source,symbol,link,date,title,content
헤럴드경제,001140,/news/news_read.nhn?article_id=0000869209&office_id=016&mode=search&query=국보&page=1,2015-10-06 10:02,"단양휴게소, 국보 홍보대사 역할 톡톡","캐릭터와 포토 존 만들어 신라적성비 홍보 도우미로 나서 한국도로공사 중앙고속도로 단양(춘천방향)휴게소가 국보인 ‘단양 신라적성비’ 홍보 도우미 역할을 톡톡히 하고 있다. 캐릭터와 포토 존을 만들며 휴게소 뒤편에 있는 국보 제198호 ‘단양 신라적성비’를 적극적으로 홍보하고 있는 것이다. 단양휴게소는 보다 많은 사람들에게 국보를 홍보하기 위해 최근 단양 신라적성비 캐릭터인 ‘적성이’를 제작, 탄생시켰다. 또 신라적성비에 나오는 역사적 인물도 캐릭터로 만들고 이를 활용한 포토 존을 조성해 관람객들로부터 큰 인기를 얻고 있다. 중앙고속도로 단양(춘천방향)휴게소가 국보를 알리기 위해 최근 휴게소 쉼터에 조성한 단양 신라적성비 캐릭터 포토존의 모습지난 9월에는 한 달간 ‘적성이와 사진 찍기’ 이벤트를 진행, 고객들에게 푸짐한 경품을 증정하면서 자연스럽게 신라적성비에 대한 관심을 이끌어냈다."
서울경제,001140,/news/news_read.nhn?article_id=0003308132&office_id=011&mode=search&query=국보&page=1,2018-05-28 15:11,"&lt;유&gt;국보, 상한가 진입.. +29.75% &uarr;","[서울경제] 오후 3시 10분 현재 국보(001140) 가 +29.75% 오른 20,500원(▲4,700)으로 장중 상한가에 진입했다. 거래대금은 40억6,364만, 거래량은 21만7,077주를 기록하고 있으며, 수급측면으로는 41(매도):59(매수)의 매수우위를 보이고 있다. 국보는 전일 하락(15,800원, ▼-1,900, -10.73%) 마감했으나, 이 시각 현재 장중 상한가를 기록하며 강세를 보이고 있다. 지난 1개월간 국보는 상한가 1회, 상승 18회, 하락 9회를 기록했고, 주가수익률은 92.49%였다. 이 기간 ' 운수창고업 ' 업종 평균 주가수익률은 -2.63%를 기록했다. 현재 ' 운수창고업 ' 총 24개 종목 중 상한가 종목은 1개, 상승 종목은 20개로, 일부 종목만이 상승세를 보이고 있다. ( 현대상선(011200) +22.45%, 동방(004140) +14.32%, KCTC(009070) +11.11%)"
파이낸셜뉴스,001140,/news/news_read.nhn?article_id=0003861025&office_id=014&mode=search&query=국보&page=1,2017-08-21 09:16,"[fnRASSI]국보디자인(066620), 52주 신고가 경신...0.6% &uarr;","국보디자인(066620)은 52주신고가를 기록하고 있어 주목할만하다. 동종목의 현재 주가는 24,950원 선에서 이루어지고 있다. 거래일을 기준으로 최근 3일간 평균 거래량은 40만 주이다. 이는 60일 일 평균 거래량 5만 주와 비교해보면 최근 거래량이 급격히 늘어났다는 것을 알 수 있다. 외국인, 기관 모두 보유량 감소 (5일 누적) 최근 5일간 동종목의 외국인 투자자는 3,835주 순매도하였고 마찬가지로 기관은 25,266주 순매도하였다. 전날 외국인 1,006주 순매수, 기관25,266주 순매도하며 보유 비율이 변동했다. 다음 표는 동종목의 외국인, 기관의 일별 순매수량을 나타낸 것이다. 상장주식수 대비 거래량은 0.87%로 적정수준 최근 한달간 국보디자인의 상장주식수 대비 거래량을 비교해보니 일별 매매회전율이 0.87%로 집계됐다. 그리고 동기간 장중 저점과 고점의 차이인 일평균 주가변동률을 3.64%를 나타내고 있다. 'fnRASSI'는 증권전문 기업 씽크풀과 파이낸셜뉴스의 협업으로 로봇기자가 실시간으로 생산하는 기사입니다."
머니투데이,001140,/news/news_read.nhn?article_id=0003644578&office_id=008&mode=search&query=국보&page=1,2016-03-09 17:22,"국보, 주당 50원 현금배당",[머니투데이 김태은 기자] 국보는 9일 주당 50원의 현금배당을 결정했다고 공시했다. 총 배당금액은 5036만원이다. textlinktopstart textlinktopend textlinkstart
헤럴드경제,001140,/news/news_read.nhn?article_id=0001094200&office_id=016&mode=search&query=국보&page=1,2016-08-03 16:25,"국보, 현저한 시황변동 관련 조회공시",[헤럴드경제=박영훈 기자] 한국거래소는 3일 국보에 현저한 시황변동에 대한 조회공시를 요구했다. 답변시한은 4일 오후 6시까지다.
서울경제,001140,/news/news_read.nhn?article_id=0003308116&office_id=011&mode=search&query=국보&page=1,2018-05-28 15:06,"&lt;유&gt;국보, 장중 신고가 돌파.. 20,000&rarr;20,200(▲200)","[서울경제] 오후 3시 4분 현재 국보(001140) 가 27.85% 오른 20,200원(▲4,400)을 기록하며, 52주 신고가를 +200원 경신했다. 기존 52주 최고가는 2018년 05월 11일 기록한 20,000원이다. 체결강도는 131%로 강세를 유지했다. 총매수체결량은 106,143주, 총매도체결량은 81,316주를 각각 기록했다.  (※ 체결강도(%) = (총매수체결량/총매도체결량)*100) 이 시각 현재 거래대금은 36억7,592만, 거래량은 19만8,064주를 기록하고 있으며, 수급측면으로는 43(매도):57(매수)의 매수우위를 보이고 있다. 거래일을 기준으로 최근 3일간 평균 거래량은 9만7천주, 60일 평균 거래량 7만7천주로 최근 거래량이 증가하는 추세다."
전자신문,001140,/news/news_read.nhn?article_id=0002729337&office_id=030&mode=search&query=국보&page=1,2018-08-01 17:10,"[ET투자뉴스][국보디자인 지분 변동] 황선응 외 5명 1.2%p 증가, 52.0...","국보디자인(066620)은 01일 주주 황선응을  비롯한 특별관계자의 보유주식이 증가되었다고 발표했다. 이는 직전 보고일보다 90,241주 증가하여 지분율은 52.03%로 상승했다. 이번 보고 사유는 특별관계자보유주식변동건보고로  알려졌다.   최대주주와 특수관계자의 지분 변동은 주가에 영향을 주는 요인이다. 특히 보유비율을 지속적으로 늘리거나 줄일 경우, 해당종목 투자시 유의할 필요가 있다.  다음은 국보디자인의 지분 변동 내역과 보유 내역이다."
전자신문,001140,/news/news_read.nhn?article_id=0002689082&office_id=030&mode=search&query=국보&page=1,2018-03-06 17:11,"[ET투자뉴스]국보, 17년4분기 실적 발표",03월 06일 국보(001140)의 2017년 4분기 연결 잠정_대량변동 실적이 발표됐다. 작년 동기 대비해서 매출액은 5.4% 하락하여 200억원을 기록했다. 영업이익은 -33.3억원으로 11억원에서 적자전환되었다. 당기순이익은 -36억원에서-5.4억원으로 적자축소되었다고 발표했다.이번분기 기준으로 추정되는 국보의 자기자본이익률(ROE)은 -11.3%로 나타났다. 전년 동기인 2016년 4분기 ROE는 -89.2%로 이번 분기에 77.9%p 상승했다. 한편 동종목의영업이익률은 -16.6%이다.최근 일년을 살펴보았을 때 영업이익률이 급락했다. 지난해 동기 영업이익률은 5.1%로 이번 4분기에 21.7%p 하락했다.주가가 1주당 순자산의 몇배인지 알려주는 주가순자산비율인 PBR은 1배이다. PBR은 최근 3분기 이상 연속으로 하락하다가 이번 분기에 상승했다. 지난해 동기 PBR은 1.41배로 이번 4분기 PBR이 하락했다.다음은 국보와 동일 업종 내 비교 그룹 종목의 각각 최근 실적의 전년 동기 대비 성장률이다. 국보의 매출액은 감소했지만 증감율은 타 종목 대비 양호한 편이다. 그리고 주가의 하락율이 가장 큰 편으로 나타났다.
머니투데이,001140,/news/news_read.nhn?article_id=0003721548&office_id=008&mode=search&query=국보&page=1,2016-08-03 16:23,"[조회공시]국보, 현저한 시황변동 관련","[머니투데이 최민지 기자] 한국거래소는 국보에 현저한 시황변동와 관련, 공시대상이 존재하는지 여부에 대해 조회공시를 요구했다고 3일 밝혔다. 공시 시한은 4일 오후 6시까지다. textlinktopstart textlinktopend textlinkstart"
연합뉴스,001140,/news/news_read.nhn?article_id=0009939398&office_id=001&mode=search&query=국보&page=1,2018-03-06 16:45,"국보, 작년 영업손실액 39억원&hellip;적자전환",(서울=연합뉴스) 전명훈 기자 = 국보는 연결재무제표 기준 작년 영업손실액이 39억원으로 전년 대비 적자 전환한 것으로 잠정 집계됐다고 6일 공시했다. 매출액은 783억원으로 10.4% 줄었고 당기순손실액은 19억원으로 적자가 지속됐다.
파이낸셜뉴스,001140,/news/news_read.nhn?article_id=0003798514&office_id=014&mode=search&query=국보&page=1,2017-04-04 14:30,"[fnRASSI]국보(001140), 52주 신저가 기록...-24.01% &darr;","국보(001140)는 당일 15,350원까지 하락하며 52주신저가를 기록했다. 동종목의 현재 주가는 전일대비 -24.01% 하락한 15,350원 선에서 이루어지고 있다. 거래일을 기준으로 최근 3일간 평균 거래량은 5만 주이다. 이는 60일 일 평균 거래량 2만 주와 비교해보면 최근 거래량이 급격히 늘어났다는 것을 알 수 있다. 상장주식수 대비 거래량은 1.03%로 적정수준 최근 한달간 국보의 상장주식수 대비 거래량을 비교해보니 일별 매매회전율이 1.03%로 집계됐다. 그리고 동기간 장중 저점과 고점의 차이인 일평균 주가변동률을 1.73%를 나타내고 있다. 외국인/개인 순매수, 기관은 순매도(한달누적)  전일 외국인이 42주를 순매도했다. 4주간을 기준으로 보면 외국인이 매수반전의 모습을 보이며 1,430주를 순매수했고, 개인들도 방향성있는 매매를 하면서 1,921주를 순매수했다. 하지만 기관은 매도 우위를 지속하면서 3,351주를 순매도했다. 'fnRASSI'는 증권전문 기업 씽크풀과 파이낸셜뉴스의 협업으로 로봇기자가 실시간으로 생산하는 기사입니다."
연합뉴스,001140,/news/news_read.nhn?article_id=0007901566&office_id=001&mode=search&query=국보&page=1,2015-10-07 13:38,원형 그대로 살린 국보 훈민정음 해례본 복간본,"(서울=연합뉴스) 이정훈 기자 = 7일 오후 서울 광화문 교보문고에 전시된 훈민정음 해례본 복간본과 해설서. 간송미술문화재단과 교보문고는 광복 70주년인 올해 한글날을 앞두고 훈민정음 해례본의 원본을 그대로 살린 복간본을 출간, 이달부터 전국 서점에서 판매한다고 밝혔다. 정가 25만원.  2015.10.6"
한국경제TV,001140,/news/news_read.nhn?article_id=0000667129&office_id=215&mode=search&query=국보&page=1,2018-07-31 11:58,"국보, 전일 대비 약 -5% 하락한 14,400원","[한국경제TV 라이온봇 기자] [그림 1] 최근 3개월 간 주가 추세 및 기간별 수익률 국보는 7월 31일 11시 57분 전일 대비 약 -5% 하락한 14,400원에 거래되고 있다. 국보는 코스피 상장 기업으로 운수창고 업종에 속해 있다. 시가총액은 254억원으로 코스피 상장기업 중 760위에 위치 해 있다. [종목 성향 진단] [그림 2] 종목 성향 진단 국보의 투자 스타일은 모호한 측면이 있으나 성장주라고 볼 수 있다. 주가 고평가 우려가 공존하지만 높은 성장성이 기대되는 기업이다. 주가 모멘텀은 부진한 편이었다. 최근 1개월 수익률은 -9.04%의 하락폭을 기록했다. 국보 종목에 대한 투자자의 관심도는 평범한 수준이었다. [투자 점수 진단] [그림 3] 투자 점수 진단 국보는 어느 측면에서 투자 매력도가 높은 종목일까? AI 인공지능 종목 분석 시스템을 이용해 성장성, 수익성, 효율성, 안전성, 저평가성, 추세 등 주가 수익률에 영향을 줄 수 있는 6가지 핵심 투자 지표를 점수화하여 종목의 투자 매력도를 계산해보았다. 그 결과 국보는 상대적으로 추세지표 측면에서 두각을 드러내고 있었다. 추세 점수는 주가의 상승 모멘텀이 어느정도 인가를 나타낸다. 국보는 특히 1주전대비수익률 측면에서 가장 높은 점수는 기록했는데, 전체 시장 내 51위를 기록하며 상위 2.5%에 위치했다. 업종별로는 25위를 기록하며 상위 6.98%에 위치했다. 그러나 재무건전성을 나타내는 기업안정성 측면에서는 아쉬운 점을 나타냈다. (위의 AI인공지능 점수는 재무 데이터를 기반으로 전체 상장 종목과 비교/분석하여 도출한 점수로 높은 점수가 반드시 높은 수익률을 보장하지 않습니다. 위의 자료는 당사의 추천 종목이 아니며, 투자 시 참고용으로 제시해드리는 것입니다. 핵심투자지표를 결합해 종목의 투자매력도를 종합 계산한 ""인공지능 투자점수""는 ""거장들의 투자공식"" 앱에서 확인하실 수 있습니다.) 라이온봇 기자 -한국경제TV※ 본 기사는 한국경제TV와 '거장들의 투자공식이'자체 개발한 '라이온봇 기자'가 실시간으로 작성한 기사입니다. 라이온봇기자"
서울경제,001140,/news/news_read.nhn?article_id=0002865602&office_id=011&mode=search&query=국보&page=1,2016-08-03 16:23,"거래소, 국보에 시황변동 관련 조회공시 요구","한국거래소 유가시장본부는 3일 국보(001140)에 현저한 시황변동에 대한 조회공시를 요구했다. 답변시한은 오는 4일 오후 6시까지다. 이날 국보는 전날 대비 가격제한폭(29.81%)까지 뛰어오른 2만7,000원에 거래를 마쳤다."
서울경제,001140,/news/news_read.nhn?article_id=0003307901&office_id=011&mode=search&query=국보&page=1,2018-05-28 12:41,"&lt;유&gt;국보, 전일 대비 15.19% 상승.. 일일회전율은 5.95% 기록","[서울경제] 국보(001140) 는 28일 오후 12시 40분 현재 15.19% 오른 18,200원에 거래되고 있으며, 49(매도):51(매수)의 매수우위를 기록하고 있다. 거래대금은 18억1,290만, 거래량은 10만14주로 거래량회전율은 5.95%로 나타났다. 지난 1개월간 국보는 상한가 1회, 상승 18회, 하락 9회를 기록했고, 주가수익률은 70.89% 표준편차는 7.30%를 기록했다. 이 기간 ' 운수창고업 ' 업종 평균 주가수익률은 -1.92%로 나타났으며, 변동성은 1.44%를 기록했다. 이 시각 현재 ' 운수창고업 '은 4.24% 상승 중이며, 66(매도):34(매수)의 매도우위를 기록하고 있다."
파이낸셜뉴스,001140,/news/news_read.nhn?article_id=0003860289&office_id=014&mode=search&query=국보&page=1,2017-08-18 10:34,[fnRASSI]국보(001140) 현재 11.96% &uarr;,"국보(001140)는 현재 주가가 전일 대비 11.96% 상승한 10,950원 선에서 거래가 이루어지고 있다. 거래비중은 개인투자자가 가장 높아 최근 한달간 주체별 거래비중을 살펴보면 개인이 97.3%, 외국인이 2.39%, 기관은 0.29%를 기록했다. 그리고 최근 5일간 거래비중은 개인이 94.89%, 외국인이 5.1%를 보였고, 기관은 거래참여가 없었다. 상장주식수 대비 거래량이 다소 높은 수준 최근 한달간 국보의 매매회전율을 분석한 결과 12일에 1번 꼴로 주식의 주인이 바뀐 것으로 나타났다. 이와 같이 회전율이 너무 높은 종목들은 투자시 주의가 필요하다. 동종목의 경우 동기간 일평균 주가변동률은 2.35%를 기록했다. 'fnRASSI'는 증권전문 기업 씽크풀과 파이낸셜뉴스의 협업으로 로봇기자가 실시간으로 생산하는 기사입니다."
머니투데이,001140,/news/news_read.nhn?article_id=0004019210&office_id=008&mode=search&query=국보&page=1,2018-03-06 16:40,"국보, 지난해 영업손실 39억원&hellip;적자전환","[머니투데이 김성은 기자] 국보는 지난해 연결 기준 영업손실액이 39억원으로 전년 대비 적자전환했다고 6일 공시했다. 같은 기간 매출액은 10.4% 감소한 783억원, 당기순손실액은 적자폭이 줄어든 19억원이다."
파이낸셜뉴스,001140,/news/news_read.nhn?article_id=0003950618&office_id=014&mode=search&query=국보&page=1,2018-01-24 10:52,"[fnRASSI]국보, 2.67% 오르며 거래량 증가","국보(001140)의 현재 거래량이 최근 5거래일 거래량의 최고치를 경신했다. 그리고 국보는 5일 연속 상승흐름을 보이며, 10시 46분 현재 2.67% 증가한 9,600원에 거래중이다. 외국인, 기관 모두 보유량 증가 (5일 누적) 최근 5일간 동종목의 외국인 투자자는 1,831주 순매수하였고 마찬가지로 기관은 1,195주 순매수하였다. 전날 두 주체 각각 790주, 1,195주 순매수하며 보유 비율을 늘렸다. 다음 표는 동종목의 외국인, 기관의 일별 순매수량을 나타낸 것이다. 외국인/기관 순매수, 개인은 순매도(한달누적)  1월19일부터 전일까지 외국인이 3거래일 연속 순매수를 보였다. 4주간을 기준으로 보면 외국인이 순매도를 기록하다가 다시 순매수로 돌아서면서 1,231주를 순매수했고, 기관도 순매수량을 늘리며 4,501주를 순매수했다. 반면 개인들은 순매도로 돌아서면서 5,732주를 순매도한 것으로 나타났다. 'fnRASSI'는 증권전문 기업 씽크풀과 파이낸셜뉴스의 협업으로 로봇기자가 실시간으로 생산하는 기사입니다."
연합뉴스,001140,/news/news_read.nhn?article_id=0007901567&office_id=001&mode=search&query=국보&page=1,2015-10-07 13:38,원형 그대로 살린 국보 훈민정음 해례본 복간본,"(서울=연합뉴스) 이정훈 기자 = 7일 오후 서울 광화문 교보문고에 전시된 훈민정음 해례본 복간본과 해설서. 간송미술문화재단과 교보문고는 광복 70주년인 올해 한글날을 앞두고 훈민정음 해례본의 원본을 그대로 살린 복간본을 출간, 이달부터 전국 서점에서 판매한다고 밝혔다. 정가 25만원.  2015.10.6"
서울경제,001140,/news/news_read.nhn?article_id=0003317174&office_id=011&mode=search&query=국보&page=1,2018-06-08 13:35,"&lt;유&gt;국보, 전일 대비 7.89% 상승.. 일일회전율은 11.46% 기록","[서울경제] 국보(001140) 는 8일 오후 1시 34분 현재 7.89% 오른 30,100원에 거래되고 있으며, 56(매도):44(매수)의 매도우위를 기록하고 있다. 거래대금은 51억8,974만, 거래량은 19만2,873주로 거래량회전율은 11.46%로 나타났다. 지난 1개월간 국보는 상한가 2회, 상승 17회, 하락 10회를 기록했고, 주가수익률은 157.26% 표준편차는 10.46%를 기록했다. 이 기간 ' 운수창고업 ' 업종 평균 주가수익률은 -7.97%로 나타났으며, 변동성은 1.51%를 기록했다. 이 시각 현재 ' 운수창고업 '은 0.48% 상승 중이며, 46(매도):54(매수)의 매수우위를 기록하고 있다."
머니투데이,001140,/news/news_read.nhn?article_id=0003850372&office_id=008&mode=search&query=국보&page=1,2017-04-03 16:49,"국보, 78억 규모 유상증자 결정","[머니투데이 송학주 기자] 국보는 운영자금 마련을 위해 주주배정후 실권주 일반공모 방식의 유상증자를 결정했다고 3일 공시했다. 신주는 65만5000주로, 예정발행가는 1만1850원. textlinktopstart textlinktopend textlinkstart"
한국경제TV,001140,/news/news_read.nhn?article_id=0000608693&office_id=215&mode=search&query=국보&page=1,2018-03-07 10:57,"국보, 전일 대비 약 -3% 하락한 10,800원","[한국경제TV 라이온봇 기자] 국보는 3월 7일 10시 56분 전일 대비 약 -3% 하락한 10,800원에 거래되고 있다. 국보는 코스피 상장 기업으로 운수창고 업종에 속해 있다. 시가총액은 187억원으로 코스피 상장기업 중 760위에 위치 해 있다. [종목 성향 진단] [그림 1] 종목 성향 진단 국보의 투자 스타일은 성장주에 가깝다. 주가 고평가 우려가 공존하지만 높은 성장성이 기대되는 기업이다. 주가 모멘텀은 좋은 편에 속했다. 최근 3개월 수익률은 12.63%의 상승폭을 기록했다. 최근 1개월 수익률 또한 12.06% 상승하며 좋은 모멘텀을 보이고 있다. 국보 종목에 대한 투자자의 관심도는 상대적으로 낮은 편이었다. [투자 점수 진단] [그림 2] 투자 점수 진단 국보는 저평가성2(PBR) 측면에서 두각을 나타내고 있다. 최근 PBR은 66점으로 6개의 핵심 팩터 중 가장 높은 점수를 기록했다. PBR은  전체 시장 내 637위를 기록하며 상위 34.14%에 위치했다. 업종별로는 160위를 기록하며 상위 48.18%에 위치했다. 그러나 PER과 부채비율은  아쉬움을 나타냈다. [종합 투자점수] [그림 3] 종합 투자점수 AI 인공지능 분석을 통한 국보의 종목 종합 스코어는 22점을 기록했다. 이는 동일 업종 평균점수인 58점과 시장 평균점수인 56점를 하회하는 수치였다. (위의 AI인공지능 점수는 재무 데이터를 기반으로 전체 상장 종목과 비교/분석하여 도출한 점수로 높은 점수가 반드시 높은 수익률을 보장하지 않습니다. 위의 자료는 당사의 추천 종목이 아니며, 투자 시 참고용으로 제시해드리는 것입니다.) 라이온봇 기자 -한국경제TV※ 본 기사는 한국경제TV와 '거장들의 투자공식이'자체 개발한 '라이온봇 기자'가 실시간으로 작성한 기사입니다. 라이온봇기자 ⓒ 한국경제TV, 무단 전재 및 재배포 금지 한국경제TV 관련뉴스해당 언론사에서 선정하며 언론사 페이지(아웃링크)로 이동해 볼 수 있습니다.이상호 2억원, 여자컬링 0원…경기단체 포상금 '천차만별'이하늬 ""살찌면 외삼촌""…문희상 의원과 닮은꼴 '깜짝'전현무♥한혜진 열애, 티격태격 하다가 정 들었다스텔라 해체, 선정성 논란 부담됐나 ""갓 스무살에...""이윤미, 주영훈 몰카논란 사과 ""많이 생각하고 반성"""
파이낸셜뉴스,001140,/news/news_read.nhn?article_id=0004033788&office_id=014&mode=search&query=국보&page=1,2018-06-04 15:37,"[fnRASSI]장마감, 거래소 상승 종목(국보 30%&uarr;)","4일 코스피는 전일 대비 8.8p 상승한 2447.76에 거래를 마감했다. 당일 상승한 종목의 수는 433개, 하락 407개, 보합 43개이다. 상승한 종목으로 국보(001140) 30%, 웰바이오텍(010600) 30%, 동방(004140) 21.04% 등이 있다. 'fnRASSI'는 증권전문 기업 씽크풀과 파이낸셜뉴스의 협업으로 로봇기자가 실시간으로 생산하는 기사입니다."
연합뉴스,001140,/news/news_read.nhn?article_id=0007901568&office_id=001&mode=search&query=국보&page=1,2015-10-07 13:38,국보 훈민정음 해례본 복간본 전시,"(서울=연합뉴스) 이정훈 기자 = 7일 오후 서울 광화문 교보문고에 전시된 훈민정음 해례본 복간본과 해설서. 간송미술문화재단과 교보문고는 광복 70주년인 올해 한글날을 앞두고 훈민정음 해례본의 원본을 그대로 살린 복간본을 출간, 이달부터 전국 서점에서 판매한다고 밝혔다. 정가 25만원.  2015.10.6"
채널A,001140,/news/news_read.nhn?article_id=0000085586&office_id=449&mode=search&query=국보&page=1,2016-01-28 15:07,삼성가 보물창고 대방출&hellip;국보 등 121점,"삼성가 보물창고 대방출…국보 등 121점 9분기 연속 종편 1위! 채널A 시청자 만족도 A+ ⓒCHANNEL A(www.ichannela.com), 무단 전재 및 재배포 금지 채널A 관련뉴스해당 언론사에서 선정하며 언론사 페이지(아웃링크)로 이동해 볼 수 있습니다.인기 신혼여행지에 '소두증' 바이러스 확산""롱다리로 기네스""…한영, 다리 112cm 화제""10만 원 중국폰 사자""…자판기 앞 '바글바글'한파 물러가자 흉기로 돌변한 고드름""6월에 혼인신고"" 박희순-박예진 이미 부부?"
이데일리,001140,/news/news_read.nhn?article_id=0003789802&office_id=018&mode=search&query=국보&page=1,2017-04-04 09:17,"[특징주]국보, 대규모 유상증자 소식에 '급락'","[이데일리 정수영 기자] 국보(001140)가 대규모 유상증자 소식에 4일 장 초반 급락세다. 이날 오전 9시15분 현재 유가증권시장에서 국보는 전날보다 20.54% 내린 1만6050원에 거래되고 있다. 개장과 동시에 급락해 실시간 거래를 제한하는 정적 변동성완화장치(vi)가 발동되기도 했다. 국보는 운영자금 77억6000만원을 마련을 위해 주주배정후 실권주 일반공모 방식의 유상증자를 결정했다고 3일 공시했다. 새로 발행하는 주식은 보통주 65만5000주, 신주 예정발행가는 주당 1만1850원이다."
