source,symbol,link,date,title,content
뉴시스,001140,/news/news_read.nhn?article_id=0007761771&office_id=003&mode=search&query=국보&page=1,2017-02-09 18:19,"국보디자인, 주당 250원 현금배당 결정",【서울=뉴시스】김주아 기자 = 실내건축 공사업체 국보디자인(066620)은 보통주 1주당 250원의 현금배당을 결정했다고 9일 공시했다. 시가배당률은 1.5%다. 배당금 총액은 18억7500만원이다.
헤럴드경제,001140,/news/news_read.nhn?article_id=0001012707&office_id=016&mode=search&query=국보&page=1,2016-03-14 16:39,"&lt;생생코스피&gt;국보, 현저한 시황변동 관련 조회공시",한국거래소는 14일 국보에 현저한 시황변동에 대한 조회공시를 요구했다. 답변시한은 15일 오후 6시까지다.
머니투데이,001140,/news/news_read.nhn?article_id=0004059691&office_id=008&mode=search&query=국보&page=1,2018-06-01 17:30,"국보, 42.5억원에 부산 남천동 토지 및 건물 매입",[머니투데이 주명호 기자] 국보는 부산지점 사무실 이전을 위해 부산광역시 수영구 남천동 7-4 토지 및 건물을 42억5000만원에 매입한다고 1일 공시했다. 취득예정일은 7월 6일이다.
머니투데이,001140,/news/news_read.nhn?article_id=0003725483&office_id=008&mode=search&query=국보&page=1,2016-08-11 12:49,이주열 &quot;기축통화국보다 금리 높아야&hellip;실효하한 가까워져&quot;,"[머니투데이 유엄식 기자, 최동수 기자] [(종합)가계대출 증가세 꺾이지 않고 있어 감독당국과 대응책 마련할 것] 이주열 한국은행 총재가 11일 오전 서울 중구 한국은행에서 열린 금융통화위원회 본회의를 주재하고 있다. /사진=김창현 기자 이주열 한국은행 총재가 향후 추가 금리인하에 매우 신중한 입장을 밝혔다. 현행 1.25% 기준금리 수준을 고려할 때 점차 실효하한선에 가까워지고 있다고 평가했다. 이 총재는 11일 8월 금융통화위원회 금리동결 결정 이후 기자회견에서 “소규모개방경제인 우리나라는 자본유출 우려 등을 고려할 때 아무래도 기축통화국보다 금리가 높아야한다”고 말했다. 그는 특히 7년 만에 금리를 0.25%로 내린 영국 사례를 언급하면서 “영란은행(BOE)이 밝힌 실효금리 하한은 0%보다는 다소 높은 수준”이라며 “그렇다면 우리나라 정책금리 실효하한이 어느 정도인지는 참고할 수 있을 것”이라고 말했다. 이 총재는 내외 금리차를 고려할 때 통화정책 여력이 소진된 것 아니냐는 지적에는 “그렇지 않다고 본다”며 “경제여건을 고려할 때 선진국과 같은 제로금리나 큰 폭의 양적완화를 고려할 단계는 아니다”라고 답변했다. 이 총재는 최근 가계부채 증가세에 대해서도 우려를 나타냈다. 그는 “올 들어 가계부채는 은행 집단대출 뿐만 아니라 비은행권도 높은 증가세를 보이고 있다”며 “감독당국이 여신심사 선진화방안 등 다각도의 대책을 시행 중이나 성과가 아직 나타나지 않고 있다”고 지적했다. 이어 “집단대출은 이미 승인된 물량으로 어느 정도의 증가세를 감안하더라도 신규 대출 증가세가 예상보다 높은 것에 대해 감독당국과 문제의식을 공유하고 있다”며 “필요할 경우 추가적인 대응책을 강구할 것”이라고 강조했다. 이 총재는 최근 원화 강세 현상과 관련해선 “글로벌 유동성 확대에 따른 투자심리 개선 영향”이라며 “해외에서 우리나라 경제 펀더멘털이 양호하다고 대외건전성이 좋다고 평가해 자금이 큰 폭으로 유입되면서 환율에 상당한 영향을 주고 있다”고 평가했다. 그는 원화 강세로 수출에 부정적 영향이 우려된다는 지적에 대해선 “부담이 될 수 있으나 과거보다 원화 강세가 수출에 미치는 영향은 약화됐다”고 답변했다. 다만 향후 물가에 하락압력으로 작용할 가능성은 인정했다. 이 총재는 사드(THAAD·고고도미사일방어체계) 배치에 따른 경제적 영향과 관련 “발표 이후 중국계 자금 유출에는 특별한 변화가 없다”면서 “다만 분업체계에 따른 효율성을 고려하면 긴밀한 교역관계를 유지하는 것이 양국 모두에 바람직하다”고 말했다. 미국 등의 보호무역주의 강화기조와 관련해선 “주요국들이 자국 산업 보호위해 보호무역주의 강화되는게 사실이고 최근 철강제품 관세율 인상도 이런 흐름과 무관치 않다”며 “이를 고려해 G20 재무장관·중앙은행 총재 회의에서 보호무역주의를 배격한다는 내용이 선언문에 담겼다”고 말했다. 이 총재는 저금리 정책이 소비나 투자를 기대만큼 높이지 못하고 있다는 지적에 대해선 “어느나라를 막론하고 소비와 투자의 진작효과가 기대만큼 크지 않았으나 그렇다고 금리정책 효과가 아예 없다고 할 수 없다”며 “금리정책 효과가 제대로 나타나지 못한 원인에 대한 분석이 다각도로 진행될 필요가 있다”고 답변했다. 이 총재는 미국 연내 금리인상에 따른 자본유출입 우려에 대해 “미국 금리인상만 보면 자본유출을 증가시키는 요인이나 이외에도 국내경기, 주요국 통화정책 등 다른 요인의 영향도 많이 받는다”고 답했다. 또 소비자물가상승률이 중기물가안정목표치인 2%를 벗어나 추가적인 완화정책이 필요하지 않느냐는 질문에는 “6~7개월 목표치보다 낮다고 곧바로 통화정책으로 대응할 것은 아니다”라고 했다. 한편 이날 한은 금통위는 1.25% 기준금리를 동결했다. 지난 6월 금리인하(1.50%→1.25%) 이후 2개월 연속 동결기조를 이어갔다. 금리동결은 금통위원 만장일치로 결론났다. 시장이 기대했던 금리인하 소수의견은 나오지 않았다. textlinktopstart textlinktopend textlinkstart"
서울경제,001140,/news/news_read.nhn?article_id=0003320765&office_id=011&mode=search&query=국보&page=1,2018-06-12 14:25,"&lt;코&gt;국보디자인, 전일 대비 7.14% 상승.. 일일회전율은 1.35% 기록","[서울경제] 국보디자인(066620) 은 12일 오후 2시 24분 현재 7.14% 오른 22,500원에 거래되고 있으며, 38(매도):62(매수)의 매수우위를 기록하고 있다. 거래대금은 22억2,973만, 거래량은 10만1,435주로 거래량회전율은 1.35%로 나타났다. 지난 1개월간 국보디자인은 상승 16회, 하락 11회를 기록했고, 주가수익률은 12.22% 표준편차는 2.01%를 기록했다. 이 기간 ' 건설업 ' 업종 평균 주가수익률은 3.41%로 나타났으며, 변동성은 3.44%를 기록했다. 이 시각 현재 ' 건설업 '은 1.83% 상승 중이며, 77(매도):23(매수)의 매도우위를 기록하고 있다."
파이낸셜뉴스,001140,/news/news_read.nhn?article_id=0003856276&office_id=014&mode=search&query=국보&page=1,2017-08-09 11:05,"[fnRASSI]국보디자인, 52주 신고가...1.9% &uarr;","국보디자인(066620)은 52주신고가를 기록하고 있어 주목할만하다. 동종목의 현재 주가는 21,400원 선에서 이루어지고 있다. 거래일을 기준으로 최근 3일간 평균 거래량은 7만 주이다. 이는 60일 일 평균 거래량 5만 주와 비교해보면 최근 거래량이 다소 증가했다는 것을 알 수 있다. 퀀트 재무분석, 종합점수 78점으로 상승                    지표               항목               값               종합점수                 성장성               매출액증가율               0.13               8.42                 자기자본증가율               0.08                 안정성               부채비율               80.98               9.86                 유동비율               194.55                 이익안정성               10                 수익성               ROA               7.61               7.32                 ROE               13.77                 영업이익율               5.75          국보디자인의 퀀트 재무 점수는 25.6점으로 3개월 이전 22.7점보다 올랐다. 지난 분기에 비해 성장성 점수가 상승했다. 이는 매출액 증가율과 자기자본 증가율이 증가하였기 때문이다. 안정성 종합 점수는 부채비율 증가, 유동비율 감소로 하락했다. 수익성 측면에서 볼때 ROA, ROE, 영업이익률 모두 개선되어 이전보다 좋은 점수를 받았다. 기관투자자의 거래참여 높아, 거래비중 17.48% 최근 한달간 주체별 거래비중을 살펴보면 개인이 전체 거래량의 73.02%를 차지하며 가장 활발한 참여를 보였고, 기관은 17.48%, 외국인은 9.48%의 거래 참여율을 보였다. 그리고 최근 5일간 거래비중은 개인이 전체 거래량의 73.01%를 차지하며 가장 활발한 참여를 보였고, 기관은 15.35%, 외국인은 11.62%의 거래 참여율을 보였다. 'fnRASSI'는 증권전문 기업 씽크풀과 파이낸셜뉴스의 협업으로 로봇기자가 실시간으로 생산하는 기사입니다."
파이낸셜뉴스,001140,/news/news_read.nhn?article_id=0004064978&office_id=014&mode=search&query=국보&page=1,2018-07-26 13:04,[fnRASSI]국보(001140) 전일대비 9.7% 상승,"현재 국보(001140)는 전일대비 9.7% 상승하여 14,700원 선에서 거래가 이루어지고 있다.                   지표               항목               값               종합점수                 성장성               매출액증가율               -0.08               2.49                 자기자본증가율               -0.15                 안정성               부채비율               322.79               2.36                 유동비율               38.95                 이익안정성               4.72                 수익성               ROA               -3.73               1.49                 ROE               -15.76                 영업이익율               -4.57          국보의 퀀트 재무 점수는 6.34점으로 지난 분기에 비해 성장성 점수가 하락했다. 이는 자기자본 증가율이 감소하였기 때문이다. 실적 안정성이 개선되어 안정성 종합 점수는 상승했다. 수익성 측면에서 볼때 영업이익률이 개선되어 이전보다 좋은 점수를 받았다. 외국인/기관 순매수, 개인은 순매도(한달누적)  7월19일부터 전일까지 기관이 5거래일 연속 동종목을 사들였다. 4주간을 기준으로 보면 외국인이 80,560주를 순매수했고, 기관도 매수반전의 모습을 보이며 6,886주를 순매수했다. 반면 개인들은 매도 우위를 지속하면서 87,446주를 순매도한 것으로 나타났다. 'fnRASSI'는 증권전문 기업 씽크풀과 파이낸셜뉴스의 협업으로 로봇기자가 실시간으로 생산하는 기사입니다."
뉴시스,001140,/news/news_read.nhn?article_id=0007098838&office_id=003&mode=search&query=국보&page=1,2016-03-15 16:07,"국보, &quot;시황변동에 영향을 미칠만한 사항 없어&quot;","【서울=뉴시스】일반 화물차 운송업체 국보(001140)는 지난 14일 한국거래소의 조회공시 요구에 ""발행주권의 최근 현저한 시황변동(주가급등)에 영향을 미칠만한 사항으로서 현재 진행 중이거나 중요한 공시대상이 없다""고 15일 답변했다. ★ 세상에 이런일이 -  기혼녀 45%는 불륜?…´허위사실 유포´ 블로거 3년형 선고 ★ 오늘의 핫 포토 -  ´카라´ 출신 강지영 솔로 데뷔…확 달라진 분위기"
파이낸셜뉴스,001140,/news/news_read.nhn?article_id=0003849099&office_id=014&mode=search&query=국보&page=1,2017-07-25 11:23,"[fnRASSI]국보디자인(066620), 52주 신고가...0.75% &uarr;","국보디자인(066620)은 52주신고가를 기록하고 있어 주목할만하다. 동종목의 현재 주가는 20,100원 선에서 이루어지고 있다. 거래일을 기준으로 최근 3일간 평균 거래량은 7만 주이다. 이는 60일 일 평균 거래량 5만 주와 비교해보면 최근 거래량이 다소 증가했다는 것을 알 수 있다. 외국인/기관 순매수, 개인은 순매도(한달누적)  7월4일부터 기관이 15거래일 연속 순매수 행진을 벌이고 있다. 4주간을 기준으로 보면 외국인이 매매관점을 매도에서 매수로 전환하면서 29,348주를 순매수했고, 기관도 순매도를 기록하다가 다시 순매수로 돌아서면서 39,087주를 순매수했다. 반면 개인들은 매도 우위로 반전되면서 68,435주를 순매도한 것으로 나타났다. 상장주식수 대비 거래량은 0.63%로 적정수준 최근 한달간 국보디자인의 상장주식수 대비 거래량을 비교해보니 일별 매매회전율이 0.63%로 집계됐다. 그리고 동기간 장중 저점과 고점의 차이인 일평균 주가변동률을 3.04%를 나타내고 있다. 'fnRASSI'는 증권전문 기업 씽크풀과 파이낸셜뉴스의 협업으로 로봇기자가 실시간으로 생산하는 기사입니다."
뉴시스,001140,/news/news_read.nhn?article_id=0008520327&office_id=003&mode=search&query=국보&page=1,2018-04-02 08:42,국보디자인 &quot;50억 규모 ICC 중재 신청 반소 제기돼&quot;,"【서울=뉴시스】장서우 기자 = 코스닥 상장 실내 건축 및 건축 마무리 공사업체 국보디자인(066620)은 Astana Property Management LLP가 국제상공회의소(ICC) 산하 국제중재원에 자사가 제기한 215억원 규모의 대금을 청구하는 국제 중재 신청에 대한 반소를 제기했다고 2일 공시했다. 청구금액은 49억6436만원으로 이는 2016년 연결 재무제표 기준 자기자본의 5.7%다. 회사 측은 ""계약과 관련한 대금 청구에 대해 법무법인 율촌을 소송대리인으로 선임해 중재 신청에 적극 대응할 예정""이라고 밝혔다."
파이낸셜뉴스,001140,/news/news_read.nhn?article_id=0003856805&office_id=014&mode=search&query=국보&page=1,2017-08-10 10:02,"[fnRASSI]국보디자인(066620), 52주 신고가...1.38% &uarr;","국보디자인(066620)은 52주신고가를 기록하고 있어 주목할만하다. 동종목의 현재 주가는 22,100원 선에서 이루어지고 있다. 거래일을 기준으로 최근 3일간 평균 거래량은 11만 주이다. 이는 60일 일 평균 거래량 5만 주와 비교해보면 최근 거래량이 급격히 늘어났다는 것을 알 수 있다. 퀀트 재무분석, 종합점수 77점으로 상승                    지표               항목               값               종합점수                 성장성               매출액증가율               0.13               8.42                 자기자본증가율               0.08                 안정성               부채비율               80.98               9.86                 유동비율               194.55                 이익안정성               10                 수익성               ROA               7.61               7.32                 ROE               13.77                 영업이익율               5.75          국보디자인의 퀀트 재무 점수는 25.6점으로 3개월 이전 22.71점보다 올랐다. 지난 분기에 비해 성장성 점수가 상승했다. 이는 매출액 증가율과 자기자본 증가율이 증가하였기 때문이다. 안정성 종합 점수는 부채비율 증가, 유동비율 감소로 하락했다. 수익성 측면에서 볼때 ROA, ROE, 영업이익률 모두 개선되어 이전보다 좋은 점수를 받았다. 외국인 보유량 증가, 기관 감소 (5일 누적) 최근 5일간 동종목의 외국인 투자자는 19,818주 순매수하였고 반면 기관은 5,903주 순매도하였다. 전날 외국인 13,193주 순매수, 기관5,903주 순매도하며 보유 비율이 변동했다. 다음 표는 동종목의 외국인, 기관의 일별 순매수량을 나타낸 것이다. 'fnRASSI'는 증권전문 기업 씽크풀과 파이낸셜뉴스의 협업으로 로봇기자가 실시간으로 생산하는 기사입니다."
파이낸셜뉴스,001140,/news/news_read.nhn?article_id=0003848389&office_id=014&mode=search&query=국보&page=1,2017-07-24 10:00,"[fnRASSI]국보디자인, 52주 신고가...1.54% &uarr;","국보디자인(066620)은 52주신고가를 기록하고 있어 주목할만하다. 동종목의 현재 주가는 19,800원 선에서 이루어지고 있다. 거래일을 기준으로 최근 3일간 평균 거래량은 5만 주이다. 이는 60일 일 평균 거래량 5만 주와 비교해보면 최근 거래량이 약간 증가했지만 크게 벗어나지는 않았다. 퀀트 재무분석, 종합점수 82점으로 상승                    지표               항목               값               종합점수                 성장성               매출액증가율               0.13               8.42                 자기자본증가율               0.08                 안정성               부채비율               80.98               9.86                 유동비율               194.55                 이익안정성               10                 수익성               ROA               7.61               7.32                 ROE               13.77                 영업이익율               5.75          국보디자인의 퀀트 재무 점수는 25.6점으로 3개월 이전 22.68점보다 올랐다. 지난 분기에 비해 성장성 점수가 상승했다. 이는 매출액 증가율과 자기자본 증가율이 증가하였기 때문이다. 안정성 종합 점수는 부채비율 증가, 유동비율 감소로 하락했다. 수익성 측면에서 볼때 ROA, ROE, 영업이익률 모두 개선되어 이전보다 좋은 점수를 받았다. 상장주식수 대비 거래량은 0.63%로 적정수준 최근 한달간 국보디자인의 상장주식수 대비 거래량을 비교해보니 일별 매매회전율이 0.63%로 집계됐다. 그리고 동기간 장중 저점과 고점의 차이인 일평균 주가변동률을 3.33%를 나타내고 있다. 'fnRASSI'는 증권전문 기업 씽크풀과 파이낸셜뉴스의 협업으로 로봇기자가 실시간으로 생산하는 기사입니다."
아시아경제,001140,/news/news_read.nhn?article_id=0004250453&office_id=277&mode=search&query=국보&page=1,2018-06-01 19:47,"국보, 부산 남천동 토지&middot;건물 42억5000만원에 취득",[아시아경제 서소정 기자]국보는 부산지점 사무실 이전을 위해 부산 수영구 남천동 7-4 토지와 건물을 42억5000만원에 취득하기로 했다고 1일 공시했다.
서울경제,001140,/news/news_read.nhn?article_id=0002807836&office_id=011&mode=search&query=국보&page=1,2016-03-14 22:11,"[기업공시] 국보, 현저한 시황변동에 대한 조회공시 요구 外","▲국보=현저한 시황변동에 대한 조회공시 요구 받아 ▲신일산업=마일즈스톤인베스트먼트 외 1인이 주주총회 의안상정 가처분 신청 제기 ▲GS건설=철산주공 10·11단지 주택재건축정비사업 시공자 선정 ▲이수페타시스=안영균 사외이사 중도퇴임 결정 ▲자화전자=김상면·류영대 각자 대표체제로 변경 ▲동원=70억원 규모 제3자 배정 유상증자, 90억원 규모 사모 전환사채 발행 ▲디아이씨=500억원 규모 사모 전환사채 발행 ▲동부제철=제2차 채권금융기관협의회에서 2,000억원 규모 출자전환 안건 의결 ▲보통주 1주당 현금배당=엔피씨 75원, 동일제강 20원, 동양 100원 ▲성호전자=자기주식 1만7,000주 처분 ▲포스코켐텍=이영훈 대표이사 체제로 변경 ▲스포츠서울=최근 현저한 시황 변동 관련 조회공시 요구 받아 ▲신양=보통주 5대1 감자 ▲멜파스=30억원 규모 자기주식 취득 신탁계약 해지 ▲한일네트웍스=20억원 규모 자기주식 취득 신탁계약 해지 ▲엠에스오토텍=해외 계열회사에 178억원 출자 ▲이그잭스=45억원 규모 사모 전환사채 발행 ▲팬엔터테인먼트=10억원 규모 제3자 배정 유상증자 ▲세븐스타웍스=80억원 규모 제3자 배정 유상증자 ▲청담러닝=자기주식 1만2,000주 처분 ▲한국토지신탁=정기 주주총회에서 유가증권시장으로의 이전 상장 위해 코스닥 시장 상장 폐지 안건을 상정하기로 결정 [ⓒ 한국미디어네트워크, 무단 전재 및 재배포 금지] 서울경제 관련뉴스해당 언론사에서 선정하며 언론사 페이지(아웃링크)로 이동해 볼 수 있습니다.은퇴 앞둔 70대 사장님의 말 못할 고민박지원 ""친노 당하는데 文 안 나서…""""北 자체 로켓 쏘지만… 한국이 곧 추월""'방치땐 영등포도 슬럼화' 심각한 우려구글 뺨치는 한국 기술로 대박 노린다"
한국경제,001140,/news/news_read.nhn?article_id=0003700161&office_id=015&mode=search&query=국보&page=1,2016-12-15 00:51,[유가증권 기업공시] (14일) 국보 등,▲국보=자기주식 2만주 처분 결정. ▲네이버=네이버랩스에 1200억원 출자. ▲동국제강=500억원 사모 CB 발행 결정. ▲동원금속=개인투자자 손명완 4만257주 추가 매수. ▲태영건설=한국도로공사로부터 2261억원 규모 공사 수주. ▲한화테크윈=롤스로이스에 3559억원어치 항공기 엔진부품 공급 계약. ▲현대중공업=셰브론과의 2조1570억원 규모 공사수주계약 해지. [
연합뉴스,001140,/news/news_read.nhn?article_id=0010123181&office_id=001&mode=search&query=국보&page=1,2018-06-01 17:26,"국보, 부산 남천동 토지&middot;건물 42억5천만원에 취득",(서울=연합뉴스) 김아람 기자 = 국보는 부산지점 사무실 이전을 목적으로 부산 수영구 남천동 토지와 건물을 42억5천만원에 취득하기로 했다고 1일 공시했다. 이는 자산 총액의 5.80% 규모다. 거래 상대는 정모씨다.
연합뉴스,001140,/news/news_read.nhn?article_id=0008605209&office_id=001&mode=search&query=국보&page=1,2016-08-11 11:36,"이주열 &quot;기준금리 실효하한, 기축통화국보다 높아야&quot;(속보)","연합뉴스 관련뉴스해당 언론사에서 선정하며 언론사 페이지(아웃링크)로 이동해 볼 수 있습니다.3살 아이 사망원인 '익사' 유력…살인 고의성 입증 주목'쓰레기 집' 4남매 양육 해법은?…친부모 VS 기관 위탁""트럼프 얼굴 좀 봅시다"" 흡착기로 트럼프타워 기어오른 美남성'뚱보' 멕시코 올림픽 女체조선수 선전에도 몸집 논란'성전환하고 싶은데 돈이 없어…' 대포통장 만든 20대 입건"
파이낸셜뉴스,001140,/news/news_read.nhn?article_id=0003617207&office_id=014&mode=search&query=국보&page=1,2016-03-14 16:34,"[공시]국보, 최근 급등 관련 조회공시",한국거래소 유가증권시장본부는 14일 국보에 현저한 시황변동과 관련한 공시규정상 공시대상이 존재하는지 여부를 알려달라며 조회공시를 요구했다.
파이낸셜뉴스,001140,/news/news_read.nhn?article_id=0003853774&office_id=014&mode=search&query=국보&page=1,2017-08-03 11:37,"[fnRASSI]국보디자인, 52주 신고가...1.26% &uarr;","국보디자인(066620)은 52주신고가를 기록하고 있어 주목할만하다. 동종목의 현재 주가는 20,150원 선에서 이루어지고 있다. 거래일을 기준으로 최근 3일간 평균 거래량은 2만 주이다. 이는 60일 일 평균 거래량 5만 주와 비교해보면 최근 거래량이 급격히 줄어들었다는 것을 알 수 있다. 퀀트 재무분석, 종합점수 80점으로 상승                    지표               항목               값               종합점수                 성장성               매출액증가율               0.13               8.42                 자기자본증가율               0.08                 안정성               부채비율               80.98               9.86                 유동비율               194.55                 이익안정성               10                 수익성               ROA               7.61               7.32                 ROE               13.77                 영업이익율               5.75          국보디자인의 퀀트 재무 점수는 25.6점으로 3개월 이전 22.68점보다 올랐다. 지난 분기에 비해 성장성 점수가 상승했다. 이는 매출액 증가율과 자기자본 증가율이 증가하였기 때문이다. 안정성 종합 점수는 부채비율 증가, 유동비율 감소로 하락했다. 수익성 측면에서 볼때 ROA, ROE, 영업이익률 모두 개선되어 이전보다 좋은 점수를 받았다. 기관투자자 연속 0일 순매도 최근 5일간 동종목의 외국인 투자자는 5,224주 순매수하였고 마찬가지로 기관은 732주 순매수하였다. 전날 외국인 1,423주 순매도, 기관732주 순매수하며 보유 비율이 변동했다. 다음 표는 동종목의 외국인, 기관의 일별 순매수량을 나타낸 것이다. 'fnRASSI'는 증권전문 기업 씽크풀과 파이낸셜뉴스의 협업으로 로봇기자가 실시간으로 생산하는 기사입니다."
