source,symbol,link,date,title,content
전자신문,002350,/news/news_read.nhn?article_id=0002592543&office_id=030&mode=search&query=넥센타이어&page=30,2017-03-16 08:30,"[ET투자뉴스]넥센타이어, &quot;업황 변곡점에서의 &hellip;&quot; 매수(유지)-한국투자증권","한국투자증권에서 16일 넥센타이어(002350)에 대해 ""업황 변곡점에서의 마진 축소""라며 투자의견을 '매수(유지)'로 제시하였고, 아울러 목표주가로는 17,500원을 내놓았다. 한국투자증권 김진우, 박성준 애널리스트가 동종목에 대하여 이번에 제시한 '매수(유지)'의견은 한국투자증권의 직전 매매의견과 동일한 것이고 전년도말의 매매의견을 기준으로  볼때도 역시 '매수'의견이 계속 유지되고 있는 상태이다. 그리고 최근 분기내 발표된 전체 증권사 리포트의 컨센서스와 비교를 해볼 경우에 오늘 발표된 투자의견은 전체의견을 소폭 상회하는 수준으로 평가되는데, 이는 동종목에 대한 기대감을 보다 공격적으로 표현한 것으로 분석되고 있다. 목표주가의 추이를 살펴보면 최근 장기간 목표가가 같은 수준에 머물고 있는 모습이다. 또한 전일 종가 기준으로 볼때 동종목의 현주가는 이번에 제시된 목표가 대비 28.7%의 저평가 요인이 존재한다는 해석이 제시되고 있다."
전자신문,002350,/news/news_read.nhn?article_id=0002545635&office_id=030&mode=search&query=넥센타이어&page=38,2016-11-04 09:09,"[로봇뉴스]넥센타이어, &quot;16년에 넘어야 할&hellip;&quot; 매수-KTB투자증권","KTB투자증권에서 4일 넥센타이어(002350)에 대해 ""16년에 넘어야 할 가장 높은 언덕""라며 투자의견을 '매수'로 제시하였고, 아울러 목표주가로는 17,000원을 내놓았다. KTB투자증권 문용권 애널리스트가 동종목에 대하여 이번에 제시한 '매수'의견은 KTB투자증권에서 8개월만에 매매의견을 새롭게 조정하는 것으로 직전 매매의견인 'HOLD'에서 한단계 상승한 것이다. 그리고 최근 분기내 발표된 전체 증권사 리포트의 컨센서스와 비교를 해볼 경우에 오늘 발표된 투자의견은 전체의견에 수렴하고 있어, 이번 의견은 시장의 평균적인 기대감이 객관적으로 표현된 것으로 분석되고 있다. 또한 전일 종가 기준으로 볼때 동종목의 현주가는 이번에 제시된 목표가 대비 24.5%의 저평가 요인이 존재한다는 해석이 제시되고 있다."
전자신문,002350,/news/news_read.nhn?article_id=0002545623&office_id=030&mode=search&query=넥센타이어&page=38,2016-11-04 08:42,"[로봇뉴스]넥센타이어, &quot;Mix 개선 지속&hellip;&quot; 매수-하나금융투자","하나금융투자에서 4일 넥센타이어(002350)에 대해 ""Mix 개선 지속""라며 투자의견을 '매수'로 제시하였다. 아울러 12개월 목표주가를 17,000원으로 내놓았다. 하나금융투자 송선재, 신동하 애널리스트가 동종목에 대하여 이번에 제시한 '매수'의견은 하나금융투자의 직전 매매의견에서 큰 변화없이 그대로 유지되는 것이고  올해 초반의 매매의견을 기준으로  볼때도 역시 '매수'의견이 계속 유지되고 있는 상태이다. 그리고 최근 분기내 발표된 전체 증권사 리포트의 컨센서스와 비교를 해볼 경우에 오늘 발표된 투자의견은 전체의견 대비해서 조금더 긍정적인 수준으로 평가되는데,  이는 동종목에 대한 기대감을 강하게 표현한 것으로 분석되고 있다. 한편 12개월 목표주가로 제시한 17,000원은 직전에 발표된 목표가와 대비해서 큰 변화는 없고, 목표주가의 추이를 살펴보면 최근 장기간 목표가가 같은 수준에 머물고 있는 모습이다. 또한 전일 종가 기준으로 볼때 동종목의 현주가는 이번에 제시된 목표가 대비 24.5%의 추가상승여력이 있다는 해석이 제시되고 있다."
머니투데이,002350,/news/news_read.nhn?article_id=0003768212&office_id=008&mode=search&query=넥센타이어&page=38,2016-11-04 08:01,"넥센타이어, 하반기 영업이익률 12~13%대 유지-현대","[머니투데이 구유나 기자] 4일 현대증권은 넥센타이어가 제품 믹스 개선과 유럽, 중국 등 주요 시장 판매 호조에 힘입어 하반기 높은 수익성을 유지할 것이라고 전망했다. 투자의견은 '매수', 목표주가는 1만7000원을 유지했다. 채희근 현대증권 연구원은 ""넥센타이어의 3분기 매출액은 전년 동기 수준인 4720억원, 영업이익은 26.5% 오른 650억원, 영업이익률은 13.9%로 기대치를 상회하는 호실적을 기록했다""며 ""이는 UHPT(초고성능타이어)와 SUV(스포츠유틸리티차량) 타이어 등 믹스 개선과 주요 시장 호조에 기인한다""고 판단했다. 넥센타이어 측에 따르면 유럽 중위권 업체들이 품질 개선에 나서면서 가격 경쟁력에 따른 제품 선호가 증가했다는 설명이다. 중국에서도 꾸준한 믹스 개선 수요가 잇따르면서 OE(신차용타이어) 시장이 급증하고 있다. 4분기에는 원재료비 상승과 캐파(생산능력) 성장 한계로 높은 성장은 힘들지만 영업이익률이 12~13%대를 유지할 것으로 봤다. 채 연구원은 ""구조적인 요인과 더불어 TBR(트럭·버스용타이어), UHPT, SUV 타이어 시장에서의 점유율 확대를 통한 성장이 이뤄질 것""이라며 ""다만 최근 코스피 시장의 밸류에이션 하락으로 목표가는 기존 1만7000원을 유지한다""고 밝혔다. textlinktopstart textlinktopend textlinkstart"
조세일보,002350,/news/news_read.nhn?article_id=0002155780&office_id=123&mode=search&query=넥센타이어&page=30,2017-03-20 10:12,"넥센타이어-영국 프리미어리그 맨시티, 후원 재계약","◆…넥센타이어 강호찬 대표이사(왼쪽)와 맨시티 페란 소리아노 CEO(오른쪽)가 '유니폼 브랜딩' 후원 계약을 체결한 뒤 기념촬영을 하고 있다. 넥센타이어(대표 강호찬)는 맨체스터시티 FC와 잉글리시 프리미어 리그 최초로 선수 유니폼 소매에 기업 로고를 노출하는 방식의 '유니폼 브랜딩' 후원 계약을 체결했다고 20일 밝혔다. 이번 계약은 8월부터 새롭게 시작되는 2017-2018년 시즌 유니폼부터 적용될 예정이다. 넥센타이어 기업 로고는 선수들이 착용하는 경기용 유니폼 소매에 부착, 맨시티가 참가하는 모든 EPL(잉글리시 프리미어 리그) 및 영국 컵 대회를 통해 전세계에 노출된다. 더불어 이번 계약은 기존의 홈구장 광고 및 선수단 이미지 사용권 등의 홍보·마케팅 활동 외에 후원 범위를 넓혀 갱신하는 형태로, 슈퍼리그와 리그컵 대회 우승팀인 '맨체스터 시티 여자 축구 팀'에 대한 후원도 병행하게 된다. 지난 몇 년간 기업 브랜드 강화를 위해 다양한 마케팅 플랫폼을 도입해 온 넥센타이어는 후원 확대를 통해 글로벌 시장에서 외형 확장과 브랜드 가치 제고, 두 가지를 모두 더욱 공고히 하겠다는 계획이다. 후원 계약 체결식은 지난 18일 (한국 시간), 영국 맨체스터 시티풋볼아카데미에서 치러졌다. 이날 행사는 강호찬 넥센타이어 대표이사와 페란 소리아노 맨시티 CEO, 펩 과르디올라 맨시티 감독 등을 비롯해 가브리엘 헤수스, 일카이 귄도간, 질 스콧 등 맨시티 스타 선수들이 참석한 가운데 진행됐다. 넥센타이어는 2015년 8월부터 맨시티를 후원중으로 맨시티 최고 선수들인 라힘 스털링, 켈레치 이헤아나초, 놀리토 등이 참여한 풋볼 챌린지를 비롯한 다양한 이벤트 활동들을 적극 추진해 오고 있다. 강호찬 대표이사는 “한국 기업으로서 세계 최고의 명문 구단 중 하나인 맨시티와 함께 EPL 최초로 유니폼 브랜딩을 할 수 있게 돼 많은 기대가 된다”며 “이번 후원 재계약을 통해 전세계 축구 팬들이 넥센타이어를 더욱 친근하게 느낄 수 있는 좋은 기회가 되길 바란다”고 전했다. 맨시티 CEO 페란 소리아노는 “세계적인 브랜드로 성장한 넥센타이어와 파트너십을 연장하게 돼 매우 기쁘게 생각한다”며 “선수들과 함께 최선을 다하는 멋진 경기로 보내준 성원에 보답할 것”이라고 밝혔다. 한편 넥센타이어는 국내외 프로야구를 비롯해 동계 스포츠 후원 등 다양한 스포츠 마케팅 활동을 통해 브랜드 인지도를 높이고 있는데 포르쉐, 폭스바겐, 피아트, 르노, FCA 그룹 (피아트-크라이슬러 오토모빌스) 등 글로벌 완성차 업체와도 각종 이미지 제고 협력을 확대해 오고 있다."
MBN,002350,/news/news_read.nhn?article_id=0001101370&office_id=057&mode=search&query=넥센타이어&page=30,2017-03-21 06:40,"넥센타이어, 맨체스터시티 FC와 유니폼 브랜딩 계약 체결","넥센타이어가 영국 프로축구 구단 맨체스터시티 FC와 프리미어리그 최초로 선수 유니폼 소매에 기업 로고를 노출하는 방식의 유니폼 브랜딩 후원 계약을 체결했습니다. 이번 계약은 오는 8월 시작되는 2017~2018년 시즌 유니폼부터 적용되고 맨체스터시티 FC가 참가하는 대회를 통해 전세계에 노출됩니다. 강호찬 넥센타이어 대표이사는 ""이번 유니폼 브랜딩을 통해 전세계 축구 팬들이 넥센타이어를 더욱 친근히 느낄 수 있게 되길 바란다""고 말했습니다. 넥센타이어는 이번 후원 확대를 통해 글로벌 시장에서 외형 확장과 브랜드 가치 재고를 공고히 하겠다고 강조했습니다. MBN 관련뉴스해당 언론사에서 선정하며 언론사 페이지(아웃링크)로 이동해 볼 수 있습니다.""어떻게 이럴수가…"" 목욕탕 배수구에 빨려 들어가 '사망'""모텔서 성관계 어때?"" 여장男의 은밀한 유혹수북하게 쌓인 눈을 고속으로 들이박는 열차!공원에 떨어진 돌멩이 주웠는데…'세상에!'프리스틴, 10인10색 담았다…'WEE WOO' 뮤비 티저 공개"
매일경제,002350,/news/news_read.nhn?article_id=0003830537&office_id=009&mode=search&query=넥센타이어&page=38,2016-11-03 18:01,넥센타이어 `질주`&hellip;영업익 26% 늘어 654억,"넥센타이어가 3분기 '어닝 서프라이즈'를 일궈냈다. 넥센타이어는 3분기 영업이익(연결기준)이 전년 동기 대비 26.5% 증가한 654억원을 기록했다고 3일 공시했다. 매출액은 4701억원을 올렸다. 영업이익은 시장 전망치(컨센서스) 576억원을 훌쩍 넘어서는 수치다. 넥센타이어 관계자는 ""마진이 큰 초고성능(UHP) 타이어 매출이 전년 대비 늘었다""며 ""미주 쪽에서도 판매가 크게 늘어나 실적 개선을 이끌었다""고 설명했다. 동국제강도 6분기 연속 흑자 행진을 이어갔다. 동국제강은 올해 3분기 연결기준 영업이익이 709억원을 기록해 전년 대비 8.7% 감소했다고 밝혔다. 매출액은 1조3797억원으로 전년 대비 7.2% 줄었다. 반면 파라다이스의 3분기 실적은 시장 전망치를 크게 밑돌았다. 파라다이스는 3분기 영업이익이 지난해 같은 기간보다 4.6% 감소한 109억원으로 잠정 집계됐다고 이날 밝혔다. 191억원으로 내다봤던 영업이익 컨센서스에 크게 못 미치는 수준이다. 반면 매출액은 시장 전망치 수준인 1752억원으로 전년 대비 22.7% 늘었다. 이에 대해 유성만 HMC투자증권 연구원은 ""지난 3분기 워커힐점에서 일회성 희망 퇴직금 비용이 발생했다""고 분석했다. [윤진호 기자] r_start // r_end //"
파이낸셜뉴스,002350,/news/news_read.nhn?article_id=0003791843&office_id=014&mode=search&query=넥센타이어&page=30,2017-03-21 13:32,"넥센타이어, 글로벌 파트너십 위한 '퍼플서밋' 개최","넥센타이어 퍼플서밋 참가자들이 기념촬영을 하고 있다.    넥센타이어는 지난 18~20일 전세계 비즈니스 파트너들과의 협력을 강화하기 위해 '2017 퍼플서밋, 맨체스터' 행사를 개최했다고 21일 밝혔다. 퍼플서밋은 넥센타이어의 비즈니스 파트너 및 소비자들을 대상으로 한 통합 마케팅 활동으로, 올해는 전 세계 34개국에서 약 60여명의 비즈니스 파트너들이 참여했다. 또 참가자들과 맨체스터 시티 FC(이하 맨시티)의 홈구장인 에티하드 스타디움에서 맨시티와 리버풀과의 경기를 관람했다. 강호찬 넥센타이어 사장은 ""세계 각국의 비즈니스 파트너들을 초청해 보다 긴밀하고 장기적인 협력을 약속하는 '2017 퍼플 서밋' 행사를 개최하게 돼 기쁘다""며 ""앞으로도 전 세계의 파트너사들과 함께 더욱 단단한 파트너십을 구축하고 발전시켜 나가는데 전념할 계획""이라고 말했다."
스포츠조선,002350,/news/news_read.nhn?article_id=0003010109&office_id=076&mode=search&query=넥센타이어&page=38,2016-11-03 11:45,넥센타이어 3분기 영업익 654억&hellip;전분기보다 5.9% 줄어,"넥센타이어는 올해 3분기 연결기준 654억원의 영업이익을 올렸다고 3일 공시했다. 이는 지난해 같은 기간보다 26.5% 늘어났으며, 전분기에 비해서는 5.9% 감소했다. 3분기 매출액은 4702억원으로 잠정 집계돼 지난해 같은 기간과 비슷했으며, 전분기 보다 4.7% 줄었다."
아이뉴스24,002350,/news/news_read.nhn?article_id=0000405263&office_id=031&mode=search&query=넥센타이어&page=30,2017-03-21 14:06,"넥센타이어, 파트너십 행사 '퍼플 서밋' 개최","[아이뉴스24 이영은기자] 넥센타이어는 전세계 비즈니스 파트너들과의 협력을 강화하기 위해 '2017 퍼플 서밋, 맨체스터' 행사를 개최했다고 21일 밝혔다. 지난해에 이어 올해 두 번째로 치러진 퍼플 서밋은 넥센타이어의 비즈니스 파트너 및 소비자들을 대상으로 한 통합 마케팅 활동으로, 글로벌 비즈니스 파트너와의 관계 발전 및 협력을 강화하고, 회사의 인지도를 널리 알리기 위한 행사라고 회사측은 설명했다. 지난 18일부터 20일까지 3일동안 전세계 34개국에서 약 60여명의 비즈니스 파트너들이 참여한 가운데 컨퍼런스가 진행됐으며, 맨체스터 시티 FC의 홈구장인 에티하드 스타디움에서 맨시티와 리버풀과의 경기를 관람했다. 강호찬 넥센타이어 사장은 ""세계 각국의 비즈니스 파트너들을 초청해 보다 긴밀하고 장기적인 협력을 약속하는 2017 퍼플 서밋 행사를 개최하게 되어 매우 기쁘다""면서 ""앞으로도 전세계의 파트너사들과 함께 더욱 단단한 파트너십을 구축하고 발전시켜 나가는데 전념할 계획""이라고 말했다. /이영은기자"
뉴시스,002350,/news/news_read.nhn?article_id=0007565493&office_id=003&mode=search&query=넥센타이어&page=38,2016-11-03 10:39,"넥센타이어, 3분기 영업익 654억&hellip;전년比 26.5%&uarr;",【서울=뉴시스】김주아 기자 = 넥센타이어(002350)는 연결재무제표 기준 올해 3분기 영업이익이 654억2600만원으로 전년동기 대비 26.5% 증가한 것으로 잠정집계됐다고 3일 공시했다. 같은 기간 매출액은 4701억8500만원으로 전년 동기와 같은 수준인 것으로 나타났다.
머니투데이,002350,/news/news_read.nhn?article_id=0003767550&office_id=008&mode=search&query=넥센타이어&page=38,2016-11-03 10:21,"넥센타이어, 3Q 영업익 654억원&hellip;전년比 27%&uarr;",[머니투데이 신희은 기자] 넥센타이어는 올 3분기 영업이익이 지난해 같은 기간보다 26.5% 증가한 654억원을 기록했다고 3일 잠정 공시했다. 매출액은 전년 동기 수준인 4702억원을 달성했다. textlinktopstart textlinktopend textlinkstart
이데일리,002350,/news/news_read.nhn?article_id=0003777880&office_id=018&mode=search&query=넥센타이어&page=30,2017-03-21 14:10,"넥센타이어, 글로벌 파트너십 위한 &lsquo;퍼플서밋&rsquo; 개최","넥센타이어 퍼플서밋 참가자들이 기념촬영을 하고 있다. 넥센타이어 제공. [이데일리 김보경 기자] 넥센타이어(002350)는 지난 18~20일 전세계 비즈니스 파트너들과의 협력을 강화하기 위해 ‘2017 퍼플서밋, 맨체스터’ 행사를 개최했다고 21일 밝혔다. 퍼플서밋은 넥센타이어의 비즈니스 파트너 및 소비자들을 대상으로 한 통합 마케팅 활동으로, 올해는 전 세계 34개국에서 약 60여명의 비즈니스 파트너들이 참여했다. 참가자들은 맨체스터 시티 FC(이하 맨시티)의 홈구장인 에티하드 스타디움에서 맨시티와 리버풀과의 경기를 관람했다. 이 경기는 올해로 두 시즌째 맨시티의 공식 후원을 맡고 있는 넥센 타이어가 참자가들을 위해 마련한 ‘스페셜 스폰서를 위한 매치 데이 이벤트’다. 강호찬 넥센타이어 사장은 “세계 각국의 비즈니스 파트너들을 초청해 보다 긴밀하고 장기적인 협력을 약속하는 ‘2017 퍼플 서밋’ 행사를 개최하게 되어 매우 기쁘다”며 “앞으로도 전 세계의 파트너사들과 함께 더욱 단단한 파트너십을 구축하고 발전시켜 나가는데 전념할 계획”이라고 말했다."
아시아경제,002350,/news/news_read.nhn?article_id=0003862132&office_id=277&mode=search&query=넥센타이어&page=38,2016-11-03 10:19,"넥센타이어, 3Q 연결 영업익 654억&hellip;전년比 26.5%&uarr;","[아시아경제 김민영 기자]넥센타이어는 3분기 연결 기준 영업이익이 전년 대비 26.5% 늘어난 654억2600만원을 기록했다고 3일 공시했다. 이 기간 매출은 전년과 같은 수준인 4701억8500만원, 법인세비용 차감 전 계속 사업이익은 102.4% 증가한 535억9100만원으로 잠정 집계됐다."
아시아경제,002350,/news/news_read.nhn?article_id=0003957669&office_id=277&mode=search&query=넥센타이어&page=30,2017-03-21 14:19,"넥센타이어, 글로벌 비즈니스 파트너 행사 개최","[아시아경제 이정민 기자] 넥센타이어가 전세계 비즈니스 파트너들과 협력을 강화하기 위해 ‘2017 퍼플 서밋, 맨체스터’ 행사를 개최했다고 21일 밝혔다. 올해 두 번째로 치러진 퍼플 서밋은 넥센타이어의 비즈니스 파트너 및 소비자들을 대상으로 한 통합 마케팅 활동으로, 글로벌 비즈니스 파트너와의 관계 발전 및 협력을 강화하고, 회사의 인지도를 널리 알리기 위해 마련됐다. 이번 행사는 지난 18일부터 20일까지 3일동안, 전 세계 34개국에서 약 60여명의 비즈니스 파트너들이 참여한 가운데 컨퍼런스가 진행되었으며, 이어 맨체스터 시티 FC(이하 맨시티)의 홈구장인 에티하드 스타디움에서 맨시티와 리버풀과의 경기를 관람했다. 강호찬 넥센타이어 사장은 “앞으로도 전 세계의 파트너사들과 함께 더욱 단단한 파트너십을 구축하고 발전시켜 나가는데 전념할 계획”이라고 말했다."
연합뉴스,002350,/news/news_read.nhn?article_id=0008798040&office_id=001&mode=search&query=넥센타이어&page=38,2016-11-03 10:14,"넥센타이어, 3분기 영업익 654억원&hellip;27% 증가",(서울=연합뉴스) 유현민 기자 = 넥센타이어는 올해 3분기 연결기준 영업이익이 654억원으로 지난해 같은 기간보다 26.5% 늘었다고 3일 공시했다. 매출액은 4천702억원으로 잠정 집계됐다.
파이낸셜뉴스,002350,/news/news_read.nhn?article_id=0003788738&office_id=014&mode=search&query=넥센타이어&page=30,2017-03-13 19:48,넥센타이어 사용자 중심 '홈페이지' 새단장,"넥센타이어는 고객 커뮤니케이션 강화의 일환으로 공식 홈페이지를 개편해 열었다고 13일 밝혔다.이번 홈페이지는 최신 트렌드를 반영한 디자인과 사용자 중심의 최적화된 콘텐츠 제공에 중점을 두고 개편됐다.새 홈페이지의 주요 특징으로는 제품별 성능지표를 한눈에 볼 수 있는 타이어 비교 기능과 방문이력에 따른 관심 제품 정보 제공, 타이어 위치 교환 알림, 가까운 대리점 안내 등 개인별 맞춤 서비스 강화다.또 타이어 렌탈서비스인 '넥스트레벨'의 월 렌탈료 계산기 등 고객 편의성을 고려한 기능도 갖췄으며, 타이어 관리와 드라이빙 팁 등 연관 소셜 컨텐츠도 제공한다. 한편, 이번 홈페이지는 반응형 웹을 적용해 다양한 모바일 기기에서도 일관된 서비스가 가능하도록 접근성을 높였다.이정은 기자"
서울경제,002350,/news/news_read.nhn?article_id=0002910950&office_id=011&mode=search&query=넥센타이어&page=38,2016-11-03 10:14,"넥센타이어, 3&middot;4분기 영업이익 654억... 전년 대비 26.5% 증가","넥센타이어(002350)가 3일 올해 3·4분기 연결 기준 잠정 영업이익이 654억원으로 전년 동기 대비 26.5% 늘어났다고 공시했다. 매출액은 4,702억원으로 지난해 같은 기간과 비교해 동일한 수준을 유지했다. 넥센타이어는 “당기순이익 등은 확정 후 공시 예정”이라고 설명했다."
전자신문,002350,/news/news_read.nhn?article_id=0002545815&office_id=030&mode=search&query=넥센타이어&page=37,2016-11-04 13:21,"[로봇뉴스]넥센타이어, &quot;합리적 가격의 UH&hellip;&quot; 매수(유지)-한국투자증권","한국투자증권에서 4일 넥센타이어(002350)에 대해 ""합리적 가격의 UHPT 전문업체로 자리매김""라며 투자의견을 '매수(유지)'로 제시하였고, 아울러 목표주가로는 17,500원을 내놓았다. 한국투자증권 김진우 애널리스트가 동종목에 대하여 이번에 제시한 '매수(유지)'의견은 한국투자증권의 직전 매매의견에서 큰 변화없이 그대로 유지되는 것이고  올해 초반의 매매의견을 기준으로  볼때도 역시 '매수'의견이 계속 유지되고 있는 상태이다. 그리고 최근 분기내 발표된 전체 증권사 리포트의 컨센서스와 비교를 해볼 경우에 오늘 발표된 투자의견은 대체적으로 평균치에 해당하는 수준으로, 이번 의견은 동종목에 대한 전체적인 흐름에서 크게 벗어나지 않은 것으로 분석되고 있다. 목표주가의 추이를 살펴보면 최근 장기간 목표가가 같은 수준에 머물고 있는 모습이다. 또한 전일 종가 기준으로 볼때 동종목의 현주가는 이번에 제시된 목표가 대비 28.2%의 추가상승여력이 있다는 해석이 제시되고 있다."
전자신문,002350,/news/news_read.nhn?article_id=0002545843&office_id=030&mode=search&query=넥센타이어&page=37,2016-11-04 13:33,"[로봇뉴스]넥센타이어, &quot;가격 경쟁 완화가 &hellip;&quot; 매수(유지)-유진투자증권","유진투자증권에서 4일 넥센타이어(002350)에 대해 ""가격 경쟁 완화가 이익 성장 지지. 단, 수효 회복 시 주가 상승 속도가 가장 빠를 전망""라며 투자의견을 '매수(유지)'로 제시하였다. 아울러 12개월 목표주가를 18,000원으로 내놓았다. 유진투자증권 장문수 애널리스트가 동종목에 대하여 이번에 제시한 '매수(유지)'의견은 유진투자증권의 직전 매매의견을 그대로 유지하는 것이고 올해 초반의 매매의견을 기준으로 본다면 '트레이딩매수'의견에서 '매수(유지)로' 상향조정된 것이다. 그리고 최근 분기내 발표된 전체 증권사 리포트의 컨센서스와 비교를 해볼 경우에 오늘 발표된 투자의견은 전체의견에 수렴하고 있어, 이번 의견은 시장의 평균적인 기대감이 객관적으로 표현된 것으로 분석되고 있다. 한편 12개월 목표주가로 제시한 18,000원은 직전에 발표된 목표가와 대비해서 큰 변화는 없고, 목표주가의 추이를 살펴보면 최근 장기간 목표가가 같은 수준에 머물고 있는 모습이다. 또한 전일 종가 기준으로 볼때 동종목의 현주가는 이번에 제시된 목표가 대비 31.9%의 저평가 요인이 존재한다는 해석이 제시되고 있다."
