source,symbol,link,date,title,content
파이낸셜뉴스,002350,/news/news_read.nhn?article_id=0003823867&office_id=014&mode=search&query=넥센타이어&page=24,2017-06-02 14:50,"[fnRASSI]넥센타이어1우B(002355), 52주 신고가...3.45% &uarr;","넥센타이어1우B(002355)는 52주신고가를 기록하고 있어 주목할만하다. 동종목의 현재 주가는 6,300원 선에서 이루어지고 있다. 거래일을 기준으로 최근 3일간 평균 거래량은 10만 주이다. 이는 60일 일 평균 거래량 9,334만 주와 비교해보면 최근 거래량이 급격히 늘어났다는 것을 알 수 있다. 기관과 개인은 순매도, 외국인은 순매수(한달누적)  5월10일부터 외국인들이 17거래일 연속 순매수 행진을 벌이고 있다. 4주간을 기준으로 보면 외국인이 방향성있는 매매를 하면서 25,969주를 순매수한 반면, 기관은 매도쪽으로 방향을 잡으면서 2,397주를 순매도했고, 개인들도 매도 우위를 지속하면서 23,572주를 순매도한 것으로 집계됐다. 외국인투자자의 거래참여 활발, 거래비중 50.4% 최근 한달간 주체별 거래비중을 살펴보면 외국인 비중이 50.4%로 가장 높았고, 개인이 47.87%로 그 뒤를 이었다. 기관은 1.72%를 나타냈다. 'fnRASSI'는 증권전문 기업 씽크풀과 파이낸셜뉴스의 협업으로 로봇기자가 실시간으로 생산하는 기사입니다."
헤럴드경제,002350,/news/news_read.nhn?article_id=0001079884&office_id=016&mode=search&query=넥센타이어&page=45,2016-07-07 10:47,넥센 친환경타이어 &lsquo;레드닷 어워드&rsquo; 디자인 컨셉부문 수상,"[헤럴드경제=유재훈 기자] 넥센타이어는 친환경 컨셉타이어인 ‘그린하이브(GreenHive)’ 제품이 독일의 ‘2016 레드닷 어워드’ 디자인 컨셉 부문에서 본상을 수상했다고 7일 밝혔다. 레드닷 어워드는 미국의 ‘IDEA 디자인 어워드’, 독일의 ‘iF 디자인 어워드’와 함께 세계 3대 디자인상으로 꼽힌다. 올해는 60개국에서 4698개 제품이 출품됐다. 트레드 재충전식의 친환경 컨셉타이어 ‘그린하이브’는 미국 IDEA 디자인 어워드를 시작으로 지난해 이탈리아 A 디자인 어워드, 올해 미국 그린 굿 디자인 어워드에 이어 독일 레드닷 어워드까지 수상하며 글로벌 디자인 어워드에서 잇달아 수상했다. ‘그린하이브’는 휠 일체형 타이어에 소모품인 리필형 트레드(접지부)만 구입해 교체할 수 있는 차세대 타이어다. 반 영구적 사용이 가능해 혁신성과 친환경성, 경제성에서 높은 점수를 받았으며, 기존 타이어의 틀을 깨고 새로운 패러다임을 제시했다는 평가를 받았다는 게 회사측 설명이다. 한민현 넥센타이어 연구개발본부장은 “세계적으로 권위있는 디자인 어워드에서 컨셉타이어의 연이은 수상은 차세대 선도 기업으로 도약하는 넥센타이어의 역량을 보여주는 것”이라며 “앞으로도 지속적인 연구개발로 미래 시장을 개척하는 혁신 제품 개발에 더욱 노력해 나갈 것”이라고 말했다. 한편 시상식은 오는 9월 22일 시행 예정이며, 수상작은 싱가포르의 레드닷 디자인 박물관에 전시될 예정이다."
서울경제,002350,/news/news_read.nhn?article_id=0003045899&office_id=011&mode=search&query=넥센타이어&page=24,2017-06-05 09:18,"[오늘의 종목]&ldquo;넥센타이어, &lsquo;타이어 가격 증가세&rsquo; 힘 입어 2분기 이후 기대&rdquo;","[서울경제] 이베스트증권은 5일 넥센타이어(002350)에 대해 “세계 타이어 가격 상승에 힘 입어 올해 2·4분기 이후 실적 개선이 이뤄질 것”이라고 전망했다. 이에 따라 현재까지 유지해왔던 투자의견 ‘보류’를 ‘매수’로 바꾸고 목표주가 역시 기존 1만3,000원에서 1만6,000원으로 올렸다. 유지웅 연구원은 이날 보고서에서 “넥센타이어가 전 세계 각 지역별로 발표한 가격 인상분이 지난 4월부터 반영되기 시작했다”며 “전반적은 흐름은 올해 1·4분기 대비 소폭 부진할 전망인 2·4분기 실적을 확인한 후 3·4분기부터 원자재 투입비용이 급감하기 시작하면서 어닝 모멘텀이 확대될 것”이라고 전망했다. 이어 “타이어 업계 전반에 걸쳐 2차 가격인상이 이뤄지고 있고 이에 따른 볼륨 상승효과를 공유할 수 있다는 점에서 긍정적”이라며 “4월 이후부터는 실제로 딜러들의 선수요 발생구간이 종료됐음에도 넥센타이어의 유럽과 중국 교체용 타이어는 각각 10% 이상씩 판매가 증가했다”고 덧붙였다."
아시아경제,002350,/news/news_read.nhn?article_id=0003782777&office_id=277&mode=search&query=넥센타이어&page=45,2016-07-07 10:27,넥센타이어 '그린하이브'&hellip;'2016 레드닷 어워드' 본상,"넥센타이어 '그린하이브'. [아시아경제 김대섭 기자] 넥센타이어는 '2016 레드닷 어워드' 디자인 콘셉트 부문에서 본상을 수상했다고 7일 밝혔다. 이번 대회에서 수상한 '그린하이브' 제품은 휠 일체형 타이어에 소모품인 리필형 트레드(접지부)만 구입해 사용 가능한 게 특징이다. 반 영구적 사용이 가능해 혁신성과 친환경성, 경제성에서 높은 점수를 받았다. 레드닷 어워드는 미국의 'IDEA 디자인 어워드', 독일의 'iF 디자인 어워드'와 함께 세계 3대 디자인상으로 꼽힌다. 혁신성, 미적 품격, 실현가능성, 기능과 유용성 등을 기준으로 심사한다. 올해는 60개국에서 4698개 제품이 출품됐다. 시상식은 오는 9월22일 시행 예정이다. 수상작은 싱가포르의 레드닷 디자인 박물관에 전시할 예정이다. 그린하이브는 IDEA 디자인을 시작으로 지난해 이탈리아 A 디자인, 올해 미국 그린 굿 디자인에 이어 독일 레드닷까지 글로벌 디자인 대회에서 연이어 수상하며 호평을 받고 있다. 한민현 넥센타이어 연구개발본부장은 ""세계적으로 권위 있는 디자인 어워드에서 연이은 수상은 차세대 선도 기업으로 도약하는 역량을 보여주는 것"" 이라며 ""앞으로도 지속적인 연구개발로 미래 시장을 개척하는 혁신 제품 개발에 더욱 노력해 나갈 것""이라고 말했다."
조세일보,002350,/news/news_read.nhn?article_id=0002161869&office_id=123&mode=search&query=넥센타이어&page=24,2017-06-05 11:12,넥센타이어 &lsquo;넥스트레벨&rsquo; 20만개 돌파 기념 홈쇼핑 특별생방송 진행,"넥센타이어(대표이사 강호찬)가 타이어 렌탈 서비스인 '넥스트레벨'의 20만개 판매를 기념해 GS홈쇼핑 특별생방송을 진행한다고 5일 밝혔다. 5일 오후 10시 40분부터 11시 40분까지 GS홈쇼핑에서 방송되며 상담예약을 남기는 고객에게 휴가비 총 3000만원 (500만원, 6명) 등 경품 추첨 이벤트 기회를 제공한다. 또 상담 완료 고객에게는 3000원 모바일 주유권을 지급한다. 계약고객 중 롯데제휴카드 자동이체 고객에게는 2만원 모바일 SK 주유권을 추가로 제공하고 추첨을 통해 롯데 기프트카드 총 150만원의 경품을 증정한다. 한편 넥스트레벨은 넥센타이어가 업계 최초로 실시한 타이어 렌탈 서비스다. 사용 기간 중 마모나 파손 등 고객이 타이어 교체가 필요할 때 언제든지 2개를 추가로 지원하는 서비스다. 고객이 원하면 6개월마다 찾아가는 방문 서비스를 통해 공기압 점검·보충, 항균 연막탈취, 워셔액 점검·보충 등 차량 10대 항목 안전 점검 서비스도 펼친다. 렌탈 가입 고객은 방문서비스와 별도로 전국 렌탈 전문점 어디에서든 차량 10대 항목 점검 서비스와 가입 기간 중 1회에 한해 위치교환 무상 서비스를 받을 수 있다. 넥센타이어 한국지역담당 박강철 전무는 “넥스트레벨은 고객의 구매 선택의 폭을 넓혔을 뿐 아니라 안전운전을 위한 지속적인 관리서비스를 결합한 고객 지향의 서비스”라며 “보다 많은 고객이 렌탈서비스를 경험하고 다양한 혜택을 누리길 바란다”라고 밝혔다."
연합뉴스,002350,/news/news_read.nhn?article_id=0008524744&office_id=001&mode=search&query=넥센타이어&page=45,2016-07-07 08:35,HMC증권 &quot;넥센타이어 원재료 값 상승 부담&hellip;목표가&darr;&quot;,"(서울=연합뉴스) 경수현 기자 = HMC투자증권은 7일 넥센타이어가 원재료 투입단가 상승이 임박한 상황이라며 투자의견을 '매수'에서 '중립(마켓퍼폼)'으로 하향조정하고 목표주가도 1만5천500원에서 1만4천원으로 낮췄다. 이명훈 연구원은 ""천연고무 가격이 연초 t당 1천150달러를 저점으로 4월 1천800달러 이상으로 급반등한 뒤 현재는 1천500달러 수준이지만 다시 3분기부터 상승세에 진입할 전망""이라며 ""하반기 영업이익률 축소가 우려된다""고 진단했다. 이에 따라 넥센타이어의 올해 연결 기준 영업이익 전망치를 2천272억원으로 종전보다 3.9% 낮춰 잡았다. 이 연구원은 ""2분기 매출과 영업이익은 4천828억원과 625억원으로 작년 동기보다 각각 3.3%, 12.3% 늘면서 컨센서스(시장 기대치)에 부합할 것""이라며 ""그러나 순이익은 중국법인의 달러 차입금 외화환산 손실 영향으로 컨센서스를 9.5% 하회할 것""이라고 예상했다."
한국경제,002350,/news/news_read.nhn?article_id=0003621159&office_id=015&mode=search&query=넥센타이어&page=45,2016-07-07 08:20,"&quot;넥센타이어, 영업이익률 축소 우려&hellip;목표가&darr;&quot;-HMC","[ 권민경 기자  ] HMC투자증권은 7일 넥센타이어에 대해 하반기 영업이익률이 감소할 것이라며 목표주가를 1만5500원에서 1만4000원으로 낮췄다. 투자의견은 '매수'에서 '마켓퍼폼'(시장수익률)으로 하향했다. 이명훈 연구원은 ""천연고무가격이 연초 톤당 1150달러에서 빠르게 반등해 현재 1500달러 수준까지 왔다""며 ""넥센타이어의 원재료 투입단가는 3분기부터 상승세에 진입할 전망""이라고 말했다. 이어 ""원재료 투입단가 상승이 임박한 상황이지만 판가 상승으로 즉시 이어지기는 어렵다""며 ""이에 따라 하반기 영업이익률이 줄어들 우려가 있다""고 설명했다. 이 연구원은 또 ""2분기 매출과 영업이익은 작년보다 각각 3%, 12% 늘어난 4828억원, 625억원으로 추정치에 부합할 것""이라며 ""다만 당기순이익은 외화환산손실 확대로 추정치를 9% 이상 밑돌 것""이라고 분석했다. 권민경 한경닷컴 기자"
조선비즈,002350,/news/news_read.nhn?article_id=0000372094&office_id=366&mode=search&query=넥센타이어&page=24,2017-06-08 07:32,[이코노미조선] 넥센타이어 '2조 매출' 눈앞&hellip;4년 연속 성장세 '롱런' 비결은,"넥센타이어 2018년 체코 공장 완공, 생산 능력 5300만개로 확대 초고성능 제품 비중 높여 4년 연속 매출·이익 증가세  2017년 넥센타이어는 최초로 매출 2조원을 넘어설 것으로 예상된다. 사진은 넥센타이어의 경남 창녕 공장 생산라인./넥센타이어 넥센타이어는 2016년 2월 독일 스포츠카 제조 업체인 포르셰의 스포츠유틸리티차량(SUV) ‘카이엔’에 ‘엔페라 RU1’ 타이어를 공급하는 계약을 따냈다. 2013년부터 꾸준히 포르셰 임직원들을 만나며 준비한 결과였다. 특히 엔페라 RU1의 고속 주행 시 안정적인 핸들링 성능과 최저 수준의 소음, 젖은 노면에서의 제동력 등이 포르셰 경영진의 마음을 사로잡았다. 넥센타이어가 꾸준히 성장세를 이어 가고 있다. 넥센타이어는 2016년 매출 1조8947억원, 영업이익 2480억원을 기록했다. 전년 대비 각각 3.1%, 10.2% 증가했다. 특히 2012년 매출 1조7006억원, 영업이익 1769억원을 기록한 이후 한 해도 빠짐없이 실적을 경신하고 있다. ◆ 성장 비결 1 중국 공장 건설 등 생산 능력 확대 넥센타이어가 꾸준히 성장할 수 있었던 비결은 무엇일까. 우선 ‘생산 능력 확대’에서 그 답을 찾을 수 있다. 넥센타이어는 2004년 1100억원을 투자해 경남 양산에 제2공장을 완공했다. 이를 통해 연간 700만개의 타이어 생산 능력을 1900만개로 확대했다. 초고성능(UHP·Ultra High Performance) 타이어 등 고부가가치 제품 생산에 집중하며 수익성도 높였다. 이후 넥센타이어는 세계 최대 타이어 시장으로 급부상한 중국을 공략하기 위해 연간 1100만개의 타이어 생산 능력을 갖춘 중국 칭다오(靑島) 공장을 건설했다. 동시에 상하이를 거점으로 베이징·광저우 등 중국 주요 도시에 지점을 설립했다. 2012년에는 경남 창녕 공장(생산 능력 1100만개)을 세웠다. 이로써 넥센타이어는 2017년 현재 연간 4100만개의 타이어 생산 능력을 확보했다. 그 결과 2000년 8%에 불과하던 내수 시장 점유율을 2016년 25%로 끌어올렸다. 전 세계 140여개국에 타이어를 판매하며 해외 매출 비중도 75%로 높였다. 현재 넥센타이어는 2018년 하반기 완공을 목표로 체코 자테츠(Zatec) 공장을 건설 중이다. 약 1조2000억원이 투입된다. 칭다오 공장을 건설해 중국 시장 공략에 나섰다면, 체코 공장은 유럽 시장 공략의 교두보 역할을 할 것이다. 체코 공장을 통해 ‘유럽 생산, 유럽 판매’ 시스템을 갖춘다는 것이다. 체코 공장(생산 능력 1200만개)이 가동되면 연간 타이어 생산 능력도 5300만개로 늘어난다. 2004년 700만개와 비교하면 657% 증가한 규모다. 체코 공장 건설은 생산 능력 확대 외에 생산 지역 다변화를 통한 수익성 확보 측면에서도 효과적이다. 넥센타이어의 지역별 생산 현황을 보면 양산·창녕 등 국내 공장이 전체 생산의 73%를, 중국 칭다오 공장이 27%를 차지하고 있다. 총매출 중 수출은 75%이고, 주요 판매 지역은 북미·유럽·중국이다. 수출 가운데 유럽이 차지하는 비율은 약 20%인데, 체코 공장을 가동해 유럽 매출 비율을 북미(29%) 수준으로 끌어올릴 수 있다. 조수홍 NH투자증권 연구원은 “넥센타이어의 매출은 2017년 최초로 2조원을 넘어설 것”이라며 “2018년 체코 공장이 정상적으로 돌아간다면 이후 매출이 고속 성장할 것”이라고 전망했다. ◆ 성장 비결 2 꾸준한 R&amp;D 투자, 초고성능 타이어 개발 꾸준한 연구·개발(R&D)도 넥센타이어의 성장을 주도했다. “첫째도 품질, 둘째도 품질이다. 품질에 승부를 걸어라.” 강병중 넥센타이어 회장이 항상 강조하는 말이다. 높은 품질은 R&D에서 나온다. 넥센타이어는 2000년 들어 본격적으로 R&D 인력 확보에 나섰다. 2000년 30여명에 불과하던 넥센타이어의 R&D 인력은 2017년 현재 450명으로 늘었다. 2006년 홍종만 전 삼성자동차 사장과 2010년 이현봉 전 삼성전자 생활가전 총괄사장 등 삼성 출신 인력을 최고경영자(CEO)로 영입하며 경영 시스템도 구축했다. 또 넥센타이어는 마모도, 주행 소음, 핸들링 등 타이어 성능을 측정할 수 있는 최신 시험 설비를 갖춘 경남 양산연구소를 비롯해 미국 애크런, 독일 프랑크푸르트, 중국 칭다오에 기술연구소를 설립했다. R&D 비용도 꾸준히 늘렸다. 2005년 63억원이었던 넥센타이어의 R&D 비용은 2010년 202억원, 2016년 599억원으로 증가했다. 그 결과 넥센타이어는 세계 최초 20시리즈 타이어 상용화, 판상 필러와 고무 나노복합체 제조 방법 개발, 고성능·고강도 산업용 폴리에스테르(PET) 섬유 개발, 타이어 소음 저감 방법 개발 등의 성과를 냈다. 현재 넥센타이어는 전기차용 타이어, 실란트(Sealant) 타이어 등 개발에 주력하고 있다. 실란트 타이어는 주행 중 이물질이 바닥 면을 관통해 펑크가 났을 때 타이어 자체적으로 손상 부위를 봉합해 공기 누출 없이 정상적으로 주행이 가능하게 하는 신기술 타이어다. UHP 타이어의 생산 비중도 2010년 32%에서 2016년 43%로 높였다. UHP 타이어는 노면의 극한 조건에서도 최상의 안전성을 확보해 고속 주행이 가능하도록 제작된 타이어다. 일반 타이어보다 제동력, 조종 안정성, 접지력, 순간 가속력 등이 뛰어나다. 일반 타이어에 비해 수익성도 높다. 넥센타이어의 대표적인 UHP 타이어 브랜드로는 ‘엔페라’가 있다. 현재 넥센타이어는 서울 마곡산업단지에 중앙연구소를 건설하고 있다. 넥센 중앙연구소는 대지 면적 1만7105㎡(약 5174평)에 지하 2층, 지상 7층 규모로 2019년 1월 완공을 목표로 하고 있다. 이 연구소는 저연비·고효율의 친환경 타이어 개발, 전기차용 타이어 등 첨단 타이어 설계 기술을 연구한다. 동시에 국내외 4곳의 기술연구소를 통합·관리하는 넥센타이어의 R&D 허브 역할을 한다. ◆  성장 비결 3 신차용·교체용 타이어 판매 비율 조절 신차용 타이어(OE·Original Equipment) 판매에 집중한 것도 넥센타이어의 성장 비결로 꼽힌다. 신차용 타이어는 완성차 업체가 신차를 개발·생산할 때 들어가는 타이어로, 타이어 업체의 기술력과 브랜드 가치를 평가하는 척도로 통한다. 소비자는 일반적으로 좋은 차량에 들어가는 타이어라면 품질이 좋다고 여긴다. 그래서 신차에 들어간 타이어를 다시 구매하는 경우가 많다. 신차용 타이어 공급량이 늘어야 교체용 타이어(RE·Replace Equipment) 매출도 늘어난다는 얘기다.  넥센타이어는 꾸준히 연구개발(R&amp;D) 비용을 늘려왔다. 넥센타이어 경남 양산연구소에서 직원들이 타이어 소음을 측정하고 있다./넥센타이어 넥센타이어는 2010년 전까지만 해도 교체용 타이어에 집중했다. 그러다 2011년 기아자동차의 중형차 ‘K5’에 타이어를 독점 공급하면서 신차용 타이어 시장에 본격 진출했다. 이후 2012년 미쓰비시의 중형차 ‘랜서’, 2013년 콤팩트 크로스오버차량(CUV) ‘아웃랜더 스포츠’에 타이어를 공급했다. 2014년에는 피아트크라이슬러(FCA)의 중형차 ‘올 뉴 200’과 중대형 픽업트럭 ‘램 3500’, 르노그룹 계열 다치아 브랜드의 소형 다목적차량(MPV) ‘로지’와 레저용차량(RV) ‘도커’, 2015년에는 FCA의 최초 CUV ‘500X’와 대표 상업용 밴인 ‘듀카토’, 폴크스바겐의 상용차 ‘캐디’에 타이어를 공급하며 영역을 넓혀나갔다. 2016년 들어서도 FCA의 미니 밴 ‘퍼시피카’, 포르셰의 SUV ‘카이엔’에 타이어를 공급했다. 이를 통해 넥센타이어는 신차용 타이어와 교체용 타이어의 판매 비율을 2010년 10% 대 90%에서 2016년 24%대 76%로 조절했다. 넥센타이어는 추후 신차용 타이어 비율을 30%로 늘릴 계획이다. ◆ PLUS POINT 강병중 넥센타이어 회장 40년 넘게 ‘타이어 외길’ 걸은 타이어 전문가 “먼저 무슨 일이 생기면 오랫동안 숙고하는 버릇이 있다. 생각을 정리한 후 해야겠다는 판단이 서면 무조건 부딪친다. 그래서 해답을 찾아내고 밀어붙인다.” 강병중 넥센타이어 회장이 말하는 성공 비결이다. 그는 40년 넘게 ‘타이어 외길’을 걸은 타이어 전문가로 통한다. 특히 강 회장의 ‘뚝심’은 업계에서도 유명하다. 강 회장은 “사업은 자기가 잘 알고 자신 있게 할 수 있는 것을 하는 게 가장 중요하다”고 강조하곤 한다. 또 그는 해외 시장에서 ‘타이어 강’으로 불린다. 세계 시장 흐름을 읽을 수 있는 타이어 관련 국제 전시회에 빠지지 않고 참여하고 있기 때문이다. 강 회장이 사업에 첫발을 내디딘 분야는 운수업이었다. 그는 1967년 건축자재를 운반하는 화물운수 회사인 옥정산업을 설립했다. 이후 운수업에서 가장 비중이 큰 소모품이 타이어인 점에 착안, 1973년 재생타이어를 생산하는 흥아타이어공업(현 넥센)을 설립했다. 미래 타이어 산업의 성장성을 읽은 것이다. ◆ 옛 ‘우성타이어’ 인수해 사업 확대 1999년에는 우성타이어(현 넥센타이어)를 인수했다. 당시 우성타이어는 부채와 낮은 생산성으로 인수·합병(M&A) 시장에서 외면당하는 기업이었다. 주위에선 고전하는 회사를 인수했다가는 같이 위험해질 수 있다는 우려가 제기됐다. 하지만 강 회장은 우성타이어가 세계적인 타이어 기업인 미쉐린과 합작법인을 설립해 기술 제휴를 한 경험과 제품의 품질이 뛰어나다는 점을 주목했다. 무엇보다 타이어 기업으로 성장하겠다는 강 회장의 의지가 강했다. 넥센타이어 관계자는 “당시 넥센은 신차용 타이어를 제외한 재생 타이어, 타이어 튜브, 지게차·화물차에 사용되는 솔리드(산업용) 타이어 등을 생산했다”며 “강병중 회장은 기회가 되면 신차용 타이어 공장을 운영해 타이어 관련 제품 전부를 생산할 계획을 가지고 있었고, 그 기회를 잡은 것”이라고 설명했다. 강 회장은 우성타이어 인수 다음 해 사명을 현재의 넥센타이어로 변경했다. 타이어 산업 성장에 대한 강 회장의 예견은 적중했다. 넥센타이어의 매출은 2000년 2064억원에서 2010년 1조원을 넘어섰고, 2016년에는 1조8947억원을 기록했다. 올해는 2조원을 바라보고 있다. 강 회장은 성공 비결로 마음을 비우는 것이 중요하다고 강조한다. 그는 마음을 비우면 모든 일이 잘된다는 뜻을 지닌 ‘심청사달(心凊事達)’이란 말을 항상 마음에 새긴다. 강 회장은 가끔 골프를 즐기는데, 사업이 골프와 같아 너무 서둘러도 안되고, 잘났다고 으스대도 안된다고 말한다. “골프를 칠 때는 낮은 자세로 마음을 비우고 쳐야 점수가 잘 나온다. 그래서 ‘천고마비(천천히, 고개를 들지 말고, 마음을 비운다)’ 타법이라 이름을 지었다. 기업을 경영하는 것도 마찬가지라 생각한다. [박용선 기자] chosunbiz.com 조선비즈 관련뉴스해당 언론사에서 선정하며 언론사 페이지(아웃링크)로 이동해 볼 수 있습니다.포르셰 경영진 감동…유럽이 반한 한국산 타이어전지현 키운 큰손, 어쩌다…연예계 '충격'""文 대통령 감사"" 앉아서 4천억 번 최태원한치 앞 모르고…제주에 투자한 사람들 후회막심회장 구설수·가짜 홍삼…천호식품, 결국"
뉴시스,002350,/news/news_read.nhn?article_id=0007039263&office_id=003&mode=search&query=넥센타이어&page=53,2016-02-15 11:58,농협&middot;넥센타이어 우리농산물 소비촉진 업무협약,【서울=뉴시스】박진희 기자 = 15일 오전 서울 중구 농협중앙회 본관에서 농협중앙회 이상욱(오른쪽 세번째) 농업경제대표이사와 넥센타이어 강호찬(왼쪽 세번째) 대표이사사장 등이 우리 농산물 소비촉진과 사회공헌 확대를 위한 업무협약을 체결하고 있다. 농협과 넥센타이어는 향후 ▲농산물 소비촉진을 위한 상생마케팅 실시 ▲농산물 기부 및 농촌봉사활동 등 우리 농산물을 통한 사회공헌 활동 ▲대한민국 토종 타이어 소비촉진 공동 프로모션 전개 등 농산물 소비촉진과 내수경제 활성화를 위한 다양한 상생협력 사업을 추진하게 된다. 2016.02.15.
매경이코노미,002350,/news/news_read.nhn?article_id=0000053480&office_id=024&mode=search&query=넥센타이어&page=45,2016-07-05 15:22,넥센타이어 | &lsquo;2016 스피드레이싱 3라운드&rsquo; 개최,"넥센타이어가 후원하는 ‘2016 넥센타이어 스피드레이싱 엔페라컵 3라운드’가 강원도 인제군에 위치한 인제스피디움에서 성황리에 막을 내렸다. 넥센타이어 스피드레이싱은 승용차량과 RV(레저용) 차량이 모두 참가하는 국내 최대 규모의 모터스포츠 대회다. 자동차 동호회 회원을 대상으로 서킷 체험 주행과 택시 체험 이벤트가 진행됐다. 대회장을 찾은 관람객에게는 레이싱 모델 포토타임, 피트스톱 챌린지, 푸드트럭존을 운영해 다채로운 볼거리와 즐길거리를 제공했다. 또한, 여름철을 맞아 가족 단위 관람객들을 위해 어린이용 에어바운스 풀장을 운영해 큰 호응을 샀다. 이 밖에도 남녀노소 모두 참여할 수 있는 세발자전거 레이스를 통해 가족 모두가 즐길 수 있는 대회였다는 평가다. [본 기사는 매경이코노미 제1865호 (2016.07.06~07.12일자) 기사입니다] r_start // r_end // r_start // r_end //"
