source,symbol,link,date,title,content
이데일리,002350,/news/news_read.nhn?article_id=0004118898&office_id=018&mode=search&query=넥센타이어&page=4,2018-06-05 10:19,"넥센타이어, 넥스트레벨 신규고객에 마블 공기청정기 증정","[이데일리 피용익 기자] 넥센타이어(002350)는 타이어 렌탈 서비스인 ‘넥스트레벨’ 신규 고객을 대상으로 사은 이벤트를 시행한다고 5일 밝혔다. 이번 이벤트는 오는 30일까지 진행되며, 넥센타이어 4개를 렌탈서비스로 이용하는 신규 고객 전원에게 마블 공기청정기(차량·실내 겸용)를 증정한다. 넥스트레벨은 타이어 4개를 렌탈할 경우 정기적인 타이어 점검 및 차량 관리를 제공 받을 수 있는 서비스다. 마모나 파손 시에는 타이어 2개 또는 엔진오일 2회 무상교체를 받을 수 있다. 월 2500원을 추가할 경우에는 두 가지 혜택을 모두 받을 수 있다. 또한 6개월마다 타이어 관리 전문가가 직접 방문해 타이어 마모 상태, 향균 탈취 등 차량 10대 항목을 정기 점검하며, 타이어테크와 렌탈 전문점에서 타이어 위치 교환 및 휠 얼라이먼트 무상 교정의 서비스를 제공한다. 넥스트레벨 신규 가입은 전국 타이어테크와 렌탈 전문점을 통해 가능하며, 5일 홈앤쇼핑과 11일 CJ오쇼핑 생방송을 통해서도 할 수 있다. 이벤트에 관한 자세한 내용은 넥스트레벨 홈페이지를 통해 확인 할 수 있다."
뉴시스,002350,/news/news_read.nhn?article_id=0008635156&office_id=003&mode=search&query=넥센타이어&page=4,2018-06-05 10:37,"넥센타이어, 타이어렌탈 서비스 신규 고객 대상 이벤트","넥스트레벨, 정기 타이어 점검 및 차량 관리 제공 서비스오는 30일까지 넥스트레벨 신규 고객 대상 공기청정기 증정 【서울=뉴시스】한주홍 기자 = 넥센타이어가 타이어 렌탈 서비스인 '넥스트레벨' 신규 고객을 대상으로 사은 이벤트를 시행한다고 5일 밝혔다. 넥센타이어 4개를 렌탈서비스로 이용하는 신규 고객 전원에게 공기청정기를 증정한다. 이번 이벤트는 오는 30일까지 진행된다. 넥스트레벨은 타이어 4개를 렌탈할 경우 정기적인 타이어 점검 및 차량 관리를 제공받을 수 있는 서비스다. 마모나 파손 시에 타이어 2개 또는 엔진오일 2회 무상교체 받을 수 있다. 또 6개월마다 타이어 관리 전문가가 직접 방문해 타이어 마모 상태, 향균 탈취 등 차량 10대 항목을 점검해준다."
서울경제,002350,/news/news_read.nhn?article_id=0003320521&office_id=011&mode=search&query=넥센타이어&page=4,2018-06-12 10:53,&lsquo;2018 넥센타이어 스피드레이싱&rsquo; 3라운드 인제 스피디움에서 17일 개최,"[서울경제] 넥센타이어(002350) 가 후원하는 ‘2018 넥센타이어 스피드레이싱’ 3라운드가 오는 17일 강원도 인제군 인제스피디움에서 개최된다. 넥센타이어 스피드레이싱은 국내에서 유일하게 승용차량과 RV차량이 모두 참가하는 국내 최대 규모의 레이싱 대회다. 이번 3라운드에서는 10개 동호회 차량 400여대를 초청하여, 동호회 회원을 대상으로 서킷 체험주행 프로그램이 운영된다. 모델 포토타임, 빠른 시간 내에 타이어를 교체하는 피트스탑 챌린지, RC카(무선 조종 자동차) 레이스, 세발자전거 레이스 등 다채로운 볼거리와 즐길 거리도 있다. 경기는 당일 오후 1시부터 3시까지 네이버 스포츠를 통해 생중계되며, 23일 SBS스포츠 채널에서도 녹화 중계가 예정돼 있다 총 6라운드로 진행되는 2018 넥센타이어 스피드레이싱은 이번 라운드 이후, 7월 14일 인제 스피디움에서 4라운드가 개최된다."
이데일리,002350,/news/news_read.nhn?article_id=0003932344&office_id=018&mode=search&query=넥센타이어&page=17,2017-09-26 10:30,"넥센타이어, 추석맞이 고속도로 타이어 무상 점검","[이데일리 김보경 기자] 넥센타이어(002350)는 민족 대이동이 시작되는 추석을 맞이하여 고속도로 타이어 무상점검 캠페인을 9월 30일부터 10월 2일까지 진행한다고 26일 밝혔다. 이번 캠페인은 9월 30일부터 10월 2일까지 사흘간 경부고속도로 망향휴게소(부산 방향), 중부내륙고속도로 선산휴게소(마산 방향)에서 진행되며, 10월 1일부터 2일까지는 호남고속도로 여산휴게소(순천 방향), 중앙고속도로 동명휴게소(부산 방향)에서 실시된다. 타이어 관리 전문 인력과 2.5t, 3.5t의 모바일 점검 차량이 투입돼 타이어 공기압과 마모 상태 등을 확인하고, 워셔액 보충, 차량 실내 소독 등의 서비스를 무상으로 제공 한다. 장착된 타이어 제조업체와 관계없이 모든 타이어의 안전 점검을 받을 수 있으며, 방문 고객에게는 소정의 기념품 3종 세트를 증정한다."
이데일리,002350,/news/news_read.nhn?article_id=0004124094&office_id=018&mode=search&query=넥센타이어&page=4,2018-06-12 15:32,&lsquo;2018 넥센타이어 스피드레이싱&rsquo; 3라운드 17일 개최,"[이데일리 피용익 기자] 넥센타이어(002350)는 ‘2018 넥센타이어 스피드레이싱’ 3라운드가 오는 17일 인제군 인제스피디움에서 개최된다고 12일 밝혔다. 이번 3라운드에서는 10개 동호회 차량 400여대를 초청해 동호회 회원을 대상으로 서킷 체험주행 프로그램이 운영된다. 또 대회장을 찾은 관람객을 대상으로 모델 포토타임, 빠른 시간 내에 타이어를 교체하는 피트스탑 챌린지, RC카(무선 조종 자동차) 레이스, 세발자전거 레이스 등을 진행한다. 아울러 가족단위 관람객들을 위해 운영하는 어린이용 에어바운스 풀장은 개인 수영복을 지참하면 자유롭게 이용할 수 있다. 이 외에도 월드컵 시즌을 맞아 축구 이벤트, 페이스페인팅, 네일아트, 캐리커쳐 등 이벤트가 마련됐다. 경기는 오후 1시부터 3시까지 네이버 스포츠를 통해 생중계되며, 23일 SBS스포츠 채널에서도 녹화 중계된다. 총 6라운드로 진행되는 2018 넥센타이어 스피드레이싱은 이번 라운드 이후 7월14일 인제 스피디움에서 4라운드가 개최된다."
뉴시스,002350,/news/news_read.nhn?article_id=0008665108&office_id=003&mode=search&query=넥센타이어&page=4,2018-06-21 10:05,"넥센타이어, 22일 고척돔구장서 '넥센타이어 데이'","고객 초청·관람객 대상 다양한 현장 이벤트 【서울=뉴시스】 박주연 기자 = 넥센타이어가 오는 22일 고척스카이돔에서 열리는 KBO리그 넥센히어로즈와 기아 타이거즈와의 경기에서 '넥센타이어 데이' 행사를 개최한다. 넥센타이어는 타이어 렌탈 서비스 '넥스트레벨' 이용 고객과 페이스북 이벤트를 통해 선정된 고객 500명을 초청한다. 일반 관람객이 참여 할 수 있는 다양한 현장 이벤트도 마련됐다. 초청된 고객 전원에게는 고척스카이돔 관람 입장권과 야구모자, 응원봉, 사은품 등이 제공된다. 경기 중에는 관람객을 대상으로 전광판 퀴즈 이벤트가 시행되며, 클리닝 타임에는 타이어 굴리기 게임 등을 통해 백화점상품권, 외식상품권, 영화관람권 등 다양한 사은품이 증정된다. 고척스카이돔 외부 보행광장에 마련한 행사 부스에서는 일반 관람객을 대상으로 레이싱 모델, 턱돌이와 함께하는 포토타임 이벤트가 진행되며, 구속측정 게임등을 통해 사은품을 증정하는 이벤트가 이뤄질 예정이다. 넥센타이어 한국지역담당 박강철 전무는 ""신개념 타이어 렌탈서비스인 '넥스트레벨' 고객을 초청해 사후 서비스에도 심혈을 기울이는 한 차원 높은 고객서비스를 제공할 계획""이라며 ""앞으로도 고객들에게 더 많은 혜택과 즐거움을 선사할 수 있는 참여형 이벤트를 확대해 나가겠다""고 전했다."
이데일리,002350,/news/news_read.nhn?article_id=0004133920&office_id=018&mode=search&query=넥센타이어&page=4,2018-06-25 09:52,"넥센타이어, 고속도로 타이어 무상점검 캠페인","[이데일리 피용익 기자] 넥센타이어(002350)는 오는 28일부터 30일까지 고속도로 타이어 무상점검 캠페인을 진행한다고 25일 밝혔다. 이번 캠페인은 영동고속도로 횡성휴게소(강릉 방향), 경부고속도로 칠곡휴게소(부산 방향)에서 진행된다. 타이어 관리 전문 인력과 3.5t, 2.5t의 모바일 점검 차량이 투입돼 타이어 공기압과 마모 상태 등을 확인하고, 워셔액 보충, 차량 실내 소독 등의 서비스를 무상으로 제공한다. 장착된 타이어 제조업체와 관계없이 모든 타이어의 안전 점검을 받을 수 있으며, 방문 고객에게는 기념품 3종 세트인 물 티슈, 수건 그리고 차량용 미니 디퓨저를 증정한다."
조세일보,002350,/news/news_read.nhn?article_id=0002169714&office_id=123&mode=search&query=넥센타이어&page=17,2017-09-18 17:03,"넥센타이어, 스코다&middot;세아트에 신차용 타이어 '엔블루 HD 플러스' 제품 공급","넥센타이어(대표이사 강호찬)가 글로벌 완성차 업체인 스코다와 세아트 차량에 신차용 타이어로 '엔블루(N'blue) HD Plus'를 공급한다고 18일 밝혔다. '엔블루 HD Plus'는 최근 폭스바겐의 '폴로' 신형과 '티록'에도 신차용 타이어로 공급된다. 독일의 권위있는 자동차 전문 잡지에서 실시한 여름용 타이어 종합 성능 평가에서 젖은 노면에서의 핸들링과 브레이킹 성능이 뛰어난 제품으로 평가 받은 바 있다. 먼저, 체코의 완성차 업체인 스코다의 두 차량에 '엔블루 HD Plus'가 장착된다. 스코다의 플래그쉽이자 생산 차종 중 최상위 모델인 '수퍼브'와 대표 SUV 차량인 '예티'의 후속 모델인 '카록'에 공급된다. 또한, 스페인의 유일한 자동차 제조사인 세아트에도 '엔블루 HD Plus'가 공급된다. 세아트를 대표하는 스테디셀링 해치백 차종인 '이비자' 신형과 세아트 최초의 SUV 차종인 '아테카'에도 공급되며 이는 성장중인 유럽 SUV 시장을 겨냥한 차종이다. 넥센타이어는 2012년부터 글로벌 자동차 업체로의 제품 공급을 지속적으로 해오고 있으며, 향후 북미와 유럽 시장에서의 신차용 타이어 공급 확대를 통해 회사의 브랜드 인지도를 더욱 높여나갈 계획이다."
아시아경제,002350,/news/news_read.nhn?article_id=0004264348&office_id=277&mode=search&query=넥센타이어&page=3,2018-06-25 10:01,"넥센타이어, 고속도로 무상점검 캠페인 실시","[아시아경제 김지희 수습기자]넥센타이어는 오는 28일부터 30일까지 고속도로 타이어 무상점검 캠페인을 진행한다고 25일 밝혔다. 이번 캠페인은 영동고속도로 횡성휴게소(강릉 방향)와 경부고속도로 칠곡휴게소(부산 방향) 두 곳에서 실시한다. 전문 인력이 타이어 공기압과 마모 상태 등을 확인하고 워셔액 보충, 차량 실내 소독 등의 서비스도 무상으로 제공한다. 제조업체와 관계없이 모든 타이어에 대해 안전 점검을 받을 수 있다. 물 티슈와 수건, 차량용 미니 디퓨저 등 기념품도 제공된다. 넥센타이어는 올해 전국 고속도로 휴게소에서 11차례 타이어 무상점검을 실시할 계획이다."
뉴시스,002350,/news/news_read.nhn?article_id=0008671181&office_id=003&mode=search&query=넥센타이어&page=3,2018-06-25 10:16,"넥센타이어, 28일부터 사흘간 고속도로 타이어 무상점검","영동고속도로 횡성휴게소(강릉 방향)·경부고속도로 칠곡휴게소(부산 방향)서 진행타이어 관리 전문 인력 투입…타이어 공기압·마모 상태 등 확인 【서울=뉴시스】한주홍 기자 = 넥센타이어가 오는 28일부터 30일까지 사흘간 고속도로 타이어 무상점검 캠페인을 진행한다고 25일 밝혔다. 이번 캠페인은 ▲영동고속도로 횡성휴게소(강릉 방향) ▲경부고속도로 칠곡휴게소(부산 방향) 총 2곳에서 진행한다. 타이어 관리 전문 인력과 3.5톤, 2.5톤의 모바일 점검 차량이 투입돼 타이어 공기압과 마모 상태 등을 확인하고 워셔액 보충, 차량 실내 소독 등의 서비스를 무상으로 제공할 예정이다. 장착된 타이어 제조사와 관계 없이 모든 타이어의 안전 점검을 받을 수 있으며 방문 고객에게는 기념품도 증정한다. 한편 넥센타이어는 올해 전국 고속도로 휴게소에서 총 11회의 타이어 무상점검을 진행할 계획이다."
머니투데이,002350,/news/news_read.nhn?article_id=0003933262&office_id=008&mode=search&query=넥센타이어&page=18,2017-09-11 16:50,"넥센타이어, 폭스바겐 '신형 폴로&middot;티록'에 신차용 타이어 공급","[머니투데이 장시복 기자] ['폴로' 신형과 소형 SUV '티록'에 넥센타이어 엔블루 HD Plus 장착] 넥센타이어 엔블루 HD 플러스/사진제공=넥센타이어 넥센타이어(대표 강호찬)가 글로벌 완성차 업체인 독일 폭스바겐의 2개 차종에 신차용 타이어(OE)를 공급한다고 11일 밝혔다. 폭스바겐의 베스트셀링 차종인 '폴로' 신형 모델과 새 소형 SUV(다목적스포츠차량)인 '티록'에도 넥센타이어의 '엔블루 HD 플러스' 제품이 탑재된다. 스페인 팜플로나에서 생산되는 폴로 신형은 폭스바겐의 대표 소형 해치백 차종이다. 티록은 2014년 제네바모터쇼에서 콘셉트카로 첫 선을 보였으며, 포르투갈의 세투발 지역에서 만들어진다."
뉴시스,002350,/news/news_read.nhn?article_id=0008675595&office_id=003&mode=search&query=넥센타이어&page=3,2018-06-27 11:38,"넥센타이어, '글로벌고객만족도' 타이어 부문 9연속 1위 달성","【부산=뉴시스】 제갈수만 기자 = 넥센타이어가 글로벌경영협회가 주관하는 ‘2018 글로벌 고객만족 역량 평가제도(이하 GCSI)' 조사에서 타이어 부문 9년 연속 1위에 선정됐다고 27일 밝혔다. 올해 14회를 맞는 GCSI는 산업통상자원부 산하 연구평가기관인 사단법인 글로벌경영협회가, 글로벌 고객만족경영에 대한 인식과 글로벌 산업경쟁력 지표 제공을 통해 수준 높은 고객만족 경영을 지원하기 위해 제정한 평가제도이다. 2018.06.27. (사진= 넥센타이어 제공)"
뉴시스,002350,/news/news_read.nhn?article_id=0008675438&office_id=003&mode=search&query=넥센타이어&page=3,2018-06-27 10:42,넥센타이어 '글로벌고객만족도' 9년 연속 1위,"업계 최초 타이어 렌탈서비스 시행지속적 고객 만족 프로그램 전개 【서울=뉴시스】 박주연 기자 = 넥센타이어가 글로벌경영협회가 주관하는 2018 글로벌 고객만족 역량 평가제도(GCSI) 조사에서 타이어 부문 9년 연속 1위로 선정됐다. 27일 넥센타이어에 따르면 올해로 14회를 맞는 GCSI는 산업통상자원부 산하 연구평가기관 글로벌경영협회가 글로벌 산업경쟁력 지표 제공을 통해 보다 수준 높은 고객 만족 경영을 지원하기 위해 제정한 평가제도다. 이번 평가는 지난 4월부터 3주간 서울시와 6대 광역시를 중심으로 온라인 조사 방식으로 진행됐다. 이번 조사의 유효 표본은 10만2000여명으로, 평가 항목은 고객만족 요소, 고객 가치, 글로벌 역량, 충성도 등이다. 넥센타이어는 업계 최초 렌탈 서비스 '넥스트레벨'을 시행, 긍정적 평가를 받았다. '넥스트레벨'은 타이어를 렌탈할 경우 정기적인 타이어 점검, 차량 10대 항목 관리를 제공하는 서비스다. 타이어 4개를 렌탈할 경우에는 마모나 파손시 타이어 2개 무상 교체 또는 엔진오일 2회 무료 서비스를 제공하고 있다. 넥센타이어는 최고급 제품인 '엔페라 AU7', '엔페라 AU5'와 '엔페라 RU5'에 고객의 과실에도 타이어를 교환해주는'신 명품보증제도'를 도입하고 있다. 아울러 타사 타이어 장착 고객에게도 전국 고속도로 휴게소, 자동차 검사소 등에서 타이어 무상점검 서비스를 제공하고, 소외지역·사회복지기관과 연계해 해당 서비스를 진행하며 사회적 기업으로서의 역할을 다하고 있다."
서울경제,002350,/news/news_read.nhn?article_id=0003110195&office_id=011&mode=search&query=넥센타이어&page=18,2017-09-11 18:24,"넥센타이어, 폭스바겐에 신차용 타이어 공급",폴로에 '엔블루 HD 플러스' 장착 [서울경제] 넥센타이어(002350)는 독일 폭스바겐 2차종에 신차용 타이어(OE)를 공급한다고 11일 밝혔다. 폭스바겐의 베스트셀링 소형차 ‘폴로’ 신형에는 넥센타이어의 ‘엔블루 HD 플러스’ 제품이 장착된다. 신형 콤팩트 SUV 차량인 ‘티록’에도 ‘엔블루 HD 플러스’가 공급된다. 강호찬 넥센타이어 대표는 “폭스바겐의 품질기준을 만족시키며 타이어 공급을 진행하게 된 것은 회사의 품질과 기술력에 대한 노력의 결과”라고 말했다.
이데일리,002350,/news/news_read.nhn?article_id=0004135565&office_id=018&mode=search&query=넥센타이어&page=3,2018-06-27 09:43,"넥센타이어, &lsquo;글로벌 고객 만족도&rsquo; 9년 연속 1위","[이데일리 피용익 기자] 넥센타이어(002350)는 글로벌경영협회가 주관하는 ‘2018 글로벌 고객만족 역량 평가제도(GCSI)’ 조사에서 타이어 부문 9년 연속 1위에 선정됐다고 27일 밝혔다. 이번 평가는 지난 4월부터 3주 간 서울시 및 6대 광역시를 중심으로 온라인 조사 방식으로 진행됐다. 유효 표본은 10만2000여명이며, 평가 항목은 고객만족 요소, 고객 가치, 글로벌 역량, 충성도 등으로 구성됐다. 넥센타이어는 업계 최초 렌탈 서비스인 ‘넥스트레벨’을 시행하고 있다. 또한 안전운전을 위해 고객의 과실에도 타이어를 교환해주는 ‘신(新)명품보증제도’를 최고급 제품인 엔페라 AU7, 엔페라 AU5, 엔페라 RU5에 도입했다. 이와 함께 전국 고속도로 휴게소, 자동차 검사소 등에서 타이어 무상점검 서비스를 제공하고 있다. 배순훈 글로벌경영협회장(왼쪽)과 이일희 넥센타이어 글로벌품질센터 고객만족팀장이 중국 상하이에서 열린 ‘2018 글로벌 고객만족도 조사(GCSI)’시상식에서 기념촬영을 하고 있다. (사진=넥센타이어)"
아시아경제,002350,/news/news_read.nhn?article_id=0004265894&office_id=277&mode=search&query=넥센타이어&page=3,2018-06-27 09:41,"넥센타이어, &lsquo;글로벌고객만족도&rsquo; 타이어 부문 9년 연속 1위","넥센타이어는 글로벌경영협회가 주관하는 ‘2018 글로벌 고객만족 역량 평가제도’ 조사에서 타이어 부문 9년 연속 1위에 선정됐다고 27일 밝혔다. (왼쪽부터) 글로벌경영협회 배순훈 회장, 넥센타이어 글로벌품질센터 고객만족팀 이일희팀장이 시상식 후 기념촬영을 하고 있다. [아시아경제 이정민 기자] 넥센타이어는 글로벌경영협회가 주관하는 ‘2018 글로벌 고객만족 역량 평가제도(이하 GCSI)’ 조사에서 타이어 부문 9년 연속 1위에 선정됐다고 27일 밝혔다. 올해 14회를 맞는 GCSI는 산업통상자원부 산하 연구평가기관인 사단법인 글로벌경영협회가 기업들의 고객만족 경영을 지원하기 위해 제정한 평가제도다. 이번 평가는 지난 4월부터 3주간 서울시 및 6대 광역시를 중심으로 온라인 조사 방식으로 진행됐다. 조사의 유효 표본은 10만2000여명으로 고객만족 요소, 고객 가치, 글로벌 역량, 충성도 등을 평가했다.  넥센타이어는 타이어 부문에서 최고 평가를 받았다.  넥센타이어는 업계 최초 렌탈 서비스인 ‘넥스트레벨’을 시행하고 있다. ‘넥스트레벨’은 타이어를 렌탈 할 경우 정기적인 타이어 점검, 차량 10대 항목 관리를 비롯해 타이어 4개를 렌탈 할 경우 마모나 파손시에 타이어 2개 무상 교체 또는 엔진오일 2회 무료 서비스를 제공하고 있다. 매년 안전 운전을 위해 넥센타이어 장착 고객뿐만이 아니라 타사 타이어 장착 고객에게도 전국 고속도로 휴게소, 자동차 검사소 등에서 타이어 무상점검 서비스를 제공하고 있으며 소외지역, 사회복지기관과 연계하여 해당 서비스를 진행하며 사회적 역할을 하고 있다. 올해 4월에는 유럽에서 높은 영향력을 자랑하는 독일 자동차 전문지인 ‘아데아체 모터벨트’에서 실시한 ‘4계절용 타이어 성능테스트’에서 1위를 차지하며 제품의 품질에 대한 만족도도 높여가고 있다."
머니투데이,002350,/news/news_read.nhn?article_id=0004059029&office_id=008&mode=search&query=넥센타이어&page=4,2018-05-31 15:10,"넥센, 넥센타이어 9만4000주 장내 매수",[머니투데이 오정은 기자] 넥센은 지난 25일 넥센타이어 9만4000주를 장내매수 했다고 공시했다. 취득 단가는 1만2347원이다. 넥센은 넥센타이어의 사실상 지배주주다.
매경이코노미,002350,/news/news_read.nhn?article_id=0000059763&office_id=024&mode=search&query=넥센타이어&page=3,2018-06-26 11:26,넥센타이어 | 英 프로축구 사상 최초 &lsquo;슬리브 마케팅&rsquo;으로 대박,"영국 프로축구 리그인 ‘프리미어리그(EPL)’ 스폰서십 마케팅 효과를 톡톡히 보는 국내 기업들이 늘어나고 있다. 최근 리그 우승에 성공한 구단 ‘맨체스터 시티 FC(이하 맨시티)’를 후원하고 있는 넥센타이어가 대표적이다. 넥센타이어는 지난 2015년 8월 맨시티와의 첫 후원 계약 이래 전방위적인 마케팅 활동을 해왔다. 지난해 3월에는 맨시티 유니폼의 소매에 회사 로고 노출을 포함하는 확대 계약을 신규 체결하고 기존 후원 계약도 3년 연장하며 맨시티의 주요 후원사로서 자리매김하게 됐다. 넥센타이어는 지난 2017~2018 시즌부터 새롭게 도입된 선수 유니폼 소매 부분 로고 부착 방식의 스폰서십 계약을 체결. 일명 ‘슬리브 마케팅(Sleeve marketing)’이라 불리는 이 후원 계약은 리그 스폰서 로고 이외 기존에 비어 있었던 선수 유니폼 왼쪽 소매 부분에 스폰서 기업 로고를 새기는 방식이다. 넥센타이어는 EPL에서 슬리브 마케팅을 시작한다는 소식을 듣고 곧바로 맨시티 측과 해당 후원 내용을 추가해 파트너십 계약을 업그레이드했다. 리그 역사상 처음으로 시도되는 스폰서십 방식이었지만 그 성장 가능성을 간파한 넥센타이어가 발 빠르게 움직인 것. 덕분에 넥센타이어는 EPL리그 역사상 최초 슬리브 마케팅을 시작한 기업으로 이름을 올리게 됐다. 넥센타이어가 후원을 시작한 지난 2017~2018 시즌에 맨시티는 FA컵과 리그 우승을 동시 석권했으며 역대 가장 빠른 우승 확정, 최다 승점, 최다 득점 등 무수한 리그 기록들을 갈아치웠다. 넥센타이어는 오는 9월경 체코에 유럽 공장 준공을 계기로 유럽 시장 리더십 강화를 꾀하고 있다. 더불어 맨시티와의 파트너십을 마케팅 플랫폼으로 적극 활용한 유럽 내 비즈니스 확충을 목표로 삼았다. r_start // r_end // r_start // r_end //"
서울경제,002350,/news/news_read.nhn?article_id=0003331707&office_id=011&mode=search&query=넥센타이어&page=3,2018-06-26 08:56,"넥센타이어, 이익 비중 높은 美 시장 경쟁 치열&middot;&middot;&middot;목표주가&darr; - 한국투자증권","[서울경제] 한국투자증권은 넥센타이어(002350) 에 대해 26일 “이익 비중이 높은 미국 시장의 경쟁이 심화되고 있다”며 목표주가를 1만5,500원에서 1만4,000원으로 10% 하향 조정했다. 투자의견 매수는 유지했다. 김진우 애널리스트는 “미국은 주행거리의 꾸준한 확대에도 불구하고 타이어 수요는 부진한 상황”이라며 “특히 2015년 7월 중국산 수입타이어에 관세를 부과한 이후 중국산 수입은 줄었으나 동남아산 수입이 늘고 있다”고 분석했다. 그는 “중국 내 설비증설 계획이 줄고 미국 내 설비가 늘어나면서 전체적인 미국시장의 공급이 중국산 관세부과 이후 오히려 늘어났다”며 “미국은 넥센타이어 매출의 28%를 차지하며 이익의 40% 이상을 기여하는 시장”이라고 설명했다. 그는 “주당 순이익(EPS)을 올해 5.7%, 내년 14.5% 하향 조정했다”며 “다만 체코공장 신설로 2019년 매출이 처음으로 2조원을 돌파하는 등 중장기 성장 동력은 확보할 전망”이라고 예상했다."
