source,symbol,link,date,title,content
머니투데이,003560,/news/news_read.nhn?article_id=0003651222&office_id=008&mode=search&query=IHQ&page=1,2016-03-22 08:45,"IHQ, '태후' 잇는 '함부로 애틋하게' 기대-키움證","[머니투데이 김유경 기자] 키움증권은 22일 IHQ에 대해 소속 대표 배우 김우빈이 출연하는 100% 사전제작 드라마 '함부로 애틋하게'를 공동 제작해 중국시장 진출이 본격화되면서 올해 매니지먼트 매출이 전년대비 70% 증가한 343억원이 될 것이라고 예상했다. 투자의견과 목표주가는 제시하지 않았다. 홍정표 키움증권 연구원은 ""6월부터 한국과 중국에 동시 방영될 '함부로 애틋하게'는 한류배우(김우빈, 수지), 스타작가(이경희) 조합으로 흥행기대감이 높다""며 ""저작권을 제작사가 공동 보유하고 있어 부가판권 시장에서 높은 수익 실현을 기대할 수 있다""고 말했다. 자회사 가지컨텐츠에서 OST를 자체 제작해 음원 관련 수익도 기대되며, 드라마 흥행으로 한국과 중국에서 주연배우의 광고활동도 늘어날 것으로 기대했다. 올해 매출액은 전년 대비 18.3% 증가한 1257억원, 영업이익은 95.9% 증가한 145억원을 기록할 것으로 예상했다. 올해부터 연간 미디어 사업의 실적 안정성을 기반으로 구조조정 효과가 본격화되고, 하반기부터는 제작과 매니지먼트 사업 매출이 크게 증가할 것으로 예상했다. textlinktopstart textlinktopend textlinkstart"
한국경제,003560,/news/news_read.nhn?article_id=0003853787&office_id=015&mode=search&query=IHQ&page=1,2017-11-21 10:03,IHQ &quot;최대주주가 지분매각 검토 중&quot;,"IHQ는 21일 최대주주 지분 매각 추진설에 대한 조회공시 답변을 통해서 ""최대주주인 딜라이브에 확인한 결과 IHQ 지분매각 방안 등을 검토 중에 있다""며 ""다만 현재까지 이와 관련해 구체적으로 확정된 사항은 없다""고 밝혔다."
헤럴드경제,003560,/news/news_read.nhn?article_id=0001046942&office_id=016&mode=search&query=IHQ&page=1,2016-05-10 14:37,"IHQ, 1분기 영업익 10.4억 전년비 54.7%&darr;",[헤럴드경제=박영훈 기자] IHQ의 1분기 영업이익이 감소했다. IHQ는 연결재무제표 기준 1분기 영업이익이 10억4500만원으로 전년동기대비 54.7% 감소했다고10일공시했다. 같은 기간 매출액은 242억700만원으로 50.7% 늘어난 것으로 나타났다. 당기순이익은 5억8200만원으로 87.3% 감소한 것으로 집계됐다.
이데일리,003560,/news/news_read.nhn?article_id=0003539558&office_id=018&mode=search&query=IHQ&page=1,2016-05-10 14:42,"IHQ, Q1 영업익 16억&hellip;전년比 36.4% 감소","[이데일리 김태현 기자] IHQ(003560)는 2016년 1분기 영업이익이 약 16억원으로 전년동기 대비 36.4% 감소했다고 10일 공시했다. 매출은 약 217억원으로 같은 기간 51.5% 늘었다. 반면, 당기순이익은 약 13억원으로 지난해 1분기보다 23.9% 감소했다."
전자신문,003560,/news/news_read.nhn?article_id=0002665642&office_id=030&mode=search&query=IHQ&page=1,2017-12-11 14:55,[ET투자뉴스]IHQ_주요 투자주체는 개인투자자,"업종평균에 비해서 변동폭 대비 수익률은 긍정적 11일 오후 2시50분 현재 전일대비 6.12% 오른 2,600원을 기록하고 있는 IHQ는 지난 1개월간 17.65% 상승했다.  같은 기간동안 변동성의 크기를 말해주는 표준편차는 4.6%를 기록했다.  이는 코스피 업종내에서 주요종목들과 비교해볼 때 IHQ의 월간 주가수익률이 가장 높았던 만큼 변동성도 가장 높은 수준을 유지했다는 뜻이다.  최근 1개월을 기준으로 IHQ의 위험을 고려한 수익률은 3.8을 기록했는데, 변동성이 가장 높았기 때문에 위험대비 수익률은 다소 부진했다.   그러나 코스피업종의 위험대비수익률 -4.6보다는 높았기 때문에 업종대비 성과는 긍정적이라고 할 수 있다. 다음으로 업종과 시장을 비교해보면 IHQ가 속해 있는 코스피업종은 서비스업지수보다 변동성과 수익률이 모두 낮은 모습을 보여주고 있다.  다시 말해서 동업종의 탄력은 약한 반면 하락시에도 지수보다 낙폭이 작다는 의미이다.        표준편차 수익율  위험대비 수익율  IHQ 4.6% 17.7% 3.8  아세아 2.4% 12.5% 5.2  AJ네트웍스 2.3% 12.7% 5.5  현대에이치씨엔 1.8% 9.2% 5.1  동성코퍼레이션 0.9% -3.6% -3.9  서비스업 1.0% 0.5% 0.5  코스피 0.6% -2.8% -4.6    관련종목들 혼조세, 서비스업업종 +0.52%   이 시각 현재 관련종목들은 혼조세를 보이고 있으나 서비스업업종은 0.52% 상승중이다."
아시아경제,003560,/news/news_read.nhn?article_id=0003754234&office_id=277&mode=search&query=IHQ&page=1,2016-05-26 07:46,"[클릭 e종목] IHQ, 김우빈 인기가 주가 상승 견인차","[아시아경제 박선미 기자]교보증권은 26일 IHQ에 대해 드라마와 소속 배우의 인기 상승으로 꾸준히 실적이 증가하면서 높은 주가 상승을 경험할 것이라고 진단했다. 한국과 중국에 동시방영하는 두번째 드라마 ‘함부로 애틋하게’가 7월 6일 방영을 앞두고 있다. 이 드라마는 IHQ와 삼화네트웍스가 3 대 7의 비율로 공동제작했고, KBS2와 중국 최대 동영상 사이트인 유쿠투도우에 방영될 예정이다. 정유석 교보증권 연구원은 ""드라마 ‘함부로 애틋하게’가 오는 7월 6일 방영을 앞두고 있는데, 주연 배우(김우빈)가 소속돼 있는 엔터테인먼트 업체 IHQ에 관심을 가질 필요가 있다""면서 ""엔터테인먼트 업체이면서 과거 사례 를 바탕으로 비교 대상으로 삼을 수 있는 업체는 2013년 12월 방영한 ‘별에서 온 그대’의 주연이었던 김수현의 소속사인 키이스트가 적합하다""고 설명했다. 키이스트의 주가는 2013년 11월 최저점(1010원)부터 2014년 6월(4350원)을 거쳐 2015년 5월 최고점(6480원)까지 541.6% 상승한 바 있다. 김수현의 인기 급상승 후 소속사인 키이스트의 실적은 2013년 영업적자(매출액 619억원, 영업손실 4억원)에서 2014년 흑자전환(매출액 757억원, 영업이익 108억원)했고, 지난해(매출액 1062억원, 영업이익 74억원)에도 매출 성장세를 지속했다. 정 연구원은 ""중국에서 한류 연예인으로 톱스타 대열에 올라있는 이민호, 김수현 등의 연간 매출액은 500억~1000억원 수준인 것으로 파악하고 있다""며 ""한-중 동시 방영 두번째 드라마 ‘함부로 애틋하게’가 흥행하고 김우빈의 인기가 상승한다면 꾸준히 실적이 증가하면서 높은 주가 상승을 경험할 업체는 IHQ일 것""이라고 전했다."
한국경제,003560,/news/news_read.nhn?article_id=0003521473&office_id=015&mode=search&query=IHQ&page=1,2016-01-12 14:47,"IHQ, 유럽 최대 동영상 플랫폼과 파트너십 체결","[ 한민수 기자  ] IHQ는 유럽 최대 동영상 플랫폼 기업인 '데일리모션'과 파트너십 계약을 체결했다고 12일 밝혔다. 데일리모션은 한달 조회수 25억회, 방문자수 3억명에 달하는 유럽 최대 동영상 서비스 플랫폼이다. 유튜브에 이어 세계 2위 사업자다. IHQ는 데일리모션에 자체 제작한  미디어 콘텐츠를 지속적으로 서비스할 예정이다. 데일리모션은 이와 연계해 발생하는 광고 및 유료 콘텐츠 수익을 배분하기로 했다. IHQ는 글로벌 플랫폼 사업자와의 제휴를 통해 해외 시장 공략에 탄력을 받게 됐고, 미디어 콘텐츠를 통한 신규 수익 창출도 기대하고 있다. 데일리모션은 프랑스 비방디 그룹이 인수하면서 사업 영역 확장에 나서고 있다. 본격적인 한국 시장 진출을 목표로 IHQ와 파트너십 계약을 체결했다는 설명이다. 김봉주 IHQ 미디어부문 본부장은 ""앞으로도 국내 뿐 아니라 해외 시청자를 공략할 수 있는 수준 높은 콘텐츠 제작에 힘쓸 예정""이라며 ""이를 위해서 글로벌 사업자와의 제휴를 통한 공동 제작도 적극적으로 추진할 계획""이라고 말했다. 한민수 한경닷컴 기자"
이데일리,003560,/news/news_read.nhn?article_id=0003489225&office_id=018&mode=search&query=IHQ&page=1,2016-02-29 09:20,"[특징주]IHQ&middot;큐브엔터, 中자본 유치 추진 소식에 급등","[이데일리 유재희 기자] 큐브엔터와 모회사인 IHQ가 중국 자본 유치에 나섰다는 소식에 급등세다. 29일 오전 9시15분 현재 큐브엔터(182360)는 전일대비 12.36%(235원) 상승한 2135원, IHQ(003560)는 10.52%(200원) 오른 2100원에 거래되고 있다. 이날 한 언론보도를 통해 큐브엔터와 IHQ가 약 1000억원 규모의 중국자본 유치에 나섰다는 소식이 전해졌다. 경영권 외 지분을 팔고 엔터사업 시장확대를 위해 전략적 제휴를 체결한다는 내용이다."
머니투데이,003560,/news/news_read.nhn?article_id=0003902137&office_id=008&mode=search&query=IHQ&page=1,2017-07-12 03:00,[단독]딜라이브 분리매각 선회&hellip;IHQ 우선매각 검토,"[머니투데이 김세관 기자, 김은령 기자] [이달 말 분리 매각 여부 최종 결정…매각가 2000억~2500억 예상] 　딜라이브 매각이 몇 년째 공회전하는 가운데 채권단이 자회사를 먼저 매각, 차입금을 일부 상환하는 동시에 몸집을 줄여 매수자의 부담을 낮추는 방안을 추진한다. 　11일 관련업계에 따르면 딜라이브 대주주인 국민유선방송투자(KCI)와 채권단, 매각주관사인 삼일회계법인은 딜라이브 자회사 IHQ를 우선 매각하는 방안을 유력하게 검토하고 있다. 돈 되는 자회사 등 자산을 팔아 차입금을 일부 상환한 뒤 기업가치가 낮아진 딜라이브 전체 매각을 추진한다는 것. 　IHQ는 코미디TV, 드라맥스 등 6개 케이블채널을 운영하는 방송채널사용사업과 드라마·콘텐츠 제작 및 김우빈 김유정 김소현 장혁 등이 소속된 연예매니지먼트사업을 벌이는 딜라이브의 핵심 자회사다. 딜라이브가 지분 56%를 보유했다. 이를 전량 매각할 경우 경영권 프리미엄을 포함, 매각가격이 2000억원 안팎에 책정될 것으로 보인다. 지난해말 전략적 제휴를 위해 디즈니 자회사 A&E에 IHQ 지분 5%를 매각할 당시 기준가(주당 2500원)를 적용하면 매각 추정 가격은 2500억원까지 높아질 수 있다. 　올해 초까지만 해도 채권단 등은 딜라이브 전체 매각에 우선순위를 두되 어려울 경우 방송권역별(17개) 매각에 무게를 두고 내부 논의를 진행했다. 그러나 케이블TV산업 전체가 실적악화로 어려움을 겪고 있으며 방송사업자간 소유 겸영 규제, 정부의 SK텔레콤-CJ헬로비전 인수불허 방침에 따른 여파 등이 겹쳐 매수자를 찾기가 쉽지 않았다. 무엇보다 최대 2조원 규모로 추산되는 매각가격이 걸림돌로 작용했다. 때문에 잠재매수자들에겐 그다지 매력적이지 않은 자회사를 내다팔아 전체 매각금액을 줄이는 동시에 일부 차입금을 갚는 쪽으로 매각전략을 급선회한 것으로 보인다. 　딜라이브의 자회사 매각이 현실화하면 매각대금은 차입금(인수금융)을 상환하는 데 우선적으로 사용할 것으로 보인다. 현재 남아있는 딜라이브의 인수금융 대출은 약 4000억원이며 KCI의 인수금융 대출금은 약 1조4000억원이다. 채권단 등은 빠르면 이달말 자회사 분리 매각안을 비롯, 딜라이브 매각계획을 확정할 예정이다. textlinktopstart textlinktopend textlinkstart"
전자신문,003560,/news/news_read.nhn?article_id=0002653760&office_id=030&mode=search&query=IHQ&page=1,2017-11-02 15:47,"[ET투자뉴스]IHQ, &quot;K-Contents&hellip;&quot; 매수-HMC투자증권","HMC투자증권에서 2일 IHQ(003560)에 대해 ""K-Contents+A&amp;E 모멘텀+α가 기대된다""라며 투자의견을 '매수'로 제시하였고, 아울러 목표주가로는 2,600원을 내놓았다. HMC투자증권 유성만 애널리스트가 동종목에 대하여 이번에 제시한 '매수'의견은 HMC투자증권에서는 올해들어 처음 내놓는 매매의견이며 그리고 최근 분기내 발표된 전체 증권사 리포트의 컨센서스와 비교를 해볼 경우에 오늘 발표된 투자의견은 대체적으로 평균치에 해당하는 수준으로, 이번 의견은 동종목에 대한 전체적인 흐름에서 크게 벗어나지 않은 것으로 분석되고 있다. 또한 전일 종가 기준으로 볼때 동종목의 현주가는 이번에 제시된 목표가 대비 33.3%의 추가상승여력이 있다는 해석이 제시되고 있다."
뉴시스,003560,/news/news_read.nhn?article_id=0007243677&office_id=003&mode=search&query=IHQ&page=1,2016-05-23 10:10,"증권가, 제2 태양의 후예는?&hellip;NEW 이을 IHQ&middot;삼화&middot;YG '주목'","【서울=뉴시스】강세훈 기자 = 주식시장에서 제2의 '태양의 후예' 찾기가 분주한 모습이다. IHQ, 삼화네트웍스, 와이지엔터 등에 관심을 가질 필요가 있다는 분석이 나왔다. 흥국증권 최용식 연구원은 23일 ""최근 종영한 태양의 후예가 사전 제작하게 된 배경은 중국시장을 공략하기 위한 것으보 보인다""고 밝혔다. 그는 ""지난 2014년 '별에서 온 그대'로 중국 안방을 강타했지만, 인기 대비 한국 제작사 측의 수익은 크지 않았던 것은 중국의 시청자들이 한국에서 반영된 드라마를 블랙마켓에서 이미 시청을 해버림으로써 방영권은 물론이고 부가판권의 메리트가 없었다""고 설명했다. 최 연구원은 이어 ""태양의 후예 제작사 NEW는 이런 아킬레스건을 극복하고자 사전제작을 했고, 결과는 기대이었다""며 ""이제 또 다른 태양의 후예를 찾아야 할 때""라고 말했다. 그는 하반기 해외 합작 드라마 라인업으로 IHQ와 삼화넥트웍스가 공동제작해 한중 동시에 방영하는 드라마 '함부로 애틋하게'와 와이지엔터의 첫 드라마 '보보경심려'를 소개했다. 최 연구원은 ""IHQ와 삼화네트웍스는 김우빈, 수지 주연의 합작드라마를 최근 사전제작 완료해 7월 6일 KBS와 중국 유쿠투더우에서 동시 방영 할 예정""이라며 ""'미안하다 사랑한다' 작가인 이경희 작가가 집필한 작품으로 중국 방영 사전심의 단계에 있고, 중국 뿐 아니라 미국, 홍콩, 대만에서도 동시 방영될 것""이라고 밝혔다. 그는 ""중국 뿐만 아니라 기타 국가에서도 동시방영권을 팔 수 있다는 것은 한류드라마가 전 세계적으로 통할 수 있다는 긍정적 시그널로 해석된다""며 ""현재 중국 방영판권과 PPL로 총제작비 손익분기점을 소폭 초과한 것으로 추정된다""고 밝혔다. 최 연구원은 이어 ""와이지엔터는 2006년 중국에서 큰 인기를 얻었던 소설 '보보경심'을 드라마화 하는 작품을 오는 10월 한중 동시 방영할 예정""이라고 설명했다. 이준기, 아이유 주연의 사극 드라마다. 그는 이어 ""미국의 NBC 유니버셜에서 공동투자하며 첫 한국 드라마 투자작품이라는 데 의미가 있다""며 최근 한국 콘텐츠 제작 시장에 급격히 늘어난 중국자본의 투자볼륨에 대한 견제가 되는 긍정적 요인으로 보인다""고 밝혔다."
머니투데이,003560,/news/news_read.nhn?article_id=0003966029&office_id=008&mode=search&query=IHQ&page=1,2017-11-17 17:57,"[베스트리포트]IHQ, 콘텐츠 몸값 상승에 올라타자","[머니투데이 김주현 기자] 17일 머니투데이가 선정한 오늘의 베스트리포트는 김윤진 대신증권 연구원이 작성한 'IHQ, 콘텐츠 몸값 상승에 올라타자'입니다. 김 연구원은 드라마 제작사 IHQ에 대해 제작사 핵심 경쟁력인 자본력과 캐스팅, 브랜드, 글로벌 네트워킹을 모두 갖췄다고 평가했습니다. 또 기획 드라마 편당 가격이 3년만에 3배 상승한 것과 넷플릭스와 텐센트 등 글로벌 업체들이 한류 콘텐츠 소싱을 본격화했다는 점에서 IHQ가 IP(지적재산권) 기업으로 진화할 것으로 전망했습니다. 아울러 그는 올해 IHQ 영업이익이 지난해 대비 23% 증가한 138억원을 달성, 사상 최대이익을 낼 것이라고 예상했습니다. 실적 개선은 제작 라인업확대와 콘텐츠 가격 상승에 기인했다는 설명입니다. 이를 배경으로 김 연구원은 IHQ에 대해 투자의견 '매수'와 목표주가 3800원을 신규 제시했습니다. 다음은 보고서를 요약한 내용입니다. ☞보고서 원문 보기 넷플릭스가 글로벌 콘텐츠 소싱 경쟁을 촉발하고 있다. 2011년 콘텐츠 투자금액은 약 2조원이었는데 2017년 6조원 돌파, 2018년에는 8조원 이상을 계획하고 있다. 페이스북과 아마존 등도 콘텐츠 투자를 본격화하면서 글로벌 플랫폼 회사들의 콘텐츠 소싱 경쟁이 시작됐다. IHQ는 내년에 기획드라마 2~3편과 블록버스터 드라마 1~2편, 일반 드라마 5편 정도를 제작할 계획이다. 기획드라마 제작 핵심 요소는 자본력과, 캐스팅, 브랜드, 글로벌 네트워킹이다. 국내 제작사 가운데 이 요소를 모두 만족하는 곳은 스튜디오드래곤과 IHQ 등 소수에 불과하다. IHQ는 오랜 업력 덕에 탑클래스 캐스팅 능력을 가지고 있다. 내년을 시작으로 IP 라이브러리 확대가 본격화될 전망이다. IHQ는 사드 영향이 가장 심했던 올해 사상 최대 영업이익을 낼 것으로 예상된다. 예상 영업익은 지난해 보다 23% 늘어난 138억원이다. 제작 라인업이 확대되고 콘텐츠 가격이 상승한 덕이다. IHQ에 대해 투자의견 '매수'와 목표주가 3800원을 제시한다. 한류 붐을 타고 제작 산업에서도 2~3년 안에 대형 성공 사례가 나올 것으로 기대한다. 제작사 가치는 올라가고 있고, 중국과의 관계도 회복세가 기대된다는 점을 고려해 국내외 관련 업체 평균 PER(주당수익비율) 37배에서 20%를 할인한 30배를 적용했다."
아시아경제,003560,/news/news_read.nhn?article_id=0003679825&office_id=277&mode=search&query=IHQ&page=1,2016-02-02 11:21,"IHQ, 지난해 영업이익 124억&hellip;전년比 12.7%&darr;","[아시아경제 김민영 기자]IHQ는 별도 재무제표 기준 지난해 매출액은 931억원, 영업이익 124억원, 당기순이익 72억원을 기록했다고 2일 밝혔다. 매출액은 전년 대비 35.7% 증가했으나 영업이익과 당기순이익은 각각 12.7%, 3.4% 감소했다. 지난해 3월 합병하면서 매출 규모는 증가했으나 합병에 따른 일회성 비용 발생 등이 반영되며 연간 영업이익과 당기순이익이 줄었다. 사업부문별로는 미디어부문의 매출액이 710억원으로 3.5% 늘었다. 회사 측은  K STAR와 CUBE TV 등 신규 채널 런칭과 자체 제작 방송 프로그램 비중 이 증가했고 국내외 다양한 온라인·모바일 플랫폼에 방송 콘텐츠를 공급하면서 미디어부문 매출이 늘었다고 설명했다. 엔터부문은 221억원을 기록했다. 엔터부문은 합병 회계 처리로 인해 1분기 실적이 반영되지 않아 전년 대비 전체 매출은 감소했지만 조직 재정비를 통한 비용 효율화로 수익성이 개선됐다는 평가다. 특히 2016년에는 삼화네트웍스와 공동제작하고 김우빈, 수지가 출연한 드라마 ‘함부로 애틋하게’가 상반기 방영을 예정돼 있어 매니지먼트와 드라마 제작 부문에서 고르게 실적 개선이 이뤄질 것으로 기대하고 있다. 회사 관계자는 ""지난해 내부적으로 조직 통합과 양 사업부문간 시너지 극대화를 위한 기반을 마련하는데 많은 시간과 노력을 기울인 만큼, 2016년에는 콘텐츠 제작성과를 바탕으로 한 사업결실이 반드시 가시화 될 수 있을 것""이라고 말했다. 한편 지난해 4분기 매출액은 280억원으로, 전분기(218억원) 대비 28.2% 늘었다. 이 기간 영업이익은 35억원으로 102.4% 증가했다."
이데일리,003560,/news/news_read.nhn?article_id=0003504588&office_id=018&mode=search&query=IHQ&page=1,2016-03-22 07:19,"IHQ, 김우빈 주연 '함부로애틋하게' 흥행 기대-키움","[이데일리 임성영 기자] 키움증권은 IHQ(003560)에 대해 올해 미디어 사업 실적이 안정적으로 나타나는 가운데 ‘함부로 애틋하게’의 흥행으로 매니지먼트 사업 매출도 크게 늘면서 실적 개선을 이끌 것이라고 분석했다. 투자의견과 목표주가는 제시하지 않았다. 홍정표 키움증권 연구원은 22일 “6월부터 태양의 후예를 후속작 ‘함부로 애틋하게’가 방영된다”면서 “IHQ와 삼화네트웍스가 공동제작하고 소속 배우 김우빈이 출연하며 100% 사전제작돼 한국과 중국에 동시에 방영될 예정”이라고 말했다. 김우빈 수지 등 한류 배우와 스타작가 이경희의 조합으로 흥행에 대한 기대감이 높고 저작권을 제작사가 공동 보유하고 있어 부가판관 시장에서 높은 수익을 실현할 것이란 판단이다. 자회사 가지컨텐츠에서 오리지널사운드트랙(OST)을 자체 제작해 음원 관련 수익도 낼 것이란 설명이다. 홍 연구원은 “드라마 흥행은 주연배우의 인기로 이어지면서 중국과 한국에서 광고 활동이 늘어날 것”이라며 “올해 매니지먼트 매출은 전년대비 70% 증가한 343억원을 기록할 것”이라고 전망했다. 또한 그는 “보유한 6개 케이블 채널에 프로그램 자체 제작 비중을 지난해 37%에서 올해 50%까지 확대할 것”이라며 “채널 경쟁력 확대는 시청률 재고에 기여 할 전망”이라고 내다봤다. 프로그램 판매 수익은 지난해 37억원에서 올해 50% 이상 증가할 것으로 예상했다. 홍 연구원은 올해 연간 매출액은 전년대비 18.3% 증가한 1257억원, 영업이익은 95.9% 늘어난 145억원을 달성할 것으로 전망했다. 그는 “올해부터 연간 미디어 사업의 실적 안정성을 기반으로 구조조정 효과가 본결화 될 것”이라면서 “하반기부터는 제작과 매니지먼트 사업 매출이 크게 늘어날 전망”이라고 강조했다."
머니투데이,003560,/news/news_read.nhn?article_id=0003974595&office_id=008&mode=search&query=IHQ&page=1,2017-12-06 07:59,"IHQ, 내년 상반기 나올 인수대상따라 로드맵 다양 - 현대차투자","[머니투데이 김훈남 기자] 현대차투자증권은 6일 IHQ에 대해 ""내년 상반기 인수대상자의 윤곽이 나타날 것""이라고 밝혔다. 투자의견은 매수를 유지하고, 목표주가는 3300원으로 올려잡았다. 유성만 연구원은 ""IHQ의 잠재적 인수후보군은 국내 이통사와 국내 플랫폼사, 월트디즈니 자회사 A&E, 중국 플랫폼사, 국내외 PEF(사모펀드) 등 5가지 분류""라며 ""인수대상자에 따라 다양한 로드맵이 예상된다""고 말했다. 이어 ""7일부터 A&E가 제작한 나이트폴이 IHQ 소유 TV채널 5개에 방영될 예정""이라며 ""A&E와의 본격적인 협업 시작으로 플랫폼 광고수익 창출과 브랜드 가치 향상이 가능하다""고 강조했다,"
연합뉴스,003560,/news/news_read.nhn?article_id=0009691236&office_id=001&mode=search&query=IHQ&page=1,2017-11-17 09:23,"[특징주] IHQ, 콘텐츠 제작 가치 조명에 신고가","(서울=연합뉴스) 경수현 기자 = 연예기획사 겸 제작사인 IHQ가 콘텐츠 제작사에 대한 증권가의 가치 조명에 17일 52주 신고가를 새로 썼다. IHQ는 이날 오전 9시 13분 현재 유가증권 시장에서 전 거래일보다 2.16% 오른 2천600원에 거래되고 있다. 장중 한때는 3.73%까지 올라 신고가를 갈아치웠다. 김윤진 대신증권 연구원은 ""넷플릭스나 텐센트의 한류 콘텐츠 확보 경쟁이 본격화하고 스튜디오드래곤의 상장도 앞두고 있어 콘텐츠 제작사에 대한 관심이 커지고 있다""며 ""국내 제작사 중 자본력, 캐스팅 등 핵심 요소를 모두 갖춘 회사는 스튜디오드래곤과 IHQ 등 소수""라고 말했다. 그러면서 IHQ를 기업 분석 대상(커버리지)으로 새로 편입하면서 투자의견과 목표주가를 각각 '매수'와 3천800원으로 제시했다."
