source,symbol,link,date,title,content
한국경제,003560,/news/news_read.nhn?article_id=0003470673&office_id=015&mode=search&query=IHQ&page=1,2015-11-06 09:56,"IHQ, 3분기 실적 감소&hellip;드라마 편성 지연(상보)","[ 한민수 기자  ] IHQ는 6일 별도기준으로 3분기에 매출 219억원, 영업이익 17억원, 순이익 15억원을 기록했다고 밝혔다. 매출액은 지난 2분기보다 24.1% 감소했으며, 영업이익과 순이익 역시 각각 61.4%와 60.2% 줄었다. 미디어 부문 매출이 176억원, 엔터테인먼트 부문은 43억원을 기록했다. 엔터테인먼트는 일일극 종영 및 신규 드라마 편성 지연으로 매출 감소가 발생했으며, 이것이 영업이익과 순이익 감소로 이어졌다는 설명이다. 미디어는 2분기와 유사한 수준의 매출을 기록했다. 미디어 부문은 4분기에도 'K STAR'와 'CUBE TV'를 중심으로 한 자체 프로그램 제작 강화에 집중할 계획이다. 지난 4일 슈퍼쥬니어의 이특과 려욱의 스위스 절친 여행기 '더프렌드 in 스위스'가 방영을 시작했고, 오는 12일에는 개그맨 정형돈과 작곡가 유재환이 영국 런던으로 음악 여행을 떠나 겨울시즌과 크리스마스를 겨냥한 음악을 만드는 과정을 담은 프로그램 '돈 워리 뮤직'도 방영된다는 설명이다. 자체 콘텐츠 증가로 '네이버 TV캐스트' '판도라TV' 등 뉴미디어 플랫폼 뿐 아니라, 'KBS WORLD' 'YTN WORLD' 등 해외 채널에도 콘텐츠를 공급할 수 있게 돼 부가 수익이 창출되고 있다고 회사 측은 전했다. 엔터테인먼트 부문은 주요 아티스트들의 활동 증대 뿐 아니라, 신규 사업으로 추진하고 있는 웹드라마 제작에 기대를 걸고 있다. 지난 9월 '연애세포 시즌2'를 선보인 이래로 '그녀는 200살'이 현재 네이버TV캐스트를 통해 방영되고 있다. 엄기준과 김소현 주연의 미스터리 학원 드라마 '악몽선생'도 방영을 추진하고 있다. 지상파 드라마 제작사업 역시 한류스타 김우빈과 수지 출연으로 큰 화제를 모았던 '함부로 애틋하게' 뿐 아니라, 현재 추가로 편성을 논의 중인 작품들을 통해 매출 회복에 나선다는 목표다. IHQ 관계자는 ""이번 분기 실적이 다소 주춤했지만 올 3분기까지 IHQ의 누적 매출은 650억원, 영업이익은 89억원으로 흑자기조를 이어나가고 있다""며 ""4분기는 광고 시장 최대 성수기인 점을 포함해 미디어와 엔터테인먼트 사업부문 모두 매출이 가장 집중되는 시기인 만큼, 현재 주력하고 있는 콘텐츠 제작 성과를 바탕으로 4분기에는 실적 회복을 이뤄내도록 할 것""이라고 말했다. 한민수 한경닷컴 기자"
아시아경제,003560,/news/news_read.nhn?article_id=0003619907&office_id=277&mode=search&query=IHQ&page=1,2015-11-06 11:17,"IHQ, 3Q 영업이익 17억원&hellip;전분기 대비 61%&darr;","미디어 부문 매출이익 176억원  [아시아경제 김민영 기자]IHQ는 별도기준 3분기 매출액은 219억원, 영업이익 17억원, 당기순이익 15억원을 기록했다고 밝혔다. 매출액은 지난 2분기 대비 24.1% 감소했으며, 영업이익과 당기순이익 역시 각각 61.4%, 60.2% 감소했다. 미디어 부문 매출이익 176억원, 엔터테인먼트 부문 매출은 43억원을 기록했다. 회사 측은 엔터테인먼트 부문에서 일일극 종영 및 신규 드라마 편성 지연으로 일시적인 매출 감소가 발생하면서 영업이익과 당기순이익 감소로 이어졌다고 설명헸다. 미디어부문은 방송 프로그램 제작 강화에 집중할 계획이다. IHQ는 KBS WORLD', 'YTN WORLD' 등 해외 채널에도 콘텐츠를 공급할 수 있게 되면서 부가 수익 창출이 실현되고 있다. 엔터테인먼트 사업부문은 주요 아티스트들의 활동 증대 뿐만 아니라 신규 사업으로 추진하고 있는 웹드라마 제작에 집중하고 있다. 지난 9월 ‘연애세포 시즌2’를 선보인 이래로 ‘그녀는 200살’이 현재 네이버TV캐스트를 통해 방영되고 있으며, 엄기준, 김소현 주연의 미스터리 학원 드라마 ‘악몽선생’도 방영을 추진하고 있다. 지상파 드라마 제작사업 역시 한류스타 김우빈, 수지 출연으로 화제를 모았던 드라마 ‘함부로 애틋하게’ 뿐만 아니라 현재 추가로 편성을 논의 중인 작품들을 통해 매출 회복에 나선다는 목표다. IHQ 관계자는 ""이번 분기 실적이 다소 주춤했지만, 올해 3분기말까지 IHQ의 누적 매출액은 650억원, 영업이익은 89억원으로 흑자기조를 이어나가고 있다""며 ""4사분기는 광고시장이 최대 성수기인 점을 포함해 미디어와 엔터테인먼트 사업부문 모두 매출이 가장 집중되는 시기인 만큼, 현재 주력하고 있는 콘텐츠 제작 성과를 바탕으로 4분기에는 실적 회복을 이뤄내도록 할 것""이라고 말했다."
아시아경제,003560,/news/news_read.nhn?article_id=0003937306&office_id=277&mode=search&query=IHQ&page=1,2017-02-21 13:40,"IHQ, 작년 영업익 53% 증가","[아시아경제 박선미 기자]IHQ는 지난해 연결 기준 영업이익이 53.3% 증가한 112억9392만원을 기록했다고 21일 공시했다. 매출액은 2.7% 증가했고, 당기순이익은 8.3% 늘었다. 회사측은 ""엔터테인먼트 사업부문의 실적이 개선됐고 AXN코리아, 가지컨텐츠 등 주요 연결회사 영업이익이 흑자전환한 게 영향을 미쳤다""고 설명했다."
뉴시스,003560,/news/news_read.nhn?article_id=0008461758&office_id=003&mode=search&query=IHQ&page=1,2018-02-27 13:34,"IHQ, 지난해 영업이익 156억원...전년比 39.0%&uarr;",【서울=뉴시스】이진영 기자 = IHQ(003560)는 연결 재무제표 기준 지난해 영업이익이 156억원으로 전년에 비해 39.0% 증가했다고 27일 공시했다. 같은 기간 매출은 1271억원으로 16.2% 확대됐다. 순이익은 91억원으로 115.3% 늘었다.
파이낸셜뉴스,003560,/news/news_read.nhn?article_id=0003678121&office_id=014&mode=search&query=IHQ&page=1,2016-07-15 08:48,"드라마 제작 패러다임 변화로 수익&uarr;기대...팬엔터테인먼트, 삼화네트웍스, 초록뱀,...","LIG투자증권은 15일 “최근 국내 드라마제작 시장의 수익구조가 변화되며 관련 기업들의 성장가능성이 높아지고 있다”고 평가했다. 과거 국내 드라마제작사는 드라마의 외주제작을 통해 방송국에 제작비를 받고 판매권을 이관하는 구조로 국한됐지만 현재는 외부자금을 투자 받아 드라마 제작 후 판권을 확보하고 투자수익을 나눌 수 있는 구조로 개선됐다는 것이다. 김인필 LIG투자증권 연구원은 “시장 환경 변화의 핵심은 중국자금 유입”이라고 지적했다. 김 연구원은 “사전제작방식의 활성화는 중국정부의 ‘사전심의제’ 규제로 출범해 중국의 ‘사전심의제’ 도입 이후 국내 드라마 컨텐츠는 중국에 동시반영이 불가능해 졌으며 이에 따라 인터넷 등을 통해 불법 컨텐츠 유통으로 중국 시청자가 무료로 컨텐츠를 사용하는 계기가 됐다”며 “이는 중국 미디어기업 입장에서는 한국드라마 시장이 축소되는 현상으로 다가왔고 국내 드라마 제작사들은 수출 기회가 줄어드는 상황을 만들었다”고 설명했다. 사전제작방식의 드라마는 이런 문제점들을 해소하고 국내 드라마제작사에게 수익창출 한계치를 높여주는 계기가 됐다는 게 김 연구원의 생각이다. 현재 국내 드라마제작사들은 선별적으로 사전제작방식을 채택하고 있으며 그 비중이 확대되고 있다. 김 연구원은 “사전제작방식 활성화로 국내 드라마제작사들의 수익구조가 영화 제작사와 유사해 지고 있다는 점에서 향후 국내 드라마제작사들도 사전제작방식으로 수익규모가 커질 가능성이 높다”며 “향후 중국자본이 드라마 투자에 국한되지 않고 기업의 지분투자 혹은 조인트 벤처 설립을 통해 중국시장 진출이 본격화될 수 있다는 점”도 가능성으로 제시했다. 그는 “국내 관련업체로 팬엔터테인먼트, 삼화네트웍스, 초록뱀, 화이브라더스, IHQ 등이 있으며 최근 영화제작과 드라마제작 시장의 경계가 제거되고 있어 시장의 확장과 경쟁이 높아질 것”으로 판단했다."
아시아경제,003560,/news/news_read.nhn?article_id=0003595722&office_id=277&mode=search&query=IHQ&page=1,2015-10-02 13:51,IHQ &quot;KBS WORLD 통해 한류 프로그램 전세계 방영&quot;,"[아시아경제 김민영 기자]IHQ는 전세계 100개국에 서비스 되고 있는 'KBS WORLD' 채널을 통해 자체 제작한 예능 프로그램을 방영한다고 2일 밝혔다. IHQ는 KBS와 여의도 한국방송공사 별관에서 '방송 콘텐츠 사용계약에 관한 조인식'을 열고 양사간 적극적인 협력을 모색하기로 했다. KBS WORLD는 2003년 7월 1일 개국을 시작으로 전세계 100개국에서 한국의 드라마, 다큐멘터리, 연예 등 다양한 인포테인먼트 프로그램을 서비스하고 있는 글로벌 채널이다. 현재까지 시청가구수만 5805만가구에 달한다. KBS WORLD에서 케이블 채널 사업자의 콘텐츠를 서비스하는 것은 이번이 처음이다. IHQ는 오는 7월부터 '한류스타 리포트', '식신로도', 절'더 프렌즈' 등의 예능 프로그램을 오는 해외 지역에서 방영될 예정이다. IHQ의 전용주 대표이사는 ""해외 시장에서 글로벌 미디어 채널들과 어깨를 나란히 하고 있는 'KBS WORLD' 채널을 통해 방송 프로그램을 방영한다는 것만으로 IHQ의 콘텐츠 경쟁력을 입증 받은 것""이라며 ""글로벌 시장 공략의 안정적인 기반을 마련한만큼, 자체 제작 콘텐츠의 수준을 높이는데 엔터테인먼트와 미디어 부문의 사업역량을 총 동원해 좋은 결실로 이어지도록 노력하겠다""고 말했다."
조선비즈,003560,/news/news_read.nhn?article_id=0000403605&office_id=366&mode=search&query=IHQ&page=1,2018-04-12 13:55,[조회답변] IHQ &quot;최대주주가 지분 매각 중단&quot;,아이에이치큐(003560) 는 한국거래소의 조회공시 요구에 대해 “최대주주인 딜라이브가 그동안 검토해 오던 회사의 지분 매각을 중단했다”고 12일 답변했다.
머니투데이,003560,/news/news_read.nhn?article_id=0003710216&office_id=008&mode=search&query=IHQ&page=1,2016-07-12 14:56,"큐브엔터, IHQ와 손잡고 웹드라마 '스파크' 제작","[머니투데이 김건우 기자] 큐브엔터테인먼트는 모회사 IHQ와 손잡고 웹드라마 ‘스파크'를 제작한다고 12일 밝혔다. '스파크'는 불의의 사고로 온 몸에 전기가 흐르는 톱스타와 평범한 한 소녀가 엮이며 벌어지는 판타지 뮤직 로맨스 드라마다. tvN드라마 '후아유'의 문지영 작가가 집필을 맡고 TV조선 '프로포즈 대작전'등을 연출한 김우식 감독이 메가폰을 잡았다. 주인공 윤가온은 MBC드라마 '빛나거나 미치거나', '엄마' 등으로 이름을 알린 배우 나종찬이 맡았다. 나종찬은 아이돌 그룹 덱스터의 막내이자 음악천재 연기를 선보인다. 여자 주인공은 여배우 남보라가 낙점됐다. 남보라는 극 중 불우한 가정환경 속에서도 꿈을 잃지 않는 알바계의 선수 ‘손하늘’ 역을 맡아 우연히 톱스타 윤가온을 만나며 예상치 못한 난관 속 달달한 로맨스를 꽃피운다. 한편 ‘스파크’는 오는 25일부터 3주간 매주 월~목 오전 10시 네이버 TV캐스트를 통해 방송된다. 이후 29일 오후 6시 케이스타(K STAR)와 큐브TV 채널을 통해서도 만날 수 있다. textlinktopstart textlinktopend textlinkstart"
머니투데이,003560,/news/news_read.nhn?article_id=0003792052&office_id=008&mode=search&query=IHQ&page=1,2016-12-19 09:21,"IHQ, 큐브엔터 지분 매각 &quot;사실무근","[머니투데이 김태은 기자] IHQ는 19일 ""큐브엔터 보유지분과 경영권 매각은 사실무근""이라고 공시했다. textlinktopstart textlinktopend textlinkstart"
전자신문,003560,/news/news_read.nhn?article_id=0002707988&office_id=030&mode=search&query=IHQ&page=1,2018-05-14 16:43,"[ET투자뉴스]IHQ, &quot;1분기는 광고 비수&hellip;&quot; 매수-현대차투자증권","현대차투자증권에서 14일 IHQ(003560)에 대해 ""1분기는 광고 비수기로 미디어 부문 수익 성장 둔화""라며 투자의견을 '매수'로 제시하였고, 아울러 목표주가로는 3,000원을 내놓았다. 현대차투자증권 유성만 애널리스트가 동종목에 대하여 이번에 제시한 '매수'의견은 현대차투자증권의 직전 매매의견에서 큰 변화없이 그대로 유지되는 것이고  올해 초반의 매매의견을 기준으로  볼때도 역시 '매수'의견이 계속 유지되고 있는 상태이다. 그리고 최근 분기내 발표된 전체 증권사 리포트의 컨센서스와 비교를 해볼 경우에 오늘 발표된 투자의견은 전체의견에 수렴하고 있어, 이번 의견은 시장의 평균적인 기대감이 객관적으로 표현된 것으로 분석되고 있다. 목표주가의 추이를 살펴보면 과거 상향조정되어오던 패턴이 한차례 정체구간을 보낸 후에 이번에 비교적 조정폭이 크게 줄어든 모습이다. 또한 전일 종가 기준으로 볼때 동종목의 현주가는 이번에 제시된 목표가 대비 39.2%의 저평가 요인이 존재한다는 해석이 제시되고 있다."
연합뉴스,003560,/news/news_read.nhn?article_id=0010257951&office_id=001&mode=search&query=IHQ&page=1,2018-08-08 11:45,"IHQ, 2분기 영업익 7억원&hellip;69.7% 감소","(서울=연합뉴스) 임은진 기자 = 영화, 비디오물, 방송프로그램 제작 및 배급업체 IHQ는 2분기 연결기준 영업이익이 7억원으로 작년 동기보다 69.7% 감소한 것으로 잠정 집계됐다고 8일 공시했다. 매출액은 275억원으로 9.3% 감소했고 당기순이익은 6억원으로 72.2% 줄었다."
서울경제,003560,/news/news_read.nhn?article_id=0003232585&office_id=011&mode=search&query=IHQ&page=1,2018-02-28 08:14,"IHQ, 호실적에 기대감 상승-현대차투자증권","[서울경제] 현대차투자증권은 28일 아이에이치큐( IHQ(003560) )에 대해 “지난해 4·4분기 호실적으로 주가 상승 기대감이 높다”고 전망하며 종전의 ‘매수’ 투자의견을 유지했다. 목표주가도 변동 없이 3,500원으로 유지했다. IHQ는 지난해 4·4분기 매출액 382억원, 영업이익은 39억원을 거뒀으며 이는 전년 동기대비 각각 37.9%, 2.6% 상승한 수치다. 유성만 연구원은 “작년 4·4분기 방영된 ‘당신이 잠든 사이에’ 국내 방영분이 실적에 대부분 반영됐고, 제작비도 당 분기에 적용돼 전 분기 대비 수익 폭은 감소했지만 연말 성수기 효과로 미디어 부문 광고 매출이 증가했다”며 “Dramax와 Comedy TV 등의 안정적 수익원 확보 채널과 자체 제작 프로그램 ‘맛있는 녀석들’의 선전으로 광고단가 상승이 주요한 요인으로 작용했다”고 분석했다. 이어 “지난해 연말에 광고대행수수료가 지출되었고, 동사 소속 아티스트 관련 무형자산상각으로 영업 외 부분에서 1회성 손실이 반영됐다”며 “일회성 손실을 제외하면 4·4분기는 우수한 실적”이라고 덧붙였다. 유 연구원은 또 “매각 작업은 순조롭게 진행되고 있으며, 올해 3월 중순~말경에 신규 인수대상자가 결정 될 예정”이라며 “결과에 따라서 IHQ의 미래 성장 방향이 결정될 것”이라고 말했다."
매일경제,003560,/news/news_read.nhn?article_id=0003823934&office_id=009&mode=search&query=IHQ&page=1,2016-10-24 17:53,"IHQ, 디즈니와 손잡고 글로벌 공략","디즈니 자회사서 1500만弗 투자 받아…콘텐츠 공동 제작 등 협력내달초 지분투자 마무리  글로벌 미디어그룹 월트디즈니컴퍼니 자회사인 A&amp;E네트웍스가 종합엔터테인먼트 기업인 IHQ에 1500만달러(약 170억원)를 투자하기로 했다. IHQ는 이번 투자 유치를 통해 월트디즈니 측과 손잡고 콘텐츠 공동 제작 등 글로벌 시장 공략에 속도를 내게 될 전망이다.24일 투자은행(IB) 업계에 따르면 코스피 상장사인 IHQ는 월트디즈니 자회사인 A&amp;E네트웍스와 전략적 제휴를 맺기로 했다. 1500만달러 규모 지분 투자도 유치한다. 전략적 제휴를 통한 지분 투자와 관련된 작업도 이르면 다음달 초 마무리될 것으로 알려졌다. 월트디즈니는 IHQ의 최대주주이자 수도권 최대 종합유선방송사업자(MSO) 딜라이브가 보유한 지분 50.37% 중 5% 안팎을 인수할 예정이다. 업무 제휴 및 딜 관련 세부 조건 등을 놓고 막판 협상을 진행 중인 것으로 전해졌다.이에 따라 IHQ는 매각에 난항을 겪고 있는 케이블TV 기업 딜라이브의 핵심 자회사로 이번 투자 유치를 통해 모기업 기업가치 제고에도 힘을 보탤 전망이다.IHQ는 2~3년 전부터 김우빈을 비롯해 유명 한류스타 등을 앞세워 미국·중국 등의 유명 콘텐츠 업체들과 전략적 제휴 및 투자 유치를 추진해왔다. 거래에 정통한 IB 관계자는 ""이번 IHQ와 A&amp;E의 전략적 제휴는 6개월이 넘는 협상 끝에 나온 결과물로 양사 모두 윈윈할 수 있는 계기를 마련할 것""이라고 말했다.월트디즈니는 이번 투자로 IHQ가 가진 드라마 등 다양한 한류 콘텐츠 활용에 더해 딜라이브라는 국내 대형 콘텐츠 유통 플랫폼도 확보할 수 있게 돼 본격적인 한국 시장 공략을 위한 기반을 마련할 수 있게 된다. A&amp;E는 미국 월트디즈니 자회사로 다큐멘터리, 드라마 시리즈 전문 케이블 채널이다. 국내에서는 히스토리 채널을 서비스 중이다.IHQ 입장에선 이번 투자 유치로 A&amp;E와 손잡고 글로벌 시장을 타깃으로 한 드라마 등 콘텐츠 제작에 나설 수 있는 발판을 마련하게 됐다. IHQ는 견조한 연예매니지먼트 사업을 기반으로 드라마 제작과 음반 기획 등으로 사업 영역을 확장 중이다. 올 들어 방영된 '함부로 애틋하게'를 제작한 것을 비롯해 지난 10년간 20편에 가까운 지상파 드라마를 제작했다. 드라맥스, 코미디TV 등 6개 채널을 보유하고 있으며 한류스타 김우빈·장혁·김유정·김소현 등 유명 연예인들과 매니지먼트 계약을 맺고 있다.이번 투자 유치는 지난 7월 인수금융 디폴트 위기를 간신히 넘긴 모기업 딜라이브에도 큰 힘이 될 전망이다. 자회사 기업가치 향상으로 향후 매각 시 유리한 고지를 점할 수 있기 때문이다.IB 업계에서는 IHQ와 A&amp;E의 이번 전략적 제휴가 경영권 매각이 예정된 딜라이브 가치 제고에도 기여할 것으로 내다보고 있다. 딜라이브는 국내 최대 사모투자펀드(PEF) MBK파트너스와 맥쿼리, 미래에셋 등이 보유하고 있으며 우여곡절 끝에 최근 인수금융 만기 재연장에 성공했다.  [강두순 기자 / 한우람 기자][매일경제 공식 페이스북] [오늘의 인기뉴스] [매경 프리미엄][ⓒ 매일경제 &amp; mk.co.kr, 무단전재 및 재배포 금지]매일경제 관련뉴스해당 언론사에서 선정하며 언론사 페이지(아웃링크)로 이동해 볼 수 있습니다.'2016 미스 유니버스' 조세휘, 위아래 볼륨 몸매 뽐내[단독] 정유라-승마선수 신모씨 작년 12월12일 獨서 비밀결혼의미심장한 오지환, 그의 키워드 '반전'과 '돌진'인도서 낯선 사람이 주는 음료 마셨다간 순식간에설리, 또다시 '속옷 미착용' 도발적 셀카…사진 봤더니"
머니투데이,003560,/news/news_read.nhn?article_id=0003549887&office_id=008&mode=search&query=IHQ&page=1,2015-09-24 17:39,"IHQ, 주식 취득&middot;유증&middot;주총 소집 철회",[머니투데이 백지수 기자] IHQ는 SK커뮤니케이션즈의 주식 2214만8040주를 취득하고 SK플래닛에 제3자배정 유상증자키로 결정했던 사항을 철회한다고 24일 공시했다. 회사측은 또 다음달 12일로 예정됐던 주주총회 소집 결의도 철회했다. textlinktopstart textlinktopend textlinkstart
파이낸셜뉴스,003560,/news/news_read.nhn?article_id=0004072019&office_id=014&mode=search&query=IHQ&page=1,2018-08-08 13:21,"[공시]IHQ, 2&middot;4분기 영업익 7억&hellip;69.7%&darr;",IHQ는 2·4분기 연결기준 영업이익이 7억원으로 작년 동기보다 69.7% 감소한 것으로 잠정 집계됐다고 8일 공시했다. 매출액은 275억원으로 9.3% 감소했고 당기순이익은 6억원으로 72.2% 줄었다.
머니투데이,003560,/news/news_read.nhn?article_id=0003710576&office_id=008&mode=search&query=IHQ&page=1,2016-07-13 08:12,"IHQ, 하반기 엔터부문 가파른 실적개선 유효-이베스트","[머니투데이 한은정 기자] 이베스트투자증권은 13일 IHQ에 대해 ""'함부로 애틋하게' 방영 후 주가는 부진하지만 하반기 엔터 사업 부문의 가파른 실적 개선 스토리는 여전히 유효하다""며 투자의견 '매수'와 목표주가 3700원을 유지했다. 황현준 연구원은 ""'함부로 애틋하게'는 1, 2회 시청률 12.5%(닐슨코리아, 전국기준)로 동시간대 시청률 1위로 순조롭게 방영중""이라며 ""동시 방영 중인 중국 YOUKU에서 유료회원의 1, 2회 누적 조회수는 12일 기준 약 4400만 뷰로 직전 한중 동시 방영 드라마인 태양에 후예 대비로는 느린 수준""이라고 설명했다. 다만 ""함부로 애틋하게는 총 20부작이고 방영 1주후부터 무료로 시청 가능하므로 개별 차의 조회수는 추가적으로 증가할 것""이라며 ""중국 YOUKU의 조회수와는 관계없이 드라마 중국 수출 판권 관련 수익 정산은 완료된 상황""이라고 덧붙였다. 황 연구원은 ""안정적인 시청률과 커버리지를 토대로 꾸준한 수익을 창출하고 있는 미디어 사업 부문은 자체 제작 콘텐츠 확대로 채널 사업자로서의 경쟁력 제고가 지속 될 것으로 기대된다""며 ""하반기 엔터 사업 부문도 드라마 중국 판권 수출에 따른 동사 제작 수익 증가, 드라마를 통한 중국 노출도 확대로 소속배우 김우빈 활동의 양과 질이 모두 상승하며 실적 성장을 견인할 것으로 예상된다""고 강조했다. textlinktopstart textlinktopend textlinkstart"
조선비즈,003560,/news/news_read.nhn?article_id=0000292077&office_id=366&mode=search&query=IHQ&page=1,2015-09-25 07:06,"[인베스트조선] IHQ, SK컴즈 인수 무산&hellip;SK, MBK와 파트너십 대신 '플랜...","채권단 동의 마감 시한 이달 23일…총 30여개 기관 가운데 2/3 동의 필수대주단 다 못모여 '승인' 못해…SK ""시한 지났다""며 기다리지 않고 자체 인수  MBK파트너스와 씨앤앰(C&amp;M)이 주도하는 IHQ의 SK커뮤니케이션즈(이하 SK컴즈) 인수가 무산됐다. 거래가 달성되는데 시간이 더 필요한 상황이 되자 SK그룹이 기다리지 않고 자체 소화하는 '플랜B'를 선택했다.24일 SK텔레콤은 SK플래닛이 보유한 SK컴즈 지분 64.5%를 매입하기로 했다고 밝혔다. SK텔레콤은 SK컴즈 지분 61.08%는 현물배당 방식으로, 나머지 3.47%는 주식 양수도 계약을 통해 인수할 예정이다.현재 SK → SK텔레콤 → SK플래닛 → SK컴즈 상태의 지배구조에서 지주회사(SK)의 증손자회사(SK컴즈)는 손자회사(SK플래닛)가 지분 100%를 보유하도록 한 공정거래법상 규정 때문에 SK컴즈 지분을 다른 곳에 팔아야 했다.  과징금을 물지 않기 위해 매각을 마무리 지어야 할 기한은 다음달인 10월4일.이를 해결하기 위해 IHQ와 SK그룹은 SK플래닛이 IHQ에 자본을 대고 이 돈으로 IHQ가 SK컴즈를 인수하는, 이른바 지분교환(SWAP)형태의 거래를 추진했다. 지난 8월26일 관련내역이 공개됐다. (아래 그림 참조) "
