source,symbol,link,date,title,content
서울경제,003560,/news/news_read.nhn?article_id=0003347427&office_id=011&mode=search&query=IHQ&page=1,2018-07-13 09:33,"&lt;유&gt;IHQ, 전일 대비 7.05% 상승.. 일일회전율은 3.24% 기록","[서울경제] IHQ(003560) 는 13일 오전 9시 32분 현재 7.05% 오른 2,430원에 거래되고 있으며, 45(매도):55(매수)의 매수우위를 기록하고 있다. 거래대금은 112억9,483만, 거래량은 474만985주로 거래량회전율은 3.24%로 나타났다. 지난 1개월간 IHQ는 상승 14회, 하락 15회를 기록했고, 주가수익률은 10.96% 표준편차는 4.19%를 기록했다. 이 기간 ' 서비스업 ' 업종 평균 주가수익률은 3.90%로 나타났으며, 변동성은 1.11%를 기록했다. 이 시각 현재 ' 서비스업 '은 0.16% 상승 중이며, 59(매도):41(매수)의 매도우위를 기록하고 있다."
서울경제,003560,/news/news_read.nhn?article_id=0003225373&office_id=011&mode=search&query=IHQ&page=1,2018-02-19 13:48,"(유)IHQ, 전일 대비 7.00% 상승.. 일일회전율은 1.77% 기록","[서울경제] IHQ(003560) 는 19일 오후 1시 47분 현재 7.00% 오른 2,600원에 거래되고 있으며, 42(매도):58(매수)의 매수우위를 기록하고 있다. 거래대금은 65억3,805만, 거래량은 256만4,754주로 거래량회전율은 1.77%로 나타났다. 지난 1개월간 IHQ는 상승 13회, 하락 16회를 기록했고, 주가수익률은 7.00% 표준편차는 3.37%를 기록했다. 이 기간 ' 서비스업 ' 업종 평균 주가수익률은 -4.29%로 나타났으며, 변동성은 1.28%를 기록했다. 이 시각 현재 ' 서비스업 '은 1.31% 상승 중이며, 47(매도):53(매수)의 매수우위를 기록하고 있다."
서울경제,003560,/news/news_read.nhn?article_id=0003346643&office_id=011&mode=search&query=IHQ&page=1,2018-07-12 13:10,"&lt;유&gt;IHQ, 전일 대비 7.11% 상승.. 일일회전율은 1.57% 기록","[서울경제] IHQ(003560) 는 12일 오후 1시 9분 현재 7.11% 오른 2,260원에 거래되고 있으며, 39(매도):61(매수)의 매수우위를 기록하고 있다. 거래대금은 50억8,125만, 거래량은 229만3,969주로 거래량회전율은 1.57%로 나타났다. 지난 1개월간 IHQ는 상승 14회, 하락 15회를 기록했고, 주가수익률은 5.12% 표준편차는 4.04%를 기록했다. 이 기간 ' 서비스업 ' 업종 평균 주가수익률은 1.94%로 나타났으며, 변동성은 1.08%를 기록했다. 이 시각 현재 ' 서비스업 '은 1.18% 상승 중이며, 56(매도):44(매수)의 매도우위를 기록하고 있다."
머니투데이,003560,/news/news_read.nhn?article_id=0004048976&office_id=008&mode=search&query=IHQ&page=1,2018-05-09 14:58,"IHQ, 1분기 영업익 13억7300만원&hellip;전년比 26.5% 감소",[머니투데이 김사무엘 기자] IHQ는 연결기준 올 1분기 영업이익이 13억7300만원으로 전년 동기대비 26.5% 줄었다고 9일 공시했다. 1분기 매출액은 198억2500만원으로 전년 동기대비 17% 감소했고 당기순이익은 11억5800만원으로 17.4% 떨어졌다.
전자신문,003560,/news/news_read.nhn?article_id=0002731333&office_id=030&mode=search&query=IHQ&page=1,2018-08-09 08:36,"[ET투자뉴스]IHQ, &quot;바닥을 지나는 시기&hellip;&quot; BUY-현대차투자증권","현대차투자증권에서 9일 IHQ(003560)에 대해 ""바닥을 지나는 시기 ""라며 투자의견을 'BUY'로 제시하였고, 아울러 목표주가로는 3,000원을 내놓았다. 현대차투자증권 유성만 애널리스트가 동종목에 대하여 이번에 제시한 'BUY'의견은 현대차투자증권의 직전 매매의견을 그대로 유지하는 것이고 올해 초반의 매매의견을 기준으로  볼때도 역시 '매수'의견이 계속 유지되고 있는 상태이다. 그리고 최근 분기내 발표된 전체 증권사 리포트의 컨센서스와 비교를 해볼 경우에 오늘 발표된 투자의견은 전체의견 대비해서 상대적으로 긍정적인 수준으로서 이는 동종목에 대한 기대감을 보다 강하게 표현한 것으로 분석되고 있다. 목표주가의 추이를 살펴보면 이번에 다시 목표가가 같은 수준을 유지하면서 최근 흐름은 목표가의 계단식 하향조정이 진행되는 모습이다. 또한 전일 종가 기준으로 볼때 동종목의 현주가는 이번에 제시된 목표가 대비 51.1%의 추가상승여력이 있다는 해석이 제시되고 있다."
연합뉴스,003560,/news/news_read.nhn?article_id=0007879063&office_id=001&mode=search&query=IHQ&page=1,2015-09-24 17:39,IHQ &quot;SK컴즈 지분 취득 결정 철회&quot;,(서울=연합뉴스) 임수정 기자 = IHQ는 SK커뮤니케이션즈(SK컴즈) 주식 2천214만8천40주를 취득하기로 한 결정을 철회한다고 24일 공시했다. IHQ는 주식 취득 자금 조달을 위해 SK플래닛을 대상으로 진행할 예정이던 1천706억원 규모의 유상증자도 함께 취소한다고 덧붙였다.
아시아경제,003560,/news/news_read.nhn?article_id=0003910804&office_id=277&mode=search&query=IHQ&page=1,2017-01-12 11:17,"[아시아초대석]전용주 IHQ대표, 딜라이브 까지 1인2역","[아시아경제 유인호 기자] 전용주 IHQ 대표는 명함이 두 개다. 엔터테인먼트 회사인 IHQ 대표 외에도 모회사인 케이블TV 방송사 딜라이브의 대표이사도 맡고 있다. 전 대표는 두 회사의 대표를 맡고 있어 몸이 열 개라도 부족할 지경이라고 토로한다. 딜라이브는 서울ㆍ경기지역 230만 가입자를 보유한 수도권 최대 케이블TV 방송사다. IHQ는 코스닥 상장사로서 배우 김우빈ㆍ김유정이 소속된 대형 엔터테인먼트 회사다. 그렇다고 두 회사 일 중 어느 하나를 허투루 할 순 없다. 그러기엔 그의 일에 대한 열정이 너무 뜨겁다. 전 대표는 지난해 말 성사시킨 글로벌미디어업체 A&E 텔레비전 네트웍스와의 계약에서도 남다른 열정을 보였다. 앨런 호지스 A&E네트웍스 아시아ㆍ태평양 지역  대표와 직접 딜을 하기 위해 바쁜 일정 속에서도 영어 회화 공부를 했다고 한다. 전 대표는 ""통역을 써도 되지만 호지스 대표와 허심탄회하게 대화를 나누기 위해 영어 공부를 했다""며 환한 웃음을 지어보였다. 사실 그는 호지스 대표와 오랫동안 인연을 맺어왔다. 이번 딜 성사 배경에는 두 대표 간의 오랜 인연도 작용했다는 후문이다. 전 대표는 캐나다 출신인 호지스 대표와 딜라이브 전신인 씨앤엠의 전무 시절인 2009년부터 인연을 맺었다. 당시 전 대표는 A&E네트웍스와 손잡고 딜라이브나 IHQ를 글로벌화하는 구상을 하고 있었다. 그러다 2013년 대표이사가 된 후 그의 구상은 급물살을 탔다. 전 대표는 호지스 대표에게 ""장기적인 파트너가 될 수 있느냐. 글로벌 한류 콘텐츠를 개발하고 싶다"" 등의 의사를 전달했다. 본격적인 협상 테이블이 차려지자 호지스 대표는 전 대표에게 ""나와 뭘 하고 싶으냐""고 물었다고 한다. 전 대표는 이에 ""단순한 콘텐츠 유통 협력으로는 안 된다. 제대로 된 사업 파트너 관계를 맺기 위해서는 지분 투자를 해야 한다""고 요구했다고 한다. 전 대표는 ""호지스 대표와 오랜 시간 신뢰관계를 맺고 있어 진정성 있는 요구를 전할 수 있었다""고 당시를 회상했다."
헤럴드경제,003560,/news/news_read.nhn?article_id=0001187861&office_id=016&mode=search&query=IHQ&page=1,2017-01-23 10:02,"IHQ, 영상 프로그램 독점 라이선스 계약",[헤럴드경제=증권팀] IHQ는 영상 프로그램 독점 라이선스 계약을 체결했다고 23일 공시했다. 계약 기간은 2022년 1월 22일까지다. 회사측은 “계약 상대방의 경영상 비밀유지 요청에 따라 주요 계약 조건에 대해 2018년 1월 23일까지공시유보한다”고 밝혔다.
이데일리,003560,/news/news_read.nhn?article_id=0003355728&office_id=018&mode=search&query=IHQ&page=1,2015-09-25 13:38,"[특징주]IHQ, SK컴즈 인수 무산에 약세",[이데일리 정병묵 기자] IHQ(003560)가 SK컴즈(066270) 인수 무산 소식에 약세다. IHQ는 25일 오후 1시36분 현재 전날 대비 5.17% 내린 2475원에 거래되고 있다. CLAS 등 외국계 창구를 통해 매물이 출회되고 있다. SK텔레콤은 전날 자회사 SK플래닛이 보유하고 있는 SK컴즈 지분 매입을 결정했다. 당초 IHQ에 매각 예정이었으나 IHQ의 최대주주 씨앤앰이 대주단 동의를 얻지 못해 SK텔레콤이 직접 인수하게 됐다. 같은 시간 SK컴즈는 가격제한폭까지 치솟았다.
한국경제,003560,/news/news_read.nhn?article_id=0003690647&office_id=015&mode=search&query=IHQ&page=1,2016-11-25 15:24,"IHQ, 넷플릭스와 콘텐츠 공급계약 체결","[ 한민수 기자  ] IHQ는 25일 세계 최대 온라인 동영상 스트리밍 서비스 기업인 '넷플릭스'와 콘텐츠 공급계약을 체결했다고 밝혔다. 이번에 공급하는 콘텐츠는 IHQ가 올해 제작한 웹드라마 4편이다. 다음달부터 '악몽선생'과 '스파크'를 시작으로 내년 1월과 2월 '통 메모리즈'와 '더 미라클'이 넷플릭스를 통해 순차적으로 세계에 서비스될 예정이다. IHQ가 넷플릭스와 해외 지역에서의 콘텐츠 공급계약을 체결한 것은 이번이 처음이다. IHQ는 앞으로 제작하는 콘텐츠에 관해서도 넷플릭스와 서비스 협력을 추진해나갈 계획이다. IHQ는 2014년 '연애세포'를 시작으로 꾸준히 온라인 전용 동영상 콘텐츠 제작에 나서고 있다. 현재까지 9편의 작품을 선보였으며, 내년에도 추가로 4~5편의 웹드라마를 제작할 예정이다. 한편 IHQ의 최대주주인 딜라이브는 넷플릭스와 계약을 체결하고, 지난 6월 'OTT(Over The Top)' 박스인 '딜라이브 플러스'를 국내에 출시했다. 딜라이브 플러스는 넷플릭스에서 제작한 콘텐츠를 TV를 통해 볼 수 있는 환경을 제공해준다. IHQ가 제작한 콘텐츠를 제공하는 'IHQ 전용 앱'도 설치돼 있다. 현재 딜라이브 플러스는 출시 4개월 만에 1만대 이상 판매되고 있다. 한민수 한경닷컴 기자"
아시아경제,003560,/news/news_read.nhn?article_id=0003776037&office_id=277&mode=search&query=IHQ&page=1,2016-06-28 10:45,"[특징주] IHQ, 4% &uarr; &hellip;드라마 방영 앞두고 연일 상승세","[아시아경제 박선미 기자]김우빈, 수지가 주연을 맡은 드라마 '함부로 애틋하게' 공동제작사인 IHQ 주가가 연일 상승 흐름을 이어가고 있다. 28일 오전 10시40분 현재 IHQ 주가는 전일 대비 115원(4.31%) 오른 2785원에 거래되고 있다. 브렉시트 충격이 코스닥시장을 덮쳤던 지난 24일만 일시적으로 하락했을 뿐 지난 17일 이후 연일 상승 행진을 이어가고 있다. 홍정표 키움증권 연구원은 이날 IHQ에 대해 "" ‘함부로 애틋하게’는 소속 대표 배우 김우 빈이 출연하고, 자회사 가지컨텐츠에서 OST를 자체 제작해 음원 관련 수익 실현도 가능할 것""이라며 ""드라마 흥행은 주연배우 인기로 이어져 한국과 중국 광고활동이 늘어나 올해 매니지먼트 매출이 전년 대비 70% 증가한 343억원을 기록할 것""이라고 예상했다. 올해 전체 매출액은 전년 대비 18.3% 증가한 1257억원, 영업이익은 95.9% 증가한 145억원을 기록 할 것으로 전망했다."
한국경제TV,003560,/news/news_read.nhn?article_id=0000368092&office_id=215&mode=search&query=IHQ&page=1,2015-09-24 17:38,"SKT, SK커뮤니케이션즈 인수&hellip;&quot;IHQ에 매각 불발&quot;","SK텔레콤이 SK커뮤니케이션즈를 인수합니다. SK텔레콤이 24일 임시이사회를 열어 SK플래닛이 보유한 SK컴즈 보유 지분 64.5%를 인수하기로 의결했습니다. SK플래닛은 지난 8월 IHQ와 SK컴즈 지분 교환 계약을 체결했으나 IHQ가 계약 사전 조건인 채권단 동의를 받지 못함에 따라, SK텔레콤이 SK컴즈 지분을 인수하기로 결정했다고 밝혔습니다. SK텔레콤 관계자는 ""IHQ 모회사인 씨앤앰 채권단이 인수를 반대하면서 SK컴즈 매각이 결렬돼 인수하게 됐다""고 설명했습니다. 이어 “SK컴즈가 그동안 유무선 인터넷분야에서 축적해온 3C (Contents, Community, Commerce) 영역에서의 역량과 노하우를 활용해 SK텔레콤이 신성장동력으로 추진 중인 차세대 플랫폼 사업에서 시너지를 창출할 계획”이라고 덧붙였습니다. SK플래닛은 SK컴즈 주식 2,800 여 만주 중 2,650 여 만주(61.08%, 금액 기준 1,954억 원)를 현물배당 방식으로, 나머지 150여 만주(3.47%, 금액 111억 원)를 주식 양수도 계약을 통해 SK텔레콤에 이관할 계획입니다. 이번 지분 인수를 통해 SK컴즈는 공정거래법상 지주회사의 증손자회사 지분 이슈가 해소됩니다. 한편, SK커뮤니케이션즈는 지난 10일 이사회를 열고 '(주)네이트'로 법인명을 변경키로 결정했다고 공시했지만, IHQ의 SK커뮤니케이션즈 인수가 불발되면서 SK컴즈의 사명변경도 재검토 될 전망입니다."
서울경제,003560,/news/news_read.nhn?article_id=0002847872&office_id=011&mode=search&query=IHQ&page=1,2016-06-28 08:44,"IHQ, 수익 실현 기회 기대-키움증권","키움증권(039490)은 28일 보고서에서 IHQ(003560)에 대해 “올해 매출액은 지난해 대비 18.3% 증가한 1,257억원, 영업이익은 95.9% 증가한 145억원을 기록할 것”이라며 “매니지먼트, 콘텐츠 제작, 플랫폼 사업을 결합해 삼박자를 갖춰 수익 계열화를 통한 시너지 효과가 기대된다”고 밝혔다. 투자의견과 목표주가는 제시하지 않았다. 홍정표 키움증권 연구원은 “IHQ가 공동제작한 ‘함부로 애틋하게’는 소속 대표 배우 김우빈이 출연하고 자회사 가지컨텐츠에서 OST를 자체 제작해 음원 관련 수익 실현도 가능할 것”이라며 “드라마 흥행은 주연배우 인기로 이어져 한국과 중국 광고활동이 늘어나 올해 매니지먼트 매출은 전년 대비 70% 증가한 343억원을 기록할 것”이라고 예상했다."
연합뉴스,003560,/news/news_read.nhn?article_id=0010020333&office_id=001&mode=search&query=IHQ&page=1,2018-04-12 11:49,"IHQ &quot;딜라이브, 보유 지분 매각 중단&quot;","딜라이브 (서울=연합뉴스) 유현민 기자 = IHQ는 12일 ""최대주주인 딜라이브가 그동안 검토해 오던 당사 지분 매각을 중단하게 됐다""고 공시했다."
서울경제,003560,/news/news_read.nhn?article_id=0003038195&office_id=011&mode=search&query=IHQ&page=1,2017-05-24 09:03,"[오늘의 종목] IHQ, 드라마 제작 확대로 올해 영업이익 성장 전망","[서울경제] 하반기 IHQ(003560)의 드라마 라인업이 집중되면서 올해 영업이익이 늘어날 전망이다. KTB투자증권은 24일 IHQ에 대해 “광고시장 개선에 따른 방송실적 개선, 드라마 제작 확대로 인한 엔터 실적 향상으로 실적이 개선될 것”으로 분석했다. IHQ는 지난 1·4분기 연결기준 매출액 239억원, 영업이익 19억원을 기록했다. 전년동기대비 매출은 1.3% 줄었지만 영업이익은 78.8% 늘어난 수치다. 이남준 KTB투자증권 연구원은 “드라마 제작 매출은 전년동기대비 역성장했지만 방송부문 수익성 향상으로 영업이익은 전년동기대비 크게 증가했다”며 “방송광고는 대기업 광고비 진출 축소로 업황 침체를 겪었는데도 상대적으로 견고한 모습을 나타냈다”고 말했다. 엔터테인먼트 수익은 기대를 밑돌았다. 이 연구원은 “중국과 교류가 축소되면서 판권판매 매출이 전년대비 감소했다”며 우려할 사항은 아니라고 판단했다. 하반기에는 드라마 라인업이 집중되면서 수익성도 전년보다 확대될 것으로 보인다. IHQ는 지난 해 3·4분기 ‘함부로 애틋하게’ 수익에 힘입어 영업이익 37억원을 기록했다. 이 연구원은 “당시 ‘함부로 애틋하게’는 삼화네트웍스와 공동제작해 수익의 30%만을 인식했지만 올해 ‘당신이 잠든사이’는 자체제작으로 수익 100%를 인식할 예정”이라며 “중국 판권판매는 아직 확정적이지는 않지만 제작비가 100억원을 상회 하는 만큼 영업이익 기여도가 클 것”이라고 말했다."
한국경제,003560,/news/news_read.nhn?article_id=0003941003&office_id=015&mode=search&query=IHQ&page=1,2018-05-17 10:13,"[IHQ] 5% 이상 상승, 외국계 증권사 창구의 거래비중 13% 수준","17일 오전 10시 10분 현재 IHQ은 전 거래일보다 5.03% 오른 2,090원에 거래되고 있다. 주가의 흐름을 살펴보면 2,000원으로 개장해서 장중에 밀리지 않고 계속 상승해서 2,090원(+5.03%)까지 큰 폭으로 상승하고 있다. ◆ 거래원 동향 - 외국계 증권사 창구의 거래비중 13% 수준 현재 거래원 동향을 보면 메릴린치와 CS증권이 각각 순매수 상위 창구 2위와 5위를 기록하고 있다. 한편, 매도 창구 상위에는 CS증권이 눈에 띄고 있다. 지금까지 외국계(추정) 증권사 창구를 통한 거래 비중은 13% 수준이다. 그리고 이 시간 메릴린치가 매수창구상위에 올라있는 종목은 이 종목 이외에도 티피씨글로벌, 화성밸브 등이 있다. [표]IHQ 거래원 동향 ◆ 기업개요 IHQ은 종합 엔터테인먼트 및 미디어 사업부 영위업체로 알려져 있다. 한경로보뉴스 이 기사는 한국경제신문과 씽크풀이 공동 개발한 기사 자동생성 알고리즘에 의해 실시간으로 작성된 것입니다. ["
한국경제,003560,/news/news_read.nhn?article_id=0003442814&office_id=015&mode=search&query=IHQ&page=1,2015-10-02 13:34,"IHQ, 'KBS WORLD' 통해 한류 프로그램 세계 방영","[ 한민수 기자  ] IHQ는 세계 100개국에 서비스되고 있는 'KBS WORLD' 채널을 통해 자체 제작한 예능 프로그램을 방영한다고 2일 밝혔다. IHQ는 이날 KBS와 '방송 콘텐츠 사용계약에 관한 조인식'을 가지고, 양사간 적극적인 협력을 모색하기로 했다. KBS WORLD에서 케이블 채널 사업자의 콘텐츠를 서비스하는 것은 이번이 처음이다. IHQ가 제작한 한류 연예 전문 데일리 뉴스 '한류스타 리포트'를 시작으로, 국내 대표 먹방 프로그램 '식신로드', 절친 스타들의 리얼 여행기 '더 프렌즈' 등의 예능 프로그램이 오는 7일부터 해외 지역에서 방영될 예정이다. IHQ 관계자는 ""KBS WORLD는 세계에서 오랜 시간 동안 한국을 대표하는 채널로 자리매김해 온 만큼, 이번 계약을 통해 IHQ가 글로벌 콘텐츠 사업자로 도약할 수 있는 좋은 기회""라며 ""해외에서 제품이나 브랜드 이미지를 제고하고자 하는 국내외 기업들을 대상으로 광고 영업에 적극 나서, 프로그램의 해외 수출과 함께 광고 매출까지 일석이조의 성과를 거둘 것으로 예상된다""고 말했다. KBS WORLD는 2003년 7월1일 개국을 시작으로 세계 100개국에서 한국의 드라마, 다큐멘터리, 연예 등 다양한 인포테인먼트 프로그램을 서비스하고 있다. 현재까지 시청가구수가 5805만가구에 달하며, 영어 중국어 일본어 말레이어 등의 자막도 제공 중이다. 한민수 한경닷컴 기자"
한국경제,003560,/news/news_read.nhn?article_id=0003469306&office_id=015&mode=search&query=IHQ&page=1,2015-11-04 18:22,"엔터테인먼트사 IHQ, HQ인베스트먼트 판다",[ 오동혁 기자  ] 유가증권시장에 상장된 엔터테인먼트회사인 IHQ가 계열 벤처캐피털 HQ인베스트먼트를 매각한다. 4일 벤처캐피털업계에 따르면 IHQ는 자회사 HQ인베스트를 팔기 위해 인수 후보와 협상을 하고 있다. 5일 임시주주총회를 열어 인수자 측 사내이사 선임 등의 안건을 결의할 예정이다. IHQ는 HQ인베스트 지분 52.9%를 보유하고 있다. KNN(14.3%) 동서학원(14.3%) 등도 주요 주주로 올라 있다. IHQ는 보유 지분 중 40~50%와 경영권을 파는 것으로 알려졌다. 업계에서 예상하는 매각 가격은 20억원 안팎이다. HQ인베스트가 운용 중인 펀드가 없는 데다 자본 잠식이 발생했다는 점 등을 고려해 액면가 수준에서 가격을 협상하는 것으로 알려졌다. 업계에선 인수 후보자가 HQ인베스트가 보유한 현금에 매력을 느끼고 있을 것으로 분석하고 있다. 작년 말 기준 HQ인베스트는 약 38억원의 현금을 갖고 있다. IHQ는 2010년 11월 영남제분과 공동으로 HQ인베스트의 전신인 아시아인베스트먼트를 인수했다. 이후 2013년 9월 영남제분에서 아시아인베스트 보유 지분을 전량 인수하며 사명을 바꿨다.
한국경제,003560,/news/news_read.nhn?article_id=0003468808&office_id=015&mode=search&query=IHQ&page=1,2015-11-04 11:07,"IHQ, '큐브TV' 콘텐츠 'YTN WORLD'서 방영 시작","[ 한민수 기자  ] IHQ는 4일 K팝 전문 채널 '큐브TV'의 주요 프로그램을 YTN의 글로벌 채널인 'YTN WORLD'에 방영하는 계약을 체결했다고 밝혔다. 양사는 이번 계약을 시작으로 양사가 가진 방송 콘텐츠 제작 및 기획력을 결합해 해외 시장 공략을 위한 협력에 나설 계획이다. YTN WORLD는 현재 미주 및 아시아 지역 등에서 세계 730만명 이상이 시청하고 있는 24시간 실시간 위성방송 채널이다. 큐브TV의 주요 프로그램은 매일 해외 각 지역에 방영될 예정이다. 큐브TV의 주요 프로그램으로는 '비스트 용준형의 굿라이프' '포미닛의 비디오' 'CLC의 뷰티풀 미션' 등이 있다. IHQ는 큐브TV 사업본부를 현재 상암동에 위치한 YTN 사옥 공간에 마련하는 등 YTN과 K팝 콘텐츠를 기반으로 한 협력방안 모색에 강한 의지를 보이고 있다. IHQ는 'KBS WORLD'를 통해 한류 채널 'K-STAR'의 주요 프로그램을 공급하는데 이어, 이번 계약까지 세계 시장에서 자체 제작 콘텐츠의 인지도 및 경쟁력 강화를 위한 사업 기회 마련에 힘쓰고 있다. 전용주 IHQ 대표는 ""그동안 한류를 모토로 한 프로그램 기획에 집중한 것이 좋은 결실로 이어지고 있다""며 ""세계 시장에서도 경쟁력 있는 콘텐츠 사업자로 발돋움할 수 있도록 수준 높은 프로그램을 지속적으로 제작 및 공급하는 데 최선을 다하겠다""고 말했다. 한민수 한경닷컴 기자"
머니투데이,003560,/news/news_read.nhn?article_id=0004037128&office_id=008&mode=search&query=IHQ&page=1,2018-04-12 12:07,"IHQ, 최대주주 지분매각설 부인","[머니투데이 김사무엘 기자] IHQ는 최대주주 지분 매각 추진설에 대한 한국거래소의 조회공시 요구에 ""당사의 최대주주인 (주)딜라이브는 그동안 검토해 오던 당사 지분 매각을 중단하게 됐다""고 12일 밝혔다."
