source,symbol,link,date,title,content
매일경제,003920,/news/news_read.nhn?article_id=0003517840&office_id=009&mode=search&query=남양유업&page=50,2015-07-02 11:46,"&lsquo;밀어내기 논란&rsquo; 남양유업 김웅 대표, 항소심 집유","주문하지 않은 물량을 대리점주에게 강제로 떠넘기는 등 ‘밀어내기’ 영업을 한 혐의 등으로 기소된 김웅 남양유업 대표에게 항소심에서도 집행유예가 선고됐다. 서울고법 형사3부(강영수 부장판사)는 2일 독점규제 및 공정거래에 관한 법률 위반 혐의 등으로 기소된 김씨의 항소심에서 1심과 마찬가지로 징역 1년6월에 집행유예 2년을 선고했다. 재판부는 “밀어내기 영업 관행을 모르고 있었다고 주장하지만, 회사 내부 문서를 보면 어느 정도 인지하고 있었다는 정황이 있다”며 “이 사건으로 사회적 파장과 국민적 공분을 일으켜 원칙적으로 엄정하고 단호한 조치가 요구된다”고 밝혔다. 다만 남양유업이 회사 차원에서 대리점협의회와 상생협약을 하는 등 개선 노력을 보였고 상생기금으로 30억원을 지급하는 등 실질적인 피해 회복이 있어 대리점 사업자들도 선처를 바라는 점을 참작했다며 1심의 양형을 유지했다. 1심에서 김씨에게 내린 사회봉사 160시간 명령은 이 사건에 적합하지 않다는 이유로 항소심에서는 뺐다. 함께 기소된 남양유업 영업상무 곽모씨에게도 1심과 같이 징역 1년에 집행유예 2년을 선고했다. 영업 실무 담당 직원들에게는 “직원으로서 회사 업무수행을 하는 과정에서 저지른 일이므로 상대적으로 가볍게 책임을 묻는 것이 맞다”며 벌금형으로 감형했다. 1심에서 각각 징역 10월에 집행유예 2년을 선고받은 영업부문장 신모씨에게는 벌금 1천만원, 영업사원 이모씨에게는 벌금 700만원을 선고했다. 이들은 2008~2012년 대리점주들이 주문한 내역을 임의로 조작해 주문하지도 않은 물량을 떠넘기고 대리점주들이 항의하면 계약을 해지하거나 반품을 거절하는 식으로 거래상 ‘갑’의 지위를 이용해 불공정 거래를 한 혐의로 2013년 7월 기소됐다. [매경닷컴 디지털뉴스국] r_start // r_end // [ⓒ 매일경제 & mk.co.kr, 무단전재 및 재배포 금지] 매일경제 관련뉴스해당 언론사에서 선정하며 언론사 페이지(아웃링크)로 이동해 볼 수 있습니다.'사생활 동영상' 논란 이시영, 과거 속옷화보 봤더니…노출 수위가 대박~!그리스 디폴트 누구 책임일까…""채권단·시리자 양측 모두에""우규민-오재원, '벤치클리어링 신경전'30여 년 생사도 몰랐던 자매 출국 직전 기적같은 만남박보영, 초미니 입고 계단 오르다 결국엔…""지금 보이는 거야? 男心 멘붕"""
이데일리,003920,/news/news_read.nhn?article_id=0003318521&office_id=018&mode=search&query=남양유업&page=48,2015-08-06 11:40,"남양유업, '아기 생명 살리기 운동' 추진","[이데일리 염지현 기자] 남양유업(003920)은 주사랑공동체와 ‘아기 생명 살리기 운동’ 추진 협약을 맺었다고 6일 밝혔다. 협약으로 남양유업은 유기 아동 분유 지원, 미혼모 자립 지원, 아동 유기 예방활동, 아기 생명 살리기 운동 캠페인 등에 참여하기로 했다. (왼쪽부터)이원구 남양유업 대표이사와 이종탁 주사랑공동체목사가 6일 오전 10시 남양유업 본사에서 ‘아기 생명 살리기 운동’ 추진 협약을 맺고 사진을 찍고 있다.(사진=남양유업)"
뉴시스,003920,/news/news_read.nhn?article_id=0008188303&office_id=003&mode=search&query=남양유업&page=17,2017-09-20 09:46,"남양유업, 추석 앞두고 협력사에 거래대금 50억 조기지급","【서울=뉴시스】 박주연 기자 = 남양유업이 추석을 앞두고 협력사에 거래대금을 조기 지급한다. 남양유업은 동반 협력사들의 자금운용을 돕고자 거래대금을 22일 조기 지급하기로 결정했다고 20일 밝혔다. 예년보다 긴 추석 연휴를 앞두고 임금, 상여금, 납품 대금 등 자금 수요가 많은 협력사들이 자금 유동성을 확보할 수 있도록 돕기 위한 조치다. 남양유업은 거래하고 있는 협력업체 중 선 자금지급이 필요한 25곳에 8월 거래대금 50억원을 본래 지급기한인 29일보다 일주일 앞당긴 22일 모두 지급할 예정이다. 남양유업 관계자는 ""남양유업의 존재는 모든 협력사의 노력이 있었기 때문""이라며 ""이번 대금 조기지급이 도움이 돼 모든 협력사 직원들이 임금을 적기에 받아 넉넉하고 따듯한 명절을 맞이하길 바란다""고 말했다. 한편, 남양유업은 불공정 거래행위, 부당이득 부정행위, 비윤리적 행위 등을 상시 감시하기 위해 클린센터를 운영 하고 있다"
뉴시스,003920,/news/news_read.nhn?article_id=0008725833&office_id=003&mode=search&query=남양유업&page=3,2018-07-25 17:32,"남양유업, '프렌치카페 듀얼 로스터리' 정해인 에디션 출시",【서울=뉴시스】박정규 기자 = 남양유업은 '프렌치카페 듀얼 로스터리'의 광고모델인 배우 정해인의 모습을 패키지에 담은 스페셜 에디션 7종을 출시한다고 25일 밝혔다. 지난 4월 출시된 프렌치카페 듀얼 로스터리는 남양유업이 여름철을 맞아 내놓은 250㎖ 컵커피 제품이다. 각 원두의 개성을 구현하기 위해 서로 다른 특성을 가진 2대의 로스터기를 활용했다. 이 제품에 적용된 듀얼 로스팅 기법은 생두를 볶는 시간이 각각 달라 생산하기까지 시간이 많이 소요되고 까다롭지만 커피전문점의 최고급 커피 맛을 재현해내기 위해 이 기법을 도입했다는 게 남양유업의 설명이다. 남양유업은 정해인 스페셜 에디션 출시와 더불어 구매영수증을 촬영해 문자메시지를 보내면 추첨을 통해 여름휴가비 등을 제공하는 이벤트도 진행한다.
머니투데이,003920,/news/news_read.nhn?article_id=0003767592&office_id=008&mode=search&query=남양유업&page=32,2016-11-03 10:54,"남양유업, 커피전문점 겨냥한 '루카스9 라떼' 출시","[머니투데이 김소연 기자] 남양유업에서 최고급 원두와 우유를 넣어 커피전문점 라떼 수준의 맛과 향을 낸 '루카스9 라떼'를 출시했다고 3일 밝혔다. 이 제품은 커피 향을 지키기 위해 영하 196도에서 원두를 50마이크로미터 이하로 미세하게 분쇄했다. 커피전문점과 같이 설탕은 사용하지 않고 천연우유를 사용해 풍부한 우유거품과 진한 커피 맛을 느낄 수 있도록 만들었다. 기존 인스턴트 커피 시장이 침체됨에 따라 남양유업은 커피 전문점 수준의 라떼 개발을 위해 노력해왔다. 이번 '루카스9 라떼'는 9기압으로 추출한 에스프레소와 신선한 무지방우유를 사용해 최적의 라떼를 구현했다. 라떼는 커피전문점에서 아메리카노에 이어 두번째로 많이 팔리는 품목이지만 설탕을 넣지 않고는 맛이 떨어져 인스턴트 커피로 상품화가 쉽지 않았다. 그러나 이번 제품은 우유함량을 대폭 늘리고 농축하는 기술을 활용해 텁텁함 없이 우유의 부드러움이 느껴진다는 설명이다. 남양유업 측은 지난달 신제품 출시를 앞두고 진행한 소비자 조사결과에서 총 200명 중 85%가 유명 전문점커피와의 차이점을 식별하지 못했다며 자신감을 피력했다. 한편 '루카스9 라떼'는 스틱 1개당 14.9g 중량에 시중판매가는 10개입이 3800원, 30개입은 1만900원이다 textlinktopstart textlinktopend textlinkstart"
스포츠경향,003920,/news/news_read.nhn?article_id=0000524376&office_id=144&mode=search&query=남양유업&page=14,2017-11-23 15:37,"남양유업 &lsquo;아기사랑 수&rsquo;, 국내 최초 중국 조제분유 수출 기준 통과","남양유업의 ‘아기사랑 수’(중국명 시우아이스)가 국내 최초로 중국 조제분유 수출 기준을 통과해 중국 식품약품감독관리총국에 정식 등록됐다. 중국 식품약품감독관리총국은 지난해 10월 심사를 통과한 업체에 한해 중국 분유 수출을 허가하고, 업체별 분유 공장당 3개 브랜드 9개 제품만 판매하도록 제한하는 ‘영유아 조제분유 등록관리법’을 발표했다. 공식 발효 시점은 내년 1월이다. 수출용 ‘아기사랑 수’ 이에 남양유업은 제품 개발 연구보고서와 배합 화학물질 증명서 등 총 10여 개에 이르는 등록 자료를 비롯해 생산 공장 심사와 허가를 받아야 하는 중국의 엄격한 조제분유 수출 기준을 모두 통과해 총 6개 브랜드 18개 제품을 중국에 수출할 수 있게 됐다. 이 중 ‘아기사랑 수’ 제품이 심사를 통과해 첫 번째로 등록됐고, 남양유업은 연말까지 중국 수출용 제품인 ‘희안지’ ‘아이즈바오’를 비롯해 기존 ‘아이엠마더’ ‘임페리얼 XO’ 등 대표 분유 브랜드 등록을 완료한다는 계획이다. 한편 현재 중국에 수출되는 전 세계 분유 브랜드 가운데 30여 개만 등록됐고, 국내 기업으로는 남양유업이 유일하다."
아시아경제,003920,/news/news_read.nhn?article_id=0004265305&office_id=277&mode=search&query=남양유업&page=4,2018-06-26 11:36,"남양유업, 세계 최초 액상형 특수의료 용도식품 16년째 소신 행보","소수의 뇌전증 환아를 위한 영·유아용 특수조제식품 개발 및 보급 앞장서 [아시아경제 이선애 기자] 최근 고속도로 운전 중 정신을 잃은 뇌전증(간질) 환자, 대마초 의료적 사용 논란 등 뇌전증 질환에 대한 사회적 관심이 증가하고 있다. 이런 가운데 난치성 뇌전증 환아를 위해 16년간 소신 행보를 지켜온 남양유업의 ‘남양 케토니아’ 제품이 재조명되고 있다. 26일 업계에 따르면 ‘남양 케토니아’는 남양유업 연구진이 뇌전증 연구의 세계적 권위를 가진 연세대 김흥동 교수와 인제대 김동욱 교수의 공동연구를 통해 2002년 세계 최초로 개발한 액상형 케톤 생성식으로 뇌전증 치료에 획기적인 전기를 마련했다는 평가를 받은 바 있다. 뇌전증은 짧은 시간 동안 의식이 소실되거나 행동이 변화하는 등 발작 증상이 만성적으로 재발하는 상태를 말하는데 치료방법에는 약물치료, 수술적 치료, 케톤 생성 식이요법 등이 있다. 케톤 생성 식이요법은 버터, 마요네즈 등 지방은 많이 섭취하고 단백질과 탄수화물은 적게 섭취하는 식이요법으로 체질에 따라 구토, 설사 등을 일으켜 중도에 포기하는 경우가 많았다. ‘남양 케토니아’는 이러한 단점을 보완하여 환아의 거부감을 낮추고 간편하게 섭취할 수 있도록 액상 형태로 개발한 제품이다. 남양유업은 불확실한 시장규모와 저조한 매출, 막대한 연구비와 설비투자비에도 불구하고 소수의 난치성 뇌전증 환아를 위해 ‘남양 케토니아’를 개발한 이후 16년간 누적 106만개(180㎖ 기준)를 생산해 특수의료 용도식품 개발 및 보급에 앞장서고 있다. 또, 2010년 10월에는 형편이 어려운 환아들이 ‘남양 케토니아’를 무상 공급받을 수 있도록 세브란스 어린이병원과 협약식을 체결하여 8년째 지속적인 사회공헌 활동을 실천하고 있다. 남양유업 관계자는 ‘남양유업만의 품질고집 정신으로 세계 최초 액상형 케톤식 ‘남양 케토니아’ 제품이 탄생했고, 소수의 환아를 위해 16년간 지속적으로 생산 및 보급해왔다”며 “앞으로도 긴밀한 산학협력 연구를 통해 더 많은 뇌전증 환아들의 아픔을 치료하는데 기여하겠다”고 밝혔다. 한편, 남양유업은 미숙아나 저체중아를 위한 ‘미숙아 분유’, 유당과 유단백을 소화하기 힘든 아기를 위한 ‘임페리얼드림 XO 알레기’, 장이 불편해 묽은 변을 보는 아기를 위한 ‘임페리얼드림 XO 닥터’ 등의 특수분유를 만들어 공급하고 있다."
머니투데이,003920,/news/news_read.nhn?article_id=0003719580&office_id=008&mode=search&query=남양유업&page=33,2016-07-29 19:41,"남양유업, 10년 연속 임단협 무교섭 타결","[머니투데이 김소연 기자] 남양유업은 29일 세종공장 대강당에서 10년 연속 임단협 무교섭 협약식과 ‘항구적 노사 평화 선언’을 진행했다고 밝혔다. 이 자리에는 이원구 대표이사와 양찬 노동조합위원장, 이해찬 세종시 국회의원, 고준일 세종시의회 의장 등 주요인사와 임직원이 참석했다. 남양유업은 지난 2007년 식품업계 최초로 무교섭 임금협상을 체결한 이후 매해 순조롭게 타결을 진행해 왔다. 2010년 ‘노사합동 위기극복 선언’, 2011년 ‘항구적 노사화합 선언’, 2012년 ‘전사원 노사 평화협정근무 선언’등의 과정을 거쳐 올해 무교섭 10주년을 달성했다. 이원구 대표이사는 “소통과 참여의 열린 노사문화를 바탕으로 고용안정을 최우선 과제로 삼아 근로환경을 개선할 것”이라며 “항구적 노사 평화가 뿌리 내릴 수 있도록 최선을 다하겠다”고 밝혔다. 양찬 노조위원장은 “지난 2007년 무교섭을 시작한 이래, 신뢰와 소통으로 상생의 길을 함께 해준 회사에 고맙다”고 화답했다. 남양유업은 앞으로도 노사관계의 새로운 소통 시스템인 노사관계발전위원회를 통해 상시적인 대화와 협의, 자율과 책임의 노사문화를 정착함과 동시에 평화적 노사관계 실천으로 선진적인 노사관계를 도모하겠다고 밝혔다. textlinktopstart textlinktopend textlinkstart"
뉴스1,003920,/news/news_read.nhn?article_id=0002953864&office_id=421&mode=search&query=남양유업&page=17,2017-09-20 10:02,"남양유업, 추석 앞두고 협력사에 거래대금 50억원 조기지급","2015.11.13/뉴스1 © News1 손형주 기자 (서울=뉴스1) 장도민 기자 = 남양유업은 추석을 앞두고 동반 협력사들의 자금운용을 위해 거래대금을 조기지급한다고 20일 밝혔다. 예년보다 긴 추석 연휴를 앞두고 임금, 상여금, 납품 대금 등 자금 수요가 많은 협력사들이 자금 유동성을 확보할 수 있도록 지원하기 위한 조치다. 남양유업은 거래하고 있는 협력업체 중 선 자금지급이 필요한 25개사에 지날달분 거래대금 총 50억원을 본래 지급기한인 29일보다 일주일 앞당긴 22일 지급한다. 남양유업 관계자는 ""이번 대금 조기지급으로 모든 협력사 직원들이 임금을 적기에 받아 넉넉하고 따뜻한 명절을 맞이하길 바란다""고 말했다."
아시아경제,003920,/news/news_read.nhn?article_id=0003533489&office_id=277&mode=search&query=남양유업&page=50,2015-07-02 12:48,'밀어내기' 갑질 영업 전 남양유업 대표 항소심도 집유,"[아시아경제 김재연 기자] 주문하지 않은 물량을 대리점주에게 강제로 떠넘기는 등 '밀어내기' 영업을 한 혐의 등으로 기소된 김웅 전 남양유업 대표에게 항소심에서도 집행유예형을 받았다. 서울고법 형사3부(부장판사 강영수)는 독점규제와 공정거래법 위반 혐의 등으로 기소된 김 씨의 항소심에서 1심과 같은 징역 1년 6월에 집행유예 2년을 선고했다고 2일 밝혔다. 또 함께 기소된 남양유업 영업상무 곽 모씨에게도 1심과 같은 징역 1년에 집행유예 2년을 선고했다. 재판부는 회사 내부 문서를 보면 밀어내기 영업 관행을 어느 정도 인지하고 있었다는 정황이 있다며 엄정하고 단호한 조치가 필요하다고 밝혔다. 재판부는 다만, 남양유업이 회사 차원에서 대리점협의회와 상생 협약을 하고, 상생 기금으로 30억 원을 지급하는 등 실질적인 피해 회복을 위해 노력한 점 등을 고려했다며 양형 이유를 밝혔다. 김웅 전 대표 등은 지난 2008년부터 4년여 간 대리점 업주들에게 유제품을 강제로 떠넘긴 혐의로 기소됐다."
이데일리,003920,/news/news_read.nhn?article_id=0003598782&office_id=018&mode=search&query=남양유업&page=33,2016-07-30 09:23,"남양유업, 10년 연속 임단협 무교섭 타결","[이데일리 함정선 기자] 남양유업(003920)은 29일 세종공장 대강당에서 이원구 대표이사와 양찬 노동조합위원장, 이해찬 세종시 국회의원, 고준일 세종시의회 의장 등 주요인사와 임직원이 참석한 가운데 10년 연속 임단협 무교섭 협약식과 함께 ‘항구적 노사 평화 선언’을 했다고 30일 밝혔다. 남양유업은 지난 2007년 식품업계 최초로 무교섭 임금협상 체결 이후, 매해 순조롭게 타결을 진행해 왔으며 2010년 ‘노사합동 위기극복 선언’, 2011년 ‘항구적 노사화합 선언’, 2012년 ‘전사원 노사 평화협정근무 선언’ 등의 과정을 거쳐 올해 무교섭 10주년을 달성했다. 이원구 대표이사는 “소통과 참여의 열린 노사문화를 바탕으로 고용안정을 최우선 과제로 삼고 근로환경을 개선하여 일하기 좋은 직장, 일하고 싶은 직장을 실현, 궁극적으로 항구적 노사 평화가 뿌리 내릴 수 있도록 최선을 다할 것”이라고 말했다. 남양유업은 앞으로도 노사관계의 새로운 소통 시스템인 노사관계발전위원회를 통해 상시적인 대화와 협의, 자율과 책임의 노사문화를 정착함과 동시에 평화적 노사관계 실천으로 선진적인 노사관계를 도모할 계획이다."
이데일리,003920,/news/news_read.nhn?article_id=0003927661&office_id=018&mode=search&query=남양유업&page=17,2017-09-20 10:24,"남양유업, 추석 앞두고 협력사 거래대금 조기 지급","- 본래 기한보다 일주일 앞당겨 50억원 지급 [이데일리 김용운 기자] 추석 명절을 앞두고 남양유업이 협력사 챙기기에 나선다. 남양유업(003920)은 추석을 앞두고 동반 협력사들의 자금운용을 돕고자 거래대금을 22일에 조기 지급하기로 결정했다. 예년보다 긴 추석 연휴를 앞두고 임금, 상여금, 납품 대금 등 자금 수요가 많은 협력사들이 자금 유동성을 확보할 수 있도록 지원하기 위함이다. 남양유업은 거래하고 있는 협력업체 중 선 자금지급이 필요한 25개사에 8월 거래대금 총 50억원을 본래 지급기한인 29일보다 일주일 앞당긴 22일 모두 지급 완료할 예정이다. 남양유업 관계자는 “이번 하도급 거래 대금 조기 지급을 통해 협력사의 어려움을 함께 해결하는 상생 협력에도 앞장서겠다”고 말했다."
연합뉴스,003920,/news/news_read.nhn?article_id=0008798204&office_id=001&mode=search&query=남양유업&page=32,2016-11-03 10:44,"남양유업, '라떼 스틱커피' 출시","(서울=연합뉴스) 강종훈 기자 = 남양유업은 스틱원두커피로 라떼 맛을 즐길 수 있는 '루카스9 라떼'를 출시했다고 3일 밝혔다. 최고급 원두와 우유를 넣어 커피전문점 라떼 수준의 맛과 향을 낸 제품으로, 영하 196도에서 원두를 미세하게 분쇄하고 설탕은 넣지 않았다고 남양유업은 설명했다. 라떼는 설탕을 넣지 않으면 맛이 떨어져 쉽게 상품화되지 못했지만, 이 제품은 우유 함량을 대폭 늘리고 농축하는 기술을 활용해 텁텁함 없이 우유의 부드러움이 느껴진다고 남양유업은 전했다. 국내 커피믹스 시장은 지난 2012년 1조2천389억 원 규모로 정점으로 찍은 이후 성장이 정체돼 올해는 1조 원 이하에 그칠 것으로 전망된다. 남양유업은 커피전문점으로 발길을 돌리는 소비자들을 붙잡기 위해 이 제품을 개발했다고 전했다. 스틱 1개당 14.9ｇ 중량에 시중 판매가는 10개입이 3천800원, 30개입이 1만900원이다."
연합뉴스,003920,/news/news_read.nhn?article_id=0007776595&office_id=001&mode=search&query=남양유업&page=48,2015-08-06 11:26,"남양유업, '아기 생명 살리기 운동' 추진 협약 체결",(서울=연합뉴스) 남양유업 이원구 대표이사(왼쪽)와 주사랑공동체 이종락 목사가 6일 오전 남양유업 본사에서 '아기 생명 살리기 운동' 추진 협약을 체결하고 있다. 협약에 따라 아동 유기 문제 해결을 위해 적극 협력하기로 했다. 2015.8.6 >
데일리안,003920,/news/news_read.nhn?article_id=0002271913&office_id=119&mode=search&query=남양유업&page=3,2018-07-25 15:26,"남양유업, &lsquo;프렌치카페 듀얼 로스터리&rsquo; 정해인 스페셜 에디션 출시","남양유업은 ‘프렌치카페 듀얼 로스터리’ 광고모델, 배우 정해인의 모습을 패키지에 담은 스페셜 에디션 7종을 출시한다고 25일 밝혔다. 지난 4월 출시된 ‘프렌치카페 듀얼 로스터리’는 남양유업이 여름철을 맞아 야심차게 내놓은 250ml 컵커피 제품이다. 각 원두의 개성을 완벽히 구현하기 위해 서로 다른 특성을 가진 2대 로스터기를 활용, 애프터 블렌딩 기법을 통해 명품 원두 본연이 가지고 있는 특징을 강조했다고 회사 측은 설명했다. 특히 ‘프렌치카페 듀얼 로스터리’에 적용된 듀얼 로스팅 기법은 생두를 볶는 시간이 각각 달라, 생산하기까지의 시간이 많이 소요되고 까다롭지만 남양유업은 커피전문점에서 즐기던 최고급 커피 맛을 그대로 재현해 내기 위해 과감하게 이 기법을 도입했다. 남양유업은 정해인 스페셜 에디션 출시와 더불어 ‘프렌치카페 듀얼 로스터리’ 인지도와 함께 매출을 견인하기 위한 다양한 온라인 프로모션도 병행하고 있다. ‘프렌치카페 듀얼 로스터리’ 구매 영수증을 촬영, 1800-4013번으로 문자메시지를 전달하면 추첨을 통해 10명에게 각각 100만원씩 총 여름휴가비 1000만원과 100% 당첨을 보장하는 해피포인트를 제공하는 이벤트가 이달 말까지 진행 중이다. 남양유업은 앞으로도 다양한 프로모션을 통해 날로 치열해지는 컵커피 시장에서의 ‘프렌치카페 듀얼 로스터리’만의 고유한 영역을 구축할 계획이다."
국민일보,003920,/news/news_read.nhn?article_id=0000923216&office_id=005&mode=search&query=남양유업&page=33,2016-07-30 20:00,"남양유업, 10년 연속 임단협 무교섭 협약식 개최","남양유업은 29일 세종공장 대강당에서 이원구 대표이사와 양찬 노동조합위원장, 이해찬 세종시 국회의원, 고준일 세종시의회 의장 등 주요인사와 임직원이 참석한 가운데 10년연속 임단협 무교섭 협약식과 함께 ‘항구적 노사 평화 선언’을 했다고 30일 밝혔다. 남양유업은 지난 2007년 식품업계 최초로 무교섭 임금협상을 체결한 이후 2010년 ‘노사합동 위기극복 선언’, 2011년 ‘항구적 노사화합 선언’, 2012년 ‘전사원 노사 평화협정근무 선언’등을 거쳐 올해 무교섭 10주년을 달성했다.   협약식을 통해 이원구 대표이사는 “소통과 참여의 열린 노사문화를 바탕으로 고용안정을 최우선 과제로 삼고 근로환경을 개선하여 일하기 좋은 직장, 일하고 싶은 직장을 실현, 궁극적으로 항구적 노사 평화가 뿌리 내릴 수 있도록 최선을 다할 것”이라고 밝혔다. 이에 양찬 노조위원장은 “지난 2007년 조합원의 실리를 위해 무교섭을 시작한 이래로 신뢰와 소통으로 상생의 길을 함께 해준 회사에 고맙다”고 화답했다. 남양유업은 앞으로도 노사관계의 새로운 소통 시스템인 노사관계발전위원회를 통해 상시적인 대화와 협의, 자율과 책임의 노사문화를 정착함과 동시에 평화적 노사관계 실천으로 선진적인 노사관계를 도모하겠다고 밝혔다. * 사진설명 *"
연합뉴스,003920,/news/news_read.nhn?article_id=0007776594&office_id=001&mode=search&query=남양유업&page=48,2015-08-06 11:26,"남양유업, '아기 생명 살리기 운동' 추진 협약 체결",(서울=연합뉴스) 남양유업 이원구 대표이사(왼쪽)와 주사랑공동체 이종락 목사가 6일 오전 남양유업 본사에서 '아기 생명 살리기 운동' 추진 협약을 체결하고 있다. 협약에 따라 아동 유기 문제 해결을 위해 적극 협력하기로 했다. 2015.8.6 >
