source,symbol,link,date,title,content
데일리안,003920,/news/news_read.nhn?article_id=0002092265&office_id=119&mode=search&query=남양유업&page=47,2015-08-27 13:33,"남양유업, 3년만에 매일유업보다 영업이익 앞섰다","남양유업의 2분기 실적이 경쟁사인 매일유업을 앞선 것으로 나타났다. 약 3년 만에 역전한 것이다. 남양유업은 대리점주 폭언 논란으로 정상적인 영업이 되지 않아 몇 년간 적자를 이어갔다. 하지만 비용절감 노력으로 올 2분기 흑자전환에 성공했다. 반면 매일유업은 신제품을 내면서 판촉 및 광고비를 과다하게 지출해 영업이익이 대폭 감소했다. 27일 금융감독원에 따르면 매일유업은 2분기 매출액 3755억원을 기록해 전년동기 3536억원보다 6.2% 증가했다. 반면 영업이익은 66억원에서 35억원으로 47.0%나 감소했다. 매일유업 관계자는 ""상반기 신제품을 내면서 판촉과 광고비에 지속 비용을 지출했고 메르스 영향으로 소비가 감소한 영향과 원유가 남아도는 영향으로 영업이익이 감소했다""고 설명했다. 반면 남양유업은 2분기 매출 3207억원으로 전년동기 대비 11.0% 증가했고 특히 영업이익은 61억원으로 흑자전환에 성공했다. 남양유업이 흑자를 기록한 것은 2013년 이후 처음이다. 특히 2분기 실적에서 남양유업의 영업이익이 매일유업을 앞선 것이 주목된다. 남양유업의 영업이익이 매일유업보다 높았던 적은 2012년 이후 거의 처음이다. 남양유업이 매일유업과 비슷한 상황 속에서도 흑자 전환에 성공할 수 있었던 배경은 비용 절감 노력이 가장 크다. 실제 남양유업은 적자를 기록한 이후 판관비를 3000억원대에서 더 이상 늘리지 않았다. 반면 매일유업은 2012년 2656억원이었던 판관비가 2013년 3974억원으로 증가했고 지난해에는 4326억원까지 증가했다. 올 2분기에도 남양유업은 판관비로 851억원을 지출한 반면 매일유업은 1229억원을 지출했다. 업계 관계자는 ""올해가 지나가봐야 알겠지만 남양유업이 정상화되고 있는 과정으로 보인다""며 ""과거에도 남양유업의 실적이 매일유업을 앞섰기 때문에 그것을 회복하는 과정으로 볼 수 있을 것""이라고 말했다. 데일리안 김영진 기자 ⓒ (주)데일리안 - 무단전재, 변형, 무단배포 금지 데일리안 관련뉴스해당 언론사에서 선정하며 언론사 페이지(아웃링크)로 이동해 볼 수 있습니다.남양유업, 아동 유기문제 해결 위해 미혼모 자립 지원 나서매일유업, 희귀병 PKU 환아 가족캠프 15년간 후원매일유업 흰우유, 1년2개월만에 중국 수출 재개매일유업, 이달 말 스틱형 프로바이오틱스 시장 진출남양유업, 다이어트에 효과 '우엉차' 출시"
조세일보,003920,/news/news_read.nhn?article_id=0002115098&office_id=123&mode=search&query=남양유업&page=47,2015-09-07 10:00,"[기업실적] 2015년 상반기 유가공 3사, 와신상담 남양유업 나홀로 '실속 장사...","매일유업, 남양유업, 빙그레 등 증시 상장 유가공 업체 3사 중 남양유업이 유일하게 올 상반기 매출과 영업이익 모두 증가해 가장 실속 있는 장사를 한 것으로 나타났다. 남양유업은 영업이익의 흑자전환에 성공하면서 2년 만에 대리점 막말 파동에 따른 영업 후유증에서 벗어나 본격 회복국면으로 전환한 것 아니냐는 평가를 받고 있다. 7일 유가공 3사의 감사보고서에 따르면 별도재무제표 기준 3사의 올 상반기 합산 매출액은 1조6057억원으로 전년 동기 1조5689억원 대비 약 2.3% 늘었다. 경기침체 지속과 남아도는 우유, 메르스 여파 등 악재에도 불구하고 3년 연속 외형 성장을 이루는 선전을 펼쳤다. 빙그레의 경우엔 빙과류 수출과 우유 및 유음료의 내수 판매 감소로 매출이 4.3% 감소세를 시현했지만 남양유업과 매일유업은 매출이 각각 5.1%, 4.4% 증가함으로써 전체 외형 성장을 이끌었다. 영업이익부문에서는 매일유업과 빙그레가 감소세를 나타냈음에도 불구하고 남양유업이 지난해 상반기 186억원의 적자에서 67억원의 흑자전환에 성공해 전체 수익성 향상을 주도했다. 3사 합산 영업이익 역시 남양유업의 선전에 힘입어 375억원을 기록, 전년 동기 201억원 대비 86.4% 증가했다. 반면 매일유업의 경우 영업이익이 47.1% 감소하고, 빙그레 역시 3.4% 감소하는 부진한 실적을 기록했다. 매출액, 남양 5.1%, 매일 4.4% 증가…빙그레만 4.3% 뒷걸음 상반기 각 사 매출액은 매일유업이 분유와 우유 및 발효유류 부문의 선전에 힘입어 전년 동기대비 4.4% 증가한 6141억원을 보여 같은 기간 5.1% 증가하며 5939억원의 매출을 기록한 남양유업을 제치고 2년 연속 수위 자리를 지켰다. 매일유업은 지난 2013년 초 발생한 대리점 막말사태로 인한 영업 후유증으로 위기를 겪고 있던 남양유업을 제치고 지난해 상반기 매출액 1위로 올라서 외형 순위에 지각변동을 일으킨바 있다. 하지만 두 회사의 매출 격차가 지난해 상반기 234억원에서 올 상반기 202억원으로 축소돼 선두 탈환을 위한 남양의 행보가 주목되고 있다. 반면에 빙그레는 올 상반기 3사중 유일하게 외형이 줄어 대조를 보였다. 이 회사는 올 상반기 3977억원의 매출을 시현하며 전년 동기대비 4.3% 감소해 가장 부진했다. 영업이익, 남양유업 흑자전환…매일유업 47.1%, 빙그레 3.4% 감소  영업이익부문에서도 남양유업의 선전이 돋보였다. 남양유업은 지난해 상반기 186억원의 적자에서 흑자전환에 성공한 반면 매일유업과 빙그레는 각각 47.1%, 3.4% 감소해 부진한 실적을 시현했다. 그럼에도 불구하고 3사의 합산 영업이익은 남양유업의 선전에 힘입어 375억원을 기록, 전년 동기 201억원 대비 174억원이 늘어나며 무려 86.4% 신장됐다. 남양유업이 전년도 186억원의 적자에서 올 상반기 67억원의 영업이익으로 흑자 전환에 성공, 253억원의 영업이익 개선을 이뤄내 매일유업과 빙그레의 영업이익 감소분 79억원을 상쇄시키며 전체 수익성 향상을 견인했다. 남양유업이 이처럼 영업이익을 큰 폭 개선시킬 수 있었던 것은 비상경영체제를 계속 추진하며 제조원가 등 매출원가와 일반관리비를 동시에 절감, 총원가율을 대폭 낮춘데 힘입은 것으로 분석된다. 업계에서는 지난 2013년 상반기 대리점 막말 파동이후 빼앗긴 주요 제품의 시장점유율 회복을 위해 지난 1년 6개월여에 걸친 대대적 판촉행사, 대리점과의 관계 개선 및 상생을 위한 비용지출 등으로 수익성이 악화됐으나 영업력이 점차 제자리를 찾아가고 있는 것으로 보고 있다. 이 회사의 매출원가율을 살펴보면 대리점 막말파동이 본격화되기 이전인 2013년 1, 2분기의 경우 71.8%, 72.4%였지만 후유증이 본격화된 3분기엔 76.5%로 치솟았다. 이후 조금씩 안정을 찾아가며 올 상반기 72.2%로 전년 동기 74.7%대비 2.5%P 개선돼 수익성 호전의 결정적 요인 중 하나로 작용했다. 판매관리비율 역시 경쟁사에 빼앗긴 주요 제품의 시장점유율 회복을 위한 판촉행사와 대리점 상생 비용 지출 등이 급증하면서 2013년 3분기 30.0%까지 치솟았다. 이후 전사적인 비용절감 노력에 힘입어 지난해 2분기 29.0%를 고점으로 매분기 하향 안정화 추세를 보이면서 수익성 개선에 힘을 실어 주는 모양새를 보이고 있다. 그 결과 올 상반기 판매관리비율은 26.7%로 전년 동기 28.6% 대비 1.9%P 줄이는 데 성공함으로써 흑자전환에 결정적 기여를 했다. 주요 절감항목을 보면 운반비 31억원, 지급수수료 34억원 등이다. 최재호 홍보실장은 ""원유 공급과잉 등 어려운 환경에도 불구하고 분유수출이 100억원이상 증가하고 커피믹스, 발효유, 차음료 등 신제품 판매 호조 등으로 외형성장을 이뤘다""며 ""수익성부문에서는 비상경영체제를 지속하며 판촉비·운반비·지급수수료 절감 등 수익·효율 중심 경영을 펼쳐 흑자를 달성했다“고 설명했다. 이 같은 비용절감 노력에 힘입어 매출원가율 2.5%P, 일반관리비율 약 1.9%P를 개선시켜 총원가율을 103.3%에서 98.9%로 약 4.4%P 낮출 수 있었다는 설명이다. 반면 매일유업은 상반기 매출원가율이 72.2%로 전년 동기 73.1%대비 0.2%P 개선됐지만 매일바이오 등 신제품 출시에 따른 판촉 및 광고비 과다 지출이 수익성의 발목을 잡은 것으로 분석됐다. 실제로 광고선전비, 판매수수료, 지급수수료 등이 전년 동기대비 각각 103억원, 21억원, 11억원씩 더 썼다. 그 결과 판관비율이 24.3%에서 25.7%로 1.4%P 상승을 초래해 수익성 악화의 단초를 제공했다. 빙그레의 경우에는 지난해 상반기대비 매출원가 142억원, 판관비 28.8억원 등 총원가에서 약 170.8억원을 절감하는 비상경영을 펼쳤다. 하지만 매출액 감소분 178억원을 넘지 못해 다소 빛이 바래긴 했지만 결과적으로는 매출액 영업이익률을 소폭 상승시키며 수익성 개선을 이뤄내는 선전을 펼쳤다. 영업이익률, 빙그레 5.73%로 남양·매일 압도 이에 따라 3사의 올 상반기 매출액 영업이익률은 빙그레가 5.73%로 전년 동기 5.68%와 비교 0.05%포인트 개선되며 이 부문 선두 자리를 지켰다. 남양유업 역시 1.13%로 전년도 -3.29%와 비교 4.42%P 개선됐다. 반면에 매일유업은 판관비 급증으로 3사중 유일하게 영업이익률이 1.27%P 후퇴해 대조를 보였다. 증권가에서는 외형기준 2위로 밀려난 남양유업의 주요 제품 시장점유율이 회복되고 있어 외형 및 수익성 호전 추세는 당분간 이어 질 것으로 전망했다. 반면에 빙그레와 매일유업의 향후 영업전망에 대한 증권가의 평가는 신중론이 대체로 우세한 편이다. HMC투자증권 조용선 연구원은 “상반기 저조한 수익성에 대한 우려감이 잔존하고 있다”며 하지만 “대 중국 분유 매출성장 지속과 흰우유 수출 재개, 잉여 원유 점진적 완화 등 하반기 실적 증가를 뒷받침할 시그널은 긍정적”이라고 분석했다. 그는 또 빙그레에 대해서는 “지난 4월 단행한 빙과가격 인상 효과(매출비중 30%)가 성수기인 3분기부터 본격 발현될 가능성과 바나나맛 우유의 중국 수출 확대 등은 긍정적”이지만 “매출의 절대 비중을 차지하는 유음료·빙과류의 판매회복 추세 확인이 필요하다”는 견해를 밝혔다. ★ 화끈한 토픽·쏠솔한 정보 조세일보 페이스북 초대합니다."
매일경제,003920,/news/news_read.nhn?article_id=0004166912&office_id=009&mode=search&query=남양유업&page=5,2018-06-12 16:55,"남양유업, 모델 정해인 초청 `프렌치카페 로스터리` 팬사인회 진행","남양유업이 16일 경기도 하남 스타필드 1층 몰리스 아트리움에서 '프렌치카페 로스터리' 모델인 정해인씨를 초청, 팬사인회를 진행한다고 12일 밝혔다. 이 행사는 사전 페이스북 로스터리 공식 홈페이지에서 마련된 3가지의 미션을 완료한 소비자들을 대상으로, 랜덤추첨을 통해 사인회 티켓과 스페셜 기프트 박스를 제공한다. 메인 행사인 '프렌치카페 로스터리'의 광고모델인 정해인씨 팬사인회는 오후 5시부터 진행되며 럭키드로우 이벤트 및 이벤트 당첨자와 셀카촬영 등이 예정되어 있다. RTD(Ready to Drink)커피 회사들은 인기가 많은 남성모델들을 광고모델로 채용하고 있다. 남양유업 '프렌치카페 로스터리'가 정해인을, 일동후디스 '노블'이 배우 이승기를, 동서식품 맥심 티오피가 배우 원빈이 광고모델이다. [이덕주 기자] r_start // r_end //"
서울경제,003920,/news/news_read.nhn?article_id=0002729553&office_id=011&mode=search&query=남양유업&page=47,2015-08-25 09:57,"남양유업, 향후 3년간 매출액은 연평균 3.7% 증가 예상","남양유업(003920)에 대해 신영증권은 ""동사는 한국 유제품업계 초창기 기업으로 해당 분야에서 풍부한 경험을 보유하고 있다. 오랜 기간 누적된 소비자 인지도에 기인한 수익성 회복 또한 유망하다고 판단한다""라고 분석했다. 또한 김윤오 애널리스트는 ""외형이 회복세를 보인 건 남양유업에 대한 소비자 인지도 및 유아용 분유의 시장점유율 회복에 기인한 것으로 판단된다. 분유 시장점유율은 영업적자를 내기 이전 수준에 근접한 것으로 보여진다. 이로 볼 때 남양유업의 외형 및 수익성 회복은 추세적이라 전망된다. 향후 3년간 매출액은 연평균 3.7% 증가하고 2017년 영업이익률은 적자 이전 수준이 될 것""이라고 밝혔다. 한편 ""남양유업의 수출 액수가 증가하는 점에도 주목한다. 수출의 대부분은 분유이며 수출 지역은 중국을 비롯한 아시아 국가. 동사는 분유에서 전문성을 갖춘 기업이고 해외영업을 강화해 나간다는 점에서 향후 꾸준한 수출 증가를 기대한다""라고 전망했다. 신영증권은 25일 남양유업에 대해 ""정상화 과정에 주목""라며 투자의견을 '매수(유지)'로 제시하였다. 아울러 12개월 목표주가를 1,000,000원으로 내놓았다. 김윤오 애널리스트가 동종목에 대하여 이번에 제시한 '매수(유지)'의견은 신영증권이 10개월만에 매매의견을 새롭게 조정하는 것으로 직전 매매의견에서 큰 변화없이 그대로 유지되는 것이다. ▷ 유가공 섹터 매일유업, 빙그레 등"
세계일보,003920,/news/news_read.nhn?article_id=0002850740&office_id=022&mode=search&query=남양유업&page=51,2015-06-11 11:34,"남양유업, '칼슘 흡수를 위한 뼈건강 비타민D 우유'출시","남양유업은 한컵으로 비타민D 권장량의 절반, 칼슘 기준치의 60％를 섭취할 수 있는 '칼슘 흡수를 위한 뼈건강 비타민D 우유'를 출시했다고 11일 밝혔다. 새 우유 200㎖ 기준, 비타민D 2.5ug, 칼슘 460mg이 들어있어 비타민D와 칼슘의 일일 영양소 기준치(각각 5㎍, 700㎎) 부족분을 충족할 수 있다고 남양유업은 설명했다.  지방함량은 기존 자사 제품 대비 절반으로 낮췄다. 가격은 180㎖ 제품은 900원, 900㎖는 3000원이며 가정배달로만 판매된다. 남양유업 관계자는 ""비타민D 우유는 외부활동이 부족한 직장인들뿐만 아니라 골다공증이 걱정되는 노년층, 칼슘과 비타민이 필요한 성장기 어린이들에게 좋은 영향을 미칠 것으로 기대한다"" 고 전했다. 김기환 유통전문기자"
YTN,003920,/news/news_read.nhn?article_id=0001053062&office_id=052&mode=search&query=남양유업&page=18,2017-08-30 22:47,남양유업 홈페이지 해킹...회원 정보 백만 건 유출,"남양유업 홈페이지가 해킹당해 회원정보가 유출된 것으로 조사됐습니다. 남양유업은 최근 수사기관이 검거한 해커의 PC에서 당사 홈페이지 회원정보 가운데 일부가 발견된 것을 확인했다고 밝혔습니다. 유출된 정보는 지난 2011년 5월부터 2015년 말까지 가입한 회원 일부의 ID, 이름, 연락처 등입니다. 경찰은 백만 건 정도의 정보가 유출된 것으로 추정하고 있습니다. 남양유업은 홈페이지를 통해 개인정보 일부가 유출된 점에 사과하고, 더 이상의 불미스런 사고가 생기지 않도록 보안대책을 수립하겠다고 밝혔습니다. 남양유업은 다만, 주민등록번호는 수집하지 않고 있으며 해당 기간 외에 가입한 회원정보는 유출되지 않았다고 덧붙였습니다. 인천지방경찰청 사이버수사대는 지난달 말 유진투자선물을 해킹해 30만 명의 개인정보를 빼낸 혐의로 28살 A씨를 구속했습니다. 경찰은 검거 당시 A씨가 소지한 노트북에서 3천300만 건의 개인정보를 발견했으며, 남양유업 홈페이지에서 유출된 정보도 이 중 일부인 것으로 조사됐습니다."
동아일보,003920,/news/news_read.nhn?article_id=0002987193&office_id=020&mode=search&query=남양유업&page=34,2016-07-10 17:32,"법원 &ldquo;&lsquo;밀어내기&rsquo; 남양유업, 대리점주에게 2억7500만원 배상하라&rdquo;",[동아일보] 서울중앙지법 형사합의10부(부장판사 이은희)는 남양유업으로부터 ‘물량 밀어내기’ 등으로 피해를 본 대리점주 윤모 씨에게 회사가 2억7500만 원을 배상하라고 판결했다고 10일 밝혔다. 윤 씨는 2008년부터 2012년까지 유통기한이 임박했거나 잘 팔리지 않는 제품들을 강제 할당받아 2억3000여만 원을 부담했다. 또 대형 할인점에 투입되는 판촉사원들의 임금 중 7700여만 원도 회사 대신 지급했다. 재판부는 남양유업의 물량 밀어내기 및 임금 전가에 대해 “거래상의 지위를 부당하게 이용한 행위”라고 판단했다.
문화일보,003920,/news/news_read.nhn?article_id=0002240548&office_id=021&mode=search&query=남양유업&page=51,2015-06-11 14:12,"비타민 D 채우세요&hellip;남양유업, 뼈건강 가정용 우유 출시","남양유업은 가정 전용 배달우유인 ‘칼슘 흡수를 위한 뼈 건강 비타민 D 우유’(사진)를 출시했다고 11일 밝혔다. 　 이 우유는 한 컵(200㎖)을 마실 때 1일 비타민 D 권장량과 칼슘의 1일 영양소 기준치의 각 50%, 60%를 충족할 수 있으며 지방함량은 2분의 1로 낮췄다고 남양우유는 설명했다. 한국인의 비타민 D 와 칼슘의 일일 영양소 기준치는 각각 5㎍, 700㎎이다. 　 이원구 남양유업 대표이사는 “비타민 D 우유는 뼈를 튼튼하게 하는 역할에 칼슘은 강화하고 지방은 낮춘 현대인에게 적합한 맞춤형 우유”라며 “외부활동이 부족한 직장인이나 골다공증이 걱정되는 노년층, 칼슘과 비타민이 필요한 성장기 어린이들에게 긍정적 영향을 줄 것”이라고 말했다. 180㎖와 900㎖ 두 가지 종류로 각 900원, 3000원."
뉴스1,003920,/news/news_read.nhn?article_id=0003069930&office_id=421&mode=search&query=남양유업&page=14,2017-11-28 09:54,"남양유업, '루카스나인 리저브 드립 인 스틱' 출시","남양유업 '루카스나인 리저브 드립 인 스틱' © News1 (서울=뉴스1) 신건웅 기자 = 남양유업은 핸드드립 커피의 맛과 향을 그대로 구현한 '루카스나인 리저브 드립 인 스틱(Lookas 9 Reserve Drip in Stick)'을 출시했다고 28일 밝혔다. 이 제품은 크라프트지 스틱에 원두커피 여과지를 부착한 제품이다. 물양으로 맛을 조절하는 기존 인스턴트커피와 달리 크라프트지 스틱을 담가 놓는 시간으로 커피의 맛과 향의 강도를 조절할 수 있다. 특히 핸드드립 커피의 맛과 향을 구현하기 위해 킬리만자로 고산지대에서 재배한 '케냐AA' 원두와 해발 1700미터 이상의 비옥한 화산토에서 자란 '과테말라 안티구아' 원두를 사용했다. 원두 함량도 기존 제품 대비 10배나 높여 갓 추출한 드립 커피 본연의 풍미를 살렸다. 소비자 판매가격은 7개입 4300원, 20개입 1만2000원이다. 박종수 남양유업 연구소장은 ""커피 마스터가 직접 내려주는 핸드드립 커피를 구현한 제품으로 스틱 커피의 수준을 한층 높였다""고 말했다."
뉴시스,003920,/news/news_read.nhn?article_id=0007597882&office_id=003&mode=search&query=남양유업&page=31,2016-11-18 09:39,[빅데이터MSI]빅데이터MSI 톱5&hellip;대상&middot;한국항공우주&middot;남양유업&middot;쌍용차&middot;일진머티리얼...,"【서울=뉴시스】강세훈 기자 = 18일 오전 빅데이터 시장심리지수(MSI)가 가장 높은 톱5에 대상·한국항공우주·남양유업·쌍용차·일진머티리얼즈가 선정됐다. 뉴시스와 코스콤이 주요 상장기업 250곳에 대해 공동 분석해 뽑아낸 빅데이터 MSI(Market Sentiment Index)에 따르면 전 거래일 오후 4시부터 이날 오전 8시까지 데이터를 취합한 결과 이같이 나타났다. 이날 톱5에 선정된 5개 종목 가운데 대상 MSI 레벨은 지난 17일 7단계를 기록한 데 이어 이날도 7단계를 유지했다. 대상은 최근 발표한 3분기 실적은 증권사 예상을 크게 밑돌았다. 3분기 영업이익은 365억원을 달성해 전년동기대비 16.3% 감소했다. 이는 증권가 예상치를 19.0% 하회한 것이다. 다만 4분기와 내년 실적은 개선될 것으로 증권가는 내다보고 있다. 한국투자증권 이경주 연구원은 16일 대상에 대해 ""3분기 실적이 라이신과 장류 부진으로 시장예상치를 밑돌았지만 라이신 실적이 앞으로는 개선될 것""이라며 ""현재와 같은 중국가격의 강세가 어느 정도 유지된다면 주 판매지역인 유럽지역의 가격도 동반 상승해 4분기 판가가 전분기보다 오를 확률이 높다""고 밝혔다. 한국항공우주 MSI 레벨은 지난 17일 6단계에서 이날 7단계로 뛰었다. 한국항공우주 주가는 지난 17일 6.15% 급등했다. 미국 고등훈련기 교체사업을 위해 개발한 T-50A의 미국 현지 시험비행을 앞두고 있다는 소식과 국산헬지 수리온의 납품이 중단 3개월만에 재개될 것이란 전망이 긍정적인 영향을 미친 것으로 풀이된다. 대신증권 이지윤 연구원은 ""수리온 3차양산에 대한 수주도 12월에 기대할 수 있을 듯하다""며 ""연말에 수리온 관련 2조4000억원의 수주를 기대하고 있다""고 밝혔다. 남양유업 MSI 레벨은 지난 17일 3단계에서 이날 7단계로 올랐다. 남양유업 주가는 최근 보름 사이 가파른 상승세를 나타내고 있다. 남양유업의 지난 3분기 기준 영업이익이 전년 동기 대비 52.0% 늘어난 95억원을 기록했다. 쌍용차 MSI 레벨은 지난 17일 5단계에서 이날 7단계로 올랐다. 쌍용차는 지난 17일 올들어 10월까지 이란에 전년 대비 600%이상 증가한 5486대의 차량을 수출했다고 밝혔다 일진머티리얼즈 MSI 레벨은 지난 17일 1단계에서 이날 7단계로 올랐다. 지난 17일 주가는 5.12% 올랐다. 미래에셋대우 류영호 연구원은 지난 15일 일진머티리얼즈에 대해 ""3분기 시장 예상보다 부진한 실적을 발표했다""며 ""본 사업에 대한 확인이 필요한 시점""이라고 밝혔다. 한편 뉴시스와 코스콤은 온라인과 소셜네트워킹서비스(SNS)에서 수집된 개별 종목 관련 빅데이터를 긍정과 부정으로 분류해 점수화한 다음 이를 최근 1년 간 흐름과 비교해 지수를 산출했다. MSI산출 대상은 코스피 200종목과 코스피 지수, 코스닥 50종목과 코스닥 지수 등 250개 개별 종목이다. MSI는 1단계 '매우 나쁨', 2단계 '나쁨', 3단계 '약간 나쁨', 4단계 '보통', 5단계 '약간 좋음', 6단계 '좋음', 7단계 '매우 좋음' 등 총 7단계로 분류한다."
연합뉴스,003920,/news/news_read.nhn?article_id=0007653334&office_id=001&mode=search&query=남양유업&page=51,2015-06-11 11:15,"남양유업, '칼슘&middot;비타민D 우유' 출시","(서울=연합뉴스) 이도연 기자 = 남양유업은 한컵으로 비타민D 권장량의 절반, 칼슘 기준치의 60％를 섭취할 수 있는 '칼슘 흡수를 위한 뼈건강 비타민D 우유'를 출시했다고 11일 밝혔다. 새 우유 200㎖ 기준, 비타민D 2.5ug, 칼슘 460mg이 들어있어 비타민D와 칼슘의 일일 영양소 기준치(각각 5㎍, 700㎎) 부족분을 충족할 수 있다고 남양유업은 설명했다. 지방함량은 기존 자사 제품 대비 절반으로 낮췄다. 가격은 180㎖ 제품은 900원, 900㎖는 3천원이며 가정배달로만 판매된다. 체내에서 합성이 되지 않는 비타민D는 체내 칼슘흡수를 도와 뼈를 튼튼하게 하고 면역력에 도움을 주는 것으로 알려지면서 큰 관심을 얻고 있다. 건강보험 심사평가원에 따르면 우리나라의 비타민D 결핍환자 수는 매년 상승하고 있으며 골다공증, 골연화증, 골관절염 등 각종 질환자도 증가하고 있다. 남양유업 관계자는 ""비타민D 우유는 외부활동이 부족한 직장인들뿐만 아니라 골다공증이 걱정되는 노년층, 칼슘과 비타민이 필요한 성장기 어린이들에게 좋은 영향을 미칠 것으로 기대한다"" 고 전했다."
