source,symbol,link,date,title,content
뉴스1,003920,/news/news_read.nhn?article_id=0002699287&office_id=421&mode=search&query=남양유업&page=26,2017-04-27 06:40,"남양유업, 주력 컵커피 '카와' 제품명 버리고 용량 늘린다","사진 = 유가공업계 © News1 '카와→로스터리' 리뉴얼 단행…250→270㎖ 용량 늘려매일·남양, 컵커피 시장 양분…분유 재고소진 효과 기대 (서울=뉴스1) 장도민 기자 = 본격적인 '컵커피 전쟁'을 앞두고 남양유업이 주력 커피 제품인 '프렌치카페 카와'의 제품명과 용량 등을 리뉴얼한 것으로 확인됐다. 매일유업과 남양유업, 일동후디스, 빙그레 등 유가공 전문 업체들마다 인스턴트 컵커피 시장에 공을 들이고 있는 것은 시장규모가 분유보다 커 주도권을 잡을 경우 안정적인 수익원을 확보할 수 있기 때문이다. 컵커피 제조업체들 입장에서는 남아도는 수익을 내면서도 과도하게 쌓여있는 분유 재고를 소진하는 효과를 볼 수 있다. 대규모 영업망을 갖춘 서울우유협동조합이 컵커피 등 시장 진출을 예고한 상황인 만큼 사전에 시장 점유율을 확보해두기 위한 의도도 담겨 있다. 27일 관련업계에 따르면 남양유업은 본격적인 음료시장 성수기를 앞두고 프렌치카페 카와를 '프렌치카페 로스터리'로 명칭을 바꿨다. 카와를 출시한 지 5년만이다. 기존 가격을 유지하기로 했지만 용량은 250㎖에서 270㎖로 늘렸다. 지난해부터 국내 컵커피 업체들마다 용량으로 승부수를 던지고 있는 영향이다. 일부 업체의 경우 지난해 여름이 시작되기 앞서 300㎖ 이상의 제품을 출시하기도 했다. 남양유업이 주력 컵커피 제품 중 하나인 프렌치카페 카와를 리뉴얼한 것은 시장 1위 업체인 매일유업의 점유율을 끌어오겠다는 전략이다. 이 회사는 2013년 3종으로 카와(로스터리)를 출시한 뒤 2015년 4종으로 늘렸으며 지난해에는 6종까지 제품 종류를 다양화하는 등 컵커피 시장 점유율 확보에 공을 들이고 있다. 이를 통해 남양유업은 시장 2위 자리를 견고하게 지키고 있지만 선두 제품과의 격차가 좁혀지지 않고 있어서 '강수'가 필요한 상황이었다. 서울우유협동조합이 신공장 컵커피 제조설비를 도입해 시장 진출을 예고한 점도 남양유업의 결정에 영향을 미친 것으로 알려졌다. 현재 국내 인스턴트 컵커피 시장은 유가공 전문업체인 매일유업과 남양유업이 수년째 양분하고 있다. 닐슨코리아에 따르면 국내 인스턴트 컵커피 시장에서 매일유업과 남양유업이 차지하고 있는 비중은 지난해 말 기준 약 70%에 달한다. 매일유업이 약 40% 수준의 점유율을 차지하고 있으며 남양유업은 30% 정도다. 이들이 본업인 유가공사업보다 컵커피 시장 경쟁에 열을 올리고 있는 배경에는 성장성과 시장 규모가 자리잡고 있다. 국내 인스턴트 컵커피 시장 규모는 4000억원 수준으로 약 3500억원인 영유아용 분유시장보다 크게 형성돼 있다. 신생아 수 감소로 우유소비가 줄어드는 상황에서 컵커피 시장 경쟁에서 우위를 점할 경우 수익성을 보전할 수 있다는 의미다. 편의점 관계자는 ""최근 남양유업이 프렌치카페 카와를 로스터리로 바꿔서 일부 매장에 납품하기 시작했다""며 ""남양유업에서 '2+1' 행사 물량을 요청하는 등 대대적으로 영업하려는 움직임을 보이고 있다""고 말했다."
서울경제,003920,/news/news_read.nhn?article_id=0003238200&office_id=011&mode=search&query=남양유업&page=9,2018-03-07 16:18,"남양유업, 보통주 1,000원&middot;종류주 1,050원 현금배당 결정","[서울경제] 남양유업(003920) 은 보통주 1주당 1000원, 종류주 1주당 1050원의 현금 결산배당을결정했다고7일공시했다. 시가배당율은 각각 0.1%, 0.5%이며 배당금총액은 8억5470만원이다. 배당금 지급 예정일자는 4월 20일이다."
데일리안,003920,/news/news_read.nhn?article_id=0002249281&office_id=119&mode=search&query=남양유업&page=8,2018-03-30 15:58,"남양유업, &lsquo;프렌치카페 듀얼 로스터리&rsquo; 출시로 250ml 컵커피 시장 총력","남양유업은 내달 1일 250ml 컵커피 시장을 공략할 ‘프렌치카페 듀얼 로스터리’를 출시한다. 이 제품은 커피 맛을 좌우하는 로스팅 기법을 한 차원 진화시킨 것으로, 각각의 생두와 로스터기의 특성에 맞춰 최적의 맛과 향을 낼 수 있도록 WKCC 수상 수석 로스터가 직접 로스팅 했다. 각 원두의 개성을 완벽히 구현하기 위해 서로 다른 특성을 가진 2대 로스터기를 활용한 듀얼 로스팅 기법을 개발 적용했으며, 애프터 블렌딩 기법을 통해 명품 원두 본연이 가지고 있는 특징을 완벽히 끌어냈다고 회사 측은 설명했다. 이 듀얼 로스팅 기법은 생두를 볶는 시간이 각각 달라, 생산하기까지의 시간이 많이 소요되고 까다롭지만 남양유업은 커피전문점에서 즐기던 최고급 커피 맛을 그대로 재현해 내기 위해 과감하게 이 기법을 도입했다. 또한 최고급 원두를 위해 커피헌터가 세계적인 커피벨트를 직접 누비며 찾아낸 1% 명품 원두만 사용했다. 남양유업은 커피전문점에서 마시는 커피 맛 그대로 컵커피에 담겠다는 일념으로 카페에서 커피를 만드는 로스터, 바리스타 등 23인의 커피 전문가 집단과 1년간의 시행착오 끝에 최적의 커피 밸런스를 찾아냈다고 밝혔다. 기존 제품에 진행해 오던 프로모션 중 하나인 20ml 추가 증정 이벤트는 신제품 출시와 함께 종료하고, 더 많은 고객이 체험할 수 있도록 2+1증정 프로모션은 더 강화할 예정이다. 전문점 수준 이상의 커피 맛을 알리기 위한 시음 및 young target에 적합한 이벤트도 추가로 진행할 계획이다. 이정인 남양유업 대표이사는 “커피 시장이 계속 성장하고 있기에 200ml에서 유지하고 있는 컵커피의 선두자리를 250ml 시장으로도 확대할 수 있도록 품질개선에 총력을 다하겠다”고 밝혔다. 신제품 ‘프렌치카페 듀얼 로스터리’는 돌체라떼, 에스프레소 리치라떼 카라멜 리치 에스프레소 등 총 7종으로 구성되며, 가격은 1900원이다."
파이낸셜뉴스,003920,/news/news_read.nhn?article_id=0003797556&office_id=014&mode=search&query=남양유업&page=28,2017-04-03 10:34,"[fnRASSI]남양유업(003920), 52주 신고가 경신...0.59% &uarr;","남양유업(003920)은 52주신고가를 기록하고 있어 주목할만하다. 동종목의 현재 주가는 855,000원 선에서 이루어지고 있다. 거래일을 기준으로 최근 3일간 평균 거래량은 1만 주이다. 이는 60일 일 평균 거래량 678만 주와 비교해보면 최근 거래량이 급격히 늘어났다는 것을 알 수 있다. 상장주식수 대비 거래량은 0.12%로 적정수준 최근 한달간 남양유업의 상장주식수 대비 거래량을 비교해보니 일별 매매회전율이 0.12%로 집계됐다. 그리고 동기간 장중 저점과 고점의 차이인 일평균 주가변동률을 2.73%를 나타내고 있다. 거래비중 기관 40.32%, 외국인 24.35% 최근 한달간 주체별 거래비중을 살펴보면 기관이 40.32%, 개인이 35.32%, 외국인은 24.35%를 기록했다. 그리고 최근 5일간 거래비중은 개인이 전체 거래량의 43.14%를 차지하며 가장 활발한 참여를 보였고, 기관은 31.89%, 외국인은 24.95%의 거래 참여율을 보였다. 'fnRASSI'는 증권전문 기업 씽크풀과 파이낸셜뉴스의 협업으로 로봇기자가 실시간으로 생산하는 기사입니다."
뉴스1,003920,/news/news_read.nhn?article_id=0001985412&office_id=421&mode=search&query=남양유업&page=38,2016-04-06 14:30,"남양유업, 서울우유에 '맞불'&hellip;세균&middot;체세포 수 1등급 원유 사용","© News1 (서울=뉴스1) 장도민 기자 = 남양유업이 최고등급 원유 마케팅을 펼치고 있는 서울우유를 향해 '맞불'을 놨다. 이 회사는 '맛있는 우유 GT' 및 '저지방우유' 등 우유 주력제품에 사용되는 원유를 세균 및 체세포수 1등급 원유로 변경한다고 6일 밝혔다. 원유의 위생등급 기준은 크게 세균수와 체세포수로 나뉜다. 기존 대부분의 우유는 세균수만을 기준으로 1등급 표시를 해왔다. 체세포수는 젖소의 건강상태를 알려주는 지표다. 1등급인 ml당 20만개 미만부터 5등급 75만개 까지로 분류되며 체세포수가 적을수록 젖소가 건강하고 원유가 깨끗하다는 것을 알 수 있다. 그동안 낙농기술의 발전과 목장의 노력으로 국내 원유는 대부분 세균수 1A등급을 유지해 왔다. 하지만 체세포수는 세균수에 비해 관리가 어렵고 일반우유와 분리해 관리, 생산해야 하기 때문에 체세포수 1등급 원유 사용은 시도되지 못했다. 남양유업은 체세포1등급 원유사용을 위해 수의사들을 공장에 배치해 각 목장에서 생산되는 원유의 품질을 집중적으로 관리 해왔으며 일반원유와 구별해 집유 및 생산하는 시스템을 갖췄다. 이원구 남양유업 대표이사는 ""세균수와 체세포수가 모두 최고등급인 원유를 사용해 뛰어난 품질의 제품을 만들 것""이라고 말했다. 남양유업은 이번 결정으로 우유 생산원가가 3~5% 가량 늘어나게 됐지만 우유소비촉진을 위해 맛있는 우유 GT(2550원), 저지방우유 3종(2630원) 모두 기존 가격을 유지하기로 결정했다."
매일경제,003920,/news/news_read.nhn?article_id=0003930246&office_id=009&mode=search&query=남양유업&page=26,2017-04-25 14:47,"11번가, 남양유업과 공동 마케팅 제휴",SK플래닛이 운영하는 오픈마켓 11번가가 남양유업과 공동마케팅을 추진하는 기업 제휴 파트너십을 맺었다고 25일 밝혔다. 두 회사는 올해 사물인터넷(IoT) 기술을 활용해 고객 로열티를 높이는 '프라임 서비스'를 비롯해 11번가의 직매입 코너인 '나우배송'에서의 단독 기획상품 판매 등을 추진할 계획이다. 이번 제휴 첫 프로모션으로 11번가는 나우배송 내 남양유업 상품에 11% 할인쿠폰(1만원 이상 구매시 최대 1만원 할인)을 제공하는 '남양유업 브랜드위크' 행사를 30일까지 진행한다. 이와 함께 남양유업이 첫 출시하는 '임페리얼 유기농 분유' 3캔을 주문하면 1캔을 추가 증정하는 '3+1' 행사도 연다. [최승진 기자] r_start // r_end //
이데일리,003920,/news/news_read.nhn?article_id=0003516575&office_id=018&mode=search&query=남양유업&page=38,2016-04-06 14:04,"남양유업, '세균수와 체세포수 1등급'으로 원유 바꾼다","[이데일리 함정선 기자] 남양유업(003920)은 ‘맛있는 우유 GT’ 및 ‘저지방우유’ 등 우유 주력제품에 사용되는 원유를 4월부터 세균수기준 1등급뿐만 아니라 체세포수 기준으로도 1등급을 받은 최고품질로 바꾼다고 6일 밝혔다. 원유의 위생등급기준은 (식품의약품안전처 고시 ‘제 2014-120호에 의거) 크게 세균수와 체세포수로 나뉘며, 기존 대부분의 우유는 세균수만을 기준으로 1등급 표시를 해왔다. 체세포수는 젖소의 건강상태를 알려주는 지표로, 1등급인 ml당 20만개 미만부터 5등급 75만개 까지로 분류되며, 체세포수가 적을수록 젖소가 건강하고 원유가 깨끗하다는 의미다. 낙농기술의 발전과 목장의 노력으로 국내 원유는 대부분 세균수 1A등급을 유지해 왔지만, 체세포수는 세균수에 비해 관리가 어렵고 일반우유와 분리해 관리, 생산하기 때문에 체세포수 1등급 원유 사용은 쉽게 않은 것으로 알려졌다. 남양유업은 체세포1등급 원유사용을 위해 수의사들을 공장에 배치해 각 목장에서 생산되는 원유의 품질을 집중적으로 관리 해왔으며 일반원유와 구별해 집유·생산하는 시스템을 갖췄다. 이원구 남양유업 대표는 “세균수와 체세포수가 모두 최고등급인 원유를 사용한 제품을 내세워 침체된  유가공 현실을 품질로 돌파하겠다”고 밝혔다. 남양유업은 우유 생산원가가 3~5% 가량 늘어나지만, 우유소비촉진을 위해 가격은 올리지 않기로 했다."
헤럴드경제,003920,/news/news_read.nhn?article_id=0001362832&office_id=016&mode=search&query=남양유업&page=9,2018-03-07 16:02,"남양유업, 보통주 1000원ㆍ종류주 1050원 현금배당 결정","[헤럴드경제=증권팀] 남양유업은 보통주 1주당 1000원, 종류주 1주당 1050원의 현금 결산배당을결정했다고7일공시했다. 시가배당율은 각각 0.1%, 0.5%이며 배당금총액은 8억5470만원이다. 배당금 지급 예정일자는 4월 20일이다."
서울경제,003920,/news/news_read.nhn?article_id=0003021614&office_id=011&mode=search&query=남양유업&page=26,2017-04-25 12:39,"11번가, 남양유업과 업무 협약 체결&middot;&middot;&middot;공동마케팅 진행",24일 서울 논현동 남양유업 본사에서 송승선(오른쪽) SK플래닛 리테일본부장이 박진성 남양유업 인터넷사업 본부장과 업무협약을 체결하고 있다. 양 기관은 식품 기획 판매 등 공동 마케팅에 나선다./사진제공=SK플래닛
조세일보,003920,/news/news_read.nhn?article_id=0002131547&office_id=123&mode=search&query=남양유업&page=39,2016-03-24 13:54,"남양유업, 영양성분 강화한 '가정배달 우유' 선보여","기존 제품 업그레이드시킨 '맛있는 우유 GT 프리미엄 아침의 선물' 출시 남양유업(대표 이원구)이 기존 가정전용 배달우유 '맛있는 우유 GT 프리미엄'의 성분을 한층 강화하고 용기 디자인도 새롭게 바꾼 '맛있는 우유 GT 프리미엄 아침의 선물'을 출시했다. 이 우유는 우유 단백질과 칼슘은 높이고, 칼슘흡수를 위해 비타민 D와 필수 비타민 A, E를 더한 온가족이 즐길 수 있는 프리미엄 우유라고 남양 측은 소개했다. 특히 기존 'GT 프리미엄' 보다 우유단백질과 칼슘을 10% 높이고, 분말 단백질을 첨가하지 않아 오직 우유만으로 단백질 함량을 높인 게 큰 특징이며, 200ml기준으로 두잔만 음용해도 부족한 비타민 D의 하루 권장량을 100%로 충족한다고 덧붙였다. 또한 계절별 미세한 맛의 변화를 최소화 하고 4계절 내내 최상의 품질과 맛을 유지하기 위해 우유속 유지방을 동일하게 유지시키는 MFS 시스템을 적용하고, 1등급 원유보다 더 까다롭게 관리되는 1A등급 원유를 사용한 것이 특징이라는 것. 남양유업 이광범 영업총괄 본부장은 “'맛있는 우유 GT 프리미엄 아침의 선물'은 원유부터 엄선된 목장에서 가져와 칼슘 같은 영양을 전보다 증대시킨 강화우유로 제품명 그대로 각 가정에 제공되는 아침의 선물로서 손색이 없을 것”이라고 자신했다. 이 우유는 용량이 200ml, 450ml, 930ml로 전과 변함없으며 가격 또한 900원, 1700원, 2800원으로 동일하며, 주문신청은 남양유업 가정배달 홈페이지 혹은 전화주문으로 가능하다. ★ 화끈한 토픽·쏠쏠한 정보 조세일보 페이스북 초대합니다."
머니S,003920,/news/news_read.nhn?article_id=0000309101&office_id=417&mode=search&query=남양유업&page=8,2018-04-11 09:45,"남양유업, &lsquo;프렌치카페 듀얼 로스터리&rsquo; 선보여","남양유업(대표 이정인)이 250ml 컵커피 시장을 공략할 ‘프렌치카페 듀얼 로스터리’를 출시했다. 이 제품은 커피 맛을 좌우하는 로스팅 기법을 한 차원 진화시킨 것으로, 각각의 생두와 로스터기의 특성에 맞춰 최적의 맛과 향을 낼 수 있도록 WKCC 수상 수석 로스터가 직접 로스팅 하였다. 각 원두의 개성을 완벽히 구현하기 위해 서로 다른 특성을 가진 2대 로스터기를 활용한 듀얼 로스팅 기법을 개발 적용하였으며, 애프터 블렌딩 기법을 통해 명품 원두 본연이 가지고 있는 특징을 완벽히 끌어냈다."
뉴시스,003920,/news/news_read.nhn?article_id=0007231863&office_id=003&mode=search&query=남양유업&page=37,2016-05-17 13:21,[빅데이터MSI유망주]남양유업 &quot;中 분유시장 점유율 꾸준히 늘려나갈 것&quot;,"중국 분유시장 점유율 확보는 길게 봐야 대리점 격인 '경소상' 계속 확보해 나갈 것 【서울=뉴시스】최예린 기자 = 남양유업(003920)이 빅데이터로 뽑은 오늘의 유망주로 나타났다. 주요 수익원인 우유류의 수익률이 저조한 가운데 조제분유를 앞세운 중국 시장 내 점유율 확대에 대한 기대감이 반영된 것으로 풀이된다. 17일 오전 11시 현재 남양유업의 주가는 74만4000원으로 지난 9일부터 이날까지 7일 연속 상승세를 보이고 있다. 17일 뉴시스와 코스콤이 주요 상장기업 250곳에 대해 블로그와 카페, 뉴스 등 온라인에서 뽑아내 분석한 빅데이터 MSI(Market Sentiment Index·시장심리지수)에 따르면 전 거래일 오후 4시부터 이날 오전 8시까지 남양유업의 MSI지수는 6단계(좋음)로 나타났다. 남양유업은 지난 13일 4단계(보통), 16일 4단계(보통) 수준에 머물렀지만 이날 7단계로 급등하면서 관심주로 떠올랐다. 긍정 스코어는 2, 부정스코어는 0으로 온라인상에서 긍정적인 의견들이 오간 것으로 보인다. 작년 말 기준으로 남양유업의 주가수익비율(PER)은 24.55배, 주가순자산비율(PBR)은 0.74배, 자기자본이익률(ROE)은 3.19% 기록했다. 다음은 남양유업 관계자와의 일문일답. Q.지난 1월 중국 온라인 전용 조제분유 브랜드 '싱베이능'을 출시했다. 현재 수출량과 판매 현황은. A.지난해 10월 초도 물량 10만 캔을 중국으로 수출했다. 이 물량이 다 소진되고 요청이 들어오면 추가로 더 수출한다. 아직 완판 전이며 구체적인 판매량은 확인되지 않았다. Q.중국시장이 실적에 미치는 영향은 어느 정도인가. A.중국의 분유 시장은 우리나라보다 훨씬 크다. 특히 중국의 한 자녀 정책이 완화되면서 더 커졌다. 작년 기준 매출 규모가 3500만 달러 정도로 전체 분유 매출에서 차지하는 비중이 점점 늘어나고 있다. 싱베이능 및 기타 제품 모두 신장률이 높다. Q.중국 시장 내 유통망 확대를 위한 전략은 무엇인가. A.중국의 유통망은 우리나라보다 복잡하다. 우선 우리나라의 대리점 개념인 경소상에게 남양유업 제품의 우수성과 수익성을 알려야 유통망 확보가 가능하다. 경소상들이 각각 한 개의 중국 성을 담당하면서 세계 여러 국가의 분유 브랜드를 취급하기 때문이다. 꾸준히 우수한 경소상들을 확보해 진열률을 높여가려고 한다. 또 점차 도시화되고 있는 농촌 지역 소재의 큰 유통업체에 판촉행사를 하거나 소비자에게 면대면으로 제품을 알리고 있다. Q.주요 수익원인 우유류 재고물량은 어떻게 처리하고 있나. A.우유를 탈지화시켜 가공유, 발효유에 넣어 소진하고 있다. 그런데 근본적으로 국내 원유 소비가 안돼 원유가 계속 남는다. 유가공협회 등 모두 우유가 몸에 좋다는 식으로 활동을 펼치고 있다. Q.신제품 출시 계획은. A.원유를 많이 사용한 제품을 가공유나 발효유 제품군으로 꾸준히 내놓을 예정이다. 특히 저지방 우유, 유기능 우유와 같은 기능성 우유 제품을 확대하려고 한다."
아시아경제,003920,/news/news_read.nhn?article_id=0003709879&office_id=277&mode=search&query=남양유업&page=39,2016-03-18 14:00,"[봄이 왔어요]남양유업, 당 함량 25% 줄인 '프렌치카페 카페믹스' 출시","커피믹스 한잔도 살 찔 걱정 없이 건강하게 [아시아경제 이주현 기자]남양유업은 커피믹스 제품 ‘프렌치카페 카페믹스’의 당 함량을 기존제품 대비 25%나 줄인 리뉴얼 신제품을 지난해 말 출시했다. 2013년 9월 식약처에서 발표한 ‘우리 국민의 당류 섭취량 분석결과’ 에도 나와있듯이 30세 이상 성인층 대상 가공식품 음료류 중 커피를 통한 당류 섭취량이 가장 높았다. 특히 커피믹스를 하루 2잔(당 함량 10~14g, 잔당 5~7g) 이상 마실 경우 세계보건기구(WHO)에서 권고하는 일일 당 섭취 권장량 50g에 가깝게 되는 만큼 자칫 잘못하다간 심각한 영양불균형을 초래할 수 있다. 하지만 그간 경쟁적으로 당을 줄여왔던 다른 식품군들과는 달리 커피믹스의 경우 단 맛이 선호도에 결정적인 역할을 하기 때문에 이러한 당 저감화 대열에 합류하지 못했다. 금번 새롭게 재 탄생한 프렌치카페 카페믹스는 기존에 6g 이상이었던 커피믹스의 당 함량을 4g대로 대폭 낮췄으며 우유의 부드럽고 달콤한 특성을 최대한 살리고 설탕대신 말티톨과 자일리톨을 배합하여 칼로리는 낮추면서도 맛은 지켜냈다. 또한, 당 저감과 더불어 금번 남양유업 프렌치카페 카페믹스는 커피 본연의 맛을 극대화 하기 위해 한층 더 업그레이드된 OPR공법으로 기존의 통합 로스팅에서 원두별 분리 로스팅으로 개별 원두의 특색있는 맛을 최대한 이끌어 냈다. 추출하는 방식에 있어서도 커피 쓴맛은 제거하고 커피 본연의 달콤함과 부드러움을 살려주는 저온 분리 추출방식을 택했으며 고온의 추출액에서 발생되는 이취를 진공으로 제거해 잡냄새 없이 깔끔한 맛을 구현해 냈다. 또한 커피믹스에서 빼 놓을 수 없는 향 역시 갓 볶은 신선하고 깊은 향을 따로 회수하는 공법을 통해 더욱더 깊고 진한 아로마를 느낄 수 있게 했다. 남양유업은 이번 신제품 개발을 위해 총 50차례, 1만 여명의 소비자를 대상으로 맛 테스트를 진행한 결과, 대부분의 소비자로부터 기존 제품에 비해 맛이 더 좋아졌다는 평가를 받음으로써 제품출시에 자신감을 얻고 주력제품 전체의 당을 낮추게 됐다. 품질일류가 세계일류라는 기업철학 아래 홍원식 남양유업 회장이 애정을 쏟고 있는 커피믹스는 시장진출 4년만에 내수시장 2위 탈환은 물론, 해외수출에서도 13년과 14년에 걸쳐 총 2000만불이 수출되는 등 해외시장에 박차를 가하고 있다. 이원구 남양유업 대표이사는 “첨가물 대신 무지방 우유를 건강한 커피믹스의 새 지평을 열었던 ‘프렌치 카페 카페믹스’가 이제는 당까지 25%나 줄여 더욱 업그레이드 되었다” 며 “당 걱정 없이 안심하고 커피를 즐기시길 바란다” 고 밝혔다."
