source,symbol,link,date,title,content
전자신문,005690,/news/news_read.nhn?article_id=0002663045&office_id=030&mode=search&query=파미셀&page=1,2017-12-01 10:30,"[ET투자뉴스]줄기세포 관련주테마, 차바이오텍, 파미셀 중심으로 강세","금일  현재, 줄기세포 관련주테마가 전일대비 4.42% 상승하며 강세를 보이고 있다. 상승폭으로는 차바이오텍 29.93%로 선두권에 있으며 파미셀(15.19%), 리더스코스메틱(3.33%)도 강세이다. 반면, 이지바이오(-0.64%)는 약세권에 머물러 있다. [테마내 주요종목 시세] * 차바이오텍 : 18,450원 (▲4250) *파미셀:5,650원 (▲745) *리더스코스메틱:21,700원 (▲700) [테마내 주요종목 재무요약] * 차바이오텍 : 영업이익률 현재 1.89%로 업종평균 수준.PER은 159로 업종평균보다 높으며, PBR은 1.53임. * 파미셀 : 영업이익률 현재 -11.94%로 업종평균 하회.  PBR은 3.12로 다소 높은편 * 리더스코스메틱 : 영업이익률 현재 3.27%로 업종평균 수준.PER은 202.26으로 업종평균보다 높으며, PBR은 3.11로 다소 높은편. [테마내 종목별 외국인 지분변동] * 차바이오텍 :  최근 2주간 -0.74%감소하여 현재 보유율은 3.77% * 파미셀 :  최근 2주간 -0.64%감소하여 현재 보유율은 2.47% * 리더스코스메틱 :  최근 2주간 -0.12%감소하여 현재 보유율은 2.82%"
한국경제TV,005690,/news/news_read.nhn?article_id=0000614007&office_id=215&mode=search&query=파미셀&page=1,2018-03-22 13:19,[이시각 특징주] 파미셀 11거래일 상승랠리...신약 기대감 확대,"[한국경제TV 오세인 기자] 국내증시는 외국인과 기관의 매수가 양지수를 이끌며 FOMC이후 안도 랠리 나타나는 모습입니다. 현재 이 시각에는 어떤 흐름이 포착되고 있는 지 확인하겠습니다. 테마 상위에는 금리상승수혜주가 자리하고 있습니다. 연준이 1.50~1.75%의 금리인상을 발표하면서 금융주가 장 초반부터 강세를 보이고 있습니다. 상승률 상위를 보면 오늘도 파미셀이 상단에 위치해 있습니다. 파미셀은 11거래일째 상승랠리를 타고 있습니다. 줄기세포 신약에 대한 기대감 때문인데요. 전일 유럽제약사와 3원의 계약 소식이 있기도 했습니다. 파미셀 현재 이 시각, 17%의 급등입니다. OCI도 중국 환경 규제 강화에 따른 실적 기대감에 강세를 보이고 있습니다. 현재 7%의 오름세입니다. 호텔신라는 1분기 호실적 전망에 4%의 오름세를 보이고 있습니다. 코스피 시가총액 상위도 확인하겠습니다. 오늘 삼성그룹주들 양호한 오름세를 보여주고 있는데요. 삼성전자도 1%의 견조한 오름세를 보이는 상황입니다. SK이노베이션은 전일 미국 셰일업체 인수하면서 석유개발 영토를 밝혔는데요. 오늘까지 4거래일째 상승을 보여주고 있고 2% 가까이 상승하고 있습니다. 코스닥 시가총액 상위도 보겠습니다. 제약바이오주는 빨간 불을 켜고 있는 가운데 메디톡스가 전일 외국인과 기관의 동반 매도로 3% 넘게 빠지며 종가를 형성했었는데요. 오늘 반등에 성공하며 5% 넘게 오르고 있습니다. 포스코켐텍은 전기차 시장 본격 성장에 따라 수혜 기대감을 받고 있고, 에이치엘비도 오늘 줄기세포섹터와 함께 강세 시현하고 있습니다. 에이치엘비는 국내 최초로 1조원의 신약 임상성공이 전망되고 있습니다. 오세인기자 ⓒ 한국경제TV, 무단 전재 및 재배포 금지 한국경제TV 관련뉴스해당 언론사에서 선정하며 언론사 페이지(아웃링크)로 이동해 볼 수 있습니다.노현정, 故 정주영 회장 제사 현장 포착…'더 예뻐졌네'골프여왕 박인비, 외모 때문에 메인스폰서 없었던 사연은?신성일, ""보디빌더 나갔다""던 리즈시절 사진 봤더니설현, 원주민도 반한 사연…만국 공통 몸매?'문재인 대통령 노벨상 추진위' 해산 이유"
전자신문,005690,/news/news_read.nhn?article_id=0002664699&office_id=030&mode=search&query=파미셀&page=1,2017-12-07 12:04,"[ET투자뉴스]줄기세포 관련주테마, 파미셀, 차바이오텍 중심으로 약세","금일  현재, 줄기세포 관련주테마가 전일대비 -4.2% 하락하며 약세를 보이고 있다. 하락폭으로는 파미셀 -7.72%로 선두권에 있으며 차바이오텍(-4.81%), 리더스코스메틱(-4.09%)도 약세이다. [테마내 주요종목 시세] * 파미셀 : 6,100원 (▼510) *차바이오텍:19,800원 (▼1000) *리더스코스메틱:19,950원 (▼850) [테마내 주요종목 재무요약] * 파미셀 : 영업이익률 현재 -11.94%로 업종평균 하회.  PBR은 3.93으로 다소 높은편 * 차바이오텍 : 영업이익률 현재 1.89%로 업종평균 수준.PER은 241.03으로 업종평균보다 높으며, PBR은 2.32임. * 리더스코스메틱 : 영업이익률 현재 3.27%로 업종평균 수준.PER은 191.71로 업종평균보다 높으며, PBR은 2.95임. [테마내 종목별 외국인 지분변동] * 파미셀 :  최근 2주간 -0.45%감소하여 현재 보유율은 2.18% * 차바이오텍 :  최근 2주간 -0.48%감소하여 현재 보유율은 3.79% * 리더스코스메틱 :  최근 2주간 -0.7%감소하여 현재 보유율은 1.79%"
파이낸셜뉴스,005690,/news/news_read.nhn?article_id=0003997093&office_id=014&mode=search&query=파미셀&page=1,2018-04-06 15:35,"[fnRASSI]비씨월드제약,파미셀 등 27종목 52주 신고가 경신","06일 비씨월드제약(200780), 파미셀(005690), 미래SCI(028040), JTC(950170), 삼천당제약(000250), 에이치엘비(028300)등이 장중 52주 신고가를 경신했다. 특히 비씨월드제약은 전 거래일 대비 24.5% 오른 32,000원에 거래를 마감하며 높은 관심을 받았다. 이외에 인터불스는 13500원까지 올라 신고가를 경신했으나, 전일보다 오히려 하락한 11,850원에 거래를 마감했다. 'fnRASSI'는 증권전문 기업 씽크풀과 파이낸셜뉴스의 협업으로 로봇기자가 실시간으로 생산하는 기사입니다."
아시아경제,005690,/news/news_read.nhn?article_id=0004134812&office_id=277&mode=search&query=파미셀&page=1,2017-12-06 16:20,파미셀 &quot;현저한 시황 변동 관련 중요 공시 사항 없다&quot;,"[아시아경제 권성회 기자] 파미셀은 최근 현저한 시황 변동 관련 한국거래소의 조회공시 요구에 대해 중요한 공시사항은 없다고 6일 답변했다. 다만 회사 측은 ""원료의약품 공장의 신축 및 확장이전에 따른 일시 생산중단을, 설비이전 일정이 확정되면 공시할 예정""이라고 밝혔다."
한국경제TV,005690,/news/news_read.nhn?article_id=0000611328&office_id=215&mode=search&query=파미셀&page=1,2018-03-15 09:12,"파미셀, 52주 신고가 경신... 전일 대비 4% 상승","[한국경제TV 라이온봇 기자] 파미셀은 52주 신고가를 경신했다. 파미셀은 3월 15일 9시 12분 전일 대비 약 4% 상승한 9,070원에 거래되고 있다. 파미셀은 코스피 상장 기업으로 의약품 업종에 속해 있다. 시가총액은 3,913억원으로 코스피 상장기업 중 309위에 위치 해 있다. [종목 성향 진단] [그림 1] 종목 성향 진단 파미셀의 투자 스타일은 성장주에 가깝다. 주가 고평가 우려가 공존하지만 높은 성장성이 기대되는 기업이다. 주가 모멘텀은 좋은 편에 속했다. 최근 1개월 수익률은 23.16%의 상승폭을 기록했다. 파미셀 종목에 대한 투자자의 관심도는 굉장히 높은 편이다. [투자 점수 진단] [그림 2] 투자 점수 진단 파미셀은 안정성(부채비율) 측면에서 두각을 나타내고 있다. 최근 부채비율은 89점으로 6개의 핵심 팩터 중 가장 높은 점수를 기록했다. 부채비율은  전체 시장 내 1675위를 기록하며 상위 10.86%에 위치했다. 업종별로는 175위를 기록하며 상위 10.17%에 위치했다. 그리고 성장성(매출증가율(YoY)) 역시 도드라지는 편이다. 성장성 점수는 82점으로 두번째로 높은 점수를 기록했다. 매출증가율(YoY)은 전체 시장 내 63위를 기록하며 상위 18.29%에 위치했다. 업종별로는 11위를 기록하며 상위 17.54%에 위치했다. 그러나 ROA와 PBR은  아쉬움을 나타냈다. [종합 투자점수] [그림 3] 종합 투자점수 AI 인공지능 분석을 통한 파미셀의 종목 종합 스코어는 44점을 기록했다. 이는 동일 업종 평균점수인 62점과 시장 평균점수인 56점를 하회하는 수치였다. (위의 AI인공지능 점수는 재무 데이터를 기반으로 전체 상장 종목과 비교/분석하여 도출한 점수로 높은 점수가 반드시 높은 수익률을 보장하지 않습니다. 위의 자료는 당사의 추천 종목이 아니며, 투자 시 참고용으로 제시해드리는 것입니다.) 라이온봇 기자 -한국경제TV※ 본 기사는 한국경제TV와 '거장들의 투자공식이'자체 개발한 '라이온봇 기자'가 실시간으로 작성한 기사입니다. 라이온봇기자 ⓒ 한국경제TV, 무단 전재 및 재배포 금지 한국경제TV 관련뉴스해당 언론사에서 선정하며 언론사 페이지(아웃링크)로 이동해 볼 수 있습니다.김종국 집 공개…못 말리는 '블랙' 사랑, '검종국' 등극배우 김혜선, 20살 때 '삭발'하고 다녀…이유는?정재성 사망, ""아내가 시신 발견""기성용, 왼손 국기에 대한 경례…이유가?구하라 집 공개, 영&amp;리치의 논현동 자수성가하우스 '입이 쩍'"
한국경제TV,005690,/news/news_read.nhn?article_id=0000619575&office_id=215&mode=search&query=파미셀&page=1,2018-04-06 10:06,"파미셀, 11% 급등... 전일 보다 1,950원 상승한 19,650원","[한국경제TV 라이온봇 기자] 파미셀은 4월 6일 10시 6분 전일 대비 약 11% 급등한 19,650원에 거래되고 있다. 파미셀은 코스피 상장 기업으로 의약품 업종에 속해 있다. 시가총액은 9,637억원으로 코스피 상장기업 중 179위에 위치 해 있다. [종목 성향 진단] [그림 1] 종목 성향 진단 파미셀의 투자 스타일은 성장주에 가깝다. 주가 고평가 우려가 공존하지만 높은 성장성이 기대되는 기업이다. 주가 모멘텀은 눈에 띄는 성장세를 기록했다. 최근 6개월 수익률이 무려 321.46%의 상승폭을 기록했다. 최근 1개월 수익률 또한 162.32% 상승하며 굉장히 좋은 모멘텀을 보이고 있다. 파미셀 종목에 대한 투자자의 관심도는 굉장히 높은 편이다. [투자 점수 진단] [그림 2] 투자 점수 진단 파미셀은 안정성(부채비율) 측면에서 두각을 나타내고 있다. 최근 부채비율은 92점으로 6개의 핵심 팩터 중 가장 높은 점수를 기록했다. 부채비율은  전체 시장 내 434위를 기록하며 상위 8.15%에 위치했다. 업종별로는 34위를 기록하며 상위 5.83%에 위치했다. 그리고 성장성(매출증가율(YoY)) 역시 도드라지는 편이다. 성장성 점수는 80점으로 두번째로 높은 점수를 기록했다. 매출증가율(YoY)은 전체 시장 내 316위를 기록하며 상위 19.89%에 위치했다. 업종별로는 38위를 기록하며 상위 18.32%에 위치했다. 그러나 ROA와 PBR은  아쉬움을 나타냈다. [종합 투자점수] [그림 3] 종합 투자점수 AI 인공지능 분석을 통한 파미셀의 종목 종합 스코어는 49점을 기록했다. 이는 동일 업종 평균점수인 56점과 시장 평균점수인 50점를 하회하는 수치였다. (위의 AI인공지능 점수는 재무 데이터를 기반으로 전체 상장 종목과 비교/분석하여 도출한 점수로 높은 점수가 반드시 높은 수익률을 보장하지 않습니다. 위의 자료는 당사의 추천 종목이 아니며, 투자 시 참고용으로 제시해드리는 것입니다.) 라이온봇 기자 -한국경제TV※ 본 기사는 한국경제TV와 '거장들의 투자공식이'자체 개발한 '라이온봇 기자'가 실시간으로 작성한 기사입니다. 라이온봇기자 ⓒ 한국경제TV, 무단 전재 및 재배포 금지 한국경제TV 관련뉴스해당 언론사에서 선정하며 언론사 페이지(아웃링크)로 이동해 볼 수 있습니다.레드벨벳 아이린 옆에 北 김정은, 실화야?""자연미인"" 셋째 출산에도 여전히 아름다운 '리설주'천안함 추적60분, 이명박 정부 당시 방송 외압 받았나?견미리 딸 이다인, 금수저 논란…주식부자?고 장자연-단역 자매 사건 재수사…""내가 노리개인가"""
이데일리,005690,/news/news_read.nhn?article_id=0004029202&office_id=018&mode=search&query=파미셀&page=1,2018-02-07 13:59,"파미셀, 줄기세포 세포노화 검출용 키트 특허권 취득","[이데일리 김정유 기자] 파미셀(005690)은 줄기세포의 세포노화 검출용 키트 특허권을 취득했다고 7일 공시했다. 이번 특허는 줄기세포의 세포노화 검출용 키트, 검출 방법 및 세포노화 억제제의 스크리닝 방법을 제공한다. 회사 관계자는 “줄기세포 치료제의 치료 효능을 극대화시키는 데에 활용할 예정”이라며 “향후 줄기세포 노화억제제 스크리닝에도 적용할 계획”이라고 밝혔다."
한국경제TV,005690,/news/news_read.nhn?article_id=0000611883&office_id=215&mode=search&query=파미셀&page=1,2018-03-16 12:07,"파미셀, 5거래일 연속 상승... 전일 대비 1% 상승","[한국경제TV 라이온봇 기자] 파미셀은 현재 5거래일 연속 상승세를 기록하고 있어 주목할 만하다. 파미셀은 3월 16일 12시 7분 전일 대비 약 1% 상승한 9,000원에 거래되고 있다. 파미셀은 코스피 상장 기업으로 의약품 업종에 속해 있다. 시가총액은 5,192억원으로 코스피 상장기업 중 252위에 위치 해 있다. [종목 성향 진단] [그림 1] 종목 성향 진단 파미셀의 투자 스타일은 성장주에 가깝다. 주가 고평가 우려가 공존하지만 높은 성장성이 기대되는 기업이다. 주가 모멘텀은 굉장히 좋은 편이었다. 최근 3개월 수익률이 무려 63.42%의 상승폭을 기록했다. 최근 1개월 수익률 또한 56.51% 상승하며 굉장히 좋은 모멘텀을 보이고 있다. 파미셀 종목에 대한 투자자의 관심도는 굉장히 높은 편이다. [투자 점수 진단] [그림 2] 투자 점수 진단 파미셀은 안정성(부채비율) 측면에서 두각을 나타내고 있다. 최근 부채비율은 88점으로 6개의 핵심 팩터 중 가장 높은 점수를 기록했다. 부채비율은  전체 시장 내 1617위를 기록하며 상위 11.69%에 위치했다. 업종별로는 166위를 기록하며 상위 8.82%에 위치했다. 그리고 성장성(매출증가율(YoY)) 역시 도드라지는 편이다. 성장성 점수는 82점으로 두번째로 높은 점수를 기록했다. 매출증가율(YoY)은 전체 시장 내 73위를 기록하며 상위 18%에 위치했다. 업종별로는 11위를 기록하며 상위 15.15%에 위치했다. 그러나 ROA와 PBR은  아쉬움을 나타냈다. [종합 투자점수] [그림 3] 종합 투자점수 AI 인공지능 분석을 통한 파미셀의 종목 종합 스코어는 48점을 기록했다. 이는 동일 업종 평균점수인 62점과 시장 평균점수인 56점를 하회하는 수치였다. (위의 AI인공지능 점수는 재무 데이터를 기반으로 전체 상장 종목과 비교/분석하여 도출한 점수로 높은 점수가 반드시 높은 수익률을 보장하지 않습니다. 위의 자료는 당사의 추천 종목이 아니며, 투자 시 참고용으로 제시해드리는 것입니다.) 라이온봇 기자 -한국경제TV※ 본 기사는 한국경제TV와 '거장들의 투자공식이'자체 개발한 '라이온봇 기자'가 실시간으로 작성한 기사입니다. 라이온봇기자 ⓒ 한국경제TV, 무단 전재 및 재배포 금지 한국경제TV 관련뉴스해당 언론사에서 선정하며 언론사 페이지(아웃링크)로 이동해 볼 수 있습니다.김종국 집 공개…못 말리는 '블랙' 사랑, '검종국' 등극'그것이 알고싶다' 배정훈PD와 열애 이영진 저격 발언도 '그알급'정재성 사망, ""아내가 시신 발견""최율 조재현 성추행 폭로글 삭제 내막 '소름'송혜교, 결혼 후 첫 공식석상…송중기가 반한 '핑크여신'"
파이낸셜뉴스,005690,/news/news_read.nhn?article_id=0003987288&office_id=014&mode=search&query=파미셀&page=1,2018-03-22 10:51,"[fnRASSI]파미셀, 52주 신고가...16.77% &uarr;","파미셀(005690)은 52주신고가를 기록하고 있어 주목할만하다. 동종목의 현재 주가는 19,150원 선에서 이루어지고 있다. 거래일을 기준으로 최근 3일간 평균 거래량은 1219만 주이다. 이는 60일 일 평균 거래량 303만 주와 비교해보면 최근 거래량이 급격히 늘어났다는 것을 알 수 있다.                   지표               항목               값               종합점수                 성장성               매출액증가율               -0.09               3.02                 자기자본증가율               -0.04                 안정성               부채비율               7.88               6.94                 유동비율               1860.42                 이익안정성               3.89                 수익성               ROA               -39.75               0.47                 ROE               -42.89                 영업이익율               -17.64          파미셀의 퀀트 재무 점수는 10.43점으로 지난 분기에 비해 성장성 점수가 상승했다. 이는 매출액 증가율이 증가하였기 때문이다. 수익성 측면에서 볼때 ROA, ROE가 하락하여 이전보다 낮은 점수를 받았다. 외국인/개인 순매수, 기관은 순매도(한달누적)  기관이 2일연속 주식을 팔고 있는 반면 외국인은 2일연속 주식을 사고 있다. 4주간을 기준으로 보면 외국인이 60,453주를 순매수했고, 개인들도 매수 우위를 유지하면서 12,806주를 순매수했다. 하지만 기관은 초반에 동종목을 순매도한 이후에 근래에는 순매도량을 줄이면서 73,259주를 순매도했다. 'fnRASSI'는 증권전문 기업 씽크풀과 파이낸셜뉴스의 협업으로 로봇기자가 실시간으로 생산하는 기사입니다."
매일경제,005690,/news/news_read.nhn?article_id=0004062374&office_id=009&mode=search&query=파미셀&page=1,2017-12-07 14:59,"파미셀, 새 줄기세포치료제 식약처에 허가 신청","간경변 치료제 `셀그램-LC`…승인땐 국내 5호 치료제 줄기세포 치료제와 원료의약품을 만드는 바이오기업 파미셀이 새로운 줄기세포 치료제 허가를 신청했다. 파미셀은 6일 식품의약품안전처에 알코올성 간경변 줄기세포치료제 셀그램?-엘씨(Cellgram?-LC)에 대한 조건부 품목허가를 신청했다고 밝혔다. 파미셀은 세계최초이자 국내 1호 줄기세포치료제인 '하티셀그램-AMI'를 개발한 회사다. 조건부 품목허가란 임상 2상 자료를 바탕으로 의약품 시판을 허가하는 제도다. 지난해 식약처는 생명을 위협받고 있거나 중증 비가역적 질환으로 고통받는 환자에게 치료기회를 제공하기 위해 안전성이 확인되고 치료효과가 탐색된 세포치료제까지 조건부 허가대상을 확대한 바 있다. 알코올성 간경변증이 중증 비가역적 질환으로 인정받았기 때문에 조건부 품목허가를 신청했다는 것이 회사측의 설명이다. 셀그램-LC는 자가 골수에서 채취한 중간엽줄기세포를 체외에서 5 x 107개의 세포수로 배양한 후, 환자의 우측 대퇴 동맥에 간동맥 카테터를 삽입해 5분~10분에 걸쳐 주사로 주입하는 방식이다. 김현수 파미셀 대표는 ""알코올로 손상된 간조직의 섬유화를 개선시키고 간기능을 회복시키는 것을 목표로 한다""며 ""셀그램-LC가 허가를 받으면 국내에서 유일하게 두 종의 줄기세포치료제를 허가받은 기업이 될 것""이라고 기대감을 나타냈다. . 파미셀은 2012년 11월부터 셀그램-LC에 대한 임상2상을 진행해 왔다. 연구 결과는 이 분야 최고의 의학저널인 미국간학회 공식학회지 '헤파톨로지(Hepatology)'에 게재되면서 줄기세포치료제의 치료 효과를 입증하기도 했다. 지난 4일 미국 식품의약국(FDA)로부터 해당 셀그램-LC의 임상 1상 신청을 승인받고 준비중이다. 통상적으로 특별한 보완사항 등이 없으면 접수일로부터 115일 이후 승인여부가 결정된다. 식약처가 품목허가를 승인하면 이 치료제는 국내 5호 줄기세포치료제가 된다. [신찬옥 기자] r_start // r_end //"
머니S,005690,/news/news_read.nhn?article_id=0000308054&office_id=417&mode=search&query=파미셀&page=1,2018-04-06 10:19,"[특징주] 파미셀, 첫 줄기세포 치료제 기대감 속 &lsquo;강세&rsquo;",파미셀이 올해 첫 줄기세포 치료제 출시 기대감 속에 ‘강세’를 보이고 있다. 6일 오전 10시18분 현재 파미셀은 전 거래일 대비 1500원(8.47%) 오른 1만9200원에 거래되고 있다. 장주 2만50원까지 올라 52주 신고가를 기록했다. 파미셀은 현재 간경병 치료제 ‘셀그램-리버’를 식품의약품안전처에 조건부 허가를 신청해 놓은 상태다. 홍승우 기자
한국경제TV,005690,/news/news_read.nhn?article_id=0000619579&office_id=215&mode=search&query=파미셀&page=1,2018-04-06 10:09,"파미셀, 52주 신고가 경신... 전일 대비 11% 상승","[한국경제TV 라이온봇 기자] 파미셀은 52주 신고가를 경신했다. 파미셀은 4월 6일 10시 9분 전일 대비 약 11% 상승한 19,700원에 거래되고 있다. 파미셀은 코스피 상장 기업으로 의약품 업종에 속해 있다. 시가총액은 9,637억원으로 코스피 상장기업 중 179위에 위치 해 있다. [종목 성향 진단] [그림 1] 종목 성향 진단 파미셀의 투자 스타일은 성장주에 가깝다. 주가 고평가 우려가 공존하지만 높은 성장성이 기대되는 기업이다. 주가 모멘텀은 눈에 띄는 성장세를 기록했다. 최근 6개월 수익률이 무려 321.46%의 상승폭을 기록했다. 최근 1개월 수익률 또한 162.32% 상승하며 굉장히 좋은 모멘텀을 보이고 있다. 파미셀 종목에 대한 투자자의 관심도는 굉장히 높은 편이다. [투자 점수 진단] [그림 2] 투자 점수 진단 파미셀은 안정성(부채비율) 측면에서 두각을 나타내고 있다. 최근 부채비율은 92점으로 6개의 핵심 팩터 중 가장 높은 점수를 기록했다. 부채비율은  전체 시장 내 434위를 기록하며 상위 8.15%에 위치했다. 업종별로는 34위를 기록하며 상위 5.83%에 위치했다. 그리고 성장성(매출증가율(YoY)) 역시 도드라지는 편이다. 성장성 점수는 80점으로 두번째로 높은 점수를 기록했다. 매출증가율(YoY)은 전체 시장 내 316위를 기록하며 상위 19.89%에 위치했다. 업종별로는 38위를 기록하며 상위 18.32%에 위치했다. 그러나 ROA와 PBR은  아쉬움을 나타냈다. [종합 투자점수] [그림 3] 종합 투자점수 AI 인공지능 분석을 통한 파미셀의 종목 종합 스코어는 49점을 기록했다. 이는 동일 업종 평균점수인 56점과 시장 평균점수인 50점를 하회하는 수치였다. (위의 AI인공지능 점수는 재무 데이터를 기반으로 전체 상장 종목과 비교/분석하여 도출한 점수로 높은 점수가 반드시 높은 수익률을 보장하지 않습니다. 위의 자료는 당사의 추천 종목이 아니며, 투자 시 참고용으로 제시해드리는 것입니다.) 라이온봇 기자 -한국경제TV※ 본 기사는 한국경제TV와 '거장들의 투자공식이'자체 개발한 '라이온봇 기자'가 실시간으로 작성한 기사입니다. 라이온봇기자 ⓒ 한국경제TV, 무단 전재 및 재배포 금지 한국경제TV 관련뉴스해당 언론사에서 선정하며 언론사 페이지(아웃링크)로 이동해 볼 수 있습니다.레드벨벳 아이린 옆에 北 김정은, 실화야?""자연미인"" 셋째 출산에도 여전히 아름다운 '리설주'천안함 추적60분, 이명박 정부 당시 방송 외압 받았나?견미리 딸 이다인, 금수저 논란…주식부자?고 장자연-단역 자매 사건 재수사…""내가 노리개인가"""
데일리안,005690,/news/news_read.nhn?article_id=0002247548&office_id=119&mode=search&query=파미셀&page=1,2018-03-22 10:03,"[특징주]파미셀, 줄기세포 신약 기대감에 상승세",파미셀이 줄기세포 신약에 대한 기대감으로 상승세다. 22일 오전 9시 59분 현재 유가증권 시장에서 파미셀은 전 거래일보다 2500원(15.24%) 오른 1만8900원에 거래 중이다. 파미셀의 간경병 치료제인 셀그램 리버가 세포치료제 활성화를 위한 조건부 허가로 조만간 판매 개시 가능성이 높다는 평가를 받은 것이 주가 상승의 배경이라는 분석이다.
