source,symbol,link,date,title,content
한국경제TV,005690,/news/news_read.nhn?article_id=0000637713&office_id=215&mode=search&query=파미셀&page=1,2018-05-24 10:00,"파미셀, 전일 대비 약 5% 상승한 20,300원","[한국경제TV 라이온봇 기자] 파미셀은 5월 24일 10시 0분 전일 대비 약 5% 상승한 20,300원에 거래되고 있다. 파미셀은 코스피 상장 기업으로 의약품 업종에 속해 있다. 시가총액은 1조2,047억원으로 코스피 상장기업 중 163위에 위치 해 있다. [종목 성향 진단] [그림 1] 종목 성향 진단 파미셀의 투자 스타일은 성장주에 가깝다. 주가 고평가 우려가 공존하지만 높은 성장성이 기대되는 기업이다. 주가 모멘텀은 평범한 수준이었다. 최근 1개월 수익률이 3.29%, 3개월 수익률은 246.35%, 6개월 수익률은 293.06%를 기록했다. 파미셀 종목에 대한 투자자의 관심도는 굉장히 높은 편이다. [투자 점수 진단] [그림 2] 투자 점수 진단 파미셀은 안정성(부채비율) 측면에서 두각을 나타내고 있다. 최근 부채비율은 90점으로 6개의 핵심 팩터 중 가장 높은 점수를 기록했다. 부채비율은  전체 시장 내 1183위를 기록하며 상위 9.91%에 위치했다. 업종별로는 87위를 기록하며 상위 7.89%에 위치했다. 그리고 성장성(매출증가율(YoY)) 역시 도드라지는 편이다. 성장성 점수는 73점으로 두번째로 높은 점수를 기록했다. 매출증가율(YoY)은 전체 시장 내 238위를 기록하며 상위 27.21%에 위치했다. 업종별로는 45위를 기록하며 상위 29.53%에 위치했다. 그러나 PBR과 영업이익률은  아쉬움을 나타냈다. [종합 투자점수] [그림 3] 종합 투자점수 AI 인공지능 분석을 통한 파미셀의 종목 종합 스코어는 55점을 기록했다. 이는 동일 업종 평균점수인 59점과 시장 평균점수인 57점를 하회하는 수치였다. (위의 AI인공지능 점수는 재무 데이터를 기반으로 전체 상장 종목과 비교/분석하여 도출한 점수로 높은 점수가 반드시 높은 수익률을 보장하지 않습니다. 위의 자료는 당사의 추천 종목이 아니며, 투자 시 참고용으로 제시해드리는 것입니다.) 라이온봇 기자 -한국경제TV※ 본 기사는 한국경제TV와 '거장들의 투자공식이'자체 개발한 '라이온봇 기자'가 실시간으로 작성한 기사입니다. 라이온봇기자 ⓒ 한국경제TV, 무단 전재 및 재배포 금지 한국경제TV 관련뉴스해당 언론사에서 선정하며 언론사 페이지(아웃링크)로 이동해 볼 수 있습니다.한그루 남편, 얼마나 훈남이기에? '쌍둥이 예쁠만 하네'""브로콜리에 치매 유발 단백질 제거효과 있다""""전자담배, 과충전 폭발 주의해야""엄지원 남편, 엄친아에 빌딩 부자…엄지원 부친은 '더 대박'홍수아 올 망사?…'이쯤되면 대륙여신'"
한국경제TV,005690,/news/news_read.nhn?article_id=0000667015&office_id=215&mode=search&query=파미셀&page=1,2018-07-31 09:08,"파미셀, 전일 대비 약 3% 상승한 13,550원","[한국경제TV 라이온봇 기자] [그림 1] 최근 3개월 간 주가 추세 및 기간별 수익률 파미셀은 7월 31일 9시 7분 전일 대비 약 3% 상승한 13,550원에 거래되고 있다. 파미셀은 코스피 상장 기업으로 의약품 업종에 속해 있다. 시가총액은 7,884억원으로 코스피 상장기업 중 200위에 위치 해 있다. [종목 성향 진단] [그림 2] 종목 성향 진단 파미셀의 투자 스타일은 성장주에 가깝다. 주가 고평가 우려가 공존하지만 높은 성장성이 기대되는 기업이다. 주가 모멘텀은 좋지 못했다. 최근 3개월 수익률은 -32.89%의 하락폭을 기록했다. 최근 1개월 수익률 또한 -25.3% 하락하며 부진한 모멘텀을 이어가고 있다. 파미셀 종목에 대한 투자자의 관심도는 굉장히 높은 편이다. [투자 점수 진단] [그림 3] 투자 점수 진단 파미셀은 어느 측면에서 투자 매력도가 높은 종목일까? AI 인공지능 종목 분석 시스템을 이용해 성장성, 수익성, 효율성, 안전성, 저평가성, 추세 등 주가 수익률에 영향을 줄 수 있는 6가지 핵심 투자 지표를 점수화하여 종목의 투자 매력도를 계산해보았다. 그 결과 파미셀은 상대적으로 기업안정성 측면에서 두각을 드러내고 있었다. 기업안정성 점수는 기업의 재무 구조가 얼마나 안정적인 상태인지를 나타낸다. 파미셀은 특히 유동비율 측면에서 가장 높은 점수는 기록했는데, 전체 시장 내 36위를 기록하며 상위 1.8%에 위치했다. 업종별로는 1위를 기록하며 상위 0%에 위치했다. 그러나 기업 가치 대비 주가 수준을 나타내는 저평가 측면에서는 아쉬움을 나타냈다. (위의 AI인공지능 점수는 재무 데이터를 기반으로 전체 상장 종목과 비교/분석하여 도출한 점수로 높은 점수가 반드시 높은 수익률을 보장하지 않습니다. 위의 자료는 당사의 추천 종목이 아니며, 투자 시 참고용으로 제시해드리는 것입니다. 핵심투자지표를 결합해 종목의 투자매력도를 종합 계산한 ""인공지능 투자점수""는 ""거장들의 투자공식"" 앱에서 확인하실 수 있습니다.) 라이온봇 기자 -한국경제TV※ 본 기사는 한국경제TV와 '거장들의 투자공식이'자체 개발한 '라이온봇 기자'가 실시간으로 작성한 기사입니다. 라이온봇기자"
한국경제,005690,/news/news_read.nhn?article_id=0003941949&office_id=015&mode=search&query=파미셀&page=1,2018-05-18 09:15,"[파미셀] 5% 이상 상승, 지금 매수 창구 상위 - 메릴린치, 삼성증권","파미셀이 장 초반 부터 전일 대비 +5%이상 상승하고 있다. 18일 오전 09시 11분 파미셀은 전 거래일보다 6.3% 오른 21,100원에 거래되고 있다. 주가의 흐름은 20,150원으로 개장해서 장중 한때 19,950원(+0.5%)까지 소폭 밀렸다가 다시 21,150원(+6.55%)까지 상승 반전한 후, 현재는 21,100원(+6.3%)에서 머물면서 장중에 많이 상승한 모습이다. ◆ 거래원 동향 - 지금 매수 창구 상위 - 메릴린치, 삼성증권 거래원 동향은 메릴린치, 삼성증권이 매수 상위 목록에 나타나고 있다. 한편, 매도 창구 상위에는 메릴린치가 눈에 띄고 있다. 이 시간 메릴린치가 매수창구상위에 올라있는 종목은 이 종목 이외에도 한화투자증권, 한국큐빅 등이 있다. [표]파미셀 거래원 동향 ◆ Valuation - 전일 종가 기준 PER 마이너스, PBR 12.8배, 고PBR 당기순이익 적자로 인해 이 종목의 PER는 마이너스이고, PBR은 12.8배이다. PER는 마이너스라서 의약품업종의 평균 PER 97.6배 대비 -128.1배 낮은 수준이고, PBR은 의약품업종의 평균 PBR 3.8배 대비 +9.0배 높은 수준으로 업종 내에서 상위 10%에 위치한다. 이 종목은 코스피 전체에서 PBR이 상위 2%에 랭킹되고 있다. [표]파미셀 Valuation 한경로보뉴스 이 기사는 한국경제신문과 씽크풀이 공동 개발한 기사 자동생성 알고리즘에 의해 실시간으로 작성된 것입니다.  - 기사관련문의 02-3277-9940 ["
연합뉴스,005690,/news/news_read.nhn?article_id=0008647603&office_id=001&mode=search&query=파미셀&page=1,2016-08-29 11:14,"파미셀 &quot;줄기세포 발기부전치료제, 동물실험서 효과&quot;","(서울=연합뉴스) 김잔디 기자 = 파미셀은 줄기세포 발기부전치료제 '셀그램-이디'(Cellgram-ED)의 치료 효과를 확인한 동물실험 결과가 국제 학술지에 발표됐다고 29일 밝혔다. 파미셀에 따르면 셀그램-이디를 음경해면체가 손상된 발기부전 동물모델의 해면체에 직접 주입하는 전임상(동물실험) 결과, 발기 기능을 개선하는 효과를 나타냈다. 음경해면체는 음경을 구성하는 조직으로 체내 신경계 작용에 따른 발기 기능을 담당한다. 연구는 보건복지부 보건의료기술연구개발사업 지원 아래 김청수 서울아산병원 비뇨기과 교수가 진행했다. 결과는 국제 학술지 '세포치료'(Cytotherapy)에 게재됐다. 파미셀 관계자는 ""셀그램-이디의 주성분인 줄기세포는 손상된 조직이나 세포기능을 회복시키는 특징이 있어 발기부전 치료에 효과적""이라며 ""전임상 결과를 바탕으로 임상 1상도 순조롭게 진행 중""이라고 말했다. 앞서 셀그램-이디는 2014년 9월 식품의약품안전처로부터 전립선 절제술 후 발기부전 및 당뇨병성 발기부전 환자를 대상으로 임상 1상 시험을 승인받았다."
매일경제,005690,/news/news_read.nhn?article_id=0003587689&office_id=009&mode=search&query=파미셀&page=1,2015-10-06 14:42,"파미셀, 中 기업과 케미컬사업 합작&hellip;정밀화학 공장 건설","줄기세포 치료제 연구개발기업 파미셀이 중국 기업과 손잡고 정밀화학 공장을 건설한다. 파미셀은 중국 랴오닝성 판진에 위치한 판진합신화공과기유한공사와 정밀화학 분야 사업 협력에 관한 양해각서(MOU)를 체결했다고 6일 밝혔다. 이번 협약에 따라 양측은 중국 판진국가기술개발구 내 정밀화학공장 건설과 운영을 공동으로 맡기로 했다. 파미셀은 다음달부터 공장건설에 대한 컨설팅과 공장운용, 제품생산, 기술이전 및 판매에 관한 지원을 하기로 했다. 판진합신은 공장 설립에 필요한 자금, 설비. 인력 등을 준비하게 된다. 판진합신은 이미 판진국가기술개발구에 약 5만평의 공장 부지를 확보한 상태다. 파미셀은 급증하는 수주에 대응할 수 있는 생산능력(CAPA)을 갖추고 중국 시장 공략을 위한 교두보를 확보할 것으로 기대하고 있다. 회사 측 관계자는 “파미셀의 기술개발 및 마케팅 능력과 중국의 자본이 결합하는 구조”라면서 “공장 준공 즉시 고분자 첨가물을 비롯해 촉매제와 원료의약품 등을 순차적으로 생산해 중국 시장 점유율을 확대할 계획”이라고 말했다. [매경닷컴 김잔디 기자] r_start // r_end // [ⓒ 매일경제 & mk.co.kr, 무단전재 및 재배포 금지] 매일경제 관련뉴스해당 언론사에서 선정하며 언론사 페이지(아웃링크)로 이동해 볼 수 있습니다.'몸매 종결자' 유승옥, 19금 보디라인 뽐내다…'숨멎' 몸매에 '男心 멘붕'유승옥, 역대급 베이글 몸매…'맙소사'채수빈, SNS서 청순 각선미 자랑美 명문대들, 오바마 큰딸 입학시키려 이 방법을…'전두환 딸' 전효선 교수, 수업 중 학생 내쫓아 논란된 취재 현장 봤더니…"
연합뉴스,005690,/news/news_read.nhn?article_id=0007838623&office_id=001&mode=search&query=파미셀&page=1,2015-09-07 14:44,"파미셀, 18억 규모 에이즈 치료제 원료 공급 계약",(서울=연합뉴스) 임수정 기자 = 파미셀[05690]은 인도 회사와 18억1천만원 규모의 에이즈 치료제 원료 공급 계약을 체결했다고 7일 공시했다. 이는 지난해 매출액의 8.98%에 해당하는 규모다.
조선비즈,005690,/news/news_read.nhn?article_id=0000412104&office_id=366&mode=search&query=파미셀&page=1,2018-07-30 17:17,"파미셀, 줄기세포 임상 확대&hellip;혈액 부족한 신장병 연구 승인","파미셀(005690) 의 줄기세포치료제 ‘셀그램’을 활용한 임상연구가 신장 질환으로 확대된다. 30일 식품의약품안전처에 따르면 김청수 서울아산병원 비뇨의학과 교수팀은 지난 27일 허혈성 급성 신장 손상을 막기 위해 투여하는 줄기세포 안전성 평가 임상시험을 승인받았다. 김 교수팀은 파미셀과 함께 이번 임상시험에서 국내 성인 10명을 대상으로 허혈성 급성 신손상 치료를 위한 줄기세포 투여 안전성을 우선 평가할 예정이다. 연구에 필요한 줄기세포는 파미셀이 배양·추출한 ‘셀그램-AKI’를 사용한다. 지난 2011년 급성심근경색환자 치료 허가를 받은 줄기세포치료제 ‘하티셀그램-AMI’. /파미셀 제공 일반적으로 급성 신손상은 체내에서 노폐물을 배출하고 체액량을 유지시키는 신장이 제 기능을 상실한 상태다. 이는 신장으로 가는 혈액이 충분하지 않을 때 발생하며, 혈액에 소변이 섞이는 등 증상이 나타난다. 급성 신손상 발생 이후 병이 계속되면 만성 신장질환이 된다. 국내에서 신장이식이나 혈액투석과 같은 신대체 요법을 필요로하는 말기 신장병 환자만 약 10만명으로 현재 존재하는 치료법은 모두 진행을 늦추는 효과만 갖고 있다. 파미셀은 셀그램-AKI가 신세뇨관 세포의 사멸을 억제하고 증식을 촉진시키며 신장 섬유증을 감소시키는 등 신장 기능 개선에 효과적일 것으로 보고 있다. 혈관 손상이나 혈류량으로 인해 발생하는 신장질환의 원인에 줄기세포가 직접 작용하는 원리다. 셀그램-AKI는 환자 자신의 골수 유래 줄기세포가 아닌 건강한 공여자의 동종 줄기세포를 사용해 향후 대량 생산 가능성도 있다. 동물유래 성분을 배제한 배양법을 이용하면 안전하고 일정한 효능을 갖는 약물로 대량생산이 가능하다. 한편 파미셀과 김청수 교수팀은 이번 임상 1상으로 2015년 ‘신장의 허혈-재관류 손상으로 인한 만성콩팥병 예방을 위한 저산소배양 동종 유래 중간엽줄기세포 치료제 허가용 비임상연구’를 함께 시작한 지 3년 만에 셀그램-AKI의 임상시험을 본격 추진하게 됐다."
이데일리,005690,/news/news_read.nhn?article_id=0003535507&office_id=018&mode=search&query=파미셀&page=1,2016-05-03 13:30,"파미셀, 차세대 줄기세포 기술 확보&hellip;'심장 손상 회복 효과 &uarr;'","[이데일리 박형수 기자] 파미셀(005690)이 차세대 줄기세포치료제를 개발하는 데 기반이 되는 기술을 확보했다. 파미셀은 미국 유타대 연구팀과 공동으로 진행한 줄기세포 전달시스템에 대한 연구결과를 미국 유전자세포치료학회의 공식 학술지에 발표했다고 3일 밝혔다. 관계자는 “중간엽줄기세포를 3차원 지지체인 다공성 고분자 물질(PPP)에 실어 동물의 심근 내에 주입한 결과 세포의 지속성이 증가했다”며 “심장 손상을 효과적으로 회복하는 데 도움이 됐다”고 설명했다. 파미셀은 줄기세포치료제를 개선해 환자의 손상부위에 전달할 시스템을 개발하려고 유타대와 연구를 진행했다. 지난해에는 줄기세포의 생존율과 생착률을 높이는 약물전달구조체(PPP)의 개발 가능성을 시사하는 연구 결과를 발표했다. 김현수 대표는 “이번 연구로 파미셀은 차세대 줄기세포 치료제를 개발하는 데 기반이 되는 기술을 확보했다”며 “앞으로 임상시험에 접목할 수 있다”고 말했다. 이어 “뇌·신경질환, 간경변 등의 다른 난치성 질환으로 확대해 적용할 예정”이며 “차세대 줄기세포치료제는 기존의 치료제보다 체외에서의 배양 시간을 크게 단축해 생산비용을 절감할 것”이라고 강조했다."
한국경제TV,005690,/news/news_read.nhn?article_id=0000637317&office_id=215&mode=search&query=파미셀&page=1,2018-05-23 11:03,"파미셀, 전일 대비 약 -3% 하락한 19,700원","[한국경제TV 라이온봇 기자] 파미셀은 5월 23일 11시 2분 전일 대비 약 -3% 하락한 19,700원에 거래되고 있다. 파미셀은 코스피 상장 기업으로 의약품 업종에 속해 있다. 시가총액은 1조1,722억원으로 코스피 상장기업 중 167위에 위치 해 있다. [종목 성향 진단] [그림 1] 종목 성향 진단 파미셀의 투자 스타일은 성장주에 가깝다. 주가 고평가 우려가 공존하지만 높은 성장성이 기대되는 기업이다. 주가 모멘텀은 좋지 못했다. 최근 1개월 수익률은 -15.71%의 하락폭을 기록했다. 파미셀 종목에 대한 투자자의 관심도는 굉장히 높은 편이다. [투자 점수 진단] [그림 2] 투자 점수 진단 파미셀은 안정성(부채비율) 측면에서 두각을 나타내고 있다. 최근 부채비율은 89점으로 6개의 핵심 팩터 중 가장 높은 점수를 기록했다. 부채비율은  전체 시장 내 1385위를 기록하며 상위 10.75%에 위치했다. 업종별로는 144위를 기록하며 상위 9.78%에 위치했다. 그리고 성장성(매출증가율(YoY)) 역시 도드라지는 편이다. 성장성 점수는 64점으로 두번째로 높은 점수를 기록했다. 매출증가율(YoY)은 전체 시장 내 237위를 기록하며 상위 35.81%에 위치했다. 업종별로는 26위를 기록하며 상위 27.78%에 위치했다. 그러나 PBR과 영업이익률은  아쉬움을 나타냈다. [종합 투자점수] [그림 3] 종합 투자점수 AI 인공지능 분석을 통한 파미셀의 종목 종합 스코어는 60점을 기록했다. 이는 동일 업종 평균점수인 60점과 동일한 수준이었으나, 시장 평균점수인 59점을 상회했다. (위의 AI인공지능 점수는 재무 데이터를 기반으로 전체 상장 종목과 비교/분석하여 도출한 점수로 높은 점수가 반드시 높은 수익률을 보장하지 않습니다. 위의 자료는 당사의 추천 종목이 아니며, 투자 시 참고용으로 제시해드리는 것입니다.) 라이온봇 기자 -한국경제TV※ 본 기사는 한국경제TV와 '거장들의 투자공식이'자체 개발한 '라이온봇 기자'가 실시간으로 작성한 기사입니다. 라이온봇기자 ⓒ 한국경제TV, 무단 전재 및 재배포 금지 한국경제TV 관련뉴스해당 언론사에서 선정하며 언론사 페이지(아웃링크)로 이동해 볼 수 있습니다.한그루 남편, 얼마나 훈남이길래? '쌍둥이 예쁠만 하네'""몸이 허락할 때까지 낳겠다"" 장윤정 둘째 임신정려원 고백, '불같았던' 열애 상대 누구?엄지원 남편, 엄친아에 빌딩 부자…엄지원 부친은 '더 대박'홍수아 올 망사?…'이쯤되면 대륙여신'"
전자신문,005690,/news/news_read.nhn?article_id=0002540551&office_id=030&mode=search&query=파미셀&page=1,2016-10-25 13:09,"[@테마]줄기세포 관련주테마, 리더스코스메틱, 파미셀 중심으로 약세","금일  현재, 줄기세포 관련주테마가 전일대비 -3.02% 하락하며 약세를 보이고 있다. 하락폭으로는 리더스코스메틱 -6.94%로 선두권에 있으며 파미셀(-2.46%), 이지바이오(-1.57%)도 약세이다. [테마내 주요종목 시세] * 리더스코스메틱 : 20,800원 (▼1550) *파미셀:4,965원 (▼125) *이지바이오:5,640원 (▼90) [테마내 주요종목 재무요약] * 리더스코스메틱 : 영업이익률 현재 10.96%로 업종평균 상회.  PBR은 3.61로 다소 높은편 * 파미셀 : 영업이익률 현재 -13.63%로 업종평균 하회.  PBR은 3.28로 다소 높은편 * 이지바이오 : 영업이익률 현재 5.1%로 업종평균 수준.PER은 13.58로 업종평균보다 낮으며, PBR은 0.7로 다소 낮은편. [테마내 종목별 외국인 지분변동] * 리더스코스메틱 :  최근 2주간 -0.22%감소하여 현재 보유율은 1.41% * 파미셀 :  최근 2주간 -0.09%감소하여 현재 보유율은 1.21% * 이지바이오 :  최근 2주간 0.28%증가하여 현재 보유율은 5.72%"
한국경제,005690,/news/news_read.nhn?article_id=0003646862&office_id=015&mode=search&query=파미셀&page=1,2016-08-29 10:23,"파미셀, 발기부전 줄기세포치료제 치료효과 입증","[ 한민수 기자  ] 파미셀은 국책과제로 진행해왔던 발기부전 줄기세포치료제 '셀그램-이디'의 전임상 결과가 국제 학술지에 발표됐다고 29일 밝혔다. 파미셀은 서울아산병원 비뇨기과의 김청수 교수와 동물모델 전임상 시험을 진행했다. 음경해면체 손상 발기부전 동물모델에 셀그램-ED 주입시, 발기능이 개선되고 조직형태학적 평가에서 치료효과가 있음을 확인했다. 이 결과는 국제 학술지인 'Cytotherapy'에 게재됐다. 회사는 2014년 9월 식품의약품안전처로부터 전립선절제술 후 발기부전 및 당뇨병성 발기부전 환자를 대상으로 셀그램-ED를 이용한 임상1상을 승인받아, 진행 중이다. 발기부전을 치료하는 전통적인 방법으로는 PDE5-I의 복용, 해면체에 혈관확장제 주사 등의 요법이 있으나 효과가 일시적이란 설명이다. 파미셀 관계자는 ""중간엽줄기세포는 손상된 조직을 회복하거나 세포기능을 회복시켜, 손상세포의 생존을 증가시키는 특징이 있어 발기부전치료에 효과적일 것으로 기대하고 있다""고 말했다. 한민수 한경닷컴 기자"
이데일리,005690,/news/news_read.nhn?article_id=0003618904&office_id=018&mode=search&query=파미셀&page=1,2016-08-29 10:13,"파미셀, 국책과제 발기부전 줄기세포치료제 치료효과 입증","[이데일리 박형수 기자] 줄기세포업체 가운데 최초로 혁신형제약기업으로 선정된 파미셀(005690)은 국책과제로 진행한 발기부전 줄기세포치료제 ‘셀그램-이디(Cellgram-ED)의 전임상 결과가 국제 학술지에 게재됐다고 29일 밝혔다. 파미셀은 서울아산병원 비뇨기과 김청수 교수와 공동으로 동물모델 전임상시험을 진행했다. 음경해면체 손상 발기부전 동물모델에 셀그램-ED를 주입했을 때 기능이 개선되는 효과를 확인했다. 연구 결과를 국제 학술지(Cytotherapy)에 게재했다. 앞서 파미셀은 2014년 9월 식품의약품안전처로부터 전립선절제술 후 발기부전, 당뇨병성 발기부전 환자를 대상으로 ‘셀그램-ED’를 이용한 임상 1상을 승인받았다. 발기부전을 치료하는 기존 방법은 효과가 일시적인 단점이 있다. 음경보형물을 넣는 수술을 요하지만 감염, 통증, 음경굴곡, 기계적 기능부전 등의 합병증을 유발할 수 있다. 일단 시술하면 자기 발기력을 잃기 때문에 이에 대한 치료제 개발이 시급한 상황이다. 파미셀 관계자는 “중간엽줄기세포는 손상된 조직을 회복하거나 세포기능을 개선해 손상세포의 생존을 늘리는 특징이 있다”며 “발기부전치료에 효과적일 것이라고 기대하고 있다”고 말했다."
한국경제,005690,/news/news_read.nhn?article_id=0003445583&office_id=015&mode=search&query=파미셀&page=1,2015-10-06 15:15,"파미셀, 중국 기업과 정밀화학 공장 MOU","파미셀(대표 김현수·김성래)은 중국 판진합신화공과기유한공사와 정밀화학 분야 사업 협력에 관한 양해각서(MOU)를 체결했다고 6일 발표했다. 이번 협약에 따라 파미셀과 판진합신은 중국 내 16만5000㎡ 규모 정밀화학 공장을 지어 공동으로 운영한다. 파미셀은 중국 현지 공장 설립에 대한 컨설팅, 제품생산, 기술이전 및 판매 등에 관한 지원을 하기로 했다. 판진합신은 공장 설립에 필요한 자금, 설비, 인력을 담당한다. 파미셀 관계자는 “최근 급증하는 수주량을 충족할 수 있는 안정적인 생산 능력을 갖출 수 있게 되었다”며 “중국 시장을 공략할 수 있는 전략적 교두보를 확보한 것”이라고 말했다."
이데일리,005690,/news/news_read.nhn?article_id=0003745346&office_id=018&mode=search&query=파미셀&page=1,2017-02-09 13:18,파미셀 &lsquo;차세대 세포치료제와 바이오신약 개발&rsquo; 심포지엄,[이데일리 박형수 기자] 파미셀 정기 학술 심포지엄이 오는 17일 밀리토피아 호텔에서 열린다. 파미셀(005690)은 ‘차세대 세포치료제 및 바이오신약 개발의 현재와 미래’라는 주제로 제7회 파미셀 정기 학술 심포지엄을 연다고 9일 밝혔다. 파미셀은 지난 2009년부터 개발사와 연구자의 동반성장을 도모하고 바이오산업의 경쟁력을 확보하려고 학술 심포지엄을 열었다. 보건복지부와 한국보건산업진흥원이 후원하는 이번 심포지엄은 각 분야에서 12명의 산학연 전문가가 모여 ‘차세대 세포치료제와 바이오신약 개발’과 관련한 연구성과를 소개한다. 세부적으로 △면역세포와 유전자를 이용한 항암치료에 대한 임상연구 △올리고핵산 기반의 암표적 항암제 △고분자 생체재료를 이용한 신약개발에 관한 최근 연구동향 △줄기세포치료제를 이용한 다양한 난치성 질환 치료의 임상 성과와 중개연구 등을 소개한다. 미래 핵심 인력으로 성장할 젊은 연구자에게 역량을 펼칠 기회를 제공하기 위한 세션을 마련했다. 김현수 파미셀 대표는 “해를 거듭할수록 바이오산업의 변화 속도가 빨라지고 있다”며 “정부 육성책도 다방면에 걸쳐 확대되고 있다”고 설명했다. 이어 “개발사와 연구자 간 긴밀한 협력을 이끌어낼 수 있도록 파미셀의 심포지엄이 튼튼한 가교 역할을 할 것”이라고 덧붙였다.
