source,symbol,link,date,title,content
연합뉴스,005690,/news/news_read.nhn?article_id=0009307803&office_id=001&mode=search&query=파미셀&page=1,2017-06-01 11:33,"파미셀, 7억원 규모 뉴클레오시드 공급계약",(서울=연합뉴스) 유현민 기자 = 파미셀은 미국 '더모 피셔 사이언티픽(Thermo Fisher Scientific)'사와 의약 중간체 뉴클레오시드(Nucleoside) 공급계약을 체결했다고 1일 공시했다. 계약금액은 7억4천여만원으로 작년 말 매출액의 2.68%에 해당한다. 계약 기간은 오는 9월 1일까지다.
연합뉴스,005690,/news/news_read.nhn?article_id=0008421432&office_id=001&mode=search&query=파미셀&page=1,2016-05-23 15:15,&lt;특징주&gt; 의약품 규제 완화 소식에 파미셀&middot;메디포스트 강세(종합),"(서울=연합뉴스) 성서호 기자 = 파미셀과 메디포스트가 식품의약품안전처의 규제 완화 소식에 23일 나란히 상승했다. 이날 유가증권시장에서 파미셀은 전 거래일보다 8.41% 오른 6천700원에 거래를 마쳤다. 식품의약품안전처는 희귀질환, 암 등 일부 질환 치료 신약에만 허용하던 조건부 허가제를 알츠하이머 치매, 뇌경색 등 질환까지 확대하기로 했다. 조건부 허가를 받게 되면 임상 2상 자료만으로도 제품을 시판할 수 있다. 파미셀은 현재 골수에서 추출한 중간엽줄기세포를 이용한 급성 뇌경색 치료제를 개발 중이어서 이번 규제 완화의 수혜를 볼 것이라는 기대감이 작용한 것으로 보인다. 알츠하이머성 치매 세포치료제 '뉴로스템'의 임상 1상과 임상 2상 전기를 동시에 수행 중인 메디포스트도 2.91% 오른 8만8천500원에 장을 마쳤다."
이데일리,005690,/news/news_read.nhn?article_id=0003362504&office_id=018&mode=search&query=파미셀&page=1,2015-10-06 09:54,"파미셀, 중국에 정밀화학 공장 설립&hellip;'2천억 매출 기대'(상보)","- 중국 판진합신화공과기유한공사와 MOU체결 - 중국 판진국가기술개발구 내 5만평 규모 정밀화학공장 건설 [이데일리 임성영 기자] 파미셀(005690)이 중국에 정밀화학 공장을 설립해 중국 시장 공략을 위한 교두보를 확보한다. 파미셀은 중국 랴오닝성(遼寧省) 판진에 위치한 판진합신화공과기유한공사(盤錦合信化工科技有限公司)와 정밀화학 분야의 사업 협력에 관한 양해각서(MOU)를 체결했다고 6일 밝혔다. 이번 MOU는 판진합신의 요청에 의해 합의된 것으로 중국 판진국가기술개발구 내에 정밀화학공장 건설과 공동운영을 골자로 한다. 파미셀의 기술개발 및 마케팅 능력과 중국의 자본이 결합하는 협력구조로 준공 시 제품을 공동생산하고 판매는 파미셀이 담당하는 형태다. MOU에 따라 파미셀은 다음 달부터 △공장건설에 대한 컨설팅 △공장운용 △제품생산 △기술이전 및 판매에 관해 지원한다. 판진합신은 공장설립에 필요한 자금, 설비, 인력을 준비한다. 이미 판진합신 측은 판진국가기술개발구 내에 약 5만 평의 공장부지를 확보한 상태이며 기술이전을 통한 제품의 생산 및 판매와 관련된 계약은 기술이전 시에 각 제품별로 별도로 체결할 예정이다. 현재 파미셀 바이오케미컬사업부의 울산공장은 수주량 증가로 풀가동 상태다. 회사 관계자는 “엠피이지(mPEG)와 뉴클레오시드(Nucleosid) 등 의약품 원료물질을 공급받는 고객사들의 제품 상업화가 임박했다”며 “이에 따른 대규모 수주와 시장초기 단계인 농약중간체, 프린트 토너 원료들의 시장안착을 위한 생산시설 확보에 고민이 많았다”고 말했다. 이어 “이번 합작사업으로 수요를 충족할 수 있는 생산능력을 확보하게 됐다”면서 “공장이 가동되면 연간 2000억~3000억원 정도의 매출이 기대된다”고 설명했다."
아시아경제,005690,/news/news_read.nhn?article_id=0003609598&office_id=277&mode=search&query=파미셀&page=1,2015-10-23 10:35,"[특징주]파미셀, 美 키메릭스 에볼라 신약 임상 3상 개시에 &lsquo;상승&rsquo;",[아시아경제 팍스넷 배요한 기자] 파미셀이 미국 키메릭스(Chimerix)사가 브린시도포비르(에볼라바이러스 실험약물)를 위한 두 실험이 임상3상에 돌입한다는 소식에 상승했다. 파미셀은 23일 오전 10시32분 현재 전일 대비 1.78%(90원) 상승한 5160원에 거래되고 있다. 키메릭스사는 신장이식환자의 Cytomegalovirus(거대세포 바이러스) 질병 예방을 위해 브린시도포비르(에볼라바이러스 실험약물) SUSTAIN과 SURPASS 연구가 임상3상 단계에 돌입했다고 22일 밝혔다. 파미셀이 키메릭스에 브린시드포비르에 쓰이는 신약원료 ‘토실레이트’를 독점 공급하고 있다.
한국경제TV,005690,/news/news_read.nhn?article_id=0000673066&office_id=215&mode=search&query=파미셀&page=1,2018-08-17 12:07,"파미셀, 10% 급등... 전일 보다 1,350원 상승한 14,450원","[한국경제TV 라이온봇 기자] [그림 1] 최근 3개월 간 주가 추세 및 기간별 수익률 파미셀은 8월 17일 12시 6분 전일 대비 약 10% 급등한 14,450원에 거래되고 있다. 파미셀은 코스피 상장 기업으로 의약품 업종에 속해 있다. 시가총액은 7,854억원으로 코스피 상장기업 중 198위에 위치 해 있다. [종목 성향 진단] [그림 2] 종목 성향 진단 파미셀의 투자 스타일은 성장주에 가깝다. 주가 고평가 우려가 공존하지만 높은 성장성이 기대되는 기업이다. 주가 모멘텀은 좋지 못했다. 최근 3개월 수익률은 -37.92%의 하락폭을 기록했다. 최근 1개월 수익률 또한 -21.32% 하락하며 부진한 모멘텀을 이어가고 있다. 파미셀 종목에 대한 투자자의 관심도는 굉장히 높은 편이다. [투자 점수 진단] [그림 3] 투자 점수 진단 파미셀은 어느 측면에서 투자 매력도가 높은 종목일까? AI 인공지능 종목 분석 시스템을 이용해 성장성, 수익성, 효율성, 안전성, 저평가성, 추세 등 주가 수익률에 영향을 줄 수 있는 6가지 핵심 투자 지표를 점수화하여 종목의 투자 매력도를 계산해보았다. 그 결과 파미셀은 상대적으로 재무안정성 측면에서 두각을 드러내고 있었다. 재무안정성 점수는 기업의 재무 구조가 얼마나 안정적인 상태인지를 나타낸다. 파미셀은 특히 유동비율 측면에서 가장 높은 점수는 기록했는데, 전체 시장 내 35위를 기록하며 상위 1.75%에 위치했다. 업종별로는 2위를 기록하며 상위 0.45%에 위치했다. 그러나 기업 가치 대비 주가 수준을 나타내는 저평가 측면에서는 아쉬움을 나타냈다. (위의 AI인공지능 점수는 재무 데이터를 기반으로 전체 상장 종목과 비교/분석하여 도출한 점수로 높은 점수가 반드시 높은 수익률을 보장하지 않습니다. 위의 자료는 당사의 추천 종목이 아니며, 투자 시 참고용으로 제시해드리는 것입니다. 핵심투자지표를 결합해 종목의 투자매력도를 종합 계산한 ""인공지능 투자점수""는 ""거장들의 투자공식"" 앱에서 확인하실 수 있습니다.) 라이온봇 기자 -한국경제TV※ 본 기사는 한국경제TV와 '거장들의 투자공식이'자체 개발한 '라이온봇 기자'가 실시간으로 작성한 기사입니다. 라이온봇기자"
한국경제TV,005690,/news/news_read.nhn?article_id=0000676737&office_id=215&mode=search&query=파미셀&page=1,2018-08-29 14:01,"파미셀, 5거래일 연속 상승... 전일 대비 3% 상승","[한국경제TV 라이온봇 기자] [그림 1] 최근 3개월 간 주가 추세 및 기간별 수익률 파미셀은 현재 5거래일 연속 상승세를 기록하고 있어 주목할 만하다. 파미셀은 8월 29일 14시 1분 전일 대비 약 3% 상승한 18,000원에 거래되고 있다. 파미셀은 코스피 상장 기업으로 의약품 업종에 속해 있다. 시가총액은 1조522억원으로 코스피 상장기업 중 166위에 위치 해 있다. [종목 성향 진단] [그림 2] 종목 성향 진단 파미셀의 투자 스타일은 성장주에 가깝다. 주가 고평가 우려가 공존하지만 높은 성장성이 기대되는 기업이다. 주가 모멘텀은 굉장히 좋은 편이었다. 최근 6개월 수익률이 무려 187.71%의 상승폭을 기록했다. 최근 1개월 수익률 또한 39.84% 상승하며 굉장히 좋은 모멘텀을 보이고 있다. 파미셀 종목에 대한 투자자의 관심도는 굉장히 높은 편이다. [투자 점수 진단] [그림 3] 투자 점수 진단 파미셀은 어느 측면에서 투자 매력도가 높은 종목일까? AI 인공지능 종목 분석 시스템을 이용해 성장성, 수익성, 효율성, 안전성, 저평가성, 추세 등 주가 수익률에 영향을 줄 수 있는 6가지 핵심 투자 지표를 점수화하여 종목의 투자 매력도를 계산해보았다. 그 결과 파미셀은 상대적으로 재무안정성 측면에서 두각을 드러내고 있었다. 재무안정성 점수는 기업의 재무 구조가 얼마나 안정적인 상태인지를 나타낸다. 파미셀은 특히 유동비율 측면에서 가장 높은 점수는 기록했는데, 전체 시장 내 36위를 기록하며 상위 1.79%에 위치했다. 업종별로는 3위를 기록하며 상위 0.89%에 위치했다. 그러나 기업 가치 대비 주가 수준을 나타내는 저평가 측면에서는 아쉬움을 나타냈다. (위의 AI인공지능 점수는 재무 데이터를 기반으로 전체 상장 종목과 비교/분석하여 도출한 점수로 높은 점수가 반드시 높은 수익률을 보장하지 않습니다. 위의 자료는 당사의 추천 종목이 아니며, 투자 시 참고용으로 제시해드리는 것입니다. 핵심투자지표를 결합해 종목의 투자매력도를 종합 계산한 ""인공지능 투자점수""는 ""거장들의 투자공식"" 앱에서 확인하실 수 있습니다.) 라이온봇 기자 -한국경제TV※ 본 기사는 한국경제TV와 '거장들의 투자공식이'자체 개발한 '라이온봇 기자'가 실시간으로 작성한 기사입니다. 라이온봇기자"
한국경제TV,005690,/news/news_read.nhn?article_id=0000633955&office_id=215&mode=search&query=파미셀&page=1,2018-05-14 16:38,[국고처 권태민] 종목상담 - 파미셀(005690),[한국경제TV 류장현 PD] [국고처 권태민] 종목상담 - 파미셀(005690) 05월 12일 방송된 '국민주식고충처리반'에 출연한 권태민파트너가 파미셀(005690)에 대한 시세와 전망을 이야기하고 있다.
파이낸셜뉴스,005690,/news/news_read.nhn?article_id=0003792872&office_id=014&mode=search&query=파미셀&page=1,2017-03-23 11:07,"[fnRASSI]파미셀, 0.68% 내리며 거래량 증가","파미셀은 투자자들의 관심으로 현재 거래량이 최근 5거래일 거래량의 최고치를 넘어섰다. 그리고 파미셀은 4일 연속 하락흐름을 보이며, 11시 3분 현재 0.68% 내린 4,390원에 거래중이다. 상장주식수 대비 거래량은 0.46%로 적정수준 최근 한달간 파미셀의 상장주식수 대비 거래량을 비교해보니 일별 매매회전율이 0.46%로 집계됐다. 그리고 동기간 장중 저점과 고점의 차이인 일평균 주가변동률을 2.31%를 나타내고 있다. 기관과 개인은 순매도, 외국인은 순매수(한달누적)  3월16일부터 전일까지 기관이 5거래일 연속 동종목을 내다 팔았다. 4주간을 기준으로 보면 외국인이 순매수량을 늘리며 186,088주를 순매수한 반면, 기관은 매도 우위를 지속하면서 20,613주를 순매도했고, 개인들도 매도 관점으로 접근하면서 165,475주를 순매도한 것으로 집계됐다. 'fnRASSI'는 증권전문 기업 씽크풀과 파이낸셜뉴스의 협업으로 로봇기자가 실시간으로 생산하는 기사입니다."
머니투데이,005690,/news/news_read.nhn?article_id=0003713927&office_id=008&mode=search&query=파미셀&page=1,2016-07-19 15:10,"파미셀, 신규 뉴클레오시드 개발 정부지원과제 선정","[머니투데이 안정준 기자] 파미셀은 '안티센스 의약품 적용을 위한 신규 뉴클레오시드(Nucleoside) 개발' 사업이 한국산업단지공단 생산기술사업화 과제로 선정돼 협약을 체결했다고 19일 밝혔다. 이번 과제를 통해 개발하게 될 신규 뉴클레오시드는 '3세대 안티센스 의약품'의 원료로 사용된다. 해당 제품에 대한 기초 개발은 이미 완료한 상태며 이번 과제를 통해 상업적 생산을 위한 제조기술, 생산공정을 확립하게 된다. 뉴클레오시드는 안티센스의약품, 유전자치료제 및 진단시약에 사용되는 원료로 IT산업의 반도체와 같이 필수적인 바이오 소재이다. 전 세계 뉴클레오시드 시장의 약 85%를 점유하고 있는 파미셀은 10여 년 전부터 독일의 시그마알드리치(Sigma Aldrich), 미국의 써모피셔(Thermo Fischer) 등에 뉴클레오시드를 공급하고 있으며 2014년부터 신규 뉴클레오시드의 개발을 위해 미국 고객사들과 협력중이다. 특히 미국의 아이오니스(IONIS)는 파미셀에서 개발한 신규 뉴클레오시드를 적용해 '3세대 안티센스 치료제'에 대한 임상 3상을 진행하고 있다. 이번 과제는 해당 임상의 종료 및 제품 출시를 염두해 두고 진행하는 것이다. 파미셀 관계자는 ""이번 과제를 통해서 최적의 상업적 생산 기술을 확보해 2017년부터 증가하는 수요에 적극적으로 대비할 예정""이라고 말했다. textlinktopstart textlinktopend textlinkstart"
한국경제,005690,/news/news_read.nhn?article_id=0003445302&office_id=015&mode=search&query=파미셀&page=1,2015-10-06 09:59,"파미셀, 中 판진합신과 케미컬사업 합작","중국 판진국가기술개발구에 정밀화학공장 건설 및 공동운영연간 2000억~3000억 원 매출 기대 [ 한민수 기자  ] 파미셀이 중국 자본과 손잡고 약 5만평 부지에 정밀화학 공장을 세운다. 이로써 파미셀은 급증하는 수주에 대응할 수 있는 생산능력(CAPA)을 갖추게 되며, 중국 시장을 공략할 수 있는 교두보도 확보하게 됐다. 파미셀은 중국 랴오닝성 판진에 위치한 판진합신화공과기유한공사와 정밀화학 분야 사업 협력에 관한 양해각서(MOU)를 체결했다고 6일 밝혔다. 이번 MOU는 판진합신의 요청에 의해 체결된 것으로, 중국 판진국가기술개발구 내 정밀화학공장 건설 및 공동운영을 골자로 한다. 파미셀의 기술개발 및 마케팅 능력과 중국의 자본이 결합하는 구조다. 준공시 제품은 공동 생산하고, 판매는 파미셀이 담당한다. MOU에 따라 파미셀은 다음달부터 공장건설에 대한 컨설팅과 공장운용, 제품생산, 기술이전 및 판매에 관한 지원을 하기로 했다. 판진합신은 공장 설립에 필요한 자금 설비 인력 등을 준비하게 된다. 판진합신 측은 판진국가기술개발구에 약 5만평의 공장 부지를 확보한 상태다. 기술이전을 통한 제품의 생산 및 판매와 관련된 계약은 기술이전시에 각 제품별로 체결하게 된다. 현재 파미셀 바이오케미컬사업부의 울산 공장은 수주량 증가로 인해 풀가동 상태다. 회사 관계자는 ""mPEG 및 Nucleoside(뉴클레오시드)와 같은 의약품 원료물질을 공급받는 고객사들의 제품 상업화가 임박함에 따라 대규모 수주에 대비해야 한다""며 ""또 시장초기 단계인 농약중간체 및 프린트 토너원료들의 시장 안착을 위한 생산시설 확보에도 고민이 많았다""고 말했다. 이어 ""공장 준공 즉시 고분자 첨가물을 비롯해 촉매제와 원료의약품 등을 순차적으로 생산해 중국 시장 점유율을 확대할 계획""이라며 ""공장이 가동되면 연간 2000억~3000억원 정도의 매출을 기대한다""고 덧붙였다. 한민수 한경닷컴 기자"
한국경제TV,005690,/news/news_read.nhn?article_id=0000633787&office_id=215&mode=search&query=파미셀&page=1,2018-05-14 13:01,"파미셀, 전일 대비 약 -8% 하락한 18,150원","[한국경제TV 라이온봇 기자] 파미셀은 5월 14일 13시 0분 전일 대비 약 -8% 하락한 18,150원에 거래되고 있다. 파미셀은 코스피 상장 기업으로 의약품 업종에 속해 있다. 시가총액은 1조1,487억원으로 코스피 상장기업 중 168위에 위치 해 있다. [종목 성향 진단] [그림 1] 종목 성향 진단 파미셀의 투자 스타일은 성장주에 가깝다. 주가 고평가 우려가 공존하지만 높은 성장성이 기대되는 기업이다. 주가 모멘텀은 좋지 못했다. 최근 1개월 수익률은 -20.77%의 하락폭을 기록했다. 파미셀 종목에 대한 투자자의 관심도는 굉장히 높은 편이다. [투자 점수 진단] [그림 2] 투자 점수 진단 파미셀은 안정성(부채비율) 측면에서 두각을 나타내고 있다. 최근 부채비율은 92점으로 6개의 핵심 팩터 중 가장 높은 점수를 기록했다. 부채비율은  전체 시장 내 178위를 기록하며 상위 8.2%에 위치했다. 업종별로는 14위를 기록하며 상위 5.75%에 위치했다. 그리고 성장성(매출증가율(YoY)) 역시 도드라지는 편이다. 성장성 점수는 77점으로 두번째로 높은 점수를 기록했다. 매출증가율(YoY)은 전체 시장 내 413위를 기록하며 상위 22.69%에 위치했다. 업종별로는 44위를 기록하며 상위 19.72%에 위치했다. 그러나 ROA와 PBR은  아쉬움을 나타냈다. [종합 투자점수] [그림 3] 종합 투자점수 AI 인공지능 분석을 통한 파미셀의 종목 종합 스코어는 62점을 기록했다. 이는 동일 업종 평균점수인 60점과 시장 평균점수인 59점를 상회하는 수치였다. (위의 AI인공지능 점수는 재무 데이터를 기반으로 전체 상장 종목과 비교/분석하여 도출한 점수로 높은 점수가 반드시 높은 수익률을 보장하지 않습니다. 위의 자료는 당사의 추천 종목이 아니며, 투자 시 참고용으로 제시해드리는 것입니다.) 라이온봇 기자 -한국경제TV※ 본 기사는 한국경제TV와 '거장들의 투자공식이'자체 개발한 '라이온봇 기자'가 실시간으로 작성한 기사입니다. 라이온봇기자 ⓒ 한국경제TV, 무단 전재 및 재배포 금지 한국경제TV 관련뉴스해당 언론사에서 선정하며 언론사 페이지(아웃링크)로 이동해 볼 수 있습니다.서정희 딸 서동주, 이렇게 예뻤나김생민 근황은?…박명수 예언 발언 ""소름 돋네""정려원 고백, '불같았던' 열애 상대 누구?민유라 해명, ""겜린과는 비지니스 파트너""홍수아 올 망사?…'이쯤되면 대륙여신'"
한국경제,005690,/news/news_read.nhn?article_id=0003627228&office_id=015&mode=search&query=파미셀&page=1,2016-07-19 14:14,"파미셀, 신규 뉴클레오시드 개발 정부지원과제 선정","[ 한민수 기자  ] 파미셀은 '안티센스 의약품 적용을 위한 신규 뉴클레오시드 개발' 사업이 한국산업단지공단 생산기술사업화 과제로 선정돼 협약을 체결했다고 19일 밝혔다. 이번 과제를 통해 개발하게 될 신규 뉴클레오시드는 '3세대 안티센스 의약품'의 원료로 사용된다. 기초 개발은 완료한 상태며, 과제를 통해 상업적 생산을 위한 제조기술 및 생산공정을 확립하는 것이 목표다. 뉴클레오시드는 안티센스 의약품, 유전자치료제 및 진단시약에 사용되는 원료로, 정보기술(IT) 산업의 반도체와 같이 필수적인 바이오 소재다. 파미셀은 세계 뉴클레오시드 시장의 약 85%를 점유하고 있다. 10여년 전부터 독일의 시그마알드리치, 미국의 써모피셔 등에 뉴클레오시드를 공급하고 있으며, 2014년부터 신규 뉴클레오시드의 개발을 위해 미국 고객사들과 기술교류 등 협력을 해오고 있다. 특히 미국의 아이오니스는 파미셀에서 개발한 신규 뉴클레오시드를 적용해 3세대 안티센스 치료제에 대한 임상3상을 진행하고 있다. 이번 과제는 이 임상의 종료 및 제품 출시를 염두에 두고 진행하는 것이다. 파미셀 관계자는 ""이번 과제를 통해 최적의 상업적 생산 기술을 확보, 내년부터 증가하는 수요에 적극적으로 대비할 예정""이라고 말했다. 한민수 한경닷컴 기자"
아시아경제,005690,/news/news_read.nhn?article_id=0003624124&office_id=277&mode=search&query=파미셀&page=1,2015-11-12 13:38,"[특징주]파미셀, 20조 머크-씨그마알드리치 M&amp;A에 협력 부각&hellip;&uarr;","[아시아경제 김원규 기자]파미셀이 머크가 20조원 규모의 씨그마알드리치 인수를 완료했다는 소식에 강세다. 12일 오후 1시35분 현재 파미셀은 전거래일보다 3.13% 오른 5100원에 거래되고 있다. 이날 머크는 유럽연합 집행위원회(EC)의 최종 승인을 받아 170억달러(약 19조6000억원) 규모의 씨그마알드리치 인수를 완료했다고 밝혔다. EC는 지난 6월15일 씨그마알드리치의 특정 자산을 매각하는 조건으로 머크의 인수를 승인했고 머크는 지난달 20일 씨그마알드리치의 용제와 무기물 사업 일부를 하니웰에 매각하는 계약을 체결했다. 칼루드비히 클레이 머크 회장은 ""350년 머크 역사에서 가장 큰 규모의 인수를 완성하는 것""이라며 ""이번 인수로 머크는 1300억달러 규모의 생명과학 시장에서 2만명의 직원, 30만개의 제품, 수천건의 특허를 가진 최고의 업체로 혁신적인 솔루션을 제공할 것""이라고 말했다. 파미셀은 머크와 수년간 신약연구 협력을 해오고 있으며 씨그마알드리치에 제품 공급계약을 체결한 적이 있다."
이데일리,005690,/news/news_read.nhn?article_id=0003563531&office_id=018&mode=search&query=파미셀&page=1,2016-06-13 15:17,한국조직공학재생의학회 '파미셀 상'에 임군일 교수 선정,[이데일리 박형수 기자] 일산 동국대학교병원 정형외과 임군일 교수가 한국조직공학재생의학회 ‘파미셀상’을 수상했다. 파미셀(005690)은 매년 한국조직공학재생의학회가 접수한 논문 가운데 산업화에 기여할 수 있는 우수 논문을 선정해 수여하는 ‘파미셀상’을 임군일 교수가 받는다고 13일 밝혔다. 임군일 교수는 논문을 통해 조골세포(osteoblast) 발달에 관여하는 유전자(Runx-2)를 탑재한 지방 줄기세포가 손상된 뼈를 재생하는데 의미 있는 역할을 하는 것을 증명했다. 지방에서 유래한 줄기세포는 골수 유래 줄기세포보다 뼈 재생능력이 낮은 단점이 있는 것으로 알려졌다. 하지만 임 교수의 연구를 통해 지방줄기 세포도 뼈를 재생하는 데 사용할 수 있을 것으로 보인다. 파미셀 관계자는 “실질적인 연구성과는 재생의료 산업의 발전에 기여한다”며 “유전자 탑재 줄기세포치료제는 파미셀이 추구하는 2세대 줄기세포치료제의 주요 형태”라고 말했다. ‘파미셀상’ 시상식은 지난 11일 이화여자대학교 복합캠퍼스(ECC)에서 열린 한국조직재생의학회 춘계 정기학술대회에서 진행했다.
헤럴드경제,005690,/news/news_read.nhn?article_id=0000870308&office_id=016&mode=search&query=파미셀&page=1,2015-10-07 09:42,"&lt;생생코스피&gt; 파미셀, 10.5억 규모 뉴클레오시드 공급계약","파미셀은 독일 Sigma-Aldrich와 10억5530만원 규모의 의약중간체 뉴클레오시드(Nucleoside) 공급계약을 체결했다고 7일 공시했다. 이는 2014년 매출액 대비 5.23%에 해당하며 계약기간은 2016년 2월 15일까지다. [자전거 Q&amp;A] 자전거를 가지고 지하철 탈 수 있나요? ""IS 포로된 여성들, 성폭행 못견디고 수백명 집단 자살"""
