source,symbol,link,date,title,content
뉴시스,006400,/news/news_read.nhn?article_id=0008576735&office_id=003&mode=search&query=삼성SDI&page=24,2018-05-02 18:49,"삼성SDI, 1분기 매출 1조9089억&middot;영업익 720억","소형전지, ESS 판매 확대로 전분기 대비 매출 증가자동차전지사업 일회성 비용 반영으로 전분기 대비 영업익 감소2분기 자동차전지 매출 확대, ESS 성장, 소형전지 판매 호조로 실적 개선 전망 【서울=뉴시스】이종희 기자 = 삼성SDI가 2일 매출 1조9089억원, 영업이익 720억원의 올해 1분기 경영실적을 발표했다. 매출은 전년 동기 대비는 6041억원(46.3%), 전분기 대비 567억원(3.1%) 증가했다. 영업이익은 전년 동기 대비는 1393억원 늘어나 흑자전환했다. 다만, 전분기 대비 466억원 줄어든 720억원을 기록했다. 전지사업부문에서 소형전지는 전동공구용 원형 전지 매출 증가와 폴리머전지 주요 고객 신제품 출시 효과 등으로 전분기 대비 매출이 증가했다. 중대형전지는 유럽 전기차 공급 지속과 에너지저장시스템(ESS) 판매 증가로 매출 성장세가 지속됐으나, 초기 자동차 전지 공급계약에 대한 일회성 비용 반영으로 전분기 대비 적자 폭이 확대됐다. 전자재료사업부문은 전분기 대비 매출이 소폭 하락했다. 반도체 소재는 고객사 신규 공장 가동으로 인해 매출이 증가했으나, OLED 소재와 태양광 페이스트는 전방 수요 감소 영향을 받아 매출이 감소했다. 삼성SDI는 2018년 2분기 전 사업부문에서 실적이 개선 될 것으로 전망했다. 전지사업부문의 자동차전지는 유럽향 전기차 매출이 확대되고 ESS는 국내 시장에서 수요가 증가하며 큰 폭의 매출 성장이 예상된다. 소형전지는 전동공구, 정원공구 등 Non-IT용 원형전지 판매가 지속 호조를 보일 것으로 예상되며, 폴리머전지 역시 고객사들의 신제품 출시로 판매가 증가할 것으로 기대된다. 전자재료사업부문은 2분기에 디스플레이 업황 회복으로 실적이 개선될 전망이다. 반도체 소재는 시장 호조로 매출 증가세가 지속되고 디스플레이 소재는 중화권 신규 수요로 고부가 제품 판매가 확대될 전망이다. 삼성SDI 관계자는 영업이익이 전분기에 비해 감소한 배경에 대해 ""자동차전지 사업의 원자재 가격 상승 등의 리스크를 반영하다 보니 일회성 비용이 늘어났기 때문""이라며 ""초기에 수주한 프로젝트들의 수익성 개선이 당분간 어렵겠지만 고객과의 거래조건 재협상 및 지속적인 원가절감 활동을 통해 손익 개선 시점을 최대한 단축하도록 노력 할 것""이라고 설명했다."
뉴시스,006400,/news/news_read.nhn?article_id=0008576734&office_id=003&mode=search&query=삼성SDI&page=24,2018-05-02 18:49,[삼성SDI 컨콜]&quot;내부 현금흐름 양호...회사채 발행 계획 있다&quot;,"【서울=뉴시스】이종희 기자 = 삼성SDI는 2일 올해 1분기 실적발표 이후 이어진 컨퍼런스콜에서 투자와 관련해 내부 자금을 충당하고 부족한 부분에 대해 회사채 발행 계획이 있다고 밝혔다. 김익현 삼성SDI 재경팀 상무는 ""전지시장 수요가 빠르게 증가해 중대형을 중심으로 급격히 매출이 증가하고 있다""며 ""현재 무엇보다 생산능력 확보가 중요해 캐펙스 투자와 운영자금 수요가 증가할 것으로 전망된다""고 말했다. 이어 ""삼성물산 지분 매각을 통해 5000억원의 자금을 확보했다""며 ""영업부문에서 손익계산이 전망돼 양호한 현금흐름이 예상된다""고 설명했다."
디지털타임스,006400,/news/news_read.nhn?article_id=0002474836&office_id=029&mode=search&query=삼성SDI&page=8,2018-07-30 11:04,[컨콜]삼성SDI &quot;BMW 중국 배터리 계약 불구 높은 점유율 유지&quot;,"[디지털타임스 박정일 기자] 삼성SDI는 30일 2분기 실적발표 콘퍼런스콜에서 중국 CATL의 BMW 전기차용 배터리 공급 계약과 관련해 ""글로벌 완성차 업체들이 추가 공급선을 확보하는 것은 성장하는 전기차 시장에서 안정적인 배터리 조달을 위해 불가피한 선택""이라고 답했다. 하지만 ""이런 시장 확대가 당사에도 새로운 공급 기회를 열어주고 있어 좋은 결과로 연결될 것""이라며 ""또 주요 완성차 업체들이 신규 공급업체를 선정한다고 하더라도 지금까지 쌓아온 신뢰와 기술력 등을 고려할 때 (BMW 배터리 공급에서)높은 점유율을 유지할 것""이라고 덧붙였다."
이데일리,006400,/news/news_read.nhn?article_id=0004093260&office_id=018&mode=search&query=삼성SDI&page=24,2018-05-02 17:05,'흑자 전환'에도 웃지 못한 삼성SDI(종합),"1Q 영업익 720억원..전분기比 466억원 ↓'애물단지' 된 자동치전지 초기 계약물량 [이데일리 윤종성 기자] 삼성SDI가 전영현 사장 부임후 시작한 ‘흑자 행진’을 4분기째 이어갔다. 하지만 자동차전지 초기 계약분에서 예상치 못한 비용이 발생하면서 흑자 폭은 전분기보다 쪼그라들었다. 삼성SDI(006400)는  올 1분기(연결재무제표 기준) 매출 1조 9089억원, 영업이익 720억원을 달성했다고 2일 공시했다. 지난해 같은 기간보다 매출은 46.3% 증가했고, 영업이익은 흑자로 돌아섰다. 하지만 전분기와 비교하면 매출은 3% 늘어나는데 그쳤고, 영업이익은 466억원 줄어든 수치다. 1000억원 이상의 ‘깜짝 실적’을 점쳤던 시장 기대치와도 다소 어긋나는 실적이다. 원자재 가격을 판가에 연동하지 않은 초기 자동차전지 공급계약에서 추가 비용이 발생하면서 중대형전지의 적자 폭이 확대됐다. 쉽게 말해 원자재 가격은 계속 상승하는데 계약 조건상 공급 가격을 올릴 수 없어 삼성SDI가 원자재 가격 상승분을 떠안았다는 의미다. 삼성SDI 관계자는 “자동차전지 사업의 원자재 가격 상승 등의 리스크를 반영하다 보니 일회성 비용이 늘어 전분기보다 영업이익이 감소했다”라고 설명했다. 회사 측에 따르면 초기 계약 건의 상당수가 원자재 가격 상승분을 반영하기 어려운 실정이다. 삼성SDI는 지난해부터 자동차전지 계약 체결시 원자재 가격 상승분을 판가에 연동시키고 있다. 전자재료사업부문의 매출도 전분기 대비 소폭 하락했다. 반도체 소재는 고객사 신규 공장 가동으로 인해 매출이 증가했으나, 유기발광다이오드(OLED) 소재와 태양광 페이스트의 매출이 줄었기 때문이다. 한편, 삼성SDI는 2분기에는 전 사업부문에 걸쳐 실적이 개선될 것으로 전망했다. 특히 유럽향 전기차 매출이 확대되고, ESS의 국내 수요 증가가 예상되는 전지사업부문에서 큰 폭의 매출 성장을 기대했다. 전자재료사업부문은 디스플레이 업황 회복에 따른 실적 개선을 내다봤다. 삼성SDI 관계자는 “초기에 수주한 프로젝트들의 수익성 개선이 당분간 어렵겠지만 고객과의 거래조건 재협상 및 지속적인 원가절감 활동을 통해 손익 개선 시점을 최대한 단축하도록 노력 할 것”이라고 강조했다. ▲삼성SDI 2018년 1분기 실적(단위= 억원)"
뉴시스,006400,/news/news_read.nhn?article_id=0008576740&office_id=003&mode=search&query=삼성SDI&page=24,2018-05-02 18:52,[종합][삼성SDI 컨콜]&quot;전지시장 수요 확대...자금흐름 문제 없다&quot;,"""삼성물산 지분 매각으로 5000억 확보...영업부문 개선""""ESS 수요, 국내는 둔화될 여지...글로벌 시장 확대될 것"" 【서울=뉴시스】이종희 기자 = 삼성SDI가 전지시장 확대에 대비해 설비투자 확대에 나설 계획을 밝혔다. 삼성SDI는 2일 올해 1분기 실적발표 이후 이어진 컨퍼런스콜에서 전지시장 확대에 대비해 투자와 관련해 내부 자금을 충당하고 부족한 부분에 대해 회사채 발행 계획이 있다고 설명했다. 김익현 삼성SDI 재경팀 상무는 ""전지시장 수요가 빠르게 증가해 중대형을 중심으로 급격히 매출이 증가하고 있다""며 ""현재 무엇보다 생산능력 확보가 중요해 캐펙스 투자와 운영자금 수요가 증가할 것으로 전망된다""고 말했다. 이어 ""삼성물산 지분 매각을 통해 5000억원의 자금을 확보했다""며 ""영업부문에서 손익계산이 전망돼 양호한 현금흐름이 예상된다""고 설명했다. 삼성SDI는 ESS의 국내 수요는 둔화될 여지가 있지만 글로벌 시장 수요가 증가할 것으로 예상했다. 손미카엘 삼성SDI 전무는 ""작년 하반기부터 금년까지 국내 시장을 중심으로 정부 정책에 따라 국내 수요가 매출증가에 기여했던 것이 사실""이라며 ""내년에는 촉진정책이 감소돼 국내 수요 둔화될 여지가 있다""고 분석했다. 이어 ""미국, 유럽, 일본, 호주 등 주요 선진국 시장 수요증가가 지속되고 글로벌 ESS시장 확대에 따라 저희 매출도 지속 성장할 것""이라며 ""중장기적으로는 국내 시장도 대규모 태양광 및 풍력 발전 도입계획이 있어 이와 연계된 ESS 수요가증가할 것""이라고 설명했다. 소형전지는 부진이 예상되지만 연구개발을 통해 극복하겠다고 말했다. 손 전무는 ""스마트폰 시장보급률이 포화가 되고 있으며 교체주기가 장기화되고 있는 상황""이라며 ""중저가 스마트폰 시장의 폴리머 전지 채택율이 증가하고 있다. 성장패턴을 유지할 것""이라고 강조했다. 아울러 ""통신기술과 사물인터넷(IoT) 환경 확대로 증강현실(AR), 가상현실(VR) 헤드셋 관련 문의가 늘어나고 있다. 이에 배터리 탑재량도 늘어날 것""이라며 ""부품이 늘어남에 따라 배터리 탑재 공간이 부족해져 에너지 집적도를 높이려 하고 있다""고 부연했다. 삼성SDI는 중국 현지 기업과 전기차 제품 문의·협업이 이어지고 있다고 말했다. 손 전무는 ""양국 정부간 경색관계가 개선되고 있다""며 ""여러 산업분야에서 교류 협업이 재개되는 조짐이 보여 자동차 전지 분야도 상황이 개선될 것으로 기대한다""고 설명했다. 이어 ""전기차 사업을 진행하는 OEM이 많고 활발하다. 중국 내에서 규모와 기술을 갖춘 업체가 한정돼 다수의 로컬 기업들이 한국과 협업을 희망하고 있다""며 ""보조금 지급이 2020년 이후에 없어지는데 그 시점을 대비해서 당사와 협의와 제품 문의가 늘어나고 있다""고 말했다. 다만 ""중국 전기차 시장에 재진입하는 시기는 단정하기 어렵다""며 ""보조금 지급 관련해서도 아직 뚜렷한 변화는 느끼지 못하고 있다""고 말했다. 삼성SDI는 삼성디스플레이의 수요 감소로 인해 매출이 감소했다고 말했다. 김경훈 삼성SDI 전무는 ""삼성디스플레이의 1분기 수요 둔화로 재료도 20% 매출이 감소했다""며 ""4월부터 가동율을 회복하면서 미주 및 중화향 신규모델을 출시를 준비하고 있다""고 말했다. 그러면서 ""삼성SDI도 BOE, 티엔마 등 중화권 신규수요에 매출이 확대되고 있어 금년도 매출 목표를 달성할 수 있을 것""이라고 덧붙였다. 한편, 삼성SDI는 이날 매출 1조9089억원, 영업이익 720억원의 올해 1분기 경영실적을 발표했다. 매출은 전년 동기 대비는 6041억원(46.3%), 전분기 대비 567억원(3.1%) 증가했다. 영업이익은 전년 동기 대비는 1393억원 늘어나 흑자전환했다. 다만, 전분기 대비 466억원 줄어든 720억원을 기록했다."
아시아경제,006400,/news/news_read.nhn?article_id=0004230966&office_id=277&mode=search&query=삼성SDI&page=24,2018-05-03 07:43,"[클릭 e종목] 삼성SDI, 2차전지 사업경쟁력 강화 지속&hellip;&quot;조정 시 매수 대응&quot;","[아시아경제 임철영 기자] NH투자증권은 3일 삼성SDI에 대해 2차전지 사업 경쟁력이 지속적으로 강화되고 있고 삼성디스플레이 우려 해소 시기 도래 등을 반영해 매수 관점에서 접근이 필요하다고 조언했다. 목표주가 27만원과 투자의견 매수를 유지했다. 1분기 영업이익은 일회성 비용을 제거하면 800억원을 넘어선다고 분석했다. 삼성SDI는 1분기 매출액 1조9100억원, 영업이익 720억원을 기록해 시장 추정치를 상회했다. 고정우 연구원은 ""소형 2차전지의 경우 스마트폰용 폴리머전지 물량 증가 등이 실적 개선으로 연결됐다""며 ""중대형 2차전지의 경우 xEV용 공급 물량이 전년 동기 대비 58% 증가했고, 전자재료에서는 OLED 소재 판매 부진에도 불구 반도체 소재 판매 양호로 실적 하락을 방어했다""고 설명했다. 2분기 영업이익은 1290억원을 달성할 것으로 내다봤다. 고 연구원은 ""소형 2차 전지는 Non-IT용 원형전지 볼륨 성장에 따른 성장률 제고 모멘텀을 예상한다""며 ""중대형 2차전지는 ESS 수주 효과가 극대화될 것으로 전망, 전자재료는 주요 고객사의 OLED 가동률 회복 등이 실적 성장의 촉매제가 될 것으로 보인다""고 말했다. 이에 따라 조정 시 매수 대응 구간이라고 진단했다. 고 연구원은 ""현재 2차전지 사업의 실적 추정치도 상향 중에 있는 상황이고 추가로 삼성디스플레이 proxy 역할도 6월 이후 재인식될 것이라는 점은 분명하다""며 ""주가의 수준과 타이밍 모두에서 매수 관점 유효하다고 판단 한다""고 설명했다."
데일리안,006400,/news/news_read.nhn?article_id=0002272769&office_id=119&mode=search&query=삼성SDI&page=8,2018-07-30 10:58,[컨콜]삼성SDI &quot;배터리 용량 증가와 5G 장비로 소형 전지 수익성 개선&quot;,"삼성SDI는 30일 오전 진행된 2분기 실적 컨퍼런스콜에서 ""2분기 폴리머 배터리 수요는 신규 스마트폰 출시 공백으로 일시적으로 하락했다""며 ""하지만 신규 배터리 용량 증가와 5G 장비 등장으로 향후 소형 전지 수익성은 개선될 것""이라고 밝혔다."
한국경제,006400,/news/news_read.nhn?article_id=0003932916&office_id=015&mode=search&query=삼성SDI&page=24,2018-05-03 07:45,"&quot;삼성SDI, 중대형 전지 연내 흑자전환 기대&quot;-IBK","IBK투자증권은 3일 삼성SDI에 대해 중대형 전지 적자 규모가 빠르게 감소하며 성장을 주도할 전망이라고 분석했다. 투자의견 '매수'와 목표주가 25만원을 유지했다. 김운호 연구원은 ""삼성SDI의 1분기 영업이익은 직전 분기 대비 39.3% 감소한 720억원""이라며 ""중대형 전지와 전자 재료 부문의 수익성이 악화된 것이 주요 원인이나 1분기가 연중 최저 규모일 것""이라고 밝혔다. 삼성SDI의 중대형 전지가 새로운 국면으로 접어들고 있다고 김 연구원은 평가했다. 올해 안에 흑자 전환이 가능할 것으로 예상했다. 김 연구원은 ""올해 실적 개선은 에너지저장장치(ESS)가 일등 공신이 될 전망이고, 지난해 대비 3배 가까이 매출이 증가할 것""이라며 ""자동차 전지는 중국 시장이 여전히 불투명하지만 기존 고객 및 신규 고객 확보를 통해 꾸준히 성장할 전망""이라고 내다봤다. 그는 ""현 시점에서는 절대적인 자기자본이익률(ROE) 보다는 ROE 개선 방향이 보다 의미 있는 시점""이라고 강조했다. 오정민 한경닷컴 기자"
이데일리,006400,/news/news_read.nhn?article_id=0004161381&office_id=018&mode=search&query=삼성SDI&page=8,2018-07-30 10:57,&quot;하반기 코발트&middot;리튬 가격 안정으로 수익성 개선&quot;-삼성SDI 컨콜,[이데일리 김겨레 기자] “올해 2분기부터 코발트 리튬 등 원소재 가격 하향 안정세. 하반기에도 이 추세 지속돼 수익성 측면에서 긍정적. 다만 구매 시점과 적용 시점 시차가 있음. 긍정적인 요소로 작용. 원소재 가격 변동성을 제품 판가에 연동시켜서 리스클를 최소화할 방침”-삼성SDI(006400) 컨콜
이데일리,006400,/news/news_read.nhn?article_id=0004093433&office_id=018&mode=search&query=삼성SDI&page=24,2018-05-03 07:49,"삼성SDI, 2분기 실적 모멘텀 본격화 기대-신한","[이데일리 오희나 기자] 신한금융투자는 3일 삼성SDI(006400)에 대해 2분기 실적 모멘텀이 본격화될 것이라며 투자의견 ‘매수’, 목표주가 27만원을 유지했다. 소현철 신한금융투자 연구원은 “1분기 매출액 1조9090억원으로 전년대비 46.3% 늘었고, 영업이익 720억원으로 흑자전환했다”며 “자동차 배터리 사업부 충당금을 제외할 경우 예상보다 좋은 실적을 시현했다”고 말했다. 이어 “2분기 대형 배터리 매출액 급증과 전자재료 사업부 성수기 수요로 영업이익은 전분기대비 62.1% 증가한 1170억원으로 예상한다”며 “3분기 갤럭시노트9를 포함한 신규 프리미엄 스마트폰향 폴리머 배터리 판매로 영업이익은 전분기대비 37.3% 증가한 1600억원을 기록할 것”으로 전망했다. 소 연구원은 “하반기 애플이 5.8인치, 6.5인치 OLED를 탑재한 아이폰X 후속모델을 출시할 예정이어서 올해 OLED 아이폰 판매량은 전년대비 233% 증가한 1억대로 예상한다”며 “3분기 삼성디스플레이 매출액 10조원, 영업이익은 1조4000억원으로 전분기대비 각각 34.8%, 337.5% 증가할 것”으로 예상했다. 올해 매출액은 8조9000억원, 영업이익 5020억원으로 전년대비 각각 40.6%, 326.9% 늘어날 것으로 추정했다. 소 연구원은 “1분기 삼성디스플레이 영업이익 급감으로 주가가 고점 대비 21.3% 하락했다”며 “3분기부터 삼성디스플레이 실적이 정상화될 전망이다. 한국 대형 IT종목 가운데 매출액 성장이 가장 높다”고 판단했다."
머니투데이,006400,/news/news_read.nhn?article_id=0004046547&office_id=008&mode=search&query=삼성SDI&page=24,2018-05-03 08:00,"삼성SDI, 2분기부터 영업이익 개선 본격화-신한","[머니투데이 배규민 기자] 신한금융투자는 3일 삼성SDI에 대해 2분기부터 실적 모멤텀이 본격화될 것으로 전망했다. 투자의견 '매수'와 목표주가 27만원을 유지했다. 소현철·박형우 신한금융투자 연구원은 2분기 대형 배터리 매출액 급증(7270억원, 전분기비 41.7%)과 전자재료 사업부 성수기 수요로 영업이익은 62.1% 증가한 1170억원으로 예상했다. 3분기에는 갤럭시노트9를 포함한 신규 프리미엄 스마트폰향 폴리머 배터리 판매로 영업이익은 전분기 보다 37.3% 증가한 1600억원을 달성할 것으로 전망했다. 소현우 연구원은 ""1분기 삼성디스플레이 영업이익 급감으로 주가가 고점 대비 21.3% 하락했다""며 ""3분기부터 삼성디스플레이 실적이 정상화될 전망""이라고 밝혔다. 그는 ""한국 대형 IT종목 가운데 매출액 성장이 가장 높다""며 ""성장주에 투자""를 권유했다. 올해 예상 매출액은 8조9000억원(전년비 40.6%), 영업이익은 5020억원(326.9%)으로 각각 추정했다. 배터리 사업부 예상 영업이익은 3490억원(381.8%)이다."
이데일리,006400,/news/news_read.nhn?article_id=0004161377&office_id=018&mode=search&query=삼성SDI&page=8,2018-07-30 10:54,&quot;LCD업황 악화로 편광필름 판가 인하 압박&quot;-삼성SDI 컨콜,[이데일리 김겨레 기자] “LCD 패널 가격 지속 하락세. 최근에는 일부 완만해지고 판가 인상 시작됐으나 편광필름에 대해서도 판가 인하 압박이 있는 것이 사실. 하지만 모바일용 고부가 편광필름 및 TV용  대면적 편광필름 판매 꾸준히 확대해왔고 수익성 개선해왔다. 하반기에도 LCD 업황 어려울 것으로 전망되나 중국 공장 강점 확대해서 고부가제품 확대하고 차별화된 신제품으로 수익 개선할 것 ”-삼성SDI(006400) 컨콜
머니투데이,006400,/news/news_read.nhn?article_id=0004046549&office_id=008&mode=search&query=삼성SDI&page=24,2018-05-03 08:01,"삼성SDI, 중대형 전지 성장 동력 긍정적-하이","[머니투데이 송선옥 기자] 하이투자증권은 3일 삼성SDI의 2018년1분기 실적이 시장 예상에 부합했다며 중대형 전지 성장 동력에 대한 긍정적인 시각을 유지한다고 밝혔다. 다만 삼성디스플레이 지분법 이익 조정에 따른 순이익 추정치 변동으로 목표주가를 26만원에서 25만원으로 하향조정했다. 정원석 하이투자증권 연구원은 “삼성SDI의 1분기 매출은 전년동기대비 46% 증가한 1조9000억원을 기록했으며 영업이익은 720억원으로 흑자전환에 성공했다”며 “2분기에도 중대형 전지 부문의 견조한 매출 성장과 계절적 성수기 진입에 따른 전자재료 부문 정상화가 실적 개선의 견인차 역할을 할 것”이라고 내다봤다. 2분기 매출과 영업이익은 각각 52%, 2073% 증가한 2조2000억원, 1190억원으로 추정했다. 정 연구원은 “중대형 전지 부문 실적은 지난해 1분기를 바닥으로 꾸준한 개선세를 나타내고 있으며 2018년 중대형 전지 적자 규모도 전년대비 1080억원 축소된 1680억원을 기록할 것”이라며 “향후 전기차 시장이 각 국의 정부 규제와 완성차 업체들의 공격적인 목표 달성 계획을 바탕으로 가파르게 성장하면 2025년에는 전체 자동차 시장의 약 20% 수준을 차지할 것”이라고 말했다. 이어 “따라서 삼성SDI의 중대형 전지 매출도 증가세를 지속, 중장기적인 성장 동력을 확보했다는 점에서 긍정적인 시각을 유지한다”고 덧붙였다."
데일리안,006400,/news/news_read.nhn?article_id=0002272768&office_id=119&mode=search&query=삼성SDI&page=8,2018-07-30 10:49,[컨콜]삼성SDI &quot;하반기 중대형 전지 수익성 지속 개선&quot;,"삼성SDI가 올 하반기에도 중대형 전지 수익성이 지속적으로 개선될 것으로 전망했다. 권영노 삼성SDI 경영지원실 부사장은 30일 오전 진행된 2분기 실적 컨퍼런스콜에서 ""에너지저장장치(ESS) 수익성 개선과 자동차 전지 물량 증가로 하반기 중대형 전지의 수익성 개선은 지속될 것""이라고 밝혔다. 다만 자동차 전지의 손익분기점(BEP) 달성 시점에는 신중한 입장을 보였다. 권 부사장은 ""원소재 가격이 반영되지 않은 초기 프로젝트 계약의 불합리성으로 BEP 조기 달성은 어렵다""면서 신규 프로젝트들이 본격 도래하는 만큼 자동차 전지도 수익성 개선에 노력할 것""이라고 말했다."
파이낸셜뉴스,006400,/news/news_read.nhn?article_id=0004014005&office_id=014&mode=search&query=삼성SDI&page=24,2018-05-03 08:14,"삼성SDI, 기대치에 부합한 올해 1&middot;4분기 실적-신영증권","신영증권은 3일 삼성SDI에 대해 올해 1·4분기 실적은 시장 기대치에 부합했다며 목표가 25만원, 투자의견 매수를 유지했다. 삼성SDI의 올해 1·4분기 실적은 매출액 1조9000억원, 영업이익 720억원을 기록했다. 이원식 신영증권 연구원은 ""세전이익은 지분법이익 약 500억원과 삼성물산 관련 매도가능증권 평가이익 약 700억원이 반영되며 1975억원을 나타냈다""고 말했다. 이 연구원은 삼성SDI가 올해 2·4분기에 매출액 2조2000억원, 영업이익 1143억원을 기록할 거로 내다봤다. 그는 ""외형 성장과 수익성 개선이 동반될 것""이라며 ""1·4분기 실적을 통해 강화된 경쟁력을 입증했고, 2·4분기에는 안정적인 이익 창출 능력을 바탕으로 강화된 경쟁력이 한층 더 부각될 것""이라고 설명했다."
