source,symbol,link,date,title,content
뉴스1,006400,/news/news_read.nhn?article_id=0003164840&office_id=421&mode=search&query=삼성SDI&page=48,2018-01-23 16:03,"삼성SDI, 3년만에 흑자&hellip;작년 영업익 1169억원(상보)","© News1 2017년 4Q 매출액 '역대 2번째' 1조8545억원 (서울=뉴스1) 주성호 기자 = 삼성SDI가 지난해 4분기에만 1186억원의 영업이익을 기록하며 3분기까지 누적된 적자를 한번에 털어내고 3년만에 흑자 경영에 성공했다. 삼성SDI는 연결기준으로 2017년 4분기 영업이익이 1186억원으로 전년 동기 대비 흑자전환했다고 23일 밝혔다. 같은 기간 매출액은 1조8545억원으로 전년 동기 대비 42.34% 증가했고 당기순이익은 2400억원으로 3016.8% 늘었다. 분기 매출액 1조8545억원은 2015년 3분기에 기록한 1조9977억원 이후 역대 2번째 최대 실적이다. 특히 2015년 3분기에는 케미칼 부문이 포함된 상황이라, 2016년 롯데그룹에 케미칼 사업부를 매각한 이후 기록한 역대 최대 분기 실적인 셈이다. 회사 측은 ""전지, 전자재료 판매 증가에 따른 매출과 손익 개선이 이뤄졌다""면서 ""당기순이익의 경우 삼성디스플레이의 사업 호조로 인한 지분법 이익 증가의 영향""이라고 설명했다. 2017년 연간으로는 매출액 6조3216억원으로 전년 대비 21.6% 증가했으며 영업이익은 1169억원을 기록해 2014년 이후 3년만에 흑자로 전환했다. 사업 부문별로 전지사업 부문은 중대형 전지의 유럽 공급 확대 등에 힘입어 올 4분기에 매출액 1조3191억원을 기록했다. 전년 동기 대비 57.6% 증가한 수치다. 아울러 상업용·전력용 ESS 판매 증가도 힘을 보탰다. 소형전지 부문은 원통형 전지의 정원공구 시장 확대와 폴리머 전지의 신규 스마트폰 진입으로 매출 증가세가 이어졌다. 전자재료 사업부문은 태양광 Paste의 계절적 영향으로 매출액 5334억원으로 전년 동기 대비 14.8% 증가했으나 전분기 대비 0.9% 감소했다. 다만 반도체와 유기발광다이오드(OLED) 소재 중심으로 수익성을 유지했다고 회사 측은 설명했다. 삼성SDI는 올 1분기에도 각 사업부문에서 고른 성장이 이뤄질 것으로 내다봤다. 전지사업 부문의 자동차전지는 유럽 고객의 플러그인하이브리드카(PHEV) 모델용 공급이 확대될 것으로 전망된다. ESS는 국내 상업용 시장 호조로 매출 증가가 예상되며 소형전지는 삼성전자 갤럭시S9 등 주요 스마트폰 고객사의 신제품 출시 등이 기대된다. 삼성SDI는 ""전자재료사업 부문은 지난해 4분기에 이어 올 1분기에도 IT 시장의 계절적 비수기가 이어져 매출 감소가 예상되나, 편광필름의 중국 고객 확대와 반도체 소재의 신제품 진입을 통해 수익성을 유지해나갈 것""이라고 밝혔다."
전자신문,006400,/news/news_read.nhn?article_id=0002690958&office_id=030&mode=search&query=삼성SDI&page=36,2018-03-14 10:56,"[ET투자뉴스]삼성SDI, &quot;폭스바겐의 &lsquo;Roa&hellip;&quot; 매수-하나금융투자","하나금융투자에서 14일 삼성SDI(006400)에 대해 ""폭스바겐의 ‘Road map E’""라며 투자의견을 '매수'로 제시하였다. 아울러 12개월 목표주가를 250,000원으로 내놓았다. 하나금융투자 김현수 애널리스트가 동종목에 대하여 이번에 제시한 '매수'의견은 하나금융투자의 직전 매매의견을 그대로 유지하는 것이고 전년도말의 매매의견을 기준으로  볼때도 역시 '매수'의견이 계속 유지되고 있는 상태이다. 그리고 최근 분기내 발표된 전체 증권사 리포트의 컨센서스와 비교를 해볼 경우에 오늘 발표된 투자의견은 대체적으로 평균치에 해당하는 수준으로, 이번 의견은 동종목에 대한 전체적인 흐름에서 크게 벗어나지 않은 것으로 분석되고 있다. 한편 12개월 목표주가로 제시한 250,000원은 직전에 발표된 목표가와 대비해서 큰 변화는 없고, 목표주가의 추이를 살펴보면 최근 장기간 목표가가 같은 수준에 머물고 있는 모습이다. 또한 전일 종가 기준으로 볼때 동종목의 현주가는 이번에 제시된 목표가 대비 23.8%의 추가상승여력이 있다는 해석이 제시되고 있다."
이데일리,006400,/news/news_read.nhn?article_id=0004017598&office_id=018&mode=search&query=삼성SDI&page=47,2018-01-23 17:00,3년 만에 흑자낸 삼성SDI &quot;올핸 더 좋은 성과 낼 것&quot;(종합),"- 작년 영업익 1169억원…4분기 흑자폭 확대 - 작년 4분기 전지사업 매출액 '분기 최대' - 권영노 CFO ""올해, 전년 1조원 이상 투자"" [이데일리 경계영 이재운 기자] 삼성SDI 영업이익이 3년 만에 흑자로 돌아섰다. 주력인 배터리 분야에서 전기차(EV), 스마트폰 등 소·중대형 전지 모두 고르게 성장한 덕분이었다. 삼성SDI(006400)는 연결 기준 지난해 연간 영업이익이 1169억원으로 2014년 이후 3년 만에 흑자 전환했다고 23일 공시했다. 매출액은 전년 대비 21.6% 증가한 6조3216억원으로 잠정 집계됐다. 6분기 만에 흑자를 낸 지난해 3분기보다 지난해 4분기 흑자 폭은 더욱 커졌다. 삼성SDI에 따르면 지난해 4분기 영업이익은 1186억원으로 잠정 집계됐다. 이는 지난해 4분기에 비해 흑자로 전환하고, 전 분기와 견줘 97.0% 급증한 수준이다. 매출액도 전년비 42.3% 늘어난 1조8545억원을 기록했다. 특히 전지사업부문의 매출액만 1조3191억원으로 분기 기준 사상 최대치를 갈아치웠다. 삼성SDI는 “중대형 전지는 자동차 전지의 유럽 공급이 확대되고 상업·전력용 ESS(에너지저장장치) 판매가 늘었다”며 “소형 전지도 원통형 전지의 정원공구(Gardening Tool) 시장 확대와 폴리머전지의 신규 스마트폰 진입으로 매출 증가세가 유지됐다”고 말했다. 특히 국내에서 올해 안에 ESS를 설치해야 보조금을 최대치로 받을 수 있는 유도 정책이 이어지고, 호주를 비롯한 선진 시장에서도 ESS가 연간 50% 이상 성장을 지속해 향후 전망이 밝다고 강조했다. 최근 불거지는 코발트 등 원자재 가격 상승에 대해 손미카엘 삼성SDI 전략마케팅실 전무는 “신규 수주 시 원가 변동을 판가에 반영하고 있고, 이를 지속하다보니 고객사들도 관련 필요성을 인지하고 긴밀하게 협의하고 있다”며 “이런 어려움은 동종 업계의 다른 업체에서도 마찬가지로, 경쟁력을 차별화할 수 있는 좋은 기회”라고 봤다. 전자재료사업부문의 경우 매출액이 5334억원으로 전 분기보다 0.9% 감소했지만 태양광 페이스트(Paste) 등 계절적 영향이라고 삼성SDI는 설명했다. 반도체와 OLED(유기발광다이오드) 소재 중심으로 수익성이 유지됐다고도 덧붙였다. 삼성SDI는 이같은 성장세가 올해 1분기에도 이어질 것이라고 예상했다. 전지사업부문에서 자동차 전지의 유럽 고객에 대한 전기차(EV) 공급이 확대되고 국내 상업용 시장이 호조를 보이면서 ESS 매출액이 늘 수 있다는 판단에서다. 소형 전지 역시 주요 스마트폰 고객의 신제품 출시, 전동공구 시장의 리튬이온배터리(LiB) 채용 확대 등에 힘입어 매출액이 더 증대될 것이라고 삼성SDI는 봤다. 아울러 삼성SDI는 전자재료사업부문의 경우 IT 시장의 계절적 비수기가 이어지겠지만 편광필름의 중국 고객 확대와 반도체 소재의 신제품 진입을 통해 수익성을 유지할 계획이다. 김경훈 전자재료 전략마케팅팀 전무는 “편광필름의 경우 TV 시장의 화면 대형화가 긍정적으로 작용할 것”이라고 예상했다. 아울러 삼성전자에 공급하는 스핀온하드마스크(SOH) 소재 공급와 관련해선 “여전히 독점적으로 진행하고 있으며 품질을 더 높인 제품을 납품하고 있다”고 설명했다. 새로 최고재무책임자(CFO)를 맡아 이날 처음 실적발표 컨퍼런스콜에 참여한 권영노 삼성SDI 경영지원실장(부사장)은 “지난해까지 어려웠던 상황을 극복하고 사업 정상화 기반을 마련한 여세를 몰아 올해 더 좋은 성과를 내겠다”고 자신감을 나타냈다. 그는 이어 “설비투자(CAPEX)는 지난해 1조원 실시한 데 이어 올해도 시장 확대로 생산능력(CAPA) 확충이 필요한 만큼 전년도 이상의 투자 재원을 철저히 준비하겠다”고 덧붙였다. 한편, 이날 삼성SDI는 보통주와 우선주에 주당 각각 1000원, 1050원의 현금 배당을 결정했다고 공시했다. 시가배당율은 각각 0.49%, 1.16%로 배당금 총액은 669억원이다. 단위=억원, 자료=삼성SDI"
이데일리,006400,/news/news_read.nhn?article_id=0004055781&office_id=018&mode=search&query=삼성SDI&page=37,2018-03-14 08:40,"삼성SDI, 고용량 ESS전용 배터리로 글로벌시장 공략","獨 ESS 전문 전시회 '에너지스토리지유럽2018' 참가에너지 밀도 대폭 향상 ESS고용량 배터리셀 첫 공개 삼성SDI가 지난 13~15일(현지시간) 독일 뒤셀도르프에서 열린 ‘에너지스토리지유럽 2018’에서 마련한 부스에서 관련 업체 관계자들이 제품을 살펴보고 있다. [삼성SDI 제공] [이데일리 양희동 기자] 삼성SDI(006400)가 에너지 밀도가 대폭 향상된 111Ah(암페어아워·배터리 용량 표시 단위) ESS(에너지저장장치) 전용 고용량 배터리 셀과 다양한 ESS 신제품을 선보이며 시장 공략에 나섰다. 삼성SDI는 지난 13일부터 15일(현지시간)까지 사흘간 독일 뒤셀도르프에서 열린 ‘에너지스토리지유럽 2018’ 전시회에 참가해 ESS 전용 셀을 비롯해 고용량 ESS, 고출력 ESS, 가정용 ESS 등을 선보였다고 14일 밝혔다. 에너지스토리지유럽은 ESS 및 신재생에너지 전문 전시회로 올해 스위스 ABB, 독일 지멘스(SIEMENS), 유나이코스(Younicos) 등 글로벌 ESS 업체와 55개국·160여 개 전후방 ESS 관련 회사들이 참가했다. 삼성SDI가 이번 전시에서 선보인 111Ah ESS 전용 배터리 셀은 대폭 늘어난 용량이 특징이다. 이 제품은 소재 혁신을 통해 배터리 크기는 유지하고 용량만 늘려 에너지 밀도가 기존 배터리 셀 대비 대폭 향상됐다. 또 설계 변경 없이도 쉽게 제품을 업그레이드 할 수 있는 장점이 있다. 삼성SDI는 이번 전시회에서 111Ah 전용셀을 적용해 에너지 밀도를 향상한 고용량 ESS 신제품 ‘E3’를 처음 공개했다. 이 제품은 보다 적은 수의 셀로도 같은 에너지를 낼 수 있어 ESS 시설 규모를 줄일 수 있다. 이는 설치비와 관리비 절감 효과로 이어져 시장에서 각광받을 것으로 삼성SDI는 기대하고 있다. 삼성SDI는 변전소에서 발전기의 전력을 일정 값으로 유지해 전력 품질을 안정적으로 유지하는 고출력 ESS와 태양광 연계로 많이 사용되는 가정용 ESS 제품도 전시했다. 또 주요 부품인 PCS(전력의 직류와 교류를 서로 전환시키는 장치) 수량을 줄여 설치 공간과 경제성을 개선한 고전압 ESS 기술, 국제 표준 규격의 컨테이너에 최적화된 솔루션도 공개했다. 이를 통해 고객들의 다양한 요구에 빠르게 대응할 수 있다는 설명이다. 박세웅 삼성SDI 전략마케팅실 상무는 “ESS 전용셀과 이를 적용한 제품 등 차별화된 경쟁력을 바탕으로 ESS 시장 공략을 강화해 나가겠다”고 강조했다. 한편 시장조사기관인 B3가 올해 발표한 전 세계 ESS시장 전망에 따르면 삼성SDI는 지난해 시장 점유율 38%로 1위를 차지했다. 또 SNE리서치는 글로벌 ESS 시장 규모가 올해 6.9GWh에서 2025년 90.4GWh로 연평균 45% 가량 급성장 할 것으로 전망했다. 삼성SDI의 ESS 배터리 셀 제품들."
머니투데이,006400,/news/news_read.nhn?article_id=0004022855&office_id=008&mode=search&query=삼성SDI&page=36,2018-03-14 11:08,삼성SDI ESS 전용 111Ah 배터리 첫 공개,"[머니투데이 한민선 기자] [독일 ESS 전문 전시회 '에너지스토리지유럽2018' 참가해 ESS 신제품 선보여 ] 삼성SDI가 '에너지스토리지유럽 2018' 에서 전시한 ESS 전용 111Ah 배터리 셀을 비롯한 다양한 ESS 배터리 셀 제품 모습./사진제공=삼성SDI 삼성SDI는 13일부터 3일간 독일 뒤셀도르프에서 열린 에너지 저장 장치(ESS) 전문 전시회인 '에너지스토리지유럽 2018'에 참가한다. 회사는 ESS 전용 셀을 비롯해 고용량과 고출력, 가정용 제품을 선보였다고 14일 밝혔다. 이번 전시에 선보인 111Ah(암페어아워) ESS 전용 배터리 셀(Cell)은 대용량으로 눈길을 끌었다. 기존 주력 배터리 용량인 94Ah 보다 용량을 10% 이상 늘렸지만 배터리 크기는 유지해 에너지 밀도가 기존 배터리 셀보다 높은 게 특징이다. 대용량이지만 전작과 크기가 같도록 설계 변경 없이 용량을 늘렸다. 삼성SDI는 111Ah 전용셀을 적용해 에너지 밀도를 향상한 고용량 ESS 신제품 'E3'를 처음 공개했다. 변전소에서 발전기의 전력을 일정 값으로 유지해 전력 품질을 안정적으로 유지하는 고출력 ESS와 태양광 연계로 많이 사용되는 가정용 ESS 제품도 전시했다. 주요 부품인 PCS(전력의 직류와 교류를 서로 전환하는 장치)로 ESS 부품수량을 줄여 설치 공간과 경제성을 개선한 고전압 ESS 기술을 공개했다. 삼성SDI 전략마케팅실 박세웅 상무는 ""ESS 전용셀과 이를 적용한 제품 등 차별화된 경쟁력을 바탕으로 시장 공략을 강화해 나가겠다""고 밝혔다. '에너지스토리지유럽'은 ESS 및 신재생에너지 전문 전시회로 올해 스위스 ABB, 독일 지멘스와 유나이코스 등 글로벌 ESS 업체들을 비롯한 55개국 160여개의 전후방 ESS 관련 회사들이 참가했다."
아시아경제,006400,/news/news_read.nhn?article_id=0004164194&office_id=277&mode=search&query=삼성SDI&page=47,2018-01-23 17:00,[삼성SDI 컨콜] &quot;갤럭시S9에 OLED 소재 공급 준비중&quot;,"[아시아경제 원다라 기자] 삼성SDI는 23일 2017년 4분기 실적 발표에 이은 컨퍼런스콜에서 ""M9에 유기발광다이오드(OLED) 소재 공급을 위해 노력하고 있다""며 ""9월쯤 최종 확정될 것""이라고 말했다. M9은 M8에 이은 OLED 디스플레이 플랫폼이다. 삼성SDI는 M8에 소재를 공급하지 못하면서 갤럭시S8 디스플레이 소재 공급계약에 실패했다."
부산일보,006400,/news/news_read.nhn?article_id=0000787648&office_id=082&mode=search&query=삼성SDI&page=37,2018-03-13 15:50,"삼성 SDI,올 상반기 신입 공채 지원서 접수","삼성SDI는 올 상반기 3급(대졸) 신입사원 지원서 접수를 3월 20일 오후 5시까지 진행한다고 13일 밝혔다. 회사는 연구개발직, 기술직, 영업마케팅직, 경영지원직군 등 4개 직군에서 채용할 예정이다. 삼성SDI는 올해 상반기 대졸 신입사원 채용 인원을 세자릿수 수준으로 늘렸다. 지난해에는 두자릿수로 채용했다. 이를 통해 기계, 전기전자, 화학·화공, 재료·금속, 섬유·고분자, 산업공학, 수학, 물리 등 각 직군별 관련 전공분야의 인재를 선발할 계획이다. 지원자격은 2018년 8월 이전 졸업 또는 졸업 예정인 자로서 직군에 따라 영어회화자격 OPIc IL 또는 IM 등급 이상을 보유하면 된다. 직무적합성평가 합격자에 한해 4월 15일 직무적성검사를 실시하며 4~5월 중 면접전형이 진행된다. 삼성SDI 관계자는 ""2차전지 및 전자재료 사업 분야의 성장세가 이어지면서 각 직군별 인재 확보가 필요한 상황""이라며 ""마감일은 접속 인원이 급증하니 충분히 여유를 갖고 지원서를 등록하는 게 안전하다""고 말했다. 한편, 삼성SDI는 지난 1월 입사한 2017년 하반기 대졸 신입사원의 입문교육을 마치고 지난 9일 수료식을 가졌다. 하반기 대졸 신입 공개채용을 통해 삼성SDI에 입사한 신입사원들은 6주간의 교육과정을 거쳤다. "
뉴시스,006400,/news/news_read.nhn?article_id=0008408432&office_id=003&mode=search&query=삼성SDI&page=49,2018-01-23 15:46,"[1보]삼성SDI, 보통주 1주당 1000원&middot;우선주 1주당 1050원 배당","【서울=뉴시스】최현 기자 = 삼성SDI는 보통주와 우선주에 각각 주당 1000원, 1050원의 현금 배당을 결정했다고 23일 공시했다. 시가배당율은 보통주 기준 0.49%, 우선주 기준 1.16%다. 배당금 총액은 669억원이다."
부산일보,006400,/news/news_read.nhn?article_id=0000787968&office_id=082&mode=search&query=삼성SDI&page=36,2018-03-14 14:24,"삼성SDI, 에너지스토리지 유럽 2018서 ESS 대거 출시","삼성SDI는 독일 뒤셀도르프에서 13일(현지시간) 개막한 '에너지스토리지 유럽 2018' 전시회에 참가해 고용량, 고출력 에너지저장장치(ESS) 신제품을 대거 선보였다고 14일 밝혔다. 이날부터 사흘간 열리는 이번 전시회에는 스위스 ABB, 독일 지멘스· 유나이코스 등 글로벌 ESS 업체들을 비롯해 전 세계 55개 국, 160여 개 신재생에너지 전문업체들이 참가했다. 삼성SDI는 이번 전시회에서 기존 제품과 크기는 같지만, 용량을 대폭 늘린 111Ah(엠페어 아워) ESS 전용 배터리 셀을 공개했다. 이 제품은 특히 설계 변경 없이도 쉽게 업그레이드할 수 있는 게 특징이다. 이와 함께 111Ah 전용 셀을 적용, 에너지 밀도를 높여 시설 규모를 줄이는 것은 물론 설치비와 관리비 절감 효과도 거둘 수 있는 고용량 ESS 신제품 'E3'도 선보였다. 또 변전소에서 발전기의 전력을 일정값으로 유지해 전력 품질을 안정적으로 유지하는 고출력 ESS와 태양광 연계로 많이 사용되는 가정용 ESS 제품도 전시했다. 이 밖에 설치 공간과 경제성을 개선한 고전압 ESS 기술, 국제 표준 규격의 컨테이너에 최적화된 솔루션 등도 공개했다. 시장조사기관 B3가 2018년 발표한 전 세계 ESS시장 전망에 따르면 삼성SDI는 2017년 시장점유율 38%로 1위를 차지했다. 또 SNE리서치는 글로벌 ESS 시장 규모가 올해 6.9GWh에서 2025년 90.4GWh로 연평균 45%가량 급성장할 것으로 전망했다."
데일리안,006400,/news/news_read.nhn?article_id=0002235613&office_id=119&mode=search&query=삼성SDI&page=47,2018-01-23 16:53,[컨콜]삼성SDI &quot;폴더블 디스플레이용 필름 개발 중&quot;,"삼성SDI가 폴더블 디스플레이용 필름을 개발하고 있다고 밝혔다. 올해 편광필름 매출 목표 달성에도 자신감을 내비쳤다. 삼성SDI는 23일 오후 진행된 2017년도 4분기 실적 컨퍼런스콜에서 ""3분기나 4분기에 플렉서블 디스플레이 하부에 들어가는 필름 양산을 개시할 것""이라며 ""폴더블 디스플레이 특수 필름도 열심히 개발하고 있다""고 밝혔다. 이어 연초부터 편광필름 생산라인이 풀 가동되고 있다면서 올해 매출 목표 달성에 자신감을 내비쳤다. 삼성SDI는 ""편광필름의 경우, 액정표시장치(LCD) 패널 가격 하락으로 인한 편광 필름 등 부품 판가 하락으로 수익성 확보가 쉽지 않다""면서도 ""하지만 그동안 가동률을 상승시켜 비수기인 연초부터 거의 풀가동 상태로 올해도 계획한 매출 목표를 달성할 것으로 보고 있다""고 말했다."
데일리안,006400,/news/news_read.nhn?article_id=0002235611&office_id=119&mode=search&query=삼성SDI&page=47,2018-01-23 16:45,[컨콜]삼성SDI &quot;올해 1조원 이상 투자 필요&quot;,"삼성SDI가 올해 1조원 이상 투자할 계획이라고 밝혔다. 또 원자재 가격 상승 부담에도 수익성 개선이 가능할 것으로 내다봤다. 삼성SDI는 23일 오후 진행된 2017년도 4분기 실적 컨퍼런스 콜에서 ""지난해는 사업 정상화 기반을 마련한 한 해였다""며 ""지난해 1조원을 투자했는데 올해도 생산량을 늘리기 위해 전년도 이상의 투자 재원이 필요하다""고 밝혔다. 또 원자재 가격 상승으로 원가 부담이 있겠지만 올해는 전년대비 수익성 개선이 가능할 것으로 내다봤다. 삼성SDI는 ""원자재 가격 상승은 업계 전체의 어려움으로 이를 경쟁력 차별화의 기회로 삼을 것""이라며 ""올해는 큰 폭의 매출 증가와 함께 고에너지밀도 신제품을 통한 제품믹스 개선과 제고 효율 등으로 수익성 개선 효과가 나타날 것""이라고 말했다."
파이낸셜뉴스,006400,/news/news_read.nhn?article_id=0003950048&office_id=014&mode=search&query=삼성SDI&page=49,2018-01-23 15:47,"삼성SDI, 2017년 4&middot;4분기 영업이익 1185억9800만원","삼성SDI가 지난해 4·4분기 매출 1조8544억원, 영업이익 1186억원을 달성했다고 23일 밝혔다. 전년 연도인 2016년 같은 기간에 비해 매출은 42.34% 증가했으며 영업이익은 흑자전환했다."
매일경제,006400,/news/news_read.nhn?article_id=0004088168&office_id=009&mode=search&query=삼성SDI&page=47,2018-01-23 16:40,"삼성SDI, 3년만에 연간 영업이익 남겨&hellip;&quot;1분기도 성장세 유지할 것&quot;","지난해 4분기 삼성SDI의 실적. [자료 제공 = 삼성SDI] 삼성SDI가 전지 부문의 성장에 힘입어 3년만에 연간 영업이익 흑자를 기록했다. 삼성SDI는 지난해 연결기준 매출 6조3216억원, 영업이익 1169억원의 잠정실적을 기록했다고 23일 공시했다. 1년 전과 비교해 매출은 21.55% 늘었고, 영업이익은 흑자로 전환했다. 삼성SDI가 연간 기준으로 영업흑자를 기록한 건 지난 2014년 이후 3년만이다. 지난해 4분기 기준으로는 매출은 전년 동기 대비 43.2% 증가한 1조8545억원, 영업이익은 흑자로 전환한 1186억원의 성적표를 받았다. 삼성SDI는 지난해 4분기 유럽 자동차업체에 공급하는 전기차용 전지와 상업용·전력용 에너지저장장치(ESS)의 판매 증가로 분기 기준 중대형전지 사상 최대 매출 기록을 갈아치웠다. 소형전지 부문도 원통형전지가 들어가는 정원공구 시장이 확대되고, 폴리머전지가 장착되는 신규 스마트폰 출시로 매출이 늘었다. 지난해 4분기 삼성SDI는 1조3191억원어치의 배터리를 팔았다. 전자재료사업부문은 반도체와 유기발광다이오드(OLED)를 만드는 소재 중심으로 수익성을 유지했지만, 태양광 패이스트는 계절 요인으로 매출이 줄었다. 삼성SDI는 올해 1분기 각 사업부문이 고른 성장세를 보일 것으로 전망했다. 전지사업부문에서 자동차용 중형전지는 유럽 자동차업체의 플러그인하이브리드(PHEV) 모델로의, ESS용 대형전지는 국내 상업용 시장으로의 공급이 늘어날 것으로 봤다. 소형전지 부문도 주요 스마트폰 제조업체의 신제품 출시와 전동공구 시장의 리튬이온배터리 채용 확대로 성장세를 유지하 것이라고 회사 측은 내다봤다. 전자재료사업부문은 지난해 4분기에 이어 올해 1분기에도 정보기술(IT) 시장의 계절정 비수기가 이어져 매출 감소가 불가피하지만, 편광필름의 중국 구매처를 더 확보하고 반도체 소재의 신제품 진입을 통해 수익성을 유지할 수 있을 것이라고 삼성SDI는 말했다. [디지털뉴스국 한경우 기자] r_start // r_end //"
파이낸셜뉴스,006400,/news/news_read.nhn?article_id=0003981632&office_id=014&mode=search&query=삼성SDI&page=37,2018-03-13 16:42,"삼성SDI, 올해 상반기 신입 공채 시작","삼성SDI 신입사원들이 입문교육 도중 기념촬영을 하고 있다.    삼성SDI는 올해 상반기 3급 신입사원 지원서 접수를 오는 20일 오후 5시까지 진행한다고 13일 밝혔다. 연구개발직, 기술직, 영업마케팅직, 경영지원직군 등 4개 직군에서 신입사원 채용이 이뤄진다. 지원자격은 올해 8월 이전 졸업 또는 졸업 예정인 자로서 직군에 따라 영어회화자격 OPIc IL 또는 IM 등급 이상을 보유하면 된다. 직무적합성평가 합격자에 한해 다음달 15일 직무적성검사(GSAT)를 실시한다. 4~5월 중 면접전형이 진행될 예정이다. 삼성SDI 관계자는 ""이차전지 및 전자재료 사업 분야의 성장세가 이어지면서 각 직군별 인재 확보가 필요한 상황""이라며, ""마감일은 접속 인원이 급증하니 충분히 여유를 갖고 지원서를 등록하는 게 안전하다""고 밝혔다."
