source,symbol,link,date,title,content
아시아경제,006400,/news/news_read.nhn?article_id=0004199761&office_id=277&mode=search&query=삼성SDI&page=34,2018-03-19 14:46,"[특징주]삼성SDI, 외국인&middot;기관 매도에 4%&darr;","[아시아경제 박나영 기자]삼성SDI가 외국인 매도에 급락세다. 19일 오후 2시37분 현재 삼성SDI는 전 거래일 대비 3.94%(8500원) 내린 20만7000원에 거래 중이다. 4거래일 만의 하락세다. 오후 2시19분 기준 외국인과 기관이 각각 84억원, 28억원을 순매도한 것으로 잠정집계됐다. 최근 급등에 따른 차익실현 매물로 풀이된다. 이달 초까지 17만원대에 머물던 삼성SDI는 '깜짝' 실적 등으로 지난 8일부터 가파르게 상승했다.  전 거래일에는 두달여 만에 21만원대를 회복했다."
한겨레,006400,/news/news_read.nhn?article_id=0002401765&office_id=028&mode=search&query=삼성SDI&page=39,2018-03-11 14:02,"포스코&middot;삼성SDI, 칠레 리튬 프로젝트 사업자로 선정","[한겨레] 세계 최대 리튬생산 국가 칠레에 합작법인 설립2021년부터 연간 3200톤 전기차용 양극재 생산 포스코와 삼성에스디아이(SDI)가 꾸린 컨소시엄이 세계 최대 리튬 생산 국가인 칠레의 생산진흥청(CORFO)이 주관한 리튬 프로젝트에서 최종 사업자로 지난 9일(현지 시각) 선정됐다. 이 프로젝트는 리튬을 원료로 현지에서 양극재를 생산하는 사업이다. 두 기업은 지난해 5월부터 칠레, 미국, 캐나다, 중국, 러시아, 벨기에, 한국 등 총 7개 국가 12개 기업이 참여한 입찰에서 두 차례 심사를 받고 최종 사업자로 선정됐다. 포스코-삼성에스디아이 컨소시엄은 칠레 북부 메히요네스시에 575억원을 투자해 양극재 생산 합작법인을 설립할 계획이다. 이 합작법인은 리튬을 칠레 수출최저가로 공급받아 2021년 하반기부터 연간 3200톤 규모의 전기차용 고용량 양극재를 생산하게 된다. 포스코는 “남미 시장으로까지 이차전지 소재 사업영역을 확대하게 되면서 글로벌 양극재 생산업체로 자리매김하게 됐다”고 밝혔다. 앞서 포스코는 지난 1월 중국 화유코발트사와 양극재 및 전구체 생산공장 합작 계약을 맺었다. 삼성에스디아이는 이번 칠레 진출로 장기간 안정적으로 양극재를 공급받아 배터리 원료 수급 경쟁력을 강화하게 됐다."
경향신문,006400,/news/news_read.nhn?article_id=0002856614&office_id=032&mode=search&query=삼성SDI&page=39,2018-03-11 16:08,"포스코&middot;삼성SDI, 칠레에 전기차 배터리 양극재 공장 세운다","SUB_TITLE_START ㆍ리튬프로젝트 최종 사업자 선정 SUB_TITLE_END 포스코와 삼성SDI가 세계 최대의 리튬 생산 국가인 칠레에 전기차용 양극재 공장을 설립하고 이차전지 소재 사업에 공동 진출한다. 전기차와 에너지저장장치(ESS), IT용 배터리에 대한 수요가 급증하는 상황에서 리튬이온배터리의 핵심 원료에 해당하는 양극재를 안정적으로 공급받을 수 있게 됐다. 포스코와 삼성SDI는 양사 컨소시엄이 지난 9일(현지시간) 칠레 생산진흥청(CORFO)이 주관하는 리튬프로젝트의 최종 사업자로 선정됐다고 11일 밝혔다. 이번 입찰에서는 7개국 12개 기업이 참여했으며 삼성SDI-포스코 컨소시엄을 비롯해 중국 푸린, 칠레 몰리멧 3개사가 리튬프로젝트 최종사업자로 선정됐다. 칠레 생산진흥청은 지난해 5월부터 자국의 리튬 후방산업 확대를 위해 칠레 현지에 리튬이온배터리의 핵심 소재인 양극재 사업에 투자하는 사업자에게 리튬을 장기간 공급할 계획임을 밝히고 입찰을 진행해왔다. 포스코-삼성SDI 컨소시엄은 575억원을 투자해 칠레 북부 메히요네스시에 양극재 생산 합작법인을 설립한다. 합작법인은 리튬을 원료로 2021년 하반기부터 연간 3200t 규모의 전기차용 고용량 양극재를 생산할 계획이다. 이번 합작사업으로 삼성SDI는 배터리의 핵심 소재인 양극재를 장기간 안정적으로 공급받게 됐고, 포스코도 양극재 생산을 국내와 중국뿐만 아니라 칠레에까지 확대함으로써 글로벌 양극재 생산업체로 자리매김하게 됐다. 리튬이온전지의 필수 소재인 양극재 세계 시장은 2016년 21만t에서 2020년 86만t으로 4배 이상 성장할 것으로 전망된다. 전기차 시장이 확대될 것으로 전망됨에 따라 전기차 배터리의 주요 원료인 리튬 가격이 최근 2년간 2배가량 급등하고 있어 안정적 확보가 중요해졌다."
연합뉴스,006400,/news/news_read.nhn?article_id=0009964149&office_id=001&mode=search&query=삼성SDI&page=34,2018-03-18 07:23,"떠오르는 배터리 산업&hellip;삼성SDI&middot;LG화학, 날갯짓 '시동'","전기차·ESS 시장 급팽창 힘입어 매출 확대될 듯 (서울=연합뉴스) 정성호 기자 = 지난해 중국 당국의 전기차 보조금 배제 조치 등으로 어려움을 겪었던 전기차 배터리 업체들이 올해 들어 본격적인 비상에 시동을 걸고 있다. 18일 업계에 따르면 독일 자동차업체 폴크스바겐은 최근 기자회견을 열고 전기차 양산을 위해 삼성SDI와 LG화학, 중국 CATL 등과 200억유로(약 26조원) 규모의 배터리 공급 계약을 체결했다고 밝혔다. 폴크스바겐그룹은 지난해 전세계적으로 1천74만대의 자동차를 팔며 2년 연속으로 글로벌 판매 1위에 오른 업체다. 폴크스바겐은 오는 2025년까지 연간 300만대의 전기차 판매를 달성한다는 목표다. 이는 현재 전기차 시장 1위인 테슬라의 판매량(지난해 10만2천807대)을 압도하는 것이다. 여기에 삼성SDI와 포스코가 꾸린 컨소시엄은 최근 칠레의 생산진흥청(CORFO)이 주관하는 리튬 프로젝트에 최종 사업자로 선정됐다. 칠레에서 리튬을 원료로 전지의 양극재를 생산할 사업자로 뽑힌 것이다. 중국이 리튬이온 전지의 주요 소재인 리튬 광물 확보에 나서면서 전 세계적 공급 부족이 우려되는 가운데 안정적인 원료 공급원을 확보한 것으로 업계는 풀이하고 있다. 이런 호재들에 힘입어 삼성SDI 주가는 이달 들어 25% 이상 상승했다. LG화학은 최근 박진수 부회장이 기자간담회를 열고 올해부터 2020년까지 3년간 연평균 매출 성장률 15%를 달성하겠다고 공언했다. 상당히 도전적인 목표인데, '말 잔치'로만 끝나지는 않을 것이라고 박 부회장은 강조했다. 그는 ""올해부터 2020년까지 늘어날 매출 10조원 가운데 반 정도가 전지 쪽""이라며 ""작년 말 기준으로 전기차 배터리 수주 잔고가 30개 회사로부터 42조원이고, 올해도 조금씩 늘고 있다""고 강조했다. 이런 수요 확대에 발맞춰 LG화학은 올해 1분기 폴란드에서 전기차 배터리 양산을 시작했고, 삼성SDI 역시 헝가리 공장 건설을 마치고 2분기부터 양산에 들어갈 예정이다. 이처럼 배터리 업체의 가파른 성장을 이끌 것으로 점쳐지는 양대 축은 전기차 시장과 ESS(에너지저장장치) 시장이다. 그동안 배터리의 성장을 이끈 원동력이 스마트폰 등 모바일 기기와 전동공구 등(소형 배터리)이었다면 이제 그 무게중심이 전기차(중형 배터리)와 ESS(대형 배터리)로 옮겨간다는 것이다. 전기차는 내연기관 자동차를 빠르게 대체할 친환경 교통수단으로 전세계에서 주목받고 있다. 중국의 경우 내연기관차 시장을 건너뛰고 전기차 시장으로 직행해 이 분야에서 글로벌 넘버 원이 되겠다며 국가적인 지원에 나서고 있다. 시장조사업체 SNE리서치에 따르면 전세계 전기차 판매량은 지난해 100만대 규모에서 2020년에는 4배에 가까운 390만대로 늘어날 전망이다. ESS 역시 태양광·풍력 발전 등 신재생에너지의 확대와 함께 급성장이 기대되고 있다. 태양광이나 풍력 등은 그 속성상 끊김 없는 발전이 어렵다 보니 발전한 전기를 저장해뒀다 필요할 때 쓰는 것이 중요하기 때문이다. 김지산 키움증권 연구원은 최근 'ESS-한국이 곧 세계다' 보고서에서 ""글로벌 리튬이온 전지 ESS 시장의 중심에는 한국이 있다""면서 ""공급 면에서는 LG화학과 삼성SDI의 점유율이 60%를 넘어섰고, 수요 면에서는 한국이 올해 2배 이상 성장하며 세계 시장의 30%를 차지할 전망""이라고 분석했다. 김 연구원은 이어 ""한국 시장의 급성장 배경은 2016년 하반기부터 집중된 정부의 신재생 및 ESS 보급 확대 정책 효과에 기인한다""며 ""ESS용 배터리는 기술적 기반이 전기차와 동일하지만 판가와 수익성이 월등하다는 점에서 매력적""이라고 지적했다."
SBS CNBC,006400,/news/news_read.nhn?article_id=0000147610&office_id=374&mode=search&query=삼성SDI&page=53,2017-12-22 12:13,"&ldquo;삼성SDI, 삼성물산 주식 매각해라&rdquo;&hellip;재벌개혁 속도 내는 김상조","■ 경제와이드 백브리핑 시시각각 삼성SDI가 남아있는 삼성물산 지분을 모두 팔아야 한다는 공정위의 이번 결정으로 이재용 부회장의 삼성전자 지배력이 균열하는 시발점이 될 수 있다는 의견이 제기됩니다. 당장은 아닐지 몰라도 보험업법이 개정되거나 금융 통합감독시스템이 도입되면 삼성생명에서 삼성전자로 이어지는 연결고리가 느슨해질 수 있다는 것이지요. 그렇게 되면 이 부회장은 자신이 최대주주인 삼성물산 주식으로 지금 같은 지배력을 유지하기 힘들 것이라는 전망도 나옵니다. 분명한 건,재벌 개혁의 칼 날을 뽑은 김상조 위원장의 움직임이 더 빨라지고 있습니다. 오늘 순서 마치겠습니다. 시청해주신 여러분 고맙습니다."
머니투데이,006400,/news/news_read.nhn?article_id=0004001137&office_id=008&mode=search&query=삼성SDI&page=44,2018-01-31 12:00,삼성SDI 사장이 삼성카드 사장으로 바로 못간다,"[머니투데이 김진형 기자] [그룹내 금융-비금융계열사간 방화벽 강화…신용공여·내부거래 한도 관리] 삼성, 한화, 현대차 등 그룹내 비금융계열사에서 근무하던 임원이 금융계열사로 이동하려면 숙려기간을 거쳐야 된다. 삼성SDI 사장이 삼성카드 사장으로 곧바로 옮겨갈 수 없다는 얘기다. 그룹내 금융계열사들이 비금융계열사에 줄 수 있는 신용공여한도가 줄어들고 내부거래도 제한을 받게 된다. 금융위원회가 31일 발표한 '금융그룹 통합감독방안'에는 이같은 내용의 기업집단내 금융-비금융간 방화벽 강화 방안이 포함돼 있다. 과거 대우그룹 유동성 위기로 무너진 대우증권, 신동아그룹 부실로 매각된 대한생명, 동양그룹 사태로 주인이 바뀐 동양증권 등 그룹 경영위기로 순식간에 부실금융회사로 전락한 과거 사례를 반복하지 않기 위해서다. 그룹내 비금융계열사로 인한 금융계열사의 동반부실을 막기 위한 구체적인 장치는 '금융그룹 통합감독법' 제정 과정에서 확정될 예정이지만 금융당국은 크게 두가지 방향에서 검토하고 있다. 하나는 동반부실위험을 측정해 그만큼 금융계열사들이 자본을 확충토록 하는 것이고 또하나는 금융-비금융계열사간 이해상충을 방지할 제도적 장치를 두는 것이다. 이해상충 방지 장치는 지배구조, 내부거래, 소유구조 측면에서 마련된다. 지배구조 측면에선 비금융계열사에서 금융계열사로의 임원 이동이 제한된다. 금융당국은 이 경우 일정기간 숙려기간을 거치도록 하는 방안을 검토하고 있다. 금융계열사와 비금융계열사의 임원 겸직도 제한되고 금융사의 CEO 후보 추천위원회·승계프로그램도 내실화될 수 있도록 할 방침이다. 금융회사의 임원 선임은 '금융지배구조법'에도 규정돼 있지만 여기에는 임원이 될 수 없는 결격 요건만 나열돼 있다. 금융지배구조법과 별개로 복합금융그룹에만 적용되는 규정이 새로 만들어지는 셈이다. 내부거래에 대한 통제도 강화된다. 금융계열사의 비금융계열사에 대한 총 익스포져(대출 등 신용공여액) 한도, 비금융계열사에 대한 매출·수익의존도 관리 등이 포함된다. 현재도 각 금융업법상 동일인에 대한 신용공여에 제한이 있지만 금융계열사 전체에도 한도를 두겠다는 의미다. 가령 삼성생명, 삼성증권, 삼성화재가 각각 금융업법상 삼성전자에 대해 익스포져 한도를 지키더라도 3개사의 지원총액이 통합감독법상 한도를 넘으면 축소하게 할 수 있게 된다. 금융계열사가 비금융계열사를 지원할 경우 이사회 심사도 강화키로 했다. 소유구조 측면에서는 비금융계열사에 대한 금융계열사의 추가 출자를 제한하고 동반부실위험이 클 경우엔 의결권 제한 등의 의무를 부과하는 방안이 검토되고 있다. 이세훈 금융그룹감독혁신단장은 ""그룹이 비금융계열사와 금융계열사를 동시에 갖고 있는 사례가 전세계적으로 흔하지 않아 벤치마크할 해외 사례가 많지 않다""며 ""입법 과정에서 논의를 거쳐 우리 실정에 맞는 도입과제를 선별해 제도화를 추진하겠다""고 밝혔다."
이데일리,006400,/news/news_read.nhn?article_id=0004024484&office_id=018&mode=search&query=삼성SDI&page=44,2018-02-01 10:27,"[특징주]삼성SDI, 외국계 매도에 사흘째&darr;","[이데일리 유재희 기자] 삼성SDI가 외국인 매도 여파로 하락세다. 1일 오전 10시 23분 현재 삼성SDI(006400)는 전일대비 5.07%, 1만원 내린 18만 7000원에 거래되고 있다. 지난달 30일 이후 사흘째 약세다. KB증권에 따르면 이날 CS증권, 메릴린치 등 외국계 창구를 통해 13만 2000주 가까운 매물이 나오고 있다. 전체 거래량은 62만 5000주 수준이다. 외국인은 전날에도 29만주 가까이 팔면서 주가 하락을 주도했다."
매일경제,006400,/news/news_read.nhn?article_id=0004093150&office_id=009&mode=search&query=삼성SDI&page=44,2018-01-31 17:38,&quot;中 친환경車 바람&hellip;LG화학&middot;삼성SDI 수혜&quot;,"왕하오 중신證 애널리스트 ""중국 친환경차가 연평균 40% 상승하는 동안 한국 배터리주 수혜가 예상된다."" 31일 삼성증권의 초빙으로 우리나라를 방문한 왕하오 중신증권 애널리스트는 올해 중국 자동차 시장을 이같이 전망했다. 왕 애널리스트는 지난해 홍콩 한 금융전문지가 선정한 자동차 섹터 관련 최우수 분석팀을 이끌고 있다. 전체 자동차 시장의 연평균 성장률이 3~7%에 머물러 있는 반면 친환경 자동차는 2020년까지 매년 30~40%씩 성장할 수 있다는 기대에서다. 중신증권에 따르면 올해부터 3년간 중국 친환경 자동차의 예상 판매량은 200만대로 2025년이 되면 500만대를 넘어설 것으로 전망된다. 10년 안에 중국 전체 자동차 시장 판매량 3500만대 중 15%가량은 친환경 자동차가 차지한다는 얘기다. 중국 정부가 최근 추진하는 내연기관 자동차 퇴출 노력은 친환경 자동차 확산의 동력이 될 전망이다. 왕 애널리스트는 중국 증권시장에 관심 있는 투자자에게 친환경 자동차에 들어가는 전지 부문을 주목해야 한다고 조언한다. 그는 ""과거 내연기관 자동차 원가에서 0.3~0.4% 비중을 차지했던 전지 원가가 최근 100배 이상 비중이 늘었다""며 ""판매량 증가와 함께 뚜렷한 매출 성장이 기대된다""고 전망했다. 왕 애널리스트는 이 같은 배경에서 중국 자동차 시장과 관련해 주목해야 할 한국 기업으로 LG화학과 삼성SDI를 꼽았다. 내연기관에 강점이 있는 현대자동차 등 국내 자동차 기업은 중국 로컬 기업의 경쟁 압력과 글로벌 럭셔리 브랜드의 인지도 대결에 밀려 고전할 것으로 전망했다. 중국 개별 종목에 관심 있는 투자자를 위해 왕 애널리스트는 중국 전기차 배터리 제조 업체 CALT를 눈여겨봐야 할 종목으로 꼽았다. [유준호 기자] r_start // r_end //"
부산일보,006400,/news/news_read.nhn?article_id=0000787041&office_id=082&mode=search&query=삼성SDI&page=39,2018-03-11 14:45,"포스코&middot;삼성SDI, 칠레서 리튬 프로젝트 최종사업자로 선정","포스코와 삼성SDI가 남미 이차전지 소재 사업에 공동 진출한다. 포스코와 삼성SDI가 함께 꾸린 컨소시엄이 지난 9일(현지시간) 칠레 생산진흥청(CORFO)이 주관하는 리튬프로젝트에 최종 사업자로 선정됐다. CORFO는 지난해 5월부터 자국 리튬 후방산업 확대를 위해 칠레 현지에 리튬이온배터리의 핵심 소재인 양극재 사업에 투자하는 투자자들에게 장기간 리튬을 공급한다면서 입찰을 진행했다. 포스코·삼성SDI 컨소시엄은 입찰에서 칠레, 미국, 캐나다, 중국, 러시아, 벨기에, 한국 등 모두 7개국의 12개 업체와의 경쟁 끝에 최종 사업자가 됐다. 칠레 북부 메히요네스시(市)에 양극재 생산 합작법인을 설립한다. 투자액은 575억원이다. 이로써 합작법인은 리튬을 원료로 2021년 하반기부터 연간 3200t 규모의 전기차용 고용량 양극재를 생산한다. 향후 시장 상황에 따라 칠레에 추가 생산설비를 건설하여 양극재 생산 규모를 확대할 계획이다. 칠레는 세계 최대 리튬 생산 국가다. 삼성SDI는 양극재를 장기간 안정적으로 공급받아 배터리 원료수급 경쟁력 강화를 꾀할 수 있게 됐고, 포스코도 양극재 생산을 국내, 중국뿐만 아니라 칠레 현지까지 확대함으로써 글로벌 양극재 생산업체로 자리매김하게 됐다. 리튬이온전지의 필수 소재인 양극재 세계 시장은 2016년 21만t에서 2020년 86만t으로 성장할 전망이다. 전기차, 에너지저장장치(ESS), 정보기술(IT)용 대용량 배터리 등에 대한 수요가 급증하고 있어서다."
서울경제,006400,/news/news_read.nhn?article_id=0003240936&office_id=011&mode=search&query=삼성SDI&page=39,2018-03-11 16:24,[이번주 추천주]'흑자 전환' 삼성SDI&middot;두산 등 주목을,두산(000150)
한국경제TV,006400,/news/news_read.nhn?article_id=0000596868&office_id=215&mode=search&query=삼성SDI&page=44,2018-01-31 11:00,"삼성SDI, 전일 대비 약 -3% 하락한 197,500원","[한국경제TV 라이온봇 기자] 삼성SDI는 1월 31일 11시 0분 전일 대비 약 -3% 하락한 197,500원에 거래되고 있다. 삼성SDI는 코스피 상장 기업으로 전기,전자 업종에 속해 있다. 시가총액은 14조623억원으로 코스피 상장기업 중 26위에 위치 해 있다. [종목 성향 진단] [그림 1] 종목 성향 진단 삼성SDI의 투자 스타일은 모호한 측면이 있으나 성장주라고 볼 수 있다. 주가 고평가 우려가 공존하지만 높은 성장성이 기대되는 기업이다. 주가 모멘텀은 평범한 수준이었다. 최근 1개월 수익률이 0%, 3개월 수익률은 3.54%, 6개월 수익률은 0.99%를 기록했다. 삼성SDI종목에 대한 투자자의 관심도는 굉장히 높은 편이다. [투자 점수 진단] [그림 2] 투자 점수 진단 삼성SDI는 성장성(매출증가율(YoY)) 측면에서 두각을 나타내고 있다. 최근 매출증가율(YoY)은 82점으로 6개의 핵심 팩터 중 가장 높은 점수를 기록했다. 매출증가율(YoY)은  전체 시장 내 316위를 기록하며 상위 17.51%에 위치했다. 업종별로는 137위를 기록하며 상위 26.36%에 위치했다. 그리고 안정성(부채비율) 역시 도드라지는 편이다. 안정성 점수는 69점으로 두번째로 높은 점수를 기록했다. 부채비율은 전체 시장 내 628위를 기록하며 상위 30.95%에 위치했다. 업종별로는 217위를 기록하며 상위 36.43%에 위치했다. 그러나 영업이익률과 PER은  아쉬움을 나타냈다. [종합 투자점수] [그림 3] 종합 투자점수 AI 인공지능 분석을 통한 삼성SDI의 종목 종합 스코어는 73점을 기록했다. 이는 동일 업종 평균점수인 57점과 시장 평균점수인 57점를 상회하는 수치였다. (위의 AI인공지능 점수는 재무 데이터를 기반으로 전체 상장 종목과 비교/분석하여 도출한 점수로 높은 점수가 반드시 높은 수익률을 보장하지 않습니다. 위의 자료는 당사의 추천 종목이 아니며, 투자 시 참고용으로 제시해드리는 것입니다.) 라이온봇 기자 -한국경제TV※ 본 기사는 한국경제TV와 '거장들의 투자공식이'자체 개발한 '라이온봇 기자'가 실시간으로 작성한 기사입니다. 라이온봇기자 ⓒ 한국경제TV, 무단 전재 및 재배포 금지 한국경제TV 관련뉴스해당 언론사에서 선정하며 언론사 페이지(아웃링크)로 이동해 볼 수 있습니다.클론 구준엽, 이상민 당황시킨 '이혼' 발언 무엇?'김연아 때문?' 손연재 SNS계정 탈퇴까지…누리꾼 '맹비난'소유진 가족사진 공개, 'D-10' 만삭에도 소녀같은 미소사람이좋다 임미숙 김학래, '100억 빚→100억 매출'박항서 비행기 '비키니 쇼' 논란, 고도의 노이즈마케팅?"
한국경제,006400,/news/news_read.nhn?article_id=0003868787&office_id=015&mode=search&query=삼성SDI&page=53,2017-12-22 07:51,"&quot;삼성SDI, 물산 지분 매각 긍정적&hellip;중대형전지 투자 기대&quot;-대신","대신증권은 22일 삼성SDI에 대해 보유 중인 삼성물산의 지분 매각은 현금 유입 측면에서 긍정적이라고 판단했다. 이 종목에 대한 투자의견은 '매수'를, 목표주가는 24만원을 유지했다. 박강호 대신증권 연구원은 ""전날 공정거래위원회의 유권해석으로 삼성SDI가 보유한 삼성물산 주식 404만주(지분 2.1%)를 매각할 가능성이 제기됐다""며 ""유권해석이 최종 확정되는 시점부터 유예기간 6개월 종료 이후 매각이 이뤄질 것""이라고 말했다. 삼성물산 지분은 약 5200억원 규모로, 삼성SDI는 매각 시 유입된 현금으로 중대형전지 부문에 투자를 진행할 것으로 내다봤다. 2019년 중대형전지 부문의 흑자전환이 예상되는 가운데 생산 능력 확대가 필요하다는 이유에서다. 박 연구원은 ""삼성SDI는 지난해 2월25일에도 삼성물산 지분 2.6%를 매각해 7750억원의 현금을 챙겼다""며 ""이번 공정위의 유권 해석도 삼성SDI 입장에서는 긍정적으로 해석할 수 있다""고 분석했다."
