source,symbol,link,date,title,content
뉴시스,006400,/news/news_read.nhn?article_id=0008658664&office_id=003&mode=search&query=삼성SDI&page=17,2018-06-18 09:05,"[빅데이터MSI]시장심리 톱5, LG화학&middot;삼성SDI&middot;신세계&middot;LG유플러스&middot;아모레퍼시...","워스트5,  LG디스플레이·삼성에스디에스·한화·삼성생명·세아제강 【서울=뉴시스】이국현 기자 = 18일 빅데이터 시장심리지수(MSI)가 가장 높은 '톱5'에 LG화학(051910), 삼성SDI(006400), 신세계(004170), LG유플러스(032640), 아모레퍼시픽(090430)이 뽑혔다. 반면 시장심리가 저조한 워스트 5로는 LG디스플레이(034220), 삼성에스디에스(018260), 한화(000880), 삼성생명(032830), 세아제강(003030)이 집계됐다. 이는 뉴시스와 코스콤이 주요 상장기업 250곳에 대해 공동 분석해 산출해 낸 빅데이터 MSI(http://m.newsis.com/stock.html, 모바일 전용)로 전 거래일 오후 4시부터 이날 오전 8시까지 데이터를 취합한 결과다. LG화학 MSI 레벨은 전날과 같은 7단계 매우 좋음을 유지했다. 관련 키워드로는 태양광, 브랜드, 사용료, 기술, 중국, 계열사, 연구, 전기, 배터리, 옥상, 설치, 발전설비, 공장, 인력, 글로벌, 전기차, 이노베이션, 보조금, 재생에너지 등이 꼽혔다. 삼성SDI MSI는 전날 6단계 '좋음'에서 7단계로 1계단 상승했다. 온라인에서는 브랜드, 사용료, 계열사, 태양광, 발전, lg화학, 설치, 상표권, 수혜, 공급, 삼성, 재생에너지, 수입, 수취, 지주회사, 확대, 수요, 태양광용 등이 관련 키워드로 추출됐다. 앞서 삼성전자가 국내외 반도체 공장 전력의 상당 부분을 태양광발전 등 신재생에너지로 대체한다는 계획을 내놓자 삼성SDI와 LG화학이 수혜 종목으로 떠오른 데 따른 것으로 풀이된다. 신세계 MSI는 전날과 같은 7단계 매우 좋음을 가리켰다. 변경, 보증, 취득, 채무, 면세점, 맥주, 사외이사, 긍정적, 브랜드, 투자, 온라인, 화장품, 하나, 상승, 중국, 샴푸 등의 키워드가 상위권에 랭크됐다. LG유플러스 MSI는 전날 2단계 나쁨에서 7단계로 5계단 뛰어올랐다. 요금제, 대역, 가입, 주파수, 고객, 경매, 서비스, 효과, 데이터, 사업, 정부, 무선, 목표가, KT, 규제, 기반, 인하, 발표, 요금, 추이, 약화, 제공, 점유율 등의 키워드가 시장심리를 끌어올린 것으로 풀이된다. 내년부터 상용화되는 5세대(5G) 이동통신의 주파수 경매에서 이동통신 3사가 물밑경쟁을 벌이면서 관심을 받은 데 따른 것으로 보인다. 아모레퍼시픽 MSI는 이틀 연속 7단계를 유지했다. 온라인에서는 민트, 본사, 녹차, 화장품, 건물, 구매, 롯데, 사각, 유어, 메이크업, 화장, 여자, 데이비드, 창업자, 준공 등이 관련 키워드로 검출됐다. 시장심리가 1단계 매우 나쁨을 나타낸 종목은 LG디스플레이·삼성에스디에스·한화·삼성생명·세아제강으로 집계됐다. LG디스플레이는 전 거래일 3단계 '약간 나쁨'에서 1단계로 2계단 하락했다.  태양광, 브랜드, 사용료, 패널, 계열사, 업체, 가격, 중국, 설치, 전기, 발전설비, 옥상, 공장, 내년, 확대, 적자, 재생에너지, 롯데마트, 비투비, 상표권 등이 관련 키워드로 추출됐다. 삼성에스디에스 MSI는 이틀째 매우 나쁨을 벗어나지 못했다. 하락, 전기가스업, 계열사, 동향, 매도, 기조, 팔자, 수급측면, 물류, 재벌, 공정거래위, 경농, 시스템통합, 필룩스, 나노, 일감, 신풍제약 등의 키워드가 뽑혔다. 한화 MSI는 전날 3단계 약간 나쁨에서 1단계로 2계단 떨어졌다. 온라인에서는 공연, 한화클래식, 보장, 한국, 가격, 예술 ,세계적, 최고, 치아보험, 서울, 치료, 독일, 보험, 콘서트, 카운터테너, 전당 등의 키워드가 집계됐다. 삼성생명 MSI는 이틀째 1단계 매우 나쁨을 가리켰다. 브랜드, 사용료, 계열사, 상표권, 지주회사, 법안, 재벌, 총수, 보험, 미국, 매각, 지배구조, 광고, 삼성, 금액, 개혁, 정책, 물류, 일감, 수입, 수취, 매출액, 핵심, 암보험, 거래량 등이 뽑혔다. 세아제강 MSI는 전날 4단계 보통에서 1단계로 3단계 추락했다. 미국, 조치, 품목, 유정용강관, 상무부, 법인, 해당, 평균, 생산, 제외, 휴스턴, 정부, 신청서 등의 키워드가 시장 심리를 끌어내린 것으로 풀이된다. MSI산출 대상은 코스피 200종목과 코스피 지수, 코스닥 50종목과 코스닥 지수 등 250개 개별 종목이다. 뉴시스와 코스콤은 온라인과 소셜네트워크서비스(SNS)에서 수집된 개별 종목 관련 빅데이터를 긍정과 부정으로 분류해 점수화한 후 이를 최근 1년 간 흐름과 비교해 MSI(Market Sentiment Index) 지수를 산출했다. MSI는 1단계 '매우 나쁨', 2단계 '나쁨', 3단계 '약간 나쁨', 4단계 '보통', 5단계 '약간 좋음', 6단계 '좋음', 7단계 '매우 좋음' 등 총 7단계로 분류한다. 한편 지난해 8월1일부터 선보인 빅데이터 MSI 모바일 전용 버전은 구글플레이 또는 애플 앱스토어에서 '뉴시스' 앱을 내려받거나 뉴시스 모바일 홈페이지(m.newsis.com)에 접속한 뒤 메인화면의 '빅데이터 MSI'를 클릭해 이용하면 된다."
아시아경제,006400,/news/news_read.nhn?article_id=0004257727&office_id=277&mode=search&query=삼성SDI&page=18,2018-06-14 10:04,"[특징주] 삼성SDI, 배터리 사업부 수익성 개선 기대&hellip;이틀째 상승","[아시아경제 임철영 기자] 삼성SDI가 배터리 매출 확대로 실적이 개선될 것이라는 전망에 상승세다. 14일 오전 10시2분 현재 삼성SDI는 전 거래일 대비 1.09% 오른 23만2500원에 거래되고 있다. 이틀째 상승세다. 이 시간 CS증권, 골드만삭스, 모건스탠리증권 등이 매수 거래원 상위에 올라있다. 신한금융투자는 이날 삼성SDI에 대해 코발트 가격 하락 전환으로 전기차 배터리 사업부 수익성이 개선될 것으로 예상된다며 목표주가 를 27만원에서 29만원으로 상향 조정했다. 투자의견도 '매수'를 유지했다. 신한금융투자는 삼성SDI의 2분기 영업이익이 전분기대비 72.2% 늘어난 1240억원을 기록, 시장 기대치(1100억원)을 상회할 것으로 예상했다. 올해 영업이익은 전년동기대비 338.2% 증가한 5150억원, 대형 배터리 매출액은 108.8% 늘어난 3조원으로 추정됐다. 소현철 신한금융투자 연구원은 ""2차 전지 핵심소재인 코발트의 t당 가격이 지난해 1월1일 3만2734달러에서 올 3월26일 9만4050달러로 급등했다""면서 ""최근 8만2250달러로 고점대비 12.5% 하락했다""고 설명했다. 이어 ""전세계 코발트 생산물량의 60%를 차지하는 콩고의 정치적 불안정성이 해소되고 있다""면서 ""삼성SDI와 LG화학은 직접 광산 개발로 코발트 사용비중을 축소하고 있다""고 설명했다. 소 연구원은 내년 전기차 배터리 사업부 영업적자가 700억원까지 줄어들 것으로 봤다."
전자신문,006400,/news/news_read.nhn?article_id=0002718222&office_id=030&mode=search&query=삼성SDI&page=15,2018-06-25 11:29,"[ET투자뉴스]삼성SDI, &quot;CATL vs. 삼&hellip;&quot; BUY(유지)-키움증권","키움증권에서 25일 삼성SDI(006400)에 대해 ""CATL vs. 삼성SDI""라며 투자의견을 'BUY(유지)'로 제시하였고, 아울러 목표주가로는 280,000원을 내놓았다. 키움증권 김지산 애널리스트가 동종목에 대하여 이번에 제시한 'BUY(유지)'의견은 키움증권의 직전 매매의견에서 큰 변화없이 그대로 유지되는 것이고  올해 초반의 매매의견을 기준으로  볼때도 역시 '매수'의견이 계속 유지되고 있는 상태이다. 그리고 최근 분기내 발표된 전체 증권사 리포트의 컨센서스와 비교를 해볼 경우에 오늘 발표된 투자의견은 전체의견에 수렴하고 있어, 이번 의견은 시장의 평균적인 기대감이 객관적으로 표현된 것으로 분석되고 있다. 목표주가의 추이를 살펴보면 이번에 다시 목표가가 같은 수준을 유지하면서 최근 흐름은 목표가의 계단식 상승이 진행되는 모습이다. 또한 전일 종가 기준으로 볼때 동종목의 현주가는 이번에 제시된 목표가 대비 23.3%의 저평가 요인이 존재한다는 해석이 제시되고 있다."
전자신문,006400,/news/news_read.nhn?article_id=0002718130&office_id=030&mode=search&query=삼성SDI&page=15,2018-06-25 09:12,"[ET투자뉴스]삼성SDI, &quot;Safe haven&hellip;&quot; BUY-KTB투자증권","KTB투자증권에서 25일 삼성SDI(006400)에 대해 ""Safe haven""라며 투자의견을 'BUY'로 제시하였고, 아울러 목표주가로는 260,000원을 내놓았다. KTB투자증권 김양재 애널리스트가 동종목에 대하여 이번에 제시한 'BUY'의견은 KTB투자증권의 직전 매매의견에서 큰 변화없이 그대로 유지되는 것이고  올해 초반의 매매의견을 기준으로  볼때도 역시 '매수'의견이 계속 유지되고 있는 상태이다. 그리고 최근 분기내 발표된 전체 증권사 리포트의 컨센서스와 비교를 해볼 경우에 오늘 발표된 투자의견은 전체의견에 수렴하고 있어, 이번 의견은 시장의 평균적인 기대감이 객관적으로 표현된 것으로 분석되고 있다. 목표주가의 추이를 살펴보면 한동안 정체구간을 보낸 후 이번에 오랜만에 목표가가 상향조정된 모습이다. 또한 전일 종가 기준으로 볼때 동종목의 현주가는 이번에 제시된 목표가 대비 14.5%의 저평가 요인이 존재한다는 해석이 제시되고 있다."
전자신문,006400,/news/news_read.nhn?article_id=0002715755&office_id=030&mode=search&query=삼성SDI&page=18,2018-06-14 13:37,"[ET투자뉴스]삼성SDI, &quot;중대형 전지 파도에&hellip;&quot; 매수(유지)-IBK투자증권","IBK투자증권에서 14일 삼성SDI(006400)에 대해 ""중대형 전지 파도에 올라타자""라며 투자의견을 '매수(유지)'로 제시하였고, 아울러 목표주가로는 290,000원을 내놓았다. IBK투자증권 김운호 애널리스트가 동종목에 대하여 이번에 제시한 '매수(유지)'의견은 IBK투자증권의 직전 매매의견을 그대로 유지하는 것이고 올해 초반의 매매의견을 기준으로  볼때도 역시 '매수'의견이 계속 유지되고 있는 상태이다. 그리고 최근 분기내 발표된 전체 증권사 리포트의 컨센서스와 비교를 해볼 경우에 오늘 발표된 투자의견은 대체적으로 평균치에 해당하는 수준으로, 이번 의견은 동종목에 대한 전체적인 흐름에서 크게 벗어나지 않은 것으로 분석되고 있다. 목표주가의 추이를 살펴보면 이번에 다시 목표가가 같은 수준을 유지하면서 최근 흐름은 목표가의 계단식 상승이 진행되는 모습이다. 또한 전일 종가 기준으로 볼때 동종목의 현주가는 이번에 제시된 목표가 대비 26.1%의 추가상승여력이 있다는 해석이 제시되고 있다."
전자신문,006400,/news/news_read.nhn?article_id=0002715874&office_id=030&mode=search&query=삼성SDI&page=18,2018-06-14 15:18,"[ET투자뉴스]삼성SDI, &quot;신재생에너지와 전기&hellip;&quot; 매수(유지)-신한금융투자","신한금융투자에서 14일 삼성SDI(006400)에 대해 ""신재생에너지와 전기차로 도약한다""라며 투자의견을 '매수(유지)'로 제시하였고, 아울러 목표주가로는 290,000원을 내놓았다. 신한금융투자 소현철, 박형우 애널리스트가 동종목에 대하여 이번에 제시한 '매수(유지)'의견은 신한금융투자의 직전 매매의견을 그대로 유지하는 것이고 올해 초반의 매매의견을 기준으로  볼때도 역시 '매수'의견이 계속 유지되고 있는 상태이다. 그리고 최근 분기내 발표된 전체 증권사 리포트의 컨센서스와 비교를 해볼 경우에 오늘 발표된 투자의견은 대체적으로 평균치에 해당하는 수준으로, 이번 의견은 동종목에 대한 전체적인 흐름에서 크게 벗어나지 않은 것으로 분석되고 있다. 목표주가의 추이를 살펴보면 한동안 정체구간을 보낸 후 이번에 오랜만에 목표가가 상향조정된 모습이다. 또한 전일 종가 기준으로 볼때 동종목의 현주가는 이번에 제시된 목표가 대비 26.1%의 추가상승여력이 있다는 해석이 제시되고 있다."
이데일리,006400,/news/news_read.nhn?article_id=0004126287&office_id=018&mode=search&query=삼성SDI&page=18,2018-06-15 08:27,"삼성SDI, 삼성전자 국내외 전사업장 태양광 설치 수혜-키움","[이데일리 성선화 기자] 키움증권은 삼성전자(005930)가 국내외 전 사업장에 태양광 발전을 하기로 한 계획에 대해 삼성SDI(006400)의 ESS(차세대에너지저장시스템)이 수혜를 볼 것이라고 전망했다. 15일 김지산 키움증권 연구원은 “삼성전자가 국내외 사업장에 2020년까지 3.1GW급 태양광 발전 구축 계획 발표했다”며 “올해 수원 사업장에 4만 2000㎡ 규모 태양광 패널 설치하고 내년에 평택 사업장, 내후년년 화성 사업장에 2만 1000㎡ 규모의 재생에너지 발전 설비를 설치할 것”이라고 전망했다. 그는 “삼성SDI ESS 사업 수혜가 클 것으로 예상된다”며 “통상적으로 태양광 발전 용량의 2.5~3배 규모의 ESS가 설치가 필요하다”고 분석했다. 이어 “태양광 발전은 ESS와 연계해야 고품질의 전력을 안정적으로 공급 가능하다”며 “현재 상업용 ESS 특례 요금제 혜택도 크다”고 평가했다. 그는 “이번 삼성전자 사업장 태양광용으로 2조원~2조 5000억원 규모 ESS 수요가 형성될 것으로 전망된다”며 “삼성SDI가 ESS용 리튬이온전지를 주도적으로 공급할 것으로 예상된다”고 내다봤다. 이는 올해 ESS 예상 매출인 1조 4000억원의 두배에 달하는 수준이다."
아이뉴스24,006400,/news/news_read.nhn?article_id=0000450092&office_id=031&mode=search&query=삼성SDI&page=18,2018-06-15 08:44,"[I-리포트] 삼성전자의 태양광 설치, 삼성SDI에 수혜-키움證","[아이뉴스24 김다운 기자] 키움증권은 15일 삼성전자의 대규모 태양광 설치 계획에 따라 삼성SDI의 차세대에너지저장시스템(ESS) 매출 확대가 기대된다고 분석했다. 삼성전자는 전날 국내외 사업장에 2020년까지 3.1GW급 태양광 발전을 구축하겠다고 발표했다. 김지산 키움증권 애널리스트는 ""삼성SDI의 ESS 사업이 특히 수혜가 클 것""이라고 전망했다. 일반적으로 태양광 발전 용량의 2.5~3배 규모의 ESS가 설치되며, ESS와 연계해야 고품질의 전력을 안정적으로 공급하는 게 가능하다는 설명이다. 현재 상업용 ESS 특례 요금제 혜택도 큰 상태다. 김 애널리스트는 ""이번 삼성전자 사업장 태양광용으로 2조~2조5천억원 규모의 ESS 수요가 형성될 전망""이라며 ""삼성SDI가 ESS용 리튬이온전지를 주도적으로 공급할 것""이라고 예상했다. 한편 올해 삼성SDI의 ESS 매출은 1조4천억원으로 전망된다. /김다운기자"
전자신문,006400,/news/news_read.nhn?article_id=0002718116&office_id=030&mode=search&query=삼성SDI&page=15,2018-06-25 08:34,"[ET투자뉴스]삼성SDI, &quot;중대형전지시장 성장&hellip;&quot; BUY(상향)-리딩투자증권","리딩투자증권에서 25일 삼성SDI(006400)에 대해 ""중대형전지시장 성장의 최대 수혜""라며 투자의견을 'BUY(상향)'로 제시하였고, 아울러 목표주가로는 280,000원을 내놓았다. 리딩투자증권 서형석, 정태원 애널리스트가 동종목에 대하여 이번에 제시한 'BUY(상향)'의견은 리딩투자증권의 직전 매매의견에서 큰 변화없이 그대로 유지되는 것이고  올해 초반의 매매의견을 기준으로  볼때도 역시 '매수'의견이 계속 유지되고 있는 상태이다. 그리고 최근 분기내 발표된 전체 증권사 리포트의 컨센서스와 비교를 해볼 경우에 오늘 발표된 투자의견은 전체의견에 수렴하고 있어, 이번 의견은 시장의 평균적인 기대감이 객관적으로 표현된 것으로 분석되고 있다. 목표주가의 추이를 살펴보면 과거 상향조정되어오던 패턴이 한차례 정체구간을 보낸 후에 이번에 다시 상향조정되는 모습이다. 또한 전일 종가 기준으로 볼때 동종목의 현주가는 이번에 제시된 목표가 대비 23.3%의 저평가 요인이 존재한다는 해석이 제시되고 있다."
서울경제,006400,/news/news_read.nhn?article_id=0003322980&office_id=011&mode=search&query=삼성SDI&page=18,2018-06-15 09:10,삼성전자 태양광 설치 계획 발표에 삼성SDI 신고가,"[서울경제] 삼성SDI(006400) 가 삼성전자의 대규모 태양광 설치 계획 소식이 전해지면서 15일 개장과 동시에 신고가를 기록했다. 이날 오전 9시8분 현재 삼성SDI는 전 거래일 대비 8,500원(3.74%) 오른 23만5,500원에 거래되고 있다. 개장 하자마자 주가는 23만6,500원까지 올라 52주 최고가를 경신했다. 삼성전자는 전날 국내외 사업장에 2020년까지 3.1GW급 태양광 발전을 구축하겠다고 발표했다. 김지산 키움증권 연구원은 “김 애널리스트는 “이번 삼성전자 사업장 태양광용으로 2조~2조5천억원 규모의 ESS 수요가 형성될 전망”이라며 “삼성SDI가 ESS용 리튬이온전지를 주도적으로 공급할 것”이라고 예상했다."
아이뉴스24,006400,/news/news_read.nhn?article_id=0000450098&office_id=031&mode=search&query=삼성SDI&page=17,2018-06-15 09:12,"[특징주] 삼성SDI, 사상최고가&hellip;삼성전자 태양광 기대","[아이뉴스24 김다운 기자] 삼성SDI가 삼성전자의 태양광 설치계획에 따른 수혜 전망에 상승하며 사상 최고가를 경신했다. 15일 오전 9시7분 현재 삼성SDI는 전날보다 3.74%(8천500원) 오른 23만5천원을 기록중이다. 장중 23만6천500원까지 오르면서 사상 최고가를 기록했다. 전날 발표된 삼성전자의 대규모 태양광 설치 계획에 따라 삼성SDI의 차세대에너지저장시스템(ESS) 매출 확대가 기대되고 있다. 김지산 키움증권 애널리스트는 ""이번 삼성전자 사업장 태양광용으로 2조~2조5천억원 규모의 ESS 수요가 형성될 전망""이라며 ""삼성SDI가 ESS용 리튬이온전지를 주도적으로 공급할 것""이라고 예상했다. /김다운기자"
서울신문,006400,/news/news_read.nhn?article_id=0002924225&office_id=081&mode=search&query=삼성SDI&page=15,2018-06-22 03:38,"삼성SDI, 전력 손실 적은 &lsquo;ESS&rsquo; 獨서 공개","배터리 셀 용량 20% 이상 높여…유럽 ESS 시장 판도 변화 기대 [서울신문] 삼성SDI는 22일까지 독일 뮌헨에서 열리는 ‘EES 유럽 2018’에서 고전압 가정용 에너지저장장치(ESS) 배터리 모듈 신제품을 선보였다고 21일 밝혔다. ‘EES 유럽’은 세계 최대 규모의 ESS 관련 전시회로, 지난 20일 사흘간 일정으로 개막했다. 회사는 ‘에너지 세상의 내일은 삼성SDI가 함께한다’는 슬로건으로 부스를 차리고, 기존 가정용 ESS보다 에너지 전환 효율이 높은 신제품을 공개했다. 태양전지가 생산한 고전압 전력을 ESS에 저장하기 위해서는 비싼 주변장치가 필요한데, 이번 신제품은 전압을 높여 손실을 최소화했다. 또 첨단 설계 기술을 적용, 에너지 밀도를 지난해 출시한 제품 대비 2배가량 높여 배터리 셀의 크기는 그대로지만 용량을 20% 이상 늘렸다고 회사는 설명했다. MobileAdNew center 가정용 ESS 시장은 태양광을 비롯한 신재생에너지 보급률이 높은 유럽시장을 중심으로 가파르게 성장하고 있다. 시장조사업체인 B3에 따르면 올해 전 세계 가정용 ESS 시장은 1259㎿h 규모로, 지난해(900㎿h)보다 40%가량 늘었다. 김정욱 전략마케팅실장(부사장)은 “차별화된 기술력을 통해 합리적 소비를 지향하는 유럽 시장의 판도를 바꿀 수 있을 것으로 기대한다”고 말했다."
한국경제,006400,/news/news_read.nhn?article_id=0003961279&office_id=015&mode=search&query=삼성SDI&page=17,2018-06-15 09:23,"[특징주]삼성SDI, 삼성전자 반도체 공장 태양광 발전 소식에 '최고가'","삼성전자가 반도체 공장에서 사용하는 전기에너지의 상당 부분을 신재생에너지로 대체하는 계획을 내놓은 가운데 삼성SDI가 수혜 기대로 강세를 나타내고 있다. 15일 오전 9시17분 현재 삼성SDI는 전날 대비 8000원(3.52%) 오른 23만5000원에 거래되고 있다. 하루 만에 반등한 주가는 장중 23만6500원까지 뛰어 사상 최고가를 경신했다. 삼성전자는 경기 수원과 화성, 평택사업장에 6만3000㎡ 규모의 태양광 및 지열 발전 설비를 갖추기로 했다. 올해부터 수원사업장 주차장과 건물 옥상 등 빈 공간에 4만2000㎡ 규모의 태양광 패널을 설치하고 있다. 내년에는 평택사업장, 2020년에는 화성사업장 등에도 태양광과 지열을 포함해 2만1000㎡ 규모의 재생에너지 발전설비를 설치할 계획이다. 오정민 한경닷컴 기자"
이데일리,006400,/news/news_read.nhn?article_id=0004126402&office_id=018&mode=search&query=삼성SDI&page=17,2018-06-15 09:34,"[특징주]삼성SDI, 삼성전자 전사업장 태양광 설치 수혜..52주 신고가","[이데일리 성선화 기자] 삼성SDI(006400)가 강세다. 15일 오전 9시 30분 현재 삼성SDI가 전날 대비 3.52% 상승한 23만 5000원에 거래되며 52주 신고가를 돌파했다. 전날 삼성전자가 전 사업장에 태양광 발전 장치를 설치할 계획이라는 발표의 영향으로 보인다. 전날 삼성전자는 경기도 수원·화성·평택 사업장의 주차장, 건물 옥상에 약 6만3000㎡(약 1만9000평) 규모의 태양광·지열 발전 시설을 설치하는 것을 비롯해 국내외 사업장에 신재생에너지 설비를 대폭 늘린다고 밝혔다. 이날 김지산 키움증권 연구원은 “삼성전자가 국내외 사업장에 태양광 패널을 설치하면 삼성SDI의 차세대에너지저장장치(ESS)가 수혜를 볼 것”이라며 “통상적으로 태양광 발전 용량의 2.5~3배 규모의 ESS가 설치가 필요하기 때문”이라고 분석했다. 이어 “태양광 발전은 ESS와 연계해야 고품질의 전력을 안정적으로 공급 가능하다”며 “현재 상업용 ESS 특례 요금제 혜택도 크다”고 평가했다. 이번 삼성전자의 태양광 발전 설치로 예상되는 수혜는 올해 예상 매출액의 두배에 달하는 수준이다. 그는 “이번 삼성전자 사업장 태양광용으로 2조원~2조 5000억원 규모 ESS 수요가 형성될 것으로 전망된다”며 “삼성SDI가 ESS용 리튬이온전지를 주도적으로 공급할 것으로 예상된다”고 내다봤다. 이는 올해 ESS 예상 매출인 1조 4000억원의 두배에 달하는 수준이다."
