source,symbol,link,date,title,content
파이낸셜뉴스,006620,/news/news_read.nhn?article_id=0004029723&office_id=014&mode=search&query=동구바이오제약&page=1,2018-05-29 12:10,"동구바이오제약, 의약 및 CMO 사업 확대에 따른 시설투자","동구바이오제약이 최근 치매치료제 시장의 급성장 등 주력사업의 성장세에 맞춰 안정적 생산능력 확보를 위한 선제적 투자에 나선다. 동구바이오제약은 29일 의약 및 CMO(Contract Manufacturing Organization) 사업 확장에 따라 경기도 화성제약공단 내 동구바이오제약 공장의 시설증설 및 기존 설비 업그레이드를 위해 33.5억을 투자한다고 공시했다. 동구바이오제약은 앞으로 대표적인 CMO생산 설비인 연질라인을 비롯, 연고라인,내용고형제 및 포장라인에 대한투자를 진행할 예정이다. 회사는 향후 2년간 4단계에 걸친 투자 집행을 계획 중이며, 금번 투자는 주요 제형별 생산 Capa 확장과 관련된 투자로 현 생산설비의 2배 수준 생산량을 확보함으로써 주력 품목에 대한 생산능력을 증대시키고CMO 고객사에 안정적인 제품 공급체계를 갖출 계획이다. 문재인 케어의 핵심인 ‘치매치료국가책임제’ 시행에 따라 치매 치료제 중심의 CMO 사업이 급성장하며 동구바이오제약의 2017년 CMO 매출은전년 대비 43.6%의 높은 성장률을 기록하기도 했다. 동구바이오제약은 의뢰를 받아생산하는수동적 영업에서 벗어나 우판권을 공동 추진해 다수의 고객사를 선제적으로 모집하고 특화제형 생산기술을 바탕으로 한 R&D기반 전략 영업을 하는 등 차별화된 CMO 시스템을 갖춘 것으로 평가받고 있다. 동구바이오제약 관계자는 “기업의 의약부문 매출이 지속적으로 성장하고 고객사의 물량이 증가함에 따라 안정적 생산능력 확보를 위한 선제적 투자를 결정했다”며 “수요에 맞춘 유연한 생산 능력을 확보하고 개량신약 등 신규 제품 발매도 가속화할 수 있을 것으로 기대된다”고 말했다."
이데일리,006620,/news/news_read.nhn?article_id=0004022219&office_id=018&mode=search&query=동구바이오제약&page=1,2018-01-29 16:16,[IPO출사표]동구바이오제약 &ldquo;피부&middot;비뇨기과 강자에서 토탈헬스케어 리더로&rdquo;,"- 안정적 제약품 분야 캐쉬카우 기반…줄기세포 R&amp;D 통한 바이오 진출 - 바이오디바이스·코스메슈티컬 등 신사업 개척 조용준 동구바이오제약 대표(사진=동구바이오제약 제공 [이데일리 윤필호 기자] “피부과와 비뇨기과 치료의학품 시장을 선도하고 있습니다. 앞으로 토탈 비즈니스 모델 구축 등 외형 성장을 통해 2020년까지 매출액 2000억원대, 국내 30위권의 혁신형 제약기업으로 발돋움할 것입니다.” 조용준 동구바이오제약 대표는 29일 여의도 63빌딩에서 개최한 기업공개(IPO) 기자간담회에서 이 같이 말하며 “그동안 2020년 비전을 준비하는 과정이었다면 올해부터는 바디오 메디컬 디바이스와 코스메슈티컬, 건강기능식품 등 신규 사업으로 확대할 예정”이라고 밝혔다. 동구바이오제약은 지난 1970년 설립 후 피부과 처방 점유율 1위, 비뇨기과 처방 9위에 오른 회사다. 전문의약품의 안정적 매출을 기반으로 최근 줄기세포 연구개발(R&D)에 나서 바이오 영역까지 진출, 새로운 성장 동력을 구축하고 있다. 이와 관련해 세계 최초로 줄기세포 추출키트인 ‘스마트엑스’를 개발했다. 또 3D 줄기세포 화장품인 ‘셀 블룸’을 개발해 코스메슈티컬(화장품과 의약품의 합성어) 시장 진출에 나섰다. 셀 블룸은 지난해 아시아나 기내 면세점, 드럭스토어 등에 입점했고 중국과도 수출계약을 체결했다. 이를 통해 ‘토탈 헬스케어 솔루션’ 업체로 성장한다는 것이 조 대표 계획이다. 최근 시장이 급성장하고 있는 의약품위탁생산(CMO) 사업도 확대하고 있다. 회사는 특화 제형생산 기술을 바탕으로 고부가가치 CMO 제품 생산을 확대하고 우판권 공동 추진으로 다수의 수탁사를 확보하고 있다. 조 대표는 “단순 제네릭이 아니라 스피디하게 나가서 독점권을 가져와 시장 지위를 높이는 스마트한 R&D 전략으로 나가고 있다”며 “이를 통해 확보한 퍼스트 제네릭 파이프라인은 8개 품목을 발매할 예정이다. 다수의 제약사와 위탁생산 계약이 체결돼 있어 자체적 영업과 CMO 매출 성장을 동시에 가져올 것으로 본다”고 설명했다. 향후 중장기적으로 계량시장 파이프라인을 확대하고 신물질 개발도 주력할 예정이다. 동구바이오제약은 줄기세포 추출키트인 스마트엑스를 내세워 해외시장 진출도 추진 중이다. 이미 국내 식품의약품안전처(KFDA)를 비롯해 미국 식품의약국(FDA), 유럽연합통합안전인증(CE) 등록을 마쳤고 중국, 일본 업체와의 수출 계약도 체결했다. 세계 최초 줄기세포 추출키트인 스마트엑스 개발도 완료해 해외에 진출했다. 최근에는 스마트엑스의 적응증 확대를 위해 국내 병원들과 증상별 임상을 진행 중이다. 동구바이오제약은 지난 2016년 매출액 874억원을 기록했으며 영업이익 106억원, 영업이익률 12%로 높은 수익성을 기록했다. 지난해 3분기 매출액은 전년 동기대비 21% 오른 754억원, 영업이익과 당기순이익은 각각 94%, 110% 오른 116억원, 95억원을 기록했다. 공모자금은 생산라인 증설과 R&D에 투입할 예정이다. 조 대표는 “상장 후 회사를 한 단계 성장시킬 것”이라며 “시설 확장과 R&D 투자를 계획하고 있다”고 말했다. 한편 공모 주식수는 207만주로 공모예정가 1만2000~1만4500원이다. 이를 통해 총 248억~300억원을 조달할 예정이다. 오는 30~31일 수요예측 이후 다음달 5~6일 양일간 일반투자자 청약을 거쳐 2월 중 상장될 예정이다. 주관사는 NH투자증권이다."
한국경제,006620,/news/news_read.nhn?article_id=0003950011&office_id=015&mode=search&query=동구바이오제약&page=1,2018-05-29 14:55,"동구바이오제약, CMO 사업 확대에 따른 시설투자","[ 전예진 기자  ] 동구바이오제약은 29일 의약품위탁생산(CMO) 사업 확장에 따라 경기도 화성 제약공단 내 동구바이오제약 공장의 시설 증설 및 기존 설비 업그레이드를 위해 33억여원을 투자한다고 공시했다. 동구바이오제약은 앞으로 2년 간 4단계에 걸쳐 대표적인 CMO 생산 설비인 연질라인을 비롯, 연고라인, 내용고형제 및 포장라인에 대한 투자를 진행할 예정이다. 주요 제형별 생산 규모를 현재 2배 수준으로 늘려 고객사에 안정적인 제품공급체계를 갖춘다는 계획이다. 동구바이오제약은 정부의 ‘치매 국가책임제’ 시행하면서 지난해 치매치료제 CMO 사업 매출이 전년대비 43.6% 성장했다고 밝혔다. 동구바이오제약 관계자는 ""의약 부문 매출이 지속적으로 성장하고 고객사의 물량이 증가함에 따라 선제적 투자를 결정했다""며 ""수요에 맞춘 유연한 생산 능력을 확보하고 개량신약 등 신규 제품 발매도 가속화할 수 있을 것""이라고 기대했다. 전예진 기자"
코메디닷컴,006620,/news/news_read.nhn?article_id=0000036026&office_id=296&mode=search&query=동구바이오제약&page=1,2018-05-29 16:39,"동구바이오제약 가파른 성장세, 33.5억 들여 공장 증설","바이오 벤처 디앤디파마텍 지분을 취득하면서 본격적인 치매 치료제 개발에 나선 동구바이오제약이 주력 사업 성장과 안정적인 생산 능력 확보를 위해 선제적 투자에 나선다. 동구바이오제약은 의약품과 위탁 생산(CMO) 사업 확장에 따라 경기도 화성 제약 공단 내 동구바이오제약 공장의 시설 증설 및 기존 설비 업그레이드를 위해 33.5억을 투자한다고 29일 공시했다. 회사는 향후 2년간 4단계에 걸친 투자 집행을 계획 중이며, 이번 투자는 주요 제형별 생산 능력 확장과 관련된 투자로 현 생산 설비의 2배 수준 생산량을 확보함으로써 주력 품목에 대한 생산능력을 증대시키고 CMO 고객사에 안정적인 제품 공급 체계를 갖출 계획이다. 문재인 케어의 핵심인 치매 국가 책임제 시행에 따라 치매 치료제 중심의 CMO 사업이 급성장하며 동구바이오제약의 2017년 CMO 매출은 전년 대비 43.6%의 높은 성장률을 기록하기도 했다. 특히 지난 3월 치매 치료제를 개발 중인 바이오 벤처 디앤디파마텍 지분을 인수하면서 치매 치료제 개발을 주력 사업으로 편입시켰다. 디앤티파마텍은 미국에서 파킨슨병/알츠하이머병 치료제 및 희귀성 섬유화증 치료제를 개발하는 뉴랄리와 세라리 화이브로시스를 보유하고 있는 존스홉킨스 대학교 의과 대학 교수진 및 연구진 기반의 의약품 개발 업체다. 동구바이오제약은 디앤디파마텍이 진행 중인 퇴행성 뇌질환 치료제 NLY01의 미국 임상 1상을 올해 안에 완료한다는 계획이다. 동구바이오제약 관계자는 ""기업의 의약 부문 매출이 지속적으로 성장하고 고객사의 물량이 증가함에 따라 안정적 생산 능력 확보를 위한 선제적 투자를 결정했다""며 ""수요에 맞춘 유연한 생산 능력을 확보하고 개량 신약 등 신규 제품 발매도 가속화할 수 있을 것으로 기대된다""고 말했다. [사진=동구바이오제약 향남공장 전경]"
연합뉴스,006620,/news/news_read.nhn?article_id=0009844951&office_id=001&mode=search&query=동구바이오제약&page=1,2018-01-29 16:55,동구바이오제약 내달 코스닥 입성 &quot;신사업 확대&quot;,"(서울=연합뉴스) 권수현 기자 = 피부과·비뇨기과 전문 제약사인 동구바이오제약이 내달 코스닥시장에 입성한다. 동구바이오제약은 29일 여의도에서 기자간담회를 열고 기업공개(IPO) 뒤 줄기세포 화장품과 의약품위탁생산(CMO) 등 신사업을 확대하겠다는 계획을 밝혔다. 1970년에 설립된 동구바이오제약은 피부과와 비뇨기과 전문 의약품에 특화한 제약사로, 알레르기 증상 완화제 알레스틴과 피부 가려움증·염증용 연고 더모타손 등을 생산해왔다. 2016년 연결 기준 매출액은 873억6천300만원, 영업이익은 105억6천500만원, 순이익은 109억1천300만원이었다. 최근에는 줄기세포 추출키트 '스마트엑스'(SmartX)와 줄기세포 화장품 브랜드 '셀블룸'을 내놓으면서 바이오와 코스메슈티컬(화장품+의약품) 분야에 진출했다. 조용준 대표는 ""스마트엑스는 미국 식품의약청(FDA)과 유럽연합 CE 인증을 받고 중국·일본 등으로 수출계약을 했다""며 ""최근에는 적응증 확대를 위해 국내 병원에서 임상을 진행중""이라고 소개했다. 조 대표는 ""셀블룸도 기내 면세점과 드럭스토어에 입점하고 중국에 수출 계약을 하는 등 세계 시장 진출에 나섰다""고 말했다. 동구바이오제약은 또 CMO로도 사업 영역을 넓혀 치매질환 치료제 '콜린알포세레이트', 전립선 비대증 치료제 '탐스로신서방정' 등 모두 329개 품목을 위탁 생산하고 있다. 조 대표는 ""그간 제약 분야에서 쌓은 경쟁력을 바탕으로 안정적인 사업 포트폴리오를 확보해 피부·비뇨기 질환 의약품부터 CMO, 헬스케어, 코스메슈티컬(화장품+의약품)까지 아우르는 글로벌 기업으로 도약하겠다""고 강조했다. 내달 상장 예정인 동구바이오제약의 주당 공모 희망가 범위(밴드)는 1만2천∼1만4천500원이다. 오는 30∼31일 수요예측을 거쳐 내달 5∼6일 공모주 청약을 받는다. 주관사는 NH투자증권이다. 조용준 동구바이오제약 대표[동구바이오제약, IFG파트너스 제공=연합뉴스]"
파이낸셜뉴스,006620,/news/news_read.nhn?article_id=0004030007&office_id=014&mode=search&query=동구바이오제약&page=1,2018-05-29 16:54,"[공시]동구바이오제약, 33억5000억 신규 시설투자",동구바이오제약은 의약 및 CMO 사업 확장에 따른 생산능력 증대를 위해 33억5000만원 규모의 신규 시설 투자를 결정했다고 29일 공시했다.
머니투데이,006620,/news/news_read.nhn?article_id=0004055991&office_id=008&mode=search&query=동구바이오제약&page=1,2018-05-25 08:39,"동구바이오제약, 줄기세포치료기술 국책과제 선정","[머니투데이 김명룡 기자] [줄기세포 추출키트 ‘스마트엑스’ 사용한 자가면역질환 전신경화증 치료 임상 개시] 동구바이오제약이 개발한 줄기세포 추출키트 ‘스마트엑스’가 줄기세포 관련 국책과제에 선정됐다. 동구바이오제약은 보건복지부의 2018년도 제1차 보건의료기술연구개발사업에서 ‘난치성 전신경화증 환자의 수지궤양 및 피부괴사 치료를 위한 지방조직 유래 세포기질 분획(SVF)사용의 개념 증명’ 과제에 선정됐다고 25일 밝혔다. 이 과제는 동구바이오제약과 가톨릭대학교 서울성모병원 류마티스내과 곽승기·성형외과 문석호 교수팀이 산학협력한다. 동구바이오제약과 서울성모병원은 2020년까지 스마트엑스를 이용한 전신경화증 환자의 수지궤양 및 말단 피부괴사 치료기술을 연구하고 이를 신의료기술로 등록할 계획이다. 전신경화증은 인체결합조직 성분 중 콜라겐이 과다하게 생성·축적돼 피부가 두꺼워지거나 폐, 심장, 콩팥 등의 주요 장기 기능에 장애를 일으켜 온 몸이 굳는 질환이다. 아직까지 근본적인 치료제는 존재하지 않으며 국내에서는 희귀난치성질환으로 분류된다. 곽승기 교수는 “이번 연구는 향후 전신경화증 외 루푸스 등 난치성 자가면역질환의 수지궤양 및 피부괴사치료에도 확대 응용할 것”이라고 기대효과를 밝혔다. 한편, 스마트엑스는 환자의 지방을 흡입하고 그 지방에서 줄기세포를 추출해 성형·미용 또는 통증·자가면역치료를 목적으로 동일 환자에게 주입하는 1회용 의료기기다. 스마트엑스를 사용하면 보다 안전하고 경제적으로 재현율 높은 줄기세포를 추출할 수 있다. 현재 스마트엑스는 주요 대학, 종합병원의 교수들과 오픈 이노베이션(Open Innovation)을 통하여 SVF를 이용한 당뇨병성 족부궤양, 유방재건, 안면비대칭, 흉터치료 등 다양한 임상시험을 수행하고 있다. 또한 미국 클리브랜드클리닉(Cleveland Clinic(Florida)) 정형외과와 ‘어깨회전근개파열’ 임상을 금년 하반기에 개시할 예정으로 FDA등록과 동시에 북미에 진출 할 예정이다. 조용준 동구바이오제약 대표는 “극심한 통증뿐만 아니라 우울증같은 정신질환까지 동반될 수 있는 만성난치성질환 환자들에게 삶의 질을 높일 수 있는 기회를 제공할 수 있다는 점에서 큰 의미”라며 “앞으로 스마트엑스를 활용한 대규모 타깃 임상시험을 통해 다빈도·만성질환 치료 시장을 개척해 나가겠다”고 말했다."
파이낸셜뉴스,006620,/news/news_read.nhn?article_id=0004027309&office_id=014&mode=search&query=동구바이오제약&page=1,2018-05-25 08:45,"동구바이오제약, 줄기세포 치료기술 국책과제 선정","-줄기세포 추출키트‘스마트엑스’를 사용한 자가면역질환 전신경화증 치료임상 개시 동구바이오제약이 세계 최초로 개발한 줄기세포 추출키트 ‘스마트엑스’가 줄기세포 관련 국책과제에 선정됐다고 25일 밝혔다. 동구바이오제약은 보건복지부의 2018년도 제1차 보건의료기술연구개발사업에서 ‘난치성 전신경화증 환자의 수지궤양 및 피부괴사 치료를 위한 지방조직 유래 세포기질 분획(SVF)사용의 개념 증명’ 과제에 선정됐다. 해당 과제는 동구바이오제약과가톨릭대학교 서울성모병원 류마티스내과 곽승기, 성형외과 문석호 교수팀이 산학협력한다. 동구바이오제약과 서울성모병원은 2020년까지 스마트엑스를 이용한 전신경화증 환자의 수지궤양 및 말단 피부괴사 치료기술을 연구하고 이를 신의료기술로 등록할 계획이다. 전신경화증은 인체결합조직 성분 중 콜라겐이 과다하게 생성·축적되어 피부가 두꺼워지거나 폐, 심장, 콩팥 등의 주요 장기 기능에 장애를 일으켜 온 몸이 굳는 질환이다. 아직까지 근본적인 치료제는 존재하지 않으며 국내에서는 희귀난치성질환으로 분류된다. 곽승기 교수는 “이번 연구는 향후 전신경화증 외 루푸스 등 난치성 자가면역질환의 수지궤양 및 피부괴사치료에도 확대 응용할 것”이라고 기대효과를 밝혔다. 스마트엑스는 환자의 지방을 흡입하고 그 지방에서 줄기세포를 추출해 성형, 미용 또는 통증, 자가면역치료를 목적으로 동일 환자에게 주입하는 1회용 의료기기다. 스마트엑스를 사용하면 보다 안전하고 경제적으로 재현율 높은 줄기세포를 추출할 수 있다. 현재 스마트엑스는 주요 대학, 종합병원의 교수들과 오픈 이노베이션(Open Innovation)을 통해 SVF를 이용한 당뇨병성 족부궤양, 유방재건, 안면비대칭, 흉터치료 등 다양한 임상시험을 수행하고 있다. 또한 미국 클리브랜드클리닉 정형외과와 ‘어깨회전근개파열’ 임상을 금년 하반기에 개시할 예정으로 북미에 진출 할 예정이다. 동구바이오제약 조용준 대표이사는 “극심한 통증뿐만 아니라 우울증같은 정신질환까지 동반될 수 있는 만성난치성질환 환자들에게 삶의 질을 높일 수 있는 기회를 제공할 수 있다는 점에서 큰 의미”라며 “앞으로 스마트엑스를 활용한 대규모 타깃 임상시험을 통해 다빈도·만성질환 치료 시장을 개척해 나가겠다”고 말했다."
머니투데이,006620,/news/news_read.nhn?article_id=0004008670&office_id=008&mode=search&query=동구바이오제약&page=1,2018-02-13 09:13,"[특징주]동구바이오제약, 상장 첫날 상한가","[머니투데이 이태성 기자] 동구바이오제약이 코스닥시장 상장 첫날 상한가를 찍었다. 13일 오전9시11분 동구바이오제약 주식은 9600원(30.00%) 오른 4만1600원에 거래 중이다. 이날 시초가는 공모가(1만6000원)보다 100% 높은 3만2000원으로 결정됐다. 동구바이오제약은 지난 1970년 설립 후 피부과 처방 점유율 1위, 비뇨기과 처방 9위에 오른 회사다."
코메디닷컴,006620,/news/news_read.nhn?article_id=0000035965&office_id=296&mode=search&query=동구바이오제약&page=1,2018-05-25 11:25,"동구바이오제약, 전신 경화증 치료제 개발","동구바이오제약이 개발 판매 중인 줄기세포 추출 키트 스마트엑스가 전신 경화증 치료제로 개발된다. 이는 정부 주도 국책 과제로 선정됐다. 동구바이오제약은 보건복지부 주관 2018년도 제1차 보건의료 기술 연구 개발 사업에서 '난치성 전신 경화증 환자의 수지 궤양 및 피부 괴사 치료를 위한 지방 조직 유래 세포기질 분획(SVF, Stromal Vascular Fraction) 사용의 개념 증명'이 과제에 선정됐다고 25일 밝혔다. 해당 과제는 동구바이오제약과 가톨릭대학교 서울성모병원 류머티스내과 곽승기, 성형외과 문석호 교수팀이 공동 진행하며, 3년간 약 14억 원의 연구비를 지원받게 된다. 연구팀과 동구바이오제약은 예비 임상 연구 결과를 근거로 동물 모델, 전임상 실험으로 SVF 치료 효과와 작용 기전을 규명함과 동시에 환자 대상 임상 시험으로 효과를 추가 검증해 2020년까지 신의료 기술로 등록할 계획이다. 전신 경화증이란 결합 조직 성분 가운데 콜라겐이 과다하게 생성되고 축적돼, 피부가 두꺼워지거나 폐, 심장, 콩팥 등 주요 장기 기능에 장애를 일으켜 온 몸이 굳는 질환이다. 국소성 경화증은 피부의 일부분이 비대칭적으로 딱딱하게 변하는 증상을 일으킨다. 이에 비해 전신 경화증은 피부뿐 아니라 폐, 심장, 위장관, 콩팥 등 여러 내부 장기를 침범할 수 있는 만성 전신성 자가 면역 질환이다. 국내에서 희귀 난치성 산정 특례로 등록된 환자의 30%는 수지 궤양 및 피부 괴사가 나타나는데 현재까지 완치 치료법이 없다. 문석호 교수는 ""전신 경화증은 만성 난치성 질환으로 수부 궤양이나 피부 괴사와 같은 합병증과 우울증 같은 정신 질환까지 동반될 수 있다""며 ""환자 삶의 질을 높일 수 있도록 치료제 개발에 주력할 것""이라고 말했다. 곽승기 교수는 '이번 SVF를 이용한 전신 경화증 치료 기술 개발은 향후 루푸스 등 난치성 자가 면역 질환의 수지 궤양 및 피부 괴사 치료에도 확대 응용할 것""이라고 연구 기대 효과를 밝혔다. 동구바이오제약 조용준 대표이사는 ""치료 기회가 없던 환자에게 새로운 치료법을 부여한다는 점에서 큰 의미가 있다""며 ""앞으로 스마트엑스를 활용한 대규모 타깃 임상 시험을 통해 다빈도ㆍ만성 질환 치료 시장을 개척해 나가겠다""고 말했다. 스마트엑스는 환자 지방 조직에서 SVF를 추출해 성형 미용 또는 통증 자가 면역 치료를 목적으로 같은 환자에게 주입하는 1회용 의료 기기다. 스마트엑스를 사용하면 보다 안전하고 경제적으로 1시간 이내에 SVF를 추출할 수 있다. 현재 스마트엑스는 주요 대학, 종합병원의 교수들과 오픈 이노베이션을 통해 SVF를 이용한 당뇨병성 족부 궤양, 유방 재건, 안면 비대칭, 흉터 치료 등 다양한 임상 시험을 수행하고 있다. 또 미국 클리브랜드클리닉 정형외과와 '어깨회전근개파열' 임상을 올해(2018년) 하반기에 개시해 FDA 등록과 동시에 세계 의료 기기 1위 시장인 북미에 진출 할 예정이다."
