source,symbol,link,date,title,content
이데일리,006620,/news/news_read.nhn?article_id=0004166726&office_id=018&mode=search&query=동구바이오제약&page=1,2018-08-07 14:27,"동구바이오제약, 러시아 의료기기 시장 진출","줄기세포 추출키트 ‘스마트엑스’, 수출 계약 체결 [이데일리 김지섭 기자]동구바이오제약(006620)이 줄기세포 추출키트 수출로 러시아 시장에 진출한다. 동구바이오제약은 지난 6일 러시아 벨라시스텍과 줄기세포 추출키트 ‘스마트엑스’의 허가등록 및 수출계약을 체결했다고 7일 밝혔다. 벨라시스텍은 러시아 및 독립국가연합(CIS) 등에 의료기기 및 화장품을 유통하는 헬스케어 유통회사다. 이번 계약을 통해 동구바이오제약이 진출하는 러시아 의료기기 시장은 지난해 기준 약 480억달러 규모다. 동구바이오제약이 개발한 스마트엑스는 환자의 지방조직에서 줄기세포를 추출해 통증·자가면역치료 또는 성형·미용을 목적으로 동일 환자에게 주입하는 일회용 의료기기다. 동구바이오제약은 스마트엑스의 러시아 허가 등록 이후 벨라시스텍과의 협업을 통해 우크라이나, 카자흐스탄, 우즈베키스탄 등 주변 CIS 12개국으로의 추가 진출을 계획하고 있다. 김윤관 동구바이오제약 팀장은 “스마트엑스는 ‘당뇨병성 족부궤양 치료’에 대한 다기관 임상을 진행하고 있고 미국 클리블랜드 클리닉과 ‘회전근개파열 치료’에 대한 임상을 진행하는 등 다빈도 만성질환 등으로 적응증을 확대하고 있는 중”이라며 “향후 스마트엑스를 이용한 난치성질환의 비수술적 줄기세포 치료술을 발전시켜 세계 시장을 공략할 것”이라고 밝혔다. 지난 6일 조용준 동구바이오제약 대표(오른쪽 두 번째)와 러시아 벨라시스텍 관계자들이 줄기세포 추출키트 수출 계약을 체결하고 기념 촬영을 하고 있다.(사진=동구바이오제약)"
연합뉴스,006620,/news/news_read.nhn?article_id=0009886483&office_id=001&mode=search&query=동구바이오제약&page=1,2018-02-13 09:44,패션플랫폼㈜&middot;㈜동구바이오제약 코스닥시장 신규상장기념식,"(서울=연합뉴스) 13일 오전 서울 여의도 한국거래소에서 의류 제조업체인 패션플랫폼㈜ 및 전문의약품 제조업체인 ㈜동구바이오제약의 코스닥시장 신규상장기념식이 열리고 있다. 왼쪽부터 최규준 한국IR협의회 부회장, 신요환 신영증권 대표이사, 정운수 한국거래소 코스닥시장본부장 직무대행, 박원희 패션플랫폼㈜ 대표이사, 조용준 ㈜동구바이오제약 대표이사, 정영채 NH투자증권 IB사업부 대표, 김재철 코스닥협회 회장. 2018.2.13 [한국거래소 제공=연합뉴스]"
머니S,006620,/news/news_read.nhn?article_id=0000295605&office_id=417&mode=search&query=동구바이오제약&page=1,2018-02-13 09:30,"[특징주] 동구바이오제약, 상장 첫날 '상한가'",동구바이오제약이 상장 첫날 상한가를 기록했다. 13일 오전 9시26분 현재 동구바이오제약의 주식은 시초가인 3만2000원보다 가격상승제한폭까지 오른 4만1600원에 거래됐다. 이 회사의 공모가는 1만6000원이었다. 박기영 기자
한국경제TV,006620,/news/news_read.nhn?article_id=0000675264&office_id=215&mode=search&query=동구바이오제약&page=1,2018-08-24 14:20,"동구바이오제약, 11% 급등... 전일 보다 2,650원 상승한 27,650원","[한국경제TV 라이온봇 기자] [그림 1] 최근 3개월 간 주가 추세 및 기간별 수익률 동구바이오제약은 8월 24일 14시 19분 전일 대비 약 11% 급등한 27,650원에 거래되고 있다. 동구바이오제약은 코스닥 상장 기업으로 제약 업종에 속해 있다. 시가총액은 2,401억원으로 코스닥 상장기업 중 232위에 위치 해 있다. [종목 성향 진단] [그림 2] 종목 성향 진단 동구바이오제약의 투자 스타일은 성장주에 가깝다. 주가 고평가 우려가 공존하지만 높은 성장성이 기대되는 기업이다. 주가 모멘텀은 부진한 편이었다. 최근 6개월 수익률은 -27.33%의 하락폭을 기록했다. 최근 1개월 수익률 또한 -1.58% 하락하며 부진한 모멘텀을 이어가고 있다. 동구바이오제약 종목에 대한 투자자의 관심도는 평범한 수준이었다. [투자 점수 진단] [그림 3] 투자 점수 진단 동구바이오제약은 어느 측면에서 투자 매력도가 높은 종목일까? AI 인공지능 종목 분석 시스템을 이용해 성장성, 수익성, 효율성, 안전성, 저평가성, 추세 등 주가 수익률에 영향을 줄 수 있는 6가지 핵심 투자 지표를 점수화하여 종목의 투자 매력도를 계산해보았다. 그 결과 동구바이오제약은 상대적으로 수익성 측면에서 두각을 드러내고 있었다. 수익성 점수는 기업이 가진 자산과 자본을 활용하여 얼마나 이익을 실현했는지를 나타낸다. 동구바이오제약은 특히 ROA 측면에서 가장 높은 점수는 기록했는데, 전체 시장 내 231위를 기록하며 상위 11.55%에 위치했다. 업종별로는 26위를 기록하며 상위 11.68%에 위치했다. 그러나 기업 가치 대비 주가 수준을 나타내는 저평가 측면에서는 아쉬움을 나타냈다. (위의 AI인공지능 점수는 재무 데이터를 기반으로 전체 상장 종목과 비교/분석하여 도출한 점수로 높은 점수가 반드시 높은 수익률을 보장하지 않습니다. 위의 자료는 당사의 추천 종목이 아니며, 투자 시 참고용으로 제시해드리는 것입니다. 핵심투자지표를 결합해 종목의 투자매력도를 종합 계산한 ""인공지능 투자점수""는 ""거장들의 투자공식"" 앱에서 확인하실 수 있습니다.) 라이온봇 기자 -한국경제TV※ 본 기사는 한국경제TV와 '거장들의 투자공식이'자체 개발한 '라이온봇 기자'가 실시간으로 작성한 기사입니다. 라이온봇기자"
한국경제TV,006620,/news/news_read.nhn?article_id=0000675233&office_id=215&mode=search&query=동구바이오제약&page=1,2018-08-24 13:19,"동구바이오제약, 전일 대비 약 6% 상승한 26,500원","[한국경제TV 라이온봇 기자] [그림 1] 최근 3개월 간 주가 추세 및 기간별 수익률 동구바이오제약은 8월 24일 13시 18분 전일 대비 약 6% 상승한 26,500원에 거래되고 있다. 동구바이오제약은 코스닥 상장 기업으로 제약 업종에 속해 있다. 시가총액은 2,401억원으로 코스닥 상장기업 중 232위에 위치 해 있다. [종목 성향 진단] [그림 2] 종목 성향 진단 동구바이오제약의 투자 스타일은 성장주에 가깝다. 주가 고평가 우려가 공존하지만 높은 성장성이 기대되는 기업이다. 주가 모멘텀은 부진한 편이었다. 최근 6개월 수익률은 -27.33%의 하락폭을 기록했다. 최근 1개월 수익률 또한 -1.58% 하락하며 부진한 모멘텀을 이어가고 있다. 동구바이오제약 종목에 대한 투자자의 관심도는 평범한 수준이었다. [투자 점수 진단] [그림 3] 투자 점수 진단 동구바이오제약은 어느 측면에서 투자 매력도가 높은 종목일까? AI 인공지능 종목 분석 시스템을 이용해 성장성, 수익성, 효율성, 안전성, 저평가성, 추세 등 주가 수익률에 영향을 줄 수 있는 6가지 핵심 투자 지표를 점수화하여 종목의 투자 매력도를 계산해보았다. 그 결과 동구바이오제약은 상대적으로 수익성 측면에서 두각을 드러내고 있었다. 수익성 점수는 기업이 가진 자산과 자본을 활용하여 얼마나 이익을 실현했는지를 나타낸다. 동구바이오제약은 특히 ROA 측면에서 가장 높은 점수는 기록했는데, 전체 시장 내 231위를 기록하며 상위 11.55%에 위치했다. 업종별로는 26위를 기록하며 상위 11.68%에 위치했다. 그러나 기업 가치 대비 주가 수준을 나타내는 저평가 측면에서는 아쉬움을 나타냈다. (위의 AI인공지능 점수는 재무 데이터를 기반으로 전체 상장 종목과 비교/분석하여 도출한 점수로 높은 점수가 반드시 높은 수익률을 보장하지 않습니다. 위의 자료는 당사의 추천 종목이 아니며, 투자 시 참고용으로 제시해드리는 것입니다. 핵심투자지표를 결합해 종목의 투자매력도를 종합 계산한 ""인공지능 투자점수""는 ""거장들의 투자공식"" 앱에서 확인하실 수 있습니다.) 라이온봇 기자 -한국경제TV※ 본 기사는 한국경제TV와 '거장들의 투자공식이'자체 개발한 '라이온봇 기자'가 실시간으로 작성한 기사입니다. 라이온봇기자"
이데일리,006620,/news/news_read.nhn?article_id=0004034330&office_id=018&mode=search&query=동구바이오제약&page=1,2018-02-13 10:25,"코스닥, 외국인&middot;기관 매도에 '하락'..새내기株 동구바이오제약'上'","[이데일리 오희나 기자] 코스닥 지수가 외국인과 기관 매도에 하락세로 전환했다. 13일 오전 10시 18분 현재 코스닥 지수는 전거래일보다 3.02포인트(-0.36%) 내린 840.22에 거래되고 있다. 이날 852선으로 상승 출발한 지수는 외국인과 기관이 매도세를 확대하면서 하락 전환한 상황이다. 외국인과 기관은 각각 288억원, 205억원 순매도를 기록중이고, 개인은 761억원 순매수를 나타내고 있다. 시가총액 상위종목 가운데 셀트리온헬스케어(091990) 메디톡스(086900) 포스코켐텍(003670) 로엔(016170) 스튜디오드래곤(253450) 컴투스(078340) SK머티리얼즈(036490) 등은 오르고 있다. 반면 신라젠(215600) CJ E&M(130960) 바이로메드(084990) 셀트리온제약(068760) 펄어비스(263750) 코미팜(041960) 파라다이스(034230) 등은 하락세다. 개별종목에서는 이날 코스닥 시장에 신규상장한 동구바이오제약(006620)이 가격제한폭까지 올랐다."
이데일리,006620,/news/news_read.nhn?article_id=0004025681&office_id=018&mode=search&query=동구바이오제약&page=1,2018-02-02 13:47,"[마켓인]동구바이오제약, 공모가 1만6000원&hellip;희망밴드 상단 넘겨","- “공모자금 시설자금·R&amp;D 비용으로 사용” [이데일리 윤필호 기자] 동구바이오제약은 지난 30~31일 기관투자자를 대상으로 진행한 수요예측 결과 공모가가 1만6000원으로 최종 확정됐다고 2일 밝혔다. 공모가는 희망밴드가격(1만2000원~1만4500원)을 넘어선 가격이며, 총 공모금액은 331억원으로 확정됐다. 이번 수요예측에는 총 845곳에 달하는 기관투자자들이 참여해 727.7대 1의 경쟁률을 기록하며 마감했다. 공모희망밴드 상단가격을 넘어선 가격을 제시한 기관투자자는 전체 투자자의 95.38%에 이르렀다. 신청물량도 96.79%를 기록했다. 주관사인 NH투자증권은 “제약사업 부분의 안정적 수익성과 바이오분야의 성장성에 대해 국내외 기관들의 러브콜이 이어진 것으로 보인다”고 설명했다. 조용준 동구바이오제약 대표는 “코스닥 상장을 계기로 마련된 공모자금은 위탁생산(CMO) 사업부 추가 설비를 위한 시설자금과 연구개발(R&D) 비용으로 사용할 예정”이라며 “외형성장과 수익성 개선을 통해 2020년까지 매출액 2020억원대, 국내 30위권 혁신형 제약기업으로 발돋움해 삶의 질 향상을 선도하는 ‘비욘드 파마 코퍼레이션(Beyond Pharma Co)’이 되겠다”고 밝혔다. 조 대표는 “주주친화적인 공모가 제시로 투자자와 직원들에게 혜택이 돌아갈 수 있어 의미가 있었다. 향후 주주가치 극대화를 위해 노력하겠다”며 “제약과 바이오 기술을 융합해 진단, 예방, 치료, 관리 시장을 모두 커버할 수 있는 토탈 헬스케어 리더로 성장할 것”이라고 했다. 동구바이오제약의 일반 투자자 공모주 청약은 오는 5일~6일 양일간 진행되며, 전체 공모 물량 중 20%인 약 41만3824주가 배정될 예정이다. 이달 13일 코스닥 시장에 입성할 예정이다. 일반 투자자들은 주관사 NH투자증권을 통해 청약을 신청할 수 있다."
파이낸셜뉴스,006620,/news/news_read.nhn?article_id=0004071300&office_id=014&mode=search&query=동구바이오제약&page=1,2018-08-07 14:10,"동구바이오제약, '스마트엑스'로 러시아 시장 공략","조용준 동구바이오제약 조용준 대표이사(오른쪽 두 번째)와 벨라시스텍 관계자들이 기념사진을 찍고 있다.    동구바이오제약이 줄기세포 추출키트 수출로 러시아 시장에 진출한다. 동구바이오제약은 러시아 의료기기 유통회사 벨라시스텍과 줄기세포 추출키트 ‘스마트엑스’의 허가등록 및 수출계약을 체결했다고 7일 밝혔다. 동구바이오제약은 해당 러시아 의료기기 시장 규모가 지난 2017년 전년 대비 약 10% 성장해 2706억 루블(약 480억 달러) 규모에 이른 것으로 분석하고 있다. 오는 2020년에는 3,154억 루블(560억 달러)에 달할 것으로 예상하고 있다. 동구바이오제약과 계약을 체결한 벨라시스텍은 러시아 및 독립국가연합(CIS) 전역에 의료기기 및 화장품을 유통하는 헬스케어전문 유통회사다. 동구바이오제약이 개발한 줄기세포 추출키트 ‘스마트엑스’는 환자의 지방조직에서 줄기세포를 추출해 통증, 자가면역치료, 성형, 미용을 목적으로 동일 환자에게 주입하는 1회용 의료기기다. 동구바이오제약은 해당 제품이 기존 방식보다 안전성에서 우월하며 기존방식 대비 저비용으로 줄기세포 추출이 가능한 것이 특징이라고 강조한다. 동구바이오제약은 ‘스마트엑스’의 러시아 허가 등록 이후 벨라시스텍과의 협업을 통해 우크라이나, 카자흐스탄, 우즈베키스탄 등 주변 CIS 12개국으로의 추가 진출을 계획하고 있다. 동구바이오제약 김윤관 팀장은 “’스마트엑스’는 '당뇨병성 족부궤양 치료'에 대한 다기관 임상을 진행하고 있고 미국 클리블랜드 클리닉과 ‘회전근개파열 치료’에 대한 임상을 진행하는 등 다빈도 만성질환 등으로 적응증을 확대하고 있는 중”이라며 “향후 ‘스마트엑스’를 이용한 난치성질환의 비수술적 줄기세포 치료술을 발전시켜 세계 시장을 공략할 것”이라고 밝혔다."
한국경제,006620,/news/news_read.nhn?article_id=0003991849&office_id=015&mode=search&query=동구바이오제약&page=1,2018-08-07 11:27,"동구바이오제약, 러시아 의료기기 시장 진출","줄기세포 추출키트 ‘스마트엑스’, 수출 계약 체결 [ 전예진 기자  ] 조용준 동구바이오제약 대표이사(오른쪽 두번째)와 러시아 벨라시스텍의 의사들. 동구바이오제약 제공 동구바이오제약이 줄기세포 추출키트 수출로 러시아 시장에 진출한다. 동구바이오제약은 6일(현지시간) 러시아 의료기기 유통회사 벨라시스텍(Bella-Systech)과 줄기세포 추출키트 ‘스마트엑스’의 허가등록 및 수출계약을 체결했다고 7일 밝혔다. 동구바이오제약이 진출하게 되는 러시아 의료기기 시장은 연간 약 10%의 성장세를 보이고 있으며 지난해 기준 2706억 루블(약 480억 달러) 규모로 추정된다. KOTRA에 따르면 러시아 의료기기 시장은 2020년 3154억 루블(560억 달러)에 달할 것으로 예상된다. 동구바이오제약과 계약을 체결한 벨라시스텍은 러시아 및 CIS 전역에 의료기기 및 화장품을 유통하는 헬스케어전문 유통회사다. 러시아 의료진들을 대상으로 학술 세미나와 트레이닝 프로그램을 운영하는 등 마케팅 경험이 풍부한 것으로 평가되고 있다. 동구바이오제약은 발라시스텍을 통해 스마트엑스의 러시아 줄기세포 치료시장을 선점하고 통증치료시장을 확대할 수 있을 것으로 기대하고 있다. 동구바이오제약이 세계 최초로 개발한 줄기세포 추출키트 스마트엑스는 환자의 지방조직에서 줄기세포를 추출해 통증, 자가면역치료 또는 성형, 미용을 목적으로 동일 환자에게 주입하는 1회용 의료기기다. 기존 방식보다 안전성에서 우월하며 기존방식 대비 저비용으로 줄기세포 추출이 가능한 것이 특징이다. 동구바이오제약은 스마트엑스의 러시아 허가 등록 이후 벨라시스텍과의 협업을 통해 우크라이나, 카자흐스탄, 우즈베키스탄 등 주변 CIS 12개국으로의 추가 진출을 계획하고 있다. 김윤관 동구바이오제약 팀장은 “스마트엑스는 '당뇨병성 족부궤양 치료'에 대한 다기관 임상을 진행하고 있고 미국 클리블랜드 클리닉(Cleveland Clnic)과 ‘회전근개파열 치료’에 대한 임상을 진행하는 등 다빈도 만성질환 등으로 적응증을 확대하고 있다”며 “향후 스마트엑스를 이용한 난치성질환의 비수술적 줄기세포 치료술을 발전시켜 세계 시장을 공략하겠다”라고 말했다. 전예진 기자"
뉴스1,006620,/news/news_read.nhn?article_id=0003204816&office_id=421&mode=search&query=동구바이오제약&page=1,2018-02-13 09:36,패션플랫폼(주) 및 (주)동구바이오제약 코스닥시장 신규상장,"한국거래소 코스닥시장본부는 13일 오전 서울사옥 홍보관에서 패션플랫폼(주)과 (주)동구바이오제약의 코스닥시장 신규상장기념식을 개최했다. 상장기념패 전달 후 최규준 한국IR협의회 부회장(왼쪽부터), 신요환 신영증권 대표이사, 정운수 한국거래소 코스닥시장본부장 직무대행, 박원희 패션플랫폼(주) 대표이사, 조용준 (주)동구바이오제약 대표이사, 정영채 NH투자증권 IB사업부 대표, 김재철 코스닥협회 회장이 박수치고 있다. (한국거래소 제공) 2018.2.13/뉴스1"
매일경제,006620,/news/news_read.nhn?article_id=0004100068&office_id=009&mode=search&query=동구바이오제약&page=1,2018-02-13 09:25,동구바이오제약 상장 첫날 상한가&hellip;공모가 대비 160%&uarr;,"동구바이오제약이 화려한 코스닥 데뷔전을 치뤘다. 13일 코스닥에서 거래가 개시된 동구바이오제약은 시초가를 이미 3만2000원에 정했다. 공모가 1만6000원의 두배다. 장 개시 후에도 매수 주문이 폭주해 거래개시와 동시에 가격제한폭인 4만1600원까지 치솟았다. 공모가에 비하면 160%나 오른 가격이다. 이는 이달 신규 상장 종목 중에서도 가장 눈에 띄는 상승세다. 12일 상장한 알리코제약과 아시아종묘도 급등하면서 이 같은 분위기를 예고했다. 게다가 최근 중소형 제약주가 급등세를 기록하면서 투자 심리를 더욱 자극한 것으로 해석된다. 특히 제약·바이오업종 주가 흐름이 고공행진을 거듭하는 와중에도 상대적으로 낮은 공모가를 택해 눈길을 끌었다. 상장 전 6개 증권사가 리포트를 제출하면서 이같은 관심을 반영했다. 이달미 SK증권 연구원도 ""공모가에 비추어 2017년 기준 PER 은 약 13 배 수준이며, 이는 동종 중소 제약사들의 평균적으로 약 16 배에 거래되고 있는 부분을 감안하면 밸류에이션 매력도는 높은 수준인 것으로 판단된다""고 분석하기도 했다. [정우성 기자] r_start // r_end //"
한국경제,006620,/news/news_read.nhn?article_id=0003893601&office_id=015&mode=search&query=동구바이오제약&page=1,2018-02-13 11:11,"동구바이오제약, 상장 첫날 상한가 기록",[ 강영연 기자  ] 동구바이오제약이 상장 첫날인 13일 9600원(30.00%) 오른 4만1600원으로 상한가를 쳤다. 동구바이오제약은 1970년에 설립된 중소제약사다. 피부과 처방 1위 제약사로 피부비뇨기과 부문에서 경쟁력을 갖고 있다는 평가를 받는다. 지난해 3분기 기준으로 의약품 매출이 전체의 68%를 차지한다. 2016년부터 줄기세포배양액이 포함된 화장품 브랜드를 출시하며 사업 다각화에 힘쓰고 있다. 이달미 SK증권 연구원은 “정부의 치매국가책임제 시행으로 의약품위탁생산(CMO)사업부에서 생산하는 치매치료제 콜린알포세레이트의 고성장세가 기대된다”고 말했다.
파이낸셜뉴스,006620,/news/news_read.nhn?article_id=0004036217&office_id=014&mode=search&query=동구바이오제약&page=1,2018-06-08 11:33,"동구바이오제약, R&amp;D센터 판교로 확장 이전","동구바이오제약 판교 중앙연구소 내부 모습    동구바이오제약이 CMO 사업 확대에 따른 증설로 인한 공장의 공간 부족 및 우수인력 확보를 위해 R&D센터를 판교로 확장·이전한다. 동구바이오제약은 2020년 개발완료가 목표인 순환기 복합제를 비롯해 세계 최초로 개발하는 남성비뇨기질환 치료 3제 복합제, 소화기 복합제 등 퍼스트 개량신약의 효율적 연구를 위해 경기도 향남제약공단 내에 있던 R&D센터를 판교로 확장, 이전했다고 8일 밝혔다. 1758㎡ 규모의 R&D센터에서는 개량신약에 대한 연구는 물론 퍼스트제네릭, 줄기세포 의료기기, 바이오의약품 등에 대한 연구가 진행될 예정이다. R&D센터 내에는 코스메슈티컬 연구소도 개설돼 보다 전문적인 코스메슈티컬 제품 개발을 위한 연구도 본격화된다. 동구바이오제약은 R&D센터의 판교 이전 이후 수도권 소재의 대학교 및 연구전문 바이오벤처 등과의 오픈이노베이션을 통한 공동연구 네트워크를 강화할 계획이다. 동구바이오제약은 R&D 부문에 대한 투자를 지속해 고급 연구인력과 최신시설을 확충하고 개량신약 및 퍼스트제네릭 개발 전문성을 갖춘다는 방침이다. 동구바이오제약 관계자는 “R&D센터의 판교 이전으로 우수한 연구 인력 확보가 용이할 것으로 예상되며 연구조직 집중을 통해 제약과 바이오의 시너지 효과가 기대된다”며 “개량신약에서부터 코스메슈티컬까지 신성장 동력을 위한 R&D 투자를 아끼지 않을 것”이라고 말했다."
이데일리,006620,/news/news_read.nhn?article_id=0004025497&office_id=018&mode=search&query=동구바이오제약&page=1,2018-02-02 10:01,"동구바이오제약, '셀블룸' 모델로 배우 이요원 발탁","- 배우 이요원과 함께 셀블룸 재생크림 방송광고 온에어 [이데일리 정태선 기자] 동구바이오제약은 코스메슈티컬(기능성화장품) 브랜드 ‘셀블룸’ 광고모델로 배우 이요원을 발탁했다고 4일 밝혔다. 동구바이오제약 측은 “피부과 처방 1위 제약사가 만든 화장품 셀블룸의 전문적인 이미지와 도회적이면서도 자신만의 영역에서 프로페셔널한 모습을 보여주는 이요원의 이미지가 부합해 브랜드 모델로 선정했다”고 설명했다. 이요원이 출연한 방송광고는 이달부터 방영할 예정이다. 광고는 ‘미안하지만 당신이 고르지 마세요. 피부가 고르게 하세요’라는 도발적인 문구로 시작해 ‘피부를 잘 아는 동구바이오제약이 만드니까’라는 내용으로 이어진다. 9년간 피부과 처방 1위 자리를 이어가는 한편, 세계 최초 줄기세포 추출 키트를 만든 동구바이오제약의 전문성을 표현한 것이다. 신제품 ‘드래곤 리제너레이트 크림’은 줄기세포 배양액 1만ppm에 드래곤후르츠, 병풀 등 천연추출성분을 함유해 외부 자극에 손상된 피부를 진정하고 피부장벽을 강화하는 등 피부재생을 돕는 재생크림이다. 동구바이오제약 관계자는 “앞으로 셀블룸 브랜드 가치를 제고하면서도 회사 신뢰도를 쌓는 마케팅 활동을 통해 소비자와의 커뮤니케이션을 강화할 것”이라고 밝혔다. 한편 이요원은 6.4%로 동시간대 최고 시청률을 기록한 tvN 드라마 ‘부암동 복수자들’에 출연, ‘복자클럽’ 결성을 주도하는 대기업 막내딸 캐릭터를 소화해 국내는 물론 중국 등지에서도 호평을 받고 있다."
파이낸셜뉴스,006620,/news/news_read.nhn?article_id=0003964851&office_id=014&mode=search&query=동구바이오제약&page=1,2018-02-13 15:36,"[fnRASSI]오늘의 상한가, 동구바이오제약 % &uarr;","13일 동구바이오제약(006620), 알리코제약(260660), 좋은사람들(033340), 에스티큐브(052020)등이 상한가를 기록했다. 'fnRASSI'는 증권전문 기업 씽크풀과 파이낸셜뉴스의 협업으로 로봇기자가 실시간으로 생산하는 기사입니다."
