source,symbol,link,date,title,content
한국경제,006620,/news/news_read.nhn?article_id=0003885869&office_id=015&mode=search&query=동구바이오제약&page=1,2018-01-29 13:47,[상장예정기업]동구바이오제약 &quot;피부과 시장 경쟁력 기반으로 줄기세포&middot;화장품 진출&quot;,"""피부과 처방 1위 제약사라는 점을 기반으로 코스메슈티컬, 줄기세포 추출키트 등 분야로 사업을 다각화하고 있습니다. 올해는 본격적으로 신사업 분야에서 성과가 나올 전망입니다."" 조용준 동구바이오제약 대표. 사진=김근희 한경닷컴 기자 조용준 동구바이오제약 대표(사진)는 29일 서울 여의도 63빌딩에서 기업공개(IPO) 간담회를 열고 이같이 말했다. 조 대표는 ""2020년 매출 2020억원, 국내 30위 혁신형 제약 기업으로 도약하겠다""고 자신했다. 동구바이오제약은 1970년에 설립된 제약사로 9년간 피부과 처방 1위, 비뇨기과 처방 9위를 유지하고 있다. 이와 함께 의약품위탁생산(CMO), 헬스케어, 코스메슈티컬 등의 사업을 펼치고 있다. 의약품 시장에서는 선점 효과가 중요한 만큼 퍼스트 제네릭(가장 먼저 출시하는 복제약)과 개량신약을 먼저 내놓는 전략을 취하고 있다고 전했다. 조 대표는 ""피부·비뇨기과 신제품을 지속해서 개발하고 있다""며 ""제형 등을 다양화해 원조의약품의 특허를 회피하고, 우선판매품목허가를 획득해 제네릭(복제약)을 출시하고 있다""고 설명했다. 동구바이오제약은 건강한 피부 구조를 재현한 MLE 기술과 약물전달체계를 개선하는 DDS 기술 등을 보유하고 있다. 제조경쟁력을 바탕으로 CMO 사업도 운영 중이다. 지난해 매출의 30% 이상을 CMO가 차지할 정도로, 관련 사업이 급성장하고 있다고 전했다. 현재 회사는 치매치료제인 콜린알포세레이트도 위탁생산 중이다. 조 대표는 ""최근 치매 치료 국가책임제 시행에 따라 치매치료제 CMO 시장의 급성장이 예상된다""며 ""지난해 동구바이오제약의 콜린알포세레이트 매출은 약 453.4% 증가한 것으로 추산한다""고 말했다. 전체 실적도 성장세를 보였다. 지난해 3분기 매출액은 754억원으로 전년 동기보다 21% 상승했다. 영업이익은 116억원으로 94% 늘었다. 회사는 또한 피부과 시장에서의 강점을 바탕으로 줄기세포, 코스메슈티컬 등의 신사업에 진출했다. 동구바이오제약은 세계 최초 줄기세포 추출키트 '스마트X'의 개발을 마쳤다. 스마트X는 인체 특정 부위 지방에서 줄기세포를 추출해 가슴, 얼굴 등 다른 신체 부위에 주입하는 시술 장비다. 기존 보톡스, 필러보다 부작용이 적고 효과가 높다는 것이 회사 측의 설명이다. 조 대표는 ""미용시술뿐 아니라 당뇨병성 족부궤양 등 만성질환으로 스마트X의 적응증을 확대할 것""이라며 ""올해 말까지 연구자 주도 임상시험을 마치고, 내년 말에는 신의료기술 등재를 마무리할 것""이라고 밝혔다. 2016년 출시한 3D 줄기세포 배양액 화장품 셀블룸의 매출이 올해부터 본격적으로 장가할 것이란 전망이다. 회사는 올해 병원, 헬스앤뷰티스토어, 면세점 등에 제품을 납품할 계획이다. 조 대표는 ""셀블룸은 품질을 인정받아 지난해 아시아나 기내 면세점, 약국 등에 입점했다""며 ""중국과 수출계약을 체결하는 등 세계 시장으로도 성공적으로 진출하고 있다""고 설명했다. 동구바이오제약은 오는 30~31일 수요예측을 거쳐, 다음 달 5~6일 이틀간 청약을 시행한다. 2월 중 코스닥 시장에 상장될 예정이다. 주관사는 NH투자증권이다."
한국경제TV,006620,/news/news_read.nhn?article_id=0000671070&office_id=215&mode=search&query=동구바이오제약&page=1,2018-08-13 09:14,"동구바이오제약, 전일 대비 약 -6% 하락한 24,900원","[한국경제TV 라이온봇 기자] [그림 1] 최근 3개월 간 주가 추세 및 기간별 수익률 동구바이오제약은 8월 13일 9시 13분 전일 대비 약 -6% 하락한 24,900원에 거래되고 있다. 동구바이오제약은 코스닥 상장 기업으로 제약 업종에 속해 있다. 시가총액은 2,535억원으로 코스닥 상장기업 중 214위에 위치 해 있다. [종목 성향 진단] [그림 2] 종목 성향 진단 동구바이오제약의 투자 스타일은 성장주에 가깝다. 주가 고평가 우려가 공존하지만 높은 성장성이 기대되는 기업이다. 주가 모멘텀은 평범한 수준이었다. 최근 1개월 수익률이 1.13%, 3개월 수익률은 -13.5%, 6개월 수익률은 0%를 기록했다. 동구바이오제약 종목에 대한 투자자의 관심도는 평범한 수준이었다. [투자 점수 진단] [그림 3] 투자 점수 진단 동구바이오제약은 어느 측면에서 투자 매력도가 높은 종목일까? AI 인공지능 종목 분석 시스템을 이용해 성장성, 수익성, 효율성, 안전성, 저평가성, 추세 등 주가 수익률에 영향을 줄 수 있는 6가지 핵심 투자 지표를 점수화하여 종목의 투자 매력도를 계산해보았다. 그 결과 동구바이오제약은 상대적으로 수익성 측면에서 두각을 드러내고 있었다. 수익성 점수는 기업이 가진 자산과 자본을 활용하여 얼마나 이익을 실현했는지를 나타낸다. 동구바이오제약은 특히 ROE 측면에서 가장 높은 점수는 기록했는데, 전체 시장 내 194위를 기록하며 상위 9.69%에 위치했다. 업종별로는 16위를 기록하며 상위 7.08%에 위치했다. 그러나 기업 가치 대비 주가 수준을 나타내는 저평가 측면에서는 아쉬움을 나타냈다. (위의 AI인공지능 점수는 재무 데이터를 기반으로 전체 상장 종목과 비교/분석하여 도출한 점수로 높은 점수가 반드시 높은 수익률을 보장하지 않습니다. 위의 자료는 당사의 추천 종목이 아니며, 투자 시 참고용으로 제시해드리는 것입니다. 핵심투자지표를 결합해 종목의 투자매력도를 종합 계산한 ""인공지능 투자점수""는 ""거장들의 투자공식"" 앱에서 확인하실 수 있습니다.) 라이온봇 기자 -한국경제TV※ 본 기사는 한국경제TV와 '거장들의 투자공식이'자체 개발한 '라이온봇 기자'가 실시간으로 작성한 기사입니다. 라이온봇기자"
매일경제,006620,/news/news_read.nhn?article_id=0004096431&office_id=009&mode=search&query=동구바이오제약&page=1,2018-02-06 16:57,동구바이오제약 공모 흥행&hellip;경쟁률 836대 1,청약 증거금 2.8조 몰려 코스닥 상장을 앞둔 동구바이오제약 공모 청약이 흥행을 거뒀다. 6일 NH투자증권에 따르면 일반 투자자 대상 41만3824주 공모 청약에 3억4623만4690주가 몰렸다. 단순 경쟁률은 836.671대 1이다. 청약 증거금은 약 2조7693억원이다. 동구바이오제약은 앞서 지난달 기관 투자가 대상 수요 예측에서 희망가 상단(1만4500원)보다 높은 1만6000원에 공모가를 정한 바 있다. 오는 13일 코스닥에 상장할 예정이다. [정우성 기자] r_start // r_end //
한국경제TV,006620,/news/news_read.nhn?article_id=0000598051&office_id=215&mode=search&query=동구바이오제약&page=1,2018-02-02 14:19,"동구바이오제약, 공모가 1만6천원 확정&hellip;경쟁률 727.7대 1","[한국경제TV 박승원 기자] 동구바이오제약은 지난 30~31일 기관투자자를 대상으로 진행한 수요예측 결과, 공모가가 1만6,000원으로 최종 확정됐다고 2일 밝혔습니다. 이번 수요예측에는 총 845곳에 달하는 기관투자자들이 참여해 727.7대 1의 경쟁률을 기록했습니다. 공모가는 희망밴드가격(1만2,000원~1만4,500원)을 넘어선 가격인 1만6,000원으로 결정됐으며, 총 공모금액은 331억원으로 확정됐습니다. 공모희망밴드 상단가격을 넘어선 가격을 제시한 기관투자자는 전체 투자자의 95.38%였습니다. 주관사인 NH투자증권 관계자는 ""제약사업 부분의 안정적 수익성과 바이오분야의 성장성에 대해 국내외 기관들의 러브콜이 이어진 것으로 보인다""고 설명했습니다. 조용준 동구바이오제약 대표는 ""이번 코스닥 상장을 계기로 마련된 공모자금은 위탁생산(CMO) 사업부 추가 설비를 위한 시설자금과 연구개발(R&D) 비용으로 사용할 예정""이라며 ""외형성장과 수익성 개선을 통해 2020년까지 매출액 2,020억원대, 국내 30위권 혁신형 제약기업으로 발돋움하겠다""고 말했습니다. 조 대표는 이어 ""향후 주주가치 극대화를 위해 노력하겠다""며 ""제약과 바이오 기술을 융합해 진단, 예방, 치료, 관리 시장을 모두 커버할 수 있는 토탈 헬스케어 리더로 성장할 것""이라고 덧붙였습니다. 한편, 동구바이오제약의 일반 투자자 공모주 청약은 오는 2월5일~6일 양일간 진행되며, 전체 공모 물량 중 20%인 약 41만3,824주가 배정될 예정입니다. 일반 투자자들은 주관사인 NH투자증권을 통해 청약을 신청할 수 있습니다. 동구바이오제약은 이번달 13일 코스닥 시장에 입성할 예정입니다."
헤럴드경제,006620,/news/news_read.nhn?article_id=0001346854&office_id=016&mode=search&query=동구바이오제약&page=1,2018-01-29 09:01,"[IPO돋보기]동구바이오제약, 피부과 의약품 노하우로 화장품 시장에 올인","-피부과 제품 9년 연속 1위…코스닥에 다음달 13일 상장-화장품 사업ㆍ줄기세포…신사업 양 날개 구축 [헤럴드경제=김나래 기자] 국내 피부과 처방 1위 제약사인 동구바이오제약이 다음달 중순 코스닥에 입성한다. 신규사업인 화장품 시장에 집중하고 줄기세포 신약이라는 새로운 포트폴리오를 키워 나갈 계획이다. 29일 금융투자업계에 따르면 동구바이오제약의 최종 공모가는 오는 30일과 31일 수요 예측을 거쳐 정한다. 공모가 하단을 기준으로 하면 조달 금액은 248억원이다. 다음달 5일과 6일 일반투자자를 대상으로 공모 청약을 받는다. 청약 신청은 대표 주간사인 NH투자증권에서 할 수 있다. 코스닥에는 다음달 13일 상장한다. 동구바이오제약은 1970년에 설립된 완제의약품 제조업체다. 지난해 3분기 누적 매출을 기준으로 부문별 매출비중은 의약품 67.8%, 의약품위탁생산(CMO) 31.7%, 기타 0.5%다. 전문의약품은 피부·비뇨기과 계통 제품들이 주력 품목이다. 피부과 제품들은 9년 연속 국내 점유율 1위를 기록하고 있다. 동구바이오제약은 화장품과 제약을 결합한 코스메슈티컬에 진출해 올해부터 매출을 본격화할 계획이다. 화장품 브랜드 셀블룸을 지난해 출시했고, 기존 피부과와 헬스앤뷰티 스토어 입점을 추진하고 있다. 또 세계 최초로 줄기세포 추출 키트를 개발해 미용성형 치료 영역에서 활용 가능성을 모색하고 있다. 지난해에는 줄기세포 배양액 화장품을 출시한바 있다. 실적도 꾸준히 성장세다. 기존 사업은 안정적인 실적을 보이고 있고, 신사업은 가파른 성장세를 보이는 구조다. 지난해 9월 말 기준 매출액 754억원과 영업이익 116억원을 달성했다. 지난해 연간으로는 전년도 매출액 874억원과 영업이익 106억원을 뛰어넘을 것으로 추정된다. 한편, 희망 공모가 범위는 1만2000~1만4500원이다. 동구바이오제약은 공모가 산정에 PER(주가수익비율)기준 9~11배를 적용했다. 이동윤 한국투자증권 연구원은 “동구바이오제약의 올해 예상 영업이익은 전년대비 18.2% 증가한 175억원, 매출액은 18.8%늘어난 1200억원”이라며 “비교 가능 기업인 대원제약, 삼진제약, 유나이티드제약, 경동제약 등 중소형 4대 제약사의 올해 평균 PER가 15.4배임을 감안할 때 밸류에이션 매력이 돋보인다”고 분석했다."
파이낸셜뉴스,006620,/news/news_read.nhn?article_id=0003964395&office_id=014&mode=search&query=동구바이오제약&page=1,2018-02-13 09:21,"[특징주]동구바이오제약, 상장첫날 상한가..공모가 2배",동구바이오제약이 상장 첫날 상한가로 거래를 시작했다. 13일 오전 9시17분 현재 코스닥에서 동구바이오제약은 가격제한폭인 30% 상승한 4만1600원에 거래중이다. 동구바이오제약은 중소제약사다. 현재 주가는 공모가 1만6000원의 두배를 넘은 수준이다.
코메디닷컴,006620,/news/news_read.nhn?article_id=0000036205&office_id=296&mode=search&query=동구바이오제약&page=1,2018-06-08 16:03,"동구바이오제약, 연구개발센터 판교 시대 개막","동구바이오제약이 연구개발센터를 판교로 확장 이전한다고 8일 밝혔다. 2020년 개발 완료가 목표인 순환기 복합제를 비롯해 세계 최초로 개발하는 남성 비뇨기 질환 치료 3제 복합제, 소화기 복합제 등 퍼스트 개량 신약의 효율적 연구를 위해 경기도 향남제약공단 내에 있던 연구개발센터를 판교로 확장ㆍ이전하는 것. 1758제곱미터 규모의 연구개발센터에서는 개량 신약에 대한 연구는 물론 퍼스트 제네릭, 줄기세포 의료 기기, 바이오 의약품 등에 대한 연구가 진행된다. 또 코스메슈티컬 연구소도 개설돼 보다 전문적인 코스메슈티컬 제품 개발을 위한 연구도 본격화된다. 동구바이오제약은 연구개발센터의 판교 이전 이후 수도권 소재의 대학교 및 연구 전문 바이오 벤처 등과의 오픈 이노베이션을 통한 공동 연구 네트워크를 강화할 계획이다. 여기에 연구개발 부문 투자를 지속해 고급 연구 인력과 최신 시설을 확충하고 개량 신약 및 퍼스트제네릭 개발 전문성을 갖춘다는 방침이다. 동구바이오제약 관계자는 ""연구개발센터 판교 이전으로 우수한 연구 인력 확보가 용이할 것으로 예상되며 연구 조직 집중을 통해 제약과 바이오 시너지 효과가 기대된다""며 ""개량 신약에서부터 코스메슈티컬까지 신성장 동력을 위한 연구개발 투자를 아끼지 않을 것""이라고 말했다."
헤럴드경제,006620,/news/news_read.nhn?article_id=0001347104&office_id=016&mode=search&query=동구바이오제약&page=1,2018-01-29 11:35,"[IPO돋보기]&lsquo;화장품&middot;줄기세포&rsquo; 동구바이오제약, 내달 13일 코스닥 상장","전년 기준 매출액 754억 영업익 116억원 달성 국내 피부과 처방 1위 제약사인 동구바이오제약이 다음달 중순 코스닥에 입성한다. 신규사업인 화장품 시장에 집중하고 줄기세포 신약이라는 새로운 포트폴리오를 키워 나갈 계획이다. 29일 금융투자업계에 따르면 동구바이오제약의 최종 공모가는 오는 30일과 31일 수요 예측을 거쳐 정한다. 공모가 하단을 기준으로 하면 조달 금액은 248억원이다. 다음달 5일과 6일 일반투자자를 대상으로 공모 청약을 받는다. 청약 신청은 대표 주간사인 NH투자증권에서 할 수 있다. 코스닥에는 다음달 13일 상장한다. 동구바이오제약은 1970년에 설립된 완제의약품 제조업체다. 지난해 3분기 누적 매출을 기준으로 부문별 매출비중은 의약품 67.8%, 의약품위탁생산(CMO) 31.7%, 기타 0.5%다. 전문의약품은 피부·비뇨기과 계통 제품들이 주력 품목이다. 피부과 제품들은 9년 연속 국내 점유율 1위를 기록하고 있다. 동구바이오제약은 화장품과 제약을 결합한 코스메슈티컬에 진출해 올해부터 매출을 본격화할 계획이다. 화장품 브랜드 셀블룸을 지난해 출시했고, 기존 피부과와 헬스앤뷰티 스토어 입점을 추진하고 있다. 또 세계 최초로 줄기세포 추출 키트를 개발해 미용성형 치료 영역에서 활용 가능성을 모색하고 있다. 지난해에는 줄기세포 배양액 화장품을 출시한바 있다. 실적도 꾸준히 성장세다. 기존 사업은 안정적인 실적을 보이고 있고, 신사업은 가파른 성장세를 보이는 구조다. 지난해 9월 말 기준 매출액 754억원과 영업이익 116억원을 달성했다. 지난해 연간으로는 전년도 매출액 874억원과 영업이익 106억원을 뛰어넘을 것으로 추정된다. 한편, 희망 공모가 범위는 1만2000~1만4500원이다. 동구바이오제약은 공모가 산정에 PER(주가수익비율)기준 9~11배를 적용했다. 이동윤 한국투자증권 연구원은 “동구바이오제약의 올해 예상 영업이익은 전년대비 18.2% 증가한 175억원, 매출액은 18.8%늘어난 1200억원”이라며 “비교 가능 기업인 대원제약, 삼진제약, 유나이티드제약, 경동제약 등 중소형 4대 제약사의 올해 평균 PER가 15.4배임을 감안할 때 밸류에이션 매력이 돋보인다”고 분석했다."
파이낸셜뉴스,006620,/news/news_read.nhn?article_id=0004036447&office_id=014&mode=search&query=동구바이오제약&page=1,2018-06-08 16:57,"동구바이오제약, R&amp;D센터 판교로 확장&middot;이전",순환기 복합제 등 연구위해
이데일리,006620,/news/news_read.nhn?article_id=0004031597&office_id=018&mode=search&query=동구바이오제약&page=1,2018-02-09 17:48,[마켓인]동구바이오제약 코스닥 시장 신규상장,"[이데일리 김무연 기자] 한국거래소는 9일 동구바이오제약의 코스닥 시장 신규상장을 승인한다고 밝혔다. 매매 거래는 오는 13일부터 가능하다. 동구바이오제약은 피부·비뇨기과 완제의약품을 주력 상품으로 하는 의약품제조업체다. 공모가는 1만 6000원, 액면가는 500원이다."
파이낸셜뉴스,006620,/news/news_read.nhn?article_id=0004080829&office_id=014&mode=search&query=동구바이오제약&page=1,2018-08-24 10:43,[fnRASSI]동구바이오제약(006620) 현재 +9.4%,"현재 동구바이오제약(006620)은 전일대비 9.4% 상승하여 27,350원 선에서 거래가 이루어지고 있다.                   지표               항목               값               종합점수                 성장성               매출액증가율               0               4.64                 자기자본증가율               0                 안정성               부채비율               49.8               7.46                 유동비율               198.39                 이익안정성               0                 수익성               ROA               5.85               7.29                 ROE               8.76                 영업이익율               7.42          동구바이오제약의 퀀트 재무 점수는 19.39점으로 지난 분기에 비해 성장성 점수가 상승했다. 안정성 종합 점수는 부채비율 감소, 유동비율 증가로 상승했다. 수익성 측면에서 볼때 ROA, ROE, 영업이익률 모두 하락하여 이전보다 낮은 점수를 받았다. 주요 투자주체는 개인투자자 최근 한달간 주체별 거래비중을 살펴보면 개인이 84.77%로 가장 높은 참여율을 보였고, 기관이 8.48%를 보였으며 외국인은 6.74%를 나타냈다. 그리고 최근 5일간 거래비중은 개인이 83.51%, 외국인이 9.61%, 기관은 6.87%를 기록했다. 'fnRASSI'는 증권전문 기업 씽크풀과 파이낸셜뉴스의 협업으로 로봇기자가 실시간으로 생산하는 기사입니다."
한국경제TV,006620,/news/news_read.nhn?article_id=0000656839&office_id=215&mode=search&query=동구바이오제약&page=1,2018-07-04 12:19,"동구바이오제약, 전일 대비 약 4% 상승한 25,600원","[한국경제TV 라이온봇 기자] [그림 1] 최근 3개월 간 주가 추세 및 기간별 수익률 동구바이오제약은 7월 4일 12시 18분 전일 대비 약 4% 상승한 25,600원에 거래되고 있다. 동구바이오제약은 코스닥 상장 기업으로 제약 업종에 속해 있다. 시가총액은 2,372억원으로 코스닥 상장기업 중 237위에 위치 해 있다. [종목 성향 진단] [그림 2] 종목 성향 진단 동구바이오제약의 투자 스타일은 성장주에 가깝다. 주가 고평가 우려가 공존하지만 높은 성장성이 기대되는 기업이다. 주가 모멘텀은 좋지 못했다. 최근 3개월 수익률은 -39.19%의 하락폭을 기록했다. 최근 1개월 수익률 또한 -18.63% 하락하며 부진한 모멘텀을 이어가고 있다. 동구바이오제약 종목에 대한 투자자의 관심도는 평범한 수준이었다. [투자 점수 진단] [그림 3] 투자 점수 진단 동구바이오제약은 어느 측면에서 투자 매력도가 높은 종목일까? AI 인공지능 종목 분석 시스템을 이용해 성장성, 수익성, 효율성, 안전성, 저평가성, 추세 등 주가 수익률에 영향을 줄 수 있는 6가지 핵심 투자 지표를 점수화하여 종목의 투자 매력도를 계산해보았다. 그 결과 동구바이오제약은 상대적으로 수익성 측면에서 두각을 드러내고 있었다. 수익성 점수는 기업이 가진 자산과 자본을 활용하여 얼마나 이익을 실현했는지를 나타낸다. 동구바이오제약은 특히 ROE 측면에서 가장 높은 점수는 기록했는데, 전체 시장 내 189위를 기록하며 상위 9.46%에 위치했다. 업종별로는 15위를 기록하며 상위 6.67%에 위치했다. 그러나 주가 상승 모멘텀을 나타내는 추세 측면에서는 아쉬움을 나타냈다. (위의 AI인공지능 점수는 재무 데이터를 기반으로 전체 상장 종목과 비교/분석하여 도출한 점수로 높은 점수가 반드시 높은 수익률을 보장하지 않습니다. 위의 자료는 당사의 추천 종목이 아니며, 투자 시 참고용으로 제시해드리는 것입니다. 핵심투자지표를 결합해 종목의 투자매력도를 종합 계산한 ""인공지능 투자점수""는 ""거장들의 투자공식"" 앱에서 확인하실 수 있습니다.) 라이온봇 기자 -한국경제TV※ 본 기사는 한국경제TV와 '거장들의 투자공식이'자체 개발한 '라이온봇 기자'가 실시간으로 작성한 기사입니다. 라이온봇기자 ⓒ 한국경제TV, 무단 전재 및 재배포 금지 한국경제TV 관련뉴스해당 언론사에서 선정하며 언론사 페이지(아웃링크)로 이동해 볼 수 있습니다.재빠른 외국인…무역전쟁 터지자 '이 주식' 샀다중국 못지 않은 베트남 '공안'…호텔 벨보이도 조심하라'25kg 감량' 홍지민, 아파트 주민들도 배신감 느꼈다광어 '소비자 주의보'…부산 양식장서 '수은' 검출'브라질vs프랑스vs잉글랜드' 월드컵 8강 대진표, 우승팀 보인다"
파이낸셜뉴스,006620,/news/news_read.nhn?article_id=0003964845&office_id=014&mode=search&query=동구바이오제약&page=1,2018-02-13 15:34,"[fnRASSI]동구바이오제약,알리코제약 등 27종목 52주 신고가 경신","13일 동구바이오제약(006620), 알리코제약(260660), 에스티큐브(052020), 닉스테크(222810), 이상네트웍스(080010), 진매트릭스(109820)등이 장중 52주 신고가를 경신했다. 이외에 동신건설은 9780원까지 올라 신고가를 경신했으나, 전일보다 오히려 하락한 9,050원에 거래를 마감했다. 'fnRASSI'는 증권전문 기업 씽크풀과 파이낸셜뉴스의 협업으로 로봇기자가 실시간으로 생산하는 기사입니다."
