source,symbol,link,date,title,content
전자신문,010060,/news/news_read.nhn?article_id=0002696191&office_id=030&mode=search&query=OCI&page=16,2018-04-03 13:22,"[ET투자뉴스]OCI, &quot;실적보다 눈에 들어&hellip;&quot; 매수(유지)-SK증권","SK증권에서 3일 OCI(010060)에 대해 ""실적보다 눈에 들어오는 건 폴리실리콘 가격""라며 투자의견을 '매수(유지)'로 제시하였고, 아울러 목표주가로는 180,000원을 내놓았다. SK증권 손지우 애널리스트가 동종목에 대하여 이번에 제시한 '매수(유지)'의견은 SK증권의 직전 매매의견과 동일한 것이고 올해 초반의 매매의견을 기준으로  볼때도 역시 '매수'의견이 계속 유지되고 있는 상태이다. 그리고 최근 분기내 발표된 전체 증권사 리포트의 컨센서스와 비교를 해볼 경우에 오늘 발표된 투자의견은 전체의견을 소폭 상회하는 수준으로 평가되는데, 이는 동종목에 대한 기대감을 보다 공격적으로 표현한 것으로 분석되고 있다. 목표주가의 추이를 살펴보면 최근 두차례 연속 상향조정되다가 이번에는 직전 목표가와 동일한 수준을 유지하는 모습이다. 또한 전일 종가 기준으로 볼때 동종목의 현주가는 이번에 제시된 목표가 대비 14.6%의 저평가 요인이 존재한다는 해석이 제시되고 있다."
한국경제,010060,/news/news_read.nhn?article_id=0003847537&office_id=015&mode=search&query=OCI&page=30,2017-11-08 09:12,"[특징주]OCI, 제품 공급과잉 우려에 '하락'","OCI가 제품 공급과잉 우려에 장 초반 하락세다. 8일 오전 9시7분 현재 OCI의 주가는 전날보다 4000원(3.17%) 떨어진 12만2000원에 거래되고 있다. 이날 KB증권은 OCI가 폴리실리콘 공급과잉 문제에 다시 직면할 것이라며 투자의견을 '매수'에서 '중립'으로 하향 조정했다. 백영찬 KB증권 연구원은 ""폴리실리콘 수급 밸런스는 올해와 내년 유사한 흐름을 보이겠지만 중국 업체의 증설로 2019년부터는 공급과잉이 심화할 것""이라며 ""내년에는 중국의 분산형 발전 보조금 삭감에 따라 태양광 수요의 둔화도 우려된다""고 분석했다."
전자신문,010060,/news/news_read.nhn?article_id=0002671803&office_id=030&mode=search&query=OCI&page=26,2018-01-04 09:15,"[ET투자뉴스]OCI, &quot;중국이 견인하는 폴&hellip;&quot; 매수(유지)-미래에셋대우","미래에셋대우에서 4일 OCI(010060)에 대해 ""중국이 견인하는 폴리 호황, 목표가 상향""라며 투자의견을 '매수(유지)'로 제시하였다. 아울러 12개월 목표주가를 200,000원으로 내놓았다. 미래에셋대우 박연주, 김민경 애널리스트가 동종목에 대하여 이번에 제시한 '매수(유지)'의견은 미래에셋대우의 직전 매매의견을 그대로 유지하는 것이고 전년도말의 매매의견을 기준으로  볼때도 역시 '매수'의견이 계속 유지되고 있는 상태이다. 그리고 최근 분기내 발표된 전체 증권사 리포트의 컨센서스와 비교를 해볼 경우에 오늘 발표된 투자의견은 전체의견 대비해서 상대적으로 긍정적인 수준으로서 이는 동종목에 대한 기대감을 보다 강하게 표현한 것으로 분석되고 있다. 한편 12개월 목표주가로 제시한 200,000원은 직전에 발표된 목표가 170,000원 대비 17.6% 상향조정 된 것이고, 목표주가의 추이를 살펴보면 최근 3회이상 지속적으로 상향조정되는 모습이다. 또한 전일 종가 기준으로 볼때 동종목의 현주가는 이번에 제시된 목표가 대비 38.4%의 추가상승여력이 있다는 해석이 제시되고 있다."
머니투데이,010060,/news/news_read.nhn?article_id=0004066181&office_id=008&mode=search&query=OCI&page=7,2018-06-18 07:56,"OCI, 저점 매수 고민할 때-교보증권","[머니투데이 이태성 기자] 교보증권은 18일 OCI에 대해 ""저점 매수를 고민해야 할 시점""이라고 밝혔다. 투자의견 매수, 목표주가는 19만5000원으로 하향했다. 손영주 연구원은 ""중국 정책 규제에 따른 폴리실리콘(이하 폴리)의 적정가치 하향 및 DCRE 가치 상향으로 목표주가는 내렸다""면서도 ""중국 설치 점진적 회복 및 PBR 0.75배의 저평가 매력을 근거로 저점 매수를 추천한다""고 설명했다. 그는 ""2분기 연결 실적은 매출액 8378억원, 영업이익 782억원""이라며 ""3분기 영업이익은 777억원으로 예상된다""고 내다봤다. 이어 ""중국 규제 Shock 및 분기말 재고 소진 위한 투매의 결과인 바, 7월 이후 가격 반등이 예상된다""고 덧붙였다."
한국경제TV,010060,/news/news_read.nhn?article_id=0000618068&office_id=215&mode=search&query=OCI&page=16,2018-04-02 17:03,[국고처 이헌상] 종목상담 - OCI(010060),[한국경제TV 류장현 PD] [국고처 이헌상] 종목상담 - OCI(010060) 3월 31일 방송된 '국민주식고충처리반'에 출연한 이헌상파트너가 OCI(010060)에 대한 시세와 전망을 이야기하고 있다.
아이뉴스24,010060,/news/news_read.nhn?article_id=0000445113&office_id=031&mode=search&query=OCI&page=11,2018-04-27 10:26,이우현 사장 일가 OCI 지분 매각&hellip;상속세 위해 최대주주 포기,"[아이뉴스24 한상연 기자] 이우현 OCI 사장 일가가 대규모 지분을 매각했다. 이에 따라 이우현 사장은 최대주주 자리를 숙부인 이화영 유니드 회장에게 내주게 됐다. 故 이수영 OCI 회장으로부터 받은 지분에 과세될 상속세 납부를 위한 불가피한 선택으로 분석된다. 27일 금융감독원 및 OCI에 따르면 이우현 사장과 어머니 김경자 송암문화재단 이사장, 여동생 이지현 OCI 미술관장은 25일 보유 지분 중 87만8천513주를 시간외매매를 통해 매각했다. 당일 종가 기준 약 1400억원에 달하는 규모다. SK실트론은 이우현 사장 일가가 매각하고자 하는 지분의 절반이 넘는 47만6천987주를 753억원에 매입했다. 앞서 2016년 2월 OCI가 OCI머티리얼즈(현 SK머티리얼즈)를 SK에 매각하며 두 그룹은 협력적 관계를 구축한 바 있다. 이번 지분 매각으로 지분율은 이우현 사장 5.04%(1.08% 포인트↓), 김경자 이사장 0.83%(1.22% 포인트↓) 이지현 관장 1.89%(1.39% 포인트↓)로 각각 낮아졌다. 동시에 최대주주가 변경됐다. 故 이수영 회장의 동생인 이복영 삼광글라스 회장과 이화영 회장은 각각 5.40%와 5.43%의 OCI 지분을 보유하고 있다. 이우현 사장의 지분 매각으로 최대주주가 이화영 회장으로 바뀌게 됐다. 이우현 사장이 최대주주 자리를 내주면서까지 지분을 매각할 수밖에 없었던 것은 지난해 10월 작고한 아버지 이수영 회장으로부터 받은 재산에 대한 상속세를 내기 위한 선택으로 보인다. 이우현 사장 일가는 앞서 이달 13일 이 회장이 보유했던 지분 260만4천921주를 상속받았다. 이 사장은 절반이 넘는 133만9천674주를 받았고, 나머지는 김경자 이시장(48만3771주)과 이지현 관장(78만1476주)이 받았다. 고 이수영 회장의 피상속 지분 가치는 당일 종가(16만4천주) 기준 4272억원이다. 따라서 이우현 사장을 비롯해 가족 세 사람이 납부해야 할 상속세는 약 2136억원에 달한다. 일단 이우현 사장 일가는 절반 가까운 상속세를 마련했을 것으로 보인다. 25일 종가 15만8천원 기준으로 매각 대금은 약 1400억원이다. 여기에 매각 차익에 따른 양도소득세를 제외할 경우 실제 확보하게 될 자금은 약 1000억원 수준으로 파악된다. 남은 1천100억원에 달하는 상속세는 이번 지분 매각 후 남은 세 사람의 지분(약 185만주)을 담보로 대출을 해 납부할 가능성도 있다. 이 지분 가치는 26일 종가(16만500원) 기준 약 2천970억원이다. /한상연기자"
전자신문,010060,/news/news_read.nhn?article_id=0002715853&office_id=030&mode=search&query=OCI&page=7,2018-06-14 15:01,"[ET투자뉴스]OCI, &quot;2Q18 Previ&hellip;&quot; 매수-KTB투자증권","KTB투자증권에서 14일 OCI(010060)에 대해 ""2Q18 Preview: 중국 태양광 정책 변화로 수요 약세 우려""라며 투자의견을 '매수'로 제시하였고, 아울러 목표주가로는 135,000원을 내놓았다. KTB투자증권 이희철 애널리스트가 동종목에 대하여 이번에 제시한 '매수'의견은 KTB투자증권의 직전 매매의견에서 큰 변화없이 그대로 유지되는 것이고  올해 초반의 시장컨센서스에 비추어 본다면 '트레이딩매수'의견에서 '매수로' 상향조정된 것이다. 그리고 최근 분기내 발표된 전체 증권사 리포트의 컨센서스와 비교를 해볼 경우에 오늘 발표된 투자의견은 전체의견에 수렴하고 있어, 이번 의견은 시장의 평균적인 기대감이 객관적으로 표현된 것으로 분석되고 있다. 목표주가의 추이를 살펴보면 과거 상향조정되어오던 패턴이 한차례 정체구간을 보낸 후에 이번에 비교적 조정폭이 크게 줄어든 모습이다. 또한 전일 종가 기준으로 볼때 동종목의 현주가는 이번에 제시된 목표가 대비 17.9%의 저평가 요인이 존재한다는 해석이 제시되고 있다."
한국경제,010060,/news/news_read.nhn?article_id=0003890300&office_id=015&mode=search&query=OCI&page=20,2018-02-06 17:36,'1조 수주' OCI&hellip; 어두운 증시서 '반짝',"수주액, 작년 매출 40% 규모… 실적도 5년 만에 최대빅데이터 이 종목지난해 영업익 134% 늘어폴리실리콘 가격 상승세… 업황 개선 기대감 커져수익성·재무구조 모두 좋아져 신용등급 상향 '청신호' [ 강영연/노유정 기자  ] 태양광 기업 OCI가 6일 미국 시중금리 급등 등의 여파로 유가증권시장이 큰 폭의 조정을 받는 와중에도 강세를 보였다. 주력 제품인 폴리실리콘(태양전지 원재료) 판매량 증가에 힘입어 5년 만에 최대 실적을 낸 데다 전날 중국 기업과 1조1000억원 규모의 폴리실리콘 공급 계약까지 체결해 호재가 겹쳤다. ◆조정장에서 빛난 OCI OCI는 이날 유가증권시장에서 7000원(4.62%) 오른 15만8500원에 마감했다. 장중 한때 5.94%까지 오르는 등 하루 종일 강세를 이어갔다. LG화학(-0.38%), 롯데케미칼(-0.96%), 한화케미칼(-1.32%), 효성(-2.67%) 등 다른 화학주가 일제히 약세를 보인 것과 대조적이다. 외국인 투자자들은 올 들어 OCI를 2148억원 순매수하며 상승세를 이끌고 있다. OCI는 올 들어 16.54% 올랐다. OCI는 이날 작년 4분기 매출과 영업이익이 각각 8525억원과 1022억원을 기록해 전년 동기 대비 31.20%, 3664.29% 늘어났다고 공시했다. 작년 연간 영업이익은 2845억원으로 전년보다 134.54% 증가했다. 올해도 실적 개선 추세가 이어질 것이란 게 증권업계의 관측이다. 금융정보업체 에프앤가이드가 집계한 OCI의 올해 영업이익 컨센서스(증권사 전망치 평균)는 3780억원으로, 지난해보다 32.87% 늘어날 것으로 예상된다. 중국 기업 룽지 솔라와 1조1000억원 규모의 폴리실리콘 공급 계약을 체결했다고 전날 공시한 것도 호재로 작용했다. 이번 계약은 작년 OCI 매출의 40.19%에 해당하는 규모다. 손영주 교보증권 연구원은 “전 세계 1위 웨이퍼기업과의 계약으로 장기적인 파트너십을 이어갈 수 있을 것으로 기대된다”며 “작년 한 해 폴리실리콘 매출(1조500억원)보다 많은 규모를 한 번에 수주한 것”이라고 설명했다. ◆태양광 업황 개선 가능성 커 업황 개선에 대한 기대도 커지고 있다. 중국을 중심으로 태양광 제품 수요가 늘어나는 가운데 공급은 크게 늘지 않아서다. 손지우 SK증권 연구원은 “OCI는 작년에 말레이시아 공장을 인수해 생산량이 연간 2만t 이상 늘어 업황 개선의 혜택을 볼 것”이라고 설명했다. 최근 고순도 폴리실리콘(일반 폴리실리콘보다 30% 이상 발전 효율이 높은 재료) 수요가 늘고 있는 가운데 세계 시장에서 이를 공급할 수 있는 기업이 OCI 등 일부에 불과한 것도 긍정적인 요인으로 꼽힌다. 손영주 연구원은 “중국 정부는 작년 12월 OCI에 대한 반덤핑관세율을 4.4%로 상향 조정했다”며 “그런데도 룽지 솔라가 OCI와 계약한 건 세계 시장에서 초고순도 소재 수급이 원활하지 않다는 것을 의미한다”고 분석했다. 이에 따라 재무구조는 빠르게 개선되고 있다. 나이스신용평가는 작년 12월 수익성과 재무구조 개선 등을 이유로 ‘A0’(10개 투자 등급 중 6위 등급)인 OCI 신용등급 전망을 ‘안정적’에서 ‘긍정적’으로 상향 조정했다. 등급 전망이 긍정적이라는 것은 2년 내에 등급을 한 단계 올릴 수 있다는 의미다. 송미경 나이스신용평가 기업평가2실장은 “이익창출 능력이 늘어나고, 투자 부담은 감소해 현금흐름이 좋아지고 있다”며 “업황 회복과 제품 경쟁력 상승으로 수익성 개선도 기대된다”고 전망했다. 다만 한·미 간 태양광 관련 무역 분쟁과 폴리실리콘 가격 하락 반전 가능성은 변수로 꼽힌다. 이응주 신한금융투자 연구원은 “중국 기업들의 폴리실리콘 공급이 늘어날 것으로 예상되는 하반기부터가 문제”라고 말했다."
한국경제,010060,/news/news_read.nhn?article_id=0003916529&office_id=015&mode=search&query=OCI&page=16,2018-03-30 17:25,"[마켓인사이트]실적 확 바뀐 OCI, 7개월만에 공모채 발행","다음달 3년물 1000억원어치 발행안정화된 재무구조에 기관들 ‘관심’떨어지는 폴리실리콘 가격 ‘변수’로 ≪이 기사는 03월30일(17:12) 자본시장의 혜안 ‘마켓인사이트’에 게재된 기사입니다≫ OCI가 7개월 만에 공모 회사채 발행에 나선다. 큰 폭의 실적 개선으로 신용등급이 오를 가능성이 높아져 많은 기관투자가들이 관심을 보일 전망이다. 30일 투자은행(IB)업계에 따르면 OCI는 다음달 19일 3년 만기 회사채 1000억원어치를 발행할 계획이다. 기관투자가들을 상대로 한 수요예측(사전 청약)은 오는 12일 진행할 예정이다. 이번에 조달한 자금은 차입금 상환에 사용할 계획이다. 미래에셋대우와 KB증권이 채권 발행실무를 맡고 있다. OCI는 최근 실적 개선에 힘입어 재무적 부담을 줄여가고 있다. 이 회사의 지난해 매출은 3조6316억원으로 전년 대비 32.7%, 영업이익은 2845억원으로 114.7% 증가했다. 지난해 상반기 한 때 kg당 13달러대까지 떨어졌던 폴리실리콘 가격이 조금씩 상승하며 태양광사업 실적이 개선됐고, 석유·석탄사업도 유가 안정화로 원재료비 변동성이 줄어든 덕분에 이익을 늘렸다. 현금이 쌓이기 시작하면서 차입 부담도 눈에 띄게 줄어들고 있다. OCI의 지난해 말 기준 현금성자산은 1조347억원으로 전년보다 두 배 이상 증가했다. 상각전영업이익(EBITDA) 대비 총 차입금 비율도 1년간 5.3배에서 3.7배로 떨어졌다. 이같은 변화를 눈여겨본 국내 신용평가사들은 지난해 6월 이후 차례로 이 회사 신용등급(A)에 ‘긍정적’ 전망을 달았다. 신용등급 전망이 긍정적인 곳은 2년 이내에 등급이 오를 가능성이 높다. 회사채 시장에선 OCI의 달라진 모습을 지켜본 여러 기관들이 투자에 뛰어들 것이란 전망이 나온다. 다만 최근 폴리실리콘 가격이 하락세라는 점이 변수로 꼽힌다. 지난 1월 kg당 17달러대까지 올랐던 폴리실리콘 가격은 14.91달러(28일 기준)로 내려앉았다. 김진성 기자"
전자신문,010060,/news/news_read.nhn?article_id=0002716405&office_id=030&mode=search&query=OCI&page=7,2018-06-18 11:21,"[ET투자뉴스]OCI, &quot;PBR 0.7배 접&hellip;&quot; BUY(유지)-교보증권","교보증권에서 18일 OCI(010060)에 대해 ""PBR 0.7배 접근 中, 저점 매수 고민해야 할 시점""라며 투자의견을 'BUY(유지)'로 제시하였고, 아울러 목표주가로는 195,000원을 내놓았다. 교보증권 손영주 애널리스트가 동종목에 대하여 이번에 제시한 'BUY(유지)'의견은 교보증권의 직전 매매의견에서 큰 변화없이 그대로 유지되는 것이고  올해 초반의 매매의견을 기준으로  볼때도 역시 '매수'의견이 계속 유지되고 있는 상태이다. 그리고 최근 분기내 발표된 전체 증권사 리포트의 컨센서스와 비교를 해볼 경우에 오늘 발표된 투자의견은 전체의견에 수렴하고 있어, 이번 의견은 시장의 평균적인 기대감이 객관적으로 표현된 것으로 분석되고 있다. 목표주가의 추이를 살펴보면 한동안 정체구간을 보낸 후 이번에 목표가가 하향조정된 모습이다. 또한 전일 종가 기준으로 볼때 동종목의 현주가는 이번에 제시된 목표가 대비 78.1%의 저평가 요인이 존재한다는 해석이 제시되고 있다."
전자신문,010060,/news/news_read.nhn?article_id=0002671433&office_id=030&mode=search&query=OCI&page=28,2018-01-03 10:10,[ET투자뉴스]OCI(010060) 수주ㆍ공급계약 - &quot;Jinko Solar과 .,OCI(010060)는 상품공급에 관한 단일판매ㆍ공급계약체결을  3일에 공시했다.  해당공시의 주요내용은 다음과 같다. -. 계약명 : 폴리실리콘 -. 계약상대방 : Jinko Solar -. 판매 및 공급지역 : 중국 -. 계약금액 : 3572.5억원 -. 회사의 최근매출액 : 2.74조원 -. 매출액 대비 비중(%) : 13% -. 계약기간 : 2018년 1월3일 ~ 2019년 12월31일( 계약기간 총 727일) -. 계약(수주)일자 : 2018년 01월 3일
파이낸셜뉴스,010060,/news/news_read.nhn?article_id=0003936691&office_id=014&mode=search&query=OCI&page=26,2018-01-04 10:40,"[fnRASSI]OCI(010060), 52주 신고가 경신...6.57% &uarr;","OCI(010060)는 52주신고가를 기록하고 있어 주목할만하다. 동종목의 현재 주가는 154,000원 선에서 이루어지고 있다. 거래일을 기준으로 최근 3일간 평균 거래량은 54만 주이다. 이는 60일 일 평균 거래량 32만 주와 비교해보면 최근 거래량이 다소 증가했다는 것을 알 수 있다. 외국인, 기관 모두 보유량 증가 (5일 누적) 최근 5일간 동종목의 외국인 투자자는 207,249주 순매수하였고 마찬가지로 기관은 85,244주 순매수하였다. 전날 두 주체 각각 124,858주, 85,244주 순매수하며 보유 비율을 늘렸다. 다음 표는 동종목의 외국인, 기관의 일별 순매수량을 나타낸 것이다. 외국인/기관 순매수, 개인은 순매도(한달누적)  12월28일부터 전일까지 기관이 3거래일 연속 순매수했다. 4주간을 기준으로 보면 외국인이 순매수량을 늘리며 519,046주를 순매수했고, 기관도 초반에 동종목을 순매수한 이후에 기세를 이어가며 339,372주를 순매수했다. 반면 개인들은 매도 관점으로 접근하면서 858,418주를 순매도한 것으로 나타났다. 'fnRASSI'는 증권전문 기업 씽크풀과 파이낸셜뉴스의 협업으로 로봇기자가 실시간으로 생산하는 기사입니다."
파이낸셜뉴스,010060,/news/news_read.nhn?article_id=0003932662&office_id=014&mode=search&query=OCI&page=28,2017-12-28 14:54,"[fnRASSI]OCI(010060), 52주 신고가...5.04% &uarr;","OCI(010060)는 52주신고가를 기록하고 있어 주목할만하다. 동종목의 현재 주가는 136,000원 선에서 이루어지고 있다. 거래일을 기준으로 최근 3일간 평균 거래량은 25만 주이다. 이는 60일 일 평균 거래량 31만 주와 비교해보면 최근 거래량이 다소 감소했다는 것을 알 수 있다. 거래비중 기관 16.82%, 외국인 27.95% 최근 한달간 주체별 거래비중을 살펴보면 개인이 전체 거래량의 55.21%를 차지하며 가장 활발한 참여를 보였고, 외국인은 27.95%, 기관은 16.82%의 거래 참여율을 보였다. 그리고 최근 5일간 거래비중은 개인 비중이 53.44%로 가장 높았고, 외국인이 27.31%로 그 뒤를 이었다. 기관은 19.24%를 나타냈다. 외국인 보유량 증가, 기관 감소 (5일 누적) 최근 5일간 동종목의 외국인 투자자는 168,172주 순매수하였고 반면 기관은 39,583주 순매도하였다. 전날 외국인 12,489주 순매수, 기관39,583주 순매도하며 보유 비율이 변동했다. 다음 표는 동종목의 외국인, 기관의 일별 순매수량을 나타낸 것이다. 'fnRASSI'는 증권전문 기업 씽크풀과 파이낸셜뉴스의 협업으로 로봇기자가 실시간으로 생산하는 기사입니다."
머니투데이,010060,/news/news_read.nhn?article_id=0004043230&office_id=008&mode=search&query=OCI&page=12,2018-04-26 07:41,"OCI, 최대주주 이우현외 36인&rarr;이화영외 37인",[머니투데이 김소연 기자] OCI는 이우현 사장이 시간외매매로 OCI 보통주 25만7466주를 처분함에 따라 최대주주가 기존 이우현외 36인에서 이화영외 37인으로 변경된다고 26일 공시했다. 바뀐 최대주주는 OCI 주식 603만106주(지분율 25.28%)를 보유하고 있다.
데일리안,010060,/news/news_read.nhn?article_id=0002228141&office_id=119&mode=search&query=OCI&page=29,2017-12-14 11:47,"OCI, &lsquo;1만장 연탄나눔&rsquo; 봉사활동 실시","김재신 OCI 사장(앞줄 오른쪽에서 네 번째)이 14일 서울시 노원구 중계동 백사마을 쪽방촌에 임직원들과 1만장의 연탄 나눔과 배달봉사를 한 후 기념촬영을 하고 있다. ⓒOCI OCI가 최근 갑자기 찾아온 매서운 한파로 난방에 어려움을 겪을 이웃들에게 따뜻한 온정을 담아 ‘1만장의 연탄배달’ 나눔을 실천했다. OCI(대표 이우현)는 14일 자원봉사대를 구성해 서울시 노원구 중계동 백사마을 쪽방촌에 사는 독거노인 및 저소득층 가구에 연탄 1만장을 기부하고 집집마다 연탄을 배달하는 봉사활동을 펼쳤다고 밝혔다. 이 날 행사에는 김재신 최고운영책임자(COO·사장)를 비롯, 김유신 카본사업본부장(전무), 김기홍 케미칼사업본부장(전무) 등 산하 임직원 40여 명으로 참여했다. 이 날 행사는 소외계층의 서민들이 추위로 고생하는 동절기 겨울을 따뜻하게 보내도록 돕자는 취지에서 지난 2009년부터 연탄은행(대표 허기복)과 함께 운영해 온 OCI의 대표적인 연말 봉사활동이다. 김재신 사장은 “연탄값이 많이 올라서 난방비가 부담되는 이웃들에게 작은 정성이지만 도움이 되기를 바란다""며 ""앞으로도 소외된 계층들에 대해 지속적으로 관심을 갖고 그 분들께 필요한 나눔을 실천해 나가겠다”고 말했다. 한편 OCI는 전사 차원에서 매년 임직원들의 자발적인 기부로 ‘1004기금’을 조성해 본사를 포함해 군산·광양·포항 등 전국 5개 사업장 및 연구소에서는 ‘신생아 모자뜨기’, ‘김장나눔’, ‘쌀기부’,’연탄 및 난방유 나눔’ 등 다양한 월동 지원활동을 전개하고 있다."
뉴시스,010060,/news/news_read.nhn?article_id=0008543037&office_id=003&mode=search&query=OCI&page=15,2018-04-13 17:46,"OCI, 최대주주 이우현 외 36명으로 변경",【서울=뉴시스】장서우 기자 = OCI(010060)는 이우현 대표가 고(故) 이수영 회장으로부터 133만9674주를 상속받아 지분이 6.12%로 늘어났다고 13일 공시했다. 이에 따라 OCI의 최대주주는 '이수영 외 36인'에서 '이우현 외 36인'으로 변경됐다. 이들은 전체 주식의 28.79%를 보유하고 있다.
머니S,010060,/news/news_read.nhn?article_id=0000326528&office_id=417&mode=search&query=OCI&page=6,2018-06-28 15:17,[공시] OCI &quot;물적분할 따른 법인세 등 부과처분 취소소송 일부 승소&quot;,"OCI는 물적분할에 따른 법인세 및 지방세 등 부과처분 취소의 소에서 승소했다고 28일 공시했다. OCI 측은 ""2013년 남대문세무서 등으로부터 법인세 등을 부과 받고 그 중 3001억원에 대해 제기한 '법인세 등 부과처분 취소의 소'가 대법원의 판결로 당사 일부 승소 확정됐다""고 밝혔다. 이어 “OCI의 종속회사 ㈜디씨알이가 2012년 인천광역시 남구청 등으로부터 취득세 등을 부과받고 그 중 1712억원에 대해 제기한 '취득세 등 부과처분 취소의 소'의 경우, 대법원의 판결로 디씨알이의 전부 승소 확정됐다”고 설명했다. OCI는 2008년 8월 남대문세무서 등으로부터 종속회사인 ㈜디씨알이의 2008년 물적분할과 관련한 설립 당시 이연 받은 법인세를 부과 받았다. 이후 2016년 2심에서 일부 승소하면서 OCI는 법인세 환급예상액 및 환급가산금을 재무제표에 반영해 왔다. OCI 측은 “대법원 판결에 따라 OCI는 이미 납부한 법인세 등의 환급으로 현금이 유입될 예정”이라면서 “다만 재무제표에 반영된 금액과 실제 환급금액은 차이가 있을 수 있다”고 덧붙였다."
