source,symbol,link,date,title,content
한국경제TV,010060,/news/news_read.nhn?article_id=0000613930&office_id=215&mode=search&query=OCI&page=16,2018-03-22 11:03,"OCI, 10% 급등... 전일 보다 14,500원 상승한 157,500원","[한국경제TV 라이온봇 기자] OCI는 3월 22일 11시 2분 전일 대비 약 10% 급등한 157,500원에 거래되고 있다. OCI는 코스피 상장 기업으로 화학 업종에 속해 있다. 시가총액은 3조4,343억원으로 코스피 상장기업 중 78위에 위치 해 있다. [종목 성향 진단] [그림 1] 종목 성향 진단 OCI의 투자 스타일은 가치주에 가깝다. 기업 가치 대비 낮은 주가가 매력적인 기업이다. 주가 모멘텀은 부진한 편이었다. 최근 1개월 수익률은 -10%의 하락폭을 기록했다. OCI 종목에 대한 투자자의 관심도는 굉장히 높은 편이다. [투자 점수 진단] [그림 2] 투자 점수 진단 OCI는 성장성(매출증가율(YoY)) 측면에서 두각을 나타내고 있다. 최근 매출증가율(YoY)은 87점으로 6개의 핵심 팩터 중 가장 높은 점수를 기록했다. 매출증가율(YoY)은  전체 시장 내 91위를 기록하며 상위 12.6%에 위치했다. 업종별로는 10위를 기록하며 상위 7.44%에 위치했다. 그리고 수익성(영업이익률) 역시 도드라지는 편이다. 수익성 점수는 84점으로 두번째로 높은 점수를 기록했다. 영업이익률은 전체 시장 내 138위를 기록하며 상위 15.86%에 위치했다. 업종별로는 14위를 기록하며 상위 9.03%에 위치했다. 그러나 부채비율이 아쉬움을 나타냈다. [종합 투자점수] [그림 3] 종합 투자점수 AI 인공지능 분석을 통한 OCI의 종목 종합 스코어는 83점을 기록했다. 이는 동일 업종 평균점수인 59점과 시장 평균점수인 55점를 상회하는 수치였다. (위의 AI인공지능 점수는 재무 데이터를 기반으로 전체 상장 종목과 비교/분석하여 도출한 점수로 높은 점수가 반드시 높은 수익률을 보장하지 않습니다. 위의 자료는 당사의 추천 종목이 아니며, 투자 시 참고용으로 제시해드리는 것입니다.) 라이온봇 기자 -한국경제TV※ 본 기사는 한국경제TV와 '거장들의 투자공식이'자체 개발한 '라이온봇 기자'가 실시간으로 작성한 기사입니다. 라이온봇기자 ⓒ 한국경제TV, 무단 전재 및 재배포 금지 한국경제TV 관련뉴스해당 언론사에서 선정하며 언론사 페이지(아웃링크)로 이동해 볼 수 있습니다.노현정, 故 정주영 회장 제사 현장 포착…'더 예뻐졌네'골프여왕 박인비, 외모 때문에 메인스폰서 없었던 사연은?신성일, ""보디빌더 나갔다""던 리즈시절 사진 봤더니설현, 원주민도 반한 사연…만국 공통 몸매?'문재인 대통령 노벨상 추진위' 해산 이유"
한국경제TV,010060,/news/news_read.nhn?article_id=0000640191&office_id=215&mode=search&query=OCI&page=10,2018-05-30 11:02,"OCI, 전일 대비 약 -4% 하락한 134,000원","[한국경제TV 라이온봇 기자] OCI는 5월 30일 11시 1분 전일 대비 약 -4% 하락한 134,000원에 거래되고 있다. OCI는 코스피 상장 기업으로 화학 업종에 속해 있다. 시가총액은 3조4,104억원으로 코스피 상장기업 중 81위에 위치 해 있다. [종목 성향 진단] [그림 1] 종목 성향 진단 OCI의 투자 스타일은 가치주에 가깝다. 기업 가치 대비 낮은 주가가 매력적인 기업이다. 주가 모멘텀은 부진한 편이었다. 최근 3개월 수익률은 -11.21%의 하락폭을 기록했다. 최근 1개월 수익률 또한 -9.81% 하락하며 부진한 모멘텀을 이어가고 있다. OCI 종목에 대한 투자자의 관심도는 굉장히 높은 편이다. [투자 점수 진단] [그림 2] 투자 점수 진단 OCI는 수익성(영업이익률) 측면에서 두각을 나타내고 있다. 최근 영업이익률은 86점으로 6개의 핵심 팩터 중 가장 높은 점수를 기록했다. 영업이익률은  전체 시장 내 261위를 기록하며 상위 14.23%에 위치했다. 업종별로는 26위를 기록하며 상위 11.47%에 위치했다. 그리고 저평가성1(PER) 역시 도드라지는 편이다. 저평가성1 점수는 76점으로 두번째로 높은 점수를 기록했다. PER은 전체 시장 내 365위를 기록하며 상위 23.99%에 위치했다. 업종별로는 69위를 기록하며 상위 34.69%에 위치했다. 그러나 매출증가율(YoY)과 부채비율은  아쉬움을 나타냈다. [종합 투자점수] [그림 3] 종합 투자점수 AI 인공지능 분석을 통한 OCI의 종목 종합 스코어는 73점을 기록했다. 이는 동일 업종 평균점수인 60점과 시장 평균점수인 58점를 상회하는 수치였다. (위의 AI인공지능 점수는 재무 데이터를 기반으로 전체 상장 종목과 비교/분석하여 도출한 점수로 높은 점수가 반드시 높은 수익률을 보장하지 않습니다. 위의 자료는 당사의 추천 종목이 아니며, 투자 시 참고용으로 제시해드리는 것입니다.) 라이온봇 기자 -한국경제TV※ 본 기사는 한국경제TV와 '거장들의 투자공식이'자체 개발한 '라이온봇 기자'가 실시간으로 작성한 기사입니다. 라이온봇기자 ⓒ 한국경제TV, 무단 전재 및 재배포 금지 한국경제TV 관련뉴스해당 언론사에서 선정하며 언론사 페이지(아웃링크)로 이동해 볼 수 있습니다.전혜진 완벽한 몸매, '이 정도일 줄은'""정준호 판박이"" 이하정 아나운서, 훌쩍 큰 아들 공개한진家 이명희 해외 갑질 폭로에 누리꾼 ""이게 사실이라면...""이선희 집 공개…탁 트인 한강뷰에 깔끔 인테리어이천희 가구 '하이브로우', '공작소'에서 브랜드가 되기까지"
이데일리,010060,/news/news_read.nhn?article_id=0004115421&office_id=018&mode=search&query=OCI&page=8,2018-05-31 12:59,"[이데일리N] OCI, 부광약품과 손잡고 신약 개발 나서&hellip;합작사 설립 外","[이데일리N] 1. 산업생산 1.5％ 증가…소비·설비투자 동반하락 2. 문재인 대통령, 국가재정전략회의 개최…예산 운용 논의 3. 땅값 10년 만에 최대 상승…보유세 인상 예고 4. 기업 경기전망 다시 ‘부정적’ 후퇴…“유가상승 영향” 5. 오늘 삼상바이오로직스 3차 감리위…최종 결론 도출 주목 6. OCI, 부광약품과 손잡고 신약 개발 나서…합작사 설립 7. 진에어 등 35개사 주식 6월 의무보호예수 해제 -국민연금, 국내증시 비중 축소…신규자금 안 넣는다 - 제약업계, 리베이트 꼬리표 뗀다…반부패시스템 도입 - LG폰 해외전략 변경…맞춤형 제품, 미국·유럽 우선 출시 - “뭉쳐야 뜬다” 식품업계 이색 ‘콜라보’ 열풍"
한국경제TV,010060,/news/news_read.nhn?article_id=0000583358&office_id=215&mode=search&query=OCI&page=30,2017-11-21 09:44,[국고처 류태형] 종목상담 - OCI(010060),[한국경제TV 류장현 PD] [국고처 류태형] 종목상담 - OCI(010060) 11월 18일 방송된 `국민주식고충처리반`에 출연한 류태형 파트너가 OCI(010060)에 대한 시세와 전망을 이야기하고 있다.
헤럴드경제,010060,/news/news_read.nhn?article_id=0001392081&office_id=016&mode=search&query=OCI&page=10,2018-05-11 11:34,유가 급등세&hellip;&lsquo;태양광 쌍두마차&rsquo; OCI&middot;한화케미칼 볕드나,"미국의 이란 핵협정 탈퇴 선언 이후 국제 유가가 급등세를 보이는 가운데 국내 증시에서도 관련주들 간의 희비가 엇갈리고 있다. 증권업계는 지정학적 리스크로 인한 유가 상승 시에는 정유ㆍ조선주보다 태양광 같은 대체 에너지 종목에 눈을 돌릴 필요가 있다고 말한다. 11일 뉴욕상업거래소(NYMEX)에 따르면 6월 인도분 서부텍사스산원유(WTI)는 전날보다 배럴당 0.22달러(0.3%) 상승한 71.36달러에 거래를 마쳤다. WTI는 미국 정부의 이란 핵협정 탈퇴 선언 전인 지난 7일 이미 70.73달러를 기록하며 2014년 11월 이후 3년 6개월 만에 70달러를 넘어섰다. 시장은 석유 매장량 세계 4위인 이란발 공급 변수에 촉각을 곤두세우고 있다. 트럼프 행정부가 이란 핵협정 파기에 이어 ‘대 이란 제재’에 돌입할 경우 이란의 석유 수출이 묶이면서 유가 시장은 또 한번 요동칠 것으로 보인다. 과거 걸프전, 이라크전 등 중동 정세가 악화될 때마다 급등세를 보인 유가 시세는 국내 건설주와 조선ㆍ정유주에게 악재가 됐다. SK증권에 따르면 대규모 이란 경제제재가 단행된 지난 2008년 3월 유가는 3개월 만에 45.9% 급등하며 사상 최대 랠리에 시동을 걸었다. 곧바로 건설ㆍ조선ㆍ정유주 등 유가 민감주는 2주간 20% 안팎의 하락세를 보이며 타격을 입었다. 반면 태양광주는 2.1% 하락하는 데 그쳐 같은 기간 코스피 수익률(-7.9%)을 크게 웃돌았다. 정유주의 경우 유가 급등으로 원가부담이 발생하면서 정제마진 하락에 대한 우려가 반영된 것으로 풀이된다. 건설업계 역시 당시 최대 발주처인 중동 경제의 영향권에서 자유롭지 못했다. 2011년 무아마르 카다피가 비참한 최후를 맞은 리비아 사태 때에도 정유ㆍ건설주는 급락했지만 태양광주는 코스피 대비 큰 폭의 수익률을 보였다. 이란발 국제유가 위기가 다시 고조된 최근에도 국내 태양광주는 비슷한 흐름을 보이고 있다. 양대 태양광주로 꼽히는 OCI와 한화케미칼은 10일 외국인과 기관의 수급이 몰리면서 이날 하루 각각 7.7%, 5.4% 상승했다. 11일 오전에도 오름세를 보이며 3일 연속 상승세를 이어갔다. 손지우 SK증권 연구원은 “지정학적 리스크에 의한 단기적인 유가 반등은 정유, 조선주 등에겐 악재”라며 “반면 태양광 같은 대체에너지는 발전단가가 비싸다는 단점이 있지만 유가 급등 국면에는 개발 여지가 더욱 높아지기 때문에 관심도가 높아질 수밖에 없다”고 설명했다. 트럼프 대통령은 오는 12일 이란 제재 유예를 더 이상 연장하지 않겠다는 결정을 의회에 통보할 방침이다. 추가 제재도 발표될 전망이어서 지정학적 리스크로 인한 유가 상승세는 계속될 것으로 전망된다. "
서울경제,010060,/news/news_read.nhn?article_id=0003250337&office_id=011&mode=search&query=OCI&page=16,2018-03-22 09:40,"(유)OCI, 전일 대비 7.34% 상승.. 일일회전율은 1.04% 기록","[서울경제] OCI(010060) 는 22일 오전 9시 39분 현재 7.34% 오른 153,500원에 거래되고 있으며, 33(매도):67(매수)의 매수우위를 기록하고 있다. 거래대금은 374억570만, 거래량은 24만7,994주로 거래량회전율은 1.04%로 나타났다. 지난 1개월간 OCI는 상승 15회, 하락 13회를 기록했고, 주가수익률은 1.32% 표준편차는 2.46%를 기록했다. 이 기간 ' 화학업 ' 업종 평균 주가수익률은 -1.03%로 나타났으며, 변동성은 1.30%를 기록했다. 이 시각 현재 ' 화학업 '은 0.68% 상승 중이며, 57(매도):43(매수)의 매도우위를 기록하고 있다."
한국경제,010060,/news/news_read.nhn?article_id=0003891041&office_id=015&mode=search&query=OCI&page=19,2018-02-07 19:58,&quot;폴리실리콘 값 더 오른다&quot;&hellip; OCI&middot;한화케미칼 '화색',[ 안효주 기자  ] 태양광 전지의 핵심 소재인 폴리실리콘 가격이 오르면서 OCI와 한화케미칼 등 관련 기업들의 실적이 개선될 것으로 전망됐다. 7일 태양광 시장조사업체 PV인사이트에 따르면 이날 폴리실리콘 가격은 ㎏당 17.4달러를 기록했다. 국내 생산업체들의 폴리실리콘 손익분기점은 14~15달러 수준이다. 폴리실리콘 가격이 오르는 것은 세계적으로 태양광 발전 수요가 늘고 있기 때문이다. 2016년 75기가와트(GW)였던 태양광 설치 수요는 지난해 97GW로 1년 새 30% 가까이 급증했다. 중국을 비롯해 인도와 유럽의 발전수요도 늘어나 2020년에는 124GW 규모로 커질 전망이다. 폴리실리콘 가격 강세에 힘입어 OCI는 작년 실적이 큰 폭으로 개선됐다. OCI의 지난해 영업이익(2845억원)은 전년(1214억원)보다 두 배 이상 증가했다. 특히 폴리실리콘 가격이 급등한 4분기 영업이익은 1022억원을 기록했다. 이우현 OCI 사장은 지난 6일 실적설명회에서 “말레이시아 폴리실리콘 공장 가동률을 높여 생산량을 늘리고 2만t 이상의 추가 증설도 검토 중”이라고 설명했다. 한화케미칼도 실적 개선을 기대하고 있다. 한화케미칼은 지난해 폴리실리콘 생산 부문에서 수백억원의 적자를 본 것으로 알려졌다.
헤럴드경제,010060,/news/news_read.nhn?article_id=0001400158&office_id=016&mode=search&query=OCI&page=8,2018-05-31 11:38,OCI 이우현의 바이오夢&hellip;큰걸음 내 딛다,"부광약품과 50대50 합작사 의결“10년내 신사업서 3분의1 수익” OCI가 제약ㆍ바아오 사업 진출을 구체화하며 미래 성장동력 확보에 시동을 걸었다. OCI는 지난 30일 이사회를 통해 부광약품과 함께 제약ㆍ바이오 부문에서 양사가 50대 50으로 참여한 합작투자사업을 진행키로 의결했다. 합작사는 오는 7월 중 설립 예정이다. 향후 OCI와 부광약품은 공동으로 신약 후보물질 발굴과 신약개발, 유망벤처 지분 투자 등 다양한 프로젝트를 수행해 나가며 매년 100억원 이상 공동 투자할 진행할 계획이다. OCI는 이번 합작투자를 통해 제약ㆍ바이오 분야에 첫 발을 내딛게 됐다. 이는 현재 폴리실리콘을 필두로 하는 화학사업ㆍ태양광발전 등 에너지솔루션 사업 중심의 포트폴리오를 새로운 영역으로 확장하겠다는 이우현사장의 의지가 바탕이 됐다. 이 사장은 올해 초 열린 OCI 정기주주총회 직후 기자들과 만난 자리에서 “신사업은 제약ㆍ바이오 쪽으로 생각하고 있다”면서 새 미래 성장분야로 제약ㆍ바이오를 염두해두고 있음을 내비쳤다. 그는 또한 “OCI는 제조에 강점있는 회사여서 시판쪽보다는 제조분야를 보고 준비 중이며, 조만간 관련 활동을 보여줄 수 있을 것”이라고했다. 투자를 통해 신사업을 적극 확대하겠다는 의지도 강하다. 이날 주총에서 경영실적 보고를 받은 이 사장은 “기존 영업 현금흐름의 10% 정도를 신산업에 투자하는 것을 적극 검토 중”이라며 “10년 후에는 지금 하고 있지 않은 사업에서 전체의 3분의 1의 이익을 낼 수 있도록 하겠다”고 밝혔다. OCI 관계자는 “이번 사업 제휴는 OCI가 새로운 미래 성장분야로 제약ㆍ바이오를 선정하고, 개발부터 생산까지 전 과정에서 풍부한 경험을 보유한 전문회사와의 협업을 통해 제약ㆍ바이오 시장에 진출한다는 데 의미가 있다”고 설명했다. OCI는 태양광발전의 핵심소재인 폴리실리콘 분야에서 세계 2위 업체로, 반도체급 수준의 11N 이상 초고순도 제품을 생산할 수 있는 고순도 정밀 생산 기술력과 경험을 갖췄다. 또한, 농약사업과 시약사업을 영위해오며 화학 기반의 유관 사업 경험을 축적해 온 만큼 제약 역량을 갖춘 부광약품과 충분한 시너지를 낼 수 있을 것이란 기대다. 부광약품은 세계 네번째로 만성B형 간염치료제인 레보비르(클레부딘)를 개발하고, 줄기세포 전문 바이오벤처인 안트로젠을 관계사로 두고 있다. 현재 글로벌 제2상 임상 중인 새로운 기전의 당뇨병 치료제 ‘MLR-1023’ 및 파킨슨병 운동장애치료제 ‘JM-010을 보유하고 있다. 이우현 사장은 “부광약품의 오랜 전통과 경험, 오픈 이노베이션 역량이 제조업 기반인 OCI의 케미칼 역량과 결합해 강력한 시너지를 낼 것으로 기대한다”고 강조했다."
파이낸셜뉴스,010060,/news/news_read.nhn?article_id=0003987147&office_id=014&mode=search&query=OCI&page=17,2018-03-22 09:29,"[특징주] OCI, 中 환경 규제 수혜 기대감에 '상승세'","OCI가 중국의 환경 규제 강화에 따른 수혜 기대감으로 장 초반 강세를 보이고 있다. 22일 오전 9시 25분 현재 코스피 시장에서 OCI는 전 거래일보다 6.64%(9500원) 상승한 15만2500원에 거래되고 있다. 이날 미래에셋대우는 OCI에 대해 중국 환경 규제 지속으로 카본화학 부문의 실적 개선이 기대되고, 태양광 수요도 반등이 전망된다며 목표가를 22만원으로 상향했다. 박연주 미래에셋대우 연구원은 ""중국 환경 규제 강화로 콜타르 공급이 타이트해지고, 정제설비 가동률도 하락해 피치, 카본 블랙 등의 가격이 상승하고 있다""며 ""수년간 시황 개선이 기대된다""고 전망했다."
머니투데이,010060,/news/news_read.nhn?article_id=0004050712&office_id=008&mode=search&query=OCI&page=10,2018-05-14 05:30,도시개발에 발목잡힌 OCI..관련 계열사에 8년간 5000억 투입,"[머니투데이 기성훈 기자] [디씨알이에 2011년부터 유상증자로 총 5828억 지원..용현·학익지구 1블록 도시개발사업에 투자] OCI그룹이 도시개발 계열사인 디씨알이에 대한 지원에 또 나섰다. 디씨알이의 주사업인 도시개발 사업이 지연되면서 경영부담이 지속되고 있어서다. 13일 관련 업계에 따르면 디씨알이는 지난달 24일 이사회를 열고 운영자금 확보를 위해 총 286억6718만원 규모의 유상증자를 결정했다. 100% 지분을 보유한 OCI가 이번 유상증자에 참여키로 했다. 자본금 500억원으로 2008년 5월 OCI 인천공장 사업부문이 분할돼 설립된 디씨알이는 도시개발사업 및 화학제품 제조·판매업체다. 디씨알이는 설립 이후 적자행진을 이어가고 있다. 분할 후 첫 회계연도인 2009년부터 2015년까지 당기순손실을 기록했다. 2016년엔 1700억원의 당기순이익을 냈다. 소송 승소로 약 1907억원이 환입된데 따른 것이다. 분할 당시 인천시 남구는 법인세법에 따른 적격 분할로 보고 OCI에 지방세를 감면해줬다. 하지만 2012년 1월 적격 분할 요건을 갖추지 못했다며 남구는 디씨알이에 취득세·등록세·가산금 등 1711억원을 부과했다. 디씨알이는 지방세 부과처분 취소 소송을 제기했고 1심과 2심에서 모두 승소했다. 소송은 현재 대법원에 계류 중이다. 디씨알이는 지난해에 다시 183억원 규모의 순손실을 냈다. OCI가 디씨알이에 대한 지원에 나선 것은 이번이 처음은 아니다. 디씨알이는 2011년 5월 500억원을 시작으로 이번까지 총 10차례의 유상증자를 했다. 전체 지원 규모만 해도 5827억5303원에 달한다. 이는 지난해 OCI가 벌어들인 전체 영업이익(2844억원)의 두 배에 달하는 규모다. OCI가 상당 규모 자금을 쏟아붓고 있는 것은 디씨알이가 추진 중인 도시개발이 지연됐기 때문이다. 이 사업은 인천시 남구 용현·학익동 일대 OCI 공장 부지 등 264만1565㎡ 규모를 개발해 2만7000가구를 짓는 것이다. 2006년 기본계획이 수립됐지만 10년이 넘는 동안 지지부진했다. 전체 지구의 70% 이상을 차지하는 1블록(154만6792㎡) 개발이 지연된 탓이다. 2016년 6월 개발계획이 변경되면서 사업진행이 급물살을 탔다. 인천시는 지난해 10월 디씨알이가 시행하는 1블록 도시개발사업에 대한 실시계획을 인가·고시했다. 디씨알이도 화학 사업을 중단하고 도시개발사업에 집중하고 있다. 사업 진행을 위해 디씨알이는 상업·문화용지 5만809m²를 인천시에 제공하기로 했다. OCI 관계자는 ""현재 부지개발을 위해 공장을 철거하기 시작했다""면서 ""개발사업이 성공적으로 진행되도록 할 계획""이라고 말했다."
한국경제,010060,/news/news_read.nhn?article_id=0003874046&office_id=015&mode=search&query=OCI&page=26,2018-01-03 19:27,"OCI, 새해 벽두 '태양광 겹경사'","4㎿ 남해 태양광발전소 가동중국에 3572억 폴리실리콘 공급 [ 김보형 기자  ] OCI가 새해 벽두부터 태양광사업에서 잇따라 성과를 내고 있다. 국내에 건설한 태양광발전소가 상업가동에 들어간 데 이어 중국에서는 대규모 폴리실리콘 공급 계약을 따냈다. 당장 수익에 일희일비하지 않고 태양광사업에 투자해온 이우현 OCI 사장의 ‘뚝심 경영’이 먹혀들고 있다는 설명이다. OCI는 지난해 11월 경남 남해에 준공한 4㎿급 태양광발전소 상업운전을 이달 시작했다고 3일 밝혔다. OCI가 작년 국내 태양광사업 강화를 목표로 삼성자산운용을 통해 조성한 1300억원 규모 태양광발전펀드 프로젝트로 준공된 첫 번째 발전소다. OCI는 태양광펀드로 금융을 주선하고, 발전소 설계·구매·건설(EPC)을 맡았으며 향후 20년간 운영권도 확보했다. 연간 생산 전력은 5200㎿h로 1400가구가 사용할 수 있는 규모다. 생산된 전력은 한전 배전망을 통해 전력거래소에 판매하게 된다. OCI의 남해 태양광발전소는 인근 주민을 위한 상생방안도 제시했다. OCI는 130㎾ 규모 태양광발전 시설을 별도로 지어 주민에게 무상으로 증여했다. 이를 통해 신재생에너지 사업 추진 과정에서 걸림돌로 작용하던 지역 주민과의 갈등을 해소했다. OCI는 2012년 태양광발전사업에 진출한 뒤 경북 상주와 경남 고성 등에 8㎿ 규모의 태양광발전소를 건설했다. 연말까지 국내에서만 100㎿ 규모의 태양광발전소를 건설할 계획이다. OCI는 이날 중국 태양광업체 진코솔라와 3572억원 규모의 폴리실리콘 공급 계약을 맺었다고 공시했다. 작년 OCI 매출의 13%에 달하는 대규모 계약이다. 중국 태양광 기업들의 증설 여파로 최근 폴리실리콘 가격이 2015년 이후 가장 높은 수준까지 상승한 만큼 OCI 실적도 크게 좋아질 전망이다."
