source,symbol,link,date,title,content
머니S,010060,/news/news_read.nhn?article_id=0000276470&office_id=417&mode=search&query=OCI&page=34,2017-11-01 11:34,"OCI, &lsquo;2017 DJSI코리아 지수&rsquo; 9년 연속 편입","본문 이미지 영역 OCI가 1일 서울 강남구 르메르디앙 호텔에서 열린 ‘2017 다우존스 지속가능경영지수(DJSI) 국제 콘퍼런스’에서 허만 경영지원실 사장이 참석한 가운데 2017 DJSI코리아 편입을 인증받았다. OCI는 ▲기업공급망관리(SCM)체계 구축 및 협력회사 간담회 등 협력회사와의 동반성장을 위한 활동 ▲안전보건경영시스템 업그레이드 및 안전문화 개선 프로젝트 등 환경 안전경영의 효율성을 제고시키는 활동 ▲전국 300개 초등학교에 태양광 발전설비를 기증하는 ‘솔라스쿨 프로젝트’ 및 발달 장애인들의 스포츠 축제인 ‘스페셜올림픽’ 후원 등 기업의 사회적 책임을 실천하는 다양한 사회·환경활동을 지속적으로 확대해 왔다. OCI 관계자는 “이번 2017 DJSI코리아 지수 편입은 동반성장, 환경안전, 사회공헌의 중요성을 인식하고 이에 대한 지속적인 노력을 다해왔기에 가능했다”며 “앞으로 투명경영을 통해 기업시민으로서의 책임과 역할을 다해 나가겠다”고 말했다. 한편 2017 DJSI코리아 지수에는 201개 평가대상 기업 중 22.3%인 45개 기업이 편입됐다. OCI는 2009년부터 9년 연속으로 이름을 올리며 지속적으로 회사의 경영역량에 대해 우수하게 평가받고 있다."
뉴시스,010060,/news/news_read.nhn?article_id=0007918755&office_id=003&mode=search&query=OCI&page=49,2017-04-26 16:03,"OCI, 2만톤 규모 말레이시아 폴리실리콘 공장 인수","【서울=뉴시스】 OCI가 인수한 도쿠야마 말레이시아 공장 전경 도쿠야마 말레이시아 주식 4억6천만주 1억7600만달러에 인수키로 【서울=뉴시스】 한상연 기자 =  OCI가 2만톤 규모 말레이시아 폴리실리콘 공장을 인수했다. OCI는 26일 이사회를 열어 연산 2만톤 규모의 폴리실리콘 제조 회사 도쿠야마 말레이시아 주식 4억6235만6839주를 1억7600만달러(약 1990억원)에 인수하기로 결정했다. 앞서 지난해 10월에는 유상증자를 통해 발행한 신주 5000만주를 240만달러에 인수한 바 있다. 도쿠야마 말레이시아는 지난 2009년 설립, 연산 2만톤 규모의 태양광용 및 반도체용 폴리실리콘 생산능력을 보유하고 있다. OCI는 인근 대형 수력발전소로부터 저렴한 가격에 전기를 공급받아 원가경쟁력을 갖췄고, 무역분쟁의 제3지대인 아시아 지역에 위치해 수출 시 규제가 적다는 점 등을 높게 평가해 이곳의 인수를 추진한 것으로 전해졌다. OCI는 도쿠야마 말레이시아 공장 인수를 통해 기존 생산 능력 포함 연간 7만2000톤의 폴리실리콘 생산능력을 갖추게 돼 글로벌 2위로 도약할 수 있게 됐다. 이우현 OCI 사장은 ""이번 인수는 성장하는 태양광시장에서의 지위를 유지하기 위해 경쟁력 있는 제품을 공급할 글로벌 생산기지를 추가로 확보할 수 있는 기회라는 판단에 따른 것""이라며 ""이 공장은 최소의 투자비로 인수하고 가격경쟁력이 있어 글로벌 탑 폴리실리콘 업체인 OCI에게 새로운 도약의 길을 열어줄 것을 기대한다""고 말했다."
디지털타임스,010060,/news/news_read.nhn?article_id=0002429320&office_id=029&mode=search&query=OCI&page=34,2017-10-29 18:07,폴리우레탄 원료 TDI 값 고공행진 &hellip; 한화케미칼&middot;OCI `함박웃음`,"톤당 4571달러 2분기보다 33%↑국내기업 수익성 개선 이어갈듯 폴리우레탄 원료인 톨루엔디이소시아네이트(TDI) 가격이 유례없는 고공행진을 지속하면서 한화케미칼과 OCI의 실적 전망을 밝게 하고 있다. 발암 물질 매트리스 파동에 휩싸인 독일 바스프가 30만톤 규모의 공장 가동을 멈춰 가격 상승을 부채질하고 있기 때문이다. 29일 석유화학업계에 따르면 중국 TDI 수입가격은 이달 현재 톤당 4571달러로, 올 2분기 평균 가격보다 33% 올랐다. 지난주 중국 내수시장 스폿(일회성) 제품 가격은 전주보다 13% 상승한 톤당 6098달러를 기록했다. TDI는 자동차 시트와 매트리스, 건축 단열재, 페인트 등을 만드는 데 쓰인다. 중국은 아시아 최대 TDI 수요처로, 중국 수입가격은 업황을 가늠하는 대표 지표로 꼽힌다. 국내에서는 한화케미칼이 15만톤, OCI 5만톤, 한국바스프가 16만톤을 각각 생산한다. 올 1~2분기 톤당 3400달러 대를 유지했던 TDI 가격이 최근 요동치고 있는 것은 성수기 진입을 전후로 공급에 차질이 빚어지고 있어서다. TDI는 3~4분기에 수요가 급증하는데, 올해는 유독 이 기간에 가동 중단과 정기보수가 몰리고 있다. 지난 8월 중국 바스프가 공장 가동을 중단한 데 이어 지난달 초 세계 2위 독일 코베스트로가 6주간 정기 보수에 들어갔다. 한국에서도 이달 제조사 세 곳이 동시에 정기 보수를 하고 있다. 이런 상황에서 독일 바스프의 생산 공백을 메우려는 아시아산 TDI가 유럽으로 향하면서 수급난이 심화하고 있다는 분석이다. 업계 관계자는 ""최근 TDI 값이 급등하고 있는 배경은 공급 불안정을 우려한 고객사들이 물량 선점에 나서고 있기 때문""이라며 ""2011년 이후 신·증설이 거의 이뤄지지 않은 점도 수급난을 가중시키는 원인 중 하나""라고 말했다. TDI 가격이 당분간 가격 상승세를 지속하면서 국내 기업도 수익성 개선을 이어갈 전망이다. 한화케미칼은 지난 2013년 한화화인케미칼(옛 KPX화인케미칼) 인수합병 이후 TDI 사업부문에서 올해 사상 최대 실적을 달성할 것으로 보인다. TDI 부문은 올 3분기에 이미 지난해 전체 실적을 넘어섰으며 기존 폴리에틸렌, 폴리염화비닐(PVC), 가성소다에 이어 한화케미칼의 주력 제품으로 자리매김하고 있다. 한화케미칼은 TDI 생산량의 90%를 수출한다. OCI는 주력인 베이직케미칼 부문과 TDI가 속한 석유화학·카본소재부문 등이 고르게 실적 개선이 이뤄질 것으로 보인다."
뉴스1,010060,/news/news_read.nhn?article_id=0002698563&office_id=421&mode=search&query=OCI&page=49,2017-04-26 17:07,"[IR종합]OCI &quot;말레이시아 폴리실리콘 공장, 내년 생산량 2만톤 목표&quot;","OCI 말레이시아 폴리실리콘 생산 공장© News1 이우현 사장 ""도쿠야마 인수 성공적…원가절감 효과 크다""1Q 영업익 694억원…전년比 5.9%↓ (서울=뉴스1) 이철 기자 = 이우현 OCI 사장이 말레이시아 폴리실리콘 생산 회사인 '도쿠야마 말레이시아'의 인수를 마무리하며 향후 생산량을 늘리겠다는 목표를 밝혔다. 특히 말레이시아 공장이 폴리실리콘 생산원가 절감에 큰 기여를 할 수 있다며 기대감을 나타냈다. 이 사장은 26일 1분기 실적 콘퍼런스콜에서 ""현재 도쿠야마 공장의 폴리실리콘 생산량은 당초 설계된 2만톤 중 60% 수준""이라며 ""설비투자와 설계변경 등을 통해 내년 2만톤 수준으로 올릴 것""이라고 밝혔다. 이우현 사장은 이번 도쿠야마 말레이시아 인수에 대해 성공한 투자라고 자평했다. 그는 ""공장인수비용이 새로 공장을 짓는 것에 비해 반값 이하""라며 ""경쟁력 있는 투자였다""고 말했다. 이어 ""말레이시아 현지 공장의 전력비가 한국 대비 절반 이하""라며 ""원가 절감에 있어 엄청난 이익""이라고 강조했다. 그는 또 ""기존 OCI의 폴리실리콘 고객과 도쿠야마 공장의 고객이 전혀 겹치지 않는 것도 장점""이라며 ""원가 측면에서 말레이시아가 훨씬 경쟁력이 있기 때문에 장기적으로 태양광은 말레이시아, 반도체는 군산에서 주로 생산할 계획""이라고 말했다. 이날 OCI는 1분기 영업이익 694억원을 기록, 전년 동기 738억원 대비 5.9% 감소했다고 발표했다. 매출은 1조1384억원으로 전년 동기 8897억원 대비 28% 증가했다. 같은기간 당기순이익은 2479억원에서 356억원으로 85.6% 줄었다. 베이직케미컬, 석유화학 등 다른 부문의 선전에도 불구하고 에너지솔루션 부문의 수익성이 악화된 것이 전체 영업이익 감소로 이어졌다. 에너지솔루션 부문의 영업이익은 지난해 1분기 660억원에서 올해 190억원으로 71.2% 줄었다. 감소 원인은 미국 태양광 발전소 건설·매각 사업인 '알라모' 프로젝트의 수익성 악화와 미국 자회사 미션솔라에너지(MSE)의 영업손실 등이다. 이 사장은 ""올해 1분기 매각한 알라모6 발전소의 원가가 지난해 1분기 알라모7을 매각했을 때보다 높다""며 ""계약된 가격부터 각종 컨퍼런스 비용 구조가 다르고 발전량도 차이가 있어서 가격차이가 생긴 것""이라고 설명했다. 마지막으로 이 사장은 ""고효율 전지를 만들기 위해 고품질 폴리실리콘을 써야하기 때문에 해당 제품의 수요는 항상 많을 것""며 ""시장이 커져가는 속도도 빠르기 때문에 폴리실리콘 수요는 향후 지속적으로 이어질 것""이라고 전망했다."
한국경제,010060,/news/news_read.nhn?article_id=0003842729&office_id=015&mode=search&query=OCI&page=34,2017-10-29 19:24,[Hot Stock] OCI,지난 27일 유가증권시장에서 3000원(2.74%) 오른 11만2500원에 마감했다. 지난 한 주간 6000원(5.63%) 올랐다. 손지우 SK증권 연구원은 “폴리실리콘 가격 강세에 힘입어 올해 영업이익이 지난해보다 75% 증가한 2135억원을 기록할 것”이라고 내다봤다. [
서울경제,010060,/news/news_read.nhn?article_id=0002983363&office_id=011&mode=search&query=OCI&page=53,2017-02-28 14:29,"OCI, 주당 400원 현금배당 결정",[서울경제] OCI(010060)는 주당 400원 현금배당을 결정했다고 28일 공시했다. 배당기준일은 지난 12월31일이다.
연합뉴스,010060,/news/news_read.nhn?article_id=0009220588&office_id=001&mode=search&query=OCI&page=49,2017-04-26 16:37,"OCI, 일본 도쿠야마 소유 말레이 폴리실리콘 공장 인수(종합)","지분 100% 인수키로…총 인수액 2억 달러 (서울=연합뉴스) 정성호 유현민 기자 = 태양광 업체 OCI가 폴리실리콘 분야의 사업역량 강화를 위해 일본 화학기업 도쿠야마로부터 말레이시아 생산법인을 인수하기로 했다. OCI는 26일 이사회를 열고 도쿠야마로부터 말레이시아 사라와크주(州) 사마라주 산업단지에 있는 연산 2만t 규모의 폴리실리콘 제조자회사인 '도쿠야마 말레이시아'의 주식 약 4억6천236만주(83.5%)를 인수하는 타법인 주식 취득계약 체결을 결정했다고 밝혔다. 이에 따라 OCI는 지난해 10월 도쿠야마 말레이시아의 주식 5천만주(16.5%)를 인수한 데 이어 이 회사 주식을 전량 사들이게 됐다. 인수 대금은 1억7천600만 달러(약 1천990억원)로 다음 달 말까지 납부할 계획이다. 작년 10월 지분 16.5%를 2천400만 달러(약 265억원)에 사들인 것과 합치면 총 인수액은 2억 달러다. OCI는 ""그동안 기술 검토와 관련 국가의 인허가 획득 등 계약 선결조건을 완료한 뒤 이번에 지분 100%를 인수하게 됐다""고 말했다. 폴리실리콘은 태양광 패널과 반도체의 원료로 쓰인다. OCI는 현재 군산공장에서 연간 5만2천t의 폴리실리콘을 생산 중인데 이번 인수로 생산능력을 7만2천t으로 끌어올리며 세계 3위에서 2위로 올라서게 된다. 도쿠야마 말레이시아는 2009년 설립 이래 태양광용 및 반도체용 폴리실리콘을 생산해왔으나 최근 몇 년간 지속된 태양광 시장의 가격 폭락으로 경영상 어려움을 겪어왔다. 하지만 이 공장은 인근의 대형 수력발전소로부터 저렴하게 전기를 공급받아 원가 경쟁력을 갖췄고, 무역 분쟁의 제3 지대인 아시아에 소재해 중국, 미국 등에 수출할 때 규제가 적은 지정학적인 이점도 있다고 OCI는 설명했다. 특히 OCI와 같은 지멘스 방식을 채용해 OCI가 축적해온 노하우와 첨단기술을 적용하면 생산효율을 극대화할 수 있을 것으로 OCI는 기대했다. 이우현 OCI 사장은 ""이 공장은 최소의 투자비로 인수하게 됐고, 가격 경쟁력도 있어 글로벌 톱 폴리실리콘 업체인 OCI에 새 도약을 길을 열어줄 것으로 기대한다""고 말했다. 한편 OCI는 올해 1분기 연결기준 영업이익이 작년 동기보다 6.9% 감소한 694억원으로 잠정 집계됐다고 이날 공시했다. 매출액은 1조1천384억원으로 28.0% 늘었으나 당기순이익은 356억원으로 85.6% 줄었다."
헤럴드경제,010060,/news/news_read.nhn?article_id=0001203943&office_id=016&mode=search&query=OCI&page=53,2017-02-28 14:34,"OCI, 주당 400원 현금배당 결정",[헤럴드경제=증권팀] OCI는 보통주 1주당 400원의 현금 결산배당을 결정했다고 28일 공시했다. 시가배당율은 0.5%이며 배당금총액은 95억3974만원이다.
데일리안,010060,/news/news_read.nhn?article_id=0002182061&office_id=119&mode=search&query=OCI&page=49,2017-04-26 16:07,"OCI, 1Q 영업익 694억원...전년동기 5.9%&darr;","OCI가 1분기 매출은 증가했지만 수익성이 소폭 하락했다. OCI는 26일 공시를 통해 1분기 매출 1조1384억원과 영업이익 694억원을 기록했다고 밝혔다. 이는 전년동기 대비 매출액은 28% 늘어난 반면 영업이익은 5.9% 감소한 수치다. 같은기간 당기순이익도 356억원으로 85.6% 줄었다. 베이직케미칼 부문의 매출액과 영업이익은 각각 3770억원과 110억원으로 지난해 4분기 100억원의 흑자를 낸 이후 수익성이 소폭 개선됐다. 석유화학 및 카본소재 부문에서는 2860억원의 매출과 470억원의 영업이익이 발생했다. 주요 제품의 가동률이 정상화된 데 더해 판매 가격이 상승하면서 수익성 개선으로 이어졌다는 분석이다. 에너지솔루션 부문의 매출액은 5040억원, 영업이익은 190억원이었다. 매출액이 대폭 증가한 것은 알라모6의 매각대금인 4467억원이 유입된데 따른 것이다. 한편 OCI는 26일 OCI SE 매각과 관련 투자안내서(IM)를 배포한 이후 지속적으로 검토했지만 매각 절차를 진행하지 않기로 최종 결정했다고 공시했다. 데일리안 이홍석 기자 ⓒ (주)데일리안 - 무단전재, 변형, 무단배포 금지"
뉴스1,010060,/news/news_read.nhn?article_id=0002698264&office_id=421&mode=search&query=OCI&page=49,2017-04-26 16:11,[IR] 이우현 OCI 사장 &quot;도쿠야마 말레이시아 인수는 경쟁력 있는 투자&quot;,"(서울=뉴스1) 이철 기자 = 이우현 OCI 사장은 26일 1분기 실적 콘퍼런스콜에서 ""도쿠야마 말레이시아 폴리실리콘 생산 공장인수비용은 새로 공장을 짓는 것에 비해 반값 이하""라며 ""경쟁력 있는 투자였다""고 말했다. 이어 ""말레이시아 현지 공장의 전력비가 한국 대비 절반 이하""라며 ""원가 절감에 있어 엄청난 이익""이라고 설명했다. 이우현 사장은 또 ""동남아시아에 생산거점을 마련해 한국에서 뿐 아니라 동남아 두곳에서 다양한 고객들의 요구조건을 들어줄 수 있는 기초가 생겼다""며 ""전세계 폴리실리콘 시장점유율 20% 수준을 계속 유지할 것""이라고 강조했다."
이데일리,010060,/news/news_read.nhn?article_id=0003760794&office_id=018&mode=search&query=OCI&page=53,2017-02-28 14:33,"OCI, 유기풍 서강대 교수 사외이사 신규선임..3월22일 주총","[이데일리 성문재 기자] OCI(010060)는 유기풍 서강대학교 기술경영전문대학원·화공생명공학과 교수를 사외이사 겸 감사위원에 신규선임했다고 28일 공시했다. 그밖에 김용환 김용환 박종훈 법률사무소 대표변호사와 반장식 서강대 기술경영전문대학원장은 사외이사 겸 감사위원에 재선임됐다. OCI는 또 정관의 사업목적을 일부 변경한다. 에너지 저장장치 제조업과 전기 공사업, 전기 판매업을 추가하고 간척사업, 관광사업, 수영장업, 각종 축류전동기 제조 및 판매업, 소프트웨어 자문, 개발 및 공급업, 방송프로그램 제작 및 공급업, 정보통신사업, 인터넷사업은 삭제했다. OCI는 3월22일 오전 10시 서울 본사 강당에서 정기 주주총회를 열고 정관 변경, 이사 선임 등의 안건을 의결할 예정이다."
데일리안,010060,/news/news_read.nhn?article_id=0002219217&office_id=119&mode=search&query=OCI&page=34,2017-10-31 15:05,"현대오일뱅크 &quot;현대OCI, 2019년 매출 2000억&middot;영업익 350억원 예상&quot;","현대오일뱅크가 OCI와 합작으로 설립한 카본블랙 업체인 현대OCI에 대해 긍정적인 전망을 내놨다. 현대오일뱅크는 31일 3분기 실적발표에서 “현대OCI는 내년에 상업생산에 들어가지만 6개월 간의 인증기간이 필요해 실질적으로는 2019년부터 실적을 기대할 수 있다”면서 “정상적으로 영업이 이뤄진다면 2019년 매출액은 2000억원, 영업이익 350억원 정도를 예상한다”고 밝혔다. 현대오일뱅크는 또 “현재 회사는 윤활기유와 혼합자일렌, 파라자일렌, 벤젠 등 비정유부문을 운영하고 있고, 앞으로도 비정유부문에 계속해서 투자할 계획”이라며 “다만 아직 확정된 것은 없다”고 덧붙였다."
뉴시스,010060,/news/news_read.nhn?article_id=0008260079&office_id=003&mode=search&query=OCI&page=34,2017-11-01 09:18,[빅데이터MSI]시장심리 톱5&hellip;신세계&middot;현대미포조선&middot;제일기획&middot;OCI&middot;휴비스,"시장심리 워스트5, 대우조선해양·현대중공업·POSCO·한세실업·동서 【서울=뉴시스】장서우 기자 = 1일 오전 빅데이터 시장심리지수(MSI)가 가장 높은 톱5로 신세계·현대미포조선·제일기획·OCI·휴비스 등이 선정됐다. 반면 가장 낮은 워스트5로 대우조선해양·현대중공업·POSCO·한세실업·동서가 선정됐다. 뉴시스와 코스콤이 주요 상장기업 250곳에 대해 공동 분석해 산출해 낸 빅데이터 MSI(http://m.newsis.com/stock.html, 모바일 전용)로 전 거래일 오후 4시부터 이날 오전 8시까지 데이터를 취합한 결과 이같이 나타났다. 이날 톱5에 선정된 신세계 MSI 레벨은 전 거래일 5단계에서 이날 7단계로 2계단 올랐다. 한·중 정부가 주한미군의 사드 배치로 촉발된 갈등을 완화하고 정상회담을 포함해 교류·협력을 정상화하는데 합의한 결과, 대표적인 사드 관련주인 신세계 역시 영향을 받은 것으로 풀이된다. 백화점을 포함해 신규 사업인 면세점 등 다각도에서 긍정적인 변화가 예상된다. 손윤경 SK증권 연구원은 ""사드 갈등의 완화 분위기가 감지되는 가운데 주요 아시아 국가 전반에서 중국인 입국자 수가 증가하며 한국으로의 중국인 입국자 수 증가에 대한 기대 또한 확대된다""며 목표주가를 기존 24만원에서 30만원으로 상향했다. 신세계와 관련해 온라인상에서는 제품, 사람, 기능, 크림, 한국, 면세점 등의 키워드가 상위에 자리했다. 현대미포조선 MSI레벨도 전 거래일 5단계에서 이날 7단계로 2계단 상승했다. 이는 올해 3분기 연결 기준 영업이익이 전년 동기 대비 69% 증가한 것으로 잠정 집계된 데 힘입은 것으로 보인다. 현대중공업은 실적 컨퍼런스콜에서 계열사인 현대미포조선이 내년에도 견조한 수익성을 유지할 것이라고 밝혔다. 조병희 키움증권 연구원은 ""건조 물량이 계속 감소하고 있지만 원가 절감 효과와 숙련도 증가 등을 통해 영업이익을 이어가고 있다""며 ""주력 선종 중심 수주로 수익성을 확보하고 있을 뿐 아니라 자산 매각을 통해 부채 비율을 낮추고 유동자산을 늘려나가고 있어 향후 신규 수주 확대 규모에 따라 주가 상승 폭이 결정될 전망""이라고 분석했다. 현대미포조선과 관련해 온라인상에서 주로 언급된 키워드로는 실적, 동기, 영업이익, 주가, 매출액, 매수, 당기, 내년, 증가, 투자의견 등이 집계됐다. 제일기획 MSI레벨은 전 거래일 7단계에서 이날도 7단계를 유지했다. 제일기획 주가는 3거래일 연속 상승세를 이어오고 있다. 올해 3분기 실적이 발표된 지난 30일에는 전 거래일 대비 4.97%(900원) 오른 1만9000원, 이어 31일에는 전 거래일 대비 9.47%(1800원) 크게 오른 2만800원에 장을 마감했다. 김현용 이베스트투자증권 연구원은 ""미국에서의 영업 회복, 중국 역신장세 완화 기류 등을 동반해 해외 영업 총이익이 성장세를 회복 중""이라며 ""평창올림픽을 앞둔 광고수요가 연말 성수기와 맞물리며 실적 모멘텀 발현이 가능하다""고 전망했다. 이날 제일기획과 관련해 온라인상에서는 증시분석, 로봇, 전문기자, 실적, 연구원, 매수, 영업이익, 매출, 컨센서스, 해외 등의 키워드가 상위에 자리했다. OCI MSI 레벨은 전 거래일 4단계에서 이날 7단계로 3계단 상승했다. 이 역시 한중 해빙 모드에서 비롯된 것으로 보인다. OCI를 비롯한 한국 화학업계는 11월 초 중국의 폴리실리콘 반덤핑조사 결과를 앞두고 있다. 이 결과에 따라 국내 화학사들의 폴리실리콘 수출 지속여부가 결정된다. 또한 OCI의 경우 태양광제품 수출의 60%가 중국에 집중돼 있어 관세 부과를 떠나 향후 중국 사업에서의 기대감이 상승할 수 있다. 이러한 기대감을 반영해 OCI 주가는 한중 관계개선 협의문이 발표된 지난 31일 전 거래일 대비 0.89%(1000원) 오른 11만3000원에 마감했다. OCI와 관련해 온라인상에서 주로 언급된 키워드는 중국, 내일, 결과, 발표, 도움, 정보, 애널, 화학업계, 해빙, 폴리실리콘 등으로 나타났다. 휴비스 MSI 레벨도 전 거래일 4단계에서 3계단 오른 7단계를 기록했다. 휴비스와 관련해 이날 온라인상에서 주로 언급된 키워드로는 도움, 정보, 급등주, 공유, 손실, 출처, 정보자료, 주식, 상한가, 수익, 주식투자 등이 선정됐다. 반면 가장 낮은 워스트5는 대우조선해양·현대중공업·POSCO·한세실업·동서 등으로 집계됐다. 대우조선해양 MSI 레벨은 전 거래일 1단계에서 이날도 1단계에 머물렀다. 대우조선해양 관련 온라인상 키워드는 이상, 거래, 주식, 삼중, 수주, 전략, 주가, 내일, 매수, 투자, 하락 등이 상위에 올랐다. 현대중공업 MSI 레벨은 전 거래일 3단계에서 이날 1단계로 2계단 떨어졌다. 현대중공업과 관련해 온라인상에서 주로 언급된 키워드는 현대자동차, 동기, 영업이익, 촉탁 계약직, 화재, 정규직, 노동자, 기간, 매출액 등으로 나타났다. POSCO MSI 레벨은 전 거래일 2단계에서 이날 1단계로 1계단 내려갔다. POSCO와 관련해 온라인상에서 주로 언급된 키워드는 기관, 외국인, 기록, 공시, 상승, 코스피지수, 이상, 개인 등이다. 한세실업 MSI 레벨은 전 거래일 4단계에서 이날 1단계로 3계단 주저앉았다. 한세실업과 관련해 온라인상에서 주로 언급된 키워드는 저항, 상승, 하락, 지지, 회사, 매수가격, 매출액 등이다. 동서 MSI 레벨은 전 거래일 3단계에서 2계단 내린 1단계를 기록했다. 동서와 관련해 온라인상에서 주로 언급된 키워드로는 칭호, 어머니, 남편, 마음, 미연, 며느리, 사람, 부모 등이 추출됐다. 뉴시스와 코스콤은 온라인과 소셜네트워크서비스(SNS)에서 수집된 개별 종목 관련 빅데이터를 긍정과 부정으로 분류해 점수화한 다음 이를 최근 1년간 흐름과 비교해 지수를 산출했다. MSI산출 대상은 코스피 200종목과 코스피 지수, 코스닥 50종목과 코스닥 지수 등 250개 개별 종목이다. MSI는 1단계 '매우 나쁨', 2단계 '나쁨', 3단계 '약간 나쁨', 4단계 '보통', 5단계 '약간 좋음', 6단계 '좋음', 7단계 '매우 좋음' 등 총 7단계로 분류한다. 한편 8월1일부터 선보인 빅데이터 MSI 모바일 전용 버전은 구글플레이 또는 애플 앱스토어에서 '뉴시스'앱을 내려받거나 뉴시스 모바일 홈페이지(m.newsis.com)에 접속한 뒤 메인화면의 '빅데이터 MSI'를 클릭해 이용하면 된다."
