source,symbol,link,date,title,content
파이낸셜뉴스,010060,/news/news_read.nhn?article_id=0003874967&office_id=014&mode=search&query=OCI&page=40,2017-09-15 09:16,"[fnRASSI]OCI, 52주 신고가...1.4% &uarr;","OCI(010060)는 52주신고가를 기록하고 있어 주목할만하다. 동종목의 현재 주가는 108,500원 선에서 이루어지고 있다. 거래일을 기준으로 최근 3일간 평균 거래량은 47만 주이다. 이는 60일 일 평균 거래량 26만 주와 비교해보면 최근 거래량이 다소 증가했다는 것을 알 수 있다. 상장주식수 대비 거래량은 1.31%로 적정수준 최근 한달간 OCI의 상장주식수 대비 거래량을 비교해보니 일별 매매회전율이 1.31%로 집계됐다. 그리고 동기간 장중 저점과 고점의 차이인 일평균 주가변동률을 4.67%를 나타내고 있다. 주요 투자주체는 개인투자자 최근 한달간 주체별 거래비중을 살펴보면 개인이 73.42%로 가장 높은 참여율을 보였고, 외국인이 13.49%를 보였으며 기관은 13.07%를 나타냈다. 그리고 최근 5일간 거래비중은 개인이 전체 거래량의 74.4%를 차지하며 가장 활발한 참여를 보였고, 기관은 13.25%, 외국인은 12.33%의 거래 참여율을 보였다. 'fnRASSI'는 증권전문 기업 씽크풀과 파이낸셜뉴스의 협업으로 로봇기자가 실시간으로 생산하는 기사입니다."
머니투데이,010060,/news/news_read.nhn?article_id=0003934954&office_id=008&mode=search&query=OCI&page=40,2017-09-14 10:15,"[특징주]OCI, 말레이 설비 정상화에 이틀 연속 신고가","[머니투데이 하세린 기자] OCI가 말레이시아 폴리실리콘 생산설비 정상화 소식에 이틀 연속 52주 신고가를 경신했다. 14일 오전 10시14분 현재 코스피 시장에서 OCI는 전일대비 3500원(3.45%) 오른 10만5000원에 거래 중이다. 장중 10만6500원의 52주 신고가를 경신했다. 박연주 미래에셋대우 연구원은 ""OCI의 말레이시아 폴리실리콘 생산설비의 가동률이 예상보다 빨리 높아지면서 전체 원가가 낮아지고 있다""며 ""폴리실리콘 가격 추세도 견조하다""고 밝혔다. 이어 ""OCI의 올해 3분기 영업이익은 458억원으로 시장 예상치 320억원을 크게 웃돌 것""이라고 전망했다. 미래에셋대우는 OCI의 목표주가를 기존 11만원에서 14만원으로 상향 조정했다."
전자신문,010060,/news/news_read.nhn?article_id=0002628340&office_id=030&mode=search&query=OCI&page=43,2017-07-27 12:57,"[ET투자뉴스]OCI, &quot;폴리실리콘 부진 지&hellip;&quot; HOLD(유지)-한화투자증권","한화투자증권에서 27일 OCI(010060)에 대해 ""폴리실리콘 부진 지속, 석유화학이 이끈 실적""라며 투자의견을 'HOLD(유지)'로 제시하였고, 아울러 목표주가로는 88,000원을 내놓았다. 한화투자증권 신현준, 김윤지 애널리스트가 동종목에 대하여 이번에 제시한 'HOLD(유지)'의견은 한화투자증권의 직전 매매의견을 그대로 유지하는 것이고 올해 초반의 매매의견을 기준으로  볼때도 역시 '중립'의견이 계속 유지되고 있는 상태이다. 그리고 최근 분기내 발표된 전체 증권사 리포트의 컨센서스와 비교를 해볼 경우에 오늘 발표된 투자의견은 전체의견 대비해서 비교적 낮은 수준으로 평가되는데,  이는 동종목에 대한 기대감을 다소 약하게 표현한 것으로 분석되고 있다. 목표주가의 추이를 살펴보면 이번에 다시 목표가가 같은 수준을 유지하면서 최근 흐름은 목표가의 계단식 하향조정이 진행되는 모습이다. 또한 전일 종가 기준으로 볼때 동종목의 현주가는 이번에 제시된 목표가 대비 1.5%의 추가상승여력이 있다는 해석이 제시되고 있다."
전자신문,010060,/news/news_read.nhn?article_id=0002628386&office_id=030&mode=search&query=OCI&page=43,2017-07-27 13:45,"[ET투자뉴스]OCI, &quot;말련 공장 인수 효&hellip;&quot; 매수(유지)-신한금융투자","신한금융투자에서 27일 OCI(010060)에 대해 ""말련 공장 인수 효과 기대""라며 투자의견을 '매수(유지)'로 제시하였고, 아울러 목표주가로는 100,000원을 내놓았다. 신한금융투자 이응주, 한상원 애널리스트가 동종목에 대하여 이번에 제시한 '매수(유지)'의견은 신한금융투자의 직전 매매의견에서 큰 변화없이 그대로 유지되는 것이고  올해 초반의 매매의견을 기준으로  볼때도 역시 '매수'의견이 계속 유지되고 있는 상태이다. 그리고 최근 분기내 발표된 전체 증권사 리포트의 컨센서스와 비교를 해볼 경우에 오늘 발표된 투자의견은 대체적으로 평균치에 해당하는 수준으로, 이번 의견은 동종목에 대한 전체적인 흐름에서 크게 벗어나지 않은 것으로 분석되고 있다. 목표주가의 추이를 살펴보면 한동안 정체구간을 보낸 후 이번에 오랜만에 목표가가 상향조정된 모습이다. 또한 전일 종가 기준으로 볼때 동종목의 현주가는 이번에 제시된 목표가 대비 15.3%의 추가상승여력이 있다는 해석이 제시되고 있다."
전자신문,010060,/news/news_read.nhn?article_id=0002628483&office_id=030&mode=search&query=OCI&page=43,2017-07-27 15:16,"[ET투자뉴스]OCI, &quot;지연되는 회복, 아&hellip;&quot; HOLD(유지)-동부증권","동부증권에서 27일 OCI(010060)에 대해 ""지연되는 회복, 아직은 이르다""라며 투자의견을 'HOLD(유지)'로 제시하였고, 아울러 목표주가로는 85,000원을 내놓았다. 동부증권 한승재 애널리스트가 동종목에 대하여 이번에 제시한 'HOLD(유지)'의견은 동부증권의 직전 매매의견을 그대로 유지하는 것이고 올해 초반의 매매의견을 기준으로  볼때도 역시 '중립'의견이 계속 유지되고 있는 상태이다. 그리고 최근 분기내 발표된 전체 증권사 리포트의 컨센서스와 비교를 해볼 경우에 오늘 발표된 투자의견은 전체의견 대비해서 비교적 낮은 수준으로 평가되는데,  이는 동종목에 대한 기대감을 다소 약하게 표현한 것으로 분석되고 있다. 목표주가의 추이를 살펴보면 최근 장기간 목표가가 같은 수준에 머물고 있는 모습이다. 또한 전일 종가 기준으로 볼때 동종목은 이번에 제시된 목표가 대비 2%의 고평가 요인에 의한 가격조정가능성이 있다는 해석이 제시되고 있다."
서울경제,010060,/news/news_read.nhn?article_id=0003112052&office_id=011&mode=search&query=OCI&page=40,2017-09-14 07:01,[터치!Up&amp;Down]OCI 말레이시아 생산설비 정상화에 신고가,"[서울경제] OCI(010060)가 13일 52주 신고가를 기록하며 주가 상승 기대감을 키웠다. 이날 유가증권시장에서 OCI는 전일과 보합이 10만 1,500원에 장을 마쳤다. 장중 한때는 10만6,000원을 기록하며 52주 신고가를 경신하기도 했다. 말레이시아 폴리실리콘 생산설비 정상화 소식이 OCI 주가에 상승 동력으로 작용했다. 미래에셋대우는 OCI가 최근 인수한 말레이시아 폴리실리콘 생산설비가 빠른 속도로 정상화하고 있다며 목표주가를 11만원에서 14만원으로 올리고 ‘매수’ 투자의견을 제시했다. 박연주 미래에셋대우 연구원은 “OCI의 말레이시아 폴리실리콘 생산설비 가동률이 예상보다 빨리 높아지면서 전체 원가가 낮아지고 있다”며 “OCI의 올해 3·4분기 영업이익이 458억원으로 시장 예상치 320억원을 크게 웃돌 것”이라고 전망했다."
전자신문,010060,/news/news_read.nhn?article_id=0002628506&office_id=030&mode=search&query=OCI&page=43,2017-07-27 15:39,"[ET투자뉴스]OCI, &quot;카본케미칼 호조세 &hellip;&quot; MARKETPERFORM-키움증권","키움증권에서 27일 OCI(010060)에 대해 ""카본케미칼 호조세 지속될 전망""라며 투자의견을 'MARKETPERFORM'로 제시하였고, 아울러 목표주가로는 90,000원을 내놓았다. 키움증권 김상구 애널리스트가 동종목에 대하여 이번에 제시한 'MARKETPERFORM'의견은 키움증권의 직전 매매의견인 'OUTPERFORM(DOWNGRADE)'에서 한단계 내려앉은 것이고 반면에 연초반의 매매의견을 기준으로 볼때에도 역시 '매수'의견에서 'MARKETPERFORM로' 레벨다운된 것이다. 그리고 최근 분기내 발표된 전체 증권사 리포트의 컨센서스와 비교를 해볼 경우에 오늘 발표된 투자의견은 전체의견을 소폭 하회하는 수준으로 평가되는데, 이는 동종목에 대한 기대감을 다소 약하게 표현한 것으로 분석되고 있다. 목표주가의 추이를 살펴보면 이번에 다시 목표가가 같은 수준을 유지하면서 최근 흐름은 목표가의 계단식 하향조정이 진행되는 모습이다. 또한 전일 종가 기준으로 볼때 동종목의 현주가는 이번에 제시된 목표가 대비 3.8%의 저평가 요인이 존재한다는 해석이 제시되고 있다."
세계일보,010060,/news/news_read.nhn?article_id=0003209027&office_id=022&mode=search&query=OCI&page=40,2017-09-13 15:18,"OCI, 말레이시아 생산설비 정상화 기대감에 신고가, 목표주가도 상향",주식시장에서 OCI가 신고가를 기록하고 목표주가도 상향조정됐다. OCI는 13일 장중 10만6000원을 기록하며 52주 신고가를 기록했다. 이후 오후 장에서는 10만1500원 선에서 등락을 거듭하고 있다. 미래에셋대우는 OCI가 최근 인수한 말레이시아 폴리실리콘 생산설비가 빠른 속도로 정상화하고 있다며 목표주가를 11만원에서 14만원으로 올리고 ‘매수’ 투자의견을 제시했다. 박연주 연구원은 “OCI의 말레이시아 폴리실리콘 생산설비의 가동률이 예상보다 빨리 높아지면서 전체 원가가 낮아지고 있다”며 “폴리실리콘 가격도 견조하다”고 분석했다. 그러면서 “OCI의 올해 3분기 영업이익은 458억원으로 시장 예상치 320억원을 크게 웃돌 것”이라고 전망했다. 그는 이어 “폴리실리콘은 중국 정부가 설치량 목표치를 높이면서 현지 수요가 오름세인 것으로 추정한다”며 “내년 수급 상황은 6월 말 중국 보조금 축소 이전에 선수요 발생으로 우호적이며 폴리실리콘 가격 상승에 따른 실적 개선 가능성을 고려하면 추가 주가 상승 여력이 있다”고 덧붙였다.
데일리안,010060,/news/news_read.nhn?article_id=0002192819&office_id=119&mode=search&query=OCI&page=45,2017-06-20 09:43,"[특징주]OCI, 탈원전 선언에 강세...태양광 관련주 동반 상승","태양광 셀모듈의 원료인 폴리실리콘을 생산하는 OCI가 문 정부의 '탈원전' 선언에 힘입어 급등하고 있다. 20일 오전 9시 38분 현재 OCI는 전일 대비 6300원(6.81%)오른 9만8800원에 거래되고 있다. 장 초반 9만9300원 까지 거래되기도 했다. 태양광 관련주로 꼽히는 신성이엔지(4.49%), 한화케미칼(3.62%), 웅진에너지(2.11%) 역시 동반 상승하고 있다. 문재인 대통령은 지난 19일 부산시 기장군 고리원전에서 열린 고리 1호기 퇴역식에서 ""준비 중인 신규 원전 건설계획을 전면 백지화할 것""이라 밝히며 '탈원전'에 대한 의지를 밝힌 바 있다. 데일리안 한성안 기자 ⓒ (주)데일리안 - 무단전재, 변형, 무단배포 금지"
파이낸셜뉴스,010060,/news/news_read.nhn?article_id=0003873762&office_id=014&mode=search&query=OCI&page=40,2017-09-13 14:11,"[fnRASSI]OCI(010060), 52주 신고가 경신...0.99% &uarr;","OCI(010060)는 52주신고가를 기록하고 있어 주목할만하다. 동종목의 현재 주가는 102,500원 선에서 이루어지고 있다. 거래일을 기준으로 최근 3일간 평균 거래량은 43만 주이다. 이는 60일 일 평균 거래량 26만 주와 비교해보면 최근 거래량이 다소 증가했다는 것을 알 수 있다. 외국인 보유량 증가, 기관 감소 (5일 누적) 최근 5일간 동종목의 외국인 투자자는 63,224주 순매수하였고 반면 기관은 29,618주 순매도하였다. 전날 외국인 13,033주 순매수, 기관29,618주 순매도하며 보유 비율이 변동했다. 다음 표는 동종목의 외국인, 기관의 일별 순매수량을 나타낸 것이다. 상장주식수 대비 거래량은 1.17%로 적정수준 최근 한달간 OCI의 상장주식수 대비 거래량을 비교해보니 일별 매매회전율이 1.17%로 집계됐다. 그리고 동기간 장중 저점과 고점의 차이인 일평균 주가변동률을 2.95%를 나타내고 있다. 'fnRASSI'는 증권전문 기업 씽크풀과 파이낸셜뉴스의 협업으로 로봇기자가 실시간으로 생산하는 기사입니다."
서울경제,010060,/news/news_read.nhn?article_id=0003083539&office_id=011&mode=search&query=OCI&page=43,2017-08-01 18:00,"OCI상사, 23년 만에 사명 바꾸는 이유는","유니드 글로벌 코퍼레이션으로 변경 추진 ""공정거래법 위반 피하기 위한 꼼수"" 지적 [서울경제] OCI상사가 23년 만에 사명 변경을 추진해 그 배경에 궁금증이 일고 있다. 1일 화학업계에 따르면 최근 OCI상사는 화학소재기업인 유니드의 이름을 따 유니드 글로벌 코퍼레이션으로의 사명 변경을 추진하고 있다. 유니드는 세계 칼륨계 화학제품 시장 점유율 1위의 중견기업이다. 이수영 OCI그룹 회장 친동생인 이화영 OCI상사 대표이사가 회장직을 겸임하고 있다. 업계에서는 OCI상사가 지난 1994년 설립 이후 처음으로 갑작스레 사명을 변경하는 게 공정거래법 위반을 피하려는 꼼수가 아니냐는 추측이 나온다. 현행법상 일감몰아주기 규제 대상은 대기업 내 계열사 중 총수 일가 지분이 일정 기준(비상장사 20%) 이상이고 내부 거래가 연간 200억원이나 총 매출의 12% 이상인 기업이다. 비상장사인 OCI상사의 주요 주주는 이화영 회장(64.29%)과 아들 이우일씨(35.71%)다. 총수일가 지분이 100%다. 아울러 OCI상사의 지난해 별도 기준 매출액 9,816억원 중 727억원이 계열사와의 거래를 통해 발생했다. 구체적으로 OCI 145억원, 유니드 88억원, 해외계열사 481억원 등이다. 연간 내부거래 제한 기준인 200억원을 훌쩍 넘는다. 이 때문에 OCI상사가 사명을 바꿔 내부거래 비중이 가장 큰 OCI와의 연관성을 조금이라도 희석하고자 나섰다는 것이다. 하지만 근본적인 해결책은 외면하는 데 대한 비판이 적지 않다. 업계 관계자는 “그렇지 않아도 문재인 정부 들어 일감 몰아주기 조사가 강화되고 있는데 이름을 바꾼다고 달라지는 게 있을까 싶다”고 지적했다."
머니투데이,010060,/news/news_read.nhn?article_id=0003920432&office_id=008&mode=search&query=OCI&page=43,2017-08-16 15:35,"OCI, 美계열사에 1028억원 채무보증",[머니투데이 김평화 기자] OCI는 미국 내 계열회사인 OCI Solar Power LLC의 채무 1028억6888만원을 보증하기로 결정했다고 16일 공시했다.
아시아경제,010060,/news/news_read.nhn?article_id=0004074512&office_id=277&mode=search&query=OCI&page=40,2017-09-13 09:37,"[특징주] OCI, 말레이 설비 정상화 소식에 52주 신고가","[아시아경제 조강욱 기자] OCI가 최근 인수한 말레이시아 설비의 빠른 정상화 소식에 힘입어 52주 신고가를 경신했다. 13일 오전 9시34분 현재 OCI는 전 거래일보다 2.46% 오른 10만4000원에 거래되고 있다. 이날 OCI는 장 시작과 함께 상승, 10만6000원을 기록하며 52주 신고가를 기록했다. 박연주 연구원은 ""OCI의 말레이시아 폴리실리콘 생산설비의 가동률이 예상보다 빨리 높아지면서 전체 원가가 낮아지고 있다""며 ""폴리실리콘 가격도 견조하다""고 분석했다. 이어 ""OCI의 올해 3분기 영업이익은 458억원으로 시장 예상치 320억원을 크게 웃돌 것""이라고 전망했다. 미래에셋대우는 OCI의 목표주가를 11만원에서 14만원으로 상향 조정했다."
한국경제,010060,/news/news_read.nhn?article_id=0003811573&office_id=015&mode=search&query=OCI&page=43,2017-08-18 17:34,"[마켓인사이트]OCI, 올 두번째 회사채 발행은 성공할 수 있을까","3년 만기 회사채 1000억원어치 다음달 12일 발행 추진주관사 한투 KB증권..2월엔 500억원어치 발행에 110억원 미매각지난해 영업이익 흑자 전환..일부 신평사는 '긍정적' 전망금리는 같은 신용등급 회사채 평균보다 높아 매력적  이 기사는 08월18일(15:42) 자본시장의 혜안 ‘마켓인사이트’에 게재된 기사입니다 ----------------------------------------------------------- 올 상반기 회사채 발행에서 흥행에 실패했던 OCI가 올 두 번째 회사채 발행에 나선다. 수익성 개선으로 지난해 4년 만에 영업이익을 내며 흑자 전환한 자신감을 바탕으로 흥행 성공에 도전한다. 18일 투자은행(IB)업계에 따르면 OCI는 3년 만기 회사채 1000억원어치 발행을 위해 최근 주관사 선정을 마치고 실무작업을 진행중이다. 기관투자가 대상 수요예측(사전 청약)은 다음달 4일이며 발행일은 12일로 예정됐다. 주관사는 한국투자증권과 KB증권이다. 오는 11월 만기 도래하는 회사채 1000억원어치를 차환하는 데 쓸 것으로 예상된다. OCI는 지난 2월 회사채 발행에서는 흥행에 실패했다. 500억원어치를 모집했지만 110억원어치 미매각이 발생하며 주관사가 이를 떠안아야했다. 주력 사업인 폴리실리콘을 생산하는 태양광 사업의 업황이 여전히 부진한 데다가 2013~2015년까지 영업손실을 이어갔기 때문이다. 회사채 투자자들은 OCI 회사채의 안정성에 의문을 제기하며 투자를 꺼렸다. 이번엔 분위기가 호전됐다는 평가다. 3년 연속 적자를 면치 못했던 OCI는 지난해 별도 기준 영업이익 1203억원을 올리며 흑자전환했고, 올 2분기까지 누적 영업이익 1002억원을 달성했다. 신용등급 상향 조정의 신호도 보인다. 국내 신용평가사들은 지난해 5월 OCI의 실적부진 등을 반영해 신용등급을 ‘A+’에서 ‘A0’로 강등했다. 이후 올 6월 정기평가에서 신용평가 3사 가운데 한국신용평가는 OCI의 신용등급 전망을 ‘긍정적’으로 조정했다. 태양광 사업의 손실 폭이 줄어들고 석탄화학사업이 흑자 폭을 키워가면서 수익성이 개선됐다는 평가다. 이번 회사채 발행에는 호재다. 등급이 올라갈 가능성이 높으면 회사채 가격 상승을 기대한 투자자들이 몰릴 수 있어서다. 한 자산운용사 채권투자팀장은 “태양광 사업의 사업성은 크게 좋아지지 않았지만 실적이 개선되고 재무 안정성이 높아 투자를 검토중”이라며 “금리가 높은 A급 회사채여서 관심있게 보고 있다” 고 말했다. 에프앤자산평가 등 민간 채권평가사들이 시가평가한 OCI 회사채 3년물의 평균 수익률은 연 3.659%다. A0 회사채 3년물 평균 수익률 연 3.063%보다 약 0.6%포인트 높은 수준이다."
연합뉴스,010060,/news/news_read.nhn?article_id=0009486328&office_id=001&mode=search&query=OCI&page=43,2017-08-21 08:31,"교보증권 &quot;OCI, 하반기 실적 대폭 개선&hellip;목표가&uarr;&quot;","(서울=연합뉴스) 조민정 기자 = 교보증권은 21일 OCI가 올해 하반기 폴리실리콘 가격 상승과 재무구조 개선에 힘입어 실적이 크게 개선될 것으로 전망하면서 목표주가를 기존 11만5천원에서 14만원으로 상향 조정했다. 투자의견은 '매수'를 유지했다. 손영주 연구원은 ""올해 폴리실리콘 수급은 수요가 35만7천t으로 공급 34만3천t보다 1만t가량 많을 것으로 전망한다""고 말했다. 그는 또 ""여기에 11월 미국의 세이프가드 조치 이후 추가 관세 인상에 따른 모듈 가격 상승 기대, 중국의 미국산 폴리에 대한 보복 관세 조치 가능성, 내년 상반기 중국·인도 설치 수요 증가로 더 늘어날 여지가 많다""고 분석했다. 이에 따라 OCI의 폴리실리콘 관련 영업이익이 흑자 전환해 내년에도 이 기조를 지속할 것으로 전망했다. 폴리실리콘 선전에 힘입어 지난 4월 도쿠야마 소유 말레이시아 폴리실리콘 공장 인수 효과도 한층 커질 것이라고 손 연구원은 강조했다. 그는 ""상반기 말 기준 OCI의 순차입금은 1조1천억원으로 작년 말 대비 6천억원이 감소했다""며 ""재무구조 개선 노력이 기업가치 개선으로 이어질 것""이라고 말했다. 손 연구원은 ""OCI는 하반기 다크호스가 될 것""이라며 ""현 주가 대비 51%의 상승 여력이 있다""고 덧붙였다."
데일리안,010060,/news/news_read.nhn?article_id=0002210242&office_id=119&mode=search&query=OCI&page=40,2017-09-13 09:33,"[특징주]OCI, 말레이 설비 정상화 소식에 신고가","OCI가 말레이시아 설비 정상화 소식에 13일 신고가를 경신했다. 이날 오전 9시30분 현재 OCI는 전 거래일보다 3.45% 오른 10만4500원에 거래되고 있다. 장중 한때 10만6000원까지 올라 52주 신고가를 경신 했다. 박연주 미래에셋대우 연구원은 ""OCI의 말레이시아 폴리실리콘 생산설비의 가동률이 예상보다 빨리 높아지면서 전체 원가가 낮아지고 있다""며 ""폴리실리콘 가격도 견조하다""고 분석했다. 이어 ""OCI의 올해 3분기 영업이익은 458억원으로 시장 예상치 320억원을 크게 웃돌 것""이라고 전망했다. 데일리안 전형민 기자 ⓒ (주)데일리안 - 무단전재, 변형, 무단배포 금지 데일리안 관련뉴스해당 언론사에서 선정하며 언론사 페이지(아웃링크)로 이동해 볼 수 있습니다.맨유 위안? 포그바 쓰러졌지만 즐라탄 뛰기 시작코스피 외인 기관 동반매도에 하락 전환'기울어진 운동장' 챔피언스리그 극단적 양극화""한국콜마, 화장품 산업 부진 지속…목표가↓""-NH투자증권뉴욕증시, 美 세제개편안 기대…3대지수 사상 최고 마감"
데일리안,010060,/news/news_read.nhn?article_id=0002205215&office_id=119&mode=search&query=OCI&page=43,2017-08-21 08:33,"&quot;OCI, 폴리가격 상승과 함께 모멘텀 부각&hellip;목표가&uarr; &quot;-교보증권","교보증권은 OCI가 폴리가격 선전과 함께 실적 개선이 기대된다고 평가하며 투자의견 '매수'와 목표주가 14만원으로 21.8% 상향조정했다. 21일 손영주 교보증권 연구원은 ""11월 미국 세이프가드 조치에 대비한 모듈 가동률 상승으로 인해 폴리 수급타이트 및 가격 선전이 기대된다""며 ""4분기 폴리 흑자 전환을 예상한다""고 그 이유를 설명했다. 이어 재무구조 개선을 통해 기업가치가 상향될 것으로 전망했다. 손 연구원은 ""상반기 말 순차입금은 1조1000억원 지난해 말 6000억원 대비 급감했다""며 ""폴리 선전과 함께 재무구조 개선 노력이 기업가치 상향으로 이어질 것""이라고 판단했다. 아울러 손 연구원은 ""판가 정체에 따른 폴리 개선 제한에도 불구하고 TDI등 카본 소재 가격 강세와 중국 증설분의 가동률 상향에 따라 실적 급증에 힘입어 전년 대비 큰 폭의 실적개선을 기대할 수 있다""고 덧붙였다. 올해 영업이익으로는 전년 대비 625억원 증가한 1832억원을 기록할 것으로 예상했다. 데일리안 한성안 기자 ⓒ (주)데일리안 - 무단전재, 변형, 무단배포 금지"
뉴시스,010060,/news/news_read.nhn?article_id=0008130626&office_id=003&mode=search&query=OCI&page=42,2017-08-21 08:36,"교보증권 &quot;OCI, 이익 전망치 상향&hellip;목표가&uarr;&quot;","【서울=뉴시스】김경원 기자 = 교보증권은 21일 OCI(010060)의 이익 전망치 상향과 순차입금 현실화 등을 감안해 목표주가를 기존 11만5000원에서 14만원으로 올렸다. 투자의견은 '매수'를 유지했다. 손영주 교보증권 연구원은 ""OCI의 투자포인트는 폴리 가격 선전, 도쿠야마 인수 모멘텀, 재무구조 개선 등""이라며 ""우선 11월 미국 세이프가드 조치에 대비한 모듈 가동률 상승으로 인해 폴리 수급타이트 및 가격 선전이 기대된다""고 설명했다. 손 연구원은 ""도쿠야마 말레이시아 인수는 '업황 부진이 가져다 준 호기'라고 판단한다""며 ""폴리 선전과 함께 도쿠야마 인수 모멘텀이 부각될 것""고 예측했다. 그는 ""상반기 말 부채비율은 전년 말 대비 10%포인트 줄어든 81%, 순차입금은 전년 말 대비 0.6조원 감소한 1.1조원""이라며 ""폴리 선전과 함께 재무구조 개선노력이 기업가치 상향으로 이어질 것""이라고 내다봤다."
