source,symbol,link,date,title,content
한국경제TV,011760,/news/news_read.nhn?article_id=0000654481&office_id=215&mode=search&query=현대상사&page=1,2018-06-29 09:06,"현대상사, 전일 대비 약 5% 상승한 33,250원","[한국경제TV 라이온봇 기자] [그림 1] 최근 3개월 간 주가 추세 및 기간별 수익률 현대상사는 6월 29일 9시 6분 전일 대비 약 5% 상승한 33,250원에 거래되고 있다. 현대상사는 코스피 상장 기업으로 유통업 업종에 속해 있다. 시가총액은 4,226억원으로 코스피 상장기업 중 284위에 위치 해 있다. [종목 성향 진단] [그림 2] 종목 성향 진단 현대상사의 투자 스타일은 가치주에 가깝다. 기업 가치 대비 낮은 주가가 매력적인 기업이다. 주가 모멘텀은 부진한 편이었다. 최근 1개월 수익률은 -12.13%의 하락폭을 기록했다. 현대상사 종목에 대한 투자자의 관심도는 굉장히 높은 편이다. [투자 점수 진단] [그림 3] 투자 점수 진단 현대상사는 어느 측면에서 투자 매력도가 높은 종목일까? AI 인공지능 종목 분석 시스템을 이용해 성장성, 수익성, 효율성, 안전성, 저평가성, 추세 등 주가 수익률에 영향을 줄 수 있는 6가지 핵심 투자 지표를 점수화하여 종목의 투자 매력도를 계산해보았다. 그 결과 현대상사는 상대적으로 저평가 측면에서 두각을 드러내고 있었다. 저평가 점수는 기업의 가치 대비 주가의 수준이 어느 정도인지를 나타낸다. 현대상사는 특히 PSR 측면에서 가장 높은 점수는 기록했는데, 전체 시장 내 23위를 기록하며 상위 1.17%에 위치했다. 업종별로는 9위를 기록하며 상위 2.4%에 위치했다. 그러나 재무건전성을 나타내는 기업안정성 측면에서는 아쉬운 점을 나타냈다. (위의 AI인공지능 점수는 재무 데이터를 기반으로 전체 상장 종목과 비교/분석하여 도출한 점수로 높은 점수가 반드시 높은 수익률을 보장하지 않습니다. 위의 자료는 당사의 추천 종목이 아니며, 투자 시 참고용으로 제시해드리는 것입니다. 핵심투자지표를 결합해 종목의 투자매력도를 종합 계산한 ""인공지능 투자점수""는 ""거장들의 투자공식"" 앱에서 확인하실 수 있습니다.) 라이온봇 기자 -한국경제TV※ 본 기사는 한국경제TV와 '거장들의 투자공식이'자체 개발한 '라이온봇 기자'가 실시간으로 작성한 기사입니다. 라이온봇기자 ⓒ 한국경제TV, 무단 전재 및 재배포 금지 한국경제TV 관련뉴스해당 언론사에서 선정하며 언론사 페이지(아웃링크)로 이동해 볼 수 있습니다.치아교정 해볼까…송곳니 위치에 달렸다'형이 왜 거기서 나와?' 놀림감 된 독일 골키퍼 노이어 ""괴롭고 처참해""무역전쟁의 끝은 '위안화 절상'…""000株 선점하라""은퇴세대 건보료 '폭탄'…월 19만원 더 내야멕시코 반응 폭발 ""우리 모두는 한국인""..항공권도 할인"
서울경제,011760,/news/news_read.nhn?article_id=0002814253&office_id=011&mode=search&query=현대상사&page=1,2016-04-04 16:50,현대종합상사.씨앤에프 총괄부회장에 김원갑,김원갑 총괄부회장
한국경제,011760,/news/news_read.nhn?article_id=0003548077&office_id=015&mode=search&query=현대상사&page=1,2016-02-18 07:34,"&quot;현대상사, 무역 부진+ 예멘 불확실성&hellip;목표가&darr;&quot;-NH","[ 권민경 기자  ] NH투자증권은 18일 현대상사(현대종합상사)에 대해 경기 악화로 수익성이 부진할 것이라며 목표주가를 4만5000원에서 2만9000원으로 크게 낮췄다. 투자의견은 '중립'을 유지했다. 이민재 연구원은 ""현대상사 무역 부문은 글로벌 시황 악화에 따라 부진할 전망""이라며 ""특히 주 판매처가 신흥국인 차량 부문 이익이 저조할 것""이라고 분석했다. 이어 ""무역 부문에서는 추가적인 사업 계획이 없는터라 예멘 LNG 가동 시점이 주가 상승 요인으로 작용할 것""이라면서도 ""이 역시 아직 재가동 여부가 불투명한 상황""이라고 진단했다. 예멘 내 상황은 크게 변화하지 않았고, 저유가 기조가 이어지면서 자원 개발 부문의 다른 지역(카타르, 오만 등) 수익성도 나빠지고 있다는 설명이다. 이 연구원은 ""예멘을 제외하면 카타르나 오만은 생산량도 줄어들 것""이라며 ""예멘 LNG가 재가동하지 않는다면 현대상사의 자원개발 부문 비중 역시 지속적으로 감소할 것""이라고 내다봤다. 권민경 한경닷컴 기자"
서울경제,011760,/news/news_read.nhn?article_id=0003284537&office_id=011&mode=search&query=현대상사&page=1,2018-04-30 12:22,"&lt;유&gt;현대상사, 전일 대비 7.58% 상승.. 일일회전율은 4.01% 기록","[서울경제] 현대상사(011760) 는 30일 오후 12시 21분 현재 7.58% 오른 22,000원에 거래되고 있으며, 44(매도):56(매수)의 매수우위를 기록하고 있다. 거래대금은 113억4,613만, 거래량은 53만1,049주로 거래량회전율은 4.01%로 나타났다. 지난 1개월간 현대상사는 상승 14회, 하락 12회를 기록했고, 주가수익률은 25.00% 표준편차는 2.13%를 기록했다. 이 기간 ' 유통업 ' 업종 평균 주가수익률은 5.84%로 나타났으며, 변동성은 0.95%를 기록했다. 이 시각 현재 ' 유통업 '은 0.86% 상승 중이며, 54(매도):46(매수)의 매도우위를 기록하고 있다."
한국경제TV,011760,/news/news_read.nhn?article_id=0000636939&office_id=215&mode=search&query=현대상사&page=1,2018-05-21 22:43,[국고처 권태민] 종목상담 - 현대상사(011760),[한국경제TV 류장현 PD] [국고처 권태민] 종목상담 - 현대상사(011760) 05월 19일 방송된 '국민주식고충처리반'에 출연한 권태민파트너가 현대상사(011760)에 대한 시세와 전망을 이야기하고 있다.
서울경제,011760,/news/news_read.nhn?article_id=0003288047&office_id=011&mode=search&query=현대상사&page=1,2018-05-03 17:05,"현대종합상사, 1Q 영업익 전년比 33% 상승..113억","[서울경제] 현대종합상사는 1-4분기 영업이익이 113억5,800만원을 기록했다고 3일 공시했다. 이는 전년 동기 대비 33% 증가한 기록이다. 같은 기간 매출은 13% 증가한 1조1,904억원을 올렸다."
파이낸셜뉴스,011760,/news/news_read.nhn?article_id=0003859589&office_id=014&mode=search&query=현대상사&page=1,2017-08-17 09:24,"[fnRASSI]현대상사, 52주 신고가...3.45% &uarr;","현대상사(011760)는 52주신고가를 기록하고 있어 주목할만하다. 동종목의 현재 주가는 22,450원 선에서 이루어지고 있다. 거래일을 기준으로 최근 3일간 평균 거래량은 14만 주이다. 이는 60일 일 평균 거래량 4만 주와 비교해보면 최근 거래량이 급격히 늘어났다는 것을 알 수 있다. 기관투자자 연속 0일 순매도 최근 5일간 동종목의 외국인 투자자는 18,873주 순매수하였고 마찬가지로 기관은 18,343주 순매수하였다. 전날 외국인 149주 순매도, 기관18,343주 순매수하며 보유 비율이 변동했다. 다음 표는 동종목의 외국인, 기관의 일별 순매수량을 나타낸 것이다. 기관투자자의 거래참여 높아, 거래비중 20.86% 최근 한달간 주체별 거래비중을 살펴보면 개인이 67.78%, 기관이 20.86%, 외국인은 11.35%를 기록한 것으로 나타났다. 그리고 최근 5일간 거래비중은 개인이 전체 거래량의 63.88%를 차지하며 가장 활발한 참여를 보였고, 기관은 27.06%, 외국인은 9.05%의 거래 참여율을 보였다. 'fnRASSI'는 증권전문 기업 씽크풀과 파이낸셜뉴스의 협업으로 로봇기자가 실시간으로 생산하는 기사입니다."
뉴스1,011760,/news/news_read.nhn?article_id=0003538440&office_id=421&mode=search&query=현대상사&page=1,2018-08-16 19:32,"정몽혁 현대종합상사 회장, 고 변중석 여사 제사 참석",(서울=뉴스1) 유승관 기자 = 정몽혁 현대종합상사 회장이 16일 오후 故 정주영 현대그룹 명예회장의 부인 고 변중석 여사의 11주기 제사에 참석하기 위해 서울 용산구 한남동 정몽구 현대자동차그룹 회장 자택으로 들어가고 있다. 2018.8.16/뉴스1
머니투데이,011760,/news/news_read.nhn?article_id=0003658990&office_id=008&mode=search&query=현대상사&page=1,2016-04-04 16:53,"현대종합상사, 김원갑 전 현대하이스코 부회장 영입","[머니투데이 강기준 기자] 김원갑 현대종합상사·현대씨앤에프 총괄 부회장. /사진제공=현대종합상사 현대종합상사·현대씨앤에프는 지난 1일부로 김원갑 전 현대하이스코 부회장을 양사 총괄부회장에 임명했다고 4일 밝혔다. 김 부회장은 재무·회계 전문가로 1978년 현대건설 경리부에 입사해 현대그룹 종합기획실, 현대자동차 전무이사, 현대위아 부사장을 거쳤다. 2002년 현대하이스코 부사장에 선임됐고 2003년에는 대표이사 사장에 올랐다. 2005년부터 2014년까지 대표이사 부회장을 지냈다. 현대종합상사 관계자는 ""김 부회장이 기업경영 경륜과 풍부한 사업운영 경험을 바탕으로 새로 출범하는 그룹체제 정비와 수익성 중심의 내실경영 구축, 신성장 사업 등을 추진할 것""이라고 말했다. textlinktopstart textlinktopend textlinkstart"
이데일리,011760,/news/news_read.nhn?article_id=0003536658&office_id=018&mode=search&query=현대상사&page=1,2016-05-04 15:39,"현대종합상사, 현대자원개발 흡수합병",[이데일리 함정선 기자] 현대종합상사(011760)는 현대자원개발 주식회사를 합병한다고 4일 공시했다. 합병비율은 1:0 흡수합병으로 합병으로 인해 발행할 신주는 없다.
한겨레,011760,/news/news_read.nhn?article_id=0002300700&office_id=028&mode=search&query=현대상사&page=1,2015-12-18 19:55,"현대중공업, 현대종합상사 계열 분리 추진","[한겨레] 현대씨앤에프도…1194억원어치 주식 매각“핵심 사업 위주로 그룹 역량 집중하기 위해”현대종합상사는 정몽혁 회장 중심 체제 구축 현대중공업그룹이 현대종합상사와 현대씨앤에프에 대한 계열 분리를 추진한다. 현대중공업은 18일 이사회를 열고 현대종합상사와 현대씨앤에프 주식을 각각 현대씨앤에프와 정몽혁(고 정주영 회장의 조카) 현대종합상사 회장에게 매각하기로 결정했다고 밝혔다. 이날 현대중공업은 보유 중인 현대종합상사 주식(22.36%)의 일부인 256만2000주(19.37%)를 797억7000만원에 현대씨앤에프에 매각했다. 현대씨앤에프 주식(22.36%)의 일부인 111만4463주(12.25%)는 396억3000만원에 정몽혁 회장 등에게 매각했다. 매각 대금은 총 1194억원이다. 이날 현대중공업의 주식 매각에 따라 현대종합상사 최대주주는 현대씨앤에프(19.37%)가, 현대씨앤에프 최대주주는 정몽혁 회장(21.15%)이 됐다. 현대종합상사는 지난 10월 각 부문별 지속 성장을 위해 무역·자원사업(현대종합상사)과 브랜드·신사업(현대씨앤에프)으로 회사를 ‘인적 분할’한 바 있다. 현대중공업은 이번 주식 매각 이후에도 현대종합상사 39만5900주(2.99%), 현대씨앤에프 92만 418주(10.11%)를 여전히 보유하게 된다. 그러나 내년 초 공정거래위원회에 계열 분리 승인을 신청해 현대종합상사의 계열 분리를 추진할 계획이다. 현대중공업의 기업집단에 속한 국내 계열사는 27개로, 이중 상장사는 현대중공업· 현대미포조선·현대종합상사 등 3개사이다. 현대중공업 관계자는 “현대종합상사의 계열 분리 추진은 그룹의 역량을 핵심 사업 위주로 집중해 나가기 위한 것으로, 최대주주 변경 뒤에도 비즈니스 협력 관계는 변함없이 계속 유지될 것”이라고 말했다."
머니투데이,011760,/news/news_read.nhn?article_id=0003642542&office_id=008&mode=search&query=현대상사&page=1,2016-03-07 08:17,"현대상사, 주가 저평가..분할 매수 시점-HMC","[머니투데이 정인지 기자] HMC투자증권은 7일 현대상사에 대해 주가가 저평가 돼 있다며 투자의견 '매수'를 유지했다. 목표주가는 기존 4만9000원에서 3만2000원으로 낮췄다. 박종렬 HMC투자증권 연구원은 ""예멘LNG광구의 가동 중단이 지속되고 있지만, 올해 3월말 종전 협상 타결 가능성도 상존한다""며 ""재가동까지는 적어도 3~4개월이 소요돼 8월 이후에나 가능할 전망""이라고 밝혔다. 그는 ""최근 국제유가가 산유국들의 생산량 동결 합의 이후 큰 폭 반등함으로써 commodity 관련주들도 그동안의 낙폭을 빠르게 만회하고 있는데, 현대상사의 주가는 부진한 모습이 지속되고 있다""며 ""이는 예멘LNG가스전이 가동 중단된 상태라 동사 주가에 대한 매력도가 떨어져 있기 때문""이라고 분석했다. 박 연구원은 ""현재 주가는 PER 5.4배, PBR 0.5배로 저평가 상태""라며 ""상반기까지는 업황이 부진하겠지만 하반기에는 지난해 기저효과와 상품 가격이 회복될 것으로 보여 예멘LNG 재가동 시기를 눈여겨 보면서 저점 분할 매수로 접근할 필요가 있다""고 판단했다. textlinktopstart textlinktopend textlinkstart"
뉴시스,011760,/news/news_read.nhn?article_id=0007389768&office_id=003&mode=search&query=현대상사&page=1,2016-08-04 17:18,"현대종합상사, 현대重 물품대금 청구소송서 423억 배상 판결","【서울=뉴시스】김주아 기자 = 현대종합상사(011760)는 현대중공업(009540)이 대한상사중재원에 제기한 물품대금 등 청구 소송에서 423억6235만8728원을 지급하라는 판결을 받았다고 4일 공시했다. 대한상사중재원은 ""현대종합상사는 현대중공업에게 미화 3802만7252달러와 이에 대해 지난 5월5일부터 다 갚는 날까지 연 6%의 비율로 계산한 돈을 지급하라""고 이날 판결했다."
이데일리,011760,/news/news_read.nhn?article_id=0003393987&office_id=018&mode=search&query=현대상사&page=1,2015-11-13 13:36,"현대상사&middot; 한전KDN, 해외사업 협력 MOU","- 에너지 신사업 분야 해외시장 개척 시너지 기대 문제달(좌측부터) 한전KDN  처장과 이유경 현대종합상사 전무가 해외사업 협력 MOU를 체결하고 있다. 현대종합상사 제공. [이데일리 정태선 기자] 현대종합상사는 한전KDN과 전력에너지 ICT와 스마트그리드 분야의 해외사업 협력을 위한 MOU(양해각서)를 체결했다. 주요 협력 분야는 △전력 ICT와 스마트그리드 해외사업 △해외사업 시장개척을 위한 공동마케팅 △기타 상호 협의에 따른 협력 필요사항 등이다. 두 회사는 13일 오전 11시 현대종합상사 서울 본사에서 현대종합상사 이유경 산업플랜트부문 전무와 한전KDN 문제달 스마트그리드 사업처장 등 관련 인사들이 참석한 가운데 MOU 체결식을 했다. 현대종합상사는 자사의 글로벌 비즈니스 노하우와 한전KDN의 에너지 ICT 기술을 결합시켜 해외시장에서 새로운 미래 성장 동력을 창출한다는 전략이다. 회사 관계자는 “이번 MOU가 에너지 신사업 분야 시장개척에 큰 시너지 효과가 있을 것으로 기대한다”면서 “관련 사업 해외시장 발굴에 더욱 적극적으로 나설 계획”이라고 말했다. 좌측부터 한전KDN  정선철 과장, 공재준 차장,  윤선영 팀장, 문제달 처장, 현대종합상사 이유경 전무,  박근우 상무, 신민철 부장. 현대종합상사 제공."
전자신문,011760,/news/news_read.nhn?article_id=0002632455&office_id=030&mode=search&query=현대상사&page=1,2017-08-10 10:25,"[ET투자뉴스]현대상사, &quot;살아나고 있는 실적&hellip;&quot; 매수-삼성증권","삼성증권에서 10일 현대상사(011760)에 대해 ""살아나고 있는 실적 모멘텀""라며 투자의견을 '매수'로 제시하였고, 아울러 목표주가로는 28,000원을 내놓았다. 삼성증권 박종렬 애널리스트가 동종목에 대하여 이번에 제시한 '매수'의견은 삼성증권에서는 올해들어 처음 내놓는 매매의견이며 그리고 최근 분기내 발표된 전체 증권사 리포트의 컨센서스와 비교를 해볼 경우에 오늘 발표된 투자의견은 전체의견에 수렴하고 있어, 이번 의견은 시장의 평균적인 기대감이 객관적으로 표현된 것으로 분석되고 있다. 또한 전일 종가 기준으로 볼때 동종목의 현주가는 이번에 제시된 목표가 대비 33.3%의 저평가 요인이 존재한다는 해석이 제시되고 있다."
서울경제,011760,/news/news_read.nhn?article_id=0003308646&office_id=011&mode=search&query=현대상사&page=1,2018-05-29 09:02,"&lt;유&gt;현대상사, 장중 신고가 돌파.. 42,000&rarr;44,500(▲2,500)","[서울경제] 오전 9시 0분 현재 현대상사(011760) 가 7.75% 오른 44,500원(▲3,200)을 기록하며, 52주 신고가를 +2,500원 경신했다. 기존 52주 최고가는 2018년 05월 23일 기록한 42,000원이다. 체결강도는 353%로 강세 반전했다. 총매수체결량은 53,391주, 총매도체결량은 15,142주를 각각 기록했다.  (※ 체결강도(%) = (총매수체결량/총매도체결량)*100) 이 시각 현재 거래대금은 59억3,116만, 거래량은 13만7,558주를 기록하고 있으며, 수급측면으로는 22(매도):78(매수)의 매수우위를 보이고 있다. 거래일을 기준으로 최근 3일간 평균 거래량은 1백4십9만5천주, 60일 평균 거래량 5십3만1천주로 최근 거래량이 큰 폭으로 증가하는 추세다."
한국일보,011760,/news/news_read.nhn?article_id=0000116406&office_id=469&mode=search&query=현대상사&page=1,2015-12-18 19:01,"현대중공업그룹, 현대종합상사 계열분리 추진","현대중공업그룹이 계열사인 현대종합상사의 지분을 매각해 계열 분리를 추진한다. 지난해 3조원대 영업손실에 이어 올해 3분기까지 8분기 연속 적자를 기록중인 현대중공업의 재무구조를 개선하고 핵심 사업에 역량을 집중하기 위해서다. 현대중공업은 18일 이사회를 열고 보유 중인 현대종합상사와 현대씨앤에프 주식을 각각 현대씨앤에프와 현대종합상사의 정몽혁 회장에게 매각하기로 의결했다. 매각 대상은 현대종합상사 주식 256만2,000주(19.37%)와 현대씨앤에프 주식 111만4,463주(12.25%)다. 대금은 총 1,194억원이며 증시 종료 후 시간 외 대량 매매 방식으로 매각된다. 2009년 12월 현대중공업에 인수된 현대종합상사는 고 정주영 전 현대그룹 명예회장의 다섯째 동생인 고 정신영씨의 외아들 정몽혁 회장이 2010년부터 회사를 이끌고 있다. 이날 결정으로 정몽혁 회장(21.15%)이 현대씨앤에프의 최대주주에 오르고, 현대씨앤에프(19.37%)는 현대종합상사의 최대주주가 된다. 현대중공업은 내년 초 공정거래위원회에 계열분리 승인을 신청해 상반기 중 계열분리를 마무리할 예정이다."
파이낸셜뉴스,011760,/news/news_read.nhn?article_id=0003951487&office_id=014&mode=search&query=현대상사&page=1,2018-01-25 10:29,"[fnRASSI]현대상사, 2.02% 오르며 거래량 증가","현대상사(011760)의 현재 거래량이 최근 5거래일 거래량의 최고치를 경신했다. 그리고 현대상사는 3일 연속 상승흐름을 보이며, 10시 18분 현재 2.02% 증가한 20,250원에 거래중이다. 외국인투자자의 거래참여 활발, 거래비중 17.78% 최근 한달간 주체별 거래비중을 살펴보면 개인이 68.72%, 외국인이 17.78%, 기관은 13.49%를 기록한 것으로 나타났다. 그리고 최근 5일간 거래비중은 개인이 59.84%, 외국인이 21.93%, 기관은 18.21%를 기록한 것으로 나타났다. 외국인과 기관은 순매도, 개인은 순매수(한달누적)  1월19일부터 전일까지 기관이 4거래일 연속 순매도를 보였다. 4주간을 기준으로 보면 외국인이 초반에 동종목을 순매도한 이후에 근래에는 순매도량을 줄이면서 13,189주를 순매도했고, 기관도 순매도로 돌아서면서 18,898주를 순매도했지만, 개인은 오히려 순매도를 기록하다가 다시 순매수로 돌아서면서 32,087주를 순매수했다. 'fnRASSI'는 증권전문 기업 씽크풀과 파이낸셜뉴스의 협업으로 로봇기자가 실시간으로 생산하는 기사입니다."
스포츠조선,011760,/news/news_read.nhn?article_id=0002860044&office_id=076&mode=search&query=현대상사&page=1,2015-12-17 09:34,[2015 하반기 고객만족도 1위 상품] 현대상사-현대방수강판지붕,"기와 형태의 전통적인 지붕은 시간이 흐르면 균열이 생기고 방수와 단열에 문제점이 발생한다. 독창적인 디자인과 혁신적인 지붕 개량 기술로 내실 있는 성장을 하고 있는 현대상사는 이러한 전통 지붕을 새롭게 개조해 호평을 듣고 있다. 김종욱 현대상사 사장은 부친이 운영하던 '특수강판 지붕공사' 사업을 가업으로 이어받아 현재 일반 주택, 박물관, 교회, 사찰, 아파트 등 각종 건물을 맞춤형 기와형 지붕으로 개조하고 있다. 현대상사의 주력 사업인 컬러강판공사는 한 번의 시공으로 하자 보증이 필요 없는 반영구적인 지붕으로 바꾸어 준다. 부식에 강하며, 색상 변질이 없어 보기에 깔끔하고, 기존 지붕재의 철거 없이 시공이 가능하기 때문에 공사비 및 공사 기간이 줄어든다. 또한 기존 지붕재 위에 덧시공하는 공법이라 보온과 단열 효과까지 증대되는 효과가 있다. 현대상사는 지붕 개조와 함께 강판 재료도 도소매하고 있으며 하자이행증권을 3∼5년 발행하고 최장 36개월 할부를 실시해 의뢰 업체의 만족도가 높다."
파이낸셜뉴스,011760,/news/news_read.nhn?article_id=0004037630&office_id=014&mode=search&query=현대상사&page=1,2018-06-11 15:22,"[fnRASSI]현대상사(011760), 52주 신고가 경신...15.93% &uarr;","현대상사(011760)는 52주신고가를 기록하고 있어 주목할만하다. 동종목의 현재 주가는 49,850원 선에서 이루어지고 있다. 거래일을 기준으로 최근 3일간 평균 거래량은 317만 주이다. 이는 60일 일 평균 거래량 78만 주와 비교해보면 최근 거래량이 급격히 늘어났다는 것을 알 수 있다. 외국인 보유량 감소, 기관 증가 (5일 누적) 최근 5일간 동종목의 외국인 투자자는 40,299주 순매도하였고 반면 기관은 760주 순매수하였다. 전날 두 주체 각각 46,673주, 760주 순매도하며 보유 비율을 줄였다. 다음 표는 동종목의 외국인, 기관의 일별 순매수량을 나타낸 것이다. 거래비중은 개인투자자가 가장 높아 최근 한달간 주체별 거래비중을 살펴보면 개인이 91.97%, 외국인이 5.18%, 기관은 2.84%를 기록했다. 그리고 최근 5일간 거래비중은 개인이 92.95%, 외국인이 6.48%, 기관은 0.56%를 기록한 것으로 나타났다. 'fnRASSI'는 증권전문 기업 씽크풀과 파이낸셜뉴스의 협업으로 로봇기자가 실시간으로 생산하는 기사입니다."
전자신문,011760,/news/news_read.nhn?article_id=0002658348&office_id=030&mode=search&query=현대상사&page=1,2017-11-16 10:15,"[ET투자뉴스]현대상사, &quot;소외의 끝은 어디일&hellip;&quot; 매수-HMC투자증권","HMC투자증권에서 16일 현대상사(011760)에 대해 ""소외의 끝은 어디일까""라며 투자의견을 '매수'로 제시하였고, 아울러 목표주가로는 28,000원을 내놓았다. HMC투자증권 박종렬 애널리스트가 동종목에 대하여 이번에 제시한 '매수'의견은 HMC투자증권의 직전 매매의견과 동일한 것이고 그리고 최근 분기내 발표된 전체 증권사 리포트의 컨센서스와 비교를 해볼 경우에 오늘 발표된 투자의견은 전체의견에 수렴하고 있어, 이번 의견은 시장의 평균적인 기대감이 객관적으로 표현된 것으로 분석되고 있다. 목표주가의 추이를 살펴보면 이번에 다시 목표가가 같은 수준을 유지하면서 최근 흐름은 목표가의 계단식 하향조정이 진행되는 모습이다. 또한 전일 종가 기준으로 볼때 동종목의 현주가는 이번에 제시된 목표가 대비 36.9%의 저평가 요인이 존재한다는 해석이 제시되고 있다."
