source,symbol,link,date,title,content
한국경제TV,011760,/news/news_read.nhn?article_id=0000627190&office_id=215&mode=search&query=현대상사&page=1,2018-04-26 11:19,"현대상사, 전일 대비 약 7% 상승한 21,250원","[한국경제TV 라이온봇 기자] 현대상사는 4월 26일 11시 18분 전일 대비 약 7% 상승한 21,250원에 거래되고 있다. 현대상사는 코스피 상장 기업으로 유통업 업종에 속해 있다. 시가총액은 2,678억원으로 코스피 상장기업 중 381위에 위치 해 있다. [종목 성향 진단] [그림 1] 종목 성향 진단 현대상사의 투자 스타일은 가치주에 가깝다. 기업 가치 대비 낮은 주가가 매력적인 기업이다. 주가 모멘텀은 좋은 편에 속했다. 최근 1개월 수익률은 15.71%의 상승폭을 기록했다. 현대상사 종목에 대한 투자자의 관심도는 높은 편에 속한다. [투자 점수 진단] [그림 2] 투자 점수 진단 현대상사는 성장성(매출증가율(YoY)) 측면에서 두각을 나타내고 있다. 최근 매출증가율(YoY)은 80점으로 6개의 핵심 팩터 중 가장 높은 점수를 기록했다. 매출증가율(YoY)은  전체 시장 내 359위를 기록하며 상위 19.71%에 위치했다. 업종별로는 56위를 기록하며 상위 17.3%에 위치했다. 그리고 저평가성2(PBR) 역시 도드라지는 편이다. 저평가성2 점수는 78점으로 두번째로 높은 점수를 기록했다. PBR은 전체 시장 내 421위를 기록하며 상위 22.45%에 위치했다. 업종별로는 90위를 기록하며 상위 27.99%에 위치했다. 그러나 부채비율과 PER은  아쉬움을 나타냈다. [종합 투자점수] [그림 3] 종합 투자점수 AI 인공지능 분석을 통한 현대상사의 종목 종합 스코어는 60점을 기록했다. 이는 동일 업종 평균점수인 59점과 시장 평균점수인 59점를 상회하는 수치였다. (위의 AI인공지능 점수는 재무 데이터를 기반으로 전체 상장 종목과 비교/분석하여 도출한 점수로 높은 점수가 반드시 높은 수익률을 보장하지 않습니다. 위의 자료는 당사의 추천 종목이 아니며, 투자 시 참고용으로 제시해드리는 것입니다.) 라이온봇 기자 -한국경제TV※ 본 기사는 한국경제TV와 '거장들의 투자공식이'자체 개발한 '라이온봇 기자'가 실시간으로 작성한 기사입니다. 라이온봇기자 ⓒ 한국경제TV, 무단 전재 및 재배포 금지 한국경제TV 관련뉴스해당 언론사에서 선정하며 언론사 페이지(아웃링크)로 이동해 볼 수 있습니다.왕빛나 서구적 몸매 비결…'20kg을 한 번에?'유병자 실손보험, 삼성화재 '가장 비싸'쏘가리 가격 '확' 떨어진다…22년 연구 끝에 '대량양식' 성공박하선 '다이어트 성공' 인증샷 ""웰컴백 44사이즈""손은서♥이주승 열애 인정, '연상녀-연하남커플' 합류"
머니투데이,011760,/news/news_read.nhn?article_id=0003655050&office_id=008&mode=search&query=현대상사&page=1,2016-03-28 17:57,"현대중공업, 현대종합상사 지분율 30.66%&rarr;2.99%",[머니투데이 유엄식 기자] 현대중공업은 계열분리를 통해 정몽혁 현대종합상사 회장과 현대씨앤에프의 특별관계가 해소됨에 따라 현대종합상사 보유지분이 405만5501주(30.66%)에서 39만5900주(2.99%)로 감소했다고 28일 공시했다. textlinktopstart textlinktopend textlinkstart
서울경제,011760,/news/news_read.nhn?article_id=0003144226&office_id=011&mode=search&query=현대상사&page=1,2017-11-02 16:41,"현대상사, 싱가포르 법인에 279억 규모 채무보증 결정","[서울경제] 현대상사(011760) 는 계열회사인 현대종합상사 싱가포르 법인에 279억2,000만원 규모 채무보증을 결정했다고 2일 공시했다."
전자신문,011760,/news/news_read.nhn?article_id=0002693864&office_id=030&mode=search&query=현대상사&page=1,2018-03-26 10:43,"[ET투자뉴스]현대상사, &quot;실적 개선에 비해 &hellip;&quot; 매수-현대차투자증권","현대차투자증권에서 26일 현대상사(011760)에 대해 ""실적 개선에 비해 과도한 주가 하락""라며 투자의견을 '매수'로 제시하였고, 아울러 목표주가로는 28,000원을 내놓았다. 현대차투자증권 박종렬 애널리스트가 동종목에 대하여 이번에 제시한 '매수'의견은 현대차투자증권의 직전 매매의견과 동일한 것이고 전년도말의 매매의견을 기준으로  볼때도 역시 '매수'의견이 계속 유지되고 있는 상태이다. 그리고 최근 분기내 발표된 전체 증권사 리포트의 컨센서스와 비교를 해볼 경우에 오늘 발표된 투자의견은 전체의견에 수렴하고 있어, 이번 의견은 시장의 평균적인 기대감이 객관적으로 표현된 것으로 분석되고 있다. 목표주가의 추이를 살펴보면 최근 장기간 목표가가 같은 수준에 머물고 있는 모습이다. 또한 전일 종가 기준으로 볼때 동종목의 현주가는 이번에 제시된 목표가 대비 60%의 저평가 요인이 존재한다는 해석이 제시되고 있다."
뉴시스,011760,/news/news_read.nhn?article_id=0007588648&office_id=003&mode=search&query=현대상사&page=1,2016-11-14 17:36,"현대종합상사, 싱가포르 법인에 419억 규모 채무보증 결정","【서울=뉴시스】김주아 기자 = 현대종합상사(011760)는 싱가포르 법인(HYUNDAI CORPORATION SINGAPORE PTE.LTD.)에 419억1840만원의 채무보증을 결정했다고 14일 공시했다. 이는 지난해 자기자본의 8.56% 규모다. 채무보증기간은 이날부터 2017년 11월14일까지다. 회사 측은 ""기존 채무보증 한도 1800만달러를 3600만달러로 증액연장한 것""이라고 설명했다."
서울경제,011760,/news/news_read.nhn?article_id=0003295665&office_id=011&mode=search&query=현대상사&page=1,2018-05-14 09:19,"&lt;유&gt;현대상사, 상한가 진입.. +29.92% &uarr;","[서울경제] 오전 9시 18분 현재 현대상사(011760) 가 +29.92% 오른 34,300원(▲7,900)으로 장중 상한가에 진입했다. 거래대금은 401억1,411만, 거래량은 124만4,197주를 기록하고 있으며, 수급측면으로는 38(매도):62(매수)의 매수우위를 보이고 있다. 현대상사는 전일 상승(26,400원, ▲3,700, +16.30%)한데 이어 이틀 연속 상승세를 이어가고 있다. 지난 1개월간 현대상사는 상승 14회, 하락 12회를 기록했고, 주가수익률은 91.09%였다. 이 기간 ' 유통업 ' 업종 평균 주가수익률은 4.03%를 기록했다. 현재 ' 유통업 ' 총 62개 종목 중 상한가 종목은 1개, 상승 종목은 37개로, 일부 종목만이 상승세를 보이고 있다. ( 혜인(003010) +22.59%, 현대코퍼레이션홀딩스(227840) +20.81%, SK네트웍스우(001745) +10.99%)"
머니투데이,011760,/news/news_read.nhn?article_id=0004028100&office_id=008&mode=search&query=현대상사&page=1,2018-03-26 08:24,"현대상사, 주가하락 과도..실적 개선 전망-현대차증권","[머니투데이 송정훈 기자] 현대차투자증권은 현대상사에 대해 매수 의견과 목표주가 2만8000원을 유지했다. 현대차투자증권 박종렬 연구원은 26일 ""최근 주가 급락은 과도한 것으로 판단된다""며 ""이는 미국의 철강 관세 부과에 대한 영향 크지 않고 올해도 양호한 실적 모멘텀 유지될 것이기 때문""이라고 밝혔다. 박 연구원은 ""올해 실적 개선이 가능할 전망""이라며 ""원화강세에도 불구하고 세계경기 호조에 따른 교역량 확대와 국제유가를 비롯한 원자재 가격 상승 등으로 영업환경이 우호적""이라고 지적했다. 이어 ""원자재 가격 상승으로 트레이딩과 자원개발 부문이 호조를 보이면서 영업실적의 양호한 성장이 가능할 것""이라고 덧붙였다."
한국경제TV,011760,/news/news_read.nhn?article_id=0000630415&office_id=215&mode=search&query=현대상사&page=1,2018-05-04 14:17,"현대상사, 전일 대비 약 4% 상승한 23,300원","[한국경제TV 라이온봇 기자] 현대상사는 5월 4일 14시 16분 전일 대비 약 4% 상승한 23,300원에 거래되고 있다. 현대상사는 코스피 상장 기업으로 유통업 업종에 속해 있다. 시가총액은 2,956억원으로 코스피 상장기업 중 370위에 위치 해 있다. [종목 성향 진단] [그림 1] 종목 성향 진단 현대상사의 투자 스타일은 가치주에 가깝다. 기업 가치 대비 낮은 주가가 매력적인 기업이다. 주가 모멘텀은 좋은 편에 속했다. 최근 1개월 수익률은 21.8%의 상승폭을 기록했다. 현대상사 종목에 대한 투자자의 관심도는 높은 편에 속한다. [투자 점수 진단] [그림 2] 투자 점수 진단 현대상사는 성장성(매출증가율(YoY)) 측면에서 두각을 나타내고 있다. 최근 매출증가율(YoY)은 80점으로 6개의 핵심 팩터 중 가장 높은 점수를 기록했다. 매출증가율(YoY)은  전체 시장 내 359위를 기록하며 상위 19.71%에 위치했다. 업종별로는 56위를 기록하며 상위 17.3%에 위치했다. 그리고 저평가성2(PBR) 역시 도드라지는 편이다. 저평가성2 점수는 78점으로 두번째로 높은 점수를 기록했다. PBR은 전체 시장 내 421위를 기록하며 상위 22.45%에 위치했다. 업종별로는 90위를 기록하며 상위 27.99%에 위치했다. 그러나 부채비율과 PER은  아쉬움을 나타냈다. [종합 투자점수] [그림 3] 종합 투자점수 AI 인공지능 분석을 통한 현대상사의 종목 종합 스코어는 58점을 기록했다. 이는 동일 업종 평균점수인 58점과 시장 평균점수인 58점과 동일한 수준이었다. (위의 AI인공지능 점수는 재무 데이터를 기반으로 전체 상장 종목과 비교/분석하여 도출한 점수로 높은 점수가 반드시 높은 수익률을 보장하지 않습니다. 위의 자료는 당사의 추천 종목이 아니며, 투자 시 참고용으로 제시해드리는 것입니다.) 라이온봇 기자 -한국경제TV※ 본 기사는 한국경제TV와 '거장들의 투자공식이'자체 개발한 '라이온봇 기자'가 실시간으로 작성한 기사입니다. 라이온봇기자 ⓒ 한국경제TV, 무단 전재 및 재배포 금지 한국경제TV 관련뉴스해당 언론사에서 선정하며 언론사 페이지(아웃링크)로 이동해 볼 수 있습니다.충남 청양에서 잡힌 '대형 메기', 크기가 무려…홍윤화 다이어트 식단 공개, 건강하게 살 빼는 비결 무엇?이명희 '임산부' 갑질…""조선시대 노비 다루듯""美 '최악의 연쇄살인' 풀렸다…소름돋는 범인 정체왕빛나 서구적 몸매 비결…'20kg을 한 번에?'"
연합뉴스,011760,/news/news_read.nhn?article_id=0008386711&office_id=001&mode=search&query=현대상사&page=1,2016-05-09 09:31,"&lt;특징주&gt; 현대상사, 931억 물품대금 분쟁에 약세","(서울=연합뉴스) 임수정 기자 = 현대상사가 현대중공업의 물품대금 지급 청구 중재 신청으로 9일 약세를 나타냈다. 이날 오전 9시27분 현재 유가증권시장에서 현대상사는 전 거래일보다 5.01% 하락한 2만4천650원에 거래됐다. 현대상사는 지난 4일 현대중공업이 자사를 상대로 대한상사중재원에 물품대금 지급 청구 중재 신청을 냈다고 공시했다. 청구액은 약 931억원으로, 작년 말 연결기준 자기자본의 19%에 해당한다."
머니투데이,011760,/news/news_read.nhn?article_id=0003565148&office_id=008&mode=search&query=현대상사&page=1,2015-10-23 09:26,[특징주]분할상장 첫날 현대상사&middot;현대C&amp;F&darr;,"[머니투데이 김성은 기자] 현대씨앤에프가 현대상사에서 인적분할 후 상장 첫 날 하락세다. 존속회사로서 변경 상장된 현대상사도 약세를 보이고 있다. 23일 오전 9시22분 현재 현대씨앤에프는 장 중 내림세로 돌아서 시초가 대비 2700원(5.40%) 내린 4만7300원에 거래중이다. 현대상사는 2150원(6.62%) 내린 3만350원에 거래중이다. 앞서 지난 5월 현대종합상사는 사업부문별 집중투자의 용이를 위해 현대상사는 무역 및 자원사업 부문을, 현대씨앤에프는 브랜드 및 신사업 부문을 담당하도록 분할한다고 밝혔다. textlinktopstart textlinktopend textlinkstart"
파이낸셜뉴스,011760,/news/news_read.nhn?article_id=0004020317&office_id=014&mode=search&query=현대상사&page=1,2018-05-14 10:58,"[fnRASSI]현대상사, 상한가 기록","현대상사(011760)는 상한가를 기록하고 있다. 동종목은 현재 34,300원선에서 이루어지고 있다. 참고로 52주 최고가는 34,300원(18년 05월 14일), 최저가는 17,400원(18년 03월 23일)원이다. 최근 3일동안 평균 거래량은 155만 주이다. 이는 250일 일 평균 거래량 8만 주와 비교해보면 최근 거래량이 급격히 늘어났다는 것을 알 수 있다. 외국인, 기관 모두 보유량 감소 (5일 누적) 최근 5일간 동종목의 외국인 투자자는 70,419주 순매도하였고 마찬가지로 기관은 4,448주 순매도하였다. 전날 두 주체 각각 19,702주, 4,448주 순매도하며 보유 비율을 줄였다. 다음 표는 동종목의 외국인, 기관의 일별 순매수량을 나타낸 것이다. 주요 투자주체는 개인투자자 최근 한달간 주체별 거래비중을 살펴보면 개인이 82.67%로 가장 높은 참여율을 보였고, 기관이 8.8%를 보였으며 외국인은 8.51%를 나타냈다. 그리고 최근 5일간 거래비중은 개인이 83.15%, 외국인이 10.24%, 기관은 6.59%를 기록한 것으로 나타났다. 'fnRASSI'는 증권전문 기업 씽크풀과 파이낸셜뉴스의 협업으로 로봇기자가 실시간으로 생산하는 기사입니다."
전자신문,011760,/news/news_read.nhn?article_id=0002725875&office_id=030&mode=search&query=현대상사&page=1,2018-07-23 09:59,"[ET투자뉴스]현대종합상사 18년2분기 실적 발표, 당기순이익 82.9억원&hellip; 전년...","07월 23일 현대종합상사(011760)의 2018년 2분기 연결 잠정 실적이 발표됐다. 매출액 1조 1061억원으로, 영업이익은 125억원으로 작년 동기 대비 각각 5.54%, 19.27% 증가했다. 반면 당기순이익은 82.9억원으로 57.39% 하락했다.이번분기 기준으로 추정되는 현대종합상사의 자기자본이익률(ROE)은 9%로 나타났다. 전년 동기인 2017년 2분기 ROE는 6.4%로 이번 분기에 2.6%p 상승했다. 한편 동종목의영업이익률은 1.1%이다. 이는 최근 1년동안 큰 변동없이 비슷한 수치이다. 지난해 동기 영업이익률은 0.8%로 이번 2분기가 0.3%p 상승했다.주가가 1주당 수익의 몇배가 되는지 나타내는 주가수익비율(PER)은 43.9배로 나타났다. 전년 동기 PER은 42.83배이다.주가가 1주당 순자산의 몇배인지 알려주는 주가순자산비율인 PBR은 0.99배이다. PBR은 최근 3분기 이상 꾸준히 상승하고 있다. 지난해 동기 PBR은 0.68배로 이번 2분기 PBR이 상승했다.다음은 현대종합상사와 동일 업종 내 비교 그룹 종목의 각각 최근 실적의 전년 동기 대비 성장률이다. 현대종합상사의 매출액 증감율은 타 종목 대비 양호한 편이다. 그리고 주가는 가장 높은 상승률을 보였다."
뉴스1,011760,/news/news_read.nhn?article_id=0001794766&office_id=421&mode=search&query=현대상사&page=1,2015-12-18 17:54,현대重 &quot;현대종합상사 주식 256만주 현대C&amp;F에 매각&quot;,(서울=뉴스1) 김진 기자 = 현대중공업은 재무구조 개선과 투자수익 실현을 위해 보유중인 현대종합상사 주식 256만2000주를 시간외 대량매매 방식으로 현대C&F에 매각한다고 18일 공시했다. 처분단가는 주당 3만1136원으로 처분금액은 797억7000만원이다. 처분후 소유주식수는 2.99%에 해당하는 39만5900주가 된다.
머니투데이,011760,/news/news_read.nhn?article_id=0004081461&office_id=008&mode=search&query=현대상사&page=1,2018-07-23 10:08,"현대상사, 올 2Q 영업이익 125억&hellip;전년比 19.3%&uarr;",[머니투데이 김남이 기자] 현대종합상사는 올 2분기 영업이익이 지난해 같은 기간보다 19.27% 증가한 125억원으로 잠정 집계됐다고 23일 밝혔다. 같은 기간 매출은 5.54% 늘어난 1조1061억원을 기록했다. 지난 2분기 당기순이익은 83억원으로 지난해 같은 기간보다 57.39% 감소했다.
아시아경제,011760,/news/news_read.nhn?article_id=0003716276&office_id=277&mode=search&query=현대상사&page=1,2016-03-28 18:19,"현대중공업, 계열분리로 현대종합상사 지분율 30.66%&rarr;2.99%",[아시아경제 원다라 기자] 현대중공업은 계열분리를 통해 정몽혁 현대종합상사 회장과 현대씨앤에프의 특별관계가 해소됨에 따라 현대종합상사 보유지분이 405만5501주(30.66%)에서 39만5900주(2.99%)로 감소했다고 28일 공시했다.
서울경제,011760,/news/news_read.nhn?article_id=0002754933&office_id=011&mode=search&query=현대상사&page=1,2015-10-28 11:31,"현대상사, 내년 예멘LNG가스전 재가동","HMC투자증권 박종렬 연구원은 현대상사(011760)에 대해 ""동사는 2016년에 자원개발(660억원)과 트레이딩(440억원)을 통해 세전이익 1,100억원을 실현해 제2의 도약기 원년이 될 전망. 올해 예멘LNG광구의 가동 중단으로 다소 지연됐지만 내년 재가동을 통해 기초체력(세전이익)을 확보할 것이고, 재가동 시점이 주가 상승의 촉매제로 작용할 전망""이라고 분석했다. 박 연구원은 28일 현대상사(011760)에 대해 ""확대되는 기업가치에 주목할 때""라며 투자의견을 '매수'로 제시하였고, 아울러 목표주가로는 49,000원을 내놓았다. 박 연구원이 동종목에 대하여 이번에 제시한 '매수'의견은 HMC투자증권의 직전 매매의견에서 큰 변화없이 그대로 유지되는 것이고 올해 초반의 매매의견을 기준으로 볼때도 역시 '매수'의견이 계속 유지되고 있는 상태이다. 또한 HMC투자증권은 ""인적분할로 인해 존속법인의 일시적인 영업실적 훼손에 대한 우려가 있지만, 기우에 불가할 것. 분할전회사 대비 분할 후 신설회사비율 기준 신설법인의 매출액은 2.2%로 매우 미미한 수준이며, 예멘LNG 정상 가동시 세전이익 기준 10.2% 수준에 불과하다""라고 밝혔다. 한편 ""현재 예멘LNG가스전이 가동 중단된 상태라 분할 후 현대상사 주가에 대한 매력도가 떨어질 수 있다는 우려가 있지만, 중장기적 관점에서 현대상사의 주가재평가가 가능할 것이고, 그 시점은 재가동 시기가 될 것""이라고 전망했다. ▷ 자원개발 E&P 섹터"
파이낸셜뉴스,011760,/news/news_read.nhn?article_id=0003826921&office_id=014&mode=search&query=현대상사&page=1,2017-06-09 11:22,"[fnRASSI]현대상사, 당일 거래량 증가하며 3거래일 하락세 지속","현대상사(011760)의 현재 거래량이 최근 5거래일 거래량의 최고치를 넘어서며 투자자들의 관심을 받고 있다. 그리고 현대상사는 3일 연속 하락흐름을 보이며, 11시 16분 현재 2.33% 내린 20,950원에 거래중이다. 상장주식수 대비 거래량은 0.32%로 적정수준 최근 한달간 현대상사의 상장주식수 대비 거래량을 비교해보니 일별 매매회전율이 0.32%로 집계됐다. 그리고 동기간 장중 저점과 고점의 차이인 일평균 주가변동률을 1.74%를 나타내고 있다. 외국인, 기관 모두 보유량 감소 (5일 누적) 최근 5일간 동종목의 외국인 투자자는 37,601주 순매도하였고 마찬가지로 기관은 6,581주 순매도하였다. 전날 외국인 11,313주 순매도, 기관6,581주 순매수하며 보유 비율이 변동했다. 다음 표는 동종목의 외국인, 기관의 일별 순매수량을 나타낸 것이다. 'fnRASSI'는 증권전문 기업 씽크풀과 파이낸셜뉴스의 협업으로 로봇기자가 실시간으로 생산하는 기사입니다."
한국경제,011760,/news/news_read.nhn?article_id=0003938420&office_id=015&mode=search&query=현대상사&page=1,2018-05-14 09:23,"[현대상사] 상한가&uarr; 도달, 이 시간 매수 창구 상위 - 삼성증권, 키움증권 등","14일 현대상사는 장 초반 부터 상한가에 진입해서, 오전 09시 18분 현재 전 거래일보다 29.92% 오른 34,300원에 거래되고 있다. 주가의 흐름은 30,100원으로 개장해서 장중에 밀리지 않고 계속 상승해서 34,300원(+29.92%)까지 큰 폭으로 상승하고 있다. ◆ 거래원 동향 - 이 시간 매수 창구 상위 - 삼성증권, 키움증권 등 이 시각 주요 거래원은 삼성증권, 키움증권, 미래에셋 등이 매수 상위 창구에 자리하고 있다. 아직까지 외국계 증권사 창구를 통한 매매는 발생하지 않고 있다. 그리고 이 시간 미래에셋이 매수창구상위에 올라있는 종목은 이 종목 이외에도 피씨디렉트, 액트 등이 있다. [표]현대상사 거래원 동향 ◆ 주체별 매매동향 - 전일 외국인 대량 순매도 지난 한달을 기준으로 보면 외국인이 5.6만주를 순매도했고, 기관도 45.8만주를 순매도했지만, 개인은 오히려 51.4만주를 순매수했다. 같은 기간, 개인의 거래 비중이 82.7%로 가장 높아, 이 종목의 주요 거래 주체는 개인이었음을 알 수 있다. 한편 외국인과 기관은 이 종목에 대해서 각각 최근 3일, 10일 연속 팔자 행진을 벌이고 있다. 더욱이 전일 외국인이 대량 순매도를 하고 있어 투자자들의 관심이 집중되고 있다. [표]현대상사 외국인/기관 매매동향 한경로보뉴스 이 기사는 한국경제신문과 씽크풀이 공동 개발한 기사 자동생성 알고리즘에 의해 실시간으로 작성된 것입니다. ["
전자신문,011760,/news/news_read.nhn?article_id=0002707600&office_id=030&mode=search&query=현대상사&page=1,2018-05-14 09:50,[ET투자뉴스]현대상사_상한가 진입 현재 +29.92%,"14일 오전 9시 43분 현재 현대상사가 7900원(29.92%) 오른 34,300원으로 상한가를 기록하고 있다.   그렇다면 이제 투자자의 입장에서 상한가의 원인이 어디에 있는지 세부항목별로 살펴보도록 하자.    [주가/수급동향]     전일까지 외국인이 3일 연속, 기관이 10일 연속 각각 동종목을 순매도 했다. 최근 한달간 현대상사의 상장주식수 대비 거래량을 비교해보니 일별 매매회전율이 3.4%로 집계됐다.  동기간 일평균 주가변동률은 10.31%로 장중 주가등락이 심하기 때문에 투자시 주의가 요망된다.  그리고 최근 5일간 거래비중은 개인이 83.15%로 가장 높은 참여율을 보였고, 외국인이 10.24%를 보였으며 기관은 6.59%를 나타냈다.     [차트신호]     현주가를 최근의 주가변화폭을 기준으로 본다면 과매입권으로 단기 조정가능성이 높아지고 있고,거래량 지표로 볼 때는 상승시에 거래량이 붙는 강세 흐름을 나타내고 있다.투자심리를 살펴보면 상승과 하락이 균형있게 나타나면서 투자자들은 안정적인 심리를 보여주고 있고 이동평균선들의 배열도를 분석을 해보면 단기, 중기, 장기 이동평균선이 정배열을 이루는 전형적인 상승국면에 있다.     [투자의견]"
연합뉴스,011760,/news/news_read.nhn?article_id=0008600926&office_id=001&mode=search&query=현대상사&page=1,2016-08-10 08:32,"HMC증권 &quot;현대상사, 예멘 LNG 재가동 지연&hellip;목표가&darr;&quot;","(서울=연합뉴스) 경수현 기자 = HMC투자증권은 10일 현대상사가 지분을 보유한 예멘LNG터미널(YLNG)의 재가동이 예멘 내전으로 지연되고 있다며 목표주가를 3만9천원에서 3만2천원으로 내렸다. 박종렬 연구원은 ""당초에는 올해 4분기부터 예멘LNG에서 배당금이 발생할 것으로 예상했으나 내전 종료가 아직 불투명한 상황""이라며 ""배당금은 내년 2분기부터 발생할 것으로 수정 전망한다""고 설명했다. 박 연구원은 ""올해 2분기 연결 기준 매출액과 영업이익도 8천407억원과 83억원으로 각각 작년 동기보다 23.8%, 30.8% 줄면서 컨센서스(시장 기대치)를 크게 하회했다""고 분석했다. 그는 그러나 ""영업이익이 저점을 통과 중이고 충분한 주가 조정도 거쳤다""며 ""배당주로서의 매력을 감안해 저점 매수를 권한다""고 말했다."
머니투데이,011760,/news/news_read.nhn?article_id=0003773581&office_id=008&mode=search&query=현대상사&page=1,2016-11-14 17:36,"현대종합상사, 싱가포르 법인 419억 채무 보증",[머니투데이 변휘 기자] 현대종합상사는 계열사인 싱가포르 법인의 채무 419억원을 보증키로 결정했다고 14일 공시했다. textlinktopstart textlinktopend textlinkstart
