source,symbol,link,date,title,content
서울경제,011760,/news/news_read.nhn?article_id=0003307501&office_id=011&mode=search&query=현대상사&page=1,2018-05-28 09:34,"&lt;유&gt;현대상사, 전일 대비 29.87% 상승.. 일일회전율은 4.86% 기록","[서울경제] 현대상사(011760) 는 28일 오전 9시 30분 현재 29.87% 오른 41,300원에 거래되고 있으며, 30(매도):70(매수)의 매수우위를 기록하고 있다. 거래대금은 262억2,597만, 거래량은 64만2,619주로 거래량회전율은 4.86%로 나타났다. 지난 1개월간 현대상사는 상한가 1회, 상승 15회, 하락 11회를 기록했고, 주가수익률은 124.46% 표준편차는 8.56%를 기록했다. 이 기간 ' 유통업 ' 업종 평균 주가수익률은 -0.89%로 나타났으며, 변동성은 0.83%를 기록했다. 이 시각 현재 ' 유통업 '은 1.23% 상승 중이며, 53(매도):47(매수)의 매도우위를 기록하고 있다."
서울경제,011760,/news/news_read.nhn?article_id=0002780714&office_id=011&mode=search&query=현대상사&page=1,2015-12-27 17:29,현대중공업서 계열분리 현대종합상사&hellip; 정몽혁 '26세 아들' 1년만에 부장 특진,현대종합상사가 최근 현대중공업에서 계열분리하기로 결정한 뒤 단행한 첫 인사에서 대표이사인 정몽혁 회장의 장남인 두선씨를 1년 만에 부장으로 승진시키며 오너경영 체제를 강화했다. 27일 업계에 따르면 현대종합상사가 지난주 발표한 부장 승진 인사에 정두선 법무팀 차장도 포함됐다. 정 차장은 1989년생으로 지난해 9월 차장으로 입사해 계약관리와 법률검토 등의 업무를 맡았다. 26세의 두선씨를 초고속 승진시킨 것은 최근 계열분리 결정으로 완벽한 정 회장 체제를 굳힌 현대종합상사에 오너가의 영향력을 확대하려는 뜻으로 풀이된다. 현대중공업은 지난 18일 이사회에서 현대종합상사와 현대씨앤에프 지분을 각각 현대씨앤에프와 정 회장에게 매각하기로 했다. 이에 따라 정 회장이 21.15%의 지분율로 현대씨엔에프와 현대종합상사를 차례대로 지배하며 내년 상반기 중으로 현대중공업그룹과 계열분리를 마무리할 계획이다. 정 회장은 고(故) 정주영 현대그룹 창업자의 다섯째 동생인 고(故) 정신영씨의 아들로 2009년 말부터 현대종합상사 회장을 맡아왔다. 현대종합상사는 올해 10월 무역·자원사업을 담당하는 현대종합상사와 브랜드·신사업 부문의 현대씨앤에프로 인적분할됐다.
아시아경제,011760,/news/news_read.nhn?article_id=0003624967&office_id=277&mode=search&query=현대상사&page=1,2015-11-13 13:36,"현대종합상사-한전KDN, 해외시장 협력 나선다","[아시아경제 김혜민 기자] 현대종합상사와 한전KDN이 전력에너지·스마트그리드 분야 해외사업에 협력하기로 했다. 양사는 13일 오전 현대종합상사 서울 본사에서 이같은 내용의 양해각서(MOU)를 체결했다. 체결식에는 이유경 현대종합상사 산업플랜트부문 전무와 문제달 한전KDN 스마트그리드 사업처장 등 관련 인사들이 참석했다. ▲현대종합상사는 13일 한전KDN와 해외사업 협력을 위한 MOU 체결식을 가졌다. 좌측부터 한전KDN 문제달 처장, 현대종합상사 이유경 전무  이번 MOU는 현대종합상사의 글로벌 비즈니스 경험과 한전KDN의 에너지 ICT 기술을 결합시켜 해외 시장에서 새로운 성장동력을 창출하기 위해 진행됐다. 양사는 전력 ICT와 스마트그리드 해외사업, 해외사업 시장개척을 위한 공동마케팅 등에 협력할 예정이다. 현대종합상사 관계자는 ""이번 MOU로 에너지 신사업 분야 시장개척에 큰 시너지 효과가 있을 것으로 기대한다""며 ""관련 사업 해외시장 발굴에 더욱 적극 나설 계획""이라고 말했다."
한국경제TV,011760,/news/news_read.nhn?article_id=0000675811&office_id=215&mode=search&query=현대상사&page=1,2018-08-27 11:06,"현대상사, -11% 하락... 전일 보다 3,400원 내린 28,650원","[한국경제TV 라이온봇 기자] [그림 1] 최근 3개월 간 주가 추세 및 기간별 수익률 현대상사는 8월 27일 11시 6분 전일 대비 약 -11% 급락한 28,650원에 거래되고 있다. 현대상사는 코스피 상장 기업으로 유통업 업종에 속해 있다. 시가총액은 4,239억원으로 코스피 상장기업 중 290위에 위치 해 있다. [종목 성향 진단] [그림 2] 종목 성향 진단 현대상사의 투자 스타일은 가치주에 가깝다. 기업 가치 대비 낮은 주가가 매력적인 기업이다. 주가 모멘텀은 평범한 수준이었다. 최근 1개월 수익률이 7.73%, 3개월 수익률은 -17.4%, 6개월 수익률은 67.8%를 기록했다. 현대상사 종목에 대한 투자자의 관심도는 높은 편에 속한다. [투자 점수 진단] [그림 3] 투자 점수 진단 현대상사는 어느 측면에서 투자 매력도가 높은 종목일까? AI 인공지능 종목 분석 시스템을 이용해 성장성, 수익성, 효율성, 안전성, 저평가성, 추세 등 주가 수익률에 영향을 줄 수 있는 6가지 핵심 투자 지표를 점수화하여 종목의 투자 매력도를 계산해보았다. 그 결과 현대상사는 상대적으로 저평가 측면에서 두각을 드러내고 있었다. 저평가 점수는 기업의 가치 대비 주가의 수준이 어느 정도인지를 나타낸다. 현대상사는 특히 PSR 측면에서 가장 높은 점수는 기록했는데, 전체 시장 내 32위를 기록하며 상위 1.65%에 위치했다. 업종별로는 8위를 기록하며 상위 2.1%에 위치했다. 그러나 재무건전성을 나타내는 재무안정성 측면에서는 아쉬운 점을 나타냈다. (위의 AI인공지능 점수는 재무 데이터를 기반으로 전체 상장 종목과 비교/분석하여 도출한 점수로 높은 점수가 반드시 높은 수익률을 보장하지 않습니다. 위의 자료는 당사의 추천 종목이 아니며, 투자 시 참고용으로 제시해드리는 것입니다. 핵심투자지표를 결합해 종목의 투자매력도를 종합 계산한 ""인공지능 투자점수""는 ""거장들의 투자공식"" 앱에서 확인하실 수 있습니다.) 라이온봇 기자 -한국경제TV※ 본 기사는 한국경제TV와 '거장들의 투자공식이'자체 개발한 '라이온봇 기자'가 실시간으로 작성한 기사입니다. 라이온봇기자"
이데일리,011760,/news/news_read.nhn?article_id=0003493200&office_id=018&mode=search&query=현대상사&page=1,2016-03-07 08:32,"현대상사, 여전히 저평가된 기업&hellip;목표가&darr;-HMC","[이데일리 유재희 기자] HMC투자증권은 7일 현대상사(011760)에 대해 현재 주가는 주가수익비율(PER) 5.4배, 주가순자산비율(PBR) 0.5배 수준으로 저평가 상태라며 투자의견 ‘매수’를 유지했다. 다만, 올해 상반기까지 업황 부진과 실적 모멘텀 부재 등은 불가피해 보인다며 목표주가를 종전 4만9000원에서 3만2000원으로 하향 조정했다. 박종렬 HMC투자증권 연구원은 “최근 국제유가가 큰 폭으로 반등하면서 원자재 관련주들도 그동안의 낙폭을 빠르게 만회하고 있지만 현대상사의 주가는 부진한 흐름이 지속되고 있다”며 “이는 예멘LNG가스전이 가동 중단된 상태라 동사에 대한 매력도가 떨어져 있기 때문”이라고 설명했다. 박 연구원은 “원자재 가격 약세 등으로 올해 상반기까지는 업황 부진과 실적 모멘텀 부재가 불가피해 보인다”며 “다만 하반기에는 기저효과와 원자재 가격 회복으로 실적 모멘텀이 개선될 것”이라고 전망했다. 그는 현대상선의 올해 연결기준 매출액과 영업이익을 각각 3조9657억원(전년비 6.9%↓), 277억원으로 추정했다. 세전이익은 55.3% 증가한 597억원으로 전망했다. 4분기에 예멘 LNG가 재가동될 것이란 전제로 추정한 실적 전망치다. 박 연구원은 “동사의 주가는 절대적으로 저평가 상태”라며 “현 시점에서는 예멘LNG 재가동 시기를 눈여겨 보면서 저점 분할 매수로 접근할 필요가 있다”고 조언했다."
머니투데이,011760,/news/news_read.nhn?article_id=0003641930&office_id=008&mode=search&query=현대상사&page=1,2016-03-04 16:47,"현대종합상사, 주당 750원 현금배당 결정",[머니투데이 김세관 기자] 현대종합상사는 4일 1주당 750원의 현금배당을 결정했다고 공시했다. 배당금총액은 99억1824만원이다. textlinktopstart textlinktopend textlinkstart
이데일리,011760,/news/news_read.nhn?article_id=0003553591&office_id=018&mode=search&query=현대상사&page=1,2016-05-30 08:54,"현대상사, 무역사업 실적개선에 배당株 매력까지-하이","[이데일리 이재호 기자] 하이투자증권은 30일 현대상사(011760)가 범현대 계열의 안정적 매출 지원 속에서 턴어라운드에 성공할 것으로 전망하며 투자의견 ‘매수’, 목표주가 4만원을 유지했다. 이상헌 하이투자증권 연구원은 “현대상사 매출 중 지난해 기준 범현대 계열 비중은 56% 수준”이라며 “무역사업부문의 경우 범현대 계열 매출처를 기반으로 차량 및 철강 사업의 이익이 증가하면서 실적 턴어라운드가 이뤄질 것”이라고 설명했다. 이 연구원은 “지난해 313억원의 수익을 기록했던 자원개발사업부문은 올해 저유가 영향과 예멘 LNG 생산 중단 등으로 수익이 상당 부분 줄어들 것”이라며 “그러나 예멘 LNG는 현재 평화회담이 진행 중으로 조기에 생산이 재개된다면 불확실성 해소와 더불어 내년부터 배당을 받을 수 있다”고 분석했다. 이 연구원은 “현대상사의 지난해 주당 배당금 750원을 기준으로 현재 배당수익률은 2.8%”라며 “향후 실적 향상 등으로 배당금이 증가할 가능성이 높아 배당주로서도 매력적”이라고 평가했다."
한국경제,011760,/news/news_read.nhn?article_id=0003677227&office_id=015&mode=search&query=현대상사&page=1,2016-10-31 07:56,"&quot;현대상사, 저평가 상태&hellip;배당 매력 증가 전망&quot;-하이","[ 채선희 기자  ] 하이투자증권은 31일 현대상사에 대해 저평가 상태에 놓여있다며 배당 매력이 점차 증가할 것이라고 밝혔다. 투자의견 매수, 목표주가 4만원을 유지했다. 이상헌 연구원은 ""현대상사의 주가는 내년 기준 주가수익비율(PER) 7.3배, 주가순자산비율(PBR) 0.6배로 저평가 상태""라며 ""안정적인 수익창출 능력 등을 고려할 때 배당주로서 매력적""이라고 말했다. 이 연구원은 ""예멘 LNG에 대한 불확실성은 이미 주가에 반영돼 있다""며 ""지난해 주당 배당금 750원을 유지해도 배당수익율은 3.5%에 이른다""고 설명했다. 실적은 3분기에는 부진하겠으나 4분기부터 회복이 가능할 것으로 봤다. 3분기 매출액은 전년 동기 대비 6.2% 줄어든 9890억원, 영업이익은 18.6% 감소한 48억원을 기록할 것이란 추정이다. 그는 ""현대상사는 지난 6월 현대차와 함께 투르크메니스탄과 대형버스 500대 공급 계약을 체결했다""며 ""이에 따라 올해 4분기부터 내년 상반기까지 순차적으로 차량이 공급될 예정""이라고 내다봤다. 이어 ""차량부문의 매출증가 효과로 올해 4분기 실적이 회복될 것이고 내년 1분기에는 실적 호전이 기대된다""고 강조했다. 채선희 한경닷컴 기자"
연합뉴스,011760,/news/news_read.nhn?article_id=0008380264&office_id=001&mode=search&query=현대상사&page=1,2016-05-04 15:50,"현대종합상사, 현대자원개발 흡수합병 결정","(서울=연합뉴스) 성서호 기자 = 현대종합상사는 현대자원개발㈜을 흡수합병한다고 4일 공시했다. 현대종합상사 대 현대자원개발의 합병비율은 1대 0이다. 합병기일은 오는 7월 31일이며 합병 후 현대자원개발은 소멸된다. 회사 측은 ""경영 효율성과 사업간 시너지 효과를 증대시킴으로써 주주가치를 높이기 위한 합병""이라고 설명했다."
파이낸셜뉴스,011760,/news/news_read.nhn?article_id=0004028834&office_id=014&mode=search&query=현대상사&page=1,2018-05-28 13:25,"[fnRASSI]현대상사, 상한가 기록","현대상사(011760)는 상한가를 기록하고 있다. 동종목은 현재 41,300원선에서 이루어지고 있다. 참고로 52주 최고가는 42,000원(18년 05월 23일), 최저가는 17,400원(18년 03월 23일)원이다. 최근 3일동안 평균 거래량은 169만 주이다. 이는 250일 일 평균 거래량 15만 주와 비교해보면 최근 거래량이 급격히 늘어났다는 것을 알 수 있다. 외국인 보유량 증가, 기관 감소 (5일 누적) 최근 5일간 동종목의 외국인 투자자는 162,102주 순매수하였고 반면 기관은 30,129주 순매도하였다. 전날 외국인 148,225주 순매수, 기관30,129주 순매도하며 보유 비율이 변동했다. 다음 표는 동종목의 외국인, 기관의 일별 순매수량을 나타낸 것이다. 거래참여는 개인투자자가 가장 활발 최근 한달간 주체별 거래비중을 살펴보면 개인이 전체 거래의 89.88%를 차지하며 가장 적극적인 모습을 보여줬고, 외국인은 5.4%를 나타냈으며 기관은 4.71%를 나타냈다. 그리고 최근 5일간 거래비중은 개인 비중이 89.3%로 가장 높았고, 외국인이 7.27%로 그 뒤를 이었다. 기관은 3.42%를 나타냈다. 'fnRASSI'는 증권전문 기업 씽크풀과 파이낸셜뉴스의 협업으로 로봇기자가 실시간으로 생산하는 기사입니다."
파이낸셜뉴스,011760,/news/news_read.nhn?article_id=0004028530&office_id=014&mode=search&query=현대상사&page=1,2018-05-28 09:45,"[fnRASSI]현대상사, 상한가 기록","현대상사(011760)는 상한가를 기록하고 있다. 동종목은 현재 41,300원선에서 이루어지고 있다. 참고로 52주 최고가는 42,000원(18년 05월 23일), 최저가는 17,400원(18년 03월 23일)원이다. 최근 3일동안 평균 거래량은 168만 주이다. 이는 250일 일 평균 거래량 15만 주와 비교해보면 최근 거래량이 급격히 늘어났다는 것을 알 수 있다. 주가등락폭 크고, 상장주식수 대비 거래량도 상당히 높아 최근 한달간 현대상사의 매매회전율을 분석한 결과 8일에 1번 꼴로 주식의 주인이 바뀐 것으로 나타났다. 이는 비정상적으로 높은 회전율을 보인 것으로 투자에 각별한 주의가 요망된다. 또한 평균적으로 장중 주가변동률이 13.46%에 달할 정도로 등락이 심하기 때문에 다시한번 주의가 필요하다. 퀀트 재무분석, 종합점수 19점으로 상승                    지표               항목               값               종합점수                 성장성               매출액증가율               -0.1               2.29                 자기자본증가율               -0.16                 안정성               부채비율               226.19               5.97                 유동비율               118.64                 이익안정성               9.17                 수익성               ROA               2.2               4.33                 ROE               7.17                 영업이익율               0.83          현대상사의 퀀트 재무 점수는 12.59점으로 3개월 이전 12.02점보다 올랐다. 지난 분기에 비해 성장성 점수가 상승했다. 이는 매출액 증가율이 증가하였기 때문이다. 부채비율이 상승하여 안정성 종합 점수는 하락했다. 수익성 측면에서 볼때 ROA, ROE, 영업이익률 모두 개선되어 이전보다 좋은 점수를 받았다. 'fnRASSI'는 증권전문 기업 씽크풀과 파이낸셜뉴스의 협업으로 로봇기자가 실시간으로 생산하는 기사입니다."
조선비즈,011760,/news/news_read.nhn?article_id=0000399520&office_id=366&mode=search&query=현대상사&page=1,2018-02-22 11:38,"현대중공업, 현대종합상사 지원으로 630억원 규모 LPG탱크 수주","현대중공업(009540) 은 나이지리아 당고테(Dangote)와 5800만달러(630억원) 규모의 LPG(액화석유가스) 저장탱크 15기에 대한 수주 계약을 체결했다고 22일 밝혔다. 당코테와 협력관계인 현대종합상사가 이번 계약을 지원했다. 현대중공업이 2011년 제작한 유사 설비 /현대중공업 제공 이번에 수주한 설비는 직경 8m, 길이 95m 원통 형태로 7만5000㎥ LPG를 저장할 수 있는 대형 탱크다. 나이지리아 남서부 라고스 인근 정유‧석유화학공장에 설치돼 정제과정에서 생산된 LPG를 저장하는 용도로 쓰일 예정이다. 현대중공업은 오는 5월부터 제작해 2019년 4월부터 순차적으로 납품할 계획이다. 이번 계약은 2016년 현대중공업이 당고테에서 수주한 중질유분해설비 후속 공사다. 현대중공업 관계자는 “이번 추가 설비 수주는 자사 플랜트 설비 제작 능력이 높게 평가 받고 있다는 의미가 있다”며 “향후 보일러 및 설비 사업부문에서 전문성과 경쟁력을 바탕으로 성장할 수 있도록 최선을 다하겠다”고 했다."
전자신문,011760,/news/news_read.nhn?article_id=0002483892&office_id=030&mode=search&query=현대상사&page=1,2016-05-30 10:27,"[@기업분석리포트]현대상사, &quot;올해 실적 턴라운드...&quot;매수(신규)_하이","하이증권은 30일 현대상사(011760)에 대해 ""올해 실적 턴라운드 및 자원개발 불확실성 해소될 전망""라며 투자의견을 '매수(신규)'로 제시하였다. 아울러 6개월 목표주가를 40,000원으로 내놓았다. 하이증권 이상헌, 김종관 애널리스트가 동종목에 대하여 이번에 제시한 '매수(신규)'의견은 하이증권에서는 올해들어 처음 내놓는 매매의견이며 그리고 최근 분기내 발표된 전체 증권사 리포트의 컨센서스와 비교를 해볼 경우에 오늘 발표된 투자의견은 대체적으로 평균치에 해당하는 수준으로, 이번 의견은 동종목에 대한 전체적인 흐름에서 크게 벗어나지 않은 것으로 분석되고 있다. 또한 전일 종가 기준으로 볼때 동종목의 현주가는 이번에 제시된 목표가 대비 51.5%의 추가상승여력이 있다는 해석이 제시되고 있다."
서울경제,011760,/news/news_read.nhn?article_id=0003332824&office_id=011&mode=search&query=현대상사&page=1,2018-06-27 09:45,"&lt;유&gt;현대상사, 전일 대비 7.11% 상승.. 일일회전율은 2.33% 기록","[서울경제] 현대상사(011760) 는 27일 오전 9시 44분 현재 7.11% 오른 33,150원에 거래되고 있으며, 41(매도):59(매수)의 매수우위를 기록하고 있다. 거래대금은 100억2,232만, 거래량은 30만8,559주로 거래량회전율은 2.33%로 나타났다. 지난 1개월간 현대상사는 상한가 2회, 상승 12회, 하락 16회를 기록했고, 주가수익률은 25.57% 표준편차는 11.49%를 기록했다. 이 기간 ' 유통업 ' 업종 평균 주가수익률은 -4.32%로 나타났으며, 변동성은 0.96%를 기록했다. 이 시각 현재 ' 유통업 '은 0.95% 상승 중이며, 41(매도):59(매수)의 매수우위를 기록하고 있다."
연합뉴스,011760,/news/news_read.nhn?article_id=0008305715&office_id=001&mode=search&query=현대상사&page=1,2016-04-04 15:50,현대종합상사&middot;씨앤에프 김원갑 총괄부회장 선임,"김원갑 총괄 부회장. 2016.4.4 [현대종합상사 제공] (서울=연합뉴스) 이승환 기자 = 김원갑 전 현대하이스코 부회장이 지난 1일 현대종합상사와 현대씨앤에프를 총괄하는 부회장으로 임명됐다고 현대종합상사 측이 4일 밝혔다. 재무·회계통인 김원갑 총괄 부회장은 1978년 현대건설 경리부에 입사해 구(舊) 현대그룹 종합기획실, 현대자동차 전무 등을 거쳐 현대하이스코 부회장을 지냈다. 현대종합상사 관계자는 ""김 부회장이 경륜을 바탕으로 수익성 중심의 내실 경영을 구축하고 신성장 사업을 추진할 것""이라고 말했다."
서울경제,011760,/news/news_read.nhn?article_id=0002761886&office_id=011&mode=search&query=현대상사&page=1,2015-11-13 13:33,"현대종합상사, 한전KDN과 해외 전력ICT&middot;스마트그리드 협력 MOU",이유경(오른쪽) 현대종합상사 전무와 문제달 한전KDN 처장이 13일 서울 종로구 현대종합상사 사옥에서 전력 정보통신기술(ICT)·스마트그리드 분야의 해외 협력을 위한 양해각서(MOU)를 맺고 기념사진을 찍고 있다. 양사는 해당 분야의 해외 시장 공동 개척과 마케팅 방안을 모색할 계획이다. /사진제공=현대종합상사
머니투데이,011760,/news/news_read.nhn?article_id=0003591356&office_id=008&mode=search&query=현대상사&page=1,2015-12-04 14:52,[인사]현대종합상사,[머니투데이 김은령 기자]  ◇전무 승진 △이문수 ◇상무보승진 △한민수 △최창준 △장수철 △김정식 ◇전무승진 △장안석 ◇상무보 승진 △권철호 textlinktopstart textlinktopend textlinkstart
연합뉴스,011760,/news/news_read.nhn?article_id=0008193566&office_id=001&mode=search&query=현대상사&page=1,2016-02-18 08:16,"NH투자 &quot;현대종합상사, 수익악화&hellip;목표가&darr;&quot;","(서울=연합뉴스) 윤선희 기자 = NH투자증권은 18일 현대종합상사에 대해 ""무역과 자원개발 부문의 수익성이 악화하고 있다""며 목표주가를 종전 4만5천원에서 2만9천원으로 내리고 '보유' 투자의견을 유지했다. 이민재 연구원은 ""현대종합상사는 무역부문이 세계 시황 악화로 부진을 지속하는데다 주 판매처가 신흥국인 차량 부문도 저조한 이익을 내고 있다""고 설명했다. 그는 ""예멘 액화천연가스(LNG)의 재가동 여부도 아직 불투명하다""며 ""저유가 여파로 카타르와 오만 등 자원개발 부문의 수익성도 악화했다""고 지적했다. 그는 ""현대종합상사 주가는 작년 10월 분할 이후 약세를 지속해 28% 떨어졌다""며 ""예멘 LNG 재가동이 주가의 상승 요인으로 작용할 것""이라고 덧붙였다."
한국경제,011760,/news/news_read.nhn?article_id=0003589526&office_id=015&mode=search&query=현대상사&page=1,2016-05-04 15:41,"현대종합상사, 현대자원개발 흡수합병 결정",[ 김아름 기자  ] 현대종합상사는 4일 현대자원개발을 흡수합병하기로 결정했다고 공시했다. 현대상사는 피합병회사인 현대자원개발의 주식 100%를 소유하고 있다. 이에 따라 피합병회사의 주식에 대한 신주 발행은 없다. 합병계약일은 오는 11일이며 합병반대의사 통지 접수기간은 오는 20일부터 6월3일까지다. 합병기일은 오는 7월31일이다. 김아름 한경닷컴 기자
