source,symbol,link,date,title,content
한국경제TV,011760,/news/news_read.nhn?article_id=0000640831&office_id=215&mode=search&query=현대상사&page=1,2018-05-31 14:08,"현대상사, 전일 대비 약 -5% 하락한 39,250원","[한국경제TV 라이온봇 기자] 현대상사는 5월 31일 14시 7분 전일 대비 약 -5% 하락한 39,250원에 거래되고 있다. 현대상사는 코스피 상장 기업으로 유통업 업종에 속해 있다. 시가총액은 5,476억원으로 코스피 상장기업 중 251위에 위치 해 있다. [종목 성향 진단] [그림 1] 종목 성향 진단 현대상사의 투자 스타일은 가치주에 가깝다. 기업 가치 대비 낮은 주가가 매력적인 기업이다. 주가 모멘텀은 굉장히 좋은 편이었다. 최근 3개월 수익률이 무려 115.92%의 상승폭을 기록했다. 최근 1개월 수익률 또한 99.02% 상승하며 굉장히 좋은 모멘텀을 보이고 있다. 현대상사 종목에 대한 투자자의 관심도는 굉장히 높은 편이다. [투자 점수 진단] [그림 2] 투자 점수 진단 현대상사는 성장성(매출증가율(YoY)) 측면에서 두각을 나타내고 있다. 최근 매출증가율(YoY)은 72점으로 6개의 핵심 팩터 중 가장 높은 점수를 기록했다. 매출증가율(YoY)은  전체 시장 내 499위를 기록하며 상위 28.42%에 위치했다. 업종별로는 81위를 기록하며 상위 25.64%에 위치했다. 그리고 저평가성1(PER) 역시 도드라지는 편이다. 저평가성1 점수는 65점으로 두번째로 높은 점수를 기록했다. PER은 전체 시장 내 617위를 기록하며 상위 34.94%에 위치했다. 업종별로는 114위를 기록하며 상위 36.45%에 위치했다. 그러나 부채비율과 영업이익률은  아쉬움을 나타냈다. [종합 투자점수] [그림 3] 종합 투자점수 AI 인공지능 분석을 통한 현대상사의 종목 종합 스코어는 64점을 기록했다. 이는 동일 업종 평균점수인 54점과 시장 평균점수인 56점를 상회하는 수치였다. (위의 AI인공지능 점수는 재무 데이터를 기반으로 전체 상장 종목과 비교/분석하여 도출한 점수로 높은 점수가 반드시 높은 수익률을 보장하지 않습니다. 위의 자료는 당사의 추천 종목이 아니며, 투자 시 참고용으로 제시해드리는 것입니다.) 라이온봇 기자 -한국경제TV※ 본 기사는 한국경제TV와 '거장들의 투자공식이'자체 개발한 '라이온봇 기자'가 실시간으로 작성한 기사입니다. 라이온봇기자 ⓒ 한국경제TV, 무단 전재 및 재배포 금지 한국경제TV 관련뉴스해당 언론사에서 선정하며 언론사 페이지(아웃링크)로 이동해 볼 수 있습니다.""다리보험 12억"" 이혜영 근황, '인형 같은 각선미'""작품 전 다이어트 필수"" 박민영 마네킹 각선미 '깜짝''추락사고' 김사랑 근황, 한 달 만…""여전히 예쁘네""이선희 집 공개…탁 트인 한강뷰에 깔끔 인테리어이천희 가구 '하이브로우', '공작소'에서 브랜드가 되기까지"
뉴시스,011760,/news/news_read.nhn?article_id=0007208884&office_id=003&mode=search&query=현대상사&page=1,2016-05-04 16:36,"현대종합상사, 현대자원개발 흡수합병 결정","【서울=뉴시스】김주아 기자 = 현대종합상사(011760)가 현대자원개발을 흡수합병한다고 4일 공시했다. 합병 후 존속회사는 현대종합상사이고, 소멸회사는 현대자원개발이다. 현대종합상사와 현대자원개발의 합병비율은 1대 0이다. 합병기일은 오는 7월31일이다. 회사 측은 ""합병을 통해 경영효율성을 증대하고 사업 간 시너지효과를 높임으로써 주주가치를 제고하기 위한 것""이라고 밝혔다."
연합뉴스,011760,/news/news_read.nhn?article_id=0009073668&office_id=001&mode=search&query=현대상사&page=1,2017-03-01 10:21,"현대상사&middot;라인호, 러에 세계최대 선박이동설비 공급","(서울=연합뉴스) 김영현 기자 = 현대종합상사는 라인호㈜와 함께 러시아 국영 즈베즈다 조선소에 세계최대 규모인 5만4천t급 선박이동설비(Ship Transfer System)를 공급한다고 1일 밝혔다. 전남 순천 율촌산단에 자리 잡고 있는 라인호㈜는 '자체 동력 중량물 이송설비' 생산 전문업체다. 국내외에서 20여 개의 특허를 갖고 있으며 글로벌 해양·건설산업 이송설비 공급 분야에서 기술력을 인정받고 있다. 지난달 28일 공급 계약을 마친 이번 선박이동설비는 현존 조선 설비 가운데 가장 크다. 종전 기록도 라인호㈜가 갖고 있었다. 이전까지는 라인호㈜가 현대삼호중공업에 공급한 5만2천800t급 선박이동설비가 세계최대 규모였다. 이번 계약의 전체 사업금액은 200억원이며 라인호㈜가 설계, 제작, 공급, 설치 등 전 과정을 총괄한다. 러시아에서 선박 공급 관련 영업활동을 벌이고 있는 현대종합상사는 사업개발 초기부터 라인호㈜와 이번 사업을 공조했다. 즈베즈다 조선소는 러시아 정부의 조선산업 육성 정책에 따라 시설 확충 작업을 진행하고 있다. 현대종합상사와 라인호㈜는 이번 계약을 토대로 추가 수주 활동을 진행할 계획이다. 라인호㈜의 대표이사 라이너 신라이히는 ""현대삼호중공업에 공급한 실적과 현대종합상사와의 효과적인 협업으로 세계 최대규모 계약을 다시 한 번 따낼 수 있었다""며 ""뛰어난 기술력을 바탕으로 앞으로도 글로벌 시장 개척에 적극 나서겠다""고 말했다.  라인호 라이너 신라이히  대표(오른쪽)와 즈베즈다 조선소 유리 필체녹 대표이사(왼쪽)가 계약을 체결하고 있다. [현대종합상사 제공=연합뉴스]"
한국경제TV,011760,/news/news_read.nhn?article_id=0000650025&office_id=215&mode=search&query=현대상사&page=1,2018-06-19 11:08,"현대상사, 전일 대비 약 -4% 하락한 39,400원","[한국경제TV 라이온봇 기자] [그림 1] 최근 3개월 간 주가 추세 및 기간별 수익률 현대상사는 6월 19일 11시 7분 전일 대비 약 -4% 하락한 39,400원에 거래되고 있다. 현대상사는 코스피 상장 기업으로 유통업 업종에 속해 있다. 시가총액은 5,265억원으로 코스피 상장기업 중 256위에 위치 해 있다. [종목 성향 진단] [그림 2] 종목 성향 진단 현대상사의 투자 스타일은 가치주에 가깝다. 기업 가치 대비 낮은 주가가 매력적인 기업이다. 주가 모멘텀은 좋은 편에 속했다. 최근 3개월 수익률은 125.35%의 상승폭을 기록했다. 최근 1개월 수익률 또한 17.93% 상승하며 좋은 모멘텀을 보이고 있다. 현대상사 종목에 대한 투자자의 관심도는 굉장히 높은 편이다. [투자 점수 진단] [그림 3] 투자 점수 진단 현대상사는 어느 측면에서 투자 매력도가 높은 종목일까? AI 인공지능 종목 분석 시스템을 이용해 성장성, 수익성, 효율성, 안전성, 저평가성, 추세 등 주가 수익률에 영향을 줄 수 있는 6가지 핵심 투자 지표를 점수화하여 종목의 투자 매력도를 계산해보았다. 그 결과 현대상사는 상대적으로 추세지표 측면에서 두각을 드러내고 있었다. 추세 점수는 주가의 상승 모멘텀이 어느정도 인가를 나타낸다. 현대상사는 특히 중기추세 측면에서 가장 높은 점수는 기록했는데, 전체 시장 내 19위를 기록하며 상위 0.91%에 위치했다. 업종별로는 7위를 기록하며 상위 1.75%에 위치했다. 그러나 재무건전성을 나타내는 기업안정성 측면에서는 아쉬운 점을 나타냈다. (위의 AI인공지능 점수는 재무 데이터를 기반으로 전체 상장 종목과 비교/분석하여 도출한 점수로 높은 점수가 반드시 높은 수익률을 보장하지 않습니다. 위의 자료는 당사의 추천 종목이 아니며, 투자 시 참고용으로 제시해드리는 것입니다. 핵심투자지표를 결합해 종목의 투자매력도를 종합 계산한 ""인공지능 투자점수""는 ""거장들의 투자공식"" 앱에서 확인하실 수 있습니다.) 라이온봇 기자 -한국경제TV※ 본 기사는 한국경제TV와 '거장들의 투자공식이'자체 개발한 '라이온봇 기자'가 실시간으로 작성한 기사입니다. 라이온봇기자 ⓒ 한국경제TV, 무단 전재 및 재배포 금지 한국경제TV 관련뉴스해당 언론사에서 선정하며 언론사 페이지(아웃링크)로 이동해 볼 수 있습니다.코스피 2400p 붕괴…외국인, 5거래일간 1.5조 매도현실화되는 '보유세 폭탄'…똑똑한 절세법은?품귀 빚던 '꼬북칩'…4,600만봉 팔렸다투기지역 연내 재조정…""노원구 빠질듯""'아동수당' 미리 신청하세요…몇 세까지 해당?"
서울경제,011760,/news/news_read.nhn?article_id=0002818052&office_id=011&mode=search&query=현대상사&page=1,2016-04-14 08:26,"현대상사 4분기부터 예멘LNG 재가동, 목표주가 3만9,000원으로 상향 - HM...","HMC투자증권이 현대상사의 목표주가를 3만9,000원으로 상향조정했다. 기대대로 오는 4·4분기 예멘 액화천연가스(LNG) 가스전이 재가동되면서 연 274억원 규모의 이익 창출이 이뤄질 것이란 전망에 따른 것이다. 현대상사의 예멘 LNG 가스전은 현지 내전으로 인해 가동을 멈춘 상태다. 지난 11일 예멘 정부군과 반군이 휴전에 합의하면서 늦어도 오는 10월부터 예멘 LNG 가스전의 생산·판매가 다시 시작될 것으로 기대된다. 박종렬 HMC투자증권 연구원은 “현재 국제유가 수준에서 연 274억원 규모의 이익·배당금이 가능하다”며 “4·4분기 배당금 69억원이 발생할 것으로 추정된다”고 설명했다. 박 연구원은 올해 현대상사가 4조601억원(연결기준)·247억원의 매출과 영업익을 기록할 것으로 관측했다. 매출은 전년보다 4.7%, 영업익은 5.5% 증가한 수치다."
뉴시스,011760,/news/news_read.nhn?article_id=0007496442&office_id=003&mode=search&query=현대상사&page=1,2016-09-30 10:06,"창립 40주년 현대종합상사, &quot;글로벌 복합기업 도약&quot;","【서울=뉴시스】유자비 기자 = 현대종합상사가 창립 40주년을 맞아 글로벌 복합기업으로 도약하겠다는 의지를 다졌다. 현대종합상사는 올해 창립 40주년을 맞아 지난 29일 오후 서울 광화문 포시즌스 호텔에서 전·현직 임직원과 국내외 주요 관계사 경영진 등 400여명이 참석한 가운데 기념행사를 열고 '준비된 100년 기업'으로의 각오를 다졌다고 30일 밝혔다. 회사는 이날 행사에서 앞으로 국내 대기업 제품뿐 아니라 중소·중견 기업 및 해외 각 지역의 유망 제품과 서비스를 적극 발굴하고 사업화(Organizing)하는 글로벌 복합 기업으로 거듭나기로 했다. 또한 밸류체인 확대를 통한 신사업 개발, 인수합병과 수익 중심 투자 전문 기업 지향 등 중장기 내실 성장 전략을 지속해서 추진하기로 했다. 이날 현대종합상사는 새로운 독립그룹 출범 원년을 기념하는 행사도 함께 했다. 지난 1976년 설립된 현대종합상사는 2010년 이후 사업별 전문화를 추진해 자원개발, 무역, 비무역 부문으로 핵심사업을 재편했다. 지난해에는 신설법인으로 지주회사격인 현대씨앤에프를 설립, 이후 자원개발 부문은 무역 부문인 종합상사와 합병했다. 올해 3월에는 현대종합상사와 현대씨앤에프가 현대중공업 계열로부터 분리해 새로운 독립경영 그룹이 탄생했다. 새로 탄생한 독립그룹 명칭을 현대종합상사의 기존 영문 명칭 '현대코퍼레이션'을 취해 '현대코퍼레이션 그룹'으로 정하고 이날 이를 기념하는 행사를 열었다."
전자신문,011760,/news/news_read.nhn?article_id=0002489862&office_id=030&mode=search&query=현대상사&page=1,2016-06-13 15:18,"[@기업분석리포트]현대상사, &quot;실적 턴어라운드 및&hellip;&quot; BUY-하이투자증권","하이투자증권에서 13일 현대상사(011760)에 대해 ""실적 턴어라운드 및 자원개발 불확실성 해소될 듯""라며 투자의견을 'BUY'로 제시하였고, 아울러 목표주가로는 40,000원을 내놓았다. 하이투자증권 이상헌,김종관 애널리스트가 동종목에 대하여 이번에 제시한 'BUY'의견은 하이투자증권의 직전 매매의견을 그대로 유지하는 것이고 올해 초반의 시장컨센서스에 비추어 본다면 '트레이딩매수'의견에서 'BUY로' 상향조정된 것이다. 그리고 최근 분기내 발표된 전체 증권사 리포트의 컨센서스와 비교를 해볼 경우에 오늘 발표된 투자의견은 전체의견에 수렴하고 있어, 이번 의견은 시장의 평균적인 기대감이 객관적으로 표현된 것으로 분석되고 있다. 또한 전일 종가 기준으로 볼때 동종목의 현주가는 이번에 제시된 목표가 대비 50.4%의 저평가 요인이 존재한다는 해석이 제시되고 있다."
서울신문,011760,/news/news_read.nhn?article_id=0002866828&office_id=081&mode=search&query=현대상사&page=1,2017-11-06 19:47,가스공사&middot;현대상사 &lsquo;수상한 버뮤다 거래&rsquo;,"[서울신문] 한국가스공사가 해외 액화천연가스(LNG) 생산업체 지분을 대표적인 조세회피처인 버뮤다를 통해 사들인 것으로 드러났다. 이 지분은 현대상사가 갖고 있던 것이었다. 가스공사 측은 “공시까지 한 합법적인 거래였다”고 해명했다. MobileAdNew center ●가스公, 현대상사 지분 거액 매입 뉴스타파는 현대상사가 2006년 버뮤다에 페이퍼 컴퍼니를 세워 가스공사와 예멘 LNG 개발사업 관련 지분 거래를 했다고 6일 공개했다. 뉴스타파는 국제탐사보도언론인협회(ICIJ)와 함께 버뮤다의 로펌 ‘애플비’(Appleby)의 1950~2016년 내부자료를 입수해 한국 관련 내용을 집중 분석했다. ●뉴스타파 “5배 비싸게 샀다” 뉴스타파에 따르면 당시 현대상사는 갖고 있던 예멘 LNG 지분 5.88%를 페이퍼 컴퍼니에 넘겼고, 가스공사는 이 페이퍼 컴퍼니가 보유한 지분을 일부 인수하는 방식으로 예멘 LNG 지분 2.88%를 확보했다. 이 과정에서 가스공사는 현대상사의 보유지분을 10개월 전 거래 가격보다 5배 이상 비싼 470억원에 샀다고 뉴스타파는 주장했다. 이에 대해 가스공사 측은 “10개월 전 거래액(6%, 193억원)도 지분가격에 주주대여금을 합하면 실제 매입비용은 900억원으로 2006년 매입가(2.88%, 470억원)와 비슷하다”고 해명했다. 버뮤다를 통한 까닭은 “이중 과세를 피하기 위해서였다”고 덧붙였다. ●공사 측 “합법적 거래” 주장 뉴스타파는 또 효성그룹이 2006년 약 300억원을 출자해 케이맨 군도에 설립한 ‘효성 파워 홀딩스’ 관련 거래 내용을 확인했다. 이 회사는 2015년 돌연 청산됐다. 효성 측은 “절차상 편의를 위해 중국 변압기 회사의 지분을 효성이 직접 인수하는 게 아니라 해외법인을 통해 하려고 지주회사를 설립한 것”이라며 불법이 아니라고 주장했다. 한편 자료 분석 결과 거주지 주소, 여권번호, 국적 등을 통해 한국인 232명이 포함된 것으로 나타났다. 이들 중 조세회피처 설립 서류에 한국 주소를 기재한 한국인은 197명이었고, 한국인이 조세회피처에 세운 법인은 90곳으로 나타났다."
매일경제,011760,/news/news_read.nhn?article_id=0003897078&office_id=009&mode=search&query=현대상사&page=1,2017-03-01 10:28,"현대상사&middot;라인호, 러에 세계최대 선박이동설비 공급","라인호 라이너 신라이히 대표(오른쪽)와 즈베즈다 조선소 유리 필체녹 대표이사(왼쪽)가 계약을 체결하고 있다. [현대종합상사 제공=연합뉴스]  현대종합상사는 라인호와 함께 러시아 국영 즈베즈다 조선소에 세계 최대 규모인 5만4000t급 선박이동설비(Ship Transfer System)를 공급한다고 1일 밝혔다. 전남 순천 율촌산단에 있는 라인호는 '자체 동력 중량물 이송설비' 생산 전문업체로, 국내외에서 20여개의 특허를 갖고 있으며 글로벌 해양·건설산업 이송설비 공급 분야에서 기술력을 인정받고 있다. 지난달 28일 공급 계약을 마친 이번 선박이동설비는 현존 조선 설비 가운데 가장 크다. 종전 기록도 라인호가 갖고 있었다. 이전까지는 라인호가 현대삼호중공업에 공급한 5만2800t급 선박이동설비가 세계최대 규모였다. 이번 계약의 전체 사업금액은 200억원이며 라인호가 설계, 제작, 공급, 설치 등 전 과정을 총괄한다. 러시아에서 선박 공급 관련 영업활동을 벌이고 있는 현대종합상사는 사업개발 초기부터 라인호와 이번 사업을 공조했다. 즈베즈다 조선소는 러시아 정부의 조선산업 육성 정책에 따라 시설 확충 작업을 진행하고 있다. 현대종합상사와 라인호는 이번 계약을 토대로 추가 수주 활동을 진행할 계획이다. [디지털뉴스국] r_start // r_end //"
아시아경제,011760,/news/news_read.nhn?article_id=0003741183&office_id=277&mode=search&query=현대상사&page=1,2016-05-04 16:39,"현대종합상사, 현대자원개발 흡수합병 결정","[아시아경제 최동현 기자] 현대종합상사가 현대자원개발을 흡수합병한다고 4일 공시했다. 합병 후 존속회사는 현대종합상사이며, 소멸회사는 현대자원개발이다. 합병비율은 1대 0이다."
뉴스1,011760,/news/news_read.nhn?article_id=0002102454&office_id=421&mode=search&query=현대상사&page=1,2016-06-09 16:09,"무보, 현대종합상사 버스수출에 6600만불 무역보험 지원","© News1 수출계약 체결-수출대금 지급 시점까지 효력…대금 미지급·계약파기 손실 보장 (서울=뉴스1) 윤다정 기자 = 한국무역보험공사가 현대종합상사와 500대 버스수출에 6600만달러의 무역보험 계약을 맺었다고 9일 밝혔다. 현대종합상사는 오는 9월부터 투르크메니스탄 도로교통부에 현대자동차가 생산한 버스를 공급한다. 무보는 현대종합상사가 물품을 선적하기 이전인 수출계약 체결 시점부터 물품 선적 이후인 수입자가 수출대금을 지급하는 시점까지 보험 효력이 발생하도록 설계했다. 이에 따라 수입자가 수출대금을 지급하지 않는 경우를 비롯해, 수출물품을 생산하는 단계에서 수입자가 계약을 중도 파기하는 경우 기업이 입게 될 손실까지 보장된다. 이번 수출거래는 2014년 6월 박근혜 대통령의 투르크메니스탄 순방 당시 양국 정상이 양국 협력 사업에 버스 수출을 포함하기로 하면서 시작됐다. 이어 투르크메니스탄 중앙은행의 신용보강과 무역보험공사의 지원이 결정되며 계약이 완성됐다. 현대종합상사는 이를 바탕으로 5월31일자로 투르크메니스탄과 수출계약 체결을 완료했다. 오는 9월~2017년 5월까지 현대자동차가 생산하는 버스를 순차적으로 선적할 예정이다. 투르크메니스탄은 수입한 버스를 2017년 9월 수도 아시가바트시(市)에서 개최되는 '실내·무도 아시안게임'에서 선수단 수송용으로 사용할 예정이다. 대회가 끝나면 자국민의 대중교통으로 활용한다. 김영학 무역보험공사 사장은 ""우리 경제의 수출위기를 극복하고 우리 기업이 수출경쟁력을 확보하려면 투르크메니스탄처럼 다소 위험하지만 성장 가능성이 높은 신흥시장에 반드시 진출해야 한다""며 ""앞으로도 투르크메니스탄을 포함한 중앙아시아 신흥국가에 과감하고 적극적으로 무역보험을 지원할 것""이라고 밝혔다."
뉴스1,011760,/news/news_read.nhn?article_id=0002100900&office_id=421&mode=search&query=현대상사&page=1,2016-06-09 08:17,"[장마감공시]현대종합상사, 자회사 현대자원개발 합병","(서울=뉴스1) 김민성 기자 = 현대종합상사가 자회사 현대자원개발과 합병한다. 현대종합상사는 현대자원개발과의 소규모합병에 대해 이사회 승인을 받았다고 공시했다. 현대종합상사는 “소규모합병에 대한 반대의사표시 주식수가 현대종합상사의 발행주식 총수의 100분의 20에 해당하지 않아 주주총회를 갈음하는 이사회에서 현대자원개발과의 소규모합병을 승인받았다”고 설명했다. 현대종합상사와 현대자원개발 합병 비율은 1대0이다. 합병회사인 현대종합상사는 피합병회사인 현대자원개발의 주식을 100% 소유하고 있다. 현대종합상사는 합병을 통해 경영 효율성을 증대하고 사업간 시너지 효과를 높임으로써 주주가치를 높일 계획이다. 합병기일은 7월31일이다. &lt;코스피시장&gt; Δ메리츠종금증권은 KT캐피탈 주식 634만5752주를 700억원에 취득한다고 공시했다. 취득 후 지분율은 16.6%다. 취득목적에 대해 상환전환우선주 취득을 통한 안정적 배당수익 확보를 위해서다. Δ성문전자는 자회사 청도성문전자유한공사에 17억4480만원의 채무보증을 결정했다고 공시했다. 이는 지난해 말 연결재무제표 기준 자기자본의 6.11%에 해당한다. Δ대림산업은 계열사 서울터널주식회사에 대해 공정거래위원회로부터 계열편입 유예 공문을 접수해 계열회사에서 제외한다고 공시했다. Δ두산건설은 화공플랜트사업(CPE)을 ㈜두산의 자회사인 DIP홀딩스에 매각한다고 공시했다. 매각 대금은 1172억원이다. &lt;코스닥시장&gt; Δ해성옵틱스는 전자부품 및 전자제품 제조업체인 바이오로그디바이스주식258만1228주를 취득한다고 공시했다. 취득 금액은 20억2500만원이며 이는 자기자본대비 2.85%에 해당하는 규모다. 취득 후 지분율은 9.4%(258만1228주)이다. Δ대주전자재료는 자사주 10만8108주를 장내에서 취득키로 결정했다고 공시했다. 취득예정금액은 4억9999만원이며 취득예상기간은 9월 8일까지다. Δ에스에이엠티는 운영자금을 마련하기 위해 313억원 규모의 주주배정증자 방식 유상증자를 결정했다고 공시했다. 신주는 2000만주로 예정발행가는 1565원이다. Δ코원은 이사회결의를 통해 박남규 대표이사와 왕빈 사내이사를 각자 대표이사로 선임했다고 공시했다. 코원은 ""기존 디지털디바이스 사업과 신규 모바일게임 사업에서 각 사업영역에 대한 효과를 높이기 위해 각자 대표제를 하기로 결정했다""고 밝혔다."
서울경제,011760,/news/news_read.nhn?article_id=0003324809&office_id=011&mode=search&query=현대상사&page=1,2018-06-18 10:08,"&lt;유&gt;현대상사, 전일 대비 7.16% 상승.. 일일회전율은 3.33% 기록","[서울경제] 현대상사(011760) 는 18일 오전 10시 7분 현재 7.16% 오른 42,650원에 거래되고 있으며, 38(매도):62(매수)의 매수우위를 기록하고 있다. 거래대금은 181억1,579만, 거래량은 44만36주로 거래량회전율은 3.33%로 나타났다. 지난 1개월간 현대상사는 상한가 2회, 상승 14회, 하락 14회를 기록했고, 주가수익률은 90.40% 표준편차는 11.19%를 기록했다. 이 기간 ' 유통업 ' 업종 평균 주가수익률은 -4.22%로 나타났으며, 변동성은 0.94%를 기록했다. 이 시각 현재 ' 유통업 '은 0.11% 상승 중이며, 38(매도):62(매수)의 매수우위를 기록하고 있다."
서울경제,011760,/news/news_read.nhn?article_id=0003315900&office_id=011&mode=search&query=현대상사&page=1,2018-06-07 10:13,"&lt;유&gt;현대상사, 장중 신고가 돌파.. 44,650&rarr;44,900(▲250)","[서울경제] 오전 10시 8분 현재 현대상사(011760) 가 6.90% 오른 44,900원(▲2,900)을 기록하며, 52주 신고가를 +250원 경신했다. 기존 52주 최고가는 2018년 05월 29일 기록한 44,650원이다. 체결강도는 150%로 강세를 유지했다. 총매수체결량은 376,736주, 총매도체결량은 251,226주를 각각 기록했다.  (※ 체결강도(%) = (총매수체결량/총매도체결량)*100) 이 시각 현재 거래대금은 284억5,416만, 거래량은 67만5,011주를 기록하고 있으며, 수급측면으로는 40(매도):60(매수)의 매수우위를 보이고 있다. 거래일을 기준으로 최근 3일간 평균 거래량은 1백5만3천주, 60일 평균 거래량 6십4만9천주로 최근 거래량이 큰 폭으로 증가하는 추세다."
