source,symbol,link,date,title,content
연합뉴스,011810,/news/news_read.nhn?article_id=0009944614&office_id=001&mode=search&query=STX&page=52,2018-03-08 16:06,STX조선해양의 운명은,(창원=연합뉴스) 이정훈 기자 = 정부와 채권단이 8일 STX조선해양에 대해 자구안 이행을 전제로 한 자력생존 결정을 내렸다. 이날 오후 경남 창원시 진해구 STX조선해양 야드내 선각 공장에서 철판 절단 작업이 진행되고 있다.  2018.3.8
연합뉴스,011810,/news/news_read.nhn?article_id=0010016167&office_id=001&mode=search&query=STX&page=24,2018-04-10 18:35,STX조선 노사 확약서 제출&hellip;공은 산은에 넘어가(2보),STX조선해양 노사확약서 (PG) (창원=연합뉴스) 이정훈 박정헌 기자 = STX조선해양 노사가 산업은행이 요구한 노사확약서 제출 시한을 하루를 넘기면서 협상을 계속한 끝에 생산직 인건비 절감 방안에 극적으로 합의했다. STX조선 노사는 노사확약서 제출 시한인 지난 9일 오후 5시에서 자정까지로 한 차례 연기를 받은 뒤에도 의견 차를 좁히지 못하다가 10일 오후 6시께 협상을 완료하고 확약서를 산업은행에 제출했다. 노사가 제출한 확약서의 구체적 내용은 공개되지 않았다. 밤샘 마라톤협상을 한 노사는 추가적인 인적 구조조정 없이 1년에 6개월 무급휴직을 하는 방향으로 접점을 찾아갔다. 그러나 6개월 무급휴직을 몇 년 동안 계속할지를 놓고 최종 합의에 이르지 못한 채 노조는 이날 오전 9시부터 비상대책위와 노조원 설명회를 잇따라 열어 회사 측과 합의한 자구계획안에 대한 노조원 동의를 얻는 절차를 진행했다. 보고대회에는 노조원 전원이 참석했으며 이들 대다수가 노사 협상안에 대해 대체로 동의한 것으로 확인됐다. 이후 무급휴직 시행 기간을 두고 다시 수 시간째 줄다리기를 한 노사 양측은 결국 연기된 제출 시한 '데드라인'을 다시 18시간 넘긴 이날 오후 6시가 다 돼서야 협상을 마무리했다. 그러나 이는 어디까지나 노사 간 협상 결과일 뿐 STX조선이 법정관리를 피하기 위해서는 최대주주인 산업은행의 승인이 있어야 한다. STX조선의 운명을 결정할 공은 산업은행으로 넘어간 셈이다.
노컷뉴스,011810,/news/news_read.nhn?article_id=0003076790&office_id=079&mode=search&query=STX&page=52,2018-03-08 15:40,엇갈린 성동조선과 STX조선의 '운명'&hellip;&quot;어쩌다&hellip;.&quot;,"[CBS노컷뉴스 윤석제 기자] 텍스트를 입력하세요. 중견 조선사인 성동조선해양과 STX조선해양의 운명이 갈렸다. 지난 7년간 3조원 이상의 공적자금이 투입된 성동조선은 법정관리로 사실상 회생이 불투명해 진 반면, STX조선은 사업개편 등 자구노력을 통해 자력 생존을 모색할 수 있게 됐다. 성동조선의 법정관리행은 주력 선종인 중대형 탱커의 수주 부진으로 남은 일감이 거의 없어 추후 이익 실현을 하기가 불가능하기 때문이다. 특히 유동성 부족으로 올해 2분기 부도가 우려돼고 있어 법정관리외에 다른 방법이 없다는게 채권단인 수출입은행측의 판단이다. 성동조선은 지난해 외부 컨설팅을 통해 기업가치를 산정한 결과 청산가치(7천억원)가 존속가치(2천억원)보다 큰 것으로 이미 평가됐다. 법정관리하에서 기적처럼 회생할 가능성을 완전 배제할 수는 없지만 채권단 측에서 신규자금 투입을 고려하지 않고 있다는 뜻을 확실히 밝혀 지난 2016년 10월 법정관리 이후 파산 수순을 밟았던 국적선사 한진해운의 길을 뒤따를 것으로 전망된다. 반면, STX조선은 채권단인 산업은행의 관리하에 고정비 감축과 자산 매각 등 강도높은 자구계획과 액화천연가스(LNG). 액화석유가스(LPG)선 등 고부가가치 가스선 수주로의 사업재편이 추진된다. STX조선은 지난 2016년 5월 법정관리에 들어갔으나 채무 건전성 개선을 통해 지난해 7월 법정관리를 졸업한 바 있다. STX조선은 현재의 경쟁 구도와 원가 구조만 놓고 볼 때 여전히 정상화가 불확실 상황이지만 지난 2월 말 현재 가용 자금이 1천475억 원을 보유하고 있다. 또 무엇보다 10척 이상의 일감이 아직 남아있어 내년까지 버틸 수 있는데다 추가수주협상도 여러 척 진행중이라는 측면이 정상화 쪽으로 가닥을 잡는 데 주요 원인이 됐다. 다만, 채권단의 신규 자금 지원 없이 자력으로 생존해야하는 만큼 자체 생존을 위한 길은 역시 '가시밭길'이 예상된다. 이와관련, 채권단은 오는 4월9일까지 새로운 자구계획과 인력 감축, 사업재편 방안에 대한 노사확약서를 제출하지 않으면 원칙대로 법정관리를 신청한다는 방침이다. 한때 수출강국의 상징이자 세계 1위의 자리에 올랐던 대한민국 조선업계가 현재 상태에 이른 것은 시장의 흐름을 제대로 읽지 못한 채 무리한 덩치키우기에만 몰두하다 맞게 된 결과다. 운명이 극명하게 엇갈린 성동조선과 STX조선 두곳의 중견 사업체를 차지하고 이른바 '빅3'로 불리는 대우조선해양과 현대중공업, 삼성중공업 역시 큰 어려움 속에 처해있는 게 사실이다. 지난 2008년 전세계를 휩쓴 글로벌 금융위기 이후 세계경제가 곤두박질 치면서 선박 발주가 절반가까이 줄어드는 시점에 우리 조선업계는 2006년 전후 대호황 시절 급격히 늘려온 생산·공급시설 등을 유지하려는 전략을 지속한 게 가장 큰 문제다. 업계에서는 이번 구조조정에 대해 조선 산업 전반에 걸쳐 몰고 올 파급 효과를 우려해 한 곳은 버리고 다른 한 곳은 살려보려는 정부의 의자가 표현된 것이라는 분석이다. 아울러, 조선 시장이 어려운 상황에서 이미 소생이 힘들어 보이는 부실 업체를 다른 곳에 무리하게 떠넘기는 것 아닌가하는 시장의 우려와 불확실성을 다소나마 해소한 측면이 있다는 평가들이 나오고 있다."
파이낸셜뉴스,011810,/news/news_read.nhn?article_id=0004052128&office_id=014&mode=search&query=STX&page=8,2018-07-05 09:23,"[특징주]STX, 거래 재개 첫날 급등",STX가 거래가 재개된 첫날인 5일 장 초반 급등세다. 이날 오전 9시 21분 현재 유가증권시장에서 STX는 전 거래일보다 4600원(15.86%) 오른 3만3600원에 거래 중이다. 전날 한국거래소 유가증권시장본부는 기업심사위원회 심의 결과 STX의 상장유지를 결정했으며 5일부터 주권의 매매거래정지가 해제된다고 밝혔다. STX는 자본금 전액 잠식으로 상장폐지 위기에 몰려 지난해 2월 16일 주식 매매가 정지됐다. 이어 같은 해 6월 거래소는 STX에 1년 개선 기간을 부여했다.
이데일리,011810,/news/news_read.nhn?article_id=0004054763&office_id=018&mode=search&query=STX&page=49,2018-03-12 18:24,"[마켓인]파인트리&middot;글로벌세아, STX重 매각 본계약 전환 앞둬","본입찰에 0곳 참여…법원 허가 절차 거쳐 4월쯤 본계약 전환엔진기자재·플랜트로 분할 매각…앞서 파인트리·세아 수의계약 체결 경남 창원에 있는 STX중공업 공장 전경. (사진=STX중공업) [이데일리 고준혁 기자] 엔진기자재와 플랜트 사업부로 분할 매각되는 STX중공업(071970) 본입찰에 한 곳도 참여하지 않으면서 이미 수의계약을 맺은 파인트리자산운용과 글로벌세아의 인수가 유력시 되고 있다. 12일 투자은행(IB) 업계에 따르면 STX중공업의 기업회생절차(법정관리)를 맡은 서울회생법원과 매각주간사 삼정KPMG가 진행한 본입찰에 한 곳도 참여하지 않았다. 앞서 지난달 23일 진행된 예비입찰에 STX중공업 엔진기자재 사업부를 인수하겠다는 한 업체가 인수의향서(LOI)를 제출했지만 본입찰엔 참여하지 않은 것이다. 이에 따라 파인트리와 글로벌세아가 STX중공업 엔진기자재와 플랜트 사업부에 대해 각각 맺은 조건부 인수 계약은 법원 허가 등을 거쳐 내달 쯤 본계약으로 전환될 예정이다. 스토킹 호스 방식으로 진행되는 이번 매각에 파인트리와 글로벌세아는 일찌감치 수의계약을 맺었다. 스토킹 호스는 유력한 예비 인수자를 선정해 미리 수의계약을 체결한 뒤 별도로 공개 입찰을 벌이는 경매 제도다. 두 회사는 앞으로 정밀실사를 거쳐 매도자 측과 STX중공업 매각가에 대해 최종 협상할 계획이다. 엔진기재자가 플랜트 사업부보다 가치가 더 큰 것으로 평가되고 있어 이러한 기준이 가격에 반영될 것으로 보인다. 지난해 일괄 매각으로 진행될 당시 STX중공업의 몸값은 약 1500억원 수준였던 것으로 알려져 있다. 파인트리는 부동산, 부실채권(NPL), 구조조정대상기업 채권 및 주식 등에 투자하는 회사다. NPL 투자 등에서 낸 높은 수익을 기반으로 인수합병(M&A)에서 두각을 나타내고 있다. 2015년 동부건설 매각 우선협상대상자 지위까지 올랐고 최근에는 본입찰을 앞둔 두산엔진 매각 예비입찰 참여하는 등 건설·조선업에 높은 관심을 보이고 있다. STX중공업 1차 매각 당시 단독으로 본입찰에 참여한 파인트리인 만큼 인수 의지가 강한 것으로 보인다. 의류 주문자상표부착생산(OEM) 사업을 하는 글로벌세아는 섬유·의류사업 업체인 세아상역의 지주사다. 비록 고배를 마셨지만 동부대우전자와 STX 인수전에 참여하는 등 M&A에 높은 관심을 보이고 있다. 이같은 행보는 단순 하청 업체라는 의류 OEM사의 한계를 극복해 종합의류기업으로 거듭나기 위한 것으로 풀이된다. 한편 STX중공업은 코스피 상장사로 1976년 설립됐다. 기자재 제조와 플랜트 설계·조달·시공(EPC)을 주요 사업으로 하고 있다. STX중공업의 계속 기업가치는 4237억원, 청산가치는 4022억원이다. STX중공업의 지난해 연결 재무제표 기준 매출액은 4147억원이고 당기순손실은 6314억원, 영업손실은 1559억원을 기록했다. STX중공업은 경영난으로 2016년 7월 법원에 법정관리를 신청했다."
디지털타임스,011810,/news/news_read.nhn?article_id=0002452004&office_id=029&mode=search&query=STX&page=52,2018-03-08 14:56,"김동연 부총리 &quot;성동조선 법정관리, STX는 한달 유예&quot;","성동조선이 결국 법정관리에 들어간다. STX조선은 고강도 자구노력 등을 전제로 한 달간 유예기간을 준다. 김동연 부총리 겸 기획재정부 장관은 8일 정부서울청사에서 산업경쟁력강화 관계장관회의를 주재하며 ""성동조선은 법정관리 신청이 불가피하고 STX조선은 자력 생존이 가능한 수준의 고강도 자구노력이 필요하다""고 밝혔다. 김 부총리는 ""지난 두 달간 전문 컨설팅 회사를 통해 산업 생태적 측면, 회사부문별 경쟁력, 구조조정 및 사업재편 방안 등을 포함해 다양하고 밀도 있는 분석을 했다""며 ""사측, 노조, 전문가 등 다양한 이해관계자의 의견 수렴 과정을 거쳤다""며 배경을 설명했다. 그는 ""채권단은 의견수렴, 컨설팅 과정을 거쳐 성동조선은 법정관리 신청이 불가피하다고 했다""면서 ""STX조선은 자력 생존이 가능한 수준의 고강도 자구노력과 사업재편에 대해 한 달 내에 노사 확약이 없는 경우 원칙대로 처리하기로 했다""고 밝혔다. 원칙대로 한다는 의미에 대해 그는 ""법정관리 한다는 것""이라고 설명했다. 이어 글로벌 업황 부진으로 어려움을 겪는 조선해운업에 대해서도 조선업 발전전략, 해운 재건 5개년 계획을 이른 시일 내에 준비하는 등 혁신과 상생 발전 방안을 마련하겠다고 했다. 그는 ""어려움이 예상되는 경남 통영 지역을 위한 지원대책을 신속히 마련할 것""이라며 ""조선소 가동 중단 등으로 어려움을 겪는 군산을 위한 대책도 필요하다""고 했다."
아이뉴스24,011810,/news/news_read.nhn?article_id=0000452995&office_id=031&mode=search&query=STX&page=8,2018-07-05 09:51,"[특징주] STX, 매매거래정지 해제 첫날 '강세'","[아이뉴스24 한수연 기자] STX가 유가증권시장에서 거래가 재개된 첫 날 급등세다. 5일 오전 9시40분 코스피 시장에서 STX는 전 거래일 대비 20.52%(5천950원) 상승한 3만4천950원에 거래되고 있다. 전일 한국거래소 유가증권시장본부는 기업심사위원회 심의 결과 STX의 상장유지를 결정했다고 공시했다. 이에 따라 STX는 5일부터 주권의 매매거래정지가 해제돼 거래가 재개됐다. 앞서 지난 2월 16일 STX는 자본금 전액 잠식으로 상장폐지 위기에 몰려 주식 매매가 정지됐으며, 지난달 거래소는 STX에 1년의 개선 기간을 부여했다. /한수연 기자"
서울경제,011810,/news/news_read.nhn?article_id=0003335056&office_id=011&mode=search&query=STX&page=11,2018-06-29 09:39,STX엔진 공동관리절차 종결,"[서울경제] STX엔진(077970) 은 29일 “최대주주 변경을 수반하는 STX엔진(주) 채권금융기관협의회의 보유주식 공동매각 거래가 종결됨에 따라, 제10차 채권금융기관협의회 결의에 의거 채권금융기관 공동관리절차(자율협약)가 종결됐다”고 29일 공시했다."
KBS 뉴스,011810,/news/news_read.nhn?article_id=0010564330&office_id=056&mode=search&query=STX&page=26,2018-04-10 10:40,산은 &ldquo;STX조선 자구안 제출하면 추가 검토해 법정관리 최종 결정&rdquo;,"산업은행이 자구계획 제출 시한을 넘긴 STX조선해양에 대해 법정관리 절차는 진행하되, 노사가 실효성 있는 자구안을 제출하면 정부와 논의해 최종 방침을 정하겠다고 밝혔다. 법정관리 신청을 준비하기까지 약 일주일 정도 걸리는 만큼, 그 안에 노사가 실효성 있는 자구안을 제출하면 법정관리를 면할 수 있을 것으로 보인다. 산업은행 관계자는 ""일단 시한을 넘겼기 때문에 법정관리는 예정대로 진행하되, 절차를 진행하는 동안 STX가 실효성 있는 자구안을 제출하면 정부에 자구안을 보내고 다시 검토해보겠다""고 밝혔다. 법정관리 신청 서류를 법원에 내려면 준비하는데 일주일 정도 시간이 걸리는 만큼, 다시 한 번 회생할 기회를 주겠다는 의미로 해석된다. STX조선 노사는 최대주주인 산업은행이 요구한 자구 계획안 제출 시한인 어제 자정을 넘겨 오늘 새벽에 잠정 합의안을 도출했다. 노사는 희망퇴직과 아웃소싱 등 인적 구조조정을 하지 않는 대신 무급휴직·임금삭감·상여금 삭감을 통해 정부와 채권단이 요구한 생산직 인건비 75% 절감 효과를 내는 방향으로 고정비 절감에 나서기로 일단 의견 접근을 이뤘다. 노사는 오늘 오전 9시부터 비상대책위와 노조원 설명회를 잇따라 열어 회사 측과 합의한 자구 계획안에 대한 노조원 동의를 얻는 절차를 진행하고 있다. 노조원 6백여 명 전원이 참석한 것으로 알려졌으며 이들 대다수가 노사 협상안에 대해 대체로 동의한 것으로 전해졌다. STX 사측은 자구 계획안이 노조 동의 절차를 통과하면, 대표이사와 노조위원장이 서명한 확약서를 산업은행에 제출할 방침이다. 앞서 정부와 산업은행은 STX조선 노사가 생산직 인건비 75% 감축(약 500명) 등의 자구계획에 합의해 확약서를 가져오면 선수금환급보증(RG)을 발급하는 등 자력 생존의 길을 터주겠다고 지난달 발표했다. [사진출처 : 연합뉴스]"
아시아경제,011810,/news/news_read.nhn?article_id=0004215891&office_id=277&mode=search&query=STX&page=23,2018-04-10 18:38,"STX조선, '노사확약서' 제출&hellip;운명은 산업은행 손에","[아시아경제 기하영 기자] STX조선해양이 산업은행에 구조조정안에 대한 노사확약서를 제출했다. 이제 산업은행과 정부의 판단에 따라 STX조선의 법정관리행이 결정될 전망이다. 10일 STX조선에 따르면 이날 오후 5시 55분 STX조선은 산업은행에 자구계획안과 노사확약서를 제출했다. 당초 정부가 제시한 데드라인인 9일 오후 12시를 넘겨 가까스로 노사합의에 이른 것이다. 이날 STX조선 노조는 오전 9시 비상대책위원회를 거쳐 10시 20분부터 조합원 간담회를 진행했다. 이후 11시 30분부터 6시간 동안 노사확약서 문안을 협의한 끝에 오후 5시 55분 산업은행에 노사확약서를 제출했다. STX조선 노조는 이날 새벽 겨우사측과 고정비 절감방안에 합의했다. 희망퇴직과 아웃소싱 등 인원감축 대신 무급휴직, 임금 삭감, 상여금 삭감을 통해 정부와 채권단이 요구한 생산직 인건비 75%절감을 실현하기로 했다. 이제 STX조선의 운명은 산업은행 등 정부와 채권단의 손으로 넘어갔다. 자구계획안과 노사확약서 내용은 공개되지 않았지만 애초 정부와 채권단이 요구한 방안과 다른 만큼 이를 산업은행이 받아들일진 미지수다. 산업은행은 원칙대로 정부와 채권단이 요구한 시한을 넘겼다는 이유로 법원에 회생절차(법정관리)를 신청하겠다고 밝힌 상태다. 다만 산업은행은 STX조선이 자구계획서와 노사확약서를 제출하면 세부내용과 이행 가능성 여부를 점검해 STX조선 처리방침을 최종 결정하겠다는 입장이다. 앞서 정부와 산업은행은 지난달 STX조선에 대해 고정비 40% 감축 등 강도 높은 구조조정 자구안을 전제로 생존시키기로 결정했다. 노사가 생산직 인건비 75% 감축(약 500명) 등의 자구계획에 합의해 확약서를 가져오면 선수금환급보증(RG)을 발급하기로 발표했다. 그러나 STX조선 노사는 인력 감축 목표에 전날까지 합의하지 못했고, 희망퇴직과 아웃소싱 신청 규모도 144명에 불과해 정부가 요구한 인건비 75%감축(500여명)의 30%밖에 달성하지 못했다."
파이낸셜뉴스,011810,/news/news_read.nhn?article_id=0003999162&office_id=014&mode=search&query=STX&page=25,2018-04-10 15:09,"STX.성동조선, 청산&middot;독자생존 갈림길 놓여","STX조선해양과 성동조선해양 등 부실 중견 조선사들이 청산과 독자생존의 갈림길에서 놓였다. 성동조선해양에 이어 STX조선해양까지 독자 생존이 어렵다는 진단이 내려지면서 강력한 인력 구조조정과 함께 최악의 경우 청산까지도 걱정해야 할 것으로 보인다. 10일 산업은행은 STX조선해양의 운명을 두고서 노조측과 팽팽한 입장차를 좁히지 못하면서 향후 기업 회생 여부를 두고 험난 항로가 예상된다. STX조선해양 노사는 지난 9일 최종 시한을 넘겨 대규모 인력 감축 대신 무급휴직 등 그에 상응하는 방안으로 고정비용 절감 방안을 잠정 합의했다. 하지만 산업은행은 시한을 넘겨 노사합의 자구안이 나온 만큼 원칙대로 STX조선해양에 대한 법정관리 절차를 진행하기로 했다.  ■중소조선사 독자생존 '부정적'  그동안 산업은행은 STX조선해양의 독자생존 가능성을 낮게 봤다. 산업은행은 ""STX조선해양은 중형 탱커선에서 높은 시장 점유율을 보여 왔으나, 중국과 베트남 등 국내 해외와의 경쟁 심화 및 기술 격차 축소, 원가 경쟁력 상실 등으로 수주 회복 선가 상승 등 우호적인 대외 여건 개선을 가정하더라도 현재의 경쟁 구도 및 원가 구조로는 정상화가 불확실하다""고 진단했다. 산업은행은 다만 ""법정관리에서의 5조원에 이르는 대규모 출자전환액에 대한 이자비용 면제 및 상환유예의 조치로 부채비율이 2016년 5월 완전자본잠식에서 2017년 9월에는 76.0%로 올라가는 등 재무 건전성이 개선돼 유동성 외에 추가적인 재무관리 요소가 없고 채권단의 신규 자금 지원 없이 1475억 원에 이르는 자체 자금 등으로 일정 기간 독자경영이 가능하다""고 설명했다. 성동조선해양에 이어 STX조선해양까지 법정관리를 통한 회사 정리절차에 들어갈 경우 협력업체의 경영 위기 가중 등 조선 산업 전반의 생태계 붕괴 여파가 극심할 것이라는 우려도 있다. 앞서 성동조선해양은 지난달 22일 창원지방법원에 회생절차(법정관리)를 먼저 신청했다. 정부는 지난달 8일 김동연 부총리 겸 기획재정부 장관 주재로 산업경쟁력강화 관계장관회의를 열고 중견 조선소 처리 방안을 확정·발표하며 성동조선해양의 법정관리행을 결정했다. ■법정관리 뒤 청산 우려까지 정부의 이 같은 결정은 성동조선해양이 2차례에 걸친 재무 건전성 평가에서 청산가치보다 존속가치가 현저히 낮게 나왔기 때문이다. 재무 건전성 평가에 따르면 성동조선해양은 그동안 채권단으로부터 4조원 가량을 지원받았지만 부채규모가 3조1000억원에 달하는 것으로 나타났다. 성동조선해양은 향후 법원의 결정에 따라 청산 또는 회생을 하게 된다. 청산이 결정될 경우 약 1400명의 직원들이 일자리를 잃고 지역경제에 미치는 파장도 적지 않을 것으로 관측된다. 반대의 경우는 법원 주도로 회생 작업에 들어가게 된다. 한편, 노동계는 지난 5일 정부가 발표한 조선산업 발전전략이 해결책이 못된다고 반발중이다. 중형 조선소인 성동조선이 법정관리에 들어가고 3600명이 일하던 STX조선은 800명만 남기고 필요한 인력은 도급 노동자로 충당하겠다는 게 대책이 아니라는 것이다. 금속노조 관계자는 ""정부가 '노사정대표자회의' 산하에 '조선업종협의회'를 즉각 구성하고 사회적 대화를 해야한다""고 요구했다. 하지만 최근 몇년간 글로벌 조선위기속에서 대형 조선사조차도 통폐합해야 하는 상황에서 중소조선사들은 더욱 생존이 어렵다는 게 조선업계의 속사정이다. 국내 '빅3' 조선사중 대우조선해양은 정부의 공적자금 지원, 그리고 현대중공업과 삼성중공업은 그룹사들의 유상증자 지원을 통해 회생을 모색중이다."
경향신문,011810,/news/news_read.nhn?article_id=0002862965&office_id=032&mode=search&query=STX&page=26,2018-04-10 10:39,"STX조선 법정관리 여부, 공은 다시 정부와 산은으로",STX조선해양이 법정관리 갈림길에 섰다. 정부와 산업은행이 노사에 넘겼던 ‘공’이 다시 정부와 산업은행으로 돌아왔다. 정부와 산업은행은 STX조선 노사의 잠정 합의안이 실효성 있는 대안인지 여부를 검토한 뒤 조만간 결정을 내릴 방침이다. 산업은행 관계자는 10일 오전 “법정관리 신청 절차에 돌입하지만 서류 작업하는데 시간이 걸린다”며 “그 사이 노사의 실효성 있는 계획안이 오면 정부하고 협의하겠다”고 말했다. YHAP 산업은행이 STX조선해양에 대해 회생절차(법정관리)를 신청한다고 밝힌 10일 오전 경남 창원시 진해구 STX조선해양 정문으로 STX조선 관계자가 출근하고 있다.  (사진 : 연합뉴스) //YHAP 이날 새벽 STX조선의 노사는 대규모 인력 감축 대신 무급휴직 등 그에 상응하는 방안으로 고정비용 절감 방안을 잠정 합의했다.
