source,symbol,link,date,title,content
KBS 뉴스,011810,/news/news_read.nhn?article_id=0010563842&office_id=056&mode=search&query=STX&page=35,2018-04-09 09:17,STX조선 오늘 오후 5시 자구안 제출 시한&hellip;인력 감축 협상 &lsquo;난항&rsquo;,"STX 조선해양의 고통 분담 노사 확약서 제출 시한이 오늘 오후 5시로 다가왔지만, 노사의 인력 감축 협상이 난항을 보이고 있다. STX조선은 생산직 희망퇴직·아웃소싱 신청자 접수를 최종 마감한 결과, 희망퇴직에 104명, 아웃소싱에 40명이 신청해 자력 생존 조건인 생산직 인건비 75% 감축(약 500명)에 미달했다고 밝혔다. 앞서 정부와 산업은행은 지난달 8일 STX조선을 살린다는 방침을 밝히면서 생산직 인건비 75%를 줄이는 자구안과 이에 동의하는 노조확약서를 오늘까지 제출하라는 조건을 달았다. 오후 5시까지 제출하지 않으면, STX조선은 9개월 만에 다시 법정관리로 넘어갈 가능성이 큰 상황이다. 사측은 ""노사확약서 제출의 기준이 되는 인력 구조조정 목표를 달성하지 못했고, 이는 법정관리로 결론 날 수밖에 없는 상황""이라며 ""생산직 조직 및 인력 조정을 통한 체질 개선만이 회사가 생존할 수 있는 기반이 될 것으로 판단하고 이를 반드시 이행하도록 하겠다""고 밝혔다. 반면 노조는 사측과 협의에 최선을 다하겠지만, 인적 구조조정은 절대 수용할 수 없다는 입장이다. 노조 관계자는 ""사측과 협의가 어떻게 될지 모르지만, 현재 상황을 보면 법정관리는 불가피해 보인다""며 ""채권단과 정부 결정에 따라야 하는 사측도 뾰족한 수는 없겠으나 우리 입장에서 인적 구조조정을 절대 받아들일 수 없다""고 말했다. 사측은 오늘까지 자구안과 확약서를 제출하지 못하면 이후 법정관리 돌입에 앞서 정리해고를 단행할 계획이다. 채권단인 산업은행은 노조확약서 제출 시한을 넘기면 법정관리에 돌입하겠다는 방침을 고수하고 있다. [사진출처 : 연합뉴스]"
서울경제,011810,/news/news_read.nhn?article_id=0003359131&office_id=011&mode=search&query=STX&page=5,2018-07-27 11:22,"&lt;유&gt;STX, 전일 대비 7.83% 상승.. 일일회전율은 0.58% 기록","[서울경제] STX(011810) 는 27일 오전 11시 21분 현재 7.83% 오른 17,900원에 거래되고 있으며, 40(매도):60(매수)의 매수우위를 기록하고 있다. 거래대금은 17억8,130만, 거래량은 10만3,004주로 거래량회전율은 0.58%로 나타났다. 지난 1개월간 STX는 상승 3회, 하락 13회를 기록했고, 주가수익률은 -24.95% 표준편차는 5.81%를 기록했다. 이 기간 ' 유통업 ' 업종 평균 주가수익률은 -8.42%로 나타났으며, 변동성은 0.99%를 기록했다. 이 시각 현재 ' 유통업 '은 1.08% 상승 중이며, 43(매도):57(매수)의 매수우위를 기록하고 있다."
뉴스1,011810,/news/news_read.nhn?article_id=0003280215&office_id=421&mode=search&query=STX&page=42,2018-03-26 18:02,STX조선해양 대형크레인 아래로,(창원=뉴스1) 여주연 기자 = 26일 오후 경남 창원시 진해구 STX조선해양에서 근로자들이 대형 크레인 아래로 걷고 있다. 이날 노조는 인력 구조조정을 철회할 때까지 생산직과 휴직자 약 700명이 전면 파업에 들어간다고 밝혔다. 2018.3.26/뉴스1
세계일보,011810,/news/news_read.nhn?article_id=0003265011&office_id=022&mode=search&query=STX&page=16,2018-04-11 20:13,"[뉴스+] 벼랑 끝 STX조선 법정관리 면했지만, 난제 '산적'","채권단, 자구계획안 수용 결정 / “노조에 밀려 원칙훼손” 지적도 STX조선해양이 가까스로 법정관리 행을 피했다. 주채권은행인 산업은행은 11일 STX조선이 전날 오후 제출한 자구안과 노사 확약서를 수용하겠다고 밝혔다. 앞서 STX조선 노사는 애초에 채권단이 제시한 것과 다르게 생산직 인력을 줄이지 않는 대신 5년간 6개월씩 무급휴직을 하는 방안을 통해 채권단이 요구한 ‘고정비의 40% 절감’을 실현하겠다는 뜻을 밝혔다. 산은은 자구안을 회계법인 등과 함께 검증한 후 “애초에 컨설팅에서 제시했던 수준 이상으로 인건비 등을 절감할 수 있을 거라는 결론을 내렸다”며 “노사의 경영정상화 의지를 존중해 이 같은 결정을 내렸다”고 말했다. 창원시 진해구 STX조선해양 야드가 한산하다. 연합뉴스 이날 산은은 보도자료를 통해 “향후 STX조선의 경영정상화를 위해 수주가이드라인의 요건을 충족하는 선박에 대한 RG(선수금환급보증)를 발급해 자구계획의 실행력을 담보하는 한편 무분별한 저가 수주로 국민경제에 부담을 초래하는 것을 방지할 것”이라고 언급했다. 또 “경영 상황과 자구계획 이행 등을 지속적으로 점검해 자산 매각 등 자구계획이 원활히 이행되지 않거나 자금부족이 발생할 경우에는 원칙대로 처리(법정관리 신청)할 예정”이라고 강조했다. 산은의 자구계획안 수용소식에 대해 창원 지역 경제계 역시 일제히 환영의 목소리를 냈다. 한철수 창원상공회의소 회장은 “법정관리를 둘러싼 노사와 채권단의 갈등 때문에 사외 협력사 등 지역민도 많은 아픔을 겪었다”며 “산업적 측면과 지역민의 염원을 모두 고려해 자구계획안을 수용한 포용적 결단이 나와 반갑다”고 환영했다. 하지만 일각에서는 산은이 구조조정의 원칙을 저버렸다는 비판의 목소리도 나온다. STX조선 노사가 확약서 제출 시한을 넘긴 것은 물론 애초 채권단이 요구했던 인적 구조조정안과 전혀 다른 안을 넘겼다는 이유 때문이다. 노사가 합의한 대로 장기간 무급휴직을 허용할 경우 인력이 여유롭지 않은 상황에서 건조 효율성이 떨어지고 회사 운영마저 차질을 빚을 가능성도 제기되고 있다. 오정근 건국대 특임교수는 “지방선거를 앞두고 있기 때문에 ‘원칙론’만을 강경하게 밀어붙이기 힘들었을 것”이라며 “노조가 향후 이 자구안의 원칙을 얼마나 철저하게 지키는지 등을 산은이 책임감 있게 지켜봐야 한다”고 주장했다. 경남 창원시 진해구 STX조선해양 정문으로 STX조선 관계자가 출근하고 있다.  향후 STX조선이 경영난을 원활하게 해결하고 정상화할 수 있을지 또한 미지수다. 조선업 관련 애널리스트들은 조선 업황의 개선 속도가 느려 올해 수주 목표 물량(20척)을 채우는 것조차 쉽지 않아 보인다고 부정적으로 전망했다. 금융권에서도 “STX조선이 2017년 법정관리 조기졸업 당시 저가수주를 통해 물량은 확보했지만 재무 상태는 나아진 게 하나도 없었다”며 “법원이 오판한 것”이라고 지적하기도 했다. 업황이 여전히 부진한데 무작정 회복세를 기대하기 힘들다는 입장이다. STX조선해양 노사가 산업은행이 요구한 노사확약서를 극적으로 제출한 10일 오후 장윤근 STX조선 대표가 창원시 진해구 STX조선해양 내 주차된 차에 오르고 있다.   박영호 창원대 조선해양공학과 교수는 “정부가 수주물량을 일부 지원해 기업이 배를 지을 수 있게 한다면 핵심인력과 기술 유출 없이도 위기를 넘기고 조선업황이 좋아질 때에 대비할 수 있다”면서 불황국면에서 중견조선사들이 줄줄이 무너지면 결국 중견조선 시장을 중국에 내줄 수 있다고 지적했다. 박무현 하나금융투자 조선업 분야 연구원은 “STX조선이 경영난을 겪게 된 주 원인은 주력 분야인 중소형 탱크선 외에 너무 많은 분야에 투자를 해 왔기 때문”이라며 “향후 비교우위가 있는 소형 탱크선에 주력한다면 경영정상화에 도움이 될 것”이라고 조언했다. 김라윤 기자, 창원=안원준 기자"
뉴스1,011810,/news/news_read.nhn?article_id=0003280258&office_id=421&mode=search&query=STX&page=42,2018-03-26 18:16,법정관리 기로에 선 STX조선해양,(창원=뉴스1) 여주연 기자 = 26일 오후 경남 창원시 진해구 STX조선해양에 대형 크레인이 자리를 지키고 있다. 이날 금속노조 STX조선해양지회는 인력 구조조정을 철회할 때까지 생산직과 휴직자 약 700명이 전면 파업에 들어간다고 밝혔다. 2018.3.26/뉴스1
연합뉴스,011810,/news/news_read.nhn?article_id=0010011902&office_id=001&mode=search&query=STX&page=35,2018-04-09 09:11,"노회찬, STX&middot;성동조선 '제3의 해법' 주문&hellip;결의안 발의","'평화와 정의의 의원모임' 노회찬 원내대표 [연합뉴스 자료사진] (창원=연합뉴스) 이정훈 기자 = 노회찬(경남 창원성산) '평화와 정의의 의원모임' 원내대표가 법정관리 위기를 맞은 창원 STX조선해양과 이미 법정관리에 들어간 통영 성동조선해양 해법을 놓고 노·사·정 대화를 통한 '제3의 방안'을 제시, 주목을 끌고 있다. 노회찬 원내대표는 지난 6일 STX조선해양과 성동조선해양이 경영정상화와 회생을 하도록 정부와 채권단의 결단을 촉구하는 결의안을 대표발의했다고 9일 밝혔다. 노 원내대표를 포함한 정의당 의원 6명 전원과 STX조선이 있는 창원시 진해구가 지역구인 김성찬 자유한국당 의원 등 여야 의원 11명이 결의안 발의에 참여했다. 결의안은 STX조선에 대해서는 9일까지 고강도 자구노력과 사업재편에 대한 노사확약이 없으면 원칙대로 처리한다는 방침을 수정해 노·사·정 대화를 추진해야 한다는 내용을 담았다. 법정관리에 들어간 성동조선에 대해서는 노동자 의견 수렴 등을 통해 기업이 존속하는 방향으로 회생계획을 세워야 한다고 지적다. 노 원내대표는 ""STX조선과 성동조선은 대외적 요인, 경영진의 부실경영 등 여러 요인에 의해 경영이 나빠졌다""며 ""그동안 노사가 경영정상화를 위해 노력한 만큼 청와대와 정책 당국은 지난달 밝힌 중견조선사 처리방안을 수정하고 노·사·정이 동의하고 함께 고통을 분담하는 방안을 다시 모색해야 한다""고 결의안 발의 취지를 설명했다. 그는 ""STX조선의 경우 현재 15척의 배를 수주해놓아 약 1천500명 정도 인력이 더 필요한 상황이다. 그런데도 정부와 채권단이 현재 680명인 생산직 노동자 중 500명을 해고하라고 요구하고 있다""고 지적했다. 살려내라    (서울=연합뉴스) 김인철 기자 = 지난 4일 오후 정부서울청사 앞에서 열린 조선산업 올바른 회생 촉구 조선업종노조연대(조선노연) 결의대회에서 성동조선·STX조선 등 노조원들이 구호를 외치고 있다."
부산일보,011810,/news/news_read.nhn?article_id=0000795943&office_id=082&mode=search&query=STX&page=16,2018-04-11 20:11,"STX, 법정관리 피하고 '독자 회생' 길 열려","정부와 채권단이 STX조선해양이 제출한 노사 합의 자구안을 수용했다. 침몰 위기에 몰렸던 STX조선은 극적 회생의 길로 접어들게 됐다. 무급 휴직 확대, 복지 축소 '노사 자구안' 채권단 수용 주채권은행인 산업은행이 11일 STX조선 노사가 제출한 자구계획을 수용키로 했다고 발표하면서 STX조선은 법원 회생절차(법정관리)를 피하게 됐다. 앞서 정부와 산업은행은 STX조선 노사가 '인건비 75% 감축 등을 통한 고정비 40% 절감'에 합의해 지난 9일까지 확약서를 제출토록 요구했다. 확약서가 제출되면 선수금환급보증(RG) 발급으로 선박 건조 수주를 지원하지만,제출되지 않으면 법정관리 신청이 불가피하다는 방침이었다. STX조선 노사는 제출 시한인 지난 9일 자정을 넘겼다. 그러자 산업은행은 ""원칙적으로 회생절차로의 전환을 신청할 예정""이라고 발표했다. 이후 18시간이 지난 전날 오후 6시께 STX조선 노사는 산업은행에 확약서를 냈다. 확약서에 담긴 자구계획은 생산직 인력(650명)을 희망퇴직과 아웃소싱(협력사 이전) 등을 통해 감축하는 대신 무급 휴직(5년간 매년 6개월씩) 기간을 늘리고 상여금과 복지혜택을 축소하는 방안을 담고 있다. 인력 구조조정을 반대하는 노조의 요구를 수용하되 정부와 채권단이 요구한 '고정비 40% 절감'을 충족하는 인건비 절감 절충안이다. 산업은행은 노사 자구안의 고정비 절감 효과와 삼정KPMG의 경영컨설팅 결과를 비교하는 시뮬레이션 작업을 거쳐 수용키로 결정했다. 정부 관계자는 ""회계법인과 채권단 실무자들이 노사 자구안이 경영컨설팅 결과에 따른 비용절감 효과를 낼 지 검증한 결과 실현 가능성이 있는 것으로 판단했다""고 전했다. 정부와 채권단은 독자 생존 항로에 들어가는 STX조선의 신규 수주를 위해 수주 가이드라인에 따라 RG 발급 등의 지원에 나서게 된다. 다만, 국민경제 부담을 줄이기 위해 신규 자금은 지원하지 않는다. 한편 장윤근 STX조선해양 대표이사는 이날 임직원 담화문을 통해 ""2년 이내에 회사가 정상화되도록 최선을 다하겠다""고 밝혔다."
연합뉴스,011810,/news/news_read.nhn?article_id=0010287896&office_id=001&mode=search&query=STX&page=2,2018-08-22 15:59,"STX &quot;최대주주, 산업은행에서 에이에프씨머큐리로 변경&quot;",(서울=연합뉴스) 전명훈 기자 = STX는 최대주주가 한국산업은행에서 에이에프씨머큐리유한회사로 변경됐다고 22일 공시했다. 에이에프씨머큐리유한회사가 보유한 STX 지분은 85.30%다.
뉴스1,011810,/news/news_read.nhn?article_id=0003280257&office_id=421&mode=search&query=STX&page=42,2018-03-26 18:16,"STX조선해양, 인력 구조조정 철회까지 전면 파업",(창원=뉴스1) 여주연 기자 = 26일 오후 경남 창원시 진해구 STX조선해양에 대형 크레인이 자리를 지키고 있다. 이날 금속노조 STX조선해양지회는 인력 구조조정을 철회할 때까지 생산직과 휴직자 약 700명이 전면 파업에 들어간다고 밝혔다. 2018.3.26/뉴스1
이데일리,011810,/news/news_read.nhn?article_id=0004074763&office_id=018&mode=search&query=STX&page=35,2018-04-09 09:07,"STX조선, 오늘 오후 5시 &lsquo;데드라인&rsquo;&hellip;노조 비대위 합의 여부 고비","9일 오전 8시부터 비상대책위 회의노조막판 변심 가능성에 이목 집중합의불발 시 법정관리行 청산 가능성↑사측·산은 ""대화창구 열어두고 있다"" STX조서해양 노조가 사측이 제안한 ‘인력 구조조정’ 자구 계획안에 반발해 지난달 26일 경남 창원시 진해구 STX조선해양에서 열린 파업 결의대회에서 구호를 외치고 있다(사진=연합뉴스). [이데일리 김미경 기자] 오늘(9일) 오후 5시. 정부와 채권단이 요구한 STX조선해양의 자구안과 이에 동의하는 노사확약서 제출 시한 ‘데드라인’(최종 마감 시간)이다. 지난해 법정관리(기업회생절차)에서 가까스로 빠져나온 STX조선해양이 또다시 운명의 기로에 섰다. 정부와 채권단은 STX조선에 이날까지 자구계획안과 노사확약서 제출을 요구했지만 STX조선 노사는 여전히 평행선을 달리고 있다. 극적 타결이 없는 한 법정관리 수순을 밟게 된다. 지난 8일 마감한 희망퇴직과 아웃소싱(외부·협력업체로 소속을 옮기는 것) 신청자 수도 144명으로 목표치인 500명에 크게 못미쳤다. STX조선 및 채권단 대표이자 최대주주인 KDB산업은행에 따르면 이날 업무 시간 내인 오후 5시까지 노사 확약서를 제출해야 한다. 합의 불발 시 앞으로 선수금환급보증(RG)을 발급해주지 않기로 했다. RG는 조선회사가 도산해 배를 건조하지 못하는 상황이 됐을 때, 금융회사가 선주에게 선수금을 대신 물어주겠다고 약속하는 보증서다. 조선사들은 RG가 없으면 선주와 계약을 맺을 수 없다. 다른 금융회사들이 이미 RG를 거부하고 있는 상황에서 산은이 RG를 발급하지 않으면 STX는 수주 영업이 불가능해진다. 법정관리에 들어가면 법원은 채권단 집회를 열고, 채무 조정을 통해 STX조선해양이 갚을 수 있는 수준으로 채무를 낮춘 뒤 경영관리를 한다. 청산이 결정되면 사무직을 포함해 1400여 명의 일자리가 한꺼번에 사라진다. 다만 산은 협상은 막판까지 가봐야 알 수 있는 만큼 대화 창구는 열어두고 있다고 말했다. STX조선 노사는 생산직 인력 감축을 놓고 맞서고 있다. 사측은 법정관리를 피하려면 정부, 채권단이 요구한 수준의 구조조정을 할 수밖에 없다는 입장을 되풀이했다. 반면 노조는 인력감축을 전제로 한 구조조정은 절대 받아들일 수 없다는 기존 방침에서 물러서지 않고 있다. 막판 합의 가능성도 배제할 수는 없다. 노조는 이날 오전 8시부터 비상대책위 회의를 진행 중이다. 이 과정이 자구안 합의 여부를 결정짓는 고비가 될 것으로 보인다. “정치적 논리로 해결하지 않는다”는 청와대의 공식 입장도 합의 여부에 영향을 미칠 가능성도 있다. 앞서 해외매각(자본유치)과 법정관리의 기로에 섰던 금호타이어 노조도 청와대와 정부가 ‘정치적 논리’가 아닌 ‘경제적 논리’로 접근하겠다고 밝히면서 노조의 강경노선이 무너져 노조 합의로 더블스타 매각을 결정했다. STX조선은 2016년 6월에도 법정관리를 받은 바 있다. 이후 두 차례의 무상감자와 출자전환으로 가까스로 지난해 7월 법정관리를 조기졸업했다. 하지만 이후에도 경영 위기는 계속됐다. STX조선은 지난해 1172억원의 영업손실을 기록했다."
이데일리,011810,/news/news_read.nhn?article_id=0004076437&office_id=018&mode=search&query=STX&page=21,2018-04-11 05:01,[법정관리 위기 STX조선]산은 &ldquo;검토하겠다&rdquo;지만&hellip;&lsquo;알맹이 빠진&rsquo; 노사 자구안 통...,"STX조선 노사확약서, 데드라인 넘겨 산은 제출희망퇴직 반대하는 노조 요구 수용'무급휴직·임금삭감 등으로 비용 절감'외부 컨설팅보고서보다 후퇴한 합의조선업계선 자구안에 대해 부정적 STX조선해양 노사는 산업은행이 제시한 시한을 하루 넘긴 10일 오후 노사확약서를 제출했다. STX조선의 한 노동자가 9일 안전모를 손에 들고 출근하고 있다(사진=연합뉴스·그래픽=이데일리 이동훈 기자). [이데일리 김미경 기자] ‘독자생존→법정관리→일단 보류.’ 10일 새벽, STX조선해양의 운명은 세 차례나 뒤바뀌었다. 9일 시한을 한 차례 넘기며 그야말로 하루밤새 천당과 지옥을 오갔다. STX조선 관계자는 “지난해 법정관리를 졸업한 기쁨도 잠시, 대규모 인력 감축을 전제로 한 ‘조건부 생존’ 판정이 내려진 뒤 한달여 동안 극한 고통을 겪고 있다. 정말 지쳤다. 피를 말린다”며 하소연했다. ◇STX조선해양의 운명, 정부 결단에 달렸다 STX조선해양이 또 다시 법정관리(기업회생절차) 갈림길에 섰다. 정부와 산업은행이 노사에 넘겼던 ‘공’이 다시 정부와 산업은행으로 돌아왔다. 정부와 산업은행은 STX조선 노사의 잠정 합의안이 실효성 있는 대안인지 여부를 검토한 뒤 조만간 법정관리 결정을 내릴 방침이다. 최종 운명은 조만간 열릴 산업경쟁력강화관계 장관회의(이하 산경장 회의)에서 갈릴 전망이다. STX조선 노사는 10일 무급휴직·임금삭감 등 인건비 절감 방안에 합의한 노사확약서를 산업은행에 제출했다. 산업은행은 이 안을 자체 검토한 후 관계부처 등과 협의해 받아들일지 말지를 결정할 계획이다. 받아들이면 독자회생의 길로, 받아들이지 않으면 법정관리가 불가피하다는 게 산은 측의 설명이다. 산업은행 관계자는 “애초에 STX조선의 회생 방안은 산업경쟁력강화 관계 장관회의를 통해 나온 것인 만큼 최종 결론도 정부에서 내리는 게 맞다”고 말했다. 산경장 회의란 기획재정부·금융위원회·산업통상자원부 등 국내 산업 경쟁력과 구조조정 등을 논의하는 정부 내 협의체다. 최근 발표한 한국해운산업 5개년 계획 및 조선업 발전전략도 산경장 회의에서 확정, 발표했다. STX조선 노사는 최대주주인 산업은행이 요구한 노사확약서 제출 시한인 9일 자정을 넘겨 이날 새벽에야 합의안을 도출했다. 시한을 넘겼지만, 노사가 어렵게 도출한 만큼 법정관리를 피했다는 관측이 컸다. 그러나 산업은행은 같은 날 새벽 1시께 “마감시한인 9일 자정을 넘긴 만큼 원칙대로 회생절차를 진행한다”며 법정관리를 선언했다. 이후 바로 “STX조선의 노사 확약서가 제출되면 상경장 회의에서 검토해 처리 여부가 결정될 것”이라며 독자 회생의 길을 갈 수 있다는 여지를 뒀다. 사측은 ‘인력 구조조정만은 안 된다’는 노조의 요구를 받아들여 노사확약서에 희망퇴직과 아웃소싱(외주·협력업체로 소속을 옮기는 것) 등 인적 구조조정을 제외하는 대신 노조 측이 주장한 무급휴직, 임금 삭감 등을 포함시켰다. 노사는 정부와 채권단이 요구한 생산직 인건비 75% 절감 효과를 내는 방향으로 고정비 절감에 나서기로 합의했다. 하지만 앞서 발표한 삼정KPMG의 컨설팅 보고서에서 대폭 후퇴한 것이어서 이를 받아들일지는 미지수다. 정부와 산은도 원칙대로 처리하겠다는 입장을 고수해왔다. 업계는 STX조선의 현재 청산가치가 계속 기업을 운영했을 때의 가치(계속기업가치)보다 높아 법정관리가 진행되면 사실상 퇴출절차를 밟을 것으로 보고 있다. STX조선 관계자는 “선수금환급보증(RG)만 발급되면 중형 탱커, 소형 액화천연가스(LNG) 운반선 등 고부가가치 가스선 영업에 나설 수 있다”며 “최근 수주가 살아나고 있고, 원가 경쟁력도 있어 올해 수주 목표만 20척이다. 회사도 빠르게 안정화할 수 있을 것”이라고 말했다. ◇한때 수주실적 세계 3위 조선사…왜 9개월만에 또 법정관리 위기 정부와 산은이 법정관리를 실제로 신청하면 STX조선은 법정관리 졸업 9개월여 만에 다시 회생이냐, 청산이냐의 기로에 서게 된다. STX조선은 지난해 7월 법정관리를 졸업했다. 한때 수주실적 기준 세계 3위 조선사였지만 8조원에 달하는 자금 수혈을 받고 기사회생했지만 9개월만에 다시 법정관리행을 걱정하는 얄궂은 운명을 맞은 셈이다. 업계에 따르면 STX조선이 또 다시 구조조정의 파고에 휩쓸리게 된 데는 채권단과 정부의 명확하지 않은 원칙이 원인을 제공했다는 비판이 나온다. 산업은행은 법정관리를 졸업한 STX조선으로부터 “고정비를 30% 안팎 줄이겠다”는 취지의 노사 확약서를 받았지만, 문재인정부가 작년 12월 산경장 회의를 열고 “새로운 구조조정 방안을 마련하겠다”고 밝히면서 이 자구안은 유야무야됐다. 업계 한 관계자는 “이후 STX조선과 성동조선에 대한 외부 회계법인 컨설팅이 시작됐고, 뒤늦은 3월8일 중형조선소 정책에 나온 것”이라고 꼬집었다. 법정관리를 섣부르게 빨리 졸업시킨게 아니냐는 지적도 있다. 법원은 회생가능하다고 판단했지만 실제 실사를 나간 컨설팅업체는 회생가능성이 없다고 판단했기 때문이다. 불과 5~6개월의 간격을 두고 서로 다른 결과나 나온 셈이다. 여기에 대해서는해석상 이견이 있을 수 있다. 법원은 STX조선의 회생가능성을 판단하는 기준을 10년으로 설정했는데 컨설팅에서는 기준을 5년으로 줄였다. 조선업계 관계자는 “법원과 정부의 회생 가능성 여부를 판단하는 기준이 다른 것도 혼란을 부추겼다”며 “다만 지금 업황을 보면 향후 5년을 기준으로 회생여부를 판단하면 위기에 빠진 모든 조선사들이 청산에 무게를 둘 수밖에 없다”고 지적했다."
