source,symbol,link,date,title,content
뉴스1,011810,/news/news_read.nhn?article_id=0003307488&office_id=421&mode=search&query=STX&page=32,2018-04-09 18:54,"STX조선, '노사확약서' 뺀 '자구안' 우선 제출&hellip;노사 협상 계속","자구안에 인력감축안 미포함…""노사 합의하면 추가""자정까지 미제출시 법정관리 유력 경남 창원시 진해구 STX조선해양. 2018.4.9/뉴스1 © News1 여주연 기자 (서울=뉴스1) 이철 기자 = STX조선해양이 '노사 확약서'를 제외한 '자구 계획안'을 채권단에 우선 제출했다. 9일 STX조선에 따르면 회사 측은 정부와 채권단에서 요구한 자구안과 노사확약서 중 일단 자구안을 채권단에 제출했다. STX조선 관계자는 ""원가 절감 방안, 생산성 향상 방안, 비영업자산매각 등의 내용이 담긴 자구안을 우선 채권단에 제출했다""며 ""고정비 40% 감축 계획은 자구안에 아직 포함이 안됐고, 노사 합의가 되면 이후 포함시킬 것""이라고 말했다. 이날까지 채권단이 요구했던 것은 자구안과 함께 고정비 40% 감축에 동의하는 노사확약서다. 이를 인건비로 환산하면 전체 생산직(693명) 중 75%(500여명)를 줄여야 한다. 회사 측은 급한대로 최근 희망퇴직·아웃소싱(협력업체로 자리를 옮김)을 접수한 결과 받아 143명(희망퇴직 103명·아웃소싱 40명)의 신청을 받았다. 하지만 채권단의 목표치에는 미달됐다. STX조선은 최근 수년간 사무기술직(설계, 연구소, 생산관리, 조달, 관리조직)을 중심으로 희망퇴직을 진행해 해당 직군에서는 최소 인력를 유지하고 있다. 이런 이유로 생산직을 줄이고 선박 건조 시 부족한 인력은 협력사에 외주를 주겠다는 계획이다. 하지만 생산직이 대부분인 노조가 채권단 요구에 반발하면서 협상이 길어지고 있다. 이날 자정까지 STX조선 노사가 확약서를 제출하지 않으면 법정관리행이 유력하다. STX조선 관계자는 ""현재 노조를 만나 노사 확약서를 제출하도록 협상을 하고 있다""고 설명했다."
한국경제TV,011810,/news/news_read.nhn?article_id=0000657122&office_id=215&mode=search&query=STX&page=9,2018-07-05 09:07,"STX, 16% 급등... 전일 보다 4,550원 상승한 33,550원","[한국경제TV 라이온봇 기자] [그림 1] 최근 3개월 간 주가 추세 및 기간별 수익률 STX는 7월 5일 9시 6분 전일 대비 약 16% 급등한 33,550원에 거래되고 있다. STX는 코스피 상장 기업으로 유통업 업종에 속해 있다. 시가총액은 4,260억원으로 코스피 상장기업 중 282위에 위치 해 있다. [종목 성향 진단] [그림 2] 종목 성향 진단 STX의 투자 스타일은 모호한 측면이 있으나 성장주라고 볼 수 있다. 주가 고평가 우려가 공존하지만 높은 성장성이 기대되는 기업이다. 주가 모멘텀은 평범한 수준이었다. STX 종목에 대한 투자자의 관심도는 매우 낮은 편이었다. [투자 점수 진단] [그림 3] 투자 점수 진단 STX는 어느 측면에서 투자 매력도가 높은 종목일까? AI 인공지능 종목 분석 시스템을 이용해 성장성, 수익성, 효율성, 안전성, 저평가성, 추세 등 주가 수익률에 영향을 줄 수 있는 6가지 핵심 투자 지표를 점수화하여 종목의 투자 매력도를 계산해보았다. 그 결과 STX는 상대적으로 추세지표 측면에서 두각을 드러내고 있었다. 추세 점수는 주가의 상승 모멘텀이 어느정도 인가를 나타낸다. STX는 특히 단기추세 측면에서 가장 높은 점수는 기록했는데, 전체 시장 내 293위를 기록하며 상위 14.66%에 위치했다. 업종별로는 24위를 기록하며 상위 6.71%에 위치했다. 그러나 재무건전성을 나타내는 기업안정성 측면에서는 아쉬운 점을 나타냈다. (위의 AI인공지능 점수는 재무 데이터를 기반으로 전체 상장 종목과 비교/분석하여 도출한 점수로 높은 점수가 반드시 높은 수익률을 보장하지 않습니다. 위의 자료는 당사의 추천 종목이 아니며, 투자 시 참고용으로 제시해드리는 것입니다. 핵심투자지표를 결합해 종목의 투자매력도를 종합 계산한 ""인공지능 투자점수""는 ""거장들의 투자공식"" 앱에서 확인하실 수 있습니다.) 라이온봇 기자 -한국경제TV※ 본 기사는 한국경제TV와 '거장들의 투자공식이'자체 개발한 '라이온봇 기자'가 실시간으로 작성한 기사입니다. 라이온봇기자 ⓒ 한국경제TV, 무단 전재 및 재배포 금지 한국경제TV 관련뉴스해당 언론사에서 선정하며 언론사 페이지(아웃링크)로 이동해 볼 수 있습니다.[단독] 모바일 간편결제도 뚫렸다…SSG페이 등 6곳 '부정 결제'재빠른 외국인…무역전쟁 터지자 '이 주식' 샀다'기내식 대란' 아시아나…지친 승객에게 '황당' 대처익산 응급실 폭행, 충격 동영상…의사 머리채 잡고 무차별 주먹질'4천억 밥 전쟁'...햇반에 도전장 낸 이마트"
서울경제,011810,/news/news_read.nhn?article_id=0003247407&office_id=011&mode=search&query=STX&page=46,2018-03-19 13:04,"STX중공업, 경영정상화 위해 창원 3공장 등 매각 공고","[서울경제] STX중공업(071970) 이 회생계획에 따른 경영정상화의 일환으로 경남 창원 3공장과 수정만사업장, 기타 비영업용 자산을 공개경쟁 입찰 방식으로 매각하기 위해 다음달 13일까지 인수의향서를 접수한다고 19일 공시했다."
한국경제TV,011810,/news/news_read.nhn?article_id=0000659705&office_id=215&mode=search&query=STX&page=7,2018-07-11 10:08,"STX, 전일 대비 약 -6% 하락한 23,450원","[한국경제TV 라이온봇 기자] [그림 1] 최근 3개월 간 주가 추세 및 기간별 수익률 STX는 7월 11일 10시 7분 전일 대비 약 -6% 하락한 23,450원에 거래되고 있다. STX는 코스피 상장 기업으로 유통업 업종에 속해 있다. 시가총액은 4,447억원으로 코스피 상장기업 중 272위에 위치 해 있다. [종목 성향 진단] [그림 2] 종목 성향 진단 STX의 투자 스타일은 모호한 측면이 있으나 성장주라고 볼 수 있다. 주가 고평가 우려가 공존하지만 높은 성장성이 기대되는 기업이다. 주가 모멘텀은 평범한 수준이었다. 최근 1개월 수익률이 4.4%, 3개월 수익률은 4.4%, 6개월 수익률은 4.4%를 기록했다. STX 종목에 대한 투자자의 관심도는 굉장히 높은 편이다. [투자 점수 진단] [그림 3] 투자 점수 진단 STX는 어느 측면에서 투자 매력도가 높은 종목일까? AI 인공지능 종목 분석 시스템을 이용해 성장성, 수익성, 효율성, 안전성, 저평가성, 추세 등 주가 수익률에 영향을 줄 수 있는 6가지 핵심 투자 지표를 점수화하여 종목의 투자 매력도를 계산해보았다. 그 결과 STX는 상대적으로 추세지표 측면에서 두각을 드러내고 있었다. 추세 점수는 주가의 상승 모멘텀이 어느정도 인가를 나타낸다. STX는 특히 단기추세 측면에서 가장 높은 점수는 기록했는데, 전체 시장 내 181위를 기록하며 상위 9.04%에 위치했다. 업종별로는 10위를 기록하며 상위 2.63%에 위치했다. 그러나 재무건전성을 나타내는 기업안정성 측면에서는 아쉬운 점을 나타냈다. (위의 AI인공지능 점수는 재무 데이터를 기반으로 전체 상장 종목과 비교/분석하여 도출한 점수로 높은 점수가 반드시 높은 수익률을 보장하지 않습니다. 위의 자료는 당사의 추천 종목이 아니며, 투자 시 참고용으로 제시해드리는 것입니다. 핵심투자지표를 결합해 종목의 투자매력도를 종합 계산한 ""인공지능 투자점수""는 ""거장들의 투자공식"" 앱에서 확인하실 수 있습니다.) 라이온봇 기자 -한국경제TV※ 본 기사는 한국경제TV와 '거장들의 투자공식이'자체 개발한 '라이온봇 기자'가 실시간으로 작성한 기사입니다. 라이온봇기자 ⓒ 한국경제TV, 무단 전재 및 재배포 금지 한국경제TV 관련뉴스해당 언론사에서 선정하며 언론사 페이지(아웃링크)로 이동해 볼 수 있습니다.대한항공, 진짜 위기 덮친다...2분기 실적전망 '충격적'90도 숙인 이재용...文 대통령의 한마디 ""한국에도...""최지우 남편, 베일 벗었다…'훈남에 생활앱 대표'장하준 교수 ""韓 주식시장은 자동인출기""…해법 있다1만 원에 놀란 가슴…영세 자영업자 '절규'"
경향신문,011810,/news/news_read.nhn?article_id=0002862850&office_id=032&mode=search&query=STX&page=32,2018-04-09 18:40,STX조선해양 법정관리 놓고 막판 진통,"STX조선해양이 정부와 채권단이 요구한 자구계획안 제출 마감일인 9일까지 협상에 진통을 겪었다. 정부와 산업은행은 ‘원칙 처리’를 여러차례 밝힌 바 있어 STX조선 노사가 합의하지 못하면 STX조선은 9개월만에 다시 법정관리로 넘어갈 가능성이 크다. STX조선해양은 9일 오후까지 희망퇴직과 아웃소싱(협력업체로 이동) 신청자가 총 144명에 불과하다고 밝혔다. 희망퇴직·아웃소싱에 응하지 않은 노조원들은 지난달 26일부터 전면파업을 계속 중이다. 사측은 이날 새로운 조건을 담은 인력 감축안을 제시했으며 이를 놓고 노사가 다시 협상을 진행했지만 결론을 내리지 못했다. 노조는 이날 오전 배상대책위원회 회의를 열고 인력 구조조정은 받아들일 수 없다는 입장을 유지했다. 앞서 정부와 산업은행은 지난달 8일 STX조선을 일단 살린다는 방침을 밝히면서 생산직 인건비 75% 감축과 노조 확약서를 요구했다. 생산직 695명 가운데 500여명을 줄이는 방안으로 확약서 제출 마감 시간이 바로 9일이었다. 정부와 산은은 “9일까지 합의안을 도출하지 못하면 원칙대로 법정관리를 신청하겠다”는 방침이 확고하다. 다만 산은은 이날 협상 마감 시한을 이날 자정까지 최대한 기다려보겠다는 입장을 밝히면서 노조 측에 숨통을 틔워주기도 했다. 산은 관계자는 이날 오후 “긍정적인 희망의 끈을 놓고 있지 않다”며 “막판 타협 가능성도 배제할 수 없다”고 말하기도 했다. STX조선은 노사가 끝까지 합의하지 못하면 법정관리행이 불가피하다. 지난해 7월 법정관리에서 졸업했지만 이번에 또다시 법정관리로 갈 위기를 맞은 셈이다. 한편 문성현 노사정위원장은 이날 오후 4시 20분쯤 STX조선을 방문, 노조 측과 면담한 것으로 전해졌다."
파이낸셜뉴스,011810,/news/news_read.nhn?article_id=0003984897&office_id=014&mode=search&query=STX&page=46,2018-03-19 13:42,"[공시]STX중공업, 창원 3공장 등 매각","STX중공업은 회생계획에 따른 경영정상화의 일환으로 경남 창원 3공장과 수정만사업장, 기타 비영업용 자산을 공개경쟁 입찰 방식으로 매각하기 위해 다음달 13일까지 인수의향서를 접수한다고 19일 공시했다."
연합뉴스,011810,/news/news_read.nhn?article_id=0010016231&office_id=001&mode=search&query=STX&page=22,2018-04-10 19:20,한산한 STX조선 야드,(창원=연합뉴스) 김동민 기자 = STX조선해양 노사가 산업은행이 요구한 노사확약서를 극적으로 제출한 10일 오후 창원시 진해구 STX조선해양 야드가 한산하다. 2018.4.10
이데일리,011810,/news/news_read.nhn?article_id=0004075428&office_id=018&mode=search&query=STX&page=32,2018-04-09 18:33,"STX조선 노조, 산은과 막판 협상 불발된 듯","확약서 제출 못하면 법정관리 유력대대적 정리해고에도 청산 가능성↑ 지난달 20일 경남 창원시 진해구 STX조선해양 야드 전경(사진=연합뉴스). [이데일리 김미경 기자] STX조선해양 노조와 산업은행의 마지막 협상이 불발 된 것으로 보인다. 9일 STX조선해양 고위 관계자는 “이날 오후께 예고됐던 노조와 산은과의 만남은 불발 된 것으로 안다”며 “때문에 일단 ‘노조 확약서’ 없이 ‘자구계획안’을 채권단인 산은 측에 먼저 제출했다”고 밝혔다. 노조는 당초 이날 오전 8시부터 9시까지 비상대책위 회의를 연 뒤 바로 조합원 간담회에서 오후에 채권단 대표이자 최대주주인 KDB산업은행과의 면담을 예고했었다. 하지만 노조 측은 “아직 만나지 못했다. 산은과의 협상은 아직 미정”이라는 말만 되풀했다. 이에 사측은 정부와 채권단에서 요구한 고강도 인력감축 자구안과 이에 동의하는 노사확약서 제출 시한을 코앞에 두고 자구안을 이날 오후 5시 채권단에 제출했다. 사측에 따르면 사전 검증용이라는 설명이다. STX조선 관계자는 “재료비 및 경비 절감, 생산성 향상 방안, 수주 확대 방안, 원가절감, 비영업자산매각 등의 내용이 담긴 자구안이 KDB산업은행으로 넘어가서 검증작업을 계속 진행 중”이라며 “산은 측이 제출 시한을 자정까지 늘린 만큼 노조를 만나 노사확약서를 제출하도록 협상을 계속하고 있다”고 말했다. 제출한 자구안에는 인건비 절감 방안을 제외한 회사를 살리기 위한 고강도 구조조정을 담고 있다. ‘고정비 40% 삭감’(생산직 인건비 75% 감축) 등이 포함됐다. 생산직 근로자 695명 가운데 500여명을 줄이는 내용이다. 다만 희망퇴직을 위한 인력감축보다는 ‘고용이 유지되는 외주화’(아웃소싱)를 통해 조선소 내 일자리는 보장하겠다고 약속했다. 외주로 소속을 옮기는 인력에 대해서는 3년 간 통상임금의 80% 시급을 적용하고, 상여금 300%(매월 25% 지급), 설과 추석 등 귀향비 및 사내협력사 처우 기준에 따르기로 했다. 채권단은 자구안 제출 마감 시한인 이날 자정까지 노사 확약서 제출을 기다린 뒤 법정관리 여부를 결정한다는 방침이다. 하지만 이날 자정까지 노조확약서를 제출하지 않으면 법정관리행이 유력하다. 노사 확약서가 없으면 실행을 담보할 수 없어서다. 노조는 여전히 “인력감축을 막기 위해선 법정관리도 불사하겠다”는 입장을 고수 중이다. 물론 막판 합의 가능성도 배제할 수는 없다. 재차 법정관리로 갈 경우 회생 여부를 장담할 수 없다는 점은 노조에는 부담이다. 사측도 협상 테이블을 열어 놓고 있다는 뜻을 밝혔다. 정부는 STX조선해양 처리와 관련해 “노사 합의가 불발되면 법정관리가 불가피하다”는 입장이다. 김동연 부총리 겸 기획재정부 장관은 이날 낮 서울 영등포구 중소기업중앙회를 방문한 자리에서 “(정부는) 한국GM과 관련해 원칙을 냈고 금호타이어에 이 원칙을 적용했다”며 “(STX조선에 대해서도) 원칙대로 처리하겠다”고 강조했다. 기획재정부, 산업통상자원부, 금융위원회 등 정부 부처 수장들도 한목소리로 ‘원칙론’을 강조하면서 압박의 수위를 높이고 있다. 앞서 해외매각을 완강하게 반대하던 금호타이어 노조도 “더 이상 시간은 줄 수 없고 시한이 오면 청와대도 청산을 못 막는다”는 이동걸 산은 회장의 최후통첩과 “정치적 논리로 해결하지 않는다”는 청와대의 공식 입장에 백기를 들었다. 만일 이날 자정을 넘겨 노사합의가 무산될 경우 산은의 선수금환급보증(RG) 발급이 중단되고 법정관리에 들어간다. 사측은 곧바로 정리해고 절차에 들어가는 한편 법정관리 신청 준비를 할 것으로 전해졌다. 당장 회사가 회생이냐 청산이냐의 갈림길에 놓이기 때문이다. 회사 측은 지난 8일 추가 인력 구조조정 결과 당초 목표치에 크게 미달하자 공식입장 자료를 내고 “생산성 향상을 위한 생산직 조직, 인력 조정을 통한 체질 개선만이 회사가 생존할 수 있는 기반이 될 것으로 판단하고 이를 반드시 이행하도록 하겠다“고 밝혔다. 사실상 정리해고 수순을 밝힌 셈이다. STX조선은 경영난으로 채권단 관리를 받다가 2016년 법정관리를 신청했다. 지난해 7월 법정관리에서 조기졸업했지만 이후에도 경영 위기는 계속됐다. 지난해 매출은 전년보다 63% 감소한 3958억원에 그쳤고, 영업이익은 1172억원으로 3년 연속 적자다."
아시아경제,011810,/news/news_read.nhn?article_id=0004199709&office_id=277&mode=search&query=STX&page=46,2018-03-19 13:44,"STX중공업, 창원 3공장 등 자산 매각&hellip;내달 13일까지 인수의향서 접수","[아시아경제 임철영 기자] STX중공업이 19일 회생계획에 따른 경영정상화를 목적으로 경남 창원 3공장과 수정만사업장, 기타 비영업용 자산을 공개경쟁 입찰 방식으로 매각하기 위해 내달 13일까지 인수의향서를 접수한다고 공시했다."
파이낸셜뉴스,011810,/news/news_read.nhn?article_id=0004008641&office_id=014&mode=search&query=STX&page=14,2018-04-24 17:17,"STX, 600억 유증으로 자본확충","中 사모펀드 AFC코리아, 유증위해 투자자 모집"
파이낸셜뉴스,011810,/news/news_read.nhn?article_id=0003984907&office_id=014&mode=search&query=STX&page=46,2018-03-19 13:49,"[fn마켓워치] STX중공업, 창원 3공장 등 자산 매각 '본격화'","창원공장·수정만사업장·리조트 회원권 비영업 자산 매물로…분리 매각 가능  최근 파인트리파트너스와 글로벌세아를 새 주인으로 맞이한 STX중공업이 보유중인 공장 부지 등 자산매각에 돌입했다. 이번 비영업자산 매각은 경영정상화 일환으로 추진되는 것이다. 19일 투자은행(IB)업계에 따르면, 매각 주간사인 삼정KPMG는 이날 매각 공고를 내고 경상남도 창원시에 위치한 STX중공업 3공장과 수정만사업장, STX중공업 소유의 문경 리조트 회원권 등 기타비영업자산에 대한 인수의향서(LOI) 접수를 내달 13일까지 모집한다. 이번 자산매각은 STX중공업의 스토킹 호스 방식 계약에 따른 인수대상에 포함되지 않는 주요 비영업용자산에 대한 매각으로 진행되는 건이다. 또한 매각대상 자산 일체에 대한 일괄매각방식이 아닌 분리 매각이 가능하다. 즉 투자자는 인수를 희망하는 비영업용자산(공장,부지)에 한해 인수의향서 제출 및 본입찰에 참여할 수 있다. 경상남도 창원시 신촌동에 위치한 STX 제3공장은 토지 및 건물과 크레인 등으로 구성되어 있다. 창원국가산업단지에 위치하고 있어 제조 사업을 영위하기에 적합한 입지라는 것이 업계의 평이다. STX중공업 수정만 사업장은 경상남도 창원시 합보구에 위치해 있다. 수정만 사업장은 매립을 통해 조성된 면정 21만44㎡에 달하는 일반 공업용지다. 이 밖에 매물로 같이 나온 STX중공업 문경리조트 회원권은 경남 문경시 농암면에 위치해 있다. 문경리조트는 2008년 12월 오픈한 지상 10층의 리조트로 디럭스룸 108실, 스위트룸 89실, 로열스위트룸 2실로 총 199실의 객실을 보유하고 있다."
YTN,011810,/news/news_read.nhn?article_id=0001133521&office_id=052&mode=search&query=STX&page=32,2018-04-09 18:22,STX조선 &quot;자구안&middot;노조확약서 자정까지 제출&quot;,정부와 채권단이 STX조선해양을 상대로 요구한 생산직 인건비 75% 감축 등 자구계획안과 이에 대한 노동조합의 확약서 제출 시한이 오늘 자정까지로 연장됐습니다. 애초 정부와 채권단이 제시한 마감 시한은 오늘 오후 5시까지였습니다. STX조선은 오늘 오후 5시가 아니라 자정까지 자구계획안과 구조조정에 동의하는 노사 확약서를 제출하기로 했다며 인건비 절감방안을 제외한 나머지 자료는 산업은행으로 넘어가 검증 작업을 진행하는 것으로 안다고 밝혔습니다. 사측은 자정까지 노조와 만나 확약서 제출에 필요한 협상을 계속할 방침이라고 전했습니다. 희망퇴직이나 하청업체 이직 등 아웃소싱에 응하지 않은 노조원들은 인적 구조조정에 반대하며 지난달 26일부터 전면 파업을 계속하고 있습니다.
이데일리,011810,/news/news_read.nhn?article_id=0004149243&office_id=018&mode=search&query=STX&page=7,2018-07-13 17:13,"STX중공업, 플랜트사업부 매각 위한 변경 회생계획안 제출","[이데일리 이재운 기자] STX중공업(071970)은 플랜트사업부 매각을 위한 변경 회생계획안을 서울회생법원에 제출했다고 13일 공시했다. 플랜트사업부 및 일부 비영업용 자산을 물적분할해 신설회사로 설립 후 플랜트 인수자(글로벌세아 주식회사)에게 매각할 계획이다. 글로벌세아는 물적분할 신설회사의 발행주식 중 50%에 대해서는 주식의 인도일로부터 1년간 양도, 증여, 담보제공, 매각, 기타 어떠한 형태로든 이를 처분할 수 없도록 한 내용을 담고 있다."
연합뉴스,011810,/news/news_read.nhn?article_id=0010016230&office_id=001&mode=search&query=STX&page=22,2018-04-10 19:20,멈춘 STX조선 야드,(창원=연합뉴스) 김동민 기자 = STX조선해양 노사가 산업은행이 요구한 노사확약서를 극적으로 제출한 10일 오후 창원시 진해구 STX조선해양 야드가 한산하다. 2018.4.10
YTN,011810,/news/news_read.nhn?article_id=0001133540&office_id=052&mode=search&query=STX&page=32,2018-04-09 18:22,STX조선 &quot;자구안&middot;노조확약서 자정까지 제출&quot;,정부와 채권단이 STX조선해양을 상대로 요구한 생산직 인건비 75% 감축 등 자구계획안과 이에 대한 노동조합의 확약서 제출 시한이 오늘 자정까지로 연장됐습니다. 애초 정부와 채권단이 제시한 마감 시한은 오늘 오후 5시까지였습니다. STX조선은 오늘 오후 5시가 아니라 자정까지 자구계획안과 구조조정에 동의하는 노사 확약서를 제출하기로 했다며 인건비 절감방안을 제외한 나머지 자료는 산업은행으로 넘어가 검증 작업을 진행하는 것으로 안다고 밝혔습니다. 사측은 자정까지 노조와 만나 확약서 제출에 필요한 협상을 계속할 방침이라고 전했습니다. 희망퇴직이나 하청업체 이직 등 아웃소싱에 응하지 않은 노조원들은 인적 구조조정에 반대하며 지난달 26일부터 전면 파업을 계속하고 있습니다.
데일리안,011810,/news/news_read.nhn?article_id=0002279175&office_id=119&mode=search&query=STX&page=1,2018-08-31 09:36,"[특징주]STX, 100억원 규모 유상증자 소식에 하락세",STX가 100억원 규모 유상증자를 실시한다는 소식에 하락세를 기록 중이다. 31일 오전 9시34분 현재 유가증권시장에서 STX의 주가는 전 거래일 대비 500원(2.65%) 떨어진 1만8350원에 거래되고 있다. STX는 지난 30일 제3자배정으로 100억3200억원 규모 유상증자 납입이 이뤄졌다고 공시했다. 대상은 유안타증권으로 발행가액은 1만6850원이다.
매일경제,011810,/news/news_read.nhn?article_id=0004130496&office_id=009&mode=search&query=STX&page=32,2018-04-09 18:18,STX조선 &quot;자구안&middot;노조확약서 자정까지 제출&quot;,"정부와 채권단이 STX조선해양을 상대로 요구한 생산직 인건비 75% 감축을 골자로 한 자구계획안과 이에 동의하는 노동조합의 확약서 제출 시한이 9일 자정까지로 연장됐다. 당초 정부와 채권단이 제시한 마감시한은 이날 오후 5시까지였다. STX조선은 ""금일 오후 5시가 아니라 자정까지 자구계획안과 구조조정에 동의하는 노사 확약서를 제출하기로 했다""며 ""인건비 절감방안을 제외한 나머지 자료는 산업은행으로 넘어가 검증작업을 진행하는 것으로 안다""고 말했다. 사측은 이날 자정까지 노조를 만나 확약서 제출에 필요한 협상을 계속할 방침이라고 강조했다. 사측은 인건비 절감을 제외한 재료비 절감, 생산성 향상방안, 수주확대 방안 등을 담은 자구계획안은 산업은행에 이미 제출을 한 상태라고 설명했다. 정부와 채권단은 지난달 8일 법정관리에서 벗어난 STX조선을 일단 살린다는 방침을 밝히면서 한달 간 시간을 주며 생산직 인건비 75% 축소, 연간 고정비 150억원 추가 감축 요구와 함께 인적 구조조정에 동의하는 노조 확약서 제출을 요구했다. 방침이 나온 후 사측은 생산직 직원들을 상대로 두 차례 희망퇴직·아웃소싱(협력업체로 자리를 옮김) 신청을 받았고 144명(희망퇴직 104명·아웃소싱 40명)이 회사를 떠났다. 희망퇴직·아웃소싱에 응하지 않은 노조원들은 인적 구조조정에 반대하며 지난달 26일부터 전면파업을 계속하고 있다. [디지털뉴스국] r_start // r_end //"
