source,symbol,link,date,title,content
한국경제TV,015860,/news/news_read.nhn?article_id=0000601514&office_id=215&mode=search&query=일진홀딩스&page=1,2018-02-09 13:13,"일진홀딩스, 전일 대비 약 -4% 하락한 5,800원","[한국경제TV 라이온봇 기자] 일진홀딩스는 2월 9일 13시 12분 전일 대비 약 -4% 하락한 5,800원에 거래되고 있다. 일진홀딩스는 코스피 상장 기업으로 금융업 업종에 속해 있다. 시가총액은 2,980억원으로 코스피 상장기업 중 361위에 위치 해 있다. [종목 성향 진단] [그림 1] 종목 성향 진단 일진홀딩스의 투자 스타일은 모호한 측면이 있으나 성장주라고 볼 수 있다. 주가 고평가 우려가 공존하지만 높은 성장성이 기대되는 기업이다. 주가 모멘텀은 평범한 수준이었다. 최근 1개월 수익률이 2.9%, 3개월 수익률은 2.9%, 6개월 수익률은 16.83%를 기록했다. 일진홀딩스 종목에 대한 투자자의 관심도는 평범한 수준이었다. [투자 점수 진단] [그림 2] 투자 점수 진단 일진홀딩스는 저평가성2(PBR) 측면에서 두각을 나타내고 있다. 최근 PBR은 81점으로 6개의 핵심 팩터 중 가장 높은 점수를 기록했다. PBR은  전체 시장 내 361위를 기록하며 상위 19.32%에 위치했다. 업종별로는 80위를 기록하며 상위 23.94%에 위치했다. 그리고 성장성(매출증가율(YoY)) 역시 도드라지는 편이다. 성장성 점수는 72점으로 두번째로 높은 점수를 기록했다. 매출증가율(YoY)은 전체 시장 내 505위를 기록하며 상위 28.02%에 위치했다. 업종별로는 90위를 기록하며 상위 28.34%에 위치했다. 그러나 PER과 ROA는  아쉬움을 나타냈다. [종합 투자점수] [그림 3] 종합 투자점수 AI 인공지능 분석을 통한 일진홀딩스의 종목 종합 스코어는 46점을 기록했다. 이는 동일 업종 평균점수인 58점과 시장 평균점수인 57점를 하회하는 수치였다. (위의 AI인공지능 점수는 재무 데이터를 기반으로 전체 상장 종목과 비교/분석하여 도출한 점수로 높은 점수가 반드시 높은 수익률을 보장하지 않습니다. 위의 자료는 당사의 추천 종목이 아니며, 투자 시 참고용으로 제시해드리는 것입니다.) 라이온봇 기자 -한국경제TV※ 본 기사는 한국경제TV와 '거장들의 투자공식이'자체 개발한 '라이온봇 기자'가 실시간으로 작성한 기사입니다. 라이온봇기자 ⓒ 한국경제TV, 무단 전재 및 재배포 금지 한국경제TV 관련뉴스해당 언론사에서 선정하며 언론사 페이지(아웃링크)로 이동해 볼 수 있습니다.김신영 다이어트 전후 사진 어떻길래? '깜짝'홍진영 근황, 물오른 미모…""30대 몸매 비결은""박지헌만의 성교육 ""야동 보는 게 나쁜 거 아냐""서정희 ""서세원과 이혼 후 트라우마, 결국...""윤정수 다이어트, '홀쭉해진' 비결은?"
서울경제,015860,/news/news_read.nhn?article_id=0002786437&office_id=011&mode=search&query=일진홀딩스&page=1,2016-01-11 14:16,"일진홀딩스, 주력 자회사 성장성 부각될 전망","하이투자증권 이상헌 연구원은 일진홀딩스(015860)에 대해 ""동사의 주력 자회사인 알피니언메디칼시스템의 올해 실적은 매출액 950억원(YoY+35.7%), 영업이익 125억원(YoY+78.6%)으로 추정되면서 성장세를 이어갈 것으로 전망된다. 이는 초음파 진단기의 신제품효과 등과 더불어 주력 수출지역인 중국, 독일 등에서의 매출성장에서 비롯될 것이며, 이와 같이 매출이 증가하면서 수익성 개선이 빠르게 이루어질 것""이라고 분석했다. 또한 하이투자증권은 ""동사의 주력 자회사인 일진전기의 실적 턴어라운드를 비롯하여 알피니언메디칼시스템 및 일진다이아몬드의 실적 호전 지속 등으로 인하여 올해 동사 수익성 개선이 클 것으로 기대된다""라고 밝혔다. 한편 ""동사의 히든 밸류 역할을 하고 있는 초음파 의료기기 업체인 알피니언메디칼시스템은 해를 거듭할수록 신제품 및 밸류체인 확대효과와 더불어 수출증가 등으로 매출이 성장하고 있을 뿐만 아니라 매출 증가에 의한 수익성 개선되고 있어서 성장성이 부각될 수 있을 것""이라고 전망했다. 이 연구원은 11일 일진홀딩스(015860)에 대해 ""기존 자회사는 실적 개선, 알피니언메디칼시스템은 성장성 부각될 전망""이라며 투자의견을 '매수(유지)'로 제시하였다. 아울러 6개월 목표주가를 16,500원으로 내놓았다. ▷ 지주사 섹터"
전자신문,015860,/news/news_read.nhn?article_id=0002493178&office_id=030&mode=search&query=일진홀딩스&page=1,2016-06-21 10:18,"[@기업분석리포트]일진홀딩스, &quot;1Q 부진 딛고 2&hellip;&quot; 매수(유지)-IBK투자증권","IBK투자증권에서 21일 일진홀딩스(015860)에 대해 ""1Q 부진 딛고 2Q 개선""라며 투자의견을 '매수(유지)'로 제시하였고, 아울러 목표주가로는 14,000원을 내놓았다. IBK투자증권 김장원 애널리스트가 동종목에 대하여 이번에 제시한 '매수(유지)'의견은 IBK투자증권의 직전 매매의견과 동일한 것이고 올해 초반의 매매의견을 기준으로  볼때도 역시 '매수'의견이 계속 유지되고 있는 상태이다. 그리고 최근 분기내 발표된 전체 증권사 리포트의 컨센서스와 비교를 해볼 경우에 오늘 발표된 투자의견은 대체적으로 평균치에 해당하는 수준으로, 이번 의견은 동종목에 대한 전체적인 흐름에서 크게 벗어나지 않은 것으로 분석되고 있다. 목표주가의 추이를 살펴보면 이번에 다시 목표가가 같은 수준을 유지하면서 최근 흐름은 목표가의 계단식 하향조정이 진행되는 모습이다. 또한 전일 종가 기준으로 볼때 동종목의 현주가는 이번에 제시된 목표가 대비 78.6%의 추가상승여력이 있다는 해석이 제시되고 있다."
이데일리,015860,/news/news_read.nhn?article_id=0003494887&office_id=018&mode=search&query=일진홀딩스&page=1,2016-03-08 17:43,"일진홀딩스, 25일 주총.. 허진규 회장&middot;허정석 사장 등기이사 재선임","[이데일리 이진철 기자] 일진홀딩스(015860)는 오는 25일 열리는 정기주총에서 허진규 회장과 허정석 사장을 1년 임기의 사내이사로 재선임하는 안건을 처리할 예정이라고 8일 밝혔다. 또 홍상범 프루트나인 대표파트너도 1년 임기의 사내이사로 신규 선임하는 안건을 상정한다. 일진홀딩스는 1년 임기의 사외이사로는 정태호 전 한국동서발전 사장, 3년 임기의 감사로는 신동혁 전 산업은행 부행장을 신규 선임할 예정이다."
머니투데이,015860,/news/news_read.nhn?article_id=0003681125&office_id=008&mode=search&query=일진홀딩스&page=1,2016-05-18 07:51,"일진홀딩스, 1Q 실적 미흡.. 목표가 하향-IBK","[머니투데이 안재용 기자] IBK투자증권은 18일 일진홀딩스에 대해 ""일진전기 수주 규모가 회복되고 지난해 호실적을 기록했던 일진다이아몬드 실적이 유지될 것으로 예상했으나 구리가격 하락에 따른 판매가 하락으로 1분기 실적이 기대에 미치지 못했다""며 투자의견 '매수'를 유지하고 목표주가를 1만4000원으로 하향했다. 김장원 IBK투자증권 연구원은 ""분기별 실적추이를 보면 1분기는 항상 부진했다""며 ""전선과 전력장비, 공구용 다이아몬드 뿐 아니라 의료장비까지 상반기보다 하반기 특히 예산집행이 많은 4분기에 몰리는 수요를 갖고 있다""고 설명했다. 김 연구원은 ""2분기 실적은 전선 수주잔고와 제품 라인업 확대로 실적이 개선될 것으로 예상한다""며 ""다만 1분기 실적이 기대에 못 미친만큼 영업익을 기존 예상보다 10.9% 하향조정했다""고 밝혔다. textlinktopstart textlinktopend textlinkstart"
머니투데이,015860,/news/news_read.nhn?article_id=0003538575&office_id=008&mode=search&query=일진홀딩스&page=1,2015-09-07 17:50,"소외주 일진홀딩스, 8년만에 급등했는데...","[머니투데이 김도윤 기자] [의료기기 자회사 알피니언, 초음파 치료기기 판매 시작…지분가치 재평가 '주목'] 시장에서 소외됐던 일진홀딩스가 새삼 주목받고 있다. 주가가 지난 7월부터 갑자기 폭등하더니 8년만에 1만원대 고지를 탈환했다. 의료기기 자회사 알피니언 메디칼 시스템(이하 알피니언)이 두드러진 성장세를 보이고 있는 가운데 일진홀딩스의 지분가치가 재평가받고 있기 때문으로 풀이된다. 일진그룹이 알피니언의 상장을 검토하고 있다는 점도 눈겨여볼 만한 대목이다. 일진홀딩스는 7일 종가 1만1950원을 기준으로 올해 주가 상승률이 76.7%에 달한다. 최근 국내 증시의 전반적인 조정 영향으로 주가 상승세가 꺾이긴 했지만 올들어 주가 추이는 눈길을 끌기에 충분하다. 일진홀딩스 주가는 2007년 11월8일 1만300원 이후 한 번도 종가 기준으로 1만원을 넘어선 적이 없다. 지난해까지 최근 5년간 주가는 1000~7000원대에서 움직였다. 그룹 내 주력회사인 일진전기 등 계열사의 실적이 주춤하면서 지주사인 일진홀딩스는 오랫동안 주식시장의 중심에서 밀려나 있었다. 그러다 지난 7월부터 변하기 시작했다. 지난 6월30일에 6780원이던 주가는 연이어 상승하며 8월17일 1만7200원까지 치솟았다. 약 한 달 반 만에 153% 상승했다. 일진홀딩스의 갑작스런 주가 급등은 자회사인 알피니언 영향이라는 분석이 지배적이다. 알피니언은 일진홀딩스가 지분 97.6%를 보유한 초음파 영상 의료기기 제조회사다. 코스닥시장이 호황을 누리던 지난 7월에 알피니언은 바이오주로 시장의 주목을 받으며 일진홀딩스의 주가 상승에 촉매제가 됐다. 알피니언은 올해 실적 개선에 성공하며 성장에 목마르던 일진그룹에 단비 역할을 톡톡히 했다. 알피니언은 지난해 매출액이 527억원, 영업이익이 40억원으로 전년대비 각각 24%, 343% 증가했다. 더구나 지난해 독자 기술로 개발한 초음파 치료기기가 올해부터 판매를 시작하며 새로운 성장동력으로 자리매김했다. 초음파 치료기는 자궁근종 등 성인병을 배를 찢지 않고 환부를 태우는 방식으로 치료할 수 있는 의료기기로, 상처를 남기지 않을 뿐더러 수술 뒤 회복 속도가 빠르다는 장점이 있다. 현대증권은 알피니언이 올해 기존제품인 초음파 진단기에 신규제품인 초음파 치료기 사업이 더해지며 매출액 758억원, 영업이익 87억원을 기록할 것으로 내다봤다. 일진홀딩스의 알피니언의 지분가치도 주목받고 있다. 올해 상반기 기준으로 일진홀딩스의 알피니언 지분 장부가액은 469억원 수준이지만, 시장에선 올해 하반기부터 본격적으로 성장 궤도에 진입할 알피니언에 대해 이보다 훨씬 큰 가치를 부여하는 모습이다. 하나대투증권은 알피니언의 상장 추진 가능성, 초음파 치료기 사업 경쟁력, 실적 개선 추세 등을 고려할 경우 기업 가치를 7000억원대까지 평가할 수 있다고 분석했다. 이는 이날 종가 기준 일진홀딩스 시가총액 5872을 넘어서는 수준이다. 증권가에서도 일진홀딩스에 대한 눈높이를 높이고 있다. 지난 8월에만 하나대투증권과 현대증권이 일진홀딩스 목표주가를 각각 2만2000원, 2만3000원으로 상향조정했고, 이달 3일 신영증권도 일진홀딩스 목표주가를 1만8000원으로 높였다. 알피니언뿐 아니라 일진전기 등의 실적 턴어라운드에 대해서도 좋은 점수를 줬다. 곽찬 신영증권 연구원은 ""핵심 의료기기 자회사인 알피니언의 성장성 본격화를 반영해 예상 EPS(주당순이익) 대비 목표주가를 기존 11.5배에서 19배로 상향조정한다""며 ""알피니언이 주력하고 있는 초음파 의료기기 시장의 성장성은 매우 크다고 판단한다""고 분석했다. 일진그룹 관계자는 ""알피니언이 올해부터 초음파 치료기 판매를 시작하면서 앞으로 성장세가 더해질 것으로 기대된다""며 ""그룹 차원에서 알피니언의 상장 계획도 검토하고 있지만 구체적인 일정에 대해선 아직 확정하지 못했다""고 말했다. textlinktopstart textlinktopend textlinkstart"
뉴시스,015860,/news/news_read.nhn?article_id=0008368435&office_id=003&mode=search&query=일진홀딩스&page=1,2017-12-29 18:11,"거래소, 일진홀딩스 불성실공시법인 지정",【서울=뉴시스】김지은 기자 = 한국거래소 유가증권시장본부는 오는 내년 1월2일 일진홀딩스(015860)를 불성실공시법인으로 지정한다고 29일 공시했다. 이 회사는 유상증자 사실을 지연 공시해 불성실공시법인 지정이 예고됐다.
서울경제,015860,/news/news_read.nhn?article_id=0002792317&office_id=011&mode=search&query=일진홀딩스&page=1,2016-01-25 11:36,"일진홀딩스, 신성장동력 모멘텀 강화로 성장성 부각 &lsquo;매수&rsquo;! 업계 최저 금리 2....","IBK투자증권은 22일 일진홀딩스에 대해 주력사업의 실적 개선과 신성장동력의 성장 모멘텀 강화로 성장성이 부각될 것으로 전망했다. 투자의견 ‘매수’와 목표주가 1만8000원을 제시했다. 김장원 연구원은 “주력제품의 전방산업 수요 특성상 4분기에 수요가 집중돼 4분기 실적이 개선되는 특징을 갖고 있다”면서 “지난해에는 시작이 부진을 예고했다면, 올해는 수주잔고가 평균수준을 회복함에 따라 양상이 다를 것”이라고 내다봤다. 이어 “지난해 높은 실적 개선을 기록했던 일진다이아몬드는 부가가치 높은 제품의 매출 비중이 지난해 수준 이상을 기록할 것”이라며 “실적 호조가 지속될 것”으로 분석했다. 의료장비와 복합소재도 부각될 것이란 분석이다. 김 연구원은 “초음파진단기는 제품라인업이 6개에서 8개로 증가한다”며 “유럽 제품인증으로 수출 여건을 마련해 성장세가 지속될 것”으로 전망했다. 여기에 일진다이아몬드가 지분을 100% 가진 환경관련제품을 생산하는 업체로 환경을 개선하기 위한 정부 정책과 전방사업자의 신모델로 제품 수요가 많아질 것으로 추정된다. 한편, 일진홀딩스의 주가는 급상승 이후 기간 조정을 충분히 받았으며 분기별 실적 편차가 큰 점을 감안해 실적과 주가가 가장 저점을 기록할 것으로 예상하는 1분기에 비중 확대를 제시한다는 조언이다. [No.1 증권포털 팍스넷] 1월 25일 종목검색 랭킹 20"
한국경제,015860,/news/news_read.nhn?article_id=0003520209&office_id=015&mode=search&query=일진홀딩스&page=1,2016-01-11 07:58,"일진홀딩스, 알피니언메디칼 성장성 부각&hellip;목표가&uarr;-하이","[ 한민수 기자  ] 하이투자증권은 11일 일진홀딩스에 대해 자회사 알피니언메디칼시스템의 성장성이 부각될 것이라며 목표주가를 1만6500원으로 높였다. 투자의견은 '매수'를 유지했다. 이상헌 연구원은 ""일진홀딩스의 주력 자회사인 알피니언메디칼시스템의 올해 매출과 영업이익은 각각 전년 대비 35.7%와 78.6% 증가한 950억원과 125억원으로 성장세를 이어갈 것""이라며 ""이는 초음파 진단기의 신제품 효과 등과 더불어 주력 수출지역인 중국과 독일 등에서의 매출 성장에서 비롯될 것""이라고 전망했다. 일진전기의 실적 회복을 비롯해 알피니언메디칼시스템 및 일진다이아몬드의 실적 호전 지속 등으로 2016년 일진홀딩스의 수익성이 크게 개선될 것이란 판단이다. 올해 일진홀딩스의 연결기준 매출은 전년 대비 6.9% 늘어난 9598억원, 영업이익은 85.9% 증가한 712억원이 될 것으로 봤다. 한민수 한경닷컴 기자"
머니투데이,015860,/news/news_read.nhn?article_id=0003986199&office_id=008&mode=search&query=일진홀딩스&page=1,2017-12-29 18:04,"일진홀딩스, 불성실공시법인 지정",[머니투데이 김도윤 기자] 한국거래소는 일진홀딩스 에 대해 유상증자 사실의 지연공시를 사유로 불성실공시법인으로 지정한다고 29일 공시했다. 지정일은 2018년 1월 2일이다.
머니투데이,015860,/news/news_read.nhn?article_id=0003638174&office_id=008&mode=search&query=일진홀딩스&page=1,2016-02-26 18:14,"일진홀딩스, 영업이익 310억원&hellip;전년比 25.4%&darr;","[머니투데이 박계현 기자] 일진홀딩스가 지난해 연결 기준 영업이익이 310억원으로 전년 대비 25.4% 감소했다고 26일 공시했다. 같은 기간 매출은 8921억원으로 4.2% 감소했으며 당기순이익은 17.8% 증가한 242억원으로 집계됐다. 회사 측은 ""매출감소로 매출원가가 상승했으며 인력확충으로 인건비가 늘면서 영업이익이 감소했다""고 설명했다. textlinktopstart textlinktopend textlinkstart"
한국경제TV,015860,/news/news_read.nhn?article_id=0000605329&office_id=215&mode=search&query=일진홀딩스&page=1,2018-02-23 12:16,"일진홀딩스, 전일 대비 약 -3% 하락한 5,500원","[한국경제TV 라이온봇 기자] 일진홀딩스는 2월 23일 12시 15분 전일 대비 약 -3% 하락한 5,500원에 거래되고 있다. 일진홀딩스는 코스피 상장 기업으로 금융업 업종에 속해 있다. 시가총액은 2,798억원으로 코스피 상장기업 중 367위에 위치 해 있다. [종목 성향 진단] [그림 1] 종목 성향 진단 일진홀딩스의 투자 스타일은 모호한 측면이 있으나 성장주라고 볼 수 있다. 주가 고평가 우려가 공존하지만 높은 성장성이 기대되는 기업이다. 주가 모멘텀은 부진한 편이었다. 최근 1개월 수익률은 -1.73%의 하락폭을 기록했다. 일진홀딩스 종목에 대한 투자자의 관심도는 평범한 수준이었다. [투자 점수 진단] [그림 2] 투자 점수 진단 일진홀딩스는 저평가성2(PBR) 측면에서 두각을 나타내고 있다. 최근 PBR은 81점으로 6개의 핵심 팩터 중 가장 높은 점수를 기록했다. PBR은  전체 시장 내 361위를 기록하며 상위 19.32%에 위치했다. 업종별로는 80위를 기록하며 상위 23.94%에 위치했다. 그리고 성장성(매출증가율(YoY)) 역시 도드라지는 편이다. 성장성 점수는 72점으로 두번째로 높은 점수를 기록했다. 매출증가율(YoY)은 전체 시장 내 505위를 기록하며 상위 28.02%에 위치했다. 업종별로는 90위를 기록하며 상위 28.34%에 위치했다. 그러나 PER과 ROA는  아쉬움을 나타냈다. [종합 투자점수] [그림 3] 종합 투자점수 AI 인공지능 분석을 통한 일진홀딩스의 종목 종합 스코어는 46점을 기록했다. 이는 동일 업종 평균점수인 58점과 시장 평균점수인 57점를 하회하는 수치였다. (위의 AI인공지능 점수는 재무 데이터를 기반으로 전체 상장 종목과 비교/분석하여 도출한 점수로 높은 점수가 반드시 높은 수익률을 보장하지 않습니다. 위의 자료는 당사의 추천 종목이 아니며, 투자 시 참고용으로 제시해드리는 것입니다.) 라이온봇 기자 -한국경제TV※ 본 기사는 한국경제TV와 '거장들의 투자공식이'자체 개발한 '라이온봇 기자'가 실시간으로 작성한 기사입니다. 라이온봇기자 ⓒ 한국경제TV, 무단 전재 및 재배포 금지 한국경제TV 관련뉴스해당 언론사에서 선정하며 언론사 페이지(아웃링크)로 이동해 볼 수 있습니다.판커신 나쁜손 ""인정 못해""…中누리꾼 최민정 SNS에 악플테러'원조 청순女' 강수지 성형고백…'자연 미인 아니었나?'이윤택 기자회견 리허설, 짜고치기 고스톱?""법적 대응한다더니..."" 송하늘 조민기 성추행 폭로 '반전'왁스, 절친 홍석천 사생활 폭로? ""클럽 가면 사라진다"""
파이낸셜뉴스,015860,/news/news_read.nhn?article_id=0003902105&office_id=014&mode=search&query=일진홀딩스&page=1,2017-11-08 09:29,"[fnRASSI]일진홀딩스, 4.29% 오르며 거래량 증가","일진홀딩스(015860)의 현재 거래량이 최근 5거래일 거래량의 최고치를 넘어섰다. 그리고 일진홀딩스는 9일 연속 상승흐름을 보이며, 9시 23분 현재 4.29% 증가한 5,840원에 거래중이다. 개인투자자의 거래비중이 가장 높아 최근 한달간 주체별 거래비중을 살펴보면 개인이 전체 거래량의 85.61%를 차지하며 가장 활발한 참여를 보였고, 외국인은 11.87%, 기관은 2.5%의 거래 참여율을 보였다. 그리고 최근 5일간 거래비중은 개인이 90.68%, 외국인이 8.58%, 기관은 0.73%를 기록했다. 외국인 보유량 증가, 기관 감소 (5일 누적) 최근 5일간 동종목의 외국인 투자자는 1,214주 순매수하였고 반면 기관은 5,941주 순매도하였다. 전날 두 주체 각각 12,957주, 5,941주 순매도하며 보유 비율을 줄였다. 다음 표는 동종목의 외국인, 기관의 일별 순매수량을 나타낸 것이다. 'fnRASSI'는 증권전문 기업 씽크풀과 파이낸셜뉴스의 협업으로 로봇기자가 실시간으로 생산하는 기사입니다."
전자신문,015860,/news/news_read.nhn?article_id=0002496025&office_id=030&mode=search&query=일진홀딩스&page=1,2016-06-28 08:33,"[@기업분석리포트]일진홀딩스, &quot;2분기 실적 정상화&hellip;&quot; 매수(유지)-현대증권","현대증권에서 28일 일진홀딩스(015860)에 대해 ""2분기 실적 정상화 전망""라며 투자의견을 '매수(유지)'로 제시하였고, 아울러 목표주가로는 15,000원을 내놓았다. 현대증권 전용기, 김다은 애널리스트가 동종목에 대하여 이번에 제시한 '매수(유지)'의견은 현대증권의 직전 매매의견을 그대로 유지하는 것이고 올해 초반의 매매의견을 기준으로  볼때도 역시 '매수'의견이 계속 유지되고 있는 상태이다. 그리고 최근 분기내 발표된 전체 증권사 리포트의 컨센서스와 비교를 해볼 경우에 오늘 발표된 투자의견은 대체적으로 평균치에 해당하는 수준으로, 이번 의견은 동종목에 대한 전체적인 흐름에서 크게 벗어나지 않은 것으로 분석되고 있다. 목표주가의 추이를 살펴보면 최근 두차례 연속 하향조정되다가 이번에는 직전 목표가와 동일한 수준을 유지하는 모습이다. 또한 전일 종가 기준으로 볼때 동종목의 현주가는 이번에 제시된 목표가 대비 114.6%의 추가상승여력이 있다는 해석이 제시되고 있다."
이데일리,015860,/news/news_read.nhn?article_id=0003372617&office_id=018&mode=search&query=일진홀딩스&page=1,2015-10-20 08:12,"일진홀딩스, 자회사의 폭발적 순익 증가&hellip;&quot;내년도 기대&quot;-하나","[이데일리 박기주 기자] 하나금융투자가 20일 일진홀딩스(015860)에 대해 올해뿐 아니라 내년에도 자회사의 폭발적 순익 증가에 실적이 대폭 개선될 것이라고 전망했다. 투자의견은 ‘매수’, 목표주가는 2만2000원을 유지했다. 오진원 하나금융투자 연구원은 “일진홀딩스의 주가는 단기간 변동성은 심화됐지만 그룹의 실적 개선 방향성에는 변함이 없다”며 “일진다이아와 알피니언의 폭발적 순익 성장 등으로 인해 홀딩스의 올해 지배순익은 209억원으로 지난해보다 54.1% 증가할 것”이라고 내다봤다. 그는 “내년에도 실적 성장세는 이어질 전망”이라며 “우선 일진다이아의 100% 자회사인 일진복합소재 매출 성장과 흑자전화에 따른 실적 개선은 내년 홀딩스의 32.7% 순익 성장을 견인할 것”이라고 분석했다. 오 연구원은 이어 “알피니언은 초음파 진단기 매출 성장과 초음파치료기(HIFU) 매출 본격화로 106.8% 순익 성장이 예상된다”며 “기존 초음파 진단기 대비 수익성이 월등한 HIFU의 매출이 이제 막 시작이라는 점에서 향후 추가 매출 뉴스와 수출을 위한 CE 인증시 주가 모멘텀으로 작용할 것”이라고 전망했다."
아시아경제,015860,/news/news_read.nhn?article_id=0004149092&office_id=277&mode=search&query=일진홀딩스&page=1,2017-12-29 19:11,일진홀딩스 불성실공시법인 지정,[아시아경제 최대열 기자]유가증권시장본부는 자회사 유상증자를 지연공시한 일진홀딩스를 공시불이행 명목으로 다음 달 2일자로 불성실공시법인으로 지정한다고 29일 밝혔다.
