source,symbol,link,date,title,content
연합뉴스,015860,/news/news_read.nhn?article_id=0009761491&office_id=001&mode=search&query=일진홀딩스&page=1,2017-12-19 18:26,"거래소, 일진홀딩스 불성실공시법인 지정 에고",(서울=연합뉴스) 전명훈 기자 = 한국거래소 유가증권시장본부는 일진홀딩스가 자회사의 유상증자 결정을 지연 공시했다며 불성실공시법인 지정을 예고했다.
한국경제TV,015860,/news/news_read.nhn?article_id=0000622752&office_id=215&mode=search&query=일진홀딩스&page=1,2018-04-16 11:22,"일진홀딩스, 전일 대비 약 3% 상승한 5,350원","[한국경제TV 라이온봇 기자] 일진홀딩스는 4월 16일 11시 21분 전일 대비 약 3% 상승한 5,350원에 거래되고 있다. 일진홀딩스는 코스피 상장 기업으로 금융업 업종에 속해 있다. 시가총액은 2,556억원으로 코스피 상장기업 중 384위에 위치 해 있다. [종목 성향 진단] [그림 1] 종목 성향 진단 일진홀딩스의 투자 스타일은 모호한 측면이 있으나 가치주라고 볼 수 있다. 기업 가치 대비 낮은 주가가 매력적인 기업이다. 주가 모멘텀은 부진한 편이었다. 최근 6개월 수익률은 -6.16%의 하락폭을 기록했다. 최근 1개월 수익률 또한 -4.07% 하락하며 부진한 모멘텀을 이어가고 있다. 일진홀딩스 종목에 대한 투자자의 관심도는 상대적으로 낮은 편이었다. [투자 점수 진단] [그림 2] 투자 점수 진단 일진홀딩스는 저평가성2(PBR) 측면에서 두각을 나타내고 있다. 최근 PBR은 84점으로 6개의 핵심 팩터 중 가장 높은 점수를 기록했다. PBR은  전체 시장 내 308위를 기록하며 상위 16.48%에 위치했다. 업종별로는 72위를 기록하며 상위 22.33%에 위치했다. 그리고 성장성(매출증가율(YoY)) 역시 도드라지는 편이다. 성장성 점수는 70점으로 두번째로 높은 점수를 기록했다. 매출증가율(YoY)은 전체 시장 내 546위를 기록하며 상위 30.06%에 위치했다. 업종별로는 93위를 기록하며 상위 28.93%에 위치했다. 그러나 PER과 부채비율은  아쉬움을 나타냈다. [종합 투자점수] [그림 3] 종합 투자점수 AI 인공지능 분석을 통한 일진홀딩스의 종목 종합 스코어는 48점을 기록했다. 이는 동일 업종 평균점수인 56점과 시장 평균점수인 56점를 하회하는 수치였다. (위의 AI인공지능 점수는 재무 데이터를 기반으로 전체 상장 종목과 비교/분석하여 도출한 점수로 높은 점수가 반드시 높은 수익률을 보장하지 않습니다. 위의 자료는 당사의 추천 종목이 아니며, 투자 시 참고용으로 제시해드리는 것입니다.) 라이온봇 기자 -한국경제TV※ 본 기사는 한국경제TV와 '거장들의 투자공식이'자체 개발한 '라이온봇 기자'가 실시간으로 작성한 기사입니다. 라이온봇기자 ⓒ 한국경제TV, 무단 전재 및 재배포 금지 한국경제TV 관련뉴스해당 언론사에서 선정하며 언론사 페이지(아웃링크)로 이동해 볼 수 있습니다.'억대 수입' 이사배, 과거 공개한 '럭셔리' 하우스 봤더니차세찌 한채아 '이런 커플 처음이야'쏘가리 가격 '확' 떨어진다…22년 연구 끝에 '대량양식' 성공스타일난다, 4천억 '신화'…김소희 대표 누구?고 장자연-단역 자매 사건 재수사…""내가 노리개인가"""
전자신문,015860,/news/news_read.nhn?article_id=0002649573&office_id=030&mode=search&query=일진홀딩스&page=1,2017-10-20 15:55,[ET투자뉴스][일진다이아 지분 변동] 일진홀딩스(주) 외 3명 -6.21%p 감...,"일진다이아(081000)는 20일 최대주주 일진홀딩스(주)를  비롯한 특별관계자의 보유주식이 감소되었다고 발표했다. 이는 직전 보고일보다 700,000주 감소하여 지분율은 61.17%로 하락했다. 이번 보고 사유는 특별관계자의주식매도에 따른 변동보고로  알려졌다.   최대주주와 특수관계자의 지분 변동은 주가에 영향을 주는 요인이다. 특히 보유비율을 지속적으로 늘리거나 줄일 경우, 해당종목 투자시 유의할 필요가 있다.  다음은 일진다이아의 지분 변동 내역과 보유 내역이다."
매일경제,015860,/news/news_read.nhn?article_id=0003663004&office_id=009&mode=search&query=일진홀딩스&page=1,2016-01-12 17:21,"일진홀딩스, 자회사 덕에 올 영업이익 급증 기대","◆ 기업분석 / 일진홀딩스 ◆ 지난해는 일진홀딩스에 힘든 한 해였다. 주력 자회사는 실적 부진에 허덕였고, 신성장동력을 책임질 자회사는 성장을 이어갔지만 지주사 실적에 기여하기에는 한계가 뚜렷했다. 올해는 일진홀딩스에 '심기일전'의 한 해가 될 전망이다. 주력 자회사 실적이 턴어라운드하는 가운데 일부 자회사 성장성이 두드러질 것으로 예상되기 때문이다. 특히 일진홀딩스 기업가치 중 가장 큰 부분을 차지하는 초음파 의료기기 업체 알피니언메디칼시스템이 1000억원에 근접한 매출과 100억원을 넘는 영업이익을 기록하며 그동안의 투자를 성과로 보상하기 시작할 것으로 보인다. 증권사들은 올해 일진홀딩스의 연결 기준 매출을 지난해 대비 6.1% 늘어난 9583억원, 영업이익은 60% 늘어난 592억원으로 예상하고 있다. 일진홀딩스는 자회사 6개를 거느리고 있다. 일진전기, 일진다이아몬드, 알피니언메디칼시스템, 일진디앤코, 아이텍, 전주방송 등이다. 매출 비중은 일진전기가 압도적이다. 2014년 일진홀딩스 연결매출 9317억원 중 82.7%(7707억원)를 일진전기가 담당했다. 지난해 일진홀딩스 실적 부진은 일진전기 때문이었다. 전선과 전력시스템 수요는 신흥국 신규 시설 투자와 선진국 교체 수요가 양대 축인데 세계 경기 침체로 양쪽 모두 줄었다. 구리 가격이 하락하며 제품 판매단가도 하락했다. 이로 인해 일진전기의 지난해 3분기까지 누적 매출은 5101억원에 그쳐 전년(5506억원) 대비 7.4% 줄었다. 같은 기간 영업이익은 226억원에서 43억원으로 급감했다. 일진다이아몬드가 지난해 3분기까지 전년도 연간 실적(77억원)을 훌쩍 뛰어넘는 영업이익 112억원을 기록하며 선전했지만 일진전기의 부진을 극복하기에는 역부족이었다. 지난해 4분기를 기점으로 상황은 긍정적으로 바뀌고 있다. IBK투자증권에 따르면 지난해 초 3000억원대 후반에 불과했던 일진전기 수주잔액이 북미·유럽·중동에서의 수주 증가에 힘입어 지난해 말 5000억원대로 회복됐다. 홍용기 일진그룹 차장은 ""최근 중남미 시장을 개척해 일부 성과를 거두고 있다""며 ""국내에서는 한국전력 실적 개선으로 인한 노후 설비 교체 확대 가능성에 기대를 걸고 있다""고 말했다. 일진다이아몬드는 고부가가치 제품을 생산하는 CTM 부문 매출 증대에 힘입어 실적 개선 추세를 이어갈 전망이다. CTM 부문은 다이아몬드 분말에 질소, 탄소, 붕소 등을 넣고 다시 한 번 소결한 결정체를 만든다. 이 결정체는 자동차, 정밀기계, 반도체 등을 가공하는 장비에 쓰인다. 매년 10% 이상 성장하고 있다. 김장원 IBK투자증권 연구원은 ""CTM 부문 비중 증가에 힘입어 올해 일진다아몬드 영업이익은 170억원에 달할 것""이라고 말했다. 신성장동력을 담당하고 있는 계열사들의 선전은 일진홀딩스 실적 개선세를 한층 가속화할 전망이다. 특히 알피니언메디칼시스템 성장세가 기대를 모은다. 2011년 101억원이었던 이 회사 매출은 2014년 527억원으로 늘었고, 같은 기간 영업이익은 147억원 적자에서 41억원 흑자로 돌아섰다. 이상헌 하이투자증권 연구원은 ""지난해 매출과 영업이익은 각각 650억원과 65억원으로 추정된다""며 ""올해 매출은 950억원, 영업이익은 125억원에 달할 것""이라고 말했다. 알피니언메디칼시스템 주력제품은 초음파 진단기다. 경쟁사와 비교해 훨씬 선명한 화상을 구현하고 조작이 간편한 데다 실시간 진단·상담이 가능하다는 장점을 앞세워 국내는 물론 중국, 독일 등에서 점유율을 높이고 있다. 지난해부터는 초음파 치료기가 제품 라인업에 추가돼 기대를 모으고 있다. 초음파 치료기의 핵심은 '하이푸(HIFU)' 기술이다. 이 기술은 고강도 초음파를 방사해 초점에서 발생하는 고열로 종양을 태워서 제거하는 것이다. 알피니언메디칼시스템은 지난해 자궁근종 치료기를 개발해 서울대병원에서 임상을 마치고 식약청으로부터 국내 판매 허가를 얻었다. 일진복합소재도 올해 큰 폭의 성장을 기대하고 있다. 수소차·압축천연가스(CNG)버스 등 친환경차량 연료탱크와 디젤 차량 매연저감장치를 만드는데 최근 정부가 수소차 보급 확대와 시장활성화 계획을 확정함에 따라 수혜를 입을 전망이다. [노현 기자] r_start // r_end // [ⓒ 매일경제 & mk.co.kr, 무단전재 및 재배포 금지] 매일경제 관련뉴스해당 언론사에서 선정하며 언론사 페이지(아웃링크)로 이동해 볼 수 있습니다.치어리더, 대놓고 치마 들추고 엉덩이 보여주다?…""원숭이 엉덩이는 빨개""성공질주 샤오미, 진짜 '대륙의 실수' 되나황혼에 선 이승엽, 또 변화를 말하다'플레이보이' 저택 매물로… 미국서 가장 비싼 집, 대체 얼마?레드벨벳 조이, 초미니 입고 '무릎앉아' 자세로…""속이 다 보이나? 화들짝"""
머니투데이,015860,/news/news_read.nhn?article_id=0003981275&office_id=008&mode=search&query=일진홀딩스&page=1,2017-12-19 18:18,"일진홀딩스, 불성실공시법인 지정예고",[머니투데이 한은정 기자] 한국거래소는 일진홀딩스 에 대해 불성실공시법인 지정예고한다고 19일 공시했다.
아시아경제,015860,/news/news_read.nhn?article_id=0004101204&office_id=277&mode=search&query=일진홀딩스&page=1,2017-10-24 09:39,"[특징주]일진홀딩스, 혈액 통한 치매 조기진단 기술 부각&hellip;&uarr;","[아시아경제 권성회 기자] 메디프론이 혈액으로 알츠하이머를 조기진단하는 기술을 도입했다는 소식에 주가가 급등하고 있는 가운데 일진홀딩스도 자회사가 혈액을 통한 초기 치매진단 기술을 이전받은 건 덕에 동반 상승 중이다. . 일진홀딩스는 24일 오전 9시31분 현재 전일 대비 2.53%(125원) 오른 5060원에 거래되고 있다. 지난 18일 이후 4거래일 만에 5000원선에 다시 올라섰다. 2016년 한국과학기술연구원(KIST)은 자체 개발한 '치매 조기진단기술'을 일진그룹 계열사 알피니언메디칼시스템에 기술이전한다고 밝혔다. 이 기술은 혈액 속 베타아밀로이드의 병리학적 연관성 연구와 전처리 기술을 통한 바이오마커 정량측정 및 치매진단법, 미량의 혈중 베타아밀로이드를 검출하기 위한 미세 교차전극 센서 등이다. 특히 이 기술은 간단한 혈액검사를 통해 치매 증상 발현 전에도 조기 진단할 수 있으며 검사비도 저렴한 것으로 알려졌다. 알피니언메디칼시스템은 일진홀딩스가 지분 93.5%를 보유하고 있다."
뉴시스,015860,/news/news_read.nhn?article_id=0008351399&office_id=003&mode=search&query=일진홀딩스&page=1,2017-12-19 17:56,"일진홀딩스 자회사 알피니언메디칼시스템, 200억원 유상증자",【서울=뉴시스】이진영 기자 = 일진홀딩스(015860)는 재무구조 개선을 위해 자회사 알피니언메디칼시스템이 제3자 배정증자 방식으로 200억원 유상증자를 한다고 19일 공시했다.
매일경제,015860,/news/news_read.nhn?article_id=0003900284&office_id=009&mode=search&query=일진홀딩스&page=1,2017-03-07 15:04,"일진홀딩스 자회사 알피니언, 초음파장비 해외특허소송 패소","일진홀딩스의 자회사인 알피니언메디칼시스템이 해외 특허침해소송에서 패소했다. 다만 회사측은 매출비중이 1%대로 큰 피해는 없다는 입장이다. 일진홀딩스는 알피니언메디칼시스템이 미국 베라소닉스(VERASONICS)와 벌인 연구용 초음파 진단장비 관력 특허침해소송에서 패소했다고 7일 밝혔다. 손해배상액은 약 291만달러이며, 해당 장비는 5년간 판매금지처분을 받을 전망이다. 이에 대해 일진홀딩스 측은 ""해당기기가 현재 미국법인에서만 취급하고 있으며, 알피니언메디칼시스템의 전체 매출대비 비중은 1.4% 수준으로 사업에 큰 영향은 없다""고 밝혔다. 이어 ""판매금지 가처분조치가 내려졌지만 기존에 납품한 제품에 대한 서비스에는 지장이 없다""고 덧붙였다. [진영태 기자] r_start // r_end //"
머니투데이,015860,/news/news_read.nhn?article_id=0003638776&office_id=008&mode=search&query=일진홀딩스&page=1,2016-02-29 08:16,"일진홀딩스, 올해 자회사 실적 고공행진-IBK투자증권","[머니투데이 송정훈 기자] IBK투자증권은 일진홀딩스의 주력 자회사 실적 개선 등을 근거로 투자의견 매수를 유지했다. 목표주가는 1만8000원을 제시했다. IBK투자증권 김장원 연구원은 29일 ""주력 자회사인 일진전기의 수주잔고가 예년 수준을 회복했고 수주지역이 다변화돼 수주의 안정성이 높아졌다는 점이 긍정적""이라며 ""초음파치료기는 출시 2년차로 국내외에서 판매량이 지난해보다 2.5배 많은 12대 정도를 목표로 하고 있다""고 말했다. 그는 이어 ""출시 초기에는 판매가 어렵게 진행되지만 사용하는 병원이 늘면 늘수록 마케팅 효과도 커져 판매량이 늘어날 것""이라고 예상했다. 또한 ""지난해 호실적을 기록했던 일진다이아몬드는 금년에도 호실적이 유지될 것""이라고 덧 붙였다. textlinktopstart textlinktopend textlinkstart"
전자신문,015860,/news/news_read.nhn?article_id=0002522944&office_id=030&mode=search&query=일진홀딩스&page=1,2016-09-07 14:51,"[@공시]일진홀딩스, 한국전력공사와 467.5억 규모 계약. 현재 +1.01%","일진홀딩스(015860)는 상품공급에 관한 계약을 한국전력공사와 467.5억원에 체결했다고 7일 공시했다. 이는 일진홀딩스의 최근 사업연도 매출액 7,146.5억원의 6.54%에 해당한다.아래 표는 과거 수주공시와의 비교를 통해 금일 공시된 계약의 규모를 가늠해 보기 위한 자료이다."
아시아경제,015860,/news/news_read.nhn?article_id=0003671666&office_id=277&mode=search&query=일진홀딩스&page=1,2016-01-22 08:22,"일진홀딩스, 신성장동력 모멘텀 강화로 성장성 부각 &lsquo;매수&rsquo;&lt;IBK투자證&gt;","[아시아경제 팍스넷 신송희 기자] IBK투자증권은 22일 일진홀딩스에 대해 주력사업의 실적 개선과 신성장동력의 성장 모멘텀 강화로 성장성이 부각될 것으로 전망했다. 투자의견 ‘매수’와 목표주가 1만8000원을 제시했다. 김장원 연구원은 “주력제품의 전방산업 수요 특성상 4분기에 수요가 집중돼 4분기 실적이 개선되는 특징을 갖고 있다”면서 “지난해에는 시작이 부진을 예고했다면, 올해는 수주잔고가 평균수준을 회복함에 따라 양상이 다를 것”이라고 내다봤다. 이어 “지난해 높은 실적 개선을 기록했던 일진다이아몬드는 부가가치 높은 제품의 매출 비중이 지난해 수준 이상을 기록할 것”이라며 “실적 호조가 지속될 것”으로 분석했다. 의료장비와 복합소재도 부각될 것이란 분석이다. 김 연구원은 “초음파진단기는 제품라인업이 6개에서 8개로 증가한다”며 “유럽 제품인증으로 수출 여건을 마련해 성장세가 지속될 것”으로 전망했다. 여기에 일진다이아몬드가 지분을 100% 가진 환경관련제품을 생산하는 업체로 환경을 개선하기 위한 정부 정책과 전방사업자의 신모델로 제품 수요가 많아질 것으로 추정된다. 한편, 일진홀딩스의 주가는 급상승 이후 기간 조정을 충분히 받았으며 분기별 실적 편차가 큰 점을 감안해 실적과 주가가 가장 저점을 기록할 것으로 예상하는 1분기에 비중 확대를 제시한다는 조언이다."
파이낸셜뉴스,015860,/news/news_read.nhn?article_id=0003652568&office_id=014&mode=search&query=일진홀딩스&page=1,2016-05-24 08:09,"현대증권 &quot;일진홀딩스, 1분기 실적 부진하나, 알피니온메디칼시스템 성장기대&quot;","현대증권은 24일 일진홀딩스에 대해 ""실적이 예상보다 부진해 목표주가를 종전 1만8000원에서 1만5000원으로 낮춘다""며 ""다만 알피니온메디칼시스템의 고성장 추세가 유지되고 있어 투자의견은 '매수'를 유지한다""고 밝혔다. 전용기 현대증권 연구원은 ""1·4분기 일진홀딩스 연결실적 부진했으나 알피니온메디칼시스템은 기대 이상의 성과를 기록했다""며 ""알피니온메디칼시스템은 단독매출 122억원을 달성했고 흑자전환에 성공했다""고 말했다. 일진전기의 영업적자 28억원을 기록 여파로 일진홀딩스는 1·4분기 영업손실로 돌아섰다. 전 연구원은 ""해외연결법인까지 포함하면 매출 130억원으로 수출증가 추세가 유지되고 있다""며 ""규모의 경제효과가 분기 매출에 도달함으로써 매분기 영업이익 흑자 달성이 가능할 것으로 예상된다""고 말했다. 그는 ""1·4분기 원가율 상승과 기성률 저하로 영업적자를 기록한 일진전기는 2·4분기부터 흑자기조로 접어들 전망""라며 ""수주잔고가 전년대비 1000억원 증가해 있고 초고압 전력선 기성증가 등이 가능하기 때문""이라고 설명했다. 마지막으로 그는 ""알피니온메디칼시스템 초음파진단기는 올해 새로운 제품라인업이 전년도 1개에서 올해 3개 이상으로 보강되면서 신규수요를 이끌 전망""이라며 ""글로벌 딜러망과의 재고시스템 구축으로 효율적인 재고 관리가 가능해진 점도 긍정적""이라고 평가했다."
한국경제,015860,/news/news_read.nhn?article_id=0003556281&office_id=015&mode=search&query=일진홀딩스&page=1,2016-02-29 07:42,"&quot;일진홀딩스, 4분기 실적 부진&hellip;성장 추세 '이상 無'&quot;-현대","[ 이민하 기자  ] 현대증권은 29일 일진홀딩스에 대해 성장 추세는 유지되고 있다며 투자의견 '매수'와 목표주가 2만3000원을 유지했다. 전용기 현대증권 연구원은 ""4분기 실적 부진은 알피니온메디칼시스템의 재고조정 정책 변화와 초음파 치료기의 매출인식 방식이 주 원인으로 성장추세는 유지되고 있다""며 ""매출 인식이 판매 후 즉시가 아닌, 1~2년 동안 순차적으로 인식될 예정으로 큰 문제는 없는 것으로 보인다""고 설명했다. 일진홀딩스의 4분기 연결 영업이익은 기타 비용 발생 등으로 시장 평균 추정치(컨센서스)인 220억원을 밑도는 167억원을 기록했다. 알피니온메디칼시스템의 연결 매출과 영업이익은 각각 260억원, 40억원으로 나타났다. 컨센서스는 각각 350억원, 80억원 수준이었다. 전 연구원은 ""올해 알피니온메디칼시스템의 실적은 초음파치료기의 매출인식과 수출 가능성, 초음파 진단기의 제품 라인업 강화 및 애플리케이션 강화로 고성장이 기대된다""며 ""올해 연결 매출은 전년 대비 38% 늘어난 855억원. 영업이익은 1400% 증가한 122억원으로 전망된다""고 말했다. 이어 ""알피니온메디칼시스템은 2017년 하반기 투자재원 확보를 위해 기업공개될 가능성이 높다""""고 덧붙였다. 이민하 한경닷컴 기자"
연합뉴스,015860,/news/news_read.nhn?article_id=0009781249&office_id=001&mode=search&query=일진홀딩스&page=1,2017-12-29 18:42,"거래소, 일진홀딩스 불성실공시법인 지정",(서울=연합뉴스) 권수현 기자 = 한국거래소 유가증권시장본부는 일진홀딩스를 유상증자 사실 지연공시로 불성실공시법인으로 지정한다고 29일 공시했다. 지정 일자는 내달 2일이며 공시 위반 제재금은 800만원이다.
파이낸셜뉴스,015860,/news/news_read.nhn?article_id=0003787525&office_id=014&mode=search&query=일진홀딩스&page=1,2017-03-10 11:17,"[fnRASSI]일진홀딩스(015860), 신저가 경신...-2.01% &darr;","일진홀딩스(015860)는 당일 4,620원까지 하락하며 52주신저가를 기록했다. 동종목의 현재 주가는 전일대비 -2.01% 하락한 4,620원 선에서 이루어지고 있다. 거래일을 기준으로 최근 3일간 평균 거래량은 51만 주이다. 이는 60일 일 평균 거래량 14만 주와 비교해보면 최근 거래량이 급격히 늘어났다는 것을 알 수 있다. 외국인/기관 순매수, 개인은 순매도(한달누적)  2월28일부터 전일까지 기관이 7거래일 연속 동종목을 내다 팔았다. 4주간을 기준으로 보면 외국인이 40,203주를 순매수했고, 기관도 8,907주를 순매수했다. 반면 개인들은 매도 관점으로 접근하면서 49,110주를 순매도한 것으로 나타났다.                   지표               항목               값               종합점수                 성장성               매출액증가율               -0.05               4.11                 자기자본증가율               -0.03                 안정성               부채비율               143.12               5.99                 유동비율               78.53                 이익안정성               8.06                 수익성               ROA               -0.68               2.34                 ROE               -1.66                 영업이익율               0.27          일진홀딩스의 퀀트 재무 점수는 12.44점으로 지난 분기에 비해 성장성 점수가 상승했다. 이는 매출액 증가율이 증가하였기 때문이다. 실적 안정성이 악화되어 안정성 종합 점수는 하락했다. 수익성 측면에서 볼때 ROA, ROE, 영업이익률 모두 하락하여 이전보다 낮은 점수를 받았다. 'fnRASSI'는 증권전문 기업 씽크풀과 파이낸셜뉴스의 협업으로 로봇기자가 실시간으로 생산하는 기사입니다."
