source,symbol,link,date,title,content
이데일리,015860,/news/news_read.nhn?article_id=0003370841&office_id=018&mode=search&query=일진홀딩스&page=1,2015-10-16 17:53,"일진홀딩스, 아이제이 자회사 편입","[이데일리 염지현 기자] 일진홀딩스(015860)는 아이텍의 인적분할에 따라 기술연구개발 및 지식, 정보관련 사업을 영위하는 아이제이를 자회사로 편입한다고 16일 공시했다. 편입후 자회사에 대한 지분율은 70%다."
파이낸셜뉴스,015860,/news/news_read.nhn?article_id=0003742630&office_id=014&mode=search&query=일진홀딩스&page=1,2016-12-02 10:26,"[특징주]일진홀딩스, 트럼프 수혜 부각..이틀째 상승세","일진홀딩스가 트럼프 미국 대통령의 인프라투자 정책에 따라 수혜가 예상된다는 증권가의 전망에 주가가 상승중이다. 1일 오전 9시32분 현재 일진홀딩스는 전일대비 2.73% 오른 6020원에 거래되고 있다. 전일 6% 이상 상승마감했으며, 이틀째 강세가 이어지고있다. 현대증권은 일진홀딩스에 대해 내년 트럼프 정책으로 인한 수혜가 예상된다고 분석했다."
파이낸셜뉴스,015860,/news/news_read.nhn?article_id=0003801876&office_id=014&mode=search&query=일진홀딩스&page=1,2017-04-12 09:57,"[fnRASSI]일진홀딩스(015860), 52주 신저가 기록...-2.29% &darr;","일진홀딩스(015860)는 당일 4,480원까지 하락하며 52주신저가를 기록했다. 동종목의 현재 주가는 전일대비 -2.29% 하락한 4,480원 선에서 이루어지고 있다. 거래일을 기준으로 최근 3일간 평균 거래량은 19만 주이다. 이는 60일 일 평균 거래량 20만 주와 비교해보면 최근 거래량이 약간 감소했지만 크게 벗어나지는 않았다. 상장주식수 대비 거래량은 0.54%로 적정수준 최근 한달간 일진홀딩스의 상장주식수 대비 거래량을 비교해보니 일별 매매회전율이 0.54%로 집계됐다. 그리고 동기간 장중 저점과 고점의 차이인 일평균 주가변동률을 1.96%를 나타내고 있다.                   지표               항목               값               종합점수                 성장성               매출액증가율               -0.05               4.08                 자기자본증가율               -0.02                 안정성               부채비율               143.12               5.99                 유동비율               78.53                 이익안정성               8.06                 수익성               ROA               -0.68               2.09                 ROE               -1.66                 영업이익율               0.27          일진홀딩스의 퀀트 재무 점수는 12.16점으로 지난 분기에 비해 성장성 점수가 상승했다. 이는 매출액 증가율과 자기자본 증가율이 증가하였기 때문이다. 실적 안정성이 악화되어 안정성 종합 점수는 하락했다. 수익성 측면에서 볼때 ROA, ROE, 영업이익률 모두 하락하여 이전보다 낮은 점수를 받았다. 'fnRASSI'는 증권전문 기업 씽크풀과 파이낸셜뉴스의 협업으로 로봇기자가 실시간으로 생산하는 기사입니다."
한국경제,015860,/news/news_read.nhn?article_id=0003754525&office_id=015&mode=search&query=일진홀딩스&page=1,2017-04-12 09:20,"[특징주]일진홀딩스, '52주 신저가' 추락&hellip;외국인 매도",[ 김은지 기자  ] 일진홀딩스가 외국인 매도세에 52주 신저가로 추락했다. 12일 오전 9시16분 현재 일진홀딩스는 전날보다 20원(0.44%) 내린 4565원에 거래되고 있다. 모건스탠리와 메릴린치 등을 통해 외국인이 2600주의 매도 물량을 내보내고 있다. 외국인은 지난 4일부터 7거래일 연속 일진홀딩스를 팔고 있다. 기관은 전날까지 8거래일 연속 순매도를 지속했다.
연합뉴스,015860,/news/news_read.nhn?article_id=0007923435&office_id=001&mode=search&query=일진홀딩스&page=1,2015-10-16 17:21,"일진홀딩스, 아이제이 자회사 편입",(서울=연합뉴스) 김수진 기자 = 일진홀딩스는 기술연구개발 및 지식 정보 관련 사업을 주로 하는 아이제이를 자회사로 편입한다고 16일 공시했다. 편입 후 일진홀딩스의 아이제이에 대한 지분 소유 비율은 70.0%다.
파이낸셜뉴스,015860,/news/news_read.nhn?article_id=0003909078&office_id=014&mode=search&query=일진홀딩스&page=1,2017-11-20 09:55,"[fnRASSI]일진홀딩스, 1.55% 오르며 거래량 증가","일진홀딩스(015860)의 현재 거래량이 최근 5거래일 거래량의 최고치를 넘어서며 투자자들의 관심을 받고 있다. 그리고 일진홀딩스는 3일 연속 상승흐름을 보이며, 9시 49분 현재 1.55% 증가한 5,900원에 거래중이다.                             지표             항목             값             종합점수                 성장성             매출액증가율             -0.01             4.38                 자기자본증가율             -0.03                 안정성             부채비율             144.35             5.28                 유동비율             97.02                 이익안정성             6.67                 수익성             ROA             -1.08             2.52                 ROE             -2.63                 영업이익율             0.86         일진홀딩스의 퀀트 재무 점수는 12.18점으로 지난 분기에 비해 성장성 점수가 하락했다. 이는 자기자본 증가율이 감소하였기 때문이다. 안정성 종합 점수는 부채비율 증가, 실적 안정성 악화로 하락했다. 수익성 측면에서 볼때 영업이익률이 개선되어 이전보다 좋은 점수를 받았다. 주요 매매주체는 개인투자자  최근 한달간 주체별 거래비중을 살펴보면 개인 비중이 88.94%로 가장 높았고, 외국인이 9.91%로 그 뒤를 이었다. 기관은 1.14%를 나타냈다. 그리고 최근 5일간 거래비중은 개인이 88.6%로 가장 높은 참여율을 보였고, 외국인이 9.5%를 보였으며 기관은 1.88%를 나타냈다. 'fnRASSI'는 증권전문 기업 씽크풀과 파이낸셜뉴스의 협업으로 로봇기자가 실시간으로 생산하는 기사입니다."
머니투데이,015860,/news/news_read.nhn?article_id=0003561382&office_id=008&mode=search&query=일진홀딩스&page=1,2015-10-16 17:19,"일진홀딩스, 아이제이를 자회사로 편입","[머니투데이 김도윤 기자] 일진홀딩스는 아이텍의 인적분할에 따라 기술연구개발 및 지식, 정보관련 사업을 영위하는 아이제이를 자회사로 편입한다고 16일 공시했다. 편입후 자회사에 대한 지분율은 70%다. textlinktopstart textlinktopend textlinkstart"
한국경제TV,015860,/news/news_read.nhn?article_id=0000596116&office_id=215&mode=search&query=일진홀딩스&page=1,2018-01-29 11:13,"일진홀딩스, 전일 대비 약 9% 상승한 6,900원","[한국경제TV 라이온봇 기자] 일진홀딩스는 1월 29일 11시 13분 전일 대비 약 9% 상승한 6,900원에 거래되고 있다. 일진홀딩스는 코스피 상장 기업으로 금융업 업종에 속해 있다. 시가총액은 3,113억원으로 코스피 상장기업 중 356위에 위치 해 있다. [종목 성향 진단] [그림 1] 종목 성향 진단 일진홀딩스의 투자 스타일은 모호한 측면이 있으나 성장주라고 볼 수 있다. 주가 고평가 우려가 공존하지만 높은 성장성이 기대되는 기업이다. 주가 모멘텀은 좋은 편에 속했다. 최근 6개월 수익률은 24.95%의 상승폭을 기록했다. 최근 1개월 수익률 또한 23.24% 상승하며 좋은 모멘텀을 보이고 있다. 일진홀딩스종목에 대한 투자자의 관심도는 평범한 수준이었다. [투자 점수 진단] [그림 2] 투자 점수 진단 일진홀딩스는 저평가성2(PBR) 측면에서 두각을 나타내고 있다. 최근 PBR은 81점으로 6개의 핵심 팩터 중 가장 높은 점수를 기록했다. PBR은  전체 시장 내 361위를 기록하며 상위 19.32%에 위치했다. 업종별로는 80위를 기록하며 상위 23.94%에 위치했다. 그리고 성장성(매출증가율(YoY)) 역시 도드라지는 편이다. 성장성 점수는 72점으로 두번째로 높은 점수를 기록했다. 매출증가율(YoY)은 전체 시장 내 505위를 기록하며 상위 28.02%에 위치했다. 업종별로는 90위를 기록하며 상위 28.34%에 위치했다. PER과 ROA은 아쉬움을 나타냈다. [종합 투자점수] [그림 3] 종합 투자점수 AI 인공지능 분석을 통한 일진홀딩스의 종목 종합 스코어는 46점을 기록했다. 이는 동일 업종 평균점수인 58점과 시장 평균점수인 57점를 하회하는 수치였다. (위의 AI인공지능 점수는 재무 데이터를 기반으로 전체 상장 종목과 비교/분석하여 도출한 점수로 높은 점수가 반드시 높은 수익률을 보장하지 않습니다.) 라이온봇 기자 -한국경제TV※ 본 기사는 한국경제TV와 '거장들의 투자공식이'자체 개발한 '라이온봇 기자'가 실시간으로 작성한 기사입니다. 라이온봇기자 ⓒ 한국경제TV, 무단 전재 및 재배포 금지 한국경제TV 관련뉴스해당 언론사에서 선정하며 언론사 페이지(아웃링크)로 이동해 볼 수 있습니다.전지현 득남…두 아이 엄마 됐다사람이좋다 임미숙 김학래, '100억 빚→100억 매출''비인두암' 김우빈 병역면제, ""신체검사 재검서 6급 판정""이욱과 열애 임지연 폭로…""어마어마한 뇌순녀""'배지현♥' 새신랑 류현진, LA 출국길 다정 투샷"
서울경제,015860,/news/news_read.nhn?article_id=0003209163&office_id=011&mode=search&query=일진홀딩스&page=1,2018-01-29 10:28,"(유)일진홀딩스, 전일 대비 7.13% 상승.. 일일회전율은 1.46% 기록","[서울경제] 일진홀딩스(015860) 는 29일 오전 10시 28분 현재 7.13% 오른 6,760원에 거래되고 있으며, 40(매도):60(매수)의 매수우위를 기록하고 있다. 거래대금은 47억6,792만, 거래량은 72만288주로 거래량회전율은 1.46%로 나타났다. 지난 1개월간 일진홀딩스는 상승 18회, 하락 11회를 기록했고, 주가수익률은 30.25% 표준편차는 3.77%를 기록했다. 이 기간 ' 금융업 ' 업종 평균 주가수익률은 8.30%로 나타났으며, 변동성은 0.80%를 기록했다. 이 시각 현재 ' 금융업 '은 1.28% 상승 중이며, 67(매도):33(매수)의 매도우위를 기록하고 있다."
머니투데이,015860,/news/news_read.nhn?article_id=0003630454&office_id=008&mode=search&query=일진홀딩스&page=1,2016-02-16 08:07,"일진홀딩스, 자회사 알피니온메디칼 고성장 지속-현대증권","[머니투데이 송정훈 기자] 현대증권은 올해 일진홀딩스에 대해 자회사인 알피니온메디칼시스템의 고성장을 전망하며 투자의견 매수와 목표주가 2만3000원을 유지했다. 현대증권 전용기 연구원은 16일 ""알피니온메디칼시스템의 고성장은 올해에도 지속될 전망""이라며 ""기술이전된 치매진단키트 가치가 점진적으로 주가에 반영될 것으로 예상된다""고 밝혔다. 이어 ""2017년 하반기부터 국내 매출이, 유럽 인증 후 2018년 하반기부터는 해외 매출 발생도 기대된다""며 ""고령화 추세에 따라 치매진단이 건강검진에 포함될 가능성이 높아 그 가치는 상당할 전망""이라고 덧 붙였다. 치매진단키트는 한국과학기술연구원(KIST) 뇌과학연구소에서 2013년부터 개발을 시작해 임상에서 좋을 결과를 얻은 기술이다. 알피니온메디칼시스템은 기술 이전료 선급금 및 발생할 매출에 대해 로열티를 지불하는 조건으로 기술을 이전받았다. textlinktopstart textlinktopend textlinkstart"
파이낸셜뉴스,015860,/news/news_read.nhn?article_id=0003857403&office_id=014&mode=search&query=일진홀딩스&page=1,2017-08-11 11:08,"[fnRASSI]일진홀딩스, 당일 거래량 증가하며 4거래일 하락세 지속","일진홀딩스는 투자자들의 관심으로 현재 거래량이 최근 5거래일 거래량의 최고치를 넘어섰다. 그리고 일진홀딩스는 4일 연속 하락흐름을 보이며, 11시 4분 현재 5.25% 내린 5,230원에 거래중이다. 외국인 보유량 감소, 기관 증가 (5일 누적) 최근 5일간 동종목의 외국인 투자자는 16,705주 순매도하였고 반면 기관은 0주 순매수하였다. 전날 외국인은 7,191주 순매도했지만 기관은 순매수량이 0으로 보유비율 그대로 유지했다. 다음 표는 동종목의 외국인, 기관의 일별 순매수량을 나타낸 것이다. 상장주식수 대비 거래량은 1.27%로 적정수준 최근 한달간 일진홀딩스의 상장주식수 대비 거래량을 비교해보니 일별 매매회전율이 1.27%로 집계됐다. 그리고 동기간 장중 저점과 고점의 차이인 일평균 주가변동률을 3.31%를 나타내고 있다. 'fnRASSI'는 증권전문 기업 씽크풀과 파이낸셜뉴스의 협업으로 로봇기자가 실시간으로 생산하는 기사입니다."
서울경제,015860,/news/news_read.nhn?article_id=0003215105&office_id=011&mode=search&query=일진홀딩스&page=1,2018-02-05 13:19,"(유)일진홀딩스, 전일 대비 7.36% 상승.. 일일회전율은 1.37% 기록","[서울경제] 일진홀딩스(015860) 는 5일 오후 1시 18분 현재 7.36% 오른 6,560원에 거래되고 있으며, 43(매도):57(매수)의 매수우위를 기록하고 있다. 거래대금은 42억119만, 거래량은 67만6,949주로 거래량회전율은 1.37%로 나타났다. 지난 1개월간 일진홀딩스는 상승 17회, 하락 12회를 기록했고, 주가수익률은 29.90% 표준편차는 3.99%를 기록했다. 이 기간 ' 금융업 ' 업종 평균 주가수익률은 4.92%로 나타났으며, 변동성은 0.79%를 기록했다. 이 시각 현재 ' 금융업 '은 0.71% 상승 중이며, 49(매도):51(매수)의 매수우위를 기록하고 있다."
한국경제TV,015860,/news/news_read.nhn?article_id=0000634323&office_id=215&mode=search&query=일진홀딩스&page=1,2018-05-15 13:21,"일진홀딩스, 전일 대비 약 5% 상승한 5,560원","[한국경제TV 라이온봇 기자] 일진홀딩스는 5월 15일 13시 20분 전일 대비 약 5% 상승한 5,560원에 거래되고 있다. 일진홀딩스는 코스피 상장 기업으로 금융업 업종에 속해 있다. 시가총액은 2,610억원으로 코스피 상장기업 중 400위에 위치 해 있다. [종목 성향 진단] [그림 1] 종목 성향 진단 일진홀딩스의 투자 스타일은 가치주에 가깝다. 기업 가치 대비 낮은 주가가 매력적인 기업이다. 주가 모멘텀은 평범한 수준이었다. 최근 1개월 수익률이 6.76%, 3개월 수익률은 -8.95%, 6개월 수익률은 -6.37%를 기록했다. 일진홀딩스 종목에 대한 투자자의 관심도는 상대적으로 낮은 편이었다. [투자 점수 진단] [그림 2] 투자 점수 진단 일진홀딩스는 저평가성2(PBR) 측면에서 두각을 나타내고 있다. 최근 PBR은 85점으로 6개의 핵심 팩터 중 가장 높은 점수를 기록했다. PBR은  전체 시장 내 273위를 기록하며 상위 14.54%에 위치했다. 업종별로는 54위를 기록하며 상위 16.67%에 위치했다. 그리고 성장성(매출증가율(YoY)) 역시 도드라지는 편이다. 성장성 점수는 70점으로 두번째로 높은 점수를 기록했다. 매출증가율(YoY)은 전체 시장 내 546위를 기록하며 상위 30.01%에 위치했다. 업종별로는 93위를 기록하며 상위 28.93%에 위치했다. 그러나 PER과 부채비율은  아쉬움을 나타냈다. [종합 투자점수] [그림 3] 종합 투자점수 AI 인공지능 분석을 통한 일진홀딩스의 종목 종합 스코어는 52점을 기록했다. 이는 동일 업종 평균점수인 59점과 시장 평균점수인 60점를 하회하는 수치였다. (위의 AI인공지능 점수는 재무 데이터를 기반으로 전체 상장 종목과 비교/분석하여 도출한 점수로 높은 점수가 반드시 높은 수익률을 보장하지 않습니다. 위의 자료는 당사의 추천 종목이 아니며, 투자 시 참고용으로 제시해드리는 것입니다.) 라이온봇 기자 -한국경제TV※ 본 기사는 한국경제TV와 '거장들의 투자공식이'자체 개발한 '라이온봇 기자'가 실시간으로 작성한 기사입니다. 라이온봇기자 ⓒ 한국경제TV, 무단 전재 및 재배포 금지 한국경제TV 관련뉴스해당 언론사에서 선정하며 언론사 페이지(아웃링크)로 이동해 볼 수 있습니다.서정희 딸 서동주, 이렇게 예뻤나김생민 근황은?…박명수 예언 발언 ""소름 돋네""정려원 고백, '불같았던' 열애 상대 누구?엄지원 남편, 엄친아에 빌딩 부자…엄지원 부친은 '더 대박'홍수아 올 망사?…'이쯤되면 대륙여신'"
아시아경제,015860,/news/news_read.nhn?article_id=0003605002&office_id=277&mode=search&query=일진홀딩스&page=1,2015-10-16 17:18,"일진홀딩스, 아이제이 자회사 편입",[아시아경제 김유리 기자] 일진홀딩스는 16일 아이텍의 인적분할 신설법인인 아이제이를 자회사로 편입했다고 공시했다. 편입 후 일진홍딩스의 자회사 총 수는 8곳이다.
서울경제,015860,/news/news_read.nhn?article_id=0002805657&office_id=011&mode=search&query=일진홀딩스&page=1,2016-03-07 10:03,"일진홀딩스, 주력 자회사의 실적 개선 및 성장 지속 전망- IBK 투자증권","일진홀딩스(015860)가 주력 자회사들의 실적 개선 및 사업 성장으로 올해 수익성이 개선될 것이라는 전망이 나왔다. IBK투자증권은 7일 보고서를 통해 “자회사인 일진전기(103590)의 수주잔고가 5,000억원 대로 예년 수준을 회복함에 따라 매출 증가를 기대할 수 있는 모멘텀을 확보했다”고 분석했다. 일진전기는 일진홀딩스 연결 매출의 80%를 차지하는 주요 자회사다. 김장원 IBK투자증권 연구원은 “제품 단가에 영향을 미치는 구리 가격도 오름세를 나타내고 있어 올해 수익 개선을 기대할 수 있을 전망”이라고 말했다. 김 연구원은 일진홀딩스의 또 다른 자회사인 알파니언의 성장세도 주목할 만한 투자 포인트라고 지목했다. 그는 알파니언에 대해 “초음파진단기를 시작으로 초음파치료기까지 개발해 국내는 물론 유럽CE 인증도 받아 연간 600억원대의 매출을 기록했다”며 “지금까지 의료장비가 주력이었다면 2년정도가 지난 뒤에는 치매진단키트를 생산하는 헬스케어전문업 체로 사업영역이 확대될 예정”이라고 설명했다."
이데일리,015860,/news/news_read.nhn?article_id=0003372675&office_id=018&mode=search&query=일진홀딩스&page=1,2015-10-20 09:10,"[특징주]일진홀딩스, 자회사 성장 기대감에 '나흘째 상승'","[이데일리 박기주 기자] 일진홀딩스(015860)가 자회사 성장에 따른 실적 개선 기대감에 연일 상승세다. 20일 오전 9시6분 현재 일진홀딩스의 주가는 전날보다 4.23% 상승한 1만3550원을 기록하고 있다. 지난 15일 이후 나흘째 상승세다. 오진원 하나금융투자 연구원은 “일진홀딩스의 주가는 단기간 변동성은 심화됐지만 그룹의 실적 개선 방향성에는 변함이 없다”며 “일진다이아와 알피니언의 폭발적 순익 성장 등으로 인해 홀딩스의 올해 지배순익은 209억원으로 지난해보다 54.1% 증가할 것”이라고 내다봤다. 그는 “내년에도 실적 성장세는 이어질 전망”이라며 “우선 일진다이아의 100% 자회사인 일진복합소재 매출 성장과 흑자전환에 따른 실적이 예상되고, 알피니언은 음파 진단기 매출 성장과 초음파치료기(HIFU) 매출이 본격화될 것“이라고 설명했다."
머니투데이,015860,/news/news_read.nhn?article_id=0004023770&office_id=008&mode=search&query=일진홀딩스&page=1,2018-03-15 18:52,"일진홀딩스, 작년 영업손 740만원&hellip;적자전환","[머니투데이 권혜민 기자] 일진홀딩스는 지난해 연결기준 영업손실이 740만원으로 전년대비 적자전환했다고 15일 공시했다. 매출액은 전년대비 10.8% 늘어난 9억4120만원을 기록했고 당기순손실은 3090만원으로 적자폭이 170% 확대됐다. 회사 측은 ""경기 악화에 다른 자회사의 순이익이 감소했다""고 설명했다."
서울경제,015860,/news/news_read.nhn?article_id=0002863280&office_id=011&mode=search&query=일진홀딩스&page=1,2016-07-29 16:03,"일진홀딩스 &ldquo;자회사 알피니언메디칼시스템, 250억원 규모 전환사채 발행&rdquo;",일진홀딩스(015860)가 29일 자회사인 알피니언메디칼시스템이 250억원 규모의 전환사채(CB)를 발행했다고 공시했다. CB 인수인은 국내 경영참여형 사모펀드(PEF)인 스틱인베스트먼트다.
한국경제,015860,/news/news_read.nhn?article_id=0003693469&office_id=015&mode=search&query=일진홀딩스&page=1,2016-12-01 07:39,"&quot;일진홀딩스, 실적부진에 목표가&darr;&hellip;내년 개선 기대&quot;-현대","[ 채선희 기자  ] 현대증권은 1일 일진홀딩스에 대해 2분기 연속 시장 기대치를 밑도는 실적을 내놨다며 목표주가를 1만5000원에서 1만원으로 내려잡았다. 투자의견 매수를 유지했다. 전용기 연구원은 ""2, 3분기 자회사들의 실적 부진 지속으로 주가 하락이 지속되고 있다""며 ""실적 전망치 하향을 반영해 목표주가를 내려잡았다""고 말했다. 일진홀딩스의 자회사 알피니언메디칼시스템은 기대치에 부합하는 매출성장을 나타냈으나, 수익성 개선이 지연됐다. 일진전기와 일진다이아 역시 부진한 실적을 기록해 일진홀딩스의 실적은 예상을 크게 밑돌았다. 이 영향으로 주가는 큰 폭의 조정을 보이는 상황이다. 다만 전 연구원은 자회사들의 실적이 4분기부터 개선돼 내년에는 일진홀딩스의 실적이 턴어라운드할 것으로 내다봤다. 먼저 일진전기와 이린다이아의 북미법인은 트럼프의 인프라정책 수혜가 기대된다는 분석이다. 일진전기의 100% 자회사인 북미법인은 전력선을 수주한 트랙레코드를 보유하고 있어 트럼프 정책의 직접적인 수혜가 가능하기 때문이다. 일진다이아의 북미법인 역시 미국의 인프라투자 확대로 산업용 다이아몬드 수요 증가가 예상된다고 봤다. 그는 알피니언메디칼시스템의 경우 4분기 매출액은 320억원, 영업이익 48억원으로 흑자전환이 기대된다고 설명했다. 내년에도 10%대의 매출 성장은 충분히 가능하며, 치매 진단키드 등과 같은 영역의 확장을 통해 성장을 시도하고 있는 점이 긍정적이라는 분석이다. 채선희 한경닷컴 기자"
머니투데이,015860,/news/news_read.nhn?article_id=0003719440&office_id=008&mode=search&query=일진홀딩스&page=1,2016-07-29 16:08,일진홀딩스 &quot;자회사가 250억 규모 전환사채 발행&quot;,[머니투데이 김세관 기자] 일진홀딩스는 29일 자회사인 알피니언메디칼시스템이 250억원 규모의 전환사채를 발행키로 했다고 공시했다. textlinktopstart textlinktopend textlinkstart
머니투데이,015860,/news/news_read.nhn?article_id=0003782183&office_id=008&mode=search&query=일진홀딩스&page=1,2016-12-01 07:43,"일진홀딩스, 내년 턴어라운드 기대 목표가는 낮춰-현대","[머니투데이 김은령 기자] 현대증권은 1일 일진홀딩스에 대해 ""2,3분기 자회사들의 실적 부진으로 주가 하락이 지속됐지만 내년 실적 성장 가능성이 매우 높다""고 분석했다. 다만 올해 실적 전망 하향 조정을 반영해 목표주가는 10만원으로 낮췄다. 투자의견은 매수를 유지했다. 전용기 현대증권 연구원은 ""알파니언메디칼시스템은 기대치를 부합하는 매출성장을 이뤘지만 수익성 개선이 지연됐고 일진전기와 일진다이아는 부진한 실적을 기록함으로써 일진홀딩스는 2분기 연속 시장 기대치를 크게 밑도는 실적을 기록했다""고 설명했다. 그러나 ""4분기 계절적 성수기와 해외 기성 증가로 흑자전환이 기대된다""며 긍정적인 전망을 내놨다. 전 연구원은 ""일진전기의 100% 자회사인 북미법인은 전력선을 수주한 트랙레코드를 보유하고 있어 트럼프 인프라 투자정책의 직접적인 수혜가 가능하고 일진다이아의 북미법인도 인프라투자 확대로 산업용 다이아몬드 수요 증가가 예상돼 수혜가 기대된다""고 강조했다. 알파니언메디칼시스템은 올해 성장률이 12%로 과거에 비해 낮아질 전망이지만 수익성 개선 등 실적 개선 국면에 진입했다는 평가다. textlinktopstart textlinktopend textlinkstart"
