source,symbol,link,date,title,content
이데일리,015860,/news/news_read.nhn?article_id=0003493179&office_id=018&mode=search&query=일진홀딩스&page=1,2016-03-07 07:55,"일진홀딩스, 안정성&middot;성장성 겸비한 기업으로 진화-IBK","[이데일리 이재호 기자] IBK투자증권은 7일 일진홀딩스(015860)가 올해 알피니언 등 계열사들의 성장세에 힘입어 호실적을 거둘 것으로 전망하며 투자의견 ‘매수’, 목표주가 1만8000원으로 유지했다. 김장원 IBK투자증권 연구원은 “일진홀딩스에 관심을 갖는 가장 큰 이유는 주력사업의 안정성과 신성장동력의 성장성 때문”이라며 “예상한대로 성장의 기틀을 마련해 작년보다 올해, 올해보다 내년이 더 기대되는 기업으로 변화되고 있다”고 말했다. 김 연구원은 “지난해 연결기준 602억원, 영업이익 14억원을 기록한 자회사 알피니언은 올해 초음파진단기 제품라인업 확대와 초음파치료기 판매 증가로 실적 개선이 기대된다”며 “2년 뒤에는 치매진단키트를 생산하는 헬스케어 전문업체로 사업영역이 확대될 예정”이라고 분석했다. 김 연구원은 “지주회사 연결 매출의 80%를 차지하는 일진전기(103590)는 지난해 수주잔고 부족에서 벗어나고 구리가격 상승으로 수익 개선이 기대된다”며 “괄목할 만한 영업이익 성장을 기록한 일진다이아(081000)몬드는 부가가치가 높은 제품의 매출 비중 확대로 지난해 이상의 수익성을 유지할 것”이라고 평가했다."
이데일리,015860,/news/news_read.nhn?article_id=0003369184&office_id=018&mode=search&query=일진홀딩스&page=1,2015-10-15 08:32,"일진홀딩스, 3Q 부진 4Q 만회-현대","[이데일리 정병묵 기자] 현대증권은 15일 일진홀딩스(015860)에 대해 3분기 실적은 시장 컨센서스를 하회할 전망이나 4분기에 이를 만회할 것이라며 투자의견 매수, 목표주가 2만3000원을 유지했다. 전용기 현대증권 연구원은 “3분기 일진전기(103590)가 동가격 하락과 해외 기성 감소로 예상치를 하회, 시장 컨센서스를 하회할 것”이라며 “3분기 일진홀딩스의 매출은 2250억원, 영업이익은 82억원, 지배주주순이익은 25억원을 기록할 것”이라고 밝혔다. 이어 “그러나 알피니언메디칼시스템의 매출은 전년 동기 대비 50% 성장한 120억원은 충분히 달성했을 것으로 전망되며, 일진다이아 또한 신규 영역개척으로 전년 동기 대비 700% 성장한 42억원의 영업이익을 달성했을 것으로 예상된다”며 “4분기에는 3분기에 하회했던 실적을 상당부분 만회할 가능성이 높다”고 전했다."
한국경제TV,015860,/news/news_read.nhn?article_id=0000437498&office_id=215&mode=search&query=일진홀딩스&page=1,2016-02-19 11:07,[스몰캡 관심주] 이엠텍(091120)&middot;일진홀딩스(015860),"[굿모닝 투자의 아침] 스몰캡 관심주 출연 : 이수철 메리츠종금증권 여의도금융센터 이사 이엠텍(091120) - 스마트폰 스피커, 리시버 제조기업 - 바이오테크놀러지 시장 진출 기대 - 매출 구성 엔클로저 36% 동전형 리시버 41% 마이크로 스피커  15% 모터 6% 기타 2% 투자 포인트 - 신기술 개발 ▷ BA스피커 개발완료, 하반기 양산 예정 ▷ 보청기 전문 기업 `바이오사운드랩` 에 지분 투자 - 신제품 효과 ▷ 작년 말, 음향기기 신제품 출시 - 안정적 매출처 확보 - 탄탄한 재무구조 ▷ 2015년 말 기준 부채비율 67% ▷ 순 현금 430억 보유 중 가격전략 - 매수가 : 현재가 목표가 : 15,000원 손절가 : 10,000원 일진홀딩스(015860) - 1982년 일진전기로 설립 - 2008년 지주사로 전환 - 지분법 이익, 배당수익, 브랜드 로열티 수취 지주사. - 매출 구성 배당금수익 57.14% 브랜드수익 42.45% 용역매출 0.41% 투자포인트 - 일진전기 : 전기, 전선 전문업체 ▷ 전선사업부, 전력시스템사업부 `국내 3위권 업체` ▷ 해외 수주 극대화 + 제품 경쟁력 제고 ▷ 일진전기, 유럽·중남미서 전력 프로젝트 진행 - 일진다이아몬드 ▷ 공업용 합성다이아몬드 제조, 판매 - 공업용 다이아몬드 85.50% 초경합금제품 14.50% - 세계시장 점유율 약 18% 수준 - 소결체 수요 증가 추세화 - 일진복합소재 ▷ CNG·수소연료탱크 및 매연저감장치 제조 ▷ 정부 정책 수혜로 안정적 성장 중 - 알피니언메디칼시스템 ▷ 초음파 진단기, 제품 라인업 8개로 확대 중 ▷ 자궁근종 치료기 유럽인증 ▷ 자궁근종 치료기 중국 진출 기대 ▷ 치료 적응 부위 확대 기대 ▷ KIST 치매 조기진단기술, 일진그룹에 이전 ▷ 치매 조기진단, 3년 내 상용화 전망 가격전략 - 10,000 ~ 12,000원 박스권 등락 중 - 목표가 : 14,000원 [자세한 내용은 동영상을 참고하세요] ★ 굿모닝 투자의 아침, 평일 오전 07시~08시30분 LIVE ⓒ 한국경제TV, 무단 전재 및 재배포 금지 한국경제TV 관련뉴스해당 언론사에서 선정하며 언론사 페이지(아웃링크)로 이동해 볼 수 있습니다.성현아 '성매매 사건' 파기환송 '반전이야'...소름 돋네딴따라 박보검 '귀여움의 극치'...""위화감 제로 배우""추적60분 윤기원 '분노와 경악'...죽음의 실체 논란수요미식회 ""f(x)루나 순대 가게 어디지?""...맛집 '추천이요'프로듀스101 전소미 ""이런 미모 처음이야""..개성미 '대박'"
매일경제,015860,/news/news_read.nhn?article_id=0003847386&office_id=009&mode=search&query=일진홀딩스&page=1,2016-12-01 08:29,"[Hot-Line]&quot;일진홀딩스, 트럼프 정책으로 자회사 수혜전망&quot;","현대증권은 일진홀딩스에 대해 내년 트럼프 정책으로 인한 수혜가 예상된다고 1일 밝혔다. 전용기 현대증권 연구원은 “2~3분기 자회사들의 실적 부진이 지속됐다”며 “일진전기·일진다이아 실적은 부진했고 알피니언메디칼시스템은 기대에 부합하는 매출성장을 이뤘지만 수익성 개선이 지연됐다”고 설명했다. 하지만 전 연구원은 자회사들이 트럼프 정책으로 인해 수혜를 볼 것으로 전망했다. 그는 “일진전기의 100% 자회사인 북미법인은 전력선을 수주한 트랙레코드를 보유하고 있어 트럼프 인프라 투자정책의 직접적인 수혜가 예상된다”며 “일진다이아의 북미법인도 인프라투자 확대로 산업용 다이아몬드 수요 증가가 예상돼 수혜가 기대된다”고 말했다. 알피니언메디칼시스템에 대해서는 “올해 매출성장률은 12%로 과거에 비해 다소 낮아질 전망이나 4분기 실적은 매출 320억원, 영업이익 48억원으로 흑자전환을 이룰 것”이라고 내다봤다. [디지털뉴스국 윤호 기자] r_start // r_end //"
파이낸셜뉴스,015860,/news/news_read.nhn?article_id=0003870587&office_id=014&mode=search&query=일진홀딩스&page=1,2017-09-07 10:43,"[fnRASSI]일진홀딩스, 4.99% 오르며 거래량 증가","일진홀딩스(015860)의 현재 거래량이 최근 5거래일 거래량의 최고치를 넘어서며 투자자들의 관심을 받고 있다. 그리고 일진홀딩스는 3일 연속 상승흐름을 보이며, 10시 36분 현재 4.99% 증가한 6,100원에 거래중이다. 개인투자자의 거래비중이 가장 높아 최근 한달간 주체별 거래비중을 살펴보면 개인이 전체 거래량의 91.64%를 차지하며 가장 활발한 참여를 보였고, 외국인은 7.59%, 기관은 0.75%의 거래 참여율을 보였다. 그리고 최근 5일간 거래비중은 개인이 전체 거래량의 93.24%를 차지하며 가장 활발한 참여를 보였고, 외국인은 5.84%, 기관은 0.91%의 거래 참여율을 보였다. 기관/개인 순매수, 외국인은 순매도(한달누적)  9월5일부터 전일까지 기관이 2거래일 연속 순매수했다. 4주간을 기준으로 보면 기관이 매매관점을 매도에서 매수로 전환하면서 12,959주를 순매수했고, 개인들도 방향성있는 매매를 하면서 82,460주를 순매수했다. 반면 그 동안 외국인은 매도쪽으로 방향을 잡으면서 95,419주를 순매도했다. 'fnRASSI'는 증권전문 기업 씽크풀과 파이낸셜뉴스의 협업으로 로봇기자가 실시간으로 생산하는 기사입니다."
이데일리,015860,/news/news_read.nhn?article_id=0003476393&office_id=018&mode=search&query=일진홀딩스&page=1,2016-02-16 07:25,일진홀딩스. 치매진단키트가 새로운 성장동력-현대,[이데일리 박형수 기자] 현대증권은 1일 일진홀딩스(015860)에 대해 치매진단키트가 새로운 성장동력이 될 것으로 내다봤다. 투자의견 ‘매수’와 목표주가 2만3000원을 유지했다. 전용기 현대증권 연구원은 “치매진단용 키트는 한국과학기술연구원(KIST) 뇌과학연구소에서 2013년부터 개발을 시작했다”며 “임상에서 좋은 결과를 얻은 기술”이라고 설명했다. 그는 이어 “일진홀딩스 계열사인 알피니온메디칼시스템은 치매진단용 나오바이오센서 기술을 이전받았다”고 덧붙였다. 아울러 “상업화를 위한 절차를 내년까지 진행한다”며 “1회 검진 비용은 5만원으로 50대 이상 건강검진 인구수 기준으로 국내시장 규모만 연간 5000억원에 달한다”고 강조했다. 전 연구원은 “조기발견으로 치매 발현까지 5년을 늦추면 사회적 비용 12조원을 줄일 수 있다는 연구결과가 있어 조기 상용화 가능성도 있다”고 분석했다. 그는 “내년 하반기부터는 국내에서 매출이 발생할 것”이며 “유럽에서 인증을 받은 후 2018년 하반기부터는 해외 매출도 발생할 것으로 기대한다”고 말했다.
연합뉴스,015860,/news/news_read.nhn?article_id=0008215776&office_id=001&mode=search&query=일진홀딩스&page=1,2016-02-26 18:04,"일진홀딩스, 작년 연결 영업익 311억원&hellip;25%&darr;",(서울=연합뉴스) 유현민 기자 = 일진홀딩스는 연결 기준 지난해 영업이익이 310억7천만원으로 전년보다 25.4% 줄었다고 26일 공시했다. 매출액은 8천920억9천만원으로 4.2% 감소했으나 당기순이익은 241억7천만원으로 17.8% 늘었다.
한국경제TV,015860,/news/news_read.nhn?article_id=0000478087&office_id=215&mode=search&query=일진홀딩스&page=1,2016-07-08 15:24,[증시라인14] 7/8 종목대결 &lt;AP시스템 VS 일진홀딩스 &gt;,[증시라인14] 앵커:김용필·하경민 출연:이동현 한화투자증권 송파지점 과장 송영기 메리츠종금증권 광화문금융센터 대리 관심 종목 이동현 과장은 일진홀딩스 송영기 대리는 AP시스템 [자세한 내용은 동영상을 참고하세요] ★ 증사라인14 매일 오후 2시 ~ 2시 50분 LIVE
아시아경제,015860,/news/news_read.nhn?article_id=0003882469&office_id=277&mode=search&query=일진홀딩스&page=1,2016-12-01 07:54,"[클릭 e종목]일진홀딩스, 2분기 연속 실적 부진&hellip;목표가&darr;","[아시아경제 박나영 기자]현대증권은 일진홀딩스에 대해 2분기 연속 실적이 부진했다며 목표주가를 1만5000원에서 1만원으로 하향조정했다. 투자의견은 ‘매수’를 유지했다. 1일 전용기 현대증권 연구원은 “자회사 일진전기와 일진다이아가 부진한 실적을 기록하면서 일진홀딩스는 2분기 연속 시장기대치를 크게 밑도는 실적을 기록했다”고 분석했다. 그러나 일진전기와 일진다이아가 도널드 트럼프 미국 대통령 당선인의 인프라정책 수혜를 입을 것이라는 긍정적인 전망도 내놨다. 전용기 연구원은 ""중동발 신규수주 감소와 국내 전력선 투자 감소 등으로 부진했던 해외 기성 증가로 흑자전환할 것으로 기대된다""고 말했다. 일진전기의 북미법인은 전력선을 수주한 트랙레코드를 보유하고 있어 인프라 정책의 직접적 수혜가 가능하고, 일진다이아의 북미법인 또한 산업용 다이아몬드 수요 증가가 예상돼 수혜를 받을 것이라는 설명이다. 알피니언메디칼시스템에 대해서도 4분기 매출액 320억원, 영업이익 48억원으로 흑자전환이 기대된다고 예상했다. 전용기 연구원은 ""내년에도 10%대의 매출 성장이 예상되며 치매 진단키드 등과 같은 영역의 확장을 통해 성장을 시도하고 있는 점이 긍정적""이라고 분석했다."
한국경제,015860,/news/news_read.nhn?article_id=0003452213&office_id=015&mode=search&query=일진홀딩스&page=1,2015-10-15 07:42,"일진홀딩스, 3분기보다 4분기 실적 개선에 '주목'-현대","[ 이민하 기자  ] 현대증권은 15일 일진홀딩스에 대해 3분기보다 4분기 실적 개선에 주목해야 한다며 투자의견 '매수'와 목표주가 2만3000원을 유지했다. 전용기 현대증권 연구원은 ""3분기 실적은 일진전기의 실적이 동가격 하락과 해외 기성 감소로 부진, 시장 기대치를 밑돌 것""이라며 ""매출은 2250억원으로 전년 대비 4.5% 감소, 영업이익은 83억원으로 69.4% 증가한 수준일 것""이라고 내다봤다. 일진홀딩스의 3분기 실적에 대한 시장 평균 추정치(컨센서스)는 매출액 2440억원, 영업이익 100억원 수준이었다. 그러나 계열사들의 실적 개선세를 고려하면 4분기 실적은 3분기 부진을 상당 부분 만회할 가능성이 높다는 예상이다. 전 연구원은 ""알피니온메디칼시스템의 매출은 전년 대비 50% 증가한 120억원, 일진다이아의 영업이익 또한 신규 영역 개척으로 700% 늘어난 42억원을 기록할 것""이라고 전망했다. 일진다이아는 100% 자회사인 일진복합소재의 실적 기여율이 점차 높아질 것이라는 설명이다. 일진복합소재는 수소연료차 탱커 생산을 주력 사업으로 하고 있다. 알피니온의 경우는 초음파 치료기 사업에 대한 기대감이 유효하다는 분석이다. 전 연구원은 ""알피니온의 신제품인 자궁 근종 초음파 치료기의 유럽 CE 인증이 진행 중으로 인증이 완료되면 유럽과 중국, 동남아 등에서 판매가 가능하다""며 ""(해외 판매에 성공한다면) 알피니온의 내년 순이익 기준 기업가치는 주가수익비율(PER) 30배 적용, 최소 5400억원에서 8500억원(PER 50배)에 달할 수 있다""고 말했다. 이민하 한경닷컴 기자"
아시아경제,015860,/news/news_read.nhn?article_id=0003607363&office_id=277&mode=search&query=일진홀딩스&page=1,2015-10-20 17:47,"일진홀딩스, 자회사인 알피니언&middot;아이제이 합병","[아시아경제 김민영 기자]일진홀딩스는 자회사인 알피니언메디칼시스템이 계열사인 아이제이를 흡수합병 한다고 20일 공시했다. 알피니언과 아이제이의 합병비율은 1:2.2118681이다. 회사 측은 ""재무구조 개선을 통한 기업가치 제고를 위해 합병을 추진했다""고 설명했다."
이데일리,015860,/news/news_read.nhn?article_id=0003476522&office_id=018&mode=search&query=일진홀딩스&page=1,2016-02-16 09:10,"[특징주]일진홀딩스, 이틀째 상승&hellip;'치매진단키트 기대감'",[이데일리 임성영 기자] 일진홀딩스(015860)가 상승세다. 치매진단키트가 새로운 성장동력이 될 것이란 분석이 주가에 영향을 주는 모습이다. 16일 오전 9시 8분 현재 일진홀딩스는 전일대비 2.68% 오른 1만1400원에 거래되고 있다. 이틀 연속 강세다. 전용기 현대증권 연구원은 “치매진단용 키트는 한국과학기술연구원(KIST) 뇌과학연구소에서 2013년부터 개발을 시작했다”며 “임상에서 좋은 결과를 얻은 기술”이라고 설명했다. 그는 이어 “일진홀딩스 계열사인 알피니온메디칼시스템은 치매진단용 나오바이오센서 기술을 이전받았다”고 덧붙였다. 아울러 “상업화를 위한 절차를 내년까지 진행한다”며 “1회 검진 비용은 5만원으로 50대 이상 건강검진 인구수 기준으로 국내시장 규모만 연간 5000억원에 달한다”고 강조했다. 전 연구원은 “조기발견으로 치매 발현까지 5년을 늦추면 사회적 비용 12조원을 줄일 수 있다는 연구결과가 있어 조기 상용화 가능성도 있다”고 분석했다. 그는 “내년 하반기부터는 국내에서 매출이 발생할 것”이며 “유럽에서 인증을 받은 후 2018년 하반기부터는 해외 매출도 발생할 것으로 기대한다”고 말했다
서울경제,015860,/news/news_read.nhn?article_id=0002863283&office_id=011&mode=search&query=일진홀딩스&page=1,2016-07-29 16:09,"일진홀딩스 &ldquo;자회사 알피니언메디칼시스템, 10억원 규모 유증 결정&rdquo;",일진홀딩스(015860)가 29일 자회사인 알피니언메디칼시스템의 10억원 규모 제3자 배정 방식 유상증자를 결정했다고 공시했다. 신주 배정 대상은 한국과학기술연구원으로 20만주를 취득하게 된다.
한국경제TV,015860,/news/news_read.nhn?article_id=0000379960&office_id=215&mode=search&query=일진홀딩스&page=1,2015-10-20 16:02,"[특징주] 일진홀딩스, 자회사 성장 기대감 '상승'","일진홀딩스가 자회사 성장에 따른 실적 개선 기대감에 연일 상승하며 장을 마감했습니다. 20일 일진홀딩스의 주가는 전날보다 250원, 1.92% 상승한 1만3,250원에 거래를 마쳤습니다. 증권금융업계에서는 일진홀딩스의 일진다이아와 알피니언의 순이익 성장세로 인해, 홀딩스의 올해 지배순익은 작년 대비 54.1% 증가할 것이라고 밝혔습니다."
뉴시스,015860,/news/news_read.nhn?article_id=0008351470&office_id=003&mode=search&query=일진홀딩스&page=1,2017-12-19 18:33,"거래소, 일진홀딩스 불성실공시법인 지정예고",【서울=뉴시스】이진영 기자 = 한국거래소는 자회사의 주요 경영 사항을 지연공시 한 일진홀딩스(015860)를 불성실공시법인으로 지정예고한다고 19일 공시했다.
서울경제,015860,/news/news_read.nhn?article_id=0003188412&office_id=011&mode=search&query=일진홀딩스&page=1,2018-01-03 14:58,"(유)일진홀딩스, 전일 대비 13.93% 상승.. 일일회전율은 4.41% 기록","[서울경제] 일진홀딩스(015860) 는 3일 오후 2시 56분 현재 13.93% 오른 5,890원에 거래되고 있으며, 47(매도):53(매수)의 매수우위를 기록하고 있다. 거래대금은 123억7,797만, 거래량은 217만8,490주로 거래량회전율은 4.41%로 나타났다. 지난 1개월간 일진홀딩스는 상승 15회, 하락 15회를 기록했고, 주가수익률은 1.38% 표준편차는 2.31%를 기록했다. 이 기간 ' 금융업 ' 업종 평균 주가수익률은 -0.31%로 나타났으며, 변동성은 0.74%를 기록했다. 이 시각 현재 ' 금융업 '은 0.30% 상승 중이며, 59(매도):41(매수)의 매도우위를 기록하고 있다."
서울경제,015860,/news/news_read.nhn?article_id=0003225689&office_id=011&mode=search&query=일진홀딩스&page=1,2018-02-19 17:21,"일진홀딩스, 자회사 영업손실 80% 커져","[서울경제] 코스피 상장사인 일진홀딩스(015860) 는 19일 자회사인 알피니언메디칼시스템이 지난해 개별기준 영업손실이 166억원으로 전년보다 적자 규모가 79.2% 확대됐다고 19일 공시했다. 매출액은 470억원으로 7.7% 감소했고 당기순손실은 206억원으로 적자 폭이 36.6% 커졌다. 회사는 신제품 출시 지연으로 매출이 이월되고, 개발비 등 투자 증대로 비용이 늘었으며 해외 지적 재산권 관련 수수료가 증가했다고 설명했다."
머니투데이,015860,/news/news_read.nhn?article_id=0003583704&office_id=008&mode=search&query=일진홀딩스&page=1,2015-11-23 08:47,"일진홀딩스, 자회사 실적 힘입어 4분기 성장 기대-현대","[머니투데이 한은정 기자] 현대증권은 23일 일진홀딩스에 대해 ""자회사 실적에 힘입어 4분기부터 성장추세는 지속될 것""이라며 투자의견 '매수'와 목표주가 2만3000원을 유지했다. 전용기 연구원은 ""4분기는 일진전기의 성수기 진입에 따른 실적개선과 알피니온메디칼시스템의 고성장에 힙입어 부진했던 3분기와는 달리 250억원 이상의 영업이익 달성이 가능것""이라고 전망했다. 전 연구원은 ""3분기 알피니온메디칼시스템은 영업적자를 기록했으나 4분기 판매증진을 위한 마케팅 비용 및 딜러 인센티브 지급 등의 영향으로 그 효과가 4분기에 나타날 것으로 기대된다""고 설명했다. 이어 ""알피니온메디칼시스템은 4분기 연결매출이 전년대비 63% 증가한 364억원, 영업이익은 61% 증가한 103억원(YoY +61%) 달성이 유력시된다""고 말했다. textlinktopstart textlinktopend textlinkstart"
머니투데이,015860,/news/news_read.nhn?article_id=0003643824&office_id=008&mode=search&query=일진홀딩스&page=1,2016-03-08 17:20,"일진홀딩스, 보통주 1주당 70원 현금배당","[머니투데이 박종진 기자] 일진홀딩스가 결산배당으로 보통주 1주당 70원의 현금배당을 결정했다고 8일 공시했다. 시가 배당률은 0.6%, 배당금 총액은 약 32억원이다. 배당금은 상법에 따라 정기주주총회일인 이달 25일 이후 1개월 이내에 지급될 예정이다. textlinktopstart textlinktopend textlinkstart"
아시아경제,015860,/news/news_read.nhn?article_id=0003702627&office_id=277&mode=search&query=일진홀딩스&page=1,2016-03-08 17:31,"일진홀딩스, 주당 70원 현금배당",[아시아경제 송화정 기자]일진홀딩스는 보통주 1주당 70원의 현금배당을 결정했다고 8일 공시했다.
연합뉴스,015860,/news/news_read.nhn?article_id=0009061097&office_id=001&mode=search&query=일진홀딩스&page=1,2017-02-24 09:24,"[특징주] 일진홀딩스, 작년 실적 부진에 하락","(서울=연합뉴스) 유현민 기자 = 일진홀딩스가 지난해 실적 부진의 영향으로 24일 장 초반 약세를 보이고 있다. 이날 오전 9시 21분 현재 유가증권시장에서 일진홀딩스는 전날보다 5.73% 떨어진 5천430원에 거래됐다 일진홀딩스는 작년 연결기준 영업이익이 전년보다 92.4% 감소한 23억원으로 잠정 집계됐다고 전날 장 종료 후 공시했다. 당기순익은 75억원 손실로 적자 전환했고, 매출은 8천494억원으로 4.7% 줄었다."
머니투데이,015860,/news/news_read.nhn?article_id=0003980895&office_id=008&mode=search&query=일진홀딩스&page=1,2017-12-19 11:53,"허정석 일진홀딩스 대표, 일진그룹 부회장 승진","[머니투데이 지영호 기자] 허정석 일진그룹 신임 부회장./사진=일진그룹 허정석(48) 일진홀딩스 대표가 일진그룹 부회장으로 승진했다. 일진그룹은 19일 내년 1월1일부로 승진 25명, 전보 4명의 정기 임원 인사를 단행한다고 밝혔다. 이번 인사로 허정석 일진홀딩스 대표는 11개 주요 계열사가 있는 일진그룹 부회장으로 승진했다. 허 부회장은 허진규 일진그룹 회장의 장남이다. 일진머티리얼즈 를 차세대 전기차 배터리 핵심 소재기업으로 견인한 주재환 부사장과 그룹 경영전략과 운영을 담당한 성경현 부사장은 각각 사장으로 승진했다. 이 외에도 김기현 일진다이아몬드 대표가 전무에서 부사장으로, 정길수 일진머티리얼즈 전무가 부사장으로 승진했다. 일진그룹 측은 ""창립 50주년을 맞이하는 내년을 앞두고 부진의 늪을 벗어나 실적이 호전됨에 따라 최대 규모의 승진을 단행했다""고 밝혔다. 일진그룹은 1968년 설립한 이후 일진머티리얼스를 주축으로 사상 최대 시가총액을 기록 중이다."
서울경제,015860,/news/news_read.nhn?article_id=0003326189&office_id=011&mode=search&query=일진홀딩스&page=1,2018-06-19 13:49,"&lt;유&gt;일진홀딩스, 장중 신저가 기록.. 4,780&rarr;4,650(▼130)","[서울경제] 오후 1시 46분 현재 일진홀딩스(015860) 가 3.93% 내린 4,650원(▼190)을 기록하며, 52주 신저가를 -130원 경신했다. 기존 52주 최저가는 2018년 03월 26일 기록한 4,780원이다. 체결강도는 13%로 강세 반전했다. 총매수체결량은 11,580주, 총매도체결량은 86,544주를 각각 기록했다.  (※ 체결강도(%) = (총매수체결량/총매도체결량)*100) 이 시각 현재 거래대금은 4억7,409만, 거래량은 10만505주를 기록하고 있으며, 수급측면으로는 88(매도):12(매수)의 매도우위를 보이고 있다. 거래일을 기준으로 최근 3일간 평균 거래량은 7만2천주, 60일 평균 거래량 1십만7천주로 최근 거래량이 큰 폭으로 감소하는 추세다."
