source,symbol,link,date,title,content
서울경제,016790,/news/news_read.nhn?article_id=0003367172&office_id=011&mode=search&query=현대사료&page=1,2018-08-08 10:51,"&lt;코&gt;현대사료, 전일 대비 7.60% 상승.. 일일회전율은 2.58% 기록","[서울경제] 현대사료(016790) 는 8일 오전 10시 50분 현재 7.60% 오른 28,300원에 거래되고 있으며, 30(매도):70(매수)의 매수우위를 기록하고 있다. 거래대금은 43억3,686만, 거래량은 15만8,524주로 거래량회전율은 2.58%로 나타났다. 지난 1개월간 현대사료는 상한가 1회, 상승 9회, 하락 20회를 기록했고, 주가수익률은 14.11% 표준편차는 8.14%를 기록했다. 이 기간 ' 음식료·담배업 ' 업종 평균 주가수익률은 -10.19%로 나타났으며, 변동성은 1.75%를 기록했다. 이 시각 현재 ' 음식료·담배업 '은 0.35% 상승 중이며, 46(매도):54(매수)의 매수우위를 기록하고 있다."
아시아경제,016790,/news/news_read.nhn?article_id=0004296180&office_id=277&mode=search&query=현대사료&page=1,2018-08-16 09:26,"[특징주]'새내기' 대유, 공모가 5배 뛴 현대사료 따라가나&hellip;랠리","[아시아경제 유현석 기자] 대유가 급등하고 있다. 문재인 대통령이 동아시아 철도공동체를 제안했다는 소식으로 인해 남북경협 기대감이 영향이 나타나고 있는 것으로 보인다. 현대사료도 상장 초기에는 남북경협주로 묶기면서 주가가 급등한 바 있다. 대유는 16일 오전 9시25분 현재 전거래일 대비 2200원(15.83%) 오른 1만6100원에 거래되고 있다. 현대사료도 2% 가까이 오름세다. 현대사료의 경우 공모가 6600원에서 지난 6월 장 중 3만9350원까지 오르기도 했다. 문재인 대통령은 전날 서울 용산 국립중앙박물관에서 열린 제73주년 광복절 및 제70주년 정부 수립 기념 경축식에서 ""경의선과 경원선의 출발지였던 용산에서 저는 오늘, 동북아 6개국과 미국이 함께 하는 ‘동아시아철도공동체’를 제안한다""고 말했다. 권성한 대유 대표는 지난달 개최된 기업공개(IPO) 기자간담회서 ""코스닥시장 상장을 통해 중국시장 진출을 계획하고, 남북 경제협력 이후 수혜까지 기대하고 있다""고 밝힌 바 있다. 대유는 1977년 설립된 42년 업력의 농자재 전문 기업으로 비료, 농약, 유기농업자재 사업을 주력으로 하고 있다. 비료 제품 약 1500종, 농약제품 43종, 유기농업자재 제품 56종을 보유하고 있으며, 현재 4종복합비료를 포함한 국내 엽면시비용 비료 시장점유율 1위를 기록하고 있다."
서울경제,016790,/news/news_read.nhn?article_id=0003316923&office_id=011&mode=search&query=현대사료&page=1,2018-06-08 09:57,"&lt;코&gt;현대사료, 전일 대비 7.10% 상승.. 일일회전율은 9.68% 기록","[서울경제] 현대사료(016790) 는 8일 오전 9시 56분 현재 7.10% 오른 33,200원에 거래되고 있으며, 49(매도):51(매수)의 매수우위를 기록하고 있다. 거래대금은 198억8,366만, 거래량은 59만5,097주로 거래량회전율은 9.68%로 나타났다. 지난 1개월간 현대사료는 상한가 3회, 상승 1회를 기록했고, 주가수익률은 0% 표준편차는 9.78%를 기록했다. 이 기간 ' 음식료·담배업 ' 업종 평균 주가수익률은 -2.44%로 나타났으며, 변동성은 1.54%를 기록했다. 이 시각 현재 ' 음식료·담배업 '은 0.81% 상승 중이며, 39(매도):61(매수)의 매수우위를 기록하고 있다."
아시아경제,016790,/news/news_read.nhn?article_id=0004253006&office_id=277&mode=search&query=현대사료&page=1,2018-06-07 09:13,"[특징주]현대사료, 상장 4일째도 급등&hellip;공모가 대비 5배&uarr;",[아시아경제 권성회 기자] 현대사료가 코스닥시장 상장 나흘째에도 급등하면서 공모가 대비 5배 이상 뛰어올랐다. 7일 오전 한때 현대사료는 전장 대비 24.05%(6950원) 오른 3만5850원까지 상승했다. 이는 공모가 6600원 대비 5.4배 이상 뛴 것이다. 지난 1일 상장 이후 3거래일 연속 상한가를 기록했던 현대사료는 이날도 크게 오르면서 고공행진을 펼치고 있다.
서울경제,016790,/news/news_read.nhn?article_id=0003357862&office_id=011&mode=search&query=현대사료&page=1,2018-07-26 09:52,"&lt;코&gt;현대사료, 전일 대비 7.81% 상승.. 일일회전율은 2.61% 기록","[서울경제] 현대사료(016790) 는 26일 오전 9시 51분 현재 7.81% 오른 25,550원에 거래되고 있으며, 39(매도):61(매수)의 매수우위를 기록하고 있다. 거래대금은 40억1,600만, 거래량은 16만788주로 거래량회전율은 2.61%로 나타났다. 지난 1개월간 현대사료는 상한가 2회, 상승 9회, 하락 19회를 기록했고, 주가수익률은 8.72% 표준편차는 9.96%를 기록했다. 이 기간 ' 음식료·담배업 ' 업종 평균 주가수익률은 -14.41%로 나타났으며, 변동성은 2.07%를 기록했다. 이 시각 현재 ' 음식료·담배업 '은 0.19% 상승 중이며, 41(매도):59(매수)의 매수우위를 기록하고 있다."
머니투데이,016790,/news/news_read.nhn?article_id=0004042554&office_id=008&mode=search&query=현대사료&page=1,2018-04-24 17:10,IPO 최저 밸류에이션&hellip;현대사료의 '고육지책',"[머니투데이 김도윤 기자] [지난해 AI 여파 및 거래 중단으로 매출·이익 역성장…남북 경협 기대감에도 PER 6~7배 기업가치 책정] 동물사료 전문회사 현대사료가 지난해 실적 악화를 고려해 올해 IPO(기업공개) 기업 중 가장 낮은 밸류에이션을 책정했다. 남북 관계 개선에 따라 사료 산업에 대한 기대감이 더해질 경우 밸류에이션 매력이 부각될 전망이다. 24일 증권업계에 따르면 현대사료는 코스닥 상장예비심사를 통과하고 5월 16일 수요예측에 돌입한다. 주관사는 신한금융투자다. 현대사료는 희망공모가 밴드로 5700~6600원을 제시했다. 희망공모가 밴드 기준 공모규모는 89억~103억원, 예상 시가총액은 350억~405억원이다. 이는 현대사료의 지난해 실적 기준 PER(주가수익비율) PER 6.2~7.2배다. 올해 IPO를 진행한 기업 중 가장 낮은 밸류에이션이다. 지난해 실적 악화를 고려한 공모 전략으로 풀이된다. 또 사료 업종이 증시에서 높은 밸류에이션을 인정받지 못하는 상황을 반영한 것으로 보인다. 현대사료의 지난해 매출액은 871억원, 영업이익은 41억원으로 전년대비 각각 18.1%, 20.6% 감소했다. 2015년 매출액 1252억원에서 2년 연속 외형이 줄었다. 현대사료 실적 악화는 2016년 발생한 AI(조류인플루엔자)로 인한 축산업황 부진때문이다. 또 지난해 양돈사료 주요 거래처 한 곳과 거래가 종료된 것도 영향을 미쳤다. 현대사료가 낮은 수준의 밸류에이션을 적용하면서 공모 시장에서 주목도는 높아질 것으로 관측된다. 사료 사업이 높은 성장성을 갖춘 업종은 아니지만 회사 측이 제시한 기업가치 기준으로 저평가 매력이 부각될 수 있기 때문이다. 현대사료가 생산량을 늘리고 있어 올해 실적 반등 가능성이 제기되는 점도 긍정적이다. 2016년 발생한 AI 여파가 진정되면서 축산 업황이 개선될 기미를 보이고 있기 때문이다. 또 남북 관계 개선에 따른 경제협력과 대북 지원 이슈가 부각되면서 사료 산업에 대한 기대감이 높아지고 있어 주목된다. 실제로 사료 업계에선 남북 관계 개선에 따라 교류가 재개되고 대북 지원이 현실화될 경우 수혜가 가능할 것으로 기대하고 있다. 최근 사조동아원, 선진, 팜스토리 등 사료 회사 주가가 오른 것도 눈여겨볼 부분이다. 현대사료는 수직계열화 구축, 안정적 사료 매출처 확보 등을 위해 공모자금을 농업회사법인 설립, 양돈농장 매입 등에 활용할 계획이다. 양계보다 수익성이 높은 양돈 사업을 확대하면서 외형뿐 아니라 이익률 향상에 나서겠다는 전략이다. 현대사료 관계자는 ""밸류에이션은 시장에서 평가할 문제로 공모 과정에서 보다 높은 투자 수요를 이끌어내기 위해 고민했다""며 ""상장 후 AI에 대응하고 실적 안정성을 높이기 위해 양돈 농장을 매입해 양돈 사료 매출을 늘리고 축산물 유통에도 나설 것""이라고 말했다."
파이낸셜뉴스,016790,/news/news_read.nhn?article_id=0004023975&office_id=014&mode=search&query=현대사료&page=1,2018-05-18 17:27,"현대사료, 내달 1일 코스닥 상장",신한금융투자 IPO 주관 청약예정일은 23~24일
파이낸셜뉴스,016790,/news/news_read.nhn?article_id=0004036133&office_id=014&mode=search&query=현대사료&page=1,2018-06-08 10:08,[fnRASSI]현대사료 전일대비 10% 상승,"현대사료(016790)는 현재 주가가 전일 대비 10% 상승한 34,100원 선에서 거래가 이루어지고 있다. 외국인과 기관은 순매도, 개인은 순매수(한달누적)  5월31일부터 전일까지 기관과 외국인 모두 5거래일연속 동종목을 내다 팔았다. 4주간을 기준으로 보면 외국인이 매도 관점으로 접근하면서 150,153주를 순매도했고, 기관도 매도쪽으로 방향을 잡으면서 321,818주를 순매도했지만, 개인은 오히려 471,971주를 순매수했다. 주요 투자주체는 개인투자자 최근 한달간 주체별 거래비중을 살펴보면 개인이 96.27%로 가장 높은 참여율을 보였고, 기관이 2.19%를 보였으며 외국인은 1.53%를 나타냈다. 그리고 최근 5일간 거래비중은 개인이 전체 거래의 96.27%를 차지하며 가장 적극적인 모습을 보여줬고, 기관은 2.19%를 나타냈으며 외국인은 1.53%를 나타냈다. 'fnRASSI'는 증권전문 기업 씽크풀과 파이낸셜뉴스의 협업으로 로봇기자가 실시간으로 생산하는 기사입니다."
서울경제,016790,/news/news_read.nhn?article_id=0003323440&office_id=011&mode=search&query=현대사료&page=1,2018-06-15 14:59,"&lt;코&gt;현대사료, 상한가 진입.. +30.00% &uarr;","[서울경제] 오후 2시 58분 현재 현대사료(016790) 가 +30.00% 오른 30,550원(▲7,050)으로 장중 상한가에 진입했다. 거래대금은 669억5,467만, 거래량은 243만4,839주를 기록하고 있으며, 수급측면으로는 46(매도):54(매수)의 매수우위를 보이고 있다. 현대사료는 전일 하락(23,500원, ▼-4,750, -16.81%) 마감했으나, 이 시각 현재 장중 상한가를 기록하며 강세를 보이고 있다. 지난 1개월간 현대사료는 상한가 3회, 상승 2회, 하락 3회를 기록했고, 주가수익률은 0%였다. 이 기간 ' 음식료·담배업 ' 업종 평균 주가수익률은 -14.25%를 기록했다. 현재 ' 음식료·담배업 ' 총 27개 종목 중 상한가 종목은 1개, 상승 종목은 10개로, 일부 종목만이 상승세를 보이고 있다. ( 한일사료(005860) +9.25%, 아미코젠(092040) +8.94%, 팜스토리(027710) +3.93%)"
한국경제,016790,/news/news_read.nhn?article_id=0003924443&office_id=015&mode=search&query=현대사료&page=1,2018-04-16 18:08,[마켓인사이트]현대사료 증권신고서 제출&hellip; 최대 목표 기업가치 406억원,"≪이 기사는 04월16일(15:07) 자본시장의 혜안 ‘마켓인사이트’에 게재된 기사입니다≫ 배합사료 제조회사인 현대사료가 코스닥시장 상장을 위해 증권신고서를 냈다. 16일 현대사료에 따르면 회사는 지난 13일 금융위원회에 증권신고서를 제출하고 공모규모 및 공모일정 등을 확정했다. 현대사료의 희망 공모가 범위는 5700~6600원으로 신주 152만6180주를 발행해 공모한다. 예상 공모금액은 87억~101억원, 희망 공모가 범위를 기준으로 한 예상 시가총액은 351억~406억원이다. 다음달 16~17일 수요예측(기관투자가 대상 사전청약)을 통해 공모가를 확정하고 같은달 23~24일 청약을 받는다. 대표주관사는 신한금융투자다. 현대사료는 양계, 양돈 등 배합사료를 제조하는 회사다. 지난해 매출 871억원에 영업이익 41억원, 순이익 56억원을 냈다. 이고운 기자"
서울경제,016790,/news/news_read.nhn?article_id=0003324845&office_id=011&mode=search&query=현대사료&page=1,2018-06-18 10:30,"&lt;코&gt;현대사료, 전일 대비 9.49% 상승.. 일일회전율은 20.80% 기록","[서울경제] 현대사료(016790) 는 18일 오전 10시 29분 현재 9.49% 오른 33,450원에 거래되고 있으며, 49(매도):51(매수)의 매수우위를 기록하고 있다. 거래대금은 396억668만, 거래량은 127만9,299주로 거래량회전율은 20.80%로 나타났다. 지난 1개월간 현대사료는 상한가 4회, 상승 2회, 하락 3회를 기록했고, 주가수익률은 0% 표준편차는 17.91%를 기록했다. 이 기간 ' 음식료·담배업 ' 업종 평균 주가수익률은 -13.90%로 나타났으며, 변동성은 2.15%를 기록했다. 이 시각 현재 ' 음식료·담배업 '은 1.39% 상승 중이며, 45(매도):55(매수)의 매수우위를 기록하고 있다."
파이낸셜뉴스,016790,/news/news_read.nhn?article_id=0004042202&office_id=014&mode=search&query=현대사료&page=1,2018-06-19 10:40,[fnRASSI]현대사료(016790) 현재 10% &uarr;,"현재 현대사료(016790)는 전일대비 10% 상승하여 36,850원 선에서 거래가 이루어지고 있다. 거래참여는 개인투자자가 가장 활발 최근 한달간 주체별 거래비중을 살펴보면 개인이 전체 거래의 97.8%를 차지하며 가장 적극적인 모습을 보여줬고, 기관은 1.19%를 나타냈으며 외국인은 1%를 나타냈다. 그리고 최근 5일간 거래비중은 개인이 98.76%로 가장 높은 참여율을 보였고, 외국인이 0.64%를 보였으며 기관은 0.58%를 나타냈다. 주가등락폭 크고, 상장주식수 대비 거래량도 상당히 높아 최근 한달간 현대사료의 매매회전율을 분석한 결과 3일에 1번 꼴로 주식의 주인이 바뀐 것으로 나타났다. 이는 비정상적으로 높은 회전율을 보인 것으로 투자에 각별한 주의가 요망된다. 또한 평균적으로 장중 주가변동률이 27.9%에 달할 정도로 등락이 심하기 때문에 다시한번 주의가 필요하다. 'fnRASSI'는 증권전문 기업 씽크풀과 파이낸셜뉴스의 협업으로 로봇기자가 실시간으로 생산하는 기사입니다."
전자신문,016790,/news/news_read.nhn?article_id=0002714739&office_id=030&mode=search&query=현대사료&page=1,2018-06-11 09:09,[ET투자뉴스]현대사료_강세 흐름속에 6일 연속 상승 현재 +3.13%,"11일 오전 9시 8분 현재 현대사료는 1000원(3.13%) 오른 33,000원을 기록하며 6일 연속 상승세를 이어가고 있다.  이렇게 양호한 흐름을 나타내는 특별한 원인이 있는지 여러각도에서 한번 살펴볼 필요가 있다.     [주가/수급동향]     5월31일부터 전일까지 기관과 외국인 모두 6거래일연속 동종목을 내다 팔았다. 최근 한달간 현대사료의 매매회전율을 분석한 결과 4일에 1번 꼴로 주식의 주인이 바뀐 것으로 나타났다.  이는 비정상적으로 높은 회전율을 보인 것으로 투자에 각별한 주의가 요망된다.  또한 평균적으로 장중 주가변동률이 15.91%에 달할 정도로 등락이 심하기 때문에 다시한번 주의가 필요하다.  그리고 최근 5일간 거래비중은 개인 비중이 96.76%로 가장 높았고, 기관이 1.84%로 그 뒤를 이었다.  외국인은 1.38%를 나타냈다.     [차트신호]     최근 주가변동폭을 기준으로 한 현재 주가는 과매입권으로 단기 조정가능성이 높아지고 있고,거래량 지표로 볼 때는 침체국면에 머물러 있다.투자심리적 관점에서 보면 주가흐름이 좋지 않아 불안한 심리를 보이고 있고 이동평균선들의 배열도를 분석을 해보면 상승 또는 하락으로 방향을 잡을 추세전환점에 접근해 있다.     [업종내 종목흐름]     이 시각 현재 관련종목들은 혼조세를 보이고 있으나 음식료,담배업종은    1.15% 상승중이다. 진로발효 30,800원0 (-0.65%) 에이치엘사이언스 31,700원▼1500(-4.52%)  하림 4,135원▲195(+4.95%) 우리손에프앤지 2,640원▲150(+6.02%)"
전자신문,016790,/news/news_read.nhn?article_id=0002714028&office_id=030&mode=search&query=현대사료&page=1,2018-06-07 09:09,[ET투자뉴스]현대사료_3일 만에 상한가 이탈 현재 +5.54% 4일연속 상승,"7일 오전 9시 8분 현재 현대사료가 3일만에 상한가를 이탈하는 모습이다.   그러나 여전히 플러스권은 이어지고 있다.   다음은 투자의 관점에서 현대사료의 세부항목들을 분석해 본 것이다.      [주가/수급동향]     5월31일부터 전일까지 기관과 외국인은 4거래일연속 동반 순매도했다. 최근 한달간 현대사료의 매매회전율을 분석한 결과 5일에 1번 꼴로 주식의 주인이 바뀐 것으로 나타났다.  이는 비정상적으로 높은 회전율을 보인 것으로 투자에 각별한 주의가 요망된다.  또한 평균적으로 장중 주가변동률이 14.19%에 달할 정도로 등락이 심하기 때문에 다시한번 주의가 필요하다.  그리고 최근 5일간 거래비중은 개인이 전체 거래량의 93.57%를 차지하며 가장 활발한 참여를 보였고, 기관은 3.82%, 외국인은 2.59%의 거래 참여율을 보였다.     [차트신호]     현재 주가를 최근 주가변동폭을 기준으로 보면 과매입권으로 단기 조정가능성이 높아지고 있고,거래량 지표로 볼 때는 수급상황이 현격히 위축되고 있다.투자심리를 살펴보면 낙폭 과대 인식에 따른 단기 반등의 가능성을 염두해 두고 있고 이동평균선들의 배열도를 분석을 해보면 단기, 중기, 장기 이동평균선이 정배열을 이루고 있으나 단기간 상승에 대한 피로감으로 조정양상을 보이고 있다.     [업종내 종목흐름]     이 시각 현재 관련종목들도 상승이 우세한 가운데 음식료,담배업종은    0.70% 상승중이다. 진로발효 30,500원▼150(-0.49%) 에이치엘사이언스 33,350원▲350(+1.06%)  하림 3,790원▲40(+1.07%) 우리손에프앤지 2,510원▲5(+0.20%)"
한국경제TV,016790,/news/news_read.nhn?article_id=0000658810&office_id=215&mode=search&query=현대사료&page=1,2018-07-09 14:20,"현대사료, -10% 하락... 전일 보다 3,050원 내린 27,250원","[한국경제TV 라이온봇 기자] [그림 1] 최근 3개월 간 주가 추세 및 기간별 수익률 현대사료는 7월 9일 14시 19분 전일 대비 약 -10% 급락한 27,250원에 거래되고 있다. 현대사료는 코스닥 상장 기업으로 음식료,담배 업종에 속해 있다. 시가총액은 1,863억원으로 코스닥 상장기업 중 315위에 위치 해 있다. [종목 성향 진단] [그림 2] 종목 성향 진단 현대사료의 투자 스타일은 성장주에 가깝다. 주가 고평가 우려가 공존하지만 높은 성장성이 기대되는 기업이다. 주가 모멘텀은 눈에 띄는 성장세를 기록했다. 최근 1개월 수익률이 무려 67.35%의 상승폭을 기록했다. 현대사료 종목에 대한 투자자의 관심도는 굉장히 높은 편이다. [투자 점수 진단] [그림 3] 투자 점수 진단 현대사료는 어느 측면에서 투자 매력도가 높은 종목일까? AI 인공지능 종목 분석 시스템을 이용해 성장성, 수익성, 효율성, 안전성, 저평가성, 추세 등 주가 수익률에 영향을 줄 수 있는 6가지 핵심 투자 지표를 점수화하여 종목의 투자 매력도를 계산해보았다. 그 결과 현대사료는 상대적으로 추세지표 측면에서 두각을 드러내고 있었다. 추세 점수는 주가의 상승 모멘텀이 어느정도 인가를 나타낸다. 현대사료는 특히 단기추세 측면에서 가장 높은 점수는 기록했는데, 전체 시장 내 188위를 기록하며 상위 9.39%에 위치했다. 업종별로는 14위를 기록하며 상위 13.68%에 위치했다. 그러나 기업 가치 대비 주가 수준을 나타내는 저평가 측면에서는 아쉬움을 나타냈다. (위의 AI인공지능 점수는 재무 데이터를 기반으로 전체 상장 종목과 비교/분석하여 도출한 점수로 높은 점수가 반드시 높은 수익률을 보장하지 않습니다. 위의 자료는 당사의 추천 종목이 아니며, 투자 시 참고용으로 제시해드리는 것입니다. 핵심투자지표를 결합해 종목의 투자매력도를 종합 계산한 ""인공지능 투자점수""는 ""거장들의 투자공식"" 앱에서 확인하실 수 있습니다.) 라이온봇 기자 -한국경제TV※ 본 기사는 한국경제TV와 '거장들의 투자공식이'자체 개발한 '라이온봇 기자'가 실시간으로 작성한 기사입니다. 라이온봇기자 ⓒ 한국경제TV, 무단 전재 및 재배포 금지 한국경제TV 관련뉴스해당 언론사에서 선정하며 언론사 페이지(아웃링크)로 이동해 볼 수 있습니다.'무역전쟁' 선반영 됐다…지금 사야할 주식은11시에 무슨 일이...매출 50% 급증한다발표하자 마자 급락...코스닥 25개사 '난감하네'계산대 의자 '이렇게' 바꾼다…이마트 10년 만의 변화""당신 차 긁었다"" 문 열어주니 강도로 돌변"
연합뉴스,016790,/news/news_read.nhn?article_id=0010121711&office_id=001&mode=search&query=현대사료&page=1,2018-06-01 09:49,현대사료㈜ 코스닥시장 신규상장 기념식,"(서울=연합뉴스) 1일 서울 여의도 한국거래소에서 배합사료 제조업을 영위하는 현대사료㈜의 코스닥시장 신규상장기념식이 열리고 있다. 왼쪽부터 최규준 한국IR협의회 부회장, 정운수 한국거래소 코스닥시장본부장, 문철명 현대사료(주) 대표이사, 이동환 신한금융투자 GIB 부문장, 송윤진 코스닥협회 부회장. 2018.6.1 [한국거래소 제공=연합뉴스]"
서울경제,016790,/news/news_read.nhn?article_id=0003313421&office_id=011&mode=search&query=현대사료&page=1,2018-06-04 09:11,"현대사료, 상장 연이틀 신고가 돌파","[서울경제] 동물 배합사료 전문업체인 현대사료가 4일 코스닥 입성 이틀째 장 중 신고가를 돌파했다. 오전 9시 7분 현재 현대사료는 전 거래일보다 27.7%(4,550원)오른 2만 1,700원에 거래되고 있다. 현대사료는 장 한때 2만 1,900원을 찍으면서 전 거래일 기록한 최고가인 1만 7,150원을 넘어섰다. 현대사료는 지난 1983년 설립된 동물 배합사료 전문업체로, 양계 및 양돈 사료부터 프리미엄 제품까지 제조·판매하고 있다. 연간 35만톤의 배합사료 생산능력을 바탕으로 147개의 브랜드를 보유중이다."
머니S,016790,/news/news_read.nhn?article_id=0000320591&office_id=417&mode=search&query=현대사료&page=1,2018-06-01 09:57,"[특징주] 현대사료, 상장 첫날 상한가&hellip; 공모가 대비 159.8%&uarr;","현대사료가 코스닥 시장 상장 첫날 상한가를 기록하고 있다. 1일 오전 9시55분 현재 현대사료는 시초가 1만3200원 대비 3950원(29.92%) 오른 1만7150원을 기록, 상한가에 진입했다. 이는 공모가 6600원 대비 159.8% 상승한 수치다. 1983년 설립된 현대사료는 35년간 동물용 배합사를 생산·판매해 온 배합사료 전문회사다. 양계사료 부문에서 62개 브랜드를 두고 있으며 매출 비중은 62.9%로 가장 크다. 지난해 매출액은 871억원, 영업이익은 41억원, 당기순이익은 56억원을 기록했다. 현대사료는 기관 투자자 대상 수요예측에서 839대 1의 경쟁률을 기록하며 희망밴드(5700~6600원) 최상단인 6600원에 공모가를 확정했다. 일반 투자자 대상 청약 결과 경쟁률이 1690대1을 기록했고 청약 증거금으로 1조7023억원이 모였다."
서울경제,016790,/news/news_read.nhn?article_id=0003333896&office_id=011&mode=search&query=현대사료&page=1,2018-06-28 09:25,"현대사료, 나흘 만에 급등세","[서울경제] 현대사료(016790) 가 장초반 급등중이다. 현대사료는 28일 오전 9시17분 현재 전일 대비 16.13%오른 2만8,800원에 거래중이다.현대사료는 지난 22일부터 4영업일동안 계속 연일하락하다 이날 급등세를 보이고 있다. 현대사료는 북한의 비료 지원 등으로 대표적인 경협주로 분류된다."
