source,symbol,link,date,title,content
서울경제,016790,/news/news_read.nhn?article_id=0003313405&office_id=011&mode=search&query=현대사료&page=1,2018-06-04 09:05,"&lt;코&gt;현대사료, 장중 신고가 돌파.. 17,150&rarr;21,900(▲4,750)","[서울경제] 오전 9시 4분 현재 현대사료(016790) 가 27.70% 오른 21,900원(▲4,750)을 기록하며, 52주 신고가를 +4,750원 경신했다. 기존 52주 최고가는 2018년 06월 01일 기록한 17,150원이다. 체결강도는 176%로 강세 반전했다. 총매수체결량은 284,389주, 총매도체결량은 161,414주를 각각 기록했다.  (※ 체결강도(%) = (총매수체결량/총매도체결량)*100) 이 시각 현재 거래대금은 179억1,331만, 거래량은 87만2,543주를 기록하고 있으며, 수급측면으로는 36(매도):64(매수)의 매수우위를 보이고 있다. 거래일을 기준으로 최근 3일간 평균 거래량은 4십2만6천주, 60일 평균 거래량 4십2만6천주로 비슷한 수준의 거래량을 유지하고 있다."
매일경제,016790,/news/news_read.nhn?article_id=0004162859&office_id=009&mode=search&query=현대사료&page=1,2018-06-05 09:17,"[Hot-Line] 현대사료, 상장 사흘째 급등&hellip;공모가 4배 껑충",현대사료가 상장 사흘째 급등세를 보이고 있다. 5일 오전 9시 6분 현재 현대사료는 전일 대비 5400원(24.27%) 오른 2만7650원에 거래되고 있다. 현대사료의 공모가는 6600원으로 현 주가는 공모가를 4배 이상 웃도는 수준이다. 현대사료는 코스닥 상장 첫날인 1일 공모가의 두배인 1만3200원에 시초가를 형성한 뒤 상한가로 마감했다. 이어 전 거래일인 4일에도 상한가로 치솟으며 급등세를 지속했다. [디지털뉴스국 김경택 기자] r_start // r_end //
머니투데이,016790,/news/news_read.nhn?article_id=0004053345&office_id=008&mode=search&query=현대사료&page=1,2018-05-18 14:28,현대사료 &quot;3만두 양돈농장 인수&hellip;축산회사로 발돋움&quot;,"[머니투데이 박계현 기자] [[IPO간담회]""사료 영업이익률 4~5%로 한정…수직계열화 나설 것""] 문철명 현대사료 대표/사진제공=현대사료 ""오는 6월 농업회사법인을 설립하고 공모자금을 활용해 충남·충북 지역에 3만 마리 규모 양돈 농장 3곳을 매입할 계획입니다."" 문철명 현대사료 대표는 18일 서울 여의도에서 열린 기자간담회에서 ""양돈 농장 매입을 통해 안정적인 사료 공급처를 확보하고 비육돈 판매를 통해 부가가치를 올리는 등 '원스톱 축산회사'로 거듭나겠다""고 말했다. 내달 1일 코스닥 상장예정인 현대사료는 지난 1983년 설립된 충남 천안 소재 사료업체다. 지난해 매출액 871억원, 영업이익 41억원, 당기순이익 56억원을 기록했다. 매출액과 영업이익은 전년 대비 각각 18.2%, 20.7% 감소했으나 당기순이익은 59.5% 증가했다. 최근 매출액 기준 △2015년 1252억원 △2016년 1065억원 △2017년 871억원으로 감소세를 보이고 있다. 지난해 기준 전체 매출에서 양계사료 비중이 62.9%, 양돈 사료 비중이 23.9%, 기타사료 비중이 10%를 차지한다. 국내 사료시장에서 현대사료가 차지하는 시장점유율 비중이 1.5%인데 비해 가장 비중이 높은 산란계용 사료는 7%를 차지하고 있다. 유재철 현대사료 이사는 ""2016년 하반기 AI(조류인플루엔자)로 인해 회사 내 비중이 가장 높은 양계 사료 부문 타격이 커서 매출액이 급감했다""며 ""지난해 4분기부터 성장이 회복되면서 현재 거의 회복 단계에 접어들었고 올해 하반기에는 완전히 회복될 것""이라고 설명했다. 최근 3년간 영업이익률 기준으로는 △2015년 3.9% △2016년 4.9% △2017년 4.7%를 기록했다. 유 이사는 ""사료업종의 경우 시장에 국제 곡물가·환율이 노출돼 있어 가격경쟁으로 점유율을 확장하는 전략은 이미 한계에 다다랐다""며 ""매출액 규모를 늘려도 부가가치는 4~5%로 한정적""이라고 설명했다. 이어 ""규모화된 농장들의 수요에 맞춰 각 농장별로 맞춤형 사료를 제공하고 180개 사료 원재료를 어떻게 배합하느냐에 따라 회사 수익성 제고에 직접적인 영향을 받는다""고 덧붙였다. 현대사료의 배합사료 생산능력은 연간 35만톤으로 기초 사료에서 양계·양돈 사료에 이르기까지 약 147개 브랜드를 보유하고 있다. 회사는 현재 99개를 확보한 제품 저장빈을 향후 150개까지 늘려 생산가능한 사료 전품목을 각 수요처에서 원하는 때 공급할 수 있게 한다는 계획이다. 현대사료는 옥수수·대두박·소맥 등 곡물을 원재료로 하는 업종 특성상 국제 곡물가, 환율 등에 따라 환율변동위험이 큰 편이다. 원재료의 80~85%를 수입에 의존하고 있다. 유 이사는 ""국제 곡물가격·환율변동에 원가 인상·인하요인이 발생할 경우 2~3개월 이내 제품가에 반영해 회사 수익구조에 미치는 영향을 낮추고 있다""고 설명했다. 이어 ""외화 거래시에는 유산스(기한부 환어음)을 활용하는데 리스크를 낮추기 위해 향후 외화선도거래를 20%까지 높일 계획""이라고 덧붙였다. 현대사료의 희망공모가는 5700~6600원이며 공모규모는 87억~101억원, 예상 시가총액은 351억~406억원이다. 지난 17일 수요예측을 마무리했으며 오는 23~24일 일반 청약을 거쳐 내달 1일 코스닥에 상장한다. 주관사는 신한금융투자다."
서울경제,016790,/news/news_read.nhn?article_id=0003355709&office_id=011&mode=search&query=현대사료&page=1,2018-07-24 09:52,"&lt;코&gt;현대사료, 전일 대비 8.95% 상승.. 일일회전율은 1.67% 기록","[서울경제] 현대사료(016790) 는 24일 오전 9시 51분 현재 8.95% 오른 24,350원에 거래되고 있으며, 35(매도):65(매수)의 매수우위를 기록하고 있다. 거래대금은 24억438만, 거래량은 10만2,800주로 거래량회전율은 1.67%로 나타났다. 지난 1개월간 현대사료는 상한가 2회, 상승 8회, 하락 20회를 기록했고, 주가수익률은 -22.70% 표준편차는 10.01%를 기록했다. 이 기간 ' 음식료·담배업 ' 업종 평균 주가수익률은 -23.87%로 나타났으며, 변동성은 2.40%를 기록했다. 이 시각 현재 ' 음식료·담배업 '은 1.34% 상승 중이며, 43(매도):57(매수)의 매수우위를 기록하고 있다."
한국경제TV,016790,/news/news_read.nhn?article_id=0000653530&office_id=215&mode=search&query=현대사료&page=1,2018-06-27 10:20,"현대사료, 전일 대비 약 -8% 하락한 25,300원","[한국경제TV 라이온봇 기자] [그림 1] 최근 3개월 간 주가 추세 및 기간별 수익률 현대사료는 6월 27일 10시 19분 전일 대비 약 -8% 하락한 25,300원에 거래되고 있다. 현대사료는 코스닥 상장 기업으로 음식료,담배 업종에 속해 있다. 시가총액은 1,851억원으로 코스닥 상장기업 중 334위에 위치 해 있다. [종목 성향 진단] [그림 2] 종목 성향 진단 현대사료의 투자 스타일은 성장주에 가깝다. 주가 고평가 우려가 공존하지만 높은 성장성이 기대되는 기업이다. 주가 모멘텀은 평범한 수준이었다. 현대사료 종목에 대한 투자자의 관심도는 굉장히 높은 편이다. [투자 점수 진단] [그림 3] 투자 점수 진단 현대사료는 어느 측면에서 투자 매력도가 높은 종목일까? AI 인공지능 종목 분석 시스템을 이용해 성장성, 수익성, 효율성, 안전성, 저평가성, 추세 등 주가 수익률에 영향을 줄 수 있는 6가지 핵심 투자 지표를 점수화하여 종목의 투자 매력도를 계산해보았다. 그 결과 현대사료는 상대적으로 기업안정성 측면에서 두각을 드러내고 있었다. 기업안정성 점수는 기업의 재무 구조가 얼마나 안정적인 상태인지를 나타낸다. 현대사료는 특히 당좌비율 측면에서 가장 높은 점수는 기록했는데, 전체 시장 내 728위를 기록하며 상위 37.67%에 위치했다. 업종별로는 25위를 기록하며 상위 25.26%에 위치했다. 그러나 주가 상승 모멘텀을 나타내는 추세 측면에서는 아쉬움을 나타냈다. (위의 AI인공지능 점수는 재무 데이터를 기반으로 전체 상장 종목과 비교/분석하여 도출한 점수로 높은 점수가 반드시 높은 수익률을 보장하지 않습니다. 위의 자료는 당사의 추천 종목이 아니며, 투자 시 참고용으로 제시해드리는 것입니다. 핵심투자지표를 결합해 종목의 투자매력도를 종합 계산한 ""인공지능 투자점수""는 ""거장들의 투자공식"" 앱에서 확인하실 수 있습니다.) 라이온봇 기자 -한국경제TV※ 본 기사는 한국경제TV와 '거장들의 투자공식이'자체 개발한 '라이온봇 기자'가 실시간으로 작성한 기사입니다. 라이온봇기자 ⓒ 한국경제TV, 무단 전재 및 재배포 금지 한국경제TV 관련뉴스해당 언론사에서 선정하며 언론사 페이지(아웃링크)로 이동해 볼 수 있습니다.""가장 쎈 놈 온다""…'전면 시행' DSR 뭐길래짐로저스 ""통일 한국에 전 재산 투자""...깜짝 놀랄 보유 주식""소주 한 병이 한 잔에""…'한방울잔' 또 완판차범근家 총출동…한채아 근황, 남편 차세찌는?""총알만 준비하자""…세금폭탄 앞둔 강남 가보니"
서울경제,016790,/news/news_read.nhn?article_id=0003315787&office_id=011&mode=search&query=현대사료&page=1,2018-06-07 09:31,"현대사료, 4거래일 연속 상승&middot;&middot;&middot;공모가 대비 5배 수준까지 올라","[서울경제] 동물 배합사료 전문업체인 현대사료가 7일에도 강세를 보이고 있다. 코스닥에 입성한 1일 이후 4거래일 연속 크게 오름세를 이어가는 모습이다. 현대사료는 이날 오전 9시 27분 현재 전날 대비 17.3%(5,000원) 오른 3만3,900원에 거래되고 있다. 현대사료는 1일 코스닥 상장 이후 3거래일 연속 상한가를 기록한 바 있다. 7일 거래량은 지난 4일 거래량에 이미 육박했다. 공모가 6,600원과 비교하면 5배 이상 오른 수준이다. 현대사료는 지난 1983년 설립된 동물 배합사료 전문업체로, 양계 및 양돈 사료부터 프리미엄 제품까지 제조·판매하고 있다. 연간 35만톤의 배합사료 생산능력을 바탕으로 147개의 브랜드를 보유 중이다. 남북 경협 수혜주로 분류되며 투자자들이 몰리는 모습이다."
매일경제,016790,/news/news_read.nhn?article_id=0004153241&office_id=009&mode=search&query=현대사료&page=1,2018-05-18 14:29,"현대사료, 코스닥 입성 코앞&hellip;&quot;종합축산기업 발돋움&quot;","직영 농장 운영해 매출 감소 극복 기대 문철명 현대사료 대표이사 [사진 제공 : 현대사료, 아이알비즈넷컨설팅] 코스닥 상장을 앞둔 현대사료는 18일 기자간담회를 열고 종합 축산 기업으로 발돋움하겠다는 목표를 밝혔다. 1983년 설립된 현대사료는 배합사료를 만들어 납품한다. 농장이 기업 형태로 대형화 하면서 맞춤형 제품을 개발해 공급하며, 특수 농축사료 기술도 확보했다. 양계와 양돈 사료 부문에서 147개 브랜드를 보유하고 있고, 연간 약 35만t을 생산한다. 이같은 성과에 충청도와 제주도 등 전국 영업망을 구축했고, 영신양계·유림축산·예산농장 등 고객사와 평균 10년 이상 장기간 거래를 유지하고 있다. 다만 사업군 성장성이 낮아 회사의 외형은 최근 4년간 매년 뒷걸음질을 쳤다. 2014년 매출액은 1350억1900만원를 기록했지만, 2015년에는 1252억2600만원으로 감소했다. 2016년에는 1064억3200만원, 지난해에는 871억4300만원으로 줄어들었다. 같은 기간 영업이익은 58억2100만원, 48억3500만원, 52억12만원, 41억3400만원으로 각각 집계됐다. 현대사료는 이에 대해 상장 이후인 올 하반기 양돈 농장을 2~3곳 인수해 성장의 기회를 잡겠다고 밝혔다. 총 3만두 규모의 농장을 직영 운영해 종합축산기업으로 발돋움하고, 수직계화를 기반으로 외형을 키우겠다는 의미다. 문철명 현대사료 대표이사는 ""내년에는 인력을 보강해 생산 역량을 증대하겠다""며 ""2020년에는 농장 지역을 다변화해 규모를 확대하고, 이후 생산성을 극대화해 안정적 매출을 시현하겠다""고 말했다. 또 친환경 신규 제품을 개발하는 것도 포트폴리오에 포함됐다. 올해 8월 살충제 계란 파동 이후 친환경 닭진드기 억제제가 중요해졌기 때문이다. 현대사료는 철연 살충제 개발을 완료했고, 사료첨가제는 개발 예정이다. 현대사료의 산란계 배합사료 시장점유율은 지난해 기준 7.0%로 업계 선두권이다. 현대사료는 코스닥 상장을 위한 총 152만6180주를 공모한다. 공모가 희망 범위는 5700원~6600원이다. 공모로 들어오는 순수입금은 85억9000만원 수준으로 전망된다. 회사는 전액 농업회사법인을 설립하고 양돈농장을 구입하는 데 지출할 예정이다. 일반 투자자 청약은 23일부터 이틀간 받는다. 상장 예정일은 다음달 1일이며, 상장 주관사는 신한금융투자가 맡았다. [디지털뉴스국 이가희 기자] r_start // r_end //"
서울경제,016790,/news/news_read.nhn?article_id=0003336968&office_id=011&mode=search&query=현대사료&page=1,2018-07-02 13:59,"&lt;코&gt;현대사료, 현재가 5.91% 급등","[서울경제] 오후 1시 58분 현재 현대사료(016790) 의 현재가는 32,250원으로 1분전 30,450원 대비 5.91% 급등했다. 수급측면으로는 49(매도):51(매수)의 매수우위를 기록하고 있다. 지난 1개월간 ' 음식료·담배업 ' 업종 평균 주가수익률은 -13.54% 로 나타났으며, 변동성은 2.14%를 기록했다. 이 시각 현재 ' 음식료·담배업 '은 0.08% 상승 중이다."
한국경제TV,016790,/news/news_read.nhn?article_id=0000653696&office_id=215&mode=search&query=현대사료&page=1,2018-06-27 13:25,"현대사료, -13% 하락... 전일 보다 3,550원 내린 23,950원","[한국경제TV 라이온봇 기자] [그림 1] 최근 3개월 간 주가 추세 및 기간별 수익률 현대사료는 6월 27일 13시 24분 전일 대비 약 -13% 급락한 23,950원에 거래되고 있다. 현대사료는 코스닥 상장 기업으로 음식료,담배 업종에 속해 있다. 시가총액은 1,691억원으로 코스닥 상장기업 중 368위에 위치 해 있다. [종목 성향 진단] [그림 2] 종목 성향 진단 현대사료의 투자 스타일은 성장주에 가깝다. 주가 고평가 우려가 공존하지만 높은 성장성이 기대되는 기업이다. 주가 모멘텀은 평범한 수준이었다. 현대사료 종목에 대한 투자자의 관심도는 굉장히 높은 편이다. [투자 점수 진단] [그림 3] 투자 점수 진단 현대사료는 어느 측면에서 투자 매력도가 높은 종목일까? AI 인공지능 종목 분석 시스템을 이용해 성장성, 수익성, 효율성, 안전성, 저평가성, 추세 등 주가 수익률에 영향을 줄 수 있는 6가지 핵심 투자 지표를 점수화하여 종목의 투자 매력도를 계산해보았다. 그 결과 현대사료는 상대적으로 기업안정성 측면에서 두각을 드러내고 있었다. 기업안정성 점수는 기업의 재무 구조가 얼마나 안정적인 상태인지를 나타낸다. 현대사료는 특히 당좌비율 측면에서 가장 높은 점수는 기록했는데, 전체 시장 내 728위를 기록하며 상위 37.67%에 위치했다. 업종별로는 25위를 기록하며 상위 25.26%에 위치했다. 그러나 주가 상승 모멘텀을 나타내는 추세 측면에서는 아쉬움을 나타냈다. (위의 AI인공지능 점수는 재무 데이터를 기반으로 전체 상장 종목과 비교/분석하여 도출한 점수로 높은 점수가 반드시 높은 수익률을 보장하지 않습니다. 위의 자료는 당사의 추천 종목이 아니며, 투자 시 참고용으로 제시해드리는 것입니다. 핵심투자지표를 결합해 종목의 투자매력도를 종합 계산한 ""인공지능 투자점수""는 ""거장들의 투자공식"" 앱에서 확인하실 수 있습니다.) 라이온봇 기자 -한국경제TV※ 본 기사는 한국경제TV와 '거장들의 투자공식이'자체 개발한 '라이온봇 기자'가 실시간으로 작성한 기사입니다. 라이온봇기자 ⓒ 한국경제TV, 무단 전재 및 재배포 금지 한국경제TV 관련뉴스해당 언론사에서 선정하며 언론사 페이지(아웃링크)로 이동해 볼 수 있습니다.""가장 쎈 놈 온다""…'전면 시행' DSR 뭐길래짐로저스 ""통일 한국에 전 재산 투자""...깜짝 놀랄 보유 주식""소주 한 병이 한 잔에""…'한방울잔' 또 완판차범근家 총출동…한채아 근황, 남편 차세찌는?""총알만 준비하자""…세금폭탄 앞둔 강남 가보니"
아시아경제,016790,/news/news_read.nhn?article_id=0004252019&office_id=277&mode=search&query=현대사료&page=1,2018-06-05 09:12,"[특징주] 현대사료, 사흘째 강세&hellip;공모가 대비 300%&uarr;","[아시아경제 임철영 기자] 현대사료가 사흘째 강세다. 5일 오전 9시9분 현재 현대사료는 전 거래일 대비 25.39% 오른 2만7900원에 거래되고 있다. 지난 1일, 4일 가격제한폭까지 오른 이후 3거래일째 급등이다. 현대사료는 상장 첫날인 1일 시초가 1만3200원 대비 가격제한폭인 29.92% 오른 1만7150원에 장을 마쳤다. 이후 급등세를 지속하며 시초가 대비 주가는 약 3배 가까이 올랐다. 공모가(6600원) 대비 322% 오른 수준이다. 증권가에서는 사료업종이 남북경협 수혜주로 주목 받으면서 현대사료에 대한 기대가 커진 것으로 보고 있다."
한국경제,016790,/news/news_read.nhn?article_id=0003942485&office_id=015&mode=search&query=현대사료&page=1,2018-05-18 14:40,[상장예정기업]현대사료 &quot;코스닥 상장 통해 종합 축산 기업으로 도약&quot;,"문철명 현대사료 대표이사. (자료 = 아이알비즈넷) ""코스닥 상장을 통해 양돈사업에도 진출, 종합 축산기업으로 도약하겠습니다."" 문철명 대표이사는 18일 서울 여의도에서 열린 기자간담회에서 이같이 밝혔다. 1983년 설립된 현대사료는 연간 35만톤의 양계·양돈 사료를 생산하고 있다. 매출비중은 지난해 기준으로 양계사료가 62.9%, 양돈이 23.9%를 차지한다. 약 147개 브랜드를 보유하고 있으며 충청도 제주도 등 전국적인 영업망 구축을 완료했다. 특히, 산란계 사료는 전국 시장점유율이 7%를 차지한다. 유재철 경영이사는 ""전체 사료시장의 시장점유율은 1.5%인데 산란계에 특화돼 있다""며 ""사료시장에선 65개 사료기업이 각축을 벌이고 있는 상태""라고 설명했다. 현대사료는 차별화된 연구개발(R&D) 역량과 경쟁사 대비 다량의 벌크 저장소(Bin)을 보유하고 있다는 점을 특징으로 꼽았다. 영신양계 유림축산 한국양계TS 등 대규모 농장을 운영하는 고객들과 평균 10년 이상 장기간 거래를 유지해오고 있다. 그는 ""양돈의 특수 농축사료 기술은 사료효율을 높이고 사료비용을 낮췄다""며 ""벌크 저장소를 99개 보유하고 있어 고객맞춤형 제품 공급이 가능하다""고 밝혔다. 현대사료는 이번 공모자금으로 양돈사업을 진행해 종합 축산 기업으로 도약한다는 계획을 세웠다. 유 이사는 ""100억원을 투입해 향후 2년 내 3만두 양돈농장을 정착시킬 계획""이라며 ""사료도 안정적으로 공급할 수 있고, 비육돈 생산을 통해 부가가치를 올릴 수 있는 만큼 연간 사료 매출액은 80억원, 영업이익률은 15%를 기록할 것""이라고 예상했다. 또 닭진드기 억제용 살비제도 공급해 사료 시장점유율을 높여나갈 계획이다. 그는 ""닭의 생산성을 저하시키는 닭진드기 억제용 살비제를 개발해 특허 출연 중에 있다""며 ""농장의 반응이 좋아서 살비제 공급을 통해 시장점유율을 확대할 계획""이라고 설명했다. 2016년 조류인플루엔자(AI) 여파와 같이 큰 충격은 다시 발생하긴 어려울 것으로 점쳤다. AI여파와 동시에 거래처 2곳과 계약이 끊기면서 지난해 현대사료 매출액은 871억4300만원으로 전년 대비 18.1% 감소했으며, 영업이익은 41억3400만원으로 20.6% 줄었다. 유 이사는 ""현 정부는 공무원들이 주1회 농장을 직접 방문, 농장에서 검사를 통해 문제가 있으면 현장에서 매물 처분하는 선제적 방역시스템을 잘 갖췄다""며 ""2016년과 비교해 현재 가축 질병은 약 85~90% 줄었다""고 밝혔다. 최근 남북 경협에 대한 기대감도 드러냈다. 홍영식 영업상무는 ""실제로 사료협회나 통일부와 남북경협에 따른 효과를 시뮬레이션 해보기도 했고, 블루오션이 생기는 만큼 희망적""이라며 ""상장 준비 과정에서 만난 기관투자자들도 테마주로 편입해야 한다는 의견을 많이 냈다""고 설명했다. 문 대표는 ""2016년 AI 여파 이후 실적이 뒷걸음질한 것처럼 보이지만, 최근 3년간 당기순이익 랭킹으로 따지면 3위에 항상 들었던 탄탄한 회사인 만큼, 코스닥 상장을 통해 종합축산기업으로 도약하겠다""고 밝혔다. 현대사료의 당기순이익은 2015년 22억원에서 2016년 35억원, 지난해 56억원으로 꾸준히 늘었다. 지난해 기준 당기순이익률은 6.4%를 기록했다. 현대사료는 23~24일간 청약을 진행한다. 공모예정금액은 86억~100억원이다. 6월1일 코스닥시장에 상장한다. 상장주관사는 신한금융투자다. 고은빛 한경닷컴 기자"
한국경제TV,016790,/news/news_read.nhn?article_id=0000652914&office_id=215&mode=search&query=현대사료&page=1,2018-06-26 09:22,"현대사료, 전일 대비 약 -3% 하락한 29,150원","[한국경제TV 라이온봇 기자] [그림 1] 최근 3개월 간 주가 추세 및 기간별 수익률 현대사료는 6월 26일 9시 21분 전일 대비 약 -3% 하락한 29,150원에 거래되고 있다. 현대사료는 코스닥 상장 기업으로 음식료,담배 업종에 속해 있다. 시가총액은 1,980억원으로 코스닥 상장기업 중 305위에 위치 해 있다. [종목 성향 진단] [그림 2] 종목 성향 진단 현대사료의 투자 스타일은 성장주에 가깝다. 주가 고평가 우려가 공존하지만 높은 성장성이 기대되는 기업이다. 주가 모멘텀은 평범한 수준이었다. 현대사료 종목에 대한 투자자의 관심도는 굉장히 높은 편이다. [투자 점수 진단] [그림 3] 투자 점수 진단 현대사료는 어느 측면에서 투자 매력도가 높은 종목일까? AI 인공지능 종목 분석 시스템을 이용해 성장성, 수익성, 효율성, 안전성, 저평가성, 추세 등 주가 수익률에 영향을 줄 수 있는 6가지 핵심 투자 지표를 점수화하여 종목의 투자 매력도를 계산해보았다. 그 결과 현대사료는 상대적으로 기업안정성 측면에서 두각을 드러내고 있었다. 기업안정성 점수는 기업의 재무 구조가 얼마나 안정적인 상태인지를 나타낸다. 현대사료는 특히 당좌비율 측면에서 가장 높은 점수는 기록했는데, 전체 시장 내 727위를 기록하며 상위 37.64%에 위치했다. 업종별로는 25위를 기록하며 상위 25.26%에 위치했다. 그러나 주가 상승 모멘텀을 나타내는 추세 측면에서는 아쉬움을 나타냈다. (위의 AI인공지능 점수는 재무 데이터를 기반으로 전체 상장 종목과 비교/분석하여 도출한 점수로 높은 점수가 반드시 높은 수익률을 보장하지 않습니다. 위의 자료는 당사의 추천 종목이 아니며, 투자 시 참고용으로 제시해드리는 것입니다. 핵심투자지표를 결합해 종목의 투자매력도를 종합 계산한 ""인공지능 투자점수""는 ""거장들의 투자공식"" 앱에서 확인하실 수 있습니다.) 라이온봇 기자 -한국경제TV※ 본 기사는 한국경제TV와 '거장들의 투자공식이'자체 개발한 '라이온봇 기자'가 실시간으로 작성한 기사입니다. 라이온봇기자 ⓒ 한국경제TV, 무단 전재 및 재배포 금지 한국경제TV 관련뉴스해당 언론사에서 선정하며 언론사 페이지(아웃링크)로 이동해 볼 수 있습니다.'혹파리' 벌레아파트...주방마다 득실득실 ""소름끼쳐""짐로저스 ""통일 한국에 전 재산 투자""...깜짝 놀랄 보유 주식""소주 한 병이 한 잔에""…인기폭발 '한방울잔' 또 완판""치킨보다 많이 팔렸다""…'월드컵 특수' 최대 수혜품은?""침대 보다 집이 더 문제""… 커지는 라돈 공포"
