source,symbol,link,date,title,content
파이낸셜뉴스,016790,/news/news_read.nhn?article_id=0004035354&office_id=014&mode=search&query=현대사료&page=1,2018-06-07 10:40,[fnRASSI]현대사료(016790) 전일대비 21.8% 상승,"현대사료(016790)는 현재 주가가 전일 대비 21.8% 상승한 35,200원 선에서 거래가 이루어지고 있다. 주가등락폭 크고, 상장주식수 대비 거래량도 상당히 높아 최근 한달간 현대사료의 매매회전율을 분석한 결과 5일에 1번 꼴로 주식의 주인이 바뀐 것으로 나타났다. 이는 비정상적으로 높은 회전율을 보인 것으로 투자에 각별한 주의가 요망된다. 또한 평균적으로 장중 주가변동률이 14.19%에 달할 정도로 등락이 심하기 때문에 다시한번 주의가 필요하다. 주요 투자주체는 개인투자자 최근 한달간 주체별 거래비중을 살펴보면 개인이 93.57%로 가장 높은 참여율을 보였고, 기관이 3.82%를 보였으며 외국인은 2.59%를 나타냈다. 그리고 최근 5일간 거래비중은 개인이 전체 거래량의 93.57%를 차지하며 가장 활발한 참여를 보였고, 기관은 3.82%, 외국인은 2.59%의 거래 참여율을 보였다. 'fnRASSI'는 증권전문 기업 씽크풀과 파이낸셜뉴스의 협업으로 로봇기자가 실시간으로 생산하는 기사입니다."
이데일리,016790,/news/news_read.nhn?article_id=0004116032&office_id=018&mode=search&query=현대사료&page=1,2018-06-01 09:10,"[특징주]한일사료, 급등&hellip;'남북 경협 수혜' 현대사료 효과",[이데일리 박형수 기자] 사료주가 급등하고 있다. 코스닥 시장에 새로 상장한 현대사료가 남북 경제협력 수혜주로 주목받으면서 동반 강세다. 1일 오전 9시9분 한일사료(005860)는 전날보다 19.6% 오른 3020원에 거래되고 있다. 우성사료(006980) 대주산업(003310) 등도 강세다. 1983년 설립한 현대사료는 지난 35년 동안 배합사료를 전문적으로 개발·생산한 회사다. 배합사료 생산능력은 연간 35만t이다. 회사는 고온·고압을 이용한 가수열처리로 사료 이용성과 내구성을 개선하고 유해미생물의 완전 살균 처리로 청정사료를 만들어내는 ‘익스팬딩 공법’을 국내 최초로 도입했다. 현대사료 공모주 청약 결과 경쟁률 1690 대 1을 기록했다. 남북관계가 개선되면서 대북 지원이 현실화되면 사료 수요가 급증할 것이란 기대를 반영했다.
파이낸셜뉴스,016790,/news/news_read.nhn?article_id=0004048813&office_id=014&mode=search&query=현대사료&page=1,2018-06-29 15:01,"[공시]현대사료, 150억 규모 거래처 채무보증 결정",현대사료는 산은캐피탈 판매카드로 거래중인 거래처에 150억원 규모 채무보증을 하기로 결정했다고 29일 공시했다.
한국경제,016790,/news/news_read.nhn?article_id=0003952717&office_id=015&mode=search&query=현대사료&page=1,2018-06-01 09:11,"[특징주]현대사료, 상장 첫날 '상한가'","현대사료가 코스닥시장 거래 개시 첫날 상한가를 기록하고 있다. 1일 오전 9시5분 현재 현대사료는 시초가 1만3200원 대비 3950원(29.92%) 오른 1만7150원을 기록, 상한가에 진입했다. 이는 공모가 6600원 대비 159.8% 상승한 수치다. 현대사료는 1983년 설립된 배합사료 생산기업으로 양계, 양돈, 오리용 사료를 생산한다. 현대사료는 남북 경제협력 수혜 종목으로 주목받으며 지난달 23~24일 일반투자자 대상 공모주 청약 접수에서 1690대 1을 기록, 9년 만에 가장 높은 공모주 청약 경쟁률을 기록했다. 회사의 지난해 매출액과 영업이익은 각각 871억원, 41억원이며 순이익은 56억원으로 집계됐다. 김소현 한경닷컴 기자"
헤럴드경제,016790,/news/news_read.nhn?article_id=0001400505&office_id=016&mode=search&query=현대사료&page=1,2018-06-01 09:14,"현대사료, 코스닥 첫 거래일 상한가 직행&hellip;공모가 2배 훌쩍","[헤럴드경제=최준선 기자] 코스닥 시장에 신규 상장된 현대사료가 장 초반 상한가로 직행했다. 1일 오전 9시 5분 현재 코스닥 시장에서 현대사료는 시초가(1만3200원)보다 29.92% 오른 1만7150원에 거래되고 있다. 공모가 6600원의 2배 높은 가격에 장을 시작했음에도 급등세를 나타낸 것이다. 현대사료는 양돈ㆍ양계 사료 등을 제조하는 업체다. 이날 주가 급등에는 최근 증시에서 사료 관련 업체들이 남북경협 테마주로서 투자자들의 관심을 받고 있는 분위기가 영향을 미친 것으로 풀이된다. 현대사료는 지난해 매출과 당기순이익으로 각각 871억원, 56억원을 기록했다."
연합뉴스,016790,/news/news_read.nhn?article_id=0010126261&office_id=001&mode=search&query=현대사료&page=1,2018-06-04 09:26,[특징주] 현대사료 상장 이틀째 상한가&hellip;공모가의 3.4배,"(서울=연합뉴스) 권수현 기자 = 현대사료가 코스닥시장 상장 첫날에 이어 이틀째인 4일에도 상한가를 기록했다. 이날 오전 9시20분 현재 현대사료는 가격제한폭(29.74%)까지 오른 2만2천250원에 거래되고 있다. 이는 공모가(6천600원)의 약 3.4배 수준이다. 1983년 설립된 현대사료는 돼지, 닭, 오리 등 가축 사육용 배합사료를 생산하는 업체다. 현재 147개 브랜드를 보유하고 있으며 연간 생산량은 35만t이다. 작년 매출액은 871억원, 당기순이익은 56억원이었다. 이 업체는 공모가를 상대적으로 낮은 수준으로 책정한 데다 최근 비료와 사료 업체들이 남북 경협 수혜 테마주로 거론된 영향으로 강한 상승세를 타고 있다."
서울경제,016790,/news/news_read.nhn?article_id=0003337761&office_id=011&mode=search&query=현대사료&page=1,2018-07-03 09:31,"&lt;코&gt;현대사료, 전일 대비 8.54% 상승.. 일일회전율은 5.64% 기록","[서울경제] 현대사료(016790) 는 3일 오전 9시 30분 현재 8.54% 오른 31,150원에 거래되고 있으며, 46(매도):54(매수)의 매수우위를 기록하고 있다. 거래대금은 107억1,846만, 거래량은 34만7,035주로 거래량회전율은 5.64%로 나타났다. 지난 1개월간 현대사료는 상한가 5회, 상승 5회, 하락 10회를 기록했고, 주가수익률은 0% 표준편차는 15.55%를 기록했다. 이 기간 ' 음식료·담배업 ' 업종 평균 주가수익률은 -13.31%로 나타났으며, 변동성은 2.16%를 기록했다. 이 시각 현재 ' 음식료·담배업 '은 1.71% 상승 중이며, 42(매도):58(매수)의 매수우위를 기록하고 있다."
서울경제,016790,/news/news_read.nhn?article_id=0003311925&office_id=011&mode=search&query=현대사료&page=1,2018-06-01 09:16,"현대사료, '경협테마'로 상장 첫날 상한가","[서울경제] 현대사료가 남북 경협테마로 상장 첫날 시초가 대비 상한가를 기록했다. 현대사료는 1일 오전 9시12분 현재 코스닥 시장에서 시초가 대비 3,950원(29.92%) 오른 1만7,150원에 거래되고 있다. 양계, 양돈, 오리용 사료를 생산하는 현대사료는 상장 전부터 남북 경제협력 수혜 기업으로 주목받은 바 있다."
뉴시스,016790,/news/news_read.nhn?article_id=0008628236&office_id=003&mode=search&query=현대사료&page=1,2018-06-01 09:16,"[특징주]현대사료, 상장 첫 날 상한가&hellip;공모가 2.6배 &uarr;","【서울=뉴시스】이국현 기자 = 1일 코스닥시장에 상장된 현대사료(016790)가 첫 날부터 상한가로 직행했다. 이날 현대사료는 공모가(6600원)보다 2배 높은 1만3200원에 시초가를 형성했다. 개장 직후 현대사료는 시초가보다 3950원(29.92%) 오른 1만7150원으로 상한가를 찍었다. 이는 공모가의 2.6배에 달하는 수치다. 현대사료는 지난 1983년 설립돼 35년간 동물용 배합사료만을 생산·판매해 온 배합사료 전문회사다. 양계사료 부문에서 62개 브랜드를 두고 있으며 매출 비중은 62.9%로 가장 크다. 지난해 매출액은 871억원, 영업이익은 41억원을 기록했다. 당기순이익은 56억원으로 집계됐다. 현대사료는 기관 투자자 대상 수요예측에서 839대 1의 경쟁률을 기록하며 희망밴드(5700~6600원) 최상단인 6600원에 공모가를 확정했다. 일반 투자자 대상 청약 결과 경쟁률이 1690대 1을 기록했고, 청약 증거금으로는 1조7023억원이 모였다"
아시아경제,016790,/news/news_read.nhn?article_id=0004267788&office_id=277&mode=search&query=현대사료&page=1,2018-06-29 14:40,"현대사료, 150억 규모 거래처 채무보증 결정",[아시아경제 문채석 기자]현대사료는 산은캐피탈 판매카드로 거래중인 거래처에 150억원 규모 채무보증을 하기로 결정했다고 29일 공시했다.
매일경제,016790,/news/news_read.nhn?article_id=0004161049&office_id=009&mode=search&query=현대사료&page=1,2018-06-01 09:17,"[Hot-Line] 현대사료, 상장 첫날 상한가 직행",현대사료가 코스닥 상장 첫날 상한가로 직행했다. 1일 오전 9시 3분 현재 현대사료는 시초가 대비 3950원(29.92%) 오른 1만7150원에 거래되고 있다. 이는 공모가인 6600원을 크게 웃도는 수준이다. 현대사료는 동물용 사료 제조업체다. [디지털뉴스국 김경택 기자] r_start // r_end //
파이낸셜뉴스,016790,/news/news_read.nhn?article_id=0004033279&office_id=014&mode=search&query=현대사료&page=1,2018-06-04 09:25,"[특징주]현대사료, 상장 이틀째 &lsquo;상한가&rsquo;","배합사료 제조업체인 현대사료가 상장 후 이틀 연속 상한가로 직행했다. 4일 오전 9시 19분 현재 현대사료는 전일대비 29.74%(5100원) 오른 2만2250원에 거래되고 있다. 지난 1일 코스닥시장에 신규 상장한 현대사료는 시초가(1만3200원) 대비 가격제한폭인 29.92% 오른 1만7150원에 장을 마쳤다. 이날 종가는 공모가 6600원보다 160% 상승했다. 현대사료는 1983년 설립돼 35년간 돼지, 닭, 오리 등 가축 사육용 배합사료를 생산해왔다. 현재 147개 브랜드를 보유하고 있다. 현대사료는 남북경협주로 상장 전부터 주목을 받으며 지난달 진행한 일반공모 청약경쟁률 1690대 1을 기록하기도 했다."
아시아경제,016790,/news/news_read.nhn?article_id=0004249795&office_id=277&mode=search&query=현대사료&page=1,2018-06-01 09:23,"[특징주]현대사료, 상장 첫날 '상한가'&hellip;공모가 대비 2.6배","[아시아경제 권성회 기자] 현대사료가 코스닥시장 상장 첫날 화려한 데뷔를 치렀다. 1일 오전 9시20분 현재 현대사료는 1만1750원에 거래되고 있다. 현대사료는 이날 공모가(6600원)의 두 배인 1만3200원에 시초가를 형성한 후, 가격제한폭까지 올랐다. 공모가에 비해 2.6배 상승한 것이다. 현대사료는 지난달 공모주 청약 경쟁률 1690대1을 기록하면서 9년 만에 최고를 기록했다. 남북관계 개선 이후 대북 지원이 현실화되면 사료 수요가 늘 것이라는 전망 덕분이었다."
뉴스1,016790,/news/news_read.nhn?article_id=0003403425&office_id=421&mode=search&query=현대사료&page=1,2018-06-01 09:25,현대사료 코스닥시장 신규상장기념식,"1일 오전 한국거래소 서울사옥 홍보관에서 열린 현대사료(주) 코스닥시장 신규상장기념식에서 최규준 한국IR협의회 부회장(왼쪽부터), 정운수 한국거래소 코스닥시장본부장, 문철명 현대사료(주) 대표이사, 이동환 신한금융투자 GIB 부문장, 송윤진 코스닥협회 부회장이 상장기념패 전달 후 박수치고 있다. (한국거래소 제공) 2018.6.1/뉴스1"
아이뉴스24,016790,/news/news_read.nhn?article_id=0000448441&office_id=031&mode=search&query=현대사료&page=1,2018-06-01 09:35,"[특징주] 공모 '돌풍' 현대사료, 상장 첫날 上","[아이뉴스24 장효원 기자] 공모청약에서 9년 만에 최대 경쟁률을 기록했던 현대사료가 상장 첫날 상한가로 직행했다. 1일 오전 9시27분 기준 코스닥시장에서 현대사료는 시초가(1만3천200원)보다 29.92%(3천950원) 상승한 1만7천150원에 거래되고 있다. 공모가 6천600원 대비로는 2.6배 상승한 것이다. 현대사료는 1983년 설립돼 35년간 동물용 배합사료를 생산·판매한 전문회사다. 지난해 매출액은 871억원, 영업이익은 41억원을 기록했다. 당기순이익은 56억원으로 집계됐다. 현대사료는 기관 투자자 대상 수요예측에서 839대 1의 경쟁률을 기록하며 희망밴드 최상단인 6천600원에 공모가를 확정했다. 일반 투자자 대상 청약 결과 경쟁률이 1천690대 1을 기록했고, 청약 증거금으로는 1조7천23억원이 모였다. 이 같은 경쟁률은 2009년 6월5일 상장한 어보브반도체 이후 9년 만에 처음이다. /장효원기자"
파이낸셜뉴스,016790,/news/news_read.nhn?article_id=0004031971&office_id=014&mode=search&query=현대사료&page=1,2018-06-01 09:39,[특징주]현대사료 상장 첫날 상한가,"현대사료가 상장 첫날 상한가로 직행했다. 1일 오전 9시 36분 기준 코스닥시장에서 현대사료는 시초가(1만3200원)보다 29.92%(3950원) 상승한 1만7150원에 거래되고 있다. 공모가 6600원 대비로는 2.6배 상승한 것이다. 현대사료는 1983년 설립돼 35년간 동물용 배합사료를 생산·판매한 전문회사다. 지난해 매출액은 871억원, 영업이익은 41억원을 기록했다. 당기순이익은 56억원으로 집계됐다. 현대사료는 기관 투자자 대상 수요예측에서 839대 1의 경쟁률을 기록하며 희망밴드 최상단인 6600원에 공모가를 확정했다. 일반 투자자 대상 청약 결과 경쟁률이 1690대 1을 기록했고, 청약 증거금으로는 1조7023억원이 모였다. 이 같은 경쟁률은 2009년 6월5일 상장한 어보브반도체 이후 9년 만에 처음이다."
아시아경제,016790,/news/news_read.nhn?article_id=0004251293&office_id=277&mode=search&query=현대사료&page=1,2018-06-04 09:22,"[특징주]현대사료, 상장 이틀째도 '上'&hellip;공모가 대비 237%&uarr;",[아시아경제 임혜선 기자] 현대사료가 코스닥 시장 상장 후 2거래일 연속 급등세다. 4일 오전 9시16분 현재 현대사료는 가격제한폭까지 치솟았다. 현재  주가는 2만2250원이다. 공모가(6600원)보다 237% 상승한 것이다. 현대사료는 상장 첫날인 시초가 1만3200원 대비 가격제한폭인 29.92% 오른 1만7150원에 장을 마쳤다. 증권가들은 사료업종이 남북경협 수혜주로 주목받으면서 현대사료에 대한 기대가 커진 것으로 보고 있다.
이데일리,016790,/news/news_read.nhn?article_id=0004114898&office_id=018&mode=search&query=현대사료&page=1,2018-05-30 17:41,"[마켓인]현대사료, 코스닥 시장 신규상장","[이데일리 김무연 기자] 현대사료가 코스닥 시장 입성에 성공했다. 한국거래소는 현대사료의 코스닥시장 신규상장을 승인한다고 30일 밝혔다. 매매거래는 오는 1일부터 가능하다. 지난 1983년 설립된 현대사료는 양계·양돈용 배합사료를 제조하는 업체로 지난해 871억원의 매출액과 56억원의 당기순이익을 달성했다. 현대사료의 지분 69.82%를 보유한 김종웅 외 3인이 주요주주로 이름을 올렸다. 한편 상장주관은 신한금융투자가 담당했다. 발행가액은 6600원, 액면가는 500원이다."
뉴시스,016790,/news/news_read.nhn?article_id=0008624756&office_id=003&mode=search&query=현대사료&page=1,2018-05-30 18:21,"거래소, 현대사료 내달 1일 코스닥 상장 승인","【서울=뉴시스】이진영 기자 = 한국거래소는  현대사료의 코스닥시장 상장을 승인했다고 30일 밝혔다. 주식 매매는 내달 1일부터 시작된다. 현대사료는 양돈·양계 사료를 제조하는 배합사료 제조사이다. 지난해 매출 871억원, 영업이익 41억원을 기록했다. 주당 발행가액은 6600원, 액면가는 500원이다. 총 공모액은 101억원이며 상장 주관사는 신한금융투자다."
서울경제,016790,/news/news_read.nhn?article_id=0003345532&office_id=011&mode=search&query=현대사료&page=1,2018-07-11 11:03,"&lt;코&gt;현대사료, 전일 대비 9.29% 상승.. 일일회전율은 4.09% 기록","[서울경제] 현대사료(016790) 는 11일 오전 11시 1분 현재 9.29% 오른 30,000원에 거래되고 있으며, 35(매도):65(매수)의 매수우위를 기록하고 있다. 거래대금은 70억5,517만, 거래량은 25만1,835주로 거래량회전율은 4.09%로 나타났다. 지난 1개월간 현대사료는 상한가 5회, 상승 7회, 하락 14회를 기록했고, 주가수익률은 0% 표준편차는 14.18%를 기록했다. 이 기간 ' 음식료·담배업 ' 업종 평균 주가수익률은 -13.74%로 나타났으며, 변동성은 2.24%를 기록했다. 이 시각 현재 ' 음식료·담배업 '은 1.25% 상승 중이며, 40(매도):60(매수)의 매수우위를 기록하고 있다."
아이뉴스24,016790,/news/news_read.nhn?article_id=0000447239&office_id=031&mode=search&query=현대사료&page=1,2018-05-18 14:20,"현대사료, 코스닥 입성&hellip; &quot;농장매입으로 안정적 수익&quot;","[아이뉴스24 장효원 기자] 동물용 배합사료 생산업체 현대사료가 코스닥시장에 입성한다. 공모자금으로 양돈농장을 인수해 안정적 수익구조를 만들 계획이다. 18일 현대사료는 여의도에서 코스닥 신규상장 기자간담회를 갖고 수직계열화를 통해 안정적인 수익창출을 하겠다는 계획을 밝혔다. 유재철 현대사료 이사는 ""2~3년 안에 3곳의 농장을 인수해 총 3만두 규모의 양돈 사업을 진행할 예정""이라며 ""이를 통해 배합사료의 안정적 매출물량을 확보하는 한편 직영 농장의 비육돈 판매 개시로 매출 외형성장과 수익성을 동시에 개선해 나갈 것""이라고 말했다. 회사 측에 따르면 3만두 규모의 양돈농장을 인수할 경우 80억원 정도의 추가 사료 매출이 발생할 수 있다. 또 농장에서 생산되는 축산물 판매량도 연간 200억원에 달할 것으로 추정된다. 특히 축산물 판매의 영업이익률은 20~25% 수준으로 5%대인 사료시장보다 마진이 높을 전망이다. 1983년 설립된 현대사료는 동물용 배합사료를 전문으로 생산하는 회사다. 지난해 기준 전체 매출액 중 양계사료가 62.9%, 양돈사료 23.9%, 기타사료 9.9% 등의 비중을 차지한다. 전체 사료시장에서 1.5%의 시장점유율을 나타내고 있다. 지난해 기준 871억원의 매출과 41억원의 영업이익을 기록해 전년 대비 소폭 감소한 수준을 기록했다. 회사 측은 2016년 하반기 조류독감(AI) 등으로 양계산업이 타격을 입으면서 매출이 감소했지만 지난해 4분기부터 다시 성장이 회복됐다고 설명했다. 특히 현대사료는 물류비와 원자재 가격의 변동에 따른 위험을 최소화해 이익률 5%대를 유지하고 있다. 유 이사는 ""원료를 수입하는 항구를 공장과 가까운 평택항으로 옮기고 판매처도 공장에서 150km내의 농장에 납품하면서 물류비를 최소화했다""며 ""또 외화선도계약을 늘리고 원가 변동분을 2~3개월 내에 사료가격에 반영하면서 손실을 줄였다""고 말했다. 상장 후 현대사료는 고배당정책을 유지할 계획이다. 현대사료는 지난 3년간 매년 주당 300원, 액면가(500원) 대비 60%의 배당을 꾸준히 이어왔다. 앞으로는 순이익을 기준으로 배당성향을 늘릴 것이라는 게 회사의 방침이다. 또 지급보증 규모를 줄일 계획은 없다. 현대사료는 지난해 말 기준 201억원 규모의 지급보증이 있다. 주로 거래처인 농장의 채무에 대한 지급보증인데, 현대사료 관계자에 따르면 농장주의 대출을 보증해 주는 방식으로 영업하기 때문에 지급보증이 생겼다는 설명이다. 한편 현대사료의 공모희망가액은 5천700~6천600원 수준이다. 총 공모예상금액은 86억~100억원이고 오는 23~24일 청약을 거쳐 오는 6월1일 상장할 예정이다. 전액 신주매출로 상장 후 유통물량은 26.95%다. 상장주관사는 신한금융투자다. /장효원기자"
한국경제,016790,/news/news_read.nhn?article_id=0003943165&office_id=015&mode=search&query=현대사료&page=1,2018-05-20 18:59,[이번주 공모주] 배합사료 업체 현대사료 23~24일 일반청약,"[ 이고운 기자  ] 이번주에는 배합사료 제조기업 현대사료가 일반청약을 받는다. 최근 증시에서 사료주가 남북경협 테마주로 주목받고 있어 현대사료 기업공개(IPO)에도 훈풍이 불지 관심이 쏠리고 있다. 현대사료 일반청약일은 23~24일이다. 회사가 제시한 희망공모가 범위는 5700~6600원으로 수요예측(기관투자가 대상 사전청약) 결과를 반영한 최종 공모가는 21일 확정 공시할 예정이다. 공모 규모가 87억~101억원으로 작은 편인데도 ‘남북경협이 가시화되면 사료기업들이 긍정적인 영향을 받을 것’이란 기대가 형성되면서 공모주 시장에서 많은 관심을 받고 있다. 1983년 설립된 현대사료는 양계·양돈사료를 공급하는 회사다. 산란계(알을 낳을 수 있는 산란기 닭) 사료에 강점을 지니고 있다는 게 증권업계의 설명이다. 지난해 현대사료의 산란계 배합사료 시장점유율은 7%로 업계에서 가장 높았다. 이 회사의 지난해 매출은 871억원, 영업이익은 41억원이다."
한국경제TV,016790,/news/news_read.nhn?article_id=0000635959&office_id=215&mode=search&query=현대사료&page=1,2018-05-18 13:11,[미리보는 IPO] 현대사료 &quot;수직계열화 완성해 종합 축산 기업 도약&quot;,"[한국경제TV 방서후 기자] 배합사료 생산업체 현대사료가 다음달 1일 코스닥 시장에 입성합니다. 현대사료는 오늘(18일) 여의도에서 기업공개(IPO) 기자간담회를 열고 양돈 사업 진출을 선언과 함께 종합 축산 기업으로 거듭나겠다는 계획을 밝혔습니다. 지난 1983년 설립된 현대사료는 양계·양돈 등의 배합사료를 제조해 판매하는 업체입니다. 고온·고압을 이용한 가수열처리로 사료 이용성 및 내구성을 개선하고 유해미생물의 완전 살균 처리로 청정 사료를 만들어내는 팽화(Expanding) 공법 등을 국내 최초로 도입했습니다. 축산 농가의 대형화·기업화에 따라 맞춤형 사료 수요가 증가하고 있는 가운데 축종·연령·상황별 맞춤형 배합비 프로그램 운영 등에 주력, 영신양계, 유림축산, 예산농장 등 대규모 농장 운영 고객들과 평균 10년 이상 장기간 거래를 유지해 오고 있습니다. 이에 따라 지난 2016~2017년 조류 인플루엔자(AI) 발생에 따른 대량 살처분에도 제품 품질 개선을 통해 산란계 시장 점유율이 7%로 증가하며 업계 최고 수준을 기록했습니다. 지난해 기준 당기순이익은 56억400만원으로 2015년 22억3,500만원, 2016년 35억1,300만원에 이어 증가세를 보이고 있습니다. 특히 올해에는 닭 진드기 억제용 살비제 및 사료 첨가제를 개발해 제품 포트폴리오도 다양화할 계획입니다. 이를 위해 지난해 10월 마늘추출물 및 허브물질을 적용한 살비제 특허를 출원했으며, 현재까지 대체제가 없는 만큼 매출에 상당 부분 기여할 것이라는 게 시장의 평가입니다. 현대사료는 이같은 기술력을 바탕으로 상장 후 2~3년 내 3곳의 농장을 인수해 총 3만두 규모의 양돈 사업을 진행할 예정입니다. 최근 축산 농장이 등록제에서 허가제로 변경되며 대형 사료나 신선육을 제조하는 회사들이 계열 농장을 확대하는 추세여서 현대사료도 농장을 매입해 수직계열화를 완성화시킨다는 목표입니다. 이를 통해 배합사료의 안정적 매출 물량을 확보하는 한편, 직영 농장의 비육돈 판매 개시로 매출 외형 성장과 수익성을 동시에 개선해 나갈 방침입니다. 현대사료 관계자는 ""사료제품 차별화를 통해 시장 지배력을 강화하고 동물 의약외품 사업 개시를 통한 제품 포트폴리오 다각화, 배합사료 사업에서 축산물 사업으로 연계되는 밸류체인 내재화를 바탕으로 종합 축산 기업으로 도약할 것""이라고 밝혔습니다. 이번 공모 과정에서 현대사료는 총 152만6,180주를 발행해 공모 희망가 밴드(5,700~6,600원) 기준으로 약 86억9,900만~100억7,300만원을 조달할 계획입니다. 오는 23일과 24일 청약을 실시할 예정이며, 주관사는 신한금융투자입니다."
