source,symbol,link,date,title,content
아시아경제,017390,/news/news_read.nhn?article_id=0003610948&office_id=277&mode=search&query=서울가스&page=1,2015-10-26 11:26,[단독]서울시 도시가스 요금 기습 인상 실패,"23일 물가대책심의위원회 열어 처리하려다 '보류'...도시가스연결비용 부담 주체 논란 끝에 위원들 반발  [아시아경제 김봉수 기자] 서울시가 도시가스 요금을 기습적으로 인상하려다 실패한 것으로 뒤늦게 알려졌다. 이사 때 도시가스 연결 비용을 이사하는 당사자가 아닌 시민 전체가 분담하도록 하는 안건을 지난주 물가대책심의에 올렸는데 처리가 보류됐던 것이다. 26일 서울시와 노동당 서울시당에 따르면, 지난 23일 오후 시청사에서 물가대책심의위원회(물대위)가 열렸으며 오는 31일부터 가정용 도시가스 요금을 기본료 월 100원(현재 900원) 인상하고 사용요금도 1㎥당 1.13원씩 각각 올리는 안건이 상정됐다. 하지만 이 안건은 위원들의 반발에 부딪혀 처리되지 못했다. 이 안건이 통과되지 못한 이유는 도시가스 연결 비용 부담 주체를 둘러싼 논란 때문이다. 시는 이번 요금 인상안에서 이사 때 발생하는 도시가스 연결 비용 중 인건비(1만2000원ㆍ재료비는 당사자 부담)를 시민 전체가 분담하도록 도시가스 회사의 공급비용(안전점검비용)에 흡수ㆍ반영하겠다는 방침을 밝혔다. 즉 기본요금을 현재 월 900원에서 1000원으로 올려 한 가구당 연간 1200원씩 더 내도록 하고, 이 돈으로 서울시 전체의 도시가스 연결 비용 인건비를 해결하겠다는 것이다. 그동안 도시가스 업체들이 전입세대들에게 2만5000~2만7000원 가량의 도시가스 연결비를 현장에서 받아가면서 너무 비싸다는 민원이 제기돼왔기 때문이다. 시는 여기에 검침원 등 고객센터 종사자 처우 개선 비용, 도시가스 회사 제반 경비 인상 등을 감안해 인상폭을 정했다. 그러나 회의에서는 대시민 여론 수렴 절차가 전혀 없었다는 점, 요금 인상 시기 일주일 전에서야 기습적으로 물대위 회의를 개최한 점이 문제로 지적됐다. 특히 일부 위원들은 이사하는 사람이 부담해야 할 도시가스 연결비를 기본 요금에 포함시켜 전체 시민들이 부담하도록 하는 것은 수익자 부담 및 형평성의 원칙에 어긋난다고 지적했다. 노동당 서울시당 관계자는 ""대시민 서비스 개선 차원에서 필요하다면 요금을 올릴 수 있지만 일부 가구가 부담해야 할 비용을 시민 전체가 떠안도록 하는 것은 적절치 않다""며 ""직접 이해관계자인 시민들을 상대로 여론 수렴도 없었고, 무엇보다 가스ㆍ전기와 같은 에너지 요금은 기본적으로 사용량에 맞춰 부과해야 하는 데 기본 요금을 인상하는 것은 타당치 않다""고 지적했다. 그러나 시는 오는 11월 물대위를 다시 열어 요금 인상안을 재상정할 계획이다. 시민 개인 입장에서도 10년에 한 번만 이사를 하더라도 본전(월 100원×12개월×10년=1만2000원)을 뽑을 수 있는 등 이익이 되는 일이라 망설일 이유가 없다는 것이다. 시 관계자는 ""그동안 도시가스업체에서 전입세대에게서 과도한 연결비용을 청구한다는 민원이 십여년째 이어지면서 정부가 지난 2013년 도시가스 연결 비용을 당사자에게 직접 청구하지 못하도록 지침을 내렸었다""며 ""여러 차례 언론보도도 됐던 사안이고 시민들의 여론도 나름대로 많이 들었던 사안인데, 더 널리 알리도록 노력하겠다""고 말했다."
이데일리,017390,/news/news_read.nhn?article_id=0003491694&office_id=018&mode=search&query=서울가스&page=1,2016-03-03 16:46,서울도시가스 &quot;국제종합기계 인수 추진 무산&quot;,[이데일리 염지현 기자] 서울도시가스(017390)는 3일 국제종합기게 인수 추진 보도에 대한 조회 공시 답변으로 “사업 다각화의 일환으로 “국제종합기계” 법인 인수를 검토하였으나 인수를 추진하지 않기로 최종 결정했다“고 밝혔다.
머니투데이,017390,/news/news_read.nhn?article_id=0003641259&office_id=008&mode=search&query=서울가스&page=1,2016-03-03 16:45,"서울도시가스, &quot;국제종합기계 인수 추진하지 않기로&quot;","[머니투데이 권화순 기자] 서울도시가스는 국제종합기계 인수 추진설에 대해 ""사업 다각화 일환으로 국제종합기계 법인 인수를 검토했으나 인수를 추진하지 않기로 최종결정했다""고 3일 공시했다. textlinktopstart textlinktopend textlinkstart"
이데일리,017390,/news/news_read.nhn?article_id=0003381670&office_id=018&mode=search&query=서울가스&page=1,2015-10-30 14:25,"서울도시가스, 계열회사에 부동산 매각","[이데일리 김관용 기자] 서울도시가스(017390)가 마포구 연남동 571-10, 강남구 신사동 575, 은평구 응암동 89-1 소재의 부동산(토지 및 건물)을 계열회사인 지알엠에 매각했다고 30일 공시했다. 처분금액은 586억원이다."
뉴시스,017390,/news/news_read.nhn?article_id=0007064428&office_id=003&mode=search&query=서울가스&page=1,2016-02-26 15:53,"서울도시가스, &ldquo;국제종합기계 인수의향서 제출&rdquo;","【서울=뉴시스】서울도시가스는 국제종합기계 인수 추진 보도에 대한 조회공시 요구에 “예비입찰 인수의향서(LOI)를 제출하고 인수에 따른 가상데이터룸(VDR) 재무실사를 진행 중”이라며 “본 입찰이 연기됨에 따라 인수 결정 검토가 지연되고 있으며 현재 결정된 사항은 없다”고 26일 답변했다. ★ 세상에 이런일이 -  교도소 하수구에서 토막시신 100여구 발견 ★ 오늘의 핫 포토 -  몸짱 치어리더 배수현, 아찔한 비키니 몸매"
한국경제,017390,/news/news_read.nhn?article_id=0003577064&office_id=015&mode=search&query=서울가스&page=1,2016-04-10 20:24,AK홀딩스&middot;SK이노베이션&middot;대림산업&middot;서울도시가스&hellip;아들이 '용돈' 주니 주가 힘 솟네,"자회사 현금배당 수입 기업AK홀딩스, 제주항공 배당 59억SK이노, 자회사 3곳서 1000억노루홀딩스·서울도시가스도 쏠쏠 [ 김익환 기자  ] SK이노베이션 AK홀딩스 등이 알짜 자회사로부터 두둑한 ‘용돈’을 받을 예정이다. 12월 결산법인 자회사들이 기말배당금을 지급하는 시점이 이달 초에 몰려 있기 때문이다. 배당 수입으로 회사 ‘곳간’ 사정이 좋아지면 그만큼 기업 가치도 올라갈 것이라는 분석이 나온다. ◆AK홀딩스, 한 달간 주가 13% 상승 AK홀딩스는 지난 8일 유가증권시장에서 3.38% 오른 6만4200원에 마감했다. 애경그룹 지주사인 이 회사는 최근 한 달 새 주가가 13.62% 상승했다. AK홀딩스 자회사인 제주항공이 처음으로 104억원 규모의 배당을 결정한 것이 주가를 밀어올렸다는 평가다. 제주항공 지분 57.2%를 보유한 AK홀딩스는 이달에 59억원의 배당금을 받는다. AK홀딩스의 작년 개별 기준 영업수익(204억원)의 30%에 가까운 액수다. 강선아 KB투자증권 연구원은 “제주항공에서 배당을 받아 AK홀딩스의 현금 창출력이 개선될 것”이라며 “또 다른 자회사인 애경산업이 내년 상반기를 목표로 상장을 추진하는 점도 회사 기업 가치에 보탬이 될 것으로 예상된다”고 말했다. SK그룹의 에너지 중간지주사인 SK이노베이션도 지분 100%를 보유한 자회사 SK에너지, SK종합화학, SK루브리컨츠로부터 올해 두둑한 배당을 받을 예정이다. 지난해 배당하지 않은 SK에너지는 400억원의 기말배당을 실시한다. SK종합화학과 SK루브리컨츠도 각각 442억원, 252억원의 기말배당을 한다. SK종합화학은 작년 11월 3200억원 규모의 중간배당을 했다. ◆합작회사도 고배당 ‘눈길’ 고배당하는 합작사 지분을 보유한 기업들도 눈길을 끈다. 한화케미칼과 대림산업은 50 대 50으로 지분을 투자한 석유화학 합작회사 여천NCC를 통해 높은 배당 수입을 올렸다. 여천NCC는 지난달 두 회사에 각각 1000억원 규모의 기말배당을 했다. 두 회사가 작년에 받은 기말배당(600억원)보다 66.7% 늘어난 금액이다. 서울도시가스는 세계적 자동차 부품업체 콘티넨탈과 35 대 65 비율로 합작한 자동차 부품업체 콘티넨탈오토모티브시스템을 통해 매년 두둑한 배당 수입을 올리고 있다. 이 회사는 2000년 들어 지난해까지 2000억원 규모의 배당금을 챙겼다. 이달에도 2015년 기말배당 명목으로 177억원을 받는다. 본업인 도시가스 사업 부진으로 작년에 25억원의 영업손실을 냈지만 넉넉한 배당금을 받아 투자 여력이 커졌다는 평가다. 국내 페인트 업체들도 알짜 합작사를 통해 쏠쏠한 배당 수입을 올렸다. 노루홀딩스는 세계 1위 페인트업체 악조노벨과 40 대 60으로 지분을 보유한 선박용 페인트 합작법인 아이피케이(IPK)로부터 166억원 규모의 기말배당을 받았다. 작년에 받은 기말배당(80억원)보다 두 배 이상 많은 금액이다. 조광페인트도 노르웨이 페인트업체 요턴과 50 대 50으로 합작한 선박용 페인트 회사 조광요턴에서 지난달 60억원의 배당금을 받았다."
머니투데이,017390,/news/news_read.nhn?article_id=0003569833&office_id=008&mode=search&query=서울가스&page=1,2015-10-30 14:16,"서울가스, 지알엠 주식 586억원 어치 취득","[머니투데이 최경민 기자] 서울가스는 30일 부동산 관련 서비스업을 주요사업으로 하는 계열회사인 지알엠의 주식 585만8190주를 586억원에 취득키로 결정했다고 공시했다. 취득 후 지분율은 100%이고 취득 방법은 토지 및 건물을 통한 현물출자다. 회사측은 취득목적에 대해 ""부동산 관련  전문회사 투자를 통한 사업 다각화""라고 설명했다. textlinktopstart textlinktopend textlinkstart"
머니투데이,017390,/news/news_read.nhn?article_id=0003569827&office_id=008&mode=search&query=서울가스&page=1,2015-10-30 14:11,"서울도시가스, 586억원 규모 부동산 처분","[머니투데이 최경민 기자] 서울가스는 30일 서울 마포구 연남동 571-10, 강남구 신사동 575, 은평구 응암동 89-1에 소재한 토지 및 건물을 지알엠에 처분키로 결정했다고 공시했다. 처분금액은 586억원으로 자산총액 대비 3.6% 수준이다. textlinktopstart textlinktopend textlinkstart"
이데일리,017390,/news/news_read.nhn?article_id=0003488126&office_id=018&mode=search&query=서울가스&page=1,2016-02-26 16:10,서울도시가스 &ldquo;국제종합기계 인수결정 검토 지연&rdquo;,[이데일리 박철근 기자] 서울도시가스(017390)는 26일 조회공시답변을 통해 “국제종합기계 인수와 관련해 예비입찰 인수의향서를 제출하고 인수에 따른 가상데이터룸 재무실사를 진행중”이라고 밝혔다.
한국경제,017390,/news/news_read.nhn?article_id=0003496655&office_id=015&mode=search&query=서울가스&page=1,2015-12-09 14:15,서울시 도시가스공급비용 14일 재심의 '관심집중',"[한경닷컴 콤파스뉴스=박남철 기자] 지난해에 이어 올해도 서울시의 도시가스공급비용반영(안)이 지난달 23일 부결되고 오는 14일 재심의하기로 함에 따라 서울지역 5개 도시가스사의 관심이 집중되고 있다. 쟁점은 현행 기본요금 900원을 1000원으로 전체 2.25원 인상하는 안이다. 지난달 23일 열린 물가대책심의위원회에서 도시가스공급비용 반영과 관련 일부 심의위원은 고객센터 처우개선을 위해 비용을 인상한다해도 고객센터 사장이 이를 착복할 소지가 있다고 주장했고, 연결비용폐지에 따른 교차보조문제도 이사를 간 사람과 가지 않은 사람의 문제가 쟁점이 된 것으로 알려졌다. 서울시 물가대책심의위원은 위원장을 포함해 23명 중 당연직 서울시 국장급 5명과 시의원, 언론인, 회계법인, 교수, 노동단체, 소비자단체 등의 투표결과 과반수의 찬성으로 의결된다. 이번 조정안은 기본요금을 1㎥ 당 현행 900원에서 1000원으로 인상하는 방안이 쟁점이며 공급비용도 1㎥당 1.13원을 포함해 전체 2.25원 인상에 불과해 도시가스사가 주장하는 물량정산분과 투자비 고객센터 처우개선 비용에는 크게 미치지 못한다는 것이 도시가스업계의 반응이다. 서울지역 도시가스업계 관계자는 ""지난해에 이어 올해도 판매물량이 크게 감소했다""면서 ""소비자 전출입시 가스레인지 연결비용 폐지와 검침비용 등을 고려할 때 최소한의 공급비용을 늦어도 8월까지 조정해 9월부터 반영해야 한다""고 강조했다."
전자신문,017390,/news/news_read.nhn?article_id=0002481078&office_id=030&mode=search&query=서울가스&page=1,2016-05-23 11:15,"[@테마]서울가스_외국인/개인 순매수, 기관은 순매도(한달누적)",HTML PUBLIC '-//W3C//DTD HTML 4.01 Transitional//EN'
전자신문,017390,/news/news_read.nhn?article_id=0002481708&office_id=030&mode=search&query=서울가스&page=1,2016-05-24 13:24,"[@테마]서울가스_관련종목들도 일제히 하락, 전기가스업업종 +0.52%",HTML PUBLIC '-//W3C//DTD HTML 4.01 Transitional//EN'
디지털타임스,017390,/news/news_read.nhn?article_id=0002345845&office_id=029&mode=search&query=서울가스&page=1,2016-05-27 14:30,"서울도시가스, 가스안전 공로 은탑산업훈장 수훈","23회 가스안전대상 행사 진행 27일 63빌딩 컨벤션센터에서 열린 제23회 대한민국 가스안전대상 행사 참석자들이 기념촬영을 하고 있다. &lt;산업통상자원부 제공&gt;  산업통상자원부와 한국가스안전공사는 제23회 대한민국 가스안전대상 행사를 27일 63빌딩 컨벤션센터에서 열었다고 밝혔다. 이날 행사에서 유승배 서울도시가스 대표는 도시가스 안전관리 공로로 은탑산업훈장을 수훈했다. 또 이영도 동덕산업가스 대표이사는 철탑산업훈장을, 지덕림 가스안전공사 처장과 윤인식 군산도시가스 대표이사가 산업포장을 각각 받았다. 김순재 한국가스공사 실장과 이호균 나노켐 이사는 대통령 표창을 받았다. 또 이번 행사에선 가스안전 결의 퍼포먼스, 가스안전 우수사례 발표도 진행됐다. 이번 행사와 연계해 산업부와 가스안전공사는 지난 23일부터 27일까지 5일간 전국 단위 가스안전 주간행사를 벌였다. 우태희 산업부 2차관은 ""점차 대형, 복잡해지는 가스 사용 환경에 대응하기 위해 정부와 가스업계 공동의 노력이 필요하다""며 ""정부는 취약계층 가스시설 개선 지원, 가스안전 인프라 구축, 안전산업 육성과 규제 개혁 등에 정책 역량을 집중하겠다""고 강조했다. 박기동 가스안전공사 사장은 ""가스산업인 모두가 기술혁신과 역량 강화로 가스 사고 없는 대한민국을 만들어야 한다""며 ""2020년까지 글로벌 톱 10대 기술확보와 내년 100만가구 당 인명피해율 5.0명 이하의 목표를 조기 달성하겠다""고 말했다."
YTN,017390,/news/news_read.nhn?article_id=0000847078&office_id=052&mode=search&query=서울가스&page=1,2016-05-27 12:09,가스안전대상 은탑훈장에 서울도시가스 대표,"산업통상자원부과 한국가스안전공사는 오늘(27일) 서울 63빌딩에서 가스안전문화 확산을 위해 '가스안전대상' 행사를 열었습니다. 국내 최초로 도시가스 배관 정밀안전 진단기술을 개발한 유승배 서울도시가스 대표이사가 은탑산업훈장을 받았습니다. 또, 산업용 고압가스 안전관리와 수소산업 기술력 향상에 이바지한 이영도 동덕산업가스 대표가 철탑산업훈장을 받는 등 도시가스 안전관리에 기여한 유공자 39명이 상을 받았습니다. 가스안전대상은 1994년 시작된 연례 행사로, 올해는 가스안전 신기술 전시회, 안전 체험행사 등도 함께 진행됐습니다."
아시아경제,017390,/news/news_read.nhn?article_id=0003755034&office_id=277&mode=search&query=서울가스&page=1,2016-05-27 06:39,가스안전대상 개최&hellip;은탑산업훈장에 유승배 서울도시가스 대표,"[아시아경제 조슬기나 기자]산업통상자원부(장관 주형환)은 27일 오전 63빌딩 컨벤션센터에서 ‘제23회 대한민국 가스안전대상’ 행사를 개최하고 가스안전에 기여한 유공자 39명에 대해 포상했다고 밝혔다. 최고 영예인 은탑산업훈장은 유승배 서울도시가스 대표이사에게 수여됐다. 유 대표는 세계 최초 도시가스 원격감시제어 시스템 구축과 국내 최초 도시가스 배관 정밀안전 진단기술을 개발한 공로를 인정받았다. 이영도 동덕산업가스 대표는 국내 최초 차량용 수소 충전소 설치ㆍ운영 및 초고순도 수소 제조공정 개발ㆍ공급에 기여해 철탑산업훈장을 받았다. 산업포장은 윤인식 군산도시가스 대표, 지덕림 한국가스안전공사 처장이 이름을 올렸다. 대통령 표창은 이호균 나노켐 이사, 김순재 한국가스공사 실장, 청주시(단체), 휴켐스(단체)가, 국무총리 표창은 성학구 한국가스기술공사 실장, 김영태 협창건설 대표, 김종율 삼천리 부장, 서초구(단체)가 받았다. 우태희 산업부 제2차관은 ""취약계층 가스시설 개선 지원, 가스안전 인프라 구축,  안전산업 육성과 규제 혁파 등에 정책 역량을 집중하겠다""고 말했다. 한편 산업부와 한국가스안전공사는 ‘안전한 대한민국 만들기’의 일환으로 5월 23~27일 ‘가스안전 주간행사’를 전국 단위로 개최했다. 이 일환으로 우 차관은 26일 광주광역시를 방문, LP가스 고무호스를 금속배관으로 교체해주는 사업 현장을 점검한다. 또 국민 가스안전 의식을 높이기 위한 가스안전 신기술 전시회, 안전 체험행사, 국제 세미나 등 전국에서 37개 행사가 진행된다."
한국경제,017390,/news/news_read.nhn?article_id=0003499273&office_id=015&mode=search&query=서울가스&page=1,2015-12-11 19:28,서울도시가스 '안전의식 강화' 결의대회 시행,"[한경닷컴 콤파스뉴스=박남철 기자] 서울도시가스(사장 유승배)는 11일 '동절기 대비 안전의식 강화 결의대회'를 열어 모든 직원들의 안전의식 고취와 함께 현장 직원들의 노고를 격려하기 위해 가스안전 유공자 시상을 병행 실시했다. 이날 행사에서는 가스 예방안전에 기여한 유공자 11명에 대해 포상과 지사별 안전사고 예방사례 발표 및 모범사례 공유를 통해 안전의식을 더 높였다. 모든 참석자들은 가스안전 결의문을 제창하고, 결의문에 자신의 의지와 각오를 기록해 실천의지를 다짐했다. 유승배 사장은 대회사에서 ""가스사용량 증가와 연말연시에 발생 할 수 있는 안전사고를 예방하기 위해 모든 직원은 안전을 최우선으로 하고 기본과 원칙을 준수해야 한다""고 말했다. 또한 ""최 일선에서 묵묵히 안전을 지키는 현장직원들의 노고에 감사드린다""라며 ""최근 테러 등 안전을 위협하는 요소들이 점점 증가하고 있는 현실에서 비상시 위기대응체계를 기반으로 종합적 안전관리시스템을 재점검하고 현장에서 예방안전관리를 실천할 것""을 강조했다. 한편 서울도시가스는 가스를 많이 사용하는 동절기를 맞아 모든 역량을 동원해 안전하고 경제적이며 편리한 도시가스를 고객에게 공급 할 수 있도록 최선 다해 나갈 것이라고 밝혔다."
이데일리,017390,/news/news_read.nhn?article_id=0003609951&office_id=018&mode=search&query=서울가스&page=1,2016-08-16 14:54,"[등기이사 연봉]서울도시가스, 김영민 회장에 상반기 7억원 지급",[이데일리 신정은 기자] 서울도시가스(017390)는 김영민 회장에 상반기 7억5000만원의 보수를 지급했다고 16일 공시했다. 서울도시가스는 보수 산정기준에 대해 “임원보수지급규정에 따라 월 1억2500만원을 지급하고 있다”며 “정기주주총회에서 사내이사 및 사외이사를 포함해 이사 총 보수한도를 승인했으며 직급별 보수지급기준은 이사회에서 승인한 임원보수지급규정에 따른다”고 설명했다.
한국경제,017390,/news/news_read.nhn?article_id=0003506432&office_id=015&mode=search&query=서울가스&page=1,2015-12-22 13:51,"서울도시가스그룹, 송년행사 시행","[한경닷컴 콤파스뉴스=박남철 기자] 서울도시가스그룹(대표이사 유승배)은 지난 22일 서울도시가스 본사 대강당에서 그룹임직원 및 협력업체 관계자, 그리고 그룹발전을 위해 공헌한 퇴직임원 부부를 초청해 한해를 되돌아보는 송년행사를 개최했다. 이날 행사는 참석자 모두가 다 같이 성탄 찬송을 부르면서 시작했으며, 사우 합창팀의 축하공연과 지난 1년간의 사업장별 사업실적을 영상으로 상영하는 등 임직원 모두가 한마음으로 애사심을 고취하는 시간을 마련했다. 그룹 최고경영자는 지난 한해 서울도시가스그룹의 발전을 위해 임직원 모두가 최선을 다해준 것에 감사하며, 항상 회사와 가정에 최선을 다하는 임직원이 되어 줄 것을 당부하는 성탄메시지를 전했다. 행사 끝 순서로 참석자 모두가 상호인사를 통해 크리스마스와 2016년 새해 인사를 미리 나누며, 행사를 마무리 했다."
한국경제,017390,/news/news_read.nhn?article_id=0003507550&office_id=015&mode=search&query=서울가스&page=1,2015-12-23 15:27,서울도시가스 '가족친화우수기업' 국무총리표창 수상,서울도시가스(대표이사 유승배)가 22일 2015년 가족친화우수기업으로 국무총리 '단체' 표창을 수상했다. 이날 시상식은 대한상공회의소 국제회의장에서 주요기업 및 기관 관계자 400여명이 참석한 가운데 여성가족부 장관이 참석해 서울도시가스를 비롯 총 28개 가족친화 우수기업 기관에 포상한 뒤 신규 인증기업에 가족친화인증을 수여했다. 2008년부터 시작된 가족친화우수기업인증 제도는 올해 처음 신청한 602개사 가운데 531개사가 인증을 통과해 현재 총 1363개사로 확대됐다. 서울도시가스는 생명가치존중과 정직 신의 사랑을 바탕으로 한 가족친화적 직장문화 정착과 확산을 모범적으로 실현했다는 평가를 받고 있다. 특히 서울도시가스는 가족친화경영대상 국가생산성대상(국무총리 표창)수상과 가족친화우수기업 국무총리표창을 차례로 수상해 도시가스업계의 모범이 되어왔고 가족친화경영을 바탕으로 회사업무와 가정 모두의 충족시키기 위한 생산성 향상을 통해 지속성장하는 기업문화를 조성해 왔다. 가족친화 우수기업 포상은 육아휴직 유연근무제 등 일 가정 양립이 가능한 가족친화 우수기업 기관에 여성가족부가 인증을 부여하고 이들 인증기업 중 가족친화제도를 모범적으로 운영하고 있는 기업과 기관을 선정해 표창을 수상하고 있다. 서울도시가스가 2015년 가족친화우수기업으로 국무총리 단체 표창을 수상한 후 기념촬영을 하고 있다.
