source,symbol,link,date,title,content
SBS 뉴스,017390,/news/news_read.nhn?article_id=0000489043&office_id=055&mode=search&query=서울가스&page=1,2016-12-27 14:11,"서울 도시가스 연결비, 가스비와 분리&hellip;가스 시공 시장 개방","도시가스비용에 포함돼 매달 모든 세대에 일괄적으로 부과돼온 도시가스 연결비용이 도시가스 비용에서 제외됩니다. 가격상한제와 정액승인제 등 가격 제한을 받았던 위성방송과 인터넷TV 요금은 기본·결합상품을 제외하고 모두 신고제로 전환됩니다. 공정거래위원회는 경쟁제한적 규제 개선방안을 확정했다고 밝혔습니다. 이들 규제개선은 공공분야 독점 시장의 경쟁원리 도입, 불합리한 사업활동 제한 개선 등이 기본 방향입니다. 정부는 내년 12월 서울시 도시가스 공급규정 개정을 추진해 도시가스 연결서비스 비용을 가스사용요금과 분리하되 청구 비용은 인건비 원가를 초과하지 않도록 하기로 했습니다. 이를 통해 가스시공업자가 도시가스 연결서비스 시장에 진입할 수 있어 서비스 요금을 합리화할 수 있을 것으로 정부는 기대하고 있습니다. 기존 케이블과 위성방송은 가격상한제, 인터넷TV는 정액승인제 제한을 받아온 유료방송요금은 신고제로 전환됩니다. 기존 제도가 인터넷TV 사업자의 요금 인하를 막아 지역 독점사업자인 케이블방송 등과의 경쟁을 제한한다는 지적에 따른 것입니다. 단 기본상품과 결합상품에 대해서는 승인제 골격을 유지하기로 했습니다."
연합뉴스,017390,/news/news_read.nhn?article_id=0008917428&office_id=001&mode=search&query=서울가스&page=1,2016-12-27 12:00,유료방송요금 신고제로&hellip;서울 도시가스요금서 설치비 분리,"[연합뉴스TV제공]
 법무사 비용 지정제에서 상한제로 변경 정부, 하반기 경쟁 제한적 규제 6건 개선방안 확정 (세종=연합뉴스) 민경락 기자 = 도시가스비용에 포함돼 매달 모든 세대에 일괄적으로 부과되어온 도시가스 연결비용이 도시가스비용에서 제외된다. 가격상한제·정액승인제 등 가격 제한을 받았던 위성방송·인터넷TV(IPTV) 요금은 기본·결합상품을 제외하고 모두 신고제로 전환된다. 공정거래위원회는 국무조정실과 함께 올해 하반기 추진한 6건의 경쟁제한적 규제 개선방안을 확정했다고 27일 밝혔다. 6건의 규제개선은 공공분야 독점 시장의 경쟁원리 도입, 불합리한 사업활동 제한 개선 등이 기본 방향이다. 규제개선안에는 서울시 도시가스 연결비용을 도시가스요금과 분리하는 내용이 담겼다. 지금까지 가스레인지에 도시가스를 연결할 때 드는 연결서비스 비용은 도시가스요금으로 모든 세대에 매달 약 100원씩 일괄적으로 부과돼 수익자 부담 원칙에 맞지 않는다는 지적이 제기돼왔다. 또 연결비용이 일괄적으로 부과되다 보니 민간 가스시공업자는 도시가스 연결서비스 시장에 진입할 수 없다는 문제도 있었다. 정부는 내년 12월 서울시 도시가스 공급규정 개정을 추진해 도시가스 연결서비스 비용을 가스사용요금과 분리하되 청구 비용은 인건비 원가를 초과하지 않도록 하기로 했다. 이를 통해 가스시공업자가 도시가스 연결서비스 시장에 진입할 수 있어 서비스 요금을 합리화할 수 있을 것으로 정부는 기대하고 있다. 기존 가격상한제(케이블·위성방송)와 정액승인제(IPTV) 제한을 받아온 유료방송요금은 신고제로 전환된다. 기존 제도가 IPTV 사업자의 요금 인하를 막아 지역 독점사업자인 케이블방송 등과의 경쟁을 제한한다는 지적에 따른 것이다. 단 기본상품과 결합상품에 대해서는 승인제 골격을 유지하기로 했다. 정부는 내년 12월 관련 법안 개정을 추진할 방침이다. 국가가 설치·관리하는 항로 표지인 철탑등대·등주의 제작·수리가 내년 12월 민간에 전면 개방된다. 지금까지 철탑등대·등주의 제작·수리 업무는 항로표지기술협회에만 위탁돼 가격·서비스 경쟁이 제대로 이뤄지지 않는다는 지적이 있었다. 부표는 제작만 민간에 개방하고 수리는 공공성을 이유로 항로표지기술협회에서 종전대로 독점 수행한다. 지난해 철탑등대·등주 제작·수리, 부표 제작 비용은 19억4천만원에 달한다. 농업기술실용화재단이 독점하던 농업기계 검정대행 업무에 경쟁체제가 도입된다. 지금까지 농업기계를 제조·수입해 판매하려면 농업기술실용화재단이 있는 경기도 수원까지 기계를 옮겨 검정을 받아야 했다. 정부는 내년 12월까지 검정대행기관을 추가 지정하는 안을 추진해 농업기계 제조·수입업자의 검정기관 선택권을 확대할 방침이다. 대한법무사협회 회칙에 정액·정률로 정해진 법무사 서비스 보수 기준은 기존 지정제에서 상한제로 변경하는 안이 내년 6월 추진된다. 요금을 자유롭게 책정할 수 있도록 함으로써 신규 법무사의 시장진입을 쉽게 하고 가격 경쟁을 통해 소비자의 부담을 줄일 수 있는 토대를 마련하겠다는 것이다. 주택건설·대지조성 사업을 하려면 22㎡ 이상의 사무실을 확보하도록 한 규정은 내년 7월 폐지하기로 했다. 일정 규모 이상의 사무실 확보에 써야 하는 영업비용 부담을 줄임으로써 주택건설·대지조성 사업을 촉진하겠다는 의도다."
한국경제,017390,/news/news_read.nhn?article_id=0003555184&office_id=015&mode=search&query=서울가스&page=1,2016-02-26 15:31,서울가스 &quot;국제종합기계 예비입찰서 제출&hellip;결정된 것 없다&quot;,"[ 박상재 기자  ] 서울가스는 26일 국제종합기계 인수 추진설 관련 조회공시 답변을 통해 ""사업 다각화 일환으로 예비입찰 인수의향서(LOI)를 제출했다""며 ""가상데이터룸(VDR) 재무실사를 진행중""이라고 밝혔다. 회사 측은 ""다만 본입찰이 연기돼 인수 결정 검토가 지연되고 있다""며 ""결정된 사항은 없다""고 덧붙였다. 박상재 한경닷컴 기자"
파이낸셜뉴스,017390,/news/news_read.nhn?article_id=0004083550&office_id=014&mode=search&query=서울가스&page=1,2018-08-29 11:27,"[fnRASSI]서울가스, 당일 거래량 증가하며 4거래일 하락세 지속","서울가스(017390)는 당일 거래량 증가로 최근 5거래일 거래량의 최고치를 넘어섰다. 그리고 서울가스는 4일 연속 하락흐름을 보이며, 11시 25분 현재 1.03% 내린 86,100원에 거래중이다. 외국인, 기관 모두 보유량 증가 (5일 누적) 최근 5일간 동종목의 외국인 투자자는 340주 순매수하였고 마찬가지로 기관은 6주 순매수하였다. 전날 기관은 6주 매도했지만 외국인은 순매수량이 0으로 보유비율 그대로 유지했다. 다음 표는 동종목의 외국인, 기관의 일별 순매수량을 나타낸 것이다. 거래비중 기관 15.85%, 외국인 19.27% 최근 한달간 주체별 거래비중을 살펴보면 개인이 64.86%, 외국인이 19.27%, 기관은 15.85%를 기록했다. 그리고 최근 5일간 거래비중은 개인이 전체 거래량의 77.56%를 차지하며 가장 활발한 참여를 보였고, 외국인은 17.92%, 기관은 4.5%의 거래 참여율을 보였다. 'fnRASSI'는 증권전문 기업 씽크풀과 파이낸셜뉴스의 협업으로 로봇기자가 실시간으로 생산하는 기사입니다."
뉴시스,017390,/news/news_read.nhn?article_id=0007762006&office_id=003&mode=search&query=서울가스&page=1,2017-02-09 19:58,"서울도시가스, 지난해 연결 영업손실 67억&hellip;전년比 171%&darr;",【서울=뉴시스】최예린 기자 = 서울도시가스(017390)는 지난해 연결재무제표 기준 영업손실이 67억원으로 전년 대비 170.5% 줄었다고 9일 공시했다. 같은 기간 매출액은 1조2722억5560만원으로 17.4% 줄었고 당기순이익은 234억8837만원으로 47.6% 감소했다.
뉴시스,017390,/news/news_read.nhn?article_id=0007761522&office_id=003&mode=search&query=서울가스&page=1,2017-02-09 17:11,"서울도시가스, 주당 1750원 현금배당 결정",【서울=뉴시스】최예린 기자 = 서울도시가스(017390)는 보통주 1주당 1750원의 현금배당을 결정했다고 9일 공시했다. 시가배당율은 2.2%이며 총 배당금액은 67억9931만원 규모다.
이데일리,017390,/news/news_read.nhn?article_id=0003745718&office_id=018&mode=search&query=서울가스&page=1,2017-02-09 16:47,"서울도시가스, 지난해 영업손실 67억..전년비 적자폭 확대","[이데일리 이유미 기자] 서울도시가스(017390)는 지난해 영업손실이 67억원으로 전년 동기 대비 적자폭이 증가했다고 9일 공시했다. 같은기간 매출액은 1조2723억원으로 17.4%, 당기순이익은 235억원으로 47,6% 감소했다."
이데일리,017390,/news/news_read.nhn?article_id=0003745703&office_id=018&mode=search&query=서울가스&page=1,2017-02-09 16:39,"서울도시가스, 주당 1750원 현금배당 결정",[이데일리 이유미 기자] 서울도시가스(017390)는 보통주 1주당 1750원의 현금배당을 결정했다고 9일 공시했다. 배당금총액은 68억원이다. 시가배당율은 2.2%다.
파이낸셜뉴스,017390,/news/news_read.nhn?article_id=0004076901&office_id=014&mode=search&query=서울가스&page=1,2018-08-17 11:29,"[fnRASSI]서울가스, 0.33% 내리며 거래량 증가","서울가스(017390)의 현재 거래량이 최근 5거래일 거래량의 최고치를 경신하며 투자자들의 관심을 받고 있다. 그리고 현재 전 거래일보다 0.33% 감소하여 3일 연속 하락흐름을 보이고 있다. 거래비중 기관 29.34%, 외국인 15.9% 최근 한달간 주체별 거래비중을 살펴보면 개인이 전체 거래의 54.75%를 차지하며 가장 적극적인 모습을 보여줬고, 기관은 29.34%를 나타냈으며 외국인은 15.9%를 나타냈다. 그리고 최근 5일간 거래비중은 개인이 59.95%로 가장 높은 참여율을 보였고, 기관이 39.81%를 보였으며 외국인은 0.22%를 나타냈다. 퀀트 재무분석, 종합점수 44점으로 상승                    지표               항목               값               종합점수                 성장성               매출액증가율               -0.03               5.14                 자기자본증가율               0.02                 안정성               부채비율               68.91               8.09                 유동비율               190.4                 이익안정성               6.67                 수익성               ROA               2.5               4.21                 ROE               4.22                 영업이익율               1.11          서울가스의 퀀트 재무 점수는 17.44점으로 3개월 이전 16.4점보다 올랐다. 지난 분기에 비해 성장성 점수가 상승했다. 이는 매출액 증가율이 증가하였기 때문이다. 수익성 측면에서 볼때 ROA, ROE, 영업이익률 모두 개선되어 이전보다 좋은 점수를 받았다. 'fnRASSI'는 증권전문 기업 씽크풀과 파이낸셜뉴스의 협업으로 로봇기자가 실시간으로 생산하는 기사입니다."
연합뉴스,017390,/news/news_read.nhn?article_id=0009020788&office_id=001&mode=search&query=서울가스&page=1,2017-02-09 16:16,"서울도시가스, 작년 영업손실 68억원&hellip;적자 확대","(서울=연합뉴스) 조민정 기자 = 서울도시가스는 작년 연결 영업손실이 68억원으로 적자 폭이 전년보다 170.5% 확대됐다고 9일 공시했다. 매출액은 1조2천722억원으로 17.4% 감소했고 당기순이익은 235억원으로 47.6% 감소했다. 회사 측은 ""도시가스 판매 단가 하락으로 매출액과 영업마진이 감소했다""며 ""당기순이익 감소는 금융수익과 관계회사투자이익이 줄어든데 따른 것""이라고 설명했다."
아시아경제,017390,/news/news_read.nhn?article_id=0003929242&office_id=277&mode=search&query=서울가스&page=1,2017-02-09 16:14,서울도시가스 주당 1750원 현금배당,[아시아경제 박선미 기자]
뉴스1,017390,/news/news_read.nhn?article_id=0001859228&office_id=421&mode=search&query=서울가스&page=1,2016-01-26 18:08,"서울도시가스, 국제종합기계 인수의향서 제출","(서울=뉴스1) 박기락 기자 = 서울도시가스는 국제종합기계 인수 추진과 관련한 한국거래소의 조회공시 요구에 대해 ""예비 입찰 인수의향서를 제출했으나 아직 검토 중이며 확정된 사항은 없다""고 26일 공시했다."
이데일리,017390,/news/news_read.nhn?article_id=0004167717&office_id=018&mode=search&query=서울가스&page=1,2018-08-08 17:04,"서울도시가스, 가스 요금할인 서비스앱 '가스락' 출시","도시가스 업계 최초 모바일 요금할인 혜택 서비스출시 기념, 캐시 적립 혜택 등 다양한 이벤트 [이데일리 정태선 기자] 서울도시가스가 모바일 요금할인 혜택 서비스 ‘가스락’을 출시했다. 가스락은 서울도시가스 요금할인 혜택을 제공하는 솔루션 서비스로, 잠금화면을 열거나 액션형 광고와 이벤트 등에 참여해 캐시를 적립하고 이를 매달 지출되는 가스비 할인에 활용할 수 있다. 가스락에 적립한 캐시를 활용해 받는 요금할인은 ‘익월 청구 할인’ 방식으로 캐시 사용 신청 시 사용자 개인이나 가족이 함께 모은 캐시만큼 익월 도시가스 요금에서 자동 차감되어 고지서가 발행된다. 서울도시가스 관계자는 “서비스의 출시를 기념해 캐시적립 혜택을 강화한 이벤트를 다양하게 마련했다”며 “서울도시가스 이용에 도움이 되는 실용적 서비스를 제공해 고객과의 소통을 강화하겠다”고 말했다."
서울경제,017390,/news/news_read.nhn?article_id=0002793229&office_id=011&mode=search&query=서울가스&page=1,2016-01-26 18:08,[기업 공시] 서울도시가스 外,"▲서울도시가스=국제종합기계 인수 추진 보도에 대한 조회공시 요구 ▲동국제강=국제종합기계 지분매각을 추진 중에 있으며 한영회계법인을 매각 주관사로 선정해 인수의향서(LOI)를 제출 받음 ▲이엔쓰리=새 대표이사에 정영우씨 선임 ▲동양=현대중공업과 62억원 규모 공급계약 체결 ▲동양물산기업=액면가 5,000원에서 500원으로 주식분할 결정 ▲KSS해운=주가안정 위해 20억원 규모 자기주식 취득 결정 ▲보통주 1주당 현금배당=KT스카이라이프 350원, 현대차 3,000원 ▲우선주 1주당 현금배당=현대차 3,100원  ▲동양=주주가치 제고 위한 방안 검토, 관할 법원에 회생절차 종결 신청 ▲중국원양자원=사외이사가 1만2,500주 장내매수 ▲삼성SDI=보통주 1주당 1,000원 배당 결정 ▲현대해상=중국 계열사가 현지 재보험사와 재보험금 지급 청구소송에서 패소 ▲한신공영=와우2지구 지역주택조합에 500억원 채무보증 결정 ▲참엔지니어링=신주발행금지 가처분 및 임시주총결의 무효확인 소송이 제기됨 ▲코아스=횡령·배임 혐의 발생, 매매거래 정지 ▲보루네오가구=송달석 외 5명이 임시 지위를 정하는 가처분 신청   ▲나스미디어=서울시 도시철도공사와 215억원 규모 광고대행사업 계약 체결 ▲자연과 환경=동래온천관광호텔로부터 360억원 규모 공사 수주 ▲메디아나=주당 0.2주 무상증자 결정 ▲SGA=자회사 넷인프라 흡수합병 결정 ▲테스=박막증착 장치 관련 특허권 취득 ▲코아스템=세포배양장치 관련 특허권 취득 ▲코아크로스=5억원 규모 제3자배정 유상증자 결정 ▲보통주 1주당 현금배당=삼천당제약 50원, 삼현철강 150원   ▲SH홀딩스=미전환사채 전환가액 981원에서 965원으로 조정 ▲씨그널엔터테인먼트그룹=중국 화이자신을 상대로 제3자배정 유상증자 결정 ▲한국정보통신=인터넷 전문은행 K뱅크 준비법인에 37억원 출자 ▲오공=김윤정 단독 대표이사 체제로 변경 ▲자연과 환경=거래소가 최대주주 지분매각 관련 조회공시 요구 ▲백산OPC=한프로 상호 변경 ▲에이디칩스=종속회사 케이앤씨코리아 흡수합병 결정 ▲세우테크=운영자금 50억원 마련을 위해 전환사채 발행 결정"
머니투데이,017390,/news/news_read.nhn?article_id=0003619052&office_id=008&mode=search&query=서울가스&page=1,2016-01-25 17:25,"대성그룹 계열 서울가스, 국제종합기계 인수 추진","[머니투데이 최동수 기자] [도시가스 사업부 영업이익 감소로 사업다각화 뛰어들어] 대성그룹 계열 서울도시가스(종목명 서울가스)가 국내 농기계 4위 업체인 국제종합기계 인수를 추진한다. 도시가스 시장의 성장이 한계에 달한 서울가스가 사업다각화에 나선 것으로 풀이된다. 25일 IB(투자은행)업계에 따르면 서울도시가스는 지난 20일 열린 국제종합기계 예비입찰에 인수의향서(LOI)를 제출했다. 이날 예비입찰에 참여한 곳은 10여 곳으로 해외 농기계 업체를 포함해 다수의 재무적투자자(FI)가 포함된 것으로 알려졌다. 이중 서울도시가스가 국제종합기계 인수전에 뛰어든 것은 주력 사업부인 도시가스 사업부가 부진한 실적을 내고 있어서다. 이 회사의 지난해 3분기 연결기준 누적매출액은 1조1087억원으로 전년 대비 10% 감소했고, 같은 기간 영업이익은 1억3000만원으로 급감했다. 2014년 연결영업이익은 74억원으로 2013년 대비 50% 가까이 줄어드는 등 2년 연속 영업이익이 큰 폭으로 감소했다. 도시가스가 다른 연료 대비 가격경쟁력이 떨어지면서 매출의 큰 부분을 차지했던 산업용 도시가스 판매물량이 줄었기 때문이다. 김영민 서울도시가스 회장의 남다른 농업사업에 대한 관심도 이번 입찰에 참여하는 계기가 됐다는 분석이다. 김 회장은 2012년 사업 다각화가 차원에서 고구마와 감자를 재배하는 농업회사법인인 굿랜드와 굿가든을 설립했다. 2013년 굿랜드를 굿가든에 흡수합병 시킨 이후 지금까지 약 200억원 이상을 농업사업에 투자했다. 업계 관계자는 ""농업사업에 관심이 많은 김 회장이 트랙터, 이앙기, 콤바인 등을 생산하는 국제종합기계를 인수해 기존 사업과 시너지를 내려고 할 것""이라며 ""국제종합기계가 워크아웃 이후 흑자전환에 성공하는 등 회사 사정이 좋아지자 이번 인수전 참여를 결정한 것 같다""고 말했다. 국제종합기계 매각주관사인 EY한영회계법인은 조만간 예비입찰에 참여한 기업들을 대상으로 적격예비인수후보(숏리스트)를 선정한 후 본입찰을 진행할 계획이다. 국제종합기계 매각대상은 동국제강이 보유하고 있는 지분 50.8%와 산업은행 등 채권단 지분 49.2%다. IB업계 관계자는 ""매각자 측인 동국제강은 1000억원 안팎을 요구하고 있고 인수자 측은 500억원 내외를 계획하고 있다""며 ""매각자와 인수자간 가격 격차가 얼마만큼 줄어드느냐에 따라 매각 성사여부가 결정될 것""이라고 말했다. textlinktopstart textlinktopend textlinkstart"
아시아경제,017390,/news/news_read.nhn?article_id=0003696019&office_id=277&mode=search&query=서울가스&page=1,2016-02-26 15:29,서울도시가스 &quot;국제종합기계 인수의향서 제출&hellip;재무실사중&quot;,"[아시아경제 권해영 기자] 서울도시가스는 국제종합기계 법인 인수 관련 예비입찰 인수의향서(LOI)를 제출하고 인수에 따른 가상데이터룸(VDR) 재무실사를 진행중이라고 26일 공시했다. 회사측은 ""본입찰이 연기되면서 인수 결정 검토가 지연되고 있다""며 ""현재 결정된 사항은 없다""고 설명했다."
아시아경제,017390,/news/news_read.nhn?article_id=0003699626&office_id=277&mode=search&query=서울가스&page=1,2016-03-03 17:04,"서울도시가스, &quot;국제종합기계 인수 안한다&quot;","[아시아경제 최서연 기자] 서울도시가스는 3일 국제종합기계 인수 추진설에 대한 한국거래소의 조회공시 요구에 대한 답변으로 ""사업다각화의 일환으로 국제종합기계 인수를 검토했으나, 인수를 추진하지 않기로 최종 결정했다""고 밝혔다."
연합뉴스,017390,/news/news_read.nhn?article_id=0008229881&office_id=001&mode=search&query=서울가스&page=1,2016-03-03 16:57,서울도시가스 &quot;국제종합기계 인수 안 한다&quot;,"(서울=연합뉴스) 김현정 기자 = 서울도시가스는 2일 국제종합기계 인수 추진설에 대한 한국거래소의 조회공시 요구에 ""사업다각화의 일환으로 국제종합기계 인수를 검토했으나, 인수를 추진하지 않기로  최종 결정했다""고 말했다. 서울도시가스는 지난달 26일 국제종합기계 법인 인수와 관련한 예비입찰 인수의향서(LOI)를 제출했다고 밝힌 바 있다."
연합뉴스,017390,/news/news_read.nhn?article_id=0008215205&office_id=001&mode=search&query=서울가스&page=1,2016-02-26 15:32,서울도시가스 &quot;국제종합기계 인수의향서 제출&quot;,"(서울=연합뉴스) 유현민 기자 = 서울도시가스는 26일 ""사업 다각화의 일환으로 국제종합기계 법인 인수와 관련한 예비입찰 인수의향서(LOI)를 제출하고 이에 따른 가상데이터룸(VDR) 재무실사를 진행 중""이라고 밝혔다. 서울도시가스는 국제종합기계 인수 추진설에 대한 한국거래소의 조회공시 요구에 이런 답변을 하고 ""본입찰이 연기됨에 따라 인수 결정 검토가 지연되고 있으며 현재 결정된 사항은 없다""고 덧붙였다."
파이낸셜뉴스,017390,/news/news_read.nhn?article_id=0003854234&office_id=014&mode=search&query=서울가스&page=1,2017-08-04 09:50,"[fnRASSI]서울가스, 52주 신고가...0.56% &uarr;","서울가스(017390)는 52주신고가를 기록하고 있어 주목할만하다. 동종목의 현재 주가는 89,200원 선에서 이루어지고 있다. 거래일을 기준으로 최근 3일간 평균 거래량은 1,288만 주이다. 이는 60일 일 평균 거래량 643만 주와 비교해보면 최근 거래량이 급격히 늘어났다는 것을 알 수 있다.                   지표               항목               값               종합점수                 성장성               매출액증가율               -0.32               2.94                 자기자본증가율               0.01                 안정성               부채비율               68.97               8.26                 유동비율               191.61                 이익안정성               6.94                 수익성               ROA               1.62               3.15                 ROE               2.74                 영업이익율               -0.71          서울가스의 퀀트 재무 점수는 14.35점으로 지난 분기에 비해 성장성 점수가 하락했다. 이는 매출액 증가율과 자기자본 증가율이 감소하였기 때문이다. 안정성 종합 점수는 부채비율 증가, 유동비율 감소로 하락했다. 수익성 측면에서 볼때 ROE가 개선되어 이전보다 좋은 점수를 받았다. 회전율이 낮지만 주가등락폭은 적정한 편 최근 한달간 서울가스의 상장주식수 대비 거래량을 비교해보니 일별 매매회전율이 0.01%로 집계됐다. 이처럼 회전율이 너무 낮은 경우 유동성이 떨어져 매매가 자유롭지 못할 수 있기 때문에 상당한 주의가 필요하다. 저점대비 고점의 장중 주가변동률은 평균 1.35%로 적정한 수준을 보이고 있다. 'fnRASSI'는 증권전문 기업 씽크풀과 파이낸셜뉴스의 협업으로 로봇기자가 실시간으로 생산하는 기사입니다."
