source,symbol,link,date,title,content
뉴시스,017390,/news/news_read.nhn?article_id=0007076369&office_id=003&mode=search&query=서울가스&page=1,2016-03-03 16:55,"서울도시가스, &ldquo;국제종합기계 인수하지 않기로 결정&rdquo;","【서울=뉴시스】서울도시가스는 국제종합기계 인수 추진 보도에 대한 조회공시 요구에 “사업 다각화의 일환으로 국제종합기계 인수를 검토했으나, 인수를 추진하지 않기로 최종 결정했다”고 3일 답변했다. ★ 세상에 이런일이 -  데이트폭력 조사중 ´스폰서 관계´ 실토한 여배우 ★ 오늘의 핫 포토 -  새끼 잡아먹는 아빠 북극곰 포착"
헤럴드경제,017390,/news/news_read.nhn?article_id=0000979690&office_id=016&mode=search&query=서울가스&page=1,2016-01-26 08:51,"&lt;생생코스피&gt; 서울가스, 국제종합기계 인수 추진설 조회공시",한국거래소는 26일 서울도시가스에 국제종합기계 인수 추진 보도에 대한 조회공시를 요구했다. 답변시한은 이날 오후 6시까지다.
조세일보,017390,/news/news_read.nhn?article_id=0002143615&office_id=123&mode=search&query=서울가스&page=1,2016-09-29 14:42,"국세청, '서울도시가스' 고강도 세무조사 왜?","서울 강서구 등 서부지역과 경기도 일대를 대상으로 도시가스를 공급하는 서울도시가스가 국세청으로부터 고강도의 심층(특별)세무조사를 받고 있는 것으로 확인됐다. 29일 업계 관계자에 따르면 국세청은 이달 초 서울지방국세청 조사4국 조사요원들을 서울시 강서구 염창동에 위치한 서울도시가스 본사에 투입해 세무조사에 필요한 각종 세무, 회계 관련 장부 등을 압수하는 등 세무조사에 착수했다. 직전 서울도시가스에 대한 세무조사는 지난 2011년 진행된 바 있다. 일각에서는 외형적으로 4~5년 만에 이루어지는 정기조사 형태로 보이지만 기업의 비자금이나 횡령, 탈세혐의 등을 주로 다루는 조사4국이 투입됐다는 측면에서 세무조사 배경에 촉각을 곤두세우고 있는 모습이다. 서울도시가스 관계자는 이번 세무조사에 대해 ""지난 2011년 세무조사 이후 5년 만에 받는 정기 세무조사로 알고 있다""며 ""세무조사를 받는 특별한 이슈는 없고 다른 기업들도 받는 일반적인 조사 성격""이라고 말했다. 한편 서울도시가스는 지난해 매출액 1조5402억7100만원, 영업손실 24억7700만원, 당기순이익 447억8500만원을 기록했다."
연합뉴스,017390,/news/news_read.nhn?article_id=0008744584&office_id=001&mode=search&query=서울가스&page=1,2016-10-11 14:20,"&quot;서울 도시가스 배관, 내진설계 안 된 구간이 90%&quot;","곽대훈·윤한홍, 국감서 가스시설에 미흡한 내진설계 잇단 지적 (세종=연합뉴스) 고은지 기자 = 국내 주요 가스시설에 내진 설계가 제대로 돼 있지 않아 지진에 취약하다는 지적이 국정감사를 통해 잇달아 지적됐다. 11일 국회 산업통상자원위원회 소속 새누리당 곽대훈 의원은 한국가스안전공사로부터 '가스시설 내진 설계 적용 현황' 자료를 받아 분석한 결과 전국 도시가스 배관 총 4만1천728km 중 내진 설계가 돼 있는 부분은 45.4%가량인 1만8천951km뿐이었다고 지적했다. 지역별로 보면 인구밀집도가 가장 높은 서울의 도시가스 배관 7천583km 중 내진 설계가 되지 않은 부분은 6천824km로 90.0%에 달했다. 이어 인천(60.9%), 울산(56.0%) 등에서 미설계 비율이 높게 나타났다. 또 국내 가스저장탱크·압력용기 6만1천962개 중 소형저장탱크, 지하매몰 저장탱크 등 5만2천963개는 내진 설계 비대상 시설로 분류돼 내진 설계 의무가 없었고, 내진 설계 대상 8천999개 중에서도 3천89개가 제대로 내진 설계가 돼 있지 않았다. 같은 당 윤한홍 의원 또한 주요 가스시설의 절반 이상이 내진 설계가 돼 있지 않았다며 지진 발생 시 사고 가능성을 우려했다. 윤 의원에 따르면 전국 기준으로 도시가스 배관의 49.2%, 압력용기(동체부 5m 이상)의 37.2%, 고압가스(5t 이상)와 액화석유가스(3t 이상) 저장탱크의 32.5%는 내진 설계가 전혀 돼 있지 않았다. 내진 설계가 돼 있어도 규모 5∼6에 맞춰져 있는 점 역시 문제로 지적됐다. 윤 의원은 ""1998년 내진 설계 기준을 적용하다 보니 규모 5~6 수준으로 설계돼 있는데, 이는 당시 규모 7 이상의 지진이 국내에 발생한 적이 없다는 조사가 반영됐기 때문""이라며 ""18년 전 내진 설계 기준에서 벗어나 현재 한반도 지각변동 상황에 맞는 수준으로 내진 설계 기준을 강화할 필요가 있다""고 말했다. 곽 의원은 ""대부분 가스시설이 규모 5∼6에 맞춰 설계돼 있고 이마저도 사각지대가 발생하고 있다""며 ""가스 설치 위치, 사용 목적, 유해성 등을 종합적으로 검토한 후 자체 내진 설계 기준을 마련하고, 특히 독성가스 설비는 특등급까지도 검토해야 한다""고 지적했다."
아시아경제,017390,/news/news_read.nhn?article_id=0003674715&office_id=277&mode=search&query=서울가스&page=1,2016-01-26 17:42,서울도시가스 &quot;국제종합기계 인수 검토 중&quot;,"[아시아경제 임온유 기자] 서울도시가스는 '국제종합기계' 법인 인수와 관련한 조회공시에 ""예비입찰 인수의향서(LOI)를 제출했으나 인수 결정은 현재 검토 중이며 확정된 바 없다""고 26일 밝혔다. 이어 ""구체적인 내용이 확정되는 시점 또는 1개월 이내에 재공시하겠다""고 덧붙였다."
전자신문,017390,/news/news_read.nhn?article_id=0002544286&office_id=030&mode=search&query=서울가스&page=1,2016-11-01 15:09,"[로봇뉴스][서울도시가스 지분 변동] 서울도시가스(주)-0.59%p 감소, 4.9...","서울도시가스(017390)는 01일 주주 서울도시가스(주)의 보유주식이 감소되었다고 발표했다. 이는 직전 보고일보다 29,719주 감소하여 지분율은 4.9%로 하락했다. 이번 보고 사유는 보유주식수변동으로  알려졌다."
이데일리,017390,/news/news_read.nhn?article_id=0003461024&office_id=018&mode=search&query=서울가스&page=1,2016-01-26 17:33,서울도시가스 &quot;국제종합기계 인수 검토 중&quot;,[이데일리 김태현 기자] 서울도시가스(017390)는 국제종합기계 인수 추진과 관련한 조회공시 요구에 대해 “예비입찰 인수의향서를 제출하였으나 인수 결정에 대해서는 현재 검토 진행 중이며 확정된 사항은 없다”고 26일 공시했다.
뉴시스,017390,/news/news_read.nhn?article_id=0007034645&office_id=003&mode=search&query=서울가스&page=1,2016-02-11 15:34,"서울도시가스, 지난해 영업손실 25억 &lsquo;적자전환&rsquo;","【서울=뉴시스】 서울도시가스는 지난해 영업손실이 24억7712만원으로 전년대비 적자 전환했다고 11일 공시했다. 같은 기간 매출은 1조5403억원으로 24.2% 감소했고, 당기순이익은 447억원으로 28.1% 줄었다. ★ 세상에 이런일이 -  ""울지마"" 20대 엄마, 아기 창밖 던져 숨져 ★ 오늘의 핫 포토 -  자동차보다 여배우에 눈길이…"
머니투데이,017390,/news/news_read.nhn?article_id=0003619840&office_id=008&mode=search&query=서울가스&page=1,2016-01-26 17:28,서울도시가스 &quot;국제종합기계 인수 검토 중&quot;,"[머니투데이 박진영 기자] 서울도시가스는 국제종합기계 인수 추진과 관련한 조회공시에 ""인수의향서를 제출했으나 인수 결정에 대해서는 검토 중이며 확정된 사항은 없다""고 26일 답변했다. 이어 ""향후 구체적인 내용이 확정되는 시점 또는 1개월 이내 재공시하겠다""고 말했다. textlinktopstart textlinktopend textlinkstart"
아시아경제,017390,/news/news_read.nhn?article_id=0003684951&office_id=277&mode=search&query=서울가스&page=1,2016-02-11 15:37,"서울가스, 지난해 영업손실 25억원&hellip;적자전환",[아시아경제 김원규 기자] 서울가스는 연결 기준 지난해 영업이익 24억7712만원을 기록해 전년대비 적자전환했다고 11일 공시했다. 같은 기간 매출액은 1조5402억원으로 24.2% 줄었고 당기순이익은 447억1621만원으로 28.1% 감소했다.
연합뉴스,017390,/news/news_read.nhn?article_id=0008146133&office_id=001&mode=search&query=서울가스&page=1,2016-01-26 17:27,서울도시가스 &quot;국제종합기계 인수의향서 제출&quot;,"(서울=연합뉴스) 홍지인 기자 = 서울도시가스는 26일 ""사업 다각화의 일환으로 국제종합기계 법인 인수와 관련해 예비입찰 인수의향서(LOI)를 제출했다""면서 ""인수 결정에 대해서는 현재 검토 진행중이며 확정된 사항은 없다""고 공시했다."
헤럴드경제,017390,/news/news_read.nhn?article_id=0000991320&office_id=016&mode=search&query=서울가스&page=1,2016-02-11 16:01,"&lt;생생코스피&gt;서울가스, 주당 1750원 현금배당 결정",서울도시가스는 보통주 1주당 1750원의 현금 결산배당을 결정했다고 11일 공시했다. 시가배당율은 1.5%이며 배당금총액은 67억9931만원이다.
서울경제,017390,/news/news_read.nhn?article_id=0002798746&office_id=011&mode=search&query=서울가스&page=1,2016-02-11 21:48,"[기업공시] 서울도시가스, 보통주 1주당 1,750원 현금배당 결정 外","▲보통주 1주당 현금배당 결정=서울도시가스 1,750원, 이연제약 300원, 무학 250원, BGF리테일 1,200원, 금강공업 400원, 동원시스템즈 250원, 현대그린푸드 60원, 현대리바트 80원, 오리온 6,000원, 한솔로지스틱스 20원, 애경유화 1,900원, 가온전선 600원 ▲인디에프=인디에프 개성에서 생산하는 의류제품 생산 중단 ▲대한방직=전주공장 부지 매각 관련 선순위 우선협상대상자인 한양제이알디와의 양해각서 효력 상실로 차순위 우선협상대상자인 부영주택과 매각협상 29일까지 진행 예정 ▲주주총회 소집 결의=윌비스·한솔로지스틱스·가온전선 3월25일 ▲현대엘리베이터=시가 하락에 따라 무기명식 이권부 무보증 사모 전환사채 가액 5만3,112원에서 4만8,698원으로 조정 ▲웅진에너지=중국 업체와 3,000톤 규모의 태양전지용 단결정 실리콘 잉곳 공급계약 체결 ▲금호타이어=주식매각 타당성 검토를 위한 우선협상대상자로 크레디트스위스(CS) 선정 ▲현대페인트=박현우 공동대표집행임원 사임 ▲보통주 1주당 현금배당 결정=삼목에스폼 100원, 지에스이 50원, 제이스텍 50원, 국순당 50원, 가온미디어 100원, 한국사이버결제 120원, 삼영엠텍 50원, 블루콤 400원, 네오위즈홀딩스 330원, 코다코 55원, 상아프론테크 140원, 엠에스씨 450원, MDS테크 280원, 형지I&C 15원, 이엔에프테크놀로지 50원, 쏠리드 50원 ▲주주총회 소집 결의=한국정보통신 2월26일, 테스·네이처셀·에스엔유·삼영엠텍·인트론바이오·국영지앤엠·엠에스씨·MDS테크·바디텍메드·위닉스·케어젠 3월25일 ▲성호전자=자사주 1만5,000주 주당 912원에 처분 결정 ▲구영테크=16일로 예정된 임시 주총 개최 철회 결의 ▲아이쓰리시스템=LIG넥스원과 75억원4,231만원 규모의 신궁 6-2차 검출기 공급계약 체결 ▲엠에스씨=1주당 가액 5,000원에서 500원으로 주식분할 결정 ▲모다정보통신=12일 오후12시까지 최대주주 지분매각 추진설에 대한 조회공시 요구받아 ▲메디아나=응급상황 시 전문의료인과 자동연결되는 자동제세동기 및 그 제어방법 특허권 취득 ▲코아크로스=오세웅 외 1명이 김민기 대표이사 상대로 직무집행정지 가처분 신청 ▲이엔에프테크놀로지=임직원에 대한 상여금 지급 위해 자사주 1만1,000주 1억7,050만원에 처분 결정 [ⓒ 한국미디어네트워크, 무단 전재 및 재배포 금지] 서울경제 관련뉴스해당 언론사에서 선정하며 언론사 페이지(아웃링크)로 이동해 볼 수 있습니다.발모촉진 특허음료 장영실 대상… 이유는?[단독] 북핵에 무산된 동북아 첫 국제기구7년 넘도록… 월급쟁이 억장 무너진다16년 만에… 인도서 돈 쓸어담는 한국 건설선진국서 아파트 대신에 퍼지는 주택"
헤럴드경제,017390,/news/news_read.nhn?article_id=0000990044&office_id=016&mode=search&query=서울가스&page=1,2016-02-08 17:34,"[北 미사일 발사] 우 차관, 설날에도 현장찾아 안전 비상 체크&hellip; 서울 가스안전종...","[헤럴드경제=황해창 기자] 우태희 산업통상자원부 2차관은 설날인 8일 서울 강남구 일대에서 북한의 장거리 미사일 발사에 따른 가스안전 비상운영체계 및 가스시설(도시가스) 안전관리 실태를 점검했다.  [자료=산업통상자원부] 우 차관은 이날 강남구 대치동에 있는 가스안전공사 서울지역본부 가스안전종합상황실과 코원에너지 도시가스상황실을 찾아 설 연휴기간 동안 전력, 가스 등 주요 에너지시설에 대한 비상대응태세를 확실하게 유지해 안전 및 재난관리에 최선을 다해줄 것을 당부하고 현장근무자들을 격려했다.   "
한국경제,017390,/news/news_read.nhn?article_id=0003531819&office_id=015&mode=search&query=서울가스&page=1,2016-01-26 09:03,"거래소, 서울도시가스에 '국제종합기계 인수설' 조회공시 요구",[ 조아라 기자  ] 한국거래소 유가증권시장본부는 26일 서울도시가스에 국제종합기계 인수 추진 보도에 대한 조회공시를 요구했다. 답변시한은 이날 오후 6시까지다. 조아라 한경닷컴 기자
뉴스1,017390,/news/news_read.nhn?article_id=0001872789&office_id=421&mode=search&query=서울가스&page=1,2016-02-03 11:15,서울 온실가스 배출 40% 줄인다&hellip;건축물 설계기준 변경,"성능평가체계 현실화··패시브 요소 도입으로 건물 기본성능 향상 등 (서울=뉴스1) 오경묵 기자 = 서울시가 서울의 전체 온실가스 발생량 중 60% 이상 차지하는 건축물의 에너지 사용을 줄이기 위해 팔을 걷어붙였다. 단열 등 건물의 성능기준을 강화했다. 새 기준을 바탕으로 오는 2030년까지 온실가스 배출 규모를 40% 감축하겠다는 게 서울시의 목표다. 서울시는 '시 녹색건축물 설계기준'을 전면 개정했다고 3일 밝혔다. 개정된 설계기준은 3월 1일부터 본격 적용된다. 새 기준안은 Δ복잡한 에너지 성능평가체계 현실화 Δ패시브 요소 도입으로 건물 기본성능 향상 Δ신재생 에너지 생산량 확대 로드맵 제시 등으로 구성돼있다. 기존 5개였던 건축물 에너지 성능 평가항목은 2개로 줄었다. 건축심의 과정에서 시간과 비용을 절감할 수 있을 것으로 보인다. 서울시가 2011년 개발한 '에너지소비총량 평가 프로그램(BESS)' 적용 대상도 확대된다. BESS는 건물 신축 계획 단계에서 1㎡당 연간 소비되는 에너지량을 쉽게 계산할 수 있는 프로그램이다. 연면적·층수·공동주택 규모에 따라 에너지 소비총량을 관리하고 있다. 기존에는 주거·업무용 건물만 BESS 적용대상이었지만 앞으로는 교육연구시설·숙박·판매시설도 포함된다. 건축물의 기본 성능을 강화하기 위해 다양한 패시브 요소도 설계기준에 포함됐다. 건축부문은 창호기밀·결로방지·자연환기로 구성됐다. 기계부문은 고효율 인증을 받은 열원설비와 폐열회수장치를 도입해야 한다. 전기부문은 대기전력차단장치를 추가로 도입하고 단열성능을 기존 대비 8~20% 강화해야 한다. 국가 공공건축물과 달리 연도별 신재생에너지 설치 의무비율 규정이 없는 민간 건축물에 대한 연차별 로드맵을 제시했다. 시는 2023년까지 주거용 건물의 10%, 비주거용 건물의 14%에 신재생에너지를 설치한다는 계획이다. 이밖에 기존에는 연면적 3000㎡ 이상 건물에만 적용됐던 환경성능기준을 500~3000㎡ 미만 소규모 건물에도 도입한다. 층간소음·세대간 경계벽 차음성능 등 최소한의 환경기준을 지키도록 하기 위한 것이다. 에너지를 많이 사용하는 대형건물(연면적 10만㎡ 이상 또는 21층 이상)에는 에너지관리시스템(BEMS) 설치가 의무화된다. '서울시 녹색건축물 설계기준'은 모든 자치구에 동일하게 적용된다. 자치구별로 성능기준의 차이가 커 형평성이 맞지 않는다는 시민사회의 의견을 반영한 것이다. 정유승 시 주택건축국장은 ""친환경 녹색 건축은 에너지 절약과 대기오염 감소뿐만 아니라 궁극적으로는 시민들의 관리비용이 줄어드는 결과로 이어진다""며 ""에너지 소비가 많은 건축물에 대해 설계 단계부터 가이드라인을 꼼꼼히 적용해 새는 에너지가 없도록 하겠다""고 말했다."
이데일리,017390,/news/news_read.nhn?article_id=0003460153&office_id=018&mode=search&query=서울가스&page=1,2016-01-26 08:57,"서울도시가스, 국제종합기계 인수 추진 조회공시",[이데일리 김태현 기자] 한국거래소는 26일 서울도시가스(017390)에 국제종합기계 인수 추진 보도에 대한 조회공시를 요구했다. 답변 시한은 이날 오후 6시까지다.
머니투데이,017390,/news/news_read.nhn?article_id=0003619280&office_id=008&mode=search&query=서울가스&page=1,2016-01-26 08:53,"[조회공시]서울도시가스, 국제종합기계 인수 추진 보도",[머니투데이 박계현 기자] 한국거래소 유가증권시장본부는 26일 서울도시가스(서울가스)에 국제종합기계 인수 추진 보도에 대한 조회공시를 요구했다. 공시시한은 26일 오후 6시까지다. textlinktopstart textlinktopend textlinkstart
KBS 뉴스,017390,/news/news_read.nhn?article_id=0010400599&office_id=056&mode=search&query=서울가스&page=1,2016-12-27 16:28,"서울 도시가스 연결비, 가스비와 분리&hellip;가스시공 시장 개방","도시가스비용에 포함돼 매달 모든 세대에 일괄적으로 부과되어온 도시가스 연결비용이 도시가스비용에서 제외된다. 가격상한제·정액승인제 등 가격 제한을 받았던 위성방송·인터넷TV(IPTV) 요금은 기본·결합상품을 제외하고 모두 신고제로 전환된다. 공정거래위원회는 국무조정실과 함께 올해 하반기 추진한 6건의 경쟁제한적 규제 개선방안을 확정했다고 밝혔다. 6건의 규제개선은 공공분야 독점 시장의 경쟁원리 도입, 불합리한 사업활동 제한 개선 등이 기본 방향이다. 규제개선안에는 서울시 도시가스 연결비용을 도시가스요금과 분리하는 내용이 담겼다. 지금까지 가스레인지에 도시가스를 연결할 때 드는 연결서비스 비용은 도시가스요금으로 모든 세대에 매달 약 100원씩 일괄적으로 부과돼 수익자 부담 원칙에 맞지 않는다는 지적이 제기돼왔다. 또 연결비용이 일괄적으로 부과되다 보니 민간 가스시공업자는 도시가스 연결서비스 시장에 진입할 수 없다는 문제도 있었다. 정부는 내년 12월 서울시 도시가스 공급규정 개정을 추진해 도시가스 연결서비스 비용을 가스사용요금과 분리하되 청구 비용은 인건비 원가를 초과하지 않도록 하기로 했다. 기존 가격상한제(케이블·위성방송)와 정액승인제(IPTV) 제한을 받아온 유료방송요금은 신고제로 전환된다. 기존 제도가 IPTV 사업자의 요금 인하를 막아 지역 독점사업자인 케이블방송 등과의 경쟁을 제한한다는 지적에 따른 것이다. 정부는 내년 12월 관련 법안 개정을 추진할 방침이다. 대한법무사협회 회칙에 정액·정률로 정해진 법무사 서비스 보수 기준은 기존 지정제에서 상한제로 변경하는 안이 내년 6월 추진된다. 요금을 자유롭게 책정할 수 있도록 함으로써 신규 법무사의 시장진입을 쉽게 하고 가격 경쟁을 통해 소비자의 부담을 줄일 수 있는 토대를 마련하겠다는 것이다. 주택건설·대지조성 사업을 하려면 22㎡ 이상의 사무실을 확보하도록 한 규정은 내년 7월 폐지하기로 했다. 일정 규모 이상의 사무실 확보에 써야 하는 영업비용 부담을 줄임으로써 주택건설·대지조성 사업을 촉진하겠다는 의도다."
아시아경제,017390,/news/news_read.nhn?article_id=0003900907&office_id=277&mode=search&query=서울가스&page=1,2016-12-27 15:10,서울 도시가스 요금서 설치비 분리..유료방송 요금 신고제로 전환,"[아시아경제 오종탁 기자] 서울 도시가스 요금에서 설치 비용이 제외된다. 가격상한제 ·정액승인제 등 가격 제한을 받았던 위성방송 ·인터넷TV(IPTV) 요금은 기본 ·결합상품을 제외하고 모두 신고제로 바뀐다. 공정거래위원회는 27일 국무조정실과 함께 올해 하반기 추진한 6건의 경쟁제한적 규제 개선방안을 확정했다고 밝혔다. 6건의 규제개선은 공공분야 독점 시장의 경쟁원리 도입, 불합리한 사업활동 제한 개선 등이 기본 방향이다. 규제개선안에는 서울시 도시가스 연결비용을 도시가스요금과 분리하는 내용이 담겼다. 지금까지 가스레인지에 도시가스를 연결할 때 드는 연결서비스 비용은 도시가스요금으로 모든 세대에 매달 약 100원씩 일괄적으로 부과돼 수익자 부담 원칙에 맞지 않는다는 지적이 제기돼왔다. 또 연결비용이 일괄적으로 부과되다 보니 민간 가스시공업자는 도시가스 연결서비스 시장에 진입할 수 없다는 문제도 있었다. 정부는 내년 12월 서울시 도시가스 공급규정 개정을 추진해 도시가스 연결서비스 비용을 가스사용요금과 분리하되 청구 비용은 인건비 원가를 초과하지 않도록 하기로 했다. 이를 통해 가스시공업자가 도시가스 연결서비스 시장에 진입할 수 있어 서비스 요금을 합리화할 수 있을 것으로 정부는 기대하고 있다. 기존 가격상한제(케이블 ·위성방송)와 정액승인제(IPTV) 제한을 받아온 유료방송요금은 신고제로 전환된다. 기존 제도가 IPTV 사업자의 요금 인하를 막아 지역 독점사업자인 케이블방송 등과의 경쟁을 제한한다는 지적에 따른 것이다. 단 기본상품과 결합상품에 대해서는 승인제 골격을 유지하기로 했다. 정부는 내년 12월 관련 법안 개정을 추진할 방침이다. 국가가 설치 ·관리하는 항로 표지인 철탑등대 ·등주의 제작 ·수리가 내년 12월 민간에 전면 개방된다. 지금까지 철탑등대 ·등주의 제작 ·수리 업무는 항로표지기술협회에만 위탁돼 가격 ·서비스 경쟁이 제대로 이뤄지지 않는다는 지적이 있었다. 부표는 제작만 민간에 개방하고 수리는 공공성을 이유로 항로표지기술협회에서 종전대로 독점 수행한다. 지난해 철탑등대 ·등주 제작 ·수리, 부표 제작 비용은 19억4000만원에 달한다. 농업기술실용화재단이 독점하던 농업기계 검정대행 업무에 경쟁체제가 도입된다. 현재 농업기계를 제조 ·수입해 판매하려면 농업기술실용화재단이 있는 경기도 수원까지 기계를 옮겨 검정을 받아야 한다. 정부는 내년 12월까지 검정대행기관을 추가 지정하는 안을 추진해 농업기계 제조 ·수입업자의 검정기관 선택권을 확대할 방침이다. 대한법무사협회 회칙에 정액 ·정률로 정해진 법무사 서비스 보수 기준은 기존 지정제에서 상한제로 변경하는 안이 내년 6월 추진된다. 요금을 자유롭게 책정할 수 있도록 함으로써 신규 법무사의 시장진입을 쉽게 하고 가격 경쟁을 통해 소비자의 부담을 줄일 수 있는 토대를 마련하겠다는 것이다. 주택건설 ·대지조성 사업을 하려면 22㎡ 이상의 사무실을 확보하도록 한 규정은 내년 7월 폐지하기로 했다. 일정 규모 이상의 사무실 확보에 써야 하는 영업비용 부담을 줄임으로써 주택건설 ·대지조성 사업을 촉진하겠다는 의도다."
