source,symbol,link,date,title,content
부산일보,017390,/news/news_read.nhn?article_id=0000789531&office_id=082&mode=search&query=서울가스&page=1,2018-03-20 16:12,"LG유플, 서울국제가스전서 'IoT 솔루션' 전시","LG유플러스는 오는 21일부터 23일까지 서울 강남 서울무역전시컨벤션센터(SETEC)에서 열리는 '서울국제가스&FC산업전'에 사물인터넷(IoT) 서비스를 전시한다고 20일 밝혔다.  서울국제가스산업전은 가스와 FC(연료전지) 관련 신기술 전문 전시회다. 올해는 81개 기업과 단체가 참여했다. LG유플러스는 여기서 가스산업에 IoT 기술을 적용한 다양한 서비스와 솔루션을 고객이 접해볼 수 있도록 이통사 중 유일하게 단독 부스를 마련했다.  특히 가스 공급 단계에 필요한 배관망 상태부터 가스 저장탱크 상태, 가스 이용 고객의 가스 사용량까지 원격으로 모니터링 할 수 있는 IoT 서비스와 솔루션을 전시해 관람객의 시선을 끌 것으로 기대된다. 구체적으로 보면 모바일IoT 분야 부스에는 가스 배관의 부식상태 및 밸브실 내 가스 누출, 침수 여부를 원격으로 모니터링 가능한 '스마트 배관망 원격관리' 솔루션을 선보인다. LPG 소형저장탱크 가스 누출 및 가스 잔량 파악이 가능한 'LPG 소형저장탱크 원격관리' 솔루션도 내놓는다.  산업IoT 분야 부스에선 사업장 유해가스를 계측해 원격으로 모니터링하는 '가스 계측모니터링'을 비롯해 모터 관련 빅데이터 알고리즘을 기반으로 모터의 상태를 실시간으로 진단해 고장을 사전에 알려주는 'IoT 모터진단' 솔루션을 전시한다.  김영만 LG유플러스 모바일IoT담당은 ""4차산업 혁명의 핵심기술인 사물인터넷이 가스 분야에 접목된 다양한 사례들을 볼 수 있는 자리""라며 ""앞으로도 안전하고 편리한 산업 환경을 만드는 신규 IoT 서비스를 지속 선보일 계획""이라고 말했다. "
파이낸셜뉴스,017390,/news/news_read.nhn?article_id=0003792289&office_id=014&mode=search&query=서울가스&page=1,2017-03-22 10:29,"[fnRASSI]서울가스, 0.89% 내리며 거래량 증가","서울가스(017390)의 현재 거래량이 최근 5거래일 거래량의 최고치를 경신하며 투자자들의 관심을 받고 있다. 그리고 서울가스는 3일 연속 하락흐름을 보이며, 10시 17분 현재 0.89% 내린 78,000원에 거래중이다. 회전율이 낮지만 주가등락폭은 적정한 편 최근 한달간 서울가스의 상장주식수 대비 거래량을 비교해보니 일별 매매회전율이 0%로 집계됐다. 이처럼 회전율이 너무 낮은 경우 유동성이 떨어져 매매가 자유롭지 못할 수 있기 때문에 상당한 주의가 필요하다. 저점대비 고점의 장중 주가변동률은 평균 2.02%로 적정한 수준을 보이고 있다. 외국인투자자 연속 5일 순매도 최근 5일간 동종목의 외국인 투자자는 404주 매수하였고 반면 기관은 120주 매도하였다. 전날 외국인 85주 매수, 기관120주 매도하며 보유 비율이 변동했다. 다음 표는 동종목의 외국인, 기관의 일별 순매수량을 나타낸 것이다. 'fnRASSI'는 증권전문 기업 씽크풀과 파이낸셜뉴스의 협업으로 로봇기자가 실시간으로 생산하는 기사입니다."
전자신문,017390,/news/news_read.nhn?article_id=0002706065&office_id=030&mode=search&query=서울가스&page=1,2018-05-08 16:59,[ET투자뉴스][서울도시가스 지분 변동] FIDELITYMANAGEMENT&amp;RES...,"서울도시가스(017390)는 08일 기타 FIDELITYMANAGEMENT&amp;RESEARCHCOMPANY를  비롯한 특별관계자의 보유주식이 증가되었다고 발표했다. 이는 직전 보고일보다 49,928주 증가하여 지분율은 6.6%로 상승했다. 이번 보고 사유는 단순주식취득및운용펀드추가에의한변동보고로  알려졌다.   최대주주와 특수관계자의 지분 변동은 주가에 영향을 주는 요인이다. 특히 보유비율을 지속적으로 늘리거나 줄일 경우, 해당종목 투자시 유의할 필요가 있다.  다음은 서울도시가스의 지분 변동 내역과 보유 내역이다."
파이낸셜뉴스,017390,/news/news_read.nhn?article_id=0004006091&office_id=014&mode=search&query=서울가스&page=1,2018-04-20 09:16,"[fnRASSI]서울가스, 거래량 확대되며 4거래일 연속 하락","서울가스(017390)의 당일 거래량이 최근 5거래일 거래량의 최고치를 넘어섰다. 그리고 서울가스는 4일 연속 하락흐름을 보이며, 9시 13분 현재 0.35% 내린 84,800원에 거래중이다. 회전율이 낮지만 주가등락폭은 적정한 편 최근 한달간 서울가스의 상장주식수 대비 거래량을 비교해보니 일별 매매회전율이 0%로 집계됐다. 이처럼 회전율이 너무 낮은 경우 유동성이 떨어져 매매가 자유롭지 못할 수 있기 때문에 상당한 주의가 필요하다. 저점대비 고점의 장중 주가변동률은 평균 1.95%로 적정한 수준을 보이고 있다. 기관과 개인은 순매도, 외국인은 순매수(한달누적)  전일 외국인과 기관이 각각 22주, 23주를 순매수 했다. 4주간을 기준으로 보면 외국인이 초반에 동종목을 순매수한 이후에 기세를 이어가며 2,293주를 순매수한 반면, 기관은 매도 관점으로 접근하면서 1,369주를 순매도했고, 개인들도 초반에 동종목을 순매도한 이후에 근래에는 순매도량을 줄이면서 924주를 순매도한 것으로 집계됐다. 'fnRASSI'는 증권전문 기업 씽크풀과 파이낸셜뉴스의 협업으로 로봇기자가 실시간으로 생산하는 기사입니다."
스포츠조선,017390,/news/news_read.nhn?article_id=0003229587&office_id=076&mode=search&query=서울가스&page=1,2018-03-20 13:55,"LG유플러스, 서울가스&amp;FC산업전 참가&hellip;IoT 관련 서비스 공개","LG유플러스가 21일부터 23일까지 서울 강남 서울무역전시컨벤션센터(SETEC)에서 진행되는 '서울국제가스&FC산업전'에서 IoT 서비스를 전시한다고 20일 밝혔다. 서울국제가스&FC산업전은 가스 및 FC(연료전지) 관련 신기술 전문 전시회다. LG유플러스는 가스산업에 IoT 기술을 적용한 다양한 서비스 및 솔루션을 평소에 접하기 어려웠던 업체들과 고객이 접해볼 수 있도록 이통사 중 유일하게 단독 부스를 운영한다. LG유플러스는 박람회에서 가스 공급 단계에 필요한 배관망의 상태부터 가스 저장탱크의 상태, 가스 이용 고객의 가스 사용량까지 원격으로 모니터링 할 수 있는 모바일IoT, 산업IoT 분야 6종의 서비스와 NB-IoT 통신모듈 및 통신보드를 공개한다. 모바일IoT 분야 부스에서는 가스 배관의 부식상태 및 밸브실 내 가스 누출, 침수 여부를 원격으로 모니터링 가능한 '스마트 배관망 원격관리' 솔루션, LPG 소형저장탱크 가스 누출 및 가스 잔량 파악이 가능한 'LPG 소형저장탱크 원격관리' 솔루션 등을 소개한다. 가구별 도시가스 사용량, 계량기 상태정보 및 이력 데이터 등을 원격 관리할 수 있는 '스마트 가스미터'도 만나 볼 수 있다. 산업IoT 분야 부스에서는 사업장의 유해가스를 계측하여 원격으로 모니터링하는 '가스 계측모니터링', 모터 관련 빅데이터 알고리즘을 기반으로 모터의 상태를 실시간으로 진단해 고장을 사전에 알려주는 'IoT 모터진단' 솔루션, 허가 단말만 고객사 내부 서버에 접속할 수 있어 보안이 강화된 'LTE전용망'등을 전시한다. LG유플러스 관계자는 ""4차산업혁명의 핵심기술인 사물인터넷이 가스 분야에 접목된 다양한 사례들을 볼 수 있는 자리""라며 ""안전하고 편리한 산업 환경을 만드는 신규 IoT 서비스를 지속 선보일 계획"" 이라고 말했다."
아시아경제,017390,/news/news_read.nhn?article_id=0004281117&office_id=277&mode=search&query=서울가스&page=1,2018-07-20 15:04,"서울도시가스, 가스 요금할인 서비스앱 '가스락' 출시","[아시아경제 이광호 기자]서울도시가스는 모바일 요금할인 혜택 서비스 어플리케이션(앱) '가스락'을 다음달 초 출시한다고 20일 밝혔다. 가스락 서비스는 잠금화면을 밀어서 광고를 보거나 이벤트 등에 참여해 캐시를 적립하고, 이를 사용해 서울도시가스 가스요금을 할인 받을 수 있다. 잠금화면 앱이나 리워드앱 포인트를 적립해 다른 곳에 사용하는 것이 아니라 매달 지출되는 가스비를 할인 받을 수 있는 실용적인 솔루션이다. 캐시를 적립할 수 있는 방법은 크게 세 가지로 잠금화면을 밀어서 적립하거나 캐시 무료충전소 개념인 '꿀 알바 목록'에서 액션형 광고에 참여할 수 있고, 서울도시가스에서 제공하는 다양한 이벤트에 참여해 캐시를 차곡차곡 쌓을 수 있다. 캐시를 활용해 받는 요금할인은 '익월 청구 할인 신청' 방식으로 적용되며, 이는 고객의 캐시 사용 신청 시점에 '확정되지 않은 청구 월' 도시가스 요금에서 해당 캐시만큼 자동 차감되어 고지서가 발행된다. 특히 가스락은 서울도시가스의 모바일고객센터가스앱과 서로 별개의 서비스지만 각 서비스의 회원정보가 서로 매칭되어 있어, 한가족이 함께 캐시를 적립할 수 있다. 가족 모두가 각자의 휴대폰에서 가스락 캐시를 적립하면, 각자가 모은 캐시의 합산 금액만큼 해당 사용계약번호 거주지의 가스요금을 받을 수 있다. 남기철 서울도시가스 부장은 ""서울도시가스 사용자들에게 보다 실용적인 모바일 플랫폼 서비스를 제공하기 위해 가스락을 선보이게 됐다""며 ""다양한 이벤트와 벨류콘텐츠를 더해 사용자들의 만족도를 높일 예정""이라고 말했다. 남 부장은 이어 ""앞으로도 유익한 정보와 편의성을 제공하기 위한 다양한 플랫폼들을 서울도시가스의 전문적인 IT기술로 구현함으로써, 도시가스 업계의 다변화를 모색할 계획""이라고 덧붙였다."
파이낸셜뉴스,017390,/news/news_read.nhn?article_id=0003855523&office_id=014&mode=search&query=서울가스&page=1,2017-08-08 09:06,"[fnRASSI]서울가스(017390), 52주 신고가 경신...1.78% &uarr;","서울가스(017390)는 52주신고가를 기록하고 있어 주목할만하다. 동종목의 현재 주가는 91,500원 선에서 이루어지고 있다. 거래일을 기준으로 최근 3일간 평균 거래량은 1,075만 주이다. 이는 60일 일 평균 거래량 666만 주와 비교해보면 최근 거래량이 다소 증가했다는 것을 알 수 있다. 외국인/기관 순매수, 개인은 순매도(한달누적)  8월1일부터 전일까지 기관이 5거래일 연속 동종목을 사들였다. 4주간을 기준으로 보면 외국인이 방향성있는 매매를 하면서 5,575주를 순매수했고, 기관도 순매수량을 늘리며 1,790주를 순매수했다. 반면 개인들은 매도 우위를 지속하면서 7,365주를 순매도한 것으로 나타났다. 회전율이 낮지만 주가등락폭은 적정한 편 최근 한달간 서울가스의 상장주식수 대비 거래량을 비교해보니 일별 매매회전율이 0.01%로 집계됐다. 이처럼 회전율이 너무 낮은 경우 유동성이 떨어져 매매가 자유롭지 못할 수 있기 때문에 상당한 주의가 필요하다. 저점대비 고점의 장중 주가변동률은 평균 1.77%로 적정한 수준을 보이고 있다. 'fnRASSI'는 증권전문 기업 씽크풀과 파이낸셜뉴스의 협업으로 로봇기자가 실시간으로 생산하는 기사입니다."
파이낸셜뉴스,017390,/news/news_read.nhn?article_id=0003856298&office_id=014&mode=search&query=서울가스&page=1,2017-08-09 11:19,"[fnRASSI]서울가스, 52주 신고가...0.22% &uarr;","서울가스(017390)는 52주신고가를 기록하고 있어 주목할만하다. 동종목의 현재 주가는 91,200원 선에서 이루어지고 있다. 거래일을 기준으로 최근 3일간 평균 거래량은 875만 주이다. 이는 60일 일 평균 거래량 677만 주와 비교해보면 최근 거래량이 다소 증가했다는 것을 알 수 있다. 외국인/기관 순매수, 개인은 순매도(한달누적)  8월1일부터 전일까지 기관이 6거래일 연속 동종목을 사들였다. 4주간을 기준으로 보면 외국인이 초반에 동종목을 순매수한 이후에 기세를 이어가며 5,725주를 순매수했고, 기관도 방향성있는 매매를 하면서 1,926주를 순매수했다. 반면 개인들은 매도쪽으로 방향을 잡으면서 7,651주를 순매도한 것으로 나타났다. 회전율이 낮지만 주가등락폭은 적정한 편 최근 한달간 서울가스의 상장주식수 대비 거래량을 비교해보니 일별 매매회전율이 0.01%로 집계됐다. 이처럼 회전율이 너무 낮은 경우 유동성이 떨어져 매매가 자유롭지 못할 수 있기 때문에 상당한 주의가 필요하다. 저점대비 고점의 장중 주가변동률은 평균 1.71%로 적정한 수준을 보이고 있다. 'fnRASSI'는 증권전문 기업 씽크풀과 파이낸셜뉴스의 협업으로 로봇기자가 실시간으로 생산하는 기사입니다."
파이낸셜뉴스,017390,/news/news_read.nhn?article_id=0003857286&office_id=014&mode=search&query=서울가스&page=1,2017-08-11 09:06,"[fnRASSI]서울가스, 52주 신고가...1.65% &uarr;","서울가스(017390)는 52주신고가를 기록하고 있어 주목할만하다. 동종목의 현재 주가는 92,200원 선에서 이루어지고 있다. 거래일을 기준으로 최근 3일간 평균 거래량은 1,420만 주이다. 이는 60일 일 평균 거래량 706만 주와 비교해보면 최근 거래량이 급격히 늘어났다는 것을 알 수 있다. 기관투자자 연속 3일 순매도 최근 5일간 동종목의 외국인 투자자는 1,034주 순매수하였고 마찬가지로 기관은 1,621주 순매수하였다. 전날 두 주체 각각 431주, 1,621주 순매수하며 보유 비율을 늘렸다. 다음 표는 동종목의 외국인, 기관의 일별 순매수량을 나타낸 것이다.                   지표               항목               값               종합점수                 성장성               매출액증가율               -0.32               2.94                 자기자본증가율               0.01                 안정성               부채비율               68.97               8.26                 유동비율               191.61                 이익안정성               6.94                 수익성               ROA               1.62               3.15                 ROE               2.74                 영업이익율               -0.71          서울가스의 퀀트 재무 점수는 14.35점으로 지난 분기에 비해 성장성 점수가 하락했다. 이는 자기자본 증가율이 감소하였기 때문이다. 안정성 종합 점수는 부채비율 증가, 유동비율 감소로 하락했다. 수익성 측면에서 볼때 ROA, ROE가 하락하여 이전보다 낮은 점수를 받았다. 'fnRASSI'는 증권전문 기업 씽크풀과 파이낸셜뉴스의 협업으로 로봇기자가 실시간으로 생산하는 기사입니다."
파이낸셜뉴스,017390,/news/news_read.nhn?article_id=0003858177&office_id=014&mode=search&query=서울가스&page=1,2017-08-14 10:28,"[fnRASSI]서울가스(017390), 52주 신고가 경신...0.54% &uarr;","서울가스(017390)는 52주신고가를 기록하고 있어 주목할만하다. 동종목의 현재 주가는 92,700원 선에서 이루어지고 있다. 거래일을 기준으로 최근 3일간 평균 거래량은 1,769만 주이다. 이는 60일 일 평균 거래량 697만 주와 비교해보면 최근 거래량이 급격히 늘어났다는 것을 알 수 있다. 외국인/기관 순매수, 개인은 순매도(한달누적)  전일까지 기관이 9일 연속, 외국인이 4일 연속 각각 동종목을 순매수 했다. 4주간을 기준으로 보면 외국인이 5,428주를 순매수했고, 기관도 순매수량을 늘리며 5,760주를 순매수했다. 반면 개인들은 매도 우위를 지속하면서 11,188주를 순매도한 것으로 나타났다. 퀀트 재무분석, 종합점수 25점으로 상승                    지표               항목               값               종합점수                 성장성               매출액증가율               -0.32               2.94                 자기자본증가율               0.01                 안정성               부채비율               68.97               8.26                 유동비율               191.61                 이익안정성               6.94                 수익성               ROA               1.62               3.15                 ROE               2.74                 영업이익율               -0.71          서울가스의 퀀트 재무 점수는 14.35점으로 3개월 이전 14.23점보다 올랐다. 지난 분기에 비해 성장성 점수가 상승했다. 'fnRASSI'는 증권전문 기업 씽크풀과 파이낸셜뉴스의 협업으로 로봇기자가 실시간으로 생산하는 기사입니다."
파이낸셜뉴스,017390,/news/news_read.nhn?article_id=0003850368&office_id=014&mode=search&query=서울가스&page=1,2017-07-27 11:00,"[fnRASSI]서울가스(017390), 52주 신고가...0.34% &uarr;","서울가스(017390)는 52주신고가를 기록하고 있어 주목할만하다. 동종목의 현재 주가는 88,400원 선에서 이루어지고 있다. 거래일을 기준으로 최근 3일간 평균 거래량은 3,835만 주이다. 이는 60일 일 평균 거래량 557만 주와 비교해보면 최근 거래량이 급격히 늘어났다는 것을 알 수 있다. 거래비중 기관 23.31%, 외국인 21.92% 최근 한달간 주체별 거래비중을 살펴보면 개인이 54.75%, 기관이 23.31%, 외국인은 21.92%를 기록한 것으로 나타났다. 그리고 최근 5일간 거래비중은 개인이 전체 거래의 51.45%를 차지하며 가장 적극적인 모습을 보여줬고, 기관은 39.05%를 나타냈으며 외국인은 9.49%를 나타냈다. 외국인, 기관 모두 보유량 증가 (5일 누적) 최근 5일간 동종목의 외국인 투자자는 998주 순매수하였고 마찬가지로 기관은 211주 순매수하였다. 전날 두 주체 각각 78주, 211주 순매수하며 보유 비율을 늘렸다. 다음 표는 동종목의 외국인, 기관의 일별 순매수량을 나타낸 것이다. 'fnRASSI'는 증권전문 기업 씽크풀과 파이낸셜뉴스의 협업으로 로봇기자가 실시간으로 생산하는 기사입니다."
파이낸셜뉴스,017390,/news/news_read.nhn?article_id=0003860414&office_id=014&mode=search&query=서울가스&page=1,2017-08-18 14:02,"[fnRASSI]서울가스(017390), 52주 신고가...2.48% &uarr;","서울가스(017390)는 52주신고가를 기록하고 있어 주목할만하다. 동종목의 현재 주가는 95,100원 선에서 이루어지고 있다. 거래일을 기준으로 최근 3일간 평균 거래량은 988만 주이다. 이는 60일 일 평균 거래량 718만 주와 비교해보면 최근 거래량이 다소 증가했다는 것을 알 수 있다. 기관투자자 연속 2일 순매도 최근 5일간 동종목의 외국인 투자자는 883주 순매수하였고 마찬가지로 기관은 195주 순매수하였다. 전날 두 주체 각각 84주, 195주 순매수하며 보유 비율을 늘렸다. 다음 표는 동종목의 외국인, 기관의 일별 순매수량을 나타낸 것이다.                   지표               항목               값               종합점수                 성장성               매출액증가율               -0.33               2.92                 자기자본증가율               0.01                 안정성               부채비율               68.97               8.12                 유동비율               191.61                 이익안정성               6.67                 수익성               ROA               1.37               3.01                 ROE               2.32                 영업이익율               -0.97          서울가스의 퀀트 재무 점수는 14.05점으로 지난 분기에 비해 성장성 점수가 상승했다. 실적 안정성이 악화되어 안정성 종합 점수는 하락했다. 수익성 측면에서 볼때 ROA, ROE, 영업이익률 모두 하락하여 이전보다 낮은 점수를 받았다. 'fnRASSI'는 증권전문 기업 씽크풀과 파이낸셜뉴스의 협업으로 로봇기자가 실시간으로 생산하는 기사입니다."
파이낸셜뉴스,017390,/news/news_read.nhn?article_id=0003876562&office_id=014&mode=search&query=서울가스&page=1,2017-09-19 10:52,"[fnRASSI]서울가스, 0.75% 내리며 거래량 증가","서울가스(017390)의 현재 거래량이 최근 5거래일 거래량의 최고치를 경신했다. 그리고 현재 전 거래일보다 0.75% 감소하여 3일 연속 하락흐름을 보이고 있다. 외국인투자자 연속 24일 순매도 최근 5일간 동종목의 외국인 투자자는 804주 순매수하였고 반면 기관은 37주 순매도하였다. 전날 외국인 161주 순매수, 기관37주 순매도하며 보유 비율이 변동했다. 다음 표는 동종목의 외국인, 기관의 일별 순매수량을 나타낸 것이다. 회전율이 낮지만 주가등락폭은 적정한 편 최근 한달간 서울가스의 상장주식수 대비 거래량을 비교해보니 일별 매매회전율이 0.01%로 집계됐다. 이처럼 회전율이 너무 낮은 경우 유동성이 떨어져 매매가 자유롭지 못할 수 있기 때문에 상당한 주의가 필요하다. 저점대비 고점의 장중 주가변동률은 평균 0.74%로 적정한 수준을 보이고 있다. 'fnRASSI'는 증권전문 기업 씽크풀과 파이낸셜뉴스의 협업으로 로봇기자가 실시간으로 생산하는 기사입니다."
파이낸셜뉴스,017390,/news/news_read.nhn?article_id=0003859702&office_id=014&mode=search&query=서울가스&page=1,2017-08-17 10:49,"[fnRASSI]서울가스(017390), 52주 신고가...0.76% &uarr;","서울가스(017390)는 52주신고가를 기록하고 있어 주목할만하다. 동종목의 현재 주가는 91,600원 선에서 이루어지고 있다. 거래일을 기준으로 최근 3일간 평균 거래량은 2만 주이다. 이는 60일 일 평균 거래량 705만 주와 비교해보면 최근 거래량이 급격히 늘어났다는 것을 알 수 있다. 기관투자자의 거래참여 높아, 거래비중 41.38% 최근 한달간 주체별 거래비중을 살펴보면 개인이 49.08%로 가장 높은 참여율을 보였고, 기관이 41.38%를 보였으며 외국인은 9.52%를 나타냈다. 그리고 최근 5일간 거래비중은 개인 비중이 63.15%로 가장 높았고, 기관이 29.02%로 그 뒤를 이었다. 외국인은 7.81%를 나타냈다.                   지표               항목               값               종합점수                 성장성               매출액증가율               -0.33               2.92                 자기자본증가율               0.01                 안정성               부채비율               68.97               8.12                 유동비율               191.61                 이익안정성               6.67                 수익성               ROA               1.37               3.01                 ROE               2.32                 영업이익율               -0.97          서울가스의 퀀트 재무 점수는 14.05점으로 지난 분기에 비해 성장성 점수가 상승했다. 실적 안정성이 악화되어 안정성 종합 점수는 하락했다. 수익성 측면에서 볼때 ROA, ROE, 영업이익률 모두 하락하여 이전보다 낮은 점수를 받았다. 'fnRASSI'는 증권전문 기업 씽크풀과 파이낸셜뉴스의 협업으로 로봇기자가 실시간으로 생산하는 기사입니다."
이데일리,017390,/news/news_read.nhn?article_id=0003869969&office_id=018&mode=search&query=서울가스&page=1,2017-07-10 09:28,"서울가스, 자기주식취득 신탁계약 연장",[이데일리 강경훈 기자] 서울가스(017390)는 자기주식취득 신탁계약 기간을 2018년 7월 10일까지로 1년 연장하기로 결정했다고 10일 공시했다.
서울경제,017390,/news/news_read.nhn?article_id=0003067936&office_id=011&mode=search&query=서울가스&page=1,2017-07-10 09:32,"서울도시가스, 자기주식취득 신탁계약 기간 연장",[서울경제] 서울도시가스는 10일 자기주식취득 신탁계약 기간을 2018년 7월 10일까지로 1년 연장키로 결정했다고 공시했다.
