source,symbol,link,date,title,content
한국경제,025560,/news/news_read.nhn?article_id=0003939836&office_id=015&mode=search&query=미래산업&page=1,2018-05-16 07:57,대구연구개발특구본부 차세대 미래산업 성장지원 프로그램 본격가동,"대구광역시와 대구연구개발특구본부는 대구특구 유망 특화기술 발굴·기획 및 초기 유망 선도기술 사업화 활성 등을 위해 대구광역시·대구특구본부 협력사업을 시행한다고 15일 밝혔다.댁 대구특구본부는 산업변화에 대응한 신성장 산업분야 특화기술 발굴, 유망 선도산업 발전방향 기획 등을 통한 연구소기업 및 첨단기술기업의 수요 발굴을 추진할 계획이다. 기업 성장을 위해서는 연구소기업을 대상으로 사업화 지원을 위해 각 1억원 이내를 지원할 예정이다.  대구특구 기업을 대상으로는 글로벌 진출 지원을 통해 글로벌 강소기업으로 육성할 계획이다. 각 사업은 수행기관 모집 및 연구소기업 지원 등을 통해 추진되며, 6월 15일까지 지원신청 을 받는다.  대구특구본부는 올해 협력사업을 통해 대구특구 신 특화분야 정책 발굴 프로젝트 수립, 특화분야 추천 기술 40건 이상 확보, 고용 15명, 매출 10억원 등을 목표로 대구특구 활성화에 박차를 가할 계획이다. 김용욱 대구연구개발특구 본부장은“기존의 대구특구 특화분야를 개편하여 미래 산업을 이끌어나갈수 있는 기술기반 생태계 구축으로 지역 경제 활성화 및 일자리 창출에 힘을 보태겠다”고 밝혔다.오경묵 기자"
뉴시스,025560,/news/news_read.nhn?article_id=0007592243&office_id=003&mode=search&query=미래산업&page=1,2016-11-16 10:48,주형환 테슬라 머스크 대표와 미래 자동차 산업 논의,"전기·자율주행차 및 신재생 에너지 분야 협력방안 논의 니카라과 대통령 마난 한-중미 FTA 논의…자동차 수출 기대 【세종=뉴시스】박상영 기자 = 주형환 산업통상자원부 장관이 세계적인 전기차 업체인 테슬라의 대표 일론 머스크와 만나 미래 자동차 산업과 에너지신산업에 대해 논의했다. 산업부는 16일 주 장관이 중남미 출장길에 미국 로스엔젤레스에 들러 주 장관과 머스크 대표가 만나 향후 협력방안에 대해 의견을 나눴다고 밝혔다. 이날 주 장관은 전기차·자율주행차 산업 발전을 위한 한국의 다양한 정책을 소개하고 세계적인 배터리 기술력, 높은 ICT 기술역량, 우수한 자동차부품 생태계, 지적재산권 보호, FTA 네트워크 등을 강조했다. 그러면서 현재 30여개의 부품, 장비 회사와 협력중인 테슬라와 한국 업체와의 협력 관계 확대와 한국에의 투자 등을 요청했다. 또 태양광, 가정용 배터리 등 신재생 에너지 산업 분야에 진출 중인 테슬라 사와 협력방안에 대해 논의했다. 주 장관은 15일에는 니카과라에서 중미경제통합기구(SIECA) 의장국인 니카라과의 다니엘 오르테가 사아베드라 대통령을 만나 한-중미 FTA와 한-니카라과 경제협력관계의 미래발전방향에 대해 논의했다. 주 장관은 ""한-중미 양측은 상호보완적인 경제·산업구조를 가지고 있다""며 ""한-중미 FTA 타결 시 양측 간 교역이 대폭 확대되고 다양화되는 등 상호 윈-윈의 결과를 얻을 수 있을 것""이라고 했다. 이어 ""특히, 한국은 자동차·자동차 부품·전자제품·타이어·편직물·화장품 등을, 니카라과는 커피·설탕·열대과일·럼 등의 수출 확대를 통해 소비자 모두에 이익을 줄 것으로 보인다""고 했다. 이에 오르테가 대통령은 ""한국과의 FTA가 타결되면 향후 양자간 미래지향적 협력 관계를 위한 출발점이 될 것""이라며 ""섬유·의류·ICT·건설·농수산 등 다양한 분야에서 선진기술과 노하우를 가진 한국 기업들의 투자 확대를 바란다""고 했다."
연합뉴스,025560,/news/news_read.nhn?article_id=0008972324&office_id=001&mode=search&query=미래산업&page=1,2017-01-19 15:47,'미래 전략산업 육성'&hellip;대구상의 중소기업 지원사업,"대구상의. [연합뉴스 자료사진] (대구=연합뉴스) 류성무 기자 = 대구상공회의소는 ㈔중소기업융합대구경북연합회와 중소기업 경쟁력 강화, 경제 활성화 등을 위한 업무협약을 했다고 19일 밝혔다. 두 기관은 대구 중소기업의 미래 전략산업 육성을 지원하고 경영환경 개선, 중소기업 교육 및 마케팅 지원 등 업무를 공동 추진한다. 이재경 대구상의 상근부회장은 ""상호 긴밀한 협력으로 기업의 미래 산업 육성을 이끌어 나갈 것이다""고 말했다."
연합뉴스,025560,/news/news_read.nhn?article_id=0008827629&office_id=001&mode=search&query=미래산업&page=1,2016-11-16 15:28,"전주시, 탄소&middot;차부품 등 미래형산업 유치 팔 걷었다","(전주=연합뉴스) 임청 기자 = 전주시가 일자리 창출과 지역경제 활성화를 위해 탄소와 자동차부품 등 미래 먹거리산업 분야 기업의 투자유치에 나섰다. 전주시는 16일 오후 전주 르윈호텔에서 국내 탄소 기업 14개사와 자동차 부품업체 3개사 등 잠재적 투자기업 25개사 관계자 50여명을 초청, 투자유치 설명회를 열었다. 참가 기업은 ㈜케이지에프, ㈜엘택 인터내셔날, ㈜알지택코리아, ㈜씨앤에프 등이다. 시는 이날 '탄소산업 중심도시 전주'를 주제로 전주의 환경·교육·교통 여건, 기업에 최적화된 인프라, 인센티브 지원 등을 소개하고 전주 탄소섬유 국가산업단지 조성 계획에 대해서도 설명했다. 전주로 기업을 이전한 후 성공신화를 이뤄낸 기업 소개도 있었다. 성도경 비나택 대표이사는 ""전주로 와서 여러 가지 어려움이 있었지만, 전주시의 적극적인 도움과 기술원 등의 도움을 받아 오늘까지 왔다""면서 ""좋은 기업들이 전주로 와서 함께 발전해 나가기를 기대한다""고 말했다. 시는 앞으로 조성될 친환경복합산업단지 3단계 사업부지(75만㎡)에 이들 기업이 들어설 수 있도록 사후관리에 집중하기로 했다. 시의 한 관계자는 ""기업하기 좋은 도시 전주 만들기에 매진함과 아울러 적극적이고 지속적인 기업유치로 청년일자리 문제를 해결해 나가도록 노력하겠다""고 말했다."
헤럴드경제,025560,/news/news_read.nhn?article_id=0001393819&office_id=016&mode=search&query=미래산업&page=1,2018-05-16 09:51,"대구특구본부, 차세대 미래산업 성장 프로그램 본격 가동","[헤럴드경제(대구)=김병진 기자]대구시와 대구연구개발특구본부는 대구특구 유망 특화기술 발굴·기획 및 초기 유망 선도기술 사업화 활성 등을 위해 '대구시·대구특구본부 협력사업'을 시행한다. 따라서 산업변화에 대응한 대구특구 신성장 산업분야 특화기술 발굴, 유망 선도산업 발전방향 기획 등을 통한 연구소기업 및 첨단기술기업의 수요 발굴을 추진한다. 연구소기업을 대상으로 사업화 지원을 위해 각 1억원 이내를 지원할 예정이다. 또 대구특구 기업을 대상으로는 글로벌 진출 지원을 통해 글로벌 강소기업으로 육성할 계획이다. 각 사업은 수행기관 모집 및 연구소기업 지원 등을 통해 추진되며 다음달 15일까지 지원신청 받는다. 대구특구본부는 올해 협력사업을 통해 대구특구 신특화분야 정책 발굴 프로젝트 수립, 특화분야 추천 기술 40건 이상 확보, 고용 15명, 매출 10억원 등을 목표로 대구특구 활성화에 박차를 가한다. 김용욱 대구연구개발특구 본부장은 ""기존의 대구특구 특화분야를 개편해 미래 산업을 이끌어나갈수 있는 기술기반 생태계 구축으로 지역 경제 활성화 및 일자리 창출에 힘을 보태겠다""고 밝혔다."
파이낸셜뉴스,025560,/news/news_read.nhn?article_id=0003735526&office_id=014&mode=search&query=미래산업&page=1,2016-11-16 17:39,"LNG 추진선박 산업, 미래 해양산업으로 키운다","배출가스 국제규제 대비..정부, 도입·건조·입항 지원항만사용료 감면, 세제혜택"
뉴스1,025560,/news/news_read.nhn?article_id=0002518280&office_id=421&mode=search&query=미래산업&page=1,2017-01-19 16:34,"제주, 국가 외교 공백 속 미래산업&middot;환경 외교 돋보여","현지시간 18일 원희룡 제주특별자치도지사가 2017 세계경제포럼 연례회의가 열린 콩그레스센터에서 잉거 앤더슨 세계자연보전연맹(IUCN) 사무총장과 면담을 가졌다.© News1 원희룡 지사, 다보서포럼서 그린빅뱅 전략 소개세계리더스포럼 세계적 환경회의로 육성 제안도 (제주=뉴스1) 고경호 기자 = 국가적인 외교 공백 속에서 국내 정치인 중 유일하게 공식 초청을 받고 2017 세계경제포럼(다보스포럼)에 참가한 원희룡 제주특별자치도지사가 미래산업과 환경 외교관 역할을 톡톡히 해 눈길을 끌고 있다. 원 지사는 세계자연보전연맹(IUCN)과 함께 제주에서 열리는 세계리더스보전포럼을 세계적인 환경회의로 거듭날 수 있도록 IUCN과의 절충에 나섰다. 또 제주가 4차 산업혁명에 대비해 추진하고 있는 카본 프리 아일랜드(탄소 없는 섬) 프로젝트와 함께 이를 통해 새로운 에너지 신산업 생태계를 구축하는 제주그린빅뱅을 세계인들에게 소개하면서 미래산업의 허브화를 추진하고 있다. ◇제주를 세계 환경회의 중심지로 원 지사는 현지시간 18일 2017 세계경제포럼 연례회의가 열린 콩그레스센터에서 잉거 앤더슨 IUCN 사무총장과 면담을 가졌다. 이 자리에서 원 지사는 제주도와 IUCN의 공동 협력 사업에 대해 논의하며 오는 2018년 제주에서 열리는 세계리더스보전포럼을 세계적인 환경회의로 개최할 것을 제안했다. 원 지사는 “2015년 세계리더스보전포럼에 이어 내년 2차 포럼 사전준비를 환경부와 협의 중”이라며 “제주와 한국정부, IUCN 공동개최로 지방정부 주도의 세계적인 환경회의로 발전시켜 지구환경 문제를 해결해 나갈 수 있도록 지속적인 협력을 이뤄나가자”고 피력했다. 원 지사는 2016년 9월 미국 하와이에서 진행된 2016 세계자연보전총회(WCC)에서 논의된 결의문 채택과 관련, “국제보호지역 관리 지침이 전 세계에 적극 반영되고 전파될 수 있도록 교육훈련프로그램 설립 센터를 제주에 유치할 수 있도록 힘을 실어 달라”고 요청했다. 이어 “올해 상반기 마무리되는 세계환경허브 평가인증시스템 구축사업도 실행 단계에 대한 발전적이고 지속가능한 방법을 논의해 나가자”고 건의했다. 이에 잉거 앤더슨 총장은 “세계환경허브 평가 인증시스템이 국제적 기준으로 자리 잡을 수 있기 위해서는 IUCN과 세계지방정부(ICLEI), 유엔 환경계획위원회(UNEP) 등 신뢰도 높은 국제기구들이 인증기구로서 직접 참여가 매우 중요하다”며 “올해 상반기부터 운영에 관한 각 기관의 역할과 책무 등에 대해 논의가 시작될 수 있길 바란다”고 화답했다. 이에 따라 제주도와 IUCN은 워킹그룹과 조정위원회 회의 등 의견수렴을 통해 세계환경허브 평가 및 인증시스템을 올 상반기까지 완료할 계획이며, 앞으로도 국제기구와의 협력 방안을 적극적으로 마련할 예정이다. 2017 세계경제포럼(다보스포럼) 연례회의 참석차 스위스 다보스를 방문 중인 원희룡 제주특별자치도지사는 현지시간 18일 오후 다보스 포럼 두 번째 일정인 ‘파워링 모빌리티’ 세션에 패널로 참석해 에너지와 교통 시스템의 변화 속에서 제주의 발전 계획을 설명하고 있다.(사진제공=제주도) © News1 ◇제주, 탄소 없는 섬 넘어 미래산업의 중심지 꿈꾼다 원 지사는 현지시간 18일 오후 다보스 포럼 두 번째 일정인 ‘파워링 모빌리티’ 세션에 패널로 참석해 제주를 4차 산업혁명을 선도할 글로벌 쇼케이스로 만들어 나가겠다고 밝혔다. 원 지사는 이 자리에서 “제주 그린빅뱅은 기후 에너지시대, 제4차 산업혁명시대를 맞이해 에너지와 교통을 망라한 새로운 산업생태계 조성을 위한 시스템 전략”이라고 소개했다. 이어 “오는 2030년까지 제주의 모든 전력을 신재생에너지로 생산하고 40만대에 가까운 모든 차량을 전기차량으로 대체하는 목표를 세우고 이를 뒷받침하기 위해 스마트그리드(지능형 전력망)의 전면적 도입과 대규모 에너지저장시설을 적극 추진 중”이라며 제주의 카본 프리 아일랜드(탄소 없는 섬) 프로젝트를 설명했다. 또 “스마트그리드는 이미 세계 최대 실증단지를 구축한 상태이고, 2030년까지 제주도 전력을 스마트그리드 거점도시로 조성하기 위해 지난해 행원 에코타운을 조성하고 오는 2018년까지 13만 가구에 지능형계량기를 설치하고, 29개 건물 에너지 관리시스템을 구축할 계획”이라며 제주의 그린빅뱅 전략도 소개했다. 이번 파워링 모빌리티 세션에는 원 지사를 포함해 드라이브 스웨덴 카타리나 엘므사터-스바르드 의장, 프랑스 에어리퀴드 베누아 포티에 CEO, 독일 이노지 피터 테리움 CEO 등이 함께 참석해 미래 에너지와 교통 시스템에 대한 의견을 교환했다. 앞서 원 지사는 이날 첫번째 세션인 ‘전기시스템에서 발휘되는 4차 산업혁명의 힘’ 세션에 토론자로 참가해 정책, 기업, 산업분야에서 4차 산업혁명이 가져올 변화에 대해 논의하고 필요한 규제와 정책에 대해 토론했다. 국내 정치인 중 유일하게 2017 세계경제포럼 연례회의(다보스포럼)에 공식초청을 받고 스위스를 방문 중인 원희룡 제주특별자치도지사는 현지시간 18일 첫번째 세션인 ‘전기시스템에서 발휘되는 4차 산업혁명의 힘’ 세션에 토론자로 참가해 정책, 기업, 산업분야에서 4차 산업혁명이 가져올 변화에 대해 발표하고 있다.(사진제공=제주도) © News1"
동아일보,025560,/news/news_read.nhn?article_id=0003035434&office_id=020&mode=search&query=미래산업&page=1,2017-01-17 09:06,민코넷 김태우 대표 &ldquo;가상현실 SW &lsquo;스윙(Swing)&rsquo;으로 미래산업 선도할 것&rdquo;,"사진=민코넷 김태우 대표 핀란드의 ‘슈퍼셀’, 중국의 ‘알리바바’, ‘페이스북’. 이들의 공통점은 해를 거듭할수록 매출이 기하급수적으로 늘어나는 글로벌 소프트웨어 기업이란 점이다. 또한, 인공지능(AI), 사물인터넷(IoT), 증강현실(AR), 가상현실(VR) 등 미래 산업에 뛰어든 2~3년 된 소프트웨어 신생기업조차 조 단위 매출을 거뜬히 달성하고 있다. 반면 IT강국을 부르짖었던 한국의 위상은 어디에서도 찾아 볼 수 없는 암담한 상황이다. 글로벌 기업이 탄생하지 못하는 것에는 여러 이유가 있지만 대기업에만 몰려 있는 핵심개발자들과 결과물이 나올 때까지 기다려주지 않는 한국의 벤처 생태계 때문이라는 지적이 많다. 이런 열악한 상황 속에서도 VR관련 소프트웨어 기술 하나만으로 정상을 향해 돌진하고 있는 토종기업이 있어 주목받고 있다. 창업 후 2년 동안 약 30억에 가까운 자금을 투자하면서 소프트웨어 개발에 전념하고 있는 민코넷(김태우 대표)이 그 주인공이다. ‘전체 직원 14명 중 12명이 소프트웨어 개발자’, ‘서울대-카이스트-USC 석박사를 비롯해 삼성전자, KT, 넥슨, 인텔 출신의 핵심개발자들’, ‘국내 14개, 미국 9개 등 국내외 특허 23개를 출원 및 등록’. 가상현실(VR) 소프트웨어 ‘스윙(Swing)’으로 글로벌 기업들과 어깨를 나란히 하고 있는 민코넷 김태우 대표를 만나 ‘스윙’에 대한 궁금증을 풀어봤다.  Q. 글로벌 VR시장에서 ‘스윙’에 대한 관심이 높다. 이유는? ‘스윙’은 작년 3월 샌프란시스코에서 열린 세계 최대 게임개발자 콘퍼런스인 ‘2016GDC’를 통해서 처음 글로벌 시장에 소개된 후 진화를 거듭해 다양한 기능을 보유하고 있다. ‘스윙’을 게임(PC, 모바일, VR)에 적용하면 ‘게임플레이’ 화면을 ‘360비디오’로 만들어 페이스북, 유튜브 등 소셜 플랫폼에 자동으로 업로드 할 수 있다. 또한, ‘게임플레이’를 인-게임에서 라이브로 방송하거나 리플레이로 볼 수 있으며, ‘게임플레이’를 다양한 VR기기(기어VR, 데이드림, 오큘러스, HTC 바이브 등)로 시청할 수 있다. 이 뿐만이 아니다. ‘게임플레이’ 화면 안에서 몰입형 네이티브 광고 및 게임아이템 판매도 가능하다. 새로운 흐름에 맞는 수익 모델을 찾고 있는 디지털 광고 및 게임회사들이 관심을 가질 수밖에 없는 대목이다.  Q.‘2017GDC’에서 국내업체 중 최대 규모로 참가한다. 참가 목적은?  오는 3월 1일, 지난 2년간 개발한 ‘스윙’을 글로벌 시장에 정식으로 론칭한다. 이번에 론칭하는 ‘스윙’은 유니티뿐만 아니라 언리얼(게임엔진)을 사용한 게임에도 적용이 가능하다. 유니티용 ‘스윙’은 ‘유니티스토어’를 통해 출시되며 언리얼용 ‘스윙’은 이번 미국 LA소재 대형 게임개발사의 신규 프로젝트에 적용, ‘2017GDC’에서 최초로 선보이는 것이다. 이로써 인디게임 개발사부터 초대형 게임개발사까지 지원할 수 있게 됐다. Q.‘스윙’이 지나온 발자취는 주로 해외에 집중되어 있다. 제품 공개도 모두 해외에서 했는데 이유가 있는지? VR시장에서 글로벌 기업으로 성장하기 위해서는 해외에서 인지도를 높이는 것이 중요하다고 판단, 해외 마케팅에 주력했다. 지난해 3월 샌프란시스코에서 열린 ‘2016GDC’에서 ‘스윙’을 최초로 공개했으며 4월 열린 ‘2016 Unite Seoul’에서는 개발자들에게 ‘스윙’에 대한 개념을 선보였다. 5월 리스본에서 열린 ‘Unite Hackweek 2016’과 8월에 열린 ‘GDC Europe’에서도 ‘스윙’을 소개해 현지에서 큰 반향을 일으킨 바 있다. 특히 11월에 열린 ‘Unite LA’에서는 유니티의 실버파트너로 참석해 유니티 앱 어워드 어플리케이션으로 선정되는 영광을 누렸다. 여세를 몰아 올해 3월 샌프란시스코에서 열리는 ‘2017GDC’에서는 유니티 및 언리얼용 제품까지 공식 론칭하게 됐다. Q.‘스윙’은 어떤 기업들과 협업해야 시너지효과를 누릴 수 있나? ‘스윙’은 PC, 모바일, VR 등 어떤 게임플랫폼이든 상관없이 적용이 가능하다. 또한, 유니티와 언리얼용 ‘스윙’을 동시에 지원하면서 ‘투 트랙’ 전략을 쓰고 있다. 즉, 인디게임과 소형개발사에게는 오픈 소스를 제공해 자유롭게 게임개발에 사용하도록 하는 것이 첫 번째이며, 두 번째는 국내외 대형 개발사와의 협업 관계를 통해 기술 지원을 해주는 방식이다. Q. 글로벌 기업으로서 민코넷에게 사회적 책임이 주어진다면 어떤 것들이 있다고 생각하는지? 우리는 회사를 처음 설립했을 당시부터 해외 어떤 기업과도 대등한 위치에서 경쟁할 수 있는 기업을 꿈꿔왔으며 한국의 기술력만으로 세계를 제패하는 것이 목표였다. 지금도 그 다짐에는 변함이 없다. 단, 기술기업으로써 우리의 성공이 한국의 소프트웨어 생태계에 조금이라도 변화를 줄 수 있다면 더할 나위 없이 좋을 것 같다. 한국에서 벤처기업으로 성공한다는 것은 하늘의 별따기다. 철저하게 준비했다고 자부했지만 우리 역시 무수한 장벽에 부딪혀 많은 고민을 해야 했다. 해외로 기업을 옮길 생각까지 했을 정도다. Q.민코넷의 수익 모델은 무엇이라고 생각하는지? ‘스윙’은 일차적으로 클라우드 서비스를 통한 안정적인 수익과 대형 게임개발사와 프로젝트 형태를 통한 수익을 창출할 것이다. 점차 ‘스윙’을 적용한 게임들과 콘텐츠가 많아지면 몰입형 네이티브 광고를 통한 매출 역시 기대할 수 있다. 궁극적으로는 VR애드 플랫폼으로 성장하기를 희망하고 있다. Q. 보상형 동영상 광고, 몰입형 네이티브 광고 등 생소한 단어가 많다. 자세히 설명해 주신다면? 새로운 패러다임에 맞는 새로운 수익모델이 그동안 게임시장을 선도해 왔다. 패키지게임(패키지판매)에서 온라인게임(정액제, 부분유료화)으로, 온라인게임에서 모바일게임(부분유료화, 보상형 동영상 광고)으로 발전한 것과 같은 맥락이다. 몰입형 네이티브 광고는 무료로 제공되는 게임을 게이머는 자유롭게 즐기고 대신 게이머가 녹화한 플레이 화면에 광고가 자연스럽게 노출되는 방식이다. 배너광고가 아닌, 게임에 자연스럽게 삽입된 시청자 전용광고(lmmersive Ads)이기 때문에 게임회사들도, 플레이어도 모두 만족할 수 있는 모델이라고 자신한다. 또한 VR게임 플레이 화면 안에 자연스럽게 삽입된 광고는 라이브 화면과 녹화 화면에서 모두 노출할 수 있기 때문에 확장성은 더 우수하다.  Q. 최근 ‘잡시뮬레이터’라는 게임이 VR에서 가장 높은 성과를 낸 게임으로 평가받고 있다. 이유는 무엇이라고 생각하는가? 아마도 현실과 유머를 동시에 즐길 수 있기 때문이 아닐까. VR게임 중 처음으로 300만 달러 이상의 매출을 달성한 ‘잡시뮬레이터’는 편의점 알바, 자동차 정비공 등 게이머가 특수한 직업을 체험할 수 있다. 단 커피를 손님에게 집어 던지거나 정비공이 손님 차를 부셔버리는 등 현실에서 벗어난 행동들을 할 수 있는 것이 특징이다. 이런 가상체험들이 페이스북이나 유튜브에 확산되어 수익으로 증명되고 유튜브 영상만 2억5000만회 이상 조회수를 달성했다.  즉, VR을 통한 가상체험과 소셜 플랫폼(페이스북, 유튜브)을 통한 확산효과가 수익으로 이어질 수 있다는 것을 증명한 사례로 볼 수 있다. Q. 국내외 합쳐서 모두 23개의 특허출원이 되어 있다. 어떤 기술들이 특허로 등록되어 있나? 특허를 일일이 다 설명할 수는 없지만, 주로 ‘스윙’ VR애드에 집중되어 있다. 기존 PC/모바일 게임을 VR로 시청할 수 있는 VR시청 기술도 물론이고 미국 9개의 특허 중 주요 특허는 모두 VR애드와 관련되어 있을 정도다. 앞으로 민코넷은 VR애드에서는 독보적인 글로벌 기업이 될 것이라고 자신한다. Q. e스포츠에서도 ‘스윙’ 기술이 사용될 수 있는지? 해외에서 VR시청은 핫한 이슈다. e스포츠도 VR360까지 온 것으로 알고 있다. 하지만 한국 e스포츠에서는 아직까지 VR을 도입하지 않고 있다. 우리는 ‘스윙’으로 게이머라면 누구나 SNS 또는 유튜브를 통해 VR e스포츠 방송을 할 수 있고 또한 시청자들도 e스포츠 장면을 VR로 시청할 수 있도록 할 생각이다. 이미 온라인 전략 시뮬레이션 게임 ‘도타2’라는 PC게임이 VR시청으로 가능하도록 지원하는 것처럼, ‘슬리버TV’ 역시 e스포츠 게임으로 그 가능성을 전 세계에 알린 것처럼, 우리는 ‘스윙’이 접목된 게임은 모두 VR e스포츠로 이용할 수 있도록 만들어 나가겠다. Q. 앞으로의 비전을 제시해 주신다면?  민코넷이 지향하고 있는 또 하나의 목표는 사용자 기반의 ‘VR 게임 콘텐츠 플랫폼’으로 발전해 나가는 것이다. VR 게임 콘텐츠들이 모여 있는 유튜브와 같은 영상 플랫폼이라고 생각하면 이해가 쉬울 것이다. 지금처럼 모든 과정들이 순조롭게 진행된다면 2019년에는 도달할 수 있을 것으로 생각한다."
