source,symbol,link,date,title,content
디지털타임스,025560,/news/news_read.nhn?article_id=0002306130&office_id=029&mode=search&query=미래산업&page=1,2015-09-23 18:48,"효성그룹, 미래 산업의 `쌀` 탄소섬유 키운다","효성그룹이 투자한 전북 창조경제혁신센터 내 탄소섬유제품 전시실에서 한 방문객이 직원의 설명을 듣고 있다. 효성그룹 제공 ■ 창조경제 선도기업 효성은 고부가가치 신소재인 '탄소섬유'를 중심으로 한국 기업의 미래 산업 저변을 넓혀나가고 있다. 지난해 11월 효성이 전라북도 전주에 창조경제혁신센터는 국내 최초로 독자 기술로 탄소섬유를 개발해 양산 중인 효성이 전라북도와 함께 '탄소클러스터'를 조성해 전북지역 창조경제 생태계를 활성화하기 위해 설립됐다. 탄소, 문화콘텐츠, 농생명 등 효성의 기술력과 해외시장 경험을 바탕으로 다양한 창업지원이 집중적으로 이뤄지고 있다. 탄소섬유는 강철보다 무게는 4배 가볍고 강도는 10배 이상 강한 고부가가치 소재다. 고강도, 내열성, 낮은 열전도도, 우수한 전기전도도 등 다양한 특성 때문에 활용 분야가 무궁무진하다. 전후방 산업 육성 효과가 커 창조 경제를 대표하는 사업 모델이 될 것으로 기대된다. 항공기 날개와 동체, 자동차, 토목, 건축 분야뿐만 아니라, 고속 스텔스함 선체와 같은 군사 제품, 고압전선 보강재와 같은 산업재를 비롯해 일반 전자기기, 스포츠 레저 분야 등에도 활용 가치가 높다. 효성은 전주를 중심으로 탄소섬유 관련 기업, 기관, 지자체가 함께 시너지 효과를 창출할 수 있는 '탄소클러스터'를 조성하기 위해 협력하고 있다. 효성은 전주공장 내 부지를 무상 제공해 약 500평 규모의 탄소특화창업보육센터 및 첨단재료 연구센터를 건립하기로 했다. 올해 11월 개소와 함께 우선 20여개 탄소 기업의 창업을 지원할 계획이다. 창업보육센터에서는 자금지원뿐만 아니라 대기업의 회사 경영 노하우 전수, 우수 아이디어 사업화, 효성의 글로벌 네트워크를 활용한 판로 개척 등이 동시에 이뤄진다. 효성은 입주한 기업에 제품 개발 실험 장비 활용 및 고성능 탄소섬유 등 필요한 원료를 지원할 계획이다. 또 효성은 지난 2년간 효성·전북 아이디어 창업 경진대회를 통해 전라북도의 유망 창업 아이템 발굴에 나서고 있다. 올해의 경우 탄소, 농생명·식품, 전통문화·ICT 등 3개 산업분야로 나눠 진행된 경진대회에서는 분야별로 5팀씩 15개 팀과 전국대회 본선 선발팀 3개팀, 총 18개팀을 선정해 총 1억4200만원의 포상금을 전달하고 창업지원에 나섰다. 다기능 탄소섬유 휠체어, 우리 농산물을 활용한 캡슐 빙수, 필터교체형 한지마스크 등의 아이디어 상품들이 분야별 대상으로 선정됐다. 중소기업의 해외마케팅을 지원한다. 효성은 전북 탄소관련 중소기업의 해외 판로 개척을 위해 독일 슈투트가르트에서 열린 '컴포지트 유럽(Composites Europe) 2015'에 열가소성 탄소섬유 합성물 제조업체인 '액시아 머티리얼스', 탄소섬유와 아라미드 섬유를 활용한 가방 및 케이스 제작업체인 '케이스' 등 탄소 강소기업과 동반 참가하며 해외시장 개척에 어려움이 있는 중소기업들을 적극 지원하고 나섰다."
이데일리,025560,/news/news_read.nhn?article_id=0003354229&office_id=018&mode=search&query=미래산업&page=1,2015-09-23 16:43,"한국거래소, 미래산업에 주가급등 관련 조회공시",[이데일리 김태현 기자] 한국거래소는 미래산업(025560)에게 현저한 시황변동에 대한 조회공시를 23일 요구했다. 공시시한은 오는 24일 오후 6시까지다.
헤럴드경제,025560,/news/news_read.nhn?article_id=0000859626&office_id=016&mode=search&query=미래산업&page=1,2015-09-23 16:30,"&lt;생생코스피&gt; 미래산업, 주가급등 관련 조회공시","한국거래소는 23일 미래산업에 현저한 시황변동(주가급등) 관련 조회공시를 요구했다. 답변시한은 24일 오후 6시까지다. [자덕잇템] 핸들에 착 달라붙는 장갑? 이건희 회장 재산, 빈곤층과 나누면 얼마씩 돌아갈까?"
아시아경제,025560,/news/news_read.nhn?article_id=0003590959&office_id=277&mode=search&query=미래산업&page=1,2015-09-23 16:29,"한국거래소, 미래산업 조회공시 요구",[아시아경제 김재연 기자] 한국거래소는 미래산업의 최근 주가 변동(현저한 시황변동)과 관련해 조회공시를 요구했다고 23일 밝혔다. 공시시한은 24일 오후 6시까지다.
아시아경제,025560,/news/news_read.nhn?article_id=0003590960&office_id=277&mode=search&query=미래산업&page=1,2015-09-23 16:29,"미래산업, 시황변동 관련 조회공시 요구받아",[아시아경제 박미주 기자]한국거래소 유가증권시장본부는 23일 미래산업에 현저한 시황변동에 대한 조회공시를 요구했다. 공시시한은 24일 오후 6시까지다.
서울경제,025560,/news/news_read.nhn?article_id=0003138957&office_id=011&mode=search&query=미래산업&page=1,2017-10-26 14:22,"미래산업, 14억8,300만원 규모 반도체 검사장비 공급 계약","[서울경제] 미래산업(025560) 은 26일 STMicroelectronics FinanceⅡNV와 14억8,300만원 규모의 반도체 검사장비 공급계약을 체결했다고 공시했다.  계약금은 지난해 연결 기준 매출의 6.36%에 해당한다. 계약기간은 내년 2월28일까지다."
뉴시스,025560,/news/news_read.nhn?article_id=0006733620&office_id=003&mode=search&query=미래산업&page=1,2015-09-03 11:31,제1회 미래산업엔진 포럼,【서울=뉴시스】황규연 산업통상자원부 산업기반실장이 3일 오전 서울 역삼동 르네상스호텔 유니버셜룸에서 열린 '제1회 미래산업엔진 포럼'에 참석해 인사말을 하고 있다. 2015.09.03. (사진=산업통상자원부 제공)
이데일리,025560,/news/news_read.nhn?article_id=0003354142&office_id=018&mode=search&query=미래산업&page=1,2015-09-23 15:34,[이데일리N] KT &quot;지능형 인프라&middot;미래산업에 13조 투자&quot; 外,"[이데일리N] 1. 주요 6개 업종 수익률, 금융위기 때보다 악화 2. 역외소득·재산 자진신고 의향서 접수 3. 하나금융, 청년희망펀드 가입 독려 ‘논란’ 4. 스포티지, 프랑크푸르트 모터쇼 ‘슈퍼카 4위’ 5. KT “지능형 인프라·미래산업에 13조 투자” 6. 홈플러스 노조, 오늘부터 파업 7. 6개 외항사, ‘안전우려 리스트’ 올라 8. ‘행복주택’ 첫 입주자 847명 선정 - 이주열 “올해 성장률 2.8% 크게 안 벗어나” - 동부하이텍, 부천공장 절반 매각 - LH 임대주택 계약·해지, 인터넷도 가능 - 추석 기차표 암거래 집중 단속"
전자신문,025560,/news/news_read.nhn?article_id=0002657532&office_id=030&mode=search&query=미래산업&page=1,2017-11-14 13:35,"SBA, '미래산업의 두 축 스타트업-데이터팩토리, 친밀감을 쌓아보자'","사진=서울산업진흥원 제공 [전자신문인터넷 박동선기자] 서울시 중소기업지원기관 서울산업진흥원(대표이사 주형철, 이하 SBA)가 미래 산업경쟁력의 핵심으로 꼽히는 스타트업과 4차 산업혁명 주요기술인 '데이터팩토리'와의 만남을 촉진하는 세미나를 갖는다. SBA측은 오는 16일 서울 상암동 DMC첨단산업센터에서 '데이터팩토리가 변화시킬 기업의 미래'라는 주제로 스타트업을 위한 기술 세미나를 진행한다고 밝혔다. 이번 세미나는 스타트업 기술 부문의 비즈니스 경쟁력을 강화하고 현업에 적용하기 위한 방법론을 공유하기 위해 마련된 자리로, 지난 10월 '클라우드 서비스의 중요성 및 활용법' 세미나에 이어 펼쳐지는 것이다. 특히 이번 세미나에서는 데이터 기반 비즈니스 전문가이자 디지털 서비스 상품 개발에 특화된 엔지니어인 이의정 코드스쿼드 마스터가 연사로 나서며, 빅데이터와 클라우드 서비스를 활용해 기술부문 비즈니스 경쟁력을 강화한 기업들의 사례분석과 개별기업에 맞는 방법론 공유, 관계자 네트워킹 등의 일정으로 진행될 예정이다. 세미나 참가자격은 스타트업 관계자라면 누구나 가능하며, 별도의 신청절차 없이 40명 선착순제로 진행된다. 보다 자세한 내용은 SBA 기업육성팀에 문의하면 된다. SBA 관계자는 ""스타트업을 비롯한 많은 기업들에게 데이터의 활용은 간과할 수 없는 이슈로 떠오르고 있다""며 ""전문가의 강연과 네트워킹 시간을 통해 기술 관련 애로사항을 해소하고 새로운 지식을 공유하는 기회가 되길 바란다""라고 말했다. 한편 SBA는 다양한 형태의 세미나와 기술가치평가, 전문가 기술심화 컨설팅 등을 통해 자체적인 SBA창업인큐베이팅 기업은 물론 스타트업들의 차세대 보유기술 확보 및 경쟁력 강화를 지원하고 있다."
매일경제,025560,/news/news_read.nhn?article_id=0003580128&office_id=009&mode=search&query=미래산업&page=1,2015-09-24 17:38,[코스닥 공시] 미래산업 / S&amp;T모티브 / 태양기전 등,"◇미래산업〓'최근 현저한 시황 변동에 영향을 미칠 만한 사항 없다' 조회공시. ◇S&T모티브〓일본 칼소닉칸세이로부터 자동차부품 공급업체로 선정. ◇태양기전〓268억원 규모 주주 배정 후 실권주 일반공모 방식 유상증자 결정. ◇바른손〓최대주주 바른손이앤에이 대상으로 9억원 규모 제3자배정 유상증자. r_start // r_end // [ⓒ 매일경제 & mk.co.kr, 무단전재 및 재배포 금지] 매일경제 관련뉴스해당 언론사에서 선정하며 언론사 페이지(아웃링크)로 이동해 볼 수 있습니다.야노시호, 속옷 화보…""이번에도 다 벗었나?"" '19금 수위로 완벽 그 자체'무너지는 '클린디젤' 신화…유럽車 불신 커진다'라디오스타' 박나래, ""음주 후 사과해야 한다"" 이유는?'열공' 엄마 제자 위해 아이 안고 수업 한 교수님황승언, 시스루 비키니 입고 몸매 뽐내다…""지금 다 보이는 거야? 대박!"""
아시아경제,025560,/news/news_read.nhn?article_id=0003591932&office_id=277&mode=search&query=미래산업&page=1,2015-09-24 17:14,미래산업 &quot;시황변동에 영향 미칠 중요 공시대상 없어&quot;,"[아시아경제 성기호 기자]미래산업은 전날 한국거래소의 조회공시 요구에 대한 답변으로 ""최근 현저한 시황 변동에 영향을 미칠 만한 중요한 사항이 없다""고 24일 공시했다."
머니투데이,025560,/news/news_read.nhn?article_id=0003549845&office_id=008&mode=search&query=미래산업&page=1,2015-09-24 17:12,미래산업 &quot;주가 영향 미칠 중요 사항 없다&quot;,"[머니투데이 백지수 기자] 미래산업은 전날 한국거래소의 조회공시 요구에 대한 답변으로 ""최근 현저한 시황 변동에 영향을 미칠 만한 중요한 사항이 없다""고 24일 공시했다. textlinktopstart textlinktopend textlinkstart"
헤럴드경제,025560,/news/news_read.nhn?article_id=0000860869&office_id=016&mode=search&query=미래산업&page=1,2015-09-24 16:59,"&lt;생생코스피&gt; 미래산업, &ldquo;현저한 시황변동 사유없다&rdquo;",미래산업은 24일 현저한 시황변동 관련 조회공시 답변에서 “최근 현저한 시황변동에 영향을 미칠만한 사항으로서 현재 진행중이거나 확정된 공시대상이 없다”고 밝혔다. [자덕잇템] 핸들에 착 달라붙는 장갑? '전지현 빌라'는 부르는게 값? 28억에 산 신혼집이 지금…
이데일리,025560,/news/news_read.nhn?article_id=0003355202&office_id=018&mode=search&query=미래산업&page=1,2015-09-24 16:59,미래산업 &quot;현재 진행&middot;확정된 중요공시 없다&quot;,[이데일리 장종원 기자] 미래산업(025560)은 현저한 시황변동과 관련해 “현재 진행중이거나 확정된 공시규정상의 중요 공시대상이 없다”고 24일 공시했다.
머니투데이,025560,/news/news_read.nhn?article_id=0003965897&office_id=008&mode=search&query=미래산업&page=1,2017-11-17 15:22,산업부 산업플랫폼 콘퍼런스 개최 &quot;미래 신산업 창출하자&quot;,"[머니투데이 세종=최우영 기자] [데이터기반 플랫폼 관련 글로벌 성공사례 공유] 산업통상자원부는 17일 서울 삼성동 코엑스에서 국제 비즈니스 플랫폼 성공사례를 공유하고 신산업 육성을 위한 정부의 역할을 모색하는 '2017 산업 플랫폼 콘퍼런스'를 연다고 밝혔다. 콘퍼런스는 4차 산업혁명으로 데이터가 경쟁력의 중요 원천으로 떠오르고 이를 활용한 플랫폼 비즈니스가 새로운 산업의 흐름이 되고 있는 상황에서, 플랫폼 비즈니스에 대한 인식을 높이기 위해 열렸다. 머크USA의 윌리엄 길 IT부문 대표, 우버의 에밀리 포트빈 아시아 전략제휴 총괄이사, 슈나이더 일렉트릭의 디에고 아르세스 동북아 총괄 대표, 바이두의 카일리 우 제너럴 매니저 등이 참석했다. 이들은 헬스케어, 모빌리티, 에너지, 제조혁신 등 4개의 세션으로 나뉘어 열린 콘퍼런스에서 각 기업의 플랫폼 사업 사례를 소개하고, 산업 플랫폼의 향후 전망 등에 대해 논의했다. 행사에는 산업계와 학계, 연구소 등에서 세션별로 400여명 이상이 참석해 플랫폼 사업에 대한 높은 관심을 보였다. 박건수 산업부 산업정책실장은 축사를 통해 ""산업플랫폼은 신산업 창출의 토대가 된다는 점에서 중요하며 정부도 산업플랫폼 구축을 활성화하기 위한 정책을 마련해 나가겠다""고 말했다. 박건수 실장은 ""산업분야에서의 플랫폼은 일자리와 미래 신산업 창출의 토대가 되고 중소중견 기업의 자생적 성장기반이 된다""며 ""우리는 강력한 제조업과 정보통신기술(ICT), 에너지산업 기반을 보유하고 있다는 점에서 플랫폼 구축에 유리한 상황""이라고 설명했다. 박 실장은 ""다만 국내 산업플랫폼 구축을 위한 민간투자가 아직은 미진한 상황""이라며 ""정부는 산업계 수요가 있는 대표적인 분야에서 플랫폼 성공사례가 나올 수 있도록 연구개발, 사업 모델 개발 등을 지원하겠다""고 덧붙였다. 산업부 관계자는 ""이번 산업플랫폼 콘퍼런스가 국제 비즈니스 플랫폼 성공사례를 공유함으로써 우리 기업이 4차 산업혁명 대응전략을 수립하는 데 큰 도움이 됐다""며 ""이를 바탕으로 정부는 국민 일자리 창출과 미래 신산업 육성을 위한 산업플랫폼 확산을 위해 노력하겠다""고 말했다."
서울경제,025560,/news/news_read.nhn?article_id=0002743290&office_id=011&mode=search&query=미래산업&page=1,2015-09-24 09:53,"[업종동향_코스피] 코스피, 의료정밀업종 급등세,미래산업 14.59%","코스피지수가 본격적인 상승흐름으로 출발하면서 의료정밀업종의 급등세가 두드러지고 있다. 24일 오전 9시40분 현재 업종별 동향을 살펴보면 의료정밀업종이 강한 모습을 보이고 있는데, 미래산업[025560]이 14.59% 상승한 것을 비롯해 케이씨텍[029460]은 업종내 주요종목들은 전일대비 1.4%대의 상승폭을 나타내고 있다. 현재 코스피시장에서 의료정밀업종외에도 섬유의복업종(2.01%)이 상승폭을 키우고 있는 것으로 나타났고 반대로 종이목재업종(-0.48%)과 기계업종(-0.31%)등은 하락폭이 큰 것으로 집계되었다. 같은 시각 코스피지수는 하루 만에 반등세로 돌아서 전일대비 전일대비 8.7포인트(0.45%) 오른 1953.34를 기록 중이다. 전반적으로 코스피 지수관련 주요업종들은 상승우위를 보이고 있다. 전기전자업종은 (-0.03)% 하락중이고 운수장비업종이 (1.59)%, 철강금속업종이 (0.24)% 오른 반면에 통신업(-0.09%)업종은 하락했다. [ⓒ 한국미디어네트워크, 무단 전재 및 재배포 금지] 서울경제 관련뉴스해당 언론사에서 선정하며 언론사 페이지(아웃링크)로 이동해 볼 수 있습니다.발모촉진 특허음료 장영실 대상… 이유는?복면 취준생 대기업 면접관에 통쾌한 일침'北 핵심시설 파괴' 한국 특수부대 만든다'반도체 강자' 삼성, 중국서 노다지 캤다3040 유부녀들 끌어들이더니… 엄청나네"
한국경제,025560,/news/news_read.nhn?article_id=0003440548&office_id=015&mode=search&query=미래산업&page=1,2015-09-30 07:02,[도약하는 경기도] 200여 벤처 몰린 안산사이언스밸리&hellip;전통&middot;미래산업 품은 '용광...,"'미니 경기도' 안산'안산산업경제혁신센터' 출범지역경제 재도약 싱크탱크役청년창업인큐베이팅 사업 통해일자리 창출·창조경제 도시로 농어촌·공업단지·도심이 공존전국 최고 다양성의 도시 시화호 등 생태·주거환경 개선 [ 김인완 기자  ] 시화호 전경. 안산에는 경기도에 있는 모든 것이 다 있다. 그래서 안산을 일명 ‘미니 경기도’라고 일컫는다. 산과 강 및 도시가 있으며 어촌·농촌·공업단지 및 도심이 어우러져 있다. 문화적으로는 전국 최고의 다문화도시다. 계획과 자연스러움이 공존하고 전통과 첨단이 함께 이 도시를 꾸미고 있다. 산업에서도 전통제조업과 첨단업종이 공존하고, 현재의 주력산업과 미래 신성장 산업이 맞물리며 안산산업경제를 이끈다. 안산사이언스밸리는 안산지역 산업의 과거-현재-미래를 연결하는 터미널이라고 할수 있다. 대학·연구소·기업 융합 안산사이언스밸리 오래된 안산의 제조업 전통은 그 배후 지원을 목적으로 형성된 대학과 연구기관·기업의 결합인 안산사이언스밸리(ASV)를 탄생시키고 발전시켰다. 1980년대 산업단지에서 필요한 인재를 키우기 위해 설립된 한양대 에리카캠퍼스(당시 명칭 : 한양대 반월분교)에서 출발했다. 이 대학의 성장 및 약진(재학생 1만3000여명의 종합대학, 3년 연속 산학협력 최우수 대학 선정 등)과 더불어 안산시·경기도에서 출연한 기업지원시설(기관)인 경기테크노파크가 1998년에 설립돼 이 대학 캠퍼스 내에 입주하면서 본격적으로 학·연·산 클러스터가 시작됐다. 그 외 국책연구기관인 한국산업기술시험원·농어촌연구원·한국해양과학기술원·한국전기연구원·한국생산기술연구원과 기업연구소로 LG이노텍이 클러스터에 참여했다. 이곳 밸리에 입주한 200여 벤처기업과 2000여명의 연구원들이 로봇·전자정보통신·메커트로닉스·의료기기·자동차부품·의약·정밀화학·바이오·신재생에너지 등의 분야에서 연구성과와 사업성과를 내고 있다. 2011년 안산시는 ‘안산시 기업지원 및 안산사이언스밸리 육성에 관한 조례’를 제정해 창업·기술개발·마케팅 지원, 인력양성, 자금지원 및 지역혁신 협력체계 구축 지원을 제도화했다. 기초지자체로는 이례적으로 오래전부터 시 직영의 국 단위 산업정책전문부서(현재 안산시 산업지원본부)를 두고 효율적인 산업정책수립·기업지원·산업단지환경관리·일자리창출 등의 업무를 수행하고 있다. 지난 7월에는 경기테크노파크 조직으로 ‘안산산업경제혁신센터’를 개소해 산업경제전문의 박사급 연구인력을 두고 지역 산업경제현황 연구, 정책사업 발굴, 특화산업 육성 및 기업지원시책 발굴·운영 등을 수행케 하고 있다. 그간 안산시 산업·경제의 침체를 극복하고 경쟁력 강화를 위한 산업경제전문연구소의 필요에 따라 탄생한 ‘안산산업경제혁신센터’는 지역특성에 맞는 산업정책 수립·시행을 통해 지역경제 재도약을 선도하고 있다. 균형잡힌 종합산업도시로 발전 안산시는 올해 청년일자리 창출 및 창조도시로 도약하기 위해 경기테크노파크 주관 청년창업인큐베이팅사업을 안산시 소재 대학인 한양대(에리카캠퍼스) 및 서울예술대와 협업해 추진할 계획이다. 예를 들면 허름한 건물을 시가 구입, 창업희망 청년들에게 제공해 그들이 자유롭게 융복합실험 등을 수행할 수 있는 등 혁신적인 창업인큐베이팅 지원을 할 예정이다. 그 외에도 다양한 사업을 지역 대학인 안산대·신안산대·한국호텔관광실용전문학교와 손잡고 추진하고 있다. 상호협력의 폭 확대와 지역 소재 대학의 발전이 지역산업을 점진적으로 지식기반 산업화하는 데 기여하고 있다. 안산시 산업에서 교육지원서비스업 등 지식기반산업의 비중이 지속적으로 증가 추세에 있다. 제조업 비중이 뚜렷이 하락하고 사업서비스업 비중이 눈에 띄게 증가하는 데서 이 지역 산업경제의 균형성장 흐름을 읽을 수 있다. 되살아나는 생태환경 최근 10여년간 안산시 생태환경과 주거환경은 각종 지표에서 개선되는 모습을 보이고 있다. 안산시는 현재 주요 악취배출업종에 대해 집중관리를 하고 있다. 최신 측정장비를 활용한 U-Clean 통합시스템 운영 및 민간중심의 민간환경감시단과 지역주민·산업단지 근로자들로 구성된 악취모니터단을 운영하고 있다. 자연환경·도심환경 개선의 증거는 시화호 주변의 생물다양성 증대와 시민들의 주거 선택 경향에서 쉽게 찾을 수 있다. 시화호에 숭어, 놀래미 등의 물고기와 큰고니, 노랑부리저어새, 청둥오리 등이 헤엄치거나 날고 있는 것을 일상적으로 볼 수 있다. 시화호를 끼고 있는 안산갈대습지공원에는 주말이면 안산시민 및 수많은 인근 도시민이 찾아와 고라니가 출몰하는 갈대길을 거닐면서 생태체험을 한다."
