source,symbol,link,date,title,content
헤럴드경제,025560,/news/news_read.nhn?article_id=0001078876&office_id=016&mode=search&query=미래산업&page=1,2016-07-05 17:11,"구미시,미래 탄소산업 집중 육성한다.","구미시가  미래  신성상동력 산업인 탄소산업을 집중 육성하기 위해 남유진 시장이 구미1공단을 직접 방문했다.(구미시 제공) [ 헤럴드 대구경북 = 김성권 기자 ] 경북 구미시가 미래 신성장동력 산업인 탄소산업을 집중육성하고 있다 . 남유진 구미시장은  4 일  1 공단에 소재하고 있는 블루큐브케미컬코리아를 방문 ,  김위형 공장장으로부터 회사현황에 대한 설명을 듣고 ,  향후 회사의 장기적인 투자 및 협력방안에 대해 논의한후 각종 시설물을 둘러봤다 . 블루큐브케미컬코리아는 미국 회사인  Olin 사의 자회사로써 탄소섬유 제조 및 가공에 꼭 필요한 에폭시를 생산하는 세계 최대업체다 . 현재 구미사업장에는 약 34 명의 근로자가 근무하고 있으며 ,  지난해  450 억원의 매출을 달성했다 .  생산제품의  80% 를 수출하고  20% 를 내수용으로 조선용 페인트업체 등에 납품하고 있다 . 남유진 구미시장은  “ 구미국가산업단지는 향후 탄소산업의 아시아 허브로 구축하기 위한 초석이 완비되어 있다 “ 면서 블루큐브케미컬코리아가 앞으로 탄소산업 발전에 큰 역할을 해주기를 당부했다 . 구미시는 미래 신성장동력 산업으로 탄소산업을 집중육성하고 있으며 ,  구미 국가  5 산업단지 내  5000 억원 규모의 융복합 탄소성형 클러스터 조성사업을 추진중에 있다"
강원일보,025560,/news/news_read.nhn?article_id=0000657485&office_id=087&mode=search&query=미래산업&page=1,2017-04-11 00:31,미래 주력산업들 타 시&middot;도에 뺏긴다,"도, 국가적 어젠다 급부상 `4차 산업혁명' 대응 미흡빅데이터·농업·관광분야 등 지자체마다 발빠른 대처  도내는 전담조직조차 없어… 도 “대선공약 반영 노력” 도가 국가적 어젠다로 확대되고 있는 `4차 산업혁명' 대응에 늑장을 부리고 있다. 대선 유력주자들마다 제조업과 정보통신기술(ICT)을 융합해 산업경쟁력을 키우는 4차 산업혁명 공약을 내놓아 차기정부 핵심 과제로 확실시되고 있으나 전담 대응 조직 하나 꾸리지 못하고 있다. 도는 10일 청내에서 실국장단이 참석한 가운데 4차 산업혁명 대응을 위한 대책회의를 개최했으나, 향후 업무 추진 전담기관 지정 없이 마쳤다. 도는 차기 정부의 부처 개편이 끝난 후에 이를 확정 지을 계획이다. 앞서 행정자치부는 4차 산업혁명 대응 영상회의를 개최하고, 시·도별 5개년 종합계획 수립과 제출을 요청했다. 타 지자체들은 4차 산업혁명 추진 체계를 속속 발표하고 있다. 부산, 전북은 전담 조직 신설, 태스크포스 구성을 마쳤고, 대전, 전주, 제주는 사업 아이템 발굴에 착수했다. 경기는 도의회가 4차 산업혁명 기술 및 산업진흥 조례안을 입법예고했다. 도가 선점한 주력 사업 분야에도 타 지역의 사업 발표가 잇따르고 있다. 강원창조경제혁신센터가 2015년 출범하며 한발 앞서 출발한 빅데이터 산업 분야와 관련, 경북이 지난주 빅데이터센터를 개소했다. 또 충북이 관광, 세종이 농업 분야에서 4차 산업혁명 계획을 수립하고 나서 도 주력 산업의 대응도 늦어질 상황이다. 김석중 강원연구원 선임연구위원은 “4차 산업혁명 대응을 위해 도 차원의 ICT융합산업 지원기관이 필요한데, 신설법인 설립이나 기존의 도 단위 조직의 기능을 확대하는 방안도 검토 가능하며 무엇보다 민·관 거버넌스 구축이 시급하다”고 말했다. 한편 도 관계자는 “대선공약 등에 도의 4차 산업 관련 정책이 반영되도록 하겠다”고 말했다. 신하림기자"
한국경제,025560,/news/news_read.nhn?article_id=0003633854&office_id=015&mode=search&query=미래산업&page=1,2016-08-02 01:28,[유가증권 메모] (2일) 일반공모청약=미래산업 한솔제지 등,◇일반공모청약=미래산업 한솔제지 ◇보통주추가상장= 비스타(전환) 필룩스(제3자배정) [
파이낸셜뉴스,025560,/news/news_read.nhn?article_id=0003673117&office_id=014&mode=search&query=미래산업&page=1,2016-07-05 16:57,"김승연 한화그룹 회장 &quot;태양광, 한국 미래산업으로 육성&quot;","한화큐셀 태양광 셀공장 찾아 












김승연 한화그룹 회장(앞줄 왼쪽 첫번째)은 5일 충북 진천에 위치한 한화큐셀 태양광 셀 공장을 방문해 생산시설을 직접 살펴보고 임직원들을 격려하는 시간을 가졌다. 김 회장과 금춘수 경영기획실 사장(앞줄 왼쪽 세번째)이 류성주 한화큐셀 진천공장장(앞줄 왼쪽 두번째)으로부터 공장 시설에 대해 설명을 듣고 있다.


 


 ""태양광은 미래를 위해 육성해야할 사업. 남다른 사명감으로 임해야 한다.""김승연 한화그룹 회장이 그룹의 주요 성장축 중 하나인 태양광 사업을 우리나라를 대표하는 미래 산업으로 육성해야 한다고 강조했다.김 회장은 5일 충북 진천 산수산업단지 내 최근 준공된 한화큐셀 태양광 셀공장을 방문, 생산시설을 직접 둘러봤다. 이 자리에서 김 회장은 ""지난 5년간 남다른 사명감으로 태양광 사업에 매진해 왔다""며 ""인류의 미래를 위해 장기적인 시각으로 고민하고 육성해야 할 사업이라 여겼다""고 강조했다. 그는 또 ""장차 대한민국을 대표할 또 하나의 미래산업으로 키워보자는 큰 비전을 실천해 왔다""고 설명했다.한화큐셀의 진천공장은 약 18만㎥의 부지에 1.4GW의 셀을 생산할 수 있는 설비를 갖추고 있다. 한화큐셀은 한국, 말레이시아, 중국에 걸쳐 총 5.2GW의 셀 생산규모를 갖췄다. 셀 생산규모 면에서 세계 1위다.김 회장은 ""생산공장 후보지를 제조원가가 낮은 말레이시아에서 국내로 변경했다""며 ""국내에서의 고용증대와 태양광 산업의 전략적 육성이라는 사명감 때문이다""고 말했다.한화큐셀은 이미 충북 음성군 금왕읍, 약 2만2000㎥ 부지에 1.5GW 규모의 모듈생산시설을 가동 중에 있다. 한화그룹은 진천 셀 공장과 음성 모듈공장에 약 6000억원을 투자했으며 약 1300명의 신규 고용을 창출했다. 생산된 제품 대부분은 수출되고 1조 6000억원 이상의 직접적 경제가치도 창출될 것으로 평가된다.안승현 기자"
파이낸셜뉴스,025560,/news/news_read.nhn?article_id=0003672895&office_id=014&mode=search&query=미래산업&page=1,2016-07-05 12:37,"김승연 회장, &quot;태양광, 한국 대표 미래산업으로 키운다&quot;","김승연 한화그룹 회장이 5일 충북 청주종합사격장에서 '2016년 한화회장배 사격대회' 개회사를 하고 있다.


 ""태양광은 미래를 위해 육성해야할 사업. 남다른 사명감으로 임해야 한다"" 김승연 한화그룹 회장이 그룹의 주요 성장축 중 하나인 태양광 사업을 우리나라를 대표하는 미래 산업으로 육성해야 한다고 강조했다. 김 회장은 5일 충북 진천 산수산업단지 내 최근 준공된 한화큐셀 태양광 셀공장을 방문, 생산시설을 직접 둘러봤다. 이 자리에서 김 회장은 ""지난 5년간 남다른 사명감으로 태양광 사업에 매진해 왔다""며 ""인류의 미래를 위해 장기적인 시각으로 고민하고 육성해야 할 사업이라 여겼다""고 강조했다. 또 ""장차 대한민국을 대표할 또 하나의 미래산업으로 키워보자는 큰 비전을 실천해 왔다""고 설명했다. 한화큐셀의 진천공장은 약 18만 평방미터의 부지에 1.4GW의 셀을 생산할 수 있는 설비를 갖추고 있다. 한화큐셀은 한국, 말레이시아, 중국에 걸쳐 총 5.2GW의 셀 생산규모를 갖췄다. 셀 생산규모 면에서 세계 1위다. 김 회장은 ""생산공장 후보지를 제조원가가 낮은 말레이시아에서 국내로 변경했다""며 ""국내에서의 고용증대와 태양광 산업의 전략적 육성이라는 사명감 때문이다""고 말했다. 한화큐셀은 이미 충북 음성군 금왕읍, 약 2만2000평방미터 부지에 1.5GW 규모의 모듈생산시설을 가동 중에 있다. 한화그룹은 진천 셀 공장과 음성 모듈공장에 약 6000억원을 투자했으며 약 1300명의 신규 고용을 창출했다. 생산된 제품 대부분은 수출되고 1조 6000억원 이상의 직접적 경제가치도 창출될 것으로 평가된다. 한편 이날 한화그룹은 충북 청주종합사격장에서 '2016년 한화회장배 사격대회'를 개최했다. 이 대회는 리우올림픽에 참가할 사격선수단의 최종 실전점검 차원에서 마련됐다. 올해로 9회째 진행된 '한화회장배 사격대회'는 국내 대표적인 5대 메이저 사격대회 중 하나다. 이날 대회 개막식에는 김승연 한화그룹 회장을 비롯, 이시종 충북도지사, 이승훈 청주시장 및 황용득 대한사격연맹회장(한화갤러리아 대표이사), 조정희 대한사격연맹부회장과 관계자들이 참석했다. 김 회장과 관계자들은 충북 청주종합사격장 경기장 시설을 둘러봤으며 사격국가대표인 진종오(권총), 이대명(권총), 김장미(권총), 김종현(소총) 선수들을 격려했다."
동아일보,025560,/news/news_read.nhn?article_id=0003132278&office_id=020&mode=search&query=미래산업&page=1,2018-03-07 03:04,&lsquo;미래산업 선도 도시&rsquo;로 성장하는 대구,"[동아일보] 미래형車-의료 등 신산업 개발 활발權시장 취임후 164개사 기업 유치 지난해 11월 대구 북구 엑스코에서 열린 ‘글로벌 로봇 비즈니스 포럼’에서 참석자들이 현대로보틱스 전시관을 둘러보고 있다. 국내 산업용 로봇 생산 1위인 현대로보틱스는 지난해 3월 대구로 본사를 옮겼다. 대구시 제공 대구시가 미래 산업을 선도하는 도시로 성장하고 있다. 투자 환경이 좋아지면서 기업 유치도 잇따르고 있다. 6일 시에 따르면 대구는 섬유를 제외하면 뚜렷한 성장산업이 없었지만 최근 미래형 자동차를 비롯해 물, 의료, 에너지, 로봇, 사물인터넷 등 신(新)산업 개발이 활발하다. 특히 올해 대구는 전기차 생산도시로 도약할 것으로 보인다. 달성군 국가산업단지에 입주한 ㈜제인모터스는 지난해 11월 1t 전기화물차 생산 공장을 준공했다. 전기상용차 생산은 국내에서 처음이다. 이달 시범 운행을 시작하고 연말까지 최소 500대를 판매할 계획이다. 대동공업과 르노삼성 컨소시엄이 개발하고 있는 전기화물차는 올해 12대를 시범 제작하고 내년에 상용화한다는 목표를 세웠다. 대구의 전기차 보급은 17개 광역단체 가운데 가장 빠르다. 2016년 314대에서 지난해 7배로 늘어난 2127대를 보급했다. 올해는 2810대를 보급할 계획이다. 2020년 5만 대, 2030년까지 50만 대로 늘어날 것으로 전망된다. 전기차용 충전시설은 현재 165곳이다. 다음 달까지 384곳으로 확충한다. 수성구 대흥동 일원에 들어서는 의료지구 수성알파시티는 세계적 수준의 스마트시티로 조성 중이다. 대구시는 올해부터 2022년까지 수성알파시티 97만9000m²에 사업비 560억 원을 들여 4차산업 육성을 위한 스마트시티 테스트베드(시험환경)를 조성한다. 시는 올해 10월까지 국제표준 사물인터넷(IoT)을 적용한 서비스를 선보일 계획이다. 스마트 가로등과 지능형 도보 안전 시스템, 차량번호인식 폐쇄회로(CC)TV 등 13개 서비스를 구축하고 있다. 대구시가 권영진 시장 취임 이후 유치한 기업은 164개사, 투자액은 2조1006억 원이다. 의료기기를 비롯해 전기전자, 기계금속, 자동차부품, 서비스 등 분야도 다양하다. 그만큼 투자 여건이 많이 좋아지고 있다는 게 대구시의 설명이다. 산업용 로봇 생산 세계 7위(국내 1위)인 현대로보틱스와 국내 최대 석유화학기업 롯데케미칼, 글로벌 자동차부품 기업인 독일의 보쉬 그룹과 대구 경창산업의 합작사인 ㈜KB와이퍼시스템이 대표적인 유치 기업으로 꼽힌다. 현대로보틱스는 1981년 대구직할시 승격 이후 처음으로 유치한 대기업이다. 시가총액이 7조1000억 원으로 국내 30대 대기업에 포함된다. 대구의 시가총액 1위 기업인 DGB금융지주(1조9000억 원)의 4배 규모다."
동아일보,025560,/news/news_read.nhn?article_id=0003065399&office_id=020&mode=search&query=미래산업&page=1,2017-05-17 17:02,[HOT100] 미래 자동차산업 리드하는 &lsquo;영산대 스마트자동차학과&rsquo;,"[동아일보] 영산대학교 스마트자동차학과는 소프트웨어를 기반으로 기계, 전기전자 공학을 집중적으로 배울 수 있는 융복합프로그램을 운영 중이다. 스마트자동차학과 학생들이 자율주행 자동차 알고리즘을 통해 만든 모형 자동차를 보며 실습하고 있다. 영산대 제공 “미래 자동차산업을 리드하는 기계,자동차 전문가.” 영산대학교 스마트자동차학과 학생들의 당찬 포부다. 스마트자동차학과 학생들은 전기자동차, 스마트자동차와 같은 미래형 자동차 개발에 필요한 융복합 과목들을 배운다. 전통적인 자동차공학에서 한 걸음 더 나아간 셈이다. 학생들은 기존의 기계. 전기. 전자자동차 관련 학과와는 차별화 된 실무 중심의 교육을 받는다. 지역 산업체와의 협력을 통한 주문식 교육, 현장맞춤식 교육, 산학연 연계 교육 등이 그것이다. 또한 프로젝트 단위 실무 중심의 교과교육도 큰 특징이다. 학생들은 자동차 실습실, 자동차 컴퓨터설계실, 자동차 전자제어실습실 등을 통해 실질적인 업무능력을 익힐 기회를 갖는다. 이를 통해 학생들은 미래 자동차 관련 산업체에서 요구하는 기계, 자동차 엔지니어로 성장한다. 이를 위해 스마트자동차학과에선 소프트웨어를 기반으로 한 기계, 전기전자, IT 정보통신 공학의 핵심을 망라한 커리큘럼을 마련해 놓고 있다. 자동차 관련 비교과 프로그램도 빼놓을 수 없다. 3차원 모델링 프로그램(CATIA) 자격증 취득 지원뿐 아니라 스마트자동차 동아리, 자작자동차 제작 동아리 등 지원도 제공하고 있다. 2016년 첫 졸업생을 배출한 만큼 스마트자동차학과의 역사는 길지 않지만 영산대학교의 실무 중심 교육 프로그램의 효과는 학생들이 거둔 각종 수상 실적들에서 증명된다. 2013년엔 모형 F1 자동차 제작/경주대회 종합우승을 시작으로 2014년 동남권 캡스톤 디자인 대회 은상, 2015년 동남권 캡스톤 디자인 대회 금상을 차지했고 2016년에는 기술창업혁신단 주관 창업탐색지원팀에 선정되는 성과를 거뒀다. 장학금 혜택도 다양하다. 신입생, 편입학, 우수재학생 장학금을 비롯 글로벌리더 장학금, 외국대학 교환학생 장학금, 해외파견 연수 장학금, 복지장학금 등 을 마련해 학생들의 학업의욕을 고취시키고 있다. 영산대학교 스마트자동차학과는 소프트웨어를 기반으로 기계, 전기전자 공학을 집중적으로 배울 수 있는 융복합프로그램을 운영 중이다. 스마트자동차학과 학생들이 자율주행 자동차 알고리즘을 실습을하고 있다. 영산대 제공 영산대학교는 자동차분야 산학협력에 유리한 지리적 요충에 위치하고 있다. 자동차 산업의 메카인 울산을 중심으로 부산, 경남에 이르는 동남권 자동차 산업단지 등과의 긴밀한 산학협동 기회가 타 대학들에 비해 월등히 많다. 이런 지리적 장점을 활용, 학과 졸업생들의 100% 자동차 관련 정규직 취업을 목표로 한다. 최근 자동차업체들은 주력제품의 모듈화 및 메커니즘 고도화 실현을 위해 기존 기계, 전기전자 분야와 소프트웨어를 함께 이용하는 융복합화 인력을 요구하고 있다. 또한 향후에는 친환경 자동차 부품 개발을 위한 R&D 인력 수요도 크게 늘 것으로 전망된다. 이에 부합하는 교육 프로그램을 갖춘 영산대학교 스마트자동차학과 졸업생들의 취업전망은 매우 밝다. 현대기아차, 삼성르노, GM대우자동차 등 완성차 업체들의 연구개발 부서와 현대케피코, 현대모비스, 만도, 한국타이어 등 자동차부품 전문 업체 연구개발 부서로의 진출이 증가할 것으로 기대되며 자동차안전연구소, 자동차부품연구원, 한국기계연구원, 테크노파크 등 자동차 관련 연구소 및 지방자치단체로의 진출도 전망된다. 영산대학교의 인재상은 ‘Y’s 인재‘이다. ’지혜로운(wise) 인재‘라는 뜻과 함께 영산대학교의 영문 이니셜(YS)을 상징하기도 한다. 스마트자동차학과는 이와 같은 학교의 인재상을 바탕으로 미래 자동차 분야를 주도할 융복합 인재로 키울 신입생 선발에 특별한 노력을 기울이고 있다. 입학하기 위한 경쟁률도 높다. 2017학년도 일반고교 출신 수시전형에선 34명 모집에 193명이 지원해 5.68대1이란 높은 경쟁률을 기록했다. 특성화고교 출신자 대상 수시전형에서도 2.25대1의 경쟁률을 보여 고교졸업생들의 뜨거운 관심을 갖는 학과로 자리매김했다. 최종 등록자의 내신(수능) 평균등급은 4~5등급으로 나타났다. 정시전형에서도 12명 모집에 22명이 지원해 2대1에 가까운 경쟁률을 기록했다. 현재 총 학생 수는 113명(여학생은 1명)이다."
국민일보,025560,/news/news_read.nhn?article_id=0000902209&office_id=005&mode=search&query=미래산업&page=1,2016-05-25 17:50,"LG그룹, 자동차 부품&middot;에너지 솔루션 미래산업으로","지난해 11월 일산 킨텍스에서 열린 에너지대전에서 LG CNS 관계자가 울릉도에 적용할 ‘LG 스마트 마이크로그리드 솔루션’을 소개하고 있다. LG그룹 제공 LG그룹이 자동차 부품과 에너지 솔루션 분야를 미래 산업으로 지목하고 성장 드라이브를 걸고 있다. LG그룹은 올해 기존 주력사업인 스마트폰과 디스플레이 등 IT 역량을 자동차 부품과 에너지 솔루션 분야에 집중해 미래 성장 동력을 발굴하고 있다. 지난해 말부터 LG전자는 GM의 차세대 전기차 개발 프로젝트의 전략적 파트너 관계를 맺고, LG화학은 세계 1위 ESS(에너지저장시스템) 기업인 AES와 ‘기가와트시(GWh)’ 규모의 배터리 공급 계약을 체결하기도 했다. 자동차 부품 분야에서는 LG전자가 스마트카 부품, 인포테인먼트 부품을 생산하고 있으며, LG화학은 글로벌 완성업체 20여곳을 전기차 배터리 고객사로 확보했다. LG디스플레이는 유럽, 미국 등 글로벌 자동차 업체에 정보 안내 디스플레이·계기판 등 자동차용 디스플레이 제품을 공급 중이며, LG이노텍은 차량용 모터와 센서·차량용 카메라모듈·LED 등 20여종의 제품을 보유하고 있다. 에너지 솔루션 분야에서도 LG전자는 세계 최고 수준의 초고효율 태양광 모듈을 생산하고 있다. LG그룹은 국내 기업 중 유일하게 친환경 에너지 생산부터 저장, 효율적 사용·관리까지 ‘토탈 에너지 솔루션’을 확보하고 있다. 이를 바탕으로 LG그룹은 제주도를 에너지 신산업 모델로 만드는 ‘글로벌 에코 플랫폼 제주’ 프로젝트를 위해 지난해 10월 제주도, 한국전력과 업무협약을 맺었다. 구본무 LG그룹 회장은 올해 초 신년사에서 “자동차 부품, 신에너지 분야처럼 성장의 가능성을 봤다면 자원을 집중해 과감히 치고 나가 남보다 먼저 시장을 선점해야 한다”며 자동차 부품과 에너지 솔루션의 발전을 통한 그룹의 성장을 강조했다."
데일리안,025560,/news/news_read.nhn?article_id=0002140249&office_id=119&mode=search&query=미래산업&page=1,2016-07-06 08:21,"김승연 한화 회장 &quot;태양광, 한국 대표 미래산업으로 육성&quot;","김승연 한화그룹 회장(앞줄 맨 왼쪽)이 5일 충북 진천 한화큐셀 태양광 셀 공장을 방문, 금춘수 경영기획실 사장(앞줄 왼쪽에서 세번째)과 류성주 한화큐셀 진천공장장(앞줄 왼쪽에서 두번째)으로부터 공장 시설에 대해 설명을 듣고 있다.ⓒ한화 김승연 한화그룹 회장이 태양광을 한국의 미래산업으로 육성하겠다는 의지를 재차 강조했다. 충북 진천 태양광 셀 공장을 방문한 자리에서다. 김승연 회장은 5일 충북 진천 산수산업단지 내 최근 준공된 한화큐셀 태양광 셀공장을 방문, 생산시설을 직접 살펴본 뒤 임직원들을 격려했다. 이 날 김 회장은 남성우 한화큐셀 대표로부터 진천 셀공장에서 양산된 제1호 태양전지로 만든 기념패를 받고 임직원들을 격려하는 문구가 인쇄된 미니모듈을 전달했다. 김 회장은 “한화그룹은 지난 5년간 남다른 사명감으로 태양광 사업에 매진해 왔다”며 “인류의 미래를 위해 장기적인 시각으로 고민하고 육성해야 할 사업이라 여겼고 장차 대한민국을 대표할 또 하나의 미래산업으로 키워보자는 큰 비전을 실천해 왔다”고 밝혔다. 이어 “당초 생산공장 후보지를 제조원가가 낮은 말레이시아에서 국내로 변경하게 된 이유도 국내에서의 고용증대와 태양광 산업의 전략적 육성이라는 사명감 때문”이라며 “이를 위해 지금까지 충청권에 6000억원을 투자했고 1300여명의 고용을 창출했다”고 강조했다. 현재 한화큐셀 진천 셀 공장은 약 18만 평방미터의 부지에 1.4GW의 셀을 생산할 수 있는 설비를 갖추고 있다. 이를 통해 한국-말레이시아-중국에 걸쳐 총 5.2GW의 셀 생산규모를 갖춰 셀 생산규모 면에서 글로벌 1위의 위상을 더욱 확고히 하고 있다. 이와 함께 한화큐셀은 이미 충북 음성군 금왕읍 약 2만2000평방미터 부지에 1.5GW 규모의 모듈생산시설을 가동 중에 있다. 한화그룹은 “진천 셀 공장과 음성 모듈공장에서 생산된 제품 대부분은 수출되고 1조6000억원 이상의 직접적 경제가치도 창출될 것”이라며 “충남창조경제혁신센터의 핵심 사업인 충청권 태양광 클러스터 구축을 위해 서산솔라벤처를 조성하는 등 다각도로 투자를 진행 중”이라고 밝혔다. 앞서 김승연 한화 회장은 이날 오전 충북 청주종합사격장에서 열린 ‘2016년 한화회장배 사격대회’ 개막식에 참석해 경기장 시설을 둘러본 뒤 국가대표 선수들을 격려했다. 김 회장은 “지난 2012년 런던올림픽에서 사상 최대의 성과를 내며 사격종목 종합우승의 위업을 차지한 이래 한국사격의 위상은 더욱 높아졌다”며 “리우올림픽에서도 자기 자신을 넘어서는 진정한 챔피언의 모습으로 또 한 번의 큰 감동을 전해주길 기대한다”고 말했다. 한편 한화그룹은 국내 사격 육성을 위해 지난 2002년 6월부터 대한사격연맹의 회장사를 맡아 지금까지 약 125억원의 사격발전 기금을 지원하는 등 국내사격 발전을 위해 전폭적으로 지원해 오고 있다. 데일리안 이홍석 기자 ⓒ (주)데일리안 - 무단전재, 변형, 무단배포 금지"
파이낸셜뉴스,025560,/news/news_read.nhn?article_id=0003802224&office_id=014&mode=search&query=미래산업&page=1,2017-04-12 17:20,미래산업 경쟁력 세계 25위 추락..수출 &lsquo;회생불능&rsquo; 위기감,"무협 ""포퓰리즘 공약 중단"" 中 산업경쟁력 2위로 위협반도체.통신 등 정체 위기.. 신성장산업은 규제에 막혀네거티브 규제 강력히 촉구"
이데일리,025560,/news/news_read.nhn?article_id=0003603189&office_id=018&mode=search&query=미래산업&page=1,2016-08-05 15:20,"미래산업, 유상증자로 9800만주 발행",[이데일리 신정은 기자] 미래산업(025560)은 주주배정 유상증자 방식으로 당초 발행예정이었던 9800만주를 모두 발행했다고 5일 공시했다. 발행금액은 268억5200만원이며 신주권 교부예정일은 오는 17일이다.
