source,symbol,link,date,title,content
서울신문,025560,/news/news_read.nhn?article_id=0002762818&office_id=081&mode=search&query=미래산업&page=1,2016-10-07 03:37,항공 레저스포츠 시장 미래 신산업으로 뜬다,"[서울신문] MobileAdNew center 소득 증대와 여가활동 다양화 등으로 레저스포츠 인구가 폭발적으로 늘고 있는 가운데 항공 레저 분야가 미래 신성장 동력으로 떠오르고 있다. 항공 레저스포츠는 취미, 오락, 체험, 교육, 경기 등을 목적으로 하는 비행 활동으로 항공기와 경량항공기(경량 헬리콥터, 자이로플레인 등), 초경량비행장치(행글라이더나 패러글라이더, 드론 등) 등이 활용된다. ●국내 시장 규모 연간 2200억원 6일 국토교통부에 따르면 올 6월 기준 우리나라의 항공 레저스포츠 등록 사업체는 95곳에 이른다. 레저 등에 사용되는 경량항공기, 초경량비행장치는 2323대에 이른다. 특히 드론과 같은 무인비행장치의 경우 2010년 144대에서 올해 5월 1280대로 9배 가까이 증가했으며 관련 동호회는 500여개에 이른다. 국토부 관계자는 “국내 항공레저스포츠 활동은 과거에는 소수의 동호회 활동 중심이었지만, 최근 종목이 다양해지면서 많은 사람들이 관심을 갖게 됐다”며 “국내 시장 규모는 연간 2200억원 정도로 세계 전체 규모인 30조원에 비하면 아직 미미하지만 빠르게 성장하고 있다”고 말했다. 대표적인 고부가가치 산업인 항공 레저스포츠는 미국, 터키 등에서 관광산업과 연계되고 있다. 터키의 ‘카파도키아 열기구 투어’, 이집트의 ‘룩소르 열기구 투어’와 같은 관광상품이 대표적이다. ●지역별로 경량항공기 이착륙장 구축 국토부는 2014년 항공법에 처음으로 항공 레저스포츠 규정을 도입했다. 이착륙장에 대한 법적 근거를 마련하고 항공레저 안전 체계 등을 정비했다. 드론의 경우 미래 전략산업으로 육성하기 위해 초경량비행장치 사용 사업의 범위를 확대하고, 비행승인 대상 및 안전성 검사대상 기준과 자본금을 완화했다. MobileAdNew center 국토부는 앞으로는 지역별로 경량항공기 이착륙장 및 패러글라이딩 활공장을 구축하고 초경량비행장치의 비행구역도 확대할 방침이다. 항공 레저스포츠 안전강령 마련과 면허갱신제도 도입 등 규제 완화도 추진 중이다. 국토부는 항공 레저스포츠의 활성화와 저변 확대를 위해 8~9일 충남 부여 금강 구드래 나루터 일대에서 ‘2016년 항공 레저스포츠 제전’을 개최한다. 대한민국항공회와 서울신문이 주관하는 이번 행사에서는 드론 레이싱, 패러글라이딩, 스카이다이빙 등 6개 부문에서 경연이 펼쳐진다."
파이낸셜뉴스,025560,/news/news_read.nhn?article_id=0004063662&office_id=014&mode=search&query=미래산업&page=1,2018-07-24 15:39,"[fnRASSI]장마감, 거래소 하락 종목(미래산업 -12.93%&darr;)","24일 거래소 기준으로 하락한 종목은 미래산업(025560) -12.93%, SK증권우(001515) -11.52%, 포스코대우(047050) -10.5% 등이 있다. 'fnRASSI'는 증권전문 기업 씽크풀과 파이낸셜뉴스의 협업으로 로봇기자가 실시간으로 생산하는 기사입니다."
파이낸셜뉴스,025560,/news/news_read.nhn?article_id=0004063297&office_id=014&mode=search&query=미래산업&page=1,2018-07-24 09:22,"[fnRASSI]미래산업(025560), 52주 신고가...9.89% &uarr;","미래산업(025560)은 52주신고가를 기록하고 있어 주목할만하다. 동종목의 현재 주가는 289원 선에서 이루어지고 있다. 거래일을 기준으로 최근 3일간 평균 거래량은 1185만 주이다. 이는 60일 일 평균 거래량 1240만 주와 비교해보면 최근 거래량이 약간 감소했지만 크게 벗어나지는 않았다. 외국인 보유량 증가, 기관 감소 (5일 누적) 최근 5일간 동종목의 외국인 투자자는 1,940,208주 순매수하였고 반면 기관은 3,622주 순매도하였다. 전날 두 주체 각각 268,313주, 3,622주 순매도하며 보유 비율을 줄였다. 다음 표는 동종목의 외국인, 기관의 일별 순매수량을 나타낸 것이다. 주가등락폭이 작아 최근 한달간 미래산업의 상장주식수 대비 거래량을 비교해보니 일별 매매회전율이 2.02%로 집계됐다. 동기간 일평균 변동률은 0%로 장중에 주가변화폭는 매우 작았던 것으로 보인다. 'fnRASSI'는 증권전문 기업 씽크풀과 파이낸셜뉴스의 협업으로 로봇기자가 실시간으로 생산하는 기사입니다."
뉴시스,025560,/news/news_read.nhn?article_id=0007773221&office_id=003&mode=search&query=미래산업&page=1,2017-02-15 17:37,"미래산업, 지난해 연결 영업손실 80억&hellip;전년比 227%&uarr;",【서울=뉴시스】최예린 기자 = 미래산업(025560)은 지난해 연결재무제표 기준 영업손실이 79억8911만원으로 전년 대비 226.7% 증가한 것으로 잠정 집계됐다고 15일 공시했다. 같은 기간 매출액은 233억1115만원으로 8.8% 줄었고 당기순손실은 88억5888만원으로 적자전환했다.
이데일리,025560,/news/news_read.nhn?article_id=0003750466&office_id=018&mode=search&query=미래산업&page=1,2017-02-15 17:24,"미래산업, 2016년 영업손실 79억원&hellip;전년比 226.7%&uarr;",[이데일리 김태현 기자] 미래산업(025560)은 2016년 영업손실이 전년대비 226.7% 증가한 79억8911만원으로 집계됐다고 15일 공시했다. 같은 기간 매출액은 8.8% 줄어든 233억원을 기록했다. 88억원의 당기순손실을 기록해 적자전환했다.
아시아경제,025560,/news/news_read.nhn?article_id=0004098304&office_id=277&mode=search&query=미래산업&page=1,2017-10-19 16:04,"미래산업, SK하이닉스와 21억 규모 공급계약",[아시아경제 권성회 기자] 미래산업은 SK하이닉스와 20억9000만원 규모 반도체 검사장비 공급계약을 맺었다고 19일 공시했다. 이는 최근 매출액 대비 8.96%에 해당한다.
아시아경제,025560,/news/news_read.nhn?article_id=0004217407&office_id=277&mode=search&query=미래산업&page=1,2018-04-12 12:00,"코스닥 미래성장산업 릴레이 IR, 16~18일 개최","[아시아경제 권성회 기자] 한국거래소는 오는 16일부터 18일까지 3일 간 기관투자자 및 전문투자자를 대상으로 한 '2018년 제1차 코스닥 미래성장산업 릴레이 IR'을 개최한다고 12 일 밝혔다. 이번 행사는 한국거래소, 키움증권, 한국IR협의회가 공동 주관하며 코스닥 대표 산업 및 80여개 상장기업의 마케팅을 지원한다. 거래소 측은 ""미래 혁신기업을 위한 모험자본시장인 코스닥 특성상, 기업 투자 시 소속 산업에 대한 이해 및 기업 관련 다양한 투자 정보가 필요하다""며 ""기업의 IR행사를 지원함으로써 상장기업 IR역량을 강화하고 기관 및 전문투자자의 코스닥 투자 활성화를 도모하고자 한다""고 설명했다. 이어 ""4차 산업혁명 시대를 맞아 코스닥시장의 브랜드 가치를 높이고, 정보 불균형 해소 및 투자자 전문성 향상을 통해 코스닥 투자 저변이 확대되길 기대한다""고 덧붙였다."
동아일보,025560,/news/news_read.nhn?article_id=0003009605&office_id=020&mode=search&query=미래산업&page=1,2016-10-07 16:58,"정부, VR에 4050억 투자&hellip;미래 성장산업으로 키운다","[동아일보] 미래의 성장 산업으로 꼽히는 가상현실(VR·Virtual Reality) 산업 육성을 위해 정부가 5년간 4050억 원을 투자한다. 미래창조과학부는 2020년까지 정부 2790억 원과 민간 1260억 원을 투자해 국내 VR 산업을 집중적으로 육성하겠다고 밝혔다. 이를 통해 미국 등 VR 선진국과의 기술 격차를 현재 1.7년에서 5년 뒤 0.5년까지 좁힐 계획이다. 정부는 3차원 깊이 센서, 표정·동작 인식, 눈동자 추적 등 VR의 핵심 기술 개발을 위해 연구개발(R&D) 투자를 확대하기로 했다. VR 시장을 개척할 유망 기업 지원도 강화한다. 서비스 플랫폼, 게임체험, 테마파크, 영화관 입체 상영, 교육, 엔터테인먼트 등 다양한 분야의 서비스·제품 개발을 지원해 VR 관련 기업들이 동반 성장하는 생태계를 구축하겠다는 구상이다. 또 주요 미디어 기업들과 정보통신기술(ICT) 관련 기업들이 모여 있는 서울 마포구 상암동 주변을 VR 산업 거점지로 조성해 역량 있는 스타트업 기업들과 인재들의 창업을 지원하기로 했다. 상암동에 있는 ＇VR 캠퍼스＇ 같은 연구 협업 공간을 늘려 예술, 창작, 컴퓨터그래픽 전공자와 기업들과의 공동 프로젝트를 확대시킬 계획이다. 7일 서울 상암DMC 누리꿈스퀘어에서 열린 ＇코리아 가상현실 페스티벌＇ 현장을 방문한 박근혜 대통령은 국가적 차원에서 VR 산업을 전략적으로 지원해 나갈 것이라고 밝혔다. 박 대통령은 ＂VR 산업이 문화산업의 부가가치를 높이는 것은 물론 관광 의료 국방 등 다양한 분야에서 발전 가능성이 무궁무진하다＂며 ＂새로운 부가가치와 일자리 창출을 통해 우리 경제 도약에도 크게 기여할 것＂이라고 말했다. 여러 분야에서 활용될 유망 신산업으로 꼽히는 VR 시장은 최근 가파르게 성장하고 있다. 골드만삭스에 따르면 전 세계 VR 시장 규모는 올해 22억 달러(2조4420억 원)에서 2025년에는 800억 달러(88조8000억 원) 급증할 것으로 전망된다. 삼성전자, LG전자 등 국내 대기업을 비롯해 구글, 소니, 화웨이, 페이스북 등 수많은 기업들도 VR을 새로운 성장 동력으로 보고 시장에 뛰어들고 있다."
매일경제,025560,/news/news_read.nhn?article_id=0004130723&office_id=009&mode=search&query=미래산업&page=1,2018-04-10 10:22,[MK 분양뉴스] 높은 층고로 공간 효율성 `UP`... 미래형 지식산업센터 주목,"대명건설 시공, 정왕 대명벨리온 만성 지식산업센터층고 6~7m로 공간활용성 탁월... 기숙사 시설도 마련 시화공단 내에 다양한 특화설계가 적용된 미래형 지식산업센터가 공급돼 기업 및 투자자들의 이목이 집중되고 있다. 대한민국 대표 리조트기업 대명건설이 경기도 시흥시 정왕동 1263-1,2번지에 시공하는 ‘정왕 대명벨리온 만성 지식산업센터’는 상업시설, 지원시설, 공장 층고가 6~7m에 달해 실내공간을 복층으로 활용할 수 있어, 시화유통‧공구상가 입점에 최적화돼 있다. 상주업체 직원들의 숙박해결이 가능한 기숙사 시설(층고 4.5m)도 마련돼 있다. 국내 최대 9.2m 주차램프 폭과 드라이브인 시스템으로 5톤 차량 진입도 가능하고 ㎡당 1.5톤의 하중도 감당할 수 있는 내구설계가 적용됐다. 공용 에어컴프레셔실도 마련돼 최적의 근무환경을 제공 할 예정이다. 594대를 동시 주차 가능해 인근 주차난까지 해소할 수 있다. ‘정왕 대명벨리온 만성 지식산업센터’는 연면적 10만8944.25㎡, 지상 10층의 시화공단 최대 규모로 지어지며 공장 382호실, 상가 119호실, 기숙사 148호실이 들어설 예정이다. 지식산업센터 근무자들의 출퇴근이 용이한 뛰어난 입지를 자랑한다. 시화산업단지 센트럴병원과 롯데마트가 인접할 만큼 중심부에 위치해 차량 접근성이 뛰어나며 시화공단 내 지원시설의 중심지 시화 공구‧유통상가와의 거리가 8m로 바로 인접하여 시인성이 우수하다. 정왕역과의 거리가 불과 2.3㎞이며 군자, 정왕, 서안산, 남안산 IC도 가깝다. 인천, 광명, 부천, 안산, 안양시도 20㎞ 이내로 영동고속도로, 평택-시흥 고속도로, 제2경인고속도로 등의 교통망을 이용하면 접근이 용이하다. 특히 송도신도시, 남동공단, 반월공단, 시화MTV 등 산업환경을 갖춰 교통, 비즈니스, 편의생활이 가능하다. 입주기업은 혜택도 풍부하다. 취‧등록세 50% 감면, 재산세 5년간 37.5% 감면과 중도금 무이자 대출, 정책자금 최대 70% 대출 등도 지원되며, 효율적인 관리비도 장점이다. 가격 경쟁력도 갖췄다. 지식산업센터 지상 1층은 3.3㎡당 690만원에 불과하다. 상가도 실투자금 2억원대부터다. 한편, 시행수탁자는 생보부동산신탁이 맡았고, 현재 예약신청서 접수 중이다. 홍보관은 시흥시 정왕동 1262-5번지 1층에 위치해 있다. [MK 부동산센터] r_start // r_end //"
머니S,025560,/news/news_read.nhn?article_id=0000200874&office_id=417&mode=search&query=미래산업&page=1,2016-09-21 05:55,[머니S토리] 미래 식품산업 키워드 'IT&middot;곤충',"현대사회에서 식품산업의 중요성은 아무리 강조해도 지나치지 않는다. 경제가 불황이라도 먹는 즐거움을 놓지 않았던 인류 덕분에 식품산업의 파이는 날로 커졌다. 국내 산업을 지탱한 자동차, 조선, 철강 등 전통적인 제조업이 부진을 겪고 있음에도 식품산업은 여전히 흔들림이 없다. ‘2016 대한민국식품대전’을 통해 미래 식품산업의 화두로 던져진 IT와 식품산업의 만남, 그리고 식용곤충산업을 조명해본다.본문 이미지 영역식용곤충을 활용한 식재료들. /사진=뉴시스 DB◆ 현실로 다가온 식품과 IT의 '콜라보'이달 초 열린 ‘2016 대한민국식품대전’에서 최대 화두는 식품과 IT의 만남, 그리고 식용곤충이었다. ‘식품산업, 대한민국을 넓히다’라는 슬로건 아래 열린 이번 행사는 IT 기술과 융합한 미래 식품산업의 모습을 가상현실로 보여주고 최첨단 식품가전을 확인할 수 있는 ‘미래식품산업관’을 선보여 관람객의 눈길을 사로잡았다. 사물인터넷(IoT)을 적용한 냉장고는 누구보다 똑똑한 가정 내 '식재료 지킴이'였다. 스마트 냉장고에 보관된 식재료의 잔량과 신선도 체크가 가능하며 요리가 가능한 식재료를 선택할 수 있다. 대형마트 장보기서비스는 물론 음악 재생도 지원한다. 스마트 식탁은 'O2O 스마트 배달 서비스'가 가능해 지금 당장 필요한 식재료나 음식 등을 주문할 수 있다.IT기술로 프로그래밍된 로봇요리사도 눈길을 끌었다. 지난해 열린 식품대전에서도 공개된 바 있는 요리로봇은 사람의 주문을 받아 로봇이 직접 요리를 만든다. 올해 식품대전에서는 한 남성이 로봇요리사를 활용해 아내가 평소 좋아하는 식사 메뉴를 결정하고 식재료 구입, 조리, 플레이팅까지 완벽하게 해내는 모습을 선보였다.푸드3D프린터는 상용화 단계에 돌입했다. 3차원으로 만든 설계도와 컴퓨터기술을 바탕으로 플라스틱이나 금속 등의 원재료를 조형해 실제의 결과물을 만들어내는 3D프린팅 기술이 요리분야로 확장된 것. 이 기술은 초콜릿, 크림, 반죽 등을 사용해 ‘요리’를 찍어낸다. 사용법도 간단하다. 프로그래밍된 조리법을 다운로드 받아 재료를 투입하기만 하면 된다.  이밖에도 필요 수분량을 추적해 물 섭취량을 알려주는 ‘스마트 보틀’, 알아서 온도를 조절하는 ‘스마트 인덕션’, 올려만 둬도 칼로리뿐 아니라 각종 영양소를 확인할 수 있는 ‘스마트 도마’ 등은 이미 판매가 진행 중인 ‘스마트 키친’ 제품들이다. 미래식품산업관 전시 관계자는 ""3D푸드프린터의 경우 올해 내 상용화될 예정이며 다른 스마트제품 역시 늦어도 내년에는 상용화될 것으로 보인다""며 “IT를 활용한 식품산업의 진화는 앞으로 더욱 거세질 것으로 예상된다”고 말했다. 본문 이미지 영역(윗쪽부터)안이 들여다 보이는 스마트 냉장고, 메뉴가 펼쳐지는 스마트 식탁. /사진=뉴시스 DB◆ 식품업계 미래먹거리 '식용곤충'식용곤충은 수년 전부터 유엔식량농업기구 지정 미래먹거리로 선정돼 세계적으로 관련 연구가 활발히 진행 중이다. 업계에 따르면 2007년 11조원에 머물던 세계곤충산업 시장규모는 2020년 38조원에 이를 것으로 전망된다. 그 중심에 식용곤충산업이 자리한다. 국내 식품업계도 경쟁력을 갖춘 식용곤충 생산에 주목한다. 식용곤충은 다른 육종에 비해 상대적으로 저렴한 비용으로 사육이 가능하며 기간도 짧은 편이다. 현재 연구에 활용할 수 있는 법적 식용곤충은 벼메뚜기, 누에번데기, 누에 백강잠, 갈색거저리 유충(고소애) 등 7종이다. 이 중 고소애의 경우 4개월, 식용애벌레는 100일이면 제품화가 가능할 정도로 성장세가 가파르다. 국내에서는 CJ제일제당이나 대상 등 식품업체가 관련 연구를 진행 중이다. CJ제일제당 관계자는 ""아직 상용화 단계는 아니지만 식용곤충을 활용한 즉석제품 등을 개발하기 위해 연구를 하고 있다""고 밝혔다. 대상 관계자도 ""관련 연구가 진행 중이지만 구체적인 상용화 계획은 미정""이라고 설명했다. 식품업계 관계자는 ""식용곤충은 단순히 미래식량 대체 차원을 넘어 앞으로 식품산업을 주도할 새로운 성장동력이 될 수 있다는 점에서 선택이 아닌 필수사업으로 여겨진다""며 ""다만 아직 소비자의 거부감이 크다는 점이 숙제인데 곤충을 가루 형태로 만들어 제조하거나 영양분을 추출하는 방식이 선호될 것""이라고 밝혔다.식품기업들의 연구와는 별개로 국내 곤충산업은 아직 걸음마 수준이다. 국내의 곤충활용은 천적, 화분매개, 학습·애완용, 관광용 등에 머물러 식·의약품과 바이오산업용으로는 활용되지 못했다. 세계 각국에서는 곤충 통조림, 에너지바, 쿠키 등 다양한 곤충식품이 생산된다. 유럽 일부국가는 식용곤충을 육류대체품으로 인식하고 정책적으로 육성 중이다. 13억 인구의 미래식량 확보로 고민 중인 중국 역시 10종의 곤충을 대량 사육하며 미래 대비 차원을 넘어 전략적으로 식용곤충사업을 진행한다는 방침을 세웠다.황재삼 농촌진흥청 곤충산업과 연구관은 ""국내에서도 식용곤충에 대한 다양한 학술토론 등이 열려 산업활성화를 위한 움직임이 활발해지는 추세""라면서 ""곤충의 유용성, 산업화 가능성 등에 대한 평가기준을 확립하는 것이 시급하다""고 말했다.☞ 본 기사는 &lt;머니S&gt;(www.moneys.news) 제454호에 실린 기사입니다.실시간 재테크 경제뉴스│창업정보의 모든 것
김정훈 기자 
&lt;저작권자 ⓒ '성공을 꿈꾸는 사람들의 경제 뉴스' 머니S, 무단전재 및 재배포 금지&gt;머니S 관련뉴스해당 언론사에서 선정하며 언론사 페이지(아웃링크)로 이동해 볼 수 있습니다.[경주 또 지진] '비상배낭' 관심고조, 뭘 챙기고 어디에 넣어둘까블랙베리, '프리브'로 국내 상륙… 출고가격 59만8000원일본 태풍 피해, 2만5000명 대피령·항공기 80여편 결항… 남해·동해 '해상특보'[작은집이 대세] 이제 '큰집'은 가라[머니포커S] '낙하산' 떨어진 한국증권금융의 돈잔치"
