source,symbol,link,date,title,content
이데일리,032940,/news/news_read.nhn?article_id=0003981209&office_id=018&mode=search&query=원익&page=1,2017-11-29 08:49,"원익홀딩스, 전방산업 호조에 호실적 지속&hellip;목표가&uarr;-SK",[이데일리 이후섭 기자] SK증권은 29일 원익홀딩스(030530)에 대해 자체 사업 및 자회사의 실적 개선세가 뚜렷하다며 주가 상승 여력은 충분하다고 진단했다. 목표가를 종전 9600원에서 1만500원으로 상향 조정했으며 투자의견은 `매수`를 유지했다. 최관순 SK증권 연구원은 “원익홀딩스의 자체 사업인 TGS(Total Gas Solution) 사업은 반도체 및 디스플레이 전방산업의 호조에 따른 수요 증가로 올해 별도기준 예상 영업이익은 전년대비 95.8% 증가한 332억원을 기록할 전망”이라며 “연결 대상인 원익머티리얼즈의 영업이익도 326억원으로 전년대비 39.1% 늘어날 것”이라고 내다봤다. 내년에도 전방산업의 투자는 계속될 전망이라 호실적을 지속할 것으로 예상했다. 최 연구원은 “올해 원익홀딩스의 주가 수익률은 28.3% 상승한 코스피지수를 소폭 상회했다”며 “반도체 호황에 따른 IT 강세가 지속됐으며 특히 지분 32.9%를 보유하고 있는 자회사 원익IPS 가 47.9% 상승하면서 원익홀딩스 주가 상승을 견인했다”고 분석했다. 이어 그는 “실적 개선폭 대비 주가 수익률은 다소 아쉬운 수준”이라며 “내년에도 실적 개선세가 지속될 것으로 예상됨에 따라 주가의 지속적인 우상향 기조는 유지될 것”이라고 덧붙였다.
전자신문,032940,/news/news_read.nhn?article_id=0002658471&office_id=030&mode=search&query=원익&page=1,2017-11-16 13:11,"[ET투자뉴스]원익QnC 17년3분기 실적 발표, 당기순이익 107.8억원&hellip; 전년...","11월 14일 원익QnC(074600)의 2017년 3분기 연결 잠정 실적이 발표됐다. 매출액과 영업이익은 지난해 같은 기간 대비 각각 56.4%, 188.4% 확대되어535억원, 109.6억원으로 발표되었다. 그러나 당기순이익은 190.4% 축소되어 107.8억원으로 집계되었다.이번분기 기준으로 추정되는 원익QnC의 자기자본이익률(ROE)은 24.6%로 나타났다. 전년 동기인 2016년 3분기 ROE는 11.1%로 이번 분기에 13.5%p 상승했다. 한편 동종목의영업이익률은 17.5%이다. 최근 4분기 이상 꾸준히 상승하다가 이번 분기에 하락했다. 지난해 동기 영업이익률은 11.7%로 이번 3분기가 5.8%p 상승했다.주가가 1주당 수익의 몇배가 되는지 나타내는 주가수익비율(PER)은 34.5배로 나타났다. PER은 최근 3분기 이상 연속으로 하락하고 있다. 전년 동기 PER은 57.95배로 이번 분기에 하락했다.주가가 1주당 순자산의 몇배인지 알려주는 주가순자산비율인 PBR은 2.04배이다. 지난해 동기 PBR은 1.58배로 이번 3분기 PBR이 상승했다.다음은 원익QnC와 동일 업종 내 비교 그룹 종목의 각각 최근 실적의 전년 동기 대비 성장률이다. 원익QnC의 매출액 증감율은 타 종목 대비 우수한 편이다. 그리고 주가 상승률은 높은 편이다."
머니투데이,032940,/news/news_read.nhn?article_id=0003966762&office_id=008&mode=search&query=원익&page=1,2017-11-20 14:51,"[베스트리포트]원익QnC, 반도체 공장에서 빛나는 수정(석영)","[머니투데이 이태성 기자] 대한민국 베스트리포트 로고 20일 머니투데이 증권부가 선정한 베스트리포트는 김경민 대신증권 연구원이 작성한 ""원익QnC, 반도체 공장에서 빛나는 수정(석영)"" 입니다. 김 연구원은 3D 낸드 반도체 식각장비에 탑재되는 소재 수요가 폭발적으로 증가한다며 원익QnC에 대해 매수 투자의견과 목표주가 2만500원을 제시했습니다. 그는 ""수정 석영 쿼츠 소재 매출은 2014년까지 1000억원 미만에 머물다가 2015년 1070억원, 2016년 1062억원 기록 후 2019년 2000억원대 진입할 것""이라며 ""산화물 세라믹 소재 매출도 2016년까지 100억원대에 머물다가 2017년 262억원, 2018년 314억원으로 증가할 것""이라고 전망했습니다. 이어 원익QnC 주가는 아직도 저평가되어 있어 지금 매수해도 늦지 않는다고 밝혔습니다. 다음은 보고서를 요약한 내용입니다.(☞원문보기) 투자의견 매수, 6개월 목표주가 2만500원, 목표시총 5389억원을 제시한다. 6개월 목표주가 2만500원은 2018년 P/E 17배에 해당한다. P/E 17배의 근거는 국내외 반도체 소재 공급사 중에서 고체 소재를 안정적으로 공급하고 있는 3개사(티씨케이, 일본 Tosoh 및 Shin-Etsu Chemical)의 3년 평균을 참고했다. 수정·석영·쿼츠 소재 매출은 2014년까지 1000억원 미만에 머물다가 2015년 1070억원, 2016년 1062억원 기록 후 2019년 2000억원대 진입이 예상된다. 3D-NAND 반도체의 적층수가 증가할수록 식각공정이 증가하는데 동사의 제품은 반도체 웨이퍼와 유사한 실리콘 성분으로 이루어져 있어 식각장비 내의 수율을 안정적으로 유지해주기 때문이다. 산화물 세라믹 소재 매출은 2016년까지 100억원대에 머물다가 2017년 262억원, 2018년 314억원을 기록할 전망. 반도체/디스플레이 생산라인의 교체수요 때문인데 2016년까지는 영업이익 기준 흑자 달성이 어려웠으나 2017년부터 10% 이상의 영업이익률 달성이 기대된다. 원익QnC보다 점유율 높은 경쟁사 SKC솔믹스는 올해 3분기 누적 기준 18% 영업이익률을 달성했다. 최근 주가 급등 원인은 3분기 매출과 영업이익이 535억원, 110억원을 기록하며 컨센서스(480억원, 82억원)를 크게 상회했기 때문이다. 2016년 매출 정체 이후 2017년부터 실적 성장이 시작되고 2020년까지 연평균 20% 성장한다는 점을 고려한다면 동사 주가는 아직도 저평가돼 있어 지금 매수해도 늦지 않으며 BUY&HOLD 전략 대응이 적절하다고 판단한다."
한국경제,032940,/news/news_read.nhn?article_id=0003853233&office_id=015&mode=search&query=원익&page=1,2017-11-20 14:19,"[특징주]원익QnC, 신고가&hellip;&quot;반도체서 수요 폭발적 증가&quot;","원익QnC가 신고가를 경신했다. 20일 오후 2시 16분 현재 원익QnC는 전날보다 400원(2.44%) 오른 1만6800원에 거래되고 있다. 신고가다. 대신증권은 이날 원익QnC에 대해 3D 낸드 반도체 식각장비에 탑재되는 소재 수요가 폭발적으로 증가한다며 매수 투자의견과 목표주가 2만500원을 제시했다. 김경민 대신증권 연구원은 ""수정 석영 쿼츠 소재 매출은 2014년까지 1000억원 미만에 머물다가 2015년 1070억원, 2016년 1062억원 기록 후 2019년 2000억원대 진입할 것""이라고 예상했다. 김 연구원은 ""3D 낸드 반도체의 적층수가 증가할수록 식각공정이 증가하는데 원익QnC의 제품은 반도체 웨이퍼와 유사한 실리콘 성분으로 이루어져 있어 식각장비 내의 수율을 안정적으로 유지해주기 때문""이라고 설명했다. 최근 원익QnC 주가가 급등했지만 여전히 매력적인 주가 수준이라는 분석이다. 그는 2016년 매출 정체 이후 2017년부터 실적 성장이 시작되고 2020년까지 연평균 20% 성장한다는 점을 고려한다면 원익QnC 주가는 아직도 저평가되어 있어 지금 매수해도 늦지 않는다고 판단했다."
아시아경제,032940,/news/news_read.nhn?article_id=0004128696&office_id=277&mode=search&query=원익&page=1,2017-11-29 08:04,"[클릭 e종목]원익홀딩스, 자체사업&middot;자회사 이익 증가 지속 전망&hellip;목표가&uarr;","[아시아경제 임철영 기자]SK증권이 29일 원익홀딩스에 대해 자체 사업과 자회사 실적 개선세가 뚜렷해 이익 증가가 지속될 가능성이 높다며 목표주가를 1만500원으로 상향조정한다고 밝혔다. 투자의견은 매수를 유지했다. 최관순 연구원은 ""아직 주가 상승률이 높은 이익 증가폭에 미치지 못하고 있어 추가 주가 상승이 가능할 전망""이라며 ""내년에도 실적 개선세가 지속될 것으로 예상됨에 따라 주가의 지속적인 우상향 기조는 유지될 것""이라고 설명했다. 자체 사업과 자회사 실적 개선세에도 주목했다. 원익홀딩스의 자체사업인 TGS 사업은 반도체와 디스플레이 전방산업의 성장과 밀접하게 연관돼있다. 내년에도 전방 산업의 투자는 계속될 것으로 추정했다. 최 연구원은 ""전방 산업의 호조에 따른 TGS 수요 증가는 원익홀딩스 별도 실적에 고스란히 반영되고 있고 2017 년 별도 기준 예상 영업이익은 전년 대비 95.8% 늘어난 332억원으로 예상한다""며 ""연결 대상인 원익머티리얼즈 2017년 영업이익은 326 억원으로 예상되며, 이는 전년 동기 대비 39.1% 증가한 수치""라고 분석했다."
한국경제,032940,/news/news_read.nhn?article_id=0003987266&office_id=015&mode=search&query=원익&page=1,2018-07-29 15:45,솔브레인&middot;원익IPS 등 낙폭과대 IT株 '찜',"위기의 코스닥… 하락장 버틸 종목은?삼성전자·SK하이닉스 등 반도체주삼성전기 등 4차 산업혁명주도 '주목' [ 김동현 기자  ] 개인 투자자가 많은 코스닥지수가 맥을 추지 못하고 있다. 미국과 중국의 상호 관세부과에 따른 무역 전쟁에 이어 네이처셀 회장의 주가조작 의혹 등 바이오주 악재까지 겹치면서다. 전문가들은 일부 정보기술(IT) 부품주와 남북경협주 등 최근 낙폭이 컸던 종목에서 실적 모멘텀이 있는 곳에 집중할 필요가 있다고 조언하고 있다. 글로벌 자본시장에서 외국인의 편입이 예상되는 미디어·엔터주, 성장성이 큰 4차 산업혁명 관련주 등도 관심을 가져볼만하다. 낙폭 큰 남북경협주 ‘눈길’ 올초 900선을 뚫었던 코스닥지수는 횡보세를 거듭하며 이달 들어 800선마저 붕괴됐다. 코스닥시장 대표 업종인 제약·바이오주가 최근 큰 폭의 조정을 보인 것이 컸다. 코스닥 시가총액 상위 바이오주인 셀트리온헬스케어와 신라젠의 낙폭이 특히 컸다. 한지영 케이프투자증권 연구원은 “삼성바이오로직스의 분식회계 여부를 둘러싼 논란 이후 바이오 업종에 대한 투자 심리가 크게 위축됐다”며 “특히 기관과 외국인이 많이 거래하는 코스닥 대형 바이오주의 타격이 컸다”고 말했다. 코스닥시장의 높은 신용융자 잔액도 조정폭을 키울 것이란 우려가 나온다. 현재 코스닥 시장의 신용융자 잔액은 5조4000억원 규모다. 증권 업계에선 대안이 될 만한 종목찾기에 나섰다. 실적 모멘텀이 있으면서 최근 크게 내린 이른바 ‘낙폭 과대주’가 우선 거론된다. 하나금융투자에 따르면 예림당, 솔브레인, 원익IPS, 다산네트웍스 등이 낙폭 과대 종목으로 꼽힌다. 최근 디램(DRAM) 등 반도체 업황 고점 논란을 겪으면서 조정받은 IT부품주가 많은 추천을 받았다. 다산네트웍스와 예림당은 최근 하락폭이 컸지만 지난 2분기 영업이익(하나금융투자 추정치)은 작년 동기에 비해 각각 400.0%, 196.2% 늘었을 것으로 예상된다. 김용구 하나금융투자 연구원은 “예림당 등은 최근 낙폭이 컸고 기관 매수세가 약했던 종목이어서 바닥에서 매수하려는 투자자들이 관심을 가져볼 만하다”고 했다. 한국경제TV 전문가들은 지난 4~5월 남북 화해무드를 타고 상승세를 타다 최근 조정받은 남북경협주 중에서 투자 종목을 선별해 볼 것을 권했다. 양태원 파트너는 현대로템·성신양회를 ‘톱픽(최선호주)’으로 꼽았다. 양 파트너는 “현대로템은 철도부문 매출이 크게 늘면서 지난 2분기 영업이익이 작년 동기에 비해 251% 늘어났다”며 “북한 철도와 지하철 사업이 현실화되면 기업가치가 크게 늘 것”으로 예상했다. 글로벌 IT주 매수도 고려할 만 하반기 글로벌 자본시장의 이벤트를 눈여겨봐야 한다는 의견도 나온다. 오는 9월 모건스탠리캐피탈인터내셔널(MSCI)이 글로벌산업분류기준(GICS) 정기 변경에서 신설된 ‘커뮤니케이션’ 부문에 처음으로 종목을 편입한다. 커뮤니케이션 분야에는 기존 통신관련주에 미디어, 소셜 미디어 관련 대형 IT주, 콘텐츠·게임 관련 기업들이 포함된다. 이에 따라 국내 미디어·소프트웨어·엔터주 등에도 외국인 매수세가 몰릴 가능성이 커졌다. 코스닥 시장에선 CJ ENM, 스튜디오드래곤, 에스엠 등이 커뮤니케이션 부문으로 소속이 바뀔 수 있다는 전망이 나온다. 신상호 한국경제TV 파트너는 엔터주 중 에스엠을 추천주로 꼽았다. 신 파트너는 “에스엠의 경우 하반기 ‘엑소’(EXO)와 ‘SJ’의 글로벌 투어가 예정돼 있어 실적이 계속 좋아질 것”이라고 말했다. 일각에선 인공지능(AI)·전기차 등으로 대표되는 국내외 4차산업 관련주를 대안으로 삼아야 한다는 견해도 있다. 이재선 KTB투자증권 연구원은 “최근 미·중 분쟁 대외환경에 가려 주목받지 못하고 있지만 4차 산업혁명 관련 정부 정책의 모멘텀이 살아있다”고 강조했다. 조용준 하나금융투자 리서치센터장은 “글로벌 증시 조정에도 아마존·구글·넷플릭스 등 미국의 4차 산업혁명 관련주는 꾸준한 흐름을 보였다”며 “미국·중국의 대형 IT기업에 투자하는 게 좋다”고 했다. 국내 증시에선 삼성전자·SK하이닉스 등 대형 반도체주, 전기차·자율주행차의 부품 등에 쓰이는 MLCC(적층세라믹콘덴서) 생산업체인 삼성전기 등이 하락장에 견딜 4차산업 혁명 수혜주로 꼽힌다."
이데일리,032940,/news/news_read.nhn?article_id=0003390059&office_id=018&mode=search&query=원익&page=1,2015-11-10 13:27,"[특징주]원익IPS, 회사 분할 소식에 신저가 급락","[이데일리 정병묵 기자] 원익IPS(030530)가 회사 분할 소식에 급락 중이다. 원익IPS는 10일 오후 1시25분 현재 전날 대비 11.84% 내린 8620원에 거래되고 있다. 52주 신저가다. 원익IPS는 9일 반도체·디스플레이 장비 제조사업부문과 토털가스솔루션(TGS)·투자사업부문으로 0.51대 0.49로 인적분할하기로 했다. 반도체, 디스플레이 및 솔라 장비의 제조 사업부문은 분할신설회사 ‘원익아이피에스’가 되고, TGS 사업부문 및 투자사업부문은 분할존속회사 ‘원익티지에스’가 된다."
전자신문,032940,/news/news_read.nhn?article_id=0002662208&office_id=030&mode=search&query=원익&page=1,2017-11-29 11:01,"[ET투자뉴스]원익홀딩스, &quot;2018 년에도 지&hellip;&quot; 매수(유지)-SK증권","SK증권에서 29일 원익홀딩스(030530)에 대해 ""2018 년에도 지속적인 실적 개선 가능성이 높다""라며 투자의견을 '매수(유지)'로 제시하였고, 아울러 목표주가로는 10,500원을 내놓았다. SK증권 최관순 애널리스트가 동종목에 대하여 이번에 제시한 '매수(유지)'의견은 그리고 최근 분기내 발표된 전체 증권사 리포트의 컨센서스와 비교를 해볼 경우에 오늘 발표된 투자의견은 대체적으로 평균치에 해당하는 수준으로, 이번 의견은 동종목에 대한 전체적인 흐름에서 크게 벗어나지 않은 것으로 분석되고 있다. 목표주가의 추이를 살펴보면 한동안 같은 수준을 유지하다가 이번에 목표가가 상향조정되는 모습이다. 또한 전일 종가 기준으로 볼때 동종목의 현주가는 이번에 제시된 목표가 대비 28.7%의 추가상승여력이 있다는 해석이 제시되고 있다."
전자신문,032940,/news/news_read.nhn?article_id=0002659369&office_id=030&mode=search&query=원익&page=1,2017-11-20 08:39,"[ET투자뉴스]원익머트리얼즈, &quot;호황기의 홍길동은 &hellip;&quot; 매수(신규)-대신증권","대신증권에서 20일 원익머트리얼즈(104830)에 대해 ""호황기의 홍길동은 동에 번쩍 서에 번쩍""라며 투자의견을 '매수(신규)'로 제시하였다. 아울러 6개월 목표주가를 90,500원으로 내놓았다. 대신증권 김경민 애널리스트가 동종목에 대하여 이번에 제시한 '매수(신규)'의견은 대신증권에서는 올해들어 처음 내놓는 매매의견이며 그리고 최근 분기내 발표된 전체 증권사 리포트의 컨센서스와 비교를 해볼 경우에 오늘 발표된 투자의견은 대체적으로 평균치에 해당하는 수준으로, 이번 의견은 동종목에 대한 전체적인 흐름에서 크게 벗어나지 않은 것으로 분석되고 있다. 또한 전일 종가 기준으로 볼때 동종목의 현주가는 이번에 제시된 목표가 대비 16.5%의 추가상승여력이 있다는 해석이 제시되고 있다."
한국경제,032940,/news/news_read.nhn?article_id=0003852944&office_id=015&mode=search&query=원익&page=1,2017-11-20 07:17,"&quot;원익QnC, 반도체서 수요 폭발적 증가&quot;-대신","대신증권은 20일 원익QnC에 대해 3D 낸드 반도체 식각장비에 탑재되는 소재 수요가 폭발적으로 증가한다며 매수 투자의견과 목표주가 2만500원을 제시했다. 김경민 대신증권 연구원은 ""수정 석영 쿼츠 소재 매출은 2014년까지 1000억원 미만에 머물다가 2015년 1070억원, 2016년 1062억원 기록 후 2019년 2000억원대 진입할 것""이라고 예상했다. 김 연구원은 ""3D 낸드 반도체의 적층수가 증가할수록 식각공정이 증가하는데 원익QnC의 제품은 반도체 웨이퍼와 유사한 실리콘 성분으로 이루어져 있어 식각장비 내의 수율을 안정적으로 유지해주기 때문""이라고 설명했다. 산화물 세라믹 소재 매출도 2016년까지 100억원대에 머물다가 2017년 262억원, 2018년 314억원으로 증가할 것이라는 전망이다. 반도체, 디스플레이 생산라인의 교체수요 때문. 그는 2016년까지는 영업이익 기준 흑자 달성이 어려웠으나 2017년부터 10% 이상의 영업이익률 달성 기대된다며 원익QnC보다 점유율 높은 경쟁사 SKC솔믹스는 3분기 누적 기준 18% 영업이익률을 달성했다고 전했다. 최근 원익QnC 주가가 급등했지만 여전히 매력적인 주가 수준이라는 분석이다. 김 연구원은 2016년 매출 정체 이후 2017년부터 실적 성장이 시작되고 2020년까지 연평균 20% 성장한다는 점을 고려한다면 원익QnC 주가는 아직도 저평가되어 있어 지금 매수해도 늦지 않는다고 판단했다."
파이낸셜뉴스,032940,/news/news_read.nhn?article_id=0003912334&office_id=014&mode=search&query=원익&page=1,2017-11-24 11:14,[fnRASSI]원익QnC(074600) 9.63% 상승,"원익QnC(074600)는 현재 주가가 전일 대비 9.63% 상승한 17,650원 선에서 거래가 이루어지고 있다.                   지표               항목               값               종합점수                 성장성               매출액증가율               0               7.83                 자기자본증가율               0.19                 안정성               부채비율               44.29               8.38                 유동비율               140.9                 이익안정성               9.72                 수익성               ROA               11.43               9.16                 ROE               16.49                 영업이익율               17.3          원익QnC의 퀀트 재무 점수는 25.37점으로 지난 분기에 비해 성장성 점수가 하락했다. 이는 매출액 증가율이 감소하였기 때문이다. 안정성 종합 점수는 부채비율 증가, 유동비율 감소로 하락했다. 수익성 측면에서 볼때 ROA, ROE가 하락하여 이전보다 낮은 점수를 받았다. 거래비중은 개인투자자가 가장 높아 최근 한달간 주체별 거래비중을 살펴보면 개인이 75.31%, 기관이 14.31%, 외국인은 10.37%를 기록했다. 그리고 최근 5일간 거래비중은 개인이 71.28%, 기관이 16.82%, 외국인은 11.88%를 기록한 것으로 나타났다. 'fnRASSI'는 증권전문 기업 씽크풀과 파이낸셜뉴스의 협업으로 로봇기자가 실시간으로 생산하는 기사입니다."
파이낸셜뉴스,032940,/news/news_read.nhn?article_id=0003907743&office_id=014&mode=search&query=원익&page=1,2017-11-16 16:04,[fnRASSI]원익QnC(074600) 현재 +8.67%,"원익QnC(074600)는 현재 주가가 전일 대비 8.67% 상승한 16,300원 선에서 거래가 이루어지고 있다.                   지표               항목               값               종합점수                 성장성               매출액증가율               0               7.58                 자기자본증가율               0.13                 안정성               부채비율               42.51               8.57                 유동비율               148.15                 이익안정성               9.72                 수익성               ROA               12.33               9.18                 ROE               17.58                 영업이익율               17.3          원익QnC의 퀀트 재무 점수는 25.33점으로 지난 분기에 비해 성장성 점수가 하락했다. 이는 매출액 증가율과 자기자본 증가율이 감소하였기 때문이다. 안정성 종합 점수는 부채비율 증가, 유동비율 감소로 하락했다. 수익성 측면에서 볼때 ROA, ROE가 하락하여 이전보다 낮은 점수를 받았다. 거래참여는 개인투자자가 가장 활발 최근 한달간 주체별 거래비중을 살펴보면 개인이 전체 거래의 78.77%를 차지하며 가장 적극적인 모습을 보여줬고, 기관은 11.29%를 나타냈으며 외국인은 9.93%를 나타냈다. 그리고 최근 5일간 거래비중은 개인이 76.65%로 가장 높은 참여율을 보였고, 기관이 12.71%를 보였으며 외국인은 10.62%를 나타냈다. 'fnRASSI'는 증권전문 기업 씽크풀과 파이낸셜뉴스의 협업으로 로봇기자가 실시간으로 생산하는 기사입니다."
한국경제,032940,/news/news_read.nhn?article_id=0003857994&office_id=015&mode=search&query=원익&page=1,2017-11-29 08:39,"원익홀딩스, 내년에도 실적개선세 '목표가 &uarr;'-SK","SK증권은 29일 원일홀딩스의 실적개선세가 내년까지 지속될 것이라며 목표주가를 9600원에서 1만500원으로 조정했다. '매수' 의견은 유지. 이 증권사 최관순 연구원은 ""원익홀딩스의 올해 주가상승률은 28.3%로 시장 대비 웃돌았다""면서도 ""자체 사업 및 연결 대상 자회사 원익머트리얼즈의 실적 개선, 상장 자회사 원익 IPS 의 주가 상승률을 고려했을 경우 추가적인 주가 상승이 가능하다""고 예상했다. 원익홀딩스의 3분기 누적 연결 영업이익은 484 억원으로 전년 동기 대비 243.7% 증가했다는 것. 별도 기준으로도 243억원으로 전년 동기 대비 1725.0% 늘었다는 전망이다. 원익홀딩스의 자체 사업인 TGS(Total Gas Solution) 사업은 반도체 및 디스플레이 전방 산업의 성장과 밀접하게 연관되어 있다는 분석이다. 전방 산업의 호조에 따른 TGS 수요 증가는 원익홀딩스 별도 실적에 반영되고 있다는 게 최 연구원의 얘기다. 그는 ""원익홀딩스의 실적 대비 주가 수익률은 다소 아쉬운 수준""이라며 ""내년에도 실적 개선세가 지속돼 주가의 우상향 기조는 유지될 것""으로 내다봤다."
