source,symbol,link,date,title,content
파이낸셜뉴스,032940,/news/news_read.nhn?article_id=0004001512&office_id=014&mode=search&query=원익&page=1,2018-04-13 10:09,[fnRASSI]원익머트리얼즈(104830) 8.28% 상승,"원익머트리얼즈(104830)는 현재 주가가 전일 대비 8.28% 상승한 65,400원 선에서 거래가 이루어지고 있다.                   지표               항목               값               종합점수                 성장성               매출액증가율               -0.09               5.89                 자기자본증가율               0.09                 안정성               부채비율               14.24               9.86                 유동비율               237.22                 이익안정성               9.72                 수익성               ROA               6.33               8.09                 ROE               7.23                 영업이익율               16.19          원익머트리얼즈의 퀀트 재무 점수는 23.84점으로 지난 분기에 비해 성장성 점수가 하락했다. 이는 매출액 증가율이 감소하였기 때문이다. 실적 안정성이 악화되어 안정성 종합 점수는 하락했다. 수익성 측면에서 볼때 ROA, ROE가 하락하여 이전보다 낮은 점수를 받았다. 외국인과 기관은 순매도, 개인은 순매수(한달누적)  기관이 3일연속 순매수를 보이고 있는 반면에 외국인은 5일연속 순매도를 보이고 있다. 4주간을 기준으로 보면 외국인이 매도 관점으로 접근하면서 62,103주를 순매도했고, 기관도 매도쪽으로 방향을 잡으면서 49,170주를 순매도했지만, 개인은 오히려 초반에 동종목을 순매수한 이후에 기세를 이어가며 111,273주를 순매수했다. 'fnRASSI'는 증권전문 기업 씽크풀과 파이낸셜뉴스의 협업으로 로봇기자가 실시간으로 생산하는 기사입니다."
한국경제TV,032940,/news/news_read.nhn?article_id=0000621963&office_id=215&mode=search&query=원익&page=1,2018-04-13 10:15,"원익QnC, 전일 대비 약 6% 상승한 15,750원","[한국경제TV 라이온봇 기자] 원익QnC는 4월 13일 10시 14분 전일 대비 약 6% 상승한 15,750원에 거래되고 있다. 원익QnC는 코스닥 상장 기업으로 비금속 업종에 속해 있다. 시가총액은 3,916억원으로 코스닥 상장기업 중 144위에 위치 해 있다. [종목 성향 진단] [그림 1] 종목 성향 진단 원익QnC의 투자 스타일은 모호한 측면이 있으나 성장주라고 볼 수 있다. 주가 고평가 우려가 공존하지만 높은 성장성이 기대되는 기업이다. 주가 모멘텀은 평범한 수준이었다. 최근 1개월 수익률이 5.67%, 3개월 수익률은 1.71%, 6개월 수익률은 29%를 기록했다. 원익QnC 종목에 대한 투자자의 관심도는 높은 편에 속한다. [투자 점수 진단] [그림 2] 투자 점수 진단 원익QnC는 성장성(매출증가율(YoY)) 측면에서 두각을 나타내고 있다. 최근 매출증가율(YoY)은 87점으로 6개의 핵심 팩터 중 가장 높은 점수를 기록했다. 매출증가율(YoY)은  전체 시장 내 230위를 기록하며 상위 12.63%에 위치했다. 업종별로는 82위를 기록하며 상위 15.4%에 위치했다. 그리고 효율성(ROA) 역시 도드라지는 편이다. 효율성 점수는 78점으로 두번째로 높은 점수를 기록했다. ROA는 전체 시장 내 421위를 기록하며 상위 21.59%에 위치했다. 업종별로는 158위를 기록하며 상위 26.88%에 위치했다. 그러나 PBR이 아쉬움을 나타냈다. [종합 투자점수] [그림 3] 종합 투자점수 AI 인공지능 분석을 통한 원익QnC의 종목 종합 스코어는 78점을 기록했다. 이는 동일 업종 평균점수인 56점과 시장 평균점수인 56점를 상회하는 수치였다. (위의 AI인공지능 점수는 재무 데이터를 기반으로 전체 상장 종목과 비교/분석하여 도출한 점수로 높은 점수가 반드시 높은 수익률을 보장하지 않습니다. 위의 자료는 당사의 추천 종목이 아니며, 투자 시 참고용으로 제시해드리는 것입니다.) 라이온봇 기자 -한국경제TV※ 본 기사는 한국경제TV와 '거장들의 투자공식이'자체 개발한 '라이온봇 기자'가 실시간으로 작성한 기사입니다. 라이온봇기자 ⓒ 한국경제TV, 무단 전재 및 재배포 금지 한국경제TV 관련뉴스해당 언론사에서 선정하며 언론사 페이지(아웃링크)로 이동해 볼 수 있습니다.'억대 수입' 이사배, 과거 공개한 '럭셔리' 하우스 봤더니""자연미인"" 셋째 출산에도 여전히 아름다운 '리설주'쏘가리 가격 '확' 떨어진다…22년 연구 끝에 '대량양식' 성공스타일난다, 4천억 '신화'…김소희 대표 누구?고 장자연-단역 자매 사건 재수사…""내가 노리개인가"""
서울경제,032940,/news/news_read.nhn?article_id=0003269473&office_id=011&mode=search&query=원익&page=1,2018-04-13 10:40,"&lt;코&gt;원익머트리얼즈, 전일 대비 8.77% 상승.. 일일회전율은 1.59% 기록","[서울경제] 원익머트리얼즈(104830) 는 13일 오전 10시 39분 현재 8.77% 오른 65,700원에 거래되고 있으며, 31(매도):69(매수)의 매수우위를 기록하고 있다. 거래대금은 64억5,267만, 거래량은 10만53주로 거래량회전율은 1.59%로 나타났다. 지난 1개월간 원익머트리얼즈는 상승 10회, 하락 20회를 기록했고, 주가수익률은 -1.35% 표준편차는 2.71%를 기록했다. 이 기간 ' 반도체업 ' 업종 평균 주가수익률은 -3.28%로 나타났으며, 변동성은 1.72%를 기록했다. 이 시각 현재 ' 반도체업 '은 0.37% 상승 중이며, 48(매도):52(매수)의 매수우위를 기록하고 있다."
한국경제TV,032940,/news/news_read.nhn?article_id=0000667697&office_id=215&mode=search&query=원익&page=1,2018-08-01 15:03,"원익IPS, 전일 대비 약 -3% 하락한 28,450원","[한국경제TV 라이온봇 기자] [그림 1] 최근 3개월 간 주가 추세 및 기간별 수익률 원익IPS는 8월 1일 15시 2분 전일 대비 약 -3% 하락한 28,450원에 거래되고 있다. 원익IPS는 코스닥 상장 기업으로 반도체 업종에 속해 있다. 시가총액은 1조2,134억원으로 코스닥 상장기업 중 25위에 위치 해 있다. [종목 성향 진단] [그림 2] 종목 성향 진단 원익IPS의 투자 스타일은 모호한 측면이 있으나 성장주라고 볼 수 있다. 주가 고평가 우려가 공존하지만 높은 성장성이 기대되는 기업이다. 주가 모멘텀은 평범한 수준이었다. 최근 1개월 수익률이 4.63%, 3개월 수익률은 -14.03%, 6개월 수익률은 -10.77%를 기록했다. 원익IPS 종목에 대한 투자자의 관심도는 높은 편에 속한다. [투자 점수 진단] [그림 3] 투자 점수 진단 원익IPS는 어느 측면에서 투자 매력도가 높은 종목일까? AI 인공지능 종목 분석 시스템을 이용해 성장성, 수익성, 효율성, 안전성, 저평가성, 추세 등 주가 수익률에 영향을 줄 수 있는 6가지 핵심 투자 지표를 점수화하여 종목의 투자 매력도를 계산해보았다. 그 결과 원익IPS는 상대적으로 수익성 측면에서 두각을 드러내고 있었다. 수익성 점수는 기업이 가진 자산과 자본을 활용하여 얼마나 이익을 실현했는지를 나타낸다. 원익IPS는 특히 ROA 측면에서 가장 높은 점수는 기록했는데, 전체 시장 내 53위를 기록하며 상위 2.62%에 위치했다. 업종별로는 26위를 기록하며 상위 4.28%에 위치했다. 그러나 기업 가치 대비 주가 수준을 나타내는 저평가 측면에서는 아쉬움을 나타냈다. (위의 AI인공지능 점수는 재무 데이터를 기반으로 전체 상장 종목과 비교/분석하여 도출한 점수로 높은 점수가 반드시 높은 수익률을 보장하지 않습니다. 위의 자료는 당사의 추천 종목이 아니며, 투자 시 참고용으로 제시해드리는 것입니다. 핵심투자지표를 결합해 종목의 투자매력도를 종합 계산한 ""인공지능 투자점수""는 ""거장들의 투자공식"" 앱에서 확인하실 수 있습니다.) 라이온봇 기자 -한국경제TV※ 본 기사는 한국경제TV와 '거장들의 투자공식이'자체 개발한 '라이온봇 기자'가 실시간으로 작성한 기사입니다. 라이온봇기자"
헤럴드경제,032940,/news/news_read.nhn?article_id=0000899471&office_id=016&mode=search&query=원익&page=1,2015-11-06 15:00,"&lt;생생코스닥&gt;원익IPS, 3분기 영업익 434.7억 전년비 147.64%&uarr;",원익IPS는 연결기준 3분기 영업이익이 434억7600만원으로 전년동기대비 147.64% 증가했다고 6일 공시했다. 매출액은 2256억4800만원으로 84.51% 늘었고 당기순이익은 356억9100만원으로 142.27% 증가한 것으로 집계됐다.
한국경제TV,032940,/news/news_read.nhn?article_id=0000663921&office_id=215&mode=search&query=원익&page=1,2018-07-23 11:35,"원익, 전일 대비 약 -5% 하락한 6,460원","[한국경제TV 라이온봇 기자] [그림 1] 최근 3개월 간 주가 추세 및 기간별 수익률 원익은 7월 23일 11시 34분 전일 대비 약 -5% 하락한 6,460원에 거래되고 있다. 원익은 코스닥 상장 기업으로 유통 업종에 속해 있다. 시가총액은 1,219억원으로 코스닥 상장기업 중 506위에 위치 해 있다. [종목 성향 진단] [그림 2] 종목 성향 진단 원익의 투자 스타일은 가치주에 가깝다. 기업 가치 대비 낮은 주가가 매력적인 기업이다. 주가 모멘텀은 부진한 편이었다. 최근 1개월 수익률은 -10.29%의 하락폭을 기록했다. 원익 종목에 대한 투자자의 관심도는 평범한 수준이었다. [투자 점수 진단] [그림 3] 투자 점수 진단 원익은 어느 측면에서 투자 매력도가 높은 종목일까? AI 인공지능 종목 분석 시스템을 이용해 성장성, 수익성, 효율성, 안전성, 저평가성, 추세 등 주가 수익률에 영향을 줄 수 있는 6가지 핵심 투자 지표를 점수화하여 종목의 투자 매력도를 계산해보았다. 그 결과 원익은 상대적으로 수익성 측면에서 두각을 드러내고 있었다. 수익성 점수는 기업이 가진 자산과 자본을 활용하여 얼마나 이익을 실현했는지를 나타낸다. 원익은 특히 ROA 측면에서 가장 높은 점수는 기록했는데, 전체 시장 내 134위를 기록하며 상위 6.7%에 위치했다. 업종별로는 12위를 기록하며 상위 5.21%에 위치했다. 그러나 재무건전성을 나타내는 기업안정성 측면에서는 아쉬운 점을 나타냈다. (위의 AI인공지능 점수는 재무 데이터를 기반으로 전체 상장 종목과 비교/분석하여 도출한 점수로 높은 점수가 반드시 높은 수익률을 보장하지 않습니다. 위의 자료는 당사의 추천 종목이 아니며, 투자 시 참고용으로 제시해드리는 것입니다. 핵심투자지표를 결합해 종목의 투자매력도를 종합 계산한 ""인공지능 투자점수""는 ""거장들의 투자공식"" 앱에서 확인하실 수 있습니다.) 라이온봇 기자 -한국경제TV※ 본 기사는 한국경제TV와 '거장들의 투자공식이'자체 개발한 '라이온봇 기자'가 실시간으로 작성한 기사입니다. 라이온봇기자"
전자신문,032940,/news/news_read.nhn?article_id=0002699020&office_id=030&mode=search&query=원익&page=1,2018-04-13 11:38,"[ET투자뉴스]원익머트리얼즈, &quot;2018년 사상 최&hellip;&quot; 매수(유지)-신한금융투자","신한금융투자에서 13일 원익머트리얼즈(104830)에 대해 ""2018년 사상 최대 실적 기록할 전망""라며 투자의견을 '매수(유지)'로 제시하였고, 아울러 목표주가로는 81,000원을 내놓았다. 신한금융투자 최도연, 임지용 애널리스트가 동종목에 대하여 이번에 제시한 '매수(유지)'의견은 신한금융투자의 직전 매매의견에서 큰 변화없이 그대로 유지되는 것이고  올해 초반의 매매의견을 기준으로  볼때도 역시 '매수'의견이 계속 유지되고 있는 상태이다. 그리고 최근 분기내 발표된 전체 증권사 리포트의 컨센서스와 비교를 해볼 경우에 오늘 발표된 투자의견은 전체의견에 수렴하고 있어, 이번 의견은 시장의 평균적인 기대감이 객관적으로 표현된 것으로 분석되고 있다. 또한 전일 종가 기준으로 볼때 동종목의 현주가는 이번에 제시된 목표가 대비 34.1%의 저평가 요인이 존재한다는 해석이 제시되고 있다."
이데일리,032940,/news/news_read.nhn?article_id=0003407030&office_id=018&mode=search&query=원익&page=1,2015-11-26 13:32,"신원종합개발, 원익머트리얼즈와 61억 규모 계약 체결","[이데일리 박기주 기자] 신원종합개발(017000)은 계열사인 원익머트리얼즈와 61억6849만원 규모의 오창 S-PROJECT 신축공사 계약을 체결했다고 26일 공시했다. 이는 지난해 매출액의 7.2%에 해당하는 수치로, 계약기간은 내년 12월31일까지다."
서울경제,032940,/news/news_read.nhn?article_id=0003269606&office_id=011&mode=search&query=원익&page=1,2018-04-13 12:00,"&lt;코&gt;원익QnC, 전일 대비 7.05% 상승.. 일일회전율은 1.51% 기록","[서울경제] 원익QnC(074600) 는 13일 오전 11시 59분 현재 7.05% 오른 15,950원에 거래되고 있으며, 29(매도):71(매수)의 매수우위를 기록하고 있다. 거래대금은 61억8,365만, 거래량은 39만6,077주로 거래량회전율은 1.51%로 나타났다. 지난 1개월간 원익QnC는 상승 12회, 하락 18회를 기록했고, 주가수익률은 10.76% 표준편차는 3.33%를 기록했다. 이 기간 ' 비금속업 ' 업종 평균 주가수익률은 -0.39%로 나타났으며, 변동성은 2.06%를 기록했다. 이 시각 현재 ' 비금속업 '은 1.83% 상승 중이며, 45(매도):55(매수)의 매수우위를 기록하고 있다."
한국경제TV,032940,/news/news_read.nhn?article_id=0000622054&office_id=215&mode=search&query=원익&page=1,2018-04-13 12:04,"원익IPS, 5거래일 연속 상승... 전일 대비 2% 상승","[한국경제TV 라이온봇 기자] 원익IPS는 현재 5거래일 연속 상승세를 기록하고 있어 주목할 만하다. 원익IPS는 4월 13일 12시 3분 전일 대비 약 2% 상승한 34,650원에 거래되고 있다. 원익IPS는 코스닥 상장 기업으로 반도체 업종에 속해 있다. 시가총액은 1조4,032억원으로 코스닥 상장기업 중 21위에 위치 해 있다. [종목 성향 진단] [그림 1] 종목 성향 진단 원익IPS의 투자 스타일은 성장주에 가깝다. 주가 고평가 우려가 공존하지만 높은 성장성이 기대되는 기업이다. 주가 모멘텀은 부진한 편이었다. 최근 6개월 수익률은 -7.86%의 하락폭을 기록했다. 최근 1개월 수익률 또한 -5.82% 하락하며 부진한 모멘텀을 이어가고 있다. 원익IPS 종목에 대한 투자자의 관심도는 높은 편에 속한다. [투자 점수 진단] [그림 2] 투자 점수 진단 원익IPS는 효율성(ROA) 측면에서 두각을 나타내고 있다. 최근 ROA는 91점으로 6개의 핵심 팩터 중 가장 높은 점수를 기록했다. ROA는  전체 시장 내 172위를 기록하며 상위 8.79%에 위치했다. 업종별로는 85위를 기록하며 상위 14.38%에 위치했다. 그리고 수익성(영업이익률) 역시 도드라지는 편이다. 수익성 점수는 87점으로 두번째로 높은 점수를 기록했다. 영업이익률은 전체 시장 내 253위를 기록하며 상위 12.91%에 위치했다. 업종별로는 116위를 기록하며 상위 19.66%에 위치했다. 그러나 PBR과 매출증가율(YoY)은  아쉬움을 나타냈다. [종합 투자점수] [그림 3] 종합 투자점수 AI 인공지능 분석을 통한 원익IPS의 종목 종합 스코어는 73점을 기록했다. 이는 동일 업종 평균점수인 56점과 시장 평균점수인 56점를 상회하는 수치였다. (위의 AI인공지능 점수는 재무 데이터를 기반으로 전체 상장 종목과 비교/분석하여 도출한 점수로 높은 점수가 반드시 높은 수익률을 보장하지 않습니다. 위의 자료는 당사의 추천 종목이 아니며, 투자 시 참고용으로 제시해드리는 것입니다.) 라이온봇 기자 -한국경제TV※ 본 기사는 한국경제TV와 '거장들의 투자공식이'자체 개발한 '라이온봇 기자'가 실시간으로 작성한 기사입니다. 라이온봇기자 ⓒ 한국경제TV, 무단 전재 및 재배포 금지 한국경제TV 관련뉴스해당 언론사에서 선정하며 언론사 페이지(아웃링크)로 이동해 볼 수 있습니다.'억대 수입' 이사배, 과거 공개한 '럭셔리' 하우스 봤더니""자연미인"" 셋째 출산에도 여전히 아름다운 '리설주'쏘가리 가격 '확' 떨어진다…22년 연구 끝에 '대량양식' 성공스타일난다, 4천억 '신화'…김소희 대표 누구?고 장자연-단역 자매 사건 재수사…""내가 노리개인가"""
한국경제TV,032940,/news/news_read.nhn?article_id=0000663888&office_id=215&mode=search&query=원익&page=1,2018-07-23 11:18,"원익QnC, 전일 대비 약 -5% 하락한 14,450원","[한국경제TV 라이온봇 기자] [그림 1] 최근 3개월 간 주가 추세 및 기간별 수익률 원익QnC는 7월 23일 11시 17분 전일 대비 약 -5% 하락한 14,450원에 거래되고 있다. 원익QnC는 코스닥 상장 기업으로 비금속 업종에 속해 있다. 시가총액은 4,008억원으로 코스닥 상장기업 중 119위에 위치 해 있다. [종목 성향 진단] [그림 2] 종목 성향 진단 원익QnC의 투자 스타일은 모호한 측면이 있으나 성장주라고 볼 수 있다. 주가 고평가 우려가 공존하지만 높은 성장성이 기대되는 기업이다. 주가 모멘텀은 평범한 수준이었다. 최근 1개월 수익률이 3.04%, 3개월 수익률은 -1.93%, 6개월 수익률은 1.67%를 기록했다. 원익QnC 종목에 대한 투자자의 관심도는 평범한 수준이었다. [투자 점수 진단] [그림 3] 투자 점수 진단 원익QnC는 어느 측면에서 투자 매력도가 높은 종목일까? AI 인공지능 종목 분석 시스템을 이용해 성장성, 수익성, 효율성, 안전성, 저평가성, 추세 등 주가 수익률에 영향을 줄 수 있는 6가지 핵심 투자 지표를 점수화하여 종목의 투자 매력도를 계산해보았다. 그 결과 원익QnC는 상대적으로 수익성 측면에서 두각을 드러내고 있었다. 수익성 점수는 기업이 가진 자산과 자본을 활용하여 얼마나 이익을 실현했는지를 나타낸다. 원익QnC는 특히 ROA 측면에서 가장 높은 점수는 기록했는데, 전체 시장 내 122위를 기록하며 상위 6.09%에 위치했다. 업종별로는 61위를 기록하며 상위 10.29%에 위치했다. 그러나 재무건전성을 나타내는 기업안정성 측면에서는 아쉬운 점을 나타냈다. (위의 AI인공지능 점수는 재무 데이터를 기반으로 전체 상장 종목과 비교/분석하여 도출한 점수로 높은 점수가 반드시 높은 수익률을 보장하지 않습니다. 위의 자료는 당사의 추천 종목이 아니며, 투자 시 참고용으로 제시해드리는 것입니다. 핵심투자지표를 결합해 종목의 투자매력도를 종합 계산한 ""인공지능 투자점수""는 ""거장들의 투자공식"" 앱에서 확인하실 수 있습니다.) 라이온봇 기자 -한국경제TV※ 본 기사는 한국경제TV와 '거장들의 투자공식이'자체 개발한 '라이온봇 기자'가 실시간으로 작성한 기사입니다. 라이온봇기자"
한국경제TV,032940,/news/news_read.nhn?article_id=0000667022&office_id=215&mode=search&query=원익&page=1,2018-07-31 09:15,"원익QnC, 전일 대비 약 4% 상승한 16,450원","[한국경제TV 라이온봇 기자] [그림 1] 최근 3개월 간 주가 추세 및 기간별 수익률 원익QnC는 7월 31일 9시 15분 전일 대비 약 4% 상승한 16,450원에 거래되고 있다. 원익QnC는 코스닥 상장 기업으로 비금속 업종에 속해 있다. 시가총액은 4,153억원으로 코스닥 상장기업 중 112위에 위치 해 있다. [종목 성향 진단] [그림 2] 종목 성향 진단 원익QnC의 투자 스타일은 모호한 측면이 있으나 성장주라고 볼 수 있다. 주가 고평가 우려가 공존하지만 높은 성장성이 기대되는 기업이다. 주가 모멘텀은 평범한 수준이었다. 최근 1개월 수익률이 4.67%, 3개월 수익률은 6.8%, 6개월 수익률은 3.29%를 기록했다. 원익QnC 종목에 대한 투자자의 관심도는 높은 편에 속한다. [투자 점수 진단] [그림 3] 투자 점수 진단 원익QnC는 어느 측면에서 투자 매력도가 높은 종목일까? AI 인공지능 종목 분석 시스템을 이용해 성장성, 수익성, 효율성, 안전성, 저평가성, 추세 등 주가 수익률에 영향을 줄 수 있는 6가지 핵심 투자 지표를 점수화하여 종목의 투자 매력도를 계산해보았다. 그 결과 원익QnC는 상대적으로 수익성 측면에서 두각을 드러내고 있었다. 수익성 점수는 기업이 가진 자산과 자본을 활용하여 얼마나 이익을 실현했는지를 나타낸다. 원익QnC는 특히 ROA 측면에서 가장 높은 점수는 기록했는데, 전체 시장 내 123위를 기록하며 상위 6.14%에 위치했다. 업종별로는 61위를 기록하며 상위 10.27%에 위치했다. 그러나 재무건전성을 나타내는 기업안정성 측면에서는 아쉬운 점을 나타냈다. (위의 AI인공지능 점수는 재무 데이터를 기반으로 전체 상장 종목과 비교/분석하여 도출한 점수로 높은 점수가 반드시 높은 수익률을 보장하지 않습니다. 위의 자료는 당사의 추천 종목이 아니며, 투자 시 참고용으로 제시해드리는 것입니다. 핵심투자지표를 결합해 종목의 투자매력도를 종합 계산한 ""인공지능 투자점수""는 ""거장들의 투자공식"" 앱에서 확인하실 수 있습니다.) 라이온봇 기자 -한국경제TV※ 본 기사는 한국경제TV와 '거장들의 투자공식이'자체 개발한 '라이온봇 기자'가 실시간으로 작성한 기사입니다. 라이온봇기자"
헤럴드경제,032940,/news/news_read.nhn?article_id=0000919898&office_id=016&mode=search&query=원익&page=1,2015-11-26 11:59,"&lt;생생코스닥&gt;신원종합개발, 원익머트리얼즈와 61.6억 규모 공사 계약",신원종합개발은 계열사 원익머트리얼즈와 61억6849만원 규모의 오창 S-PROJECT 신축공사 계약을 체결했다고 26일 공시했다. 이는 2014년 매출액 대비 7.2%에 해당하며 계약기간은 2016년 12월 31일까지다.
이데일리,032940,/news/news_read.nhn?article_id=0003386370&office_id=018&mode=search&query=원익&page=1,2015-11-05 11:30,"한화자산운용, 원익머트리얼즈 지분 5.4% 보유 중",[이데일리 임성영 기자] 한화자산운용은 원익머트리얼즈(104830) 지분 5.4%(33만4114주)를 보유하고 있다고 5일 공시했다.
한국경제,032940,/news/news_read.nhn?article_id=0003923078&office_id=015&mode=search&query=원익&page=1,2018-04-13 08:35,"신한금투 &quot;원익머트리얼즈, 올해 사상 최대 실적 낼 것&quot;","[ 송종현 기자  ] 신한금융투자는 코스닥 상장 반도체 기업인 원익머트리얼즈가 올해 사상 최대 실적을 낼 것이라고 13일 전망했다. 신한금융투자는 이 회사의 올해 매출과 영업이익이 각각 작년보다 18.6%와 34.3% 증가한 2409억원과 442억원을 기록할 것이라고 설명했다. 최도연 신한금융투자 연구원은 “삼성전자의 D램, 3D낸드 증설 효과를 톡톡히 볼 것”이라고 말했다."
