source,symbol,link,date,title,content
SBS CNBC,036460,/news/news_read.nhn?article_id=0000154123&office_id=374&mode=search&query=한국가스공사&page=11,2018-03-22 11:03,"백경비엠에스, 한국가스안전공사와 업무협약","부동산컨설팅기업 백경비엠에스가 한국가스안전공사와 기업부동산 자문서비스의 업무협약을 체결했다고 밝혔다. 업무협약식은 지난 19일 서울 역삼동 백경비엠에스 본사에서 백경비엠에스 문만수 대표를 비롯해 한국가스안전공사 장석봉 행정지원처장 등 10여명이 참석한 가운데 진행됐다. 이번 업무협약에 따라 백경비엠에스는 공사 보유 부동산 자산의 운용 및 관리, 신규 투자와 개발사업의 자문서비스를 제공할 예정이다. 이와 함께 ▲부동산 관련 신규 투자 및 개발사업 ▲보유 사옥 및 사택의 운용방안 ▲부동산 자산의 리스크 관리 등을 협력, 다양한 사업영역을 강화하여 운영할 방침이다. 한국가스안전공사 측은 “최근 부동산 자산의 증가 및 관련 법규의 지속적 개정 등으로 전문 기업의 자문서비스에 대한 필요성이 증가하였다”고 밝히며, 국내 공공기관 부동산 투자자문 전문기업인 백경비엠에스의 자문서비스가 큰 도움이 될 것이라고 기대감을 드러내었다. 백경비엠에스 문만수 대표는 ""이번 업무협약을 통해 한국가스안전공사는 공공기관 기업부동산 운용 및 관리부문에서 역량을 강화할 수 있게 되었다""며 ""양사의 동반성장 및 발전을 위한 전략을 더욱 모색하겠다""고 하였다. 한편 백경비엠에스는 △코레일유통 개발사업컨설팅 △한국고전번역원 종전부동산 매각자문 컨설팅 △한국주류산업협회 부동산 자산운용 컨설팅 △한국건설기술인협회 최유효활용방안 컨설팅 등을 수행해온 공공기관 부동산 투자자문 전문 기업이다. 2017년 공공기관 부동산 자문 및 컨설팅 서비스분야 1위를 차지했으며 최근에는 프리미엄 종합 부동산 서비스를 제공하기 위해 '백경비엠에스 밸류크리에이터' 브랜드를 론칭하였다. 백경비엠에스 밸류크리에이터는 부동산의 기획, 매입부터 운영, 매각, 처분까지 건물의 생애주기 전반에 걸쳐 다양한 서비스를 원스톱으로 제공한다."
머니투데이,036460,/news/news_read.nhn?article_id=0004026813&office_id=008&mode=search&query=한국가스공사&page=11,2018-03-22 12:44,"백경비엠에스, 한국가스안전공사와 부동산자문 협약 체결","[머니투데이 중기&창업팀 이상연 기자] 국내 공공기관 부동산 투자자문 및 컨설팅 선도 기업 ‘백경비엠에스’는 한국가스안전공사와 기업부동산 자문서비스 업무협약을 체결하고, 공사 보유 부동산 자산의 운용 및 관리, 신규 투자와 개발사업의 자문서비스를 제공한다고 밝혔다. 문만수 백경비엠에스 대표이사(좌)와 장석봉 한국가스안전공사 행정지원처장(우)의 업무협약식 모습/사진제공=백경비엠에스 지난 3월 19일 서울 강남구 역삼동 백경비엠에스 본사에서는 백경비엠에스 문만수 대표이사, 한국가스안전공사 장석봉 행정지원처장 등 10여명이 참석한 가운데 기업부동산 자문서비스 업무제휴 협약식이 진행되었다. 양사는 이 자리에서 ▲부동산 관련 신규 투자 및 개발사업 ▲보유 사옥 및 사택의 운용방안 ▲부동산 자산의 리스크 관리 등의 부문에서 협력을 더욱 강화해 나가기로 협의하였다. 관계자 설명에 따르면 한국가스안전공사가 기업 부동산 자문서비스 업무협약을 체결한 배경에는 최근 부동산 자산의 증가 및 관련 법규의 지속적 개정 등으로 인하여 전문 기업의 자문서비스에 대한 필요성이 커졌기 때문이다. 백경비엠에스 문만수 대표이사는 “한국가스안전공사의 기업부동산 운용 및 관리부문 역량이 강화될 수 있도록 돕겠다”면서 “기업 부동산 본연의 역할인 공공성 기여와 함께 최유효활용 자문서비스를 제공할 것”이라고 하였다. 백경비엠에스는 코레일유통 개발사업컨설팅, 한국고전번역원 종전부동산 매각자문 컨설팅, 한국주류산업협회 부동산 자산운용 컨설팅, 한국건설기술인협회 최유효활용방안 컨설팅 등을 수행한 바 있다."
한국경제,036460,/news/news_read.nhn?article_id=0003663241&office_id=015&mode=search&query=한국가스공사&page=49,2016-10-04 10:00,"한국가스공사, 협력업체 유치 전무, 이전효과 미미...곽대훈의원 지적","[ 오경묵 기자  ] 한국가스공사가 대구로 이전(2014년 10월)한지 2년이 지났으나 가스공사의 대구이전 효과가 매우 미미한 것으로 나타났다고 곽대훈 의원이 지적했다. 국회 산업통상자원위원회 곽대훈 (새누리, 대구 달서갑)의원의 국정감사 자료에 따르면 한국가스공사가 산학연 협력사업에 참여한 사업이 ‘그린에너지 산업 전문인력 양성사업(4억)’ 단 1건에 불과한 것으로 나타났고 이 사업 마저도 한국 산업기술진흥원 평가결과 c등급을 받았다.  반면 나주로 이전한 한국전력은 나주 지역에 1624억원을 투입해여 ‘빛가람 에너지밸리 조성사업’을 추진 중에 있어 대비된다고 곽 의원은 지적했다. 공공기관 지방이전에 따른 혁신도시 건설 및 지원에 관한 특별법에 따라 각 지자체는 산학연 클러스터 용지 조성 및 기업, 대학, 연구소, 공공기관 등의 기관이 서로 긴밀하게 협력할 수 있는 산학연 클러스터 구축계획을 수립하도록 하고 있고 이 계획에 이전 공공기관은 반드시 참여하도록 하고 있다. 또한 대구 혁신도시 내 산학연 클러스터가 활성화되기 위해서는 한국가스공사의 관련회사 및 협력업체들의 동반이전이 함께 논의되어야 함에도 가스공사는 유관 미관 및 협력업체 유치 실적이 전무하고, 유치계획 조차도 수립되어 있지 않다. 2015년 지역발전위원회 자료에 따르면 진주로 이전한 한국세라믹기술원은 5개 업체를 이전시켰고 나주로 이전한 한전 KDN은 16개 업체를 혁신도시로 유치했다. 또  한국전력 또한 210개 협력업체를 유치시킨 것으로 나타났다. 곽의원은 이에따라 대구와 광주전남의 혁신 도시 내 클러스터 분양률도 차이가 많이 나타났다고 지적했다. 대구는 분양률이 48.3%인 반면, 광주 전남은 62.7%에 달하는 것으로 나타났다. 곽 의원은 “ 타 기관은 협력업체를 해당지역을 적극 유치하고 있으나, 가스공사는 출자회사 4곳도 대구로 옮기지 않고 있는 등 타 공공기관에 비해 대구 경제 활성화 의지가 미흡해 보인다”며 ""출자 회사 4곳을 포함해 협력업체들의 대구 이전 계획을 조속히 수립해 실행에 옮기고 산학연 클러스터 사업도 예산과 사업수를 늘려야 할 것”이라고 말했다.  오경묵 기자"
전자신문,036460,/news/news_read.nhn?article_id=0002693196&office_id=030&mode=search&query=한국가스공사&page=11,2018-03-22 14:14,"[ET투자뉴스]의약품업종/전기가스업종 강세_명문제약,한국가스공사 두드러져","  코스피지수가 일단의 매수세가 유입되어 장중 상승탄력이 커지고 있는 가운데(2500.59p/+15.62p) 의약품업종과 전기가스업종 등에서 상승세가 전개되고 있다. 22일 오후 2시10분 현재 코스피시장에서 업종별 등락현황을 살펴보면, 의약품업종(2.46%)과 전기가스업종(1.55%)등이 상승폭을 키우고 있는 것으로 나타났고 반대로 운수창고업종(-1.3%)과 종이목재업종(-1.15%)등은 하락률이 큰 것으로 집계되었다. 상승률이 가장 큰 의약품업종지수는 전일에 이어 오늘도 상승하면서 또한번 연중최고치를 갈아치우는 모습인데, 향후 추가적인 강세트렌드가 진행될 가능성을 보여주고 있다. 동업종에 대해서 외국인은 최근 매수세를 지속하고 있는데, 최근 일주일동안 외국인이 순매수한 금액은 232억원에 이른다. 기관 또한 매수에 치중한 것으로 나타났다. 동업종지수의 패턴을 분석해보면 현재위치는 전형적인 정배열 구간에서 5일, 10일, 20일, 60일, 120일, 240일 이동평균선을 상향돌파해내고 있는 모습이다.의약품업종내 주요 종목동향을 보면 명문제약이 12.92%의 상승률로 오늘 업종내에서 움직임이 활발한모습인데, 최근 해당종목에 대한 외국인의 순매도세가 나타나고 있다. 그리고 우리들제약은 5.76%, 삼성바이오로직스는 5.75%의 오름세를 보이고 있다. 한편 장중 기준으로 지금은 전기전자업종의 상승률이 가장 커지는 것으로 나타나고 있고(+0.57%), 상대적으로 의료정밀업종은 하락률이 커지고 있는 것으로 나타났다.(-0.72%) 전반적으로 코스피 지수관련 주요업종들은 상승우위를 보이고 있다. 전기전자업종은 (0.84)% 상승중이고 금융업종이 (0.8)%, 통신업종이 (0.23)% 오른 반면에 운수장비업종(-0.21%),철강금속(-0.72%)은 하락했다. 이시각 현재, 외국인은 코스피시장에서 1484억원의 순매수를 보이고 있다.  전기전자업종과 화학업종을 주로 매수하고 있고 철강금속업종과 운송장비업종 등에서는 매도우위를 보이고 있다. 이에 따라 전기전자업종내  대원전선(006340)은 7.67% 오른 1,825원을 기록하고 있으며 삼화콘덴서(001820)는 7.4% 오른 48,650원에 거래되고 있다.  한편 화학업종내에서  금호타이어(073240)와 OCI(010060)도 각각 11.46%, 10.14%의 등락폭을 보이고 있다. 상대적으로 외국인이 매도우위를 보이는 운송장비업종에서는 동양철관(008970)이 전날보다 -6.12% 낮아진 1,380원을 기록하고 있으며 동부제철(016380)과 한국특수형강(007280)은 각각 -6.07%,-5.36% 보이고 있다."
전자신문,036460,/news/news_read.nhn?article_id=0002532076&office_id=030&mode=search&query=한국가스공사&page=49,2016-10-05 10:27,"한국가스공사, 제주도 다문화가정 주택수리 봉사활동","한국가스공사(사장 이승훈) 임직원과 대학생 봉사단, 대구시사회복지협의회 직원 등 25명이 최근 2박 3일간 제주도에서 다문화가정 주택 수리 봉사활동을 펼쳤다.     자체 사회공헌 브랜드인 KOGAS ‘온(溫)누리 사업’의 일환으로, 지난달 20~22일 진행한 이번 봉사활동에서 가스공사는 제주도 온누리사업 선정가구 5곳을 기준으로 2개 다문화가정을 선정하여 창호 교체, 도배, 외벽 도색 등 주택 수리‧보수 및 생필품 전달을 실시하였다.   특히, 가스공사는 소외된 복지 사각지대를 발굴하고 이를 해소하고자 그 동안 공무출장을 통하여 적립한 항공 마일리지를 활용하여 봉사활동 대상지를 제주도로 선정하였다.   참가자들을 인솔한 한국가스공사 사회공헌팀 권오득 차장은 “봉사활동을 통하여 수혜자분들이 행복해하는 모습을 보면서 봉사에는 특별한 기술이나 힘 보다 마음이 중요하다는 것을 다시 한 번 깨달았다”고 소감을 밝혔다.   한편, 가스공사는 고유의 사회공헌 브랜드인 온누리 사업을 통해 지역사회 어울림 및 에너지 취약층 해소를 위한 노력을 활발히 전개하고 있으며, 대한민국을 대표하는 공기업으로서 사회공헌 활동에 선도적 역할을 수행하고 있다."
연합뉴스,036460,/news/news_read.nhn?article_id=0009975060&office_id=001&mode=search&query=한국가스공사&page=11,2018-03-22 14:22,"백경비엠에스-한국가스안전공사, 부동산 자문서비스 MOU","백경비엠에스 문만수 대표이사(왼쪽)와 한국가스안전공사 장석봉 행정지원처장이 지난 19일 부동산 자문서비스 MOU 체결 후 기념 촬영을 하고 있다. ▲ 부동산컨설팅기업 백경비엠에스는 지난 19일 서울 역삼동 본사에서 한국가스안전공사와 기업부동산 자문서비스 구축을 위한 업무협약(MOU)을 체결했다고 22일 밝혔다. 이날 업무 협약식에 백경비엠에스 문만수 대표이사, 가스안전공사 장석봉 행정지원처장 등 10여 명이 참석했다. 양 기관은 부동산 관련 신규 투자 및 개발사업, 보유 사옥 및 사택의 운용방안, 부동산 자산의 리스크 관리 등 다양한 사업 영역을 함께할 계획이다. 가스안전공사 관계자는 ""부동산 자산의 증가 및 관련 법규의 지속적 개정 등으로 전문 기업의 자문서비스에 대한 필요성이 커짐에 따라 이번 MOU를 체결하게 됐다""고 말했다. 백경비엠에스 문만수 대표이사는 ""이번 협약을 통해 가스안전공사는 공공기관 기업 부동산 운용 및 관리부문에서 역량을 강화할 수 있게 됐다""며 ""공사 보유 부동산 자산의 운용·관리 및 신규 투자와 개발사업의 자문서비스를 제공에 만전을 기할 것""이라고 전했다. 한편, 백경비엠에스는 코레일유통 개발사업 및 한국고전번역원 종전부동산 매각자문 컨설팅, 한국주류산업협회 부동산 자산운용 및 한국건설기술인협회 최유효 활용방안 컨설팅 등을 수행해온 공공기관 부동산 투자자문 및 컨설팅 선도기업이다. 아울러 지난 2일 프리미엄 종합 부동산 서비스를 제공하기 위해 '백경비엠에스 밸류크리에이터'를 론칭, 부동산의 기획, 매입부터 운영, 매각, 처분까지 건물의 생애주기 전반에 걸친 다양한 서비스를 원스톱으로 제공하고 있다. (연합뉴스)"
전자신문,036460,/news/news_read.nhn?article_id=0002532627&office_id=030&mode=search&query=한국가스공사&page=49,2016-10-06 08:48,"[@기업분석리포트]한국가스공사, &quot;분기 실적은 중요하&hellip;&quot; 매수(유지)-한국투자증권","한국투자증권에서 6일 한국가스공사(036460)에 대해 ""분기 실적은 중요하지 않아. 장기투자매력이 커지는 점에 주목할 때""라며 투자의견을 '매수(유지)'로 제시하였고, 아울러 목표주가로는 57,000원을 내놓았다. 한국투자증권 윤희도 애널리스트가 동종목에 대하여 이번에 제시한 '매수(유지)'의견은 한국투자증권의 직전 매매의견과 동일한 것이고 올해 초반의 매매의견을 기준으로  볼때도 역시 '매수'의견이 계속 유지되고 있는 상태이다. 그리고 최근 분기내 발표된 전체 증권사 리포트의 컨센서스와 비교를 해볼 경우에 오늘 발표된 투자의견은 전체의견에 수렴하고 있어, 이번 의견은 시장의 평균적인 기대감이 객관적으로 표현된 것으로 분석되고 있다. 목표주가의 추이를 살펴보면 이번에 다시 목표가가 같은 수준을 유지하면서 최근 흐름은 목표가의 계단식 상승이 진행되는 모습이다. 또한 전일 종가 기준으로 볼때 동종목의 현주가는 이번에 제시된 목표가 대비 28.2%의 저평가 요인이 존재한다는 해석이 제시되고 있다."
전자신문,036460,/news/news_read.nhn?article_id=0002693817&office_id=030&mode=search&query=한국가스공사&page=11,2018-03-26 09:31,"[ET투자뉴스]한국가스공사, &quot;투자보수율 확대로 &hellip;&quot; 매수(신규)-하이투자증권","하이투자증권에서 26일 한국가스공사(036460)에 대해 ""투자보수율 확대로 실적 Level-Up""라며 투자의견을 '매수(신규)'로 제시하였다. 아울러 12개월 목표주가를 63,000원으로 내놓았다. 하이투자증권 원민석 애널리스트가 동종목에 대하여 이번에 제시한 '매수(신규)'의견은 하이투자증권에서는 올해들어 처음 내놓는 매매의견이며 그리고 최근 분기내 발표된 전체 증권사 리포트의 컨센서스와 비교를 해볼 경우에 오늘 발표된 투자의견은 대체적으로 평균치에 해당하는 수준으로, 이번 의견은 동종목에 대한 전체적인 흐름에서 크게 벗어나지 않은 것으로 분석되고 있다. 또한 전일 종가 기준으로 볼때 동종목의 현주가는 이번에 제시된 목표가 대비 34.2%의 추가상승여력이 있다는 해석이 제시되고 있다."
서울경제,036460,/news/news_read.nhn?article_id=0002894960&office_id=011&mode=search&query=한국가스공사&page=49,2016-10-06 08:51,"한국가스공사, LNG&middot;자원개발 등 중장기 매력 주목-한국투자증권","한국가스공사(036460)가 3·4분기 실적 부진이 예상되지만 중장기적으로 LNG 도입·도매판매 사업과 해외 자원개발 사업 등에서 투자심리가 개선될 여지가 크다는 분석이 나왔다. 윤희도 한국투자증권 연구원은 6일 보고서에서 “한국가스공사는 3·4분기 1,296억원의 영업손실이 예상되지만 이는 감가상각비, 인건비 등은 매 분기 균등하게 발생하는데 판매량이 줄어들며 회수된 비용보다 집행된 비용이 더 많기 때문”이라며 “매년 3·4분기 반복되는 현상”이라고 밝혔다. 투자의견과 목표주가는 각각 ‘매수’, 5만7,000원을 유지했다. 대신 본업인 LNG 도입 및 도매판매 부문에 대한 관점이 긍정적으로 변할 것으로 전망했다. 그는 “지난 2년 동안 큰 폭으로 감소했던 LNG 판매량은 올해 8월까지 0.3% 감소하는데 그쳤으며 앞으로는 수요가 다시 늘 것으로 본다”며 “다시 가스공사의 적극적 투자가 가능해진다”고 지적했다. 해외자원개발 부문에서도 손상차손 이슈가 올해 유가가 점차 오른다면 사라질 것으로 윤 연구원은 전망했다."
전자신문,036460,/news/news_read.nhn?article_id=0002532643&office_id=030&mode=search&query=한국가스공사&page=49,2016-10-06 09:15,"[@기업분석리포트]한국가스공사, &quot;모잠비크 FLNG &hellip;&quot; 매수-KTB투자증권","KTB투자증권에서 6일 한국가스공사(036460)에 대해 ""모잠비크 FLNG 판매계약 체결""라며 투자의견을 '매수'로 제시하였고, 아울러 목표주가로는 60,000원을 내놓았다. KTB투자증권 신지윤 애널리스트가 동종목에 대하여 이번에 제시한 '매수'의견은 KTB투자증권의 직전 매매의견을 그대로 유지하는 것이고 올해 초반의 매매의견을 기준으로  볼때도 역시 '매수'의견이 계속 유지되고 있는 상태이다. 그리고 최근 분기내 발표된 전체 증권사 리포트의 컨센서스와 비교를 해볼 경우에 오늘 발표된 투자의견은 전체의견에 수렴하고 있어, 이번 의견은 시장의 평균적인 기대감이 객관적으로 표현된 것으로 분석되고 있다. 목표주가의 추이를 살펴보면 최근 장기간 목표가가 같은 수준에 머물고 있는 모습이다. 또한 전일 종가 기준으로 볼때 동종목의 현주가는 이번에 제시된 목표가 대비 35%의 저평가 요인이 존재한다는 해석이 제시되고 있다."
전자신문,036460,/news/news_read.nhn?article_id=0002532682&office_id=030&mode=search&query=한국가스공사&page=49,2016-10-06 10:12,"[@기업분석리포트]한국가스공사, &quot;드디어 시작되는 모&hellip;&quot; 매수-NH투자증권","NH투자증권에서 6일 한국가스공사(036460)에 대해 ""드디어 시작되는 모잠비크 가스전""라며 투자의견을 '매수'로 제시하였다. 아울러 12개월 목표주가를 58,000원으로 내놓았다. NH투자증권 이민재 애널리스트가 동종목에 대하여 이번에 제시한 '매수'의견은 NH투자증권의 직전 매매의견과 동일한 것이고 올해 초반의 매매의견을 기준으로  볼때도 역시 '매수'의견이 계속 유지되고 있는 상태이다. 그리고 최근 분기내 발표된 전체 증권사 리포트의 컨센서스와 비교를 해볼 경우에 오늘 발표된 투자의견은 전체의견에 수렴하고 있어, 이번 의견은 시장의 평균적인 기대감이 객관적으로 표현된 것으로 분석되고 있다. 한편 12개월 목표주가로 제시한 58,000원은 직전에 발표된 목표가와 대비해서 큰 변화는 없고, 목표주가의 추이를 살펴보면 최근 장기간 목표가가 같은 수준에 머물고 있는 모습이다. 또한 전일 종가 기준으로 볼때 동종목의 현주가는 이번에 제시된 목표가 대비 30.5%의 저평가 요인이 존재한다는 해석이 제시되고 있다."
부산일보,036460,/news/news_read.nhn?article_id=0000639237&office_id=082&mode=search&query=한국가스공사&page=49,2016-10-03 19:16,[에너지 공기업 특집-한국가스공사] 발로 뛰는 사회공헌 '귀감',"한국가스공사 이승훈(오른쪽) 사장이 지난달 12일 대구시사회복지협의회 이재모 회장에게 온누리상품권을 전달하고 있다. 가스공사 제공
 지난달 23일 대구 동구 신서혁신도시에 있는 한국가스공사(사장 이승훈) 본사에 평소에 안 보이던 버스 1대가 나타났다. 통근 버스도 아니고, 사원 연수용 버스도 아니었다. 이 버스의 정체(?)는 '사회 공헌 버스'. 이름조차 낯선 이 버스는 가스공사가 지역 주민을 위해 소통하겠다는 의지와 열정을 상징하는 것이다. ■주민에게 다가가는 공기업 사회 공헌 버스는 이동 수단의 원활한 접근성과 편리성을 활용해 지역 주민과 친밀도를 높이고, 소외된 이웃들의 복지 개선과 다양한 문화 체험의 기회를 확대하려고 마련됐다. 가스공사는 이 버스로 지역을 누비며 발로 뛰는 공헌 활동을 강화하고, 지역 밀착형 사회 공헌 활동을 펼친다는 당찬 포부를 갖고 있다. 사회 공헌 버스는 지역 주민들의 혁신도시 이전 공공기관 방문을 유도하고 공기업의 딱딱한 이미지에서 탈피해 주민들과의 우호 관계 형성에 이바지할 것으로 보인다. '사회공헌 버스' 운영 복지 개선·문화체험 확대 쪽방촌 폭염 모니터링 온누리상품권 6억 기탁 5·9월 시민 콘서트 호평 2014년 9월 대구로 본사를 옮긴 가스공사의 사회 공헌 활동은 이뿐이 아니다. 추석 등 명절마다 지역 주민과 다양한 행사를 펼친다. 지난달 12일에는 대구 안심종합사회복지관에서 '한가위 사랑의 송편 나누기' 행사를 개최했다. 행사에 참여한 이승훈 사장과 임직원 40여 명은 지역 홀몸 어르신들과 함께 송편을 빚으며 덕담을 나눴다. 직접 빚은 송편과 국거리 등 명절 음식을 가정에 전달하며 따스한 온정의 손길을 전했다. 가스공사는 또 저소득층을 위한 무료급식 봉사 등 소외계층 대상 사회 공헌 활동을 계속 수행하고 있다. 같은 날 가스공사는 7000만 원 상당의 온누리 상품권(전통시장 상품권)을 대구시사회복지협의회에 맡겼다. 이 상품권은 대구지역 노인복지관과 장애인 복지시설 등 80여 개 기관에 전달됐다. 상품권은 가스공사가 지난해 법인카드 사용으로 발생한 포인트를 상품권으로 바꾼 것이었다. 해마다 이어지는 온누리상품권 기탁사업은 공공기관의 사회적 책임 이행과 전통시장 활성화에 기여하고 있다. 2010년부터 현재까지 기탁한 금액은 6억 2000여만 원에 이른다. ■쪽방촌 주민 위한 폭염 모니터링까지 지역 주민을 대상으로 한 맞춤형 사회 공헌 활동도 활발하다. 지난달 21일 대구 두류공원 코오롱야외음악당에서 '제2회 대구시민을 위한 파크콘서트'가 열렸다. 지난 5월에 제1회 콘서트가 열렸는데, 시민들의 호응을 받았다. 가스공사는 이에 힘입어 시민들이 품격 있는 문화 공연을 즐길 수 있도록 지난 콘서트보다 더욱 알찬 콘텐츠를 내놓았다. 이날 공연장에는 시민 3만여 명이 모였다. 콘서트는 지역 문화예술단체들의 사물놀이, 발레·뮤지컬에 이어 대중 가수들의 무대가 꾸려져 시민들에게 다채로운 문화공연을 선사했다. 이외에도 가스공사는 현재 지역 사회 복지 증진을 위한 맞춤형 사회 공헌 활동도 활발하게 추진하고 있다. 쪽방촌 주민을 위한 폭염 모니터링, 동절기 난방비 지원 등 에너지 복지 사업도 큰 폭으로 확대할 예정이다. 이승훈 사장은 ""지역 아동들을 위한 어린이 장난감 도서관 개소, 지역인재 채용 등 지역사회의 이슈와 요구를 반영한 사회 공헌 사업 외에도 협력 사업을 더욱 확대해 나갈 계획이다""고 말했다. 전대식 기자"
