source,symbol,link,date,title,content
전자신문,036460,/news/news_read.nhn?article_id=0002599511&office_id=030&mode=search&query=한국가스공사&page=34,2017-04-11 08:51,"[ET투자뉴스]한국가스공사, &quot;놀랄 만한 보장이익&hellip;&quot; 매수(분석재개)-한국투자증권","한국투자증권에서 11일 한국가스공사(036460)에 대해 ""놀랄 만한 보장이익 증가세가 이어진다""라며 투자의견을 '매수(분석재개)'로 제시하였고, 아울러 목표주가로는 62,000원을 내놓았다. 한국투자증권 강승균 애널리스트가 동종목에 대하여 이번에 제시한 '매수(분석재개)'의견은 한국투자증권의 직전 매매의견에서 큰 변화없이 그대로 유지되는 것이고  올해 초반의 시장컨센서스에 비추어 본다면 '매수'의견에서 '매수(분석재개)로' 상향조정된 것이다. 그리고 최근 분기내 발표된 전체 증권사 리포트의 컨센서스와 비교를 해볼 경우에 오늘 발표된 투자의견은 대체적으로 평균치에 해당하는 수준으로, 이번 의견은 동종목에 대한 전체적인 흐름에서 크게 벗어나지 않은 것으로 분석되고 있다. 목표주가의 추이를 살펴보면 한동안 정체구간을 보낸 후 이번에 오랜만에 목표가가 상향조정된 모습이다. 또한 전일 종가 기준으로 볼때 동종목의 현주가는 이번에 제시된 목표가 대비 37.3%의 추가상승여력이 있다는 해석이 제시되고 있다."
전자신문,036460,/news/news_read.nhn?article_id=0002731573&office_id=030&mode=search&query=한국가스공사&page=1,2018-08-09 13:08,"[ET투자뉴스]한국가스공사, &quot;2Q 흑자전환, 하&hellip;&quot; 매수(유지)-신한금융투자","신한금융투자에서 9일 한국가스공사(036460)에 대해 ""2Q 흑자전환, 하반기 실적개선 지속""라며 투자의견을 '매수(유지)'로 제시하였고, 아울러 목표주가로는 77,000원을 내놓았다. 신한금융투자 허민호 애널리스트가 동종목에 대하여 이번에 제시한 '매수(유지)'의견은 신한금융투자의 직전 매매의견을 그대로 유지하는 것이고 올해 초반의 매매의견을 기준으로  볼때도 역시 '매수'의견이 계속 유지되고 있는 상태이다. 그리고 최근 분기내 발표된 전체 증권사 리포트의 컨센서스와 비교를 해볼 경우에 오늘 발표된 투자의견은 대체적으로 평균치에 해당하는 수준으로, 이번 의견은 동종목에 대한 전체적인 흐름에서 크게 벗어나지 않은 것으로 분석되고 있다. 목표주가의 추이를 살펴보면 최근 3회이상 지속적으로 상향조정되고 있는데, 이번에는 목표가의 상승폭이 다소 줄어드는 모습이다. 또한 전일 종가 기준으로 볼때 동종목의 현주가는 이번에 제시된 목표가 대비 38.7%의 추가상승여력이 있다는 해석이 제시되고 있다."
한국일보,036460,/news/news_read.nhn?article_id=0000208340&office_id=469&mode=search&query=한국가스공사&page=29,2017-06-13 06:02,희망! 국민의 기업이 뛴다 - 한국가스공사,"해외사업 호전… 1분기 5001억 깜짝 순익 안전하고 안정적인 천연가스 공급을 위해 최선을 다하고 있는 한국가스공사 직원들 한국가스공사가 연결재무제표 기준으로 올해 1분기 매출액 7조7,182억원, 영업이익과 당기순이익은 각각 8,267억원, 5,001억원을 달성했다. 가스공사는 그동안 적극적인 사업효율화를 통해 차입금 감소, 판매량 증가, 해외사업 이익 증가 등의 성과를 거두었으나 판매단가 하락(-0.34원/MJ) 등에 기인하여 매출액이 전년동기대비 0.6% 감소했다. 하지만 올해 하반기 이후에는 투자보수액 증가 등이 국내 도매사업 실적에 반영되어, 2017년 연간 영업이익은 전년보다 증가할 것으로 예상된다. 미수금은 1분기에 4,163억원을 회수했고, 잔여 미수금 5,454억원은 연내에 전액 회수할 계획이다. 한편, 부채비율은 지난해 말 325.4%에서 올해 1분기 현재 301.6%로 줄어, 꾸준한 재무구조 개선활동의 노력이 빛을 발하고 있다. 가스공사의 1분기 해외사업 주요 현황 및 성과를 보면, 이라크 주바이르 사업은 일일생산량이 늘어 영업이익이 전년동기보다 45억원 늘어난 305억원에 달했다. 이라크 바드라 사업은 2014년 9월 상업생산을 개시한 이래 생산량이 단계적으로 증가하고 있으며, 올해 1분기에도 일일생산량이 크게 증가하여 영업이익은 전년동기보다 107억원 늘어난 118억원을 기록했다. 호주 GLNG 사업은 올해 1분기에 22카고(약130만 톤)를 생산하여 948억원의 매출을 올렸고, 영업손실은 국제유가 상승과 생산량 증가 등에 힘입어 107억원에 그쳐 전년동기보다 83억원 줄었다. 우즈벡 수르길 사업은 본격적인 생산에 진입하여 안정적인 수익 발생이 기대되며 올해 1분기에 지분법 이익 79억원이 예상된다. 특히, 가스전과 화학플랜트에서의 점진적인 생산량 증가에 힘입어 2041년까지 연평균 500억원 이상의 수익 창출이 기대된다."
이데일리,036460,/news/news_read.nhn?article_id=0003822090&office_id=018&mode=search&query=한국가스공사&page=32,2017-05-11 17:11,"한국가스공사, 1분기 영업익 8267억원..전년비 7.5%&darr;","[이데일리 신정은 기자] 한국가스공사(036460)는 올해 1분기 잠정 영업이익이 8267억원으로 작년 동기 대비 7.5% 감소했다고 11일 공시했다. 매출은 7조7182억원, 당기순이익은 5100억원으로 각각 0.6%, 2.18% 줄었다."
이데일리,036460,/news/news_read.nhn?article_id=0003749814&office_id=018&mode=search&query=한국가스공사&page=39,2017-02-15 09:09,"한국가스공사, E&amp;P 손상반영으로 실적 둔화-키움","[이데일리 윤필호 기자] 키움증권은 15일 한국가스공사(036460)에 대해 작년 4분기 가스 판매량 증가에도 불구하고 해외 석유개발(E&P) 손상 반영으로 실적이 둔화됐다고 밝혔다. 다만 목표주가는 그동안 주가변동을 감안해 기존 4만6000원에서 5만원으로 상향 조정했고 투자의견은 ‘시장수익률’(market perform)을 유지했다. 김상구 키움증권 연구원은 “지난해 4분기 실적은 매출액 6조1785억원, 영업이익 2197억원으로 전년동기대비 수익성이 크게 둔화됐다”며 “통상임금 관련 인건비 204억원과 이라크 프로젝트 관련 세금 316억원, 저소득층 요금할인 140억원 등 비용증가에 기인하고 있다”고 분석했다. 이어 “대규모 순적자 원인은 해외 E&P 자산손상 반영에 기인한다”며 “GLNG(글레드스톤액화천연가스) 4204억원, 아카스 3335억원 등 총8247억원의 손상이 반영됐다”고 설명했다. 김 연구원은 “12월 이후 월성원전과 신규 기저발전 가동으로 인해 발전용 가스수요는 전년수준을 다소 하회할 것”이라며 “중장기적으로는 LNG(액화천연가스) 직도입과 IPP(민자발전사업) 상업운전에 따라 발전용 수요 감소 가능성이 있다”고 전망했다. 그는 “안정적인 국내사업보다는 해외 E&P 성과가 변수로 판단된다”며 “손상반영으로 GLNG 감가상각비용이 분기당 50억원 감소할 것으로 예상되며 올해 생산량은 20% 증가할 것”이라고 내다봤다. 김 연구원은 “상반기모잠비크 FID(최종투자결정) 등 신규프로젝트가 시작될 것”이라며 “2022년 생산이 시작돼 유가상승시점까지는 제한적인 영향을 미칠 것”이라고 전망했다."
서울경제,036460,/news/news_read.nhn?article_id=0003057799&office_id=011&mode=search&query=한국가스공사&page=28,2017-06-23 13:53,"대한해운, 한국가스공사와 1조 규모 수송계약 체결","[서울경제] 23일 대한해운(005880)은 한국가스공사와 1조2,669억4,766만9,882원 규모의 LNG 전용선 수송계약을 체결했다고 공시했다. 계약기간은 내년 4월 25일부터 2037년 5월 30일까지다."
부산일보,036460,/news/news_read.nhn?article_id=0000722872&office_id=082&mode=search&query=한국가스공사&page=27,2017-07-11 17:06,"한국가스공사, 취약계층 어린이 의료비 2억 원 지원","한국가스공사는 11일 대구 경북대 어린이병원에 취약계층 의료비 지원을 위해 2억 원을 기탁했다고 밝혔다. 이날 전달식(사진)에는 김점수 가스공사 기획본부장, 권순학 경북대 어린이병원장 등 관계자들이 참석했다. 가스공사는 2013년부터 매년 경북대 어린이병원에 취약계층 수술비 지원 등을 위해 1억 원을 기탁해왔다. 올해는 지원 금액을 2억 원으로 확대했으며, 이 기탁금은 희귀난치성환자, 중증장애환자 등 대구지역 취약계층 어린이 치료비 등으로 사용된다."
한국경제TV,036460,/news/news_read.nhn?article_id=0000559142&office_id=215&mode=search&query=한국가스공사&page=28,2017-06-30 10:57,"한국가스안전공사, 한ㆍ일 가스용품 기술교류 및 협력 강화","[한국경제TV 반기웅 기자] 한국가스안전공사와 일본 가스기기검사협회는 지난 28일부터 30일까지 일본 하코네에서 한ㆍ일 가스용품 기술교류와 협력 강화를 위한 '제22회 한일 인증ㆍ기술 교류 정기회의'를 열었습니다. 이번 회의에서 두 기관은 에너지정책 및 에너지효율기기 보급추진사항에 대한 자료를 공유하고 수입제품 공장심사, 가스제품 품질비교평가 등 현안사항에 대해 여러 의견을 나눴습니다. 한편 두 기관은 지난 정기회의에서 의견을 교환한 이동식부탄연소기 국제표준을 제정하기 위해 공동으로 초안을 작성하고 사업에 대한 마무리 절차를 밟고 있습니다. 이동식부탄연소기 국제표준이 제정되면 사고예방을 위한 안전관리가 강화되고, 국제표준 수준의 기술력을 보유한 국내 업체의 수출이 활성화 될 것으로 두 기관은 기대하고 있습니다. 한편, 일본가스기기검사협회는 지난 1967년에 설립된 경제산업성 산하 일반재단법인으로, 가스용품의 안전성 및 성능ㆍ품질에 대한 검사ㆍ인증업무를 수행하고 있습니다."
이데일리,036460,/news/news_read.nhn?article_id=0003768566&office_id=018&mode=search&query=한국가스공사&page=37,2017-03-09 18:21,"대우건설, 한국가스공사가 2000억 규모 손해배상 소송 제기",[이데일리 임성영 기자] 대우건설(047040)은 한국가스공사가 대구지방법원에 2000억원 규모의 손해배상 청구 소송을 제기했다고 9일 공시했다. 피고는 대우건설을 포함한 13개사다. 회사측은 “법률대리인을 선임해 법적인 절차에 따라 적극적으로 대응할 예정”이라고 밝혔다.
전자신문,036460,/news/news_read.nhn?article_id=0002599096&office_id=030&mode=search&query=한국가스공사&page=34,2017-04-10 08:39,"[ET투자뉴스]한국가스공사, &quot;적정투자보수 전망치&hellip;&quot; HOLD(하향)-KB증권","KB증권에서 10일 한국가스공사(036460)에 대해 ""적정투자보수 전망치 하향 조정""라며 투자의견을 'HOLD(하향)'로 제시하였고, 아울러 목표주가로는 53,000원을 내놓았다. KB증권 강성진, 정혜정, 안예원 애널리스트가 동종목에 대하여 이번에 제시한 'HOLD(하향)'의견은 KB증권의 직전 매매의견인 '매수(유지)'에서 한단계 내려앉은 것이고 반면에 연초반의 매매의견을 기준으로 볼때에도 역시 '매수'의견에서 'HOLD(하향)로' 레벨다운된 것이다. 그리고 최근 분기내 발표된 전체 증권사 리포트의 컨센서스와 비교를 해볼 경우에 오늘 발표된 투자의견은 전체의견 대비해서 비교적 낮은 수준으로 평가되는데,  이는 동종목에 대한 기대감을 다소 약하게 표현한 것으로 분석되고 있다. 목표주가의 추이를 살펴보면 과거 상향조정되어오던 패턴이 한차례 정체구간을 보낸 후에 이번에 비교적 조정폭이 크게 줄어든 모습이다. 또한 전일 종가 기준으로 볼때 동종목의 현주가는 이번에 제시된 목표가 대비 15%의 추가상승여력이 있다는 해석이 제시되고 있다."
아시아경제,036460,/news/news_read.nhn?article_id=0004012634&office_id=277&mode=search&query=한국가스공사&page=29,2017-06-12 17:55,"한국가스공사, 5월 천연가스 판매량 173.6만t&hellip;전년比 8.9%&darr;","[아시아경제 송화정 기자]한국가스공사는 지난달 천연가스 판매량이 전년 동월 대비 8.9% 감소한 173만6000t을 기록했다고 12일 공시했다. 도시가스용은 1.5% 증가한 99만5000t, 발전용은 20.1% 감소한 73만9000t를 기록했고 기타 판매량이 2000t이었다."
연합뉴스,036460,/news/news_read.nhn?article_id=0009034465&office_id=001&mode=search&query=한국가스공사&page=39,2017-02-15 08:56,한화투자 &quot;한국가스공사 해외사업 수익성 개선될 것&quot;,"(서울=연합뉴스) 권수현 기자 = 한화투자증권은 한국가스공사가 지난해 해외자원개발 사업의 손상차손 반영으로 실적이 저조했으나 올해는 해외사업 수익성이 개선될 것이라면서 15일 목표주가를 5만5천원에서 6만원으로 상향 조정했다.    신현준 한화투자증권 연구원은 ""한국가스공사가 호주 글래드스톤액화천연가스(GLNG)와 이라크 아카스 등 해외 부실 프로젝트의 손상차손을 반영해 작년 한 해 6천736억원의 당기순손실을 냈다""면서도 ""올해는 해외사업 수익성이 개선되면서 이익 증가 폭이 커질 것""이라고 전망했다. 신 연구원은 ""해외 부실자산 손상처리로 연간 200억원 수준의 감가상각비 절감 효과가 있겠고 호주 GLNG 프로젝트는 유가가 50달러 수준을 유지하고 생산량이 목표 수준을 달성하면 손익분기점을 넘어설 것""으로 기대했다. 그는 ""이런 해외 자원개발 사업 수익성 개선에 요금 기저 조정에 따른 영업이익 증가를 고려할 때 주가 상승 여력이 충분하다""고 판단했다."
전자신문,036460,/news/news_read.nhn?article_id=0002731517&office_id=030&mode=search&query=한국가스공사&page=2,2018-08-09 11:32,"[ET투자뉴스]한국가스공사, &quot;3년 만에 2Q 영&hellip;&quot; BUY-하나금융투자","하나금융투자에서 9일 한국가스공사(036460)에 대해 ""3년 만에 2Q 영업흑자 달성""라며 투자의견을 'BUY'로 제시하였고, 아울러 목표주가로는 74,000원을 내놓았다. 하나금융투자 유재선 애널리스트가 동종목에 대하여 이번에 제시한 'BUY'의견은 하나금융투자의 직전 매매의견에서 큰 변화없이 그대로 유지되는 것이고  올해 초반의 매매의견을 기준으로  볼때도 역시 '매수'의견이 계속 유지되고 있는 상태이다. 그리고 최근 분기내 발표된 전체 증권사 리포트의 컨센서스와 비교를 해볼 경우에 오늘 발표된 투자의견은 전체의견에 수렴하고 있어, 이번 의견은 시장의 평균적인 기대감이 객관적으로 표현된 것으로 분석되고 있다. 목표주가의 추이를 살펴보면 최근 장기간 목표가가 같은 수준에 머물고 있는 모습이다. 또한 전일 종가 기준으로 볼때 동종목의 현주가는 이번에 제시된 목표가 대비 33.3%의 저평가 요인이 존재한다는 해석이 제시되고 있다."
파이낸셜뉴스,036460,/news/news_read.nhn?article_id=0003776763&office_id=014&mode=search&query=한국가스공사&page=39,2017-02-15 08:38,"&quot;한국가스공사, 해외자원개발 턴어라운드 가능성 높아&quot;-미래에셋대우","미래에셋대우는 15일 한국가스공사에 대해 해외자원개발부문의 턴어라운드 가능성이 높아 실적개선이 가능할 것으로 내다봤다. 투자의견 매수와 목표주가 6만원을 유지했다. 류제현 연구원은 ""대규모 상각으로 인해 감가상각비가 감소하고, 최근 유가 안정화와 증산 에 따라 주바이르와 미얀마, GLNG 등 주요 프로젝트의 이익이 개선될 것으로 예상된다""며 이같이 분석했다. 류 연구원은 주요 프로젝트에서의 영업이익이 2016년 약 900억원에서 2017년 2000억원 수준으로개선될 것으로 기대하고 있다. 다만 한국가스공사는 4·4분기 일회성 요인이 대거 반영되면서 실적이 하락했다. 한국가스공사의 4·4분기 매출액은 4.7% 전년대비 감소한 6조 1786억원을 기록했다. 도시가스 판매량과 발전용 가스 판매량이 각각 7.5% YoY, 30.4% YoY 증가하면서 전체 판매량이 17.0% YoY 증가했다. 하지만 유가 하락에 따른 도입가 하락으로 가스 판가가 약 20% YoY 하락하면서 매출 하락이 나타났다. 영업이익은 2197억원으로 22.6% YoY 감소했다. 이는 미래에셋대우 추정치(2926억원) 및 시장기대치(3101억원)을 하회하는 것이다. 여기에는 약 700억원에 달하는 일회성 요인이 작용했다. 강 연구원은 ""실망스러운 실적으로 밸류에이션이 상승한 만큼 일시적으로 주가가 부진할 수 있다""며 ""실적개선이 가능할 것으로 보이며 유가도 반등세를 보이고 있어 장기적인 주가 상승 추세는 유효할 것""으로 기대했다."
부산일보,036460,/news/news_read.nhn?article_id=0000681640&office_id=082&mode=search&query=한국가스공사&page=37,2017-02-24 17:03,"한국가스공사, 천연가스 주배관 정밀검사 실시&hellip; 올해 440㎞ 대상","한국가스공사의 배관 정밀검사 로봇 '인텔리전트 피그'. 한국가스공사 제공.
 한국가스공사(사장 이승훈)는 24일 전북 익산과 전주에 걸친 천연가스 주배관 20㎞에 대한 배관 검사를 시행해 안전성에 이상이 없음을 확인했다고 밝혔다. 가스공사는 현재 전국 약 4672㎞에 달하는 천연가스 주배관을 운영하고 있으며, 이 중 10년 이상 장기운영배관에 대한 안전성 검사를 위해 매년 주배관 약 300㎞을 정밀검사하고 있다. 올해엔 지난해에 비해 검사구간을 50% 가량 확장시켜 약 440㎞를 검사할 계획이다. 가스공사의 배관검사는 배관 내외부의 물리적 결함 및 부식 등을 확인하기 위한 배관 내부 주행형 로봇을 활용하고 있다. 또한 검사 결과에 따라 배관 보수 및 교체 등을 통해 배관의 수명과 안전성을 연장하게 된다."
전자신문,036460,/news/news_read.nhn?article_id=0002607997&office_id=030&mode=search&query=한국가스공사&page=32,2017-05-12 09:53,"[ET투자뉴스]한국가스공사, &quot;연말을 위해 저축한&hellip;&quot; 매수-KTB투자증권","KTB투자증권에서 12일 한국가스공사(036460)에 대해 ""연말을 위해 저축한 셈""라며 투자의견을 '매수'로 제시하였고, 아울러 목표주가로는 66,000원을 내놓았다. KTB투자증권 신지윤 애널리스트가 동종목에 대하여 이번에 제시한 '매수'의견은 KTB투자증권의 직전 매매의견과 동일한 것이고 올해 초반의 매매의견을 기준으로  볼때도 역시 '매수'의견이 계속 유지되고 있는 상태이다. 그리고 최근 분기내 발표된 전체 증권사 리포트의 컨센서스와 비교를 해볼 경우에 오늘 발표된 투자의견은 전체의견에 수렴하고 있어, 이번 의견은 시장의 평균적인 기대감이 객관적으로 표현된 것으로 분석되고 있다. 목표주가의 추이를 살펴보면 한동안 정체구간을 보낸 후 이번에 오랜만에 목표가가 상향조정된 모습이다. 또한 전일 종가 기준으로 볼때 동종목의 현주가는 이번에 제시된 목표가 대비 41.3%의 저평가 요인이 존재한다는 해석이 제시되고 있다."
전자신문,036460,/news/news_read.nhn?article_id=0002731477&office_id=030&mode=search&query=한국가스공사&page=2,2018-08-09 10:43,"[ET투자뉴스]한국가스공사, &quot;국내외 실적 개선세&hellip;&quot; BUY(MAINTAIN)-하...","하이투자증권에서 9일 한국가스공사(036460)에 대해 ""국내외 실적 개선세 지속으로 흑자전환에 성공""라며 투자의견을 'BUY(MAINTAIN)'로 제시하였고, 아울러 목표주가로는 69,000원을 내놓았다. 하이투자증권 원민석 애널리스트가 동종목에 대하여 이번에 제시한 'BUY(MAINTAIN)'의견은 하이투자증권의 직전 매매의견에서 큰 변화없이 그대로 유지되는 것이고  올해 초반의 매매의견을 기준으로  볼때도 역시 '매수'의견이 계속 유지되고 있는 상태이다. 그리고 최근 분기내 발표된 전체 증권사 리포트의 컨센서스와 비교를 해볼 경우에 오늘 발표된 투자의견은 전체의견에 수렴하고 있어, 이번 의견은 시장의 평균적인 기대감이 객관적으로 표현된 것으로 분석되고 있다. 목표주가의 추이를 살펴보면 최근 한차례 레벨업 된 이후 이번에는 직전 수준을 유지하는 모습이다. 또한 전일 종가 기준으로 볼때 동종목의 현주가는 이번에 제시된 목표가 대비 24.3%의 저평가 요인이 존재한다는 해석이 제시되고 있다."
한국경제,036460,/news/news_read.nhn?article_id=0003767479&office_id=015&mode=search&query=한국가스공사&page=32,2017-05-12 10:00,"한국가스공사, 4월 가스 판매량 213만t&hellip;전년比 1.8%&uarr;",[ 오정민 기자  ] 한국가스공사는 4월 천연가스 판매량이 213만2000t으로 전년 동월 대비 1.8% 늘었다고 12일 공시했다. 세부적으로 도시가스용 가스 매출은 130만9000t으로 7.4% 증가했다. 발전용 가스 판매량은 82만3000t으로 6.1% 감소했다.
전자신문,036460,/news/news_read.nhn?article_id=0002731568&office_id=030&mode=search&query=한국가스공사&page=2,2018-08-09 13:07,"[ET투자뉴스]한국가스공사, &quot;편안한 항해&hellip;&quot; BUY-KTB투자증권","KTB투자증권에서 9일 한국가스공사(036460)에 대해 ""편안한 항해""라며 투자의견을 'BUY'로 제시하였고, 아울러 목표주가로는 68,000원을 내놓았다. KTB투자증권 신지윤 애널리스트가 동종목에 대하여 이번에 제시한 'BUY'의견은 KTB투자증권의 직전 매매의견을 그대로 유지하는 것이고 올해 초반의 매매의견을 기준으로  볼때도 역시 '매수'의견이 계속 유지되고 있는 상태이다. 그리고 최근 분기내 발표된 전체 증권사 리포트의 컨센서스와 비교를 해볼 경우에 오늘 발표된 투자의견은 대체적으로 평균치에 해당하는 수준으로, 이번 의견은 동종목에 대한 전체적인 흐름에서 크게 벗어나지 않은 것으로 분석되고 있다. 목표주가의 추이를 살펴보면 과거 상향조정되어오던 패턴이 최근 두차례 연속 같은 수준에 머물고 있는 모습이다. 또한 전일 종가 기준으로 볼때 동종목의 현주가는 이번에 제시된 목표가 대비 22.5%의 추가상승여력이 있다는 해석이 제시되고 있다."
MBN,036460,/news/news_read.nhn?article_id=0001135502&office_id=057&mode=search&query=한국가스공사&page=29,2017-06-14 09:58,"한국가스공사, 안심종합사회복지관 찾아 사랑나눔 봉사","한국가스공사가 어제(13일) 대구시 동구 소재 안심종합사회복지관을 찾아 사랑나눔 봉사를 실시했습니다. 가스공사는 지역사회 나눔문화 확산을 위해 각 본부조직별로 대구지역내 사회복지시설들과 1대 1로 자매결연을 맺고 정기적인 봉사활동을 펼치고 있는데, 이번에 가스공사 해외사업본부 직원 10여명이 복지관을 찾아 배식봉사 후 후원금 500만원을 전달했습니다."
한국경제TV,036460,/news/news_read.nhn?article_id=0000554566&office_id=215&mode=search&query=한국가스공사&page=29,2017-06-08 14:51,"한국가스안전공사-한국산업단지공단, 가스사고 예방 위한 업무협약 체결","[한국경제TV 반기웅 기자] 한국가스안전공사와 한국산업단지공단이 한국산업단지공단 본사에서 전국 산업단지 내 가스사고 예방을 위한 업무협약을 체결했습니다. 두 기관은 신 정부 주요 핵심공약인 '안전하고 건강한 대한민국'을 만들기 위해, 전국 산업단지 가스시설에 대한 선제적 안전관리 업무체계를 구축하고 기업지원 생태계를 조성하기 위한 업무협약 체결을 추진했습니다. 이번 업무협약을 통해 '공장설립 단계에서 가스시설 검사' 확인과  '업계에 신속한 가스정보' 제공, '안전관리 인프라 향상을 위한 업무매뉴얼' 개발을 추진됩니다. 아울러 '가스관련 법령교육 지원' 등 기술정보를 공유하고, 사업주 및 근로자 안전의식 고취를 위한 홍보활동을 전개하는 등 '가스사고 예방활동'을 공동으로 추진하기로 했습니다. 한편 한국가스안전공사 박기동 사장은 ""가스사고 예방업무를 효과적으로 수행해 산업단지 중소기업의 안전을 지원하는 대표적인 협업 사례를 만들어가겠다""고 말했습니다."
