source,symbol,link,date,title,content
한국경제TV,036460,/news/news_read.nhn?article_id=0000520135&office_id=215&mode=search&query=한국가스공사&page=42,2016-12-29 13:58,[인사] 한국가스공사,[한국경제TV 조현석 기자] ▲ 전보 및 보임 법무실장 이창균 전략기획처장 안길현 총무지원처장 박오근 LNG사업처장 정재호 인천기지본부장 홍종윤 통영기지본부장 홍영수 삼척기지본부장 이한준 삼척기지건설사무소장 지성권 서울지역본부장 김용숙 경기지역본부장 박성봉 강원지역본부장 김광수 부산경남지역본부장 성영규 기술사업단장 홍성백 연수원장 이규준 개성지사장 이동률 생산운영처장 한동근 제주기지건설단장 안형철 공급운영처장 장도열 공급건설처장 전재호 인천지역본부장 김환용 제주공급건설단장 김부용 감사총괄팀장 양재형 사무감사팀장 이정진 언론팀장 최민호 홍보팀장 이상욱 경영평가팀장 임종순 미래전략팀장 홍석주 사업기반팀장 민성기 재무기획팀장 김영석 예산팀장 신국철 재무개선팀장 배창주 총무팀장 육성형 사옥관리팀장 김승호 공사용역계약팀장 이문희 인사팀장 윤재선 인재육성팀장 정운호 보안전략팀장 주권욱 정보기획팀장 박상욱 업무정보화팀장 이규훈 시스템운영팀장 도진현 수급계획팀장 문정상 발전영업팀장 최충식 시설이용영업팀장 박효훈 요금제도팀장 손병철 중동사업팀장 주노철 호주LNG사업팀장 이학수 기술사업화팀장 김용수 EHSQ팀장 김경선 품질관리팀장 나익환 계통운영팀장 이혁 생산운영팀장 김종성 생산개선팀장 조인규 생산건설계전팀장 최강춘 생산건설토건팀장 류호진 해외생산사업팀장 김우택 해외생산기술팀장 백승기 해외공급사업팀장 김성수 해상기지사업팀장 김경희 평택기지본부 공정기술팀장 정동련 평택기지본부 안전환경팀장 박동열 평택기지본부 기계보전팀장 강성우 평택기지본부 계전보전팀장 장대식 평택기지본부 시설보전팀장 이상직 인천기지본부 지역협력팀장 정윤흥 인천기지본부 안전환경팀장 박성모 인천기지본부 설비운영1팀장 박철진 인천기지본부 설비운영2팀장 김영길 인천기지본부 기계보전팀장 한창훈 인천기지건설단 공무팀장 석융원 인천기지건설단 기계팀장 장동근 인천기지건설단 계전팀장 김형만 통영기지본부 관리팀장 김강룡 통영기지본부 안전환경팀장 김경태 통영기지본부 시설보전팀장 황영태 삼척기지본부 지역협력팀장 곽승용 삼척기지본부 계전보전팀장 김기호 삼척기지건설단 공무팀장 이상원 제주기지건설단 관리팀장 정승모 제주기기지건단 공무팀장 윤승보 제주기지건설단 기전팀장 전영길 제주기지건설단 토건팀장 장희수 공급개선팀장 김훤 서울지역본부 관리팀장 박종호 서울지역본부 안전환경팀장 이승준 서울지역본부 설비운영팀장 김동규 서울지역본부 북부지사장 강신재 인천지역본부 관리팀장 이동우 인천지역본부 안전환경팀장 남기승 인천지역본부 설비운영팀장 장혜경 인천지역본부 설비보전팀장 이병용 인천지역본부 관로보전팀장 김현문 경기지역본부 관리팀장 최남기 경기지역본부 설비운영팀장 이종복 경기지역본부 설비보전팀장 이창우 경기지역본부 중부지사장 안경환 강원지역본부 관리팀장 이영환 강원지역본부 설비보전팀장 이경호 강원지역본부 건설사무소장 양승복 충청지역본부 안전환경팀장 박지운 충청지역본부 설비운영팀장 이성춘 충청지역본부 설비보전팀장 남진창 충청지역본부 건설사무소장 구자남 전북지역본부 관리팀장 정유헌 전북지역본부 설비보전팀장 엄윤상 광주전남지역본부 안전환경팀장 배용수 광주전남지역본부 설비운영팀장 추동윤 광주전남지역본부 설비보전팀장 송정기 광주전남지역본부 관로보전팀장 김진수 광주전남지역본부 동부지사장 정광섭 대구경북지역본부 관리팀장 방명석 대구경북지역본부 설비운영팀장 박인효 대구경북지역본부 설비보전팀장 이건섭 대구경북지역본부 관로보전팀장 하광택 대구경북지역본부 동부지사장 권순근 부산경남지역본부 설비운영팀장 강권철 부산경남지역본부 관로보전팀장 곽규영석 부산경남지역본부 안전환경팀장 이기홍 부산경남지역본부 울산지사장 모정남 부산경남지역본부 서부지사장 양희범 제주공급건설단 공무팀장 장영민 제주공급건설단 공사팀장 정병용 기술기획팀장 이효진 액화설계기술팀장 정현상 연구기획팀장 이동준 연구지원팀장 장세광 연구안전환경팀장 문용수 LNG기술연구센터장 양영철 LNG계약팀장 송형진 계량관리팀장 장종일 생산진단팀장 손민
서울경제,036460,/news/news_read.nhn?article_id=0003295760&office_id=011&mode=search&query=한국가스공사&page=8,2018-05-14 09:44,"&lt;유&gt;한국가스공사, 장중 신고가 돌파.. 59,200&rarr;59,500(▲300)","[서울경제] 오전 9시 42분 현재 한국가스공사(036460) 가 5.50% 오른 59,500원(▲3,100)을 기록하며, 52주 신고가를 +300원 경신했다. 기존 52주 최고가는 2018년 05월 02일 기록한 59,200원이다. 체결강도는 396%로 강세를 유지했다. 총매수체결량은 105,514주, 총매도체결량은 26,641주를 각각 기록했다.  (※ 체결강도(%) = (총매수체결량/총매도체결량)*100) 이 시각 현재 거래대금은 77억3,737만, 거래량은 13만2,351주를 기록하고 있으며, 수급측면으로는 20(매도):80(매수)의 매수우위를 보이고 있다. 거래일을 기준으로 최근 3일간 평균 거래량은 2십9만9천주, 60일 평균 거래량 2십3만1천주로 최근 거래량이 큰 폭으로 증가하는 추세다."
전자신문,036460,/news/news_read.nhn?article_id=0002548229&office_id=030&mode=search&query=한국가스공사&page=47,2016-11-10 08:51,"[로봇뉴스]한국가스공사, &quot;숨고르기가 필요하다&hellip;&quot; TRADING BUY(유지)-미...","미래에셋대우에서 10일 한국가스공사(036460)에 대해 ""숨고르기가 필요하다""라며 투자의견을 'TRADING BUY(유지)'로 제시하였다. 아울러 12개월 목표주가를 52,000원으로 내놓았다. 미래에셋대우 류제현, 김충현 애널리스트가 동종목에 대하여 이번에 제시한 'TRADING BUY(유지)'의견은 미래에셋대우의 직전 매매의견에서 큰 변화없이 그대로 유지되는 것이고  올해 초반의 매매의견을 기준으로  볼때도 역시 '트레이딩매수'의견이 계속 유지되고 있는 상태이다. 그리고 최근 분기내 발표된 전체 증권사 리포트의 컨센서스와 비교를 해볼 경우에 오늘 발표된 투자의견은 전체의견 대비해서 소폭 낮은 수준으로서,  이는 동종목에 대한 시장의 전망을 다소 보수적으로 표현한 것으로 분석되고 있다. 한편 12개월 목표주가로 제시한 52,000원은 직전에 발표된 목표가와 대비해서 큰 변화는 없고, 목표주가의 추이를 살펴보면 최근 장기간 목표가가 같은 수준에 머물고 있는 모습이다. 또한 전일 종가 기준으로 볼때 동종목의 현주가는 이번에 제시된 목표가 대비 14%의 추가상승여력이 있다는 해석이 제시되고 있다."
파이낸셜뉴스,036460,/news/news_read.nhn?article_id=0003683518&office_id=014&mode=search&query=한국가스공사&page=51,2016-07-26 14:51,"산업은행, 한국가스공사 등과 천연가스 인프라 지원 MOU 체결","이경섭 NH농협은행장, 이동걸 사업은행 회장, 이승훈 한국가스공사 사장, 김영학 무역보험공사 사장(왼쪽부터)이 26일 서울 산업은행 여의도 본점에서 열린 '해외 천연가스 인프라 투자사업 지원 MOU체결' 후 기념 촬영하고 있다.


 산업은행은 한국가스공사, 한국무역보험공사, NH농협은행과 해외 천연가스 인프라 투자사업 발굴 및 개발에 관한 업무협약(MOU)을 체결했다고 26일 밝혔다. 협력분야는 이란, 인도네시아 등 해외 천연가스 인프라 투자사업에 관한 사업정보 공유 등이다. 또 초기 사업성 검토, 공동 투자 및 자금조달, 세미나 및 인적교류 등을 통한 업무 공유 등이다. 협약에 따라 가스공사는 전략적 투자자로서 사업정보 공유와 인프라 시설의 운영관리 역할을 맡는다. 산은은 금융자문 주선 및 재무적 투자자 역할을 한다. 무역보험공사는 저개발국가 사업에 대한 해외투자보험 제공, 농협은행은 산은과 함께 금융 지원 등을 담당한다. 해외 천연가스 시장은 수출, 고용 등 부가가치 창출 효과가 큰 사업 영역으로 최근 수주 경쟁이 치열해지면서 초기 진출 및 금융사의 지원이 중요해지고 있다. 이동걸 산은 회장은 ""금번 업무협약이 천연가스 인프라 관련 사업과 금융을 유기적으로 연계해 우리 기업의 수주 경쟁력을 한층 높일 수 있는 성공적인 협업체계가 될 것으로 기대한다""며 “우리 기업들의 해외시장 개척을 견인하고 해외 프로젝트파이낸싱(PF)업무의 외연을 더욱 확대하는 계기가 될 수 있도록 노력할 것""이라고 말했다."
서울경제,036460,/news/news_read.nhn?article_id=0002915169&office_id=011&mode=search&query=한국가스공사&page=47,2016-11-10 08:32,"한국가스공사, 자원개발부문 실적개선 둔화 - 미래에셋대우","한국가스공사(036460)가 자원개발 부문의 느린 실적 개선으로 변동성이 확대될 전망이다. 류제현 미래에셋대우(006800)증권 연구원은 10일 보고서를 통해 “한국가스공사의 자원개발부문 실적개선이 다소 둔화될 것”이라며 “단기간 반등하기도 쉽지 않을 것”이라고 관측했다. 이는 유가가 최근 산유국 감산에 대한 불확실성으로 하락했고, 이 같은 상태가 지속되면 내년 GLNG 실적 개선도 쉽지 않기 때문이다. 이밖에 이라크 아카스 가스전화 GLNG 프로젝트에 투자된 자산의 재평가가 이뤄질 가능성이 높으며 현재 추정되는 총 손상 규모는 3,000억~5,000억원 수준으로 예상된다. 3·4분기 한국가스공사의 영업이익은 -1,897억원의 적자를 기록한 바 있다. 류 연구원은 “3분기 실적 부진과 자원개발 실적 개선 속도의 불확실성으로 변동성 확대가 예상된다”며 “장기적으로는 여전히 매력적인 밸류에이션이지만 본격적인 매수 시점은 다소 늦춰질 전망”이라고 분석했다."
조선비즈,036460,/news/news_read.nhn?article_id=0000392506&office_id=366&mode=search&query=한국가스공사&page=18,2017-12-13 16:25,"한국가스공사, 11월 판매량 327만톤&hellip;전년 比 4.1% 감소","한국가스공사(036460) 는 지난달 도시가스용 191만1000톤, 발전용 136만2000톤 등 327만3000톤을 판매했다고 13일 공시했다. 이는 지난해 같은 기간보다 4.1% 감소한 수준이다."
뉴스1,036460,/news/news_read.nhn?article_id=0003105418&office_id=421&mode=search&query=한국가스공사&page=18,2017-12-18 15:29,"한국가스공사-中 CNPC, 천연가스 사업 협력 강화한다","15일 중국 베이징에서 천연가스 사업 협력 양해각서(MOU)를 체결하는 안완기 가스공사 사장 직무대리(왼쪽)와 장젠화 CNPC 사장. (가스공사 제공) © News1 (세종=뉴스1) 한종수 기자 = 한국가스공사는 중국석유천연가스공사(CNPC)와 지난 15일 천연가스 사업 협력을 위한 양해각서(MOU)를 체결했다고 18일 밝혔다. 두 기관은 모잠비크·캐나다 자원개발 사업에 공동 참여하고 있으며, 이번 협약을 계기로 천연가스 수급 안정을 위한 트레이딩, LNG 저장탱크 건설, LNG 터미널 시운전 및 교육훈련 등에 협력하기로 했다. CNPC는 원유 및 천연가스 탐사·개발, 정유, 석유화학, 천연가스 배관 건설·운영 등에 이르기까지 폭넓은 사업영역을 가진 세계적 에너지 기업으로 2017년 포춘지가 선정한 글로벌 500대 기업 중 4위를 차지했다."
KBS 뉴스,036460,/news/news_read.nhn?article_id=0010530287&office_id=056&mode=search&query=한국가스공사&page=18,2017-12-20 14:23,"공정위, 한국가스공사 7천억대 입찰 &lsquo;나눠먹기&rsquo;&hellip;과징금 921억","한국가스공사가 발주한 수천억 원대 강철 파이프 구매 입찰에서 10년 동안 담합을 통해 물량을 '나눠먹기'한 제조사들이 적발돼 검찰 고발과 과징금 처분을 받았다. 공정거래위원회는 사전에 낙찰 예정사와 가격, 물량을 합의한 6개 파이프 제조사에 시정명령과 함께 과징금 총 921억6천500만원을 부과하고 각 법인을 검찰에 고발한다고 20일 밝혔다. 적발된 업체와 과징금 규모는 세아제강(310억6천800만원), 현대제철(256억900만원), 동양철관(214억4천400만원), 휴스틸(71억4천100만원), 하이스틸(45억1천500만원), 동부인천스틸(23억8천800만원) 등이다. 이들은 2003년 1월부터 2013년 12월까지 총 33건의 입찰(계약금액 합계 7천350억원)에 참여하면서 담합했다가 적발됐다. 한국가스공사가 2000년대 초반 가스 주배관 공사를 확대하며 파이프 입찰을 확대하자, 최저가 낙찰에 따른 저가 수주를 방지하고 균등하고 안정적인 물량을 확보하기 위해 담합을 한 것으로 알려졌다. 입찰 당일 낙찰예정사로 합의된 사업자는 '들러리' 사업자에게 입찰 가격을 알려주고, 들러리 사업자들은 이 가격대로 투찰하는 방법으로 물량을 나눠먹었다. 2011년부터 입찰이 대면에서 전자 방식으로 바뀌자, 이들은 한자리에 모여 입찰하거나 낙찰예정사의 직원이 들러리사에 방문해 감시를 받으며 입찰을 했다. 공정위 관계자는 ""장기간의 고질적인 담합 관행을 시정했다는 점에서 의의가 있다""며 ""앞으로 공공 입찰 담합 감시를 더 강화할 것""이라고 말했다."
서울경제,036460,/news/news_read.nhn?article_id=0003180271&office_id=011&mode=search&query=한국가스공사&page=18,2017-12-21 17:38,"한국가스공사, 케이지미얀마 2,300억원 규모 유상증자","[서울경제] 한국가스공사(036460) 는 종속회사 케이지미얀마가 2,275억원 규모의 유상증자를 진행한다고 21일 공시했다. 신주권 교부 예정일은 오는 26일이다."
머니투데이,036460,/news/news_read.nhn?article_id=0003917638&office_id=008&mode=search&query=한국가스공사&page=26,2017-08-10 08:13,"한국가스공사, 하반기 실적 개선 기대-신한","[머니투데이 오정은 기자] 신한금융투자는 10일 한국가스공사에 대해 2분기 실적이 기대치를 밑돌았지만 하반기 실적 개선 기대감이 높다고 판단했다. 중장기 가스 사업의 가치 상승도 유력하다며 투자의견 매수, 목표주가 6만5000원을 유지했다. 허민호 신한금융투자 연구원은 ""2분기 영업적자는 342억원으로 컨센서스를 하회했다""며 ""하지만 하반기 영업이익은 전년비 798.9% 증가한 2698억원을 전망한다""고 밝혔다. 2017년 가스도매 영업이익은 적정투자보수 증가 등으로 전년비 645억원 늘 것으로 내다봤다. 이어 ""중장기 LNG 세제 인하 등 가스가격 경쟁력 회복, 판매량 증가가 기대된다""며 ""베타 및 금리 상승에 따른 투자보수율 상승 등으로 2018년 세후적정투자보수 982억원, 가스 모대 영업이익 1324억원이 증가할 전망으로 투자의견 매수를 유지한다""고 말했다. 올해 주당배당금은 1150억원, 배당수익률 2.3% 수준으로 배당 매력 회복도 기대된다고 덧붙였다. textlinktopstart textlinktopend textlinkstart"
국민일보,036460,/news/news_read.nhn?article_id=0001058365&office_id=005&mode=search&query=한국가스공사&page=18,2017-12-21 23:37,[사회 공헌으로 나눔&middot;성장-한국가스공사] 취약계층에 난방기 설치 등 에너지 복지사...,"안완기 한국가스공사 사장 직무대리(가운데)가 18일 대구MBC를 찾아 불우이웃돕기 성금 1억원을 전달하고 있다. 한국가스공사 제공 한국가스공사는 ‘좋은 에너지 더 좋은 세상’이라는 기념이념을 바탕으로 에너지 복지와 지역사회 활성화 분야에서 다양한 사회공헌 활동을 펼쳐왔다. 먼저 사회 취약계층을 위한 에너지 복지 사업 ‘온누리 사랑 프로젝트’를 진행한다. 저소득가구 및 사회복지시설의 바닥난방, 벽체단열, 창호·도배장판을 교체해 난방열효율을 개선하고 사회복지시설에 연료전지·가스냉난방기 설치를 지원하는 활동이 대표적이다. 미래세대를 육성하기 위한 ‘온누리 희망 프로젝트’도 실시한다. 국내·외 취약계층 고교·대학생을 대상으로 장학사업을 하고 전문 의료기관과 협력해 장애아동·청소년을 대상으로 재활보조기구 및 의료서비스를 지원하고 있다. 지역사회 및 세계시민과의 신뢰를 쌓는 ‘온누리 어울림 프로젝트’도 시행한다. 가스공사는 본사가 2014년 대구로 이전하면서 지역사회가 요구하는 사회공헌 활동에 집중해왔다. 상생협력 플랫폼을 조성해 지역경제를 활성화시키고 사회 공헌 사업비를 크게 늘렸다. 또 나눔문화 확산을 위한 ‘온누리 한마음 프로젝트’도 이어오고 있다. 최고경영자를 비롯한 전 임직원이 참여하는 ‘온누리 봉사단’을 주축으로 자발적 봉사 활동을 해왔다. 직원 급여 일부를 모금해 취약계층을 지원하는 온누리 펀드, 주말 가족 봉사 활동 등을 진행했다. [국민일보 홈페이지] [페이스북] [취재대행소 왱!(클릭)] GoodNews paper ⓒ"
서울경제,036460,/news/news_read.nhn?article_id=0003183210&office_id=011&mode=search&query=한국가스공사&page=18,2017-12-27 09:40,"한국가스공사 (KOGAS), 법인카드포인트 1억 7백만원, 온누리 상품권으로 기부","[서울경제] 한국가스공사(사장 직무대리 안완기)는 전임직원들이 법인카드 사용 후 쌓인 포인트 1억 7백만원을 온누리 상품권으로 교환해, 26일 대구광역시사회복지협의회(회장 이재모)에 전달했다. 본 사업추진을 위해 한국가스공사는 대구광역시사회복지협의회와 함께 대상 사회복지시설을 선정했으며, 대구지역 140여개소에 따뜻한 마음이 전달되었다. 한국가스공사는 단순한 기부를 넘어 지역 경제활성화를 위해 기부금액을 온누리상품권으로 사회복지시설에 기탁함으로써 지역의 대표적인 상생기업으로써의 역할을 했다. 대구광역시사회복지협의회 이재모 회장은 “기업이 단순한 후원금 전달에만 그치지 않고, 지역의 경제를 생각하고 카드포인트까지 기부함으로써 따뜻하고 투명한 운영의 마음을 느낄 수 있다.”며, 후원을 해준 한국가스공사 임직원들에게 감사의 마음을 전달했다.   한편, 한국가스공사(KOGAS)는 고유의 사회공헌 브랜드인 “온(溫)누리사업”을 통해 지역사회 취약계층에 대한 지원을 활발하게 전개하고 있으며 지역주민과도 상생하며 함께 호흡하고 있다."
SBS CNBC,036460,/news/news_read.nhn?article_id=0000147825&office_id=374&mode=search&query=한국가스공사&page=18,2017-12-27 09:58,"한국가스공사 (KOGAS), 법인카드포인트 1억 7백만원, 온누리 상품권 사회복지...","한국가스공사(사장 직무대리 안완기)는 전임직원들이 법인카드 사용 후 쌓인 포인트 1억 7백만원을 온누리 상품권으로 교환해, 26일 대구광역시사회복지협의회(회장 이재모)에 전달했다. 본 사업추진을 위해 한국가스공사는 대구광역시사회복지협의회와 함께 대상 사회복지시설을 선정했으며, 대구지역 140여개소에 따뜻한 마음이 전달되었다. 한국가스공사는 단순한 기부를 넘어 지역 경제활성화를 위해 기부금액을 온누리상품권으로 사회복지시설에 기탁함으로써 지역의 대표적인 상생기업으로써의 역할을 했다. 대구광역시사회복지협의회 이재모 회장은 “기업이 단순한 후원금 전달에만 그치지 않고, 지역의 경제를 생각하고 카드포인트까지 기부함으로써 따뜻하고 투명한 운영의 마음을 느낄 수 있다.”며, 후원을 해준 한국가스공사 임직원들에게 감사의 마음을 전달했다. 한편, 한국가스공사(KOGAS)는 고유의 사회공헌 브랜드인 “온(溫)누리사업”을 통해 지역사회 취약계층에 대한 지원을 활발하게 전개하고 있으며 지역주민과도 상생하며 함께 호흡하고 있다."
디지털타임스,036460,/news/news_read.nhn?article_id=0002440242&office_id=029&mode=search&query=한국가스공사&page=18,2017-12-27 10:51,"한국가스공사 (KOGAS), 법인카드포인트 1억 7백만원, 온누리 상품권 140여...","한국가스공사(사장 직무대리 안완기)는 전임직원들이 법인카드 사용 후 쌓인 포인트 1억 7백만원을 온누리 상품권으로 교환해, 26일 대구광역시사회복지협의회(회장 이재모)에 전달했다. 본 사업추진을 위해 한국가스공사는 대구광역시사회복지협의회와 함께 대상 사회복지시설을 선정했으며, 대구지역 140여개소에 따뜻한 마음이 전달되었다. 한국가스공사는 단순한 기부를 넘어 지역 경제활성화를 위해 기부금액을 온누리상품권으로 사회복지시설에 기탁함으로써 지역의 대표적인 상생기업으로써의 역할을 했다. 대구광역시사회복지협의회 이재모 회장은 ""기업이 단순한 후원금 전달에만 그치지 않고, 지역의 경제를 생각하고 카드포인트까지 기부함으로써 따뜻하고 투명한 운영의 마음을 느낄 수 있다.""며, 후원을 해준 한국가스공사 임직원들에게 감사의 마음을 전달했다. 한편, 한국가스공사(KOGAS)는 고유의 사회공헌 브랜드인 ""온(溫)누리사업""을 통해 지역사회 취약계층에 대한 지원을 활발하게 전개하고 있으며 지역주민과도 상생하며 함께 호흡하고 있다."
조선비즈,036460,/news/news_read.nhn?article_id=0000394242&office_id=366&mode=search&query=한국가스공사&page=18,2017-12-28 17:15,한국가스공사 신임 사장에 정승일 전 산업부 실장,"정승일 전 산업통상자원부 에너지자원실장(52·사진)이 28일 한국가스공사 신임 사장으로 선임됐다. 가스공사는 이날 대구 동내동 대구경북첨단의료산업진흥재단에서 임시주주총회를 열고 정 전 실장을 제16대 사장으로 선임하는 안을 통과시켰다. 정 전 실장은 주무부처인 산업부 장관의 제청과 대통령의 재가를 거치면 가스공사 사장으로 공식 취임하게 된다. 경남 하동 출신인 정 전 실장은 경성고와 서울대 경영학과를 졸업한 후 서울대에서 경영학 석사 학위를 받았다. 행시 33회로 공직에 입문, 동력자원부에서 산업부까지 가스산업팀장, 에너지산업정책관, 자유무역협정(FTA)정책관, 무역투자실장, 에너지자원실장 등 요직을 두루 거쳤다. 일처리가 꼼꼼하고 치밀하다는 평가를 받는다. 천연가스수급, 전기요금 산정체계 개편 등 에너지 분야에서 성공한 정책을 다수 만들었다. 지난해 4월에는 쟁쟁한 선배들을 제치고 산업부 1급(무역투자실장)으로 승진해 대표적인 발탁인사라는 평가를 받기도 했다."
아시아경제,036460,/news/news_read.nhn?article_id=0004148604&office_id=277&mode=search&query=한국가스공사&page=18,2017-12-28 17:24,"한국가스공사, 11조원 규모 천연가스 공급계약",[아시아경제 노태영 기자] 한국가스공사는 28일 경남에너지와 11조원 규모의 도시가스용 천연가스 공급계약을 체결했다고 밝혔다. 이는 매출액 대비 52.27% 수준이다.
뉴시스,036460,/news/news_read.nhn?article_id=0008341179&office_id=003&mode=search&query=한국가스공사&page=18,2017-12-13 16:16,"한국가스공사, 11월 판매량 327만t&hellip;전년比 4.1%&darr;","【서울=뉴시스】 김지은 기자 = 한국가스공사(036460)는 지난 11월 도시가스용 191만1000t, 발전용 136만2000t 등 총 327만3000t을 판매한 것으로 잠정 집계됐다고 13일 공시했다. 이는 지난해 같은 달보다 4.1% 감소한 수준이다"
