source,symbol,link,date,title,content
TV조선,036460,/news/news_read.nhn?article_id=0000246929&office_id=448&mode=search&query=한국가스공사&page=4,2018-07-06 13:20,한국가스안전공사 '제25회 가스안전대상' 개최,"한국가스안전공사는 제25회 대한민국 가스안전대상을 오늘 서울 63빌딩에서 개최했다. 최고 영예인 은탑산업훈장은 SK이노베이션 임성배 전무에게 돌아갔다. 이밖에 (주)인우공영, (주)폴리미래 등 개인과 단체 100명이 수상했다. / 박상현 기자"
전자신문,036460,/news/news_read.nhn?article_id=0002704267&office_id=030&mode=search&query=한국가스공사&page=9,2018-05-02 09:52,"[ET투자뉴스]한국가스공사, &quot;2020년까지 매년&hellip;&quot; 매수-하나금융투자","하나금융투자에서 2일 한국가스공사(036460)에 대해 ""2020년까지 매년 성장하는 이익""라며 투자의견을 '매수'로 제시하였다. 아울러 12개월 목표주가를 64,000원으로 내놓았다. 하나금융투자 유재선 애널리스트가 동종목에 대하여 이번에 제시한 '매수'의견은 하나금융투자의 직전 매매의견에서 큰 변화없이 그대로 유지되는 것이고  올해 초반의 매매의견을 기준으로  볼때도 역시 '매수'의견이 계속 유지되고 있는 상태이다. 그리고 최근 분기내 발표된 전체 증권사 리포트의 컨센서스와 비교를 해볼 경우에 오늘 발표된 투자의견은 전체의견에 수렴하고 있어, 이번 의견은 시장의 평균적인 기대감이 객관적으로 표현된 것으로 분석되고 있다. 한편 12개월 목표주가로 제시한 64,000원은 직전에 발표된 목표가와 대비해서 큰 변화는 없고, 목표주가의 추이를 살펴보면 이번에 다시 목표가가 같은 수준을 유지하면서 최근 흐름은 목표가의 계단식 상승이 진행되는 모습이다. 또한 전일 종가 기준으로 볼때 동종목의 현주가는 이번에 제시된 목표가 대비 16.8%의 저평가 요인이 존재한다는 해석이 제시되고 있다."
매일신문,036460,/news/news_read.nhn?article_id=0000467741&office_id=088&mode=search&query=한국가스공사&page=46,2016-11-11 05:01,"한국가스공사, 호주 GLNG사업 9일 준공식",한국가스공사는 9일 호주 퀸즐랜드주 글래드스톤에서 'G(Gladstone)LNG' 플랜트 준공식을 개최했다. 한국가스공사 제공
서울경제,036460,/news/news_read.nhn?article_id=0003347726&office_id=011&mode=search&query=한국가스공사&page=3,2018-07-13 13:22,2018 한국가스공사 온(溫)누리 열효율개선사업!&quot; 범죄피해자 가정 대상 합동봉사...,"▲ 범죄피해자가정에서 봉사활동 하고 있는 모습 [서울경제] 대구광역시사회복지협의회(회장 이재모)에서는 한국가스공사(사장 정승일)의 후원으로『도망가는 에너지를 잡아라! 2018 한국가스공사 온(溫)누리 열효율개선사업』을 통해 지역 내 저소득층을 대상으로 업(業)의 특성을 살린 사회공헌활동을 펼치고 있다.  이 사업과 관련하여 한국가스공사는 지난 7월 11일 동부경찰서와 ‘열효율개선사업을 통한 범죄피해자 지원을 위한 업무협약’을 체결하고, 다음날 대구동부경찰서에서 추천해준 범죄피해자 가정을 대상으로 무료로 집수리 및 도배ㆍ장판, 현관문 수리등을 지원함으로써 어려움을 겪고 있는 범죄피해자 가족을 지원했다.  특히 단순한 후원에만 그치지 않고 한국가스공사 직원들이 직접 나와 동부경찰서 직원과 함께 집수리 봉사활동을 함께 함으로써 그 의미를 더욱 살릴 수 있었다. 대구광역시사회복지협의회 이재모 회장은 “한국가스공사의 사회공헌으로 지역사회의 어려운 이웃에게 많은 도움이 되고 있다. 특히 범죄피해자 가족 지원까지 세심한 부분에 신경 쓰는 모습에 감동을 받았다.”고 말했다.  한편 한국가스공사에서는 『도망가는 에너지를 잡아라! 2018 한국가스공사 온(溫)누리 열효율개선사업』을 통해 2010년부터 현재까지 저소득층 및 사회복지시설 에너지효율 개선사업 지원, 연료전지 설치사업, 노숙인 및 쪽방거주민 일자리 만들기 프로젝트 등 다양한 사회복지사업을 진행하고 있다. 한국가스공사는 2018년 한 해동안 대구광역시, 경상북도, 제주특별자치도에 총 160여개소를 대상으로 에너지복지를 실현할 예정이다."
이데일리,036460,/news/news_read.nhn?article_id=0003727376&office_id=018&mode=search&query=한국가스공사&page=41,2017-01-16 10:44,"한국가스공사, 160여 저소득가구 등에 에너지효율 공사 지원","[이데일리 e뉴스 최성근 기자] 한국가스공사가 후원한 ‘KOGAS 온(溫)누리 열효율개선사업’의 공사가 대구광역시·경상북도·경기도·제주특별자치도 4개 시도에서 완료됐다. 대구광역시사회복지협의회 주관으로 진행된 이번 사업은 공사의 시공업체로 지역의 사회적 기업이나 자활기업이 참여해서 일자리 창출과 지역경제의 활성화에도 긍정적 영향을 끼쳤다는 평가다. 지난 7월~9월 4개 지역의 사회복지시설 및 단체, 저소득가구로부터 신청을 받고 서류심사·현장실사 등을 거쳐 최종 160여 개의 사회복지시설 및 저소득가구를 선정했다. 또한 지난해 10월부터 본격적으로 공사를 시작해 최종 선정된 160곳에 창호, 단열, 출입문, 보일러 등 에너지 효율과 관련이 있는 공사를 지원했다. 온누리사업을 통해 공사를 지원받은 대구의 한 사회복지시설은 “해마다 겨울철이면 오래된 창문 틈 사이로 불어오는 외풍 때문에 연료비도 많이 들고 추운 생활을 해 나갔는데 이번 공사 지원으로 한층 더 따뜻하고 외풍 없는 겨울을 보내고 있다”며 공사를 지원해준 한국가스공사와 대구광역시사회복지협의회에 거듭 감사하다고 전했다."
서울신문,036460,/news/news_read.nhn?article_id=0002930287&office_id=081&mode=search&query=한국가스공사&page=3,2018-07-18 03:39,"한국가스공사, 최초의 여성 본부장&hellip; 인적 쇄신 활발","[서울신문] 한국가스공사의 전진 기지인 멕시코 만사니요 LNG터미널 건설 현장에서 직원들이 진행 상황을 꼼꼼히 점검하고 있다. 한국가스공사 제공 한국가스공사가 강도 높은 경영 혁신을 통해 신뢰받는 공기업으로 재도약을 준비하고 있다. 17일 가스공사에 따르면 정승일 사장은 지난 1월 취임 이후 경영 시스템과 조직 체계를 대대적으로 개편하고 있다. 혁신 활동을 진두지휘할 사장 직속 전략기획본부를 신설하고, 일자리 창출 등 사회적 가치 실현을 주도할 경영협력처를 확대 개편했다. 또 인적 쇄신을 통해 공사 창립 35년 만에 최초로 여성 본부장을 임명했으며, 전략기획본부의 부장급 이상 간부 직원에 대한 세대 교체를 통해 간부 직원들의 평균 연령이 이전에 비해 3.1세 젊어졌다. MobileAdNew center 가스공사는 또 ‘좋은 에너지, 더 좋은 세상’이라는 기업 이념을 바탕으로 ‘천연가스’의 이미지를 살려 온 세상을 따뜻하게 만든다는 의미의 사회공헌 브랜드인 ‘온누리’를 자체 구축해 다양한 사회공헌 활동을 전개하고 있다. 2010년부터 꾸준히 추진해 온 ‘온누리 열효율 개선사업’이 대표적인 사례다. 이는 취약계층과 사회복지시설을 대상으로 난방 효율을 개선하는 사업이다. 지난 한 해에만 152가구를 대상으로 사업을 진행했으며 사회적기업 30개가 동참해 일자리 창출에도 기여했다. 공사는 최근 성과에 안주하지 않고 사회적 가치 창출 성과를 객관적으로 측정할 수 있도록 SK사회공헌위원회와 업무협약을 맺고 지표 개발도 추진하고 있다. 정 사장은 “혁신 경영을 통해 공사 본연의 임무인 안전하고 안정적인 천연가스 공급은 물론 국정 과제인 사회적 가치 실현에도 책임을 다하는 공기업으로 거듭날 수 있도록 지속적으로 노력할 것”이라고 말했다."
데일리안,036460,/news/news_read.nhn?article_id=0002268316&office_id=119&mode=search&query=한국가스공사&page=4,2018-07-09 08:37,"&quot;한국가스공사, 가스발전량 지속 증대&hellip;목표가&uarr;&quot; SK증권","SK증권이 발전용가스 수요급증과 유가상승 여파가 한국가스공사의 이익에 긍정적 영향을 미칠 것으로 분석하며 목표가를 상향했다. 9일 SK증권 손지우 연구원은 한국가스공사에 대한 투자의견을 ‘매수’로 유지하고 목표가를 기존 6만원에서 7만5000원으로 올려잡았다. 그는 “문재인 정부의 탈원전 정책상 가스발전량은 지속 증대될 것”이며, “특히 9월로 예상되는 러-북 협상 이후 러시아 PNG 스토리 가시화로 동사에 대한 기대감이 높다”고 말했다. 손 연구원은 “최근 트럼프와 사우디가 증산을 통해 유가 안정화를 추진하고 있어 E&P 수익에서 수혜를 봤던 동사에게는 좋은 소식이 아니지만 중장기적 그림에 주목해야 하기 때문에 매수관점을 견지해야 할 것”이라고 판단했다."
한국경제,036460,/news/news_read.nhn?article_id=0003812168&office_id=015&mode=search&query=한국가스공사&page=24,2017-08-21 09:08,"[특징주]한국가스공사, 6일만에 반등&hellip;&quot;주가 하락 과도&quot;","사진=게티이미지뱅크 한국가스공사가 주가 저평가 진단에 힘입어 6거래일 만에 반등에 나섰다. 21일 오전 9시2분 현재 한국가스공사는 전 거래일보다 450원(0.98%) 오른 4만6500원에 거래되고 있다. 이날 한국투자증권은 한국가스공사에 대해 최근 주가 하락이 과도한 수준이라며 매수 기회라고 분석했다. 강승균 한국투자증권 연구원은 ""한국가스공사 주가가 2분기 실적발표 후 최근 5거래일간 10% 하락해 신정부의 '탈 원전·석탄' 정책 수혜 이전 수준으로 돌아갔다""며 ""기존 장기투자 매력이 유효한 만큼 과도한 주가 하락은 매수 기회""라고 밝혔다. 주가 하락 요인으로는 이라크 아카스 프로젝트 손상차손(1171억원) 반영에 따른 2분기 실적의 시장 예상치 하회, 회복 중이던 해외 자원개발(E&P) 사업에 대한 부정적인 시각 확산을 꼽았다. 호주 GLNG 프로젝트의 운영사인 산토스(지분 30%)가 자체 장기 유가전망을 낮추며 2분기 손상차손 인식 가능성을 언급한 점도 해당 프로젝트에 참여하고 있는 한국가스공사의 주가 하락 요인으로 거론했다. 강 연구원은 ""해외 손상차손 이슈 부각이 단기적으로는 주가에 부정적인 영향을 줄 수 있지만, 천연가스 수요가 다시 증가해 본업인 국내 LNG 도입 및 도매판매가 좋아진다는 중장기적인 방향성은 유효하다""며 ""손상차손 리스크를 제외하면 해외 E&P에서도 생산량 증가 등으로 실적 개선이 지속될 것""이라고 내다봤다. 그는 ""장기투자 매력이 유효한 상황에서, 단기 주가 하락으로 내년 예상 실적 기준 주가순자산비율(PBR) 0.4배까지 낮아진 지금이 적극적으로 매수할 때""라고 진단했다."
파이낸셜뉴스,036460,/news/news_read.nhn?article_id=0004065128&office_id=014&mode=search&query=한국가스공사&page=3,2018-07-26 15:27,"한국가스공사 제주기지건설단, 지역특화 사회공헌활동 &lsquo;주목&rsquo;","제주 서부사회복지관, 26일 감사패 전달       한국가스공사 제주기지건설단은 매월 목요일 넷째주에 직원들이 함께 참여하는 경로식당 배식과 청소, 설거지 봉사활동을 실시하고 있다.    [제주=좌승훈기자] 제주 서부종합복지관(관장 안원식)은 26일 지역 내 소외계층 지원활동에 적극 나서고 있는 한국가스공사 제주기지건설단(단장 안형철)에 감사패를 전달했다. 한국가스공사 제주기지건설단은 지난 2017년 5월 제주 서부종합복지관과 업무협약을 맺고, 지난해에 이어 올해에도 경로식당 식사 질 개선을 위해 후원금 500만원을 기탁했다. 또 매월 목요일 넷째주에 직원들이 함께 참여하는 경로식당 배식과 청소, 설거지 봉사활동을 실시하고 있다.       제주 서부종합복지관은 26일 한국가스공사 제주기지건설단(단장 안형철)에 감사패를 전달했다.          한국가스공사 제주기지건설단의 경로식당 배식활동.    한편 좋은 에너지, 더 좋은 세상이라는 기업 이념을 바탕으로 ‘온누리’ 사랑·희망·어울림·한마음 프로젝트를 운영하고 있는 한국가스공사는 제주 LNG 기지 건설에 따른 온누리 봉사단 확대 편성을 통해 직원 중심의 사회공헌 활동을 강화하고 있다. 현재 한국가스공사는 3500억원을 투입해 제주시 애월항 일대 7만4786㎡ 부지에 LNG 저장탱크 2기(4만5000㎘/기)와 시간당 120t 규모의 기화송출설비를 건설하고 있다. 2019년 8월 말에 이 사업이 마무리되면 도내 2만5600세대, 260개소 사업장이 도시가스 공급의 혜택을 받게 되고, 300㎿ 규모의 천연가스 복합발전도 이뤄질 것으로 예상된다."
국민일보,036460,/news/news_read.nhn?article_id=0000967662&office_id=005&mode=search&query=한국가스공사&page=40,2017-01-24 19:24,"[기업, 다시 뛴다-한국가스공사] &lsquo;LNG 인프라 확충&rsquo; 해외 사업 적극 추진","한국가스공사 직원들이 LNG기지 앞에서 활짝 웃고 있다. 가스공사는 LNG탱크(화물창) 기술을 국산화하는데 성공했다. 원가절감, 고용창출 효과가 상당할 것으로 기대한다. 가스공사 제공 한국가스공사는 지난해 7월 발표된 정부의 ‘천연가스(LNG) 인프라사업 계획’에 발맞춰 국내 협력회사들과 함께 해외 사업에 박차를 가하고 있다. 가스공사는 현재 세계 각국에서 논의되고 있는 LNG기지 및 배관망 사업이 예정대로 진행될 경우 약 370조원 규모의 시장이 형성될 것으로 전망한다. 특히 공사는 LNG탱크(화물창) ‘KC-1’ 기술로 경쟁력을 한 단계 높였다. 화물창은 LNG를 적재하는 공간으로, 화물창 시스템은 LNG 적재·운송·하역 과정의 모든 설비를 일컫는다. 국내 조선업체는 세계에서 가장 많은 LNG선을 건조하고 있지만 핵심 기술인 화물창 시스템은 해외에 의존해왔다. LNG선 1척당 5%(약 100억원)를 로열티로 지급하고 있다. 공사는 지난해 KC-1 개발에 성공하고 현대중공업·삼성중공업·대우조선해양과 함께 전문회사를 설립했다. 45건의 국내 및 해외 특허를 땄고, 국제선급 인증사인 한국선급(KR), 미국선급(ABS), 프랑스선급(BV) 등으로부터 인증을 획득하기도 했다. 가스공사 관계자는 “조선산업 원가절감으로 5750억원, 수입대체 2300억원, 중소기업 등에 6조9690억원 생산유발, 5만7132명의 고용창출 효과를 기대한다”고 말했다. [국민일보 홈페이지] [페이스북] [트위터] [국민일보 꿀잼영상 바로가기] GoodNews paper ⓒ"
세계일보,036460,/news/news_read.nhn?article_id=0003136504&office_id=022&mode=search&query=한국가스공사&page=41,2017-01-16 09:20,"한국가스공사, 4개 시&middot;도 온누리 열효율개선사업 완료", 
서울경제,036460,/news/news_read.nhn?article_id=0002921313&office_id=011&mode=search&query=한국가스공사&page=46,2016-11-20 17:53,"[서경스타즈IR] 한국가스공사, 해외자원사업 결실...내년 실적 확 달라진다",우즈베크·모잠비크 가스전 등 이익 가시화·국제유가도 회복세 해외자원 4분기 흑자전환 전망 내년 실적개선·주가상승 견인할듯
전자신문,036460,/news/news_read.nhn?article_id=0002702152&office_id=030&mode=search&query=한국가스공사&page=9,2018-04-25 13:17,"[ET투자뉴스]한국가스공사, &quot;유가를 포함하여 국&hellip;&quot; 매수-하나금융투자","하나금융투자에서 25일 한국가스공사(036460)에 대해 ""유가를 포함하여 국내외 모든 여건이 긍정적인 상황""라며 투자의견을 '매수'로 제시하였다. 아울러 12개월 목표주가를 64,000원으로 내놓았다. 하나금융투자 유재선 애널리스트가 동종목에 대하여 이번에 제시한 '매수'의견은 하나금융투자의 직전 매매의견에서 큰 변화없이 그대로 유지되는 것이고  올해 초반의 매매의견을 기준으로  볼때도 역시 '매수'의견이 계속 유지되고 있는 상태이다. 그리고 최근 분기내 발표된 전체 증권사 리포트의 컨센서스와 비교를 해볼 경우에 오늘 발표된 투자의견은 전체의견에 수렴하고 있어, 이번 의견은 시장의 평균적인 기대감이 객관적으로 표현된 것으로 분석되고 있다. 한편 12개월 목표주가로 제시한 64,000원은 직전에 발표된 목표가 60,000원 대비 6.7% 상향조정 된 것이고, 목표주가의 추이를 살펴보면 한동안 정체구간을 보낸 후 이번에 오랜만에 목표가가 상향조정된 모습이다. 또한 전일 종가 기준으로 볼때 동종목의 현주가는 이번에 제시된 목표가 대비 19.6%의 저평가 요인이 존재한다는 해석이 제시되고 있다."
국민일보,036460,/news/news_read.nhn?article_id=0000965778&office_id=005&mode=search&query=한국가스공사&page=41,2017-01-16 10:39,"한국가스공사, 4개 시&middot;도 160여 복지시설 등에 열효율개선사업 펼쳐","한국가스공사가 대구광역시·경상북도·경기도·제주특별자치도 4개 시도의 ‘KOGAS 온(溫)누리 열효율개선사업’ 공사를 완료했다고 16일 밝혔다. 대구광역시사회복지협의회 주관으로 진행된 이번 사업은 지난 7월~9월 4개 지역의 사회복지시설 및 단체, 저소득가구로부터 접수를 받고 서류심사·현장실사 등을 거쳐 최종 160여 개의 사회복지시설 및 저소득가구를 선정했다. 또한 지난해 10월부터 본격적으로 공사를 시작해 최종 선정된 160곳에 창호, 단열, 출입문, 보일러 등 에너지 효율과 관련이 있는 공사를 지원했다. ‘온누리 열효율개선사업’의 경우 공사의 시공업체로 지역의 사회적 기업이나 자활기업이 참여해서 일자리 창출과 지역경제의 활성화를 가져올 수 있었다. 온누리사업을 통해 공사를 지원받은 대구의 한 사회복지시설은 “해마다 겨울철이면 오래된 창문 틈 사이로 불어오는 외풍 때문에 연료비도 많이 들고 추운 생활을 해 나갔는데 이번 공사 지원으로 한층 더 따뜻하고 외풍 없는 겨울을 보내고 있다”며 공사를 지원해준 한국가스공사와 대구광역시사회복지협의회에 거듭 감사하다고 전했다. 한편, ‘KOGAS 온(溫)누리 사업’은 한국가스공사(사장 이승훈)가 후원하는 사회공헌사업 브랜드로, 온누리 사랑프로젝트, 희망프로젝트, 어울림 프로젝트, 한마음 프로젝트로 나뉘어 에너지복지사업에서 미래육성․공익사업, 지역사회․국제협력사업, 한국가스공사 전직원의 나눔문화사업까지 다양한 사회공헌사업을 진행하고 있다."
아시아경제,036460,/news/news_read.nhn?article_id=0003914224&office_id=277&mode=search&query=한국가스공사&page=41,2017-01-18 09:21,"한국가스공사, 임직원 가족 초청&lsquo; KOGAS 가족 방문의 날 &rsquo;개최","[아시아경제TV 김원규 기자] 한국가스공사가 지난 16일 대구 본사에서 ‘KOGAS 가족 방문의 날’ 행사를 개최했다고 18일 밝혔다. 가스공사는 임직원 가족들에게 부모의 일터를 소개하고 다양한 체험 기회를 제공함으로써 가족 간의 유대감을 강화하고자 행사를 마련했다. 이날 행사에는 가스공사 본사 임직원 가족 약 70명이 참여했다. 행사에 참여한 가족들은 가스공사 본사를 견학한 후, 지난 브라질 리우 올림픽 메달리스트인 김소희, 이대훈 선수가 속해있는 가스공사 태권도단의 시범을 관람했다. 또 천연가스 산업에 대한 다양한 정보가 전시돼 있는 홍보관 체험, 마술 공연 등 다양한 볼거리도 이어졌다. 김점수 가스공사 기획본부장은 “임직원들에 대한 가족 여러분의 믿음과 지원이 있었기에 가스공사가 글로벌 에너지 공기업으로 성장할 수 있었다”며 “앞으로도 임직원 여러분께서 일 뿐만 아니라 가정에도 집중할 수 있는 환경을 만들도록 최선을 다하겠다”고 말했다."
MBN,036460,/news/news_read.nhn?article_id=0001075655&office_id=057&mode=search&query=한국가스공사&page=41,2017-01-17 18:33,한국가스안전공사,"▲ 부사장(기획관리이사 겸직) 오재순 ▲ 안전관리이사 양해명 ▲ 기술이사 정해덕 MBN 관련뉴스해당 언론사에서 선정하며 언론사 페이지(아웃링크)로 이동해 볼 수 있습니다.20대女 집 비번 외워둔 수도공사 인부, 성욕에 그만…""마시면 안 되는데…"" 반기문, 퇴주잔 논란당황한 사장님과 더 당황한 강도 ""이, 이게…""교도소 담 폭파시킨 수감자들 '상상 초월'[M+신격의 습격] 수지에 '이효리'가 비치다"
