source,symbol,link,date,title,content
파이낸셜뉴스,037270,/news/news_read.nhn?article_id=0003586592&office_id=014&mode=search&query=YG PLUS&page=1,2016-01-22 14:36,"[공시]YG PLUS, 빅뱅 지드래곤과 태양에 유상증자 결정",YG PLUS는 빅뱅의 지드래곤(본명 권지용)과 태양(동영배)을 대상으로 제3자 배정방식 유상증자를 결정했다고 22일 공시했다. 운영자금 23억원을 조달하기 위해서다. 이번 결정으로 지드래곤과 태양은 각각 73만5294주와 11만294주를 배정받게 된다. 신주 발행가액은 2720원이다. YG PLUS의 자회사 코드코스메인터내셔널도 이날 지드래곤과 태양에 각각 20만주와 6만주를 유상증자하기로 결정했다고 공시했다. 신주 발행가액은 5000원이다.
매일경제,037270,/news/news_read.nhn?article_id=0003730038&office_id=009&mode=search&query=YG PLUS&page=1,2016-05-12 07:32,"[Hot-Line] &ldquo;와이지엔터, 1분기 호실적&hellip; YG PLUS 적자 축소&rdquo;","KTB투자증권은 12일 와이지엔터에 대해 양호한 본업 성장과 자회사 YG PLUS의 적자 축소에 따라 1분기 실적이 호조를 보였다며 투자의견은 ‘매수’, 목표주가는 5만7000원을 유지했다. 이남준 KTB투자증권 연구원은 “연결재무제표기준 와이지엔터의 1분기 매출액은 730억원, 영업이익은 95억원으로 전년 동기 대비 각각 64.3%, 32.6% 증가했다”면서 “이는 시장 예상치를 크게 웃도는 수준”이라고 설명했다. 빅뱅의 일본 돔투어 11회와 중국 아레나 콘서트 9회분이 매출로 인식돼 전년 동기 대비 콘서트 매출과 로열티 매출이 큰 폭으로 증가했다는 설명이다. 일본 돔투어 규모는 전년 동기와 유사했지만 우호적인 원·엔 환율 덕분에 로열티 수익은 약 22% 가량 상승했다. 우려가 깊었던 자회사 YG PLUS 실적 역시 매출액 107억원, 영업적자 16억원을 달성하며 전 분기 대비 적자 10억원을 축소했다. 이 연구원은 “2분기 이후로는 빅뱅 10주년 월드투어와 아이콘의 중국·동남아 콘서트가 연이어 예정돼 있어 실적 기대감은 그 어느 때보다 높은 상황”이라며 “2분기 연결 매출액은 676억원, 영업이익은 81억원으로 전년 동기 대비 각각 49.4%, 58.6% 늘어날 것”이라고 내다봤다. 이어 “현 주가는 주가수익비율(PER) 21배 수준으로 역사적 밸류에이션 밴드 하단에 위치해 있다”고 덧붙였다. [디지털뉴스국 김경택 기자] r_start // r_end // [ⓒ 매일경제 & mk.co.kr, 무단전재 및 재배포 금지] 매일경제 관련뉴스해당 언론사에서 선정하며 언론사 페이지(아웃링크)로 이동해 볼 수 있습니다.'꿀벅지' 레이양, 아찔 시스루에 육감적 각선미 뽐내김밥도 '뺄셈의 미학'…크기·재료 줄였더니 대박박병호, BAA전 3타수 무안타 침묵…김현수 결장남자는 역시 하체…실패해도 괜찮은 평생 하체 운동'미스서울 眞', 군살 없는 비키니 몸매에 '입이 쩍!'"
아시아경제,037270,/news/news_read.nhn?article_id=0003672070&office_id=277&mode=search&query=YG PLUS&page=1,2016-01-22 14:04,지드래곤&middot;태양도 화장품 사업&hellip;YG PLUS와 자회사에 36억 투자,"지드래곤 [아시아경제 박선미 기자]아이돌 그룹 빅뱅의 지드래곤과 태양이 YG PLUS와 화장품 사업을 하는 자회사에 총 36억원을 투자한다. 22일 금융감독원 전자공시시스템에 따르면 YG PLUS는 운영자금 마련을 위해 이날 지드래곤(본명 권지용)과 태양(본명 동영배)을 대상으로 제3자배정 유상증자를 실시한다고 밝혔다. YG PLUS는 주당 2720원에 총 84만5588주를 발행해 운영자금 22억9999만9360원을 조달할 계획이다. 지드래곤과 태양은 YG PLUS 주식을 각각 73만5294주, 11만294주 취득하며 액수로는 지드래곤 20억원, 태양 3억원에 해당한다. 이들이 보유하는 주식은 1년간 보호예수로 묶이게 된다. 납입일은 오는 29일이고 신주권 교부 예정일은 다음달 19일이다. 지드래곤과 태양은 화장품 제조 및 판매를 주요 사업으로 하는 YG PLUS의 자회사 코드코스메인터내셔널에도 13억원을 투자한다. 코드코스메인터내셜은 색조화장품 문샷을 개발해 유통하고 있다. 현재 지드래곤이 '문샷'의 광고모델로 계약돼 있다. 3자배정 유상증자 방식으로 지드래곤과 태양이 취득 예정인 코드코스메 주식 수는 각각 20만주, 6만주로 주당 5000원의 가격을 적용하면 각각 10억원, 3억원에 해당한다. 납입일과 신주권 교부 예정일은 오는 29일이다. YG PLUS는 광고대행업을 주요사업으로 하고 있는데, 코드코스메를 통해 화장품 제조 및 판매 사업에도 손을 뻗었으며 골프매니지먼트, MD제조 및 유통판매, 모델매니지먼트 및 외식프랜차이즈 등의 사업도 영위하고 있다. YG PLUS는 2014년 11월 와이지엔터테인먼트가 인수한 이후 신사업 확장에 적극적으로 나서고 있다."
뉴시스,037270,/news/news_read.nhn?article_id=0008230196&office_id=003&mode=search&query=YG PLUS&page=1,2017-10-18 11:04,"YG PLUS-네이버, 국내외 음악사업 공동 추진","【서울=뉴시스】김경원 기자 = 국내외 음악 산업 분야에서 차별화된 경쟁력을 확보하기 위해 YG엔터테인먼트(122870)의 자회사 YG PLUS(037270, 대표이사 양민석)와 네이버(대표이사 사장 한성숙)가 힘을 모은다. YG PLUS와 네이버는 국내외 음악산업 분야에서 공동사업을 위한 인프라 구축 작업부터 시작한다고 18일 밝혔다. 양사는 이를 위해 대규모 음원을 확보하고 케이팝(K-Pop)을 포함한 다양한 음악 장르의 풍부한 메타 데이터베이스(DB)를 정교화하는 작업을 진행할 계획이다. 이렇게 확보한 대규모 음원은 우선적으로 네이버 뮤직을 통해 제공될 예정이다. 글로벌 메타 DB가 구축되면 엔터테인먼트의 콘텐츠 추천 기술이 한층 고도화할 전망이다. YG PLUS는 이번 공동사업을 시작으로 글로벌 음악 서비스 사업을 추진하기 위해 음악사업본부를 신설하고 전문인력을 영입하는 등 사업 역량 강화에 집중하고 있다. 이번 글로벌 음악 서비스 인프라 구축 작업은 네이버와 YG PLUS가 함께 추진하는 음악사업의 첫 행보다. 이에 양사는 전략적 파트너로서 다양한 협업을 통한 사업적 시너지를 기대했다. 박선영 네이버 V&엔터셀 리더는 ""네이버의 우수한 기술력과 YG의 엔터테인먼트 분야에서 폭넓은 사업 역량을 모아 기존 서비스를 고도화하겠다""며 ""나아가 차별화된 글로벌 뮤직 서비스를 선보이기 위한 기틀을 다질 것""이라고 말했다. 양민석 YG PLUS 대표는 ""K-Pop의 글로벌 시장 진출 확대와 성장에 기여할 수 있도록 네이버와 다양한 음악사업을 발굴하기 위해 다각도로 협력해 나가겠다""고 강조했다."
한국경제TV,037270,/news/news_read.nhn?article_id=0000577530&office_id=215&mode=search&query=YG PLUS&page=1,2017-10-16 15:27,"YG PLUS, 동남아 시장 진출 첫발‥싱가포르에 지점 설립","[한국경제TV 김치형 기자] YG엔터테인먼트의 자회사 YG PLUS가 16일, 싱가포르 현지에 지점을 설립하고 동남아 시장 진출을 본격화한다고 밝혔습니다. 싱가포르 지점은 기존 사업과 시너지 창출이 가능한 투자 대상들을 발굴해 나감은 물론 동남아시아 현지의 다양한 업체들과 협업을 통해 YG그룹의 엔터테인먼트, 마케팅, 화장품, F&B, 스포츠, 모델 등의 해외 사업을 확장하는 역할을 하게 됩니다. 또한 해외 지점 설립과 함께 YG PIUS는 자회사인 YG인베스트먼트를 통해 싱가포르 현지 기업인 거쉬클라우드 인터내셔널(Gushcloud International)과 전략적 투자도 체결했습니다. 거쉬클라우드 인터내셔널은 디지털 인플루언서(influencer) 마케팅 및 엔터테인먼트 기업으로 싱가포르 본사를 비롯해 말레이시아, 인도네시아 등에 지사를 둔 글로벌 마케팅 그룹입니다. 거쉬클라우드 인터내셜널은 자회사로 엔터테인먼트와 탤런트 에이전시 등도 보유하고 있습니다. 조현우 YG PLUS 싱가포르 지사장은 ""이번 투자는 거쉬클라우드가 보유한 9개의 해외 지사를 통해 YG그룹의 아티스트를 비롯한 다양한 사업들을 동남아시아로 진출 시키기 위한 전략적 투자로, 앞으로 긴밀한 협력을 통해 해외시장 진출의 교두보를 마련할 것"" 이라고 말했습니다."
이데일리,037270,/news/news_read.nhn?article_id=0003960655&office_id=018&mode=search&query=YG PLUS&page=1,2017-11-02 14:27,YG PLUS 계열사. 네이버 온라인 골프 예약서비스 론칭,"- 그린웍스, 300여개 골프장 최저가 그린피 예약 지원 [이데일리 이명철 기자] YG PLUS(037270)는 계열사 그린웍스가 국내 최대 포털사이트 네이버를 통해 온라인 골프 예약서비스를 선보인다고 2일 밝혔다. 새로 마련한 예약 서비스는 국내 300여개 골프장의 최저가 그린피 예약 기능을 네이버에 모바일이나 인터넷을 통해 이용 가능한 플랫폼이다. 네이버에서 원하는 골프장을 검색하면 바로 예약 서비스를 진행할 수 있다. 온라인 결제 옵션으로 N Pay(네이버 페이)가 지원돼 간편한 이용이 가능하다. 전국 골프장 검색 정보를 업데이트해 최신 정보를 정확하게 제공할 수 있다. 그린웍스는 약 72만명 회원을 보유한 국내 최대 골프 예약 서비스 ‘엑스골프(XGOLF)’를 운영 중이다. 국내 300여개 골프장과 해외 인기 골프장 예약 서비스를 제공하며 최근 온라인투오프라인(O2O) 사업 일환으로 골프장·골프연습장 위탁 운영에도 나섰다. 조성준 그린웍스 대표는 “이번 협업을 토대로 향후 인공지능(AI) 스피커와 AI 비서 클로바(Clova)를 통해 골프장 관련 서비스도 제공할 예정”이라며 “국내 골프 시장 성장에 기여하도록 네이버와 골프 분야 다양한 콘텐츠를 개발갈 것”이라고 말했다. 한편 YG PLUS는 지난 5월 종속회사 YG스포츠를 통해 그린웍스를 인수했다. YG스포츠는 김효주·최혜진 등 골프 선수 매니지먼트와 골프대회 운영, 골프 아카데미, 온·오프라인 골프용품 유통사업 등을 영위하고 있다."
이데일리,037270,/news/news_read.nhn?article_id=0003457732&office_id=018&mode=search&query=YG PLUS&page=1,2016-01-22 13:03,"YG PLUS, 자회사 등 유상증자 결정",[이데일리 김유성 기자] YG PLUS(037270)는 종속회사인 코드코스메인터내셔널이 13억 규모의 유상증자를 결정했다고 22일 공시했다. 이와 함께 YG PLUS는 30억원 규모의 유상증자를 결정했다고 공시했다.
머니투데이,037270,/news/news_read.nhn?article_id=0003617684&office_id=008&mode=search&query=YG PLUS&page=1,2016-01-22 12:03,"GD&middot;태양, YG PLUS 36억원 투자..화장품 문샷 성장에 '베팅'","[머니투데이 김건우 기자] [지드래곤 30억원, 태양 6억원 투자..YG PLUS 'YG엔터 성장의 KEY'] 남성아이돌 빅뱅의 멤버인 지드래곤(권지용)과 태양(동영배)이 소속사 와이지엔터테인먼트의 자회사 YG PLUS 및 코드코스메인터내셔널(코드코스메)에 36억원을 투자한다. 22일 YG PLUS와 코드코스메는 지드래곤과 태양을 대상으로 총 36억원의 유상증자를 결정했다. 지드래곤이 30억원, 태양이 6억원을 투자한다. YG PLUS는 23억원 규모의 운영자금을 조달하기 위해 지드래곤과 태양을 대상으로 전환상환우선주 84만 5588주를 발행하기로 했다. 지드래곤이 20억원, 태양이 3억원을 투자한다. 발행가액은 2720원이다. 납입일은 29일이다. 또 자회사 코드코스메도 지드래곤을 대상으로 10억원, 태양에게 3억원의 유상증자를 결정했다. 신주 발행가는 5000원으로 지드래곤이 20만주, 태양이 6만주를 받는다. 코드코스메는 색조화장품 문샷을 개발·유통하는 화장품 전문기업이다. 두 사람이 와이지엔터가 아니라 YG PLUS 및 코드코스메에 투자하는 이유는 미래 성장의 키가 YG PLUS에 있기 때문이다. 2014년 11월 와이지엔터가 인수한 YG PLUS는 화장품(코드코스메), 외식업(와이지푸즈), 모델에이전시(케이플러스), 골프매니지먼트(GAD), MD(상품기획) 상업을 영위하고 있다. 와이지엔터가 가수와 배우들의 매니지먼트에만 집중하고 보유한 IP(지적재산권) 및 신규 사업은 모두 YG PLUS가 담당하는 구조다. 특히 2014년 첫 선을 보인 코드코스메의 색조화장품 문샷이 신사업의 핵심이다. 문샷은 지난해 롯데면세점과 영플라자에 입점했고, 루이비통의 편집샵인 세포라를 통해 싱가포르와 말레이시아에 진출했다. 하지만 발 빠른 유통망 확장과 달리 실적이 뒷받침되지 않는다는 평가를 받았다. 최근 문샷은 브랜드, 가격, 제품 등의 재정비를 마쳤다. 따라서 스타마케팅이 약했던 문샷이 지드래곤을 모델로 발탁해 본격적인 실적 사냥에 나선다는 것이다. 문샷은 올해 하반기 중국 화장품 판매 승인도 예상된다. 그런 맥락에서 지드래곤과 태양은 YG PLUS에 투자하는 한편, 코드코스메에 별도로 투자해 더 높은 수익을 노리려는 것으로 파악된다. 화장품 업종은 PER(주가수익비율)를 높이 받아 코드코스메가 흑자전환한 뒤 상장하게 되면 더 큰 차익을 기대할 수 있다. 와이지엔터테인먼트 관계자는 ""지드래곤과 태양이 코드코스메의 성장성을 높이 평가하고 투자를 결정한 것으로 알고 있다""고 말했다. textlinktopstart textlinktopend textlinkstart"
뉴시스,037270,/news/news_read.nhn?article_id=0008750718&office_id=003&mode=search&query=YG PLUS&page=1,2018-08-10 13:42,"YG PLUS, 2분기 영업익 1.2억&hellip;흑자전환",【서울=뉴시스】장서우 기자 = YG PLUS(0373270)는 올해 2분기 연결 재무제표 기준 영업이익이 1억2400만원으로 잠정 집계돼 흑자전환했다고 10일 공시했다. 같은 기간 당기순손실은 6억8500만원을 기록해 적자전환했다. 매출액은 28.6% 증가한 280억5900만원이다.
머니투데이,037270,/news/news_read.nhn?article_id=0003949380&office_id=008&mode=search&query=YG PLUS&page=1,2017-10-18 10:27,"YG PLUS, 네이버와 네이버뮤직 공동운영한다","[머니투데이 김건우 기자] 와이지엔터테인먼트의 자회사 YG PLUS는 네이버와 음원 서비스 사이트 네이버뮤직을 공동 운영한다고 18일 밝혔다. 지니뮤직에서 맡고 있는 와이지엔터의 음원 유통 사업도 네이버뮤직이 맡을 전망이다. YG PLUS와 네이버는 공동사업을 위한 인프라 구축 작업부터 시작한다. 두 회사는 대규모 음원을 확보하고, K팝을 포함한 다양한 음악 장르에 대한 데이터베이스(DB)를 정교화하는 작업을 진행할 계획이다. YG PLUS 관계자는 ""와이지엔터 아티스트의 음원을 네이버뮤직에 선공개하는 등 다양한 방안을 모색하고 있다""며 ""확보된 대규모 음원은 네이버 뮤직에 우선 제공하고,글로벌 메타 DB가 구축되면 엔터테인먼트의 콘텐츠 추천 기술도 한층 고도화 될 것으로 기대하고 있다고 말했다. YG PLUS는 음악사업본부를 신설하고 전문인력을 영입하는 등 사업 역량을 집중하고 있다. 이번 글로벌 음악 서비스 인프라 구축 작업은 네이버와 YG PLUS가 함께 추진하는 음악사업의 첫 행보로, 전략적 파트너로서 앞으로 다양한 협업을 통한 사업적 시너지가 기대된다고 회사 측은 설명했다. 양민석 대표는  ""K팝의 글로벌 시장 진출 확대와 성장에 기여할 수 있도록 네이버와 함께 다양한 음악사업을 발굴하기 위해 다각도로 협력해 나갈 것""이라고 말했다."
헤럴드경제,037270,/news/news_read.nhn?article_id=0001428356&office_id=016&mode=search&query=YG PLUS&page=1,2018-08-10 13:32,"[생생코스피] YG PLUS, 2분기 영업이익 흑자전환","- 네이버 바이브(VIBE) 운영대행 및 중국, 동남아시아 화장품 시장 매출 본격 가시화로 하반기 기대  [헤럴드경제=김지헌 기자] YG엔터테인먼트의 자회사 YG PLUS(대표이사 양민석)가 10일, 영업잠정실적 공시를 통해 2분기 연결재무제표 기준으로 영업이익이 1억 2400만원을 기록하며 전년동기대비 흑자전환 했다고 밝혔다. 매출액은 280억5900만원으로 전년동기보다 28.6% 증가했다. 회사 측은 “전 사업부의 고른 매출성장과 이익개선으로 이 같은 실적을 달성했다”며 “특히 신규사업인 음악사업의 매출이 2분기부터 본격 반영되기 시작했고, 골프 온라인 플랫폼사업을 영위 중인 그린웍스의 매출이 큰 폭으로 증가하며 매출성장을 견인했다. 또한 적자 폭이 가장 컸던 화장품 사업의 영업손실이 전년동기대비 큰 폭으로 줄며 이익개선에 기여했다” 고 전했다. YG PLUS는 최근 지난 6월 런칭한 네이버의 신규 음악 플랫폼인 바이브(VIBE)의 운영대행을 시작했고, 중국, 일본, 동남아시아 화장품 시장 진출을 본격화함에 따라 하반기 실적은 더욱 좋아질 것으로 기대하고 있다."
아시아경제,037270,/news/news_read.nhn?article_id=0003667044&office_id=277&mode=search&query=YG PLUS&page=1,2016-01-15 07:53,"YG PLUS, 난감한 화장품 사업 &lsquo;문샷&rsquo;","[아시아경제 팍스넷 공도윤 기자] YG PLUS가 화장품 사업 진출 후 고전을 면치 못하고 있다. 2014년 화장품 브랜드 ‘문샷’ 출시로 투자자들의 기대를 한몸에 받았지만, 중국 진출 지연, 매출 부진 등으로 최근 1년간 주가는 바닥을 모르고 추락 중이다. 지난해 4월22일 6480원을 찍었던 주가는 14일 종가 2525원을 기록하며 약 60% 하락했다. YG PLUS 관계자는 15일 “신규 사업 진출로 투자비용이 늘어 영업실적이 플러스로 돌아서지 못했다”며 “올해 하반기 중국 화장품 판매 허가 승인이 가능할 것으로 예상하는 만큼, 실적 개선까지는 좀 더 시간이 필요할 것 같다”고 전했다. 2년전 이 회사는 국내 화장품업체 코스온의 홍콩 자회사인 ‘코드코스메’를 인수해 ’문샷’을 런칭했다. 이후 문샷은 명동과 동대문에 팝업 스토어를 열고, 지난해 7월 북경 세가프레도 커피숍 매장에 쇼룸을 오픈했다. 이어 롯데면세점, 명동 롯데영플라자 등에 연이어 입점하면서 유통채널을 확대했다. 9월에는 루이비통그룹 편집샵인 ‘세포라’를 통해 싱가포르, 말레이시아에 진출해 매장 25개점 입점에 성공했다. 숨가쁜 외형 확장과는 달리 현재 화장품 부문 매출은 전체 매출의 5~6% 수준에 불과하다. 사실 화장품 사업 진출에 있어 투자자들이 YG PLUS에 기대한 것은 실적보다는 중국 진출이었다. YG엔터테인먼트를 통한 공격적인 마케팅으로 중국에서 소위 ‘대박’이 날 것이라고 기대했기 때문이다. 하지만 중국 식약청으로의 위생허가 획득이 2016년 이후로 미뤄지면서 시장내 실망 매물이 나오기 시작했다. 국내 기관에서 대량 매도 물량을 쏟아낸데 이어, 실적악화 지속으로 소위 ‘사겠다’는 사람이 없다. 화장품 사업 외에도 추가로 신규 사업에 진출하며 투자비용이 높아진 탓에 실적은 더 처참했다. 2011년부터 2015년까지 5년간 영업손실, 지난 4년간 순손실을 기록했다. 백준기 NH투자증권 연구원은 “회사 내부에서 올해 상반기 내 중국 화장품 판매 허가 승인을 받겠다는 목표를 정한 것으로 안다”며 “올해 화장품 광고를 시작으로 공격적인 마케팅을 계획하고 있어 당분간 비용부담은 이어지겠지만 장기적인 관점에서는 저가 매수의 기회가 될 수 있다”고 전했다. 증권업계에서는 2017년 이후에나 실적 턴어라운드가 가능할 것으로 보고 있다. 다만 지난해 10월 새로 취임한 장재영 대표의 경영 능력에 따라 턴어라운드 시기가 좀 더 당겨지지 않겠냐는 기대가 있는 것은 분명해 보인다."
한국경제,037270,/news/news_read.nhn?article_id=0003459833&office_id=015&mode=search&query=YG PLUS&page=1,2015-10-23 13:30,"YG엔터, 종속사 YG PLUS가 자회사 흡수합병",[ 노정동 기자  ] 와이지엔터테인먼트는 23일 종속사 YG PLUS가 기업가치를 제고하기 위해 MD 제조와 유통판매 업체인 100% 자회사 와이지넥스트를 흡수합병한다고 공시했다. 노정동 한경닷컴 기자
매일경제,037270,/news/news_read.nhn?article_id=0004030099&office_id=009&mode=search&query=YG PLUS&page=1,2017-10-16 13:32,"YG PLUS, 싱가포르에 첫 해외지점 설립","YG PLUS가 동남아시아 시장 진출의 신호탄을 쐈다. YG엔터테인먼트의 자회사 YG PLUS는 16일 싱가포르 현지에 지점을 설립하고 동남아 시장 진출을 본격화한다고 밝혔다. 싱가포르 지점은 동남아시아 현지의 다양한 업체들과 협업을 통해 YG그룹의 엔터테인먼트, 마케팅, 화장품, F&B, 스포츠, 모델 등의 해외 사업을 확장하고 기존 사업과 시너지 창출이 가능한 투자 대상들을 발굴해 나갈 예정이다. 또 해외 지점 설립과 함께 자회사인 YG인베스트먼트를 통해 싱가포르 현지 기업인 거쉬클라우드 인터내셔널(Gushcloud International)에 전략적 투자도 결정했다. 조현우 YG PLUS 싱가포르 지점 지사장은 ""이번 투자는 거쉬클라우드가 보유한 9개의 해외 지사를 통해 YG그룹의 아티스트를 비롯한 다양한 사업들을 동남아시아로 진출하기 위한 전략적 투자""라면서 ""앞으로 긴밀한 협력을 통해 해외시장 진출의 교두보를 마련할 것""이라고 말했다. [디지털뉴스국 김경택 기자] r_start // r_end //"
헤럴드경제,037270,/news/news_read.nhn?article_id=0000934816&office_id=016&mode=search&query=YG PLUS&page=1,2015-12-10 15:43,"&lt;생생코스피&gt;YG PLUS, 자회사 주식 89.8억 규모 취득 결정","YG PLUS는 사업역량 강화 및 경쟁력 확보를 위해 자회사 코드코스메인터내셔널 주식 179만6000주를 취득키로 결정했다고 10일 공시했다. 취득금액은 89억8000만원이며 이는 자기자본대비 8.55%에 해당한다. 취득후 지분율은 93.33%(280만주), 취득예정일자는 오는 15일이다."
매일경제,037270,/news/news_read.nhn?article_id=0004040962&office_id=009&mode=search&query=YG PLUS&page=1,2017-11-02 09:59,"YG PLUS 계열사 그린웍스, 네이버에 골프서비스 플랫폼 론칭","YG PLUS의 계열사인 그린웍스가 국내 최대 검색 포털사이트인 네이버를 통해 온라인 골프 예약서비스를 선보인다. 2일 그린웍스에 따르면 네이버와 그린웍스는 협업을 통해 국내 최대 골프 예약서비스를 새롭게 만들었다. 그린웍스는 네이버에 국내 300여개 골프장의 최저가 그린피 예약 기능을 담은 예약 플랫폼을 구축했다. 모바일 또는 인터넷 검색 포털에서도 누구나 손쉽게 바로 이용할 수 있다. 네이버에서 원하는 골프장을 검색하면 바로 예약서비스를 진행할 수 있는 플랫폼으로, 온라인 결제 옵션으로 N Pay(네이버 페이)까지 지원돼 간편하게 이용할 수 있다. 또 전국 골프장 검색 정보를 대대적으로 업데이트해 이용자가 필요로 하는 최신 정보를 보다 정확하게 제공할 수 있게 됐다. 그린웍스는 약 72만여명의 회원을 보유한 국내 최대 골프예약서비스 '엑스골프(XGOLF)'를 운영하는 회사다. 현재 국내 300여개 골프장과 해외 인기 골프장의 예약 서비스를 제공하고 있으며 최근에는 O2O(Online to Offline)사업의 일환으로 골프장·골프연습장 위탁 운영 사업에 나서고 있다. 조성준 그린웍스 대표는 ""이번 협업을 토대로 향후 AI 스피커 및 인공지능 비서 'Clova(클로바)'를 통해 골프장 관련 서비스도 제공할 예정""이라면서 ""국내 골프 시장의 성장에 기여할 수 있도록 네이버와 함께 골프 분야의 다양한 콘츠를 개발해 나갈 것""이라고 말했다. [디지털뉴스국 김경택 기자] r_start // r_end //"
이데일리,037270,/news/news_read.nhn?article_id=0003651249&office_id=018&mode=search&query=YG PLUS&page=1,2016-10-13 15:57,"YG PLUS, 종속사가 주주배정 유상증자 결정",[이데일리 임현영 기자] YG PLUS(037270)는 종속사인 와이지프라이빗에쿼티가 운영자금 100억원을 조달하고자 보통주 200만주를 발행하는 주주배정 유상증자를 결정했다고 13일 공시했다. 회사 측은 취득 목적에 대해 “사업역량 강화 및 경쟁력 확보”라고 밝혔다.
