source,symbol,link,date,title,content
이데일리,037270,/news/news_read.nhn?article_id=0004099627&office_id=018&mode=search&query=YG PLUS&page=1,2018-05-11 13:01,"YG PLUS, 中 화장품업체 춘원과 200억 규모 공급계약","올해 中 주요 H&amp;B 채널 600여곳 입점‘티몰’, ‘타오바오’ 등 온라인 쇼핑몰 판매 본격화110여개 이상 제품 중국 위생허가 받아- 이 달부터 공급 예정으로 올 해부터 중국 매 [이데일리 박형수 기자] YG엔터테인먼트 자회사 YG PLUS(037270)가 중국 화장품 시장에 진출했다. YG PLUS는 화장품 사업을 하는 자회사 코드코스메인터내셔널이 중국 화장품 유통업체인 항주춘원무역유한공사와 공급계약을 체결했다고 11일 밝혔다. YG PLUS는 내년 말까지 약 200억원 규모의 화장품 브랜드 문샷 제품을 춘원에 공급하기로 했다. YG PLUS는 춘원과 함께 올해 중으로 피오나코스(Fionacos), 왓슨스(WATSONS), T3C 등 중국 주요 H&B 채널 600여곳에 입점한다. 중국 최대 온라인 쇼핑몰인 ‘티몰’과 ‘타오바오’에서도 판매할 계획이다. 현지 오프라인 채널을 확대해 중국 시장을 적극 공략한다. 춘원은 중국 전 지역에 H&B 매장과 백화점, 쇼핑몰 등 주요 오프라인 채널 3만여 곳을 보유하고 있는 화장품 유통업체다. 최근 K뷰티를 육성하는 데 집중하고 있어 문샷이 중국 시장에 안착하는 데 힘을 쏟을 것으로 기대된다. YG PLUS는 지난해까지 110여개 품목에 대한 위생허가 취득을 완료했다. 최근 베스트제품인 ‘지디 오 드 뚜왈렛(GD Eau De Toilette)’ 위생허가도 취득했다. 지디향수는 YG엔터테인먼트 소속 아티스트인 지디와 문샷이 협업해 지난 2016년 6월 출시한 제품이다. 출시한 첫해 12만개 이상 팔리며 큰 인기를 끌었다. 현재까지 국내 화장품 브랜드가 출시한 향수 제품 가운데 가장 많이 팔린 제품이다. 마이크로핏 쿠션, 페이스 퍼펙션 밤쿠션, 크림페인트라이트핏 등 인기제품도 최근 위생허가를 취득했다. 양민석 YG PLUS 대표는 “YG의 코스메틱 브랜드 문샷을 중국시장에 선보인다”며 “춘원의 강력한 네트워크와 YG가 보유한 다양한 콘텐츠 및 인프라를 활용해 중국 화장품 시장에 성공적으로 자리매김할 것” 이라고 말했다. YG PLUS는 본격적으로 해외시장에 진출하면서 신제품을 적극적으로 개발하고 있다. 홍콩, 싱가포르, 태국, 말레이시아에 이어 인도네시아와 필리핀에도 진출할 계획이다."
헤럴드경제,037270,/news/news_read.nhn?article_id=0001341727&office_id=016&mode=search&query=YG PLUS&page=1,2018-01-17 10:12,"[생생코스닥] YG PLUS, 동남아시아 화장품 시장 진출 본격화","- 지난해말 말레이시아에 첫 단독매장 오픈 후 연달아 3개 단독매장 오픈 - 중국 위생허가 순항 중…올해 중국 시장 진출로 새로운 활로 개척  [헤럴드경제=김지헌 기자] YG엔터테인먼트의 자회사인 코스닥 상장사 YG PLUS(대표이사 양민석)는 YG코스메틱 브랜드 ‘문샷’이 지난해말 말레이시아 대형 쇼핑몰 세 곳에 단독매장을 잇따라 오픈한데 이어, 16일 글로벌 면세점 체인인 DFS그룹 ‘T갤러리아(구 DFS 갤러리아)’의 홍콩점에 추가로 입점하며 동남아시아 진출이 본격화되고 있다고 17일 전했다. ‘문샷(moonshot)’은 YG PLUS의 자회사인 코드코스메인터내셔널이 론칭한 코스메틱 브랜드로, 일명 ‘지디쿠션’ 으로 불리우는 ‘마이크로핏 쿠션’과 ‘크림페인트 라이트핏’ 등의 제품을 판매하고 있다. 지난 2015년 6월 브랜드 런칭 이후 1년 만에 글로벌 화장품 편집샵인 ‘세포라(Sephora)’와 홍콩의 뷰티 편집샵 ‘사사(SASA)’ 등에 입점하며 큰 관심을 모았다.  또 지난해 11월 말레이시아 쿠알라룸푸르의 대형 쇼핑몰 선웨이 피라미드(Sunway Pyramid)에 해외 첫 단독매장을 오픈하고, 같은달 대형쇼핑몰인 원 우타마(One Utama)에, 12월에는 파빌리온 몰(Pavilion Mall)에 연달아 단독매장을 오픈했다. 특히 특히, 선웨이 피라미드와 파빌리온 몰은 말레이시아를 대표하는 쇼핑몰로써 쿠알라룸푸르에서 유동인구가 가장 많은 지역으로 손꼽힌다.  홍콩면세점 [사진=YG플러스 제공] 최근에는 글로벌 면세점 체인인 DFS그룹의 T갤러리아(구 DFS 갤러리아)의 홍콩 하이산플레이스 지점에 단독 입점했다. 하이산플레이스는 홍콩에서 가장 트렌디한 쇼핑몰로 이 곳 1층에 위치한 T갤러리아는 홍콩 시내에 처음 오픈한 대형 뷰티 면세점이다. 전세계 50여개의 유명 화장품 브랜드가 입점해 있으며, 홍콩 시내 쇼핑의 메카 중 한 곳으로 손꼽힌다. YG PLUS는 홍콩, 말레이시아, 싱가포르 등에 전략적 거점과 유통채널을 확보함은 물론, 올 해 안에 태국, 인도네시아, 필리핀 등의 국가에도 진출해 동남아시아 시장의 확실한 기반을 마련할 계획이다. 한편, 중국시장 진출에도 속도가 날 전망이다. 그 동안 중국 위생허가를 꾸준히 취득하며 기반을 다져온 회사는 2017년말까지 약 110여개 제품의 품목허가를 완료했다. YG PLUS 관계자는 “‘문샷’은 YG PLUS의 성장동력으로 그 동안 많은 기대를 받아왔다” 며 “꾸준한 투자와 적극적인 해외시장 개척의 결과가 올 해부터 가시화될 전망으로 올 해가 화장품 사업 성장의 원년이 될 것으로 기대한다” 고 말했다."
서울경제,037270,/news/news_read.nhn?article_id=0003267232&office_id=011&mode=search&query=YG PLUS&page=1,2018-04-11 11:14,"&lt;유&gt;YG PLUS, 전일 대비 7.03% 상승.. 일일회전율은 1.21% 기록","[서울경제] YG PLUS(037270) 는 11일 오전 11시 13분 현재 7.03% 오른 2,435원에 거래되고 있으며, 42(매도):58(매수)의 매수우위를 기록하고 있다. 거래대금은 16억8,439만, 거래량은 70만5,754주로 거래량회전율은 1.21%로 나타났다. 지난 1개월간 YG PLUS는 상승 17회, 하락 12회를 기록했고, 주가수익률은 21.75% 표준편차는 2.01%를 기록했다. 이 기간 ' 서비스업 ' 업종 평균 주가수익률은 -3.07%로 나타났으며, 변동성은 1.30%를 기록했다. 이 시각 현재 ' 서비스업 '은 0.92% 상승 중이며, 43(매도):57(매수)의 매수우위를 기록하고 있다."
아시아경제,037270,/news/news_read.nhn?article_id=0004198255&office_id=277&mode=search&query=YG PLUS&page=1,2018-03-16 09:23,"YG PLUS, 일본 라인뮤직과 K-POP 음원 공급계약 체결","[아시아경제 권성회 기자] YG엔터테인먼트의 자회사 YG PLUS가 일본 내 음악스트리밍 서비스 업체인 라인뮤직과 케이팝(K-POP) 음원 공급계약을 체결했다고 16일 밝혔다. 라인뮤직은 네이버의 일본 자회사인 라인주식회사가 2015년 6월, 일본 내 모바일 메신저 1위인 라인과 연계해 출시한 음악 스트리밍 서비스다. 출시 3년 만에 사용자 수가 700만명에 달하면서 일본 음악 스트리밍 서비스 시장 2위로 급성장했으며, 최근에는 네이버의 인공지능(AI) 기반 스피커인 웨이브와 연계한 다양한 프로모션을 통해 사용자 확대에 주력하고 있다. YG PLUS는 지난해 10월, 네이버와 '공동 음악 사업 추진을 위한 업무 협약'을 체결했으며, 이에 따른 첫 번째 사업으로 네이버 내 AI 기반의 음악 서비스 인프라 고도화를 추진 중이다. 또한 후속사업으로 라인뮤직과 음원공급계약을 체결하며 네이버와 음악 사업에 대한 협력을 확대해 나가고 있다. YG PLUS 관계자는 “최근 글로벌 음악 플랫폼들은 AI를 기반으로 한 큐레이션 서비스 확대에 나서고 있으며, 이에 대한 선제적 대응으로 지난 1월 글로벌 뮤직 데이터를 보유한 그레이스노트와 K-POP 데이터 고도화에 대한 업무협약을 체결했다”며 “K-POP 음원 콘텐츠와 AI를 기반으로 한 큐레이션 데이터를 함께 공급함으로써 음악 콘텐츠 사업자로써 차별화된 경쟁력을 확보하고 K-POP의 글로벌 시장 확대에 기여할 것”이라고 말했다. YG PLUS는 라인뮤직과 음원공급계약을 시작으로 다양한 글로벌 음악 플랫폼 사업자들과 협력을 확대해 나갈 계획이다."
이데일리,037270,/news/news_read.nhn?article_id=0004074893&office_id=018&mode=search&query=YG PLUS&page=1,2018-04-09 10:18,"YG PLUS, 네이버뮤직 서비스 운영 대행&hellip;협업 본격화",연내 다양한 신규 음악사업 추진…음원유통도 속도 [이데일리 이명철 기자] YG엔터테인먼트(122870) 자회사 YG PLUS(037270)는 지난 1일부터 네이버(035420)가 운영하는 네이버뮤직 서비스 운영 대행을 시작했다고 9일 밝혔다. 앞서 회사와 네이버는 지난해 10월 음악 사업을 추진하기로 업무 협약을 체결하고 네이버 뮤직에 대한 독점 콘텐츠 공급 등을 포함한 서비스 운영 대행을 진행하기로 협의한 바 있다. 네이버가 계획 중인 인공지능(AI) 기반 음악 서비스 구현을 위해 지난 1월에는 AI 기반 엔터테인먼트 데이터 서비스를 제공하는 그레이스노트와 K-POP 뮤직 데이터 고도화에 대한 업무 협약도 체결했다. 회사는 네이버와 협력 관계 외에도 최근 일본 라인 뮤직과 K-POP 콘텐츠 공급계약을 체결하는 등 음원유통사업 확대에 속도를 내고 있다. 회사 관계자는 “네이버뮤직 서비스 운영 대행 업무를 시작으로 상반기 중 보다 고도화된 뮤직 데이터베이스와 차별화된 콘텐츠를 공급할 것”이라며 “네이버뮤직의 서비스 경쟁력을 강화하고 연내 네이버와 다양한 신규 음악사업도 추진할 계획”이라고 말했다.
서울경제,037270,/news/news_read.nhn?article_id=0003245569&office_id=011&mode=search&query=YG PLUS&page=1,2018-03-16 10:13,"(유)YG PLUS, 전일 대비 7.04% 상승.. 일일회전율은 0.23% 기록","[서울경제] YG PLUS(037270) 는 16일 오전 10시 11분 현재 7.04% 오른 2,130원에 거래되고 있으며, 17(매도):83(매수)의 매수우위를 기록하고 있다. 거래대금은 2억7,257만, 거래량은 13만3,206주로 거래량회전율은 0.23%로 나타났다. 지난 1개월간 YG PLUS는 상승 14회, 하락 14회를 기록했고, 주가수익률은 4.16% 표준편차는 2.92%를 기록했다. 이 기간 ' 서비스업 ' 업종 평균 주가수익률은 -6.98%로 나타났으며, 변동성은 1.43%를 기록했다. 이 시각 현재 ' 서비스업 '은 0.32% 상승 중이며, 48(매도):52(매수)의 매수우위를 기록하고 있다."
아시아경제,037270,/news/news_read.nhn?article_id=0003956346&office_id=277&mode=search&query=YG PLUS&page=1,2017-03-20 09:16,"[특징주]YG PLUS, 네이버 1000억 투자에 급등","[아시아경제 조강욱 기자] YG PLUS가 네이버로부터 총1000억원에 이르는 투자금을 유치했다는 소식에 장 초반 급등세를 보이고 있다. 20일 오전 9시8분 현재 YG PLUS는 전 거래일보다 21.60% 오른 2730원에 거래되고 있다. 네이버는 지난 17일 주주총회에서 YG엔터테인먼트의 3자배정 유상증자에 500억원, YG PLUS의 자회사인 YG인베스트먼트 펀드에 500억원 출연 등 총 1000억원을 투자키로 결정했다. 네이버는 이번 투자를 통해 지분율 9.14%로 2대 주주가 된다. 황승택 하나금융투자 연구원은 ""이번 네이버의 YG엔터테인먼트 투자는 콘텐츠 경쟁력 강화를 통한 서비스 품질 향상 및 플랫폼 확대라는 측면에서 긍정적인 성과를 기대한다""면서 ""YG의 콘텐츠 생산능력과 브랜드 인지도를 고려할 때 네이버 플랫폼 유통은 트래픽 증가효과와 더불어 충성도 향상에도 기여할 것""이라고 판단했다."
아이뉴스24,037270,/news/news_read.nhn?article_id=0000446504&office_id=031&mode=search&query=YG PLUS&page=1,2018-05-11 13:50,"YG PLUS, 中 춘원과 200억 화장품 공급계약","[아이뉴스24 김다운 기자] YG엔터테인먼트의 자회사 YG PLUS는 화장품 사업을 전개 중인 자회사 코드코스메인터내셔널이 중국 코스메틱 유통업체인 항주춘원무역유한공사(춘원)와 공급계약을 체결했다고 11일 밝혔다. YG PLUS는 오는 2019년 12월 31일까지 약 200억원 규모의 제품을 춘원에 공급하기로 합의하고, 이달부터 납품을 시작한다. YG PLUS는 춘원과 함께 올해 안에 피오나코스(Fionacos), 왓슨스(WATSONS) 등 중국의 주요 H&B 채널 600여곳에 입점하고 중국 최대의 온라인 쇼핑몰인 티몰과 타오바오에서도 판매를 본격화할 계획이다. 또한 현지 오프라인 채널을 점차 확대해 중국시장을 적극 공략하고 확대해 나간다는 전략이다. 춘원은 중국 전 지역에 H&B 매장과 백화점, 쇼핑몰 등 주요 오프라인 채널 3만여 곳을 보유하고 있는 코스메틱 유통업체 강자로, 최근에는 'K뷰티' 육성에 집중하고 있어 '문샷'의 중국시장 런칭에 더욱 힘을 쏟을 것이라는 기대다. YG PLUS는 지난해까지 110여개 품목에 대한 위생허가 취득을 완료했으며, 최근에는 베스트제품인 '지디 오 드 뚜왈렛(GD Eau De Toilette)', 일명 '지디향수'의 위생허가도 취득했다. 지디향수는 YG 아티스트 지디와 문샷이 콜라보레이션해 2016년 6월 출시한 제품으로, 출시 첫해에만 12만개 이상이 판매됐다. 또한 마이크로핏 쿠션, 페이스 퍼펙션 밤쿠션, 크림페인트라이트핏 등의 베스트제품도 최근 위생허가를 취득해 중국시장 진출과 맞물려 중국 매출확대에 더욱 속도가 날 것으로 회사 측은 기대하고 있다. 양민석 YG PLUS 대표는 ""YG의 코스메틱 브랜드 문샷을 중국시장에 런칭하게 되어 매우 기쁘게 생각하며 춘원의 강력한 네트워크와 YG가 보유한 다양한 콘텐츠 및 인프라를 적극 활용해 올 해 안에 중국 화장품 시장에 성공적으로 자리매김할 것""이라고 말했다. 한편 YG PLUS는 해외시장 진출이 본격화됨에 따라 중국, 동남아 등 글로벌 신제품 개발에 박차를 가하고 있으며, 홍콩, 싱가포르, 태국, 말레이시아에 이어 올해 안에 인도네시아와 필리핀에도 진출할 계획이다. /김다운기자"
헤럴드경제,037270,/news/news_read.nhn?article_id=0001392047&office_id=016&mode=search&query=YG PLUS&page=1,2018-05-11 11:23,"[생생코스피] YG PLUS, 中 화장품업체 &lsquo;춘원&rsquo;과 200억 규모 공급계약 체...","- 올 해 中 주요 H&amp;B 채널 600여곳 입점, ‘티몰’, ‘타오바오’도 판매 본격화- 110여개 이상 제품 위생허가 완료, 최근 지디향수, 쿠션 등 베스트제품 위생허가도 취득해 [헤럴드경제=김지헌 기자] YG PLUS가 중국 화장품 시장에 진출했다.  YG엔터테인먼트의 자회사이자 유가증권시장 상장사인 YG PLUS(대표이사 양민석)는 화장품 사업을 전개 중인 자회사 ‘코드코스메인터내셔널(브랜드: 문샷(moonshot))’이 중국 코스메틱 유통업체인 항주춘원무역유한공사(杭州春源易有限公司, 이하 ‘춘원’)와 공급계약을 체결했다고 11일 밝혔다. YG PLUS는 오는 2019년 12월 31일까지 약 200억원 규모의 제품을 춘원에 공급하기로 합의하고, 이 달부터 납품을 시작한다. YG PLUS는 춘원과 함께 올 해 안에 피오나코스(Fionacos), 왓슨스(WATSONS), CONTTIE, T3C 등 중국의 주요 H&B 채널 600여곳에 입점하고 중국 최대의 온라인 쇼핑몰인 ‘티몰’과 ‘타오바오’ 에서도 판매를 본격화할 계획이다. 또한 현지 오프라인 채널을 점차 확대해 중국시장을 적극 공략하고 확대해 나간다는 전략이다. 춘원은 중국 전 지역에 헬스앤드뷰티(H&B) 매장과 백화점, 쇼핑몰 등 주요 오프라인 채널 3만여 곳을 보유하고 있는 코스메틱 유통업체 강자로, 최근에는 ‘K뷰티’ 육성에 집중하고 있어 ‘문샷’의 중국시장 런칭에 더욱 힘을 쏟을 것으로 예상된다. YG PLUS는 지난해까지 110여개 품목에 대한 위생허가 취득을 완료했으며, 최근에는 베스트제품인 ‘지디 오 드 뚜왈렛(GD Eau De Toilette), 일명 지디향수’의 위생허가도 취득했다. 지디향수는 YG 아티스트 ‘지디’와 ‘문샷(moonshot)’이 콜라보레이션해 2016년 6월 출시한 제품으로, 출시 첫 해에만 12만개 이상이 판매되며 큰 인기를 끌었으며, 현재까지 국내 화장품 기업이 출시한 향수 제품 중 가장 많이 팔린 제품이기도 해 더욱 기대가 크다. 또한 마이크로핏 쿠션, 페이스 퍼펙션 밤쿠션, 크림페인트라이트핏 등의 베스트제품도 최근 위생허가를 취득해 중국시장 진출과 맞물려 중국向 매출확대에 더욱 속도가 날 것으로 기대하고 있다. 양민석 YG PLUS 대표는 “YG의 코스메틱 브랜드 ‘문샷’을 중국시장에 런칭하게 되어 매우 기쁘게 생각하며 춘원의 강력한 네트워크와 YG가 보유한 다양한 콘텐츠 및 인프라를 적극 활용해 올 해 안에 중국 화장품 시장에 성공적으로 자리매김할 것” 이라고 말했다. 한편, YG PLUS는 해외시장 진출이 본격화됨에 따라 중국, 동남아 등 글로벌向 신제품 개발에 박차를 가하고 있으며, 홍콩, 싱가포르, 태국, 말레이시아에 이어 올 해 안에 인도네시아와 필리핀에도 진출할 계획이다."
한국경제,037270,/news/news_read.nhn?article_id=0003937308&office_id=015&mode=search&query=YG PLUS&page=1,2018-05-11 11:45,"YG PLUS &quot;문샷, 中 춘원과 200억 규모 공급계약&quot;","YG PLUS는 자회사 코드코스메인터내셔널이 중국 화장품 유통업체인 항주춘원무역유한공사(杭州春源贸易有限公司·이하 춘원)와 200억원 규모 제품 공급계약을 체결했다고 11일 밝혔다. YG PLUS는 춘원과 함께 올해 자사 브랜드 '문샷'을 '피오나코스', '왓슨스', 'CONTTIE', 'T3C' 등 중국의 주요 헬스앤드뷰티(H&B) 채널 600여 곳에 입점시키고 중국 온라인 쇼핑몰인 '티몰'과 '타오바오'에서도 판매를 본격화할 계획이다. YG PLUS 관계자는 ""지난해까지 110여개 품목에 대한 중국 위생허가 취득을 마쳤고, 최근에는 베스트 향수제품인 '지디 오 드 뚜왈렛(GD Eau De Toilette)'의 위생허가를 받았다""고 설명했다. 오정민 한경닷컴 기자"
한국경제,037270,/news/news_read.nhn?article_id=0003743548&office_id=015&mode=search&query=YG PLUS&page=1,2017-03-20 19:03,[Hot Stock] YG PLUS,20일 유가증권시장에서 19.38%(435원) 오른 2680원에 장을 마감했다. 최근 3거래일 동안 41.05% 올랐다. 지난 17일 장 마감 후 네이버가 이 회사 자회사인 YG인베스트먼트와 계열사 YG엔터테인먼트에 각각 500억원을 투자하기로 했다는 발표가 영향을 줬다는 분석이다. [
파이낸셜뉴스,037270,/news/news_read.nhn?article_id=0003999662&office_id=014&mode=search&query=YG PLUS&page=1,2018-04-11 09:46,"[fnRASSI]YG PLUS, 4.62% 오르며 거래량 증가","YG PLUS는 투자자들의 관심으로 당일 거래량이 최근 5거래일 거래량의 최고치를 경신했다. 그리고 YG PLUS는 3일 연속 상승흐름을 보이며, 9시 42분 현재 4.62% 증가한 2,380원에 거래중이다. 외국인/개인 순매수, 기관은 순매도(한달누적)  전일 외국인이 17,560주를 사들인 반면 기관은 62,881주를 팔았다. 4주간을 기준으로 보면 외국인이 100,296주를 순매수했고, 개인들도 매매관점을 매도에서 매수로 전환하면서 11,068주를 순매수했다. 하지만 기관은 매도 우위로 반전되면서 111,364주를 순매도했다.                   지표               항목               값               종합점수                 성장성               매출액증가율               0.03               5.9                 자기자본증가율               0.01                 안정성               부채비율               18.95               7.22                 유동비율               382.91                 이익안정성               4.44                 수익성               ROA               -6.98               1.32                 ROE               -8.3                 영업이익율               -8.24          YG PLUS의 퀀트 재무 점수는 14.44점으로 지난 분기에 비해 성장성 점수가 하락했다. 이는 매출액 증가율이 감소하였기 때문이다. 실적 안정성이 악화되어 안정성 종합 점수는 하락했다. 수익성 측면에서 볼때 영업이익률이 개선되어 이전보다 좋은 점수를 받았다. 'fnRASSI'는 증권전문 기업 씽크풀과 파이낸셜뉴스의 협업으로 로봇기자가 실시간으로 생산하는 기사입니다."
머니S,037270,/news/news_read.nhn?article_id=0000315919&office_id=417&mode=search&query=YG PLUS&page=1,2018-05-10 11:17,"YG PLUS, YG 굿즈샵 새단장&hellip;&quot;스토리텔링 입혔다&quot;","YG엔터테인먼트의 자회사 YG PLUS가 기존의 YG E-shop을 ‘YG SELECT ’로 바꾸고 다섯 가지 색다른 콘셉트를 담은 쇼핑몰을 오픈했다고 10일 밝혔다. /사진=YG PLUS 다섯가지의 콘셉트는 ‘Focus On Artist, Attractive Contents, Fan Activity, Cross Selling, Mobile Platform’으로, 아티스트 중심의 다양한 굿즈와 스토리텔링 컨텐츠, 팬들을 위한 독립적인 커뮤니티 공간과 YG만의 다양한 브랜드 상품들을 만나볼 수 있는 모바일 기반의 신개념 플랫폼을 의미한다. 그 동안 YG E-shop이 YG 아티스트 앨범과 굿즈 중심이었다면, YG SELECT 에서는 YG의 대표 캐릭터인 ‘크렁크(KRUNK)’를 비롯해 셀럽들을 위한 패션브랜드 ‘노나곤’, YG 코스메틱 브랜드 ‘문샷(moonshot)’ 등 YG만의 다양한 브랜드들을 함께 만나볼 수 있다. /사진=YG PLUS YG PLUS 측은 “YG SELECT는 단순한 굿즈샵을 넘어 YG 아티스트들에 대한 스토리와 컨텐츠, 다양한 상품과 이야기가 있는 색다른 쇼핑몰이자 플랫폼으로, YG만의 특별한 감성과 브랜드 스토리를 만날 수 있을 것” 이라고 말했다. 강인귀 기자"
이데일리,037270,/news/news_read.nhn?article_id=0004057838&office_id=018&mode=search&query=YG PLUS&page=1,2018-03-16 09:37,"YG PLUS, 日 라인뮤직 통해 K-POP 음원 선보인다",AI 기반 음악서비스 인프라 고도화 추진 일환 [이데일리 이명철 기자] 와이지엔터테인먼트(122870) 자회사 YG PLUS(037270)는 일본 음악스트리밍 서비스 업체 라인뮤직과 K-POP(케이팝) 음원 공급계약을 체결했다고 16일 밝혔다. 라인뮤직은 네이버의 일본 자회사 라인이 2015년 6월 일본 모바일 메신저 라인과 연계해 출시한 음악 스트리밍 서비스다. 출시 3년만에 사용자수가 700만명에 달하며 일본 음악 스트리밍 서비스 시장 2위로 성장했다. 최근 네이버의 인공지능(AI) 기반 스피커인 웨이브와 연계한 다양한 프로모션을 진행 중이다. 앞서 지난해 10월 YG PLUS와 네이버는 공동 음악사업 추진을 위한 업무 협약을 체결한 바 있다. 이에 따른 첫 사업으로 네이버 AI 기반의 음악 서비스 인프라 고도화를 추진 중이다. 후속사업으로 라인뮤직과 음원 공급계약을 체결해 음악 사업 협력을 확대하는 것이다. 향후 다양한 글로벌 음악 플랫폼 사업자들과도 협력을 확대할 계획이다. 회사 관계자는 “최근 글로벌 음악 플랫폼들이 AI 기반 큐레이션 서비스 확대에 나섬에 따라 1월에는 글로벌 뮤직 데이터를 보유한 그레이스노트와 케이팝 데이터 고도화에 대한 업무협약을 체결했다”며 “케이팝 음원콘텐츠와 AI 기반 큐레이션 데이터를 함께 공급해 음악 콘텐츠 사업자로서 차별화된 경쟁력을 확보할 것”이라고 말했다.
