source,symbol,link,date,title,content
뉴시스,037270,/news/news_read.nhn?article_id=0008565863&office_id=003&mode=search&query=YG PLUS&page=1,2018-04-26 18:11,"YG PLUS, 업종 변경...'광고업'&rarr;'인형,장난감 및 오락용품 제조업'","【서울=뉴시스】이진영 기자 = YG PLUS(037270)은 업종을 '광고업'에서 '인형,장난감 및 오락용품 제조업'으로 변경한다고 26일 공시했다."
머니투데이,037270,/news/news_read.nhn?article_id=0004026197&office_id=008&mode=search&query=YG PLUS&page=1,2018-03-21 14:28,"YG PLUS, 中 화장품 시장 진출 &quot;H&amp;B스토어&middot;백화점 입점한다&quot;","[머니투데이 김건우 기자] [코스맥스 전폭적인 지원 기대, 114개 위생허가 완료 ] 와이지엔터테인먼트의 자회사 YG PLUS는 21일 중국 항저우에서 현지 유통업체 항주춘원무역유한공사(이하 춘원) 및 레시피와 색조화장품 문샷의 중국 유통을 위한 양해각서를 체결했다고 밝혔다. 이 날 행사에는 YG PLUS 양민석 대표, 코스맥스 이경수 회장, 춘원의 왕지리 회장, 레시피의 이윤식 대표 등을 비롯하여 중국 내 주요 거래상들이 많이 참석했다. 춘원은 중국 내 1만여 개의 H&B 매장을 비롯해 백화점, 쇼핑몰 등 중국 전 지역 주요 오프라인 채널 3만여 곳 이상에서 화장품 브랜드를 유통하고 있다. 문샷은 춘원의 강력한 네트워크와 레시피의 제품전략 및 마케팅 역량을 바탕으로 베이징, 상하이 등 중국 주요 지역의 H&B스토어, 백화점, 쇼핑몰 등 다양한 오프라인 채널에 입점할 계획이다. 또 중국 최대의 온라인 쇼핑몰인 티몰과 타오바오 등 온라인 채널 마케팅도 강화한다고 회사 측은 설명했다. 왕지리 춘원 회장은 “K-뷰티를 선도하는 와이지엔터테인먼트의 코스메틱 브랜드 ‘문샷’을 중국시장에 함께 선보여 매우 기쁘게 생각한다""며 ""문샷이 중국 시장에 성공적으로 자리매김할 수 있도록 전사적인 노력을 하겠다""고 말했다. 이 날 행사에 참석한 이경수 코스맥스 회장은 문샷의 중국시장 진출을 적극 지원할 뜻을 내비쳤다. 이경수 회장은 ""문샷이 중국 화장품 시장에 새로운 바람을 일으킬 수 있도록 와이지엔터-코스맥스-춘원-레시피가 함께 힘을 모을 것” 이라고 말했다. 코스맥스는 현재 문샷에 제품을 공급하고 있다. 그동안 YG PLUS는 중국 화장품 시장 진출을 위해 제품위생허가를 꾸준히 취득해왔다. 올 해 3월을 기준으로 약 114개의 위생허가를 완료했다. 올 상반기 중 히트제품인 ‘지디향수’, ‘쿠션’ 등의 위생허가를 추가로 취득하면 중국향 매출확대에 속도가 날 것으로 예상된다. 양민석 대표는 ""각 분야에서 최고의 역량을 가지고 있는 춘원, 레시피와의 강력한 파트너십을 기반으로 YG가 보유한 다양한 콘텐츠와 인프라를 적극 활용해 문샷이 올 해 안에 중국시장에 성공적으로 자리매김할 수 있도록 최선을 다하겠다""고 말했다."
머니투데이,037270,/news/news_read.nhn?article_id=0004050120&office_id=008&mode=search&query=YG PLUS&page=1,2018-05-11 11:09,"[특징주]YG PLUS, '문샷' 中 대규모 공급계약 '상승'","[머니투데이 김건우 기자] YG PLUS가 자회사 코드코스메인터내셔널이 중국 유통업체와 대규모 공급계약을 체결했다는 소식에 상승세다. 11일 오전 11시 6분 현재 YG PLUS는 전일대비 4.7% 상승한 2450원에 거래되고 있다. 이날 상승세는 YG PLUS의 색조 화장품 자회사 코드코스메인터내셔널이 중국 유통업체 항주춘원무역유한공사(이하 춘원)와 공급계약을 체결했다는 소식에 투자심리가 개선된 것으로 분석된다. YG PLUS는 오는 2019년 12월 31일까지 약 200억원 규모의 제품을 춘원에 공급할 계획이다. 이달부터 공급을 시작한다. YG PLUS는 춘원과 함께 올 해 안에 피오나코스, 왓슨스, CONTTIE, T3C 등 중국의 주요 유통 채널 600여곳에 입점하고 중국 최대의 온라인 쇼핑몰인 ‘티몰’과 ‘타오바오’ 에서도 판매를 본격화할 계획이다. 또 현지 오프라인 채널을 점차 확대해 중국시장을 적극 공략하고 확대해 나간다는 전략이다."
헤럴드경제,037270,/news/news_read.nhn?article_id=0001409580&office_id=016&mode=search&query=YG PLUS&page=1,2018-06-25 14:16,"YG PLUS, 네이버와 함께 AI 뮤직서비스 &lsquo;바이브&rsquo; 경쟁력 강화 나서","- 엔터테인먼트에 기술 더해 애플뮤직, 스포티파이 등 글로벌 음악 플랫폼 함께 만들 것 [헤럴드경제=김지헌 기자] 엔터테인먼트 및 콘텐츠의 YG와 기술의 네이버가 만났다. YG엔터테인먼트의 자회사 YG PLUS(대표이사 양민석)는 네이버가 새롭게 선보인 인공지능(AI) 뮤직 서비스인 ‘VIBE(이하 바이브)’의 경쟁력 강화에 본격 나선다고 25일 밝혔다. YG PLUS는 엔터테인먼트 분야의 역량을 바탕으로 바이브에 대한 ▷독점 콘텐츠를 비롯한 음원 공급 ▷서비스 운영 ▷정산 플랫폼 고도화 등을 포함한 다양한 분야에서 네이버와 협력한다. 특히 바이브는 AI 추천 기술을 활용해 사용자 개인의 취향을 고려한 ‘맞춤형 플레이리스트’를 끊임없이 생성해 준다는 점에서 보다 다양한 음원을 확보하는 것이 무엇보다 중요하다. YG PLUS는 이를 위해 오차드, 라우트노트 등 해외 음원 콘텐츠 유통사와 공급계약을 통해 국내 최대 수준인 4000만곡의 음원을 확보했으며, 올 하반기부터는 네이버와 공동으로 조성한 ‘YG-네이버 콘텐츠&라이프스타일 펀드’를 통해 경쟁력 있는 추가 음원 및 독점 콘텐츠 확보에 적극 나설 계획이다. YG PLUS 관계자는 “올 하반기부터 ‘YG-네이버 펀드’를 통해 본격적 투자를 진행할 예정이며, 이와 함께 개별 음원의 메타데이터를 구축하고 개별 음원의 특색과 특징을 분석할 수 있는 네이버의 딥러닝 기술을 결합해 애플 뮤직, 스포티파이 등과 경쟁할 수 있는 글로벌 음악 플랫폼을 함께 만들어 나갈 것” 이라고 말했다. 한편, YG PLUS는 지난해 10월 네이버와 공동 음악 사업 추진을 위한 업무 협약을 체결한 바 있으며, 앞으로도 바이브의 경쟁력 강화를 위해 네이버와 다각도로 협력해 나갈 계획이다."
파이낸셜뉴스,037270,/news/news_read.nhn?article_id=0003957812&office_id=014&mode=search&query=YG PLUS&page=1,2018-02-02 14:31,[fnRASSI]YG PLUS(037270) 현재 8.27% &uarr;,"현재 YG PLUS(037270)는 전일대비 8.27% 상승하여 2,225원 선에서 거래가 이루어지고 있다. 외국인, 기관 모두 보유량 증가 (5일 누적) 최근 5일간 동종목의 외국인 투자자는 58,572주 순매수하였고 마찬가지로 기관은 27,462주 순매수하였다. 전날 두 주체 각각 2,346주, 27,462주 순매수하며 보유 비율을 늘렸다. 다음 표는 동종목의 외국인, 기관의 일별 순매수량을 나타낸 것이다. 외국인/기관 순매수, 개인은 순매도(한달누적)  1월31일부터 전일까지 외국인이 2거래일 연속 순매수를 보였다. 4주간을 기준으로 보면 외국인이 107,606주를 순매수했고, 기관도 순매수량을 늘리며 29,941주를 순매수했다. 반면 개인들은 매도 우위를 지속하면서 137,547주를 순매도한 것으로 나타났다. 'fnRASSI'는 증권전문 기업 씽크풀과 파이낸셜뉴스의 협업으로 로봇기자가 실시간으로 생산하는 기사입니다."
헤럴드경제,037270,/news/news_read.nhn?article_id=0001369241&office_id=016&mode=search&query=YG PLUS&page=1,2018-03-21 16:08,"[생생코스피] YG PLUS, 중국 화장품 시장 출사표","- 올 해 中 H&amp;B스토어, 쇼핑몰, 백화점 등 입점, 중국 최대 온라인쇼핑몰인 ‘티몰’과 ‘타오바오’ 본격 진출 [헤럴드경제=김지헌 기자] 유가증권시장 상장사 YG PLUS가 중국 화장품 시장에 진출한다. YG엔터테인먼트의 자회사 YG PLUS(대표이사 양민석)는 지난 21일, 중국 항저우에서 현지 유수의 유통업체인 항주춘원무역유한공사(杭州春源易有限公司, 이하 ‘춘원’), ‘레시피’와 문샷 화장품의 중국 유통을 위한 양해각서를 체결했다고 21일 전했다. 이 날 행사에는 YG PLUS 양민석 대표, 코스맥스 이경수 회장, 춘원의 왕지리 회장, 레시피의 이윤식 대표 등을 비롯하여 중국 내 주요 거래상들이 많이 참석했다. 춘원은 중국 코스메틱 유통업체 강자로, 중국 내 1만여 개의 헬스앤뷰티(H&B) 매장을 비롯해 백화점, 쇼핑몰 등 중국 전 지역 주요 오프라인 채널 3만여 곳 이상에서 화장품 브랜드를 유통 중이다. 특히 그동안 한국 화장품 브랜드들을 중국시장에 성공적으로 런칭해 왔으며, 최근에는 한국 화장품 브랜드 집중육성사업에 나서며 K-뷰티에 집중하고 있다. [사진=YG PLUS 제공] 문샷은 춘원의 강력한 네트워크와 레시피의 제품전략 및 마케팅 역량을 바탕으로 베이징, 상하이 등 중국 주요 지역의 H&B스토어, 백화점, 쇼핑몰 등 다양한 오프라인 채널에 입점할 계획이다. 또한 중국 최대의 온라인 쇼핑몰인 ‘티몰’과 ‘타오바오’ 등 온라인 채널 마케팅도 강화해 온, 오프라인의 전사적인 유통채널과 적극적인 마케팅을 통해 중국 시장 공략에 박차를 가할 계획이다. 왕지리 춘원 회장은 “K-뷰티를 선도하는 YG의 코스메틱 브랜드 ‘문샷’을 중국시장에 함께 런칭하게 되어 매우 기쁘게 생각하며, YG의 파트너로서 문샷이 중국 시장에 성공적으로 자리매김할 수 있도록 전사적인 노력을 기울일 것” 이라고 말했다. 또한 이 날 행사에 참석한 이경수 코스맥스 회장은 문샷의 중국시장 진출을 적극 지원할 뜻을 내비쳤다. 이 회장은 “문샷은 한류 열풍의 가장 중심에 서 있는 YG그룹이 컨텐츠의 한류를 넘어 뷰티 산업의 한류 확산을 위해 런칭한 최고의 화장품” 이라며 “문샷이 중국 화장품 시장에 새로운 바람을 일으킬 수 있도록 YG-코스맥스-춘원-레시피가 함께 힘을 모을 것” 이라고 말했다. 코스맥스는 현재 문샷에 제품을 공급하고 있다. YG PLUS는 그 동안 중국 화장품 시장 진출을 위해 제품위생허가를 꾸준히 취득해왔으며, 올 해 3월을 기준으로 약 114개의 위생허가를 완료했다. 올 상반기 중 히트제품인 ‘지디향수’, ‘쿠션’ 등의 위생허가를 추가로 취득하면 중국 관련 매출확대에 속도가 날 것으로 예상된다. 양민석 YG PLUS 대표는 “춘원, 레시피라는 가장 좋은 파트너들과 함께 중국 시장에 진출하게 되어 매우 기쁘게 생각한다” 며 “각 분야에서 최고의 역량을 가지고 있는 춘원, 레시피와의 강력한 파트너십을 기반으로 YG가 보유한 다양한 콘텐츠와 인프라를 적극 활용해 문샷이 올 해 안에 중국시장에 성공적으로 자리매김할 수 있도록 최선을 다할 것” 이라고 각오를 밝혔다. 한편, YG PLUS는 최근 홍콩, 말레이시아 등에 문샷 단독매장을 오픈하며 해외시장 확대에 속도를 내고 있으며, 올 해 중국시장과 태국, 인도네시아 등 동남아시아 시장 확대가 본격화되면 확실한 성장모멘텀을 보여줄 것으로 기대하고 있다."
파이낸셜뉴스,037270,/news/news_read.nhn?article_id=0003790518&office_id=014&mode=search&query=YG PLUS&page=1,2017-03-17 10:37,[fnRASSI]YG PLUS(037270) 현재 11.08% &uarr;,"YG PLUS(037270)는 현재 주가가 전일 대비 11.08% 상승한 2,155원 선에서 거래가 이루어지고 있다. 외국인, 기관 모두 보유량 감소 (5일 누적) 최근 5일간 동종목의 외국인 투자자는 28,283주 매도하였고 마찬가지로 기관은 173주 매도하였다. 전날 두 주체 각각 3,498주, 173주 순매도하며 보유 비율을 줄였다. 다음 표는 동종목의 외국인, 기관의 일별 순매수량을 나타낸 것이다.                   지표               항목               값               종합점수                 성장성               매출액증가율               1.41               6.9                 자기자본증가율               -0.01                 안정성               부채비율               15.35               7.22                 유동비율               641.88                 이익안정성               4.44                 수익성               ROA               -4.55               1.38                 ROE               -5.25                 영업이익율               -9.62          YG PLUS의 퀀트 재무 점수는 15.5점으로 지난 분기에 비해 성장성 점수가 상승했다. 이는 매출액 증가율이 증가하였기 때문이다. 수익성 측면에서 볼때 ROA, ROE가 하락하여 이전보다 낮은 점수를 받았다. 'fnRASSI'는 증권전문 기업 씽크풀과 파이낸셜뉴스의 협업으로 로봇기자가 실시간으로 생산하는 기사입니다."
아이뉴스24,037270,/news/news_read.nhn?article_id=0000443188&office_id=031&mode=search&query=YG PLUS&page=1,2018-04-09 10:32,"YG PLUS, 네이버뮤직 운영 본격 개시","[아이뉴스24 김다운 기자] YG PLUS가 네이버와 본격적으로 공동 음악 사업을 개시했다. YG엔터테인먼트의 자회사 YG PLUS는 지난 1일부터, 국내 최대 포털 업체인 네이버가 운영하고 있는 '네이버뮤직'의 서비스 운영 대행을 시작했다고 9일 밝혔다. YG PLUS는 지난해 10월 네이버와 공동으로 음악 사업을 추진하기로 업무 협약을 체결하고, 첫번째 사업으로 네이버 뮤직에 대한 독점 콘텐츠 공급 등을 포함한 서비스 운영 대행을 진행하기로 했다. 또한 네이버가 계획 중인 인공 지능 기반 음악 서비스를 구현하기 위해 지난 1월 인공지능 기반 엔터테인먼트 데이터 서비스를 제공하고 있는 그레이스노트(Gracenote)와 K-POP 뮤직 데이터 고도화에 대한 업무 협약을 체결하며 현재 차별화된 콘텐츠와 서비스 제공을 위한 음악 서비스 인프라 개선을 진행중이다. YG PLUS는 ""이번 네이버뮤직 서비스 운영 대행 업무를 시작으로 올 상반기 중 보다 고도화된 뮤직 데이터베이스와 차별화된 콘텐츠 공급을 통해 네이버뮤직의 서비스 경쟁력을 강화할 예정이며, 네이버와 다양한 신규 음악사업도 연내 추진할 계획""이라고 전했다. /김다운기자"
이데일리,037270,/news/news_read.nhn?article_id=0004076928&office_id=018&mode=search&query=YG PLUS&page=1,2018-04-11 14:12,"[특징주]YG PLUS, 음악&middot;화장품 성장성 부각&hellip;강세","[이데일리 이명철 기자] YG PLUS(037270)(YG플러스)가 음악과 화장품 사업 본격 성과에 대한 기대감에 강세를 이어가고 있다. 11일 오후 2시 9분 현재 YG PLUS 주가는 전일대비 8.79% 오른 2475원을 기록 중이다. 최근 3거래일째 상승세다. 사업 성과가 가시화될 경우 기업가치가 상승할 것이라는 예상이 반영된 것으로 풀이된다. 이상헌 하이투자증권 연구원은 최근 보고서를 통해 “네이버뮤직 운영대행과 글로벌 음악 콘텐츠 데이터베이스 업체 그레이스노트와 업무 협약으로 음악사업 탄력을 받을 것”이라며 “지난달에는 중국 코스메틱 유통업체와 레시피, 화장품 중국 유통 양해각서를 체결해 향후 관련 매출이 가시화되면 실적 턴어라운드와 성장성이 부각될 수 있다”고 진단했다."
서울경제,037270,/news/news_read.nhn?article_id=0003213628&office_id=011&mode=search&query=YG PLUS&page=1,2018-02-02 12:29,"(유)YG PLUS, 전일 대비 8.03% 상승.. 일일회전율은 1.22% 기록","[서울경제] YG PLUS(037270) 는 2일 오후 12시 27분 현재 8.03% 오른 2,220원에 거래되고 있으며, 27(매도):73(매수)의 매수우위를 기록하고 있다. 거래대금은 15억1,726만, 거래량은 71만2,262주로 거래량회전율은 1.22%로 나타났다. 지난 1개월간 YG PLUS는 상승 11회, 하락 15회를 기록했고, 주가수익률은 12.41% 표준편차는 2.48%를 기록했다. 이 기간 ' 서비스업 ' 업종 평균 주가수익률은 4.37%로 나타났으며, 변동성은 0.95%를 기록했다. 이 시각 현재 ' 서비스업 '은 1.07% 상승 중이며, 49(매도):51(매수)의 매수우위를 기록하고 있다."
파이낸셜뉴스,037270,/news/news_read.nhn?article_id=0004000078&office_id=014&mode=search&query=YG PLUS&page=1,2018-04-11 15:11,"[fnRASSI]YG PLUS, 52주 신고가...10.77% &uarr;","YG PLUS(037270)는 52주신고가를 기록하고 있어 주목할만하다. 동종목의 현재 주가는 2,520원 선에서 이루어지고 있다. 거래일을 기준으로 최근 3일간 평균 거래량은 132만 주이다. 이는 60일 일 평균 거래량 29만 주와 비교해보면 최근 거래량이 급격히 늘어났다는 것을 알 수 있다. 외국인/개인 순매수, 기관은 순매도(한달누적)  전일 외국인이 17,560주를 사들인 반면 기관은 62,881주를 팔았다. 4주간을 기준으로 보면 외국인이 순매수량을 늘리며 100,296주를 순매수했고, 개인들도 순매도를 기록하다가 다시 순매수로 돌아서면서 11,068주를 순매수했다. 하지만 기관은 순매도로 돌아서면서 111,364주를 순매도했다. 외국인투자자 연속 6일 순매도 최근 5일간 동종목의 외국인 투자자는 61,514주 순매수하였고 반면 기관은 62,881주 순매도하였다. 전날 외국인 17,560주 순매수, 기관62,881주 순매도하며 보유 비율이 변동했다. 다음 표는 동종목의 외국인, 기관의 일별 순매수량을 나타낸 것이다. 'fnRASSI'는 증권전문 기업 씽크풀과 파이낸셜뉴스의 협업으로 로봇기자가 실시간으로 생산하는 기사입니다."
한국경제,037270,/news/news_read.nhn?article_id=0003910834&office_id=015&mode=search&query=YG PLUS&page=1,2018-03-21 15:29,YG PLUS &quot;춘원과 손잡고 중국시장서 화장품 유통&quot;,"YG PLUS는 21일 중국 항저우에서 현지 유통업체인 항주춘원무역유한공사(杭州春源贸易有限公司·이하 춘원), 화장품 업체 '레시피'와 화장품 브랜드 '문샷'의 중국 현지시장 유통을 위한 양해각서(MOU)를 체결했다고 밝혔다. 문샷은 춘원의 유통망과 레시피의 제품전략 및 마케팅 역량을 바탕으로 베이징, 상하이 등 중국 주요 지역의 헬스앤드뷰티(H&B)스토어, 백화점, 쇼핑몰 등 다양한 오프라인 채널에 입점한다는 계획이다. 중국 최대의 온라인 쇼핑몰인 '티몰'과 '타오바오' 등 온라인 채널 마케팅도 강화할 예정이다. 춘원은  중국 내 1만여 개의 H&B 매장을 비롯해 백화점, 쇼핑몰 등 중국 전 지역 주요 오프라인 채널 3만여 곳 이상에서 화장품 브랜드를 유통하고 있는 기업이다. 양민석 YG PLUS 대표는 ""각 분야에서 최고의 역량을 가지고 있는 춘원, 레시피와의 강력한 파트너십을 기반으로 YG가 보유한 다양한 콘텐츠와 인프라를 적극 활용해 문샷이 올해 안에 중국시장에 성공적으로 자리매김할 수 있도록 최선을 다할 것""이라고 말했다. 오정민 한경닷컴 기자"
아이뉴스24,037270,/news/news_read.nhn?article_id=0000452606&office_id=031&mode=search&query=YG PLUS&page=1,2018-07-03 10:34,"YG PLUS, 문화서비스 플랫폼 '로우키' 런칭","[아이뉴스24 김다운 기자] YG엔터테인먼트의 자회사 YG PLUS는 다양한 문화생활을 더욱 쉽고 특별하게 향유할 수 있는 새로운 문화 플랫폼 '로우키'를 런칭한다고 3일 밝혔다. 로우키는 최근 '워라밸(일과 삶의 균형)' '소확행(소소하지만 확실한 행복)'의 트랜드를 반영해 일상생활에서 다양한 문화 생활을 더욱 쉽고 색다르게 향유할 수 있는 새로운 유형의 문화 서비스 플랫폼이다. 분야도 아트, 푸드, 키즈, 스포츠 등 다양하며 자신만의 노하우를 가진 사람이라면 누구나 클래스를 런칭할 수 있고, 다양한 클래스를 경험할 수도 있다. 또한 현재 YG그룹이 영위 중인 엔터테인먼트, 음악, 화장품, 외식, 스포츠 등 다양한 라이프스타일 사업과 결합한 뷰티 메이크업, 쿠킹클래스,댄스 강의 등의 클래스도 준비 중이다. YG PLUS 측은 ""로우키는 현재 베타테스트 중으로,앞으로 유수 셀러들의 클래스를 유치하고 YG만의 다양한 콘텐츠 상품을 런칭해 글로벌 문화 서비스 플랫폼으로 만들어 나갈 것”""이라고 전했다. 로우키는 현재 다양한 셀러들의 클래스를 모집 중이며 7월부터 순차적으로 오픈할 예정이다. /김다운기자"
한국경제TV,037270,/news/news_read.nhn?article_id=0000613624&office_id=215&mode=search&query=YG PLUS&page=1,2018-03-21 15:14,"YG PLUS, 중국 화장품 시장 진출&hellip;블랙핑크 리사 글로벌 모델로","[한국경제TV 방서후 기자] YG엔터테인먼트의 자회사 YG PLUS가 중국 화장품 시장에 진출합니다. YG PLUS는 오늘(21일) 중국 항저우에서 현지 유수의 유통업체인 항주춘원무역유한공사(이하 '춘원') 등과 '문샷' 화장품의 중국 유통을 위한 양해각서를 체결했다고 밝혔습니다. 이날 행사에는 양민석 YG PLUS 양민석 대표, 이경수 코스맥스 회장, 왕지리 춘원 회장, 이윤식 레시피 대표 등을 비롯한 중국 내 주요 거래상들이 참석했습니다. 중국 코스메틱 유통업체인 춘원은 중국 내 1만여 개의 H&B 매장을 비롯해 백화점, 쇼핑몰 등 중국 전 지역 주요 오프라인 채널 3만여 곳 이상에서 화장품 브랜드를 유통하고 있습니다. 문샷은 춘원의 강력한 네트워크와 레시피의 제품전략 및 마케팅 역량을 바탕으로 베이징, 상하이 등 중국 주요 지역의 H&B스토어, 백화점, 쇼핑몰 등 다양한 오프라인 채널에 입점할 계획입니다. 또한 중국 최대의 온라인 쇼핑몰인 '티몰'과 '타오바오' 등 온라인 채널 마케팅도 강화할 방침입니다. 왕지리 춘원 회장은 ""K-뷰티를 선도하는 YG의 코스메틱 브랜드 '문샷'을 중국시장에 함께 런칭하게 돼 매우 기쁘다""며 ""YG의 파트너로서 문샷이 중국 시장에 성공적으로 자리매김할 수 있도록 전사적인 노력을 기울일 것""이라고 말했습니다. 한편 YG PLUS는 그동안 중국 화장품 시장 진출을 위해 제품위생허가를 꾸준히 취득해 왔으며, 현재 약 114개의 위생허가를 완료했습니다. 올 상반기 중 히트제품인 '지디향수', '쿠션' 등의 위생허가를 추가로 취득하면 중국향 매출 확대에 속도가 날 전망입니다. 이밖에 최근 홍콩, 말레이시아 등지에도 문샷 단독 매장을 오픈하며 해외 시장 확대에 속도를 내고 있으며, 올해 태국, 인도네시아 등 동남아시아 시장에도 본격적으로 진출할 계획입니다. 양민석 YG PLUS 대표는 ""각 분야에서 최고의 역량을 가지고 있는 춘원, 레시피와의 강력한 파트너십을 기반으로 YG가 보유한 다양한 콘텐츠와 인프라를 적극 활용해 문샷이 올해 안에 중국시장에 성공적으로 자리매김할 수 있도록 최선을 다할 것""이라고 각오를 밝혔습니다."
전자신문,037270,/news/news_read.nhn?article_id=0002708146&office_id=030&mode=search&query=YG PLUS&page=1,2018-05-15 11:09,"[ET투자뉴스]와이지엔터테인먼트, &quot;YG PLUS는 1&hellip;&quot; 매수-현대차투자증권","현대차투자증권에서 15일 와이지엔터테인먼트(122870)에 대해 ""YG PLUS는 1분기 적자 기록하였으나 올해부터 의미 있는 적자축소 가능""라며 투자의견을 '매수'로 제시하였고, 아울러 목표주가로는 32,000원을 내놓았다. 현대차투자증권 유성만 애널리스트가 동종목에 대하여 이번에 제시한 '매수'의견은 현대차투자증권의 직전 매매의견에서 큰 변화없이 그대로 유지되는 것이고  올해 초반의 매매의견을 기준으로  볼때도 역시 '매수'의견이 계속 유지되고 있는 상태이다. 그리고 최근 분기내 발표된 전체 증권사 리포트의 컨센서스와 비교를 해볼 경우에 오늘 발표된 투자의견은 전체의견에 수렴하고 있어, 이번 의견은 시장의 평균적인 기대감이 객관적으로 표현된 것으로 분석되고 있다. 목표주가의 추이를 살펴보면 한동안 같은 수준을 유지하던 목표가가 최근 두차례 연속 하향조정되고 있는 모습이다. 또한 전일 종가 기준으로 볼때 동종목의 현주가는 이번에 제시된 목표가 대비 17%의 저평가 요인이 존재한다는 해석이 제시되고 있다."
