source,symbol,link,date,title,content
부산일보,048410,/news/news_read.nhn?article_id=0000760707&office_id=082&mode=search&query=현대아이비티&page=1,2017-12-06 09:40,"현대아이비티, 1회 24시간 약효지속 점안제 개발 성공...8배 염증감소 효과","현대아이비티.  현대아이비티는 6일 바이오 나노약물 전달 제약기술 국책과제로, 점안제를 1일 1회만 사용해도 24시간 약효가 유지되고, 염증감소 효과를 8배 개선시킨 나노약물 전달시스템 상용화기술을 개발하는데 성공했다고 밝혔다. 이번 국책과제는 현대아이비티가 주관사로, 서울대, 서울대병원, 한양대 등이 참여했다. '백내장 수술후 부작용 방지를 위한 나노약물 전달시스템 제품화 기술개발' 과제로, 2016년 1월부터 시작해 4년간 정부지원금 30억원을 포함 총 41억원의 연구개발비를 투입하는 대규모 바이오 제약 기반기술 프로젝트다. 전세계 안과약품 시장은 17억8천만달러(한화 2조1천억원) 규모로 이중 전안부 염증질환 약물시장은 7억1천만달러(한화 8천400억원)에 달하는 큰 시장이다. 건강보험공단과 건강보험심사평가원에 따르면 2014년 국내 안과질환 환자는 25만명으로 65세 이상 입원환자 1위 질병이며, 한해 치료비만 2천400억원에 달한다. 오상기 현대아이비티 대표는 ""이번 성공은 피부치료제 등 피부외용제에 두루 적용할 수 있는 상용화 수준의 기술을 개발했다는데 의미가 있다""면서 ""이를 통해 항생제 또는 스테로이드 계열 약물의 사용량은 크게 줄이면서 치료시간은 단축시키는 개량신약 혁신을 주도해 나갈 것""이라고 말했다."
연합뉴스,048410,/news/news_read.nhn?article_id=0009766191&office_id=001&mode=search&query=현대아이비티&page=1,2017-12-21 15:22,"현대아이비티 日합작법인 비타브리드재팬, 내년 도쿄증시 상장","(서울=연합뉴스) 김은경 기자 = 화장품 브랜드 '비타브리드'를 보유한 현대아이비티의 일본 합작법인인 '비타브리드재팬'이 이르면 2018년말 일본 도쿄증시에 상장한다. 현대아이비티는 일본 합작법인 '비타브리드재팬'의 매출이 급증해 일본증시 상장요건을 갖춤에 따라 이르면 내년말 일본 도쿄증권거래소에 상장할 계획이라고 21일 발표했다. 현대아이비티는 비타브리드재팬 합작 파트너인 일본 벡토르사가 상장을 제안해 일본 올림픽 개최 전인 2019년까지 비타브리드재팬을 일본 도쿄증권거래소에 상장하기로 합의했다고 전했다. 비타브리드재팬은 그동안 매년 매출과 영업이익이 급성장해 올해가 마무리되면 일본 증시 매출액과 영업이익 상장요건이 모두 충족된다. 현대아이비티와 비타브리드재팬은 주간사 선정과 상장일정 등과 관련, 양사 주관임원간 정례 미팅을 갖기로 했다. 현대아이비티는 ""올해 9월 뉴욕타임즈에 결혼 한달 전 예비신부의 빛나는 피부관리 비법으로 '비타브리드C12 페이스' 제품이 소개된 후 비타브리드재팬 매출이 급증하고 있다""고 설명했다. 현대아이비티는 이에 따라 기존 월 공급 물량 외에 1월 추가 공급분으로 12억3천만원 규모의 비타브리드 페이스 제품을 비타브리드재팬에 긴급 공수한다는 단일판매-공급체결계약을 이달 18일 코스닥 시장에 자율공시한 바 있다. 현재 국내 기업 중 도쿄증권거래소에 상장된 기업은 라인과 넥슨 등이다. 최근 하나투어재팬이 상장해 화제가 됐다. 비타브리드C12 페이스[비타브리드 제공]"
한국경제TV,048410,/news/news_read.nhn?article_id=0000600284&office_id=215&mode=search&query=현대아이비티&page=1,2018-02-07 10:19,"현대아이비티, 전일 대비 약 7% 상승한 6,180원","[한국경제TV 라이온봇 기자] 현대아이비티는 2월 7일 10시 18분 전일 대비 약 7% 상승한 6,180원에 거래되고 있다. 현대아이비티는 코스닥 상장 기업으로 정보기기 업종에 속해 있다. 시가총액은 1,925억원으로 코스닥 상장기업 중 314위에 위치 해 있다. [종목 성향 진단] [그림 1] 종목 성향 진단 현대아이비티의 투자 스타일은 성장주에 가깝다. 주가 고평가 우려가 공존하지만 높은 성장성이 기대되는 기업이다. 주가 모멘텀은 좋은 편에 속했다. 최근 6개월 수익률은 12.14%의 상승폭을 기록했다. 최근 1개월 수익률 또한 11.09% 상승하며 좋은 모멘텀을 보이고 있다. 현대아이비티 종목에 대한 투자자의 관심도는 평범한 수준이었다. [투자 점수 진단] [그림 2] 투자 점수 진단 현대아이비티는 수익성(영업이익률) 측면에서 두각을 나타내고 있다. 최근 영업이익률은 80점으로 6개의 핵심 팩터 중 가장 높은 점수를 기록했다. 영업이익률은  전체 시장 내 382위를 기록하며 상위 19.53%에 위치했다. 업종별로는 144위를 기록하며 상위 24.57%에 위치했다. 그리고 효율성(ROA) 역시 도드라지는 편이다. 효율성 점수는 65점으로 두번째로 높은 점수를 기록했다. ROA는 전체 시장 내 667위를 기록하며 상위 34.67%에 위치했다. 업종별로는 242위를 기록하며 상위 42.5%에 위치했다. 그러나 PBR과 매출증가율(YoY)은  아쉬움을 나타냈다. [종합 투자점수] [그림 3] 종합 투자점수 AI 인공지능 분석을 통한 현대아이비티의 종목 종합 스코어는 49점을 기록했다. 이는 동일 업종 평균점수인 57점과 시장 평균점수인 57점를 하회하는 수치였다. (위의 AI인공지능 점수는 재무 데이터를 기반으로 전체 상장 종목과 비교/분석하여 도출한 점수로 높은 점수가 반드시 높은 수익률을 보장하지 않습니다. 위의 자료는 당사의 추천 종목이 아니며, 투자 시 참고용으로 제시해드리는 것입니다.) 라이온봇 기자 -한국경제TV※ 본 기사는 한국경제TV와 '거장들의 투자공식이'자체 개발한 '라이온봇 기자'가 실시간으로 작성한 기사입니다. 라이온봇기자 ⓒ 한국경제TV, 무단 전재 및 재배포 금지 한국경제TV 관련뉴스해당 언론사에서 선정하며 언론사 페이지(아웃링크)로 이동해 볼 수 있습니다.이은하, 쿠싱증후군 투병 중에도 일해야 했던 속사정""그만 좀 괴롭혀"" 하리수 악플 고소에 누리꾼 '씁쓸'태진아 집 공개, 화려한 신발들 '시선집중'""따스한 햇살이 좋았던 하루"" 김희애 나이 잊은 근황최영미 시인 성추행 폭로 '재조명', ""교활한 늙은이"""
동아일보,048410,/news/news_read.nhn?article_id=0002967333&office_id=020&mode=search&query=현대아이비티&page=1,2016-04-26 09:07,"현대아이비티, &lsquo;2016 몽드 셀렉션&rsquo; 화장품 분야 &lsquo;그랜드 골드상 &rsquo; 수상","현대아이비티의 비타브리드 제품이 2016년 ‘몽드 셀렉션(Monde Selection)’에서 화장품 분야 최고 영예인 ‘그랜드 골드상’을 수상했다. 현대아이비티는 일본 합작회사 ‘비타브리드재팬’에서 출품한 비타브리드 C12 스킨이 세계 3대 품질평가기관 ‘몽드 셀렉션’이 실시하는 국제품평회 ‘2016 몽드 셀렉션’에서 화장품 분야 대상인 그랜드 골드상을 수상했다고 26일 밝혔다. 비타브리드 C12 스킨은 세계 유망혁신 바이오기술을 비타민C에 적용한 것으로 화장품과 혼합하여 피부에 바르면 비타민C를 12시간 이상 지속적으로 피부에 전달하는 신개념 비타민C 제품이다. 한편, ‘몽드 셀렉션’은 벨기에 브뤼셀에서 1961년 설립된 국제 품평회로, 영국 런던의 국제주류품평회(IWSC), 미국 샌프란시스코의 국제주류품평회(SWSC)와 더불어 세계 3대 품평회로 손꼽힌다.매년 건강식 제품과 미용, 음료, 주류, 식품 등의 분야에 약 82개국의 3,100여 개 제품들이 참가하며, 70명 이상의 과학자와 각 분야 전문가들이 4개월 간의 엄격한 심사를 통해 그랜드 골드상(최고 금상), 금상, 은상, 동상을 수상한다. 잇츠스킨의 ‘달팽이 크림’은 지난해  몽드 셀렉션은 화장품 분야에서 금상을 수상한 바 있다."
전자신문,048410,/news/news_read.nhn?article_id=0002669008&office_id=030&mode=search&query=현대아이비티&page=1,2017-12-21 17:52,현대아이비티 합작사 '비타브리드재팬' 일본 증시 상장 추진,"ⓒ게티이미지 현대아이비티(대표 오상기)는 일본 합작법인 '비타브리드재팬' 매출이 급증해 일본증시 상장요건을 갖춤에 따라 이르면 내년 말 일본 도쿄증권거래소에 상장시킬 계획이라고 21일 밝혔다. 현대아이비티는 비타브리드재팬 합작 파트너인 일본 벡토르사가 상장을 제안해 일본 올림픽 개최 전인 2019년까지 비타브리드재팬을 일본 도쿄증권거래소에 상장하기로 합의했다. 비타브리드재팬은 그동안 매년 매출과 영업이익이 급성장해 올해가 마무리되면 일본 증시 상장요건인 매출액과 영업이익이 모두 충족된다. 현대아이비티와 비타브리드재팬은 주간사 선정 및 상장일정 등과 관련, 양사 주관임원간 정례 미팅을 갖기로 했다. 현대아이비티는 지난 9월 뉴욕타임즈에 결혼 한달전 예비신부 피부관리 비법으로 '비타브리드C12 페이스' 제품이 소개된 이후 비타브리드재팬 매출이 급증했다고 설명했다. 현대아이비티는 최근 일본 판매량이 급증해 1월 추가 공급분으로 12억3000만원 규모의 비타브리드 페이스 제품을 비타브리드재팬에 공급한다는 단일판매-공급체결계약을 지난 18일 코스닥시장에 자율공시한 바 있다."
헤럴드경제,048410,/news/news_read.nhn?article_id=0001331173&office_id=016&mode=search&query=현대아이비티&page=1,2017-12-21 09:31,[생생코스닥]현대아이비티 日 합작사 &lsquo;비타브리드재팬&rsquo; 일본 증시 상장 추진,"- 비타브리드재팬 매출급증에 따라 상장 청신호... 내년초 주관 증권사 선정- 뉴욕타임즈 보도후 예비 신부 피부관리 필수품 입소문 ‘페이스 판매 급증’  [헤럴드경제=이진용 기자]현대아이비티 일본 합작법인인 ‘비타브리드재팬’이 이르면 2018년말 일본 도쿄증시에 상장한다. 코스닥 상장 기업인 현대아이비티(대표 오상기ㆍ048410)는 일본 합작법인 ‘비타브리드재팬’의 매출이 급증해 일본증시 상장요건을 갖춤에 따라 이르면 내년말 일본 도쿄증권거래소에 상장시킬 계획이라고 21일 공식 발표했다. 현대아이비티는 비타브리드재팬 합작 파트너인 일본 벡토르사가 상장을 제안해 일본 올림픽 개최 전인 2019년까지 비타브리드재팬을 일본 도쿄증권거래소에 상장하기로 합의했다고 밝혔다. 비타브리드재팬은 그동안 매년 매출과 영업이익이 급성장해 올해가 마무리되면 일본 증시 상장요건인 매출액과 영업이익이 모두 충족된다. 현대아이비티와 비타브리드재팬은 주간사 선정 및 상장일정 등과 관련, 양사 주관임원간 정례 미팅을 갖기로 했다. 현대아이비티는 지난 9월 뉴욕타임즈에 결혼 한달전 예비신부의 빛나는 피부관리 비법으로 ‘비타브리드C12 페이스’ 제품이 소개된 이후 비타브리드재팬 매출이 급증하고 있다고 설명했다. 이와관련 현대아이비티는 최근 일본 제품 판매량이 폭발적으로 증가해, 판매계획에 따른 기존 월 공급 물량 외에 1월 추가 공급분으로 12억3000만원 규모의 비타브리드 페이스 제품을 비타브리드재팬에 긴급 공수한다는 단일판매-공급체결계약을 지난 18일 코스닥 시장에 자율공시한 바 있다. 현재 국내 기업중 도쿄증권거래소에 상장된 기업은 라인과 넥슨 등이며, 최근 하나투어재팬이 상장해 화제가 됐다."
이데일리,048410,/news/news_read.nhn?article_id=0003529238&office_id=018&mode=search&query=현대아이비티&page=1,2016-04-26 09:44,"[특징주]현대아이비티, 세계 화장품 시장서 성공 가능성 &uarr;","[이데일리 박형수 기자] 현대아이비티(048410)가 강세다. 세계 3대 품질평가기관 가운데 하나인 몽드 셀렉션이 진행하는 국제품평회에서 화장품 분야 대상을 받았다는 소식이 주가에 영향을 준 것으로 보인다. 26일 오전 9시41분 현대아이비티는 전날보다 4.77% 오른 6150원에 거래되고 있다. 현대아이비티는 일본 합작회사 ‘비타브리드재팬’에서 출품한 ‘비타브리드 C12’ 스킨이 ‘2016 몽드 셀렉션’에서 화장품 분야 대상인 그랜드 골드상을 수상했다고 26일 밝혔다. 비타브리드 C12 스킨은 바이오기술을 비타민C에 적용한 것으로 화장품과 함께 피부에 바르면 비타민C가 피부에 흡수되는 제품이다. 현대아이비티 관계자는 “세계 최고 권위의 국제품평회에서 비타브리드C12 파우더 제품이 그랜드 골드상을 수상한 것은 전 세계 시장에서 기술과 제품을 인정받은 결과”라고 설명했다. 몽드 셀렉션은 벨기에 브뤼셀에서 1961년 시작한 국제 품평회다. 영국 런던의 국제주류품평회(IWSC), 미국 샌프란시스코의 국제주류품평회(SWSC)와 더불어 세계 3대 품평회로 꼽히는 권위있는 대회다. 현대아이비티의 ‘미네랄-유효물질 전달체’ 기술은 미국화학회지(JACS), 독일화학회지(Angewandte Chemie) 등의 표지논문으로 선정됐다. 미국재료학회에서도 유망 혁신기술로 소개하는 등 세계적으로 인정받은 차세대 바이오기술이다."
아시아경제,048410,/news/news_read.nhn?article_id=0003655417&office_id=277&mode=search&query=현대아이비티&page=1,2015-12-28 16:34,"현대아이비티, 전환가액 7412원&rarr;6304원으로 조정",[아시아경제 김원규 기자] 현대아이비티가 전날부터 1개월마다 전환가액 조정일로 정함 따라 전환가액을 7412원에서 6304원으로 조정한다고 28일 공시했다
서울경제,048410,/news/news_read.nhn?article_id=0002945678&office_id=011&mode=search&query=현대아이비티&page=1,2016-12-28 09:29,&quot;해외매출 급증...현대아이비티 내년 바이오 비중 IT 추월&quot;,●오상기 현대아이비티 대표 미백·피부탄력 강화해주는 '비타브리드' 제품 日수출 증가 두피케어센터 설립 계약 등 中사업도 확장세 본격화 장기적으로 표적항암제도 개발 명실상부 바이오기업 탈바꿈
헤럴드경제,048410,/news/news_read.nhn?article_id=0001324500&office_id=016&mode=search&query=현대아이비티&page=1,2017-12-06 09:15,"현대아이비티, 1회 투입 24시간 약효지속 점안제 개발 성공","- 서울大, 서울대병원, 한양大 공동참여... 차세대 제약기술 개발 ‘쾌거’- 산업부 ‘나노약물전달시스템 국책과제’ 2년차 중간 결과 - 기존 일 4회 투입에 비해 일 1회 투입으로도 염증감소 8배 개선  [헤럴드경제=이진용 기자]현대아이비티(대표 오상기)는 산업통상자원부 바이오 나노약물 전달 제약기술 국책과제로 하루 4회 투여해 온 점안제를 하루 1회만 사용해도 24시간 약효가 유지되고, 기존 1일 4회 투여할 때보다 염증감소 효과를 8배 개선시킨 나노약물 전달시스템 상용화기술을 개발하는데 성공했다고 6일 밝혔다. 이번 국책과제는 현대아이비티가 주관사로, 서울대, 서울대병원, 한양대 등이 참여한 ‘백내장 수술후 부작용 방지를 위한 나노약물 전달시스템 제품화 기술개발’ 과제로, 2016년 1월부터 시작해 4년간 정부지원금 30억원을 포함 총 41억원의 연구개발비를 투입하는 대규모 바이오 제약 기반기술 프로젝트다. 전세계 안과약품 시장은 17억8000만달러(한화 2조1000억원) 규모로 이중 전안부 염증질환 약물시장은 7억1000만달러(한화 8400억원)에 달하는 큰 시장이다. 건강보험공단과 건강보험심사평가원에 따르면 2014년 국내 안과질환 환자는 25만명으로 65세 이상 입원환자 1위 질병이며, 한해 치료비만 2400억원에 달한다. 현대아이비티는 기존 일 4회 투입해 온 점안제에 나노약물 전달시스템을 적용, 주약물인 덱사메타손의 방출시간 및 잔류시간을 정밀하게 제어해 투입횟수를 일 1회로 줄였음에도 염증감소효과가 8배나 개선됐고 약물 투여후 최대 72시간까지 약효가 유지되는 등 획기적인 성과를 거뒀다고 설명했다. 오상기 현대아이비티 대표는 “이번 성공은 피부치료제 등 피부외용제에 두루 적용할 수 있는 상용화 수준의 기술을 개발했다는데 의미가 있다”면서 “이를 통해 항생제 또는 스테로이드 계열 약물의 사용량은 크게 줄이면서 치료시간은 단축시키는 개량신약 혁신을 주도해 나갈 것”이라고 말했다."
뉴시스,048410,/news/news_read.nhn?article_id=0008349212&office_id=003&mode=search&query=현대아이비티&page=1,2017-12-18 18:23,"현대아이비티, 12억 규모 공급계약 체결","【서울=뉴시스】정옥주 기자 = 현대아이비티(048410)는 땡큐비타민씨코리아와 12억3000만원 비타브리드C 페이스 브라이트닝 공급 계약을 체결했다고 18일 공시했다. 이는 최근 매출액의 3.4%에 해당한다. 회사 측은 ""본 건은 땡큐비타민씨코리아를 거쳐 최종 일본 비타브리드 재팬(Vitabrid Japan Inc.)에 공급되는 건""이라고 설명했다."
서울경제,048410,/news/news_read.nhn?article_id=0003179509&office_id=011&mode=search&query=현대아이비티&page=1,2017-12-21 09:22,"현대아이비티, 일본 합작사 &lsquo;비타브리드재팬&rsquo; 日 증시 상장 추진에 상승세","[서울경제] 현대아이비티(048410) 가 일본 합작법인 비타브리드재팬이 이르면 내년말 일본 증시에 상장될 것이라는 소식에 장 초반 상승세다. 현대아이비티는 21일 오전9시20분 현재 전일 대비 4.86% 오른 5,390원에 거래 중이다. 이날 현대아이비티는 일본 합작법인 비타브리드재팬의 매출이 급증해 일본증시 상장요건을 갖춤에 따라 이르면 내년말 일본 도쿄증권거래소에 상장시킬 계획이라고 21일 공식 발표했다. 비타브리드재팬은 그동안 매년 매출과 영업이익이 급성장해 올해가 마무리되면 일본 증시 상장요건인 매출액과 영업이익이 모두 충족된다. 현대아이비티와 비타브리드재팬은 주간사 선정 및 상장일정 등과 관련, 양사 주관 임원간 정례 미팅을 갖기로 했다."
서울경제,048410,/news/news_read.nhn?article_id=0003216934&office_id=011&mode=search&query=현대아이비티&page=1,2018-02-07 09:37,"(코)현대아이비티, 전일 대비 7.96% 상승.. 일일회전율은 0.91% 기록","[서울경제] 현대아이비티(048410) 는 7일 오전 9시 35분 현재 7.96% 오른 6,240원에 거래되고 있으며, 39(매도):61(매수)의 매수우위를 기록하고 있다. 거래대금은 17억8,145만, 거래량은 29만5,708주로 거래량회전율은 0.91%로 나타났다. 지난 1개월간 현대아이비티는 상승 14회, 하락 14회를 기록했고, 주가수익률은 20.93% 표준편차는 3.62%를 기록했다. 이 기간 ' 정보기기업 ' 업종 평균 주가수익률은 11.90%로 나타났으며, 변동성은 1.36%를 기록했다. 이 시각 현재 ' 정보기기업 '은 1.03% 상승 중이며, 36(매도):64(매수)의 매수우위를 기록하고 있다."
스포츠경향,048410,/news/news_read.nhn?article_id=0000536758&office_id=144&mode=search&query=현대아이비티&page=1,2018-02-08 08:56,"명품백화점 美 바니스뉴욕 입점한 현대아이비티, 日서 매출 급성장","현대아이비티가 글로벌 명품백화점인 미국 바니스뉴욕 입점이후 일본 합작법인 ‘비타브리드재팬’ 매출이 급증하고 있다. 이와 관련 현대아이비티는 일본내 비타브리드 누적판매량이 지난해 3월 50만개를 넘어선지 불과 10개월만에 2배나 늘어난 100만개를 돌파했다고 7일 밝혔다. 월간 판매량도 30억원을 넘어서는 등 일본 매출이 급성장하고 있는 추세다. ‘비타브리드재팬’은 지난 2016년 10월 월간 판매금액 2억엔(20억원)을 돌파한 이후, 15개월만에 월간 판매금액 3억엔(30억원)을 넘어서는 등 가파른 매출 상승세를 보이고 있다. 특히 지난해 상장조건을 모두 갖춘데다, 안정적 흑자기조를 유지하고 있어 일본 도쿄증권거래소 상장 플랜이 한층 탄력을 받을 전망이다. 현대아이비티는 지난해말 비타브리드재팬 합작 파트너인 일본 벡토르사의 제안에 따라 이르면 내년 말, 늦어도 올림픽 개최 전인 2019년까지 비타브리드재팬을 일본 도쿄증권거래소에 상장할 계획이다. 오상기 현대아이비티 대표는 “비타브리드 제품이 일본시장에서 50만개 판매되는데 3년이 걸렸지만, 불과 10개월만에 누적판매량 100만개를 돌파하는 등 신기록을 수립하고 있다”면서 “올해 안에 새로운 밀레니엄 판매기록을 경신하고, 이르면 올연말, 늦어도 내년중엔 비타브리드재팬을 도쿄증권거래소에 상장시켜 보다 공격적으로 마케팅을 펼쳐 나갈 것”이라고 말했다."
한국경제TV,048410,/news/news_read.nhn?article_id=0000659333&office_id=215&mode=search&query=현대아이비티&page=1,2018-07-10 13:26,"현대아이비티, 전일 대비 약 3% 상승한 5,150원","[한국경제TV 라이온봇 기자] [그림 1] 최근 3개월 간 주가 추세 및 기간별 수익률 현대아이비티는 7월 10일 13시 25분 전일 대비 약 3% 상승한 5,150원에 거래되고 있다. 현대아이비티는 코스닥 상장 기업으로 화학 업종에 속해 있다. 시가총액은 1,628억원으로 코스닥 상장기업 중 361위에 위치 해 있다. [종목 성향 진단] [그림 2] 종목 성향 진단 현대아이비티의 투자 스타일은 성장주에 가깝다. 주가 고평가 우려가 공존하지만 높은 성장성이 기대되는 기업이다. 주가 모멘텀은 부진한 편이었다. 최근 3개월 수익률은 -12.42%의 하락폭을 기록했다. 최근 1개월 수익률 또한 -3.56% 하락하며 부진한 모멘텀을 이어가고 있다. 현대아이비티 종목에 대한 투자자의 관심도는 평범한 수준이었다. [투자 점수 진단] [그림 3] 투자 점수 진단 현대아이비티는 어느 측면에서 투자 매력도가 높은 종목일까? AI 인공지능 종목 분석 시스템을 이용해 성장성, 수익성, 효율성, 안전성, 저평가성, 추세 등 주가 수익률에 영향을 줄 수 있는 6가지 핵심 투자 지표를 점수화하여 종목의 투자 매력도를 계산해보았다. 그 결과 현대아이비티는 상대적으로 성장성 측면에서 두각을 드러내고 있었다. 성장성 점수는 기업의 실적이 전년 동기 대비 얼마나 증가했는지를 나타낸 지표로 기업의 이익 성장 추세를 나타낸다. 현대아이비티는 특히 영업이익증가율(YoY) 측면에서 가장 높은 점수는 기록했는데, 전체 시장 내 193위를 기록하며 상위 10.19%에 위치했다. 업종별로는 35위를 기록하며 상위 8.74%에 위치했다. 그러나 기업 가치 대비 주가 수준을 나타내는 저평가 측면에서는 아쉬움을 나타냈다. (위의 AI인공지능 점수는 재무 데이터를 기반으로 전체 상장 종목과 비교/분석하여 도출한 점수로 높은 점수가 반드시 높은 수익률을 보장하지 않습니다. 위의 자료는 당사의 추천 종목이 아니며, 투자 시 참고용으로 제시해드리는 것입니다. 핵심투자지표를 결합해 종목의 투자매력도를 종합 계산한 ""인공지능 투자점수""는 ""거장들의 투자공식"" 앱에서 확인하실 수 있습니다.) 라이온봇 기자 -한국경제TV※ 본 기사는 한국경제TV와 '거장들의 투자공식이'자체 개발한 '라이온봇 기자'가 실시간으로 작성한 기사입니다. 라이온봇기자 ⓒ 한국경제TV, 무단 전재 및 재배포 금지 한국경제TV 관련뉴스해당 언론사에서 선정하며 언론사 페이지(아웃링크)로 이동해 볼 수 있습니다.발암물질 고혈압약 115개 공개...식약처 홈페이지 '온종일 북적'90도 고개 숙인 이재용...文의 한마디 ""한국서도 일자리를...""고개드는 美 금리인상 신중론…'무역전쟁' 부메랑 되나계산대 의자 '이렇게' 바꾼다…이마트 10년 만의 변화설민석 집 공개, 5성급 호텔 뺨치는 '럭셔리 하우스'"
