source,symbol,link,date,title,content
서울경제,048410,/news/news_read.nhn?article_id=0003058746&office_id=011&mode=search&query=현대아이비티&page=1,2017-06-26 09:29,"현대아이비티, 스위스 명품 화장품 시장 진출&middot;&middot;&middot;ADN사와 190억원 독점 공급 ...","美 바니스뉴욕 백화점 계약 체결 후 판권 요청 [서울경제] 현대아이비티(048410)가 독일현지법인을 통해 스위스 화장품유통회사 ‘AV-Distribution Nyon Sarl’(AVDN)사와 5년간 1,500만유로(한화 190억원) 규모의 제품 공급 독점계약을 23일자로 체결하며 올 가을부터 스위스와 리히텐슈타인 후국 화장품 시장에 진출한다고 발표했다. 현대아이비티는 이번 계약이 미국 ‘바니스뉴욕’ 백화점과의 계약 직후 스위스 AVDN사가 독점판권을 요청해 와 성사된 것으로, 스위스-리히텐슈타인 후국 지역의 오피니언 리더와 상류층이 자주 이용하는 최고급 미용실과 스파 살롱, 미용용품점 등에 비타브리드 제품을 우선 공급할 예정이다. 스위스는 1인당 GDP가 8만달러가 넘는 세계 2위의 부국으로, 인구는 814만명에 불과하지만 화장품 시장규모가 무려 3조원에 달하는 유럽 최대 명품화장품 시장 중 하나이다. 높은 국민소득으로 친환경 고급화장품 선호도가 매우 높고, 품질, 위생, 윤리경영, 첨단기술 등 까다롭지만 보수적인 소비특성 때문에 유럽의 대표적인 테스트 마켓으로 알려져 있다. 오상기 현대아이비티 대표는 “스위스는 구매력과 세계시장 파급력이 매우 높은 매력적인 시장”이라며 “보그誌가 K뷰티의 기적이라 칭송했고 명품백화점 바니스뉴욕이 선택한 비타브리드의 스위스 론칭을 계기로 유럽 명품화장품 시장에 본격 진출해 나갈 것”이라고 밝혔다."
서울경제,048410,/news/news_read.nhn?article_id=0003058862&office_id=011&mode=search&query=현대아이비티&page=1,2017-06-26 10:39,"현대아이비티, 스위스 화장품 시장 진출","5년간 190억원 공급 계약 ""까다로운 스위스 시장 만족시켜 유럽 전역으로 시장 확대해갈 방침"" [서울경제] 바이오 기업 현대아이비티(048410)는 지난 23일 독일 현지 법인을 통해 스위스 화장품 유통기업 AVDN과 5년 간 1,500만 유로(한화 약 190억원) 규모의 비타브리드 제품 독점 공급 계약을 체결했다고 26일 밝혔다. 이로써 현대아이비티는 스위스와 리히텐슈타인 공국 화장품 시장에 진출하게 됐다. 현대아이비티는 이번 계약이 미국 바니스뉴욕과의 계약 직후 들어온 스위스 AVDN 사의 독점 판권 요청에 의해 성사됐다고 설명했다. 회사 측은 비타브리드 제품을 스위스와 리히텐슈타인 공국 지역의 최고급 미용실과 살롱, 미용용품점 등에 우선 공급할 방침이다. 오상기 현대아이비티 대표는 “스위스는 구매력이 높은데다 품질·위생 등에 대해 까다로운 소비 특성을 가지고 있어 유럽의 대표적인 테스트 마켓으로 알려져 있다”며 “스위스 시장 진출을 계기로 유럽 명품 화장품 시장을 본격 공략할 방침”이라고 밝혔다."
서울경제,048410,/news/news_read.nhn?article_id=0002795949&office_id=011&mode=search&query=현대아이비티&page=1,2016-02-02 09:18,"현대아이비티, 중국 최대 약국체인 '국대약방'과 비타브리드 제품 수출 본계약 체결","현대아이비티(048410)가 중국 최대 약국체인 국대약방과 주력제품인 비타브리드 중국 판매를 위한 상품공급계약을 베이징에서 체결했다고 2일 밝혔다. 외국기업이 국대약방과 중국 현지 에이전트를 통하지 않고 직접 계약을 체결한 것은 현대아이비티가 처음이다. 국대약방은 연매출 40조원의 중국 국영기업 국약홀딩스(시노팜) 그룹 계열사로 국약홀딩스는 중국내 1만351개 병원과 7만8,238개 보건소와 진료소, 5만4,452개 약국에 의약품을 공급하는 중국 최대 제약유통 그룹사다. 현대아이비티는 중국 현지에 설립한 자회사를 통해 비타브리드 제품에 대한 중국정부의 위생허가를 신청한 상태다. 제품 판매를 위한 인허가가 완료되는대로 비타브리드 생산라인을 풀가동해 국대약방 소속 약국 매장들에 공급할 예정이다. 현대아이비티는 빠르면 올해 5월에 중국정부로부터 비타브리드 제품에 대한 인허가를 받을 수 있을 것으로 예상하고 있다. 중국내 약국체인 진출을 시작으로 올해부터 매출이 큰 폭으로 늘어날 것으로 기대하고 있다. 현대아이비티는 동인당, 의보전신 등 중국내 주요 거대약국체인과도 지난해부터 상품공급계약을 활발히 추진중이며 중국내 군병원 및 일반 병의원 등에도 비타브리드 제품공급을 위한 막후교섭을 진행중이라고 밝혔다. 현대아이비티는 차세대 바이오 원천기술을 보유한 회사로 피부에 바르는 비타민C 파우더 제품 ‘비타브리드’를 개발해 한국과 일본, 중국, 홍콩 등지에 시판중이며, DNA 및 항암치료제 관련 나노융합기술을 상용화하기 위한 연구개발에 박차를 가하고 있는 바이오기업이다. 현대아이비티와 상품공급계약을 체결한 중국 최대 약국체인 ‘국대약방’ 매장 전경./사진제공=현대아이비티"
조선비즈,048410,/news/news_read.nhn?article_id=0000373696&office_id=366&mode=search&query=현대아이비티&page=1,2017-06-22 16:55,"현대아이비티, 중동 마케팅회사와 JV 설립.. 중동 시장 진출 본격화","코스닥 바이오화장품기업 현대아이비티(048410) 가 중동지역 글로벌 마케팅회사와 합작사를 설립, 중동과 북아프리카 화장품 시장에 진출한다고 22일 밝혔다. 오상기(왼쪽) 현대아이비티 대표와 윌 허트슨 LMTD그룹 대표가 20일 서울 이화여대 산학협력관에서 중동-북아프리카 지역 합작사 설립 계약을 체결하고 악수를 나누고 있다./현대아이비티 제공 오상기 현대아이비티 대표와 윌 허트슨 LMTD그룹 대표는 지난 20일 서울 이화여대 산학협력관에서 중동-북아프리카 지역 합작사 설립 계약을 체결했다. 윌허트슨 대표는 디즈니 토이스토리를 마케팅한 인물로 미국 나스닥, 버라이즌, 코카콜라, 레드불 등 글로벌 회사의 굵직한 마케팅 프로젝트들을 성공적으로 수행한 마케팅 전문가다. LMTD그룹은 윌 허트슨이 설립한 중동지역 메이저 글로벌 마케팅그룹으로, 아부다비 국영 석유회사, 아부다비 상업은행, 아랍에미리트 제2 항공사인 에티하드 항공, 필립스, 구글 등 중동 거대기업 마케팅을 맡고 있다. 현대아이비티와 LMTD는 비타브리드가 美 바니스뉴욕이 선택한 최고급 명품 화장품 브랜드란 점을 적극 활용 고품질 화장품과 명품에 아낌없이 투자하는 아랍에미리트와 사우디아라비아 상류층을 대상으로 집중 마케팅할 계획이다. 중동지역과 북아프리카 지역은 전세계 화장품 시장의 6%를 차지하는 신흥시장으로, 매년 11%씩 초고속 성장하고 있다. LMTD는 지난해부터 비타브리드 시장가능성을 주목하고, 올해초 중동지역 오피니언 리더, 셀럽, 화장품 전문가를 대상으로 비타브리드 화장품을 파일럿 테스트까지 마쳤다. 현대아이비티와의 합작사 설립을 위해 중동 지역 술탄과 왕족, 유력자들로부터 합작사 투자자금을 확보한 것으로 알려졌다. LMTD는 보그 아라비아를 비롯, 바자, 호텔뉴스매거진 등 현지 유력매체를 통한 언론홍보-마케팅 활동을 지난달부터 시작했다. 오상기 현대아이비티 대표는 “글로벌 마케팅 전문회사인 LMTD그룹과 합작법인을 설립해 중동과 북아프리카 시장에 진출하게 돼 기쁘다”면서 “LMTD와 손잡고 중동-북아프리카 지역에서 바니스뉴욕이 선택한 명품 ‘비타브리드’ 화장품을 성공시켜 전세계적인 K뷰티의 기적을 선도해 나갈 것”이라고 말했다."
헤럴드경제,048410,/news/news_read.nhn?article_id=0000918889&office_id=016&mode=search&query=현대아이비티&page=1,2015-11-25 17:11,"&lt;생생코스닥&gt; 현대아이비티, 100억 규모 사모 CB 발행 결정","현대아이비티는 시설자금과 운영자금 조달을 위해 100억원 규모의 사모 전환사채를 발행키로 결정했다고 25일 공시했다. 표면이자율 1%, 만기이자율 4%, 사채만기일은 2018년 11월 27일이다. 전환가액은 7412원이다."
이데일리,048410,/news/news_read.nhn?article_id=0003855477&office_id=018&mode=search&query=현대아이비티&page=1,2017-06-21 08:53,"현대아이비티, 28조 중동&middot;북아프리카 화장품시장 진출","- 중동지역 글로벌 마케팅회사와 합작사 설립 - 명품백화점 바니스 독점 브랜딩 이어 글로벌마켓 확장 20일 20일 서울 이화여대 산학협력관에 위치한 현대아이비티 서울사무소에서 오상기 현대아이비티 대표와 윌허트슨LMTD그룹 대표가 중동-북아프리카 지역 합작사 설립 계약을 체결하고 있다. 현대아이비티 제공 [이데일리 정태선 기자] 현대아이비티는 중동지역 글로벌 마케팅회사와 합작사를 설립하고, 올해 250억 달러(한화 28조원) 규모로 예상되는 중동과 북아프리아 시장에 진출한다. 바이오화장품기업 현대아이비티(048410) 는 20일 서울 이화여대 산학협력관에 위치한 현대아이비티 서울사무소에서 오상기 현대아이비티 대표와 윌허트슨 LMTD그룹 대표가 참석한 가운데 중동·북아프리카 지역 합작사 설립 계약을 체결했다. 윌허트슨 LMTD그룹 대표는 디즈니 토이스토리 신화를 일궈낸 마케팅 귀재로 미국 나스닥, 버라이즌, 코카콜라, 레드불 등 글로벌 회사의 굵직한 마케팅 프로젝트를 성공적으로 수행한 마케팅 전문가다. LMTD그룹은 윌허트슨이 설립한 중동지역 메이저 글로벌 마케팅그룹으로, 아부다비 국영 석유회사, 아부다비 상업은행, 아랍에미리트 제2 항공사인 에티하드 항공, 필립스, 구글 등 중동 거대기업 마케팅을 맡고 있다. LMTD는 현대아이비티의 ‘비타브리드’가 미국 바니스뉴욕이 선택한 최고급 명품 화장품 브랜드란 점을 적극적으로 활용해 아랍에미리트와 사우디아라비아 상류층을 집중 공략하면서 급성장중인 북아프리카까지 시장을 확대한다는 전략이다. 중동지역과 북아프리카 지역은 전세계 화장품 시장의 6%를 차지하는 신흥시장으로, 매년 11%씩 초고속 성장세를 지속해 화장품업계의 황금어장으로 손꼽힌다. 이달 초 현대아이비티의 비타브리드는 미국에서도 5% 상위층이 다니는 백화점 바니스뉴욕과 브랜드 독점계약을 체결하면서 화제가 됐다. 이 계약은 국내에서는 비타브리드가 처음이며 아시아에서는 2010년 일본 ‘코겐도’ 이후 두번째다. 현대아이비티가 만든 비타브리드는 단독으로 사용하는 것이 아니라 모든 화장품이나 물에 조금씩 섞어서 쓰는 비타민C 가루 제품이다. 비타민C 입자를 미네랄이 감싸고 있다가 피부에 닿으면 미네랄이 서서히 녹으면서 12시간 동안 비타민이 피부에 천천히 흡수된다. 물에 섞어서 두피에 뿌리면 비타민C가 생성을 촉진한 콜라젠이 모근을 잡아주는 역할을 해 탈모 방지 효과도 있다고 한다. LMTD는 작년부터 비타브리드 시장가능성을 주목하고, 올해초 중동지역 오피니언 리더, 셀럽, 화장품 전문가를 대상으로 비타브리드 화장품을 파일럿 테스트까지 마쳤다. 현대아이비티와 합작사 설립을 위해 중동 지역 술탄과 왕족, 유력자들로부터 합작사 투자자금을 확보하고 미국 바니스뉴욕과의 계약체결 소식에 서둘러 합작사 설립을 추진한 것으로 알려졌다. LMTD는 보그 아라비아를 비롯, 바자, 호텔뉴스매거진 등 현지 유력매체를 통한 언론홍보와 마케팅 활동을 지난달부터 시작했다. 조만간 영어와 아랍어 버전 온라인쇼핑몰을 개설할 예정이다. 오상기 현대아이비티 대표는 “LMTD와 손잡고 중동과 북아프리카 지역에서 바니스뉴욕이 선택한 명품 ‘비타브리드’ 화장품을 성공시켜 전세계적인 K뷰티의 기적을 선도해 나갈 것”이라고 말했다. 현대아이비티는 옛 현대전자에서 분사한 디스플레이 전문업체다. 사업 다각화를 위해 바이오 분야에 투자를 시작했고 지난 2013년 국내에 비타브리드를 선보였다. 일본에서 먼저 관심을 보이면서 합작 회사인 ‘비타브리드재팬’을 설립했다. 최근 러시아의 유통 회사와 3년 독점판매 계약을 맺었고 스페인·불가리아·독일·영국 등에서도 판매를 시작했다. 작년 비타브리드재팬 매출은 400억원이며, 현대아이비티 바이오 분야 매출은 100억원이다."
이데일리,048410,/news/news_read.nhn?article_id=0003855514&office_id=018&mode=search&query=현대아이비티&page=1,2017-06-21 09:10,"[특징주]현대아이비티, 중동&middot;북아프리카 진출 소식에 급등",[이데일리 이명철 기자] 현대아이비티(048410)가 중동과 북아프리카 화장품 시장에 진출한다는 소식에 급등세다. 21일 오전 9시9분 현재 현대아이비티 주가는 전일대비 14.97% 오른 8600원을 기록 중이다. 화장품 시장에서 고성장을 나타내는 중동·북아프리카 시장 진출에 따른 실적 개선 기대감이 반영된 것으로 풀이된다. 회사는 지난 LMTD그룹과 중동-북아프리카 지역 합작사 설립 계약을 체결했다고 밝혔다. LMTD그룹은 중동지역 메이저 글로벌 마케팅그룹이다. 양사는 아랍에미리트와 사우디아라비아 상류층을 집중 공략하고 북아프리카까지 시장을 확대한다는 전략이다. 중동지역과 북아프리카 지역은 전세계 화장품 시장의 6%를 차지하며 매년 11%씩 초고속 성장세를 지속하고 있다.
헤럴드경제,048410,/news/news_read.nhn?article_id=0001205373&office_id=016&mode=search&query=현대아이비티&page=1,2017-03-03 15:41,"[생생코스닥] 현대아이비티, 바이오신물질 생산공장 준공식","-바이오 신물질 생산라인 증설…연간 20톤 생산-일본, 미국, 유럽, 중국, 동남아 수출물량 확대 대비 [헤럴드경제=양영경 기자] 코스닥 상장사 현대아이비티는 3일 경북 김천에서 바이오 생산설비 증축공사 준공식을 치렀다고 밝혔다. 현대아이비티는 늘어나는 해외 수요에 대비해 지난해 6월부터 총 50억원을 투입, 연 20톤 규모의 고품질 바이오 신물질 생산라인 300여평을 증축했다.  오상기 현대아이비티 대표는 “그간 매출이 급증하고 있는 일본이나 기타 시장에 제한적으로 제품을 공급할 수밖에 없었으나, 김천 바이오공장 생산설비 증설이 완료됨에 따라 미국과 유럽, 중국 시장 등 신규 시장의 수요에 적극적으로 대처할 수 있게 됐다”고 말했다."
서울경제,048410,/news/news_read.nhn?article_id=0003056008&office_id=011&mode=search&query=현대아이비티&page=1,2017-06-21 09:16,"현대아이비티, 중동-북아프리카 진출 소식에 장초반 급등세","[서울경제] 현대아이비티(048410)가 중동과 북아프리카 화장품 시장에 진출한다는 소식에 장초반 급등세를 보이고 있다. 21일 오전 9시12분 현재 코스닥시장에서 현대아이비티 주가는 전일대비 23.4%(1,750원) 오른 9,230원을 기록 중이다. 현대아이비티는 전날 LMTD그룹과 중동-북아프리카 지역 합작사 설립 계약을 체결했다고 밝혔다. LMTD그룹은 중동지역 메이저 글로벌 마케팅그룹이다. 양사는 아랍에미리트와 사우디아라비아 상류층을 집중 공략하고 북아프리카까지 시장을 확대한다는 전략이다."
매일경제,048410,/news/news_read.nhn?article_id=0003964537&office_id=009&mode=search&query=현대아이비티&page=1,2017-06-21 09:24,"[Hot-Line] 현대아이비티, 중동&middot;북아프리카 진출에 상승","현대아이비티가 중동·북아프리카 지역 화장품 시장에 진출한다는 소식에 상승하고 있다. 현대아이비티는 21일 오전 9시 12분 현재 전 거래일 대비 20.32%(1520원) 오른 9000원에 매매가가 형성돼 있다. 회사 측은 중동지역 마케팅회사 LMTD와 합작사를 설립하고, 올해 250억 달러 규모의 중동·북아프리카 시장에 도전한다고 밝혔다. [디지털뉴스국 이가희 기자] r_start // r_end //"
연합뉴스,048410,/news/news_read.nhn?article_id=0009351430&office_id=001&mode=search&query=현대아이비티&page=1,2017-06-21 09:25,"[특징주] 현대아이비티, 중동&middot;북아프리카 진출 소식에 급등",(서울=연합뉴스) 권수현 기자 = 현대아이비티가 중동과 북아프리카 화장품 시장에 진출한다는 소식에 21일 장 초반 급등하고 있다. 이날 오전 9시 23분 현재 코스닥시장에서 현대아이비티는 전 거래일보다 18.05% 뛰어오른 8천830원에 거래되고 있다. 현대아이비티는 전날 중동지역 글로벌 마케팅회사인 LMTD그룹과 중동·북아프리카 현지 합작사 설립 계약을 체결하고 올해 250억 달러 규모로 예상되는 중동과 북아프리카 시장 진출에 나선다고 이날 발표했다.
한국경제,048410,/news/news_read.nhn?article_id=0003784853&office_id=015&mode=search&query=현대아이비티&page=1,2017-06-21 09:31,"[특징주]현대아이비티, 52주 신고가&hellip;중동&middot;북아프리카 진출","현대아이비티가 52주 신고가를 경신했다. 21일 오전 9시26분 현재 현대아이비티는 전날보다 1300원(17.38%) 오른 8780원에 거래중이다. 장종에는 9230원까지 오르며 52주 신고가를 새로 썼다. 현대아이비티가 중동지역 글로벌 마케팅회사와 합작사를 설립하고, 올해 250억달러(한화 28조원) 규모로 예상되는 중동과 북아프리아 시장에 진출한다는 소식이 호재로 작용하고 있다. 현대아이비티는 전날 LMTD그룹과 중동-북아프리카 지역 합작사 설립 계약을 체결했다. LMTD그룹은 윌허트슨이 설립한 중동지역 메이저 글로벌 마케팅그룹이다. 양사는 아랍에미리트와 사우디아라비아 상류층을 집중 공략하고, 급성장중인 북아프리카까지 시장을 확대한다는 전략이다."
파이낸셜뉴스,048410,/news/news_read.nhn?article_id=0003832168&office_id=014&mode=search&query=현대아이비티&page=1,2017-06-21 09:39,"[fnRASSI]현대아이비티, 52주 신고가...12.57% &uarr;","현대아이비티(048410)는 52주신고가를 기록하고 있어 주목할만하다. 동종목의 현재 주가는 8,420원 선에서 이루어지고 있다. 거래일을 기준으로 최근 3일간 평균 거래량은 394만 주이다. 이는 60일 일 평균 거래량 69만 주와 비교해보면 최근 거래량이 급격히 늘어났다는 것을 알 수 있다. 외국인은 순매도, 개인은 순매수(한달누적)  전일 외국인이 435주를 순매수했다. 4주간을 기준으로 보면 개관이 순매수량을 늘리며 37,627주를 순매수했지만, 외국인은 매도 우위를 지속하면서 37,627주를 순매도했다. 기관의 순매수량에는 변함이 없다.                   지표               항목               값               종합점수                 성장성               매출액증가율               -0.16               1.59                 자기자본증가율               -0.31                 안정성               부채비율               192.56               5.71                 유동비율               135.75                 이익안정성               6.94                 수익성               ROA               -19.24               0.46                 ROE               -56.28                 영업이익율               -24.02          현대아이비티의 퀀트 재무 점수는 7.76점으로 지난 분기에 비해 성장성 점수가 하락했다. 이는 매출액 증가율과 자기자본 증가율이 감소하였기 때문이다. 안정성 종합 점수는 부채비율 증가, 유동비율 감소로 하락했다. 수익성 측면에서 볼때 ROA, ROE, 영업이익률 모두 하락하여 이전보다 낮은 점수를 받았다. 'fnRASSI'는 증권전문 기업 씽크풀과 파이낸셜뉴스의 협업으로 로봇기자가 실시간으로 생산하는 기사입니다."
데일리안,048410,/news/news_read.nhn?article_id=0002193065&office_id=119&mode=search&query=현대아이비티&page=1,2017-06-21 09:55,"[특징주] 현대아이비티, 중동&middot;북아프리카 시장 진출 소식에 '신고가'","현대아이비티가 중동과 북아프리카 시장에 진출한다는 소식이 전해지면서 52주 신고가를 경신했다. 21일 오전 9시49분 현재 현대아이비티는 전일대비 1090원(14.57%) 오른 8570원에 거래중이다. 장중 한 때 9230원까지 오르며 52주 신고가를 갈아치웠다. 현대아이비티는 이날 LMTD그룹과 중동-북아프리카 지역 합작사 설립 계약을 체결했다고 밝혔다. LMTD그룹은 중동지역 메이저 글로벌 마케팅그룹이다. 데일리안 한성안 기자 ⓒ (주)데일리안 - 무단전재, 변형, 무단배포 금지"
파이낸셜뉴스,048410,/news/news_read.nhn?article_id=0003784503&office_id=014&mode=search&query=현대아이비티&page=1,2017-03-03 15:33,"[fnRASSI]현대아이비티, 52주 신저가 경신...-5.44% &darr;","현대아이비티(048410)는 당일 4,085원까지 하락하며 52주신저가를 기록했다. 동종목의 현재 주가는 전일대비 -5.44% 하락한 4,085원 선에서 이루어지고 있다. 거래일을 기준으로 최근 3일간 평균 거래량은 34만 주이다. 이는 60일 일 평균 거래량 16만 주와 비교해보면 최근 거래량이 급격히 늘어났다는 것을 알 수 있다. 외국인 보유량 감소, 기관 증가 (5일 누적) 최근 5일간 동종목의 외국인 투자자는 11,589주 매도하였고 반면 기관은 1주 매수하였다. 전날 외국인 8,455주 매도, 기관1주 매수하며 보유 비율이 변동했다. 다음 표는 동종목의 외국인, 기관의 일별 순매수량을 나타낸 것이다. 상장주식수 대비 거래량은 0.56%로 적정수준 최근 한달간 현대아이비티의 상장주식수 대비 거래량을 비교해보니 일별 매매회전율이 0.56%로 집계됐다. 그리고 동기간 장중 저점과 고점의 차이인 일평균 주가변동률을 2.84%를 나타내고 있다. 'fnRASSI'는 증권전문 기업 씽크풀과 파이낸셜뉴스의 협업으로 로봇기자가 실시간으로 생산하는 기사입니다."
이데일리,048410,/news/news_read.nhn?article_id=0003466761&office_id=018&mode=search&query=현대아이비티&page=1,2016-02-02 09:12,[특징주]현대아이비티 급등&hellip;中 최대 약국체인과 제품 수출 본계약,"[이데일리 유재희 기자] 현대아이비티가 중국 최대 약국체인과 제푸 수출 본계약을 체결했다는 소식에 급등세다. 2일 오전 9시8분 현재 현대아이비티는 전일대비 20.33%(1200원) 상승한 7100원에 거래되고 있다. 현대아이비티는 중국 최대의 약국체인인 ‘국대약방’과 지난해 8월 사업제휴(MOU)를 맺은데 이어 주력제품인 비타브리드 제품 수출 계약을 체결했다고 밝혔다. 외국기업이 중국 국대약방과 현지 에이전트를 통하지 않고 직접 계약을 체결한 것은 현대아이비티가 처음이다. ‘국대약방’은 연매출 40조원의 중국 국영기업 국약홀딩스(시노팜) 그룹 계열사로, 국약홀딩스는 중국내 1만351개 병원과 7만8238개 보건소 및 진료소, 5만4452개 약국에 의약품을 공급하는 중국 최대의 제약 및 제약유통 그룹사다."
서울경제,048410,/news/news_read.nhn?article_id=0002985359&office_id=011&mode=search&query=현대아이비티&page=1,2017-03-03 14:04,"현대아이비티, 경북 김천에 바이오 신공장 증축",연간 20톤 규모 생산할 수 있는 생산라인 증축 급증하고 있는 해외 수출 수요 충족할 것
