source,symbol,link,date,title,content
헤럴드경제,048410,/news/news_read.nhn?article_id=0001228455&office_id=016&mode=search&query=현대아이비티&page=1,2017-04-24 10:13,"[생생코스닥] 현대아이비티, 러시아ㆍ우크라이나 시장 진출&hellip;500만달러 공급계약","- 미국ㆍ중국ㆍ일본 이어 신시장 열려 [헤럴드경제=양영경 기자] 현대아이비티는 독일 현지법인을 통해 러시아ㆍ우크라이나 전문 유통그룹 ‘네오그룹’(NEO Group)과 3년간 최소 500만달러(한화 약 56억원) 규모의 비타브리드 제품을 러시아에 독점 공급하는 본계약을 체결했다고 24일 밝혔다.  현대아이비티 측은 “네오그룹 관계자들은 지난 3월 ‘2017 이태리 볼로냐 코스모프로프’(Cosmoprof Worldwide Bologna 2017) 화장품 국제전시회에서 비타브리드C12 브랜드 부스를 방문했다”며 “최근 본계약을 체결하게 된 것”이라고 설명했다. 오상기 현대아이비티 대표는 “비타브리드C12 브랜드는 미국, 중국, 일본 등에 성공적으로 진출해 수출 물량을 확대하고 있다”며 “연간 1조원 이상의 화장품을 수입하는 러시아와 우크라이나 시장을 집중 공략할 것”이라고 말했다. 현대아이비티의 비타브리드C12 관련 바이오 원천기술은 세계적인 학술지인 ‘네이쳐’(Nature)와 ‘앙게반트케미’(Angewandte Chemie)’에 소개된 바 있다. 관련 제품은 몽드셀렉션 그랜드 골드상, 북미 코스모프로프 트렌드세터상 등을 수상했다. 일본 자사몰에서는 월 20억원 이상의 매출이 나오고 있으며, 비타브리드 스칼프 샴푸는 국내 홈쇼핑 론칭 후 6주 연속 매진행진을 이어가고 있다."
파이낸셜뉴스,048410,/news/news_read.nhn?article_id=0003800905&office_id=014&mode=search&query=현대아이비티&page=1,2017-04-10 14:06,"[fnRASSI]현대아이비티(048410), 신저가 경신...-4.86% &darr;","현대아이비티(048410)는 당일 3,815원까지 하락하며 52주신저가를 기록했다. 동종목의 현재 주가는 전일대비 -4.86% 하락한 3,815원 선에서 이루어지고 있다. 거래일을 기준으로 최근 3일간 평균 거래량은 31만 주이다. 이는 60일 일 평균 거래량 16만 주와 비교해보면 최근 거래량이 다소 증가했다는 것을 알 수 있다. 상장주식수 대비 거래량은 0.42%로 적정수준 최근 한달간 현대아이비티의 상장주식수 대비 거래량을 비교해보니 일별 매매회전율이 0.42%로 집계됐다. 그리고 동기간 장중 저점과 고점의 차이인 일평균 주가변동률을 1.49%를 나타내고 있다.                   지표               항목               값               종합점수                 성장성               매출액증가율               -0.11               3.12                 자기자본증가율               -0.03                 안정성               부채비율               132.43               8.07                 유동비율               325.9                 이익안정성               6.94                 수익성               ROA               -15.13               0.62                 ROE               -35.16                 영업이익율               -19.22          현대아이비티의 퀀트 재무 점수는 11.81점으로 지난 분기에 비해 성장성 점수가 하락했다. 이는 자기자본 증가율이 감소하였기 때문이다. 수익성 측면에서 볼때 ROA, ROE, 영업이익률 모두 하락하여 이전보다 낮은 점수를 받았다. 'fnRASSI'는 증권전문 기업 씽크풀과 파이낸셜뉴스의 협업으로 로봇기자가 실시간으로 생산하는 기사입니다."
머니투데이,048410,/news/news_read.nhn?article_id=0003629854&office_id=008&mode=search&query=현대아이비티&page=1,2016-02-15 10:45,현대아이비티 지난해 영업이익 13.5억&hellip;전년비 109.6%&uarr;,"[머니투데이 유엄식 기자] 현대아이비티는 지난해 영업실적이 매출액 406억7462만원, 영업이익 12억5588만원, 당기순이익 7억1128만원으로 잠정 집계됐다고 15일 공시했다. 전년대비 매출액은 40.6%, 영업이익은 109.6% 증가했고 당기순이익은 흑자 전환됐다. textlinktopstart textlinktopend textlinkstart"
아시아경제,048410,/news/news_read.nhn?article_id=0003686787&office_id=277&mode=search&query=현대아이비티&page=1,2016-02-15 10:49,"현대아이비티, 지난해 영업익 14억원&hellip;전년比 109.6%&uarr;",[아시아경제 최서연 기자] 현대아이비티는 지난해 영업이익이 13억6000만원으로 전년대비 109.6% 증가했다고 15일 공시했다. 같은 기간 매출액은 406억7000만원으로 40.6% 늘었고 당기순이익은 7억1000만원으로 흑자전환했다.
아시아경제,048410,/news/news_read.nhn?article_id=0003646691&office_id=277&mode=search&query=현대아이비티&page=1,2015-12-15 09:15,"현대아이비티, 서울대와 녹내장 등 점안제 공동개발","[아시아경제 팍스넷 배요한 기자] 현대아이비티는 올해초부터 한국콜마와 공동개발해 온 전립선암 치료제 제형을 성공적으로 개발한데 이어, 최근 서울대 등과 공동으로 녹내장 등 점안제 개발에 착수할 예정이라고 15일 밝혔다. 제약업계에 따르면 전세계 안과약품 시장은 17억8천만달러(한화 2조1000억원) 규모로 이중 전안부 염증질환 약물시장은 7억1천만달러(한화 8400억원)에 달하는 큰 시장이다. 건강보험공단과 건강보험심사평가원에 따르면 2014년 국내 안과질환 환자는 25만명으로 65세 이상 입원환자 1위 질병이며, 한해 치료비만 2400억원에 달한다. 현대아이비티는 최근 전립선암 치료제 개량신약 제형 개발에 성공했으며, 아토피, 창상, 무좀치료용 연고제 등 피부용 개량신약 개발에도 박차를 가하고 있는 상태다. 전립선암 치료제 시장은 국내만 1천억원에 달하며 세계시장 규모는 20조원이 넘는다. 한편 현대아이비티는 내년중 전립선암 치료제와 피부연고제 등 현재 개발중인 개량신약을 바탕으로 내년에 제약업계에 본격 진출할 방침이다."
뉴시스,048410,/news/news_read.nhn?article_id=0007038964&office_id=003&mode=search&query=현대아이비티&page=1,2016-02-15 10:45,"현대아이비티, 지난해 영업이익 14억&hellip;전년比 110%&uarr;","【서울=뉴시스】디스플레이 전문업체 현대아이비티는 지난해 영업이익이 전년대비 109.6% 증가한 13억5588만원을 기록했다고 15일 공시했다. 같은 기간 매출은 406억7462만원으로 40.6% 늘었고, 당기순이익은 7억1129만원으로 흑자 전환했다. ★ 세상에 이런일이 -  반대편 문 열고 내리다 KTX 치여 숨져 ★ 오늘의 핫 포토 -  윤소이, 시선 사로잡는 시원한 뒤태"
이데일리,048410,/news/news_read.nhn?article_id=0003807780&office_id=018&mode=search&query=현대아이비티&page=1,2017-04-24 15:14,"현대아이비티, 러시아 시장 진출&hellip;500만달러 규모 공급계약",[이데일리 이후섭 기자] 현대아이비티(048410)는 지난 19일 독일 현지법인을 통해 러시아·우크라이나 전문유통그룹 `네오그룹(NEO Group)`과 3년간 500만달러 규모의 비타브리드 제품을 러시아에 독점 공급하는 계약을 체결했다고 24일 밝혔다. 회사 측은 지난 3월 `2017 이태리 볼로냐 코스모프로프` 화장품 국제전시회에서 네오그룹 관계자들이 비타브리드C12 브랜드 부스를 방문했고 최근 본계약을 체결하게 된 것이라고 설명했다. 오상기 현대아이비티 대표는 “비타브리드C12 브랜드는 이미 3대 화장품 시장인 미국·중국·일본에 성공적으로 진출해 수출 물량을 꾸준히 확대하고 있다”며 “동유럽 대형 유통채널을 보유한 네오그룹과 손잡고 연간 10억달러 이상의 화장품을 수입하고 있는 러시아와 우크라이나 시장을 집중 공략해 나갈 것”이라고 전했다.
경향신문,048410,/news/news_read.nhn?article_id=0002660232&office_id=032&mode=search&query=현대아이비티&page=1,2015-12-17 20:52,[2015 하반기 경향히트상품] 현대아이비티 | 비타브리드C12 헤어-&lsquo;바이오융합...,"현대아이비티의 ‘비타브리드C12 헤어’는 세계적인 과학저널 네이처에 하이라이트로 소개된 최진호 석좌교수(이화여대)의 바이오 융합기술을 이용한 두피·모발케어 제품이다. 피부 전용 비타민C-미네랄 복합체인 ‘비타브리드C’를 적용, 12시간 이상 지속적으로 피부 깊숙이 활성 비타민C를 공급, 탈모 치료를 돕는다. ‘비타브리드C’는 바이오 융합기술을 이용해 미네랄에 비타민C를 저장한 세계 최초의 피부 전용 비타민C 신물질로 알려져 있다. 비타브리드C12 헤어’는 첨단 바이오 신기술로 항산화작용이 뛰어난 콜라겐 생성물질인 비타민C를 활성화한 제품으로 탈모 방지 및 예방 효과가 우수하다. 현대아이비티 관계자는 “지난 수십년간 바이오 기술이 빠른 속도로 발전해 왔음에도 기존 약물 중심의 탈모치료제보다 효능이 뛰어난 제품이 없었다”며 “신기술 부재로 답보상태에 있는 탈모치료제 시장에서 인체에 유익한 활성물질인 비타민C를 이용한 ‘비타브리드C12 헤어’는 피부 재생을 통한 새로운 탈모 치료의 시대를 열 것”이라고 말했다. 모바일 경향 ["
파이낸셜뉴스,048410,/news/news_read.nhn?article_id=0003802713&office_id=014&mode=search&query=현대아이비티&page=1,2017-04-13 14:53,"[fnRASSI]현대아이비티(048410), 신저가 경신...-3.15% &darr;","현대아이비티(048410)는 당일 3,690원까지 하락하며 52주신저가를 기록했다. 동종목의 현재 주가는 전일대비 -3.15% 하락한 3,690원 선에서 이루어지고 있다. 거래일을 기준으로 최근 3일간 평균 거래량은 22만 주이다. 이는 60일 일 평균 거래량 16만 주와 비교해보면 최근 거래량이 다소 증가했다는 것을 알 수 있다. 개인,외국인 투자자만 매매에 참여 최근 한달간 주체별 거래비중을 살펴보면 개인 비중이 92.69%로 가장 높았고, 외국인이 7.3%로 그 뒤를 이었다. 기관은 거래에 참여하지 않은 것으로 보인다. 그리고 최근 5일간 거래비중은 개인 비중이 93.8%로 가장 높았고, 외국인이 6.19%로 그 뒤를 이었다. 기관은 거래에 참여하지 않은 것으로 보인다. 상장주식수 대비 거래량은 0.42%로 적정수준 최근 한달간 현대아이비티의 상장주식수 대비 거래량을 비교해보니 일별 매매회전율이 0.42%로 집계됐다. 그리고 동기간 장중 저점과 고점의 차이인 일평균 주가변동률을 3.22%를 나타내고 있다. 'fnRASSI'는 증권전문 기업 씽크풀과 파이낸셜뉴스의 협업으로 로봇기자가 실시간으로 생산하는 기사입니다."
헤럴드경제,048410,/news/news_read.nhn?article_id=0000993320&office_id=016&mode=search&query=현대아이비티&page=1,2016-02-15 10:48,"&lt;생생코스닥&gt;현대아이비티, 작년 영업익 13.5억 전년비 109.6%&uarr;",현대아이비티는 지난해 연결 영업이익이 13억5587만원으로 전년대비 109.6% 증가했다고 15일 공시했다. 매출액은 406억7461만원으로 40.6% 늘었고 당기순이익은 7억1128만원으로 흑자전환했다.
서울신문,048410,/news/news_read.nhn?article_id=0002748937&office_id=081&mode=search&query=현대아이비티&page=1,2016-08-19 15:36,"현대아이비티 &lsquo;비타브리드C12 헤어&rsquo; 화장품 3종, 중국 위생허가 취득","[서울신문] 현대아이비티(www.huyndaeibt.com)는 19일 중국 국가식품의약품감독관리총국(CFDA)으로부터 ‘비타브리드C12 헤어’ 3개 제품에 대한 위생 허가를 취득했다고 밝혔다. 해당 제품은 헤어, 헤어 솔루션, 스칼프 솔루션이다. ‘비타브리드C12 헤어’ 외에 ‘비타브리드C12 페이스’ 제품도 몇주 안에 위생허가가 나올 것이라고 현대아이비티는 설명했다. 이미 일본에서 인지도를 굳힌 비타브리드 제품이 중국에서 위생 허가를 받게 됨에 따라 본격적인 중국시장공략에 가속도가 붙게 될 전망이다. 이번 중국 위생허가 취득은 최근 생활용품 전문 국영기업 량미엔쩐과의 제휴에 이어 중국 시장에 뿌리를 내리는 새로운 전기가 될 것으로 보인다. 오상기 현대아이비티 대표이사는 “중국 시장의 성장을 발판 삼아 북미와 유럽시장 공략도 해 나갈 계획”이라고 말했다. 현대아이비티의 비타민화장품 ‘비타브리드’는 첨단 바이오 기술을 비타민C에 적용한 신물질로 피부에 바르면 비타민C를 12시간 이상 지속해서 피부에 전달하는 제품이다. MobileAdNew center 세계 최고의 권위를 자랑하는 과학 학술지 ‘네이처’와 ‘앙게반트 케미’에 차세대 바이오 융합 기술로 소개돼 세계적으로 주목받고 있는 비타브리드C는 미국재료학회 MRS와 미국 화학협회의 화학전문지인 C&EM 등에서도 미래 유망 기술로 소개됐다."
아시아경제,048410,/news/news_read.nhn?article_id=0003962039&office_id=277&mode=search&query=현대아이비티&page=1,2017-03-27 16:30,"현대아이비티, 4회차 전환가액 5251원&rarr;5189원",[아시아경제 박미주 기자]현대아이비티는 4회차 전환사채권의 전환가액이 기존 5251원에서 5189원으로 변경됐다고 27일 공시했다. 전환가능 주식수는 190만4399주에서 192만7153주로 늘었다.
뉴시스,048410,/news/news_read.nhn?article_id=0008147097&office_id=003&mode=search&query=현대아이비티&page=1,2017-08-29 16:21,"현대아이비티, 일본서 '비타브리드C12 헤어' 신제품 출시","【서울=뉴시스】현대아이비티는 '비타브리드C12 헤어' 신제품을, 일본 식약처 의약외품 승인을 받아서 새롭게 출시했다고 29일 밝혔다. 일본 합작회사 비타브리드 재팬에서 열린 신제품 발표회에 정치인 히가시고쿠바루, 일본 전 축구대표 후쿠다마사히로, 아나운서 쿠라시키야스오 등이 참석해 제품의 우수성을 소개한 후 기념사진을 찍고 있다.(제공=현대아이비티)  日 식약처 의약외품 승인 【서울=뉴시스】김경원 기자 = 코스닥기업 현대아이비티(대표 오상기·048410)는 '비타브리드C12 헤어' 신제품을, 일본 식약처 의약외품 승인을 받아서 새롭게 출시했다고 29일 밝혔다. 일본 합작회사 비타브리드 재팬에서 열린 신제품 발표회에는 정치인 히가시고쿠바루, 일본 전 축구대표 후쿠다마사히로, 아나운서 쿠라시키야스오, JOY, 사토미키, 오쿠데라야스히코 등 일본 유명인사들이 대거 참석했다. 비타브리드 재팬에 따르면 자사몰에서 신제품 출시 직후 헤어 제품 매출이 전월대비 30% 이상 증가했다. 또한 정기구매 고객 중 50% 이상이 신제품으로 전환해 줄 것을 요청하는 등 뜨거운 반응을 보이고 있다. 페이스 제품도 판매가 급증하면서 다른 제품 매출이 크게 늘고 있어 효자 역할을 톡톡히 하는 것으로 알려졌다. 비타브리드 재팬은 이 같은 상승세를 적극 활용해 조만간 대대적인 온오프 마케팅을 시작할 예정이다. 이번에 출시된 '비타브리드C12 헤어' 신제품은 현대아이비티가 2년 넘게 효능 및 사용감 개선을 위한 테스트 등 심혈을 기울여 만들어낸 전략제품이다. 이런 노력의 결과로 일본 식약처로부터 육모, 박모, 가려움, 탈모예방, 발모 촉진용 의약외품으로 공식 인정을 받았다. 핵심성분인 영국산 순수 비타민C와 탈모 증상 완화에 도움을 주는 멘톨, 살리실산, 텍스판테놀 성분이 함유돼 손상된 두피를 진정시키고 부작용 없이 건강한 두피를 만들어 준다. 사용감이 개선되고 탈모 관련 유효성분들이 강화됐다. 오상기 현대아이비티 대표는 ""이번 제품은 세계 3대 헤어케어시장인 일본시장을 겨냥해 오랜 기간 준비했다""며 ""미국 바니스뉴욕 입점으로 제품의 신뢰도가 한층 높아진 가운데 일본시장에서 높은 반응을 보이고 있어 판매시장을 전 세계로 확대할 것""이라고 말했다."
조선비즈,048410,/news/news_read.nhn?article_id=0000372118&office_id=366&mode=search&query=현대아이비티&page=1,2017-06-08 09:17,"[특징주] 현대아이비티, 美 백화점 바니스뉴욕과 독점계약 소식에 급등","디스플레이·화장품 전문업체인 현대아이비티(048410) 가 미국 ‘바니스 뉴욕’과 독점계약을 체결했다는 소식에 급등세다. 8일 오전 9시 12분 현재 현대아이비티는 전날 대비 14.94(810원) 오른 6230원에 거래되고 있다. 현대아이비티는 미국 명품백화점이자 명품 브랜드 메이커인 바니스 뉴욕과 미국 독점계약을 체결했다고 7일 밝혔다. 회사측은 “바니스뉴욕은 미국의 최고급 명품백화점으로, 국내 화장품 업체 중 바니스뉴욕과 브랜드 독점 계약을 체결한 것은 현대아이비티의 ‘비타브리드’가 처음”이라며 “아시아에서는 지난 2010년 일본의 ‘코겐도’ 이후 두 번째”라고 설명했다. 브랜드 독점 계약이란 일정기간 브랜드 전체에 대한 독점권을 부여받는 높은 단계의 파트너십 계약이다. 바니스뉴욕은 이에 따라 2년 동안 자사 비용으로 현대아이티비의 제품에 대한 미국 내 광고홍보와 이벤트, 스타마케팅 등을 진행한다."
서울경제,048410,/news/news_read.nhn?article_id=0003047896&office_id=011&mode=search&query=현대아이비티&page=1,2017-06-08 09:16,"美 진출 현대아이비티, 2거래일 연속 급등","[서울경제] 7일 미국 진출을 선언한 현대아이비티(048410)가 2거래일 연속 상승세를 보여주고 있다. 현대아이비티는 8일 오전 9시13분 현재 코스닥 시장에서 전일 대비 18.08%(980원) 오른 6,400원에 거래되고 있다. 전 거래일인 7일 현대아이비티는 미국 명품 유통채널에 자사의 화장품 제품 비타브리드를 공급한다고 밝힌 바 있다. 이에 당일 상한가를 기록하며 5,420원에 장을 마친 바 있다."
이데일리,048410,/news/news_read.nhn?article_id=0003763247&office_id=018&mode=search&query=현대아이비티&page=1,2017-03-03 09:54,"현대아이비티, 바이오 생산설비 증축&hellip;&quot;해외수요 적극 대처&quot;","[이데일리 이후섭 기자] 현대아이비티(048410)는 3일 경북 김천 바이오공장에서 오상기 대표와 바이오 업계 전문가, 관계사 임직원 등이 참석한 가운데 바이오 생산설비 증축공사 준공식을 가졌다고 밝혔다. 회사는 늘어나는 해외수요에 대비해 지난해 6월부터 총 50억원을 투입해 연간 20톤 규모의 바이오 신물질 생산라인 300여평을 증축해 왔다. 이번 바이오 공장 증설로 매출이 급증하고 있는 해외 수출 물량공급에 차질없이 준비할 수 있게 됐다고 회사측은 설명했다. 오상기 현대아이비티 대표는 “김천 바이오공장 생산설비 증설이 완료됨에 따라 미국과 유럽, 중국 시장 등 신규 시장의 수요에 적극 대처할 수 있게 됐다”고 전했다."
한국경제TV,048410,/news/news_read.nhn?article_id=0000557250&office_id=215&mode=search&query=현대아이비티&page=1,2017-06-21 14:29,"현대아이비티, LMTD그룹과 합작사 설립 계약‥중동진출 본격화","[한국경제TV 김치형 기자] 현대아이비티가 LMTD그룹과  중동-북아프리카 지역 합작사 설립 계약을 체결했다고 밝혔습니다. LMTD그룹(teamlmtd.com)은 윌허트슨이 설립한 중동지역 메이저 글로벌 마케팅그룹으로, 아부다비 국영 석유회사, 아부다비 상업은행, 아랍에미리트 제2 항공사인 에티하드 항공, 필립스, 구글 등 중동 거대기업 마케팅을 맡고 있습니다. 윌허트슨 LMTD그룹 대표는 디즈니 토이스토리, 美 나스닥, 버라이즌, 코카콜라, 레드불 등 글로벌 회사의 굵직한 마케팅 프로젝트들을 성공적으로 수행한 마케팅 전문가 입니다. 현대아이비티와 LMTD는 비타브리드가 美 바니스뉴욕이 선택한 최고급 명품 화장품 브랜드란 점을 적극 활용해, 고품질 화장품과 명품에 아낌없이 투자하는 아랍에미리트와 사우디아라비아 상류층을 대상으로 집중 마케팅함으로써 중동지역 화장품 시장을 공략하면서, 급성장중인 북아프리카까지 시장을 확대해 나간다는 전략입니다. 오상기 현대아이비티 대표는 ""글로벌 마케팅 전문회사인 LMTD그룹과 합작법인을 설립해 중동과 북아프리카 시장에 진출하게 돼 기쁘다""면서 ""LMTD와 손잡고 중동-북아프리카 지역에서 바니스뉴욕이 선택한 명품 '비타브리드' 화장품을 성공시켜 전세계적인 K뷰티의 기적을 선도해 나갈 것""이라고 말했습니다. . ."
아시아경제,048410,/news/news_read.nhn?article_id=0004018765&office_id=277&mode=search&query=현대아이비티&page=1,2017-06-21 14:38,"현대아이비티, 중동 화장품시장 진출 위한 합작사 설립",[아시아경제 박선미 기자]현대아이비티가 중동 및 북아프리카 지역 화장품시장 진출을 위해 아랍에미레이트연합(UAE) Rudde 및 씨앤팜과 합작법인 ‘Vitabrid MENA Limited(가칭)’을 설립하기로 결정했다고 21일 공시했다. 현대아이비티가 보유하는 합작법인 지분은 24.5%(12만2500주)다. 출자예정일은 9월 1일이다.
파이낸셜뉴스,048410,/news/news_read.nhn?article_id=0003593280&office_id=014&mode=search&query=현대아이비티&page=1,2016-02-02 08:52,"현대아이비티, 중국 최대 약국체인 '국대약방'과 비타브리드 제품 수출 본계약 체결","현대아이비티가 중국 최대의 약국체인인 '국대약방'과 지난해 8월 사업제휴(MOU)를 맺은데 이어, 중국 북경에서 현대아이비티 주력제품인 비타브리드 제품 중국 판매를 위한 상품공급계약을 체결했다고 2일 밝혔다. 외국기업이 중국 국대약방과 현지 에이전트를 통하지 않고 직접 계약을 체결한 것은 현대아이비티가 처음이다. '국대약방'은 연매출 40조원의 중국 국영기업 국약홀딩스(시노팜) 그룹 계열사로, 국약홀딩스는 중국내 1만351개 병원과 7만8238개 보건소 및 진료소, 5만4452개 약국에 의약품을 공급하는 중국 최대의 제약 및 제약유통 그룹사다. 현대아이비티는 중국 현지에 설립한 자회사를 통해 비타브리드 제품에 대한 중국정부의 위생허가를 신청한 상태이며, 제품 판매를 위한 인허가가 완료되는대로 비타브리드 생산라인을 풀가동해 국대약방 소속 약국 매장들에 공급할 예정이다. 현대아이비티 관계자는 ""빠르면 올해 5월에 중국정부로부터 비타브리드 제품에 대한 인허가를 받을 수 있을 것으로 예상한다""면서 ""중국 내 약국체인 진출을 시작으로 올해부터 매출이 큰 폭으로 늘어날 것으로 기대하고 있다""고 전했다. 이와함께 현대아이비티는 동인당, 의보전신 등 중국 내 주요 거대약국체인과도 지난해부터 상품공급계약을 추진 중에 있며, 중국 내 군병원 및 일반 병의원 등에도 비타브리드 제품공급을 위한 막후교섭을 진행 중이라는 게 사측 설명이다. 한편, 현대아이비티는 피부에 바르는 비타민C 파우더 제품 '비타브리드'를 개발해 한국과 일본, 중국, 홍콩 등지에 시판 중이며, DNA 및 항암치료제 관련 나노융합기술을 상용화하기 위한 연구개발에 박차를 가하고 있는 바이오기업이다. 특히 현대아이비티가 보유한 '미네랄-약물 전달체' 기술은 세계 각국에 특허등록 되었을 뿐만 아니라 미국화학회지(JACS), 독일화학회지(Angewante Chemie-International Edition) 등의 표지논문으로 선정됐고, 네이처지(Nature)의 하이라이트에 소개된 바 있다. 이어 미국재료학회에서 8대 혁신기술로 선정되는 등 세계적으로 인정받은 차세대 바이오기술이다."
