source,symbol,link,date,title,content
한국경제,049180,/news/news_read.nhn?article_id=0003590827&office_id=015&mode=search&query=셀루메드&page=1,2016-05-09 07:31,"셀루메드, 대표가 최대주주 변경 수반 주식담보계약","[ 이민하 기자  ] 셀루메드는 심영복 대표이사가 지난 4일 공평저축은행과 최대주주 변경을 수반하는 주식 담보제공 계약을 체결했다고 9일 공시했다. 심 대표는 회사 주식 736만5000주(지분 4.32%)를 보유 중이며 공평저축은행(300만주), MS저축은행(85만주), 키움저축은행(150만주)과 각각 담보제공을 위한 주식질권설정을 맺은 상태다. 채무금액은 22억원, 담보설정금액은 총 37억9000만원이다. 이민하 한경닷컴 기자"
파이낸셜뉴스,049180,/news/news_read.nhn?article_id=0003785982&office_id=014&mode=search&query=셀루메드&page=1,2017-03-07 15:31,"[fnRASSI]셀루메드(049180), 신저가 경신...-20.4% &darr;","셀루메드(049180)는 당일 601원까지 하락하며 52주신저가를 기록했다. 동종목의 현재 주가는 전일대비 -20.4% 하락한 601원 선에서 이루어지고 있다. 거래일을 기준으로 최근 3일간 평균 거래량은 3940만 주이다. 이는 60일 일 평균 거래량 722만 주와 비교해보면 최근 거래량이 급격히 늘어났다는 것을 알 수 있다. 외국인 보유량 감소, 기관 증가 (5일 누적) 최근 5일간 동종목의 외국인 투자자는 359,404주 매도하였고 반면 기관은 17,720주 매수하였다. 전날 두 주체 각각 600주, 17,720주 순매수하며 보유 비율을 늘렸다. 다음 표는 동종목의 외국인, 기관의 일별 순매수량을 나타낸 것이다. 기관/개인 순매수, 외국인은 순매도(한달누적)  3월2일부터 전일까지 기관이 3거래일 연속 순매수했다. 4주간을 기준으로 보면 기관이 53,006주를 순매수했고, 개인들도 129,998주를 순매수했다. 반면 그 동안 외국인은 매도쪽으로 방향을 잡으면서 183,004주를 순매도했다. 'fnRASSI'는 증권전문 기업 씽크풀과 파이낸셜뉴스의 협업으로 로봇기자가 실시간으로 생산하는 기사입니다."
파이낸셜뉴스,049180,/news/news_read.nhn?article_id=0003907648&office_id=014&mode=search&query=셀루메드&page=1,2017-11-16 14:40,[fnRASSI]셀루메드(049180) 전일대비 23.04% 상승,"현재 셀루메드(049180)는 전일대비 23.04% 상승하여 11,750원 선에서 거래가 이루어지고 있다. 주주들의 손바뀜 14.15%이 너무 잦아 최근 한달간 셀루메드의 매매회전율을 분석한 결과 7일에 1번 꼴로 주식의 주인이 바뀐 것으로 나타났다. 이는 비정상적으로 높은 회전율을 보인 것으로 투자에 각별한 주의가 요망된다. 동종목의 경우 동기간 일평균 주가변동률은 5.75%를 기록했다. 외국인, 기관 모두 보유량 감소 (5일 누적) 최근 5일간 동종목의 외국인 투자자는 71,191주 순매도하였고 마찬가지로 기관은 7,305주 순매도하였다. 전날 외국인 18,389주 순매수, 기관7,305주 순매도하며 보유 비율이 변동했다. 다음 표는 동종목의 외국인, 기관의 일별 순매수량을 나타낸 것이다. 'fnRASSI'는 증권전문 기업 씽크풀과 파이낸셜뉴스의 협업으로 로봇기자가 실시간으로 생산하는 기사입니다."
한국경제,049180,/news/news_read.nhn?article_id=0003591438&office_id=015&mode=search&query=셀루메드&page=1,2016-05-10 01:07,[코스닥 기업공시] (9일) 셀루메드 등,"▲셀루메드=최대주주가 공평저축은행, MS저축은행, 키움저축은행 등에 736만주(37억9000만원) 담보 제공. ▲에이티테크놀러지=5억원 규모 전환사채(CB) 발행 결정. ["
전자신문,049180,/news/news_read.nhn?article_id=0002658875&office_id=030&mode=search&query=셀루메드&page=1,2017-11-16 20:05,"[ET투자뉴스]셀루메드, 17년3분기 실적 발표",11월 14일 셀루메드(049180)의 2017년 3분기 연결 확정 실적이 발표됐다. 작년 같은 기간 대비해서 매출액은 72.56% 상승하여 40억원을 기록했다. 영업이익은 -12.5억원으로 -12억원에서 적자폭이 확대되었다. 당기순이익은 -17억원으로 -12.4억원에서 적자확대되었다. 이번분기 기준으로 추정되는 셀루메드의 자기자본이익률(ROE)은 -15%로 나타났다. 전년 동기인 2016년 3분기 ROE는 -9.6%로 이번 분기에 5.4%p 하락했다. 한편 동종목의영업이익률은 -31.2%이다. 지난해 동기 영업이익률은 -51.5%로 이번 3분기가 20.3%p 상승했다. 주가가 1주당 순자산의 몇배인지 알려주는 주가순자산비율인 PBR은 5.03배이다. PBR은 3분기 이상 연속으로 하락하다 저번 분기부터 반등하여 상승했다. 지난해 동기 PBR은 9.74배로 이번 3분기 PBR이 하락했다. 다음은 셀루메드와 동일 업종 내 비교 그룹 종목의 각각 최근 실적의 전년 동기 대비 성장률이다. 셀루메드의 매출액 증감율은 타 종목 대비 가장 우수한 편이다. 그리고 주가의 하락율이 가장 큰 편으로 나타났다.
매일경제,049180,/news/news_read.nhn?article_id=0003899382&office_id=009&mode=search&query=셀루메드&page=1,2017-03-06 09:23,"[Hot-Line] 셀루메드, 20대 1 감자 소식에 하한가",셀루메드가 20대 1 감자결정에 장 초반 하한가를 찍고있다. 6일 오전 9시 10분 현재 셀루메드는 전거래일 대비 320원(29.77%) 내린 755원에 거래되고 있다. 셀루메드는 지난 3일 재무구조 개선을 위해 보통주 20주를 1주로 줄이는 감자를 결정했다고 공시했다. 감자가 실행되면 자본금은 908억 원에서 45억 원으로 감소한다. 감자 기준일은 오는 5월 2일이며 신주 상장예정일은 5월19일이다. [디지털뉴스국 김경택 기자] r_start // r_end //
전자신문,049180,/news/news_read.nhn?article_id=0002656625&office_id=030&mode=search&query=셀루메드&page=1,2017-11-12 14:01,[코스닥 UP&amp;DOWN] 셀루메드&uarr; 풍국주정&darr;,"◆[업(Up)]셀루메드 바이오·제약업종의 코스닥 질주가 계속되고 있다. 바이오시밀러전문업체인 셀루메드는 지난 7일 콜라겐 및 디알데히드전분을 포함하는 필러용 고분자 복합체 국내 특허를 취득했다고 공시했다. 셀루메드가 개발한 필러용 고분자 복합체는 필러의 주름 개선효과를 장시간 유지시키는 것이 특징이다. 보다 적은 횟수로 필러를 시술해도 그 효과가 유지될 수 있어서 피부 자극 역시 줄어든다는 장점이 있다. 또 피부 세포 재생을 촉진해 피부 탄력을 강화하고 주름 개선 효과에 대한 시너지 효과를 낼 수 있다고 셀루메드 측은 설명했다. 회사는 해당 특허를 기반으로 국내외 사업을 확대할 방침이다. 이외에도 최근 골이식재 '라퓨젠 DBM'의 동물 유효성 실험을 마치고, 미국 식품의약국(FDA) 승인을 위한 막바지 작업에 돌입했다는 소식에 주가가 상승했다. 셀루메드는 작년 총 350억원의 당기순손실을 기록한 바 있다. ◆[다운(Down)]풍국주정 ⓒ게티이미지 풍국주정이 수소차 테마주 여파로 주가가 출렁였다. 풍국주정은 소주의 원료로 사용되는 주정을 전문으로 생산하는 기업으로 1954년 창업했다. 당시 양조사업을 하던 삼성의 고 이병철 회장에 의해 설립돼, 고 이규호 회장에게 인수되면서 안정적 생산능력을 갖춘 기업으로 자리 잡았다. 풍국주정은 1994년에 코스닥시장에 상장했고, 1999년에 취임한 이한용 대표는 풍국주정을 차세대 에너지기업으로 탈바꿈시키는 데 앞장섰다. 현재는 선도그룹 이름 아래 차세대 산업용 기초소재 전문 기업으로서 풍국주정, 선도화학, 화신화학, 선도산업, 에스디지 등 계열사를 거느리고 있다. 풍국주정 핵심 역량은 친환경 고품질 에탄올 생산능력이다. 또 자회사인 에스디지가 수소 생산능력을 갖춰 미래 수소연료전지차 수혜주로 떠올랐으나 단기 급등 이후 하락세를 면치 못 했다. ※표 코스닥 주간 등락률 상하위 종목"
연합뉴스,049180,/news/news_read.nhn?article_id=0009084050&office_id=001&mode=search&query=셀루메드&page=1,2017-03-06 09:15,"[특징주] 셀루메드, 감자 결정에 하한가",(서울=연합뉴스) 윤선희 기자 = 셀루메드가 재무구조 개선을 위한 감자를 추진하기로 한 소식에 6일 가격제한폭까지 급락했다. 오전 9시12분 현재 셀루메드는 하한가로 직행해 755원에 거래되고 있다. 셀루메드는 3일 재무구조 개선을 위해 보통주 20주를 1주로 줄이는 감자를 결정했다고 공시했다. 감자 기준일은 5월 2일이며 신주 상장 예정일은 5월 19일이다. 셀루메드는 작년 연결 기준 자본잠식률이 44% 수준이라고 잠정 집계했다. 이달 31일 정기 주주총회에서 감자 안건이 승인되면 자본잠식 문제는 해소될 것으로 전망됐다.
서울경제,049180,/news/news_read.nhn?article_id=0003148980&office_id=011&mode=search&query=셀루메드&page=1,2017-11-09 09:40,"셀루메드, 라퓨젠 동물 유효성 실험 완료&middot;&middot;&middot;FDA승인 준비에 &uarr;","[서울경제] 셀루메드(049180) 가 라퓨젠DBM 제품의 미국 FDA 승인 심사 준비가 순항하고 있다는 소식에 장 초반 상승세다. 셀루메드는 9일 오전 9시37분 현재 전일 대비 13.03%(1,170원) 오른 1만150원에 거래되고 있다. 셀루메드는 골이식재 ‘라퓨젠 DBM’의 동물 유효성 실험을 지난 여름부터 시작하여 모든 실험을 마치고 외부 시험기관에 분석을 의뢰하고  FDA승인을 위한 막바지 작업이 진행 중에 있으며, 외부 시험기관의 시험분석이 끝나면 자체적으로 데이이터를 작성하여 FDA에 승인을 위한 서류를 접수할 예정이라고 밝혔다. 셀루메드는 그 동안 동물실험을 위하여 대상 동물의 수급이 부족하여 동물을 자체적으로 동물을 사육하는 등 극도의 노력으로 동물실험을 완전히 끝내고 외부기관의 시험분석에 들어간 것으로 알려졌다. 작년말 SCI 수준급의 동물 유효성을 입증하는 자료는 충분히 보유하고 있으나 FDA는 샘플데이터의 완전 성숙한 동물을 실험대상으로 한 유효성 테스트 결과만 인정하여, 이에 맞는 동물을 국내에서는 유통하고 있지 않아 실험 동물의 수급의 지연으로 시간이 오래 소요됐다. ‘라퓨젠 DBM’은 탈회골기질인 DBM내 내재되어 있는 천연의 골형성 단백질을 주원료로 한 제품으로 기존 골이식재와 비교할 때 높은 골 형성 능력을 발휘해 환자의 신속한 회복을 돕는 특징이 있다. 국내 뿐 아니라 태국, 말레이시아, 인도네시아 등 아시아 지역 식약처로 부터 승인 받아 판매되고 있다."
뉴시스,049180,/news/news_read.nhn?article_id=0008276730&office_id=003&mode=search&query=셀루메드&page=1,2017-11-09 09:47,"셀루메드, 美 공략 위한 '라퓨젠 DBM' FDA승인 순항 중","【서울=뉴시스】김경원 기자 = 근골격계 바이오시밀러 전문기업 셀루메드(049180)가 '라퓨젠 DBM'(골형성단백질) 제품의 미국 식품의약품안전청(FDA) 승인심사를 위한 준비가 순항 중이라고 9일 밝혔다. 현재 재접수를 위한 동물 유효성 실험을 마치고 외부 시험기관에 시험분석을 의뢰한 것으로 알려졌다. 셀루메드는 지난 여름부터 골이식재 '라퓨젠 DBM'의 동물 유효성 실험을 시작했다. 실험은 이미 마쳤으며 외부 시험기관에 분석을 의뢰, FDA승인을 위한 막바지 작업이 진행 중이다. 회사 측은 외부 시험기관의 시험분석이 끝나면 자체적으로 데이터를 작성해 FDA에 승인을 위한 서류를 접수할 예정이라고 설명했다. '라퓨젠 DBM'은 탈회골기질인 DBM에 내재돼 있는 천연의 골형성단백질을 주원료로 하는 제품이다. 기존 골이식재와 비교할 때 높은 골 형성 능력을 발휘해 환자의 신속한 회복을 돕는다는 게 특징이다. 국내뿐 아니라 태국, 말레이시아, 인도네시아 등 아시아 지역 식약처로부터 승인 받아 판매되고 있다. 회사 관계자는 ""그동안 '라퓨젠 DBM'의 FDA승인을 위해 자체적으로 많은 노력을 기울였다""며 ""향후 FDA승인이 완료되는 데로 자회사 엔도텍을 거점으로 미국시장 진출을 교두보로 남미 등 글로벌 시장 공략에 나설 것""이라고 말했다."
서울경제,049180,/news/news_read.nhn?article_id=0002986418&office_id=011&mode=search&query=셀루메드&page=1,2017-03-06 09:15,"셀루메드, 대규모 감자결정에 신저가 추락",[서울경제] 셀루메드(049180)가 대규모 감자 결정 소식에 장 초반 신저가로 추락했다. 6일 오전 9시 13분 현재 셀루메드는 전 거래일 대비 가격제한폭(29.77%)까지 하락한 755원에 거래되고 있다. 이 회사는 재무구조 개선을 위해 보통주 20주를 1주로 줄이는 감자를 결정했다고 지난 3일 공시했다. 이번 감자에 따라 자본금은 908억원에서 45억원으로 감소한다. 감자 기준일은 5월2일이며 신주 상장예정일은 5월19일이다.
뉴시스,049180,/news/news_read.nhn?article_id=0008291769&office_id=003&mode=search&query=셀루메드&page=1,2017-11-16 15:26,"셀루메드, BMP4 복합체 제품 생산 확대키로","BMP4, 줄기세포 분화 억제해 자가 증식 능력 증대 ""BMP시리즈 연구개발 토대로 많은 제품 상용화"" 【서울=뉴시스】김경원 기자 = 셀루메드(049180)는 16일 BMP4 복합체 생산을 통해 제품을 확대하겠다고 밝혔다. BMP4단백질은 골 재생능력, 지방 줄기세포의 분화 및 뇌교모종 암세포의 증식을 억제하는 것으로 알려져 있는 골형성단백질이다. 지난 5월 제주대 연구팀이 BMP4를 이용해 피부 속 내재적 줄기세포를 단기간에 유사줄기세포로 재생산하고 심근세포를 분화시키는 연구에 성공하며 BMP4에 관심이 쏠렸다. BMP4는 줄기세포의 분화를 억제함으로써 자가 증식 능력을 증대시키는 효과가 있는 것으로 알려져 있다. 셀루메드는 이미 2014년 한국과학기술원과 공동으로 BMP4를 고발현시킬 수 있는 세포주와 배양 최적화 및 고순도로 정제할 수 있는 기술을 개발했다. 연구용 세포주 개발 후 미국의 우시엡텍(WuxiAppTec)사에서 마스터세포주(MCB)와 생산 세포주(MCB) 제조에 안정성 검증을 완료했다. 또한 최근 생산된 BMP4단백질은 한국화학연구원 부설 안전성평가연구소에서 안정성(약물동태 및 일반독성시험) 검증을 완료했다. 현재 BMP4 단백질을 의약품급 수준으로 생산하기 위한 작업이 진행 중이다. 회사 측은 피부, 인대, 뼈 등 다양한 조직의 치료제품으로 생산할 예정이며 향후 임상시험을 거쳐 상용화가 이뤄질 것으로 기대했다. 셀루메드 생체재료 의공학연구소 관계자는 ""조직공학 및 재생의학의 필수인 지지체, 성장인자, 세포개발을 위한 연구자원 기반시설을 충분히 갖추고 있다""며 ""BMP시리즈의 다양한 연구개발을 토대로 많은 제품을 상용화했으며 지속적인 연구개발을 통해 획기적인 제품이 개발될 것""이라고 말했다."
조선비즈,049180,/news/news_read.nhn?article_id=0000367619&office_id=366&mode=search&query=셀루메드&page=1,2017-04-26 15:42,"셀루메드, 퇴행성 척추 질환 치료물질 특허 취득",셀루메드(049180) 는 퇴행성 척추 추간판 질환 치료용 하이드로겔과 이를 포함한 주사제형에 대한 국내 특허를 취득했다고 26일 공시했다. 회사 측은 “척추 추간판 퇴행성 질환 치료의 디스크 충진용 조성물로 유용하게 활용될 것”이라고 설명했다.
머니투데이,049180,/news/news_read.nhn?article_id=0003957076&office_id=008&mode=search&query=셀루메드&page=1,2017-11-01 11:42,"셀루메드, 단백질 활성 관련 특허 취득",[머니투데이 서진욱 기자] 셀루메드가 'BrdU 어세이' 개선 방법 관련 국내 특허를 취득했다고 1일 공시했다. BrdU 어세이는 'FGF-7 단백질' 활성을 확인하는 방법인 세포 증식 어세이 중 하나다.
이데일리,049180,/news/news_read.nhn?article_id=0003959573&office_id=018&mode=search&query=셀루메드&page=1,2017-11-01 13:10,"셀루메드, 단백질 활성 관련 국내특허 취득",[이데일리 윤필호 기자] 셀루메드(049180)가 ‘BrdU 어세이’ 개선 방법 관련 국내 특허를 취득했다고 1일 공시했다. BrdU 어세이는 ‘FGF-7 단백질’ 활성을 확인하는 방법인 세포 증식 어세이 중 하나다.
한국경제,049180,/news/news_read.nhn?article_id=0003828743&office_id=015&mode=search&query=셀루메드&page=1,2017-09-26 10:33,"셀루메드, 관절활액 대체제 '비스코실' 심평원 급여 판정","[ 한민수 기자  ] 셀루메드는 관절 활액 대체재인 '비스코실'을 출시한 지 1년 만에 건강보험심사평가원으로부터 급여 판정을 받아 다음달부터 적용된다고 26일 밝혔다. 셀루메드는 지난해 비스코실의 수입 품목허가를 획득한 바 있다. 비스코실은 관절경 수술 시 식염수로 씻겨나간 관절 활액을 대체해 주는 역할을 한다. 시장 규모는 연간 600억원 수준으로 추정되고 있다. 셀루메드는 비스코실의 한국 판권을 보유 중이다. 회사 관계자는 ""관절경 수술이 매년 늘어나고 있어 비스코실이 필수적으로 사용될 것으로 예상된다""며 ""이번 심평원 급여 개시로 매출 재도약의 효자 노릇을 할 것""이라고 말했다."
헤럴드경제,049180,/news/news_read.nhn?article_id=0001295582&office_id=016&mode=search&query=셀루메드&page=1,2017-09-26 10:41,"[생생코스닥] 셀루메드, 비스코실 심평원에 급여 판정 받아","- 환자 관절 손상 방지 [헤럴드경제=김지헌 기자] 코스닥 상장사 셀루메드는 지난해 수입품목 허가를 득한 후 관절 활액 대체재인 비스코실(VISCOSEAL Syringe)을 출시한지 1년만에 심평원으로부터 급여(한정) 판정을 받았다고 26일 밝혔다. 비스코실은 환자 관절의 손상을 방지해 주는 역할을 한다. 무릎의 인대나 연골이 손상돼 관절경 수술을 진행할 때, 시야 확보를 위해 관절 주변을 식염수 등으로 세척하는 과정을 거친다. 이때 혈액이나 조직만 제거되는 게 아니라 관절내 필수적으로 존재해야 하는 관절 활액까지 씻겨져 나감으로써 수술 후에 환자는 통증을 느낀다. 관절 활액은 일정기간이 지나면 자연적으로 다시 생성 되지만, 자연 생성되기 전까지 환자는 계속 진통제를 투여 받아야 한다. 관절을 사용할 때마다 관절 간에 직접적 마찰이 일어나 조직에 미세한 손상이 가해 지기도 한다. 이를 방지하기 위해 활액 대체용으로 개발된 것이 비스코실이다. [사진=오픈애즈] 회사 관계자는 “비스코실은 관절경 수술이 매년 수십만 건으로 매년 늘어나고 있어 필수적으로 사용될 것으로 예상되다”며 “이번 심평원 비급여 개시로 셀루메드 매출도 재도약의 효자 노릇을 할 수 있을 것”이라고 밝혔다. 한편 건강보험심사평가원에 따르면 국내에서 매년 20만건 이상의 관절경 수술이 행해지고 있다."
파이낸셜뉴스,049180,/news/news_read.nhn?article_id=0003799423&office_id=014&mode=search&query=셀루메드&page=1,2017-04-06 09:48,"[fnRASSI]셀루메드(049180), 신저가 경신...-2.51% &darr;","셀루메드(049180)는 당일 544원까지 하락하며 52주신저가를 기록했다. 동종목의 현재 주가는 전일대비 -2.51% 하락한 544원 선에서 이루어지고 있다. 거래일을 기준으로 최근 3일간 평균 거래량은 1004만 주이다. 이는 60일 일 평균 거래량 1581만 주와 비교해보면 최근 거래량이 다소 감소했다는 것을 알 수 있다. 주주들의 손바뀜 19.21%이 너무 잦아 최근 한달간 셀루메드의 매매회전율을 분석한 결과 5일에 1번 꼴로 주식의 주인이 바뀐 것으로 나타났다. 이는 비정상적으로 높은 회전율을 보인 것으로 투자에 각별한 주의가 요망된다. 동종목의 경우 동기간 일평균 주가변동률은 4.3%를 기록했다. 외국인과 개인은 순매도, 기관은 순매수(한달누적)  전일 외국인이 121,351주를 사들인 반면 기관은 4,764주를 팔았다. 4주간을 기준으로 보면 기관이 방향성있는 매매를 하면서 263,025주를 순매수한 반면, 외국인은 매도 후 매수의 관점을 보이고 있음에도 불구하고 89,629주를 순매도했고, 개인들도 매도 우위로 반전되면서 173,396주를 순매도했다. 'fnRASSI'는 증권전문 기업 씽크풀과 파이낸셜뉴스의 협업으로 로봇기자가 실시간으로 생산하는 기사입니다."
이데일리,049180,/news/news_read.nhn?article_id=0003926876&office_id=018&mode=search&query=셀루메드&page=1,2017-09-19 13:56,"셀루메드, 신개념 무릎연골 치료 결과 공개&hellip;기술특허 출원","[이데일리 박형수 기자] 셀루메드(049180)가 무릎반월상 연골 및 연골치료를 위한 치료제 연구개발 결과를 공개한다. 셀루메드는 국제 인공괄절술 학회(ISTA)서 연구 결과를 채택했다며 오는 20일부터 23일 사이에 발표한다고 19일 밝혔다. 앞서 셀루메드는 지난 2015년부터 세계 최대 규모의 비영리 민간 연구소로 알려진 스크립스 연구소에 본사 수석연구원을 파견해 관련 연구를 진행했다. 지난해부터 세계 정형외과 학회, 관절학회 등, 관련 연구의 결과를 국제학회에 발표했다. 반월상연골은 무릎관절 사이에서 충격흡수와 관절 형태 유지를 하는 조직으로 무릎연골시장 규모는 2023년까지 약 27억달러(한화 약3조원) 규모의 시장을 형성할 것으로 관측됐다. 연평균 5.8% 성장하는 시장이다. 반월상 연골이 손상된 환자를 치료하려면 기존에는 단순히 수술용 봉합사를 통해 복구하는 재건술에만 의존했다. 수술 후 치료 결과가 좋지 않고 무릎관절 내의 가혹한 물리적 조건 탓에 완치가 힘들었다. 학회가 채택한 연구 결과는 별도 줄기세포 이식이 없이도 환자 본인 세포가 치료재 내로 침투하도록 유도한다. 자발적으로 손상된 연골을 복구하기 때문에 이전과는 다른 개념의 치료 방식으로 알려졌다. 셀루메드 관계자는 “현재 신기술을 셀루메드와 스크립스연구소가 공동으로 기술특허를 출원한 상태”라며 “국제학회는 서울 신라호텔에서 열린다”고 말했다."
파이낸셜뉴스,049180,/news/news_read.nhn?article_id=0003876739&office_id=014&mode=search&query=셀루메드&page=1,2017-09-19 14:41,"[fnRASSI]셀루메드, 상한가 기록","셀루메드(049180)는 상한가를 기록하고 있다. 동종목은 현재 8,540원선에서 이루어지고 있다. 참고로 52주 최고가는 13,650원(17년 05월 30일), 최저가는 531원(17년 04월 10일)원이다. 최근 3일동안 평균 거래량은 309만 주이다. 이는 250일 일 평균 거래량 139만 주와 비교해보면 최근 거래량이 급격히 늘어났다는 것을 알 수 있다. 개인투자자의 매매가 가장 활발 최근 한달간 주체별 거래비중을 살펴보면 개인이 93.38%, 외국인이 6.12%, 기관은 0.49%를 기록한 것으로 나타났다. 그리고 최근 5일간 거래비중은 개인이 전체 거래량의 94.85%를 차지하며 가장 활발한 참여를 보였고, 외국인은 4.07%, 기관은 1.07%의 거래 참여율을 보였다. 외국인, 기관 모두 보유량 감소 (5일 누적) 최근 5일간 동종목의 외국인 투자자는 65,433주 순매도하였고 마찬가지로 기관은 7,500주 순매도하였다. 전날 두 주체 각각 19,340주, 7,500주 순매도하며 보유 비율을 줄였다. 다음 표는 동종목의 외국인, 기관의 일별 순매수량을 나타낸 것이다. 'fnRASSI'는 증권전문 기업 씽크풀과 파이낸셜뉴스의 협업으로 로봇기자가 실시간으로 생산하는 기사입니다."
