source,symbol,link,date,title,content
한국경제TV,049180,/news/news_read.nhn?article_id=0000625464&office_id=215&mode=search&query=셀루메드&page=1,2018-04-23 10:15,"셀루메드, 전일 대비 약 -8% 하락한 21,300원","[한국경제TV 라이온봇 기자] 셀루메드는 4월 23일 10시 14분 전일 대비 약 -8% 하락한 21,300원에 거래되고 있다. 셀루메드는 코스닥 상장 기업으로 제약 업종에 속해 있다. 시가총액은 4,466억원으로 코스닥 상장기업 중 121위에 위치 해 있다. [종목 성향 진단] [그림 1] 종목 성향 진단 셀루메드의 투자 스타일은 성장주에 가깝다. 주가 고평가 우려가 공존하지만 높은 성장성이 기대되는 기업이다. 주가 모멘텀은 눈에 띄는 성장세를 기록했다. 최근 6개월 수익률이 무려 225.39%의 상승폭을 기록했다. 최근 1개월 수익률 또한 132.23% 상승하며 굉장히 좋은 모멘텀을 보이고 있다. 셀루메드 종목에 대한 투자자의 관심도는 굉장히 높은 편이다. [투자 점수 진단] [그림 2] 투자 점수 진단 셀루메드는 성장성(매출증가율(YoY)) 측면에서 두각을 나타내고 있다. 최근 매출증가율(YoY)은 97점으로 6개의 핵심 팩터 중 가장 높은 점수를 기록했다. 매출증가율(YoY)은  전체 시장 내 56위를 기록하며 상위 3.03%에 위치했다. 업종별로는 8위를 기록하며 상위 3.91%에 위치했다. 그러나 ROA와 PBR은  아쉬움을 나타냈다. [종합 투자점수] [그림 3] 종합 투자점수 AI 인공지능 분석을 통한 셀루메드의 종목 종합 스코어는 36점을 기록했다. 이는 동일 업종 평균점수인 54점과 시장 평균점수인 56점를 하회하는 수치였다. (위의 AI인공지능 점수는 재무 데이터를 기반으로 전체 상장 종목과 비교/분석하여 도출한 점수로 높은 점수가 반드시 높은 수익률을 보장하지 않습니다. 위의 자료는 당사의 추천 종목이 아니며, 투자 시 참고용으로 제시해드리는 것입니다.) 라이온봇 기자 -한국경제TV※ 본 기사는 한국경제TV와 '거장들의 투자공식이'자체 개발한 '라이온봇 기자'가 실시간으로 작성한 기사입니다. 라이온봇기자 ⓒ 한국경제TV, 무단 전재 및 재배포 금지 한국경제TV 관련뉴스해당 언론사에서 선정하며 언론사 페이지(아웃링크)로 이동해 볼 수 있습니다.왕빛나 서구적 몸매 비결…'20kg을 한 번에?'유병자 실손보험, 삼성화재 '가장 비싸'쏘가리 가격 '확' 떨어진다…22년 연구 끝에 '대량양식' 성공박하선 '다이어트 성공' 인증샷 ""웰컴백 44사이즈""손은서♥이주승 열애 인정, '연상녀-연하남커플' 합류"
헤럴드경제,049180,/news/news_read.nhn?article_id=0001025699&office_id=016&mode=search&query=셀루메드&page=1,2016-04-04 14:06,"&lt;생생코스닥&gt;셀루메드, 관절 활액 대체재 식약처 수입허가 승인",셀루메드는 식품의약품안전처(MFDS)로부터 관절 활액 대체재(VISCOSEAL Syringe)가 의료기기 수입품목 허가 승인을 받았다고 4일 공시했다. 회사측은 “조직수복용생체재료인 관절 활액 대체제의 수입품목 허가를 취득함으로써 향후 매출확대에 기여할 것으로 기대한다”고 밝혔다.
파이낸셜뉴스,049180,/news/news_read.nhn?article_id=0003996470&office_id=014&mode=search&query=셀루메드&page=1,2018-04-05 15:41,"[fnRASSI]장마감, 코스닥 하락 종목(셀루메드 -14.01%&darr;)","5일 코스닥 시장에서 하락한 종목으로 셀루메드(049180) -14.01%, 이젠텍(033600) -13.86%, 스킨앤스킨(159910) -12.2% 등이 있다. 'fnRASSI'는 증권전문 기업 씽크풀과 파이낸셜뉴스의 협업으로 로봇기자가 실시간으로 생산하는 기사입니다."
연합뉴스,049180,/news/news_read.nhn?article_id=0010007130&office_id=001&mode=search&query=셀루메드&page=1,2018-04-05 18:12,대호에이엘&middot;셀루메드 공매도 과열종목 지정,"(서울=연합뉴스) 전명훈 기자 = 한국거래소는 5일 유가증권시장의 대호에이엘, 코스닥시장의 셀루메드 등 2종목을 공매도 과열종목으로 지정했다고 공시했다. 공매도 과열종목으로 지정되면 다음 거래일에 공매도 거래가 금지된다."
한국경제,049180,/news/news_read.nhn?article_id=0003558827&office_id=015&mode=search&query=셀루메드&page=1,2016-03-04 09:45,"[특징주]셀루메드&middot;행남자기, 액면분할 재상장 첫 날 '급등'",[ 조아라 기자  ] 셀루메드와 행남자기가 액면분할 후 재상장한 첫 날 급등하고 있다. 4일 오전 9시38분 현재 셀루메드는 가격제한폭까지 오른 1065원에 거래되고 있다. 같은시간 행남자기도 24.57% 급등한 1445원을 나타내고 있다. 앞서 셀루메드는 유통주식수 확대로 인한 거래 활성화를 위해 액면가를 2500원에서 500원으로 낮추는 주식분할을 결정했다. 행남자기도 액면가를 5000원에서 500원으로 낮췄다. 조아라 한경닷컴 기자
머니투데이,049180,/news/news_read.nhn?article_id=0003809702&office_id=008&mode=search&query=셀루메드&page=1,2017-01-20 17:59,"셀루메드, 전환가액 1874원에서 1523원으로 하향",[머니투데이 주명호 기자] 셀루메드는 시가하락으로 전환사채의 전환가액을 주당 1874원에서 1523원으로 하향 조정한다고 20일 공시했다. 이에 따라 전환 가능한 주식수는 133만4044주에서 164만1497주로 늘어난다. textlinktopstart textlinktopend textlinkstart
아시아경제,049180,/news/news_read.nhn?article_id=0003699951&office_id=277&mode=search&query=셀루메드&page=1,2016-03-04 09:40,"[특징주]셀루메드&middot;행남자기, 액면분할 효과에 장 초반 '급등'","[아시아경제 임철영 기자]셀루메드와 행남자기가 액면분할 효과에 장 초반 강세다. 4일 오전 9시53분 현재 셀루메드는 전 거래일 대비 가격제한폭(29.40%) 오른 1065원에 거래되고 있다. 셀루메드는 유통주식수를 늘려 거래를 활성화할 목적으로 액면가를 2500원에서 500원으로 낮췄다. 행남자기 역시 액면가를 5000원에서 500원으로 낮추는 액면분할을 단행, 거래재개 첫날 24.14% 오른 1440원을 기록중이다."
뉴시스,049180,/news/news_read.nhn?article_id=0008529430&office_id=003&mode=search&query=셀루메드&page=1,2018-04-05 18:59,대호에이엘&middot;셀루메드 공매도 과열종목 지정,"【서울=뉴시스】이진영 기자 = 한국거래소는 대호에이엘(069460), 셀루메드(049180) 등 2종목을 공매도 과열종목으로 지정했다고 5일 공시했다. 공매도 과열종목으로 지정되면 다음 거래일에 공매도 거래가 제한된다."
아시아경제,049180,/news/news_read.nhn?article_id=0003719257&office_id=277&mode=search&query=셀루메드&page=1,2016-04-01 08:40,"셀루메드, 보건복지부 의료기기 임상시험지원 과제로 선정","[아시아경제 이정민 기자] 바이오시밀러 전문기업 셀루메드는 지난달 31일 보건복지부가 지원하는 2016년도 제2차 보건의료기술연구개발사업의 최종대상자로 선정됐다고 밝혔다. 임상지원대상 제품은 현재 세브란스 병원을 비롯한 총 7개 병원에서 진행 중인 라푸젠(Rafugen) BMP2이다. 이 제품은 향후 3년간 총 9억원의 임상 시험비를 지원받는다. 이 제품은 세계에서 2번째로 CHO 세포 배양 방식의 의료용 단백질 BMP2(Bone Morpho  -genic Protein)을 주원료로 제조한 제품으로 기존 제품보다 빠른 골재생이 일어남을 특징으로 한다. 현재 중증의 척추질환 환자를 치유할 수 있는 척추유합술에 사용되고 있다. 치과분야에서는 이미 임상시험을 거쳐 시판되고 있으며, 동남아, 남미 일부 국가에 수출돼 치과분야 뿐만 아니라 정형, 신경외과 분야에서도 사용되고 있다. 셀루메드 관계자는 “보건복지부의 임상시험 지원에 따라 해당 제품의 임상시험은 보다 원활하고 신속하게 진행될 예정이다. 국가에서 지원을 받게 됨으로써 임상 대상이 되는 환자들의 두려움도 다소 해소될 것""이라고 말했다."
서울경제,049180,/news/news_read.nhn?article_id=0003221061&office_id=011&mode=search&query=셀루메드&page=1,2018-02-12 11:44,"(코)셀루메드, 전일 대비 10.31% 상승.. 일일회전율은 1.43% 기록","[서울경제] 셀루메드(049180) 는 12일 오전 11시 42분 현재 10.31% 오른 9,950원에 거래되고 있으며, 39(매도):61(매수)의 매수우위를 기록하고 있다. 거래대금은 25억4,583만, 거래량은 27만2,176주로 거래량회전율은 1.43%로 나타났다. 지난 1개월간 셀루메드는 상승 12회, 하락 13회를 기록했고, 주가수익률은 1.63% 표준편차는 2.86%를 기록했다. 이 기간 ' 제약업 ' 업종 평균 주가수익률은 17.84%로 나타났으며, 변동성은 3.81%를 기록했다. 이 시각 현재 ' 제약업 '은 1.75% 상승 중이며, 55(매도):45(매수)의 매도우위를 기록하고 있다."
아시아경제,049180,/news/news_read.nhn?article_id=0003935087&office_id=277&mode=search&query=셀루메드&page=1,2017-02-17 13:31,"셀루메드, 퇴행성 추간판 치료 위한 하이드로겔 제조법 특허 취득","[아시아경제 권성회 기자] 셀루메드는 퇴행성 추간판 질환 치료를 위한 하이드로겔의 제조방법에 대해 특허권을 취득했다고 17일 공시했다. 회사 측은 “우수한 함수성 및 물성을 가지는 가수분해 폴리아크릴로니트릴(HPAN)을 함유하는 퇴행성 추간판 질환 치료용 하이드로겔을 제조하는 방법에 관한 것”이라고 소개했다. 이어 “주사제형의 하이드로겔을 주입해 디스크의 기능을 복원하는데 효과적일 것으로 판단된다”며 “기존 수술을 통한 치료법의 한계인 수술 후 거동 제한 및 재수술 발생률이 높은 단점을 극복할 수 있어, 앞으로 출시하고자 하는 제품 개발에 적용해 적극적으로 활용할 예정”이라고 밝혔다."
머니투데이,049180,/news/news_read.nhn?article_id=0003641579&office_id=008&mode=search&query=셀루메드&page=1,2016-03-04 09:14,"[특징주]셀루메드&middot;행남자기, 액면분할 재상장 첫날 급등",[머니투데이 김은령 기자] 셀루메드와 행남자기 등 액면분할을 단행한 종목들이 재상장 첫 날 급등하고 있다. 4일 오전 9시 11분 현재 셀루메드는 전 거래일 대비 가격제한폭까지 오른 1065원에 거래되고 있다. 앞서 셀루메드는 유통주식수 확대로 인한 거래 활성화를 위해 액면가를 2500원에서 500원으로 낮추는 주식분할을 결정한 바 있다. 행남자기도 액면분할 후 재상장 이후 20% 급등한 1400원에 거래되고 있다. 행남자기는 액면가를 5000원에서 500원으로 낮췄다. textlinktopstart textlinktopend textlinkstart
데일리안,049180,/news/news_read.nhn?article_id=0002163536&office_id=119&mode=search&query=셀루메드&page=1,2017-01-20 17:42,"셀루메드, 전환가액 1874원서 1523원으로 조정","셀루메드는 시가하락에 따라 제17회차 전환사채의 전환가액을 1874원에서 1523원으로 조정한다고 20일 공시했다. 데일리안 박선영 기자 ⓒ (주)데일리안 - 무단전재, 변형, 무단배포 금지"
아시아경제,049180,/news/news_read.nhn?article_id=0004178129&office_id=277&mode=search&query=셀루메드&page=1,2018-02-12 11:44,"셀루메드, 일동제약과 골이식재 마케팅제휴 업무협약","[팍스넷데일리 정혜인 기자] 셀루메드와 일동제약이 골이식재 rhBMP2(이하 BMP2) 관련 사업화와 산학연협력의 동반 성과창출을 위한 업무협약(MOU)을 체결했다. 셀루메드에 따르면 BMP2는 현재 미국 FDA 승인을 신청한 Rafugen DBM보다 골 재생 기능이 빠른 제품이다. 골 형성을 유도하는 천연 BMP(Bone Morphogenic Protein)외에도 인간재조합골형성단백질2(rhBMP2)가 다량 함유돼 골 생성을 촉진하는 이식재다. 현재 정형외과 및 척추 신경외과 분야의 환자 임상 Case를 모두 마친 상태로, 임상환자들의 골 유합율 경과를 기다리는 단계다. 이르면 연내 식품의약품안전처의 제조품목 허가를 완료(치과용 식약처 품목 허가는 이미 완료)할 수 있도록 준비한다는 계획이다. 회사 관계자는 12일 “향후 일동제약과의 본 계약이 완료되면 본격적인 마케팅에 나설 예정” 이라고 말했다. 일동제약그룹은 ‘인류의 건강과 행복에 기여하는 초일류기업’을 기업이념으로 77년 역사를 달려온 국내 대표 제약그룹이다. 의약품, 의약품 원료의 연구개발 및 제조, 판매에 경쟁력 있는 역량을 갖추고 있다."
머니투데이,049180,/news/news_read.nhn?article_id=0004032773&office_id=008&mode=search&query=셀루메드&page=1,2018-04-03 13:49,"셀루메드, 3D 프린팅 기술 이용 지지체 특허 취득","[머니투데이 김태현 기자] 셀루메드는 3차원(3D) 프린팅을 이용한 골 결손 충진용 지지체의 제조 특허권을 취득했다고 3일 공시했다. 이 특허는 골 결손 충진용 지지체 생산 비용을 낮추고, 다양한 형태의 지지체를 제조할 수 있는 기술이다."
파이낸셜뉴스,049180,/news/news_read.nhn?article_id=0003994772&office_id=014&mode=search&query=셀루메드&page=1,2018-04-03 14:05,"[공시] 셀루메드, 골 결손 충진용 지지체 관련 특허권 취득","셀루메드는 3일 3차원 프린팅을 이용한 골 결손 충진용 지지체의 제조방법에 관한 특허권을 취득했다고 공시했다. 이 제조방법은 생체 흡수성 고분자와 트리칼슘포스페이트를 재료로 사용해, 이를 냉각 분쇄한 다음 3차원 프린팅으로 성형하는 단계를 거친다. 셀루메드는 ""이 기술을 앞으로 출시하고자 하는 정형용 의료기기 제품 개발에 활용할 예정""이라고 전했다."
머니투데이,049180,/news/news_read.nhn?article_id=0003641561&office_id=008&mode=search&query=셀루메드&page=1,2016-03-04 09:00,"[더벨]셀루메드-엠젠, 이종 장기및 조직 개발 공동 연구착수","[더벨 김세연 기자] [연골재생촉진 의료용단백질 개발 탄력] 더벨|이 기사는 03월04일(08:52) 자본시장 미디어 '머니투데이 thebell'에 출고된 기사입니다. 셀루메드와 엠젠플러스가 이종 장기 및 조직 개발에 공동으로 나섰다. 셀루메드는 지난 3일 엠젠플러스와 이종 장기 및 조직 개발을 위한 공동 연구 계약을 체결했다고 4일 밝혔다. 계약에 따라 셀루메드는 엠젠플러스로부터 면역 결핍 돼지의 반월상 연골조직을 공급받고 진행중인 '연골재생촉진 의료용 단백질(TGF-β)' 개발에 활용하게 된다. 인체 조직과 가장 유한 면역 결핍 돼지의 조직을 적용해 보다 빨리 재생이 이뤄질 수 있는 조직공학적 임플란트 개발이 가능해진 셈이다. 무릎 관절의 충격 흡수와 윤활작용을 하는 반월상 연골은 운동 등으로 인한 손상의 경우가 많은 부위로, 최근 고령화 등에 따라 대체 치료제 개발의 중요성이 높아져왔다. 장주웅 셀루메드 연구소장은 ""국내 최초로 면역결핍 돼지를 생산한 엠젠플러스 연구팀과의 공동 연구로 돼지의 연골조직을 활용, 생체 적합성과 효능이 우수한 새로운 이종 무릎연골 의료소재의 개발뿐 아니라 퇴행성 무릎관절염 치료제 개발에도 적극 활용할 것""이라고 밝혔다. 셀루메드는 지난 2010년부터 산업통상자원부가 주관한 세계시장 선점 10대 핵심소재(WPM) 사업의 연구과제 수행에 나서며 100억 원 이상의 연구비를 지원받아 의료용 단백질을 개발해 왔다. 셀루메드는 이미 세계에서 2번째로 차세대 골이식재인 'CHO cell-rhBMP2'인 동물세포 유래의 골형성 단백질을 개발하며 우수성을 입증했다. 셀루메드는 지난해 연결기준 매출 187억, 영업손실 46억을 기록했다. 매출은 메르스 여파로 인한 장기이식 수술 지연 등의 여파로 전년대비 소폭 감소했지만 원가절감과 지급수수료 등 판관비 감소 노력에 힘입어 영업손실은 전년보다 60억 원 가량 줄어들었다. 셀루메드 관계자는 ""지난해 4분기 매출이 65억 원으로 전분기 대비 216% 증가했고, 올해 1분기 역시 매출이 회복세를 이어가고 있다""고 밝혔다. 이어 ""지난해 네오바이오텍과의 파트너십 강화로 올해 국내는 물론 중국 등 해외시장에서의 매출 확대가 예상된다""며 ""사업부문별로 경쟁체제 도입을 통해 적자사업부의 구조조정 등 수익성 개선에도 총력을 기울일 것""이라고 덧붙였다. textlinktopstart textlinktopend textlinkstart"
머니투데이,049180,/news/news_read.nhn?article_id=0003730141&office_id=008&mode=search&query=셀루메드&page=1,2016-08-22 13:31,"셀루메드, 마이크로핏 헬스케어 웨어러블 시장진출","[머니투데이 반준환 기자] 의료기기 업체들의 웨어러블 헬스케어 기기 분야의 진출이 두드러지고 있다. 건강과 웰빙 생활에 대한 관심이 점점 높아지면서 피트니스, 헬스케어 관련 분야의 웨어러블 디바이스 수요가 높아지고 있다. 산업연구원에 따르면 웨어러블 헬스케어 기기 시장은 2013년 5억 달러(약 5500억원)에서 2017년 55억 달러(약 6조원)으로 약 10배 이상 성장할 전망이다. EMS트레이닝은 유럽 , 미국에서 가장 주목받고 있는 트레이닝 방법으로, 가장 효율적으로 근육자극, 활성화가 가능한 트레이닝 방법이다. 마이크로핏은 속근육 생성 및 다이어트, 재활치료까지 건강관리를 통합으로 할 수 있는 멀티장비이다. 의료기술과 IT제품이 융합되어 창업의 새로운 시장가능성을 보인다. 셀루메드가 출시한 마이크로핏(micro fit) 운동기구는 20분 운동하면 6시간 운동효과를 지향하는 제품으로 시중에 이미 알려져 있고, 가격도 외국산에 비해 저렴하고 기능도 뛰어나다. 고정형의 경우 3300만원대이며, 한 기계에 남녀 2인 동시 운동가능하다. 이동형은 10~11월경 출시될 예정이다. 마이크로핏은 기계 하나로 적합한 매장에서 소자본 창업이 가능한 품목이다. 기존에는 하나의 아이템에 한가지형태의 사업만 가능하였던 헬스장이나 피트니스센터의 한계를 벗어나 대형커피숍, 대형피부과 등 기존의 다양한 산업분야로의 사업과 결합하여 창업이 가능하며, 기존 사업(대형커피숍, 대형피부과 등)의 매출 및 인구유입을 증가시켜서 기존업체와 소장본창업자간의 시너지 효과를 발휘할 수 있다는 장점이 있다. EMS 운동기구는 국내에 제대로 소개된 지 1~2년 정도 밖에 되지 않았는데 벌써 국내 1000개가 넘는 EMS전문샵 및 병행샵들이 생겨날 정도로 성장세는 가히 폭발적이다. 셀루메드는 별도의 마케팅비를 들이지 않고도 쉽게 시장진입이 가능하고, 국내 대리점 계약을 앞두고 있다. 심영복 셀루메드 대표는 “소상공인의 소자본 창업을 활성화하여 국내시장을 석권함과 동시에 중국 복단대를 통해 중국시장에 진출해 국내의료기기 기술의 해외진출 우수 성공사례를 보여주겠다”고 말했다. textlinktopstart textlinktopend textlinkstart"
파이낸셜뉴스,049180,/news/news_read.nhn?article_id=0003611947&office_id=014&mode=search&query=셀루메드&page=1,2016-03-04 08:45,"셀루메드, 엠젠플러스와 이종 조직 개발에 박차","셀루메드가 이종이식 연구에 나선다. 셀루메드는 4일 형질전환 및 이종이식 연구 선두기업인 엠젠플러스와 이종 조직 개발에 대한 공동 연구를 수행하기로 합의하고 계약을 지난 3일 체결했다고 밝혔다. 셀루메드는 엠젠플러스로부터 면역 결핍 돼지의 반월상 연골조직을 공급받아 개발 중인 연골재생촉진 의료용 단백질(TGF-β) 개발에 적극 활용해 조직 재생이 빨리 될 수 있는 조직공학적 임플란트 개발을 추진한다. 셀루메드 장주웅 연구소장은 “무릎 관절의 충격 흡수와 윤활작용으로 하는 반월상연골은 운동 중 손상되는 경우가 가장 많고, 최근 고령화 등에 따라 대체 치료제 개발이 중요해지고 있다”며, “엠젠플러스 연구팀과 돼지의 연골조직을 활용해 효능이 우수한 새로운 이종 무릎연골 의료소재의 치료제 개발에도 활용될 수 있을 것으로 기대된다.”고 설명했다. 지난 2010년부터 산업통상자원부가 주관하는 WPM 소재사업의 연구과제를 수행하고 있는 셀루메드는 100억 이상의 연구비를 지원받아 의료용 단백질을 개발해 왔고, 차세대 골이식재인 'CHO cell-rhBMP2'인 동물세포 유래의 골형성 단백질을 세계 2번째로 개발해 그 우수성을 입증한 바 있다. 한편, 지난 29일 실적 발표한 셀루메드는 2015년 연결기준 매출 187억, 영업손실 46억으로 메르스 여파로 인해 전년 대비 매출이 소폭 감소했으나 구조조정 등에 따른 원가절감과 지급수수료 등의 판관비 감소로 전년대비 영업손실이 60억 가량 축소됐다. 셀루메드 관계자는 ”올해 1·4분기부터 매출 회복세를 이어 갈 것으로 보인다“며, “지난해 네오바이오텍과의 파트너십 강화 등으로 인해 올해 국내시장 및 중국 등 해외시장의 매출 확대가 예상되고, 사업부문별로 경쟁체제를 도입해 적자사업부의 구조조정으로 수익성 개선에 총력을 기울일 것“이라고 강조했다."
한국경제,049180,/news/news_read.nhn?article_id=0003717307&office_id=015&mode=search&query=셀루메드&page=1,2017-01-20 13:58,"셀루메드, 오투오시스템과 '마이크로 핏 EMS' 판매 협약","[ 한민수 기자  ] 셀루메드는 오투오시스템과 강남구 신사동에 위치한 '마이크로 핏 EMS' 압구정로데오점에서 업무 협약식과 직영점 개점식을 진행했다고 20일 밝혔다. 이번 협약을 통해 셀루메드는 오투오시스템에 마이크로 핏 EMS의 영업 지위를 제공한다. 또 제품 홍보·마케팅 공동 진행, 가종 기획 및 프로젝트 공동 참여, EMS 헬스케어 산업 저변확대 등을 함께 전개하기로 했다. 마이크로 핏 EMS는 셀루메드가 2015년 출시한 저주파 근자극 운동기구다. 근육 전신에 저주파(1~3Khz) 자극을 줘 짧은 시간에 운동 효과를 극대화할 수 있도록 했다. 기존 제품과 달리 1대의 기기로 유무선 동시 사용이 가능하고, 트랜스 방식 EMS를 채택해 다른 제품에 비해 2배 이상의 저주파 효과를 볼 수 있다는 설명이다. 심영복 셀루메드 대표는 ""EMS 트레이닝은 유럽과 미국에서 주목받고 있는 운동 방법""이라며 ""이번 협약을 통해 제품 인지도 상승을 위한 다각적인 노력과 그에 따른 매출을 달성하겠다""고 말했다."
머니투데이,049180,/news/news_read.nhn?article_id=0003824125&office_id=008&mode=search&query=셀루메드&page=1,2017-02-17 13:46,"셀루메드, 하이드로겔 제조관련 특허 취득",[머니투데이 김지민 기자] 셀루메드가 퇴행성 추간판 질환 치료를 위한 하이드로겔의 제조방법에 대한 특허를 취득했다고 17일 공시했다. textlinktopstart textlinktopend textlinkstart
이데일리,049180,/news/news_read.nhn?article_id=0003360062&office_id=018&mode=search&query=셀루메드&page=1,2015-10-02 17:19,"셀루메드, 10억 규모 유상증자 결정","[이데일리 박기주 기자] 셀루메드(049180)는 운영자금 조달을 위해 9억9999만원 규모의 유상증자를 결정했다고 2일 공시했다. 청약예정일은 10월6일 하루이며, 신주 상장 예정일은 10월23일이다."
