source,symbol,link,date,title,content
아이뉴스24,053110,/news/news_read.nhn?article_id=0000395635&office_id=031&mode=search&query=소리바다&page=1,2016-12-08 15:24,"소리바다, 美 업체와 유기농 온라인쇼핑몰 진출","[김다운기자] 소리바다는 지난 7일 소리바다 사옥에서 신사업 진출을 위해 옴니채널사업그룹을 신설하고 미국 추오트레이딩CORP.과 함께 유기농 온라인 쇼핑몰 '올가농'의 원활한 제품 공급 시스템 구축 및 최적의 서비스 제공을 위한 업무 협약식(MOU)을 체결했다고 8일 발표했다. 유기농 온라인 쇼핑몰 올가농은 미국 식품의약국(FDA)으로부터 유기농 인증(USDA)을 받은 식품과 생활 용품만을 판매하는 유기농 전문 온라인 쇼핑몰이다. 고객들의 유기농 라이프 스타일에 최적화된 제품을 제공하며, 해외 직구 서비스를 통해 국내 고객들에게도 뉴욕의 최신 오가닉 트렌드와 라이프 스타일을 소개한다는 계획이다. 조나단 김 추오트레이딩 대표는 ""올가농을 통해 이렇게 한국 시장에 진출할 수 있게 되어 기쁘다""며 ""양질의 제품을 통해 한국 시장에 트렌디한 뉴욕의 유기농 라이프 스타일을 소개하겠다""고 전했다. 업무 협약식을 체결한 소리바다 관계자는 ""올가농을 통해 새로운 사업에 도전하는 것이며 소리바다의 새로운 성장 동력이 될 것""이라며 ""최선의 노력과 최대의 지원을 통해 신사업 개척에 활로를 찾겠다""고 말했다. /김다운기자"
머니투데이,053110,/news/news_read.nhn?article_id=0003937923&office_id=008&mode=search&query=소리바다&page=1,2017-09-20 11:34,관리종목 벗어난 소리바다 &quot;체질개선으로 신뢰회복&quot;,"[머니투데이 김건우 기자] [상반기 매출액 전년대비 47.9% 증가해...음원 사업 확대+자동차 시트 안정적 실적 ] 온라인 음원 포털 소리바다가 관리종목을 탈피하고 투자자 신뢰 회복에 나선다. 20일 한국거래소에 따르면 소리바다는 불성실공시로 인한 관리종목 지정 사유가 해소돼 관리종목에서 해제됐다. 소리바다는 2016년 2월부터 전 최대주주인 양션정환 대표가 경영권을 매각하면서 진통을 겪었다. 이 과정에서 최대주주 변경을 수반하는 주식담보제공 계약체결 지연 공시로 벌점을 받았고 누적 벌점 21.5점으로 관리종목에 지정됐다. 1년 누적 벌점이 15점을 넘기면 관리종목에 지정된다. 소리바다는 지난해 9월 손지현·김재학 공동 대표이사 체제를 구축했고, 최대주주도 3자 배정 유상증자로 제이메이슨으로 변경됐다. 증권업계는 이번 관리종목 탈피가 소리바다 재도약의 신호탄이라고 분석한다. 소리바다는 반기 연결기준 누적 매출이 전년대비 47.9% 증가한 277억원을 기록했다. 구체적으로 음원 콘텐츠 매출은 전년과 비슷한 122억원을 올렸고, 유통사업부(55억원)와 제조판매사업부(57억원) 매출이 새롭게 발생했다. 이는 자동차 시트를 제조하는 케이시트 등의 실적이 새롭게 인식된 영향이다. 케이시트는 지난 8월 현대·기아자동차의 시트 공급사 두올과 4~5년간 53만대를 기준으로 약 1130억원 규모의 공급계약을 체결하는 등 안정적인 실적 기반을 마련했다. 주요 고객사 비중도 2016년 반기에는 단일 고객사 비중이 30.7% 수준이었지만, 올해는 주요 고객사 2곳의 비중이 각각 28.8%, 16.1%다. 매출처 다변화에 성공했다는 의미다. 소리바다는 기존 주요사업인 음원 서비스 관련 브랜드 인지도 확대에 주력하고 있다. 오는 20일 제1회 소리바다 베스트 케이뮤직 어워즈를 개최한다. 이는 소리바다가 주최하는 첫 번째 시상식이다. 소리바다 관계자는 ""지난해부터 사업확장보다는 선택과 집중으로 내실을 다졌고, 이번에 관리종목에서 벗어나 투자자들과 약속을 지키게 돼 기쁘다""며 ""안정적인 경영성과 달성과 사업 경쟁력을 강화에 주력할 것”이라고 말했다."
이데일리,053110,/news/news_read.nhn?article_id=0003777110&office_id=018&mode=search&query=소리바다&page=1,2017-03-20 20:06,"소리바다, 3년만에 흑자 전환","[이데일리 김현아 기자] 온라인 음원 포털 소리바다(053110)가  3년만에 흑자 전환에 성공했다. 20일 감사보고서 내용에 따르면 소리바다는 지난해 개별 기준 연간 매출이 277억 원으로 전년보다 약54.7% 증가하였으며, 영업이익은 4.4억 원을 기록하며 흑자 전환에 성공했다. 지난해 연결기준 매출도 전년보다 약 37.4%늘어난 393억 원을 기록하며 재도약의 계기를 마련했다. 소리바다 관계자는 “2013년 이후 3년 연속 개별 기준으로 적자를 기록했으나 작년에 흑자 전환에 성공하면서 관리종목 지정 우려에 대한 이슈를 종식시켰다” 며 “수익성 높은 분야로 사업을 다각화하여 수익의 안정성과 신규 매출원을 확보하겠다”고 밝혔다. 한국거래소의 현행 코스닥시장 상장규정 및 시행세칙에 따르면 최근 4사업연도에 각각 영업손실이 있는 경우 감사보고서에 의해 확인된 날의 익일부터 관리종목에 지정된다. 소리바다는 지난 최대주주변경 등 불성실공시지정으로 관리종목으로 지정, 지정사유가 추가될 경우 그 해제시기는 차기 감사보고서로서 소명될 불확실성이 존재했다. 소리바다 관계자는 “20일 감사보고서를 제출하고 최근 우려되었던 4사업연도 연속 영업손실 발생 관련 관리종목 지정 우려에서 완전히 해소됐다. 9월 하순 관리종목에서 탈피할 것으로 예상된다”고 기대했다."
연합뉴스,053110,/news/news_read.nhn?article_id=0008347428&office_id=001&mode=search&query=소리바다&page=1,2016-04-20 17:30,"소리바다, 새 대표이사에 박성미 씨 선임",(서울=연합뉴스) 유현민 기자 = 소리바다는 리 제이슨 우 대표이사의 사임에 따라 박성미(48) 씨가 새 대표이사로 선임됐다고 20일 공시했다. 이에 따라 리 제이슨 우·손지현 공동 대표이사 체제에서 손지현·박성미 공동 대표이사 체제로 바뀌었다.
뉴시스,053110,/news/news_read.nhn?article_id=0007054515&office_id=003&mode=search&query=소리바다&page=1,2016-02-22 17:41,"소리바다, 90억 규모 유상증자 결정","【서울=뉴시스】소리바다는 운영자금 50억원과 기타자금 40억원 등 총 90억원을 마련하기 위해 200만6689주 유상증자를 결정했다고 22일 공시했다. 증자방식은 제3자배정증자로 배정대상자는 ‘ISPC Limited’이다. 신주발행가액은 4485원이며 신주 상장예정일은 내달 22일이다. ★ 세상에 이런일이 -  교도소 하수구에서 토막시신 100여구 발견 ★ 오늘의 핫 포토 -  몸짱 치어리더 배수현, 아찔한 비키니 몸매"
아시아경제,053110,/news/news_read.nhn?article_id=0003673375&office_id=277&mode=search&query=소리바다&page=1,2016-01-25 12:10,"소리바다, 최대주주 지분매각&middot;3자배정 증자 협의중",[아시아경제 김원규 기자] 소리바다는 25일 최대주주 지분 매각과 제3자 배정 유상증자에 대한 협의를 진행 중이라고 공시했다. 소리바다는 지난 22일 한국거래소의 최대주주 지분매각 추진설과 제3자 배정 유상증자 추진설의 사실 여부와 구체적인 내용에 대한 조회공시 요구에 이같이 밝히고 현재까지 확정된 사항은 없다고 답했다. 소리바다는 또 구체적인 내용이 확정되는 시점이나 1개월 내에 재공시하겠다고 덧붙였다.
이데일리,053110,/news/news_read.nhn?article_id=0003450921&office_id=018&mode=search&query=소리바다&page=1,2016-01-14 10:48,"소리바다, 화장품 사업 진출&hellip; 랩코리아와 한&middot;중 판매","- 자회사 윌엔터, 윌앤코스 설립… ‘스킨드셀럽’ 론칭 윌앤코스의 스킨드셀럽 제품.(사진=소리바다 제공) [이데일리 이명철 기자] 온라인 음원 포털업체인 소리바다(053110)가 자회사를 통해 화장품 사업에 뛰어든다. SPA 브랜드인 랩코리아(LAP KOREA)와 제휴를 통해 한국과 중국에서 동시 제품 판매에 나선다. 소리바다는 자회사 윌엔터테인먼트가 화장품 기업 윌앤코스(WILL&COS)를 설립하고 화장품 브랜드 ‘스킨드셀럽(Skin deCeleb)’을 론칭했다고 14일 밝혔다. 유명 배우들이 소속된 엔터테인먼트 업체 윌엔터테인먼트는 소리바다의 대표 자회사다. 최근 드라마 등 콘텐츠 제작에 진출한데 이어 화장품 사업에도 나선 것이다. 소리바다는 윌엔터테인먼트의 지분 75%를 보유하고 있다. 새로 설립된 윌앤코스에 대한 윌엔터테인머트 보유 지분율은 65%다. 지난해 외부 투자를 유치해 지분율이 다소 낮아졌다는 게 회사 설명이다. 스킨드셀럽은 랩코리아와 유통망 제휴를 맺고 전국 신세계·롯데·현대백화점 등 60여개 매장에 제품을 공개할 예정이다. 해외에서는 랩코리아가 계약을 확정한 판매처에 기초화장품 분야를 담당하게 된다. 랩코리아에 따르면 중국 충칭 보세구역 입점과 중국 파트너사 2000개 이상 매장을 통해 제품을 판매하는 계약이 완료됐다. 향후 양사는 중국·대만·일본·베트남 등 아시아 지역과 미국·유럽까지 5000개 이상 매장에 진출하겠다는 방침을 세웠다. 랩코리아는 패션기업 아이올리의 대표 브랜드다. 멀티 SPA형 셀렉샵으로 전국 백화점에 입점했다. 손지현 윌앤코스 대표는 “화장품 사업 진출을 위해 기획에만 1년 이상의 장시간을 투자하면서 심사숙고해 철저히 준비했다”며 “향후 콜라보레이션 제품 출시와 스타마케팅 등의 활동을 펼칠 예정“이라고 전했다. 스킨드셀럽의 ‘화이트 플라워’ 마스크팩과 크림은 내달 2일부터 랩코리아의 코스메틱 브랜드인 랩코스 백화점 매장 등에 출시될 예정이다. 브랜드 온라인 쇼핑몰(www.skindeceleb.com)은 이달 22일 오픈한다."
MBN,053110,/news/news_read.nhn?article_id=0000902883&office_id=057&mode=search&query=소리바다&page=1,2016-02-03 11:45,"소리바다, 中 국영 투자회사 ISPC에 매각&hellip;&lsquo;한류 콘텐츠 활용한 중국 사업 나선...","소리바다, 中 국영 투자회사 ISPC에 매각…‘한류 콘텐츠 활용한 중국 사업 나선다’ 온라인 음악 서비스 소리바다가 중국 상하이투자청이 운영하는 국영 투자 회사인 ISPC에 매각됐다. 매각 후 소리바다는 한류 콘텐츠를 앞세워 중국 사업을 시작할 것으로 보인다. 양정환 소리바다 대표와 양일환 전무는 보유한 회사 주식 200만주를 3월말까지 단계별로 ISPC에 100억원에 매각하기로 했다. 소리바다 형제인 두 사람은 매각과 함께 회사를 떠나게 된다. 소리바다는 3월말 정기 총회에서 신임 경영진을 인선하고 한류 콘텐츠를 활용한 중국 사업에 나설 계획이다. 2000년 P2P 음악 공유 사이트로 시작한 소리바다는 인터넷 보급 확산 속에 사용자들로부터 폭발적인 반응을 불러일으켰다. 그러나 이후 저작권 침해 논란에 휩싸였고 2002년 7월 P2P 기반 소리바다 서비스는 문을 닫았다. 이후 소리바다는 유료화 기반 온라인 음악 서비스로 옷을 갈아 입었다. 국내 온라인 음악 서비스 시장에서 소리바다는 멜론, KT 지니, 벅스, 엠넷에 이어 5위권으로 평가되고 있다. 온라인 음악 서비스 외에 이보영 씨 등이 소속돼 있는 엔터테인먼트 기획사인 윌엔터테인먼트를 자회사로 두고 있다. 소리바다"
전자신문,053110,/news/news_read.nhn?article_id=0002668963&office_id=030&mode=search&query=소리바다&page=1,2017-12-21 16:04,"[ET투자뉴스][소리바다 지분 변동] ㈜제이메이슨3.51%p 증가, 11.93% ...","소리바다(053110)는 21일 최대주주 ㈜제이메이슨의 보유주식이 증가되었다고 발표했다. 이는 직전 보고일보다 2,208,600주 증가하여 지분율은 17.94%로 상승했다. 이번 보고 사유는 ①보고자(본인)의보유주식에관한변경계약②CB인수및유상신주취득으로  알려졌다.   최대주주와 특수관계자의 지분 변동은 주가에 영향을 주는 요인이다. 특히 보유비율을 지속적으로 늘리거나 줄일 경우, 해당종목 투자시 유의할 필요가 있다.  다음은 소리바다의 지분 변동 내역과 보유 내역이다."
디지털타임스,053110,/news/news_read.nhn?article_id=0002390940&office_id=029&mode=search&query=소리바다&page=1,2017-03-07 11:18,"소리바다, `음악과 여행을 동시에&hellip;` 50%할인된 음원 호텔 패키지이벤트 진행","국내 최대 음원 보유 온라인 음악 포털 ㈜소리바다(대표 손지현, 김재학)가 '음원 호텔 패키지' 이벤트를 실시한다고 밝혔다. 소리바다와 제주도 서귀포시에 위치한 비스타케이호텔 천지연이 공동으로 주관하는 음원호텔패키지이벤트는 소리바다를 이용하는 전 고객들을 대상으로 진행되는 이벤트다. 특히 음악과 여행을 동시에 누릴 수 있는 이벤트 패키지를 구성해 일반 사용자 및 여행을 준비하고 있는 소비자들에게 희소식을 전한다. 내용은 음원 이용료와 숙박비용을 약 50% 할인된 파격적인 가격을 제시한다. 소리바다 음원 이용권은 최근 고객들이 가장 많이 이용하는 모바일 무제한다운로드(DRM)와 무제한 스트리밍을 동시에 즐길 수 있는 복합이용권이 제공된다. 비용은 12개월 음원 이용권과 호텔 1박 숙박권 구매 시 9만 원, 호텔 2박 숙박은 12만원, 호텔 3박은 15만원 등 부담 없이 합리적인 가격으로 이벤트를 진행한다. 업체 관계자는 ""소리바다 고객들에게 색다른 이벤트로 음악과 동시에 여행을 즐길 수 있도록 시원한 가격할인이 적용된 패키지 상품을 출시하게 됐다""며 ""향후 더욱 다양한 이벤트와 프로모션을 통해 고객들과 커뮤니케이션 하며 관심에 보답할 수 있는 소리바다가 되도록 만전을 기하겠다""고 전했다. 한편, 오는 4월 30일까지 이벤트가 진행되며 자세한 사항은 모바일 앱과 홈페이지를 통해 확인 가능하다."
스포츠조선,053110,/news/news_read.nhn?article_id=0003206469&office_id=076&mode=search&query=소리바다&page=1,2018-01-24 13:55,"[엔터비즈]소리바다, 전환사채 발행 통해 80억 원 규모의 투자 유치","소리바다는 NH투자증권, 삼성증권, 신한금융투자, 아우름 자산운용 등 투자기관들을 대상으로 80억 원 규모의 전환사채 발행을 통해 투자를 유치했다고 24일 공시했다. 투자는 국내 무기명식 무보증 사모 전환사채를 통해 진행되며, 전환가액 2,077원, 표면이자율과 만기이자율은 각각 0.0%, 6.0%이며 만기일은 2021년 1월 26일이다. 특히 이번 전환사채 발행은 국내 유수의 투자기관들로부터 투자 받은 것으로 향후 소리바다 비즈니스의 성장 가능성과 기업의 잠재적 가치를 높게 평가받은 것으로 보여 눈길을 끌고 있다. 소리바다는 이번 투자금으로 신사업 투자에 대한 운영자금 마련과 재무구조 개선을 도모할 계획이다. 소리바다 관계자는 ""투자자금은 우선 현재 핵심역량으로 개발중인 AI 스피커 연동 서비스의 조속한 완성과 관련 컨텐츠 확보 등에 일부 자금이 사용될 예정이다."" 라며 ""또한 여유 있는 현금 유동성 확보로 향후 신중한 사업 검토를 통한 차세대 신사업 투자로 소리바다의 성장 동력 마련에 더욱 박차를 가할 것이다."" 라고 말했다. 이번 투자에 참여한 아우름 자산운용의 윤상우 대표는 ""소리바다의 사업 안정성 및 신규사업에 대한 잠재력 등을 면밀히 검토하여 투자를 결정하게 되었다."" 며 ""현재 계획대로 사업이 진행될 경우 향후 소리바다의 기업 가치는 충분히 상승할 수 있을 것으로 판단된다.""고 투자 이유를 밝혔다."
머니투데이,053110,/news/news_read.nhn?article_id=0003676581&office_id=008&mode=search&query=소리바다&page=1,2016-05-09 16:15,"[더벨]소리바다, 1분기 영업익 2.3억&hellip;4년만에 흑자전환","[더벨 김세연 기자] [음원가격 상승·구조개선 효과…""음원수출 통한 실적 턴어라운드 기대""] 더벨|이 기사는 05월09일(16:02) 자본시장 미디어 '머니투데이 thebell'에 출고된 기사입니다. 소리바다가 흑자전환에 성공했다. 2012년 적자(연결기준)를 기록한 이후 4년만이다. 소리바다는 지난 1분기 연결기준 영업이익 2억 3000만 원을 기록해 흑자전환했다고 9일 밝혔다. 지난해 4분기 15억 원이던 영업손실은 올해 1분기에만 이익이 17억 원이상 늘어나며 흑자로 돌아섰다. 지난해 1분기와 비교해도 9억 원 가량이 증가했다. 같은 기간 매출은 전년대비 24.1%가 증가한 96억 4100만 원을 기록했다. 지난해 4분기와 비교하면 29억 원(43.7%)가 늘어난 수준이다. 당기순이익은 7억 4300만 원으로 흑자전환했다. 소리바다 관계자는 ""올해 초 적용된 음원 가격 상승을 배경으로 유료서비스 매출이 대폭 증가했다""며 ""구조조정을 통한 재무구조 개선 활동이 가시적 성과로 이어졌다""고 밝혔다. 이어 ""밀크뮤직 또한 투자단계를 지나 본격적인 사용자 증가 및 매출 신장이 이뤄지는 구간에 들어섰다""며 ""올해부터 본격적인 수익구조 개선이 기대된다""고 덧붙였다. 현재 소리바다는 미국과 중국, 일본을 타깃으로 한류 음원 수출 사업을 추진 중이다. 소리바다 관계자는 ""해외 진출 사업의 가시적 성과가 반영되면 상반기는 물론 하반기에도 본격적인 매출을 달성할 것""이라며 ""연간 실적 턴 어라운드를 목표로 음원 해외수출 등 다양한 신사업들을 지속적으로 확대 추진할 것""이라고 말했다. textlinktopstart textlinktopend textlinkstart"
파이낸셜뉴스,053110,/news/news_read.nhn?article_id=0003690530&office_id=014&mode=search&query=소리바다&page=1,2016-08-10 16:38,"[공시] 소리바다, 최대주주 ISPC로 변경",소리바다는 최대주주가 블루인베스트 외 2인에서 ISPC로 변경됐다고 10일 공시했다.
머니투데이,053110,/news/news_read.nhn?article_id=0003724944&office_id=008&mode=search&query=소리바다&page=1,2016-08-10 16:17,"소리바다, 최대주주 ISPC 리미티드로 변경",[머니투데이 이해인 기자] 소리바다는 블루인베스트 외 2인의 주식 매도로 인해 최대주주가 ISPC 리미티드(지분율 5.71%)로 변경됐다고 10일 공시했다. textlinktopstart textlinktopend textlinkstart
아시아경제,053110,/news/news_read.nhn?article_id=0003805524&office_id=277&mode=search&query=소리바다&page=1,2016-08-10 16:09,"소리바다, 최대주주 ISPC로 변경",[아시아경제 박선미 기자]소리바다는 최대주주가 블루인베스트 외 2인에서 ISPC로 변경됐다고 10일 공시했다.
서울경제,053110,/news/news_read.nhn?article_id=0003311122&office_id=011&mode=search&query=소리바다&page=1,2018-05-31 11:01,"&lt;코&gt;소리바다, 현재가 5.18% 급락","[서울경제] 오전 10시 59분 현재 소리바다(053110) 의 현재가는 2,745원으로 1분전 2,895원 대비 5.18% 급락했다. 수급측면으로는 56(매도):44(매수)의 매도우위를 기록하고 있다. 지난 1개월간 소리바다는 4.97% 상승했으며, 표준편차는 6.70%를 기록했다. 이 기간 ' 디지털컨텐츠업 ' 업종 평균 주가수익률은 -0.92% 로 나타났으며, 변동성은 1.09%를 기록했다. 이 시각 현재 ' 디지털컨텐츠업 '은 0.14% 상승 중이다."
서울경제,053110,/news/news_read.nhn?article_id=0003248119&office_id=011&mode=search&query=소리바다&page=1,2018-03-20 09:36,"(코)소리바다, 장중 신고가 돌파.. 2,720&rarr;2,730(▲10)","[서울경제] 오전 9시 34분 현재 소리바다(053110) 가 2.44% 오른 2,730원(▲65)을 기록하며, 52주 신고가를 +10원 경신했다. 기존 52주 최고가는 2018년 03월 19일 기록한 2,720원이다. 체결강도는 161%로 강세를 유지했다. 총매수체결량은 148,717주, 총매도체결량은 92,482주를 각각 기록했다.  (※ 체결강도(%) = (총매수체결량/총매도체결량)*100) 이 시각 현재 거래대금은 6억5,545만, 거래량은 24만5,015주를 기록하고 있으며, 수급측면으로는 38(매도):62(매수)의 매수우위를 보이고 있다. 거래일을 기준으로 최근 3일간 평균 거래량은 2백9십6만4천주, 60일 평균 거래량 1백4십만4천주로 최근 거래량이 큰 폭으로 증가하는 추세다."
파이낸셜뉴스,053110,/news/news_read.nhn?article_id=0003745728&office_id=014&mode=search&query=소리바다&page=1,2016-12-08 17:37,"소리바다, 미 추오트레이딩과 MOU 맺고 신사업 진출","소리바다는 지난 7일 소리바다 사옥에서 신사업 진출을 위해 옴니채널사업그룹을 신설하고 미국 추오트레이딩과 유기농 온라인 쇼핑몰 올가농의 원활한 제품 공급 시스템 구축 업무 협약식(MOU)을 체결했다. 유기농 온라인 쇼핑몰 올가농은 미국FDA의 유기농 인증(USDA)을 받은 식품과 생활 용품만을 판매하는 유기농 전문 온라인 쇼핑몰이다. 올가농은 고객들의 유기농 라이프 스타일에 최적화된 제품을 제공한다. 해외 직구 서비스를 통해 국내 고객들에게도 뉴욕의 최신 오가닉 트렌드와 라이프 스타일을 소개하고자 한다. 미국 추오트레이딩 조나단 김 대표는 ""올가농을 통해 이렇게 한국 시장에 진출할 수 있게 되어 기쁘다"" 라며 ""양질의 제품을 통해 한국 시장에 트렌디한 뉴욕의 유기농 라이프 스타일을 소개하겠다""고 전했다."
부산일보,053110,/news/news_read.nhn?article_id=0000765295&office_id=082&mode=search&query=소리바다&page=1,2017-12-21 11:46,"소리바다 스테어, 중국 진출 급물살...&quot;내년 250개 매장 오픈&quot;","소리바다의 스니커즈 브랜드 '스테어(STARE)'가 내년 중국 전역에 250개 매장을 오픈할 것이라고 밝혔다.   현재 중국 내 550여개 매장을 운영 중인 스카치스포츠(SIKAJIE SPORT) 브랜드 매장 중 베이징, 상하이, 허난성 등 대도시를 중심으로 절반 수준인 250개 매장을 스테어 브랜드 매장으로 탈바꿈한다는 계획이다. 또, 매장 리뉴얼 시 드는 모든 제반 비용을 스카치스포츠사에서 제공키로 해 연내 모든 매장의 오픈을 진행할 수 있을 것으로 보인다.   스카치스포츠사는 중국 내에서 큰 인기를 끌고 있는 스포츠 용품 브랜드로서 스포츠슈즈, 트래킹슈즈를 비롯해 스포츠의류 등을 유통, 판매하고 있다.   소리바다 담당자는 ""스카치스포츠사의 효율적인 협조와 적극적인 투자로 중국 시장 진출에 박차를 가할 수 있었다""며 ""내년 상반기에 중국 내 매장을 오픈해 사업 진행에 더욱 속도를 붙이겠다""는 포부를 밝혔다.   한편, 소리바다는 최근 스카치스포츠사와 스테어의 업무 제휴 협약식을 맺고 중국 진출을 선언한 바 있다.   사진=소리바다 제공  "
