source,symbol,link,date,title,content
머니투데이,053110,/news/news_read.nhn?article_id=0003662919&office_id=008&mode=search&query=소리바다&page=1,2016-04-12 07:59,"소리바다, 리 제이슨 우 대표이사로 변경",[머니투데이 김성은 기자] 소리바다는 대표이사가 기존 손지현씨에서 리 제이슨 우(LEE JASON WO)로 변경됐다고 12일 공시했다. textlinktopstart textlinktopend textlinkstart
전자신문,053110,/news/news_read.nhn?article_id=0002662092&office_id=030&mode=search&query=소리바다&page=1,2017-11-29 08:08,"[ET투자뉴스][소리바다 지분 변동] ㈜제이메이슨-13.57%p 감소, 8.32%...","소리바다(053110)는 28일 최대주주 ㈜제이메이슨의 보유주식이 감소되었다고 발표했다. 이는 직전 보고일보다 6,868,131주 감소하여 지분율은 14.43%로 하락했다. 이번 보고 사유는 보고자(본인)의전환사채권인수계약승계로인한권리이전으로  알려졌다.   최대주주와 특수관계자의 지분 변동은 주가에 영향을 주는 요인이다. 특히 보유비율을 지속적으로 늘리거나 줄일 경우, 해당종목 투자시 유의할 필요가 있다.  다음은 소리바다의 지분 변동 내역과 보유 내역이다."
한국경제TV,053110,/news/news_read.nhn?article_id=0000431622&office_id=215&mode=search&query=소리바다&page=1,2016-02-03 11:58,"소리바다 중국매각, 100억원에 상하이ISPC 주식 경영권 인수","[한국경제TV 정보뉴스팀 기자] 소리바다 중국매각 소리바다 중국매각, 100억원에 상하이ISPC 주식 경영권 인수 국내 5위 음원제공업체 소리바다가 중국 기업 상하이ISPC에 매각된다. 매각 가격은 100억원이다. 소리바다는 2일 공시를 통해 양정환 대표와 형인 양일환 전무가 보유한 주식 200만주와 경영권을 중국 국영투자기관 상하이ISPC 외 1인에게 100억원에 양도한다고 밝혔다. 양 대표는 양 전무와 함께 각각 7.38% 지분을 보유한 공동 최대 주주였다. 이번 계약으로 양 대표 지분이 5.47%로 줄어들면서 최대 주주가 양 전무로 바뀌었다. 소리바다 관계자는 "" 3월30일 개최 예정인 정기 주주총회에서 경영권이 이전될 것""이라고 말했다. 소리바다는 지난 2000년 양 대표가 설립한 국내 1세대 음원서비스 공급 업체로 2006년 상장한 업체다. 상하이ISPC는 2002년 중국 상하이(上海)시 투자청의 전액 출자로 설립된 정부 산하기관이다. 주로 중국 업체의 해외 진출과 해외 업체의 중국 진출을 돕고 있다. 소리바다는 멜론과 KT뮤직, 벅스, 엠넷 등에 음원사이트 경쟁에 밀리며 시장 점유율이 낮아졌으며, 악화된 경영난으로 매각설이 돌았다. 소리바다 중국매각, 100억원에 상하이ISPC 주식 경영권 인수 정보뉴스팀기자"
아시아경제,053110,/news/news_read.nhn?article_id=0003866950&office_id=277&mode=search&query=소리바다&page=1,2016-11-10 08:08,"소리바다, 100억 사모 CB 발행","[아시아경제 박나영 기자]소리바다는 운영자금과 타법인 증권 취득자금을 조달하기 위해 케이엠에이치와 팍스넷을 대상으로 100억원 규모의 전환사채(CB)를 발행키로 했다고 공시했다. 표면이자율은 3%, 만기이자율은 5%이다. 사채 만기일은 2019년 11월22일까지이며 전환가액은 1571원이다."
머니투데이,053110,/news/news_read.nhn?article_id=0003998901&office_id=008&mode=search&query=소리바다&page=1,2018-01-26 14:37,"[특징주]소리바다, 삼성과 시너지 본격화? 80억원 투자 유치 '상승'","[머니투데이 김건우 기자] 종합 엔터테인먼트기업 소리바다가 80억원의 기관 투자를 유치해 AI(인공지능) 스피커 사업을 확대한다는 기대감에 상승세다. 26일 오후 2시 32분 현재 소리바다는 전일대비 3.81% 상승한 2180원에 거래 중이다. 소리바다는 80억원 규모의 CB(전환사채) 납입이 완료됐다고 공시했다. 이번 CB는 NH투자증권, 삼성증권, 신한금융투자, 아우름 자산운용 등 투자기관들을 대상으로 발행했다. 이날 상승세는 소리바다가 기관 투자 유치로 재무구조가 개선되고, 개발 중인 AI 스피커 개발이 속도를 낼 것이란 기대감 덕분이다. 업계는 소리바다가 삼성전자의 음원 파트너로 선정된 점에 주목하고 있다. 삼성전자가 AI 음성인식 서비스 빅스비를 탑재한 AI 스피커를 출시를 예정하면서 음원서비스를 강화할 가능성이 높아서다."
이데일리,053110,/news/news_read.nhn?article_id=0003777340&office_id=018&mode=search&query=소리바다&page=1,2017-03-21 09:08,"[특징주]소리바다, 관리종목 지정 우려 해소&hellip;급등",[이데일리 이명철 기자] 온라인 음원포털업체인 소리바다(053110)가 3년만에 흑자 전환해 관리종목 지정 우려에서 탈피했다는 소식에 급등세다. 21일 오전 9시7분 현재 소리바다 주가는 전일대비 19.03% 오른 1720원을 기록 중이다. 경영 개선에 대한 기대감이 매수세로 유입되는 양상이다. 회사는 지난 20일 감사보고서를 제출하고 4사업연도 연속 영업손실 발생 관련 관리종목 지정 우려에서 해소됐다고 밝혔다. 앞서 잠정 영업실적 발표를 통해 내부결산시점 3사업연연도 연속적자에서 흑자전환을 발표한 바 있다. 감사보고서 내용에 따르면 지난해 개별 기준 연간 매출액 277억원으로 전년대비 약 54.7% 증가했고 영업이익 4억4000만원으로 흑자 전환에 성공했다. 연결 기준 매출액은 약 37.4% 늘어난 393억원을 기록했다. 회사 관계자는 “2013년 이후 3년 연속 개별 기준으로 적자를 기록했지만 작년에 흑자 전환에 성공해 관리종목 지정 우려에 대한 이슈를 종식했다”며 “올해 수익성 높은 분야로 사업을 다각화해 수익 안정성과 신규 매출원을 확보할 예정”이라고 전했다.
한국경제,053110,/news/news_read.nhn?article_id=0003689104&office_id=015&mode=search&query=소리바다&page=1,2016-11-23 00:50,[코스닥 기업공시] (22일) 소리바다 등,▲소리바다=100억원 규모 사모 전환사채 발행 결정. ▲아이이=자회사 스마트포스팅 흡수합병 결정. ▲파라다이스=1000억원어치 회사채 발행 계획 철회. [
머니투데이,053110,/news/news_read.nhn?article_id=0003634704&office_id=008&mode=search&query=소리바다&page=1,2016-02-22 17:24,"소리바다, ISPC 대상 90억 규모 유증 결정",[머니투데이 서진욱 기자] 소리바다는 90억원 규모의 보통주 200만주 유상증자를 결정했다고 22일 공시했다. 배정 대상은 'ISPC Limited'다. ISPC는 경영권 양수도와 유상증자 이후 소리바다의 최대주주로 올라설 예정이다. 해당 지분은 전량 1년간 보호예수된다. textlinktopstart textlinktopend textlinkstart
머니투데이,053110,/news/news_read.nhn?article_id=0003978281&office_id=008&mode=search&query=소리바다&page=1,2017-12-13 13:40,"소리바다, 제이메이슨 상대 유증으로 30억원 조달","[머니투데이 신희은 기자] 소리바다 는 30억원 규모의 운영자금 조달을 위해 보통주 171만3306주를 신규 발행하는 3자배정 유상증자를 결정했다고 13일 공시했다. 1주당 액면가액은 500원이며 발행가액은 1751원, 할인율은 10%다. 배정대상자는 최대주주 제이메이슨이며 신주 상장예정일은 오는 28일이다."
머니투데이,053110,/news/news_read.nhn?article_id=0003909156&office_id=008&mode=search&query=소리바다&page=1,2017-07-25 11:41,"소리바다, '제1회 베스트 케이뮤직 어워즈' 티저영상 공개","[머니투데이 이원광 기자] '2017 제 1회 소리바다 베스트 케이뮤직 어워즈'(2017 SOBA·2017 1st SORIBADA BEST K-MUSIC AWARDS)의 티저 영상이 공개됐다. / 사진제공=소리바다 음원 플랫폼 전문기업 소리바다는 '2017 제1회 소리바다 베스트 케이뮤직 어워즈'(2017 SOBA·2017 1st SORIBADA BEST K-MUSIC AWARDS)의 티저 영상을 공개했다고 25일 밝혔다. 이날 사이트와 SNS를 통해 공개된 티저 영상에는 '2017 SOBA'에 참여하는 아티스트들의 모습과 행사 슬로건인 'IMAGINE YOUR MUSIC'이 강조됐다. 'IMAGINE YOUR MUSIC'은 전 세계인이 공감하고 즐기는 특별한 시간을 선물하겠다는 의미로, 그동안 볼 수 없었던 역동적이고 화려한 축제의 장을 열겠다는 의지를 담았다. 소리바다는 '2017 SOBA 10'과 '신한류 인기상' 선정을 위한 온라인 투표를 진행하고 있다. 후보군인 'TOP50'은 지난해 9월부터 발매된 음반 및 음원을 기준으로, 소리바다 음원 재생, 다운로드, 차트 등에서 활약을 펼친 아티스트들로 선정됐다. 이들 중 팬들의 가장 많은 지지를 받은 10팀에게 '2017 SOBA 10'을, 글로벌 한류 확산에 기여한 아티스트에게는 '신한류 인기상'을 수여한다. 소리바다 관계자는 ""이번 온라인 투표 결과와 함께 소리바다 자체 데이터와 전문위원단의 심사, 주최 측 사무국 위원단 심사 등을 토대로 공정한 시상을 진행할 계획""이라고 말했다. 한편, '2017 SOBA'는 오는 9월 20일 오후 6시 30분 서울 송파구 잠실학생체육관에서 개최된다. 전 세계 'K-POP' 팬들의 진정한 축제로 발돋움하기 위해 영어와 중국어 등 7개국 언어로 번역돼 SNS를 통해 160여개 국가에 실시간 전송될 예정이다. textlinktopstart textlinktopend textlinkstart"
매일경제,053110,/news/news_read.nhn?article_id=0003713104&office_id=009&mode=search&query=소리바다&page=1,2016-04-12 08:18,"소리바다, 대표이사에 리제이슨우 씨 선임","소리바다는 12일 공시를 통해 대표이사가 종전 손지현 씨에서 리제이슨우(LEE JASON WU) 씨로 변경됐다고 밝혔다. [디지털뉴스국 이상규 기자] r_start // r_end // [ⓒ 매일경제 & mk.co.kr, 무단전재 및 재배포 금지] 매일경제 관련뉴스해당 언론사에서 선정하며 언론사 페이지(아웃링크)로 이동해 볼 수 있습니다.'역시 송중기' ""朴 대통령 눈에서 꿀 뚝뚝 떨어지네~""[단독] '제2 유승준'에 상속·증여세 중과GSW, 최다승 타이기록 달성...인디애나는 PO 확정당신은 혹시 진상 관객? 민폐 피하는 '에티켓 5'해외식당 경험 탈북女 증언…""감시속 하루 18시간을"""
매일경제,053110,/news/news_read.nhn?article_id=0004144799&office_id=009&mode=search&query=소리바다&page=1,2018-05-03 17:42,[코스닥 공시] 나노스 / 소리바다 / 스포츠서울 등,"◇나노스=양선길 대표이사 신규 선임. ◇소리바다=김재학 공동대표 사임. ◇스포츠서울=자회사 아스팩투자조합, 리드 지분 231억원 처분. ◇엘아이에스=중국 업체에 236억원 규모 장비 공급. r_start // r_end //"
아시아경제,053110,/news/news_read.nhn?article_id=0003956920&office_id=277&mode=search&query=소리바다&page=1,2017-03-20 16:29,"소리바다, 3년만에 흑자전환&hellip;관리종목 지정우려 탈피","지난해 영업이익 4억4000만원, 흑자전환 …오는 9월 관리종목 탈피 예상안정적 수익구조 마련 ·신규 사업 진행 예정 [아시아경제 박미주 기자]온라인 음원 포털 소리바다가 3년 만에 흑자전환을 기록하며 관리종목 지정 우려에서 탈피했다고 20일 밝혔다. 소리바다가 제출한 지난해 감사보고서에 따르면 지난해 개별 기준 연간 매출이 277억원으로 전년보다 54.7% 증가했다. 영업이익은 4억4000만원으로 흑자 전환했다. 또한 지난해 연결 기준 매출도 전년보다 37.4% 늘어난 393억원을 기록했다. 한국거래소의 현행 코스닥시장 상장규정 및 시행세칙에 따르면 최근 4사업연도에 각각 영업손실이 있는 경우 감사보고서에 의해 확인된 날의 익일부터 관리종목에 지정된다. 소리바다는 지난 최대주주 변경 등 불성실공시지정으로 관리종목으로 지정됐고 지정사유가 추가될 경우 그 해제 시기는 차기 감사보고서로서 소명될 불확실성이 존재했다. 소리바다 관계자는 “감사보고서를 제출하고 최근 우려됐던 4사업연도 연속 영업손실 발생 관련 관리종목 지정 우려에서 완전히 해소됐다”며 “오는 9월 하순 관리종목에서 탈피할 것으로 예상된다”고 전했다. 소리바다 관계자는 ""2013년 이후 3년 연속 개별 기준으로 적자를 기록했으나 작년에 흑자 전환에 성공하면서 관리종목 지정 우려에 대한 이슈를 종식시켰다""며 ""올해 수익성 높은 분야로 사업을 다각화해 수익의 안정성과 신규 매출원을 확보하는 등 적극적인 움직임을 보일 예정""이라고 말했다."
머니투데이,053110,/news/news_read.nhn?article_id=0003777656&office_id=008&mode=search&query=소리바다&page=1,2016-11-22 15:34,"'원조 음원플랫폼' 소리바다, 3Q 흑자전환&hellip;&quot;15만 열성고객의 힘&quot;","[머니투데이 이원광 기자] [자금력 앞세운 음원 선점 전략 속 음원서비스에 집중…3Q 영업익 흑자전환·매출액 43.98%↑] '원조 음원플랫폼' 소리바다의 메인 홈페이지 / 사진=소리바다 제공 '원조 음원플랫폼' 소리바다가 15만 열성 고객과 함께 과열 경쟁의 음원 유통 시장에서 성장을 이어가고 있다. 22일 관련업계에 따르면 소리바다의 3분기 매출액은 개별기준 63억3800만원으로 전년동기(44억200만원) 대비 43.98% 증가했다. 같은 기간 영업이익도 1억2300만원을 기록해 전년 동기와 비교해 흑자전환에 성공했다. 소리바다의 이같은 실적은 대형 기업들의 음원 선점 전략 속에서 음원 서비스만으로 이뤄낸 성과라는 점에서 주목된다. 최근 대형 음원플랫폼 기업들은 자금력을 바탕으로 일부 아티스트에 투자해 선제적 계약을 맺고 음원 유통을 독점하는 전략을 취하고 있다. 이에  중소 기업들의 수익 창출은 물론, 시장 진입 자체가 불가능하다는 지적이 이어졌다. 다수의 대형 음원플랫폼 기업들이 실적보다 음원 확보 등에 집중한 결과 부진한 실적을 기록했다. NHN엔터(40.7%)가 최대주주인 벅스의 경우, 개별기준 3분기 영업손실 28억300만원을 기록했고, KT가 최대주주(49.99%)인 KT뮤직은 영업이익 11억6200만원을 기록하며, 전년 동기(13억7000만원) 대비 부진했다. 소리바다의 저력은 15만 열성고객에 있다는 분석이다. 주로 30~50대 구성된 이들은 소리바다가 첫 음원 서비스를 시작한 2005년 이후 타사의 다양한 이벤트 전략에도 이탈하지 않는 열성고객이 됐다. 업계 관계자는 ""10~20대 소비자들은 각사가 벌이는 무료 이벤트에 따라 각 플랫폼을 순환적으로 가입하는 경향을 보인다""며 ""소리바다는 원조 플랫폼에 대한 향수를 가진 고객층을 중심으로 꾸준한 매출을 기록하고 있다""고 말했다. 소리바다의 열성 고객에 음원 시장의 주요 고객인 10~20대가 더해져 회사의 안정적 매출을 견인하고 있다는 평이다. 소리바다는 지난 9월 시장의 음원 가격 인상 경향에도 최대 87% 할인된 가격으로 이용권을 구입하는 '가격 할인 이벤트'와 영화나 뮤지컬 티켓을 추첨을 통해 제공하는 '문화생활 이벤트'를 진행해 10~20대의 접근성을 높였다. 이에 지난 9월 전월과 비교해 229% 매출액 상승을 이뤄냈다. 소리바다는 향후 대형 음원 유통사들의 출혈 경쟁에 참전하기보다 음원 서비스 질을 높이는 원칙으로 생존한다는 전략이다. 소리바다 관계자는 ""음원 소비자들이 편리하게 음원 정보를 검색하고 이용하는 모바일 플랫폼 소리바다 3.7버전을 다음달 중순 출시 예정""이라며 ""전면 개편이 더해진 4.0을 이르면 내년 상반기 출시할 계획""이라고 말했다. textlinktopstart textlinktopend textlinkstart"
한국경제,053110,/news/news_read.nhn?article_id=0003643385&office_id=015&mode=search&query=소리바다&page=1,2016-08-22 14:02,"[특징주]소리바다, '밀크뮤직' 美 서비스 종료 소식에 '급락'",[ 조아라 기자  ] 소리바다가 급락 중이다. 삼성전자가 미국에서 음원 스트리밍 서비스인 '밀크뮤직'을 종료한다는 소식 때문으로 풀이된다. 22일 오후 1시49분 현재 소리바다는 전거래일 대비 325원(10.74%) 내린 2700원에 거래되고 있다. 이날 삼성전자는 미국에서 '밀크 뮤직'을 중단한다고 밝혔다. 종료일은 다음달 22일이다. 밀크 뮤직은 2014년 삼성전자가 소리바다와 손을 잡고 갤럭시 기기 사용자들을 위해 출시한 스트리밍 라디오 서비스다. 삼성전자가 소리바다에 음원 사용료를 지불하고 소리바다는 보유한 곡을 제공하는 시스템이다. 삼성전자는 밀크 이용자가 '슬래커'(Slacker)'로 옮겨가도록 유도할 방침인 것으로 전해졌다. 미국 음악 서비스인 슬래커는 삼성전자 미주법인의 파트너다. 한편 한국 중국 말레이시아 등 아시아 지역의 '밀크 뮤직' 서비스는 아직 유지하고 있다. 조아라 한경닷컴 기자
머니투데이,053110,/news/news_read.nhn?article_id=0003665478&office_id=008&mode=search&query=소리바다&page=1,2016-04-15 17:28,"소리바다, '리 제이슨 우, 손지현' 공동 대표이사 선임","[머니투데이 이원광 기자] 소리바다가 대표이사 자리에 기존 리 제이슨 우(LEE JASON WU)에서 손지현씨가 추가로 선임됐다고 15일 공시했다. 회사 측은 ""신규사업 강화와 효율성 제고를 위한 공동대표 이사를 선임했다""고 밝혔다. textlinktopstart textlinktopend textlinkstart"
연합뉴스,053110,/news/news_read.nhn?article_id=0008203192&office_id=001&mode=search&query=소리바다&page=1,2016-02-22 17:26,"소리바다, 중국 ISPC 대상 90억원 증자 결정","(서울=연합뉴스) 유현민 기자 = 소리바다는 운영자금과 기타자금을 마련하기 위해 중국의 ISPC사(ISPC Limited.)를 대상으로 90억원 규모의 유상증자를 결정했다고 22일 공시했다. ISPC는 경영권 양수도와 유상증자 후 소리바다의 최대주주가 될 예정이다. 발생 신주는 보통주 200만6천689구이며, 신주 발행가액은 4천485원이다."
파이낸셜뉴스,053110,/news/news_read.nhn?article_id=0003791424&office_id=014&mode=search&query=소리바다&page=1,2017-03-20 17:03,"소리바다, 3년만에 흑자 전환으로 관리종목 지정 우려 탈피","온라인 음원 포털 소리바다가 3년만에 흑자 전환을 기록하며 관리종목 지정 우려에서 탈피했다고 20일 밝혔다. 한국거래소의 현행 코스닥시장 상장규정 및 시행세칙에 따르면 최근 4사업연도에 각각 영업손실이 있는 경우 감사보고서에 의하여 확인된 날의 익일부터 관리종목에 지정된다. 소리바다는 지난 최대주주변경 등 불성실공시지정으로 관리종목으로 지정, 지정사유가 추가될 경우 그 해제시기는 차기 감사보고서로서 소명될 불확실성이 존재했다. 앞서 영업(잠정)실적 발표를 통해 내부결산시점 3사업연연도 연속적자에서 흑자전환을 발표한 소리바다 관계자는 “이날 감사보고서를 제출하고 최근 우려됐던 4사업연도 연속 영업손실 발생 관련 관리종목 지정 우려에서 완전히 해소됐다”며 이어 “오는 9월 하순 관리종목에서 탈피할 것으로 예상된다” 고 말했다. 감사보고서 내용에 따르면 소리바다는 지난해 개별 기준 연간 매출이 277억 원으로 전년보다 약54.7% 증가하였으며, 영업이익은 4.4억 원을 기록하며 흑자 전환에 성공했다. 또한 지난해 연결기준 매출도 전년보다 약 37.4%늘어난 393억 원을 기록하며 재도약의 계기를 마련했다. 소리바다 관계자는 ""2013년 이후 3년 연속 개별 기준으로 적자를 기록하였으나 작년에 흑자 전환에 성공하면서 관리종목 지정 우려에 대한 이슈를 종식시켰다"" 며 ""올해 수익성 높은 분야로 사업을 다각화하여 수익의 안정성과 신규 매출원을 확보하는 등 적극적인 움직임을 보일 예정""이라고 밝혔다."
아이뉴스24,053110,/news/news_read.nhn?article_id=0000441502&office_id=031&mode=search&query=소리바다&page=1,2018-03-21 17:24,소리바다 '스테어' 풋마트 입점&hellip;오프라인 유통망 확대,"[아이뉴스24 윤지혜 기자] 소리바다의 프리미엄 스니커즈 브랜드 '스테어(STARE)'가 풋마트에 입점하며 유통 채널을 강화한다. 21일 스테어는 전국 풋마트 25개 매장에 입점해 판매를 시작했다고 밝혔다. 작년 12월 롯데백화점 본점에 입점하며 오프라인 시장에 진출한지 3개월 만에 새로운 판매망을 확보한 것이다. 스테어는 올 상반기 중 전국 50개 매장으로 판매망을 확대할 예정이다. 스테어는 매 시즌 특정 테마에 맞춰 한정 수량으로 새로운 디자인을 선보이고 있다. 최근에는 배우 김소은을 모델로 발탁해 화제가 됐으며 중국 유명 스포츠 용품 브랜드와 업무 협약을 맺고 해외 시장 진출도 선언한 바 있다. 소리바다의 패션사업을 총괄하고 있는 황종근 전무이사는 ""오프라인 판매망을 확대해 다양한 고객에게 스테어 브랜드를 알리고 고퀄리티의 제품을 합리적인 가격에 구입할 수 있는 기회를 제공하겠다""며 ""실용적이고 미니멀리즘한 스테어 만의 철학이 담긴 신제품을 출시해 프리미엄 스니커즈 브랜드의 입지를 다지겠다""고 말했다. /윤지혜기자"
머니투데이,053110,/news/news_read.nhn?article_id=0003997538&office_id=008&mode=search&query=소리바다&page=1,2018-01-24 13:49,"소리바다, 80억원 규모 전환사채 발행",[머니투데이 배영윤 기자] 소리바다는 운영자금 조달 목적으로 80억원 규모의 무기명식 무보증 사모 전환사채를 발행한다고 24일 공시했다. 사채의 만기이자율은 6%다. 만기일은 오는 2021년1월26일이다.
한국경제,053110,/news/news_read.nhn?article_id=0003643986&office_id=015&mode=search&query=소리바다&page=1,2016-08-23 10:49,"[마켓인사이트]소리바다 전 최대주주, 뒤늦은 주식담보계약 공시",지난 8일 주식 전량 반대매매되고나서 22일 돼서야 담보제공 계약 사실 알려 이 기사는 08월22일(22:38) 자본시장의 혜안 ‘마켓인사이트’에 게재된 기사입니다 ----------------------------------------------------------- 소리바다 전 최대주주가 뒤늦게 주식담보계약 공시를 내보냈다. 소리바다는 최대주주인 블루인베스트가 최대주주 변경을 수반하는 주식 담보제공 계약을 체결했다고 22일 공시했다. 공시에 따르면 블루인베스트는 지난 6월29일 보유하고 있던 소리바다 주식 전량인 178만6300주(지분율 5.08%)에 대해 세종상호저축은행에 금전대출을 위한 담보제공으로 공시의무가 발생했다. 블루인베스트는 당시 공시를 누락했다. 담보제공된 주식은 지난 8일 세종상호저축은행에 의하여 계약의 기한이익상실에 따른 담보권처분 실행으로 전량 반대매매됐다. 이에 소리바다는 지난 10일 최대주주 변경 공시를 냈다. 이후 거래소가 공시 누락을 발견해 주식담보계약 공시를 내보낼 것을 소리바다측에 종용했다. 거래소는 이날 소리바다에 대해 불성실공시법인 지정을 예고했다. 임도원 기자
이데일리,053110,/news/news_read.nhn?article_id=0003960980&office_id=018&mode=search&query=소리바다&page=1,2017-11-02 16:26,"소리바다, 10억원 규모 제3자배정 유상증자 결정",[이데일리 이후섭 기자] 소리바다(053110)는 10억원 규모의 운영자금을 마련하기 위해 제3자배정 유상증자를 결정했다고 2일 공시했다. 보통주 51만2307주가 새로 발행되며 신주 상장예정일은 오는 21일이다.
뉴시스,053110,/news/news_read.nhn?article_id=0007180510&office_id=003&mode=search&query=소리바다&page=1,2016-04-20 19:09,"소리바다, 손지현&middot;박성미 공동 대표이사 선임",【서울=뉴시스】김주아 기자 = 소리바다(053110)는 대표이사 사임에 따라 기존 Lee Jason Wu·손지현 대표이사 체제에서 손지현·박성미 대표이사 체제로 변경한다고 20일 공시했다.
뉴시스,053110,/news/news_read.nhn?article_id=0007161238&office_id=003&mode=search&query=소리바다&page=1,2016-04-12 08:58,"소리바다, 대표이사 '리 제이슨 우'로 변경",【서울=뉴시스】최예린 기자 = 소리바다(053110)는 이사회에서 대표이사가 손지현에서 리 제이슨 우(Lee Jason Wu)로 변경됐다고 12일 공시했다.
