source,symbol,link,date,title,content
뉴시스,055550,/news/news_read.nhn?article_id=0008150830&office_id=003&mode=search&query=신한지주&page=21,2017-08-31 10:11,[빅데이터MSI]오전 10시 시장심리 톱5&middot;&middot;&middot;삼성전자&middot;LG유플러스&middot;신한지주&middot;KB...,"시장심리 워스트5, 롯데쇼핑·현대위아·현대모비스·기아차·현대차 【서울=뉴시스】정옥주 기자 = 31일 오전 10시 기준 빅데이터 시장심리지수(MSI)가 가장 높은 톱5로 삼성전자·LG유플러스·신한지주·KB금융·GS 등이 선정됐다. 반면 가장 낮은 워스트5로 롯데쇼핑·현대위아·현대모비스·기아차·현대차가 선정됐다. 뉴시스와 코스콤이 주요 상장기업 250곳에 대해 공동 분석해 산출해 낸 빅데이터 MSI(http://m.newsis.com/stock.html, 모바일 전용)로 이날 오전 10시까지 데이터를 취합한 결과 이같이 나타났다. 이날 톱5에 선정된 삼성전자 MSI 레벨은 전 거래일 3단계에서 이날 7단계로 4계단 뛰어올랐다. 삼성전자와 관련해 이날 온라인상에서 주로 언급된 키워드는 기어, 제품, 운동, 기능, 서비스, 프로, 스포츠, 스마트폰 등이었다. LG유플러스 MSI 레벨도 전 거래일 7단계에서 이날도 7단계로 동일했다. 이날 LG유플러스와 관련해 온라인상에서는 유튜브, 키즈, 콘텐츠, 아이, 서비스, 어린이, 동영상, 시청, 고객, 자녀 등의 키워드가 상위에 자리했다. 신한지주 MSI 레벨은 전 거래일 7단계에서 이날도 7단계를 유지했다. 신한지주와 관련해 이날 온라인상에서 주로 언급된 키워드로는 직원, 계열사, 유연근무제, 회장, 자율출퇴근, 등록금, 납부, 근무자 등이 추출됐다. KB금융 MSI 레벨은 전 거래일 3단계에서 이날 7단계로 4계단 상승했다. KB금융과 관련해 이날 온라인상에서 주로 언급된 키워드는 회장, 스타트업, 은행, 계열사, 공간, 포인트, 관계자, 기업, 창업 등이었다. GS MSI 레벨도 전 거래일 3단계에서 이날 7단계로 4계단 올랐다. GS와 관련해 이날 온라인상에서 주로 언급된 키워드로는 문제, 상품, 증가, 해외수주, 효과, GS건설 등이 선정됐다. 반면 가장 낮은 워스트5는 롯데쇼핑·현대위아·현대모비스·기아차·현대차 등으로 집계됐다. 롯데쇼핑 MSI 레벨은 전 거래일 1단계에서 이날도 1단계에 그쳤다. 롯데쇼핑과 관련해 온라인상에서 주로 언급된 키워드는 지주사, 인수, 전환, 실적, 가능성, 시장, 중국, 지분, 롯데그룹 등이다. 현대위아 MSI 레벨도 전 거래일 1단계에서 이날 1단계에 머물렀다. 현대위아와 관련해 온라인상에서 주로 언급된 키워드는 중국, 가동, 실적, 전략, 공장, 주가, 금지, 소식, 중단, 증시 등이다. 현대모비스 MSI 레벨은 전 거래일 4단계에서 이날 1단계로 3계단 떨어졌다. 이날 현대모비스와 관련해 온라인상에서는 중국, 실적, 가동, 주가, 공장, 미국, 증시, 북한 등의 키워드가 주로 언급됐다. 기아차 MSI 레벨은 전 거래일 3단계에서 이날 1단계로 2계단 내려갔다. 이날 기아차와 관련해 온라인상에서 주로 언급된 키워드로는 중국, 통상임금, 기업, 주가, 자동차, 실적, 판결, 소송, 시장, 가동 등이 추출됐다. 현대차 MSI 레벨은 전 거래일 1단계에서 이날도 1단계로 같았다. 이날 현대차와 관련해 온라인상에서 주로 언급된 키워드는 중국, 가동, 공장, 실적, 기업, 중단, 시장, 대금, 부품, 주가, 판매, 금지 등으로 나타났다. 뉴시스와 코스콤은 온라인과 소셜네트워크서비스(SNS)에서 수집된 개별 종목 관련 빅데이터를 긍정과 부정으로 분류해 점수화한 다음 이를 최근 1년 간 흐름과 비교해 지수를 산출했다. MSI산출 대상은 코스피 200종목과 코스피 지수, 코스닥 50종목과 코스닥 지수 등 250개 개별 종목이다. MSI는 1단계 '매우 나쁨', 2단계 '나쁨', 3단계 '약간 나쁨', 4단계 '보통', 5단계 '약간 좋음', 6단계 '좋음', 7단계 '매우 좋음' 등 총 7단계로 분류한다. 한편 8월1일부터 선보이는 빅데이터 MSI 모바일 전용 버전은 구글플레이 또는 애플 앱스토어에서 '뉴시스'앱을 내려받거나 뉴시스 모바일 홈페이지(m.newsis.com)에 접속한 뒤 메인화면의 '빅데이터 MSI'를 클릭해 이용하면 된다."
아시아경제,055550,/news/news_read.nhn?article_id=0003819134&office_id=277&mode=search&query=신한지주&page=52,2016-09-01 10:29,[이슈人]한동우 회장 &quot;신한지주 15년 성과&hellip;자부심&middot;긍지 가져야&quot;,"한 회장, 내년 3월 임기 만료 앞두고 마지막 창립기념식…""위기 극복, 선진 경영시스템 정착""  한동우 신한금융지주 회장이 1일 서울 중구 신한은행 본점에서 '신한지주 15주년 창립기념식'을 열고 기념사를 하고 있다. (사진 : 신한지주) [아시아경제 손선희 기자] ""지난 15년 간 신한금융그룹은 한국 금융사에 남다른 발자취를 남겼다. 이러한 성과에 대해 우리 모두 자부심과 긍지를 가져도 좋다."" 한동우 신한금융지주 회장은 1일 서울 중구 신한은행 본점에서 '신한지주 창립 15주년 기념식'을 열고 이같이 말했다. 한 회장은 신한의 그간 성과를 축하하는 것에서 한발 더 나아갔다. 한 회장은 ""우리의 경쟁자는 발 빠르게 움직이고 있다""며 ""급변하는 환경 속에서 신한이 계속 앞서가기 위해서는 경영의 속도를 더욱 높여야 한다""고 당부했다. 주마가편(走馬加鞭). 달리는 말에 채찍질을 하듯 신한이 한 발 더 멀리 나아갈 것을 주문한 셈이다. 이날 행사는 한 회장의 임기 중에 치러지는 마지막 창립기념식이다. 한 회장의 임기는 내년 3월이다. 1982년 불과 세 개의 영업점으로 문을 연 신한은행은 현재 국내 '리딩뱅크' 입지를 공고히 다졌다는 것이 안팎의 평가다. 이어 2001년 신한지주를 창립해 총자산 390조원 규모의 국내 최대 금융그룹으로 성장했다. 지난해 신한지주의 당기순이익은 2조3700억원을 기록하며 8년 연속 은행권 1위 자리를 지켰다. 2011년 신한사태의 여진이 남아있는 상태에서 회장직에 오른 한 회장은 지난 5년 간 조직을 안정적으로 이끌었다는 평가를 얻고 있다. 한 회장도 이날 ""여러 위기를 슬기롭게 극복하면서 선진화된 경영 시스템을 정착시켰다""고 강조했다. 한 회장은 이날 그룹의 5대 경영 방침으로 ▲디지털 트랜스포메이션(Transformation) ▲글로벌 진출의 현지화 ▲선제적 리스크 관리 ▲원 신한(One Shinhan) ▲'미래를 함께 하는 따뜻한 금융'의 완전한 체화(體化)를 제시했다. 이는 향후 신한지주의 핵심 전략이 될 전망이다. 한 회장은 ""금융의 디지털화는 거스를 수 없는 흐름이 됐다""며 ""전사적 노력을 기울여 그룹 차원의 협력, 외부와의 다양한 협업을 통해 차별화된 디지털 금융을 구현해야 한다""고 말했다. 한 회장은 또 ""신한이 눈부신 성장을 거듭할 수 있었던 것은 '꼭 성공해야 한다'는 절박함이 있었기 때문""이라며 초심을 잃지 말 것을 당부했다. 아울러 ""신한지주의 존재 이유이자 신한의 백년대계를 위한 핵심인 '미래를 함께 하는 따뜻한 금융' 미션을 완전히 체화하겠다""고 다짐했다."
조선비즈,055550,/news/news_read.nhn?article_id=0000410760&office_id=366&mode=search&query=신한지주&page=4,2018-07-13 18:32,조용병 신한지주 회장 &ldquo;더 빠른 조직으로 거듭나자&rdquo;&hellip;하반기 워크숍 개최,"조용병(사진) 신한금융지주 회장이 13일 하반기 임직원 워크숍을 열고 “더 빠른 조직으로 거듭나자”고 당부했다. 조선DB 13일 신한금융에 따르면 조 회장을 포함한 신한금융 전 임직원은 서울 태평로 신한금융 본점에서 ‘2018년 하반기 워크숍’을 열었다. 이는 지난 6월과 7월에 이어 세 번째 워크숍이다. 이날 행사에서 신한지주 임직원들은 조직 전체의 체질 개선을 위해 ‘S.A.Q 조직으로의 업그레이드를 위한 혁신방안’을 주제로 토론을 진행했다. S.A.Q는 올해 초 신한금융이 신한만의 차별적인 성장을 추진하기 위해 설정한 전략으로 신속한 실행(Speed), 민첩한 대응(Agility), 순발력(Quickness)을 뜻한다. 이날 논의된 내용들은 앞으로 그룹 경영전략에 반영될 계획이다. 신한금융 관계자는 “조 회장이 S.A.Q조직 도입을 위해 치열하게 고민해보자고 당부했다”고 말했다."
전자신문,055550,/news/news_read.nhn?article_id=0002724201&office_id=030&mode=search&query=신한지주&page=4,2018-07-16 10:21,"[ET투자뉴스]신한지주, &quot;동사의 위험관리 능&hellip;&quot; BUY(MAINTAIN)-키움증...","키움증권에서 16일 신한지주(055550)에 대해 ""동사의 위험관리 능력이 발휘되는 시점""라며 투자의견을 'BUY(MAINTAIN)'로 제시하였고, 아울러 목표주가로는 57,000원을 내놓았다. 키움증권 서영수, 유근탁 애널리스트가 동종목에 대하여 이번에 제시한 'BUY(MAINTAIN)'의견은 키움증권의 직전 매매의견에서 큰 변화없이 그대로 유지되는 것이고  올해 초반의 매매의견을 기준으로  볼때도 역시 '매수'의견이 계속 유지되고 있는 상태이다. 그리고 최근 분기내 발표된 전체 증권사 리포트의 컨센서스와 비교를 해볼 경우에 오늘 발표된 투자의견은 전체의견에 수렴하고 있어, 이번 의견은 시장의 평균적인 기대감이 객관적으로 표현된 것으로 분석되고 있다. 목표주가의 추이를 살펴보면 한동안 정체구간을 보낸 후 이번에 목표가가 하향조정된 모습이다. 또한 전일 종가 기준으로 볼때 동종목의 현주가는 이번에 제시된 목표가 대비 26.1%의 저평가 요인이 존재한다는 해석이 제시되고 있다."
한국경제,055550,/news/news_read.nhn?article_id=0003716475&office_id=015&mode=search&query=신한지주&page=42,2017-01-19 07:13,"신한금융지주, 차기 회장 오후 발표 예정","신한금융지주가 차기 회장 후보를 선정한다. 19일 신한금융에 따르면 신한금융 회장추천위원회는 이날 오후 2시부터 회의를 시작한다. 이어 오후 3시부터 3명의 회장 후보자에 대한 면접을 시작한다. 최방길 전 신한BNP파리바자산운용 사장, 위성호 신한카드 사장, 조용병 신한은행장 순이다. 면접이 끝나면 회추위원들은 각 후보의 성과와 역량, 자격요건 적합 여부 등을 종합적으로 검증해 이사회에 추천할 1명의 차기 회장 후보자를 선정한다. 신한금융 관계자는 ""회추위원들의 의견이 일치될 때까지 토론을 진행할 전망이지만 과거처럼 밤 늦게까지 오래 걸리지는 않을 것""이라고 말했다."
아시아경제,055550,/news/news_read.nhn?article_id=0003875453&office_id=277&mode=search&query=신한지주&page=48,2016-11-21 17:27,"신한지주, 24일 국내외 기관투자자 대상 IR개최",[아시아경제 권재희 기자]신한지주는 오는 24일 오전 9시 여의도 콘래드호텔에서 국내외 기관투자자를 대상으로 기업설명회(IR)를 개최한다고 21일 공시했다.
연합뉴스,055550,/news/news_read.nhn?article_id=0010229972&office_id=001&mode=search&query=신한지주&page=4,2018-07-24 15:41,"신한지주, 상반기 순익 1조8천억&hellip;예상치 웃돌아","신한금융그룹 [연합뉴스TV 제공] 순익, 전년 대비 5% 감소…일회성 요인 제외하면 11.3% 증가 2분기 기준 7년 만에 최대순익 (서울=연합뉴스) 박의래 기자 = 신한금융지주는 연결 기준으로 올해 상반기 순이익이 1조7천956억원을 기록했다고 24일 밝혔다. 지난해 상반기(1조8천891억원)와 비교하면 5.0% 줄었다. 일회성 요인으로 지난해 1분기에 발생한 신한카드 대손충당금 환입액(약 2천800억원·세후)을 제외하면 전년 동기 대비 11.3%(1천822억원) 늘어난 수준이다. 2분기만 놓고 보면 9천380억원 순이익을 얻어 1분기(8천575억원)보다 9.4% 증가했다. 2분기 기준으로는 2011년 2분기(9천648억) 이후 최대치다. 신한지주는 금융시장 평균 전망치(상반기 1조7천253억원·2분기 8천678억원)를 뛰어넘는 성적을 냈다. 신한지주는 ""은행 부문 이익이 안정적으로 증가하고 금융투자, 캐피탈 등 비은행 부문에서도 고르게 이익이 났다""며 ""이자이익과 비이자이익이 모두 늘었고 대손 비용도 크지 않아 호실적을 낼 수 있었다""고 설명했다. 상반기 기준으로 순이자마진(NIM)은 2.11%로 작년 말보다 0.05%포인트 올랐다. 이자이익은 4조1천800억원으로 전년 동기 대비 10.5% 늘었다. 비이자이익은 8천960억원으로 17.3% 증가했으며, 이 중 수수료 이익이 9천960억원으로 20.8% 뛰었다. 대손충당금 전입액은 3천530억원으로 지난해 상반기(-490억원) 보다 크게 늘었다. 그러나 대손비용률은 0.26%로 과거 5개년 평균치(0.42%)와 비교해 크게 떨어졌다. 판매관리비는 2조2천130억원으로 3.3% 늘었다. 계열사별로 살펴보면 신한은행은 상반기 순이익이 1조2천718억원으로 1년 전보다 15.2% 증가했다. 6월 말 기준 원화 대출금 잔액은 201조2천940억원으로 지난해 말보다 3.0% 늘었다. 가계(2.9%)와 기업(3.1%) 모두 증가했으며 특히 소호(SOHO) 대출 잔액이 6.2% 늘어났다. 여기에 NIM은 1.62%로 전년 말보다 0.06%포인트 올라 이자이익은 지난해 상반기보다 14.0% 늘어난 2조7천137억원을 기록했다. 고정이하여신(NPL) 비율은 0.51%로 작년 말과 비교해 0.04%포인트 떨어졌지만, 연체율은 0.27%로 0.04%포인트 올랐다. 신한카드와 금융투자 등 비은행 부문의 상반기 당기순이익은 6천198억원을 기록, 지난해 상반기보다 28.4% 감소했다. 신한카드 순익이 2천819억원으로 55.3% 감소한 영향이다. 신한카드는 지난해 대손충당금 환입으로 일회성 이익이 발생했다. 신한금융투자는 1천827억원으로 94.9% 증가했고, 신한캐피탈은 638억원으로 38.3% 늘었다. 그러나 신한생명은 700억원으로 7.5% 감소했고, 신한BNP파리바자산운용은 66억원으로 1.9% 증가했다."
연합뉴스,055550,/news/news_read.nhn?article_id=0008655709&office_id=001&mode=search&query=신한지주&page=52,2016-09-01 10:45,'신한금융지주회사 창립 15주년 기념식',(서울=연합뉴스) 한동우 신한금융지주회사 회장이 1일 서울 중구 본사에서 열린 창립 15주년 기념식에서 기념사하고 있다. 2016.9.1 [신한금융지주회사 제공=연합뉴스]
연합뉴스,055550,/news/news_read.nhn?article_id=0008973050&office_id=001&mode=search&query=신한지주&page=40,2017-01-19 19:19,신한금융지주 차기회장 최종후보에 조용병 현 신한은행장(종합2보),"회추위 ""전문성과 통찰력 고루 갖춰 만장일치로 선정""…3월 주총서 최종 선임 위성호, 면접서 사퇴 뜻 밝혀…""조 행장 도와 조직발전 기여하겠다"" (서울=연합뉴스) 박의래 기자 = 조용병 신한은행장이 신한금융지주 차기 회장 단독 후보로 선정됐다. 신한금융 회장추천위원회(회추위)는 19일, 신한금융 회장 선정 회의를 열고 조 행장을 단독 회장 후보로 추천했다. 회추위는 ""면접 절차가 종료된 후 심의와 투표를 거쳐 만장일치로 조용병 신한은행장이 최종후보로 선정됐다""고 밝혔다. 이상경 회추위원장은 ""조 후보는 축적한 경험과 전문성을 바탕으로 회장으로서 요구되는 통찰력과 조직관리 역량, 도덕성 등을 고루 갖춘 인사""라며 선정 사유를 밝혔다. 금융업계에서는 그동안 조 행장이 신한금융 차기 회장에 가장 유력하다고 평가해 왔다. 2015년부터 신한은행을 맡아 저금리 지속 등 악화된 영업환경과 다른 은행들의 치열한 도전에도 리딩뱅크의 위상을 공고히 했기 때문이다. 또 모바일 은행인 써니뱅크를 성공적으로 출범시켜 급변하는 금융 환경에 유연하게 대응했다는 평가를 받았다. 특정 계파에 속해 있지 않은 중립 인사라는 점도 차기 회장 후보로 선정되는 데 유리했을 것으로 보인다. 조 행장은 1957년 대전 출생으로 대전고와 고려대 법학과를 나왔다. 1984년 신한은행에 입행해 뉴욕지점장과 리테일부문장 부행장, 신한BNP파리바자산운용 대표를 거쳤다. 은행의 기초인 영업부터 인사와 기획, 글로벌 등 은행 업무 전반을 거쳤으며, BNP파리바자산운용 대표를 맡아 큰돈을 굴려본 경험도 있다. 직원 행복을 강조하며 은행권 최초로 스마트 근무제를 도입하는 등 업무 혁신에도 관심이 많으며, 경영 스타일도 '형님 리더십'이라 불릴 정도로 소탈해 내부 직원들 사이에서 신망이 두텁다. 조 행장과 회장 후보에 올라 유력 후보로 거론되던 위성호 신한카드 사장은 이날 면접 과정에서 ""신한의 미래를 위해 조용병 은행장이 회장이 되는 것이 순리라고 생각한다""며 ""차기 회장을 도와 조직의 발전에 기여하고 싶다""며 후보직 사퇴의 뜻을 밝혔다고 회추위는 전했다. 위 사장이 회장 후보에서 막판에 조 행장을 지지하면서 조 행장을 이을 차기 신한은행장에는 위 사장이 유력해 졌다는 분석이 나온다. 신한금융은 조만간 자회사경영관리위원회(자경위)를 열고 공석이 되는 신한은행장을 선출할 계획이다. 이 위원장은 ""조 회장을 선임하는 과정에서 안정적 발전을 중요하게 여겼다. 안정적인 것은 순서대로라는 말""이라며 ""신한금융에서 회장 다음은 은행장이고 그 다음은 카드, 생명 순이다""라고 말했다. 그는 ""이날 회장을 선출하는 과정에서 누구라고 말은 안 했지만 다음 행장은 누가 적당하다는 의견은 논의 중에 나왔다""고 말했다. 위 사장이 차기 행장이 될 가능성이 높은가 묻는 기자들의 질문에 ""차기 행장은 자경위에서 결정할 문제""라고 하면서도 ""순리라고 말했다. 제일 높은 사람이 회장이고 다음이 행장이고 카드가 그다음 아닌가""라고 답했다. 한동우 현 회장의 향후 역할에 대해서는 ""한 회장의 역할에 대해서는 전혀 논의되지 않았다""고 말했다. 신한금융은 오는 20일 이사회를 열고 조 행장을 차기 회장 내정자로 선임할 계획이다. 조 행장은 오는 3월 정기 주주총회에서 차기 회장으로 최종 선임된다. 조용병 신한금융지주 회장 후보자 [연합뉴스 DB]"
서울경제,055550,/news/news_read.nhn?article_id=0002903246&office_id=011&mode=search&query=신한지주&page=50,2016-10-20 18:22,"블랙록, 신한지주 지분 5.13% 보유","블랙록(BlackRock Fund Advisors) 외 특별관계자 14인은 신한지주(055550)의 지분5.13%(2,432만723주)를 보유하고 있다고 20일 공시했다."
아이뉴스24,055550,/news/news_read.nhn?article_id=0000421123&office_id=031&mode=search&query=신한지주&page=21,2017-08-18 14:33,"신한지주, 리츠운용사 CEO에 신한투자 남궁훈 본부장 발탁","[아이뉴스24 김다운기자] 신한금융지주는 18일 서울 중구 세종대로에 위치한 본사에서 정기 이사회를 열고, 2017년 상반기 결산실적 보고와 함께 자회사경영진 후보를 추천했다고 발표했다. 지난 17일 신한지주는 국토교통부로부터 지주사 산하에 리츠 AMC 설립에 대한 예비인가를 획득한바 있다. 이날 신한지주 자회사경영관리위원회(자경위)는 신한리츠운용사의 설립추진단장으로 신한금융투자의 남궁훈 본부장 (사진) 을 내정하고, 향후 본인가 획득 시 사장으로 선임될 예정이라고 전했다. 신한지주 관계자는 ""남 내정자는 현 자산운용(WM)추진본부장으로 지난 17년간 증권업에 종사하면서 부동산을 포함한 자본시장에서 능력을 인정받은 자산관리 최고 전문가""라며 ""은행 및 금융투자의 복합채널에서 쌓은 경험을 바탕으로 고객의 니즈 파악뿐 아니라 및 판매 채널과의 소통에도 역량을 발휘할 것으로 기대한다""고 전했다. 한편 신한지주는 지난 7월에도 투자금융분야 전문가인 김희송 당시 신한생명상무를 신한PE 사장으로 선임한 바 있다. 최근 선임된 두 명의 CEO는 각 사 공채출신이 아닌 외부에서 영입된 전문가로 각 분야에서 최고의 역량을 인정받은 인물들이라는 설명이다. 과거 중용되던 은행 출신이 아닌 외부 영입인재를 발탁하는 신한금융의 인사정책은 올해 상반기부터 본격화됐고, 직급도 본부장에서 최고경영자(CEO)급까지로 상향된 것이다. 신한지주는 상반기 디지털 분야에서 외국계 컨설팅사 대표출신인 조영서 본부장을, 빅데이터센터 본부장에도 김철기 금융연수원 교수를 영입했다. 신한지주 관계자는 ""출중한 능력과 역량을 보유하고 있는 인재라면 그룹 내외를 가리지 않고 등용하는 그룹의 인사정책은 앞으로도 계속될 것""이라며 ""향후 자회사 단위까지로 확산될 예정""이라고 전했다. 한편 이날 이사회에서는 그룹 국제결제은행(BIS) 기준 자기자본비율 개선을 위한 3천억원 규모 상각형 조건부자본증권 발행을 승인했다. /김다운기자"
