source,symbol,link,date,title,content
머니투데이,055550,/news/news_read.nhn?article_id=0004088885&office_id=008&mode=search&query=신한지주&page=3,2018-08-08 10:17,"신한금융지주, 외화 상각형 조건부자본증권 5억달러 발행 성공","[머니투데이 한은정 기자] [국내 금융지주 최초로 외화 신종자본증권 발행] 신한금융지주는 7일 해외 투자자 대상으로 미화 5억달러 규모의 바젤3 적격 외화 상각형 조건부자본증권을 성공적으로 발행했다고 8일 밝혔다. 이번 발행은 국내 금융지주회사 최초로 발행하는 외화표시(USD) 영구채 상각형 조건부자본증권으로 국내 금융기관이 발행한 바젤3 적격 외화 상각형 조건부자본증권 중 유일하게 투자적격 등급(Baa3)을 부여 받았다. 발행금리는 미국 국채 5년물 금리에 3.05%포인트(p)를 가산한 수준인 연 5.875% 이다. 총 159 개 기관에서 발행규모의 약 4배에 해당하는 약 20억 달러의 주문을 확보했으며 지역별로는 아시아 86%, 유럽 14%의 분포를 보였다. 지난 5월 국내금융지주 최초로 국제신용평가등급(무디스 A1)을 취득한 신한지주는 최근 주요 선진국의 급격한 금리상승 전망과 무역갈등 등 글로벌 금융시장의 불확실성 확대로 인해 외화 상각형 조건부자본증권 발행시기를 한 차례 조정한 바 있다. 한편, 신한지주는 아시아 금융기관 중 올해 처음으로 바젤 3 적격 외화표시 상각형 조건부자본증권을 발행하며 뱅크오브아메리카메릴린치(BOAML), 크레디트스위스(Credit Suisse), HSBC, JP모간(Morgan), 미즈호(Mizuho) 가 공동주간사로 신한금융투자와 신한아주금융유한공사가 보조주간사로 각각 참여했다. 신한지주 관계자는 ""최근 다수의 발행사가 발행을 연기할 정도로 어려운 시장 상황 속에서도 금융지주 최초로 외화 상각형 조건부자본증권 발행에 성공했다”며 “이번 발행을 통해 국내 금융지주사 외화조달의 벤치마크를 형성했을 뿐만 아니라 글로벌 자본시장에서 신한금융그룹의 위상을 재확인했다는 점에서 큰 의미가 있다""고 밝혔다."
디지털타임스,055550,/news/news_read.nhn?article_id=0002364031&office_id=029&mode=search&query=신한지주&page=51,2016-09-28 14:45,"신한금융지주, 지속가능성대회서 KRCA 수상","신한금융지주는 28일 서울 리츠칼튼호텔에서 개최된 '2016 대한민국 지속가능성대회'에서 '지속가능성보고서상(KRCA)'을 수상했다. 시상식에서 임영진 신한금융 부사장(왼쪽)과 백수현 한국표준협회장이 기념촬영을 하고 있다. 신한금융지주 제공  신한금융지주는 28일 서울 리츠칼튼호텔에서 개최된 '2016 대한민국 지속가능성대회'에서 '지속가능성보고서상(KRCA)'을 수상했다고 밝혔다. KRCA는 한국표준협회가 사회책임활동을 성실히 수행하고 소비자 등 이해관계자와 잘 소통하고 있는 기업에 수여하는 상이다. 국내 지속가능 경영분야 전문가와 해당기업의 이해관계자가 국제기준으로 종합 평가해 수상기업을 선정한다. 이번 수상은 2013년에 이은 두번째다. 신한금융은 △그룹의 주요 사회책임경영 이슈인 금융소비자보호, 환경경영, 금융접근성 확대 등의 추진성과 보고 △이해관계자에 대한 의견 수렴 △조직을 둘러싼 위험과 기회, 메가트렌드 분석 대응 등에서 높은 평가를 받았다. 신한금융 측은 ""2005년 국내 금융권 최초로 사회책임 보고서를 발간하고 2009년부터 그룹 차원의 통합 보고서를 매년 발간하는 등 국내 금융권 사회책임경영을 선도하고 있다""며 ""최근 발표된 다우존스 지속가능경영 월드 지수(DJSI World)에 4년 연속 편입됐으며, 다보스포럼에서 발표한 글로벌 지속가능경영 100대 기업에도 세계 18위 기업으로 선정된 바 있다""고 설명했다. 한편 이날 함께 열린 KSI(Korean Sustainability Index, 대한민국 지속가능성지수) 1위기업 인증수여식에서 신한은행과 신한카드가 각각 은행, 신용카드 부문에서 1위 기업으로 선정됐다."
연합뉴스,055550,/news/news_read.nhn?article_id=0008973046&office_id=001&mode=search&query=신한지주&page=40,2017-01-19 19:13,"'리딩금융' 수성, 발등의 불&hellip;조용병 신한지주 회장 후보 과제는","KB금융 맹추격에 금융지주 '왕좌' 타이틀전 올해부터 본격화 디지털 금융·해외진출서 먹거리 찾아야 (서울=연합뉴스) 송광호 박의래 기자 = 6년간 장기집권한 한동우 회장에 이어 신한금융을 떠맡게 된 신임 조용병 신한금융 회장 내정자 앞에는 풀어야 할 과제가 산적해 있다. 2008년 이후 '리딩금융' 자리를 유지하고 있지만 격변하는 금융권의 변화 탓에 1위 수성이 만만치 않은 과제로 떠올랐기 때문이다. 살짝만 방향을 잘못 잡아도 왕좌에서 밀려날 살얼음판 형국이다. 인터넷전문은행이 올해 출현하고, 송금이나 입출금식 거래의 90% 이상은 비대면으로 이뤄지는 '디지털 시대'가 도래했다. 점포 의존도가 높았던 대출도 모바일로 점점 이동하는 추세다. '내 손안에 은행'이 이미 대세로 자리를 잡아가고 있다. 조 후보로서는 세밀한 '모바일 퍼스트' 전략을 추진해야 하는 이유다. 글로벌 전략도 강화해야 한다. 은행권의 먹거리가 부족해지고 있는 만큼 해외진출은 이제 선택이 아닌 필수다. 은행의 경우 미얀마, 인도네시아, 인도 등 이미 20개국에 150개의 해외 채널을 구축했다. 올해부터는 채널 확장보다는 내실을 다져 글로벌 사업을 더 튼튼하게 해야 하는 과제가 있다. 1위 자리를 노리는 기존 은행들의 강력한 도전도 뿌리쳐야 한다. 특히 KB금융의 도전은 위협적이다. 2000년대 초중반 부동의 1위 자리를 차지했으나 낙하산 인사와 내부 갈등으로 추락했던 KB금융은 윤종규 회장 체제가 자리를 잡으면서 안정화에 접어들었다는 평가를 받고 있다. 최근 수년간 LIG손해보험과 현대증권을 잇달아 인수하며 몸집을 키웠다. 포트폴리오가 안정화되면서 수익도 다변화했다. 당장 신한금융의 9년 연속 '리딩금융' 수성이 위태로운 상황이다. 현대증권 인수에 따른 1조원가량의 염가매수차익이 발생하면서 KB금융의 작년 순이익이 많이 늘어날 전망이기 때문이다. 금융권에서는 올해부터 신한과 KB금융의 본격적인 승부가 이뤄질 것으로 보는 시각이 많다. 조 후보가 '리딩뱅크' 수성에 온 힘을 다해야 하는 이유다. 은행 통합에 따른 시너지가 아직 본격화하진 않았지만 모바일금융에서 성장세를 이어가고 있는 하나금융, 작년 큰 손실을 봤지만 고객층이 두터운 농협금융도 언제든 위협 대상이다. 민영화에 성공한 우리은행도 금융지주는 아니지만 의외의 '복병'이 될 수 있다. 조용병 신한은행장(가운데)이 지난해 3월 16일 광주시 광산구 소재 화천기공㈜를 방문, 생산과정에 대해 설명을 듣고 있다. [연합뉴스 자료사진] 조 후보자가 직면한 첫 시험대는 자회사 인사다. 당장 공석이 된 신한은행장을 자회사 경영관리위원회, 한동우 현 회장과 함께 선정해야 한다. 3월에는 더 많다. 신한금융투자 강대석 사장, 신한BNP파리바자산운용 민정기 사장, 제주은행 이동대 행장, 신한저축은행 김영표 사장, 신한신용정보 이원호 사장, 신한 PE 김종규 사장 등의 임기가 3월 말 마무리된다. 자회사 인사는 자회사 경영관리위원회와 지주 회장이 함께 진행한다. 통상적으로 지주 회장의 입김이 많이 반영되는 것으로 알려졌다. 한동우 회장의 재임이 3월까지지만 새 회장에 힘을 실어주기 위해서 자신이 인사를 하고 나갈 가능성은 거의 없을 것으로 보인다."
뉴시스,055550,/news/news_read.nhn?article_id=0008157116&office_id=003&mode=search&query=신한지주&page=20,2017-09-04 08:59,[빅데이터MSI]시장심리 톱5...KB금융&middot;신한지주&middot;한국항공우주&middot;후성&middot;부광약품,"시장심리 워스트5, 기아차·고려아연·농심·한진중공업·LS 【서울=뉴시스】이진영 기자 = 4일 빅데이터 시장심리지수(MSI)가 가장 높은 '톱5'로 KB금융·신한지주·한국항공우주·후성·부광약품이 선정됐다. 반면 시장심리가 가장 저조한 '워스트 5'로는 기아차·고려아연·농심·한진중공업·LS가 뽑혔다. 뉴시스와 코스콤이 주요 상장기업 250곳에 대해 공동 분석해 산출해 낸 빅데이터 MSI(http://m.newsis.com/stock.html, 모바일 전용)로 전 거래일 오후 4시부터 이날 오전 8시까지 데이터를 취합한 결과 이같이 나타났다. 이날 톱5에 선정된 KB금융 MSI 레벨은 가장 높은 7단계로 전 거래일보다 한 계단 상승했다. 오는 11월 20일 임기가 끝나는 윤종규 KB금융지주 회장 겸 국민은행장의 후임자를 선출하기 위해 KB금융이 지난 1일 사외이사 7명으로 구성된 확대지배구조위원회(확대위)를 열었다. 이에 따라 약 한 달 후에는 후임자의 윤곽이 드러날 것으로 기대되고 있다. KB금융 관련해 이날 온라인상에서는 회장, 후보, KB금융, 국민은행, 최종, 확대위 등이 키워드로 언급됐다. 신한지주 MSI 레벨은 이날 7단계로 전 거래일에 비해 6계단 급등했다. 조용병 신한금융지주 회장은 지난 1일 신한은행 본점에서 열린 신한금융지주 출범 16주년 기념식에서 새로운 기회 발굴과 미래 지향적인 포트폴리오 구축을 강조하며 ""기회가 왔을 때 인수합병(M&A) 등 다양한 방안을 적극 추진하겠다""고 밝힌 바 있다. 신한지주 관련해 이날 온라인상에서 회장, 신한, 사장, 후보, 포트폴리오, 신한금융 등이 키워드로 검출됐다. 한국항공우주 MSI 레벨은 이날 7단계로 전일보다 한 계단 올랐다. 북한의 제6차 핵실험으로 방산주가 조명을 받고 있다. 다만 지난 1일 서울중앙지검 방위사업수사부는 한국항공우주 협력업체 D사 대표 황모(59)씨를 주식회사의 외부감사에 관한 법률 및 특정경제범죄 가중처벌 등에 관한 법률 위반(사기) 혐의로 구속기소했다고 밝힌 바 있다. 한국항공우주 관련해 이날 온라인상에서는 주가, 북한, 주식, 대통령, 미국, 사업 등이 키워드로 조사됐다. 후성 MSI 레벨은 이날 7단계로 전일에 비해 5계단 올랐다. KTB투자증권은 지난 1일 후성의 목표주가를 기존 1만1500원에서 1만3500원으로 상향 조정했다. 또 후성의 3분기 매출액은 전년동기대비 36.3% 증가한 696억원, 영업이익은 19.6% 늘어난 124억원으로 추정했다. 김양재 KTB투자증권 연구원은 ""최근 예상보다 타이트한 반도체와 2차전지 수급이 이어지면서 관련 업계 증설도 더 빠르게 전개 중""이라며 ""업계 신규 팹 가동과 후성의 증설 스케줄을 고려하면 실적 모멘텀은 올 상반기 보다 하반기, 내년 상반기 보다 하반기에 더 크게 발생할 것으로 추정된다""고 밝혔다. 후성 관련해 이날 온라인상에서는 주가, 증설, 미래, 가치, 반도체 등의 단어가 상위에 올랐다. 부광약품 MSI 레벨은 이날 7단계로 전일에 비해 3계단 올랐다. 부광약품은 제2형 당뇨병신약 'MLR-1023'이 보건복지부 한국보건산업진흥원의 첨단의료기술개발 신약개발지원 과제로 선정됐다고 지난달 30일 밝힌 바 있다. 미국 멜리어와 부광약품은 신약재창출을 통해 MLR-1023을 당뇨병치료제로 개발하고 있다. 인슐린 세포신호 전달에 관여하는 '린 카이네이즈'를 선택적으로 활성화시키는 새로운 기전의 신약후보물질이다. 부광약품 관련해 이날 온라인상에서는 가능성, 상승, 지지, 증권가, 주가 등의 키워드가 빈도가 높게 감지됐다. 이와 달리 시장심리가 가장 부정적인 5종목으로는 기아차·고려아연·농심·한진중공업·LS가 집계됐다. 기아차 MSI 레벨은 이날 가장 낮은 1단계로 전 거래일과 같은 수준이다. 기아차 관련해 이날 온라인상에서는 통상임금, 판결, 소송, 노조, 회사, 주가 등이 키워드로 가장 많이 뽑혔다. 고려아연 MSI 레벨은 이날 1단계로 전 거래일보다 2단계 하락했다. 고려아연 관련해 이날 온라인상에서는 실적, 개선, 보조기, 프로젝트, 치료, 수요, 주가 등의 키워드가 상위권에 추출됐다. 농심 MSI 레벨은 이날 1단계로 전 거래일과 같다. 농심 관련해 이날 온라인상에서는 라면, 마을, 감자, 마음, 사람, 광고 등이 키워드로 꼽혔다. 한진중공업 MSI 레벨은 이날 1단계로 6계단 급락했다. 한진중공업 관련해 이날 온라인상에서는 주가, 통상임금, 중국, 소송, 판결, 소식 등이 주요 키워드로 조사됐다. LS MSI 레벨은 이날 1단계로 전 거래일에 비해 6계단 추락했다. LS 관련해 이날 온라인상에서는 파일, 수원, 기능, 복사, 본문, 사진 등이 키워드로 검출됐다. 뉴시스와 코스콤은 온라인과 소셜네트워크서비스(SNS)에서 수집된 개별 종목 관련 빅데이터를 긍정과 부정으로 분류해 점수화한 다음 이를 최근 1년 간 흐름과 비교해 MSI(Market Sentiment Index) 지수를 산출했다. MSI산출 대상은 코스피 200종목과 코스피 지수, 코스닥 50종목과 코스닥 지수 등 250개 개별 종목이다. MSI는 1단계 '매우 나쁨', 2단계 '나쁨', 3단계 '약간 나쁨', 4단계 '보통', 5단계 '약간 좋음', 6단계 '좋음', 7단계 '매우 좋음' 등 총 7단계로 분류한다. 한편 8월 1일부터 선보이는 빅데이터 MSI 모바일 전용 버전은 구글플레이 또는 애플 앱스토어에서 '뉴시스'앱을 내려받거나 뉴시스 모바일 홈페이지(m.newsis.com)에 접속한 뒤 메인화면의 '빅데이터 MSI'를 클릭해 이용하면 된다."
이데일리,055550,/news/news_read.nhn?article_id=0003639633&office_id=018&mode=search&query=신한지주&page=51,2016-09-28 17:52,"신한지주, 다음달 5일 여의도서 IR 개최",[이데일리 신정은 기자] 신한지주(055550)는 다음달 5일 오후 3시15분 서울 여의도 금융투자교육원에서 국내 기관투자자를 대상으로 기업설명회(IR) 개최한다고 28일 공시했다.
서울경제,055550,/news/news_read.nhn?article_id=0002903072&office_id=011&mode=search&query=신한지주&page=50,2016-10-20 16:09,"[서울경제TV] 신한금융지주, 3분기 순익 7,079억원&middot;&middot;&middot; 전년比 4%증가","신한금융지주가 지난 분기에 예상을 뛰어넘는 실적 달성했다. 신한지주는 20일, 올 3분기에 7,079억원의 순이익을 내 지난해 3분기(6,790억원) 보다 4.3% 늘었다고 밝혔다. 이는 약 6,000억원이었던 신한지주에 대한 시장의 전망치를 1,000억원 가량 뛰어넘는 실적이다. 3분기까지 누적 순익은 2조1,627억원으로 지난해 같은 기간(1조9,631억원) 대비 10.2% 증가했다. 신한지주가 3분기까지 누적 순익으로 2조원을 넘긴 것은 2012년 이후 4년 만이다. 신한지주가 3분기에 좋은 성적을 낸 것은 이자이익이 늘고 대손충당금과 판매관리비가 줄어든 덕분인 것으로 분석된다. 계열사별로 살펴보면 신한은행은 3분기까지 1조5,117억원의 순익을 기록해 전년 동기 대비 20.7% 늘었고 이자부문은 3조3,005억원으로 7% 늘었다. 비이자 부문 이익도 8,658억원으로 3.5% 증가했다."
이데일리,055550,/news/news_read.nhn?article_id=0003917866&office_id=018&mode=search&query=신한지주&page=20,2017-09-07 17:42,"신한지주&middot;KB금융, DJSI 월드지수 편입","[이데일리 권소현 기자] KB금융그룹과 신한금융지주가 미국 다우존스의 DJSI (Dow Jones Sustainability Index) 지속가능경영평가에서 월드지수에 편입됐다고 7일 밝혔다. 신한금융지주는 5년 연속, KB금융그룹은 2년째 월드지수에 이름을 올렸다. DJSI는 전세계 시가총액 상위 2500여 글로벌 기업을 대상으로 매년 재무적 성과 뿐 아니라 환경, 사회적 측면에서 기업의 지속가능성을 평가해 발표한다. 올해 DJSI 월드 지수에 편입된 기업은 전세계 총 320개 기업으로 이 중 은행산업 부문에는 웨스트팩, BNP파리바, 바클레이스, 씨티그룹 등 전 세계 28개사가 편입됐다. 신한금융그룹은 금융소외계층에 대한 금융포용뿐 아니라 고객관계관리, 재무안정성, 기후변화 대응, 윤리경영, 사회공헌 활동 등에서 높은 점수를 받아 국내 금융그룹 최초로 5년 연속 선정됐다. KB금융그룹 역시 윤리경영 실천, 정보보안, 사회공헌 활동, 금융포용성 등의 분야에서 좋은 평가를 받아 2년 연속 월드지수에 편입됐다."
아시아경제,055550,/news/news_read.nhn?article_id=0004283112&office_id=277&mode=search&query=신한지주&page=4,2018-07-24 15:49,신한금융지주 상반기 순이익 1조7956억 기록,"[아시아경제 유인호 기자] 신한금융지주는  올해 상반기 순이익이 1조7956억원을 기록했다고 24일 밝혔다. 지난해 상반기(1조8891억원) 보다 4.9% 줄었다.  일회성 요인으로 지난해 1분기에 발생한 신한카드 대손충당금 환입액(2800억원ㆍ세후)을 제외하면 전년 동기 대비 11.3%(1822억원) 늘어난 수준이다. 2분기 순이익은 전분기 보다 9.4% 늘어난 9380억원을 기록했다. 분기 기준으로는 2011년 2분기(9648억) 이후 최대치다. 신한지주는 “은행 부문 이익이 안정적으로 증가하고 금융투자, 캐피탈 등 비은행 부문에서도 고르게 이익이 났다”며 “이자이익과 비이자이익이 모두 늘었고 대손 비용도 크지 않아 높은 실적을 낼 수 있었다”고 설명했다. 상반기 기준으로 순이자마진(NIM)은 2.11%로 2017년 말보다 0.05%포인트 올랐다. 이자이익은 4조1800억원으로 전년 동기 대비 10.5% 늘었다. 비이자이익은 8960억원으로 17.3% 증가했으며, 이 중 수수료 이익이 9960억원으로 20.8% 뛰었다. 대손충당금 전입액은 3530억원으로 지난해 상반기(-490억원) 보다 크게 늘었다. 그러나 대손비용률은 0.26%로 과거 5개년 평균치(0.42%)와 비교해 크게 떨어졌다. 계열사별로 살펴보면 신한은행은 상반기 순이익이 1조2718억원으로 1년 전보다 15.2% 증가했다. 지난 상반기말 기준 원화 대출금 잔액은 201조2940억원으로 지난해 말보다 3.0% 늘었다. 가계(2.9%)와 기업(3.1%) 모두 증가했으며 특히 소호(SOHO) 대출 잔액이 6.2% 늘어났다. 여기에 NIM은 1.62%로 전년 말보다 0.06%포인트 올라 이자이익은 지난해 상반기보다 14.0% 늘어난 2조7137억원을 기록했다. 신한카드와 금융투자 등 비은행 부문의 상반기 당기순이익은지난해 동기 보다 28.4% 줄어든 6198억원을 기록했다. 신한카드 순익이 2819억원으로 55.3% 감소한 영향이 컸다.  신한금융투자는 1827억원으로 94.9%, 신한캐피탈은 638억원으로 38. 3%가 각각 늘었다.  신한BNP파리바자산운용은 66억원으로 1.9% 증가했다. 반면,  신한생명은 700억원으로 7.5% 감소했다."
서울경제,055550,/news/news_read.nhn?article_id=0003075951&office_id=011&mode=search&query=신한지주&page=23,2017-07-21 08:32,"신한지주, 2분기 실적 개선에 가치주 매력 상승-삼성증권","[서울경제] 신한지주(055550)가 2·4분기 실적 개선에 가치주로서 매력을 키우고 있다. 21일 삼성증권은 신한지주가 2·4분기 예상을 뛰어넘는 실적을 기록했다며 밸류에이션 매력이 높아졌다고 평가했다. 김재우 삼성증권 연구원은 “신한지주가 주가순자산비율(PBR) 0,8배, 주가순이익비율(PER) 7.4배에 거래되는 가운데 순이자마진(NIM) 개선 싸이클이 진행 중에 있다”며 “자기자본이익률(ROE)이 10.8%까지 회복돼 밸류에이션 매력이 제고 여력이 충분하다”고 평가했다. 비은행 실적 개선 소식도 신한지주에 호재다. 김 연구원은 “ 2·4분기 중 비은행부문 이익은 3,621억원을 기록. 전분기대비 28.0% 감소했으나, 이는 1·4분기 중 인식한 신한카드의 대규모 충당금 환입에 따른 것”이라며 “이례 요인을 제외한 비은행 부문 이익은 전년동기대비 59.3% 증가한 것으로 추산된다”고 설명했다."
세계일보,055550,/news/news_read.nhn?article_id=0003135151&office_id=022&mode=search&query=신한지주&page=42,2017-01-11 18:11,신한지주 회장 후보 조용병&middot;위성호&middot;최방길 3명으로 압축,"강대석 사장 고사로 빠져…19일 최종면접 실시해 회장 내정 신한금융지주 회장후보추천위원회는 차기 회장 후보  가운데 최종면접 대상자를 확정지었다고 11일 밝혔다. 오는 19일로 예정된 최종 면접에 참가할 후보는 조용병 신한은행장, 위성호 신한카드 사장, 최방길 전 신한BNP파리바자산운용 사장 등 3명이다. 지난 9일 선정된 압축 후보군 중 강대석 신한금융투자 사장이 빠졌다.  강 사장은 ‘증권맨’으로서만 집중해 자본시장 발전에 기여하고 싶다며 고사한 것으로 알려졌다. 회추위는 앞으로 이들 세 후보의 성과 및 역량, 자격요건 적합여부 등을 종합적으로 검증할 방침이다. 이어 오는 19일 회추위를 개최, 평판조회 결과 리뷰 및 후보별 최종 면접 절차 등을 거쳐 차기 회장을 내정할 예정이다."
세계일보,055550,/news/news_read.nhn?article_id=0003138049&office_id=022&mode=search&query=신한지주&page=40,2017-01-19 19:56,"신한지주, 차기 회장에 조용병 신한은행장 내정","자산관리 전문가에 실적도 양호  …3월 주총 이후 취임
기존 경영전략 유지할 듯…""신한 문화 지키는 게 중요"""
