source,symbol,link,date,title,content
아시아경제,055550,/news/news_read.nhn?article_id=0003996184&office_id=277&mode=search&query=신한지주&page=27,2017-05-18 10:34,"신한지주, 신상훈 전 사장 스톡옵션 지급하기로","이사회 ""과거 문제로 현 경영진 부담줘선 안 돼""…'신한사태 마무리'엔 양측 입장차 여전  신상훈 전 신한금융지주 사장 [아시아경제 손선희 기자] 신한금융지주 이사회가 신상훈 전(前) 사장(현 우리은행 사외이사)에게 스톡옵션을 지급한다. 7년 전 이른바 '신한사태'에 따른 해묵은 갈등으로 현 경영진에게 더 이상 부담을 줘서는 안 된다는 일부 이사의 의견에 공감대가 형성됐다는 후문이다. 18일 금융권에 따르면 신한지주 이사회는 이날 오전 정기 이사회에 신 전 사장에 대한 스톡옵션 지급 안건을 추가할 계획이다. 10시 이사회 내 소위원회인 보수위원회에서 최종 논의를 거친 뒤 11시로 예정된 정기 이사회에 해당 안건을 추가로 부칠 예정이다. 경영진에 대한 평가 ·보상 체계를 결정 및 관리하는 신한지주 보수위원회는 이성량(위원장), 이상경, 필립 에이브릴 등 세 명의 사외이사로 구성돼 있다. 신 전 사장이 받게 될 스톡옵션은 과거 2005~2008년 근무에 대한 보수 격으로 총 23만7678주다. 이날 오전 신한지주 개장가(4만9100원)를 감안하면 신 전 사장이 스톡옵션 행사로 얻게 될 시세차익은 약 25억원이다. 과거 신한의 '넘버2'로 통했던 신 전 사장은 라응찬 전 회장과 갈등을 빚고 신한은행으로부터 고소당하는 과정에서 불명예 퇴진했다. 하지만 올초 신 전 사장이 대법원으로부터 주요 혐의에 대해 대부분 무죄 판결(일부 횡령 혐의 인정으로 2000만원 벌금형)을 받으면서 스톡옵션 지급 논란이 불거졌다. 신한지주 이사회 멤버는 전날 임시 이사회를 열고 스톡옵션 지급 여부에 대해 격론을 벌인 것으로 전해진다. 이어 이사회 전 멤버가 참석한 만찬 자리에서 이사회 의장을 맡고 있는 박철 전 한국은행 부총재가 ""7년 전 일로 조용병 회장에게 부담을 줘서야 되겠냐""며 ""(신한의) 미래를 위해 전향적으로 이사회에서 용단을 내리자""고 제안하면서 이사들의 의견이 모아졌다. 다만 스톡옵션 지급 결정이 신한사태의 진정한 마무리로 연결될 것이냐에 대해서는 양측의 입장 차가 감지된다. 신한 측에서는 이번 이사회의 결정을 '대승적 판단'으로 규정하는 반면 신 전 사장 측은 '신한사태는 조직의 문제'라고 주장해 온 만큼 경영진 차원의 추가 대화가 필요하다는 의견도 나온다."
아시아경제,055550,/news/news_read.nhn?article_id=0004174773&office_id=277&mode=search&query=신한지주&page=13,2018-02-08 07:29,"[클릭 e종목]&quot;신한지주, 올해 순익 3조원 시대 개막 기대&quot;","[아시아경제 조강욱 기자] 하나금융투자는 8일 신한지주에 대해 올해 순이익 3조원 달성이 가능할 전망이라며 투자의견 매수, 목표주가 6만2000원을 유지했다. 신한지주의 지난해 4분기 순이익은 2115억원으로 하나금융투자의 전망치인 2955억원을 하회했다. 비자주식매각 1309억원이 발생했으나 희망퇴직 2852억원과 충당금 및 감액손 2707억원과 출연금 530억원 등 일회성들이 많았다는 분석이다. NIM이 전분기대비 2bp하락했지만 4분기에만 대출이 1.9%내외 증가하면서 이자이익이 4.3%증가했다. 또 대손율은 0.34%로 매우 안정되고 있다. 고정이하비율이나 요주의비율이 양호하고 연체율도 하향안정세가 유지되고 있어 당분간 비용요인 부각은 크지 않을 것으로 전망됐다. 특히 소호 부분의 대출이 늘면서 연체율도 다시 안정세를 찾고 있어 전체적으로 내용은 좋은 것으로 평가됐다. 올해에도 이러한 추세가 유지되면서 분기당 8000억원 중반대의 순이익은 충분히 가능할 것으로 전망됐다. 지난해 신한지주는 전년대비 5.16% 증가한 2.92조원의 순이익을 시현했다. 올해 순이익은 3.0조원으로 전망됐다. 일회성의 역기저효과와 법인세 인상효과를 극복하고 성장을 보여주기는 만만치 않을 것이지만 세전이익단에서의 내용은 나쁘지 않을 것으로 예상됐다. 한정태 하나금융투자 연구원은 ""이제 기대하는 부분은 추가적인 이익체력 확대일 것""이라면서 ""해외비중 확대를 강조하고 있고 해외부문의 이익이 국내은행(지주) 중 가장 큰 상황이지만 의미있는 이익 비중과 모멘텀으로 작용하기에는 조금은 시간이 더 필요해 보인다""고 내다봤다."
전자신문,055550,/news/news_read.nhn?article_id=0002682650&office_id=030&mode=search&query=신한지주&page=12,2018-02-08 13:35,"[ET투자뉴스]신한지주, &quot;다양한 자본 활용을&hellip;&quot; 매수(유지)-SK증권","SK증권에서 8일 신한지주(055550)에 대해 ""다양한 자본 활용을 통한 주주가치 제고를 기대""라며 투자의견을 '매수(유지)'로 제시하였고, 아울러 목표주가로는 66,000원을 내놓았다. SK증권 김도하 애널리스트가 동종목에 대하여 이번에 제시한 '매수(유지)'의견은 SK증권의 직전 매매의견과 동일한 것이고 전년도말의 매매의견을 기준으로  볼때도 역시 '매수'의견이 계속 유지되고 있는 상태이다. 그리고 최근 분기내 발표된 전체 증권사 리포트의 컨센서스와 비교를 해볼 경우에 오늘 발표된 투자의견은 전체의견에 수렴하고 있어, 이번 의견은 시장의 평균적인 기대감이 객관적으로 표현된 것으로 분석되고 있다. 목표주가의 추이를 살펴보면 최근 한차례 레벨업 된 이후 이번에는 직전 수준을 유지하는 모습이다.  ◆ Report statistics목표주가는 2017년11월 64,000원이 저점으로 제시된 이후 이번에 발표된 66,000원까지 꾸준하게 상향조정되어 왔다.  &lt;컨센서스 하이라이트&gt;  컨센서스최고최저투자의견매수매수(유지)시장수익률(유지)목표주가62,51366,00057,000 *최근 분기기준 오늘 SK증권에서 발표된 '매수(유지)'의견 및 목표주가 66,000원은 전체의견에 수렴하면서 시장의 평균적인 기대감이 비교적 객관적으로 표현된 것으로 풀이되며 목표가평균 대비 5.6% 초과하고 있는 것으로 집계되었다.  참고로 최근에 목표주가를 가장 공격적으로 제시한 현대차투자증권에서 투자의견 '매수'에 목표주가 66,000원을 제일 보수적인 의견을 제시한 KTB투자증권에서 투자의견 '매수'에 목표주가 57,000원을 제시한 바 있다.   의견제시일자투자의견목표가격20180208매수(유지)66,00020180115매수(유지)66,00020171116매수(신규편입)64,000&lt;최근 리포트 동향&gt;의견제시일자증권사투자의견목표가20180208SK증권매수(유지)66,00020180208메리츠종금증권매수62,00020180208대신증권시장수익률(유지)57,00020180208한국투자증권매수(유지)65,000 (씽크풀에서 제공하는 컨센서스는 국내 전증권사에서 발표되는 기업분석 리포트 및 코멘트를 실시간으로 통계/분석처리되고 있습니다.)"
전자신문,055550,/news/news_read.nhn?article_id=0002682759&office_id=030&mode=search&query=신한지주&page=12,2018-02-08 14:48,"[ET투자뉴스]신한지주, &quot;2018년 순이익 &hellip;&quot; 매수-하나금융투자","하나금융투자에서 8일 신한지주(055550)에 대해 ""2018년 순이익 3.0조원은 가능할 전망""라며 투자의견을 '매수'로 제시하였다. 아울러 12개월 목표주가를 62,000원으로 내놓았다. 하나금융투자 한정태 애널리스트가 동종목에 대하여 이번에 제시한 '매수'의견은 하나금융투자의 직전 매매의견을 그대로 유지하는 것이고 전년도말의 매매의견을 기준으로  볼때도 역시 '매수'의견이 계속 유지되고 있는 상태이다. 그리고 최근 분기내 발표된 전체 증권사 리포트의 컨센서스와 비교를 해볼 경우에 오늘 발표된 투자의견은 대체적으로 평균치에 해당하는 수준으로, 이번 의견은 동종목에 대한 전체적인 흐름에서 크게 벗어나지 않은 것으로 분석되고 있다. 한편 12개월 목표주가로 제시한 62,000원은 직전에 발표된 목표가와 대비해서 큰 변화는 없고, 목표주가의 추이를 살펴보면 과거 상향조정되어오던 패턴이 최근 두차례 연속 같은 수준에 머물고 있는 모습이다.  ◆ Report statistics하나금융투자의 동종목에 대한 최근 1년동안의 투자의견은 전체적으로 큰 변화없이 유지되고 있다. 목표주가는 2017년2월 54,000원이 저점으로 제시된 이후 이번에 발표된 62,000원까지 꾸준하게 상향조정되어 왔다.  &lt;컨센서스 하이라이트&gt;  컨센서스최고최저투자의견매수매수(유지)시장수익률(유지)목표주가62,62966,00057,000 *최근 분기기준 오늘 하나금융투자에서 발표된 '매수'의견 및 목표주가 62,000원은 전체 컨센서스 대비해서 대체적으로 평균치에 해당하는 수준으로, 이번 의견은 동종목에 대한 전체적인 흐름에서 크게 벗어나지 않은 것으로 파악되며 목표가평균과 대비해서 미미한 차이가 나는 것으로 집계되었다.  참고로 최근에 목표주가를 가장 공격적으로 제시한 현대차투자증권에서 투자의견 '매수'에 목표주가 66,000원을 제일 보수적인 의견을 제시한 KTB투자증권에서 투자의견 '매수'에 목표주가 57,000원을 제시한 바 있다.  &lt;하나금융투자 투자의견 추이&gt; 의견제시일자투자의견목표가격20180208매수62,00020171031매수62,00020170721매수62,00020170523매수58,00020170209매수54,000&lt;최근 리포트 동향&gt;의견제시일자증권사투자의견목표가20180208하나금융투자매수62,00020180208유진투자증권매수(유지)60,00020180208NH투자증권매수(유지)65,00020180208SK증권매수(유지)66,000 (씽크풀에서 제공하는 컨센서스는 국내 전증권사에서 발표되는 기업분석 리포트 및 코멘트를 실시간으로 통계/분석처리되고 있습니다.)"
세계일보,055550,/news/news_read.nhn?article_id=0003132973&office_id=022&mode=search&query=신한지주&page=45,2017-01-04 20:02,"신한금융지주, 차기 회장 선임작업 돌입","신한금융지주 차기 회장을 추천하는 회장추천위원회(회추위)가 4일 개최됐다. 신한금융지주에 따르면 이 날 회추위 위원들은 대표이사 회장후보 추천 절차, 회의 일정 및 후보군 심의 기준 등 회의 운영과 관련된 내용을 논의했다. 또 회장 후보군을 현임 자회사 CEO와 전임 자회사 CEO 등 포괄적으로 구성하기로 결정하고 회장 후보들의 경력과 재임 중 성과 등도 함께 살폈다. 회추위는 오늘 검토한 후보군 중에서 압축된 후보군을 차기 회의에서 선정할 계획이다. 또 향후 일정 안내 및 후보 수락 여부 등을 확인해 최종 후보 추천 과정을 진행할 예정이다. 회추위가 신한금융그룹 경영승계계획에 따라 대표이사 회장 후보군을 추천하면 이후 개최되는 이사회에서 추천된 후보에 대해 적정성을 심의, 의결해 최종 후보를 확정하게 된다. 신한금융지주 관계자는 ""최종 대표이사 회장 후보는 오는 3월 신한금융지주 정기 주주총회의 승인을 거쳐 회장으로 취임하게 된다""고 말했다."
아시아경제,055550,/news/news_read.nhn?article_id=0003875689&office_id=277&mode=search&query=신한지주&page=47,2016-11-22 09:28,"[특징주]신한지주&middot;하나금융지주, POSCO의 지분 매각에 약세","[아시아경제 박선미 기자]신한지주와 하나금융지주가 22일 POSCO(포스코)의 지분 매각으로 약세다. 이날 오전 9시14분 현재 신한지주는 전일 대비 850원(1.93%) 내린 4만3100원에 거래되고 있다. 전날에도 회사 주가는 0.45% 하락했다. 하나금융지주 주가 역시 1.23% 하락한 3만2050원에 거래되고 있다. 금융투자업계에 따르면 포스코는 최근 이사회를 열고 보유 중인 신한금융지주 주식 436만9881주(지분율 0.92%)를 블록딜 방식으로 처분하기로 하고 전날 기관 수요 예측에 나섰다. 수요예측 결과 전일 종가(4만3950원) 대비 2.96% 할인된 가격인 주당 4만2650원에 거래가 진행됐다. 이번 신한지주 매각으로 POSCO는 약 1864억원(2.96% 할인율 적용)의 현금을 마련하게 됐다. 포스코는 이와는 별도로 하나금융지주 보유 주식 243만498주도 클럽딜 방식으로 처분한 것으로 알려졌다. 약 785억원 규모다. POSCO는 지분 매각 이유가 비핵심자산 정리를 통한 재무구조 개선의 일환이라고 입장을 밝히고 있지만 시장에서는 매각의 근본적인 이유가 우리은행 지분 매입을 위한 재원 마련이라는 얘기가 나오고 있다. 최정욱 대신증권 연구원은 ""우리은행 과점주주 매각 당시 POSCO가 미래에셋자산운용에 신탁 방식을 통해 지분 3%를 투자한다는 얘기가 있었다는 점을 상기해 볼 때 지분 매각의 근본적인 이유는 우리은행 지분 매입을 위한 재원 마련 차원""이라고 설명했다. 할인율을 감안할 경우 수급 우려에 따른 일시적인 신한지주 주가 약세는 불가피하고 하나금융에 대한 투자심리에도 부정적인 영향을 미칠 것이라는 게 최 연구원의 판단이다."
세계일보,055550,/news/news_read.nhn?article_id=0003157961&office_id=022&mode=search&query=신한지주&page=31,2017-03-24 03:00,[이코노 브리핑] 신한금융지주 조용병 회장 취임 외,"신한금융지주 조용병 회장 취임 신한금융지주는 23일 서울시 중구 신한은행 본사에서 제16기 주주총회를 열고 조용병(사진) 회장을 신임 회장으로 선임했다. 조 회장은 지난 1월 신한금융지주 회장추천위원회에서 한동우 전 회장의 뒤를 이을 차기 회장으로 내정된 바 있다. 조 회장은 취임사에서 “금융혁신의 시대, ‘명견만리’ 만리 밖의 일까지 꿰뚫어 보고, ‘선결·선행’ 빠르게 결정하고 신속히 실행해 대한민국 금융의 새 지평을 열겠다”고 밝혔다. 한편, 이날 열린 이사회 운영위원회에서는 지주 신임 부사장에 우영웅·진옥동 신한은행 부행장을 각각 선임했다. 롯데렌터카 태국 방콕서 영업 시작 롯데렌터카를 운영하는 롯데렌탈은 태국 방콕에 롯데렌터카 태국 법인(LOTTE rent-a-car THAILAND)을 출범하고 영업을 시작했다고 23일 밝혔다. 롯데렌터카 태국 법인은 연말까지 차량 렌털 400대, 매출 120억원을 달성할 것으로 기대하고 있다. 관광객을 위한 투어버스, 태국 주재 한국 기업과 글로벌 기업뿐 아니라 현지 기업을 대상으로 하는 통근버스·주재원 차량 등 맞춤형 장·단기 렌터카 서비스를 주력으로 제공할 예정이다. 롯데렌터카는 지난 2008년 베트남법인을 세우고 호찌민, 하노이, 다낭으로 진출지역을 확대한 바 있다. 이진경 기자 ⓒ 세상을 보는 눈, 글로벌 미디어 세계일보 세계일보 관련뉴스해당 언론사에서 선정하며 언론사 페이지(아웃링크)로 이동해 볼 수 있습니다.""참 나쁜 대통령""…그 때는 맞고 지금은 틀리다?이상아 ""매달 고정 지출만 800만원""최순실, 대통령과 통화후 ""아직도 지가 공주인 줄…""""아내와 여자친구 감사""…축구선수의 아찔한 말실수'1억 별풍선' 주고 BJ와 관계 맺은 남성의 결말"
전자신문,055550,/news/news_read.nhn?article_id=0002583343&office_id=030&mode=search&query=신한지주&page=35,2017-02-09 10:27,"[ET투자뉴스]신한지주, &quot;16년 연간 이자이&hellip;&quot; 매수-삼성증권","> 삼성증권에서 9일 신한지주(055550)에 대해 ""16년 연간 이자이익 Level-up에 초점""라며 투자의견을 '매수'로 제시하였고, 아울러 목표주가로는 57,000원을 내놓았다. 삼성증권 김재우 애널리스트가 동종목에 대하여 이번에 제시한 '매수'의견은 삼성증권의 직전 매매의견에서 큰 변화없이 그대로 유지되는 것이고  전년도말의 매매의견을 기준으로  볼때도 역시 '매수'의견이 계속 유지되고 있는 상태이다. 그리고 최근 분기내 발표된 전체 증권사 리포트의 컨센서스와 비교를 해볼 경우에 오늘 발표된 투자의견은 대체적으로 평균치에 해당하는 수준으로, 이번 의견은 동종목에 대한 전체적인 흐름에서 크게 벗어나지 않은 것으로 분석되고 있다. 목표주가의 추이를 살펴보면 최근 두차례 연속 상향조정되다가 이번에는 직전 목표가와 동일한 수준을 유지하는 모습이다. 또한 전일 종가 기준으로 볼때 동종목의 현주가는 이번에 제시된 목표가 대비 23.8%의 추가상승여력이 있다는 해석이 제시되고 있다."
머니S,055550,/news/news_read.nhn?article_id=0000301164&office_id=417&mode=search&query=신한지주&page=10,2018-03-09 17:52,"신한지주, ING생명 인수설에 &quot;확정된 사실 없다&quot;",신한지주는 ING생명 인수설에 대한 조회공시 요구에 “사업다각화 차원에서 M&A 추진을 검토해 왔으나 ING생명 지분 인수와 관련 확정된 사항은 없다”고 답했다. 회사 측은 “향후 결정되는 사항이 있을 경우 재공시 하겠다”고 덧붙였다. 
파이낸셜뉴스,055550,/news/news_read.nhn?article_id=0003773727&office_id=014&mode=search&query=신한지주&page=36,2017-02-08 16:09,"신한카드노동조합, 신한금융지주 자회사 배당정책에 반기","신한카드노동조합이 자회사 배당정책에 반기를 들었다. 신한카드노동조합(이하 ‘조합’)은 8일 과도한 배당을 반대하고 기업의 이익을 사회적 책임 이행에 써야 한다는 입장을 밝혔다. 조합 측은 이처럼 배당에 대해 경계의 목소리를 내는 이유로 그간 상대적으로 높았던 신한카드의 배당성향을 꼽았다. 신한카드는 지난 2007년 신한금융지주(이하 ‘지주’)의 자회사로 편입된 이후 2015년까지 9년간 총 6조1511억원의 현금배당을 해 왔다. 특히 2015년에는 당기순이익 6948억원보다 훨씬 많은 9000억원을 배당했다. 이 한 해에만 배당성향이 129.5%, 9년간 평균은 76.5%에 달한다. 이는 같은 기간인 9년간의 다른 자회사 배당성향인 신한은행 26.7%, 신한금융투자 19.0%, 신한생명 18.9%과 현격한 차이를 보인다는 지적이다. 자회사 간 업(業)의 특수성을 고려하더라도 너무나 높은 배당성향을 유지해 왔다는 것이다. 조합측 관계자는 “물론 지주가 신한카드의 지분 100%를 소유하고 있어 배당을 결정하는 것에 대해 법적으로는 아무런 하자가 없고 배당을 통해 신한카드의 수익기반이나 경쟁력이 약화된 것도 아니다”면서도 “지난 2016년 4월에 지주가 (구)LG카드 인수를 위해 조달했던 금액 6조7000억원을 모두 상환했는데, 이 금액의 대부분을 신한카드 배당을 통해 갚은 셈이고 이 과정에서 신한카드인들의 열정과 노고가 수반되었음을 인정해야 한다”고 강조했다. 신한카드 인수에 조달했던 대금도 신한카드의 손으로 모두 갚았으니 더 이상 단기적이고 무분별한 배당으로 신한카드를 지주 이익 창출을 위한 도구로 여겨서는 안 된다는 것이 조합 측 입장이다. 이성은 조합 위원장은 내부 게시글을 통해 “이제 신한카드도 당당하게 독립적인 금융회사로서의 사회적 책임을 다 해야 하고 그러기 위해서 지주는 회사의 자율성을 훼손하고 조직 구성원의 사기를 저하시키는 무분별한 배당 정책을 전면 재검토 해야 한다”고 전했다."
