source,symbol,link,date,title,content
헤럴드경제,055550,/news/news_read.nhn?article_id=0001351480&office_id=016&mode=search&query=신한지주&page=13,2018-02-07 16:21,"신한지주, 지난해 순익 2조9000억원&hellip;2011년 이후 최대","4년 연속 당기순익 증가 불구KB와 ‘리딩뱅크’ 다툼에선 ‘석패’ 예상 [헤럴드경제=도현정 기자]신한금융지주가 지난해 2조9000억여원의 순이익을 거두면서 2011년 이후 최고의 실적을 거뒀다. 하지만 4분기 희망퇴직 비용 등 일회성 요인으로 순익 3조원 고지를 넘지는 못했다. 이에 따라 ‘리딩뱅크’ 자리를 두고 경쟁하는 KB금융에 석패할 것으로 예상된다. 신한지주는 7일 지난해 2조9179억원의 순이익을 냈다고 공시했다. 이는 2016년과 비교할 때 5.2% 늘었다. 이와 함께 3조1000억원을 기록한 2011년 이후 가장 높은 수준이다. 하지만 4분기만 놓고 보면 순익이 2115억원에 불과해 전년 동기보다 65.4% 줄었다. 4분기에 명예퇴직금이 2850억원 발생해 전년보다 1800억원 가량 늘었기 때문이다. 딜라이브 유가증권 손실분 1500억원도 4분기에 반영됐다. 대우조선해양(300억원)과 금호타이어(300억원), 동부제철(620억원) 등에서 1200억원을 충당금으로 쌓은 점도 영향을 미쳤다. 계열사별로 보면 신한은행은 지난해 1조7110억원의 순익을 기록하며, 전년 대비 11.8% 감소했다. 원화 대출금은 195조4970억원으로 5.9% 늘어 이자이익이 10.8% 늘어난 4조9921억원을 기록했다. 원화 예수금도 197조3550억원으로 5.0% 늘었고, 특히 요구불예금 등 유동성 핵심 예금이 9.5% 늘어나 조달비용이 낮아졌다. 덕분에 4분기까지 NIM은 1.56%로 전년 말보다 0.07%포인트 올라갔다. 하지만 비이자이익은 7907억원으로 23.5% 감소했다. 유가증권 매각 이익이 줄었고, 1회성 유가증권 감액이 발생해서다. 대손충당금 전입액은 4603억원으로 33.1% 줄었고, 판매관리비는 희망퇴직 비용 증가 등으로 7.9% 늘어난 3조1181억원을 기록했다. 지난해 말 기준 연체율은 0.23%로 0.05%포인트 낮아졌고, 부실채권(NPL) 비율도 0.55%로 은행설립 후 최저 수준을 기록했다. 신한카드는 순익이 전년 대비 27.6% 증가한 9138억원을 달성했다. 다만 4분기에만 놓고 보면 전 분기보다10.9% 줄어든 1332억원으로 쪼그라들었다. 신한금융투자는 83.6% 늘어난 2119억원의 순이익을 올렸고, 신한생명은 19.9% 줄어든 1206억원을 기록했다. 신한캐피탈은 876억원으로, 순익이 158.8% 증가했다. 한편 신한지주는 이날 이사회를 열고 보통주 1주당 1450원의 현금배당을 결의했다. 이는 지난해와 같은 수준이다. 배당성향은 23.6%로 전년(24.8%)보다 소폭 떨어졌다."
데일리안,055550,/news/news_read.nhn?article_id=0002163962&office_id=119&mode=search&query=신한지주&page=38,2017-01-24 09:38,[인사]신한금융지주,"△M2승진 ▲시너지추진팀 부장 김성주 ▲HR팀 부장 신현민 △M1승진 ▲경영지원팀 부장 예상욱 데일리안 이나영 기자 ⓒ (주)데일리안 - 무단전재, 변형, 무단배포 금지"
연합뉴스,055550,/news/news_read.nhn?article_id=0009004313&office_id=001&mode=search&query=신한지주&page=38,2017-02-03 08:28,"미래에셋대우 &quot;신한지주, 이익 개선과 고배당 매력&quot;","(서울=연합뉴스) 윤선희 기자 = 미래에셋대우는 3일 신한금융지주가 높은 이익률과 배당을 유지할 것이라며 투자의견 매수와 목표주가 5만9천원을 제시했다. 강혜승 연구원은 ""신한지주의 작년 4분기 순이익은 전년 같은 기간보다 19% 늘어난 4천810억원으로 시장 기대를 웃돈 것으로 추정한다""며 ""양호한 실적은 희망퇴직 비용 발생에도 보유 주식 매각과 충당금 환입에 따른 것""이라고 설명했다. 그는 ""신한지주의 올해 순이익은 2조7천760억원으로 작년보다 5% 늘어나고 자기자본이익률(ROE)은 8.6%로 0.06%포인트 개선될 것""이라며 ""순이자 이윤 개선으로 순이자 이익이 의미 있게 늘어나고 충당금 비용 감소, 보유 자산 매각 등으로 이익 개선이 기대된다""고 말했다. 그는 또 ""신한지주의 올해와 내년 주당 배당금은 각각 1천650원과 1천800원으로 추정한다""며 ""배당수익률이 작년 결산 결과 3.3%에서 올해 3.6%, 내년 3.9%로 높아질 것""이라고 덧붙였다."
조세일보,055550,/news/news_read.nhn?article_id=0002178552&office_id=123&mode=search&query=신한지주&page=13,2018-02-07 17:31,"신한금융지주, 지난해 순익 2조9179억원&hellip;전년비 5.2% &uarr;",◆…자료=신한금융지주
연합뉴스,055550,/news/news_read.nhn?article_id=0009009507&office_id=001&mode=search&query=신한지주&page=37,2017-02-05 20:32,"신한지주, 7일 차기 신한은행장 뽑는다&hellip;위성호 유력","김형진 부사장, 임영진 부사장도 후보로 거론 (서울=연합뉴스) 박의래 기자 = 신한금융지주가 오는 7일 차기 신한은행장을 선출한다. 5일 금융권에 따르면 신한금융은 7일 자회사경영관리위원회(자경위)를 열고 차기 신한은행장을 뽑는다. 신한은행장은 차기 신한금융 회장으로 내정된 조용병 현 행장이 오는 3월에 열릴 주주총회에서 회장에 선임되면 공석이 된다. 차기 신한은행장을 뽑는 자경위는 한동우 현 신한금융 회장과 사외이사인 박철 전 한국은행 부총재, 고부인 전 도쿄 한국상공회의소 부회장, 이흔야 전 재일한국상공회의소 상임이사, 이만우 고려대 경영학과 교수로 구성돼 있다. 금융권에서는 한 회장과 재일교포 주주들의 생각에 따라 차기 행장이 결정될 것으로 보고 있다. 자경위에는 속해있지 않지만 조 행장의 의견도 비중 있게 다뤄질 전망이다. 이로 바탕으로 금융권이나 신한금융 안에서는 위성호 신한카드 사장이 차기 신한은행장으로 유력하다고 예상한다. 위 사장은 조 행장과 차기 신한금융 회장을 두고 경쟁할 정도로 그룹 내 위상이 높다. 그러나 지난달 19일 차기 회장을 뽑는 최종 면접에서 ""신한의 미래를 위해 조 행장이 회장이 되는 것이 순리라고 생각한다""며 ""차기 회장을 도와 조직의 발전에 기여하고 싶다""며 후보직 사퇴의 뜻을 밝혔다. 경영 면에서도 2013년부터 신한금융 계열사 중 신한은행 다음으로 큰 신한카드를 이끌며 업계 1위 자리를 확고히 하는 실력을 보여줬다. 신한카드에서 판(FAN) 브랜드를 만들어 신한금융 전체 멤버십 플랫폼 브랜드로 키우고 빅데이터와 인공지능을 영업에 접목시키는 등 급변하는 금융 환경에서 미래 성장 동력을 발굴하는 능력도 보여줬다. 위 사장은 1958년 서울 출생으로 서울고와 고려대 경제학과를 졸업했다. 1985년 신한은행에 입행해 신한금융 경영관리담당 상무와 부사장, 신한은행 자산관리그룹 부행장을 역임했다. 위 사장 외에도 김형진 신한금융 부사장과 임영진 신한금융 부사장도 차기 행장 후보로 거론된다. 김 부사장은 이전부터 위 사장, 이성락 전 신한생명 사장과 함께 1958년생 개띠 트로이카로 불리며 '신한의 미래'라는 평가를 받았다. 1958년생으로 경북고와 영남대 경영학과를 나와 1983년 신한은행에 입행했다. 신한은행 인사부장과 기업그룹담당 부행장, 신한데이타시스템 사장을 역임했으며 2013년부터 신한금융 부사장을 맡고 있다. 임영진 신한금융 부사장은 2015년 고(故) 서진원 행장이 와병으로 은행장 자리를 맡지 못하게 되자 행장 직무대행을 맡아 은행을 무난하게 이끌었던 경험이 있다. 1960년생으로 수성고와 고려대 경영학과를 나와 1986년 신한은행에 입행했다. 신한은행에서 영업추진본부장과 자산관리그룹 부행장 등을 역임했고 2015년부터 신한금융 부사장을 맡고 있다. 신임 신한은행장은 자경위를 거쳐 내달 열리는 신한은행 주주총회에서 최종 선임된다. (왼쪽부터) 차기 신한은행장으로 거론되는 위성호 신한카드 사장과 김형진 신한금융 부사장, 임영진 신한금융 부사장. [연합뉴스 자료사진]"
머니투데이,055550,/news/news_read.nhn?article_id=0003860696&office_id=008&mode=search&query=신한지주&page=28,2017-04-21 08:01,"신한지주, 실적호조와 높은 수익성으로 양호한 주가 흐름-KB證","[머니투데이 진경진 기자] KB증권은 신한지주 에 대해 실적 호조와 높은 수익성을 바탕으로 양호한 주가 흐름이 지속될 것이라고 전망했다. 이에 투자의견 매수, 목표주가 5만5000원을 유지했다. 유승창·유현정 연구원은 21일 ""신한지주의 올 1분기 지배주주 순이익은 전년대비 29.3% 오른 9971억원으로 시장 컨센서스(6797억원)와 KB증권 예상치(6795억원)를 크게 상회하는 실적을 기록했다""고 설명했다. 이들 연구원은 ""특히 순이자 마진이 예상보다 크게 상승한 점과 대손비용률이 크게 하락했다""며 ""올 1분기 그룹 순이자마진은 2.01%로 전분기대비 4bp 상승해 향후 현 수준의 시장금리가 이어질 경우 추가적인 순이자마진 개선이 가능할 전망""이라고 내다봤다. 그러면서 ""대손충당금 전입액은 -1965억원 환입을 기록했는데 이는 신용리스크 내부등급법을 적용해 신한카드에서 3639억원 수준의 대손충당금 환입이 발생했기 때문""이라며 ""대규모 대손충당금 환입을 감안해도 신한지주의 1분기 대손충당금은 1674억원 수준으로 크게 감소했다""고 분석했다. 이어 ""신한지주의 리스크관리능력을 감안할 때 향후 대손비용률은 35bp 내외의 경상적 수준에서 유지될 것""이라고 전망했다. 이들 연구원은 ""시장 컨센서스를 크게 상회하는 양호한 1분기 실적과 업종 내 최고 수준의 이익창출력을 바탕으로 향후 양호한 주가 흐름을 기록할 전망""이라며 ""지속적인 배당성향 상승을 통해 올해 예상 배당 수익률은 3.1%를 기록할 전망""이라고 기대했다. textlinktopstart textlinktopend textlinkstart"
한국경제TV,055550,/news/news_read.nhn?article_id=0000599863&office_id=215&mode=search&query=신한지주&page=14,2018-02-06 13:00,"신한지주, 전일 대비 약 -5% 하락한 49,700원","[한국경제TV 라이온봇 기자] 신한지주는 2월 6일 13시 0분 전일 대비 약 -5% 하락한 49,700원에 거래되고 있다. 신한지주는 코스피 상장 기업으로 금융업 업종에 속해 있다. 시가총액은 24조8,954억원으로 코스피 상장기업 중 11위에 위치 해 있다. [종목 성향 진단] [그림 1] 종목 성향 진단 신한지주의 투자 스타일은 가치주에 가깝다. 기업 가치 대비 낮은 주가가 매력적인 기업이다. 주가 모멘텀은 평범한 수준이었다. 최근 1개월 수익률이 6.28%, 3개월 수익률은 6.28%, 6개월 수익률은 6.28%를 기록했다. 신한지주 종목에 대한 투자자의 관심도는 굉장히 높은 편이다. [투자 점수 진단] [그림 2] 투자 점수 진단 신한지주는 수익성(영업이익률) 측면에서 두각을 나타내고 있다. 최근 영업이익률은 90점으로 6개의 핵심 팩터 중 가장 높은 점수를 기록했다. 영업이익률은  전체 시장 내 190위를 기록하며 상위 9.69%에 위치했다. 업종별로는 18위를 기록하며 상위 22.67%에 위치했다. 그리고 저평가성1(PER) 역시 도드라지는 편이다. 저평가성1 점수는 83점으로 두번째로 높은 점수를 기록했다. PER은 전체 시장 내 312위를 기록하며 상위 16.69%에 위치했다. 업종별로는 23위를 기록하며 상위 29.73%에 위치했다. 그러나 부채비율과 ROA는  아쉬움을 나타냈다. [종합 투자점수] 라이온봇 기자 -한국경제TV[그림 3] 종합 투자점수 AI 인공지능 분석을 통한 신한지주의 종목 종합 스코어는 67점을 기록했다. 이는 동일 업종 평균점수인 61점과 시장 평균점수인 57점를 상회하는 수치였다. (위의 AI인공지능 점수는 재무 데이터를 기반으로 전체 상장 종목과 비교/분석하여 도출한 점수로 높은 점수가 반드시 높은 수익률을 보장하지 않습니다. 위의 자료는 당사의 추천 종목이 아니며, 투자 시 참고용으로 제시해드리는 것입니다.) ※ 본 기사는 한국경제TV와 '거장들의 투자공식이'자체 개발한 '라이온봇 기자'가 실시간으로 작성한 기사입니다. 라이온봇기자 ⓒ 한국경제TV, 무단 전재 및 재배포 금지 한국경제TV 관련뉴스해당 언론사에서 선정하며 언론사 페이지(아웃링크)로 이동해 볼 수 있습니다.'오달수의 그녀' 채국희, 승무원 출신? 채시라 동생?도도맘 전 남편 조용제 씨 ""불륜사건은 강용석과 나와의 싸움""박삼구 아시아나 회장도 성추행 논란…승무원들 상대로?'굿모닝FM 하차' 문지애 집…""아나운서 집이 왜 이래""태양♥민효린 결혼, 영화 포스터같은 웨딩화보 '시선집중'"
세계일보,055550,/news/news_read.nhn?article_id=0003174373&office_id=022&mode=search&query=신한지주&page=26,2017-05-18 16:37,신상훈 전 신한지주 사장 25억 규모 스톡옵션 행사 허용,"신한금융지주(회장 조용병)는 18일 열린 정기이사회에서 신상훈 전 사장 등 3인에 대해 그간 행사가 보류된 스톡옵션의 보류 해제를 결정했다.  이들 3인은 횡령, 배임 등의 혐의로 검찰에 고발된 뒤 스톡옵션을 행사할 수 없는 상태였다.  이에 따라 신 전 사장은 지난 2005~2007년 부여된 스톡옵션 20만8540주를 행사할 수 있게 됐다. 신 전 사장은 총 23만7678주의 스톡옵션을 지급받았으나 2008년분 2만9138주는 보류가 풀리지 않았다.  또 이백순 전 신한은행장도 스톡옵션 5만2969주, 이정원 전 신한데이타시스템 사장은 1만5024주의 행사 보류가 해제됐다. 신한지주 관계자는 “대법원 판결 후 사외이사로 구성된 사전 검토단을 통해 법률, 관련사례 등에 대한 심도 있는 검토를 했다”며 “동시에 총 3차에 걸친 이사회의 충분한 논의 과정을 통해 보류 해제 결정이 이뤄졌다”고 말했다. 그는 “이번 결정이 신한금융그룹의 힘을 하나로 통합해 미래를 향해 나아갈 수 있는 단초가 되길 기대한다”고 덧붙였다. 금융권 고위관계자는 “스톡옵션 보류 해제를 미룰수록 논란만 거듭될 우려가 높아 신한지주 이사들이 깔끔하게 털고 가기로 결정한 듯 하다”고 분석했다. 신한지주는 향후 대상자의 권리행사가 이뤄지는 대로 행사차익을 지급할 예정이다. 18일 종가(4만8700원)를 기준으로 할 때 신 전 사장은 약 25억원의 행사차익을 거둘 것으로 추산된다. "
매일경제,055550,/news/news_read.nhn?article_id=0003899726&office_id=009&mode=search&query=신한지주&page=34,2017-03-06 16:51,신임 신한카드 사장에 임영진 신한금융지주 부사장 내정(속보),[디지털뉴스국] r_start // r_end //
연합뉴스,055550,/news/news_read.nhn?article_id=0008904511&office_id=001&mode=search&query=신한지주&page=45,2016-12-21 09:20,&lt;특징주&gt; 은행주 동반 강세 속 신한지주 신고가,"(서울=연합뉴스) 윤선희 기자 = 미국의 금리 인상 여파로 시중금리 상승 기대감이 확산하면서 은행업종 대표주인 신한금융지주가 21일 신고가를 경신했다. 오전 9시8분 유가증권시장에서 신한지주는 2.43% 오른 4만8천400원을 기록해 52주 신고가를 새로 썼다. KB금융지주도 1.25% 오른 4만4천550원에 거래되고 있다. 하나금융지주, 우리은행, 기업은행, BNK금융지주 등 은행주들이 모두 강보합권에서 상승을 시도하고 있다. 은행주의 동반 오름세는 미국의 기준금리 인상 영향으로 국내 시중 금리가 상승세를 탈 것이라는 기대감이 커지고 있기 때문이다. 통상 시중 금리가 오르면 은행들은 순이자마진(NIM)이 개선돼 이익 증가 효과를 거둔다. 은행권 주택담보대출 금리의 기준이 되는 코픽스 금리는 지난달 0.1%포인트 올라 석 달 연속 상승세를 보였다. 김재우 삼성증권 연구원은 ""코픽스 금리의 상승으로 은행의 내년 1분기 순이자마진이 회복세를 보일 가능성이 크다""고 말했다."
전자신문,055550,/news/news_read.nhn?article_id=0002682421&office_id=030&mode=search&query=신한지주&page=13,2018-02-07 17:38,"신한금융지주, 지난해 순익 2조9000억원&hellip;2011년 이후 최대","신한금융지주가 지난해 2조9000억여원의 순이익을 거두면서 2011년 이후 최고 실적을 거뒀다. 다만 지난 4분기에 희망퇴직 비용 등 일회성 비용이 생기면서 순이익이 3조원이 넘을 것이란 전망치에는 미치지 못했다. 신한금융지주는 7일 지난해 2조9179억원의 순이익을 냈다고 밝혔다. 2016년과 비교해 5.2% 늘어난 수치다. 다만 4분기에는 2115억원의 순이익을 올려 전년 동기보다 65.4% 줄었다. 4분기에만 명예퇴직금이 2850억원이 발생해 전년보다 1800억원 가량 늘었고, 딜라이브 유가증권 손실 1500억원도 반영했다. 또 대우조선해양(300억원)과 금호타이어(300억원), 동부제철(620억원) 등으로 1200억원의 충당금을 쌓았다. 총 4500억원 가량의 1회성 비용이 발생했다. 계열사별로 신한은행은 지난해 1조7110억원의 순익을 기록, 전년 대비 11.8% 감소했다. 지난해 원화 대출금은 195조4970억원으로 전년 말 대비 5.9% 늘어나면서 이자 이익은 10.8% 늘어난 4조9921억원을 기록했다. 원화 예수금은 197조3550억원으로 5.0% 늘었고, 특히 요구불예금 등 유동성 핵심 예금이 9.5% 늘어나 조달비용이 개선됐다. 이 덕분에 4분기까지 순이자마진(NIM)은 1.56%로 전년 말 보다 0.07%P 올라갔다. 비이자이익은 7907억원으로 23.5% 감소했다. 유가증권 매각 이익이 줄었고 1회성 유가증권 감액이 발생했다. 대손충당금 전입액은 4603억원으로 33.1% 줄었고, 판매관리비는 희망퇴직비용 증가 등으로 7.9% 늘어난 3조1181억원을 기록했다. 지난해 말 기준 연체율은 0.23%로 0.05% 줄었고 부실채권(NPL) 비율도 0.55%로 은행설립 후 최저 수준을 기록했다. 또 다른 주력 계열사인 신한카드는 전년 대비 27.6% 증가한 9138억원의 순익을 올렸다. 매출이 꾸준히 늘었고 저금리가 장기간 이어지며 조달비용은 줄었다. 다만 4분기 순이익은 1332억원으로 전 분기 대비 10.9% 줄었다. 12월 말 기준 신한카드의 1개월 이상 연체율은 1.27%로 전년 대비 0.16%P 떨어졌고, NPL 비율은 1.04%로 0.12%P 낮아졌다. 신한금융투자는 2119억원의 순이익을 올려 전년 동기 대비 83.6% 증가했고, 신한생명은 1206억원으로 19.9% 감소했다. 신한캐피탈은 876억원 순익으로 158.8% 증가했다. 한편 신한금융지주 이사회는 이날 2017 회계연도 보통주 1주당 1450원의 현금배당을 결의했다. 지난해와 같은 수준이다. 배당성향은 23.6%로 전년(24.8%)보다 소폭 떨어졌다."
이데일리,055550,/news/news_read.nhn?article_id=0003732842&office_id=018&mode=search&query=신한지주&page=38,2017-01-23 06:01,"&quot;신한지주&middot;하나금융, 딜라이브 탓에 4Q 200억 추가 충당금 부담&quot;","[이데일리 노희준 기자] 신한지주(055550)와 하나금융지주(086790)가 종합유선방송업체 딜라이브(옛 씨앤앰) 여신에 대한 대손충당금으로 지난해 4분기에 400억원 가량을 추가 적립할 것이라는 분석이 나왔다. 그만큼 순이익이 줄어든다는 얘기다. 최정욱 대신증권 애널리스트는 23일 보고서를 통해 “지난해 4분기 딜라이브 여신에 대한 은행의 충당금 추가 적립이 불가피할 전망”이라며 “출자전환(갚아야 할 채무의 주식전환) 외의 잔여여신에 대해 건전성이 요주의로 하향될 것으로 예상되기 때문”이라고 말했다. 대신증권에 따르면 딜라이브 잔여여신은 KB금융(105560) 692억원, 신한지주 2292억원, 하나금융 2591억원, BNK금융 128억원 등이다. 문제는 신한지주와 하나금융가 딜라이트 여신을 지난해 3분기 기준으로 ‘정상’으로 분류하고 있다는 점이다. 최 애널리스트는 “잔여 여신을 요주의로 재분류할 경우 각각 7% 내외의 충당금 추가 적립이 예상된다”며 “신한지주와 하나금융은 4분기 200억원 내외의 추가 부담이 발생할 듯하다”고 설명했다. 대손충당금인 채권부실에 대비해 적립하는 돈으로 충당금이 늘면 순이익이 깎인다. 금융회사는 채권의 여신 건전성을 적기 상환 가능성 등을 기준으로 정상·요주의·고정·회수의문·추정손실 5단계로 분류해 충당금을 달리 쌓고 있다. 기업대출 기준으로 정상 0.85% 이상, 요주의 7% 이상, 고정 20% 이상, 회수의문 50% 이상, 추정손실 100%로 쌓는다. 딜라이브는 2013년부터 매각되는 과정에서 유동성 위기에 몰려 금융권 대출을 연체하는 등 부도위기에 몰렸었다. 이에 지난해 금융권은 출자전환 등 채무 재조정에 나섰다. 앞서 KB금융은 지난해 3분기 딜라이브 여신을 회수의문으로 분류해 480억원의 충당금을 쌓은 바 있다. 그는 “대우조선(042660)에 대한 충당금 추가 적립 이슈는 크게 발생하지 않을 것”이라며 “기존 적립률의 상향 가능성보다는 선수금환급보증(RG) 등 추가 지원 부분에서만 충당금을 추가로 적립할 가능성이 높다”고 강조했다. 은행별 부담은 100억원을 넘지 않을 것이란 전망이다."
뉴시스,055550,/news/news_read.nhn?article_id=0008435243&office_id=003&mode=search&query=신한지주&page=13,2018-02-07 18:27,"신한금융지주, 작년 당기순익 2조9000억원 달성","【서울=뉴시스】 【서울=뉴시스】금융팀 = 신한금융지주는 7일 실적발표를 통해 2017년 당기순이익 2조9179억원을 달성했다고 밝혔다. 이는 2016년의 2조7748억원에 비해 5.2% 늘어난 것이며 2011년 3조1000억원에 이어 설립 이후 두 번째로 높은 실적이다. 신한금융에 따르면 신한은행의 2017년 순이익은 4분기 희망퇴직 등 일회성 비용 증가 영향으로 전년보다 11.8% 감소한 1조7110억원을 기록했다. 4분기 순이익은 151억원으로 전 분기 대비 97.4% 감소했다. 지난해 비은행 부문 당기순이익 비중은 2016년 35%보다 9%p 오른 44%를 차지했다. 지난해 신한카드 당기순이익은 9138억원으로 전년 대비 27.6% 증가했고, 4분기 순이익은 1332억원으로 전분기 대비 10.9% 감소했다. 신한금융투자의 당기순이익은 2119억원으로 전년 대비 83.6% 증가했다. 신한생명의 당기순이익은 1206억원으로 전년 대비 19.9% 감소했다. 신한캐피탈의 당기순이익은 876억원으로 전년 대비 158.8% 증가했다. 신한BNP파리바자산운용의 당기순이익은 128억원이며, 신한저축은행은 168억원의 순이익을 기록했다."
