source,symbol,link,date,title,content
디지털타임스,057050,/news/news_read.nhn?article_id=0002470381&office_id=029&mode=search&query=현대홈쇼핑&page=10,2018-06-28 10:10,"현대홈쇼핑, 인문학강연 프로그램 `심야책방` 진행","현대홈쇼핑의 인문학강연 프로그램 '심야책방' 홍보 이미지 &lt;현대홈쇼핑 제공&gt;     [디지털타임스 박민영 기자] 현대홈쇼핑이 강연과 도서 판매를 결합한 교양 프로그램을 선보인다. 현대홈쇼핑은 30일 오전 1시에 최진기 강사가 출연하는 인문학강연 프로그램인 '심야책방'을 진행한다고 28일 밝혔다. 최 강사는 '한 권으로 정리하는 4차 산업혁명'의 저자다. 그는 이날 방송에서 4차 산업혁명에 관한 3가지 주제로 약 5∼7분간 특강을 한다. 저자 사인이 들어간 책도 판매할 예정이다. 현대홈쇼핑은 교보문고와 함께 강연과 홈쇼핑을 결합한 프로그램을 기획했다. 방송에는 연예인 딘딘과 슬리피가 출연한다. 현대홈쇼핑 관계자는 ""각 분야의 전문가가 출연해 강연하고 연예인들이 강연을 듣는 프로그램을 벤치마킹했다""며 ""홈쇼핑 방송세트와 화면 구도까지 확실히 차별화할 것""이라고 말했다."
매일경제,057050,/news/news_read.nhn?article_id=0004166811&office_id=009&mode=search&query=현대홈쇼핑&page=12,2018-06-12 14:40,유닉스전자 `에어샷 플라즈마 시스템` 현대홈쇼핑 판매,손상모 개선 효과 극대화한 프리미엄 헤어드라이어 에어샷 플라즈마 드라이어(화이트) [사진제공 = 유닉스전자] 뷰티 가전 전문기업 유닉스전자가 프리미엄 헤어드라이어 '에어샷 플라즈마 시스템'을 오는 13일 오후 3시 40분부터 현대홈쇼핑에서 생방송 판매를 진행한다. 유닉스전자는 홈쇼핑 론칭 기념으로 프리미엄 헤어드라이어 '에어샷 플라즈마 시스템' 가격 할인과 함께 제품 구매 시 헤어 고데기를 증정하는 혜택을 제공한다. 일시불 결제 시 1만원 할인 및 현대 홈쇼핑 모바일 앱 이용 시 10% 추가 할인까지 적용된 역대 최저가 판매로 소비자들의 마음을 사로잡을 예정이다. 유닉스전자는 지난 2월 창립 40주년을 기념해 손상모 개선 효과가 입증된 프리미엄 헤어드라이어 '에어샷 플라즈마 시스템'을 출시했다. 40년 간 축적된 노하우와 기술로 개발한 '에어샷 플라즈마 시스템'은 모발 건조 및 손상 최소화에 그쳤던 기존 헤어드라이어의 기능을 넘어 손상모를 개선해준다. [이영욱 기자] r_start // r_end //
파이낸셜뉴스,057050,/news/news_read.nhn?article_id=0004036013&office_id=014&mode=search&query=현대홈쇼핑&page=13,2018-06-08 08:50,"어바웃미, 완판아이템 &lsquo;메디앤서 콜라겐 리프트업 밴드&rsquo; 현대홈쇼핑서 선봬","‘메디앤서 콜라겐 리프트업 밴드’    ‘어바웃미’가 9일 현대홈쇼핑의 라이프스타일링 프로그램인 ‘최현우의 초이스’에서 ‘메디앤서 콜라겐 리프트업 밴드’ 생방송을 진행한다고 8일 밝혔다. 메디앤서 콜라겐 리프트업 밴드는 탄성력과 복원력이 우수한 ESB 밴드를 적용해 귀에 걸 필요 없이 턱에 붙여 간편하게 사용할 수 있는 리프팅 마스크로, 콜라겐 펩타이드, PGLA, 트라이라겐 성분 등을 마스크에 담았으며, 삼양바이오팜의 TDS(Transdermal Delivery System) 기술을 적용해 유효 성분의 흡수를 돕는 것이 특징이다. 최근 진행된 홈쇼핑 방송에서도 완판을 기록하는 등 큰 인기를 얻으며, 출시 1년만에 100만장 판매를 돌파했다. 이번 현대홈쇼핑 방송에서는 합리적인 가격으로 풍성하게 기획한 본구성과 함께 상품평 작성 시 또 한 번 제공되는 세트가 눈길을 끈다. 본구성으로는 메디앤서 콜라겐 리프트업 밴드 9박스(1박스 4매입) 및 낱장 4매에 무료체험용으로 1매를 추가했으며, 최근 선보인 메디앤서 콜라겐 퍼밍업 젤스킨과 에멀전을 포함했다. 또한 상품평을 작성한 고객에게는 메디앤서 콜라겐 리프트업 밴드 1박스와 메디앤서 콜라겐 퍼밍업 캡슐 세럼 1개를 증정한다. 어바웃미 홈쇼핑담당 노성한 부장은 “이번 현대홈쇼핑 ‘최현우의 초이스’ 방송에서는 평소 탄력 및 리프팅 케어에 관심이 많은 고객들이 보다 합리적인 가격에 더 많은 제품을 경험할 수 있도록 기획세트를 구성하는데 중점을 뒀다”고 말했다."
머니투데이,057050,/news/news_read.nhn?article_id=0004065957&office_id=008&mode=search&query=현대홈쇼핑&page=12,2018-06-17 13:20,현대홈쇼핑 &quot; 中企 해외진출 항공료&middot;숙박비 지원&quot;,"[머니투데이 박진영 기자] [약 1000만 달러 수출 상담 실적 달성 및 10개 기업 현지 방송 론칭 목표] 현대홈쇼핑이 태국 시장 진출을 희망하는 국내 중소기업들을 지원한다. 현대홈쇼핑은 국내 중소기업들을 대상으로 '중소기업 제품 해외시장 현지화 조사단' 프로그램을 다음 달 3일부터 6일까지 태국 방콕에서 진행한다고 17일 밝혔다. 앞서 현대홈쇼핑은 프로그램 참여 모집 공고를 내고 상품의 경쟁력, 태국 현지 시장 판매 적합성 등을 평가해 주방·뷰티·미용·생활 부문 중소기업 20곳을 선정했다. 특히 현대홈쇼핑은 이번 조사단에 참여한 전 중소기업에 태국 왕복 항공료와 숙박비를 전액 지원한다. 태국은 아세안 10개국 중 인도네시아에 이어 두 번째로 경제 규모가 크고 중산층이 두텁다. 한류 영향으로 국내 상품에 대한 관심이 높아 해외 진출을 계획하고 있는 국내 중소기업들이 가장 먼저 고려하는 국가 중 하나로 꼽힌다. 현대홈쇼핑도 2016년 태국 방송통신 1위 기업 인터치그룹 자회사인 '인터치미디어'와 함께 '하이(HIGH)쇼핑' 현지 법인을 설립해 TV홈쇼핑과 온라인 채널을 운영 중이다. 이번 사업은 중소기업 해외시장 판로개척의 일환으로 현대홈쇼핑이 대중소기업농어업협력재단과 코트라(대만무역투자진흥공사·KOTRA)와 함께 하는 프로그램이다. 태국 현지 온·오프라인 바이어, 현대홈쇼핑 태국 법인 '하이쇼핑' 소속 MD(상품기획자) 등 총 50여 명이 참여해 참가 기업들에게 1:1 맞춤형 상담 및 태국 유통시장의 트렌드와 상품 수출 노하우 등을 알려줄 예정이다. 현대홈쇼핑은 업계에서 유일하게 중소기업의 해외 판로 확대를 위해 '해외 판로개척 지원사업'도 운영하고 있다. 2016년부터 지난해까지 총 15억원을 지원했고, 올해도 3억원의 기금을 추가로 투입할 계획이다. 중소기업들이 해외 현지 홈쇼핑 진출시 필요한 영상제작 및 프로모션, 상품 인증비용 등을 지원하는 사업이다. 현재까지 총 20여개 중소협력사가 지원을 받아 태국·베트남·대만 등 현지 홈쇼핑에서 약 3000회 가량 방송되는 실적을 거뒀다."
뉴스1,057050,/news/news_read.nhn?article_id=0003423618&office_id=421&mode=search&query=현대홈쇼핑&page=12,2018-06-12 10:07,"현대홈쇼핑, 직무체험 기회 '현홈 서포터즈' 5기 모집","오는 25일까지 마케팅·PD·쇼호스트 부문 각각 선발 © News1 (서울=뉴스1) 김민석 기자 = 현대홈쇼핑은 마케팅·PD·쇼호스트 부문에서 '현홈 서포터즈 5기'를 오는 25일까지 모집한다고 12일 밝혔다. 평소 유통과 방송 산업에 관심이 많고 페이스북·인스타그램·유튜브 등 SNS 활동에 적극적인 대학생이라면 누구나 지원할 수 있다. 활동 기간은 오는 7월부터 약 2개월이다. '현홈 서포터즈'는 영상과 사진을 활용해 현대홈쇼핑의 온·오프라인 콘텐츠를 기획 및 제작하는 과정에 참여하게 된다. 이를 위해 3주 마다 진행되는 오프라인 모임에 정기적으로 참석하고 월별로 개인 SNS를 통한 미션을 수행하게 된다. 특히 '2030 타겟 프로그램 기획' 미션을 통해 서포터즈가 직접 TV 방송 콘텐츠를 기획할 수 있어 방송 분야로의 진로를 희망하는 대학생들이 직무를 체험할 수 있는 기회를 제공한다. 현대홈쇼핑 관계자는 ""현직에 있는 실무자들과 직접 현업에 참여하고 다양한 과제를 수행하게 된다""며 ""취업과 진로에 대한 멘토링을 제공할 예정""이라고 말했다. 이어 ""서포터즈로 활동하는 학생들의 아이디어를 방송과 마케팅에 실제로 적용해 만족도가 높았다""고 덧붙였다. 현홈 서포터즈 5기는 현대홈쇼핑 공식 블로그와 현대H몰 이벤트 페이지를 통해 지원할 수 있다. 서류 및 면접 전형으로 진행되며 최종 합격자는 28일 발표 예정이다."
MBN,057050,/news/news_read.nhn?article_id=0001259934&office_id=057&mode=search&query=현대홈쇼핑&page=11,2018-06-18 06:31,"현대홈쇼핑, 중소기업 20곳 태국서 시장조사&middot;수출상담 지원","현대홈쇼핑이 중소기업 20곳을 다음 달 3∼6일 태국 방콕에 보내 현지 시장 조사와 수출 상담 등을 지원합니다. 태국 현지 온·오프라인 바이어, 현대홈쇼핑 태국 법인 '하이쇼핑' 소속 상품기획자 등 총 50여 명이 참가해 중소기업에 일대일 맞춤형 상담을 하고 태국 유통시장의 트렌드와 상품 수출 노하우 등을 알려줄 예정입니다. 이 행사는 중소기업 해외시장 판로개척을 목적으로 현대홈쇼핑이 대·중·소기업농어업협력재단, 코트라와 함께 추진하는 프로그램입니다."
뉴스1,057050,/news/news_read.nhn?article_id=0003458493&office_id=421&mode=search&query=현대홈쇼핑&page=10,2018-07-01 14:25,"현대홈쇼핑, 스타 셰프가 만든 프리미엄 김치 '침채' 선봬","100% 국내산 원재료 사용…'無설탕·無젓갈' 유현수 셰프 © News1 (서울=뉴스1) 신건웅 기자 = 현대홈쇼핑은 '미쉐린 가이드 2018'에 소개된 한식 레스토랑의 김치를 업계 최초로 선보인다고 1일 밝혔다. 오는 3일 저녁 5시 40분부터 한식 전문점 '두레유'의 유현수 셰프와 협업해 만든 프리미엄 김치 브랜드 '침채'(沈菜)를 판매한다. 침채(沈菜)는 담근·절인·숙성한 채소라는 뜻을 지닌 한자어로, 소금으로만 간을 했던 초기 김치처럼 재료 본연의 맛을 최대한 살려 건강하고 깔끔한 맛을 느낄 수 있다. 김치의 주재료인 배추와 무는 전라도 해남부터 강원도 영월까지 지정 농가와 사전 계약을 통해 재배했으며, 고춧가루·양파·마늘·대파 등 김치 양념에 들어가는 재료는 유명 산지의 원재료를 공수했다. 100% 국내산만을 사용한다. 특히 젓갈·설탕·화학조미료를 넣지 않았다. 대신 태양초 고춧가루·자연산 송이버섯·홍시·밤 등을 사용해 단맛과 감칠맛을 냈다. 현대홈쇼핑은 배추김치 2.5kg(2개)와 열무김치 1kg 등 총 6kg의 김치를 5만4900원에 판매한다. 유현수 셰프는 방송에 직접 출연해 김치 담그는 노하우와 원재료 선택 방법 등의 정보를 소개한다. 현대홈쇼핑 관계자는 ""앞으로도 스타 셰프의 노하우와 전문성이 담긴 프리미엄 메뉴를 상품화하겠다""고 말했다."
매일경제,057050,/news/news_read.nhn?article_id=0004177056&office_id=009&mode=search&query=현대홈쇼핑&page=10,2018-07-01 15:55,"현대홈쇼핑, 유현수 셰프 손잡고 프리미엄 김치 론칭","국내산 원재료·무설탕 무젓갈 `침채` 론칭미슐랭 한식 전문점 `두레유` 오너 셰프 현대홈쇼핑 유현수 셰프의 프리미엄 김치 `침채`출시 현대홈쇼핑이 미슐랭 스타 한식 셰프 유현수씨와 손잡고 프리미엄 김치를 업계 최초로 선보인다. 현대홈쇼핑은 3일 저녁 5시 40분부터 미쉐린 가이드 2018에 소개된 한식 전문점 '두레유'의 오너 셰프인 유현수 셰프와 협업해 만든 프리미엄 김치 브랜드 '침채' 론칭 방송을 진행한다고 1일 밝혔다. '침채(沈菜)는 담근, 절인, 숙성한 채소라는 뜻을 지닌 한자어로, 소금으로만 간을 했던 초기의 김치와 같이 재료 본연의 맛을 최대한 살려 건강하고 깔끔한 맛의 김치라는 의미를 담고 있다. 현재 '두레유' 레스토랑에서 맛볼 수 있는 김치와 동일한 원재료와 조리법으로 '침채'를 선보일 예정이다. 김치의 주재료인 배추와 무는 전라도 해남부터 강원도 영월까지 지정 농가와 사전 계약을 통해 재배된 것만 확보해 엄격하게 품질을 관리한다. 고춧가루·양파·마늘·대파 등 김치 양념에 들어가는 재료들 모두 유명 산지 원재료를 공수해 100% 국내산만 사용한다. 특히 '침채'는 8시간 이상 물을 뺀 절임 배추를 를 비롯해, 젓갈·설탕·화학 조미료를 넣지 않고 대신 태양초 고춧가루, 자연산 송이버섯·홍시·밤 등을 사용해 단맛과 감칠맛을 내는 것이 특징이다. 현대홈쇼핑은 이 날 방송에서 배추김치 2.5kg(2개)와 열무김치 1kg 등 총 6kg의 '침채' 김치를 5만4900원에 판매할 예정이다. 아울러, 유현수 셰프가 방송에 직접 출연해 본인만의 김치 담그는 노하우와 원재료 선택법 등을 알려줄 예정이다. 현대홈쇼핑 관계자는 ""그동안 홈쇼핑 김치 방송에서 소개되지 않았던 오이소박이·부추김치·굴깍뚜기 등의 시즌별 특수 김치들도 유현수 셰프와 협업해 선보일 계획""이라며 ""앞으로도 스타 셰프의 노하우와 전문성이 담긴 프리미엄 메뉴들을 고객들이 합리적으로 구매할 수 있도록 다양한 음식들을 상품화할 방침""이라고 말했다. [이한나 기자] r_start // r_end //"
이데일리,057050,/news/news_read.nhn?article_id=0004127675&office_id=018&mode=search&query=현대홈쇼핑&page=12,2018-06-17 09:46,"현대홈쇼핑, 중기 해외진출 개척 나선다","20개 업체와 태국 '해외시장 현지화 조사단' 진행태국 왕복 항공 및 숙박비 전액 지원1000만 달러 수출 상담·10개 기업 현지 방송 목표 (사진=현대홈쇼핑) [이데일리 함지현 기자]현대홈쇼핑(057050)은 태국 시장 진출을 희망하는 국내 중소기업들의 시장 개척 전도사로 나선다고 17일 밝혔다. 현대홈쇼핑은 다음달 3일부터 6일까지 태국 방콕에서 국내 중소기업들을 대상으로 ‘중소기업 제품 해외시장 현지화 조사단’ 프로그램을 진행한다. 이번 사업은 중소기업 해외시장 판로개척의 일환으로, 현대홈쇼핑이 대중소기업농어업협력재단과 코트라(대만무역투자진흥공사, KOTRA)와 함께 하는 프로그램이다. 태국 현지 온·오프라인 바이어, 현대홈쇼핑 태국 법인 ‘하이쇼핑’ 소속 MD 등 총 50여 명이 참여해 참가 기업들에게 1:1 맞춤형 상담 및 태국 유통시장의 트렌드와 상품 수출 노하우 등을 알려줄 예정이다. 앞서 현대홈쇼핑은 프로그램 참여 모집 공고를 내고, 상품의 경쟁력·태국 현지 시장 판매 적합성 등을 평가해 주방·뷰티·미용·생활 부문 중소기업 20곳을 선정했다. 현대홈쇼핑은 이번 조사단에 참여한 전 중소기업에 태국 왕복 항공료와 숙박비를 전액 지원한다. 태국은 아세안 10개국 중 인도네시아에 이어 두 번째로 경제 규모가 크고 중산층이 두터운 신흥 시장이다. 한류 영향으로 국내 상품에 대한 관심이 높아, 해외 진출을 계획하고 있는 국내 중소기업들이 가장 먼저 고려하는 국가 중 하나로 꼽힌다. 현대홈쇼핑도 지난 2016년 태국 방송통신 1위 기업 인터치그룹 자회사인 ‘인터치미디어’와 함께 ‘하이(HIGH)쇼핑’ 현지 법인을 설립해 TV홈쇼핑과 온라인 채널을 운영 중이다. 현대홈쇼핑은 중소기업의 해외 판로 확대를 위해 ‘해외 판로개척 지원사업’도 운영하고 있다. 지난 2016년부터 작년까지 총 15억원을 지원했고, 올해도 3억원의 기금을 추가로 투입할 계획이다. 이 사업은 중소기업들이 해외 현지 홈쇼핑 진출시 필요한 영상제작 및 프로모션, 상품 인증비용 등을 지원하는 것으로, 현재까지 총 20여 개 중소협력사가 지원을 받아 태국·베트남·대만 등 현지 홈쇼핑에서 약 3000회 가량 방송되는 실적을 거둔 바 있다. 현대홈쇼핑 관계자는 “이번 프로그램을 통해 약 1000만 달러의 수출 상담 실적과 참여 기업의 절반인 10개사가 태국 현지 방송 론칭을 목표로 하고 있다”며 “태국을 시작으로 베트남 등 해외 네트워크와 지원 프로그램을 통해 중소협력사들이 해외로 진출하는데 있어 실질적인 도움이 되도록 노력할 계획”이라고 말했다."
서울경제,057050,/news/news_read.nhn?article_id=0003328235&office_id=011&mode=search&query=현대홈쇼핑&page=11,2018-06-21 11:35,차홍 고데기 상반기 현대 홈쇼핑 히트 상품 선정,[서울경제] 헤어 스타일링 제품으로 꾸준히 사랑받아온 차홍 고데기가 ‘오토 기능’을 비롯해 “예열속도”디자인 부문 등을 강화한 ‘차홍 올힛 스타일러’ 가 현대 홈쇼핑 2018 상반기 (1월1일 ~6월 6일 방송상품 판매 수량 기준) 히트 상품 5위 이미용 기기 1등 에 올랐다.  또한 모발관리에 효과적인 ‘ 차홍 밀크 스노우 트리트 먼트’ 도 기존 200ml 에서 휴대가 용이한 100ml 제품을 출시되어 고객에게 한발더 다가 섭니다.
조선비즈,057050,/news/news_read.nhn?article_id=0000410810&office_id=366&mode=search&query=현대홈쇼핑&page=9,2018-07-15 13:27,"현대홈쇼핑, 미북정상회담 기념 메달 판매... '금메달' 121만원","현대홈쇼핑은 지난 6월 싱가포르에서 열린 ‘6·12 미북정상회담’ 기념 메달을 선보인다고 15일 밝혔다. 현대홈쇼핑 제공 현대홈쇼핑과 현대H몰은 싱가포르 조폐국에서 미북정상회담을 기념해 제작한 메달을 오는 17일부터 판매한다. 현대홈쇼핑은 17일 오전 11시40분부터 30분간 예약 판매 특별 방송을 진행한다. 현대홈쇼핑 관계자는 “이번 기념 메달은 싱가포르 조폐국이 한정판으로 금메달 1500점과 은메달 7500점만 생산한 것으로, 현대홈쇼핑이 이 중 금메달 500점과 은메달 1000점을 확보했다”고 말했다. 싱가포르 미북정상회담 기념 메달 앞면은 미국과 북한 양국의 국기(성조기·인공기)가 좌우에 들어가 있으며, 테두리에는 미국과 북한의 공식 영문 국호가 새겨져 있다. 뒷면에는 김정일 북한 국무위원장과 도널드 트럼프 미국 대통령이 서명한 합의서를 배경으로 두 정상이 손을 맞잡은 모습이 디자인돼 있다. 테두리 위아래에 정상회담 일자(12 JUNE 2018)와 정상회담 명칭(SINGAPORE SUMMIT, 싱가포르 회담)이 표기돼 있다. 기념 메달은 재질에 따라 순도 99.99%의 금 15.55g이 들어간 금메달(중량 15.55g·지름 27mm)과 순도 99.9%의 은이 들어간 은메달(중량 31.1g·지름 40.7mm), 아연에 니켈이 도금된 메달(중량 20g·지름 40.7mm) 등 3종으로 제작됐다. 판매 가격은 금메달이 121만원, 은메달과 동메달은 각각 8만9000원, 3만3000원이다. 니켈도금메달은 수량 제한이 없다. 또 현대H몰은 싱가포르 조폐국이 발행한 기념 메달외에도 미국 백악관에서 제작한 ‘미북정상회담 기념 메달(6만6000원)’도 함께 판매한다. 현대홈쇼핑 관계자는 “예약 판매로 이뤄지기 때문에 실제 상품은 9월 중순부터 순차적으로 배송될 예정”이라고 말했다."
헤럴드경제,057050,/news/news_read.nhn?article_id=0001406066&office_id=016&mode=search&query=현대홈쇼핑&page=12,2018-06-17 09:02,"현대홈쇼핑, 중소기업 해외진출 위해 뛴다","-20개 중소기업과 태국 ‘해외시장 현지화 조사단’ 진행 [헤럴드경제=이혜미 기자] 현대홈쇼핑이 국내 중소기업의 해외 진출을 위해 팔을 걷어붙였다. 현대홈쇼핑은 다음달 3일부터 6일까지 태국 방콕에서 ‘중소기업 제품 해외시장 현지화 조사단’ 프로그램을 진행한다고 17일 밝혔다. 앞서 현대홈쇼핑은 모집 공고를 내고 상품 경쟁력, 태국 시장 판매 적합성 등을 평가해 주방ㆍ뷰티ㆍ미용ㆍ생활 부문 중소기업 20곳을 선정했다. 현대홈쇼핑은 이번 조사단에 참여하는 전 중소기업에 태국 왕복 항공료와 숙박비를 전액 지원한다. 홈쇼핑업계가 자사 해외 네트워크와 연계한 해외 진출 프로그램을 운영하고 있지만, 항공료와 숙박비까지 지원해주는 건 이번이 처음이라고 현대홈쇼핑 측은 밝혔다.  작년 현대홈쇼핑이 대만 홈쇼핑 2위 업체인 ‘동삼홈쇼핑’과 함께 진행한 현지화 조사단 프로그램 모습. [제공=현대홈쇼핑] 태국 현지 온ㆍ오프라인 바이어, 현대홈쇼핑 태국 법인 ‘하이쇼핑’ 소속 MD 등 총 50여 명이 참여해 참가 기업을 대상으로 1:1 맞춤형 상담을 진행한다. 태국 유통시장의 트렌드와 상품 수출 노하우 등을 습득할 수 있는 기회가 될 전망이다. 현대홈쇼핑 관계자는 “이번 프로그램을 통해 약 1000만 달러의 수출 상담 실적과 참여 기업의 절반인 10개사가 태국 현지 방송 론칭을 목표로 하고 있다”며 “태국을 시작으로 베트남 등 해외 네트워크와 지원 프로그램을 통해 중소협력사들이 해외로 진출하는데 있어 실질적인 도움이 되도록 노력할 계획”이라고 했다. 한편 현대홈쇼핑은 중소기업의 해외 판로 확대를 위해 ‘해외 판로개척 지원사업’도 운영하고 있다. 지난 2016년부터 작년까지 총 15억원을 지원했고, 올해도 3억원의 기금을 추가로 투입할 계획이다. 현재까지 20여개 중소협력사가 지원을 받아 태국ㆍ베트남ㆍ대만 등 현지 홈쇼핑에서 약 3000회 가량 방송했다."
머니S,057050,/news/news_read.nhn?article_id=0000325177&office_id=417&mode=search&query=현대홈쇼핑&page=11,2018-06-22 08:50,"[STOCK] 현대홈쇼핑, 탁월한 실적안정성","SK증권은 22일 현대홈쇼핑에 대해 실적안정성이 탁월하다며 투자의견 ‘매수’, 목표주가 14만5000원을 유지했다. 현대홈쇼핑은 올 2분기 눈에 띄는 실적개선은 없을 것으로 전망된다. 다만 연간 1000억원 규모의 현금을 안정적으로 창출할 수 있는 능력과 8000억원에 이르는 현금보유 능력은 불확실성이 커진 시장에서 주목할 만하다. 손윤경 SK증권 애널리스트는 “현대홈쇼핑은 탁월한 현금창출능력과 풍부한 보유현금이 매력적인 투자포인트”라고 설명했다. 홍승우 기자"
파이낸셜뉴스,057050,/news/news_read.nhn?article_id=0004038293&office_id=014&mode=search&query=현대홈쇼핑&page=12,2018-06-12 13:29,"현대홈쇼핑, 대학생 '현홈 서포터즈' 5기 모집","현대홈쇼핑이 여름 방학 시즌을 맞아 대학생 서포터즈를 모집한다. 현대홈쇼핑은 오는 25일까지 마케팅·PD·쇼호스트 부문에서 각각 '현홈 서포터즈 5기'를 모집한다고 12일 밝혔다. 평소 유통 및 방송 산업에 관심이 많고 페이스북·인스타그램·유튜브 등 SNS 활동에 적극적인 대학생이라면 누구나 지원할 수 있다. 활동 기간은 오는 7월부터 약 2개월이다. '현홈 서포터즈'는 영상과 사진을 활용해 현대홈쇼핑의 온·오프라인 콘텐츠를 기획 및 제작하는 과정에 참여한다. 이를 위해 3주마다 진행되는 오프라인 모임에 정기적으로 참석하고, 월별로 개인 SNS를 통한 미션을 수행하게 될 예정이다. 이번 '현홈 서포터즈 5기'는 '2030 타겟 프로그램 기획' 미션을 추가해 서포터즈가 직접 TV 방송 콘텐츠를 기획할 수 있다. 방송 분야로의 진로를 희망하는 대학생들이 직무를 체험할 수 있는 기회를 추가한 것이 특징이다. 현대홈쇼핑 관계자는 ""현직에 있는 실무자들과 직접 현업에 참여하고 다양한 과제를 수행하며, 취업 및 진로에 대한 멘토링까지 제공한다""며 ""서포터즈로 활동하는 학생들의 아이디어를 방송 및 마케팅에 실제로 적용시켜, 참여했던 학생들의 만족도가 높았다""고 말했다. '현홈 서포터즈 5기'는 현대홈쇼핑 공식 블로그와 현대H몰 이벤트 페이지를 통해 지원할 수 있다. 서류 및 면접 전형으로 진행되며 최종 합격자는 28일에 발표할 예정이다."
