source,symbol,link,date,title,content
중앙일보,057050,/news/news_read.nhn?article_id=0002769044&office_id=025&mode=search&query=현대홈쇼핑&page=41,2017-11-05 17:18,"성폭행 논란 여파 현대홈쇼핑, &lsquo;칼리아&times;한샘 마테라소파&rsquo; 생방송 연기","한샘 가구를 홍보하는 홈쇼핑 방송. 사진은 기사와 관계 없음.[사진 현대홈쇼핑]    신입 여직원 사내 성폭행 논란 파문이 커지면서 한샘 제품을 유통 중인 홈쇼핑업체들이 관련 방송을 연기하고 있다. 5일 홈쇼핑업체에 따르면 현대홈쇼핑은 이날 저녁 예정된 ‘칼리아×한샘 마테라소파’ 생방송을 연기했다. 해당 상품은 현대홈쇼핑과 이태리 소파 브랜드 칼리아, 한샘 등 3사가 공동 기획한 상품이다. 이날 오전 롯데홈쇼핑에서 방송된 ‘한샘 올인원 하이클래스 시스템키친’은 평소와 비교해 판매 실적이 10%가량 감소한 것으로 전해졌다.   [사진 한샘몰 페이스북]    한 홈쇼핑업체 관계자는 연합뉴스를 통해 “사건이 어떻게 흘러가는지를 봐야겠다”면서 “아직 결정된 것은 없지만 당분간 한샘 제품 편성을 자제하는 방안도 고려하고 있다”고 말했다. 포털사이트 다음 아고라의 이슈 청원에는 ‘한샘 교육담당자 성폭행 사건 올바른 조사와 처벌을 청원합니다’라는 제안이 올라와 이날 오후 현재 1만 명이 넘게 청원에 서명했다. 한샘 공식 페이스북에도 불매 운동에 동참하겠다는 댓글이 이어지고 있다."
뉴스1,057050,/news/news_read.nhn?article_id=0003031119&office_id=421&mode=search&query=현대홈쇼핑&page=41,2017-11-06 06:00,법원 &quot;백수오&middot;홍삼 과장 광고한 현대홈쇼핑 영업정지 적법&quot;,"시장에 국내산 백수오가 진열된 모습(사진은 기사 내용과 관련이 없음). © News1 박지혜 기자 ""백수오가 여성호르몬 대체할 수 있다며 허위광고"" (서울=뉴스1) 문창석 기자 = 백수오·홍삼·다이어트 등 건강기능 관련 제품의 효과를 과장해서 광고한 현대홈쇼핑에 대해 영업정지 처분을 내린 것은 적법하다는 법원 판결이 나왔다. 서울행정법원 행정5부(부장판사 강석규)는 현대홈쇼핑이 서울 강동구청을 상대로 '영업정지 처분을 취소해달라'며 낸 청구를 기각했다고 6일 밝혔다. 현대홈쇼핑은 2014년 12월부터 2015년 4월까지 백수오 관련 제품을 광고하면서 여성호르몬의 다양한 역할을 대체·대신하고, 갱년기 관련 증상에 기능성이 있는 것처럼 사실과 다르게 과장 광고했다. 문제의 광고에는 홍삼 관련 제품을 판매하면서도 '수능이 112일 남았는데 공부했던 것도 깜빡깜빡할 때가 있거든요, 공부하는 친구들에게 도움을 드리고 싶고요'라며 수험생의 학습능력 향상을 위한 기억력 개선에 도움을 줄 수 있다는 내용이 담겼다. 또 다이어트 제품 광고에 출연한 게스트가 '전 녹화하면서 계속 먹는데 요즘 정말 다른 거 하는 게 없어요, A제품 밖에!'라며 A제품만 섭취하면 운동이나 식이요법을 병행하지 않고도 살을 뺄 수 있는 것처럼 광고하기도 했다. 이에 강동구청은 현대홈쇼핑에 건강기능식품일반판매업에 대해 2016년 11월부터 지난 1월까지 영업정지 2개월의 처분을 내렸다. 현대홈쇼핑은 처분이 적법하지 않다며 소송을 냈다. 재판부는 백수오 제품과 관련해 ""광고에 나온 쇼핑호스트·한의사의 발언을 통해 백수오 등이 여성호르몬을 대체할 수 있다는 취지로 광고했고, 갱년기와 관련해서도 심의 내용을 위반하거나 허위·과장광고했다""며 강동구청의 손을 들어줬다. 홍삼 제품과 관련해선 ""어린이·학생 등 특정 집단에게 기억력 개선 부분을 권하는 내용을 사용할 수 없도록 심의받고도, 학생에게 홍삼 제품이 기억력에 도움을 주는 것처럼 광고했다""고 지적했다. 다이어트 제품을 판매하는 게스트가 즉흥적·우발적으로 발언한 것이라는 주장에 대해서도 ""이는 현대홈쇼핑이 관리해야 할 영역""이라며 ""법에서 금지하는 행위가 그런 사정만으로 행정제재 부과 대상으로 삼을 수 없다면 이를 빌미로 위반행위를 저지를 가능성도 있다""고 밝혔다."
연합뉴스,057050,/news/news_read.nhn?article_id=0009661565&office_id=001&mode=search&query=현대홈쇼핑&page=41,2017-11-06 06:00,&quot;'공부&middot;갱년기에 도움' 과장광고 현대홈쇼핑 제재 정당&quot;,"법원 ""홍삼·백수오 등 건강기능식품 과장 광고에 영업정지 2개월 정당"" ""불특정 다수 피해 예방 위해 사전심의 필요하고 게스트 발언 관리해야"" 현대홈쇼핑 CI[현대홈쇼핑 제공] (서울=연합뉴스) 송진원 기자 = 백수오와 홍삼, 다이어트 제품 등의 효능을 허위·과장 광고한 현대홈쇼핑이 2개월간 건강기능식품 판매 정지 처분을 받자 불복해 소송을 냈지만 패소했다. 6일 법조계에 따르면 서울행정법원 행정5부(강석규 부장판사)는 현대홈쇼핑이 서울 강동구청장을 상대로 ""영업정지 처분을 취소해달라""고 낸 소송에서 현대홈쇼핑의 청구를 기각했다. 한국건강기능식품협회는 사전 심의에서 백수오 제품이 갱년기 여성 건강에 도움을 줄 수 있다는 점은 인정했지만, 안면홍조나 신경과민 등 구체적인 갱년기 증상에 대한 기능성까지 인정하지는 않았다. 홍삼 제품에 대해선 기억력 개선 도움이 과학적으로 입증된 게 아니므로 학생 등 특정 집단에 권하는 내용은 광고에 넣지 말도록 했다. 그러나 현대홈쇼핑은 2014년 12월 말부터 이듬해 4월까지 백수오 제품이 여성호르몬 역할을 대신하는 기능성이 있는 것처럼 광고했다. 다이어트 제품들과 관련해서도 과장 광고를 한 것으로 파악됐다. 홍삼 제품에 대해선 2015년 7월 ""수능이 112일 남았다. 공부했던 것도 머릿속에 담아졌는지 안 담아졌는지 깜빡할 때가 있다. 공부하는 친구들에게 도움을 주고 싶다""는 내용으로 광고했다. 이에 강동구청장은 현대홈쇼핑이 허위·과장 광고를 했다며 작년 11월 건강기능식품 판매업 영업정지 2개월 처분을 내렸다. 현대 측은 해당 광고가 허위·과장이 아니며 건강기능식품법상 사전 심의는 헌법이 금지한 사전 검열이라며 소송을 냈다. 그러나 법원은 해당 내용은 모두 허위·과장 광고라며 홈쇼핑 측 주장을 받아들이지 않았다. 사전 검열 주장에 대해서도 ""건강기능식품의 허위, 과장 광고를 예방하지 않으면 불특정 다수의 국민이 신체·건강상 피해를 볼 수 있다""면서 사전 심의는 필요하다고 판단했다. 현대홈쇼핑은 일부 제품의 경우 게스트가 우발적으로 심의 내용에 저촉된 발언을 한 만큼 처분을 감경해달라고 주장했다. 하지만 재판부는 ""게스트의 우발적인 언행 등 돌발 상황이 발생할 가능성이 있긴 하나 이 또한 원고가 관리해야 할 영역""이라고 지적했다."
스포츠조선,057050,/news/news_read.nhn?article_id=0003174784&office_id=076&mode=search&query=현대홈쇼핑&page=41,2017-11-06 12:54,리안 솔로 유모차&amp;신생아 카시트 현대홈쇼핑 특별방송 진행,"유모차 브랜드 리안이 8일 오후 12시 40분부터 현대홈쇼핑에서 '솔로 절충형유모차 트래블 세트 특별방송'을 진행한다고 밝혔다. 리안에 따르면 이번 방송은 '솔로 유모차 완판 특별 구성'으로 한달 넘게 구매할 수 없었던 인기 컬러인 그레이 컬러 완판 고객감사 및 재판매를 기념해 기획됐다. 소비자에게 가격과 사은품을 풍성하게 제공해 줄 수 있도록, 올해 최저가격, 최다사은품으로 준비된 게 특징이다. 리안 솔로 유모차는는 양대면이 가능한 절충형 유모차로, 디럭스급 기능에 이동편의성까지 갖춘 제품이다. 방송시간 동안 '리안 솔로 트래블 세트'는 최저 45만9000원까지 할인된 가격에 판매할 예정이며 사은품도 제공된다. 리안 솔로 유모차 단품 구매 시 풋머프, 이너시트, 방풍커버, 컵홀더, 목베게, 블랭킷 다용도걸이까지 7종 사은품을 제공되며 트래블 세트 구매 시 여기에 카시트용 이너시트가 추가 제공된다. 리안 관계자는 ""솔로 트래블 세트는 차 안에서는 카시트로, 야외에서는 유모차로 활용할 수 있어 휴가철에 더욱 활용도가 높다""며 ""디럭스급 안정감을 지닌 절충형 유모차 솔로와 신생아용 카시트 패키지로 신생아를 둔 부모들도 안전하고 편안한 외출을 즐길 수 있을 것""이라고 말했다."
부산일보,057050,/news/news_read.nhn?article_id=0000752124&office_id=082&mode=search&query=현대홈쇼핑&page=41,2017-11-06 16:41,리안 '솔로 유모차'&amp;'신생아 카시트' 8일 현대홈쇼핑 방송,"유아용품 전문기업 ㈜에이원에서 전개하고 있는 국내 대표 유모차 브랜드 '리안(RYAN)'이 오는 8일 낮 12시 40분부터 '리안 솔로 절충형유모차 트래블 세트 특별방송'(사진)을 진행한다고 6일 밝혔다. 이번 현대홈쇼핑 방송은 솔로 유모차 완판 특별 구성으로 한 달 넘게 구매할 수 없었던 인기 컬러인 그레이 컬러 완판 고객감사 및 재판매를 기념한 것이다. 소비자에게 가격과 사은품을 풍성하게 제공해 줄 수 있도록 올해 최저가격, 최다사은품으로 준비했다. 2017 리안 솔로 유모차는는 양대면이 가능한 절충형 유모차로, 디럭스급 기능에 이동편의성까지 갖춰 홈쇼핑 방송 때마다 품절을 기록하는 인기상품이다. 리안은 이번 현대홈쇼핑 방송을 통해 대대적인 할인 프로모션을 진행할 계획이다. 방송시간 동안 '리안 솔로 트래블 세트'는 최저 45만 9000원까지 할인된 가격에 판매할 예정이며 인기 컬러인 그레이는 이번 방송을 통해서만 구매할 수 있다. 사은품 또한 더욱 풍성하게 준비했다. 리안 솔로 유모차 단품 구매 시 풋머프, 이너시트, 방풍커버, 컵홀더, 목베게, 블랭킷 다용도걸이까지 7종 사은품을 제공할 예정이며 트래블 세트 구매 시 여기에 카시트용 이너시트를 추가 증정한다. 이외에도 현대홈쇼핑 방송구매 고객이 구매 후기란에 간단한 포토상품평을 남기면 이유식을 시작 시 필수 육아아이템인 '루미 부스터 아기의자'를 전원 증정하는 추가 사은품 이벤트도 함께 진행한다. 리안 마케팅 담당자는 ""이번 방송되는 솔로 트래블 세트는 차 안에서는 카시트로, 야외에서는 유모차로 활용할 수 있어 휴가철에 더욱 활용도가 높다""며 ""디럭스급 안정감을 지닌 절충형 유모차 '솔로'와 신생아용 카시트 패키지로 신생아를 둔 부모들도 안전하고 편안한 외출을 즐길 수 있길 바란다""고 말했다."
머니투데이,057050,/news/news_read.nhn?article_id=0003959689&office_id=008&mode=search&query=현대홈쇼핑&page=41,2017-11-06 17:27,"이태리 화장품 &lsquo;카말돌리&rsquo;, 6일 현대홈쇼핑서 &lsquo;겨울 피부 특집전&rsquo;","[머니투데이 중기&창업팀 이민정 기자] 카말돌리는 6일 밤 11시 55분부터 약 65분간 현대홈쇼핑에서 건조한 겨울 피부를 위한 카말돌리 프리미엄 세트를 선보인다고 밝혔다. 사진제공=카말돌리 에센티아 올레움을 비롯하여 카말돌리 프리미엄 라인의 안티에이징 크림 루지스운구엔뚬(주름개선크림). 이중기능성 토너에센스 플로럼아쿠아(토닉에센스) 더블 구성이다. 빠르게 찾아온 겨울 날씨와 큰 일교차로 우리 피부는 민감해져 있다. 아무리 비싼 화장품이라도 피부에 맞지 않으면 효과를 기대할 수 없다. 천연화장품은 화학성분이 없어 민감해진 피부를 진정시키고 잃어버린 피부 건강을 되찾을 수 있다. 카말돌리 관계자는 ""‘청담동 크림’, ‘여배우 크림’, ‘아나운서 화장품’으로 불리는 루지스 운구엔뚬은 프리미엄 주름개선 크림""이라며 ""아보카도 오일, 호호바 오일 등으로 피부 장벽을 강화시키고 식물성 콜라겐으로 피부를 촉촉하고 부드럽게 가꾸는데 도움을 준다""고 전했다. 플로럼아쿠아는 토너와 에센스의 기능을 하나로 합친 토닉에센스로, 식약처에서 주름개선 효과와 미백 효과를 허가 받은 2중 기능성 제품이다. 카렌듈라꽃 추출물, 장미꽃 추출물, 캐모마일꽃 추출물 등 5가지 꽃 추출물로 구성돼 자극 받은 피부를 촉촉하게 진정시킨다는 게 회사 측 설명이다."
파이낸셜뉴스,057050,/news/news_read.nhn?article_id=0003899884&office_id=014&mode=search&query=현대홈쇼핑&page=41,2017-11-03 15:51,"현대홈쇼핑, 프리미엄 가죽 소파 &lsquo;칼리아&middot;한샘 마테라&rsquo; 단독 론칭","현대홈쇼핑은 5일 저녁 8시 25분부터 165분 동안 '칼리아·한샘 마테라소파' 론칭 특별 생방송을 진행한다고 3일 밝혔다. 현대홈쇼핑이 선보이는 '칼리아·한샘 마테라소파'는 62년 전통의 이태리 최고의 소파 브랜드 '칼리아'와 국내 인테리어 전문 회사 '한샘'과 현대홈쇼핑이 함께 공동 기획한 상품이다. 현대홈쇼핑은 '칼리아·한샘 소파'를 업계 최초로 선보여 고급 소파시장을 적극 공략할 계획이다. 고객들이 소파 구매시 가죽 소재를 가장 중요시한다는 점을 감안해 최상급 가죽으로 평가 받는 이태리 펠레밀라노사의 면피 가죽을 사용했다. 또 20mm의 메모리폼 사용을 통해 오래 사용해도 쉽게 꺼지지 않고, 가죽의 뒤틀림과 늘어짐을 방지하는 퀄팅 디자인을 적용했다. 이 외에도 8단계로 조절이 가능한 '헤드 리클라이닝' 시스템을 도입해 사용자의 편의성을 더했다. 색상은 브라운과 아이보리, 그레이 중 선택할 수 있으며, 가격은 4인용 기준으로 159만 9000원이다. 론칭 기념으로 '장 스탠드'와 '쿠션 2개'를 구매 고객 전원에게 증정한다."
이데일리,057050,/news/news_read.nhn?article_id=0003964229&office_id=018&mode=search&query=현대홈쇼핑&page=41,2017-11-07 09:47,"현대홈쇼핑 &lsquo;디오르드 게르마늄 팔찌, 목걸이&rsquo; 단독론칭","- 7일 밤 10시50분 론칭방송 (사진=현대홈쇼핑) [이데일리 강신우 기자] 현대홈쇼핑이 7일 밤 10시50분부터 65분간 ‘디오르드 게르마늄 주얼리(팔찌, 목걸이)’를 단독 론칭한다고 7일 밝혔다. 99.99% 게르마늄 원석에 ‘화이트+로즈골드’ 색을 조합한 콤비 도금 방식의 디자인은 홈쇼핑 업계에서 유일하다. ‘디오르드 게르마늄 쥬얼리 세트’는 20년 넘는 쥬얼리 제작 전문 업체에서 ‘디오드르’에서 기획했다. 일상 생활에서도 쉽고 편리하게 착용이 가능하며, 콤비 도금 방식을 적용해 패션 아이템로도 손색 없다. 특히 ‘화이트 + 로즈골드’ 콤비 도금 방식은 일반 도금에 비해 3~4배 이상의 공정이 추가되는 데다, 가볍고 경도가 우수한 티타늄 소재로 제작돼 장시간 편안하게 착용이 가능하다. 상품은 총 4가지 중 선택이 가능하다. ‘팔찌 2종 + 목걸이 2종 총 4종 풀세트’를 59만 9000원에 판매하며, ‘남성용 목걸이 1종’(24만 9000원), ‘여성용 목걸이 1종’(21만 9000원)과 ‘팔찌 2종 세트’(19만 9000원)도 별도로 선보인다. 첫 론칭 방송과 함께 2차 방송은 15일 아침 7시 15분부터 1시간동안 ‘얼리버드쇼’ 기획 상품으로 예정돼 있다. 박미선 현대홈쇼핑 아동레포츠팀  상품기획자(MD)는 “디오르드 게르마늄 쥬얼리 세트는 콤비 도금 방식을 채택해 기능 뿐만 아니라 디자인까지 모두 살린 상품”이라며 “남녀노소 누구나 착용이 가능하고, 특히 부모님을 위한 효도 선물로도 손색없는 선택이 될 것”이라고 말했다."
파이낸셜뉴스,057050,/news/news_read.nhn?article_id=0003901373&office_id=014&mode=search&query=현대홈쇼핑&page=41,2017-11-07 10:21,"현대홈쇼핑, '디오르드 게르마늄 팔찌&middot;목걸이' 단독 론칭","현대홈쇼핑이 7일 밤 10시 50분부터 65분간 '디오르드 게르마늄 주얼리(팔찌, 목걸이)'를 단독 론칭한다고 밝혔다.. 99.99% 게르마늄 원석에 '화이트+로즈골드' 색을 조합한 콤비 도금 방식의 디자인은 홈쇼핑 업계에서 유일하다. 이날 첫 선을 보이는 '디오르드 게르마늄 쥬얼리 세트'는 20년 넘는 쥬얼리 제작 전문 업체에서 '디오드르'에서 기획했다. '화이트 + 로즈골드' 콤비 도금 방식은 일반 도금에 비해 3~4배 이상의 공정이 추가된다. 가볍고 경도가 우수한 티타늄 소재로 제작돼 장시간 편안하게 착용이 가능하다. 상품은 총 4가지 중 선택이 가능하다. '팔찌 2종 + 목걸이 2종 총 4종 풀세트'를 59만9000원에 판매하며, '남성용 목걸이 1종'(24만9000원), '여성용 목걸이 1종'(21만9000원)과 '팔찌 2종 세트'(19만9000원)도 별도로 선보인다. 2차 방송은 15일 아침 7시 15분부터 1시간동안 '얼리버드쇼' 기획 상품으로 예정돼 있다."
연합뉴스,057050,/news/news_read.nhn?article_id=0009665159&office_id=001&mode=search&query=현대홈쇼핑&page=41,2017-11-07 11:06,"현대홈쇼핑, '디오르드 게르마늄 팔찌&middot;목걸이' 단독 출시","(서울=연합뉴스) 전준상 기자 = 현대홈쇼핑은 7일 밤 10시 50분부터 65분간 '디오르드 게르마늄 팔찌·목걸이'를 단독 판매한다. 99.99%의 게르마늄 원석에 '화이트＋로즈골드' 색을 조합한 콤비 도금 방식의 디자인은 홈쇼핑 업계에서 유일하다고 현대홈쇼핑은 전했다. 일상생활을 하면서도 쉽고 편리하게 착용이 가능하다. 콤비 도금 방식을 적용해 패션 아이템으로도 손색이 없다. 총 4가지 중 선택이 가능하다. '팔찌 2종 ＋ 목걸이 2종 총 4종 풀세트' 가격은 59만9천원이다. 남성용 목걸이 1종은 24만9천원, 여성용 목걸이 1종은 21만9천원, 팔찌 2종 세트는 19만 9천원이다."
뉴시스,057050,/news/news_read.nhn?article_id=0008272726&office_id=003&mode=search&query=현대홈쇼핑&page=41,2017-11-07 16:25,"[유통단신]현대홈쇼핑, 게르마늄 주얼리 단독 론칭 外","【서울=뉴시스】 ▲현대홈쇼핑이 7일 오후 10시50분부터 65분간 '디오르드 게르마늄 주얼리(팔찌, 목걸이)'를 단독 론칭한다. 첫 선을 보이는 '디오르드 게르마늄 쥬얼리 세트'는 20년 넘는 쥬얼리 제작 전문 업체에서 기획했다. 일상 생활에서도 쉽고 편리하게 착용이 가능하며, 콤비 도금 방식을 적용해 패션 아이템로도 손색 없다. ▲이랜드리테일이 이랜드그룹 창립 37주년을 맞아 오는 8~14일 고객 성원에 보답하는 러브 페스티벌을 개최한다.8일 단 하루 주요 지점에서 고객 한 명 당 1개의 럭키쿠폰을 2000원에 판매할 예정이다. 럭키쿠폰 추첨은 지점별로 진행된다. 1등 당첨 고객에게는 트롬 스타일러, 2등에게는 필립스 에어프라이어, 3등에게는 스타벅스 카드 10만원권 등 상품을 증정한다. ▲여성복 크로커다일레이디는 56년 제화명가인 에스콰이아와 두번째 협업을 진행, 한정판 겨울시즌 앵클 부츠를 출시했다. 최고급 소가죽 소재를 사용해 내구성을 높였다. 발목 부분 털 내피를 덧대 보온성을 한층 높였다. 블랙 색상으로 라운드 형태의 앞코와 밑창을 사용해 여성스러움을 강조했다."
아시아경제,057050,/news/news_read.nhn?article_id=0004113911&office_id=277&mode=search&query=현대홈쇼핑&page=41,2017-11-08 11:13,"네오플램, 북유럽 감성 테이블웨어 '구겐' 현대홈쇼핑서 2차 방송","[아시아경제 정동훈 기자] 글로벌 주방용품 전문기업 네오플램이 오는 9일 북유럽 감성 테이블웨어 '구겐'의 2차 방송을 현대홈쇼핑에서 진행한다. 오전 11시40분에 진행되는 이번 2차 방송에서는 밥공기, 대접, 찬기, 접시, 멀티볼 등 용도와 사이즈 별로 총 43개 세트의 6인조 구성(29만9000원)을 선보일 예정이다. 지난 1차 방송과 비교해 공기, 대접, 수저받침이 각각 6개로 늘어났다. 중찬기과 중접시, 정사각 접시 2개 및 특태 멀티볼 1개가 새롭게 추가됐다. 또한 모든 구매 고객을 대상으로 메인 요리를 담기에 유용한 넉넉한 사이즈의 대형 서브볼을 사은품으로 증정한다. 구겐은 도자기 소재의 깊이 있는 색감이 돋보이는 북유럽 감성 테이블웨어 제품으로, 천연재료인 고령토에 티타늄을 섞은 소재를 사용해 얇고 가벼우면서도 견고한 내구성을 자랑하는 것이 특징이다. 천연유약을 핸드메이드 시유 공법으로 입혀 톤 다운된 린넨, 포그, 스톤, 데님 등의 은은하면서도 세련된 색감을 완성했다. 네오플램 마케팅팀 김지나 팀장은 ""지난 론칭 방송의 많은 관심과 성원에 힘입어 더욱 다양해진 구성으로 이번 2차 방송을 마련하게 됐다""고 전했다."
머니투데이,057050,/news/news_read.nhn?article_id=0003961064&office_id=008&mode=search&query=현대홈쇼핑&page=40,2017-11-08 16:03,"현대홈쇼핑, 3Q 영업익 314억 전년比 34.4% 증가","[머니투데이 김훈남 기자] 현대홈쇼핑은 3분기 영업이익은 314억원, 매출액은 2471억원이라고 8일 공시했다. 지난해 3분기와 비교하면 영업이익은 34.4%, 매출은 8.8% 증가했다."
아시아경제,057050,/news/news_read.nhn?article_id=0004114275&office_id=277&mode=search&query=현대홈쇼핑&page=40,2017-11-08 16:04,"현대홈쇼핑, 3분기 영업익 314억&hellip;34% 증가","[아시아경제 임혜선 기자]현대홈쇼핑은 3분기 영업이익이 314억원으로 전년동기대비 34.3% 증가했다고 8일 공시했다. 같은기간 매출액은 2470억원으로 8.8% 증가했고, 당기순이익도 261억원으로 23.5% 늘었다."
아시아경제,057050,/news/news_read.nhn?article_id=0004112722&office_id=277&mode=search&query=현대홈쇼핑&page=41,2017-11-07 10:16,"현대홈쇼핑, 디오르드 게르마늄 주얼리 단독 론칭","[아시아경제 오종탁 기자] 현대홈쇼핑이 디오르드 게르마늄 주얼리를 론칭한다. 현대홈쇼핑은 7일 오후 10시50분부터 65분 간 디오르드 게르마늄 팔찌, 목걸이를 단독 론칭한다고 밝혔다. 99.99% 게르마늄 원석에 화이트와 로즈골드 색상을 조합한 콤비 도금 방식의 디자인이다. 일상 생활에서도 쉽고 편리하게 착용할 수 있다. '팔찌 2종+목걸이 2종 풀세트'를 59만9000원에 판매한다. '남성용 목걸이 1종'(24만9000원), '여성용 목걸이 1종'(21만9000원), '팔찌 2종 세트'(19만9000원)도 별도로 선보인다."
조선비즈,057050,/news/news_read.nhn?article_id=0000388439&office_id=366&mode=search&query=현대홈쇼핑&page=40,2017-11-08 16:06,"현대홈쇼핑, 3분기 영업익 314억원&hellip;전년보다 34.4% 증가","현대홈쇼핑(057050) 은 3분기에 2470억원의 매출액을 기록해 전년 같은 기간보다 8.8% 증가했다고 8일 공시했다. 영업이익은 314억원으로 34.4%, 당기순이익은 261억원으로 23.5% 늘었다."
매일경제,057050,/news/news_read.nhn?article_id=0004041816&office_id=009&mode=search&query=현대홈쇼핑&page=41,2017-11-03 12:48,"완판 행진 스틸라이트, 4일 현대홈쇼핑 3차 판매 진행","스틸라이트 140년 전통의 영국 도자기 브랜드 스틸라이트가 현대홈쇼핑을 통해 3차 판매를 진행한다고 3일 밝혔다. 스틸라이트는 영국 도자기 명가 던 베넷(Dunn Bennett)가의 전통을 이어받은 브랜드로 이번 생방송을 통해 도공들의 손으로 직접 빚은 도자기에서 영감을 얻은 크래프트(craft)라인을 선보인다. 이 제품은 오는 4일 현대홈쇼핑의 간판 쇼 호스트 허수경이 진행하는 '허수경의 쇼핑스토리'를 통해 소개될 예정이다. 특히 이번 방송에서는 앞선 2회의 방송에서 연속 매진을 달성해 많은 소비자들에게 기회를 제공하고자 홈쇼핑 판매 물량을 확대키로 결정했다. 이번 생방송을 통해 소개되는 크래프트(craft)라인은 100% 핸드페인팅으로 구현하는 독특한 컬러와 높은 온도에서 만들어진 자연스러운 질감으로 아름다움을 표현하는 제품이다. 스틸라이트는 ""고객들의 성원에 힘입어 조금 더 많은 분들에게 다가가고자 이번 홈쇼핑 방송에 출연하게 됐다""며 ""앞으로도 여러 채널을 통해 고객에게 다가갈 예정""이라고 말했다. [서찬동 기자] r_start // r_end //"
