source,symbol,link,date,title,content
한국경제,057050,/news/news_read.nhn?article_id=0003931915&office_id=015&mode=search&query=현대홈쇼핑&page=17,2018-05-01 09:01,"현대홈쇼핑, 임직원 자녀 위한 '현대홈키즈' 어린이집 개원","본사 1층 495㎡ 규모원어민 교사 상주 및 전문 독서공간 마련 사진=현대홈쇼핑 제공 현대홈쇼핑이 서울 강동구 천호동 본사에 사내 직장 어린이집을 운영한다. 현대홈쇼핑은 오는 2일 본사 1층에 '현대홈키즈 어린이집(495㎡ 규모)'을 개원한다고 1일 밝혔다. '현대 홈키즈 어린이집'은 현대홈쇼핑 본사에 근무하는 직원들 자녀 중 만 1세에서 만 5세까지의 영유아들을 돌보는 시설로, 각 연령대별 보육실과 실내·실외 놀이터 등 다양한 학습 공간으로 구성돼 있다. 현대홈쇼핑 관계자는 ""직원들이 자녀를 편하게 맡기고, 틈틈이 교감할 수 있도록 본사 1층에 어린이집을 마련했다""며 ""수준 높은 교육을 원하는 직원들의 의견을 반영해 원어민 교사가 상주해 있고, 전문 독서 공간도 마련하는 등 체계적인 방식으로 운영할 계획""이라고 말했다. 회사 측은 직원들의 출퇴근 편의를 고려해 오전 7시30분부터 오후 7시30분까지 어린이집을 운영할 예정이다. 어린이집 정원은 최대 60명으로, 이는 만 1세~만 5세 자녀를 둔 현대홈쇼핑 직원(130 명)의 약 50%가 이용할 수 있는 규모다. 강찬석 현대홈쇼핑 대표는 ""어린 자녀를 둔 직원들이 일과 가정 생활을 병행하면서 돌봄의 공백이 발생하지 않도록 지원을 아끼지 않겠다""며 “앞으로도 직원들의 애로사항을 청취하고, 이를 반영한 다양한 '워라밸' 제도를 마련해 ‘일하고 싶은 기업 문화' 정착을 위해 노력할 것""이라고 말했다. 한편, 현대홈쇼핑은 직원들의 ‘워라밸(일과 생활의 균형)’ 실현과 출산·육아 지원을 위해 다양한 프로그램을 홈쇼핑 업계에서 가장 선도적으로 도입해 운영하고 있다. '임산부 근로시간 단축 제도'를 임신기간 전체로 확대해 임신 전 기간 2시간 단축 근무 제도를 시행 중이다. 또한 임신 한 직원에게는 임산부 의자, 전자파 차단 앞치마 제공 등 ‘예비맘 패키지’를 제공하고, 본사 내 별도 휴식 공간인 ‘모성보호실’도 운영하고 있다. 조아라 한경닷컴 기자"
디지털타임스,057050,/news/news_read.nhn?article_id=0002449853&office_id=029&mode=search&query=현대홈쇼핑&page=25,2018-02-23 09:29,"세타필 레스토라덤, 4년간의 준비기간 거쳐 24일 현대홈쇼핑 런칭","피부전문 제약기업 갈더마코리아(대표 박흥범)의 보습 전문 스킨케어 브랜드 '세타필'이 4년간의 준비기간을 거쳐 전문가용 보습제 '레스토라덤'을 24일 오후 12시 55분 현대홈쇼핑에서 첫 런칭 방송을 진행한다. 피부전문기관용 보습로션으로서 700여 개 피부 전문기관에서만 구입 할 수 있던 '세타필 AD'가 오리지널 글로벌 버전으로 재탄생한 세타필 레스토라덤은 피부 전문기관이나 직구를 통해서만 구입 할 수 있어 소비자들의 판매 요구가 이어졌던 제품이다. 이에 세타필과 현대홈쇼핑 박혜민 MD와 4년여간의 준비 끝에 성사된 이번 첫 런칭 방송에도 벌써부터 시청자들의 관심이 이어지고 있는 상황이다. 세타필 또한 소비자들의 성원에 보답하기 위해 상품 구성에도 철저히 신경 써 높은 판매율을 기록할 것으로 예상된다. 따라서 이번 방송을 통해 레스토라덤 구매 시 레스토라덤 로션(295ml) 3개, 레스토라덤 워시(295ml), 제품의 만족도를 미리 체험해볼 수 있는 로션 무료체험분 29ml가 제공되며 정가에 비해 54% 할인된 69,900원에 만나볼 수 있다. 극건성, 극건조, 극민감성이 사용하는 초강력 보습로션으로 불리는 레스토라덤은 세타필만의 더블 보습막 케어 피부 장벽 강화 시스템이 적용됐다. 이에 천연 보습인자 필라그린의 수분 보습 효과와 함께 세라마이드가 피부 장벽을 꼼꼼하게 메꾸어주며 피부 수분 증발을 방지하는 전문가용 보습로션으로 꼽힌다. 또 피부 표면에서 천연 유래 성분 수분 증발 차단막이 2차 보습막을 케어하며 유해물질을 차단하는 효과도 있어 한파와 미세먼지가 극성인 요즘 피부를 보호하기 위해 적합한 제품으로 꼽힌다. 이에 실제로 SCIE급 논문을 통해 레스토라덤 사용 시 세라마이드가 9.3배 증가하며 피부 장벽을 강화한다는 것이 확인됐으며, 여린 피부의 유아 피부에도 안심하고 사용할 수 있도록 3개월 이상 유아 피부 인체적용시험을 완료했다. 업체 관계자는 ""단순한 보습을 넘어 자극 없이 피부 장벽까지 강화하는 로션으로 병원 처방으로 사용 후 인생템으로 꼽는 소비자들이 많았지만, 구입이 어렵다는 요청이 많아 오랜 기간 홈쇼핑 런칭을 준비했다.""며 ""공식 수입 정품을 최저가에, 최신 통관 제품으로 만나보실 수 있도록 한 만큼 많은 성원을 부탁드린다.""고 전했다."
매일경제,057050,/news/news_read.nhn?article_id=0004105547&office_id=009&mode=search&query=현대홈쇼핑&page=25,2018-02-25 13:40,"현대홈쇼핑, 패션 PB `밀라노스토리` 1시간만에 매출 20억 기록","현대홈쇼핑은 신규 패션 자가상표(PB) '밀라노 스토리'가 첫 방송에서 1시간 만에 매출 20억5000만원을 달성했다고 25일 밝혔다. 시간당 매출을 기준으로 하면 자사 패션부문 역대 최대 기록이다. 기존 패션 PB인 'J by'와 '라씨엔토'는 지난 2016년과 2017년 출시때 각각 2시간, 4시간씩 방송했고 1시간 평균 매출액이 20억원, 18억원에 달해 이를 뛰어넘은 수준다. 현대홈쇼핑은 22일 저녁 10시 50분부터 1시간 동안 밀라노 스토리 출시 방송을 해 정장 세트와 트렌치코트 총 1만7000세트를 판매했다. 공식 모델인 방송인 정지영씨가 이날 일일 쇼호스트로 참여했고 정 씨의 부드러운 음성을 '밀라노 스토리' ARS 주문 멘트에 적용했더니 ARS 주문 건수가 평상시보다 30% 높게 나온 것으로 나타났다. 이에 다음 달 7일 오전 밀라노 스토리 정장세트와 트렌치 코트 2차 방송을 긴급 편성했다. 다음 달 말부터는 재킷·베스트·블라우스 등 총 10여 종의 아이템을 린넨 시리즈로 선보일 예정이다. 현대홈쇼핑은 프리미엄 패션브랜드 '라씨엔토'와 실용성과 합리적인 가격대를 앞세운 밀라노 스토리를 '투트랙'(Two-Track) 전략으로 내세워 패션 PB 사업을 확대할 계획이다. [이한나 기자] r_start // r_end //"
아이뉴스24,057050,/news/news_read.nhn?article_id=0000439266&office_id=031&mode=search&query=현대홈쇼핑&page=25,2018-02-25 14:44,"현대홈쇼핑 '밀라노 스토리', 1시간 만에 20억 매출","[아이뉴스24 윤지혜 기자] 현대홈쇼핑의 가성비를 내세운 신규 패션 자체브랜드(PB) '밀라노 스토리'가 첫 방송에서 1시간 만에 매출 20억 5천만원을 달성했다. 패션부문 시간당 매출 기준으로 역대 최대 기록이다. 25일 현대홈쇼핑은 22일 저녁 1시간 동안 진행된 밀라노 스토리 론칭 방송에서 정장 세트와 트렌치코트가 총 1만7천세트의 판매고를 올려 20억5천만원의 매출을 기록했다고 밝혔다. 이는 2016년과 2017년에 각각 2시간, 4시간 론칭 방송을 했던 'J by'와 '라씨엔토'의 1시간 평균 매출액 20억원과 18억원을 뛰어넘는 수준이다. 현대홈쇼핑 관계자는 ""라씨엔토와 J by의 경우 첫 방송때 제품 단가가 높은 가을·겨울 시즌에 진행한 걸 감안하면 밀라노 스토리 방송은 예상보다 훨씬 높은 실적""이라며 ""동시간대 패션 방송이 13억~15억원이 나오면 보통 매진이 되지만 사전 협력사와 협의해 충분한 물량을 확보한 것이 주효했다""고 말했다. 특히 밀라노 스토리 공식 모델인 방송인 정지영이 론칭 방송에 일일 쇼호스트로 참여해 상품과 다양한 상황에 알맞은 본인만의 스타일링 연출법 등을 편하게 설명한 것도 긍정적으로 작용한 것으로 보인다. ARS 주문 멘트에 라디오 DJ로 유명한 정지영의 목소리를 적용하자 ARS 주문 건수가 평상시보다 30% 높게 나오기도 했다. 현대홈쇼핑은 대표 패션 브랜드로써 밀라노 스토리의 인지도를 강화하기 위해 다음달 7일 오전에 정장세트와 트렌치 코트 2차 방송을 긴급 편성했다. 다음달 말부터는 린넨 시리즈(재킷·베스트·블라우스) 등 총 10여 종의 아이템을 연이어 선보일 예정이다. 이를 통해 프리미엄 패션 브랜드 라씨엔토와 실용성과 합리적인 가격대를 앞세운 밀라노 스토리를 투트랙 전략으로 패션 PB 사업을 확대해 나갈 계획이다. 현대홈쇼핑 관계자는 ""단아하고 지적이면서 세련된 이미지의 정지영이 밀라노 스토리 브랜드 이미지와 부합해 30~40대 여성 고객에게 좋은 반응을 얻은 것으로 분석된다""며 ""정지영씨와 고객이 함께 소통할 수 있는 토크 콘서트 등 다양한 이벤트를 진행할 계획""이라고 말했다. /윤지혜기자"
한국경제,057050,/news/news_read.nhn?article_id=0003898546&office_id=015&mode=search&query=현대홈쇼핑&page=24,2018-02-25 16:35,현대홈쇼핑 PB '밀라노스토리' 첫방송에서 20억원 매출,[ 박성완 기자  ] 현대홈쇼핑의 패션 자체브랜드(PB) ‘밀라노스토리’가 출시 첫 방송에서 한 시간 만에 매출 20억5000만원을 달성했다. 시간당 매출로는 현대홈쇼핑 역대 최고 기록이다. 현대홈쇼핑은 지난 22일 오후 10시50분부터 한 시간 동안 밀라노스토리 출시 방송을 한 결과 정장 세트와 트렌치코트 등 총 1만7000세트가 팔렸다고 집계했다. 이에 따라 다음달 7일 오전 2차 방송을 긴급 편성했다. 내달 말부터는 린넨 시리즈 등 10여 종의 아이템을 연이어 선보일 예정이다.
파이낸셜뉴스,057050,/news/news_read.nhn?article_id=0003971418&office_id=014&mode=search&query=현대홈쇼핑&page=24,2018-02-25 17:09,현대홈쇼핑 패션PB '밀라노 스토리' 론칭 방송서 역대 최대 매출 기록,"1시간에 매출 20억5천만원   현대홈쇼핑이 실용성과 가성비(가격 대비 성능)를 내세운 패션 자체브랜드(PB) '밀라노 스토리'가 첫 방송에서 시간당 역대 최대의 매출을 올리며 '홈쇼핑 PB패션의 강자'로 떠올랐다.1시간 만에 매출 20억 5000만원을 달성했다고 25일 밝혔다. 시간당 매출에 있어 패션부문 역대 최대 기록이다.현대홈쇼핑은 지난 22일 오후 10시50분부터 1시간 동안 진행된 '밀라노 스토리' 론칭 방송에서 선보인 정장세트와 트렌치코트가 1만7000세트 팔리며 20억5000만원의 매출을 기록했다고 25일 밝혔다. 회사 측은 지난 2016년과 2017년에 각각 2시간, 4시간 론칭 방송을 했던 'J by'와 '라씨엔토' 1시간 평균 매출액인 20억원, 18억원을 각각 뛰어넘는 수준이라고 설명했다.현대홈쇼핑 관계자는 ""'라씨엔토'와 'J by'의 경우 첫 방송때 제품 단가가 높은 가을.겨울 시즌에 진행한 것을 감안하면 '밀라노 스토리'의 실적은 예상을 훨씬 웃도는 것""이라며 ""동시간대 패션 방송이 13억~15억원이 나오면 보통 매진이 되지만 사전에 협력사와 협의해 충분한 물량을 확보한 것이 주효했다""고 말했다.특히 밀라노 스토리 공식 모델인 방송인 정지영씨가 론칭 방송에 일일 쇼호스트로 참여해 상품과 다양한 상황에 알맞은 본인만의 스타일링 연출법 등을 편하게 설명한 것도 긍정적으로 작용했다고 보고 있다. 실제 라디오 DJ로 유명한 정지영씨의 부드러운 음성을 '밀라노 스토리' ARS 주문 멘트에 적용해 ARS 주문 건수가 평상시보다 30% 높게 나오기도 했다.현대홈쇼핑은 '밀라노 스토리'의 인기를 이어가고 대표 패션 브랜드로서 인지도를 강화하기 위해 오는 3월7일 오전 정장세트와 트렌치 코트 2차 방송을 긴급 편성했다. 다음달 말부터는 린넨 시리즈 등 총 10여 종의 아이템을 연이어 선보일 예정이다.박신영 기자"
머니투데이,057050,/news/news_read.nhn?article_id=0004015039&office_id=008&mode=search&query=현대홈쇼핑&page=24,2018-02-26 08:17,"현대홈쇼핑, 올해 취급고 성장 이어질 듯-한화證","[머니투데이 송정훈 기자] 한화투자증권은 현대홈쇼핑의 올해 취급고가 견조한 성장세를 보일 것으로 전망했다. 한화투자증권 남성현 연구원은 26일 """"티커머스 채널 확장 효과 일부 제품군들이 성장을 주도할 것""이라며 이같이 밝혔다. 그는 홈대홈쇼핑의 올해 매출이 성장하면서 취급고가 2400억원 규모에 달할 것으로 예상했다. 올 1분기 취급고와 관련해선 ""견조한 외형성장과 상품믹스 효과에도 불구 영업이익 감익은 피할 수 없을 전망""이라며 ""이는 지난해 경정청구 환급에 따른 1회성 수익 79억원과 렌탈케어 적자폭 감소가 개선되지 않을 것으로 판단되기 때문""이라고 분석했다. 남 연구원은 ""실적 모멘텀이 부재한 것은 사실이지만 현 주가 수준은 저평가 영역에  머무르고 있다""고 덧붙였다."
조선비즈,057050,/news/news_read.nhn?article_id=0000399743&office_id=366&mode=search&query=현대홈쇼핑&page=24,2018-02-26 08:57,"&quot;현대홈쇼핑, 외형성장해도 영업익 줄어들 것...목표주가 16.8만&rarr;15.9만&quot; ...","한화투자증권은 26일 현대홈쇼핑(057050) 에 대해 “외형 성장에도 불구하고 1분기 영업이익이 줄어들 것”이라면서 투자 의견은 ‘매수’, 목표 주가는 16만8000원에서 15만9000원으로 하향 제시했다. 남성현 한화투자증권 연구원은 “지난해 렌탈케어 적자폭 감소가 개선되지 않을 것으로 판단한다”면서 이같이 밝혔다. 남 연구원은 “외형 성장은 견조할 것으로 보는데, 이는 티커머스 채널 확장 효과와 일부 제품군들 성장이 주도할 것”이라면서 “지난해 티커머스 매출액은 약 1770억 원으로 전년 대비 약 74.7% 성장했고, 올해도 매출액은 2400억원에 달할 것”이라고 내다봤다."
파이낸셜뉴스,057050,/news/news_read.nhn?article_id=0004011113&office_id=014&mode=search&query=현대홈쇼핑&page=17,2018-04-27 16:58,"현대홈쇼핑, 2030 겨냥 '영스타그램' 방송 론칭","현대홈쇼핑이 20~30대 젊은 고객들을 겨냥한 새로운 프로그램 방송을 선보인다고 27일 밝혔다. SNS 채널 '인스타그램'에서 차용한 '영스타그램'은 젊은 고객을 대상으로 한다는 '영'(Young)과 연예인 게스트가 출연한다는 '스타'의 의미를 담았다. 28일부터 매주 금요일 오전 1시에 방송된다. 28일 첫방송에서는 젊은 고객들이 선호하는 '후지 인스탁스 미니9' 즉석카메라 세트를 선보인다. 이날 방송에는 유명 래퍼 딘딘이 특별 게스트로 출연해 생활 밀착 카메라 방식의 사전 영상과 실시간 소통형 라이브 방송 '딘딘에게 물어봐' 등의 코너를 진행할 예정이다. 현대홈쇼핑은 앞으로 매달 금요일 심야 시간대 젊은층을 대상으로 한 방송을 1~2회에 진행할 예정이다. 문화·인테리어·IT 등 다양한 카테고리의 최신 아이템을 중심으로 선보인다는 계획이다. 현대홈쇼핑 관계자는 ""젊은층의 관심이 높은 뮤지컬 방송을 토요일 새벽 1시에 테스트 차원에서 진행했는데, 2030세대 매출 비중이50%를 넘길 정도로 좋은 반응을 얻었다""며 ""기존 홈쇼핑 방송의 틀을 깨는 다양한 볼거리와 젊은 고객들이 원하는 상품을 발굴, 소개해 '영(Young) 채널'로서의 이미지를 확보하기 위해 전략 중 하나""라고 설명했다."
전자신문,057050,/news/news_read.nhn?article_id=0002686997&office_id=030&mode=search&query=현대홈쇼핑&page=24,2018-02-26 13:34,"[ET투자뉴스]현대홈쇼핑, &quot;2018년에도 취급&hellip;&quot; 매수(유지)-한화투자증권","한화투자증권에서 26일 현대홈쇼핑(057050)에 대해 ""2018년에도 취급고 성장 이어질 전망""라며 투자의견을 '매수(유지)'로 제시하였고, 아울러 목표주가로는 159,000원을 내놓았다. 한화투자증권 남성현 애널리스트가 동종목에 대하여 이번에 제시한 '매수(유지)'의견은 작년 연말의 시장컨센서스에 비추어 보면 '매수'의견이 계속 유지되고 있는 상태이다. 그리고 최근 분기내 발표된 전체 증권사 리포트의 컨센서스와 비교를 해볼 경우에 오늘 발표된 투자의견은 전체의견에 수렴하고 있어, 이번 의견은 시장의 평균적인 기대감이 객관적으로 표현된 것으로 분석되고 있다. 목표주가의 추이를 살펴보면 직전에 한차례 상향조정된 후에 이번에 다시 목표가가 낮아졌는데, 이번에 조정된 목표가가 전저점보다는 높은 수준이다. 또한 전일 종가 기준으로 볼때 동종목의 현주가는 이번에 제시된 목표가 대비 45.9%의 저평가 요인이 존재한다는 해석이 제시되고 있다."
아시아경제,057050,/news/news_read.nhn?article_id=0004188384&office_id=277&mode=search&query=현대홈쇼핑&page=24,2018-02-28 08:53,"현대홈쇼핑, 내일 LG전자 '원데이' 특별방송","[아시아경제 지연진 기자]현대홈쇼핑은 다음 달 1일 하루 동안 LG전자 창사 60주년을 기념해 LG의 다양한 인기 상품들을 선보이는 ‘원데이’ 특별 방송을 진행한다고 28일 밝혔다. 현대홈쇼핑은 오는 1일 하루 동안 LG전자 창사 60주년을 기념해 '라이프 이즈 굿 데이(Life's Good Day)'라는 주제로, 건조기 ·공기청정기 ·에어컨 ·냉장고 ·노트북 등 총 10개 LG 가전 생방송을 연이어 진행한다고 28일 밝혔다. 현대홈쇼핑은 특별 방송을 기념해  TV방송 상품 결제완료 고객 중 추첨을 통해 ‘LG안마의자’(3명), ‘구찌 마틀라세 핸드백’(10명)을 증정하고, 이 날 방송 상품을 2건 이상 구매한 모든 고객에게 ‘발렌시아가 선글라스’를 사은품으로 증정한다. 이날 현대홈쇼핑은 ‘LG 의류건조기(144만원)을 시작으로  ‘LG 퓨리케어 공기청정기’,  'LG 휘센 듀얼 에어컨',  ‘LG 디오스 매직스페이스 냉장고’(870ℓ),   'LG노트북 그램', 'LG 울트라HD TV' 등의 편송을 잇따라 진행한다."
뉴시스,057050,/news/news_read.nhn?article_id=0008463265&office_id=003&mode=search&query=현대홈쇼핑&page=24,2018-02-28 11:11,"[유통단신]현대홈쇼핑, LG전자 특집방송 진행 外","【서울=뉴시스】 ▲G마켓과 옥션은 필립스의 차량용 공기청정기 신제품을 단독으로 선보인다. '필립스 차량용 공기청정기 고퓨어 7101'는 필립스 고퓨어 7시리즈로 필립스만의 멀티 레이어 필터 기술이 탑재돼 PM2.5 초미세먼지와 유독 배기가스를 효율적으로 제거하는 것이 특징이다. 알레르기 유발 물질 유효 제거율이 90%이며, 시간당 7.6회의 차량 내 공기 정화가 가능하다. 3월4일까지 특별 할인가격인 16만9000원에 판매한다. ▲GS수퍼마켓과 GS25는 28일부터 다음달 20일까지 친환경 계란과 친환경 닭고기를 최대 50% 할인해 판매한다. 주차별로 바뀌는 초특가 이벤트로는 이날부터 3월6일까지 기존 각 8980원과 9980원에 판매하던 친환경 1등급판란 1판(大 30입)을 4980원, 친환경 동물복지란 1판(25입)을 6980원에 판매한다. ▲스타필드는 3월1일부터 18일까지 '스프링 블라썸 인 스타필드' 행사를 진행한다. 학생, 사회초년생, 연인 등을 위해 마련됐다. 스타필드 전 점에서는 달콤함과 봄의 낭만을 전하는 이벤트가 열린다. 캔디공장 체험존, 아트워크 갤러리, 포토존 등으로 구성된 팝업스토어에서는 다양한 현장 이벤트를 통해 경품을 증정한다. ▲현대홈쇼핑은 3월1일 하루 동안 LG전자 창사 60주년을 기념해 '라이프 이즈 굿 데이(Life's Good Day)'를 주제로 건조기·공기청정기·에어컨·냉장고·노트북 등 총 10개 LG 가전 생방송을 연이어 진행한다. TV 방송 상품 결제완료 고객 중 추첨을 통해 'LG안마의자'(3명), '구찌 마틀라세 핸드백'(10명)을 증정한다. ▲CJ오쇼핑의 독립 뷰티브랜드 SEP(셉)은 네슬레 재팬의 '킷캣(KitKat) 쇼콜라토리'와 손잡고 한정판 콜라보레이션 제품을 출시한다. 3월 화이트데이 시즌을 맞아 '키스를 부르는 립스틱'을 콘셉트로 기획된 이번 신제품은 킷캣과 콜라보한 컬러인 '루비 카카오'를 포함한 '립스틱 얼티매트' 5종을 킷캣 쇼콜라토리의 '수블림 루비' 초콜렛, 그리고 나만의 립스틱을 꾸밀 수 있는 DIY 스티커와 함께 만날 수 있다. ▲K쇼핑은 추첨을 통해 프리미엄 홈 스킨케어 기기 LG 프라엘(Pra.L) 전 세트를 증정한다. K쇼핑은 황사와 미세먼지가 기승을 부리는 봄에 대비해 약 180만원 상당의 LG 프라엘(Pra.L) 프리미엄 피부관리 기기 세트를 K쇼핑 고객 총 100명에게 증정한다. 프라엘은 'LED 마스크', '토탈 리프트업 케어', '갈바닉 이온 부스터', '듀얼 모션 클렌저' 등 다양한 기능을 가진 피부 관리기 4종으로 구성돼 있다."
파이낸셜뉴스,057050,/news/news_read.nhn?article_id=0003973697&office_id=014&mode=search&query=현대홈쇼핑&page=24,2018-02-28 13:32,"현대홈쇼핑, 'LG전자 창사 60주년' 원데이 특집방송 진행","현대홈쇼핑이 LG전자의 다양한 인기상품들을 선보이는 '원데이' 특별 방송을 진행한다. 현대홈쇼핑은 3월 1일 하루 동안 LG전자 창사 60주년을 기념해 '라이프 이즈 굿 데이(Life's Good Day)'라는 주제로, 건조기·공기청정기·에어컨·냉장고·노트북 등 총 10개 LG 가전 생방송을 연이어 진행한다고 2월 28일 밝혔다. 현대홈쇼핑은 특별 방송을 기념해 TV방송 상품 결제완료 고객 중 추첨을 통해 'LG안마의자'(3명), '구찌 마틀라세 핸드백'(10명)을 증정한다. 이 날 방송 상품을 2건 이상 구매한 모든 고객에게는 '발렌시아가 선글라스'를 사은품으로 증정한다. 이날 현대홈쇼핑은 'LG 의류건조기(144만원)', 'LG 퓨리케어 공기청정기', 'LG 휘센 듀얼 에어컨', 'LG 디오스 매직스페이스 냉장고(870L)', 'LG노트북 그램', 'LG 울트라HD TV' 등의 상품 방송을 진행한다."
조세일보,057050,/news/news_read.nhn?article_id=0002179879&office_id=123&mode=search&query=현대홈쇼핑&page=24,2018-03-01 09:25,"현대홈쇼핑, 60돌 LG전자 가전 원데이 특집 초대",◆…출처:현대홈쇼핑
