source,symbol,link,date,title,content
데일리안,057050,/news/news_read.nhn?article_id=0002271006&office_id=119&mode=search&query=현대홈쇼핑&page=8,2018-07-22 09:00,"현대홈쇼핑, 태국서 中企 판로 개척 앞장&hellip;1300만 달러 수출상담 성과","현대홈쇼핑이 이달 초 태국 방콕에서 진행했던 ‘중소기업 제품 해외시장 현지화 조사단’ 프로그램을 통해 약 1300만 달러(약 146억)의 수출 상담 실적을 올렸다고 22일 밝혔다. ‘중소기업 제품 해외시장 현지화 조사단’은 중소기업 해외시장 판로개척의 일환으로, 현대홈쇼핑이 대중소기업농어업협력재단과 코트라(대한무역투자진흥공사, KOTRA)와 함께 운영하는 프로그램이다. 이번 프로그램에는 PN풍년·드림셰프·두두월드 등 주방부문, 엔앤비랩·두리화장품 등 뷰티, 엘더블유·에이원 등 생활부문, 보국전자 등 가전부문, 헬스밸런스 등 식품부문 등 총 20개 중소협력사가 참여했다. 특히 현대홈쇼핑은 참여한 전 협력사에 왕복 항공료와 숙박비 전액을 지원했다. 현대홈쇼핑은 태국에서 현지 유통업체 바이어와 현대홈쇼핑 태국 법인 ‘하이쇼핑’ 소속 MD 등 총 60명이 참여해 1:1 맞춤형 구매 상담을 진행했다. 대표적으로 압력솥 냄비를 생산하는 'PN풍년'의 경우 태국 최대 홈퍼니싱 업체로 꼽히는 ‘인덱스 리빙몰(Index Living Mall)’ 주방 바이어와의 미팅을 통해 54억원 규모의 수출 상담 실적을 거뒀다. 회사 측은 보국전자의 ‘티포트’(20억원), 엔앤비랩의 ‘클렌징 오일폼’(13억원), 드림셰프의 ‘냄비와 후라이팬’(12억원), 엘더블유의 ‘트레이’(11억원), 두리화장품의 ‘댕기머리 샴푸’(8억원), 에이원의 ‘리안 유모차’(7억원) 등의 제품들도 현지 바이어들의 관심이 높았다고 설명했다. 현대홈쇼핑은 또한 태국 현지 법인 하이(HIGH)쇼핑을 통해 이번 프로그램에 참여한 기업들의 제품을 방송할 계획이다. 이와 함께 현재 운영 중인 ‘해외 판로 개척 지원사업’을 적극 활용해, 현지 방송 시 필요한 프로모션과 상품 인증 등 참여 기업들이 태국 시장에 안착할 수 있는 다양한 지원책을 함께 운영할 계획이다. 현대홈쇼핑은 오는 10월 말에도 1억명의 인구와 높은 경제성장률을 바탕으로 ‘포스트 차이나’로 불리는 베트남에서 현지화 조사단 프로그램을 진행한다. 베트남 프로그램에 선정된 중소협력사에도 태국과 마찬가지로 왕복 항공료와 숙박비를 지원할 예정이다. 이경렬 현대홈쇼핑 대외협력팀장은 “현지 방송 및 수출 등 계약 과정 전반에 있어 현대홈쇼핑 해외사업팀과 협력사를 매칭시켜 해외 판로 개척에 실질적인 도움이 될 수 있는 다양한 지원책을 운영해 나갈 것”이라며 “참여 기업들이 개별적으로 유통시장을 견학하거나, 선호하는 특정 유통사와의 상담회를 마련하는 등 협력사의 니즈를 반영해 다음 프로그램을 진행할 계획”이라고 말했다."
아이뉴스24,057050,/news/news_read.nhn?article_id=0000455283&office_id=031&mode=search&query=현대홈쇼핑&page=8,2018-07-22 09:01,"현대홈쇼핑, 태국서 1300만달러 中企 수출상담","[아이뉴스24 윤지혜 기자] 현대홈쇼핑은 이달 초 태국 방콕에서 진행했던 '중소기업 제품 해외시장 현지화 조사단' 프로그램을 통해 1천300만 달러(약 146억원)의 수출 상담 실적을 올렸다고 22일 발표했다. 중소기업 제품 해외시장 현지화 조사단은 현대홈쇼핑이 대중소기업농어업협력재단, 코트라(대한무역투자진흥공사)와 함께 중소기업의 해외시장 판로개척을 위해 운영하는 프로그램이다. 이번에는 PN풍년·드림셰프·두두월드 등 주방부문, 엔앤비랩·두리화장품 등 뷰티, 엘더블유·에이원 등 생활부문, 보국전자 등 가전부문, 헬스밸런스 등 식품부문 등 총 20개 중소협력사가 참여했다. 현대홈쇼핑은 참여한 전 협력사에 왕복 항공료와 숙박비 전액을 지원했다. 태국에서 현지 유통업체 바이어와 현대홈쇼핑 태국 법인 '하이쇼핑' 소속 MD 등 총 60명이 참여해 1:1 맞춤형 구매 상담을 진행했다. 압력솥 냄비를 생산하는 PN풍년의 경우 태국 최대 홈퍼니싱 업체 '인덱스 리빙몰' 바이어와 54억원 규모의 수출 상담 실적을 거뒀다. 아울러 보국전자의 '티포트'(20억원), 엔앤비랩의 '클렌징 오일폼'(13억원), 드림셰프의 '냄비와 후라이팬'(12억원), 엘더블유의 '트레이'(11억원), 두리화장품의 '댕기머리 샴푸'(8억원), 에이원의 '리안 유모차'(7억원) 등의 제품들도 현지 바이어들의 높은 관심을 받았다. 현대홈쇼핑은 태국 현지 법인을 통해 참여 기업들의 제품을 방송할 계획이다. 이와 함께 현재 운영중인 해외판로 개척 지원사업을 적극 활용해 현지 방송 시 필요한 프로모션과 상품 인증 등을 지원할 방침이다. 현대홈쇼핑은 오는 10월 말에도 포스트 차이나로 불리는 베트남에서 현지화 조사단 프로그램을 진행한다. 베트남 프로그램에 선정된 중소협력사에도 태국과 마찬가지로 왕복 항공료와 숙박비를 지원할 예정이다. 현대홈쇼핑 이경렬 대외협력팀장은 ""현지 방송 및 수출 등 계약 과정 전반에 있어 현대홈쇼핑 해외사업팀과 협력사를 매칭시켜 실질적인 도움을 줄 것""이라며 ""참여 기업들이 개별적으로 유통시장을 견학하거나 선호하는 특정 유통사와의 상담회를 마련하는 등 협력사의 니즈를 반영해 다음 프로그램을 진행할 계획""이라고 말했다. /윤지혜기자"
이데일리,057050,/news/news_read.nhn?article_id=0004154964&office_id=018&mode=search&query=현대홈쇼핑&page=8,2018-07-22 09:01,"현대홈쇼핑, 태국서 中企 판로개척 앞장 &hellip;1300만달러 수출 성과 올려","(사진=현대홈쇼핑) [이데일리 송주오 기자] 현대홈쇼핑은 이달 초 태국 방콕에서 진행했던 ‘중소기업 제품 해외시장 현지화 조사단’ 프로그램을 통해 약 1300만 달러(약 146억)의 수출 상담 실적을 올렸다고 22일 밝혔다. 중소기업 제품 해외시장 현지화 조사단은 중소기업 해외시장 판로개척의 일환으로, 현대홈쇼핑이 대중소기업농어업협력재단과 코트라(대한무역투자진흥공사, KOTRA)와 함께 운영하는 프로그램이다. 이번 프로그램에는 PN풍년·드림셰프·두두월드 등 주방부문, 엔앤비랩·두리화장품 등 뷰티, 엘더블유·에이원 등 생활부문, 보국전자 등 가전부문, 헬스밸런스 등 식품부문 등 총 20개 중소협력사가 참여했다. 특히 현대홈쇼핑은 참여한 전 협력사에 왕복 항공료와 숙박비 전액을 지원했다. 현대홈쇼핑은 태국에서 현지 유통업체 바이어와 현대홈쇼핑 태국 법인 ‘하이쇼핑’ 소속 MD 등 총 60명이 참여해 참여해 1:1 맞춤형 구매 상담을 진행했다. 대표적으로 압력솥 냄비를 생산하는 ‘PN풍년’의 경우 태국 최대 홈퍼니싱 업체로 꼽히는 ‘인덱스 리빙몰(Index Living Mall)’ 주방 바이어와의 미팅을 통해 54억원 규모의 수출 상담 실적을 거뒀다. 또한 태국 현지 법인 하이(HIGH)쇼핑을 통해 이번 프로그램에 참여한 기업들의 제품을 방송할 계획이다. 이와 함께 현재 운영중인 ‘해외판로 개척 지원사업’을 적극 활용해, 현지 방송시 필요한 프로모션과 상품 인증 등 참여 기업들이 태국 시장에 안착할 수 있는 다양한 지원책을 함께 운영할 계획이다. 현대홈쇼핑은 오는 10월 말에도 1억명의 인구와 높은 경제성장률을 바탕으로 ‘포스트 차이나’로 불리는 베트남에서 현지화 조사단 프로그램을 진행한다. 베트남 프로그램에 선정된 중소협력사에도 태국과 마찬가지로 왕복 항공료와 숙박비를 지원할 예정이다. 이경렬 현대홈쇼핑 대외협력팀장은 “현지 방송 및 수출 등 계약 과정 전반에 있어 현대홈쇼핑 해외사업팀과 협력사를 매칭시켜 해외 판로 개척에 실질적인 도움이 될 수 있는 다양한 지원책을 운영해 나갈 것”이라며 “참여 기업들이 개별적으로 유통시장을 견학하거나, 선호하는 특정 유통사와의 상담회를 마련하는 등 협력사의 니즈를 반영해 다음 프로그램을 진행할 계획”이라고 말했다."
파이낸셜뉴스,057050,/news/news_read.nhn?article_id=0004062171&office_id=014&mode=search&query=현대홈쇼핑&page=8,2018-07-22 09:01,"현대홈쇼핑, 태국서 중소기업 판로 개척 앞장&hellip;1300만 달러 수출상담 성과","현대홈쇼핑이 이달 초 태국 방콕에서 진행한 현지화 조사단에서 압력솥 냄비를 생산하는 'PN풍년'이 상품을 설명하고 있다.    현대홈쇼핑이 지난 3일에서 6일까지 태국 방콕에서 진행했던 '중소기업 제품 해외시장 현지화 조사단' 프로그램을 통해 약 1300만 달러(약 146억)의 수출 상담 실적을 올렸다고 22일 밝혔다. 이번 프로그램에는 주방, 뷰티, 생활, 가전, 헬스밸런스, 식품 부문 등 총 20개 중소협력사가 참여했다. 현대홈쇼핑은 참여한 전 협력사에 왕복 항공료와 숙박비 전액을 지원했다. 태국 현지 유통업체 바이어와 현대홈쇼핑 태국 법인 '하이쇼핑' 소속 MD 등 총 60명이 참여해 1:1 맞춤형 구매 상담을 진행했다. 압력솥 냄비를 생산하는 'PN풍년'의 경우 태국 최대 홈퍼니싱 업체로 꼽히는 '인덱스 리빙몰' 주방 바이어와의 미팅을 통해 54억원 규모의 수출 상담 실적을 거뒀다. 현대홈쇼핑은 태국 현지 법인 하이(HIGH)쇼핑을 통해 이번 프로그램에 참여한 기업들의 제품을 방송할 계획이다. 이와 함께 현재 운영중인 '해외판로 개척 지원사업'을 적극 활용해, 현지 방송시 필요한 프로모션과 상품 인증 등 참여 기업들이 태국 시장에 안착할 수 있는 다양한 지원책을 함께 운영할 계획이다. 이경렬 현대홈쇼핑 대외협력팀장은 ""현지 방송 및 수출 등 계약 과정 전반에 있어 현대홈쇼핑 해외사업팀과 협력사를 매칭시켜 해외 판로 개척에 실질적인 도움이 될 수 있는 다양한 지원책을 운영해 나갈 것""이라며 ""참여 기업들이 개별적으로 유통시장을 견학하거나, 선호하는 특정 유통사와의 상담회를 마련하는 등 협력사의 니즈를 반영해 다음 프로그램을 진행할 계획""이라고 말했다."
동아일보,057050,/news/news_read.nhn?article_id=0003159472&office_id=020&mode=search&query=현대홈쇼핑&page=8,2018-07-20 10:15,"현대홈쇼핑, 21일 미국 뮤지컬 '오! 캐롤' 예매권 방송","현대홈쇼핑이 오는 21일 새벽 1시 10분부터 60분 동안 뮤지컬 '오! 캐롤'의 예매권을 방송한다고 20일 밝혔다. 뮤지컬 오! 캐롤은 미국의 싱어송라이터이자 히트곡 100여 곡을 보유한 ‘닐 세다카’의 대표 히트곡 ‘오 캐롤’ ’유 민 에브리씽 투미’ ‘원웨이 티켓’ ’스튜피드 큐피드’ 등 27개 곡을 활용해 만든 ‘주크박스 뮤지컬(기존 대중음악을 활용한 뮤지컬)’이다. 2005년 미국 초연 이후 지금까지 미국 전역에서 공연되고 있는 뮤지컬 중 하나로, 국내에서도 2016년 첫 공연을 시작한 이래 현재까지 누적관객 10만 명을 넘어섰다. 이번 방송에서 선보이는 예매권은 VIP석과 R석, 그리고 공연당 30석 밖에 되지 않아 티켓 오픈 시 가장 먼저 매진되는 무대 바로 앞 '오케스트라 피트석'인 OP석이다. 3종류 좌석 모두 50% 할인된 가격으로 VIP석 6만5000원, R석 5만5000원, OP석 6만 원이다. 이번 방송을 통해 예매권을 구매한 고객들은 다음달 25일부터 10월 7일까지 서울 구로구 디큐브아트센터 공연 중 원하는 날짜를 선택해 관람할 수 있다. 이번 방송을 통해 판매되는 예매권은 26일 1차 티켓 예매 오픈 전날인 25일 현대홈쇼핑 주문 고객만을 위한 선예매가 진행돼, 가장 먼저 원하는 좌석을 선택할 수 있는 것이 특징이다. 또한 방송에서는 오! 캐롤 메인 캐스팅 배우 박해미와 뮤지컬 배우 정상윤, 박한근이 직접 출연해 닐 세다카 유명 곡 원웨이 티켓, 오! 캐롤 등을 앙상블과 함께 뮤지컬 무대 그대로 재현해 볼거리를 더할 예정이다. 현대홈쇼핑은 방송 중 구매하는 모든 고객에게 주문 건당 정품 프로그램 북을 증정하고, 추첨을 통해 20명에게 쇼미디어그룹에서 진행하는 VIP석 공연 예매권(1인 2매)과 공연 배우의 친필 사인이 담긴 포스터 액자를 증정할 예정이다."
머니S,057050,/news/news_read.nhn?article_id=0000334988&office_id=417&mode=search&query=현대홈쇼핑&page=5,2018-08-13 08:49,"[STOCK] &quot;현대홈쇼핑, 실적 모멘텀 제한적이나 안정성&middot;저평가 메리트&hellip; 목표가...","KB증권은 13일 현대홈쇼핑에 대해 ""실적 모멘텀은 제한적이나 이익 안정성과 저평가 메리트는 유효하다""며 목표주가를 기존 14만원에서 14만5000원으로 소폭 상향했다. 투자의견은 '매수'를 유지했다. 박신애 KB증권 애널리스트는 ""올 2분기 별도 실적에서 회계기준 변경 요인을 제거한 취급고 성장률은 4% 수준이다. 마진이 낮은 렌탈 상품의 매출 비중이 상승한 영향으로 (회계기준 변경 요인을 제거한) 매출총이익은 전년동기대비 0.3% 하락했다""며 ""모바일 취급고가 전년대비 8% 성장하는데 그치면서 성장세가 10% 미만으로 둔화될 전망이다. 상반기에 SO수수료 인상폭은 미미했으나 하반기에는 IPTV향 SO수수료 부담이 다소 확대될 것으로 예상돼 올해 연간 인상률은 5% 안팎이 될 것""이라고 전망했다. 박기영 기자"
연합뉴스,057050,/news/news_read.nhn?article_id=0010239346&office_id=001&mode=search&query=현대홈쇼핑&page=7,2018-07-29 09:00,"현대홈쇼핑, '처치 곤란' 아이스팩 무료 수거 캠페인","(서울=연합뉴스) 이유미 기자 = 현대홈쇼핑이 아이스팩을 회수해 재활용하는 친환경 캠페인('북극곰은 얼음팩을 좋아해')을 업계 최초로 진행한다고 29일 밝혔다. 아이스팩은 선도 유지가 필요한 신선식품이 변질하지 않도록 식품 배송 시 반드시 들어가는 포장재 중 하나다. 현대홈쇼핑은 8월 한 달간 전국에서 캠페인 참여를 희망하는 고객 1천 명을 선착순으로 모집할 예정이다. 희망자는 현대H몰 캠페인 관련 페이지에서 이름과 주소, 연락처, 아이스팩 개수를 댓글로 남기면 된다. 현대홈쇼핑이 이를 접수하면 일주일 안에 택배업체에서 고객 집을 방문해 아이스팩을 직접 수거할 예정이다. 아이스팩은 10·20·30개 단위로 수거하며, 택배 비용은 현대홈쇼핑이 전액 부담한다. 타사 제품 구매로 보관 중인 아이스팩도 수거 대상이다. 캠페인 참여 고객에게는 현대백화점 온·오프라인 채널에서 현금처럼 사용할 수 있는 'H.포인트'를 지급한다. 현대홈쇼핑은 수거한 아이스팩을 모아 세척·냉동 등의 과정을 거쳐 식품 협력업체에 무상으로 제공할 예정이다. 현대홈쇼핑 관계자는 ""회수 비용과 포인트 적립 등으로 인해 아이스팩을 새로 구매해서 사용하는 것보다 비용이 많이 들지만, 환경보호의 중요성을 고객들에게 알리기 위해 이번 캠페인을 진행하게 됐다""고 말했다. 현대홈쇼핑 아이스팩 수거 캠페인 [현대홈쇼핑 제공=연합뉴스]"
파이낸셜뉴스,057050,/news/news_read.nhn?article_id=0004066195&office_id=014&mode=search&query=현대홈쇼핑&page=7,2018-07-29 09:01,"현대홈쇼핑, '친환경 아이스팩' 수거 캠페인 전개","현대홈쇼핑은 다음달 1일부터 아이스팩 수거 캠페인 '북극곰은 얼음팩을 좋아해'를 업계 최초로 진행한다고 29일 밝혔다. 아이스팩은 선도 유지가 필요한 신선 식품을 변질되지 않도록 하기 위해 함께 포장하는 보냉재로, 식품 배송시 반드시 들어가는 포장재 중 하나다. 현대홈쇼핑 관계자는 ""아이스팩을 버리려면 내용물은 종량제 봉투에 버리고 비닐 포장재는 분리배출해야 하지만 대부분 아이스팩 전체를 버리거나 냉동실에 보관하는 경우가 많다""며 ""온라인으로 장을 보는 고객들이 증가하면서 아이스팩을 어떻게 처리할 지 고민이라는 주부 고객들의 의견에서 아이디어를 얻어 이번 캠페인을 기획하게 됐다""고 말했다. 우선 한 달 동안 전국에서 캠페인 참여를 희망하는 고객 1000명을 선착순으로 모집할 예정이다. 캠페인 참여 방법은 온라인과 모바일로 현대홈쇼핑이 운영하는 인터넷 종합쇼핑몰 현대H몰 이벤트 코너에서 '북극곰은 얼음팩을 좋아해' 페이지를 선택한 뒤, 이름·주소·연락처·아이스팩 갯수를 댓글로 남기면 된다. 접수 후 일주일 이내 택배업체에서 고객 집을 방문해 직접 수거할 예정이다. 10·20·30개 단위로 아이스팩을 수거하고 택배 비용은 현대홈쇼핑이 전액 부담한다. 참여한 고객에게 현대백화점그룹 온·오프라인 채널에서 현금처럼 사용할 수 있는 'H.포인트' 2,000원·5,000원·1만원을 증정한다. 타사에서 제품을 구매해 보관 중인 아이스팩들도 크기와 종류에 상관없이 수거할 예정이다. 현대홈쇼핑은 수거한 아이스팩을 모아서 재활용 가능 여부를 판단한 뒤, 세척·냉동 등의 재사용 과정을 거쳐 식품 협력업체에 무상으로 제공할 계획이다."
디지털타임스,057050,/news/news_read.nhn?article_id=0002476741&office_id=029&mode=search&query=현대홈쇼핑&page=6,2018-08-10 09:45,"현대홈쇼핑, 추석 겨냥 주방 특화 프로그램 출시",[디지털타임스 김양혁 기자] 현대홈쇼핑은 오는 12일부터 다음 달 16일까지 매주 일요일 오전 8시 45분~10시 주방 고정 프로그램 '키친스토리'를 방송한다고 10일 밝혔다. 이번 방송은 추석 명절에 앞두고 주방용품 매출이 크게 증가하는 점을 고려헤 맞춤형 프로그램을 한시적으로 기획한 것이다. 실제 최근 3년간 현대홈쇼핑 주방용품 월별 매출을 보면 8~9월 매출이 설날(1월)을 제외하고 가장 높은 것으로 나타났다. 현대홈쇼핑은 방송마다 주문자 중 4명을 추첨해 초고속 블렌더 바이타믹스를 경품으로 제공하는 등 방송마다 다양한 판촉도 진행할 예정이다.
파이낸셜뉴스,057050,/news/news_read.nhn?article_id=0004073285&office_id=014&mode=search&query=현대홈쇼핑&page=6,2018-08-10 09:59,현대홈쇼핑 '추석 겨냥' 주방 특화 방송 '키친스토리' 론칭,"-오는 12일부터 6주 동안 매주 일요일 고정 방송       현대홈쇼핑은 추석을 겨냥해 오는 12일부터 6주 동안 주방 특화 프로그램 '키친스토리'를 매주 일요일 방송한다.    현대홈쇼핑은 6주 앞으로 다가온 민족 대명절 추석을 겨냥한 주방 특화 프로그램 '키친스토리'를 론칭한다. 해마다 추석 명절에 앞서 주방용품 매출이 크게 증가하는 만큼 맞춤형 프로그램을 통해 고객 공략에 나선 것이다. 10일 현대홈쇼핑은 오는 12일부터 다음달 16일까지 6주 동안 매주 일요일 오전 8시 45분부터 10시까지 주방 고정 프로그램 '키친스토리'를 방송한다고 밝혔다. 주방용품 수요가 늘어나는 추석이 다가오는 만큼 선제적으로 대응, 고객몰이에 집중하려는 것으로 풀이된다. 실제로, 최근 3년간 현대홈쇼핑 주방용품 매출을 월별로 분석해본 결과, 8월·9월 매출이 설날(1월)을 제외하고 가장 높은 것으로 나타났다. 명절과 이사 등의 수요가 겹쳐 주방매출이 크게 증가하는 추세라고 회사 측은 설명했다. 방송 첫주인 12일에는 현대홈쇼핑 주방용품 매출 1위 브랜드인 '세신퀸센스'의 스텐용기세트를 방송한다. 이날 방송에는 기존 스텐용기 12종(2000ml·1750ml·650ml·400ml·320ml 용기 각 2종)세트에 7종(1000ml 3종·2900ml 2종· 3700ml 2종)을 추가해 총 19종을 17만9000원에 선보인다. 현대H몰 앱으로 주문 결제한 고객에게는 3만3000원 할인 혜택을 제공한다. 19일에는 올 상반기 용기부문 매출 1위를 기록한 '더스텐 메탈그라운드 스텐용기' 세트를 방송한다. 현대홈쇼핑은 이번 시즌 고객들에게 좋은 반응을 얻은 주방용품 인기 브랜드를 순차적으로 선보일 계획이다. 현대홈쇼핑은 매 방송마다 주문고객 중 4명을 추첨해 초고속 블렌더 '바이타믹스'를 경품으로 제공하는 등 다양한 프로모션을 함께 진행할 예정이다. 현대홈쇼핑 관계자는 ""이미 방송에서 고객들의 높은 관심을 받은 인기 상품을 중심으로 편성하고, 기존 방송보다 혜택을 강화한 '가성비' 특화 방송으로 진행할 계획""이라며 ""앞으로도 시간대별로 구매 고객들의 특성과 상품군을 분석해 이를 겨냥한 맞춤형 '팝업' 프로그램을 다양하게 선보일 방침""이라고 말했다."
매일경제,057050,/news/news_read.nhn?article_id=0004151948&office_id=009&mode=search&query=현대홈쇼핑&page=15,2018-05-16 16:39,현대홈쇼핑 `꽃을 잊은 그대에게` 이벤트 실시,16일 오전 서울 강동구 천호동 현대홈쇼핑 본사에서 직원들이 `꽃을 잊은 그대에게` 이벤트를 소개하고 있다. [사진 제공 = 현대홈쇼핑] 현대홈쇼핑은 창사 17주년을 맞아 이달 말까지 플라워서브스크립션 전문업체 모이와 함께 '꽃을 잊은 그대에게' 이벤트를 실시한다고 16일 밝혔다. 현대H몰 내 이벤트 페이지에서 꽃을 선물하고 싶은 사연과 대상을 남기면 500명을 추첨해 3만원 상당의 꽃다발을 다음달 초 전달한다. 오는 31일까지 TV·플러스샵(데이터방송)·H몰 중 한 곳에서 1건 이상(3만원 이상) 구매 시 신청할 수 있다. [디지털뉴스국 배윤경 기자] r_start // r_end //
전자신문,057050,/news/news_read.nhn?article_id=0002731876&office_id=030&mode=search&query=현대홈쇼핑&page=6,2018-08-10 10:18,"현대홈쇼핑, 추석 겨냥 주방 특화 프로그램 '키친스토리' 론칭",현대홈쇼핑은 12일부터 다음달 16일까지 매주 일요일 오전 8시 45분 주방 고정 프로그램 '키친스토리'를 방영한다고 10일 밝혔다. 12일에는 현대홈쇼핑 주방용품 매출 1위 브랜드 '세신퀸센스' 스텐용기세트를 판매한다. 기존 스텐용기 12종(2000㎖·1750㎖·650㎖·400㎖·320㎖ 용기 각 2종)세트에 7종(1000㎖ 3종·2900㎖ 2종· 3700㎖ 2종)을 추가해 총 19종을 17만9000원에 판매한다. 현대H몰 모바일 애플리케이션(앱)으로 주문·결제한 고객에게는 3만3000원 할인 혜택을 제공한다. 19일에는 상반기 용기부문 매출 1위를 기록한 '더스텐 메탈그라운드 스텐용기' 세트를 방영한다. 현대홈쇼핑은 이번 시즌 고객들에게 좋은 반응을 얻은 주방용품 인기 브랜드를 순차로 선보일 계획이다. 매 방송마다 주문고객 중 4명을 추첨해 초고속 블렌더 '바이타믹스'를 경품으로 제공한다. 현대홈쇼핑 관계자는 “기존 방송보다 혜택을 강화한 '가성비' 특화 방송을 선보일 것”이라면서 “시간대 별로 구매 고 특성과 상품군을 분석해 맞춤형 팝업 프로그램을 다양하게 선보이겠다”고 말했다.
