source,symbol,link,date,title,content
이데일리,060240,/news/news_read.nhn?article_id=0003975286&office_id=018&mode=search&query=룽투코리아&page=1,2017-11-21 11:44,룽투코리아 &ldquo;게임사업에 집중&hellip;주주소통 지속&rdquo;,"- 20일 기업설명회 성료…사업현황·계획 소개 지난 20일 서울 여의도 코스닥협회 강당에서 열린 룽투코리아 기업설명회에서 참석자들이 설명을 듣고 있다.(사진=룽투코리아 제공) [이데일리 이명철 기자] 룽투코리아(060240)는 지난 20일 서울 여의도 코스닥협회 강당에서 열린 기업설명회(IR)에 참가했다고 21일 밝혔다. 이번 행사는 국내외 기관 투자자, 애널리스트와 개인주주 등 40여명이 참석했다. 회사는 이곳에서 회사 소개와 사업 현황 전반을 설명하고 그동안 진행된 사업 성과와 추후 진행할 사업 전략을 발표했다. 회사는 발표를 통해 지속 적자를 기록했던 교육사업부 물적 분할과 매각으로 게임사업에 더욱 집중하는 구조를 만들었다고 강조했다. 발표 후 현장에 참석한 투자자 질의응답과 멘토링이 이어졌다. 김봉준 상무이사는 “앞으로 주기적으로 기업설명회를 진행해 지속 주주소통을 해나가겠다”며 “기업 투명성 증진과 전문성 강화로 주주가치를 극대화하고 공정한 기업 활동을 위해 최선을 다하겠다”고 말했다."
서울경제,060240,/news/news_read.nhn?article_id=0003134557&office_id=011&mode=search&query=룽투코리아&page=1,2017-10-20 11:14,"룽투코리아, 열혈강호 for kakao 한달 만에 사전 예약자 수 100만 넘어&middot;...","[서울경제] 룽투코리아(060240) 는 오는 24일 정식 출시 예정인 초대형 신작 모바일 MMORPG(다중접속역할수행게임) 의 사전 예약자 수가 100만명을 넘어섰다고 20일 밝혔다. 지난 9월 말 사전예약 이벤트 시작 당시 일주일 만에 60만명이 참여한 데 이어 한 달여 만에 100만 명이 넘는 이용자가 몰려 정식 출시 전 하반기 기대 작 중 하나임을 다시 한번 입증했다. 이홍의 게임사업본부장은 “가 많은 유저들의 관심 가운데 사전예약자 수 100만명을 기록하는 등 유의미한 성과를 거두고 있어 기쁘게 생각한다”며 “게이머들의 기대가 큰 만큼 좋은 게임과 양질의 서비스를 선보일 수 있도록 심혈을 기울이겠다”고 말했다. 한편, 는 중국 조이파이게임(Joypiegame)이 개발하고 자사에서 서비스하는 게임으로 누적 판매부수 600만 기록의 인기만화 ‘열혈강호’에서 시도되는 최초의 모바일 MMORPG이며 풀 3D로 구현된 그래픽과 원작 주인공들을 SD캐릭터로 표현해 귀여움과 유쾌함을 담은 무협 대작 게임이다. 이미 중화권에서 검증된 게임성을 그대로 가져오면서도 최신 트렌드에 맞게 그래픽 리소스를 교체한 것이 특징이다."
아시아경제,060240,/news/news_read.nhn?article_id=0003864257&office_id=277&mode=search&query=룽투코리아&page=1,2016-11-07 09:42,"룽투코리아, 3분기 영업익 43억원&hellip;전년比 흑자전환",[아시아경제 박선미 기자]룽투코리아는 3분기 영업이익이 43억400만원으로 전년 동기대비 흑자전환했다고 7일 공시했다. 매출액은 533.19% 늘어난 283억6700만원으로 집계됐다.
한국경제,060240,/news/news_read.nhn?article_id=0003939924&office_id=015&mode=search&query=룽투코리아&page=1,2018-05-16 09:49,"[룽투코리아] 10% 이상 상승, 2017.4Q, 매출액 227억(+21.0%),...","룽투코리아가 장 초반 부터 전일 대비 +10%이상 상승하고 있다. 16일 오전 09시 45분 룽투코리아는 전 거래일보다 10.23% 오른 6,570원에 거래되고 있다. 주가의 흐름을 살펴보면 6,000원으로 개장해서 장중 한때 5,990원(+0.5%)까지 살짝 밀렸지만, 다시 큰 폭으로 올라서 현재 6,570원(+10.23%)까지 상승하고 있다. ◆ 최근 분기 실적 - 2017.4Q, 매출액 227억(+21.0%), 영업이익 32억(+3862.5%) 룽투코리아의 2017년 4사분기 매출액은 227억으로 전년동기 대비 21.03% 상승했고, 영업이익은 32억으로 전년동기 대비 3862.5% 증가했다. 이 기업은 지난 2분기 동안의 연속 적자를 깨고 2017년 4분기에 영업이익 흑자 전환에 성공했다. 이번 분기의 매출액은 지난 3년 평균 분기 매출액을 217% 상회하는 수준이고, 영업이익은 지난 3년 평균 분기 영업이익을 4090% 상회하는 수준이다. 이 회사의 매출액 증가율과 영업이익 증가율은 각각 코스닥 상위 25%, 상위 1%에 랭킹되고 있다. [표]룽투코리아 분기실적 한경로보뉴스 이 기사는 한국경제신문과 씽크풀이 공동 개발한 기사 자동생성 알고리즘에 의해 실시간으로 작성된 것입니다. ["
머니투데이,060240,/news/news_read.nhn?article_id=0003777624&office_id=008&mode=search&query=룽투코리아&page=1,2016-11-22 15:06,"룽투코리아, '크로스파이어' 모바일 게임 中 판호 획득","[머니투데이 김남이 기자] /사진제공=룽투코리아 룽투코리아는 중국 모회사 룽투게임에서 개발한 크로스파이어 모바일 TPS (3인칭 슈팅) 게임 '천월화선 : 중반전장'이 중국 서비스를 위한 판호(중국 현지 서비스 허가권)를 취득했다고 22일 밝혔다. 룽투코리아는 지난 1일 중국 미디어를 총괄하는 정부기관인 국가신문출판광전총국으로부터 '천월화선 : 중반전장'에 관한 판호(유통 허가)를 획득, 빠른 시일 내 게임 출시를 목표로 막바지 준비 작업 중이다. 회사 관계자는 ""올해 7월 이후 중국 모바일 게임 판호가 의무제로 변경되면서 한류콘텐츠에 대한 엄격한 규제를 적용하고 있다""며 ""이 상황에서 '천월화선 : 중반전장'의 판호 허가증 취득은 남다른 의미를 갖는다""고 설명했다. 룽투코리아는 게임의 성공적인 서비스를 위해 모회사인 중국 룽투게임과 함께 중국 현지에서 우호적인 관계를 맺고 있는 대표적인 안드로이드 마켓 360, 바이두 등과 긴밀한 협력체계를 바탕으로 게임 정식 서비스를 이어갈 예정이다. 최성원 룽투코리아 사업총괄이사는 “'천월화선 : 중반전장'은 중국에서 S급 IP인 크로스파이어를 기반으로 제작된 게임인 만큼 룽투그룹 차원에서도 굉장히 중요한 프로젝트로 인식하고 있다”며 ”빠른 시일 내 완성도 높은 게임 출시와 성공적인 런칭을 위해 룽투의 모든 역량을 쏟아 부을 계획""이라고 전했다. 한편 크로스파이어는 글로벌 최고 동시접속자 600만명을 돌파하고 연 매출 1조 5000억원을 기록한 중국 인기 1위의 게임이다. 지난해 룽투코리아에서 크로스파이어 IP 홀더인 스마일게이트와 모바일 TPS 게임 개발에 대한 라이선스 및 중국 퍼블리싱 계약을 체결했다. textlinktopstart textlinktopend textlinkstart"
아시아경제,060240,/news/news_read.nhn?article_id=0004099082&office_id=277&mode=search&query=룽투코리아&page=1,2017-10-20 14:00,룽투코리아 &quot;'열혈강호 for kakako' 사전 예약자 100만명 넘어&quot;,"[아시아경제 박선미 기자]룽투코리아는 오는 24일 정식 출시 예정인 초대형 신작 모바일 MMORPG(다중접속역할수행게임) '열혈강호 for kakao'의 사전 예약자 수가 100만명을 넘어섰다고 20일 밝혔다. 지난 9월 말 사전예약 이벤트 시작 당시 일주일 만에 60만명이 참여한 데 이어 한 달여 만에 100만 명이 넘는 이용자가 몰렸다. 영화배우 오달수가 모바일 게임 공식 홍보모델로 선정되면서 관심도 높아졌다. 룽투코리아는 사전예약 100만 돌파를 기념한 추가 이벤트를 진행한다. 우선, '열혈강호 for kakao' 공식 카페 가입 및 이벤트에 참여하는 이용자에게는 카카오톡 이모티콘 밍밍이를 선착순 2만명에게 제공한다. 사전예약 이벤트에 참여하는 이용자 전원에게 1000귀속 금화를 증정하고, 구글 플레이 스토어에 마련된 사전예약에 참여하는 이용자에게는 50만 금전 추가 제공, 또 카카오 게임을 통해 사전예약에 참여할 경우 '한비광-담화린 카카오톡 이모티콘'을 증정한다. 추가로 카카오 게임 사전예약 후 공유하기 버튼을 통해 친구 초대 이벤트에 참여하는 유저에게는 초대 완료된 친구 수에 따라 다양한 보상을 지급하는 등 이벤트도 진행한다."
이데일리,060240,/news/news_read.nhn?article_id=0003668109&office_id=018&mode=search&query=룽투코리아&page=1,2016-11-04 11:10,룽투코리아. 지스타서 &lsquo;아톰&rsquo; 등 신작 6종 선보인다,"- 신작 모바일게임, VR·AR게임 등 공개 예정 룽투코리아 지스타 출품작.(이미지=룽투코리아 제공) [이데일리 이명철 기자] 룽투코리아(060240)는 오는 17~20일까지 부산 벡스코에서 열리는 ‘지스타2016’에 프리미어 스폰서십으로 참가를 확정하고 신작 라인업을 공개한다고 4일 밝혔다. 100부스 규모 B2C부스와 야외부스를 마련하고 신작 모바일 게임 4종, 가상현실(VR) 게임 1종, 증강현실(AR) 게임 1종 등 미공개 신작을 포함한 신규게임을 선보일 예정이다. 먼저 지난달 31일 원스토어 출시 후 정식 출시를 앞둔 ‘아톰의 캐치캐치’를 소개한다. 인기 만화 캐릭터인 ‘아톰’과 ‘레오’를 내세운 수집형 역할수행게임(RPG)이다. 내년 상반기 기대작인 ‘히어로즈 오브 스카이렐름(Heroes of Skyrealm) : 천공의 성’도 공개된다. 3D 고퀄리티 그래픽을 바탕으로 제작된 액션 RPG로 시뮬레이션게임(SLG)과 적진점령(AOS) 모드 등의 요소가 결합됐다. 일본풍 2D 일러스트를 적용한 트레이딩카드게임(TCG)형 RPG ‘나선경계선’과 대만 유명 애니메이션 기반으로 제작된 미소녀 수집 함대 시뮬레이션 ‘강철소녀’도 출품한다. 실내부스에는 VR·AR존을 마련하고 방문객 대상 게임 체험존도 운영한다. 모회사인 중국 룽투게임이 준비 중인 격투 소재 VR게임 ‘파이널포스’도 준비됐다. 포켓로이드라고 알려진 AR게임 ‘마이크로볼츠AR’도 나온다. 특설무대에서는 ‘검과마법’ e스포츠 대회와 인기가수 태연 팬사인회를 진행한다. 국내 유명 레이싱 모델로 구성된 10인의 부스걸 ‘룽투쓰’를 내세워 게임 콘셉트 코스프레쇼와 아이돌 댄스 등 특별공연을 진행할 계획이다. 회사 관계자는 “지스타를 시작으로 하반기부터 게임 출시를 본격화할 방침”이라며 “국내 게임업계에서 입지를 공고히하겠다”고 전했다."
파이낸셜뉴스,060240,/news/news_read.nhn?article_id=0003687039&office_id=014&mode=search&query=룽투코리아&page=1,2016-08-03 08:59,"룽투코리아, 스포츠 체감형 가상현실(VR) 게임 시장 접수 나선다","룽투코리아가 ‘검과마법 for Kakao’ 대 흥행을 시작으로 성장성이 큰 스포츠 체감형 VR게임 시장 접수에 나선다. 3일 룽투코리아는 탁구게임 개발의 명가 브리디아스마트와 가상현실(VR, Virtual Reality)게임 퍼블리싱 계약을 체결하고 본격적인 VR 사업을 전개한다고 밝혔다. 실제 룽투그룹은 지난 2015년 HMD(Head Mounted Dislpay, 머리에 쓰는 형태의 디스플레이 기기)로 유명한 회사에 투자를 시작으로 VR 게임사업에 공을 들이고 있다. 향후 중국 ‘룽투게임’이 개발 중인 격투 소재의 VR게임 ‘Final Force VR (파이널 포스 VR)’과 FPS(First-person shooter)를 비롯해 애니메이션, 체험형 게임 등 다양한 VR콘텐츠를 확보하고 VR 하드웨어 기기 산업에도 적극 투자할 계획이다. 룽투코리아 관계자는 “2020년까지 약 700억 달러에 이를 것으로 예상되는 VR사업 전개를 위해 룽투그룹은 지난해부터 R&D 및 인프라 투자에 주력해 왔고 이번 VR게임 사업 진출은 모기업과의 협업을 통해 초기시장을 선점하겠다는 의지”라며 “VR게임의 대중화를 위해 모두가 부담 없이 즐길 수 있는 캐주얼 스포츠 콘텐츠를 시작으로 다양한 체감형 장르로 발전시키겠다” 고 전했다. 이번 계약에 따라 룽투코리아는 브리디아스마트에서 개발중인 VR 게임 ‘맞짱탁구’의 전세계 판권을 획득하고 글로벌 서비스를 맡게 된다. 빠르면 연내 국내 최대의 게임쇼인 지스타를 통해 게임을 선보일 예정이다. 또 룽투코리아는 향후 ‘맞짱탁구’를 시작으로 테니스, 배드민턴 등과 접목한 스포츠형 VR게임을 선보여 중국, 북미, 유럽, 인도네시아 등을 적극 공략하겠다는 계획이다. 그 외에도 레이싱 등 체감형 VR 게임을 지속적으로 확보해 VR게임의 장르 다변화에 힘 쓸 방침이다. 최성원 룽투코리아 사업총괄이사는 “모바일 게임 사업에 이어 향후 큰 성장이 기대되는 VR게임 퍼블리싱 산업에 진출하기 위해 국내외 개발사들과 논의 중”이라며 “모회사와의 협력을 통해 VR 관련 콘텐츠와 하드웨어를 모두 아우르는 VR 선도기업으로 자리잡겠다”고 포부를 밝혔다. 한편 브리디아스마트는 액션스포츠 전문 게임 개발사로 2014년 모바일 게임 ‘역전맞짱탁구’를 출시해 구글 플레이 스토어 인기순위 1위, 최고매출 10위를 달성한 바 있다."
이데일리,060240,/news/news_read.nhn?article_id=0003601260&office_id=018&mode=search&query=룽투코리아&page=1,2016-08-03 09:07,"[특징주]룽투코리아, VR 게임 시장 진출 소식에 '상승'","[이데일리 임성영 기자] 룽투코리아(060240)가 상승세다. 가상현실(VR)게임 시장에 진출한다는 소식이 주가에 영향을 주는 모습이다. 3일 오전 9시 5분 현재 룽투코리아는 전일대비 1.9% 오른 1만3400원에 거래되고 있다. 룽투코리아는 탁구게임 개발의 명가 ㈜브리디아스마트와 VR게임 퍼블리싱 계약을 체결했다고 이날 밝혔다. 이번 계약으로 룽투코리아는 브리디아스마트에서 개발중인 VR 게임 ‘맞짱탁구’의 전세계 판권을 획득하고 글로벌 서비스를 맡게 된다. 빠르면 연내 국내 최대의 게임쇼인 지스타를 통해 게임을 선보일 예정이다. 앞으로 테니스, 배드민턴 등과 접목한 스포츠형 VR게임을 선보여 중국, 북미, 유럽, 인도네시아 등을 적극 공략하겠다는 계획이다. 회사 관계자는 “2020년까지 약 700억 달러에 이를 것으로 예상되는 VR사업을 위해 룽투그룹은 지난해부터 연구개발(R&D)과 인프라 투자에 주력해 왔다”며 “VR게임의 대중화를 위해 모두가 부담 없이 즐길 수 있는 캐주얼 스포츠 콘텐츠를 시작으로 다양한 체감형 장르로 발전시키겠다”고 전했다."
파이낸셜뉴스,060240,/news/news_read.nhn?article_id=0004022061&office_id=014&mode=search&query=룽투코리아&page=1,2018-05-16 09:53,[fnRASSI]룽투코리아(060240) 현재 +10.07%,"현재 룽투코리아(060240)는 전일대비 10.07% 상승하여 6,560원 선에서 거래가 이루어지고 있다. 외국인투자자의 거래참여 활발, 거래비중 20.56% 최근 한달간 주체별 거래비중을 살펴보면 개인이 79.34%로 가장 높은 참여율을 보였고, 외국인이 20.56%를 보였으며 기관은 0.08%를 나타냈다. 그리고 최근 5일간 거래비중은 개인이 전체 거래량의 79.32%를 차지하며 가장 활발한 참여를 보였고, 외국인은 20.66%, 기관은 0.01%의 거래 참여율을 보였다. 기관과 개인은 순매도, 외국인은 순매수(한달누적)  전일까지 외국인이 2일 연속, 기관이 3일 연속 각각 동종목을 순매도 했다. 4주간을 기준으로 보면 외국인이 매기를 떨어뜨리면서도 173,633주를 순매수한 반면, 기관은 매도 우위를 지속하면서 2,865주를 순매도했고, 개인들도 매도 우위를 보이면서 170,768주를 순매도한 것으로 집계됐다. 'fnRASSI'는 증권전문 기업 씽크풀과 파이낸셜뉴스의 협업으로 로봇기자가 실시간으로 생산하는 기사입니다."
머니투데이,060240,/news/news_read.nhn?article_id=0003765413&office_id=008&mode=search&query=룽투코리아&page=1,2016-10-31 13:47,"룽투코리아, 내달 7일 3Q 실적 발표 예고",[머니투데이 백지수 기자] 룽투코리아는 내달 7일 올해 3분기까지의 누적 실적을 발표할 예정이라고 31일 공시했다. textlinktopstart textlinktopend textlinkstart
전자신문,060240,/news/news_read.nhn?article_id=0002654949&office_id=030&mode=search&query=룽투코리아&page=1,2017-11-07 12:17,[ET투자뉴스][룽투코리아 지분 변동] LONGTUGAMEHKLIMITED 외 1...,"룽투코리아(060240)는 07일 최대주주 LONGTUGAMEHKLIMITED를  비롯한 특별관계자의 보유주식이 증가되었다고 발표했다. 이는 직전 보고일보다 1,186,239주 증가하여 지분율은 43.91%로 상승했다. 이번 보고 사유는 유상증자로인한보유주식수증가로  알려졌다.   최대주주와 특수관계자의 지분 변동은 주가에 영향을 주는 요인이다. 특히 보유비율을 지속적으로 늘리거나 줄일 경우, 해당종목 투자시 유의할 필요가 있다.  다음은 룽투코리아의 지분 변동 내역과 보유 내역이다."
연합뉴스,060240,/news/news_read.nhn?article_id=0009522364&office_id=001&mode=search&query=룽투코리아&page=1,2017-09-05 09:06,"[특징주] 룽투코리아, 자금 유입 기대감에 강세",(서울=연합뉴스) 조민정 기자 = 소프트웨어 개발업체 룽투코리아가 100억원 규모의 유상증자 소식에 5일 장 초반 강세다. 이날 오전 9시5분 현재 코스닥시장에서 룽투코리아는 전날보다 5.42% 오른 1만500원에 거래 중이다. 이 업체는 전날 장 마감 후 타법인 증권 취득자금 100억원을 조달하기 위해 제3자 배정 방식의 유상증자를 결정했다고 공시했다. 신주 상장 예정일은 오는 11월17일이다.
한국경제,060240,/news/news_read.nhn?article_id=0003634522&office_id=015&mode=search&query=룽투코리아&page=1,2016-08-03 09:12,"[특징주]룽투코리아, VR 스포츠게임 서비스 소식에 '상승'","[ 김아름 기자  ] 룽투코리아가 가상현실(VR)을 이용한 스포츠 게임 시장에 진출한다는 소식에 상승세다. 3일 오전 9시9분 현재 룽투코리아는 전날보다 250원(1.90%) 오른 1만3400원에 거래되고 있다. 룽투코리아는 이날 오전 브리디아스마트가 개발 중인 VR 탁구 게임 '맞짱탁구'의 글로벌 판권을 획득했다고 밝혔다. 앞으로 테니스, 배드민턴 등 스포츠형 VR게임으로 글로벌 시장을 공략하겠다는 계획이다. 브리디아스마트는 액션스포츠 전문 게임 개발사로 2014년 모바일 게임 '역전맞짱탁구'를 출시해 구글 플레이 스토어 인기순위 1위, 최고매출 10위를 달성한 바 있다. 김아름 한경닷컴 기자"
매일경제,060240,/news/news_read.nhn?article_id=0003740154&office_id=009&mode=search&query=룽투코리아&page=1,2016-05-30 12:12,"로코조이, `열혈강호 모바일` 퍼블리싱 계약&hellip;&quot;중화권은 룽투코리아와 협의 `필요`...","로코조이가 인기 만화 ‘열혈강호’를 기반으로 제작 중인 모바일게임의 퍼블리싱 계약을 체결했다. 이번 계약을 통해 로코조이는 내년 하반기에 중화권을 제외한 지역에 해당 게임을 출시할 예정이다. 중화권의 경우 룽투코리아가 독점 권한을 보유하고 있어 향후 양사간의 협의가 필요할 전망이다. 30일 로코조이인터내셔널(대표 싱샨후)은 비누스엔터테인먼트가 개발한 모바일게임 ‘열혈강호 모바일’의 퍼블리싱 계약을 체결했다고 밝혔다. 로코조이는 이번 계약을 통해 내년 하반기 중화권 이외의 지역에 해당 게임을 출시할 방침이다. 로코조이에 따르면 ‘열혈강호 모바일’은 스타일리시 액션을 강조한 무협 RPG로 원작의 무공 등을 실감나게 재현했다. 파티 플레이 기반의 레이드 시스템과 전략이 강화된 대전 콘텐츠도 특징이다. 로코조이측은 이 게임이 만화는 물론 PC온라인게임으로도 높은 인지도를 갖고 있는 만큼 초반 인기 몰이가 수월할 것이라고 내다봤다. 다만 중국과 홍콩, 싱가포르 등 중화권 시장의 경우 서비스를 위해서는 해당 지역에 대한 독점 권한을 보유한 룽투코리아와 협의가 필요한 상황이다. 룽투코리아는 지난해 6월 중화권 시장에 대한 독점 계약을 체결하고 중국 룽투게임즈를 통해 ‘열혈강호’ IP를 활용한 모바일게임 개발에 착수한 바 있다."
연합뉴스,060240,/news/news_read.nhn?article_id=0008831469&office_id=001&mode=search&query=룽투코리아&page=1,2016-11-17 19:24,룽투코리아의 최성원 사업총괄이사,(부산=연합뉴스) 룽투코리아의 최성원 사업총괄이사(39)가 17일 부산 벡스코의 '지스타' 현장에서 연합뉴스와의 인터뷰에 응하고 있다. 중국계 게임회사인 룽투코리아는 올해 지스타에서 외국계 업체로는 처음으로 2위 협찬사로 나서 화제가 됐다. 2016.11.17 [룽투코리아 제공 제공=연합뉴스]
서울경제,060240,/news/news_read.nhn?article_id=0002865263&office_id=011&mode=search&query=룽투코리아&page=1,2016-08-03 08:46,"룽투코리아, 증강현실&middot;가상현실게임 동시 진출","룽투코리아(060240)는 가칭 포켓로이드로 이름 붙여진 증강현실(AR) 게임 사업 진출에 이어 스포츠 체감형 VR게임 시장에 진출한다. 룽투코리아는 브리디아스마트와 가상현실(VR) 게임 퍼블리싱 계약을 체결하고 본격 VR게임 사업을 시작한다고 3일 밝혔다. 이에 대해 룽투코리아 관계자는 “2020년까지 약 700억 달러에 이를 것으로 예상되는 VR사업 전개를 위해 룽투그룹은 지난해부터 R&D 및 인프라 투자에 주력해 왔었다. 이번 당사의 VR게임 사업 진출은 모기업과의 협업을 통해 초기시장을 선점하겠다는 의지이자 첫 단추” 라며 “VR게임의 대중화를 위해 모두가 부담 없이 즐길 수 있는 캐주얼 스포츠 콘텐츠를 시작으로 다양한 체감형 장르로 발전시키겠다” 고 전했다. 실제로 룽투그룹은 지난 2015년 HMD(Head Mounted Dislpay, 머리에 쓰는 형태의 디스플레이 기기)로 유명한 회사에 투자를 시작으로 VR 게임사업에 공을 들이고 있다. 향후 중국 ‘룽투게임’이 개발 중인 격투 소재의 VR게임 ‘Final Force VR (파이널 포스 VR)’과 FPS(First-person shooter)를 비롯해 애니메이션, 체험형 게임 등 다양한 VR콘텐츠를 확보하고 VR 하드웨어 기기 산업에도 적극 투자할 계획이다. 이번 계약에 따라 룽투코리아는 브리디아스마트에서 개발중인 VR 게임 ‘맞짱탁구’의 전세계 판권을 획득하고 글로벌 서비스를 맡게 된다. 빠르면 연내 국내 최대의 게임쇼인 지스타를 통해 게임을 선보일 예정이다. 또한 룽투코리아는 향후 ‘맞짱탁구’를 시작으로 테니스, 배드민턴 등과 접목한 스포츠형 VR게임을 선보여 중국, 북미, 유럽, 인도네시아 등을 적극 공략하겠다는 계획이다. 그 외에도 레이싱 등 체감형 VR 게임을 지속적으로 확보해 VR게임의 장르 다변화에 힘 쓸 방침이다. 이에 대해 최성원 룽투코리아 사업총괄이사는 “모바일 게임 사업에 이어 향후 큰 성장이 기대되는 VR게임 퍼블리싱 산업에 진출하기 위해 국내외 개발사들과 논의중”이라며, “모회사와의 협력을 통해 VR 관련 콘텐츠와 하드웨어를 모두 아우르는 VR 선도기업으로 자리잡겠다”고 포부를 밝혔다."
한국경제,060240,/news/news_read.nhn?article_id=0003635072&office_id=015&mode=search&query=룽투코리아&page=1,2016-08-04 09:42,"룽투코리아, 2분기 영업익 12억&hellip;전년比 흑자전환",[ 권민경 기자  ] 룽투코리아는 2분기 연결 영업이익이 12억8400만원으로 작년 동기와 비교해 흑자전환했다고 4일 공시했다. 같은 기간 매출은 331% 증가한 155억9200만원으로 집계됐다. 권민경 한경닷컴 기자
