source,symbol,link,date,title,content
부산일보,060240,/news/news_read.nhn?article_id=0000674336&office_id=082&mode=search&query=룽투코리아&page=1,2017-02-02 11:21,"룽투코리아, 펀플 '스펠나인' 품었다&hellip;IP 독점개발 계약 체결","룽투코리아가 국내 신생 개발사 펀플의 지적재산권(IP) ‘스펠나인’을 품었다.   중국계 게임사 룽투코리아(대표 양성휘)는 펀플(대표 조영기·이시형)과 모바일 액션RPG ‘스펠나인’에 대한 IP 독점 계약을 체결했다고 2일 밝혔다.   룽투코리아는 이번 계약을 통해 중국 모회사인 룽투게임과 함께 ‘스펠나인’의 아트웍 리소스 및 지식재산권을 활용한 모바일게임 개발과 중국 지역 서비스를 독점으로 진행할 계획이다.   펀플은 ‘스펠나인’의 새로운 모바일게임 개발에 필요한 서버 소스, 클라이언트 소스, 아트 리소스, 사운드 리소스, 웹툰 리소스 등 게임 개발에 필요한 기술협력을 지원하고 향후 모바일게임 성과에 따른 로열티를 받게 된다.   작년 6월 네시삼십삼분을 통해 출시된 ‘스펠나인’은 대규모 전쟁 콘텐츠, 장편소설 20권 분량의 방대한 스토리 등으로 주목받았던 모바일 액션RPG다.   특히 이 게임은 총 245장 886컷에 이르는 만화를 통해 게임 스토리를 전달하는 등 차별화된 요소를 제공해 눈길을 모았었다.   룽투코리아는 펀플과 협력체계를 바탕으로 ‘스펠나인’을 모바일 MMORPG(다중접속역할수행게임) 또는 MORPG(다중사용자역할수행게임) 장르의 게임으로 개발할 예정이다.   양성휘 룽투코리아 대표는 “펀플의 야심작 ‘스펠나인’을 통해 웰메이드 게임의 가치를 중국 게이머들에게 선보일 수 있는 기회가 되길 바란다”며, “자사 대표작인 ‘검과마법’을 통해 축적된 노하우를 살려 ‘스펠나인’이 거대한 중국 시장에서 의미 있는 타이틀로 자리매김 할 수 있도록 개발과 서비스에 최선을 다하겠다”고 말했다.   펀플 조영기 대표는 “펀플의 핵심 IP인 ‘스펠나인’을 풍부한 개발 및 서비스 경험을 보유한 룽투코리아와 함께하게 돼 기쁘다”며 “양사간 긴밀한 협력을 통해 중국에서 높은 수준의 ‘스펠나인’을 선보이도록 노력해 나가겠다”고 전했다.  "
머니투데이,060240,/news/news_read.nhn?article_id=0003878661&office_id=008&mode=search&query=룽투코리아&page=1,2017-05-26 13:58,"룽투코리아, 신작 모바일게임 '아이테르' 정식 출시","[머니투데이 서진욱 기자] 룽투코리아가 신작 모바일게임 '아이테르:천공의성'(이하 아이테르)을 정식 출시했다고 26일 밝혔다. 아이테르는 3D ARPG(액션역할수행게임) 장르 모바일게임이다. 동서양을 대표하는 영웅 30여종과 함께 공중요새 '천공의성'을 발전시켜 나가는 재미를 담았다. 사전 예약자 50만명을 넘어설 정도로 출시 전부터 흥행 기대감을 모았다. 뛰어난 그래픽과 타격감뿐 아니라 SLG(시뮬레이션게임) 모드, 디펜스 게임 방식의 UGC(이용자 제작 콘텐츠) 모드 등을 접목해 차별화된 재미를 선사한다. 룽투코리아는 게임 출시를 기념해 오는 6월 23일까지 '레벨 성장' 이벤트를 진행한다. 40 레벨을 달성하고 공식 카페에 스크린샷을 남겨 인증하는 이용자에게는 '갤럭시S8'과 '시크릿 선물 세트'를 추첨을 통해 지급한다. 20 레벨과 30 레벨을 인증한 이벤트 참여자에게는 '도미노 피자' 외식상품권과 문화상품권 등을 선물한다. 알뜰폰(MVNO) 사업자과 제휴한 이벤트도 진행한다. 미니게이트 'M2모바일'이 출시한 '룽투 요금제' 가입 시 선택한 요금제에 따라 다양한 게임 아이템을 매달 지급한다. textlinktopstart textlinktopend textlinkstart"
매일경제,060240,/news/news_read.nhn?article_id=0003645146&office_id=009&mode=search&query=룽투코리아&page=1,2015-12-16 11:35,"[게임스톡] 룽투코리아, 급등세&hellip;22% 올라",룽투코리아(060240)가 급등세를 보이고 있다. 16일 오전 11시 30분 룽투코리아는 전거래일 대비 22.71% 오른 1만2050원에 거래되고 있다. 전일에는 10.21% 올랐다. 룽투코리아의 경우 오는 21일 중국 본사 룽투게임즈가 북경에서 전략발표회를 진행하는 것으로 알려졌다. 스마일게이트와 공동개발하는 모바일 TPS게임 ‘크로스파이어’를 비롯해 ‘열혈강호’ 모바일 등의 주요 라인업을 발표하고 스마트폰 메신저 ‘라인’을 서비스하는 라인과 합작투자한 란투게임즈 관련 소식도 공개될 것으로 예측되고 있다. 이와관련 룽투코리아측은 “현재 중국 본사와 전략발표회 관련 내용을 논의 중”이라며 “금주 중 명확한 일정 및 내용 등을 밝힐 수 있을 것”이라고 설명했다. 한편 룽투코리아는 지난 7일에도 본사 전략발표회 개최 소식에 상한가를 기록한바 있다.
전자신문,060240,/news/news_read.nhn?article_id=0002724633&office_id=030&mode=search&query=룽투코리아&page=1,2018-07-17 13:40,룽투코리아 타이곤 모바일 잔여지분 인수.. 100% 자회사 편입,"룽투코리아가 타이곤 모바일(이하 타이곤)의 잔여지분 전량을 인수한다. 기존 룽투코리아와 모회사 룽투게임의 타이곤 지분율은 64.57%였으나, 이번 계약으로 나머지 지분 35.43%를 인수했다. 타이곤은 룽투코리아의 100% 자회사로 편입된다. 룽투코리아 관계자는 “'열혈강호'를 활용한 신규 추진 사업 성장성을 높게 평가한 것”이라며 “넵튠 전략 투자로 사업적 협력을 지속할 방침”이라고 전했다. 넵튠은 “열혈강호 IP뿐만 아니라 사업 전반에 대한 협력 관계를 지속시킬 수 있는 신뢰를 바탕으로 한 결정“이라고 말했다. 룽투코리아는 열혈강호 IP를 활용한 모바일 게임 사업을 더욱 확대하겠다는 전략이다. 양성휘 룽투코리아 대표는 “'열혈강호'는 게임 시장에서 높은 인기를 구가하는 IP”라며 “고부가가치를 창출하는 핵심 IP로 자리 잡을 수 있도록 하겠다”고 전했다."
헤럴드경제,060240,/news/news_read.nhn?article_id=0001054468&office_id=016&mode=search&query=룽투코리아&page=1,2016-05-23 13:58,"룽투코리아, 50억 규모 사모 CB 발행 결정","[헤럴드경제=박영훈 기자] 룽투코리아는 운영자금 조달을 위해 50억원 규모의 무기명 사모 전환사채를발행키로결정했다고 23일 공시했다. 표면이자율 0%, 만기이자율 2.5%, 사채만기일은 2020년 5월 30일이다. 전환가액은 1만2000원이며 전환청구기간은 2017년 5월 30일부터 2020년 4월 29일까지다. 발행 대상자는 주식회사 엔진이다."
아시아경제,060240,/news/news_read.nhn?article_id=0004002126&office_id=277&mode=search&query=룽투코리아&page=1,2017-05-26 14:31,"룽투코리아, '아이테르:천공의 성' 출시","[아시아경제 한진주 기자] 룽투코리아가 모바일 3D ARPG(액션역할수행게임) '아이테르:천공의 성'(이하 아이테르)을 구글 플레이와 애플 앱스토어에 정식 출시했다. '아이테르'는 동서양을 대표하는 영웅 30여종과 함께 공중요새 '천공의 성'을 발전시켜 나가는 재미를 담은 모바일 액션 RPG다. 아이테르는 탄탄한 시나리오를 바탕으로 고화질 3D 그래픽과 시원시원한 타격감을 살린 액션 RPG의 묘미와 SLG 모드(시뮬레이션게임), 디펜스 게임 방식의 UGC 모드(이용자 제작 콘텐츠) 등을 접목했다. 룽투코리아는 '아이테르' 정식 출시를 기념해 내달 23일까지 레벨 성장 이벤트를 진행한다. 레벨 40을 달성하고 공식카페에 스크린샷을 인증하면 '갤럭시 S8'과 '시크릿 선물 세트'를 추첨을 통해 지급한다. 레벨20과 30을 인증한 이벤트 참여자에게는 도미노 피자 외식 상품권과 문화 상품권 등을 선물한다. 룽투코리아는 '아이테르' 출시와 함께 알뜰폰 제휴 이벤트도 진행한다. 미니게이트 M2mobile이 출시한 '룽투 요금제' 가입시 선택한 요금제에 따라 다양한 '아이테르' 게임 내 아이템을 매월 차등 지급한다. 최성원 룽투코리아 사업총괄이사는 ""안정적인 서비스와 지속적인 콘텐츠 업데이트로 이용자의 만족도를 높일 수 있도록 최선을 다하겠다""고 말했다."
머니투데이,060240,/news/news_read.nhn?article_id=0004078892&office_id=008&mode=search&query=룽투코리아&page=1,2018-07-16 17:32,"룽투코리아, 타이곤모바일 주식 8504주 취득 결정",[머니투데이 신희은 기자] 룽투코리아는 계열사 타이곤모바일 주식 8504주를 53억원에 취득키로 결정했다고 16일 공시했다. 취득금액은 지난해 자기자본 대비 6.5% 규모다. 취득 후 지분율은 80%다.
아시아경제,060240,/news/news_read.nhn?article_id=0003588979&office_id=277&mode=search&query=룽투코리아&page=1,2015-09-21 13:06,"룽투코리아, &lsquo;일이삼국지&rsquo; 시즌2 오픈 대규모 업데이트","[아시아경제 팍스넷 배요한 기자] 룽투코리아가 서비스 중인 모바일 전략 RPG 가 시즌2를 맞이해 대규모 업데이트를 실시했다고 21일 밝혔다. 이번 업데이트를 통해 는 총 5종의 신규 콘텐츠 및 시스템을 선보이고 신규서버 ‘원소’를 오픈하는 등 유저들의 성원에 보답하는 업데이트와 다양한 이벤트도 실시한다. 먼저 국가 시스템 기능이 대폭 업그레이드 됐다. 또 삼국지 소설 내 인연이 되는 장수끼리 모아 활성화 시키면 보유한 캐릭터의 속성 능력치가 향상되는 ‘삼국지 무장 인연 버프 시스템’이 추가됐다. 그 외 유저들의 편의를 위해 마련된 ‘캐릭터 별 병기 재분배 속성 추천 시스템’, ‘초보자 경험치 버프 시스템’ 등을 새롭게 선보인다. 이와 함께 시즌2 업데이트를 기념한 다양한 이벤트도 진행된다. 우선 오는 27일까지 요일별 특정 던전 아이템 드랍률 2배, 예금 이벤트를 선보이고 이번에 추가된 ‘삼국지 무장 인연 버프 시스템’의 원활한 진행을 위해 ‘장수의 령’과 ‘만능 영혼석’ 아이템을 무료로 제공하는 등 총 4종의 이벤트가 진행된다. 그 외에도 신규서버 ‘원소’에서는 일정 레벨을 달성할 때마다 아이템을 지급하고, 매일매일 다이아 300개와 물만두 1개를 오는 27일까지 증정한다."
매일경제,060240,/news/news_read.nhn?article_id=0003736399&office_id=009&mode=search&query=룽투코리아&page=1,2016-05-23 17:07,"룽투코리아, 엔진과 맞손&hellip;100억 규모 투자 유치&middot;향후 협력 체계 구축","룽투코리아와 엔진이 손을 잡았다. 엔진이 룽투코리아에 유상증자 및 전환사채 등으로 100억 원을 투자하고 향후 양사간의 게임사업에 있어 긴밀한 협력 체계를 구축하는 것이 골자다. 엔진은 이번 투자를 통해 최소 2.6%의 지분을 확보하게 되며 향후 룽투코리아의 게임 라인업을 서비스할 가능성도 생겼다. 23일 룽투코리아는 카카오의 계열사인 게임업체 엔진을 대상으로 50억 원 규모의 제3자배정 유상증자를 결정했다고 공시했다. 이번 유상증자에 따라 엔진은 룽투코리아의 주식 49만196주(약 2.6%)를 확보하게 된다. 또 룽투코리아는 엔진을 대상으로 50억 원의 전환사채(4차)도 발행한다. 전환가액은 주당 1만2000원, 전환청구기간은 2017년 5월 30일부터 2020년 4월 29일까지다. 엔진이 전환을 청구할 경우 지분율은 약 4.7%(2차, 3차 전환사채 미포함, 포함시 약 4%)에 이를 전망이다. 양사는 이번 투자에 대해 포괄적인 협력 체계를 만들기 위한 결정이라고 설명했다. 엔진이 보유한 퍼블리싱 역량에 룽투코리아의 게임 라인업을 결합해 게임 시장에서의 성과를 높이겠다는 입장이다. 룽투코리아측은 “엔진이 보유한 마케팅 및 서비스 역량을 바탕으로 양사가 협력해 국내에서 게임 사업의 시너지를 높이겠다는 의미”라며 “엔진과의 협력으로 카카오를 통해 게임을 보다 잘 서비스할 수 있는 기틀을 마련했다”라고 설명했다. 이에 따라 양사는 엔진이 게임 서비스, 룽투코리아 게임 라인업을 확보하는 형태로 사업을 전개할 전망이다. 다만 룽투코리아측은 엔진이 퍼블리싱을 하는 개념이 아닌 함께 서비스하는 형태로 봐줄 것을 주문했다. 타이틀에 따라 양사의 협력 방식도 달라질 것으로 예측된다. 한편 엔진은 카카오의 100% 자회사 케이벤처그룹이 57.9%(3월 31일 기준)의 지분을 보유한 게임회사다. 지난 4월 1일 카카오의 100% 자회사 다음게임을 흡수합병했다."
머니투데이,060240,/news/news_read.nhn?article_id=0003682863&office_id=008&mode=search&query=룽투코리아&page=1,2016-05-20 15:15,"룽투코리아, 4만8000주 스톡옵션 부여","[머니투데이 최동수 기자] 룽투코리아는 20일 이홍의 게임운영본부장 등 임직원 6명에게 4만8000주의 주식매수선택권(스톡옵션)을 부여했다고 공시했다. 행사가액은 주당 1만804원이고 신주교부, 자기주식교부, 차액보상 중 하나의 방법으로 이사회 결의일로부터 2년 경과 후 3년 이내에 행사가 가능하다. textlinktopstart textlinktopend textlinkstart"
연합뉴스,060240,/news/news_read.nhn?article_id=0008057959&office_id=001&mode=search&query=룽투코리아&page=1,2015-12-16 18:14,"룽투코리아, 용현BM 지분 55% 취득","(서울=연합뉴스) 장하나 기자 = 룽투코리아는 397억원 규모의 용현BM 주식 1천19만여주를 제3자 배정 유상증자 참여 방식으로 취득하기로 결정했다고 16일 공시했다. 룽투코리아의 지분비율은 55.48%가 된다. 회사 측은 ""사업다각화를 통한 성장동력 확보""라고 지분 취득 이유를 설명했다. 한편 용현BM은 이날 자산 매각을 통한 재무구조 개선을 위해 238억원 규모의 연속가열로 등을 현진소재에 양도했다고 공시했다."
아시아경제,060240,/news/news_read.nhn?article_id=0003996522&office_id=277&mode=search&query=룽투코리아&page=1,2017-05-18 15:30,"더이앤엠-룽투코리아, '소리바다'와 전략적 제휴 체결","[아시아경제 김유리 기자] 국내 미디어 플랫폼 운영사 더이앤엠(THE E&M)은 18일 서울 강남구 소리바다 사옥에서 소리바다, 룽투코리아와 전략적 업무제휴를 맺었다고 밝혔다. 더이앤엠은 이번 제휴를 통해 3사가 플랫폼 별로 보유하고 있는 영상, 음악, 게임 등의 콘텐츠를 상호 제공해 경쟁력을 강화해 나갈 예정이다. 콘텐츠의 다양성을 확보하고 각 플랫폼 유저를 대상으로 공동 마케팅도 전개해나갈 계획이다. 대표적인 플랫폼으로는 더이앤엠의 국내 2위 개인방송 플랫폼인 '팝콘티비', 여러 장르의 셀럽(유명인) 대상의 개인방송 플랫폼 '셀럽티비', 국내 최초로 선보인 음원 포털사이트 '소리바다' 등이 있다. 상호 간의 플랫폼 ·콘텐츠의 적극적인 교류를 통해 공연, 콘텐츠 유통 등의 해외사업도 공동으로 추진한다. 더이앤엠의 신규 서비스인 셀럽티비를 활성화 시키기 위해 지속적으로 연예 콘텐츠를 개발 ·확보하는데 집중할 계획이다. 더이앤엠의 모회사인 룽투코리아는 이번 제휴로 각 사가 보유하고 있는 인터넷 플랫폼 등에서 서비스하는 모바일 게임의 공동 마케팅을 진행한다는 방침이다. 이를 통해 글로벌 시장 진출과 이용자 유입을 통한 수익 극대화에 힘쓴다는 계획이다. 더이앤엠 관계자는 ""국내 2위 개인방송 플랫폼 운영기업과 국내 최초 음원 포털사이트의 기술 경험을 기반으로 차별화된 경쟁력을 확보하고 지속적으로 투자 ·발전시켜 종합 엔터테인먼트 콘텐츠 플랫폼 사업이 국내외에서 성공적으로 안착할 수 있도록 노력할 것""이라고 말했다. 룽투코리아 최성원 사업총괄이사는 ""이번 3사의 제휴는 게임사, 음원사, 미디어 플랫폼 사의 유례없는 협업으로 다양한 윈윈 효과가 기대된다""며 ""'검과마법' 이후 트랜스미디어 전략을 외연적으로 확장해 온 룽투코리아는 이용자들이 즐겁게 게임을 즐길 수 있는 환경 조성을 위해 긴밀히 협업할 것""이라고 밝혔다. 소리바다 김재학 공동 대표는 ""이번 협약을 통해 기존 음악서비스 사업자가 제휴하지 못한 새로운 형태의 콘텐츠 인프라 연계 등 소리바다 만의 차별화 전략으로 디지털 음악 시장 및 관련 사업 확대에 기여할 수 있도록 최선을 다하겠다""고 전했다."
연합뉴스,060240,/news/news_read.nhn?article_id=0008080878&office_id=001&mode=search&query=룽투코리아&page=1,2015-12-28 17:40,용현BM 최대주주 룽투코리아로 변경(종합),"(서울=연합뉴스) 성서호 기자 = 용현BM은 제3자 배정 유상증자의 양수 대금 지급이 완료됨에 따라 최대주주가 현진소재 외 1인에서 룽투코리아로 변경됐다고 28일 공시했다. 용현BM은 ""향후 정기주주총회에서 신규 이사가 선임될 예정""이라고 설명했다. 앞서 룽투코리아는 용현BM의 제3자 배정 유상증자에 참여하기 위해 120억원을 단기 차입하기로 했다고 공시했다."
매일경제,060240,/news/news_read.nhn?article_id=0004000393&office_id=009&mode=search&query=룽투코리아&page=1,2017-08-22 11:03,"룽투코리아, &lsquo;열혈강호 모바일&rsquo; 연내 출시&hellip;그래픽 전면 교체","룽투코리아(대표 양성휘)는 모바일게임 ‘열혈강호 for kakao’를 연내 출시한다. 이 게임은 유명 만화 ‘열혈강호’를 소재로 제작된 모바일 MMORPG로 중국 시장에서 흥행한 바 있어 주목받고 있다. 22일 룽투코리아는 인기 만화 ‘열혈강호’ 기반 모바일 MMORPG ‘열혈강호 for kakao’를 올 하반기 국내에 선보일 예정이라고 밝혔다. 이 게임은 원작 만화 주인공들을 3D 형태의 캐릭터로 구현한 것이 특징이며 정파 및 사파간의 세력전, 보스전, 전장 등의 전투 콘텐츠와 의상, 탈 것, 문파시스템, 결혼시스템 등을 갖췄다. 룽투코리아의 모회사 중국 룽투게임이 개발했으며 이미 중국, 대만, 홍콩 및 마카오 등에 출시돼 현지 시장 앱마켓 매출 순위 상위권에 이름을 올리며 인기를 끌었다. 또 이번 한국 버전의 경우 기존 중국 등에 출시된 버전과 달리 그래픽 리소스도 변경됐다. 이전 버전의 경우 엠게임이 제작 및 서비스하는 ‘열혈강호온라인’의 그래픽 리소스를 활용했으나 최근 국내 서비스와 관련해 양사간 이견이 발생하면서 결국 룽투코리아는 그래픽 리소스를 전면 교체해 서비스하는 것으로 결론을 내렸다. 룽투코리아측은 “최신 트렌드에 맞는 새로운 그래픽으로 업그레이드 하면서 원작의 감성을 충실히 반영해 현지 로컬라이징 작업에 최선을 다할 방침”이라고 소개했다. 또 “‘카카오 게임하기’ 플랫폼을 통해 성공 가능성을 높일 것”이라고 덧붙였다. 한편 룽투코리아는 지난해 모바일게임 ‘검과마법’을 카카오 플랫폼으로 출시해 흥행몰이에 성공한바 있다."
이데일리,060240,/news/news_read.nhn?article_id=0003903600&office_id=018&mode=search&query=룽투코리아&page=1,2017-08-22 10:38,"룽투코리아, 하반기 &lsquo;열혈강호 for kakao&rsquo; 국내 출시","- 모기업 ‘열혈강호 모바일’ 게임성 물려받아 (이미지=룽투코리아 제공) [이데일리 이명철 기자] 룽투코리아(060240)는 하반기 모바일 다중접속역할수행게임(MMORPG) ‘열혈강호 for kakao’를 국내에 선보일 예정이라고 22일 밝혔다. 만화인 ‘열혈강호’ 지적재산권(IP)을 활용한 이 게임은 정파와 사파간 세력전, 보스전, 전장 등 전투와 다채로운 의상, 탈 것, 문파시스템, 결혼시스템 등 MMORPG 게임 본연의 재미를 담았다는 게 회사 설명이다. 모회사 중국 룽투게임은 열혈강호 모바일(?血江湖手游)을 중국, 대만, 홍콩·마카오 등에 출시해 현지 주요 앱마켓 매출 상위권에 진입한 바 있다. 열혈강호 for kakao는 열혈강호 모바일 게임성을 가져오면서 기존에 사용된 그래픽 리소스를 교체해 선보였다. 이홍의 게임사업본부장은 “하반 야심작인 열혈강호 for kakao는 카카오의 다양한 플랫폼을 통한 다각적인 마케팅 활동으로 주목 받을 것”이라며 “빠른 시일 내 만화 ‘열혈강호’ 마니아층과 국내 게이머 모두 만족할 완성도 높은 게임을 선보이도록 최선을 다하겠다”고 말했다."
이데일리,060240,/news/news_read.nhn?article_id=0003535921&office_id=018&mode=search&query=룽투코리아&page=1,2016-05-03 18:50,"킹파워인터네셔널유한회사, 룽투코리아 지분율 10&rarr;6.17%","[이데일리 임성영 기자] 홍콩 소재 킹 파워 인터네셔널 유한회사(KING POWER INTERNATIONAL LIMITED)는 룽투코리아(060240) 주식 70만주(3.83%)를 시간외매매를 통해 처분함에 따라 지분율이 종전 10%(182만7200주)에서 6.17%(112만7200주)로 감소했다고 3일 공시했다. 처분 대상은 레드캡투어, 타임폴리오 투자자문, 피인베스트먼트, 케이오인베스트먼트이며 주당 처분가는 9486원이다."
한국경제,060240,/news/news_read.nhn?article_id=0003432876&office_id=015&mode=search&query=룽투코리아&page=1,2015-09-17 13:30,"룽투코리아, 모바일게임 개발에 11억 투자","[ 노정동 기자  ] 룽투코리아는 모바일게임 개발을 위해 11억8100만원을 투자하기로 했다고 17일 공시했다. 이는 지난해 자기자본의 14.92%에 해당한다. 회사 측은 ""스마일게이트의 온라인게임 '크로스파이어'의 지적재산권을 이용한 모바일게임 개발을 위한 투자""라고 밝혔다. 노정동 한경닷컴 기자"
한국경제TV,060240,/news/news_read.nhn?article_id=0000663976&office_id=215&mode=search&query=룽투코리아&page=1,2018-07-23 12:27,"룽투코리아, 전일 대비 약 -3% 하락한 5,420원","[한국경제TV 라이온봇 기자] [그림 1] 최근 3개월 간 주가 추세 및 기간별 수익률 룽투코리아는 7월 23일 12시 27분 전일 대비 약 -3% 하락한 5,420원에 거래되고 있다. 룽투코리아는 코스닥 상장 기업으로 디지털컨텐츠 업종에 속해 있다. 시가총액은 1,356억원으로 코스닥 상장기업 중 457위에 위치 해 있다. [종목 성향 진단] [그림 2] 종목 성향 진단 룽투코리아의 투자 스타일은 모호한 측면이 있으나 성장주라고 볼 수 있다. 주가 고평가 우려가 공존하지만 높은 성장성이 기대되는 기업이다. 주가 모멘텀은 부진한 편이었다. 최근 6개월 수익률은 -31.08%의 하락폭을 기록했다. 최근 1개월 수익률 또한 -2.26% 하락하며 부진한 모멘텀을 이어가고 있다. 룽투코리아 종목에 대한 투자자의 관심도는 상대적으로 낮은 편이었다. [투자 점수 진단] [그림 3] 투자 점수 진단 룽투코리아는 어느 측면에서 투자 매력도가 높은 종목일까? AI 인공지능 종목 분석 시스템을 이용해 성장성, 수익성, 효율성, 안전성, 저평가성, 추세 등 주가 수익률에 영향을 줄 수 있는 6가지 핵심 투자 지표를 점수화하여 종목의 투자 매력도를 계산해보았다. 그 결과 룽투코리아는 상대적으로 수익성 측면에서 두각을 드러내고 있었다. 수익성 점수는 기업이 가진 자산과 자본을 활용하여 얼마나 이익을 실현했는지를 나타낸다. 룽투코리아는 특히 영업이익률 측면에서 가장 높은 점수는 기록했는데, 전체 시장 내 261위를 기록하며 상위 13.09%에 위치했다. 업종별로는 100위를 기록하며 상위 16.95%에 위치했다. 그러나 기업 가치 대비 주가 수준을 나타내는 저평가 측면에서는 아쉬움을 나타냈다. (위의 AI인공지능 점수는 재무 데이터를 기반으로 전체 상장 종목과 비교/분석하여 도출한 점수로 높은 점수가 반드시 높은 수익률을 보장하지 않습니다. 위의 자료는 당사의 추천 종목이 아니며, 투자 시 참고용으로 제시해드리는 것입니다. 핵심투자지표를 결합해 종목의 투자매력도를 종합 계산한 ""인공지능 투자점수""는 ""거장들의 투자공식"" 앱에서 확인하실 수 있습니다.) 라이온봇 기자 -한국경제TV※ 본 기사는 한국경제TV와 '거장들의 투자공식이'자체 개발한 '라이온봇 기자'가 실시간으로 작성한 기사입니다. 라이온봇기자"
