source,symbol,link,date,title,content
머니투데이,060240,/news/news_read.nhn?article_id=0003860539&office_id=008&mode=search&query=룽투코리아&page=1,2017-04-20 17:41,"빅데이터가 주목한 종목, 한국항공우주&middot;룽투코리아","[머니투데이 김주현 기자] [한국투자證 ""주가 오르는 종목 중 조회수·검색량 많은 종목 매수 추천""] 투자자들의 검색 빈도와 관련글 조회 수가 주가 등락에 영향을 미치는 것으로 나타나면서 빅데이터를 활용한 투자전략에 관심이 모인다. 20일 한국투자증권에 따르면 네이버 주식게시판에 올라온 종목관련 글의 조회 수를 빅데이터 분석한 결과, 최근 1주일 동안 주가가 시장평균 보다 상승한 종목 가운데 인터넷게시글 조회수가 최근 한 달 평균보다 2배 이상으로 늘어날 경우 주가가 추가 상승한 것으로 나타났다. 반면 주가 하락 중 조회수가 늘어나면 하락세가 이어질 확률이 높았다. 안혁 한국투자증권 연구원은 ""주가 상승으로 관심이 높아진 종목에 대해 긍정적인 내용의 글이 확산되면 신규 투자자들의 매수성향이 올라가기 때문""이라며 ""조회수가 증가할수록 추종 성향이 강해지는 것을 확인할 수 있다""고 말했다. 이에 따라 주식 게시판의 조회수 증가를 확인하고 매수하는 전략을 활용한다면 10%대의 주가 상승률을 거둘 수 있다는 설명이다. 다만 이같은 매도·매수 전략은 한달 간 유효하다고 조언했다. 안 연구원은 ""실제로 코스피100종목을 대상으로 테스트한 결과 최근 한달 동안 5%의 상승률을 보인 종목은 조회수 증가 이후 한 달 동안 10%의 추가 상승을 보였다""며 ""반대로 주가가 5% 하락했던 종목은 마찬가지로 조회수 증가 이후 한 달동안 주가가 10% 추가로 떨어졌다""고 설명했다. 이번주 빅데이터 분석결과 주가가 상승한 종목 중 조회수가 급증한 기업은 CJ와 한국항공우주, 잇츠스킨, 한샘, 금호산업, 더블유게임즈, 덕산네오룩스, 룽투코리아, 씨젠, 현대리바트 등 10개였다. 반면 주가 하락 중 조회수가 늘어 추가 하락이 우려되는 종목은 컴투스와 세아베스틸, SKC, 현대위아 등 4곳으로 집계됐다. 아울러 구글 트랜드를 반영한 신규 모델도 제시했다. 구글 트랜드는 구글 검색 빈도를 지수화한 것으로 지수가 높으면 그만큼 종목에 대한 투자자들의 관심이 높은 것으로 풀이할 수 있다. 구글트랜드에 대해서는 주가가 상승 중인 종목의 트랜드 지수가 최근 3개월 평균보다 두 배이상 높을 경우 매수를, 반대인 경우 매도를 추천했다. 해당 신규 모델을 이용한 결과 룽투코리아와 세아제강, 태영건설, LIG넥스원, 아이센스 등 5개 종목의 구글트랜드 투자심리가 높았다. 반면 현대위아에는 매도 신호가 나왔다. 두 모델에서 공통적으로 매수신호가 나온 종목은 룽투코리아였다. 룽투코리아는 지난 10일 중국 애플 앱스토어에 출시된 모바일게임 '열혈강호' 흥행 소식에 이달들어 주가가 57.5% 급증했다. 다만 지난 18일 거래소가 소수계좌 매수관여 과다를 이유로 룽투코리아를 투자주의종목으로 지정해 투자에 주의가 필요하다. 업계 관계자는 ""빅데이터 전략은 기업 펀터멘탈과는 상관없이 주가 흐름과 단순 조회수를 기반으로 한 전략인 만큼 투자 시 유의해야 한다""고 지적했다. textlinktopstart textlinktopend textlinkstart"
머니투데이,060240,/news/news_read.nhn?article_id=0003617843&office_id=008&mode=search&query=룽투코리아&page=1,2016-01-22 16:28,"거래소, 룽투코리아 용현비엠 지분인수설 조회공시 요구",[머니투데이 유엄식 기자] 거래소는 22일 룽투코리아의 용현비엠(주) 지분인수 추진설의 사실여부 및 구체적인 내용을 조회공시 요구했다. 답변시한은 오는 25일 정오까지다. textlinktopstart textlinktopend textlinkstart
연합뉴스,060240,/news/news_read.nhn?article_id=0008137432&office_id=001&mode=search&query=룽투코리아&page=1,2016-01-22 16:20,룽투코리아에 용현비엠 지분인수설 조회공시 요구,(서울=연합뉴스) 장하나 기자 = 한국거래소는 22일 룽투코리아에 용현비엠 지분인수 추진설의 사실 여부와 구체적인 내용에 대한 조회공시를 요구했다. 답변시한은 오는 25일 낮 12시까지다.
한국경제TV,060240,/news/news_read.nhn?article_id=0000426283&office_id=215&mode=search&query=룽투코리아&page=1,2016-01-22 14:43,"[특징주] 용현BM, 룽투코리아와 지분 인수 협상 '급등'","룽투코리아가 용현BM지분을 인수하기 위해 협상 중인 것으로 알려지면서 용현BM의 주가가 급등세를 나타내고 있습니다. 22일 증권업계에 따르면 룽투코리아는 현진소재가 보유한 용현BM 주식 193만여주를 인수하기 위한 협상을 진행 중인 것으로 알려졌습니다. 오후 2시 35분 현재 용현BM은 전날보다 9.72% 오른 1만 950원에 거래되고 있습니다. 증권업계 관계자는 ""용현BM이 매출채권, 공장, 사옥 등을 꾸준히 매각해 회사의 부채를 줄이고 새로운 엔터테인먼트사업을 모색하고 있다""며 ""인기 아이돌 그룹의 소속사를 인수하는 것도 검토 중인 것으로 안다""고 말했습니다. 이에 더해 룽투코리아 관계자는 ""룽투코리아가 게임 사업을 맡고 용현BM이 엔터 사업을 맡는 방향은 맞다""며 ""구체적인 엔터테인먼트 사업 계획은 내부 논의가 진행 중이다""고 밝혔습니다."
아시아경제,060240,/news/news_read.nhn?article_id=0003673682&office_id=277&mode=search&query=룽투코리아&page=1,2016-01-25 16:42,"룽투코리아, &lsquo;마계영웅전&rsquo; 사전 등록에 30만명 참여","[아시아경제 팍스넷 배요한 기자] 룽투코리아는 국내 개발사 도치에서 개발하고 자사가 서비스하는 신작 모바일 액션 RPG ‘마계영웅전 for Kakao(이하 마계영웅전)’의 국내 사전 예약 이벤트에 30만명 이상이 참여했다고 25일 밝혔다. 회사 측은 지난달 22일 사전등록을 시작한 ‘마계영웅전’이 약 한 달 만에 사전등록자수 30만을 돌파하고 정식 출시를 위한 막바지 준비에 한창이라고 설명했다. ‘마계영웅전’은 정통 삼국지와 마계 스토리를 결합한 판타지 모바일 액션 RPG로 250여종의 맵과400여종의 캐릭터가 펼치는 모험 스토리를 담고 있다. 삼국지 캐릭터로 일대 다수의 몰이사냥과 스킬 시전을 통한 짜릿한 타격감을 즐길 수 있는 게임이다. ‘마계영웅전’은 오는 26일 출시를 앞두고 사전등록에 참가하는 유저 전원에게 5만원 상당의 아이템인 4성 영웅 뽑기권, 곡옥 350개, 부적 50개, 금화 10만개 등을 지급한다."
아시아경제,060240,/news/news_read.nhn?article_id=0003673490&office_id=277&mode=search&query=룽투코리아&page=1,2016-01-25 14:19,[특징주]룽투코리아 2% &darr;&hellip;용현BM 지분 추가 인수설 부인,"[아시아경제 박선미 기자]25일 룽투코리아 주가가 2% 넘게 하락 중이다. 오후 2시14분 현재 룽투코리아는 전 거래일 대비 250원(2.42%) 하락한 1만100원을 기록하고 있다. 이날 룽투코리아는 용현비엠 지분인수 추진설과 관련한 한국거래소의 조회공시 요구에 대해 ""당사는 지난달 28일 용현BM의 주식 취득으로 이미 용현BM발행주식의 55.48%를 보유한 최대주주""라며 ""현재 보유 지분 외의 추가적인 용현BM 지분인수를 진행할 이유가 없으며 이를 계획하고 있지 않다""고 밝혔다."
이데일리,060240,/news/news_read.nhn?article_id=0003802562&office_id=018&mode=search&query=룽투코리아&page=1,2017-04-18 13:58,"[특징주]룽투코리아, 中 &lsquo;열혈강호 모바일&rsquo; 흥행 소식에&uarr;","[이데일리 이명철 기자] 룽투코리아(060240)가 모기업이 중국에 출시한 모바일 게임 ‘열혈강호 모바일’ 흥행 기대감에 강세다. 18일 오후 1시56분 현재 룽투코리아 주가는 전일대비 5.82% 오른 1만5450원을 기록 중이다. ‘열혈강호 모바일’이 출시 후 매출 호조를 나타내면서 실적 개선에 대한 기대감이 반영되는 것으로 풀이된다. 회사에 따르면 지난 13일 중국 현지 안드로이드 마켓에서 정식 서비스를 시작한 ‘열혈강호 모바일’은 14일 최고 매출 2위를 달성했다. iOS 마켓에서는 출시 3일만에 최고 매출 3위를 기록하기도 했다. 20일 중국 최대 동영상 플랫폼 ‘아이치이(?奇?)’에서 열혈강호를 소재로 제작한 웹 영화(열혈강호지몽환기연) 독점 방영을 앞둬 흥행 시너지가 될 것으로 기대했다. 최성원 사업총괄이사는 “열혈강호 모바일 흥행으로 로열티 수익과 중국 열혈강호 지적재산권(IP) 가치가 높아질 것”이라며 “향후 열혈강호 모바일 국내, 글로벌 진출과 IP 강화에 힘쓸 것”이라고 전했다."
파이낸셜뉴스,060240,/news/news_read.nhn?article_id=0003804585&office_id=014&mode=search&query=룽투코리아&page=1,2017-04-18 15:07,"[fnRASSI]룽투코리아(060240), 52주 신고가 경신...10.27% &uarr;","룽투코리아(060240)는 52주신고가를 기록하고 있어 주목할만하다. 동종목의 현재 주가는 16,100원 선에서 이루어지고 있다. 거래일을 기준으로 최근 3일간 평균 거래량은 104만 주이다. 이는 60일 일 평균 거래량 13만 주와 비교해보면 최근 거래량이 급격히 늘어났다는 것을 알 수 있다. 상장주식수 대비 거래량은 1.3%로 적정수준 최근 한달간 룽투코리아의 상장주식수 대비 거래량을 비교해보니 일별 매매회전율이 1.3%로 집계됐다. 그리고 동기간 장중 저점과 고점의 차이인 일평균 주가변동률을 3.76%를 나타내고 있다. 주요 매매주체는 개인투자자  최근 한달간 주체별 거래비중을 살펴보면 개인 비중이 89.88%로 가장 높았고, 외국인이 6.83%로 그 뒤를 이었다. 기관은 3.28%를 나타냈다. 그리고 최근 5일간 거래비중은 개인이 88.65%로 가장 높은 참여율을 보였고, 외국인이 7.44%를 보였으며 기관은 3.9%를 나타냈다. 'fnRASSI'는 증권전문 기업 씽크풀과 파이낸셜뉴스의 협업으로 로봇기자가 실시간으로 생산하는 기사입니다."
머니투데이,060240,/news/news_read.nhn?article_id=0003598317&office_id=008&mode=search&query=룽투코리아&page=1,2015-12-17 07:34,"룽투코리아, 용현비엠 채권 51억6000만원에 양수","[머니투데이 김평화 기자] 룽투코리아는 현진소재 주식회사와 채권양수도계약을 체결하고 양도인의 용현비엠 주식회사에 대한 채권을 총 거래금액 51억6320만5680원에 양수할 예정이라고 17일 공시했다. 회사 측은 ""용현비엠의 경영권 인수 목적으로 동사 제3자배정 유상증자에 따른 신주 인수대금의 일부로 사용할 것""이라고 설명했다. textlinktopstart textlinktopend textlinkstart"
파이낸셜뉴스,060240,/news/news_read.nhn?article_id=0003587775&office_id=014&mode=search&query=룽투코리아&page=1,2016-01-25 13:18,"[특징주]용현BM, 룽투코리아 지분인수 부인..'급락'","용현BM이 룽투코리아의 지분 인수 부인에 급락하고 있다. 25일 오전 1시15분 현재 용현BM은 전 거래일보다 1350원(11.44%) 내린 1만450원에 거래되고 있다. 룽투코리아는 ""현재 보유 지분 외의 추가적인 용현BM의 지분인수를 진행할 이유가 없으며 이를 계획하고 있지 않다""며 ""당사와 현진소재 간에 주식양수도계약(현진소재가 보유한 용현BM의 주식 193만여주)을 추진중이라는 보도는 사실이 아니다""라고 밝혔따."
아시아경제,060240,/news/news_read.nhn?article_id=0003673381&office_id=277&mode=search&query=룽투코리아&page=1,2016-01-25 12:20,"룽투코리아, 용현BM 지분인수 추진설&hellip;&quot;사실무근&quot;","[아시아경제 김원규 기자] 룽투코리아는 거래소의 조회공시 요구에 대해 당사와 현진소재 간에 주식양수도계약(현진소재가 보유한 용현BM의 주식 193만여주)을 추진중이라는 언론 보도는 사실이 아니라고 부인했다. 회사측은 ""당사는 2015년 12월28일 용현BM의 주식 취득으로 이미 용현BM 발행주식의 55.48%를 보유한 최대주주""라며 ""현재 보유 지분 외에 추가적인 용현BM의 지분인수를 진행할 이유가 없고, 이를 계획하고 있지 않다""고 밝혔다."
파이낸셜뉴스,060240,/news/news_read.nhn?article_id=0003802691&office_id=014&mode=search&query=룽투코리아&page=1,2017-04-13 14:22,[fnRASSI]룽투코리아(060240) 6.06% 상승,"현재 룽투코리아(060240)는 전일대비 6.06% 상승하여 14,000원 선에서 거래가 이루어지고 있다. 외국인 보유량 감소, 기관 증가 (5일 누적) 최근 5일간 동종목의 외국인 투자자는 53,095주 순매도하였고 반면 기관은 71,087주 순매수하였다. 전날 외국인 20,148주 순매도, 기관71,087주 순매수하며 보유 비율이 변동했다. 다음 표는 동종목의 외국인, 기관의 일별 순매수량을 나타낸 것이다. 주요 투자주체는 개인투자자 최근 한달간 주체별 거래비중을 살펴보면 개인이 90.84%로 가장 높은 참여율을 보였고, 외국인이 5.65%를 보였으며 기관은 3.5%를 나타냈다. 그리고 최근 5일간 거래비중은 개인이 88.7%, 외국인이 5.98%, 기관은 5.3%를 기록한 것으로 나타났다. 'fnRASSI'는 증권전문 기업 씽크풀과 파이낸셜뉴스의 협업으로 로봇기자가 실시간으로 생산하는 기사입니다."
연합뉴스,060240,/news/news_read.nhn?article_id=0008141836&office_id=001&mode=search&query=룽투코리아&page=1,2016-01-25 11:48,룽투코리아 &quot;용현BM 지분 추가 인수 계획 없어&quot;,"(서울=연합뉴스) 유현민 기자 = 룽투코리아는 25일 ""용현BM의 지분을 추가로 인수할 계획이 없다""고 공시했다. 룽투코리아는 지난 22일 용현BM 지분 인수 추진설의 사실 여부와 구체적인 내용에 대한 한국거래소의 조회공시 요구에 ""지난해 12월 28일 용현BM 주식 취득으로 이미 발행 주식의 55.48%를 보유한 최대 주주""라며 이같이 답했다. 현진소재가 보유한 용현BM 주식 193만여 주를 인수하는 주식양수도 계약을 추진 중이라는 일부 언론의 보도 내용도 사실이 아니라고 룽투코리아는 덧붙였다."
머니투데이,060240,/news/news_read.nhn?article_id=0003618707&office_id=008&mode=search&query=룽투코리아&page=1,2016-01-25 11:46,"룽투코리아, 용현BM 지분인수 추진설 부인","[머니투데이 권혜민 기자] 룽투코리아는 거래소의 조회공시 요구에 대해 ""당사와 현진소재 간에 주식양수도계약(현진소재가 보유한 용현BM의 주식 193만여주)을 추진중이라는 언론 보도는 사실이 아니다""라며 부인했다. 회사측은 ""당사는 2015년 12월28일 용현BM의 주식 취득으로 이미 용현BM 발행주식의 55.48%를 보유한 최대주주""라며 ""현재 보유 지분 외에 추가적인 용현BM의 지분인수를 진행할 이유가 없으며 이를 계획하고 있지 않다""고 밝혔다. textlinktopstart textlinktopend textlinkstart"
매일경제,060240,/news/news_read.nhn?article_id=0003923507&office_id=009&mode=search&query=룽투코리아&page=1,2017-04-13 20:59,&lsquo;주가급등&rsquo; 룽투코리아 단기과열완화장치 발동예고,13일 코스닥시장본부는 룽투코리아의 주가급등에 따라 단기과열완화장치 발동을 예고했다. 이에 따라 14일부터 10거래일 이내 특정일에 ▲종가가 직전 40거래일 평균 종가 대비 30% 이상 상승하고 ▲최근 2거래일 평균 회전율이 직전 40거래일 평균 회전율 대비 500% 이상 증가하고 ▲최근 2거래일 평균 일중변동성이 직전 40거래일 평균 일중변동성 대비 50% 이상 증가하면 해당일 종가가 직전 거래일 및 발동예고일 전일인 13일 종가 대비 상승했을 경우 다음 거래일부터 단기과열완화장치가 발동된다. 단기과열완화장치가 발동되면 3거래일간 30분 단위 단일가매매방식이 적용된다. 룽투코리아는 이달 들어 상승세를 지속해왔다. 지난달 31일 종가 9890원에서 13일 종가 1만4000원으로 9거래일 동안 41.55% 상승했다. 최근에는 기관 매수세도 이어지고 있다. 이날도 기관은 5만5878주를 순매수했다. 반면 외국인 투자자는 이날 14만4207주를 순매도하는 등 매도세를 지속 중이다. 한편 룽투코리아는 지난 10일 중국 애플 앱스토어에 출시된 모바일게임 ‘열혈강호’에 대한 기대감이 작용하는 것으로 풀이된다. 이 게임은 13일 중국 애플 앱스토어 게임 매출 순위 6위에 랭크됐다. 룽투코리아는 현지 매출에 따라 10~15% 수준의 로열티를 받는 것으로 알려졌다. ‘열혈강호온라인’을 서비스하는 엠게임도 관련 매출의 일부를 로열티로 받는다.
연합뉴스,060240,/news/news_read.nhn?article_id=0009301677&office_id=001&mode=search&query=룽투코리아&page=1,2017-05-30 13:42,"룽투코리아, 온라인 교육사업 떼어내 아이넷스쿨 신설","(서울=연합뉴스) 조민정 기자 = 룽투코리아는 온라인 교육사업부문을 물적 분할해 아이넷스쿨(가칭)을 신설하기로 했다고 30일 공시했다. 분할은 분할회사인 룽투코리아가 존속하면서 신설회사의 발행주식 총수를 취득하는 물적 분할 방법으로 이뤄지며, 신설회사는 비상장법인으로 하기로 했다. 회사는 ""이번 분할은 경영 자원의 효율적 배분과 전문화된 사업영역에 역량을 집중해 경영 위험을 최소화하기 위한 것""이라고 설명했다. 분할 기일은 8월 25일이다."
이데일리,060240,/news/news_read.nhn?article_id=0003806634&office_id=018&mode=search&query=룽투코리아&page=1,2017-04-23 07:02,"룽투코리아, 열혈강호 모바일 흥행&hellip;이달 들어 46% &uarr;","[이데일리 박형수 기자] 모바일 게임 개발업체 룽투코리아 주가가 이달 들어 큰 폭으로 올랐다. 중국에서 서비스를 시작한 모바일 다중접속역할수행게임(MMORPG) ‘열혈강호 모바일’이 인기를 끌고 있다는 소식이 주가 상승을 이끌었다. 다만 전환권 행사에 따라 다음달 대규모 신주 상장이 예정돼 있다는 점에서 주의해야 한다는 조언도 나왔다. ◇열혈강호 모바일 중국서 흥행 돌풍…주가도 고공행진 23일 마켓포인트에 따르면 룽투코리아 주가는 이달 들어 46%가량 올랐다. 지난달 말 9890원으로 거래를 마친 뒤 지난 20일 장 중 한때 1만7150원까지 오르며 52주 신고가를 기록했다. 지난 22일에는 차익 실현을 위한 물량이 나오면서 주가 상승 흐름에는 일단 제동이 걸렸다. 룽투코리아는 모회사인 중국 룽투게임 기술력과 개발력을 바탕으로 모바일 게임을 국내에서 퍼블리싱하는 사업을 하고 있다. 자체 지적재산(IP)을 비롯해 국내외 유명 IP를 확보하기 위한 투자 사업도 진행 중이다. 룽투코리아는 지난 2015년 열혈강호 모바일 중화권 독점권을 확보했다. 지난해 말에는 전 세계 모바일 사업 판권을 보유한 타이곤 모바일을 인수했다. 룽투코리아는 지난 14일 중국에서 열혈강호 모바일 정식 서비스를 시작했다. 서비스를 시작한 지 하루 만에 중국 최대 안드로이드 마켓 ‘360’에서 최고매출 2위를 기록했다. 룽투코리아 관계자는 “애플 앱스토어 iOS 마켓에서는 출시 3일 만에 최고매출 3위를 기록한 데 이어 텐센트 앱마켓인 ‘응용보’에서도 최고 매출 3위로 올라섰다”고 소개했다. 열혈강호 모바일은 중국 애플 앱 스토어, 현지 안드로이드 마켓에서 높은 순위를 유지했다. 중국 스마트폰 시장에서 모바일 OS 시장점유율은 애플보다 안드로이드 마켓이 6배가량 크다. 룽투코리아는 열혈강호 모바일이 ‘360’, ‘응용보’ 등 현지 주요 안드로이드 마켓에서 의미 있는 성과를 거두고 있다는 점에서 장기간 흥행이 이어질 것으로 기대했다. 룽투코리아는 세계 시장 점유율 1위로 올라선 중국 모바일 게임 시장에서 열혈강호 온라인이 인기를 끌면서 매출이 큰 폭으로 늘 것으로 내다봤다. 룽투코리아는 열혈강호 모바일을 올해 상반기 중으로 국내와 대만, 홍콩, 마카오, 동남아 시장에서 서비스할 계획이다. ◇라인 캐릭터 활용한 라인팝2 중국 서비스 개시 룽투코리아는 지난 20일 란투게임즈가 개발한 퍼즐 캐주얼 게임 ‘라인팝2’의 중국 애플 앱스토어 정식 서비스를 시작했다. 중국 서비스는 현지에서 열혈강호 모바일로 흥행 돌풍을 일으킨 룽투게임이 맡았다. 라인팝2는 전 세계 4700만 다운로드를 기록한 모바일 퍼즐게임 ‘라인팝’ 후속게임이다, NHN픽셀큐브가 개발한 원작을 란투게임즈가 중국 게임 시장 특성을 고려해 리뉴얼했다. 라인 대표 캐릭터인 브라운(곰)과 코니(토끼)가 등장하며 6방향 3매칭의 게임 방식을 채택했다. 중국 현지에서 라인 캐릭터 자체 인지도가 높은 점을 고려할 때 IP를 활용한 퍼즐게임이 흥행할 가능성이 크다. 출시한 지 하루 만에 중국 애플 앱스토어에서 화제의 게임으로 올랐다. ◇대규모 신주 상장 이슈…주가 조정 빌미 될수도 게임 사업부문에서 실적 개선 기대감이 커지는 가운데 룽투코리아는 지난 21일 3회차 전환사채에 대한 전환 청구권 행사가 있었다고 공시했다. 250억원에 대한 전환청구권 행사로 신주 260만주를 새롭게 상장한다. 전환가는 9629원이고 상장일은 다음달 12일이다. 앞서 룽투코리아는 지난해 2월 케이엘앤파트너스룽투코리아 사모투자합자회사를 대상으로 250억원 규모의 전환사채를 발행했다. 지난 1일부터 오는 2020년 2월2일 사이에 전환권을 청구할 수 있다."
연합뉴스,060240,/news/news_read.nhn?article_id=0008081539&office_id=001&mode=search&query=룽투코리아&page=1,2015-12-29 09:19,"&lt;특징주&gt; 룽투코리아, 용현BM 대주주 차지에 상승세",(서울=연합뉴스) 성서호 기자 = 룽투코리아가 용현BM의 최대주주로 올라섰다는 소식에 29일 장 초반 오름세를 나타냈다. 이날 오전 9시16분 현재 코스닥시장에서 룽투코리아는 전날보다 3.79% 오른 1천950원에 거래됐다. 용현BM은 전날 제3자 배정 유상증자의 양수 대금 지급이 완료됨에 따라 최대주주가 현진소재 외 1인에서 룽투코리아로 변경됐다고 공시했다.
