source,symbol,link,date,title,content
매일경제,060240,/news/news_read.nhn?article_id=0003778679&office_id=009&mode=search&query=룽투코리아&page=1,2016-08-03 14:47,"룽투코리아, VR게임 시장 진출&hellip;&lsquo;맞짱탁구&rsquo; 세계 판권 확보","룽투코리아가 세계 판권을 확보한 브리디아스마트의 VR게임 ‘맞짱탁구’ 룽투코리아는 탁구게임 개발업체 브리디아스마트와 가상현실(VR)게임 퍼블리싱 계약을 체결하고 본격적인 VR 사업을 전개한다고 3일 밝혔다. 이번 계약에 따라 룽투코리아는 브리디아스마트에서 개발 중인 VR 게임 ‘맞짱탁구’의 세계 판권을 획득하고 글로벌 서비스를 맡아 이르면 국내 최대 게임쇼 ‘2016 지스타’에서 첫 선을 보일 예정이다. 룽투코리아는 맞짱탁구를 필두로 테니스, 배드민턴 등과 접목한 스포츠형 VR게임을 선보이며, 중국, 북미, 유럽, 인도네시아 등의 해외시장 적극적으로 공략할 계획이다. 이외에도 레이싱 등 체감형 VR 게임을 확보해 VR 게임 장르 다변화에도 힘쓸 예정이다. 룽투코리아 관계자는 “2020년까지 약 700억 달러에 이를 것으로 예상되는 VR사업 전개를 위해 룽투그룹은 지난해부터 연구개발(R&D)과 인프라 투자에 주력해 왔다”며 “VR게임 사업 진출은 모기업과의 협업을 통해 초기시장을 선점하겠다는 의지이자 첫 단추”라고 말했다. 룽투코리아의 모회사인 중국 룽투게임이 개발 중인 VR 룽투그룹은 지난 2015년 헤드마운트디스플레이(HMD·헤드셋 방식의 디스플레이) 관련 업체에 투자하기도 했다. 향후 모회사인 중국 ‘룽투게임’이 개발 중인 격투 소재의 VR게임 ‘파이널 포스 VR’도 확보하게 된다. 최성원 룽투코리아 사업총괄이사는 “모바일 게임 사업에 이어 VR게임 퍼블리싱 산업에 진출하기 위해 국내외 개발사들과 논의 중”이라며 “모회사와의 협력을 통해 VR 관련 콘텐츠와 하드웨어를 아우르는 기업으로 자리 잡겠다”고 말했다. [디지털뉴스국 박진형 기자] r_start // r_end //"
아시아경제,060240,/news/news_read.nhn?article_id=0003801481&office_id=277&mode=search&query=룽투코리아&page=1,2016-08-04 10:02,"[공시+]룽투코리아, '검과마법' 효과&hellip;사상최대 매출","[아시아경제 박선미 기자]룽투코리아가 지난 6월 출시한 ‘검과마법 for Kakao(이하 검과마법)’ 흥행에 힘입어 역대최고 실적을 달성했다. 룽투코리아는 4일 잠정실적 공시를 통해 2분기 연결기준 매출액이 156억원을 달성해 지난해 동기대비 331% 증가했다고 밝혔다. 상반기까지의 누적 매출액은 264억4400만원으로 지난해 상반기와 비교해 약 289% 증가했다. 영업이익은 2분기에만 12억8400만원, 상반기 누적기준으로는 28억5000만원을 달성해 지난해 동기대비 각각 294%과 336% 급증하며 흑자전환했다. 회사측은 이러한 실적 개선의 배경을 '검과마법' 흥행에서 찾고 있다. 검과마법은 지난 6월 7일 게임 출시 후 11일만에 구글 플레이 스토어 다운로드 수 100만건 돌파에 이어 40일만에 누적 다운로드 300만 돌파에 성공하며 흥행했다. 회사측 관계자는 ""‘검과마법’은 향후에도 큰 성장이 예고 된다”며 “하반기에는 게임 런칭 초기에 발생되는 마케팅 비용도 줄어 외형성장에 이은 수익개선도 기대해 볼만 하다”고 자신했다."
부산일보,060240,/news/news_read.nhn?article_id=0000618306&office_id=082&mode=search&query=룽투코리아&page=1,2016-07-21 20:42,한국에 둥지 튼 中룽투코리아의 필승전략&hellip;'게임&middot;시너지&middot;글로벌',"소녀시대 태연을 모델로 내세운 모바일게임 '검과마법' 흥행으로 국내 게임시장 연착륙에 성공한 중국계 게임사 룽투코리아(대표 양성휘)가 미래성장을 위한 키워드로 '게임', '시너지', '글로벌'을 꺼내 들었다.  룽투코리아는 21일 오후 여의도 한국거래소에서 국내 증시입성 후 첫 기업설명회를 열고, '검과마법' 흥행비결과 앞으로의 성장전략을 풀어놨다.   ◆ 게임 : 강력한 IP 기반의 라인업 구축 우선 게임사업을 회사의 근간으로 하는 만큼 게임 라인업 강화를 최우선 과제로 삼겠다는 각오다.  우수 게임 타이틀을 지속적으로 출시하는 한편 유명 지적재산권(IP)을 확보하고, 국내외 다양한 타이틀의 소싱 및 퍼블리싱을 진행하는 것을 기본으로 한다.  실제 룽투코리아는 작년 6월 인기만화 '열혈강호' IP 확보를 통해 게임개발 및 글로벌 서비스 판권을 확보했으며, 같은해 9월에는 중국의 국민게임인 '크로스파이어'에 대한 IP 계약도 마친 상태다. 현재 이 두 개 IP를 활용한 게임들은 중국에서 테스트를 진행중인 상태로, 올 3분기 중국 모회사 룽투게임을 통해 서비스될 예정이다.  한국시장을 위해서는 만화 '타짜' IP를 활용한 '타짜 고스톱 for Kakao', '타자 포커 for Kakao'를 비롯해 현재 중국 애플 앱스토어 매출순위 상위권을 유지하고 있는 '산구산전기' 등을 3분기 내 국내 시장에 선보일 계획이다.  이 외에도 소셜카지노게임(북미 등), '라인팝2(중국)', '메탈슬러그(한국)', '미식연맹(한국)', '천제기병(한국)' 등의 타이틀과 함께 최근 IT업계 화두로 떠오른 가상현실(VR), 증강현실(AR) 기술을 활용한 게임들도 연내 출시를 목표로 고도화 작업중인 것으로 확인됐다.   ◆ 시너지 : 계열사-파트너사 역량 모아 '도약'"
한국경제TV,060240,/news/news_read.nhn?article_id=0000620331&office_id=215&mode=search&query=룽투코리아&page=1,2018-04-09 14:25,"룽투코리아, 전일 대비 약 7% 상승한 6,110원","[한국경제TV 라이온봇 기자] 룽투코리아는 4월 9일 14시 24분 전일 대비 약 7% 상승한 6,110원에 거래되고 있다. 룽투코리아는 코스닥 상장 기업으로 디지털컨텐츠 업종에 속해 있다. 시가총액은 1,375억원으로 코스닥 상장기업 중 471위에 위치 해 있다. [종목 성향 진단] [그림 1] 종목 성향 진단 룽투코리아의 투자 스타일은 성장주에 가깝다. 주가 고평가 우려가 공존하지만 높은 성장성이 기대되는 기업이다. 주가 모멘텀은 부진한 편이었다. 최근 6개월 수익률은 -48.27%의 하락폭을 기록했다. 최근 1개월 수익률 또한 -13.26% 하락하며 부진한 모멘텀을 이어가고 있다. 룽투코리아 종목에 대한 투자자의 관심도는 평범한 수준이었다. [투자 점수 진단] [그림 2] 투자 점수 진단 룽투코리아는 성장성(매출증가율(YoY)) 측면에서 두각을 나타내고 있다. 최근 매출증가율(YoY)은 97점으로 6개의 핵심 팩터 중 가장 높은 점수를 기록했다. 매출증가율(YoY)은  전체 시장 내 49위를 기록하며 상위 3.03%에 위치했다. 업종별로는 15위를 기록하며 상위 3.2%에 위치했다. 그리고 수익성(영업이익률) 역시 도드라지는 편이다. 수익성 점수는 87점으로 두번째로 높은 점수를 기록했다. 영업이익률은 전체 시장 내 223위를 기록하며 상위 13.2%에 위치했다. 업종별로는 107위를 기록하며 상위 21.99%에 위치했다. 그러나 ROA와 PER은  아쉬움을 나타냈다. [종합 투자점수] [그림 3] 종합 투자점수 AI 인공지능 분석을 통한 룽투코리아의 종목 종합 스코어는 49점을 기록했다. 이는 동일 업종 평균점수인 48점보단 높지만, 시장 평균점수인 50점을 하회했다. (위의 AI인공지능 점수는 재무 데이터를 기반으로 전체 상장 종목과 비교/분석하여 도출한 점수로 높은 점수가 반드시 높은 수익률을 보장하지 않습니다. 위의 자료는 당사의 추천 종목이 아니며, 투자 시 참고용으로 제시해드리는 것입니다.) 라이온봇 기자 -한국경제TV※ 본 기사는 한국경제TV와 '거장들의 투자공식이'자체 개발한 '라이온봇 기자'가 실시간으로 작성한 기사입니다. 라이온봇기자 ⓒ 한국경제TV, 무단 전재 및 재배포 금지 한국경제TV 관련뉴스해당 언론사에서 선정하며 언론사 페이지(아웃링크)로 이동해 볼 수 있습니다.레드벨벳 아이린 옆에 北 김정은, 실화야?""자연미인"" 셋째 출산에도 여전히 아름다운 '리설주'박근혜 선고 ""역대급 중형""견미리 딸 이다인, 금수저 논란…주식부자?고 장자연-단역 자매 사건 재수사…""내가 노리개인가"""
연합뉴스,060240,/news/news_read.nhn?article_id=0008804915&office_id=001&mode=search&query=룽투코리아&page=1,2016-11-07 09:20,"룽투코리아, 3분기 연결 영업익 43억원&hellip;흑자전환","(서울=연합뉴스) 유현민 기자 = 코스닥에 상장된 온라인 교육 학원업체 룽투코리아는 올해 3분기 연결기준 영업이익이 43억원으로 작년 동기 대비 흑자전환했다고 7일 공시했다. 당기순이익도 43억원으로 흑자전환했고, 매출은 284억원으로 533.19% 늘었다."
매일경제,060240,/news/news_read.nhn?article_id=0003772075&office_id=009&mode=search&query=룽투코리아&page=1,2016-07-22 08:14,"룽투코리아, 하반기 신작 대거 공개&hellip;AR &middot; 유명 IP 게임 등 10여종 &lsquo;투하&rsquo;","중국계 코스닥 상장 게임업체 룽투코리아가 하반기부터 10여종 신작을 선보이며 사업에 드라이브를 건다. 최근 전세계적으로 주목받고 있는 증강현실(AR) 기술 기반의 하드코어 모바일 RPG ‘포켓로이드’를 비롯해 ‘라인’과의 합자법인 란투게임즈가 개발한 ‘라인팝2’, 국내 유명 PC온라인게임 IP 활용 모바일게임인 ‘크로스파이어’와 ‘열혈강호’, 유명 만화 ‘타짜’ 기반 모바일 보드게임 등 굵직굵직한 작품들을 준비했다. 룽투코리아는 이를 통해 본격적으로 게임 사업 매출을 끌어올릴 방침이다. 21일 코스닥협회에서 열린 룽투코리아 기업설명회에서 최성원 사업총괄이사가 하반기 라인업을 소개하고 있다. 룽투코리아는 21일 서울 영등포구 여의도동 코스닥협회 강당에서 기업설명회를 갖고 하반기 이후 라인업을 대거 공개했다. 이날 행사에서는 AR게임과 소셜카지노, 유명 IP 기반 게임 등 약 12종의 모바일게임이 소개됐다. 발표에 나선 룽투코리아 최성원 기획본부장(사업총괄이사)은 “지난해는 기반을 다졌고 2분기 ‘검과마법’을 통해 실적으로 보여줬다”라며 “하반기부터 빠르게 사업을 전개해나갈 것”이라고 설명했다. ◆ 타짜·크파·열강 등 유명 IP 게임부터 증강현실까지 잡았다 우선 유명게임 ‘크로스파이어’와 ‘열혈강호’ 기반 모바일게임들이 중국에 출시된다. 최 본부장에 따르면 지난 14일 3인칭 슈팅게임 ‘크로스파이어’ 모바일게임의 중국 현지 테스트가 진행됐고 3분기 중 모바일 MMORPG ‘열혈강호’의 테스트도 진행된다. 이들 게임은 룽투코리아가 관련 IP를 확보해 중국 본사 룽투게임과 계약한 작품이다. 현지 매출에 따라 로열티를 지급받게 된다. ‘열혈강호’의 경우 룽투코리아가 한국 서비스도 담당한다. 유명 만화 ‘타짜’ IP도 확보했다. 해당 IP 기반의 맞고게임과 포커게임을 국내 시장에 가을경 내놓는다. 해외 시장에는 소셜카지노 게임도 선보인다. 8월 중순 동남아 시장에 우선 출시하고 10월 경 전세계 정식 서비스에 돌입한다. 동남아, 유럽, 북미 순으로 시장 타깃을 설정했다. 중국에 출시돼 현지 애플 앱스토어 매출 순위 상위권을 유지 중인 신작 모바일 RPG ‘산구산전기’도 3분기 출시를 계획하고 있다. 이미 한국어 번역 작업이 마무리 단계이며 카카오 게임하기를 통해 선보일 예정이다. 중국내 인기 애니메이션 ‘산구산전기’를 기반으로 제작된 것이 특징이다. 이달 중 유명 아케이드게임 ‘메탈슬러그’ 기반의 모바일게임의 테스트도 진행한다. 룽투코리아가 독점 판권을 확보했다. 4분기에는 최근 상장한 스마트폰 메신저 ‘라인’의 서비스업체 라인과 함께 설립한 합자회사 란투게임즈의 신작 ‘라인팝2’도 선보인다. 중국 우선 출시로 순차적으로 각국 서비스를 진행한다. 국내 시장에는 중국게임 ‘천제기병’ 출시가 예정됐다. 블록버스터급 모바일 RPG로 상반기 히트작 ‘검과마법’ 이상의 대작이라는 설명이다. 또 음식을 소재로 한 모바일 퍼즐게임 ‘미식연맹’을 내놓을 예정이다. 게임 이용자에게 각종 음식을 직접 배송해주는 서비스를 선보이는 등 O2O가 결합돼 눈길을 끈다. 연말과 내년 초에는 증강현실(AR) 기반 모바일 RPG ‘포켓로이드’를 선보인다. 세계 곳곳에 위치한 랜드마크에 출몰하는 몬스터 등을 공략하는 재미를 담았다. 이외에도 중국 룽투게임이 서비스 예정인 DC코믹스 기반의 모바일게임 ‘DC정의연맹(저스티스리그)’, 유명 중국 PC온라인게임 ‘고검’을 기반으로 제작한 ‘고검기담’ 등의 신작들도 내년 출시 라인업으로 준비 중이다. ◆ 카카오 협력 지속…검과마법 흥행 장기화에도 ‘심혈’ 룽투코리아는 이들 신작 라인업을 통해 게임사업 전개에 가속도를 낸다는 방침이다. 특히 ‘검과마법’의 흥행에 큰 기여를 한 카카오와의 전략적인 협업을 차기 타이틀에서도 지속해 신작 흥행 가능성을 높인다는 전략이다. 현재 룽투코리아가 서비스하고 있는 모바일게임 ‘검과마법’은 최근 누적 300만 다운로드를 달성했고 구글 플레이와 애플 앱스토어, 원스토어 등의 마켓에서 매출 순위 상위권에 자리하는 등 흥행 중에 있다. 2분기 매출이 큰 폭으로 성장할 것으로 예측되는 상황이다. 이런 ‘검과마법’의 흥행에는 카카오의 힘이 컸다. 카카오 게임하기 내에서 적극적인 마케팅 지원으로 빠르게 인기를 높일 수 있었다는 것이 최 본부장의 설명이다. 룽투코리아는 카카오의 게임 계열사 카카오게임즈로부터 100억 원의 투자 유치를 이끌어 내고 전략적인 관계를 맺은 바 있다. 또 ‘검과마법’ 서비스를 통해 선보인 미디어믹스 전략도 한층 강화한다. ‘검과마법’의 경우 소녀시대 태연 등의 인기가수를 활용한 OST는 물론 관련 웹툰 등을 선보이며 다른 콘텐츠 소비자들의 유입을 이끌었다. 특히 웹툰은 카카오 게임하기 인기순위에서 ‘검과마법’이 상위권을 유지하는 원동력 중에 하나다. 자회사 더이앤엠의 방송 플랫폼 ‘팝콘TV’와의 연계를 통한 저변 확대도 핵심 포인트 중 하나다. 현재 흥행 중인 ‘검과마법’의 인기를 지속하기 위한 전략도 공개했다. 이달 중 궁수 캐릭터를 추가하고 이후 e스포츠화를 고려한 토너먼트 시스템도 더한다. 11월 열리는 게임전시회 지스타에서 결승전을 열고 12월에는 중국과 대만, 한국 이용자가 참여하는 국가대항전도 개최할 생각이다. 최 본부장은 “검과마법은 원스토어 매출 비중이 매우 높은 편으로 전체 모바일게임 시장에서 ‘검과마법’의 실제 매출 비중은 우리가 1등이라고 생각한다”라며 “카카오 플랫폼 내에서 많은 지원을 받았는데 다음 타이틀도 전략적으로 긴밀한 협력을 통해 서비스할 것”이라고 말했다."
이데일리,060240,/news/news_read.nhn?article_id=0003949660&office_id=018&mode=search&query=룽투코리아&page=1,2017-10-20 14:58,룽투코리아 &lsquo;열혈강호 for kakao&rsquo; 사전예약자 100만 돌파,- 24일 정식 출시…추가 이벤트 진행 (이미지=룽투코리아 제공) [이데일리 이명철 기자] 룽투코리아(060240)는 24일 정식 출시 예정인 모바일 다중접속역할수행게임(MMORPG) ‘열혈강호 for kakako’가 사전 예약자수 100만명을 넘었다고 20일 밝혔다. 지난달말에는 사전예약 이벤트 시작 후 일주일만에 60만명을 모은 바 있다. 인기 영화배우 오달수가 모바일 게임 공식 홍보모델로 선정하고 16일 TV CF를 공개하며 주목을 받았다. 사전예약 100만 돌파를 기념해 공식 카페 가입과 이벤트에 참여하는 이용자 선착순 2만명에게 ‘카카오톡 이모티콘 밍밍이’를 지급한다. 사전예약 이벤트 참여 전원에게는 1000귀속 금화를 증정하는 등 추가 행사를 진행한다. 이홍의 게임사업본부장은 “많은 유저들의 관심 속에 유의미한 성과를 거두고 있다”며 “기대가 큰 만큼 좋은 게임과 양질의 서비스를 선보이겠다”고 말했다.
머니투데이,060240,/news/news_read.nhn?article_id=0003714302&office_id=008&mode=search&query=룽투코리아&page=1,2016-07-20 09:18,"룽투코리아 '검과마법', 출시 40일만에 누적 다운로드 300만","[머니투데이 김평화 기자] [유저 유입가속화 매출상승과 직결, 2분기 실적개선 기대] 룽투코리아의 신작 모바일 게임 ‘검과마법’이 흥행을 이어가고 있다. 룽투코리아는 '검과마법'이 출시 40일만에 누적 다운로드 300만 돌파에 성공했다고 20일 밝혔다. 누적 다운로드 수 집계는 구글 플레이스토어, 원스토어, 애플 앱스토어 등 주요 3대 마켓 집계 기준이다. 회사 관계자는 ""'검과마법'은 판타지 세계관을 바탕으로 캐릭터의 성장과 유저 간 커뮤니티, 뛰어난 타격감 등 정통 MMORPG의 감성을 모바일에 최적화된 조작감으로 완성시킨 모바일 게임""이라며 ""PC 온라인 게임에 버금가는 판타지 풍의 풀 3D 그래픽과 방대한 콘텐츠가 특징""이라고 자부했다. 이 게임은 지난 6월 출시 이후 마켓별 인기 및 매출순위 부문에서 상위권을 차지하고 있다. 특히 카카오게임 플랫폼을 활용한 마케팅과 게임, 웹툰, 음악, 방송을 연계한 트랜스미디어 전략이 유저 유입이 이뤄진 것으로 분석된다. 룽투코리아 관계자는 ""실제로 게임 출시 전부터 공식 홍보 모델 태연이 출연하는 광고 및 '아틀란티스 소녀' OST로 화제를 모았다""며 ""게임 출시와 함께 웹툰, 검과마법 OST, 게임 방송 등을 선보이며 정식 출시 40여일 만에 누적 300만 다운로드를 달성하는 쾌거를 올렸다""고 설명했다. 이 관계자는 ""하반기에도 계속 성과를 이어가기 위해 확보된 라인업을 공개하고 특히 게임사업에 있어 카카오와 긴밀히 협조해 나갈 것""이라고 말했다. 한편, 룽투코리아는 오는 21일 기관 투자자를 대상으로 기업설명회를 열고, 사업현황 및 비전공유를 통해 기업가치제고에 주력할 방침이다. textlinktopstart textlinktopend textlinkstart"
이데일리,060240,/news/news_read.nhn?article_id=0003591289&office_id=018&mode=search&query=룽투코리아&page=1,2016-07-20 09:50,[특징주]룽투코리아 신작 &lsquo;검과 마법&rsquo; 인기에 상승세,"[이데일리 이명철 기자] 룽투코리아(060240)가 신작 게임인 ‘검과 마법 for Kakao’가 흥행 소식에 상승세를 나타내고 있다. 20일 오전 9시47분 현재 룽투코리아 주가는 전일대비 4.78% 오른 1만3150원을 기록 중이다.전날 하락했지만 하루만에 상승 전환했다. 신작 인기에 따른 실적 개선 기대감이 작용하는 것으로 풀이된다. 회사는 ‘검과 마법’이 출시 40일만에 구글 플레이스토어, 원스토어, 애플 앱스토어 등 주요 3대마켓에서 누적 다운로드 300만 돌파에 성공했다고 이날 밝혔다. 정통 다중역할수행게임(MMORPG)을 모바일에 최적화시킨 게임으로 지난달 출시 후 상위권을 유지했다. 공식 홍보 모델 태연이 출연하는 광고와 ‘아틀란티스 소녀’ OST로 화제를 모으기도 했다. 회사 관계자는 “‘검과마법’을 통해 2분기 게임 매출의 큰 성장이 예상된다”며 “하반기에도 확보된 라인업을 공개하고 게임사업에서 카카오와 긴밀히 협조해 나갈 예정”이라고 전했다."
아이뉴스24,060240,/news/news_read.nhn?article_id=0000381973&office_id=031&mode=search&query=룽투코리아&page=1,2016-07-20 11:00,[특징주]룽투코리아 상승세&hellip;신작 '검과마법' 흥행,"[윤지혜기자] 룽투코리아가 신작 게임 흥행에 힘입어 상승세다. 룽투코리아는 20일 오전 10시 55분 현재 전일 대비 2.79%(350원) 오른 1만2천900원에 거래되고 있다. 이날 룽투코리아는 신작 게임 '검과마법'이 출시 40일 만에 구글 플레이스토어·원스토어·애플 앱스토어 등 주요 3대 마켓에서 누적 다운로드 수 300만 명을 돌파했다고 발표했다. 검과마법은 대규모다중접속역할수행게임(MMORPG)으로 3차원(D) 그래픽과 방대한 콘텐츠가 특징이다. 회사 측은 ""지난 11일 검과마법 첫 대규모 업데이터에서 추가된 '결혼시스템'이 사용자들 사이에서 큰 호응을 얻어 사용자 유입과 매출 증대에 긍정적인 영향을 주고 있다""며 ""룽투코리아의 2분기 실적에도 크게 기여할 것""으로 내다봤다. /윤지혜기자"
서울경제,060240,/news/news_read.nhn?article_id=0003235848&office_id=011&mode=search&query=룽투코리아&page=1,2018-03-05 11:55,"(코)룽투코리아, 장중 신저가 기록.. 6,720&rarr;6,640(▼80)","[서울경제] 오전 11시 54분 현재 룽투코리아(060240) 가 4.18% 내린 6,640원(▼290)을 기록하며, 52주 신저가를 -80원 경신했다. 기존 52주 최저가는 2018년 03월 02일 기록한 6,720원이다. 체결강도는 38%로 강세 반전했다. 총매수체결량은 26,921주, 총매도체결량은 70,519주를 각각 기록했다.  (※ 체결강도(%) = (총매수체결량/총매도체결량)*100) 이 시각 현재 거래대금은 6억8,669만, 거래량은 10만1,550주를 기록하고 있으며, 수급측면으로는 72(매도):28(매수)의 매도우위를 보이고 있다. 거래일을 기준으로 최근 3일간 평균 거래량은 2십4만8천주, 60일 평균 거래량 2십6만2천주로 비슷한 수준의 거래량을 유지하고 있다."
부산일보,060240,/news/news_read.nhn?article_id=0000615176&office_id=082&mode=search&query=룽투코리아&page=1,2016-07-11 11:19,"룽투코리아, '검과 마법' 인기 고삐죈다&hellip;론칭 후 첫 대규모 업데이트","중국계 모바일게임사 룽투코리아(대표이사 양성휘)는 자사가 서비스하는 모바일 MMORPG ‘검과마법 for Kakao(이하 검과마법)’에서 론칭 이후 첫 번째 대규모 업데이트를 단행했다고 11일 밝혔다.    ‘검과마법’은 오픈필드에서 펼쳐지는 판타지풍의 3D 그래픽을 중심으로 3대3 PVP, 10대10 전장, 대규모 영지전 등 이용자간 대결 요소를 차별화 된 시스템을 특징으로 큰 인기를 얻고 있다. ‘검과마법’은 지난 6월 초 출시 이후 단숨에 구글플레이 매출 탑3에 진입했으며, 현재도 매출 탑6에 이름을 올리고 있다.   룽퉄리아는 이번 업데이트를 통해 ‘검과마법’내에 ‘결혼시스템’, ‘별자리 리뉴얼’, ‘이벤트 월드보스’ 등의 신규 게임 콘텐츠 추가와 함께 이용자 편의를 고려한 다양한 기능이 업데이트 됐다.   한편, 룽투코리아는 ‘검과마법’의 첫 번째 대규모 업데이트를 기념해 이달 말까지 퀘스트 및 복귀 이벤트 등을 진행한다.   사진=룽투코리아 제공  "
