source,symbol,link,date,title,content
이데일리,063570,/news/news_read.nhn?article_id=0003491894&office_id=018&mode=search&query=한국전자금융&page=1,2016-03-04 06:38,"한국전자금융, 신규 성장 동력 확보-하나","[이데일리 박형수 기자] 하나금융투자는 4일 한국전자금융(063570)에 대해 신규로 추진하는 사업이 빠르게 성장할 것으로 기대했다. 투자의견 ‘매수’와 목표주가 1만200원을 새롭게 제시했다. 이정기 하나금융투자 스몰캡 팀장은 “한국전자금융은 지난해 8월 포스(POS) 기기업체 오케이포스를 인수했다”며 “포스 사업과 무인주차장 사업, 키오스크 사업을 시작하며 새로운 성장동력을 확보했다”고 설명했다. 그는 이어 “국내 무인 주차장 사업은 시장 형성 초기 단계로 큰 성장 잠재력이 있다”며 “2018년 약 200억원 이상의 매출을 달성할 것으로 예상한다”고 덧붙였다. 아울러 “기존 주차장 위탁관리와 토지를 임대한 후에 직접 운영하는 방식으로 추진한다”며 “이익률은 약 15%에 달할 것”이라고 강조했다."
한국경제TV,063570,/news/news_read.nhn?article_id=0000442418&office_id=215&mode=search&query=한국전자금융&page=1,2016-03-05 09:50,[국고처 최승욱] 종목상담 - 한국전자금융(063570),[국고처 최승욱] 종목상담 - 한국전자금융(063570) 3월 5일 방송된 `국민주식고충처리반`에 출연한  최승욱 파트너가 한국전자금융(063570)에 대한 시세와 전망을 얘기하고 있다.
머니투데이,063570,/news/news_read.nhn?article_id=0003892233&office_id=008&mode=search&query=한국전자금융&page=1,2017-06-22 11:10,"[베스트리포트]한국전자금융, 성장주로 화려한 변신","[머니투데이 김주현 기자] 22일 머니투데이 증권부가 선정한 베스트리포트는 한상웅 한국투자증권 연구원이 작성한 '한국전자금융, 성장주로의 화려한 변신'입니다. 한 연구원은 한국전자금융이 CD VAN(현금자동지급기) 시장 점유율이 확대와 인터넷 은행 성장으로 수혜를 입을 것으로 전망했습니다. CD VAN 2위 사업자인 BGF핀링크 지분 50%를 인수하면서 CD VAN 시장 점유율이 47%로 늘어난다는 설명입니다. 아울러 신규 사업 Kiosk 렌탈.판매와 무인 주차 시스템 구축은 새로운 성장동력이 될 것이라고 분석했습니다. 특히 무인화 신규 사업은 높은 외형 성장을 보이고 있다며 2015년 80개였던 무인 주차장 운영사이트가 올해 270개까지 확대될 전망이라고 설명했습니다. 다음은 보고서를 요약한 내용입니다. ☞"
한국경제,063570,/news/news_read.nhn?article_id=0003563066&office_id=015&mode=search&query=한국전자금융&page=1,2016-03-14 07:02,두산중공업&middot;포스코&middot;카카오&middot;한국전자금융&hellip;경기민감 대형주&middot;핀테크 유망주 '주목',"'대형주 랠리' 이끌 종목은 [ 민지혜 기자  ] 코스피지수가 최근 1970선을 회복하는 등 투자심리가 개선되면서 외국인이 주도하는 ‘대형주 랠리’에 관심이 모아지고 있다. 외국인들은 주로 정유·화학과 반도체 자동차 정보기술(IT) 등 한국을 대표하는 종목을 순매수하며 지수 상승을 주도하고 있다. 증권가에서는 실적 개선세가 뚜렷하고 주가가 저평가돼 있는 경기민감 대형주에 투자하라는 의견이 잇달아 나오고 있다. 유가 반등으로 기대감 상승 외국인 투자자들은 올 들어 지난 11일까지 유가증권시장에서 정유·화학과 철강, 반도체 등의 업종을 가장 많이 순매수했다. 포스코를 2000억원가량 샀고 LG전자 SK이노베이션 현대중공업 한화케미칼 LG화학 등을 1000억원어치 이상 담았다. 국제유가가 한 달 만에 배럴당 25달러대에서 37달러대까지 급상승한 것이 투자심리를 키웠다는 분석이다. 현대증권에 따르면 최근 한 달 동안 조선업종의 주가가 17.9% 올랐고 철강(12.6%) 자동차(8.1%) 반도체(4%) 등의 상승폭도 컸다. 올 1월 들어 철강·조선업종의 밸류에이션(실적 대비 주가 수준)이 역사적 최저치까지 내려가면서 저가 매수세가 유입됐다는 분석이다. 한국경제TV 와우넷 전문가인 반경수 파트너는 “정유·화학 등 경기 민감 대형주로 외국인 자금이 몰리면서 향후 대형주 랠리를 이어갈 종목에 관심이 모아지고 있다”며 “올해 이익 개선이 예상되는 현대미포조선과 GS건설을 비롯해 3년 만에 턴어라운드가 예상되는 두산중공업 등이 유망하다”고 말했다. 포스코를 추천하는 의견도 많았다. 박광래 신한금융투자 연구원은 “중국 철강산업 구조조정에 대한 기대감으로 철강재 판매가격이 급등하고 있는 데다 포스코의 현 주가는 2008년 글로벌 금융위기 수준으로 떨어졌다”며 목표주가를 26만원에서 27만원으로 상향조정했다. 포스코 주가는 지난 1월21일 15만6000원까지 내려갔다가 이후 반등하며 저점 대비 40%가량 올랐다. 전문가들은 포스코의 12개월 선행 주가순자산비율(PBR)이 0.41배 수준으로 매우 낮고 올해 1분기 영업이익이 시장 기대치보다 높을 것으로 예상된다며 앞으로도 주가 상승 여력이 크다고 보고 있다. 핀테크 등 IT 업종도 주목 화학, 철강 등의 업종이 올 들어 지수 상승을 이끌었다면 앞으로는 핀테크(금융+기술) 반도체 등 IT 업종에 관심을 가져야 한다는 의견도 나온다. 모바일 결제와 지문인식 등 핀테크 업종의 성장성이 높고 삼성전자의 새 스마트폰 ‘갤럭시 S7’의 판매량 개선도 상승 동력으로 작용할 것이란 이유에서다. 한국경제TV 와우넷 전문가인 박영호 파트너는 “모바일 결제 시장에서 삼성페이가 점차 두각을 나타내면서 관련주인 한국전자금융의 실적 개선과 주가 상승이 예상된다”며 “최근 인터넷은행에 뛰어든 카카오도 핀테크 유망주로 꼽힌다”고 말했다. 삼성전자 LG전자 등 한국을 대표하는 전자업체를 추천하는 전문가도 많았다. 소현철 신한금융투자 연구원은 “LG전자의 새 스마트폰 G5가 연간 1200만대 이상 팔릴 것으로 예상되고 OLED(유기발광다이오드) TV 등 가전부문에서도 판매량이 개선되고 있다”며 “올해 영업이익은 작년보다 68.2% 급증한 2조원으로 예상된다”고 설명했다. 미래에셋증권은 삼성전자가 3D 낸드플래시 부문에서 공격적으로 사업을 펼치고 있다며 주가 상승 여력이 높다고 분석했다. 시장분석 업체 S&P캐피털 IQ에 따르면 휴대폰 케이스를 주력으로 만드는 슈피겐코리아의 올해 매출은 작년(1730억5000만원)보다 31.98% 증가한 2284억원에 이를 것으로 예상된다. 새 스마트폰의 출시로 인해 케이스 등 관련기업의 실적도 개선될 가능성이 높다는 분석이다. 이 밖에 현대자동차 현대모비스 아모레퍼시픽 한미약품 오리온 롯데쇼핑 등을 유망 종목으로 꼽는 전문가도 있었다. 김진우 한국투자증권 수석연구원은 “현대모비스의 핵심부품 판매 비중이 올라가고 있고 친환경차 부품 라인업도 확대되는 추세”라며 “안정적 이익을 기반으로 수익 개선이 예상되기 때문에 자동차 업종 내 최선호주로 추천한다”고 했다."
연합뉴스,063570,/news/news_read.nhn?article_id=0008259981&office_id=001&mode=search&query=한국전자금융&page=1,2016-03-17 08:40,이베스트투자 &quot;한국전자금융 사업다각화&hellip;목표가&uarr;&quot;,"(서울=연합뉴스) 윤종석 기자 = 이베스트투자증권은 17일 한국전자금융에 대해 무인자동화기기 등으로 사업이 다각화돼 성장성이 좋다며 목표주가를 9천원에서 1만원으로 올렸다. 정홍식 연구원은 ""한국전자금융의 경쟁력은 기존 현금자동입출금기(ATM)를 관리하는 전국 네트워크를 활용해 사업 영역을 확장할 수 있다는 것""이라며 ""이를 활용해 무인자동화기기나 무인주차장으로 사업영역을 다각화하고 있다""고 설명했다. 정 연구원은 ""이 회사는 작년 8월 POS(판매시점 정보관리시스템) 단말기 업체인 'OK POS'를 인수하고서 올해 1월 결제단말기 업체인 제이텍씨엔씨와 합병했다""며 ""이를 통해 올해 연결 매출액이 400억원 이상 증가하는 효과가 나올 것""이라고 전망했다."
한국경제,063570,/news/news_read.nhn?article_id=0003778760&office_id=015&mode=search&query=한국전자금융&page=1,2017-06-07 08:14,"&quot;한국전자금융, BGF핀링크 인수로 외형성장&middot;수익개선 전망&quot;-이베스트","이베스트투자증권은 7일 한국전자금융이 BGF핀링크를 인수하면서 외형 성장과 수익성이 개선이 나타날 것이라고 밝혔다. 한국전자금융은 지난 2일 BGF핀링크를 385억원(지분율 50%)에 인수했다고 밝혔다. BGF핀링크는 지난해 12월 BGF네트웍스(BGF리네일의 100% 계열사)의 CD/VAN 사업부문이 물적분할된 기업이다. BGF핀링크의 기기수는 1만1014대, 국내 시장점유율(M/S)은 25% 수준으로 1위를 유지하고 있다. 지난해 기준 매출액은 467억원, 영업이익 78억원, 세전이익 72억원을 기록했다. 정 연구원은 ""BGF핀링크와 한국전자금융의 CD/VAN 사업을 합산하면 M/S 45% 수준에 달한다""며 ""시너지 효과와 함께 플랫폼 비즈니스 강화로 성장 모멘텀을 강화할 수 있을 것""이라고 설명했다. 이어 ""인수 효과로 한국전자금융의 실적 개선도 기대된다""며 ""연간기준 매출액 450억원 ~500억원, 영업이익 10억원~20억원(지분율 50%을 고려한 것임, 연결기준으로는 2배)에 달할 것""이라고 강조했다."
전자신문,063570,/news/news_read.nhn?article_id=0002614937&office_id=030&mode=search&query=한국전자금융&page=1,2017-06-07 09:10,"[ET투자뉴스]한국전자금융, &quot;지속되는 M&amp;A 효&hellip;&quot; 매수(유지)-이베스트투자증권","이베스트투자증권에서 7일 한국전자금융(063570)에 대해 ""지속되는 M&amp;A 효과""라며 투자의견을 '매수(유지)'로 제시하였고, 아울러 목표주가로는 12,000원을 내놓았다. 이베스트투자증권 정홍식 애널리스트가 동종목에 대하여 이번에 제시한 '매수(유지)'의견은 이베스트투자증권의 직전 매매의견과 동일한 것이고 올해 초반의 매매의견을 기준으로  볼때도 역시 '매수'의견이 계속 유지되고 있는 상태이다. 그리고 최근 분기내 발표된 전체 증권사 리포트의 컨센서스와 비교를 해볼 경우에 오늘 발표된 투자의견은 전체의견에 수렴하고 있어, 이번 의견은 시장의 평균적인 기대감이 객관적으로 표현된 것으로 분석되고 있다. 목표주가의 추이를 살펴보면 이번에 다시 목표가가 같은 수준을 유지하면서 최근 흐름은 목표가의 계단식 상승이 진행되는 모습이다. 또한 전일 종가 기준으로 볼때 동종목의 현주가는 이번에 제시된 목표가 대비 42.3%의 저평가 요인이 존재한다는 해석이 제시되고 있다."
이데일리,063570,/news/news_read.nhn?article_id=0003501581&office_id=018&mode=search&query=한국전자금융&page=1,2016-03-17 08:40,"한국전자금융, 사업다각화 긍정적&hellip;목표가&uarr;-이베스트","[이데일리 유재희 기자] 이베스트투자증권은 17일 한국전자금융(063570)에 대해 무인자동화기기 및 POS 단말기 사업 등으로 업무 영역을 다각화하고 있는 점이 긍정적이라며 목표주가를 종전 9000원에서 1만원으로 상향 조정했다. 투자의견은 ‘매수’를 유지했다. 정홍식 이베스트투자증권 연구원은 “한국전자금융의 경쟁력은 기존 ATM과 CD-VAN을 관리할 수 있는 전국적인 네트워크 인프라를 활용해 사업영역을 확장시킬 수 있다는 것”이라며 “동사는 실제 이를 활용해 무인자동화기기(푸드코트 셀프 주문 등의 역할)와 무인주차장으로 사업영역을 다각화하고 있다”고 설명했다. 인건비 절감 및 업무 효율화로 무인기기에 대한 고객 수요가 증가하고 있다는 점에서 동사의 신규 성장 동력이 될 것으로 판단했다. 정 연구원은 또 “동사는 지난해 8월 POS 단말기 업체 OK POS를 인수(지분 70%)했고, 올해 1월 OK POS를 결제단말기 업체 제이텍씨엔씨와 합병했다”며 “이를 통해 올해 연결매출액 400억원 이상의 증가효과가 나타날 것”이라고 전망했다. 이어 “중장기적으로는 NICE 그룹의 인프라를 활용한 고객선 확대로 POS 사업의 고성장이 예상된다”고 덧붙였다. 한편 한국전자금융은 ATM 운영관리, CD VAN(NICE 현금지급기), 현금물류(매출비중 12.5%), 무인주차장 및 무인자동화기기(KIOSK), POS, 결제단말기 사업을 영위하고 있는 기업으로 전국 26개의 AS지사와 10개의 자금센터를 보유하고 있다. 계열회사는 현금수송을 담당하는 나이스씨엠에스(지분율 89.8%)와 OK POS(지분율 70%)가 있다."
머니투데이,063570,/news/news_read.nhn?article_id=0003759970&office_id=008&mode=search&query=한국전자금융&page=1,2016-10-20 15:11,"한국전자금융, 황록 사외이사 중도퇴임",[머니투데이 이해인 기자] 한국전자금융은 황록 사외이사가 일신상의 사유로 중도 퇴임했다고 20일 공시했다. textlinktopstart textlinktopend textlinkstart
파이낸셜뉴스,063570,/news/news_read.nhn?article_id=0003812008&office_id=014&mode=search&query=한국전자금융&page=1,2017-05-08 14:19,"[fnRASSI]한국전자금융(063570), 52주 신고가 경신...4.23% &uarr;","한국전자금융(063570)은 52주신고가를 기록하고 있어 주목할만하다. 동종목의 현재 주가는 9,360원 선에서 이루어지고 있다. 거래일을 기준으로 최근 3일간 평균 거래량은 142만 주이다. 이는 60일 일 평균 거래량 43만 주와 비교해보면 최근 거래량이 급격히 늘어났다는 것을 알 수 있다. 주요 매매주체는 개인투자자  최근 한달간 주체별 거래비중을 살펴보면 개인 비중이 89.13%로 가장 높았고, 외국인이 8.4%로 그 뒤를 이었다. 기관은 2.46%를 나타냈다. 그리고 최근 5일간 거래비중은 개인이 전체 거래량의 87.63%를 차지하며 가장 활발한 참여를 보였고, 외국인은 10.55%, 기관은 1.8%의 거래 참여율을 보였다. 외국인 보유량 증가, 기관 감소 (5일 누적) 최근 5일간 동종목의 외국인 투자자는 115,325주 순매수하였고 반면 기관은 12,324주 순매도하였다. 전날 외국인 116,486주 순매수, 기관12,324주 순매도하며 보유 비율이 변동했다. 다음 표는 동종목의 외국인, 기관의 일별 순매수량을 나타낸 것이다. 'fnRASSI'는 증권전문 기업 씽크풀과 파이낸셜뉴스의 협업으로 로봇기자가 실시간으로 생산하는 기사입니다."
파이낸셜뉴스,063570,/news/news_read.nhn?article_id=0003811901&office_id=014&mode=search&query=한국전자금융&page=1,2017-05-08 11:11,"[fnRASSI]한국전자금융(063570), 52주 신고가...4.23% &uarr;","한국전자금융(063570)은 52주신고가를 기록하고 있어 주목할만하다. 동종목의 현재 주가는 9,360원 선에서 이루어지고 있다. 거래일을 기준으로 최근 3일간 평균 거래량은 131만 주이다. 이는 60일 일 평균 거래량 43만 주와 비교해보면 최근 거래량이 급격히 늘어났다는 것을 알 수 있다. 기관과 개인은 순매도, 외국인은 순매수(한달누적)  4월28일부터 전일까지 기관이 3거래일 연속 순매도를 보였다. 4주간을 기준으로 보면 외국인이 462,470주를 순매수한 반면, 기관은 매도쪽으로 방향을 잡으면서 92,397주를 순매도했고, 개인들도 매도 우위를 지속하면서 370,073주를 순매도한 것으로 집계됐다. 주요 매매주체는 개인투자자  최근 한달간 주체별 거래비중을 살펴보면 개인 비중이 89.13%로 가장 높았고, 외국인이 8.4%로 그 뒤를 이었다. 기관은 2.46%를 나타냈다. 그리고 최근 5일간 거래비중은 개인이 전체 거래의 87.63%를 차지하며 가장 적극적인 모습을 보여줬고, 외국인은 10.55%를 나타냈으며 기관은 1.8%를 나타냈다. 'fnRASSI'는 증권전문 기업 씽크풀과 파이낸셜뉴스의 협업으로 로봇기자가 실시간으로 생산하는 기사입니다."
파이낸셜뉴스,063570,/news/news_read.nhn?article_id=0003811761&office_id=014&mode=search&query=한국전자금융&page=1,2017-05-08 09:29,"[fnRASSI]한국전자금융, 52주 신고가...3.12% &uarr;","한국전자금융(063570)은 52주신고가를 기록하고 있어 주목할만하다. 동종목의 현재 주가는 9,260원 선에서 이루어지고 있다. 거래일을 기준으로 최근 3일간 평균 거래량은 55만 주이다. 이는 60일 일 평균 거래량 43만 주와 비교해보면 최근 거래량이 다소 증가했다는 것을 알 수 있다.                   지표               항목               값               종합점수                 성장성               매출액증가율               0.07               8.23                 자기자본증가율               0.09                 안정성               부채비율               110.49               8.38                 유동비율               140.45                 이익안정성               10                 수익성               ROA               5.01               6.98                 ROE               10.54                 영업이익율               7.16          한국전자금융의 퀀트 재무 점수는 23.59점으로 지난 분기에 비해 성장성 점수가 하락했다. 이는 매출액 증가율과 자기자본 증가율이 감소하였기 때문이다. 실적 안정성이 개선되어 안정성 종합 점수는 상승했다. 기관과 개인은 순매도, 외국인은 순매수(한달누적)  4월28일부터 전일까지 기관이 3거래일 연속 순매도를 보였다. 4주간을 기준으로 보면 외국인이 초반에 동종목을 순매수한 이후에 기세를 이어가며 462,470주를 순매수한 반면, 기관은 매도 관점으로 접근하면서 92,397주를 순매도했고, 개인들도 매도쪽으로 방향을 잡으면서 370,073주를 순매도한 것으로 집계됐다. 'fnRASSI'는 증권전문 기업 씽크풀과 파이낸셜뉴스의 협업으로 로봇기자가 실시간으로 생산하는 기사입니다."
전자신문,063570,/news/news_read.nhn?article_id=0002609209&office_id=030&mode=search&query=한국전자금융&page=1,2017-05-16 13:41,"[ET투자뉴스]한국전자금융, &quot;1Q17 영업이익 &hellip;&quot; 매수(유지)-이베스트투자증권","이베스트투자증권에서 16일 한국전자금융(063570)에 대해 ""1Q17 영업이익 +36.3% yoy""라며 투자의견을 '매수(유지)'로 제시하였고, 아울러 목표주가로는 12,000원을 내놓았다. 이베스트투자증권 정홍식 애널리스트가 동종목에 대하여 이번에 제시한 '매수(유지)'의견은 이베스트투자증권의 직전 매매의견에서 큰 변화없이 그대로 유지되는 것이고  올해 초반의 매매의견을 기준으로  볼때도 역시 '매수'의견이 계속 유지되고 있는 상태이다. 그리고 최근 분기내 발표된 전체 증권사 리포트의 컨센서스와 비교를 해볼 경우에 오늘 발표된 투자의견은 전체의견에 수렴하고 있어, 이번 의견은 시장의 평균적인 기대감이 객관적으로 표현된 것으로 분석되고 있다. 목표주가의 추이를 살펴보면 한동안 정체구간을 보낸 후 이번에 오랜만에 목표가가 상향조정된 모습이다. 또한 전일 종가 기준으로 볼때 동종목의 현주가는 이번에 제시된 목표가 대비 35.3%의 저평가 요인이 존재한다는 해석이 제시되고 있다."
헤럴드경제,063570,/news/news_read.nhn?article_id=0001240630&office_id=016&mode=search&query=한국전자금융&page=1,2017-05-22 11:29,"한국전자금융, 무인주차사업 탄력 받는다","소규모부지·낮은 관리비 강점1분기, 작년 매출의 절반 달성 단순업무를 기기가 대신하는 ‘무인(無人)시대’를 맞아 무인 주차장과 키오스크를 필두로 하는 한국전자금융의 신사업이 주목받고 있다. 시장에서는 인구구조 변화와 저성장 시대 진입, 비용 절감 등 외부 환경 변화와 함께 기존 현금자동입출금기(ATM) 관리, 금융자동화기기 부가가치통신망(CD VAN) 운영 능력이 어우러지면서 외형 성장이 가시화 할 것이라는 관측을 내놓고 있다. 22일 금융투자업계에 따르면 한국전자금융의 신사업인 무인 주차장과 키오스크의 합산 매출액은 연평균 60%대 성장할 것으로 전망되고 있다. 신한금융투자는 이 매출액이 지난해 89억원에서 오는 2019년 369억원 수준으로 늘어날 것으로 추정했다. 일본 무인 주차장의 성공 사례는 이같은 추정의 바탕이 됐다. 현지 최대 주차장 관리업체인 파크24의 주차장 부문 매출액은 지난 2009~2016년 연평균 7.9% 늘었다. 인건비 부담 축소와 용이한 주차장 부지 확보, 안정적인 수익 창출 등은 관련 산업의 성장을 이끌었다. 국내에서도 주차공간 부족 문제가 심화하면서 무인 주차장 시장이 수혜를 볼 것으로 관측된다. 무인 주차장은 소규모 부자와 낮은 관리비용으로 주차 서비스를 제공한다. 국내 가구당 보유 자동차수는 1.5대지만, 호당 주차면수는 0.7대에 그쳤다. 실제 한국전자금융은 200여개의 무인 주차장 운영을 통해 올해 1분기에만 지난해 연간 실적의 절반에 달하는 매출액을 달성했다. 올해 하반기 카카오의 주차 서비스 앱 출시는 ‘모멘텀’이 될 것이라는 전망도 나온다. 조현목 신한금융투자 연구원은 “온ㆍ오프라인 연계(O2O) 서비스 기반의 주차 서비스 확대로 무인 주차장 활용도 빈번해질 것이”이라며 “한국전자금융의 무인 주차장 매출은 올해와 내년 각각 162억원, 208억원을 기록할 것으로 예상된다”고 말했다. 또 다른 신사업인 키오스크 부문도 기대를 모으고 있다. 키오스크는 터치스크린 방식의 정보전달 시스템이다. 최근 패스트푸드 매장이나 극장에서 주문과 발권은 키오스크로 대체되는 추세다. 이에 따라 전 세계 키오스크 시장은 2020년까지 연평균 9.2% 성장할 것으로 예상되고 있다. 글로벌 저성장 기조와 비용 절감, 인구구조 변화에 따라 무인 자동화기기 성장성은 무궁무진하다는 분석도 나온다. 이재환 메리츠종금증권 연구원은 “점포 무인화는 장기적인 추세”라며 “주요 외식업체에 키오스크를 공급하면서 성장을 지속할 것”이라고 내다봤다."
이데일리,063570,/news/news_read.nhn?article_id=0003468955&office_id=018&mode=search&query=한국전자금융&page=1,2016-02-04 09:21,"[특징주]한국전자금융, 신사업 성장 본격화 기대감에 급등","[이데일리 유재희 기자] 한국전자금융이 신규 사업 성장 본격화 기대감에 급등세다. 4일 오전 9시14분 현재 한국전자금융(063570)은 전일대비 8.73%(550원) 상승한 6850원에 거래되고 있다. 정홍식 이베스트투자증권 연구원은 “무인자동화기기·무인주차장 사업은 올해 2~3배 외형성장이 가능할 것”이라며 “전국적인 거점을 기반으로 아이템을 다각화하고 있기 때문에 비용투입 대비 수익성이 좋을 것으로 예상된다”고 평가했다. 그는 또 “자회사 OK POS(포스 생산업체)가 지난 달 신용카드 결제 단말기 생산업체 제이텍씨엔씨을 흡수합병함에 따라 나이스 정보통신, KIS정보통신(VAN사업 영위기업)과의 시너지를 통한 외형확대와 고성장이 전망된다”며 “특히 OK POS가 연결대상회사로 편입되면서 매출성장에 긍정적 요인이 될 것”이라고 덧붙였다."
