source,symbol,link,date,title,content
한국경제TV,063570,/news/news_read.nhn?article_id=0000652557&office_id=215&mode=search&query=한국전자금융&page=1,2018-06-25 12:13,"한국전자금융, 전일 대비 약 5% 상승한 11,250원","[한국경제TV 라이온봇 기자] [그림 1] 최근 3개월 간 주가 추세 및 기간별 수익률 한국전자금융은 6월 25일 12시 12분 전일 대비 약 5% 상승한 11,250원에 거래되고 있다. 한국전자금융은 코스닥 상장 기업으로 통신서비스 업종에 속해 있다. 시가총액은 3,724억원으로 코스닥 상장기업 중 130위에 위치 해 있다. [종목 성향 진단] [그림 2] 종목 성향 진단 한국전자금융의 투자 스타일은 성장주에 가깝다. 주가 고평가 우려가 공존하지만 높은 성장성이 기대되는 기업이다. 주가 모멘텀은 부진한 편이었다. 최근 1개월 수익률은 -7.32%의 하락폭을 기록했다. 한국전자금융 종목에 대한 투자자의 관심도는 평범한 수준이었다. [투자 점수 진단] [그림 3] 투자 점수 진단 한국전자금융은 어느 측면에서 투자 매력도가 높은 종목일까? AI 인공지능 종목 분석 시스템을 이용해 성장성, 수익성, 효율성, 안전성, 저평가성, 추세 등 주가 수익률에 영향을 줄 수 있는 6가지 핵심 투자 지표를 점수화하여 종목의 투자 매력도를 계산해보았다. 그 결과 한국전자금융은 상대적으로 효율성 측면에서 두각을 드러내고 있었다. 효율성 점수는 기업의 자산 활용이 얼마나 효율적으로 이뤄지고 있는가를 나타낸다. 한국전자금융은 특히 재고자산회전율 측면에서 가장 높은 점수는 기록했는데, 전체 시장 내 141위를 기록하며 상위 7.65%에 위치했다. 업종별로는 4위를 기록하며 상위 42.86%에 위치했다. 그러나 기업 가치 대비 주가 수준을 나타내는 저평가 측면에서는 아쉬움을 나타냈다. (위의 AI인공지능 점수는 재무 데이터를 기반으로 전체 상장 종목과 비교/분석하여 도출한 점수로 높은 점수가 반드시 높은 수익률을 보장하지 않습니다. 위의 자료는 당사의 추천 종목이 아니며, 투자 시 참고용으로 제시해드리는 것입니다. 핵심투자지표를 결합해 종목의 투자매력도를 종합 계산한 ""인공지능 투자점수""는 ""거장들의 투자공식"" 앱에서 확인하실 수 있습니다.) 라이온봇 기자 -한국경제TV※ 본 기사는 한국경제TV와 '거장들의 투자공식이'자체 개발한 '라이온봇 기자'가 실시간으로 작성한 기사입니다. 라이온봇기자 ⓒ 한국경제TV, 무단 전재 및 재배포 금지 한국경제TV 관련뉴스해당 언론사에서 선정하며 언론사 페이지(아웃링크)로 이동해 볼 수 있습니다.""치킨보다 많이 팔렸다""…'월드컵 특수' 최대 수혜자는?10명 중 9명은 원인불명...여름철 '맥주·냉방' 조심하세요""달고 기름진 음식 줄이세요""…탈모 키우는 습관열흘새 7조 증발한 현대차…삼성전자는?""침대 보다 집이 더 문제""… 커지는 라돈 공포"
머니투데이,063570,/news/news_read.nhn?article_id=0003964981&office_id=008&mode=search&query=한국전자금융&page=1,2017-11-16 07:54,"한국전자금융, 나이스핀링크 흡수합병 결정",[머니투데이 한은정 기자] 한국전자금융은 인프라 통합 및 규모의 경제 달성 등 경영효율성 증대를 위해 종속회사인 나이스핀링크를 흡수합병 한다고 16일 공시했다. 한국전자금융과 나이스핀링크 합병 비율은 1대4.3153598이며 합병기일은 2내 1월31일이다.
서울경제,063570,/news/news_read.nhn?article_id=0003253376&office_id=011&mode=search&query=한국전자금융&page=1,2018-03-26 12:07,"(코)한국전자금융, 전일 대비 7.26% 상승.. 일일회전율은 2.07% 기록","[서울경제] 한국전자금융(063570) 은 26일 오후 12시 6분 현재 7.26% 오른 13,300원에 거래되고 있으며, 35(매도):65(매수)의 매수우위를 기록하고 있다. 거래대금은 92억3,152만, 거래량은 71만7,269주로 거래량회전율은 2.07%로 나타났다. 지난 1개월간 한국전자금융은 상승 12회, 하락 15회를 기록했고, 주가수익률은 13.68% 표준편차는 2.76%를 기록했다. 이 기간 ' 통신서비스업 ' 업종 평균 주가수익률은 -1.91%로 나타났으며, 변동성은 1.63%를 기록했다. 이 시각 현재 ' 통신서비스업 '은 3.50% 상승 중이며, 66(매도):34(매수)의 매도우위를 기록하고 있다."
서울경제,063570,/news/news_read.nhn?article_id=0003189125&office_id=011&mode=search&query=한국전자금융&page=1,2018-01-04 10:00,"(코)한국전자금융, 전일 대비 7.17% 상승.. 일일회전율은 5.10% 기록","[서울경제] 한국전자금융(063570) 은 4일 오전 9시 59분 현재 7.17% 오른 13,450원에 거래되고 있으며, 32(매도):68(매수)의 매수우위를 기록하고 있다. 거래대금은 173억6,662만, 거래량은 132만7,079주로 거래량회전율은 5.10%로 나타났다. 지난 1개월간 한국전자금융은 상승 13회, 하락 15회를 기록했고, 주가수익률은 28.10% 표준편차는 4.29%를 기록했다. 이 기간 ' 통신서비스업 ' 업종 평균 주가수익률은 3.64%로 나타났으며, 변동성은 1.49%를 기록했다. 이 시각 현재 ' 통신서비스업 '은 1.48% 상승 중이며, 47(매도):53(매수)의 매수우위를 기록하고 있다."
전자신문,063570,/news/news_read.nhn?article_id=0002699584&office_id=030&mode=search&query=한국전자금융&page=1,2018-04-16 14:57,[ET투자뉴스][한국전자금융 지분 변동] 주식회사비지에프네트웍스12.46%p 증가...,"한국전자금융(063570)은 16일 주요주주 주식회사비지에프네트웍스의 보유주식이 증가되었다고 발표했다. 이는 직전 보고일보다 4,315,359주 증가하여 지분율은 12.46%로 상승했다. 이번 보고 사유는 유상신주취득(주식교환방식)으로인한지분증가로  알려졌다.   최대주주와 특수관계자의 지분 변동은 주가에 영향을 주는 요인이다. 특히 보유비율을 지속적으로 늘리거나 줄일 경우, 해당종목 투자시 유의할 필요가 있다.  다음은 한국전자금융의 지분 변동 내역과 보유 내역이다."
뉴시스,063570,/news/news_read.nhn?article_id=0008290155&office_id=003&mode=search&query=한국전자금융&page=1,2017-11-16 08:32,"한국전자금융, 종속회사 나이스핀링크 흡수합병 결정","【서울=뉴시스】김형섭 기자 = 한국전자금융(063570)은 종속회사 나이스핀링크를 흡수합병하기로 결정했다고 16일 공시했다. 합병비율은 한국전자금융 1대 나이스핀링크 4.3153598이다. 합병 후 나이스핀링크는 소멸하며 한국전자금융이 존속회사로 남는다. 합병기일은 내년 1월31알이다. 회사측은 ""합병을 통한 인프라 통합 및 규모의 경제 달성 등 경영효율성 증대가 목적""이라고 전했다."
헤럴드경제,063570,/news/news_read.nhn?article_id=0001436184&office_id=016&mode=search&query=한국전자금융&page=1,2018-09-02 08:02,"한국전자금융ㆍ푸른기술, 최저임금 인상 수혜주로 &lsquo;주목&rsquo;","-주 52시간 근무제로 자영업자ㆍ프랜차이즈 무인기기 수요증가 [헤럴드경제=윤호 기자]최저임금 인상과 주 52시간 근무제 시행으로 편의점주가 신음하고 있는 가운데 키오스크(무인결제시스템) 관련주의 수혜가 전망된다. 2일 관련업계에 따르면 지난 7월 최저임금위원회는 내년도 최저임금을 8350원으로 확정했다. 이는 올해 최저임금인 7530원보다 10.9% 오른 것으로, 2년 연속 두 자릿수 인상률을 기록했다. 이에 따라 BGF리테일과 GS리테일 등 편의점 관련주는 급격히 하락한 반면 한네트, 케이씨티, 케이씨에스, 한국전자금융, 씨아이테크, 푸른기술 등 키오스크 관련주는 윗방향으로 크게 출렁였다. 특히 급등 후 조정을 면치 못했던 다른 종목들과 달리 한국전자금융과 푸른기술은 비교적 꾸준한 우상향 곡선을 그리고 있다. 한국전자금융은 지난 2014년 성장동력 확보를 위해 키오스크와 무인주차장 등 무인화 사업에 진출했다. 이 회사는 본업인 은행 현금자동지급기 운영관리로 확보한 경쟁력을 통해 신규 무인자동화기기 부문에서도 높은 수익을 올릴 수 있다는 평을 받고 있다. 성현동 KB증권 연구원은 “현금자동지급기 사업 인프라를 활용할 수 있어 고정비 부담이 낮은데다, 안정적 재무구조를 바탕으로 한 렌탈모델을 제공해 무인화기기 시장을 선점할 가능성이 높다”면서 “주 52시간 근무제 시행으로 영세 자영업자와 주요 프랜차이즈의 무인 기기 수요도 증가 추세”라고 말했다. 이정기 하나금융투자 연구원도 “현 정권에서 지속적으로 소득주도 성장론 관련 정책들이 시행될 것으로 예상되는 가운데, 영세 사업자들의 인건비 부담이 증가함에 따라 한국전자금융이 진출해 있는 키오스크와 무인주차장 시장은 더욱 빠르게 성장할 것으로 전망된다”고 말했다. 푸른기술은 지폐인식기, 위폐감별계수기 등 금융자동화기기와 승차권발매기, 자동충전기 등 역무자동화기기 특화 기업이다. 최근 스피드게이트(출입통제시스템)를 개발해 인천공항 터미널에 납품했으며 제조현장에서 생산공정 자동화와 작업자 안전을 확보할 수 있는 경량형 7축 협업로봇도 개발해 제조 자동화시장에 도전하고 있다. 서찬희 NICE평가정보 연구원 “푸른기술의 수요처는 대부분 대기업과 공공기관으로, 특성상 판매안정성이 높다”고 말했다."
한국경제TV,063570,/news/news_read.nhn?article_id=0000615245&office_id=215&mode=search&query=한국전자금융&page=1,2018-03-26 11:07,"한국전자금융, 전일 대비 약 5% 상승한 13,050원","[한국경제TV 라이온봇 기자] 한국전자금융은 3월 26일 11시 6분 전일 대비 약 5% 상승한 13,050원에 거래되고 있다. 한국전자금융은 코스닥 상장 기업으로 통신서비스 업종에 속해 있다. 시가총액은 4,278억원으로 코스닥 상장기업 중 112위에 위치 해 있다. [종목 성향 진단] [그림 1] 종목 성향 진단 한국전자금융의 투자 스타일은 모호한 측면이 있으나 성장주라고 볼 수 있다. 주가 고평가 우려가 공존하지만 높은 성장성이 기대되는 기업이다. 주가 모멘텀은 평범한 수준이었다. 최근 1개월 수익률이 6.47%, 3개월 수익률은 6.01%, 6개월 수익률은 8.81%를 기록했다. 한국전자금융 종목에 대한 투자자의 관심도는 높은 편에 속한다. [투자 점수 진단] [그림 2] 투자 점수 진단 한국전자금융은 성장성(매출증가율(YoY)) 측면에서 두각을 나타내고 있다. 최근 매출증가율(YoY)은 88점으로 6개의 핵심 팩터 중 가장 높은 점수를 기록했다. 매출증가율(YoY)은  전체 시장 내 129위를 기록하며 상위 12.11%에 위치했다. 업종별로는 3위를 기록하며 상위 13.33%에 위치했다. 그리고 수익성(영업이익률) 역시 도드라지는 편이다. 수익성 점수는 79점으로 두번째로 높은 점수를 기록했다. 영업이익률은 전체 시장 내 236위를 기록하며 상위 21.27%에 위치했다. 업종별로는 4위를 기록하며 상위 20%에 위치했다. 그러나 PBR과 부채비율은  아쉬움을 나타냈다. [종합 투자점수] [그림 3] 종합 투자점수 AI 인공지능 분석을 통한 한국전자금융의 종목 종합 스코어는 72점을 기록했다. 이는 동일 업종 평균점수인 61점과 시장 평균점수인 55점를 상회하는 수치였다. (위의 AI인공지능 점수는 재무 데이터를 기반으로 전체 상장 종목과 비교/분석하여 도출한 점수로 높은 점수가 반드시 높은 수익률을 보장하지 않습니다. 위의 자료는 당사의 추천 종목이 아니며, 투자 시 참고용으로 제시해드리는 것입니다.) 라이온봇 기자 -한국경제TV※ 본 기사는 한국경제TV와 '거장들의 투자공식이'자체 개발한 '라이온봇 기자'가 실시간으로 작성한 기사입니다. 라이온봇기자 ⓒ 한국경제TV, 무단 전재 및 재배포 금지 한국경제TV 관련뉴스해당 언론사에서 선정하며 언론사 페이지(아웃링크)로 이동해 볼 수 있습니다.노현정, 故 정주영 회장 제사 현장 포착…'더 예뻐졌네'골프여왕 박인비, 외모 때문에 메인스폰서 없었던 사연은?박명수 일침, ""국밥 먹는 정치인 속지말자"" 소신발언설현, 원주민도 반한 사연…만국 공통 몸매?'재벌 3세' 정용진·정지선은 SNS를 어떻게 이용할까?"
서울경제,063570,/news/news_read.nhn?article_id=0003357052&office_id=011&mode=search&query=한국전자금융&page=1,2018-07-25 13:20,"&lt;코&gt;한국전자금융, 전일 대비 7.23% 상승.. 일일회전율은 1.47% 기록","[서울경제] 한국전자금융(063570) 은 25일 오후 1시 19분 현재 7.23% 오른 12,600원에 거래되고 있으며, 31(매도):69(매수)의 매수우위를 기록하고 있다. 거래대금은 61억7,869만, 거래량은 51만202주로 거래량회전율은 1.47%로 나타났다. 지난 1개월간 한국전자금융은 상승 13회, 하락 16회를 기록했고, 주가수익률은 10.53% 표준편차는 3.19%를 기록했다. 이 기간 ' 통신서비스업 ' 업종 평균 주가수익률은 -11.19%로 나타났으며, 변동성은 1.89%를 기록했다. 이 시각 현재 ' 통신서비스업 '은 0.70% 상승 중이며, 26(매도):74(매수)의 매수우위를 기록하고 있다."
한국경제TV,063570,/news/news_read.nhn?article_id=0000657413&office_id=215&mode=search&query=한국전자금융&page=1,2018-07-05 13:12,"한국전자금융, 전일 대비 약 -6% 하락한 11,850원","[한국경제TV 라이온봇 기자] [그림 1] 최근 3개월 간 주가 추세 및 기간별 수익률 한국전자금융은 7월 5일 13시 11분 전일 대비 약 -6% 하락한 11,850원에 거래되고 있다. 한국전자금융은 코스닥 상장 기업으로 통신서비스 업종에 속해 있다. 시가총액은 4,348억원으로 코스닥 상장기업 중 103위에 위치 해 있다. [종목 성향 진단] [그림 2] 종목 성향 진단 한국전자금융의 투자 스타일은 성장주에 가깝다. 주가 고평가 우려가 공존하지만 높은 성장성이 기대되는 기업이다. 주가 모멘텀은 평범한 수준이었다. 최근 1개월 수익률이 1.32%, 3개월 수익률은 -16.61%, 6개월 수익률은 -10.81%를 기록했다. 한국전자금융 종목에 대한 투자자의 관심도는 굉장히 높은 편이다. [투자 점수 진단] [그림 3] 투자 점수 진단 한국전자금융은 어느 측면에서 투자 매력도가 높은 종목일까? AI 인공지능 종목 분석 시스템을 이용해 성장성, 수익성, 효율성, 안전성, 저평가성, 추세 등 주가 수익률에 영향을 줄 수 있는 6가지 핵심 투자 지표를 점수화하여 종목의 투자 매력도를 계산해보았다. 그 결과 한국전자금융은 상대적으로 효율성 측면에서 두각을 드러내고 있었다. 효율성 점수는 기업의 자산 활용이 얼마나 효율적으로 이뤄지고 있는가를 나타낸다. 한국전자금융은 특히 재고자산회전율 측면에서 가장 높은 점수는 기록했는데, 전체 시장 내 141위를 기록하며 상위 7.64%에 위치했다. 업종별로는 4위를 기록하며 상위 42.86%에 위치했다. 그러나 기업 가치 대비 주가 수준을 나타내는 저평가 측면에서는 아쉬움을 나타냈다. (위의 AI인공지능 점수는 재무 데이터를 기반으로 전체 상장 종목과 비교/분석하여 도출한 점수로 높은 점수가 반드시 높은 수익률을 보장하지 않습니다. 위의 자료는 당사의 추천 종목이 아니며, 투자 시 참고용으로 제시해드리는 것입니다. 핵심투자지표를 결합해 종목의 투자매력도를 종합 계산한 ""인공지능 투자점수""는 ""거장들의 투자공식"" 앱에서 확인하실 수 있습니다.) 라이온봇 기자 -한국경제TV※ 본 기사는 한국경제TV와 '거장들의 투자공식이'자체 개발한 '라이온봇 기자'가 실시간으로 작성한 기사입니다. 라이온봇기자 ⓒ 한국경제TV, 무단 전재 및 재배포 금지 한국경제TV 관련뉴스해당 언론사에서 선정하며 언론사 페이지(아웃링크)로 이동해 볼 수 있습니다.[단독] 모바일 간편결제도 뚫렸다…SSG페이 등 6곳 '부정 결제'1분기 수익률 -0.2%…내 국민연금에 무슨 일이이혜영, 남편부터 워너원까지 '솔직+당당' 매력 발산1988년 김성령 vs 2018년 김수민...20년차 미스코리아 진'4천억 밥 전쟁'...햇반에 도전장 낸 이마트"
이데일리,063570,/news/news_read.nhn?article_id=0003971531&office_id=018&mode=search&query=한국전자금융&page=1,2017-11-16 08:48,"한국전자금융, 나이스핀링크 흡수합병 결정",[이데일리 윤필호 기자] 한국전자금융(063570)은 종속회사인 나이스핀링크를 흡수합병하기로 했다고 16일 공시했다. 합병비율은 한국전자금융 1.0000000 대 나이스핀링크 4.3153598이다. 회사 측은 “합병은 인프라를 통합하고 규모의 경제를 이루는 등 경영 효율성을 높이기 위한 것”이라고 설명했다. 합병기일은 내년 1월 31일이다.
전자신문,063570,/news/news_read.nhn?article_id=0002658386&office_id=030&mode=search&query=한국전자금융&page=1,2017-11-16 11:00,"[ET투자뉴스]한국전자금융, &quot;3Q17 Sales&hellip;&quot; 매수(유지)-이베스트투자증권","이베스트투자증권에서 16일 한국전자금융(063570)에 대해 ""3Q17 Sales +9.8% YoY, OP +6.1% YoY""라며 투자의견을 '매수(유지)'로 제시하였고, 아울러 목표주가로는 15,000원을 내놓았다. 이베스트투자증권 정홍식 애널리스트가 동종목에 대하여 이번에 제시한 '매수(유지)'의견은 이베스트투자증권의 직전 매매의견과 동일한 것이고 올해 초반의 매매의견을 기준으로  볼때도 역시 '매수'의견이 계속 유지되고 있는 상태이다. 그리고 최근 분기내 발표된 전체 증권사 리포트의 컨센서스와 비교를 해볼 경우에 오늘 발표된 투자의견은 전체의견에 수렴하고 있어, 이번 의견은 시장의 평균적인 기대감이 객관적으로 표현된 것으로 분석되고 있다. 목표주가의 추이를 살펴보면 과거 상향조정되어오던 패턴이 최근 두차례 연속 같은 수준에 머물고 있는 모습이다. 또한 전일 종가 기준으로 볼때 동종목의 현주가는 이번에 제시된 목표가 대비 48.5%의 저평가 요인이 존재한다는 해석이 제시되고 있다."
전자신문,063570,/news/news_read.nhn?article_id=0002736445&office_id=030&mode=search&query=한국전자금융&page=1,2018-08-28 09:04,"[ET투자뉴스]한국전자금융, &quot;계획대로 진행 중!&hellip;&quot; BUY(MAINTAIN)-이...","이베스트투자증권에서 28일 한국전자금융(063570)에 대해 ""계획대로 진행 중!""라며 투자의견을 'BUY(MAINTAIN)'로 제시하였고, 아울러 목표주가로는 18,000원을 내놓았다. 이베스트투자증권 정홍식 애널리스트가 동종목에 대하여 이번에 제시한 'BUY(MAINTAIN)'의견은 이베스트투자증권의 직전 매매의견을 그대로 유지하는 것이고 올해 초반의 시장컨센서스와 비교해 볼때도 역시 '매수'의견이 계속 유지되고 있는 상태이다. 그리고 최근 분기내 발표된 전체 증권사 리포트의 컨센서스와 비교를 해볼 경우에 오늘 발표된 투자의견은 대체적으로 평균치에 해당하는 수준으로, 이번 의견은 동종목에 대한 전체적인 흐름에서 크게 벗어나지 않은 것으로 분석되고 있다. 목표주가의 추이를 살펴보면 최근 장기간 목표가가 같은 수준에 머물고 있는 모습이다. 또한 전일 종가 기준으로 볼때 동종목의 현주가는 이번에 제시된 목표가 대비 40.6%의 추가상승여력이 있다는 해석이 제시되고 있다."
헤럴드경제,063570,/news/news_read.nhn?article_id=0001433702&office_id=016&mode=search&query=한국전자금융&page=1,2018-08-27 09:29,"한국전자금융ㆍ푸른기술, 최저임금 인상 수혜로 &lsquo;승승장구&rsquo;","-지난달 이후 급등…‘꾸준한’ 우상향-주 52시간 근무제로 자영업자ㆍ프랜차이즈 무인기기 수요증가 [헤럴드경제=윤호 기자]최저임금 인상과 주 52시간 근무제 시행으로 편의점주가 신음하고 있는 가운데 키오스크(무인결제시스템) 관련주의 수혜가 예상된다. 27일 한국거래소에 따르면 한국전자금융과 푸른기술 주가는 지난달 이후 각각 12%, 125% 상승했다. 지난달 최저임금위원회는 내년도 최저임금을 8350원으로 확정한 바 있다. 이는 올해 최저임금인 7530원보다 10.9% 오른 것으로, 2년 연속 두 자릿수 인상률을 기록했다. 이에 따라 BGF리테일과 GS리테일 등 편의점 관련주는 급격히 하락한 반면 한네트, 케이씨티, 케이씨에스, 한국전자금융, 씨아이테크, 푸른기술 등 키오스크 관련주는 크게 출렁였다. 특히 급등 후 조정을 면치 못했던 다른 종목들과 달리 한국전자금융과 푸른기술은 꾸준한 우상향 곡선을 그리고 있다. 한국전자금융은 지난 2014년 성장동력 확보를 위해 키오스크와 무인주차장 등 무인화 사업에 진출했다. 이 회사는 본업인 은행 현금자동지급기 운영관리로 확보한 경쟁력을 통해 신규 무인자동화기기 부문에서도 높은 수익을 올릴 수 있다는 평을 받고 있다. 성현동 KB증권 연구원은 “현금자동지급기 사업 인프라를 활용할 수 있어 고정비 부담이 낮은데다, 안정적 재무구조를 바탕으로 한 렌탈모델을 제공해 무인화기기 시장을 선점할 가능성이 높다”면서 “주 52시간 근무제 시행으로 영세 자영업자와 주요 프랜차이즈의 무인 기기 수요도 증가 추세”라고 말했다. 이정기 하나금융투자 연구원도 “현 정권에서 지속적으로 소득주도 성장론 관련 정책들이 시행될 것으로 예상되는 가운데, 영세 사업자들의 인건비 부담이 증가함에 따라 한국전자금융이 진출해 있는 키오스크와 무인주차장 시장은 더욱 빠르게 성장할 것으로 전망된다”고 말했다. 푸른기술은 지폐인식기, 위폐감별계수기 등 금융자동화기기와 승차권발매기, 자동충전기 등 역무자동화기기 특화 기업이다. 최근 스피드게이트(출입통제시스템)를 개발해 인천공항 터미널에 납품했으며 제조현장에서 생산공정 자동화와 작업자 안전을 확보할 수 있는 경량형 7축 협업로봇도 개발해 제조 자동화시장에 도전하고 있다. 서찬희 NICE평가정보 연구원 “푸른기술의 수요처는 대부분 대기업과 공공기관으로, 특성상 판매안정성이 높다”고 말했다."
