source,symbol,link,date,title,content
이데일리,063570,/news/news_read.nhn?article_id=0004147982&office_id=018&mode=search&query=한국전자금융&page=1,2018-07-12 10:58,"[특징주]한국전자금융, 무인화 사업 부각에 '강세'","[이데일리 박태진 기자] 한국전자금융(063570)이 근로환경 변화에 따른 무인주차장, 키오스크(무인 종합정보안내시스템) 등 무인화 사업 부각으로 상승세를 보이고 있다. 12일 오전 10시 30분 현재 한국전자금융 주가는 전일대비 6.75% 오른 1만2650원을 기록 중이다. 최근 최저임금 상승에 따른 인건비 절감 차원에서 무인 사업장이 주목받는데 따른 영향이라는 분석이 나온다. 이경수 하나금융투자 연구위원은 “한국전자금융의 경우 기존 3개월 평균 대비 거래대금이 1.85% 증가했다”면서 “한국전자금융은 안정적인 실적 시현이 가능한 ATM(현금자동입출금기)관리사업,  CD VAN(금융 거래 위한 부가가치 통신망) 사업을 영위해 투자심리가 개선되고 있다”고 말했다."
한국경제TV,063570,/news/news_read.nhn?article_id=0000622016&office_id=215&mode=search&query=한국전자금융&page=1,2018-04-13 11:10,"한국전자금융, 전일 대비 약 5% 상승한 15,350원","[한국경제TV 라이온봇 기자] 한국전자금융은 4월 13일 11시 9분 전일 대비 약 5% 상승한 15,350원에 거래되고 있다. 한국전자금융은 코스닥 상장 기업으로 통신서비스 업종에 속해 있다. 시가총액은 5,075억원으로 코스닥 상장기업 중 103위에 위치 해 있다. [종목 성향 진단] [그림 1] 종목 성향 진단 한국전자금융의 투자 스타일은 모호한 측면이 있으나 가치주라고 볼 수 있다. 기업 가치 대비 낮은 주가가 매력적인 기업이다. 주가 모멘텀은 좋은 편에 속했다. 최근 6개월 수익률은 45.05%의 상승폭을 기록했다. 최근 1개월 수익률 또한 17.67% 상승하며 좋은 모멘텀을 보이고 있다. 한국전자금융 종목에 대한 투자자의 관심도는 높은 편에 속한다. [투자 점수 진단] [그림 2] 투자 점수 진단 한국전자금융은 성장성(매출증가율(YoY)) 측면에서 두각을 나타내고 있다. 최근 매출증가율(YoY)은 85점으로 6개의 핵심 팩터 중 가장 높은 점수를 기록했다. 매출증가율(YoY)은  전체 시장 내 282위를 기록하며 상위 15.5%에 위치했다. 업종별로는 16위를 기록하며 상위 20.55%에 위치했다. 그리고 수익성(영업이익률) 역시 도드라지는 편이다. 수익성 점수는 79점으로 두번째로 높은 점수를 기록했다. 영업이익률은 전체 시장 내 411위를 기록하며 상위 21%에 위치했다. 업종별로는 17위를 기록하며 상위 21.05%에 위치했다. 그러나 부채비율과 PBR은  아쉬움을 나타냈다. [종합 투자점수] [그림 3] 종합 투자점수 AI 인공지능 분석을 통한 한국전자금융의 종목 종합 스코어는 76점을 기록했다. 이는 동일 업종 평균점수인 64점과 시장 평균점수인 56점를 상회하는 수치였다. (위의 AI인공지능 점수는 재무 데이터를 기반으로 전체 상장 종목과 비교/분석하여 도출한 점수로 높은 점수가 반드시 높은 수익률을 보장하지 않습니다. 위의 자료는 당사의 추천 종목이 아니며, 투자 시 참고용으로 제시해드리는 것입니다.) 라이온봇 기자 -한국경제TV※ 본 기사는 한국경제TV와 '거장들의 투자공식이'자체 개발한 '라이온봇 기자'가 실시간으로 작성한 기사입니다. 라이온봇기자 ⓒ 한국경제TV, 무단 전재 및 재배포 금지 한국경제TV 관련뉴스해당 언론사에서 선정하며 언론사 페이지(아웃링크)로 이동해 볼 수 있습니다.'억대 수입' 이사배, 과거 공개한 '럭셔리' 하우스 봤더니""자연미인"" 셋째 출산에도 여전히 아름다운 '리설주'쏘가리 가격 '확' 떨어진다…22년 연구 끝에 '대량양식' 성공스타일난다, 4천억 '신화'…김소희 대표 누구?고 장자연-단역 자매 사건 재수사…""내가 노리개인가"""
매경이코노미,063570,/news/news_read.nhn?article_id=0000060148&office_id=024&mode=search&query=한국전자금융&page=1,2018-08-13 14:35,[화제의 보고서] 한국전자금융 | 근로시간 단축&middot;최저임금 인상에 신사업 성장,"법정 최장 근로시간이 주당 68시간에서 52시간으로 줄어들고 최저임금이 가파르게 오르자 무인 시스템을 도입하는 기업이 증가하고 있다. 이에 자동화 기계 시장이 성장하고 관련 기업도 수혜를 볼 전망이다. 한국전자금융도 수혜가 예상되는 기업 중 하나다. 한국전자금융은 지난 2014년 성장동력을 확보하기 위해 무인화 사업에 발을 들였다. 이후 키오스크와 무인 주차장용 기기 부문에서 두각을 나타내고 있다. 이정기 하나금융투자 애널리스트는 “한국전자금융의 무인화 사업 매출은 2014년 20억원에서 지난해 241억원으로 늘었다. 연평균 약 130% 증가했다는 뜻이다. 근로시간 단축, 인건비 부담 가중 등으로 인해 자동화 기기 수요가 빠르게 증가하는 만큼 향후 전망도 긍정적이다. 올해에는 무인화 사업 매출이 375억원을 기록할 것으로 추산한다”고 분석했다. CD VAN(현금자동화기기 부가가치통신망), ATM 관리 등 기존 사업도 연 2%가량의 안정적인 성장률을 보이며 캐시카우(현금 창출원) 역할을 충실히 해내고 있다. 지난해 인수한 CD VAN 기업 나이스핀링크와의 시너지 효과도 올해부터 본격적으로 나타날 것으로 기대된다. 이 애널리스트는 “합병으로 인해 올해에는 10억원 안팎, 2019년에는 20억원가량의 비용 절감 효과가 예상된다”고 말했다."
서울경제,063570,/news/news_read.nhn?article_id=0003207694&office_id=011&mode=search&query=한국전자금융&page=1,2018-01-26 10:04,"(코)한국전자금융, 전일 대비 7.01% 상승.. 일일회전율은 4.60% 기록","[서울경제] 한국전자금융(063570) 은 26일 오전 10시 2분 현재 7.01% 오른 14,500원에 거래되고 있으며, 38(매도):62(매수)의 매수우위를 기록하고 있다. 거래대금은 170억4,709만, 거래량은 119만5,640주로 거래량회전율은 4.60%로 나타났다. 지난 1개월간 한국전자금융은 상승 15회, 하락 12회를 기록했고, 주가수익률은 40.78% 표준편차는 4.71%를 기록했다. 이 기간 ' 통신서비스업 ' 업종 평균 주가수익률은 18.30%로 나타났으며, 변동성은 1.68%를 기록했다. 이 시각 현재 ' 통신서비스업 '은 1.31% 상승 중이며, 55(매도):45(매수)의 매도우위를 기록하고 있다."
머니투데이,063570,/news/news_read.nhn?article_id=0003545548&office_id=008&mode=search&query=한국전자금융&page=1,2015-09-17 17:29,"[조회공시]한국전자금융, 최근 주가급등 관련",[머니투데이 안재용 기자] 한국거래소는 17일 한국전자금융에 최근의 현저한 시황변동(주가급등) 관련 조회공시를 요구했다. 답변시한은 18일 오후 6시까지다. textlinktopstart textlinktopend textlinkstart
한국경제TV,063570,/news/news_read.nhn?article_id=0000595492&office_id=215&mode=search&query=한국전자금융&page=1,2018-01-26 10:13,"한국전자금융, 전일 대비 약 6% 상승한 14,350원","[한국경제TV 라이온봇 기자] 한국전자금융은 1월 26일 10시 12분 전일 대비 약 6% 상승한 14,350원에 거래되고 있다. 한국전자금융은 코스닥 상장 기업으로 통신서비스 업종에 속해 있다. 시가총액은 3,499억원으로 코스닥 상장기업 중 169위에 위치 해 있다. [종목 성향 진단] [그림 1] 종목 성향 진단 한국전자금융의 투자 스타일은 모호한 측면이 있으나 성장주라고 볼 수 있다. 주가 고평가 우려가 공존하지만 높은 성장성이 기대되는 기업이다. 주가 모멘텀은 좋은 편에 속했다. 최근 3개월 수익률은 29.95%의 상승폭을 기록했다. 최근 1개월 수익률 또한 25.7% 상승하며 좋은 모멘텀을 보이고 있다. 한국전자금융종목에 대한 투자자의 관심도는 높은 편에 속한다. [투자 점수 진단] [그림 2] 투자 점수 진단 한국전자금융은 수익성(영업이익률) 측면에서 두각을 나타내고 있다. 최근 영업이익률은 70점으로 6개의 핵심 팩터 중 가장 높은 점수를 기록했다. 영업이익률은  전체 시장 내 583위를 기록하며 상위 29.83%에 위치했다. 업종별로는 41위를 기록하며 상위 53.33%에 위치했다. 그리고 효율성(ROA) 역시 도드라지는 편이다. 효율성 점수는 60점으로 두번째로 높은 점수를 기록했다. ROA은 전체 시장 내 765위를 기록하며 상위 39.77%에 위치했다. 업종별로는 12위를 기록하며 상위 14.67%에 위치했다. 부채비율과 PBR은 아쉬움을 나타냈다. [종합 투자점수] [그림 3] 종합 투자점수 AI 인공지능 분석을 통한 한국전자금융의 종목 종합 스코어는 62점을 기록했다. 이는 동일 업종 평균점수인 61점과 시장 평균점수인 57점를 상회하는 수치였다. (위의 AI인공지능 점수는 재무 데이터를 기반으로 전체 상장 종목과 비교/분석하여 도출한 점수로 높은 점수가 반드시 높은 수익률을 보장하지 않습니다.) 라이온봇 기자 -한국경제TV※ 본 기사는 한국경제TV와 '거장들의 투자공식이'자체 개발한 '라이온봇 기자'가 실시간으로 작성한 기사입니다. 라이온봇기자 ⓒ 한국경제TV, 무단 전재 및 재배포 금지 한국경제TV 관련뉴스해당 언론사에서 선정하며 언론사 페이지(아웃링크)로 이동해 볼 수 있습니다.강문영, 김도균과 제2의 커플되나? '관심집중'임현식 한옥 대저택…'한옥마을 집인 줄'한비야 결혼, ""아이 안 낳는다고 비난 받았다""?'김우빈 결별설 왜 나오나'…신민아 카리스마 넘치는 근황김준호, 김지민에 ""비혼으로 사는 게 좋아"" 과거 발언 봤더니"
서울경제,063570,/news/news_read.nhn?article_id=0003346456&office_id=011&mode=search&query=한국전자금융&page=1,2018-07-12 10:17,"&lt;코&gt;한국전자금융, 전일 대비 7.59% 상승.. 일일회전율은 1.42% 기록","[서울경제] 한국전자금융(063570) 은 12일 오전 10시 16분 현재 7.59% 오른 12,750원에 거래되고 있으며, 31(매도):69(매수)의 매수우위를 기록하고 있다. 거래대금은 61억2,010만, 거래량은 49만924주로 거래량회전율은 1.42%로 나타났다. 지난 1개월간 한국전자금융은 상승 13회, 하락 14회를 기록했고, 주가수익률은 19.72% 표준편차는 2.92%를 기록했다. 이 기간 ' 통신서비스업 ' 업종 평균 주가수익률은 -10.06%로 나타났으며, 변동성은 1.76%를 기록했다. 이 시각 현재 ' 통신서비스업 '은 1.92% 상승 중이며, 36(매도):64(매수)의 매수우위를 기록하고 있다."
머니투데이,063570,/news/news_read.nhn?article_id=0004090327&office_id=008&mode=search&query=한국전자금융&page=1,2018-08-10 17:17,"GCMC&middot;체인리펀드&middot;한국전자금융, 세금 환급 키오스크로 글로벌 진출 계획","[머니투데이 중기협력팀 오지훈 기자] (주)GCMC(대표 한석경, 이하 지씨엠씨)가 택스리펀스(Tax Refund, 세금 환급) 사업에 가속도를 내기 위해 (주)체인리펀드, 한국전자금융(주)과 함께 3사 간 업무 제휴 MOU를 체결했다고 10일 밝혔다. 이번 MOU의 골자는 △택스리펀드 키오스크(KIOSK) 시스템 구성 및 설계 △택스리펀드 키오스크 개발 및 공급 △해외 진출 시 지씨엠씨, 체인리펀드, 한국전자금융 3사 간 업무 협력 등이다. 이를 통해 택스리펀드 서비스가 가능한 키오스크를 개발하고 국내 및 해외 공항에 보급, 상용화한다는 데 목적을 두고 있다. 지씨엠씨는 글로벌 여행자를 위한 편의 서비스인 DCC(Dynamic Currency Conversion, 자국통화결제) 서비스를 제공하는 기업으로, 최근 신사업 추진의 일환으로 외국인 여행객에게 편의를 더하는 '택스리펀드' 사업을 진행하고 있다. 이번 MOU를 주도한 지씨엠씨는 공항에서 택스리펀드를 손쉽게 받을 수 있도록 하는 택스리펀드 키오스크를 설계하고 개발 및 보급하는 데 힘쓸 계획이다. 택스리펀드 애플리케이션을 개발 중인 체인리펀드와 키오스크 개발 기술을 가진 한국전자금융 등이 상호 협력하기로 했다. 한국전자금융은 2017년 기준 한 해 키오스크 출하량이 1580대에 달하는 업체다. 2013년 인천국제공항을 시작으로 현재까지 국내에 세금 환급 키오스크 200여대를 보급했다. 이번 MOU를 통해 △현지 보안 인증 △물류 비용 절감 △키오스크 시스템 유지 보수 △현지 서버 연결 등의 이슈를 해결, 글로벌 사업 영역으로 확장할 계획이다. 한편 지씨엠씨는 최근 EBC Foundation(이비씨 파운데이션)과 어니언텍, 체인리펀드와 파트너십을 맺고 블록체인 기반 글로벌 택스리펀드 사업을 추진 중이다. 키오스크 예시 화면/사진제공=지씨엠씨"
머니S,063570,/news/news_read.nhn?article_id=0000306954&office_id=417&mode=search&query=한국전자금융&page=1,2018-04-03 08:45,"[STOCK] &quot;한국전자금융, 코스닥150지수 편입 호재&hellip; 목표가&uarr;&quot;","KB증권은 3일 한국전자금융에 대해 ""우호적인 영업환경과 코스닥150지수 편입이 호재""라며 목표주가를 기존 1만4000원에서 1만6500원으로 상향했다. 투자의견 '매수'도 유지했다. 성현동 KB증권 애널리스트는 ""기존 투자포인트였던 최저임금의 가파른 인상에 따른 KIOSK 및 무인주차장 사업의 고성장이 지속될 전망이 유효하다""며 ""기존 사업의 유지보수 인프라 및 현금 수송에 따르는 고정비를 분담할 수 있는 복권수탁사업 등의 신사업 발굴이 활발하게 이루어지고 있다. 신규 사업에 따르는 매출액 증가세 대비 고정비 증가폭은 완만할 것""이라고 전망했다. 성 애널리스트는 ""이는 중장기적인 ROE 개선으로 이어질 가능성이 높을 것""이라며 ""코스닥150지수 편입에 따른 수급 개선효과 또한 기대된다""고 분석했다. 그는 ""다만 실제 (코스닥150지수)편입 시점은 상황에 따라 유동적이다. 한국전자금융의 지수 편입은 에프티이앤이의 관리종목 지정으로 인해 발생했는데, 거래정지 해제 후 2매매일이 경과하는 시점에 이루어지기 때문""이라며 ""만약 거래정지 지속이 계속된다고 해도 ‘15매매거래일 한도’라는 조건이 있기 때문에 최소한 4월 16일에는 편입될 것""이라고 예상했다. 박기영 기자"
아시아경제,063570,/news/news_read.nhn?article_id=0004119544&office_id=277&mode=search&query=한국전자금융&page=1,2017-11-15 19:11,"한국전자금융, 나이스핀링크 흡수 합병","한국전자금융은 나이스핀링크를 흡수합병한다고 15일 공시했다. 존속회사는 한국전자금융이며 소멸법인은 나이스핀링크다. 회사 측은 ""합병을 통한 구축 인프라의 통합활용으로 비용절감 등 조직 운영 효율성 및 사업 경쟁력을 강화하고, 유통채널에 대한 영향력 강화로 신규 사업 진출 교두보를 확보하여 신성장동력을 얻고자 한다""고 설명했다."
한국경제,063570,/news/news_read.nhn?article_id=0003432667&office_id=015&mode=search&query=한국전자금융&page=1,2015-09-17 09:31,"[특징주]한국전자금융, 장중 1만원 돌파 '역대 최고가'","[ 정현영 기자  ] 한국전자금융의 주가가 상장 이래 최초로 장중 1만원을 돌파했다. 시장에서 '삼성페이 관련주(株)'로 거론되면서 매수세가 집중되고 있는 모습이다. 한국전자금융은 17일 오전 9시23분 현재 전날보다 24.08% 오른 1만100원에 거래되고 있다. 이 회사 주가는 전날에도 12% 가까운 주가상승률을 기록하는 등 나흘 연속 몸값이 뛰어오르고 있다. 올해 들어 주가상승률은 약 250%에 이른다. 연초에 주당 2800원대에서 거래되던 것이 9개월여 만에 1만원대를 오가고 있다. 수급상황도 긍정적이다. 기관과 외국인이 함께 주식을 사는 '쌍끌이 매수'에 나서고 있어서다. 이들은 지난 14일부터 전날까지 3거래일 연속 한국전자금융의 주식을 집중 순매수하고 있다. 한국전자금융의 주요사업은 금융기관의 CD·ATM 관리를 아웃소싱하는 ATM관리사업을 비롯해 고객들에게 금융 서비스 등을 제공하는 CD VAN사업, 현금처리와 관련된 제반 업무를 대행해주는 현금물류사업 등이다. 정현영 한경닷컴 기자"
한국경제TV,063570,/news/news_read.nhn?article_id=0000594203&office_id=215&mode=search&query=한국전자금융&page=1,2018-01-22 16:42,[국고처 박문환] 종목상담 - 한국전자금융(063570),[한국경제TV 류장현 PD] [국고처 박문환] 종목상담 - 한국전자금융(063570) 1월 20일 방송된 `국민주식고충처리반`에 출연한 박문환파트너가 한국전자금융(063570)에 대한 시세와 전망을 이야기하고 있다.
연합뉴스,063570,/news/news_read.nhn?article_id=0007863373&office_id=001&mode=search&query=한국전자금융&page=1,2015-09-17 17:27,"거래소, 한국전자금융에 주가급등 조회공시 요구",(서울=연합뉴스) 장하나 기자 = 한국거래소 코스닥시장본부는 17일 한국전자금융에 최근의 현저한 주가 급등에 대한 조회공시를 요구했다. 답변 시한은 오는 18일 오후 6시까지다.
파이낸셜뉴스,063570,/news/news_read.nhn?article_id=0003941326&office_id=014&mode=search&query=한국전자금융&page=1,2018-01-11 09:13,"[fnRASSI]한국전자금융, 52주 신고가...7.98% &uarr;","한국전자금융(063570)은 52주신고가를 기록하고 있어 주목할만하다. 동종목의 현재 주가는 14,200원 선에서 이루어지고 있다. 거래일을 기준으로 최근 3일간 평균 거래량은 105만 주이다. 이는 60일 일 평균 거래량 87만 주와 비교해보면 최근 거래량이 다소 증가했다는 것을 알 수 있다. 외국인/기관 순매수, 개인은 순매도(한달누적)  전일 기관이 25,934주를 순매수했고, 외국인은 5,670주를 순매도했다. 4주간을 기준으로 보면 외국인이 매수 우위를 유지하면서 469,812주를 순매수했고, 기관도 방향성있는 매매를 하면서 291,116주를 순매수했다. 반면 개인들은 초반에 동종목을 순매도한 이후에 근래에는 순매도량을 줄이면서 760,928주를 순매도한 것으로 나타났다. 주요 투자주체는 개인투자자 최근 한달간 주체별 거래비중을 살펴보면 개인이 90.68%로 가장 높은 참여율을 보였고, 외국인이 5.42%를 보였으며 기관은 3.88%를 나타냈다. 그리고 최근 5일간 거래비중은 개인 비중이 94.49%로 가장 높았고, 외국인이 3.74%로 그 뒤를 이었다. 기관은 1.75%를 나타냈다. 'fnRASSI'는 증권전문 기업 씽크풀과 파이낸셜뉴스의 협업으로 로봇기자가 실시간으로 생산하는 기사입니다."
서울경제,063570,/news/news_read.nhn?article_id=0003194658&office_id=011&mode=search&query=한국전자금융&page=1,2018-01-11 09:12,"(코)한국전자금융, 장중 신고가 돌파.. 14,200&rarr;14,300(▲100)","[서울경제] 오전 9시 10분 현재 한국전자금융(063570) 이 8.75% 오른 14,300원(▲1,150)을 기록하며, 52주 신고가를 +100원 경신했다. 기존 52주 최고가는 2018년 01월 04일 기록한 14,200원이다. 체결강도는 254%로 강세를 유지했다. 총매수체결량은 501,540주, 총매도체결량은 197,830주를 각각 기록했다.  (※ 체결강도(%) = (총매수체결량/총매도체결량)*100) 이 시각 현재 거래대금은 101억7,775만, 거래량은 73만4,318주를 기록하고 있으며, 수급측면으로는 28(매도):72(매수)의 매수우위를 보이고 있다. 거래일을 기준으로 최근 3일간 평균 거래량은 7십7만7천주, 60일 평균 거래량 8십6만2천주로 비슷한 수준의 거래량을 유지하고 있다."
아시아경제,063570,/news/news_read.nhn?article_id=0004289281&office_id=277&mode=search&query=한국전자금융&page=1,2018-08-03 07:43,"[클릭 e종목]&ldquo;한국전자금융, 영업 환경 개선 지속&rdquo;","[아시아경제 구은모 기자] KB증권이 한국전자금융에 대해 최저임금 인상과 주52시간 근무제 도입 등으로 영업환경이 개선되고 있다며 올해를 그동안 기대감에 머물렀던 사업들이 본격화되는 구간으로 판단했다. 성현동 KB증권 연구원은 3일 보고서에서 내년 최저임금이 올해(7530원)보다 10.9% 인상된 8350원으로 결정되고 주52시간 근무제가 시행되면서 영세 자영업자와 중소 규모 프랜차이즈를 중심으로 무인결제기(키오스크·Kiosk) 도입이 본격화될 것으로 전망했다. 성 연구원은 “한국전자금융은 기존 사업인 무인현금지급기 운영 인프라를 활용할 수 있어 경쟁사보다 비용 측면에서 강점을 확보하고 있고 있으며, 대여 모델을 도입해 영세 자영업자의 부담이 적어 초기 시장을 선점할 수 있을 것”으로 진단했다. 또한 무인주차장도 전반적인 인건비 부담 증가로 고성장세가 이어질 것으로 내다봤다. 올해 2분기 매출액과 영업이익은 각각 전년 동기보다 30.1%, 46.9% 증가한 759억원, 80억원을 기록할 것으로 추정했다. 성 연구원은 키오스크와 무인주차장 등의 성장세와 더불어 NICE핀링크 인수효과가 본격적으로 나타날 것으로 예상했다. 그는 “NICE핀링크 인수로 외형은 성장하고, 중복 인프라와 외주 비용 효율화 등이 진행되면서 수익성도 개선될 것”이라고 전망했다. 연간 실적은 매출액 2994억원, 영업이익 309억원을 기록할 것으로 전망했다. 이는 전년 동기 대비 각각 24.2%, 46.8% 증가한 수치다. 투자의견과 목표주가는 각각 ‘매수’와 1만6500원을 유지했다. 성 연구원은 “현금자동입출금기(ATM)와 현금자동화기기 부가가치통신망(CD VAN) 시장의 1위 사업자로서 규모의 경제를 확보하고 있는 가운데, 키오스크·무인주차장·복권수탁사업 등 기존 사업의 인프라를 활용해 고정비를 분산할 수 있으면서 경쟁 우위를 확보할 수 있는 분야로 사업 영역을 확장하고 있다”고 설명했다. 그러면서 “올해는 그간 기대감에 머물렀던 사업들이 본격화되는 구간으로 성장주로의 리레이팅이 가능한 시기”라고 평가했다 다만 “NICE핀링크 인수를 위해 발행한 합병신주 863만주의 보호예수해제에 따른 일시적 수급 악화 가능성은 고려해야 한다”고 덧붙였다."
이데일리,063570,/news/news_read.nhn?article_id=0003349908&office_id=018&mode=search&query=한국전자금융&page=1,2015-09-17 17:25,"한국전자금융, 최근 주가급등 관련 조회공시 요구받아",[이데일리 이유미 기자] 한국거래소는 17일 한국전자금융(063570)에 대해 최근 현저한 주가급등 관련 조회공시를 요구했다.
이데일리,063570,/news/news_read.nhn?article_id=0004150032&office_id=018&mode=search&query=한국전자금융&page=1,2018-07-16 09:16,"[특징주]한국전자금융, 최저임금 인상 결정에 &lsquo;강세&rsquo;",[이데일리 이광수 기자] 한국전자금융(063570)이 내년 최저임금 인상 결정에 강세다. 16일 오전 9시 12분 현재 한국전자금융은 전 거래일 보다 700원(5.60%)오른 1만 3200원에 거래되고 있다. 앞서 한국투자증권은 “최저임금 인상과 근로시간 단축으로 무인자동화기기와 무인주차장의 수요 증가가 전망된다”며 한국전자금융을 추천 종목으로 선정하기도 했다. 최저임금위원회는 지난 14일 내년 시간당 최저임금을 올해보다 10.9% 오른 8350원으로 결정했다.
