source,symbol,link,date,title,content
서울경제,066670,/news/news_read.nhn?article_id=0003197505&office_id=011&mode=search&query=디스플레이텍&page=1,2018-01-15 14:10,"(코)디스플레이텍, 장중 신저가 기록.. 3,705&rarr;3,680(▼25)","[서울경제] 오후 2시 8분 현재 디스플레이텍(066670) 이 2.65% 내린 3,680원(▼100)을 기록하며, 52주 신저가를 -25원 경신했다. 기존 52주 최저가는 2018년 01월 12일 기록한 3,705원이다. 체결강도는 24%로 강세 반전했다. 총매수체결량은 19,843주, 총매도체결량은 83,919주를 각각 기록했다.  (※ 체결강도(%) = (총매수체결량/총매도체결량)*100) 이 시각 현재 거래대금은 3억8,466만, 거래량은 10만3,811주를 기록하고 있으며, 수급측면으로는 81(매도):19(매수)의 매도우위를 보이고 있다. 거래일을 기준으로 최근 3일간 평균 거래량은 4만6천주, 60일 평균 거래량 4만4천주로 비슷한 수준의 거래량을 유지하고 있다."
한국경제TV,066670,/news/news_read.nhn?article_id=0000595215&office_id=215&mode=search&query=디스플레이텍&page=1,2018-01-25 13:47,"디스플레이텍, 전일 대비 약 3% 상승한 3,820원","[한국경제TV 라이온봇 기자] 디스플레이텍은 1월 25일 13시 47분 전일 대비 약 3% 상승한 3,820원에 거래되고 있다. 디스플레이텍은 코스닥 상장 기업으로 IT부품 업종에 속해 있다. 시가총액은 692억원으로 코스닥 상장기업 중 820위에 위치 해 있다. [종목 성향 진단] [그림 1] 종목 성향 진단 디스플레이텍의 투자 스타일은 가치주에 가깝다. 기업 가치 대비 낮은 주가가 매력적인 기업이다. 주가 모멘텀은 부진한 편이었다. 최근 6개월 수익률은 -2.63%의 하락폭을 기록했다. 최근 1개월 수익률 또한 -2.24% 하락하며 부진한 모멘텀을 이어가고 있다. 디스플레이텍종목에 대한 투자자의 관심도는 매우 낮은 편이었다. [투자 점수 진단] [그림 2] 투자 점수 진단 디스플레이텍은 저평가성2(PBR) 측면에서 두각을 나타내고 있다. 최근 PBR은 89점으로 6개의 핵심 팩터 중 가장 높은 점수를 기록했다. PBR은  전체 시장 내 208위를 기록하며 상위 11.11%에 위치했다. 업종별로는 23위를 기록하며 상위 3.99%에 위치했다. 그리고 안정성(부채비율) 역시 도드라지는 편이다. 안정성 점수는 86점으로 두번째로 높은 점수를 기록했다. 부채비율은 전체 시장 내 294위를 기록하며 상위 13.96%에 위치했다. 업종별로는 96위를 기록하며 상위 15.81%에 위치했다. [종합 투자점수] [그림 3] 종합 투자점수 AI 인공지능 분석을 통한 디스플레이텍의 종목 종합 스코어는 85점을 기록했다. 이는 동일 업종 평균점수인 57점과 시장 평균점수인 57점를 상회하는 수치였다. (위의 AI인공지능 점수는 재무 데이터를 기반으로 전체 상장 종목과 비교/분석하여 도출한 점수로 높은 점수가 반드시 높은 수익률을 보장하지 않습니다.) 라이온봇 기자 -한국경제TV※ 본 기사는 한국경제TV와 '거장들의 투자공식이'자체 개발한 '라이온봇 기자'가 실시간으로 작성한 기사입니다. 라이온봇기자 ⓒ 한국경제TV, 무단 전재 및 재배포 금지 한국경제TV 관련뉴스해당 언론사에서 선정하며 언론사 페이지(아웃링크)로 이동해 볼 수 있습니다.강문영, 김도균과 제2의 커플되나? '관심집중'임현식 한옥 대저택…'한옥마을 집인 줄'한비야 결혼, ""아이 안 낳는다고 비난 받았다""?'김우빈 결별설 왜 나오나'…신민아 카리스마 넘치는 근황김준호, 김지민에 ""비혼으로 사는 게 좋아"" 과거 발언 봤더니"
한국경제TV,066670,/news/news_read.nhn?article_id=0000619711&office_id=215&mode=search&query=디스플레이텍&page=1,2018-04-06 12:48,"디스플레이텍, 전일 대비 약 8% 상승한 4,150원","[한국경제TV 라이온봇 기자] 디스플레이텍은 4월 6일 12시 47분 전일 대비 약 8% 상승한 4,150원에 거래되고 있다. 디스플레이텍은 코스닥 상장 기업으로 IT부품 업종에 속해 있다. 시가총액은 715억원으로 코스닥 상장기업 중 827위에 위치 해 있다. [종목 성향 진단] [그림 1] 종목 성향 진단 디스플레이텍의 투자 스타일은 가치주에 가깝다. 기업 가치 대비 낮은 주가가 매력적인 기업이다. 주가 모멘텀은 평범한 수준이었다. 최근 1개월 수익률이 2.96%, 3개월 수익률은 -1.54%, 6개월 수익률은 -1.42%를 기록했다. 디스플레이텍 종목에 대한 투자자의 관심도는 상대적으로 낮은 편이었다. [투자 점수 진단] [그림 2] 투자 점수 진단 디스플레이텍은 안정성(부채비율) 측면에서 두각을 나타내고 있다. 최근 부채비율은 93점으로 6개의 핵심 팩터 중 가장 높은 점수를 기록했다. 부채비율은  전체 시장 내 417위를 기록하며 상위 7.14%에 위치했다. 업종별로는 158위를 기록하며 상위 11.13%에 위치했다. 그리고 저평가성2(PBR) 역시 도드라지는 편이다. 저평가성2 점수는 90점으로 두번째로 높은 점수를 기록했다. PBR은 전체 시장 내 165위를 기록하며 상위 10.23%에 위치했다. 업종별로는 17위를 기록하며 상위 3.47%에 위치했다. 그러나 매출증가율(YoY)과 PER은  아쉬움을 나타냈다. [종합 투자점수] [그림 3] 종합 투자점수 AI 인공지능 분석을 통한 디스플레이텍의 종목 종합 스코어는 65점을 기록했다. 이는 동일 업종 평균점수인 48점과 시장 평균점수인 50점를 상회하는 수치였다. (위의 AI인공지능 점수는 재무 데이터를 기반으로 전체 상장 종목과 비교/분석하여 도출한 점수로 높은 점수가 반드시 높은 수익률을 보장하지 않습니다. 위의 자료는 당사의 추천 종목이 아니며, 투자 시 참고용으로 제시해드리는 것입니다.) 라이온봇 기자 -한국경제TV※ 본 기사는 한국경제TV와 '거장들의 투자공식이'자체 개발한 '라이온봇 기자'가 실시간으로 작성한 기사입니다. 라이온봇기자 ⓒ 한국경제TV, 무단 전재 및 재배포 금지 한국경제TV 관련뉴스해당 언론사에서 선정하며 언론사 페이지(아웃링크)로 이동해 볼 수 있습니다.레드벨벳 아이린 옆에 北 김정은, 실화야?""자연미인"" 셋째 출산에도 여전히 아름다운 '리설주'천안함 추적60분, 이명박 정부 당시 방송 외압 받았나?견미리 딸 이다인, 금수저 논란…주식부자?고 장자연-단역 자매 사건 재수사…""내가 노리개인가"""
서울경제,066670,/news/news_read.nhn?article_id=0003263618&office_id=011&mode=search&query=디스플레이텍&page=1,2018-04-06 12:49,"&lt;코&gt;디스플레이텍, 전일 대비 9.01% 상승.. 일일회전율은 0.88% 기록","[서울경제] 디스플레이텍(066670) 은 6일 오후 12시 48분 현재 9.01% 오른 4,175원에 거래되고 있으며, 28(매도):72(매수)의 매수우위를 기록하고 있다. 거래대금은 6억5,474만, 거래량은 16만5,077주로 거래량회전율은 0.88%로 나타났다. 지난 1개월간 디스플레이텍은 상승 12회, 하락 13회를 기록했고, 주가수익률은 9.58% 표준편차는 0.78%를 기록했다. 이 기간 ' IT부품업 ' 업종 평균 주가수익률은 -6.47%로 나타났으며, 변동성은 1.41%를 기록했다. 이 시각 현재 ' IT부품업 '은 0.70% 상승 중이며, 44(매도):56(매수)의 매수우위를 기록하고 있다."
파이낸셜뉴스,066670,/news/news_read.nhn?article_id=0003836100&office_id=014&mode=search&query=디스플레이텍&page=1,2017-06-29 10:48,"[fnRASSI]디스플레이텍, 2.25% 오르며 거래량 증가","디스플레이텍(066670)은 당일 거래량 증가로 최근 5거래일 거래량의 최고치를 넘어섰다. 그리고 디스플레이텍은 3일 연속 상승흐름을 보이며, 10시 46분 현재 2.25% 증가한 4,325원에 거래중이다. 기관과 개인은 순매도, 외국인은 순매수(한달누적)  전일 기관이 3,219주를 순매수했고, 외국인은 2,724주를 순매도했다. 4주간을 기준으로 보면 외국인이 매매관점을 매도에서 매수로 전환하면서 21,022주를 순매수한 반면, 기관은 매도 관점으로 접근하면서 6,175주를 순매도했고, 개인들도 매도 우위로 반전되면서 14,847주를 순매도한 것으로 집계됐다. 외국인, 기관 모두 보유량 증가 (5일 누적) 최근 5일간 동종목의 외국인 투자자는 5,994주 순매수하였고 마찬가지로 기관은 3,219주 순매수하였다. 전날 외국인 1,724주 순매도, 기관3,219주 순매수하며 보유 비율이 변동했다. 다음 표는 동종목의 외국인, 기관의 일별 순매수량을 나타낸 것이다. 'fnRASSI'는 증권전문 기업 씽크풀과 파이낸셜뉴스의 협업으로 로봇기자가 실시간으로 생산하는 기사입니다."
파이낸셜뉴스,066670,/news/news_read.nhn?article_id=0003826809&office_id=014&mode=search&query=디스플레이텍&page=1,2017-06-09 09:29,"[fnRASSI]디스플레이텍, 4.57% 오르며 거래량 증가","디스플레이텍은 투자자들의 관심으로 현재 거래량이 최근 5거래일 거래량의 최고치를 넘어섰다. 그리고 디스플레이텍은 5일 연속 상승흐름을 보이며, 9시 23분 현재 4.57% 증가한 4,345원에 거래중이다. 외국인과 기관은 순매도, 개인은 순매수(한달누적)  6월5일부터 전일까지 외국인이 3거래일 연속 순매수를 보였다. 4주간을 기준으로 보면 외국인이 매도 후 매수의 관점을 보이고 있음에도 불구하고 30,369주를 순매도했고, 기관도 매도 우위를 보이면서 17,403주를 순매도했지만, 개인은 오히려 매기를 떨어뜨리면서도 47,772주를 순매수했다. 퀀트 재무분석, 종합점수 41점으로 상승                    지표               항목               값               종합점수                 성장성               매출액증가율               -0.64               2.8                 자기자본증가율               0.02                 안정성               부채비율               22.21               10                 유동비율               324.17                 이익안정성               10                 수익성               ROA               2.34               5.24                 ROE               2.86                 영업이익율               5.82          디스플레이텍의 퀀트 재무 점수는 18.04점으로 3개월 이전 17.75점보다 올랐다. 지난 분기에 비해 성장성 점수가 상승했다. 이는 매출액 증가율과 자기자본 증가율이 증가하였기 때문이다. 수익성 측면에서 볼때 ROA, ROE, 영업이익률 모두 개선되어 이전보다 좋은 점수를 받았다. 'fnRASSI'는 증권전문 기업 씽크풀과 파이낸셜뉴스의 협업으로 로봇기자가 실시간으로 생산하는 기사입니다."
파이낸셜뉴스,066670,/news/news_read.nhn?article_id=0003806011&office_id=014&mode=search&query=디스플레이텍&page=1,2017-04-21 10:17,"[fnRASSI]디스플레이텍, 1.65% 오르며 거래량 증가","디스플레이텍(066670)의 당일 거래량이 최근 5거래일 거래량의 최고치를 넘어섰다. 그리고 디스플레이텍은 5일 연속 상승흐름을 보이며, 10시 9분 현재 1.65% 증가한 4,005원에 거래중이다. 상장주식수 대비 거래량은 0.15%로 적정수준 최근 한달간 디스플레이텍의 상장주식수 대비 거래량을 비교해보니 일별 매매회전율이 0.15%로 집계됐다. 그리고 동기간 장중 저점과 고점의 차이인 일평균 주가변동률을 1.88%를 나타내고 있다.                   지표               항목               값               종합점수                 성장성               매출액증가율               -0.72               2.36                 자기자본증가율               0                 안정성               부채비율               23.18               10                 유동비율               331.51                 이익안정성               10                 수익성               ROA               2.25               4.9                 ROE               2.78                 영업이익율               5.09          디스플레이텍의 퀀트 재무 점수는 17.26점으로 지난 분기에 비해 성장성 점수가 하락했다. 이는 매출액 증가율과 자기자본 증가율이 감소하였기 때문이다. 수익성 측면에서 볼때 영업이익률이 개선되어 이전보다 좋은 점수를 받았다. 'fnRASSI'는 증권전문 기업 씽크풀과 파이낸셜뉴스의 협업으로 로봇기자가 실시간으로 생산하는 기사입니다."
전자신문,066670,/news/news_read.nhn?article_id=0002661684&office_id=030&mode=search&query=디스플레이텍&page=1,2017-11-27 19:00,"[ET투자뉴스][디스플레이텍 지분 변동] 박윤민 외 1명 1%p 증가, 31.59...","디스플레이텍(066670)은 27일 최대주주 박윤민을  비롯한 특별관계자의 보유주식이 증가되었다고 발표했다. 이는 직전 보고일보다 187,000주 증가하여 지분율은 31.59%로 상승했다. 이번 보고 사유는 특별관계자의주식취득에 따른 변동보고로  알려졌다.   최대주주와 특수관계자의 지분 변동은 주가에 영향을 주는 요인이다. 특히 보유비율을 지속적으로 늘리거나 줄일 경우, 해당종목 투자시 유의할 필요가 있다.  다음은 디스플레이텍의 지분 변동 내역과 보유 내역이다."
파이낸셜뉴스,066670,/news/news_read.nhn?article_id=0003877247&office_id=014&mode=search&query=디스플레이텍&page=1,2017-09-20 10:52,"[fnRASSI]디스플레이텍, 1.24% 내리며 거래량 증가","디스플레이텍(066670)의 현재 거래량이 최근 5거래일 거래량의 최고치를 경신하며 투자자들의 관심을 받고 있다. 그리고 현재 1.24% 내린 3,980원에 거래중이며 4일 연속 하락흐름을 보이고 있다. 퀀트 재무분석, 종합점수 50점으로 상승                    지표               항목               값               종합점수                 성장성               매출액증가율               -0.58               3.13                 자기자본증가율               0.03                 안정성               부채비율               19.41               10                 유동비율               355.98                 이익안정성               10                 수익성               ROA               3.27               6.25                 ROE               3.91                 영업이익율               8.21          디스플레이텍의 퀀트 재무 점수는 19.38점으로 3개월 이전 18.17점보다 올랐다. 지난 분기에 비해 성장성 점수가 상승했다. 이는 매출액 증가율과 자기자본 증가율이 증가하였기 때문이다. 수익성 측면에서 볼때 ROA, ROE, 영업이익률 모두 개선되어 이전보다 좋은 점수를 받았다. 상장주식수 대비 거래량은 0.21%로 적정수준 최근 한달간 디스플레이텍의 상장주식수 대비 거래량을 비교해보니 일별 매매회전율이 0.21%로 집계됐다. 그리고 동기간 장중 저점과 고점의 차이인 일평균 주가변동률을 1.88%를 나타내고 있다. 'fnRASSI'는 증권전문 기업 씽크풀과 파이낸셜뉴스의 협업으로 로봇기자가 실시간으로 생산하는 기사입니다."
전자신문,066670,/news/news_read.nhn?article_id=0002644783&office_id=030&mode=search&query=디스플레이텍&page=1,2017-09-27 15:31,"[ET투자뉴스][디스플레이텍 지분 변동] 박윤민 외 1명 1.12%p 증가, 30...","디스플레이텍(066670)은 27일 최대주주 박윤민을  비롯한 특별관계자의 보유주식이 증가되었다고 발표했다. 이는 직전 보고일보다 210,000주 증가하여 지분율은 30.59%로 상승했다. 이번 보고 사유는 특별관계자의주식취득에 따른 변동보고로  알려졌다.   최대주주와 특수관계자의 지분 변동은 주가에 영향을 주는 요인이다. 특히 보유비율을 지속적으로 늘리거나 줄일 경우, 해당종목 투자시 유의할 필요가 있다.  다음은 디스플레이텍의 지분 변동 내역과 보유 내역이다."
한국경제TV,066670,/news/news_read.nhn?article_id=0000598017&office_id=215&mode=search&query=디스플레이텍&page=1,2018-02-02 13:44,"디스플레이텍, 전일 대비 약 -3% 하락한 3,855원","[한국경제TV 라이온봇 기자] 디스플레이텍은 2월 2일 13시 43분 전일 대비 약 -3% 하락한 3,855원에 거래되고 있다. 디스플레이텍은 코스닥 상장 기업으로 IT부품 업종에 속해 있다. 시가총액은 743억원으로 코스닥 상장기업 중 817위에 위치 해 있다. [종목 성향 진단] [그림 1] 종목 성향 진단 디스플레이텍의 투자 스타일은 가치주에 가깝다. 기업 가치 대비 낮은 주가가 매력적인 기업이다. 주가 모멘텀은 평범한 수준이었다. 최근 1개월 수익률이 4.61%, 3개월 수익률은 4.61%, 6개월 수익률은 4.33%를 기록했다. 디스플레이텍종목에 대한 투자자의 관심도는 상대적으로 낮은 편이었다. [투자 점수 진단] [그림 2] 투자 점수 진단 디스플레이텍은 저평가성2(PBR) 측면에서 두각을 나타내고 있다. 최근 PBR은 89점으로 6개의 핵심 팩터 중 가장 높은 점수를 기록했다. PBR은  전체 시장 내 208위를 기록하며 상위 11.11%에 위치했다. 업종별로는 23위를 기록하며 상위 3.99%에 위치했다. 그리고 안정성(부채비율) 역시 도드라지는 편이다. 안정성 점수는 86점으로 두번째로 높은 점수를 기록했다. 부채비율은 전체 시장 내 297위를 기록하며 상위 13.96%에 위치했다. 업종별로는 97위를 기록하며 상위 15.81%에 위치했다. [종합 투자점수] [그림 3] 종합 투자점수 AI 인공지능 분석을 통한 디스플레이텍의 종목 종합 스코어는 85점을 기록했다. 이는 동일 업종 평균점수인 57점과 시장 평균점수인 57점를 상회하는 수치였다. (위의 AI인공지능 점수는 재무 데이터를 기반으로 전체 상장 종목과 비교/분석하여 도출한 점수로 높은 점수가 반드시 높은 수익률을 보장하지 않습니다. 위의 자료는 당사의 추천 종목이 아니며, 투자 시 참고용으로 제시해드리는 것입니다.) 라이온봇 기자 -한국경제TV※ 본 기사는 한국경제TV와 '거장들의 투자공식이'자체 개발한 '라이온봇 기자'가 실시간으로 작성한 기사입니다. 라이온봇기자 ⓒ 한국경제TV, 무단 전재 및 재배포 금지 한국경제TV 관련뉴스해당 언론사에서 선정하며 언론사 페이지(아웃링크)로 이동해 볼 수 있습니다.'오달수의 그녀' 채국희, 승무원 출신? 채시라 동생?김민정 ""대시한 男연예인 5명…같은 직업군 괜찮아""소유진 가족사진 공개, 'D-10' 만삭에도 소녀같은 미소'김연아 때문?' 손연재 SNS계정 탈퇴까지…누리꾼 '맹비난'알베르토 몬디, 1형 당뇨 투병 고백…""발병 원인 알 수 없다"""
아시아경제,066670,/news/news_read.nhn?article_id=0003931568&office_id=277&mode=search&query=디스플레이텍&page=1,2017-02-13 14:39,"디스플레이텍, 다음달 24일 정기주주총회 개최",[아시아경제 권해영 기자] 디스플레이텍은 다음달 24일 오전 9시 경기도 안성시 공단1로 10 본사 회의실에서 정기주주총회를 소집한다고 13일 공시했다.
