source,symbol,link,date,title,content
파이낸셜뉴스,069140,/news/news_read.nhn?article_id=0004004791&office_id=014&mode=search&query=누리플랜&page=1,2018-04-18 15:37,"[fnRASSI]장마감, 코스닥 상승 종목(누리플랜 30%&uarr;)","18일 코스닥 시장은 상승 536개, 하락 619개, 보합 77개로 마감했다. 상승한 종목으로 누리플랜(069140) 30%, 삼륭물산(014970) 29.98%, 재영솔루텍(049630) 29.91% 등이 있다. 'fnRASSI'는 증권전문 기업 씽크풀과 파이낸셜뉴스의 협업으로 로봇기자가 실시간으로 생산하는 기사입니다."
이데일리,069140,/news/news_read.nhn?article_id=0003820542&office_id=018&mode=search&query=누리플랜&page=1,2017-05-10 10:42,"[특징주]누리플랜, 문재인 매년 10조 도시재생뉴딜 투자 &uarr;","[이데일리 박형수 기자] 경관조명 사업과 경관시설 사업 등을 하는 누리플랜(069140)이 강세다. 문재인 대통령의 주요 부동산 공약인 ‘도시재생 뉴딜’ 정책을 본격적으로 추진할 것이라는 전망이 주가에 영향을 준 것으로 보인다. 10일 오전 10시38분 누리플랜은 전날보다 3.1% 오른 7320원에 거래되고 있다. 더불어민주당 대선 공약집을 보면 문 대통령이 제시한 부동산 정책은 도시재생 뉴딜 정책과 공적임대주택 공급 등 주거 약자 보호 정책 등으로 요약된다. 주요 부동산 정책 가운데 하나인 도시재생은 기존 건물을 철거하고 새로 세우는 ‘재건축 또는 재개발’과 반대되는 개념이다. 역사와 문화, 환경, 생태 등을 보존하면서 노후 주거환경을 살 만한 주거지로 바꾸는 것이 핵심이다. 도시재생 예산 10조원 가운데 2조원은 중앙정부재정으로 마련하고 나머지 8조원은 주택도시기금, 한국토지주택공사(LH), 서울주택도시공사(SH) 사업비로 마련할 계획이다. 누리플랜이이 하는 경관조명사업은 교량, 대형 건축물, 공원 등에 발광다이오드(LED) 조명기구, 투광기 등 기타 조명기구를 이용해 주간의 경관과 또 다른 특색과 디자인을 갖춘 야간의 경관을 연출하는 사업이다. 국가 경제수준 향상과 도시의 경쟁력 제고를 위해 많은 지자체가 쾌적하고수준 높은 문화 공간을 제공하려고 투자하고 있다. 도시 경쟁력을 높이면 고급인력과 기업을 유치하는 데 도움이 되기 때문에 야간경관조명사업이 성장하고 있다. 경관시설사업은 교량과 도로의 일반부대시설물인 난간, 휀스, 차량 방호울타리, 조형물, 외장재, 방음벽 등을 주로 하는 경관시설사업부문과 보도육교, 가설교량 등의 철구조물의 시공 등을 주로 하는 강구조물사업부문으로 나뉜다. 건축과 토목현장의 분진과 소음 등 환경적인 피해를 줄일 다양한 가설방음벽과 도로, 철도시설 등에서 발생하는 소음을 차단하는 방음벽 등을 생산·제작하는 사업을 포함하고 있다."
파이낸셜뉴스,069140,/news/news_read.nhn?article_id=0004004787&office_id=014&mode=search&query=누리플랜&page=1,2018-04-18 15:35,"[fnRASSI]오늘의 상한가, 누리플랜 30% &uarr;","18일 누리플랜(069140), 삼륭물산(014970), 코아스(071950), 재영솔루텍(049630), 나이벡(138610), 고려시멘트(198440)등이 상한가를 기록했다. 특히 누리플랜은 전 거래일 대비 30% 오른 6,760원에 거래를 마감하며 높은 관심을 받았다. 'fnRASSI'는 증권전문 기업 씽크풀과 파이낸셜뉴스의 협업으로 로봇기자가 실시간으로 생산하는 기사입니다."
파이낸셜뉴스,069140,/news/news_read.nhn?article_id=0004004519&office_id=014&mode=search&query=누리플랜&page=1,2018-04-18 11:35,"[fnRASSI]누리플랜, 상한가 기록","누리플랜(069140)은 상한가를 기록하고 있다. 동종목은 현재 6,760원선에서 이루어지고 있다. 참고로 52주 최고가는 8,810원(17년 07월 06일), 최저가는 4,370원(18년 01월 09일)원이다. 최근 3일동안 평균 거래량은 38만 주이다. 이는 250일 일 평균 거래량 14만 주와 비교해보면 최근 거래량이 급격히 늘어났다는 것을 알 수 있다. 퀀트 재무분석, 종합점수 20점으로 상승                    지표               항목               값               종합점수                 성장성               매출액증가율               0.03               5.02                 자기자본증가율               -0.02                 안정성               부채비율               76.95               6.44                 유동비율               118.59                 이익안정성               6.94                 수익성               ROA               0.06               2.97                 ROE               0.1                 영업이익율               1.24          누리플랜의 퀀트 재무 점수는 14.43점으로 3개월 이전 11.2점보다 올랐다. 지난 분기에 비해 성장성 점수가 상승했다. 이는 매출액 증가율과 자기자본 증가율이 증가하였기 때문이다. 실적 안정성이 개선되어 안정성 종합 점수는 상승했다. 수익성 측면에서 볼때 ROA, ROE, 영업이익률 모두 개선되어 이전보다 좋은 점수를 받았다. 주요 투자주체는 개인투자자 최근 한달간 주체별 거래비중을 살펴보면 개인이 93.22%로 가장 높은 참여율을 보였고, 외국인이 4.89%를 보였으며 기관은 1.88%를 나타냈다. 그리고 최근 5일간 거래비중은 개인이 91.13%, 외국인이 8.86%를 기록한 것으로 나타났다. 'fnRASSI'는 증권전문 기업 씽크풀과 파이낸셜뉴스의 협업으로 로봇기자가 실시간으로 생산하는 기사입니다."
한국경제TV,069140,/news/news_read.nhn?article_id=0000624812&office_id=215&mode=search&query=누리플랜&page=1,2018-04-20 11:57,"누리플랜, -10% 하락... 전일 보다 720원 내린 6,440원","[한국경제TV 라이온봇 기자] 누리플랜은 4월 20일 11시 56분 전일 대비 약 -10% 급락한 6,440원에 거래되고 있다. 누리플랜은 코스닥 상장 기업으로 금속 업종에 속해 있다. 시가총액은 340억원으로 코스닥 상장기업 중 1,167위에 위치 해 있다. [종목 성향 진단] [그림 1] 종목 성향 진단 누리플랜의 투자 스타일은 가치주에 가깝다. 기업 가치 대비 낮은 주가가 매력적인 기업이다. 주가 모멘텀은 굉장히 좋은 편이었다. 최근 3개월 수익률이 무려 55.82%의 상승폭을 기록했다. 최근 1개월 수익률 또한 32.35% 상승하며 굉장히 좋은 모멘텀을 보이고 있다. 누리플랜 종목에 대한 투자자의 관심도는 굉장히 높은 편이다. [투자 점수 진단] [그림 2] 투자 점수 진단 누리플랜은 저평가성1(PER) 측면에서 두각을 나타내고 있다. 최근 PER은 95점으로 6개의 핵심 팩터 중 가장 높은 점수를 기록했다. PER은  전체 시장 내 95위를 기록하며 상위 5.08%에 위치했다. 업종별로는 24위를 기록하며 상위 7.3%에 위치했다. 그리고 효율성(ROA) 역시 도드라지는 편이다. 효율성 점수는 93점으로 두번째로 높은 점수를 기록했다. ROA는 전체 시장 내 132위를 기록하며 상위 6.74%에 위치했다. 업종별로는 14위를 기록하며 상위 3.86%에 위치했다. 그러나 매출증가율(YoY)과 부채비율은  아쉬움을 나타냈다. [종합 투자점수] [그림 3] 종합 투자점수 AI 인공지능 분석을 통한 누리플랜의 종목 종합 스코어는 75점을 기록했다. 이는 동일 업종 평균점수인 56점과 시장 평균점수인 56점를 상회하는 수치였다. (위의 AI인공지능 점수는 재무 데이터를 기반으로 전체 상장 종목과 비교/분석하여 도출한 점수로 높은 점수가 반드시 높은 수익률을 보장하지 않습니다. 위의 자료는 당사의 추천 종목이 아니며, 투자 시 참고용으로 제시해드리는 것입니다.) 라이온봇 기자 -한국경제TV※ 본 기사는 한국경제TV와 '거장들의 투자공식이'자체 개발한 '라이온봇 기자'가 실시간으로 작성한 기사입니다. 라이온봇기자 ⓒ 한국경제TV, 무단 전재 및 재배포 금지 한국경제TV 관련뉴스해당 언론사에서 선정하며 언론사 페이지(아웃링크)로 이동해 볼 수 있습니다.'억대 수입' 이사배, 과거 공개한 '럭셔리' 하우스 봤더니유병자 실손보험, 삼성화재 '가장 비싸'쏘가리 가격 '확' 떨어진다…22년 연구 끝에 '대량양식' 성공박하선 '다이어트 성공' 인증샷 ""웰컴백 44사이즈""손은서♥이주승 열애 인정, '연상녀-연하남커플' 합류"
한국경제TV,069140,/news/news_read.nhn?article_id=0000623590&office_id=215&mode=search&query=누리플랜&page=1,2018-04-18 09:54,"누리플랜, 상한가 기록 (▲1,560) - 현재가 6,760원","[한국경제TV 라이온봇 기자] 4월 18일 9시 54분 누리플랜이 상한가를 기록했다. 누리플랜은 전일 대비 약 1,560원 상승한 6,760원을 기록했다. 누리플랜은 코스닥 상장 기업으로 금속 업종에 속해 있다. 시가총액은 247억원으로 코스닥 상장기업 중 1,213위에 위치 해 있다. 거래량은 전일 대비 13796% 증가한 1,089,577주 이고, 거래대금은 70억4,600만원 수준이다. 현재 총 매수잔량은 585,305주이고, 상한가 잔량은 584,195주이다. 라이온봇 기자 -한국경제TV※ 본 기사는 한국경제TV와 '거장들의 투자공식이'자체 개발한 '라이온봇 기자'가 실시간으로 작성한 기사입니다. 라이온봇기자 ⓒ 한국경제TV, 무단 전재 및 재배포 금지 한국경제TV 관련뉴스해당 언론사에서 선정하며 언론사 페이지(아웃링크)로 이동해 볼 수 있습니다.'억대 수입' 이사배, 과거 공개한 '럭셔리' 하우스 봤더니유병자 실손보험, 삼성화재 '가장 비싸'쏘가리 가격 '확' 떨어진다…22년 연구 끝에 '대량양식' 성공마포 요양원 인질극, 왜 그랬냐 묻자 ""국민을 위해서…""고 장자연-단역 자매 사건 재수사…""내가 노리개인가"""
이데일리,069140,/news/news_read.nhn?article_id=0003948214&office_id=018&mode=search&query=누리플랜&page=1,2017-10-19 09:42,"[특징주]누리플랜, 北EMP 방어 정부회의 부각 '강세'","[이데일리 오희나 기자] 정부가 북한의 고출력 전자기파(EMP) 공격에 대비해 첫 관계부처 합동 회의를 진행한다는 소식에 누리플랜이 부각되고 있다. 19일 오전 9시37분 현재 누리플랜(069140)은 전거래일보다 6.46%(400원) 오른 6590원에 거래되고 있다. 이틀 연속 상승세를 이어가고 있다. 누리플랜은 지난 2009년부터 EMP방호사업을 하고 있다. EMP방호사업은 군사 및 국가주요시설에 대해 항전자파차단시설을 제작·설치하는 사업이다. EMP방호사업은 국방부에서 중점적으로 추진하는 사업으로 무기체계의 첨단화와 적의 공격능력 증대, 그리고 전작권 환수와 작전계획의 변동에 따라 대공능력을 향상시키기 위하여 진행 중에 있다. 누리플랜은 지난 2010년 국방부 ‘201사업’ 중 시설사업에서 32억원을 수주하기도 했다. 관련업계와 언론에 따르면 국가정보원은 이날 ‘국가 EMP 정책방향 회의’를 비공개로 개최하는 것으로 알려졌다. 앞서 지난달 국정원은 기획재정부, 행정안전부, 금융위원회, 산업통상자원부, 과학기술정보통신부 등 주요 정부 부처와 민간 연구기관 등에 회의 개최 공문을 발송한 것으로 전해졌다. 북한의 EMP 공격에 대비해 경제 부처가 함께 모이는 회의는 이번이 처음이다. 이날 회의에서는 북한의 EMP 공격에 대비하기 위한 민간분야 방호체계 구축 확대와 방호시설 효율성 제고 방안 등이 주요 의제로 다뤄질 것으로 전해졌다. 북한의 EMP탄은 전자기파를 대량 방출해 반경 내 전자기기·통신·전력망의 전자회로를 태우는 무기다. 에너지 관련 시설은 물론 금융전산망, 도로 신호등, 자동차, 휴대전화, 병원, 상하수도 등 생활밀접시설을 수초내에 무용지물로 만드는 위력을 갖고 있다."
서울경제,069140,/news/news_read.nhn?article_id=0003273385&office_id=011&mode=search&query=누리플랜&page=1,2018-04-18 09:31,"&lt;코&gt;누리플랜, 전일 대비 30.00% 상승.. 일일회전율은 22.54% 기록","[서울경제] 누리플랜(069140) 은 18일 오전 9시 30분 현재 30.00% 오른 6,760원에 거래되고 있으며, 44(매도):56(매수)의 매수우위를 기록하고 있다. 거래대금은 69억2,115만, 거래량은 107만1,018주로 거래량회전율은 22.54%로 나타났다. 지난 1개월간 누리플랜은 상승 15회, 하락 11회를 기록했고, 주가수익률은 34.39% 표준편차는 1.39%를 기록했다. 이 기간 ' 금속업 ' 업종 평균 주가수익률은 -0.21%로 나타났으며, 변동성은 1.25%를 기록했다. 이 시각 현재 ' 금속업 '은 0.03% 상승 중이며, 48(매도):52(매수)의 매수우위를 기록하고 있다."
전자신문,069140,/news/news_read.nhn?article_id=0002657207&office_id=030&mode=search&query=누리플랜&page=1,2017-11-14 09:43,"[ET투자뉴스]누리플랜, 17년3분기 실적 발표",11월 13일 누리플랜(069140)의 2017년 3분기 연결 확정 실적이 발표됐다. 매출액은 지난해 같은 기간 대비해서 55.05% 증가하여 70억원을 달성했다. 당기순이익은 -13.7억원에서0.3억원으로 흑자전환되었다. 이번분기 기준으로 추정되는 누리플랜의 자기자본이익률(ROE)은 0.6%로 나타났다. 이는 최근 일년과 비교했을 때 급등한 수치이다. 한편 동종목의 주가가 1주당 수익의 몇배가 되는지 나타내는 주가수익비율(PER)은 876.2배로 나타났다.주가가 1주당 순자산의 몇배인지 알려주는 주가순자산비율인 PBR은 1.35배이다. 지난해 동기 PBR은 1.66배로 이번 3분기 PBR이 하락했다. 다음은 누리플랜과 동일 업종 내 비교 그룹 종목의 각각 최근 실적의 전년 동기 대비 성장률이다. 누리플랜의 매출액 증감율은 타 종목 대비 우수한 편이다. 그리고 주가는 하락하였지만 가장 나은 상승률을 기록하였다.
서울경제,069140,/news/news_read.nhn?article_id=0003274450&office_id=011&mode=search&query=누리플랜&page=1,2018-04-19 09:05,"&lt;코&gt;누리플랜, 상한가 진입.. +29.88% &uarr;","[서울경제] 오전 9시 4분 현재 누리플랜(069140) 이 +29.88% 오른 8,780원(▲2,020)으로 장중 상한가에 진입했다. 거래대금은 22억1,390만, 거래량은 25만2,153주를 기록하고 있으며, 수급측면으로는 100(매도):0(매수)의 매도우위를 보이고 있다. 누리플랜은 전일 상한가(6,760원, ▲1,560, +30.00%)를 기록한데 이어 이틀 연속 강한 상승세를 이어가고 있다. 지난 1개월간 누리플랜은 상한가 1회, 상승 15회, 하락 10회를 기록했고, 주가수익률은 72.16%였다. 이 기간 ' 금속업 ' 업종 평균 주가수익률은 1.02%를 기록했다. 현재 ' 금속업 ' 총 66개 종목 중 상한가 종목은 1개, 상승 종목은 36개로, 일부 종목만이 상승세를 보이고 있다. ( 웰크론강원(114190) +11.47%, 대동스틸(048470) +7.92%, 세명전기(017510) +3.82%)"
서울경제,069140,/news/news_read.nhn?article_id=0003273348&office_id=011&mode=search&query=누리플랜&page=1,2018-04-18 09:22,"&lt;코&gt;누리플랜, 상한가 진입.. +30.00% &uarr;","[서울경제] 오전 9시 20분 현재 누리플랜(069140) 이 +30.00% 오른 6,760원(▲1,560)으로 장중 상한가에 진입했다. 거래대금은 66억6,488만, 거래량은 103만3,108주를 기록하고 있으며, 수급측면으로는 41(매도):59(매수)의 매수우위를 보이고 있다. 누리플랜은 전일 하락(5,200원, ▼-10, -0.19%) 마감했으나, 이 시각 현재 장중 상한가를 기록하며 강세를 보이고 있다. 지난 1개월간 누리플랜은 상승 15회, 하락 11회를 기록했고, 주가수익률은 34.39%였다. 이 기간 ' 금속업 ' 업종 평균 주가수익률은 -0.03%를 기록했다. 현재 ' 금속업 ' 총 66개 종목 중 상한가 종목은 1개, 상승 종목은 35개로, 일부 종목만이 상승세를 보이고 있다. ( 현진소재(053660) +4.25%, 제룡산업(147830) +3.59%, 한국선재(025550) +2.98%)"
서울경제,069140,/news/news_read.nhn?article_id=0003275043&office_id=011&mode=search&query=누리플랜&page=1,2018-04-19 15:13,"&lt;코&gt;누리플랜, 현재가 5.53% 급락","[서울경제] 오후 3시 12분 현재 누리플랜(069140) 의 현재가는 7,340원으로 1분전 7,770원 대비 5.53% 급락했다. 수급측면으로는 63(매도):37(매수)의 매도우위를 기록하고 있다. 지난 1개월간 누리플랜은 43.92% 상승했으며, 표준편차는 5.52%를 기록했다. 이 기간 ' 금속업 ' 업종 평균 주가수익률은 2.23% 로 나타났으며, 변동성은 1.27%를 기록했다. 이 시각 현재 ' 금속업 '은 2.07% 상승 중이다."
서울경제,069140,/news/news_read.nhn?article_id=0003274806&office_id=011&mode=search&query=누리플랜&page=1,2018-04-19 11:38,"&lt;코&gt;누리플랜, 전일 대비 26.78% 상승.. 일일회전율은 49.76% 기록","[서울경제] 누리플랜(069140) 은 19일 오전 11시 37분 현재 26.78% 오른 8,570원에 거래되고 있으며, 62(매도):38(매수)의 매도우위를 기록하고 있다. 거래대금은 202억2,112만, 거래량은 236만4,109주로 거래량회전율은 49.76%로 나타났다. 지난 1개월간 누리플랜은 상한가 1회, 상승 15회, 하락 10회를 기록했고, 주가수익률은 68.04% 표준편차는 5.52%를 기록했다. 이 기간 ' 금속업 ' 업종 평균 주가수익률은 1.73%로 나타났으며, 변동성은 1.27%를 기록했다. 이 시각 현재 ' 금속업 '은 1.58% 상승 중이며, 44(매도):56(매수)의 매수우위를 기록하고 있다."
파이낸셜뉴스,069140,/news/news_read.nhn?article_id=0003812777&office_id=014&mode=search&query=누리플랜&page=1,2017-05-10 10:25,"[fnRASSI]누리플랜, 2.11% 오르며 거래량 증가","누리플랜(069140)은 당일 거래량 증가로 최근 5거래일 거래량의 최고치를 경신했다. 그리고 누리플랜은 3일 연속 상승흐름을 보이며, 10시 16분 현재 2.11% 증가한 7,250원에 거래중이다. 외국인 보유량 감소, 기관 변화 없음 (5일 누적) 최근 5일간 동종목의 외국인 투자자는 28,971주 순매도하였고 반면 기관은 0주 순매수하였다. 전날 외국인은 17,029주 순매도했지만 기관은 순매수량이 0으로 보유비율 그대로 유지했다. 다음 표는 동종목의 외국인, 기관의 일별 순매수량을 나타낸 것이다. 주주들의 손바뀜이 잦은 듯 최근 한달간 누리플랜의 매매회전율을 분석한 결과 14일에 1번 꼴로 주식의 주인이 바뀐 것으로 나타났다. 회전율이 높은 경우 유동성이 좋다고 할 수 있으나 이런경우 주가변동이 심한 경우가 많아 주의가 요구된다. 동종목의 경우 동기간 일평균 주가변동률은 4.44%를 기록했다. 'fnRASSI'는 증권전문 기업 씽크풀과 파이낸셜뉴스의 협업으로 로봇기자가 실시간으로 생산하는 기사입니다."
서울경제,069140,/news/news_read.nhn?article_id=0003274804&office_id=011&mode=search&query=누리플랜&page=1,2018-04-19 11:37,"&lt;코&gt;누리플랜, 전일 대비 26.78% 상승.. 일일회전율은 49.68% 기록","[서울경제] 누리플랜(069140) 은 19일 오전 11시 36분 현재 26.78% 오른 8,570원에 거래되고 있으며, 62(매도):38(매수)의 매도우위를 기록하고 있다. 거래대금은 201억9,220만, 거래량은 236만731주로 거래량회전율은 49.68%로 나타났다. 지난 1개월간 누리플랜은 상한가 1회, 상승 15회, 하락 10회를 기록했고, 주가수익률은 68.04% 표준편차는 5.52%를 기록했다. 이 기간 ' 금속업 ' 업종 평균 주가수익률은 1.73%로 나타났으며, 변동성은 1.27%를 기록했다. 이 시각 현재 ' 금속업 '은 1.57% 상승 중이며, 45(매도):55(매수)의 매수우위를 기록하고 있다."
서울경제,069140,/news/news_read.nhn?article_id=0002829176&office_id=011&mode=search&query=누리플랜&page=1,2016-05-13 16:06,누리플랜 &quot;자금조달 검토 중이나 확정된 건 없어&quot;,누리플랜(069140)은 13일 최근 주가급등에 관한 조회공시 답변을 통해 “사업다각화를 위한 유상증자 등 자금조달을 검토 중”이라면서도 “다만 현재까지 확정된 사항은 없다”고 밝혔다.
한국경제TV,069140,/news/news_read.nhn?article_id=0000624103&office_id=215&mode=search&query=누리플랜&page=1,2018-04-19 09:55,"누리플랜, 25% 급등... 전일 보다 1,680원 상승한 8,440원","[한국경제TV 라이온봇 기자] 누리플랜은 4월 19일 9시 55분 전일 대비 약 25% 급등한 8,440원에 거래되고 있다. 누리플랜은 코스닥 상장 기업으로 금속 업종에 속해 있다. 시가총액은 321억원으로 코스닥 상장기업 중 1,172위에 위치 해 있다. [종목 성향 진단] [그림 1] 종목 성향 진단 누리플랜의 투자 스타일은 가치주에 가깝다. 기업 가치 대비 낮은 주가가 매력적인 기업이다. 주가 모멘텀은 좋은 편에 속했다. 최근 3개월 수익률은 48.25%의 상승폭을 기록했다. 최근 1개월 수익률 또한 24.95% 상승하며 좋은 모멘텀을 보이고 있다. 누리플랜 종목에 대한 투자자의 관심도는 높은 편에 속한다. [투자 점수 진단] [그림 2] 투자 점수 진단 누리플랜은 저평가성1(PER) 측면에서 두각을 나타내고 있다. 최근 PER은 95점으로 6개의 핵심 팩터 중 가장 높은 점수를 기록했다. PER은  전체 시장 내 95위를 기록하며 상위 5.08%에 위치했다. 업종별로는 24위를 기록하며 상위 7.3%에 위치했다. 그리고 효율성(ROA) 역시 도드라지는 편이다. 효율성 점수는 93점으로 두번째로 높은 점수를 기록했다. ROA는 전체 시장 내 132위를 기록하며 상위 6.74%에 위치했다. 업종별로는 14위를 기록하며 상위 3.86%에 위치했다. 그러나 매출증가율(YoY)과 부채비율은  아쉬움을 나타냈다. [종합 투자점수] [그림 3] 종합 투자점수 AI 인공지능 분석을 통한 누리플랜의 종목 종합 스코어는 75점을 기록했다. 이는 동일 업종 평균점수인 56점과 시장 평균점수인 56점를 상회하는 수치였다. (위의 AI인공지능 점수는 재무 데이터를 기반으로 전체 상장 종목과 비교/분석하여 도출한 점수로 높은 점수가 반드시 높은 수익률을 보장하지 않습니다. 위의 자료는 당사의 추천 종목이 아니며, 투자 시 참고용으로 제시해드리는 것입니다.) 라이온봇 기자 -한국경제TV※ 본 기사는 한국경제TV와 '거장들의 투자공식이'자체 개발한 '라이온봇 기자'가 실시간으로 작성한 기사입니다. 라이온봇기자 ⓒ 한국경제TV, 무단 전재 및 재배포 금지 한국경제TV 관련뉴스해당 언론사에서 선정하며 언론사 페이지(아웃링크)로 이동해 볼 수 있습니다.'억대 수입' 이사배, 과거 공개한 '럭셔리' 하우스 봤더니유병자 실손보험, 삼성화재 '가장 비싸'쏘가리 가격 '확' 떨어진다…22년 연구 끝에 '대량양식' 성공'PD수첩' 김학의 '별장 성접대 동영상' 재조명, 검찰수사 문제 많았다고 장자연-단역 자매 사건 재수사…""내가 노리개인가"""
파이낸셜뉴스,069140,/news/news_read.nhn?article_id=0004005178&office_id=014&mode=search&query=누리플랜&page=1,2018-04-19 09:19,"[특징주] 누리플랜, 남북경협 수혜 기대감에 '이틀 연속 상한가'","누리플랜이 남북관계 긴장 완화 수혜 기대감에 이틀 연속 상한가다. 19일 오전 9시 14분 현재 코스닥시장에서 누리플랜은 전 거래일 대비 가격제한폭(29.88%) 까지 치솟은 8780원에 거래되고 있다. 누리플랜은 전날에 이어 이날도 연이틀 상한가를 기록 중이다. 누리플랜은 경관 조명, 광섬유 LED 등 조명 시설을 주력으로 하는 업체다. 남북관계 개선 시 DMZ 평화공원 조성에 따른 수혜를 입을 것이란 기대감에 주가가 급등하고 있다는 분석이다."
