source,symbol,link,date,title,content
파이낸셜뉴스,069140,/news/news_read.nhn?article_id=0003788804&office_id=014&mode=search&query=누리플랜&page=1,2017-03-14 09:11,[fnRASSI]누리플랜(069140) 17.98% 상승,"누리플랜(069140)은 현재 주가가 전일 대비 17.98% 상승한 7,610원 선에서 거래가 이루어지고 있다. 상장주식수 대비 거래량은 0.34%로 적정수준 최근 한달간 누리플랜의 상장주식수 대비 거래량을 비교해보니 일별 매매회전율이 0.34%로 집계됐다. 그리고 동기간 장중 저점과 고점의 차이인 일평균 주가변동률을 4.49%를 나타내고 있다. 외국인, 기관 모두 보유량 증가 (5일 누적) 최근 5일간 동종목의 외국인 투자자는 1,991주 매수하였고 마찬가지로 기관은 940주 매수하였다. 전날 외국인 600주 매도, 기관940주 매수하며 보유 비율이 변동했다. 다음 표는 동종목의 외국인, 기관의 일별 순매수량을 나타낸 것이다. 'fnRASSI'는 증권전문 기업 씽크풀과 파이낸셜뉴스의 협업으로 로봇기자가 실시간으로 생산하는 기사입니다."
뉴시스,069140,/news/news_read.nhn?article_id=0007723300&office_id=003&mode=search&query=누리플랜&page=1,2017-01-19 15:54,누리플랜 &quot;손해배상 청구 소송 기각&quot;,"【서울=뉴시스】김주아 기자 = 금속공작물 제조업체 누리플랜(069140)은 박은용 외 11인이 자사를 상대로 제기한 손해배상 청구 소송에 대해 서울중앙지방법원이 기각 판결을 내렸다고 19일 공시했다. 법원은 ""원고들의 피고 누리플랜에 대한 각 청구는 각 이유없어 모두 기각한다""며 ""원고와 피고 사이에 생긴 소송비용은 원고들이 각자 부담한다""고 판결했다."
한국경제TV,069140,/news/news_read.nhn?article_id=0000627568&office_id=215&mode=search&query=누리플랜&page=1,2018-04-27 09:57,"누리플랜, 10% 급등... 전일 보다 710원 상승한 7,730원","[한국경제TV 라이온봇 기자] 누리플랜은 4월 27일 9시 56분 전일 대비 약 10% 급등한 7,730원에 거래되고 있다. 누리플랜은 코스닥 상장 기업으로 금속 업종에 속해 있다. 시가총액은 333억원으로 코스닥 상장기업 중 1,170위에 위치 해 있다. [종목 성향 진단] [그림 1] 종목 성향 진단 누리플랜의 투자 스타일은 가치주에 가깝다. 기업 가치 대비 낮은 주가가 매력적인 기업이다. 주가 모멘텀은 굉장히 좋은 편이었다. 최근 1개월 수익률이 무려 36.84%의 상승폭을 기록했다. 누리플랜 종목에 대한 투자자의 관심도는 평범한 수준이었다. [투자 점수 진단] [그림 2] 투자 점수 진단 누리플랜은 효율성(ROA) 측면에서 두각을 나타내고 있다. 최근 ROA는 93점으로 6개의 핵심 팩터 중 가장 높은 점수를 기록했다. ROA는  전체 시장 내 132위를 기록하며 상위 6.72%에 위치했다. 업종별로는 14위를 기록하며 상위 3.86%에 위치했다. 그리고 저평가성1(PER) 역시 도드라지는 편이다. 저평가성1 점수는 92점으로 두번째로 높은 점수를 기록했다. PER은 전체 시장 내 153위를 기록하며 상위 8.23%에 위치했다. 업종별로는 30위를 기록하며 상위 8.81%에 위치했다. 그러나 매출증가율(YoY)과 부채비율은  아쉬움을 나타냈다. [종합 투자점수] [그림 3] 종합 투자점수 AI 인공지능 분석을 통한 누리플랜의 종목 종합 스코어는 71점을 기록했다. 이는 동일 업종 평균점수인 59점과 시장 평균점수인 59점를 상회하는 수치였다. (위의 AI인공지능 점수는 재무 데이터를 기반으로 전체 상장 종목과 비교/분석하여 도출한 점수로 높은 점수가 반드시 높은 수익률을 보장하지 않습니다. 위의 자료는 당사의 추천 종목이 아니며, 투자 시 참고용으로 제시해드리는 것입니다.) 라이온봇 기자 -한국경제TV※ 본 기사는 한국경제TV와 '거장들의 투자공식이'자체 개발한 '라이온봇 기자'가 실시간으로 작성한 기사입니다. 라이온봇기자 ⓒ 한국경제TV, 무단 전재 및 재배포 금지 한국경제TV 관련뉴스해당 언론사에서 선정하며 언론사 페이지(아웃링크)로 이동해 볼 수 있습니다.왕빛나 서구적 몸매 비결…'20kg을 한 번에?'미국 '최악의 살인사건' 풀렸다…체포된 연쇄살인범 정체는?이명희 '임산부' 갑질, ""조선시대 노비 다루듯""박하선 '다이어트 성공' 인증샷 ""웰컴백 44사이즈""유병자 실손보험, 삼성화재 '가장 비싸'"
서울경제,069140,/news/news_read.nhn?article_id=0002993350&office_id=011&mode=search&query=누리플랜&page=1,2017-03-15 15:07,누리플랜 &quot;현저한 시황 변동 사유 없어&quot;,[서울경제] 누리플랜(069140)은 현저한 시황변동 관련 조회 공시 요구에 “별도로 공시할 정보가 없다”고 답했다.
아시아경제,069140,/news/news_read.nhn?article_id=0003915352&office_id=277&mode=search&query=누리플랜&page=1,2017-01-19 14:13,"누리플랜, 손해배상 청구소송 기각",[아시아경제 박선미 기자]누리플랜은 박은용 외 11인이 회사를 상대로 제기한 손해배상 청구소송에 대해 서울중앙지법이 기각 판결을 내렸다고 19일 공시했다.
서울경제,069140,/news/news_read.nhn?article_id=0003284082&office_id=011&mode=search&query=누리플랜&page=1,2018-04-30 09:30,"&lt;코&gt;누리플랜, 장중 신고가 돌파.. 8,990&rarr;9,130(▲140)","[서울경제] 오전 9시 28분 현재 누리플랜(069140) 이 9.34% 오른 9,130원(▲780)을 기록하며, 52주 신고가를 +140원 경신했다. 기존 52주 최고가는 2018년 04월 27일 기록한 8,990원이다. 체결강도는 92%로 강세 반전했다. 총매수체결량은 222,221주, 총매도체결량은 242,453주를 각각 기록했다.  (※ 체결강도(%) = (총매수체결량/총매도체결량)*100) 이 시각 현재 거래대금은 40억1,823만, 거래량은 47만7,365주를 기록하고 있으며, 수급측면으로는 52(매도):48(매수)의 매도우위를 보이고 있다. 거래일을 기준으로 최근 3일간 평균 거래량은 1백3십2만2천주, 60일 평균 거래량 2십만7천주로 최근 거래량이 큰 폭으로 증가하는 추세다."
이데일리,069140,/news/news_read.nhn?article_id=0003730897&office_id=018&mode=search&query=누리플랜&page=1,2017-01-19 13:50,"누리플랜, 손해배상 청구소송 기각",[이데일리 김기훈 기자] 누리플랜(069140)은 박은용 외 11인이 자사를 상대로 제기한 손해배상 청구소송에 대해 서울중앙지법이 기각 판결을 내렸다고 19일 공시했다. 소송비용 중 원고들과 피고 누리플랜 사이에 생긴 부분은 원고가 각 부담한다.
머니투데이,069140,/news/news_read.nhn?article_id=0003839006&office_id=008&mode=search&query=누리플랜&page=1,2017-03-15 14:21,누리플랜 &quot;주가급등 관련 공시할 정보 없어&quot;,"[머니투데이 최동수 기자] 누리플랜은 최근 주가급등과 관련한 조회공시에 대해 ""별도로 공시할 중요한 정보가 없다""고 15일 공시했다. textlinktopstart textlinktopend textlinkstart"
서울경제,069140,/news/news_read.nhn?article_id=0003284193&office_id=011&mode=search&query=누리플랜&page=1,2018-04-30 09:44,"&lt;코&gt;누리플랜, 전일 대비 7.43% 상승.. 일일회전율은 15.15% 기록","[서울경제] 누리플랜(069140) 은 30일 오전 9시 43분 현재 7.43% 오른 8,970원에 거래되고 있으며, 53(매도):47(매수)의 매도우위를 기록하고 있다. 거래대금은 61억4,624만, 거래량은 71만9,617주로 거래량회전율은 15.15%로 나타났다. 지난 1개월간 누리플랜은 상한가 1회, 상승 12회, 하락 13회를 기록했고, 주가수익률은 64.29% 표준편차는 6.61%를 기록했다. 이 기간 ' 금속업 ' 업종 평균 주가수익률은 7.77%로 나타났으며, 변동성은 1.37%를 기록했다. 이 시각 현재 ' 금속업 '은 3.23% 상승 중이며, 63(매도):37(매수)의 매도우위를 기록하고 있다."
한국경제TV,069140,/news/news_read.nhn?article_id=0000628282&office_id=215&mode=search&query=누리플랜&page=1,2018-04-30 09:55,"누리플랜, 전일 대비 약 6% 상승한 8,890원","[한국경제TV 라이온봇 기자] 누리플랜은 4월 30일 9시 54분 전일 대비 약 6% 상승한 8,890원에 거래되고 있다. 누리플랜은 코스닥 상장 기업으로 금속 업종에 속해 있다. 시가총액은 396억원으로 코스닥 상장기업 중 1,133위에 위치 해 있다. [종목 성향 진단] [그림 1] 종목 성향 진단 누리플랜의 투자 스타일은 가치주에 가깝다. 기업 가치 대비 낮은 주가가 매력적인 기업이다. 주가 모멘텀은 굉장히 좋은 편이었다. 최근 1개월 수익률이 무려 61.2%의 상승폭을 기록했다. 누리플랜 종목에 대한 투자자의 관심도는 굉장히 높은 편이다. [투자 점수 진단] [그림 2] 투자 점수 진단 누리플랜은 효율성(ROA) 측면에서 두각을 나타내고 있다. 최근 ROA는 93점으로 6개의 핵심 팩터 중 가장 높은 점수를 기록했다. ROA는  전체 시장 내 132위를 기록하며 상위 6.72%에 위치했다. 업종별로는 14위를 기록하며 상위 3.86%에 위치했다. 그리고 저평가성1(PER) 역시 도드라지는 편이다. 저평가성1 점수는 92점으로 두번째로 높은 점수를 기록했다. PER은 전체 시장 내 153위를 기록하며 상위 8.23%에 위치했다. 업종별로는 30위를 기록하며 상위 8.81%에 위치했다. 그러나 매출증가율(YoY)과 부채비율은  아쉬움을 나타냈다. [종합 투자점수] [그림 3] 종합 투자점수 AI 인공지능 분석을 통한 누리플랜의 종목 종합 스코어는 77점을 기록했다. 이는 동일 업종 평균점수인 58점과 시장 평균점수인 59점를 상회하는 수치였다. (위의 AI인공지능 점수는 재무 데이터를 기반으로 전체 상장 종목과 비교/분석하여 도출한 점수로 높은 점수가 반드시 높은 수익률을 보장하지 않습니다. 위의 자료는 당사의 추천 종목이 아니며, 투자 시 참고용으로 제시해드리는 것입니다.) 라이온봇 기자 -한국경제TV※ 본 기사는 한국경제TV와 '거장들의 투자공식이'자체 개발한 '라이온봇 기자'가 실시간으로 작성한 기사입니다. 라이온봇기자 ⓒ 한국경제TV, 무단 전재 및 재배포 금지 한국경제TV 관련뉴스해당 언론사에서 선정하며 언론사 페이지(아웃링크)로 이동해 볼 수 있습니다.바이오주 급락…증시 전문가들 ""저도 몰라요""홍지민 이어 서유리도 '홀쭉'…""4개월 만에 10kg 다이어트""이명희 '임산부' 갑질…""조선시대 노비 다루듯""美 '최악의 연쇄살인' 풀렸다…소름돋는 범인 정체왕빛나 서구적 몸매 비결…'20kg을 한 번에?'"
파이낸셜뉴스,069140,/news/news_read.nhn?article_id=0003800632&office_id=014&mode=search&query=누리플랜&page=1,2017-04-10 09:14,"[fnRASSI]누리플랜, 18.06% 오르며 거래량 증가","누리플랜(069140)의 현재 거래량이 최근 5거래일 거래량의 최고치를 경신하며 투자자들의 관심을 받고 있다. 그리고 누리플랜은 4일 연속 상승흐름을 보이며, 9시 5분 현재 18.06% 증가한 7,910원에 거래중이다. 퀀트 재무분석, 종합점수 12점으로 상승                    지표               항목               값               종합점수                 성장성               매출액증가율               -0.59               3.95                 자기자본증가율               0.07                 안정성               부채비율               74.24               6.33                 유동비율               131.05                 이익안정성               6.11                 수익성               ROA               -4.78               1.83                 ROE               -8.34                 영업이익율               0.1          누리플랜의 퀀트 재무 점수는 12.11점으로 3개월 이전 11.5점보다 올랐다. 지난 분기에 비해 성장성 점수가 상승했다. 이는 자기자본 증가율이 증가하였기 때문이다. 실적 안정성이 개선되어 안정성 종합 점수는 상승했다. 수익성 측면에서 볼때 ROA, ROE가 하락하여 이전보다 낮은 점수를 받았다. 상장주식수 대비 거래량은 4.9%로 적정수준 최근 한달간 누리플랜의 상장주식수 대비 거래량을 비교해보니 일별 매매회전율이 4.9%로 집계됐다. 그리고 동기간 장중 저점과 고점의 차이인 일평균 주가변동률을 3.7%를 나타내고 있다. 'fnRASSI'는 증권전문 기업 씽크풀과 파이낸셜뉴스의 협업으로 로봇기자가 실시간으로 생산하는 기사입니다."
파이낸셜뉴스,069140,/news/news_read.nhn?article_id=0004011991&office_id=014&mode=search&query=누리플랜&page=1,2018-04-30 10:21,"[fnRASSI]누리플랜(069140), 52주 신고가 경신...5.51% &uarr;","누리플랜(069140)은 52주신고가를 기록하고 있어 주목할만하다. 동종목의 현재 주가는 8,810원 선에서 이루어지고 있다. 거래일을 기준으로 최근 3일간 평균 거래량은 167만 주이다. 이는 60일 일 평균 거래량 22만 주와 비교해보면 최근 거래량이 급격히 늘어났다는 것을 알 수 있다. 외국인, 기관 모두 보유량 감소 (5일 누적) 최근 5일간 동종목의 외국인 투자자는 37,015주 순매도하였고 마찬가지로 기관은 3,292주 순매도하였다. 전날 두 주체 각각 1,878주, 3,292주 순매도하며 보유 비율을 줄였다. 다음 표는 동종목의 외국인, 기관의 일별 순매수량을 나타낸 것이다. 퀀트 재무분석, 종합점수 18점으로 상승                    지표               항목               값               종합점수                 성장성               매출액증가율               0.03               5.04                 자기자본증가율               -0.02                 안정성               부채비율               76.95               6.44                 유동비율               118.59                 이익안정성               6.94                 수익성               ROA               0.06               2.99                 ROE               0.1                 영업이익율               1.24          누리플랜의 퀀트 재무 점수는 14.47점으로 3개월 이전 11.21점보다 올랐다. 지난 분기에 비해 성장성 점수가 상승했다. 이는 매출액 증가율과 자기자본 증가율이 증가하였기 때문이다. 실적 안정성이 개선되어 안정성 종합 점수는 상승했다. 수익성 측면에서 볼때 ROA, ROE, 영업이익률 모두 개선되어 이전보다 좋은 점수를 받았다. 'fnRASSI'는 증권전문 기업 씽크풀과 파이낸셜뉴스의 협업으로 로봇기자가 실시간으로 생산하는 기사입니다."
파이낸셜뉴스,069140,/news/news_read.nhn?article_id=0003800865&office_id=014&mode=search&query=누리플랜&page=1,2017-04-10 13:39,[fnRASSI]누리플랜(069140) 현재 +10.45%,"현재 누리플랜(069140)은 전일대비 10.45% 상승하여 7,400원 선에서 거래가 이루어지고 있다. 상장주식수 대비 거래량은 4.9%로 적정수준 최근 한달간 누리플랜의 상장주식수 대비 거래량을 비교해보니 일별 매매회전율이 4.9%로 집계됐다. 그리고 동기간 장중 저점과 고점의 차이인 일평균 주가변동률을 3.7%를 나타내고 있다. 외국인, 기관 모두 보유량 증가 (5일 누적) 최근 5일간 동종목의 외국인 투자자는 11,372주 순매수하였고 마찬가지로 기관은 0주 순매수하였다. 전날 외국인은 199주 순매도했지만 기관은 순매수량이 0으로 보유비율 그대로 유지했다. 다음 표는 동종목의 외국인, 기관의 일별 순매수량을 나타낸 것이다. 'fnRASSI'는 증권전문 기업 씽크풀과 파이낸셜뉴스의 협업으로 로봇기자가 실시간으로 생산하는 기사입니다."
서울경제,069140,/news/news_read.nhn?article_id=0003282314&office_id=011&mode=search&query=누리플랜&page=1,2018-04-27 09:31,"&lt;코&gt;누리플랜, 전일 대비 16.38% 상승.. 일일회전율은 15.59% 기록","[서울경제] 누리플랜(069140) 은 27일 오전 9시 30분 현재 16.38% 오른 8,170원에 거래되고 있으며, 48(매도):52(매수)의 매수우위를 기록하고 있다. 거래대금은 59억4,939만, 거래량은 74만676주로 거래량회전율은 15.59%로 나타났다. 지난 1개월간 누리플랜은 상한가 1회, 상승 12회, 하락 13회를 기록했고, 주가수익률은 51.02% 표준편차는 5.77%를 기록했다. 이 기간 ' 금속업 ' 업종 평균 주가수익률은 5.47%로 나타났으며, 변동성은 1.37%를 기록했다. 이 시각 현재 ' 금속업 '은 0.87% 상승 중이며, 48(매도):52(매수)의 매수우위를 기록하고 있다."
서울경제,069140,/news/news_read.nhn?article_id=0003307681&office_id=011&mode=search&query=누리플랜&page=1,2018-05-28 10:43,"&lt;코&gt;누리플랜, 전일 대비 19.62% 상승.. 일일회전율은 2.13% 기록","[서울경제] 누리플랜(069140) 은 28일 오전 10시 42분 현재 19.62% 오른 7,500원에 거래되고 있으며, 49(매도):51(매수)의 매수우위를 기록하고 있다. 거래대금은 7억2,605만, 거래량은 10만1,043주로 거래량회전율은 2.13%로 나타났다. 지난 1개월간 누리플랜은 상한가 1회, 상승 15회, 하락 13회를 기록했고, 주가수익률은 46.20% 표준편차는 8.23%를 기록했다. 이 기간 ' 금속업 ' 업종 평균 주가수익률은 17.07%로 나타났으며, 변동성은 2.61%를 기록했다. 이 시각 현재 ' 금속업 '은 8.82% 상승 중이며, 56(매도):44(매수)의 매도우위를 기록하고 있다."
아시아경제,069140,/news/news_read.nhn?article_id=0003953623&office_id=277&mode=search&query=누리플랜&page=1,2017-03-15 14:25,"누리플랜, &quot;주가 급증, 공시할 중요한 정보 없어&quot;","[아시아경제 임혜선 기자]누리플랜은 주가급등 관련 조회공시 답변으로 ""별도로 공시할 중요한 정보가 없다""고 15일 밝혔다."
머니투데이,069140,/news/news_read.nhn?article_id=0003784365&office_id=008&mode=search&query=누리플랜&page=1,2016-12-05 14:28,"[더벨]누리플랜, 도시경관 &rarr; 디지털 미디어월로 시장 확대","[더벨 김세연 기자] [LED 건축조명 시장 역량 강화…재난안전 시설 분야 진출] 더벨|이 기사는 12월05일(14:23) 자본시장 미디어 '머니투데이 thebell'에 출고된 기사입니다. 누리플랜이 스마트글라스 전문기업 파워글라스글로벌을 인수키로 하며 배경과 인수효과에 관심이 모아지고 있다. 업계에서는 일단 사업 다각화를 추진해온 누리플랜이 기존 주력사업과 시너지가 큰 성장 동력을 발굴했다는 점에서 긍정적이란 평가를 내리고 있다. ◇LED조명 활용…경관조명 시장 시너지 극대화 1998년 J기획으로 설립된 파워글라스글로벌은 설립 초기 산업현장내 안전사고를 예방하는 세계 최초 홀로그램 허공영상 버튼, 세계 최초 네트워크 솔루션, 영상분배장치 등을 개발하며 기술력을 인정받은 기술개발 기업이다. 이후 파워글라스글로벌은 무선 LED기술 기업인 독일 글라스플라츠와 파워글라스 독점 공급 및 아시아 생산기지 설립 계약을 체결하고 2013년 사명을 변경하며 본격 투명 유리 발광다이오드(LED)패널 개발에 나서왔다. 파워글라스는 산화인듐(ITO) 코팅 처리를 통해 전도성을 지닌 유리에 발광다이오드LED를 삽입해 빛을 발하는 전광유리로 문자, 이미지, 동영상 등을 표출할 수 있는 미디어월로 활용이 가능한 건축자재다. 파워글라스글로벌이 개발한 미디어월은 LED칩을 무선으로 개별 콘트롤해 텍스트와 동영상 구현을 가능케한 양방향 미디어로 건축 외부와 다양한 커뮤니케이션이 가능하다는 점에서 최근 각광을 받고 있다. 조두희 파워글라스글로벌 사장은 ""세계적으로 인정받는 원조기술을 보유한 파워글라스코리아는 기술 완벽주의에 바탕을 두고 지난 10여년 동안 약 200여건 이상의 프로젝트를 진행해 왔다""며 ""시장내 성능을 입증받은 유일한 파워글라스를 공급해 온 파워글라스글로벌이 누리플랜을 통해 동반 성장 기반을 마련했다""고 말했다. 이어 ""누리플랜의 새로운 식구로 보다 공격적인 마케팅이 가능해진 만큼 국내는 물론 일본, 홍콩, 및 중동시장 등 해외 시장을 집중 공략해 나갈 것""이라고 덧붙였다. 업계에서는 누리플랜의 파워글라스글로벌 인수가 도시경관 분야의 새로운 트렌드를 주도할 수 있는 최적의 선택이라는 평가다. 빠르게 진화하는 도시경관 사업분야에서 디지털 미디어월 분야로의 진출을 통해 기존 경관조명 사업의 또 다른 확장을 이끌 수 있는 기반을 갖췄기 때문이다. 업계 관계자는 ""현재 건축 시장은 콘크리트 등을 통해 외부와 완전한 차단을 고려하는 것에서 벗어나 시인성이 좋은 판유리를 내외장재로 채택하는 등 트렌드 변화가 이어지고 있다""며 ""LED 디스플레이를 통해 자유로운 연출이 가능한 파워글라스는 판유리 시장의 또 다른 대안이 될 것""이라고 전망했다. ◇파워글라스 적용 '재난안전 승강문' 주목 누리플랜은 지난 2000년대 초반부터 도시 경관시설 및 조명분야 선두 기업으로 자리 매김해 왔다. 16개 한강 교량중 14개에 대한 관련 사업을 추진하는 등 다양한 공공 프로젝트를 수행해온 누리플랜은 자체 디자인 연구소를 갖추고 제품 개발 기획에서부터 시공, 생산, 설계 등 경관조명 분야의 일환화된 원스톱 사업구조도 갖추고 있다. 누리플랜의 파워글라스글로벌 인수는 설립 초기부터 꾸준히 관심을 가져온 LED조명 시장의 성장 기대에 따른 것이다. 누리플랜은 2000년대 초반부터 LED조명을 이용한 건축조명을 업계의 새로운 흐름으로 제시했다. LED를 활용한 다양한 효과 연출이 대부분의 건축시장에서 활용될 수 있다는 분석에서다. 이번 인수로 누리플랜은 기존 건물과 교량 등의 특성에 맞춘 경관 조명분야는 물론 특수판 유리인 '파워글라스'를 통해 미디어 월 등 다양한 건축 내외장재 분야로의 확장이 가능해졌다. 이규홍 누리플랜 대표이사는 ""기존 경관조명 사업은 각 지자체 및 공공기관을 중심으로 이루어져 왔다""며 ""파워글라스라는 신제품을 통해 공공기관 뿐 아니라 일반 건설사에 대한 영업도 활발하게 이뤄질 것으로 판단돼 공격적 영업에 나설 것""이라고 말했다. 일단 누리플랜은 파워글라스가 재난안전 분야에서 활용도가 높은 만큼 재난안전 승강문과 자동문, 테이블 스탠드 등의 새로운 제품을 선보인다는 목표다. 파워글라스글로벌이 개발에 성공한 파워글라스 적용 자동문이 양방향 뮤니케이션이 가능한 제품인 만큼 화재나 긴급상황 발생의 경우 안전한 대피로 확보와 이동 지시용으로 활용도가 높다는 평가에서다. 파워글라스 자동문은 최근 굿디자인(GD)를 획득하며 시장 확대 가능성도 높이고 있다. 누리플랜은 기존 네트워크를 활용해 본격적으로 국내외 시장에서 파워글라스글로벌이 개발한 제품 판매와 적용을 확대할 계획이다. 파워글라스글로벌이 이미 지난 8월 일본에 파워글라스제팬을 설립하고 홍콩 기업과 공급계약을 체결하는 등 해외 영업 활동도 강화하고 있어 누리플랜과 동반 진출 가능성도 높다는 분석이다. textlinktopstart textlinktopend textlinkstart"
머니투데이,069140,/news/news_read.nhn?article_id=0003726183&office_id=008&mode=search&query=누리플랜&page=1,2016-08-12 12:31,"누리플랜, 2분기 영업이익 7억9061만원","[머니투데이 유엄식 기자] 누리플랜은 올해 2분기 실적이 매출액 136억9023만3817원, 영업이익 7억9061만2903원, 당기순이익 32억2670만239원으로 잠정 집계됐다고 12일 공시했다. textlinktopstart textlinktopend textlinkstart"
머니투데이,069140,/news/news_read.nhn?article_id=0003878226&office_id=008&mode=search&query=누리플랜&page=1,2017-05-25 16:43,"누리플랜, 4억원 규모 신주인수권 행사","[머니투데이 강기준 기자] 누리플랜은 4억원 규모의 신주인수권을 행사했다고 25일 공시했다. 무기명식 무보증 분리형 신주인수권 부사채를 지난 23일 2억원 규모, 25일 2억원 규모로 각각 행사했다. 신주인수권 행사가액은 6625원이다. textlinktopstart textlinktopend textlinkstart"
