source,symbol,link,date,title,content
머니투데이,069140,/news/news_read.nhn?article_id=0003784363&office_id=008&mode=search&query=누리플랜&page=1,2016-12-05 14:28,"[더벨]누리플랜, 파워글라스 인수&hellip;특수 전광유리시장 진출","[더벨 김세연 기자] [투명 유리 LED 패널 기술 기반 사업 시너지 기대] 더벨|이 기사는 12월05일(14:16) 자본시장 미디어 '머니투데이 thebell'에 출고된 기사입니다. 경관조명 전문기업 누리플랜이 투명 유리 발광다이오드(LED) 패널 개발기업 파워글라스글로벌을 인수했다. 주력 경관 조명 사업과의 시너지를 기대한 사업 다각화의 일환이다. 누리플랜은 최근 조두희 파워글라스글로벌 대표이사가 보유한 지분 100%를 인수했다고 5일 밝혔다. 양측간 합의에 따라 구체적인 인수 규모는 알려지지 않았다. 1998년 설립된 파워글라스글로벌은 자유로운 디자인 연출이 가능해 외장유리, 간판, 미디어월 등 디지털 디스플레이를 활용한 디지털 사이니지 관련 건축 내외장제로 각광을 받고 있는 파워글라스를 시장에 선보여 왔다. 파워글라스란 2개의 투명 유리판에 무선으로 LED를 부착시켜 빛을 발산하는 특수 판유리 제품이다. 유리의 투명성과 LED조명, 동영상 구동 등의 조건을 동시에 만족시킬 수 있는 하이테크 제품으로 건축 및 경관 조명시장에서 다양한 활용이 가능하다. 누리플랜은 파워글라스글로벌의 인수로 경관조명 분야에서 국내 수위 기업 지위를 강화할 수 있는 성장동력을 확보했다는 평가를 받게 됐다. 누리플랜은 양사의 조직 인력 등의 운영 효율성을 이끌어 상호 역량을 보완하고 대외 경쟁력을 높여나간다는 계획이다. 이규홍 누리플랜 대표이사는  ""인수를 통해 진화하는 도시경관 시장에 발 맞춰 파워글라스라는 첨단 아이템을 사업분야로 확보할 수 있게 됐다""며 ""파워글라스글로벌은 수 십 년간 국내외 도시경관사업을 이끌어 온 누리플랜의 사업 다각화에 큰 역할을 할 것""이라고 말했다. 이어 ""기존 사업분야에 즉시 적용이 가능한 아이템인 만큼 빠른 시일 내 매출증대도 기대된다""며 ""도시경관 업계의 선두주자로 업계의 트렌드를 선도하는 기업으로서의 지위를 지속적으로 확대해 나갈 것""이라고 덧붙였다. textlinktopstart textlinktopend textlinkstart"
파이낸셜뉴스,069140,/news/news_read.nhn?article_id=0003778268&office_id=014&mode=search&query=누리플랜&page=1,2017-02-17 11:22,"[fnRASSI]누리플랜, 거래량 확대되며 3거래일 연속 하락","누리플랜(069140)의 현재 거래량이 최근 5거래일 거래량의 최고치를 넘어섰다. 그리고 현재 0.34% 내린 5,840원에 거래중이며 3일 연속 하락흐름을 보이고 있다. 외국인/기관 순매수, 개인은 순매도(한달누적)  2월9일부터 전일까지 기관이 4거래일 연속 순매도를 보였다. 4주간을 기준으로 보면 외국인이 순매수량을 늘리며 1,474주를 순매수했고, 기관도 초반에 동종목을 순매수한 이후에 기세를 이어가며 11,541주를 순매수했다. 반면 개인들은 매도 관점으로 접근하면서 13,015주를 순매도한 것으로 나타났다. 외국인 보유량 증가, 기관 감소 (5일 누적) 최근 5일간 동종목의 외국인 투자자는 390주 매수하였고 반면 기관은 780주 매도하였다. 전날 두 주체 각각 71주, 780주 순매도하며 보유 비율을 줄였다. 다음 표는 동종목의 외국인, 기관의 일별 순매수량을 나타낸 것이다. 'fnRASSI'는 증권전문 기업 씽크풀과 파이낸셜뉴스의 협업으로 로봇기자가 실시간으로 생산하는 기사입니다."
한국경제TV,069140,/news/news_read.nhn?article_id=0000627623&office_id=215&mode=search&query=누리플랜&page=1,2018-04-27 10:55,"누리플랜, 52주 신고가 경신... 전일 대비 26% 상승","[한국경제TV 라이온봇 기자] 누리플랜은 52주 신고가를 경신했다. 누리플랜은 4월 27일 10시 54분 전일 대비 약 26% 상승한 8,830원에 거래되고 있다. 누리플랜은 코스닥 상장 기업으로 금속 업종에 속해 있다. 시가총액은 333억원으로 코스닥 상장기업 중 1,170위에 위치 해 있다. [종목 성향 진단] [그림 1] 종목 성향 진단 누리플랜의 투자 스타일은 가치주에 가깝다. 기업 가치 대비 낮은 주가가 매력적인 기업이다. 주가 모멘텀은 굉장히 좋은 편이었다. 최근 1개월 수익률이 무려 36.84%의 상승폭을 기록했다. 누리플랜 종목에 대한 투자자의 관심도는 평범한 수준이었다. [투자 점수 진단] [그림 2] 투자 점수 진단 누리플랜은 효율성(ROA) 측면에서 두각을 나타내고 있다. 최근 ROA는 93점으로 6개의 핵심 팩터 중 가장 높은 점수를 기록했다. ROA는  전체 시장 내 132위를 기록하며 상위 6.72%에 위치했다. 업종별로는 14위를 기록하며 상위 3.86%에 위치했다. 그리고 저평가성1(PER) 역시 도드라지는 편이다. 저평가성1 점수는 92점으로 두번째로 높은 점수를 기록했다. PER은 전체 시장 내 153위를 기록하며 상위 8.23%에 위치했다. 업종별로는 30위를 기록하며 상위 8.81%에 위치했다. 그러나 매출증가율(YoY)과 부채비율은  아쉬움을 나타냈다. [종합 투자점수] [그림 3] 종합 투자점수 AI 인공지능 분석을 통한 누리플랜의 종목 종합 스코어는 71점을 기록했다. 이는 동일 업종 평균점수인 59점과 시장 평균점수인 59점를 상회하는 수치였다. (위의 AI인공지능 점수는 재무 데이터를 기반으로 전체 상장 종목과 비교/분석하여 도출한 점수로 높은 점수가 반드시 높은 수익률을 보장하지 않습니다. 위의 자료는 당사의 추천 종목이 아니며, 투자 시 참고용으로 제시해드리는 것입니다.) 라이온봇 기자 -한국경제TV※ 본 기사는 한국경제TV와 '거장들의 투자공식이'자체 개발한 '라이온봇 기자'가 실시간으로 작성한 기사입니다. 라이온봇기자 ⓒ 한국경제TV, 무단 전재 및 재배포 금지 한국경제TV 관련뉴스해당 언론사에서 선정하며 언론사 페이지(아웃링크)로 이동해 볼 수 있습니다.왕빛나 서구적 몸매 비결…'20kg을 한 번에?'미국 '최악의 살인사건' 풀렸다…체포된 연쇄살인범 정체는?이명희 '임산부' 갑질, ""조선시대 노비 다루듯""박하선 '다이어트 성공' 인증샷 ""웰컴백 44사이즈""유병자 실손보험, 삼성화재 '가장 비싸'"
서울경제,069140,/news/news_read.nhn?article_id=0003282488&office_id=011&mode=search&query=누리플랜&page=1,2018-04-27 10:40,"&lt;코&gt;누리플랜, 장중 신고가 돌파.. 8,810&rarr;8,880(▲70)","[서울경제] 오전 10시 38분 현재 누리플랜(069140) 이 26.50% 오른 8,880원(▲1,860)을 기록하며, 52주 신고가를 +70원 경신했다. 기존 52주 최고가는 2017년 07월 06일 기록한 8,810원이다. 체결강도는 119%로 강세를 유지했다. 총매수체결량은 790,902주, 총매도체결량은 667,371주를 각각 기록했다.  (※ 체결강도(%) = (총매수체결량/총매도체결량)*100) 이 시각 현재 거래대금은 121억9,528만, 거래량은 150만3,737주를 기록하고 있으며, 수급측면으로는 46(매도):54(매수)의 매수우위를 보이고 있다. 거래일을 기준으로 최근 3일간 평균 거래량은 3십4만5천주, 60일 평균 거래량 1십5만4천주로 최근 거래량이 큰 폭으로 증가하는 추세다."
아시아경제,069140,/news/news_read.nhn?article_id=0003929233&office_id=277&mode=search&query=누리플랜&page=1,2017-02-09 16:09,"누리플랜, 작년 영업익 7억2598만원&hellip;전년比 40.9%&darr;",[아시아경제 최동현 기자] 누리플랜은 지난해 영업이익이 7억2598만원으로 전년 대비 40.9% 줄었다고 9일 공시했다. 같은 기간 매출은 344억원으로 7.1% 증가했으며 당기순이익은 22억원으로 129.9% 늘었다.
파이낸셜뉴스,069140,/news/news_read.nhn?article_id=0004010780&office_id=014&mode=search&query=누리플랜&page=1,2018-04-27 11:07,"[fnRASSI]누리플랜(069140), 52주 신고가...23.93% &uarr;","누리플랜(069140)은 52주신고가를 기록하고 있어 주목할만하다. 동종목의 현재 주가는 8,700원 선에서 이루어지고 있다. 거래일을 기준으로 최근 3일간 평균 거래량은 88만 주이다. 이는 60일 일 평균 거래량 18만 주와 비교해보면 최근 거래량이 급격히 늘어났다는 것을 알 수 있다. 거래비중은 개인투자자가 가장 높아 최근 한달간 주체별 거래비중을 살펴보면 개인이 96.63%, 외국인이 2.76%, 기관은 0.6%를 기록했다. 그리고 최근 5일간 거래비중은 개인이 95.5%로 가장 높은 참여율을 보였고, 외국인이 4.42%를 보였으며 기관은 0.06%를 나타냈다. 퀀트 재무분석, 종합점수 19점으로 상승                    지표               항목               값               종합점수                 성장성               매출액증가율               0.03               5.04                 자기자본증가율               -0.02                 안정성               부채비율               76.95               6.44                 유동비율               118.59                 이익안정성               6.94                 수익성               ROA               0.06               2.99                 ROE               0.1                 영업이익율               1.24          누리플랜의 퀀트 재무 점수는 14.47점으로 3개월 이전 11.21점보다 올랐다. 지난 분기에 비해 성장성 점수가 상승했다. 이는 매출액 증가율과 자기자본 증가율이 증가하였기 때문이다. 실적 안정성이 개선되어 안정성 종합 점수는 상승했다. 수익성 측면에서 볼때 ROA, ROE, 영업이익률 모두 개선되어 이전보다 좋은 점수를 받았다. 'fnRASSI'는 증권전문 기업 씽크풀과 파이낸셜뉴스의 협업으로 로봇기자가 실시간으로 생산하는 기사입니다."
연합뉴스,069140,/news/news_read.nhn?article_id=0009107052&office_id=001&mode=search&query=누리플랜&page=1,2017-03-14 17:15,"거래소, 누리플랜&middot;특수건설에 급등 조회공시 요구",(서울=연합뉴스) 조민정 기자 = 한국거래소 코스닥시장본부는 14일 누리플랜과 특수건설에 최근의 현저한 시황변동(주가급등)과 관련해 공시규정상 중요공시사항이 있는지 조회공시를 요구했다. 답변시한은 15일 오후 6시까지다.
한국경제TV,069140,/news/news_read.nhn?article_id=0000627567&office_id=215&mode=search&query=누리플랜&page=1,2018-04-27 09:56,"누리플랜, 전일 대비 약 9% 상승한 7,680원","[한국경제TV 라이온봇 기자] 누리플랜은 4월 27일 9시 55분 전일 대비 약 9% 상승한 7,680원에 거래되고 있다. 누리플랜은 코스닥 상장 기업으로 금속 업종에 속해 있다. 시가총액은 333억원으로 코스닥 상장기업 중 1,170위에 위치 해 있다. [종목 성향 진단] [그림 1] 종목 성향 진단 누리플랜의 투자 스타일은 가치주에 가깝다. 기업 가치 대비 낮은 주가가 매력적인 기업이다. 주가 모멘텀은 굉장히 좋은 편이었다. 최근 1개월 수익률이 무려 36.84%의 상승폭을 기록했다. 누리플랜 종목에 대한 투자자의 관심도는 평범한 수준이었다. [투자 점수 진단] [그림 2] 투자 점수 진단 누리플랜은 효율성(ROA) 측면에서 두각을 나타내고 있다. 최근 ROA는 93점으로 6개의 핵심 팩터 중 가장 높은 점수를 기록했다. ROA는  전체 시장 내 132위를 기록하며 상위 6.72%에 위치했다. 업종별로는 14위를 기록하며 상위 3.86%에 위치했다. 그리고 저평가성1(PER) 역시 도드라지는 편이다. 저평가성1 점수는 92점으로 두번째로 높은 점수를 기록했다. PER은 전체 시장 내 153위를 기록하며 상위 8.23%에 위치했다. 업종별로는 30위를 기록하며 상위 8.81%에 위치했다. 그러나 매출증가율(YoY)과 부채비율은  아쉬움을 나타냈다. [종합 투자점수] [그림 3] 종합 투자점수 AI 인공지능 분석을 통한 누리플랜의 종목 종합 스코어는 71점을 기록했다. 이는 동일 업종 평균점수인 59점과 시장 평균점수인 59점를 상회하는 수치였다. (위의 AI인공지능 점수는 재무 데이터를 기반으로 전체 상장 종목과 비교/분석하여 도출한 점수로 높은 점수가 반드시 높은 수익률을 보장하지 않습니다. 위의 자료는 당사의 추천 종목이 아니며, 투자 시 참고용으로 제시해드리는 것입니다.) 라이온봇 기자 -한국경제TV※ 본 기사는 한국경제TV와 '거장들의 투자공식이'자체 개발한 '라이온봇 기자'가 실시간으로 작성한 기사입니다. 라이온봇기자 ⓒ 한국경제TV, 무단 전재 및 재배포 금지 한국경제TV 관련뉴스해당 언론사에서 선정하며 언론사 페이지(아웃링크)로 이동해 볼 수 있습니다.왕빛나 서구적 몸매 비결…'20kg을 한 번에?'미국 '최악의 살인사건' 풀렸다…체포된 연쇄살인범 정체는?이명희 '임산부' 갑질, ""조선시대 노비 다루듯""박하선 '다이어트 성공' 인증샷 ""웰컴백 44사이즈""유병자 실손보험, 삼성화재 '가장 비싸'"
머니투데이,069140,/news/news_read.nhn?article_id=0003838500&office_id=008&mode=search&query=누리플랜&page=1,2017-03-14 17:21,"[조회공시]누리플랜, 주가급등 관련",[머니투데이 권혜민 기자] 코스닥시장본부는 14일 누리플랜에 최근의 현저한 시황변동(주가급등) 관련 공시 규정상 중요 공시사항 유무에 대한 조회공시를 요구했다. 답변시한은 15일 오후 6시까지다. textlinktopstart textlinktopend textlinkstart
한국경제TV,069140,/news/news_read.nhn?article_id=0000677535&office_id=215&mode=search&query=누리플랜&page=1,2018-08-31 14:56,"누리플랜, 전일 대비 약 4% 상승한 5,650원","[한국경제TV 라이온봇 기자] [그림 1] 최근 3개월 간 주가 추세 및 기간별 수익률 누리플랜은 8월 31일 14시 55분 전일 대비 약 4% 상승한 5,650원에 거래되고 있다. 누리플랜은 코스닥 상장 기업으로 금속 업종에 속해 있다. 시가총액은 257억원으로 코스닥 상장기업 중 1,211위에 위치 해 있다. [종목 성향 진단] [그림 2] 종목 성향 진단 누리플랜의 투자 스타일은 가치주에 가깝다. 기업 가치 대비 낮은 주가가 매력적인 기업이다. 주가 모멘텀은 부진한 편이었다. 최근 3개월 수익률은 -16.74%의 하락폭을 기록했다. 최근 1개월 수익률 또한 -0.55% 하락하며 부진한 모멘텀을 이어가고 있다. 누리플랜 종목에 대한 투자자의 관심도는 상대적으로 낮은 편이었다. [투자 점수 진단] [그림 3] 투자 점수 진단 누리플랜은 어느 측면에서 투자 매력도가 높은 종목일까? AI 인공지능 종목 분석 시스템을 이용해 성장성, 수익성, 효율성, 안전성, 저평가성, 추세 등 주가 수익률에 영향을 줄 수 있는 6가지 핵심 투자 지표를 점수화하여 종목의 투자 매력도를 계산해보았다. 그 결과 누리플랜은 상대적으로 효율성 측면에서 두각을 드러내고 있었다. 효율성 점수는 기업의 자산 활용이 얼마나 효율적으로 이뤄지고 있는가를 나타낸다. 누리플랜은 특히 재고자산회전율 측면에서 가장 높은 점수는 기록했는데, 전체 시장 내 253위를 기록하며 상위 13.76%에 위치했다. 업종별로는 72위를 기록하며 상위 21.45%에 위치했다. 그러나 주가 상승 모멘텀을 나타내는 추세 측면에서는 아쉬움을 나타냈다. (위의 AI인공지능 점수는 재무 데이터를 기반으로 전체 상장 종목과 비교/분석하여 도출한 점수로 높은 점수가 반드시 높은 수익률을 보장하지 않습니다. 위의 자료는 당사의 추천 종목이 아니며, 투자 시 참고용으로 제시해드리는 것입니다. 핵심투자지표를 결합해 종목의 투자매력도를 종합 계산한 ""인공지능 투자점수""는 ""거장들의 투자공식"" 앱에서 확인하실 수 있습니다.) 라이온봇 기자 -한국경제TV※ 본 기사는 한국경제TV와 '거장들의 투자공식이'자체 개발한 '라이온봇 기자'가 실시간으로 작성한 기사입니다. 라이온봇기자"
이데일리,069140,/news/news_read.nhn?article_id=0003772461&office_id=018&mode=search&query=누리플랜&page=1,2017-03-14 17:24,"거래소, 누리플랜에 주가 급등 관련 조회 공시",[이데일리 최정희 기자] 한국거래소 코스닥시장본부는 누리플랜(069140)에 주가 급등과 관련해 조회 공시를 요구했다. 답변 시한은 15일 오후 6시까지다.
파이낸셜뉴스,069140,/news/news_read.nhn?article_id=0003789008&office_id=014&mode=search&query=누리플랜&page=1,2017-03-14 13:05,[fnRASSI]누리플랜(069140) 전일대비 29.92% 상승,"누리플랜(069140)은 현재 주가가 전일 대비 29.92% 상승한 8,380원 선에서 거래가 이루어지고 있다. 외국인, 기관 모두 보유량 증가 (5일 누적) 최근 5일간 동종목의 외국인 투자자는 1,991주 매수하였고 마찬가지로 기관은 940주 매수하였다. 전날 외국인 600주 매도, 기관940주 매수하며 보유 비율이 변동했다. 다음 표는 동종목의 외국인, 기관의 일별 순매수량을 나타낸 것이다. 상장주식수 대비 거래량은 0.34%로 적정수준 최근 한달간 누리플랜의 상장주식수 대비 거래량을 비교해보니 일별 매매회전율이 0.34%로 집계됐다. 그리고 동기간 장중 저점과 고점의 차이인 일평균 주가변동률을 4.49%를 나타내고 있다. 'fnRASSI'는 증권전문 기업 씽크풀과 파이낸셜뉴스의 협업으로 로봇기자가 실시간으로 생산하는 기사입니다."
파이낸셜뉴스,069140,/news/news_read.nhn?article_id=0004016912&office_id=014&mode=search&query=누리플랜&page=1,2018-05-08 15:38,"[fnRASSI]장마감, 코스닥 하락 종목(누리플랜 -18.1%&darr;)","8일 코스닥 시장에서 하락한 종목으로 누리플랜(069140) -18.1%, 에이치엘비(028300) -16.98%, 우리기술(032820) -16.48% 등이 있다. 'fnRASSI'는 증권전문 기업 씽크풀과 파이낸셜뉴스의 협업으로 로봇기자가 실시간으로 생산하는 기사입니다."
한국경제,069140,/news/news_read.nhn?article_id=0003940892&office_id=015&mode=search&query=누리플랜&page=1,2018-05-17 09:42,"[누리플랜] 5% 이상 상승, 외국계 증권사 창구의 거래비중 9% 수준","누리플랜이 장 초반 부터 전일 대비 +5%이상 상승하고 있다. 17일 오전 09시 39분 누리플랜은 전 거래일보다 5.16% 오른 7,330원에 거래되고 있다. 주가의 흐름을 살펴보면 7,140원으로 개장해서 장중 한때 7,010원(+0.57%)까지 살짝 밀렸지만, 상승 반전해서 현재 7,330원(+5.16%)까지 소폭 상승하고 있다. ◆ 거래원 동향 - 외국계 증권사 창구의 거래비중 9% 수준 메릴린치가 매수상위 창구 3위를 기록중이고, 그 외에 미래에셋, NH투자 등이 매수 창구 상위에 위치하고 있다. 지금까지 외국계(추정) 증권사 창구를 통한 거래 비중은 9% 수준이다. 그리고 이 시간 메릴린치가 매수창구상위에 올라있는 종목은 이 종목 이외에도 명문제약, 이수화학 등이 있다. [표]누리플랜 거래원 동향 ◆ 주체별 매매동향 - 최근 5일간 외국인 대량 순매수 지난 한달을 기준으로 보면 외국인이 7.6만주를 순매수했고, 기관도 1.4만주를 순매수했다. 반면 개인들은 8.9만주를 순매도한 것으로 나타났다. 같은 기간 개인의 거래비중이 96.0%로 가장 높아, 주요 거래 주체로 참여했음을 알 수 있다. 한편 기관은 이 종목에 대해서 최근 6일 연속 1.7만주 순매수를 하고 있다. 더욱이 최근 5일간 외국인이 대량 순매수를 하고 있어 투자자들의 관심이 집중되고 있다. [표]누리플랜 외국인/기관 매매동향 한경로보뉴스 이 기사는 한국경제신문과 씽크풀이 공동 개발한 기사 자동생성 알고리즘에 의해 실시간으로 작성된 것입니다. ["
파이낸셜뉴스,069140,/news/news_read.nhn?article_id=0004015351&office_id=014&mode=search&query=누리플랜&page=1,2018-05-04 14:45,"[fnRASSI]누리플랜(069140), 52주 신고가...7.28% &uarr;","누리플랜(069140)은 52주신고가를 기록하고 있어 주목할만하다. 동종목의 현재 주가는 9,280원 선에서 이루어지고 있다. 거래일을 기준으로 최근 3일간 평균 거래량은 80만 주이다. 이는 60일 일 평균 거래량 24만 주와 비교해보면 최근 거래량이 급격히 늘어났다는 것을 알 수 있다. 외국인과 기관은 순매도, 개인은 순매수(한달누적)  5월2일부터 전일까지 기관이 2거래일 연속 순매수했다. 4주간을 기준으로 보면 외국인이 29,994주를 순매도했고, 기관도 매도쪽으로 방향을 잡으면서 32,878주를 순매도했지만, 개인은 오히려 초반에 동종목을 순매수한 이후에 기세를 이어가며 62,872주를 순매수했다. 개인투자자의 거래비중이 가장 높아 최근 한달간 주체별 거래비중을 살펴보면 개인이 전체 거래량의 97.29%를 차지하며 가장 활발한 참여를 보였고, 외국인은 2.34%, 기관은 0.35%의 거래 참여율을 보였다. 그리고 최근 5일간 거래비중은 개인이 전체 거래량의 97.99%를 차지하며 가장 활발한 참여를 보였고, 외국인은 1.95%, 기관은 0.05%의 거래 참여율을 보였다. 'fnRASSI'는 증권전문 기업 씽크풀과 파이낸셜뉴스의 협업으로 로봇기자가 실시간으로 생산하는 기사입니다."
서울경제,069140,/news/news_read.nhn?article_id=0003384122&office_id=011&mode=search&query=누리플랜&page=1,2018-08-31 14:37,"&lt;코&gt;누리플랜, 전일 대비 19.37% 상승.. 일일회전율은 3.11% 기록","[서울경제] 누리플랜(069140) 은 31일 오후 2시 36분 현재 19.37% 오른 6,470원에 거래되고 있으며, 44(매도):56(매수)의 매수우위를 기록하고 있다. 거래대금은 9억928만, 거래량은 14만7,887주로 거래량회전율은 3.11%로 나타났다. 지난 1개월간 누리플랜은 상승 16회, 하락 13회를 기록했고, 주가수익률은 25.63% 표준편차는 1.82%를 기록했다. 이 기간 ' 금속업 ' 업종 평균 주가수익률은 4.13%로 나타났으며, 변동성은 1.31%를 기록했다. 이 시각 현재 ' 금속업 '은 0.02% 상승 중이며, 46(매도):54(매수)의 매수우위를 기록하고 있다."
서울경제,069140,/news/news_read.nhn?article_id=0003011841&office_id=011&mode=search&query=누리플랜&page=1,2017-04-11 07:01,"[터치!Peak&amp;Bottom]누리플랜, 관급공사로 탄탄한 매출","[서울경제] 경관조명 등 도시경관전문회사인 코스닥 상장업체 누리플랜이 5거래일 연속 상승하며 차분한 성장세를 보이고 있다. 지난 10일 코스닥 시장에서 전날보다 14.33% 오른 누리플랜은 지난 5일 이후 계속 종가가 오르고 있다. 오름폭도 점점 커지고 있어 5일은 전날보다 70원 상승했지만 7일은 180원 10일은 960원이 올랐다. 가격상승과 함게 거래량도 폭증해 5일~7일에는 하루 3만 주 정도가 거래되다 10일에는 15만 6,000주가 손바뀜했다. 지난달 말 외국인의 보유비중은 0% 였으나, 5일에는 0.78%까지 상승 했으며 그 직후부터 외국인은 대거 물량을 팔아 치우며 차익을 실현했다. 2010년 코스닥에 상장한 누리플랜은 매출의 대부분을 공공단체나 지방자치단체와 협상이나 수의로 계약하는 프로젝트 사업으로 진행한다. 국내 전체 경기 변동에 크게 구애 받지 않는 사업 구조를 지니고 있는 것이다. 특히 관급 경관 조명시장에서 시장 점유율을 늘리고 있으며 매출비중은 LED조명기구 및 상품이 69% 경관 조명 30%, 설계용역 0.98%로 구성되어 있다. 연간 매출도 크지는 않지만 꾸준히 오르고 있다. 지난해 말 별도 재무제표 기준 매출액은 344억 원이며 당기순이익은 23억 원이다."
