source,symbol,link,date,title,content
한국경제,069920,/news/news_read.nhn?article_id=0003964767&office_id=015&mode=search&query=아이에스이커머스&page=1,2018-06-21 09:06,"아이에스이커머스,120억 규모 사모 CB 발행 결정","코스닥 전자상거래업체 아이에스이커머스가 사모 전환사채(CB) 120억원어치를 발행한다. 아이에스이커머스는 20일 이사회를 열고 120억원 규모의 4회차 무기명식 무보증 사모 CB 발행을 결의했다. 이 사채의 만기는 3년이며 만기 이자율은 2%다. 보통주로의 전환가액은 기준 주가 대비 25% 할증한 4859원이다. 아이에스이커머스는 CB 발행으로 조달한 자금을 해외 브랜드 라이선스 및 독점판매권한 인수에 쓸 계획이다. 이 회사 관계자는 ""생활문화 브랜드 기업 구축자라는 회사의 중장기 목표를 달성하기 위해 역량을 갖춘 브랜드 인수를 논의 중""이라며 ""본격적인 글로벌 유통사로 도약하기 위한 시도가 성과를 내기 시작할 것""이라고 말했다. 안혜원 한경닷컴 기자"
한국경제,069920,/news/news_read.nhn?article_id=0003964615&office_id=015&mode=search&query=아이에스이커머스&page=1,2018-06-20 20:48,"[마켓인사이트]아이에스이커머스, 사모 CB 120억 발행","≪이 기사는 06월20일(17:47) 자본시장의 혜안 ‘마켓인사이트’에 게재된 기사입니다≫ 코스닥 상장사 아이에스이커머스가 사모 전환사채(CB) 120억원어치를 발행한다. 아이에스이커머스는 20일 이사회를 열고 120억원 규모의 사모 CB 발행을 결의했다. 이 사채의 만기는 3년이며 만기 이자율은 2%다. 보통주로의 전환가액은 기준 주가 대비 25% 할증한 4859원이다. 주식 총수 대비 9.68%인 246만9643주가 신규로 발행될 수 있다. 이 회사는 CB 발행으로 조달한 자금을 해외 브랜드 라이선스 및 독점판매권한 인수에 쓸 계획이라고 설명했다. 회사 관계자는 ""생활문화 브랜드 기업 구축자라는 회사의 중장기 목표를 달성하기 위해 역량을 갖춘 브랜드 인수를 논의 중""이라고 귀띔했다. 그러면서 ""본격적인 글로벌 유통사로 도약하기 위한 시도가 성과를 내기 시작할 것""이라고 덧붙였다. 김병근 기자"
한국경제TV,069920,/news/news_read.nhn?article_id=0000660737&office_id=215&mode=search&query=아이에스이커머스&page=1,2018-07-13 11:31,"아이에스이커머스, 12% 급등... 전일 보다 530원 상승한 5,040원","[한국경제TV 라이온봇 기자] [그림 1] 최근 3개월 간 주가 추세 및 기간별 수익률 아이에스이커머스는 7월 13일 11시 30분 전일 대비 약 12% 급등한 5,040원에 거래되고 있다. 아이에스이커머스는 코스닥 상장 기업으로 유통 업종에 속해 있다. 시가총액은 1,150억원으로 코스닥 상장기업 중 545위에 위치 해 있다. [종목 성향 진단] [그림 2] 종목 성향 진단 아이에스이커머스의 투자 스타일은 성장주에 가깝다. 주가 고평가 우려가 공존하지만 높은 성장성이 기대되는 기업이다. 주가 모멘텀은 좋은 편에 속했다. 최근 3개월 수익률은 42.72%의 상승폭을 기록했다. 최근 1개월 수익률 또한 23.56% 상승하며 좋은 모멘텀을 보이고 있다. 아이에스이커머스 종목에 대한 투자자의 관심도는 상대적으로 낮은 편이었다. [투자 점수 진단] [그림 3] 투자 점수 진단 아이에스이커머스는 어느 측면에서 투자 매력도가 높은 종목일까? AI 인공지능 종목 분석 시스템을 이용해 성장성, 수익성, 효율성, 안전성, 저평가성, 추세 등 주가 수익률에 영향을 줄 수 있는 6가지 핵심 투자 지표를 점수화하여 종목의 투자 매력도를 계산해보았다. 그 결과 아이에스이커머스는 상대적으로 기업안정성 측면에서 두각을 드러내고 있었다. 기업안정성 점수는 기업의 재무 구조가 얼마나 안정적인 상태인지를 나타낸다. 아이에스이커머스는 특히 부채비율 측면에서 가장 높은 점수는 기록했는데, 전체 시장 내 278위를 기록하며 상위 13.88%에 위치했다. 업종별로는 52위를 기록하며 상위 12.47%에 위치했다. 그러나 기업의 이익 성장 추세를 나타내는 성장성 측면에서는 아쉬움을 나타냈다. (위의 AI인공지능 점수는 재무 데이터를 기반으로 전체 상장 종목과 비교/분석하여 도출한 점수로 높은 점수가 반드시 높은 수익률을 보장하지 않습니다. 위의 자료는 당사의 추천 종목이 아니며, 투자 시 참고용으로 제시해드리는 것입니다. 핵심투자지표를 결합해 종목의 투자매력도를 종합 계산한 ""인공지능 투자점수""는 ""거장들의 투자공식"" 앱에서 확인하실 수 있습니다.) 라이온봇 기자 -한국경제TV※ 본 기사는 한국경제TV와 '거장들의 투자공식이'자체 개발한 '라이온봇 기자'가 실시간으로 작성한 기사입니다. 라이온봇기자 ⓒ 한국경제TV, 무단 전재 및 재배포 금지 한국경제TV 관련뉴스해당 언론사에서 선정하며 언론사 페이지(아웃링크)로 이동해 볼 수 있습니다.삼바 '분식회계' 판정 피했지만…독이 된 콜옵션'88올림픽 때 탄생한 '이 과자'…17억 봉지 팔렸다김해공항 사고영상 공개…피해자측 ""풍비박산""[단독] ""카카오택시와 결별""...택시업계 '대항마' 출격""4채중 1채는 빈집""…전국에 '미입주 리스크' 확산"
한국경제TV,069920,/news/news_read.nhn?article_id=0000661447&office_id=215&mode=search&query=아이에스이커머스&page=1,2018-07-16 10:33,"아이에스이커머스, 전일 대비 약 -8% 하락한 4,460원","[한국경제TV 라이온봇 기자] [그림 1] 최근 3개월 간 주가 추세 및 기간별 수익률 아이에스이커머스는 7월 16일 10시 32분 전일 대비 약 -8% 하락한 4,460원에 거래되고 있다. 아이에스이커머스는 코스닥 상장 기업으로 유통 업종에 속해 있다. 시가총액은 1,234억원으로 코스닥 상장기업 중 514위에 위치 해 있다. [종목 성향 진단] [그림 2] 종목 성향 진단 아이에스이커머스의 투자 스타일은 성장주에 가깝다. 주가 고평가 우려가 공존하지만 높은 성장성이 기대되는 기업이다. 주가 모멘텀은 굉장히 좋은 편이었다. 최근 3개월 수익률이 무려 50.78%의 상승폭을 기록했다. 최근 1개월 수익률 또한 32.6% 상승하며 굉장히 좋은 모멘텀을 보이고 있다. 아이에스이커머스 종목에 대한 투자자의 관심도는 높은 편에 속한다. [투자 점수 진단] [그림 3] 투자 점수 진단 아이에스이커머스는 어느 측면에서 투자 매력도가 높은 종목일까? AI 인공지능 종목 분석 시스템을 이용해 성장성, 수익성, 효율성, 안전성, 저평가성, 추세 등 주가 수익률에 영향을 줄 수 있는 6가지 핵심 투자 지표를 점수화하여 종목의 투자 매력도를 계산해보았다. 그 결과 아이에스이커머스는 상대적으로 추세지표 측면에서 두각을 드러내고 있었다. 추세 점수는 주가의 상승 모멘텀이 어느정도 인가를 나타낸다. 아이에스이커머스는 특히 1주전대비수익률 측면에서 가장 높은 점수는 기록했는데, 전체 시장 내 19위를 기록하며 상위 0.9%에 위치했다. 업종별로는 4위를 기록하며 상위 0.74%에 위치했다. 그러나 기업의 이익 성장 추세를 나타내는 성장성 측면에서는 아쉬움을 나타냈다. (위의 AI인공지능 점수는 재무 데이터를 기반으로 전체 상장 종목과 비교/분석하여 도출한 점수로 높은 점수가 반드시 높은 수익률을 보장하지 않습니다. 위의 자료는 당사의 추천 종목이 아니며, 투자 시 참고용으로 제시해드리는 것입니다. 핵심투자지표를 결합해 종목의 투자매력도를 종합 계산한 ""인공지능 투자점수""는 ""거장들의 투자공식"" 앱에서 확인하실 수 있습니다.) 라이온봇 기자 -한국경제TV※ 본 기사는 한국경제TV와 '거장들의 투자공식이'자체 개발한 '라이온봇 기자'가 실시간으로 작성한 기사입니다. 라이온봇기자 ⓒ 한국경제TV, 무단 전재 및 재배포 금지 한국경제TV 관련뉴스해당 언론사에서 선정하며 언론사 페이지(아웃링크)로 이동해 볼 수 있습니다.미세먼지 주범 '경유'…가격 못올리는 현실적 이유4일만에 '이건희' 제친 이 사람…中 6대 부호 안착[단독] 유명 간편결제 이렇게 뚫렸다…피해 개인만 '발동동'[단독] NC백화점 야탑점…천장 함몰에도 영업강행'답답한 교통체증'…자동차 등록대수 보니 그럴만"
한국경제TV,069920,/news/news_read.nhn?article_id=0000650067&office_id=215&mode=search&query=아이에스이커머스&page=1,2018-06-19 11:40,"아이에스이커머스, 전일 대비 약 6% 상승한 3,955원","[한국경제TV 라이온봇 기자] [그림 1] 최근 3개월 간 주가 추세 및 기간별 수익률 아이에스이커머스는 6월 19일 11시 39분 전일 대비 약 6% 상승한 3,955원에 거래되고 있다. 아이에스이커머스는 코스닥 상장 기업으로 유통 업종에 속해 있다. 시가총액은 951억원으로 코스닥 상장기업 중 670위에 위치 해 있다. [종목 성향 진단] [그림 2] 종목 성향 진단 아이에스이커머스의 투자 스타일은 성장주에 가깝다. 주가 고평가 우려가 공존하지만 높은 성장성이 기대되는 기업이다. 주가 모멘텀은 좋은 편에 속했다. 최근 1개월 수익률은 12.27%의 상승폭을 기록했다. 아이에스이커머스 종목에 대한 투자자의 관심도는 매우 낮은 편이었다. [투자 점수 진단] [그림 3] 투자 점수 진단 아이에스이커머스는 어느 측면에서 투자 매력도가 높은 종목일까? AI 인공지능 종목 분석 시스템을 이용해 성장성, 수익성, 효율성, 안전성, 저평가성, 추세 등 주가 수익률에 영향을 줄 수 있는 6가지 핵심 투자 지표를 점수화하여 종목의 투자 매력도를 계산해보았다. 그 결과 아이에스이커머스는 상대적으로 기업안정성 측면에서 두각을 드러내고 있었다. 기업안정성 점수는 기업의 재무 구조가 얼마나 안정적인 상태인지를 나타낸다. 아이에스이커머스는 특히 부채비율 측면에서 가장 높은 점수는 기록했는데, 전체 시장 내 279위를 기록하며 상위 13.95%에 위치했다. 업종별로는 53위를 기록하며 상위 12.75%에 위치했다. 그러나 기업의 이익 성장 추세를 나타내는 성장성 측면에서는 아쉬움을 나타냈다. (위의 AI인공지능 점수는 재무 데이터를 기반으로 전체 상장 종목과 비교/분석하여 도출한 점수로 높은 점수가 반드시 높은 수익률을 보장하지 않습니다. 위의 자료는 당사의 추천 종목이 아니며, 투자 시 참고용으로 제시해드리는 것입니다. 핵심투자지표를 결합해 종목의 투자매력도를 종합 계산한 ""인공지능 투자점수""는 ""거장들의 투자공식"" 앱에서 확인하실 수 있습니다.) 라이온봇 기자 -한국경제TV※ 본 기사는 한국경제TV와 '거장들의 투자공식이'자체 개발한 '라이온봇 기자'가 실시간으로 작성한 기사입니다. 라이온봇기자 ⓒ 한국경제TV, 무단 전재 및 재배포 금지 한국경제TV 관련뉴스해당 언론사에서 선정하며 언론사 페이지(아웃링크)로 이동해 볼 수 있습니다.현실화되는 '보유세 폭탄'…똑똑한 절세법은?아시아팀 부진 속 콜롬비아-일본전 '이목'품귀 빚던 '꼬북칩'이 이럴줄은투기지역 연내 재조정…""노원구 빠질듯""'아동수당' 미리 신청하세요…몇 세까지 해당?"
한국경제TV,069920,/news/news_read.nhn?article_id=0000659303&office_id=215&mode=search&query=아이에스이커머스&page=1,2018-07-10 12:34,"아이에스이커머스, 10% 급등... 전일 보다 400원 상승한 4,350원","[한국경제TV 라이온봇 기자] [그림 1] 최근 3개월 간 주가 추세 및 기간별 수익률 아이에스이커머스는 7월 10일 12시 33분 전일 대비 약 10% 급등한 4,350원에 거래되고 있다. 아이에스이커머스는 코스닥 상장 기업으로 유통 업종에 속해 있다. 시가총액은 1,007억원으로 코스닥 상장기업 중 592위에 위치 해 있다. [종목 성향 진단] [그림 2] 종목 성향 진단 아이에스이커머스의 투자 스타일은 성장주에 가깝다. 주가 고평가 우려가 공존하지만 높은 성장성이 기대되는 기업이다. 주가 모멘텀은 좋은 편에 속했다. 최근 3개월 수익률은 23.89%의 상승폭을 기록했다. 최근 1개월 수익률 또한 17.16% 상승하며 좋은 모멘텀을 보이고 있다. 아이에스이커머스 종목에 대한 투자자의 관심도는 상대적으로 낮은 편이었다. [투자 점수 진단] [그림 3] 투자 점수 진단 아이에스이커머스는 어느 측면에서 투자 매력도가 높은 종목일까? AI 인공지능 종목 분석 시스템을 이용해 성장성, 수익성, 효율성, 안전성, 저평가성, 추세 등 주가 수익률에 영향을 줄 수 있는 6가지 핵심 투자 지표를 점수화하여 종목의 투자 매력도를 계산해보았다. 그 결과 아이에스이커머스는 상대적으로 기업안정성 측면에서 두각을 드러내고 있었다. 기업안정성 점수는 기업의 재무 구조가 얼마나 안정적인 상태인지를 나타낸다. 아이에스이커머스는 특히 부채비율 측면에서 가장 높은 점수는 기록했는데, 전체 시장 내 278위를 기록하며 상위 13.89%에 위치했다. 업종별로는 52위를 기록하며 상위 12.5%에 위치했다. 그러나 기업의 이익 성장 추세를 나타내는 성장성 측면에서는 아쉬움을 나타냈다. (위의 AI인공지능 점수는 재무 데이터를 기반으로 전체 상장 종목과 비교/분석하여 도출한 점수로 높은 점수가 반드시 높은 수익률을 보장하지 않습니다. 위의 자료는 당사의 추천 종목이 아니며, 투자 시 참고용으로 제시해드리는 것입니다. 핵심투자지표를 결합해 종목의 투자매력도를 종합 계산한 ""인공지능 투자점수""는 ""거장들의 투자공식"" 앱에서 확인하실 수 있습니다.) 라이온봇 기자 -한국경제TV※ 본 기사는 한국경제TV와 '거장들의 투자공식이'자체 개발한 '라이온봇 기자'가 실시간으로 작성한 기사입니다. 라이온봇기자 ⓒ 한국경제TV, 무단 전재 및 재배포 금지 한국경제TV 관련뉴스해당 언론사에서 선정하며 언론사 페이지(아웃링크)로 이동해 볼 수 있습니다.발암물질 고혈압약 115개 공개...식약처 홈페이지 '온종일 북적'90도 고개 숙인 이재용...文의 한마디 ""한국서도 일자리를...""고개드는 美 금리인상 신중론…'무역전쟁' 부메랑 되나계산대 의자 '이렇게' 바꾼다…이마트 10년 만의 변화설민석 집 공개, 5성급 호텔 뺨치는 '럭셔리 하우스'"
아이뉴스24,069920,/news/news_read.nhn?article_id=0000450932&office_id=031&mode=search&query=아이에스이커머스&page=1,2018-06-21 08:44,"아이에스이커머스, 120억 CB 발행&hellip; &quot;브랜드 인수 자금&quot;","[아이뉴스24 장효원 기자] 전자상거래 기반 생활문화 브랜드 리딩 기업 아이에스이커머스가 120억원 규모의 전환사채(CB) 발행을 결정했다고 지난 20일 공시했다. 사채의 발행조건 중 전환가액은 기준 주가대비 25% 할증한 4천859원이고 표면이자율은 0%, 만기보장수익률은 연복리 2%다. 만기일은 2021년 6월22일로 아이에스이커머스는 기업가치를 인정받으며 최적의 조건으로 자금을 조달했다는 평가다. 전환사채 발행을 통해 조달한 자금은 해외 브랜드 라이선스 또는 DT권(독점판매권한 등) 인수와 엣지 플랫폼의 서비스 경쟁력 강화에 투입될 예정이다. 이와 함께 생활문화 브랜드 컴퍼니 빌더라는 기업의 중장기적 목표를 바탕으로 역량을 갖춘 브랜드 인수가 논의되고 있어 이에 자금이 활용될 예정이다. 또 다른 주력사업인 위즈위드는 현재 타 채널과 다른 상품 차별화를 진행 중에 있다. 상품 소싱 과정에서 가격 경쟁력 및 매출 확대의 시너지가 있는 2~3개의 해외 브랜드 인수를 모색 중에 있다고 회사 측은 전했다. 아이에스이커머스 관계자는 ""지금까지는 글로벌 유통사로 가는 틀을 다졌고 이제부터는 본격적인 도약을 할 수 있는 환경이 대내외적으로 조성돼 그 성과가 이제부터 가시화 될 것""이라고 전했다. /장효원기자"
파이낸셜뉴스,069920,/news/news_read.nhn?article_id=0004042250&office_id=014&mode=search&query=아이에스이커머스&page=1,2018-06-19 11:18,"[fnRASSI]아이에스이커머스, 3.35% 오르며 거래량 증가","아이에스이커머스(069920)의 당일 거래량이 최근 5거래일 거래량의 최고치를 넘어섰다. 그리고 아이에스이커머스는 3일 연속 상승흐름을 보이며, 11시 11분 현재 3.35% 증가한 3,855원에 거래중이다. 외국인 보유량 증가, 기관 변화 없음 (5일 누적) 최근 5일간 동종목의 외국인 투자자는 3주 순매수하였고 마찬가지로 기관은 0주 순매수하였다. 전날 두 주체의 각각 순매수량은 0으로 보유비율이 그대로이다. 다음 표는 동종목의 외국인, 기관의 일별 순매수량을 나타낸 것이다. 회전율이 낮지만 주가등락폭은 적정한 편 최근 한달간 아이에스이커의 상장주식수 대비 거래량을 비교해보니 일별 매매회전율이 0.07%로 집계됐다. 이처럼 회전율이 너무 낮은 경우 유동성이 떨어져 매매가 자유롭지 못할 수 있기 때문에 상당한 주의가 필요하다. 저점대비 고점의 장중 주가변동률은 평균 4.91%로 적정한 수준을 보이고 있다. 'fnRASSI'는 증권전문 기업 씽크풀과 파이낸셜뉴스의 협업으로 로봇기자가 실시간으로 생산하는 기사입니다."
서울경제,069920,/news/news_read.nhn?article_id=0003347637&office_id=011&mode=search&query=아이에스이커머스&page=1,2018-07-13 11:29,"&lt;코&gt;아이에스이커머스, 전일 대비 10.75% 상승.. 일일회전율은 0.49% 기...","[서울경제] 아이에스이커머스(069920) 는 13일 오전 11시 28분 현재 10.75% 오른 4,995원에 거래되고 있으며, 23(매도):77(매수)의 매수우위를 기록하고 있다. 거래대금은 6억89만, 거래량은 12만4,879주로 거래량회전율은 0.49%로 나타났다. 지난 1개월간 아이에스이커머스는 상한가 1회, 상승 15회, 하락 12회를 기록했고, 주가수익률은 41.70% 표준편차는 6.80%를 기록했다. 이 기간 ' 유통업 ' 업종 평균 주가수익률은 -2.78%로 나타났으며, 변동성은 2.10%를 기록했다. 이 시각 현재 ' 유통업 '은 0.66% 상승 중이며, 50(매도):50(매수)의 보합세를 보이고 있다"
서울경제,069920,/news/news_read.nhn?article_id=0003344654&office_id=011&mode=search&query=아이에스이커머스&page=1,2018-07-10 12:47,"&lt;코&gt;아이에스이커머스, 전일 대비 7.34% 상승.. 일일회전율은 0.40% 기록","[서울경제] 아이에스이커머스(069920) 는 10일 오후 12시 46분 현재 7.34% 오른 4,240원에 거래되고 있으며, 33(매도):67(매수)의 매수우위를 기록하고 있다. 거래대금은 4억2,353만, 거래량은 10만1,328주로 거래량회전율은 0.40%로 나타났다. 지난 1개월간 아이에스이커머스는 상한가 1회, 상승 16회, 하락 12회를 기록했고, 주가수익률은 21.32% 표준편차는 6.62%를 기록했다. 이 기간 ' 유통업 ' 업종 평균 주가수익률은 -1.71%로 나타났으며, 변동성은 2.09%를 기록했다. 이 시각 현재 ' 유통업 '은 0.31% 상승 중이며, 41(매도):59(매수)의 매수우위를 기록하고 있다."
파이낸셜뉴스,069920,/news/news_read.nhn?article_id=0003841249&office_id=014&mode=search&query=아이에스이커머스&page=1,2017-07-10 13:29,[fnRASSI]아이에스이커머스(069920) 현재 9.81% &uarr;,"현재 아이에스이커머스(069920)는 전일대비 9.81% 상승하여 5,430원 선에서 거래가 이루어지고 있다. 외국인 보유량 증가, 기관 변화 없음 (5일 누적) 최근 5일간 동종목의 외국인 투자자는 11,142주 순매수하였고 마찬가지로 기관은 0주 순매수하였다. 전날 외국인은 1,658주 순매수했지만 기관은 순매수량이 0으로 보유비율 그대로 유지했다. 다음 표는 동종목의 외국인, 기관의 일별 순매수량을 나타낸 것이다. 거래참여는 개인투자자가 가장 활발 최근 한달간 주체별 거래비중을 살펴보면 개인이 전체 거래의 97.66%를 차지하며 가장 적극적인 모습을 보여줬고, 외국인은 2.24%를 나타냈으며 기관은 0.09%를 나타냈다. 그리고 최근 5일간 거래비중은 개인이 93.03%, 외국인이 6.96%를 보였고, 기관은 거래참여가 없었다. 'fnRASSI'는 증권전문 기업 씽크풀과 파이낸셜뉴스의 협업으로 로봇기자가 실시간으로 생산하는 기사입니다."
한국경제,069920,/news/news_read.nhn?article_id=0003964626&office_id=015&mode=search&query=아이에스이커머스&page=1,2018-06-20 22:20,[코스닥 기업공시] (20일) 아이에스이커머스 등,▲아이에스이커머스=60억원 규모 CB 발행. ▲인터불스=50억원 규모 CB 발행. ▲코오롱생명과학=169억원 규모 인보사 공급 계약. ▲한국코퍼레이션=법원의 임시 주주총회 개최 금지 가처분 결정에 따라 임시 주총 소집 철회. [
파이낸셜뉴스,069920,/news/news_read.nhn?article_id=0004055252&office_id=014&mode=search&query=아이에스이커머스&page=1,2018-07-10 13:21,[fnRASSI]아이에스이커머스(069920) 현재 8.86% &uarr;,"현재 아이에스이커머스(069920)는 전일대비 8.86% 상승하여 4,300원 선에서 거래가 이루어지고 있다. 외국인/기관 순매수, 개인은 순매도(한달누적)  6월28일부터 외국인들이 8거래일 연속 순매수 행진을 벌이고 있다. 4주간을 기준으로 보면 외국인이 초반에 동종목을 순매수한 이후에 기세를 이어가며 13,236주를 순매수했고, 기관도 순매도를 기록하다가 다시 순매수로 돌아서면서 22,678주를 순매수했다. 반면 개인들은 매도쪽으로 방향을 잡으면서 35,914주를 순매도한 것으로 나타났다. 퀀트 재무분석, 종합점수 38점으로 상승                    지표               항목               값               종합점수                 성장성               매출액증가율               -0.76               3.74                 자기자본증가율               0.07                 안정성               부채비율               20.87               7.64                 유동비율               316.08                 이익안정성               5.28                 수익성               ROA               37.6               5.55                 ROE               45.45                 영업이익율               -8.63          아이에스이커머스의 퀀트 재무 점수는 16.93점으로 3개월 이전 14.14점보다 올랐다. 지난 분기에 비해 성장성 점수가 상승했다. 이는 자기자본 증가율이 증가하였기 때문이다. 안정성 종합 점수는 부채비율 감소, 유동비율 증가, 그리고 실적 안정성 증가로 인해 상승했다. 수익성 측면에서 볼때 ROA, ROE, 영업이익률 모두 하락하여 이전보다 낮은 점수를 받았다. 'fnRASSI'는 증권전문 기업 씽크풀과 파이낸셜뉴스의 협업으로 로봇기자가 실시간으로 생산하는 기사입니다."
