source,symbol,link,date,title,content
한국경제,069920,/news/news_read.nhn?article_id=0003835643&office_id=015&mode=search&query=아이에스이커머스&page=1,2017-10-16 14:12,"아이에스이커머스, 더블유컨셉코리아 경영권&middot;지분 612억에 매각","아이에스이커머스는 보유 중인 더블유컨셉코리아 주식 28만8000주(지분 60%)를 612억원에 아이엠엠로즈골드3 사모투자전문회사 업무집행사원인 아이엠엠프라이빗에쿼티에 양도하기로 결정했다고 16일 공시했다. 이번 매각 금액은 총 자산의 68.94%에 해당한다. 아이에스이커머스 측은 ""인큐베이팅이 완료된 더블유컨셉코리아의 지분을 매각하고, 이번 매각을 통해 확보한 자금으로 성장성 높은 전자상거래 기반 생활문화 브랜드를 발굴 및 육성할 계획""이라며 ""이번 1차대금 지급 시점에 양수인이 최대주주가 될 예정""이라고 밝혔다. 이어 아이에스이커머스 측은 ""양도 후에는 더블유컨셉코리아 주식 9만6000주(지분 20%)를 보유하게 된다""고 밝혔다."
이데일리,069920,/news/news_read.nhn?article_id=0004177240&office_id=018&mode=search&query=아이에스이커머스&page=1,2018-08-20 15:43,"아이에스이커머스, 자사주 73만5000주 취득키로","""주주가치 우선 경영방침 실천"" [이데일리 윤종성 기자] 아이에스이커머스(069920)는 자사주 73만5000주(약 25억원 규모)를 11월말까지 장내매수를 통해 분할 취득키로 결정했다고 20일 공시했다. 이번 자사주 매입은 기업가치를 높이는 동시에 책임 경영 의지를 표명하고, 주주가치 제고에 노력하겠다는 의지로 풀이된다. 김응상 아이에스이커머스 대표는 “주주가치를 우선으로 생각하는 경영 방침을 지속적으로 실천해 나가겠다”고 전했다."
머니투데이,069920,/news/news_read.nhn?article_id=0004067926&office_id=008&mode=search&query=아이에스이커머스&page=1,2018-06-20 17:29,아이에스이커머스 120억원 규모 전환사채권 발행,"[머니투데이 유엄식 기자] 아이에스이커머스는 120억원 규모 무기명식 이권부 무보증 사모 전환사채를 발행한다고 20일 공시했다. 조달된 자금 중 60억원은 타법인 증권 취득자금으로, 나머지 60억원은 기타자금으로 활용될 계획이다. 만기일은 2021년 6월 22일이며, 이자율은 2%다."
데일리안,069920,/news/news_read.nhn?article_id=0002276695&office_id=119&mode=search&query=아이에스이커머스&page=1,2018-08-20 16:30,"아이에스이커머스, 73만5000주 자사주 취득","전자상거래 기반 생활문화 브랜드 리딩 기업 아이에스이커머스가 자사주 매입 계획을 밝히며 주주친화 정책을 지속하겠다는 의지를 표명했다. 아이에스이커머스는 20일 이사회를 통해 자사주 매입 계획을 결의하며 73만5000주(약 25억원 규모)를 11월 말까지 장내매수를 통해 분할 취득하기로 했다고 공시했다. 이번 자사주 매입의 배경은 기업가치를 높임과 동시에 책임 경영 의지를 표명하고, 주주가치 제고에 노력하겠다는 기업의 의지로 풀이된다. 글로벌 시장 공략이 가시화 된 만큼 기업의 성장세는 빠르게 상승할 것으로 전망되고 있다. 김응상 아이에스이커머스 대표는 “아이에스이커머스의 본질적 가치는 변함이 없는 만큼, 주주가치를 우선으로 생각하는 경영 방침을 지속적으로 실천해 나가겠다”고 전했다."
한국경제TV,069920,/news/news_read.nhn?article_id=0000651793&office_id=215&mode=search&query=아이에스이커머스&page=1,2018-06-22 11:34,"아이에스이커머스, 전일 대비 약 -8% 하락한 4,495원","[한국경제TV 라이온봇 기자] [그림 1] 최근 3개월 간 주가 추세 및 기간별 수익률 아이에스이커머스는 6월 22일 11시 33분 전일 대비 약 -8% 하락한 4,495원에 거래되고 있다. 아이에스이커머스는 코스닥 상장 기업으로 유통 업종에 속해 있다. 시가총액은 1,250억원으로 코스닥 상장기업 중 518위에 위치 해 있다. [종목 성향 진단] [그림 2] 종목 성향 진단 아이에스이커머스의 투자 스타일은 성장주에 가깝다. 주가 고평가 우려가 공존하지만 높은 성장성이 기대되는 기업이다. 주가 모멘텀은 좋은 편에 속했다. 최근 1개월 수익률은 12.27%의 상승폭을 기록했다. 아이에스이커머스 종목에 대한 투자자의 관심도는 높은 편에 속한다. [투자 점수 진단] [그림 3] 투자 점수 진단 아이에스이커머스는 어느 측면에서 투자 매력도가 높은 종목일까? AI 인공지능 종목 분석 시스템을 이용해 성장성, 수익성, 효율성, 안전성, 저평가성, 추세 등 주가 수익률에 영향을 줄 수 있는 6가지 핵심 투자 지표를 점수화하여 종목의 투자 매력도를 계산해보았다. 그 결과 아이에스이커머스는 상대적으로 추세지표 측면에서 두각을 드러내고 있었다. 추세 점수는 주가의 상승 모멘텀이 어느정도 인가를 나타낸다. 아이에스이커머스는 특히 1주전대비수익률 측면에서 가장 높은 점수는 기록했는데, 전체 시장 내 11위를 기록하며 상위 0.5%에 위치했다. 업종별로는 3위를 기록하며 상위 0.49%에 위치했다. 그러나 기업의 이익 성장 추세를 나타내는 성장성 측면에서는 아쉬움을 나타냈다. (위의 AI인공지능 점수는 재무 데이터를 기반으로 전체 상장 종목과 비교/분석하여 도출한 점수로 높은 점수가 반드시 높은 수익률을 보장하지 않습니다. 위의 자료는 당사의 추천 종목이 아니며, 투자 시 참고용으로 제시해드리는 것입니다. 핵심투자지표를 결합해 종목의 투자매력도를 종합 계산한 ""인공지능 투자점수""는 ""거장들의 투자공식"" 앱에서 확인하실 수 있습니다.) 라이온봇 기자 -한국경제TV※ 본 기사는 한국경제TV와 '거장들의 투자공식이'자체 개발한 '라이온봇 기자'가 실시간으로 작성한 기사입니다. 라이온봇기자 ⓒ 한국경제TV, 무단 전재 및 재배포 금지 한국경제TV 관련뉴스해당 언론사에서 선정하며 언론사 페이지(아웃링크)로 이동해 볼 수 있습니다.대출금리에 '바가지'…7개 은행 적발""사우디 악재까지""…고민 깊어가는 韓 증시'철밥통' 노조의 질주…""이익 30%배당해라""""멕시코 약점 우리가 알아요""…유럽 클럽이 감탄한 '스타트업'품절 빚던 '꼬북칩'…1년 만에 이럴줄은"
뉴시스,069920,/news/news_read.nhn?article_id=0008221325&office_id=003&mode=search&query=아이에스이커머스&page=1,2017-10-13 11:32,"아이에스이커머스, &quot;더블유컨셉코리아 지분 매각 협의 중&quot;","【서울=뉴시스】김경원 기자 = 아이에스이커머스(069920)는 13일 '자회사인 더블유컨셉코리아의 지분 매각 추진설' 과 관련한 조회공시요구에 ""협의 중에 있다""며 ""다만 현재까지 확정된 사항은 없다""고 답변했다."
한국경제TV,069920,/news/news_read.nhn?article_id=0000657376&office_id=215&mode=search&query=아이에스이커머스&page=1,2018-07-05 12:30,"아이에스이커머스, 전일 대비 약 -5% 하락한 4,100원","[한국경제TV 라이온봇 기자] [그림 1] 최근 3개월 간 주가 추세 및 기간별 수익률 아이에스이커머스는 7월 5일 12시 30분 전일 대비 약 -5% 하락한 4,100원에 거래되고 있다. 아이에스이커머스는 코스닥 상장 기업으로 유통 업종에 속해 있다. 시가총액은 1,097억원으로 코스닥 상장기업 중 550위에 위치 해 있다. [종목 성향 진단] [그림 2] 종목 성향 진단 아이에스이커머스의 투자 스타일은 성장주에 가깝다. 주가 고평가 우려가 공존하지만 높은 성장성이 기대되는 기업이다. 주가 모멘텀은 좋은 편에 속했다. 최근 3개월 수익률은 23.89%의 상승폭을 기록했다. 최근 1개월 수익률 또한 17.16% 상승하며 좋은 모멘텀을 보이고 있다. 아이에스이커머스 종목에 대한 투자자의 관심도는 상대적으로 낮은 편이었다. [투자 점수 진단] [그림 3] 투자 점수 진단 아이에스이커머스는 어느 측면에서 투자 매력도가 높은 종목일까? AI 인공지능 종목 분석 시스템을 이용해 성장성, 수익성, 효율성, 안전성, 저평가성, 추세 등 주가 수익률에 영향을 줄 수 있는 6가지 핵심 투자 지표를 점수화하여 종목의 투자 매력도를 계산해보았다. 그 결과 아이에스이커머스는 상대적으로 기업안정성 측면에서 두각을 드러내고 있었다. 기업안정성 점수는 기업의 재무 구조가 얼마나 안정적인 상태인지를 나타낸다. 아이에스이커머스는 특히 부채비율 측면에서 가장 높은 점수는 기록했는데, 전체 시장 내 278위를 기록하며 상위 13.89%에 위치했다. 업종별로는 52위를 기록하며 상위 12.5%에 위치했다. 그러나 기업의 이익 성장 추세를 나타내는 성장성 측면에서는 아쉬움을 나타냈다. (위의 AI인공지능 점수는 재무 데이터를 기반으로 전체 상장 종목과 비교/분석하여 도출한 점수로 높은 점수가 반드시 높은 수익률을 보장하지 않습니다. 위의 자료는 당사의 추천 종목이 아니며, 투자 시 참고용으로 제시해드리는 것입니다. 핵심투자지표를 결합해 종목의 투자매력도를 종합 계산한 ""인공지능 투자점수""는 ""거장들의 투자공식"" 앱에서 확인하실 수 있습니다.) 라이온봇 기자 -한국경제TV※ 본 기사는 한국경제TV와 '거장들의 투자공식이'자체 개발한 '라이온봇 기자'가 실시간으로 작성한 기사입니다. 라이온봇기자 ⓒ 한국경제TV, 무단 전재 및 재배포 금지 한국경제TV 관련뉴스해당 언론사에서 선정하며 언론사 페이지(아웃링크)로 이동해 볼 수 있습니다.[단독] 모바일 간편결제도 뚫렸다…SSG페이 등 6곳 '부정 결제'1분기 수익률 -0.2%…내 국민연금에 무슨 일이이혜영, 남편부터 워너원까지 '솔직+당당' 매력 발산1988년 김성령 vs 2018년 김수민...20년차 미스코리아 진'4천억 밥 전쟁'...햇반에 도전장 낸 이마트"
파이낸셜뉴스,069920,/news/news_read.nhn?article_id=0004043246&office_id=014&mode=search&query=아이에스이커머스&page=1,2018-06-20 15:37,"[fnRASSI]장마감, 코스닥 상승 종목(아이에스이커머스 29.96%&uarr;)","20일 코스닥 시장은 상승 976개, 하락 211개, 보합 50개로 마감했다. 상승한 종목으로 아이에스이커머스(069920) 29.96%, 경남스틸(039240) 29.93%, 동양에스텍(060380) 29.89% 등이 있다. 'fnRASSI'는 증권전문 기업 씽크풀과 파이낸셜뉴스의 협업으로 로봇기자가 실시간으로 생산하는 기사입니다."
머니투데이,069920,/news/news_read.nhn?article_id=0003948092&office_id=008&mode=search&query=아이에스이커머스&page=1,2017-10-16 13:51,"아이에스이커머스, 612억 규모 더블유컨셉코리아 주식 양도","[머니투데이 이건희 기자] 아이에스이커머스는 더블유컨셉코리아(W Concept Korea Co.,Ltd.)의 주식 28만8000주를 아이엠엠로즈골드3 사모투자전문회사 업무집행사원 아이엠엠프라이빗에쿼티에 양도키로 결정했다고 16일 공시했다. 양도금액은 612억원이다."
이데일리,069920,/news/news_read.nhn?article_id=0003943102&office_id=018&mode=search&query=아이에스이커머스&page=1,2017-10-13 13:50,"아이에스이커머스, &ldquo;더블유컨셉코리아 지분매각 협의 중&rdquo;",[이데일리 박정수 기자] 아이에스이커머스(069920)는 종속회사인 더블유컨셉코리아 지분 매각 추진설에 대한 거래소 조회공시에 “지분매각 협의 중이나 현재까지 확정된 사항은 없다”고 13일 답했다.
아시아경제,069920,/news/news_read.nhn?article_id=0003650783&office_id=277&mode=search&query=아이에스이커머스&page=1,2015-12-21 10:27,"아이에스이커머스, 中 대표 의류기업 썬마와 합작 법인 출범","[아시아경제 팍스넷 신송희 기자] 아이에스이커머스는 중국 대표 의류기업 Zhejiang Semir Garment Co., Ltd.(이하 썬마)와 합작 투자한 Shanghai Shenai Information Technology Co., Ltd. 법인을 출범한다. 여기에 더블유컨셉 차이나(WCONCEPT CHINA/m.wconcept.cn) 모바일 플랫폼을 런칭해 중국시장 진출을 본격화할 방침이다. 더블유컨셉 차이나는 아시아 디자이너 브랜드를 중국 소비자들에게 소개하는 모바일 플랫폼이다. 특히 더블유컨셉 차이나 모바일 플랫폼은 중국 소비자들의 사용의 편의성을 극대화하기 위해 △대부분의 중국인들이 애용하는 ‘웨이신(위쳇, 微信)’ 내 공식 스토어 운영 △모든 재고를 중국 현지로 선 이동시켜 배송시간을 단축한 물류 프로세스를 구축해 경쟁력을 확보했다. 더블유컨셉 차이나 관계자는 “중국 내 인기가 높은 K-패션, 뷰티 브랜드 상품은 물론 현지 고객들의 만족감을 높여주기 위한 다양한 서비스를 제공할 계획”이라고 설명했다. 또 “더블유컨셉 코리아 및 국내 디자이너 브랜드와의 전략적 제휴를 통해 중국 내 유통되고 있는 상품들과 차별화를 두고, 각 브랜드의 특색을 살린 다양한 컨텐츠를 개발, 활성화하겠다”고 전했다."
파이낸셜뉴스,069920,/news/news_read.nhn?article_id=0003958836&office_id=014&mode=search&query=아이에스이커머스&page=1,2018-02-05 10:53,"[fnRASSI]아이에스이커머스, 거래량 확대되며 3거래일 연속 하락","아이에스이커머스(069920)는 당일 거래량 증가로 최근 5거래일 거래량의 최고치를 넘어섰다. 그리고 아이에스이커머스는 3일 연속 하락흐름을 보이며, 10시 45분 현재 1% 내린 3,450원에 거래중이다. 개인,외국인만 거래 참여 최근 한달간 주체별 거래비중을 살펴보면 개인이 95.28%, 외국인이 4.7%를 보였고, 기관은 거래참여가 없었다. 그리고 최근 5일간 거래비중은 개인 비중이 94.19%로 가장 높았고, 외국인이 5.8%로 그 뒤를 이었다. 기관은 거래에 참여하지 않은 것으로 보인다. 외국인/기관 순매수, 개인은 순매도(한달누적)  전일 외국인이 662주를 순매도했다. 4주간을 기준으로 보면 외국인이 초반에 동종목을 순매수한 이후에 기세를 이어가며 15,426주를 순매수했고, 기관도 초반에 동종목을 순매수한 이후에 최근에는 순매수량이 줄어들고 있음에도 불구하고 5주를 순매수했다. 반면 개인들은 매도쪽으로 방향을 잡으면서 15,431주를 순매도한 것으로 나타났다. 'fnRASSI'는 증권전문 기업 씽크풀과 파이낸셜뉴스의 협업으로 로봇기자가 실시간으로 생산하는 기사입니다."
서울경제,069920,/news/news_read.nhn?article_id=0003128951&office_id=011&mode=search&query=아이에스이커머스&page=1,2017-10-13 09:12,"아이에스이커머스, 종속회사 매각설에 상승","[서울경제] 온라인쇼핑업체로 코스닥 상장된 아이에스이커머스(069920)가 종속회사인 더블유 컨셉 지분 매각설에 13일 상승세를 타고 있다. 오전 9시 9분 아이에스이커머스는 전날보다 2.77%(160원)오른 5,930원에 거래중이다. 아이에스이커머스가 보유한 더블유컨셉은 여성의류 전문 온라인 편집숍으로 IMM 프라이빗에쿼티에 지분 80% 매각을 추진하는 것으로 전해졌다. 한국거래소는 오늘 낮 12시까지 관련 조회공시를 요구했다."
매일경제,069920,/news/news_read.nhn?article_id=0004184550&office_id=009&mode=search&query=아이에스이커머스&page=1,2018-07-13 17:07,아이에스이커머스 &quot;텐바이텐 지분 인수 않기로&quot;,"전자상거래 기업 아이에스이커머스는 텐바이텐 인수 추진 관련 조회공시 요구에 ""텐바이텐은 지분 인수를 추진하지 않기로 했다""면서 ""인수 대상에 오른 복수의 후보군 중 하나로 실사 진행 후 협의 과정에서 시너지 효과가 미비하다는 판단과 함께 조건에 차이가 있어 결렬된 사례""라고 13일 밝혔다. 그러면서 ""경쟁력 있는 브랜드를 지속적으로 물색하고 있으며 역량을 갖춘 몇몇 브랜드들과 투자 협의를 진행하고 있다""고 설명했다. [디지털뉴스국 김경택 기자] r_start // r_end //"
머니투데이,069920,/news/news_read.nhn?article_id=0003829048&office_id=008&mode=search&query=아이에스이커머스&page=1,2017-02-27 15:47,"아이에스이커머스, 지난해 영업손실 4억원&hellip;적자 개선",[머니투데이 권혜민 기자] 아이에스이커머스는 지난해 영업손실이 4억97만원으로 적자규모가 전년대비 86.5% 개선됐다고 27일 공시했다. 같은 기간 매출액은 786억2610만원으로 40.1% 증가했고 당기순이익은 9717만원으로 흑자전환했다. textlinktopstart textlinktopend textlinkstart
연합뉴스,069920,/news/news_read.nhn?article_id=0009603183&office_id=001&mode=search&query=아이에스이커머스&page=1,2017-10-13 11:26,아이에스이커머스 &quot;종속회사 지분매각 협의 중&quot;,"(서울=연합뉴스) 유현민 기자 = 코스닥에 상장된 전자상거래 업체인 아이에스이커머스는 종속회사인 더블유컨셉코리아 지분 매각과 관련해 협의 중이라고 13일 공시했다. 회사 측은 이와 관련한 한국거래소의 전날 조회공시 요구에 이같이 답하고 ""현재까지 확정된 사항은 없다""고 덧붙였다."
뉴시스,069920,/news/news_read.nhn?article_id=0008653877&office_id=003&mode=search&query=아이에스이커머스&page=1,2018-06-14 11:28,아이에스이커머스 &quot;텐바이텐 인수 검토중&hellip;확정된 사항 없다&quot;,"【서울=뉴시스】이국현 기자 = 아이에스이커머스(069920)는 텐바이텐 인수 추진설에 대한 한국거래소의 조회공시 요구에 대해 ""검토 중에 있으나 현재까지 확정된 사항은 없다""며 ""구체적인 내용이 확정되는 시점 또는 1개월 내에 재공시 하겠다""고 14일 답변했다."
이데일리,069920,/news/news_read.nhn?article_id=0003759889&office_id=018&mode=search&query=아이에스이커머스&page=1,2017-02-27 15:53,"아이에스이커머스, 작년 영업손실 4억&hellip;적자지속",[이데일리 김기훈 기자] 아이에스이커머스(069920)는 지난해 영업손실이 4억원을 기록해 전년 대비 적자가 지속됐다고 27일 공시했다. 같은 기간 당기순이익은 9700만원으로 흑자 전환했고 매출액은 40.1% 늘어난 786억2600만원으로 집계됐다.
서울경제,069920,/news/news_read.nhn?article_id=0003322152&office_id=011&mode=search&query=아이에스이커머스&page=1,2018-06-14 11:18,"아이에스이커머스, &ldquo;텐바이텐 인수 검토&rdquo;",[서울경제] 아이에스이커머스(069920) 는 한국거래소의 텐바이텐 인수 추진설에 대한 조회공시에서 “인수 검토 중에 있으나 확정된 사안은 없다”고 14일 공시했다.
머니투데이,069920,/news/news_read.nhn?article_id=0003946979&office_id=008&mode=search&query=아이에스이커머스&page=1,2017-10-13 10:59,"아이에스이커머스 &quot;더블유컨셉코리아 지분매각, 확정사항 없다&quot;","[머니투데이 고석용 기자] 아이에스이커머스가 13일 종속회사 (주)더블유컨셉코리아 지분 매각 추진설과 관련한 한국거래소의 조회공시 요구에 대해 ""상기 건을 협의 중이나 현재까지 확정된 사항이 없다""고 답변공시했다."
파이낸셜뉴스,069920,/news/news_read.nhn?article_id=0004039394&office_id=014&mode=search&query=아이에스이커머스&page=1,2018-06-14 11:26,[공시]아이에스이커머스 &quot;텐바이텐 인수 검토 중&quot;,"아이에스이커머스는 텐바이텐 인수 추진설에 관한 한국거래소의 조회공시 요구에 ""검토 중이지만 현재까지 확정된 사항은 없다""고 14일 답변했다. 회사 측은 ""이와 관련해 구체적인 내용이 확정되는 시점 또는 1개월 이내에 재공시하겠다""고 밝혔다."
뉴시스,069920,/news/news_read.nhn?article_id=0008225855&office_id=003&mode=search&query=아이에스이커머스&page=1,2017-10-16 13:58,"아이에스이커머스, 더블유컨셉코리아 지분 612억에 매각","【서울=뉴시스】정옥주 기자 = 아이에스이커머스(069920)는 더블유컨셉코리아의 지분 28만8000주를 아이엠엠로즈골드3 사모투자전문회사 업무집행사원 아이엠엠프라이빗에쿼티 주식회사에 양도한다고 16일 공시했다. 양도금액은 612억원이며, 양도예정일은 오는 11월30일이다. 회사측은 ""생활문화 브랜드 컴퍼니 빌더로서 인큐베이팅이 완료된 더블유컨셉코리아의 지분을 매각하고, 이번 매각을 통해 확보한 자금으로 엣지 플랫폼을 더욱 강화해 성장성 높은 전자상거래 기반 생활문화 브랜드를 발굴 및 육성할 계획""이라고 설명했다."
한국경제TV,069920,/news/news_read.nhn?article_id=0000656330&office_id=215&mode=search&query=아이에스이커머스&page=1,2018-07-03 13:34,"아이에스이커머스, 전일 대비 약 -4% 하락한 4,035원","[한국경제TV 라이온봇 기자] [그림 1] 최근 3개월 간 주가 추세 및 기간별 수익률 아이에스이커머스는 7월 3일 13시 33분 전일 대비 약 -4% 하락한 4,035원에 거래되고 있다. 아이에스이커머스는 코스닥 상장 기업으로 유통 업종에 속해 있다. 시가총액은 1,071억원으로 코스닥 상장기업 중 560위에 위치 해 있다. [종목 성향 진단] [그림 2] 종목 성향 진단 아이에스이커머스의 투자 스타일은 성장주에 가깝다. 주가 고평가 우려가 공존하지만 높은 성장성이 기대되는 기업이다. 주가 모멘텀은 좋은 편에 속했다. 최근 3개월 수익률은 23.89%의 상승폭을 기록했다. 최근 1개월 수익률 또한 17.16% 상승하며 좋은 모멘텀을 보이고 있다. 아이에스이커머스 종목에 대한 투자자의 관심도는 평범한 수준이었다. [투자 점수 진단] [그림 3] 투자 점수 진단 아이에스이커머스는 어느 측면에서 투자 매력도가 높은 종목일까? AI 인공지능 종목 분석 시스템을 이용해 성장성, 수익성, 효율성, 안전성, 저평가성, 추세 등 주가 수익률에 영향을 줄 수 있는 6가지 핵심 투자 지표를 점수화하여 종목의 투자 매력도를 계산해보았다. 그 결과 아이에스이커머스는 상대적으로 기업안정성 측면에서 두각을 드러내고 있었다. 기업안정성 점수는 기업의 재무 구조가 얼마나 안정적인 상태인지를 나타낸다. 아이에스이커머스는 특히 부채비율 측면에서 가장 높은 점수는 기록했는데, 전체 시장 내 278위를 기록하며 상위 13.89%에 위치했다. 업종별로는 52위를 기록하며 상위 12.5%에 위치했다. 그러나 기업의 이익 성장 추세를 나타내는 성장성 측면에서는 아쉬움을 나타냈다. (위의 AI인공지능 점수는 재무 데이터를 기반으로 전체 상장 종목과 비교/분석하여 도출한 점수로 높은 점수가 반드시 높은 수익률을 보장하지 않습니다. 위의 자료는 당사의 추천 종목이 아니며, 투자 시 참고용으로 제시해드리는 것입니다. 핵심투자지표를 결합해 종목의 투자매력도를 종합 계산한 ""인공지능 투자점수""는 ""거장들의 투자공식"" 앱에서 확인하실 수 있습니다.) 라이온봇 기자 -한국경제TV※ 본 기사는 한국경제TV와 '거장들의 투자공식이'자체 개발한 '라이온봇 기자'가 실시간으로 작성한 기사입니다. 라이온봇기자 ⓒ 한국경제TV, 무단 전재 및 재배포 금지 한국경제TV 관련뉴스해당 언론사에서 선정하며 언론사 페이지(아웃링크)로 이동해 볼 수 있습니다.중국 못지 않은 베트남 '공안'…호텔 벨보이도 조심하라비관론 쏟아낸 짐 로저스 ""한국은 예외""…무슨 이유가수 방미, 美서 수백억 성공 이룬 사연…시계 때문?집값 가장 많이 올랐다고?...최대 하락폭은 '이 곳''반도체 호황이라더니'...삼성·SK 성과급이 '무려'"
