source,symbol,link,date,title,content
이데일리,069920,/news/news_read.nhn?article_id=0004147327&office_id=018&mode=search&query=아이에스이커머스&page=1,2018-07-11 14:56,"아이에스이커머스 최대주주, 지분 확대&hellip;&ldquo;책임경영 일환&rdquo;","2~3일 4만3000여주 장내매수…“주주친화 강화할 것” [이데일리 이명철 기자] 전자상거래 기반 생활문화 브랜드기업 아이에스이커머스(069920)는 최대주주인 아이에스이네트워크와 특수관계인이 회사 주식 4만3276주를 장내 매수했다고 11일 공시를 통해 밝혔다. 아이에스이네트워크와 김응상 대표는 지난 2~3일 각각 2만5946주, 1만7330주를 사들였다. 최대주주측 지분율은 30.09%에서 30.19%로 상승했다. 이번 지분매수는 증시 불안에 따른 주가 변동성을 안정화하려는 책임경영의 일환이라는 게 회사측 설명이다. 향후 사업 전개과 실적 개선에 대한 기대감도 있다. 회사 관계자는 “글로벌 메가시티 중심으로 해외영업을 강화하고 있고 온라인 플랫폼 엣지(EDGE) 사업 성장 기조로 하반기 수익성 개선이 기대된다”며 “기업 가치를 믿고 꾸준히 지켜봐 준 투자자를 위해 주주친화정책을 강화할 것”이라고 전했다."
서울경제,069920,/news/news_read.nhn?article_id=0003129256&office_id=011&mode=search&query=아이에스이커머스&page=1,2017-10-13 13:57,"아이에스이커머스, 종속회사 지분매각 협의중",[서울경제] 아이에스이커머스(069920)는 종속회사인 더블유컨셉코리아 지분 매각과 관련해 협의 중이라고 13일 공시했다.
아시아경제,069920,/news/news_read.nhn?article_id=0004276810&office_id=277&mode=search&query=아이에스이커머스&page=1,2018-07-13 16:38,"아이에스이커머스, &quot;텐바이텐 지분 인수 추진 않기로&quot;",[아시아경제 이관주 기자] 아이에스이커머스는 텐바이텐 지분 인수를 추진하지 않기로 결정했다고 13일 공시했다. 이는 지난달 14일 한국거래소 조회공시 요구에 따른 답변이다.
헤럴드경제,069920,/news/news_read.nhn?article_id=0001431433&office_id=016&mode=search&query=아이에스이커머스&page=1,2018-08-20 15:24,"[생생코스닥]아이에스이커머스, 25억 규모 자사주 취득 결정",[헤럴드경제=증권팀] 아이에스이커머스는 주가안정 및 주주가치 제고를 위해 자사주 73만5000주를 장내 취득하기로 결정했다고 20일 공시했다. 취득예정금액은 24억9900만원이며 취득예상기간은 오는 21일부터 11월 21일까지다.
헤럴드경제,069920,/news/news_read.nhn?article_id=0001405171&office_id=016&mode=search&query=아이에스이커머스&page=1,2018-06-14 11:17,"[생생코스닥]아이에스이커머스, &ldquo;텐바이텐 인수 검토 중&rdquo;","[헤럴드경제=증권팀] 아이에스이커머스는 14일 텐바이텐 인수 추진설에 대한 조회공시 답변으로“검토 중에 있으나, 현재까지 확정된 사항은 없다”고 공시했다."
머니투데이,069920,/news/news_read.nhn?article_id=0003946533&office_id=008&mode=search&query=아이에스이커머스&page=1,2017-10-12 16:20,"[조회공시]아이에스이커머스, 지분매각 추진설",[머니투데이 신희은 기자] 한국거래소는 12일 아이에스이커머스에 최근 지분매각 추진설 관련 조회공시를 요구했다. 답변시한은 다음날 오후 12시까지다.
머니투데이,069920,/news/news_read.nhn?article_id=0003707815&office_id=008&mode=search&query=아이에스이커머스&page=1,2016-07-07 13:15,"[더벨]아이에스이커머스, 美 법인 매각&hellip;재무구조&uarr;","[더벨 류 석 기자] [올해 흑자전환 기대…""썬마그룹 지분 매각 없이 2단계 사업 착수, 협럭 강화""] 더벨|이 기사는 07월07일(13:10) 자본시장 미디어 '머니투데이 thebell'에 출고된 기사입니다. 아이에스이커머스가 미국 내 자회사 매각을 완료하고, 재무구조 개선에 나섰다. 회사의 2대 주주인 썬마그룹과의 협력도 더욱 공고히 해나갈 계획이다. 온라인쇼핑몰업체 아이에스이커머스는 지난 6월20일 미국 내 자회사 'Disys Commerce Inc'의 매각 대금 570만 달러(한화 약66억) 전액이 납입됐다고 7일 밝혔다. 회사는 이를 통해 올해 재무구조가 대폭 호전 될 것으로 기대하고 있다. 하반기 영업실적 호전도 예상하고 있다. 아이에스이커머스는 온라인쇼핑몰 '위즈위드(WIZWID)'사업을 필두로 온라인 플랫폼 사업인 'EDGE Platform Service' 운영하고 있는 기업이다. EDGE Platform Service는 회사가 현재 가장 역량을 집중하고는 사업이다. 국가간 상품 거래의 거점이 되는 곳을 중심으로 IT, 물류, 상품소싱, 마케팅 등을 플랫폼화 한 것이 특징이다. WIZWID와 내부 종속 회사는 물론, 제3의 사업자에게도 동일한 서비스를 제공해 수익을 발생시키는 구조로 운영 되고 있다. 회사 관계자는 ""EDGE Platform Service는 전자 상거래의 고도화를 통해 해외 시장 진출을 희망하는 생활·문화 브랜드 업체들에게 유용할 것""이라고 말했다. 회사는 그동안 더블유컨셉트, 커먼웰스, 수퍼리빙 등의 종속 회사들이 각각 패션, 생활, 뷰티, 음식 등의 다양한 분야에서 사업을 성공적으로 만들어 갈 수 있도록 EDGE Platform Service를 통해 지원해왔다. 이로 인해 지난 몇년 간 해당 서비스에 많은 투자가 이루어져 회사의 재무상태에 많은 영향을 끼쳤다. 올해는 대부분의 영역에 대한 투자가 종결돼 수익으로 전환될 수 있을 것으로 기대하고 있다. 회사에 따르면 더블유컨셉트의 경우, 2011년 EDGE Platform Service를 기반으로 탄생된 후 매년 큰 폭의 성장을 지속했다. 지난해에는 미국과 중국에 해당 서비스를 출시했으며, 올해는 본격적인 성과를 내고 있다. 회사는 올해 들어 적극적으로 기업설명회(IR)를 진행하고 있다. 지난 6월13일에는 한국거래소와 코스닥 협회가 주최하는 글로벌 IR 행사에 참가해 홍콩, 싱가포르 등 해외 기관투자자 및 애널리스트 들에게 회사의 사업 모델인 EDGE Platform Service를 소개해 기대 이상의 좋은 평가를 받았다. 이 회사는 향후 최고경영자(CEO) 중심의 IR조직을 강화해 국내외에서 IR활동을 적극적으로 펼쳐나갈 계획이다. 회사 관계자는 ""올해 흑자전환을 이루기 위해 모든 임직원이 최대의 역량을 투입하고 있다""며 ""올해 하반기와 내년에는 보다 높은 성장세를 보이게 될 것""이라고 말했다. 그는 또 ""2대 주주인 중국 썬마그룹의 지분에 대한 보호예수기간 종료 시점에서의 지분 매각설은 전혀 사실이 아니다""라며 ""향후 썬마그룹과의 2단계 사업진행에 착수할 것이고, 국내 및 중국 내 협업 관계를 더욱 공고히 할 것""이라고 강조했다. textlinktopstart textlinktopend textlinkstart"
파이낸셜뉴스,069920,/news/news_read.nhn?article_id=0004043243&office_id=014&mode=search&query=아이에스이커머스&page=1,2018-06-20 15:35,"[fnRASSI]오늘의 상한가, 아이에스이커머스 30% &uarr;","20일 아이에스이커머스(069920), 부국철강(026940), 경남스틸(039240), 동양에스텍(060380), 삼화전기(009470), 아이씨케이(068940)등이 상한가를 기록했다. 특히 아이에스이커머스는 전 거래일 대비 30% 오른 5,140원에 거래를 마감하며 높은 관심을 받았다. 'fnRASSI'는 증권전문 기업 씽크풀과 파이낸셜뉴스의 협업으로 로봇기자가 실시간으로 생산하는 기사입니다."
뉴시스,069920,/news/news_read.nhn?article_id=0008704763&office_id=003&mode=search&query=아이에스이커머스&page=1,2018-07-13 16:46,"아이에스이커머스 &quot;텐바이텐 지분 인수, 추진 않기로&quot;","【서울=뉴시스】장서우 기자 = 코스닥 상장 무점포 소매업체 아이에스이커머스(069920)는 텐바이텐 인수 추진설에 대한 한국거래소의 조회공시 요구에 대해 ""텐바이텐 지분 인수를 추진하지 않기로 결정했다""고 13일 답변했다."
헤럴드경제,069920,/news/news_read.nhn?article_id=0001300831&office_id=016&mode=search&query=아이에스이커머스&page=1,2017-10-12 16:56,"[생생코스닥]아이에스이커머스, 더블유컨셉코리아 지분매각 추진설 조회공시",[헤럴드경제=증권팀] 한국거래소는 12일 아이에스이커머스에 종속회사 더블유컨셉코리아 지분 매각 추진설의 사실여부 및 구체적인 내용을 묻는 조회공시를 요구했다. 답변시한은 13일 정오까지다.
한국경제,069920,/news/news_read.nhn?article_id=0003979709&office_id=015&mode=search&query=아이에스이커머스&page=1,2018-07-16 09:16,"[특징주]아이에스이커머스, 텐바이텐 인수 부인 '급락'","아이에스이커머스가 최근 불거진 텐바이텐 인수설을 공식 부인했다는 소식에 급락하고 있다. 16일 오전 9시 14분 현재 아이에스이커머스는 전날보다 305원(6.30%) 내린 4535원에 거래되고 있다. 아이에스이커머스는 지난 13일 조회공시 답변을 통해 텐바이텐 지분 인수를 추진하지 않겠다고 밝혔다. 아이에스이커머스 관계자는 ""생활문화 컴퍼니 빌더라는 기업의 지향점에 맞춰 경쟁력 있는 브랜드를 물색하는 작업을 지속적으로 시행하고 있다""며 ""텐바이텐은 복수의 후보군 중 하나였고, 실사 과정을 거쳤으나 거래 협의 단계에서 아쉽게 결렬된 사례""라고 설명했다. 정형석 한경닷컴 기자"
파이낸셜뉴스,069920,/news/news_read.nhn?article_id=0004028667&office_id=014&mode=search&query=아이에스이커머스&page=1,2018-05-28 10:53,[fnRASSI]아이에스이커머스(069920) 전일대비 8.26% 상승,"아이에스이커머스(069920)는 현재 주가가 전일 대비 8.26% 상승한 3,540원 선에서 거래가 이루어지고 있다. 외국인 보유량 감소, 기관 변화 없음 (5일 누적) 최근 5일간 동종목의 외국인 투자자는 2,762주 순매도하였고 반면 기관은 0주 순매수하였다. 전날 외국인은 2,840주 순매도했지만 기관은 순매수량이 0으로 보유비율 그대로 유지했다. 다음 표는 동종목의 외국인, 기관의 일별 순매수량을 나타낸 것이다. 퀀트 재무분석, 종합점수 40점으로 상승                    지표               항목               값               종합점수                 성장성               매출액증가율               -0.76               3.76                 자기자본증가율               0.07                 안정성               부채비율               20.87               7.64                 유동비율               316.08                 이익안정성               5.28                 수익성               ROA               37.6               5.55                 ROE               45.45                 영업이익율               -8.63          아이에스이커머스의 퀀트 재무 점수는 16.95점으로 3개월 이전 15.39점보다 올랐다. 지난 분기에 비해 성장성 점수가 하락했다. 이는 매출액 증가율이 감소하였기 때문이다. 수익성 측면에서 볼때 ROA, ROE가 개선되어 이전보다 좋은 점수를 받았다. 'fnRASSI'는 증권전문 기업 씽크풀과 파이낸셜뉴스의 협업으로 로봇기자가 실시간으로 생산하는 기사입니다."
아이뉴스24,069920,/news/news_read.nhn?article_id=0000459546&office_id=031&mode=search&query=아이에스이커머스&page=1,2018-08-20 15:29,"아이에스이커머스, 25억 자사주 취득 결정","[아이뉴스24 김다운 기자] 전자상거래 기반 생활문화 기업 아이에스이커머스는 20일 이사회를 통해 자사주 매입 계획을 결의하며 73만5천주(약 25억원 규모)를 11월 말까지 장내매수를 통해 분할 취득하기로 했다고 공시했다. 이번 자사주 매입의 배경은 기업가치를 높임과 동시에 책임 경영 의지를 표명하고, 주주가치 제고에 노력하겠다는 기업의 의지라는 설명이다. 글로벌 시장 공략이 가시화 된 만큼 기업의 성장세는 빠르게 상승할 것으로 전망했다. 김응상 아이에스이커머스 대표는 ""아이에스이커머스의 본질적 가치는 변함이 없는 만큼, 주주가치를 우선으로 생각하는 경영 방침을 지속적으로 실천해 나가겠다""고 전했다. /김다운기자"
이데일리,069920,/news/news_read.nhn?article_id=0003942338&office_id=018&mode=search&query=아이에스이커머스&page=1,2017-10-12 16:57,"거래소, 아이에스이커머스 `더블유컨셉코리아` 지분매각 조회공시",[이데일리 최정희 기자] 한국거래소는 아이에스이커머스(069920)에 종속회사 더블유컨셉코리아 지분 매각 추진설에 대한 조회 공시를 요구했다고 12일 밝혔다.
파이낸셜뉴스,069920,/news/news_read.nhn?article_id=0003950468&office_id=014&mode=search&query=아이에스이커머스&page=1,2018-01-24 09:27,"[fnRASSI]아이에스이커머스, 8.22% 오르며 거래량 증가","아이에스이커머스(069920)의 현재 거래량이 최근 5거래일 거래량의 최고치를 넘어섰다. 그리고 아이에스이커머스는 3일 연속 상승흐름을 보이며, 9시 23분 현재 8.22% 증가한 3,620원에 거래중이다. 상장주식수 대비 거래량은 0.08%로 적정수준 최근 한달간 아이에스이커의 상장주식수 대비 거래량을 비교해보니 일별 매매회전율이 0.08%로 집계됐다. 그리고 동기간 장중 저점과 고점의 차이인 일평균 주가변동률을 4.55%를 나타내고 있다. 외국인/기관 순매수, 개인은 순매도(한달누적)  1월12일부터 외국인들이 8거래일 연속 순매수 행진을 벌이고 있다. 4주간을 기준으로 보면 외국인이 순매수량을 늘리며 22,896주를 순매수했고, 기관도 매매관점을 매도에서 매수로 전환하면서 5주를 순매수했다. 반면 개인들은 매도 관점으로 접근하면서 22,901주를 순매도한 것으로 나타났다. 'fnRASSI'는 증권전문 기업 씽크풀과 파이낸셜뉴스의 협업으로 로봇기자가 실시간으로 생산하는 기사입니다."
이데일리,069920,/news/news_read.nhn?article_id=0003786873&office_id=018&mode=search&query=아이에스이커머스&page=1,2017-03-31 13:23,"아이에스이커머스, 김응상 단독 대표이사 체제로 변경",[이데일리 이후섭 기자] 아이에스이커머스(069920)는 김응수 대표이사의 임기만료로 김응상 단독 대표이사 체제로 변경한다고 31일 공시했다.
뉴시스,069920,/news/news_read.nhn?article_id=0008220194&office_id=003&mode=search&query=아이에스이커머스&page=1,2017-10-12 17:06,"거래소, 아이에스이커머스에 종속회사 관련 조회공시 요구",【서울=뉴시스】김형섭 기자 = 한국거래소 코스닥시장본부는 12일 아이에스이커머스(069920)에 종속회사 더블유컨셉코리아의 지분 매각 추진설에 대한 조회공시를 요구했다. 답변 시한은 오는 13일 낮 12시까지다.
아시아경제,069920,/news/news_read.nhn?article_id=0003965394&office_id=277&mode=search&query=아이에스이커머스&page=1,2017-03-31 12:17,"아이에스이커머스, 김응상 단독 대표 체제로 변경",[아시아경제 조강욱 기자] 아이에스이커머스는 김응수 ·김응상 대표이사 체제에서 김응상 단독 대표 체제로 변경했다고 31일 공시했다. 이는 김응수 대표의 임기 만료에 따른 것이다.
서울경제,069920,/news/news_read.nhn?article_id=0003327142&office_id=011&mode=search&query=아이에스이커머스&page=1,2018-06-20 11:08,"&lt;코&gt;아이에스이커머스, 전일 대비 12.14% 상승.. 일일회전율은 0.45% 기...","[서울경제] 아이에스이커머스(069920) 는 20일 오전 11시 6분 현재 12.14% 오른 4,435원에 거래되고 있으며, 20(매도):80(매수)의 매수우위를 기록하고 있다. 거래대금은 4억7,537만, 거래량은 11만4,152주로 거래량회전율은 0.45%로 나타났다. 지난 1개월간 아이에스이커머스는 상승 15회, 하락 12회를 기록했고, 주가수익률은 31.99% 표준편차는 2.09%를 기록했다. 이 기간 ' 유통업 ' 업종 평균 주가수익률은 12.00%로 나타났으며, 변동성은 2.69%를 기록했다. 이 시각 현재 ' 유통업 '은 3.45% 상승 중이며, 49(매도):51(매수)의 매수우위를 기록하고 있다."
머니투데이,069920,/news/news_read.nhn?article_id=0003848909&office_id=008&mode=search&query=아이에스이커머스&page=1,2017-03-31 11:57,"아이에스이커머스, 김응수&middot;김응상 대표에서 김응상 대표 체제로",[머니투데이 김훈남 기자] 아이에스이커머스는 김응수·김응상 대표이사 체제에서 김응상 단독 대표 체제로 바뀌었다고 31일 공시했다. 이는 김응수 대표의 임기 만료에 따른 것이다. textlinktopstart textlinktopend textlinkstart
뉴시스,069920,/news/news_read.nhn?article_id=0008664440&office_id=003&mode=search&query=아이에스이커머스&page=1,2018-06-20 18:00,"아이에스이커머스, 120억 규모 전환사채 발행 결정","【서울=뉴시스】이국현 기자 = 아이에스이커머스(069920)는 120억원 규모의 무기명식 이권부 무보증 사모 전환사채 발행을 결정했다고 20일 공시했다. 만기이자율은 2%이며, 전환에 따라 발행할 주식은 246만9643주다. 사채 만기일은 오는 2021년 6월22일이다."
파이낸셜뉴스,069920,/news/news_read.nhn?article_id=0003799441&office_id=014&mode=search&query=아이에스이커머스&page=1,2017-04-06 10:10,[fnRASSI]아이에스이커머스 전일대비 8.05% 상승,"아이에스이커머스(069920)는 현재 주가가 전일 대비 8.05% 상승한 4,160원 선에서 거래가 이루어지고 있다. 퀀트 재무분석, 종합점수 15점으로 상승                    지표               항목               값               종합점수                 성장성               매출액증가율               -0.16               4.02                 자기자본증가율               0.02                 안정성               부채비율               84               7.64                 유동비율               212.69                 이익안정성               5.28                 수익성               ROA               0.08               2.32                 ROE               0.15                 영업이익율               -0.48          아이에스이커머스의 퀀트 재무 점수는 13.98점으로 3개월 이전 11.73점보다 올랐다. 지난 분기에 비해 성장성 점수가 상승했다. 이는 매출액 증가율과 자기자본 증가율이 증가하였기 때문이다. 실적 안정성이 개선되어 안정성 종합 점수는 상승했다. 수익성 측면에서 볼때 ROA, ROE, 영업이익률 모두 개선되어 이전보다 좋은 점수를 받았다. 회전율이 낮지만 주가등락폭은 적정한 편 최근 한달간 아이에스이커의 상장주식수 대비 거래량을 비교해보니 일별 매매회전율이 0.02%로 집계됐다. 이처럼 회전율이 너무 낮은 경우 유동성이 떨어져 매매가 자유롭지 못할 수 있기 때문에 상당한 주의가 필요하다. 저점대비 고점의 장중 주가변동률은 평균 3.76%로 적정한 수준을 보이고 있다. 'fnRASSI'는 증권전문 기업 씽크풀과 파이낸셜뉴스의 협업으로 로봇기자가 실시간으로 생산하는 기사입니다."
서울경제,069920,/news/news_read.nhn?article_id=0003205538&office_id=011&mode=search&query=아이에스이커머스&page=1,2018-01-24 11:12,"(코)아이에스이커머스, 전일 대비 7.03% 상승.. 일일회전율은 0.44% 기록","[서울경제] 아이에스이커머스(069920) 는 24일 오전 11시 11분 현재 7.03% 오른 3,580원에 거래되고 있으며, 51(매도):49(매수)의 매도우위를 기록하고 있다. 거래대금은 4억1,298만, 거래량은 11만1,241주로 거래량회전율은 0.44%로 나타났다. 지난 1개월간 아이에스이커머스는 상승 9회, 하락 20회를 기록했고, 주가수익률은 -2.72% 표준편차는 2.25%를 기록했다. 이 기간 ' 유통업 ' 업종 평균 주가수익률은 40.65%로 나타났으며, 변동성은 4.26%를 기록했다. 이 시각 현재 ' 유통업 '은 1.51% 상승 중이며, 49(매도):51(매수)의 매수우위를 기록하고 있다."
파이낸셜뉴스,069920,/news/news_read.nhn?article_id=0004008363&office_id=014&mode=search&query=아이에스이커머스&page=1,2018-04-24 14:02,[fnRASSI]아이에스이커머스(069920) 전일대비 8.33% 상승,"현재 아이에스이커머스(069920)는 전일대비 8.33% 상승하여 3,445원 선에서 거래가 이루어지고 있다. 회전율이 낮지만 주가등락폭은 적정한 편 최근 한달간 아이에스이커의 상장주식수 대비 거래량을 비교해보니 일별 매매회전율이 0.04%로 집계됐다. 이처럼 회전율이 너무 낮은 경우 유동성이 떨어져 매매가 자유롭지 못할 수 있기 때문에 상당한 주의가 필요하다. 저점대비 고점의 장중 주가변동률은 평균 3.77%로 적정한 수준을 보이고 있다.                   지표               항목               값               종합점수                 성장성               매출액증가율               -0.54               0.96                 자기자본증가율               -0.07                 안정성               부채비율               90.38               7.5                 유동비율               209.62                 이익안정성               5                 수익성               ROA               41.05               5.72                 ROE               78.15                 영업이익율               -3.81          아이에스이커머스의 퀀트 재무 점수는 14.18점으로 지난 분기에 비해 성장성 점수가 하락했다. 이는 매출액 증가율과 자기자본 증가율이 감소하였기 때문이다. 실적 안정성이 악화되어 안정성 종합 점수는 하락했다. 수익성 측면에서 볼때 ROA, ROE가 개선되어 이전보다 좋은 점수를 받았다. 'fnRASSI'는 증권전문 기업 씽크풀과 파이낸셜뉴스의 협업으로 로봇기자가 실시간으로 생산하는 기사입니다."
한국경제,069920,/news/news_read.nhn?article_id=0003960635&office_id=015&mode=search&query=아이에스이커머스&page=1,2018-06-14 11:12,아이에스이커머스 &quot;텐바이텐 인수 검토중&quot;,"아이에스이커머스는 텐바이텐 인수 추진설에 대한 한국거래소의 조회공시 요구 답변에서 ""검토 중에 있으나 현재까지 확정된 사항은 없다""고 14일 밝혔다. 노정동 한경닷컴 기자"
이데일리,069920,/news/news_read.nhn?article_id=0003804695&office_id=018&mode=search&query=아이에스이커머스&page=1,2017-04-20 14:45,"아이에스이커머스, 27일 기업설명회 개최",[이데일리 최정희 기자] 아이에스이커머스(069920)는 27일 서울 여의도 NH투자증권에서 기업설명회(IR)를 개최키로 했다고 20일 공시했다.
