source,symbol,link,date,title,content
아시아경제,069920,/news/news_read.nhn?article_id=0003646861&office_id=277&mode=search&query=아이에스이커머스&page=1,2015-12-15 10:38,"아이에스이커머스, 中 전자상거래사업 인허가 취득","[아시아경제 김원규 기자]온라인쇼핑 전문업체 아이에스이커머스가 중국 정부로부터 전자상거래 사업 인허가를 받았다. 아이에스이커머스는 최근 중국 정부로부터 전자상거래 사업 인허가를 취득했다고 15일 밝혔다. 아이에스이커머스 관계자는 ""이번에 중국 정부로부터 사업 인허가를 받으면서 중국 전자상거래 시장에 공식적으로 진출할 수 있게 됐다""며 ""주요 상품은 국내 제품 위주의 화장품과 의류로, 중국 내 '역직구 전자상거래' 사업인 셈""이라고 말했다. 아이에스이커머스는 지난 4월 중국 전자상거래 시장 진출을 위해 중국 썬마그룹과 손 잡고 관련 작업을 진행해왔다. 지난 6월18일 썬마그룹은 아이에스커머스의 지분 17.67%(450만9583주)를 200억원에 경영 참여 목적으로 취득해 아이에스이커머스의 2대 주주에 올랐다. 이어 양사는 지난 10월15일 기업과 소비자 간 거래(B2C) 전자상거래 업체인 상하이 슈나이 인포메이션 테크놀로지를 설립했다. 아이에스이커머스는 당시 이 회사에 20억8864만원을 출자해 19.9%의 지분을 확보하는 등 중국 진출의 토대를 마련했다. 이후 상하이 슈나이 인포메이션은 지난달부터 중국 고객을 대상으로 한국 상품을 주요 품목으로 한 전자상거래 베타 서비스를 시작했고 이달 들어 전자상거래를 공식화하기 위한 마지막 관문인 인허가 취득에 성공한 것이다. 썬마그룹은 중국 현지에 7500여개 매장을 운영 중인 의류 분야 거대 상장 기업이다. 현재 시가총액은 72억달러, 우리 돈으로 8조5000억원 상당이다. 중국 국가통계국에 따르면 지난해 중국 전자상거래 시장 규모는 2조8000억위안(약 500조원)으로 B2C 거래는 이 중 45%에 해당하는 1조2900억위안(약 300조원)에 달했다. 올해 상반기에만 중국 전자상거래 시장은 1조9000억위안(약 340조원) 규모로, 전년보다 40% 가까이 성장했다."
한국경제TV,069920,/news/news_read.nhn?article_id=0000659821&office_id=215&mode=search&query=아이에스이커머스&page=1,2018-07-11 12:33,"아이에스이커머스, 전일 대비 약 4% 상승한 4,630원","[한국경제TV 라이온봇 기자] [그림 1] 최근 3개월 간 주가 추세 및 기간별 수익률 아이에스이커머스는 7월 11일 12시 32분 전일 대비 약 4% 상승한 4,630원에 거래되고 있다. 아이에스이커머스는 코스닥 상장 기업으로 유통 업종에 속해 있다. 시가총액은 1,140억원으로 코스닥 상장기업 중 544위에 위치 해 있다. [종목 성향 진단] [그림 2] 종목 성향 진단 아이에스이커머스의 투자 스타일은 성장주에 가깝다. 주가 고평가 우려가 공존하지만 높은 성장성이 기대되는 기업이다. 주가 모멘텀은 좋은 편에 속했다. 최근 3개월 수익률은 35.05%의 상승폭을 기록했다. 최근 1개월 수익률 또한 21.14% 상승하며 좋은 모멘텀을 보이고 있다. 아이에스이커머스 종목에 대한 투자자의 관심도는 평범한 수준이었다. [투자 점수 진단] [그림 3] 투자 점수 진단 아이에스이커머스는 어느 측면에서 투자 매력도가 높은 종목일까? AI 인공지능 종목 분석 시스템을 이용해 성장성, 수익성, 효율성, 안전성, 저평가성, 추세 등 주가 수익률에 영향을 줄 수 있는 6가지 핵심 투자 지표를 점수화하여 종목의 투자 매력도를 계산해보았다. 그 결과 아이에스이커머스는 상대적으로 기업안정성 측면에서 두각을 드러내고 있었다. 기업안정성 점수는 기업의 재무 구조가 얼마나 안정적인 상태인지를 나타낸다. 아이에스이커머스는 특히 부채비율 측면에서 가장 높은 점수는 기록했는데, 전체 시장 내 278위를 기록하며 상위 13.89%에 위치했다. 업종별로는 52위를 기록하며 상위 12.5%에 위치했다. 그러나 기업의 이익 성장 추세를 나타내는 성장성 측면에서는 아쉬움을 나타냈다. (위의 AI인공지능 점수는 재무 데이터를 기반으로 전체 상장 종목과 비교/분석하여 도출한 점수로 높은 점수가 반드시 높은 수익률을 보장하지 않습니다. 위의 자료는 당사의 추천 종목이 아니며, 투자 시 참고용으로 제시해드리는 것입니다. 핵심투자지표를 결합해 종목의 투자매력도를 종합 계산한 ""인공지능 투자점수""는 ""거장들의 투자공식"" 앱에서 확인하실 수 있습니다.) 라이온봇 기자 -한국경제TV※ 본 기사는 한국경제TV와 '거장들의 투자공식이'자체 개발한 '라이온봇 기자'가 실시간으로 작성한 기사입니다. 라이온봇기자 ⓒ 한국경제TV, 무단 전재 및 재배포 금지 한국경제TV 관련뉴스해당 언론사에서 선정하며 언론사 페이지(아웃링크)로 이동해 볼 수 있습니다.대한항공, 진짜 위기 덮친다...2분기 실적전망 '충격적'90도 숙인 이재용...文 대통령의 한마디 ""한국에도...""최지우 남편, 베일 벗었다…'훈남에 생활앱 대표'장하준 교수 ""韓 주식시장은 자동인출기""…해법 있다심은진, 김기덕 루머 유포한 스토커에 분노 ""사람 잘못 골랐어"""
이데일리,069920,/news/news_read.nhn?article_id=0004162171&office_id=018&mode=search&query=아이에스이커머스&page=1,2018-07-31 10:39,"아이에스이커머스 &lsquo;W컨셉 차이나&rsquo;, 약 146억 규모 유상증자 결정","中 썬마그룹·아이에스이커머스 유상증자 참여 [이데일리 이광수 기자] 전자상거래 기반 생활문화 브랜드 기업 아이에스이커머스(069920)의 핵심 관계사 ‘W컨셉 차이나’가 약 146억 원(9000만 위안) 규모의 유상증자를 결정했다고 31일 밝혔다. 중국 대표 의류기업 썬마그룹과 아이에스이커머스가 유상증자에 참여하며, 투자금액은 각각 117억원, 29억원 규모다. 현재 ‘W컨셉 차이나’는 썬마그룹이 지분 80.1%를 보유해 최대주주로 있으며, 아이에스이머스도 지분 19.9%로 주요주주로 있다. 증자 후 지분율에 변동은 없다. 이번 증자로 확보된 자금은 글로벌 상품 소싱 및 판매 강화를 위한 IT기술 개발과 수익성 높은 자체브랜드(PB) 상품개발에 활용할 예정이다. 지난 2015년 아이에스이커머스와 썬마그룹이 합작투자해 출범한 ‘W컨셉 차이나’는 중국 소비자들에게 국내 브랜드를 알리는 역할을 수행하며, 중국사업에 중추적인 역할을 담당하고 있다. 현재 ‘티몰’과 ‘징동’, ‘세쿠’ 등 대형 플랫폼에 순차적으로 입점을 준비하고 있는 상태다. 이번 증자는 직접적인 연관을 맺고 있는 관계사들이 ‘W컨셉 차이나’의 성장 잠재력을 높게 평가한 것은 물론, 상호 신의를 증명하는 의미 있는 증자로 풀이가 가능하다는게 회사 측 설명이다. 아이에스이커머스 관계자는 “일시적 정체기에 빠졌던 중국시장이 다시 활성화되고 있는 추세에 맞춰 ‘W컨셉 차이나’의 성장세도 강화되고 있다”며 “한층 강화된 온라인 플랫폼 엣지(EDGE)를 활용해 향후 ‘W컨셉 차이나’의 브랜드 파워가 더욱 커질 것으로 예상된다”고 말했다."
한국경제,069920,/news/news_read.nhn?article_id=0003959571&office_id=015&mode=search&query=아이에스이커머스&page=1,2018-06-12 13:47,"거래소, 아이에스이커머스에 텐바이텐 인수 추진설 조회공시 요구",한국거래소 코스닥시장본부는 12일 아이에스이커머스에 텐바이텐 인수 추진설과 관련한 조회공시를 요구했다. 답변시한은 14일 정오까지다. 전형진 한경닷컴 기자
연합뉴스,069920,/news/news_read.nhn?article_id=0010144274&office_id=001&mode=search&query=아이에스이커머스&page=1,2018-06-12 13:57,아이에스이커머스에 '텐바이텐 인수 추진설' 조회공시 요구,(서울=연합뉴스) 전명훈 기자 = 한국거래소 코스닥시장본부는 아이에스이커머스에 '텐바이텐 인수 추진설'이 사실인지 조회공시를 요구했다. 답변 시한은 14일 정오다.
머니투데이,069920,/news/news_read.nhn?article_id=0003536827&office_id=008&mode=search&query=아이에스이커머스&page=1,2015-09-03 18:01,"지에스비홀딩스, 아이에스이커머스 주요종속회사서 탈퇴",[머니투데이 안재용 기자] 아이에스이커머스는 지에스비홀딩스와의 합병에 따라 주요 종속회사에서 탈퇴했다고 3일 공시했다. textlinktopstart textlinktopend textlinkstart
한국경제TV,069920,/news/news_read.nhn?article_id=0000650738&office_id=215&mode=search&query=아이에스이커머스&page=1,2018-06-20 12:37,"아이에스이커머스, 20% 급등... 전일 보다 795원 상승한 4,750원","[한국경제TV 라이온봇 기자] [그림 1] 최근 3개월 간 주가 추세 및 기간별 수익률 아이에스이커머스는 6월 20일 12시 37분 전일 대비 약 20% 급등한 4,750원에 거래되고 있다. 아이에스이커머스는 코스닥 상장 기업으로 유통 업종에 속해 있다. 시가총액은 1,009억원으로 코스닥 상장기업 중 619위에 위치 해 있다. [종목 성향 진단] [그림 2] 종목 성향 진단 아이에스이커머스의 투자 스타일은 성장주에 가깝다. 주가 고평가 우려가 공존하지만 높은 성장성이 기대되는 기업이다. 주가 모멘텀은 좋은 편에 속했다. 최근 1개월 수익률은 12.27%의 상승폭을 기록했다. 아이에스이커머스 종목에 대한 투자자의 관심도는 상대적으로 낮은 편이었다. [투자 점수 진단] [그림 3] 투자 점수 진단 아이에스이커머스는 어느 측면에서 투자 매력도가 높은 종목일까? AI 인공지능 종목 분석 시스템을 이용해 성장성, 수익성, 효율성, 안전성, 저평가성, 추세 등 주가 수익률에 영향을 줄 수 있는 6가지 핵심 투자 지표를 점수화하여 종목의 투자 매력도를 계산해보았다. 그 결과 아이에스이커머스는 상대적으로 기업안정성 측면에서 두각을 드러내고 있었다. 기업안정성 점수는 기업의 재무 구조가 얼마나 안정적인 상태인지를 나타낸다. 아이에스이커머스는 특히 부채비율 측면에서 가장 높은 점수는 기록했는데, 전체 시장 내 279위를 기록하며 상위 13.95%에 위치했다. 업종별로는 53위를 기록하며 상위 12.75%에 위치했다. 그러나 기업의 이익 성장 추세를 나타내는 성장성 측면에서는 아쉬움을 나타냈다. (위의 AI인공지능 점수는 재무 데이터를 기반으로 전체 상장 종목과 비교/분석하여 도출한 점수로 높은 점수가 반드시 높은 수익률을 보장하지 않습니다. 위의 자료는 당사의 추천 종목이 아니며, 투자 시 참고용으로 제시해드리는 것입니다. 핵심투자지표를 결합해 종목의 투자매력도를 종합 계산한 ""인공지능 투자점수""는 ""거장들의 투자공식"" 앱에서 확인하실 수 있습니다.) 라이온봇 기자 -한국경제TV※ 본 기사는 한국경제TV와 '거장들의 투자공식이'자체 개발한 '라이온봇 기자'가 실시간으로 작성한 기사입니다. 라이온봇기자 ⓒ 한국경제TV, 무단 전재 및 재배포 금지 한국경제TV 관련뉴스해당 언론사에서 선정하며 언론사 페이지(아웃링크)로 이동해 볼 수 있습니다.외국인도 외면한 삼성전자…3분기엔 회복할까빗썸, 해킹으로 350억 탈취...입출금 전면 중단기준금리 인상 '한걸음 더'…시점은 불투명한진家 이명희 수행기사 ""얼굴에 침…인간 이하였다""싼타페 꺾을 새 SUV 등장…가격 차이는?"
이데일리,069920,/news/news_read.nhn?article_id=0003339377&office_id=018&mode=search&query=아이에스이커머스&page=1,2015-09-03 17:56,"아이에스이커머스, 지에스비홀딩스 주요종속회사서 탈퇴",[이데일리 박기주 기자] 아이에스이커머스(069920)는 지에스비홀딩스가 커먼웰스에 흡수합병되면서 주요종속회사에서 탈퇴됐다고 3일 공시했다.
머니투데이,069920,/news/news_read.nhn?article_id=0004063793&office_id=008&mode=search&query=아이에스이커머스&page=1,2018-06-12 14:18,"아이에스이커머스, 텐바이텐 인수 추진설 조회 공시 요구",[머니투데이 김지훈 기자] 한국거래소 코스닥시장본부는 12일 아이에스이커머스에 '텐바이텐 인수 추진설'의 사실 관계를 확인하는 조회 공시를 요구했다.
이데일리,069920,/news/news_read.nhn?article_id=0003626698&office_id=018&mode=search&query=아이에스이커머스&page=1,2016-09-08 10:07,"김응상 공동대표이사, 아이에스이커머스 지분 2.84&rarr;1.61%",[이데일리 송이라 기자] 김응상 아이에스이커머스(069920) 공동대표이사는 장내매수를 통해 5만5600주를 취득했다고 8일 공시했다. 보유주식수는 기존보다 늘었지만 전체 발행주식수도 증가하면서 지분율은 기존 2.84%에서 1.61%로 줄었다.
아이뉴스24,069920,/news/news_read.nhn?article_id=0000453759&office_id=031&mode=search&query=아이에스이커머스&page=1,2018-07-11 10:23,"아이에스이커머스, 최대주주 및 특수관계인 장내매수","[아이뉴스24 한수연 기자] 아이에스이커머스가 최대주주인 아이에스이네트워크 및 특수관계인이 자사 주식 4만3천276주를 장내 매수했다고 11일 밝혔다. 아이에스이네크워크와 김응상 아이에스이커머스 대표는 지난 2일과 3일 이틀간 각각 2만5천946주, 1만7천330주를 장내 매수했다. 이에 따라 최대주주의 지분율은 30.19%로 늘었다. 이번 지분매수는 증시 불안에 따른 주가 변동성을 안정화 시키려는 책임경영의 의지 표명으로 향후 사업 전개에 대한 자신감 및 실적 개선의 긍정적 시그널로도 해석해 달라는 게 사측의 설명이다. 현재 아이에스이커머스는 글로벌 메가시티를 중심으로 해외영업을 강화하고 있다. 온라인 플랫폼 엣지(EDGE) 사업의 성장기조 속에 하반기 수익성 개선을 기대한다고 회사 측은 전했다. 또한 아이에스이커머스의 기업 가치를 믿고, 꾸준히 지켜봐 준 투자자들을 위한 주주친화정책을 강화하겠다는 방침이다. /한수연 기자"
한국경제,069920,/news/news_read.nhn?article_id=0003837659&office_id=015&mode=search&query=아이에스이커머스&page=1,2017-10-19 11:04,"아이에스이커머스, 자회사 '더블유컨셉코리아' 매각 입장 발표","아이에스이커머스가 19일 최근 진행한 자회사 지분 매각에 대한 기업의 입장을 밝혔다. 김응상 아이에스이커머스 대표는 '주주에게 전하는 글'을 통해 ""자회사 더블유컨셉코리아의 경영권 지분 매각은 일시적인 판단이 아닌 기업에서 다년간 준비한 노력의 결과물""이라며 ""성장 고점에 오른 브랜드를 처분하는 형태가 아닌 인큐베이팅 과정을 거친 독립의 형태로 알아달라""고 말했다. 또 ""생활문화 브랜드 컴퍼니 빌더로 나아가기 위한 출발점인 만큼 전 임직원이 최선을 다해 기업 가치를 상승시키도록 만전을 기하겠다""고 덧붙였다. 아이에스이커머스는 지난 16일 자체 개발한 온라인 패션 플랫폼 '더블유컨셉코리아'의 지분 28만8000주를 사모펀드인 IMM PE에 매각했다. 다음은 김응상 대표의  전문. 안녕하십니까 주주 여러분, 아이에스이커머스 대표이사 김응상 입니다. 최근 진행된 자회사 지분 매각과 관련해, 주주 여러분의 판단에 도움이 되고자 매각 배경과 기업의 향후 계획을 전하고자 합니다. 저희 아이에스이커머스는 지난 2000년 SK네트웍스(당시 SK글로벌)의 신규 사업부에서 시작, 위즈위드(wizwid) 사업을 필두로 온라인 플랫폼 '엣지(EDGE)'를 주력사업으로 영위하며 성장했습니다. 이번에 지분 매각을 진행한 ‘더블유컨셉코리아’는 당사의 핵심 자회사로 ‘엣지 플랫폼’이 기반이 되어, 가치 상승을 이뤄낸 온라인 패션 편집샵 입니다. 이번 매각은 일시적인 판단이 아닌 기업에서 다년간 준비한 노력의 결과물입니다. 당사는 지난 2008년 더블유컨셉코리아 설립부터 현재에 이르기까지 지속적인 투자를 통해 브랜드 가치 상승에 전념했습니다. 노력의 성과는 브랜드의 외형 성장으로 나타났으며, 더블유컨셉코리아의 기업 가치는 전년대비 2배 이상 커지며 1,000억원 수준을 바라보게 되었습니다. 이는 아이에스이커머스의 엣지 플랫폼을 통한 결과로 판단되며, 당사는 여기에 그치지 않고 또 한번의 성장을 바라보고 있습니다. 단순히 성장 고점에 오른 브랜드를 처분하는 형태가 아니라 인큐베이팅 과정을 거친 독립의 형태로 알아주시면 좋겠습니다. 당사는 매각 이후에도 더블유컨셉코리아의 2대 주주로 남아 관계를 유지하는 한편, 서비스 제공을 이어가며 윈(WIN)-윈(WIN) 체제를 견고히 구축할 것입니다. 이미 제2, 제3의 더블유컨셉코리아의 발굴은 진행되고 있으며, 후속 모델의 순차적인 성공을 통해 당사는 컴퍼니 빌더로서의 독자적인 능력을 갖추게 될 것입니다. 아이에스이커머스의 기업가치를 인정하시고 투자해 주신 주주 여러분, 현재 아이에스이커머스는 '생활문화 브랜드 컴퍼니 빌더’로 나아가기 위한 출발점에 서 있으며, 이번 사례는 그 역량을 입증한 첫 번째 시도로 자부하고 있습니다. 갑작스런 사업 전략 공표로 혼란을 느끼신 주주분들이 계시다면 최고 경영자로서 송구한 마음 금할 길이 없습니다. 앞으로 주주 중시 경영을 실천하며 기업 가치 상승에 만전을 기하겠습니다. 저를 포함한 임직원 일동은 더욱더 열심히 노력할 것임을 약속드리오니, 아이에스이커머스에 계속해서 많은 관심과 애정 보내 주시길 바랍니다. 아이에스이커머스 대표이사 김응상 배상."
아시아경제,069920,/news/news_read.nhn?article_id=0004258080&office_id=277&mode=search&query=아이에스이커머스&page=1,2018-06-14 14:02,아이에스이커머스 &quot;텐바이텐 인수 추진 검토&quot;,"[아시아경제 문채석 기자]아이에스이커머스는 텐바이텐 인수 추진설에 관한 한국거래소의 조회공시 요구에 ""검토 중이지만 현재까지 확정된 사항은 없다""고 14일 답변했다. 회사 측은 ""이와 관련해 구체적인 내용이 확정되는 시점 또는 한달 내에 재공시하겠다""고 밝혔다."
아시아경제,069920,/news/news_read.nhn?article_id=0004261691&office_id=277&mode=search&query=아이에스이커머스&page=1,2018-06-20 17:27,"아이에스이커머스, 120억원 규모 CB 발행",[아시아경제 배경환 기자] 아이에스이커머스는 120억원 규모의 무기명식 무보증 사모 전환사채(CB) 발행을 결정했다고 20일 공시했다.
이데일리,069920,/news/news_read.nhn?article_id=0004125425&office_id=018&mode=search&query=아이에스이커머스&page=1,2018-06-14 11:45,아이에스이커머스 &quot;텐바이텐 인수 검토 중&quot;,[이데일리 이후섭 기자] 아이에스이커머스(069920)는 한국거래소의 텐바이텐 인수 추진설에 대한 조회공시 요구에 “텐바이텐 인수 관련 검토중에 있으나 현재까지 확정된 사항은 없다”고 14일 공시했다.
아시아경제,069920,/news/news_read.nhn?article_id=0004287161&office_id=277&mode=search&query=아이에스이커머스&page=1,2018-07-31 09:16,"아이에스이커머스 관계사 'W컨셉 차이나', 약146억 규모 유상증자 결정","[아시아경제 문채석 기자]전자상거래 기반 생활문화 브랜드 리딩 기업 아이에스이커머스의 핵심 관계사 ‘W컨셉 차이나’가 약 146억 원(9000만 위안) 규모의 유상증자를 결정했다고 31일 밝혔다. 중국 대표 의류기업 썬마그룹과 아이에스이커머스가 유상증자에 참여하며, 투자금액은 각각 117억원, 29억원 규모다. 현재 'W컨셉 차이나'는 썬마그룹이 지분 80.1%를 보유해 최대주주고 아이에스이머스(19.9%)는 주요주주다. 증자 후 지분율에 변동은 없다. 이번 증자로 확보된 자금은 글로벌 상품 소싱 및 판매 강화를 위한 IT기술 개발 및 수익성 높은 자체브랜드(PB) 상품개발에 활용할 예정이다. 지난 2015년 아이에스이커머스와 썬마그룹이 합작투자해 출범한 ‘W컨셉 차이나’는 중국 소비자들에게 국내 브랜드를 알리는 역할을 수행하며, 중국사업에 중추적인 역할을 담당하고 있다. 현재 티몰(tmall) 비롯해, 징동(JD.com), 세쿠(Secoo)등 대형 플랫폼에 순차적으로 입점을 준비하고 있는 상태다. 이번 증자는 직접적인 연관을 맺고 있는 관계사들이 ‘W컨셉 차이나’의 성장 잠재력을 높게 평가한 것은 물론, 상호 신의를 증명하는 의미 있는 증자로 풀이가 가능하다. 아이에스이커머스 관계자는 “일시적 정체기에 빠졌던 중국시장이 다시 활성화되고 있는 추세에 맞춰 ‘W컨셉 차이나’의 성장세도 강화되고 있다”며 “한층 강화된 온라인 플랫폼 엣지(EDGE)를 활용해 향후 ‘W컨셉 차이나’의 브랜드 파워가 더욱 커질 것으로 예상되어, 이를 통해 아이에스이커머스의 외형 성장과 수익성 강화가 전망된다”고 전했다. 현재 아이에스이커머스는 온라인 플랫폼 엣지의 안정적인 서비스를 기반으로 생활문화 브랜드 컴퍼니 빌더로서의 입지를 다져가고 있다."
이데일리,069920,/news/news_read.nhn?article_id=0004130661&office_id=018&mode=search&query=아이에스이커머스&page=1,2018-06-20 17:25,"아이에스이커머스, 120억 CB 발행&hellip;브랜드 인수 등 활용","해외 브랜드 라이선스, 독점판매권한 인수 등도 검토 [이데일리 이명철 기자] 전자상거래 기반 생활문화 브랜드기업 아이에스이커머스(069920)는 120억원 규모의 4회차 무기명식 무보증 사모 전환사채(CB) 발행을 결정했다고 20일 공시를 통해 밝혔다. 전환가액은 기준주가 대비 25% 할증한 4859원이다. 표면이자율은 0%, 만기보장수익률 연복리 2%다. 만기일은 2021년 6월 22일이다. 기업 가치를 인정받으며 최적의 조건으로 자금을 조달했다고 회사측은 평가했다. 조달한 자금은 해외 브랜드 라이선스나 독점판매권한(DT권) 등 인수, 엣지 플랫폼의 서비스 경쟁력 강화에 투입할 예정이다. 생활문화 브랜드 컴퍼니 빌더라는 중장기 목표를 바탕으로 현재 논의 중인 브랜드 인수에도 활용될 전망이다. 위즈위드는 현재 다른 채널과 다른 상품 차별화를 진행 중이다. 상품 소싱 과정에서 가격 경쟁력과 매출 확대의 시너지가 있는 2~3개의 해외 브랜드 인수를 모색 중이다. 회사 관계자는 “지금까지 글로벌 유통사로 가는 틀을 다졌다면 이제부터 본격 도약할 수 있는 환경이 조성돼 성과가 가시화될 것”이라고 말했다."
