source,symbol,link,date,title,content
머니투데이,080720,/news/news_read.nhn?article_id=0004083375&office_id=008&mode=search&query=한국유니온제약&page=1,2018-07-26 09:04,"한국유니온제약, 시초가 2만3000원&hellip;공모가 대비 27.8%&uarr;","[머니투데이 박계현 기자] 한국유니온제약이 26일 코스닥 시장 상장 첫날 공모가에서 27.8% 오른 2만3000원의 시초가를 기록했다. 한국유니온제약은 오전 9시 3분 현재 시초가 대비 1.74%(400원) 오른 2만3400원을 기록하고 있다. 한국유니온제약은 이 날 오전 8∼9시에 공모가격인 1만8000원의 90~200% 사이에서 호가를 접수했으며, 매도호가와 매수호가가 합치되는 가격으로 결정한 시초가가 공모가의 128% 수준인 2만3000원으로 결정됐다. 회사 측은 당초 공모희망가로 1만3500원~1만6000원을 제시했으며 이 달 9~10일 실시한 수요예측에서 918.99 대 1을 기록, 공모가 밴드 상단 밖인 1만8000원으로 공모가가 결정됐다. 이어 이 달 17~18일 진행한 일반공모 청약에선 최종 청약 경쟁률 1015.13 대 1을 기록했다. 한국유니온제약은 전문의약품 제조 및 판매 전문 기업이다. △항생제 케포돈주 △혈관확장제 리마스타정 △위산분비 억제제 뉴란소캡슐 △퇴행성 관절염 치료제 유니히알주 등의 주요 제품 라인업을 보유하고 있다. 지난해 기준 매출액 508억원, 영업이익 79억원, 당기순이익 31억원을 기록했다. 주관사는 DB금융투자다."
뉴시스,080720,/news/news_read.nhn?article_id=0008653537&office_id=003&mode=search&query=한국유니온제약&page=1,2018-06-14 10:06,"한국유니온제약, 증권신고서 제출&hellip;코스닥 상장 '초읽기'","공모액 202억~240억…""R&amp;D·시설 투자 등에 사용""7월 9~10일 수요예측, 17~18일 공모 청약 예정 【서울=뉴시스】장서우 기자 = 전문 의약품 전문회사 한국유니온제약이 코스닥 시장 상장을 위한 절차에 돌입했다. 한국유니온제약은 지난 12일 금융위원회에 증권신고서를 제출했다고 14일 밝혔다. 총 공모 주식 수는 150만주다. 주당 희망 공모가 밴드는 1만3500~1만6000원이며 총 공모액 규모는 202억~240억원이다. 다음달 9~10일 기관투자자 대상 수요예측을 실시, 공모가를 확정한 후 같은달 17~18일 일반투자자 대상 공모 청약이 진행된다. 대표 주관사는 DB금융투자다. 한국유니온제약은 지난 1985년 설립된 제약기업이다. 전문의약품의 제조·판매, 수출, 수탁사업(CMO) 등을 영위하고 있다. 대표 의약품으로는세파 항생제 '케포돈주', 혈관 확장제 '리마스타정', 위산분비 억제제 '뉴란소캡슐', 퇴행성 관절염 치료제 '유니히알주' 등이 있다. 회사는 특히 인터올리고와 함께 기존 항체를 효과적으로 대체할 수 있는 물질로 기대받고 있는 '압타머(Aptamer)'를 활용한 유방암 표적 양전자방출단층촬영(PET) 조영제를 개발 중이다. 지난해 실적은 매출액 508억4600만원, 영업이익 78억5800만원을 기록했다. 백병하 한국유니온제약 대표는 ""회사의 장기적이고 안정적인 성장을 위해 기업 인지도와 재무 안정성의 제고, 우수 인력 유치 등의 목적으로 상장을 결정했다""며 ""공모 자금은 연구·개발(R&D)과 시설 투자 등에 사용할 계획""이라고 밝혔다."
아이뉴스24,080720,/news/news_read.nhn?article_id=0000453962&office_id=031&mode=search&query=한국유니온제약&page=1,2018-07-12 10:40,"한국유니온제약, 공모가 1만8천원&hellip; 밴드 최상단 초과","[아이뉴스24 장효원 기자] 전문의약품 전문회사 한국유니온제약(대표이사 백병하)의 공모가가 공모희망가 밴드 최상단을 넘어선 1만8천원으로 확정됐다. 한국유니온제약은 지난 9~10일 이틀에 걸쳐 총 공모주식수 150만주 중 62.07%인 93만1천주를 대상으로 실시한 수요예측에 총 995개의 기관이 참여해 918.99대 1의 경쟁률을 기록했다고 12일 공시했다. 공모가가 1만8천원으로 확정되면서 한국유니온제약의 총 공모금액은 270억원, 상장 후 시가총액은 약 1천34억원으로 예상된다. 회사 관계자는 ""수요예측에 참여해 주신 국내외 기관투자자 분들의 높은 관심에 큰 감사를 표한다""며 ""다음주에 진행되는 일반투자자 청약에도 많은 관심을 부탁드린다""고 말했다. 한국유니온제약은 오는 17~18일 양일 간 총 공모주식수의 20%인 30만주에 대한 일반 공모 청약을 실시한다. 상장 예정일은 26일, 대표 주관회사는 DB금융투자다. 한편 한국유니온제약은 지난 1985년 설립된 전문의약품 제조 및 판매 전문 제약기업으로 전문의약품 제조와 판매, 해외수출, 수탁사업(CMO) 등의 사업을 영위하고 있다. 회사의 신성장동력 발굴을 위해 기존 항체를 효과적으로 대체할 수 있는 물질로 기대받고 있는 압타머(Aptamer)를 활용한 유방암 표적 양전자방출단층촬영(PET) 조영제를 인터올리고와 공동 개발하고 있다. 2017년 실적은 매출액 508억4천600만원, 영업이익 78억5천800만원을 기록했다. /장효원기자"
서울경제,080720,/news/news_read.nhn?article_id=0003368261&office_id=011&mode=search&query=한국유니온제약&page=1,2018-08-09 14:23,"한국유니온제약, 122억 투자해 원주에 공장 신설키로","[서울경제] 한국유니온제약은 122억7,000만원을 투자해 강원 원주시 문막공단에 공장을 신설하기로 했다고 9일 공시했다. 의약 및 CMO사업 확장에 따른 공장 신축이다. 투자규모는 자기자본 대비 24.6%에 해당한다. 투자기간은 내년 6월 30일까지다."
한국경제,080720,/news/news_read.nhn?article_id=0003993071&office_id=015&mode=search&query=한국유니온제약&page=1,2018-08-09 11:28,"한국유니온제약, 122억 투자해 원주에 공장 신설키로",한국유니온제약은 122억7000만원을 투자해 강원 원주시 문막공단에 공장을 신설하기로 했다고 9일 공시했다. 의약 및 CMO사업 확장에 따른 공장 신축이다. 투자규모는 자기자본 대비 24.6%에 해당한다. 투자기간은 내년 6월 30일까지다. 전형진 한경닷컴 기자
뉴시스,080720,/news/news_read.nhn?article_id=0008723921&office_id=003&mode=search&query=한국유니온제약&page=1,2018-07-25 08:05,코스닥 상장 앞둔 백병하 한국유니온제약 대표이사,【성남=뉴시스】고범준 기자 = 백병하 한국유니온제약 대표이사가 16일 오후 경기도 성남시 분당구 한국유니온제약 본사에서 코스닥 상장을 앞두고 뉴시스와 인터뷰를 하고 있다. 2018.07.25.
한국경제,080720,/news/news_read.nhn?article_id=0003985549&office_id=015&mode=search&query=한국유니온제약&page=1,2018-07-26 02:10,[코스닥 메모] (26일) 신규상장=한국유니온제약(080720) 등,◇신규상장=한국유니온제약(080720) ◇무상기준일=펩트론 ◇유상권리락=경창산업 ◇일반공모청약=솔고바이오 ◇공모주청약=디아이티(삼성) 휴네시온(NH) 에스에스알(하나) [
전자신문,080720,/news/news_read.nhn?article_id=0002728829&office_id=030&mode=search&query=한국유니온제약&page=1,2018-07-31 16:26,"[ET투자뉴스][한국유니온제약 지분 변동] 이성수8.36%p 증가, 8.36% 보...","한국유니온제약(080720)은 31일 주주 이성수의 보유주식이 증가되었다고 발표했다. 이는 직전 보고일보다 480,000주 증가하여 지분율은 8.36%로 상승했다. 이번 보고 사유는 코스닥시장상장에 따른 신규보고로  알려졌다.   최대주주와 특수관계자의 지분 변동은 주가에 영향을 주는 요인이다. 특히 보유비율을 지속적으로 늘리거나 줄일 경우, 해당종목 투자시 유의할 필요가 있다.  다음은 한국유니온제약의 지분 변동 내역과 보유 내역이다."
매일경제,080720,/news/news_read.nhn?article_id=0004209866&office_id=009&mode=search&query=한국유니온제약&page=1,2018-08-30 09:33,"한국유니온제약, `한국유니온생명과학` 설립","한국유니온제약은 바이오의약품 산업 진출을 위한 자회사로 '한국유니온생명과학'을 설립하고 연구소장과 책임연구원에 각각 이재삼 박사와 김정석 박사를 영입했다고 30일 밝혔다. 회사 관계자는 ""전임상을 앞두고 있는 '압타머(Aptamer)'를 활용한 유방암 표적 양전자방출단층촬영(PET) 조영제와 췌장암 표적 항암제 연구개발을 전담하기 위해 자회사인 연구소를 설립했다""며 ""인터올리고와 공동으로 연구 중인 압타머 외에도 엑소좀을 활용한 치료제 개발에도 나설 계획""이라고 말했다. 한국유니온생명과학은 연구소 설립과 동시에 엑소좀(Exosome)을 이용한 암, 심혈관 질환 등 난치성 질환의 조기 진단과 효율적인 질환별 치료제의 개발을 시작한다. 엑소좀은 세포가 다른 세포에 특정 정보를 전달할 목적으로 자신의 유전자나 단백질을 담아 분비하는 나노 크기의 소포체다. 엑소좀의 특성을 분석해 유래 세포의 상태를 확인하고 병인을 진단할 수 있으며 정확한 진단을 통해 효율적인 치료제를 개발할 수 있을 것으로 회사는 전망하고 있다. 이재삼 연구소장은 ""압타머와 엑소좀의 응용 연구를 위한 연구원을 충원하고 있으며 이를 기반으로 한 진단 및 항암제 개발을 본격적으로 수행할 계획""이라며 ""앞으로 획기적인 진단과 치료제 개발을 위한 국내외 대학, 병원, 연구소, 제약회사 등과의 공동개발을 적극적으로 추진할 것""이라고 말했다. [디지털뉴스국 김경택 기자] r_start // r_end //"
아시아경제,080720,/news/news_read.nhn?article_id=0004283286&office_id=277&mode=search&query=한국유니온제약&page=1,2018-07-24 18:07,"한국유니온제약, 26일 코스닥 신규 상장","[아시아경제 김흥순 기자] 한국거래소는 한국유니온제약이 코스닥에 신규 상장된다고 24일 발표했다. 주식 매매는 오는 26일부터 시작된다.  공모가는 주당 1만8000원, 액면가는 500원이다.  한국유니온제약은 1985년 8월 설립된 의약품 제조업체다. 지난 해 별도기준 매출은 508억원, 당기순이익 31억원이며 자본금은 현재 29억원 수준이다."
매일경제,080720,/news/news_read.nhn?article_id=0004180117&office_id=009&mode=search&query=한국유니온제약&page=1,2018-07-06 04:03,[위클리 마켓] 골격근이완제 생산 한국유니온제약 17~18일 청약,"다음주는 롯데그룹에서 IT서비스를 담당하는 롯데정보통신의 기업공개(IPO) 수요예측이 예정돼 있다. 유망한 바이오 종목들도 IPO를 위한 수요예측과 공모청약을 진행한다. 한국유니온제약은 수요예측을, 올릭스와 엠코르셋은 공모청약을 각각 진행할 예정이다. 삼일제약과 중앙백신, 잘만테크는 유상증자 청약을 실시한다. 유망기업을 인수할 목적으로 만들어진 아이비케이에스 제9호기업인수목적도 11일과 12일 양일간 공모청약을 실시한다. 대표적인 경협주로 지목받으며 주가가 크게 뛰었던 쌍용양회는 액면분할을 진행할 예정이다. 롯데정보통신은 롯데그룹이 지주사로 전환한 뒤 최초로 상장을 준비하는 자회사다. 11일과 12일 양일간 수요예측을 진행한다. 총 공모 주는 428만6000주로, 희망 공모가 밴드는 2만8300원에서 3만3800원 사이로 설정돼 있다. 총 공모금액은 1213억~1449억원이다. 청약은 수요예측을 거쳐 17일과 18일에 진행된다. 일반청약자에게는 전체의 20%에 해당하는 85만7200주가 배정될 예정이다. 롯데정보통신은 1분기 약 57억원의 영업이익을 기록해 전년 동기 대비 약 5억원 영업이익이 상승한 모습을 보였다. 한국유니온제약도 9일과 10일 수요예측을 진행한다. 총 150만주 발행을 준비하며, 희망 공모가 밴드는 1만3500~1만6000원으로 형성돼 있다. 총 공모금액은 203억~240억원이다. 한국유니온제약은 수요예측을 거쳐 17일과 18일 양일간 공모청약을 진행한다. 일반투자자에게는 전체의 20%인 30만주가 배정된다. 한국유니온제약은 진통제와 골격근이완제 등을 제조한다. 질병의 원인인 유전자와 단백질 생성을 억제하는 기술을 개발하는 올릭스는 9일과 10일 공모청약을 진행한다. 120만주 가운데 20%인 24만주가 일반청약자에게 배정돼 있다. 대표주간사인 NH투자증권을 통해 청약할 수 있다. 여성 속옷업체 엠코르셋은 12일과 13일 IPO를 위한 공모청약을 진행한다. 총 251만8500주 가운데 20%인 50만3700주가 일반청약자에게 배정돼 있으며, 대신증권을 통해 청약이 가능하다. 삼일제약과 중앙백신, 잘만테크는 우리사주와 구주주를 대상으로 다음주 유상증자 공모청약을 진행한다. 각각 중앙백신은 10~11일, 삼일제약은 11~12일, 잘만테크는 12~13일에 청약을 진행한다. 아이비케이에스제9호인수목적의 공모청약은 11일과 12일 양일간 이뤄진다. 일반청약자에게는 50만주가 배정되며, IBK투자증권을 통해 청약할 수 있다. 대표적 남북경협주로 주목받았던 시멘트 업체 쌍용양회는 액면분할을 단행한다. [정희영 기자] r_start // r_end //"
전자신문,080720,/news/news_read.nhn?article_id=0002728901&office_id=030&mode=search&query=한국유니온제약&page=1,2018-08-01 09:14,"[ET투자뉴스][한국유니온제약 지분 변동] 안희숙 외 8명 26.46%p 증가, ...","한국유니온제약(080720)은 01일 최대주주 안희숙을  비롯한 특별관계자의 보유주식이 증가되었다고 발표했다. 이는 직전 보고일보다 1,520,278주 증가하여 지분율은 26.46%로 상승했다. 이번 보고 사유는 코스닥시장상장에 따른 신규보고로  알려졌다.   최대주주와 특수관계자의 지분 변동은 주가에 영향을 주는 요인이다. 특히 보유비율을 지속적으로 늘리거나 줄일 경우, 해당종목 투자시 유의할 필요가 있다.  다음은 한국유니온제약의 지분 변동 내역과 보유 내역이다."
뉴시스,080720,/news/news_read.nhn?article_id=0008723920&office_id=003&mode=search&query=한국유니온제약&page=1,2018-07-25 08:05,코스닥 상장 앞둔 백병하 한국유니온제약 대표이사,【성남=뉴시스】고범준 기자 = 백병하 한국유니온제약 대표이사가 16일 오후 경기도 성남시 분당구 한국유니온제약 본사에서 코스닥 상장을 앞두고 뉴시스와 인터뷰를 하고 있다. 2018.07.25.
코메디닷컴,080720,/news/news_read.nhn?article_id=0000036283&office_id=296&mode=search&query=한국유니온제약&page=1,2018-06-14 11:48,"한국유니온제약, 코스닥 상장 절차 돌입","의약품 제조 업체 한국유니온제약이 코스닥에 상장한다. 지난 5월 31일 코스닥 상장 예비 심사를 통과했던 한국유니온제약이 12일 금융위원회에 증권 신고서를 제출했다. 한국유니온제약은 증권 신고서 제출을 시작으로 코스닥 상장을 위한 절차에 돌입했다. 총 공모 주식 수는 150만 주로 희망 공모가는 최저 1만3500원, 최대 1만6000원이다. 총 공모가 규모는 202억 원에서 240억 원이다. 7월 9~10일 수요 예측을 거쳐 공모가를 확정한다. 17~18일에는 공모 청약을 진행한다. 대표 주관사는 DB금융투자. 한국유니온제약은 주로 항생제와 순환기 치료제 등 전문 의약품을 개발 생산하는 기업이다. 2017년 매출은 508억 원, 영업 이익 79억 원, 당기 순이익 31억 원을 기록했다. 대표 제품으로는 퇴행성 관절염 치료제 유니히알, 혈관 확장제 리마스타, 세파 항생제 케포돈 등이 있다. 특히 2015년부터는 개량 신약을 개발 중에 있으며 인터올리고와 기술 이전 계약을 체결해 표적 항암제 개발에 착수했다. 한국유니온제약 백병하 대표는 ""안정적이고 장기적인 성장과 인지도와 재무 안정성을 제고하기 위해 상장을 결정했다""며 ""상장 후 미국 식품의약국(FDA) cGMP 수준의 공장을 신설해 CMO 규모를 확대할 것""이라고 말했다."
이데일리,080720,/news/news_read.nhn?article_id=0004147956&office_id=018&mode=search&query=한국유니온제약&page=1,2018-07-12 10:45,"[마켓인]한국유니온제약, 공모가 1만8000원 확정","[이데일리 이후섭 기자] 한국유니온제약은 지난 9~10일 기관투자자를 대상으로 수요예측을 실시한 결과 공모가를 1만8000원으로 확정했다고 12일 밝혔다. 이번 수요예측에는 국내외 995개 기관이 참여해 918.99대 1의 경쟁률을 기록했다. 희망공모가 밴드(1만3500~1만6000원) 상단을 넘어 1만8000원으로 공모가를 결정함에 따라 공모금액은 총 270억원으로 확정됐다. 지난 1985년 설립된 한국유니온제약은 전문의약품 제조 및 판매업체로 항생제 ‘케포돈주’, 혈관 확장제 ‘리마스타정’, 위산분비 억제제 ‘뉴란소캡슐’,퇴행성 관절염 치료제 ‘유니히알주’ 등을 생산하고 있다. 한국유니온제약의 지난해 매출액은 전년대비 6.9% 증가한 508억원, 영업이익은 25.4% 늘어난 79억원을 기록했다. 회사는 개량신약 개발과 제품 포트폴리오 다변화를 위해 내년 완공을 목표로 신공장 건설을 추진하고 있다. 신공장은 주사제 전용의 우수의약품제조 및 품질관리기준(cGMP)급으로 지어질 계획이다. 회사는 신공장 건설에 따라 판매 품목수가 대폭 확대될 것으로 기대하고 있으며 중동, 동남아시아, 중남미 등으로의 수출을 본격화할 계획이다. 또 바이오 의약품 시장 진입을 위해 인터올리고와 압타머를 활용한 공동 기술개발을 진행하고 있다. 한국유니온제약은 오는 17~18일 일반투자자 대상 공모 청약을 거쳐 26일 코스닥시장에 상장할 예정이다. 주관사는 DB금융투자다."
파이낸셜뉴스,080720,/news/news_read.nhn?article_id=0004059265&office_id=014&mode=search&query=한국유니온제약&page=1,2018-07-17 09:17,"코리아펀딩, 한국유니온제약 기업분석 자료 공개","코리아펀딩이 '한국유니온제약' 기업 분석 자료를 홈페이지에 공개한다고 17일 밝혔다. 코리아펀딩에 따르면 한국유니온제약은 지난 1985년에 설립된 이래로 33년간 완제의약품을제조 및 판매하고 있다 한국유니온제약은 향후 의료가 치료보다는 예방쪽으로페러다임이 변화할 것이라는 판단에 따라 질병을 조기에 치료하는데 꼭 필요한 조영제에 큰 기대를 걸고 있다. 세계 표적조영제 시장 규모는 올해 약 5000억원으로 추정되며 한국유니온제약은 오는 8월부터 국내에서 전임상 연구를 시작하고 연내 전임상 단계를 마무리할 계획이다. 한국유니온제약은 공모자금 약 200억원 중 100억원 가량을 의약품품질관리기준(cGMP) 공장에 투입할 예정이다. 신공장 완공 후 2020년부터 제품생산에 들어가면 판매품목수를 대폭 확대할 수 있을 전망이다. 공장은 내년 완공될 예정이며 2020년부터 본격 생산이 시작될 계획이다. 한국유니온제약은 공장 신축으로 원가 절감과 더불어 경구제 및 주사제 등 200여개 미판매 허가 제품을 판매할 수 있을 것으로 예상하고 있다. 한국유니온제약의 공모가 밴드는 1만3500원에서 1만6000원이었으나 확정공모가는 1만8000원으로 결정되었다. 상장 당시의 유통 가능한 물량을 파악한 결과 상장 예정 수량의 약 56.86%정도다. 코리아펀딩 측은 ""다른 공모주와 비교해 다소 많은 유통물량이라고 볼 수 있으나 금액은 588억원 정도로 최근에 상장에 성공한 제약주들의거래대금보다 낮기에 대부분의 물량을 시장에서 소화가 가능할 것""이라고 내다봤다. 코리아펀딩에서는 기업분석 페이지를 통해 비상장 기업에 대한 정보를 제공하고 있으며, 보다 자세한 내용은 코리아펀딩 홈페이지에서 확인할 수 있다."
아시아경제,080720,/news/news_read.nhn?article_id=0004257668&office_id=277&mode=search&query=한국유니온제약&page=1,2018-06-14 09:36,"한국유니온제약, 코스닥 상장 위해 증권신고서 제출","[아시아경제 임혜선 기자] 의약품 전문회사 한국유니온제약이 지난 12일 금융위원회에 증권신고서를 제출했다고 14일 밝혔다. 1985년 설립된 한국유니온제약은 전문의약품 제조와 판매, 해외수출, 수탁사업(CMO) 등의 사업을 영위하고 있다. 대표 의약품으로는 세파 항생제 '케포돈주', 혈관 확장제 '리마스타정', 위산분비 억제제 '뉴란소캡슐', 퇴행성 관절염 치료제 '유니히알주' 등이 있다. 특히 회사의 신성장동력 발굴을 위해 기존 항체를 효과적으로 대체할 수 있는 물질로 기대받고 있는 압타머(Aptamer)를 활용한 유방암 표적 양전자방출단층촬영(PET) 조영제를 인터올리고와 공동 개발하고 있다. 지난해 실적은 매출액 508억4600만 원, 영업이익 78억5800만원을 기록했다. 백병하 대표는 ""회사의 장기적이고 안정적인 성장을 위해 기업 인지도와 재무 안정성의 제고, 우수 인력 유치 등의 목적으로 상장을 결정했다""면서 ""공모 자금은 연구개발(R&D)과 시설 투자에 사용할 계획""이라고 밝혔다. 한국유니온제약의 총 공모주식수는 150만주, 주당 희망 공모가 밴드는 1만3500~1만6000원이다. 공모금액 규모는 202억~240억원이다. 다음달 9~10일 양일 간 수요예측을 실시해 공모가를 확정하고, 17~18일 공모 청약을 진행할 계획이다. 대표 주관회사는 DB금융투자다."
한국경제,080720,/news/news_read.nhn?article_id=0004003500&office_id=015&mode=search&query=한국유니온제약&page=1,2018-08-30 14:02,"한국유니온제약, 바이오의약품 연구개발 자회사 설립","왼쪽부터 백병하 한국유니온제약 대표와 이재삼 연구소장. 한국유니온제약은 바이오의약품 산업 진출을 위해 자회사 한국유니온생명과학을 설립했다고 30일 밝혔다. 연구소장과 책임연구원에 각각 이재삼 박사와 김정석 박사를 영입했다. 회사 측은 ""전임상을 앞두고 있는 '압타머'를 활용한 유방암 표적 양전자방출단층촬영(PET) 조영제와 췌장암 표적 항암제 연구개발을 전담하기 위한 자회사를 설립했다""며 ""인터올리고와 공동으로 연구 중인 압타머 외에도 '엑소좀'을 활용한 치료제 개발에도 나설 계획""이라고 말했다. 한국유니온생명과학은 엑소좀을 이용한 난치성 질환의 조기 진단과 치료제의 개발을 시작한다. 엑소좀은 세포가 다른 세포에 특정 정보를 전달할 목적으로 자신의 유전자나 단백질을 담아 분비하는 나노 크기의 물질이다. 엑소좀의 특성을 분석해 병의 원인을 진단할 수 있으며, 정확한 진단을 통해 효율적인 치료제를 개발할 수 있을 것으로 회사는 기대하고 있다. 이재삼 연구소장은 ""압타머와 엑소좀의 응용 연구를 위한 연구원을 충원하고 있다""며 ""국내외 대학 병원 연구소 제약회사 등과의 공동개발을 적극적으로 추진할 것""이라고 말했다. 한민수 한경닷컴 기자"
파이낸셜뉴스,080720,/news/news_read.nhn?article_id=0004082046&office_id=014&mode=search&query=한국유니온제약&page=1,2018-08-27 11:32,[fnRASSI]한국유니온제약(080720) 현재 +8.18%,"현재 한국유니온제약(080720)은 전일대비 8.18% 상승하여 17,850원 선에서 거래가 이루어지고 있다. 외국인과 개인은 순매도, 기관은 순매수(한달누적)  8월23일부터 전일까지 외국인이 2거래일 연속 순매도했다. 4주간을 기준으로 보면 기관이 초반에 동종목을 순매수한 이후에 기세를 이어가며 75,267주를 순매수한 반면, 외국인은 매도쪽으로 방향을 잡으면서 42,832주를 순매도했고, 개인들도 매도 관점으로 접근하면서 32,435주를 순매도했다. 개인투자자의 거래비중이 가장 높아 최근 한달간 주체별 거래비중을 살펴보면 개인이 전체 거래량의 96.41%를 차지하며 가장 활발한 참여를 보였고, 외국인은 2.57%, 기관은 1%의 거래 참여율을 보였다. 그리고 최근 5일간 거래비중은 개인 비중이 95.21%로 가장 높았고, 외국인이 3.08%로 그 뒤를 이었다. 기관은 1.7%를 나타냈다. 'fnRASSI'는 증권전문 기업 씽크풀과 파이낸셜뉴스의 협업으로 로봇기자가 실시간으로 생산하는 기사입니다."
