source,symbol,link,date,title,content
아시아경제,080720,/news/news_read.nhn?article_id=0004272394&office_id=277&mode=search&query=한국유니온제약&page=1,2018-07-06 13:30,백병하 한국유니온제약 대표 &quot;신공장&middot;기술개발로 성장 동력 확보&quot;,"[아시아경제 권성회 기자] 전문의약품 전문회사 한국유니온제약의 백병하 대표이사는 6일 오후 서울 여의도에서 기자간담회를 열고 코스닥시장 상장을 앞둔 포부를 밝혔다. 신공장 증설과 각종 기술개발 등으로 종합 헬스케어 기업으로 도약하겠다는 목표다. 1985년 설립된 한국유니온제약은 의약품 제조?판매, 해외수출, 수탁사업(CMO) 등의 사업을 영위해 온 전문의약품 제조 및 판매 전문 기업이다. 대표 의약품으로는 1세대 세파 항생제 ‘케포돈주’, 혈관 확장제 ‘리마스타정’, 위산분비 억제제 ‘뉴란소캡슐’ ,퇴행성 관절염 치료제 ‘유니히알주’ 등이 있다. 한국유니온제약은 정제, 캡슐제, 액상 주사제, 세파분말 주사제 등 전 제형을 생산할 수 있는 우수한 제형 능력을 보유 중이다. 항생제류, 순환기계류, 근골격계류, 소화기계류의 기존 4대 주력 제품군에 추가로 호흡기계류와 비뇨기계류의 개량 신약을 개발해 제품 라인업을 확대함으로써 제품군을 6개로 확장했다. 개량신약과 제제 변경에 대한 지속적인 연구개발(R&D)로 중장기적인 제품 경쟁력과 시장성을 확보할 계획이다. 이러한 개량 신약 개발과 제품 라인업 확대를 위해 회사는 신공장 건설을 추진 중이다. 백 대표는 ""현재 가동 중인 공장의 주사제 품목 생산능력(Capa)이 한계에 다다르면서 신공장은 주사제 전용의 선진GMP(cGMP) 규격의 제조시설로 건설될 계획""이라고 설명했다. 내년까지 신공장이 완공되고, 2020년부터 본격적인 제품 생산을 시작하면 주사제 시장 내 독보적인 지위를 누릴 수 있을 것으로 회사는 기대하고 있다. 또한, 허가품목수 406개 중 생산능력 부족으로 인해 124개의 품목만을 판매하고 있는 현 상황을 벗어나 판매품목수도 대폭 확대할 수 있을 것으로 예상하고 있다. 한국유니온제약은 바이오 의약품 시장 진입을 위해 인터올리고와 압타머(Aptamer)를 활용한 공동 기술 개발을 진행하고 있다.압타머는 특정물질에 특이적으로 결합능력을 가지는 3D 구조의 DNA 또는 RNA 물질로, 기존 항체를 효과적으로 대체할 수 있는 물질로 기대받고 있다. 백 대표는 ""국소부위 타깃이 가능한 압타머의 최적화를 통해 고부가가치 의약품을 개발할 수 있을 것으로 판단해, 인터올리고로부터 표적 조영제 전용 실시권을 허가받아 유방암 조기진단과 표적치료 진단용 양전자방출단층촬영(PET) 조영제를 공동으로 개발하고 있다""며 ""향후 파이프라인 확대를 위해 인터올리고의 표적 항암이식제 우선 협상권도 확보했다""고 덧붙였다. 화장품 원료 사업 영역도 점차 확대할 계획이다. 한국유니온제약의 화장품 원료는 기능성 화장품 브랜드 ‘끌라삐엘(Clapiel)’에 납품돼 미국 5개,중국 13개,베트남 10개의 품목 위생허가를 획득했다. 백 대표는 ""해외 식약처 위생허가 추가 획득은 물론 젤라틴, 식용 곤충 추출 등 신물질에 대한 연구개발도 강화할 예정""이라고 강조했다. 한국유니온제약의 총 공모주식수는 150만주, 주당 희망 공모가 밴드는 1만3500원에서 1만6000원이며이다. 공모금액 규모는202억원에서 240억원이다. 오는 9~10일 양일 간 수요예측을 실시해 공모가를 확정하고, 17~18일 이틀 동안 공모 청약을 진행할 예정이다. 상장예정일은 26일이며, 대표 주관회사는 DB금융투자다."
연합뉴스,080720,/news/news_read.nhn?article_id=0010218468&office_id=001&mode=search&query=한국유니온제약&page=1,2018-07-18 17:19,한국유니온제약 공모주 청약 경쟁률 1천15대 1,"(서울=연합뉴스) 전명훈 기자 = 코스닥시장 상장을 추진하는 한국유니온제약은 17일부터 이틀 동안 일반 공모주 청약을 받은 결과 경쟁률이 1천15대 1로 집계됐다고 18일 밝혔다. 한국유니온제약은 일반 투자자에게 30만주(전체 공모주의 20%)를 배정했는데, 청약물량은 3억453만9천339주에 달했다. 이에 따른 청약 증거금은 2조7천409억원이 모였다. 공모가는 1만8천원, 상장 예정일은 26일이다. 1985년 설립된 한국유니온제약은 정제, 캡슐제, 액상 주사제, 분말 주사제 등 제형별 생산 능력을 갖춘 제약사다. 세파계 항생제 '케포돈주', 혈관 확장제 '리마스타정', 위산분비 억제제 '뉴란소캡슐', 퇴행성 관절염 치료제 '유니히알주' 등 전문의약품이 유니온제약의 대표 제품이다."
이데일리,080720,/news/news_read.nhn?article_id=0004168501&office_id=018&mode=search&query=한국유니온제약&page=1,2018-08-09 16:49,"한국유니온제약, 공장 신축에 123억원 투자",[이데일리 윤필호 기자] 한국유니온제약(080720)은 의약 및 의약품 위탁생산(CMO) 사업 확장에 따른 공장 신축을 위해 123억원을 투자한다고 9일 공시했다. 작년 말 개별기준 자기자본의 24.6%에 해당한다.
뉴스1,080720,/news/news_read.nhn?article_id=0003503315&office_id=421&mode=search&query=한국유니온제약&page=1,2018-07-26 09:38,한국유니온제약(주) 코스닥시장 신규상장기념식,"26일 오전 서울 영등포구 한국거래소 사옥에서 열린 '한국유니온제약 코스닥시장 신규상장기념식'에서 최규준 한국IR협의회 부회장(왼쪽부터), 손승균 DB금융투자 IB사업부장, 정운수 한국거래소 코스닥시장본부장, 백병하 한국유니온제약(주) 대표이사, 안희숙 한국유니온제약(주) 주주대표 송윤진 코스닥협회 부회장이 박수치고 있다. (한국거래소 제공) 2018.7.26/뉴스1"
이데일리,080720,/news/news_read.nhn?article_id=0004159134&office_id=018&mode=search&query=한국유니온제약&page=1,2018-07-26 10:35,[포토] 한국유니온제약 코스닥시장 신규상장,"[이데일리 김태형 기자] 한국거래소 코스닥시장본부는 26일 서울사옥 홍보관에서 항생제류 등 의약품 제조업체인 한국유니온제약(주) 의 코스닥시장 신규상장기념식을 개최하였다. 왼쪽부터 최규준 한국IR협의회 부회장, 손승균 DB금융투자 IB사업부장, 정운수 한국거래소 코스닥시장본부장, 백병하 한국유니온제약(주) 대표이사, 안희숙 한국유니온제약(주) 주주대표, 송윤진 코스닥협회 부회장. (사진=한국거래소)"
뉴시스,080720,/news/news_read.nhn?article_id=0008713043&office_id=003&mode=search&query=한국유니온제약&page=1,2018-07-18 16:50,"한국유니온제약, 청약 경쟁률 1015.13:1&hellip;증거금 2.7조","【서울=뉴시스】장서우 기자 = 오는 26일 코스닥 시장 상장을 앞둔 전문 의약품 전문회사 한국유니온제약의 일반투자자 대상 공모 청약 경쟁률이 1000:1을 넘었다. 한국유니온제약은 지난 17일부터 양일간 시행한 공모 청약에서 총 3억480만8330주가 접수돼 경쟁률이 1015.13:1을 기록했다고 밝혔다. 청약 증거금으로는 약 2조7432억원이 몰렸다. 앞서 지난 9~10일 기관투자자를 대상으로 진행된 수요예측에서는 총 995개 기관이 참여, 918.99:1의 경쟁률을 기록한 바 있다. 최종 공모가는 희망 밴드(1만3500~1만6000원) 상단을 넘어선 1만8000원으로 결정됐다. 회사 관계자는 ""수요예측부터 일반 공모까지 큰 관심을 보여주신 국내·외 기관투자자와 일반 투자자분들에게 감사드린다""며 ""상장 후 전 임직원이 상장사로서의 책임감을 바탕으로 주주가치를 높일 수 있도록 최선을 다하겠다""고 말했다. 한국유니온제약은 지난 1985년 설립된 전문 의약품 제조·판매 전문 제약기업으로 전문 의약품 제조와 판매, 수출, 수탁 사업(CMO) 등을 영위하고 있다. 바이오벤처 회사 인터올리고와 공동 개발 중인 유방암 표적 양전자방출단층촬영(PET) 조영제와 바이오 소재 화장품 원료인 세포 생장 촉진 펩타이드성 호르몬은 회사의 신 성장 동력이다. 지난해 매출액은 508억4600만원, 영업이익은 78억5800만원을 각각 기록했다."
파이낸셜뉴스,080720,/news/news_read.nhn?article_id=0004056835&office_id=014&mode=search&query=한국유니온제약&page=1,2018-07-12 13:59,"한국유니온제약, 공모가 1만8000원 확정&hellip;밴드 최상단 초과","한국유니온제약의 공모가가 공모희망가 밴드 최상단을 넘어선 1만8000원으로 확정됐다. 12일 업계에 따르면 한국유니온제약은 지난 9~10일 이틀에 걸쳐 총 공모주식수 150만주 중 62.07%인 93만1000주를 대상으로 실시한 수요예측에 총 995개의 기관이 참여해 918.99대 1의 경쟁률을 기록했다고 밝혔다. 공모가가 1만8000원으로 확정되면서 한국유니온제약의 총 공모금액은 270억 원, 상장 후 시가총액은 약 1034억 원으로 예상된다. 회사 관계자는 “수요예측에 참여해 주신 국내외 기관투자자 분들의 높은 관심에 큰 감사를 표한다”며, “다음주에 진행되는 일반투자자 청약에도 많은 관심을 부탁드린다”고 말했다. 한국유니온제약은 오는 17~18일 양일 간 총 공모주식수의 20%인 300,000주에 대한 일반 공모 청약을 실시한다. 상장 예정일은 26일, 대표 주관회사는 DB금융투자다. 한국유니온제약은 지난 1985년 설립된 전문의약품 제조 및 판매 전문 제약기업으로, 전문의약품 제조와 판매, 해외수출, 수탁사업(CMO) 등의 사업을 영위하고 있다. 회사의 신성장동력 발굴을 위해 기존 항체를 효과적으로 대체할 수 있는 물질로 기대받고 있는 압타머(Aptamer)를 활용한 유방암 표적 양전자방출단층촬영(PET) 조영제를 인터올리고㈜와 공동 개발하고 있다. 2017년 실적은 매출액 508억 4600만 원, 영업이익 78억 5800만 원을 기록했다."
데일리안,080720,/news/news_read.nhn?article_id=0002269070&office_id=119&mode=search&query=한국유니온제약&page=1,2018-07-12 12:07,"한국유니온제약, 공모가 1만8000원&hellip;밴드 최상단 초과","한국유니온제약이 지난 9~10일 실시한 수요예측 결과, 공모가가 1만8000원으로 확정됐다. ⓒ한국유니온제약 전문의약품 전문회사 한국유니온제약의 공모가가 공모희망가 밴드 최상단을 넘어선 1만8000원으로 확정됐다. 한국유니온제약은 지난 9~10일 총 공모주식수 150만주 중 62.07%인 93만1000주를 대상으로 수요예측을 실시했다. 수요예측에는 총 995개의 기관이 참여해 918.99대 1의 경쟁률을 기록했다. 한국유니온제약의 공모가가 1만8000원으로 확정되면서 총 공모금액은 270억 원, 상장 후 시가총액은 약 1034억 원으로 예상된다. 회사 관계자는 “수요예측에 참여해 주신 국내외 기관투자자 분들의 높은 관심에 큰 감사를 표한다”며, “다음주에 진행되는 일반투자자 청약에도 많은 관심을 부탁드린다”고 말했다. 한국유니온제약은 오는 17~18일 양일 간 총 공모주식수의 20%인 30만주에 대한 일반 공모 청약을 실시한다. 상장 예정일은 26일이고 대표 주관회사는 DB금융투자다."
머니투데이,080720,/news/news_read.nhn?article_id=0004089538&office_id=008&mode=search&query=한국유니온제약&page=1,2018-08-09 11:24,"한국유니온제약, 123억원 규모 공장신축","[머니투데이 한고은 기자] 한국유니온제약이 의약 및 의약품 위탁생산(CMO) 사업확장에 따른 공장을 신축하기 위해 122억7000만원 규모의 신규시설투자를 결정했다고 9일 공시했다. 투자금액은 2017년말 개별재무제표기준 자기자본의 24.6%에 해당한다. 투자기간은 2018년 8월 9일부터 2019년 6월 30일까지로, 투자지역은 강원도 원주시다."
연합뉴스,080720,/news/news_read.nhn?article_id=0010235588&office_id=001&mode=search&query=한국유니온제약&page=1,2018-07-26 15:59,"[특징주] 한국유니온제약, 코스닥 첫날 약세&hellip;공모가는 상회(종합)","(서울=연합뉴스) 권수현 기자 = 한국유니온제약이 코스닥시장 상장 첫날인 26일 시초가보다는 내렸으나 공모가는 웃돌았다. 이날 한국유니온제약은 시초가(2만3천원) 대비 15.22% 하락한 1만9천500원에 거래를 마쳤다. 이는 공모가인 1만8천원 대비 8.3% 높은 수준이다. 한국유니온제약은 장 초반 한때 12% 넘게 급등하다 오후 들어 16% 가까이 급락하는 등 롤러코스터 흐름을 보이다 공모가를 소폭 상회하는 수준에서 마감했다. 한국유니온제약은 1985년 8월 설립된 의약품 제조업체다. 세파계 항생제 '케포돈주', 혈관 확장제 '리마스타정', 위산분비 억제제 '뉴란소캡슐', 퇴행성 관절염 치료제 '유니히알주' 등을 생산한다. 작년 한 해 별도기준으로 매출액 508억원, 당기순이익 31억원을 각각 거뒀다."
이데일리,080720,/news/news_read.nhn?article_id=0004185280&office_id=018&mode=search&query=한국유니온제약&page=1,2018-08-30 09:28,"한국유니온제약, &lsquo;한국유니온생명과학&rsquo; 설립&hellip;&ldquo;바이오의약품 산업 진출&rdquo;","연구소장에 엑소좀 연구 전문가 이재삼 박사 영입 [이데일리 김지섭 기자]한국유니온제약(080720)은 바이오의약품 산업 진출을 위한 자회사 ‘한국유니온생명과학’을 설립하고 연구소장과 책임연구원에 각각 이재삼 박사와 김정석 박사를 영입했다고 30일 밝혔다. 한국유니온생명과학은 연구소 설립과 동시에 ‘엑소좀’을 이용한 암, 심혈관 질환 등 난치성 질환의 조기 진단과 효율적인 질환별 치료제의 개발을 시작한다. 엑소좀은 세포가 다른 세포에 특정 정보를 전달할 목적으로 자신의 유전자나 단백질을 담아 분비하는 나노 크기의 소포체다. 엑소좀의 특성을 분석해 유래 세포의 상태를 확인하고 병인을 진단할 수 있으며, 정확한 진단을 통해 효율적인 치료제를 개발할 수 있을 것으로 회사는 기대하고 있다. 회사 측은 “전임상을 앞두고 있는 ‘압타머’를 활용한 유방암 표적 양전자방출단층촬영(PET) 조영제와 췌장암 표적 항암제 연구개발을 전담하기 위해 자회사인 연구소를 설립했다”며, “인터올리고와 공동으로 연구 중인 압타머 외에도 엑소좀을 활용한 치료제 개발에도 나설 계획”이라고 말했다. 이재삼 연구소장은 “압타머와 엑소좀의 응용 연구를 위한 연구원을 충원하고 있으며 이를 기반으로 한 진단 및 항암제 개발을 본격적으로 수행할 계획”이라며, “앞으로 획기적인 진단과 치료제 개발을 위한 국내외 대학, 병원, 연구소, 제약회사 등과의 공동개발을 적극적으로 추진할 것”이라고 말했다. 한편 지난 7월 코스닥 시장에 상장한 한국유니온제약은 의약품 제조 및 판매, 수출, 수탁사업(CMO) 등을 하고 있다. 백병하 한국유니온제약 대표(왼쪽)와 이재삼 한국유니온제약 연구소장이 한국유니온생명과학 현판을 들고 기념 촬영을 하고 있다.(사진=한국유니온제약)"
이데일리,080720,/news/news_read.nhn?article_id=0004152242&office_id=018&mode=search&query=한국유니온제약&page=1,2018-07-18 16:47,"[마켓인]한국유니온제약, 청약경쟁률 1015대1&hellip;증거금 2.7조원","[이데일리 이후섭 기자] 한국유니온제약은 전날부터 실시한 일반투자자 대상 공모 청약에서 최종 경쟁률 1015.13대 1을 기록했다고 18일 밝혔다. 청약 증거금은 2조7408억원으로 집계됐다. 한국유니온제약은 앞서 진행된 기관투자자 대상 수요예측에서 918.99대 1의 경쟁률을 기록하며 희망공모가(1만3500~1만6000원) 상단을 넘어 1만8000원으로 공모가를 확정했다. 회사는 오는 26일 코스닥시장에 상장할 예정이다. 지난 1985년 설립된 한국유니온제약은 전문의약품 제조 및 판매업체로 항생제 `케포돈주`, 혈관 확장제 `리마스타정`, 위산분비 억제제 `뉴란소캡슐`,퇴행성 관절염 치료제 `유니히알주` 등을 생산하고 있다. 한국유니온제약의 지난해 매출액은 전년대비 6.9% 증가한 508억원, 영업이익은 25.4% 늘어난 79억원을 기록했다. 회사는 개량신약 개발과 제품 포트폴리오 다변화를 위해 내년 완공을 목표로 신공장 건설을 추진하고 있다. 신공장은 주사제 전용의 우수의약품제조 및 품질관리기준(cGMP)급으로 지어질 계획이다. 회사는 신공장 건설에 따라 판매 품목수가 대폭 확대될 것으로 기대하고 있으며 중동, 동남아시아, 중남미 등으로의 수출을 본격화할 계획이다. 또 바이오 의약품 시장 진입을 위해 인터올리고와 압타머를 활용한 공동 기술개발을 진행하고 있다."
서울경제,080720,/news/news_read.nhn?article_id=0003382746&office_id=011&mode=search&query=한국유니온제약&page=1,2018-08-30 09:32,"한국유니온제약, 한국유니온생명과학 설립&middot;&middot;&middot;&rdquo;바이오의약품 산업 진출&rdquo;","연구소장으로 엑소좀 연구 전문가 이재삼 박사 영입 [서울경제] 한국유니온제약(080720) 이 바이오의약품 산업 진출을 위해 자회사 ‘한국유니온생명과학’을 설립했다고 30일 밝혔다. 연구소장과 책임연구원에는 이재삼 박사와 김정석 박사가 각각 선임됐다. 한국유니온생명과학은 연구소 설립과 동시에 ‘엑소좀(Exosome)’을 이용한 암·심혈관 질환 등 난치성 질환의 조기 진단과 효율적인 치료제 개발에 돌입할 계획이다. 엑소좀은 세포가 다른 세포에 특정 정보를 전달하기 위해 자신의 유전자 또는 단백질을 담아 분비하는 나노 크기의 소포체다. 아울러 ‘압타머(Aptamer)’를 활용한 유방암 표적 양전자방출단층촬영(PET) 조영제와 췌장암 표적 항암제 연구개발 등을 진행할 계획이다. 압타머는 특정 분자에 특이적으로 결합하는 핵산으로 표적 치료제 개발에 활용될 것으로 기대되는 물질이다. 이재삼 연구소장은 “압타머와 엑소좀 응용 연구를 위해 연구원을 충원하고 있으며 이를 기반으로 한 진단·항암제 개발을 본격화하겠다”며 “국내외 대학, 병원, 연구소, 제약회사 등과의 공동개발도 적극 추진할 방침”이라고 말했다. 한편 한국유니온제약은 1985년 설립된 전문의약품 제조·판매 회사로 지난 7월 코스닥 시장에 상장했다."
뉴시스,080720,/news/news_read.nhn?article_id=0008723929&office_id=003&mode=search&query=한국유니온제약&page=1,2018-07-25 08:05,인터뷰 하는 백병하 한국유니온제약 대표이사,【성남=뉴시스】고범준 기자 = 백병하 한국유니온제약 대표이사가 16일 오후 경기도 성남시 분당구 한국유니온제약 본사에서 코스닥 상장을 앞두고 뉴시스와 인터뷰를 하고 있다. 2018.07.25.
뉴시스,080720,/news/news_read.nhn?article_id=0008723927&office_id=003&mode=search&query=한국유니온제약&page=1,2018-07-25 08:05,코스닥 상장 앞둔 백병하 한국유니온제약 대표이사,【성남=뉴시스】고범준 기자 = 백병하 한국유니온제약 대표이사가 16일 오후 경기도 성남시 분당구 한국유니온제약 본사에서 코스닥 상장을 앞두고 뉴시스와 인터뷰를 하고 있다. 2018.07.25.
이데일리,080720,/news/news_read.nhn?article_id=0004143806&office_id=018&mode=search&query=한국유니온제약&page=1,2018-07-06 16:37,[IPO출사표]한국유니온제약 &quot;신공장 건설로 의약 품목수 확대&quot;,"전문의약품 제조업체…""모든 제형 제품 생산 가능""신공장 건설 추진…제품 품목수 및 수출 확대 기대신성장동력 `압타머` 활용 공동 기술개발 진행 백병하 한국유니온제약 대표가 6일 서울 여의도에서 기업공개(IPO) 기자간담회를 열고 회사의 비전과 사업계획에 대해 설명하고 있다.(사진=한국유니온제약 제공) [이데일리 이후섭 기자] “신공장 건립을 통해 제품 품목수를 확대하고, 고부가가치 분야로 사업 영역을 확장할 계획이다.” 백병하 한국유니온제약 대표는 6일 서울 여의도에서 기업공개(IPO) 기자간담회를 열고 “지속적인 제품 개발과 시장점유율 확대를 통해 안정적인 성장을 이어왔으며, 이번 코스닥시장 상장을 발판으로 종합 헬스케어 기업으로 도약하겠다”며 이같이 밝혔다. 지난 1985년 설립된 한국유니온제약은 전문의약품 제조 및 판매업체로 항생제 `케포돈주`, 혈관 확장제 `리마스타정`, 위산분비 억제제 `뉴란소캡슐`,퇴행성 관절염 치료제 `유니히알주` 등을 생산하고 있다. 항생제류, 순환기계류, 근골격계류, 소화기계류의 기존 4대 주력 제품군에 추가로 호흡기계류와 비뇨기계류의 개량신약을 개발해 제품군을 6개로 확장했다. 한국유니온제약의 지난해 매출액은 전년대비 6.9% 증가한 508억원, 영업이익은 25.4% 늘어난 79억원을 기록했다. 올해 1분기 매출액과 영업이익은 각각 126억원, 30억원으로 집계됐다. 백 대표는 “정제·캡슐제·액상주사제·세파분말주사제 등 모든 제형을 생산할 수 있다는 것이 회사의 가장 큰 장점”이라며 “지난 2010년부터 개량신약과 제제 변경에 대한 연구개발을 이어와 현재 유니알포 연질캡슐 등 3가지 제품의 개발을 완료했으며, 유니코나졸 주사 등 3가지 제품은 개발을 진행하고 있다”고 설명했다. 회사는 개량신약 개발과 제품 포트폴리오 다변화를 위해 내년 완공을 목표로 신공장 건설을 추진하고 있다. 신공장은 주사제 전용의 우수의약품제조 및 품질관리기준(cGMP)급으로 지어질 계획이다. 백 대표는 “내년에 신공장이 완공되고 2020년 1분기부터 본격적으로 제품 생산을 시작하면 주사제 시장내 독보적인 지위를 누릴 것으로 기대된다”며 “허가품목수 406개 중 생산능력 부족으로 인해 124개의 품목만을 판매하고 있는 현재 상황에서 벗어나 판매 품목수도 대폭 확대될 것”이라고 내다봤다. 신공장 건설에 따른 주사제 품목의 경쟁우위를 기반으로 중동, 동남아시아, 중남미 등으로의 수출을 본격화할 계획이다. 더불어 기존 수탁사업(CMO)에서 위탁개발생산(CDMO) 영역으로 사업을 확장한다는 전략이다. 한국유니온제약은 바이오 의약품 시장 진입을 위해 인터올리고와 압타머를 활용한 공동 기술개발을 진행하고 있다. 압타머는 특정물질에 특이적으로 결합능력을 가지는 3D 구조의 데옥시리보핵산(DNA) 또는 리보핵산(RNA) 물질이다. 국소부위 타깃이 가능한 압타머의 최적화를 통해 고부가가치 의약품을 개발할 수 있을 것으로 보고 인터올리고로부터 표적 조영제 전용 실시권을 부여받아 유방암 조기진단과 표적치료 진단용 PET 조영제를 공동으로 개발하고 있다. 향후 파이프라인 확대를 위해 인터올리고의 표적 항암이식제 우선 협상권도 확보했다. 화장품 원료사업 영역도 점차 확대할 계획이다. 회사가 자체 개발한 화장품 원료는 국제 화장품원료집(ICID)에도 등재됐다. 화장품 원료는 기능성 화장품 브랜드 `끌라삐엘(Clapiel)`에 납품돼 미국(5개),중국(13개),베트남(10개)의 품목 위생허가를 획득했다. 회사는 해외 식약처 위생허가 추가 획득과 더불어 젤라틴, 식용 곤충 추출 등 신물질에 대한 연구개발도 강화할 예정이다. 한국유니온제약의 공모주식수는 총 150만주로 희망 공모가 밴드는 1만3500~1만6000원이다. 오는 26일 코스닥시장 상장을 목표로 9~10일 기관투자가 대상 수요예측을 통해 공모가를 확정하고 17~18일 공모 청약을 진행할 예정이다. 대표 주관사는 DB금융투자다."
