source,symbol,link,date,title,content
뉴시스,080720,/news/news_read.nhn?article_id=0008723923&office_id=003&mode=search&query=한국유니온제약&page=1,2018-07-25 08:05,백병하 한국유니온제약 대표이사 뉴시스 인터뷰,【성남=뉴시스】고범준 기자 = 백병하 한국유니온제약 대표이사가 16일 오후 경기도 성남시 분당구 한국유니온제약 본사에서 코스닥 상장을 앞두고 뉴시스와 인터뷰를 하고 있다. 2018.07.25.
뉴시스,080720,/news/news_read.nhn?article_id=0008723925&office_id=003&mode=search&query=한국유니온제약&page=1,2018-07-25 08:05,백병하 한국유니온제약 대표이사 뉴시스와 인터뷰,【성남=뉴시스】고범준 기자 = 백병하 한국유니온제약 대표이사가 16일 오후 경기도 성남시 분당구 한국유니온제약 본사에서 코스닥 상장을 앞두고 뉴시스와 인터뷰를 하고 있다. 2018.07.25.
뉴시스,080720,/news/news_read.nhn?article_id=0008726447&office_id=003&mode=search&query=한국유니온제약&page=1,2018-07-26 09:36,"[특징주]한국유니온제약, 상장 첫 날 '약세'&hellip;공모가는 상회","【서울=뉴시스】장서우 기자 = 26일 코스닥 시장에 상장한 한국유니온제약(080720)이 약세다. 이날 한국유니온제약의 시초가는 2만3000원에 형성됐다. 오전 9시30분 현재 주가는 시초가 대비 550원(2.39%) 내린 2만2450원에 거래되고 있다. 그러나 이는 공모가(1만8000원)보단 24.72%가량 높은 수준이다. 장중 주가는 2만5800원까지 고점을 높이기도 했으나 이내 하락세로 전환했다. 한국유니온제약은 33년간 의약품 제조·판매, 수출, 수탁 사업(CMO) 등 사업을 영위해 온 전문 의약품 제조 기업이다. 항생제류, 근골격계류, 소화기계류, 순환기계류, 호흡기계류, 비뇨기계류 등 시장에 진출했으며 바이오 의약품과 화장품 원료 사업에도 나섰다. 2016년 영업이익이 63억3400만원을 기록하며 전년(4억800만원)보다 15배 이상 크게 뛰었으며 지난해 영업이익도 78억5800만원을 기록, 지속해서 증가했다."
한국경제TV,080720,/news/news_read.nhn?article_id=0000673009&office_id=215&mode=search&query=한국유니온제약&page=1,2018-08-17 10:37,"한국유니온제약, 전일 대비 약 4% 상승한 15,900원","[한국경제TV 라이온봇 기자] [그림 1] 최근 3개월 간 주가 추세 및 기간별 수익률 한국유니온제약은 8월 17일 10시 36분 전일 대비 약 4% 상승한 15,900원에 거래되고 있다. 한국유니온제약은 코스닥 상장 기업으로 제약 업종에 속해 있다. 시가총액은 881억원으로 코스닥 상장기업 중 674위에 위치 해 있다. [종목 성향 진단] [그림 2] 종목 성향 진단 한국유니온제약의 투자 스타일은 모호한 측면이 있으나 성장주라고 볼 수 있다. 주가 고평가 우려가 공존하지만 높은 성장성이 기대되는 기업이다. 주가 모멘텀은 평범한 수준이었다. 한국유니온제약 종목에 대한 투자자의 관심도는 높은 편에 속한다. [투자 점수 진단] [그림 3] 투자 점수 진단 한국유니온제약은 어느 측면에서 투자 매력도가 높은 종목일까? AI 인공지능 종목 분석 시스템을 이용해 성장성, 수익성, 효율성, 안전성, 저평가성, 추세 등 주가 수익률에 영향을 줄 수 있는 6가지 핵심 투자 지표를 점수화하여 종목의 투자 매력도를 계산해보았다. 그 결과 한국유니온제약은 상대적으로 수익성 측면에서 두각을 드러내고 있었다. 수익성 점수는 기업이 가진 자산과 자본을 활용하여 얼마나 이익을 실현했는지를 나타낸다. 한국유니온제약은 특히 ROE 측면에서 가장 높은 점수는 기록했는데, 전체 시장 내 45위를 기록하며 상위 2.21%에 위치했다. 업종별로는 6위를 기록하며 상위 2.36%에 위치했다. 그러나 주가 상승 모멘텀을 나타내는 추세 측면에서는 아쉬움을 나타냈다. (위의 AI인공지능 점수는 재무 데이터를 기반으로 전체 상장 종목과 비교/분석하여 도출한 점수로 높은 점수가 반드시 높은 수익률을 보장하지 않습니다. 위의 자료는 당사의 추천 종목이 아니며, 투자 시 참고용으로 제시해드리는 것입니다. 핵심투자지표를 결합해 종목의 투자매력도를 종합 계산한 ""인공지능 투자점수""는 ""거장들의 투자공식"" 앱에서 확인하실 수 있습니다.) 라이온봇 기자 -한국경제TV※ 본 기사는 한국경제TV와 '거장들의 투자공식이'자체 개발한 '라이온봇 기자'가 실시간으로 작성한 기사입니다. 라이온봇기자"
아시아경제,080720,/news/news_read.nhn?article_id=0004305321&office_id=277&mode=search&query=한국유니온제약&page=1,2018-08-30 09:20,"한국유니온제약, '한국유니온생명과학' 세워&hellip;&quot;바이오의약품 산업 진출&quot;","사진제공=한국유니온제약 [아시아경제 문채석 기자]한국유니온제약이 바이오의약품 산업 진출을 위한 자회사로 ‘한국유니온생명과학’을 설립하고 연구소장과 책임연구원에 각각 이재삼 박사와 김정석 박사를 영입했다고 30일 밝혔다. 회사 측은 ""전임상을 앞두고 있는 '압타머(Aptamer)'를 활용해 유방암 표적 양전자방출단층촬영(PET) 조영제와 췌장암 표적 항암제 연구개발을 전담하려 자회사인 연구소를 세웠다""며 ""인터올리고와 공동 연구 중인 압타머 외에도 엑소좀을 활용한 치료제 개발에도 나설 계획""이라고 말했다. 한국유니온생명과학은 연구소 설립과 동시에 '엑소좀(Exosome)'을 이용해 암, 심혈관 질환 등 난치성 질환의 조기 진단과 효율적인 질환별 치료제의 개발을 시작하게 된다. 엑소좀은 세포가 다른 세포에 특정 정보를 전달할 목적으로 자신의 유전자나 단백질을 담아 분비하는 나노 크기의 소포체다. 엑소좀의 특성을 분석해 유래 세포의 상태를 확인하고 병인을 진단할 수 있고 정확한 진단을 통해 효율적인 치료제를 개발할 수 있을 것으로 회사는 전망하고 있다. 이재삼 연구소장은 ""압타머와 엑소좀의 응용 연구를 위한 연구원을 충원하고 있으며 이를 기반으로 한 진단 및 항암제 개발을 본격적으로 수행할 계획""이라며 ""앞으로 획기적인 진단과 치료제 개발을 위한 국내외 대학, 병원, 연구소, 제약회사 등과의 공동개발을 적극적으로 추진할 것""이라고 말했다. 지난 7월 코스닥 시장에 상장한 한국유니온제약은 1985년 설립된 전문의약품 제조 및 판매, 수출, 수탁사업(CMO) 등의 사업을 영위하고 있다."
헤럴드경제,080720,/news/news_read.nhn?article_id=0001427842&office_id=016&mode=search&query=한국유니온제약&page=1,2018-08-09 11:25,"[생생코스닥]한국유니온제약, 공장 신축에 122.7억 투자",[헤럴드경제=증권팀] 한국유니온제약은 의약 및 CMO 사업 확장에 따른 신공장 신축에 122억7000만원을투자한다고 9일 공시했다. 이는 자기자본대비 24.6%에 해당하는 규모이며 투자기간은 2019년 6월 30일까지다.
코메디닷컴,080720,/news/news_read.nhn?article_id=0000037228&office_id=296&mode=search&query=한국유니온제약&page=1,2018-08-09 15:21,"한국유니온제약, 신공장 신축...CMO 사업 확장","한국유니온제약이 약 123억 원을 들여 신공장을 신축한다고 9일 공시했다. 공시에 따르면 한국유니온제약은 강원도 원주시 문막공단에 공장을 신설한다. 토지는 유니온제약 소유로 공장 신축에 122억7000만 원이 투자된다. 한국유니온제약은 ""의약품 및 CMO(의약품 위탁 생산) 사업 확장을 위해 공장을 신설한다""고 밝혔다. 신공장과 함께 앰플주사제 생산 설비가 추가된다. 이번 투자 규모는 자기 자본 대비 24.6%로 투자기간은 2019년 6월 30일까지다. 한국유니온제약은 주로 항생제와 순환기 치료제 등 전문 의약품을 개발 생산하는 기업이다. 2017년 매출은 508억 원, 영업 이익 79억 원, 당기 순이익 31억 원을 기록했다. 대표 제품으로는 퇴행성 관절염 치료제 유니히알, 혈관 확장제 리마스타, 세파 항생제 케포돈 등이 있다. 특히 2015년부터는 개량 신약을 개발 중에 있으며 인터올리고와 기술 이전 계약을 체결해 표적 항암제 개발에 착수했다. [사진=ValentynVolkov/gettyimagesbank]"
연합뉴스,080720,/news/news_read.nhn?article_id=0010195205&office_id=001&mode=search&query=한국유니온제약&page=1,2018-07-06 17:26,'항생제 강자' 한국유니온제약 26일 코스닥 상장,"(서울=연합뉴스) 전명훈 기자 = 33년 전통의 제약사 한국유니온제약이 26일 코스닥시장에 상장한다. 한국유니온제약은 6일 여의도에서 기업공개(IPO) 기자간담회를 열고 상장 계획을 밝혔다. 1985년 설립된 한국유니온제약은 정제, 캡슐제, 액상 주사제, 분말 주사제 등 제형별 생산 능력을 갖춘 제약사다. 세파계 항생제 '케포돈주', 혈관 확장제 '리마스타정', 위산분비 억제제 '뉴란소캡슐', 퇴행성 관절염 치료제 '유니히알주' 등 전문의약품이 유니온제약의 대표 제품이다. 한국유니온제약은 특히 세팔로스포린계 항생제 전용 시설을 구축해 의료기기 제조 및 품질관리 기준 적합인증(KGMP)을 받았다. 회사 측은 이 계열 항생제 생산 시설을 갖춘 제약사가 국내 400여 개사 중 5% 정도에 불과하다고 설명했다. 한국유니온제약은 항생제류, 순환기계류, 근골격계류, 소화기계류 등 4대 제품군 생산에 주력하고 있다. 이 중 전체 매출액의 37%를 차지하는 항생제류의 매출액은 2013년 99억원 수준에서 작년에는 237억원으로 연평균 24%씩 늘어나고 있다. 최근에는 호흡기계류, 비뇨기계류 개량 신약을 개발하면서 제품군을 6개로 확장했으며, 양전자방출촬영(PET) 조영제도 개발 중이다. 한국유니온제약의 작년 매출액은 508억원, 영업이익은 79억원이었다. 매출액은 최근 3년 동안 연평균 7.3% 늘었다. 영업이익률은 2015년 0.9%에서 2016년 13.3%, 작년에는 15.4%로 점차 수익성을 개선하고 있다. 백병하 한국유니온제약 대표는 ""설립 후 현재까지 안정적으로 성장해왔다""며 ""코스닥 상장을 발판으로 신뢰받는 종합 헬스케어 기업으로 도약하겠다""고 말했다. 한국유니온제약의 희망 공모가는 1만3천500∼1만6천원이다. 희망가 상단을 기준으로 250억원을 조달한다. 9∼10일 기관투자자 대상 수요예측에서 공모가를 확정하고 17∼18일에 공모 청약을 받는다. DB금융투자가 상장 주관을 맡았다."
파이낸셜뉴스,080720,/news/news_read.nhn?article_id=0004060449&office_id=014&mode=search&query=한국유니온제약&page=1,2018-07-18 16:37,"한국유니온제약, 공모 청약 경쟁률 1015.13대 1&hellip;증거금 2조7432억 원","한국유니온제약의 일반 공모 청약 경쟁률이 1015.13대 1을 기록하며 흥행을 거뒀다. 한국유니온제약은 17~18일 양일 간 실시한 일반 공모 청약에 총 3억480만8330주가 접수됐으며, 경쟁률은 1015.13대 1을 기록했다고 18일 밝혔다. 청약 증거금은 약 2조 7432억 원이 모였다. 회사 관계자는 “수요예측부터 일반 공모까지 크나큰 관심을 보여주신 국내외 기관투자자와 일반투자자분들에게 감사드린다”며, “상장 후 한국유니온제약의 전 임직원은 상장사로서의 책임감을 바탕으로 주주가치를 제고할 수 있도록 최선을 다하겠다”고 말했다. 한국유니온제약은 지난 12일 공모가를 1만8000원으로 확정한 바 있으며, 오는 26일 코스닥 시장에 상장할 예정이다. 한편, 한국유니온제약은 지난 1985년 설립된 전문의약품 제조 및 판매 전문 제약기업으로, 전문의약품 제조와 판매, 해외수출, 수탁사업(CMO) 등의 사업을 영위하고 있다. 회사의 신성장동력 발굴을 위해 기존 항체를 효과적으로 대체할 수 있는 물질로 기대받고 있는 압타머(Aptamer)를 활용한 유방암 표적 양전자방출단층촬영(PET) 조영제를 인터올리고㈜와 공동 개발하고 있다. 2017년 실적은 매출액 508억 4600만 원, 영업이익 78억 5800만 원을 기록했다."
연합뉴스,080720,/news/news_read.nhn?article_id=0010233991&office_id=001&mode=search&query=한국유니온제약&page=1,2018-07-26 09:31,한국유니온제약㈜ 코스닥시장 신규상장 기념식,"(서울=연합뉴스) 26일 서울 여의도 한국거래소에서 항생제류 등 의약품 제조업체인 한국유니온제약㈜의 코스닥시장 신규상장기념식이 열리고 있다. 왼쪽부터 최규준 한국IR협의회 부회장, 손승균 DB금융투자 IB사업부장, 정운수 한국거래소 코스닥시장본부장, 백병하 한국유니온제약㈜ 대표이사, 안희숙 한국유니온제약㈜ 주주대표, 송윤진 코스닥협회 부회장. 2018.7.26 [한국거래소 제공]"
뉴시스,080720,/news/news_read.nhn?article_id=0008723924&office_id=003&mode=search&query=한국유니온제약&page=1,2018-07-25 08:05,인터뷰 하는 백병하 한국유니온제약 대표이사,【성남=뉴시스】고범준 기자 = 백병하 한국유니온제약 대표이사가 16일 오후 경기도 성남시 분당구 한국유니온제약 본사에서 코스닥 상장을 앞두고 뉴시스와 인터뷰를 하고 있다. 2018.07.25.
한국경제TV,080720,/news/news_read.nhn?article_id=0000675278&office_id=215&mode=search&query=한국유니온제약&page=1,2018-08-24 14:39,"한국유니온제약, 전일 대비 약 4% 상승한 16,450원","[한국경제TV 라이온봇 기자] [그림 1] 최근 3개월 간 주가 추세 및 기간별 수익률 한국유니온제약은 8월 24일 14시 38분 전일 대비 약 4% 상승한 16,450원에 거래되고 있다. 한국유니온제약은 코스닥 상장 기업으로 제약 업종에 속해 있다. 시가총액은 907억원으로 코스닥 상장기업 중 669위에 위치 해 있다. [종목 성향 진단] [그림 2] 종목 성향 진단 한국유니온제약의 투자 스타일은 모호한 측면이 있으나 성장주라고 볼 수 있다. 주가 고평가 우려가 공존하지만 높은 성장성이 기대되는 기업이다. 주가 모멘텀은 평범한 수준이었다. 한국유니온제약 종목에 대한 투자자의 관심도는 높은 편에 속한다. [투자 점수 진단] [그림 3] 투자 점수 진단 한국유니온제약은 어느 측면에서 투자 매력도가 높은 종목일까? AI 인공지능 종목 분석 시스템을 이용해 성장성, 수익성, 효율성, 안전성, 저평가성, 추세 등 주가 수익률에 영향을 줄 수 있는 6가지 핵심 투자 지표를 점수화하여 종목의 투자 매력도를 계산해보았다. 그 결과 한국유니온제약은 상대적으로 수익성 측면에서 두각을 드러내고 있었다. 수익성 점수는 기업이 가진 자산과 자본을 활용하여 얼마나 이익을 실현했는지를 나타낸다. 한국유니온제약은 특히 ROE 측면에서 가장 높은 점수는 기록했는데, 전체 시장 내 52위를 기록하며 상위 2.56%에 위치했다. 업종별로는 5위를 기록하며 상위 1.87%에 위치했다. 그러나 기업의 자산 활용도를 나타내는 효율성 측면에서는 아쉬움을 나타냈다. (위의 AI인공지능 점수는 재무 데이터를 기반으로 전체 상장 종목과 비교/분석하여 도출한 점수로 높은 점수가 반드시 높은 수익률을 보장하지 않습니다. 위의 자료는 당사의 추천 종목이 아니며, 투자 시 참고용으로 제시해드리는 것입니다. 핵심투자지표를 결합해 종목의 투자매력도를 종합 계산한 ""인공지능 투자점수""는 ""거장들의 투자공식"" 앱에서 확인하실 수 있습니다.) 라이온봇 기자 -한국경제TV※ 본 기사는 한국경제TV와 '거장들의 투자공식이'자체 개발한 '라이온봇 기자'가 실시간으로 작성한 기사입니다. 라이온봇기자"
뉴시스,080720,/news/news_read.nhn?article_id=0008726448&office_id=003&mode=search&query=한국유니온제약&page=1,2018-07-26 09:36,한국유니온제약 코스닥 신규상장 기념식,"【서울=뉴시스】 한국거래소 코스닥시장본부는 26일 오전 서울 여의도 서울사옥 홍보관에서 항생제류 등 의약품 제조업체인 한국유니온제약의 코스닥시장 신규상장기념식을 개최했다. 왼쪽부터 최규준 한국IR협의회 부회장, 손승균 DB금융투자 IB사업부장, 정운수 한국거래소 코스닥시장본부장, 백병하 한국유니온제약 대표이사, 안희숙 한국유니온제약 주주대표, 송윤진 코스닥협회 부회장이 기념촬영을 하고 있다. 2018.07.26. (사진=한국거래소 제공)"
서울경제,080720,/news/news_read.nhn?article_id=0003380129&office_id=011&mode=search&query=한국유니온제약&page=1,2018-08-27 11:29,"&lt;코&gt;한국유니온제약, 전일 대비 7.58% 상승.. 일일회전율은 5.44% 기록","[서울경제] 한국유니온제약(080720) 은 27일 오전 11시 28분 현재 7.58% 오른 17,750원에 거래되고 있으며, 34(매도):66(매수)의 매수우위를 기록하고 있다. 거래대금은 54억6,766만, 거래량은 32만1,252주로 거래량회전율은 5.44%로 나타났다. 지난 1개월간 한국유니온제약은 상승 7회, 하락 13회를 기록했고, 주가수익률은 0% 표준편차는 4.47%를 기록했다. 이 기간 ' 제약업 ' 업종 평균 주가수익률은 -3.58%로 나타났으며, 변동성은 2.06%를 기록했다. 이 시각 현재 ' 제약업 '은 1.23% 상승 중이며, 53(매도):47(매수)의 매도우위를 기록하고 있다."
한국경제,080720,/news/news_read.nhn?article_id=0003985668&office_id=015&mode=search&query=한국유니온제약&page=1,2018-07-26 09:19,"한국유니온제약, 코스닥 상장 첫날 '강세'&hellip;공모가 훌쩍","백병하 한국유니온제약 대표(사진=한국유니온제약 제공) 한국유니온제약이 코스닥시장 상장 첫날 강세를 보이고 있다. 26일 오전 9시 15분 현재 한국유니온제약은 시초가보다 1400원(6.09%) 오른 2만4400원에 거래되고 있다. 시초가는 공모가 1만8000원보다 27.8% 높은 2만3000원으로 결정됐다. 1985년 설립된 한국유니온제약은 전문의약품 제조 및 판매 기업으로 1세대 세파 항생제 '케포돈주', 혈관 확장제 '리마스타정', 위산분비 억제제 '뉴란소캡슐', 퇴행성 관절염 치료제 '유니히알주' 등이 주요 제품이다. 의약품 제조·판매 뿐 아니라 해외수출, 수탁사업(CMO) 등도 진행하고 있다. 지난해 매출과 영업이익은 508억원과 260억원으로 전년 대비 각각 7.11%, 9.51% 증가했다. 정형석 한경닷컴 기자"
아이뉴스24,080720,/news/news_read.nhn?article_id=0000453213&office_id=031&mode=search&query=한국유니온제약&page=1,2018-07-06 14:25,"[IPO] 한국유니온제약, 코스닥 입성&hellip; &quot;신물질로 성장동력 발굴&quot;","""신성장동력 발굴을 위해 압타머(Aptamer)를 활용한 바이오 의약품을 개발하고 있습니다."" [아이뉴스24 장효원 기자] 6일 백병하 한국유니온제약 대표는 여의도에서 코스닥 상장을 위한 기자간담회를 열고 ""압타머는 특정물질에 특이적으로 결합하는 3차원 구조의 리보핵산(RNA) 물질""이라며 ""표적 치료가 가능한 이 물질로 표적조영제, 표적항암이식제, 면역항암제 등을 개발할 것""이라고 밝혔다. 1985년 설립된 한국유니온제약은 의약품 제조·판매, 해외수출, 수탁사업(CMO) 등의 사업을 영위해 온 전문의약품 제조기업이다. 대표 의약품으로 1세대 세파항생제 '케포돈주', 혈관 확장제 '리마스타정', 위산분비 억제제 '뉴란소캡슐' 등이 있다. 올 1분기 말 기준 매출액 126억원을 기록했고 영업이익과 당기순이익은 각각 30억원, 24억원으로 전년 동기 대비 25%, 33% 증가했다. 매출액 구성은 의약품 제조판매가 96% 수준이고, CMO는 3% 비중을 차지한다. 매출 중 가장 큰 부분을 차지하는 제품은 케포돈주 등의 항생제류다. 케포돈주의 경우 2015년 시장점유율 9.23%(5위)에서 지난해 21.1%(1위)로 뛰어올랐다. 전체 매출의 12%를 차지하는 세프타짐주 역시 시장점유율이 기존 3위에서 지난해 2위로 상승했다. 한국유니온제약은 이번 공모자금 약 200억원 중 91억원을 의약품품질관리기준(cGMP) 공장에 투입할 예정이다. 신공장 완공 후 2020년부터 제품생산에 들어가면 판매품목수를 대폭 확대할 수 있을 전망이다. 현재 한국유니온제약는 생산능력 부족으로 허가품목수 406개 중 124개 품목만 판매하고 있다. 또 연구개발비에 44억원을 투입한다. 한국유니온제약은 관계사 인터올리고와 압타머를 활용한 공동기술 개발을 진행하고 있다. 표적조영제, 항암이식제 등이 개발 대상이다. 김순옥 한국유니온제약 연구소장은 ""압타머로 개발하는 조영제는 체내 잔존기간이 짧아 상대적으로 독성실험 임상허가기준이 쉬워 올해 내로 전임상을 완료할 예정""이라며 ""또 수술 후 남아있는 암세포를 죽이는 항암이식제도 자체 실험결과가 양호하다""고 설명했다. 한편 한국유니온제약은 이번 코스닥 상장을 통해 150만주를 공모한다. 주당 희망 공모가밴드는 1만3천500~1만6천원이며 공모금액은 202억~240억원이다. 오는 9~10일 수요예측을 진행하고 17~18일 공모 청약을 진행한다. 상장예정일은 26일이며, 대표 주관사는 DB금융투자다. /장효원기자"
아이뉴스24,080720,/news/news_read.nhn?article_id=0000452955&office_id=031&mode=search&query=한국유니온제약&page=1,2018-07-05 08:24,"[I-리포트] 한국유니온제약, 다양한 제형 생산 경쟁력-BNK證","[아이뉴스24 한수연 기자] BNK투자증권이 이달 코스닥 상장을 앞두고 있는 한국유니온제약에 대해 다양한 제형 생산 경쟁력이 있다고 평가했다. 투자의견과 목표주가는 따로 제시하지 않았다. 5일 최종경 BNK투자증권 연구원은 ""의약품 개발과 제조, 판매 전문 제약사인 한국유니온제약은 내용고형제(정제 및 캡슐제)와 주사제(액상), 특수제제(세파분말) 등 다양한 제형의 생산 능력과 제제 및 제형 변경으로 시장성을 확대한 개량신약 개발 능력을 보유하고 있다""며 ""특히 지속적인 연구개발(R&D) 기반 개량신약 개발로 제품 경쟁력과 시장성을 확보해 경쟁력이 있다""고 설명했다. 추진 중인 주사제 전용 신공장 증설에 대해서는 판매품목 확대 면에서 긍정적이라는 진단이다. 최 연구원은 ""생산시설 대비 3배 규모의 신공장 건설을 추진 중인데 완공할 경우 주사제 전용 cGMP 규격의 제2공장 증설로 판매품목이 확대되고 주사제 시장의 지위도 확보할 수 있다""며 ""화장품 원료용 세포생장 촉진 펩타이드 개발 등 미래 성장 동력도 눈여겨 봐야할 부분""이라고 덧붙였다. /한수연 기자"
서울경제,080720,/news/news_read.nhn?article_id=0003366581&office_id=011&mode=search&query=한국유니온제약&page=1,2018-08-07 15:04,"&lt;코&gt;한국유니온제약, 장중 신저가 기록.. 16,800&rarr;16,750(▼50)","[서울경제] 오후 3시 3분 현재 한국유니온제약(080720) 이 0.59% 내린 16,750원(▼100)을 기록하며, 52주 신저가를 -50원 경신했다. 기존 52주 최저가는 2018년 08월 06일 기록한 16,800원이다. 체결강도는 71%로 강세 반전했다. 총매수체결량은 93,891주, 총매도체결량은 132,228주를 각각 기록했다.  (※ 체결강도(%) = (총매수체결량/총매도체결량)*100) 이 시각 현재 거래대금은 40억9,347만, 거래량은 23만9,490주를 기록하고 있으며, 수급측면으로는 58(매도):42(매수)의 매도우위를 보이고 있다. 거래일을 기준으로 최근 3일간 평균 거래량은 3십1만7천주, 60일 평균 거래량 1백7만3천주로 최근 거래량이 큰 폭으로 감소하는 추세다."
