source,symbol,link,date,title,content
한국경제TV,080720,/news/news_read.nhn?article_id=0000658103&office_id=215&mode=search&query=한국유니온제약&page=1,2018-07-06 15:34,한국유니온제약 &quot;26일 코스닥 상장...종합 헬스케어 기업 도약&quot;,"cGMP 수준 신공장 증설...표적 조영제 개발 중 [한국경제TV 전민정 기자] 오는 26일 코스닥 상장을 앞두고 있는 한국유니온제약이 신 공장 증설과 바이오 의약품 개발 등을 통해 종합 헬스케어기업으로 거듭나겠다는 포부를 밝혔습니다. 백병하 한국유니온제약 대표 6일 서울 여의도에서 열린 기자간담회에서 ""이번 코스닥 시장 상장을 계기로 생산시설을 확충하고 바이오 연구개발(R&D) 확대, 제품의 제형·제제 개발 등을 통해 신뢰받는 종합 헬스케어 기업으로 도약하겠다""고 말했습니다. 백 대표는 또 ""제조시설을 갖추고 있고 생산 품목이 400여가지나 된다는 것이 회사의 가장 큰 장점""이라며 ""직접 생산을 통해 비용을 낮추는 방식으로 안정적으로 매출을 올려 나가겠다""고 강조했습니다. 1985년 설립된 한국유니온제약은 33년 간 의약품 제조·판매, 해외수출, 의약품위탁생산(CMO) 등의 사업을 영위해 온 전문의약품 제조와 판매 전문 기업입니다. 대표 의약품으로는 1세대 세파 항생제 '케포돈주', 혈관 확장제 '리마스타정', 위산분비 억제제 '뉴란소캡슐', 퇴행성 관절염 치료제 '유니히알주' 등이 있습니다. 한국유니온제약은 정제, 캡슐제, 액상 주사제, 세파분말 주사제 등 전 제형을 생산할 수 있는 제형 능력을 갖추고 있습니다. 항생제류, 순환기계류, 근골격계류, 소화기계류의 기존 4대 주력 제품군에 추가로 호흡기계류와 비뇨기계류의 개량 신약을 개발해 제품 라인업도 확대했습니다. 백 대표는 ""개량신약 개발과 제품군 확대를 위해 강원도 원주시 문막읍에 제2공장 건설을 추진 중”이라며 “현재 가동 중인 공장의 주사제 품목 캐파가 한계에 달함에 따라 신공장은 주사제 전용우수 의약품 제조·품질 관리 기준(cGMP) 규격 제조시설로 세울 계획”이라고 강조했습니다. 회사 측은 내년 중으로 신공장을 완공해 2020년 상반기에는 본격적인 제품을 생산하는 것을 목표로 하고 있으며, 이를 통해 국내 주사제 CMO시장 독보적인 위치를 점한다는 계획입니다. 한국유니온제약은 바이오 분야도 회사의 신성장동력으로 꼽았습니다. 현재 바이오벤처 인터올리고와 압타머(Aptamer)를 활용한 유방암 표적 양전자방출단층촬영(PET) 조영제를 공동 개발 중입니다. 압타머는 체내 바이오마커로 쓸 수 있는 단백질, 바이러스 등과 결합하는 3차원 구조 물질로 특이 타겟에 결합하는 속성이 있어 새로운 핵산 치료제로 각광받는 물질입니다. 이 밖에도 주사제 품목의 경쟁우위를 기반으로 중동, 동남아시아, 중남미 등 파머징 시장 중심으로 수출을 본격화하고, CMO에서 위탁개발생산(CDMO) 비즈니스로 사업을 확장할 계획입니다. 한편 한국유니온제약의 총 공모주식수는 150만주로, 주당 희망 공모가 밴드는 1만3500원에서 1만6000원이며 공모금액 규모는 202억원에서 240억원입니다. 오는 9~10일 수요예측을 실시해 공모가를 확정하고 17~18일 이틀 동안 공모 청약을 진행할 계획으로 상장예정일은 26일입니다."
연합뉴스,080720,/news/news_read.nhn?article_id=0009999063&office_id=001&mode=search&query=한국유니온제약&page=1,2018-04-02 17:18,엠코르셋&middot;한국유니온제약 등 8개사 코스닥 상장예심 청구,"(서울=연합뉴스) 권수현 기자 = 한국거래소 코스닥시장본부는 엠코르셋과 한국유니온제약, 디아이티 등 8개사의 상장 예비심사 청구서를 접수했다고 2일 밝혔다. 엠코르셋은 속옷 전문 제조·유통업체로 원더브라와 플레이텍스 등 외국 브랜드와 미싱도로시, 르페 등 자체 브랜드 상품을 취급한다. 지난해 1천243억원의 매출에 96억원의 영업이익을 올렸다. 1956년 설립된 한국유니온제약은 항생제, 순환기계, 근골격계, 소화기계 관련 의약품을 생산하는 제약사다. 작년 매출액과 영업이익은 508억원과 79억원이었다. 디아이티는 디스플레이 검사장비 제조업체로 작년에 매출액 860억원, 영업이익 139억원의 실적을 냈다. 이밖에 반도체·디스플레이 검사설비와 스마트팩토리 개발업체인 트윔, 죽염 제품 제조사인 인산가, 정보기술(IT) 보안 솔루션 업체인 휴네시온, 정보보안 컨설팅 업체인 에스에스알(SSR), 신약 개발업체인 올릭스 등도 예비심사 청구서를 냈다."
뉴시스,080720,/news/news_read.nhn?article_id=0008723855&office_id=003&mode=search&query=한국유니온제약&page=1,2018-07-25 05:00,[IPO톡톡]한국유니온제약 백병하 대표 &quot;진실된 성장으로 주주와의 약속 지킬 것&quot;,"""기관투자자 평가 좋았다…상장사로서 이익 경쟁 승산 있어""""2공장 증설 완료되면 매출 현재 수준의 3~4배로 늘어날 것""""과욕 부리지 않는 것이 철칙…회사 키우는 건 오너 아닌 직원"""
한국경제,080720,/news/news_read.nhn?article_id=0003974942&office_id=015&mode=search&query=한국유니온제약&page=1,2018-07-06 15:31,[상장예정기업]한국유니온제약 &quot;내년 신공장 완공&hellip;종합 헬스케어기업 도약&quot;,"백병하 한국유니온제약 대표(사진=한국유니온제약 제공) ""내년 신공장 완공과 코스닥 시장 상장을 발판으로 신뢰받는 종합 헬스케어 기업으로 도약하겠습니다."" 이달 26일 코스닥 시장 상장 예정인 한국유니온제약의 백병하 대표(사진)는 6일 서울 여의도 한 식당에서 기자간담회를 열고 이같이 말했다. 1985년 설립된 한국유니온제약은 전문의약품 제조 및 판매 기업으로 1세대 세파 항생제 '케포돈주', 혈관 확장제 '리마스타정', 위산분비 억제제 '뉴란소캡슐', 퇴행성 관절염 치료제 '유니히알주' 등이 주요 제품이다. 의약품 제조·판매 뿐 아니라 해외수출, 수탁사업(CMO) 등도 진행하고 있다. 한국유니온제약은 항생제류·순환기계류·근골격계류, 소화기계류의 기존 4대 주력 제품군에 추가로 호흡기계류와 비뇨기계류의 개량 신약을 개발해 제품군을 확장했다고 전했다. 개량 신약과 제제 변경에 대한 지속적인 연구개발을 진행해 중장기적인 제품 경쟁력과 시장성을 확보한다는 계획이다. 이를 위해 주사제 전용의 선진 의약품 제조 및 품질관리 기준(cGMP) 규격의 신공장 건설을 추진 중이라고 전했다. 백 대표는 ""내년까지 신공장이 완공되고, 2020년부터 본격적인 제품 생산을 시작하면 주사제 시장 내 독보적인 지위를 누릴 수 있을 것""이라고 전망했다. 아울러 화장품 원료 사업 영역을 확대하고, 바이오의약품 시장 진입을 위해 기존 항체 대체 물질로 기대받고 있는 '압타머'를 활용한 유방암 표적 양전자방출단층촬영(PET) 조영제를 인터올리고와 공동으로 개발하고 있다고 설명했다. 지난해 매출과 영업이익은 508억원과 260억원으로 전년 대비 각각 7.11%, 9.51% 증가했다. 한국유니온제약의 총 공모주식수는 150만주이고, 오는 9~10일 기관투자자를 대상으로 수요예측을 실시해 공모가를 확정한다. 주당 희망 공모가격은 1만3500~1만6000원이다. 이달 17~18일 일반공모 청약을 진행한다. 대표 주관회사는 DB금융투자이다. 오정민 한경닷컴 기자"
뉴시스,080720,/news/news_read.nhn?article_id=0008692569&office_id=003&mode=search&query=한국유니온제약&page=1,2018-07-06 14:32,[IPO기업]한국유니온제약 &quot;신공장 증설로 종합 헬스케어 기업 도약&quot;,"1세대 세파 항젱제 '케포돈주', 매출 1위 효자 품목강원도 원주 cGMP 제조 시설 신축…내년 완공 예상치매제, 배뇨장애 치료제 등 개량신약 개발, 시판 중유방암 조기 진단 및 표적 치료용 조영제 시장 진출"
서울경제,080720,/news/news_read.nhn?article_id=0003365705&office_id=011&mode=search&query=한국유니온제약&page=1,2018-08-06 14:40,"&lt;코&gt;한국유니온제약, 장중 신저가 기록.. 17,100&rarr;17,000(▼100)","[서울경제] 오후 2시 39분 현재 한국유니온제약(080720) 이 1.73% 내린 17,000원(▼300)을 기록하며, 52주 신저가를 -100원 경신했다. 기존 52주 최저가는 2018년 08월 03일 기록한 17,100원이다. 체결강도는 56%로 강세 반전했다. 총매수체결량은 56,430주, 총매도체결량은 100,510주를 각각 기록했다.  (※ 체결강도(%) = (총매수체결량/총매도체결량)*100) 이 시각 현재 거래대금은 27억7,028만, 거래량은 16만700주를 기록하고 있으며, 수급측면으로는 64(매도):36(매수)의 매도우위를 보이고 있다. 거래일을 기준으로 최근 3일간 평균 거래량은 3십9만1천주, 60일 평균 거래량 1백1십9만2천주로 최근 거래량이 큰 폭으로 감소하는 추세다."
서울경제,080720,/news/news_read.nhn?article_id=0003364181&office_id=011&mode=search&query=한국유니온제약&page=1,2018-08-03 10:14,"&lt;코&gt;한국유니온제약, 장중 신저가 기록.. 17,900&rarr;17,500(▼400)","[서울경제] 오전 10시 12분 현재 한국유니온제약(080720) 이 2.23% 내린 17,500원(▼400)을 기록하며, 52주 신저가를 -400원 경신했다. 기존 52주 최저가는 2018년 08월 02일 기록한 17,900원이다. 체결강도는 57%로 강세 반전했다. 총매수체결량은 38,508주, 총매도체결량은 67,766주를 각각 기록했다.  (※ 체결강도(%) = (총매수체결량/총매도체결량)*100) 이 시각 현재 거래대금은 19억5,529만, 거래량은 10만9,746주를 기록하고 있으며, 수급측면으로는 64(매도):36(매수)의 매도우위를 보이고 있다. 거래일을 기준으로 최근 3일간 평균 거래량은 5십3만3천주, 60일 평균 거래량 1백3십3만1천주로 최근 거래량이 큰 폭으로 감소하는 추세다."
한국경제,080720,/news/news_read.nhn?article_id=0003979547&office_id=015&mode=search&query=한국유니온제약&page=1,2018-07-15 18:32,롯데정보통신&middot;한국유니온제약 17~18일 청약,"이번주 공모주 [ 이고운 기자  ] 롯데정보통신과 한국유니온제약이 17~18일 공모주 일반 청약을 받는다. 롯데정보통신은 롯데그룹 정보기술(IT) 계열사다. 지난해 롯데지주가 출범한 뒤 그룹 내 첫 계열사 기업공개(IPO)다. 희망 공모가 범위는 2만8300~3만3800원이다. 공모가는 16일 확정 공시한다. 롯데정보통신은 전체 매출의 80%(연결재무제표 기준)를 롯데그룹 계열사를 통해 올리고 있다. 대표 주관사인 미래에셋대우, 인수증권사인 신한금융투자 KB증권 하나금융투자를 통해 청약할 수 있다. 오는 27일 유가증권시장에 상장할 예정이다. 한국유니온제약은 전문 의약품 제조회사다. 공모가는 1만8000원으로 확정했다. 수요예측(기관투자가 대상 사전청약)에서 918.99 대 1의 경쟁률을 나타냈다. 기관들의 투자 열기에 힘입어 희망 범위(1만3500~1만6000원)보다 높은 수준으로 공모가를 결정했다."
서울경제,080720,/news/news_read.nhn?article_id=0003371253&office_id=011&mode=search&query=한국유니온제약&page=1,2018-08-14 11:00,"&lt;코&gt;한국유니온제약, 장중 신저가 기록.. 16,100&rarr;15,950(▼150)","[서울경제] 오전 10시 59분 현재 한국유니온제약(080720) 이 0.93% 내린 15,950원(▼150)을 기록하며, 52주 신저가를 -150원 경신했다. 기존 52주 최저가는 2018년 08월 13일 기록한 16,100원이다. 체결강도는 91%로 강세 반전했다. 총매수체결량은 60,138주, 총매도체결량은 65,789주를 각각 기록했다.  (※ 체결강도(%) = (총매수체결량/총매도체결량)*100) 이 시각 현재 거래대금은 20억4,950만, 거래량은 12만7,025주를 기록하고 있으며, 수급측면으로는 52(매도):48(매수)의 매도우위를 보이고 있다. 거래일을 기준으로 최근 3일간 평균 거래량은 3십1만1천주, 60일 평균 거래량 8십1만3천주로 최근 거래량이 큰 폭으로 감소하는 추세다."
매일경제,080720,/news/news_read.nhn?article_id=0004183534&office_id=009&mode=search&query=한국유니온제약&page=1,2018-07-12 11:37,"한국유니온제약, 공모가 1만8000원 확정&hellip;26일 코스닥 상장","전문의약품 회사 한국유니온제약의 공모가가 희망가 밴드 최상단을 넘어선 가격에 확정됐다. 한국유니온제약은 지난 9~10일 이틀에 걸쳐 진행한 수요예측에서 공모가를 1만8000원에 확정했다고 12일 공시했다. 경쟁률은 918.99대 1을 기록했다. 이에 따라 총 공모금액은 270억원, 상장 후 시가총액은 약 1034억원으로 예상된다. 회사 관계자는 ""수요예측에 참여해 주신 국내외 기관투자자 분들의 높은 관심에 큰 감사를 표한다""며 ""다음주 진행되는 일반투자자 청약에도 많은 관심을 부탁드린다""고 말했다. 한국유니온제약은 오는 17~18일 양일 간 총 공모주식수의 20%인 30만주에 대한 일반 공모 청약을 실시한다. 상장 예정일은 26일, 대표 주관회사는 DB금융투자다. 한편 한국유니온제약은 지난 1985년 설립된 전문의약품 제조 및 판매 전문 제약기업이다. 전문의약품 제조와 판매, 해외수출, 수탁사업(CMO) 등의 사업을 영위하고 있다. 회사의 신성장동력 발굴을 위해 기존 항체를 효과적으로 대체할 수 있는 물질로 기대받고 있는 압타머(Aptamer)를 활용한 유방암 표적 양전자방출단층촬영(PET) 조영제를, '인터올리고'와 공동 개발하고 있다. [디지털뉴스국 김경택 기자] r_start // r_end //"
서울경제,080720,/news/news_read.nhn?article_id=0003370216&office_id=011&mode=search&query=한국유니온제약&page=1,2018-08-13 09:52,"&lt;코&gt;한국유니온제약, 장중 신저가 기록.. 16,750&rarr;16,650(▼100)","[서울경제] 오전 9시 51분 현재 한국유니온제약(080720) 이 2.35% 내린 16,650원(▼400)을 기록하며, 52주 신저가를 -100원 경신했다. 기존 52주 최저가는 2018년 08월 07일 기록한 16,750원이다. 체결강도는 122%로 강세를 유지했다. 총매수체결량은 67,129주, 총매도체결량은 54,877주를 각각 기록했다.  (※ 체결강도(%) = (총매수체결량/총매도체결량)*100) 이 시각 현재 거래대금은 21억5,140만, 거래량은 12만5,456주를 기록하고 있으며, 수급측면으로는 45(매도):55(매수)의 매수우위를 보이고 있다. 거래일을 기준으로 최근 3일간 평균 거래량은 4십6만8천주, 60일 평균 거래량 8십5만5천주로 최근 거래량이 큰 폭으로 감소하는 추세다."
머니투데이,080720,/news/news_read.nhn?article_id=0004079993&office_id=008&mode=search&query=한국유니온제약&page=1,2018-07-18 17:00,"한국유니온제약, 청약경쟁률 1015대 1..증거금 2조7432억원","[머니투데이 김도윤 기자] 한국유니온제약은 지난 17일부터 이틀간 진행한 일반투자자 대상 공모 청약 결과 경쟁률 1015.13대 1을 기록했다고 18일 밝혔다. 청약증거금은 약 2조7432억원이다. 한국유니온제약은 지난 9~10일 기관투자자를 대상으로 진행한 수요예측 결과를 토대로 공모가를 1만8000원으로 확정했다. 희망공모가밴드(1만3500~1만6000원) 상단을 초과한 가격이다. 코스닥 상장예정일은 오는 26일이다. 한국유니온제약은 1985년 설립된 전문의약품 제조 및 판매 회사다. 지난해 매출액은 508억원, 영업이익은 78억원이다. 한국유니온제약 관계자는 ""수요예측부터 일반 공모까지 큰 관심을 보여준 국내외 투자자에게 감사드린다""며 ""앞으로 책임감을 바탕으로 주주가치를 제고할 수 있도록 최선을 다하겠다""고 말했다."
세계일보,080720,/news/news_read.nhn?article_id=0003291957&office_id=022&mode=search&query=한국유니온제약&page=1,2018-07-26 09:48,"한국유니온제약, 코스닥 상장 첫날 '급등'&hellip;공모가 대비 43%&uarr;","백병하 한국유니온제약 대표. 한국유니온제약 제공 한국유니온제약이 코스닥 시장 상장 첫날 강세를 보이며 공모가를 크게 웃돌고 있다. 이날 오전 9시6분 현재 한국유니온제약은 시초가 2만3000원 대비 11.96% 상승한 2만5750원에 거래됐다. 이는 공모가인 1만8000원보다 43%가량 오른 수준이다. 한국유니온제약은 1985년 8월 설립된 완제 의약품 제조 및 판매 업체다. 세파계 항생제 '케포돈주'와 혈관 확장제 '리마스타정', 위산분비 억제제 '뉴란소캡슐', 퇴행성 관절염 치료제 '유니히알주' 등을 생산한다.  완제 의약품의 국내 판매와 해외 수출, 타 제약회사에 대한 수탁생산(CMO)을 주요 사업으로 하고 있다. 지난해 매출과 영업이익은 508억원과 260억원으로 전년 대비 각각 7.11%, 9.51% 증가했다. 순이익 31억원을 거뒀다.  뉴스팀"
매일경제,080720,/news/news_read.nhn?article_id=0004186999&office_id=009&mode=search&query=한국유니온제약&page=1,2018-07-18 16:37,"한국유니온제약, 청약 경쟁률 1015.13대 1&hellip;26일 코스닥 상장","전문의약품 전문회사 한국유니온제약은 지난 17~18일 실시한 일반 공모 청약 경쟁률이 1015.13대 1을 기록했다고 밝혔다. 공모 청약에 총 3억453만9330주가 접수됐으며, 경쟁률은 1015.13대 1을 기록했다. 청약 증거금은 약 2조7408억원으로집계됐다. 앞서 한국유니온제약은 공모가를 1만8000원으로 확정한 바 있으며, 오는 26일 코스닥 시장에 상장할 예정이다. [디지털뉴스국 김경택 기자] r_start // r_end //"
매일경제,080720,/news/news_read.nhn?article_id=0004198966&office_id=009&mode=search&query=한국유니온제약&page=1,2018-08-09 17:55,[코스닥 공시] 웰크론강원 / 한국유니온제약,◇웰크론강원=현대엔지니어링과 39억원 규모 제품 공급 계약 체결. ◇한국유니온제약=123억원 규모 공장 신축 투자. r_start // r_end //
동아일보,080720,/news/news_read.nhn?article_id=0003160609&office_id=020&mode=search&query=한국유니온제약&page=1,2018-07-26 09:50,"한국유니온제약, 코스닥상장 첫날 오르락내리락&hellip;&lsquo;강세&rarr;하락세&rsquo;","[동아닷컴] 사진=한국유니온제약 주가(네이버) 한국유니온제약이 26일 코스닥시장 상장 첫날 강세를 보이다가 하락세에 접어들었다. 한국유니온제약은 이날 오전 9시 6분 시초가(2만3000원) 대비 11.96% 상승한 2만5750원에 거래됐다. 시초가는 공모가 1만8000원보다 27.8% 높은 2만3000원으로 결정됐다. 그러나 오전 9시 36분 기준, 시초가(2만3000원) 대비 4.78% 하락한 2만1900원을 기록하고 있다. 1985년 설립된 한국유니온제약은 의약품 제조·판매 기업이다. 대표 의약품으로는 세파계 항생제 ‘케포돈주’, 혈관 확장제 ‘리마스타정’, 위산분비 억제제 ‘뉴란소캡슐’, 퇴행성 관절염 치료제 ‘유니히알주’ 등이 있다. 지난해 기준 매출액 508억 원, 영업이익 79억 원, 당기순이익 31억 원을 기록했다."
연합뉴스,080720,/news/news_read.nhn?article_id=0010260199&office_id=001&mode=search&query=한국유니온제약&page=1,2018-08-09 11:12,"한국유니온제약, 공장 신축에 123억원 투자",(서울=연합뉴스) 임은진 기자 = 한국유니온제약은 의약 및 의약품 위탁생산(CMO) 사업 확장에 따른 공장 신축을 위해 123억원을 투자한다고 9일 공시했다. 작년 말 개별기준 자기자본의 24.6%에 해당한다.
서울경제,080720,/news/news_read.nhn?article_id=0003367243&office_id=011&mode=search&query=한국유니온제약&page=1,2018-08-08 11:39,"&lt;코&gt;한국유니온제약, 전일 대비 8.61% 상승.. 일일회전율은 6.93% 기록","[서울경제] 한국유니온제약(080720) 은 8일 오전 11시 39분 현재 8.61% 오른 18,300원에 거래되고 있으며, 38(매도):62(매수)의 매수우위를 기록하고 있다. 거래대금은 69억8,505만, 거래량은 39만7,894주로 거래량회전율은 6.93%로 나타났다. 지난 1개월간 한국유니온제약은 상승 1회, 하락 7회를 기록했고, 주가수익률은 0% 표준편차는 5.06%를 기록했다. 이 기간 ' 제약업 ' 업종 평균 주가수익률은 -6.58%로 나타났으며, 변동성은 2.00%를 기록했다. 이 시각 현재 ' 제약업 '은 0.09% 상승 중이며, 48(매도):52(매수)의 매수우위를 기록하고 있다."
이데일리,080720,/news/news_read.nhn?article_id=0004185288&office_id=018&mode=search&query=한국유니온제약&page=1,2018-08-30 09:35,"한국유니온제약, 자회사 '한국유니온생명과학' 설립","연구소장에 '엑소좀 연구 전문가' 이재삼 박사 [이데일리 윤종성 기자] 한국유니온제약(080720)은 바이오의약품 산업 진출을 위한 자회사로 ‘한국유니온생명과학’을 설립하고, 연구소장과 책임연구원에 각각 이재삼 박사, 김정석 박사를 영입했다고 30일 밝혔다. 회사 측은 “전임상을 앞두고 있는 ‘압타머(Aptamer)’를 활용한 유방암 표적 양전자방출단층촬영(PET) 조영제와 췌장암 표적 항암제 연구개발을 전담하기 위해 자회사인 연구소를 설립했다”며 “인터올리고와 공동 연구 중인 압타머 외에도 엑소좀을 활용한 치료제 개발에도 나설 계획”이라고 설명했다. 한국유니온생명과학은 연구소 설립과 동시에 ‘엑소좀(Exosome)’을 이용한 암, 심혈관 질환 등 난치성 질환의 조기 진단과 효율적인 질환별 치료제의 개발을 시작한다. 엑소좀은 세포가 다른 세포에 특정 정보를 전달할 목적으로 자신의 유전자나 단백질을 담아 분비하는 나노 크기의 소포체다. 엑소좀의 특성을 분석해 유래 세포의 상태를 확인하고 병인을 진단할 수 있으며, 효율적인 치료제를 개발할 수 있을 것으로 회사 측은 기대했다. 이재삼 연구소장은 “압타머와 엑소좀의 응용 연구를 위한 연구원을 충원하고 있으며 이를 기반으로 한 진단 및 항암제 개발을 본격 수행할 계획”이라며 “앞으로 획기적인 진단과 치료제 개발을 위한 국내외 대학, 병원, 연구소, 제약회사 등과의 공동개발을 적극 추진할 것”이라고 말했다. 한편 지난 7월 코스닥 시장에 상장한 한국유니온제약은 전문의약품 제조 및 판매, 수출, 수탁사업(CMO) 등의 사업을 영위하고 있다. ▲한국유니온제약 백병하 대표(왼쪽)와 이재삼 연구소장(사진=한국유니온제약)"
뉴시스,080720,/news/news_read.nhn?article_id=0008723926&office_id=003&mode=search&query=한국유니온제약&page=1,2018-07-25 08:05,백병하 한국유니온제약 대표이사 뉴시스 인터뷰,【성남=뉴시스】고범준 기자 = 백병하 한국유니온제약 대표이사가 16일 오후 경기도 성남시 분당구 한국유니온제약 본사에서 코스닥 상장을 앞두고 뉴시스와 인터뷰를 하고 있다. 2018.07.25.
머니S,080720,/news/news_read.nhn?article_id=0000331812&office_id=417&mode=search&query=한국유니온제약&page=1,2018-07-26 09:51,"[특징주] 한국유니온제약, 상장 첫날 약보합세",한국유니온제약이 코스닥 상장 첫날 약보합세를 나타내고 있다. 26일 오전 9시50분 현재 한국유니온제약은 시초가 대비 200원(0.87%) 내린 2만2800원에 거래되고 있다. 이날 한국유니온제약은 장중 2만5800원(12.17%)까지 오르기도 했다. 앞서 한국유니온제약은 기관투자자 대상 수요예측에서 918.99대1의 경쟁률을 기록했으며 희망공모가(1만3500~1만6000원) 상단을 넘어 1만8000원으로 공모가를 확정했다. 일반투자자를 대상으로 한 공모청약에서는 최종 경쟁률 1015.13대1을 기록했다. 홍승우 기자
