source,symbol,link,date,title,content
머니투데이,082270,/news/news_read.nhn?article_id=0003557076&office_id=008&mode=search&query=젬백스&page=1,2015-10-08 14:19,"젬백스테크놀러지, 34억 규모 전환사채 발행 결정","[머니투데이 김남이 기자] 젬백스테크놀러지는 34억원 규모의 무기명식 무보증 사모 전환사채를 발행했다고 8일 공시했다. 이번 사채의 표면금리는 0.0%이며, 별도의 이자지급 기일은 없다. textlinktopstart textlinktopend textlinkstart"
머니투데이,082270,/news/news_read.nhn?article_id=0003788271&office_id=008&mode=search&query=젬백스&page=1,2016-12-12 10:53,"젬백스테크, 한국콜마와 뷰티 디바이스 사업 MOU 체결","[머니투데이 김건우 기자]  젬백스테크놀러지가 지난 8일 한국콜마주식회사와 뷰티와 연계된 디바이스 사업에 대한 포괄적인 협력을 추진하는 것을 내용으로 하는 양해각서(MOU)를 체결했다고 12일 밝혔다. 이번 업무협약은 디지털과 뷰티 기술을 융합하여 고객에게 또다른 가치를 제공한다는 의미를 담고 있다. 두 회사는 뷰티 디바이스 개발 및 서비스 시장 개척을 위해 상호간에 협력하며, 서비스 및 공동기획 및 개발을 위한 정기적인 교류를 실시하기로 합의했다. 한국콜마는 미주 및 글로벌 시장 개척에 있어 서비스 유통, 마케팅을, 젬백스테크놀러지는 글로벌 수준의 뷰티디바이스 개발 및 제조를 각각 담당하게 된다. 젬백스테크놀러지는 스마트폰부터 스마트워치에 이르는 다양한 디스플레이스 모듈 및 뷰티&헬스케어 기술을 갖추고 있는 디바이스 전문기업이다. 계열사인 바이오기업 젬백스앤카엘과 삼성제약 등을 통해 바이오 산업 전반에 대한 폭넓은 이해와 접근이 가능해 시너지 창출이 기대된다고 회사 측은 설명했다. 젬백스테크놀러지 관계자는 ""이번 양해각서 체결을 통하여 기술장벽이 높은 미주시장 개척에 있어 수준 높은 K-뷰티솔루션을 제공하고 뷰티시장 영역을 확장해 나갈 수 있을 것""이라며 ""미국시장 뿐만 아니라 글로벌 뷰티시장에 적극적으로 진출하겠다""고 말했다. textlinktopstart textlinktopend textlinkstart"
매일경제,082270,/news/news_read.nhn?article_id=0003606499&office_id=009&mode=search&query=젬백스&page=1,2015-10-29 08:42,"젬백스 &quot;증선위 조치, 적극 해명하겠다&quot;","젬백스는 증권선물위원회(이하 증선위)의 고발 조치와 관련, 2013년 임상 실패설 등에 대한 금융당국 측의 오해가 있다면 적극 해명할 계획이라고 29일 밝혔다. 증권선물위원회는 전날 정례회의를 열고 젬백스 대표 A씨를 불공정거래 혐의로 검찰에 고발하기로 했다. 증선위는 A씨가 자회사 신제품 개발사업 실패설로 젬백스 주가가 급락하자 담보주식의 반대매매 및 경영권 상실 등을 방지하기 위해 실패를 인지하고도 ‘실패설은 사실이 아니다’라는 허위 보도자료를 배포한 혐의가 있다고 보고 있다. 젬백스 관계자는 “췌장암 치료제 리아백스주는 임상 성공 이후 현재 판매승인을 받은 상태”라며 “판매는 중동호흡기증후군(메르스) 사태로 늦어진 것일 뿐이고 해외 기술이전 또한 순조롭게 진행하고 있다”고 밝혔다. 이어 “아직 금감원과 증선위로부터 어떠한 통보를 받지도 못했다”며 “적극 해명하겠다”고 거듭 강조했다. [매경닷컴 김잔디 기자] r_start // r_end // [ⓒ 매일경제 & mk.co.kr, 무단전재 및 재배포 금지] 매일경제 관련뉴스해당 언론사에서 선정하며 언론사 페이지(아웃링크)로 이동해 볼 수 있습니다.송지은, 초미니 입고 계단 오르다…한손으로 애써 가려보지만 ""다 보여?""땅값 59개월째 오름세…대구·제주·세종 급등도도맘 김미나 ""강용석과 안 잤다"" 불륜설 심경종가음식 홍보에 팔걷은 이부진, 전통 종가음식 현대화 나선다이혜영, 딸이 있었나? 모전여전 미모 자랑하는 명문고 재학 딸 깜짝 공개"
파이낸셜뉴스,082270,/news/news_read.nhn?article_id=0003936466&office_id=014&mode=search&query=젬백스&page=1,2018-01-04 08:29,"[공시] 젬백스테크놀러지, 154억 규모 제3자배정 유상증자",젬백스테크놀러지는 운영자금 조달을 위해 154억4400만원 규모의 제3자배정 방식 유상증자를 결정했다고 4일 공시했다. 발행신주는 보통주 324만7947주로 발행가액은 4755원이다. 신주 상장예정일은 오는 25일이다.
코메디닷컴,082270,/news/news_read.nhn?article_id=0000034503&office_id=296&mode=search&query=젬백스&page=1,2018-01-26 13:45,"젬백스앤카엘 GV1001, 청력손상 치료 효과 확인","젬백스앤카엘이 면역 항암제로 개발한 GV1001이 청력 손상을 회복시켰다는 연구 결과가 발표됐다. 젬백스앤카엘(대표이사 송형곤)은 SCI급 국제 학술지 'Frontiers in Cellular Neuroscience'에 GV1001이 약물에 의해 유발된 청력 소실을 회복시키는데 효과가 있음을 증명한 연구 논문이 게재됐다고 26일 밝혔다. 분당서울대병원 이비인후과 구자원 교수 연구팀은 청력 손실을 유도한 쥐에게 생리 식염수, 스테로이드 덱사메타손, GV1001을 각각 투여해 청각유모세포(cochlear hair cell)의 조직학적 형태와 청력 소실 정도를 측정했다. 그 결과 GV1001을 투여한 군에서 청각유모세포의 손상이 현저하게 낮고 청력 소실이 유의하게 감소함을 확인했다. 기존 연구들이 예방적 효과를 보고한 것과 달리 이번 연구에서는 난청이 유발된 이후 3일 지연 처치한 군에서도 치료 효과가 있음을 확인했다. 구자원 교수는 ""GV1001의 약리 작용 중 항염, 항산화, 세포 사멸 억제 효과 효과로 청력 소실이 호전되는 것으로 보인다""며 ""이번 연구는 일단 발생하면 회복하기 어려운 청력 손상에 대한 새로운 치료적 대안을 제시한 의미 있는 연구""라고 말했다. 젬백스앤카엘 송형곤 대표는 ""이번 연구로 GV1001은 전립선 비대증과 알츠하이머에 이어 청력 손상에 효과가 있는 것으로 확인됐다""며 ""스테로이드에 버금가는 항염 효과 등 항암 이외의 여러 효과에 대한 연구를 지속하겠다""고 말했다."
아시아경제,082270,/news/news_read.nhn?article_id=0003780020&office_id=277&mode=search&query=젬백스&page=1,2016-07-04 08:54,"젬백스, 의대교수 출신 연구소장&middot;사장 영입&hellip;&quot;사업 박차&quot;","(왼쪽부터)송형곤 신임 젬백스 사장, 문찬일 신임 중앙연구소장 [아시아경제 이정민 기자] 젬백스앤카엘은 이달 1일자로 젬백스 중앙연구소장에 문찬일 박사, 바이오사업부문 사장에 송형곤 박사를 임명했다고 4일 밝혔다. 중앙연구소장으로 임명된 문찬일 박사는 ""우선 펩타이드를 이용한 신약개발 뿐 아니라 줄기세포 치료제 개발과 삼성제약의 연구개발 부문에도 연구 역량을 투입할 계획""이라며 ""젬백스 전 계열사의 연구 분야를 총괄해 통합적인 연구개발 업무를 수행할 것""이라고 말했다. 지난해 12월부터 젬백스 의료사업본부장직을 수행했던 송형곤 사장은 ""현재 진행 중인 임상시험에 최선을 다해 국내 뿐 아니라 세계 시장에서도 그 효과를 인정받는 신약이 되도록 모든 노력을 다하겠다""고 했다. 이어 ""젬백스가 개발하려는 신약은 화학적 합성물질이 아닌 인체 유래의 펩타이드""라며 ""이미 진행 중인 차세대 펩타이드 신약후보물질 연구개발에도 노력을 하겠다""고 덧붙였다. 젬백스는 1989년 노르웨이에서 텔로머라아제에서 유래한 펩타이드 항암백신 연구개발을 위해 설립된 기업이다. 현재 반도체 관련 필터 제조와 펩타이드 신약을 개발 중이다. 2014년 췌장암 면역항암치료제 리아백스를 개발해, 국내 개발 21호 신약으로 조건부 판매허가를 받은 바 있다. 현재 리아백스는 국내에서 췌장암 3상 임상시험과 전립선 비대증에 대한 2상 임상시험을 동시에 진행 중이다."
매일경제,082270,/news/news_read.nhn?article_id=0004029916&office_id=009&mode=search&query=젬백스&page=1,2017-10-16 09:04,"젬백스 &quot;GV1001, 임상 2상서 전립선비대증 치료효과 확인&quot;","젬백스앤카엘은 신약 물질 'GV1001'의 전립선비대증 대상 임상 2상 결과 치료 효과가 확인됐다고 16일 밝혔다. GV1001은 젬백스가 자체 개발한 텔로머라아제(Telomerase)에서 유래한 펩타이드 조성물이다. 이번 임상 2상 시험은 기존 허가받은 췌장암과는 별개로 전립선비대증 치료 효과를 확인하기 위한 것이다. 2015년 8월부터 동국대 경주병원을 비롯해 국내 8개 의료기관에서 전립선비대증 환자 161명을 대상으로 시행했고 올해 6월 최종 보고서를 제출했다. 결과는 지난 12일 태국 치앙마이에서 개최된 아시아태평양 전립선학회(APPS)에서 공식 발표됐다. 발표에 따르면 GV1001을 투여한 환자군의 국제전립선증상점수(IPSS)가 위약 투여군 대비 낮아지는 등 전반적인 증상이 개선돼 치료제로서의 가능성을 보였다. 임상을 주관하는 이경섭 동국대 경주병원 비뇨기과 교수는 ""GV1001을 투여한 환자에게서 전립선의 용적이 위약 투여군 대비 유의하게 감소했다""며 ""소변을 배출하는 속도인 요속이 늘었고 잔뇨량은 줄었다""고 말했다. 송형곤 젬백스 대표는 ""이번 임상시험의 결과를 토대로 이른 시일 안에 국내 3상을 실시할 예정""이라며 ""대표적인 노인성 질환인 전립선비대증의 치료제 개발을 위해 전력을 다할 것""이라고 자신했다. [디지털뉴스국 이상규 기자] r_start // r_end //"
이데일리,082270,/news/news_read.nhn?article_id=0003897725&office_id=018&mode=search&query=젬백스&page=1,2017-08-14 14:40,"젬백스앤카엘, 경영진 자사주 6.6만주 장내매수&hellip;책임경영 표명",- GV1001 전립선비대증 치료제 국내 임상 3상 예정 [이데일리 이명철 기자] 젬백스(082270)앤카엘은 지난 11일 김기웅 사내 이사를 포함한 경영진이 자사주 6만6000주를 장내 매수했다고 밝혔다. 이번 매입으로 경영진은 총 17.93%의 지분을 보유하게 됐다. 이번 자사주 매입은 최근 주가가 과도한 하락세를 보인다는 판단에 자발적으로 이뤄졌다. 경영진으로서 주주가치를 높이고 책임경영에 동참하면서 향후 성장성에 대한 자신감도 보였다는 게 회사 설명이다. 송형곤 바이오사업부 사장은 “최근 GV1001의 전립선비대증 치료제로서의 가능성을 확인하는 국내 2상 임상시험을 완료했고 연내 국내 3상 임상시험을 개시할 예정”이라며 “새로운 치료 기전을 가진 알츠하이머병 치료제 개발을 목표로 국내 2상 임상시험을 개시해 이달 환자 모집을 시작할 것이고 알츠하이머병 글로벌 임상시험을 위한 준비도 차질 없이 진행 중”이라고 설명했다.
이데일리,082270,/news/news_read.nhn?article_id=0003677081&office_id=018&mode=search&query=젬백스&page=1,2016-11-15 16:00,"젬백스테크놀러지, 총 131억 규모 CB 발행",[이데일리 김기훈 기자] 젬백스테크놀러지(041590)는 운영자금을 마련하기 위해 총 131억원 규모의 무기명식 무보증 사모 전환사채(CB)를 발행하기로 했다고 15일 공시했다. 표면이자율과 만기이자율은 각각 4.0%이며 사채만기일은 2019년 11월15일이다.
파이낸셜뉴스,082270,/news/news_read.nhn?article_id=0003936474&office_id=014&mode=search&query=젬백스&page=1,2018-01-04 08:44,"젬백스테크놀러지, 유엠에너지 인수 'ESS' 사업 진출","젬백스테크놀러지가 ESS(에너지 저장장치) 사업에 진출한다. ESS사업은 문재인 정부의 탈원전 정책에 따라 대체 에너지 기반 수요가 크게 증가할 것으로 예상되는 분야다. 젬백스테크놀러지는 4일 에너지관리시스템(Energe Management System, EMS)를 기반으로 한 빙축열 시스템을 운영하는 유엠에너지를 인수한다고 밝혔다. 100% 지분을 인수하는 조건으로 금액은 240억원 규모다. 2014년 설립된 유엠에너지는 빙축열 시스템을 이용해 에너지를 절감시키는 사업을 진행하는 회사로, 국내 신세계, 이마트 등 에너지 사용이 많은 기업들이 주요 고객이며, 2016년 157억원의 매출을 기록했다. 최근 유엠에너지는 베트남 정부가 추진하고 있는 ESS(Energe Storage System, 에너지 저장장치)사업까지 진출이 확정되며, 신세계건설, 미래에셋대우 등과 민간 최초로 ESS펀드를 조성에 합의한 바 있다. ESS는 전력을 저장했다가 필요할 때 공급해 전력사용의 효율성을 높이는 시스템으로 태양광과 풍력에너지의 상용화에 핵심 역할을 하는 설비다. 한국경제경영연구원에 따르면, ESS 시장규모는 2016년 이후 매년 50%이상 성장을 예상하고 있으며, 10KW 이하의 주택용 시장의 성장은 95% 이상 확대될 것으로 전망하고 있다. 젬백스테크놀러지 관계자는 “이미 가시적인 성과를 보이고 있는 유엠에너지 인수를 통해, 손쉽게 ESS 사업에 진출할 수 있게 되었다” 며 “곧 양산을 앞두고 있는 자회사 디케이앤파트너스의 사물인터넷 기반의 생활가전 기술과 접목하여 주택용 에너지 사업에도 적극 활용할 계획”이라고 밝혔다. 에너지관리시스템과 IOT(사물인터넷)기술을 접목하여, 본사가 모든 고객의 에너지효율을 한곳에서 관리할 수 있도록 하겠다는 것이다. 한편, 젬백스테크놀러지는 LCD모듈 생산업체에서 지난해 필링크와 크리스F&C를 인수하여 사업다각화에 대한 긍정적인 평가를 받고 있으며, 최근 자회사 디케이앤파트너스는 사물인터넷 기반의 생활가전을 선보이고 있다."
서울경제,082270,/news/news_read.nhn?article_id=0003032158&office_id=011&mode=search&query=젬백스&page=1,2017-05-15 09:42,"젬백스앤카엘 췌장암 치료제, 전립선비대증 임상 2상 성공","[서울경제] 젬백스(082270)앤카엘은 최장암 치료제 ‘GV1001’이 전립선비대증에 대한 임상 2상에 성공했다고 15일 밝혔다. 이번 임상은 분당서울대병원, 세브란스병원, 중앙대병원 등 8개 병원에서 총 161명의 전립선비대증 환자를 대상으로 12주에 걸쳐 진행됐으며 추적 관찰까지 성공적으로 마쳤다. 구체적인 임상시험 결과는 국제학회 등을 통해 발표할 예정이다. GV1001은 젬백스앤카엘이 독자 개발한 텔로머라아제 성분의 펩타이드 조성물로 국내에서는 앞서 췌장암 치료제로 허가받았다. 송형곤 젬백스앤카엘 바이오사업부문 사장은 “이번 임상시험 결과를 토대로 연내에 국내에서 임상 3상을 개시하고 글로벌 임상시험 역시 이른 시일 내에 시작할 것”이라며 “노인층의 건강과 삶의 질 향상을 위한 전립선비대증 치료제 개발에 최선을 다하겠다”고 말했다."
머니투데이,082270,/news/news_read.nhn?article_id=0003705504&office_id=008&mode=search&query=젬백스&page=1,2016-07-04 08:48,"젬백스, 바이오 전문기업으로 도약 위한 전열 재정비","[머니투데이 김건우 기자] [의대교수 출신 연구소장·사장 영입 “바이오업계 선도기업으로 거듭날 것”] 젬백스앤카엘이 4일 바이오사업부문 사장과 연구소장에 의과대학 교수 출신을 전면 배치하고 전문 바이오기업으로 탈바꿈을 시작한다고 밝혔다. 젬백스앤카엘은 지난 1일자로 젬백스 중앙연구소장에 문찬일 박사, 바이오사업부문 사장에 송형곤 박사를 임명한다고 밝혔다. 문찬일 젬백스 신임연구소장  젬백스앤카엘은 1989년 노르웨이에서 텔로머라아제에서 유래한 펩타이드 항암백신 연구개발을 위해 설립된 기업으로, 현재는 반도체 관련 필터 제조와 펩타이드 신약을 개발 중이다. 특히 지난 2014년는 췌장암 면역항암치료제 리아백스를 개발해, 국내 개발 21호 신약으로 조건부 판매허가를 받은 바 있다. 현재 리아백스는 국내에서 췌장암 3상 임상시험과, 전립선 비대증에 대한 2상 임상시험을 동시에 진행 중이다. 문찬일 박사는 “펩타이드를 이용한 신약 개발 뿐 아니라 줄기세포치료제 개발과 삼성제약의 연구개발 부문에도 연구 역량을 투입할 계획이며 젬백스 전 계열사의 연구 분야를 총괄하여 통합적인 R&D(연구개발) 업무를 수행할 것”이라고 말했다. 송형곤 젬백스 사장  지난해 12월부터 젬백스 의료사업본부장직을 수행하던 송형곤 사장은 ""현재 진행 중 인 임상시험에 최선을 다하여 국내 뿐 아니라 글로벌 시장에서도 그 효과를 인정받는 신약이 되도록 모든 노력을 다하겠다""고 전했다. 송 사장은 ""젬백스가 개발하려는 신약은 ‘화학적 합성물질’이 아닌 ‘인체 유래의 펩타이드’라며 이미 진행 중인 차세대 펩타이드 파이프라인에 대한 연구 개발에도 배전의 노력을 다하겠다""고 다짐했다. 한편 문찬일 소장은 한양대학교 의과대학 세포치료센터 연구교수를 역임한 순환기 내과 전문의이며, 송형곤 사장은 응급의학과 전문의로 제 37대 대한의사협회 집행부에서 상근부회장을 역임했다. textlinktopstart textlinktopend textlinkstart"
서울경제,082270,/news/news_read.nhn?article_id=0002744292&office_id=011&mode=search&query=젬백스&page=1,2015-09-29 17:10,"김상재 젬백스 대표 &quot;중국 유통망 확보, 본격 성장 계기 될 것&quot;","中 최대 제약유통사와 협약… 7년간 1000억 들여 개발한 췌장암 치료 백신 현지 판매… 1~2년내 투자금 회수 기대 김상재(사진) 젬백스&카엘(이하 젬백스) 대표는 요즘 한국과 중국을 오가느라 정신이 없다. 최근에는 중국 베이징 인민대회장에서 진행된 화련젬백스와 화련신광의 업무협약식에 참석했다. 화련신광은 중국 국영 유통그룹인 화련의 중국 내 모든 유통채널에 대한 브랜드 운영권을 가진 회사로 올해 7월 젬백스와 50대 50으로 출자해 합작법인 화련젬백스를 출범시켰다. 화련젬백스는 중국에서 ‘화련’ 상호를 사용하는 모든 백화점과 마트, 온라인몰에 대한 유통을 담당한다. 김 대표는 화련젬백스를 통해 삼성제약(젬백스가 2014년 인수) 등 자회사에서 제조하는 바이오·의약 제품을 중국 시장에 판매할 계획이다. 또  중국 진출을 원하는 국내 기업들의 제품들도 화련젬백스를 통해 중국 시장에 유통되도록 도울 계획이다. 이미 서울우유, 농협중앙회, 롯데제과 등의 기업과 기관들이 화련젬백스와 업무 협약을 맺은 상태다. 김 대표는 지난 25일 경기도 성남시 젬백스 판교 사옥에서 서울경제신문 취재진과 만나 “바이오 기업의 경우 제품개발과 생산 못지않게 유통망 확보가 중요한 데 화련젬백스를 통해 중국 판로를 확보하게 됐다”며 “국내 일반 기업의 제품도 화련젬백스를 통해 중국에 유통된다면 유통사업에서 매출이 발생해 젬백스의 실적도 개선될 것”이라고 밝혔다. 젬백스는 그 동안 안정적인 매출 기반을 마련하기 위해 중국 유통망 확보에 공을 들여왔다. 그 결과 중국에 합작법인인 화련젬백스를 설립했으며 이달에는 중국의 최대 제약 유통그룹인 구주통의약그룹유한회사와 전략적 업무협약을 체결하기도 했다. 구주통의약그룹은 80여개의 대형 물류센터를 기반으로 연간 매출 7조원을 올리는 업체다. 젬백스는 구주통의약그룹의 유통망을 통해 직접 개발한 췌장암 치료백신인 리아백스를 중국 시장에서 판매할 예정이다. 리아백스는 지난해 9월 식품의약품안전처가 허가한 항암 치료제로 췌장암 환자의 생존기간을 늘리고 고통을 줄이는 효과가 있는 것으로 알려져 있다. 최근에는 리아백스가 전립선질환 치료에도 효과가 있는 것으로 밝혀져 젬백스는 이 점을 적극 알리고 있다. 김 대표는 “중국의 전립선 환자가 1억명이 넘는 것으로 알려지면서 구주통의약그룹이 리아백스에 적극적인 관심을 보였다”며 “10월 중순 구주통의약그룹이 최종 실사에 나설 예정이며 올해 말 정도에 라이선스 계약이 체결될 것”이라고 말했다. 이어 “2008년 이후 리아백스 개발에 약 1,000억원을 투자했는데 중국 시장에서 본격적으로 판매되면 1~2년안에 투자금을 회수할 수 있을 것”이라고 덧붙였다. 전문가들도 중국 유통망 확보를 통해 새로운 성장스토리를 써나가는 젬백스에 긍정적인 평가를 내리고 있다. 노경철 SK증권 연구원은 “젬백스는 중국내 합작법인 설립과 중국 최대 제약 유통그룹과의 사업 제휴 등을 통해 성장을 위한 적극적인 행보를 보이고 있다”며 “내년 하반기에는 눈에 띄는 성장세를 확인할 수 있을 것”이라고 분석했다. 김 대표는 “젬백스는 어음도 없고 보유 현금과 주식, 부동산까지 합하면 유동자산이 2,000억원이 넘는 안정적인 회사”라며 “중국 시장 진출로 발생한 이익을 추가 신약 개발에 지속적으로 투자할 계획”이라고 말했다."
연합뉴스,082270,/news/news_read.nhn?article_id=0009971148&office_id=001&mode=search&query=젬백스&page=1,2018-03-21 09:15,"젬백스 &quot;'GV1001' 전립선비대증 연구, 유럽서 우수 논문&quot;","(서울=연합뉴스) 김잔디 기자 = 젬백스앤카엘은 지난 16일부터 덴마크 코펜하겐에서 열린 유럽비뇨기과학회(EAU) 학술대회에서 'GV1001'의 전립선비대증 치료 효과를 밝힌 연구가 우수 논문에 선정됐다고 21일 밝혔다. GV1001은 젬백스가 자체 개발한 텔로머라아제(telomerase) 유래 펩타이드 조성물이다. 국내에서는 췌장암 치료제로 조건부 허가받았다. 젬백스는 GV1001의 치료 범위를 확대하기 위한 다양한 연구를 진행 중이다. 전립선비대증도 그중 하나다. 이번 논문은 동국대 경주병원 이경섭 비뇨의학과 교수가 양성전립선비대증 환자를 대상으로 GV1001의 유효성 및 안전성을 확인한 임상 2상 연구다. 연구에 따르면 GV1001을 투여한 환자군의 국제전립선증상점수(IPSS)가 위약 투여군 대비 낮아지는 등 전반적인 증상이 개선돼 치료제로서의 가능성을 보였다. 빈뇨, 잔뇨감 등 전립선 관련 증상을 수치화한 국제전립선증상점수는 전립선비대증 치료제 효과를 평가할 때 사용하는 도구다. 점수가 높을수록 질환의 정도가 심하다. 젬백스는 ""학회에서 발표된 1천220개의 논문 중 객관적인 심사를 거쳐 우수 논문으로 선정됐다""며, ""미국비뇨기과학회와 더불어 비뇨의학에서 최고 권위를 인정받는 유럽 비뇨기과학회에서 성과를 인정받았다는 데 의미가 있다""고 강조했다."
