source,symbol,link,date,title,content
한국경제TV,082270,/news/news_read.nhn?article_id=0000622012&office_id=215&mode=search&query=젬백스&page=1,2018-04-13 11:08,"젬백스, 전일 대비 약 6% 상승한 20,450원","[한국경제TV 라이온봇 기자] 젬백스는 4월 13일 11시 6분 전일 대비 약 6% 상승한 20,450원에 거래되고 있다. 젬백스는 코스닥 상장 기업으로 기계,장비 업종에 속해 있다. 시가총액은 6,050억원으로 코스닥 상장기업 중 83위에 위치 해 있다. [종목 성향 진단] [그림 1] 종목 성향 진단 젬백스의 투자 스타일은 성장주에 가깝다. 주가 고평가 우려가 공존하지만 높은 성장성이 기대되는 기업이다. 주가 모멘텀은 좋은 편에 속했다. 최근 6개월 수익률은 73.09%의 상승폭을 기록했다. 최근 1개월 수익률 또한 18.77% 상승하며 좋은 모멘텀을 보이고 있다. 젬백스 종목에 대한 투자자의 관심도는 굉장히 높은 편이다. [투자 점수 진단] [그림 2] 투자 점수 진단 젬백스는 성장성(매출증가율(YoY)) 측면에서 두각을 나타내고 있다. 최근 매출증가율(YoY)은 92점으로 6개의 핵심 팩터 중 가장 높은 점수를 기록했다. 매출증가율(YoY)은  전체 시장 내 150위를 기록하며 상위 8.22%에 위치했다. 업종별로는 53위를 기록하며 상위 9.89%에 위치했다. 그리고 수익성(영업이익률) 역시 도드라지는 편이다. 수익성 점수는 88점으로 두번째로 높은 점수를 기록했다. 영업이익률은 전체 시장 내 236위를 기록하며 상위 12.04%에 위치했다. 업종별로는 107위를 기록하며 상위 18.12%에 위치했다. 그러나 PBR과 ROA는  아쉬움을 나타냈다. [종합 투자점수] [그림 3] 종합 투자점수 AI 인공지능 분석을 통한 젬백스의 종목 종합 스코어는 49점을 기록했다. 이는 동일 업종 평균점수인 56점과 시장 평균점수인 56점를 하회하는 수치였다. (위의 AI인공지능 점수는 재무 데이터를 기반으로 전체 상장 종목과 비교/분석하여 도출한 점수로 높은 점수가 반드시 높은 수익률을 보장하지 않습니다. 위의 자료는 당사의 추천 종목이 아니며, 투자 시 참고용으로 제시해드리는 것입니다.) 라이온봇 기자 -한국경제TV※ 본 기사는 한국경제TV와 '거장들의 투자공식이'자체 개발한 '라이온봇 기자'가 실시간으로 작성한 기사입니다. 라이온봇기자 ⓒ 한국경제TV, 무단 전재 및 재배포 금지 한국경제TV 관련뉴스해당 언론사에서 선정하며 언론사 페이지(아웃링크)로 이동해 볼 수 있습니다.'억대 수입' 이사배, 과거 공개한 '럭셔리' 하우스 봤더니""자연미인"" 셋째 출산에도 여전히 아름다운 '리설주'쏘가리 가격 '확' 떨어진다…22년 연구 끝에 '대량양식' 성공스타일난다, 4천억 '신화'…김소희 대표 누구?고 장자연-단역 자매 사건 재수사…""내가 노리개인가"""
파이낸셜뉴스,082270,/news/news_read.nhn?article_id=0003795335&office_id=014&mode=search&query=젬백스&page=1,2017-03-29 11:21,[fnRASSI]젬백스테크놀러지 전일대비 6.06% 상승,"젬백스테크놀러지(041590)는 현재 주가가 전일 대비 6.06% 상승한 3,765원 선에서 거래가 이루어지고 있다. 개인,외국인 투자자만 매매에 참여 최근 한달간 주체별 거래비중을 살펴보면 개인 비중이 92.82%로 가장 높았고, 외국인이 7.17%로 그 뒤를 이었다. 기관은 거래에 참여하지 않은 것으로 보인다. 그리고 최근 5일간 거래비중은 개인이 94.61%, 외국인이 5.38%를 보였고, 기관은 거래참여가 없었다.                   지표               항목               값               종합점수                 성장성               매출액증가율               -0.4               0.85                 자기자본증가율               -0.21                 안정성               부채비율               204.54               3.97                 유동비율               42.46                 이익안정성               5.56                 수익성               ROA               -17.86               0.56                 ROE               -54.4                 영업이익율               -14.06          젬백스테크놀러지의 퀀트 재무 점수는 5.38점으로 지난 분기에 비해 성장성 점수가 하락했다. 이는 매출액 증가율이 감소하였기 때문이다. 실적 안정성이 악화되어 안정성 종합 점수는 하락했다. 수익성 측면에서 볼때 ROA, ROE가 하락하여 이전보다 낮은 점수를 받았다. 'fnRASSI'는 증권전문 기업 씽크풀과 파이낸셜뉴스의 협업으로 로봇기자가 실시간으로 생산하는 기사입니다."
머니투데이,082270,/news/news_read.nhn?article_id=0004038344&office_id=008&mode=search&query=젬백스&page=1,2018-04-16 09:18,"젬백스, 신약 파이프라인 재부각 &quot;임상재개로 주가 회복&quot;","[머니투데이 김건우 기자] KTB투자증권은 젬백스가 하반기 전립선비대 국내 임상 3상 진입 및 알츠하이머 미국 임상 2상 진입으로 신약가치 상승이 예상된다고 16일 밝혔다. 투자의견과 목표주가는 밝히지 않았다. 이혜린 KTB투자증권 연구원은 ""젬백스는 GV1001 췌장암 영국 임상 3상 결과 발표에 대한 기대가 컸던 2013년 최고가 5만원 내외를 기록 했다""며 ""중단되었던 임상 재개로 주가 회복이 예상된다""고 말했다. 젬백스는 췌장암과전립선비대증 치료제, 알츠하이머 치료제를 파이프라인으로 갖고 있다. 이 연구원은 ""국내 임상 3상 진행 중인 전이성 췌장암 치료제는 연내 종료가 예상되고, 전립선비대증 치료제도 국내 임상 2상 완료 뒤 연내 임상 3상 진입 예정이다""고 말했다. 그는 ""전립선비대증 치료제는 신약 출시 부재로 글로벌 시장이 2017년 29억 달러에서 2023년 23억 달러 규모로 성장할 것""이라며 ""알츠하이머 치료제도 국내 임상 2상 진행 중으로, 연내 미국 2상 IND 신청 계획""이라고 설명했다. 이 연구원은 ""알츠하이머 치료제는 2020년 이후 신약 출시가 본격화되면서 매출이 급성장이 예상된다""며 ""전임상, 임상 1단계에서 글로벌 딜(계약)이 평균 10억 달러 이상에 거래되고 있다""고 덧붙였다."
아시아경제,082270,/news/news_read.nhn?article_id=0003684361&office_id=277&mode=search&query=젬백스&page=1,2016-02-11 08:28,"젬백스 췌장암 치료제, C형 간염 억제 효과 국제 학술지 게재","[아시아경제 이정민 기자] 젬백스앤카엘은 11일 췌장암의 면역치료제로 판매허가를 받은 GV1001(상품명 리아백스)이 C형 간염 바이러스(HCV)에 대한 항바이러스 효과가 있다는 내용의 논문이 국제학술지에 게재 승인됐다고 밝혔다. 이번 논문은 미국 의과학학술지인 '생화학,생물리학 연구학회지'에 게재 승인됐다. HCV로 감염된 세포에 GV1001을 처리한 결과, GV1001이 HCV 복제효소 복합체 형성을 직접적으로 억제하여 HCV RNA의 증식을 억제함을 규명했다. 바이러스성 간염은 원인 바이러스의 종류에 따라 7가지로 분류되는데, C형 간염은 HCV에 감염된 혈액을 매개로 전파되는 질병이다. 대한간학회에 따르면 C형 간염 환자의 일부는 20~25년 내 간경변으로 악화되며, 비감염자보다 간염 사망률이 21배 이상 높다. HCV는 RNA 바이러스의 일종으로 초기 감염시 증상이 없고, 약 55~85%의 환자는 만성 간염으로 진행된다. C형 간염 바이러스 보균자는 세계적으로 약 1억8000만명이 분포하고 있는 것으로 알려져 있다. 송형곤 젬백스 의료사업본부장은 ""이번 논문은 GV1001의 항암 기전 외에 항바이러스제로서의 역할을 새롭게 규명할 수 있는 학문적 성과""라며 ""C형 간염 바이러스 뿐 아니라 앞으로 RNA 유전체를 기반으로 하는 다른 종류의 바이러스의 증식 억제에도 적용할 수 있을 것""이라고 말했다."
한국경제,082270,/news/news_read.nhn?article_id=0003538764&office_id=015&mode=search&query=젬백스&page=1,2016-02-03 17:35,"젬백스, 구주통과 계약 종결 합의","[ 한민수 기자  ] 젬백스&카엘은 구주통의약그룹유한회사와 지난해 11월에 체결했던 계약을 종결하기로 합의했다고 3일 밝혔다. 이번 합의는 중국의 환경 변화로 인해 구주통의 장기적 경영정책이 바뀌었기 때문이란 설명이다. 최근 국내총생산(GDP) 성장률, 투자, 소비, 산업생산 등 중국의 경제 실물지표가 예상치를 밑돌고, 금융시장이 불안정한 모습을 보이는 등 중국 경제에 대한 위기감이 확산되고 있는 현실이 반영됐다고 회사 측은 전했다. 다만 앞으로 구주통의 여건을 고려해 젬백스의 'GV1001', 삼성제약의 의약품, 의약외품, 건강식품 등에 대한 중국 판권 이전 노력을 이어가기로 했다. 상호간 전략적 우호 관계도 유지된다. 젬백스 관계자는 ""구주통의 진심 어린 결정에 존중을 표한다""며 ""비록 지난 11월 계약은 종결되지만 구주통과의 우호관계는 지속되며, 또 다른 파트너를 찾는 노력을 병행할 것""이라고 말했다. 젬백스는 지난해 11월5일 구주통과 GV1001의 중국 독점판매권 이전, 삼성제약 제품의 중국 판권 이전, 상호 기술 및 자금 투자 등을 골자로 하는 계약을 체결한 바 있다. 한민수 한경닷컴 기자"
헤럴드경제,082270,/news/news_read.nhn?article_id=0000987747&office_id=016&mode=search&query=젬백스&page=1,2016-02-04 09:44,&lt;생생코스닥&gt; 젬백스 급락세&hellip; 中 업체와 계약 해지,[헤럴드경제=홍석희 기자] 젬백스가 급락세다. 중국 거래처 구주통의약그룹유한공사와의 계약이 해지됐다는 소식 탓으로 해석된다. 젬백스는 4일 오전 9시40분 현재 전거래일 대비 11.92% 급락한 1만8750원에 거래되고 있다. 젬백스는 전날 장 마감 후 지난해 11월5일 구주통의약그룹유한공사와 체결한 공급계약이 해지됐다고 공시했다. 회사측은 “구주통이 중국 내 시장 상황과여건 등 외부 환경의 변화로 인해 장기적 경영정책을 바꿨다”고 계약해지 이유를 밝혔다.
서울경제,082270,/news/news_read.nhn?article_id=0002766013&office_id=011&mode=search&query=젬백스&page=1,2015-11-24 10:31,"젬백스테크놀러지, 성장성 높은 사업군 확보","유안타증권은 젬백스테크놀러지(041590)에 대해 ""특히 중국 정부가 식품 안전 및 개선 정책을 강화하고 최근 산모들에게 영유아식은 부족한 칼로리나 영양을 보충해 준다는 인식이 확산됨에 따라 중국 영유아식 시장은 13년 7.4억 달러에서 18년 약 15억 달러로 연평균 20% 이상의 고성장이 예상된다""라고 분석했다. 또한 유안타증권은 ""국내 영유아 식품 회사인 ㈜미즈앤코를 인수하여 중국 베이인메이와 수출 협약을 체결하면서 중국 시장 진출 교두보를 마련. 더불어, 스웨던 바이오기업 노바헵(NovaHep) 인수를 통한 바이오 사업 (재생의학, 조직공학, 줄기세포) 진출은 동사 밸류에이션을 한단계 격상시켜 줄 것으로 기대된다""라고 밝혔다. 한편 ""15년 LCD 모듈 감소 및 신규 사업 진출에 따른 실적 저하는 불가피해 보이나 향후 성장성이 높은 사업군을 확보했다라는 점이 긍정적. 16년 실적은 매출액 981억원(+134%, YoY), 영업이익 132억원(흑전, YoY), 순이익 106억원(흑전, YoY)으로 예상된다""라고 전망했다. 24일 현재 젬백스테크놀러지의 주가는 전일대비 마이너스권에서 거래되고 있다. ▷ TFT-LCD부품 섹터"
서울경제,082270,/news/news_read.nhn?article_id=0002945033&office_id=011&mode=search&query=젬백스&page=1,2016-12-27 12:53,"젬백스카엘, 전립선 비대증 관련 특허 취득",젬백스카엘은 전립선 비대증 치료 및 예방용 조성물에 관련한 특허를 취득했다고 27일 공시했다. 이번 특허는 전립선 비대증 치료 및 예방을 위한 조성물 및 이를 사용한 전립선 비대증 치료방법에 관한 것이다.
한국경제TV,082270,/news/news_read.nhn?article_id=0000537997&office_id=215&mode=search&query=젬백스&page=1,2017-03-27 09:07,"젬백스앤카엘, 글로벌 임상대행기관과 임상대행 계약","[한국경제TV 양재준 기자] 젬백스앤카엘이 글로벌 임상시험수탁기관(CRO)인 파렉셀과 알츠하이머성 치료 후보물질에 대한 글로벌 임상시험 계약을 체결했습니다. 이번 협약을 통해 젬백스는 미국내 알츠하이머병 임상시험 허가(FDA-IND)를 위한 임상시험 계획과 운영,평가에 대한 포괄적이고 전문적인 지원을 받게 됩니다. 젬백스는 그동안 췌장암 치료제인 '리아벡스(주)'의 물질인 'GV1001'이 여러가지 기전을 통해 알츠하이머병에 대한 치료효과를 확인하고 국내뿐 아니라 글로벌 임상시험을 준비해 왔습니다. 이에 앞서 젬백스는 (재)범부처신약개발사업단의 연구지원 협약을 통해 치료기전에 대한 과학적 근거를 확보하고 지난 달 베터사와 글로벌임상시험용 의약품생산을 위한 계약을 체결한 바 있습니다. 송형곤 젬백스 사장은 ""이번 파렉셀과의 업무협약은 2018년초 미국내 임상시험계획승인(FDA IND)을 위한 단계적인 준비""라며 ""알츠하이머병 치료 후보물질의 글로벌 임상시험을 성공적으로 완수하기 위해 최선을 다하겠다""고 말했습니다."
한국경제,082270,/news/news_read.nhn?article_id=0003430886&office_id=015&mode=search&query=젬백스&page=1,2015-09-15 10:22,"젬백스, 인플루엔자 백신 유럽 특허 확보","[ 한민수 기자  ] 젬백스는 인플루엔자 백신에 대해 유럽 특허를 취득했다고 15일 밝혔다. 유럽특허청(EPO)은 이번 인플루엔자 백신 발명에 대해 지난 7월 특허 등록공고를 했으며, 최근 젬백스는 유럽 8개국에 대해서 번역문 제출 등의 국가별 등록절차를 완료했다. 국가별 등록절차를 밟음으로써 인플루엔자 유럽 특허에 대한 효력을 해당 유럽 국가에서 인정받고, 특허 권리를 행사할 수 있게 된다는 설명이다. 이번 인플루엔자 백신 특허는 젬백스의 자회사인 에피뮨이 보유하고 있는 인플루엔자 DNA 백신 발명에 대한 특허다. 세포성 면역반응과 함께 체액성 면역반응을 증가시키는 에피토프(항원결정기)를 모두 포함하는 멀티 에피토프 백신이라고 회사는 전했다. 멀티 에피토프 백신은 다수의 에피토프를 하나의 백신으로 제공함으로써 다양한 바이러스 항원에 대한 면역력을 제공할 수 있다는 것이다. 이번 백신은 에피뮨에서 개발한 '파드레'라는 면역 기능을 강화시키는 기술을 접목해 한층 백신의 면역 기능을 증가시켰다. 인플루엔자 바이러스는 매해 다양한 변종이 생기고 있다. 때문에 인플루엔자 바이러스 변종으로 인해 광범위하게 대응할 수 있는 신규 인플루엔자 백신 개발에 대한 필요가 크다. 젬백스 관계자는 ""멀티 에피토프 백신은 다양하게 변하는 인플루엔자 바이러스에 폭넓게 대응할 수 있을 것으로 기대된다""며 ""향후 개발이 완료된다면 인플루엔자 치료에 유용한 역할을 할 수 있을 것""이라고 말했다. 한민수 한경닷컴 기자"
머니투데이,082270,/news/news_read.nhn?article_id=0003625297&office_id=008&mode=search&query=젬백스&page=1,2016-02-04 09:30,"[특징주]젬백스, 中 거래처와 계약 해지에 급락세","[머니투데이 백지수 기자] 젬백스가 급락세다. 중국 거래처인 구주통의약그룹유한공사와의 계약이 해지됐다는 소식이 영향을 미친 것으로 풀이된다. 젬백스는 4일 오전 9시29분 현재 전일 종가 대비 2350원(10.98%) 내린 1만9050원에 거래되고 있다. 젬백스는 전날 지난해 11월5일 구주통의약그룹유한공사와 체결한 공급계약이 해지됐다고 공시했다. 회사측은 ""구주통이 중국 내 시장 상황과 여건 등 외부 환경의 변화로 인해 장기적 경영정책을 바꿨다""고 계약해지 이유를 밝혔다. textlinktopstart textlinktopend textlinkstart"
