source,symbol,link,date,title,content
머니투데이,082270,/news/news_read.nhn?article_id=0003926219&office_id=008&mode=search&query=젬백스&page=1,2017-08-29 10:25,"젬백스앤카엘, 알츠하이머병 국내 임상 2상 개시","[머니투데이 민승기 기자] [메디데이터 통합데이터 솔루션 사용으로 효율 극대화] 젬백스, 항암백신 후보물질 GV1001 젬백스앤카엘은 알츠하이머병 환자에서 GV1001의 치료 효과를 검증하기 위한 국내 2상 임상시험 환자 모집을 시작한다고 29일 밝혔다. 이번 임상시험은 중등도 이상 알츠하이머병 환자에서 GV1001의 효과를 검증할 예정이며, 한양대학교 구리병원을 주관연구기관으로 고려대학교 안암병원, 이화여자대학교 목동병원, 인하대학교병원, 중앙보훈병원 등 총 5개 병원이 참여한다. 연구기간은IRB(Institutional Review Board; 임상시험심사위원회)의 승인일로부터 24개월이다. GV1001은 인간 텔로머라제역전사 효소(hTERT)에서 유래된 펩타이드로 16개의 아미노산으로 이루어져 있다. 텔로머라제는 염색체 말단에 존재하는 텔로미어의 길이를 유지시켜주는 기능을 한다. 텔로미어는 세포가 분열할 때마다 조금씩 짧아지게 되며 완전히 없어지면 더 이상 세포의 분열이 일어나지 않게 된다. 앞서 고성호 한양대 구리병원 교수는 중등도 이상의 치매를 가진 쥐에게 GV1001을 주사해 생존기간 연장 및 인지기능의 향상 효과를 확인한 바 있다. 이번 임상시험에서는 클라우드 기반 통합 데이터 플랫폼인 메디데이터 통합 솔루션도 활용된다. 젬백스앤카엘이 사용하게 될 메디데이터의 솔루션은 환자 무작위 배정, 시험약의 공급 및 관리를 지원하는 메디데이터 밸런스와 빠르고 정확한 임상 데이터 코딩을 위한 메디데이터코더, 임상 데이터의 수집, 관리 및 보고를 한번에 해결할 수 있는 전자자료수집(EDC) 솔루션인메디데이터레이브 등 세 가지이다. 통합 솔루션 사용으로 복잡한 과정을 가진 임상시험의 효율을 극대화할 수 있고 글로벌 임상에서 추가적인 가공 없이 임상 데이터를 사용할 수 있게됐다고 회사측은 설명했다. 송형곤 젬백스앤카엘바이오사업부 사장은 “중등도 이상 알츠하이머병 환자에게 아직까지 확실한 치료제가 없다”며 “세계 대형제약사들도 알츠하이머병 치료제 임상시험에 계속 실패하고 있고, 고령화사회에서 반드시 해결해야 할 질병 중 하나가 알츠하이머병임을 감안할 때 이번 임상시험이 가지는 의의는 매우 크다”고 말했다. 이어 “향후 젬백스앤카엘이 시행하게 될 주요 임상시험은 메디데이터의 통합 솔루션을 사용하게 될 것”이라며 “클라우드 기반의 통합 데이터 솔루션을 통해 국내 임상시험은 물론 글로벌 임상시험 성공을 위해 최선을 다하겠다”고 덧붙였다."
매일경제,082270,/news/news_read.nhn?article_id=0003940519&office_id=009&mode=search&query=젬백스&page=1,2017-05-15 08:28,"젬백스앤카엘, `GV1001`전립선비대증2상 임상시험 완료","젬백스앤카엘(대표이사 김상재)은 지난 12일 텔로머라제 유래 펩타이드 'GV1001'의 국내 양성전립선비대증 환자를 대상으로 한 2상 임상시험을 완료했다고 15일 밝혔다. 이에 앞서 젬백스는 GV1001의 전립선비대증 치료·예방을 위한 조성물에 대해 2016년 12월 국내 특허권을 취득했고 올해 1월 미국 특허권을 취득했다. 이번 임상시험은 동국대학교 경주병원, 계명대학교 동산의료원, 분당서울대학교병원, 을지대학교 을지병원, 연세대학교 의과대학 세브란스병원, 인제대학교 부산백병원, 중앙대학교병원, 한양대학교 구리병원에서 총 161명의 양성전립선비대증 환자를 대상으로 진행했다. 3개월의 투약기간 동안 GV1001을 피내투여해 안전성·임상적 유효성을 검증하는 시험으로 GV1001을 12주간 투여하고 추적관찰기간을 이행한 결과, 임상시험용 의약품과 관련된 중대한 이상반응이 발견되지 않았다. 또한 이번 임상시험의 결과는 향후 국제학회에서 발표될 예정이다. 젬백스앤카엘 바이오사업부문 송형곤 사장은 ""이번 임상시험 결과를 토대로 연내에 국내 3상 임상시험을 개시하고 글로벌 임상시험 역시 빠른 시일 내에 시작할 것""이라고 말했다. [디지털뉴스국 이상규 기자] r_start // r_end //"
서울경제,082270,/news/news_read.nhn?article_id=0003217235&office_id=011&mode=search&query=젬백스&page=1,2018-02-07 13:12,"(코)젬백스, 전일 대비 7.12% 상승.. 일일회전율은 4.00% 기록","[서울경제] 젬백스(082270) 는 7일 오후 1시 8분 현재 7.12% 오른 16,550원에 거래되고 있으며, 45(매도):55(매수)의 매수우위를 기록하고 있다. 거래대금은 193억8,084만, 거래량은 123만696주로 거래량회전율은 4.00%로 나타났다. 지난 1개월간 젬백스는 상승 19회, 하락 11회를 기록했고, 주가수익률은 12.97% 표준편차는 3.57%를 기록했다. 이 기간 ' 기계·장비업 ' 업종 평균 주가수익률은 6.64%로 나타났으며, 변동성은 1.33%를 기록했다. 이 시각 현재 ' 기계·장비업 '은 2.28% 상승 중이며, 48(매도):52(매수)의 매수우위를 기록하고 있다."
한국경제TV,082270,/news/news_read.nhn?article_id=0000556114&office_id=215&mode=search&query=젬백스&page=1,2017-06-15 15:29,"젬백스테크 &quot;스웨덴 자회사, 정부 연구지원금 30억 획득&quot;","[한국경제TV 김치형 기자] 젬백스테크놀러지(대표이사 김상재)는 스웨덴 자회사인 노바헵(NovaHep AB, 대표이사:PetterBj?rquist)이 유럽연합(EU) 'Horizon 2020 SME instrument' 프로그램과 스웨덴 당국의 'Swelife'프로그램에서 총 30억 2천만원 (2,328,341유로)의 연구 지원금을 획득했다고 16일 밝혔습니다. 노바헵은 조직공학기술을 통해 생체적합성 극대화 환자맞춤형 혈관을 연구 및 개발하고, 재생의학 분야에서 독점기술을 보유한 스웨덴 기업으로, 지난 2015년 젬백스테크놀러지에 인수됐습니다. 지난해에도 이들은 과학적 우수성, 비즈니스 혁신성을 인정받아 260,000 유로(한화 3억 4천만원)규모의 마리퀴리 연구지원금 획득한바 있습니다. 'Horizon 2020 SME instrument'는 유럽연합이 2014년부터 2020년까지 약 7년간 800억 유로의 연구비를 지원하는 연구지원 혁신프로그램의 일환으로 혁신성이 높은 중소기업의 기술 상업화를 지원하고 성장을 도모하는 프로그램입니다. 총 1,222개의 신청 기업 중 69개의 기업이 선정되었으며, 노바헵은 15점 중 총 13.34의 점수를 받아 최종 선정돼 향후 2년간 총 2,184,604 유로(한화 28억 3천만원)를 지원 받아, 환자맞춤형 재생혈관 (P-TEV: personalized tissue-engineered vein)의 만성정맥부전 I/II상 임상시험 및 GMP 생산을 진행하게 됩니다. 'Swelife'는 스웨덴 정부산하 기술혁신청비노바(Vinnova) 및 스웨덴 지역당국 VGR(V?straG?talandsRegionen)가 지원하는 국가 전략 혁신 프로그램으로, 연구기관, 대학, 기업 등이 조직의 경계를 넘어 지역간의 협력을 통해 생명과학 및 보건 분야에서 실질적인 성과를 도출하도록 지원하는 프로그램입니다. 이 프로그램을 통해 노바헵은 총 1,400,000 크로나(한화 1억 8천만원) 규모의 연구지원금을 받아 심혈관계 질환 치료제 개발을 위한 개념입증연구(Proof-of-concept)도 진행하게 됩니다. 송형곤 젬백스그룹 경영기획실장은 ""이번 연구지원금 획득으로 노바헵이 가진 기술의 혁신성을 인정받은 계기가 되었다""라며 ""노바헵의 환자맞춤형 재생혈관의 연구개발 및 임상에 최선을 다할 것""이라고 밝혔습니다. 또 ""이미 진행중인 췌장암 3상 임상시험과 전립선비대증 및 알츠하이머병 치료제 개발뿐 아니라 재생의학분야의 기초연구에도 그룹의 역량을 집중하여 젬백스 그룹이 명실상부한 바이오그룹으로 자리매김할 수 있도록 노력하겠다""고 덧붙였습니다."
한국경제,082270,/news/news_read.nhn?article_id=0003815891&office_id=015&mode=search&query=젬백스&page=1,2017-08-29 13:57,"젬백스앤카엘, 알츠하이머병 국내 임상2상 개시","젬백스앤카엘은 알츠하이머병 환자에서 'GV1001'의 치료 효과를 검증하기 위한 국내 2상 임상시험의 환자 모집이 시작됐다고 29일 밝혔다. 이번 임상의 참여 기관은 한양대학교 구리병원을 주관 연구기관으로 고려대학교 안암병원, 이화여자대학교 목동병원, 인하대학교병원, 중앙보훈병원 등 총 5개다. 연구기간은 임상시험심사위원회(IRB)의 승인일로부터 24개월이다. GV1001은 인간 텔로머라제 역전사 효소(hTERT)에서 유래된 펩타이드다. 이번 임상의 연구책임자인 고성호 교수는 중등도 이상의 치매를 가진 쥐에게 GV1001을 주사하해 생존기간 연장 및 인지기능의 향상 효과를 확인한 바 있다. 송형곤 젬백스앤카엘 바이오사업부 사장은 ""중등도 이상의 알츠하이머병 환자에게 아직까지 확실한 치료제가 없다""며 ""GV1001의 전임상 자료에 의하면 이번 임상의 성공이 기대된다""고 말했다."
이데일리,082270,/news/news_read.nhn?article_id=0004029177&office_id=018&mode=search&query=젬백스&page=1,2018-02-07 13:26,"[특징주]젬백스테크, IoT 기술 앞세워 中 미세먼지 시장 진출 &uarr;","[이데일리 박형수 기자] 젬백스테크놀러지(041590)가 강세다. 중국 장수치안그룹의 자회사 장수언비터블라디에어터와 사물인터넷(IoT) 기반 스마트 에어케어 제품 개발 사업 본계약을 체결했다는 소식이 주가에 영향을 준 것으로 보인다. 7일 오후 1시23분 젬백스테크놀러지는 전날보다 3.6% 오른 4320원에 거래되고 있다. 앞서 젬백스테크놀러지는 지난해 11월 중국 장수치안그룹과 공동사업 양해각서를 체결했다. 본계약을 통해 젬백스테크놀러지는 에너지저장장치(ESS) 기반 빌트인 타입 라디에이터를 개발하고 장수언비터블라디에이터사가 제품 양산과 글로벌 유통을 담당하게 된다. 본계약을 시작으로 IoT 기반 실내 공기질 측정기, 공조기, 가습기, 디퓨저 등 다양한 제품 라인업을 확보해 사업 영역을 확대할 계획이다. 정대근 IoT 신사업 담당 이사는 “제품 기획과 개발 능력을 인정받아 안정적 사업 기반을 확보했다”며 “연간 3만대 정도로 예상되는 판매에서도 높은 로열티를 보장받아 향후 500만달러(약 54억원) 정도 매출을 올릴 것”이라고 기대했다."
한국경제TV,082270,/news/news_read.nhn?article_id=0000607723&office_id=215&mode=search&query=젬백스&page=1,2018-03-05 10:08,"젬백스, 전일 대비 약 -4% 하락한 14,050원","[한국경제TV 라이온봇 기자] 젬백스는 3월 5일 10시 7분 전일 대비 약 -4% 하락한 14,050원에 거래되고 있다. 젬백스는 코스닥 상장 기업으로 기계,장비 업종에 속해 있다. 시가총액은 4,671억원으로 코스닥 상장기업 중 105위에 위치 해 있다. [종목 성향 진단] [그림 1] 종목 성향 진단 젬백스의 투자 스타일은 성장주에 가깝다. 주가 고평가 우려가 공존하지만 높은 성장성이 기대되는 기업이다. 주가 모멘텀은 부진한 편이었다. 최근 1개월 수익률은 -4.43%의 하락폭을 기록했다. 젬백스 종목에 대한 투자자의 관심도는 높은 편에 속한다. [투자 점수 진단] [그림 2] 투자 점수 진단 젬백스는 각 재무지표를 전체 상장종목과 비교하여 점수화 했을 때, 대부분 지표에서 시장과 업종 대비 아쉬움을 나타냈다. 부채비율 점수에서 장점을 드러냈으나, 전체시장을 대비 상대적으로 낮은 수치였다. 또한, 매출증가율(YoY)과 PBR은  아쉬움을 나타냈다. [종합 투자점수] [그림 3] 종합 투자점수 AI 인공지능 분석을 통한 젬백스의 종목 종합 스코어는 23점을 기록했다. 이는 동일 업종 평균점수인 57점과 시장 평균점수인 57점를 하회하는 수치였다. (위의 AI인공지능 점수는 재무 데이터를 기반으로 전체 상장 종목과 비교/분석하여 도출한 점수로 높은 점수가 반드시 높은 수익률을 보장하지 않습니다. 위의 자료는 당사의 추천 종목이 아니며, 투자 시 참고용으로 제시해드리는 것입니다.) 라이온봇 기자 -한국경제TV※ 본 기사는 한국경제TV와 '거장들의 투자공식이'자체 개발한 '라이온봇 기자'가 실시간으로 작성한 기사입니다. 라이온봇기자 ⓒ 한국경제TV, 무단 전재 및 재배포 금지 한국경제TV 관련뉴스해당 언론사에서 선정하며 언론사 페이지(아웃링크)로 이동해 볼 수 있습니다.이상호 2억원, 여자컬링 0원…경기단체 포상금 '천차만별'이하늬 ""살찌면 외삼촌""…문희상 의원과 닮은꼴 '깜짝'전현무♥한혜진 열애, 티격태격 하다가 정 들었다스텔라 해체, 선정성 논란 부담됐나 ""갓 스무살에...""이윤미, 주영훈 몰카논란 사과 ""많이 생각하고 반성"""
머니투데이,082270,/news/news_read.nhn?article_id=0004005270&office_id=008&mode=search&query=젬백스&page=1,2018-02-07 15:16,"젬백스테크, 中 장수치안 그룹과 4조 위안 IoT 공조 공략","[머니투데이 김건우 기자] 젬백스테크놀러지는 지난 1월 19일 중국장수치안그룹의 자회사 장수언비터블라디에어터와 IoT(사물인터넷) 기반 스마트 에어케어 제품 개발 사업을 위한 본계약을 체결했다고 7일 밝혔다. 이번 계약은 지난해 11월 젬백스테크놀러지와 중국 장수치안그룹이 체결한 공동사업양해각서 이후 체결된 첫번째 제품에 대한 본 계약이다. 젬백스테크놀러지는 ESS(에너지 저장 시스템) 기반의 빌트인 타입의 라디에이터를 개발하며, 장수언비터블라디에이터사는 본 제품의 양산 및 글로벌 유통을 담당할 예정이다. 정대근 젬백스테크놀러지 IoT 신사업 이사는 ""연간 3만대 정도로 예상되는 판매에 있어서도 높은 로열티를 보장받아 향후 본 제품과 관련해 500만 달러 정도의 매출을 기대한다""고 말했다. 두 회사는 앞으로 IoT 기반의 실내공기질측정기, 공조기, 가습기, 디퓨저 등 다양한 B2C, B2B 제품 라인업을 확보해 사업 영역을 확대해 나갈 계획이다. 중국은 대기 오염의 심화로 인한 에어케어 관련 시장의 급격한 성장과 함께, 2020년 IoT 관련 제품 수요가 4조 위안을 넘어설 것으로 예상된다고 회사 측은 덧붙였다."
매일경제,082270,/news/news_read.nhn?article_id=0003961267&office_id=009&mode=search&query=젬백스&page=1,2017-06-15 14:55,"젬백스테크놀러지 자회사 노바헵, EU&middot;스웨덴서 연구지원금 획득","젬백스테크놀러지는 스웨덴 자회사인 노바헵이 유럽연합(EU) 'Horizon 2020 SME instrument' 프로그램과 스웨덴 당국의 'Swelife'프로그램에서 총 30억 2000만원의 연구 지원금을 받는다고 15일 밝혔다. 노바헵은 조직공학기술을 통해 생체적합성 극대화 환자맞춤형 혈관을 연구·개발하고, 재생의학 분야에서 독점기술을 보유한 스웨덴 기업으로 지난 2015년 젬백스테크놀러지에 인수됐다. 지난해에도 과학적 우수성, 비즈니스 혁신성을 인정받아 3억4000만원 규모의 마리퀴리 연구지원금을 받은 바 있다. 'Horizon 2020 SME instrument'는 혁신성이 높은 중소기업의 기술 상업화를 지원하고 성장을 도모하는 프로그램이다. 이번에는 총 1222개의 신청 기업 중 69개의 기업이 선정됐다. 노바헵은 15점 중 총 13.34의 점수를 받아 2년간 총 28억3000만원의 지원금을 받는다. 회사 측은 ""이번 지원금을 환자맞춤형 재생혈관 (P-TEV: personalized tissue-engineered vein)의 만성정맥부전 I/II상 임상시험 및 GMP 생산을 진행하는데 쓸 것""이라고 말했다. 'Swelife'는 스웨덴 정부산하 기술혁신청비노바(Vinnova) 및 스웨덴 지역당국 VGR(V?straG?talandsRegionen)가 지원하는 국가 전략 혁신 프로그램이다. 이 프로그램을 통해 노바헵은 총 1억8000만원의 연구지원금을 받아 심혈관계 질환 치료제 개발을 위한 개념입증연구(Proof-of-concept)를 진행할 계획이다. 젬백스 그룹의 송형곤 경영기획실장은 ""이번 연구지원금 획득으로 노바헵이 가진 기술의 혁신성을 인정받은 계기가 됐다""라며 ""노바헵의 환자맞춤형 재생혈관의 연구개발 및 임상에 최선을 다할 것""이라고 밝혔다. [디지털뉴스국 이상규 기자] r_start // r_end //"
이데일리,082270,/news/news_read.nhn?article_id=0003344254&office_id=018&mode=search&query=젬백스&page=1,2015-09-10 13:29,"[특징주]젬백스, 롯데 과자 중국 공급 소식에 급등","[이데일리 정병묵 기자] 젬백스(082270)가 중국 합작계열사의 중국 내 롯데제과 제품 공급 계약 체결 소식에 급등세다. 젬백스는 10일 오후 1시27분 현재 전날 대비 9.55% 오른 3만9000원에 거래되고 있다. 화련젬백스는 이날 롯데제과(004990)와 중국 최대 유통그룹인 화련그룹의 유통망을 통해 롯데제과의 제품을 공급하는 업무협약을 체결했다. 화련그룹은 중국 86개의 백화점과 2400여개의 대형 마트를 보유한 연 매출 122조원의 대형 유통그룹이다. 화련그룹은 지난 7월 한국 우수상품의 중국 시장진출을 위해 젬백스와 합작회사인 화련젬백스를 설립했다. 화련젬백스는 현재 중국 내 ‘화련’상호를 사용하는 모든 백화점과 마트, 온라인몰에 대한 유통을 담당하고 있다."
한국경제TV,082270,/news/news_read.nhn?article_id=0000599602&office_id=215&mode=search&query=젬백스&page=1,2018-02-06 11:06,"젬백스, 전일 대비 약 -8% 하락한 15,050원","[한국경제TV 라이온봇 기자] 젬백스는 2월 6일 11시 6분 전일 대비 약 -8% 하락한 15,050원에 거래되고 있다. 젬백스는 코스닥 상장 기업으로 기계,장비 업종에 속해 있다. 시가총액은 5,044억원으로 코스닥 상장기업 중 95위에 위치 해 있다. [종목 성향 진단] [그림 1] 종목 성향 진단 젬백스의 투자 스타일은 성장주에 가깝다. 주가 고평가 우려가 공존하지만 높은 성장성이 기대되는 기업이다. 주가 모멘텀은 좋은 편에 속했다. 최근 6개월 수익률은 15.09%의 상승폭을 기록했다. 최근 1개월 수익률 또한 13.89% 상승하며 좋은 모멘텀을 보이고 있다. 젬백스 종목에 대한 투자자의 관심도는 굉장히 높은 편이다. [투자 점수 진단] [그림 2] 투자 점수 진단 젬백스는 각 재무지표를 전체 상장종목과 비교하여 점수화 했을 때, 대부분 지표에서 시장과 업종 대비 아쉬움을 나타냈다. 부채비율 점수에서 장점을 드러냈으나, 전체시장을 대비 상대적으로 낮은 수치였다. 또한, 매출증가율(YoY)과 PBR은  아쉬움을 나타냈다. [종합 투자점수] [그림 3] 종합 투자점수 AI 인공지능 분석을 통한 젬백스의 종목 종합 스코어는 23점을 기록했다. 이는 동일 업종 평균점수인 57점과 시장 평균점수인 57점를 하회하는 수치였다. (위의 AI인공지능 점수는 재무 데이터를 기반으로 전체 상장 종목과 비교/분석하여 도출한 점수로 높은 점수가 반드시 높은 수익률을 보장하지 않습니다. 위의 자료는 당사의 추천 종목이 아니며, 투자 시 참고용으로 제시해드리는 것입니다.) 라이온봇 기자 -한국경제TV※ 본 기사는 한국경제TV와 '거장들의 투자공식이'자체 개발한 '라이온봇 기자'가 실시간으로 작성한 기사입니다. 라이온봇기자 ⓒ 한국경제TV, 무단 전재 및 재배포 금지 한국경제TV 관련뉴스해당 언론사에서 선정하며 언론사 페이지(아웃링크)로 이동해 볼 수 있습니다.'오달수의 그녀' 채국희, 승무원 출신? 채시라 동생?도도맘 전 남편 조용제 씨 ""불륜사건은 강용석과 나와의 싸움""박삼구 아시아나 회장도 성추행 논란…승무원들 상대로?'굿모닝FM 하차' 문지애 집…""아나운서 집이 왜 이래""태양♥민효린 결혼, 영화 포스터같은 웨딩화보 '시선집중'"
머니투데이,082270,/news/news_read.nhn?article_id=0003778382&office_id=008&mode=search&query=젬백스&page=1,2016-11-23 17:05,"젬백스, 경영진 주식 1만 1000주 매수 &quot;주주가치 견인&quot;","[머니투데이 김건우 기자] 젬백스앤카엘은 김상재 대표를 비롯한 주요 경영진이 주주가치 견인 및 책임경영을 위해 총 1만 1000주 규모의 주식을 장내 매수했다고 23일 밝혔다. 김상재 대표는“최근 금리인상, 국내정세 등의 불확실성 증가 등으로 인한 젬백스앤카엘 주주여러분들의 우려 확산에 따른 주주가치 제고를 위한 결정”이라며 “자사주 매입은 회사의 미래가치와 무관하게 주가가 하락한 것에 대한 기업의 책임경영과 회사 성장에 대한 의지”라고 말했다. 이어 ""사업진행 및 실적에 대한 일부 우려가 있으나 최근사업년도 흑자전환을 실현한 바 있으며, 현재 진행하고 있는 사업도 차질 없이 진행 되고 있다""고 설명했다. 젬백스는 전립선비대증 치료제 개발은 진행중인 국내 임상 2상 시험이 지난 10월에 종료되었고, 임상시험결과는 2017년 3월 경 발표될 예정이다. 내년 상반기에 국내 3상 임상시험을 계획하고 있으며 좋은 결과가 있을 것이라고 회사 측은 기대하고 있다. 송형곤 바이오사업 부문 사장은 ""지금까지와 다른 새로운 치료기전을 가진 알츠하이머병 치료제를 개발중이며, 국내와 별도로 2017년 말 미국에서 임상 2상 시험을 준비 중""이라며 ""연내 국제 임상시험을 위한 임상시험대행기관(CRO), 임상시험용의약품 제조업체(CMO)와 계약할 예정""이라고 말했다. 항암제 부문은 췌장암 치료제 리아백스주 외에 현재 대장암을 대상으로 임상시험 중이며, 비소세포폐암, 전립선암 등 다양한 암종으로 적응증을 확대하기 위해 국내 여러 대학병원과 연구자 임상시험을 준비하고 있다. 송 사장은 ""회사가 계획한 바에 따라 구체적인 결과를 보여드릴 수 있도록 노력해, 조만간 만족할 만한 성과로 보답하겠다""고 덧붙였다. textlinktopstart textlinktopend textlinkstart"
