source,symbol,link,date,title,content
파이낸셜뉴스,087220,/news/news_read.nhn?article_id=0003776423&office_id=014&mode=search&query=스틸플라워&page=1,2017-02-14 14:28,"[fnRASSI]스틸플라워, 52주 신저가 경신...-2.1% &darr;","스틸플라워(087220)는 당일 467원까지 하락하며 52주신저가를 기록했다. 동종목의 현재 주가는 전일대비 -2.1% 하락한 467원 선에서 이루어지고 있다. 거래일을 기준으로 최근 3일간 평균 거래량은 1583만 주이다. 이는 60일 일 평균 거래량 393만 주와 비교해보면 최근 거래량이 급격히 늘어났다는 것을 알 수 있다.                   지표               항목               값               종합점수                 성장성               매출액증가율               -0.43               0.69                 자기자본증가율               -0.25                 안정성               부채비율               260.91               2.3                 유동비율               54.93                 이익안정성               3.61                 수익성               ROA               -9.18               0.72                 ROE               -33.13                 영업이익율               -13.73          스틸플라워의 퀀트 재무 점수는 3.71점으로 지난 분기에 비해 성장성 점수가 하락했다. 이는 자기자본 증가율이 감소하였기 때문이다. 안정성 종합 점수는 부채비율 증가, 유동비율 감소로 하락했다. 수익성 측면에서 볼때 ROA, ROE가 하락하여 이전보다 낮은 점수를 받았다. 매매주체는개인,외국인 최근 한달간 주체별 거래비중을 살펴보면 개인이 96.3%, 외국인이 3.69%를 기록한 것으로 나타났다. 그리고 최근 5일간 거래비중은 개인이 96.83%, 외국인이 3.16%를 기록한 것으로 나타났다. 'fnRASSI'는 증권전문 기업 씽크풀과 파이낸셜뉴스의 협업으로 로봇기자가 실시간으로 생산하는 기사입니다."
서울경제,087220,/news/news_read.nhn?article_id=0002859166&office_id=011&mode=search&query=스틸플라워&page=1,2016-07-21 09:41,"스틸플라워, 서태평양 광구 탐사 기대감에 상한가","스틸플라워(087220)가 서태평양의 망간각 광구 탐사 기대감에 따라 상한가를 기록 중이다. 21일 오전 9시 38분 현재 스틸플라워는 전일보다 29.84% 오른 1,610원에 거래되고 있다. 가격제한폭까지 오르며 전날에 이어 이틀째 상승세를 유지 중이다. 이는 국제해저기구(ISA)가 제22차 총회를 통해 서태평양 마젤란 해역의 망간각 광구를 한국이 독점 탐사하도록 승인한 데 따른 것이다. 망간각에는 산업용 금속으로 활용도가 높은 희토류와 코발트·니켈·구리·망간 등이 함유돼 수입산 광물의 대체효과가 기대된다. 스틸플라워는 심해저 광물자원 개발에 관한 기술을 보유하고 있어 이번 결정의 대표적인 수혜주로 꼽힌다."
이데일리,087220,/news/news_read.nhn?article_id=0003592096&office_id=018&mode=search&query=스틸플라워&page=1,2016-07-21 09:12,"[특징주]스틸플라워, 망간각 탐사공구 확보 소식에 &lsquo;上&rsquo;","[이데일리 이명철 기자] 스틸플라워(087220)가 ‘바닷속 검은 노다지’로 불리는 망간각 탐사공구 독점 확보 소식에 급등하며 상한가를 나타내고 있다. 21일 오전 9시10분 현재 스틸플라워 주가는 전일대비 가격제한폭(29.84%)까지 오른 1610원을 기록 중이다. 전날에 이어 이틀째 상승세로 오름폭은 대폭 확대됐다. 망간단괴를 채취하는 기술을 보유하고 있어 이번 독점 확보가 수혜를 입을 것이라는 판단이 영향을 미친 것으로 풀이된다. 해양수산부와 외교부에 따르면 국제해저기구(ISA)는 제22차 총회를 열어 서태평양 마젤란 해역 ‘망간각’ 광구를 한국이 독점 탐사하도록 승인했다. 면적은 3000㎢로 서울 여의도의 약 350배에 달한다. 망간각은 바닷물 금속성분이 수심 800~2500m 해저산 사면에 흡착돼 만들어진 광물 자원이다. 첨단산업 기초 금속으로 꼽히는 희토류와 코발트, 니켈, 구리, 망간 등이 함유됐다. 정부는 망간각 독점 탐사광구에 4000만t의 망간각이 매장됐을 것으로 추정하고 있다. 연간 100만t씩 망간각을 생산할 경우 앞으로 20년간 총 6조원 가량의 수입산 광물 대체효과가 기대된다. 한편 스틸플라워가 개발한 라이저파이프는 심해저에서 망간단괴를 채광선까지 옮기는 양광시스템 실증에서 성공한 바 있다. 외산제품 일색의 심해저 광물자원 개발 파이프라인의 국산화 영업력을 강화하고 있다."
이데일리,087220,/news/news_read.nhn?article_id=0003640111&office_id=018&mode=search&query=스틸플라워&page=1,2016-09-29 11:12,스틸플라워 &quot;내진 건축용 파이프 생산&hellip;수혜 기대&quot;,[이데일리 박형수 기자] 최근 연이은 지진 발생으로 내진 제품에 대한 관심이 커지는 가운데 내진 건축용 파이프를 생산하는 스틸플라워(087220)가 주목을 받고 있다. 스틸플라워는 후육관 사업부문에서 약 331억원의 수주잔고를 보유하고 있다고 29일 밝혔다. 최근 계속된 지진으로 내진 건축용 강관 제품에 대한 시장이 열리고 있기 때문에 추가적인 수주를 확보할 것으로 기대했다. 스틸플라워는 후육강관을 생산·판매하는 업체다. 후육강관은 두께가 20~140mm인 특수강관으로 전 세계 강관산업에서 약 5% 정도의 틈새시장을 형성하고 있다. 특히 최종 수요자의 요구에 맞게 제작하는 사업 특성상 다품종 소량생산 형태의 산업구조를 보유하고 있다. 세계적으로 일부 업체만 후육강관을 생산하고 있다. 스틸플라워는 핵심공정에 필요한 가공기술을 지속적으로 개발하고 있다. 지난 2012년에는 내진건축과 하중이 큰 구조물에 사용하는 냉간 프레스 성형 각형강관 신제품을 개발했다. 국내 한국산업표준(KS규격)은 물론 일본공업규격(JIS) 인증도 취득했다. JIS는 일본뿐만 아니라 세계 시장에서도 통용돼 전세계 수출이 가능하다. 회사 관계자는 “국내는 아직 대부분 H빔을 쓰고 있고 내진설계가 필요한 건축물에는 각형강관을 부분적으로 사용하고 있다”고 말했다. 그는 이어 “내년부터 2층 이상 건축물에 내진 설계를 의무적으로 적용해야 한다”며 “시장 수요가 증가할 것”이라고 강조했다.
머니투데이,087220,/news/news_read.nhn?article_id=0003849410&office_id=008&mode=search&query=스틸플라워&page=1,2017-03-31 19:13,"스틸플라워, 김종룡&middot;박준석 각자대표로 변경","[머니투데이 김주현 기자] 스틸플라워가 김병권 단독대표 체제에서 김종룡, 박준석 각자 대표 체제로 변경했다고 31일 공시했다. textlinktopstart textlinktopend textlinkstart"
연합뉴스,087220,/news/news_read.nhn?article_id=0008527564&office_id=001&mode=search&query=스틸플라워&page=1,2016-07-08 09:05,"&lt;특징주&gt; 스틸플라워, 국내특허 취득 소식에 강세","(서울=연합뉴스) 유현민 기자 = 강관 제조업체인 스틸플라워가 국내 특허 취득 소식에 8일 장 초반 강세를 보이고 있다. 이날 오전 9시 1분 현재 코스닥시장에서 스틸플라워는 전날보다 6.03% 오른 1천230원에 거래됐다. 스틸플라워는 해안 방파용 등으로 설치되는 구조물인 소파블록에 대한 국내 특허를 취득했다고 전날 장 종료 후 공시했다. 회사 측은 ""향후 군사용으로 사용되는 해안방호시설과 서해안 중국 쌍끌이 어선 그물파손 등에 활용할 계획""이라고 설명했다."
서울경제,087220,/news/news_read.nhn?article_id=0002853172&office_id=011&mode=search&query=스틸플라워&page=1,2016-07-08 09:15,"스틸플라워, 특허 취득 소식에 10% 이상 급등","강관 제조업체인 스틸플라워(087220)가 국내 특허 취득 소식에 8일 급등세를 보이고 있다. 이날 오전 9시 13분 현재 스틸플라워는 전일보다 11.64% 오른 1,295원에 거래 중이다. 전일 스틸플라워는 해안 방파용 등으로 설치되는 구조물인 소파블록에 대한 국내 특허를 취득했다고 공시한 바 있다."
파이낸셜뉴스,087220,/news/news_read.nhn?article_id=0003775418&office_id=014&mode=search&query=스틸플라워&page=1,2017-02-13 09:09,"[fnRASSI]스틸플라워, 52주 신저가 경신...-21.45% &darr;","스틸플라워(087220)는 당일 531원까지 하락하며 52주신저가를 기록했다. 동종목의 현재 주가는 전일대비 -21.45% 하락한 531원 선에서 이루어지고 있다. 거래일을 기준으로 최근 3일간 평균 거래량은 152만 주이다. 이는 60일 일 평균 거래량 320만 주와 비교해보면 최근 거래량이 급격히 줄어들었다는 것을 알 수 있다. 주주들의 손바뀜이 잦은 듯 최근 한달간 스틸플라워의 매매회전율을 분석한 결과 14일에 1번 꼴로 주식의 주인이 바뀐 것으로 나타났다. 회전율이 높은 경우 유동성이 좋다고 할 수 있으나 이런경우 주가변동이 심한 경우가 많아 주의가 요구된다. 동종목의 경우 동기간 일평균 주가변동률은 1.77%를 기록했다. 개인,외국인 투자자만 매매에 참여 최근 한달간 주체별 거래비중을 살펴보면 개인 비중이 95.8%로 가장 높았고, 외국인이 4.19%로 그 뒤를 이었다. 기관은 거래에 참여하지 않은 것으로 보인다. 그리고 최근 5일간 거래비중은 개인이 95.65%, 외국인이 4.34%를 기록한 것으로 나타났다. 'fnRASSI'는 증권전문 기업 씽크풀과 파이낸셜뉴스의 협업으로 로봇기자가 실시간으로 생산하는 기사입니다."
전자신문,087220,/news/news_read.nhn?article_id=0002596861&office_id=030&mode=search&query=스틸플라워&page=1,2017-03-31 09:42,"[ET투자뉴스]가스관 관련주테마, 스틸플라워, 대동스틸 중심으로 강세","금일  현재, 가스관 관련주테마가 전일대비 3.44% 상승하며 강세를 보이고 있다. 상승폭으로는 스틸플라워 10.38%로 선두권에 있으며 대동스틸(1.86%), 동양철관(1.61%)도 강세이다. [테마내 주요종목 시세] * 스틸플라워 : 404원 (▲38) *대동스틸:4,110원 (▲75) *동양철관:1,265원 (▲20) [테마내 주요종목 재무요약] * 스틸플라워 : 영업이익률 현재 -16.73%로 업종평균 하회.  PBR은 0.49로 다소 낮은편 * 대동스틸 : 영업이익률 현재 4.73%로 업종평균 수준. PBR은 0.71로 다소 낮은편 * 동양철관 : 영업이익률 현재 -5.08%로 업종평균 하회.  PBR은 1.2임. [테마내 종목별 외국인 지분변동] * 스틸플라워 :  최근 2주간 0.44%증가하여 현재 보유율은 1.35% * 대동스틸 :  최근 2주간 0.28%증가하여 현재 보유율은 4.42% * 동양철관 :  최근 2주간 0.14%증가하여 현재 보유율은 2.2%"
전자신문,087220,/news/news_read.nhn?article_id=0002507421&office_id=030&mode=search&query=스틸플라워&page=1,2016-07-26 14:18,[@테마]가스관 관련주테마주 강세_스틸플라워 테마내 주도적 흐름(1시),"  가스관 관련주테마주들이 전체적으로 장중 강보합권의 분위기속에서 상승모멘텀이 집중되면서 독보적인 강세를 보이고 있다. 반면에 가스관 관련주테마외에 현재 뚜렷하게 상승세를 나타내는 테마는 눈에 뜨이지 않고 있다. 오늘 가스관 관련주테마는 26일 오후 1시 현재 2.09% 소폭 상승하고 있는데, 테마내에서 스틸플라워(4.75%)가 테마 전체의 강세흐름을 주도하는 모습이고 대동스틸(1.63%)와 하이스틸(0.97%) 등이 빠르게 주도주와 발을 맞추는 동조화를 보이고 있다. &lt;표&gt;가스관 관련주테마내 주요종목 등락율*가스관 관련주테마..1069.63p(+2.09%)오후 1시종목명현재가(대비)등락율스틸플라워  1,545원(+70)  +4.75% "
이데일리,087220,/news/news_read.nhn?article_id=0003582589&office_id=018&mode=search&query=스틸플라워&page=1,2016-07-08 09:16,"[특징주]스틸플라워, 해안방파용 소파블록 특허 취득에 급등",[이데일리 유재희 기자] 스틸플라워가 해안 방파용 소파블록 관련 특허를 취득했다는 소식에 급등세다. 8일 오전 9시13분 현재 스틸플라워(087220)는 전일대비 9.48%(110원) 상승한 1270원에 거래되고 있다. 스틸플라워는 전날 공시를 통해 해안 방파용으로 설치되는 소파블록에 대한 국내 특허를 취득했다고 밝혔다. 회사 측은 “향후 군사용으로 사용되는 해안방호시설과 서해안 중국 쌍끌이 어선 그물파손 등에 활용할 계획”이라고 설명했다.
파이낸셜뉴스,087220,/news/news_read.nhn?article_id=0004009333&office_id=014&mode=search&query=스틸플라워&page=1,2018-04-25 15:39,"[fnRASSI]장마감, 코스닥 하락 종목(스틸플라워 -80.83%&darr;)","25일 코스닥 시장에서 하락한 종목으로 스틸플라워(087220) -80.83%, 씨그널엔터테인먼(099830) -36.25%, 엔에스(217820) -13.47% 등이 있다. 'fnRASSI'는 증권전문 기업 씽크풀과 파이낸셜뉴스의 협업으로 로봇기자가 실시간으로 생산하는 기사입니다."
매일경제,087220,/news/news_read.nhn?article_id=0003764038&office_id=009&mode=search&query=스틸플라워&page=1,2016-07-08 09:18,"[Hot-Line] 스틸플라워, 소파블록 특허 취득 소식에 &lsquo;강세&rsquo;",스틸플라워가 소파블록 관련 국내 특허 취득 소식에 장 초반 강세를 보이고 있다. 8일 오전 9시 11분 현재 스틸플라워는 전날보다 120원(10.34%) 오른 1280원에 거래되고 있다. 회사는 전날 해안 방파용으로 설치하는 소파블록에 관한 국내 특허를 취득했다고 공시했다. 스틸플라워 측은 “군사용으로 사용하는 해안방호시설과 서해안 중국 쌍끌이 어선 그물파손 등에 활용할 계획”이라고 밝혔다. [디지털뉴스국 박진형 기자] r_start // r_end //
머니투데이,087220,/news/news_read.nhn?article_id=0003749380&office_id=008&mode=search&query=스틸플라워&page=1,2016-09-30 10:01,"스틸플라워, 유증 1차 발행가액 669원 결정",[머니투데이 김주현 기자] 스틸플라워가 유상증자 1차발행가액을 주당 669원으로 결정했다고 30일 공시했다. textlinktopstart textlinktopend textlinkstart
이데일리,087220,/news/news_read.nhn?article_id=0003747694&office_id=018&mode=search&query=스틸플라워&page=1,2017-02-13 09:10,"[특징주]스틸플라워, 관리종목 지정 우려에 급락",[이데일리 최정희 기자] 스틸플라워(087220) 주가가 급락하고 있다. 13일 마켓포인트에 따르면 스틸플라워 주가는 이날 오전 9시 8분 현재 전 거래일보다 25.89% 하락한 501원에 거래되고 있다. 한국거래소 코스닥시장본부는 지난 10일 스틸플라워가 최근 4개 사업연도 연속 영업적자가 발생해 관리종목 지정 우려가 있다고 밝혔다. 이 같은 사실이 감사보고서에서 확인될 경우 관리종목으로 지정될 수 있다.
이데일리,087220,/news/news_read.nhn?article_id=0003526123&office_id=018&mode=search&query=스틸플라워&page=1,2016-04-21 09:13,"[특징주]스틸플라워, 잇단 해외 수주 소식에 강세","[이데일리 박형수 기자] 스틸플라워(087220)가 강세다. 태국 국영석유회사가 진행하는 자우티카(ZAWTIKA) 프로젝트에 후육관을 공급한다는 소식이 주가에 영향을 준 것으로 보인다. 21일 오전 9시9분 스틸플라워는 전날보다 2.45% 오른 1465원에 거래되고 있다. 이날 스틸플라워는 태국 국영석유회사인 PTT 익스플로레이션앤프로덕션과 후육관 공급계약을 체결했다고 밝혔다. 계약금액은 약 610만 달러(한화 71억원) 규모이며, 납기일은 오는 9월 30일까지다. 스틸플라워 관계자는 “PTTEP는 다양한 원유개발 프로젝트를 진행하고 있다”며 “태국과 미얀마 원유시장 내 시장점유율이 높기 때문에 장기적인 프로젝트 거래처로 연계될 수 있다는 장점이 있다”고 말했다. 실제 태국의 PTTEP사는 아시아 최고의 에너지 개발기업으로 태국 석유공사(PTT) 산하에 있다. 미얀마 칼론과 자우티카에서 대규모 천연가스 채굴을 진행하며 태국의 원유시장을 독점하고 있다. 김병권 대표이사는 “지난 아르셀로 미탈과의 업무제휴 후 인도 다만 프로젝트에 이어 이번 PTTEP의 미얀마 프로젝트까지 연속으로 수주했다”며 “해외영업 부진을 극복하고 재도약하는 전환점으로 삼겠다”고 말했다."
한국경제,087220,/news/news_read.nhn?article_id=0003662422&office_id=015&mode=search&query=스틸플라워&page=1,2016-09-30 22:36,[코스닥 메모] (10월 4일) 유상권리락=스틸플라워 등,◇유상권리락=스틸플라워 ◇일반공모청약=세진전자 에스에스컴텍 ◇공모주청약=앤디포스(미래에셋대우) 잉글우드랩(하나) [
이데일리,087220,/news/news_read.nhn?article_id=0003633158&office_id=018&mode=search&query=스틸플라워&page=1,2016-09-20 11:12,"[특징주]스틸플라워, 지진 공포 속 내진용 강관 부각 &uarr;","[이데일리 박형수 기자] 특수 후육관 생산업체 스틸플라워(087220)가 강세다. 지진 관련주가 상승 흐름을 보이면서 스틸플라워도 주목받는 것으로 풀이됐다. 20일 오전 11시7분 스틸플라워는 전날보다 4.21% 오른 1115원에 거래되고 있다. 기상청에 따르면 전날 오후 8시 33분께 경북 경주시 남남서쪽 11㎞ 지역, 깊이 14㎞ 지점에서 규모 4.5의 지진이 발생했다. 지난 12일 경주 인근에서 규모 5.8 지진이 발생한 이후 300여 차례 이어진 여진 가운데 가장 큰 규모다. 스틸플라워는 해양플랜트와 송유관, 발전소 열배관재, 내진건축용 파이프 등을 생산하고 있다."
아시아경제,087220,/news/news_read.nhn?article_id=0003783174&office_id=277&mode=search&query=스틸플라워&page=1,2016-07-07 16:06,"스틸플라워, 해안 방파용 '소파블록' 관련 특허권 취득",[아시아경제 임철영 기자]스틸플라워가 7일 해안에 방파용으로 설치되는 소파블록(WAVE REDUCING BLOCK)에 관한 특허권을 취득했다고 공시했다.
연합뉴스,087220,/news/news_read.nhn?article_id=0009028413&office_id=001&mode=search&query=스틸플라워&page=1,2017-02-13 09:29,[특징주] 스틸플라워&middot;넥스트바이오홀딩스 신저가,(서울=연합뉴스) 권수현 기자 = 스틸플라워와 넥스트바이오홀딩스가 관리종목 지정 우려에 13일 장 초반 52주 신저가를 기록하는 등 급락세다. 이날 오전 9시 28분 현재 코스닥 시장에서 스틸플라워는 전 거래일보다 24.70% 하락한 509원에 거래 중이다. 이 종목은 장중 한때 490원까지 떨어져 52주 신저가를 경신했다. 넥스트바이오홀딩스는 22.54% 급락한 1천375원선에서 움직이고 있다. 이 종목 역시 장 출발 직후 1천325원까지 떨어져 52주 신저가를 갈아치웠다. 한국거래소 코스닥시장본부는 앞서 지난 10일 두 종목에 대해 최근 4개 연도 연속 영업적자가 발생하는 등 관리종목 지정 우려가 있다고 공시했다.
머니투데이,087220,/news/news_read.nhn?article_id=0003749658&office_id=008&mode=search&query=스틸플라워&page=1,2016-09-30 16:11,"스틸플라워, 내달 4일 권리락",[머니투데이 김주현 기자] 스틸플라워가 유상증자를 이유로 다음달 4일 권리락이 실시된다고 30일 공시했다. 권리락 기준가는 주당 961원이다. textlinktopstart textlinktopend textlinkstart
전자신문,087220,/news/news_read.nhn?article_id=0002526437&office_id=030&mode=search&query=스틸플라워&page=1,2016-09-20 12:12,"[@테마]가스관 관련주테마, 스틸플라워, 하이스틸 중심으로 강세","금일  현재, 가스관 관련주테마가 전일대비 3.27% 상승하며 강세를 보이고 있다. 상승폭으로는 스틸플라워 9.81%로 선두권에 있으며 하이스틸(2.17%), 대동스틸(1.4%)도 강세이다. [테마내 주요종목 시세] * 스틸플라워 : 1,175원 (▲105) *하이스틸:21,150원 (▲450) *대동스틸:3,620원 (▲50) [테마내 주요종목 재무요약] * 스틸플라워 : 영업이익률 현재 -13.93%로 업종평균 하회.  PBR은 0.58로 다소 낮은편 * 하이스틸 : 영업이익률 현재 -4.34%로 업종평균 하회.  PBR은 0.34로 다소 낮은편 * 대동스틸 : 영업이익률 현재 -1.21%로 업종평균 하회.  PBR은 0.65로 다소 낮은편 [테마내 종목별 외국인 지분변동] * 하이스틸 :  최근 2주간 0.03%증가하여 현재 보유율은 1.13% * 대동스틸 :  최근 2주간 0.9%증가하여 현재 보유율은 6.88%"
머니S,087220,/news/news_read.nhn?article_id=0000312589&office_id=417&mode=search&query=스틸플라워&page=1,2018-04-25 10:03,"[특징주] '상장폐지' 스틸플라워, 정리매매 시작&hellip; 79.32% 급락",상장폐지가 결정된 스틸플라워의 주가가 정리매매 시작 첫날 79.32% 급락했다. 25일 오전 9시58분 현재 스틸플라워는 55원에 거래됐다. 앞서 스틸플라워는 감사범위 제한과 계속기업 존속능력에 대한 불확실성으로 외부감사인에게 '감사의견 거절'을 받아 상장폐지가 결정됐다. 이 종목에 대한 정리매매기간은 이날부터 다음달 4일까지이며 상장폐지일은 다음달 8일이다. 박기영 기자
머니투데이,087220,/news/news_read.nhn?article_id=0003708010&office_id=008&mode=search&query=스틸플라워&page=1,2016-07-07 16:13,"스틸플라워, 소파블록 특허권 취득",[머니투데이 유엄식 기자] 스틸플라워는 해안에 방파용으로 설치되는 소파블록(WAVE REDUCING BLOCK)과 관련된 특허권을 취득(특허출원번호 10-2016-0023956)했다고 7일 공시했다. textlinktopstart textlinktopend textlinkstart
헤럴드경제,087220,/news/news_read.nhn?article_id=0001080220&office_id=016&mode=search&query=스틸플라워&page=1,2016-07-07 16:16,"스틸플라워, 해안 방파용 소파블록 관련 특허취득",[헤럴드경제=박영훈 기자] 스틸플라워는 소파블록(WAVE REDUCING BLOCK) 관한 특허권을 취득했다고7일공시했다. 회사측은 “해안에 방파용으로 설치되는 소파블록에 관한 것”이라며 “내부에 충전재가 충전되는 철 파이프를 사용하여 간편하게 제작 할 수 있도록 한 기술”이라고 설명했다. 이어 “군사용으로 사용되는 해안방호시설 및 서해안 중국 쌍끌이 어선 그물파손 등에 활용할 계획”이라고밝혔다.
연합뉴스,087220,/news/news_read.nhn?article_id=0008526619&office_id=001&mode=search&query=스틸플라워&page=1,2016-07-07 16:17,"스틸플라워, 소파블록 국내 특허 취득","(서울=연합뉴스) 유현민 기자 = 코스닥에 상장된 강관 제조업체인 스틸플라워는 7일 해안 방파용으로 설치되는 소파블록에 대한 국내 특허를 취득했다고 공시했다. 회사 측은 ""향후 군사용으로 사용되는 해안방호시설과 서해안 중국 쌍끌이 어선 그물파손 등에 활용할 계획""이라고 설명했다."
전자신문,087220,/news/news_read.nhn?article_id=0002513898&office_id=030&mode=search&query=스틸플라워&page=1,2016-08-12 16:27,"[@테마]가스관 관련주테마, 스틸플라워, 동양철관 중심으로 약세","금일  현재, 가스관 관련주테마가 전일대비 -3.02% 하락하며 약세를 보이고 있다. 하락폭으로는 스틸플라워 -4.75%로 선두권에 있으며 동양철관(-3.27%), 대동스틸(-2.19%)도 약세이다. [테마내 주요종목 시세] * 스틸플라워 : 1,405원 (▼70) *동양철관:1,625원 (▼55) *대동스틸:3,570원 (▼80) [테마내 주요종목 재무요약] * 스틸플라워 : 영업이익률 현재 -13.93%로 업종평균 하회.  PBR은 0.8로 다소 낮은편 * 동양철관 : 영업이익률 현재 -0.72%로 업종평균 하회.  PBR은 1.36임. * 대동스틸 : 영업이익률 현재 -1.21%로 업종평균 하회.  PBR은 0.65로 다소 낮은편 [테마내 종목별 외국인 지분변동] * 동양철관 :  최근 2주간 -0.78%감소하여 현재 보유율은 1.25% * 대동스틸 :  최근 2주간 -0.01%감소하여 현재 보유율은 3.4%"
