source,symbol,link,date,title,content
머니투데이,087220,/news/news_read.nhn?article_id=0003668656&office_id=008&mode=search&query=스틸플라워&page=1,2016-04-21 17:54,"스틸플라워, 일반공모 유상증자 청약률 10443.2%",[머니투데이 구유나 기자] 스틸플라워가 일반공모 유상증자 청약률이 10443.2%를 기록했다고 21일 공시했다. 총 발행 예정 주식수는 1000만주며 청약 주식수는 10억4432만4400주다. 신주권 교부일은 오는 5월6일이며 상장일은 5월9일이다. textlinktopstart textlinktopend textlinkstart
파이낸셜뉴스,087220,/news/news_read.nhn?article_id=0003818003&office_id=014&mode=search&query=스틸플라워&page=1,2017-05-22 09:44,"[fnRASSI]스틸플라워, 15.15% 오르며 거래량 증가","스틸플라워(087220)의 현재 거래량이 최근 5거래일 거래량의 최고치를 넘어섰다. 그리고 스틸플라워는 3일 연속 상승흐름을 보이며, 9시 39분 현재 15.15% 증가한 494원에 거래중이다.                   지표               항목               값               종합점수                 성장성               매출액증가율               -0.37               0.58                 자기자본증가율               -0.36                 안정성               부채비율               317.28               1.81                 유동비율               44.62                 이익안정성               3.61                 수익성               ROA               -27.62               0.21                 ROE               -115.25                 영업이익율               -41.11          스틸플라워의 퀀트 재무 점수는 2.6점으로 지난 분기에 비해 성장성 점수가 하락했다. 이는 자기자본 증가율이 감소하였기 때문이다. 안정성 종합 점수는 부채비율 증가, 유동비율 감소로 하락했다. 수익성 측면에서 볼때 ROA, ROE, 영업이익률 모두 하락하여 이전보다 낮은 점수를 받았다. 주가등락폭은 다소 큰 편 최근 한달간 스틸플라워의 상장주식수 대비 거래량을 비교해보니 일별 매매회전율이 3.49%로 집계됐다. 동기간 일평균 주가변동률은 8.85%로 장중 저점과 고점의 차이가 매우 컸음을 알 수 있다. 'fnRASSI'는 증권전문 기업 씽크풀과 파이낸셜뉴스의 협업으로 로봇기자가 실시간으로 생산하는 기사입니다."
매일경제,087220,/news/news_read.nhn?article_id=0003660651&office_id=009&mode=search&query=스틸플라워&page=1,2016-01-08 10:18,"스틸플라워, 대우조선해양과 85억원 규모 납품 계약","스틸플라워는 대우조선해양과 85억4343만원 규모의 파이프(C/S WELDED PIPES) 납품 계약을 체결했다고 8일 공시했다. 이는 스틸플라워의 2014년 매출액 대비 4.26%에 해당한다. 계약기간은 오는 3월 30일까지다. [디지털뉴스국 김잔디 기자] r_start // r_end // [ⓒ 매일경제 & mk.co.kr, 무단전재 및 재배포 금지] 매일경제 관련뉴스해당 언론사에서 선정하며 언론사 페이지(아웃링크)로 이동해 볼 수 있습니다.이유비, 가슴 전부 드러내는 드레스 입고…""방송 사고 아니야? 男心 멘붕!""현대차, 국내 최초의 친환경 전용차 아이오닉 공개박병호 기자회견, ""악플러, 한 번 만나 함께 사진 찍고 싶다"" [MK포토]'응팔' 속 동룡이네 주택 알고 보니 前대통령 가옥'핫팬츠' 치어리더, 갑자기 고개 숙이더니…""속이 다 보이나? 화들짝 놀라"""
전자신문,087220,/news/news_read.nhn?article_id=0002612992&office_id=030&mode=search&query=스틸플라워&page=1,2017-05-30 10:05,"[ET투자뉴스]가스관 관련주테마, 스틸플라워, 동양철관 중심으로 강세","금일  현재, 가스관 관련주테마가 전일대비 3.62% 상승하며 강세를 보이고 있다. 상승폭으로는 스틸플라워 6%로 선두권에 있으며 동양철관(3.68%), 대동스틸(2.38%)도 강세이다. [테마내 주요종목 시세] * 스틸플라워 : 495원 (▲28) *동양철관:1,410원 (▲50) *대동스틸:4,955원 (▲115) [테마내 주요종목 재무요약] * 스틸플라워 : 영업이익률 현재 -16.73%로 업종평균 하회.  PBR은 0.73으로 다소 낮은편 * 동양철관 : 영업이익률 현재 -5.08%로 업종평균 하회.  PBR은 1.55임. * 대동스틸 : 영업이익률 현재 4.73%로 업종평균 수준. PBR은 0.77로 다소 낮은편 [테마내 종목별 외국인 지분변동] * 스틸플라워 :  최근 2주간 0.1%증가하여 현재 보유율은 0.91% * 동양철관 :  최근 2주간 -0.1%감소하여 현재 보유율은 1.66% * 대동스틸 :  최근 2주간 0.47%증가하여 현재 보유율은 3.41%"
머니투데이,087220,/news/news_read.nhn?article_id=0003544486&office_id=008&mode=search&query=스틸플라워&page=1,2015-09-16 14:34,"스틸플라워, 부유식 방파제 기술로 특허 취득","[머니투데이 이정혁 기자] 스틸플라워는 부유식 방파제와 관련된 기술로 특허권을 취득했다고 16일 공시했다. 회사 측은 ""부유식 방파제를 사용해 연근해 어장보호에 중요하게 활용할 계획""이라고 설명했다. textlinktopstart textlinktopend textlinkstart"
한국경제,087220,/news/news_read.nhn?article_id=0003487774&office_id=015&mode=search&query=스틸플라워&page=1,2015-11-27 17:01,"[마켓인사이트]네오플럭스, 스틸플라워 투자로 절반 이상 손실..'눈물의 매각'","이 기사는 11월27일(15:51) 자본시장의 혜안 ‘마켓인사이트’에 게재된 기사입니다 ----------------------------------------------------------- 두산그룹 계열의 사모펀드(PE) 회사인 네오플럭스가 상장사 스틸플라워에 투자했다가 50% 이상 손실을 보고 일부 지분을 처분했다. 최근 몇년 새 투자한 회사들도 대부분 수익률이 한 자리수에 그치거나 손실을 보고 매각하는 등 '투자 성적'이 저조하다는 평가다. 27일 금융감독원 전자공시시스템에 따르면 네오플럭스는 최근 코스닥 상장사 스틸플라워 지분 164만9942주를 장내에서 매도했다. 주당 매매가는 2275~2426원으로 약 30억원 규모다. 이에 따라 네오플럭스의 스틸플라워 지분은 기존(지난 신고 시점 기준) 108만8977주(13.92%)에서 106만3523주(3.31%)로 감소했다. 스틸플라워는 후육강관을 주로 생산, 포스코 등 대기업에 납품해 온 철강 기자재 업체다. 네오플럭스는 2009년 스틸플라워 상장 당시부터 투자자로 참여했다. 당시 185억9000만원을 투자해 108만8977주(13.92%)를 취득했다. 주당 단가는 1만277원 수준이었다. 그러나 철강업계의 업황 부진의 여파로 스틸플라워도 경영이 악화됐다. 2013년 적자 전환한 이후 지난해에도 2004억원의 매출에 226억원의 영업손실을 기록했다. 이때문에 주가도 꾸준히 하향 곡선을 그렸다. 스틸플라워는 경영 자금 확보를 위해 지난 4월 무상증자와 유상증자를 잇따라 진행했다. 무상증자에 따라 네오플럭스의 지분은 지난 5월 180만8977주에서 271만3465주로 늘었다. 다만 유상증자에는 참여하지 않아 전체 주식 대비 총 지분율은 8.43%로 감소한 상태였다. 증자로 인해 보유 물량이 기존 대비 50% 늘었음을 감안하더라도 네오플럭스의 손실은 상당할 전망이다. 주당 1만원대에 사들여 2000원대에 매각한 셈이기 때문이다. 다만 증자 이후 현재 남은 지분은 106만3523주(3.31%)다. 만약 이번과 같은 수준(2200~2300원)에서 남은 지분을 처분한다고 고려한다 해도 총 회수금액은 50억원대에 머무를 예정이다. 업계 관계자는 ""6년 전에 185억원을 투자했음을 감안하면 50% 원금도 지키지 못한 투자""라며 ""철강 업계 업황이 좋지 않아 당분간은 손실을 보전할 가능성이 낮아 보인다""라고 말했다."
아시아경제,087220,/news/news_read.nhn?article_id=0003675125&office_id=277&mode=search&query=스틸플라워&page=1,2016-01-27 10:39,"[특징주]스틸플라워, 사우디 3조원 규모 프로젝트 재개&hellip;&uarr;",[아시아경제 김원규 기자] 스틸플라워가 사이우아라비아 프로젝트가 재개됐다는 소식에 강세다. 27일 오전 10시39분 현재 스틸플라워는 전거래일 대비 5.77% 오른 1650원에 거래되고 있다. 잠정중단 된 것으로 알려졌던 사우디아라비아의 30억달러(약 3조원) 규모 프로젝트가 재개된 것으로 확인됐다. 이날 정부 관계자와 관련업계에 따르면 사우디아라비아의 국영석유기업 아람코(ARAMCO)가 발주하는 라스 타누라 클린퓨얼 프로젝트의 기술입찰서가 지난 14일 발급됐다. 송유관 등 특수 후육관 전문업체인 스틸플라워는 2012년 사우디 투자청으로부터 사우디아라비아에서 직접 영업이 가능한 라이센스를 취득과 함께 사우디 최대 석유 업체인 사우디 아람코의 공급업체로 등록할 수 있는 자격요건도 함께 획득했다.
아시아경제,087220,/news/news_read.nhn?article_id=0003865400&office_id=277&mode=search&query=스틸플라워&page=1,2016-11-08 13:59,"[특징주]스틸플라워, 특수강관개발 MOU&hellip;13% 상승","[아시아경제 박선미 기자]8일 스틸플라워가 한국해양과학기술원 산하의 선박해양플랜트연구소와 심해자원 개발용 기자재 공동 연구개발에 나선다는 소식에 주가 급등 중이다. 이날 오후 1시57분 현재 스틸플라워는 전일 대비 116원(13%) 오른 994원에 거래되고 있다. 이날 스틸플라워는 한국해양과학기술원 산하 선박해양플랜트연구소와 ‘심해자원 개발용 무계목강관 대체 소구경 SAW 강관 개발’을 골자로 하는 업무 협약(MOU)을 체결했다고 밝혔다. 이번 협약으로 양사는 심해저 광물자원 개발 분야의 기술개발을 위한 국가 연구개발 사업, 선박해양플랜트연구소 내부사업, 협약기관 간 상호 출자에 의한 공동연구사업 등에 제한을 두지 않는 상호협력 체계를 확립하게 됐다. 스틸플라워는 ""해양 플랜트 기자재 공동 연구개발을 위해 관련 물품과 기자재, 시험장소 제공 등에 적극 협력할 예정이며, 선박해양플랜트연구소는 연구개발과 설계엔지니어링, 안정성 및 신뢰성 평가를 통해 실용화 촉진에 속도를 낼 계획""이라고 설명했다. 이어 “아직 망간각 탐사광구 사업의 진행시기와 투자에 대한 구체적인 사항이 확정되지 않았지만, 정부가 사업을 진행할 경우 망간단괴 채굴 후 이동에 쓰이는 라이저파이프를 당사가 공급할 가능성이 높다”며, “이를 위해 이번 업무협약으로 실증단계를 뛰어넘어 실용화를 위한 연구가 진행 될 계획”이라고 덧붙였다."
머니투데이,087220,/news/news_read.nhn?article_id=0003618759&office_id=008&mode=search&query=스틸플라워&page=1,2016-01-25 13:27,스틸플라워 용접강관 가공기술 특허 획득,[머니투데이 우경희 기자] 스틸플라워는 용접 대구경 강관 내주면 버핑장치 특허를 획득했다고 25일 공시했다. 이는 용접 대구경강관의 용접부위를 간편하게 연마할 수 있도록 하는 기술이다. textlinktopstart textlinktopend textlinkstart
전자신문,087220,/news/news_read.nhn?article_id=0002547256&office_id=030&mode=search&query=스틸플라워&page=1,2016-11-08 14:12,[로봇뉴스]가스관 관련주 테마_스틸플라워 가장 안정적인 수익 올려,"지금 시점에서 가스관 관련주 테마의 종목들 중 하이스틸을 제외하고 모두 좋은 모습을 보여주고 있다. 가스관 관련주 테마지수는 994p로 전일보다 3.17% 상승하며 견조한 상승세를 나타내고 있는데 , 최근 10일 동안에는 -3.72% 하락하는 모습이다. 당일 테마 내 종목현황을 살펴보면 스틸플라워, 동양철관, 대동스틸이 각각 15.6%, 0.81%, 0.5% 오르며 상승세를 보이고 있다. 반면, 하이스틸은 -1.66% 하락하며 테마의 방향과는 반대되는 모습이다. [*가스관 관련주테마 994p(+3.17%)] ------ 종목명/등락율 ------ 스틸플라워/ +15.6% 동양철관/ +0.81% 대동스틸/ +0.5% ------"
머니투데이,087220,/news/news_read.nhn?article_id=0003923220&office_id=008&mode=search&query=스틸플라워&page=1,2017-08-22 17:24,"한국거래소, 스틸플라워 불성실공시법인 지정 예고",[머니투데이 진경진 기자] 한국거래소 코스닥시장본부는 스틸플라워 가 최대주주 변경을 수반하는 주식 담보제공 계약 체결 관련 공시를 불이행했다며 22일 불성실공시법인 지정을 예고했다.
이데일리,087220,/news/news_read.nhn?article_id=0003348783&office_id=018&mode=search&query=스틸플라워&page=1,2015-09-16 14:31,"스틸플라워, 소파기능 갖춘 부유식 방파제 특허권 취득",[이데일리 이명철 기자] 스틸플라워(087220)는 부유식 방파제에 대한 특허권을 취득했다고 16일 공시했다. 이 기술은 서남해 연근해에 설치된 양식·양어장을 태풍으로부터 보호하고 소파과정에서 발전기를 통해 전기에너지를 생산할 수 있다고 회사는 설명했다.
아이뉴스24,087220,/news/news_read.nhn?article_id=0000374070&office_id=031&mode=search&query=스틸플라워&page=1,2016-04-21 17:06,"스틸플라워, 태국서 71억원 규모 후육관 수주","[이원갑기자] 특수 후육관 제조사 스틸플라워(대표 김병권)가 연속으로 해외 수주 계약을 체결했다. 후육관은 해양 액화천연가스(LNG) 수송 등에 쓰이는 두꺼운 강관이다. 스틸플라워는 21일 태국 국영 석유 회사인 PTT익스플로레이션앤프로덕션(PTTEP)가 진행하는 자우티카(ZAWTIKA) 프로젝트에 쓰일 후육관의 공급계약을 체결했다고 발표했다. 계약 금액은 약 610만달러(71억원) 규모이며, 납기일은 오는 9월 30일까지다. 이번에 공급되는 특수 후육관은 PTTEP가 미얀마 자우티카에서 진행하는 해상 플랫폼 건설 프로젝트에 적용된다. 스틸플라워 관계자는 ""이번 PTTEP와의 공급 계약 규모가 그리 크지는 않지만 PTTEP는 다양한 유전 개발 프로젝트를 진행하고 있다""며 ""태국과 미얀마 원유 시장에서 PTTEP의 시장점유율이 높다는 점에서 이번 계약은 장기적인 프로젝트 거래로 연계될 수 있다는 장점이 있다""고 전했다. PTTEP는 태국 석유공사(PTT) 산하에 있으며, 미얀마 칼론과 자우티카에서 대규모 천연가스 채굴을 진행하며 태국의 원유 시장을 독점하고 있다. 우드맥킨지가 지난 2015년 발간한 보고서에 따르면 아시아 석유 기업들은 에너지 포트폴리오를 다변화해 성장을 도모하고 자국 에너지 수요에 대처하고 있다. 보고서는 아시아 석유 기업 중에 PTTEP의 오일샌드 개발이 가장 활발하고 비중도 가장 크다고 평가했다. 스틸플라워 김병권 대표이사는 ""인도 다만 프로젝트에서 아르셀로 미탈과 업무 제휴를 한 데 이어 이번 PTTEP의 미얀마 프로젝트까지 연속 수주 홈런을 쳤다""며 ""이번 수주 훈풍을 그동안의 해외 영업 부진을 극복하고 재도약하는 기점으로 삼겠다""고 자신했다. /이원갑기자"
한국경제,087220,/news/news_read.nhn?article_id=0003572180&office_id=015&mode=search&query=스틸플라워&page=1,2016-03-31 00:30,[코스닥 증자공시] (30일) 스틸플라워,▲스틸플라워=127억원 규모의 일반공모 유상증자 결정. [
이데일리,087220,/news/news_read.nhn?article_id=0003670839&office_id=018&mode=search&query=스틸플라워&page=1,2016-11-08 13:44,"[특징주]스틸플라워, 4000만톤 망각 이동용 강관 공급 기대 &uarr;","[이데일리 박형수 기자] 스틸플라워(087220)가 강세다. 정부가 국제해저기구(ISA) 총회에서 승인받은 망간각 광구 독점탐사에 참여할 것이라는 기대가 주가에 영향을 준 것으로 보인다. 대상지역은 서태평양 괌에서 약 1500km 떨어진 마젤란 해저산 주변으로 면적은 3000㎢ 규모다. 8일 오후 1시38분 스틸플라워는 전날보다 8.2% 오른 950원에 거래되고 있다. 이날 스틸플라워는 한국해양과학기술원 부설 선박해양플랜트연구소와 ‘심해자원 개발용 무계목강관 대체 소구경 SAW 강관 개발’을 골자로 하는 업무 협약(MOU)을 체결했다고 밝혔다. 스틸플라워는 해양 플랜트 기자재 공동 연구개발을 위해 관련 물품과 기자재, 시험장소 제공 등에 적극 협력한다. 선박해양플랜트연구소는 연구개발과 설계엔지니어링, 안정성, 신뢰성 평가를 통해 실용화 촉진에 속도를 낼 계획이다. 회사 관계자는 “업무협약은 정부가 추진 중인 망간각 탐사광구 개발사업에 참여하기 위한 기술개발의 일환”이라고 말했다. 망간단괴는 심해에 부존하는 광석으로 첨단산업의 기초소재로 쓰이는 니켈, 코발트, 구리 등 고부가가치 금속을 많이 함유하고 있다. 정부는 마젤란 해저산 지역에 약 4000만톤 이상의 망간각이 매장됐을 것으로 추정하고 있다. 연간 100만톤 상업생산에 들어가면 20년간 총 6조원의 주요광물자원 수입대체 효과가 있을 것으로 전망하고 있다. 회사 관계자는 “정부가 사업을 진행하면 망간단괴 채굴 후 이동에 쓰이는 라이저파이프를 스틸플라워가 공급할 가능성이 크다”고 말했다. 그는 “업무협약으로 실증단계를 뛰어넘어 실용화를 위한 연구를 진행할 계획”이라고 말했다."
연합뉴스,087220,/news/news_read.nhn?article_id=0008294555&office_id=001&mode=search&query=스틸플라워&page=1,2016-03-31 09:10,"&lt;특징주&gt; 스틸플라워, 대규모 증자 소식에 급락",(서울=연합뉴스) 유현민 기자 = 철강 제조업체인 스틸플라워가 대규모 유상증자 추진 소식에 31일 장 초반 급락세를 보이고 있다. 이날 오전 9시6분 현재 코스닥시장에서 스틸플라워는 전날보다 16.21% 떨어진 1천525원에 거래됐다. 스틸플라워는 운영자금 127억원을 마련하기 위해 일반 공모 방식의 유상증자를 결정했다고 전날 장 종료 후 공시했다. 신주는 보통주 1천만주이며 주당 발행가액은 1천270원이다.
머니투데이,087220,/news/news_read.nhn?article_id=0003605134&office_id=008&mode=search&query=스틸플라워&page=1,2015-12-30 11:23,"스틸플라워 &quot;한국스틸텍에 계약이행 내용증명, 법적 대응 준비&quot;","[머니투데이 서진욱 기자] 스틸플라워는 한국스틸텍과 체결한 405억원 규모의 제강 및 압연설비 건설공사 계약과 관련, 한국스틸텍에 계약 이행을 요구하는 내용증명을 보내고 법적 대응을 준비 중이라고 30일 공시했다. 현재까지 진행률은 7.57%로 진행금액은 30억원 정도다. textlinktopstart textlinktopend textlinkstart"
헤럴드경제,087220,/news/news_read.nhn?article_id=0001035895&office_id=016&mode=search&query=스틸플라워&page=1,2016-04-21 09:35,"스틸플라워, 태국 국영석유회사와 71억원 규모 공급계약 체결","[헤럴드경제=양영경 기자] 스틸플라워가 태국 국영석유회사와 71억원 규모 공급계약을 체결했다. 특수 후육관 전문기업 스틸플라워는 21일 태국 국영석유회사인 PTTEP(PTT Exploration and Production Public Company LimitedㆍPTT 익스플로레이션앤프로덕션)가 진행하는 ‘자우티카(ZAWTIKA) 프로젝트’의 후육관 공급계약을 체결했다고 밝혔다. 계약금액은 약 610만달러(한화 71억원) 규모이며 납기일은 오는 9월30일까지다. 이번에 공급하는 특수 후육관은 PTTEP가 미얀마 자우티카에서 진행하는 해상 플랫폼 구조물에 쓰인다. 스틸플라워 관계자는 “이번 계약을 체결한 PTTEP는 다양한 오일개발 프로젝트를 진행하고 있고 태국ㆍ미얀마 원유시장 내 시장점유율이 높다”며 “장기적인 프로젝트 거래처로 연계될 수 있을 것으로 기대한다”고 밝혔다. 태국 석유공사(PTT) 산하 PTTEP사는 아시아 최고의 에너지 개발기업의 하나로 꼽히고 있다. 미얀마 칼론과 자우티카에서 대규모 천연가스 채굴을 진행, 태국의 원유시장을 독점하고 있다. 지난해 우드맥킨지 보고서에 따르면 PTTEP는 아시아 석유기업 중 전 세계 오일샌드 개발 비중이 가장 큰 것으로 조사됐다. 김병권 스틸플라워 대표이사는 “지난번 아르셀로 미탈과의 업무제휴에 이어 PTTEP의 미얀마 프로젝트까지 연속 수주홈런을 치게 됐다”며 “글로벌 오일 프로젝트 재개가 수주 훈풍으로 이어지고 있어 그간의 해외영업 부진을 극복하고 재도약하는 터닝포인트가 될 것으로 보인다”고 말했다."
이데일리,087220,/news/news_read.nhn?article_id=0003670833&office_id=018&mode=search&query=스틸플라워&page=1,2016-11-08 13:36,"스틸플라워, 망간 채굴강관 MOU&hellip;망간각 독점탐사 참여 기대","- 정부, 지난 7월 망간각 독점탐사 광구권 최종 승인 - 20년간 총 6조원 주요광물자원 수입대체 효과 [이데일리 박형수 기자] 스틸플라워(087220)가 심해자원 개발에 필요한 강관 개발에 나선다. 스틸플라워는 한국해양과학기술원 부설 선박해양플랜트연구소와 ‘심해자원 개발용 무계목강관 대체 소구경 SAW 강관 개발’을 골자로 하는 업무 협약(MOU)을 체결했다고 8일 밝혔다. 스틸플라워와 선박해양플랜트연구소는 심해저 광물자원 개발 분야의 기술개발을 위한 국가 연구개발 사업, 협약기관 간 상호 출자에 의한 공동연구사업 등에 제한을 두지 않는 상호협력 체계를 확립했다. 스틸플라워는 해양 플랜트 기자재 공동 연구개발을 위해 관련 물품과 기자재, 시험장소 제공 등에 적극 협력한다. 선박해양플랜트연구소는 연구개발과 설계엔지니어링, 안정성, 신뢰성 평가를 통해 실용화 촉진에 속도를 낼 계획이다. 회사 관계자는 “업무협약은 정부가 추진 중인 망간각 탐사광구 개발사업에 참여하기 위한 기술개발의 일환”이라고 말했다. 이어 “소구경 SAW(Submerged Arc Welding; 잠호용접)방식 강관을 개발하면 해외 수입에 의존하던 라이저파이프를 국산으로 대체하는 효과를 가져올 수 있다”고 설명했다.앞서 정부는 지난 7월 열린 제22차 국제해저기구(ISA) 총회에서 망간각 독점탐사 광구권을 최종 승인 받았다. 대상지역은 서태평양 괌에서 약 1500km 떨어진 마젤란 해저산 주변으로 면적은 3000㎢ 규모다. 망간단괴는 심해에 부존하는 광석으로 첨단산업의 기초소재로 쓰이는 니켈, 코발트, 구리 등 고부가가치 금속을 많이 함유하고 있다. 정부는 해당지역에 약 4000만톤 이상의 망간각이 매장됐을 것으로 추정하고 있다. 연간 100만톤 상업생산에 들어가면 20년간 총 6조원의 주요광물자원 수입대체 효과가 있을 것으로 전망하고 있다. 회사 관계자는 “망간각 탐사광구 사업의 진행시기와 투자에 대한 구체적인 사항을 확정하지 않았다”며 “정부가 사업을 진행하면 망간단괴 채굴 후 이동에 쓰이는 라이저파이프를 스틸플라워가 공급할 가능성이 크다”고 말했다. 그는 “업무협약으로 실증단계를 뛰어넘어 실용화를 위한 연구를 진행할 계획”이라고 말했다. 앞서 스틸플라워는 무계목강관에서 한 단계 발전한 라이저파이프 자체 개발에 성공했다. 올해 초 선박해양플랜트연구소와 함께 망간단괴 채굴을 위한 양광시스템 실증에 성공했다."
전자신문,087220,/news/news_read.nhn?article_id=0002634573&office_id=030&mode=search&query=스틸플라워&page=1,2017-08-17 10:54,"[ET투자뉴스]가스관 관련주테마, 스틸플라워, 대동스틸 중심으로 강세","금일  현재, 가스관 관련주테마가 전일대비 3.04% 상승하며 강세를 보이고 있다. 상승폭으로는 스틸플라워 6.02%로 선두권에 있으며 대동스틸(3.8%), 동양철관(1.89%)도 강세이다. [테마내 주요종목 시세] * 스틸플라워 : 264원 (▲15) *대동스틸:5,740원 (▲210) *동양철관:1,350원 (▲25) [테마내 주요종목 재무요약] * 스틸플라워 : 영업이익률 현재 -23.87%로 업종평균 하회.  PBR은 0.49로 다소 낮은편 * 대동스틸 : 영업이익률 현재 10.28%로 업종평균 상회. PER은 6.51로 업종평균보다 낮으며, PBR은 0.88로 다소 낮은편. * 동양철관 : 영업이익률 현재 -7.15%로 업종평균 하회.  PBR은 1.37임. [테마내 종목별 외국인 지분변동] * 스틸플라워 :  최근 2주간 -0.31%감소하여 현재 보유율은 0.39% * 대동스틸 :  최근 2주간 -0.24%감소하여 현재 보유율은 0.35% * 동양철관 :  최근 2주간 -0.1%감소하여 현재 보유율은 1.21%"
