source,symbol,link,date,title,content
머니투데이,087220,/news/news_read.nhn?article_id=0004029180&office_id=008&mode=search&query=스틸플라워&page=1,2018-03-27 17:13,"스틸플라워, 박준석 대표 사임&hellip;김종룡 대표 체제 변경","[머니투데이 김사무엘 기자] 스틸플라워는 일신상의 사유로 박준석 대표이사가 사임한다고 27일 공시했다. 회사 경영은 김종룡, 박준석 각자 대표 체제에서 김종룡 대표 체제로 변경된다."
헤럴드경제,087220,/news/news_read.nhn?article_id=0000963561&office_id=016&mode=search&query=스틸플라워&page=1,2016-01-08 10:09,"&lt;생생코스닥&gt;스틸플라워, 대우조선해양과 85.4억 규모 공급계약",스틸플라워는 대우조선해양과 85억4343만원 규모의 C/S WELDED PIPES 제작납품계약을 체결했다고 8일 공시했다. 이는 2014년 매출액 대비 4.26%에 해당하며 계약기간은 오는 3월 30일까지다.
뉴스1,087220,/news/news_read.nhn?article_id=0002900301&office_id=421&mode=search&query=스틸플라워&page=1,2017-08-21 15:50,"포스코 투자한 스틸플라워, 대주주 지분 없어진 뒤에야 주담대 공시","김병권 스틸플라워 전 대표© News1 7개월 늑장공시...포스코, 투자금 170억원 날릴 처지 (서울=뉴스1) 강현창 기자 = 코스닥 상장사 스틸플라워가 반대매매로 대주주가 지분을 대부분 잃고 난 뒤에야 대주주가 주식담보대출을 받은 사실을 공시했다. 이 회사에 170억원 가량을 투자한 포스코는 대출 계약을 몰랐다는 입장이다. 투자금은 대부분 날릴 위기다. 파이프 전문 업체(강관) 스틸플라워는 대주주였던 김병권 전 대표가 지난해 12월 자기 지분주식 830만주를 담보로 30억원을 세종저축은행으로부터 빌렸다고 21일 공시했다. 7개월이나 지난 늑장공시다. 김 전 대표는 앞서 지난 3월 이사회의 결의로 회장직에서 물러난 상태다. 경영에서 물러난 뒤 4개월여가 지나도록 지분담보대출 사실을 공시하지 않았다. 게다가 이미 김 전 대표의 지분은 대부분 반대매매됐다. 지난 17일 스틸플라워는 세종저축은행이 담보로 잡은 지분 646만7542주를 매도해 김 대표의 지분율이 2.59%로 떨어졌다고 공시했다. 뱐대매매로 대주주의 지분 대부분이 시장에 풀렸지만 공시가 없어 다른 주주들은 이 소식을 알 수가 없었다. 현재 스틸플라워는 5%이상을 가진 주주가 없다. 새로 대주주가 된 포스코도 지분율은 3.33%에 불과하다. 포스코는 지난 2011년 스틸플라워의 3자배정 유상증자에 참여해 170억원을 출자하고 지분 10.96%를 확보했었다. 이후 2015~2016년 있었던 총 세차례의 유상증자에는 참여하지 않아 지분율이 3.33%까지 떨어졌다. 현재 스틸플라워의 재무상황은 심각하다. 최근 4개 사업연도 연속 영업손실을 기록해 관리종목으로 지정된 상태다. 지난 2분기 연결기준 영업손실은 139억원에 달했다. 반기 누적 적자 규모는 240억원 수준이다. 최대주주 변경 사실이 알려지면서 한국거래소는 스틸플라워를 최근 상장적격성 실질심사 대상으로 지정했다. 주식은 지난 18일부터 거래정지 중이다. 관리종목의 대주주 변경은 상장적격성 실질심사 대상이다. 거래소는 스틸플라워에 대해 15거래일 동안 상장적격성 심사 대상 여부를 결정한 뒤 심사 대상으로 결론이 날 경우 상장폐지 심사를 진행할 예정이다. 만약 스틸플라워가 상장폐지 될 경우 포스코의 투자도 실패로 끝난다. 포스코가 참여한 유증 당시 스틸플라워의 신주 발행가액은 주당 1만650원이었지만, 현재 주가는 266원으로 동전주에 불과하다."
이데일리,087220,/news/news_read.nhn?article_id=0003521620&office_id=018&mode=search&query=스틸플라워&page=1,2016-04-14 11:03,"[특징주]스틸플라워, 세계최대 철강업체 업고 해외시장 개척 &uarr;",[이데일리 박형수 기자] 스틸플라워(087220)가 세계최대 철강업체 아르셀로미탈과 사업협약 관련 전략적 제휴를 체결했다는 소식에 강세다. 14일 오전 11시1분 스틸플라워는 전날보다 6.48% 오른 1555원에 거래되고 있다. 이날 스틸플라워는 아르셀로미탈과 사업협약 관련 전략적 제휴를 체결했다고 밝혔다. 협약 당사자는 아르셀로미탈 그룹 내 전 세계 파이프와 플레이트사업을 총괄하는 아르셀로미탈프로젝트(ArcelorMittal Projects·AMP)다. 관계자는 “사업제휴와 맞물려 AMP가 추진하는 인도의 다만(DAMAN) 프로젝트에 약 4500톤 규모의 후육관도 공급한다”고 설명했다. 스틸플라워는 AMP라는 강력한 해외 영업채널을 확보하게 됨에 따라 전 세계 오일개발 프로젝트와 해양플랜트에 참여할 토대를 확보했다. 협약에 따라 AMP는 전 세계 주요 프로젝트에서 스틸플라워의 후육관 제품에 대한 판매와 마케팅을 담당한다. 프로젝트의 핵심 원재료인 플레이트의 원활한 수급을 위해 스틸플라워에 금융지원도 한다.
서울경제,087220,/news/news_read.nhn?article_id=0002792526&office_id=011&mode=search&query=스틸플라워&page=1,2016-01-25 16:21,스틸플라워,"스틸플라워(087220)는 용접 대구경 강관 내주면 버핑장치에 대한 특허권을 취득했다. 본 특허는 용접 대구경 강관 내주면 버핑장치에 관한 것으로, 더 자세하게는 좌우방향으로 이송되는 회전축 및 버핑헤드를 사용하여 용접 대구경 강관의 내주면의 용접부위 등을 간편하게 연마할 수 있도록 한 기술이다. 특허 취득일자는 2016년 1월 25일이다."
연합뉴스,087220,/news/news_read.nhn?article_id=0009986153&office_id=001&mode=search&query=스틸플라워&page=1,2018-03-27 17:22,"스틸플라워, 김종룡 단독 대표이사 체제로 변경",(서울=연합뉴스) 전명훈 기자 = 스틸플라워는 박준석 대표가 일신상 이유로 사임해 기존 김종룡·박준성 각자대표 체제에서 김종룡 단독 대표이사 체제로 변경됐다고 27일 공시했다.
아이뉴스24,087220,/news/news_read.nhn?article_id=0000373471&office_id=031&mode=search&query=스틸플라워&page=1,2016-04-14 11:33,"스틸플라워, 세계 1위 철강사 아르셀로미탈과 파트너십","[김다운기자] 특수 후육관 전문기업 스틸플라워는 14일 세계 최대의 철강회사인 아르셀로미탈과 사업협약관련 전략적 제휴를 체결했다고 발표했다. 협약 당사자는 아르셀로미탈 그룹 내 전 세계 파이프와 플레이트사업을 총괄하는 아르셀로미탈프로젝트(AMP)다. 이번 사업제휴와 맞물려 AMP가 추진하는 인도의 다만(DAMAN) 프로젝트에 약 4천500톤의 후육관 수주계약도 체결했다. 계약금은 약 290만 달러(약 33억원)이며, 계약금 중 70%에 해당되는 약 200만 달러는 원재료 구매조건으로 AMP가 선 지원했다. 이로써 스틸플라워는 AMP라는 강력한 해외 영업채널을 확보해 전 세계적으로 재개되는 오일개발 프로젝트 및 해양플랜트 대상 수주를 강화할 수 있는 토대를 확보했다는 설명이다. 이번 협약에 따라 AMP는 자사가 진행하는 전 세계 주요 프로젝트에서 스틸플라워의 후육관 제품에 대한 세일즈와 마케팅을 담당한다. 프로젝트의 핵심 원재료인 플레이트의 원활한 수급을 위해 스틸플라워에 대한 금융지원도 포함시켰다. 스틸플라워 해외영업 관계자는 ""최근 몇 년간 글로벌 경기 위축 및 유 가하락으로 대규모 오일 프로젝트가 지연된 바 있지만, 최근 이란 경제제재 해제나 중동 프로젝트가 기지개를 켜는 분위기""라며 ""되살아나는 시장에 편승해 글로벌 기업과의 사업제휴로 해외수주의 고삐를 당겨 턴어라운드의 기회를 모색하겠다""고 전했다. /김다운기자"
뉴시스,087220,/news/news_read.nhn?article_id=0006973892&office_id=003&mode=search&query=스틸플라워&page=1,2016-01-08 10:15,"스틸플라워, 대우조선해양과 85억 규모 계약체결","【서울=뉴시스】 강관 제조업체인 스틸플라워는 대우조선해양(DSME)과 85억4343만원의 ‘C/S WELDED PIPES 제작납품’ 계약을 체결했다고 8일 공시했다. 이는 매출액대비 4.3%에 해당하고 계약기간은 3월30일까지다. ★ 세상에 이런일이 -  경찰·군인, 경계근무 중 집단 ´퇴폐 파티´ ★ 오늘의 핫 포토 -  ´달샤벳´ 수빈, 아찔한 포즈"
이데일리,087220,/news/news_read.nhn?article_id=0003904134&office_id=018&mode=search&query=스틸플라워&page=1,2017-08-22 17:36,"스틸플라워, 불성실공시법인 지정 예고",[이데일리 오희나 기자] 한국거래소 코스닥시장본부는 스틸플라워(087220)가 최대주주 변경을 수반하는 주식 담보제공 계약 체결 관련 공시를 불이행했다며 22일 불성실공시법인 지정을 예고했다.
전자신문,087220,/news/news_read.nhn?article_id=0002547249&office_id=030&mode=search&query=스틸플라워&page=1,2016-11-08 14:12,[로봇뉴스]가스관 관련주 테마_스틸플라워 가장 안정적인 수익 올려,"   ◆가스관 관련주 테마 동향_스틸플라워 15.6%로 테마 내 상승 최대지금 시점에서 가스관 관련주 테마의 종목들 중 하이스틸을 제외하고 모두 좋은 모습을 보여주고 있다. 가스관 관련주 테마지수는 994p로 전일보다 3.17% 상승하며 견조한 상승세를 나타내고 있는데 , 최근 10일 동안에는 -3.72% 하락하는 모습이다. 당일 테마 내 종목현황을 살펴보면 스틸플라워, 동양철관, 대동스틸이 각각 15.6%, 0.81%, 0.5% 오르며 상승세를 보이고 있다. 반면, 하이스틸은 -1.66% 하락하며 테마의 방향과는 반대되는 모습이다. 가스관 관련주(지수:994   전일비:▲3.17%)◆테마구성종목종목명현재가전일비등락율거래량스틸플라워1,015▲13715.6%10,709,885동양철관1,250▲100.8%517,916대동스틸4,040▲200.5%22,417하이스틸20,750▼-350-1.7%815 [최근 10거래일 수익률 비교 곡선] ◆가스관 관련주 테마 동조화 분석_주도주 찾기 힘들어가스관 관련주 테마 내 종목들은 최근 20거래일(4주) 사이에 네 번 동조화 현상을 보여주었는데, 종목에 대한 테마의 영향력이 작용하는 것으로 나타났다. 테마가 뚜렷하게 동조화 현상을 보이며 움직인 날만을 5일간 모아 등락률을 살펴봤을 때, 하락하면서 동조화 모습을 보인 경우가 더 많았고, 이는 시장에서 경계감이 커지고 있어 리스크를 관리할 필요가 있다는 것을 의미한다. 종목별로는 특별히 동테마 내에서 주도적으로 움직인 종목을 찾기가 어렵다. 상승순위(등락률%)일자동양철관대동스틸하이스틸스틸플라워테마지수11/083(0.81)4(0.5)5(-1.66)1(15.6)2(3.17)10/315(-8.3)4(-5.95)1(-0.92)2(-3.92)3(-4.77)10/281(-0.75)2(-0.94)3(-1.81)5(-4.67)4(-2.02)10/263(-2.24)5(-5.36)2(-1.97)1(-1.95)4(-2.9)10/202(-2.44)1(0.12)4(-3.02)5(-5.08)3(-2.6)전체순위25314※ 전체순위는 각 종목의 순위 합계가 낮은 순으로 정함. ◆가스관 관련주 테마 종목 종합평가_스틸플라워 가장 안정적인 수익 올려전체적인 평가에서는 스틸플라워가 높은 순위를 차지했다. 최근 10거래일(2주)을 분석했을때, 모든 종목 중 스틸플라워(-0.96%)가 비교적 하락폭이 작은 모습을 나타냈다. 위험도 분석에서는 스틸플라워(0.52)가 상대적으로 안정적인 수익을 올린 것으로 평가되고 있다. 등락률, 변동성(%)동양철관대동스틸하이스틸스틸플라워테마지수등락률-6.71-9.82-8.98-0.96-5.93변동성3.453.372.618.282.68위험도0.370.310.290.520.37전체순위25413※ 전체순위는 동조화, 등락률, 위험도, 변동성 대비 등락률의 순위를 더해 낮은 순으로 정함.※ 변동성은 10일간의 표준편차임. 변동성이 클수록 주가는 평균 등락률을 중심으로 넓게 분포.※ 위험도 = 상승합 / (상승합 + |하락합|), [1(안전) &lt;--&gt; 0.5(중립) &lt;--&gt; 0(위험)]"
아시아경제,087220,/news/news_read.nhn?article_id=0003723665&office_id=277&mode=search&query=스틸플라워&page=1,2016-04-07 19:20,"스틸플라워, 불성실공시법인 지정",[아시아경제 임온유 기자] 한국거래소는 스틸플라워를 최대주주 변경을 수반하는 주식 담보제공 계약체결을 지연 공시한 이유로 불성실공시법인으로 지정했다고 7일 공시했다.
전자신문,087220,/news/news_read.nhn?article_id=0002610698&office_id=030&mode=search&query=스틸플라워&page=1,2017-05-22 09:35,"[ET투자뉴스]가스관 관련주테마, 스틸플라워, 동양철관 중심으로 강세","금일  현재, 가스관 관련주테마가 전일대비 5.79% 상승하며 강세를 보이고 있다. 상승폭으로는 스틸플라워 16.08%로 선두권에 있으며 동양철관(13.57%), 대동스틸(5.24%)도 강세이다. [테마내 주요종목 시세] * 스틸플라워 : 498원 (▲69) *동양철관:1,590원 (▲190) *대동스틸:5,420원 (▲270) [테마내 주요종목 재무요약] * 스틸플라워 : 영업이익률 현재 -16.73%로 업종평균 하회.  PBR은 0.57로 다소 낮은편 * 동양철관 : 영업이익률 현재 -5.08%로 업종평균 하회.  PBR은 1.4임. * 대동스틸 : 영업이익률 현재 4.73%로 업종평균 수준. PBR은 0.78로 다소 낮은편 [테마내 종목별 외국인 지분변동] * 스틸플라워 :  최근 2주간 2.26%증가하여 현재 보유율은 3.03% * 동양철관 :  최근 2주간 0.45%증가하여 현재 보유율은 2.08% * 대동스틸 :  최근 2주간 0.37%증가하여 현재 보유율은 3.58%"
머니투데이,087220,/news/news_read.nhn?article_id=0003592548&office_id=008&mode=search&query=스틸플라워&page=1,2015-12-07 16:48,"스틸플라워, 포스코 지분율 10.96%&rarr;7.46%","[머니투데이 백지수 기자] 스틸플라워는 10% 이상 주주 포스코(POSCO)의 주식수가 80만주 증가했지만 지분율은 이전보다 3.5%포인트 줄어 7.46%로 집계됐다고 7일 공시했다. 회사측은 ""포스코가 지난 5월 유상증자에는 참여하지 않았지만 기존 보유분에 대한 무상신주를 취득해 주식수는 증가하고 보유 비율은 감소했다""고 설명했다. textlinktopstart textlinktopend textlinkstart"
이데일리,087220,/news/news_read.nhn?article_id=0003667305&office_id=018&mode=search&query=스틸플라워&page=1,2016-11-03 13:51,"스틸플라워, 유상증자 최종발행가액 669원",[이데일리 송이라 기자] 스틸플라워(087220)는 기명식 보통주 3000만주에 대한 유상증자 최종발행가액이 669원으로 결정됐다고 3일 공시했다.
한국경제,087220,/news/news_read.nhn?article_id=0003581868&office_id=015&mode=search&query=스틸플라워&page=1,2016-04-20 09:31,"스틸플라워, 맥스블록 신규 성장동력으로",후육강관 전문 제조업체인 스틸플라워가 신시장 개척에 나섰다. 철로 만든 방파제 구조물(소파블록)인 ‘맥스블록’(max block)을 앞세워서다. 국내에는 2500여개의 방파제가 구축돼 있다. 파도로부터 항만 내부의 시설물을 보호하고 해안의 유실을 방지하기 위해서다. 방파제 신축 및 유지 보수에 연 평균 1조원 규모의 예산이 집행되고 있다. 현재까지 방파제 구축에 쓰이는 소파블록은 대부분 삼각뿔 모양의 콘크리트구조물로 돼 있었다. 매년 반복되는 태풍으로 소파블록의 파손 및 유실이 빈번하게 발생했다. 스틸플라워는 기존 콘크리트 소파블록보다 내구성과 경제성이 뛰어나고 친환경적인 철재 소파블록 ‘맥스블록’ 개발에 성공해 국내 방파제 가운데 10% 이상의 수요를 확보할 것으로 기대하고 있다. 맥스블록은 기존 콘크리트 제품에 비해 내구연한은 50년까지 연장되고 설치 개수가 14% 절감되며 유지보수비용이 적게 드는 등 경제적 효율성 면에서 기존 제품을 앞서는 것으로 평가받고 있다. 국내를 비롯해 4개국에서 특허를 받았다. 맥스블록은 콘크리트 제품의 유독성으로 인한 연안의 백화현상(갯녹음)이 없기 떄문에 친환경적이어서 동남아 국가로의 수출도 기대되고 있다.
머니투데이,087220,/news/news_read.nhn?article_id=0003661215&office_id=008&mode=search&query=스틸플라워&page=1,2016-04-07 19:12,"스틸플라워, 불성실공시법인 지정",[머니투데이 강기준 기자] 한국거래소는 스틸플라워에 대해 최대주주 변경을 수반하는 주식 담보제공 계약체결 지연공시로 불성실공시법인으로 지정한다고 7일 공시했다. textlinktopstart textlinktopend textlinkstart
매일경제,087220,/news/news_read.nhn?article_id=0003832900&office_id=009&mode=search&query=스틸플라워&page=1,2016-11-08 15:34,"스틸플라워, 선박해양플랜트연구소와 특수강관개발 MOU 체결","스틸플라워는 최근 한국해양과학기술원 부설 선박해양플랜트연구소와 ‘심해자원 개발용 무계목강관 대체 소구경 잠호용접(SAW) 강관 개발’을 골자로 하는 업무협약(MOU)을 체결했다고 8일 밝혔다. 두 회사는 이번 협약으로 심해저 광물자원 개발 분야의 기술개발을 위한 국가 연구개발 사업, 선박해양플랜트연구소 내부사업, 협약기관 간 상호 출자에 의한 공동연구사업 등에 제한을 서로 협력한다. 스틸플라워 관계자는 “이번 업무협약은 정부가 추진 중인 망간각 탐사광구 개발사업에 참여하기 위한 기술개발의 일환”이라며 “소구경 SAW 방식 강관 개발이 완료되면 해외 수입에 의존하던 라이저파이프를 국산으로 대체하는 효과를 가져올 수 있다”고 강조했다. 회사는 정부가 망간각 탐사광구 사업을 진행하면 라이저파이트에 대한 수요가 늘어날 것으로 기대하고 있다. 아직 사업 진행 시기와 투자에 대한 구체적인 사항은 확정되지 않았다. 정부는 지난 7월 제22차 국제해저기구(ISA) 총회에서 망간각 독점탐사 광구권을 최종 승인받았다. 대상지역은 서태평양 괌에서 약 1500km 떨어진 마젤란 해저산 주변으로 면적은 3000㎢ 규모다. 정부는 해당 지역에 약 4000만톤 이상의 망간각이 매장되어 있을 것으로 추정하고 있다. [디지털뉴스국 박진형 기자] r_start // r_end //"
매일경제,087220,/news/news_read.nhn?article_id=0003714506&office_id=009&mode=search&query=스틸플라워&page=1,2016-04-14 13:31,"스틸플라워, 아르셀로미탈과 파트너십 체결","스틸플라워 부사장 진태준(사진 오른쪽)과 아르셀로미탈 그룹 DSI(Distribution Solutions International) 부문 CEO 요하네스 스레이버르(Mr. Johannes De Schrijver)는 파트너쉽 계약 체결 후 기념 포즈를 취하고 있다. 특수 후육관 전문기업 스틸플라워는 다국적 철강사인 아르셀로미탈과 사업협약관련 전략적 제휴를 체결했다고 14일 발표했다. 협약 당사자는 아르셀로미탈 그룹 내 전세계 파이프와 플레이트사업을 총괄하는 아르셀로미탈프로젝트(ArcelorMittal Projects; 이하 AMP)다. 스틸플라워는 AMP가 추진하는 인도의 다만(DAMAN) 프로젝트에 약 4500t 규모의 후육관 수주계약도 체결했다. 계약금은 약 290만달러(한화 33억원)로 70%에 해당하는 약 200만달러는 원재료 구매조건으로 AMP가 선지원했다. 이번 협약에 따라 AMP는 자사가 진행하는 전세계 주요 프로젝트에서 스틸플라워의 후육관 제품에 대한 판매와 마케팅을 담당하게 된다. 스틸플라워 관계자는 “최근 몇 년간 글로벌 경기 위축, 유가하락으로 대규모 오일 프로젝트가 지연된 바 있지만 최근 이란 경제제재 해제나 중동 프로젝트가 기지개를 켜는 분위기”라며 “글로벌 기업과의 사업제휴로 해외수주의 고삐를 당겨 턴어라운드의 기회를 모색하겠다”고 말했다. [디지털뉴스국 김경택 기자] r_start // r_end // [ⓒ 매일경제 & mk.co.kr, 무단전재 및 재배포 금지] 매일경제 관련뉴스해당 언론사에서 선정하며 언론사 페이지(아웃링크)로 이동해 볼 수 있습니다.장쯔이 딸 백일잔치 중 '의붓딸 눈물 펑펑'…무슨 일?새누리 참패…民心은 오만을 심판했다'대타 출전' 이대호, 연장 10회말 끝내기 홈런…시즌 2호'11명 사망' 독일 열차 충돌사고, 원인은 고작…'역시 송중기' ""朴 대통령 눈에서 꿀 뚝뚝 떨어지네~"""
이데일리,087220,/news/news_read.nhn?article_id=0004087562&office_id=018&mode=search&query=스틸플라워&page=1,2018-04-26 09:12,"[특징주]&lsquo;상장폐지&rsquo; 스틸플라워, 정리매매 2일차 급등",[이데일리 이명철 기자] 상장폐지 결정에 따른 정리매매 절차를 밟고 있는 스틸플라워(087220)가 급등세를 나타내고 있다. 25.49% 오른 64원을 기록 중이다. 전날 80% 이상 급락했으나 이날 장 초반 매수세가 몰리면서 크게 오른 것이다. 정리매매는 가격제한폭 30분 간격으로 단일가격에 의한 개별 경쟁 매매가 실시된다. 앞서 회사는 감사범위 제한 및 계속기업 존속능력에 대한 불확실성에 따른 감사의견 거절을 사유로 상장폐지가 확정됐다. 정리매매는 전날부터 시작해 내달 4일까지 진행할 예정이다. 상장 폐지일은 내달 8일이다.
뉴시스,087220,/news/news_read.nhn?article_id=0008134566&office_id=003&mode=search&query=스틸플라워&page=1,2017-08-22 17:41,"거래소, 스틸플라워 불성실공시법인 지정 예고",【서울=뉴시스】 이진영 기자 = 한국거래소 코스닥시장본부는 스틸플라워(087220)가 최대주주 변경을 수반하는 주식 담보제공 계약 체결 공시 의무를 불이행했다며 불성실공시법인으로 지정을 예고한다고 22일 공시했다.
머니투데이,087220,/news/news_read.nhn?article_id=0003609951&office_id=008&mode=search&query=스틸플라워&page=1,2016-01-08 10:09,"스틸플라워, 85억원 규모 납품 계약 체결",[머니투데이 박다해 기자] 스틸플라워는 대우조선해양과 85억원 규모의 'C/S WELDED PIPES 제작납품' 계약을 체결했다고 8일 공시했다. 이는 최근 매출액 대비 4.26% 규모로 계약기간은 오는 3월 30일이다. textlinktopstart textlinktopend textlinkstart
아시아경제,087220,/news/news_read.nhn?article_id=0004059750&office_id=277&mode=search&query=스틸플라워&page=1,2017-08-22 17:51,"거래소, 스틸플라워 불성실 공시법인 지정 예고",[아시아경제 이선애 기자] 한국거래소 코스닥시장본부는 22일 철강관 제조업체인 스틸플라워가 최대주주 변경을 수반하는 주식담보제공 계약체결에 관련된 공시를 이행하지 않았다며 불성실 공시법인 지정을 예고했다. 정시한은 다음 달 14일이다.
헤럴드경제,087220,/news/news_read.nhn?article_id=0001031797&office_id=016&mode=search&query=스틸플라워&page=1,2016-04-14 11:31,"스틸플라워, 글로벌 철강사 &lsquo;아르셀로미탈&rsquo;과 전략적 제휴","[헤럴드경제=양영경 기자] 특수 후육관 전문기업 스틸플라워가 세계 최대 철강회사인 아르셀로미탈과 사업협약 관련 전략적 제휴를 체결했다고 14일 밝혔다. 협약 대상은 아르셀로미탈 그룹 내 파이프와 플레이트사업을 총괄하는 ‘아르셀로미탈프로젝트’(ArcelorMittal Projectsㆍ이하 AMP)다. 스틸플라워는 이날 AMP가 추진하는 인도의 다만(DAMAN) 프로젝트에 약 4500톤의 후육관 수주계약도 체결했다. 계약금은 약 290만 달러(한화 33억원)이며 이중 약 200만 달러는 원재료 구매조건으로 AMP가 선지원한다. (왼쪽부터) 요하네스 스레이버르(Mr. Johannes De Schrijver) 아르셀로미탈 그룹 DSI(Distribution Solutions International) 부문 CEO, 진태준 스틸플라워 부사장이 파트너쉽 계약 체결 후 기념 포즈를 취하고 있다. AMP는 자사가 진행하는 전 세계 주요 프로젝트에서 스틸플라워의 후육관 제품에 대한 세일즈와 마케팅을 담당한다. 아울러 프로젝트의 핵심 원재료인 플레이트의 원활한 수급을 위해 스틸플라워에 대한 금융지원도 나선다. 스틸플라워 관계자는 “최근 몇 년간 글로벌 경기 위축과 유가하락으로 대규모 오일 프로젝트가 지연됐지만 최근 이란 경제제재 해제나 중동 프로젝트가 기지개를 켜는 분위기” 라며 “되살아나는 시장 분위기에 더불어 글로벌 기업과의 사업제휴로 턴어라운드의 기회를 모색 하겠다”고 말했다. 한편 스틸플라워는 오일ㆍ가스관 외 해양플랜트 구조물, 철재 소파블록, 3D 곡가공 등 신제품 파이프라인 확장에 주력해왔다."
