source,symbol,link,date,title,content
파이낸셜뉴스,089980,/news/news_read.nhn?article_id=0003832381&office_id=014&mode=search&query=상아프론테크&page=1,2017-06-21 14:53,"[fnRASSI]상아프론테크, 52주 신고가...2.4% &uarr;","상아프론테크(089980)는 52주신고가를 기록하고 있어 주목할만하다. 동종목의 현재 주가는 14,950원 선에서 이루어지고 있다. 거래일을 기준으로 최근 3일간 평균 거래량은 75만 주이다. 이는 60일 일 평균 거래량 39만 주와 비교해보면 최근 거래량이 다소 증가했다는 것을 알 수 있다. 개인투자자의 거래비중이 가장 높아 최근 한달간 주체별 거래비중을 살펴보면 개인이 전체 거래량의 88.97%를 차지하며 가장 활발한 참여를 보였고, 외국인은 5.7%, 기관은 5.31%의 거래 참여율을 보였다. 그리고 최근 5일간 거래비중은 개인이 90.51%로 가장 높은 참여율을 보였고, 외국인이 5.31%를 보였으며 기관은 4.16%를 나타냈다. 퀀트 재무분석, 종합점수 44점으로 상승                    지표               항목               값               종합점수                 성장성               매출액증가율               0.07               7.71                 자기자본증가율               0.07                 안정성               부채비율               109.07               7.08                 유동비율               110.13                 이익안정성               8.89                 수익성               ROA               3.11               6.22                 ROE               6.5                 영업이익율               6.74          상아프론테크의 퀀트 재무 점수는 21.01점으로 3개월 이전 20.61점보다 올랐다. 지난 분기에 비해 성장성 점수가 상승했다. 이는 자기자본 증가율이 증가하였기 때문이다. 부채비율이 상승하여 안정성 종합 점수는 하락했다. 수익성 측면에서 볼때 ROA, ROE, 영업이익률 모두 개선되어 이전보다 좋은 점수를 받았다. 'fnRASSI'는 증권전문 기업 씽크풀과 파이낸셜뉴스의 협업으로 로봇기자가 실시간으로 생산하는 기사입니다."
파이낸셜뉴스,089980,/news/news_read.nhn?article_id=0003830165&office_id=014&mode=search&query=상아프론테크&page=1,2017-06-16 09:17,"[fnRASSI]상아프론테크, 52주 신고가...2.52% &uarr;","상아프론테크(089980)는 52주신고가를 기록하고 있어 주목할만하다. 동종목의 현재 주가는 14,250원 선에서 이루어지고 있다. 거래일을 기준으로 최근 3일간 평균 거래량은 74만 주이다. 이는 60일 일 평균 거래량 36만 주와 비교해보면 최근 거래량이 급격히 늘어났다는 것을 알 수 있다. 상장주식수 대비 거래량은 2.7%로 적정수준 최근 한달간 상아프론테크의 상장주식수 대비 거래량을 비교해보니 일별 매매회전율이 2.7%로 집계됐다. 그리고 동기간 장중 저점과 고점의 차이인 일평균 주가변동률을 5.52%를 나타내고 있다. 외국인, 기관 모두 보유량 증가 (5일 누적) 최근 5일간 동종목의 외국인 투자자는 42,587주 순매수하였고 마찬가지로 기관은 28,131주 순매수하였다. 전날 두 주체 각각 41,802주, 28,131주 순매수하며 보유 비율을 늘렸다. 다음 표는 동종목의 외국인, 기관의 일별 순매수량을 나타낸 것이다. 'fnRASSI'는 증권전문 기업 씽크풀과 파이낸셜뉴스의 협업으로 로봇기자가 실시간으로 생산하는 기사입니다."
이데일리,089980,/news/news_read.nhn?article_id=0003547771&office_id=018&mode=search&query=상아프론테크&page=1,2016-05-20 14:09,"프랭클린템플턴투신운용, 상아프론테크 지분 5.33% 보유 중",[이데일리 이명철 기자] 집합투자·투자일임업체인 프랭클린템플턴투신운용은 상아프론테크(089980) 지분 5.33%(70만3144주)를 보유하고 있다고 20일 공시했다.
한국경제,089980,/news/news_read.nhn?article_id=0003594585&office_id=015&mode=search&query=상아프론테크&page=1,2016-05-16 10:03,"상아프론테크, 1분기 영업이익 17억6000만원&hellip;전년比 25%&uarr;","[ 김아름 기자  ] 상아프론테크는 올 1분기 영업이익이 17억6000만원을 기록, 전년 동기 대비 25% 늘어났다고 16일 밝혔다. 같은 기간 매출액은 6.3% 늘어난 380억3500만원, 당기순이익은 일회성 법인세 증가로 인해 200만 원 적자를 기록했다. 회사 측은 ""신규 사업인 반도체 소재 납품이 본격화되고 중대형 전지 부품(EV, ESS용) 사업의 매출 증가와 고정비율 하락으로 전체 매출과 영업이익이 모두 성장했다""며 ""공정 개선과 수율 개선 등 원가절감 노력도 실적 성장의 주요 요인으로 작용했다""고 설명했다. 회사는 당분간 신사업 분야의 매출이 꾸준히 증가할 것으로 예상하고 있다. 특히, 최근 중대형 2차전지 시장이 빠른 성장세를 보이는 만큼 전지 부품 매출 성장의 폭도 증가할 것으로 기대하고 있다. 이상원 상아프론테크 대표는 ""상아프론테크는 독보적 기술력과 제품 경쟁력을 바탕으로 매출처다변화에 성공해, 안정적 매출 성장세를 이어오고 있다""며, ""앞으로도 시장에 변화에 발 빠르게 대처해 지금의 성장세를 이어 갈 수 있도록 최선을 다하겠다""고 말했다. 김아름 한경닷컴 기자"
파이낸셜뉴스,089980,/news/news_read.nhn?article_id=0003659267&office_id=014&mode=search&query=상아프론테크&page=1,2016-06-07 09:44,"유진투자證 &quot;테슬라, 미세먼지 정책으로 국내 친환경에너지 업체 수혜 예상...삼성...","삼성SDI,상아프론테크,포스코ICT 등이 친환경정책 수혜주로 주목받고 있다. 유진투자증권은 7일 “삼성SDI가 전기자동차업체 테슬라의 배터리 공급업체로 선정됐다는 일본 언론 보도가 신빙성이 높고, 국내 미세먼지 개선 정책발표는 정책이 친환경에너지중심으로 변화하는 분수령”이라며 국내 친환경에너지 관련업체들이 수혜를 받을 것으로 내다봤다. 유진투자증권이 삼성SDI(목표주가 16만원), 상아프론테크(목포주가 1만6000원), 포스코ICT(목표주가 7200원), 동국S&C(목표주가 7500원)등을 친환경정책 수혜주로 추천했다. 유진투자증권 한병화 연구원은 “테슬라의 모델3 대규모 선행주문과 2020년 이후 연간 100만대 수준의 판매계획을 달성하기 위해서는 파나소닉 하나만으로 배터리 공급을 감당하기 어렵다”며 “배터리 가격 하락을 유도하고 공급의 유연성을 위해 삼성SDI와 같은 새로운 파트너가 필요하다”고 지적했다. 그는 테슬라가 미국 다음으로 중요시하는 중국시장에 생산기지를 세울 가능성이 높은 점도 삼성SDI와 같이 이미 중국시장에 진출한 국내 업체와의 협력가능성이 높을 것으로 판단하는 이유라고 설명했다. 한 연구원은 “삼성SDI가 BMW 등 독일의 완성차업체들에 테슬라까지 고객으로 확보하면 글로벌 전기차 배터리 시장의 주도권을 잡게된다”며 “따라서 삼성SDI에 배터리 부품·소재를 납품하는 업체들도 수혜를 볼 것”이라고 예상했다. 친환경에너지 관련주의 상승 판단에는 국내 정부의 미세먼지 대책도 한몫했다. 최근 정부는 친환경차를 확대보급하고, 노후 석탄발전소를 폐쇄 또는 연료전환하는 것을 주 내용으로 삼는 미세먼지 개선 정책을 발표한 바 있다. 한 연구원은 “국내 친환경에너지원 육성에 대한 인식변화로 정부의 정책중심이 변화하고 있음이 확인된다""면서 ""전기차 판매목표 증가를 위해 충전인프라를 오는 2020년 기준 1400기에서 3000기로 확대한 부분도 긍정적”이라고 말했다. ※ 저작권자 ⓒ"
파이낸셜뉴스,089980,/news/news_read.nhn?article_id=0003616779&office_id=014&mode=search&query=상아프론테크&page=1,2016-03-14 08:21,상아프론테크 동종업체 대비 높은 성장성 주목,"메리츠종금증권은 14일 상아프론테크에 대해 동종업체 대비 높은 자기자본이익률(ROE)과 이익 성장성을 보유하고 있다는 점에 주목할 필요가 있다며 투자의견 매수(Buy)와 목표주가 1만7500원을 유지했다. 메리츠종금증권에 따르면 상아프론테크는 올해 매출액이 전년대비 15.6% 증가한 1681억원, 영업이익은 전년대비 38.6% 늘어난 140억원을 기록할 것으로 각각 전망됐다. 액정표시장치(LCD) 카세트, 2차전지, 반도체 패키징 소재 등 3가지 아이템이 외형성장을 주도할 것으로 예상됐다. LCD 카세트 부문의 경우 지난해 매출액 336억원에서 올해 380억원으로 성장세가 지속될 것으로 내다봤다. LCD 카세트 매출 규모는 발주처의 투자싸이클에 따라 좌우되는데 BOE 로부터의 일감이 늘어나 50억원의 매출액이 2016년에 추가로 발생할 전망이다. 김승철 메리츠종금증권 연구원은 ""2차 전지는 소형 2차 전지 캡 어셈블리와 중대형 2차 전지 매출로 구성돼 있는데 이 중 성장의 축은 단연 중대형 2차 전지 캡 어셈블리 부문""이라면서 ""중대형 2차 전지는 삼성 SDI 서안 공장 신규 가동에 따라 생산량이 확대돼 관련 매출액은 2015년 257억원에서 2016년 355억원으로 점프할 것""이라고 말했다. 반도체 패키징 소재 부문의 경우 반도체 패키징 공정 중 금형과 패키징 재료를 분리하기 위한 필름으로 작년 하반기부터 삼성전자에 납품하고 있다. 이에 따라 2015년 94억원 매출액에서 2016년 145억원으로 매출이 증가될 것으로 전망됐다. 김 연구원은 ""일본 아사히글라스가 독점 공급하던 제품을 동사가 신규 개발해 수입대체 중""이라면서 ""동사는 기존 아이템의 꾸준한 매출 발생과 신규 아이템의 성장성이 부각되고 있어 동종업체 대비 저평가 받을 이유가 없어 보인다""고 설명했다."
머니투데이,089980,/news/news_read.nhn?article_id=0003693599&office_id=008&mode=search&query=상아프론테크&page=1,2016-06-10 15:27,"상아프론테크, 월드클래스 300 기업 선정","[머니투데이 김평화 기자] [해외마케팅, 미래 전략 수립 등 22개 기관 각종 지원 혜택] 첨단 부품·소재 전문 기업 상아프론테크가 ‘2016년 월드클래스 300 프로젝트’ 지원 대상기업에 선정됐다. ‘월드클래스 300 프로젝트’는 국내 중견, 중소기업 300개를 2020년까지 세계적 기업으로 육성하기 위해 중소기업청과 산업통산자원부에서 추진하는 프로젝트다. 이번에 선정된 기업들은 5년간 최대 75억 원의 연구개발(R&D)자금을 지원받는다. 뿐만 아니라 해외마케팅, 미래 전략 수립, 인력채용, 금융, 기술 개발 등에 대해 한국산업기술진흥원, 대한무역투자진흥공사(KOTRA), 무역보험공사, 수출입은행 등 22개 기관의 각종 지원 및 혜택을 받게 된다. 상아프론테크는 국내 최대의 불소수지 가공 전문 기업으로 핵심 산업의 고기능성 소재 개발 및 부품 생산에 연구개발 역량을 집중하고 있다. 또 매년 새로운 신규사업에 진출해 다양한 사업포트폴리오를 구축하고 있다. 최근에는 지속 성장을 위한 신규 사업의 일환으로 특정 물질을 통과시키거나 배제시키는 기능을 가진 폴리테트라플루오르 에틸렌 멤브레인(ePTFE membrane) 개발에 성공해 사업화를 추진하고 있다. 올해 상반기 양산 체제를 구축한 것으로 알려졌다. 상아프론테크는 월드클래스 300 지원책을 통해 우수한 품질의 멤브레인 제품 생산과 글로벌 마케팅을 추진할 계획이다. 이상원 상아프론테크 대표는 “지속적인 R&D 투자와 품질 향상의 노력이 월드클래스 300 선정으로 이어졌다.이번에 개발된 멤브레인도 유관 기관의 지원 아래 성공적으로 시장에 진입할 수 있도록 최선을 다할 것”이라며 ”나날이 발전하는 소재기술 분야에서 상아프론테크가 선도적 역할을 수행할 수 있도록 끊임없는 노력을 기울일 것”이라고 밝혔다. textlinktopstart textlinktopend textlinkstart"
전자신문,089980,/news/news_read.nhn?article_id=0002621417&office_id=030&mode=search&query=상아프론테크&page=1,2017-07-03 10:07,"[ET투자뉴스]상아프론테크, &quot;2분기, 사상 최대&hellip;&quot; 매수-메리츠종금증권","메리츠종금증권에서 3일 상아프론테크(089980)에 대해 ""2분기, 사상 최대 이익 달성 전망!""라며 투자의견을 '매수'로 제시하였다. 아울러 12개월 목표주가를 17,500원으로 내놓았다. 메리츠종금증권 김승철, 김정섭 애널리스트가 동종목에 대하여 이번에 제시한 '매수'의견은 메리츠종금증권의 직전 매매의견에서 큰 변화없이 그대로 유지되는 것이고  올해 초반의 매매의견을 기준으로  볼때도 역시 '매수'의견이 계속 유지되고 있는 상태이다. 그리고 최근 분기내 발표된 전체 증권사 리포트의 컨센서스와 비교를 해볼 경우에 오늘 발표된 투자의견은 대체적으로 평균치에 해당하는 수준으로, 이번 의견은 동종목에 대한 전체적인 흐름에서 크게 벗어나지 않은 것으로 분석되고 있다. 한편 12개월 목표주가로 제시한 17,500원은 직전에 발표된 목표가 16,000원 대비 9.4% 상향조정 된 것이고, 목표주가의 추이를 살펴보면 정체구간을 한동안 보낸 후에 최근 2회 연속 목표가가 높아졌는데 이번에 조정된 상승폭은 이전보다 다소 둔화된 모습이다. 또한 전일 종가 기준으로 볼때 동종목의 현주가는 이번에 제시된 목표가 대비 17.8%의 추가상승여력이 있다는 해석이 제시되고 있다."
머니투데이,089980,/news/news_read.nhn?article_id=0003701600&office_id=008&mode=search&query=상아프론테크&page=1,2016-06-27 09:09,"상아프론테크, 글로벌 의료기업과 저압지속흡인기 공급계약","[머니투데이 김평화 기자] [글로벌 의료기기 전문기업 짐머바이오메트가 국내 유통 및 판매 맡기로] 상아프론테크가 글로벌 의료기기 전문기업과 자사 의료기기 국내 공급계약을 체결하며 본격적인 시장 공략에 나섰다 첨단 부품·소재 및 의료기기 제조 전문기업 상아프론테크가 최근 글로벌 의료기기 전문기업 짐머바이오메트와 자사가 직접 개발 양산하는 의료용저압지속흡인기('그린박')의 국내 유통 및 판매 독점 공급계약을 체결했다고 27일 밝혔다. 이번 계약에 따라 상아프론테크는 자사의 의료용저압지속흡인기 '그린박'을 짐머바이오메트에 공급할 예정이다. 짐머바이로메트는 독점적으로 국내 유통 및 판매를 전담하며 추가적인 후속 제품 개발에도 협력하기로 합의했다. 의료용저압지속흡인기는 수술 후 환부에 생긴 체액, 혈장 등의 분비액을 진공상태로 유지하며 지속적으로 배액(Drainge) 하는 목적으로 사용되는 수집 용기다. 신속하게 분비액을 배출해 조직 층간의 사이를 좁혀주며 항생제 사용을 줄여 치유 기간과 비용을 줄이는 효과가 있다. 국내 의료용저압지속흡인기 시장은 약 120억원 규모로 연간 80만 개가 사용되고 있다. '그린박'은 기존 방식의 흡인기 단점을 보완한 밀폐형 진공 흡인기다. 균일한 배액 압력의 유지가 가능하다. 특히, 간편한 교체가 가능하고 밀폐된 상태에서 폐기함으로써 병원 내 2차적인 감영의 위험성을 획기적으로 줄였다. 상아프론테크 관계자는 ""글로벌 의료기기 업체인 짐머바이오메트와의 계약으로 제품의 신뢰도를 높이는 한편, 관련 의료기기 시장 진입에 있어 확실한 기반을 마련한 것으로 생각한다""며 ""현재 활발하게 진행 중인 신제품 개발과 안전필터주사기의 시장진입에 더욱 속도를 낼 것으로 기대하고 있다""고 말했다. 한편, 지난 2014년 짐머와 바이오메트의 합병으로 설립된 짐머바이오메트(Zimmer Biomet)는 인공관절 등 정형외과 분야 글로벌 선두 기업으로, 의료용저압지속흡인기인 헤모박(Hemovac)을 국내 시장에 최초로 도입한 것으로도 알려졌다. textlinktopstart textlinktopend textlinkstart"
한국경제,089980,/news/news_read.nhn?article_id=0003554892&office_id=015&mode=search&query=상아프론테크&page=1,2016-02-26 09:07,"[특징주]상아프론테크, 기업 가치 재평가 분석에 상승","[ 채선희 기자  ] 상아프론테크가 기업 가치를 재평가 받을 것이란 분석이 나오자 상승세다. 26일 오전 9시2분 현재 상아프론테크는 전날보다 450원(4.09%) 오른 1만1450원에 거래중이다. 유진투자증권은 상아프론테크에 대해 최근의 주가 하락은 과도하다며 가치는 재평가받을 것이라고 밝혔다. 한병화 연구원은 ""상아프론테크는 글로벌 경제위기와 같은 특수 상황이 벌어지지 않는 한 매년 개발 상용화되는 신제품과 함께 성장이 지속될 것""이라고 말했다. 또 ""글로벌 특수소재업체로 성장하는 가운데 향후 경쟁자의 진입은 매우 제한적인 상황""이라며 ""글로벌 독과점 업체로 성장할 수 있을 것""이라고 전망했다. 그는 상아프론테크의 올해 매출액은 전년대비 15.4% 증가한 1658억원, 영업이익은 38% 증가한 139억원을 기록할 것으로 추정했다. 채선희 한경닷컴 기자"
이데일리,089980,/news/news_read.nhn?article_id=0003487660&office_id=018&mode=search&query=상아프론테크&page=1,2016-02-26 09:06,[특징주]상아프론테크 실적 대폭 개선에 강세,"[이데일리 이재호 기자] 상아프론테크(089980)가 실적 개선에 힘입어 강세를 보이고 있다. 26일 오전 9시3분 현재 상아프론테크는 전거래일보다 5.00% 오른 1만1550원에 거래 중이다. 상아프론테크는 전날 실적 공시를 통해 지난해 매출액 1437억원, 영업이익 100억원을 기록했다고 밝혔다. 전년대비 각각 11.9% 와 74.6% 증가한 수치다. 이상원 상아프론테크 대표는 “지속적인 연구개발(R&D) 투자와 품질을 개선한 덕분에 이익이 늘었다”며 “올해는 전 사업 분야의 고른 성장을 이끌 것”이라고 말했다. 아울러 상아프론테크는 주주 환원정책의 일환으로 이사회 결의를 통해 주당 140원씩 현금 배당하기로 결정했다."
아시아경제,089980,/news/news_read.nhn?article_id=0003695538&office_id=277&mode=search&query=상아프론테크&page=1,2016-02-26 08:16,"상아프론테크, 글로벌 특수소재업체로 성장 중 &lsquo;매수&rsquo;&lt;유진투자證&gt;","[아시아경제 팍스넷 배요한 기자] 유진투자증권은 26일 상아프론테크에 대해 “동사가 제조하는 제품들은 전 세계에서 생산가능한 업체가 2~3개에 불과하며, 슈퍼엔지니어링 플라스틱 소재 기술은 40년의 업력을 바탕으로 글로벌 최고 수준에 도달한 것으로 판단된다”면서 투자의견 매수(유지)와 목표주가 1만6000원을 제시했다. 한성화 연구원은 “슈퍼엔지니어링 플라스틱은 고온에서의 내구성, 초경량, 전도성을 가지고 정밀 가공시 분자단위의 투과성까지 갖출수 있어 반도체, 가전, 자동차, 의류 등의 생활소비재, 바이오 등 다양한 산업에 사용되고 그 범위가 확대되고 있다""고 전했다. 이어 “도체용 ETFE 필름, 복합기용 전사벨트, 반도체 웨이퍼·디스플레이 패널 이송장치 등 상아프론테크가 제조하는 제품들은 전 세계에서 생산가능한 업체가 2~3개에 불과하다”면서 “이 제품들은 소재부터 최종 가공까지의 일관기술을 가져야 생산이 가능하기 때문에 향후에도 경쟁자의 진입이 매우 제한적”이라고 설명했다. 특히, 한 연구원은 “동사가 보유한 슈퍼엔지니어링 플라스틱 소재 기술은 40년의 업력을 바탕으로 글로벌 최고 수준에 도달한 것으로 판단된다”며 “매출액의 약 5%를 연구개발비로 사용하고 있어, 매년 특수소재의 신제품 들이 성장을 견인할 전망”이라고 말했다. 그는 상아프론테크를 단순한 하청업체나 부품회사가 아니라 자체 기술력으로 글로벌 시장을 개척하는 핵심소재업체라고 평가했다."
머니투데이,089980,/news/news_read.nhn?article_id=0003637625&office_id=008&mode=search&query=상아프론테크&page=1,2016-02-26 07:53,"상아프론테크, 핵심소재업체로 성장-유진투자증권","[머니투데이 송정훈 기자] 유진투자증권은 상아프론테크에 대해 핵심소재업체로 성장이 기대된다며 투자의견 매수와 목표주가 1만6000원을 유지했다. 유진투자증권 한병화 연구원은 26일 ""단순한 하청업체나 부품회사가 아니라 자체 기술력으로 글로벌 시장을 개척하는 핵심소재업체""라며  ""목표주가는 2016년 순이익 기준 PER 18배 수준""이라고 밝혔다. 그는 ""주력제품들인 반도체용 필름이나 복합기용 벨트, 반도체 웨이퍼 등은 소재부터 최종 가공까지 일관기술을 가져야 생산이 가능하기 때문에 향후에도 경쟁자의 진입이 매우 제한적일 것""이라고 분석했다. 또한 ""매출액의 약 50%를 연구개발비로 사용하고 있어 매년 특수소재의 신제품들이  성장을 견인할 것""이라고 덧 붙였다. textlinktopstart textlinktopend textlinkstart"
한국경제,089980,/news/news_read.nhn?article_id=0003554847&office_id=015&mode=search&query=상아프론테크&page=1,2016-02-26 07:36,"&quot;상아프론테크, 주가 하락 과도&hellip;가치 재평가 전망&quot;-유진","[ 채선희 기자  ] 유진투자증권은 26일 상아프론테크에 대해 최근의 주가 하락은 과도하다며 가치는 재평가받을 것이라고 밝혔다. 투자의견 매수, 목표주가는 1만6000원을 유지했다. 한병화 연구원은 ""상아프론테크는 글로벌 경제위기와 같은 특수 상황이 벌어지지 않는 한 매년 개발 상용화되는 신제품과 함께 성장이 지속될 것""이라며 ""최근의 주가 하락은 과도하다""고 말했다. 한 연구원은 ""주가 하락의 원인은 중국 국내업체에 대한 전기버스 배터리 보조금 제외 때문이었다""며 ""그러나 이 문제가 상아프론테크의 올해 매출에 미치는 영향은 2% 이하인 것으로 추정된다""고 설명했다. 독일이 빠르면 상반기 중으로 전기차 구매시 보조금을 지급할 가능성이 높아지는 등 전기차의 글로벌 수요 증가는 여전히 강한 상태라는 분석이다. 상아프론테크의 올해 매출액은 전년대비 15.4% 증가한 1658억원, 영업이익은 38% 증가한 139억원을 기록할 것으로 추정했다. 또 그는 ""상아프론테크가 글로절 특수소재업체로 성장하고 있어 가치를 재평가 받을 것""으로 내다봤다. 현재 상아프론테크가 제조하는 제품들은 전 세계에서 생산가능한 업체가 2~3개에 불과하다는 이유에서다. 그는 ""향후에도 경쟁자의 진입은 매우 제한적인 상황""이라며 ""글로벌 독과점 업체로 성장할 수 있을 것""이라고 전망했다. 이어 ""특히 보유중인 슈퍼엔지니어링 플라스틱 소재 기술은 40년의 업력을 바탕으로 글로벌 최고 수준에 도달했다""며 ""매출액의 약 5% 를 연구개발비로 사용하고 있어 매년 특수소재의 신제품들이 성장을 견인할 것""이라고 강조했다. 채선희 한경닷컴 기자"
