source,symbol,link,date,title,content
이데일리,089980,/news/news_read.nhn?article_id=0003402459&office_id=018&mode=search&query=상아프론테크&page=1,2015-11-23 09:04,"[특징주]상아프론테크, 삼성SDI 中 전기차 배터리 납품에 신고가","[이데일리 정병묵 기자] 상아프론테크(089980)가 주요 공급처 삼성SDI(006400)의 중국 전기차 베터리 납품 소식에 52주 신고가를 경신했다. 상아프론테크는 23일 오전 9시1분 현재 전날 대비 8.20% 오른 1만3100원에 거래되고 있다. 전날 삼성SDI는 중국의 10대 완성차업체인 JAC와 신규 전기차 모델 iEV6S의 배터리 공급 계약을 체결했다. iEV6S는 SUV로 한번 충전으로 약 250km의 주행이 가능한 원통형 배터리가 장착된다. 한병화 유진투자증권 연구원은 “리튬이온 배터리의 전해액의 누수를 방지하는 게스킷과 인슐레이터 등을 납품하고 있는데 차종별, 배터리 형태별로 사양이 다르며 원통형 부품생산이 가능한 생산라인을 이미 확보한 상태라서 전기차 관련 매출은 고속성장할 가능성이 높다”고 설명했다."
이데일리,089980,/news/news_read.nhn?article_id=0003402360&office_id=018&mode=search&query=상아프론테크&page=1,2015-11-23 07:54,"상아프론테크, 전기차 배터리 소재 성장 개시-유진","[이데일리 정병묵 기자] 유진투자증권은 23일 상아프론테크(089980)에 대해 전기차 배터리 관련 소재 부문 성장이 시작됐다며 투자의견 매수, 목표주가 1만6000원을 유지했다. 전날 삼성SDI(006400)는 중국의 10대 완성차업체인 JAC와 신규 전기차 모델 iEV6S의 배터리 공급 계약을 체결했다. iEV6S는 SUV로 한번 충전으로 약 250km의 주행이 가능한 원통형 배터리가 장착된다. 한병화 유진투자증권 연구원은 “상아프론테크는 고객사의 본격적인 전기차 원통형 배터리 제조 확대로 관련 시장에 진입할 것으로 예상된다”며 “리튬이온 배터리의 전해액의 누수를 방지하는 게스킷과 인슐레이터 등을 납품하고 있는데 차종별, 배터리 형태별로 사양이 다르며 원통형 부품생산이 가능한 생산라인을 이미 확보한 상태라서 전기차 관련 매출은 고속성장 할 가능성이 높다”고 설명했다. 이어 “연간 매출액의 5% 이상을 연구개발에 사용하고 있고 소재관련 인력이 전체의 약 20%에 육박한다”며 “전기차와 관련된 소재기술도 국책과제 형태로 진행하고 있는데 국내 대형 배터리업체와 소재관련 기업들 컨소시움에 참여하고 있다”고 덧붙였다."
서울경제,089980,/news/news_read.nhn?article_id=0002765655&office_id=011&mode=search&query=상아프론테크&page=1,2015-11-23 15:15,"상아프론테크, 전기차 관련 매출은 고속 성장할 가능성 높다","23일 상아프론테크(089980)에 대해 유진투자증권 한병화 연구원은 ""고객사의 중국전기차 시장 확대 전략 본격화로 수혜""라며 투자의견을 '매수(유지)'로 제시하였다. 아울러 12개월 목표주가를 16,000원으로 내놓았다. 이에 한 연구원은 동사에 대해 ""전일 삼성SDI는 중국의 10대 완성차업체인 JAC와 신규 전기차 모델 iEV6S의 배터리 공급 계약을 체결했다고 밝혔다. Tang은 플러그인 하이브리드로 충전 주행거리가 85km에 불과해, iEV6S가 내년부터 판매되면 전기차용 SUV로는 대표 차종이 될 것으로 판단된다""라고 분석했다. 또한 ""이번 배터리는 원통형으로 중국 내 전기차업체들의 50% 이상이 원통형을 사용하거나 할 계획이어서, 향후 SDI의 중국내 전기차 배터리 공급확대에 중요한 분기점이 될 것""이라고 밝혔다. 한편 한 연구원은 ""고객사의 본격적인 전기차향 원통형 배터리 제조 확대로 관련 시장에 진입할 것으로 예상된다. 동사는 리튬이온 배터리의 전해액의 누수를 방지하는 게스킷과 인슐레이터 등을 납품하고 있는데 차종별, 배터리 형태별로 사양이 다르다. 원통형 부품생산이 가능한 생산라인을 이미 확보한 상태라서 동사의 전기차 관련 매출은 고속 성장할 가능성이 높다고 판단된다""라고 전망했다. 한 연구원이 동종목에 대하여 이번에 제시한 '매수(유지)'의견은 유진투자증권의 직전 매매의견과 동일한 것이고 올해 초반의 매매의견을 기준으로 볼때도 역시 '매수'의견이 계속 유지되고 있는 상태이다. ▷ 전기차 섹터"
한국경제TV,089980,/news/news_read.nhn?article_id=0000583371&office_id=215&mode=search&query=상아프론테크&page=1,2017-11-21 09:52,[국고처 류태형] 종목상담 - 상아프론테크(089980),[한국경제TV 류장현 PD] [국고처 류태형] 종목상담 - 상아프론테크(089980) 11월 18일 방송된 `국민주식고충처리반`에 출연한 류태형 파트너가 상아프론테크(089980)에 대한 시세와 전망을 이야기하고 있다.
연합뉴스,089980,/news/news_read.nhn?article_id=0008004360&office_id=001&mode=search&query=상아프론테크&page=1,2015-11-23 09:20,"&lt;특징주&gt; 상아프론테크, 전기차시장 확대기대에 강세","(서울=연합뉴스) 장하나 기자 = 상아프론테크가 고객사인 삼성SDI의 중국 전기차 배터리 수주 소식에 23일 장 초반 강세다. 이날 오전 9시17분 현재 코스닥시장에서 상아프론테크는 전 거래일보다 600원(4.92%) 오른 1만2천800원에 거래됐다. 장 초반 1만3천300원까지 오르며 52주 신고가를 새로 썼다. 전날 삼성SDI는 중국의 10대 완성차업체인 JAC와 신규 전기차 모델 iEV6S의 배터리 공급 계약을 체결했다고 밝혔다 한병화 유진투자증권 연구원은 ""상아프론테크는 그동안 각형 전기차 배터리 부품만 납품했지만, 이번 삼성SDI의 계약으로 자연스럽게 원통형 전기차 부품 시장에 진입할 것으로 예상된다""며 ""원통형 부품생산이 가능한 생산라인을 이미 확보한 상태라서 전기차 관련 매출은 고속성장 할 가능성이 높다""고 말했다."
파이낸셜뉴스,089980,/news/news_read.nhn?article_id=0003546959&office_id=014&mode=search&query=상아프론테크&page=1,2015-11-23 08:53,"상아프론테크, 전기차 관련 성장 스토리 시작에 불과-유진투자증권","유진투자증권은 23일 상아프론테크 의 전기차 관련 성장 스토리는 이제 시작에 불과하다라며 투자의견 매수와 목표주가 1만6000원을 유지했다. 한병화 연구원은 "" 상아프론테크 는 고객사의 본격적인 전기차 원통형 배터리 제조 확대로 관련 시장에 진입할 것으로 예상된다”며 “리튬이온 배터리의 전해액의 누수를 방지하는 게스킷과 인슐레이터 등을 납품하고 있는데 차종별, 배터리 형태별로 사양이 다르며 원통형 부품생산이 가능한 생산라인을 이미 확보한 상태라서 전기차 관련 매출은 고속성장 할 가능성이 높다”고 설명했다. 전날 삼성SDI는 중국의 10대 완성차업체인 JAC와 신규 전기차 모델 iEV6S의 배터리 공급 계약을 체결했다. iEV6S는 SUV로 한번 충전으로 약 250km의 주행이 가능한 원통형 배터리가 장착된다. 상아프론테크 는 리튬이온배터리의 전해액의 누수를 방지하는 게스킷과 인슐레이터 등을 납품하고 있는데 차종별, 배터리 형태별로 사양이 다르다. 원통형 부품생산이 가능한 생산라인을 이미 확보한 상태라서 전기차 관련 매출은 고속성장 할 가능성이 높다라는 게 한 연구원은 판단이다. 한 연구원은 “연간 매출액의 5% 이상을 연구개발에 사용하고 있고 소재관련 인력이 전체의 약 20%에 육박한다”며 “전기차와 관련된 소재기술도 국책과제 형태로 진행하고 있는데 국내 대형 배터리업체와 소재관련 기업들 컨소시움에 참여하고 있다”고 전했다."
전자신문,089980,/news/news_read.nhn?article_id=0002657335&office_id=030&mode=search&query=상아프론테크&page=1,2017-11-14 10:41,[ET투자뉴스]상아프론테크 17년3분기 실적 발표... 전분기比 매출액&middot;영업이익 ...,"11월 13일 상아프론테크(089980)의 2017년 3분기 연결 확정 실적이 발표됐다. 전년 동기 대비해서 매출액, 영업이익, 당기순이익 모두 증가하였다. 365억원이었던 매출액은 12.54% 증가하여 411억원을 기록했다. 영업이익은 16.08% 상승하여 36.2억원이고, 당기순이익은 24.5억원으로 발표됐다. 이번분기 기준으로 추정되는 상아프론테크의 자기자본이익률(ROE)은 9.3%로 나타났다. 전년 동기인 2016년 3분기 ROE는 3.2%로 이번 분기에 6.1%p 상승했다. 한편 동종목의영업이익률은 8.8%이다. 지난해 동기 영업이익률은 8.6%로 이번 분기와 비슷한 수치이다. 주가가 1주당 수익의 몇배가 되는지 나타내는 주가수익비율(PER)은 79.2배로 나타났다. 전년 동기 PER은 193.86배로 이번 분기에 하락했다.주가가 1주당 순자산의 몇배인지 알려주는 주가순자산비율인 PBR은 1.78배이다. 지난해 동기 PBR은 1.54배로 이번 3분기 PBR이 상승했다. 다음은 상아프론테크와 동일 업종 내 비교 그룹 종목의 각각 최근 실적의 전년 동기 대비 성장률이다. 상아프론테크의 매출액 증감율은 타 종목 대비 가장 우수한 편이다. 그리고 주가는 가장 높은 상승률을 보였다."
머니투데이,089980,/news/news_read.nhn?article_id=0003583737&office_id=008&mode=search&query=상아프론테크&page=1,2015-11-23 09:14,"[특징주]상아프론테크, 삼성SDI 중국 베터리 수주에 급등",[머니투데이 김남이 기자] 상아프론테크가 고객사인 삼성SDI의 중국 전기차 베터리 수주 소식에 급등세다. 23일 오전 9시11분 상아프론테크는 전 거래일보다 1050원(8.61%) 오른 1만3250원에 거래되고 있다. 전날 삼성SDI는 중국의 10대 완성차업체인 JAC와 신규 전기차 모델 iEV6S의 배터리 공급 계약을 체결했다. iEV6S는 SUV로 한번 충전으로 약 250km의 주행이 가능한 원통형 배터리가 장착된다. 한병화 유진투자증권 연구원은 “상아프론테크는 삼성SDI의 전기차 배터리 공급에 따라 자연스럽게 원통형 배터리 시장에 진입하게 됐다”며 “그동안은 각형 전기차 배터리 부품만 납품했지만 원통형 부품생산이 가능한 생산 라인을 확보한 상태이기 때문에 관련 매출은 고속성장할 가능성이 높다”고 말했다. textlinktopstart textlinktopend textlinkstart
매일경제,089980,/news/news_read.nhn?article_id=0003626365&office_id=009&mode=search&query=상아프론테크&page=1,2015-11-23 09:07,"[Hot-Line] &quot;상아프론테크, 원통형 배터리 시장 수혜 기대&quot;","유진투자증권은 23일 상아프론테크에 대해 중국 전기차 시장 확대 전략 본격화로 수혜를 입을 것이라며 투자의견 ‘매수’와 목표주가 1만6000원을 유지했다. 전날 삼성SDI는 중국의 10대 완성차업체인 JAC와 신규 전기차 모델 iEV6S의 배터리 공급 계약을 체결했다. iEV6S는 SUV로 한번 충전으로 약 250km를 주행할 수있는 원통형 배터리가 장착된다. 한병화 유진투자증권 연구원은 “상아프론테크는 삼성SDI의 전기차 배터리 공급에 따라 자연스럽게 원통형 배터리 시장에 진입하게 됐다”며 “그동안은 각형 전기차 배터리 부품만 납품했지만 원통형 부품생산이 가능한 생산 라인을 확보한 상태이기 때문에 관련 매출은 고속성장할 가능성이 높다”고 말했다. 이어 “상아프론테크는 연간 매출액의 5% 이상을 연구개발에 사용하고 있고 소재관련 인력이 전체의 약 20%에 육박한다”며 “전기차와 관련된 소재기술도 국책과제 형태로 진행하고 있는데, 이는 배터리 고효율에 필수적인 요소여서 관련 소재업체들이 주목 받을 수 밖에 없다”고 설명했다. [매경닷컴 김경택 기자] r_start // r_end // [ⓒ 매일경제 & mk.co.kr, 무단전재 및 재배포 금지] 매일경제 관련뉴스해당 언론사에서 선정하며 언론사 페이지(아웃링크)로 이동해 볼 수 있습니다.섹시 치어리더, 격한 안무에 속바지가 그만…""지금 다 보이는 거야? 대박!""파킨슨병 원인, 난치병 정복할 수 있는 가능성 열리다…키워드는 '줄기세포'전임감독제부터 기초훈련까지…김인식이 던진 과제저커버그 ""딸 태어나면 육아휴직 2개월""…'파격 선언'래시가드 입고 섹시미 뽐냈던 건희, 상의 탈의한 셀카 공개…'초콜릿 복근'"
전자신문,089980,/news/news_read.nhn?article_id=0002658943&office_id=030&mode=search&query=상아프론테크&page=1,2017-11-17 09:39,[ET투자뉴스]상아프론테크_外人 대량매수 이후 주가도 탄력 받아 현재 +1.73%,"외국인이 전일 상아프론테크를 평소와 다르게 큰 규모로 순매수했다. 전일 순매수량은 전체 거래량의 13.68%를 차지할 정도로 크다. 외국인의 순매수로 수급여건이 개선되면서 주가도 상승세를 나타내고 있다. 이러한 영향권에서 17일 오전 9시 33분 현재 250원(1.73%) 오른 14,700원을 기록하고 있다.    [주가/수급동향]     11월15일부터 전일까지 기관이 2거래일 연속 순매도를 보였다. 최근 한달간 상아프론테크의 상장주식수 대비 거래량을 비교해보니 일별 매매회전율이 1.67%로 집계됐다.  그리고 동기간 장중 저점과 고점의 차이인 일평균 주가변동률을 6.92%를 나타내고 있다.  그리고 최근 5일간 거래비중은 개인 비중이 86.28%로 가장 높았고, 외국인이 10.63%로 그 뒤를 이었다.  기관은 3.08%를 나타냈다.     [업종내 종목흐름]     이 시각 현재 관련종목들이 혼조세를 보이고 있는 동안 화학업종은    0.23% 하락중이다. 와이엠티 60,800원▲1400(+2.36%) 디엔에프 16,450원▲150(+0.92%)  에프티이앤이 4,390원▼100(-2.23%) 한국알콜 8,100원▼60(-0.74%)    [재무특징]     영업이익률 현재 7.74%로 업종평균 수준.PER은 21.58로 업종평균보다 높으며, PBR은 2.1임."
아시아경제,089980,/news/news_read.nhn?article_id=0004205729&office_id=277&mode=search&query=상아프론테크&page=1,2018-03-28 09:57,"상아프론테크, 필터주사기 중국 시장 진출","[아시아경제 임혜선 기자] 첨단 소재 ·부품 전문기업 상아프론테크가 중국 의약품 유통회사와  '그린메디 EZ 필터니들 주사기' 공급 계약을 체결했다고 28일 밝혔다. 회사 측은 ""이번 계약을 통해 잠재적 최대 의료기기 시장인 중국시장 진출에 성공했다는 점에서 의미가 있다""면서 ""수 개월간의 심사과정을 통해 제품의 우수성은 인정받은 만큼 안정된 제품 공급을 통해 계약 규모와 품목 확대를 단계적으로 진행할 방침""이라고 밝혔다. 이번 계약을 통해 상아프론테크는 중국 정부의 등록허가 완료후 1차년 500만개, 2차년 1000만개의 필터주사기 납품을 진행하기로 합의했다. 해당 필터주사기는 주사제 개봉 시 혼입되는 앰플의 유리조각이나 고무가루가 혈관에 유입되는 것을 차단하는 필터 기능이 탑재된 것이 특징이다. 기존 일반주사기 사용시 주사제 파편이 혈관으로 유입돼 혈전, 정맥염, 폐육아종, 조직괴사 등을 일으키는 사례가 보고됨에 따라 최근 우리나라를 비롯한 세계 각국에서 필터주사기의 수요가 급격히 늘어나고 있다. 상아프론테크는 국내를 비롯한 세계 각국의 의료기기 시장별 특징을 고려해 기능성 주사기 시장 지배력을 강화한다는 전략이다. 회사는 필터주사기, 재사용 방지 기능을 탑재한 안전주사기, 그리고 두 가지 기능을 모두 더해진 안전필터주사기 등 3종 주사기를 통해 시장 점유율 확대를 진행하고 있다. 한편, 상아프론테크는 장기간 제품 심사를 통해 최근 세브란스병원 안전필터주사기 납품업체로 선정돼 국내에서도 공급처를 확대하게 됐다. 회사는 세브란스병원 외 분당서울대병원, 경희의료원 등 국내 다수의 의료기관에 안전필터주사기를 공급 중이다."
한국경제,089980,/news/news_read.nhn?article_id=0003475585&office_id=015&mode=search&query=상아프론테크&page=1,2015-11-12 14:49,"상아프론테크, 3분기 영업이익 33억&hellip;전년비 105%&uarr;","[ 박희진 기자  ] 첨단 부품·소재 전문기업인 상아프론테크는 올 3분기 연결기준 영업이익이 33억8000만원으로 전년 동기 대비 105.7% 증가했다고 12일 밝혔다. 같은 기간 매출은 360억3000만원으로 전년 동기보다 10.8% 늘었고, 당기순이익은 34억8000만원으로 112.5% 증가했다. 회사 측은 ""전기차 에너지저장장치(ESS) 등 중대형 2차전지 사업과 반도체 패키징 소재 등 신규사업의 매출 증가가 실적 개선으로 이어졌다""며 ""앞서 투자를 진행했던 자회사들도 매출이 늘어나면서 실적 개선에 기여했다""고 밝혔다. 상아프론테크는 그동안 기존 사업의 원가 절감과 수율 향상에 힘쓴 동시에 꾸준히 연구·개발(R&D) 및 투자를 진행한 결과 올해 신규사업 진출에 성공했다. 특히 3분기에는 신규사업 중심의 매출 성장과 고정비 비율 감소가 두드러졌다는 설명이다. 이상원 상아프론테크 대표는 ""중대형 2차전지 사업과 신규 사업의 매출 성장이 지속될 것으로 전망된다""며 ""올해 실적은 지난해 수준을 무난히 뛰어 넘을 것으로 기대한다""고 말했다. 박희진 한경닷컴 기자"
전자신문,089980,/news/news_read.nhn?article_id=0002670036&office_id=030&mode=search&query=상아프론테크&page=1,2017-12-27 12:36,"[ET투자뉴스]전기차주테마, 피앤이솔루션, 상아프론테크 중심으로 강세","금일  현재, 전기차주테마가 전일대비 3.04% 상승하며 강세를 보이고 있다. 상승폭으로는 피앤이솔루션 3.84%로 선두권에 있으며 상아프론테크(3.77%), 에코프로(3.07%)도 강세이다. [테마내 주요종목 시세] * 피앤이솔루션 : 10,000원 (▲370) *상아프론테크:13,750원 (▲500) *에코프로:38,550원 (▲1150) [테마내 주요종목 재무요약] * 피앤이솔루션 : 영업이익률 현재 8.24%로 업종평균 상회. PER은 33.06으로 업종평균보다 높으며, PBR은 2.78임. * 상아프론테크 : 영업이익률 현재 8.43%로 업종평균 상회. PER은 18.93으로 업종평균보다 높으며, PBR은 1.71임. * 에코프로 : 영업이익률 현재 4.72%로 업종평균 수준.PER은 94.02로 업종평균보다 높으며, PBR은 4.19로 다소 높은편. [테마내 종목별 외국인 지분변동] * 피앤이솔루션 :  최근 2주간 -0.2%감소하여 현재 보유율은 1.4% * 상아프론테크 :  최근 2주간 -0.1%감소하여 현재 보유율은 1.99% * 에코프로 :  최근 2주간 1.74%증가하여 현재 보유율은 5.5%"
이데일리,089980,/news/news_read.nhn?article_id=0003378750&office_id=018&mode=search&query=상아프론테크&page=1,2015-10-27 15:54,"상아프론테크, 신주인수권 17만주 행사",[이데일리 경계영 기자] 상아프론테크(089980)는 신주인수권 17만8157주(지분 1.42%)가 행사된다고 27일 공시했다. 신주인수권 행사가액은 5613원이며 다음달 11일 상장될 예정이다. 행사되지 않은 신주인수권증권 잔액은 87억원이다.
뉴시스,089980,/news/news_read.nhn?article_id=0008442498&office_id=003&mode=search&query=상아프론테크&page=1,2018-02-12 15:18,"상아프론테크, 주당 140원 현금배당 결정",【서울=뉴시스】장서우 기자 = 코스닥 상장 플라스틱 제품 제조업체 상아프론테크(089980)는 보통주 1주당 140원을 현금 결산배당키로 결정했다고 12일 공시했다. 시가배당율은 1.1%이며 배당금 총액은 19억7871만원이다.
아시아경제,089980,/news/news_read.nhn?article_id=0003612212&office_id=277&mode=search&query=상아프론테크&page=1,2015-10-27 15:58,"상아프론테크, 신주인수권 17만8157주 행사",[아시아경제 권해영 기자] 상아프론테크는 17만8157주의 신주인수권을 행사했다고 27일 공시했다. 이는 발행주식총수 대비 1.42% 규모다. 신주인수권 행사가액은 5613원이며 신주상장예정일은 다음달 11일이다.
아시아경제,089980,/news/news_read.nhn?article_id=0004178344&office_id=277&mode=search&query=상아프론테크&page=1,2018-02-12 15:04,"상아프론테크, 주당 140원 현금배당 결정","[아시아경제 조강욱 기자] 상아프론테크는 보통주 1주당 140원의 현금 결산배당을 결정했다고 12일 공시했다. 시가배당율은 1.1%, 배당금총액은 약 20억원이다. 배당금 지급 예정일자는 4월 26일이다."
헤럴드경제,089980,/news/news_read.nhn?article_id=0001353518&office_id=016&mode=search&query=상아프론테크&page=1,2018-02-12 14:55,"[생생코스닥]상아프론테크, 주당 140원 현금배당 결정",[헤럴드경제=증권팀] 상아프론테크는 보통주 1주당 140원의 현금 결산배당을 결정했다고 12일 공시했다. 시가배당율은 1.1%이며 배당금총액은 19억7871만원이다. 배당금 지급 예정일자는 4월 26일이다.
전자신문,089980,/news/news_read.nhn?article_id=0002572362&office_id=030&mode=search&query=상아프론테크&page=1,2017-01-10 16:48,"[로봇뉴스][상아프론테크 지분 변동] 국민연금공단 외 1명 -1.05%p 감소, ...","상아프론테크(089980)는 10일 주주 국민연금공단을  비롯한 특별관계자의 보유주식이 감소되었다고 발표했다. 이는 직전 보고일보다 139,266주 감소하여 지분율은 7.3%로 하락했다. 이번 보고 사유는 단순추가취득/처분으로  알려졌다.   최대주주와 특수관계자의 지분 변동은 주가에 영향을 주는 요인이다. 특히 보유비율을 지속적으로 늘리거나 줄일 경우, 해당종목 투자시 유의할 필요가 있다.  다음은 상아프론테크의 지분 변동 내역과 보유 내역이다."
머니투데이,089980,/news/news_read.nhn?article_id=0003567442&office_id=008&mode=search&query=상아프론테크&page=1,2015-10-27 16:18,"상아프론테크, 신주인수권 17만주 행사","[머니투데이 이정혁 기자] 상아프론테크는 신주인수권 17만8157주(1.42%)를 행사한다고 27일 공시했다. 행사가액은 5613원이며, 내달 11일 상장될 예정이다. textlinktopstart textlinktopend textlinkstart"
