source,symbol,link,date,title,content
매일경제,089980,/news/news_read.nhn?article_id=0003926393&office_id=009&mode=search&query=상아프론테크&page=1,2017-04-19 09:37,"상아프론테크, 기능성 특수소재 ePTFE 멤브레인 사업 진출","상아프론테크가 기능성 특수소재 개발에 성공하면서 해당 사업에 본격 진출한다. 첨단 소재·부품 전문 기업 상아프론테크는 특정 물질을 통과시키거나 배제하는 기능을 가진 ePTFE 멤브레인(Expanded Polytetrafluoroethylene Membrane, 이하 멤브레인) 개발에 성공해 특수소재 사업에 본격적으로 진출한다고 19일 밝혔다. 멤브레인은 특정 물질에 대한 통과나 배제 기능을 가져 여러 사업분야에서 다양하게 사용된다. 시중에서 공기는 통과시키고 물방울은 차단하는 기능성 의류용 원단 제작 소재로 많이 알려져 있다. 방수 기능성과 통기성, 오염 입자 침투 방지 기능이 높아 최근에는 휴대폰과 자동차 등에 필수 소재로 채택되고 있다. 또 내화학성과 내열성도 높아 전지용 분리막이나 반도체용 필터로도 활용되고 있다. 이외에도 수처리, 에어필터, 의료·미용, 전기전자, 식음료 사업 등에도 사용된다. 회사 관계자는 ""멤브레인 소재는 적용 가능한 사업이 다양하고 고부가가치를 창출할 수 있는 아이템""이라며 ""기존 사업영역과 함께 상아프론테크의 매출 성장과 수익성 개선에 도움을 줄 새로운 영역으로 기대되고 있다""고 말했다. [디지털뉴스국 김경택 기자] r_start // r_end //"
전자신문,089980,/news/news_read.nhn?article_id=0002646234&office_id=030&mode=search&query=상아프론테크&page=1,2017-10-10 09:50,"[ET투자뉴스][상아프론테크 지분 변동] 국민연금공단 외 1명 5.08%p 증가,...","상아프론테크(089980)는 10일 주주 국민연금공단을  비롯한 특별관계자의 보유주식이 증가되었다고 발표했다. 이는 직전 보고일보다 724,513주 증가하여 지분율은 5.08%로 상승했다. 이번 보고 사유는 단순추가취득/처분으로  알려졌다.   최대주주와 특수관계자의 지분 변동은 주가에 영향을 주는 요인이다. 특히 보유비율을 지속적으로 늘리거나 줄일 경우, 해당종목 투자시 유의할 필요가 있다.  다음은 상아프론테크의 지분 변동 내역과 보유 내역이다."
서울경제,089980,/news/news_read.nhn?article_id=0002771819&office_id=011&mode=search&query=상아프론테크&page=1,2015-12-07 10:32,"상아프론테크, 전기차라는 신성장 동력 확보","상아프론테크(089980)에 대해 유진투자증권 한병화 연구원은 ""SDI가 중국과 국내의 전기차배터리 생산능력을 올해 말 대비 50% 이상 확장할 것이기 때문에 동사의 관련 부품 매출액도 동반 상승할 것으로 판단된다. 동사의 전기차 부품 매출액은 14년 115억원 ->15년 156억원 ->16년 250억원으로 큰 폭 증가할 전망""이라고 분석했다. 또한 ""2016년 부문별 매출액 성장률을 보면 전기차부품이 60%로 가장 높고 반도체용 소재/부품이 45%로 뒤를 이을 것으로 추정된다. 기존 제품들인 가전, 자동차, LCD, 의료기기 부품 등은 약 180개의 다양한 고객에게 납품되고 있고 대부분 독점품들이어서 실적 안정성이 높다""라고 밝혔다. 한편 한 연구원은 ""동사는 LG화학, 에프티이앤이와 국책과제로 차세대 전기차용 분리막을 개발하고 있다. 나노 멤브레인이라는 특수소재를 이용한 분리막을 개발하는 프로젝트가 정부지원아래 시행되고 있고 내년 5월에 완료된다. 따라서 상용화 기간을 고려하면 2017년 이후부터는 고효율 분리막 소재의 매출도 기대할 수 있다""라고 전망했다. 유진투자증권은 7일 상아프론테크(089980)에 대해 ""전기차라는 신성장 동력 확보""라며 투자의견을 '매수(유지)'로 제시하였다. 아울러 12개월 목표주가를 16,000원으로 내놓았다. 한 연구원이 동종목에 대하여 이번에 제시한 '매수(유지)'의견은 유진투자증권의 직전 매매의견을 그대로 유지하는 것이고 올해 초반의 매매의견을 기준으로 볼때도 역시 '매수'의견이 계속 유지되고 있는 상태이다. ▷ 전기차 섹터"
전자신문,089980,/news/news_read.nhn?article_id=0002546535&office_id=030&mode=search&query=상아프론테크&page=1,2016-11-07 11:45,"[로봇뉴스]전기차주테마, 우리산업, 상아프론테크 중심으로 강세","금일  현재, 전기차주테마가 전일대비 3.19% 상승하며 강세를 보이고 있다. 상승폭으로는 우리산업 3.9%로 선두권에 있으며 상아프론테크(3.6%), 에코프로(3.17%)도 강세이다. [테마내 주요종목 시세] * 우리산업 : 24,000원 (▲900) *상아프론테크:9,790원 (▲340) *에코프로:13,000원 (▲400) [테마내 주요종목 재무요약] * 우리산업 : 영업이익률 현재 5.59%로 업종평균 수준.PER은 16.22로 업종평균보다 높으며, PBR은 3.46으로 다소 높은편. * 상아프론테크 : 영업이익률 현재 6.18%로 업종평균 수준.PER은 24.91로 업종평균보다 높으며, PBR은 1.32임. * 에코프로 : 영업이익률 현재 5.5%로 업종평균 수준.PER은 88.35로 업종평균보다 높으며, PBR은 1.53임. [테마내 종목별 외국인 지분변동] * 우리산업 :  최근 2주간 -0.01%감소하여 현재 보유율은 12.07% * 상아프론테크 :  최근 2주간 0.21%증가하여 현재 보유율은 0.87% * 에코프로 :  최근 2주간 0.17%증가하여 현재 보유율은 1.94%"
파이낸셜뉴스,089980,/news/news_read.nhn?article_id=0003731072&office_id=014&mode=search&query=상아프론테크&page=1,2016-11-07 15:07,[fnRASSI]상아프론테크 전일대비 6.35% 상승,"현재 상아프론테크(089980)는 전일대비 6.35% 상승하여 10,050원 선에서 거래가 이루어지고 있다.  외국인 보유량 증가, 기관 감소 (5일 누적)최근 5일간 동종목의 외국인 투자자는 15,429주 매수하였고 반면 기관은 2,421주 매도하였다. 전날 두 주체 각각 4,076주, 2,421주 순매도하며 보유 비율을 줄였다.다음 표는 동종목의 외국인, 기관의 일별 순매수량을 나타낸 것이다.  상장주식수 대비 거래량은 0.6%로 적정수준최근 한달간 상아프론테크의 상장주식수 대비 거래량을 비교해보니 일별 매매회전율이 0.6%로 집계됐다. 그리고 동기간 장중 저점과 고점의 차이인 일평균 주가변동률을 3.23%를 나타내고 있다.  
 'fnRASSI'는 증권전문 기업 씽크풀과 파이낸셜뉴스의 협업으로 로봇기자가 실시간으로 생산하는 기사입니다."
파이낸셜뉴스,089980,/news/news_read.nhn?article_id=0003805755&office_id=014&mode=search&query=상아프론테크&page=1,2017-04-20 15:42,"[fnRASSI]상아프론테크,CJ씨푸드1우 등 26종목 52주 신고가 경신","20일 상아프론테크(089980), CJ씨푸드1우(011155), 우진플라임(049800), 신원우(009275), 룽투코리아(060240), 대한광통신(010170)등이 장중 52주 신고가를 경신했다. 특히 상아프론테크는 전 거래일 대비 18.2% 오른 13,000원에 거래를 마감하며 높은 관심을 받았다. 이외에 코위버는 7870원까지 올라 신고가를 경신했으나, 전일보다 오히려 하락한 7,070원에 거래를 마감했다. 'fnRASSI'는 증권전문 기업 씽크풀과 파이낸셜뉴스의 협업으로 로봇기자가 실시간으로 생산하는 기사입니다."
파이낸셜뉴스,089980,/news/news_read.nhn?article_id=0003805704&office_id=014&mode=search&query=상아프론테크&page=1,2017-04-20 14:49,[fnRASSI]상아프론테크(089980) 22.73% 상승,"현재 상아프론테크(089980)는 전일대비 22.73% 상승하여 13,500원 선에서 거래가 이루어지고 있다. 외국인/기관 순매수, 개인은 순매도(한달누적)  4월17일부터 전일까지 외국인이 3거래일 연속 순매수를 보였다. 4주간을 기준으로 보면 외국인이 방향성있는 매매를 하면서 63,473주를 순매수했고, 기관도 순매수량을 늘리며 137,617주를 순매수했다. 반면 개인들은 매도 우위를 지속하면서 201,090주를 순매도한 것으로 나타났다. 개인투자자의 거래비중이 가장 높아 최근 한달간 주체별 거래비중을 살펴보면 개인이 전체 거래량의 82.49%를 차지하며 가장 활발한 참여를 보였고, 기관은 11.37%, 외국인은 6.12%의 거래 참여율을 보였다. 그리고 최근 5일간 거래비중은 개인 비중이 85.97%로 가장 높았고, 기관이 7.4%로 그 뒤를 이었다. 외국인은 6.62%를 나타냈다. 'fnRASSI'는 증권전문 기업 씽크풀과 파이낸셜뉴스의 협업으로 로봇기자가 실시간으로 생산하는 기사입니다."
매일경제,089980,/news/news_read.nhn?article_id=0003637349&office_id=009&mode=search&query=상아프론테크&page=1,2015-12-07 09:34,"[Hot-Line]상아프론테크, 中전기차 성장 기대감에 `강세`","상아프론테크가 중국 전기차 사업 성장 기대감에 장 초반 강세를 보이고 있다. 7일 오전 9시21분 현재 상아프론테크는 전날보다 4.03% 오른 1만2900원에 거래 중이다. 유진투자증권은 이날 상아프론테크를 중국 전기차 시장 고성장의 수혜주로 지목했다. 한병화 유진투자증권 연구원은 “상아프론테크는 삼성SDI의 독점 공급업체로, 중국 시안에 전기차 부품 공장을 신설했다”며 “중국 전기차 시장은 진입장벽 철폐와 각종 보조금 지급, 충전 인프라 확충에 따라 2020년까지 연평균 65% 성장할 것으로 예상된다”고 말했다. [매경닷컴 윤호 기자] r_start // r_end // [ⓒ 매일경제 & mk.co.kr, 무단전재 및 재배포 금지] 매일경제 관련뉴스해당 언론사에서 선정하며 언론사 페이지(아웃링크)로 이동해 볼 수 있습니다.하지원, 살결 다 비치는 시스루 드레스 입고 요염한 자세로…""男心 덜컹!""현대차 1년만에 신형 아슬란 출시'마리텔' 김하나, 옥타곤걸 출신의 글래머 몸매 눈길300년 전 침몰한 보물선 발견인양하면 20조원 '횡재'손흥민의 그녀 유소영, 초미니 드레스 입고 입장하다…""男心 후끈후끈~!"""
한국경제,089980,/news/news_read.nhn?article_id=0003488936&office_id=015&mode=search&query=상아프론테크&page=1,2015-11-30 08:45,"&quot;상아프론테크, 한중 디스플레이 업체 경쟁 속 수혜株&quot;-유진","[ 김근희 기자  ] 유진투자증권은 30일 상아프론테크에 대해 한국과 중국의 디스플레이 업체들의 경쟁이 심화될수록 수혜를 입게될 것이라며 목표주가 1만6000원과 투자의견 '매수'를 유지했다. 한병화 연구원은 ""한국과 중국 업체들이 경쟁적으로 대규모 증설에 나서고 있다""며 ""이와 같은 흐름은 상아프론테크에 유리하게 작용할 것""이라고 분석했다. LG디스플레이는 지난주 파주 유기발광다이오드(OLED) 신규라인에 1조8000억원의 투자를 발표했다. 이번 투자는 2018년까지 10조원 규모로 진행되는 증설의 일부다. 한 연구원은 ""상아프론테크는 액정표시장치(LCD)와 OLED 라인의 디스플레이 패널을 이송하는 장치인 카세트의 글로벌 독과점업체""라며 ""국내의 LG디스플레이와 중국 대만 등 대부분의 디스플레이업체들을 고객으로 두고 있다""고 설명했다. 이어 ""한국과 중국업체의 증설경쟁으로 상아프론테크의 카세트 매출은 내년 350억원, 2017년 430억원, 2018년 500억원을 기록할 것""이라고 내다봤다. 반도체 부문도 고객사 확대를 통해 매출이 급증할 것이란 관측이다. 상아프론테크는 일본업체가 독점하던 초극박막 불소수지 필름(ETFE) 시장에 진입했다. 대만업체 등 해외업체들에게도 ETFE를 공급할 가능성이 높다는 게 한 연구원의 분석이다. 그는 반도체 관련 매출이 올해 93억원에서 내년 143억원으로 54% 증가할 것이라고 예상했다. 앞으로 한동안 상아프론테크의 실적 성장은 지속될 것이란 전망이다. 한 연구원은 ""상아프론테크의 성장을 견인하는 최대 요인은 매년 50% 이상 성장할 전기차 관련 매출""이라며 ""반도체소재·장비 역시 고난도의 부품으로 마진율이 높다""고 말했다. 이어 ""결론적으로 향후 3~4년간 상아프론테크의 견조한 실적 성장을 제한할 요인을 찾기 어려운 상태""리며 ""안정적인 실적, 전기차 산업의 성장 등을 바탕으로 글로벌 핵심 소재·부품업체로 재평가될 것""이라고 했다. 김근희 한경닷컴 기자"
서울경제,089980,/news/news_read.nhn?article_id=0002767823&office_id=011&mode=search&query=상아프론테크&page=1,2015-11-27 10:47,"상아프론테크, 중대형 전지 매출액이 늘어나고 있다","메리츠종금증권 김승철 연구원은 상아프론테크(089980)에 대해 ""최근 관심을 끌고 있는 전기차 부품은 동사의 중장기적 성장 동력이다. 현재 동사는 배터리 전해액 누수 방지(seal) 부품을 삼성 SDI 에 납품하고 있는데 최근 소형 전지 CAP ASS’Y 에 이어 전기차 배터리인 중대형 전지 CAP ASS’Y 매출액이 늘어나고 있다""라고 분석했다. 또한 메리츠종금증권은 ""반도체 패키징 과정에서 소자를 보호하는 ETFE 필름 역시 일본의 Asahi Glass 가 독점하던 것을 동일한 품질에 싼 가격으로 개발을 완료하여 삼성전자 등에 납품하고 있다. 올해부터 증설이 완료되어 현재 매분기 외형성장이 이루어지고 있는 사업분야""라고 밝혔다. 한편 ""불소수지를 이용한 제품의 다양한 응용성을 보여주는 또 다른 사례가 바로 의료기기용 주사기이다 특히 일회용 주사기 재사용 방지기능을 갖추었기 때문에 최근 이슈가 된 주사기 재사용에 따른 감염 사례를 막기 위한 제품으로 그 중요성이 부각될 것""이라고 전망했다. 김 연구원은 27일 상아프론테크(089980)에 대해 ""팔색조 매력 분출!""이라며 투자의견을 '매수'로 제시하였다. 아울러 6개월 목표주가를 17,500원으로 내놓았다. ▷ 2차전지 섹터"
아이뉴스24,089980,/news/news_read.nhn?article_id=0000364184&office_id=031&mode=search&query=상아프론테크&page=1,2015-12-09 14:42,"상아프론테크, 일체형 안전필터주사기 품목허가 취득","[김다운기자] 첨단 부품·소재 및 의료기기 제조 전문기업인 상아프론테크는 최근 식품의약품안전처로부터 자체 개발한 그린메디 안전필터주사기에 대해 품목허가를 획득했다고 9일 발표했다. 이 제품은 약물 주사에 사용되는 일체형 A.D(Auto Disable) 안전필터 주사기다. A.D 기능은 최근 사회적으로 이슈가 되고 있는 집단 C간염 감염 등 주사기 재사용으로 인해 발생할 수 있는 질병을 원천적으로 방지하는 기능이다. 주사제 포장에 사용되는 앰플 등의 유리나 고무가루가 환자의 몸으로 유입되는 것을 차단하는 동시에, 주사기 재사용 방지, 의료진의 주사바늘 찔림 사고로 인한 2차 감염 방지 등이 가능하도록 안전 기능을 강화했다는 설명이다. 회사는 품목허가와 동시에 본사에서 신제품 발표회를 개최하는 등 유통라인 구축에 나서며 본격적인 판매에 돌입할 방침이다. 회사 관계자는 ""이번 품목허가를 기점으로 해당 시장을 적극 공략할 것""이라며 ""일체형 안전필터주사기 시장은 지속적으로 확대되고 있는 만큼, 향후 회사 매출에서 큰 역할을 담당할 것""이라고 기대했다. /김다운기자"
이데일리,089980,/news/news_read.nhn?article_id=0003804116&office_id=018&mode=search&query=상아프론테크&page=1,2017-04-20 07:29,"상아프론테크, 고어텍스 개발 성공&hellip;'신성장 동력'-유진","[이데일리 박형수 기자] 유진투자증권은 20일 상아프론테크(089980)에 대해 꿈의 소재인 폴리테트라플루오르 에틸렌(ePTFE) 멤브레인을 개발해 새로운 성장동력을 찾았다고 평했다. 투자의견 ‘매수’와 목표주가 1만6000원을 유지했다. 한병화 유진투자증권 연구원은 “ ePTFE 멤브레인은 고어사가 1965년 개발한 소재”라며 “흔히 고어텍스 멤브레인으로 알고 있다”고 소개했다. 이어 “불소수지로 만드는 최고 난이도 소재”라며 “소재표면에 마이크론 단위 미세공기 구멍이 있기 때문에 열과 습기를 배출하는 대신 입자가 큰 물은 침투하지 못한다”고 설명했다. 그는 “핵심특허 기간은 1997년 끝났지만 대체할 소재를 개발한 업체가 드물다”며 “상아프론테크는 43년의 업력을 바탕으로 소재를 개발하고 제조설비도 준비했다”고 덧붙였다. 한 연구원은 “ePTFE 시장은 최소 3조원 이상”이라며 “생산공정용 수처리 필터, 방수, 차폐용 IT소재, 자동차 전장용 모터 보호장치, 전지 분리막, 인공혈관 등 다양한 산업에 적용하고 있다”고 분석했다. 아울러 “아웃도어 원단용, IT 방수용, 반도체 공정용 수처리 필터, 분리막용 멤브레인 개발과 시험을 국내외 업체와 진행하고 있다”며 “멤브레인 수요업체인 국내 IT, 자동차 대기업이 상아프론테크 기존 고객”이라고 강조했다. 상아프론테크가 앞으로 10년 이상 성장할 기반을 마련했다고 한 연구원은 판단했다."
이데일리,089980,/news/news_read.nhn?article_id=0003441802&office_id=018&mode=search&query=상아프론테크&page=1,2016-01-04 08:31,"상아프론테크, 전기차 부품 고성장&hellip; 4Q 영업이익 개선-유진","[이데일리 이명철 기자] 유진투자증권은 4일 상아프론테크(089980)에 대해 지난해 4분기 실적이 전년보다 대폭 호전되고 전기차 부품의 고성장을 감안하면 해외 동종업체보다 현재 저평가 국면이라고 진단했다. 투자의견은 매수(Buy), 목표주가 1만6000원을 제시했다. 한병화 유진투자증권 연구원은 “회사 4분기 매출액은 353억원으로 전년동기대비 12% 증가하고 영업이익 24억원으로 흑자 전환할 것”이라며 “영업이익은 목표 달성에 따른 특별상여금 7억~8억원을 가정한 수치로 실제로는 31억~32억원 수준을 달성할 것으로 추정된다”고 분석했다. 실적 호진은 주요인은 전기차와 반도체용 부품·소재 매출 증가 때문으로 풀이됐다. 이들 부품·소재 매출은 4분기 77억원으로 전년동기대비 120% 증가한 것으로 파악됐다. 그는 “전기차 부품은 중국 시안공장의 본격 가동, 반도체 소재는 라인 증설과 고객사 확대 등으로 올해 393억원의 매출이 발생해 지난해보다 60% 증가할 것”이라고 추정했다. 특히 전기차 관련 업체가 매력적인 투자 대상으로 꼽히지만 매출 성장 초기로 이익이 충분히 실현되는 업체를 찾기 어렵다는 점에서 안정성이 부각되고 있다. 회사는 특수 엔지니어링 플라스틱이라는 독과점 소재 기술을 기반으로 기존 사업에서 이익이 나타나고 있고 전기차용 부품이 연평균 40% 이상 성장할 것으로 예상된다. 한 연구원은 “해외 소재·부품 업체들의 경우 진입장벽이 높다는 이유로 내년 실적 기준 주가수익률(PER)이 15~64배로 높은 프리미엄을 받고 있다”며 “회사가 생산하는 대부분 제품이 글로벌 독과점 상태이고 전기차 부품의 고성장에 힘입어 밸류에이션 매력이 배가될 것”이라고 전했다."
전자신문,089980,/news/news_read.nhn?article_id=0002629341&office_id=030&mode=search&query=상아프론테크&page=1,2017-07-31 09:54,[ET투자뉴스]상아프론테크_외국인의 매수에 기관은 순매도 현재 -1.86% 4일연...,"기관이 외국인과 반대 방향으로 매매를 하고 있다. 외국인은 어제까지 2일 연속 순매수를 기록했지만, 기관이 3일 연속 순매도로 대응하면서 주가를 끌어내리고 있다. 상아프론테크는 기관의 팔자세 영향으로 약세흐름을 보이고 있고, 31일 오전 9시 48분 현재 300원(1.86%) 내린 15,800원을 기록하고 있다.    [주가/수급동향]     기관이 3일연속 주식을 팔고 있는 반면 외국인은 2일연속 주식을 사고 있다. 최근 한달간 상아프론테크의 매매회전율을 분석한 결과 15일에 1번 꼴로 주식의 주인이 바뀐 것으로 나타났다.  회전율이 높은 경우 유동성이 좋다고 할 수 있으나 이런경우 주가변동이 심한 경우가 많아 주의가 요구된다.  동종목의 경우도 일평균 주가변동률이 7.55%에 달해 장중 주가변동이 상당히 크다는 것을 알 수 있다.  그리고 최근 5일간 거래비중은 개인이 전체 거래량의 86.39%를 차지하며 가장 활발한 참여를 보였고, 외국인은 9.38%, 기관은 4.21%의 거래 참여율을 보였다.     [투자의견]"
매일경제,089980,/news/news_read.nhn?article_id=0003657493&office_id=009&mode=search&query=상아프론테크&page=1,2016-01-04 08:06,"[Hot-Line] &ldquo;상아프론테크, 4분기 호실적 예상&hellip;전기차 부문 성장 견인&rdquo;","유진투자증권은 4일 상아프론테크에 대해 지난 4분기 실적이 큰 폭으로 호전될 것이라며 투자의견 ‘매수’와 목표주가 1만6000원을 유지했다. 한병화 유진투자증권 연구원은 “상아프론테크는 기존 사업 안정성에 전기차 부문이 실적 성장을 견인할 것으로 추정된다”면서 “전기차용 부품이 연평균 40% 이상의 성장을 이끌 것”이라고 말했다. 실제로 최근 전기차 관련주가 가장 매력적인 투자대상으로 부상하고 있지만, 아직 매출 성장 초기 단계에 있기 때문에 실질적인 이익을 내고 있는 업체를 가려내기는 어렵다. 하지만 상아프론테크는 특수 엔지니어링 플라스틱이라는 독과점 소재기술을 기반으로 기존 사업에서도 빠르게 이익을 나타내고 있어 동종업체 대비 저평가 됐다는 설명이다. 한 연구원은 “상아프론테크의 4분기 매출액은 전년 동기 대비 12% 증가한 353억원, 영업이익은 24억원을 기록해 흑자전환할 것”이라면서 “특히 영업이익은 목표달성에 따른 특별상여금 7~8억원 지급을 가정한 수치이기 때문에 실제로는 31~32억원 가량을 달성할 것으로 예상된다”고 설명했다. 이어 “올해에도 전기차 부품은 중국 시안 공장의 본격 가동효과, 반도체소재는 라인 증설과 고객사 확대 효과 등으로 관련 매출만 393억원으로 예상돼 지난해 대비 60% 가량 증가할 것”이라고 전망했다. [매경닷컴 김경택 기자] r_start // r_end // [ⓒ 매일경제 & mk.co.kr, 무단전재 및 재배포 금지] 매일경제 관련뉴스해당 언론사에서 선정하며 언론사 페이지(아웃링크)로 이동해 볼 수 있습니다.지주연, 초미니 입고 계단을 성큼성큼 걷다…허벅지 사이로 아찔하게 '헉'상시적 위기에 노출된 기업…경쟁자가 누군지도 모른다석현준, 새해부터 골폭풍…벼락같은 프리킥 선제골피지서 헬리콥터 바람에 '휙' 나무와 충돌 순간 포착차지연, 과감하게 '상의 훌러덩~'…""그녀는 이번에도 실망시키지 않았다"""
