source,symbol,link,date,title,content
파이낸셜뉴스,092590,/news/news_read.nhn?article_id=0003532233&office_id=014&mode=search&query=럭스피아&page=1,2015-10-30 10:32,"럭스피아, 코넥스시장 신규상장","한국거래소 코스닥시장본부는 30일 서울 여의도 사옥에서 유기발광다이오드(LED) 패키지 및 모듈 개발 전문기업인 럭스피아의 코넥스시장 신규상장기념식을 개최했다. 상장기념패 전달 후 김혜경 코넥스협회 부회장, 김재준 한국거래소 코스닥시장위원회 위원장, 성석종 럭스피아 대표이사, 강대석 신한금융투자 대표이사, 김영균 한국IR협의회 상무(왼쪽부터)가 기념촬영을 하고 있다.

 ※ 저작권자 ⓒ"
한국경제,092590,/news/news_read.nhn?article_id=0003461452&office_id=015&mode=search&query=럭스피아&page=1,2015-10-26 15:59,"럭스피아, 30일 코넥스시장 신규 상장","[ 정현영 기자  ] 한국거래소(이사장 최경수)는 럭스피아의 코넥스시장 신규 상장을 승인, 오는 30일부터 주권 매매거래가 가능하다고 26일 밝혔다. 럭스피아는 반도체 제조업체로, 주요제품은 LED 패키지와 모듈이다. 주당 평가가격은 1015원(액면가)이며 지정자문인은 신한금융투자다. 정현영 한경닷컴 기자"
이데일리,092590,/news/news_read.nhn?article_id=0003381398&office_id=018&mode=search&query=럭스피아&page=1,2015-10-30 10:42,[포토]럭스피아(주) 코넥스시장 신규상장기념식,"[이데일리 신종오 기자]럭스피아(주) 코넥스시장 신규상장기념식 한국거래소 코스닥시장본부는 30일 오전 서울사옥 홍보관에서 LED 패키지 및 모듈 개발 전문기업인 럭스피아(주)의 코넥스시장 신규상장기념식을 개최했다. 상장기념패 전달 후 기념촬영 왼쪽부터 김혜경 코넥스협회 부회장, 김재준 한국거래소 코스닥시장위원회 위원장, 성석종 럭스피아(주) 대표이사, 강대석 신한금융투자 대표이사, 김영균 한국IR협의회 상무.  한국거래소 제공."
전자신문,092590,/news/news_read.nhn?article_id=0002408809&office_id=030&mode=search&query=럭스피아&page=1,2015-10-30 10:30,"럭스피아, 코넥스시장 신규상장","한국거래소 코스닥시장본부는 30일 서울사옥 홍보관에서 LED 패키지 및 모듈 개발 전문기업인 럭스피아 의 코넥스시장 신규상장 기념식을 개최했다. 왼쪽부터 김혜경 코넥스협회 부회장, 김재준 한국거래소 코스닥시장위원장, 성석종 럭스피아 대표, 강대석 신한금융투자 대표, 김영균 한국IR협의회 상무."
아시아경제,092590,/news/news_read.nhn?article_id=0003599541&office_id=277&mode=search&query=럭스피아&page=1,2015-10-08 14:43,"한국거래소, 럭스피아의 코넥스시장 상장신청서 접수",[아시아경제 김원규 기자] 한국거래소는 럭스피아의 코넥스시장 신규상장신청서를 접수했다고 8일 밝혔다. 거래소는 상장적격성보고서 검토 및 현지심사 등 2주간의 삼장심사를 거쳐 럭스피아의 상장승인 여부를 결정할 예정이다. 8일 현재 코넥스시장의 상장회사는 총 89개다.
서울경제,092590,/news/news_read.nhn?article_id=0002747817&office_id=011&mode=search&query=럭스피아&page=1,2015-10-08 14:35,한국거래소 럭스피아의 코넥스시장 상장신청서 접수,"한국거래소는 8일 럭스피아의 코넥스시장 신규상장신청서를 접수했다고 밝혔다. 반도체 제조업체인 럭스피아는 지난해 기준 101억2,100만원의 매출액, 5억2,300만원의 당기순이익을 올렸다. 자기자본은 73억8,900만원 규모다. 신한금융투자가 지정자문인을 맡았다. 한국거래소는 약 2주간의 상장심사(제출한 상장적격성보고서 검토 및 현지심사)를 거쳐 상장승인 여부를 결정할 예정이다."
파이낸셜뉴스,092590,/news/news_read.nhn?article_id=0003922705&office_id=014&mode=search&query=럭스피아&page=1,2017-12-12 11:14,"[fnRASSI]럭스피아, 13.12% 오르며 거래량 증가","럭스피아(092590)의 현재 거래량이 최근 5거래일 거래량의 최고치를 경신했다. 그리고 럭스피아는 5일 연속 상승흐름을 보이며, 11시 11분 현재 13.12% 증가한 940원에 거래중이다. 'fnRASSI'는 증권전문 기업 씽크풀과 파이낸셜뉴스의 협업으로 로봇기자가 실시간으로 생산하는 기사입니다."
뉴스1,092590,/news/news_read.nhn?article_id=0001707686&office_id=421&mode=search&query=럭스피아&page=1,2015-10-30 10:48,럭스피아(주) 코넥스시장 신규상장기념식,"(서울=뉴스1) 장인범  = 한국거래소 코스닥시장본부는 30일 서울 여의도 사옥 홍보관에서 LED 패키지 및 모듈 개발 전문기업인 럭스피아(주)의 코넥스시장 신규상장기념식을 개최하고 상장기념패 전달 뒤 기념촬영을 하고 있다. 왼쪽부터 김혜경 코넥스협회 부회장, 김재준 한국거래소 코스닥시장위원회 위원장, 성석종 럭스피아(주) 대표이사, 강대석 신한금융투자 대표이사, 김영균 한국IR협의회 상무. (한국거래소 제공) 2015.10.30/뉴스1"
뉴시스,092590,/news/news_read.nhn?article_id=0006842836&office_id=003&mode=search&query=럭스피아&page=1,2015-10-30 10:17,럭스피아 코넥스시장 신규상장 기념식,"【서울=뉴시스】한국거래소 코스닥시장본부는 30일 서울 여의도 서울사옥 홍보관에서 LED 패키지 및 모듈 개발 전문기업인 럭스피아의 코넥스시장 신규상장 기념식을 개최했다. 왼쪽부터 김혜경 코넥스협회 부회장, 김재준 한국거래소 코스닥시장위원회 위원장, 성석종 럭스피아 대표이사, 강대석 신한금융투자 대표이사, 김영균 한국IR협의회 상무가 기념촬영을 하고 있다. 2015.10.30. (사진=한국거래소 제공)"
이데일리,092590,/news/news_read.nhn?article_id=0003364878&office_id=018&mode=search&query=럭스피아&page=1,2015-10-08 15:01,"반도체 제조업체 럭스피아, 코넥스 상장 신청","[이데일리 경계영 기자] 한국거래소는 럭스피아가 코넥스시장 신규 상장 신청서를 8일 접수했다고 밝혔다. 럭스피아는 LED 패키지·모듈 제조업체로 지난해 매출액과 순이익이 각각 101억2100만원, 5억2300만원을 기록했다. 자기자본은 73억8900만원이다. 지정자문인은 신한금융투자가 맡는다. 거래소는 2주 간의 상장심사를 거쳐 상장 승인 여부를 결정할 예정이다."
연합뉴스,092590,/news/news_read.nhn?article_id=0007954402&office_id=001&mode=search&query=럭스피아&page=1,2015-10-30 09:46,럭스피아(주) 코넥스시장 신규상장기념식,"(서울=연합뉴스) 한국거래소 코스닥시장본부는 30일 오전 서울사옥 홍보관에서 럭스피아(주)의 코넥스시장 신규상장기념식을 개최했다. 상장기념패 전달 후 김혜경 코넥스협회 부회장(왼쪽부터), 김재준 한국거래소 코스닥시장위원회 위원장, 성석종 럭스피아(주) 대표이사, 강대석 신한금융투자 대표이사, 김영균 한국IR협의회 상무가 기념촬영을 하고 있다. 2015.10.30 >"
한국경제,092590,/news/news_read.nhn?article_id=0003447423&office_id=015&mode=search&query=럭스피아&page=1,2015-10-08 14:50,"거래소, 럭스피아 코넥스시장 상장신청서 접수","[ 정현영 기자  ] 한국거래소(이사장 최경수)는 럭스피아(지정자문인 신한금융투자)의 코넥스시장 신규 상장신청서를 8일 접수했다고 밝혔다. 거래소는 약 2주간 상장심사(제출한 상장적격성보고서 검토 및 현지심사)를 거쳐 상장승인 여부를 결정하게 된다. 럭스피아는 LED패키지 모듈 전문기업으로, 지난해 매출액과 순이익이 각각 101억2100만원과 5억2300만원을 기록했다. 정현영 한경닷컴 기자"
파이낸셜뉴스,092590,/news/news_read.nhn?article_id=0003532489&office_id=014&mode=search&query=럭스피아&page=1,2015-10-30 16:13,"럭스피아, 코넥스 상장기념식 개최","한국거래소 코스닥시장본부는 30일 서울 여의도 사옥 홍보관에서 LED 패키지 및 모듈 개발 전문기업 럭스피아의 코넥스 시장 상장기념식을 개최했다. 김혜경 코넥스협회 부회장, 김재준 한국거래소 코스닥시장위원회 위원장, 성석종 럭스피아 대표이사, 강대석 신한금융투자 대표이사, 김영균 한국IR협의회 상무(왼쪽부터)가 기념촬영을 하고 있다.

 ※ 저작권자 ⓒ"
헤럴드경제,092590,/news/news_read.nhn?article_id=0000892226&office_id=016&mode=search&query=럭스피아&page=1,2015-10-30 09:52,"럭스피아, 코넥스시장 신규상장기념식","[헤럴드경제 =박영훈 기자] 한국거래소 코스닥시장본부는 30일 서울사옥 홍보관에서 LED 패키지 및 모듈 개발 전문기업인 럭스피아(주)의 코넥스시장 신규상장기념식을 개최했다. 김혜경 코넥스협회 부회장(왼쪽부터), 김재준 한국거래소 코스닥시장위원회 위원장, 성석종 럭스피아(주) 대표이사, 강대석 신한금융투자 대표이사, 김영균 한국IR협의회 상무 등이 참석, 기념촬영을 하고 있다."
