source,symbol,link,date,title,content
아이뉴스24,093240,/news/news_read.nhn?article_id=0000453914&office_id=031&mode=search&query=형지엘리트&page=1,2018-07-12 09:11,[인터뷰] 형지엘리트 &quot;개성공단에서 중국 교복 만들 것&quot;,"[아이뉴스24 장효원 기자] 교복의 명가 형지엘리트는 남과 북의 화해 분위기를 누구보다 반기는 기업이다. 2011년부터 개성공단 업체와 협력한 형지엘리트는 2016년 갑작스런 폐쇄 전까지 대부분의 교복을 개성에서 생산했다. 교복업체 중에서는 유일하다. 형지엘리트는 개성공단이 재개되면 현재 집중하고 있는 중국 수출 물량을 개성에서 생산할 계획이다. 중국 시장을 공략하기 위해선 고품질 교복이 필요한데, 형지엘리트의 노하우와 북한 노동자의 협업으로 이를 만들어 낼 수 있기 때문이다. ◆ 개성공단 '노하우' 있어… 빠른 생산 가능 임재용 형지엘리트 전무는 와 만나 ""2016년에만 해도 북한 노동자의 인건비가 여러 가지 세금 등을 포함해도 한국의 70% 수준이었다""며 ""거리도 가까워 물류비도 많이 들지 않아 당시에는 대부분의 교복을 개성공단에서 생산했다""고 말했다. 하지만 개성공단은 남북의 관계가 냉각되며 잠정 폐쇄됐다. 임 전무는 2016년 2월10일을 생생히 기억한다. 당시 신학기 이전 판매되는 동복, 곧 다가올 여름용 하복, 게다가 생산을 위한 원부자재까지 개성공단에 있는 상황에서 모든 재고를 놓고 내려왔기 때문이다. 임 전무는 ""폐쇄 당시 남쪽으로 내려갈 수 있는 시간이 정해져서 그 시간을 넘기면 아무 것도 못 가지고 내려오는 상황이었다""며 ""재고와 원자재가 많아서 제 시간에 맞춰 가져나올 수 없었다""고 회상했다. 교복은 놓고 내려왔지만 형지엘리트는 북한 노동자들과 일하는 '노하우'를 가져왔다. 남북의 문화차이로 말 한마디 조심해야 했던 처음, 형지엘리트는 상주 직원을 파견하는 등 적극적으로 북한 노동자들과 교감했다. 결국 '돈'보다 '당'을 따르던 북한 노동자들도 서서히 마음을 열었고 한국의 기술을 공유하며 숙련공으로 거듭났다. 그는 ""우리 교복을 만들기 위해서는 숙련된 기술자가 필요한데, 처음 북한 노동자들과 일할 때는 적응하는 데만 1년여의 시간이 필요했다""며 ""지금은 어떻게 북한 노동자의 마음을 얻는지 알기 때문에 개성공단이 재개되면 빠르게 숙련공을 키워 생산에 돌입할 수 있을 것""이라고 자신했다. ◆ 개성공단 생산으로 중국사업 탄력↑ 개성공단이 재가동되면 형지엘리트의 중국 사업도 더 탄력 받을 전망이다. 현재 형지엘리트 교복의 목표시장은 중국이다. 국내 중고등학생이 계속 줄어드는 상황에서 중국의 2억명 학생을 타깃으로 시장을 공략한다는 방침이다. 앞서 2016년 형지엘리트는 중국 빠우시냐우그룹과 상하이 합자법인 '상해엘리트의류유한회사'를 설립했다. 2005년 독자적으로 진출을 시도했지만 독특한 중국 영업방식에 좌절하고 중국기업과 협력하는 방식을 택했다. 합작법인은 지난 5월 60억원 규모의 수주계약을 따내는 등 이제 성과를 내고 있다. 올해는 전년보다 3~4배 더 큰 규모의 수주를 할 계획이다. 임 전무는 ""현재 우리 교복은 중국 내에서 품평회를 하면 거의 1등을 할 정도로 인정받고 있어 중국 국제학교, 상류층학교 등에 들어간다""며 ""이 배경에는 중국 교복업체들이 따라갈 수 없는 기술력과 디자인, 높은 품질 등이 있는데 가장 중요한 건 숙련된 기술자들""이라고 강조했다. 이에 숙련된 기술자가 있는 개성공단에서 중국으로의 수출 제품을 만들겠다는 복안이다. 북한 인력은 의사소통도 원활하고 중국 노동자들보다 더 주인의식을 갖고 일해 훨씬 훌륭한 품질의 제품을 만들 수 있다는 설명이다. 게다가 최근 중국의 인건비도 급상승해 비용 측면에서도 훨씬 우월하다. 그는 ""중국 수출품을 개성공단에서 생산하면 높은 품질 뿐 아니라 서울-개성-평양-신의주를 통한 육로 수출도 기대할 수 있게 된다""며 ""하루빨리 개성공단이 재개되고 남북이 더 가까워져서 앞으로 북한에 우리 교복을 팔 수 있는 날이 왔으면 좋겠다""고 말했다. /장효원기자"
디지털타임스,093240,/news/news_read.nhn?article_id=0002355310&office_id=029&mode=search&query=형지엘리트&page=1,2016-07-27 11:36,"형지엘리트, 2016년 프리미엄브랜드지수(KS-PBI) 8년 연속 1위","형지엘리트의 교복 브랜드 엘리트(대표이사 최병오, 홍종순)가 '2016년 프리미엄브랜드지수(KS-PBI)'에서 학생복 부문 8년 연속 1위로 선정됐다. 올해 9회째를 맞는 프리미엄브랜드지수(KS-PBI)는 한국표준협회와 서울대 경영연구소가 기업의 경쟁력 제고와 프리미엄브랜드의 전략적 관리를 위해 개발한 브랜드 평가제도이다. 브랜드 자산 평가 모델을 통한 대규모 국내 소비자 조사를 통해 브랜드의 현재 가치에 미래 가치까지 반영, 분야별 최고 프리미엄 가치를 지닌 브랜드를 발표하고 있다. 8년 연속 1위의 영예를 안은 엘리트는 1969년 '에리트 학생복지'를 출시한 이래 대한민국 대표 학생복 브랜드로 업계를 선도하고 있다. 몸에 딱 맞는 편안한 핏을 위한 입체 패턴 도입, 추위와 더위를 모두 이겨낼 수 있는 계절별 고기능성 원단 개발 등을 통해 교복 품질향상 및 기술개발에 힘쓰고 있다. 이번 조사에서 마켓 리더십과 브랜드 사회적 책임 항목에서 특히 높은 점수를 받았다. 50여 년 간 업계 리딩 브랜드로 자리매김한 점, 나라사랑캠프 및 한문화재 한지킴이 등 10대 중심의 사회공헌활동을 꾸준하게 전개했다는 부분에서 좋은 평가를 받은 것이다. 20일 오전 롯데호텔 서울 크리스탈볼룸에서 열린 시상식에 참석한 형지엘리트 이범구 상무는 ""8년간 변함없는 애정과 사랑을 보내 주신 고객 여러분 덕에 오늘과 같은 영광을 맞이할 수 있었다""며 ""앞으로도 학생과 학부모, 학교의 목소리를 모두 아울러 가장 편하고 예쁜 교복을 선보일 수 있도록 지속적인 품질 관리에 힘쓸 것""이라고 전했다."
이데일리,093240,/news/news_read.nhn?article_id=0003358327&office_id=018&mode=search&query=형지엘리트&page=1,2015-10-01 09:51,"에리트베이직, 형지엘리트로 상호 변경&hellip; 그룹 시너지 강화",- 그룹 통합 CI 적용… 이에프씨로 본사 이전 형지엘리트 CI. [이데일리 이명철 기자] 패션의류 전문기업인 에리트베이직(093240)이 모그룹인 패션그룹형지의 통합 CI를 적용한 형지엘리트로 상호를 바꾸고 그룹과 시너지 강화에 나설 방침이다. 에리트베이직은 1일부터 상호를 형지엘리트로 변경·적용한다고 이날 밝혔다. 이번 상호변경은 패션그룹형지가 올해 창립 33주년을 맞아 그룹 통합 CI를 발표하고 글로벌 패션유통기업으로 성장한다는 비전에 맞춘 것이다. 앞으로 패션그룹형지와 전사 협업을 통해 미래성장동력인 패션사업부를 키우고 중국·유럽 등 글로벌 시장 개척에 박차를 가할 계획이다. 회사는 또 지난 3월 인수한 패션사업부의 핵심인 이에프씨로 본사를 이전했다. 마케팅·관리·인력 부문에서 이에프씨와 협업을 통해 업무 효율성을 높이겠다는 복안이다. 서울 강남구 테헤란로에 위치한 이에프씨 사옥은 패션그룹형지 본사와 인근에 위치해 그룹 통합 인프라를 활용할 수 있을 것으로 기대된다. 지난달에는 물류센터를 형지그룹의 통합물류센터로 옮겨 연간 20억원 규모의 비용이 절감될 것으로 추산했다. 홍종순 대표는 “이번 CI 변경은 회사 제2의 도약을 위한 상징적인 첫 걸음”이라며 “앞으로 형지그룹과의 전사적인 협업을 통해 종합패션기업으로서 면모를 갖춰 나갈 것”이라고 전했다. 서울 강남구 이에프씨 사옥 전경.(사진=형지엘리트 제공)
이데일리,093240,/news/news_read.nhn?article_id=0003612318&office_id=018&mode=search&query=형지엘리트&page=1,2016-08-18 18:06,"형지엘리트, 200억 규모 CB 발행 결정","[이데일리 유근일 기자] 형지엘리트(093240)는 200억원 규모의 무기명식 이권부 무보증 사모 전환사채 발행을 결정했다고 18일 공시했다. 사채 만기 이자율은 1.0%, 전환가액은 주당 6545원이다."
한국경제,093240,/news/news_read.nhn?article_id=0003937370&office_id=015&mode=search&query=형지엘리트&page=1,2018-05-11 14:01,"[형지엘리트] 15% 이상 상승, 키움증권, 교보증권 등 매수 창구 상위에 랭킹","11일 오후 13시 56분 현재 형지엘리트는 전 거래일보다 15.2% 오른 5,760원에 거래되고 있다. 주가의 흐름은 4,985원으로 개장해서 장중 한때 4,965원(-0.7%)까지 소폭 밀렸다가 다시 5,840원(+16.8%)까지 상승 반전한 후, 현재는 5,760원(+15.2%)에서 머물면서 장중에 많이 상승한 모습이다. ◆ 거래원 동향 - 키움증권, 교보증권 등 매수 창구 상위에 랭킹 현재 거래원 동향은 키움증권, 교보증권, 미래에셋 등이 매수 상위 목록에 나타나고 있다. 한편, 매도 창구 상위에는 모건스가 눈에 띄고 있다. 이 시간 교보증권이 매수창구상위에 올라있는 종목은 이 종목 이외에도 비아트론, 이스트소프트 등이 있다. [표]형지엘리트 거래원 동향 ◆ 주체별 매매동향 - 최근 3일간 외국인 대량 순매도 지난 한달을 기준으로 보면 외국인이 18.9만주를 순매수한 반면, 기관은 12.8만주를 순매도했고, 개인들도 6.2만주를 순매도한 것으로 집계됐다. 같은 기간 이 종목의 거래비중은 외국인과 개인이 각각 12.7%, 86.0%로 비중이 높다. 한편 기관은 이 종목에 대해서 최근 7일 연속 486주 순매수를 하고 있다. 더욱이 최근 3일간 외국인이 대량 순매도를 하고 있어 투자자들의 관심이 집중되고 있다. [표]형지엘리트 외국인/기관 매매동향 한경로보뉴스 이 기사는 한국경제신문과 씽크풀이 공동 개발한 기사 자동생성 알고리즘에 의해 실시간으로 작성된 것입니다. ["
한국경제,093240,/news/news_read.nhn?article_id=0003580564&office_id=015&mode=search&query=형지엘리트&page=1,2016-04-18 09:43,"[특징주]형지엘리트, 中 시장 진출 소식에 7거래일째 '급등'",[ 김근희 기자  ] 형지엘리트가 중국 교복시장 진출 소식에 연일 급등하며 52주 신고가를 ㄱ경신했다. 18일 오전 9시40분 현재 형지엘리트는 전 거래일보다 1800원(19.78%) 오른 1만900원에 거래되고 있다. 이로써 형지엘리트는 52주 싱고가를 갈아치웠다. 회사 측은 지난 6일 중국의 빠우시냐우그룹 계열 상해보노복장회사와 중국 교복사업 진출을 위한 업무협약(MOU)을 체결했다고 밝혔다. 이후 주가는 7거래일 연속 급등세다. 김근희 한경닷컴 기자
파이낸셜뉴스,093240,/news/news_read.nhn?article_id=0003577114&office_id=014&mode=search&query=형지엘리트&page=1,2016-01-08 10:23,"형지엘리트, 새해 맞이 소노비와 &lsquo;훈녀 백팩 득템 프로젝트&rsquo; 2탄 진행","형지엘리트의 국내 No. 1 교복 브랜드 엘리트가 15일까지 감성 잡화 브랜드 소노비(SONOVI)와 함께 ‘훈녀 백팩 득템 프로젝트 2탄’을 실시한다. 참여 방법은 소노비 페이스북 페이지(www.facebook.com/sonovibag)에서 ‘좋아요’를 누르고, 댓글로 신년인사를 작성한 뒤, 엘리트학생복 블로그(eliteblog.co.kr) 이벤트 게시글 댓글로 페이스북 아이디를 남기면 된다. 당첨자는 22일 소노비 페이스북에서 공개되며, 추첨을 통해 30만원 상당의 ‘소노비 와펜 그래픽 백팩’을 증정한다. 자세한 내용은 엘리트 블로그에서 확인할 수 있다. 형지엘리트 마케팅 담당자는 “지난 12월 진행했던 소노비와의 제휴 이벤트에 대한 뜨거운 호응에 보답하고자 추가 이벤트를 마련했다”며 “세련된 핏과 편안함을 자랑하는 엘리트 교복과 어울리는 소노비 백팩과 함께 스타일과 감성까지 새로워지는 2016년 신학기가 됐으면 한다”고 전했다."
한국경제,093240,/news/news_read.nhn?article_id=0003616487&office_id=015&mode=search&query=형지엘리트&page=1,2016-06-28 15:36,"형지엘리트, 中 합작법인 지분 40% 취득&hellip;&quot;교복 브랜드 사업 전개&quot;","[ 조아라 기자  ] 형지엘리트는 의류 생산·판매 업체 상해엘리트의류유한회사(SHANGHAI YILITE FASHION CO.,LTD)의 지분 40%를 약 7억1000만원에 취득하기로 결정했다고 28일 공시했다. 이 금액은 연결기준 자기자본 대비 0.8%다. 회사 측은 ""현지법인을 통해 교복, 운동복 및 관련의류의 디자인·생산·판매를 통해 교복브랜드 사업을 전개할 것""이라고 밝혔다. 조아라 한경닷컴 기자"
파이낸셜뉴스,093240,/news/news_read.nhn?article_id=0003576336&office_id=014&mode=search&query=형지엘리트&page=1,2016-01-07 10:51,"형지엘리트, &lsquo;제2회 교복 아카데미&rsquo; 참가자 모집","형지엘리트의 교복 브랜드 엘리트가 8일부터 14일까지 예비 중고생 자녀를 둔 학부모를 위한 ‘제2회 엘리트 교복 아카데미’를 개최하고 참가자를 모집한다고 7일 밝혔다. ‘엘리트 교복 아카데미’는 학부모들이 교복을 직접 만져보고 입어보며 원단 구별법, 세탁 및 관리법, 핏 살려주는 법 등 다양한 정보를 공유하는 특별 체험 프로그램으로 오는 27일 오전 역삼동에서 진행된다. 2015년 9월 학부모 서포터즈 ‘엘리트맘’과 함께 1차 행사를 진행한 바 있다. 예비 중고등학생 자녀를 둔 엄마라면 누구나 참가 가능하며, 형지엘리트 브랜드 공식 홈페이지 및 SNS 채널, 모바일 알림장 어플리케이션 ‘아이엠스쿨’ 내 이벤트 배너를 클릭하면 참가 신청서를 접수할 수 있다. 참석자 전원에게 5만원 상당의 기념품과 교복 체험 기회를 제공한다. 추첨을 통해 총 35명을 선발하며, 당첨자는 19일 개별 통지된다. 형지엘리트 마케팅 관계자는 “예비 중고등학교 입학생을 둔 엄마들이 우리 아이가 어떤 교복을 입는지 눈으로 직접 보며 아이의 교복 생활을 간접 체험해 볼 수 있는 자리가 될 것”이라고 밝혔다. 한편, 엘리트는 학부모 교복 서포터즈 ‘엘리트맘(엘맘)’과 학생 서포터즈 ‘엘리트친구(엘친)’와 함께 ‘교복생활연구소’를 운영, 소비자들의 다양한 의견을 지속적으로 수렴, 반영해 활동성이 뛰어나고 실용적인 디자인의 학생복을 선보이고 있다."
파이낸셜뉴스,093240,/news/news_read.nhn?article_id=0003899702&office_id=014&mode=search&query=형지엘리트&page=1,2017-11-03 10:12,"[특징주]형지엘리트, 대규모 차입금상환..급락세",형지엘리트가 대규모 차입금 상환 소식에 급락세다. 3일 오전 10시6분 현재 코스피에서 형지엘리트는 전일대비 5.96% 내린 4890원에 거래중이다. 전일 형지엘리트는 유휴자산 매각을 통해 마련한 자금으로 에스콰이어 인수를 위해 차입한 450억원을 전액 상환 했다고 밝혔다.
아시아경제,093240,/news/news_read.nhn?article_id=0003729255&office_id=277&mode=search&query=형지엘리트&page=1,2016-04-18 09:18,"[특징주]형지엘리트, 中 호재에 7거래일 연속 상승세",[아시아경제 이정민 기자] 중국발 호재에 형지엘리트가 연일 상승세를 타고 있다. 18일 오전 9시17분 형지엘리트는 전 거래일 대비 13.74% 오른 1만350원을 기록하고 있다. 지난 6일 형지엘리트는 중국 종합패션그룹 빠우시냐우와 중국 교복 사업을 위한 업무 협약(MOU)을 체결했다고 밝혔다. 이후 회사 주가는 상한가를 기록하는 등 이날까지 계속 상승하고 있는 중이다.
파이낸셜뉴스,093240,/news/news_read.nhn?article_id=0003630091&office_id=014&mode=search&query=형지엘리트&page=1,2016-04-06 09:49,"형지엘리트, 6조원 규모 중국 교복시장 공략","▲형지엘리트는 6일 패션그룹형지 본사에서 중국의 ‘빠우시냐우’ 그룹과 함께 중국 교복사업 진출을 위한 협약식을 진행했다. 사진 중간 (좌) 빠우시냐우 그룹 왕린용(王琳?) 총경리 (우) 형지엘리트 홍종순 대표


 형지엘리트에서 전개하는 학생복 브랜드 '엘리트'가 중국의 '빠우시냐우' 그룹과 손잡고 6조원 규모의 중국 교복 시장 공략에 나선다. 형지엘리트는 6일 패션그룹형지 본사에서 중국 내 5개 패션 브랜드를 보유한 종합패션그룹 '빠우시냐우' 그룹과 함께 중국 교복 사업을 위한 협약을 체결했다. MOU 체결식에는 형지엘리트 홍종순 대표와 빠우시냐우 그룹의 왕린용 총경리 등이 참석했다. 두 회사는 올해 안에 중국 현지에 합자법인 후 각 사가 보유한 핵심 역량을 활용해 교복 제작 및 유통, 마케팅 등을 진행하게 된다. 빠우시냐우 그룹은 현재 중국 전역에서 패션 사업을 중심으로 부동산 및 금융투자업무까지 전개하고 있으며, 5개의 패션 브랜드를 비롯해 상장 복장회사 및 창업투자회사, 4개의 국제브랜드, 3개의 복장생산기지를 계열사로 두고 있다. 의류 생산에 대한 노하우를 기반으로 ISO9001 품질시스템 및 ISO14001 환경시스템의 인증을 받은 기업이다. 한편, 중국 교복 시장 규모는 약 6조원으로 추정된다. 최근 경제발전에 따른 교육 수요 증대로 사립학교 설립이 매년 10% 이상 늘어나고 있으며, 실질 구매력이 증가하면서 고품질 교복에 대한 선호도가 높아지고 있어 시장 규모는 더욱 커질 것으로 기대된다. 형지엘리트 홍종순 대표는 ""지난 2005년 업계 최초로 중국 쑹청화메이학교에 교복을 납품하며 국제적으로 경쟁력을 인정 받아왔고, 빠우시냐우 그룹과의 전략적인 사업제휴를 통해 본격적으로 중국 사업에 진출할 수 있게 됐다""며 ""이번 협약을 계기로 중국 시장 공략에 박차를 가할 것""이라고 말했다."
한국경제TV,093240,/news/news_read.nhn?article_id=0000649485&office_id=215&mode=search&query=형지엘리트&page=1,2018-06-18 12:37,"형지엘리트, 전일 대비 약 -6% 하락한 4,285원","[한국경제TV 라이온봇 기자] [그림 1] 최근 3개월 간 주가 추세 및 기간별 수익률 형지엘리트는 6월 18일 12시 37분 전일 대비 약 -6% 하락한 4,285원에 거래되고 있다. 형지엘리트는 코스피 상장 기업으로 섬유,의복 업종에 속해 있다. 시가총액은 874억원으로 코스피 상장기업 중 654위에 위치 해 있다. [종목 성향 진단] [그림 2] 종목 성향 진단 형지엘리트의 투자 스타일은 모호한 측면이 있으나 성장주라고 볼 수 있다. 주가 고평가 우려가 공존하지만 높은 성장성이 기대되는 기업이다. 주가 모멘텀은 부진한 편이었다. 최근 3개월 수익률은 -17.32%의 하락폭을 기록했다. 최근 1개월 수익률 또한 -10.79% 하락하며 부진한 모멘텀을 이어가고 있다. 형지엘리트 종목에 대한 투자자의 관심도는 상대적으로 낮은 편이었다. [투자 점수 진단] [그림 3] 투자 점수 진단 형지엘리트는 어느 측면에서 투자 매력도가 높은 종목일까? AI 인공지능 종목 분석 시스템을 이용해 성장성, 수익성, 효율성, 안전성, 저평가성, 추세 등 주가 수익률에 영향을 줄 수 있는 6가지 핵심 투자 지표를 점수화하여 종목의 투자 매력도를 계산해보았다. 그 결과 형지엘리트는 상대적으로 성장성 측면에서 두각을 드러내고 있었다. 성장성 점수는 기업의 실적이 전년 동기 대비 얼마나 증가했는지를 나타낸 지표로 기업의 이익 성장 추세를 나타낸다. 형지엘리트는 특히 영업이익증가율(YoY) 측면에서 가장 높은 점수는 기록했는데, 전체 시장 내 136위를 기록하며 상위 7.16%에 위치했다. 업종별로는 22위를 기록하며 상위 5.4%에 위치했다. 그러나 기업의 자산 활용도를 나타내는 효율성 측면에서는 아쉬움을 나타냈다. (위의 AI인공지능 점수는 재무 데이터를 기반으로 전체 상장 종목과 비교/분석하여 도출한 점수로 높은 점수가 반드시 높은 수익률을 보장하지 않습니다. 위의 자료는 당사의 추천 종목이 아니며, 투자 시 참고용으로 제시해드리는 것입니다. 핵심투자지표를 결합해 종목의 투자매력도를 종합 계산한 ""인공지능 투자점수""는 ""거장들의 투자공식"" 앱에서 확인하실 수 있습니다.) 라이온봇 기자 -한국경제TV※ 본 기사는 한국경제TV와 '거장들의 투자공식이'자체 개발한 '라이온봇 기자'가 실시간으로 작성한 기사입니다. 라이온봇기자 ⓒ 한국경제TV, 무단 전재 및 재배포 금지 한국경제TV 관련뉴스해당 언론사에서 선정하며 언론사 페이지(아웃링크)로 이동해 볼 수 있습니다.""금리 계속 오른다""…연내 주택대출 5~6% 간다하반기 'J노믹스' 성패 가를 3대 요인생리컵 쏟아진다…이 질환 있으면 피해야여권 없이 얼굴인식으로 출국…짐은 집에서 부쳐요""도요타 말고 현대차""…터키 경제장관의 의리"
매일경제,093240,/news/news_read.nhn?article_id=0004149161&office_id=009&mode=search&query=형지엘리트&page=1,2018-05-11 14:05,"형지엘리트 中합자법인, 60억원 규모 수주 계약","형지엘리트가 중국 시장 공략을 가속화한다. 패션 전문기업 형지엘리트는 중국 합자법인 상해엘리트의류유한회사가 중국 최대 교육재단인 보슬러(Bright Scholar) 교육그룹과 60억원 규모의 수주 계약을 체결했다고 11일 밝혔다. 이번 계약에 따라 상해엘리트의류유한회사는 보슬러 교육그룹 산하 학교에 3년간 제품을 공급하게 된다. 형지엘리트 관계자는 ""중국 최대 교육재단의 첫 수주라는 점에서 의의가 있다""고 말했다. 보슬러 교육그룹은 뉴욕증시(NYSE)에 상장한 교육재단으로 중국 주요 도시에 유아원, 유치원, 외국어학교, 국제학교 등 78개 교육기관을 운영 중이다. 소속 인원은 직원 6000명, 학생 3만4000명 등 약 4만여명으로 이번 수주를 통해 중국내 고객을 확대할 수 있는 기반을 마련했다는 평가다. 실제 형지엘리트의 올해 중국 교복 사업의 주요 전략은 프리미엄 브랜드와 중저가 브랜드 등 이른바 '투트랙 전략'을 통한 시장 확대다. 지난달 말 기준 신규 중국 교복 수주 계약고는 보슬러 교육그룹 수주 건을 포함해 75억원에 달한다. 또 총 260억원 규모의 상하이 송장시 교육부 및 산둥 지난리샤구 교육부 통일구매에 입찰해 결과를 기다리고 있으며 베이징, 텐진, 상하이, 광저우 등 중국 전역에서 40여개 학교와 교복 수주 관련 논의를 진행 중이다. 이 관계자는 ""형지엘리트는 성장하는 중국 시장에서 현지 파트너 보노(BONO)의 직영 영업망, 메이저 대리상 등을 활용해 마케팅을 강화할 계획""이라면서 ""사드 보복 해제 기류에 따라 교육 기관들이 수주 논의에 적극 임할 것으로 전망되는 점도 기대감을 끌어올리는 요소""라고 말했다. [디지털뉴스국 김경택 기자] r_start // r_end //"
아시아경제,093240,/news/news_read.nhn?article_id=0003659905&office_id=277&mode=search&query=형지엘리트&page=1,2016-01-05 13:09,"형지엘리트, '새학기 첫간식' 이벤트","[아시아경제 임혜선 기자]형지엘리트의 교복 브랜드 엘리트가 다음달 19일까지 예비 중·고등학생을 대상으로 '새학기 첫간식' 이벤트를 진행한다. 이번 이벤트는 예비 중등 1학년이거나 고등 1학년 학생이라면 누구나 참여 가능하다. 엘리트학생복 공식 블로그 내 이벤트 게시물 댓글로 '엘리트 교복을 입고 싶은 이유'를 적고, 추가 댓글로 진학 예정인 학교와 연락처를 기입하면 응모가 완료된다. 추첨을 통해 피자 상품권 20만원권(1명), 롯데리아 햄버거 세트 30개(10명), CU 편의점 상품권 10만원권(5명) 등 한 학급 인원이 함께 즐길 수 있는 푸짐한 경품을 증정한다. 당첨자는 3월 4일 블로그에서 공개한다."
