source,symbol,link,date,title,content
파이낸셜뉴스,093240,/news/news_read.nhn?article_id=0003863254&office_id=014&mode=search&query=형지엘리트&page=1,2017-08-24 11:34,"[fnRASSI]형지엘리트, 4.49% 오르며 거래량 증가","형지엘리트(093240)의 현재 거래량이 최근 5거래일 거래량의 최고치를 넘어섰다. 그리고 형지엘리트는 4일 연속 상승흐름을 보이며, 11시 30분 현재 4.49% 증가한 3,960원에 거래중이다. 외국인/기관 순매수, 개인은 순매도(한달누적)  8월21일부터 전일까지 외국인이 3거래일 연속 순매수를 보였다. 4주간을 기준으로 보면 외국인이 매매관점을 매도에서 매수로 전환하면서 3,697주를 순매수했고, 기관도 초반에 동종목을 순매수한 이후에 최근에는 순매수량이 줄어들고 있음에도 불구하고 40,434주를 순매수했다. 반면 개인들은 매도쪽으로 방향을 잡으면서 44,131주를 순매도한 것으로 나타났다. 거래참여는 개인투자자가 가장 활발 최근 한달간 주체별 거래비중을 살펴보면 개인이 전체 거래의 93.76%를 차지하며 가장 적극적인 모습을 보여줬고, 외국인은 4.6%를 나타냈으며 기관은 1.63%를 나타냈다. 그리고 최근 5일간 거래비중은 개인이 94.8%, 외국인이 5.19%를 기록한 것으로 나타났다. 'fnRASSI'는 증권전문 기업 씽크풀과 파이낸셜뉴스의 협업으로 로봇기자가 실시간으로 생산하는 기사입니다."
서울경제,093240,/news/news_read.nhn?article_id=0002847723&office_id=011&mode=search&query=형지엘리트&page=1,2016-06-27 17:33,"형지엘리트 설문결과, 여중고생 10명 중 9명 &quot;교복 스타일링 중요&quot;","- 여학생 10명 중 9명 '교복 스타일링 중요하다'고 응답, 이유는 '예쁜 모습으로 등교하고 싶어'"
헤럴드경제,093240,/news/news_read.nhn?article_id=0001029680&office_id=016&mode=search&query=형지엘리트&page=1,2016-04-11 09:33,&lt;생생코스피&gt; 투자경고 받은 형지엘리트 가격 제한폭까지 &lsquo;급등세&rsquo;,[헤럴드경제=황유진 기자] 투자경고종목으로 지정된 형지엘리트가 또 다시 급등세를 나타내고 있다. 11일 오전 9시25분 현재 유가증권시장에서 형지엘리트는 가격 제한폭(29.91%)까지 올라 5820원에 거래됐다. 7거래일 연속 상승으로 이달 1일 종가와 비교해 2배 이상이 올랐다. 형지엘리트는 지난 6일 중국 업체와 손잡고 중국 교복 시장에 진출한다는 발표를 하고 나서 급등세를 이어가고 있다. 한국거래소는 이날 하루동안 형지엘리트를 투자경고종목으로 지정했다. 현재 거래량은 28만7792주다. 중국 업체와 손잡고 교복 시장에 진출한다는 소식이 호재로 작용하고 있는 것으로 풀이된다
전자신문,093240,/news/news_read.nhn?article_id=0002646933&office_id=030&mode=search&query=형지엘리트&page=1,2017-10-11 15:43,[ET투자뉴스][형지엘리트 지분 변동] (주)형지아이앤씨 외 4명 0.16%p 증...,"형지엘리트(093240)는 11일 최대주주 (주)형지아이앤씨를  비롯한 특별관계자의 보유주식이 증가되었다고 발표했다. 이는 직전 보고일보다 30,622주 증가하여 지분율은 44.01%로 상승했다. 이번 보고 사유는 장내매수로  알려졌다.   최대주주와 특수관계자의 지분 변동은 주가에 영향을 주는 요인이다. 특히 보유비율을 지속적으로 늘리거나 줄일 경우, 해당종목 투자시 유의할 필요가 있다.  다음은 형지엘리트의 지분 변동 내역과 보유 내역이다."
뉴시스,093240,/news/news_read.nhn?article_id=0007072037&office_id=003&mode=search&query=형지엘리트&page=1,2016-03-02 11:04,"형지엘리트, 개성공단 협력업체 거래대금 우선 지급키로","【서울=뉴시스】김동현 기자 = 패션그룹형지 계열사 형지엘리트는 개성공단 협력업체들에게 미지급 임가공비를 우선 지급하기로 했다. 2일 형지엘리트는 협력업체 피해 최소화를 위해 거래대금 지급 관련해 개성공단 협력업체들과 수차례 만나 1개 업체는 대금지급을 이미 완료했고 미합의된 3개 업체는 대금지급을 협의중이라고 밝혔다. 최병오 패션그룹형지 회장은 ""개성공단 협력업체의 어려움을 돕고 국내 패션의류봉제산업의 상생 발전에 기여하기 위해 대승적 차원에서 개성공단 협력업체의 임가공 거래대금을 우선 지급하기로 했다""고 말했다. 최 회장은 이어 ""정부에서 개성공단 사태로 인한 원부자재 손실에 대한 정책적 배려를 적극 검토해주길 희망한다""고 덧붙였다."
아시아경제,093240,/news/news_read.nhn?article_id=0004007281&office_id=277&mode=search&query=형지엘리트&page=1,2017-06-02 15:49,"형지엘리트, 패션그룹형지 등이 63만주 신주인수권 행사","[아시아경제 박미주 기자]형지엘리트는 최대주주인 패션그룹형지가 45만4627주, 회사 임원인 임재용씨와 이범구씨가 9만744주씩 신주인수권을 행사해 최대주주측 지분율이 기존 41.87%에서 43.87%로 늘었다고 2일 공시했다."
뉴시스,093240,/news/news_read.nhn?article_id=0008203877&office_id=003&mode=search&query=형지엘리트&page=1,2017-09-27 17:22,형지엘리트 中 합작사 본사 방문 &ldquo;소싱&middot;디자인 실무협력 강화&rdquo;,"【서울=뉴시스】 【서울=뉴시스】최선윤 기자 = 형지엘리트의 중국 현지 합작사 빠오시니아오 그룹(BAOXINIAO GROUP)의 실무 대표단이 한국을 찾았다. 빠오시니아오 소싱·디자인팀 실무 대표단 7명은 지난 26일 서울 역삼동 형지엘리트 및 형지그룹 본사를 방문해 임직원들과 소통하고 사업 확대와 우호 협력 증진을 논하는 뜻 깊은 시간을 가졌다. 이번 방문은 양사 간 신뢰와 협력관계를 더욱 공고히 하기 위한 행사의 일환으로 추진됐다. 형지엘리트는 한국 교복 시장 현황, 교복 사업 인프라 구축 등 선진 교복시장의 비즈니스 실무 노하우를 공유하고, 중국 시장 본격 공략을 위한 양사의 적극적인 협력 의지를 다시 한번 확인하는 시간을 가졌다. 형지엘리트는 지난해 11월 중국 빠오시니아오 그룹과 현지 합자법인 ‘상해엘리트의류유한회사’를 설립하고 중국 사업을 시작, 중국 프리미엄 교복 시장의 블루오션을 개척하고 있다. 지난해 제품 현지화, 품질 표준 정립 등 사업 기반과 시스템 구축을 마치고 올해 본격적인 중국 사업을 전개, 상하이, 강소, 절강 지역의 명문 국제학교 및 사립학교를 대상으로 중국시장 진입 첫해 70억 규모의 수주 목표를 이미 달성한 바 있다. 2018년에는 빠오시니아오 그룹의 영업 유통망을 활용해 중국 전역으로 사업을 확대해 빠른 시일 내에 중국 교복시장의 대표 주자로 자리매김하겠다는 계획이다. 형지엘리트 관계자는 “이번 빠오시니아오 그룹 방문은 중국 사업 진출에 대한 양사의 결속과 화합을 다지는 시간이었다”라며 “형지엘리트는 중국 교복 시장을 대표하는 프리미엄 브랜드로 거듭나기 위해 빠오시니아오 그룹과 전략적인 제휴를 맺고, 본격적인 영업활동을 전개해 나갈 것”이라고 말했다."
서울경제,093240,/news/news_read.nhn?article_id=0002920677&office_id=011&mode=search&query=형지엘리트&page=1,2016-11-18 17:45,형지엘리트 &ldquo;재무구조 개선 위해 본사 사옥 매각&rdquo;,형지엘리트(093240)는 현저한 시황변동 관련 한국거래소의 조회공시 요구에 “재무구조 개선을 위해 본사 사옥으로 사용했던 건물과 토지를 지난달 12일 매각처분을 완료했다”고 18일 장 마감 후 답변했다. 이어 회사 측은 “주요 종속회사인 형지에스콰이아는 임대 상가 건물과 토지에 대해 다수의 잠재적 인수후보자와 계속적으로 매각조건에 대해 협상을 진행하고 있다”고 밝혔다.
이데일리,093240,/news/news_read.nhn?article_id=0003522659&office_id=018&mode=search&query=형지엘리트&page=1,2016-04-15 16:57,"거래소, 형지엘리트에 시황변동 조회공시 요구",[이데일리 임현영 기자] 한국거래소는 형지엘리트에 현저한 시황변동에 대한 조회공시를 15일 요구했다. 답변 시한은 오는 18일 오후 6시까지다.
서울경제,093240,/news/news_read.nhn?article_id=0002818818&office_id=011&mode=search&query=형지엘리트&page=1,2016-04-15 16:55,"형지엘리트, 최근 주가 급등 관련 조회공시","한국거래소는 15일 형지엘리트(093240)에 대해 현저한 시황변동과 관련 공시 규정상 공시대상이 존재하는지 여부를 묻는 조회공시를 요구했다. 답변 기한은 18일 오후 6시까지다. 형지엘리트(093240)는 이날 유가증권시장에서 전날 보다 가격제한폭(30.00%)까지 치솟은 9,100원에 거래를 마치며 이달 1일부터 9거래일 연속 상승세를 이어나가고 있다. 이달 초 대비 주가 상승률은 234.55%에 달한다."
아시아경제,093240,/news/news_read.nhn?article_id=0004238016&office_id=277&mode=search&query=형지엘리트&page=1,2018-05-14 12:56,"[공시+]형지엘리트, 매출액 411억&middot;영업익 19억","[아시아경제 문채석 기자] 6월에 결산하는 법인인 형지엘리트가 제17기 3분기(2018.01.01~2018.03.31) 경영 실적을 14일 발표했다. 형지엘리트는 제17기 3분기 연결 재무제표 기준 매출액 411억원, 영업이익 19억원을 기록했다고 이날 공시를 통해 밝혔다. 전년동기대비 매출액은 10.5% 감소했고 영업이익은 36억원 늘어 흑자전환했다. 형지엘리트 관계자는 ""브랜드별 선택과 집중을 위해 부실매장을 정리하고, 까스텔바쟉 가방 사업을 패션그룹형지로 이전해 매출이 감소했지만 효율적인 경영을 통해 흑자전환을 이뤄낸 의미 있는 결과""라고 설명했다. 자회사들의 마케팅 및 브랜드 경쟁력을 강화한 것도 중요한 성과라고 회사 측은 보고 있다. 에스콰이아는 온라인 전용 기획상품을 확대하는 등 온라인 마케팅을 공격적으로 전개했고, 여성복 브랜드 라젤로는 메인상품 및 시그니처 아이템을 개발하며 브랜드 오리지널리티 확립에 주력했다. 두 자회사 모두 홈쇼핑 채널에 진출하며 판매 채널을 다변화한 것에도 주목할 필요가 있다. 오는 하반기에는 중국 교복 사업에 속도를 더할 예정이다다. 합작법인 상해엘리트의류유한회사의 파트너사 보노(BONO)가 주축이 돼 중국 전역으로 수주 영업을 확대한다. 타깃 다각화를 위해 프리미엄 브랜드 외 합리적 사양을 갖춘 중저가 브랜드도 런칭했다. 4월 말 기준 올해 신규 수주 75 원을 달성했고 260억원 규모의 상해·산둥 교육부 입찰에도 참여해 결과를 대기 중이다. 형지엘리트 관계자는 ""양호한 성과가 기대되는 사업부를 중심으로 생산성 강화 및 경쟁력 있는 제품 개발에 힘쓰고 있다""며 ""중국 교복 사업을 강화하는 한편, 분기 매출의 47%가 발생하는 에스콰이아의 글로벌 소싱 강화, 재고 감축 등 효율적 운영을 통해 내실을 다지는 것이 목표""라고 밝혔다."
뉴시스,093240,/news/news_read.nhn?article_id=0007595227&office_id=003&mode=search&query=형지엘리트&page=1,2016-11-17 10:07,"형지엘리트, 홈페이지 새단장 기념 온라인 이벤트 실시","【서울=뉴시스】김동현 기자 = 형지엘리트가 아이오아이(I.O.I)와 펜타곤과 함께 '내 몸에 딱'을 테마로 새 단장한 홈페이지를 오픈했다. 이를 기념해 형지엘리트는 다음달 15일까지 온라인 이벤트를 진행한다. 새롭게 단장한 이번 홈페이지는 단순한 웹사이트 리뉴얼이 아닌 고객과의 효과적인 온라인 커뮤니케이션을 구현하는 데 중점을 두고 기획됐다. 엘리트학생복은 홈페이지의 주요 방문자인 10대들이 아이오아이(I.O.I)와 펜타곤의 더욱 다양한 화보를 볼 수 있도록 구성했다. 엘리트학생복은 홈페이지를 통해 아이오아이(I.O.I)와 펜타곤의 교복 화보와 촬영 현장을 담은 영상도 함께 선보인다. 아이오아이(I.O.I)는 이번 화보에서 '핏신강림, 은밀하게 날씬하게!, 갓 오브 핏' 등 웹툰 콘셉트로 엘리트학생복의 특장점을 한껏 살렸다. 홈페이지 리뉴얼과 함께 공식 블로그 및 페이스북, 인스타그램을 통해 이벤트를 실시한다. 블로그 이벤트는 홈페이지 리뉴얼 소식을 친구에게 공유한 뒤 엘리트학생복 전속모델들이 출연한 핏피엘(핏PL)드라마를 보고 영상 속 숨어있는 기능이 필요한 순간을 공유한 URL과 함께 댓글로 남기면 된다. 페이스북에서는 이달 말까지 '누구의 핏이 제일 예뻐?' 이벤트를 진행한다. 참여방법은 홈페이지 리뉴얼 소식을 페이스북에서 해당 이벤트를 공유하거나 친구를 소환해 알린 뒤 전속모델이 입은 새로운 교복 중 가장 마음에 드는 교복핏 한 개를 댓글로 남기면 된다. 형지엘리트 마케팅팀 관계자는 ""앞으로도 엘리트학생복은 타 교복 브랜드와는 차별화된 고객 맞춤형 커뮤니케이션에 집중해 교복 제작은 물론 홈페이지, SNS채널 등까지 주요 고객층인 학생을 우선으로 생각하며 성장하는 기업이 되겠다""고 말했다."
헤럴드경제,093240,/news/news_read.nhn?article_id=0001032682&office_id=016&mode=search&query=형지엘리트&page=1,2016-04-15 16:19,"&lt;생생코스피&gt;형지엘리트, 주가급등 관련 조회공시",한국거래소는 15일 형지엘리트에 현저한 시황변동에 대한 조회공시를 요구했다. 답변시한은 18일 오후 6시까지다.
뉴시스,093240,/news/news_read.nhn?article_id=0008241242&office_id=003&mode=search&query=형지엘리트&page=1,2017-10-23 15:47,"[패션단신]형지엘리트, 학부모 서포터즈 엘리트맘 11기 모집 外","【서울=뉴시스】 ▲형지엘리트의 교복 브랜드 엘리트가 23일부터 교복생활연구소와 함께 자녀의 교복을 배우고 연구할 학부모 서포터즈 '엘리트맘' 11기를 모집한다. 엘리트맘은 엘리트 교복 제품 품평, 브랜드 및 제품 아이디어 공유, 엘리트학생복 SNS 홍보 등 다양한 온·오프라인 활동과 정기 미션 활동에 참여하게 된다. ▲아웃도어 브랜드 네파는 미담이나 선행 주인공에게 패딩을 전달하는 '따뜻한 세상' 캠페인 시즌 3를 시작한다. 페이스북을 통해 소비자들이 미담이나 선행 주인공인 '따뜻한 패딩'을 캠페인 사무국과 함께 추천하고 선정까지 하는 방식으로 운영된다. 오는 12월29일까지 약 3개월에 걸쳐 진행되며, 약 100여 명의 주인공들을 찾는다. ▲금강제화가 전개하는 이태리 패션 브랜드 브루노말리가 본격적인 겨울 시즌을 앞두고 여성백 2종을 출시한다. 제품명은 '라벨라(LABELLA)'와 '벨루치(BELLUCCI)'다. 두 제품 모두 군더더기 없이 깔끔한 디자인에 최고급 소가죽과 양가죽을 사용한 프리미엄 핸드백이다. ▲아웃도어 브랜드 밀레가 벤치파카 '스웨그 다운' 출시를 기념해 '겟유어스웨그(GET YOUR SWAG)' 이벤트를 실시하며 마이크로사이트를 오픈한다. 겟유어스웨그 이벤트는 스웨그 넘치는 스타일링 사진으로 손쉽게 참여하고, 투표를 통해 공감을 많이 받는 참여자를 뽑는 소비자 참여형 이벤트다."
헤럴드경제,093240,/news/news_read.nhn?article_id=0001103140&office_id=016&mode=search&query=형지엘리트&page=1,2016-08-19 13:55,"中 교복 사업 속도내기&hellip;형지엘리트, 200억 규모 자금조달","[헤럴드경제=손미정 기자] ㈜형지엘리트(093240, 대표이사 최병오ㆍ홍종순)는 시너지파트너스 외 1개사를 대상으로 18일 200억 규모의 전환사채(CB)를 발행, 중국 시장 확대를 위한 투자 자금과 여성복 브랜드 ‘라젤로’ 매출 성장 등을 위한 기타 운영자금을 확보했다고 밝혔다. 형지엘리트가 이번에 조달한 200억원은 중국 교복시장 확대에 사용된다. 형지엘리트는 해당 자금으로 대대적인 투자에 나서며 중국 전 지역을 대상으로 공격적인 영업ㆍ마케팅 전략을 추진할 계획이다. 조달한 자금은 여성복 브랜드 ‘라젤로’의 매출 증대 및 기타 운영 자금 등에 사용할 예정이다. 형지엘리트는 올해 초부터 중국 교복 시장 진출을 위한 적극적인 행보를 이어나가고 있다. 4월 빠오시니아오(喜集) 그룹의 MOU 체결 이후, 지난 6월 양사 합자법인 설립을 위한 본 계약을 체결하며 중국 시장 공략을 위한 발판을 마련했다. 현재 중국 합자법인 설립을 위한 절차가 진행 중이다. 형지엘리트가 지난 50년간 축적해 온 교복 디자인의 노하우와 관련 자문 서비스, 그리고 ‘빠오시니아오’ 그룹의 현지 영업 유통망 및 생산라인의 시너지를 통해 합리적인 가격대의 고품질 교복을 선보일 예정이다. 형지엘리트 관계자는 “합자법인 설립 이후에는 현지 내 사업 기반을 빠르게 구축한 뒤, 중국 전역의 사립, 귀족학교를 대상으로 본격적인 영업을 전개할 예정”이라며 “빠르면 내년 초 매출이 발생할 것으로 내다보고 있으며, 향후 중국 교복 시장 점유율 1위 기업으로 자리매김하는 것이 목표”라고 전했다."
뉴시스,093240,/news/news_read.nhn?article_id=0007149045&office_id=003&mode=search&query=형지엘리트&page=1,2016-04-06 15:49,"거래소, 형지엘리트에 '현저한 시황 변동' 조회공시 요구",【서울=뉴시스】최예린 기자 = 한국거래소는 여자용 정장 제조업체 형지엘리트(093240)에 현저한 시황변동 관련 공시규정상 공시대상 존재 여부에 대한 조회공시를 요구했다고 6일 공시했다. 공시시한은 오는 7일 오후 6시다.
동아일보,093240,/news/news_read.nhn?article_id=0002951379&office_id=020&mode=search&query=형지엘리트&page=1,2016-02-29 17:53,"개성공단기업 비대위 &ldquo;형지엘리트, 입주기업 상대로 배상 요구&rdquo;","[동아일보] 개성공단기업 비상대책위원회는 29일 “입주기업 4곳과 거래하고 있는 형지엘리트가 입주기업들을 상대로 배상을 요구하면서 완제품 결제대금 16억 원을 주지 않고 있다”고 밝혔다. 형지엘리트는 패션그룹형지의 계열사다. 비대위는 “이 때문에 도산위기에 놓인 입주기업들이 벼랑 끝으로 더욱 내몰리고 있다”며 “납품이 끝난 물량에 대해서는 대금 결제를 해야 한다”고 주장했다. 이에 대해 형지엘리트는 “개성공단 입주기업에 귀속된 원부자재를 돌려받지 못한 피해가 막심하다”며 “원부자재 손실에 대한 협의가 먼저 필요하다”는 입장을 밝혔다. 형지엘리트 관계자는 “손실에 대한 협의 없이 임의로 대금을 지급하면 주주들이 문제를 제기할 수 있다”고 말했다. 형지엘리트 측은 또 “거래 업체 4곳 중 1곳은 이미 합의해 대금을 지급했고, 나머지 3곳도 합의안이 도출되는 대로 대금을 지급할 계획”이라고 덧붙였다. 한편 입주기업 피해 대책 마련을 위해 개성공단 비대위는 개성공단 거래처 및 협력업체를 포함한 개성 기업인 비상대책회의를 3월 2일 개최할 예정이다."
한국경제TV,093240,/news/news_read.nhn?article_id=0000476604&office_id=215&mode=search&query=형지엘리트&page=1,2016-07-04 17:09,"형지엘리트, '나만의 100점 과목 만들기' 프로모션 운영","[한국경제TV 디지털뉴스팀] 기말고사를 맞아 페이스북에서 7월 5일까지 중고생 대상 진행 ㈜형지엘리트의 국내 No. 1 교복 브랜드 엘리트(대표이사 최병오, 홍종순)가 7월 5일까지 페이스북에서 중고생을 대상으로 '나만의 100점 과목 만들기' 프로모션을 운영한다. 이번 이벤트는 형지엘리트가 기말고사를 맞아 공부에 지친 학생들을 응원하기 위해 준비한 깜짝 프로모션이다. 국어나 영어, 수학 등의 일반적인 과목 대신 '아이돌 댄스', '성대모사' 등 100점을 받을 수 있는 나만의 자신 있는 과목을 만들어 보는 내용으로 구성됐다. 참여 방법은 형지엘리트 페이스북 내 이벤트 게시글 댓글로 휴대폰번호 뒷자리와 함께 만점을 받을 수 있는 나만의 과목을 작성한 뒤, 친구를 소환하고 페이지를 공유하면 된다. 추첨을 통해 엘리트 전속모델의 사인이 담긴 물품 랜덤박스 및 텀블러, 배스킨라빈스 상품권(5000원권), 잠바주스 캐리비안패션, 해피콘(5000원권), KFC 스마트초이스(치킨 2조각+콜라) 등 푸짐한 경품을 증정한다. 당첨자는 7월 7일 페이스북을 통해 발표한다. 디지털뉴스팀"
파이낸셜뉴스,093240,/news/news_read.nhn?article_id=0003735835&office_id=014&mode=search&query=형지엘리트&page=1,2016-11-17 12:17,[fnRASSI]형지엘리트(093240) 현재 11.51% &uarr;,"현재 형지엘리트(093240)는 전일대비 11.51% 상승하여 5,620원 선에서 거래가 이루어지고 있다.  주주들의 손바뀜이 잦은 듯최근 한달간 형지엘리트의 매매회전율을 분석한 결과 19일에 1번 꼴로 주식의 주인이 바뀐 것으로 나타났다. 회전율이 높은 경우 유동성이 좋다고 할 수 있으나 이런경우 주가변동이 심한 경우가 많아 주의가 요구된다. 동종목의 경우 동기간 일평균 주가변동률은 3.07%를 기록했다.  주요 투자주체는 개인투자자최근 한달간 주체별 거래비중을 살펴보면 개인이 94.93%로 가장 높은 참여율을 보였고, 외국인이 5.05%를 보였으며 기관은 0.01%를 나타냈다. 그리고 최근 5일간 거래비중은 개인이 85.13%로 가장 높은 참여율을 보였고, 외국인이 14.68%를 보였으며 기관은 0.17%를 나타냈다.  
 'fnRASSI'는 증권전문 기업 씽크풀과 파이낸셜뉴스의 협업으로 로봇기자가 실시간으로 생산하는 기사입니다."
이데일리,093240,/news/news_read.nhn?article_id=0004101405&office_id=018&mode=search&query=형지엘리트&page=1,2018-05-14 14:03,"형지엘리트, 1~3월 흑자전환 성공&hellip;&ldquo;올해 中사업 본격화&rdquo;","부실매장 정리로 효율 경영…中 교복 수주 전역 확대 [이데일리 이명철 기자] 멀티패션기업 형지엘리트(093240)는 제17기 3분기(1월 1일~3월 31일) 연결 영업이익 19억으로 전년동기대비 흑자전환했다고 14일 밝혔다. 매출액은 같은기간 10.5% 감소한 411억원이다. 브랜드별 선택과 집중을 위해 부실매장을 정리하고 까스텔바쟉 가방 사업을 패션그룹형지로 이전해 매출이 감소했지만 효율 경영을 통해 흑자를 일궜다는 게 회사 설명이다. 자회사 마케팅과 브랜드 경쟁력도 강화했다. 에스콰이아는 온라인 전용 기획상품을 확대하며 온라인 마케팅을 전개했고 여성복 브랜드 라젤로는 메인 상품과 시그니처 아이템을 개발했다. 양사 모두 홈쇼핑 채널에 진출해 판매 채널도 다변화했다. 하반기에는 중국 교복 사업에 속도를 낼 계획이다. 현지 합작법인 상해엘리트의류유한회사의파트너 기업인 보노를 주축으로 전역에서 수주 영업을 벌이기로 했다. 타깃 다각화를 위해 프리미엄 브랜드 외 합리적 사양을 갖춘 중저가 브랜드도 론칭했다. 4월말 기준 신규 수주 75억 원을 달성했으며 260억원 규모 상해·산둥 교육부 입찰에도 참여했다. 회사 관계자는 “양호한 성과가 기대되는 사업부를 중심으로 생산성 강화와 경쟁력 있는 제품 개발에 힘쓰고 있다”며 “중국 교복 사업을 강화하고 에스콰이아의 글로벌 소싱 강화, 재고 감축 등을 통해 내실을 다질 것”이라고 말했다."
