source,symbol,link,date,title,content
파이낸셜뉴스,093240,/news/news_read.nhn?article_id=0003757676&office_id=014&mode=search&query=형지엘리트&page=1,2017-01-04 10:01,"형지엘리트, 기능성 추가한 2017학년도 신학기 교복 출시","형지엘리트가 탈부착카라 기능이 적용된 2017년 신상품을 선보였다.


 형지엘리트의 교복브랜드 엘리트가 깨끗하게 교복을 관리할 수 있도록 기능성을 추가한 2017학년도 신학기 교복을 선보였다고 4일 밝혔다. 엘리트는 신학기를 맞아 교복업계 최초로 오염방지셔츠·탈부착카라 등 편의 기능을 적용했다. 엘리트 ‘나노(NANO) 오염방지 셔츠’는 나노 입자 가공을 통해 섬유 표면에 부착된 나노 돌기들이 오염물질이 섬유에 스며드는 것을 막고, 흘러내리도록 작용한다. 실제로 커피, 주스 등이 셔츠에 묻거나 떨어져도 털어버리거나 휴지로 닦아내면 오염이 깔끔하게 제거돼 보다 깨끗한 교복 셔츠를 입을 수 있다. 또한 엘리트만의 나노 오염방지 원단은 여러 번의 세탁 후에도 기존 오염방지원단 대비 내구성이 뛰어난 것이 특징이다. 이와 함께 ‘탈부착카라’ 기능을 더해 편리성을 강화했다. 오염되기 쉬운 교복 카라만 따로 떼어 빨래할 수 있어 간편하고, 세탁 시 시간 절약이 가능하다. 여기에 낡은 카라를 새 카라로 교체만하면 교복 셔츠를 장기간 새것처럼 착용할 수 있다. 이외에도 엘리트 교복만의 특징인 소매길이 조절이 가능한 ‘매직소매’, 목뒤와 소매 때를 감춰주는 ‘샤방밴드’ 등 다양한 기능이 함께 적용돼 교복을 더욱 실용적으로 착용할 수 있도록 했다. 형지엘리트 관계자는 “엘리트는 학부모 교복서포터즈 ‘엘리트맘(엘맘)’과 함께 ‘교복생활연구소’ 운영을 통해 다양한 니즈를 반영, 이번 신학기 제품에 교복을 새것처럼 유지할 수 있도록 나노 오염방지셔츠와 카라탈부착 기능을 새롭게 추가하게 됐다”며 “학생들은 언제나 교복을 깨끗하게 입을 수 있고, 교복을 관리하는 학부모들은 편하게 관리와 세탁을 할 수 있어 모두에게 만족도가 높을 것으로 기대된다”고 말했다"
아시아경제,093240,/news/news_read.nhn?article_id=0004081442&office_id=277&mode=search&query=형지엘리트&page=1,2017-09-21 16:27,"형지엘리트, 종속회사 형지에스콰이아 166억 규모 부동산 처분 결정",[아시아경제 임철영 기자]형지엘리트 종속회사 형지에스콰이아가 재무구조 개선을 목적으로 21일 해커스어학원 챔프스터디와 166억원 규모 부산광역시 부산진구 부전동 254-5 소재 부동산을 처분키로 했다고 공시했다.
머니투데이,093240,/news/news_read.nhn?article_id=0003666506&office_id=008&mode=search&query=형지엘리트&page=1,2016-04-18 16:49,형지엘리트 &quot;본사 사옥 건물&middot;토지 매각 추진중&quot;,"[머니투데이 송학주 기자] 형지엘리트는 최근 시황변동 관련 조회공시 답변을 통해 ""재무구조 개선을 위해 당사는 본사 사옥으로 사용했던 건물·토지를 매각 추진중""이라고 18일 밝혔다. 이어 ""계열사 형지에스콰이아가 임대를 하던 상가 건물과 토지 매각을 추진하고 있다""며 ""현재까지 결정된 사항은 없다""고 공시했다. textlinktopstart textlinktopend textlinkstart"
파이낸셜뉴스,093240,/news/news_read.nhn?article_id=0003898470&office_id=014&mode=search&query=형지엘리트&page=1,2017-11-01 14:16,[fnRASSI]형지엘리트 전일대비 16.12% 상승,"현재 형지엘리트(093240)는 전일대비 16.12% 상승하여 5,150원 선에서 거래가 이루어지고 있다. 주요 매매주체는 개인투자자  최근 한달간 주체별 거래비중을 살펴보면 개인 비중이 97.91%로 가장 높았고, 외국인이 2.01%로 그 뒤를 이었다. 기관은 0.06%를 나타냈다. 그리고 최근 5일간 거래비중은 개인이 98.3%, 외국인이 1.63%, 기관은 0.06%를 기록했다. 기관/개인 순매수, 외국인은 순매도(한달누적)  전일 외국인이 7,189주를 순매도했다. 4주간을 기준으로 보면 기관이 초반에 동종목을 순매수한 이후에 최근에는 순매수량이 줄어들고 있음에도 불구하고 893주를 순매수했고, 개인들도 매수반전의 모습을 보이며 28,468주를 순매수했다. 반면 그 동안 외국인은 순매도로 돌아서면서 29,361주를 순매도했다. 'fnRASSI'는 증권전문 기업 씽크풀과 파이낸셜뉴스의 협업으로 로봇기자가 실시간으로 생산하는 기사입니다."
서울경제,093240,/news/news_read.nhn?article_id=0002848250&office_id=011&mode=search&query=형지엘리트&page=1,2016-06-28 15:49,"형지엘리트, 상해엘리트의류 지분 40% 취득 결정","형지엘리트(093240)는 중국 상해엘리트의류유한회사(SHANGHAI YILITE FASHION CO.,LTD) 지분 40.0%를 7억1,084만원에 취득하기로 결정했다고 28일 공시했다."
매일경제,093240,/news/news_read.nhn?article_id=0003867236&office_id=009&mode=search&query=형지엘리트&page=1,2017-01-04 10:35,"형지엘리트, 기능성 더한 `신학기 교복` 출시","`나노 오염방지 셔츠`·`탈부착카라` 기능 적용 엘리트는 2017년도 신학기 기능성 교복을 출시했다고 4일 밝혔다. 교복업계 최초로 오염방지셔츠·탈부착카라 등 편의 기능을 적용해 교복 관리의 편의성을 높였다고 회사는 설명했다. '나노 오염방지 셔츠'는 나노 입자 가공을 통해 섬유 표면에 부착된 돌기들이 오염물질이 섬유에 스며드는 것을 막아주는 제품으로 커피, 주스 등이 셔츠에 묻거나 떨어져도 털어버리거나 휴지로 닦아내면 오염이 깔끔하게 제거된다. 여러 번 세탁 후에도 기존 오염방지원단 대비 내구성이 뛰어난 것도 특징이다. '탈부착카라' 기능을 더해 편리성을 강화했다. 오염되기 쉬운 교복 카라만 따로 떼어 빨래할 수 있어 간편하고, 세탁 시간을 절약할 수 있다. 이외에도 소매길이 조절이 가능한 '매직소매', 목뒤와 소매 때를 감춰주는 '샤방밴드' 등 다양한 기능이 함께 적용돼 교복을 더욱 실용적으로 착용할 수 있도록 했다. 형지엘리트 관계자는 ""엘리트는 학부모 교복서포터즈 '엘리트맘(엘맘)'과 함께 교복생활연구소와 함께 학부모, 중고생들의 다양한 의견을 반영해 신학기 기능성 교복을 제작했다""면서 ""업계 처음으로 시도하는 나노 오염방지셔츠와 카라탈부착 기능으로 학생들에게는 깨끗한 교복을, 학부모에게는 관리와 세탁의 편의성을 제공할 예정""이라고 말했다. [디지털뉴스국 김슬기 기자] r_start // r_end //"
머니투데이,093240,/news/news_read.nhn?article_id=0003874026&office_id=008&mode=search&query=형지엘리트&page=1,2017-05-17 16:39,형지엘리트 &quot;형지에스콰이아 건물 및 토지 매각 진행&quot;,"[머니투데이 유엄식 기자] 형지엘리트는 종속회사인  (주)형지에스콰이아가 재무구조 개선을 위해 부산 소재 상가 건물 및 토지 매각을 진행 중이라고 17일 공시했다. 회사 측은 ""현재 일부 인수후보자로부터 매입의향서를 제출 받아 매각 조건에 대해 협상을 진행하고 있다""고 밝혔다. textlinktopstart textlinktopend textlinkstart"
헤럴드경제,093240,/news/news_read.nhn?article_id=0001145499&office_id=016&mode=search&query=형지엘리트&page=1,2016-11-01 15:30,"형지엘리트, 에스콰이어 성남공장 매각&hellip; 재무 개선 속도","[헤럴드경제=손미정 기자] ㈜형지엘리트(대표이사 최병오ㆍ홍종순)는 지난달 동안 330억원 규모의 차입금을 상환, 재무 구조 개선에 속도를 내고 있다고 1일 밝혔다. 형지엘리트는 지난달 31일, 작년에 인수한 형지에스콰이아의 성남 공장을 매각하고 그 잔금이 입금, 230억 규모의 차입금을 상환해 재무 부담을 완화했다. 앞서 같은달 11일에는 가산동 사옥을 매각, 매각 대금 전액인 100억원 규모의 차입금 상환을 완료했다. 현재 형지엘리트는 지난 6월말부터 흑자 전환된 인도네시아의 봉제 공장 ‘뻬떼엘리트(PT.ELITE)’와 중국 교복 시장 진출을 진행 중으로, 특히 ‘빠오시니아오(喜集, BAOXINIAO GROUP)’ 그룹과 함께 진행 중인 중국 교복 사업은 여러 주요 거점 도시의 학교들을 대상으로 본격적인 영업 활동을 하는 등 사업 내용들이 구체화되고 있는 것으로 알려졌다."
헤럴드경제,093240,/news/news_read.nhn?article_id=0001027906&office_id=016&mode=search&query=형지엘리트&page=1,2016-04-07 10:24,"&lt;생생코스피&gt; 형지엘리트, 中 교복시장 진출 소식에 19%대 급등","[헤럴드경제=양영경 기자] 교복업체인 형지엘리트가 중국 교복시장에 진출한다는 소식에 이틀째 급등세를 이어가고 있다. 7일 오전10시19분 현재 형지엘리트는 유가증권시장에서 전 거래일 대비 19.10%(720원) 오른 4490원에 거래되고 있다. 형지엘리트는 이날 주가 급등으로 정적 변동성완화장치(vi)가 발동되기도 했다. 주가가 전일 종가 혹은 직전 단일가와 비교해 변동폭이 10%를 넘으면 2분간 단일가로 매매되도록 하는 장치다. 형지엘리트는 전날 “중국에서 5개 의류 브랜드를 갖고 있는 빠우시냐우(baoxiniao)그룹과 협약을 맺고 중국 교복 시장에 진출한다”고 밝혔다. 빠우시냐우 그룹은 현재 중국 전역에서 패션 사업을 중심으로 부동산과 금융투자사업 등을 하고 있는 종합 유통업체로 상장 의류회사와 4개의 국제 브랜드, 3개의 의류 생산기지를 계열사로 두고 있다. 중국의 학생 수는 약 1억9100만명, 연평균 초중고교 신입생 수는 5500만명이며 교복 시장은 약 6조원 규모로 추정된다. 이날 형지엘리트는 상한가를 기록했다."
매일경제,093240,/news/news_read.nhn?article_id=0003787295&office_id=009&mode=search&query=형지엘리트&page=1,2016-08-18 21:41,형지엘리트 中진출 자금 전환사채로 200억 조달,"형지엘리트가 중국 교복시장에 진출하기 위한 200억원 규모 자금 조달에 성공했다. 형지엘리트는 18일 시너지파트너스 외 1개사를 대상으로 200억원 규모의 전환사채(CB)를 발행했다고 밝혔다. 중국 교복시장 진출 확대를 위한 투자금으로 활용하는 한편 여성복 브랜드 '라젤로'의 운영자금으로 사용하기 위한 목적이다. 전환가액은 주당 6545원이며, 표면이자율은 0.0%, 만기 이자율은 1.0%이다. 사채만기일은 2020년 8월 23일이다. 형지엘리트는 지난 6월 중국 바오시냐오그룹과 합자법인 설립을 위한 본계약을 체결하는 등 현지 교복시장 진출 행보를 이어가고 있다. 형지엘리트 관계자는 ""합자법인 설립 이후 현지 내 사업 기반을 빠르게 구축한 뒤 중국 전역의 사립·귀족학교를 대상으로 본격적인 영업을 전개할 예정""이라고 말했다. 합자법인을 통해 형지엘리트는  교복 디자인의 노하우와 관련 자문 서비스를 제공하며 바오시냐오그룹의 현지 영업 유통망 및 생산라인을 활용할 예정이다. [박은진 기자] r_start // r_end //"
아시아경제,093240,/news/news_read.nhn?article_id=0003729872&office_id=277&mode=search&query=형지엘리트&page=1,2016-04-18 16:49,형지엘리트 &quot;재무구조 개선 위해 본사 사옥 매각 추진 중&quot;,"[아시아경제 이정민 기자] 형지엘리트는 18일 거래소의 조회공시 요구에 대해 ""재무구조 개선을 위해 본사 사옥으로 사용하던 건물 및 토지를 매각 추진 중""이라며 ""주요종속사 형지에스콰이아는 임대를 해주던 상가 건물 및 토지를 매각 추진중""이라고 답변했다. 사측은 현재까지 결정된 사항은 없다고 덧붙였다."
이데일리,093240,/news/news_read.nhn?article_id=0003574712&office_id=018&mode=search&query=형지엘리트&page=1,2016-06-28 15:58,"형지엘리트, 中기업과 교복사업 합자법인 설립 계약","- 최병오 회장 ""中패션사업 성공 이끄는 도화선 될 것"" △최병오 패션그룹형지 회장과 오지택 중국 빠오시니아오 그룹 회장이 28일 중국 상하이 창닝구 빠오시니아오 그룹 사옥에서 합자법인 설립을 위한 본계약을 체결하고 기념사진을 찍고 있다.(사진=형지엘리트) [이데일리 김진우 기자] 형지엘리트(093240)는 28일 중국 상하이 창닝구에서 중국 빠오시니아오 그룹과 합자법인 설립을 위한 본계약을 체결했다. 양사는 7월 중 합자법인을 설립하기로 했다. 지난 4월 양해각서(MOU) 체결에 이어 중국 교복시장 진출에 한 걸음 더 다가섰다. 합자법인의 공식 명칭은 ‘상해엘리트의류유한회사’로 법인은 중국 상하이에 설립할 예정이다. 양사의 1차 투자금액은 1000만 위안(한화 17억 5400만원)으로 향후 3년 이내에 시장 상황에 따라 투자 총액을 5000만 위안(87억 7000만원)으로 증액하기로 했다. 양사는 향후 5~8년 이내에 중국이나 해외 증권거래소에 기업공개(IPO)를 추진하기로 합의했다. 형지엘리트는 50년 간 축척해 온 교복 디자인 노하우와 자문 서비스를 제공하고, 빠오시니아오 그룹은 현지 영업 유통망과 생산라인을 활용해 고품질·합리적 가격대의 교복으로 중국 시장을 공략한다는 계획이다. 빠오시니아오그룹은 중국 전역에서 8개의 패션 브랜드와 3개의 복장생산 기지를 계열사로 두고 있다. 최병오 회장은 계약식에서 “중국의 성장세대인 10대들에게 형지의 젊은 이미지와 K(한국) 브랜드의 우수성에 대한 경험을 제공하겠다”며 “이번 중국 진출계약은 향후 형지그룹이 중국 패션사업을 성공적으로 이끄는 도화선이 될 것이다. 중국 시장 성공 후 동남아 등지로도 진출할 것”이라고 말했다."
머니투데이,093240,/news/news_read.nhn?article_id=0003547429&office_id=008&mode=search&query=형지엘리트&page=1,2015-09-21 17:01,"에리트베이직, 상호 '형지엘리트' 변경안 승인",[머니투데이 백지수 기자] 에리트베이직은 정기주주총회 결과 상호를 '형지엘리트'로 바꾸고 발행 예정 주식 총 수를 1억주로 변경하는 등 정관 일부를 변경하는 건에 대해 승인했다고 21일 공시했다. 이밖에 △이익잉여금처분계산서를 포함한 제14기 연결재무제표 △이사 보수한도 50억원 △감사 보수한도 1억원 등의 안건도 원안대로 승인됐다. textlinktopstart textlinktopend textlinkstart
이데일리,093240,/news/news_read.nhn?article_id=0003958543&office_id=018&mode=search&query=형지엘리트&page=1,2017-10-31 14:34,"[특징주]형지엘리트, 22조 中 교복시장 선점 기대&hellip;한ㆍ중 해빙기 &uarr;","[이데일리 박형수 기자] 형지그룹 주력 계열사로 떠오른 형지엘리트(093240)가 강세다. 사드 보복 우려 해소로 중국 교복 시장 진출 사업에 대한 기대가 커지고 있다. 31일 오후 2시30분 형지엘리트는 전날보다 20.1% 오른 4720원에 거래되고 있다. 지분 구조상 형지엘리트는 그룹의 중간지주사 위치에 자리하고 있다. 형지엘리트 지분은 패션그룹형지, 형지리테일, 형지I&C 등 사업형 지주사 역할을 하고 있는 계열사가 확보하고 있다. 중국 증권업계에 따르면 지난해 현지 학생복시장 규모는 13조6000억원에 달한다. 연평균 9.3% 성장하는 점을 고려하면 2020년께는 시장 규모가 22조7000억원으로 커질 전망이다. 앞서 형지엘리트는 지난해 11월 현지 유통망 2000여 개를 갖춘 패션업체 빠우시냐우 그룹과 합작법인 ‘상해엘리트의류유한회사’를 설립했다. 한·중 관계 정상화가 급물살을 타면서 사드 리스크에 시달리던 중국 관련 사업 회복에 대한 기대가 살아나고 있다."
뉴시스,093240,/news/news_read.nhn?article_id=0007417937&office_id=003&mode=search&query=형지엘리트&page=1,2016-08-18 17:37,"형지엘리트 &quot;형지에스콰이아, 본사 사옥 등 매각 추진&hellip;매각 조건 협상중&quot;","【서울=뉴시스】김주아 기자 = 형지엘리트(093240)는 당사 발행 주권의 현저한 시황변동과 관련한 한국거래소의 조회공시 요구에 대해 ""당사의 주요 종속사 형지에스콰이아는 본사 사옥 부동산에 대해 현재 잠재적 인수후보자로부터 매입의향서를 제출받아 매각조건을 협상 중에 있다""고 18일 공시했다. 회사 측은 재무구조 개선을 위해 본사 사옥 용도의 부동산을 매각처분한다고 지난 5월9일 공시한 바 있다."
뉴시스,093240,/news/news_read.nhn?article_id=0006986013&office_id=003&mode=search&query=형지엘리트&page=1,2016-01-14 16:57,"형지엘리트 종속회사, 303억 성남소재 토지&middot;건물 처분 결정","【서울=뉴시스】 의류 전문업체인 형지엘리트는 종속회사인 ㈜형지에스콰이아가 재무구조 개선을 위해 303억원의 ‘경기 성남시 중원구 상대원동 145-1, 145-2, 145-4 소재 토지 및 건물’을 ㈜타워플래닝에게 처분키로 결정했다고 14일 공시했다. 이는 자산총액대비 16.1%에 해당하고 처분예정일자는 7월31일까지다. ★ 세상에 이런일이 -  월급 재촉하는 10대 알바에 야구배트 휘두른 사장 ★ 오늘의 핫 포토 -  서울서 발견된 북한군 대남전단"
한국경제,093240,/news/news_read.nhn?article_id=0003575968&office_id=015&mode=search&query=형지엘리트&page=1,2016-04-07 18:08,"중국 교복 진출 형지엘리트, 이틀 만에 주가 45% 급등",[ 최만수 기자  ] 교복업체인 형지엘리트가 중국 교복시장에 진출한다는 소식에 이틀째 급등했다. 7일 형지엘리트는 전날보다 11.14% 오른 4190원에 거래를 마쳤다. 주가 급등으로 ‘정적 변동성완화장치(VI)’가 발동되기도 했다. 주가가 전일 종가 또는 직전 단일가와 비교해 변동폭이 10%를 넘으면 2분간 단일가로 매매되도록 하는 장치다. 형지엘리트는 전날인 6일 “중국에서 5개 의류 브랜드를 갖고 있는 바오시냐오그룹과 양해각서(MOU)를 체결하고 중국 교복시장에 진출한다”고 발표했다. 이틀간 주가가 44.48% 오르자 한국거래소는 이날 형지엘리트를 ‘투자경고 종목’으로 지정한다고 예고했다. 형지엘리트는 홍종순 부회장이 유승민 국회의원과 경북고 동문이라는 이유로 인터넷 카페 등에서 정치 테마주로 분류되기도 했다.
매일경제,093240,/news/news_read.nhn?article_id=0003716246&office_id=009&mode=search&query=형지엘리트&page=1,2016-04-18 11:28,"`제2의 코데즈컴바인?` 형지엘리트, 이상 급등&hellip;투자 주의보","‘엘리트 교복’으로 유명한 형지엘리트가 10거래일 연속 급등하면서 ‘제2의 코데즈컴바인’으로 떠오르고 있다. 형지엘리트의 주가는 최근 중국 교복 시장에 진출한다는 소식이 호재로 작용하면서 무서운 상승세다. 하지만 실적은 여전히 주가에 못미치는 수준을 보이고 있어 우려의 목소리가 높아지고 있다. 18일 증권업계에 따르면 형지엘리트는 중국 교복시장 진출 재료에 힘입어 연일 52주 신고가를 갈아치우고 있다. 형지엘리트의 주가는 이달 1일부터 이날까지 10거래일 연속 강세를 보이며 2620원에서 1만1700원까지 4배 이상 뛰었다. 이 기간동안 상한가를 4번이나 찍었고, 시가총액도 2000억원에 달할 정도로 불어났다. 형지엘리트의 급등세로는 무엇보다 중국 교복 시장 진출 재료가 꼽힌다. 최근 온라인 주식전문 사이트에서 유승민 테마주로 분류되며 ‘정치 테마’의 오명을 쓰기도 했지만 회사는 지난 6일 형지엘리트는 중국의 빠우시냐우그룹과 중국 교복사업 진출을 위한 양해각서(MOU)를 체결했다고 공시하면서 오명을 털어냈다. 중국발 호재에 계열사인 형지I&C마저 5거래일 연속 급등하고 있다. 형지엘리트는 6조원 규모의 시장으로 추정되는 중국 교복 시장에 올해 안으로 합자법인을 설립하고 교복 제작·유통·마케팅 등을 진행할 계획이다. 형지엘리트 관계자는 “중국 교복시장은 대부분 개별 학교장이 교복에 대한 재량권을 갖고 있다”면서 “합자법인 설립 후 학교를 개별 공략해 계약을 성사하는 방식으로 진행될 것”이라고 설명했다. 하지만 문제는 형지엘리트가 중국내 시장 점유율을 얼마나 가져가는지를 장담할 수 없다는 점이다. 현재 빠우시냐우 그룹이 1조3000억원의 매출을 기록하고 있긴 하지만 형지엘리트의 실적에 어느정도 반영될지는 회사 측에서도 가늠하기 어렵다는 입장이다. 또 형지엘리트의 모회사인 패션그룹형지는 지난 2006년 ‘카텔로’로 중국 시장에 진출했지만 별다른 성과를 거두지 못한 채 철수한 바 있다. 따라서 이번 교복 시장 진출도 낙관할 수만은 없다는 것이다. 여기에 MOU는 말 그대로 ‘합의’라는 뜻으로 진행 과정에서 본계약까지 못하고 취소가 되는 경우도 다반사다. 회사 관계자는 “MOU체결에 이어 빠우시냐우그룹과 본계약 협의를 진행하고 있다”며 “실제 매출로 연결될 수 있도록 최선을 다해 중국 진출의 교두보를 마련할 것”이라고 강조했다. 기업의 본업 가치와 다르게 주가가 급등하고 있다는 점도 부담이다. 형지엘리트는 지난해 하반기 계열사들의 부진으로 인해 22억원의 영업손실을 내면서 전년 동기 대비 적자 전환했다. 이 관계자는 “중국 시장에 대한 비전을 시장에서 높게 평가하고 있는 것 같다”면서도 “이는 지난해 순자산 1000억에 달하는 에스콰이아를 인수한 데 이어 중국 진출 재료까지 확보했기 때문”이라고 설명했다. 이어 ”본업 가치와는 다르게 급등하고 있는 점은 부담스러우나 에스콰이아 등 계열사가 실적 턴어라운드를 이뤄내 연결 실적이 긍정적인 수준을 나타내면 주가도 정상적인 평가를 받을 수 있을 것”이라고 내다봤다. [디지털뉴스국 김경택 기자] r_start // r_end // [ⓒ 매일경제 & mk.co.kr, 무단전재 및 재배포 금지] 매일경제 관련뉴스해당 언론사에서 선정하며 언론사 페이지(아웃링크)로 이동해 볼 수 있습니다.美교회 '기름 흐르는 요한상'…만병통치약으로 알려져기아 K형제의 돌풍…사촌들 눌렀다신지은, 텍사스 슛아웃 우승…데뷔 6년 만에 정상보드 타고 하늘 날다 佛 남성, 기네스 신기록'세번째 결혼' 김혜선, 훈남 사업가 남편과 '웨딩화보'"
