source,symbol,link,date,title,content
서울경제,093240,/news/news_read.nhn?article_id=0002827514&office_id=011&mode=search&query=형지엘리트&page=1,2016-05-10 09:37,"형지엘리트, 재무구조 개선 기대감에 강세","형지엘리트(093240)가 재무구조 개선 기대감에 장 초반 강세를 보이고 있다. 형지엘리트는 10일 오전 9시 32분 현재 유가증권시장에서 형지엘리트는 전날보다 6.16% 오른 8,270원에 거래되고 있다. 이 회사는 채무상환과 재무구조 개선을 위해 서울 금천구에 있는 98억원 규모의 토지 및 건물을 한국도시개발에 매각한다고 전날 장 마감 후 공시했다."
헤럴드경제,093240,/news/news_read.nhn?article_id=0001046220&office_id=016&mode=search&query=형지엘리트&page=1,2016-05-09 16:19,"형지엘리트, 98억 규모 토지ㆍ건물 처분 결정",[헤럴드경제=박영훈 기자] 형지엘리트는 서울 금천구 가산디지털2로 169-37 토지 및 건물을 한국도시개발에 처분키로 결정했다고 9일 공시했다. 처분금액은 98억원이며 이는 자산 총액 대비 5.2%에 해당하는 규모다. 처분예정일자는 오는 10월 12일이다. 회사측은 “채무 상환 및 재무구조 개선이 처분 목적”이라고 밝혔다.
서울경제,093240,/news/news_read.nhn?article_id=0003212654&office_id=011&mode=search&query=형지엘리트&page=1,2018-02-01 13:04,"(유)형지엘리트, 전일 대비 7.20% 상승.. 일일회전율은 1.62% 기록","[서울경제] 형지엘리트(093240) 는 1일 오후 1시 3분 현재 7.20% 오른 5,810원에 거래되고 있으며, 41(매도):59(매수)의 매수우위를 기록하고 있다. 거래대금은 17억3,987만, 거래량은 30만9,238주로 거래량회전율은 1.62%로 나타났다. 지난 1개월간 형지엘리트는 상승 14회, 하락 16회를 기록했고, 주가수익률은 11.73% 표준편차는 3.02%를 기록했다. 이 기간 ' 섬유의복업 ' 업종 평균 주가수익률은 0.11%로 나타났으며, 변동성은 1.03%를 기록했다. 이 시각 현재 ' 섬유의복업 '은 0.30% 상승 중이며, 55(매도):45(매수)의 매도우위를 기록하고 있다."
부산일보,093240,/news/news_read.nhn?article_id=0000776821&office_id=082&mode=search&query=형지엘리트&page=1,2018-02-01 17:41,형지엘리트-이강학원과 교육사업 전략적 제휴,"형지엘리트와 이강학원이 교육 모델 개발과 학원 사업 발전을 위한 교육사업 제휴 업무 협약을 체결했다고 1일 밝혔다. 지난달 31일 서울 역삼동 패션그룹형지 본사에서 열린 체결식(사진)을 통해 △이강학원에서 형지엘리트의 엘리트모의고사 판매 △이강학원의 과학탐구 과목 모의고사 콘텐츠 개발 △양사 교육 관련 사업 추진 상호 협력 등을 협약했다. 형지엘리트는 이번 업무 협약을 통해 유통망 확대는 물론 수능 모의고사 시장 내 엘리트 브랜드 경쟁력이 강화시키는 계기가 됐다. 향후 전개할 각종 교육 사업에 있어서도 활발한 협력 활동을 이어갈 계획이다. 또 국어 과목뿐만 아니라 수학, 영어, 과학탐구 영역까지 평가 과목을 확대하며 이강학원과 적극 협력해 수준 높은 컨텐츠를 제공하게 된다. 형지엘리트는 엘리트모의평가연구소를 설립하고 지난 해 8월부터 5번의 모의고사 국어 교재를 선보였다. 입시전문 출제위원 들의 수능 유형 분석과 연구로 2018년도 수능 국어 과목에서 80% 이상의 높은 유사적중률을 보여 수험생과 학부모로부터 호평을 받았다. 이강학원은 교육의 메카 대치동 본원을 두고 13개 캠퍼스를 운영하는 국내 유명 입시 전문 학원으로 대입 컨설팅과 뛰어난 합격 실적으로 손꼽히는 대표 학원 브랜드다. 형지엘리트 관계자는 ""양사간의 공식적인 업무협약을 체결한 만큼 앞으로는 더욱 긴밀한 협조를 통해 상호간의 협력 효과를 배가 시키고, 학생들에게는 양질의 교육 콘텐츠를 제공할 수 있는 발판을 마련했다""고 말했다."
여성신문,093240,/news/news_read.nhn?article_id=0000065524&office_id=310&mode=search&query=형지엘리트&page=1,2018-04-20 20:08,"형지엘리트, &lsquo;엘리트 문화재지킴이&rsquo; 모집","© 형지엘리트 ㈜형지엘리트(대표 최병오)의 교복 브랜드 엘리트학생복이 5월 3일까지 서울지역 초중고생 및 학부모를 대상으로 ‘엘리트 문화재지킴이’를 모집한다. 엘리트학생복과 문화재청이 함께하는 엘리트 문화재지킴이 프로그램은 학생과 학부모가 우리 문화재를 바로 알고 보호할 수 있도록 하는 연중 사회공헌 캠페인으로, 2010년부터 9년째 지속적으로 진행하고 있다. 5월 12일 진행되는 이번 프로그램은 ‘자랑스러운 우리의 문화유산을 손으로 가꾸고 보호하자’라는 주제로 사적 제11호인 서울 송파구 풍납백제문화공원을 방문해 문화유산 가치를 이해하는 교육과 문화재 가꾸기 활동을 진행한다. 참가자들은 풍납토성 및 한성백제에 대한 해설을 듣고, 베틀체험, 금동관 만들기, 백제 부채등 만들기 등 다양한 교육 프로그램을 수행한다. 또한 풍납토성 주변 정화활동을 위해 제초작업과 쓰레기 줍기 등 문화재지킴이 활동을 펼친다. 이번 엘리트 문화재지킴이는 서울 및 경기지역 초중고생 학생 및 학부모라면 누구나 참여할 있다. 엘리트학생복 공식 홈페이지 및 SNS 채널(페이스북, 블로그)을 통해 선착순으로 신청 가능하며, 참가자는 1365 자원봉사포털시스템에서 자원봉사확인서를 발급 받을 수 있다.   형지엘리트 마케팅팀은 “이번 활동은 참가자들이 풍납토성이 갖는 의미와 가치를 이해할 수 있는 체험의 장이 될 것”이라고 말했다."
머니투데이,093240,/news/news_read.nhn?article_id=0003703086&office_id=008&mode=search&query=형지엘리트&page=1,2016-06-29 09:19,"[특징주]형지엘리트, 中 교복시장 진출 소식에 '신고가'","[머니투데이 김유경 기자] 형지엘리트가 중국 교복시장에 진출한다는 소식에 급등세다. 29일 오전 9시 17분 현재 형지엘리트는 전날보다 700원(6.06%) 오른 1만2250원에 거래되고 있다. 장 초반에는 1만3500원까지 오르며 52주 신고가도 갈아치웠다. 형지엘리트는 중국 현지기업인 상하이 빠오니아오의류유한공사와 교복 생산판매 합작법인 '상해엘리트의류유한회사'를 세웠다고 전날 장 마감후 공시했다. 형지엘리트는 7억원을 투자해 이 합작법인 지분 40%를 취득키로 했다. 형지엘리트는 ""합작법인에서 교복, 운동복 등의 디자인, 생산, 판매를 진행해 교복 브랜드 사업을 전개할 것""이라고 밝혔다. 또 향후 5~8년 이내에 중국 또는 해외 증권거래소에 IPO(기업공개)를 추진하기로 합의했다고 밝혔다. textlinktopstart textlinktopend textlinkstart"
전자신문,093240,/news/news_read.nhn?article_id=0002667826&office_id=030&mode=search&query=형지엘리트&page=1,2017-12-19 09:22,[ET투자뉴스]형지엘리트_6일 연속 하락하며 약세흐름 지속중 현재 -4.23% 외...,"19일 오전 9시 18분 현재 형지엘리트는 220원(-4.23%) 내린 4,980원을 기록하며 6일 연속 하락세를 이어가고 있다.  이러한 약세흐름에 특별한 원인이 있는지 여러각도에서 한번 살펴볼 필요가 있다.     [주가/수급동향]     전일 기관이 1주를 순매수했고, 외국인은 49,752주를 순매도했다. 최근 한달간 형지엘리트의 매매회전율을 분석한 결과 8일에 1번 꼴로 주식의 주인이 바뀐 것으로 나타났다.  이는 비정상적으로 높은 회전율을 보인 것으로 투자에 각별한 주의가 요망된다.  또한 평균적으로 장중 주가변동률이 10.35%에 달할 정도로 등락이 심하기 때문에 다시한번 주의가 필요하다.  그리고 최근 5일간 거래비중은 개인이 96.17%, 외국인이 3.82%를 보였고, 기관은 거래참여가 없었다.     [차트신호]     최근 주가변동폭을 기준으로 한 현재 주가는 하락추세는 지속되고 있고,거래량을 활용한 지표로 볼 때는 어느 한쪽으로 치우쳐지지 않는 보통상태를 나타내고 있다.실리적인 측면에서는 주가흐름과 같이 투자심리도 호전적이지 못하고 이동평균선들의 배열도를 분석을 해보면 중기적 관점에서 불완전 정배열상태를 보이며 하락으로 추세전환 신호가 나오고 있다.     [업종내 종목흐름]     이 시각 현재 관련종목들은 하락이 우세한 가운데 섬유의복업종이    0.40% 하락하고 있다. 호전실업 13,550원▼150(-1.09%) 아비스타 3,555원▼95(-2.60%)  대현 2,685원▼15(-0.56%) 방림 20,400원0 (0.00%)    [재무특징]     영업이익률 현재 3%로 업종평균 하회. PER은 21.56으로 업종평균보다 높으며, PBR은 1.66임."
매일경제,093240,/news/news_read.nhn?article_id=0003757929&office_id=009&mode=search&query=형지엘리트&page=1,2016-06-28 16:03,"형지엘리트, 중국서 교복사업 계약체결","최병오 패션그룹형지 회장(왼쪽)이 오지택 빠오시니아오 그룹 회장이 중국 교복 사업을 위한 합자법인을 설립하기로 하는 본계약 체결 후 기념사진촬영을 하고 있다. 패션그룹형지가 운영하는 교복 브랜드 엘리트가 중국 교복 시장 공략을 위한 본격적 시동을 걸었다. 28일 형지엘리트는 교복 브랜드 ‘엘리트’가 28일 중국의 빠오시니아오’ 그룹과 본 계약을 체결하고 중국 교복 사업을 위한 합자법인을 설립한다고 밝혔다. 형지엘리트는 지난 4월 체결한 MOU에 이어 28일 상하이 창닝구 빠오시니아오 그룹 사옥에서 양사 합자법인 설립을 위한 본 계약을 체결했다. 이날 계약식에는 패션그룹형지 최병오 회장과 오지택 빠오시니아오 회장 등 양사 관계자들이 참석했다. 이번 본 계약을 통해 설립하게 되는 합자법인 공식 명칭은 상하이엘리트의류유한회사(SHANGHAI YILITE FASHION CO., LTD)이며, 법인은 중국 상하이에 둘 예정이다. 양 사의 1차 투자금액은 인민폐 1000만 위엔으로 시작하여 향후 3년 이내에 시장상황에 따라 합자회사의 투자 총액을 인민폐 5,000만 위엔으로 증액하기로 하였다. 또한, 향후 5~8년 이내에 중국 또는 해외 증권거래소에 IPO상장을 추진하기로 합의했다. 합자회사에서는 형지엘리트가 50년 간 축척해 온 교복 디자인의 노하우와 관련 자문 서비스를 제공하고, 빠오시니아오 그룹의 현지 영업 유통망 및 생산라인을 통해 고품질의 합리적인 가격대의 교복을 통해 중국 교복시장을 공략할 계획이다. 중국 ‘빠오시니아오’그룹은 현재 중국 전역에서 패션, 유니폼 정장 사업을 중심으로 부동산 및 금융투자업무까지 전개하고 있으며, 8개의 패션 브랜드를 비롯해 상장 복장회사 및 창업투자회사, 3개의 복장생산기지를 계열사로 두고 있다. 중국 교복 시장은 미 개척된 시장으로 성장성이 큰 것으로 평가된다. 향후 시장 규모가 약 6조원으로 추정된다. 이는 2013년 중국교육사업통계 보고서 기준 중국의 총 학생수 약 1억9100만 명이며, 연 평균 신입생 수가 5500만 여명임을 고려한 수치다. 최근 경제발전에 따른 교육 수요 증대로 사립학교 설립이 매년 10% 이상 늘어나고 있으며, 실질 구매력이 증가하면서 고품질 교복에 대한 선호도가 높아지고 있어 3~5년 내로 교복시장 규모는 더욱 커질 예상이다. 현재 일반적인 중국 교복은 체육복 형태다. 형지엘리트과 빠오시니아오 그룹은 7월 내 합자법인 설립 후, 2017년 하복부터 중국 주요 거점지역 소재의 사립학교 및 귀족학교를 시작으로 향후 중국 전역의 일반 초.중.고 교복 및 교복용 운동복까지 점차 시장을 확대해 나갈 예정이다. 우선 올해에는 시장 공략을 위한 위한 사업기반 및 시스템을 구축에 주력하고, 공격적 학교 영업을 통해 향후 수년 내에 중국 교복시장 점유율 1위 기업으로 자리매김 하겠다는 계획이다. [박인혜 기자] r_start //"
전자신문,093240,/news/news_read.nhn?article_id=0002685675&office_id=030&mode=search&query=형지엘리트&page=1,2018-02-21 09:12,[ET투자뉴스]형지엘리트_외국인의 매수세 유입 이후 주가가 탄력 받나 현재 +3....,"외국인이 전일 형지엘리트를 평소와 다르게 큰 규모로 순매수했다. 전일 순매수량은 전체 거래량의 18.26%를 차지할 정도로 크다. 외국인의 순매수로 수급여건이 개선되면서 주가도 상승세를 나타내고 있다. 이러한 영향권에서 21일 오전 9시 8분 현재 180원(3.4%) 오른 5,470원을 기록하고 있다.    [주가/수급동향]     2월19일부터 전일까지 외국인이 2거래일 연속 순매수를 보였다. 최근 한달간 형지엘리트의 상장주식수 대비 거래량을 비교해보니 일별 매매회전율이 2.43%로 집계됐다.  그리고 동기간 장중 저점과 고점의 차이인 일평균 주가변동률을 7.18%를 나타내고 있다.  그리고 최근 5일간 거래비중은 개인이 90.68%, 외국인이 9.31%를 보였고, 기관은 거래참여가 없었다.     [업종내 종목흐름]     이 시각 현재 관련종목들도 상승이 우세한 가운데 섬유의복업종은    0.46% 상승중이다. 아비스타 3,135원▼15(-0.48%) 방림 20,200원▲50(+0.25%)  호전실업 14,450원▲50(+0.35%) 인디에프 1,495원▲5(+0.34%)    [재무특징]     영업이익률 현재 3.97%로 업종평균 수준.PER은 23.7로 업종평균보다 높으며, PBR은 1.7임."
파이낸셜뉴스,093240,/news/news_read.nhn?article_id=0003969610&office_id=014&mode=search&query=형지엘리트&page=1,2018-02-22 09:44,[fnRASSI]형지엘리트(093240) 현재 +10.13%,"형지엘리트(093240)는 현재 주가가 전일 대비 10.13% 상승한 5,870원 선에서 거래가 이루어지고 있다. 거래참여는 개인투자자가 가장 활발 최근 한달간 주체별 거래비중을 살펴보면 개인이 전체 거래의 92.64%를 차지하며 가장 적극적인 모습을 보여줬고, 외국인은 6.95%를 나타냈으며 기관은 0.4%를 나타냈다. 그리고 최근 5일간 거래비중은 개인 비중이 90.58%로 가장 높았고, 외국인이 9.41%로 그 뒤를 이었다. 기관은 거래에 참여하지 않은 것으로 보인다.                   지표               항목               값               종합점수                 성장성               매출액증가율               -0.1               2.01                 자기자본증가율               -0.25                 안정성               부채비율               215.42               7.08                 유동비율               179.71                 이익안정성               8.06                 수익성               ROA               2.27               5.25                 ROE               7.16                 영업이익율               3.97          형지엘리트의 퀀트 재무 점수는 14.34점으로 지난 분기에 비해 성장성 점수가 하락했다. 이는 매출액 증가율과 자기자본 증가율이 감소하였기 때문이다. 안정성 종합 점수는 부채비율 증가, 유동비율 감소로 하락했다. 수익성 측면에서 볼때 ROE, 영업이익률이 개선되어 이전보다 좋은 점수를 받았다. 'fnRASSI'는 증권전문 기업 씽크풀과 파이낸셜뉴스의 협업으로 로봇기자가 실시간으로 생산하는 기사입니다."
아시아경제,093240,/news/news_read.nhn?article_id=0004136128&office_id=277&mode=search&query=형지엘리트&page=1,2017-12-08 11:02,주가 두배 뛴 형지엘리트 &quot;中 교복 시장 문 열렸다&quot;,"임재용 전무 ""中 22조 교복시장 정복 나선다""  임재용 형지엘리트 총괄전무 [아시아경제 박선미 기자] ""체육복 형태가 일반적인 중국 교복시장에 변화의 바람이 불고 있습니다. 소득 수준이 높아진 중국인들이 디자인과 품질이 좋은 교복을 원하면서 한국식 교복이 중국에서 자리잡기 시작한 것이죠. 중국 합자회사를 통한 전국 단위의 공략을 본격화하고 있습니다."" 임재용 형지엘리트 총괄전무는 7일 아시아경제 인터뷰에서 한국 학생수 감소에서 오는 교복 매출 성장 둔화의 고민을 중국 시장에서 해결할 수 있다고 자신했다. 임 전무는 ""중국 교복시장 진출을 위해 중국 상장 패션기업 빠우시냐우와 합자기업 '상해엘리트의류유한회사'를 설립한 후 상하이 지역을 중심으로 영업을 한 결과 성과가 좋았다""며 ""빠우시냐우가 보유한 전국 200여개 직영점, 1000명의 영업사원을 활용해 중국 전국 단위의 영업을 본격화하고 있다""고 말했다. 형지엘리트 주가는 10월 초 3200원대에서 현재 6200원 수준으로 두 배 뛰었다. 사드(고고도미사일방어체계) 배치 이슈로 인해 경색됐던 한 ·중 관계가 해빙 모드로 돌아서면서 형지엘리트가 중국 소비주로 부각된 영향이다. 임 전무는 ""지난해 기준 800억위안(약 13조6000억원) 규모인 중국 교복시장이 매년 9%씩 성장해 2020년 1337억6000만위안(약 22조7000억원)까지 확대될 것으로 보고 있다""며 ""한류 때문에 중국인들이 한국식 교복을 좋아한다는 점, 품질과 디자인 면에서 중국 업체들과 차별화가 뚜렷하다는 점, 중국인 소득수준 향상으로 높은 가격대 공략이 가능하다는 점 등이 긍정적""이라고 설명했다. 그는 ""형지엘리트는 올해 상하이에서 고소득층 자녀들이 다니는 사립학교, 국제학교 등을 중점적으로 공략해 '프리미엄 교복' 이미지를 구축했는데 결과가 성공적이었다""며 ""현재 중국 전역으로 시장을 확대하는 인프라 구축 작업을 하고 있어 내년부터 본격적인 영업 활동을 하고 2021년까지 1500억원 수주를 목표로 하고 있다""고 덧붙였다. 중국 교복시장이 자리를 잡으면 형지 그룹내 보유 브랜드의 중국 시장 확대도 검토할 수 있는 부분이다. 임 전무는 ""2015년 인수한 에스콰이어(형지에스콰이어) 뿐 아니라 다른 그룹사 내 브랜드의 중국 시장 진출에 교두보 역할을 할 수 있을 것으로 본다""고 전했다. 형지엘리트는 주력 사업인 교복 ·유니폼 뿐 아니라 내년 자회사 형지에스콰이어의 빠른 성장도 기대하고 있다. 임 전무는 ""형지에스콰이어를 인수하며 발생한 인수금융 450억원을 최근 전액 상환해 재무건전성을 갖췄고 경영 정상화 작업으로 적자폭을 지속적으로 축소하고 있다""며 ""형지에스콰이어는 브랜드 경쟁력 강화에 더 힘을 쏟을 것""이라고 설명했다. 형지엘리트는 1969년 제일모직에서 만든 학생복 '에리트'가 전신인데 임 전무는 제일모직과 형지엘리트 양쪽에서 모두 근무한 업계 베테랑이다. 1988년 삼성그룹 공채로 입사한 임 전무는 2001년까지 제일모직에 있다가 2003년 형지엘리트로 옮겨 현재 교복, 기업 유니폼, 제화잡화, 패션잡화 등 모든 사업을 총괄하는 전무직을 맡고 있다."
뉴시스,093240,/news/news_read.nhn?article_id=0007531018&office_id=003&mode=search&query=형지엘리트&page=1,2016-10-18 11:34,"형지엘리트, 전략 사업 강화 및 재무구조 개선키로","【서울=뉴시스】김동현 기자 = 형지엘리트가 국내 교복 사업 외에 패션, 수출봉제사업, 해외 진출 등 전략 사업을 강화키로 했다. 18일 형지엘리트에 따르면 2010년 인도네시아에 설립한 봉제 공장 뻬떼엘리트와 여성복 패션브랜드 라젤로는 지난 6월 말 결산기준으로 흑자로 전환했다. 형지엘리트는 내년에도 글로벌 수주 확대 및 유통망 확대를 통해 매출 상승세를 이어간다는 계획이다. 또 지난 6월 중국 빠오시니아오 그룹과 교복 사업 추진을 위한 본 계약을 체결한 이후, 중국 현지 내 제품 생산을 위한 공장을 다수 확보하고 샘플을 제작 중이다. 내년 신학기 시즌을 겨냥해 형지엘리트는 지난달부터 상하이, 북경 등 주요 거점 도시의 유명 사립, 귀족 학교들을 대상으로 수주상담·구매 조건 등을 협의했으며 향후 본격적인 영업활동을 진행한다는 계획이다. 이와함께 재무구조 개선에도 역량을 집중할 계획이다. 형지엘리트는 지난해 에스콰이아 인수로 차입금 규모가 늘어났다. 이를 개선하기 위해 형지엘리트는 유휴 고정자산 매각작업을 통해 재무구조를 개선한다는 계획이다. 지난 11일 형지엘리트 가산동 사옥 매각을 완료하고 약 98억원의 차입금 상환을 진행한 것도 재무구조 개선작업의 일환이다. 이달 말 형지에스콰이아 성남공장 매각이 완료되면 추가 차입금 상환을 통해 회사의 재무구조 지표가 상당부분 개선될 것으로 회사 측은 보고 있다. 형지엘리트 관계자는 ""지난 8월 200억 규모의 전환사채(CB)를 발행해 중국 시장 확대를 위한 투자 자금도 충분히 확보된 상황""이라며 ""중국 교복 시장에 잠재된 수요를 성공적으로 개척해서 대한민국 대표 브랜드는 물론 글로벌 경쟁력을 갖춘 교복 브랜드로 자리매김할 수 있도록 최선을 다하겠다""고 말했다."
한국경제,093240,/news/news_read.nhn?article_id=0003591526&office_id=015&mode=search&query=형지엘리트&page=1,2016-05-10 09:24,"[특징주]형지엘리트, 98억 규모 부동산 처분 소식에 '강세'","[ 박상재 기자  ] 형지엘리트가 98억원 규모의 유형자산 처분 소식에 강세다. 재무구조 개선에 대한 기대감이 반영된 것으로 풀이된다. 10일 오전 9시15분 현재 형지엘리트는 전날보다 400원(5.13%) 오른 8190원에 거래되고 있다. 형지엘리트는 채무상환 및 재무구조 개선을 위해 98억원의 서울 금천구 가산디지털2로 169-37 소재 토지 및 건물을 처분한다고 전날 장 마감 후 공시했다. 이 금액은 지난해 연결 기준 자산총액의 5.2%에 해당하며, 거래 상대방은 한국도시개발이다. 박상재 한경닷컴 기자"
매일경제,093240,/news/news_read.nhn?article_id=0003724794&office_id=009&mode=search&query=형지엘리트&page=1,2016-05-02 14:21,올 두배 이상 오른 종목은 어디&hellip;영진약품 271% &middot; 형지엘리트 250%,"올 들어 주가가 가장 많이 오른 종목은 영진약품 등 중소형 제약주인 것으로 나타났다. 2일 한국거래소의 '시장별 상장 종목의 가격대 분포' 자료에 따르면 유가증권시장에서 작년 말 대비 지난달 28일 종가 기준으로 주가 상승률이 가장 높은 종목은 영진약품(271.4%)이었다. 이어 형지엘리트(249.7%) 성지건설(164.9%) 필룩스(107.8%) 제일약품(107.8%) 명문제약(94.1%) 순이다. 상위 10개 중 4개 종목이 중소 제약사다. 코스닥시장에서는 서버관리 전문업체인 에스아이티글로벌(500%)의 연초 이후 주가 상승률이 가장 높았다. 심엔터테인먼트(424.1%) 엠젠플러스(317.6%) 유니더스(280.2%)도 각각 200% 이상 상승했다. 이 자료에 따르면 유가증권시장에서 비중이 가장 큰 주가 수준은 1만~5만원으로 전체 종목에서 32.5%를 차지했다. 코스닥시장에서는 주가가 5000~1만원인 종목이 전체 중 27.8%를 차지해 가장 많았다. 코스닥시장 가격대가 유가증권시장 가격대보다 다소 낮게 나타난 것이다. [용환진 기자] r_start // r_end // [ⓒ 매일경제 & mk.co.kr, 무단전재 및 재배포 금지] 매일경제 관련뉴스해당 언론사에서 선정하며 언론사 페이지(아웃링크)로 이동해 볼 수 있습니다.美교회 '기름 흐르는 요한상'…만병통치약으로 알려져""그래도 침실은 넓어야"" 준대형 평형 인기신지은, 텍사스 슛아웃 우승…데뷔 6년 만에 정상보드 타고 하늘 날다 佛 남성, 기네스 신기록'세번째 결혼' 김혜선, 훈남 사업가 남편과 '웨딩화보'"
