source,symbol,link,date,title,content
아시아경제,094840,/news/news_read.nhn?article_id=0003961330&office_id=277&mode=search&query=슈프리마에이치큐&page=1,2017-03-27 07:15,"슈프리마에이치큐, 권혁일 사외이사 재선임",[아시아경제 박미주 기자]슈프리마에이치큐는 권혁일 사외이사를 재선임했다고 27일 공시했다. 임기는 2020년 3월24일까지다.
이데일리,094840,/news/news_read.nhn?article_id=0004059401&office_id=018&mode=search&query=슈프리마에이치큐&page=1,2018-03-19 15:07,"슈프리마에이치큐, 지난해 영업이익 47억&rarr;37억..증가율 축소 정정공시","[이데일리 성선화 기자]슈프리마에이치큐(094840)는 지난해 영업이익 전년 대비 31% 증가가 아닌 2% 늘어난 37억원이라고 19일 정정공시 했다. 매출액은 전년 대비 10.9% 감소한 286억원, 당기순이익은 전년 대비 20.6% 증가한 46억원이다."
머니투데이,094840,/news/news_read.nhn?article_id=0003662805&office_id=008&mode=search&query=슈프리마에이치큐&page=1,2016-04-11 18:41,"슈프리마에이치큐, 슈프리마 주식 200만주 공개매수","[머니투데이 최민지 기자] 슈프리마는 슈프리마에이치큐가 지주회사 요건을 충족하기 위해 슈프리마 기명식 보통주식을 주당 2만3250원에 공개매수한다고 11일 공시했다. 공개매수 예정주식수는 200만주(28.3%)이며, 공개매수 후 보유주식 수는 257만696주(36.3%)가 될 전망이다. 공개매수 기간은 오는 6월 2일부터 같은달 21일까지다. textlinktopstart textlinktopend textlinkstart"
한국경제TV,094840,/news/news_read.nhn?article_id=0000483641&office_id=215&mode=search&query=슈프리마에이치큐&page=1,2016-07-29 09:50,[공시] 슈프리마에이치큐 &quot;전 사내이사 횡령혐의 고소&quot;,"[한국경제TV 김종학 기자] 슈프리마에이치큐가 박대종 전 사내이사를 업무상 횡령 혐의로 형사고소했다고 29일 공시했습니다. 이번 횡령 혐의금액은 9,380만 원으로 슈프리마에이치큐의 작년말 자기자본 대비 0.12%에 해당합니다. 슈프리마에이치큐는 ""이번 횡령은 경영에 중대한 영향을 주는 사안은 아니지만, 도덕성과 투명성을 중요시하는 경영방침에 따라 적법 절차대로 진행하겠다""고 밝혔습니다."
이데일리,094840,/news/news_read.nhn?article_id=0003644895&office_id=018&mode=search&query=슈프리마에이치큐&page=1,2016-10-06 15:52,슈프리마에이치큐 &quot;지주사 요건 충족 심사결과 통보받아&quot;,[이데일리 김기훈 기자] 슈프리마에이치큐(094840)는 공정거래위원회로부터 지난 6월25일을 기준으로 독점 규제와 공정거래에 관한 법률에서 규정한 지주회사의 요건을 충족한다는 지주회사 전환신고에 대한 심사결과를 통보받았다“고 6일 공시했다.
서울경제,094840,/news/news_read.nhn?article_id=0002817363&office_id=011&mode=search&query=슈프리마에이치큐&page=1,2016-04-12 10:42,"슈프리마에이치큐, 대규모 증자 소식에 약세","통신·방송장비 제조업체인 슈프리마에이치큐가 대규모 증자 결정 소식이 알려지면서 약세다 . 12일 오전 10시 37분 현재 코스닥시장에서 전 거래일보다 620원(7.38%) 내린 9,020원에 거래 중이다. 이 회사는 지난 8일 다른 법인 증권 취득 자금 마련을 위해 465억원 규모의 일반공모 방식의 유상증자를 하기로 했다고 장 종료 후 공시했다. 발행되는 신주는 493만1,594주, 신주 발행가액은 9,429원이다. 신주 상장 예정일은 오는 7월 7일이다."
머니투데이,094840,/news/news_read.nhn?article_id=0003577593&office_id=008&mode=search&query=슈프리마에이치큐&page=1,2015-11-12 11:55,슈프리마&rarr;슈프리마에이치큐로 사명 변경,[머니투데이 김지민 기자] 슈프리마는 기업 분할에 따라 사명이 슈프리마에이치큐로 변경된다고 12일 공시했다. textlinktopstart textlinktopend textlinkstart
서울경제,094840,/news/news_read.nhn?article_id=0002945161&office_id=011&mode=search&query=슈프리마에이치큐&page=1,2016-12-27 15:04,"슈프리마에이치큐, 얼굴인식 인증 관련 특허 취득",슈프리마에이치큐(094840)는 얼굴인식을 이용한 인증장치 및 인증방법에 관련한 국내특허를 취득했다고 27일 공시했다. 이 특허는 얼굴인식을 이용한 인증장치와 그 인증방법에 관한 것으로 더욱 상세하게는 얼굴인식 처리속도향상 및 인식오류율 감소를 위하여 사용자의 음성을 이용하는 얼굴인식을 이용장치 및 그 인증방법에 관한 기술이다.
머니투데이,094840,/news/news_read.nhn?article_id=0003688000&office_id=008&mode=search&query=슈프리마에이치큐&page=1,2016-05-31 09:04,"슈프리마에이치큐, 유증 최종발행가 주당 9056원",[머니투데이 백지수 기자] 슈프리마에이치큐는 일반공모 유상증자로 발행할 보통주 513만4717주의 최종 발행가액을 주당 9056원으로 확정했다고 31일 공시했다. textlinktopstart textlinktopend textlinkstart
뉴시스,094840,/news/news_read.nhn?article_id=0007507915&office_id=003&mode=search&query=슈프리마에이치큐&page=1,2016-10-06 16:16,슈프리마에이치큐 &quot;지주사 전환 요건 충족 통보 받아&quot;,【서울=뉴시스】최예린 기자 = 통신·방송 장비 제조업체 슈프리마에이치큐(094840)는 공정거래위원회로부터 6월25일을 기준으로 지주회사의 요건을 충족한다는 심사결과를 통보받았다고 6일 공시했다.
연합뉴스,094840,/news/news_read.nhn?article_id=0008574782&office_id=001&mode=search&query=슈프리마에이치큐&page=1,2016-07-29 17:37,슈프리마에이치큐&middot;넥슨지티 불성실공시법인 지정예고,(서울=연합뉴스) 장하나 기자 = 한국거래소는 29일 횡령·배임 사건이 발생한 사실을 지연 공시했다는 이유로 슈프리마에이치큐를 불성실공시법인으로 지정예고했다. 거래소는 이와 함께 넥슨지티에 대해서도 단일판매·공급계약 금액 50% 이상 변경을 이유로 불성실공시법인 지정을 예고했다.
전자신문,094840,/news/news_read.nhn?article_id=0002614291&office_id=030&mode=search&query=슈프리마에이치큐&page=1,2017-06-02 16:15,"[ET투자뉴스][슈프리마에이치큐 지분 변동] 이재원 외 6명 -1.61%p 감소,...","슈프리마에이치큐(094840)는 02일 최대주주 이재원을  비롯한 특별관계자의 보유주식이 감소되었다고 발표했다. 이는 직전 보고일보다 169,278주 감소하여 지분율은 44.33%로 하락했다. 이번 보고 사유는 계열회사변경에따른특별관계자구성원변경으로  알려졌다.   최대주주와 특수관계자의 지분 변동은 주가에 영향을 주는 요인이다. 특히 보유비율을 지속적으로 늘리거나 줄일 경우, 해당종목 투자시 유의할 필요가 있다.  다음은 슈프리마에이치큐의 지분 변동 내역과 보유 내역이다."
한국경제,094840,/news/news_read.nhn?article_id=0003602744&office_id=015&mode=search&query=슈프리마에이치큐&page=1,2016-05-31 17:44,"[마켓인사이트]슈프리마에이치큐,유상증자 발행가액 주당 9056원",이 기사는 05월31일(11:02) 자본시장의 혜안 ‘마켓인사이트’에 게재된 기사입니다 ----------------------------------------------------------- 보안 전문업체 슈프리마에이치큐는 일반공모 유상증자로 발행할 보통주 513만4717주의 최종 발행가액을 주당 9056원으로 확정했다고 31일 공시했다. 액면가는 500원이다. 슈프리마에이치큐는 지문인식 전문업체 슈프리마가 바이오인식 시스템 및 솔루션 사업을 분할함에 따라 변경상장된 ID솔루션 및 융합보안 전문기업이다. ID솔루션 사업은 주로 경찰청 외교부 법무부 등에 지문인식 기술과 제품 등을 공급하는 공공부문 사업군이다. 회사측은 유상증자 최종 발행가액을 청약일 전 3거래일부터 5거래일까지 기간(2016년 5월 26일~5월 30일)의 가중산술평균주가(그 기간동안 증권시장에서 거래된 해당 종목의 총 거래금액을 총 거래량으로 나눈 가격)로 결정했다고 밝혔다. 민지혜 기자
서울경제,094840,/news/news_read.nhn?article_id=0002846519&office_id=011&mode=search&query=슈프리마에이치큐&page=1,2016-06-24 10:11,"슈프리마에이치큐, 256억 유상증자 대금 납입 완료","슈프리마에이치큐(094840)가 유상증자 대금 납입을 완료했다. 슈프라미에이치큐는 24일 지난 5월 31일 결정한 유상증자의 대금을 이날 납입 완료했다고 공시했다. 이번 유상증자는 282만4,113주가 발행됐으며, 255억7,517만원 규모로 추진됐다. 회사 관계자는 “이번 유상증자는 지난 2일부터 21일까지 보통주식을 보유하고 있는 주주 중 청약에 응한 주주에게 해당주식을 현물출자받고 신주로 발행하는 방식으로 진행됐다”고 말했다."
연합뉴스,094840,/news/news_read.nhn?article_id=0008917933&office_id=001&mode=search&query=슈프리마에이치큐&page=1,2016-12-27 15:05,"슈프리마에이치큐, 얼굴인식 인증장치 특허권 취득",(서울=연합뉴스) 김현정 기자 = 코스닥 상장사 슈프리마에이치큐는 얼굴인식을 이용한 인증장치 및 그 인증방법에 관한 특허권을 취득했다고 27일 공시했다.
서울경제,094840,/news/news_read.nhn?article_id=0002863341&office_id=011&mode=search&query=슈프리마에이치큐&page=1,2016-07-29 17:32,"거래소 &ldquo;슈프리마에이치큐, 불성실 공시법인 지정예고&rdquo;",한국거래소가 29일 슈프리마에이치큐(094840)를 횡령배임 혐의발생 지연 공시를 이유로 불성실 공시법인으로 지정 예고한다고 밝혔다. 지정 여부 결정시한은 다음달 24일이다.
이데일리,094840,/news/news_read.nhn?article_id=0003519172&office_id=018&mode=search&query=슈프리마에이치큐&page=1,2016-04-11 09:30,"[특징주]슈프리마에이치큐, 대규모 유증 소식에 약세",[이데일리 유재희 기자] 슈프리마에이치큐가 465억원 규모의 유상증자를 추진한다는 소식에 약세다. 11일 오전 9시27분 현재 슈프리마에이치큐(094840)는 전거래일대비 4.24%(380원) 하락한 8580원에 거래되고 있다. 대규모 유상증자에 따른 물량 부담 우려가 작용하고 있는 것으로 풀이된다. 슈프리마에이치큐는 지난 8일 장마감 후 공시를 통해 타법인 증권 취득 자금 마련을 위해 465억원 규모로 일반공모 방식의 유상증자를 추진한다고 밝혔다. 발행 신주는 493만1594주로 현재 총 발행주식수 764만7727주의 64.5% 해당하는 규모다. 신주 상장 예정일은 오는 7월7일이다.
서울경제,094840,/news/news_read.nhn?article_id=0002905481&office_id=011&mode=search&query=슈프리마에이치큐&page=1,2016-10-25 13:57,"슈프리마에이치큐, 지문조합 인증장치 특허취득",슈프리마에이치큐(094840)는 지문 조합을 이용한 인증장치 및 방법에 관한 특허권을 취득했다고 25일 공시했다.
이데일리,094840,/news/news_read.nhn?article_id=0003519729&office_id=018&mode=search&query=슈프리마에이치큐&page=1,2016-04-11 17:33,"슈프리마에이치큐, 슈프리마 주식 200만주 공개매수",- 주당 2만3250원…슈프리마에이치큐 보통주 지급 방식 [이데일리 박형수 기자] 슈프리마에이치큐(094840)는 지주회사 요건을 충족하려고 슈프리마 지분 28.25%(200만주)를 주당 2만3250원에 공개 매수한다고 11일 공시했다. 회사 측은 공개매수에 응한 슈프리마 주주에게 현금을 지급하는 ‘현금매수 방식’이 아니고 슈프리마에이치큐 보통주를 교부하는 ‘현물출자 신주발행의 방식’이라고 설명했다.
머니투데이,094840,/news/news_read.nhn?article_id=0003751021&office_id=008&mode=search&query=슈프리마에이치큐&page=1,2016-10-04 17:35,"슈프리마에이치큐, 전 사내이사 횡령 혐의 불기소 처분",[머니투데이 안재용 기자] 슈프리마에이치큐는 박대종 전 사내이사가 회사자금 9380만원을 횡령했다는 혐의에 대해 서울중앙지방검찰청으로부터 불기소 처분을 받았다고 4일 공시했다. 불기소이유는 피의자 사망이다. textlinktopstart textlinktopend textlinkstart
머니투데이,094840,/news/news_read.nhn?article_id=0003719517&office_id=008&mode=search&query=슈프리마에이치큐&page=1,2016-07-29 17:31,"슈프리마에이치큐, 불성실공시법인지정예고",[머니투데이 정인지 기자] 한국거래소는 29일 횡령배임 혐의발생 지연공시를 이유로 슈프리마에이치큐에 불성실공시법인지정을 예고했다. 불성실공시법인지정여부 결정시한은 오는 8월24일까지다. textlinktopstart textlinktopend textlinkstart
연합뉴스,094840,/news/news_read.nhn?article_id=0008776943&office_id=001&mode=search&query=슈프리마에이치큐&page=1,2016-10-25 13:55,"슈프리마에이치큐, 지문조합 인증장치 특허 취득","(서울=연합뉴스) 김현정 기자 = 코스닥 상장사 슈프리마에이치큐는 지문조합을 이용한 인증장치 및 방법에 대한 특허권을 취득했다고 25일 공시했다. 회사 측은 ""특허 기술은 높은 보안 수준을 요구하는 업종에 적극적으로 활용할 예정""이라고 밝혔다."
이데일리,094840,/news/news_read.nhn?article_id=0003572374&office_id=018&mode=search&query=슈프리마에이치큐&page=1,2016-06-24 17:44,"슈프리마, 슈프리마에이치큐로 최대주주 변경",[이데일리 이명철 기자] 슈프리마(236200)는 슈프리마에이치큐(094840)가 주식 110만8주를 공개매수 함에 따라 최대주주로 변경됐다고 24일 공시했다. ‘독점규제 및 공정거래에 관한 법률’에 따른 지주회사로 전환하기 위해 슈프리마에이치큐는 슈프리마를 자회사로 편입시키고 ‘독점규제 및 공정거래에 관한 법률’ 제8조의2 제2항제2호에 따른 비율 이상을 소유하기 위해서라고 전했다.
이데일리,094840,/news/news_read.nhn?article_id=0003598678&office_id=018&mode=search&query=슈프리마에이치큐&page=1,2016-07-29 18:16,"거래소, 슈프리마에이치큐 불성실 공시법인 지정 예고",[이데일리 임성영 기자] 한국거래소 코스닥시장 본부는 슈프리마에이치큐(094840)에 대해 공시불이행을 사유로 불성실 공시법인에 지정 예고한다고 29일 공시했다. 불성실 공시법인 지정 여부 결정 시한은 내달 24일이다.
이데일리,094840,/news/news_read.nhn?article_id=0003392738&office_id=018&mode=search&query=슈프리마에이치큐&page=1,2015-11-12 13:17,"슈프리마, 슈프리마에이치큐로 사명 변경",[이데일리 정병묵 기자] 슈프리마(094840)는 기업 분할에 따라 슈프리마에이치큐로 사명을 변경하기로 했다고 12일 공시했다.
아시아경제,094840,/news/news_read.nhn?article_id=0003855162&office_id=277&mode=search&query=슈프리마에이치큐&page=1,2016-10-25 14:05,"슈프리마에이치큐, 지문인증장치 특허권 취득","[아시아경제 권성회 기자] 슈프리마에이치큐는 지문 조합을 이용한 인증장치 및 방법에 대한 특허권을 취득했다고 25일 공시했다. 회사 측은 “지문의 일치 여부를 검사해 사용자를 인증하는 1차 인증과, 적어도 하나 이상의 지문으로 구성되는 지문 조합에 대응되는 비밀번호 일치 여부를 검사하는 2차 인증을 수행하는 방법”이라며 “높은 보안 수준을 요구하는 업종에 적극 활용할 예정”이라고 밝혔다."
머니투데이,094840,/news/news_read.nhn?article_id=0003731578&office_id=008&mode=search&query=슈프리마에이치큐&page=1,2016-08-24 17:53,"슈프리마에이치큐, 불성실공시법인 미지정",[머니투데이 한은정 기자] 한국거래소는 슈프리마에이치큐에 대해 불성실공시법인 지정을 유예했다고 24일 공시했다. 슈프리마에이치큐는 지난달 22일 횡령배임 혐의발생 지연공시로 불성실공시법인 지정예고된 바 있다. textlinktopstart textlinktopend textlinkstart
연합뉴스,094840,/news/news_read.nhn?article_id=0008322875&office_id=001&mode=search&query=슈프리마에이치큐&page=1,2016-04-11 09:13,"&lt;특징주&gt; 슈프리마에이치큐, 대규모 증자 소식에 약세","(서울=연합뉴스) 유현민 기자 = 통신·방송장비 제조업체인 슈프리마에이치큐가 대규모 증자 결정 소식에 11일 장 초반 약세를 보이고 있다. 이날 오전 9시 9분 현재 코스닥시장에서 슈프리마에이치큐는 전 거래일보다 5.13% 떨어진 8천500원에 거래됐다. 슈프리마에이치큐는 다른 법인 증권 취득 자금 마련을 위해 465억원 규모의 일반공모 방식의 유상증자를 하기로 했다고 지난 8일 장 종료 후 공시했다. 발행되는 신주는 493만1천594주, 신주 발행가액은 9천429원이다. 신주 상장 예정일은 오는 7월 7일이다."
파이낸셜뉴스,094840,/news/news_read.nhn?article_id=0003656029&office_id=014&mode=search&query=슈프리마에이치큐&page=1,2016-05-31 08:49,슈프리마에이치큐 유상증자 최종발행가액 9056원,슈프리마에이치큐는 유상증자 확정 최종발행가액이 9056원이라고 31일 공시했다. 발행 주식수는 513만4717주다.
이데일리,094840,/news/news_read.nhn?article_id=0003616200&office_id=018&mode=search&query=슈프리마에이치큐&page=1,2016-08-24 17:50,"거래소, 슈프리마에이치큐 불성실 공시법인 지정 유예",[이데일리 임성영 기자] 한국거래소 코스닥시장 본부는 슈프리마에이치큐(094840)에 대해 불성실 공시 법인으로의 지정을 유예한다고 24일 공시했다. 거래소는 “부과벌점은 2.0점이며 6개월간 불성실공시법인으로 지정 예고 되지 않을 조건으로 유예한다”고 설명했다. 이어 “만약 조건 기간은 6개월 동안 불성실 공시 법인으로 지정되면 지정되는 날을 기준으로 지정을 유예한 건에 대해 불성실 공시법인으로 지정하고 유예된 벌점을 부과한다”고 덧붙였다.
아시아경제,094840,/news/news_read.nhn?article_id=0003798367&office_id=277&mode=search&query=슈프리마에이치큐&page=1,2016-07-29 18:19,"거래소, 슈프리마에이치큐 불성실 공시법인 지정 예고",[아시아경제 임혜선 기자]한국거래소 코스닥시장 본부는 29일 슈프리마에이치큐에 대해 공시불이행을 사유로 불성실 공시법인에 지정 예고한다고 공시했다.
한국경제,094840,/news/news_read.nhn?article_id=0003475503&office_id=015&mode=search&query=슈프리마에이치큐&page=1,2015-11-12 13:24,"슈프리마, 슈프리마에이치큐로 사명 변경",[ 정현영 기자  ] 슈프리마는 12일 기업분할로 인해 사명을 슈프리마에이치큐(Suprema HQ Inc.)로 변경한다고 공시했다. 정현영 한경닷컴 기자
한국경제TV,094840,/news/news_read.nhn?article_id=0000651374&office_id=215&mode=search&query=슈프리마에이치큐&page=1,2018-06-21 15:00,"슈프리마에이치큐, 전일 대비 약 -3% 하락한 6,040원","[한국경제TV 라이온봇 기자] [그림 1] 최근 3개월 간 주가 추세 및 기간별 수익률 슈프리마에이치큐는 6월 21일 14시 59분 전일 대비 약 -3% 하락한 6,040원에 거래되고 있다. 슈프리마에이치큐는 코스닥 상장 기업으로 금융 업종에 속해 있다. 시가총액은 652억원으로 코스닥 상장기업 중 915위에 위치 해 있다. [종목 성향 진단] [그림 2] 종목 성향 진단 슈프리마에이치큐의 투자 스타일은 모호한 측면이 있으나 가치주라고 볼 수 있다. 기업 가치 대비 낮은 주가가 매력적인 기업이다. 주가 모멘텀은 평범한 수준이었다. 최근 1개월 수익률이 3.08%, 3개월 수익률은 4.43%, 6개월 수익률은 6.36%를 기록했다. 슈프리마에이치큐 종목에 대한 투자자의 관심도는 상대적으로 낮은 편이었다. [투자 점수 진단] [그림 3] 투자 점수 진단 슈프리마에이치큐는 어느 측면에서 투자 매력도가 높은 종목일까? AI 인공지능 종목 분석 시스템을 이용해 성장성, 수익성, 효율성, 안전성, 저평가성, 추세 등 주가 수익률에 영향을 줄 수 있는 6가지 핵심 투자 지표를 점수화하여 종목의 투자 매력도를 계산해보았다. 그 결과 슈프리마에이치큐는 상대적으로 기업안정성 측면에서 두각을 드러내고 있었다. 기업안정성 점수는 기업의 재무 구조가 얼마나 안정적인 상태인지를 나타낸다. 슈프리마에이치큐는 특히 당좌비율 측면에서 가장 높은 점수는 기록했는데, 전체 시장 내 24위를 기록하며 상위 1.19%에 위치했다. 업종별로는 11위를 기록하며 상위 1.71%에 위치했다. 그러나 주가 상승 모멘텀을 나타내는 추세 측면에서는 아쉬움을 나타냈다. (위의 AI인공지능 점수는 재무 데이터를 기반으로 전체 상장 종목과 비교/분석하여 도출한 점수로 높은 점수가 반드시 높은 수익률을 보장하지 않습니다. 위의 자료는 당사의 추천 종목이 아니며, 투자 시 참고용으로 제시해드리는 것입니다. 핵심투자지표를 결합해 종목의 투자매력도를 종합 계산한 ""인공지능 투자점수""는 ""거장들의 투자공식"" 앱에서 확인하실 수 있습니다.) 라이온봇 기자 -한국경제TV※ 본 기사는 한국경제TV와 '거장들의 투자공식이'자체 개발한 '라이온봇 기자'가 실시간으로 작성한 기사입니다. 라이온봇기자 ⓒ 한국경제TV, 무단 전재 및 재배포 금지 한국경제TV 관련뉴스해당 언론사에서 선정하며 언론사 페이지(아웃링크)로 이동해 볼 수 있습니다.""침대 보다 집이 더 문제""… 커지는 라돈 공포빗썸, 해킹으로 350억 탈취...입출금 전면 중단김동연-장하성 '불화설'에…靑 ""분위기 좋습니다""최태원 회장 ""경쟁사가 찾아오더라""...공유·개방의 힘[시승기] '안전과 실용'…패밀리 SUV 이쿼녹스"
이데일리,094840,/news/news_read.nhn?article_id=0003701180&office_id=018&mode=search&query=슈프리마에이치큐&page=1,2016-12-14 09:13,"슈프리마에이치큐, 무선 통신 지원가능한 지문스캐너 출시","- CPU 내부 탑재로 보안성 강화 [이데일리 박철근 기자] 바이오인식 전문기업 슈프리마에이치큐(094840)는 14일 기기 내 인증 및 HID(human interface device)  프로토콜을 지원하는 지문 스캐너 ‘바이오미니 슬림S(BioMini Slim S·사진)’를 출시했다. 이 제품은 CPU(중앙처리장치)를 내부에 탑재해 기기 내에서 지문 정보의 추출, 인증 및 암호화까지 수행할수 있어  보안성을 강화했다. 특히 지문 스캐너 중 세계 최초로 HID 프로토콜을 지원함으로써 플러그 앤 플레이를 가능하게 해 스마트 TV, 프린터, POS 장비 등에 추가 설치 없이 고객들이 손쉽게 사용할 수 있도록 편의성을 한층 강화했다. 와이파이를 지원하는 이 제품은 안드로이드 기기뿐 아니라 iOS 운영체제 기반 기기와 연동해 사용할 수 있다. 이를 기반으로 기기 내에 웹서버를 구현해 뛰어난 보안성을 제공하고 고객이 원하는 솔루션을 쉽게 개발할 수 있다고 회사측은 전했다. 이재원 슈프리마에이치큐 대표는 “바이오미니 슬림S는 모든 면에서 경쟁사들을 압도할 수 있는 제품”이라며 “확장된 편의성과 보안성은 급격히 변화하는 환경과 고객의 요구를 모두 수용할 수 있다”고 강조했다. (사진=슈프리마에이치큐)"
머니투데이,094840,/news/news_read.nhn?article_id=0003762134&office_id=008&mode=search&query=슈프리마에이치큐&page=1,2016-10-25 12:10,"슈프리마에이치큐, 이중 보안 인증 장치 특허권 취득","[머니투데이 배영윤 기자] 슈프리마에이치큐는 지문 조합을 이용한 인증장치 및 방법에 관한 특허권을 취득했다고 25일 공시했다. 해당 특허는 지문 일치 여부를 검사하는 1차 인증과 하나 이상의 지문으로 구성되는 지문 조합에 대응되는 비밀번호 일치 여부를 검사하는 2차 인증을 통한 이중 보안 인증을 수행하는 기술이다. 회사 측은 해당 특허 기술에 대해 ""높은 보안 수준을 요구하는 업종에 적극 활용할 예정""이라고 밝혔다. textlinktopstart textlinktopend textlinkstart"
이데일리,094840,/news/news_read.nhn?article_id=0003643173&office_id=018&mode=search&query=슈프리마에이치큐&page=1,2016-10-04 17:49,"슈프리마에이치큐, 퇴직 임원 업무상 횡령 혐의 불기소 처분",[이데일리 최정희 기자] 슈프리마에이치큐(094840)는 9380만원을 횡령한 박대종 전 사내이사를 상대로 고소한 결과 서울중앙지방검찰청으로부터 불기소 처분을 받았다고 4일 공시했다. 박 전 이사가 사망하면서 공소원이 사라진 영향이다.
