source,symbol,link,date,title,content
한국경제,107640,/news/news_read.nhn?article_id=0003628995&office_id=015&mode=search&query=한중엔시에스&page=1,2016-07-22 10:04,"한중엔시에스, 연료전지 시스템용 통합형 개질기 특허 취득",[ 이민하 기자  ] 한중엔시에스는 연료전지 시스템용 통합형 개질기(Integrated Reformer for Fuel Cell System) 특허권을 취득했다고 22일 공시했다. 이민하 한경닷컴 기자
아시아경제,107640,/news/news_read.nhn?article_id=0003603804&office_id=277&mode=search&query=한중엔시에스&page=1,2015-10-15 11:13,"한중엔시에스, 열교환기 관련 특허권 취득","[아시아경제 이현우 기자]한중엔시엔스는 15일 예열기가 내장된 열교환기(Heat Exchanger With A Built In Preheater) 관련 특허권을 취득했다고 공시했다. 한중엔시에스 관계자는 ""본 특허 확보를 통해 추후 연료전지 MBOP 부품의 상용화를 위한 기술적 근거로 활용할 계획""이라고 밝혔다."
머니투데이,107640,/news/news_read.nhn?article_id=0003608387&office_id=008&mode=search&query=한중엔시에스&page=1,2016-01-06 10:47,"한중엔시에스, 경북 영천 토지 재평가 차액 71억 발생",[머니투데이 정영일 기자] 코넥스 상장기업 한중엔시에스는 6일 경북 영천시 채신동 일대의 보유 토지에 대한 자산재평가 결과 137억9800만원으로 평가돼 재평가 차액이 71억1100만원이 발생했다고 공시했다. 이는 자산총액대비 10.35%에 달한다. textlinktopstart textlinktopend textlinkstart
파이낸셜뉴스,107640,/news/news_read.nhn?article_id=0004080104&office_id=014&mode=search&query=한중엔시에스&page=1,2018-08-23 10:05,"[fnRASSI]한중엔시에스, 당일 거래량 증가하며 5거래일 하락세 지속","한중엔시에스(107640)의 당일 거래량이 최근 5거래일 거래량의 최고치를 경신하며 투자자들의 관심을 받고 있다. 그리고 한중엔시에스는 5일 연속 하락흐름을 보이며, 10시 3분 현재 13.27% 내린 1,700원에 거래중이다. 외국인 보유량 변화 없음, 기관 증가 (5일 누적) 최근 5일간 동종목의 외국인 투자자는 0주 순매수하였고 마찬가지로 기관은 600주 순매수하였다. 전날 기관은 600주 순매수했지만 외국인은 순매수량이 0으로 보유비율 그대로 유지했다. 다음 표는 동종목의 외국인, 기관의 일별 순매수량을 나타낸 것이다. 'fnRASSI'는 증권전문 기업 씽크풀과 파이낸셜뉴스의 협업으로 로봇기자가 실시간으로 생산하는 기사입니다."
머니투데이,107640,/news/news_read.nhn?article_id=0003578290&office_id=008&mode=search&query=한중엔시에스&page=1,2015-11-13 11:07,"한중엔시에스, 휴대 전원공급 장치 스위치 특허 취득","[머니투데이 박종진 기자] 코넥스 상장법인인 한중엔시에스는 휴대·이동형 상용 전원 공급 장치의 전원 제어용 다중스위치와 인버터 제어용 스위치 특허권을 취득했다고 13일 공시했다. 회사는 ""당사에서 개발하고 있는 휴대·이동형의 상용전원 공급장치와 더불어, 기존 사용되고 있는 인버터에 적용하면 에너지 절약효과를 얻을 수 있다""고 밝혔다. textlinktopstart textlinktopend textlinkstart"
아시아경제,107640,/news/news_read.nhn?article_id=0004085920&office_id=277&mode=search&query=한중엔시에스&page=1,2017-09-28 11:12,"한중엔시에스, 임시주총 소집&hellip;전환우선주 자기주식 매입",[아시아경제 박미주 기자]한중엔시에스는 오는 11월24일 오전 11시 경북 영천시 영천산단로 379(채신동) 본점2층 회의실에서 임시주주총회를 연다고 28일 공시했다. 안건은 전환우선주 자기주식 매입 승인의 건이다.
아시아경제,107640,/news/news_read.nhn?article_id=0004044017&office_id=277&mode=search&query=한중엔시에스&page=1,2017-07-28 10:56,"한중엔시에스, 코스닥 상장예심 미승인",[아시아경제 박미주 기자]한중엔시에스는 한국거래소 코스닥시장본부에 상장예비심사를 접수한 결과 미승인 통보를 받았다고 28일 공시했다.
연합뉴스,107640,/news/news_read.nhn?article_id=0009254836&office_id=001&mode=search&query=한중엔시에스&page=1,2017-05-10 11:26,"한중엔시에스, 코넥스서 코스닥 이전상장 결정","(서울=연합뉴스) 조민정 기자 = 코넥스 상장사인 한중엔시에스는 코스닥시장으로 이전 상장을 결정하고 이달 중 예비심사를 청구할 예정이라고 10일 공시했다. 회사 측은 ""기업가치 제고와 원활한 자금 조달, 주식의 유동성 확보를 위한 것""이라고 설명했다."
이데일리,107640,/news/news_read.nhn?article_id=0003613654&office_id=018&mode=search&query=한중엔시에스&page=1,2016-08-22 06:01,"7권의 시집 출판한 감성CEO, 김환식 한중엔시에스 대표","- '15년 매출 635억원의 자동차부품제조 기업 - 10년간의 공무원 생활, CEO를 꿈꿔 창업 - 7권의 시집을 낸 감성CEO - 사내 복지·직원과 소통에 관심 많아 [영천=이데일리 박경훈 기자] “학창시절에는 나름 문학소년이었습니다. 늦게나마 시(詩)를 쓰며 꿈을 다시 찾은 셈이죠.” 19일 경북 영천시 자동차부품경제특구 내 한중엔시에스에서 만난 김환식(58) 대표는 지방 공무원에서 600억원대 자동차 부품기업 대표로 변신한, 또 7권의 시집을 출간한 시인이라는 독특한 이력을 지니고 있다. 김환식 한중엔시에스 대표는 “지금은 창업 20년을 넘어 새로운 20년을 향해 도약할 시기”라고 말했다. (사진=박경훈 기자) 지난해 매출 635억원의 한중엔시에스는 자동차용 배기시스템부품, WCS(에어백 압력 조절 승객 중량 감지센서 모듈), 램프, 브레이크 등을 생산하는 글로벌강소기업이다. 이 제품들은 현대자동차(005380)·기아자동차(000270)·현대모비스(012330)를 비롯해 미국 타이코 일렉트로닉스(TE)·테네코(Tenneco), 독일 브로제(Brose) 등에 납품한다. ◇10년간의 공무원 생활…기업단지조성 실무 맡으며 CEO 꿈꿔 영천이 고향인 김 대표의 어릴 적 꿈은 국어 선생님이었지만 가난한 집안 환경 탓에 고교 졸업 후 공무원 길을 걷는다. 평범한 지역 공무원이었던 김 대표를 기업 CEO로 변신케 한 단초는 영천농공단지 조성사업이다. 그는 “1985년에 농공단지를 조성하면서 기업 유치·지원 업무를 맡았고 자연스레 기업을 알게 됐다”고 말했다. 김 대표는 기업을 하나라도 더 도와주기 위해 주말까지 반납하며 일했다. 하지만 당시 그런 그의 모습을 색안경을 끼고 보는 사람이 많았다. 김 대표는 “당시는 창업하려면 도장만 200개를 찍어야 했던 시절”이라며 “이들을 돕기 위해 인허가 서류를 직접 들고 관련 부서 협조하려고 하면 다들 기업과 연관이 있는 것으로 생각했다”고 회고했다. 그가 씨앗을 뿌려놓은 기업들이 하나 둘 성장해 나갈수록 김 대표의 머릿속에서는 낮은 처우, 폐쇄적인 문화 등 공무원 생활에 대한 회의감과 기업인에 대한 동경이 꿈틀댔다. 결국 나이 서른셋이던 1991년 10여년의 공무원 생활을 마감했다. 퇴직금을 포함 손에 주어진 돈은 1500만원 남짓이 전부였다. 그는 종잣돈을 모으기 위해 영농단지 조성 경험을 살려 기업 컨설팅 업체를 꾸려 1억원의 돈을 모았다. 부족한 실력을 메우기 위해 경북산업대(현 경일대)에 들어가 경영학을 전공한다. 한중엔시에스는 스마트공장 설비를 구축했다. 목표량과 조업도를 보여주는 화면. (사진=박경훈 기자) 자동차산업의 미래가 밝다고 생각한 김 대표는 1995년 대구 북구에 12명의 직원을 지닌 부품제조기업인 ‘한중’을 열었다. 하지만 자동차부품과 전혀 무관한 이력을 보고 제품을 맡길 사람은 아무도 없었다. 김 대표는 “업체들을 찾아다니며 ‘일단 6개월만 지켜보고 그때도 아니다 싶으면 계약을 끊어도 좋다’”고 설득해 납품 수주를 받았다. 기술력을 인정받으며 자동차 램프에서 시작한 한중엔시에스의 생산품목은 프레스 단품·볼트·너트 등으로 다양해졌다. 한중엔시에스는 2000년대에 다른 기업에 비해 성장률이 좋았다. 김 대표는 “IMF때 많은 영세기업들이 도산하고 살아남은 기업은 대부분 투자에 소극적이었다”며 “우리는 그때 공격적으로 투자했다”고 성장 비결을 말했다. 2005년 100억원이었던 매출액은 2008년 200억원으로 2배로 뛰었고 현재는 600억원대로 뛰었다. 김환식 대표의 시집 ‘버팀목’과 ‘참 고약한 버릇’. (사진=박경훈 기자) ◇7권의 시집을 낸 감성CEO…창의성, 인문학 감성 기르기 위해 김 대표는 시집과 칼럼집 8권을 출판한 작가로, 대구문인협회 부회장을 역임하기도 했다. 그는 스트레스를 음주 대신 독서로 풀 정도로 글을 좋아한다. 김 대표는 “학창시절 누구보다 글을 좋아했었는데 삶이 워낙 바빠 그동안 진짜 좋아하는 것을 잊고 살았다”고 돌이켰다. 그가 본격적으로 시를 쓰기 시작한 것은 2005년. 창의성과 인문학적 감성을 기르기 위해서다. 김 대표는 “시를 쓰다 보면 남들이 보지 못하는 시각으로 세상을 볼 수 있다”며 “시 창작이나 제품 생산은 무언가를 새로 만든다는 점에서 비슷하다”고 설명했다. 김 대표의 인문학 사랑은 경영에서도 드러난다. 그는 2010년, 직원 누구나 원하는 책을 신청해 볼 수 있는 서재를 만들었다. 서재에는 책이 3000여권이나 있다. 김 대표는 사내 복지에도 남다른 관심을 쏟는다. 한중엔시에스는 내일채움공제 1호 기업이다. 직장어린이집은 물론 사내대학 프로그램도 개설했다. 김 대표는 “고졸 직원들은 사내에서 학위를 딸 수 있어 좋고, 기업은 대학 진학을 이유로 직원들이 퇴사하는 것을 막을 수 있어 일거양득”이라고 말했다. 김 대표의 목표는 두 가지다. 김 대표는 “현재 큐브젠(CUBEGEN)이라는 브랜드의 휴대용 축·발전기 상용화를 눈앞에 두고 있다”며 “우리 브랜드로 출시되는 신제품들이 많은 사랑을 받았으면 좋겠다”고 소망했다. 이어 “구성원 모두 꿈·희망·행복이 가득한 회사를 만들고 싶다”며 직원들에 대한 애정을 표현했다."
연합뉴스,107640,/news/news_read.nhn?article_id=0008763622&office_id=001&mode=search&query=한중엔시에스&page=1,2016-10-19 13:34,중소기업융합대전 금탑훈장에 김환식 한중엔시에스 대표,"(서울=연합뉴스) 이승환 기자 = 중소기업청과 중소기업융합중앙회는 19일 서울 더케이호텔에서 '2016 중소기업융합대전'을 열고 중소기업 간 교류·협력을 통해 기술융합사업 성과를 거둔 기업인을 포상했다. 대전 최고 영예인 금탑산업훈장은 김환식 한중엔시에스 대표가 수상했다. 김 대표는 중소기업 간 협력을 통해 친환경 하이브리드 등 신기술을 개발해 회사를 글로벌기업으로 성장시킨 공로를 인정받았다. 동탑산업훈장은 도성찬 대도테크라 대표가 받았다. 도 대표는 정보통신기술(IT)을 접목한 신개념의 3차원 입체영상(3D) 개념 자동차 도장플랜트 사업을 추진하면서 회사 경쟁력을 끌어올렸다. 산업포장은 스마트 전기개폐기 시스템 등을 개발한 박종관 다우산업 대표, 26개 해외 파트너사와의 기술 협력을 한 최태호 다인소재 대표가 수상했다. 중소기업융합대전은 '3S(속도·범위·체계 영향력 의미) 융합경영 확산으로 중소기업의 글로벌 경쟁력 강화'라는 주제로 열렸으며 중소기업 유관단체장과 600여 명의 기업인이 참석했다."
연합뉴스,107640,/news/news_read.nhn?article_id=0008765316&office_id=001&mode=search&query=한중엔시에스&page=1,2016-10-20 07:11,한중엔시에스 &quot;내년 중국 車부품 시장 진출&quot;,"(서울=연합뉴스) 이승환 기자 = ""내년 상반기 중국 자동차 부품 시장 진출을 본격화합니다."" 올해 중소기업융합대전에서 최고 영예인 금탑산업훈장을 수상한 김환식 한중엔시에스 대표이사는 19일 서울 양재동 더케이 호텔 한 식당에서 가진 연합뉴스와의 인터뷰에서 이같이 밝혔다. 한중엔시에스는 김 대표가 1995년 설립한 자동차 부품 생산·판매 기업으로 휴대용 비상전원장치, 전기자동차 핵심 부품 센서 등을 생산해 현대모비스, 미국 테네코 등 글로벌 자동차 부품 업체에 납품하고 있다. 김환식 대표이사. [한중엔시에스 제공 = 연합뉴스] 한중엔시에스는 2013년 12월 한국거래소 코넥스 시장에 상장된 후 성장세를 보이고 있으며 지난해 매출로 635억 원을 기록했다. 이날 더케이호텔에서 열린 중소기업융합대전에서 친환경 하이브리드 등 신기술을 개발한 공로로 김 대표가 금탑산업훈장을 수상하면서 한중엔시에스는 업계의 주목을 받고 있다. 김 대표는 ""그간 투자를 아끼지 않은 연구개발(R&D) 분야가 성과를 내고 있다""며 중국 진출 계획을 밝혔다. 그는 ""그간 미국 법인을 두고 현지 시장 진출에 공을 들였으나 전기자동차 등 중국 친환경 차 시장이 무섭게 성장할 것으로 보고 중국 진출을 본격화하기로 했다""며 ""특히 전기차 필수 부품인 센서는 우리 회사가 글로벌 경쟁력을 확보한 분야""라고 말했다. 그는 이어 ""중국 중견 자동차 업체 두 곳과 부품 공급 계약을 사실상 확정해 내년 3월부터 자동차 부품인 센서를 공급한다""고 설명했다. 김 대표는 그간 R&D 투자를 통한 기술 경쟁력 확보에 공을 들였다. 2005년 회사 자체 연구소를 설립한 한중엔시에스는 지난해 기준 40여 개의 기술 특허를 보유하고 있다. 김 대표는 연구소를 자신의 직속 조직으로 두고 회사 미래 성장 동력을 직접 챙기고 있으며 고졸·전문대졸 사원을 대상으로 한 '사내 대학 과정'을 마련하기도 했다. 사내 대학 과정이란 사원들이 주중 야간에 회사에서 대학교수 강연을 듣고 주말에는 현장 실습을 하는 교육 과정으로 김 대표가 R&D 인력 확보를 위해 생각해낸 것이다. 김 대표는 ""중소기업의 가장 큰 애로는 R&D 인력 확보""라며 ""인재들이 중소기업들을 기피할 수 있어 회사 자체적으로 인재를 양성하게 됐다""고 설명했다. 기술 경쟁력을 바탕으로 다양한 고객사를 확보한 덕분에 한중엔시에스는 최근 현대차 노조의 파업에도 별다른 타격을 받지 않았다고 김 대표는 전했다. 지난 7월 이후 진행됐다가 최근 중단된 현대차 파업으로 1차 협력 부품 업체들이 파업 기간 하루 900억 원의 매출 손실을 본 것과 대조적이다. 김 대표는 ""현대차 등 탄탄한 고객사 한 곳을 두면 회사 영업은 편해지겠지만 고객사가 흔들리면 연쇄적으로 따라 흔들리는 위험 부담이 있다""며 ""중소기업들은 사정이 어려워도 R&D 투자에 나서 해외 고객사 등 다양한 고객사를 확보해야 한다""고 말했다. 1958년 경북 영천에서 태어난 그는 시집 7권을 낸 특이한 이력도 갖고 있다. 좋아하는 작가로 '정호승 시인'을 꼽은 김 대표는 경영자와 시인 모두 현상이나 사안을 새로운 시각으로 보는 공통점이 있다고 강조했다. 김 대표는 ""똑같은 환경을 봐도 시인은 보통 사람과 달리 자신만의 새로운 의미를 찾아낸다""며 ""경영자도 남들이 보지 못하는 사업의 성장 가능성을 보고 도전할 수 있는 시야가 있어야 한다""고 설명했다."
헤럴드경제,107640,/news/news_read.nhn?article_id=0001138044&office_id=016&mode=search&query=한중엔시에스&page=1,2016-10-19 13:02,"김환식 한중엔시에스 대표, 금탑산업훈장 수상","- 중기청, 2016 중소기업융합대전 개최 [헤럴드경제=정진영 기자] 김환식 ㈜한중엔시에스 대표 &lt;사진&gt; 가 금탑산업훈장을 수상했다. 중소기업청과 중소기업융합중앙회는 19일 서울 더케이호텔에서 ‘3S 융합경영 확산으로 중소기업의 글로벌 경쟁력 강화’이란 구호 아래 ‘2016 중소기업융합대전’을 개최했다. 이날 행사에는 중소기업 유관단체장과 600여 명의 중소기업인이 참석한 가운데, 이업종 중소기업 간 교류 및 기술융합의 우수성과를 창출한 유공자 포상과 함께 각종 우수 사례 전시가 이뤄졌다. 최고 영예인 금탑산업훈장을 수상한 김 대표는 중소기업 간 교류ㆍ협력을 통해 친환경 하이브리드 및 전기ㆍ수소차용 진공센서 등 신기술을 개발해 글로벌기업으로 성장시킨 공로를 인정받았다. 동탑산업훈장을 수상한 도성찬 ㈜대도테크라 대표는 정보통신기술(IT)을 접목한 신개념의 3차원 입체영상(3D) 모델링 자동차 도장플랜트 사업과 함께 영상장치를 산업현장에 접목한 플랜트 경계 감시 시스템 등을 개발해 강소기업으로 성장시킨 공로를 인정받았다. 박종관 ㈜다우산업 대표는 지역 내 중소기업의 융합교류활동을 선도하고, 사물인터넷(IoT) 신기술을 적용한 스마트 전기개폐기 시스템 등의 개발로 매출의 98%이상 수출을 통해 성과를 이룬 공로로, 최태호 ㈜다인소재 대표는 26개의 해외 파트너사와의 기술 제휴 및 연구개발로 212개의 제품을 만들고 450개의 고객사를 확보하며 독보적인 기능성 식품소재 개발 전문기업으로 성장한 공로로 산업포장을 받았다. 개막식에 앞서 진행된 융합 컨퍼런스에선 김기찬 가톨릭대 교수가 ‘4차 산업혁명의 특징과 국내 중소기업의 대처방안’이란 주제로 4차 산업혁명의 이슈 배경과 이에 대응하기 위한 국내 중소기업의 교류와 협력의 필요성을 설명하고 혁신방안에 대한 방법론를 제시했다. 임종태 대전창조경제혁신센터 센터장은 ‘4차 산업혁명의 키워드, 융합과 창조’라는 주제로 자사의 핵심역량에 부합한 창업기업과의 공생 협업을 통한 성장방안에 대해 강연했다. 교류ㆍ협업 우수사례 및 융합신제품 전시회에는 일반소비재부터 산업재까지 30개 기업이 참여해 융합신기술 및 신사업 창출 사례를 전시ㆍ홍보했다. 기술이전 및 사업화 상담회에는 동신대, 전북생물산업진흥원, 강원대 등이 참여해 각 기관이 보유한 기술을 바탕으로 사업화 성공사례 홍보 및 기술이전 상담회를 실시했다. 이밖에도 중국 시장 진출을 지원하는 전문무역상사가 참여해 성공사례를 설명하고, 중국기업들과의 거래를 희망하는 기업에게 필요한 절차와 바이어를 소개하는 중국시장진출 상담회도 마련됐다."
파이낸셜뉴스,107640,/news/news_read.nhn?article_id=0003954759&office_id=014&mode=search&query=한중엔시에스&page=1,2018-01-30 11:05,"[fnRASSI]한중엔시에스, 14.9% 내리며 거래량 증가",한중엔시에스(107640)의 현재 거래량이 최근 5거래일 거래량의 최고치를 넘어섰다. 그리고 현재 전 거래일보다 14.9% 감소하여 7일 연속 하락흐름을 보이고 있다. 'fnRASSI'는 증권전문 기업 씽크풀과 파이낸셜뉴스의 협업으로 로봇기자가 실시간으로 생산하는 기사입니다.
