source,symbol,link,date,title,content
매일경제,127710,/news/news_read.nhn?article_id=0003753716&office_id=009&mode=search&query=아시아경제&page=1,2016-06-21 16:39,&ldquo;브렉시트 이뤄져도 아시아 경제엔 충격 미미&rdquo;,"[[--image0--]]// 세계 금융시장의 관심이 영국의 유럽연합 탈퇴에 쏠려 있는 가운데 브렉시트(영국의 유럽연합 탈퇴)가 현실화되더라도 아시아 국가들에 미치는 충격은 적을 것이라는 주장이 나왔다. 미국 매체 블룸버그 통신은 캐피털이코노믹스의 분석을 토대로 영국이 유럽연합을 탈퇴한다고 해도 아시아 지역의 국내총생산(GDP)은 0.2% 하락하는 데 그칠 것으로 21일 보도했다. 캐피털이코노믹스는 브렉시트가 아시아 경제에 가할 수 있는 충격이 미미한 이유로 “수출 규모가 작기 때문”이라고 했다. 아시아에서 영국으로 향하는 수출 규모는 지역 GDP의 0.7% 수준에 그친다. 아시아 최대 경제국인 중국도 브렉시트의 타격을 크게 받지 않을 것으로 전망됐다. 중국 GDP에서 영국으로 향하는 수출 비중은 0.5% 수준에 그친다. 캐피털이코노믹스의 료우창은 브렉시트 이후 글로벌 금융시장이 요동치더라도 중국이 잘 견뎌낼 것으로 봤다. 그는 “중국의 자본계정이 폐쇄적이고 중국과 다른 나라의 금융 연결고리도 제한적이기 때문”이라고 설명했다. 캐피털이코노믹스의 다니엘 마틴 선임연구원도 “영국과의 무역 규모가 작은 아시아 신흥시장은 브렉시트 충격 대부분을 면할 수 있을 것”이라고 말했다. 그러나 “홍콩과 캄보디아, 베트남 등 영국과 무역관계를 장기간 이어온 일부 아시아 국가들의 경우 상대적으로 큰 타격을 입을 것”이라고 설명했다. [디지털뉴스국 김지현 인턴기자] r_start //"
아시아경제,127710,/news/news_read.nhn?article_id=0003763694&office_id=277&mode=search&query=아시아경제&page=1,2016-06-09 15:53,[6월 9일]아시아경제 오늘의 한줄뉴스,"[코스피마감] 코스피, 선물·옵션 동시만기일 경계감 …소폭 하락[말] 朴대통령 한마디에 카카오 대기업서 제외[사건] 檢, 국민의당 김수민 '불법 정치자금 의혹' 압수수색[인물] SNS 달인 정용진의 건배제의 …이번엔 '소주' [숫자] '반포 위에 개포' …3.3㎡당 아파트값 4330만원 전국 1위[행사] 이틀 앞으로 다가온 퀴어축제 …갈수록 심해지는 갈등[장면] 한은 기준금리 전격 인하 …1.5%→1.25% [만화] 끗발 시즌1 165화"
아시아경제,127710,/news/news_read.nhn?article_id=0003771453&office_id=277&mode=search&query=아시아경제&page=1,2016-06-21 15:21,[6월 21일]아시아경제 오늘의 한줄뉴스,"[코스피마감] 코스피, 장 막판 개인 순매수 유입으로 1980선 이틀째 지켜[말] 진보정당 찾은 정진행 ""정의당, 잘하면 우군이 될 수 있겠다""[사건] ""北 미사일 발사준비 징후 …日 자위대 요격준비 돌입""[인물] 롯데사태 비자금 의혹 정점엔 롯데·김우중 커넥션?[숫자] 수출, 6월 중순까지 12.8%↓ …18개월 연속 마이너스 유력[행사] 영남권 신공항 백지화 …""김해공항 확장""[장면] 본회의장에서 만난 유승민·서청원[만화] 탁류 102화"
전자신문,127710,/news/news_read.nhn?article_id=0002732657&office_id=030&mode=search&query=아시아경제&page=1,2018-08-13 14:45,[ET투자뉴스][팍스넷 지분 변동] (주)아시아경제 외 2명 -15.63%p 감소...,"팍스넷(038160)은 13일 최대주주 (주)아시아경제를  비롯한 특별관계자의 보유주식이 감소되었다고 발표했다. 이는 직전 보고일보다 1,730,945주 감소하여 지분율은 15%로 하락했다. 이번 보고 사유는 장외처분으로  알려졌다.   최대주주와 특수관계자의 지분 변동은 주가에 영향을 주는 요인이다. 특히 보유비율을 지속적으로 늘리거나 줄일 경우, 해당종목 투자시 유의할 필요가 있다.  다음은 팍스넷의 지분 변동 내역과 보유 내역이다."
아시아경제,127710,/news/news_read.nhn?article_id=0003587757&office_id=277&mode=search&query=아시아경제&page=1,2015-09-18 15:29,[9월 18일]아시아경제 오늘의 한줄뉴스,[코스피 마감]
아시아경제,127710,/news/news_read.nhn?article_id=0003763836&office_id=277&mode=search&query=아시아경제&page=1,2016-06-09 18:26,"아시아경제 자회사 팍스넷, 코스닥 상장예비심사 통과","[아시아경제 박선미 기자]아시아경제(대표 이세정) 자회사 팍스넷이 9일 코스닥 상장예비심사를 통과했다. 팍스넷은 지난 4월 한국거래소에 상장예비심사를 청구했으며, 심사 결과 이날 거래소로부터 '승인' 통보를 받았다.  팍스넷은 이번 코스닥 상장예비심사 통과를 계기로 공모 절차를 본격화할 계획이다. 하반기 중 코스닥 시장에 상장해 매매를 시작한다는 목표다. 상장 주관사는 한국투자증권이 맡고 있다. 팍스넷은 650만 회원을 보유한 국내 최대 종합 증권·금융 포탈로 인터넷 트래픽 평가기관인 랭키닷컴이 선정한 '슈퍼 웹사이트 23'에 이름을 올렸다. 금융솔루션 사업, 증권정보 사업, 광고 사업을 주요 사업으로 영위하고 있으며 높은 브랜드 이미지를 바탕으로 차별화된 증권 콘텐츠 제공과 함께 안정적인 수익을 창출하고 있다. 또한 온라인 전문 경제 매체인 모회사 아시아경제, 증권·재테크 전문 TV 매체인 아시아경제티브이, 연예·스포츠 전문 온라인 미디어인 티브이데일리, 스투닷컴 등 계열사 간의 시너지를 통한 활발한 콘텐츠·네트워크 교류로 그 역량을 강화해 나가고 있다. 2013년 아시아경제에 편입된 팍스넷은 지난해 별도기준 매출액 206억원, 영업이익 46억원, 당기순이익 36억원의 실적을 기록했다."
아시아경제,127710,/news/news_read.nhn?article_id=0004294816&office_id=277&mode=search&query=아시아경제&page=1,2018-08-13 17:59,"아시아경제, 팍스넷 주식 247억원어치 양도 &quot;유동성 확보 목적&quot;","아시아경제는 회사의 주요 주주인 인터넷 서비스 업체 팍스넷의 주식 166만여 주를 247억원에 이호정·김진만에게 양도하기로 결정했다고 13일 공시했다. 이는 지난해 말 연결기준 자기자본의 22.72%에 해당한다. 회사 측은 ""사업 확대를 위한 유동성 확보""라고 설명했다."
파이낸셜뉴스,127710,/news/news_read.nhn?article_id=0004074846&office_id=014&mode=search&query=아시아경제&page=1,2018-08-13 18:18,"[공시]아시아경제, 팍스넷 주식 247억어치 양도 결정",아시아경제는 회사의 주요 주주인 인터넷 서비스업체 팍스넷의 주식 166만여주를 247억원에 이호정·김진만에게 양도하기로 결정했다고 13일 공시했다. 지난해 말 연결기준 자기자본의 22.72%에 해당한다.
머니투데이,127710,/news/news_read.nhn?article_id=0004088734&office_id=008&mode=search&query=아시아경제&page=1,2018-08-07 18:22,"아시아경제, 팍스넷 주식 169.6만주 양도 결정",[머니투데이 박상빈 기자] 아시아경제는 사업 확대를 위한 유동성 확보를 목적으로 보유했던 팍스넷 주식 169만6068주를 253억원에 피엑스엔홀딩스에 양도하기로 결정했다고 7일 공시했다. 양도 후 지분율은 15.00%로 낮아진다. 양도예정일자는 오는 14일이다.
이데일리,127710,/news/news_read.nhn?article_id=0004167028&office_id=018&mode=search&query=아시아경제&page=1,2018-08-07 18:34,"아시아경제, 팍스넷 지분 일부 매각",[이데일리 최정희 기자] 아시아경제(127710)는 팍스넷(038160) 주식 169만6068주를 253억원에 피엑스엔홀딩스에 매각키로 했다고 7일 공시했다. 매각 후 보유 지분은 15%로 감소한다. 이에 따라 팍스넷의 최대주주는 아시아경제에서 피엑스엔홀딩스로 변경된다.
매일경제,127710,/news/news_read.nhn?article_id=0003754580&office_id=009&mode=search&query=아시아경제&page=1,2016-06-22 17:24,아시아법경제학회 24&middot;25일,"아시아법경제학회 국제 학술대회가 24~25일 양일간 서울대 법학전문대학원에서 열린다. 법경제학은 제도로서의 법을 연구하는 학문 분야로 이번 학회에서는 비상시 헌법, 정보공개 정책, 재산권 등을 다루는 것을 필두로 26개 세션에서 다양한 경제제도 문제가 논의될 예정이다. 20여 개국이 넘는 국가 연구자들이 참여하는 아시아법경제학회는 2005년 서울 창립총회 이후 12년 만에 서울에서 다시 국제학술대회를 열게 됐다. 한국법경제학회와 서울대 아시아태평양법연구소가 주최한다. 참가 문의는 서울대 법과경제연구센터(02) 880-9094 [정의현 기자] r_start //"
연합뉴스,127710,/news/news_read.nhn?article_id=0008486569&office_id=001&mode=search&query=아시아경제&page=1,2016-06-21 13:40,&quot;브렉시트 이뤄져도 아시아 경제엔 영향 적어&hellip;홍콩은 타격&quot;,"ECB, 브렉시트 대비 전략 논의…장기 대책 고민 (서울=연합뉴스) 김윤구 기자 = 영국이 유럽연합(EU)을 탈퇴하더라도 아시아 경제에 미치는 영향은 적을 것이라고 캐피털이코노믹스가 전망했다. 21일 블룸버그에 따르면 리서치업체 캐피털이코노믹스는 보고서에서 브렉시트가 실제 이뤄지더라도 아시아 전체의 국내총생산(GDP)에 미치는 영향은 0.2% 감소에 그칠 것이라고 예상했다. 이는 최악의 시나리오를 가정한 것이다. 다만 영국의 수입(輸入)은 2년 안에 세계적으로 25% 감소할 것으로 예상했다. 캐피털이코노믹스가 아시아가 받는 영향이 적은 것으로 전망한 이유로 아시아 국가 GDP에서 영국으로의 수출이 차지하는 비중이 0.7%에 불과하는 점을 들었다. 캐피털이코노믹스의 이코노미스트 대니얼 마틴은 아시아에서 눈에 띄는 영향이 있을 나라는 소수라고 말했다. 영국과 무역관계가 돈독한 홍콩이 대표적이며 캄보디아와 베트남도 포함된다. 그는 ""상품 수출 외에도 홍콩의 대(對) 영국 서비스 수출은 GDP의 2.3%를 차지한다""고 설명했다. 아시아 최대 경제국인 중국은 브렉시트의 타격을 크게 받지 않을 것으로 분석됐다. 중국 GDP에서 대 영국 수출의 비중은 0.5% 수준이다. 캐피털이코노믹스의 료우창은 별도 보고서에서 브렉시트 이후 글로벌 금융시장이 요동치더라도 중국은 잘 견뎌낼 것으로 봤다. 그는 ""중국의 자본계정이 폐쇄적이고 중국과 다른 나라의 금융 연결고리도 제한적이기 때문""이라고 설명했다. 한편 유럽중앙은행(ECB)은 이날 '포스트-브렉시트 전략'을 논의한다고 파이낸셜타임스(FT)가 보도했다. ECB는 단기적으로는 브렉시트에 대응할 수 있지만, 장기적인 대책을 걱정하고 있다고 FT는 전했다. 영국의 브렉시트 국민투표를 이틀 앞두고 거물 투자자들은 앞다퉈 우려를 표명하고 있다. 홍콩의 최고 부자로 영국에 대규모 투자를 한 리카싱 CK 허치슨 홀딩스 회장은 블룸버그 TV 인터뷰에서 ""브렉시트가 일어나면 영국에 피해가 가고 유럽 전역에도 부정적 영향이 있을 것""이라고 말했다. 억만장자 투자자 조지 소로스는 가디언 기고에서 영국이 EU를 탈퇴하면 파운드화 가치가 15% 이상 폭락할 것이라고 경고했다. 기업들도 브렉시트를 우려하고 있다. 도요타자동차는 이날 직원들에게 보낸 편지에서 브렉시트로 4천명이 일하는 영국 내 공장의 일자리가 줄어들 수 있다고 시사했다. 이 회사는 영국이 EU를 떠나면 10%의 관세 부담이 생겨 강한 비용 절감 압박을 받게 될 것이라고 강조했다. 영국자동차공업협회는 성명에서 브렉시트 반대를 표명했다. BMW와 도요타, GM, 복스홀 등이 EU 잔류 지지에 동참했다."
아시아경제,127710,/news/news_read.nhn?article_id=0004296535&office_id=277&mode=search&query=아시아경제&page=1,2018-08-16 13:24,"아시아경제TV, '24시간 인공지능 무료 종목상담' 서비스 실시","이미지출처=아시아경제TV 방송캡처 [아시아경제 임철영 기자] 쌍방향 재테크를 선도해 온 아시아경제TV가 이번에는 ‘24시간 무료 종목상담 서비스’를 제공한다. 유안타증권의 인공지능 종목분석시스템인 ‘티레이더’를 통해 내 종목진단을 24시간 무료로 확인할 수 있는 이번 서비스는 투자자들의 종목진단갈증을 해소하기 위해  양사간 업무제휴를 통해 이뤄졌다. 티레이더는 유안타증권이 개발한 빅데이터 알고리즘 분석으로 차트와 수급, 실적 등 주가에 영향을 주는 가장 큰 요소들을 다각적으로 분석해낸 시스템으로 종목의 상태를 날씨로 표현하여 한 눈에 종목분석결과를 확인할 수 있다. 인공지능 종목상담서비스를 기획한 아시아경제TV는 ""방송 프로그램을 통한 종목상담은 제한된 시간에 투자자를 상담하기에는 한계가 있어,  개인투자자들이 기다림 없이 24시간 언제든지 무료로 묻고 실시간으로 종목진단을 확인할 수 있는 쌍방향 서비스를 기획했다""고 밝혔다. 아시아경제TV 채널을 통해 24시간 무료로 진행되는 인공지능 종목상담은 무료ARS 1666-3180으로 종목명을 보내면 TV화면을 통해 분석결과를 직접 확인할 수 있다. 현재 1만 명이 참여하여 종목의 궁금증을 해소하였으며 앞으로 새로운 방식의 종목상담을 준비하고 시청자를 기다리고 있다."
아시아경제,127710,/news/news_read.nhn?article_id=0003588473&office_id=277&mode=search&query=아시아경제&page=1,2015-09-21 06:55,[9월 21일]아시아경제 뉴스브리핑,"◆9월 21일 월요일 주요경제지 1면 기사 *매경 ‘사교육 1번지’ 대치동 탈세 정조준 科學立國의 민낯 “아는 과학자 없다” 농어촌 지역구 최대 10석 줄듯 당정청 “노동개혁 5대법안 연내 마무리” “저가수주 조선사 지원 끊을 것” 日 안보법 통과하자마자 “자위대 해외임무 확대"" *한경 삼성라이온즈도 다저스처럼 …’홀로서기 실험’ 추석대목 활기 “3년만에 최고” 화교 중국 큰손들 ‘한국 부동산’에 꽂혔다 “금융완화로 저성장 탈피 못한다” 다음카카오 ‘CXO팀 집단경영' *서경 ‘SPP조선’ 내달초 M&A 매물로 중소조선사 구조조정 속도 낸다 추석시장 훈풍 기업수요가 소비절벽 막았다 부사관 이하 전 장병에 1박2일 특별휴가 통신 공공요금 잘내면 신용등급 상향 *머투 “은행, 분기말 충당금 충분히 쌓아라” [사진]북적이는 시장 광주 청약경쟁률 116대1 실수요보다 투자 수요만 추석준비 마음 급한데 …쉽게 열지 못하는 지갑 *파뉴 [사진]靑 강아지 이름, 평화 통일 금강 한라 백두 “소재시장 이끌 中인재 직접 데려오겠다” 공공요금 잘내면 신용등급 올라간다 朴대통령, 全장병에 1박2일 특별휴가증 ""남북 화해무드 노동개혁이 한국 신용등급 상향 요인” 韓, 사회보럼 국민부담 증가속도 OECD 최고 ◆주요이슈 *"
아시아경제,127710,/news/news_read.nhn?article_id=0004300369&office_id=277&mode=search&query=아시아경제&page=1,2018-08-22 15:28,"아시아경제TV, 블록체인 서바이벌 TV프로그램 론칭","[아시아경제 조호윤 기자]아시아경제TV가 블록체인 서바이벌 TV 프로그램을 론칭한다.  아시아경제TV는 오는 10월19일에 블록체인 서바이벌 프로그램 '블록배틀'을 첫 방영한다고 22일 밝혔다. 총 5회 방송으로 구성됐으며, 최종 우승팀을 가려내는 방식이다. 첫 방송은 아시아경제TV를 통해 국내는 물론, 중국, 호주, 태국, 말레이시아, 대만, 싱가포, 베트남, 홍콩 등에 동시 방영된다. 온라인 채널인 유튜브 코인캐스트를 통해서도 생방송될 예정이다 방송 기간동안 실시간 시청자 투표도 이뤄진다. 오는 11월19일 마지막 방송일에는 생방송으로 진행되는 현장 투표 결과가 반영된다. 최종 5개팀에게는 다양한 혜택이 주어진다. 참가 대상은 백서를 가진 전 세계 블록체인 프로젝트다. 참 가 신청은 다음달 5일까지 공식 홈페이지 '넥스트사토시닷컴'에서 가능하다.  참가 신청을 완료한 프로젝트들은 기본적인 기술 검증을 통해 예선을 거치게 되며, 사전 심사위원단의 개별 심사도 있다.  예선 심사위원에는 ▲한국블록체인산업협회 ▲오픈블록체인산업협회 ▲한국블록체인협회 ▲한국블록체인스타트업협회 등 국내 대표 블록체인 협회와 ▲고려대학교 ▲동국대학교 등 학계 관계자 및 ▲토큰뱅크 ▲비트맨 ▲머니넷 ▲땡글 등 대형 가상화폐(암호화폐) 커뮤니티 대표들이 나선다. 총 10개팀이 본선에 진출하며, 팀별 프리젠테이션, 1대1 및 랜덤 배틀 등을 거친다. 10개팀은 ▲기술 ▲비즈니스 모델 ▲법률 ▲홍보마케팅 ▲투자 분야 등에 대해 국내외 전문가들의 멘토링을 받을 수 있다. 심사위원에는 비트코인닷컴(Bitcoin.com)의 로저 버(Roger Ver), 지비아이씨(GBIC)의 이신혜, 알케미스트 벤처스(Alchemist Ventures)의 데이미안 윌리암스(Damian Williams), 한국블록체인협회의 전하진 위원장, 힐스톤파트너스의 황라열 등이 나설 예정이다. 또 글로벌 암호화폐 거래소인 후오비 코리아(Huobi Korea)와 오케이코인 코리아(OK Coin Korea)도 함께 한다."
디지털타임스,127710,/news/news_read.nhn?article_id=0002480084&office_id=029&mode=search&query=아시아경제&page=1,2018-08-31 09:51,"코스닥협회, 중국아시아경제발전협회와 간담회 개최","[디지털타임스 김동욱 기자] 코스닥협회는 30일 중국아시아경제발전협회 중소기업위원회 천쥔 회장이 협회를 방문해 코스닥기업의 중국 진출 관련 두 기관의 상호협력 방안에 대해 논의했다고 밝혔다. 이 자리에서 코스닥협회 송윤진 상근부회장은 ""한국과 중국간 오랜 교류의 역사와 양국의 사회·문화적 유사성, 지리적 이점으로 코스닥기업이 가장 많이 진출한 나라가 중국""이라며 ""한·중 경제교류가 지속적으로 발전할 수 있도록 두 기관 간 상호협력을 강화해 코스닥기업의 중국 진출 협력방안을 모색해보자""고 말했다. 송윤진 코스닥협회 상근부회장(사진 왼쪽에서 세 번째)과 천쥔 중국아시아경제발전협회 상무부회장 겸 중소기업위원회 회장(사진 왼쪽에서 네 번째)이 30일 코스닥협회에서 만나 두 기관의 상호협력 방안을 논의했다. (사진=코스닥협회 제공)     이에 대해 천쥔 중국아시아경제발전협회 상무부회장 겸 중소기업위원회 회장은 ""중국아시아경제발전협회는 중국 외교부에 등록된 전국 1급 사단법인으로 아시아 지역 기업간 협력 활동 지원에 있어 정부에 버금가는 역량을 가지고 있다""고 강조하고 ""코스닥기업과 중국아시아경제발전협회 회원사 간 교류 활성화를 위해 적극 노력하자""고 밝혔다. 중국아시아경제발전협회는 1993년 설립해 5000여 회원사를 두고 있으며, 아시아 48개 국가 및 전 세계 여러 나라와 경제교류, 협력을 추진하는 경제단체로 자리매김하고 있다. 한편, 코스닥협회는 중국아시아경제발전협회와 2013년 중국 북경에서 개최된 한·중 성장기업가 교류포럼을 시작으로 2016년 중일한 경제무역협력포럼 및 중일한 헬스양로산업 포럼까지 교류행사를 이어왔다."
매일경제,127710,/news/news_read.nhn?article_id=0003751770&office_id=009&mode=search&query=아시아경제&page=1,2016-06-17 15:56,[코스닥 공시] 아시아경제 / 엠에스오토텍 / CS,"◇아시아경제=종속회사 팍스넷 보통주 285만여 주 일반공모방식 유상증자 결정. 액면가 주당 500원. ◇엠에스오토텍=계열사 명신에 114억원 규모 채무보증 결정. ◇CS=이홍배 외 특수관계인 2명에서 트러스트아이비1조합 외 특수관계인 3명으로 최대주주 변경. r_start // r_end // [ⓒ 매일경제 & mk.co.kr, 무단전재 및 재배포 금지] 매일경제 관련뉴스해당 언론사에서 선정하며 언론사 페이지(아웃링크)로 이동해 볼 수 있습니다.'성폭행 혐의' 박유천이 갔던 유흥업소 직접 가보니…국방부 ""김정은 자살폭탄 사망설 사실 아니다""박유천 '은퇴 배수진'에도…성폭행 관련 3번째 피소뉴욕의 7가지 스킨톤 속옷 'One Nude? So Rude'전효성, 풍만한 볼륨…환상적 비키니 자태 '男心 흔들'"
아시아경제,127710,/news/news_read.nhn?article_id=0003768548&office_id=277&mode=search&query=아시아경제&page=1,2016-06-16 15:40,[6월 16일]아시아경제 오늘의 한줄뉴스,"[코스피마감] 코스피, 1950선으로 '털썩' …브렉시트 우려·엔고 심화[말] 정세균, 직권상정 ""주저하지 않아""·특권 ""대폭 수술"" [사건] 롯데 캐는 검찰, '기업 살리는 수사' 시험대[인물] 홍기택 ""나는 들러리였다"" …낙하산의 비극 혹은 희극[숫자] '금리인하에' 서울 아파트 매매가 0.09% 올라 …'올들어 최고'[행사] [재계, 호봉제 폐지] LG이노텍, 생산직 전체에 성과급제 도입[장면]  북한 어선활동 증가로 NLL 긴장 고조 …해군 고강도 기동훈련[만화] 꽃미남 라이브 흥신소 70화 아시아경제 관련뉴스해당 언론사에서 선정하며 언론사 페이지(아웃링크)로 이동해 볼 수 있습니다.[긴급]박유천 피해여성 또 등장…장소는[속보]'미스롯데 출신' 신격호 셋째부인의 과거박유천 성폭행 피해여성, CCTV 속 황당행동'인기 폭발' 첫 누드식당, 女종업원들 실제로…신안군 여교사 성폭행 사건 주민들의 대반전"
머니S,127710,/news/news_read.nhn?article_id=0000338675&office_id=417&mode=search&query=아시아경제&page=1,2018-08-30 13:31,"코스닥협회, 중국아시아경제발전협회와 협력방안 간담회 개최","송윤진 코스닥협회 상근부회장(사진 왼쪽에서 세 번째)과 천쥔 중국아시아경제발전협회 상무부회장 겸 중소기업위원회 회장(사진 왼쪽에서 네 번째)이 30일 코스닥협회에서 만나 두 기관의 상호협력 방안을 논의했다./사진=코스닥협회 제공 천쥔 중국아시아경제발전협회 중소기업위원회 회장이 30일 오전 코스닥협회를 방문해 코스닥기업의 중국 진출 관련 두 기관의 상호협력 방안에 대해 논의했다. 이 자리에서 송윤진 코스닥협회 상근부회장은 “중국은 한국과 오랜 교류와 양국의 사회·문화적 유사성, 지리적 이점으로 코스닥기업이 가장 많이 진출한 나라”라며 “한·중 경제교류가 지속적으로 발전할 수 있도록 두 기관 간 상호협력을 강화해 코스닥기업의 중국 진출 협력방안을 모색해보자”고 말했다. 이에 대해 천쥔 중국아시아경제발전협회 상무부회장 겸 중소기업위원회 회장은 “중국아시아경제발전협회는 중국 외교부에 등록된 전국 1급 사단법인으로 아시아 지역 기업간 협력 활동 지원에 있어 정부에 버금가는 역량을 가지고 있다”고 강조하며 “코스닥기업과 중국아시아경제발전협회 회원사 간 교류 활성화를 위해 적극 노력하자”고 밝혔다. 중국아시아경제발전협회는 1993년 설립돼 5000여 회원사를 두고 있으며 아시아 48개 국가 및 전 세계 여러 나라와 경제교류·협력을 추진하는 경제단체로 자리매김하고 있다. 한편 코스닥협회는 중국아시아경제발전협회와 2013년 중국 북경에서 개최된 한·중 성장기업가 교류포럼을 시작으로 2016년 중일한 경제무역협력포럼 및 중일한 헬스양로산업 포럼까지 교류행사를 이어왔다. 박기영 기자"
데일리안,127710,/news/news_read.nhn?article_id=0002138394&office_id=119&mode=search&query=아시아경제&page=1,2016-06-20 17:10,[부고]이현우(아시아경제 기자)씨 부친상,"▲이순철 前KBS1라디오국PD 별세, 박경희 前KBS아나운서실장 남편상, 미아 한국경제신문기자·현우 아시아경제기자 부친상, 안광록 근로복지공단정보화본부과장 장인상=20일 오전 9시30분 서울대병원 장례식장 2호실 발인 22일 02-2072-2020. 데일리안 데스크 기자 ⓒ (주)데일리안 - 무단전재, 변형, 무단배포 금지"
