source,symbol,link,date,title,content
아시아경제,127710,/news/news_read.nhn?article_id=0003801098&office_id=277&mode=search&query=아시아경제&page=1,2016-08-03 16:17,[8월 3일]아시아경제 오늘의 한줄뉴스,"[코스피마감] 外人 매도세 급전환에 코스피 2000선 밑에서 마감[말] 이화여대 ""미래라이프대학 설립 백지화"" …평생교육 단과대학, 출발부터 삐걱?[사건] 北, 탄도미사일 발사해 日 EEZ 첫 낙하 … 추가도발 가능성은[인물] 靑 ""朴대통령-TK의원 면담, 與전대 상관없어""[숫자] [빚더미 한국, 질이 더 문제]가계 ·기업 부채 1년만에 200조 ↑[행사] 2野, 공수처법 쟁점 최종합의 …'김영란법 위반' 포함[장면] [여행만리]풍덩, 이 맛에 빠지다 …계곡 트레킹[만화] 멜랑꼴리 5257화 스트레스 제로"
이데일리,127710,/news/news_read.nhn?article_id=0003355675&office_id=018&mode=search&query=아시아경제&page=1,2015-09-25 11:34,"유재훈 예탁결제원 사장, '유로아시아 경제포럼' 참석","[이데일리 박기주 기자] 한국예탁결제원은 유재훈 사장이 지난 23일부터 25일까지 중국 서안에서 개최되는 ‘유로아시아 경제포럼 2015(Euro-Asia Economic Forum 2015)’에 참가했다고 25일 밝혔다. 이번 포럼은 아시아 역내 인프라 투자은행 AIIB의 본격적 투자가 예상되는 내년에 앞서, 역내 인접국들간의 금융협력과 상호간의 자본시장 개방에 대한 심도 있는 논의를 위해 진행됐다. 유재훈 사장은 포럼 마지막 날인 25일 ‘위안화 국제화를 매개로 한 아시아 자본시장 통합’이라는 제목으로 주제발표를 실시했다. 유 사장은 주제발표를 통해 아시아 역내 채권시장과 펀드시장 그리고  Repo시장의 통합 관련 주요 움직임과 그 필요성, 그리고 중국의 RMB(위안화) 국제화에 따른 자본시장이 아시아 증권시장에 미치는 영향에 대해 설명했다. 한편 유재훈 사장은 일대일로(一帶一路)사업을 관장하는 서안 시함국가개발 구역 내 펑동신성관리위원회 진홍도 주임과의 접견을 통해 일대일로(一帶一路)사업 추진 관련 상호 관심사를 나누고, 중국 금융법학회 부회장 겸 서북정법대학 경제법학대학원장인 강력 교수와도 접견했다."
아시아경제,127710,/news/news_read.nhn?article_id=0003801912&office_id=277&mode=search&query=아시아경제&page=1,2016-08-04 16:05,[8월 4일]아시아경제 오늘의 한줄뉴스,"[코스피마감] 코스피, 하루 만에 2000선 회복 …개인 ·외국인 매수세 유입[말] 朴대통령 ""사드 배치, 성주군 추천 새로운 지역도 검토""[사건] [단독]정부, '천황폐하 만세 삼창' 이정호 센터장에 중징계처분 요구 [인물] [단독] 킹메이커들의 귀환 …최경환, 김무성, 서청원 전대 앞두고 속속 여의도로[숫자] 개포주공3단지 분양가 3.3㎡당 4137만원으로 낮춰[행사] [단독]폭스바겐, 딜러사 지원안 확정 … ""이탈 잡겠다""[장면] 펄펄 끓는 도심 아스팔트[만화] 아이스께끼 520화"
아시아경제,127710,/news/news_read.nhn?article_id=0003748431&office_id=277&mode=search&query=아시아경제&page=1,2016-05-17 15:25,[5월 17일]아시아경제 오늘의 한줄뉴스,"[코스피마감] 외국인+기관 동반 '팔자' …코스피 이틀째 강보합 마감[말] 전국위 무산 …김용태 ""그들에게 꿇지 않겠다 혁신위원장 사퇴""[사건] ‘가습기 살균제’ 판 대형 유통사, 檢 하청업자 때리기[인물] 5·18 논란중심 ‘박승춘 보훈처장’ … 5·18 당시 뭐했나[숫자] [벼랑끝 조선의 민낯②]40척 중 33척 …선박 수주 ‘中 싹쓸이’ [행사] S7·G5, 지원금 올리고 5월 폰시장 2R[장면] 가습기 피해자·시민단체 ""김앤장, 스스로 진실을 밝혀라""[만화] 불멸의 게임 284화"
한국경제TV,127710,/news/news_read.nhn?article_id=0000604554&office_id=215&mode=search&query=아시아경제&page=1,2018-02-21 12:46,"아시아경제, 5거래일 연속 상승... 전일 대비 2% 상승","[한국경제TV 라이온봇 기자] 아시아경제는 현재 5거래일 연속 상승세를 기록하고 있어 주목할 만하다. 아시아경제는 2월 21일 12시 45분 전일 대비 약 2% 상승한 3,120원에 거래되고 있다. 아시아경제는 코스닥 상장 기업으로 디지털컨텐츠 업종에 속해 있다. 시가총액은 773억원으로 코스닥 상장기업 중 771위에 위치 해 있다. [종목 성향 진단] [그림 1] 종목 성향 진단 아시아경제의 투자 스타일은 가치주에 가깝다. 기업 가치 대비 낮은 주가가 매력적인 기업이다. 주가 모멘텀은 부진한 편이었다. 최근 1개월 수익률은 -8.23%의 하락폭을 기록했다. 아시아경제 종목에 대한 투자자의 관심도는 상대적으로 낮은 편이었다. [투자 점수 진단] [그림 2] 투자 점수 진단 아시아경제는 안정성(부채비율) 측면에서 두각을 나타내고 있다. 최근 부채비율은 83점으로 6개의 핵심 팩터 중 가장 높은 점수를 기록했다. 부채비율은  전체 시장 내 371위를 기록하며 상위 17.39%에 위치했다. 업종별로는 71위를 기록하며 상위 15.44%에 위치했다. 그리고 수익성(영업이익률) 역시 도드라지는 편이다. 수익성 점수는 79점으로 두번째로 높은 점수를 기록했다. 영업이익률은 전체 시장 내 416위를 기록하며 상위 21.27%에 위치했다. 업종별로는 62위를 기록하며 상위 15.44%에 위치했다. 그러나 매출증가율(YoY)이 아쉬움을 나타냈다. [종합 투자점수] [그림 3] 종합 투자점수 AI 인공지능 분석을 통한 아시아경제의 종목 종합 스코어는 65점을 기록했다. 이는 동일 업종 평균점수인 52점과 시장 평균점수인 57점를 상회하는 수치였다. (위의 AI인공지능 점수는 재무 데이터를 기반으로 전체 상장 종목과 비교/분석하여 도출한 점수로 높은 점수가 반드시 높은 수익률을 보장하지 않습니다. 위의 자료는 당사의 추천 종목이 아니며, 투자 시 참고용으로 제시해드리는 것입니다.) 라이온봇 기자 -한국경제TV※ 본 기사는 한국경제TV와 '거장들의 투자공식이'자체 개발한 '라이온봇 기자'가 실시간으로 작성한 기사입니다. 라이온봇기자 ⓒ 한국경제TV, 무단 전재 및 재배포 금지 한국경제TV 관련뉴스해당 언론사에서 선정하며 언론사 페이지(아웃링크)로 이동해 볼 수 있습니다.고속도로 교통상황 아직 원활, 인천공항 출국장은 '북적'홍진영 근황, 물오른 미모…""30대 몸매 비결은""박지헌만의 성교육 ""야동 보는 게 나쁜 거 아냐""김수희 누구?…서태지 제치고 가요대상 받은 전설윤정수 다이어트, '홀쭉해진' 비결은?"
아시아경제,127710,/news/news_read.nhn?article_id=0003802640&office_id=277&mode=search&query=아시아경제&page=1,2016-08-05 16:21,[8월 5일]아시아경제 오늘의 한줄뉴스,"[코스피마감] 코스피, 英 경기부양책 조치 발표 …2010선↑[말] 靑 ""새 후보지 검토는 '조사 결과 상세히 알려주겠다'는 뜻""[사건] 檢, 대우조선 부사장 전격소환 …1200억원 분식회계[인물] 이재현 CJ 회장, 벌금 252억 일시불 납부 …""치료가 최우선""[숫자] [단독]저유가 ·저물가에 …할당관세 5년새 84% 감소[행사] 더민주 예비경선 정견발표, ""秋 ·李 ·金 ·宋, 대선 승리 당대표 적임자는 나""[장면] 폭염 속 삼보일배, 간절한 염원을 담아 …[만화] 날 동정마세요 3화"
아시아경제,127710,/news/news_read.nhn?article_id=0003748538&office_id=277&mode=search&query=아시아경제&page=1,2016-05-17 16:50,아시아경제TV '건전 NPL&middot;경매 아카데미' 3기 개강!,"유암코와 아시아경제TV가 오는 6월 7일(화)부터 6월30일(목)까지 '건전 NPL·경매 아카데미' 3기 교육을 진행한다. 자산건전성 확보를 위한 국내 은행의 부실채권 매각이 활발해지면서 저금리시대 안정적인 투자처로‘NPL(부실채권)’이 떠오르고 있다. NPL(부실채권)은 부동산을 담보로 채무자가 은행으로부터 3개월 이상 연체해 정상적으로 상환되지 않고 있는 대출채권을 뜻한다. 기업이나 개인에게 돈을 빌려준 금융기관이 NPL을 회계상 손실로 처리해 매각하는데, 이 때 근저당권을 직접 매입하여 경매를 통해 매각대금에서 배당을 받거나 근저당권을 활용해 일반투자자들에 비해 유리하게 낙찰 받는 방식으로 수익을 올릴 수 있다. 최근에는 NPL 시장을 경험해보지 않았거나 경매를 배우지 않은 일반인들도 NPL에 많은 관심을 보이고 있다. 하지만 '정보 부족'으로 관련 투자에 실패하는 경우가 많다. 이에 재테크 투자의 길잡이 역할을 하고 있는 아시아경제TV가 제3기 '건전한 NPL·경매 아카데미'를 연다.총 8회, 24시간 과정으로 진행되는 '건전한 NPL·경매 아카데미'는 경매 초·중급자와 새로운 투자 대안을 통해 투자고수를 꿈꾸는 사람들을 대상으로 한다. '건전한 NPLㆍ경매 아카데미' 1강에서는 'NPL 기본개념'을, 2~3강에서는 법원 경매 기본과 입찰과 이전,인도절차를,4강에서는 일반권리분석, 5강에서는 유치권,법정지상권,분묘기지권 등 특수권리분석과 NPL권리분석, 6강에서는 경매 배당ㆍ수익분석, NPL 배당ㆍ수익분석을, 7강에서는 NPL 매각과 거래시 유의사항을 공부한다. 마지막 8강에서는 NPL 계약실무와 사례분석 등에 대해 배운다. 이번 아카데미에서는 NPL 선도기업 유암코의 자산관리본부 내부강사를 비롯해 서울중앙지방법원 집행관을 역임하고 현 대한법무사협회 법제연구소 소장으로 재직중인 안갑준 소장, 한국부동산자산관리사 전문위원이자 '경매야 놀자’저자인 강은현 소장이 알찬 강의를 제공할 계획이다. 자세한 내용은 아시아경제TV 홈페이지를 참고하면 된다."
아시아경제,127710,/news/news_read.nhn?article_id=0004183073&office_id=277&mode=search&query=아시아경제&page=1,2018-02-20 15:58,"아시아경제TV, 경제채널 시청률 1위","[아시아경제 임혜선 기자] 종합 재테크 채널인 아시아경제TV가 경제채널 가운데 최고 시청률을 기록했다. 20일 전국 멀티미디어 통합 조사(TNMS)에 따르면 지난 15일 아시아경제TV는 0.037%(케이블 아날로그 ·전국유료 방송가입가구 기준)로 경제채널 가운데 1위를 기록했다. 인터넷TV(IPTV)기준으로도 2위를 차지했다. 전체 시청률 기준으로 보면 경제채널 중 전체 상위 3위권에 올랐다. 특히 새벽 4시 '부동산 고수비급' 시간대 시청률은  1%에 가깝게 나왔다. '부동산 고수비급'은 부동산 이슈와 함께 투자자의 고민을 해결해주는 프로그램이다. 아시아경제TV는 오늘의 코인과 코인넘버원, 톡톡 코인365, 코인119, 코인인터뷰 등 블록체인과 관련한 다양한 프로그램을 진행 중이다. '최진기의 경제 톡톡', '종목 토크 NOW', '똑똑TV 건강상담', '부동산 고민 해결반' 등 쌍방향 종합 제테크 프로그램들을 내놓고 있다."
아시아경제,127710,/news/news_read.nhn?article_id=0004183195&office_id=277&mode=search&query=아시아경제&page=1,2018-02-20 18:00,아시아경제 오늘의 뉴스 - 종합 Top10,"2018년 02월 20일 가장 많이 본 기사는 김혜민 기자가 쓴 홍준표 ""MB 뇌물 받고 이건희 사면? 실소 금할 수 없어""입니다. 다음은 오후 6시 기준 오늘의 뉴스 - 종합 Top10 입니다. [이미지출처=연합뉴스] 1위"
아시아경제,127710,/news/news_read.nhn?article_id=0003747623&office_id=277&mode=search&query=아시아경제&page=1,2016-05-16 15:22,[5월 16일]아시아경제 오늘의 한줄뉴스,"[코스피마감] 코스피, 외국인만 '사자' …1960선에서 강보합권 마감[말] 朴정부 추가 인적쇄신 없을듯 …""이대로 끝까지 간다"" [사건] 보훈처, '임을 위한 행진곡' 합창 유지[인물] 김종인 ""靑인사 보면, 총선 패배에도 정부·여당 인신 변화 안보여""[숫자] 아파트 5채 중 1채, 전셋값이 4년전 집값보다 비싸[행사] 세계4위 부호 알왈리드 사우디 왕자, 17년만의 방한[장면] 전통성년례에 임하는 97년생 '웃음 가득'[만화] 아이스께끼 486화"
아시아경제,127710,/news/news_read.nhn?article_id=0003580161&office_id=277&mode=search&query=아시아경제&page=1,2015-09-09 06:41,[9월 9일]아시아경제 뉴스브리핑,"◆9월 9일 수요일 주요경제지 1면 기사 *매경 국감 증인채택에 사업포기 첫 사례 국가채무비율 첫 40% [사진]3년 더 …주먹 불끈 쥔 장기집권 아베 포시즌스호텔 들어올때 팔리는 리츠칼튼호텔 1년8개월만에 이산상봉 재개 *한경 '전세>매매價 아파트' 서울서도 나왔다 車산업 임금 상승 '세계 최고' 기업 구조조정·사업재편도 '국회 눈치' 봐야하는 나라 다음달 20~26일 이산가족 상봉 나라빚 '위험수위' 40% 넘어선다 *서경 곳간 바닥에 …'균형·확대 절충 예산' 선택 재계 연말 '인사 태풍' 몰아친다 3T 코리아 세계를 홀리다 中 보유외환 한달새 939억弗 급감 남북 이산가족 상봉 합의 …내달 20~26일 금강산서 *머투 '감원 NO' 보장 받고도 …조선 勞는 ""파업"" 내달 20~26일 이산가족 상봉 '상위 10%' 소득, '하위 10%' 56배 '삼색' 시리아 …한국의 난민문제 '색깔'은 내년 예산 3% 늘린 387조 …GDP대비 국가부채 첫 40%대 진입할 듯 *파뉴 후발업체가 또 베껴갈라 …가전 선두주자의 남모를 고민 [사진]야당대표 첫 전경련 방문 朴정부 4년차 예산, 일자리·복지에 집중 이산가족 상봉 내달 20~26일 금융위기 악몽의 주범 서브프라임 모기지 부활? ◆주요이슈 *"
아시아경제,127710,/news/news_read.nhn?article_id=0003746238&office_id=277&mode=search&query=아시아경제&page=1,2016-05-13 15:28,[5월 13일]아시아경제 오늘의 한줄뉴스,"[코스피마감] 코스피, 3거래일째 하락 …외인·기관 동반 '팔자'[말] 정의화 ""아직 화가 안 풀렸다"" …與 복당 안할듯 [사건] '대부도 토막살인' 조성호 검찰 송치 …'계획 범행' 결론[인물] 정용진의 발빠른 1등 작전 …""혼밥시장 선점""[숫자] 갤럽 ""朴대통령 지지율 지난주 비해 1%p 떨어진 32%""[행사] 朴·여야 오늘 회동 …靑 ""국민에 희망주는 의제 기대""[장면] 북한, 中실크로드 박람회 이례적 참가 …왜?[만화] 끗발 시즌1 142화"
아시아경제,127710,/news/news_read.nhn?article_id=0003701619&office_id=277&mode=search&query=아시아경제&page=1,2016-03-07 15:18,[3월 7일]아시아경제 오늘의 한줄뉴스,"[코스피마감] 코스피, 외국인 '사자' 나서며 상승 …1957.87 마감[말] 김한길 ""집권세력 개헌 확보 저지 위해 통합적 국민 저항 체제 필요""[사건] 7일 韓·美연합훈련 …北 ""총공세 진입할 것""[인물] '2전 2패' …롯데그룹 長子의 비극[숫자] 실버쇼퍼 전성시대 …""100歲까지 뭐하고 놀지?"" [행사] 알파고vs이세돌 D-2 …이세돌에 도전한 '알파고'의 저력은[장면] 복원된 소중한 국보 '귀걸이'  [만화] 아이스께끼 456화"
아시아경제,127710,/news/news_read.nhn?article_id=0003769323&office_id=277&mode=search&query=아시아경제&page=1,2016-06-17 15:25,[6월 17일]아시아경제 오늘의 한줄뉴스,"[코스피마감] 코스피, 7거래일만에 상승했지만 …1950선 머물러[말] 朴 ""김밥 한줄이 만원? 불친절·바가지가 관광객 쫓아내""[사건] 김병원 농협중앙회장 압수수색 …농협 ""당혹""[인물] 서청원 ""비대위 복당 결정 따라야 …여론수렴 과정은 아쉬워""[숫자] 대우조선 분식회계 1조5000억 …+α 있다[행사] '리베이트 의혹' 국민의당, 지지율 15% …총선 이후 최저[장면] '멍때리기 아닙니다. 배꼽 명상중입니다'[만화] 탁류 100화 아시아경제 관련뉴스해당 언론사에서 선정하며 언론사 페이지(아웃링크)로 이동해 볼 수 있습니다.[속보]""박유천 피해여성 만난 조폭의 첫마디가…""[속보]'이부진 폭로' 임우재, 정말 큰일났다'미스롯데 출신' 신격호 셋째부인의 과거'인기 폭발' 첫 누드식당, 女종업원들 실제로…박유천 성폭행 피해여성, CCTV 속 황당행동"
아시아경제,127710,/news/news_read.nhn?article_id=0003687267&office_id=277&mode=search&query=아시아경제&page=1,2016-02-15 16:30,[사고] 아시아경제TV '건전 NPL&middot;경매 아카데미' 2기 개강!,"[아시아경제TV]유암코와 아시아경제TV가 오는 3월 9일(수)부터 4월1일(금)까지 '건전 NPL·경매 아카데미' 2기 교육을 진행합니다. 저금리 시대, 부실채권(NPL) 투자가 재테크 수단으로 새롭게 주목받고 있습니다. 지난해 NPL선도기업 유암코와 아시아경제TV는 NPL 투자자들의 뜨거운 관심으로 제1기 '건전한 NPL·경매 아카데미'를 성황리에 마쳤습니다. 이번 2기 교육에서는 유암코 자산관리본부 사내강사진이 NPL에 대해 강의하고, 서울중앙지방법원 집행관을 역임하고 현 대한법무사협회 법제연구소 소장으로 재직중인 안갑준 소장, 한국부동산자산관리사 전문위원이자 '경매야 놀자' 저자인 강은현 소장이 1기에 이어 강사로 나섭니다. 수업은 오후 7시부터 10시까지 진행하며, 모집정원은 선착순 50명 입니다. NPL에 관심있는 투자자들의 많은 참여 바랍니다. 자세한 내용은 고객센터(02-2638-3903~5)로 문의주시면 됩니다. ◆일시 : 2016년 3월 9일(수) ~ 4월 1일(금) 오후 7시~10시 ◆장소 : 서울 중구 서소문동 유암코 5층 강당 ◆비용 : 70만원 (선착순 30명에 한하여 50만원) ◆정원 : 50명 ◆문의 : 아시아경제 TV (02)2638-3903~5"
아시아경제,127710,/news/news_read.nhn?article_id=0003951957&office_id=277&mode=search&query=아시아경제&page=1,2017-03-13 15:48,[3월 13일]아시아경제 오늘의 한줄뉴스,"[코스피마감] 코스피, 외국인 4500억원대 순매수로 2110선 탈환[말] ""진실은 밝혀진다"" 朴 메시지 담긴 뜻 해석 '분분'[사건] 탄핵 인용 수혜품 …선고일에 태어난 '탄돌이' G6[인물] [대선주자 공약검증]'안희정의 대연정' 시대 명령인가, 대선용 쇼인가[숫자] 현대엔지니어링 이란서 3.8조원 …역대 최대 플랜트 공사 수주[행사] 바빠진 대선달력, 오늘부터 黨 예선 점화[장면] 경호 받으며 떠나는 이정미 대행[만화] 불의나라 153화"
파이낸셜뉴스,127710,/news/news_read.nhn?article_id=0003762966&office_id=014&mode=search&query=아시아경제&page=1,2017-01-16 09:08,[fnRASSI]아시아경제 전일대비 5.71% 상승,"현재 아시아경제(127710)는 전일대비 5.71% 상승하여 5,180원 선에서 거래가 이루어지고 있다.  외국인 보유량 증가, 기관 감소 (5일 누적)최근 5일간 동종목의 외국인 투자자는 15,744주 매수하였고 반면 기관은 50,000주 매도하였다. 전날 두 주체 각각 61,472주, 50,000주 순매도하며 보유 비율을 줄였다.다음 표는 동종목의 외국인, 기관의 일별 순매수량을 나타낸 것이다.  주요 투자주체는 개인투자자최근 한달간 주체별 거래비중을 살펴보면 개인이 87.04%로 가장 높은 참여율을 보였고, 기관이 7.13%를 보였으며 외국인은 5.81%를 나타냈다. 그리고 최근 5일간 거래비중은 개인 비중이 86.36%로 가장 높았고, 기관이 8.12%로 그 뒤를 이었다. 외국인은 5.51%를 나타냈다.  
 'fnRASSI'는 증권전문 기업 씽크풀과 파이낸셜뉴스의 협업으로 로봇기자가 실시간으로 생산하는 기사입니다."
파이낸셜뉴스,127710,/news/news_read.nhn?article_id=0003747031&office_id=014&mode=search&query=아시아경제&page=1,2016-12-12 14:57,[fnRASSI]아시아경제(127710) 전일대비 7.07% 상승,"아시아경제(127710)는 현재 주가가 전일 대비 7.07% 상승한 4,015원 선에서 거래가 이루어지고 있다.  주가등락폭은 다소 큰 편최근 한달간 아시아경제의 상장주식수 대비 거래량을 비교해보니 일별 매매회전율이 1.02%로 집계됐다. 동기간 일평균 주가변동률은 7.75%로 장중 저점과 고점의 차이가 매우 컸음을 알 수 있다.  외국인은 순매도, 개인은 순매수(한달누적) 전일 외국인이 15,729주를 순매수했다. 4주간을 기준으로 보면 개관이 순매수량을 늘리며 46,796주를 순매수했지만, 외국인은 매도 우위를 지속하면서 46,796주를 순매도했다. 기관의 순매수량에는 변함이 없다.  
 'fnRASSI'는 증권전문 기업 씽크풀과 파이낸셜뉴스의 협업으로 로봇기자가 실시간으로 생산하는 기사입니다."
아시아경제,127710,/news/news_read.nhn?article_id=0003939399&office_id=277&mode=search&query=아시아경제&page=1,2017-02-23 16:06,[2월 23일]아시아경제 오늘의 한줄뉴스,"[코스피마감] 코스피, 외인 순매수 지속에 강보합 마감 …코스닥은 620선 붕괴[말] 특검, 본격재판 앞두고 골머리 …""인력 ·예산 줄어 공소유지 걱정""[사건] 김정남 암살 북한 첫 반응 … 의도는[인물] '장고에 장고' 김종인, '대권 도전' 해석할 수 있는 미묘한 발언[숫자] 씀씀이 커진 요우커 …국내서 8.3조 썼다 …전년比 46%[행사] [2월 금통위]한은, 기준금리 8개월째 연1.25% 동결[장면] '태극기는 온 국민들의 것'[만화] 아이스께끼 - 607화 늑대인간"
아시아경제,127710,/news/news_read.nhn?article_id=0003890866&office_id=277&mode=search&query=아시아경제&page=1,2016-12-12 16:44,[12월 12일]아시아경제 오늘의 한줄뉴스,"[코스피마감] 코스피, 기관 ·외인 매수에 소폭 상승 마감 …'탄핵 쇼크 없어'[말] 헌재 ""탄핵사유 전부심리 원칙 …준비절차로 속도 높일것""[사건] 문화예술계, '블랙리스트' 의혹 김기춘-조윤선 등 특검 고발[인물] [단독]국회 청문회가 우습나 …고영태 ·장시호 또 위증 논란[숫자] 7주간 760만명 …꺼지지 않은 촛불, 이제 헌재 앞으로[행사] 여야 15~31일 임시국회 개최 …29일 본회의[장면] 2017 대입정시 합격전략 설명회[만화] 아이스께끼-576화 봉숙아"
뉴시스,127710,/news/news_read.nhn?article_id=0008116149&office_id=003&mode=search&query=아시아경제&page=1,2017-08-11 08:48,"아시아경제, &quot;팍스넷 지분매각 검토 중&quot;","【서울=뉴시스】김경원 기자 = 아시아경제(127710)는 11일 ""팍스넷 지분매각과 관련해 검토를 진행 중""이라며 ""다만 구체적으로 확정된 사항은 없다""고 조회공시에 답했다."
아시아경제,127710,/news/news_read.nhn?article_id=0003687183&office_id=277&mode=search&query=아시아경제&page=1,2016-02-15 15:37,[2월 15일]아시아경제 오늘의 한줄뉴스,"[코스피마감] 코스피 1860 회복 …유가 급등 + 日 증시 강한 반등 호재[말] 문재인 겨냥한 김무성 ""대북포용, 착각과 망상에서 벗어나주길""  [사건] 춘천 육군 헬기 추락 …탑승자 3명 치료 중 사망[인물] 원유철 ""평화의 핵·미사일 보유해야"" 핵무장론 재차 주장[숫자] '갤노트5 페이백 40만원' …다시 고개든 불법 보조금[행사] 與野, 선거구 획정 또 불발 …쟁점법안 연계 '네탓 공방'[장면] 무용학도의 우아한 졸업식 [만화] 불멸의 게임 222화"
이데일리,127710,/news/news_read.nhn?article_id=0003895599&office_id=018&mode=search&query=아시아경제&page=1,2017-08-11 08:44,아시아경제 &ldquo;팍스넷 지분 매각 검토 중&rdquo;,[이데일리 윤필호 기자] 아시아경제(127710)는 11일 팍스넷(038160) 지분 매각 추진설에 대해 “검토를 진행 중이지만 구체적으로 확정된 사항이 없다”고 밝혔다.
