source,symbol,link,date,title,content
아시아경제,127710,/news/news_read.nhn?article_id=0003846259&office_id=277&mode=search&query=아시아경제&page=1,2016-10-12 16:05,[10월 12일]아시아경제 오늘의 한줄뉴스,"[코스피마감] 코스피, 기관의 힘 …갤노트7 악재 딛고 2030선 탈환[사건] 檢, ‘공천개입’ 최경환 ·윤상현 ·현기환 모두 무혐의[말] 巨野, 禹수석 출석 총공세 …""패스트트랙 만지작""[인물] 국감 나온 이승철 ""미르 ·K재단, 수사 중이라 답변 어렵다"" 반복[숫자] 청년실업률 '9.4%' 또 역대 최고 …'고용 악순환' 심화[행사] '갤럭시노트7' 산 50만명 어디로? …가입자 쟁탈전 시작됐다[장면] [여행만리]밤바다 물러나면 황금 다랑논 …가을이 출렁[만화] 탁류-183화"
아시아경제,127710,/news/news_read.nhn?article_id=0003727674&office_id=277&mode=search&query=아시아경제&page=1,2016-04-14 15:49,[4월 14일]아시아경제 오늘의 한줄뉴스,"[코스피마감] 코스피, 외국인·기관 동반 대규모 매수에 …34p↑[말] 문재인 ""호남이 저를 버린 것인지 더 겸허히 노력하고 기다리겠다""[사건] 새누리, 12년만에 원내 제1당 자리 빼앗겨 …더민주 최다 의석[인물] 朴리더십 최대고비 …장악력 상실 불가피·스타일 변화는 미지수[숫자] 국민의당 정당투표서 깜짝 '2위' 선전 배경은?[행사] 검찰 ""20대 총선 당선자 98명 수사 중""[장면] 김무성 ""대표직 사퇴하겠습니다"" [만화] 아이스께끼 472화"
머니투데이,127710,/news/news_read.nhn?article_id=0003656226&office_id=008&mode=search&query=아시아경제&page=1,2016-03-30 11:53,아시아 올해 경제성장률 5.7% 전망&hellip;15년만에 최저,"[머니투데이 이보라 기자] [""선진국 경기회복 지연…중국 경제 구조 변화 탓""] 아시아개발은행 본사/사진=블룸버그 올해 아시아 지역의 성장률이 15년 만에 최저치를 기록할 것이라는 전망이 나왔다. 아시아개발은행(ADB)은 30일 발표한 '아시아 경제 전망' 보고서에서 올해 아시아 지역의 성장률이 지난해에 비해 0.2%포인트 하락한 5.7%에 그칠 것으로 전망했다. 2001년(4.9%) 이후 15년 만에 최저치다. 내년 성장률도 5.7%로 예상됐다. ADB는 선진국의 경기 회복이 자연되고 중국이 경제구조개혁에 나선 데 따른 성장둔화 등을 악재로 꼽았다. 미국 연방준비제도이사회(FRB)가 연내 금리 인상 속도를 늦출 것임을 시사하는 등 세계 경제의 미래도 불투명해졌다는 지적이다. 아시아 경제 대국 중국은 최근 수출 중심에서 내수 중심의 경제 구조로 변화하고 있다. 노동 인구의 감소와 임금 상승 등으로 두 자리 성장 시대가 끝났다는 평가를 받고 있다. ADB는 중국의 성장률이 지난해 6.9%에서 올해 6.5%, 내년에는 6.3%로 떨어질 것으로 봤다. 이는 중국 정부가 2020년까지 목표로 삼은 연간 성장률 6.5%를 밑도는 것이다. 이에 따라 아시아 경제는 이제 중국이 아닌 인도가 이끌 것이라는 전망도 나온다. ADB는 인도의 올해 성장률이 7.4%로 지난해(7.6%)에 비해 소폭 낮아질 것으로 봤지만 내년에는 성장률이 7.8%로 반등할 것으로 예상했다. 나렌드라 모디 인도 총리가 추진하는 구조개혁이 국내외에서 투자를 끌어모으고 기반시설 정비를 비롯한 공공사업이 성장의 기폭제가 될 것이라는 전망이다. ADB는 동남아시아도 5% 정도의 성장세를 유지하며 아시아 경제를 뒷받침할 것이라고 봤다. 외부 환경이 어려운 가운데 필리핀은 내수가 탄탄하고 인도네시아는 정부의 재정 지출 확대가 경기를 받쳐주고 있다는 설명이다. 중국의 경기 둔화에 따라 아시아 각국은 독자적인 성장을 요구받고 있다. 인구 13억명의 인도와 6억명 이상의 동남아국가연합(ASEAN)이 잠재력있는 경제권으로 주목받고 있다. ADB의 웨이상진 수석 이코노미스트는 ""생산성 향상 외에도 부족한 인프라 정비에 자원을 투입하는 등의 개혁을 계속 해 잠재된 성장력을 살릴 필요가 있다""고 지적했다. ADB는 또 아시아 국가들이 외국 수출로 인한 성장에는 한계를 느끼고 내수 진작, 생산성 향상 등 경제 개혁을 추구할 것으로 보인다고 분석했다. textlinktopstart textlinktopend"
아시아경제,127710,/news/news_read.nhn?article_id=0003844414&office_id=277&mode=search&query=아시아경제&page=1,2016-10-10 16:14,[10월 10일]아시아경제 오늘의 한줄뉴스,"[코스피마감] ‘돌아온 기관’ …코스피, 장 후반 상승반전 성공[말] [단독]""일단 아무것도 하지마라""...김영란法 대혼란 이유 있었다[사건] 정부, 현대차 '엔진 결함' 논란 조사 착수 …결과 '촉각'[인물] '미르 ·K스포츠 의혹' 중심에 선 허창수 전경련 회장[숫자] ""삼성전자 갤노트7, 4Q 생산 중단 때 기회 손실 비용만 7000억""[행사] ""감옥 갈거야"" ·""자격 없다"" 진흙탕 미 대선 2차 TV 토론 [장면] 화물연대 총파업 돌입 …다가오는 '물류대란'[만화] 탁류-181화"
아시아경제,127710,/news/news_read.nhn?article_id=0003842990&office_id=277&mode=search&query=아시아경제&page=1,2016-10-07 15:59,[10월 7일]아시아경제 오늘의 한줄뉴스,"[코스피마감] 코스피, 너무 올랐나? 숨고르기 …삼성전자 종가 기준 최고치 [말] 與 ""박원순, 살수차 물 공급 중단? 인기영합용 정치쇼"" [사건] 때아닌 '김제동 국감' 논란 …왜? [인물] '제2의 유승민' 김영우 국방위원장 징계받나[숫자] LG전자, 3Q 영업익 2830억 …스마트폰 부진 영향 [행사] 삼성 7.8조 영업익 …리콜 악재 막아낸 '포트폴리오의 힘' [장면] 깊어가는 가을 '금빛 억새 물결'[만화] 탁류-180화"
아시아경제,127710,/news/news_read.nhn?article_id=0004114553&office_id=277&mode=search&query=아시아경제&page=1,2017-11-09 09:30,[2017여성포럼]최영범 아시아경제 대표 &quot;AI시대 여성리더가 이끌 것&quot;,"9일 서울 롯데호텔서 '아시아여성리더스포럼' 개막  최영범 아시아경제 대표 [아시아경제 서소정 기자]""인공지능(AI)시대 여성의 강점을 활용할 수 있는 지능적 리더십이 새롭게 주목받고 있다."" 최영범 아시아경제 대표는 9일 서울 소공동 롯데호텔에서 열린 '2017 아시아여성리더스포럼'에서 ""4차 산업혁명 시대에는 전통적인 리더십과 달리 기술을 수용하고 변화를 포용하는 새로운 여성 리더십이 주목받을 것""이라고 말했다. 올해로 6회째를 맞이한 2017 아시아여성리더스포럼은 ""AI 퍼스트시대, 지능적 리더십으로 주도하라""를 주제로 개최됐다. 최 대표는 ""초연결과 초지능을 특징으로 하는 4차 산업혁명은 기존 산업혁명과 비교할 때 보다 더 넓은 범위에서 더 빠른 속도로 확장된다""며 ""이런 특징은 소통에 강하고 책임을 중시하는 여성 특유의 리더십이 큰 효과를 발휘할 수 있다""고 강조했다. 최 대표는 ""4차 산업혁명 물결 속에서 여성의 리더십은 국가 미래를 설계하는 중요한 한 축이 될 수 있다""며 ""2017 아시아여성리더스포럼은 시대 변화에 능동적으로 대처하는 여성의 리더십을 조명하고 미래 전략을 모색하는 자리가 될 것""이라고 말했다. 아시아여성리더스포럼은 이날 '제2회 여성지수 대상 시상식'도 함께 개최했다. 정형화된 여성지수를 공개해 여성경쟁력 제고에 적극 나서고 있는 기업을 시상했다. 이날 포럼에는 이낙연 국무총리, 심상정 국회의원, 정현백 여성가족부 장관 등이 참석해 축사와 강연을 했다."
아시아경제,127710,/news/news_read.nhn?article_id=0003855358&office_id=277&mode=search&query=아시아경제&page=1,2016-10-25 17:20,[포토]인사말하는 이세정 아시아경제 사장,[아시아경제 윤동주 기자] IBK기업은행과 아시아경제신문이 공동으로 주최한 '2016 창조금융 아이디어 공모전 시상식'이 25일 서울 중구 프레스센터에서 열렸다. 행사에 참석한 이세정 아시아경제 사장이 인사말을 하고 있다.
아시아경제,127710,/news/news_read.nhn?article_id=0003717490&office_id=277&mode=search&query=아시아경제&page=1,2016-03-30 10:21,"아시아경제, 이세정 대표 연임",[아시아경제 박선미 기자]아시아경제는 30일 오전 10시 정기주주총회를 열고 이세정ㆍ윤준학 사내이사의 연임을 결정했다. 이세정 사내이사는 아시아경제 대표이사로 재직 중이며 윤준학 이사는 아시아경제 애드마케팅 본부장을 맡고 있다. 아시아경제는 주총 후 이사회를 열고 이세정 대표의 연임을 결정했다.
아시아경제,127710,/news/news_read.nhn?article_id=0003615857&office_id=277&mode=search&query=아시아경제&page=1,2015-11-02 06:32,[11월 2일]아시아경제 뉴스브리핑,"◆11월 2일 월요일 주요경제지 1면 기사 *매경 5년연속 적자 동부제철 분리매각 추진 ""삼성 LG 돈 엄청 버는데 안보는 공짜로 美에 기대"" [사진]한일중 정상회의 …누구 손 먼저 잡을까 아파트 중도금 대출 조인다 리커창, 中 청두 창업단지 조성 제안 *한경 한중일 '전자 상거래 장벽' 없앤다 자사주 매입 사상최대 연말 주식시장 달군다 수출 '비명' …지난달 15.8% 급감 *서경 한중일 '협력체제 복원' 합의 [사진]손잡은 한중일 러 여객기 이집트서 추락 탑승객 224명 전원 사망 산은, 91개사 지분 매각 …M&A 매물 쏟아진다 *머투 한일중 '3국 FTA 협상' 속도낸다 산업은행 비금융회사 지분정리 대우조선 한국GM 3년내 판다 1000억 규모 폐수장 '新민간투자 드라이브' '새 팬택' 정준 문지욱 공동대표 체제로 *파뉴 한중일 FTA 박차 …동북아 경제통합 가속도 아파트 집단대출 건전성 검사 착수 분양시장에 찬물 산은, 비금융사 91곳 지분 3년간 집중 매각한다 ◆주요이슈 *"
아시아경제,127710,/news/news_read.nhn?article_id=0003726300&office_id=277&mode=search&query=아시아경제&page=1,2016-04-12 15:35,[4월 12일]아시아경제 오늘의 한줄뉴스,"[코스피마감] 코스피 사흘만에 반등 …4·13 총선 전 외국인이 샀다[말] 더민주 ""朴, 여당 찍으라고 협박 …나라 살림 누가 거덜냈나""[사건] 한달에 4000만원? 지나친 수입차 렌트비 법원서 첫 제동[인물] 광고쟁이의 면세사업, 명품 잡으러 날아갔다[숫자] 4·13총선 마지막 변수 '투표율', 60% 넘어설까?[행사] ""나라 위하는 국회 만들어달라"" …朴의 국회심판론[장면] 총선D-1, 대한민국의 선택은? [만화] NEW 까까마까 931화"
데일리안,127710,/news/news_read.nhn?article_id=0002151209&office_id=119&mode=search&query=아시아경제&page=1,2016-10-10 15:30,한-일 경제계 &quot;아시아 지역 경제통합해야&quot;,"허창수 전국경제인연합회 회장(오른쪽에서 두 번째)이 10일 서울 여의도 전경련회관 컨퍼런스센터에서 개최된 '제 26회 한일재계회의'에서 인사말을 하고 있다. 왼쪽부터 쿠보타 마사카즈 경단련 사무총장, 사카키바라 사다유키 경단련 회장, 허 회장, 이승철 전경련 부회장.ⓒ전국경제인연합회 전경련-경단련, 공동성명서 발표...""환경·지진 등 상호협력"" 한국과 일본 양국 경제계가 아시아 지역내 경제통합의 중요성을 재확인하고 자유무역협정(FTA) 체결 등을 통해 상호 협력을 확대해 나가자고 다짐했다. 또 인력교류나 관광·서비스산업에서의 협력과 함께 환경문제 및 자연재해에 대한 공동 대응도 확대해 나가기로 했다. 전국경제인연합회와 경제단체연합회(게이단렌) 대표단은 10일 서울 여의도 전경련 컨퍼런스센터에서 개최된 ‘제 26회 한일 재계회의’에서 이같은 내용을 골자로 한 공동성명서를 채택했다. 양국 대표단은 아시아 지역의 경제통합이 향후 아시아의 성장을 지속하는데 필수적이라면서 한·중·일 자유무역협정(FTA)과 역내 포괄적 경제동반자협정(RCEP) 등의 체결을 위한 양국간 긴밀한 협력이 중요하다고 강조했다. 양측은 향후 성장 및 경쟁력 강화를 위해 상호 산업협력이 필요하다는 인식을 공유하고 관광·서비스산업 및 신성장 미래산업 분야에서 향후 협력 확대 방안에 대한 의견을 교환해 나가기로 했다. 또 지속적인 성장을 뒷받침하는 과학기술과 이노베이션 분야에서 호혜적인 입장에서 협력확대를 위해 노력해 나가기로 했으며 청년 인재 채용과 인턴십 등 인재교류 활성화를 위해서도 상호 협력해 나가기로 했다. 전경련과 경단련은 양국간 상호 협력의 구체적인 방향으로 제 3국 시장에서 실질적 협력을 확대해 나간다는 계획이다. 제 3국 시장에서 한-일 기업간 협력 사례가 증가하고 있는 만큼 보다 구체적인 사례에 대한 정보 공유를 통해 협력 관계를 발전시켜 나가겠다는 것이다. 이러한 출발점으로 상호 정보 공유와 공동진출 지원 제도 기반 등에 대해 이해를 높이기 위해 내년 봄에 관련 세미나를 서울에서 개최하기로 하는데도 합의했다. 허창수 전경련 회장의 제안에 따라 다양한 방안을 모색하자는 데 양국 경제계가 공감대를 형성했다는 후문이다. 이와 함께 글로벌 이슈로 부각되고 있는 환경문제나 자연재해에 대한 대응 등에 대해서도 양국이 상호 협력하고 기여하기로 다짐했다. 지난 4월 일본 구마모토에 이어 지난달 한국 경주에서 발생한 지진 등 자연재해에 대한 공동 대응력도 높여 나갈 계획이다. 더 나아가 경제계 협력이 한-일 양국 관계 발전으로 이어질 수 있도록 기여해 나간다는 계획이다. 경제계 교류를 시작으로 양국 정부 간의 교류가 다양한 형태로 진행돼 정치·외교적으로 안정적인 기반이 구축 될 수 있도록 비즈니스 서밋 개최 등 협력해 나가기로 합의했다. 엄치성 전경련 국제본부장은 이 날 행사 후 브리핑을 통해 역내 경제 통합과 관련 ""우리 측에서 아시아 경제통합을 위한 상임위원회 설치를 제안했다“며 ”상임위를 통해 양국 기업간 활동을 북돋우자는 취지에서 의견을 제시했다“고 말했다. 엄 본부장은 제 3국 공동 진출과 관련해서는 향후 인프라 구축 시장에서 기회가 많을 것으로 보이는 만큼 양국 기업이 공동마케팅과 인적교류 등을 통해 협업해 나가기로 했다고 설명했다. 그는 “일본은 연구개발(R&D) 중에서도 리서치분야에 상당히 강점이 있는 반면 우리는 마케팅에 강점이 있어 상호 윈-윈할 수 있는 구조”라면서 “시너지 효과 창출에 많은 공감대가 형성됐다”고 말했다. 관광산업 활성화 방안과 관련해서는 중국까지 포함, 한·중·일 동북아 3국 관광위원회를 설립하자는 의견도 제시됐다. 또 신사업 글로벌 표준화 활동에도 협력을 강화하기로 했다. 엄 본부장은 ""오는 2018년 평창올림픽과 2020년 도쿄올림픽 등을 대비해 관광마케팅을 위해 공동 노력하자는 제안도 나왔다“면서 ”미국이 주도하고 있는 스마트카와 스마트폰 운영체제(OS) 등의 표준화에도 양국이 공동 협력해야 한다는 의견도 제기됐다“고 밝혔다. 양국은 내년 한일재계회의를 일본 동경에서 개최하기로 합의했다. 한편 이 날 행사에는 한국 측에서 허창수 회장, 조양호 한진그룹  회장, 박삼구 금호아시아나그룹 회장, 김윤 삼양홀딩스 회장, 박영주 이건산업 회장, 류진 풍산 회장, 이장한 종근당 회장 등 경제계 대표인사 18인이 참석했다. 일본 측에서는 사카키바라 경단련 회장, 우치야마다 도요타자동차 회장, 이와사 미쓰이부동산 회장 등 경단련 회장단을 주축으로 19인이 참석했다. 데일리안 이홍석 기자 ⓒ (주)데일리안 - 무단전재, 변형, 무단배포 금지 데일리안 관련뉴스해당 언론사에서 선정하며 언론사 페이지(아웃링크)로 이동해 볼 수 있습니다.허창수 전경련 회장 ""3국 공동진출 실질적 협력 확대 필요""""한-일 경제계, 지진 등 방재분야와 3국 공동진출 협력"""
아시아경제,127710,/news/news_read.nhn?article_id=0004073467&office_id=277&mode=search&query=아시아경제&page=1,2017-09-12 07:34,"아시아경제, 파빌리온PE에 팍스넷 주식 491만주 양도 결정",[아시아경제 임철영 기자]아시아경제는 12일 사업 확대를 위한 유동성 확보를 목적으로 계열사 팍스넷 주식 491만주를 파빌리온프라이빗에쿼티에 양도한다고 밝혔다. 양도금액은 650억원으로 자기자본 대비 77.31% 규모다.
아시아경제,127710,/news/news_read.nhn?article_id=0003716138&office_id=277&mode=search&query=아시아경제&page=1,2016-03-28 15:30,[3월 28일]아시아경제 오늘의 한줄뉴스,"[코스피마감] 코스피, 美 금리인상 가능성에 약보합 …기관 '팔자'[말] 정청래 등 '더컸유세단' 출정 …""더 억울한 국민들 만나겠다""[사건] [세월호 청문회]""정부 발표 AIS 항적 믿기 어려워"" …항적 오류 진위 공방[인물] '4세 경영' 두산家 …‘구조조정·면세안착’ 박정원호 갈길 바쁘다[숫자] 현대증권 인수가격 1조원 갈까[행사] [단독]10년 끌어온 광명지하철 노선 확정[장면] '농성 800일' …박원순 시장도 못 푸는 용산화상경마장 갈등 [만화] 꽃미남 라이브 흥신소 1화"
아시아경제,127710,/news/news_read.nhn?article_id=0003717944&office_id=277&mode=search&query=아시아경제&page=1,2016-03-30 15:34,[3월 30일]아시아경제 오늘의 한줄뉴스,"[코스피마감] 코스피, 올들어 첫 2000선 안착 …옐런과 삼성의 힘[말] ""여왕의 시대냐""ㆍ""안희정 대권"" …문재인 유세 눈길[사건] 北 추가 핵실험땐 백두산 분화로 '대재앙'?[인물] 김무성 ""공천갈등 책임 …총선 후 대표사퇴""[숫자] 상병월급 22만6100원까지 오른다[행사] 총선 선거운동 내일 본격 시작 …'홍보 현수막 게시 가능'[장면] 봄마중하는 샛노란 개나리 [만화] 꽃미남 라이브 흥신소 3화"
아시아경제,127710,/news/news_read.nhn?article_id=0003847796&office_id=277&mode=search&query=아시아경제&page=1,2016-10-14 15:49,[10월 14일]아시아경제 오늘의 한줄뉴스,"[코스피마감] 코스피, 외국인 '사자'에 2020선 탈환[말] 한민구 국방장관 ""김제동씨가 영창 갔다는 증언 ·자료는 없다""[사건] '강남역 살인' 1심서 징역 30년 · · ·""남성공포에 약자로 눈돌려""[인물] 2016년 차은택과 70년대 차지철,두 VIP심복 의외의 공통점은[숫자] 단종 갤럭시노트7으로 삼성 7조 손실[행사] [與野 예산전쟁 시동]""법인 세수 증감, 기업 실적에 좌우""[장면] 주말부터 가을에 흠뻑 물든다 …오대산 내일 ·설악산 17일 단풍 절정[만화] 탁류 185화"
아시아경제,127710,/news/news_read.nhn?article_id=0003855265&office_id=277&mode=search&query=아시아경제&page=1,2016-10-25 15:57,[10월 25일]아시아경제 오늘의 한줄뉴스,"[코스피마감] 코스피, 하루만에 2040선 '털썩' …삼성물산 한 때 시총 2위[말] 정치권, 최순실 '쇼크'에 경악 …""특검이든 국정조사든 뭐든 하자""[사건] 신동빈의 '반성문' …'뉴롯데' 경영철학을 바꾸다[인물] 비선의 딸 정유라와 황태자 이강석 … 충격의 '닮은꼴'[숫자] 3분기 성장률 0.7%, 낙관만 하기 어려운 이유[행사] 신형 그랜저 출격, 차명 빼곤 다 바꿨다 …명품세단의 재탄생[장면] 당혹스런 표정의 이정현 대표[만화] 탁류 192화"
아시아경제,127710,/news/news_read.nhn?article_id=0003831367&office_id=277&mode=search&query=아시아경제&page=1,2016-09-21 16:03,[9월 21일]아시아경제 오늘의 한줄뉴스,"[코스피마감] 코스피, 4거래일 연속 상승 …2030선 회복[말] 추미애 ""朴대통령, 무능한 지진대응 즉각 사과해야""[사건] 두 번째로 큰 3.5규모 여진 …""불안하고 무섭다""[인물] 朴의 직설 통치 …경주지진 ·한진해운 난맥상 풀릴까[숫자] 400만원 받으면 674만원 내야 …카드깡 주의보[행사] 美 전략폭격기 B-1B, 오산기지 착륙[장면] [여행만리]해발 850m 청정림, 風浴에 빠지다[만화] 끗발 시즌1 - 254화"
아시아경제,127710,/news/news_read.nhn?article_id=0003854423&office_id=277&mode=search&query=아시아경제&page=1,2016-10-24 16:19,[10월 24일]아시아경제 오늘의 한줄뉴스,"[코스피마감] 코스피, 외인 ·기관 매수에 상승 마감[말] 정진석 ""北 어떻게 믿나 …문재인 찌질한 거짓말 하지 말라""[사건] 檢, ‘文 내통발언’ 이정현 형사부가 수사[인물] '이재용 삼성' 어떤 모습?[숫자] ""노트7 교환하면 S8 ·노트8 반값"" 삼성 추가대책, 80% 소비자 응답할까[행사] 中공산당 6중전회 오늘 개막 …'시진핑 핵심' 여부가 핵심[장면] 영장 시한 D-1 …유족 ·시민 ""밤샘 농성"" vs 경찰 ""고민 중""[만화] 아이스께끼 555화-혼자서"
아시아경제,127710,/news/news_read.nhn?article_id=0003721800&office_id=277&mode=search&query=아시아경제&page=1,2016-04-05 14:51,[사고]아시아경제&middot;아시아경제TV '2016대한민국 기업경영대상' 공모,"아시아경제와 아시아경제TV가 공동주최하는 '2016 대한민국 기업 경영대상'을 공모합니다. 올해로 2회째를 맞는 대한민국 기업 경영대상은 끊임없는 변화와 창조적 기술 개발로 국내 및 글로벌 경쟁에서 성과를 창출하여 국가경제 발전에 큰 힘이 되고 있는 기업을 선정해 노고를 치하하고, 대한민국 경제발전을 도모하기 위해 마련되었습니다. 급변하는 시대에 탁월한 전략을 통해 각 산업 및 글로벌 시장에서 성장 발전하는 국가대표 기업들과 최고경영자 및 ‘기업하기 좋은 도시’를 만들어가고 있는 지방자치단체를 선정하는 이번 행사는 창조경영, 창의혁신, 고용창출, 노사협력, 품질경영, 고객만족, 글로벌 경영, 사회공헌, 지속가능, 동반성장, 환경친화, 최고 경영자(CEO) 등의 부문으로 시상하며, 전문가의 공정한 심사를 통해 수상 기업을 선정합니다. 본 행사에 참여를 희망하는 기업은 오는 5월 11일까지 운영사무국을 통해 접수하실 수 있습니다. 대한민국을 넘어 글로벌 경쟁시대에 최고를 꿈꾸는 기업, 지방자치단체, 최고경영자들의 많은 관심과 참여를 바랍니다. ■ 시상부문 - 기업체 부문 (창의혁신, 고용창출, 노사협력, 품질경영, 고객만족, 글로벌 경영, 사회공헌, 지속가능, 동반성장, 환경친화) - 지방자치제 부문 (기업하기 좋은 도시, 환경친화도시, 가족친화도시) - 최고경영자 부문 ■ 접수기간 - 참가신청서 접수 : 2016년 5월 11일까지 ■ 시상 및 발표 - 일시 : 2016년 5월 19일(목), 오전11시~오후 1시 - 장소 : 한국프레스센터(20F) ■ 참가신청 및 문의 - 운영사무국 : 02.2128.0721 - 주 최 : 아시아경제, 아시아경제tv - 주 관 : 아시아경영연구원, 대한민국 기업경영대상 운영위원회"
