source,symbol,link,date,title,content
아시아경제,127710,/news/news_read.nhn?article_id=0004030998&office_id=277&mode=search&query=아시아경제&page=1,2017-07-10 13:19,[사고]제 8회 아시아경제 직장인밴드대회,"▲제7회 아시아경제 직장인밴드대회 국내 최대 직장인밴드 경연대회인 '제8회 아시아경제 직장인 밴드대회'가 오는 8월 17일 여의도 물빛무대에서 개최됩니다. 이 행사는 직장인들의 동료애와 애사심을 극대화하는 등 건설적이고 창조적인 조직문화를 제고하기 위한 화합의 무대입니다. 또한 '음악'이라는 공통된 코드를 통해 건전한 경쟁을 도모하자는 취지에서 마련됐습니다.  많은 참여와 관심 바랍니다. *일시 : 2017년 8월 17일(목) /17:00~20:00 *장소 : 서울 여의도 물빛무대(구 플로팅 스테이지) *규모 : 국내 기업 및 단체의 직장인 밴드동호회 회원/ 약 10팀 참가 *주최 : 아시아경제, 스포츠투데이 *후원 : 고용노동부 *문의 : 아시아경제 행사 담당자 02-2200-2158 운영사무국 : 1833-8981"
아시아경제,127710,/news/news_read.nhn?article_id=0004052788&office_id=277&mode=search&query=아시아경제&page=1,2017-08-10 17:28,"거래소, 아시아경제에 팍스넷 지분 매각 관련 조회공시 요구",한국거래소는 아시아경제에 팍스넷 지분 매각 추진과 관련한 조회공시를 요구했다고 10일 밝혔다. 답변시한은 11일 오후 12시까지다.
아시아경제,127710,/news/news_read.nhn?article_id=0003897366&office_id=277&mode=search&query=아시아경제&page=1,2016-12-21 16:36,[12월 21일]아시아경제 오늘의 한줄뉴스,"[코스피마감] 힘 빠진 코스피, 2040 밑에서 하락마감[말] 안희정 ""정당이 뭐가 중요하냐는 반기문, 정치 기웃 거리지 말라""[사건] 반기문 ""국민이 원한다면 한 몸 불사르겠다"" 대권도전 강력 시사[인물] '신사업 전략가' 조대식 수펙스 의장 …혁신 승부수 [숫자] 고개드는 수출 …2년2개월만에 '2개월 연속' 증가세 전망[행사] 한미 '확장억제협의체' 첫 가동 …美전략무기 상시배치 협의 [장면] 현판식 갖는 최순실 국정농단 특검[만화] 불의나라 98화"
아시아경제,127710,/news/news_read.nhn?article_id=0003682149&office_id=277&mode=search&query=아시아경제&page=1,2016-02-04 15:44,[2월 4일]아시아경제 오늘의 한줄뉴스,"[코스피마감] 코스피, 유갇환율 덕에 …1910선 안착[말] 北김정은 ""하나같이 움직이는 혁명적 군풍을 세워야 한다""[사건] 안동서 군용훈련기 비상착륙 …조종사 2명 무사[인물] 루키 이준석의 安리장성 공략 …달아오르는 노원병[숫자] 朴대통령 지지율 40%초반으로 …정당 지지율 변화는[행사] 아시아 주식시장에서 콘돔 투자 열기 '후끈'[장면] 지카 바이러스 공포에도 …설 연휴 앞드고 북적이는 공항 [만화] 끗발 57화"
아시아경제,127710,/news/news_read.nhn?article_id=0003911015&office_id=277&mode=search&query=아시아경제&page=1,2017-01-12 16:06,[1월 12일]아시아경제 오늘의 한줄뉴스,"[코스피마감] 코스피, 2080 위로 껑충 …外人 12거래일 연속 순매수[말] 靑관계자 ""이제는 헌재서 치열한 법리싸움해야"" …탄핵대응 바뀌나[사건] 이영선, 대통령에 유리한 진술은 ‘술술’ 불리하면 “경호상 비밀”[인물] ""국민께 송구"" 이재용, 특검 '포토라인' 그 이후 …[숫자] 흔들리는 '강남불패' … 강남 3구 집값 9주 연속 하락[행사] 반기문 귀국, 野 대선판도 흔드나[장면] 첫 기자회견 갖는 트럼프 …""내게 질문해봐""[만화] 아이스께끼-589화 순수"
아시아경제,127710,/news/news_read.nhn?article_id=0003647238&office_id=277&mode=search&query=아시아경제&page=1,2015-12-15 15:49,[12월 15일]아시아경제 오늘의 한줄뉴스,"[코스피마감] 코스피, 기관 매수세에 1930선 회복 …外인은 여전히 '팔자'[말] 靑 ""선거법보다 경제·테러法 더 중요"" …국회의장에 직권상정 요청[인물]  안철수의 '구인광고' …3가지 조건은?[사건] 이재현 회장 실형에 CJ '침울' …그룹 경영 '먹구름'[숫자] 10년간 공대졸업생 26만명 부족 …인문사회계열 53만명 과잉[행사] 예비후보 등록 시작 …막 오른 총선 전쟁 '예고된 혼란'[장면] 등 돌린 김무성·문재인[만화] NEW 까까마까 881화"
아시아경제,127710,/news/news_read.nhn?article_id=0003667505&office_id=277&mode=search&query=아시아경제&page=1,2016-01-15 15:20,[1월 15일]아시아경제 오늘의 한줄뉴스,"[코스피마감] 코스피, 외국인 2700억 매도 폭탄에 1880선마저 붕괴[말] 이노근 ""김종인, 인간의 모습 아니야""[사건] 조석래 효성 회장 실형 …법정구속은 면해[인물]문재인 더민주 대표, 차기 대선후보 1위[숫자] ""연봉 7000만원 이상 50만명, 연말정산 추가 납부 많을 듯""[행사] 삼성그룹, 20만 임직원 모바일로 연결[장면] 두 경제수장의 첫 만남 [만화] 인범 48화"
아시아경제,127710,/news/news_read.nhn?article_id=0003941844&office_id=277&mode=search&query=아시아경제&page=1,2017-02-27 15:58,[2월 27일]아시아경제 오늘의 한줄뉴스,"[코스피마감] 코스피, '외인 매도' 늘며 2080선 후퇴[말] ""朴측이 녹음 ·녹화 거부"" …특검, 대면조사 무산 유감 토로 [사건] 특검 연장 무산 …野3당, 황교안 탄핵 추진키로[인물] ""조사 받겠다""더니 … 검찰 ·특검 ·헌재 모습 안드러낸 朴[숫자] 가입은 쉽게, 요금은 싸게 …알뜰폰 800만 진격[행사] [삼성 비상체제]'미전실 해체' '계열사 독립' 혁신안 조만간 발표[장면] 헌법재판소 앞 아수라장 [만화] 아이스께끼 - 609화 친구의 신혼일기"
아시아경제,127710,/news/news_read.nhn?article_id=0003650493&office_id=277&mode=search&query=아시아경제&page=1,2015-12-21 06:52,[12월 21일]아시아경제 뉴스브리핑,"◆12월 21일 월요일 주요경제지 1면 기사 *매경 서울시민의 발 밑이 심상찮다 55세이상 세금 안 내고 퇴직·개인연금 갈아타 꼬리표 달린 韓신용등급 상향 [사진]脫朴 vs 新朴 '서초갑 혈투' '응답없는' 한국 과학기술 *한경 구조개혁 경고음이 더 크게 들리는 '최고 신용등급' 개인·퇴직연금 투자 주식·채권 비중 늘린다 2016년 경영 키워드 ""혁신 압박"" '서비스 좋은 수입차' 렉서스 1위 …벤츠 추월 경찰 '현장 검거 원칙' 폭력시위자 확 줄였다 [사진]중국 공안도 스모그 마스크 *서경 국가신용 최고 …'축배' 들때 아니다 롤러코스터 탄 글로벌 금융시장 사적연금, 주식·펀드 비중 높인다 ""칭다오 뱃길 …7시간 후에는 무관세혜택 받아요"" 여야 쟁정법안·선거구 협상 또 결렬 *머니 가스公, 세계최대 이란 가스전 개발 투자 ""북한에 제2 다목적 공단 추진 …17억명 유라시아시장 가교로"" [사진]60년전 세밑 …情있던 그때 그시절 최경환 ""구조개혁 성공 못하면 신용하락"" *파이낸셜 은행 8조 자본확충 발등의 불 …中企 대출회수 압박 거세지나 崔 ""구조개혁 입법 늦어지면 국가신용도 타격"" ""35년만에 열린 기회의 땅 잡아라"" 민관 경제사절단 내달 이란 간다 ◆주요이슈 *"
아시아경제,127710,/news/news_read.nhn?article_id=0003627833&office_id=277&mode=search&query=아시아경제&page=1,2015-11-18 07:24,[11월 18일]아시아경제 뉴스브리핑,"◆11월 18일 수요일 주요경제지 1면 기사 매경 규제철폐 매달려라 …성장 2% 높인다 올랑드 ""IS와 전쟁중"" …IS ""다음 타깃 워싱턴"" 당정, 한중 FTA 26일 처리 한경 ""5년 걸릴 줄 알았는데"" …9개월만에 공장 허가한 여주시 이주열 ""기업활동 자체가 애국"" 서울 경전철 '헛바퀴' 9곳중 1곳만 본궤도 ""美금리인상 전에"" …자금 조달 서두르는 기업들 서경 금융지주 '차기 후계구도' 바로미터 되나 TPP에 치인 RCEP 타결시한 1년 연장 한중 FTA 26일 비준 확실 SK해운 등 3사에 '에코쉽펀드' 1억불 지원 머니 '파견직원 허용' 법안 힘싣는 뿌리산업 용인·김포 등 수도권까지 …은행, 집단대출 거부 확산 '부모와 10년 같이 산 집' 5억 상속 공제 파이낸셜 구조조정 기업 내년까지 10곳 선정 ECB, 경제충격 잇단 경고 …FRB, 금리인상 예정대로 스타우드 품은 메리어트 …세계 호텔 '왕좌' 앉는다 파리테러 반면교사로 …가짜 난민 브로커 잡는다 ◆주요이슈 *"
아시아경제,127710,/news/news_read.nhn?article_id=0003896602&office_id=277&mode=search&query=아시아경제&page=1,2016-12-20 15:50,[12월 20일]아시아경제 오늘의 한줄뉴스,"[코스피마감] 코스피, 외국인vs개인 ·기관 매매공방 치열 …강보합 마감[말] 특검팀 朴대통령 뇌물죄 본격수사 임박 · · ·“모든 준비했다”[사건] 비주류 ""탈당 작업 본격화 하겠다"" …與 분당 초읽기[인물] 새누리당 사분오열 …반기문만 기다리나[숫자] 계란 대란 …후라이값 4배↑, 카스테라 ·계란말이 메뉴서 빠져[행사] 헌재, 탄핵심판 착수 …“첫 준비절차기일 22일 진행”[장면] 연설 중 뒤에서 '총탄' …러시아 대사 총격 전후 보니[만화] NEW까까마까 - 1031화 인디아나걸스 8"
연합뉴스,127710,/news/news_read.nhn?article_id=0009387649&office_id=001&mode=search&query=아시아경제&page=1,2017-07-06 06:00,"아시아 경제단체장 회의, 24&sim;25일 서울 첫 개최","(서울=연합뉴스) 윤보람 기자 = 아시아 주요 경제단체장들이 한자리에 모여 경제계 간 협력과 발전을 모색하는 행사가 한국에서 처음으로 열린다. 전국경제인연합회는 24∼25일 서울 여의도 전경련회관에서 아시아 15개국 19개 경제단체장 등을 초청해 '2017 아시아 비즈니스 서밋'을 개최한다고 6일 밝혔다. 아시아 비즈니스 서밋은 일본 경단련 주도로 결성된 역내 주요국 경제단체 협의체로, 이 회의가 국내에서 열리는 것은 2009년 발족 후 처음이다. 회원국은 한국, 일본, 중국, 인도, 대만, 태국, 베트남, 싱가포르, 말레이시아, 필리핀, 인도네시아, 미얀마 등 12개국이며 브루나이, 캄보디아, 라오스는 참관국 자격을 얻었다. 전경련에 따르면 15개 참가국은 전 세계 인구의 절반이자 국내총생산(GDP)의 3분의 1을 차지해 '세계의 공장이자 시장'으로 불린다. 이 지역은 평균연령이 20대인 '젊은 나라'들이 많고 인도(6.8%), 베트남(6.2%) 등 일부 국가는 경제성장률이 세계 평균(3.1%)을 크게 상회해 생산기지뿐 아니라 소비와 수출시장으로서의 가치가 높아지고 있다. 이번 회의에서는 미국과 유럽연합(EU) 발(發) 보호무역주의 대응, 제조업 선진화, 인프라 공동개발 등 현안뿐 아니라 노령화 사회 대비, 아시아 소프트파워 증진 등 장기 전략과제 등이 논의될 예정이다. 주요 인사로는 허창수 전경련 회장, 사카키바라 사다유키 일본 경단련 회장, 인종화 중국국제무역촉진위원회 부회장, 쇼바라 카미네니 인도산업연맹 회장 등 경제단체장과 박삼구 금호아시아나 회장, 김윤 삼양홀딩스 회장, 야마나시 케니치로 미츠비시전자 회장 등 기업인 총 30여명이 참석한다. [연합뉴스TV 제공, 자료사진]"
아시아경제,127710,/news/news_read.nhn?article_id=0003666811&office_id=277&mode=search&query=아시아경제&page=1,2016-01-14 15:25,[1월 14일]아시아경제 오늘의 한줄뉴스,"[코스피마감] 外人 3700억 매도 폭탄에도 코스피 '1900선' 지켰다[말] '수직적 당청관계' 비판에 대한 朴대통령의 반박[사건] 또다시 불붙은 '송도 매립지 관할권' 분쟁[인물]더불어민주당 선대위원장에 '김종인' 전격 영입[숫자] 국민연금, 12일 만에 3兆 날렸다[행사] 현대차 아이오닉 출시 … ""올해 3만대 팔겠다""[장면] 꽁꽁 추위에 얼어버린 한강 [만화] 아이스께끼 433화"
아시아경제,127710,/news/news_read.nhn?article_id=0003682970&office_id=277&mode=search&query=아시아경제&page=1,2016-02-05 15:35,[2월 5일]아시아경제 오늘의 한줄뉴스,"[코스피마감] 코스피, 설 연휴 앞두고 강보합 마감 …외국인·기관 동반 '매수'[말] 김종인 ""선거구 12일까지는 여야 원만히 합의해야""[사건] [단독]공매도 척결운동, 이젠 상장사까지 나섰다[인물] 檢, ‘김태촌 후계자’ 원정도박 혐의 기소[숫자] 작년 세수 예산 2.2조원 초과 …4년 만에 결손 탈출[행사] 성적표 받아든 5대은행 …신한 독주·KB 선방·하나 멈칫[장면] 고향가는 버스 …마음은 이미 고향 [만화] 탁류 5화"
아시아경제,127710,/news/news_read.nhn?article_id=0003948419&office_id=277&mode=search&query=아시아경제&page=1,2017-03-08 15:55,[3월 8일]아시아경제 오늘의 한줄뉴스,"[코스피마감] 코스피, 외국인 '매수'에 강보합 마감 …통신株 강세[말] 말레이 ""北과 단교 계획없다"" …물밑 협상 예고[사건] 특수본, 정중동 유지하며 朴탄핵심판 결과에 '촉각'[인물] [대선주자 공약검증]시도엔 호평, 각론은 분분 …安 학제개편[숫자] 금호타이어 매각가격 9549억8100만원 확정[행사] 삼성 ·현대차 등 中진출기업들, 中서 대규모 채용박람회 '親中행보'[장면] [여행만리]꽃을 이기는 春景은 없다[만화] 멜랑꼴리 - 5473화 트라우마 극복"
아시아경제,127710,/news/news_read.nhn?article_id=0003895883&office_id=277&mode=search&query=아시아경제&page=1,2016-12-19 15:52,[12월 19일]아시아경제 오늘의 한줄뉴스,"[코스피마감] 코스피, 삼성전자 날았지만 못 넘은 2040의 벽[말] 정우택 ""친박 아바타 ·로봇 아니다"" 했지만 …野 '문전박대'[사건] 서울까지 번진 AI, 의심 조류 살처분 ·철새 도래지 소독 강화[인물] 모든 혐의 쟁점화 전략 …길게 보는 박근혜 대통령[숫자] 서울 관광지도 바뀐다...12조 면세 시장 지각변동[행사] '탄핵정국', 가장 뜨거울 일주일 …19일 첫 재판 시작[장면] 최순실, 날카로운 눈빛 ""공소사실 전부 인정할 수 없다""[만화] [아이스께끼] 579화 곰돌이"
KBS 뉴스,127710,/news/news_read.nhn?article_id=0010251351&office_id=056&mode=search&query=아시아경제&page=1,2015-11-22 13:06,중앙아시아 경제협력 강화&hellip;경제사절단 파견,산업통상자원부는 내일부터 이틀간 중앙아시아에 중소·중견기업 25개사로 이뤄진  경제사절단을 파견해  경제협력 강화 방안을 모색한다고 밝혔습니다. 경제사절단은  우즈베키스탄 타슈켄트에서 비즈니스 상담회를 열고 카자흐스탄 알마티에서  경협 포럼과 협력의 밤 행사 등을 개최합니다. 산업부는 교역 확대 방안 모색과  자유무역협정 공동 연구 등을 통해  서로 이익을 누릴 수 있는 기반을 다지고자  이번 행사를 추진했다고 설명했습니다.
데일리안,127710,/news/news_read.nhn?article_id=0002196126&office_id=119&mode=search&query=아시아경제&page=1,2017-07-06 09:19,"전경련, 아시아경제단체장들과 서울서 첫 회의","전국경제인연합회가 오는 24,25일 서울 여의도 전경련회관에서 '아시아비즈니스 서밋'을 개최한다. 이 회의가 국내서 열리는 것은 2009년 발족 후 처음이다. 사진은 서울 여의도 전국경제인연합회 앞.ⓒ연합뉴스 아시아 주요 경제단체장들이 한자리에 모여 경제계 간 협력과 발전을 모색하는 행사가 한국에서 처음으로 열린다. 전국경제인연합회는 24∼25일 서울 여의도 전경련회관에서 아시아 15개국 19개 경제단체장 등을 초청해 ´2017 아시아 비즈니스 서밋´을 개최한다고 6일 밝혔다. 아시아 비즈니스 서밋은 일본 경단련 주도로 결성된 역내 주요국 경제단체 협의체로, 이 회의가 국내에서 열리는 것은 2009년 발족 후 처음이다. 회원국은 한국, 일본, 중국, 인도, 대만, 태국, 베트남, 싱가포르, 말레이시아, 필리핀, 인도네시아, 미얀마 등 12개국이며 브루나이, 캄보디아, 라오스는 참관국 자격을 얻었다. 전경련에 따르면 15개 참가국은 전 세계 인구의 절반이자 국내총생산(GDP)의 3분의 1을 차지해 ´세계의 공장이자 시장´으로 불린다. 이 지역은 평균연령이 20대인 ´젊은 나라´들이 많고 인도(6.8%), 베트남(6.2%) 등 일부 국가는 경제성장률이 세계 평균(3.1%)을 크게 상회해 생산기지뿐 아니라 소비와 수출시장으로서의 가치가 높아지고 있다. 이번 회의에서는 미국과 유럽연합(EU) 발(發) 보호무역주의 대응, 제조업 선진화, 인프라 공동개발 등 현안뿐 아니라 노령화 사회 대비, 아시아 소프트파워 증진 등 장기 전략과제 등이 논의될 예정이다. 주요 인사로는 허창수 전경련 회장, 사카키바라 사다유키 일본 경단련 회장, 인종화 중국국제무역촉진위원회 부회장, 쇼바라 카미네니 인도산업연맹 회장 등 경제단체장과 박삼구 금호아시아나 회장, 김윤 삼양홀딩스 회장, 야마나시 케니치로 미츠비시전자 회장 등 기업인 총 30여명이 참석한다. 데일리안 이강미 기자 ⓒ (주)데일리안 - 무단전재, 변형, 무단배포 금지"
아시아경제,127710,/news/news_read.nhn?article_id=0003911775&office_id=277&mode=search&query=아시아경제&page=1,2017-01-13 15:58,[1월 13일]아시아경제 오늘의 한줄뉴스,"[코스피마감] 코스피, 하루만에 2080선 반납 …外人 13거래일만에 순매도 전환[말] ""이재용 신병처리 모레까지 결정"" …영장청구 가능성 높아[사건] 유한킴벌리 하기스 물티슈 등 10개 제품서 메탄올 초과 검출 [인물] 반기문 대권행보 재확인 …""朴대통령에게 전화 한 번 할 것""[숫자] 설 성수품 구입비용 25만4000원 …8.1% 올랐다[행사] ""채용 확대하라"" 고용부 장관, 다음주 30대 기업 만난다[장면] [1월 금통위]한은 기준금리 예상대로 동결[만화] 불의나라 - 114화"
아시아경제,127710,/news/news_read.nhn?article_id=0003901713&office_id=277&mode=search&query=아시아경제&page=1,2016-12-28 15:52,[12월 28일] 아시아경제 오늘의 한줄뉴스,"[코스피마감] 코스피, 배당락일 맞아 기관 4000억대 매물폭탄 …2020선까지 밀려[말] 조윤선 ""재벌家 부인들에게 최순실 소개? …결단코 사실 아냐""[사건] 공정위, 'IT공룡' 퀄컴에 사상 최대 1조300억원 과징금 폭탄 [인물] 반기무 ""되도록 빨리 돌아가겠다"" …제3지대로 '반 발짝'[숫자] ""빚내서 집샀다"" 3분기 가계 여윳돈 1.9조 …11년 만에 최저[행사] 내일 최순실 2차 준비기일 …'태블릿PC 공방' 끝날까?[장면] 신비의 울릉도원과 원초적 이끼계곡 …2016 '조용준의 여행만리 톱5' [만화] 불의 나라 102화"
아시아경제,127710,/news/news_read.nhn?article_id=0003603416&office_id=277&mode=search&query=아시아경제&page=1,2015-10-15 06:24,[10월 15일]아시아경제 뉴스브리핑,"◆10월 15일 목요일 주요경제지 1면 기사 *매경 '시한부 영업권'에 발목잡힌 면세점 사업 복지부 ""최광, 책임져야 비연임 결정 철회하라"" [사진]""당신들의 희생이 있었기에 …"" 亞주요국 대졸은행원 초임연봉 한국 최고 일본의 2배 육박 朴, 美 첫일정 혁명상징 한국전기념비 헌화 강덕수 STX 前회장 항소심서 집유 석방 *한경 '과학한국' 발목 잡는 5대 고질병 朴대통령 방미 첫 일정 한국전 참전비 헌화 강덕수 前회장 석방 분식회계 혐의 무죄 ""차병원, 바이오 사관학교 만들것"" '분양가 67억' 해운대 아파트 청약 최고 73대1 *서경 '황금알' 中 내수시장 …바라만 보는 한국 신흥시장 생산라인 대폭 확충 러 체코 등선 대기물량 밀려 증권사 기업대출 20조 늘어난다 [사진]통일 상징 도라산역에 간 獨대통령 재창업땐 정책금융 빚 75% 감면 복지부 ""최광 이사장 책임져라"" 사실상 사퇴 요구 *머투 267억원 규모 불법시장 추첨제 9년만에 손본다 '법인세 6.25%' 아일랜드가 연 '稅시장' [사진]'블프효과' 점검 나간 경제부총리 무늬만 소상공인 얌체짓 못하게 은행들 ""돈 쓰실 분"" …빅4 신용대출 반년새 5조 껑충 *파이낸셜 한중일 금통위원 간 '핫라인' 만든다 LG-독일, 차 부품 동반자로 재기 가능한 창업기반 구축 연말까지 과감한 규제 특례 朴대통령 방미외교 돌입 한국전 참전기념비 헌화 ◆주요이슈 *"
아시아경제,127710,/news/news_read.nhn?article_id=0003898884&office_id=277&mode=search&query=아시아경제&page=1,2016-12-23 16:02,[12월 23일]아시아경제 오늘의 한줄뉴스,"[코스피마감] 코스피, 보합권 공방 끝 기관 앞세워 3일만에 상승[말] 靑, '세월호 7시간 행적 제출' 헌재 요구에 ""당당히 임할 것""[사건] 물 건너간 崔 재산 ·딸 찾느라 분주한 특검[인물] 노무현, 박정희 제치고 국가발전 기여도 1위 역대 대통령[숫자] 원 ·달러 환율 1200원대 고공행진‥9개월만 최고치[행사] 與 비주류 신당은 '개혁 보수 신당'으로 …김용태 ·남경필 합류[장면] 크리스마스에는 사랑을[만화] 신고금소총 - 9화 감언이설"
아시아경제,127710,/news/news_read.nhn?article_id=0003670472&office_id=277&mode=search&query=아시아경제&page=1,2016-01-20 15:32,[1월 20일]아시아경제 오늘의 한줄뉴스,"[코스피마감] 코스피, 외국인·기관 '팔자'에 2% 넘게 후퇴[말] 이종걸, 최고위 복귀 …""文 사퇴, 큰 결단·만시지탄""[사건] 복권의 明과 暗 …'당첨자의 저주'에 서민주머니털기 논란까지[인물] 심상정 ""文·安, 선거용 연대 넘은 야권 정책연대 나서자""[숫자] 불황에 더 늘어난 신사임당‥작년 20조원 발행, 6년만에 2배 증가[행사] [단독]우리은행 오픈마켓 시장 진출한다[장면] 냉동고 추위에도 노숙농성은 계속된다 [만화] 인범 49화"
이데일리,127710,/news/news_read.nhn?article_id=0003766505&office_id=018&mode=search&query=아시아경제&page=1,2017-03-07 17:35,"아시아경제, 키위미디어그룹 지분 6.21% 보유 중",[이데일리 이유미 기자] 아시아경제(127710)는 전환사채 취득으로 키위미디어그룹(012170)의 지분을 6.21%(939만주)를 보유하고 있다고 7일 공시했다.
아시아경제,127710,/news/news_read.nhn?article_id=0003629668&office_id=277&mode=search&query=아시아경제&page=1,2015-11-20 06:49,[11월 20일]아시아경제 뉴스브리핑,"◆11월 20일 금요일 주요경제지 1면 기사 *매경 '사업재승인'은 정부 甲질 …길들여지는 기업 대출금 전액 분할상환 2025년 APEC 정상회의 한국 개최 ""IS테러 아시아 안전지대 아니다"" 행자부 ""상가 과세 불평등 개선"" 파리 연쇄테러 총책 아바우드 사망 확인 한국 야구, 일본에 4-3 역전승 …결승 진출 *한경 한투 고객 수익률 9.6% …비결은 '인사평가' 서울~세종시 1시간 생활권 된다 黃총리 만난 전경련 ""총선용 포퓰리즘 막아달라"" 美퀄컴 주가 '공정위 쇼크'에 급락 APEC 정상회의 2025년 한국서 열린다 '峨山 정주영 금화' 나왔다 …탄생 100년 기념 *서경 대우조선 자금 지원 EU·日 ""WTO 위반"" 글로벌 IB 큰場 서는데 …명함 못 내미는 국내은행 APEC 폐막 …한자리에 모인 정상들 APEC ""환경상품 관세 연내 5%이하로"" 대법 ""대형마트 의무휴업일 지정은 정당"" *머투 LG '가상화폐 최고기술' 블록체인 플랫폼 개발 세종문화회관까지 광화문 광장 확장 중간에 車 못다녀 미끄러지는 기름값, 금가는 금값 최경환 ""지자체 청년수당 포퓰리즘적 행위"" 대형마트 영업규제 대법원 ""정당하다"" *파이낸셜 低低低 …추락하는 물가 고개드는 디플레 'LA오토쇼' 럭셔리브랜드 제네시스 美 공개 서울~세종 민자고속道 내년말 착공 한국, 2025년 APEC 개최국 확정 대법 ""대형마트 영업시간 제한 정당"" ◆주요이슈 *"
아시아경제,127710,/news/news_read.nhn?article_id=0003909776&office_id=277&mode=search&query=아시아경제&page=1,2017-01-11 09:14,[공시+]KMH &quot;아시아경제 블록딜 배경은 신규사업 자금 마련&quot;,"[아시아경제 박선미 기자]아시아경제는 11일 공시를 통해 KMH가 기관투자자에 블록딜(시간 외 대량매매)로  250만주(9.91%)를 주당 4491원에 처분했다고 밝혔다. 지분 매각 후 KMH의 아시아경제 지분율은 기존 55.93%에서 46.02%로 감소했다. KMH는 이번 아시아경제 지분 블록딜 배경에 대해 ""현재 진행하고 있는 신규사업을 위한 가용자금 마련""이라고 설명했다."
