source,symbol,link,date,title,content
뉴시스,131220,/news/news_read.nhn?article_id=0008717573&office_id=003&mode=search&query=대한과학&page=1,2018-07-21 09:18,"대한상의 제주포럼, 장동선 뇌과학자 강연",【서울=뉴시스】21일 제주 신라호텔에서 대한상공회의소가 개최한 제43회 대한상의 제주포럼에서 장동선 뇌과학자가 강연을 하고 있다. 2018.07.21. (사진=대한상공회의소 제공)
한국경제TV,131220,/news/news_read.nhn?article_id=0000669233&office_id=215&mode=search&query=대한과학&page=1,2018-08-07 09:54,"대한과학, 전일 대비 약 4% 상승한 5,690원","[한국경제TV 라이온봇 기자] [그림 1] 최근 3개월 간 주가 추세 및 기간별 수익률 대한과학은 8월 7일 9시 54분 전일 대비 약 4% 상승한 5,690원에 거래되고 있다. 대한과학은 코스닥 상장 기업으로 유통 업종에 속해 있다. 시가총액은 407억원으로 코스닥 상장기업 중 1,096위에 위치 해 있다. [종목 성향 진단] [그림 2] 종목 성향 진단 대한과학의 투자 스타일은 모호한 측면이 있으나 가치주라고 볼 수 있다. 기업 가치 대비 낮은 주가가 매력적인 기업이다. 주가 모멘텀은 평범한 수준이었다. 최근 1개월 수익률이 1.31%, 3개월 수익률은 -9.65%, 6개월 수익률은 -6.06%를 기록했다. 대한과학 종목에 대한 투자자의 관심도는 상대적으로 낮은 편이었다. [투자 점수 진단] [그림 3] 투자 점수 진단 대한과학은 어느 측면에서 투자 매력도가 높은 종목일까? AI 인공지능 종목 분석 시스템을 이용해 성장성, 수익성, 효율성, 안전성, 저평가성, 추세 등 주가 수익률에 영향을 줄 수 있는 6가지 핵심 투자 지표를 점수화하여 종목의 투자 매력도를 계산해보았다. 그 결과 대한과학은 상대적으로 성장성 측면에서 두각을 드러내고 있었다. 성장성 점수는 기업의 실적이 전년 동기 대비 얼마나 증가했는지를 나타낸 지표로 기업의 이익 성장 추세를 나타낸다. 대한과학은 특히 당기순이익증가율(YoY) 측면에서 가장 높은 점수는 기록했는데, 전체 시장 내 177위를 기록하며 상위 9.21%에 위치했다. 업종별로는 22위를 기록하며 상위 10.55%에 위치했다. 그러나 기업의 자산 활용도를 나타내는 효율성 측면에서는 아쉬움을 나타냈다. (위의 AI인공지능 점수는 재무 데이터를 기반으로 전체 상장 종목과 비교/분석하여 도출한 점수로 높은 점수가 반드시 높은 수익률을 보장하지 않습니다. 위의 자료는 당사의 추천 종목이 아니며, 투자 시 참고용으로 제시해드리는 것입니다. 핵심투자지표를 결합해 종목의 투자매력도를 종합 계산한 ""인공지능 투자점수""는 ""거장들의 투자공식"" 앱에서 확인하실 수 있습니다.) 라이온봇 기자 -한국경제TV※ 본 기사는 한국경제TV와 '거장들의 투자공식이'자체 개발한 '라이온봇 기자'가 실시간으로 작성한 기사입니다. 라이온봇기자"
머니투데이,131220,/news/news_read.nhn?article_id=0004023746&office_id=008&mode=search&query=대한과학&page=1,2018-03-15 17:41,"대한과학, 작년 영업익 19억&hellip;전년比 18%&uarr;","[머니투데이 김훈남 기자] 대한과학은 지난해 연결기준 매출이 413억원에 영업이익은 19억원으로 집계됐다고 15일 공시했다. 2016년 대비 매출은 10.21% 줄고, 영업이익은 17.8% 증가했다. 순이익은 40.1% 감소한 13억원이다. 회사 측은 ""국내 및 해외 경기침체에 따라 매출액이 감소했다""고 설명했따."
파이낸셜뉴스,131220,/news/news_read.nhn?article_id=0004055030&office_id=014&mode=search&query=대한과학&page=1,2018-07-10 10:00,"[fnRASSI]대한과학, 3.28% 오르며 거래량 증가","대한과학(131220)의 당일 거래량이 최근 5거래일 거래량의 최고치를 경신하며 투자자들의 관심을 받고 있다. 그리고 대한과학은 3일 연속 상승흐름을 보이며, 9시 57분 현재 3.28% 증가한 5,660원에 거래중이다. 주요 매매주체는 개인투자자  최근 한달간 주체별 거래비중을 살펴보면 개인 비중이 90.5%로 가장 높았고, 외국인이 7.25%로 그 뒤를 이었다. 기관은 2.24%를 나타냈다. 그리고 최근 5일간 거래비중은 개인이 87.59%, 외국인이 8.28%, 기관은 4.12%를 기록했다. 외국인과 기관은 순매도, 개인은 순매수(한달누적)  전일 외국인과 기관이 각각 949주, 12,311주를 순매수 했다. 4주간을 기준으로 보면 외국인이 매도쪽으로 방향을 잡으면서 37,354주를 순매도했고, 기관도 매도 우위를 지속하면서 66,317주를 순매도했지만, 개인은 오히려 방향성있는 매매를 하면서 103,671주를 순매수했다. 'fnRASSI'는 증권전문 기업 씽크풀과 파이낸셜뉴스의 협업으로 로봇기자가 실시간으로 생산하는 기사입니다."
서울경제,131220,/news/news_read.nhn?article_id=0003366300&office_id=011&mode=search&query=대한과학&page=1,2018-08-07 10:20,"&lt;코&gt;대한과학, 전일 대비 7.68% 상승.. 일일회전율은 2.56% 기록","[서울경제] 대한과학(131220) 은 7일 오전 10시 20분 현재 7.68% 오른 5,890원에 거래되고 있으며, 40(매도):60(매수)의 매수우위를 기록하고 있다. 거래대금은 10억9,253만, 거래량은 19만555주로 거래량회전율은 2.56%로 나타났다. 지난 1개월간 대한과학은 상승 14회, 하락 14회를 기록했고, 주가수익률은 -3.44% 표준편차는 1.71%를 기록했다. 이 기간 ' 유통업 ' 업종 평균 주가수익률은 -12.58%로 나타났으며, 변동성은 2.17%를 기록했다. 이 시각 현재 ' 유통업 '은 0.34% 상승 중이며, 43(매도):57(매수)의 매수우위를 기록하고 있다."
한국경제TV,131220,/news/news_read.nhn?article_id=0000624893&office_id=215&mode=search&query=대한과학&page=1,2018-04-20 13:55,"대한과학, 전일 대비 약 3% 상승한 6,240원","[한국경제TV 라이온봇 기자] 대한과학은 4월 20일 13시 54분 전일 대비 약 3% 상승한 6,240원에 거래되고 있다. 대한과학은 코스닥 상장 기업으로 유통 업종에 속해 있다. 시가총액은 437억원으로 코스닥 상장기업 중 1,091위에 위치 해 있다. [종목 성향 진단] [그림 1] 종목 성향 진단 대한과학의 투자 스타일은 모호한 측면이 있으나 가치주라고 볼 수 있다. 기업 가치 대비 낮은 주가가 매력적인 기업이다. 주가 모멘텀은 평범한 수준이었다. 최근 1개월 수익률이 5.79%, 3개월 수익률은 12.71%, 6개월 수익률은 23.19%를 기록했다. 대한과학 종목에 대한 투자자의 관심도는 평범한 수준이었다. [투자 점수 진단] [그림 2] 투자 점수 진단 대한과학은 효율성(ROA) 측면에서 두각을 나타내고 있다. 최근 ROA는 72점으로 6개의 핵심 팩터 중 가장 높은 점수를 기록했다. ROA는  전체 시장 내 554위를 기록하며 상위 28.43%에 위치했다. 업종별로는 55위를 기록하며 상위 26.73%에 위치했다. 그리고 안정성(부채비율) 역시 도드라지는 편이다. 안정성 점수는 67점으로 두번째로 높은 점수를 기록했다. 부채비율은 전체 시장 내 664위를 기록하며 상위 32.67%에 위치했다. 업종별로는 99위를 기록하며 상위 47.55%에 위치했다. 그러나 PBR과 매출증가율(YoY)은  아쉬움을 나타냈다. [종합 투자점수] [그림 3] 종합 투자점수 AI 인공지능 분석을 통한 대한과학의 종목 종합 스코어는 63점을 기록했다. 이는 동일 업종 평균점수인 54점과 시장 평균점수인 56점를 상회하는 수치였다. (위의 AI인공지능 점수는 재무 데이터를 기반으로 전체 상장 종목과 비교/분석하여 도출한 점수로 높은 점수가 반드시 높은 수익률을 보장하지 않습니다. 위의 자료는 당사의 추천 종목이 아니며, 투자 시 참고용으로 제시해드리는 것입니다.) 라이온봇 기자 -한국경제TV※ 본 기사는 한국경제TV와 '거장들의 투자공식이'자체 개발한 '라이온봇 기자'가 실시간으로 작성한 기사입니다. 라이온봇기자 ⓒ 한국경제TV, 무단 전재 및 재배포 금지 한국경제TV 관련뉴스해당 언론사에서 선정하며 언론사 페이지(아웃링크)로 이동해 볼 수 있습니다.'억대 수입' 이사배, 과거 공개한 '럭셔리' 하우스 봤더니유병자 실손보험, 삼성화재 '가장 비싸'쏘가리 가격 '확' 떨어진다…22년 연구 끝에 '대량양식' 성공박하선 '다이어트 성공' 인증샷 ""웰컴백 44사이즈""손은서♥이주승 열애 인정, '연상녀-연하남커플' 합류"
매일경제,131220,/news/news_read.nhn?article_id=0004113958&office_id=009&mode=search&query=대한과학&page=1,2018-03-12 16:33,뇌에 대한 낭설과 유사과학&middot;&middot;&middot;일반인은 정말 뇌를 10%만 사용할까?,"[송민령의 뇌과학 에세이-6] 천재는 뇌를 100% 활용하지만 일반인은 뇌의 10%밖에 사용하지 않을까? 혹은천재와 달리 일반인은 뇌의 10%밖에 사용하지 못할까?  천재는 뇌를 100% 활용하지만 일반인은 뇌의 10%밖에 사용하지 못한다는 말을 한번쯤 들어보았을 것이다. 지능과 긴밀하게 연관된 기관인 뇌를 많이 쓸수록 똑똑하리라는 이 해설은 제법 그럴싸하다. 또한 뇌를 더 많이 활용할 수 있으면 일반인도 천재처럼 될 수 있으리라는 희망도 준다. 그런데 일반인은 정말로 뇌의 10%만 사용할까? ◆긴밀하게 연결된 네트워크 뇌를 10%만 사용하기란 불가능하다. 아래 그림은 사람의 뇌를 확산텐서영상(diffusion tensor imaging)으로 촬영한 것이다. 카메라의 설정을 조정해서 야간 촬영도 하고, 접사도 하듯이 자기공명영상(MRI) 기기의 설정을 조정해 뇌의 여러 측면을 관측할 수 있는데, 그중 하나가 확산텐서영상이다. 확산텐서영상을 활용하면 뇌의 서로 다른 부위를 연결하는 신경섬유들을 볼 수 있다. 아래 그림에서 볼 수 있는 것처럼 뇌 부위들은 구석구석 연결돼 있고, 그림에는 드러나지 않지만 같은 부위 안의 신경세포들도 서로 긴밀하게 상호작용한다. 이렇게 긴밀하게 연결된 뇌에서 10%만 사용하기란 불가능에 가깝다. ◆항상성 (1): 흥분독성 천재와 달리 일반인은 뇌의 10%밖에 사용하지 않는다는 말에는 뇌를 많이 사용할수록 좋다는 가정이 깔려 있는데, 이 가정도 옳지 않다. 생명 활동이 가능한 범위 내에서 항상성을 유지해야 하는 생체에는 다다익선이 통하지 않기 때문이다. 신경세포가 흥분성 신경전달물질인 글루타메이트 등에 반응해 활성화되면 세포 내부에 칼슘 이온이 유입된다. 그런데 신경세포가 지나치게 활성화돼 과량의 칼슘 이온이 유입되면 세포가 죽을 수 있다. 세포 속의 발전소라고도 불리는 미토콘드리아는 세포 자살을 촉발하는 역할도 하는데, 세포 자살은 칼슘 이온의 농도가 지나치게 높아졌을 때 촉발되기 때문이다. 이처럼 지나친 흥분으로 세포가 죽는 것을 흥분독성(excitotoxicity)라고 부른다. 뇌졸중에서 신경세포가 손상되는 주된 이유 중 하나도 흥분독성이다. 정상적인 상황에서는 세포가 에너지를 사용해 흥분성 신경전달물질인 글루타메이트를 재흡수하거나 분해한다. 그래서 세포 밖 글루타메이트의 농도가 낮게 유지된다. 하지만 뇌졸중으로 인해 산소와 영양분이 공급되지 않으면 글루타메이트의 농도가 높아지면서 신경세포들이 지나치게 활성화되고, 신경세포의 과활성은 세포 자살로 이어질 수 있다. 세포가 자살을 한다니 어이없고 아깝게 느껴질 수도 있지만, 세포 자살은 암세포처럼 비정상적으로 증식하는 세포, 감염된 세포, 파괴된 세포를 안전하게 없애주는 꼭 필요한 작용이다. ◆항상성 (2): 수상돌기 이처럼 지나친 활동은 해롭기 때문에 신경세포는 적절한 활동 수준을 유지하려고 하며, 이를 위해 여러 방법을 동원한다. 그중 한 방법은 다른 신경세포들과의 연결 정도를 조절하는 것이다. 신경세포는 나뭇가지처럼 생긴 수상돌기(아래 그림)라는 부분에서 다른 신경세포들로부터 전해지는 입력을 받는데, 지나치게 많은 흥분성 입력이 들어오거나 신경세포가 지나치게 활발해지면 수상돌기의 크기를 줄인다. 반면에 신경세포로 전해지는 입력이 부족하거나 신경세포의 활성이 평소보다 낮게 유지되면 주변으로 수상돌기를 뻗어 입력을 줄 신경세포들을 찾아나선다. 간혹 사고로 손을 잃은 환자가 얼굴을 만졌는데 있지도 않은 손을 느낄 수 있다. 이를 환상지(phantom limb)라고 부르는데, 환상지는 더 이상 입력을 받지 못하게 된 신경세포가 주변으로 수상돌기를 뻗어나가서 생기는 현상이다. 예컨대 손을 잃은 환자가 얼굴에서 손을 느끼는 것은, 손으로부터 입력을 받던 신경세포가 손에서 입력을 받지 못하게 되자 주변으로 수상돌기를 뻗어 얼굴 신경세포와 연결됐을 때 생긴다. 이처럼 신경세포는 항상성을 유지하기 위해 적극적으로 변해가며, 이 과정(및 이 과정의 이상)은 뇌의 여러 기능 및 뇌 질환과 관련된다. ◆가치 판단과 소망이 빚어낸 가짜 과학 천재와 달리 일반인은 뇌의 10%밖에 사용하지 않는다는 말은, 뇌를 많이 사용할수록 좋다는 가치 판단과 뇌를 많이 활용해서 똑똑해지고 싶다는 바람이 빚어낸 낭설이다. 하지만 이 그럴싸한 낭설을 믿고 한 발짝만 더 나아가면 어떤 제품을 사용하면 뇌의 활용도가 높아진다는(똑똑해진다는) 사기에 속을 수도 있다. 편평해 보이는 땅이 실제로는 둥근 것처럼(지구가 둥그니까) 과학이 보여주는 세상에는 통념과 다른 것이 참 많다. 그런데도 '천재와 일반인의 뇌', '남자와 여자의 뇌'처럼 어떤 과학적 사실에 대해 낭설이 유난히 많이 생기는 것은, 관련된 소망과 가치 판단을 원래부터 갖고 있었기 때문일 것이다. 환경에 적응하며 끊임없이 변해가는 과정인 진화를 인간이라는 만물의 영장으로 향해가는 '진보'라고 오해했던 것도, 적극적으로 인간의 '진보'를 도모하는 우생학이 탄생한 것도 인간 우월주의와 경쟁의식이 잠재돼 있었기 때문이었다. 가치 판단과 바람에 따라 뒤틀린 이해는 나치의 유대인 학살이나 강제 불임 수술과 같은 어리석음과 비극을 낳았다. 그러니 과학적 사실에 대한 낭설이 유난히 많은 분야를 다룰수록 주의해야 한다. 이미 작동하고 있는 편견과 소망에 과학적 사실이라는 권위까지 더해주지 않도록. 그리고 돌아봐야 한다. 과학적 사실이 어떤 가치 판단·소망과 잇닿아 있기에 낭설이 생겨나는지. 그래서 낭설이 횡행하는 것은 바람직하지 않지만, 낭설 자체는 인간과 사회를 이해하게 해주는 소중한 기회다. 출처:J Yin & Q Yuan (2015) Structural homeostasis in the nervous system: a balancing act for wiring plasticity and stability. Frontiers in cellular neuroscience. 8:439. [송민령 작가(카이스트 바이오 및 뇌공학과 박사과정)] r_start // r_end //"
전자신문,131220,/news/news_read.nhn?article_id=0002670290&office_id=030&mode=search&query=대한과학&page=1,2017-12-28 08:28,"[ET투자뉴스][대한과학 지분 변동] 서정구 외 8명 0.77%p 증가, 31.0...","대한과학(131220)은 28일 최대주주 서정구를  비롯한 특별관계자의 보유주식이 증가되었다고 발표했다. 이는 직전 보고일보다 54,797주 증가하여 지분율은 31.02%로 상승했다. 이번 보고 사유는 특수관계인주식보유율상승으로  알려졌다.   최대주주와 특수관계자의 지분 변동은 주가에 영향을 주는 요인이다. 특히 보유비율을 지속적으로 늘리거나 줄일 경우, 해당종목 투자시 유의할 필요가 있다.  다음은 대한과학의 지분 변동 내역과 보유 내역이다."
이데일리,131220,/news/news_read.nhn?article_id=0004000655&office_id=018&mode=search&query=대한과학&page=1,2017-12-28 08:52,"서정구 대표&middot;특별관계자, 대한과학 지분율 30.25%&rarr;31.02%",[이데일리 이명철 기자] 대한과학(131220) 최대주주인 서정구 대표이사와 특별관계자 16인은 회사 주식 장내 매수에 따라 지분율이 30.25%에서 31.02%로 0.77%포인트(5만4797주) 상승했다고 28일 공시했다.
파이낸셜뉴스,131220,/news/news_read.nhn?article_id=0004071143&office_id=014&mode=search&query=대한과학&page=1,2018-08-07 10:37,[fnRASSI]대한과학(131220) 현재 8.59% &uarr;,"현재 대한과학(131220)은 전일대비 8.59% 상승하여 5,940원 선에서 거래가 이루어지고 있다. 외국인 보유량 증가, 기관 변화 없음 (5일 누적) 최근 5일간 동종목의 외국인 투자자는 4,473주 순매수하였고 마찬가지로 기관은 0주 순매수하였다. 전날 외국인은 740주 순매수했지만 기관은 순매수량이 0으로 보유비율 그대로 유지했다. 다음 표는 동종목의 외국인, 기관의 일별 순매수량을 나타낸 것이다. 상장주식수 대비 거래량은 0.33%로 적정수준 최근 한달간 대한과학의 상장주식수 대비 거래량을 비교해보니 일별 매매회전율이 0.33%로 집계됐다. 그리고 동기간 장중 저점과 고점의 차이인 일평균 주가변동률을 1.64%를 나타내고 있다. 'fnRASSI'는 증권전문 기업 씽크풀과 파이낸셜뉴스의 협업으로 로봇기자가 실시간으로 생산하는 기사입니다."
파이낸셜뉴스,131220,/news/news_read.nhn?article_id=0003798279&office_id=014&mode=search&query=대한과학&page=1,2017-04-04 10:33,"[fnRASSI]대한과학, 3.29% 오르며 거래량 증가","대한과학(131220)의 현재 거래량이 최근 5거래일 거래량의 최고치를 넘어서며 투자자들의 관심을 받고 있다. 그리고 대한과학은 3일 연속 상승흐름을 보이며, 10시 29분 현재 3.29% 증가한 7,540원에 거래중이다. 외국인 보유량 증가, 기관 감소 (5일 누적) 최근 5일간 동종목의 외국인 투자자는 22,048주 순매수하였고 반면 기관은 0주 순매도하였다. 전날 외국인은 9,192주 순매수했지만 기관은 순매수량이 0으로 보유비율 그대로 유지했다. 다음 표는 동종목의 외국인, 기관의 일별 순매수량을 나타낸 것이다. 기관과 개인은 순매도, 외국인은 순매수(한달누적)  3월30일부터 전일까지 외국인이 3거래일 연속 순매수를 보였다. 4주간을 기준으로 보면 외국인이 방향성있는 매매를 하면서 48,850주를 순매수한 반면, 기관은 매도쪽으로 방향을 잡으면서 2,010주를 순매도했고, 개인들도 매도 우위를 지속하면서 46,840주를 순매도한 것으로 집계됐다. 'fnRASSI'는 증권전문 기업 씽크풀과 파이낸셜뉴스의 협업으로 로봇기자가 실시간으로 생산하는 기사입니다."
한국경제TV,131220,/news/news_read.nhn?article_id=0000624363&office_id=215&mode=search&query=대한과학&page=1,2018-04-19 13:56,"대한과학, 전일 대비 약 3% 상승한 5,950원","[한국경제TV 라이온봇 기자] 대한과학은 4월 19일 13시 56분 전일 대비 약 3% 상승한 5,950원에 거래되고 있다. 대한과학은 코스닥 상장 기업으로 유통 업종에 속해 있다. 시가총액은 418억원으로 코스닥 상장기업 중 1,105위에 위치 해 있다. [종목 성향 진단] [그림 1] 종목 성향 진단 대한과학의 투자 스타일은 모호한 측면이 있으나 가치주라고 볼 수 있다. 기업 가치 대비 낮은 주가가 매력적인 기업이다. 주가 모멘텀은 평범한 수준이었다. 최근 1개월 수익률이 1.23%, 3개월 수익률은 11.39%, 6개월 수익률은 17.52%를 기록했다. 대한과학 종목에 대한 투자자의 관심도는 상대적으로 낮은 편이었다. [투자 점수 진단] [그림 2] 투자 점수 진단 대한과학은 효율성(ROA) 측면에서 두각을 나타내고 있다. 최근 ROA는 72점으로 6개의 핵심 팩터 중 가장 높은 점수를 기록했다. ROA는  전체 시장 내 554위를 기록하며 상위 28.43%에 위치했다. 업종별로는 55위를 기록하며 상위 26.73%에 위치했다. 그리고 안정성(부채비율) 역시 도드라지는 편이다. 안정성 점수는 67점으로 두번째로 높은 점수를 기록했다. 부채비율은 전체 시장 내 664위를 기록하며 상위 32.67%에 위치했다. 업종별로는 99위를 기록하며 상위 47.55%에 위치했다. 그러나 PBR과 매출증가율(YoY)은  아쉬움을 나타냈다. [종합 투자점수] [그림 3] 종합 투자점수 AI 인공지능 분석을 통한 대한과학의 종목 종합 스코어는 63점을 기록했다. 이는 동일 업종 평균점수인 54점과 시장 평균점수인 56점를 상회하는 수치였다. (위의 AI인공지능 점수는 재무 데이터를 기반으로 전체 상장 종목과 비교/분석하여 도출한 점수로 높은 점수가 반드시 높은 수익률을 보장하지 않습니다. 위의 자료는 당사의 추천 종목이 아니며, 투자 시 참고용으로 제시해드리는 것입니다.) 라이온봇 기자 -한국경제TV※ 본 기사는 한국경제TV와 '거장들의 투자공식이'자체 개발한 '라이온봇 기자'가 실시간으로 작성한 기사입니다. 라이온봇기자 ⓒ 한국경제TV, 무단 전재 및 재배포 금지 한국경제TV 관련뉴스해당 언론사에서 선정하며 언론사 페이지(아웃링크)로 이동해 볼 수 있습니다.'억대 수입' 이사배, 과거 공개한 '럭셔리' 하우스 봤더니유병자 실손보험, 삼성화재 '가장 비싸'쏘가리 가격 '확' 떨어진다…22년 연구 끝에 '대량양식' 성공'PD수첩' 김학의 '별장 성접대 동영상' 재조명, 검찰수사 문제 많았다고 장자연-단역 자매 사건 재수사…""내가 노리개인가"""
