source,symbol,link,date,title,content
뉴시스,131220,/news/news_read.nhn?article_id=0007125601&office_id=003&mode=search&query=대한과학&page=1,2016-03-28 09:10,[빅데이터MSI 유망주]빅데이터MSI 톱5&hellip;&middot;GS&middot;LG생명과학&middot;대한항공&middot;한화케미칼...,"【서울=뉴시스】 한상연 기자 =  GS, LG생명과학, 대한항공, 한화케미칼, 롯데케미칼이 28일 오전 8시 현재 기준 빅데이터 시장심리지수(MSI)가 가장 높은 톱5에 올랐다. 28일 뉴시스와 코스콤이 주요 상장기업 250곳에 대해 공동으로 분석해 뽑아낸 빅데이터 MSI(Market Sentiment Index)에 따르면 전 거래일 오후 4시부터 이날 오전 8시까지 데이터를 취합한 결과 이 같이 나타났다. MSI로 볼 때 긍정적인 레벨(5~7단계)에 해당하는 유망종목은 이날 총 28개다. 뉴시스와 코스콤은 온라인과 소셜네트워킹서비스(SNS)에서 수집된 개별 종목 관련 빅데이터를 긍정과 부정으로 분류해 점수화 한 다음 이를 최근 1년 간 흐름과 비교해 지수를 산출했다. MSI산출 대상은 코스피 200종목과 코스피 지수, 코스닥 50종목과 코스닥 지수 등 250개 개별 종목이다. MSI는 1단계 '매우 나쁨', 2단계 '나쁨', 3단계 '약간 나쁨', 4단계 '보통', 5단계 '약간 좋음', 6단계 '좋음', 7단계 '매우 좋음' 등 총 7단계로 분류한다. 이 중 5~7단계는 긍정적인 종목으로 간주, 오늘 주식시장에서 상승 가능성이 높은 이른바 MSI 유망주로 꼽힌다. 이날 오전 집계된 유망종목은 시장별로 유가증권 시장 27개, 코스닥 시장 1개다. 분석 대상은 코스피 200종목과 코스닥 50종목 등 모두 250종목이다. 이 가운데 이날 MSI 톱5 유망주는 GS, LG생명과학, 대한항공, 한화케미칼, 롯데케미칼이다. 톱5 가운데 7단계 종목으로 꼽힌 것은 GS, LG생명과학, 대한항공 등 10종목, 6단계 종목은 현대백화점, 대우증권, 부광약품 등 6종목, 5단계 종목은 현대차, 두산, 코웨이 등 12개인 것으로 나타났다. 가장 눈에 띄는 종목은 전 거래일(25일) 대비 7단계가 상승한 LG생명과학이다. LG생명과학은 매출 증대 가능성이 높이 점쳐지며 증권가의 관심을 받고 있다. 신한금융투자는 지난 25일 리포트를 통해 올해 LG생명과학이 5040억원의 매출을 올릴 것이라고 전망했다. 신한금융은 ""주력 품목의 매출 증대와 기술 수출료 유입으로 의약품 매출액이 4392억원이 될 것으로 예상된다""며 ""특히 자체개발 품목인 히알루론산 필러 '이브아르'와 당뇨병치료제인 '제미글로'의 공동 마케팅(대웅제약) 효과도 사상 최대매출 달성에 기여할 것""이라고 내다봤다. 신한금융 분석대로라면 LG생명과학은 사상 처음으로 연매출 5000억원을 넘게되는 것이다. 이 때문에 관심을 받고 있는 것으로 분석된다."
아시아경제,131220,/news/news_read.nhn?article_id=0003616096&office_id=277&mode=search&query=대한과학&page=1,2015-11-02 09:56,"대한과학, 명문장수기업 포상 &lsquo;중소기업청장상&rsquo; 수상","[아시아경제 팍스넷 신송희 기자] 대한과학은 제 8회 명문장수기업 포상에서 ‘중소기업청장상’을 수상했다고 2일 밝혔다. 중소기업중앙회가 주관하는 명문장수기업 포상은 존경 받는 기업문화 조성을 위해 오랜 기간 동안 기업을 지속 성장시켜 국가경제에 기여한 기업을 발굴하고 격려하고자 마련된 포상이다. 경영이념과 기술의 꾸준한 계승, 발전으로 경쟁력을 향상시킨 기업 가운데 고용창출, 사회공헌 등 사회적 책임에 앞장서고 있는 기업을 매년 선정하며, 업력 30년 이상 중소·중견기업을 대상으로 한다. 대한과학이 지난 30일 중소기업중앙회사 주관하는 명수장문기업 포상에서 '중소기업청장상'을 수상했다. 대한과학의 창업주인 서정구 회장은 연구원 출신으로써 열악했던 연구, 실험실의 기자재 구매 환경을 개선하기 위해 1980년 ‘대한이화학’을 설립했다. 국내 최초로 연구 실험실을 위한 종합 공급체제를 완성해 업계 사업 비즈니스의 기초를 닦았다. 이후 1993년 법인전환, 2003년 제조업 진출, 2011년 코스닥 상장 등 현재까지 35년간 동 분야에서 꾸준한 성장을 이어온 대표적인 장수기업이다. 특히 2005년 현 서은택 대표이사 취임 후 기존의 유통기업에서 기술개발 기업으로 한 단계 도약하고, 해당 기술로 개발한 연구 실험장비들을 미국과 중국, 유럽 등 해외 55개국에 수출하며 글로벌 기업으로 입지를 다졌다. 대한과학의 이번 수상은 이런 오랜 기간에 걸친 뚜렷한 실적에 고용창출, 사회공헌, 경영혁신 등이 고른 점수를 받은 결과로 풀이된다. 서은택 대표이사는 수상 소감을 통해 “대한과학은 국내 기초과학 분야의 발전사와 함께 해 온 기업으로 지난 업적들을 기반으로 미래 100년 이상 성장을 이어가 장수기업이 갖는 사회적 책임을 다하는 기업이 될 수 있도록 하겠다”고 전했다."
뉴시스,131220,/news/news_read.nhn?article_id=0007127230&office_id=003&mode=search&query=대한과학&page=1,2016-03-28 15:58,[빅데이터MSI]빅데이터MSI 유망주 GS&middot;LG생명과학&middot;대한항공&middot;롯데케미칼 상승 ...,"한화케미칼 하락 마감…자회사 실적 악화 전망 【서울=뉴시스】이국현 기자 = 28일 빅데이터 시장심리지수(Market Sentiment Index·MSI)로 추출된 유망주 5종목 가운데 4개 종목이 상승 마감했다. 23일 뉴시스와 코스콤이 주요 상장기업 250곳에 대해 공동으로 분석해 뽑아낸 빅데이터 MSI(Market Sentiment Index)에 따르면 전거래일 오후 4시부터 이날 오전 8시까지 집계한 유망주 톱5 종목은 GS, LG생명과학, 대한항공, 한화케미칼, 롯데케미칼이 등 5종목으로 나타났다. 이 가운데 GS(0.36%), LG생명과학(0.90%), 대한항공(0.51%), 롯데케미칼(1.47%) 등 4종목이 상승 마감했다. 반면 한화케미칼은 2.70% 하락 마감했다. 롯데케미칼은 에틸린 등 올레핀 시장의 수급 개선과 삼성화학 부문 인수 효과 때문에 올해 예상 영업이익이 시장 기대치를 웃돌 것이라는 전망이 나오면서 4거래일 연속 상승했다. 아울러 52주 신고가를 26일 만에 갈아치웠다. LG생명과학은 현재까지 국내에서만 판매되던 당뇨치료제 '제미글로'가 이달부터 본격 해외 판매를 시작해 실적이 더욱 개선될 것이라는 분석이 나오면서 상승세로 마감했다. KTB투자증권에 따르면 제미글로의 1~2월 처방액이 65억원으로 지난해 4분기(79억원) 실적의 82%를 달성했다. GS는 에너지 관련 자회사 GS칼텍스의 화학사업부 회복세와 GS리테일의 소매사업부 성장성이 계속되고 있다는 점이 주목을 받으면서 2거래일 연속 상승세를 보인 것으로 풀이된다. 대한항공은 진에어가 운항 중인 인천 출발 클락, 하노이, 타이베이, 호놀룰루 노선과 부산 출발 세부, 다낭 노선 등 6개 노선에서 진에어와 양사간 공동운항 노선을 확대키로 하면서 소폭 상승한 것으로 나타났다. 하지만 증권가에서는 대한항공이 유가 하락에 따른 실적 기대감과 여객 수송량 증가 때문에 저점 대비 28.9% 반등했지만 화물 수송량과 탑재율이 부진한 것으로 나타나면서 상승 모멘텀이 여전할 지는 의문시되고 있다. 반면 이날 화학주가 보합세를 보인 가운데 한화케미칼은 2.70% 하락 마감했다. 자회사인 한화큐셀 실적 발표를 앞두고 지난해 3,4분기 호조가 이어지지 않을 것이라는 불안감 때문으로 풀이된다. 황규원 유안타증권 연구원은 ""한화큐셀의 실적이 지난해 3,4분기 좋았지만 올해 상반기에는 이어지지 않을 것으로 보이면서 오늘 주가가 빠진 것으로 풀이된다""며 ""1분기는 태양광 제품 비수기인 데다 올 들어 태양광 원재료인 폴리실리콘 가격은 올라가고, 태양광 모듈가는 내려가면서 그 차이가 좁혀지고 있는 것도 원인""이라고 분석했다. 이날 코스피 시장에서는 외국인은 109억원어치를 순매도하면서 이틀 연속 국내 주식을 팔아치웠다. 기관과 개인도 각각 274억원, 307억원을 순매도했다. 한편 뉴시스와 코스콤은 250개 종목에 대해 감성사전을 만들어 해당 종목의 실시간 점수를 산출해 내고 이를 최근 1년간의 흐름과 비교해 시장심리지수(MSI) 레벨로 제시하고 있다. MSI는 총 7단계로 나눠진다. 1단계 '매우 나쁨', 2단계 '나쁨', 3단계 '약간 나쁨', 4단계 '보통', 5단계 '약간 좋음', 6단계 '좋음', 7단계 '매우 좋음' 등으로 분류된다. MSI 레벨이 가장 낮은 수준인 1단계에서 가장 높은 수준인 7단계쪽으로 방향을 틀면 해당 종목에 대해 온라인상에서의 반응이 부정에서 긍정으로 바뀌고 있다는 뜻으로 해석할 수 있다."
조세일보,131220,/news/news_read.nhn?article_id=0002118911&office_id=123&mode=search&query=대한과학&page=1,2015-10-21 11:36,"대한항공-국가과학기술연구회, 무인기 사업 MOU","대한항공은 21일 성남시 서울공항에서 열리는 서울 에어쇼에서 국가과학기술연구회와 무인항공기 등 미래첨단기술개발 및 사업화와 관련한 포괄적 업무 협약을 체결했다고 밝혔다. 이날 행사에는 지창훈 대한항공 총괄사장, 이상천 국가과학기술연구회 이사장, 함명래 대한항공 항공우주사업본부장 등이 참석했다. 국가과학기술연구회는 25개 정부출연연구기관을 지원•육성하고 관리하는 미래창조과학부 산하 공공기관이다. 이번 협약은 연구기관이 보유한 미래 첨단 무인기 기술을 실제 사업화하기 위한 것으로 ▲정부출연연구기관 보유 기술 및 연구 성과에 대한 산업체 이전 확산 ▲무인기 분야 등 미래첨단기술의 사업화 및 상용화 연구 협력 강화 ▲인천창조경제혁신센터 벤처∙중소기업 지원 등을 주요 내용으로 한다. 이번 협약에 따라 국가과학기술연구회는 정부출연연구기관이 보유한 무인기 등 미래첨단 산업 기술 및 지식재산권을 대한항공으로 이전하는 방안을 모색하게 된다. 또한 대한항공은 정부출연연구기관이 가진 무인항공기 기술을 상용화시키는 연구에 적극 참여하게 된다. 아울러 한진그룹 지원의 인천창조경제혁신센터가 육성하는 벤처∙중소기업이 정부출연연구기관 보유한 특허 및 장비도 활용할 수 있도록 할 예정이다. ★ 화끈한 토픽·쏠솔한 정보 조세일보 페이스북 초대합니다."
한국경제TV,131220,/news/news_read.nhn?article_id=0000482641&office_id=215&mode=search&query=대한과학&page=1,2016-07-26 13:37,"연구용 실험기기 기업 ㈜대한과학, 중국 혈액보관센터에 -95℃ 초저온냉동고 220...","[한국경제TV 디지털뉴스팀] 국내 최대의 연구용 실험기기 제조 및 종합유통 기업인 대한과학(대표 서정구)의 주력제품인 -95℃ 초저온냉동고(Ultra-Low Temp. Freezer)가 중국 내 영업망을 통해 중국 혈액보관센터에 대량으로 공급된다. 대한과학의 초저온 냉동고는 -95℃/-85℃ 이하의 초저온 상태로 내부를 유지시키는 장비로써 병원, 의/약학 연구소, 생명과학 및 식품연구 등에서 각종 연구 실험분야에 다양하게 사용되는 장비다. 최근 대한과학 중국법인(DAIHAN Scientific CHINA Co., Ltd.)의 중국 내 현지 대리점인 중국상해정국유한공사를 통해 중국 혈액보관센터와의 납품계약이 이뤄졌음을 전하고 이 초저온냉동고를 곧 공급할 예정임을 알렸다. 금번 납품 수량은 총 220대에 달하며 금액으로는 10억 규모다. 관게자는 “기존 제품들과 달리 초저온 급속냉각을 위한 컴프레서를 1대만 탑재하고도 2대를 기본으로 탑재한 제품들과 동일한 성능을 구현해낸 핵심기술, 업계 최초로 풀 터치 스크린(Full Touch Screen) 컨트롤러 장착, 자체 개발한 원격 제어시스템인 스마트랩 시스템(Smart-Lab System) 도입 등 제품의 다양한 경쟁력들이 대형계약 성사를 거둔 이유로 보고 있다”며 “게다가 글로벌 기업들이 고강도 경쟁을 벌이고 있는 중국 내에서 해외 경쟁사들을 제친 성과라 대한과학 해외 영업력이 함께 높아지고 있음을 확인한 계기가 되어 더욱 큰 의의를 두고 있다”고 전했다. 실제 금번 계약은 중국 혈액보관센터에 기 납품된 동일 제품이 장기간 이상여부 없이 만족스럽게 가동된데다 대한과학 중국법인의 영업능력이 큰 역할을 한 것으로 업체 측은 보고 있다. 중국은 현재 연구용 실험기기 분야의 여러 업체들이 경쟁을 벌이고 있는 상태다. 한편, 대한과학 초저온 냉동고는 굿디자인 인증마크를 획득한 바 있으며, 동일 제품에 대해 렌탈 프로그램을 적용해 초저온 냉동고 렌탈 서비스도 진행 중이다. 본 납품은 9월까지 전량 설치를 예정하고 있다. 디지털뉴스팀"
연합뉴스,131220,/news/news_read.nhn?article_id=0008566411&office_id=001&mode=search&query=대한과학&page=1,2016-07-26 14:16,"대한과학, -95℃ 초저온냉동고 중국 혈액보관센터에 공급","▲ 연구용 실험기기 제조 및 종합유통 기업 대한과학(대표 서정구)이 중국 현지법인을 통해 중국 혈액 보관센터에 초저온냉동고(Ultra―Low Temp. Freezer) 220대를 납품하기로 했다고 26일 밝혔다. 대한과학은 오는 9월까지 -95℃ 및 -85℃ 초저온냉동고 220대를 납품하기로 했으며 스케쥴에 따라 제품을 생산하고 있다. 업체 측은 ""이번 납품은 글로벌 기업들이 중국시장에 들어와 현지 생산공장까지 구축하는 등 많은 경쟁이 있었지만, 자사 제품을 데모 제품으로 납품하면서 성능과 서비스 능력이 입증돼 경쟁 기업들을 제치고 납품에 성공했다""고 전했다. 초저온냉동고는 병·의원에서 샘플보관, 혈액 보관용으로도 사용되고 기타 의·약학 연구소, 생명과학 및 식품연구 등에서 필요한 장비이다. 업체 관계자는 ""금번 납품되는 대한과학 초저온냉동고는 특히 초저온 급속 냉각을 위한 장치인 컴프레서(compressor)를 단독으로 탑재했음에도 불구하고 두 대의 컴프레서 탑재 제품과 동일한 성능을 보이며 제품 단가도 낮춰 가격경쟁력도 갖췄다""고 설명했다. 또한, 원격 확인, 제어 등이 가능한 대한과학 자체기술 '스마트랩 시스템'을 적용해 디자인 인증인 '굿디자인 마크'도 획득했다. 서정구 대표는 ""자사의 초저온 냉동고는 북미, 유럽 등 선진국에서 선전하고 있어 금번 계약에서도 해외 선두기업과의 경쟁에서 이길 수 있다는 자신감을 가지고 있었다""라며 ""이번 계약으로 중국 내 다른 국가기관 연구소와 학회에 대한 추가적인 영업에 큰 도움이 될 전망이고 중국 법인뿐만 아니라 대한그룹의 전체 실적에도 도움이 될 것""이라고 말했다. (연합뉴스) 연합뉴스 관련뉴스해당 언론사에서 선정하며 언론사 페이지(아웃링크)로 이동해 볼 수 있습니다.후임병 속옷에 손 넣어 주무르고 만지고…20대 징역형""평화롭던 산골마을 공포의 밤""…日장애인시설 살상극에 '뜬눈'중학생이 수업시간에 여교사 치마 속 몰카…친구들에 유포""김정일 넷째 부인 김옥 숙청…수용소로 보내져""가만히 있는 길고양이 집어던져 살해…CCTV 공개로 '시끌'"
이데일리,131220,/news/news_read.nhn?article_id=0003358857&office_id=018&mode=search&query=대한과학&page=1,2015-10-01 18:02,"대한과학, 신주인수권 9만주 행사",[이데일리 경계영 기자] 대한과학(131220)은 신주인수권 9만9403주(지분 1.4%)가 행사된다고 1일 공시했다. 신주인수권 행사가액은 5030원이며 15일 상장될 예정이다. 미행사된 신주인수권증권 잔액은 15억원이다.
이데일리,131220,/news/news_read.nhn?article_id=0003553779&office_id=018&mode=search&query=대한과학&page=1,2016-05-30 10:39,"대한과학, 미용장비 신제품 &lsquo;리프레타&rsquo; 내달께 국내 출시","- KGMP 인증 완료… 식약처 품목허가 후 선보일 예정 대한과학 HIFU 미용장비 리프레타.(이미지=대한과학 제공) [이데일리 이명철 기자] 연구용 실험·의료기업체인 대한과학(131220)은 헬스케어 신제품인 집속초음파치료(HIFU) 장비 ‘리프테라(Liftera)’의 의료기기 제조·품질관리기준 적합인정서(KGMP) 인증이 완료됐다고 30일 밝혔다. 현재 진행 중인 식약처(KFDA) 의료기기 품목허가 취득까지 완료되면 올초 정식 론칭한 체성분분석기 ‘인밸런스(InBalance) 300’과 함께 두 종류의 헬스케어 장비를 본격 생산·판매할 여건을 마련하게 된다. 리프레타는 고강도 초음파에너지를 한 초점으로 집약해 피부 안쪽을 자극시키는 제품이다. 수술과정 없이도 주름개선과 콜라겐 생성, 리프팅 효과 등을 기대할 수 있다. 에너지가 같은 곳에 계속 조사되지 않도록 하는 센서인식 기능과 에너지 정밀제어로 초점을 맞추는 정밀도 등의 기술을 갖췄다. 회사는 일반형(리프레타-P)과 고급형(리프레타-A) 두 가지 모델 동시 출시를 준비 중이다. 식약처 품목허가는 이달 중 취득할 것으로 예상되며 비슷한 시기 국내 시판에 나설 계획이다. 회사 관계자는 “리프레타는 이미 중국에서 미용장비로 영업을 시작해 호응을 얻고 있는 제품으로 국내 출시되면 본격 마케팅과 거래처 추가 발굴 등을 통해 제품 우수성을 알리는데 주력할 예정”이라며 “체성분분석기와 함께 신사업 성장동력이 될 것”이라고 전했다."
아시아경제,131220,/news/news_read.nhn?article_id=0003589467&office_id=277&mode=search&query=대한과학&page=1,2015-09-22 08:19,대한과학 &ldquo;체성분 측정기로 해외 시장 공략&rdquo;,"[아시아경제 팍스넷 배요한 기자] 대한과학이 체성분 측정기의 제품 생산 및 마케팅을 본격화할 전망이다. 또 기존 해외영업망을 통해 체성분 측정기의 해외진출을 가속화한다는 방침이다. 대한과학 관계자는 22일 “지난 15일 식약처로부터 임피던스 300K 체지방측정기(InBalance 300K)의 의료기기 제조인증 승인을 받았다”면서 “빠르면 내달 체성분 측정기 출시를 목표로 하고 있다”고 전했다. 체성분 측정기는 인체에 무해한 미세 교류전류를 체내에 통과시켜 얻은 저항값을 측정하여 신체의 구성 성분을 분석하는 임피던스 기술을 이용한 장비로 학교, 병원, 스포츠센터 등에서 대부분 사용되고 있다. 현재 체성분 측정기 시장은 인바디가 국내를 비롯한 세계시장 점유율에서 1위를 기록하고 있다. 대한과학은 이 시장의 후발주자로 기존 영업망과 가격경쟁력을 통해 인바디의 아성을 무너뜨리겠다는 전략이다. 회사 관계자는 “체지방 측정기는 대한과학의 신사업으로서 해외시장 진출을 노리고 개발한 의료기기”라면서 “현재 해외 55개국에 진출한 상태로 기존 영업망을 활용한다면 해외진출이 용이할 전망”이라고 전했다. 대한과학은 기존 주요산업인 실험기기 시장 진출을 통해 북미, 유럽, 동남아 등 대륙별 주요 거점에 유통 네트워크 구축하고 있다. 미국에서는 현지 법인을 설립하며 북미 지역의 영업망을 구축해 나가고 있으며, 독일에서는 현지 대리점을 통해 영업력을 확대하고 있다. 최근에는 태국, 터키, 말레이시아 등 신흥 시장을 중심으로 인지도를 높이고 있다."
아시아경제,131220,/news/news_read.nhn?article_id=0003591259&office_id=277&mode=search&query=대한과학&page=1,2015-09-24 09:10,"[특징주]대한과학, 주름개선용 장비판매 호조 소식‥上",[아시아경제 임철영 기자]대한과학의 주가가 주름개선용 장비 초도물량이 중국시장에서 완판됐다는 소식에 가격제한폭까지 올랐다. 24일 오전 9시5분 현재 대한과학은 전 거래일 대비 2560원(29.80%) 오른 1만1150원을 기록중이다. 대한과학은 주름개선용 HIFU 장비 ‘Liftera’ 초도 물량이 중국 시장에서 모두 판매됐다고 밝혔다. 대한과학 관계자는 “직접 시연해본 참가자들의 호평이 제품 주문으로까지 이어졌다”면서 “초도 물량 완판에 이어 지속적으로 납품이 이어질 예정”이라고 말했다.
뉴시스,131220,/news/news_read.nhn?article_id=0007287372&office_id=003&mode=search&query=대한과학&page=1,2016-06-13 17:12,"대한과학, 최대주주 서정구 외 16인으로 변경",【서울=뉴시스】최예린 기자 = 의료·정밀 및 과학기기 도매업체 대한과학(131220)은 변경 전 최대주주 서은택의 차입금 상환 및 투자금 확보를 위한 주식 매각으로 최대주주가 서은택 외 16인에서 서정구 외 16인으로 변경됐다고 13일 공시했다.
머니투데이,131220,/news/news_read.nhn?article_id=0003547843&office_id=008&mode=search&query=대한과학&page=1,2015-09-22 10:19,"[더벨]대한과학, 피부미용 치료기 출시&hellip;中 미용시장 공략","[더벨 김세연 기자] [실험기기 제조기업에서 종합 헬스케어기업 변신 추진] 더벨|이 기사는 09월22일(09:15) 자본시장 미디어 '머니투데이 thebell'에 출고된 기사입니다. 종합 헬스케어 기업으로 변신에 나선 대한과학이 중국 미용시장 공략에 나섰다. 대한과학은 고강도 초음파 에너지를 이용한 집속 초음파 치료(HIFU) 장비 '리프테라(Liftera)'의 개발을 완료하고 중국 수출에 나선다고 22일 밝혔다. HIFU는 고강도의 초음파에너지를 하나의 초점에 맞춰 피부 안쪽을 자극하는 시술로, 수술 없이 주름개선 및 콜라겐 생성, 리프팅 효과 등을 기대할 수 있는 치료법이다. 대한과학이 선보인 리프테라는 같은 곳에 에너지가 계속 조사되지 않도록 하는 센서인식 기능과 타깃 층에 정확히 초점을 맞추도록 하는 에너지 정밀제어 기능을 갖추고 있다. 시술 부위에 따라 최적화된 카트리지 및 파라미터도 제공한다. 육안으로 판독이 가능한 사용자인터페이스(GUI)를 적용해 시술자의 편의성을 높였고 제품 대비 가격대도 낮춰 HIFU 시술 비용을 현실화를 이끌었다는 평가다. 서은택 대한과학 대표는 ""전세계 판매를 염두하고 개발한 만큼 기존 해외 현지법인과 대리점 등 55개국의 판매망을 적극 활용해 수출 영업을 시작하고 있고, 일부 매출을 거두고 있다""며 ""리프테라 브랜드의 조기 정착과 함께 대한과학의 글로벌 인지도를 더욱 높이기 위해 국내 판매는 물론 수출을 동시에 추진할 것""이라고 말했다. 대한과학 관계자는 ""리프테라는 이달 초 중국 광저우에서 열린 아시아 최대의 '2015 광저우 국제 미용 박람회'에서 첫 선을 보인 이후 제품 문의와 선주문이 이어지고 있다""며 ""현지의 뜨거운 반응에 따라 급성장하고 있는 중국 미용 시장을 포함해 해외 시장 공략을 확대해 나갈 것""이라고 밝혔다. 대한과학은 최근 체지방분석기 'InBalance300'의 식약청 의료기기 품목허가도 취득하며 기존 연구용 실험기기 제조 및 유통 기업에서 '종합 헬스케어' 기업으로 변화에 주력하고 있다. textlinktopstart textlinktopend textlinkstart"
