source,symbol,link,date,title,content
전자신문,131220,/news/news_read.nhn?article_id=0002581057&office_id=030&mode=search&query=대한과학&page=1,2017-02-03 10:03,[로봇뉴스]대한과학_상당 물량의 외인 매물이 흘러나오면서.. 현재 -3.13%,"외국인이 전일 대한과학을 평소와 다르게 큰 규모로 순매도했다. 전일 순매도량은 전체 거래량의 20.62%를 차지할 정도로 크다. 외국인의 순매도로 수급여건이 나빠지면서 주가도 하락세를 보이고 있다. 이러한 영향권에서 3일 오전 9시 53분 현재 220원(3.13%) 내린 6,810원을 기록하고 있다.    [종목동향]     * 대한과학의 최대주주가 기존의 서은택외 16인에서 서정구외 16인으로 변경됨 (2016-06-13) * 대표이사변경, 서정구 신규선임 (2016년 03월 17일)    [주가/수급동향]     1월31일부터 전일까지 외국인이 3거래일 연속 순매도했다. 최근 한달간 대한과학의 매매회전율을 분석한 결과 11일에 1번 꼴로 주식의 주인이 바뀐 것으로 나타났다.  이와 같이 회전율이 너무 높은 종목들은 투자시 주의가 필요하다.  동종목의 경우 동기간 일평균 주가변동률은 5.68%를 기록했다.  그리고 최근 5일간 거래비중은 개인 비중이 93.73%로 가장 높았고, 외국인이 6.24%로 그 뒤를 이었다.  기관은 0.02%를 나타냈다.     [업종내 종목흐름]     이 시각 현재 관련종목들은 혼조세를 보이고 있고 유통업종은    0.04% 하락하고 있다. 매커스 3,370원▲40(+1.20%) 포티스 2,080원▲60(+2.97%)  SDN 1,595원▲60(+3.91%) 한국정보공학 5,890원▼100(-1.67%)    [재무특징]     영업이익률 현재 1.54%로 업종평균 하회. PER은 103.77로 업종평균보다 높으며, PBR은 2.2임."
매일경제,131220,/news/news_read.nhn?article_id=0004132707&office_id=009&mode=search&query=대한과학&page=1,2018-04-12 18:45,"&quot;韓&middot;伊, 과학 연구에 대한 열정 닮아 있어&hellip;협력 확대하자&quot;","15일 `제 1회 세계 이탈리아 과학인의 날`伊, 레오나르도 다빈치, 갈릴레이의 나라""음식·럭셔리 뿐 아니라 과학에서도 강국""  12일 서울 용산구 주한이탈리아 대사관저에서 열린 '제1회 세계 이탈리아 과학인의 날' 기자간담회에서 참석자들이 기념사진을 찍고 있다. (왼쪽부터) 그라치아노 로시 세종대 물리천문학과 교수, 스테파노 스코펠 서강대 물리학과 교수, 엔리코 드리올리 한양대 에너지공학과 교수, 프란체스코 카가넬라 주한이탈리아대사관 과학서기관, 마르코 델라 세타 주한 이탈리아 대사, 원광연 NST 이사장, 김혜숙 이대 총장, 이영무 한양대 총장, 김두철 IBS 원장. ""한국과 이탈리아는 과학에 대한 강렬한 열정이 있다는 데서 매우 닮아있다. 협력의 기회를 더 늘릴 수 있다고 생각한다"" 스테파노 스코펠 서강대학교 물리학과 교수는 12일 서울 용산구 주한이탈리아대사관저에서 열린 '제1회 세계 이탈리아 과학인의 날' 기자간담회에서 이같이 밝혔다. 그는 지난 2004년 한국에서 연구활동을 시작했으며 2010년부터 서강대 교수를 역임하고 있다. 이탈리아 교육·대학·연구부는 레오나르도 다빈치 탄생일을 기념해 올해부터 매년 4월 15일을 ' 세계 이탈리아 과학인의 날' 로 지정했다. '세계 이탈리아 과학인의 날'을 지정한 목적은 다양한 국가에서 연구활동 중인 이탈리아 과학자의 경쟁력과 능력을 부각하기 위해서다. 이에 주한이탈리아대사관도 한국에서 활동하고 있는 이탈리아 학자들을 소개하고 한국과 이탈리아의 과학협력 증진을 도모하기 위해 행사를 개최했다. 현재 한국에서는 25명의 이탈리아 과학자들이 활동하고 있다. 분야는 물리학, 수학과 같은 기초과학분야부터 나노과학, 대체에너지, 생명공학 등까지 다양하다. 이날 행사에서는 25명의 과학자들 중 3명의 연구 활동에 대한 소개가 진행됐으며, 원광연 국가과학기술연구회(NST) 이사장 ,김두철 기초과학연구원(IBS) 원장, 김혜숙 이화여자대학교 총장, 이영무 한양대학교 총장 등도 참석했다. 마르코 델라 세타 주한 이탈리아 대사는 ""사람들이 잘 모르는 한국과 이탈리아의 과학 협력에 대해 소개하기 위해 오늘 행사를 갖게 됐다""며 ""이탈리아는 음식, 럭셔리 뿐 아니라 과학 분야에서도 강국이다. 특히 기초과학분야에서 아주 오랜 전통을 갖고 있다. ""고 말했다. 대표적 학자로는 예술가이자 과학자인 레오나르도 다빈치와 갈릴레오 갈릴레이 등이 있다. 그는 ""양국간의 협력은 정부와 기관들의 도움을 필요로 하긴 하지만 결국 사람들 간의 관계가 가장 중요하다""며 ""그래서 오늘 이 자리가 의미있는 것""이라고 말했다. 델라 세타 대사는 이어 ""한국은 과학 연구에 투자를 많이 하고있는 나라""라며 ""이탈리아는 과학 분야에 있어 한국을 최우선의 파트너로 생각한다""고 전했다. 프란체스코 캉가넬라 주한이탈리아대사관 과학서기관도 ""이탈리아는 12명의 노벨과학상 수상자를 배출한 국가""라며 ""우주항공분야에서도 한국과 협력을 기대한다""고 말했다. [김하경 기자] r_start // r_end //"
한국경제TV,131220,/news/news_read.nhn?article_id=0000621086&office_id=215&mode=search&query=대한과학&page=1,2018-04-11 10:55,"대한과학, 전일 대비 약 4% 상승한 5,640원","[한국경제TV 라이온봇 기자] 대한과학은 4월 11일 10시 54분 전일 대비 약 4% 상승한 5,640원에 거래되고 있다. 대한과학은 코스닥 상장 기업으로 유통 업종에 속해 있다. 시가총액은 391억원으로 코스닥 상장기업 중 1,113위에 위치 해 있다. [종목 성향 진단] [그림 1] 종목 성향 진단 대한과학의 투자 스타일은 모호한 측면이 있으나 가치주라고 볼 수 있다. 기업 가치 대비 낮은 주가가 매력적인 기업이다. 주가 모멘텀은 부진한 편이었다. 최근 1개월 수익률은 -3.05%의 하락폭을 기록했다. 대한과학 종목에 대한 투자자의 관심도는 상대적으로 낮은 편이었다. [투자 점수 진단] [그림 2] 투자 점수 진단 대한과학은 효율성(ROA) 측면에서 두각을 나타내고 있다. 최근 ROA는 70점으로 6개의 핵심 팩터 중 가장 높은 점수를 기록했다. ROA는  전체 시장 내 496위를 기록하며 상위 29.55%에 위치했다. 업종별로는 51위를 기록하며 상위 27.32%에 위치했다. 그리고 안정성(부채비율) 역시 도드라지는 편이다. 안정성 점수는 66점으로 두번째로 높은 점수를 기록했다. 부채비율은 전체 시장 내 869위를 기록하며 상위 33.83%에 위치했다. 업종별로는 112위를 기록하며 상위 48.91%에 위치했다. 그러나 PBR과 매출증가율(YoY)은  아쉬움을 나타냈다. [종합 투자점수] [그림 3] 종합 투자점수 AI 인공지능 분석을 통한 대한과학의 종목 종합 스코어는 61점을 기록했다. 이는 동일 업종 평균점수인 52점과 시장 평균점수인 50점를 상회하는 수치였다. (위의 AI인공지능 점수는 재무 데이터를 기반으로 전체 상장 종목과 비교/분석하여 도출한 점수로 높은 점수가 반드시 높은 수익률을 보장하지 않습니다. 위의 자료는 당사의 추천 종목이 아니며, 투자 시 참고용으로 제시해드리는 것입니다.) 라이온봇 기자 -한국경제TV※ 본 기사는 한국경제TV와 '거장들의 투자공식이'자체 개발한 '라이온봇 기자'가 실시간으로 작성한 기사입니다. 라이온봇기자 ⓒ 한국경제TV, 무단 전재 및 재배포 금지 한국경제TV 관련뉴스해당 언론사에서 선정하며 언론사 페이지(아웃링크)로 이동해 볼 수 있습니다.레드벨벳 아이린 옆에 北 김정은, 실화야?""자연미인"" 셋째 출산에도 여전히 아름다운 '리설주'박근혜 선고 ""역대급 중형""스타일난다, 4천억 '신화'…김소희 대표 누구?고 장자연-단역 자매 사건 재수사…""내가 노리개인가"""
서울경제,131220,/news/news_read.nhn?article_id=0003267457&office_id=011&mode=search&query=대한과학&page=1,2018-04-11 14:19,"&lt;코&gt;대한과학, 전일 대비 7.22% 상승.. 일일회전율은 1.95% 기록","[서울경제] 대한과학(131220) 은 11일 오후 2시 18분 현재 7.22% 오른 5,790원에 거래되고 있으며, 45(매도):55(매수)의 매수우위를 기록하고 있다. 거래대금은 7억9,524만, 거래량은 14만1,219주로 거래량회전율은 1.95%로 나타났다. 지난 1개월간 대한과학은 상승 13회, 하락 16회를 기록했고, 주가수익률은 -4.46% 표준편차는 2.36%를 기록했다. 이 기간 ' 유통업 ' 업종 평균 주가수익률은 -15.18%로 나타났으며, 변동성은 2.61%를 기록했다. 이 시각 현재 ' 유통업 '은 0.67% 상승 중이며, 50(매도):50(매수)의 보합세를 보이고 있다"
뉴시스,131220,/news/news_read.nhn?article_id=0008526588&office_id=003&mode=search&query=대한과학&page=1,2018-04-04 15:39,"식량과학원-대한두채협회, 콩나물 소비확대 mou 체결",【서울=뉴시스】강종민 기자 = 4일 서울 양재동 aT센터에서 열린 농촌진흥청 국립식량과학원과 (사)대한두채협회가 국산 콩나물콩 자급률 향상과 소비 확대를 위한 업무협력(mou)를 체결하고 있다. 2018.04.04. (사진=농진청 제공)
파이낸셜뉴스,131220,/news/news_read.nhn?article_id=0004000001&office_id=014&mode=search&query=대한과학&page=1,2018-04-11 14:30,[fnRASSI]대한과학(131220) 전일대비 8.33% 상승,"대한과학(131220)은 현재 주가가 전일 대비 8.33% 상승한 5,850원 선에서 거래가 이루어지고 있다. 거래비중은 개인투자자가 가장 높아 최근 한달간 주체별 거래비중을 살펴보면 개인이 92%, 외국인이 7.95%, 기관은 0.03%를 기록했다. 그리고 최근 5일간 거래비중은 개인이 91.58%, 외국인이 8.41%를 보였고, 기관은 거래참여가 없었다. 상장주식수 대비 거래량은 0.64%로 적정수준 최근 한달간 대한과학의 상장주식수 대비 거래량을 비교해보니 일별 매매회전율이 0.64%로 집계됐다. 그리고 동기간 장중 저점과 고점의 차이인 일평균 주가변동률을 5.74%를 나타내고 있다. 'fnRASSI'는 증권전문 기업 씽크풀과 파이낸셜뉴스의 협업으로 로봇기자가 실시간으로 생산하는 기사입니다."
파이낸셜뉴스,131220,/news/news_read.nhn?article_id=0003894986&office_id=014&mode=search&query=대한과학&page=1,2017-10-26 09:51,"[fnRASSI]대한과학, 5.74% 오르며 거래량 증가","대한과학(131220)의 현재 거래량이 최근 5거래일 거래량의 최고치를 경신하며 투자자들의 관심을 받고 있다. 그리고 대한과학은 4일 연속 상승흐름을 보이며, 9시 48분 현재 5.74% 증가한 5,160원에 거래중이다. 개인,외국인만 거래 참여 최근 한달간 주체별 거래비중을 살펴보면 개인이 95.91%, 외국인이 4.08%를 보였고, 기관은 거래참여가 없었다. 그리고 최근 5일간 거래비중은 개인이 94.95%, 외국인이 5.04%를 보였고, 기관은 거래참여가 없었다. 상장주식수 대비 거래량은 0.61%로 적정수준 최근 한달간 대한과학의 상장주식수 대비 거래량을 비교해보니 일별 매매회전율이 0.61%로 집계됐다. 그리고 동기간 장중 저점과 고점의 차이인 일평균 주가변동률을 1.43%를 나타내고 있다. 'fnRASSI'는 증권전문 기업 씽크풀과 파이낸셜뉴스의 협업으로 로봇기자가 실시간으로 생산하는 기사입니다."
연합뉴스,131220,/news/news_read.nhn?article_id=0010254573&office_id=001&mode=search&query=대한과학&page=1,2018-08-06 17:38,대한과학 서정구&middot;서현정 공동대표 체제로 변경,(서울=연합뉴스) 전명훈 기자 = 대한과학은 기존 서정구 단독 대표 체제에서 서정구·서현정 공동대표 체제로 바뀐다고 6일 공시했다.
헤럴드경제,131220,/news/news_read.nhn?article_id=0001362805&office_id=016&mode=search&query=대한과학&page=1,2018-03-07 15:17,"[생생코스닥]대한과학, 주당 50원 현금배당 결정",[헤럴드경제=증권팀] 대한과학은 보통주 1주당 50원의 현금 결산배당을 결정했다고 7일 공시했다. 시가배당율은 0.9%이며 배당금총액은 3억5771만원이다.
아시아경제,131220,/news/news_read.nhn?article_id=0003937620&office_id=277&mode=search&query=대한과학&page=1,2017-02-21 17:54,대한과학 흑자전환&hellip;영업익 16억원,[아시아경제 임온유 기자] 대한과학은 지난해 매출액이 460억7095만원으로 10.7% 증가했다고 21일 공시했다. 영업이익은 16억4049만원으로 흑자전환했고 당기순이익도 22억2678만원으로 흑자전환했다.
서울경제,131220,/news/news_read.nhn?article_id=0003220950&office_id=011&mode=search&query=대한과학&page=1,2018-02-12 10:32,"(코)대한과학, 전일 대비 7.09% 상승.. 일일회전율은 1.76% 기록","[서울경제] 대한과학(131220) 은 12일 오전 10시 30분 현재 7.09% 오른 5,740원에 거래되고 있으며, 35(매도):65(매수)의 매수우위를 기록하고 있다. 거래대금은 7억1,674만, 거래량은 12만6,252주로 거래량회전율은 1.76%로 나타났다. 지난 1개월간 대한과학은 상승 12회, 하락 18회를 기록했고, 주가수익률은 9.33% 표준편차는 2.33%를 기록했다. 이 기간 ' 유통업 ' 업종 평균 주가수익률은 8.25%로 나타났으며, 변동성은 4.63%를 기록했다. 이 시각 현재 ' 유통업 '은 0.81% 상승 중이며, 48(매도):52(매수)의 매수우위를 기록하고 있다."
뉴시스,131220,/news/news_read.nhn?article_id=0007784671&office_id=003&mode=search&query=대한과학&page=1,2017-02-21 17:53,"대한과학, 작년 연결 영업익 16억&hellip;흑자전환",【서울=뉴시스】최예린 기자 = 의료·정밀·과학기기 도매업체 대한과학(131220)은 지난해 연결재무제표 기준 영업이익이 16억4049만원 규모로 전년 대비 흑자전환했다고 21일 공시했다. 같은 기간 매출액은 460억7095만원으로 10.7% 늘었고 당기순이익은 22억2678만원으로 흑자전환했다.
이데일리,131220,/news/news_read.nhn?article_id=0003755210&office_id=018&mode=search&query=대한과학&page=1,2017-02-21 17:52,"대한과학, 작년 연결 기준 영업익 흑자 전환","[이데일리 최정희 기자] 대한과학(131220)은 작년 연결 기준으로 매출액과 영업이익이 460억7000만원, 16억4000만원으로 전년동기보다 10.7% 증가, 흑자 전환에 성공했다고 21일 공시했다. 또 주당 40원을 현금배당키로 했다."
머니투데이,131220,/news/news_read.nhn?article_id=0003826022&office_id=008&mode=search&query=대한과학&page=1,2017-02-21 17:44,"대한과학, 당해 영업이익 16억&hellip; 흑자전환",[머니투데이 최민지 기자] 대한과학은 당해사업연도 매출액이 460억7095만원으로 10.7% 증가했다고 21일 공시했다. 영업이익은 16억4049만원으로 흑자전환했고 당기순이익도 22억2678만원으로 흑자전환했다. textlinktopstart textlinktopend textlinkstart
한국경제TV,131220,/news/news_read.nhn?article_id=0000606270&office_id=215&mode=search&query=대한과학&page=1,2018-02-27 10:57,"대한과학, 11% 급등... 전일 보다 620원 상승한 6,330원","[한국경제TV 라이온봇 기자] 대한과학은 2월 27일 10시 56분 전일 대비 약 11% 급등한 6,330원에 거래되고 있다. 대한과학은 코스닥 상장 기업으로 유통 업종에 속해 있다. 시가총액은 408억원으로 코스닥 상장기업 중 1,103위에 위치 해 있다. [종목 성향 진단] [그림 1] 종목 성향 진단 대한과학의 투자 스타일은 모호한 측면이 있으나 성장주라고 볼 수 있다. 주가 고평가 우려가 공존하지만 높은 성장성이 기대되는 기업이다. 주가 모멘텀은 평범한 수준이었다. 최근 1개월 수익률이 1.78%, 3개월 수익률은 0.35%, 6개월 수익률은 2.15%를 기록했다. 대한과학 종목에 대한 투자자의 관심도는 상대적으로 낮은 편이었다. [투자 점수 진단] [그림 2] 투자 점수 진단 대한과학은 안정성(부채비율) 측면에서 두각을 나타내고 있다. 최근 부채비율은 64점으로 6개의 핵심 팩터 중 가장 높은 점수를 기록했다. 부채비율은  전체 시장 내 734위를 기록하며 상위 35.91%에 위치했다. 업종별로는 110위를 기록하며 상위 52.26%에 위치했다. 그리고 효율성(ROA) 역시 도드라지는 편이다. 효율성 점수는 62점으로 두번째로 높은 점수를 기록했다. ROA는 전체 시장 내 722위를 기록하며 상위 37.53%에 위치했다. 업종별로는 76위를 기록하며 상위 38.46%에 위치했다. 그러나 매출증가율(YoY)과 PBR은  아쉬움을 나타냈다. [종합 투자점수] [그림 3] 종합 투자점수 AI 인공지능 분석을 통한 대한과학의 종목 종합 스코어는 50점을 기록했다. 이는 동일 업종 평균점수인 51점과 시장 평균점수인 57점를 하회하는 수치였다. (위의 AI인공지능 점수는 재무 데이터를 기반으로 전체 상장 종목과 비교/분석하여 도출한 점수로 높은 점수가 반드시 높은 수익률을 보장하지 않습니다. 위의 자료는 당사의 추천 종목이 아니며, 투자 시 참고용으로 제시해드리는 것입니다.) 라이온봇 기자 -한국경제TV※ 본 기사는 한국경제TV와 '거장들의 투자공식이'자체 개발한 '라이온봇 기자'가 실시간으로 작성한 기사입니다. 라이온봇기자 ⓒ 한국경제TV, 무단 전재 및 재배포 금지 한국경제TV 관련뉴스해당 언론사에서 선정하며 언론사 페이지(아웃링크)로 이동해 볼 수 있습니다.판커신 나쁜손 ""인정 못해""…中누리꾼 최민정 SNS에 악플테러'원조 청순女' 강수지 성형고백…'자연 미인 아니었나?'이윤택 기자회견 리허설, 짜고치기 고스톱?""법적 대응한다더니..."" 송하늘 조민기 성추행 폭로 '반전'왁스, 절친 홍석천 사생활 폭로? ""클럽 가면 사라진다"""
한국경제TV,131220,/news/news_read.nhn?article_id=0000606268&office_id=215&mode=search&query=대한과학&page=1,2018-02-27 10:54,"대한과학, 전일 대비 약 8% 상승한 6,160원","[한국경제TV 라이온봇 기자] 대한과학은 2월 27일 10시 54분 전일 대비 약 8% 상승한 6,160원에 거래되고 있다. 대한과학은 코스닥 상장 기업으로 유통 업종에 속해 있다. 시가총액은 408억원으로 코스닥 상장기업 중 1,103위에 위치 해 있다. [종목 성향 진단] [그림 1] 종목 성향 진단 대한과학의 투자 스타일은 모호한 측면이 있으나 성장주라고 볼 수 있다. 주가 고평가 우려가 공존하지만 높은 성장성이 기대되는 기업이다. 주가 모멘텀은 평범한 수준이었다. 최근 1개월 수익률이 1.78%, 3개월 수익률은 0.35%, 6개월 수익률은 2.15%를 기록했다. 대한과학 종목에 대한 투자자의 관심도는 상대적으로 낮은 편이었다. [투자 점수 진단] [그림 2] 투자 점수 진단 대한과학은 안정성(부채비율) 측면에서 두각을 나타내고 있다. 최근 부채비율은 64점으로 6개의 핵심 팩터 중 가장 높은 점수를 기록했다. 부채비율은  전체 시장 내 734위를 기록하며 상위 35.91%에 위치했다. 업종별로는 110위를 기록하며 상위 52.26%에 위치했다. 그리고 효율성(ROA) 역시 도드라지는 편이다. 효율성 점수는 62점으로 두번째로 높은 점수를 기록했다. ROA는 전체 시장 내 722위를 기록하며 상위 37.53%에 위치했다. 업종별로는 76위를 기록하며 상위 38.46%에 위치했다. 그러나 매출증가율(YoY)과 PBR은  아쉬움을 나타냈다. [종합 투자점수] [그림 3] 종합 투자점수 AI 인공지능 분석을 통한 대한과학의 종목 종합 스코어는 50점을 기록했다. 이는 동일 업종 평균점수인 51점과 시장 평균점수인 57점를 하회하는 수치였다. (위의 AI인공지능 점수는 재무 데이터를 기반으로 전체 상장 종목과 비교/분석하여 도출한 점수로 높은 점수가 반드시 높은 수익률을 보장하지 않습니다. 위의 자료는 당사의 추천 종목이 아니며, 투자 시 참고용으로 제시해드리는 것입니다.) 라이온봇 기자 -한국경제TV※ 본 기사는 한국경제TV와 '거장들의 투자공식이'자체 개발한 '라이온봇 기자'가 실시간으로 작성한 기사입니다. 라이온봇기자 ⓒ 한국경제TV, 무단 전재 및 재배포 금지 한국경제TV 관련뉴스해당 언론사에서 선정하며 언론사 페이지(아웃링크)로 이동해 볼 수 있습니다.판커신 나쁜손 ""인정 못해""…中누리꾼 최민정 SNS에 악플테러'원조 청순女' 강수지 성형고백…'자연 미인 아니었나?'이윤택 기자회견 리허설, 짜고치기 고스톱?""법적 대응한다더니..."" 송하늘 조민기 성추행 폭로 '반전'왁스, 절친 홍석천 사생활 폭로? ""클럽 가면 사라진다"""
뉴시스,131220,/news/news_read.nhn?article_id=0008717572&office_id=003&mode=search&query=대한과학&page=1,2018-07-21 09:18,대한상의 포럼에서 강연하는 장동선 뇌과학자,【서울=뉴시스】21일 제주 신라호텔에서 대한상공회의소가 개최한 제43회 대한상의 제주포럼에서 장동선 뇌과학자가 강연을 하고 있다. 2018.07.21. (사진=대한상공회의소 제공)
머니투데이,131220,/news/news_read.nhn?article_id=0003830022&office_id=008&mode=search&query=대한과학&page=1,2017-02-28 16:23,"대한과학, 정철의 사외이사 중도퇴임",[머니투데이 박다해 기자] 대한과학은 정철의 사외이사가 일신상의 사유로 중도퇴임했다고 28일 공시했다. textlinktopstart textlinktopend textlinkstart
