source,symbol,link,date,title,content
코메디닷컴,138610,/news/news_read.nhn?article_id=0000033201&office_id=296&mode=search&query=나이벡&page=1,2017-09-19 12:28,"나이벡, 펩타이드 기반 임플란트 미국 특허 등록","펩타이드 헬스 케어 전문 기업 나이벡이 펩타이드를 기반으로 한 임플란트 기술 관련 미국 특허를 등록했다고 19일 밝혔다. 이 특허는 '지르코니아 결합능을 가지는 펩타이드(Peptide Having Zirconia Binding Affinity)'로 지르코니아 임플란트 표면에 특이적으로 결합하는 펩타이드에 관한 것이다. 지르코니아는 치과에서 사용하는 세라믹 재료 가운데 가장 강도가 높고 심미성이 뛰어나 치아를 대신하는 재료로 많이 사용된다. 이번 특허의 기술은 지르코니아 표면에 기능성 약물이 추가된 펩타이드를 고정시켜 장시간 동안 약물의 활성이 유지되도록 한다. 회사 관계자는 ""지르코니아는 금속 알레르기에 대한 최적의 대체제로 이번 펩타이드 결합을 통해 생체 친화성 또한 갖췄다""며 ""이번 펩타이드를 통해 외과 재생 치료 이외에도 다른 시술 재료에도 결합이 가능할 것으로 기대하고 있다""고 말했다. 노인의 경우에는 치아 골량이 부족하거나 골질 저하로 임플란트 식립 자체가 어려운 경우가 많지만, 본 특허 관련 기술 적용 시 임플란트 수술 초기 단계에 안정성을 확보하여 수술 성공률을 높일 수 있다는 장점이 있다. 실제로 내년 7월부터 시행되는 문재인 케어 국민건강보험 제도에 치과용 임플란트의 본인 부담 비율이 50%에서 30%로 대폭 축소되기 때문에 임플란트의 수요는 계속해서 증가할 전망이다. 나이벡 관계자는 ""이번 특허는 지난 해 11월에 국내 특허 등록을 완료하였으며, 이번 미국 특허 등록을 통해 해외 시장 진출도 활발히 준비 중""이라며 ""특히, 지난 6일 특허 등록한 하이브리드 일체형 임플란트 기술을 비롯해 이번 특허 관련 기술에 대해 글로벌 임플란트 전문 기업과 치과 분야 적용을 검토하고 있다""라고 덧붙였다. 나이벡은 펩타이드 전문 기업으로 펩타이드 관련 기술을 기반으로 치과용 정형외과용 바이오소재 및 관절염과 골다공증, 항암 치료제 등 의약품 시장으로의 진출로 사업 영역을 확대하고 있다."
아시아경제,138610,/news/news_read.nhn?article_id=0003577310&office_id=277&mode=search&query=나이벡&page=1,2015-09-04 10:03,"나이벡, 주주배정 유상증자 청약률 108%","[아시아경제 최동현 기자] 나이벡은 구주주를 대상으로 실시한 주주배정 유상증자의 청약률이 108.98%를 기록했다고 4일 공시했다. 예정발행주식 수는 80만주, 청약주식 수는 87만1819주다."
이데일리,138610,/news/news_read.nhn?article_id=0003349489&office_id=018&mode=search&query=나이벡&page=1,2015-09-17 10:30,"나이벡, 치아미백 제품 &lsquo;블랑티스 프리미엄&rsquo; 판매 시작",- 식품의약품안전처로부터 판매 허가 획득 [이데일리 이명철 기자] 나이벡(138610)은 식품의약품안전처(KFDA)로부터 오피스 브리치용 치아미백제인 ‘블랑티스 프리미엄’ 판매 허가를 받아 시판에 들어갔다고 17일 밝혔다. 오피스 브리칭은 치과병원에서 전문가로부터 처치를 받는 치아미백으로 발광다이오드(LED) 치료를 활용해 치아미백의 효과를 얻을 수 있는 방식을 말한다. 회사는 2008년 9월 일반용 치아미백제를 론칭하고 제품을 공급 중이다. 지난 4월 수출용 치아미백제를 시작으로 지금까지 7개의 전문의약품 허가를 받았다. 수출용 4개 품목은 미국으로 수출 중이다. 회사 관계자는 “국내 홈브리칭 치아미백제의 관심이 커져갈 시점에 오피스 브리치용 제품 허가를 획득해 국내 마케팅에 적극 대응할 계획”이라며 “일반인용 치아미백제 닥터화이티스는 현재 러시아의 허가를 진행 중으로 수출 소식도 기대하고 있다”고 전했다. 한편 나이벡은 서울대 전 교육과학기술부 산하 한국과학재단(현 미래창조과학부)이 지원한 연구결과를 상용화해 2004년 1월 설립했다. 2011년 7월 코스닥시장에 상장했다.
매일경제,138610,/news/news_read.nhn?article_id=0003572553&office_id=009&mode=search&query=나이벡&page=1,2015-09-15 16:19,"나이벡, 전환가액 6770원으로 하향 조정","의약 관련제품 제조업체 나이벡은 유상증자에 따라 전환가액을 기존 7121원에서 6770원으로 하향 조정한다고 15일 공시했다. 이에 따라 전환 가능한 주식 수는 기존 28만859주에서 29만5420주로 증가했다. [매경닷컴 김경택 기자] r_start // r_end // [ⓒ 매일경제 & mk.co.kr, 무단전재 및 재배포 금지] 매일경제 관련뉴스해당 언론사에서 선정하며 언론사 페이지(아웃링크)로 이동해 볼 수 있습니다.박샤론, 과거 노출 화보서 '물방울 가슴+황금골반' 자랑 ""男心 완전 멘붕""강정호, 동점 적시타 맹활약...팀은 대역전승라미란 ""엉덩이 노출신 확산, 자제를 부탁한다""힐러리, 방송서 춤도 춰봤지만 대세론은 저멀리…어쩌나'스포츠여신' 홀딱 벗었다! '알몸 방송' 논란…""팬티까지 다 벗은 후…"" 헉!"
한국경제,138610,/news/news_read.nhn?article_id=0003422528&office_id=015&mode=search&query=나이벡&page=1,2015-09-04 09:57,"나이벡, 주주배정 유증 청약률 108%","[ 정현영 기자  ] 나이벡은 4일 자율공시를 통해 구주주를 대상으로 실시한 주주배정 유상증자의 청약률이 108.98%를 기록했다고 밝혔다. 예정발행주식 수는 80만주, 청약주식 수는 87만1819주로 집계됐다. 정현영 한경닷컴 기자"
한국경제,138610,/news/news_read.nhn?article_id=0003603740&office_id=015&mode=search&query=나이벡&page=1,2016-06-02 14:24,"나이벡, 단백질&middot;미네랄 복합 조직재생제 특허 기술 등록완료","[ 채선희 기자  ] 펩타이드 전문기업인 나이벡은 2일 조직 재생을 극대화할 수 있는 기술을 특허 등록 완료했다고 밝혔다. 특허 명칭은 '세포외기질 단백질-골미네랄 복합체를 함유하는 조직 구조 모사체 및 그 제조방법'이며 손상된 조직을 치유하는데 이상적인 생체환경을 제공, 치료효과를 극대화할 수 있는 기술이 핵심이다. 사측은 특허 내용에 대해 ""생체환경을 모방할 수 있는 콜라겐, 히알루론산, 콘드로이틴 등을 포함하는 세포외기질단백질과 바이오소재를 융합, 가공하고 조직재생기능 생리활성이 있는 펩타이드를 함유하도록 한 것""이라며 ""기존 바이오소재가 지니는 제한적인 재생치료효과를 높일 수 있는 기술을 제공하는 것""이라고 설명했다. 특허 관련 기술이 우선 탑재된 제품은 나이벡의 골재생복합재료 'OCS-B Collagen'과 'Equimatrix Collagen'이 있다. 특히 'OCS-B Collagen'는 기존 골이식재와 고순도로 정제된 바이오콜라겐을 가공해 골재생에 유리한 환경을 조성해준다. 또 일정시간 이후에 콜라겐이 분해되어 신속하게 골재생으로 치환되게 해주는 제품이다. 나이벡은 특허 관련 기술력을 바탕으로 OCS-B Collagen에 대해 지난해 미국 FDA 승인을 획득했다. 현재는 글로벌 바이오소재 기업인 노벨바이오케어를 통해 미국에 수출하고 있으며 각국의 인증절차가 진행중이다. 나이벡의 관계자는 ""이번에 특허 등록 완료한 기술은 향후 조직재생기능성 펩타이드를 융합한 복합 골재생제에도 적용될 예정""이라며 ""노인이나 만성병환자의 골재생치료에도 기대가 크다""고 말했다. 이어 ""해당 특허기술을 바탕으로 골재생치료 바이오소재의 라인업 구축이 이뤄졌다""며 ""동시에 인증결과에 따라 국내 및 해외수출 증가로 이어져 매출에도 긍정적인 효과를 기대할 수 있을 것""이라고 덧붙였다. 채선희 한경닷컴 기자"
파이낸셜뉴스,138610,/news/news_read.nhn?article_id=0003505529&office_id=014&mode=search&query=나이벡&page=1,2015-09-17 10:32,"나이벡, 오피스 브리치용 치아미백제 '블링티스 프리미엄' 판매 허가","코스닥 상장회사 나이벡 이 전문의약품인 오피스 브리치용 치아미백제 판매 허가를 획득하고 시판에 들어간다. 나이벡 은 전문의약품인 최근 식품의약품안전처(KFDA)로부터 오피스 브리치용 치아미백제 '블링티스 프리미엄'의 판매 허가를 받았다고 17일 밝혔다. 오피스 브리칭이란, 치과병원에서 전문가로부터 처치를 받는 치아미백으로 LED 광선치료를 활용해 신속하게 치아미백의 효과를 얻을 수 있는 미백 방법이다. 나이벡 은 지난 2008년 9월 일반용 치아미백제 런칭을 시작으로 현재까지 계속해서 품질 업그레이드를 통해 국내에 제품을 공급해오고 있다. 나이벡 의 치아미백제는 지난 4월 수출용 치아미백제를 시작으로 현재까지 전문의약품으로 총 7개에 대한 허가를 받아 국내 최초로 치아미백제 라인업이 완성됐다. 이 중 수출용 4품목은 현재 미국으로 수출중이다. 나이벡 관계자는 ""국내에서 홈브리칭 치아미백제의 관심이 커져갈 시점에 오피스 브리치용 제품 허가를 획득하게 되어 국내 마케팅에 적극적으로 대응할 계획이며 특히 일반인용 치아미백제 '닥터화이티스'는 현재 러시아의 허가를 진행 중에 있어 화장품에 이어 수출 소식도 기대하고 있다""고 밝혔다."
아시아경제,138610,/news/news_read.nhn?article_id=0003729434&office_id=277&mode=search&query=나이벡&page=1,2016-04-18 10:40,"[특징주]나이벡, 中CFDA로부터 화장품 위생허가 취득 소식에&uarr;","[아시아경제 최동현 기자] 나이벡이 중국 식품의약품관리총국(CFDA)로부터 화장품 제품 '닥터마이유'의 위생허가를 취득했다는 소식에 급등세다. 18일 오전 10시38분 현재 나이벡은 전장대비 1450원(13.62%) 오른 1만2100원을 기록중이다. 나이벡 관계자는 ""중국 위생허가 승인을 바탕으로 시장진입을 위해 총력을 기울일 예정""이라며 ""대대적인 마케팅을 통해 중국시장에 나이벡의 인지도를 향상시킬 것""이라고 설명했다."
뉴시스,138610,/news/news_read.nhn?article_id=0007266858&office_id=003&mode=search&query=나이벡&page=1,2016-06-02 14:14,"나이벡, 조직구조 모사체&middot;제조방법 관련 특허 취득","【서울=뉴시스】최예린 기자 = 의료용품 및 기타 의약관련제품 제조업체 나이벡(138610)은 세포외기질 단백질·골미네랄 복합체를 함유하는 조직 구조 모사체 및 그 제조방법 관련 특허권을 취득했다고 2일 공시했다. 회사 측은 ""이 특허 기술을 펩타이드융합 골재생용 복합재료 제품의 개발 및 상품화에 적용계획""이라고 밝혔다."
한국경제,138610,/news/news_read.nhn?article_id=0003433033&office_id=015&mode=search&query=나이벡&page=1,2015-09-17 15:50,"나이벡, 치아미백제 '블링티스 프리미엄' 판매","[ 박상재 기자  ] 나이벡이 치아미백제 '블링티스 프리미엄'을 판매한다고 17일 밝혔다. 블링티스 프리미엄은 식품의약품안전처로부터 판매 허가를 받은 오피스 브리칭용 치아미백제다. 오피스 브리칭은 치과에서 발광 다이오드(LED) 광선을 활용해 치아 미백 효과를 얻는 치료법이다. 1~2시간 내에 미백 효과를 얻을 수 있는 것이 장점이라고 회사 측은 설명했다. 나이벡은 지금까지 전문의약품 치아미백제 7종을 허가 받았으며, 이중 4품목을 미국으로 수출했다. 박상재 한경닷컴 기자"
한국경제,138610,/news/news_read.nhn?article_id=0003825311&office_id=015&mode=search&query=나이벡&page=1,2017-09-19 10:25,"나이벡, 바이오임플란트 활성 부여 펩타이드 美 특허 등록","[ 한민수 기자  ] 나이벡은 펩타이드를 기반으로 한 임플란트 기술에 대한 미국 특허를 등록했다고 19일 밝혔다. 이번 기술은 지르코니아 임플란트 표면에 특이적으로 결합하는 펩타이드에 관한 것이다. 지르코니아는 치과에서 사용하는 세라믹 재료 중 가장 강도가 높고 심미성이 뛰어나 많이 사용된다는 설명이다. 이번 특허는 지르코니아 표면에 기능성 약물이 추가된 펩타이드를 고정시켜 장시간 동안 약효가 유지되도록 한다. 나이벡 관계자는 ""지르코니아는 금속 알러지에 대한 최적의 대체제""라며 ""이번 펩타이드 결합 기술을 통해 생체친화성 또한 갖췄다""고 말했다. 이어 ""이번 펩타이드를 외과 재생치료 이외에도 다른 시술 재료에도 결합할 수 있을 것으로 기대하고 있다""고 했다. 노인의 경우에는 치아의 골량이 부족하거나 골질 저하로 인해 임플란트 식립 자체가 어려운 경우가 많다. 그러나 이번 기술을 적용하면 수술 성공률을 높일 수 있다는 설명이다. 나이벡은 글로벌 임플란트 전문기업들과 보유 특허의 치과 분야 적용을 검토하고 있다."
헤럴드경제,138610,/news/news_read.nhn?article_id=0001061157&office_id=016&mode=search&query=나이벡&page=1,2016-06-02 14:10,"나이벡, 조직 구조 모사체 관련 특허취득",[헤럴드경제=박영훈 기자] 나이벡은 세포외기질 단백질-골미네랄 복합체를 함유하는 조직 구조 모사체 및 그 제조방법에 관한 특허권을 취득했다고 2일 공시했다. 회사측은 “세포외기질 단백질-골미네랄 성분의 복합체와 재생기능성 펩타이드를 결합시켜 회복을 요하는 조직의 환경을 구현해 조직재생력을 극대화 할 수 있는 기술”이라며 “펩타이드융합 골재생용 복합재료 제품의 개발 및 상품화에 적용할 계획”이라고 밝혔다.
머니투데이,138610,/news/news_read.nhn?article_id=0003545066&office_id=008&mode=search&query=나이벡&page=1,2015-09-17 10:30,"나이벡, 치과병원 치료용 치아미백제 출시","[머니투데이 김도윤 기자] 나이벡은 식품의약품안전처(KFDA)로부터 치과병원 전문치료용 치아미백제 '블랑티스 프리미엄'에 대한 판매허가를 획득하고 판매를 시작했다고 17일 밝혔다. 이 제품을 활용하면 LED(발광다이오드) 광선 치료를 통해 비교적 신속하게 치아미백의 효과를 얻을 수 있다고 회사측은 설명했다. 나이벡은 2008년 9월 일반용 치아미백제 출시를 시작으로 현재까지 꾸준히 관련 제품을 개발 및 판매하고 있다. 이미 국내뿐 아니라 수출용 치아미백제 4품목을 미국으로 수출중이다. 나이벡 관계자는 ""국내에서 치과병원용 치아미백제에 대한 관심이 커져가는 가운데 관련 제품에 대한 허가를 획득했다""며 ""이를 통해 치아미백제 7품목에 대한 허가를 획득함으로써 제품 라인업을 완성한 만큼 앞으로 마케팅에 적극적으로 나서겠다""고 말했다. textlinktopstart textlinktopend textlinkstart"
한국경제TV,138610,/news/news_read.nhn?article_id=0000454561&office_id=215&mode=search&query=나이벡&page=1,2016-04-18 11:18,"나이벡, 마유 화장품 중국 판매허가 획득","[한국경제TV 김치형 기자] 나이벡(대표: 정종평)은 자사의 마유 (馬油)화장품이 중국 식약처(CFDA)로부터 최근 공식 판매 허가를 받았다고 18일 밝혔습니다. 이번에 중국으로부터 '닥터 마이유/Dr.MyYou'라는 브랜드명으로 판매 허가를 받은 나이벡 화장품은 고순도 펩타이드와 마유(馬油)가 함유된 에센스와 마스크 팩 2종류입니다. 나이벡이 자체 개발한 이 제품은 고순도 펩타이드 성분이 함유돼 있어 이를 사용할 경우 피부 탄력에 도움을 주며, 사람의 피부와 같은 순수 마유(馬油) 성분으로 인해 피하 조직까지 영양 및 수분의 흡수를 도와줍니다. '닥터 마이유/Dr.MyYou'는 현재 미국과 러시아 등 해외로 수출이 이뤄지고 있습니다. 나이벡 관계자는 “이번에 중국 판매허가를 받은 만큼 중국내 화장품 시장 공략을 위해 각종 마케팅 활동을 전개하고 이를 바탕으로 화장품 수출을 큰 폭으로 늘리는데 총력을 기울이겠다 ”고 밝혔습니다. 나이벡은 또한 이번 판매허가를 받은 '닥터마이유'에 이어 후속 제품인 '유스텔라/EUSTELLA'에 대해서도 현재 중국 위생허가를 진행하고 있다고 덧붙였습니다."
이데일리,138610,/news/news_read.nhn?article_id=0003564194&office_id=018&mode=search&query=나이벡&page=1,2016-06-14 13:32,"나이벡, 용산면세백화점 입점 계약","[이데일리 임성영 기자] 펩타이드 전문기업나이벡(138610)이 용산면세백화점에 입점한다고 14일 밝혔다. 용산면세백화점은 현재 용산 전자랜드 위치에 5000평 이상의 국내 최대 규모인 사후면세점으로 7월에 오픈 예정이며 국내에서 생산된 화장품 등의 다양한 품목을 전시·판매할 예정이다. 사후면세점은 세금이 포함된 제품을 구입한 뒤 출국장에서 세금을 돌려받는 매장으로 ‘텍스리펀샵’으로 불린다. 현재 전국의 사후면세점은 7600여 개로 올해 시장 규모는 2조7000억원으로 추정된다. 용산면세백화점은 이번에 입점한 업체를 대상으로 중국 백화점과 보세구역에 다양한 한국 상품을 공급하기 위해 중국 업체들과 양해각서(MOU)를 체결하고 있으며, 오픈 전에 중국 수출을 먼저 이뤄낼 계획이다. 나이벡은 자체 브랜드인 닥터마이유, 유스텔라, 닥터화이티스, 닥터블랑티스 화장품 및 치아미백제 등 뷰티제품을 계약 체결했다. 나이벡 관계자는 “이번 입점을 통해 중국 진출과 외국중소상인으로 도매판매 등 판매경로를 다각화할 예정”이라며 “SM면세점과 용산면세백화점 입점 등 지속적인 요우커를 대상으로 한 마케팅을 통해 화장품과 치아미백제 등 대표 뷰티제품의 수출 증대에 노력중이다”고 말했다. 나이벡은 서울대학교 치의학대학원 지능형 생체계면공학 연구센터의 연구결과를 상용화해 지난 2004년 1월 설립했다. 2011년 7월 코스닥 시장 신성장 기업부에 상장됐다."
이데일리,138610,/news/news_read.nhn?article_id=0003396373&office_id=018&mode=search&query=나이벡&page=1,2015-11-16 16:30,"나이벡, 올해 예상 영업이익 2.4억서 6.6억 손실로 변경",[이데일리 이명철 기자] 나이벡(138610)은 올해 해외인증 지연에 의한 매출 감소로 올해 예상 매출액을 62억8000만원에서 49억9500만원으로 정정한다고 16일 공시했다. 영업손익은 2억3900만원 이익에서 6억6200만원 손실로 변경했다.
연합뉴스,138610,/news/news_read.nhn?article_id=0008340463&office_id=001&mode=search&query=나이벡&page=1,2016-04-18 11:54,"나이벡, '닥터마이유' 화장품 중국 위생허가 획득","(서울=연합뉴스) 김잔디 기자 = 펩타이드 전문기업 나이벡은 고기능성 화장품 '닥터마이유'의 에센스와 마스크팩 2종이 중국 식품의약품감독관리총국(CFDA)으로부터 위생허가를 획득했다고 18일 밝혔다. 회사 측은 ""닥터마이유는 나이벡이 직접 생산한 고순도 펩타이드와 마유(馬油)가 함유돼 피부 탄력 개선에 도움을 주는 고기능성 화장품""이라며 ""이번 위생허가 승인을 바탕으로 중국 시장 진입을 위해 총력을 기울일 예정""이라고 말했다."
아시아경제,138610,/news/news_read.nhn?article_id=0003783523&office_id=277&mode=search&query=나이벡&page=1,2016-07-08 09:42,"나이벡, 줄기세포 재생 관련 특허권 취득",[아시아경제 김민영 기자] 나이벡은 줄기세포 재생 또는 증식능 향상용 세포 침투성 융합 단백질(Cell Permeable Fusion Protein for Strengthening Regenerative Potential of Stem Cells)에 대한 특허권을 취득했다고 8일 공시했다.
파이낸셜뉴스,138610,/news/news_read.nhn?article_id=0003561473&office_id=014&mode=search&query=나이벡&page=1,2015-12-15 13:20,"나이벡, 글로벌 의료기기 업체와 수출 계약","나이벡이 펩타이드융합 골이식재료를 포함한 뼈이식재 주력제품을 세계 최상위 글로벌 의료기기 업체와 지난 14일 공급 계약을 체결했다고 15일 밝혔다. 총 공급규모는 미화 648만4400 달러, 한화 76억 5000여만원이며, 공급기간은 2016년 1월부터 2021년 12월까지이다. 이는 2014년도 매출액 기준 159%에 해당하는 공급계약으로 매년 13억원 가량의 매출 규모다. 또한, 판매지역은 전 세계로, 공급계약을 체결한 품목은 뼈형성펩타이드가 융합된 골이식재 'OssGen-X15', 뼈이식재인 'OCS-B'와 'OCS-B collagen' 세 가지 제품이다. 나이벡의 뼈형성 펩타이드는 최적의 뼈재생 표면을 제공하는 생리활성 펩타이드로서, 미래창조과학부의 바이오의료기술개발사업(국민 8대건강문제 해결사업)의 R&D 과제 지원을 받아 나이벡이 세계 최초로 발굴, 상용화한 펩타이드다. 이는 향후 노인성골질환, 골다공증, 만성질환자의 뼈형성에 필수적인 치료제로 자리잡을 전망인데, 이번 최상위 글로벌 의료기기 업체와의 수출계약으로 확고한 판매망을 구축하고 수출이 진행될 것으로 예상된다. 나이벡의 대표제품인 'OCS-B'는 소뼈 유래 골 이식재로, 이미 미국 유럽, 캐나다, 대만 등 수출을 하고 있다. 또한 'OCS-B collagen'은 OCS-B에 콜라겐이 함유된 골이식 복합재료로서, 뛰어난 신생골을 형성해주는 제품이다. 나이벡 관계자는 ""전 세계 유일한 생리활성 펩타이드의 상용화 플랫폼을 구축한 상태에서 해당 제품의 수출 계약이 이루어진 것은 기술력이 입증된 것""이라며 ""펩타이드의 바이오 소재로의 응용이 임플란트 등 필요한 곳에 활용될 수 있어 추가적인 적용도 가능하다""고 밝혔다. 또한 ”이미 기존 골이식재료가 미국 유럽 대만 등으로 제품을 수출하고 있는 가운데 세계 최상위 글로벌 의료기기 업체와의 계약이 이뤄진 것이어서 앞으로 수출 관련 매출 신장을 기대하고 있다”며 “또한 계약 체결한 품목 외 다른 품목들도 인허가가 완료되고 마케팅에 총력을 다 해 수출 계약으로 이뤄질 수 있게 노력 하고 있다”고 밝혔다."
이데일리,138610,/news/news_read.nhn?article_id=0003582617&office_id=018&mode=search&query=나이벡&page=1,2016-07-08 09:39,"나이벡, 줄기세포 침투 단백질 관련 美 특허 취득","[이데일리 이재호 기자] 나이벡(138610)은 줄기세포 재생 또는 증식능 항상용 세포 침투성 융합 단백질에 관한 미국 특허를 취득했다고 8일 공시했다. 이 특허는 신약과 줄기세포 치료물질에 관한 것으로 세포에 대한 독성이나 부작용 없이 줄기세포 재상, 증식 및 분화를 촉진하는 단백질을 세포 안으로 침투시킬 수 있다. 회사 측은 “줄기세포 이식 성공률을 높이고 골조직의 선택적 재생 및 분화를 달성할 수 있어 세포치료제 개발에 활용 가능하다”고 설명했다."
이데일리,138610,/news/news_read.nhn?article_id=0003523630&office_id=018&mode=search&query=나이벡&page=1,2016-04-18 11:37,"나이벡, 고기능 화장품 &lsquo;닥터마이유&rsquo; 중국 위생허가 획득",- 후속 제품 ‘유스텔라’도 추진 중… 해외 진출 박차 [이데일리 이명철 기자] 펩타이드 전문기업 나이벡(138610)은 고기능성 화장품 ‘닥터마이유’가 중국 식품의약품감독관리총국(CFDA)으로부터 위생허가를 획득했다고 18일 밝혔다. 닥터마이유는 지난해 6월 론칭해 러시아·미국으로 수출되는 제품이다. 이번에 위생허가를 받은 제품은 펩타이드와 마유(馬油)가 함유된 에센스·마스크팩 2종이다. 회사가 직접 생산한 고순도 펩타이드가 함유돼 즉각 피부 탄력 개선에 도움을 준다. 순수 마유는 사람의 피지와 성분이 비슷해 영양·수분 흡수를 피하조직까지 돕는다. 회사는 최근 대만 식약청으로부터 치주조직 재생제인 가이도스(GuidOss) 판매 허가를 획득하는 등 해외수출 준비를 진행 중이다. 닥터마이유 후속제품으로 고함량 펩타이드가 함유된 주픔 개선 기능성 화장품 ‘유스텔라’도 중국 위생허가를 진행하고 있어 중국 진출에 박차를 가할 계획이다. 회사 관계자는 “중국 제품 수출을 위한 위생허가승인을 바탕으로 시장 진입을 위해 총력을 기울일 것”이라며 “대대적인 마케팅으로 중국 시장에서 인지도를 향상시키겠다”고 전했다.
