source,symbol,link,date,title,content
머니투데이,138610,/news/news_read.nhn?article_id=0003596838&office_id=008&mode=search&query=나이벡&page=1,2015-12-15 09:29,"나이벡, 76억 규모 치과용 골이식재 공급계약 체결",[머니투데이 진경진 기자] 나이벡은 76억원 규모의 치과용 골이식재 공급계약을 체결했다고 15일 밝혔다. 이는 매출액 대비 159.8%에 해당하는 규모다. textlinktopstart textlinktopend textlinkstart
한국경제,138610,/news/news_read.nhn?article_id=0003621847&office_id=015&mode=search&query=나이벡&page=1,2016-07-08 09:45,"나이벡, 줄기세포 재생&middot;세포 침투성 단백질 관련 특허 취득","[ 채선희 기자  ] 나이벡은 줄기세포 재생 또는 증식능 향상용 세포 침투성 융합 단백질에 대한 특허권을 취득했다고 8일 공시했다. 사측은 ""신약과 줄기세포 치료물질에 관한 것""이라며 ""줄기세포의 분화촉진능, 세포 사멸 억제능, 줄기세포의 기능성 유지 및 스트레스에 의해 억제된 줄기세포의 기능성을 회복하기 위한 줄기세포 재생 강화용 세포 침투성 펩타이드 융합 단백질""이라고 설명했다. 채선희 한경닷컴 기자"
한국경제,138610,/news/news_read.nhn?article_id=0003621854&office_id=015&mode=search&query=나이벡&page=1,2016-07-08 10:03,"[특징주]나이벡, 줄기세포 재생 특허 취득 소식에 '급등'","[ 조아라 기자  ] 나이벡이 줄기세포 재생 및 세포 침투성 단백질 관련 특허권 취득소식에 급등세다. 8일 오전 9시55분 현재 나이벡은 전날보다 1450원(12.78%) 상승한 1만2800원에 거래되고 있다. 이날 나이벡은 줄기세포 재생 또는 증식능 향상용 세포 침투성 융합 단백질에 대한 특허권을 취득했다고 공시했다. 사측은 ""신약과 줄기세포 치료물질에 관한 것""이라며 ""줄기세포의 분화촉진능, 세포 사멸 억제능, 줄기세포의 기능성 유지 및 스트레스에 의해 억제된 줄기세포의 기능성을 회복하기 위한 줄기세포 재생 강화용 세포 침투성 펩타이드 융합 단백질""이라고 설명했다. 조아라 한경닷컴 기자"
이데일리,138610,/news/news_read.nhn?article_id=0003425550&office_id=018&mode=search&query=나이벡&page=1,2015-12-15 09:29,"나이벡, 76억 규모 치과용 골이식재 공급계약",[이데일리 임성영 기자] 나이벡(138610)은 76억4900만원 규모의 치과용 골이식재 공급계약을 체결했다고 15일 공시했다. 이는 최근 매출액의 159.83%에 해당하는 규모다. 계약기간은 내년 1월 1일부터 2021년 12월 31일 까지다. 계약상대방은 밝히지 않았다. 회사측은 “계약금액은 최소 구매수량 기준”이라며 “계약상대방이 최소 구매수량을 이행하지 않으면 계약이 해지될 수 있다”고 설명했다.
머니투데이,138610,/news/news_read.nhn?article_id=0003983274&office_id=008&mode=search&query=나이벡&page=1,2017-12-22 16:51,"나이벡, 50억원 규모 CB발행 결정",[머니투데이 안재용 기자] 나이벡 은 50억원 규모 전환사채를 발행키로 결정했다고 22일 공시했다.
이데일리,138610,/news/news_read.nhn?article_id=0003425542&office_id=018&mode=search&query=나이벡&page=1,2015-12-15 09:25,"[특징주]나이벡, 美 FDA 승인 소식에 강세 전환",[이데일리 정병묵 기자] 나이벡(138610)이 콜라겐 이식재 미국 식품의약국안전처(FDA) 승인 소식에 강세다. 나이벡은 15일 오전 9시22분 현재 전날보다 8.54% 내린 1만850원에 거래되고 있다. 나이벡은 전날 콜라겐 이식재인 ‘리제노머’가 최근 미국 FDA로부터 판매 허가를 받았다고 밝혔다. 콜라겐으로 구성된 리제노머는 치아를 뽑은 후 상처 치유 및 세포활성 유도에 의해 골조직 재생을 촉진하거나 치조골 결손부의 치주조직 재생을 촉진하는 형태의 이식재다.
헤럴드경제,138610,/news/news_read.nhn?article_id=0000938938&office_id=016&mode=search&query=나이벡&page=1,2015-12-15 09:24,"&lt;생생코스닥&gt; 나이벡, 76.5억 규모 치과용 골이식재 공급계약",나이벡은 76억4964만원 규모의 치과용 골이식재 공급계약을 체결했다고 15일 공시했다. 이는 2014년 매출액 대비 159.83%에 해당하며 계약기간은 2016년 1월 1일부터 2021년 12월 31일까지다.
이데일리,138610,/news/news_read.nhn?article_id=0003582631&office_id=018&mode=search&query=나이벡&page=1,2016-07-08 09:54,"[특징주]나이벡, 급등&hellip;줄기세포 관련 美 특허 취득",[이데일리 이명철 기자] 펩타이드 전문기업 나이벡(138610)이 미국에서 줄기세포 침투 단백질 관련 특허를 취득했다는 소식에 강세다. 8일 오전 9시53분 현재 나이벡 주가는 전일대비 11.01% 오른 1만2600원을 기록 중이다. 전날 하락했지만 하루만에 상승 전환했다. 줄기세포 이식 성공률을 높이고 골 조직으로의 선택 재생·분화를 달성하는 신기술 개발에 따른 기대감이 매수세로 유입되고 있다. 회사는 이날 줄기세포 재생 강화용 세포 침투성 펩타이드 융합 단백질에 관한 미국 특허를 등록했다고 밝혔다. 세포에 대한 독성·부작용 없이 줄기세포 재생·증식·분화를 촉진시키는 단백질을 줄기세포 안으로 침투하게 하는 기술이다. 골질환 치료용 약학 조성 주사제나 기능성 식품 등에 접목해 골질환 치료를 위한 치료물질로 상용화될 것으로 기대했다. 회사 관계자는 “줄기세포 이식성공률을 높이고 골조직 재생도 가능한 신약 개발과 줄기세포 치료제 관련 연구가 활발히 진행 중”이라고 전했다.
연합뉴스,138610,/news/news_read.nhn?article_id=0009769067&office_id=001&mode=search&query=나이벡&page=1,2017-12-22 16:53,"나이벡, 50억원 규모 전환사채 발행",(서울=연합뉴스) 전명훈 기자 = 코스닥 상장사 나이백은 운영자금 50억원 마련을 위해 무기명식 이권부 무보증 사모 전환사채를 발행한다고 22일 공시했다. 사채 만기일은 2020년 12월 26일이다.
아시아경제,138610,/news/news_read.nhn?article_id=0003646701&office_id=277&mode=search&query=나이벡&page=1,2015-12-15 09:24,"나이벡, 76억원 규모 공급계약 체결","[아시아경제 최동현 기자] 나이벡은 176억4900만원 규모의 치과용 골이식재 공급계약을 체결했다고 15일 공시했다. 이는 지난해 매출의 159.83%이며, 계약기간은 내년부터 2021년까지다."
머니투데이,138610,/news/news_read.nhn?article_id=0003666274&office_id=008&mode=search&query=나이벡&page=1,2016-04-18 13:46,"나이벡, 마유(馬油) 화장품 中 위생허가 취득",[머니투데이 송선옥 기자] ['닥터마이유' 에센스 등 2종류 ] 나이벡이 중국 식품의약품관리총국(CFDA)로부터 화장품 제품 ‘닥터마이유’의 위생허가를 취득했다고 18일 밝혔다. 나이벡의 '닥터마이유' 에센스/사진제공=나이벡 이번에 중국으로부터 판매허가를 받은 나이벡 화장품은 ‘닥터마이유’ 에센스와 마스크팩 2종류다. 나이벡 관계자는 “닥터마이유는 나이벡이 직접 생산한 고순도 펩타이드와 마유(馬油)가 함유돼 피부 탄력 개선에 즉각적인 도움을 주는 고기능성 화장품”이라며 “중국 화장품 시장 공략을 위해 각종 마케팅 활동을 전개하고 이를 바탕으로 화장품 수출을 큰 폭으로 확대할 것”이라고 말했다. 한편 나이벡은 ‘닥터마이유’ 외에 후속 제품인 ‘유스텔라’에 대해서도 중국 위생허가를 진행하고 있다. textlinktopstart textlinktopend textlinkstart
한국경제TV,138610,/news/news_read.nhn?article_id=0000408446&office_id=215&mode=search&query=나이벡&page=1,2015-12-15 10:02,"[공시]나이벡, 76억 규모 공급계약 체결","[한국경제TV 김도엽 기자] 나이벡은 76억4,964만원 규모의 치과용 골이식재 공급계약을 체결했다고 15일 공시했습니다. 이는 지난해 매출의 159.83%입니다."
매일경제,138610,/news/news_read.nhn?article_id=0003646088&office_id=009&mode=search&query=나이벡&page=1,2015-12-17 10:07,"[Hot-Line] 나이벡, 펩타이드 기술 中 특허 취득에 강세","치과용 의료소재 제조업체 나이벡이 중국에서 약제조성물에 대한 특허를 취득했다는 소식에 상승하고 있다. 17일 오전 9시 51분 현재 나이벡은 전일 대비 280원(2.81%) 오른 1만250원을 기록 중이다. 나이벡은 이날 항균 또는 항염증 활성을 가지는 펩타이드 및 이를 유효성분으로 함유하는 약제학적 조성물에 대한 특허를 취득했다고 공시했다. 나이벡 관계자는 “이번에 특허 등록한 기술을 현재 펩타이드 치료제로 개발 중인 치주질환 치료제와 임플란트주위염 치료제 등에 활용해 상품화를 적극 추진할 계획”이라고 밝혔다. [매경닷컴 김잔디 기자] r_start // r_end // [ⓒ 매일경제 & mk.co.kr, 무단전재 및 재배포 금지] 매일경제 관련뉴스해당 언론사에서 선정하며 언론사 페이지(아웃링크)로 이동해 볼 수 있습니다.9등신 몸매 이하늬, 당당한 발걸음으로 계단 오르다…'그곳에 시선집중'이하늬, 과거 가슴 사이즈 공개 ""내가 굉장히 큰 줄 알았는데...""'라디오스타' 제시, ""시옷만 발음하면 다들 욕으로...""새끼 잃은 소, 수년간 같은 버스 가로막아…왜?심으뜸, 과거 외신서도 극찬한 '화난 엉덩이'…TV방송에 클로즈업 '깜짝'"
이데일리,138610,/news/news_read.nhn?article_id=0003428039&office_id=018&mode=search&query=나이벡&page=1,2015-12-17 09:40,"나이벡, 특허권 취득",[이데일리 송이라 기자] 나이벡(138610)은 항균 또는 항염증 활성을 갖는 펩타이드 및 이를 유효성분으로 함유하는 약제학적 조성물에 대한 특허권을 취득했다고 17일 공시했다.
파이낸셜뉴스,138610,/news/news_read.nhn?article_id=0003673548&office_id=014&mode=search&query=나이벡&page=1,2016-07-06 11:30,"[공시] 나이벡, 비만예방 약학조성물 특허권 취득",나이벡은 지방 축적 억제용 펩타이드와 이를 포함하는 비만 예방 또는 치료용 약학조성물 국내 특허권을 취득했다고 6일 공시했다.
매일경제,138610,/news/news_read.nhn?article_id=0003988428&office_id=009&mode=search&query=나이벡&page=1,2017-07-31 09:43,"나이벡, 인도에 펩타이드 기술 특허 등록","나이벡은 펩타이드 기반의 치료 기술을 인도에 특허 등록했다고 31일 공시했다. 특허 명칭은 '표적 선택적 세포/조직 투과기능 활성을 가지는 펩타이드 및 그 용도(Target Activated Cells / Tissue Translocation Peptide for Impermeable Compound Strategy and Use Thereof)'이다. 이 기술은 약물 또는 약물함유 입자가 정상 세포 및 조직을 제외한 표적세포, 조직에서 분비되는 특이적 효소에 대해서만 세포 투과 기능성을 갖게 하는 기술이다. 이 같은 장점으로 인해 치료를 원하는 질환에 대해 직접적으로 표적을 하기 때문에 정확성은 물론 치료 효과를 극대화할 수 있다. 나이벡 관계자는 ""이 기술은 응용 방법에 따라 다양한 질병 치료로 범위를 확대할 수 있다""며 ""미국, 유럽에 이어 인도의 특허 등록을 통해 세계 의약품 시장에서 급격한 성장을 하고 있는 국가를 대상으로 기술경쟁력을 확보하고 있다""고 말했다. [디지털뉴스국 김경택 기자] r_start // r_end //"
이데일리,138610,/news/news_read.nhn?article_id=0003981577&office_id=018&mode=search&query=나이벡&page=1,2017-11-29 13:44,"[특징주]나이벡, 펩타이드 관절염 신약 기대감&hellip;상한가",[이데일리 이명철 기자] 펩타이드 전문기업인 나이벡(138610)이 펩타이드 관절염 신약 물질의 추가 효능을 입증했다는 소식에 급등하며 상한가를 나타내고 있다. 29일 오후 1시42분 현재 나이벡 주가는 전일대비 가격제한폭(29.90%)까지 오른 1만3250원을 기록 중이다. 신약 개발 기대감이 매수세로 반영된 양상이다. 나이벡은 서울대 산학협력단 연구팀과 공동 연구한 ‘펩타이드 관절염 치료제’가 염증을 차단하는 기전작용 외 파골세포 분화를 억제함으로써 골흡수를 차단하는 추가 효능이 있다는 것을 확인했다고 이날 밝혔다. 이번 연구에서는 나이벡의 펩타이드가 파골세포 골 조직 밀착과 골 구성 성분을 녹이고 흡수하는 핵심 분자 랜클을 차단해 골 질환에 유용한 제어물질로 활용될 수 있음을 증명했다. 골 관절염은 뼈 관절면을 감싼 관절 연골이 마모돼 연골 밑 뼈가 노출되고 관절 주변 활액막에 염증이 생겨 통증과 변형이 발생하는 질환이다. 현재 대부분 치료법이 통증완화 제품에 한정됐지만 나이벡 펩타이드는 염증의 근원적 치료가 가능하다는 게 가장 큰 특징이라고 회사측은 전했다. 회사 관계자는 “독자 발굴한 펩타이드 효능을 다양한 전문 분야에서 검증 받는 중으로 접목 방법도 같이 모색하고 있다”며 “동시 개발 중인 조골세포 활성을 돕는 골다공증 치료제와 시너지도 기대할 수 있다”고 말했다.
전자신문,138610,/news/news_read.nhn?article_id=0002468649&office_id=030&mode=search&query=나이벡&page=1,2016-04-14 11:03,"나이벡, 치주조직 재생재 가이도스 대만 판매 허가 획득",나이벡(대표 정종평)은 자체 개발한 콜라겐 성분 치주조직 재생재 가이도스(GuidOss)가 대만 식품관리처로부터 판매허가를 받았다고 14일 밝혔다. 가이도스는 다공성 섬유구조로 돼 있어 혈액 및 영양분 투과율이 뛰어나 수술 후 염증이 거의 없는 상태에서 세균 침투를 막고 치조골과 뼈 조직 재생에 도움을 주는 제품이다. 수술 후 4개월정도 지나면 체내에 서서히 흡수돼 수술할 때 삽입해 놓은 차페막 제거를 위한 2차 수술이 필요없다. 나이벡은 대만 판매허가로 작년 8월 대만 타이베이 소재 모 의약품 유통회사와 맺은 129만달러 상당 수출 공급을 본격화하게 됐다. 나이벡 관계자는 “작년 11월 소뼈유래 뼈이식재(OCS-B) 판매허가에 이어 이번 콜라겐성분 치주조직 재생재 판매허가 획득으로 대만은 물론이고 동남아 시장 진출 교두보를 확보하게 됐다”고 밝혔다. 최근 진천공장에 콜라겐 제조구역 생산시설 확충을 마치고 미국 공인 시험기관으로부터 품질과 안전성을 확보했다. 나이벡은 주력제품인 말뼈유래 뼈이식재(이퀴매트릭스)도 대만 판매허가를 진행 중이다. 나이벡은 서울대 치의학대학원 지능형 생체계면공학연구센터의 연구결과를 상용화해 2004년 1월 설립됐다. 지난 2011년 7월 기술특례기업으로 코스닥시장 신성장기업부에 상장됐다.
이데일리,138610,/news/news_read.nhn?article_id=0003521637&office_id=018&mode=search&query=나이벡&page=1,2016-04-14 11:06,"나이벡, 치주조직 재생제 &lsquo;가이도스&rsquo; 대만 수출길 열려",- 대만 식약청 판매허가 획득… 매출 증가 기대 [이데일리 이명철 기자] 펩타이드 전문기업 나이벡(138610)은 대만 식약청(대만위생복리부 식품약물관리처)로부터 치주조직 재생제 가이도스(GuidOss) 판매 허가를 획득했다고 14일 밝혔다. 가이도스는 콜라겐 성분이 함유돼 치조골·뼈 조직의 재생을 돕는 제품이다. 다공성 섬유구조여서 혈액·영양분 투과가 용이하고 구강 노출 시 거의 염증 없이 세균의 침투를 막으며 치조골·상피·결체조직 재생에 도움을 준다. 생체 친화 성분이 함유돼 수술 후 4개월 가량이 지나면 체내에 서서히 흡수되기 때문에 차폐막을 제거하기 위한 2차 수술이 필요 없다. 회사는 지난해 8월 대만의 의료기기·의약품 유통회사와 129만달러 규모의 공급계약을 맺은데 이어 이번 판매 허가를 획득함으로써 매출은 급증할 것으로 기대했다. 대만에서는 지난해 11월 뼈재생 바이오 소재 OCS-B(골이식재)가 판매허가를 얻어 현재 수출 중이다. 말뼈 유래 골이식재인 이퀴매트릭스(Equimatrix)도 대만에서 판매허가를 진행 중이다. 회사 관계자는 “골이식재에 이어 가이도스 판매 허가는 제품 다양화를 위한 교두보를 확보한 것”이라며 “제품 공급뿐 아니라 글로벌 보건 의료 향상에 기여해 글로벌 기업으로 성장하겠다”고 전했다.
매일경제,138610,/news/news_read.nhn?article_id=0004057333&office_id=009&mode=search&query=나이벡&page=1,2017-11-29 15:40,"나이벡, 기능성 펩타이드 효능 입증 논문 게재","펩타이드 헬스케어 전문기업 나이벡이 펩타이드 관절염 신약물질의 추가효능을 입증하고 개발에 박차를 가하고 있다. 29일 나이벡에 따르면 회사는 서울대 산학협력단 연구팀과 공동 연구한 '펩타이드 관절염 치료제'가 염증을 차단하는 기전작용 외에 추가적으로 파골세포 분화를 억제함으로써 골흡수를 차단하는 추가 효능이 있다는 것을 저널을 통해 밝혔다. 연구 내용에는 나이벡의 펩타이드가 파골세포의 골 조직 밀착과 골 구성 성분을 녹이고 흡수하는 핵심 분자인 랜클(RANKL, Receptor Activator of Nuclear factor Kappa-B Ligand)을 차단함으로써 골질환에 유용한 제어물질로 활용할 수 있음을 증명했다. 현대에 대표적인 골 질환으로는 골다공증과 골관절염을 들 수 있다. 골관절염이란 뼈의 관절면을 감싸고 있는 관절 연골이 마모돼 연골 밑의 뼈가 노출되고, 관절 주변의 활액막에 염증이 생겨서 통증과 변형이 발생하는 질환이다. 이 질환은 현재 대부분의 치료법이 통증완화 제품에 한정돼 있으나 나이벡 펩타이드는 염증의 근원적 치료가 가능하다. 아울러 골다공증은 현재 나이벡에서 주력하고 있는 펩타이드 신약부분의 하나로 골 소실을 막는 것 뿐만 아니라 골을 형성하는 작용을 한다고 회사 측은 소개했다. 피하지방 축적을 억제하는 효과도 지니고 있어 폐경기 여성의 골다공증 환자에게는 획기적인 치료물질이라는 설명이다. 회사 관계자는 ""독자적으로 발굴한 펩타이드를 연구개발(R&D) 네트워크를 통해 효능을 다양한 전문 분야에서 검증 받고 있다""며 ""이번 치료제는 염증을 근원적으로 치료하면서 골 흡수억제에도 도움을 주는 이중 기능성으로, 동시 개발중인 조골세포 활성을 돕는 골다공증 치료제와의 시너지 효과도 기대할 수 있어 꿈의 신약이 될 것""이라고 덧붙였다. 한편 이 연구결과의 논문은 'A 15-amino acid C-terminal peptide of beta-defensin-3 inhibits bone resorption by inhibiting the osteoclast differentiation and disrupting podosome belt formation/파골세포 분화를 억제하고 포도솜 형성을 방해함으로써 골흡수를 억제하는 펩타이드)' 로 Journal of Molecular Medicine(2017) 95: 1315-1325 에 게재됐다. [디지털뉴스국 김경택 기자] r_start // r_end //"
아시아경제,138610,/news/news_read.nhn?article_id=0003727387&office_id=277&mode=search&query=나이벡&page=1,2016-04-14 10:51,"[공시+]나이벡, 가이도스&hellip;대만 판매 허가 획득","[아시아경제 김원규 기자] 나이벡이 치주조직 재생제 '가이도스'가 대만 식약청인 대만위생복리부 식품약물관리처으로부터 판매 허가를 획득했다고 14일 밝혔다. 가이도스는 콜라겐 성분이 함유된 제품으로 치조골 및 뼈 조직의 재생에 도움을 주는 제품으로 혈액 및 영양분의 투과가 용이하고, 구강노출시 염증 없이 세균의 침투를 막고 치조골, 상피 및 결체조직 재생에 도움을 준다. 또 생체 친화적인 성분이 함유돼 수술 후 4개월 정도 지나면 체내에 서서히 흡수돼 차폐막을 제거하기 위한 2차 수술이 필요 없다는 장점을 가졌다. 나이벡은 2015년 8월 대만의 의료기기 및 의약품 유통회사 A사와 129만 달러 공급계약을 맺은 가운데 가이도스의 판매 허가를 획득으로 수출 매출이 향후 크게 늘 것으로 기대하고 있다. 나이벡의 관계자는 ""골이식재에 이어 이번 가이도스의 판매 허가는 제품 다양화를 위한 교두보를 확보한 것"" 이라며 ""제품 공급뿐만 아니라 글로벌 보건 의료 향상에 기여해 글로벌 기업으로 성장할 것""이라고 말했다."
아시아경제,138610,/news/news_read.nhn?article_id=0003651632&office_id=277&mode=search&query=나이벡&page=1,2015-12-22 10:09,"나이벡 화장품, 세계 화장품 원료집(ICID)에 등재 완료","[아시아경제 최동현 기자] 코스닥 상장사 나이벡은 자사가 개발한 펩타이드 성분을 세계 화장품원료집(ICID)에 등재하고 본격적인 해외 마케팅에 나선다고 22일 밝혔다. 이번에 나이벡이 ICID에 등재한 펩타이드는 'NAP-1 peptide' 와 'NCB-3 peptide' 등 2종류다. 나이벡에 따르면 NAP-1 peptide는 트러블성 피부에 적용하면 피부의 염증을 완화하고 가려움증을 진정시킬 수 있다. NCB-3 peptide는 콜라겐 생성 촉진 펩타이드로 손상된 피부의 재생을 돕는 역할을 해 피부의 재생 및 피부 장벽 강화 효과가 있다. 나이벡은 이에 앞서 마유(馬油) 성분으로 개발한 '닥터 마이유(Dr. MyYou)'와 '유스텔라(EUSTELLA)'를 출시해 현재 러시아와 미국 등 해외로 수출중이다. 나이벡은 이와 함께 자사 화장품에 대해 중국 위생당국에도 판매허가를 신청해 놓은 상태다. 중국 판매 허가가 완료될 경우 본격적 중국 수출도 개시 한다는 방침이다. 나이벡 관계자는 ""이번 ICID에 등재된 펩타이드는 나이벡만의 자체 기술 펩타이드""라며 ""글로벌 화장품 시장에서 1등 제품이 되도록 연구개발에 몰두하고 있다""고 설명했다."
서울경제,138610,/news/news_read.nhn?article_id=0003061505&office_id=011&mode=search&query=나이벡&page=1,2017-06-29 14:35,"나이벡, 골 재생 치료기술 유럽 특허 등록","[서울경제] 펩타이드 헬스케어 전문기업으로 코스닥 상장사인 나이벡(138610)은 이달 6일 유럽에서 골 재생 치료기술이 특허 등록됐다고 29일 밝혔다. 펩타이드는 단백질의 최소단위로 이 기술은 펩타이드가 골 조직의 미네랄 성분에 고정돼 재생 효과를 내며 치과나 정형외과용 의료기기 영역에서 활용할 수 있다. 또한 골 조직에 체류하면서 골재생에 관련된 세포의 분화를 촉진해 최종적으로 골조직 재생력을 극대화 시킬 수 있다. 나이백은 이 기술을 바탕으로 골 재생을 목적으로 하는 재생치료제의 상용화에 활용할 계획이다. 나이벡 관계자는 “국내와 미국, 이스라엘, 유럽에서 특허 등록을 완료했다”며 “캐나다와 멕시코 등에서도 특허 등록을 진행 중”이라고 말했다."
파이낸셜뉴스,138610,/news/news_read.nhn?article_id=0003565651&office_id=014&mode=search&query=나이벡&page=1,2015-12-22 09:56,"나이벡 화장품, 세계 화장품 원료집(ICID)에 등재 완료","나이벡이 자체 개발한 펩타이드 성분에 대해 세계 화장품 원료집인 ICID(International Cosmetic Ingredient Dictionary)에 원료 등재를 완료하고 본격적인 해외 마케팅에 나선다고 22일 밝혔다. 이번에 나이벡 ICID에 등재한 펩타이드는 'NAP-1 peptide' 와 'NCB-3 peptide' 등 2종류 이다. 나이벡에 따르면 NAP-1 peptide는 트러블성 피부에 적용하면 피부의 염증을 완화하고 가려움증을 진정시킬 수 있다. NCB-3 peptide는 콜라겐 생성 촉진 펩타이드로 손상된 피부의 재생을 돕는 역할을 하여 피부의 재생 및 피부 장벽 강화 효과가 있다고 나이벡 관계자는 강조했다 나이벡 관계자는 ""이번 ICID에 등재된 펩타이드는 나이벡 만의 자체 기술 펩타이드로 글로벌 화장품 시장에서 독보적 1등 제품이 되도록 연구개발에 몰두하고 있다""고 밝혔다 나이벡은 이에 앞서 마유(馬油) 성분으로 자체 개발한 닥터 마이유 (Dr. MyYou)>와 '유스텔라(EUSTELLA)'를 출시하여 현재 러시아와 미국 등 해외로 수출을 하고 있다. 나이벡은 이와 함께 자사 화장품에 대해 중국 위생당국에도 판매허가를 신청해 놓은 상태다. 중국 판매 허가가 완료될 경우 나이벡은 본격적인 중국 수출도 개시 한다는 방침이다."
