source,symbol,link,date,title,content
뉴시스,138610,/news/news_read.nhn?article_id=0008432208&office_id=003&mode=search&query=나이벡&page=1,2018-02-06 11:09,"휴온스, 치과분야 전문기업 나이벡과 공동판매 계약","【서울=뉴시스】류난영 기자 = 휴온스글로벌의 자회사 휴온스는 치과 분야 사업 강화를 위해 치과 연구 전문기업 나이벡과 치과용 의약품의 공동판매계약을 체결했다고 6일 밝혔다. 이번 계약을 통해 휴온스는 나이벡이 자체 개발한 치주염 치료제 '미노큐어'와 치과용 컨디셔너 '크린플란트'를 국내에서 공동으로 판매할 예정이다. 휴온스는 국내 치과용 국소마취제 시장의 선도 기업으로 주력 제품 중 하나인 치과용 '리도카인'과 함께 나이벡의 '미노큐어'와 '크린플란트'를 유통해 치과 분야 의약품 전문 기업으로 입지를 확고히 다질 계획이다. '미노큐어'는 치과용 항생 연고로 주로 치주염 치료제로 처방되는 전문의약품이다. 치주낭에 직접 주입하는 방식으로 치주염증 부위에만 국소적으로 작용해 항생제 내성으로부터 안전성을 높였다. 일정 시간이 지나면 치주낭 안에서 자연적으로 분해돼 항생제 복용이 어려운 환자들에게 도움이 될 것으로 기대하고 있다. '크린플란트'는 임플란트 및 치주조직 염증의 원인이 되는 치태 및 치석을 제거해 염증의 예방과 진행을 억제하는 제품으로 임플란트 및 치근 표면을 세척하는데 사용되는 치과용 컨디셔너이다. 특히 임플란트 시술시 사용할 경우 치아 접합 기능을 향상시키는 동시에 세균층을 제거해 감염 등의 부작용 예방 효과를 볼 수 있다. 엄기안 휴온스 대표는 ""치과 분야의 연구 개발 전문성을 보유한 나이벡과 30여년 동안 국내 치과용 국소 마취제 시장을 리드해온 휴온스의 영업·유통 노하우가 만나 강력한 시너지를 창출할 것으로 기대된다""며 ""이번 나이벡과의 협력을 기점으로 다양한 치과 분야 전문의약품으로 품목을 넓혀 치과 분야에서도 전문성을 강화해나갈 계획""이라고 말했다."
매일경제,138610,/news/news_read.nhn?article_id=0004096085&office_id=009&mode=search&query=나이벡&page=1,2018-02-06 10:53,"휴온스, 치과 전문기업 나이벡과 공동판매계약","미노큐어, 크린플란트 2개 품목 유통 노하우로 양사 시너지 기대 휴온스와 나이벡이 공동판매계약을 맺고 치과 의약품 시장을 본격 공락한다. 정종평 나이벡 대표와 엄기안 휴온스 대표(왼쪽부터)가 협약 후 기념촬영을 하고 있다. &lt;사진제공=휴온스&gt; 휴온스글로벌 자회사 휴온스가 치과 분야 사업을 강화한다. 휴온스는 지난 1일 판교 본사에서 치과 연구 전문기업 나이벡과 공동판매계약을 체결했다고 밝혔다. 나이벡이 자체 개발한 치주염 치료제 '미노큐어(MinoCure)'와 치과용 컨디셔너 '크린플란트(Clinplant)'를 국내에서 공동으로 판매할 예정이다. 휴온스 관계자는 ""휴온스는 국내 치과용 국소마취제 시장의 선도 기업으로, 치과용 '리도카인'이 주력제품 중 하나""라며 ""미노큐어와 크린플란트를 유통해 치과 분야 의약품 전문 기업으로 입지를 확고히 다지겠다는 계획""이라고 밝혔다. 미노큐어는 치과용 항생 연고이며, 주로 치주염 치료제로 처방되는 전문의약품이다. 치주낭에 직접 주입하는 방식으로 치주염증 부위에만 국소적으로 작용하며, 일정 기간 동안 약물 방출을 자체 조절해 항균 유효농도를 유지시킨다. 일정 시간이 지나면 치주낭 안에서 자연적으로 분해되어 항생제 복용이 어려운 환자들에게 도움이 될 것으로 회사 측은 기대하고 있다. 크린플란트는 임플란트 및 치근 표면을 세척하는데 사용되는 치과용 컨디셔너이다. 임플란트 시술시 사용하면 치아 접합 기능을 향상시키는 동시에 세균층을 제거해 감염 등의 부작용 예방 효과를 볼 수 있다고 회사 측은 밝혔다. 지난 2015년 미국 특허를 받았고 국내에서도 대한치과의사협회지 등에 치주염 및 임플란트 주위염의 예방 및 진행 억제에 대한 효능이 소개되는 등 주목을 받고 있다. 엄기안 휴온스 대표는 ""치과 분야의 연구 개발 전문성을 보유한 나이벡과 30여년 동안 국내 치과용 국소 마취제 시장을 리드해온 휴온스의 영업·유통 노하우가 만나 강력한 시너지를 창출할 것""이라며 ""휴온스는 이번 나이벡과의 협력을 기점으로 다양한 치과 분야 전문의약품으로 품목을 넓혀 치과 분야에서도 전문성을 강화해나갈 계획""이라고 밝혔다. [신찬옥 기자] r_start // r_end //"
매일경제,138610,/news/news_read.nhn?article_id=0003995062&office_id=009&mode=search&query=나이벡&page=1,2017-08-11 14:50,"나이벡, 2분기 영업손 3억3900만원&hellip;적자 지속","펩타이드 전문기업 나이벡은 지난 2분기 영업손실이 3억3900만원을 기록해 전년 동기 대비 적자를 지속했다고 11일 공시했다. 같은 기간 매출액은 12억7700만원으로 3.4% 늘었으나 순손실은 4억5100만원으로 적자폭을 확대했다. 나이벡 관계자는 ""올 상반기 스트라우만과 기술이전 계약 체결 등을 통해 실적이 호조를 보였다""며 ""하반기에도 지속적인 제품 공급계약 체결뿐 아니라 추가 기술이전을 통해 좋은 결과를 보일 예정""이라고 말했다. 한편 나이벡은 서울대 치의학대학원 지능형 생체계면공학 연구센터의 연구결과를 상용화해 지난 2004년 1월 설립한 첨단 기술 회사다. 2011년 7월 코스닥 시장 신성장 기업부에 상장했다. [디지털뉴스국 김경택 기자] r_start // r_end //"
아시아경제,138610,/news/news_read.nhn?article_id=0003736180&office_id=277&mode=search&query=나이벡&page=1,2016-04-27 13:56,"나이벡, 러시아서 치아미백제 판매 허가 획득","[아시아경제 김민영 기자]나이벡이 치아미백제 닥터화이티스(Dr.Whitiss) 러시아 판매 허가를 획득했다고 27일 밝혔다. 나이벡은 이번 판매허가를 받은 닥터화이티스(Dr.Whitiss)에 대해 곧 러시아 홈쇼핑에 런칭해 본격적으로 판매할 예정이다. 이번에 러시아에 런칭하는 닥터화이티스는 지난해 9월 한국보건산업 진흥원에서 추진한 러시아 모스크바 인구밀집 지역 쇼핑몰 전시에서 러시아 현지인들로부터 큰 호평을 받았다. 나이벡은 당시 자사 펩타이드 화장품 닥터마이유도도 함께 판매했다. 닥터화이티스는 2008년 9월 처음 국내에 런칭해 2014년도 5번째 리뉴얼한 제품으로 현재까지 홈쇼핑과 온라인을 통해 판매하고 있다. 나이벡 관계자는 ""치아미백제의 경우 국내.외 업계 1위를 목표로 하여 전사적인 마케팅을 펼치고 있으며 특히 이번에 러시아 지역 판매 허가 획득을 바탕으로 현지의 홈쇼핑 런칭을 예정하고 있고 다방면으로 수출 다각화에 노력중에 있어 이 지역 수출이 크게 늘어 날 것으로 예상된다""고 말했다."
조선비즈,138610,/news/news_read.nhn?article_id=0000398145&office_id=366&mode=search&query=나이벡&page=1,2018-02-06 10:39,"휴온스, 치과 분야 전문기업 나이벡 치과용 의약품 2개 공동 판매","휴온스글로벌의 자(子)회사인 휴온스는 치과 분야 사업을 강화하기 위해 1일 경기 판교 휴온스 본사에서 치과 연구 전문기업 나이벡과 치과용 의약품을 공동으로 판매하는 계약을 체결했다고 5일 밝혔다. 휴온스(243070) 는 이번 계약을 통해 나이벡이 자체 개발한 치주염 치료제 ‘미노큐어(MinoCure)’와 치과용 컨디셔너 ‘크린플란트(Clinplant)’를 국내에서 공동으로 판매할 예정이다.  정종평(사진 왼쪽) 나이벡 대표와 엄기안 휴온스 대표가 치과용 의약품 공동 판매 계약을 체결한 뒤 기념촬영을 하고 있다. / 휴온스 제공 미노큐어는 치과용 항생 연고로, 주로 치주염(잇몸 염증이 뼈까지 발전하는 질환) 치료제로 처방되는 전문의약품이다. 치주낭(잇몸)에 직접 주입하는 방식으로 치주염증 부위에만 국소적으로 작용해 항생제 내성으로부터 안전성을 높였다. 또 치주질환의 원인균을 억제할 뿐 아니라 치주낭 안에서 일정 기간 동안 약물 방출을 자체 조절해 항균 유효 농도를 유지시키는 기능도 있다. 따라서 일정 시간이 지나면 미노큐어가 치주낭 안에서 자연적으로 분해돼 항생제 복용이 어려운 환자들에게 도움이 될 것이라는 게 회사 측 설명이다. 크린플란트는 임플란트와 치주조직 염증의 원인이 되는 치태·치석을 제거해 염증의 예방과 진행을 억제하는 제품이다. 임플란트와 치근 표면을 세척하는데 사용되는 치과용 컨디셔너이다. 특히 임플란트 시술 시 사용할 경우, 치아 접합 기능을 향상시키는 동시에 세균층을 제거해 감염 등의 부작용 예방 효과를 볼 수 있다. 2015년 미국 특허를 받기도 한 제품이다. 엄기안 휴온스 대표는 “이번 나이벡과의 협력을 통해 다양한 치과용 전문의약품으로 제품군을 넓혀 해당 분야에서 전문성을 강화하겠다”고 말했다."
서울경제,138610,/news/news_read.nhn?article_id=0002834402&office_id=011&mode=search&query=나이벡&page=1,2016-05-26 13:38,"나이벡, 펩타이드 기반 골다공증 치료제 개발 가시화","나이벡, 펩타이드 기반 골다공증 치료제 개발 가시화"
파이낸셜뉴스,138610,/news/news_read.nhn?article_id=0003807845&office_id=014&mode=search&query=나이벡&page=1,2017-04-26 10:18,[fnRASSI]나이벡(138610) 전일대비 5.68% 상승,"나이벡(138610)은 현재 주가가 전일 대비 5.68% 상승한 8,560원 선에서 거래가 이루어지고 있다. 퀀트 재무분석, 종합점수 4점으로 상승                    지표               항목               값               종합점수                 성장성               매출액증가율               -0.13               2.43                 자기자본증가율               -0.07                 안정성               부채비율               135.33               5.66                 유동비율               177.46                 이익안정성               3.33                 수익성               ROA               -12.88               0.48                 ROE               -30.3                 영업이익율               -52.47          나이벡의 퀀트 재무 점수는 8.57점으로 3개월 이전 8.04점보다 올랐다. 지난 분기에 비해 성장성 점수가 상승했다. 이는 매출액 증가율과 자기자본 증가율이 증가하였기 때문이다. 개인,외국인 투자자만 매매에 참여 최근 한달간 주체별 거래비중을 살펴보면 개인 비중이 96.07%로 가장 높았고, 외국인이 3.92%로 그 뒤를 이었다. 기관은 거래에 참여하지 않은 것으로 보인다. 그리고 최근 5일간 거래비중은 개인이 96.87%, 외국인이 3.12%를 보였고, 기관은 거래참여가 없었다. 'fnRASSI'는 증권전문 기업 씽크풀과 파이낸셜뉴스의 협업으로 로봇기자가 실시간으로 생산하는 기사입니다."
뉴스1,138610,/news/news_read.nhn?article_id=0003189999&office_id=421&mode=search&query=나이벡&page=1,2018-02-06 10:27,"나이벡, 휴온스와 의약품 공동판매&hellip;실적 부진 해법 될까","나이벡과 휴온스 관계자가 공동판매 계약을 체결하며 기념사진을 찍고 있다. © News1 (서울=뉴스1) 강현창 기자 = 조직재생용 의료용구 제조를 전문으로 하는 코스닥 상장사 나이벡이 의약품 전문회사 휴온스와 치과용 전문의약품의 공동판매에 나선다. 나이벡은 휴온스와 치과용 항생연고제 미노큐어(Minocure)와 임플란트 주위염 치료제 크린플란트(Clinplant)의 공동판매 계약을 체결했다고 6일 밝혔다. 나이벡이 자체 개발한 미노큐어는 치주질환의 원인균을 억제하는 효능을 가진 전문의약품이다. 국소부위에만 효능이 있어 항생제 내성이 없다는 설명이다. 크린플란트는 임플란트 후 치태와 치석을 제거해 주는 치과용 컨디셔너 제품이다. 나이벡 관계자는 ""의약품 전문 판매를 진행해온 휴온스의 영업 노하우와 구축된 공급망을 통해 매출 성장 시너지가 기대된다""며 ""이번 첫 공급 계약을 시작으로 지속적인 시너지가 날 수 있도록 노력할 예정""이라고 말했다. 한편 업계에서는 나이벡의 판로 확대가 부진한 실적의 개선으로 이어질 지 관심을 보이고 있다. 나이벡은 지난 2011년 기술성상장기업으로 코스닥에 특례상장한 업체다. 하지만 상장이후 단 한차례도 연간 기준 흑자를 기록하지 못했다. 만약 지난해에도 영업이익에도 적자를 기록할 경우 상장 이후 6년 연속 적자가 된다. 일반 코스닥기업이라면 관리종목 지정 등에 따라 상장폐지가 거론될 수준이다. 하지만 나이벡은 기술특례기업이어서 연간 매출 30억원만 달성하면 상장 유지에 문제가 없다. 연속 적자 결과 2011년에는 1억9000만원 수준이던 이익잉여금은 지난 2016년에는 163억원 규모의 결손금이 됐다."
한국경제TV,138610,/news/news_read.nhn?article_id=0000599851&office_id=215&mode=search&query=나이벡&page=1,2018-02-06 12:46,"나이벡, 전일 대비 약 -4% 하락한 9,850원","[한국경제TV 라이온봇 기자] 나이벡은 2월 6일 12시 45분 전일 대비 약 -4% 하락한 9,850원에 거래되고 있다. 나이벡은 코스닥 상장 기업으로 제약 업종에 속해 있다. 시가총액은 619억원으로 코스닥 상장기업 중 892위에 위치 해 있다. [종목 성향 진단] [그림 1] 종목 성향 진단 나이벡의 투자 스타일은 성장주에 가깝다. 주가 고평가 우려가 공존하지만 높은 성장성이 기대되는 기업이다. 주가 모멘텀은 부진한 편이었다. 최근 3개월 수익률은 -8.04%의 하락폭을 기록했다. 최근 1개월 수익률 또한 -7.21% 하락하며 부진한 모멘텀을 이어가고 있다. 나이벡 종목에 대한 투자자의 관심도는 상대적으로 낮은 편이었다. [투자 점수 진단] [그림 2] 투자 점수 진단 나이벡은 성장성(매출증가율(YoY)) 측면에서 두각을 나타내고 있다. 최근 매출증가율(YoY)은 82점으로 6개의 핵심 팩터 중 가장 높은 점수를 기록했다. 매출증가율(YoY)은  전체 시장 내 322위를 기록하며 상위 17.84%에 위치했다. 업종별로는 28위를 기록하며 상위 15.43%에 위치했다. 그러나 PBR과 영업이익률은  아쉬움을 나타냈다. [종합 투자점수] [그림 3] 종합 투자점수 AI 인공지능 분석을 통한 나이벡의 종목 종합 스코어는 31점을 기록했다. 이는 동일 업종 평균점수인 52점과 시장 평균점수인 57점를 하회하는 수치였다. (위의 AI인공지능 점수는 재무 데이터를 기반으로 전체 상장 종목과 비교/분석하여 도출한 점수로 높은 점수가 반드시 높은 수익률을 보장하지 않습니다. 위의 자료는 당사의 추천 종목이 아니며, 투자 시 참고용으로 제시해드리는 것입니다.) 라이온봇 기자 -한국경제TV※ 본 기사는 한국경제TV와 '거장들의 투자공식이'자체 개발한 '라이온봇 기자'가 실시간으로 작성한 기사입니다. 라이온봇기자 ⓒ 한국경제TV, 무단 전재 및 재배포 금지 한국경제TV 관련뉴스해당 언론사에서 선정하며 언론사 페이지(아웃링크)로 이동해 볼 수 있습니다.'오달수의 그녀' 채국희, 승무원 출신? 채시라 동생?도도맘 전 남편 조용제 씨 ""불륜사건은 강용석과 나와의 싸움""박삼구 아시아나 회장도 성추행 논란…승무원들 상대로?'굿모닝FM 하차' 문지애 집…""아나운서 집이 왜 이래""태양♥민효린 결혼, 영화 포스터같은 웨딩화보 '시선집중'"
아시아경제,138610,/news/news_read.nhn?article_id=0003783526&office_id=277&mode=search&query=나이벡&page=1,2016-07-08 09:44,"[특징주]나이벡, 줄기세포 침투 단백질 관련 美 특허 취득 소식&hellip;6%&uarr;","[아시아경제 임철영 기자]나이벡이 줄기세포 침투 단백질 관련 미국 특허 취득 소식에 강세다. 8일 오전 9시41분 현재 나이벡은 전 거래일 대비 6.17% 오른 1만2050원에 거래되고 있다. 펩타이드 전문기업 나이벡은 ‘줄기세포 재생 증식능 향상용 세포 침투성 융합 단백질(Cell Permeable Fusion Protein for Strengthening Regenerative Potential of Stem Cells)’에 관한 특허 기술을 미국에 등록 완료했다고 이날 밝혔다. 이번 특허의 주요내용은 신약과 줄기세포 치료물질에 관한 것으로 줄기세포의 분화촉진능, 세포 사멸 억제능, 줄기세포 기능성 유지 및 스트레스에 의해 억제된 줄기세포의 기능성을 회복하기 위한 줄기세포 재생 강화용 세포 침투성 융합 단백질에 관한 것이다. 이 특허 기술은 세포에 대한 독성이나 부작용 없이 줄기세포의 재생, 증식 및 분화를 촉진시키는 단백질을 줄기세포 안으로 침투하게 할 수 있는 기술이다. 줄기세포의 이식성공률을 높일 수 있고, 골 조직으로의 선택적인 재생 및 분화를 달성할 수 있다는 설명이다. 나이벡의 관계자는 ""서울대학교와 나이벡의 공동 연구개발로, 줄기세포의 이식성공률을 높이고, 골조직 재생도 가능한 신약 개발과 줄기 세포 치료제 관련 연구가 활발히 진행 중이다”라고 말했다."
한국경제,138610,/news/news_read.nhn?article_id=0003580702&office_id=015&mode=search&query=나이벡&page=1,2016-04-18 13:45,"나이벡, 마유 화장품 中 시장 진출","[ 한민수 기자  ] 나이벡의 마유(馬油) 화장품이 중국 시장에 진출한다. 나이벡은 현재 미국과 러시아 등으로 수출되고 있는 마유 화장품이 중국 식약처(CFDA)로부터 판매 허가를 받았다고 18일 밝혔다. '닥터 마이유'라는 브랜드명으로 허가를 받은 나이벡의 화장품은 고순도 펩타이드와 마유가 함유된 '에센스'와 '마스크팩' 등 2종류다. 이 제품은 고순도 펩타이드 성분이 함유돼 피부 탄력에 도움을 주며, 마유 성분으로 인해 피하 조직까지 영양 및 수분 흡수를 도와준다는 설명이다. 나이벡 관계자는 ""중국 화장품 시장 공략을 위해 각종 마케팅 활동을 전개하고, 이를 바탕으로 화장품 수출을 큰 폭으로 늘리는 데 총력을 기울이겠다""고 말했다. 나이벡은 '닥터 마이유'에 이어 후속 제품인 '유스텔라'에 대해서도 중국 위생허가를 진행하고 있다. 한민수 한경닷컴 기자"
연합뉴스,138610,/news/news_read.nhn?article_id=0008446255&office_id=001&mode=search&query=나이벡&page=1,2016-06-02 13:42,나이벡 &quot;조직 구조 모사체 특허권 취득&quot;,"(서울=연합뉴스) 김현정 기자 = 코스닥업체 나이벡은 조직의 재생을 위해 사용되는 조직 구조 모사체 제조방법에 대한 특허권을 취득했다고 2일 공시했다. 회사 측은 ""펩타이드융합 골재생용 복합재료 제품의 개발 및 상품화에 적용할 계획""이라고 밝혔다."
뉴시스,138610,/news/news_read.nhn?article_id=0008097234&office_id=003&mode=search&query=나이벡&page=1,2017-07-31 10:52,"나이벡, 펩타이드 기술 인도에 특허 등록","【서울=뉴시스】김경원 기자 = 헬스케어 전문기업 나이벡(138610)은 펩타이드 기반의 치료 기술을 인도에 특허 등록했다고 31일 밝혔다. 특허 명칭은 '표적 선택적 세포, 조직 투과기능 활성을 가지는 펩타이드 및 그 용도'(Target Activated Cells, Tissue Translocation Peptide for Impermeable Compound Strategy and Use Thereof)이다. 이 기술은 약물 또는 약물함유 입자가 정상 세포 및 조직을 제외한 표적세포, 조직에서 분비되는 특이적 효소만 세포 투과 기능성을 갖게 하는 기술이다. 회사 관계자는 ""이 기술은 응용 방법에 따라 다양한 질병 치료로 범위가 확대할 수 있다""며 ""미국, 유럽에 이어 인도의 특허 등록을 통해 세계 의약품 시장에서 급격한 성장을 하고 있는 국가를 대상으로 기술경쟁력을 확보하고 있다""고 전했다. 실제로 인도 통상산업부의 인도브랜드자산재단(IEBF)에 따르면 인도 제약시장은 2005년 7조원(60억 달러)에서 2013년 14조원(120억 달러) 규모로 성장했다. 2020년에는 60조원(550억 달러) 규모까지 성장해 세계 6위를 기록할 것으로 전망하고 있다. 나이벡 관계자는 ""급격한 경제성장과 함께 의약품 소비량도 빠르게 증가하고 있는 인도 시장에서 펩타이드 기반의 기술 개발 및 제품 상용화를 통해 시장을 확대할 예정""이라며 ""각종 암과 염증성 질환 치료제 개발을 위한 제품 인허가도진행 중""이라고 설명했다."
파이낸셜뉴스,138610,/news/news_read.nhn?article_id=0003843995&office_id=014&mode=search&query=나이벡&page=1,2017-07-14 13:09,"나이벡, 서울대학교 산학협력단과 '차세대 치근치주염 치료제' 개발","펩타이드 전문기업 나이벡(NIBEC)이 서울대학교 산학협력단과 진행한 '치근단 및 치주염 공동 연구'를 통해 펩타이드 기반 다기능성 차세대 '근관첨약제'를 개발했다고 14일 밝혔다. 이번 연구의 주제는 '다기능성 차세대 근관첨약제 개발'로 지난 2016년 6월 보건복지부 보건의료기술연구개발사업 중 '질환 극복 기술개발 프로젝트'의 일환으로 시작됐다. 근관첨약제는 손상된 치아신경을 소독하는 동시에 치아뿌리에 염증이 발생하지 않도록 채워 넣는 치과용 치료제다. 그러나 이전까지 의약품으로 개발된 것이 없어 미네랄 분말로 채워 넣거나 항균제를 이용한 대응치료만 시행하고 있었다. 나이벡 관계자는 ""구강 건강을 악화시키는 주요 원인 중 가장 큰 부분은 치아 소실""이라면서 ""국내의 경우 전체 치아 소실의 약 88%가 충치와 치주질환 때문""이라고 설명했다. 이어 ""최근 치주염 환자 수가 계속해서 증가해 본질적인 치주염 치료제에 대한 필요성이 증대되고 있다""고 강조했다. 나이벡 관계자는 ""이번에 개발된 근관첨약제는 생체 친화적 소재인 펩타이드를 활용해 부작용이 거의 없다""면서 ""항균 기능과 치아뿌리 재생 및 소실 방지 효능을 입증했다""고 밝혔다. 이어 ""이번 연구를 통해 고질적인 치아뿌리 감염을 근본적으로 치료할 수 있는 치료제가 완성됐다""고말했다. 나이벡은 추후 임상 시험을 진행해 근관첨약제를 환자 치료에 활용할 예정이다."
머니투데이,138610,/news/news_read.nhn?article_id=0003613156&office_id=008&mode=search&query=나이벡&page=1,2016-01-14 10:39,"나이벡, 치아 치료제 관련 특허 취득","[머니투데이 최동수 기자] 나이벡은 14일 치아 지각과민 방지용 조성물 관련 특허를 취득했다고 공시했다. 회사 측은 ""이번 특허는 베트남 특허""로 ""시린이치료제인 센스블록의 해외판매를 진행할 계획""이라고 말했다. textlinktopstart textlinktopend textlinkstart"
