source,symbol,link,date,title,content
뉴시스,138690,/news/news_read.nhn?article_id=0007011055&office_id=003&mode=search&query=엘아이에스&page=1,2016-01-28 09:46,"[종목토크]엘아이에스, 코리아나와 MOU&middot;ODM 체결&hellip;한류화장품 출시 '첫발'","【서울=뉴시스】 사후면세점 전문업체 엘아이에스 홈페이지 모습. 【서울=뉴시스】 한상연 기자 = 사후면세점 전문기업 엘아이에스의 한류 화장품 탄생이 첫 발을 뗐다. 엘아이에스는 27일 코리아나화장품과 포괄적인 협력을 위한 업무협약(MOU) 및 제조자개발생산(ODM) 계약을 체결하고 고품질화장품 브랜드의 공동 개발에 나서기로 했다. 두 회사의 협력으로 생산될 주름·미백 관리용 기능성 화장품 루바체와 프리미엄 한방 화장품 수진비 등은 올 3월 서울 중심가에 입점하게 될 매장과 온·오프라인 중국 시장을 통해 본격적으로 판매될 예정이다. 이하 엘아이에스 관계자와의 일문일답. Q. 기존에 한국화장품과 한국콜마 등도 접촉 중이었던 것으로 알고 있다. 코리아나와 협력을 하게 된 결정적인 이유는 무엇인가? A. 코리아나화장품과는 지난해 11~12월부터 중국 시장을 함께 조사하며 화장품 브랜드를 개발해왔다. 이번에 코리아나와 MOU 및 ODM 계약을 맺은 것은 사실이지만, 그렇다고 코리아나와 독점적으로 사업을 진행하겠다는 건 아니다. 한국화장품과는 화장품 브랜드 개발을 진행하는 단계는 아니지만 계속 이야기가 오가는 상태다. 다만 동시다발적으로 여러 업체들과 사업을 진행하면 안 좋을 것 같다는 판단 하에 가장 적극적인 모습을 보였던 코리아나와 우선 계약을 맺게 된 것이다. Q. 이번 제휴에 담긴 전략은 무엇인가? A. 중국의 시장 조사를 하며 아모레퍼시픽이나 LG생활건강 등 국내 대형 화장품 회사 외에는 다른 브랜드의 인지도가 크게 강하지 않다는 것을 알게 됐다. 다만 중국 소비자들에게 각 회사마다 인기를 얻는 상품들은 있었다. 우리는 각 회사 화장품 브랜드마다 인기 있는 제품 라인업을 ODM을 통해 생산, 자사 브랜드화 시키겠다는 전략을 가지고 있다. Q. 본격적인 화장품 생산과 판매는 언제부터 이뤄지는 것인가? A. 3월에 서울 이대 근처에 신규 화장품 매장을 크게 오픈할 예정인데, 그 일정에 맞춰 화장품 생산과 판매를 준비할 것이다. 그러나 코리아나 측과 최소 생산 수량을 명시해 계약하지는 않았다. Q. 루바체, 수진비 등 새 브랜드의 소유권은 어디에 귀속되는 것인가? A. 엘아이에스와 코리아나가 공동 소유하게 될 것이다. Q. 이 제품들을 온라인 쇼핑몰을 통해서도 판매한다고 알고 있다. 앞서 MOU를 맺었던 중국 유고홈쇼핑의 플랫폼에 국한된 것인가? A. 중국 유고홈쇼핑의 온라인 쇼핑몰 외에 엘아이에스에서 자체적으로 준비 중인 쇼핑몰이 있다. 이 쇼핑몰도 3월 중 오픈 예정이다. 이곳에서도 제품들을 판매하게 될 것이다. Q. 최근 자생한방병원과의 MOU를 통해 의료관광 사업에도 뛰어들었다. 어떻게 진행 중인가? A. 의료관광 사업의 활성화에는 조금의 시간이 더 필요할 것으로 예상된다. 우선 1차적으로 자생한방병원의 건강상품들을 중국 현지 사람들에게 알려 자생한방병원이라는 브랜드를 적극적으로 알리고, 2차적으로 이를 통해 얻은 인지도를 바탕으로 의료관광까지 확대하겠다는 게 계획이다. 이 과정에서 엘아이에스가 자생한방병원을 알리는 데 긴밀하게 협조할 생각이다. Q. 자생한방병원을 알리기 위해 생각해 둔 전략이 있는가? A. 자생한방병원은 연방국가에 이미 꽤 알려져 있는 것으로 알고 있다. 일례로 자생한방병원에서 카자흐스탄 대통령을 치료한 적이 있었다. 때문에 그곳 사람들이 가족 단위로 한국을 방문, 자생한방병원을 찾는다고 들었다. 이를 착안해 엘아이에스에서 중국 고위급 인사를 접촉, 자생한방병원의 의료기술을 체험할 수 있도록 하는 등 다양한 방법을 생각 중이다."
파이낸셜뉴스,138690,/news/news_read.nhn?article_id=0003600860&office_id=014&mode=search&query=엘아이에스&page=1,2016-02-15 16:22,엘아이에스 지난해 영업익 210억원..'흑자 전환',"엘아이에스가 지난해 상 최대 실적을 기록했다. 엘아이에스는 지난해 매출 1219억원을 달성했다고 15일 공시했다. 이는 2014년보다 3배 이상 증가한 것이다. 지난해 영업이익은 210억원을 기록하며 흑자 전환에 성공했다. 엘아이에스 관계자는 ""지난해 글로벌 기업과의 레이저 제조장비 공급계약 등 레이저 응용기기 제조 분야의 대형 수주와 방한 중국 관광객 증가로 인한 사후면세 사업 분야 지속적인 성장이 반영된 결과""라고 밝혔다. 엘아이에스는 OLED 디스플레이 분야의 기술력을 보유하고 있으며 주력 사업으로 추진중인 사후면세사업도 안착하고 있어 올해도 추가 성장을 기대하고 있다. 한편, 지난 2003년 설립된 엘아이에스는 레이저 응용기기 제조 부분 중 아몰레드 셀 실링 장비 분야에서 세계 시장을 선도하고 있으며, 플렉서블 디스플레이 구현을 위한 모바일 레이저 가공기술을 보유하고 있다. 사후면세 분야에서는 서울과 제주 등지에 6개 매장을 열고 운영 중이다. 올 1·4분기 내에 제주도 헛개 매장(진간보), 서울 인삼 매장(인삼예찬), 서울 이화여대 앞에 최대 규모의 종합 화장품 사후면세점을 추가로 오픈할 계획이다."
연합뉴스,138690,/news/news_read.nhn?article_id=0008601040&office_id=001&mode=search&query=엘아이에스&page=1,2016-08-10 09:09,"&lt;특징주&gt; 엘아이에스, 적자전환 소식에 52주 신저가",(서울=연합뉴스) 유현민 기자 = 엘아이에스가 올해 2분기 적자전환 소식에 10일 장 초반 52주 신저가를 갈아치웠다. 이날 오전 9시 4분 현재 코스닥시장에서 엘아이에스는 전날보다 1.49% 내린 1만3천250원에 거래됐다. 장 초반 1만2천900원까지 떨어져 52주 신저가를 새로 쓰기도 했다. 전자응용 공작기계 제조업체인 엘아이에스는 올해 2분기 연결기준 영업손실 23억4천만원을 기록해 작년 동기대비 적자 전환했다고 전날 장 마감 후 공시했다. 같은 기간 매출액은 306억4천만원으로 20.54% 늘었으나 당기순익은 27억2천만원 손실로 적자 전환했다.
한국경제,138690,/news/news_read.nhn?article_id=0003612091&office_id=015&mode=search&query=엘아이에스&page=1,2016-06-20 09:06,"[특징주]엘아이에스, 성장 전망에 '강세'","[ 김근희 기자  ] 엘아이에스가 사후면세점과 정보기술(IT) 사업이 호조를 보이며 성장하고 있다는 증권가 호평에 장 초반 강세다. 20일 오전 9시2분 현재 엘아이에스는 전 거래일보다 750원(3.97%) 오른 1만9650원에 거래되고 있다. 하나금융투자는 이날 엘아이에스에 대해 사후면세점 부문과 IT 사업 부문 모두 호조를 보일 것이라며 투자의견 '매수'와 목표주가 3만3200원을 제시했다. 이정기 연구원은 ""엘아이에스의 올해 영업이익은 263억원으로 전년동기 대비 235% 증가하고, 매출은 74.4% 늘어난 2126억원을 기록할 것""이라며 ""사후면세점 고성장과 유기발광다이오드(OLED) 디스플레이 장비 수주 증가 등이 실적을 이끌 것""이라고 말했다. 김근희 한경닷컴 기자"
머니투데이,138690,/news/news_read.nhn?article_id=0003630152&office_id=008&mode=search&query=엘아이에스&page=1,2016-02-15 16:24,"엘아이에스, 작년 영업이익 210억...흑자 전환","[머니투데이 고석용 기자] 엘아이에스는 지난해 영업이익이 210억6633만원으로 전년대비 흑자 전환했다고 15일 공시했다. 같은 기간 매출액은 1219억406만원으로 230% 증가했고, 당기순이익도 224억4665만원으로 흑자전환했다. 회사 측은 미국 등 해외 공급 계약이 증가하고 사업부 등 조직 구조조정으로 인해 수익성이 증가한 것이 원인이라고 밝혔다. 또 방한 중국 관광객의 증가로 사후 면세 시장이 지속적으로 선장한 것도 주요 원인이라 덧붙였다. textlinktopstart textlinktopend textlinkstart"
머니투데이,138690,/news/news_read.nhn?article_id=0003697849&office_id=008&mode=search&query=엘아이에스&page=1,2016-06-20 07:29,"엘아이에스, 사후면세점 시장의 선두주자 -하나","[머니투데이 김남이 기자] 하나금융투자는 20일 엘아이에스에 대해 사후면세점 사업이 고성장 중이고 IT장비 수주 증가도 기대된다고 밝혔다. 투자의견은 매수, 목표주가는 3만3200원을 신규 제시했다. 이정기 하나금융투자 연구원은 “엘아이에스의 고성장 부문인 사후면세점 사업은 올해부터 본격적인 이익 기여가 예상된다”며 “사후면세점 매장 수 증가가 나타나고 점 중국에 높은 인지도를 보유한 대기업 상품군 확대로 매장당 ASP(평균판매가격) 증가가 나타나기 때문”이라고 설명했다. 이 연구원은 “또 IT장비부문도 중국 기업들의 OLED투자 확대에 따른 OLED 레이저 커팅 및 실리장비 수주 증가가 예상된다”며 “6월에 공급계약을 체결한 중국 BOE와 티안마향 양산형 합착기판 레이저 커팅장비는 플렉서블 OLED를 포함한 디스플레이 패널공정에 필수적인 레이저 절단장비로 고객사들 니즈가 큰 상황”이라고 했다. 그는 “엘아이에스는 올 2분기부터 사후면세점의 계절적 성수기와 신규 매장 오픈에 따른 매출 증가가 예상된다”며 “하반기 글로벌 디스플레이 업체들의 대규모 투자가 예정되어 있어 IT 장비 부문의 수주 확대를 전망한다”고 분석했다. textlinktopstart textlinktopend textlinkstart"
매일경제,138690,/news/news_read.nhn?article_id=0003640014&office_id=009&mode=search&query=엘아이에스&page=1,2015-12-09 17:30,"엘아이에스, AUO에 30억 규모 OLED 레이저 제조장비 공급","엘아이에스는 9일 대만 AU옵트로닉스(AUO)와 30억원 규모의 OLED 레이저 제조장비 공급계약을 체결했다고 9일 밝혔다. 이번 계약으로 엘아이에스는 지난 8월 애플사와의 800억대 공급계약에 이어 AUO를 두번째 고객사로 확보하게 됐다. AUO는 후속 OLED 생산 공정에 엘아이에스의 장비를 투입할 예정이다. 엘아이에스는 국내 레이저 응용기기 분야의 선도 기업으로 아몰레드 셀 실링 장비 분야에서 세계 시장을 독점하고 있으며 플렉서블 디스플레이를 구현하기 위한 레이저 가공 기술도 보유하고 있다. 삼성전자 스마트폰 생산공정에 대규모 레이저 장비를 공급했으며 애플, LG디스플레이, 교세라 등에도 관련 장비를 공급해 왔다. 윤장원 엘아이에스 대표는 “AUO와의 추가 계약은 물론 글로벌 대표 디스플레이 업체들과도 대규모 계약들도 논의 중”이라며 ”레이저 장비 제조의 핵심 사업과 사후면세점을 바탕으로 고속 성장할 것”이라고 말했다. [매경닷컴 김용영 기자] r_start // r_end // [ⓒ 매일경제 & mk.co.kr, 무단전재 및 재배포 금지] 매일경제 관련뉴스해당 언론사에서 선정하며 언론사 페이지(아웃링크)로 이동해 볼 수 있습니다.차지연, 무릎 꿇은 자세로 두 다리 벌린 채…""그곳에 시선집중 '男心 덜컹'""차지연, 빛나는 시스루 의상에 드러난 육감적인 몸매EXID 하니 '완벽한 바디라인을 뽐내고~' [MK포토]기형적인 몰골의 백호 케니, ""인간들 탓에 이렇게 태어났죠""주다영, '하의실종한 채 도발적 포즈' 중요부위가…""내 눈을 믿을 수 없어!"""
헤럴드경제,138690,/news/news_read.nhn?article_id=0000982989&office_id=016&mode=search&query=엘아이에스&page=1,2016-01-29 09:31,"&lt;생생코스닥&gt;엘아이에스, LG디스플레이와 38.1억 규모 레이저 제조장비 공급계약",엘아이에스는 LG디스플레이와 38억1000만원 규모의 레이저 제조장비 공급계약을 체결했다고 29일 공시했다. 이는 2014년 매출액 대비 10.3%에 해당하며 계약기간은 오는 4월 9일까지다.
뉴시스,138690,/news/news_read.nhn?article_id=0007040398&office_id=003&mode=search&query=엘아이에스&page=1,2016-02-15 16:38,"엘아이에스, 지난해 매출 1219억 달성","【서울=뉴시스】김동현 기자 = ㈜엘아이에스는 지난해 매출 1219억원을 달성했다고 15일 공시했다. 지난 2014년 매출 약 369억원에 대비 3배 이상 증가했다. 지난해 영업이익은 210억원을 기록했다. 엘아이에스 측은 지난해 레이저 응용기기 제조 분야의 대형 수주 성과 및 사후면세 사업 분야의 지속적인 성장이 반영돼 이 같은 매출액을 기록했다고 밝혔다. 나일석 엘아이에스 회장은 ""OLED 디스플레이 수요가 증가하고 우리나라를 찾는 관광객수도 꾸준히 늘어나고 있는 만큼 엘아이에스의 가파른 성장은 향후에도 이어질 것""이라고 말했다."
한국경제TV,138690,/news/news_read.nhn?article_id=0000405832&office_id=215&mode=search&query=엘아이에스&page=1,2015-12-09 13:43,"엘아이에스, 대만 업체에 30억 규모 OLED 레이저 장비 공급","[한국경제TV 신선미 기자] 엘아이에스가 대만 AU옵트로닉스(AUO)와 30억원 규모의 OLED 레이저 제조장비 공급계약을 체결했다고 9일 발표했습니다. AUO는 모바일 디스플레이, TV패널 등을 생산하는 기업으로, 이번 계약은 엘아에스의 지난해 매출액 대비 8.4%에 해당하며 계약기간은 내년 1월10일까지입니다. 회사 측은 디스플레이 시장 무게 중심이 액정표시장치(LCD)에서 OLED로 점차 옮겨가고 있는 시점에서 나온 대규모의 계약 체결이라는 점에서 그 의미가 크다고 강조했습니다. 2006년부터 엘아이에스는 적극적인 설비 투자와 기술 개발을 통해 국내외 기업들에 OLED관련 레이저 장비를 공급해 왔습니다. 올해 8월 애플사와 800억 원대의 레이저 제조장비 공급계약을 맺었으며, 삼성전자 스마트폰 생산공정에 대규모 레이저 장비를 공급하고 있습니다."
이데일리,138690,/news/news_read.nhn?article_id=0003420015&office_id=018&mode=search&query=엘아이에스&page=1,2015-12-09 13:39,"엘아이에스, 대만 AUO와 30억 규모 계약 체결(상보)","[이데일리 박기주 기자] 레이저 응용기기 제조업과 사후면세사업을 펼치고 있는 엘아이에스(138690)는 9일 대만 AU옵트로닉스(AUO)와 30억원 규모의 OLED 레이저 제조장비 공급계약을 체결했다고 9일 밝혔다. 이는 지난해 매출액 대비 8.4%에 해당하며 계약기간은 내년 1월10일까지다. AUO는 모바일 디스플레이, TV패널 등을 생산하는 기업이다. 이번 계약은 디스플레이 시장의 무게 중심이 액정표시장치(LCD)에서 유기발광다이오드(OLED)로 점차 옮겨가고 있는 시점에서 나온 대규모의 계약 체결이라는 점에서 그 의미가 크다고 회사 측은 설명했다. 엘아이에스는 2006년부터 적극적인 설비 투자 및 기술 개발을 통해 국내외 기업들에 OLED관련 레이저 장비를 공급해 왔으며, 향후 OLED가 디스플레이 시장의 중심에 섬에 따라 가파른 성장을 이어갈 것으로 기대된다. 윤장원 엘아이에스 대표는 “이번 계약은 OLED의 애플의 아이폰 차기 모델 탑재, 삼성디스플레이의 8세대 OLED 양산 등 OLED가 시장의 중심으로 떠오르는 상황에서 의미 있는 성과”라며 “대만 AUO와의 추가 계약은 물론, 글로벌 대표 디스플레이 업체들과도 대규모 계약들도 논의 중에 있기 때문에 엘아이에스는 레이저 장비 제조의 핵심 사업과 사후면세점을 바탕으로 고속 성장을 할 것”이라고 말했다."
이데일리,138690,/news/news_read.nhn?article_id=0003576184&office_id=018&mode=search&query=엘아이에스&page=1,2016-06-30 09:38,"엘아이에스, 홍콩 사모펀드와 MOU&hellip;'아시아 전역 관광 체인'","[이데일리 임성영 기자] 엘아이에스가 홍콩 사모펀드와 손잡고 아시아 관광산업 활성화에 적극 나선다. 국내에서 사후면서점을 하고 있는 엘아이에스(138690)는 홍콩 대표 사모펀드인 액티스그룹(AKTIS Group, 대표 대니 옹 리)과 글로벌 사후면세점 체인망 구축에 대한 포괄적 업무협약(MOU)을 체결했다고 30일 밝혔다. 두 회사는 이번 협약을 통해 액티스그룹이 보유한 호텔 체인망과 사후면세점 연계를 통한 관광 상품 개발, 전자결제 시스템 인프라 구축 등을 핵심으로 아시아 관광업 가치사슬 확장에 함께 나설 예정이다. 엘아이에스는 액티스그룹이 보유하고 있는 글로벌 금융네트워크, 디지털금융 인프라와 호텔 체인망에 자사의 사후면세점, 여행 상품을 접목해 국내는 물론 아시아 전역에 이르는 관광 체인 구축에 나설 수 있게 됐다. 액티스그룹은 지난 3월 현대증권 매각 입찰시 KB금융지주, 한국금융과 경합한 바 있는 홍콩계 사모펀드다. 중국 소재 글렌뷰 호텔체인과 비은행금융업 6개사(단자·리스·보증보험·자산운영)등 한화 약 3조원 규모의 자산을 운영 중이다."
한국경제,138690,/news/news_read.nhn?article_id=0003612065&office_id=015&mode=search&query=엘아이에스&page=1,2016-06-20 07:55,"&quot;엘아이에스, 사후면세점과 IT 사업 모두 호조&hellip;목표가 3만3200원&quot;-하나","[ 김근희 기자  ] 하나금융투자는 20일 엘아이에스에 대해 사후면세점 부문과 정보기술(IT) 사업 부문 모두 호조를 보일 것이라며 투자의견 '매수'와 목표주가 3만3200원을 제시했다. 이정기 연구원은 ""엘아이에스의 올해 영업이익은 263억원으로 전년동기 대비 235% 증가하고, 매출은 74.4% 늘어난 2126억원을 기록할 것""이라며 ""사후면세점 고성장과 유기발광다이오드(OLED) 디스플레이 장비 수주 증가 등이 실적을 이끌 것""이라고 말했다. 사후면세점 사업 부문은 올해부터 본격적으로 이익 기여가 나타날 것이란 분석이다. 사후면세점 매장 수가 증가하는데다가 지난해 중동호흡기증후군(메르스) 사태로 인한 기저 효과로 중국인 입국자 수가 늘어나기 때문이다. 박 연구원은 ""사후면세점 매장 수가 지난해말 5개에서 올해 12월 10개로 늘어날 것""이라며 ""중국에 높은 인지도를 보유한 대기업 상품군 확대로 매장당 평균판매단가(ASP) 증가도 나타날 것""이라고 예상했다. IT장비 부문도 중국 기업들의 OLED투자 확대에 따라 성장할 것이란 판단이다. 그는 ""레이저 커팅장비는 플렉서블 OLED를 포함한 디스플레이 패널공정에 필수적인 레이저 절단장비""라며 ""고객사들 수요가 큰 상황인 만큼 하반기 대규모 장비 수주 가능성이 높다""고 내다봤다. 김근희 한경닷컴 기자"
이데일리,138690,/news/news_read.nhn?article_id=0003616020&office_id=018&mode=search&query=엘아이에스&page=1,2016-08-24 15:25,"엘아이에스, 최대주주 에이치씨자산관리&rarr;아이엠벤쳐스 변경",[이데일리 임성영 기자] 엘아이에스(138690)는 최대주주인 (주)에이치씨자산관리가 보유 지분 200만주를 아이엠벤쳐스(주)에 양도하는 계약을 체결했다고 24일 공시했다. 매각대금은 300억원이다. 이에 따라 엘아이에스의 최대주주는 아이엠벤쳐스(주)로 변경되며 새로운 최대주주의 지분율은 15.87%(200만주)다.
이데일리,138690,/news/news_read.nhn?article_id=0003476006&office_id=018&mode=search&query=엘아이에스&page=1,2016-02-15 16:38,"엘아이에스, 작년 영업익 211억&hellip; 흑자 전환",[이데일리 이명철 기자] 엘아이에스(138690)는 지난해 연결 영업이익이 210억6600만원으로 전년대비 흑자 전환했다고 15일 공시했다. 당기순이익도 224억4700만원으로 흑자로 돌아섰다. 매출액은 같은 기간 230.1% 증가한 1219억400만원이다. 회사는 레이저 응용 장비 제조 및 사후면세 사업의 성장 때문이라고 전했다.
헤럴드경제,138690,/news/news_read.nhn?article_id=0000993857&office_id=016&mode=search&query=엘아이에스&page=1,2016-02-15 16:36,"&lt;생생코스닥&gt;엘아이에스, 작년 영업익 210.6억&hellip;흑자전환",엘아이에스는 지난해 연결 영업이익이 210억6633만원으로 전년대비 흑자전환했다고 15일 공시했다. 매출액은 1219억406만원으로 230.1% 늘었고 당기순이익은 224억4665만원으로 흑자전환했다.
한국경제,138690,/news/news_read.nhn?article_id=0003617656&office_id=015&mode=search&query=엘아이에스&page=1,2016-06-30 09:13,"엘아이에스, 홍콩 사모펀드와 MOU 체결","[ 김근희 기자  ] 엘아이에스는 홍콩 대표 사모펀드인 액티스그룹(AKTIS Group)과 글로벌 사후면세점 체인망 구축에 대한 포괄적 업무협약(MOU)을 체결했다고 30일 밝혔다. 액티스그룹은 홍콩계 사모펀드로 중국 소재 글렌뷰 호텔체인과 비은행금융업 6개사 등 약 3조원 규모의 자산을 운영 중인 기업이다. 이번 협약을 통해 엘아이에스는 액티스그룹이 보유한 호텔 체인망과 사후면세점 연계를 통한 관광 상품 개발, 전자결제 시스템 인프라 구축 등에 나선다. 회사 측은 액티스그룹이 보유하고 있는 금융네트워크, 디지털금융 인프라 및 호텔 체인망에 엘아이에스의 사후면세점을 접목해 아시아 전역에 이르는 관광 체인 구축하겠다는 방침이다. 윤장원 엘아이에스 대표는 ""엘아이에스는 새로운 주력 사업인 호텔 마스터리스(master lease) 사업과 토탈 여행 서비스 제공 사업 등 다양한 분야에서 액티스 그룹과의 시너지를 만들 것""이라고 밝혔다. 김근희 한경닷컴 기자"
이데일리,138690,/news/news_read.nhn?article_id=0003475994&office_id=018&mode=search&query=엘아이에스&page=1,2016-02-15 16:28,"엘아이에스, 작년 매출 1219억원&hellip;전년비 3배 성장",[이데일리 김진우 기자] 엘아이에스(138690)(대표 윤장원)는 지난해 매출 1219억원으로 사상 최대 실적을 기록했다고 15일 밝혔다. 2014년 매출(369억원)보다 3배 이상 늘어난 수치다. 지난해 영업익은 210억원으로 흑자전환에 성공하며 역시 사상 최대치를 기록했다. 이번 실적은 지난해 글로벌 기업과의 레이저 제조장비 공급계약 등 레이저 응용기기 제조 분야의 대형 수주 성과와 방한 중국 관광객 증가로 인한 사후면세 사업 분야의 지속적인 성장이 반영된 결과라고 회사 측은 설명했다. 나일석 회장은 “이번 사상 최대 실적은 사후면세와 레이저 제조업 모두에서 뛰어난 성과를 거둠으로써 달성할 수 있었다”며 “본사가 강점을 가지고 있는 OLED 디스플레이 수요가 증가하고 우리나라를 찾는 관광객수 또한 꾸준히 늘어나고 있는 만큼 엘아이에스의 가파른 성장은 향후에도 이어질 것”이라고 말했다.
전자신문,138690,/news/news_read.nhn?article_id=0002492631&office_id=030&mode=search&query=엘아이에스&page=1,2016-06-20 08:42,"[@기업분석리포트]엘아이에스, &quot;독보적인 시장지배력&hellip;&quot; 매수-하나금융투자","하나금융투자에서 20일 엘아이에스(138690)에 대해 ""독보적인 시장지배력을 바탕으로 사후면세점 시장 선도""라며 투자의견을 '매수'로 제시하였다. 아울러 12개월 목표주가를 33,200원으로 내놓았다. 하나금융투자 이정기, 안주원, 김재윤, 김두현 애널리스트가 동종목에 대하여 이번에 제시한 '매수'의견은 하나금융투자에서는 올해들어 처음 내놓는 매매의견이며 그리고 최근 분기내 발표된 전체 증권사 리포트의 컨센서스와 비교를 해볼 경우에 오늘 발표된 투자의견은 전체의견에 수렴하고 있어, 이번 의견은 시장의 평균적인 기대감이 객관적으로 표현된 것으로 분석되고 있다. 또한 전일 종가 기준으로 볼때 동종목의 현주가는 이번에 제시된 목표가 대비 75.7%의 저평가 요인이 존재한다는 해석이 제시되고 있다."
