source,symbol,link,date,title,content
파이낸셜뉴스,138610,/news/news_read.nhn?article_id=0003999929&office_id=014&mode=search&query=나이벡&page=1,2018-04-11 13:30,[fnRASSI]나이벡(138610) 전일대비 29.84% 상승,"현재 나이벡(138610)은 전일대비 29.84% 상승하여 16,100원 선에서 거래가 이루어지고 있다.                   지표               항목               값               종합점수                 성장성               매출액증가율               0.15               5.27                 자기자본증가율               -0.07                 안정성               부채비율               141.81               3.92                 유동비율               69.62                 이익안정성               3.89                 수익성               ROA               -11.29               0.75                 ROE               -27.31                 영업이익율               -18.76          나이벡의 퀀트 재무 점수는 9.94점으로 지난 분기에 비해 성장성 점수가 상승했다. 이는 자기자본 증가율이 증가하였기 때문이다. 수익성 측면에서 볼때 ROA, ROE, 영업이익률 모두 하락하여 이전보다 낮은 점수를 받았다. 거래참여는 개인투자자가 가장 활발 최근 한달간 주체별 거래비중을 살펴보면 개인이 전체 거래의 92.21%를 차지하며 가장 적극적인 모습을 보여줬고, 외국인은 7.54%를 나타냈으며 기관은 0.24%를 나타냈다. 그리고 최근 5일간 거래비중은 개인이 93.37%로 가장 높은 참여율을 보였고, 외국인이 6.61%를 보였으며 기관은 0.01%를 나타냈다. 'fnRASSI'는 증권전문 기업 씽크풀과 파이낸셜뉴스의 협업으로 로봇기자가 실시간으로 생산하는 기사입니다."
아시아경제,138610,/news/news_read.nhn?article_id=0003957301&office_id=277&mode=search&query=나이벡&page=1,2017-03-21 09:38,"나이벡, 11억 규모 중국시장 독점판매권 계약",[아시아경제 권성회 기자] 나이벡은 11억2450만원 규모로 치과용 골이식재 및 콜라겐 바이오소재의 중국시장 독점판매권 및 기본공급계약을 맺었다고 21일 공시했다. 이는 최근 매출액 대비 26.94%에 해당하는 금액이다. 계약상대방은 영업비밀 보호측면에서 기재하지 않기로 했다. 유보기한은 2027년 3월20일이다.
서울경제,138610,/news/news_read.nhn?article_id=0003338227&office_id=011&mode=search&query=나이벡&page=1,2018-07-03 14:04,"&lt;코&gt;나이벡, 전일 대비 9.84% 상승.. 일일회전율은 1.86% 기록","[서울경제] 나이벡(138610) 은 3일 오후 2시 3분 현재 9.84% 오른 13,950원에 거래되고 있으며, 40(매도):60(매수)의 매수우위를 기록하고 있다. 거래대금은 15억5,192만, 거래량은 11만8,720주로 거래량회전율은 1.86%로 나타났다. 지난 1개월간 나이벡은 상승 13회, 하락 16회를 기록했고, 주가수익률은 -2.79% 표준편차는 3.54%를 기록했다. 이 기간 ' 제약업 ' 업종 평균 주가수익률은 -8.31%로 나타났으며, 변동성은 1.74%를 기록했다. 이 시각 현재 ' 제약업 '은 0.75% 상승 중이며, 39(매도):61(매수)의 매수우위를 기록하고 있다."
매일경제,138610,/news/news_read.nhn?article_id=0004138317&office_id=009&mode=search&query=나이벡&page=1,2018-04-23 14:19,"나이벡, 암줄기세포 성장 억제 펩타이드 美 특허 등록","펩타이드 전문기업 나이벡은 암줄기세포 성장을 억제하는 펩타이드를 개발해 미국에 특허 등록을 완료했다고 23일 공시했다. 이 특허 발명의 명칭은 '암줄기세포의 성장억제용 항암기능성 펩타이드 및 그 용도(Anti-Cancer Peptide for Inhibition of Proliferation on the Cancer Stem Cells and Use Thereof)'다. 암 조직 내 존재하는 암 줄기세포의 증식을 억제하고 세포 사멸을 유도하는 항암기능성 펩타이드에 대한 기술이다. 회사 관계자는 ""이 펩타이드는 암줄기세포에 발현하는 단백질을 선택적으로 저해하면서 항암효과를 일으키며 암 줄기세포에만 작용돼 정상 세포에는 독성이 없다""면서 ""반면 항체와 유사한 표적 선택 및 결합능을 가지면서 암조직의 성장과 재발을 제어하는 효과가 있다""고 설명했다. [디지털뉴스국 김경택 기자] r_start // r_end //"
서울경제,138610,/news/news_read.nhn?article_id=0003267206&office_id=011&mode=search&query=나이벡&page=1,2018-04-11 10:56,나이벡 장중 상한가&middot;&middot;&middot;항암 줄기세포 기술 개발 기대감,"[서울경제] 펩타이드 전문기업인 나이벡(138610) 이 11일 장중 상한가를 기록 중이다. 나이벡은 이날 코스닥 시장에서 오전 10시 51분 현재 전날 대비 29.84%(3,700원) 오른 1만6,100원에 거래 중이다. 52주 신고가다. 3거래일 연속 상승세로 최근 5거래일 중 거래량이 가장 많다. 나이벡은 조직재생용 바이오소재, 구강보건제품, 펩타이드 융합바이오 소재, 펩타이드 치료제 등을 개발하고 있는 것으로 알려졌다. 나이벡이 개발한 펩타이드는 암의 근원이라고 할 수 있는 암 줄기세포까지 공격해 근본적인 암 치료 방법으로 기대를 모으고 있는 것으로 전해졌다. 최근에는 콜라겐이 접목된 골 재생용 바이오 제품에 관한 유럽통합규격인증(CE) 인증을 획득해 본격적인 판매에 나서기도 했다."
서울경제,138610,/news/news_read.nhn?article_id=0003278041&office_id=011&mode=search&query=나이벡&page=1,2018-04-23 14:48,"&lt;코&gt;나이벡, 상한가 진입.. +29.82% &uarr;","[서울경제] 오후 2시 46분 현재 나이벡(138610) 이 +29.82% 오른 22,200원(▲5,100)으로 장중 상한가에 진입했다. 거래대금은 855억10만, 거래량은 427만9,797주를 기록하고 있으며, 수급측면으로는 46(매도):54(매수)의 매수우위를 보이고 있다. 나이벡은 전일 하락(17,100원, ▼-100, -0.58%) 마감했으나, 이 시각 현재 장중 상한가를 기록하며 강세를 보이고 있다. 지난 1개월간 나이벡은 상한가 2회, 상승 15회, 하락 13회를 기록했고, 주가수익률은 122.22%였다. 이 기간 ' 제약업 ' 업종 평균 주가수익률은 0.72%를 기록했다. 현재 ' 제약업 ' 총 73개 종목 중 상한가 종목은 1개, 상승 종목은 7개로, 일부 종목만이 상승세를 보이고 있다. ( 프로스테믹스(203690) +4.66%, 중앙백신(072020) +1.93%, 휴젤(145020) +1.31%)"
서울경제,138610,/news/news_read.nhn?article_id=0002997027&office_id=011&mode=search&query=나이벡&page=1,2017-03-21 09:40,"나이벡, 펩타이드 기술이전 계약 체결","[서울경제] 21일 나이벡(138610)은 임플란트 전문기업 스트라우만과 펩타이드 기술이전 계약을 체결했다고 공시했다. 본 기술이전 건으로 지급받은 초기 기술료는 100만달러(약 11억 2천만원)이며 계약기간은 2027년 3월까지 10년간이다. 향후 추가적인 매출 발생과 기술이전 관련해서는 연구개발비가 별도로 지급될 예정이다. 이번에 이전하는 기술은 다양한 분야에 적용이 가능하나 치과 분야의 차세대 치료제 및 치료 재생소재 개발에 대해서만 사용하는 것으로 제한하였으며, 임상 개발비 및 향후 상업화 등에 필요한 경비에 대해 지급을 받는 조건으로 체결됐다. 향후 기술이 접목된 제품 판매에 대해서는 본 기술이전과는 별도로 계약을 통해 추가적인 매출이 이루어지는 구조며, 개발한 제품에 대해서는 나이벡이 독점으로 제조 및 공급하는 방식이다."
파이낸셜뉴스,138610,/news/news_read.nhn?article_id=0004050890&office_id=014&mode=search&query=나이벡&page=1,2018-07-03 14:12,[fnRASSI]나이벡(138610) 현재 +10.24%,"현재 나이벡(138610)은 전일대비 10.24% 상승하여 14,000원 선에서 거래가 이루어지고 있다. 주가등락폭이 너무 커 최근 한달간 나이벡의 상장주식수 대비 거래량을 비교해보니 일별 매매회전율이 2.57%로 집계됐다. 동기간 일평균 주가변동률은 10.62%로 장중 주가등락이 심하기 때문에 투자시 주의가 요망된다. 외국인과 기관은 순매도, 개인은 순매수(한달누적)  6월29일부터 전일까지 외국인이 2거래일 연속 순매수를 보였다. 4주간을 기준으로 보면 외국인이 매도 관점으로 접근하면서 21,953주를 순매도했고, 기관도 매도 우위로 반전되면서 3,581주를 순매도했지만, 개인은 오히려 초반에 동종목을 순매수한 이후에 기세를 이어가며 25,534주를 순매수했다. 'fnRASSI'는 증권전문 기업 씽크풀과 파이낸셜뉴스의 협업으로 로봇기자가 실시간으로 생산하는 기사입니다."
파이낸셜뉴스,138610,/news/news_read.nhn?article_id=0004050922&office_id=014&mode=search&query=나이벡&page=1,2018-07-03 14:41,"[공시] 나이벡, 합성 펩타이드 이용 유도만능줄기세포 제조방법 특허 취득",나이벡은 3일 합성 펩타이드를 이용한 유도만능줄기세포의 제조방법에 관한 특허를 취득했다고 공시했다. 이 특허기술로는 동물혈청 또는 이종세포와의 공배양 등이 필요없는 무-이종감염 또는 무-지지세포 조건에서 미분화 상태의 다능성 줄기세포를 효율적으로 제조할 수 있다. 나이벡은 이 기술이 임상 적용이 가능한 줄기세포 치료제 개발에 유용하다며 신약 개발에 활용할 거라고 전했다.
파이낸셜뉴스,138610,/news/news_read.nhn?article_id=0003737784&office_id=014&mode=search&query=나이벡&page=1,2016-11-22 14:52,[공시]나이벡 이주연 이사 5500주 취득,나이벡 이주연 사내이사는 주식매수청구권 행사로 보통주 5500주(0.10%)를 취득했다고 22일 공시했다. 취득단가는 1882원이다.
이데일리,138610,/news/news_read.nhn?article_id=0004130140&office_id=018&mode=search&query=나이벡&page=1,2018-06-20 09:49,"나이벡, 유로페리오에서 콜라겐복합재료 글로벌 런칭","유로페리오 2018에서 ‘OCS-B Xenomatrix Collagen’ 런칭 [이데일리 윤필호 기자] 나이벡(138610)은 치주학·임플란트 치과 분야 학회인 ‘유로페리오(EuroPerio9) 2018’에서 콜라겐복합 치과재료를 런칭할 계획이라고 20일 밝혔다. 유로페리오는 유럽치주과학회(EFP)가 주최하는 세계 최대 규모의 치주학 분야 학술대회다. 1994년 시작한 이래 3년마다 열리며 오는 20일부터 23일(현지시간)까지 네덜란드 암스테르담에서 개최한다. 나이벡은 이번 학회를 통해 콜라겐이 접목된 골 재생용 바이오 소재를 정식 런칭할 계획이다. 학회에 선보일 ‘OCS-B Xenomatrix Collagen’은 돼지피부에서 추출된 골재생 촉진제로 골재생 촉진을 통한 시술시간 단축 및 시술의 편리성을 갖춰 저명한 치과의사 및 학술지에서 호평을 받은 제품이다. 이 제품은 지난 3월 CE 인증을 받았으며, 글로벌 기업과 공급 계약도 체결돼 있어 제품경쟁력을 갖춘 제품이라고 회사측은 설명했다. 나이벡은 글로벌 기업의 유통경로 및 판매 네트워크를 통해 제품을 공급하는 한편 유로페이오에제품을 선보여 추가적인 러브콜을 기대하고 있다. 나이벡 관계자는 “제품 기술력을 바탕으로 다양한 기업들과 공급계약을 통한 매출성장을 이룰 예정”이라며 “약 4년간의 연구결과를 통한 CE 인증 획득과 동시에 공급 물량이 소화가능한 생산시설도 확충돼 이번 런칭을 통해 미국, 유럽 등 글로벌 지역의 매출 증대를 예상하고 있다”고 설명했다."
아시아경제,138610,/news/news_read.nhn?article_id=0003957316&office_id=277&mode=search&query=나이벡&page=1,2017-03-21 09:43,"나이벡, 유럽기업과 11억 규모 기술이전계약","[아시아경제 권성회 기자] 나이벡은 유럽 스트라우만(Straumann AG)과 11억2450만원 규모로 치료용 펩타이드 기술의 치과분야 응용기술 이전계약을 맺었다고 21일 공시했다. 이는 자기자본 대비 9.14%에 해당하는 금액이다. 회사 측은 “치료용 펩타이드 기술은 현재 전임상 단계로 향후 진행되는 임상비용 및 상업화에 소요되는 경비는 별도로 지급받는다”며 “임상완료 후 제품 출시 예정이며, 향후 매출발생에 따른 경상기술료(running royalty)는 상기금액과 별도로 지급받는다”고 설명했다."
파이낸셜뉴스,138610,/news/news_read.nhn?article_id=0003999588&office_id=014&mode=search&query=나이벡&page=1,2018-04-11 09:13,"[fnRASSI]나이벡, 상한가 기록","나이벡(138610)은 상한가를 기록하고 있다. 동종목은 현재 16,100원선에서 이루어지고 있다. 참고로 52주 최고가는 16,100원(18년 04월 11일), 최저가는 7,270원(17년 09월 05일)원이다. 최근 3일동안 평균 거래량은 32만 주이다. 이는 250일 일 평균 거래량 9만 주와 비교해보면 최근 거래량이 급격히 늘어났다는 것을 알 수 있다. 외국인/개인 순매수, 기관은 순매도(한달누적)  전일 외국인이 10,541주를 순매도했다. 4주간을 기준으로 보면 외국인이 매수반전의 모습을 보이며 2,350주를 순매수했고, 개인들도 초반에 동종목을 순매수한 이후에 최근에는 순매수량이 줄어들고 있음에도 불구하고 3,090주를 순매수했다. 하지만 기관은 매도 우위를 지속하면서 5,440주를 순매도했다. 외국인 보유량 감소, 기관 증가 (5일 누적) 최근 5일간 동종목의 외국인 투자자는 3,195주 순매도하였고 반면 기관은 0주 순매수하였다. 전날 외국인은 10,541주 순매도했지만 기관은 순매수량이 0으로 보유비율 그대로 유지했다. 다음 표는 동종목의 외국인, 기관의 일별 순매수량을 나타낸 것이다. 'fnRASSI'는 증권전문 기업 씽크풀과 파이낸셜뉴스의 협업으로 로봇기자가 실시간으로 생산하는 기사입니다."
코메디닷컴,138610,/news/news_read.nhn?article_id=0000036421&office_id=296&mode=search&query=나이벡&page=1,2018-06-21 16:27,"나이벡, 세계면역암학회서 항암 펩타이드 연구 발표","펩타이드 전문 기업 나이벡이 세계 최대 바이오 행사인 세계면역암학회(immuno-oncology 2018)에 참석해 개발 중인 펩타이드 기반 항암 치료제 연구 결과를 발표한다고 21일 밝혔다. 올해 세계면역암학회는 오스트리아 비엔나에서 오는 6월 25일부터 개최된다. 현재 사용 가능한 약물과 세포 치료를 비롯해서 암 면역 관련 향후 방향과 면역 요법 반응을 평가하고 면역 요법 약물 독성 관리 등 다양한 주제로 컨퍼런스가 진행된다. 특히 의약품과 진단법 등 바이오마커 연구 개발의 모든 영역을 다룰 것으로 예상돼 전문 학술 컨퍼런스의 장이 될 것으로 보인다. 나이벡은 이번 행사에서 주력 기술인 펩타이드 기반 항암 치료제 및 면역 질환 치료제 등 파이프라인의 연구 결과를 발표한다. 나이벡의 펩타이드 기반 항암 치료제 관련 연구는 정상 세포를 제외한 암세포와 암줄기세포만을 공격하는 표적 기능을 탑재해 안전성을 확보한 것으로, 원천적인 암 치료를 위한 세포 사멸 기능을 갖췄다. 나이벡 관계자는 ""유방암과 난소암과 같이 재발률이 높은 암 치료제에 사용할 경우 매우 효과적일 것으로 기대하고 있다""며 ""암 진단 및 항암제와 병용 투여 시 큰 효과를 볼 수 있는 기술""이라고 말했다. 회사는 이번 학회 참석을 통해 현재 개발 중인 항암 관련 기술 이전 네트워크를 확장하며 세계적인 기업을 파트너로 확보하는데 주력할 방침이다. 나이벡 관계자는 ""시장에서 관심도가 가장 높은 항암 치료제 관련해 비임상 단계에서도 탁월한 안정성 및 약효를 통해 글로벌 파트너사와 연계점을 확장하는데 주력할 것""이라며 ""회사가 보유한 핵심 기술력을 세계에 알려 추가적인 파트너 유치 및 성장 기반을 마련할 예정""이라고 말했다. [사진=Ravil Sayfullin/shutterstock]"
헤럴드경제,138610,/news/news_read.nhn?article_id=0001212891&office_id=016&mode=search&query=나이벡&page=1,2017-03-21 09:56,"[생생코스닥] 나이벡, 글로벌 바이오기업과 펩타이드 기술이전 계약","-전년 매출액의 24%에 달하는 펩타이드 기술이전…올해 턴어라운드 [헤럴드경제=양영경 기자] 펩타이드 전문기업 나이벡은 바이오 임플란트 전문기업 스트라우만과 펩타이드 기술이전 계약을 체결했다고 21일 공시했다. 이번 기술이전으로 지급받은 초기 기술료는 100만불(한화 약 11억3000만원)이다. 계약기간은 올해 3월부터 2017년 3월까지 10년간이다. 이전 기술은 다양한 분야에 적용 가능하나, 치과 분야의 차세대 치료제와 치료 재생소재 개발에 대해서만 사용하는 것으로 제한했다. 임상 개발비와 향후 상업화 등에 필요한 경비를 지급받는 조건으로 체결됐다. 관련된 제품 판매는 기술이전과 별도로 계약을 통해 추가적인 매출이 발생한다. 제품은 나이벡이 독점으로 제조ㆍ공급한다. 회사 관계자는 “이번 기술이전 계약금은 나이벡의 지난해 매출(약 48억원)의 24%에 달한다”며 “향후 기술이 접목된 제품 판매 등 별도의 계약을 통해 추가적인 매출이 기대된다”고 말했다. 나이벡은 서울대학교 치과대학 연구진을 바탕으로 현 미래창조과학부 산하 연구재단지원 지능형생체계면공학연구센터(IBEC)의 연구 결과물을 상용화해 2004년 설립됐다. 이후 2011년 7월 펩타이드 관련 기술로 기술특례 상장했다. 나이벡은 현재 약 400종에 달하는 독자 펩타이드 기술을 보유 중이다. 올해는 펩타이드 구역 증축을 상반기 내 완료해 관련 의약품을 생산한다는 계획이다."
아시아경제,138610,/news/news_read.nhn?article_id=0004269898&office_id=277&mode=search&query=나이벡&page=1,2018-07-03 14:43,"[공시+]나이벡, 펩타이드 기반 유도만능줄기세포 제조방법 미국 특허 등록","[아시아경제 권성회 기자] 펩타이드 전문기업 나이벡이 합성 펩타이드를 이용한 유도만능줄기세포의 제조방법에 대해 미국에 특허를 등록했다고 3일 공시를 통해 밝혔다. 서울대학교와 나이벡이 공동으로 연구한 특허 명칭은 ‘합성 펩타이드를 이용한 유도만능줄기세포의 제조방법(Method for Preparing Induced Pluripotent Stem Cells Using Synthetic Peptide)’다. 특히 이 기술은 과학기술정보통신부 바이오의료 기술개발사업의 지원 과제인 성과물로 합성 펩타이드 신약 후보물질을 이용해 세포 내 신규 바이오마커를 제어함으로써 안전하게 임상적용 가능한 역분화 줄기세포를 제조하는 방법이다. 이 기술은 기존의 임상 적용이 바이러스로 유도만능줄기세포를 제조한 것이 아니라 펩타이드를 이용하여 제조하기 때문에 인체 안전성을 확보했으며, 기존 역분화줄기세포를 배양하는데 걸렸던 시간을 획기적으로 단축시켜 효율성까지 확보한 기술로 평가된다고 회사 측은 설명했다. 특히, 이 기술은 미분화 상태의 다능성 줄기세포를 효율적으로 제조할 수 있으므로 임상적용이 가능하다는 점이 가장 큰 장점이라고 덧붙여 말했다. 줄기세포는 무한하게 자가 재생을 할 수 있고 신체 모든 조직의 세포로 분화할 수 있어 신약개발 및 인체 질환의 발병 원인 규명 및 치료 연구대상으로 각광받고 있다. 그러나, 현재까지는 바이러스에 대한 잠재적 위험뿐 아니라 유전자의 변이와 같은 다양한 문제들이 항상 내제돼 있어 인체에 적용하는 데 한계가 있는 상황이다. 나이벡은 이러한 문제점을 해결하기 위해 펩타이드 기술로 안전성을 확보한 줄기세포 배양 및 분화 기술을 찾아내, 이를 효율적으로 배양하여 임상적용이 가능한 줄기세포 치료제 개발에 매우 유용할 수 있게 됐다라는 점에서 큰 기대를 모으고 있다. 나이벡 관계자는 “나이벡의 펩타이드 기반 관절염 치료제와 연계하여 연구개발 중이며, 염증 개선에 큰 시너지 효과를 낼 것으로 기대하고 있다”며 “미국 특허 등록을 통해 선진 시장에서의 기술 경쟁력을 선점하고, 다양한 기술력을 통해 세계 재생의료 분야 핵심시장에서 진입에 유리한 입지를 다질 예정”이라고 말했다."
아이뉴스24,138610,/news/news_read.nhn?article_id=0000447605&office_id=031&mode=search&query=나이벡&page=1,2018-05-24 09:26,"나이벡, 펩타이드 관련 유럽 특허 등록","[아이뉴스24 장효원 기자] 펩타이드 전문기업 나이벡(대표이사 정종평)이 세포투과성 펩타이드 및 형광표지 자성나노 입자 관련한 특허를 유럽에 등록했다고 23일 밝혔다. 특허 발명의 명칭은 '세포투과성 펩타이드와 형광표지 자성나노입자의 복합체 및 그 용도'다. 이 기술은 세포투과성 펩타이드와 형광표지 자성나노입자를 화학적으로 결합시켜 세포가 내포 작용 없이 세포 내로 안정적으로 투입시킬 수 있는 세포 영상용 조성물 관련한 기술이다. 나이벡이 개발한 세포투과성 펩타이드과 형광표지 자성나노입자의 복합체는 약물을 전달하는 운반체 역할이 가능하며 또한 병의 진단도 가능하다. 나이벡 관계자는 ""생체 내 도입시킬 경우, 직접 세포 내로 투과돼 기존의 바이러스성 수송체에 비교해 높은 안정성을 확보할 수 있으며 부작용을 최소화할 수 있다""고 설명했다. 특히 종양치료에 적용이 가능한 기술로 세포 내 투과기능성 항암 펩타이드를 자성나노입자의 복합체에 결합시켜 암세포를 공격, 암 치료와 함께 암의 치료 정도를 관찰할 수 있어 암 치료 및 진단이 동시에 가능한 획기적 기술이라는 설명이다. 회사 관계자는 ""이 기술은 다양한 약물에 대한 운반체 역할 뿐만 아니라 약물에 의한 치료효과의 진단이 동시에 가능하다""며 ""MRI와 같은 영상 진단 시 효과적으로 사용될 것으로 기대하며 치료 효과 또한 극대화 될 것으로 예상된다""고 말했다. 최근 나이벡은 암줄기세포 표적 항암 펩타이드 기술에 대한 특허를 등록하는 등 근본적인 암 치료제에 대한 신약개발을 활발히 진행하고 있다. 이외에 항암 및 줄기세포 치료 펩타이드 기술에 대해 전임상을 진행중이며, 효능 검증 등 의약품 개발 및 기술이전에 대해서도 논의하고 있다고 회사 측은 답했다. /장효원기자"
이데일리,138610,/news/news_read.nhn?article_id=0003777596&office_id=018&mode=search&query=나이벡&page=1,2017-03-21 10:24,"[특징주]나이벡, 기술이전계약 소식에 강세",[이데일리 최정희 기자] 나이벡(138610) 주가가 기술이전계약 소식에 강세를 보이고 있다. 21일 마켓포인트에 따르면 이날 오전 10시 22분 나이벡 주가는 전 거래일보다 3.96% 오른 8130원에 거래되고 있다. 이날 나이벡은 세계적인 임플란트 회사 유럽 스트라우만(Straumann AG)과 치료용 펩타이드 기술의 치과분야 응용기술과 관련해 기술이전 계약을 체결했다고 공시했다. 초기기술료는 11억2450만원이다. 치료용 펩타이드 기술은 현재 전임상 단계로 향후 진행되는 임상비용 및 상업화에 소요되는 경비에 대해선 별도로 지급을 받을 예정이다.
