source,symbol,link,date,title,content
연합뉴스,138690,/news/news_read.nhn?article_id=0007932960&office_id=001&mode=search&query=엘아이에스&page=1,2015-10-21 10:40,"사후면세점 '엘아이에스', '인삼예찬' 인수","(서울=연합뉴스) 전준상 기자 = 사후면세 전문회사인 엘아이에스는 인삼상품 판매 전문기업인 '인삼예찬'을 인수했다고 21일 밝혔다. 사후면세점은 외국인 관광객이 여행중 구입한 물품을 사용하지 않고 자국으로 가져간다는 조건으로 부가가치세 등 내국세를 출국전에 환급받을 수 있는 상점을 말한다. 인삼예찬은 2013년 설립된 인삼 상품 판매 전문 기업이다. 지난해 매출 118억원에 영업이익 흑자를 달성했다. 태극삼, 흑삼 등의 인삼 상품이 유커(遊客·중국인 관광객)로부터 큰 인기를 끌고 있다고 엘아이에스는 전했다. 엘아이에스는 인삼예찬의 지분 100%를 인수했고 향후 그간 축적한 사후면세점 운영 노하우를 바탕으로 연간 200억원 이상의 매출을 달성할 계획이다. 엘아이에스가 운영할 제주 인삼예찬 매장은 유커가 즐겨 찾는 '바오젠(寶健)' 거리 인근인 제주시 연삼로에 있어 많은 중국인들의 방문이 이어질 것으로 기대를 모으고 있다. 한편 엘아이에스는 9월 1일 인천 영종도 인천공항 인근에 잡화 전문 매장인 '엘리스 마트'를 신규로 연 바 있다. 현재까지 전국 6개 매장을 열었으며 연내 8개 매장 개설을 목표로 하고 있다. 서울과 인천, 제주도 등 각지에서 헛개, 인삼, 화장품, 잡화 품목을 판매중이다."
파이낸셜뉴스,138690,/news/news_read.nhn?article_id=0003829783&office_id=014&mode=search&query=엘아이에스&page=1,2017-06-15 13:48,[fnRASSI]엘아이에스(138690) 현재 8.41% &uarr;,"엘아이에스(138690)는 현재 주가가 전일 대비 8.41% 상승한 11,600원 선에서 거래가 이루어지고 있다. 퀀트 재무분석, 종합점수 3점으로 상승                    지표               항목               값               종합점수                 성장성               매출액증가율               -0.16               2.09                 자기자본증가율               -0.12                 안정성               부채비율               168.65               4.61                 유동비율               124.16                 이익안정성               4.72                 수익성               ROA               -18.67               0.7                 ROE               -50.15                 영업이익율               -11.44          엘아이에스의 퀀트 재무 점수는 7.4점으로 3개월 이전 6.89점보다 올랐다. 지난 분기에 비해 성장성 점수가 상승했다. 이는 자기자본 증가율이 증가하였기 때문이다. 유동 비율이 증가하여 안정성 종합 점수는 상승했다. 수익성 측면에서 볼때 ROA, 영업이익률이 개선되어 이전보다 좋은 점수를 받았다. 상장주식수 대비 거래량은 0.39%로 적정수준 최근 한달간 엘아이에스의 상장주식수 대비 거래량을 비교해보니 일별 매매회전율이 0.39%로 집계됐다. 그리고 동기간 장중 저점과 고점의 차이인 일평균 주가변동률을 6.54%를 나타내고 있다. 'fnRASSI'는 증권전문 기업 씽크풀과 파이낸셜뉴스의 협업으로 로봇기자가 실시간으로 생산하는 기사입니다."
한국경제TV,138690,/news/news_read.nhn?article_id=0000637206&office_id=215&mode=search&query=엘아이에스&page=1,2018-05-23 09:25,"엘아이에스, 전일 대비 약 6% 상승한 15,050원","[한국경제TV 라이온봇 기자] 엘아이에스는 5월 23일 9시 25분 전일 대비 약 6% 상승한 15,050원에 거래되고 있다. 엘아이에스는 코스닥 상장 기업으로 반도체 업종에 속해 있다. 시가총액은 1,856억원으로 코스닥 상장기업 중 344위에 위치 해 있다. [종목 성향 진단] [그림 1] 종목 성향 진단 엘아이에스의 투자 스타일은 모호한 측면이 있으나 성장주라고 볼 수 있다. 주가 고평가 우려가 공존하지만 높은 성장성이 기대되는 기업이다. 주가 모멘텀은 부진한 편이었다. 최근 6개월 수익률은 -17.15%의 하락폭을 기록했다. 최근 1개월 수익률 또한 -4.83% 하락하며 부진한 모멘텀을 이어가고 있다. 엘아이에스 종목에 대한 투자자의 관심도는 평범한 수준이었다. [투자 점수 진단] [그림 2] 투자 점수 진단 엘아이에스는 성장성(매출증가율(YoY)) 측면에서 두각을 나타내고 있다. 최근 매출증가율(YoY)은 95점으로 6개의 핵심 팩터 중 가장 높은 점수를 기록했다. 매출증가율(YoY)은  전체 시장 내 32위를 기록하며 상위 4.7%에 위치했다. 업종별로는 12위를 기록하며 상위 6.51%에 위치했다. 그리고 효율성(ROA) 역시 도드라지는 편이다. 효율성 점수는 83점으로 두번째로 높은 점수를 기록했다. ROA는 전체 시장 내 119위를 기록하며 상위 17.43%에 위치했다. 업종별로는 43위를 기록하며 상위 23.86%에 위치했다. 그러나 부채비율과 PBR은  아쉬움을 나타냈다. [종합 투자점수] [그림 3] 종합 투자점수 AI 인공지능 분석을 통한 엘아이에스의 종목 종합 스코어는 56점을 기록했다. 이는 동일 업종 평균점수인 59점과 시장 평균점수인 59점를 하회하는 수치였다. (위의 AI인공지능 점수는 재무 데이터를 기반으로 전체 상장 종목과 비교/분석하여 도출한 점수로 높은 점수가 반드시 높은 수익률을 보장하지 않습니다. 위의 자료는 당사의 추천 종목이 아니며, 투자 시 참고용으로 제시해드리는 것입니다.) 라이온봇 기자 -한국경제TV※ 본 기사는 한국경제TV와 '거장들의 투자공식이'자체 개발한 '라이온봇 기자'가 실시간으로 작성한 기사입니다. 라이온봇기자 ⓒ 한국경제TV, 무단 전재 및 재배포 금지 한국경제TV 관련뉴스해당 언론사에서 선정하며 언론사 페이지(아웃링크)로 이동해 볼 수 있습니다.한그루 남편, 얼마나 훈남이길래? '쌍둥이 예쁠만 하네'""몸이 허락할 때까지 낳겠다"" 장윤정 둘째 임신정려원 고백, '불같았던' 열애 상대 누구?엄지원 남편, 엄친아에 빌딩 부자…엄지원 부친은 '더 대박'홍수아 올 망사?…'이쯤되면 대륙여신'"
아시아경제,138690,/news/news_read.nhn?article_id=0003949408&office_id=277&mode=search&query=엘아이에스&page=1,2017-03-09 17:38,"임태원 엘아이에스 대표 &ldquo;사드역풍, 레이저 기술력+면세점 구조조정으로 돌파&rdquo;","[아시아경제 권성회 기자] “레이저 사업 부문도 중국 수출량이 많고, 면세점 부문도 중국 관광객 비중이 높습니다. 사드 여파로 인한 걱정이 있지만 회사가 빠르게 안정화되는 만큼 올해 흑자전환에 자신 있습니다.” 임태원 엘아이에스 대표는 9일 오후 서울 여의도에서 기업설명회(IR)를 열고 올해 사업전략에 대한 포부를 밝혔다. 엘아이에스는 지난해 11월 수인코스메틱과 비앤비인베스트먼트의 컨소시엄으로부터 인수됐다. 임 대표는 수인코스메틱의 대표이사를 맡고 있다가 인수와 함께 엘아이에스의 대표이사로 나섰다. 엘아이에스는 레이저사업과 사후면세점 사업을 동시에 진행하고 있다. 레이저의 경우 유기발광다이오드(OLED) 관련 사업에 재빨리 뛰어들었다. 레이저를 이용해 플렉서블 OLED 패널을 휴대전화 규격에 맞게 잘라내는 기술 등을 통해 중국 티앤마(Tianma), BOE 등과 협업하고 있고 국내 LG디스플레이, 삼성플레이 등도 주요 고객사다. 임 대표는 “중국 매출 비중 높은 건 선점효과가 있었기 때문”이라며 “중국 업체들이 디스플레이 사업을 확장하고 있기 때문에 대량 발주가 예상되고 특히 커팅장비 쪽에서 수주를 많이 기대하고 있다”고 설명했다. 고고도미사일방어체계(THAAD ·사드)의 한반도 배치 관련한 중국의 보복조치에 대한 우려도 잠재웠다. 임 대표는 “OLED 기술을 보유한 곳이 한국과 일본 정도”라며 “화장품, 문화콘텐츠 등은 제재가 있겠지만 레이저 부문은 중국으로서도 꼭 필요한 것이기 때문에 사드 영향은 적을 것”이라고 밝혔다. 사후면세점 사업은 과감한 구조조정으로 정상화에 시동을 걸고 있다. 엘아이에스는 이전 경영진이 무리하게 면세점 사업을 확장한 나머지 손실을 많이 입었다. 이에 면세점 매장 수를 기존 8개에서 5개로 줄이는 등 구조조정에 나서고 있다. 임 대표는 “해외 관광객에 대한 국내 여행을 전문으로 하는 화청여행사와 협업을 통해 면세점 사업 이익을 극대화하는 한편, 오는 4월 출시되는 신규화장품을 내세워 고객을 더욱 유치하겠다”고 말했다. 사드 사태 관련 중국인 관광객 감소 우려에 대해선 “연 200억원 이상의 매출을 올리는 용산 진선미 매장은 태국 등 동남아 관광객 비중이 높은데, 이곳을 통해 관광객 감소에도 대처하겠다”고 자신했다. 엘아이에스는 올해 예상 매출액 1933억원, 영업이익 170억원을 제시했다. 지난해 영업손실 129억원을 극복하고 턴어라운드에 진입하겠다는 것이다. 임 대표는 “투자자들의 신뢰 회복이 우선돼야 한다”며 “올해 사업목표를 꼭 이뤄내 이익 성장을 실현하겠다”고 강조했다."
아시아경제,138690,/news/news_read.nhn?article_id=0003577670&office_id=277&mode=search&query=엘아이에스&page=1,2015-09-04 19:00,"엘아이에스, HK이노베이션 80억원 채무보증",[아시아경제 이종길 기자]엘아이에스는 종속회사 HK이노베이션에 80억원 채무보증을 결정했다고 4일 공시했다. 자기자본대비 62.22%로 채권자는 농협은행 제주영업부다.
머니투데이,138690,/news/news_read.nhn?article_id=0003537409&office_id=008&mode=search&query=엘아이에스&page=1,2015-09-04 17:35,"엘아이에스, HK이노베이션 80억원 채무보증 결정",[머니투데이 황보람 기자] 엘아이에스는 종속회사 에이치케이이노베이션에 80억원 규모 채무보증을 결정했다고 4일 공시했다. 이는 자기자본대비 62.22%며 채권자는 농협은행 제주영업부다. textlinktopstart textlinktopend textlinkstart
한국경제,138690,/news/news_read.nhn?article_id=0003663165&office_id=015&mode=search&query=엘아이에스&page=1,2016-10-04 07:39,엘아이에스 &quot;200억 제3자배정 유상증자 취소&quot;,[ 이민하 기자  ] 엘아이에스는 제3자배정 대상자의 유상증자 철회 요청 및 주금 전액 미납으로 따라 아이엠벤쳐스와 옵티머스헬스케어트레이딩(Optimus Health Care Trading Corp)를 대상으로 배정했던 200억원 규모의 유상증자가 취소됐다고 4일 공시했다. 납입일은 지난달 30일이었다. 이민하 한경닷컴 기자
뉴시스,138690,/news/news_read.nhn?article_id=0007824521&office_id=003&mode=search&query=엘아이에스&page=1,2017-03-13 11:29,"엘아이에스, 78.7억 규모 레이저 제조장비 공급계약 체결",【서울=뉴시스】최예린 기자 = 전자응용 공작기계 제조업체 엘아이에스(138690)는 LG디스플레이(138690)와 78억7000만원 규모의 레이저 제조장비 공급계약을 체결했다고 13일 공시했다. 이는 2015년 말 연결재무제표 기준 매출액의 6.46%에 해당하는 규모이며 계약기간은 오는 7월10일까지다.
이데일리,138690,/news/news_read.nhn?article_id=0003653854&office_id=018&mode=search&query=엘아이에스&page=1,2016-10-17 18:28,"엘아이에스, 1일 주주총회 소집공고","[이데일리 송이라 기자] 엘아이에스(138690)는 오는 11월1일 경기 의왕시 경수대로 391번길7 예전교회에서 사내외 이사, 감사 선임 건 등으로 주주총회를 소집하기로 했다고 17일 공시했다."
전자신문,138690,/news/news_read.nhn?article_id=0002616996&office_id=030&mode=search&query=엘아이에스&page=1,2017-06-14 16:05,[ET투자뉴스][엘아이에스 지분 변동] (주)수인코스메틱 외 4명 0.01%p 증...,"엘아이에스(138690)는 14일 최대주주 (주)수인코스메틱을  비롯한 특별관계자의 보유주식이 증가되었다고 발표했다. 이는 직전 보고일보다 20,714주 증가하여 지분율은 17.78%로 상승했다. 이번 보고 사유는 장내매수,주식담보대출연장계약으로  알려졌다.   최대주주와 특수관계자의 지분 변동은 주가에 영향을 주는 요인이다. 특히 보유비율을 지속적으로 늘리거나 줄일 경우, 해당종목 투자시 유의할 필요가 있다.  다음은 엘아이에스의 지분 변동 내역과 보유 내역이다."
한국경제,138690,/news/news_read.nhn?article_id=0003942207&office_id=015&mode=search&query=엘아이에스&page=1,2018-05-18 11:04,"[엘아이에스] 10% 이상 상승, 외국계 증권사 창구의 거래비중 10% 수준","18일 오전 11시 01분 현재 엘아이에스는 전 거래일보다 10.16% 오른 14,100원에 거래되고 있다. 주가의 흐름은 12,850원으로 개장해서 장중 한때 12,800원(0%)까지 살짝 밀렸지만, 다시 큰 폭으로 올라서 현재 14,100원(+10.16%)까지 상승하고 있다. ◆ 거래원 동향 - 외국계 증권사 창구의 거래비중 10% 수준 거래원 동향은 메릴린치, CS증권, 삼성증권 등이 매수 상위 목록에 위치하고 있다. 지금까지 외국계(추정) 증권사 창구를 통한 거래 비중은 10% 수준이다. 그리고 이 시간 메릴린치가 매수창구상위에 올라있는 종목은 이 종목 이외에도 월덱스, 켐트로닉스 등이 있다. [표]엘아이에스 거래원 동향 ◆ 차트 분석 - 주가 20일 이평선 상회, 단기·중기 이평선 역배열 이 시간 차트의 흐름은 중기적으로 역배열을 보이고 있지만 단기적으로 반등흐름이 나오면서 20일선을 넘어서는 모습이다. 최근 이 종목의 차트에서 최근 60일 매물대 돌파, 삼선전환도(양전환), 주가 5MA 상향돌파 등의 특이사항이 발생했다. [표]엘아이에스 차트 분석 한경로보뉴스 이 기사는 한국경제신문과 씽크풀이 공동 개발한 기사 자동생성 알고리즘에 의해 실시간으로 작성된 것입니다.  - 기사관련문의 02-3277-9940 ["
조세일보,138690,/news/news_read.nhn?article_id=0002184540&office_id=123&mode=search&query=엘아이에스&page=1,2018-05-09 20:46,"증선위, 회계위반 엘아이에스에 과징금&middot;과태료 부과","한국비엔씨 등 3개 기업, 회계법인도 징계 금융위원회 증권선물위원회는 회계처리기준을 위반해 재무제표를 작성·공시한 엘아이에스, 한국비엔씨 등 4개사에 대해 과징금 및 과태료 부과, 증권발행제한 및 감사인지정 등의 조치를 내렸다고 9일 밝혔다. 또 회사의 재무제표를 감사하면서 회계감사기준을 위반한 회계법인과 소속 공인회계사에 대해서는 감사업무제한 등의 징계를 내렸다. 엘아이에스는 지난 2012년 말부터 2015년 말 결산에서 내재된 파생상품에 대한 평가없이 복합금융상품의 부채가치를 과소 산정해 신주인수권 대가 등 자기자본을 과대계상한 점이 적발됐다. 증선위는 이 회사에 과징금 2310만원과 과태료 2500만원을 부과하고 감사인지정 1년의 징계를 내렸다. 감사인인 삼경회계법인에게는 손행배상공동기금 추가 적립 20%, 이 회사에 대한 감사업무제한 2년의 제재를 내렸다. 소속 공인회계사 2인에게도 감사업무제한, 직무연수 등의 징계를 내렸다. 한국비엔씨는 지난 2016년 말 결산에 토지분양대금 납입을 위해 은행으로부터 자금 35억원을 차입한 후 담보로 토지분양대금반환금에 근질권(설정한도 45억원)을 설정했음에도 담보제공 사실을 재무제표 주석에 기재하지 않은 사실이 적발됐다. 증선위는 이 회사에 과징금 680만원을 부과하고 감사인지정 1년의 징계를 내렸다. 감사인인 회계법인 바른에게는 손해배상공동기금 30% 적립, 이 회사에 대한 감사업무제한 2년의 제재를 가했다. 소속 공인회계사 2인에게는 감사업무제한, 직무연수 등의 징계를 내렸다. 증선위는 특수관계자에 대한 매출채권을 재무제표 주석에 기재하지 않은 엘브스오토모티브에 증권발행제한 2월, 감사인지정 1년의 징계를 내렸다. 비상장사인 이 회사를 감사하면서 회계감사기준을 위반한 회계법인 및 소속 공인회계사에 대해서는 한국공인회계사회에서 감사업무제한 등의 조치를 기의결했다. 증선위는 이밖에 장기매출채권 등 대손충당금을 과소 계상한 보국전기공업에게도 증권발행제한 2월, 감사인 지정 1년의 제재를 가했다."
서울경제,138690,/news/news_read.nhn?article_id=0003300427&office_id=011&mode=search&query=엘아이에스&page=1,2018-05-18 10:34,"&lt;코&gt;엘아이에스, 전일 대비 7.03% 상승.. 일일회전율은 0.69% 기록","[서울경제] 엘아이에스(138690) 는 18일 오전 10시 33분 현재 7.03% 오른 13,700원에 거래되고 있으며, 26(매도):74(매수)의 매수우위를 기록하고 있다. 거래대금은 13억4,286만, 거래량은 10만56주로 거래량회전율은 0.69%로 나타났다. 지난 1개월간 엘아이에스는 상승 10회, 하락 17회를 기록했고, 주가수익률은 4.18% 표준편차는 2.06%를 기록했다. 이 기간 ' 반도체업 ' 업종 평균 주가수익률은 4.91%로 나타났으며, 변동성은 1.35%를 기록했다. 이 시각 현재 ' 반도체업 '은 1.03% 상승 중이며, 53(매도):47(매수)의 매도우위를 기록하고 있다."
아시아경제,138690,/news/news_read.nhn?article_id=0003949897&office_id=277&mode=search&query=엘아이에스&page=1,2017-03-10 11:18,"임태원 엘아이에스 대표 &quot;레이저사업, 사드보복 뚫는다&quot;","중국시장 공략 자신감화장품사업으로 쌓은 노하우 적극 활용 [아시아경제 권성회 기자] ""저는 사실 레이저에 대해 잘 모릅니다. 하지만 화장품 사업을 하면서 오랜 기간 동안 중국 기업들을 상대해왔고, 이를 통해 그들의 신뢰를 얻는 방법을 많이 배웠습니다."" 임태원 엘아이에스 대표는 9일 오후 서울 여의도에서 개최한 기업설명회(IR)에서 이같이 말하며 새로운 사업전선에 뛰어드는 포부를 밝혔다. 임 대표는 화장품 유통 전문업체 수인코스메틱 대표를 맡고 있다. 그런 그가 화장품과 전혀 관련 없는 레이저사업을 기반으로 하는 엘아이에스의 대표직을 직접 맡은 것은 그간 중국 사업에 대한 노하우를 활용할 수 있다는 자신감에서다. 임 대표는 ""어제도 중국 출장을 다녀왔다""며 ""레이저사업에 대한 업무도 진행했고, 화장품사업에 대한 업무도 따로 보고왔다""고 말했다. 자칭 '중국통'인 만큼 중국과의 거래가 많은 엘아이에스를 더욱 성장시킬 수 있다는 자신감을 내비쳤다. 지난해 11월 수인코스메틱은 비앤비인베스트먼트와 컨소시엄으로 엘아이에스의 경영권을 인수했다. 그가 엘아이에스 인수에 나서게 된 것은 회사의 성장 가능성을 봤기 때문이다. 임 대표는 ""성장성이 있는 회사라고 생각해서 인수 이전부터 투자를 해왔다""며 ""수인코스메틱 시절 사후면세점에 화장품 납품 경험이 있어 이익을 더 낼 수 있다는 자신감이 있었고, 중국시장 성공 경험을 바탕으로 레이저사업 제조와 영업도 성공 가능성이 있다고 판단했다""고 소개했다. 그는 사장에 취임하면서 회사가 정상화되기까지 머리카락을 자르지 않겠다고 선언했다. 그는 이 약속을 지키기 위해 경영정상화에 매진했고, 석 달이 흐른 지난달에야 머리를 단정히 할 수 있었다. 임 대표는 ""지난 3개월간 사후면세점사업 부문에 대한 구조조정을 과감히 진행하는 등 경영정상화에 온 힘을 쏟은 것 같다""며 ""앞으로는 본격적인 회사 성장에 전력을 기울일 때""라고 말했다. 엘아이에스는 레이저사업 부문과 사후면세점사업 부문을 동시에 보유하고 있다. 레이저를 이용해 플렉서블 유기발광다이오드(OLED) 패널을 휴대전화 규격에 맞게 잘라내는 기술 등을 앞세워 중국 티앤마(Tianma), BOE 등과 협업하고 있다. 사후면세점 사업은 임 대표 취임 이후 면세점 매장 수를 기존 8개에서 5개로 줄이는 등의 구조조정을 실시했다. 해외 관광객에 대한 국내 여행을 전문으로 하는 화청여행사와 협업을 시작했고, 오는 4월 출시되는 신규화장품을 내세워 고객을 더욱 유치할 계획이다. 임 대표는 두 사업부문 모두 중국과 밀접한 구조로 인해 최근 적잖은 우려의 소리를 많이 들었다고 했다. 고고도미사일방어체계(THAADㆍ사드)의 한반도 배치에 따른 중국의 보복 조치가 진행되고 있기 때문이다. 그러나 임 대표는 ""레이저사업 부문의 경우 OLED 기술을 보유한 곳이 한국과 일본 정도여서 화장품, 문화콘텐츠 등과 달리, 중국으로서도 꼭 필요한 것이기 때문에 사드 영향은 적을 것""이라고 설명했다. 사후면세점사업 부문 역시 ""연 200억원 이상의 매출을 올리는 용산 진선미 매장은 태국 등 동남아 관광객 비중이 높은데, 이곳을 통해 동남아 관광객을 더욱 유치하는 등의 대응 방안을 내세우겠다""고 자신했다. 엘아이에스는 올해 예상 매출액 1933억원, 영업이익 170억원을 제시했다. 지난해 영업손실 129억원을 극복하고 턴어라운드에 진입하겠다는 것이다. 임 대표는 ""투자자들의 신뢰 회복이 우선돼야 한다""며 ""올해 사업목표를 꼭 이뤄내 이익 성장을 실현하겠다""고 강조했다."
뉴시스,138690,/news/news_read.nhn?article_id=0008588093&office_id=003&mode=search&query=엘아이에스&page=1,2018-05-10 09:35,"증선위, 회계처리 위반 엘아이에스 등 4개사 과징금","【서울=뉴시스】이현주 기자 = 금융위원회 증권선물위원회는 회계처리 기준을 위반한 엘아이에스 등 4개사에 과징금 부과 등 제재 조치를 취했다고 10일 밝혔다. 증선위는 전날 제9차 회의를 열고 회계처리 기준을 위반해 재무제표를 작성·공시한 ㈜한국비엔씨, ㈜엘아이에스, 엘브스오토모티브㈜, 보국전기공업㈜ 등 4개사에 과징금 및 과태료 부과, 증권발행제한 및 감사인지정 등의 조치를 내렸다. 코스닥 상장법인 엘아이에스는 2012년부터 2015년말까지 신주인수권대가 등을 과대계상해 자기자본을 부풀린 혐의로 과징금 2310만원과 과태료 2500만원, 감사인지정 1년 조치를 받았다. 해당 회사를 부실감사한 삼경회계법인은 손해배상공동기금 20%를 추가 적립하고, 엘아이에스 감사를 2년간 제한키로 했다. 코넥스 상장법인 한국비엔씨는 차입금에 대한 담보제공 주석을 기재하지 않았다. 토지분양대금 납입을 위해 은행으로부터 자금(35억원)을 차입한 후 이에 대한 담보로 토지분양대금반환금에 근질권(설정한도 42억원)을 설정했지만 해당 담보제공 사실을 재무제표 주석에 기재하지 않았다. 증선위는 한국비엔씨에 과징금 680만원을 부과하고 감사인지정 1년 처분을 내렸다. 한국비엔씨를 부실 감사한 회계법인 바른은 손해배상공동기금 30%를 추가 적립하고, 한국비엔씨 감사업무 2년간 제한 조치를 받았다. 비상장법인 엘브스오토모티브와 보국전기공업은 각각 증권발행제한 2개월과 감사인지정 1년을 처분받았다. 엘브스오토모티브는 특수관계자와의 매출채권 거래를 주석에 기재하지 않았으며, 보국전기공업은 장기매출채권 등 대손충당금을 과소계상한 것으로 나타났다."
