source,symbol,link,date,title,content
아시아경제,138690,/news/news_read.nhn?article_id=0003619624&office_id=277&mode=search&query=엘아이에스&page=1,2015-11-06 08:10,"엘아이에스, 사후면세점 사업 탄력&hellip;실적 기대감 고조","[아시아경제 팍스넷 배요한 기자] 엘아이에스가 레이저 사업의 실적 회복과 사후면세점 등 신사업이 속도를 내면서 본격적인 성장 기대감이 커지고 있다. 엘아이에스는 연결기준 올해 3분기 영업이익은 240억9700만원으로 지난해 동기대비 흑자전환했다. 매출액은 419.3% 늘어난 704억4100만원, 당기순이익은 244억5900만원으로 역시 흑자전환했다. 회사측은 큰 폭의 실적 개선에 대해 “적극적인 구조조정과 레이저 사업에서의 거래처 확장이 주요인”이라며 “국내 대기업은 물론 애플과도 추가 수주 협의가 진행 중”이라고 밝혔다. 엘아이에스는 지난 2012년 삼성과 LG 등의 요청으로 OLED TV 분야에 설비 투자를 진행했지만 거래처의 투자가 지연되면서 휘청이기 시작했다. 지난 2011년 66억원의 영업이익을 올렸지만 이후 3년간 수백억의 적자를 내면서 결국 관리종목으로 지정됐다. 하지만 적극적인 구조조정을 통한 체질 개선과 신규 거래처인 애플 효과로 올해 본격적인 실적 턴어라운드가 확실시 되고 있다. 또 미래성장 동력으로 사후면세점 사업에 뛰어들면서 향후 실적에 대한 기대감을 더욱 높여주고 있다. 사후면세점 사업에서는 여행과 관광 플랫폼 비지니스를 통해 수익성 극대화를 꾀한다는 전략이다. 이를 위해 호텔, 음식점, 관광문화체험, 사후면세점 등을 하나로 연계해 한국 방문객을 위한 숙박 및 쇼핑을 위한 모든 서비스 시스템을 통합운영 할 계획이다. 특히 기존 서울과 제주에 있는 6곳의 매장을 내년 3월 이전까지 서울과 제주, 부산으로 지역을 확대시키고 추가적으로 6곳을 열어 매장을 총 12곳으로 늘릴 예정이다. 매장 방식도 체험형과 복합 매장으로 업그레이드해 다양하게 확대한다. 또 자회사 88호텔을 통해 호텔 마스터리스 사업에 진출하며 객실 사업에도 진입한다. 호텔 마스터리스사업은 관광객이 주로 찾는 지역에 있는 호텔을 장기 리스해 여행사들에게 판매하는 사업이다. 회사 관계자는 6일 “서울과 제주도에 있는 3000개의 객실 운영권을 구매할 계획”이라면서 “대규모 그룹 투어를 통한 안정적인 객실 가동율을 유지할 것”이라고 전했다."
머니투데이,138690,/news/news_read.nhn?article_id=0004050233&office_id=008&mode=search&query=엘아이에스&page=1,2018-05-11 14:50,"엘아이에스, 1Q 영업익 58억원 &quot;올해 사상 최대 실적 기대&quot;","[머니투데이 김건우 기자] [1분기 영업익 전년比 561.4% 올라, 중국 영업 효과 ] 레이저 응용장비 제조업체 엘아이에스는 1분기 별도기준 영업이익이 58억100만원으로 전년대비 561.4% 증가했다고 11일 밝혔다. 매출액은 590억2100만원, 당기순이익은 50억1700만원으로 각각 86%, 423% 늘었다. 1분기 실적은 중국을 중심으로 한 레이저 장비 매출의 성장이 이끌었다. ""수익성이 악화된 사후 면세 사업의 정리를 완료하고 레이저 사업에 집중한 결과""라며 ""올해 사상 최대 실적을 기대하고 있다""고 회사 관계자는 강조했다. 이번 실적은 IFRS 회계 기준의 변경에 따라 선적기준 적용하던 회계처리를 인도기준으로 변경하였으며 회계기준 변경효과를 감안하면 향후 분기별 실적은 더욱 기대되는 상황이다. 이  관계자는 ""변경된 회계 기준에 따라 1분기에는 매출인식이 2개월만 반영이 됐고, 직원들 특별 보너스와 상여를 지급함에도 준수한 실적을 올렸다""며 ""구매 전문화로 원가 절감과 물류의 시스템화를 위한 다각적인 노력을 기울이고 있다""고 설명했다. 엘아이에스는 2016년 중국 시장에 본격적으로 진출한 이후 OLED(유기발광다이오드) 후공정 커팅 장비 부문에서 사실상 독점에 가깝게 수주하고 있다. 시장조사업체 DSCC에 따르면 올해 중국 기업의 총 장비 지출액은 198억달러(약 20조1700억원)로 연간 장비 투자액의 88%에 이른다. 투자 상위 기업은 BOE, LG디스플레이, 차이나스타, Tianma, GVO 등 엘아이에스의 주요 고객사다. 이 관계자는 ""중국 패널 업체와의 영업에 오랜 기간 집중하며 기술력을 인정받은 부분이 지속적인 수주로 이어지고 있다""며 ""공정 연계의 특성상 장비를 다른 장비로 바꾸는데 드는 전환비용이 크기 때문에, 선점 효과가 중요하고 현재 수주한 장비들에 중요한 의미가 있다""고 말했다. 이어 ""4월 안양 신공장의 가동으로 레이저 사업의 경쟁력을 강화하고 생산량이 2배로 늘어난 만큼 늘어나는 수주에도 충분히 대응이 가능하며, 향후 다양한 R&D(연구개발)를 통해 신규 프로젝트의 가능성을 높이고 있다""고 덧붙였다. 한편 엘아이에스는 오는 15일 오후 4시 서울 여의도 한국거래소 별관 1층 국제회의장에서 1분기 경영실적에 대한 기업설명회를 갖는다."
매일경제,138690,/news/news_read.nhn?article_id=0004196912&office_id=009&mode=search&query=엘아이에스&page=1,2018-08-06 17:34,[코스닥 공시] 비츠로셀 / AP위성 / 엘아이에스 등,◇비츠로셀=이탈리아 업체와 326억원 리튬전지 판매계약. ◇AP위성=38억원 규모 장비개발·공급계약. ◇엘아이에스=80억원 규모 레이저 제조장비 공급계약. ◇엘앤케이바이오=인공관절 FDA 수입품목 허가. r_start // r_end //
뉴시스,138690,/news/news_read.nhn?article_id=0007442397&office_id=003&mode=search&query=엘아이에스&page=1,2016-08-31 18:56,"엘아이에스, 455억 규모 여성 위생용품 공급계약 체결",【서울=뉴시스】최예린 기자 = 전자응용 공작기계 제조업체 엘아이에스(138690)는 옵티머스 헬스케어 트레이딩(Optimus Health Care Trading Corp)과 455억1565만원 규모의 여성 위생용품 공급 계약을 체결했다고 31일 공시했다. 이는 지난해 말 연결 기준 매출액의 37.34%에 해당하는 규모다.
머니투데이,138690,/news/news_read.nhn?article_id=0003629855&office_id=008&mode=search&query=엘아이에스&page=1,2016-02-15 10:45,"엘아이에스, 이대 앞에 서울 최대 규모 종합 화장품 면세점 연다","[머니투데이 김건우 기자] 사후면세 전문기업 엘아이에스는 오는 3월 서울 이화여대 앞에 서울 최대규모의 종합 화장품 사후면세점을 연다고 15일 밝혔다. 엘아이에스는 서울 지하철 2호선 이대역에서 이화여자대학교 정문으로 이르는 길에 위치한 예스 에이피엠(YES apm) 건물을 리모델링해 사후면세점으로 개장할 계획이다. 지하 1층과 지상 1층 총 2개층 연면적 1500평 규모다. 이번 매장에는 국내 유명 브랜드 제품과 메디컬 기능성 화장품 등 다양한 브랜드가 입점할 예정이다. 또 한류 스타 관련 화장품의 전시공간, 체험 공간 및 각종 문화 공연 시설도 함께 준비될 예정이다. 엘아이에스는 화장품 전문 매장의 개장을 시작으로 상반기 중에 지하 1층에서 지상 8층까지 총 9개층 전층을 새롭게 꾸며 국내 최대 규모의 사후면세점으로 선보일 계획이다. 이대 앞은 유커(중국인 관광객)를 중심으로 새로운 관광명소로 떠오른 지역이다. 이밖에 엘아이에스는 3월에는 제주에 건강기능식품 전문매장인 ‘진간보’ 매장과 서울 ‘인삼예찬’ 매장 등을 추가로 오픈할 예정이다. 나일석 엘아이에스 회장은 ""이번 국내 최대 규모의 사후면세 전문 매장의 개장을 기점으로 엘아이에스의 사후면세사업이 더욱 탄력을 받을 전망”이라며 ""사후면세 즉시환급제가 시행되는 올해는 본격적인 사후면세 업계 도약의 해가 될 것”이라고 말했다. textlinktopstart textlinktopend textlinkstart"
연합뉴스,138690,/news/news_read.nhn?article_id=0008549800&office_id=001&mode=search&query=엘아이에스&page=1,2016-07-18 18:54,"거래소, 엘아이에스 불성실공시법인 지정","(서울=연합뉴스) 고상민 기자 = 한국거래소 코스닥시장본부는 18일 실적예측공시에 대한 면책조항 위반을 이유로 엘아이에스를 불성실공시법인으로 지정한다고 공시했다. 지정일은 19일이고, 위반 제재금은 1천200만원이다."
서울경제,138690,/news/news_read.nhn?article_id=0002837880&office_id=011&mode=search&query=엘아이에스&page=1,2016-06-03 09:24,"엘아이에스, 대규모 유상증자 결정 소식에 약세","엘아이에스(138690)가 대규모 유상증자 결정 소식에 약세다. 엘아이에스는 3일 오전 9시 20분 현재 코스닥시장에서 전날 보다 800원(3.69%) 내린 2만850원에 거래되고 있다. 엘아이에스는 전날 장 마감 직전 210억원 규모의 운영자금 조달을 위해 제3자 배정 방식 유상증자를 결정했다고 공시했다. 발행되는 신주는 116만6,666주이며 발행가액은 1만8,000원이다."
한국경제,138690,/news/news_read.nhn?article_id=0003544910&office_id=015&mode=search&query=엘아이에스&page=1,2016-02-15 10:41,"엘아이에스, 다음 달 이대 앞에 종합 화장품 사후 면세점 개장","[ 김근희 기자  ] 기업형 사후면세사업 전문회사 엘아이에스는 다음 달 서울 이화여자대학교 앞에 종합 화장품 사후면세점을 열 계획이라고 15일 밝혔다. 엘아이에스는 서울 지하철 2호선 이대역에서 이화여대 정문으로 이르는 길에 있는 '예스 에이피엠(YES apm)' 건물을 리모델링해 사후면세점으로 개장할 예정이다. 다음 달 말 문을 여는 종합 화장품 사후면세점의 규모는 지하 1층과 지상 1층 총 2개층으로, 연면적 1500평에 이른다. 서울에 있는 종합 화장품 사후면세점 중 최대 규모다. 화장품 사후 면세점에는 국내 유명 브랜드 제품과 기능성 화장품 등 다양한 브랜드가 입점할 예정이다. 또 한류 스타 관련 화장품 전시공간, 체험 공간 및 각종 문화 공연 시설도 함께 들어선다. 이후 상반기 중에는 YES apm 건물 지하 1층에서 지상 8층까지 총 9개층 전층을 리모델링할 계획이다. 이를 통해 국내 최대 규모의 사후 면세점을 만들겠다는 방침이다. 엘아이에스 관계자는 ""이화여대 앞은 요우커(중국인 관광객) 관광명소로 떠오른 지역""이라며 지역 선정 이유를 설명했다. 이어 ""이번 복합 쇼핑몰형 사후면세점 개장을 계기로 사후면세사업 본격화에 더욱 박차를 가할 계획""이라며 ""다음 달에는 제주에 건강기능식품 전문매장인 '진간보' 매장과 서울 '인삼예찬' 매장 등을 추가로 개장할 예정""이라고 했다. 나일석 엘아이에스 회장은 ""이번 국내 최대 규모의 사후면세 전문 매장의 개장을 기점으로 엘아이에스의 사후면세사업이 더욱 탄력을 받을 것""이라며, ""올해 사후면세 즉시환급제가 시행되면서 사후면세 업계가 도약할 것""이라고 내다봤다. 김근희 한경닷컴 기자"
이데일리,138690,/news/news_read.nhn?article_id=0003589897&office_id=018&mode=search&query=엘아이에스&page=1,2016-07-18 18:33,"엘아이에스, 불성실 공시법인 지정",[이데일리 박형수 기자] 한국거래소 코스닥시장본부는 18일 엘아이에스(138690)에 대해 실적예측공시에 대한 면책조항을 위반했다며 불성실 공시법인으로 지정했다.
연합뉴스,138690,/news/news_read.nhn?article_id=0008448571&office_id=001&mode=search&query=엘아이에스&page=1,2016-06-03 09:09,"&lt;특징주&gt; 엘아이에스, 대규모 증자 소식에 약세","(서울=연합뉴스) 유현민 기자 = 전자응용 공작기계 제조업체인 엘아이에스가 대규모 유상증자 결정 소식에 3일 장 초반 약세를 보이고 있다. 이날 오전 9시 3분 현재 코스닥시장에서 엘아이에스는 전날보다 4.61% 내린 2만700원에 거래됐다. 엘아이에스는 210억원의 운영자금을 조달하기 위해 제3자 배정 방식의 유상증자를 한다고 전날 장 마감 직전 공시했다. 발행되는 신주는 116만6천666주이며, 신주 발행가액은 1만8천원이다. 신주 상장 예정일은 9월 21일이다."
이데일리,138690,/news/news_read.nhn?article_id=0003410037&office_id=018&mode=search&query=엘아이에스&page=1,2015-11-30 10:27,"나일석 회장, 엘아이에스 지분 0.08% 보유중",[이데일리 경계영 기자] 엘아이에스(138690)는 나일석 회장이 주식 1만주(지분 0.08%)를 장내에서 신규 매수했다고 30일 공시했다.
파이낸셜뉴스,138690,/news/news_read.nhn?article_id=0003658181&office_id=014&mode=search&query=엘아이에스&page=1,2016-06-03 09:54,"엘아이에스, 210억원 규모 투자 유치 성공","국내 유일의 기업형 사후면세 전문회사 ㈜엘아이에스가 대규모 중국자본을 유치했다. 또한 중국의 주요 아웃바운드 여행사들과 중국 관광객을 보내주는 송객계약을 체결했다고 3일 밝혔다 투자유치는 100% 중국자본으로 이뤄진 (주)태화건설에 추가적인 중국자본을 투입해 신주를 인수하는 방식으로 엘아이에스 유상증자에 참여하고, 관광객 송객계약을 맺은 중국의 주요 아웃바운드 여행사 대표들도 유상증자에 직접 참여하는 방식이다. 금액은 210억원에 이른다. 태화건설은 중국의 자본이 투자된 외국인투자기업으로서, 제주 삼매봉 유원지 인근에 토지 3만여평을 매입하며 호화 크루즈사업, 최고급 호텔 및 스파 신축사업, 고급빌라분양사업 등에 이미 1억 달러 이상을 투자했다. 송객업무협약을 맺은 5개 여행사들은 중국 내에서 단체관광객을 모아서 해외로 보내는 아웃바운드 분야에서 강자로 인정받고 있는 여행사들이다. 랴오닝성 강휘국제여행사는 중국 10대 여행사에 속하는 강휘그룹계열 여행사다. 강휘국제여행사는 중국 장애인협회 총재였던 등소평의 아들 등박방이 세운 여행사로 유명하다. 또한 심양 대운통국제여행사는 랴오닝성 문화사범창구 지정을 받은 여행사이며, 복주 강태여행사는 복건성 10강 여행사로 선정됐고, 산서의 보화여행사도 산서성 10강 여행사이며, 만연 여행사는 중국내 B2B 분야의 여행사 5위권으로 평가 받는 여행사다. 5개 여행사가 연간 송객해 올 것으로 예상되는 인원만 80만명에 이르는 가운데, 엘아이에스는 이번 투자 및 업무협약을 바탕으로 면세사업과 더불어 중국여행사를 통한 고객 연계성을 확보해 국내 대표 사후면세 전문 기업의 위치를 더욱 공고히 하게 될 것으로 기대된다. 앞으로 엘아이에스는 이러한 협력 관계를 바탕으로 중국 관광객 유치에 박차를 가하고, 유상증자를 통해 조달된 자금을 활용하여 사후면세 매장을 확대할 예정이다. 또한 제주도와 서울의 호텔 마스터리스 사업 등을 본격화하여 중국인 관광객을 수용 할 수 있는 관광 인프라를 확장할 계획이다. 나일석 엘아이에스 회장은 ""이번 업무협약과 유상증자를 통해 사후면세매장 확장 이외에 요우커를 유치하는데 필요한 객실확보 등 밸류체인을 확보하는데 들어가는 비용을 확보했다""면서 ""또한 중국관광객을 상대로 ‘한류 제품’을 판매하는 엘아이에스가 중국자본을 직접 유치한 것은 중국 또한 엘아이에스의 ‘요우커를 통한 관광’사업 능력과 성장성을 동시에 인정한 사례""라고 말했다. 이어 ""장차 중국기업과 더욱 적극적인 사업확장에 필요한 추가 투자유치를 이끌어 낼 수 있도록 해서 다른 기업들의 귀감이 될 수 있도록 하겠다""고 밝혔다."
뉴시스,138690,/news/news_read.nhn?article_id=0007442390&office_id=003&mode=search&query=엘아이에스&page=1,2016-08-31 18:55,"엘아이에스, 200억 규모 제3자배정 유상증자 결정","【서울=뉴시스】최예린 기자 = 전자응용 공작기계 제조업체 엘아이에스(138690)는 200억원 규모의 운영자금을 조달하기 위해 제3자배정 유상증자를 결정했다고 31일 공시했다. 발행되는 신주는 138만8888주이며, 신주의 발행가액은 1만4400원이다. 신주의 상장 예정일은 오는 10월21일이다."
머니투데이,138690,/news/news_read.nhn?article_id=0003587915&office_id=008&mode=search&query=엘아이에스&page=1,2015-11-30 10:32,"나일석 회장, 엘아이에스 지분 0.08% 보유 중",[머니투데이 김승미 기자] 엘아이에스는 나일석 회장이 주식 1만주(0.08%)를 장내에서 신규 매수했다고 30일 공시했다. textlinktopstart textlinktopend textlinkstart
서울경제,138690,/news/news_read.nhn?article_id=0002799975&office_id=011&mode=search&query=엘아이에스&page=1,2016-02-16 13:27,"엘아이에스, 2016년 매출액 3,112억원(+155.3% YoY) 예상","BNK투자증권 이승은 연구원은 16일 엘아이에스(138690)에 대해 ""관리종목 탈출한다""라며 투자의견을 '매수(유지)'로 제시하였다. 아울러 6개월 목표주가를 42,000원으로 내놓았다. 이 연구원은 엘아이에스(138690)에 대해 ""동사의 2015년 매출액은 1,219억원(+230.1% YoY), 영업이익은 211억원(흑자전환 YoY)을 기록했다. 흑자전환을 기록함에 따라 동사는 2015년 관리종목 지정이후 빠르면 올 3월 첫째주에 감사보고서 제출과 함께 관리종목 해제가 예상된다""라고 분석했다. 또한 BNK투자증권은 ""동사는 3월에 제주도 건강기능식품 전문매장인 진간보 매장과 서울 인삼예찬매장 추가 개점에 이어 신촌 이화여대 부근 예스 에이피엠(Yes APM) 건물을 리모델링해 사후면세점으로 개장할 예정. 2016년 사후면세점 부문 매출액은 2,459억원 영업이익은 406억원을 기록할 것으로 기대되며, 동사 사후 면세점 매출액 성장폭은 더 커질 것""이라고 밝혔다. 한편 ""2016년 중국인 패키지 관광객의 증가로 동사의 사후면세점 고객이 매월 증가하고 있고, 레이저 장비 사업 역시 순조로운 매출 성장이 기대된다. 2016년 매출액은 3,112억원(+155.3% YoY), 영업이익은 472억원(+124.8 YoY)으로 예상한다""라고 전망했다. BNK투자증권이 동종목에 대하여 이번에 제시한 '매수(유지)'의견은 직전 매매의견과 동일한 것이고 전년도말의 매매의견을 기준으로 볼때도 역시 '매수'의견이 계속 유지되고 있는 상태이다. ▷ LED장비 섹터"
아시아경제,138690,/news/news_read.nhn?article_id=0003790001&office_id=277&mode=search&query=엘아이에스&page=1,2016-07-18 18:11,"엘아이에스, 불성실공시법인 지정",[아시아경제 송화정 기자]엘아이에스는 18일 한국거래소 코스닥시장본부로부터 실적 예측공시에 대한 면책조항 위반 등 공시불이행으로 불성실공시법인에 지정됐다.
파이낸셜뉴스,138690,/news/news_read.nhn?article_id=0003589428&office_id=014&mode=search&query=엘아이에스&page=1,2016-01-27 11:29,"사후면세점 엘아이에스-코리아나화장품, 화장품 공동개발 및 판매 업무협약","사후면세사업 전문회사 엘아이에스는 코리아나화장품과 화장품 브랜드를 공동 개발, 외국인 관광객을 대상으로 판매에 나서는 것을 골자로 하는 포괄적 협력을 위한 업무 협약(MOU) 및 제조자개발생산(ODM) 계약을 체결했다고 27일 밝혔다. 이번 업무협약 및 계약를 통해 엘아이에스는 자회사인 진선미 코스메틱과 코리아나화장품이 함께 개발한 주름·미백 관리용 기능성 화장품 브랜드 ‘루바체’, 프리미엄 한방 화장품 브랜드 ‘수진비’ 제품 등을 서울, 제주, 인천 등 엘아이에스 사후면세점 매장에서 판매할 예정이다. 이 브랜드들는 양사가 시장 조사부터 제품 개발까지 적극 협력해 요우커(중국인 관광객)들의 취향을 반영한 고품질 제품들로 구성됐다. ‘비책’ 화장품 시리즈를 개발했던 진선미코스메틱의 기술력과 코리아나화장품의 371개(해외 51개 포함) 특허 기술이 반영됐다. 엘아이에스는 국내 사후면세점 매장을 시작으로 향후 개설될 온라인 쇼핑몰에서도 루바체와 수진비 제품을 판매할 계획이다."
머니투데이,138690,/news/news_read.nhn?article_id=0003593652&office_id=008&mode=search&query=엘아이에스&page=1,2015-12-09 10:41,"엘아이에스, 30.8억 규모 레이저 제조장비 공급계약 체",[머니투데이 박소연 기자] 엘아이에스는 대만 AU 옵트로닉스(AU OPTRONICS CORP) 업체와 30억8374만원 규모의 레이저 제조장비 공급계약을 맺었다고 9일 공시했다. 이는 지난해 매출액 대비 8.4%에 해당하며 계약기간은 내년 1월10일까지다. textlinktopstart textlinktopend textlinkstart
아시아경제,138690,/news/news_read.nhn?article_id=0003805390&office_id=277&mode=search&query=엘아이에스&page=1,2016-08-10 14:17,"엘아이에스, 에이치씨&rarr;아이엠벤쳐스 200만주 양도",[아시아경제 박선미 기자]엘아이에스는 에이치씨 자산관리가 아이엠벤쳐스에 200만주(약 300억원 규모) 엘아이에스 주식을 양도하는 계약을 체결하기로 했다고 10일 공시했다.
머니투데이,138690,/news/news_read.nhn?article_id=0003690190&office_id=008&mode=search&query=엘아이에스&page=1,2016-06-03 08:55,"엘아이에스, 中 210억원 투자 유치..80만 관광객 '확보'","[머니투데이 김건우 기자] [덩샤오핑 아들 덩푸팡이 세운 여행사 계열사도 투자 ] 사후면세 전문기업 엘아이에스가 제주도에 대규모 투자 중인 중국 베이징의 투자회사, 중국 주요 아웃바운드 여행사들로부터 210억원의 투자유치에 성공했다. 향후 연간 80만명의 중국인을 데려오는 안정적인 실적 성장의 기반을 마련한 것으로 평가된다. 3일 엘아이에스는 운영자금 조달을 위해 210억원 규모의 제3자 배정 유상증자를 결정했다고 밝혔다. 대상자는 태화건설, 정학동, 이효춘, 황자파, 노언, 이화경 씨 등이다. 태화건설은 제주도에서 대규모 투자를 집행하고 있는 투자회사다. 또 정학동 씨 외 4인은 중국의 주요 아웃바운드 여행사들의 대표다. 엘아이에스는 태화건설과 호텔, 전시장 등 관광 인프라 구축을 위한 업무협약(MOU)을 체결했고, 여행사들과는 중국인 관광객을 엘아이에스로 보내는 송객 계약을 체결했다. 태화건설은 베이징의 전문투자회사에서 투자하여 설립한 제주도 소재 기업이다. 제주 삼매봉 유원지 인근에 토지 3만평을 매입해 크루즈사업, 최고급 호텔 및 스파 신축사업, 고급빌라분양사업 등에 1억 달러 이상을 투자했다. 유상증자에 참여한 여행사들은 중국 현지에서 영향력이 높은 곳들이다.  랴오닝성 강휘국제여행사는 중국 10대 여행사에 속하는 강휘그룹계열 여행사로, 덩샤오핑의 아들 덩푸팡이 세운 여행사로 유명하다. 선양 대운통국제여행사는 랴오닝성 문화사범창구 지정을 받은 여행사이며, 복주 강태여행사는 푸젠성 10강 여행사로 선정되었고, 보화여행사도 산시성 10강 여행사이며, 만연 여행사는 중국내  B2B(기업간거래) 분야의 여행사 5위권으로 평가 받는 여행사이다. 나일석 엘아이에스 회장은 ""이번 투자 유를 통해 사후면세매장 확장 이외에 요우커를 유치하는데 필요한 객실 등 밸류체인들을 확보하는데 들어가는 비용을 확보했다""고 말했다. 나 회장은 ""중국 자본들의 러브콜이 많았으나 최근 중국 기업 대상 유상증자의 실폐 사례가 있는 점을 고려해 한국 투자 이력과 기반이 있는 기업, 시너지 효과가 크게 낼 수 있는 중국 우량 기업을 전략적인 파트너로 선정했다""고 덧붙였다. textlinktopstart textlinktopend textlinkstart"
