source,symbol,link,date,title,content
머니투데이,150900,/news/news_read.nhn?article_id=0004009148&office_id=008&mode=search&query=파수닷컴&page=1,2018-02-13 16:19,"파수닷컴, 소프트웨어 보안사업 물적분할 결정","[머니투데이 김소연 기자] 파수닷컴은 소프트웨어 보안사업을 따로 떼 이를 영위할 주식회사 스패로우를 분할신설한다고 13일 공시했다. 분할존속회사인 파수닷컴이 분할신설회사인 스패로우 주식 100%를 배정받는 단순·물적분할 방식이다. 이번 분할로 회사의 최대주주 소유주식 및 지분율 변동은 없다. 파수닷컴은 데이터보안 사업을 영위하게 된다. 분할회사가 분할신설회사 주식의 100%를 배정받는 방식이기 때문에 분할비율도 산정하지 않았다. 분할기일은 오는 5월4일이다. 회사 측은 ""업종전문화를 통해 각 사업부문의 성장잠재력을 배가하고 각 사업부문에서 창출되는 수익을 해당사업에 재투자해 사업영역 확장 및 해외시장 개척 등 성장잠재력을 확보하겠다""고 밝혔다."
아시아경제,150900,/news/news_read.nhn?article_id=0003659910&office_id=277&mode=search&query=파수닷컴&page=1,2016-01-05 13:15,조규곤 파수닷컴 대표 &ldquo;핵심 4종으로 디지털 세상 리드&rdquo;,"조규곤 파수닷컴 대표가 지난 4일 파수닷컴 본사에서 시무식을 갖고 올해 계획을 발표하고 있다.&lt;사진제공=파수닷컴&gt; [아시아경제 팍스넷 공도윤 기자] 조규곤 파수닷컴 대표가 2016년 신년사를 통해 핵심키워드를 ‘리딩 디지털(Lead Digital)’로 꼽고 디지털 시대를 리드하는 기업으로의 성장을 다짐했다. 조규곤 대표는 “디지털 비즈니스 시대 진입으로 변화와 혼돈의 시기를 겪고 있는 만큼, 이제 디지털 비즈니스의 핵심은 자산이 아닌 지능화된 소프트웨어에 있다는 사실을 모두가 공감하는 분위기”라며 “시대의 변화를 쫓아 다양한 혁신을 4가지 핵심 사업 분야에 이미 적용했으며, 올해는 이를 더욱 인텔리전트하게 만드는 작업을 진행할 계획”이라고 밝혔다. 파수닷컴은 지난해 데이터 시큐리티 프레임워크를 제시한 데 이어, 올해 프레임워크 내 각 제품들 간의 링크를 보다 스마트하게 업그레이드해 나갈 예정이다. 시큐어코딩 분야는 스패로우(SPARROW)를 핵심으로 정적 분석 능력을 높이기 위해 차별화된 기능을 적용했다. 현재 정적 분석을 넘어 애플리케이션 개발·테스트·운영전반에 걸친 유기적인 연결을 통해 인텔리전트 보안을 제공하는 플랫폼을 준비하고 있다. 디지털 콘텐트를 관리하는 솔루션인 랩소디(Wrapsody)는 전 세계 사람들의 일하는 방식을 확실히 바꿀 수 있도록 편의성을 높이는 기능을 추가하고 있다. 마지막으로 지난해 하반기에 출시한 디지털페이지(DigitalPage)를 통해 디지털 세상에서의 개인 정보 관리에 새로운 방식을 제안함으로써 정보 관리의 패러다임을 바꿔나겠다는 계획이다. 조 대표는 “파수닷컴의 2015년은 지난 15년의 변화보다 더 큰 변화를 만들어낸 아주 중요한 시기였고, 코어까지 디지털화되는 세상을 리드할 경쟁력을 준비하는 시기였다”라며 “올해는 파수닷컴의 주력 제품 4가지를 통해 디지털 세상을 리드하며 2020년 100대 소프트웨어 기업으로 더욱 스피드 있게 돌격해 나갈 것”이라고 밝혔다."
이데일리,150900,/news/news_read.nhn?article_id=0004075683&office_id=018&mode=search&query=파수닷컴&page=1,2018-04-10 09:44,파수닷컴 문서관리 '랩소디' 문의 급증,"문서추적 솔루션 제품 문의 전년비 60% 증가 파수닷컴 랩소디 솔루션 [이데일리 이재운 기자] 국내 정보보안 업체 파수닷컴(150900)이 기업용 문서 관리 솔루션 ‘랩소디’에 대한 문의가 급증하고 있다고 10일 밝혔다. 랩소디는 기업에서 보유한 모든 문서에 영구적인 ID(아이디)를 부여해 관리할 수 있는 퍼시스턴트 아이디(Persistent ID) 기술을 바탕으로, 문서의 이동에 따른 지속적인 추적이 가능하다. 한 문서에서 파생돼 생성 또는 수정된 문서에 대한 현황을 한 눈에 파악하고, 문서 사용 이력이나 문서간 연관관계, 배포 문서에 대한 유통 경로 등을 실시간으로 확인할 수 있다. 특히 문서 추적용 제품의 경우 전년 대비 60% 가량 문의가 증가하고 있다는 설명이다. 김규봉 파수닷컴 엔터프라이즈다큐먼트플랫폼 사업본부장(상무)은 “랩소디는 시장에서 요구하고 있는 문서의 사용현황과 추적은 물론 간편하면서도 효율적인 문서관리가 모두 가능해, 유일무이한 컨셉의 문서관리 플랫폼이라는 평을 받고 있다”며 “현재 많은 기업 및 기관들로부터 문의가 쇄도하고 있어 수주 실적이 전년보다 크게 성장할 것으로 예상된다”고 말했다."
이데일리,150900,/news/news_read.nhn?article_id=0004168205&office_id=018&mode=search&query=파수닷컴&page=1,2018-08-09 11:54,"파수닷컴 자회사 스패로우, 북미 공략 위해 블랙햇2018 참가","8일(현지시간) 미국 라스베이거스에서 열린 정보보안 행사 ‘블랙햇 USA 2018’ 행사장에 부스를 마련한 스패로우 관계자가 방문객에게 제품의 주요 특징을 설명하고 있다. 스패로우 제공 [이데일리 이재운 기자] 정보보안 업체 파수닷컴(150900) 자회사인 스패로우는 글로벌 사이버 보안 행사 ‘블랙햇(BlackHat) USA 2018’에 참가해 북미시장 공략에 나선다고 9일 밝혔다. 미국 라스베가스에서 8일(현지시간)부터 이틀간 열리는 이 행사는 세계 보안 전문가 1만5000여명이 모여 다양한 분야의 수준 높은 정보들을 공유하는 자리다. 스패로우는 국내 업체 중 유일하게 참가해 애플리케이션 보안 솔루션을 선보이며, 북미 시장 본격 진출을 알렸다. 앞서 진출한 일본·중국 시장의 성공적인 안착에 이어, 본 행사를 시작으로 소프트웨어 강국인 미국 시장 진출에도 힘을 쏟을 계획이다. 스패로우는 이번 행사에서 주요 제품을 소개한다. 소스코드 상의 보안 취약점과 런타임 오류를 개발단계부터 검출하는 △시큐어코딩 솔루션(SAST)을 비롯해 개발 완료 후 테스팅 단계에서 보안 취약점을 진단하는 △웹스캐너 솔루션(DAST), 웹 애플리케이션에 대한 공격을 실시간으로 탐지·차단하는 △자가방어 솔루션(RASP), 이를 모두 통합 관리하는 플랫폼 △인터렉티브허브(InteractiveHUB)를 소개했다. 또 이와 함께 시큐어코딩 클라우드 서비스인 스패로우 사스트 온 클라우드(Sparrow SAST on Cloud)와 이번에 출시한 웹취약점 분석 클라우드 서비스 스패로우 다스트 온 클라우드(Sparrow DAST on Cloud)도 선보였다. 스패로우는 CWE, OWASP, CERT, MISRA C 등의 글로벌 컴플라이언스는 물론 행안부 47개 보안취약점, 국정원 8대 취약점, 전자금융감독 규정 등의 다양한 국내 컴플라이언스 기준을 모두 충족한다. 장일수 스패로우 대표는 “미국 현지 파트너들과의 미팅을 통해 사업 기회를 발굴하고, 포춘 100대 기업에 해당하는 여러 고객들과의 1대 1 상담을 진행하는 등 매우 의미 있는 시간이었다”며 “이번 행사를 미국시장 진출 속도를 높이는 기회로 활용할 수 있을 것”이라고 말했다."
머니투데이,150900,/news/news_read.nhn?article_id=0003897740&office_id=008&mode=search&query=파수닷컴&page=1,2017-07-03 14:13,"파수닷컴, 문서관리 플랫폼에 블록체인 적용","[머니투데이 김지민 기자] 파수닷컴이 지능형 문서관리 플랫폼인 랩소디에 블록체인 기술을 적용했다고 3일 밝혔다. 4차 산업혁명의 핵심 기술로 꼽히고 있는 블록체인은 네트워크 내 모든 참여자가 공동으로 데이터를 검증·기록·보관해 제3자 기관 없이 데이터의 신뢰성을 확보할 수 있는 기술이다. 금융은 물론 부동산, 공공서비스 등 다양한 분야에 사용될 것으로 전망되고 있다. 블록체인을 적용한 랩소디는 문서 라이프 사이클 전 과정에서 생성되는 모든 버전의 문서를 자동으로 수집·관리해 보관 시점과 원본을 증명한다. 이로 인해 전자문서의 무결성 및 보안성을 확보할 수 있다고 설명했다. 기업 및 기관들의 목적 및 특성에 맞게 플랫폼을 선택해 구축할 수 있다는 점도 특징이다. 이미 블록체인 인프라를 구축한 고객들도 기존의 인프라를 재활용할 수 있도록 지원해 구축 시간을 단축하고 비용을 절감할 수 있도록 했다. 조규곤 파수닷컴 대표는 ""블록체인에 대한 기술개발과 적용 범위를 지속적으로 확대해 나가면서 혁신적인 솔루션들을 계속해서 선보일 계획”이라고 밝혔다. textlinktopstart textlinktopend textlinkstart"
헤럴드경제,150900,/news/news_read.nhn?article_id=0001356185&office_id=016&mode=search&query=파수닷컴&page=1,2018-02-20 10:37,"[생생코스닥] 파수닷컴, 앱 보안 사업 &lsquo;스패로우&rsquo; 자회사 분리&hellip;&ldquo;3년내 IPO ...","- “스패로우 재무 안정화 작업 진행” [헤럴드경제=김지헌 기자] 코스닥 상장사 파수닷컴(대표 조규곤)은 최근 3년간 200% 이상의 실적 성장을 기록해 온 애플리케이션 보안 사업 ‘스패로우’를 별도 자회사로 분리했다고 20일 밝혔다. 오는 2021년 기업공개(IPO)를 목표로 사업 전문성을 강화하고 해외 시장 공략 확대에 나설 계획이다. 지난 13일 이사회를 통해 스패로우 법인 신설 안건을 통과시킨 파수닷컴은 내달 3일 주주총회 결의를 거쳐 5월경 신규 법인을 출범할 계획이다. [사진=오픈애즈] 파수닷컴은 ‘스패로우’의 별도법인 설립 이유로 독자적인 사업 전문성 강화를 손꼽았다. 지난 2007년 첫 론칭된 스패로우 사업부가 새로운 시장을 개척하며 견고한 브랜드로 올라선 만큼, 향후 별도 법인에서 발생하는 수익을 온전히 해당 사업 분야에만 재투자 할 수 있는 구조를 마련하고, 해외사업을 더욱 활성화시켜 글로벌 기업으로 성장시켜가겠다는 방침이다. 파수닷컴 관계자는 “스패로우 사업부의 분리는 끊임없이 변화하는 보안시장 움직임에 대응하는 파수닷컴의 속도와 능력을 한층 끌어올리는 계기가 될 수 있을 것”이라며 “성장세가 두드러진 신규 법인 스패로우는 향후 3년내 IPO 추진을 목표로 재무적 경영 안정화도 병행해 갈 계획”이라고 밝혔다. 파수닷컴의 ‘스패로우’는 높은 검출력과 낮은 오탐율을 기반으로 시큐어코딩과 품질을 모두 만족시키는 국내 유일의 정적 분석 진단도구다. 소프트웨어(SW) 개발에서 운영 전 과정에 적용이 가능한 통합플랫폼을 제공하는 것이 특징이다."
이데일리,150900,/news/news_read.nhn?article_id=0004099463&office_id=018&mode=search&query=파수닷컴&page=1,2018-05-11 10:56,"파수닷컴, 앱보안 사업 '스패로우' 분사","사업 전문성-경영 효율성 강화 차원 [이데일리 이재운 기자] 파수닷컴(150900)은 애플리케이션 보안 사업본부를 분사해 ㈜스패로우로 설립하고 글로벌 매출 확대에 나선다고 11일 밝혔다. 스패로우 솔루션은 안전한 소프트웨어 개발 환경을 위한 소스코드 정적 분석 도구로, 10년 이상 연구개발 및 인프라 투자를 통해 자체 기술 경쟁력을 확보하며 국내 애플리케이션 보안 시장을 주도해왔다는 평가를 받는다. 파수닷컴은 이번 분할을 통해 사업 전문성을 높이고 경영 효율성을 극대화해, 국내 시장에서의 주도력을 강화하고 해외 진출을 적극적으로 추진한다는 계획이다. 이를 통해 단기적으로는 3년 내 기업공개(IPO) 상장을, 중장기적으로는 애플리케이션 보안 테스팅 분야에서 글로벌 톱(Top)3에 진입한다는 목표다. 신설법인 스패로우는 소프트웨어 개발주기 전 과정에 적용할 수 있는 제품라인업과 통합플랫폼은 물론, 고객을 위한 맞춤형 전문서비스인 매니지드 서비스까지 넓혀 소프트웨어 품질과 보안을 모두 책임진다는 계획이다. 이와 함께 인공지능(AI), 딥러닝과 같은 최신 기술 접목은 물론 시장 환경과 고객 수요(니즈)를 적극 반영해 타기업과는 차별화한 패러다임을 제시한다는 계획도 밝혔다. 스패로우는 지난 9일부터 11일까지 일본 도쿄 빅사이트에서 열린 일본 최대 IT 전시회 ‘일본IT주간(Japan IT Week) 2018’에 참가, 독립 법인으로서 제품을 선보였다. 장일수 스패로우 대표는 “4차 산업혁명이라는 시대적 변화와 맞물려 애플리케이션 보안이 다양한 분야에서 초미의 관심사가 되면서, 스패로우의 성장성에 대한 기대가 매우 높다”며 “이번 분사를 계기로 일본을 비롯한 중국 등 아시아시장은 물론 미국, 유럽 등 전 세계 해외시장 개척을 위한 행보를 본격화함으로써, 소프트웨어 보안 시장을 대표하는 브랜드로 도약해 나갈 것”이라고 밝혔다."
파이낸셜뉴스,150900,/news/news_read.nhn?article_id=0003799446&office_id=014&mode=search&query=파수닷컴&page=1,2017-04-06 10:16,[fnRASSI]파수닷컴(150900) 현재 +7.02%,"현재 파수닷컴(150900)은 전일대비 7.02% 상승하여 5,260원 선에서 거래가 이루어지고 있다.                   지표               항목               값               종합점수                 성장성               매출액증가율               -0.15               1.76                 자기자본증가율               -0.21                 안정성               부채비율               102.29               7.33                 유동비율               566.58                 이익안정성               4.72                 수익성               ROA               -28.68               0.26                 ROE               -58.01                 영업이익율               -36.17          파수닷컴의 퀀트 재무 점수는 9.35점으로 지난 분기에 비해 성장성 점수가 하락했다. 이는 자기자본 증가율이 감소하였기 때문이다. 실적 안정성이 악화되어 안정성 종합 점수는 하락했다. 수익성 측면에서 볼때 ROA, ROE, 영업이익률 모두 하락하여 이전보다 낮은 점수를 받았다. 상장주식수 대비 거래량은 0.23%로 적정수준 최근 한달간 파수닷컴의 상장주식수 대비 거래량을 비교해보니 일별 매매회전율이 0.23%로 집계됐다. 그리고 동기간 장중 저점과 고점의 차이인 일평균 주가변동률을 3.08%를 나타내고 있다. 'fnRASSI'는 증권전문 기업 씽크풀과 파이낸셜뉴스의 협업으로 로봇기자가 실시간으로 생산하는 기사입니다."
조선비즈,150900,/news/news_read.nhn?article_id=0000396344&office_id=366&mode=search&query=파수닷컴&page=1,2018-01-19 09:54,[특징주] 블록체인 문서 플랫폼 기대감 '파수닷컴' 상한가,블록체인 기술 관련주로 꼽히는 파수닷컴(150900) 이 상한가까지 치솟으며 강세를 나타내고 있다. 19일 오전 9시 52분 현재 코스닥시장에서 파수닷컴은 전날보다 2120원(29.94%) 오른 9200원(상한가)에 거래되고 있다. 지난 16일 5130원이던 이 회사 주가는 3일만에 2배 가까이 올랐다. 파수닷컴은 문서보안 플랫폼 기업이다. 전날 파수닷컴은 올해 상반기 중 블록체인 기반기술이 접목된 문서 플랫폼 ‘랩소디’를 출시한다고 밝힌 바 있다.
아시아경제,150900,/news/news_read.nhn?article_id=0004114279&office_id=277&mode=search&query=파수닷컴&page=1,2017-11-08 16:07,"파수닷컴, 랩소디 연이은 수주&hellip; &ldquo;문서관리 매출 확대 가속화&rdquo;","[팍스넷데일리 공도윤 기자] 파수닷컴의 인텔리전트 문서관리 플랫폼인 랩소디(Wrapsody)가 하반기 다수의 신규 고객사를 확보하며 문서관리 시장 공략을 성공적으로 전개하고 있다. 랩소디는 하반기에 ▲KT&G, 이촌회계법인 등 일반기업을 비롯해 ▲이나인페이 등 금융기업 ▲교육기관 및 한국인터넷진흥원(KISA) 등 공공기관, 제조업에 도입됐다. 회사 관계자는 8일 “여러 분야에서 레퍼런스를 보유하면서, 랩소디가 향후 다양한 버티컬의 고객사들을 위한 문서관리 플랫폼으로 자리 잡을 수 있는 환경이 조성됐다”고 평가했다. 파수닷컴은 관리에 필요한 정보들을 문서에 일체화시켜 암호화하는 방안을 기반으로 새로운 디지털 비즈니스 플랫폼 랩소디를 출시하여 기존 ECM 솔루션의 한계점을 개선했다. 랩소디는 사용자의 익숙한 UX 환경을 유지하면서도 기존 시스템과의 연동을 통해 문서의 보안과 협업, 자산화를 통합적으로 제공한다. 특히 4차산업혁명의 핵심인 사물인터넷(IoT) 기반 구조를 디지털 문서에 적용한 점이 특징이다. 조규곤 대표이사는 “여러 시스템에 분산돼 있던 기업 내 문서들을 하나의 플랫폼으로 관리할 수 있다는 점이 많은 기업 및 기관에서 랩소디를 선택하는 이유”라고 언급하며 “향후 국내 시장을 넘어 세계 시장에서도 높은 성과를 낼 수 있을 것으로 기대하고 있다”고 밝혔다."
서울경제,150900,/news/news_read.nhn?article_id=0003199992&office_id=011&mode=search&query=파수닷컴&page=1,2018-01-17 16:46,"(코)파수닷컴, 전일 대비 13.26% 상승.. 일일회전율은 1.31% 기록","[서울경제] 파수닷컴(150900) 은 17일 오후 1시 5분 현재 13.26% 오른 5,810원에 거래되고 있으며, 39(매도):61(매수)의 매수우위를 기록하고 있다. 거래대금은 5억8,987만, 거래량은 10만6,643주로 거래량회전율은 1.31%로 나타났다. 지난 1개월간 파수닷컴은 상승 13회, 하락 14회를 기록했고, 주가수익률은 19.79% 표준편차는 1.20%를 기록했다. 이 기간 ' 소프트웨어업 ' 업종 평균 주가수익률은 13.69%로 나타났으며, 변동성은 1.41%를 기록했다. 이 시각 현재 ' 소프트웨어업 '은 3.16% 상승 중이며, 54(매도):46(매수)의 매도우위를 기록하고 있다."
이데일리,150900,/news/news_read.nhn?article_id=0003477341&office_id=018&mode=search&query=파수닷컴&page=1,2016-02-16 16:06,"파수닷컴, 지난해 영업이익 3.7억..전년비 77.5% 감소","[이데일리 송이라 기자] 파수닷컴(150900)은 지난해 영업이익이 3억6600만원으로 전년보다 77.5% 감소했다고 16일 공시했다. 같은 기간 매출액은 252억8700만원으로 9.3% 증가했고, 당기순익은 10억2200만원으로 53.1% 감소했다."
이데일리,150900,/news/news_read.nhn?article_id=0003857736&office_id=018&mode=search&query=파수닷컴&page=1,2017-06-23 09:42,"파수닷컴, 인공지능 접목 보안솔루션 개발 MOU","[이데일리 정병묵 기자] 파수닷컴(150900)은 인공지능, 임베디드 관련 소프트웨어 솔루션 전문회사인 엘렉시와 인공지능을 접목한 데이터 보안 솔루션 공동 개발 및 협력을 위한 MOU(양해각서)를 체결했다고 23일 밝혔다. 양사는 이번 MOU를 통해 파수닷컴의 내부 정보유출 탐지 솔루션과 엘렉시의 이상패턴 감지 솔루션을 연동함으로써 인공지능 보안 솔루션 시장에서의 경쟁력 확보 및 잠재적인 사업 기회 발굴에 적극 협력하기로 했다. 파수 리스크뷰는 조직 내 구축된 다양한 보안 시스템 로그들의 연관관계를 기반으로 문서 사용자의 패턴 및 빅데이터 분석을 통해 위험도를 관리하는 솔루션이다. 여기에 딥러닝 기반 신경망 방식으로 데이터스트림을 실시간 모니터링하며 이상패턴을 탐지하는 솔루션인 ‘필로-AD’를 접목함으로써 한층 더 지능적인 정보유출 탐지 성능을 구현한다. 이로써 기존에는 찾지 못했던 유출 리스크 위험을 딥러닝 학습을 통해 탐지할 수 있게 됐다. 또한 리스크 판별을 위한 규칙이 자동 생성되어 전문가의 리소스를 최소화 하였으며, 판단 오류를 점진적으로 줄여줌으로써 시스템 신뢰도를 향상시켰다."
