source,symbol,link,date,title,content
이데일리,150900,/news/news_read.nhn?article_id=0004086963&office_id=018&mode=search&query=파수닷컴&page=1,2018-04-25 13:58,"파수닷컴, 美 CIO 매거진 협업기술 기업 선정","문서 협업·보안 솔루션 ‘랩소디’ 높은 평가 [이데일리 이명철 기자] 파수닷컴(150900)은 미국 CIO 애플리케이션 매거진이 발표한 2018 톱 25 협업 기술 기업에 선정됐다고 25일 밝혔다. CIO는 미국 현지 정보기술(IT) 미디어 브랜드다. 다양한 IT 분야에서 혁신적 엔터프라이즈 솔루션을 선별하고 각 기업의 문제를 효과적으로 해결할 수 있는 적합한 솔루션을 채택토록 지원하고 있다. 이번 협업 기술 기업 선정에서 랩소디가 높은 평가를 받았다고 회사측은 전했다. 랩소디는 기업이 보유한 모든 문서를 지속 관리할 수 있는 퍼시스턴트 아이디 기술을 통해 협업·보안을 동시에 제공하는 솔루션이다. 문서 저장 위치에 상관없이 자동 동기화와 버전 관리를 제공해 수동 프로세스에 따른 실수나 불필요한 업무를 최소화, 비즈니스 효율성을 극대화한다. 조규곤 대표는 “랩소디를 통한 협업 기술 기업 선정은 미국 시장 진출에 집중하는 회사 기술 경쟁력을 인정받은 성과”라며 “해외 보안시장은 인지도와 기술 레퍼런스가 중요한 만큼 시장 진출 전략에도 긍정적”이라고 전했다."
아시아경제,150900,/news/news_read.nhn?article_id=0003633351&office_id=277&mode=search&query=파수닷컴&page=1,2015-11-25 13:48,"파수닷컴, DLL 인젝션 유럽 특허권 취득",[아시아경제 김원규 기자] 파수닷컴은 DLL 인젝션 기능을 구비한 컴퓨팅 장치 및 DLL 인젝션 방법 관련 유럽 특허권을 취득했다고 25일 공시했다. 파수닷컴의 이번 특허는 유럽에서 처음 등록되는 것으로 영국과 독일에 권리 주장을 진행할 계획이다.
디지털타임스,150900,/news/news_read.nhn?article_id=0002331074&office_id=029&mode=search&query=파수닷컴&page=1,2016-02-24 10:18,"파수닷컴, 협업 저작물 저작권 보호 유통 플랫폼 개발","데이터 소프트웨어 보안기업 ㈜파수닷컴(대표 조규곤)이 소셜 콘텐츠 보호와 활성화를 위한 저작권 보호 유통 플랫폼을 올 상반기에 출시한다고 24일 밝혔다. 기존 저작자의 권리를 보호하고 재사용함으로써 누구나 손쉽게 양질의 콘텐츠를 제작하고 적은 비용으로 유통할 수 있게 하는 협업 저작물이 느는데 따른 것이다. 파수닷컴은 한국저작권위원회의 지원을 받아 2013년 5월부터 올해 2월까지 '소셜 저작물의 저작권 보호 및 콘텐츠 메시업 도구 요소기술 개발'을 벌여왔다. 프로젝트의 일환으로 파수닷컴은 저작권 정보에 허용된 용도로 저작물을 2차 이용 및 가공해도 저작권 정보가 유지·확인되면서 최종 저작물의 유통이 활성화되고 정산이 가능한 플랫폼을 개발한 바 있다. 플랫폼 내에서 생성, 자동 변환, 유통되는 모든 저작물은 EPUB 3 포맷을 기반으로 한다. 협업 저작물의 저작권 보호 유통 플랫폼은 ▲개인 또는 협업 콘텐츠 등록 및 관리 시스템 ▲이와 연동된 웹 편집 저작도구 ▲구글드라이브와 같은 외부 저작물의 자동 변환 등록 ▲등록 시 저작물에 포함된 텍스트와 멀티미디어 등의 부분 저작물 저작권 침해 여부 검사 ▲각 저작물의 암호화 및 권한 관리, 위·변조 방지를 위한 DRM ▲유통을 위한 오픈 마켓 연동 ▲저작권 기반 정산 관리 등 각 시스템으로 구성된 플랫폼으로 이루어져 있다. 이와 함께 콘텐츠 구매자가 암호화된 콘텐츠를 복호화해 볼 수 있고 각 부분 저작물의 저작권 정보를 확인할 수 있는 뷰어도 제공한다. 파수닷컴은 웹을 통한 콘텐츠 저작권 보호를 위한 HTML5 기반 저작권 표시 기술과 위변조 방지, HTML5 DRM 기술, 저작권 정보와 권한에 따른 화면 캡처 방지 기술을 개발해 적용했다. 파수닷컴은 이번 플랫폼 개발을 위해 부분 저작물의 분류 및 식별체계, 저작권자 식별체계, 저작권 거래형태, 저작권 정보를 담기 위한 EPUB3 포맷 확장, EPUB DRM 및 라이선스 발급, 저작권 침해 점검을 위한 텍스트 특징점 추출 및 유사도 분석 등 부분저작물의 저작권 보호 기초기술 연구도 벌였다. 이를 바탕으로 실제적인 저작권 침해 점검 도구와 협업 저작물 DRM 기술, 협업 저작물 유통 플랫폼, EPUB 뷰어를 개발했으며 EPUB 저작도구, 클라우드 스토리지 오픈 API 연계, 오픈마켓 연계 기술, 저작권 침해 점검 상용 필터링 서비스 연동, 부분저작물 권리자 수익배분 정산 시스템 등도 개발해 적용했다."
파이낸셜뉴스,150900,/news/news_read.nhn?article_id=0003967971&office_id=014&mode=search&query=파수닷컴&page=1,2018-02-20 10:26,"파수닷컴, 앱 보안 사업 '스패로우' 자회사 분리 &hellip; &quot;3년내 IPO 목표&quot;","파수닷컴이 최근 3년간 200% 이상의 실적 성장을 기록해 온 애플리케이션 보안 사업 ‘스패로우’를 별도 자회사로 분리했다. 향후 2021년 IPO를 목표로, 독자적 사업 전문성을 강화하고 해외 시장 공략 확대에 나서겠다는 취지다. 파수닷컴은 지난 13일 이사회를 통해 스패로우 법인 신설 안건을 통과시킨 파수닷컴은 내달 3일 주주총회 결의를 거쳐 5월경 신규 법인을 출범할 계획이라고 20일 밝혔다. 보안사업은 기술별 제품에 따라 각각의 고객과 시장이 형성돼 있다. 가트너에 따르면 스패로우가 영위 중인 전 세계 애플리케이션 보안 시장 규모는 2021년까지 연 평균 10.7% 가량 고성장을 이어갈 것으로 전망되고 있다. 실제 파수닷컴의 스패로우는 최근 3년 평균 200% 이상의 실적 성장을 이뤄왔고, 지난 해엔 역대 최고 실적을 경신했다. 파수닷컴은 '스패로우'의 별도법인 설립 이유로 독자적인 사업 전문성 강화를 손꼽았다. 지난 2007년 첫 론칭된 스패로우 사업부가 새로운 시장을 개척하며 견고한 브랜드로 올라선 만큼, 향후 별도 법인에서 발생하는 수익을 온전히 해당 사업 분야에만 재투자 할 수 있는 구조를 마련하고, 해외사업을 더욱 활성화시켜 글로벌 기업으로 성장시켜가겠다는 방침이다. 파수닷컴 관계자는 ""스패로우 사업부의 분리는 끊임없이 변화하는 보안시장 움직임에 대응하는 파수닷컴의 속도와 능력을 한층 끌어올리는 계기가 될 수 있을 것""이라며 ""성장세가 두드러진 신규 법인 스패로우는 향후 3년내 IPO 추진을 목표로 재무적 경영 안정화도 병행해 갈 계획""이라고 밝혔다. 파수닷컴의 '스패로우'는 높은 검출력과 낮은 오탐율을 기반으로 시큐어코딩과 품질을 모두 만족시키는 국내 유일의 정적 분석 진단도구다. SW개발에서 운영 전 과정에 적용이 가능한 통합플랫폼을 제공하는 것이 특징이다."
서울경제,150900,/news/news_read.nhn?article_id=0003280451&office_id=011&mode=search&query=파수닷컴&page=1,2018-04-25 14:55,"파수닷컴, 美 시장 &lsquo;Top 25 협업 기술 기업&rsquo; 선정","[서울경제] 파수닷컴(150900) 이 최근 미국 CIO 애플리케이션 매거진(CIO Applications, 이하 CIO)에서 발표한 2018 Top 25 협업 기술 기업(Top 25 Collaboration Technology Companies 2018)에 선정됐다고 25일 밝혔다. CIO는 이번 협업 기술 기업 선정에서 파수닷컴의 랩소디(Wrapsody)를 높이 평가했다. CIO는 “인공지능과 같은 혁신 기술의 적용을 위해 체계적 문서 관리는 우선적으로 진행돼야 한다”며 정보기술(IT) 기업 CIO 및 IT 의사결정권자들에게 랩소디를 소개했다. 조규곤 파수닷컴 대표는 “해외 보안시장은 회사 인지도와 실질적 기술 레퍼런스가 매우 중요시 되는 만큼, 시장 진출 전략에서도 긍정적 요인으로 작용하게 될 것”이라고 밝혔다. 랩소디는 기업에서 보유한 모든 문서를 지속적으로 관리할 수 있는 퍼시스턴트 아이디(Persistent ID) 기술을 통해 협업 및 보안을 동시에 제공한다."
이데일리,150900,/news/news_read.nhn?article_id=0003833743&office_id=018&mode=search&query=파수닷컴&page=1,2017-05-25 14:10,"파수닷컴, 아태지역 최대 정보통신 박람회 '커뮤닉아시아 2017' 참가","[이데일리 이유미 기자] 파수닷컴(150900)이 아시아·태평양 지역 최대 규모의 정보통신 박람회인 ‘커뮤닉아시아 (CommunicAsia) 2017’에 참가해 효율적인 문서관리 및 보안 방안을 소개했다고 25일 밝혔다. 5월 23일부터 25일까지 싱가포르 마리나 베이 샌즈에서 열리는 커뮤닉아시아는 통신, 모바일, 네트워크, 보안 등 IT 전반에 걸쳐 최신 제품 및 솔루션을 소개하는 컨퍼런스다. 중요한 산업 이슈들에 대해 함께 고민하고 정보통신 생태계의 전략적 파트너쉽을 도모하는 자리로, 올해는 약 1191여업체가 참가, 4만8700여명이 참관했다. 이번 행사에서 파수닷컴은 업무 생산성 향상을 위한 인텔리전트 문서관리 플랫폼인 랩소디(Wrapsody)를 선보였다. 랩소디를 사용하게 되면 문서가 생성되는 시점부터 기본적인 보안이 적용되며, 문서식별 기술을 기반으로 효율적인 문서 공유와 버전 관리가 가능하다. 문서가 수정되는 내용들이 서버에 버전 별로 자동 저장되고 필요 시에는 복구를 원하는 PC의 원래 위치에 기존 문서들을 빠르게 복구할 수 있어 랜섬웨어 대응책으로도 관심을 받았다. 조규곤 파수닷컴 대표는 “전 세계를 강타한 랜섬웨어는 물론 대형 고객정보 유출 사고, 보안 규제 등으로 인해 아시아 지역에서도 데이터 중심의 보안 및 관리 방안에 대한 관심이 높아지고 있음을 확인할 수 있었다”며 “이와 함께 사용성을 고려한 효과적인 보안 기능에 대한 니즈가 증가하고 있어 랩소디에 대한 관심과 파트너쉽 문의가 끊이지 않았다”고 말했다. 파수닷컴 부스. (사진=파수닷컴)"
이데일리,150900,/news/news_read.nhn?article_id=0004013464&office_id=018&mode=search&query=파수닷컴&page=1,2018-01-17 13:51,"파수닷컴, 블록체인 활용 문서 보안서비스 상반기 출시",- 문서 플랫폼 랩소디에 블록체인 기반 기술 접목 [이데일리 이명철 기자] 문서보안 플랫폼기업 파수닷컴(150900)은 지난해 7월 개발에 착수한 블록체인 기반 기술의 문서 플랫폼 랩소디를 올 상반기 출시할 예정이라고 17일 밝혔다. 랩소디는 문서가 생성되는 모든 과정에서 모든 버전의 문서를 자동 수집·관리해 보관시점과 원본을 증명하고 전자문서의 무결성과 보안성을 확보하는 시스템이다. 블록체인 기반기술을 접목하면 문서 검증·기록·보관 등 데이터 신뢰성이 향상되고 랜섬웨어 같은 외부 해킹에 대한 보안성도 급격히 향상된다는 게 회사 설명이다. 블록체인 기반 랩소디를 출시하면 기존 국내외 고객사들에게 공급이 확산될 것으로 기대했다. 파수닷컴은 올 초 데이터 칼럼 암호화 장치·방법에 대한 미국 특허를 확보했고 미국 시장 중심으로 문서 플랫폼 사업을 확장하기 위해 랩소디 자산을 미국 법인에 출자한 바 있다. 지난해에는 보안·정보기술(IT) 전문가 존 헤링(John Herring)을 미국법인 대표이사로 영입하기도 했다. 2016년부터는 스위스 블록체인 전문가 모린 진 헨리(Morin Jean Henry) 교수와 블록체인 기반기술 공동연구 개발을 진행하고 있다.
헤럴드경제,150900,/news/news_read.nhn?article_id=0001385269&office_id=016&mode=search&query=파수닷컴&page=1,2018-04-25 15:42,"[생생코스닥] 파수닷컴, 美 시장 &lsquo;Top 25 협업 기술 기업&rsquo; 선정","- 랩소디를 높게 평가 [헤럴드경제=김지헌 기자] 코스닥 상장사 파수닷컴이 최근 미국 애플리케이션 매거진(CIO Applications, 이하 CIO)에서 발표한 2018 Top 25 협업 기술 기업(Top 25 Collaboration Technology Companies 2018)에 선정됐다고 25일 밝혔다. CIO는 이번 협업 기술 기업 선정에서 파수닷컴의 랩소디(Wrapsody)를 높이 평가했다. CIO는 인공지능과 같은 혁신 기술의 적용을 위해 체계적 문서 관리는 우선적으로 진행되어야 하는데, 효과적 디지털 트랜스포메이션 방안을 고민하는 CIO와 IT 의사결정권자들에게 랩소디를 소개했다. [사진=오픈애즈] CIO는 미국 현지 기업들에게 신뢰 높은 IT 미디어 브랜드다. 다양한 IT 분야에서 혁신적 엔터프라이즈 솔루션을 선별하고, 각 기업이 갖고 있는 문제를 효과적으로 해결할 수 있는 적합한 솔루션을 채택할 수 있도록 지원하고 있다. 파수닷컴 조규곤 대표는 “랩소디를 통한 이번 협업 기술 기업 선정은 미국 시장 진출을 위해 다각적 사업에 집중하고 있는 파수닷컴의 기술 경쟁력을 인정받은 가시적 성과”라며 “해외 보안시장은 회사 인지도와 실질적 기술 레퍼런스가 매우 중요시 되는 만큼, 시장 진출 전략에서도 긍정적 요인으로 작용하게 될 것”이라고 밝혔다. 랩소디는 기업에서 보유한 모든 문서를 지속적으로 관리할 수 있는 퍼시스턴트 아이디(Persistent ID) 기술을 통해 협업 및 보안을 동시에 제공한다. 문서 저장 위치에 상관없는 자동 동기화 및 버전관리 역시 제공 중이다."
한국경제TV,150900,/news/news_read.nhn?article_id=0000574395&office_id=215&mode=search&query=파수닷컴&page=1,2017-09-21 10:42,"IBM-파수닷컴, 콘텐트 플랫폼 협력&hellip;문서 공유&middot;보안 기능 '확장'","[한국경제TV 김종학 기자] 파수닷컴이 IBM과 손잡고 기업형 소셜네트워크 서비스 플랫폼을 출시했다고 21일 밝혔습니다. 파수닷컴은 이번 협력으로 데이터 보안 플랫폼인 랩소디(Wrapsody)를  소셜네트워크를 기반으로 한 IBM Connections와 연동해 기업 내에서 생산한 문서들의 보안성을 높이고, 효율적으로 높일 수 있다고 설명했습니다. 파수닷컴의 랩소디는 파수 DRM의 보안 기술을 기반으로 문서 생성 시점부터 접근 제어와 감사 추적 기능을 제공하고 있으며, IBM Connection은 소셜 네트워크 기반 타임라인 방식으로 사용자 간에 신속한 정보 공유가 가능하도록 하고 있습니다. 최종신 파수닷컴 디지털서비스 본부장 ""4차 산업 혁명 시대에 디지털 트랜스포메이션은 기업 성장을 위해 가장 중요한 요소""라며 ""이번에 선보인 콘텐트 서비스 플랫폼을 통해 기업의 문서 관리 체계를 한 단계 더 높일 수 있을 것""이라고 말했습니다."
파이낸셜뉴스,150900,/news/news_read.nhn?article_id=0003945815&office_id=014&mode=search&query=파수닷컴&page=1,2018-01-17 13:41,파수닷컴 &quot;블록체인 문서 플랫폼으로 글로벌 시장 진출&rdquo;,"국내 1위 문서보안 플랫폼 기업 파수닷컴이 올해 블록체인 기반 문서 플랫폼으로 글로벌 시장 진출을 본격화한다고 17일 밝혔다. 지난해 7월 개발에 착수한 파수닷컴은 올해 상반기 블록체인 기반기술이 접목된 문서 플랫폼 랩소디를 출시할 예정이다. 파수닷컴 관계자는 ""랩소디는 문서가 생성되는 모든 과정에서 모든 버전의 문서를 자동으로 수집•관리해 보관시점과 원본을 증명하고, 전자문서의 무결성과 보안성을 확보해 준다. 여기에 블록체인 기반기술이 접목되면 문서의 검증, 기록, 보관 등 데이터 신뢰성이 향상되며 랜섬웨어와 같은 외부 해킹에 대한 보안성도 급격히 향상된다""고 밝혔다. 블록체인 기반 랩소디가 출시되면 파수닷컴의 국내외 클라이언트에게도 확산될 것으로 기대된다. 또한, 글로벌 시장조사 기관인 가트너가 파수닷컴의 랩소디를 높이 평가하고 있는 만큼, 블록체인 기반 문서 플랫폼의 해외진출에도 긍정적인 영향을 미치게 될 것으로 예상된다. 파수닷컴은 올해 초 데이터 컬럼 암호화 장치 및 방법에 대한 미국 특허를 확보했으며, 미국 시장을 중심으로 문서 플랫폼 사업을 본격 확장하기 위해 랩소디 자산을 미국 법인에 출자한 바 있다. 한편 작년에 보안 및 IT전문가인 존 헤링(John Herring)을 미국법인 대표이사로 영입했다. 미 해군 장교 출신인 존 헤링 미국법인 대표이사는 미국 CIA 자금운용회사인 인큐텔(In-q-Tel) 계열사 CEO를 역임한 바 있다. 특히, 파수닷컴은 2016년부터 스위스의 블록체인 전문가 모린 진 헨리(Morin Jean Henry) 교수와 블록체인 기반기술에 대한 공동연구 개발을 진행해 왔으며, 올해 블록체인 기술이 접목된 문서 플랫폼 블록체인 랩소디가 출시를 앞두고 있다"
파이낸셜뉴스,150900,/news/news_read.nhn?article_id=0003548985&office_id=014&mode=search&query=파수닷컴&page=1,2015-11-25 15:17,"[공시]파수닷컴, DLL 인젝션 기술 유럽 특허권 취득","파수닷컴은 DLL 인젝션 기술이 지난 24일 유럽 특허권을 취득했다고 25일 공시했다. 특허명칭은 'DLL 인젝션 기능을 구비한 컴퓨팅 장치 및 DLL 인젝션 방법'이다. DLL 인젝션은 컴퓨터 프로그래밍에서 다른 프로세스의 주소 공간 내에서 DLL를 강제로 로드시켜 코드를 실행하는 기술이다. 회사 측은 ""이번 특허 기술은 프로세스 실행 이전에 DLL 인젝션이 이루어지도록 해 충돌을 방지하는 방법""이라며 ""기존 DLL 인젝션 기법은 프로세스 실행 명령이 입력되면 프로세스가 메모리에 적재된 후 실행되면서 DLL 인젝션이 수행되지만 특허 기술을 사용하면 대상 프로세스 실행 이전에 DLL 인젝션이 이루어질 수 있도록 할 수 있다""고 설명했다. 회사 측은 ""국내와 미국 특허는 이미 등록돼 있다""면서 ""유럽에도 특허를 등록한만큼 향후 영국과 독일에 권리 주장을 진행할 계획""이라고 밝혔다."
한국일보,150900,/news/news_read.nhn?article_id=0000294646&office_id=469&mode=search&query=파수닷컴&page=1,2018-04-19 15:02,"파수닷컴, RSA 2018에서 비정형 데이터 보안ㆍ관리 방안 제시","파수닷컴이 세계 최대 규모의 보안 컨퍼런스 ‘RSA 2018’에 참가해 비정형 데이터를 체계적으로 보호하고 관리할 수 있는 방안을 선보였다고 19일 밝혔다. 미국 샌프란시스코 모스코니센터에서 지난 16일부터 열린 ‘RSA 2018’에서 파수닷컴은 한국 참가기업 중 가장 큰 규모의 부스를 운영하며 비정형 데이터 보안ㆍ관리 솔루션을 상세히 소개했다. 파수닷컴은 기업이 보유한 전체 데이터의 80% 이상을 차지하고 있는 비정형 데이터의 보안ㆍ관리를 위한 ‘파수 데이터 시큐리티 프레임워크(Fasoo Data Security Framework)’와 ‘랩소디(Wrapsody)’를 함께 제시해 큰 호응을 받았다. ‘비정형 데이터를 관리하라(Get Control of Your Unstructured Data)’를 슬로건으로 내건 파수닷컴은 이번 RSA 행사에서 비정형 데이터의 체계적인 관리를 위한 선결 요건인 데이터의 식별ㆍ분류를 위한 새 솔루션 ‘파수 데이터 레이더’(Fasoo Data Radar)를 처음으로 소개했다. 또한 데이터 보안 솔루션 중 가장 강력한 도구로 인식되고 있는 ‘파수 엔터프라이즈 디알엠’(Fasoo Enterprise DRM), 사용자 행위분석을 통해 데이터 유출 위험을 사전에 파악하고 조치할 수 있는 ‘파수 리스크뷰(Fasoo RiskView)’로 구성된 데이터 보안 프레임워크를 상세히 설명했다. 이와 함께 파수닷컴은 효율적인 문서 관리와 문서 사용현황 파악ㆍ추적이 가능한 엔터프라이즈 다큐먼트 플랫폼 ‘랩소디(Wrapsody)’도 소개했다. 보안은 물론 사용자의 문서사용 현황을 기반으로 기업의 업무 생산성 향상을 위한 정보까지 제공한다는 점에서 뜨거운 호응을 받았다. 한편 RSA 2018 행사는 ‘지금이 중요하다(Now Matters)’는 주제를 내걸고 효과가 검증된 사이버 보안 대책들을 더 빠른 속도로 더 많이 채택하는 등 사이버 보안을 위한 조기 투자가 필요하다고 강조했다. 조규곤 파수닷컴 대표는 “행사 참가를 통해 글로벌 기업들이 기업의 생존과 경쟁력 강화를 위해 비정형 데이터 관리와 보안을 얼마나 중요하게 생각하는지 확인할 수 있었다”며 “비정형 데이터 관리와 보안에 관한 최고의 기술력과 경험을 보유하고 있는 파수닷컴 솔루션의 글로벌 경쟁력을 다시 한 번 확인했다”고 말했다."
머니투데이,150900,/news/news_read.nhn?article_id=0003946259&office_id=008&mode=search&query=파수닷컴&page=1,2017-10-12 11:23,"파수닷컴 문서관리 플랫폼 '랩소디', 공공시장 출격","[머니투데이 김지민 기자] /사진제공=파수닷컴 파수닷컴이 디지털 문서 관리 플랫폼 랩소디(Wrapsody)를 조달청 나라장터 쇼핑몰에 GS인증 1등급 지정 제품으로 등록하고 공공시장 영업을 본격화한다고 12일 밝혔다. 랩소디가 공공기관들이 필요한 물품을 구입할 수 있는 사이트인 ‘나라장터 종합쇼핑몰’에 등록(물품식별번호: 23198673~6)을 완료하면서 공공 기관들은 별도의 입찰 과정 없이 구매 클릭만으로 랩소디를 도입할 수 있게 됐다. 랩소디는 오랜 문서 보안 사업을 통해 축적한 파수닷컴 고유의 문서 식별 기술을 기반으로 만들어진 지능형 디지털 문서 플랫폼으로, 생산성과 보안성을 동시에 갖추고 있다. 문서 자체에 통합 관리를 위한 정보를 일체화해 공공기관에서 이미 사용 중인 기존 시스템과의 광범위한 연동을 통해 통합적으로 디지털 문서를 관리할 수 있도록 했다. 최종신 파수닷컴 디지털 다큐먼트 플랫폼 사업본부장은 “공공시장은 파수닷컴이 가장 주력해 온 문서보안 관련 시장 중 하나로 랩소디를 통해 한층 더 고도화된 스마트워크 환경을 구축할 수 있을 것으로 예상한다”고 말했다."
파이낸셜뉴스,150900,/news/news_read.nhn?article_id=0003945774&office_id=014&mode=search&query=파수닷컴&page=1,2018-01-17 13:04,[fnRASSI]파수닷컴(150900) 현재 11.11% &uarr;,"파수닷컴(150900)은 현재 주가가 전일 대비 11.11% 상승한 5,700원 선에서 거래가 이루어지고 있다. 기관/개인 순매수, 외국인은 순매도(한달누적)  전일 외국인이 56주를 순매수했다. 4주간을 기준으로 보면 기관이 매수 우위를 보이면서 2주를 순매수했고, 개인들도 방향성있는 매매를 하면서 1,321주를 순매수했다. 반면 그 동안 외국인은 매도쪽으로 방향을 잡으면서 1,323주를 순매도했다. 개인,외국인만 거래 참여 최근 한달간 주체별 거래비중을 살펴보면 개인이 98.74%, 외국인이 1.25%를 보였고, 기관은 거래참여가 없었다. 그리고 최근 5일간 거래비중은 개인이 97.46%, 외국인이 2.53%를 기록한 것으로 나타났다. 'fnRASSI'는 증권전문 기업 씽크풀과 파이낸셜뉴스의 협업으로 로봇기자가 실시간으로 생산하는 기사입니다."
