source,symbol,link,date,title,content
아시아경제,150900,/news/news_read.nhn?article_id=0003926862&office_id=277&mode=search&query=파수닷컴&page=1,2017-02-07 10:00,"파수닷컴, 가상폴더 이용한 보안 콘텐츠 관리장치 관련 특허권 취득",[아시아경제 권성회 기자] 파수닷컴은 가상 폴더를 이용한 보안 콘텐츠 관리 장치 및 방법에 대한 특허권을 취득했다고 7일 공시했다. 회사 측은 “윈도(Windows) 환경에서 작성된 암호화된 문서를 타 운영체제(OS) 환경(Mac OS)에서 별도의 작업 없이 문서의 권한제어가 가능하게 하기 위한 가상환경을 개발했다”고 설명했다.
이데일리,150900,/news/news_read.nhn?article_id=0004134044&office_id=018&mode=search&query=파수닷컴&page=1,2018-06-25 11:25,"파수닷컴, 정부 신규SW 사업화 대상 선정..20억원 지원 받아","빅데이터 비식별화 솔루션 개발에 총 27억원 투입 [이데일리 이재운 기자] 파수닷컴(150900)은 과학기술정보통신부가 지원하는 2018년 글로벌 창조 소프트웨어(Global Creative SW; GCS) 사업 대상자로 선정됐다고 25일 밝혔다. 이를 통해 파수닷컴은 글로벌 프라이버시 컴플라이언스에 대비한 비식별화 솔루션 개발 사업’을 진행하며, 빠르게 성장하고 있는 빅데이터 비식별화 SW 시장에 본격적으로 뛰어든다고 강조했다. GCS 사업은 국내 역량 있는 SW기업을 대상으로 신규 과제 공모를 실시해 기술개발 혁신성, 글로벌 경쟁력, 사업화 가능성 등을 바탕으로 우수 과제를 선정해 지원한다. 파수닷컴은 이번 선정으로 20억원의 자금을 지원받아 2년간 27억원 규모의 글로벌 비식별화 솔루션 개발 사업을 진행한다. 빅데이터의 핵심이 되는 개인정보를 안전하게 활용할 수 있도록 국내뿐 아니라 각 국가별,  산업별로 상이한 규제(컴플라이언스) 지원과 이에 요구되는 비식별화 기술, 데이터의 유용성이 고려된 차세대 비식별화 솔루션을 완성할 예정이다. 시장조사기관 IDC에 따르면 글로벌 빅데이터 시장은 오는 2020년에 약 2100억 달러 규모로 추산되며, 이에 빅데이터를 안전하게 활용하기 위해 유럽연합의 일반적 개인정보보호 규제(GDPR)와 같은 비식별화에 대한 각 국의 가이드라인이 제정되고 있다. 조규곤 파수닷컴 대표는 “빅데이터 활용에 대한 불분명한 이전 규제에 비해 최근 빅데이터를 통한 가치창출에 중점을 둔 보다 명확하고 안전한 법률과 가이드라인이 생겨나면서, 비식별화 SW 시장이 활성화되고 있는 상황”이라며 “이번 과제를 통해 신규 해외 매출 증대는 물론, 세계적인 빅데이터 활용 활성화에도 기여할 것으로 기대하고 있다”고 말했다."
파이낸셜뉴스,150900,/news/news_read.nhn?article_id=0003773689&office_id=014&mode=search&query=파수닷컴&page=1,2017-02-08 15:20,"[fnRASSI]파수닷컴, 52주 신저가 기록...-2.26% &darr;","외국인과 개인은 순매도, 기관은 순매수(한달누적)  2월2일부터 전일까지 외국인이 4거래일 연속 순매도했다. 4주간을 기준으로 보면 기관이 순매수량을 늘리며 8,048주를 순매수한 반면, 외국인은 매도 관점으로 접근하면서 6,609주를 순매도했고, 개인들도 매도 후 매수의 관점을 보이고 있음에도 불구하고 1,439주를 순매도했다. 주요 투자주체는 개인투자자 최근 한달간 주체별 거래비중을 살펴보면 개인이 92.23%로 가장 높은 참여율을 보였고, 외국인이 4.78%를 보였으며 기관은 2.98%를 나타냈다. 그리고 최근 5일간 거래비중은 개인이 95.49%, 외국인이 4.5%를 기록한 것으로 나타났다.    파수닷컴(150900)은 당일 5,620원까지 하락하며 52주신저가를 기록했다. 동종목의 현재 주가는 전일대비 -2.26% 하락한 5,620원 선에서 이루어지고 있다. 거래일을 기준으로 최근 3일간 평균 거래량은 6,411만 주이다. 이는 60일 일 평균 거래량 8,320만 주와 비교해보면 최근 거래량이 다소 감소했다는 것을 알 수 있다.   'fnRASSI'는 증권전문 기업 씽크풀과 파이낸셜뉴스의 협업으로 로봇기자가 실시간으로 생산하는 기사입니다."
한국경제,150900,/news/news_read.nhn?article_id=0003528739&office_id=015&mode=search&query=파수닷컴&page=1,2016-01-21 13:39,"파수닷컴, 자기주식 취득 결정",[ 정현영 기자  ] 파수닷컴은 21일 주주가치 제고를 위해 보통 자사주 5만주를 취득하기로 결정했다고 공시했다. 취득예상기간은 오는 4월21일까지다. 정현영 한경닷컴 기자
이데일리,150900,/news/news_read.nhn?article_id=0003745161&office_id=018&mode=search&query=파수닷컴&page=1,2017-02-09 10:36,"파수닷컴, 미국법인 새 CEO 영입&hellip;&quot;美 시장 영향력 확대&quot;","존 헤링 파수 미국법인 대표. (사진=파수닷컴) [이데일리 이유미 기자] 파수닷컴(150900)은 파수 미국법인 대표(CEO)로 존 헤링(John Herring)을 새롭게 영입했다고 9일 밝혔다. 파수닷컴은 미국 상황에 맞는 영업전략 및 마케팅을 진행하고자 2012년에 미국법인을 설립하고 현지 IT전문가들을 경영진으로 구성해 미국 시장을 공략해 왔다. 올해 IT 분야에서 30년 이상의 경력을 가진 존 헤링을 CEO로 새롭게 영입한 파수닷컴은 주요 기관·기업의 경영진 등 고위급 영업력을 강화하며 미국시장에서의 영향력을 확대해 나간다는 전략이다. 존 헤링 대표는 미 해군 장교로 활동한 이후, 초기 시장에서부터 시장 개척에 이르기까지 4개의 벤처를 이끌었다. 최근에는 CIA 자금운용회사인 인큐텔(In-q-Tel) 계열 회사의 CEO를 맡았으며, 신기술 및 솔루션 동향 등을 빠르게 습득해 미국 정보보안 시장 발전을 위해 힘써왔다. 사모투자펀드 운용회사 코스톤 캐피털을 공동 설립한 바 있으며, 더 시타델에서 학사, 조지 워싱턴 대학교에서 금융 및 투자관련 MBA 과정을 수료한 바 있다. 존 헤링 대표는 “지난 15년동안 국가 정보기관 및 사모펀드 회사의 IT 최고 전문가로 활동하며 사이버 보안과 관련한 최신 요구 사항에 대응하고, 데이터 중심의 솔루션 및 기술을 이끌어 왔다”며 “차별화된 데이터 보안 플랫폼으로 시장에서 지속적으로 부각되는 파수닷컴을 지난 몇 년간 관심 있게 지켜봤으며, 북미 데이터 보안 시장을 리딩하는 기업으로 성장하기에 충분히 승산이 있을 것으로 판단했다”고 말했다. 한편, 파수닷컴은 오는 13일부터 17일까지(현지시간) 미국 샌프란시스코에서 개최되는 세계 최대 사이버보안 행사인 ‘RSA 2017’에 단독 부스로 참가한다. 이번 행사에서 파수닷컴은 ‘데이터 중심의 모든 것’을 주제로 데이터 중심의 보안 프레임워크인 파수 데이터 시큐리티 프레임워크, 인텔리전트 디지털 다큐먼트 플랫폼 랩소디, 정적 분석 도구 스패로우를 선보일 계획이다."
전자신문,150900,/news/news_read.nhn?article_id=0002657301&office_id=030&mode=search&query=파수닷컴&page=1,2017-11-14 10:28,"[ET투자뉴스]2017년 3분기 실적발표 파수닷컴, 전분기比 영업이익&middot;순이익 모두...","11월 13일 파수닷컴(150900)의 2017년 3분기 연결 확정 실적이 발표됐다. 매출액은 작년 같은 기간 대비해서 6.83% 증가하여 63억원을 달성했다. 영업이익은 2.2억원으로 -6.7억원에서 흑자전환되었다. 당기순이익은 0.1억원으로 -7.6억원에서 흑자전환되었다. 이번분기 기준으로 추정되는 파수닷컴의 자기자본이익률(ROE)은 0.4%로 나타났다. 이는 최근 일년과 비교했을 때 급등한 수치이다. 3분기 자기자본은 하락하고 당기순이익이 상승하였기 때문이다. 전년 동기인 2016년 3분기 ROE는 -14.7%로 이번 분기에 15.1%p 상승했다. 한편 동종목의영업이익률은 3.5%이다. 이는 최근 일년과 비교했을 때 급등하였다. 3분기 매출액, 영업이익 모두 상승했는데, 영업이익의 상승폭이 더 컸기 때문에 영업이익률이 상승했다. 지난해 동기 영업이익률은 -11.4%로 이번 3분기가 14.9%p 상승했다. 주가가 1주당 수익의 몇배가 되는지 나타내는 주가수익비율(PER)은 3745.8배로 나타났다.주가가 1주당 순자산의 몇배인지 알려주는 주가순자산비율인 PBR은 3.39배이다. 지난해 동기 PBR은 2.57배로 이번 3분기 PBR이 상승했다. 다음은 파수닷컴과 동일 업종 내 비교 그룹 종목의 각각 최근 실적의 전년 동기 대비 성장률이다. 파수닷컴의 매출액 증감율은 타 종목 대비 우수한 편이다. 그리고 주가의 하락율이 비교적 큰 편으로 나타났다."
머니투데이,150900,/news/news_read.nhn?article_id=0003988854&office_id=008&mode=search&query=파수닷컴&page=1,2018-01-05 12:01,"파수닷컴, 美서 데이터 컬럼 암호화 장치 및 방법 특허권 취득","[머니투데이 진경진 기자] 파수닷컴 은 데이터 컬럼 암호화 장치 및 방법에 대한 미국 특허권을 취득했다고 5일 공시했다. 회사 측은 ""해당 특허는 DB 암호화 솔루션 관련 기술로 사용자에게 암호화된 정보에 대해 빠른 검색을 제공한다""며 ""2015년 국내 특허를 취득한 이후 해외 시장 경쟁력 확보를 위해 미국에서 동일한 내용으로 특허를 취득했다""고 설명했다."
연합뉴스,150900,/news/news_read.nhn?article_id=0009793021&office_id=001&mode=search&query=파수닷컴&page=1,2018-01-05 11:44,"파수닷컴, 데이터 컬럼 암호화 기술 미국 특허","(서울=연합뉴스) 유현민 기자 = 코스닥에 상장된 시스템 소프트웨어 개발업체인 파수닷컴은 데이터 컬럼 암호와 장치와 방법에 대한 미국 특허를 취득했다고 5일 공시했다. 회사 측은 ""국내 특허는 2015년에 취득했다""며 ""해외시장에서 경쟁력 확보를 위해 이번에 미국에서도 동일한 내용으로 특허를 취득했다""고 설명했다."
이데일리,150900,/news/news_read.nhn?article_id=0003748285&office_id=018&mode=search&query=파수닷컴&page=1,2017-02-13 15:51,"파수닷컴, 데이터 보안 토털 서비스로 보안 시장 공략","[이데일리 이유미 기자] 파수닷컴(150900)이 컨설팅 서비스부터 보안 시스템 구축 및 관리까지 원 스톱으로 제공하는 ‘파수 데이터 보안 토털 서비스’로 올 한해 보안 시장을 적극 공략한다고 13일 밝혔다. 파수닷컴은 컨설팅부터 설계, 구축에 이르기까지 조직에 필요한 전반적인 시스템 구축과 지속적인 관리를 지원하는 ‘파수 데이터 보안 토털 서비스’를 올해부터 본격적으로 제공할 계획이다. 이미 파수닷컴은 빈틈없는 데이터 보안을 위해 ‘파수 데이터 시큐리티 프레임워크’를 제시하고 데이터 중심의 탐지, 분류, 보안, 리스크 관리 솔루션들을 제공해 오고 있다. 하지만 기존의 자사 솔루션 공급 위주의 사업 방식으로는 데이터 시큐리티 프레임워크를 고객에게 효과적으로 딜리버리 하기 힘들다는 판단 하에, 개별 고객 환경에 최적화된 데이터 보안 체계를 구축할 수 있는 토탈 서비스 형태로 사업을 확장했다. 파수닷컴은 데이터 보안 토털 서비스 제공을 위해 지난해 정보보호컨설팅 전문회사를 인수해 내재화를 완료했으며 차별화된 데이터 보안 컨설팅을 위해 파수만의 특화된 정책설정방법론과 데이터 보안 컨설팅 방법론에 대한 개발도 완료했다. 데이터 보안을 위한 인력지원이나 투자가 어려운 중소 규모의 조직을 위한 클라우드 기반의 보안 관리 서비스도 연내 제공할 계획이다. 더불어, 해당 사업을 본격적으로 진행하기 위해 컨설팅, SI, 서비스 기반의 전략사업을 총괄할 윤덕상 전무를 올해 초 새롭게 영입했다. 윤전무는 지난 25년 동안 삼성, 롯데 그룹 IT 계열사에서 보안 및 컨설팅, 인프라 분야 서비스 사업을 담당하였으며 최근까지 KT그룹 IT서비스 전문 회사에서 CISO 업무를 수행해 온 보안 전문가이다. 윤전무는 “이제는 단위 포인트 솔루션을 제공하는 개념에서 한 단계 더 나아가 고객들이 데이터를 안전하게 활용하고 관리하는데 필요한 모든 솔루션과 서비스를 통합하여 제공해야 한다”며 “파수닷컴이 지난 16년간 쌓은 데이터 보안분야의 오랜 경험과 노하우를 바탕으로 파일, DB, 멀티미디어 콘텐트 등 모든 데이터에 대해 고객 맞춤형 보안 및 관리 방안을 제공해 나갈 것”이라고 말했다."
머니투데이,150900,/news/news_read.nhn?article_id=0003617032&office_id=008&mode=search&query=파수닷컴&page=1,2016-01-21 13:33,"파수닷컴, 자사주 5만주 취득 결정","[머니투데이 이택주 기자] 파수닷컴이 3억1850만원 규모의 자기주식 5만주를 취득하기로 결정했다고 21일 공시했다. 회사측은 ""주주가치를 제고하고 임직원 복리를 증진하기 위해서 증권시장에서 자사주를 취득하겠다""고 밝혔다. textlinktopstart textlinktopend textlinkstart"
뉴시스,150900,/news/news_read.nhn?article_id=0008659030&office_id=003&mode=search&query=파수닷컴&page=1,2018-06-18 11:12,"파수닷컴, DRM 환경 클립보드 시스템 관련 유럽 특허 취득","【서울=뉴시스】장서우 기자 = 코스닥 상장 시스템 소프트웨어 개발 및 공급업체 파수닷컴(150900)은 디지털저작권관리(DRM) 환경에서의 클립보드 보호 시스템 및 그 방법을 컴퓨터에서 실행하기 위한 프로그램을 기록한 기록 매체에 관한 유럽 특허를 취득했다고 18일 공시했다. 회사 측은 ""DRM이 적용된 데이터 클립보드의 임시 저장 식별 정보에 특정 문자열을 추가해 변경하고 변경된 식별 정보로 접근하는 객체에 대해서만 복호화된 자료 이용을 허용하는 방안에 관한 특허""라며 ""윈도우즈 시스템에서 카피&페이스트 기능 사용을 제어하기 위해 DRM이 적용된 데이터와 DRM이 적용되지 않은 데이터의 클립보드를 구분해 사용 권한을 확인할 수 있게 한다""고 설명했다. 파수닷컴은 지난 2011년 국내, 2015년 일본, 2015년 미국에서 해당 특허를 각각 취득한 바 있다. 회사는 이를 자사 제품에 적용할 예정이다."
한국경제TV,150900,/news/news_read.nhn?article_id=0000604171&office_id=215&mode=search&query=파수닷컴&page=1,2018-02-20 14:07,"파수닷컴, 앱 보안 사업 '스패로우' 분리‥3년래 IPO","[한국경제TV 김치형 기자] 파수닷컴(대표 조규곤)이 최근 3년간 200% 이상의 실적 성장을 기록해 온 애플리케이션 보안 사업 '스패로우'를 별도 자회사로 분리키로 했습니다. 또한 향후 3년래 기업공개를 통한 상장을 목표로 독자적 사업 전문성을 강화하고 해외 시장 공략 확대에 나서겠다고 선언했습니다 파수닷컴은 지난 13일 이사회를 통해 스패로우 법인 신설 안건을 통과시키고 다음달 3일 주주총회 결의를 거쳐 5월경 신규 법인을 출범 계획을 세웠습니다. 가트너에 따르면 스패로우가 영위 중인 전 세계 애플리케이션 보안 시장 규모는 2021년까지 연 평균 10.7%의 고성장을 전망됩니다. 실제 파수닷컴의 스패로우 역시 최근 3년 평균 200% 이상의 실적 성장을 이뤘습니다. 파수닷컴 회사 관계자는 ""스패로우 사업부의 분리는 끊임없이 변화하는 보안시장 움직임에 대응하는 파수닷컴의 속도와 능력을 한층 끌어올리는 계기가 될 수 있을 것""이라며 ""성장세가 두드러진 신규 법인 스패로우는 향후 3년내 IPO 추진을 목표로 재무적 경영 안정화도 병행해 갈 계획""이라고 밝혔습니다."
파이낸셜뉴스,150900,/news/news_read.nhn?article_id=0003775616&office_id=014&mode=search&query=파수닷컴&page=1,2017-02-13 11:00,"[fnRASSI]파수닷컴, 0.52% 오르며 거래량 증가","파수닷컴(150900)의 당일 거래량이 최근 5거래일 거래량의 최고치를 넘어서며 투자자들의 관심을 받고 있다. 그리고 파수닷컴은 3일 연속 상승흐름을 보이며, 10시 56분 현재 0.52% 증가한 5,850원에 거래중이다. 회전율이 낮지만 주가등락폭은 적정한 편 최근 한달간 파수닷컴의 상장주식수 대비 거래량을 비교해보니 일별 매매회전율이 0.07%로 집계됐다. 이처럼 회전율이 너무 낮은 경우 유동성이 떨어져 매매가 자유롭지 못할 수 있기 때문에 상당한 주의가 필요하다. 저점대비 고점의 장중 주가변동률은 평균 2.68%로 적정한 수준을 보이고 있다. 퀀트 재무분석, 종합점수 9점으로 상승                    지표               항목               값               종합점수                 성장성               매출액증가율               -0.26               2.16                 자기자본증가율               -0.05                 안정성               부채비율               102.29               7.61                 유동비율               566.58                 이익안정성               5.28                 수익성               ROA               -3.42               1.97                 ROE               -6.91                 영업이익율               0.15          파수닷컴의 퀀트 재무 점수는 11.74점으로 3개월 이전 11.66점보다 올랐다. 지난 분기에 비해 성장성 점수가 상승했다. 이는 자기자본 증가율이 증가하였기 때문이다. 부채비율이 상승하여 안정성 종합 점수는 하락했다. 수익성 측면에서 볼때 ROE가 하락하여 이전보다 낮은 점수를 받았다. 'fnRASSI'는 증권전문 기업 씽크풀과 파이낸셜뉴스의 협업으로 로봇기자가 실시간으로 생산하는 기사입니다."
아시아경제,150900,/news/news_read.nhn?article_id=0003643964&office_id=277&mode=search&query=파수닷컴&page=1,2015-12-10 10:53,"파수닷컴, 디지털페이지 스마트앱 어워드 2015 최우수상 수상","스마트앱어워드 2015에서 디지털페이지가 기능서비스 부문 정보관리 분야에서 최우수상을 수상했다(사진제공=파수닷컴) [아시아경제 팍스넷 공도윤 기자] 데이터 보안 기업 파수닷컴이 클라우드 서비스 ‘디지털페이지(DigitalPage)’가 스마트앱어워드 2015에서 최우수상을 수상했다고 10일 밝혔다. 디지털페이지는 메모, 일정, 연락처, 할일 등 개인 일상 정보를 기록하고 연결해 필요한 정보를 찾기 전에 보여주는 인텔리전트 라이프로그 서비스다. 스마트앱어워드는 새로 개발되거나 업데이트 된 모바일 앱을 대상으로, 가장 혁신적이고 우수한 성과를 이룬 앱을 선정해 시상하는 국내 최대 권위의 우수 모바일 앱 평가 시상이다. 올해 스마트앱어워드에는 총 13개 부문에 706개의 업체가 참여, 디지털페이지는 기능서비스 부문 정보관리 분야에서 최우수상을 수상했다. 이번 시상에서 디지털페이지는 각종 정보에 인라인 태그를 지정하면 자동으로 연동돼 별도의 앱을 실행하지 않고 정보를 손쉽게 관리할 수 있다는 점과 오프라인 상태에서도 페이지를 작성하고 편집할 수 있다는 점에서 높은 점수를 받았다. 최종신 파수닷컴 클라우드 서비스 본부장은 “사용자들이 더욱 편리하고 쉽게 사용할 수 있도록 지속적인 서비스 개선 및 차별화 기능을 제공해 글로벌 시장에서 주목 받는 서비스가 되도록 하겠다”고 밝혔다."
파이낸셜뉴스,150900,/news/news_read.nhn?article_id=0003772049&office_id=014&mode=search&query=파수닷컴&page=1,2017-02-06 09:18,"[fnRASSI]파수닷컴(150900), 52주 신저가 기록...-2.59% &darr;","개인투자자의 매매가 가장 활발 최근 한달간 주체별 거래비중을 살펴보면 개인이 92.49%, 외국인이 4.46%, 기관은 3.03%를 기록한 것으로 나타났다. 그리고 최근 5일간 거래비중은 개인이 96.67%, 외국인이 2.66%, 기관은 0.66%를 기록했다. 상장주식수 대비 거래량은 0.08%로 적정수준 최근 한달간 파수닷컴의 상장주식수 대비 거래량을 비교해보니 일별 매매회전율이 0.08%로 집계됐다. 그리고 동기간 장중 저점과 고점의 차이인 일평균 주가변동률을 2.24%를 나타내고 있다.    파수닷컴(150900)은 당일 5,650원까지 하락하며 52주신저가를 기록했다. 동종목의 현재 주가는 전일대비 -2.59% 하락한 5,650원 선에서 이루어지고 있다. 거래일을 기준으로 최근 3일간 평균 거래량은 9,661만 주이다. 이는 60일 일 평균 거래량 8,452만 주와 비교해보면 최근 거래량이 약간 증가했지만 크게 벗어나지는 않았다.   'fnRASSI'는 증권전문 기업 씽크풀과 파이낸셜뉴스의 협업으로 로봇기자가 실시간으로 생산하는 기사입니다."
헤럴드경제,150900,/news/news_read.nhn?article_id=0001182915&office_id=016&mode=search&query=파수닷컴&page=1,2017-01-11 14:50,"[생생코스닥] 파수닷컴, KB 지식재산 투자조합으로부터 40억 투자 유치","- 창의형 IP 투자 20억, 벤처캐피털형 IP투자 20억 유치- 지적재산에 대한 수익화 사업 및 해외진출에 적극 투자 [헤럴드경제=박세환 기자] 코스닥 상장사 파수닷컴(대표 조규곤)이 ‘KB 지식재산 투자조합’으로부터 지적재산(IP)에 대한 잠재적 성장가치를 인정받아 40억 투자를 유치했다고 11일 밝혔다.  KB 지식재산 투자조합은 성장사다리펀드 중 IP펀드를 운용하는 KB인베스트먼트에 의해 조성됐다. 장래성있는 IP를 보유한 중소·벤처기업에게 자금을 조달한다는 취지로 설립됐다. 파수닷컴은 기술력을 바탕으로 데이터 보안과 애플리케이션 보안, 디지털 문서 플랫폼, 개인정보 비식별화, 개인용 생산성 서비스 등 다양한 분야에서 국내외 시장을 리드하고 있는 소프트웨어 기업이다. 모바일, 클라우드, 사물인터넷(IoT), 빅데이터, 인공지능(AI) 등 변화하는 IT트렌드에 빠르게 대응하며 생산성과 보안성을 획기적으로 높여주는 차별화된 소프트웨어를 제공하고 있다. 이와 관련해 등록된 특허수가 국내외 통틀어 70여건이 된다. 이번에 파수닷컴이 유치한 투자금 40억원 중 20억원은 창의형 IP투자, 나머지 20억원은 벤처캐피탈형 IP 투자이다. 창의형 IP투자는 파수닷컴이 보유한 특허의 라이센싱 사업으로 발생한 수익금의 일부를 조합과 공유하는 형태이다. 이 형태의 투자는 국내에서 파수닷컴이 처음이다. 조규곤 파수닷컴 대표는 “파수닷컴이 보유한 기술력과 장래의 성장 가능성을 외부 투자자로부터 인정받았다는데 그 의미가 크다”며 “지난 몇 년간 신규 사업과 해외 진출에 대한 투자 결과가 지난해부터 가시화하고 있으며 올해 본격적인 성과가 나올 것”이라고 밝혔다. 한편, 파수닷컴은 이번 투자에 대해 10일 계약체결을 완료했으며, 이번에 유치한 투자금은 파수닷컴이 보유한 국내외 핵심 특허의 수익화 사업 및 해외진출을 위한 특허포트폴리오 강화 비용으로 활용될 예정이다."
아시아경제,150900,/news/news_read.nhn?article_id=0003814814&office_id=277&mode=search&query=파수닷컴&page=1,2016-08-25 14:35,"파수닷컴, 워터마크 화면표시장치 특허권 취득",[아시아경제 최동현 기자] 파수닷컴은 워터마크를 화면상에 표시하는 장치 및 방법에 대한 특허권을 취득했다고 25일 공시했다.
머니투데이,150900,/news/news_read.nhn?article_id=0003598165&office_id=008&mode=search&query=파수닷컴&page=1,2015-12-16 18:17,"파수닷컴, 30억원 규모 BW 발행 결정",[머니투데이 박진영 기자] 파수닷컴은 운영자금 취득을 위해 30억원 규모의 무기명 이권부 비분리형 사모신주인수권부사채를 발행키로 했다고 16일 공시했다. 만기 이자율은 3%이고 사채 만기일은 2018년 12월18일이다. [박진영 기자 트위터 계정
