source,symbol,link,date,title,content
매일경제,150900,/news/news_read.nhn?article_id=0004078480&office_id=009&mode=search&query=파수닷컴&page=1,2018-01-05 15:56,[코스닥 공시] 삼강엠앤티 / 파수닷컴,◇삼강엠앤티=576억원 경비함 공급계약 체결. ◇파수닷컴=DB 암호화 솔루션 기술 특허 취득. r_start // r_end //
이데일리,150900,/news/news_read.nhn?article_id=0003895074&office_id=018&mode=search&query=파수닷컴&page=1,2017-08-10 14:26,"파수닷컴, 日&middot;中 시장서 공급계약 체결","[이데일리 이유미 기자] 파수닷컴(150900)은 소스코드 분석도구인 스패로우(SPARROW)가 아시아 시장에서 본격적인 공급계약이 이어지고 있다고 10일 밝혔다. 파수닷컴은 지난달 일본의 베리서브와 전략적 파트너십을 체결하며 일본 소프트웨어 테스트시장 공략에 나섰다. 스패로우는 국내 최고 시맨틱 기반의 정적 분석 기술을 바탕으로 개발 단계부터 소스코드 상의 보안 약점을 검출해 제거하도록 지원하는 최적의 정적 분석 도구이다. 2001년 설립된 베리서브는 일본 전역에서 소프트웨어 품질 및 보안 테스트를 위한 솔루션을 공급하고 자체 보유한 전문인력을 통해 고객에게 직접 테스트 서비스도 함께 제공하는 회사이다. 이번 제휴를 통해 베리서브는 파수닷컴의 스패로우를 일본에서 판매하는 역할뿐 아니라 고객에게 서비스를 제공할 때 기존의 미국 솔루션을 대신해 스패로우를 사용하기로 했다. 파수닷컴은 중국에서도 소프트웨어 품질 컨설팅 업체인 티스프테크(Tisp Tech)와 스패로우 공급을 위한 파트너십을 구축했다. 장일수 파수닷컴 상무는 “스패로우는 낮은 오탐율과 체계적인 기술지원 서비스는 물론, 소프트웨어 품질과 보안을 함께 커버할 수 있는 정적 분석 진단도구”라며 “한국과 비교해 10배 이상의 품질 테스트 시장 규모를 형성하고 있는 일본에서 스패로우의 경쟁력을 인정 받은 것은 의미가 크며 앞으로 해외 영업망을 강화해 글로벌 시장 점유율을 높여나갈 것“이라고 말했다."
헤럴드경제,150900,/news/news_read.nhn?article_id=0001410418&office_id=016&mode=search&query=파수닷컴&page=1,2018-06-27 10:00,"[생생코스닥] 파수닷컴, 20억원 규모 정부사업 대상자 선정","- 총 20억원의 자금을 지원받아 향후 2년간 진행 [헤럴드경제=김지헌 기자] 코스닥 상장사 파수닷컴이 과학기술정보통신부에서 지원하는 ‘글로벌 창조 소프트웨어(Global Creative SW, 이하 GCS)사업’ 대상자에 선정됐다고 27일 밝혔다. 이 사업은 최근 빅데이터의 핵심이 되는 개인정보의 안전한 활용을 위해 차세대 비식별화 솔루션 개발을 하는 것이다. 세계 빅데이터 시장이 오는 2020년 약 2100억달러(약 234조3390억원) 규모까지 성장할 것으로 전망되는 와중에 유럽연합(EU)이 일반개인정보보호법(GDPR) 시행에 돌입하는 등 전 세계적으로 데이터 산업에 대한 중요성이 강조되면서 우리나라 정부도 선제적 대응에 나서는 모습이다. 이번 GCS 사업 선정을 통해, 파수닷컴은 정부로부터 총 20억원의 자금을 지원받아 향후 2년간 글로벌 비식별화 솔루션 개발 사업을 진행하게 된다. 파수닷컴은 지난 2015년부터 비식별화 관련 기술의 중요성을 인식하고, 다양한 조합의 알고리즘을 연구 및 개발하는 등 선제적 기술개발을 이어왔다. 지난 2016년 4월엔 국내 최초로 비식별화 솔루션 ‘애널리틱 디아이디(Analytic DID)’를 출시하는 등 현재까지 민간, 의료, 공공 등 다양한 분야에서 비식별 및 재식별 위험 진단 컨설팅을 수행하며 빅데이터 보안 시장에서 입지를 확고히 해오고 있다. 한편, 대통령 직속 4차 산업혁명위원회는 지난 26일 ‘데이터 산업 활성화 전략’을 심의-의결했다. 과학기술정보통신부는 2022년까지 빅데이터 기술수준을 선진국의 90%까지 끌어 올리기 위해 데이터 강소기업 100개를 육성할 계획이다. 정부는 데이터 시장의 10조원 규모 확대 육성을 위해 다양한 전방위 정책 지원을 이어가겠다는 방침이다."
서울경제,150900,/news/news_read.nhn?article_id=0002924189&office_id=011&mode=search&query=파수닷컴&page=1,2016-11-24 16:14,"파수닷컴, 디지털 저작권 관리방법 美 특허취득",파수닷컴(150900)이 전자책 콘텐츠의 디지털 저작권 관리장치·방법에 관해 미국에서 특허를 취득했다고 24일 공시했다. 파수닷컴은 앞서 해당 기술로 2013년에 국내 특허를 취득한 바 있으며 일본·미국에서도 특허권을 확보했다. 유럽에서는 심사가 진행 중이다.
전자신문,150900,/news/news_read.nhn?article_id=0002632059&office_id=030&mode=search&query=파수닷컴&page=1,2017-08-09 11:15,"[ET투자뉴스]파수닷컴, 17년2분기 실적 발표",08월 09일 파수닷컴(150900)의 2017년 2분기 연결 확정 실적이 발표됐다. 전년 같은 기간 대비해서 매출액은 28.35% 상승하여 58억원을 기록했다. 영업이익은 -7.9억원으로 -20.9억원에서 적자폭이 축소되었다. 당기순이익은 -8.1억원으로 -21.9억원에서 적자축소되었다. 이번분기 기준으로 추정되는 파수닷컴의 자기자본이익률(ROE)은 -28.9%로 나타났다. 이는 최근 일년과 비교했을 때 급등한 수치이다. 2분기 자기자본은 하락하고 당기순이익이 상승하였기 때문이다. 전년 동기인 2016년 2분기 ROE는 -40.2%로 이번 분기에 11.3%p 상승했다. 한편 동종목의영업이익률은 -13.6%이다. 이는 최근 일년과 비교했을 때 급등하였다. 지난해 동기 영업이익률은 -46.2%로 이번 2분기가 32.6%p 상승했다. 주가가 1주당 순자산의 몇배인지 알려주는 주가순자산비율인 PBR은 3.03배이다. 지난해 동기 PBR은 2.54배로 이번 2분기 PBR이 상승했다. 다음은 파수닷컴과 동일 업종 내 비교 그룹 종목의 각각 최근 실적의 전년 동기 대비 성장률이다. 파수닷컴의 매출액 증감율은 타 종목 대비 가장 우수한 편이다. 그리고 주가의 하락율이 가장 큰 편으로 나타났다.
한국일보,150900,/news/news_read.nhn?article_id=0000182898&office_id=469&mode=search&query=파수닷컴&page=1,2017-01-11 18:55,"파수닷컴, 지적재산에 대한 가치 인정받아 40억 투자 유치","보안업체인 파수닷컴은 11일 KB 지식재산 투자조합으로부터 지적재산(IP)에 대한 잠재적 성장가치를 인정받아 40억원을 투자 유치했다고 밝혔다. 파수닷컴은 데이터 보안, 애플리케이션 보안, 디지털 문서 플랫폼, 개인정보 비식별화, 개인용 생산성 서비스 등 다양한 분야에서 국내외 70여건의 특허를 등록했다 파수닷컴은 이번에 유치한 투자금을 국내외 핵심 특허의 수익화 사업 및 해외진출을 위한 특허포트폴리오 강화 비용으로 활용될 예정이다. 조규곤 파수닷컴 대표는 “해당 투자는 과거실현 매출보다 파수닷컴이 보유한 기술력과 장래의 성장 가능성을 외부 투자자로부터 인정받았다는데 그 의미가 크다.”라고 밝혔다."
이데일리,150900,/news/news_read.nhn?article_id=0004164017&office_id=018&mode=search&query=파수닷컴&page=1,2018-08-02 15:21,"파수닷컴, 문서 보안&middot;협업 돕는 클라우드서비스 론칭","랩소디, 클라우드제트 등록…중소기업 비용 절감 [이데일리 이명철 기자] 파수닷컴(150900)은 퍼시스턴트 아이디(Persistent ID) 기반 엔터프라이즈 다큐먼트 플랫폼 ‘랩소디’를 SK C&C의 클라우드서비스 클라우드제트에 등록했다고 2일 밝혔다. 퍼시스턴트 아이디는 기업이 보유한 모든 문서에 변형되지 않는 영구 아이디를 부여해 끊김 없이 관리할 수 있는 기술이다. 회사의 랩소디는 해당 기술 기반으로 개발한 문서들을 추적·관리해 클라우드상에서도 제공되도록 최적화하는 서비스형 소프트웨어(SaaS) 상품이다. 클라우드제트는 기존 시스템이나 고객이 자체 구축한 클라우드 시스템과 연계해 고객이 원하는 시스템 구현을 지원하는 하이브리드 클라우드 서비스다. 랩소디는 문서중앙화를 대체하는 차세대 문서 통제 플랫폼으로 관심 받고 있다. 운영체제(OS)와 애플리케이션에 종속되지 않는 다양한 환경에서 문서 암호화와 사후 추적 기능을 제공한다. 기존 문서중앙화 불편함을 개선해 사용자 환경변화가 최소화되면서도 모든 문서를 중앙으로 이관, 보안과 자산화를 동시에 이룰 수 있는 것이 장점이다. 이번에 제공하는 랩소디 클라우드제트 서비스에는 단순 보안 목적이 아닌 다양한 형태의 협업 솔루션 역할도 수행 가능하다. 김규봉 상무는 “클라우드 제트를 통해 랩소디를 쓰면 60% 이상 비용을 절감할 수 있다”며 “중소기업들은 문서 자산화, 보안, 통제, 추적, 협업 등을 한 번에 해결할 수 있을 것”이라고 기대했다. 한편 파수닷컴은 이달 둘째주부터 랩소디 클라우드 서비스 오픈 기념으로 서비스 신청 대상자는 한달간 무료 체험 기회를 주는 프로모션을 진행한다."
서울경제,150900,/news/news_read.nhn?article_id=0003211879&office_id=011&mode=search&query=파수닷컴&page=1,2018-01-31 17:19,"파수닷컴, 美 보안산업 중심 메릴랜드주 법인 개소식","[서울경제] 파수닷컴(150900) 이 미국 사이버 보안의 심장부로 불리는 워싱턴 D.C. 인근으로 사무실을 이전하며 개소식을 진행했다고 31일 밝혔다. 미국 메릴랜드주 베데스다로 이전한 파수닷컴 법인 개소식에는 △유미 호건 메릴랜드주 퍼스트레이디 △마크 리퍼트 전 주한미국대사 △벤 우 메릴랜드 상무차관 △이시아 레겟 몽고메리카운티 대표 △장호현 주미한국대사관 경제공사 등 유명인사들이 대거 참석했다. 메릴랜드주는 미국의 수도 워싱턴 D.C.와 인접해 비즈니스 인프라가 잘 갖춰져 있는 곳이다. 특히, 미국에서 가장 많은 사이버 보안 스타트업을 배출해낸 탓에 넥스트 실리콘밸리(Next Silicon Valley)로도 불려지고 있다. 파수닷컴은 미 연방정부의 사이버 보안 예산 약 140억 달러(약 14조9,828억원) 중 65% 가량이 워싱턴 D.C 인근지역에서 집행된다는 점에서 메릴랜드주 법인 이전을 결정했다. 조규곤 파수닷컴 대표이사는 “법인 이전은 미국 매출확대를 위한 전략적 조치로 파수닷컴의 비전인 글로벌 소프트웨어 기업이 되기 위한 큰 발판이 될 수 있을 것”이라며 “보안 기업에게 최적의 입지로 손꼽히는 메릴랜드주의 지리적 이점을 토대로 파수닷컴의 미국시장 공략 속도를 획기적으로 높여갈 계획”이라고 밝혔다. 지난 12월 파수닷컴은 블록체인 기술을 채택한 엔터프라이즈 다큐먼트 플랫폼 ‘랩소디(Wrapsody)’의 지적자산을 미국 법인에 출자했다. 이로써 파수닷컴은 미국에서 본격 성장궤도에 오른 ▲문서보안 솔루션 EDRM(Enterprise Digital Rights Management)에 이어 ▲랩소디 ▲행동 기반 애널리틱 툴 리스크뷰(RiskView)의 동시 제공으로 새로운 통합 보안솔루션 체제를 구축하게 됐다."
한국경제TV,150900,/news/news_read.nhn?article_id=0000596854&office_id=215&mode=search&query=파수닷컴&page=1,2018-01-31 10:45,"파수닷컴, 전일 대비 약 -7% 하락한 7,070원","[한국경제TV 라이온봇 기자] 파수닷컴은 1월 31일 10시 45분 전일 대비 약 -7% 하락한 7,070원에 거래되고 있다. 파수닷컴은 코스닥 상장 기업으로 소프트웨어 업종에 속해 있다. 시가총액은 620억원으로 코스닥 상장기업 중 906위에 위치 해 있다. [종목 성향 진단] [그림 1] 종목 성향 진단 파수닷컴의 투자 스타일은 성장주에 가깝다. 주가 고평가 우려가 공존하지만 높은 성장성이 기대되는 기업이다. 주가 모멘텀은 굉장히 좋은 편이었다. 최근 3개월 수익률이 무려 44.59%의 상승폭을 기록했다. 최근 1개월 수익률 또한 42.16% 상승하며 굉장히 좋은 모멘텀을 보이고 있다. 파수닷컴종목에 대한 투자자의 관심도는 평범한 수준이었다. [투자 점수 진단] [그림 2] 투자 점수 진단 파수닷컴은 각 재무지표를 전체 상장종목과 비교하여 점수화 했을 때, 대부분 지표에서 시장과 업종 대비 아쉬움을 나타냈다. 영업이익률 점수에서 장점을 드러냈으나, 전체시장을 대비 상대적으로 낮은 수치였다. 또한, 부채비율과 PBR은  아쉬움을 나타냈다. [종합 투자점수] [그림 3] 종합 투자점수 AI 인공지능 분석을 통한 파수닷컴의 종목 종합 스코어는 30점을 기록했다. 이는 동일 업종 평균점수인 57점과 시장 평균점수인 57점를 하회하는 수치였다. (위의 AI인공지능 점수는 재무 데이터를 기반으로 전체 상장 종목과 비교/분석하여 도출한 점수로 높은 점수가 반드시 높은 수익률을 보장하지 않습니다. 위의 자료는 당사의 추천 종목이 아니며, 투자 시 참고용으로 제시해드리는 것입니다.) 라이온봇 기자 -한국경제TV※ 본 기사는 한국경제TV와 '거장들의 투자공식이'자체 개발한 '라이온봇 기자'가 실시간으로 작성한 기사입니다. 라이온봇기자 ⓒ 한국경제TV, 무단 전재 및 재배포 금지 한국경제TV 관련뉴스해당 언론사에서 선정하며 언론사 페이지(아웃링크)로 이동해 볼 수 있습니다.클론 구준엽, 이상민 당황시킨 '이혼' 발언 무엇?'김연아 때문?' 손연재 SNS계정 탈퇴까지…누리꾼 '맹비난'소유진 가족사진 공개, 'D-10' 만삭에도 소녀같은 미소사람이좋다 임미숙 김학래, '100억 빚→100억 매출'박항서 비행기 '비키니 쇼' 논란, 고도의 노이즈마케팅?"
파이낸셜뉴스,150900,/news/news_read.nhn?article_id=0003994429&office_id=014&mode=search&query=파수닷컴&page=1,2018-04-03 09:31,[fnRASSI]파수닷컴(150900) 현재 +9.51%,"현재 파수닷컴(150900)은 전일대비 9.51% 상승하여 5,760원 선에서 거래가 이루어지고 있다. 기관과 개인은 순매도, 외국인은 순매수(한달누적)  3월30일부터 전일까지 외국인이 2거래일 연속 순매수를 보였다. 4주간을 기준으로 보면 외국인이 55,468주를 순매수한 반면, 기관은 초반에 동종목을 순매도한 이후에 근래에는 순매도량을 줄이면서 4,728주를 순매도했고, 개인들도 매도 우위를 지속하면서 50,740주를 순매도한 것으로 집계됐다. 외국인, 기관 모두 보유량 감소 (5일 누적) 최근 5일간 동종목의 외국인 투자자는 1,376주 순매도하였고 마찬가지로 기관은 0주 순매도하였다. 전날 외국인은 470주 순매수했지만 기관은 순매수량이 0으로 보유비율 그대로 유지했다. 다음 표는 동종목의 외국인, 기관의 일별 순매수량을 나타낸 것이다. 'fnRASSI'는 증권전문 기업 씽크풀과 파이낸셜뉴스의 협업으로 로봇기자가 실시간으로 생산하는 기사입니다."
이데일리,150900,/news/news_read.nhn?article_id=0003684678&office_id=018&mode=search&query=파수닷컴&page=1,2016-11-24 16:45,"파수닷컴, 美서 EPUB 컨텐츠 디지털 저작권 관리장치 등 특허권 취득",[이데일리 최정희 기자] 파수닷컴(150900)은 EPUB 기반 컨텐츠에 대한 디지털 저작권 관리장치 및 방법 그리고 사용자 권한에 따른 EPUB 기반 컨텐츠 제공장치 및 방법 등에 관한 특허권을 취득했다고 24일 공시했다. 이 특허를 2013년 국내 특허를 받았고 일본에 이어 이번에 미국에서 취득한 것이다. 현재 유럽에선 심사중에 있다.
한국경제TV,150900,/news/news_read.nhn?article_id=0000597315&office_id=215&mode=search&query=파수닷컴&page=1,2018-02-01 10:49,"파수닷컴, 전일 대비 약 -3% 하락한 6,900원","[한국경제TV 라이온봇 기자] 파수닷컴은 2월 1일 10시 49분 전일 대비 약 -3% 하락한 6,900원에 거래되고 있다. 파수닷컴은 코스닥 상장 기업으로 소프트웨어 업종에 속해 있다. 시가총액은 582억원으로 코스닥 상장기업 중 950위에 위치 해 있다. [종목 성향 진단] [그림 1] 종목 성향 진단 파수닷컴의 투자 스타일은 성장주에 가깝다. 주가 고평가 우려가 공존하지만 높은 성장성이 기대되는 기업이다. 주가 모멘텀은 굉장히 좋은 편이었다. 최근 6개월 수익률이 무려 34.91%의 상승폭을 기록했다. 최근 1개월 수익률 또한 33.4% 상승하며 굉장히 좋은 모멘텀을 보이고 있다. 파수닷컴종목에 대한 투자자의 관심도는 높은 편에 속한다. [투자 점수 진단] [그림 2] 투자 점수 진단 파수닷컴은 각 재무지표를 전체 상장종목과 비교하여 점수화 했을 때, 대부분 지표에서 시장과 업종 대비 아쉬움을 나타냈다. 영업이익률 점수에서 장점을 드러냈으나, 전체시장을 대비 상대적으로 낮은 수치였다. 또한, 부채비율과 PBR은  아쉬움을 나타냈다. [종합 투자점수] [그림 3] 종합 투자점수 AI 인공지능 분석을 통한 파수닷컴의 종목 종합 스코어는 30점을 기록했다. 이는 동일 업종 평균점수인 57점과 시장 평균점수인 57점를 하회하는 수치였다. (위의 AI인공지능 점수는 재무 데이터를 기반으로 전체 상장 종목과 비교/분석하여 도출한 점수로 높은 점수가 반드시 높은 수익률을 보장하지 않습니다. 위의 자료는 당사의 추천 종목이 아니며, 투자 시 참고용으로 제시해드리는 것입니다.) 라이온봇 기자 -한국경제TV※ 본 기사는 한국경제TV와 '거장들의 투자공식이'자체 개발한 '라이온봇 기자'가 실시간으로 작성한 기사입니다. 라이온봇기자 ⓒ 한국경제TV, 무단 전재 및 재배포 금지 한국경제TV 관련뉴스해당 언론사에서 선정하며 언론사 페이지(아웃링크)로 이동해 볼 수 있습니다.'오달수의 그녀' 채국희, 승무원 출신? 채시라 동생?김민정 ""대시한 男연예인 5명…같은 직업군 괜찮아""소유진 가족사진 공개, 'D-10' 만삭에도 소녀같은 미소'김연아 때문?' 손연재 SNS계정 탈퇴까지…누리꾼 '맹비난'알베르토 몬디, 1형 당뇨 투병 고백…""발병 원인 알 수 없다"""
서울경제,150900,/news/news_read.nhn?article_id=0002877838&office_id=011&mode=search&query=파수닷컴&page=1,2016-08-25 14:31,"파수닷컴, 워터마크 관련 美 특허 취득","보안 솔루션 업체인 파수닷컴(150900)이 미국에서 워터마크와 관련된 특허를 취득했다고 25일 공시했다. 해당 기술은 중요한 문서·시스템을 사용할 때 화면에 회사 로고·사용자 정보·경고 문구 등을 워터마크로 표시하고 화면 캡처를 막는 기술이다. 파수닷컴은 앞서 2011년 해당 기술로 국내 특허를 취득했으며, 미국에 이어 유럽 특허 출원 중이다."
파이낸셜뉴스,150900,/news/news_read.nhn?article_id=0003947757&office_id=014&mode=search&query=파수닷컴&page=1,2018-01-19 15:34,"[fnRASSI]파수닷컴,케이사인 등 40종목 52주 신고가 경신","19일 파수닷컴(150900), 케이사인(192250), 텍셀네트컴(038540), 평화홀딩스(010770), 대화제약(067080), 다원시스(068240)등이 장중 52주 신고가를 경신했다. 특히 파수닷컴은 전 거래일 대비 29.9% 오른 9,200원에 거래를 마감하며 높은 관심을 받았다. 'fnRASSI'는 증권전문 기업 씽크풀과 파이낸셜뉴스의 협업으로 로봇기자가 실시간으로 생산하는 기사입니다."
머니투데이,150900,/news/news_read.nhn?article_id=0003732058&office_id=008&mode=search&query=파수닷컴&page=1,2016-08-25 14:28,"파수닷컴, 워터마크 화면 표시 관련 美특허 취득","[머니투데이 백지수 기자] 파수닷컴은 워터마크를 화면상에 표시하는 장치와 방법에 관한 미국 특허를 취득했다고 25일 공시했다. 이는 중요 문서나 중요 시스템을 사용할 때 모니터화면에 회사 로고나 사용자 정보, 경고 문구를 워터마크 형태로 표시해 보안 중임을 인지시키고 화면 캡처를 방지하는 기능을 수행하는 기능을 가지며 2011년 국내 특허를 취득한 기술이라고 회사측은 밝혔다. textlinktopstart textlinktopend textlinkstart"
파이낸셜뉴스,150900,/news/news_read.nhn?article_id=0004068159&office_id=014&mode=search&query=파수닷컴&page=1,2018-08-01 11:21,"[fnRASSI]파수닷컴, 0.68% 오르며 거래량 증가","파수닷컴(150900)의 현재 거래량이 최근 5거래일 거래량의 최고치를 넘어섰다. 그리고 파수닷컴은 6일 연속 상승흐름을 보이며, 11시 19분 현재 0.68% 증가한 4,450원에 거래중이다. 주요 투자주체는 개인투자자 최근 한달간 주체별 거래비중을 살펴보면 개인이 90.67%로 가장 높은 참여율을 보였고, 외국인이 6.77%를 보였으며 기관은 2.54%를 나타냈다. 그리고 최근 5일간 거래비중은 개인이 89.42%, 외국인이 7.82%, 기관은 2.75%를 기록했다. 기관/개인 순매수, 외국인은 순매도(한달누적)  7월13일부터 외국인들이 13거래일 연속 순매도 행진을 벌이고 있다. 4주간을 기준으로 보면 기관이 방향성있는 매매를 하면서 11,025주를 순매수했고, 개인들도 매수반전의 모습을 보이며 6,672주를 순매수했다. 반면 그 동안 외국인은 매도 우위를 지속하면서 17,697주를 순매도했다. 'fnRASSI'는 증권전문 기업 씽크풀과 파이낸셜뉴스의 협업으로 로봇기자가 실시간으로 생산하는 기사입니다."
헤럴드경제,150900,/news/news_read.nhn?article_id=0001342901&office_id=016&mode=search&query=파수닷컴&page=1,2018-01-19 09:15,"파수닷컴, 블록체인 기반 문서 플랫폼 부각 &lsquo;상한가&rsquo;&hellip;사흘째 급등","[헤럴드경제=최준선 기자] 파수닷컴이 블록체인 기반 문서 플랫폼으로 글로벌 시장 진출을 본격화한다는 소식에 사흘째 급등세다. 19일 오전 9시 11분 현재 파수닷컴은 코스닥 시장에서 전날보다 29.94% 오른 9200원에 거래되고 있다. 지난 17일과 18일 각각 13.94%, 21.23% 급등한데 이어 이날도 상한가를 기록한 것이다. [사진=게티이미지] 이는 전날 파수닷컴이 올해 블록체인 기반 문서 플랫폼으로 글로벌 시장 진출을 본격화한다고 밝힌 영향으로 풀이된다. 회사 측 설명에 따르면 파수닷컴은 올해 상반기 플록체인 기반기술이 접목된 문서 플랫폼 ‘랩소디’를 출시할 계획이다. 파수닷컴 관계자는 “랩소디는 문서가 생성되는 모든 과정에서 모든 버전의 문서를 자동으로 수집ㆍ관리해 보관시점과 원본을 증명하고, 전자문서의 무결성과 보안성을 확보해 준다”며 “블록체인 기반기술이 접목되면 문서의 검증, 기록, 보관 등 데이터 신뢰성이 향상될 것”이라고 설명했다."
연합뉴스,150900,/news/news_read.nhn?article_id=0008949522&office_id=001&mode=search&query=파수닷컴&page=1,2017-01-10 17:46,"파수닷컴, '특허펀드'로부터 40억원 투자 유치","(서울=연합뉴스) 조민정 기자 = 파수닷컴은 'KB지식재산투자조합'(특허펀드)로부터 40억원의 투자를 받기로 합의하고 정식 계약을 체결했다고 10일 공시했다. 이 펀드는 정부자금과 KB인베스트먼트자금 등 500억원을 기반으로 장래 성장이 유망한 중소기업에 투자한다. 회사 측은 ""이번 자금 유치는 기술력과 지적자산에 대한 가치를 외부 투자자로부터 객관적으로 평가받고 인정받았다는 의미가 크다""며 ""국내외 특허 로열티 확보와 수익성 개선에도 노력하겠다""고 밝혔다."
