source,symbol,link,date,title,content
이데일리,183190,/news/news_read.nhn?article_id=0003961874&office_id=018&mode=search&query=아세아시멘트&page=1,2017-11-03 15:43,"[마켓인]한라시멘트, 아주산업&middot;아세아시멘트 등 참여(속보)",[이데일리 신상건 기자] 3일 투자은행(IB) 업계에 따르면 이날 실시된 한라시멘트 매각 본입찰에 아주산업과 아세아시멘트가 참여했다. 성신양회와 LK투자파트너스는 참여하지 않은 것으로 전해진다.
이데일리,183190,/news/news_read.nhn?article_id=0004108726&office_id=018&mode=search&query=아세아시멘트&page=1,2018-05-23 15:43,"한라시멘트, 아세아시멘트와 한국해비타트 공동후원","시멘트 1106t, 물류비 포함 약 1억원 상당 무상 지원 약속 왼쪽부터 양승조 아세아시멘트 전무, 손미향 한국해비타트 사무총장, 임경태 한라시멘트 대표가 23일 서울 역삼동 아세아타워에서 ‘2018년 한국해비타트 희망의 집짓기’ 공동후원 협약식을 가졌다. (사진=한라시멘트) [이데일리 박경훈 기자] 아세아시멘트(183190)와 한라(014790)시멘트가 함께 2018년 한국해비타트 ‘희망의 집짓기’ 사업에 사용될 시멘트 전량을 지원하기로 약속하고 23일 서울 강남구 역삼동 아세아타워에서 공동후원 협약식을 가졌다고 밝혔다. 한국해비타트 희망의 집짓기 사업에 대한 시멘트 전량 후원은 한라시멘트가 지난 2001년부터 이어 온 대표적인 사회공헌활동 중 하나이다. 특히 올해에는 지난 1월 한라시멘트가 아세아시멘트의 계열사로 편입된 만큼 이병무 아세아시멘트 회장의 의견에 따라 양사가 함께 후원에 동참하게 됐다. 협약식에는 2018년 ‘희망의 집짓기’ 사업에 사용될 1106.9t, 물류비 포함 약 1억원 상당의 시멘트 전량을 지원하기로 약속했다. 이에 따라 아세아시멘트와 한라시멘트는 각각 한국해비타트 천안현장에 196.3톤 및 삼척·시흥현장에 910.6t의 시멘트를 지원하게 된다. 더불어 오는 8월에는 양사의 임직원 및 가족들이 삼척현장 집짓기 자원봉사에도 참가해 함께 희망을 나눌 예정이다. 임경태 한라시멘트 대표는 “이번 시멘트 지원이 경제적으로 소외된 이웃들의 자립을 돕는데 작은 보탬이 되길 바란다”며 “특히 올해는 아세아시멘트와 한라시멘트가 공동후원을 진행함으로써 해비타트 협약의 의미를 높이게 되어 더욱 기쁘게 생각한다”고 말했다."
파이낸셜뉴스,183190,/news/news_read.nhn?article_id=0004004302&office_id=014&mode=search&query=아세아시멘트&page=1,2018-04-18 09:28,"[fnRASSI]아세아시멘트, 6.6% 오르며 거래량 증가","아세아시멘트는 투자자들의 관심으로 현재 거래량이 최근 5거래일 거래량의 최고치를 넘어섰다. 그리고 아세아시멘트는 3일 연속 상승흐름을 보이며, 9시 23분 현재 6.6% 증가한 105,000원에 거래중이다. 거래비중 기관 38.6%, 외국인 21.28% 최근 한달간 주체별 거래비중을 살펴보면 개인이 40.11%로 가장 높은 참여율을 보였고, 기관이 38.6%를 보였으며 외국인은 21.28%를 나타냈다. 그리고 최근 5일간 거래비중은 기관이 전체 거래의 46.82%를 차지하며 가장 적극적인 모습을 보여줬고, 개인은 35.94%를 나타냈으며 외국인은 17.22%를 나타냈다. 외국인 보유량 감소, 기관 증가 (5일 누적) 최근 5일간 동종목의 외국인 투자자는 3,256주 순매도하였고 반면 기관은 5,663주 순매수하였다. 전날 두 주체 각각 699주, 5,663주 순매수하며 보유 비율을 늘렸다. 다음 표는 동종목의 외국인, 기관의 일별 순매수량을 나타낸 것이다. 'fnRASSI'는 증권전문 기업 씽크풀과 파이낸셜뉴스의 협업으로 로봇기자가 실시간으로 생산하는 기사입니다."
머니투데이,183190,/news/news_read.nhn?article_id=0004001498&office_id=008&mode=search&query=아세아시멘트&page=1,2018-01-31 17:42,"아세아시멘트, 지난해 영업익 533억원...전년비 6.50% 감소",[머니투데이 오정은 기자] 아세아시멘트는 31일 지난해 연결 기준 영업이익이 533억원으로 전년비 6.50% 감소했다고 공시했다. 같은 기간 매출액은 4612억원으로 전년비 1.19% 늘었고 당기순이익은 투자자산 처분 덕분에 677억원으로 전년비 59.03% 증가했다.
뉴시스,183190,/news/news_read.nhn?article_id=0008279903&office_id=003&mode=search&query=아세아시멘트&page=1,2017-11-10 13:31,아세아시멘트 &quot;한라시멘트 매각서 독점적 우선협상대상자 선정&quot;,"【서울=뉴시스】김형섭 기자 = 아세아시멘트(183190)는 ""한라시멘트 공개매각과 관련해 본입찰에 참여한 결과 독점·배타적 우선협상대상자로 선정됐음을 통보받았다""고 10일 공시했다."
이데일리,183190,/news/news_read.nhn?article_id=0003921405&office_id=018&mode=search&query=아세아시멘트&page=1,2017-09-12 17:27,아세아시멘트 &quot;한라시멘트 예비입찰 LOI 제출&quot;,[이데일리 김정유 기자] 아세아시멘트(183190)는 한라시멘트 예비입찰 인수의향서(LOI)를 제출했다고 12일 공시했다. 회사 측은 “당사는 매간주간사인 씨티그룹글로벌마켓증권주식회사에 한라시멘트 주식매각 예비입찰에 참여할 의향이 있다는 인수의향서를 제출했다”며 “관련 내용은 추후 진행과정에 따라 공시할 예정”이라고 밝혔다.
파이낸셜뉴스,183190,/news/news_read.nhn?article_id=0004076983&office_id=014&mode=search&query=아세아시멘트&page=1,2018-08-17 14:29,"한라시멘트-아세아시멘트, 한국해비타트 집짓기 자원 봉사","한라시멘트와 아세아시멘트 직원들이 삼척에서 진행된 한국해비타트 자원 봉사에 참여, 희망의 집을 짓고 있다.    기업의 사회적 책임을 다하고자 다양한 사회공헌활동을 펼쳐 온 아세아그룹의 임직원들이 14일과 17일, 한국해비타트 ‘희망의 집짓기’ 사업 자원봉사에 나서 구슬땀을 흘렸다. 한국해비타트 삼척현장에서 있었던 ‘희망의 집짓기’에는 아세아그룹 임직원 50여 명이 자발적으로 참여했다. 이번 봉사는 지난 5월 한라시멘트와 아세아시멘트가 한국해비타트 측에 시멘트 전량 지원을 약속하며 체결한 후원 협약의 일환이다. 삼척시 갈천동 해비타트 마을 내 4세대가 거주하게 될 주택을 신규로 짓는 것이 과업이었다. 이들 50여 명은 지붕과 벽체를 마감하는 작업에 투입되어 힘을 보탰으며, 무더운 날씨 속에서도 모두 행복하고 밝은 표정으로 각자 맡은 작업에 열중했다. 자원봉사에 참여한 임직원 중 한 명은 “우리의 땀방울이 이웃에게 희망을 줄 수 있어 보람되고 뿌듯하다”며 참여 소감을 밝히기도 했다. 한편, 한국해비타트의 ‘희망의 집짓기’는 후원자, 자원봉사자, 홈오너 가정이 함께하는 비영리 건축사업으로서 주거환경이 취약한 가정에게 보금자리를 마련해 줌으로써 자립의 희망으로 새로운 삶을 시작할 수 있도록 지원하는 파트너십 운동이다. 한라시멘트는 지난 2001년부터 매년 한국해비타트 ‘희망의 집짓기’에 사용될 시멘트 전량을 무상으로 지원해 왔으며, 올해에는 한라시멘트가 아세아그룹의 계열사로 편입되면서 한라시멘트와 아세아시멘트가 공동으로 시멘트 1106.9t(물류비 포함 약 1억 원 상당)을 후원했다."
한국경제TV,183190,/news/news_read.nhn?article_id=0000623730&office_id=215&mode=search&query=아세아시멘트&page=1,2018-04-18 12:12,"아세아시멘트, 11% 급등... 전일 보다 10,500원 상승한 109,000원","[한국경제TV 라이온봇 기자] 아세아시멘트는 4월 18일 12시 12분 전일 대비 약 11% 급등한 109,000원에 거래되고 있다. 아세아시멘트는 코스피 상장 기업으로 비금속광물 업종에 속해 있다. 시가총액은 3,837억원으로 코스피 상장기업 중 315위에 위치 해 있다. [종목 성향 진단] [그림 1] 종목 성향 진단 아세아시멘트의 투자 스타일은 가치주에 가깝다. 기업 가치 대비 낮은 주가가 매력적인 기업이다. 주가 모멘텀은 부진한 편이었다. 최근 3개월 수익률은 -18.93%의 하락폭을 기록했다. 최근 1개월 수익률 또한 -1.99% 하락하며 부진한 모멘텀을 이어가고 있다. 아세아시멘트 종목에 대한 투자자의 관심도는 평범한 수준이었다. [투자 점수 진단] [그림 2] 투자 점수 진단 아세아시멘트는 저평가성1(PER) 측면에서 두각을 나타내고 있다. 최근 PER은 94점으로 6개의 핵심 팩터 중 가장 높은 점수를 기록했다. PER은  전체 시장 내 116위를 기록하며 상위 6.22%에 위치했다. 업종별로는 27위를 기록하며 상위 8.25%에 위치했다. 그리고 저평가성2(PBR) 역시 도드라지는 편이다. 저평가성2 점수는 87점으로 두번째로 높은 점수를 기록했다. PBR은 전체 시장 내 252위를 기록하며 상위 13.47%에 위치했다. 업종별로는 58위를 기록하며 상위 17.92%에 위치했다. 그러나 매출증가율(YoY)이 아쉬움을 나타냈다. [종합 투자점수] [그림 3] 종합 투자점수 AI 인공지능 분석을 통한 아세아시멘트의 종목 종합 스코어는 89점을 기록했다. 이는 동일 업종 평균점수인 56점과 시장 평균점수인 56점를 상회하는 수치였다. (위의 AI인공지능 점수는 재무 데이터를 기반으로 전체 상장 종목과 비교/분석하여 도출한 점수로 높은 점수가 반드시 높은 수익률을 보장하지 않습니다. 위의 자료는 당사의 추천 종목이 아니며, 투자 시 참고용으로 제시해드리는 것입니다.) 라이온봇 기자 -한국경제TV※ 본 기사는 한국경제TV와 '거장들의 투자공식이'자체 개발한 '라이온봇 기자'가 실시간으로 작성한 기사입니다. 라이온봇기자 ⓒ 한국경제TV, 무단 전재 및 재배포 금지 한국경제TV 관련뉴스해당 언론사에서 선정하며 언론사 페이지(아웃링크)로 이동해 볼 수 있습니다.'억대 수입' 이사배, 과거 공개한 '럭셔리' 하우스 봤더니유병자 실손보험, 삼성화재 '가장 비싸'쏘가리 가격 '확' 떨어진다…22년 연구 끝에 '대량양식' 성공마포 요양원 인질극, 왜 그랬냐 묻자 ""국민을 위해서…""고 장자연-단역 자매 사건 재수사…""내가 노리개인가"""
연합뉴스,183190,/news/news_read.nhn?article_id=0009744142&office_id=001&mode=search&query=아세아시멘트&page=1,2017-12-12 09:29,"[특징주] 아세아시멘트, 한라시멘트 인수에 신고가",(서울=연합뉴스) 박상돈 기자 = 아세아시멘트가 한라시멘트 인수를 공식화함에 따라 12일 장 초반 신고가를 새로 썼다. 이날 오전 9시 29분 현재 유가증권시장에서 아세아시멘트는 전날보다 4.40% 오른 13만500원에 거래 중이다. 장중에는 13만8천원까지 올라 신고가를 갈아치웠다. 아세아시멘트는 전날 장 마감 후 시멘트 산업의 경쟁력 강화를 위해 한라시멘트 지분 100%를 3천651억여원에 양수하기로 했다고 공시했다.
파이낸셜뉴스,183190,/news/news_read.nhn?article_id=0003904654&office_id=014&mode=search&query=아세아시멘트&page=1,2017-11-13 09:43,"[fnRASSI]아세아시멘트(183190), 52주 신고가 경신...3.81% &uarr;","아세아시멘트(183190)는 52주신고가를 기록하고 있어 주목할만하다. 동종목의 현재 주가는 122,500원 선에서 이루어지고 있다. 거래일을 기준으로 최근 3일간 평균 거래량은 21만 주이다. 이는 60일 일 평균 거래량 1만 주와 비교해보면 최근 거래량이 급격히 늘어났다는 것을 알 수 있다. 퀀트 재무분석, 종합점수 87점으로 상승                    지표               항목               값               종합점수                 성장성               매출액증가율               0.04               7.24                 자기자본증가율               0.06                 안정성               부채비율               28.87               9.44                 유동비율               341.8                 이익안정성               8.89                 수익성               ROA               4.89               7.44                 ROE               6.3                 영업이익율               12.86          아세아시멘트의 퀀트 재무 점수는 24.12점으로 3개월 이전 24점보다 올랐다. 지난 분기에 비해 성장성 점수가 상승했다. 이는 매출액 증가율과 자기자본 증가율이 증가하였기 때문이다. 수익성 측면에서 볼때 ROA, ROE, 영업이익률 모두 하락하여 이전보다 낮은 점수를 받았다. 기관투자자의 거래참여 높아, 거래비중 21.9% 최근 한달간 주체별 거래비중을 살펴보면 개인이 70.97%로 가장 높은 참여율을 보였고, 기관이 21.9%를 보였으며 외국인은 7.12%를 나타냈다. 그리고 최근 5일간 거래비중은 개인이 전체 거래량의 75.91%를 차지하며 가장 활발한 참여를 보였고, 기관은 20.35%, 외국인은 3.73%의 거래 참여율을 보였다. 'fnRASSI'는 증권전문 기업 씽크풀과 파이낸셜뉴스의 협업으로 로봇기자가 실시간으로 생산하는 기사입니다."
한국경제,183190,/news/news_read.nhn?article_id=0003864046&office_id=015&mode=search&query=아세아시멘트&page=1,2017-12-12 09:39,"[특징주]아세아시멘트, 한라시멘트 인수 확정 '신고가'",아세아시멘트가 한라시멘트 인수를 확정했다는 소식에 신고가를 기록했다. 12일 오전 9시20분 아세아시멘트는 전날보다 9000원(7.20%) 오른 13만4000원에 거래 중이다. 장 초반 13만8000원까지 오르면서 신고가를 경신했다. 전날 장 마감 후 아세아시멘트는 한라시멘트 주식 2499만9992주(100%)를 3651억1300만원에 양수하기로 결정했다고 공시했다.
전자신문,183190,/news/news_read.nhn?article_id=0002638571&office_id=030&mode=search&query=아세아시멘트&page=1,2017-09-05 08:37,"[ET투자뉴스]아세아시멘트, &quot;2차 시장재편의 주&hellip;&quot; 매수(신규)-한국투자증권","한국투자증권에서 5일 아세아시멘트(183190)에 대해 ""2차 시장재편의 주도자가 될 것인가""라며 투자의견을 '매수(신규)'로 제시하였고, 아울러 목표주가로는 120,000원을 내놓았다. 한국투자증권 이경자, 허나래 애널리스트가 동종목에 대하여 이번에 제시한 '매수(신규)'의견은 한국투자증권에서는 올해들어 처음 내놓는 매매의견이며 그리고 최근 분기내 발표된 전체 증권사 리포트의 컨센서스와 비교를 해볼 경우에 오늘 발표된 투자의견은 대체적으로 평균치에 해당하는 수준으로, 이번 의견은 동종목에 대한 전체적인 흐름에서 크게 벗어나지 않은 것으로 분석되고 있다. 또한 전일 종가 기준으로 볼때 동종목의 현주가는 이번에 제시된 목표가 대비 42.3%의 추가상승여력이 있다는 해석이 제시되고 있다."
한국경제TV,183190,/news/news_read.nhn?article_id=0000630406&office_id=215&mode=search&query=아세아시멘트&page=1,2018-05-04 14:08,"아세아시멘트, 52주 신고가 경신... 전일 대비 14% 상승","[한국경제TV 라이온봇 기자] 아세아시멘트는 52주 신고가를 경신했다. 아세아시멘트는 5월 4일 14시 7분 전일 대비 약 14% 상승한 163,000원에 거래되고 있다. 아세아시멘트는 코스피 상장 기업으로 비금속광물 업종에 속해 있다. 시가총액은 5,551억원으로 코스피 상장기업 중 252위에 위치 해 있다. [종목 성향 진단] [그림 1] 종목 성향 진단 아세아시멘트의 투자 스타일은 가치주에 가깝다. 기업 가치 대비 낮은 주가가 매력적인 기업이다. 주가 모멘텀은 굉장히 좋은 편이었다. 최근 6개월 수익률이 무려 67.18%의 상승폭을 기록했다. 최근 1개월 수익률 또한 43.65% 상승하며 굉장히 좋은 모멘텀을 보이고 있다. 아세아시멘트 종목에 대한 투자자의 관심도는 높은 편에 속한다. [투자 점수 진단] [그림 2] 투자 점수 진단 아세아시멘트는 저평가성1(PER) 측면에서 두각을 나타내고 있다. 최근 PER은 91점으로 6개의 핵심 팩터 중 가장 높은 점수를 기록했다. PER은  전체 시장 내 161위를 기록하며 상위 8.67%에 위치했다. 업종별로는 32위를 기록하며 상위 9.42%에 위치했다. 그리고 효율성(ROA) 역시 도드라지는 편이다. 효율성 점수는 87점으로 두번째로 높은 점수를 기록했다. ROA는 전체 시장 내 259위를 기록하며 상위 13.24%에 위치했다. 업종별로는 36위를 기록하며 상위 10.39%에 위치했다. 그러나 매출증가율(YoY)이 아쉬움을 나타냈다. [종합 투자점수] [그림 3] 종합 투자점수 AI 인공지능 분석을 통한 아세아시멘트의 종목 종합 스코어는 79점을 기록했다. 이는 동일 업종 평균점수인 58점과 시장 평균점수인 58점를 상회하는 수치였다. (위의 AI인공지능 점수는 재무 데이터를 기반으로 전체 상장 종목과 비교/분석하여 도출한 점수로 높은 점수가 반드시 높은 수익률을 보장하지 않습니다. 위의 자료는 당사의 추천 종목이 아니며, 투자 시 참고용으로 제시해드리는 것입니다.) 라이온봇 기자 -한국경제TV※ 본 기사는 한국경제TV와 '거장들의 투자공식이'자체 개발한 '라이온봇 기자'가 실시간으로 작성한 기사입니다. 라이온봇기자 ⓒ 한국경제TV, 무단 전재 및 재배포 금지 한국경제TV 관련뉴스해당 언론사에서 선정하며 언론사 페이지(아웃링크)로 이동해 볼 수 있습니다.충남 청양에서 잡힌 '대형 메기', 크기가 무려…홍윤화 다이어트 식단 공개, 건강하게 살 빼는 비결 무엇?이명희 '임산부' 갑질…""조선시대 노비 다루듯""美 '최악의 연쇄살인' 풀렸다…소름돋는 범인 정체왕빛나 서구적 몸매 비결…'20kg을 한 번에?'"
아시아경제,183190,/news/news_read.nhn?article_id=0004116125&office_id=277&mode=search&query=아세아시멘트&page=1,2017-11-10 18:10,"아세아시멘트, '한라시멘트' 품에 안고&hellip;1위 경쟁","[아시아경제 김대섭 기자] 아세아시멘트가 시멘트 업계 마지막 대형 매물로 평가받은 한라시멘트를 사실상 품에 안았다. 업계 강자인 쌍용양회, 한일시멘트와 함께 선두권 자리를 놓고 치열하게 경쟁하게 됐다. 아세아시멘트는 10일 한라시멘트 매각 관련 독점적 배타적 우선협상대상자로 선정됐다고 밝혔다. 아세아시멘트는 지난 3일 씨티글로벌마켓증권이 주관한 한라시멘트 매각 본입찰에 참여한 바 있다. 매각주간사는 이달 안에 주식매매계약을 체결할 것으로 전해졌다. 우선협상대상자로 선정되면서 한라시멘트를 인수할 경우 시장점유율에서 업계 하위권이었던 아세아시멘트는 선두권으로 올라가게 된다. 국내 시멘트 시장은 쌍용양회가 19% 이상의 시장 점유율을 보유해 1위 업체로 자리를 잡아왔다. 그러나 올해 한일시멘트가 현대시멘트 인수 후 쌍용양회의 자리를 위협하고 있다. 향후 시장점유율은 물론 매출 규모 면에서도 아세아시멘트까지 3개 회사가 1위 자리를 놓고 치열하게 경쟁하게 됐다. 한국시멘트협회에 따르면 지난해 기준 국내 시멘트 시장 점유율은 쌍용양회(19.2%), 삼표시멘트(14.2%), 성신양회(14.0%), 한일시멘트(12.8%), 한라시멘트(11.9%), 현대시멘트(9.5%), 아세아시멘트(7.2%) 수준이었다. 생산공장이 내륙에 있는 아세아시멘트가 해안에 공장이 있는 한라시멘트를 인수하면 유통망 확장 등 시너지 효과가 예상된다. 투자은행(IB)업계 등에 따르면 한라시멘트는 사모투자펀드인 베어링 프라이빗에쿼티아시아(PEA)가 지분 100%를 보유하고 있다. 아세아시멘트는 이번 인수전에서 차입금 4000억원을 제외한 인수가격으로 3800억원을 제시한 것으로 알려졌다. 시멘트 업계 관계자는 ""시멘트 업계 1위 자존심을 놓고 앞으로 쌍용양회, 한일시멘트, 아세아시멘트 간 치열한 경쟁이 전망된다""고 말했다."
서울경제,183190,/news/news_read.nhn?article_id=0003172301&office_id=011&mode=search&query=아세아시멘트&page=1,2017-12-12 09:09,"아세아시멘트, 한라시멘트 인수 결정 소식에 신고가","[서울경제] 아세아시멘트(183190) 가 한라시멘트 인수를 결정했다고 공식 발표를 하면서 12일 신고가를 다시 썼다. 아세아시멘트 주가는 이날 오전 9시 7분 전날보다 4,500원(3.6%) 오른 12만9,500원을 기록하고 있다. 장중에는 13만8,000원까지 올라 52주 최고가를 갈아치웠다. 아세아시멘트는 시멘트산업 경쟁력 강화를 위해 한라시멘트 지분 100%를 3,651억여원에 양수하기로 했다고 전날 공시했다."
머니투데이,183190,/news/news_read.nhn?article_id=0004092883&office_id=008&mode=search&query=아세아시멘트&page=1,2018-08-17 15:40,"한라&middot;아세아시멘트, 해비타트와 '희망의 집짓기' 활동","[머니투데이 지영호 기자] [임직원 50여명 자원봉사…삼척 4가구 작업] 한라시멘트와 아세아시멘트 등 아세아그룹 임직원 50여명이 14일과 17일 이틀간 한국해비타트 삼척현장에서 '희망의 집짓기' 자원봉사로 참여해 구슬땀을 흘렸다. 이번 봉사는 지난 5월 한라시멘트와 아세아시멘트가 한국해비타트 측에 시멘트 전량 지원을 약속한 후원협약의 일환이다. 집짓기 봉사는 삼척시 갈천동 해비타트마을 4가구를 대상으로 실시됐다. 임직원들은 지붕과 벽체를 마감하는 작업에 투입돼 공사에 힘을 보탰다. 한국해비타트 희망의 집짓기는 후원자, 자원봉사자, 홈오너 가정이 함께하는 비영리 건축사업이다. 주거환경이 취약한 가정에 보금자리를 마련해 자립을 지원하는 파트너십 운동이다. 한라시멘트는 지난 2001년부터 매년 여기에 사용될 시멘트 전량을 무상으로 지원해 왔으며 올해 한라시멘트가 아세아그룹의 계열사로 편입되면서 아세아시멘트와 공동으로 1억원 상당의 시멘트와 물류비 등을 후원하기로 약속한 바 있다."
전자신문,183190,/news/news_read.nhn?article_id=0002656717&office_id=030&mode=search&query=아세아시멘트&page=1,2017-11-13 08:36,"[ET투자뉴스]아세아시멘트, &quot;한라시멘트 실적 합&hellip;&quot; 매수(유지-신영증권","신영증권에서 13일 아세아시멘트(183190)에 대해 ""한라시멘트 실적 합산, 목표주가 상향 제시""라며 투자의견을 '매수(유지'로 제시하였다. 아울러 12개월 목표주가를 150,000원으로 내놓았다. 신영증권 박세라 애널리스트가 동종목에 대하여 이번에 제시한 '매수(유지'의견은 신영증권의 직전 매매의견을 그대로 유지하는 것이고 그리고 최근 분기내 발표된 전체 증권사 리포트의 컨센서스와 비교를 해볼 경우에 오늘 발표된 투자의견은 대체적으로 평균치에 해당하는 수준으로, 이번 의견은 동종목에 대한 전체적인 흐름에서 크게 벗어나지 않은 것으로 분석되고 있다. 한편 12개월 목표주가로 제시한 150,000원은 직전에 발표된 목표가 100,000원 대비 50% 상향조정 된 것이고, 목표주가의 추이를 살펴보면 직전에 한차례 하향조정된 후에 이번에 다시 목표가가 전고점보다 더 높게 상향조정되는 모습이다. 또한 전일 종가 기준으로 볼때 동종목의 현주가는 이번에 제시된 목표가 대비 27.1%의 추가상승여력이 있다는 해석이 제시되고 있다."
아시아경제,183190,/news/news_read.nhn?article_id=0003617633&office_id=277&mode=search&query=아세아시멘트&page=1,2015-11-03 17:06,"국민연금, 아세아시멘트 지분 10.03% 보유",[아시아경제 조인경 기자] 국민연금공단은 3일 아세아시멘트 지분 10.03%(33만523주)를 보유하고 있다고 공시했다.
