source,symbol,link,date,title,content
한국경제TV,183190,/news/news_read.nhn?article_id=0000654568&office_id=215&mode=search&query=아세아시멘트&page=1,2018-06-29 10:08,"아세아시멘트, 전일 대비 약 7% 상승한 143,500원","[한국경제TV 라이온봇 기자] [그림 1] 최근 3개월 간 주가 추세 및 기간별 수익률 아세아시멘트는 6월 29일 10시 7분 전일 대비 약 7% 상승한 143,500원에 거래되고 있다. 아세아시멘트는 코스피 상장 기업으로 비금속광물 업종에 속해 있다. 시가총액은 5,278억원으로 코스피 상장기업 중 251위에 위치 해 있다. [종목 성향 진단] [그림 2] 종목 성향 진단 아세아시멘트의 투자 스타일은 모호한 측면이 있으나 성장주라고 볼 수 있다. 주가 고평가 우려가 공존하지만 높은 성장성이 기대되는 기업이다. 주가 모멘텀은 좋지 못했다. 최근 1개월 수익률은 -24.8%의 하락폭을 기록했다. 아세아시멘트 종목에 대한 투자자의 관심도는 높은 편에 속한다. [투자 점수 진단] [그림 3] 투자 점수 진단 아세아시멘트는 어느 측면에서 투자 매력도가 높은 종목일까? AI 인공지능 종목 분석 시스템을 이용해 성장성, 수익성, 효율성, 안전성, 저평가성, 추세 등 주가 수익률에 영향을 줄 수 있는 6가지 핵심 투자 지표를 점수화하여 종목의 투자 매력도를 계산해보았다. 그 결과 아세아시멘트는 상대적으로 추세지표 측면에서 두각을 드러내고 있었다. 추세 점수는 주가의 상승 모멘텀이 어느정도 인가를 나타낸다. 아세아시멘트는 특히 중기추세 측면에서 가장 높은 점수는 기록했는데, 전체 시장 내 87위를 기록하며 상위 4.33%에 위치했다. 업종별로는 21위를 기록하며 상위 5.83%에 위치했다. 그러나 기업의 이익 실현 정도를 나타내는 수익성 측면에서는 아쉬움을 나타냈다. (위의 AI인공지능 점수는 재무 데이터를 기반으로 전체 상장 종목과 비교/분석하여 도출한 점수로 높은 점수가 반드시 높은 수익률을 보장하지 않습니다. 위의 자료는 당사의 추천 종목이 아니며, 투자 시 참고용으로 제시해드리는 것입니다. 핵심투자지표를 결합해 종목의 투자매력도를 종합 계산한 ""인공지능 투자점수""는 ""거장들의 투자공식"" 앱에서 확인하실 수 있습니다.) 라이온봇 기자 -한국경제TV※ 본 기사는 한국경제TV와 '거장들의 투자공식이'자체 개발한 '라이온봇 기자'가 실시간으로 작성한 기사입니다. 라이온봇기자 ⓒ 한국경제TV, 무단 전재 및 재배포 금지 한국경제TV 관련뉴스해당 언론사에서 선정하며 언론사 페이지(아웃링크)로 이동해 볼 수 있습니다.치아교정 해볼까…송곳니 위치에 달렸다'형이 왜 거기서 나와?' 놀림감 된 독일 골키퍼 노이어 ""괴롭고 처참해""무역전쟁의 끝은 '위안화 절상'…""000株 선점하라""은퇴세대 건보료 '폭탄'…월 19만원 더 내야멕시코 반응 폭발 ""우리 모두는 한국인""..항공권도 할인"
한국경제TV,183190,/news/news_read.nhn?article_id=0000664552&office_id=215&mode=search&query=아세아시멘트&page=1,2018-07-24 13:11,"아세아시멘트, 10% 급등... 전일 보다 11,500원 상승한 125,500원","[한국경제TV 라이온봇 기자] [그림 1] 최근 3개월 간 주가 추세 및 기간별 수익률 아세아시멘트는 7월 24일 13시 10분 전일 대비 약 10% 급등한 125,500원에 거래되고 있다. 아세아시멘트는 코스피 상장 기업으로 비금속광물 업종에 속해 있다. 시가총액은 4,441억원으로 코스피 상장기업 중 274위에 위치 해 있다. [종목 성향 진단] [그림 2] 종목 성향 진단 아세아시멘트의 투자 스타일은 모호한 측면이 있으나 성장주라고 볼 수 있다. 주가 고평가 우려가 공존하지만 높은 성장성이 기대되는 기업이다. 주가 모멘텀은 좋지 못했다. 최근 1개월 수익률은 -19.15%의 하락폭을 기록했다. 아세아시멘트 종목에 대한 투자자의 관심도는 평범한 수준이었다. [투자 점수 진단] [그림 3] 투자 점수 진단 아세아시멘트는 어느 측면에서 투자 매력도가 높은 종목일까? AI 인공지능 종목 분석 시스템을 이용해 성장성, 수익성, 효율성, 안전성, 저평가성, 추세 등 주가 수익률에 영향을 줄 수 있는 6가지 핵심 투자 지표를 점수화하여 종목의 투자 매력도를 계산해보았다. 그 결과 아세아시멘트는 상대적으로 저평가 측면에서 두각을 드러내고 있었다. 저평가 점수는 기업의 가치 대비 주가의 수준이 어느 정도인지를 나타낸다. 아세아시멘트는 특히 PBR 측면에서 가장 높은 점수는 기록했는데, 전체 시장 내 369위를 기록하며 상위 19.65%에 위치했다. 업종별로는 83위를 기록하며 상위 24.7%에 위치했다. 그러나 기업의 이익 실현 정도를 나타내는 수익성 측면에서는 아쉬움을 나타냈다. (위의 AI인공지능 점수는 재무 데이터를 기반으로 전체 상장 종목과 비교/분석하여 도출한 점수로 높은 점수가 반드시 높은 수익률을 보장하지 않습니다. 위의 자료는 당사의 추천 종목이 아니며, 투자 시 참고용으로 제시해드리는 것입니다. 핵심투자지표를 결합해 종목의 투자매력도를 종합 계산한 ""인공지능 투자점수""는 ""거장들의 투자공식"" 앱에서 확인하실 수 있습니다.) 라이온봇 기자 -한국경제TV※ 본 기사는 한국경제TV와 '거장들의 투자공식이'자체 개발한 '라이온봇 기자'가 실시간으로 작성한 기사입니다. 라이온봇기자"
이데일리,183190,/news/news_read.nhn?article_id=0004033840&office_id=018&mode=search&query=아세아시멘트&page=1,2018-02-12 18:29,"아세아시멘트, 한라시멘트에 4800억원 규모 담보제공",[이데일리 경계영 기자] 아세아시멘트(183190)는 계열사인 한라시멘트에 4800억원 규모의 한라시멘트 주식 332만4689주를 담보로 제공키로 결정했다고 12일 공시했다.
한국경제TV,183190,/news/news_read.nhn?article_id=0000666741&office_id=215&mode=search&query=아세아시멘트&page=1,2018-07-30 14:08,"아세아시멘트, 5거래일 연속 상승... 전일 대비 1% 상승","[한국경제TV 라이온봇 기자] [그림 1] 최근 3개월 간 주가 추세 및 기간별 수익률 아세아시멘트는 현재 5거래일 연속 상승세를 기록하고 있어 주목할 만하다. 아세아시멘트는 7월 30일 14시 7분 전일 대비 약 1% 상승한 138,000원에 거래되고 있다. 아세아시멘트는 코스피 상장 기업으로 비금속광물 업종에 속해 있다. 시가총액은 5,317억원으로 코스피 상장기업 중 250위에 위치 해 있다. [종목 성향 진단] [그림 2] 종목 성향 진단 아세아시멘트의 투자 스타일은 모호한 측면이 있으나 성장주라고 볼 수 있다. 주가 고평가 우려가 공존하지만 높은 성장성이 기대되는 기업이다. 주가 모멘텀은 평범한 수준이었다. 최근 1개월 수익률이 0.74%, 3개월 수익률은 8.33%, 6개월 수익률은 7.48%를 기록했다. 아세아시멘트 종목에 대한 투자자의 관심도는 평범한 수준이었다. [투자 점수 진단] [그림 3] 투자 점수 진단 아세아시멘트는 어느 측면에서 투자 매력도가 높은 종목일까? AI 인공지능 종목 분석 시스템을 이용해 성장성, 수익성, 효율성, 안전성, 저평가성, 추세 등 주가 수익률에 영향을 줄 수 있는 6가지 핵심 투자 지표를 점수화하여 종목의 투자 매력도를 계산해보았다. 그 결과 아세아시멘트는 상대적으로 추세지표 측면에서 두각을 드러내고 있었다. 추세 점수는 주가의 상승 모멘텀이 어느정도 인가를 나타낸다. 아세아시멘트는 특히 1주전대비수익률 측면에서 가장 높은 점수는 기록했는데, 전체 시장 내 34위를 기록하며 상위 1.65%에 위치했다. 업종별로는 16위를 기록하며 상위 4.36%에 위치했다. 그러나 기업의 이익 실현 정도를 나타내는 수익성 측면에서는 아쉬움을 나타냈다. (위의 AI인공지능 점수는 재무 데이터를 기반으로 전체 상장 종목과 비교/분석하여 도출한 점수로 높은 점수가 반드시 높은 수익률을 보장하지 않습니다. 위의 자료는 당사의 추천 종목이 아니며, 투자 시 참고용으로 제시해드리는 것입니다. 핵심투자지표를 결합해 종목의 투자매력도를 종합 계산한 ""인공지능 투자점수""는 ""거장들의 투자공식"" 앱에서 확인하실 수 있습니다.) 라이온봇 기자 -한국경제TV※ 본 기사는 한국경제TV와 '거장들의 투자공식이'자체 개발한 '라이온봇 기자'가 실시간으로 작성한 기사입니다. 라이온봇기자"
아시아경제,183190,/news/news_read.nhn?article_id=0003650524&office_id=277&mode=search&query=아세아시멘트&page=1,2015-12-21 07:19,"대신證, 아세아시멘트 목표가 13만원으로 커버리지 개시","[아시아경제 김민영 기자]대신증권은 21일 아세아시멘트에 대해 '가장 저평가된 시멘트 업체'라고 평하며 목표주가 13만원, 투자의견 '매수'를 제시하며 분석을 시작했다. 이선일 대신증권 연구원은 ""목표주가는 2016년 예상 주당순이익(EPS)에 적정 주가수익배수(PER) 7.9배를 적용해 산출했다""며 ""EV/EBITDA(기업가치/세금·이자지급전이익) 방식으로는 17만8000원까지 나오지만 역시 보수적 기준 적용했다""고 설명했다. 아세아시멘트는 한일시멘트와 함께 시멘트, 레미콘, 몰탈을 모두 생산하는 유일한 업체다. 종속회사인 아세아산업개발은 콘크리트 타일기와 및 벽돌을 생산하고 있다. 부문별 매출비중은 시멘트 67.4%, 레미콘 24.3%, 타일 및 벽돌 5.7%, 기타 금융 등 2.6%이다. 타일 및 벽돌 같은 경우는 매출 규모가 크진 않지만 영업이익률이 25%에 달할 정도로 수익성이 높은 제품이다. 이 연구원은 아세아시멘트를 작지만 단단한 회사의 전형이라고 평했다. 그는 ""오랫동안 우량한 재무구조와 안정적인 실적을 유지해 왔기 때문에 가동률과 폐자원 대체 등 원가절감에서 한 발 앞서 있다""면서 ""캐파(Capa)가 작은 회사임에도 불구하고 수익성이 매우 높은 수준""이라고 했다. 하지만 생산 및 수요가 팽창하는 시기에는 규모의 경제효과가 상대적으로 떨어지기 때문에 실적개선 모멘텀이 다른 회사와 비교해 약한 건 약점으로 지적된다. 이 연구원은 주택경기 호황으로 시멘트 계열 모든 사업부가 순항 중이라는 점을 들어 2015년 및 2016년 영업이익은 각각 632억원, 712억원으로 예상했다."
파이낸셜뉴스,183190,/news/news_read.nhn?article_id=0003899983&office_id=014&mode=search&query=아세아시멘트&page=1,2017-11-03 17:35,한라시멘트 인수전 아주산업&middot;아세아시멘트 2파전,"한라시멘트 인수전이 아주산업, 아세아시멘트 등 2파전이 됐다. 매각 예비입찰을 통해 뽑힌 숏리스트(예비적격후보) 중 2곳이 본입찰에 참여했다. 이 원매자들은 지난 9월 18일 입찰 참여 적격후보(Short List)로 선정된 곳이다. 3일 투자은행(IB) 업계에 따르면 라시멘트 매각 본입찰에 아세아시멘트, 아주산업이 참여했다. 아주산업은 외부와 컨소시엄 없이 그룹 단독으로 한라시멘트 인수에 나섰다. 아세아시멘트는 각각 전략적투자자(SI), 재무적투자자(FI)와 컨소시엄을 구성했다. 가장 인수 의지가 큰 후보로는 아세아시멘트가 꼽힌다. 인수전 초기부터 별도 태스크포스(TF)까지 만든 아세아시멘트는 2015년 삼표와 손잡고 삼표시멘트(옛 동양시멘트)를 인수했던 KDB산업은행 M&A실을 자문사로 고용해 이번 거래를 추진 중이다. 아세아시멘트가 한라시멘트를 인수하면 업계 2~3위권으로 올라설 수 있다. 이번 매각 대상은 홍콩계 PEF인 베어링프라이빗에퀴티아시아(PEA)가 보유한 한라시멘트 지분 100% 전량이다. IB 업계에서는 매각가로 최대 8000억원 수준이 거론되고 있다. 베어링PEA는 지난해 글랜우드PE와 컨소시엄을 구성해 한라시멘트를 인수했다. 이후 글랜우드PE가 베어링PEA에 지분을 팔고 먼저 투자금을 회수하면서 베어링PEA가 단일 최대주주가 됐다. 한편, 한라시멘트 지난해 매출액은 4706억원, 영업이익은 628억원으로 전년대비 각각 1%, 43.1% 증가했다. IB업계 관계자는 “한라시멘트 인수전은 업황 자체에 대한 기대보다 시장 지배력을 위해 인수전에 참여한 것으로 안다”고 말했다."
뉴스1,183190,/news/news_read.nhn?article_id=0003040806&office_id=421&mode=search&query=아세아시멘트&page=1,2017-11-10 15:17,"아세아시멘트, 한라시멘트 우선협상자 선정&hellip;점유율 꼴찌&rarr;3위 '껑충'","© News1 이은주 디자이너 (상보)한라시멘트, 해상운송 강점…인수 후 시너지 기대시멘트 업계, 올해 7개→5개사 체제로 개편 (서울=뉴스1) 이철 기자 = 아세아시멘트가 한라시멘트 인수 우선협상대상자에 선정됐다. 아세아시멘트가 한라시멘트 인수에 성공할 경우 주요 시멘트 업체 중 생산량 꼴찌에서 단숨에 3위로 뛰어오르게 된다. 시멘트 업계의 구조조정이 사실상 마무리됨에 따라 시장구조는 내년부터 주요 5개사 체제로 재편될 전망이다. 아세아시멘트는 한라시멘트 인수 우선협상대상자로 선정됐다고 10일 밝혔다. 한라시멘트는 사모투자펀드운용사인 베어링 프라이빗에쿼티아시아(PEA)가 지분 100%를 보유하고 있다. 아세아시멘트는 한라시멘트의 차입금 4000억원을 제외한 인수가격으로 3000억원대 중반을, 아주산업은 2000억원대 중반을 제시한 것으로 알려졌다. 앞서 지난 3일 매각 본입찰을 마감한 결과 아세아시멘트와 아주산업만 본입찰에 참여했다. 예비입찰에 참여했던 성신양회와 LK투자파트너스는 본입찰에 참가하지 않았다. 계약이 성공적으로 마무리될 경우 아세아시멘트의 시장점유율은 7%에서 19%대(출하량 기준)로 뛰어올라 쌍용양회(24%), 한일시멘트(22%)에 이어 업계 3위로 껑충 뛰어오르게 된다. 아세아시멘트의 단순 매출 규모도 지금보다 2배가량 커질 것으로 보인다. 한라시멘트는 지난해 매출액이 4707억원, 영업이익은 628억원을 기록했다. 아세아시멘트의 지난해 실적(매출 4557억원, 영업이익 570억원)보다 나은 편이다. 또 다른 관계자는 ""강원도 강릉시 옥계에 광산 전용항구를 둔 한라시멘트는 해상 운송이 가능해 톤당 운송비가 (육상 대비)4~5배 저렴하다""며 ""내륙사인 아세아시멘트는 한라시멘트의 전국 영업망 및 생산기지와 시너지를 기대할 수 있다""고 설명했다. 시멘트 업계에서도 이번 인수를 반기는 분위기다. 사모펀드보다는 다른 시멘트 업체가 한라시멘트를 인수하는 것이 업계 전체에 이익이라는 설명이다. 국내 시멘트 시장은 상위 7개사가 전체 생산량의 87.9%를 점유하고 있는 과점 구조다. 지난 8월 한일시멘트가 현대시멘트를 인수하며 업계 1위로 올라선데 이어 이번 인수까지 마무리되면 시장은 사실상 5개사 체제로 재편된다. 한 시멘트 업체 관계자는 ""막대한 시설 투자금이 드는 시멘트 업계는 신규 시장 진입이 어렵고 제품 차별화가 쉽지 않아 시장 점유율이 좀처럼 달라지지 않는다""며 ""6개사가 5개사 구도로 줄고 점유율 경쟁을 자제할 경우 전반적으로 단가협상력이 높아질 것""이라고 내다봤다."
한국경제,183190,/news/news_read.nhn?article_id=0003863976&office_id=015&mode=search&query=아세아시멘트&page=1,2017-12-12 06:36,"아세아시멘트, 한라시멘트 인수 확정",지분 100% 3651억에 사들여점유율 7위서 단숨에 선두권 [ 정영효/정소람 기자  ] 아세아시멘트가 국내 시멘트업계 재편 과정에서 마지막 대형 매물로 꼽히는 한라시멘트 인수를 확정지었다. 현재 7위인 아세아시멘트의 시장 점유율 순위가 단숨에 선두권으로 올라설 전망이다. 아세아시멘트 모회사인 아세아는 11일 아세아시멘트가 코리아시멘트홀딩스 등이 보유한 한라시멘트 주식 100%(2499만9992주)를 3651억1300만원에 인수하는 주식매매계약을 체결했다고 공시했다. 코리아시멘트홀딩스는 홍콩계 사모펀드인 베어링 프라이빗에쿼티아시아(PEA)가 지난해 한라시멘트를 인수하기 위해 설립한 특수목적회사(SPC)다. 부채를 포함한 총 기업가치(EV) 기준으로 인수 규모는 7760억원 수준이다. 앞서 베어링PE는 지난달 10일 아세아시멘트를 한라시멘트 매각을 위한 우선협상대상자로 선정했다. 아세아시멘트는 이날 인수 대금의 8%를 납입했으며 다음달 31일까지 잔금을 납입해 거래를 완료할 계획이다. 한국시멘트협회에 따르면 국내 시멘트 시장 점유율은 지난해 쌍용양회(19.2%)와 삼표시멘트(14.2%) 성신양회(14.0%) 순이었다. 아세아시멘트는 7.2%로 7위에 머물렀다. 시장 점유율 11.9%의 한라시멘트를 인수하면 1위인 쌍용양회와 어깨를 나란히 하게 된다.
한국경제TV,183190,/news/news_read.nhn?article_id=0000670417&office_id=215&mode=search&query=아세아시멘트&page=1,2018-08-10 09:09,"아세아시멘트, 전일 대비 약 6% 상승한 139,500원","[한국경제TV 라이온봇 기자] [그림 1] 최근 3개월 간 주가 추세 및 기간별 수익률 아세아시멘트는 8월 10일 9시 8분 전일 대비 약 6% 상승한 139,500원에 거래되고 있다. 아세아시멘트는 코스피 상장 기업으로 비금속광물 업종에 속해 있다. 시가총액은 5,142억원으로 코스피 상장기업 중 255위에 위치 해 있다. [종목 성향 진단] [그림 2] 종목 성향 진단 아세아시멘트의 투자 스타일은 모호한 측면이 있으나 성장주라고 볼 수 있다. 주가 고평가 우려가 공존하지만 높은 성장성이 기대되는 기업이다. 주가 모멘텀은 부진한 편이었다. 최근 3개월 수익률은 -12.78%의 하락폭을 기록했다. 최근 1개월 수익률 또한 -0.37% 하락하며 부진한 모멘텀을 이어가고 있다. 아세아시멘트 종목에 대한 투자자의 관심도는 평범한 수준이었다. [투자 점수 진단] [그림 3] 투자 점수 진단 아세아시멘트는 어느 측면에서 투자 매력도가 높은 종목일까? AI 인공지능 종목 분석 시스템을 이용해 성장성, 수익성, 효율성, 안전성, 저평가성, 추세 등 주가 수익률에 영향을 줄 수 있는 6가지 핵심 투자 지표를 점수화하여 종목의 투자 매력도를 계산해보았다. 그 결과 아세아시멘트는 상대적으로 추세지표 측면에서 두각을 드러내고 있었다. 추세 점수는 주가의 상승 모멘텀이 어느정도 인가를 나타낸다. 아세아시멘트는 특히 12개월전대비수익률 측면에서 가장 높은 점수는 기록했는데, 전체 시장 내 196위를 기록하며 상위 10.05%에 위치했다. 업종별로는 29위를 기록하며 상위 8.33%에 위치했다. 그러나 기업의 이익 실현 정도를 나타내는 수익성 측면에서는 아쉬움을 나타냈다. (위의 AI인공지능 점수는 재무 데이터를 기반으로 전체 상장 종목과 비교/분석하여 도출한 점수로 높은 점수가 반드시 높은 수익률을 보장하지 않습니다. 위의 자료는 당사의 추천 종목이 아니며, 투자 시 참고용으로 제시해드리는 것입니다. 핵심투자지표를 결합해 종목의 투자매력도를 종합 계산한 ""인공지능 투자점수""는 ""거장들의 투자공식"" 앱에서 확인하실 수 있습니다.) 라이온봇 기자 -한국경제TV※ 본 기사는 한국경제TV와 '거장들의 투자공식이'자체 개발한 '라이온봇 기자'가 실시간으로 작성한 기사입니다. 라이온봇기자"
이데일리,183190,/news/news_read.nhn?article_id=0003961942&office_id=018&mode=search&query=아세아시멘트&page=1,2017-11-03 16:26,"[마켓인]한라시멘트 인수전, 아주산업&middot;아세아시멘트 2파전","[이데일리 신상건 기자] 시멘트업계 5위인 한라시멘트 인수전이 아주산업과 아세아시멘트(183190) 2파전으로 좁혀졌다. △한라시멘트 전경. 3일 투자은행(IB) 업계에 따르면 이날 진행된 한라시멘트 매각 본입찰에 아주산업과 아세아시멘트가 참여했다. 다른 인수 후보인 성신양회와 LK투자파트너스는 참여하지 않은 것으로 전해진다. 매각 대상은 한라시멘트 최대주주인 홍콩계 사모투자펀드(PEF)인 베어링프라이빗에퀴티아시아(PEA)가 세운 특수목적회사(SPC) 라코가 보유한 한라시멘트 지분 100%다. 매각 측은 예비 인수 후보자를  대상으로 조만간 우선협상대상자를 선정할 예정이다. 레미콘업체인 아주산업이 한라시멘트를 인수하게 되면 골재부터 시멘트와 레미콘으로 이어지는 수직계열화를 완성할 수 있다. 아주산업은 지난해 골재채취업체인 공영해운을 인수하면서 수직 계열화 완성의 첫 단추를 끼웠다. 레미콘은 모래와 자갈, 시멘트를 혼합해 만드는데 아주산업은 공영해운에 더해 한라시멘트까지 인수하게 되면 안정적인 공급망을 확보하는 셈이다. 또 한라시멘트가 철도와 차량 외 선박으로 시멘트를 운송하는 해안사인 만큼 해상 운송을 통해 전국으로 시멘트를 공급할 수 있고 운송비용도 아낄 수 있다. 또 한라시멘트 인수를 통해 단숨에 시멘트업계 ‘빅5’에 올라서게 된다. 아세아시멘트 역시 한라시멘트를 인수하면 시멘트업계 3위 자리를 차지하게 된다. 시멘트업계의 점유율은 한일시멘트(2016년 기준 시장 점유율 12.8%)가 현대시멘트(9.5%)를 인수하면서 시장 점유율 22.3%를 기록해 업계 1위를 기록 중이다. 뒤를 이어 △쌍용양회(19.2%) △삼표시멘트(14.2%) △성신양회(14.0%) △한라시멘트(11.9%) △아세아시멘트(9.5%) 순이다. 아세아시멘트는 한라시멘트 인수를 위해 별도 전담팀(TFT)까지 만들었고 KDB산업은행 M&A실을 자문사로 고용했다. 관건은 가격이다. 현재 인수 가격은 6000억~8000억원까지로 추정된다. 일각에서는 1조원에 달할 수 있다는 전망도 나온다. IB업계 관계자는 “시멘트업계는 과점시장이기 때문에 인수합병(M&A)이 아니고서야 시장점유율을 끌어올리기 어려운 구조”라며 “한라시멘트 인수전의 최종 승자는 얼마만큼 인수 의지를 가졌느냐가 결정지을 것으로 보인다”고 말했다. 이어 “최종 인수자에 따라 변화되는 시멘트업계 판도도 귀추가 주목된다”고 덧붙였다."
