source,symbol,link,date,title,content
한국경제TV,183190,/news/news_read.nhn?article_id=0000633612&office_id=215&mode=search&query=아세아시멘트&page=1,2018-05-14 10:10,"아세아시멘트, 52주 신고가 경신... 전일 대비 9% 상승","[한국경제TV 라이온봇 기자] 아세아시멘트는 52주 신고가를 경신했다. 아세아시멘트는 5월 14일 10시 10분 전일 대비 약 9% 상승한 171,500원에 거래되고 있다. 아세아시멘트는 코스피 상장 기업으로 비금속광물 업종에 속해 있다. 시가총액은 6,116억원으로 코스피 상장기업 중 243위에 위치 해 있다. [종목 성향 진단] [그림 1] 종목 성향 진단 아세아시멘트의 투자 스타일은 가치주에 가깝다. 기업 가치 대비 낮은 주가가 매력적인 기업이다. 주가 모멘텀은 굉장히 좋은 편이었다. 최근 1개월 수익률이 무려 63.37%의 상승폭을 기록했다. 아세아시멘트 종목에 대한 투자자의 관심도는 높은 편에 속한다. [투자 점수 진단] [그림 2] 투자 점수 진단 아세아시멘트는 저평가성1(PER) 측면에서 두각을 나타내고 있다. 최근 PER은 91점으로 6개의 핵심 팩터 중 가장 높은 점수를 기록했다. PER은  전체 시장 내 161위를 기록하며 상위 8.67%에 위치했다. 업종별로는 32위를 기록하며 상위 9.42%에 위치했다. 그리고 효율성(ROA) 역시 도드라지는 편이다. 효율성 점수는 87점으로 두번째로 높은 점수를 기록했다. ROA는 전체 시장 내 259위를 기록하며 상위 13.24%에 위치했다. 업종별로는 36위를 기록하며 상위 10.39%에 위치했다. 그러나 매출증가율(YoY)이 아쉬움을 나타냈다. [종합 투자점수] [그림 3] 종합 투자점수 AI 인공지능 분석을 통한 아세아시멘트의 종목 종합 스코어는 74점을 기록했다. 이는 동일 업종 평균점수인 57점과 시장 평균점수인 59점를 상회하는 수치였다. (위의 AI인공지능 점수는 재무 데이터를 기반으로 전체 상장 종목과 비교/분석하여 도출한 점수로 높은 점수가 반드시 높은 수익률을 보장하지 않습니다. 위의 자료는 당사의 추천 종목이 아니며, 투자 시 참고용으로 제시해드리는 것입니다.) 라이온봇 기자 -한국경제TV※ 본 기사는 한국경제TV와 '거장들의 투자공식이'자체 개발한 '라이온봇 기자'가 실시간으로 작성한 기사입니다. 라이온봇기자 ⓒ 한국경제TV, 무단 전재 및 재배포 금지 한국경제TV 관련뉴스해당 언론사에서 선정하며 언론사 페이지(아웃링크)로 이동해 볼 수 있습니다.서정희 딸 서동주, 이렇게 예뻤나김생민 근황은?…박명수 예언 발언 ""소름 돋네""정려원 고백, '불같았던' 열애 상대 누구?민유라 해명, ""겜린과는 비지니스 파트너""홍수아 올 망사?…'이쯤되면 대륙여신'"
파이낸셜뉴스,183190,/news/news_read.nhn?article_id=0004022255&office_id=014&mode=search&query=아세아시멘트&page=1,2018-05-16 13:18,"[fnRASSI]아세아시멘트, 52주 신고가...1.39% &uarr;","아세아시멘트(183190)는 52주신고가를 기록하고 있어 주목할만하다. 동종목의 현재 주가는 182,000원 선에서 이루어지고 있다. 거래일을 기준으로 최근 3일간 평균 거래량은 11만 주이다. 이는 60일 일 평균 거래량 4만 주와 비교해보면 최근 거래량이 급격히 늘어났다는 것을 알 수 있다. 외국인과 개인은 순매도, 기관은 순매수(한달누적)  5월9일부터 전일까지 외국인이 5거래일 연속 동종목을 내다 팔았다. 4주간을 기준으로 보면 기관이 방향성있는 매매를 하면서 174,537주를 순매수한 반면, 외국인은 매도 우위를 지속하면서 116,065주를 순매도했고, 개인들도 매도쪽으로 방향을 잡으면서 58,472주를 순매도했다. 주가등락폭이 너무 커 최근 한달간 아세아시멘트의 상장주식수 대비 거래량을 비교해보니 일별 매매회전율이 2.47%로 집계됐다. 동기간 일평균 주가변동률은 12.17%로 장중 주가등락이 심하기 때문에 투자시 주의가 요망된다. 'fnRASSI'는 증권전문 기업 씽크풀과 파이낸셜뉴스의 협업으로 로봇기자가 실시간으로 생산하는 기사입니다."
뉴시스,183190,/news/news_read.nhn?article_id=0008185027&office_id=003&mode=search&query=아세아시멘트&page=1,2017-09-18 17:57,"아세아시멘트 &quot;한라시멘트 매각, 본입찰대상자로 선정&quot;","【서울=뉴시스】정옥주 기자 = 아세아시멘트(183190)는 ""한라시멘트 인수의향서(LOI)를 제출한 결과 매각 주간사인 씨티그룹글로벌마켓증권주식회사로부터 본입찰대상자(Short List)로 선정됐음을 통보받았디""고 18일 공시했다. 회사 측은 관련 내용을 추후 진행과정에 따라 공시할 예정이다."
서울경제,183190,/news/news_read.nhn?article_id=0002739378&office_id=011&mode=search&query=아세아시멘트&page=1,2015-09-15 13:15,"아세아시멘트, 수급타이트시 빛날 업체","아세아시멘트(183190)에 대해 교보증권은 ""수급타이트시 빛날 업체""라 평하며 투자의견 BUY에 목표주가 148,000원을 제시했다. 이에 백광제 연구원은 ""동사는 시멘트 업체 중 가장 낮은 부채비율 및 뛰어난 자금 동원력 보유, 시멘트 수급 타이트 발생시 출하량 증가에 투자 가능한 소수 업체 중 하나로 시멘트 업체內 Top-Pick 추천한다""고 전했다. 또한 ""2015년 매출액 4,400억원(YoY +4.7%), 영업이익 636억원(YoY +16.0%)전망한다. 주택경기 호조에 따른 수요 증가로 시멘트, 레미콘, 몰탈 등 전부문 매출액 증가 및 유연탄 등 원자재 가격 하락으로 영업이익 증가. 주택 착공면적 증가로 3·4분기 전년동기비 이익 증대는 지속될 예상""이라고 밝히기도 했다. 한편 백 연구원은 내년 실적 전망으로 ""2016년 매출액 4,800억원(YoY +8.1%), 영업이익 700억원(YoY +10.5%) 전망한다. ‘15년 주택 분양 물량 착공시점 도래로 매출액(시멘트 +9.1%, 레미콘 +4.0%, 몰탈 2.4%) 증가 및 수요 증가에 따른 수급타이트 발생으로 시멘트 판가 인상 예상. 소성로 재가동 가정시 매출액은 추가 증가 가능하다""고 덧붙여 설명했다. ▷ 시멘트 섹터 아세아, 남화토건, 모헨즈, 유니온, 한일시멘트, 쌍용양회, 동양시멘트, 성신양회, 현대시멘트 등"
전자신문,183190,/news/news_read.nhn?article_id=0002721311&office_id=030&mode=search&query=아세아시멘트&page=1,2018-07-04 15:50,"[ET투자뉴스][아세아시멘트 지분 변동] 신영자산운용(주)1.029%p 증가, 1...","아세아시멘트(183190)는 04일 주주 신영자산운용(주)의 보유주식이 증가되었다고 발표했다. 이는 직전 보고일보다 40,084주 증가하여 지분율은 12.55%로 상승했다. 이번 보고 사유는 1%이상변동으로  알려졌다.   최대주주와 특수관계자의 지분 변동은 주가에 영향을 주는 요인이다. 특히 보유비율을 지속적으로 늘리거나 줄일 경우, 해당종목 투자시 유의할 필요가 있다.  다음은 아세아시멘트의 지분 변동 내역과 보유 내역이다."
한국경제TV,183190,/news/news_read.nhn?article_id=0000628559&office_id=215&mode=search&query=아세아시멘트&page=1,2018-04-30 13:11,"아세아시멘트, 10% 급등... 전일 보다 13,000원 상승한 139,000원","[한국경제TV 라이온봇 기자] 아세아시멘트는 4월 30일 13시 10분 전일 대비 약 10% 급등한 139,000원에 거래되고 있다. 아세아시멘트는 코스피 상장 기업으로 비금속광물 업종에 속해 있다. 시가총액은 4,908억원으로 코스피 상장기업 중 261위에 위치 해 있다. [종목 성향 진단] [그림 1] 종목 성향 진단 아세아시멘트의 투자 스타일은 가치주에 가깝다. 기업 가치 대비 낮은 주가가 매력적인 기업이다. 주가 모멘텀은 굉장히 좋은 편이었다. 최근 6개월 수익률이 무려 52.58%의 상승폭을 기록했다. 최근 1개월 수익률 또한 34.33% 상승하며 굉장히 좋은 모멘텀을 보이고 있다. 아세아시멘트 종목에 대한 투자자의 관심도는 높은 편에 속한다. [투자 점수 진단] [그림 2] 투자 점수 진단 아세아시멘트는 저평가성1(PER) 측면에서 두각을 나타내고 있다. 최근 PER은 91점으로 6개의 핵심 팩터 중 가장 높은 점수를 기록했다. PER은  전체 시장 내 161위를 기록하며 상위 8.67%에 위치했다. 업종별로는 32위를 기록하며 상위 9.42%에 위치했다. 그리고 효율성(ROA) 역시 도드라지는 편이다. 효율성 점수는 87점으로 두번째로 높은 점수를 기록했다. ROA는 전체 시장 내 259위를 기록하며 상위 13.24%에 위치했다. 업종별로는 36위를 기록하며 상위 10.39%에 위치했다. 그러나 매출증가율(YoY)이 아쉬움을 나타냈다. [종합 투자점수] [그림 3] 종합 투자점수 AI 인공지능 분석을 통한 아세아시멘트의 종목 종합 스코어는 80점을 기록했다. 이는 동일 업종 평균점수인 59점과 시장 평균점수인 60점를 상회하는 수치였다. (위의 AI인공지능 점수는 재무 데이터를 기반으로 전체 상장 종목과 비교/분석하여 도출한 점수로 높은 점수가 반드시 높은 수익률을 보장하지 않습니다. 위의 자료는 당사의 추천 종목이 아니며, 투자 시 참고용으로 제시해드리는 것입니다.) 라이온봇 기자 -한국경제TV※ 본 기사는 한국경제TV와 '거장들의 투자공식이'자체 개발한 '라이온봇 기자'가 실시간으로 작성한 기사입니다. 라이온봇기자 ⓒ 한국경제TV, 무단 전재 및 재배포 금지 한국경제TV 관련뉴스해당 언론사에서 선정하며 언론사 페이지(아웃링크)로 이동해 볼 수 있습니다.바이오주 급락…증시 전문가들 ""저도 몰라요""홍지민 이어 서유리도 '홀쭉'…""4개월 만에 10kg 다이어트""이명희 '임산부' 갑질…""조선시대 노비 다루듯""美 '최악의 연쇄살인' 풀렸다…소름돋는 범인 정체왕빛나 서구적 몸매 비결…'20kg을 한 번에?'"
이데일리,183190,/news/news_read.nhn?article_id=0003968717&office_id=018&mode=search&query=아세아시멘트&page=1,2017-11-13 08:00,"아세아시멘트, 한라시멘트 인수로 업계 3위..목표가&uarr;-신영","[이데일리 함정선 기자] 신영증권은 13일 아세아시멘트(183190)에 대해 한라시멘트 인수로 업계 3위로 올라설 전망이라며 목표주가를 기존 10만원에서 15만원으로 올렸다. 투자의견은 ‘매수’를 유지했다. 박세라 신영증권 연구원은 “아세아시멘트가 한라시멘트 인수 관련 최종 우선협상대상자로 선정됐으며 최종 인수할 경우 시장점유율은 7%에서 19%으로 상승, 업계 3위 규모로 성장할 것”이라고 전망했다. 박 연구원은 한라시멘트 인수로 점유율 상승을 통해 안정적인 실적을 낼 것으로 봤다. 또한 그는 “해안사와 시너지로 해안사는 해운 운송이 가능하기 때문에 내륙사 대비 운반비를 절감할 수 있게 된다”며 “아세아시멘트는 서울, 수도권 위주 시멘트 판매에서 해운사를 활용해 강원도와 경남 등 지방까지 영업력을 확대할 수 있어 긍정적”이라고 평가했다. 다만 박 연구원은 시멘트 가격 인상에 대한 기대감에 지나친 상승은 경계해야 한다고 판단했다. 그는 “가격 인상을 위해서는 시장지배력을 향상해야 한다”며 “내년 이후 국내 건설업 경기가 하향하며 시멘트 출하량이 감소하는 점도 고려해야 한다”고 분석했다."
뉴시스,183190,/news/news_read.nhn?article_id=0008174131&office_id=003&mode=search&query=아세아시멘트&page=1,2017-09-12 19:05,아세아시멘트 &quot;한라시멘트 예비입찰 인수의향서 제출&quot;,【서울=뉴시스】 이진영 기자 = 아세아시멘트(183190)는 매각 주간사인 씨티그룹글로벌마켓증권에 한라시멘트 예비입찰에 참여할 의향이 있다는 인수의향서(LOC)를 제출했다고 12일 공시했다.
매일경제,183190,/news/news_read.nhn?article_id=0004046022&office_id=009&mode=search&query=아세아시멘트&page=1,2017-11-10 09:33,"[Hot-Line] 아세아시멘트, 한라시멘트 인수 성공 소식에 급등","아세아시멘트가 시멘트업계의 마지막 대형 매물로 꼽힌 한라시멘트를 인수한다는 소식에 급등세다. 10일 오전 9시 3분 현재 아세아시멘트는 전일 대비 9000원(9.89%) 오른 10만원에 거래되고 있다. 이날 개장 직후 아세아시멘트는 10만9500원까지 올라 52주 신고가를 경신했다. 전날 한라시멘트 매각 주관사인 시티글로벌마켓증권은 최종 우선협상대상자로 아세아시멘트를, 차선 협상자로는 아주산업을 선정했다. 한라시멘트는 사모투자펀드(PEF)운용사인 베어링 프라이빗에쿼티아시아(PEA)가 지분 100%를 보유하고 있다. [디지털뉴스국 고득관 기자] r_start // r_end //"
한국경제TV,183190,/news/news_read.nhn?article_id=0000655573&office_id=215&mode=search&query=아세아시멘트&page=1,2018-07-02 12:11,"아세아시멘트, 전일 대비 약 -8% 하락한 132,000원","[한국경제TV 라이온봇 기자] [그림 1] 최근 3개월 간 주가 추세 및 기간별 수익률 아세아시멘트는 7월 2일 12시 10분 전일 대비 약 -8% 하락한 132,000원에 거래되고 있다. 아세아시멘트는 코스피 상장 기업으로 비금속광물 업종에 속해 있다. 시가총액은 5,590억원으로 코스피 상장기업 중 240위에 위치 해 있다. [종목 성향 진단] [그림 2] 종목 성향 진단 아세아시멘트의 투자 스타일은 모호한 측면이 있으나 성장주라고 볼 수 있다. 주가 고평가 우려가 공존하지만 높은 성장성이 기대되는 기업이다. 주가 모멘텀은 좋지 못했다. 최근 1개월 수익률은 -24.8%의 하락폭을 기록했다. 아세아시멘트 종목에 대한 투자자의 관심도는 높은 편에 속한다. [투자 점수 진단] [그림 3] 투자 점수 진단 아세아시멘트는 어느 측면에서 투자 매력도가 높은 종목일까? AI 인공지능 종목 분석 시스템을 이용해 성장성, 수익성, 효율성, 안전성, 저평가성, 추세 등 주가 수익률에 영향을 줄 수 있는 6가지 핵심 투자 지표를 점수화하여 종목의 투자 매력도를 계산해보았다. 그 결과 아세아시멘트는 상대적으로 추세지표 측면에서 두각을 드러내고 있었다. 추세 점수는 주가의 상승 모멘텀이 어느정도 인가를 나타낸다. 아세아시멘트는 특히 중기추세 측면에서 가장 높은 점수는 기록했는데, 전체 시장 내 82위를 기록하며 상위 4.07%에 위치했다. 업종별로는 21위를 기록하며 상위 5.83%에 위치했다. 그러나 기업의 이익 실현 정도를 나타내는 수익성 측면에서는 아쉬움을 나타냈다. (위의 AI인공지능 점수는 재무 데이터를 기반으로 전체 상장 종목과 비교/분석하여 도출한 점수로 높은 점수가 반드시 높은 수익률을 보장하지 않습니다. 위의 자료는 당사의 추천 종목이 아니며, 투자 시 참고용으로 제시해드리는 것입니다. 핵심투자지표를 결합해 종목의 투자매력도를 종합 계산한 ""인공지능 투자점수""는 ""거장들의 투자공식"" 앱에서 확인하실 수 있습니다.) 라이온봇 기자 -한국경제TV※ 본 기사는 한국경제TV와 '거장들의 투자공식이'자체 개발한 '라이온봇 기자'가 실시간으로 작성한 기사입니다. 라이온봇기자 ⓒ 한국경제TV, 무단 전재 및 재배포 금지 한국경제TV 관련뉴스해당 언론사에서 선정하며 언론사 페이지(아웃링크)로 이동해 볼 수 있습니다.중국 못지 않은 베트남 '공안'…호텔 벨보이도 조심하라휴가철 피부화상, 감자팩·오이팩 잘못 하면 낭패메시도 호날두도 없다…BBC ""남은 선수 중 최고는""올해 집값 가장 많이 오른 지역은?...최대 하락폭은 '이 곳'갑자기 많아진 새치…'20대'라면 이 것 때문"
데일리안,183190,/news/news_read.nhn?article_id=0002227639&office_id=119&mode=search&query=아세아시멘트&page=1,2017-12-12 10:11,"[특징주]아세아시멘트, 한라시멘트 인수 확정에 상승세",아세아시멘트가 한라시멘트 인수를 확정지었다는 소식에 장초반 상승세다. 12일 10시3분 현재 아세아시멘트는 유가증권 시장에서 전 거래일보다 3500원(2.8%) 오른 12만8500원에 거래 중이다. 전날 장 마감 후 아시아시멘트는 한라시멘트 주식 2499만9992주를 3651억1300만원에 양수한다고 공시했다. 아세아시멘트의 국내 시멘트 시장 점유율은 7위(7.2%)로 점유율 11.9%인 한라시멘트를 인수하면 19.1%가 되면서 쌍용양회(19.2%)에 이어 2위로 올라선다.
아시아경제,183190,/news/news_read.nhn?article_id=0003940266&office_id=277&mode=search&query=아세아시멘트&page=1,2017-02-24 17:08,"아세아시멘트, 주당 1500원 현금배당",[아시아경제 노태영 기자]아세아시멘트는 보통주 1주당 1500원의 현금배당을 결정했다고 24일 공시했다.
한국경제,183190,/news/news_read.nhn?article_id=0003848779&office_id=015&mode=search&query=아세아시멘트&page=1,2017-11-10 09:23,"[마켓인사이트]아세아시멘트, 한라시멘트 품는다..우협 선정",이 기사는 11월10일(09:22) 자본시장의 혜안 ‘마켓인사이트’에 게재된 기사입니다 ----------------------------------------------------------- 아세아시멘트가 국내 시멘트업계 재편 과정에서 마지막 대형 매물로 꼽히는 한라시멘트를 인수한다. 현재 7위인 아세아시멘트의 시장 점유율이 단숨에 1위 수준으로 높아질 전망이다. 10일 투자은행(IB) 업계 등에 따르면 한라시멘트 매각을 추진하고 있는 베어링 프라이빗에쿼티아시아(PEA)는 이날 오전 우선협상대상자로 아세아시멘트를 선정했다. 매각 대상은 베어링 PEA가 보유한 경영권 지분 98.5%와 소액주주 지분 1.5%를 포함한 보통주 100%다. 양측은 조만간 주식매매계약(SPA)을 체결할 계획이다. 한국시멘트협회에 따르면 국내 시멘트 시장 점유율은 지난해 쌍용양회(19.2%)와 삼표시멘트(14.2%) 성신양회(14.0%) 순이었다. 아세아시멘트는 7.2%로 7위에 머물렀다. 시장점유율 11.9%의 한라시멘트를 인수하면 1위인 쌍용양회와 어깨를 나란히 하게 된다. 내륙 시멘트 운송 중심의 아세아시멘트가 해안 운송에 강점을 지닌 한라시멘트를 인수하면 유통망 확장 등 시너지 효과도 기대할만 하다는 게 업계 평가다. 베어링PEA는 지난해 4월 글랜우드PE와 컨소시엄을 구성해 한라시멘트를 인수했다. 글랜우드는 지난해말과 지난 5월 두 차례에 걸쳐 지분을 베어링PEA에 팔아 투자금을 회수했다. 베어링PEA는 지난 8월 씨티글로벌마켓증권을 매각 주관사로 선정하고 매각작업에 뛰어들었다. 한라시멘트는 지난해 매출 4706억원에 상각전 영업이익(EBITDA) 864억원을 올렸다. 앞서 진행한 예비입찰에선 아세아시멘트 성신양회 아주산업 등 전략적 투자자(SI) 세 곳과 사모펀드(PEF) 운용사인 LK투자파트너스까지 총 네 곳이 쇼트리스트(적격인수후보)에 선정됐다. 베어링PEA는 연내 거래 완료(클로징)를 목표로 하고 있다. 잔금이 계획대로 납입되면 베어링PEA는 국내에선 처음으로 바이아웃(경영권 매매) 거래로 투자금 회수(exit)에 성공하게 된다. 내년에 계획 중인 아시아 펀드 조성에도 파란 불이 켜질 전망이다.
한국경제TV,183190,/news/news_read.nhn?article_id=0000630271&office_id=215&mode=search&query=아세아시멘트&page=1,2018-05-04 11:07,"아세아시멘트, 전일 대비 약 8% 상승한 154,000원","[한국경제TV 라이온봇 기자] 아세아시멘트는 5월 4일 11시 6분 전일 대비 약 8% 상승한 154,000원에 거래되고 있다. 아세아시멘트는 코스피 상장 기업으로 비금속광물 업종에 속해 있다. 시가총액은 5,551억원으로 코스피 상장기업 중 252위에 위치 해 있다. [종목 성향 진단] [그림 1] 종목 성향 진단 아세아시멘트의 투자 스타일은 가치주에 가깝다. 기업 가치 대비 낮은 주가가 매력적인 기업이다. 주가 모멘텀은 굉장히 좋은 편이었다. 최근 6개월 수익률이 무려 67.18%의 상승폭을 기록했다. 최근 1개월 수익률 또한 43.65% 상승하며 굉장히 좋은 모멘텀을 보이고 있다. 아세아시멘트 종목에 대한 투자자의 관심도는 높은 편에 속한다. [투자 점수 진단] [그림 2] 투자 점수 진단 아세아시멘트는 저평가성1(PER) 측면에서 두각을 나타내고 있다. 최근 PER은 91점으로 6개의 핵심 팩터 중 가장 높은 점수를 기록했다. PER은  전체 시장 내 161위를 기록하며 상위 8.67%에 위치했다. 업종별로는 32위를 기록하며 상위 9.42%에 위치했다. 그리고 효율성(ROA) 역시 도드라지는 편이다. 효율성 점수는 87점으로 두번째로 높은 점수를 기록했다. ROA는 전체 시장 내 259위를 기록하며 상위 13.24%에 위치했다. 업종별로는 36위를 기록하며 상위 10.39%에 위치했다. 그러나 매출증가율(YoY)이 아쉬움을 나타냈다. [종합 투자점수] [그림 3] 종합 투자점수 AI 인공지능 분석을 통한 아세아시멘트의 종목 종합 스코어는 81점을 기록했다. 이는 동일 업종 평균점수인 60점과 시장 평균점수인 59점를 상회하는 수치였다. (위의 AI인공지능 점수는 재무 데이터를 기반으로 전체 상장 종목과 비교/분석하여 도출한 점수로 높은 점수가 반드시 높은 수익률을 보장하지 않습니다. 위의 자료는 당사의 추천 종목이 아니며, 투자 시 참고용으로 제시해드리는 것입니다.) 라이온봇 기자 -한국경제TV※ 본 기사는 한국경제TV와 '거장들의 투자공식이'자체 개발한 '라이온봇 기자'가 실시간으로 작성한 기사입니다. 라이온봇기자 ⓒ 한국경제TV, 무단 전재 및 재배포 금지 한국경제TV 관련뉴스해당 언론사에서 선정하며 언론사 페이지(아웃링크)로 이동해 볼 수 있습니다.충남 청양에서 잡힌 '대형 메기', 크기가 무려…홍윤화 다이어트 식단 공개, 건강하게 살 빼는 비결 무엇?이명희 '임산부' 갑질…""조선시대 노비 다루듯""美 '최악의 연쇄살인' 풀렸다…소름돋는 범인 정체왕빛나 서구적 몸매 비결…'20kg을 한 번에?'"
파이낸셜뉴스,183190,/news/news_read.nhn?article_id=0003902847&office_id=014&mode=search&query=아세아시멘트&page=1,2017-11-09 09:26,"[fnRASSI]아세아시멘트, 52주 신고가...5.17% &uarr;","아세아시멘트(183190)는 52주신고가를 기록하고 있어 주목할만하다. 동종목의 현재 주가는 93,500원 선에서 이루어지고 있다. 거래일을 기준으로 최근 3일간 평균 거래량은 1만 주이다. 이는 60일 일 평균 거래량 5,060만 주와 비교해보면 최근 거래량이 급격히 늘어났다는 것을 알 수 있다. 외국인투자자 연속 5일 순매도 최근 5일간 동종목의 외국인 투자자는 10,332주 순매수하였고 반면 기관은 5,409주 순매도하였다. 전날 외국인 1,781주 순매수, 기관5,409주 순매도하며 보유 비율이 변동했다. 다음 표는 동종목의 외국인, 기관의 일별 순매수량을 나타낸 것이다. 기관과 개인은 순매도, 외국인은 순매수(한달누적)  기관이 6일연속 주식을 팔고 있는 반면 외국인은 5일연속 주식을 사고 있다. 4주간을 기준으로 보면 외국인이 25,023주를 순매수한 반면, 기관은 매도쪽으로 방향을 잡으면서 16,648주를 순매도했고, 개인들도 매도 후 매수의 관점을 보이고 있음에도 불구하고 8,375주를 순매도한 것으로 집계됐다. 'fnRASSI'는 증권전문 기업 씽크풀과 파이낸셜뉴스의 협업으로 로봇기자가 실시간으로 생산하는 기사입니다."
