source,symbol,link,date,title,content
한국경제TV,183190,/news/news_read.nhn?article_id=0000605346&office_id=215&mode=search&query=아세아시멘트&page=1,2018-02-23 13:17,"아세아시멘트, 전일 대비 약 -3% 하락한 110,000원","[한국경제TV 라이온봇 기자] 아세아시멘트는 2월 23일 13시 16분 전일 대비 약 -3% 하락한 110,000원에 거래되고 있다. 아세아시멘트는 코스피 상장 기업으로 비금속광물 업종에 속해 있다. 시가총액은 3,740억원으로 코스피 상장기업 중 316위에 위치 해 있다. [종목 성향 진단] [그림 1] 종목 성향 진단 아세아시멘트의 투자 스타일은 가치주에 가깝다. 기업 가치 대비 낮은 주가가 매력적인 기업이다. 주가 모멘텀은 부진한 편이었다. 최근 1개월 수익률은 -6.97%의 하락폭을 기록했다. 아세아시멘트 종목에 대한 투자자의 관심도는 평범한 수준이었다. [투자 점수 진단] [그림 2] 투자 점수 진단 아세아시멘트는 저평가성1(PER) 측면에서 두각을 나타내고 있다. 최근 PER은 96점으로 6개의 핵심 팩터 중 가장 높은 점수를 기록했다. PER은  전체 시장 내 73위를 기록하며 상위 3.86%에 위치했다. 업종별로는 19위를 기록하며 상위 5.52%에 위치했다. 그리고 저평가성2(PBR) 역시 도드라지는 편이다. 저평가성2 점수는 94점으로 두번째로 높은 점수를 기록했다. PBR은 전체 시장 내 105위를 기록하며 상위 5.58%에 위치했다. 업종별로는 21위를 기록하며 상위 6.06%에 위치했다. 그러나 매출증가율(YoY)이 아쉬움을 나타냈다. [종합 투자점수] [그림 3] 종합 투자점수 AI 인공지능 분석을 통한 아세아시멘트의 종목 종합 스코어는 92점을 기록했다. 이는 동일 업종 평균점수인 58점과 시장 평균점수인 57점를 상회하는 수치였다. (위의 AI인공지능 점수는 재무 데이터를 기반으로 전체 상장 종목과 비교/분석하여 도출한 점수로 높은 점수가 반드시 높은 수익률을 보장하지 않습니다. 위의 자료는 당사의 추천 종목이 아니며, 투자 시 참고용으로 제시해드리는 것입니다.) 라이온봇 기자 -한국경제TV※ 본 기사는 한국경제TV와 '거장들의 투자공식이'자체 개발한 '라이온봇 기자'가 실시간으로 작성한 기사입니다. 라이온봇기자 ⓒ 한국경제TV, 무단 전재 및 재배포 금지 한국경제TV 관련뉴스해당 언론사에서 선정하며 언론사 페이지(아웃링크)로 이동해 볼 수 있습니다.판커신 나쁜손 ""인정 못해""…中누리꾼 최민정 SNS에 악플테러'원조 청순女' 강수지 성형고백…'자연 미인 아니었나?'이윤택 기자회견 리허설, 짜고치기 고스톱?""법적 대응한다더니..."" 송하늘 조민기 성추행 폭로 '반전'왁스, 절친 홍석천 사생활 폭로? ""클럽 가면 사라진다"""
파이낸셜뉴스,183190,/news/news_read.nhn?article_id=0003911657&office_id=014&mode=search&query=아세아시멘트&page=1,2017-11-23 11:50,"[fnRASSI]아세아시멘트(183190), 52주 신고가...5.71% &uarr;","아세아시멘트(183190)는 52주신고가를 기록하고 있어 주목할만하다. 동종목의 현재 주가는 129,500원 선에서 이루어지고 있다. 거래일을 기준으로 최근 3일간 평균 거래량은 6만 주이다. 이는 60일 일 평균 거래량 2만 주와 비교해보면 최근 거래량이 급격히 늘어났다는 것을 알 수 있다. 외국인, 기관 모두 보유량 증가 (5일 누적) 최근 5일간 동종목의 외국인 투자자는 5,285주 순매수하였고 마찬가지로 기관은 13,671주 순매수하였다. 전날 외국인 921주 순매도, 기관13,671주 순매수하며 보유 비율이 변동했다. 다음 표는 동종목의 외국인, 기관의 일별 순매수량을 나타낸 것이다. 주가등락폭은 다소 큰 편 최근 한달간 아세아시멘트의 상장주식수 대비 거래량을 비교해보니 일별 매매회전율이 1.74%로 집계됐다. 동기간 일평균 주가변동률은 7.95%로 장중 저점과 고점의 차이가 매우 컸음을 알 수 있다. 'fnRASSI'는 증권전문 기업 씽크풀과 파이낸셜뉴스의 협업으로 로봇기자가 실시간으로 생산하는 기사입니다."
한국경제,183190,/news/news_read.nhn?article_id=0003813552&office_id=015&mode=search&query=아세아시멘트&page=1,2017-08-23 17:45,"아세아시멘트, 한라시멘트 인수전 참여",자문사로 산업은행 선정인수 땐 단숨에 업계 3위로 도약 [ 정영효 기자  ] 시멘트 업계 6위 아세아시멘트가 5위인 한라시멘트 인수전에 뛰어든다. 23일 투자은행(IB)업계에 따르면 아세아시멘트는 산업은행을 인수자문사로 선정하고 다음달 중순으로 예정된 예비입찰에 참여하기 위해 준비작업을 하고 있다. 한라시멘트는 지분 100%를 갖고 있는 사모펀드(PEF) 운용사 베어링프라이빗에쿼티아시아가 인수 1년여 만에 투자금 회수에 나서면서 매물로 나왔다. 씨티그룹글로벌마켓증권이 매각주관사를 맡아 잠재적 인수 후보들에 투자안내문(IM)을 보내고 있다. 감가상각비 차감전 영업이익(EBITDA)이 약 1000억원이어서 매각 가격은 7000억~8000억원에 달할 것으로 예상된다. 8.3%의 시장점유율(2015년 말 기준)을 가진 아세아시멘트가 한라시멘트(점유율 12.7%)를 인수하면 점유율이 20%를 넘어선다. 한일시멘트(25.1%·지난달 인수한 현대시멘트 포함)와 쌍용양회(22.2%)에 이어 단숨에 3위 회사로 도약한다. 한라시멘트 현대시멘트 동양시멘트 쌍용양회 등이 인수합병(M&A) 시장에 나오면서 업계가 지각변동을 겪는 동안 아세아시멘트는 상대적으로 조용한 행보를 이어왔다. 한라시멘트마저 다른 대형사에 팔리면 시장점유율면에서 경쟁사에 완전히 뒤처지게 된다는 위기감이 아세아시멘트를 인수전에 끌어들였다는 분석이 나온다. 내륙에 생산시설을 둔 아세아시멘트가 해안에 생산시설을 가진 한라시멘트를 인수했을 때 시너지 효과가 큰 점도 감안한 것으로 보인다. 관건은 유진 삼표그룹 등 경쟁사들에 비해 약세로 평가받는 자금력이다. IB업계에선 한일시멘트가 PEF인 LK투자파트너스와 짝을 이뤄 현대시멘트를 사들인 사례처럼 아세아시멘트가 재무적 투자자(FI)를 끌어들일 가능성이 있는 것으로 보고 있다.
머니투데이,183190,/news/news_read.nhn?article_id=0003728447&office_id=008&mode=search&query=아세아시멘트&page=1,2016-08-18 08:42,"아세아시멘트, 경쟁 심화...목표가 하향-하나","[머니투데이 오정은 기자] 하나금융투자는 18일 아세아시멘트에 대해 골조용 건자재 호황으로 생산량이 급증했으나 경쟁 심화로 시멘트 판가 하락이 나타났다고 밝혔다. 당분간 가격 인상이 어려울 거라며 보수적인 주가 흐름을 예상했다. 투자의견 매수를 유지하고 목표주가를 10만원으로 하향조정했다. 채상욱 하나금융투자 연구원은 ""아세아시멘트의 2분기 영업이익은 236억원으로 전년비 5.6% 감소했다""며 ""매출액은 1283억원으로 전년비 0.7% 줄었다""고 말했다. 부문별로 시멘트는 매출 716억원으로 전년비 8.1% 감소했고 레미콘은 매출 352억원으로 전년비 10% 증가했다.몰탈부문은 매출 54억원으로 전년비 23% 감소했다. 채 연구원은 ""아세아시멘트의 2분기 클링커생산량은 108.8만톤으로 가동율이 98.7%에 이르러 사실상 완전 가동을 했다""며 ""생산량은 24.3% 증가하며 호황을 증명했지만 시멘트 판가가 작년 대비 5%대 하락하며 생산량 증가 효과를 상쇄했다""고 설명했다. 이어 ""이런 현상은 내륙 시멘트 3사에 공통적으로 나타나 경쟁 심화의 결과로 판단된다""며 ""시멘트업이 갖는 구조적 강점은 당분간 지속되겠지만 향후 가격 변동이 주가의 핵심이 될 것이다""고 예상했다. textlinktopstart textlinktopend textlinkstart"
한국경제TV,183190,/news/news_read.nhn?article_id=0000625685&office_id=215&mode=search&query=아세아시멘트&page=1,2018-04-23 13:07,"아세아시멘트, 5거래일 연속 상승... 전일 대비 4% 상승","[한국경제TV 라이온봇 기자] 아세아시멘트는 현재 5거래일 연속 상승세를 기록하고 있어 주목할 만하다. 아세아시멘트는 4월 23일 13시 7분 전일 대비 약 4% 상승한 133,500원에 거래되고 있다. 아세아시멘트는 코스피 상장 기업으로 비금속광물 업종에 속해 있다. 시가총액은 4,986억원으로 코스피 상장기업 중 261위에 위치 해 있다. [종목 성향 진단] [그림 1] 종목 성향 진단 아세아시멘트의 투자 스타일은 가치주에 가깝다. 기업 가치 대비 낮은 주가가 매력적인 기업이다. 주가 모멘텀은 좋은 편에 속했다. 최근 6개월 수익률은 48.29%의 상승폭을 기록했다. 최근 1개월 수익률 또한 26.11% 상승하며 좋은 모멘텀을 보이고 있다. 아세아시멘트 종목에 대한 투자자의 관심도는 굉장히 높은 편이다. [투자 점수 진단] [그림 2] 투자 점수 진단 아세아시멘트는 저평가성1(PER) 측면에서 두각을 나타내고 있다. 최근 PER은 94점으로 6개의 핵심 팩터 중 가장 높은 점수를 기록했다. PER은  전체 시장 내 116위를 기록하며 상위 6.22%에 위치했다. 업종별로는 27위를 기록하며 상위 8.25%에 위치했다. 그리고 저평가성2(PBR) 역시 도드라지는 편이다. 저평가성2 점수는 87점으로 두번째로 높은 점수를 기록했다. PBR은 전체 시장 내 252위를 기록하며 상위 13.47%에 위치했다. 업종별로는 58위를 기록하며 상위 17.92%에 위치했다. 그러나 매출증가율(YoY)이 아쉬움을 나타냈다. [종합 투자점수] [그림 3] 종합 투자점수 AI 인공지능 분석을 통한 아세아시멘트의 종목 종합 스코어는 89점을 기록했다. 이는 동일 업종 평균점수인 56점과 시장 평균점수인 56점를 상회하는 수치였다. (위의 AI인공지능 점수는 재무 데이터를 기반으로 전체 상장 종목과 비교/분석하여 도출한 점수로 높은 점수가 반드시 높은 수익률을 보장하지 않습니다. 위의 자료는 당사의 추천 종목이 아니며, 투자 시 참고용으로 제시해드리는 것입니다.) 라이온봇 기자 -한국경제TV※ 본 기사는 한국경제TV와 '거장들의 투자공식이'자체 개발한 '라이온봇 기자'가 실시간으로 작성한 기사입니다. 라이온봇기자 ⓒ 한국경제TV, 무단 전재 및 재배포 금지 한국경제TV 관련뉴스해당 언론사에서 선정하며 언론사 페이지(아웃링크)로 이동해 볼 수 있습니다.왕빛나 서구적 몸매 비결…'20kg을 한 번에?'유병자 실손보험, 삼성화재 '가장 비싸'쏘가리 가격 '확' 떨어진다…22년 연구 끝에 '대량양식' 성공박하선 '다이어트 성공' 인증샷 ""웰컴백 44사이즈""손은서♥이주승 열애 인정, '연상녀-연하남커플' 합류"
연합뉴스,183190,/news/news_read.nhn?article_id=0008622159&office_id=001&mode=search&query=아세아시멘트&page=1,2016-08-18 08:30,하나금투 &quot;아세아시멘트 이익증가 기대감 낮아&hellip;목표가&darr;&quot;,"(서울=연합뉴스) 유현민 기자 = 하나금융투자는 18일 판매가격 하락으로 아세아시멘트의 수익이 늘 것이라는 기대감이 낮다며 목표주가를 14만원에서 10만원으로 내렸다. 채상욱 연구원은 ""아세아시멘트의 올해 2분기 클링커생산량은 108만8천t으로 가동률이 98.7%에 달한다""면서 ""생산량이 24.3% 증가해 수량 측면에서 최고 호황임을 증명했다""고 분석했다. 그는 ""그러나 1분기 6만7천443원이던 시멘트 판매가격이 반기 평균 6만6천40원으로 하락해 2분기에는 약 6만5천원 수준인 것으로 판단된다""면서 ""작년의 6만8천원에 비해 5% 정도 가격이 하락해 생산량 증가 효과를 상쇄시켰다""고 설명했다. 채 연구원은 ""이는 성신양회, 한일시멘트, 아세아시멘트 등 내륙 시멘트 3사에 공통적으로 나타나는 현상""이라면서 ""경쟁 심화의 결과""라고 판단했다. 그는 ""시멘트업이 갖는 구조적 강점은 당분간 지속되겠지만 수량보다는 가격 변동이 향후 주가에 영향을 줄 것""이라면서 지난해의 담합 과징금으로 당분간 가격인상이 어려운 상황이어서 보수적인 주가 흐름을 전망한다고 덧붙였다."
이데일리,183190,/news/news_read.nhn?article_id=0003967308&office_id=018&mode=search&query=아세아시멘트&page=1,2017-11-10 11:30,"아세아시멘트, 한라시멘트 우선협상대상자 선정",[이데일리 송주오 기자] 아세아시멘트(183190)는 한라시멘트 우선협상대상자로 선정됐다고 10일 공시했다.
머니투데이,183190,/news/news_read.nhn?article_id=0003539324&office_id=008&mode=search&query=아세아시멘트&page=1,2015-09-08 17:24,"국민연금, 아세아시멘트 지분 10.04% 보유","[머니투데이 박종진 기자] 국민연금공단이 아세아시멘트 지분 10.04%, 33만815주를 보유하고 있다고 8일 공시했다. textlinktopstart textlinktopend textlinkstart"
이데일리,183190,/news/news_read.nhn?article_id=0003496764&office_id=018&mode=search&query=아세아시멘트&page=1,2016-03-10 16:55,"아세아시멘트, 보통주 1주당 1500원 현금배당 결정",[이데일리 장종원 기자] 아세아시멘트(183190)는 보통주 1주당 1500원을 현금배당한다고 10일 공시했다. 배당금총액은 49억 4200만원으로 배당기준일은 2015년 12월 31일이다.
한국경제TV,183190,/news/news_read.nhn?article_id=0000625454&office_id=215&mode=search&query=아세아시멘트&page=1,2018-04-23 10:09,"아세아시멘트, 10% 급등... 전일 보다 12,500원 상승한 140,500원","[한국경제TV 라이온봇 기자] 아세아시멘트는 4월 23일 10시 8분 전일 대비 약 10% 급등한 140,500원에 거래되고 있다. 아세아시멘트는 코스피 상장 기업으로 비금속광물 업종에 속해 있다. 시가총액은 4,986억원으로 코스피 상장기업 중 261위에 위치 해 있다. [종목 성향 진단] [그림 1] 종목 성향 진단 아세아시멘트의 투자 스타일은 가치주에 가깝다. 기업 가치 대비 낮은 주가가 매력적인 기업이다. 주가 모멘텀은 좋은 편에 속했다. 최근 6개월 수익률은 48.29%의 상승폭을 기록했다. 최근 1개월 수익률 또한 26.11% 상승하며 좋은 모멘텀을 보이고 있다. 아세아시멘트 종목에 대한 투자자의 관심도는 높은 편에 속한다. [투자 점수 진단] [그림 2] 투자 점수 진단 아세아시멘트는 저평가성1(PER) 측면에서 두각을 나타내고 있다. 최근 PER은 94점으로 6개의 핵심 팩터 중 가장 높은 점수를 기록했다. PER은  전체 시장 내 116위를 기록하며 상위 6.22%에 위치했다. 업종별로는 27위를 기록하며 상위 8.25%에 위치했다. 그리고 저평가성2(PBR) 역시 도드라지는 편이다. 저평가성2 점수는 87점으로 두번째로 높은 점수를 기록했다. PBR은 전체 시장 내 252위를 기록하며 상위 13.47%에 위치했다. 업종별로는 58위를 기록하며 상위 17.92%에 위치했다. 그러나 매출증가율(YoY)이 아쉬움을 나타냈다. [종합 투자점수] [그림 3] 종합 투자점수 AI 인공지능 분석을 통한 아세아시멘트의 종목 종합 스코어는 89점을 기록했다. 이는 동일 업종 평균점수인 56점과 시장 평균점수인 56점를 상회하는 수치였다. (위의 AI인공지능 점수는 재무 데이터를 기반으로 전체 상장 종목과 비교/분석하여 도출한 점수로 높은 점수가 반드시 높은 수익률을 보장하지 않습니다. 위의 자료는 당사의 추천 종목이 아니며, 투자 시 참고용으로 제시해드리는 것입니다.) 라이온봇 기자 -한국경제TV※ 본 기사는 한국경제TV와 '거장들의 투자공식이'자체 개발한 '라이온봇 기자'가 실시간으로 작성한 기사입니다. 라이온봇기자 ⓒ 한국경제TV, 무단 전재 및 재배포 금지 한국경제TV 관련뉴스해당 언론사에서 선정하며 언론사 페이지(아웃링크)로 이동해 볼 수 있습니다.왕빛나 서구적 몸매 비결…'20kg을 한 번에?'유병자 실손보험, 삼성화재 '가장 비싸'쏘가리 가격 '확' 떨어진다…22년 연구 끝에 '대량양식' 성공박하선 '다이어트 성공' 인증샷 ""웰컴백 44사이즈""손은서♥이주승 열애 인정, '연상녀-연하남커플' 합류"
뉴시스,183190,/news/news_read.nhn?article_id=0008460392&office_id=003&mode=search&query=아세아시멘트&page=1,2018-02-26 16:48,"아세아시멘트, 주당 1500원 현금배당 결정","【서울=뉴시스】장서우 기자 = 아세아시멘트(183190)는 보통주 1주당 1500원을 현금 결산배당키로 결정했다고 26일 공시했다. 시가배당율은 1.3%, 배당금 총액은 49억4172만원이다."
한국경제,183190,/news/news_read.nhn?article_id=0003939036&office_id=015&mode=search&query=아세아시멘트&page=1,2018-05-14 19:03,[Hot Stock] 아세아시멘트,14일 유가증권시장에서 1만8000원(11.46%) 오른 17만5000원에 마감했다. 지난 주말 마이크 폼페이오 미국 국무장관이 “북한이 핵 프로그램을 완전히 폐기하면 미국의 민간 투자를 허용할 것”이라고 밝힌 뒤 시멘트 등 사회간접자본(SOC) 관련주에 매수세가 몰렸다는 분석이다. [
연합뉴스,183190,/news/news_read.nhn?article_id=0009743461&office_id=001&mode=search&query=아세아시멘트&page=1,2017-12-11 17:30,"아세아시멘트, 한라시멘트 3천651억원에 인수",(서울=연합뉴스) 권수현 기자 = 아세아시멘트는 시멘트산업 경쟁력 강화를 위해 한라시멘트 지분 100%를 3천651억여원에 양수하기로 했다고 11일 공시했다.
한국경제TV,183190,/news/news_read.nhn?article_id=0000635422&office_id=215&mode=search&query=아세아시멘트&page=1,2018-05-17 11:08,"아세아시멘트, 12% 급등... 전일 보다 21,000원 상승한 191,500원","[한국경제TV 라이온봇 기자] 아세아시멘트는 5월 17일 11시 7분 전일 대비 약 12% 급등한 191,500원에 거래되고 있다. 아세아시멘트는 코스피 상장 기업으로 비금속광물 업종에 속해 있다. 시가총액은 6,642억원으로 코스피 상장기업 중 234위에 위치 해 있다. [종목 성향 진단] [그림 1] 종목 성향 진단 아세아시멘트의 투자 스타일은 가치주에 가깝다. 기업 가치 대비 낮은 주가가 매력적인 기업이다. 주가 모멘텀은 굉장히 좋은 편이었다. 최근 1개월 수익률이 무려 74.69%의 상승폭을 기록했다. 아세아시멘트 종목에 대한 투자자의 관심도는 굉장히 높은 편이다. [투자 점수 진단] [그림 2] 투자 점수 진단 아세아시멘트는 저평가성1(PER) 측면에서 두각을 나타내고 있다. 최근 PER은 91점으로 6개의 핵심 팩터 중 가장 높은 점수를 기록했다. PER은  전체 시장 내 161위를 기록하며 상위 8.67%에 위치했다. 업종별로는 32위를 기록하며 상위 9.42%에 위치했다. 그리고 효율성(ROA) 역시 도드라지는 편이다. 효율성 점수는 87점으로 두번째로 높은 점수를 기록했다. ROA는 전체 시장 내 259위를 기록하며 상위 13.24%에 위치했다. 업종별로는 36위를 기록하며 상위 10.39%에 위치했다. 그러나 매출증가율(YoY)이 아쉬움을 나타냈다. [종합 투자점수] [그림 3] 종합 투자점수 AI 인공지능 분석을 통한 아세아시멘트의 종목 종합 스코어는 78점을 기록했다. 이는 동일 업종 평균점수인 58점과 시장 평균점수인 58점를 상회하는 수치였다. (위의 AI인공지능 점수는 재무 데이터를 기반으로 전체 상장 종목과 비교/분석하여 도출한 점수로 높은 점수가 반드시 높은 수익률을 보장하지 않습니다. 위의 자료는 당사의 추천 종목이 아니며, 투자 시 참고용으로 제시해드리는 것입니다.) 라이온봇 기자 -한국경제TV※ 본 기사는 한국경제TV와 '거장들의 투자공식이'자체 개발한 '라이온봇 기자'가 실시간으로 작성한 기사입니다. 라이온봇기자 ⓒ 한국경제TV, 무단 전재 및 재배포 금지 한국경제TV 관련뉴스해당 언론사에서 선정하며 언론사 페이지(아웃링크)로 이동해 볼 수 있습니다.문가비 월드비키니대회 우승자 이력 '둔갑'""몸이 허락할 때까지 낳겠다"" 장윤정 둘째 임신정려원 고백, '불같았던' 열애 상대 누구?엄지원 남편, 엄친아에 빌딩 부자…엄지원 부친은 '더 대박'홍수아 올 망사?…'이쯤되면 대륙여신'"
한국경제TV,183190,/news/news_read.nhn?article_id=0000624825&office_id=215&mode=search&query=아세아시멘트&page=1,2018-04-20 12:08,"아세아시멘트, 5거래일 연속 상승... 전일 대비 1% 상승","[한국경제TV 라이온봇 기자] 아세아시멘트는 현재 5거래일 연속 상승세를 기록하고 있어 주목할 만하다. 아세아시멘트는 4월 20일 12시 7분 전일 대비 약 1% 상승한 126,500원에 거래되고 있다. 아세아시멘트는 코스피 상장 기업으로 비금속광물 업종에 속해 있다. 시가총액은 4,869억원으로 코스피 상장기업 중 262위에 위치 해 있다. [종목 성향 진단] [그림 1] 종목 성향 진단 아세아시멘트의 투자 스타일은 가치주에 가깝다. 기업 가치 대비 낮은 주가가 매력적인 기업이다. 주가 모멘텀은 좋은 편에 속했다. 최근 6개월 수익률은 46.31%의 상승폭을 기록했다. 최근 1개월 수익률 또한 24.38% 상승하며 좋은 모멘텀을 보이고 있다. 아세아시멘트 종목에 대한 투자자의 관심도는 굉장히 높은 편이다. [투자 점수 진단] [그림 2] 투자 점수 진단 아세아시멘트는 저평가성1(PER) 측면에서 두각을 나타내고 있다. 최근 PER은 94점으로 6개의 핵심 팩터 중 가장 높은 점수를 기록했다. PER은  전체 시장 내 116위를 기록하며 상위 6.22%에 위치했다. 업종별로는 27위를 기록하며 상위 8.25%에 위치했다. 그리고 저평가성2(PBR) 역시 도드라지는 편이다. 저평가성2 점수는 87점으로 두번째로 높은 점수를 기록했다. PBR은 전체 시장 내 252위를 기록하며 상위 13.47%에 위치했다. 업종별로는 58위를 기록하며 상위 17.92%에 위치했다. 그러나 매출증가율(YoY)이 아쉬움을 나타냈다. [종합 투자점수] [그림 3] 종합 투자점수 AI 인공지능 분석을 통한 아세아시멘트의 종목 종합 스코어는 89점을 기록했다. 이는 동일 업종 평균점수인 56점과 시장 평균점수인 56점를 상회하는 수치였다. (위의 AI인공지능 점수는 재무 데이터를 기반으로 전체 상장 종목과 비교/분석하여 도출한 점수로 높은 점수가 반드시 높은 수익률을 보장하지 않습니다. 위의 자료는 당사의 추천 종목이 아니며, 투자 시 참고용으로 제시해드리는 것입니다.) 라이온봇 기자 -한국경제TV※ 본 기사는 한국경제TV와 '거장들의 투자공식이'자체 개발한 '라이온봇 기자'가 실시간으로 작성한 기사입니다. 라이온봇기자 ⓒ 한국경제TV, 무단 전재 및 재배포 금지 한국경제TV 관련뉴스해당 언론사에서 선정하며 언론사 페이지(아웃링크)로 이동해 볼 수 있습니다.'억대 수입' 이사배, 과거 공개한 '럭셔리' 하우스 봤더니유병자 실손보험, 삼성화재 '가장 비싸'쏘가리 가격 '확' 떨어진다…22년 연구 끝에 '대량양식' 성공박하선 '다이어트 성공' 인증샷 ""웰컴백 44사이즈""손은서♥이주승 열애 인정, '연상녀-연하남커플' 합류"
