source,symbol,link,date,title,content
이데일리,183490,/news/news_read.nhn?article_id=0003358701&office_id=018&mode=search&query=엔지켐생명과학&page=1,2015-10-01 15:49,"엔지켐생명과학-충청도, 오송 단지 투자 MOU 체결","[이데일리 박기주 기자] 바이오제약 기업 엔지켐생명과학은 1일 충북도청과 오송 제2생명과학단지에 연구 및 생산 통합 캠퍼스 건립을 위한 MOU를 맺었다고 밝혔다. 이번 협약식을 통해 엔지켐생명과학은 2022년까지 815억원을 투자해 혁신적 글로벌 바이오 제약기업에 걸맞은 통합캠퍼스를 건립하겠다고 밝혔다. 2022년에 완공될 엔지켐생명과학 통합캠퍼스(6만㎡)에는 연구시설과 최첨단 생산설비, 기숙사 등 부대시설이 들어설 예정이다. 엔지켐생명과학 관계자는 “대전과 제천에 분산 운영돼 온 연구조직과 생산시설을 통합하고 ‘혁신적 글로벌 바이오 제약기업의 비전’을 실현하기 위해 수년전부터 통합캠퍼스 건립을 추진해왔다”며 “통합 캠퍼스 건립은 세계 최고를 향한 글로벌 바이오제약 기업 위상 확보와 오송 바이오벨트의 글로벌 제약사 유치에 촉매 역할을 할 것”이라고 밝혔다. 한편 엔지켐생명과학이 개발에 박차를 가하고 있는 ‘항암치료 시 호중구 감소증 치료’는 2017년 신약개발을 목표로 미국과 국내에서 임상시험을 동시에 진행하고 있다. 또한 지난해 말 신약물질인 피엘에이지(PLAG)를 기반으로 한 건강기능식품 ‘록피드“를 출시해 판매하고 있고, 이는 복용효과에 대한 데이터 축적과 피엘에이지(PLAG)의 글로벌 신약개발 성공에 큰 기여를 할 것으로 전망하고 있다."
서울경제,183490,/news/news_read.nhn?article_id=0003229246&office_id=011&mode=search&query=엔지켐생명과학&page=1,2018-02-23 10:15,"(코)엔지켐생명과학, 전일 대비 7.45% 상승.. 일일회전율은 1.67% 기록","[서울경제] 엔지켐생명과학(183490) 은 23일 오전 10시 14분 현재 7.45% 오른 89,400원에 거래되고 있으며, 32(매도):68(매수)의 매수우위를 기록하고 있다. 거래대금은 110억2,130만, 거래량은 12만7,307주로 거래량회전율은 1.67%로 나타났다. 지난 1개월간 엔지켐생명과학은 하락 2회를 기록했고, 주가수익률은 0% 표준편차는 0.14%를 기록했다. 이 기간 ' 제약업 ' 업종 평균 주가수익률은 0.58%로 나타났으며, 변동성은 3.48%를 기록했다. 이 시각 현재 ' 제약업 '은 1.07% 상승 중이며, 51(매도):49(매수)의 매도우위를 기록하고 있다."
아시아경제,183490,/news/news_read.nhn?article_id=0003595085&office_id=277&mode=search&query=엔지켐생명과학&page=1,2015-10-01 15:40,"엔지켐생명과학-충북, 종합 연구&middot;생산 캠퍼스 투자 MOU 체결","[아시아경제 정준영 기자] 코넥스 상장 바이오제약 기업 엔지켐생명과학은 1일 오송 제2생명과학단지에 연구 및 생산 통합 캠퍼스를 세우기 위한 MOU를 충청북도와 맺었다고 밝혔다. 협약식엔 이시종 충청북도지사, 이승훈 청주시장, 전상헌 충청북도경제자유구역청장, 엔지켐생명과학 경영진이 참석했다. 엔지켐생명과학은 2022년까지 815억원을 투자해 혁신적 글로벌 바이오 제약기업에 걸맞은 통합캠퍼스를 건립할 계획이다. 통합캠퍼스가 완공되면 6만㎡ 부지에 연구시설과 최첨단 생산설비는 물론 기숙사 등 부대시설이 들어서게 된다. 1999년 설립된 엔지켐생명과학의 기업부설연구소는 현재 대전 카이스트 산학협력단 내에 등록되어 있다. 2008년 4월과 2012년 11월 각각 충북 제천에 제1, 제2 GMP 생산시설을 세웠다. 엔지켐생명과학 관계자는 ”대전과 제천에 분산 운영되어 온 연구조직과 생산시설을 통합하고 ‘혁신적 글로벌 바이오 제약기업의 비전’을 실현하기 위해 수년전부터 통합캠퍼스 건립을 추진해왔다”며 “통합 캠퍼스 건립은 세계 최고를 향한 글로벌 바이오제약 기업 위상 확보와 오송 바이오벨트의 글로벌 제약사 유치에 촉매 역할을 할 것으로 전망한다“고 밝혔다. 엔지켐생명과학은 2017년 신약개발을 목표로 미국과 국내에서 ‘항암치료 시 호중구 감소증 치료’관련 임상시험을 동시 진행하고 있다. 또 신약물질인 피엘에이지(PLAG)를 기반으로 한 건강기능식품 ‘록피드’를 작년 말 출시해, 국내외 매출증대는 물론 캐나다, 중국 등 4개 국가에 라이센싱을 추진 중이다. 엔지켐생명과학은 록피드 판매가 복용효과 데이터 축적 및 PLAG의 신약개발 성공에도 기여할 것으로 기대하고 있다."
서울경제,183490,/news/news_read.nhn?article_id=0003228100&office_id=011&mode=search&query=엔지켐생명과학&page=1,2018-02-22 09:06,"엔지켐생명과학, 코스닥 이틀째에도 하락흐름","[서울경제] 엔지켐생명과학(183490) 이 코스닥 상장 이틀째에도 주가 하락 흐름을 보이고 있다. 22일 9시 4분 현재 엔지켐생명과학은 전거래일 대비 2.93% 하락한 8만 2,700원에 거래 중이다. 엔지켐생명과학은 전날 코넥스 시장에서 코스닥 시장으로 이전 상장했다. 21일에는 코넥스 종가 대비 주가가 2.07% 하락했는데 이틀 연속 주가가 떨어지는 모습이다."
헤럴드경제,183490,/news/news_read.nhn?article_id=0001357235&office_id=016&mode=search&query=엔지켐생명과학&page=1,2018-02-22 09:40,"엔지켐생명과학, 코스닥 입성 이틀 연속 하락세","[헤럴드경제=최준선 기자] 전날 코넥스에서 코스닥으로 이전상장을 마무리한 엔지켐생명과학이 이틀 연속 하락세를 기록 중이다. 22일 오전 9시 30분 현재 코스닥 시장에서 엔지켐생명과학은 전날보다 4.46% 내린 8만1400원에 거래되고 있다. 전날 엔지켐생명과학은 공모가(5만6000원)보다 55% 이상 높은 8만7000원에 거래를 시작했으나, 시초가 대비 2.07% 하락 마감한 바 있다. 코스닥 입성 이후 이틀 연속 하락세를 기록하고 있는 것이다. 엔지켐생명과학은 기초 의약물질 및 생물학적 제제 제조업체다. [사진=게티이미지]"
연합뉴스,183490,/news/news_read.nhn?article_id=0007887253&office_id=001&mode=search&query=엔지켐생명과학&page=1,2015-10-01 10:04,"엔지켐생명과학, 오송2단지에 816억원 투자","㈜엔지켐, 제천 제2공장 준공  &lt;&lt;연합뉴스 DB&gt;&gt;  (청주=연합뉴스) 전창해 기자 = 충북도와 청주시는 1일 청주 오송 제2생명과학단지에 투자할 중견 바이오제약기업인 ㈜엔지켐생명과학과 816억원 규모의 투자협약을 체결했다. 이날 협약에 따라 엔지켐생명과학은 오는 2022년까지 오송 제2생명과학단지 내 6만㎡ 부지에 R&D시설과 생산시설, 기숙사 등 종합캠퍼스 건립을 추진한다. 특히 이 기업은 시설 준공 시점에 맞춰 500여명의 인력을 충원할 계획인데 도내 거주자에게 우선권을 주기로 도와 약속했다. 1999년 대전을 본사로 설립된 엔지켐생명과학은 글로벌신약개발, 원료의약품, 건강기능식품 등의 사업 분야에서 두각을 나타내고 있다. 이 기업은 충북 제천에 제1·2공장이 있다."
이데일리,183490,/news/news_read.nhn?article_id=0004038378&office_id=018&mode=search&query=엔지켐생명과학&page=1,2018-02-19 17:35,코넥스 123개 종목 거래..거래대금 1위 엔지켐생명과학,"[이데일리 김대웅 기자] 19일 코넥스 시장에서 123개 종목이 거래됐다. 거래대금 1위는 엔지켐생명과학으로 집계됐다. 한국거래소에 따르면 이날 코넥스 상장종목 151개 중 가격이 형성된 종목은 124개로 나타났다. 이중 1개 종목은 호가만 형성됐을 뿐 거래로 연결되지 못했다. 123개 종목만 거래됐다. 전 거래일보다 가격이 오른 종목은 66개, 하락한 종목은 44개, 보합은 14개로 조사됐다. 앙츠, 씨앗, 구름게임즈앤컴퍼니, 씨앤에스링크, 대동고려삼, 비나텍, 에이원알폼, 데카시스템 등 8개 종목은 상한가를 기록했고 인터코스, 옐로페이 등 2개 종목은 하한가로 떨어졌다. 거래대금은 92억1000만원으로 전 거래일에 비해 8억6000만원 감소했다. 거래량은 41만5000주로 2만6000주 줄었다. 거래대금 1위는 엔지켐생명과학으로 33억1720만원이 거래됐다. 툴젠(19억5280만원), 카이노스메드(9억3570만원)가 그 뒤를 이었다. 투자자별로 보면 기관이 2억5000만원 순매도했고 개인이 2억8000만원 순매수했다. 전체 시가총액은 6조7578억원으로 400억원 증가했다. 시가총액 1위~3위는 툴젠(9556억원), 엔지켐생명과학(6063억원), 노브메타파마(4656억만원)로 집계됐다."
서울경제,183490,/news/news_read.nhn?article_id=0003113510&office_id=011&mode=search&query=엔지켐생명과학&page=1,2017-09-15 16:19,"엔지켐생명과학, 코스닥 이전 상장 결정",[서울경제] 엔지켐생명과학(183490)은 코스닥 시장으로 이전 상장한다고 15일 공시했다. 이전 상장 사유는 기업가치 제고와 원활한 자금 조달 및 주식의 유동성 확보다. 예비심사청구일정은 9월 중이다.
이데일리,183490,/news/news_read.nhn?article_id=0003928082&office_id=018&mode=search&query=엔지켐생명과학&page=1,2017-09-20 17:37,코넥스 108개 거래&hellip;거래대금 1위 &lsquo;엔지켐생명과학&rsquo;,"[이데일리 윤필호 기자] 20일 코넥스 시장에서 108개 종목이 거래됐다. 거래대금 1위는 엔지켐생명과학으로 조사됐다. 이날 한국거래소에 따르면 150개 코넥스 상장종목 중 113개 종목의 가격이 형성됐다. 5개 종목을 제외한 108개 종목만 거래됐다. 전일보다 가격이 오른 종목은 57개, 하락한 종목은 45개, 보합권에서 거래된 종목은 11개로 나타났다. 썬테크, 옐로페이, 씨이랩, 비디아이 등 6개 종목이 상한가를 기록했고 굿센, 씨앤에스링크, 그린플러스 등 5개 종목은 하한가를 보였다. 거래량은 13만8000주로 전일보다 6만9000주 감소했고 거래대금은 10억9000만원으로 1억2000만원 줄었다. 거래대금 1~3위는 엔지켐생명과학(3억24670만원), 툴젠(3억1520만원), 오스텍오닉(1억1620만원)으로 집계됐다. 투자자별로 보면 기관과 외국인이 각각 2700만원, 1110만원 순매수를 보였고 개인과 기타법인이 각각 1400만원, 2410만원 순매도를 기록했다. 전체 시가총액은 4조482억원으로 전일보다 116억원 증가했다. 시가총액 1~3위 종목은 엔지켐생명과학(2529억1000만원), 하우동천(2137억원), 툴젠(2120억7000만원)으로 집계됐다."
머니S,183490,/news/news_read.nhn?article_id=0000296703&office_id=417&mode=search&query=엔지켐생명과학&page=1,2018-02-19 17:59,"엔지켐생명과학, 21일 코스닥 상장","한국거래소는 엔지켐생명과학의 코스닥 시장 신규상장을 승인한다고 19일 밝혔다. 매매는 오는 21일부터 개시된다. 공모가는 5만6000원, 액면가는 500원이다. 공모금액은 431억원이며 상장 주관사는 한국투자증권이다. 엔지켐생명과학은 기초 의약물질 및 생물학적 제제 제조업체로 2016년 별도 재무제표 기준 매출액 218억원, 당기순손실 63억원을 기록했다."
한국경제,183490,/news/news_read.nhn?article_id=0003889070&office_id=015&mode=search&query=엔지켐생명과학&page=1,2018-02-04 18:39,동구바이오&middot;엔지켐생명과학 청약 접수,"이번주 공모주 [ 이고운 기자  ] 이번주(2월5~9일)에는 3개 공모기업이 청약에 나선다. 피부과 질환 의약품 회사인 동구바이오제약의 일반청약일은 5~6일이다. 수요예측(기관투자가 대상 사전청약)에서 좋은 성적을 내며 희망가격 범위(1만2000~1만4500원)보다 높은 1만6000원으로 공모가를 확정했다. 수요예측 경쟁률은 727.7 대 1이었다. 참여수량의 53.41%는 상장 후 일정 기간 주식을 팔지 않겠다는 보호예수 조건을 걸었다. 동구바이오제약은 피부·비뇨기과 처방 의약품 생산을 주력으로 하면서 제네릭(복제약) 개발, 의약품 수탁생산(CMO) 등을 하고 있다. 코넥스시장에서 코스닥으로 이전 상장하는 엔지켐생명과학과 오스테오닉은 8~9일 청약을 받는다. 엔지켐생명과학은 원료의약품과 신약 개발사업을 하는 회사다. 항암치료의 부작용 중 하나인 호중구(백혈구 구성 성분 중 하나) 감소증 치료제와 구강점막염 치료제 등을 개발하고 있다. 희망 공모가 범위는 4만5000~7만원이다. 공모가는 7일 확정해 공시할 계획이다. 대표주관사는 한국투자증권이다. 오스테오닉은 정형외과·성형외과 시술에 쓰이는 의료기기를 제조하는 회사다. 두개골과 안면의 성형 및 재건에 쓰이는 장치 등이 주력제품이다. 국내에서 처음으로 퇴행성 디스크 치료 등에 활용되는 관절보존 장치 제품을 선보였다. 희망 공모가 범위는 5800~7500원으로 6일 공모가를 확정 공시할 예정이다. 키움증권이 대표주관사를 맡았다."
이데일리,183490,/news/news_read.nhn?article_id=0003883703&office_id=018&mode=search&query=엔지켐생명과학&page=1,2017-07-26 16:25,"코넥스, 114개 종목 거래..엔지켐생명과학 거래대금 1위","[이데일리 오희나 기자] 코넥스 시장에서 엔지켐생명과학이 가장 활발하게 거래된 것으로 나타났다. 26일 한국거래소에 따르면 코넥스시장에서 150개 종목 중 114개 종목 가격이 형성됐다. 47개 종목이 올랐으며 58개가 내렸다. 9개 종목은 보합권에 머물렀다. 소프트캠프, 케이피에스, 피엠디아카데미, 대주이엔티, 루켄테크놀러지스, 바이오프로테크, 코셋, 캐로스 등 8개 종목이 상한가를 기록했다. 엠로, 지성이씨에스, 뿌리깊은나무들, 이엠티, 에듀케이션파트너, 패션플랫폼, 유비온, 나눔테크, 볼빅, 유투바이오, 세종머티리얼즈, 세기리텍 등 12개 종목은 하한가를 기록했다. 종목별 거래대금으로는 엔지켐생명과학이 2억7090만원으로 가장 많았고, 로보쓰리 1억3680만원, 툴젠이 1억1940만원으로 그 뒤를 이었다. 시가총액은 전거래일보다 383억원 감소한 4조1050억원을 기록했다. 시총 상위 종목은 엔지켐생명과학(2188억원), 하우동천(2016억원), 툴젠(1821억원) 순이다. 투자자별로는 기관이 6900만원 순매수를 기록했고 개인이 6500만원 순매도를 기록했다. 코넥스 거래대금은 전거래일 대비 5000만원 감소한 9억3000만원을 기록했다. 거래량은 2만9000주 감소한  10만2000주로 집계됐다."
머니투데이,183490,/news/news_read.nhn?article_id=0003996561&office_id=008&mode=search&query=엔지켐생명과학&page=1,2018-01-23 08:16,"엔지켐생명과학, '재상장 추진'은 투자자 보호 위한 선택-케이프","[머니투데이 신아름 기자] 케이프투자증권은 23일 엔지켐생명과학에 대해 ""지난 19일 상장철회신고서를 제출한 것은 기존투자자 보호를 위한 불가피한 선택""이었다고 평가했다. 김형수 연구원은 ""철회신고서를 제출한 19일 당일 엔지켐생명과학 주가는 7만9900원으로 증권신고서 제출일인 2017년 12월 15일 주가(4만8250원) 대비 65.6% 상승해 큰 괴리율이 발생했다""며 ""상장철회신고서 제출 후 곧바로 22일 증권신고서를 제출해 재상장을 추진함으로써 빠른 이전상장 절차를 밟고 있다""고 평가했다. 엔지켐생명과학은 지난 15일과 16일 수요예측 결과 748대 1의 경쟁률과 4만5000원 이상의 가격 참여수량 91.28%를 차지했다. 의무보유확약의사를 밝힌 수량도 42.46%로 기관투자자들의 높은 관심을 받았다. 이에 엔지켐생명과학은 19일 공모가액 미확정을 이유로 공모 일정 연기를 결정했고, 22일 공모희망가액을 높여 '증권신고서'를 다시 제출, 코스닥 이전상장 재추진에 돌입했다. 공모희망가액은 기존 2만7000원~3만7000원에서 4만5000원~7만원으로 변경됐다. 오는 2월 5~6일 수요예측을 거쳐 8~9일 청약. 21일 코스닥 상장을 준비 중이다. 김 연구원은 ""엔지켐생명과학은 원료사업분야 등을 통해 안정적인 현금흐름을 창출할 수 있을 것""이라며 ""코넥스 현재가 8만원으로 공모기준가보다 여전히 높은 수준""이라고 평가했다. 한편, 엔지켐생명과학은 녹용유래 합성화학물질(EC-18)로 호중구감소증, 구강점막염, 급성방사선증후군 3가지 적응증으로 신약을 개발 중이다. 3가지 적응증은 혁신신약(Breakthrough therapy), 신속심사(Fast Track), 희귀질환치료제(Orphan drug)로 지정이 가능해 임상 2상 후 상업화가 가능하다. 특히 급성방사선증후군은 2017년 12월 23일 미국 FDA로부터 희귀질환치료제로 지정 받아 빠른 상업화가 기대된다."
뉴시스,183490,/news/news_read.nhn?article_id=0008184781&office_id=003&mode=search&query=엔지켐생명과학&page=1,2017-09-18 16:41,"엔지켐생명과학, 코스닥 이전상장 예비심사 청구서 제출",【서울 =뉴시스】남빛나라 기자 = 코넥스 대장주인 엔지켐생명과학(183490)은 코스닥시장 상장을 위한 상장예비심사 청구서를 제출했다고 18일 공시했다. 상장주선은 한국투자증권이 맡았으며 이전상장 시기는 12월로 예정됐다.
머니투데이,183490,/news/news_read.nhn?article_id=0003995949&office_id=008&mode=search&query=엔지켐생명과학&page=1,2018-01-22 07:41,엔지켐생명과학 &quot;코스닥 이전 상장 절차 진행&quot;,"[머니투데이 유엄식 기자] 엔지켐생명과학은 22일 ""코스닥 시장 이전 상장 및 공모를 위해 지난해 12월 15일 증권신고서를 제출했으나 발행가격 요건 간 괴리가 발생해 공모가격을 확정하지 못했다""며 ""지난 1월 19일자로 증권신고서를 철회했고 최대한 빠른 시간 내에 발행가격 요건을 고려해 코스닥 이전 상장 절차를 차질 없이 진행할 예정""이라고 공시했다."
이데일리,183490,/news/news_read.nhn?article_id=0003884973&office_id=018&mode=search&query=엔지켐생명과학&page=1,2017-07-27 18:06,코넥스 110개 종목 거래..거래대금 1위 `엔지켐생명과학`,"[이데일리 최정희 기자] 27일 코넥스 시장에선 150개 종목 중 118개 종목의 가격이 형성됐다. 이중 8개 종목은 호가만 제시됐을 뿐 거래로 이어지지 못했다. 그 결과 110개 종목만 거래됐다. 한국거래소에 따르면 전 거래일보다 51개 종목의 가격이 올랐고 56개 종목은 하락했다. 11개는 보합권에서 거래를 마쳤다. 피엠디아카데미, 데카시스템 등 7개 종목은 상한가를 기록했고 그린플러스, 볼빅 등 7개는 하한가를 보였다. 거래대금은 9억원으로 전 거래일보다 3000만원이 감소했고 거래량은 13만7000주로 3만5000주가 늘어났다. 거래대금 1위는 엔지켐생명과학(1억8930만원)으로 조사됐고 그 뒤를 툴젠(1억5750만원), 선바이오(1억760만원)가 이었다. 투자자별로 보면 외국인과 개인이 각각 1580만원, 3830만원 순매수를 보였다. 기관과 기타법인은 각각 4470만원, 950만원 순매도했다. 전체 시가총액은 4조900억원으로 전일보다 151억원이 감소했다. 시가총액 1~3위는 엔지켐생명과학(2191억7000만원), 하우동천(2083억2000만원), 툴젠(1841억8000만원)으로 집계됐다."
이데일리,183490,/news/news_read.nhn?article_id=0003885671&office_id=018&mode=search&query=엔지켐생명과학&page=1,2017-07-28 17:00,"코넥스, 116개 거래&hellip;엔지켐생명과학 거래대금 1위","[이데일리 박정수 기자] 28일 코넥스시장에서는 150개 상장종목 가운데 122개 종목의 가격이 형성됐다. 가격은 형성됐으나 거래로 연결되지 않은 기세종목 6개를 제외하면 실제 거래 체결 종목은 116개다. 이날 거래량은 10만6000주로 전 거래일 대비 3만1000주 감소했고, 거래대금은 3억6000만원 줄어든 5억4000만원으로 집계됐다. 거래대금 1위 종목은 엔지켐생명과학으로 1억4730만원을 기록했다. 이어 피엔아이시스템(5670만원), 툴젠(4280만원) 순으로 나타났다. 시가총액은 전 거래일보다 195억원 감소한 4조704억원을 기록했다. 시총 상위 종목은 엔지켐생명과학(2211억원), 하우동천(2016억원),  툴젠(1833억원) 순이다. 투자자별로는 개인과 기타법인이 각각 1220만원, 170만원 순매도했고 기관이 1390만원 순매수했다."
아시아경제,183490,/news/news_read.nhn?article_id=0004044217&office_id=277&mode=search&query=엔지켐생명과학&page=1,2017-07-28 14:53,"엔지켐생명과학, 구강점막염 치료 'EC-18' 임상2상 美FDA 승인","[아시아경제 박미주 기자]엔지켐생명과학이 구강점막염 치료를 위한 'EC-18'의 임상2상 시험이 미국 식품의약국(FDA)의 IND 승인을 받았다고 28일 공시했다. 회사는 ""개발 중인 생체면역조절 신개념 치료제 EC-18은 임상연구 진행 후 개발 완료시 치료제 선점을 통한 임상가치의 극대화가 기대된다""며 ""2상 임상시험은 오는 4분기 중 개시할 예정이고, 그 중간 결과와 최종 결과를 활용해 기존 라이선싱 파트너들과 적극적인 라이선스 아웃을 추진할 계획""이라고 전했다."
뉴시스,183490,/news/news_read.nhn?article_id=0008404883&office_id=003&mode=search&query=엔지켐생명과학&page=1,2018-01-22 08:09,엔지켐생명과학 &quot;코스닥 이전 상장 절차 차질 없이 진행&quot;,"【서울=뉴시스】장서우 기자 = 코넥스 상장사 엔지켐생명과학(183490)은 ""최대한 이른 시일 내에 발행가액 요건을 고려해 증권신고서를 제출하고 코스닥 이전 상장 절차를 차질 없이 진행할 예정""이라고 22일 공시했다. 회사 측은 ""증권신고서 제출 이후 주가 변동으로 수요예측 결과와 발행가액 요건 간 괴리가 발생해 공모가격을 확정하지 못했다""며 지난 19일 증권신고서를 철회한 사유를 설명했다. 당초 엔지켐생명과학은 한국투자증권 주관으로 오는 31일 코스닥 시장으로 이전 상장될 예정이었다. 지난 15~16일 국내·외 기관투자자를 대상으로 진행된 수요예측에선 918개 기관이 참여해 748.05:1의 경쟁률을 보였다."
아시아경제,183490,/news/news_read.nhn?article_id=0004162668&office_id=277&mode=search&query=엔지켐생명과학&page=1,2018-01-22 09:01,엔지켐생명과학 &quot;코스닥 이전상장 차질 없이 완료할 것&quot;,"[아시아경제 권성회 기자] 글로벌 신약개발기업 엔지켐생명과학이 19일 증권신고서를 철회하는 철회신고서 제출 이후, 빠른 시간 내에 코스닥 이전 상장 절차를 완료할 것이라고 22일 밝혔다. 엔지켐생명과학은 지난달 15일 제출한 증권신고서를 바탕으로 지난 15일부터 16일 양일간 국내?외 기관투자자를 대상으로 수요예측을 실시했다. 수요예측 결과는 총 918개 국?내외 기관투자자가 참여해, 748.05:1의 경쟁률을 보였으며, 4만5000원 이상의 가격을 제시한 비중은 총 참여 수량의 91.28%, 의무보유확약의 비중은 총 참여 수량의 42.46%를 기록했다. 그러나 증권신고서 제출부터 수요예측 결과까지 순조롭게 진행되던 엔지켐생명과학은 19일 철회신고서를 제출하며 향후 남은 일정을 취소했다. 이는 증권신고서 제출 이후 변동된 코넥스 주가로 증권 인수업무 등에 관한 규정 제5조에 따른 수요예측 결과와 증권의 발행 및 공시 등에 관한 규정 제5-18조에서 정하는 발행가액 요건 간 괴리가 발생해 공모가를 확정하지 못했기 때문이다. 증권 인수 업무 등에 관한 규정에 따르면 수요예측을 포함한 몇 가지 방법으로 공모가격을 결정할 수 있도록 하고 있다. 코스닥 신규 상장 종목 및 이전상장 종목의 경우에는 수요예측을 통해 가격을 결정하지만, 주권 상장 법인은 기준주가의 30% 이내로 할인율을 결정하도록 규정돼 있다. 엔지켐생명과학 역시 증권 인수 업무 등에 관한 규정에 따른 수요예측 결과와 증권의 발행 및 공시 등에 관한 규정에 따른 할인율을 모두 충족할 것을 금융감독원으로 요구받아 이를 충족하기 위해 지난달 제출한 증권신고서를 철회한 것이다. 엔지켐생명과학 관계자는 “우리의 내부적인 사업 진행과 근본적인 역량에 관한 이슈가 아니기 때문에 빠르면 22일 증권신고서를 제출해 코스닥 이전 상장을 차질없이 완료할 예정”이라고 밝혔다."
