source,symbol,link,date,title,content
이데일리,183490,/news/news_read.nhn?article_id=0003866429&office_id=018&mode=search&query=엔지켐생명과학&page=1,2017-07-04 16:43,"코넥스, 109개 거래&hellip;엔지켐생명과학 거래대금 1위","[이데일리 박정수 기자] 4일 코넥스시장에서는 149개 상장종목 가운데 118개 종목의 가격이 형성됐다. 가격은 형성됐으나 거래로 연결되지 않은 기세종목 9개를 제외하면 실제 거래 체결 종목은 109개다. 이날 거래량은 15만4000주로 전 거래일 대비 6만9000주 감소했고, 거래대금은 9억6000만원 줄어든 7억3000만원으로 집계됐다. 거래대금 1위 종목은 엔지켐생명과학으로 1억580만원을 기록했다. 이어 라온테크(9030만원), 카이노스메드(8020만원) 순으로 나타났다. 시가총액은 전 거래일보다 465억원 감소한 4조1064억원을 기록했다. 시총 상위 종목은 엔지켐생명과학(2120억원), 툴젠(1827억원), 하우동천(1565억원) 순이다. 투자자별로는 기관과 외국인이 각각 260만원, 100만원 순매수했고, 개인이 970만원 순매도했다."
서울경제,183490,/news/news_read.nhn?article_id=0003202332&office_id=011&mode=search&query=엔지켐생명과학&page=1,2018-01-19 18:25,"엔지켐생명과학, 공모가 이견에 상장 철회 결정&middot;&middot;&middot;추후로 연기",[서울경제] 이달 코스닥 시장에 상장 예정이었던 엔지켐생명과학이 상장을 전격 철회했다. 주관사와 발행사 간 공모가에 대한 이견 차이 때문이다. 엔지켐생명과학은 19일 “공모가액 확정을 위한 수요예측을 실시했으나 확정예정이었던 공모가액이 산출한 발행가액과의 괴리로 공모가액을 확정하지 못함에 따라 이번 공모를 추후로 연기하는 것으로 결정했다”고 공시했다. 코넥스 대장주 엔지켐생명과학은 한국투자증권을 주관사로 이달 말 상장할 예정이었다.
이데일리,183490,/news/news_read.nhn?article_id=0003867411&office_id=018&mode=search&query=엔지켐생명과학&page=1,2017-07-05 17:05,"코넥스, 113종목 거래&hellip;거래대금 1위는 엔지켐생명과학","[이데일리 윤필호 기자] 5일 코넥스시장에서는 149개 상장종목 가운데 119개 종목의 가격이 형성됐다. 가격은 형성됐으나 거래로 연결되지 않은 기세종목 6개를 제외하면 실제 거래 체결 종목은 113개다. 이날 거래량은 12만3000주로 전 거래일 대비 3만1000주 감소했고, 거래대금은 5000만원 늘어난 7억8000만원으로 집계됐다. 거래대금 1위 종목은 엔지켐생명과학으로 2억2130만원을 기록했다. 이어 하우동천(1억510만원), 다이오진(5260만원) 순으로 나타났다. 시가총액은 전 거래일보다 27억원 증가한 4조1091억원을 기록했다. 시총 상위 종목은 엔지켐생명과학(2195억원), 툴젠(1792억원), 하우동천(1579억원) 순이다. 투자자별로는 기관이 7810만원 순매도 했고, 외국인과 개인이 각각 270만원, 1억390만원 순매수했다."
코메디닷컴,183490,/news/news_read.nhn?article_id=0000034656&office_id=296&mode=search&query=엔지켐생명과학&page=1,2018-02-07 18:18,"엔지켐생명과학, 공모가 5만6000원 확정","신약 개발 기업 엔지켐생명과학(대표 손기영)이 지난 5~6일 기관 투자자를 대상으로 진행한 수요 예측 결과 공모가가 5만6000원으로 최종 확정됐다고 7일 밝혔다. 이번 수요 예측에는 총 518곳에 달하는 기관 투자자들이 참여해 259대 1의 경쟁률을 보였으며 5만6000원 이상 비중은 96.27%를 기록했다. 공모가는 5만6000원, 총 공모 금액은 431억 원으로 확정됐다. 엔지켐생명과학 손기영 대표는 ""이번 공모가 확정은 증권 발행 및 공시 규정에 따라 코넥스 기준 주가에 최대 할인율과 수요 예측 결과를 모두 충족하면서 공모주 투자자 이익을 최대한 고려할 수 있도록 결정했다""며 ""이번 코스닥 이전 상장을 계기로 마련된 공모 자금은 호중구 감소증 치료제, 구강 점막염 치료제 및 급성 방사선 증후군(ARS) 치료제 임상 2상 시험에 주로 사용할 계획""이라고 밝혔다. 이어서 손기영 대표는 ""신약 개발에 반드시 성공해 2020년에는 신약 개발 기업이 아닌 신약 보유 기업으로 도약할 것""이라고 포부를 밝혔다. 엔지켐생명과학의 주관사 한국투자증권 관계자는 ""기관 투자자의 많은 기대 덕분에 미국 증시 영향으로 국내 증시가 불안한 상황 속에서도 성공적으로 수요 예측을 마칠 수 있었다""고 밝혔다. 엔지켐생명과학 일반 투자자 공모주 청약은 오는 2월 8일~9일 양일간 진행된다. 전체 공모 물량 가운데 20%인 약 15만4000주가 배정될 예정이다. 일반 투자자는 주관사인 한국투자증권을 통해 청약을 신청할 수 있다. 엔지켐생명과학은 이달 21일 코스닥 시장에 이전 상장될 예정이다."
이데일리,183490,/news/news_read.nhn?article_id=0004016849&office_id=018&mode=search&query=엔지켐생명과학&page=1,2018-01-22 18:18,"코넥스, 129개 종목거래..거래대금 1위 엔지켐생명과학","[이데일리 김대웅 기자]코스닥 이전 상장이 보류된 엔지켐생명과학이 22일 코넥스 시장에서 가장 활발하게 거래됐다. 이날 한국거래소에 따르면 코넥스시장에서 154개 종목 중 129개 종목 가격이 형성됐다. 51개 종목이 올랐으며 65개가 내렸다. 13개 종목은 보합권에 머물렀다. 비플라이소프트, 씨케이컴퍼니, 세종머티리얼즈, 나눔테크, 코셋, 뿌리깊은나무들 등 6개 종목은 상한가를 기록했다. 노브메타파마, 크로넥스, 케이엠제약, 휴럼, 대주이엔티, 데카시스템, 유비온, 지성이씨에스 등 8개 종목은 하한가를 기록했다. 종목별 거래대금으로는 엔지켐생명과학이 36억1720만원으로 가장 많았고 툴젠이 23억4410만원, 노브메타파마가 20억1340만원으로 그 뒤를 이었다. 전체 시가총액은 전거래일보다 1701억원 감소한 6조6055억원을 기록했다. 시총 상위 종목은 툴젠(7353억원) 엔지켐생명과학(5468억원) 노브메타파마(4708억원) 순이다. 투자자별로는 기관이 1억2100만원 순매수했고, 개인이 2억4880만원 순매도를 기록했다. 코넥스 거래대금은 전거래일 대비 39억원 감소한 107억원을 기록했다. 거래량은 14만5000주 감소한 47만2000주로 집계됐다."
한국경제,183490,/news/news_read.nhn?article_id=0003890984&office_id=015&mode=search&query=엔지켐생명과학&page=1,2018-02-07 18:57,[마켓인사이트]'공모가 재산정 해프닝' 엔지켐생명과학 가격 확정,"엔지켐생명과학 공모가 5만6000원으로 확정코넥스 주가의 70% 수준으로 공모가를 맞춰야 한다는 금융당국 지침 맞추는데 성공 ≪이 기사는 02월07일(16:08) 자본시장의 혜안 ‘마켓인사이트’에 게재된 기사입니다≫ 코넥스 상장사인 엔지켐생명과학이 수요예측(기관투자가 대상 사전청약)을 다시 진행하는 우여곡절을 겪은 끝에 공모가를 확정했다. 코넥스 상장사가 코스닥시장으로 이전 상장할 경우 최근 코넥스 주가를 공모가에 반영해야 한다는 금융당국 지침이 나온 여파였다. 엔지켐생명과학은 가까스로 수요예측 결과와 금융당국 지침을 모두 맞추는 데 성공하면서 상장할 수 있게 됐지만, 투자은행(IB) 업계에서는 보완책을 마련해야 한다는 지적이 이어지고 있다. 7일 엔지켐생명과학은 공모가를 5만6000원으로 확정했다고 공시했다. 이날 종가(7만8000원)보다 2만2000원 낮은 가격으로, 회사가 제시했던 희망 공모가 범위(4만5000~7만원)의 중간값에 미치지 못하는 수준이다. 공모가 결정을 위해 지난 5~6일 실시한 수요예측 경쟁률은 258.68대 1로 집계됐다. 금융당국은 ‘증권의 발행 및 공시 등에 관한 규정’을 들며 엔지켐생명과학처럼 코넥스에서 코스닥으로 이전 상장할 때  최근 코넥스 주가(청약일 3~5일 전 평균 주가)의 70% 수준으로 공모가를 맞춰야 한다는 지침을 내렸다. 지난해 말만 해도 4만~5만원대였던 엔지켐생명과학의 주가가 지난달 8만원대로 폭등하면서, 원래 회사가 제시했던 희망 공모가 범위(2만7000~3만7000원)가 주가에 비해 지나치게 낮아 규정에 어긋난다는 지적이었다. 이 때문에 엔지켐생명과학은 지난달 수요예측까지 실시했다가 자진철회했고, 주가를 반영해 공모가를 높인 다음 재도전해야 했다. 금융당국이 제시한 규정에 맞추려면 엔지켐생명과학은 최근 주가의 70% 수준인 5만6000원 이상으로 공모가를 정해야 했는데, 수요예측 참여 수량의 96.27%가 이 가격 이상을 제시하면서 위기를 면하게 됐다. 대신 공모가가 높아지면서 지난달 15~16일 벌였던 수요예측에 비해서는 흥행 열기가 가라앉았다. 수요예측 참여 기관 수는 지난달 918곳에서 이번에 518곳으로 줄었고, 수요예측 경쟁률도 대폭 낮아졌다. 한 업계 관계자는 “수요예측 결과가 좋지 않은데도 코넥스 주가에 맞춰 기계적으로 공모가를 결정하는 건 현실에 맞지 않다”며 “코넥스 상장사의 경우 예외 규정을 두어야 할 것”이라고 말했다. 엔지켐생명과학은 8~9일 일반 청약을 받는다. 대표주관사는 한국투자증권이다."
이데일리,183490,/news/news_read.nhn?article_id=0003877221&office_id=018&mode=search&query=엔지켐생명과학&page=1,2017-07-18 16:55,"코넥스, 112개 종목 거래&hellip;엔지켐생명과학 거래대금 1위","[이데일리 오희나 기자] 코넥스 시장에서 엔지켐생명과학이 가장 활발하게 거래된 것으로 나타났다. 18일 한국거래소에 따르면 코넥스시장에서 149개 종목 중 112개 종목 가격이 형성됐다. 49개 종목이 올랐으며 53개가 내렸다. 10개 종목은 보합권에 머물렀다. 그린플러스가 유일하게 상한가를 기록했다. 플럼라인생명과학, 코셋, 제노텍, 유비온, 씨티네트웍스, 씨앤에스링크, 캐로스, 피엠디아카데미, 옐로페이, 티케이씨, 바이오프로테크 등 11개 종목은 하한가를 기록했다. 종목별 거래대금으로는 엔지켐생명과학이 9억3820만원으로 가장 많았고, 틸론이 5150만원, 하우동천이 5140만원으로 그 뒤를 이었다. 시가총액은 전거래일보다 336억원 증가한 4조1067억원을 기록했다. 시총 상위 종목은 엔지켐생명과학(2113억원), 툴젠(1934억원), 하우동천(1720억원) 순이다. 투자자별로는 개인이 1억9000만원 순매수를 기록했고 기관투자가가 1억7000만원 순매도를 기록했다. 코넥스 거래대금은 전거래일 대비 5억3000만원 증가한 13억9000만원을 기록했다. 거래량은 6만2000주 감소한  11만5000주로 집계됐다."
이데일리,183490,/news/news_read.nhn?article_id=0003878217&office_id=018&mode=search&query=엔지켐생명과학&page=1,2017-07-19 16:35,"코넥스, 106개 거래&hellip;엔지켐생명과학 거래대금 1위","[이데일리 이후섭 기자] 19일 코넥스시장에서는 149개 상장종목 중 114개 종목의 가격이 형성됐다. 가격은 형성됐으나 거래로 연결되진 않은 기세종목 8개를 제외하면 실제 거래 체결 종목은 106개다. 이날 거래량은 14만7000주로 전날대비 3만2000주 증가했고 거래대금은 5억2000만원 줄어든 8억7000만원으로 집계됐다. 거래대금 1위 종목은 엔지켐생명과학으로 3억4600만원을 기록했다. 이어 툴젠(1억3300만원), 피노텍(4900만원) 순으로 나타났다. 시가총액은 전날보다 83억원 증가한 4조11149억원을 기록했다. 시총 상위 종목은 엔지켐생명과학(2106억원), 툴젠(1915억원), 하우동천(1747억원) 순이다. 투자자별로는 기관이 1억1600만원 순매도한 반면 개인과 외국인은 각각 700만원, 200만원 순매수했다."
매일경제,183490,/news/news_read.nhn?article_id=0004086470&office_id=009&mode=search&query=엔지켐생명과학&page=1,2018-01-19 18:34,엔지켐생명과학 코스닥 이전 상장 보류&hellip;증권신고서 철회,"코넥스 주가 너무 올라 공모가 산정 어려워 코넥스 대장주 엔지켐생명과학이 코스닥 이전 상장 계획을 보류했다. 코넥스 주가가 지나치게 높아지면서 공모가 산정이 어려워졌기 때문이다. 19일 엔지켐생명과학은 금융감독원에 철회신고서를 제출했다. 이에 따르면 엔지켐생명과학은 공모가 확정을 위해 수요예측을 실시했다. 그러나 코넥스 평균 주가에서 30% 범위 이내 할인율을 산정해야 한다는 금융위원회 규정을 맞출 수 없었다. 당초 엔지켐생명과학이 제시한 희망 공모가는 2만7000원에서 3만7000원 사이다. 그러나 최근 급등세를 기록해 지난 16일 8만8600원까지 치솟았다. 19일 코넥스 시장에서 종가는 7만9900원이다. 이에 따라 엔지켐생명과학 측은 ""금번 공모를 추후로 연기하는 것으로 결정했다""면서 ""대표주관회사 등의 동의 하에 잔여 일정을 취소하고 철회신고서를 제출한다""고 밝혔다. 최근 코넥스 시장에서는 코스닥 이전 상장을 앞둔 종목들이 큰 오름세를 보였다. 링크제니시스, 오스테오닉도 코스닥 이전 상장 계획을 밝힌 뒤 상승세다. 다만 지나치게 코넥스 주가가 오르면 공모 과정 자체가 불가능해질 수 있다는 선례가 생겼다. [정우성 기자] r_start // r_end //"
조선비즈,183490,/news/news_read.nhn?article_id=0000401189&office_id=366&mode=search&query=엔지켐생명과학&page=1,2018-03-14 13:07,"美 FDA &quot;엔지켐생명과학 구강점막염 치료제, 신속심사 지정&quot;","엔지켐생명과학은 14일 미국 식품의약국(FDA)으로부터 자체 개발 중인 ‘EC-18(개발명)’이 화학 항암 치료 중 발생하는 입안의 염증이나 궤양인 구강점막염(Chemoradiation Induced Oral Mucositis)을 적응증으로 하는 의약품으로 ‘신속심사 지정(Fast Track Designation)’을 획득했다고 밝혔다. 신속심사 지정은 질병으로 상태가 심각하거나 생명을 위협받는 환자를 치료하는 약물이거나 미충족 의학적 수요가 있는 약물의 개발을 촉진하기 위해 임상시험용 의약품에 대해 신속한 검토 프로세스를 진행할 수 있도록 FDA가 약물을 지정하는 제도다. 일반적으로 신약의 경우 허가 서류 검토 과정에서 FDA가 요구하는 모든 조항의 자료와 허가 서류를 제출해야 하지만, 신속심사 지정을 획득한 의약품의 경우 동반 심사(Rolling Review)의 혜택에 따라 개별 조항별로 검토 서류를 제출할 수 있게 된다.  충북 제천시에 위치한 엔지켐생명과학 본사 전경. /엔지켐생명과학 제공 엔지켐생명과학이 신속심사 지정을 획득한 EC-18은 녹용에서 추출해 자체 합성한 유효성 물질이다. EC-18은 녹용 성분 중 0.002%가 포함된 ‘피엘에이지(PLAG)’라는 물질이 면역 활성화 기능이 있다는 것에 착안해 경구용(먹는)으로 개발 중인 화학합성 의약품이다. EC-18은 글로벌 임상 2상 중인 호중구감소증(혈액암의 일종) 치료제와 구강점막염 치료제를 비롯해 △급성 방사선 증후군(ARS) △류머티즘 관절염 △패혈증 △아토피 피부염 △천식 △건선 등 총 8가지 적응증을 대상으로 개발되고 있다. 류머티즘 관절염, 패혈증, 아토피 피부염, 천식, 건선 등을 적응증으로 하는 EC-18은 전임상(동물실험)을 완료한 상태다. 엔지켐생명과학(183490) 은 이번 FDA의 신속심사 지정에 대해 EC-18이 중증 구강점막염 치료 효능을 입증했기 때문이라고 설명했다. 또 획기적으로 부작용뿐 아니라 독성도 낮췄다고 덧붙였다. 손기영 엔지켐생명과학 대표는 “EC-18이 작년 12월 FDA로부터 급성 방사선 증후군 치료 희귀의약품으로 지정을 받은 데 이어 이번 구강점막염 치료제로 신속심사 지정을 획득하면서 임상 가속화와 글로벌 전략적 라이선스 아웃(기술 수출) 가능성을 높일 수 있을 것으로 기대한다”고 말했다."
한국경제,183490,/news/news_read.nhn?article_id=0003907064&office_id=015&mode=search&query=엔지켐생명과학&page=1,2018-03-14 14:10,"美 FDA, 엔지켐생명과학 구강염치료제 신속심사 대상으로 지정","[ 한민수 기자  ] 엔지켐생명과학은 'EC-18'이 미국 식품의약국(FDA)으로부터 항암화학방사선 유발 구강점막염 치료에 대한 신속심사 대상으로 지정됐다고 14일 밝혔다. 신속심사는 미충족 의학 수요 관련 약물 개발을 촉진하기 위해 FDA가 도입한 제도다. 신속심사 대상에 지정되면 신약 허가 검토 과정이 빨라진다. 엔지켐생명과학의 EC-18은 면역 조절의 기능을 가진 신약후보물질이다. 한국과 미국에서 임상 1상을 완료한 이후 항암제에 의한 호중구감소증 및 구강점막염에 대한 임상 2상을 진행 중이다. 신속심사 지정은 EC-18이 치료제가 없는 구강점막염에 대한 효능을 입증했기 때문이란 설명이다. 손기영 대표는 ""EC-18은 지난해 12월 FDA로부터 급성방사선증후군에 대해 희귀의약품으로 지정받은 데 이어, 이번 구강점막염 신속심사 지정으로 임상 가속화와 글로벌 기술수출을 더욱 촉진시킬 수 있게 됐다""고 말했다. 한민수 기자"
파이낸셜뉴스,183490,/news/news_read.nhn?article_id=0003982092&office_id=014&mode=search&query=엔지켐생명과학&page=1,2018-03-14 10:39,"[fnRASSI]엔지켐생명과학, 3.29% 오르며 거래량 증가","엔지켐생명과학(183490)은 당일 거래량 증가로 최근 5거래일 거래량의 최고치를 경신했다. 그리고 엔지켐생명과학은 3일 연속 상승흐름을 보이며, 10시 34분 현재 3.29% 증가한 87,800원에 거래중이다. 기관투자자 연속 2일 순매도 최근 5일간 동종목의 외국인 투자자는 8,778주 순매수하였고 마찬가지로 기관은 7,258주 순매수하였다. 전날 두 주체 각각 18,328주, 7,258주 순매수하며 보유 비율을 늘렸다. 다음 표는 동종목의 외국인, 기관의 일별 순매수량을 나타낸 것이다. 상장주식수 대비 거래량은 3.23%로 적정수준 최근 한달간 엔지켐생명과의 상장주식수 대비 거래량을 비교해보니 일별 매매회전율이 3.23%로 집계됐다. 그리고 동기간 장중 저점과 고점의 차이인 일평균 주가변동률을 3.55%를 나타내고 있다. 'fnRASSI'는 증권전문 기업 씽크풀과 파이낸셜뉴스의 협업으로 로봇기자가 실시간으로 생산하는 기사입니다."
한국경제,183490,/news/news_read.nhn?article_id=0003970962&office_id=015&mode=search&query=엔지켐생명과학&page=1,2018-06-29 18:54,손기영 엔지켐생명과학 회장 &quot;글로벌 제약사와 라이선싱 협의 중&hellip; 2020년 녹용물...,"[ 김현석 기자  ] “글로벌 대형 제약사와 기술 라이선싱 및 임상 협업을 논의하고 있다. 유럽연합(EU)에서 의약품 제조와 품질관리에 관한 규칙(GMP) 인증을 받는 등 라이선싱 인프라도 갖춰가고 있다.” 코스닥시장 상장기업인 엔지켐생명과학의 손기영 회장(사진)은 28일(현지시간) 미국 뉴욕 롯데팰리스호텔에서 열린 미국법인 출범식에서 기자와 만나 이같이 말했다. 엔지켐은 녹용의 약리성분을 화학적으로 합성한 물질 ‘EC-18’을 개발해 임상 2상을 진행하고 있다. 2020년까지 임상 3상을 마치고 제품을 출시하는 게 목표다. 이를 위해 미국법인을 세웠다. 미국법인 대표는 최고운영책임자(COO)인 조도현 박사가 맡는다. 손 회장은 “임상 3상을 혼자 하는 건 위험이 크다”며 “추후 판매와 마케팅을 생각해야 하기 때문에 반드시 글로벌 제약사와 협업해야 한다”고 말했다. 그는 “미국법인을 세운 것도 빠른 시간 내에 성공시키기 위한 것”이라고 설명했다. 손 회장은 신약으로 성공하려면 항암제 등에 모두 덤벼드는 게 아니라 독창적이고 기존 관념을 깨는 혁신적인 제품이 필요하다고 강조했다. 그는 “유행을 따르면 성공하기 어렵고, 성공한다고 해도 일류가 되기 힘들다”고 말했다. 엔지켐은 EC-18을 이용해 호중구감소증, 구강점막염, 급성방사선증후군 치료제 등 3가지 약을 집중적으로 개발 중이다. 모두 기존에 약이 없거나, 약이 있다 해도 불편하고 부작용이 많은 증상이다. 미국 식품의약국(FDA)에서 구강점막염 치료제에 대해 신속심사 대상(2018년 3월) 지정을, 급성방사선증후군 치료제에 대해선 희귀의약품(2017년 12월) 지정을 받았다. 그만큼 독창적이고 필요한 약이란 뜻으로 해석할 수 있다. 손 회장은 이스라엘의 바이오 기술을 벤치마크하고 있다고 말했다. 이스라엘은 독창적 신약을 앞세우며 전체 수출의 16%를 바이오 제품으로 채우고 있다. 한국의 바이오 수출 비중(0.4%)과 비교된다. 그는 “한국 바이오에서 독창적 제품으로 부가가치를 창출하는 사업 모델을 만들고 싶다”고 포부를 밝혔다."
한국경제TV,183490,/news/news_read.nhn?article_id=0000654178&office_id=215&mode=search&query=엔지켐생명과학&page=1,2018-06-28 13:08,"엔지켐생명과학, 전일 대비 약 3% 상승한 84,000원","[한국경제TV 라이온봇 기자] [그림 1] 최근 3개월 간 주가 추세 및 기간별 수익률 엔지켐생명과학은 6월 28일 13시 7분 전일 대비 약 3% 상승한 84,000원에 거래되고 있다. 엔지켐생명과학은 코스닥 상장 기업으로 제약 업종에 속해 있다. 시가총액은 6,254억원으로 코스닥 상장기업 중 69위에 위치 해 있다. [종목 성향 진단] [그림 2] 종목 성향 진단 엔지켐생명과학의 투자 스타일은 성장주에 가깝다. 주가 고평가 우려가 공존하지만 높은 성장성이 기대되는 기업이다. 주가 모멘텀은 부진한 편이었다. 최근 3개월 수익률은 -28.65%의 하락폭을 기록했다. 최근 1개월 수익률 또한 -14.71% 하락하며 부진한 모멘텀을 이어가고 있다. 엔지켐생명과학 종목에 대한 투자자의 관심도는 높은 편에 속한다. [투자 점수 진단] [그림 3] 투자 점수 진단 엔지켐생명과학은 어느 측면에서 투자 매력도가 높은 종목일까? AI 인공지능 종목 분석 시스템을 이용해 성장성, 수익성, 효율성, 안전성, 저평가성, 추세 등 주가 수익률에 영향을 줄 수 있는 6가지 핵심 투자 지표를 점수화하여 종목의 투자 매력도를 계산해보았다. 그 결과 엔지켐생명과학은 상대적으로 기업안정성 측면에서 두각을 드러내고 있었다. 기업안정성 점수는 기업의 재무 구조가 얼마나 안정적인 상태인지를 나타낸다. 엔지켐생명과학은 특히 당좌비율 측면에서 가장 높은 점수는 기록했는데, 전체 시장 내 135위를 기록하며 상위 6.94%에 위치했다. 업종별로는 36위를 기록하며 상위 16.43%에 위치했다. 그러나 기업의 이익 실현 정도를 나타내는 수익성 측면에서는 아쉬움을 나타냈다. (위의 AI인공지능 점수는 재무 데이터를 기반으로 전체 상장 종목과 비교/분석하여 도출한 점수로 높은 점수가 반드시 높은 수익률을 보장하지 않습니다. 위의 자료는 당사의 추천 종목이 아니며, 투자 시 참고용으로 제시해드리는 것입니다. 핵심투자지표를 결합해 종목의 투자매력도를 종합 계산한 ""인공지능 투자점수""는 ""거장들의 투자공식"" 앱에서 확인하실 수 있습니다.) 라이온봇 기자 -한국경제TV※ 본 기사는 한국경제TV와 '거장들의 투자공식이'자체 개발한 '라이온봇 기자'가 실시간으로 작성한 기사입니다. 라이온봇기자 ⓒ 한국경제TV, 무단 전재 및 재배포 금지 한국경제TV 관련뉴스해당 언론사에서 선정하며 언론사 페이지(아웃링크)로 이동해 볼 수 있습니다.멕시코 반응 폭발 ""우리 모두는 한국인""..항공권도 할인'형이 왜 거기서 나와?' 놀림감 된 독일 골키퍼 노이어 ""괴롭고 처참해""'세계 최강 선방쇼' 조현우 평점 최고...유럽 가즈아차범근家 총출동…한채아 근황, 남편 차세찌는?""정돈 보다 혼돈""…'B급 감성 만물상' 문 열었다"
