source,symbol,link,date,title,content
아시아경제,183490,/news/news_read.nhn?article_id=0004141920&office_id=277&mode=search&query=엔지켐생명과학&page=1,2017-12-18 09:22,"'코넥스 대장주' 엔지켐생명과학, 코스닥 시장 이전 상장","[아시아경제 임혜선 기자]글로벌 신약개발기업 엔지켐생명과학이 내년 1월 월 코스닥 시장에 이전 상장된다. 엔지켐생명과학은 15일 한국거래소와 금융감독원에 증권신고서를 제출하고 본격적인 공모절차에 들어간다고 밝혔다. 1999년에 설립된 엔지켐생명과학은 글로벌 신약은 물론 원료의약품을 개발, 제조하는 기업이다. 2013년 9월 코넥스 시장에 상장한 후 시가총액 1위를 기록한 코넥스 대장주이기도 하다. 엔지켐생명과학은 녹용에서 추출한 자체 합성한 유효성 물질(EC-18)을 통해 호중구 감소증 치료제, 구강점막염 치료제, 류마티스관절염 치료제 등 8가지의 적응증에 글로벌 신약을 개발 중이다. 자체 개발한 EC-18은 활성 또는 작용제, 억제, 길항제가 아닌 조절제로 생체면역조절의 신개념 치료제로 평가 받고 있다. 현재 66건의 국제 특허 등록과 65건의 국제 특허 출원 중인 EC-18은 호중구의 과다 이동과 침윤 조절 작용기전으로 경구용 형태를 통해 항암, 염증 분야로 적응증 확대가 가능하다. 현재 호중구감소증은 미국과 한국에서, 구강점막염은 미국에서 각각 임상 2상을 진행하고 있으며, 2020년 시판을 목표로 추진 중이다. 엔지켐생명과학의 공모희망가는 2만7000~3만7000원으로 총 예상 공모금액은 208억원~285억원이다. 1월 15일~16일 양일간 수요예측을 거쳐 공모가를 확정한 후 1월 22일부터 23일까지 청약을 받는다. 대표 주관사는 한국투자증권이다."
아시아경제,183490,/news/news_read.nhn?article_id=0004281762&office_id=277&mode=search&query=엔지켐생명과학&page=1,2018-07-23 07:37,"[클릭 e종목] 엔지켐생명과학, 3Q 호구감소증 등 임상 2상 중간결과&hellip;성장성 부...","[아시아경제 임철영 기자] 하이투자증권은 23일 엔지켐생명과학에 대해 호구감소증 등과 관련한 임상 2상의 중간결과는 올해 3분기에 나올 전망이라고 밝혔다. 이후에는 공동 연구를 전제로 글로벌 기업에 EC-18을 기술수출할 계획으로 다국적 기업과 병용 요법을 연구하면서 성장성이 부각될 것으로 예상했다. 엔지켐생명과학은 급성방사선증후군(ARS) 관련 미국 FDA 임상 2상 가시화와 BARDA 선정 가능성이 높아지면서 성장성이 부각될 전망이다. 급성방사선증후군은 원전사고 또는 핵피폭 및 암 환자들이 지속적으로 방사선 치료를 받는 과정에서 생기는 후유증으로 방사선 피폭으로 면역세포 교란, 불임, 구토 등 부작용이 생기고 심하면 사망에 이르기도 한다. 이상헌 연구원은 ""지난해 12월 미국 FDA로부터 희귀의약품으로 지정받았고 임상 2상 개시를 위해 세부 내용을 조율하고 있어서 조만간 승인을 받을 전망""이라며 ""임상 2상의 경우 영장류를 대상으로 한 동물임상이기 때문에 임상 3상을 거칠 필요가 없어 임상 2상 시험 결과를 토대로 해 판매허가 신청이 가능하다""고 설명했다. 특히 BARDA는 질병예방대응본부 내에 있는 의료대책 선진화와 관련한 조사와 개발을 지원하는 임무를 맡은 프로그램으로 엔지켐생명과학이 개발하고 있는 급성방사선증후군 치료제는 해당 프로그램과 목적이 일치, 그 만큼 선정될 가능성이 높다고 진단했다. 이 연구원은 ""엔지켐생명과학은 BARDA 프로그램에 선정되기 위한 여러가지 일련의 행정절차 등을 진행중에 있으므로 내년 초에는 선정이 가능할 것으로 예상됨에 따라 성장성을 담보받을 수 있을 것""이라고 말했다."
머니투데이,183490,/news/news_read.nhn?article_id=0004081413&office_id=008&mode=search&query=엔지켐생명과학&page=1,2018-07-23 08:22,"엔지켐생명과학, 글로벌 임상 순항..성장성 부각-하이","[머니투데이 김도윤 기자] 하이투자증권은 23일 엔지켐생명과학에 대해 글로벌 임상 순항중으로 암치료 관련 성장성이 부각될 것이라고 분석했다. 투자의견과 목표주가는 제시하지 않았다. 엔지켐생명과학의 전 거래일 종가는 8만5000원이다. 이상헌 하이투자증권 연구원은 엔지켐생명과학이 급성방사선증후군(ARS) 관련 미국 FDA(식품의약국) 임상 2상 가시화 및 BARDA(Biomedical Advanced Research and Development Authority) 선정 가능성 높아지면서 성장성이 부각될 것이라고 강조했다. 급성방사선증후군은 원전사고 또는 핵피폭 및 암 환자들이 지속적인 방사선 치료를 받는 과정에서 생기는 후유증으로, 방사선 피폭으로 면역세포 교란, 불임, 구토, 탈모, 백혈구 감소, 감염, 출형 등 부작용이 생기고 심할 경우 사망한다. 급성방사선증후군에 대해 엔지켐생명과학은 지난해 12월 미국 FDA로부터 희귀의약품으로 지정받았다. 급성방사선증후군 임상 2상 개시를 위해 미국 FDA와 관련된 세부적인 내용을 조율하고 있어서 조만간에 승인을 받을 것으로 예상된다. 이 연구원은 또 미국 건강보건부(HHS) 기관인 질병예방대응본부(ASPR) 안에 있는 BARDA에 주목했다. BARDA는 의료대책의 선진화된 조사 및 개발을 지원하는 임무를 맡고 있는데, 미래의 공중보건상 긴급 상황에 대한 준비를 위해 백신, 약품, 진단 프로그램을 비축한다. 엔지켐생명과학이 개발중인 급성방사선증후군은 BARDA 프로그램 목적과 일치되기 때문에 선정될 가능성이 높아질 것으로 내다봤다. 엔지켐생명과학은 BARDA 프로그램에 선정되기 위한 일련의 행정절차 등을 진행중이다. 이 연구원은 엔지켐생명과학의 호중구감소증 등과 관련된 임상 2상 중간결과가 올해 3부기에 나올 것으로 전망했다. 이후 공동 연구를 전제로 글로벌 기업에 호중구감소증 치료제 EC-18을 기술수출할 계획으로, 다국적 기업과 병용 요법을 연구하면서 성장성이 부각될 것이라고 조언했다."
한국경제,183490,/news/news_read.nhn?article_id=0003983474&office_id=015&mode=search&query=엔지켐생명과학&page=1,2018-07-23 09:09,"[특징주]엔지켐생명과학, 사흘 만에 반등&hellip;성장 기대","엔지켐생명과학이 연구개발 성과에 따른 성장 기대감에 사흘 만에 반등 중이다. 23일 오전 9시5분 현재 엔지켐생명과학은 전거래일보다 700원(0.82%) 오른 8만5700원에 거래되고 있다. 이상헌 하이투자증권 연구원은 ""엔지켐생명과학은 급성방사선증후군 치료제에 대해 지난해 12월 미국 식품의약국(FDA)으로부터 희귀의약품으로 지정받았다""며 ""임상 2상 시작을 위해 FDA와 세부적인 내용을 조율하고 있어서 조만간 승인받을 것""이라고 예상했다. 임상 2상의 결과를 토대로 판매허가 신청도 가능하다는 설명이다. 한민수 한경닷컴 기자"
아시아경제,183490,/news/news_read.nhn?article_id=0004281822&office_id=277&mode=search&query=엔지켐생명과학&page=1,2018-07-23 09:18,"[특징주] 엔지켐생명과학, 임상 성과 기대감&hellip;3일만에 &uarr;","[아시아경제 임철영 기자] 엔지켐생명과학이 급성방사선증후군 임상 2상 등 성과 가시화 기대감에 장 초반 상승세다. 23일 오전 9시16분 현재 엔지켐생명과학은 전 거래일 대비 0.71% 오른 8만5600원에 거래되고 있다. 하이투자증권은 이날 엔지켐생명과학에 대해 호구감소증 등과 관련한 임상 2상의 중간결과는 올해 3분기에 나올 전망이라고 밝혔다. 이후에는 공동 연구를 전제로 글로벌 기업에 EC-18을 기술수출할 계획으로 다국적 기업과 병용 요법을 연구하면서 성장성이 부각될 것으로 예상했다. 엔지켐생명과학은 급성방사선증후군(ARS) 관련 미국 FDA 임상 2상 가시화와 BARDA 선정 가능성이 높아지면서 성장성이 부각될 전망이다. 급성방사선증후군은 원전사고 또는 핵피폭 및 암 환자들이 지속적으로 방사선 치료를 받는 과정에서 생기는 후유증으로 방사선 피폭으로 면역세포 교란, 불임, 구토 등 부작용이 생기고 심하면 사망에 이르기도 한다. 이상헌 연구원은 ""지난해 12월 미국 FDA로부터 희귀의약품으로 지정받았고 임상 2상 개시를 위해 세부 내용을 조율하고 있어서 조만간 승인을 받을 전망""이라며 ""임상 2상의 경우 영장류를 대상으로 한 동물임상이기 때문에 임상 3상을 거칠 필요가 없어 임상 2상 시험 결과를 토대로 해 판매허가 신청이 가능하다""고 설명했다."
머니투데이,183490,/news/news_read.nhn?article_id=0004098982&office_id=008&mode=search&query=엔지켐생명과학&page=1,2018-08-31 09:15,"[특징주]엔지켐생명과학, 파이프라인 기술수출 기대감에 강세","[머니투데이 반준환 기자] 엔지켐생명과학이 하반기 호중구감소증 치료제 임상2상에 대해 중간결과를 발표하고, 해당 결과를 토대로 기술수출을 추진할 것이라는 기대감에 강세다. 31일 오전 9시14분 현재 엔지켐생명과학은 전날보다 4% 오른 10만8600원에 거래되고 있다. 엔지켐생명과학이 개발하고 있는 호중구감소증 치료제(G-CSF)의 시장규모는 지난해 기준 56억 달러에 달한다. 이중 암젠의 뉴라스타가 시장 점유율 약 80%를 차지하고 있다. 한국투자증권 진홍국 연구원은 ""엔지켐이 개발 중인 호중구감소증 치료제는 기존 약품 대비 다양한 강점을 지니고 있어 출시에 성공할 경우 빠르게 시장을 잠식할 것으로 기대한다""고 전망했다. 현재 미국에서 FDA 임상2상을 진행하고 있으며 내년 하반기 임상을 마무리할 전망이다. 임상결과를 바탕으로 혁신신약 신청과 현재 추진 중인 라이센스 딜을 정리한다는 계획이다. 이밖에 구강점막염 치료제, 급성방사선증후군 치료제 등도 개발하고 있다. 진 연구원은 ""하반기 호중구감소증 치료제의 임상2상 중간결과를 해외학회에서 발표할 계획이며, 이를 토대로 기술수출을 추진할 예정""이라며 ""파이프라인 개발이 순항하고 있어 긍정적 주가 흐름을 기대한다""고 덧붙였다."
이데일리,183490,/news/news_read.nhn?article_id=0004098393&office_id=018&mode=search&query=엔지켐생명과학&page=1,2018-05-10 08:44,"엔지켐생명과학, 가장 저평가된 신약개발 업체-토러스","[이데일리 최정희 기자] 토러스투자증권은 엔지켐생명과학(183490)에 대해 국내에서 가장 저평가된 신약 개발 업체라고 분석했다. 오병용 토러스투자증권 연구원은 10일 보고서에서 “엔지켐생명과학은 항암제 부작용 중 가장 대표적인 호중구감소증, 구강점막염 치료제의 미국 임상 2상을 진행중”이라며 “임상 결과가 성공적일 가능성이 높다”고 밝혔다. 엔지켐생명과학의 EC-18은 록피드의 용량을 약 두 배 투여하는 것인데 이미 록피드는 2014년부터 건강기능식품으로 만들어져 판매돼오고 있기 때문이다. 오 연구원은 “이미 수천 명의 사람들이 록피드를 복용했고 4년이 넘는 기간 동안 부작용 관련 이슈가 제기된 적이 한 번도 없었다”며 “EC-18의 부작용과 안정성도 어느 정도 입증됐다고 판단돼 미국 임상 2상도 성공적일 것”이라고 설명했다. 임상 시험을 통과할 경우 신약의 시장 규모도 상당하단 평가다. 전체 항암치료 환자의 20%에서 호중구감소증이 발생하고 두경부암 항암치료 환자의 대부분에서 구강점막염이 생긴다. 호중구감소증 치료제는 G-CSF계열의 약물(에포젠, 뉴라스타 등)밖에 없는데 이 약물의 환자 반응률은 50% 수준에 불과하다. 골수성백혈병환자나 방사선 치료시에는 사용이 불가능하다. 즉, 호중구감소증 환자 절반 이상이 치료제가 없는 상황이기 때문에 내년 임상 2상 종료 후 혁신신약 지정 신청을 통해 조건부 시판허가를 받을 것으로 예상되고 있다. 구강점막염은 현재 치료제가 없다. 이에 따라 오 연구원은 “안정성이 입증된 약이라 타 물질 대비 임상 성공 확률이 높고 임상 2상 후 조건부 시판허가를 받을 가능성도 높다”며 “EC-18은 시장성, 임상통과 확률, 시판허가 시기 등 세 가지를 모두 갖춘 우수한 파이프라인”이라고 설명했다. 이어 “국내 유명 신약개발 기업들의 신약 파이프라인 대비 밸류에이션을 덜 받을 이유가 없고, 가치 재평가가 반드시 필요하다”고 덧붙였다."
한국경제,183490,/news/news_read.nhn?article_id=0003937189&office_id=015&mode=search&query=엔지켐생명과학&page=1,2018-05-11 09:37,토러스證 &quot;엔지켐생명과학 2분기 매출 37.5% 증가&quot;,[ 강영연 기자  ] 토러스투자증권은 엔지켐생명과학의 2분기 매출이 지난해 동기보다 37.5% 늘어날 것으로 전망했다. 토러스투자증권에 따르면 엔지켐생명과학은 호중구감소증과 구강점막염에 효과가 있는 치료제 ‘EC-18’의 임상 2상을 미국에서 진행중이다. 호중구감소증과 구강점막염은 항암치료에 따른 부작용으로 대표적인 질환이다. 오병용 토러스투자증권 연구원은 “EC-18는 치료제가 없는 항암 부작용 시장을 목표로 하고 있어 시장성이 크다”며 “현재 주가는 파이프라인 가치가 현저히 저평가된 상태”라고 평가했다.
파이낸셜뉴스,183490,/news/news_read.nhn?article_id=0004018370&office_id=014&mode=search&query=엔지켐생명과학&page=1,2018-05-10 13:30,[fnRASSI]엔지켐생명과학(183490) 전일대비 8.89% 상승,"현재 엔지켐생명과학(183490)은 전일대비 8.89% 상승하여 83,300원 선에서 거래가 이루어지고 있다. 주가등락폭은 다소 큰 편 최근 한달간 엔지켐생명과의 상장주식수 대비 거래량을 비교해보니 일별 매매회전율이 1.47%로 집계됐다. 동기간 일평균 주가변동률은 9.15%로 장중 저점과 고점의 차이가 매우 컸음을 알 수 있다. 외국인과 기관은 순매도, 개인은 순매수(한달누적)  5월8일부터 전일까지 기관이 2거래일 연속 순매도를 보였다. 4주간을 기준으로 보면 외국인이 매도쪽으로 방향을 잡으면서 11,700주를 순매도했고, 기관도 매도 후 매수의 관점을 보이고 있음에도 불구하고 2,476주를 순매도했지만, 개인은 오히려 방향성있는 매매를 하면서 14,176주를 순매수했다. 'fnRASSI'는 증권전문 기업 씽크풀과 파이낸셜뉴스의 협업으로 로봇기자가 실시간으로 생산하는 기사입니다."
머니투데이,183490,/news/news_read.nhn?article_id=0004049344&office_id=008&mode=search&query=엔지켐생명과학&page=1,2018-05-10 09:14,"[특징주]엔지켐생명과학, 저평가 분석에 4%대 강세","[머니투데이 하세린 기자] 엔지켐생명과학이 저평가 분석에 4%대 강세다. 10일 오전 9시10분 현재 코스닥 시장에서 엔지켐생명과학은 전날대비 3400원(4.44%) 오른 7만9900원에 거래되고 있다. 장 초반 7% 가까이 오르기도 했다. 오병용 토러스투자증권 연구원은 ""엔지켐생명과학은 항암제 부작용 중 가장 대표적인 호중구감소증, 구강점막염 치료제의 미국 임상 2상을 진행중""이라며 ""임상 결과가 성공적일 가능성이 높다""고 밝혔다. 이어 ""엔지켐생명과학의 EC-18은 시장성, 임상통과확률, 시판허가시기의 3가지를 전부 갖춘 우수한 파이프라인이라고 판단할 수 있다""면서 ""국내 유명 신약개발 기업들의 신약 파이프라인 대비 밸류를 덜 받을 이유가 없으며 가치재평가가 반드시 필요하다""고 강조했다."
서울경제,183490,/news/news_read.nhn?article_id=0003262333&office_id=011&mode=search&query=엔지켐생명과학&page=1,2018-04-05 09:46,"&lt;코&gt;엔지켐생명과학, 전일 대비 7.03% 상승.. 일일회전율은 1.50% 기록","[서울경제] 엔지켐생명과학(183490) 은 5일 오전 9시 45분 현재 7.03% 오른 105,000원에 거래되고 있으며, 44(매도):56(매수)의 매수우위를 기록하고 있다. 거래대금은 118억3,961만, 거래량은 11만4,079주로 거래량회전율은 1.50%로 나타났다. 지난 1개월간 엔지켐생명과학은 상승 15회, 하락 15회를 기록했고, 주가수익률은 23.24% 표준편차는 5.46%를 기록했다. 이 기간 ' 제약업 ' 업종 평균 주가수익률은 7.80%로 나타났으며, 변동성은 2.15%를 기록했다. 이 시각 현재 ' 제약업 '은 1.96% 상승 중이며, 57(매도):43(매수)의 매도우위를 기록하고 있다."
전자신문,183490,/news/news_read.nhn?article_id=0002696942&office_id=030&mode=search&query=엔지켐생명과학&page=1,2018-04-05 13:49,"[ET투자뉴스]엔지켐생명과학, &quot;동사의 신약후보 물&hellip;&quot; 매수(유지)-케이프투자증권","케이프투자증권에서 5일 엔지켐생명과학(183490)에 대해 ""동사의 신약후보 물질(EC-18)에 대한 공신력 제고로 투자매력 상승""라며 투자의견을 '매수(유지)'로 제시하였고, 아울러 목표주가로는 150,000원을 내놓았다. 케이프투자증권 김형수 애널리스트가 동종목에 대하여 이번에 제시한 '매수(유지)'의견은 케이프투자증권의 직전 매매의견에서 큰 변화없이 그대로 유지되는 것이고  올해 초반의 매매의견을 기준으로  볼때도 역시 '매수'의견이 계속 유지되고 있는 상태이다. 그리고 최근 분기내 발표된 전체 증권사 리포트의 컨센서스와 비교를 해볼 경우에 오늘 발표된 투자의견은 전체의견에 수렴하고 있어, 이번 의견은 시장의 평균적인 기대감이 객관적으로 표현된 것으로 분석되고 있다. 목표주가의 추이를 살펴보면 최근 두차례 연속해서 같은 수준을 유지하고 있는 모습이다. 또한 전일 종가 기준으로 볼때 동종목의 현주가는 이번에 제시된 목표가 대비 52.9%의 저평가 요인이 존재한다는 해석이 제시되고 있다."
이데일리,183490,/news/news_read.nhn?article_id=0003945739&office_id=018&mode=search&query=엔지켐생명과학&page=1,2017-10-16 18:23,"코넥스, 112개 거래&hellip;엔지켐생명과학 거래대금 1위","[이데일리 윤필호 기자] 16일 코넥스시장에서는 150개 상장종목 가운데 122개 종목의 가격이 형성됐다. 가격은 형성됐으나 거래로 연결되지 않은 기세종목 10개를 제외하면 실제 거래 체결 종목은 112개다. 이날 거래량은 15만4000주로 전 거래일 대비 22만4000주 감소했고, 거래대금은 54억9000만원 줄어든 13억5000만원으로 집계됐다. 거래대금 1위 종목은 엔지켐생명과학으로 3억9300만원을 기록했다. 이어 툴젠(1억9030만원), 볼빅(1억1140만원) 순으로 나타났다. 시가총액은 전 거래일보다 135억원 증가한 4조1068억원을 기록했다. 시총 상위 종목은 엔지켐생명과학(2939억2000만원), 툴젠(2315억4000만원), 하우동천(2150억4000만원) 순이다. 투자자별로는 개인은 2억3330만원을 순매수했고, 기관과 기타법인이 각각 2억220만원, 3110만원 순매도했다."
머니투데이,183490,/news/news_read.nhn?article_id=0003946746&office_id=008&mode=search&query=엔지켐생명과학&page=1,2017-10-13 04:25,"적자기업 엔지켐생명과학, 시총 2700억원 가능할까","[머니투데이 김도윤 기자] [코넥스서 기술특례로 코스닥 이전상장 추진…적자회사 부담안고 현 시총 2700억원 넘을지 '주목'] 바이오 회사 엔지켐생명과학이 기술특례로 코스닥 이전 상장을 결정한 가운데 '적자회사'라는 부담을 극복하고 현재 이상의 기업가치를 받아낼 수 있을지 주목된다. 코넥스 대장주 엔지켐생명과학은 현재 시가총액 기준 2700억원 안팎에서 거래 중이다. 12일 증권업계에 따르면 엔지켐생명과학은 최근 기술성평가를 통과하고 코스닥 상장예비심사를 청구하는 등 본격적인 상장 절차에 돌입했다. 주관사는 한국투자증권이다. 엔지켐생명과학은 신약인 호중구감소증 치료제 'EC-18'을 개발하고 있어 업계의 관심이 크다. 지난해부터 미국 식품의약국(FDA) 승인을 받고 임상2상을 진행 중이다. EC-18은 항암치료 등 과정에서 호중구 수치가 감소하고 면역력이 떨어지는 부작용을 치료하거나 완화하는 약이다. 경구용 치료제로, 피하주사용보다 비교적 사용이 간편하고 통증을 줄일 수 있다는 점이 강점이다. 글로벌 호중구감소증 치료제 시장은 8조원 이상으로 추정된다. 엔지켐생명과학은 EC-18을 호중구감소증뿐 아니라 구강점막역 치료제로도 개발 중이다. 엔지켐생명과학은 EC-18에 대한 기대감을 바탕으로 코넥스 대장주로 부상했다. 지난해 8만원에 근접할 정도로 주가가 급등, 코넥스에서 대표적인 바이오 기업으로 각광 받았다. 그만큼 EC-18 개발에 대한 시장의 관심이 크다는 방증이다. 올 들어 주가가 조정을 받으며 현재 4만원 안팎에서 거래 중이다. 상장예비심사를 청구할 당시 주가 기준 시가총액은 약 2400억원이었는데, 이후 주가가 상승하며 현재 2700억원 고지를 밟았다. 엔지켐생명과학이 코스닥 이전 상장을 결정한 이유는 EC-18 임상을 진행하는 과정에서 필요한 자금을 조달하려는 목적으로 해석된다. 신약 개발의 경우 임상을 거치면서 많게는 수백억 이상의 비용이 필요하기 때문이다. 다만 엔지켐생명과학에 대한 높은 기대감이 오히려 코스닥 이전 상장의 난관으로 작용할 수 있다는 지적도 나온다. 현재 엔지켐생명과학 시가총액인 2700억원 안팎의 기업가치를 공모 과정에서 받아내기 위한 회사 측과 주관사의 고민이 깊어질 수밖에 없다. 지금 주가보다 아래에서 공모가가 결정될 경우 기존 주주의 피해로 인한 잡음이 일어날 수 있기 때문이다. 특히 엔지켐생명과학은 꾸준히 적자가 이어지고 있어 기업가치 책정에 어려움이 적지 않을 것으로 관측된다. 기술특례를 거치는 바이오 기업의 경우 주로 앞으로 예상되는 수익 등 미래가치를 끌어와 기업가치의 토대로 삼는다. 엔지켐생명과학은 지난해 매출액 218억원, 영업손실 62억원, 순손실 63억원을 기록했다. 현재 시장 가격을 기준으로 할 경우 엔지켐생명과학이 공모를 통해 조달하는 자금은 약 308억원이다. 엔지켐생명과학 최대주주는 브리짓라이프사이언스로 지분율은 17%다. 특수관계인인 손기영 대표를 포함한 최대주주측 지분율은 25.5%다. 증권업계 관계자는 ""엔지켐생명과학은 현재 이익이 나지 않는 회사이기 때문에 공모 과정에서 미래가치를 기준으로 기업가치를 산정할 수밖에 없을 것""이라며 ""회사의 자금조달 욕구가 클 경우 현재 시장가격보다 아래에서 공모가가 책정돼도 받아들일 수 있지만, 그 이상의 가치를 받기 위해 다양한 기업가치 평가 방식과 마케팅 포인트를 고민하고 있을 것""이라고 말했다. 엔지켐생명과학 관계자는 ""엔지켐생명과학은 글로벌 바이오 업계에서 주목하는 EC-18에 대한 개발을 진행하고 있고 현재까지 진행상황, 효능 등을 고려할 경우 개발 성공 가능성이 매우 높다는 확신을 갖고 있다""고 말했다. 그는 ""기업가치에 대해선 아직 구체적으로 말할 단계는 아니지만 이미 업계에서 기술력에 대해 인정을 받고 있고 실제로 일정 규모 이상의 매출을 올리고 있다는 점이 시장에서 높은 평가를 받고 있는 요인""이라고 덧붙였다."
