source,symbol,link,date,title,content
연합뉴스,192530,/news/news_read.nhn?article_id=0010069278&office_id=001&mode=search&query=광주은행&page=11,2018-05-06 13:48,광주은행 1분기 당기순이익 451억원&hellip;전년 대비 5.4％&uarr;,"(광주=연합뉴스) 장덕종 기자 = 광주은행은 올해 1분기 당기순이익(공시 기준)으로 451억원을 달성했다고 6일 밝혔다. 지난해 같은 기간 대비 5.4％ 증가했다. 지난해 당기순이익은 총 1천350억원이다. 1분기 영업이익은 584억원으로 지난해 같은 기간 대비 2.8％ 증가했다. 이 기간 수익성 지표인 순이자마진(NIM)은 지난해 같은 기간 대비 0.07％p 상승한 2.40％를 기록했다. 경영 효율성 지표인 영업이익 경비율(CIR)은 5.1％p 증가한 44.3％, BIS 자기자본비율은 1.26％p 증가한 16.20％를 나타냈다. 이는 인터넷, 스마트뱅킹 등 비대면 영업이 확대되고, 수도권 영업망이 점차 안정화되는 등 다양한 경영효율화 정책의 성과로 분석됐다. 광주은행 관계자는 ""미래경쟁력 확보를 위해 디지털 역량을 강화하는 등 변화와 혁신을 추진하겠다""며 ""특히 창립 50주년을 맞은 만큼 다양한 고객 감사 행사와 사회공헌활동을 추진해 지역 대표은행의 위상을 공고히 하겠다""고 말했다."
전자신문,192530,/news/news_read.nhn?article_id=0002712033&office_id=030&mode=search&query=광주은행&page=11,2018-05-30 09:15,"[ET투자뉴스]광주은행, &quot;순이자마진 개선추세&hellip;&quot; 매수(신규)-케이프투자증권","케이프투자증권에서 30일 광주은행(192530)에 대해 ""순이자마진 개선추세 유효""라며 투자의견을 '매수(신규)'로 제시하였고, 아울러 목표주가로는 15,000원을 내놓았다. 케이프투자증권 전배승 애널리스트가 동종목에 대하여 이번에 제시한 '매수(신규)'의견은 케이프투자증권에서는 올해들어 처음 내놓는 매매의견이며 그리고 최근 분기내 발표된 전체 증권사 리포트의 컨센서스와 비교를 해볼 경우에 오늘 발표된 투자의견은 전체의견에 수렴하고 있어, 이번 의견은 시장의 평균적인 기대감이 객관적으로 표현된 것으로 분석되고 있다. 또한 전일 종가 기준으로 볼때 동종목의 현주가는 이번에 제시된 목표가 대비 34.5%의 저평가 요인이 존재한다는 해석이 제시되고 있다."
스포츠경향,192530,/news/news_read.nhn?article_id=0000550766&office_id=144&mode=search&query=광주은행&page=11,2018-05-05 14:06,"광주은행, 1분기 451억원 당기순이익&hellip;전년대비 5.4% 증가","광주은행이 지난 1분기 451억원의 당기 순이익(공시기준)을 달성했다. 전년 동기대비 5.4% 증가한 수치다. 광주은행은 5일 이 같이 발표하며 1분기 영업이익은 584억원으로 전년 동기대비 2.8% 증가했고, 분기중 NIM(순이자마진)은 전분기 대비 0.07%p 상승한 2.40%를 나타냈다고 밝혔다. 경영효율성 지표인 영업이익경비율(CIR)은 전년 동기대비 5.1%p 개선된 44.3%를 기록했다. 또한 BIS자기자본비율은 16.20%로 전년 동기대비 1.26%p 증가했다. 2017년 당기순이익 1,350억원 달성에 이어 2018년 1분기에도 451억원의 안정적인 순이익을 시현하고 있다. 이러한 성과에 대해 광주은행은 인터넷뱅킹과 스마트뱅킹 고도화를 바탕으로 비대면채널 영업이 확대되고, 수도권 영업망이 점차 안정화되는 등 다양한 경영효율화 정책들이 가시화되면서 나온 성과로 향후 그 효과가 더 커질 것으로 예상했다. 광주은행 관계자는 “앞으로도 미래경쟁력 확보를 위해 디지털 역량을 강화하는 등 지속적인 변화와 혁신을 추진하겠다”며 “특히 창립 50주년을 맞는 뜻깊은 해인만큼 다양한 고객 감사 행사 및 사회공헌활동을 지속적으로 추진하여 광주⦁전남 대표은행의 위상을 더욱 공고히 할 수 있도록 최선을 다할 것“이라 밝혔다."
조세일보,192530,/news/news_read.nhn?article_id=0002184314&office_id=123&mode=search&query=광주은행&page=11,2018-05-05 10:52,"광주은행, 올 1분기 당기순익 451억원&hellip;전년비 5.4% 증가",광주은행은 올해 1분기 당기순이익이 451억원을 달성했다고 5일 밝혔다. 이는 전년 동기대비 5.4% 증가한 수치다. 광주은행의 1분기 영업이익은 584억원으로 전년 동기대비 2.8% 증가했고 분기중 NIM(순이자마진)은 전분기 대비 0.07%p 상승한 2.40%를 나타냈다. 경영효율성 지표인 영업이익경비율(CIR)은 전년 동기대비 5.1%p 개선된 44.3%를 기록했다. 또한 BIS자기자본비율은 16.20%로 전년 동기대비 1.26%p 증가했다. 광주은행은 지난해 당기순이익 1350억원 달성에 이어 2018년 1분기에도 451억원의 안정적인 순이익을 시현하고 있다. 안정적인 순이익 시현의 배경에는 저원가성예금의 증가와 자산구조의 개선으로 NIM이 꾸준히 상승했고 이자이익이 1분기 기준 전년 동기대비 10.5% 증가했다. 고정이하여신비율은 0.66%를 기록하며 자산건전성을 유지했기 때문이다. 인터넷뱅킹과 스마트뱅킹 고도화를 바탕으로 비대면채널 영업이 확대되고 수도권 영업망이 점차 안정화되는 등 다양한 경영효율화 정책들이 가시화되면서 효과가 더 커질 것으로 예상된다고 광주은행 측은 밝혔다.
전자신문,192530,/news/news_read.nhn?article_id=0002705501&office_id=030&mode=search&query=광주은행&page=12,2018-05-04 17:50,"광주은행, 스마트뱅킹 전용 간편인증&middot;이체 서비스 출시","광주은행(행장 송종욱)은 스마트뱅킹 고객을 위한 간편비밀번호인증, 패턴인증, 간편이체 서비스를 8일 출시한다고 4일 밝혔다. '간편비밀번호인증'은 스마트뱅킹 이용 시 숫자 6자리 비밀번호로 모든 금융거래를 할 수 있는 서비스다. 신청 시 인증서가 스마트폰 별도 보안영역에 저장된다 유효기간은 3년이다. 자신이 설정한 패턴으로 로그인이 가능한 '패턴인증' 서비스도 제공한다. '간편이체'는 하루 100만원 범위 내에서 보안카드나 일회성비밀번호(OTP) 입력 없이 간단한 인증만으로도 송금할 수 있는 서비스다. 상대방 계좌번호를 알지 못하는 경우 카카오톡이나 휴대폰 전화번호로 돈을 보낼 수 있다. 수취인은 휴대폰 메시지의 URL에 계좌 정보를 입력해 돈을 받을 수 있다."
파이낸셜뉴스,192530,/news/news_read.nhn?article_id=0004030721&office_id=014&mode=search&query=광주은행&page=11,2018-05-30 15:57,"광주은행 KJ카드, 창립 50주년 기념 '행운 대축제' 실시","【광주=황태종기자】광주은행은 6월 1일부터 한 달간 광주은행 KJ카드 개인고객을 대상으로 '어서 50시오, KJ Card입니다-행운 대축제'를 실시한다고 밝혔다. 이번 행운 대축제는 창립 50주년을 기념한 특별 경품 제공 이벤트다. 기간 내 홈페이지, 가까운 영업점, 고객센터를 통해 이벤트에 응모하고, 개인신용(체크 포함)카드로 총 합산 50만원 이상 이용한 고객 중 추첨을 통해 경품을 제공한다. 1등 고객 1명에게 LG 양문형 냉장고, 2등 고객 5명에게 다이슨 청소기, 3등 고객 10명에게 LG 공기청정기, 4등 고객 200명에게 신세계이마트 모바일상품권 3만원권이 각각 제공된다. 광주은행 관계자는 ""'5월 가정의 달' 광주카드 이벤트에 이어 이번 달에도 행복 가득한 6월을 보낼 수 있도록 이벤트를 준비했다""며 ""항상 고객을 우선으로 생각하며 더 좋은 혜택을 제공하기 위해 최선을 다하겠다""고 말했다."
디지털타임스,192530,/news/news_read.nhn?article_id=0002462228&office_id=029&mode=search&query=광주은행&page=12,2018-05-04 16:02,"광주은행, 8일부터 간편이체 등 스마트뱅킹 서비스 시작","공인인증서·복잡한 비밀번호 대체계좌번호 몰라도 카카오톡 등 메시지 송금도 광주은행은 오는 8일 스마트뱅킹 이용고객 편의를 위해 간편비밀번호인증, 패턴인증, 간편이체 서비스를 내놓는다고 4일 밝혔다. 광주은행 제공     광주은행은 오는 8일 스마트뱅킹 이용고객 편의를 위해 간편비밀번호인증, 패턴인증, 간편이체 서비스를 내놓는다고 4일 밝혔다. 간편비밀번호인증은 스마트뱅킹 이용 시 기존 공인인증서의 복잡한 비밀번호 대신 숫자 6자리 비밀번호 설정만으로 계좌 조회, 이체 등 모든 금융거래를 할 수 있는 서비스다. 서비스 신청 시 유효기간 3년의 인증서가 스마트폰 별도의 보안영역에 저장돼 기존의 보안방식보다 더 안전하게 인증서를 보관할 수 있다. 기존 지문인식과 공인인증서 암호 입력 방식과 더불어 패턴인증, 간편비밀번호 인증 등 다양한 로그인 방법 중 본인이 선호하는 인증수단을 선택해 스마트뱅킹 거래를 할 수 있다. 간편이체는 보안카드나 일회용 비밀번호 생성기(OTP) 없이도 간단한 인증 만으로 송금할 수 있는 서비스다. 1일 100만원 범위 내에서 할 수 있으며 상대방의 계좌번호를 모르더라도 카카오톡이나 휴대폰 전화번호로 송금할 수 있다. 송금인이 이체금액을 카카오톡이나 메시지로 보내면 수취인은 메시지에 포함된 URL에 접속해 수취계좌 정보를 입력하고 송금받을 수 있다."
헤럴드경제,192530,/news/news_read.nhn?article_id=0001389519&office_id=016&mode=search&query=광주은행&page=12,2018-05-04 14:30,"광주은행, 1분기 영업익 583.4억&hellip;전년비 2.8%&uarr;",[헤럴드경제=증권팀] 광주은행은 1분기 연결기준 영업이익이 583억4700만원으로 전년동기대비 2.8% 증가했다고 4일 공시했다. 같은 기간 매출액은 2332억5000만원으로 6.9% 늘어난 것으로 나타났다. 당기순이익은 450억8700만원으로 5.3% 증가한 것으로 집계됐다.
파이낸셜뉴스,192530,/news/news_read.nhn?article_id=0004031243&office_id=014&mode=search&query=광주은행&page=11,2018-05-31 11:03,"광주은행, '해피라이프 여행스케치적금' 인기몰이","【광주=황태종기자】광주은행은 지난 2015년 7월에 첫 선을 보인 '해피라이프 여행스케치적금'이 30일 기준으로 누적 판매 5만 3000좌, 계약액 2700억원을 돌파했다고 밝혔다. 이 상품은 ㈜하나투어와의 제휴를 통해 여행을 가기 위해 목돈을 마련하려는 가입고객에게 다양한 우대서비스를 제공하는데, 휴가시즌을 앞두고 가입 및 문의가 잇따르고 있다. 6개월 이상부터 36개월 이하 월 단위로 영업점 방문, 인터넷뱅킹, 스마트뱅킹을 통해 가입할 수 있으며, 광주은행 신용(체크)카드 사용 실적에 따라 우대금리를 제공한다. 또 △하나투어 지정대리점 여행상품 이용시 결제금액의 3% 캐시백 △광주은행 카드로 해당 여행상품 결제 및 해외 사용시 이용금액의 0.5% 추가 캐쉬백 △적금 가입기간 중 환전 시 최대 70%까지 환율우대 △하나투어 그룹사 SM면세점 할인 등 다양한 혜택을 제공한다. 특히 광주은행은 창립 50주년을 기념해 '해피라이프 여행스케치적금' 고객사은행사를 벌인다. 이번 행사는 6월 1일부터 7월 31일까지 신규 가입 고객과 기존 계좌 보유고객을 대상으로 실시된다. 총 25명을 추첨해 하나투어 여행상품권 200만원권(1명), 하나투어 여행상품권 100만원권(2명), 제주도 특급호텔숙박권(3명), 여수엠블호텔숙박권(4명), 백화점상품권 10만원권(15명) 등 푸짐한 경품을 제공한다. 광주은행 관계자는 ""'해피라이프 여행스케치 적금'이 광주은행의 히트상품으로 자리매김할 수 있도록 보내주신 고객들의 성원에 보답하고자 이번 '고객 감사 이벤트'를 마련했다""고 말했다."
전자신문,192530,/news/news_read.nhn?article_id=0002710781&office_id=030&mode=search&query=광주은행&page=11,2018-05-24 16:35,"[ET투자뉴스][대한전선 지분 변동] (주)광주은행 외 8명 -3.14%p 감소,...","대한전선(001440)은 24일 주주 (주)광주은행을  비롯한 특별관계자의 보유주식이 감소되었다고 발표했다. 이는 직전 보고일보다 26,874,910주 감소하여 지분율은 87.03%로 하락했다. 이번 보고 사유는 주식매각에 따른 지분율감소로  알려졌다.   최대주주와 특수관계자의 지분 변동은 주가에 영향을 주는 요인이다. 특히 보유비율을 지속적으로 늘리거나 줄일 경우, 해당종목 투자시 유의할 필요가 있다.  다음은 대한전선의 지분 변동 내역과 보유 내역이다."
아이뉴스24,192530,/news/news_read.nhn?article_id=0000454349&office_id=031&mode=search&query=광주은행&page=7,2018-07-16 08:32,"[I-리포트] JB금융, 광주은행 100% 자회사편입 긍정적-유진證","[아이뉴스24 김다운 기자] 유진투자증권은 16일 JB금융에 대해 자회사 광주은행의 100% 편입은 주주가치 제고에 긍정적이라며 '매수' 의견과 목표주가 7천700원을 유지했다. 김인 유진투자증권 애널리스트는 ""지난 2016년 은행주 실적이 큰 폭 증가하면서 주가가 상승할 때 JB금융 주가상승은 전년 대비 5.1%에 불과했던 반면 광주은행은 41.0% 상승했다""며 "" 자회사 광주은행 실적 반등에 따른 JB금융 실적증가 수혜가 전혀 반영되지 않았다""고 전했다. 자회사 광주은행이 상장됨에 따라 투자자들이 광주은행을 선택했기 때문이라는 설명이다. 또한 배당수익률에서의 차이도 주주간의불만 사항이라고 봤다. 따라서 그는 ""광주은행이 100% 자회사로 편입됨에 따라 모회사와 자회사 주주간의 이해상충 문제가 해소될 것""이라며 ""모회사 및 자회사 동시 상장에 따른 관리비용 중복 문제도 해소 기능하다""고 진단했다. 광주은행 100% 편입 이후 JB금융의 총자산대비이익(ROA)는 15bp, 자기자본대비이익(ROE)은 1.4% 상승 가능하다고 봤다. 더불어 부채비율은 3.6% 떨어지고 이중레버리지비율은 2.9%p 하락할 것으로 분석했다. 그는 ""예상보다 빠른 광주은행 100% 편입에 따라 유상증자 우려가 조기 해소된 상황이며, JB금융의 낮은 시가총액 및 거래량에 따른 주가 할인도 축소될 것'이라고 전망했다. /김다운기자"
조세일보,192530,/news/news_read.nhn?article_id=0002186275&office_id=123&mode=search&query=광주은행&page=10,2018-06-07 10:18,"JB금융지주, 하반기 신입 채용&hellip;전북은행 50명, 광주은행 60명","JB금융지주는 2018년도 하반기 신입행원을 110명 채용키로 했다고 7일 밝혔다. JB금융그룹은 청년들의 신규 일자리 창출과 디지털뱅킹 강화를 위해 자회사인 전북은행이 50명, 광주은행이 60명, 합계 110명의 신입행원을 채용하기로 했다. 이는 지난해 전북은행이 38명의 신입행원을, 광주은행이 53명의 신입행원을 채용했던 것에 비해 전체적으로 120% 이상 늘린 것이다. 또한 채용절차는 은행연합회에서 발표한 은행권 채용절차 모범규준을 최대한 준수하여 신입행원 채용과정의 공정성과 투명성을 강화할 예정이며 채용시기도 은행연합회 모범규준이 확정되면 결정할 예정이다. JB금융지주는 지방은행의 특성상 반드시 고려되어야 할 지역인재들을 위해 전체 채용인원의 70% 이상을 지역(전라남·북도)에 할당하여 선발할 계획이며 지역인재들이 은행권 채용절차 모범규준에 의거 불이익이 없도록 한다는 방침이다."
이데일리,192530,/news/news_read.nhn?article_id=0004088830&office_id=018&mode=search&query=광주은행&page=13,2018-04-27 10:33,"광주은행, 대학등록금 납부 이벤트 당첨자 발표","송종욱 광주은행장이 27일 광주 본점에서 ‘슈퍼그레잇~! 등록금 이벤트’ 당첨 고객에게 장학금을 증정한 후 기념촬영을 하고 있다. (사진=광주은행) [이데일리 전상희 기자] 광주은행이 27일 2018년 1학기 ‘슈퍼그레잇~! 등록금 이벤트’ 당첨자를 발표하고 당첨고객을 본점에 초청해 장학금 증정식을 가졌다고 밝혔다. 이번 ‘슈퍼그레잇~! 등록금 이벤트’는 2월 7일부터 3월 31일까지 광주은행을 통해 대학등록금을 납부한 대학(원)생들을 대상으로 진행됐다. 추첨을 통해 행운의 주인공 총 103명을 선정했으며 당첨자는 광주은행 홈페이지에서 확인할 수 있다. 이날 장학금 증정식에서 1등 당첨자 1명에게는 장학금 100만원, 2등 당첨자 2명에게는 각각 장학금 50만원이 전달됐다. 이외에 행운상  100명에게는 스타벅스 기프티콘 2만원권이 전달됐다. 광주은행 관계자는 “이번 이벤트에 참여해주신 고객 여러분께 감사드리며 앞으로도 광주은행은 미래의 주역이 될 우리 지역 대학생들을 대상으로 지속적인 지원과 다양한 서비스를 제공하는데 최선을 다 하겠다”고 말했다"
디지털타임스,192530,/news/news_read.nhn?article_id=0002459558&office_id=029&mode=search&query=광주은행&page=13,2018-04-19 18:48,"검찰, 광주은행 임직원 2명 구속영장 청구&hellip;채용비리 혐의","20여명 면접점수 조작…6명 최종 합격 광주은행 채용비리 의혹을 수사하고 있는 검찰이 채용과정에서 면접점수를 조작한 혐의로 광주은행 임직원 2명에 대해 구속영장을 청구했다. 19일 금융권에 따르면 광주지검은 업무방해 혐의로 광주은행 임원 서모씨와 중간 관리자급 직원 황모씨에 대해 구속영장을 청구했다. 이들은 2016년 신입 행원 채용 과정에서 20여명의 1차 면접점수 결과를 조작한 혐의를 받고 있다. 당시 이들은 인사나 채용 관련 권한이 없음에도 면접관들에게 면접자 점수를 고치도록 해, 1차 면접점수가 나온 상황에서 면접점수를 임의로 올려 기준을 충족시켰다. 1차 면접 대상자는 180여명으로, 점수가 조작된 것으로 밝혀진 20여명을 포함한 60여명이 1차 면접을 통과했다. 특히 최종 합격자 36명 중 면접 점수가 조작된 것으로 드러난 6명이 포함됐다. 광주은행은 이에 대해 성별·학교별로 인원수를 맞추기 위해 점수를 고친 것이라고 주장하고 있지만, 당시 광주은행은 성별·학교별 인원수에 대한 채용 기준이 없었던 것으로 확인됐다. 게다가 성별·학교별 인원수를 임의를 조정한 것 역시 현행법상 불법이다."
연합뉴스,192530,/news/news_read.nhn?article_id=0010035292&office_id=001&mode=search&query=광주은행&page=13,2018-04-19 15:37,"광주은행, 20여명 면접점수 조작&hellip;6명 최종 합격(종합)","광주지검, 채용비리 의혹 임직원 2명 구속영장 청구 광주은행 ""성별·학교별 안배 차원서 점수 고쳤다"" 해명 광주은행 임원실·인사부[연합뉴스 자료사진] (광주=연합뉴스) 장덕종 기자 = 검찰이 채용과정에서 면접 점수를 조작한 혐의로 광주은행 임직원들에 대해 구속영장을 청구했다. 광주지검 특수부(허정 부장검사)는 업무방해 혐의로 광주은행 임원 서모씨와 중간 관리자급 직원 황모씨에 대해 구속영장을 청구했다고 19일 밝혔다. 이들 임직원은 범행 당시 광주은행 본점에서, 현재는 광주은행 자회사에서 근무하는 것으로 알려졌다. 이들은 2016년 신입 행원 채용과정에서 20여명의 1차 면접점수 결과를 조작한 혐의를 받고 있다. 이들은 당시 인사나 채용 관련 권한이 없는데도 당시 면접관들에게 이들 면접자 점수를 고치도록 한 것으로 조사됐다. 당시 1차 면접은 면접관들이 각 항목에 점수를 부여하는 절대평가 방식이었다. 일정 기준 점수 이상이면 2차 면접을 볼 수 있다. 이미 1차 면접점수가 나온 가운데 이들의 요청으로 이들 면접자 점수를 임의로 올려 기준을 충족했다. 점수가 임의로 올라갔고 이 때문에 다른 20여명의 점수가 기준 점수 이하로 떨어지면서 채용이 되지 못한 셈이다. 이들은 성별·학교별로 인원수를 맞추려 점수를 고친 것이라고 주장하는 것으로 전해졌다. 그러나 당시 이 은행에는 성별·학교별 인원수에 대한 채용 기준이 없는 것으로 확인됐다. 또 성별·학교별 인원수를 임의로 조정하는 것은 현행법상 불법이다. 당시 1차 면접 대상은 180여명으로 점수가 조작된 것으로 밝혀진 20여명을 포함한 60여명이 1차 면접을 통과해 2차 면접을 봤다. 당시 최종 합격자는 36명이며 이 가운데 이번에 점수가 조작된 것으로 드러난 6명도 합격자에 이름을 올렸다. 검찰은 이들을 상대로 청탁이 있었는지, 관련자가 추가로 있었는지 등을 수사하고 있다. 검찰 관계자는 ""성별·학교별로 안배하려 일부 점수를 고쳤다고 하지만 그 자체가 불법이다. 당시 관련 기준도 없는 것으로 확인돼 조작 근거도 되지 못한다""며 ""관련자가 더 있는지, 다른 해에도 채용비리가 있었는지를 추가로 수사할 계획이다""고 밝혔다. 이번 광주은행 채용비리 정황은 2015년 이 은행 부행장보가 딸 면접위원으로 참여해 채용비리 의혹이 있다며 금융감독원이 수사 의뢰한 건을 수사하는 과정에서 불거졌다. 검찰은 이 사건을 수사하는 과정에서 2016년에도 채용비리 정황이 있는 사실을 추가로 확인해 수사를 벌여왔다. 이들에 대한 구속전피의자심문(영장실질심사)은 이날 오전 광주지법에서 열렸다. 구속 여부는 이날 오후 늦게 나온다."
뉴스1,192530,/news/news_read.nhn?article_id=0003326509&office_id=421&mode=search&query=광주은행&page=13,2018-04-19 15:19,"檢, '채용비리 의혹' 광주은행 간부 2명 영장 청구",광주고등지방검찰청 전경. © News1DB (광주=뉴스1) 전원 기자 = 광주지검은 광주은행 채용비리 의혹을 수사 중인 검찰이 점수 조작에 가담한 혐의(업무방해)로 광주은행 간부 2명에 대해 구속영장을 청구했다고 19일 밝혔다. 검찰에 따르면 이들은 지난 2016년 신인 행원 채용과정에서 시험에 응시한 20여명의 1차 면접점수를 조작한 혐의를 받고 있다. 이들은 성별과 출신학교별 채용 인원을 조정하기 위해 범행을 저지른 것으로 알려졌다. 하지만 이들은 자신의 혐의를 부인하고 있는 것으로 전해졌다. 앞서 대검찰청은 금융감독원으로부터 2개 시중은행과 3개 지방은행 채용비리 관련 수사 참고자료를 접수받아 관할 지검으로 해당 자료를 송부했다. 광주은행은 임원이 자녀의 2차 면접위원으로 참여하는 등 채용비리가 있었던 것으로 확인됐고 관할 지검인 광주지검이 수사를 담당하게 됐다 이에 검찰은 광주은행 본점과 광주은행비즈니스를 압수수색 했다. 광주은행은 사과문을 내고 재발방지 절차를 마련하겠다고 밝혔다
