source,symbol,link,date,title,content
한국경제,192530,/news/news_read.nhn?article_id=0003852856&office_id=015&mode=search&query=광주은행&page=30,2017-11-19 20:07,첫 내부출신 송종욱 광주은행장&hellip;&quot;5년내 이익 절반 수도권서 낼 것&quot;,"영업 최우선 전략으로 100년 은행 기반 다질 것수도권 점포·고객층 늘려…순익 비중 27%→50%중국 우시에 첫 해외 사무소 [ 윤희은 기자  ] 송종욱 광주은행장(55·사진)은 “더 이상 시중은행과 지방은행 영역을 구분하는 건 의미가 없다”며 “4~5년 안에 전체 순이익의 절반을 서울·수도권에서 올리겠다”고 밝혔다. 또 “체질 개선을 통해 광주은행을 ‘100년 은행’으로 만드는 기반을 다지겠다”고 강조했다. 송 행장은 지난 17일 서울 여의도 JB빌딩에서 한국경제신문과 인터뷰하고 이 같은 경영전략을 제시했다. 지난 9월27일 취임한 그는 광주은행 역사상 첫 내부 출신 최고경영자(CEO)다. 김한 JB금융그룹 회장은 2014년 광주은행 인수 이후 3년간 겸직한 광주은행장 자리를 송 행장에게 맡겼다. “누구보다 광주은행을 잘 아는 적임자”라는 게 김 회장이 그를 점찍은 이유다. 송 행장은 “광주은행은 2014년 JB금융 계열사가 된 이후 비약적으로 성장했다”며 “김 회장 주도 아래 2014년 521억원이던 순이익을 지난해 1033억원, 올 3분기 누적 1285억원으로 늘렸고 지방은행 중 주가도 가장 높다”고 설명했다. 그는 취임 후 첫 경영전략으로 ‘세일즈 퍼스트(영업 제일주의)’를 내걸었다. “강한 영업력이 곧 은행 경쟁력”이란 생각에서다. 이를 위해 본점 인력 530명 중 10%를 일선 영업점으로 전진 배치하기로 했다. 본점·영업점 전 분야에 걸쳐 보고체계를 간소화한 ‘페이퍼리스 시스템’도 구축할 계획이다. 그는 “영업하기 바쁜 일선 지점에서 본점에 보낼 보고서를 쓰는 데 시간을 허비해선 안 된다”며 “은행의 비효율을 없애는 등 당분간 체중 늘리기보다 체력을 키우는 데 주력할 계획”이라고 설명했다. 무한경쟁 시대를 맞고 있는 은행산업 변화에 대응해야 한다는 점도 강조했다. 그는 “시중은행이 지방의 시·군금고 쟁탈전에 뛰어들고, 인터넷전문은행 출범으로 영업 지역 구분이 사라졌다”며 세 가지 대응전략을 내놨다. 먼저 영업 기반인 광주·전남지역에서의 입지 강화다. 그는 “광주·전남은 광주은행의 텃밭이지만 22개 시·군 가운데 광주은행이 시·군금고 사업자인 곳은 10곳뿐”이라며 “3년 안에 최대한 많은 시·군금고를 확보하겠다”고 말했다. 수도권 영업 강화도 예고했다. 송 행장은 “수도권은 광주은행의 미래 성장 기반”이라며 “광주·전남 출신 기업 및 출향민 500만 명을 대상으로 한 영업을 확대하겠다”고 했다. 내년 초 전략상품인 ‘광주·전남애(愛) 사랑카드’(가칭)도 내놓을 계획이다. 카드 사용액 중 일정액이 사용자 고향에 자동 기부되도록 설계한 특화상품이다. 그는 “광주·전남지역 오피니언리더뿐 아니라 이 지역 출신 기업인, 소비자를 겨냥해 내놓을 것”이라며 “이 같은 영업을 통해 현재 수도권 점포 31곳의 순이익은 광주은행 전체 순익의 27%가량인데 이를 4~5년 안에 절반까지 끌어올리겠다”고 강조했다. 모바일·자산관리(WM) 분야 경쟁력도 키울 계획이다. 중간등급 신용자를 겨냥한 모바일 중금리대출(더드림론) 등 상품군을 대폭 확대하고 하나투어 등 이종 기업과의 융합 상품도 내놓기로 했다. 올해 말 은행 내에 디지털본부를 신설하고 내년 초엔 인터넷뱅킹도 전면 개편할 계획이다. 또 현재 30곳가량인 프라이빗뱅킹(PB)센터를 20~30곳 추가로 늘리고 내년 초엔 전문인력 양성소인 PB사관학교도 만들 예정이다. 오는 22일 중국 우시에 첫 현지사무소를 내는 등 해외 진출도 본격화한다. 송 행장은 “고객은 0.5%포인트 금리에 은행을 바꾸지는 않는다”며 “시중은행보다 상품 다양성 등은 뒤처지지만 광주은행이 잘할 수 있는 틈새를 찾아 경쟁력을 키울 것”이라고 말했다. 그는 “20일이 광주은행 창립 49주년”이라며 “49주년 이전과 이후의 광주은행은 달라야 하고, ‘100년 은행’의 토대를 다져야 할 때”라고 강조했다."
파이낸셜뉴스,192530,/news/news_read.nhn?article_id=0003790659&office_id=014&mode=search&query=광주은행&page=46,2017-03-17 15:05,"[fnRASSI]광주은행, 52주 신고가...0.44% &uarr;","광주은행(192530)은 52주신고가를 기록하고 있어 주목할만하다. 동종목의 현재 주가는 11,350원 선에서 이루어지고 있다. 거래일을 기준으로 최근 3일간 평균 거래량은 43만 주이다. 이는 60일 일 평균 거래량 7만 주와 비교해보면 최근 거래량이 급격히 늘어났다는 것을 알 수 있다. 외국인/기관 순매수, 개인은 순매도(한달누적)  외국인과 기관의 동반 순매수가 눈에 띈다. 어제까지 외국인은 5일 연속 동종목을 사들였고, 기관도 9일 연속 순매수를 보이고 있다. 4주간을 기준으로 보면 외국인이 순매수량을 늘리며 335,226주를 순매수했고, 기관도 초반에 동종목을 순매수한 이후에 기세를 이어가며 162,848주를 순매수했다. 반면 개인들은 매도 관점으로 접근하면서 498,074주를 순매도한 것으로 나타났다. 상장주식수 대비 거래량은 0.14%로 적정수준 최근 한달간 광주은행의 상장주식수 대비 거래량을 비교해보니 일별 매매회전율이 0.14%로 집계됐다. 그리고 동기간 장중 저점과 고점의 차이인 일평균 주가변동률을 3.53%를 나타내고 있다. 'fnRASSI'는 증권전문 기업 씽크풀과 파이낸셜뉴스의 협업으로 로봇기자가 실시간으로 생산하는 기사입니다."
서울경제,192530,/news/news_read.nhn?article_id=0003146402&office_id=011&mode=search&query=광주은행&page=31,2017-11-06 16:12,광주은행 소상공인 위해 6억 출연,"[서울경제] 송종욱(왼쪽) 광주은행장, 박종광 광주신용보증재단 이사장이 6일 광주 동구 대인동 광주은행 본점에서 열린 ‘상생발전을 위한 지역 소기업·소상공인 금융지원 업무협약식’에서 기념촬영을 하고 있다. /사진제공=광주은행"
머니S,192530,/news/news_read.nhn?article_id=0000267878&office_id=417&mode=search&query=광주은행&page=37,2017-08-31 16:12,광주은행 &lsquo;희망이 꽃피는 공부방&rsquo; 32호점 선정,"본문 이미지 영역 광주은행은 31일 오후 3시 광주 광산구 도산동에 위치한 은혜지역아동센터에서 ‘희망이 꽃피는 공부방’ 32호점 선정식을 가졌다고 밝혔다.  ‘희망이 꽃피는 공부방’ 32호점으로 선정된 은혜지역아동센터는 지역 아동들에게 방과 후 돌봄 서비스와 학습지도를 통해 지역 아동들이 건강한 사회일원으로 성장하도록 돕고 있는 아동복지시설이다. 광주은행 지역사랑봉사단은 이날 선정식 후 안전하고 편리한 학습환경을 만들어 주기 위해 학습실에 책상과 의자를 새 것으로 바꾸고 장판과 도배작업을 실시했다.   마재필 광주은행 부행장은 “지역 아동들이 새롭게 바뀐 공부방에 만족하며 즐거워하는 모습을 보며 보람을 느낀다”며 “앞으로 우리 지역의 아동들이 건강하게 성장할 수 있도록 방과 후 아동들의 학습 장소이자 쉼터인 희망이 꽃피는 공부방을 앞으로도 지속적으로 지원하겠다”고 말했다. 광주=이재호 기자 머니S 관련뉴스해당 언론사에서 선정하며 언론사 페이지(아웃링크)로 이동해 볼 수 있습니다.오나라 ""남자친구와 18년째 열애중, 결혼이 중요해요?""'라디오스타' 김생민 조롱, MC들 태도 논란… ""무례하다""청와대 ""문재인 대통령, '국군의 날' 변경 지시 안해""아파트투유, 성남 '산성역 포레스티아' 청약접수… 31일 1순위부터트럼프 ""대화는 답 아니다""… 틸러슨과 '엇박자'"
머니S,192530,/news/news_read.nhn?article_id=0000267814&office_id=417&mode=search&query=광주은행&page=37,2017-08-31 11:26,"광주&middot;전북은행, 2분기 재무건전성 개선&hellip; 총자본비율 상승","지난 2분기 광주·전북은행의 BIS 기준 자본비율이 전분기보다 상승하며 재무건전성 지표가 개선된 가운데 두 은행을 계열사로 두고 있는 JB(전북)금융지주의 자본비율도 높아진 것으로 나타났다. 31일 금융감독원이 내놓은 ‘2017년 6월 말 은행 및 은행지주회사 BIS기준 자본비율(잠정)현황’에 따르면 광주은행의 총자본비율은 15.53%로 전분기 14.94%에 비해 0.59%포인트 상승했다. 보통주·기본자본비율은 각각 11.21, 11.95%로 전분기 10.58, 11.30%에 비해 각각 0.63, 0.65%포인트 상승했다.전북은행 총자본비율은 13.89%로 전분기 13.54%에 비해 0.35%포인트 상승했다. 보통주·기본자본비율은 9.9, 10.40%로 전분기 9.56, 9.56%에 비해 각각 0.38% 상승했다.광주·전북은행의 총자본비율은 당기순이익 증가 및 유상증자 등에 힘입어 개선된 것으로 분석됐다.한편 광주·전북은행을 자회사로 둔 전북은행지주의 총자본비율은 12.13%로 전분기 11.87%에 비해 0.26%포인트 상승했다. 보통주·기본자본비율도 8.30, 9.55%로 전분기 8.00, 9.26%에 비해 각각 0.30%포인트 상승한 것으로 나타났다. 광주=이재호 기자 머니S 관련뉴스해당 언론사에서 선정하며 언론사 페이지(아웃링크)로 이동해 볼 수 있습니다.원세훈 경호원들 '눈길', 앳된 얼굴에 젊은층 헤어스타일'인천 초등생 살인사건' 주범 20년, 공범 무기징역 구형… 소년법 기준건양대, 김희수 총장 갑질 의혹에 '시끌'[CEO] '갑질 회장님' 또 추가요[머니포커S] 지방은행 수난시대"
파이낸셜뉴스,192530,/news/news_read.nhn?article_id=0003847530&office_id=014&mode=search&query=광주은행&page=41,2017-07-21 09:33,"[fnRASSI]광주은행(192530), 52주 신고가...1.5% &uarr;","광주은행(192530)은 52주신고가를 기록하고 있어 주목할만하다. 동종목의 현재 주가는 13,550원 선에서 이루어지고 있다. 거래일을 기준으로 최근 3일간 평균 거래량은 14만 주이다. 이는 60일 일 평균 거래량 7만 주와 비교해보면 최근 거래량이 다소 증가했다는 것을 알 수 있다. 외국인 보유량 증가, 기관 감소 (5일 누적) 최근 5일간 동종목의 외국인 투자자는 13,415주 순매수하였고 반면 기관은 1,190주 순매도하였다. 전날 두 주체 각각 691주, 1,190주 순매도하며 보유 비율을 줄였다. 다음 표는 동종목의 외국인, 기관의 일별 순매수량을 나타낸 것이다. 거래비중 기관 24.17%, 외국인 19.21% 최근 한달간 주체별 거래비중을 살펴보면 개인 비중이 56.6%로 가장 높았고, 기관이 24.17%로 그 뒤를 이었다. 외국인은 19.21%를 나타냈다. 그리고 최근 5일간 거래비중은 개인이 전체 거래의 56.07%를 차지하며 가장 적극적인 모습을 보여줬고, 기관은 27.99%를 나타냈으며 외국인은 15.92%를 나타냈다. 'fnRASSI'는 증권전문 기업 씽크풀과 파이낸셜뉴스의 협업으로 로봇기자가 실시간으로 생산하는 기사입니다."
아시아경제,192530,/news/news_read.nhn?article_id=0003991398&office_id=277&mode=search&query=광주은행&page=43,2017-05-11 11:00,[소프트M]광주은행 '전역장교' 특채 6년만에 부활,"밀리터리 스펙, 바늘권 금융권 채용에 다시 인기 불어…군 경력자, 조직 충성도 생산성 높아  [아시아경제 구채은 기자] '밀리터리 스펙(군 경력)'이 바늘구멍 금융권 채용에서 다시 조명받고 있습니다. 광주은행은 이달초 '기 전역장교 및 올 6월말 전역예정 장교인 자'를 대상으로 채용공고를 냈습니다. 서류전형 합격자는 1차면접과 인ㆍ적성검사, 2차 면접과 채용검진을 걸쳐 합격하게 됩니다. 성적이나 전공에 제한은 없으나 금융관련 자격증 소지자는 우대한다고 합니다. 광주은행이 전역장교만을 대상으로 별도 공채를 낸 것은 처음은 아닙니다. 1994년과 2011년에 전역장교만을 대상으로 한 채용을 진행했습니다. 하지만 매년 정기적으로 돌아오는 채용이 아닌데다 모집규모가 많진 않습니다. 광주은행은 지난 2011년엔 전역장교 12명을 채용했습니다. 은행원 대상 전역장교 특채는 흔한 공채는 아닙니다. 대부분 일반직 은행 신입공채 때 전역장교를 같이 뽑는데다 최근 들어선 은행마다 몸집 줄이기가 한창이여서 일반직 공채 자체가 가물에 콩나듯 하는 경우가 다반사입니다. ""장교출신 은행원들의 조직충성도나 업무생산성이 높다는 게 전례를 통해 확인돼 올해 채용을 하게됐다""면서 ""아직 정기채용으로 굳히진 않았지만 올해 뽑아보고 앞으로도 정기적으로 채용할지 여부를 판단할 것""이라고 광주은행 관계자가 말했습니다. 얼마전 채용이 끝난 대구은행의 대졸 신입 공채에도 35명 모집에 1500명이 몰려 45:1의 경쟁률을 기록했습니다. 지방은행이라 하더라도 복지나 연봉수준은 수도권 시중은행과 크게 차이가 나진 않아 경쟁률이 꽤 높습니다. '밀리터리 스펙' 채용의 부활이 금융권 우수 인재 모집에 새 활로가 될 지 기대해봅니다."
한국경제,192530,/news/news_read.nhn?article_id=0003852857&office_id=015&mode=search&query=광주은행&page=30,2017-11-19 20:09,"송종욱 광주은행장은&hellip;지점장 가는 곳마다 두배 실적, JB금융그룹 내 '영업의 달인...","[ 윤희은 기자  ] 송종욱 광주은행장은 광주은행뿐 아니라 JB금융그룹 내에서 ‘영업의 달인’으로 통한다. 지점장을 맡은 곳마다 2년 안에 예금·대출 실적을 두 배로 늘린 탁월한 영업력 덕분이다. 1991년 광주은행에 입행한 그는 39세이던 2001년 광주 금호동 지점에서 첫 지점장 생활을 시작했다. 당시 금호동지점은 수년째 영업실적이 좋지 않아 곧 폐점될 것이란 얘기가 돌았다. 지점장 부임 첫날부터 그는 단 하루도 거르지 않고 금호동 곳곳을 누볐다. 그렇게 2년여 동안 ‘발품 영업’을 한 결과 금호동지점은 광주은행 내 1등 지점이 됐다. 그가 지점장으로 부임하기 전 89억원이던 지점의 대출잔액은 2년 새 550억원으로 늘었고 예금잔액은 224억원에서 580억원이 됐다. 다음으로 맡은 순천지점에선 1년6개월 만에 대출 및 예금잔액을 두 배로 키웠다. ‘영업 잘한다’는 평가를 받은 그는 2005년 상경(上京)을 명 받았다. 서울 여의도지점장을 맡으라는 임무가 떨어졌다. 당시 서울은 지방은행의 불모지나 다름없었다. 덩치 큰 시중은행들과 경쟁하기엔 지점 수, 영업망 등이 비교가 안 되기 때문이다. 당시 광주은행의 서울 지점도 3곳에 불과했다. 하지만 송 행장은 여의도지점을 맡은 지 2년 만에 대출잔액을 150억원에서 550억원으로 늘리는 성과를 올렸다. 지점장 부임 전 6000억원이던 예금잔액은 1조2000억원으로 두 배 이상으로 불렸다. 지방은행 서울지점이 ‘예금 1조원’을 넘어선 건 이때가 처음이다. 송 행장은 “영업의 진리는 ‘불가능은 없다’는 것”이라며 “경쟁 은행이 고객을 한 번 찾을 때 우리는 열 번 찾아가는 진정성을 보이는 게 영업의 기본”이라고 했다."
이데일리,192530,/news/news_read.nhn?article_id=0003714714&office_id=018&mode=search&query=광주은행&page=50,2016-12-30 17:33,"광주은행, 설명절 중소기업 특별자금 3천억원 신규 지원","[이데일리 김경은 기자] 광주은행이 설 명절을 맞아 자금애로를 겪고 있는 지역 소재 중소기업을 지원하기 위해, ‘설명절 중소기업 특별 대출’로 신규자금 3000억원을 편성해 내달 2일부터 2월 28일까지 지원한다. 또 3000억원의 만기연장 자금을 함께 편성하여 이 기간 중 만기도래 대출금에 대해 특별한 경우를 제외하고 차주가 원할 경우 만기연장 해주기로 했다. 광주은행의 이번 설명절 중소기업 특별 대출은 민생안정 대책의 일환으로 지역 중소기업의 노무비나 체불임금 지급, 원자재 구입자금, 긴급결제 자금 등을 자금 수요가 집중되는 설 이전부터 발빠르게 지원하는 정책으로 그 의미가 있다. 이번 특별 대출의 업체당 지원한도는 최고 30억원 이내이며, 금리는 산출금리 대비 최대 1.0%포인트를 우대하고, 한국은행 중소기업 지원자금 차입시 최고 1.2%포인트까지 우대하여 중소기업의 금융 부담을 덜어줄 예정이다."
연합뉴스,192530,/news/news_read.nhn?article_id=0009636404&office_id=001&mode=search&query=광주은행&page=33,2017-10-26 11:48,[국감현장] 한국은행 광주전남&middot;목포본부 성추문 도마 위에,"(광주=연합뉴스) 전승현 기자 = 국회 기획재정위원회의 26일 한국은행 광주전남본부와 목포본부에 대한 국정감사에서는 일부 간부의 성추문이 도마 위에 올랐다. 더불어민주당 박영선 의원은 ""목포본부 부본부장급 간부가 지속해서 여직원을 언어적으로 성희롱한 사건이 발생했고 광주전남본부 팀장은 제가 입에 담기 그럴(어려울) 정도로 또 다른 (성추문) 사건을 일으켰다""며 ""이런 일이 반복되지 않도록 대책을 세워야 한다""고 밝혔다. 박 의원이 지적한 광주전남본부 팀장 사건은 해당 팀장이 광주전남본부 관사 등에서 유부녀와 부적절한 관계를 맺었다는 혐의로 유부녀 남편으로부터 피소됐다. 박 의원은 ""특히 해당 팀장이 서울로 발령 난 것은 문제가 있는 것 아니냐""며 ""반드시 문책이 있어야 한다""고 지적했다. 이에 대해 박양수 한국은행 광주전남본부장은 ""팀장의 발령 부분은 조사하고 있다""며 ""한국은행에 대한 국민에 대한 도덕적 기대감이 높아진 만큼 공직기강을 확립하겠다""고 말했다."
머니S,192530,/news/news_read.nhn?article_id=0000273298&office_id=417&mode=search&query=광주은행&page=34,2017-10-11 14:53,"광주은행, &lsquo;유&middot;스퀘어&rsquo; 제휴카드 출시","본문 이미지 영역 광주은행이 지역 대표 복합문화생활공간인 유·스퀘어와 금호아시아나그룹 주요 계열사를 이용하는 고객을 대상으로 풍성한 혜택을 제공하는 ‘아름다운 유·스퀘어 KJ카드’를 출시했다.  11일 광주은행에 따르면 ‘아름다운 유·스퀘어 KJ카드’는 CGV, 영풍문고, 자연별곡, 엔제리너스 등 유·스퀘어 입점 가맹점 이용시 10% 포인트 적립 서비스와 광주, 전남, 전북 주요 백화점 및 대형마트 10% 포인트 적립 서비스, 전국 S-Oil 및 현대오일뱅크 리터당 100포인트 적립 서비스 그리고 교통업종과 3대 이동통신 요금 결제시 5% 포인트 적립 서비스를 제공하는 특화카드다. 포인트 적립 서비스는 전월 이용실적 40만원 이상시 제공하며, 카드 이용실적에 따라 업종별로 최소 5000 포인트에서 최대 2만 포인트가 적립돼 각 업종별 적립포인트 합산 시에는 월 최대 6만5000 포인트까지 적립이 가능하다. 적립된 포인트는 결제계좌에 캐시백 입금은 물론 유·스퀘어 가맹점에서 현금처럼 제한없이 사용 가능하며, 연회비는 국내 전용 1만원, 국내외겸용은 1만3000원이다. 광주은행과 유스퀘어는 이번‘아름다운 유·스퀘어 KJ카드’ 출시를 기념해 금호리조트 우대할인, 유·스퀘어 문화관 동산아트홀 기획 연극 및 뮤지컬 2~4인 60% 할인, 금호타이어 10~30%할인, 금호고속 전세버스 대절 5% 할인 등 금호아시아나 그룹 계열사의 현장 할인 이벤트를 실시한다. 또 롯데리아, 버거킹, KFC, 애슐리, 자연별곡, 엔제리너스, 카페베네, 파스쿠찌, 파리바게트, 뚜레쥬르, 이가자헤어비스 등 52개 유·스퀘어 가맹점에서 이용금액별 캐시백과 무료음료 제공 등 다양한 서비스를 제공한다. 광주=이재호 기자 머니S 관련뉴스해당 언론사에서 선정하며 언론사 페이지(아웃링크)로 이동해 볼 수 있습니다.오승은 이혼 ""3년전 일, 아이들 아직 몰라… 말하기 쉽지 않아""아파트투유, 부산 '명지 더샵 퍼스트월드' 청약당첨자 발표… 최고경쟁률 195.57대1청주시 공무원, 아파트 베란다서 숨진 채 발견오지은 결혼, 4세 연상 금융업 종사자와 백년가약… ""2년 사랑 결실""경차 유류세 환급 대상자 42만명에 개별 안내… 연 20만원 상당"
파이낸셜뉴스,192530,/news/news_read.nhn?article_id=0003828907&office_id=014&mode=search&query=광주은행&page=42,2017-06-14 09:54,"[fnRASSI]광주은행(192530), 52주 신고가...2.33% &uarr;","광주은행(192530)은 52주신고가를 기록하고 있어 주목할만하다. 동종목의 현재 주가는 13,150원 선에서 이루어지고 있다. 거래일을 기준으로 최근 3일간 평균 거래량은 78만 주이다. 이는 60일 일 평균 거래량 6만 주와 비교해보면 최근 거래량이 급격히 늘어났다는 것을 알 수 있다. 퀀트 재무분석, 종합점수 39점으로 상승                    지표               항목               값               종합점수                 성장성               매출액증가율               0               4.62                 자기자본증가율               0                 안정성               부채비율               0               5.02                 유동비율               100.74                 이익안정성               0                 수익성               ROA               3189.78               6.45                 ROE               0.22                 영업이익율               6.4          광주은행의 퀀트 재무 점수는 16.09점으로 3개월 이전 16.03점보다 올랐다. 지난 분기에 비해 성장성 점수가 하락했다. 수익성 측면에서 볼때 ROA, ROE, 영업이익률 모두 개선되어 이전보다 좋은 점수를 받았다. 외국인/개인 순매수, 기관은 순매도(한달누적)  6월12일부터 전일까지 기관이 2거래일 연속 순매수했다. 4주간을 기준으로 보면 외국인이 85,292주를 순매수했고, 개인들도 초반에 동종목을 순매수한 이후에 기세를 이어가며 196,010주를 순매수했다. 하지만 기관은 매도쪽으로 방향을 잡으면서 281,302주를 순매도했다. 'fnRASSI'는 증권전문 기업 씽크풀과 파이낸셜뉴스의 협업으로 로봇기자가 실시간으로 생산하는 기사입니다."
연합뉴스,192530,/news/news_read.nhn?article_id=0009597605&office_id=001&mode=search&query=광주은행&page=34,2017-10-11 14:44,광주은행 '아름다운 유&middot;스퀘어 KJ카드' 출시,"(광주=연합뉴스) 전승현 기자 = 광주은행은 지역 대표 복합문화생활공간인 유·스퀘어 등지에서 혜택을 볼 수 있는 '아름다운 유·스퀘어 KJ카드'를 11일 출시했다. 아름다운 유·스퀘어 KJ카드는 CGV, 영풍문고, 자연별곡, 엔제리너스 등 유·스퀘어 입점 가맹점 및 광주, 전남, 전북 주요 백화점, 대형마트 이용 때 10% 포인트 적립 서비스, 전국 S-Oil과 현대오일뱅크 리터당 100포인트 적립 서비스를 제공한다. 광주은행 로고[연합뉴스 자료사진] 또 교통업종과 3대 이동통신 요금 결제 때 5% 포인트 적립 서비스를 한다. 포인트 적립 서비스는 전월 이용실적 40만원 이상 때 제공한다. 카드 이용실적에 따라 업종별로 최소 5천 포인트에서 최대 2만 포인트 적립되며 업종별 적립 포인트 합산 때는 월 최대 6만5천 포인트까지 적립할 수 있다. 적립된 포인트는 결제 계좌에 캐시백 입금되고 유·스퀘어 가맹점에서 현금처럼 제한 없이 사용할 수 있다. 연회비는 국내 전용 1만원, 국내외 겸용 1만3천원이다."
