source,symbol,link,date,title,content
머니S,192530,/news/news_read.nhn?article_id=0000251409&office_id=417&mode=search&query=광주은행&page=43,2017-05-23 14:37,"광주은행, 적십자사 희망나눔 걷기대회 후원금 1000만원 전달",본문 이미지 영역정순자(오른쪽 두번째) 광주은행 부행장이 희망걷기대회 후원금을 전달하고 있다. 광주은행은 23일 본점에서 대한적십자사 광주전남지사 주최 제2회 희망나눔 걷기대회 후원금 전달 행사를 가졌다고 밝혔다.  광주은행은 이날 지역 취약계층 지원을 위한 나눔문화 확산에 기여하고 희망나눔 걷기대회의 성공적인 개최를 기원하기 위해 지난해에 이어 후원금 1000만원을 전달했다.   대한적십자사 광주전남지사 주최로 열리는 제2회 희망나눔 걷기대회는 다음달 3일 오전 9시부터 오후 2시까지 상무시민공원 야외공연장에서 열린다.
데일리안,192530,/news/news_read.nhn?article_id=0002221811&office_id=119&mode=search&query=광주은행&page=30,2017-11-13 10:06,"KB국민은행, 광주시 김대중 컨벤션센터서 'KB평생사랑 콘서트' 개최","KB국민은행은 지난 10일 광주광역시 김대중 컨벤션센터에서 2300여명의 우수 고객을 초청해 2017년 하반기 'KB평생사랑 콘서트'를 개최했다고 13일 밝혔다. 'KB평생사랑 콘서트'는 장기거래 우수고객에 대한 감사의 마음을 '평생사랑'으로 네이밍하고 2006년부터 매년 진행되어온 KB국민은행을 대표하는 대규모 고객초청 문화행사이다. 올해 'KB평생사랑 콘서트'는 상반기에 서울, 인천을 시작으로 하반기에는 부산에 이어 광주까지 총 4개지역에서 개최됐다. 이번 콘서트에서는 국내 최고의 듀엣 MC 컬투의 진행과 함께 전 세대가 공감하며 좋아하는 최고의 가수 김건모, 김태우, 에일리, 헤이즈, 린 등이 출연해 깊은 가을밤의 정취를 한껏 느낄 수 있는 고품격 무대가 펼쳐졌다. 특히 이번 콘서트에서는 KB국민은행 임직원들이 고객들에게 감사의 마음을 전달하기 위해 웰컴 패키지 물품을 제공하고 전문작가의 포토타임 및 'KB Cafeteria'등을 운영해 참석 고객들에게 즐거움을 선사했다. KB국민은행 관계자는 “이번 콘서트를 통해 고객님이 주신 관심과 사랑에 조금이나마 보답할 수 있는 시간이 되길 바란다”며 “앞으로도 KB국민은행은 고객님의 평생금융파트너로써 고객과 함께 할 수 있는 다양한 문화행사를 개최하겠다”고 말했다."
연합뉴스,192530,/news/news_read.nhn?article_id=0009636195&office_id=001&mode=search&query=광주은행&page=33,2017-10-26 11:09,광주국세청&middot;한국은행 광주전남본부 국정감사,(광주=연합뉴스) 정회성 기자 = 26일 광주 북구 오룡동 정부광주지방합동청사에서 국회 기획재정위원회 국정감사가 열리고 있다. 2017.10.26
연합뉴스,192530,/news/news_read.nhn?article_id=0008944967&office_id=001&mode=search&query=광주은행&page=49,2017-01-09 10:05,"광주은행 점포수, 수도권 &uarr;&middot;광주전남 &darr;&hellip;직원 감소 추세","최근 4년 동안 200명 줄어…올해도 대규모 명퇴 가능성 주목 (광주=연합뉴스) 전승현 기자 = 광주은행 점포 수가 수도권은 매년 꾸준히 증가하고, 광주·전남은 감소한 것으로 나타났다. 전체 직원 수도 대규모 명예퇴직으로 최근 4년 동안 200명가량 감소했고 올해도 명퇴 가능성이 주목된다. 9일 광주은행에 따르면 수도권 점포 수는 2014년 4곳에 불과하던 것이 2015년 22곳, 2016년 30곳으로 대폭 늘었다. 이에 따라 수도권 점포 직원 수도 2014년 37명에서 2015년 108명, 2016년 144명으로 증가했다. 반면 광주·전남 점포 수는 2014년 141곳에서 2015년 113곳, 2016년 110곳으로 매년 감소했다. 광주·전남 점포 직원 수도 2014년 1천64명, 2015년 873명, 2016년 756명으로 줄었다. 이처럼 광주은행 점포 수의 수도권 증가·광주전남 감소 추세는 광주은행이 '향토 브랜드'에 집착하기보다는 '수익성'이 큰 수도권 금융시장을 공략하고 있기 때문으로 풀이된다. 광주은행 로고[연합뉴스 자료사진] 특히 2014년 김한 은행장 체제 들어 수도권 공략이 가속화하고 있다. 수도권 집중에 따라 전남 곡성군, 구례군, 진도군에는 광주은행 영업점이 없어 해당 자치단체 주민들은 광주은행을 거래하는 데 애로를 겪는 문제점도 나타난다. 광주은행은 영업방식과 금융환경이 창구 대면에서 인터넷, 모바일, 핀테크(금융기술 접목) 서비스로 변하면서 직원 '구조조정'도 하고 있다. 이와 관련, 광주은행은 명예퇴직 신청을 받아 2015년 88명, 지난해 102명 직원이 회사를 그만뒀다. 이에 따라 광주은행 직원 수는 2013년 1천191명, 2014년 1천101명, 2015년 981명, 2016년 900명 등 최근 4년 동안 200명가량이 감소했다. 직원들은 올해도 명예퇴직 형식을 밟아 '구조조정' 가능성이 있는 것으로 전망하고 있다. 이에 대해 광주은행 관계자는 ""금융환경이 급변해 은행 직원들이 줄어드는 추세""라면서 ""올해는 명예퇴직 실시 여부를 정하지 않았다""고 말했다."
디지털타임스,192530,/news/news_read.nhn?article_id=0002412475&office_id=029&mode=search&query=광주은행&page=41,2017-07-13 15:05,"광주은행, ING생명&middot;처브라이프생명과 방카슈랑스 판매제휴","13일 광주 동구 광주은행 본점에서 진행된 광주은행-ING생명 방카슈랑스 업무제휴 협약식에서 양사 관계자들이 기념촬영을 하고 있다. 광주은행 제공     광주은행은 13일 오전 광주 동구 광주은행 본점에서 ING생명, 처브라이프생명과 '방카슈랑스 판매제휴 협약'을 체결했다. 이번 협약에 따라 광주은행은 오는 17일부터 전 영업점을 통해 ING생명에서 출시한 ING굿스타트 변액 적립보험과 처브라이프생명에서 내놓은 처브라이프 변액 적립보험을 판매한다. ING굿스타트 변액 적립보험은 이용자가 납부하는 보험료에서 계약체결 비용을 받지 않아 더 높은 적립금 수익률을 기대할 수 있고, 유지하는 계약에 대해 확실한 혜택을 제공하는 상품이다. 계약 해지 시에도 납기에 상관없이 최단기납 기준의 해지 공제액을 적용해 이용자에게 돌아가는 혜택이 높다. 처브라이프 변액 적립보험은 국내외 20종의 다양한 펀드를 자유롭게 선택 가능하고, 계약체결비용은 최소화해, 계약관리비용, 추가납입, 중도인출 사업비 및 해지 공제 비용 등을 없앤 상품이다. 또 펀드의 다양한 기능과 펀드관리옵션을 넣은 것이 특징이다."
파이낸셜뉴스,192530,/news/news_read.nhn?article_id=0003788401&office_id=014&mode=search&query=광주은행&page=46,2017-03-13 11:40,"[fnRASSI]광주은행, 52주 신고가...1.83% &uarr;","광주은행(192530)은 52주신고가를 기록하고 있어 주목할만하다. 동종목의 현재 주가는 11,150원 선에서 이루어지고 있다. 거래일을 기준으로 최근 3일간 평균 거래량은 18만 주이다. 이는 60일 일 평균 거래량 7만 주와 비교해보면 최근 거래량이 급격히 늘어났다는 것을 알 수 있다. 외국인과 기관은 순매도, 개인은 순매수(한달누적)  기관이 4일연속 순매수를 보이고 있는 반면에 외국인은 3일연속 순매도를 보이고 있다. 4주간을 기준으로 보면 외국인이 매도 우위를 지속하면서 805주를 순매도했고, 기관도 매도 관점으로 접근하면서 20,961주를 순매도했지만, 개인은 오히려 21,766주를 순매수했다. 기관투자자 연속 1일 순매도 최근 5일간 동종목의 외국인 투자자는 279주 매도하였고 반면 기관은 28,695주 매수하였다. 전날 두 주체 각각 1,052주, 28,695주 순매수하며 보유 비율을 늘렸다. 다음 표는 동종목의 외국인, 기관의 일별 순매수량을 나타낸 것이다. 'fnRASSI'는 증권전문 기업 씽크풀과 파이낸셜뉴스의 협업으로 로봇기자가 실시간으로 생산하는 기사입니다."
연합뉴스,192530,/news/news_read.nhn?article_id=0009284022&office_id=001&mode=search&query=광주은행&page=43,2017-05-23 09:05,광주은행 어르신 전용 점포 확대&hellip;금리우대&middot;수수료 면제 혜택,"광주 남·북구에 이어 올해 동구에 설치 (광주=연합뉴스) 전승현 기자 = 광주은행이 어르신을 위한 전용 점포를 확대한다. 금융권이 비대면 거래가 확대하면서 점포 수를 줄이는 가운데 노령화 시대를 맞아 디지털 금융 거래가 원활하지 않은 노인 배려차원에서다. 광주은행 로고[연합뉴스 자료사진] 광주은행은 2015년 남구 빛고을건겅타운점과 지난해 북구 오치동점을 어르신 전용 점포로 지정한 데 이어 올해 동구에 어르신 전용 점포를 설치한다. 어르신 전용 점포에는 직원 3명가량이 근무한다. 어르신 전용 점포를 이용하는 노인들에게는 금리를 우대하고 창구에서 다른 금융기관으로 돈을 이체하거나 각종 증명서를 발급받을 경우 수수료를 면제해준다. 오치동점은 북구 보건소와 협약을 해 매달 한차례 보건소 직원이 점포로 출장 나와 노인 대상 무료 건강 상담도 한다. 광주은행은 광주 5개 구에 어르신 점포 1개씩을 설치한다는 목표를 정하고 노인이 많이 거주하는 지역 점포를 물색 중이다. 동구의 경우 학동 등이 유력하게 검토되고 있다. 광주은행 관계자는 ""금융환경이 디지털, 비대면이 확산하면서 오프라인에 익숙한 노인들을 위한 전용 점포 개설 필요성이 있다""며 ""금융권 전체적으로 점포 수가 감소하는 추세지만, 노인이 많이 거주한 지역을 선정해 점포를 설치하겠다""고 말했다."
헤럴드경제,192530,/news/news_read.nhn?article_id=0001314417&office_id=016&mode=search&query=광주은행&page=30,2017-11-13 10:33,"KB국민은행, 광주서 &lsquo;KB평생사랑 콘서트&rsquo; 개최","장기거래 우수고객 2300명 대상 문화행사 [헤럴드경제=도현정 기자]KB국민은행이 지난 10일 장기거래 우수고객 2300명을 초청, ‘2017 KB평생사랑 콘서트’를 개최했다. 광주광역시 김대중 컨벤션센터에서 진행된 평생사랑 콘서트는 KB국민은행이 2006년부터 매년 진행해온 대규모 고객 초청 문화행사다. 올해는 상반기에 서울과 인천에서, 하반기에는 부산에 이어 이번에 광주에서 콘서트를 진행했다. 허인 KB국민은행장 내정자가 지난 10일 광주 김대중 컨벤션센터에서 열린 KB평생사랑 콘서트에서 고객들에게 웰컴 패키지를 전달하고 있다. [사진제공=KB국민은행] 인기 개그 듀오 컬투의 사회로 진행된 이번 행사는 김건모와 김태우, 에일리, 헤이즈, 린 등의 인기가수들이 참여해 가을밤의 정취를 고객들에게 전달했다. KB국민은행 임직원들은 웰컴 패키지 물품을 마련해 고객들에게 전달했고, 전문 사진 작가가 나서 사진을 찍으며 행사의 분위기를 화기애애하게 했다. KB국민은행 관계자는 “이번 콘서트가 고객들이 주신 관심과 사랑에 보답할 수 있는 시간이 되길 바란다”며 “앞으로도 KB국민은행은 고객의 평생금융파트너로 고객과 함께 할 수 있는 다양한 문화행사를 개최하겠다”고 말했다."
머니S,192530,/news/news_read.nhn?article_id=0000268545&office_id=417&mode=search&query=광주은행&page=36,2017-09-05 16:29,"광주은행, &lsquo;여행스케치 적금Ⅱ&rsquo; 이벤트 당첨자 경품 증정","본문 이미지 영역 광주은행은 5일 본점 17층 회의실에서 '해피라이프 여행스케치적금Ⅱ' 출시 기념 1차 이벤트 당첨고객에 대한 경품 증정식을 가졌다고 밝혔다.    이번 1차 이벤트는 '해피라이프 여행스케치적금Ⅱ' 출시를 기념해 지난 8월 1일부터 8월 25일까지 가입한 고객을 대상으로 진행했으며, 추첨을 통해 선정된 2명에게 100만원 상당의 커플 해외왕복항공권을 각각 전달했다. 광주은행과 하나투어가 '금융과 여행의 만남‘ 이라는 콘셉트로 지난 8월 새롭게 출시한 '해피라이프 여행스케치적금Ⅱ'는 ▲하나투어 지정대리점 여행상품 결제금액의 3% 캐시백 ▲광주은행 카드로 해당 여행상품 결제 및 해외 사용시 이용금액의 0.5% 추가 캐시백 ▲적금 가입기간 중 환전 시 최대 70%까지 환율우대 서비스 ▲하나투어 그룹사 SM면세점 할인혜택 등을 제공하는 상품이다. 이날 당첨의 주인공이 된 안유지 고객은 “가족 여행을 위해 여행스케치적금을 가입했는데 뜻밖의 행운을 얻게 됐다""면서 ""앞으로도 광주은행 단골 고객으로서 좋은 서비스와 상품에 관심을 가지고 이용하겠다”고 말했다.  한편, 광주은행은 지난달 26일부터 이달 22일까지 '해피라이프 여행스케치적금Ⅱ' 가입고객을 대상으로 2명을 추첨해 커플 해외왕복권을 제공하는 2차 이벤트를 진행 중이며, 5000번째, 1만번째 가입고객에게는 여행마일리지도 제공할 예정이다.  광주=이재호 기자 머니S 관련뉴스해당 언론사에서 선정하며 언론사 페이지(아웃링크)로 이동해 볼 수 있습니다.'갑질 의혹' 육군 제39사단장, 불구속 기소… ""직권남용 혐의 추가""손혜원 의원, 자유한국당 시위 촬영 중 소동… ""빨X이, 쓰X기"" 원색 비난정부, 재정지원 제한 대학명단 공개… 4년제 14곳·2년제 11곳[머니포커S] 먹구름 몰려오는 건설사[잇츠IT] 규제 완화 vs 강화, 빅데이터 논란"
이데일리,192530,/news/news_read.nhn?article_id=0003873336&office_id=018&mode=search&query=광주은행&page=41,2017-07-13 15:32,"광주은행, ING생명&middot;CHUBB생명과 방카슈랑스 판매제휴 체결","[이데일리 전상희 기자] 광주은행은 13일 ING생명·CHUBB생명과 ‘방카슈랑스 판매제휴 협약’을 체결했다고 밝혔다. 이번 협약에 따라 광주은행은 오는 17일부터 전 영업점을 통해 ING생명에서 출시한 ING굿스타트 변액 적립보험과 CHUBB생명에서 출시한 CHUBB라이프 변액 적립보험을 판매한다. ING굿스타트 변액 적립보험은 고객이 납부하는 보험료에서 계약체결비용을 받지 않아 보다 높은 적립금 수익률을 기대할 수 있으며, 계약 해지시에도 납기에 상관없이 최단기납 기준의 해지공제액을 적용해 고객에게 돌아가는 혜택을 높인 것이 특징이다. CHUBB라이프 변액 적립보험은 고객이 국내외 20종의 다양한 펀드를 자유롭게 선택 가능하며 계약체결비용은 최소화하고 계약관리비용, 추가납입, 중도인출 사업비 및 해지공제 비용 등은 없는 상품이다. 펀드의 다양한 기능과 펀드관리옵션을 넣은 것이 특징이다. 김경태 광주은행 WM사업부장은 “이번 협약으로 업계 최초 로보 어드바이저 펀드 탑재로 국내 및 해외 ETF에 분산투자로 저성장 저금리 시대에 새로운 투자기회를 제공하는 ING굿스타트 변액 적립보험 상품과 CHUBB라이프생명의 첫 번째 상품을 판매개시하게 됐다”며 “앞으로도 다양한 상품을 준비해 고객 선택의 폭을 넓힐 수 있게 최선을 다하겠다”고 말했다."
디지털타임스,192530,/news/news_read.nhn?article_id=0002431726&office_id=029&mode=search&query=광주은행&page=30,2017-11-09 18:05,"전북&middot;광주은행, 자산 건전성 분야 `양호`","5대 지방은행 3분기 실적 발표시장금리 상승 영향 순익 증가 경기 개선과 시중금리 상승 등으로 은행 영업환경이 좋아지면서, 지방은행들의 실적도 개선됐다. 하지만 CEO 리스크를 겪은 BNK금융지주 계열사인 부산은행과 경남은행은 다른 지방은행보다 뒤처진 실적을 기록했다. 9일 금융권에 따르면 부산· 경남·대구·광주·전북은행 등 5대 지방은행은 모두 3분기 순익이 증가하는 등 개선된 성적표를 받았다. 특히 대구은행과 전북은행은 순익 증가 폭이 30%를 웃돌았다. 대구은행과 전북은행은 3분기 당기순이익으로 514억원과 143억원을 기록했다. 이는 지난해 같은 기간보다 각각 33.83%와 39.86% 증가한 수치이다. 광주은행도 이 기간 27.14% 증가한 445억원 순익을 거두면서 순익 증가 폭이 세 번째로 높았다. 하지만 자산 규모가 가장 큰 부산은행은 3분기 당기순이익으로 947억원을 기록해, 규모 측면에서는 1위를 나타냈지만, 순익 증가 폭은 0.32%에 불과했다. 관계사인 경남은행도 7.20% 증가한 551억원의 순이익을 나타냈지만, 성장성 측면에서 대구와 전북은행에 크게 못 미쳤다. 자산 건전성 분야에서도 전북은행과 광주은행이 가장 양호했다. 전북은행은 연체율과 고정이하여신비율(부실채권비율)이 각각 0.86%와 0.89%로 전분기보다 0.14%포인트, 0.15%포인트 낮아졌고, 광주은행은 연체율이 0.01%포인트 상승한 0.57%를 나타냈지만, 고정이하여신비율(0.53%)과 연체율 모두 5개 지방은행 중 가장 낮은 수치를 나타냈다. 반면, 부산은행과 경남은행은 다른 지방은행보다 건전성 수치가 높은데다, 전분기 보다 상승하는 등 리스크 관리가 미흡했다. 경남은행은 연체율과 고정이하여신비율이 각각 0.63%와 1.10%로 전분기보다 0.08%포인트와 0.20%포인트 악화됐고, 부산은행은 연체율이 0.35%포인트 상승한 0.86%를 나타냈다. 이처럼 부산은행과 경남은행이 수익성 및 건전성 지표가 뒤떨어진 데는 조선·해운업이 활력이 찾지 못하고 있는 데다, 성세환 전 BNK금융 회장이 주가조작 혐의로 구속된 이후 장기간 경영공백 상태가 계속된 점도 영향을 미친 것으로 판단된다. 금융권 관계자는 ""현재 은행 영업환경은 시중금리 상승에 더불어 대출자산 증가로 성장세가 이어지고 있지만, 부산은행과 경남은행은 경남지역의 산업적 특성과 CEO 리스크로 인한 전략적인 투자가 적시에 이뤄지기 어려워 다른 은행보다 성장세가 주춤한 것으로 보인다""고 말했다. 한편 5대 지방은행의 자산은 대구은행이 59조9374억원으로 가장 많았다. 이어 부산은행(59조4820억원)과 경남은행(45조4553억원), 광주은행(27조4271어구언), 전북은행(17조8955억원) 순이었다."
머니S,192530,/news/news_read.nhn?article_id=0000248370&office_id=417&mode=search&query=광주은행&page=44,2017-05-04 18:24,"JB금융, 1분기 당기순이익 706억원&hellip; 광주은행은 428억원","광주은행이 속한 JB(전북)금융지주의 지난 1분기 당기순이익이 크게 증가하는 등 전체적인 재무실적이 호조를 보인 것으로 나타났다. 4일 JB금융지주에 따르면 올해 1분기 당기순이익(공시기준)은 전년 같은 기간대비 27.9%, 전분기대비 410.8% 증가한 706억원을 시현했다. 이같은 실적은 이자수익자산의 견조한 증가로 이자이익이 지속적으로 증가했고, 적극적인 비용절감과 위험자산감축을 통해 경영의 효율성 및 자산의 질적 개선이 증진했기 때문이다. 또 고객기반확대를 통한 잠재 이익 모멘텀 제고를 위해 적극적인 해외진출 및 디지털역량을 강화해 나간 점이 재무실적 호조로 이어진 것으로 분석됐다. 계열사별로 광주은행의 NIM(순이자마진)은 2.22%로 전분기대비 0.08%포인트 상승했고, 대손비용률(0.12%)은 역대 최저치를 기록하는 등 전 부문의 재무지표 호조로 전년도 동기대비 49.3% 늘어난 428억원의 당기순이익을 시현했다. 전북은행은 안정적인 대출성장과 자산건전성 개선 노력 등으로 대우조선해양(회사채)관련  일회성 요인 반영(손상차손 68억원)에도 불구하고 125억원(PPCB 28억원 포함)의 순이익을 달성했다.  특히 자동차전문여전사인 JB우리캐피탈은 자산의 양적 경쟁을 지양하면서 자산포트폴리오를수익중심으로 다변화함으로써 전분기 대비 24.6% 증가한 185억을 기록했다. JB자산운용은 운용자산이 처음으로 5조원을 넘어서고 특별자산 중심이었던 운용자산포트폴리오도 사모펀드(채권형, 혼합형)가 전체 비중의 55.7% 차지하는 등 종합자산운용사로서의 면모를 갖춰 나가면서 흑자기조를 이어나갔다. 은행의 핵심이익 지표인 그룹(은행) 연간 NIM(순이자마진)은 전분기대비 0.03%포인트 상승한 2.19%(전북은행 2.14%, 광주은행 2.22%)를 나타냈다.  건전성지표인 그룹 고정이하여신비율과 연체비율이 전분기대비 각각 0.12%포인트, 0.07%포인트 하락한 1.04%와 0.97%로 지속적으로 개선되고 있고, 대손비용률(Credit Cost) 역시 자산건전성 개선 영향으로 전분기대비 0.09%포인트 하락한 0.41%(전북은행 0.59%, 광주은행 0.12%)를 기록했다. 경영효율성 지표인 그룹 영업이익경비율(CIR)은 적극적인 비용효율성 강화로 전분기대비 6.5%포인트 감소한 50.5%에 진입했다. 무엇보다 위험가중자산(RWA)의 적극적인 관리와 이익 극대화로 보통주자본비율(CET1)은 8.00%(잠정)로 전분기대비 0.08%포인트 증가했다.    JB금융지주 관계자는 “이번 1분기 당기순익은 전년도 같은 기간과 비교해 크게 늘어나면서 9.6%수준의 ROE(연결기준)를 나타냈는데, 이는 큰 폭의 이자이익 증가(+16.8% yoy)가 견인하면서 동시에 적극적인 경비절감과 대손비용의 하향안정화 등이 뒷받침 됐기 때문에 가능했다”고 분석했다. 또 “앞으로도 선제적인 리스크관리와 수익성 중심의 경영전략을 일관되게 시행 하면서 디지털뱅킹으로 대표되는 미래금융에서의 선도자로 자리매김하기 위해서 전사적인 역량을 집중시켜 나갈 계획이다”고 덧붙였다."
이데일리,192530,/news/news_read.nhn?article_id=0003754202&office_id=018&mode=search&query=광주은행&page=47,2017-02-20 16:47,"광주은행, 광주지역 소상공인 위해 5억원 특별 출연","송종욱(왼쪽)광주은행 부행장이 20일 광주 서구 광주광역시청에서 광주광역시·광주신용보증재단과 ‘2017 골목상권 특례보증 금융지원 업무협약’을 맺은 후 윤장현 광주광역시장과 기념촬영을 하고 있다. [사진=광주은행] [이데일리 전상희 기자] 광주은행이 광주광역시·광주신용보증재단과 함께 지역 소상공인 지원에 나섰다. 광주은행은 광주광역시·광주신용보증재단과 ‘2017 골목상권 특례보증 금융지원 업무협약’을 맺었다고 20일 밝혔다. 광주 은행은 이 협약을 통해 광주 지역 소상공인을 위해 5억원을 출연했다. 이어 21일부터는 ‘골목상권 특례보증대출’을 판매해 자금난으로 어려움을 겪고 있는 지역 내 소상공인들에게 100억원의 특별보증을 지원할 예정이다. 이번 특별보증은 업체당 최대 2500만원까지 지원하며 대출기간은 5년 이내다. 대출 신청 후 1년간 광주시의 2.3% 이자차액 보전으로 최저 0.6%~최고 1.2% 수준의 저금리로 대출을 받을 수 있다. 골목상권 특례보증 협약은 광주광역시와 광주은행 등 금융기관, 광주신용보증재단이 2012년도부터 추진해 온 사업으로 전통시장 발전과 소상공인 경영안정을 도모하기 위해 마련됐다. 광주은행은 지난 2013년부터 지난해까지 4년간 총 18억원을 광주시에 출연해 3200개 업체에 360억원을 지원했다. 송종욱 광주은행 영업전략본부 부행장은 “골목상권 신규창업 지원과 일시적인 자금난을 겪고 있는 소상공인들에게 자금지원을 통해 실질적인 금융애로를 해결함으로써 지역민과 상생 발전하는 지역은행의 소임을 다하겠다”고 말했다."
