source,symbol,link,date,title,content
머니투데이,192530,/news/news_read.nhn?article_id=0004093659&office_id=008&mode=search&query=광주은행&page=2,2018-08-20 15:54,"광주은행, 노인복지관서 삼계탕 배식 봉사활동","[머니투데이 한은정 기자] [송종욱 은행장 및 남구지역 지점장, 직원 등 30여명 참여] 광주은행은 20일 월산동에 위치한 광주남구노인복지관에서 삼계탕 배식봉사활동을 진행했다. 송종욱 광주은행장이 어르신들에게 식사를 대접하고 있다./사진제공=광주은행. 광주은행은 20일 월산동에 위치한 광주남구노인복지관에서 배식봉사활동을 진행했다고 밝혔다. 올 여름 막바지 더위가 예상되는 가운데 광주은행은 무더위에 지친 남구지역 어르신들에게 정성스럽게 준비한 삼계탕 400인분을 대접했다. 이날 봉사활동에는 송종욱 광주은행장과 남구지역 지점장, 직원 30여명이 참여했으며 점심식사 배식 외에도 떡과 음료를 후식으로 제공했다. 또, 현재 광주은행 무더위쉼터에서 배부하고 있는 부채도 함께 전달했다. 배식봉사를 마친 후에는 설거지와 식당청소까지 도맡으며 봉사활동을 마무리했다. 송 행장은 “올 여름 우리 지역의 어르신들을 찾아뵙고 맛있는 점심식사를 대접할 수 있게 돼 기쁘다”며 “앞으로도 광주·전남의 대표 은행으로서 광주의 구별로 어르신들을 위한 배식봉사를 이어가면서 나눔 문화 확산에 앞장서겠다”고 말했다."
조세일보,192530,/news/news_read.nhn?article_id=0002190668&office_id=123&mode=search&query=광주은행&page=2,2018-08-27 16:50,"광주은행, 집중호우 피해업체에 1000억원 특별금융지원","광주은행은 한반도를 관통한 태풍 솔릭과 뒤이어 찾아온 집중호우로 인해 피해를 입은 중소기업 및 개인을 대상으로 피해시설 복구와 금융비용 부담완화를 위한 특별지원을 시행한다고 27일 밝혔다. 이번 특별지원을 통해 태풍 및 수해 피해를 입은 중소기업은 3억원, 개인은 3000만원 이내로 총 1000억원 규모의 긴급경영안정자금을 투입하며 최대 1.5%포인트의 특별금리우대도 적용할 예정이다. 또한 만기가 도래하는 대출금을 보유하고 있는 고객 중 피해고객이 있다면 별도 원금상환 없이 1%포인트의 대출금리 감면을 적용해 기한연장이 가능하며 분할상환금 유예도 시행한다. 아울러 피해업체들에 대한 금융애로 사항을 신속하게 접수·처리할 수 있도록 전 영업점에 상시 지원체제를 도입했으며 직원들을 직접 피해현장에 파견하여 현장점검을 통한 실질적인 지원방안을 강구키로 했다. 광주은행은 “태풍 솔릭에 이어 집중호우로 인해 피해를 입은 업체들에 대한 실질적인 금융 지원방안을 수립해 피해가 최소화 될 수 있도록 최선을 다하겠다”고 전했다."
한국경제,192530,/news/news_read.nhn?article_id=0003998265&office_id=015&mode=search&query=광주은행&page=2,2018-08-20 18:51,"광주은행, 지역 어르신에 삼계탕 대접",송종욱 광주은행장(오른쪽 두 번째)이 20일 광주광역시 월산동 광주남구노인복지관을 찾아 지역 어르신에게 삼계탕 400인분을 대접했다. 송 행장은 막바지 무더위로 고생하는 어르신을 돕기 위해 특별 제작한 부채도 함께 전달했다. 광주은행 제공 [
조세일보,192530,/news/news_read.nhn?article_id=0002177957&office_id=123&mode=search&query=광주은행&page=23,2018-01-31 15:21,"광주은행, 시각장애인 위한 '보이스코드 프로그램' 도입",◆…광주은행이 시각장애인을 위한 &amp;apos보이스코드 프로그램&amp;apos을 도입한다. 사진=광주은행 제공
머니투데이,192530,/news/news_read.nhn?article_id=0003988634&office_id=008&mode=search&query=광주은행&page=25,2018-01-05 04:24,송종욱 광주은행장 &quot;中은행 소수지분 인수 검토&hellip;글로벌&middot;디지털 강화&quot;,"[머니투데이 최동수 기자] [광주은행 첫 행원출신 은행장…올해 50주년 맞아 100년 은행 프로젝트 준비] 송종욱 광주은행장 인터뷰 송종욱 광주은행장은 17년 전인 2001년 첫 지점장(광주 서구 금호동지점) 시절 인연을 맺은 고객들에게 명절 때마다 조그마한 선물을 보낸다. 처음으로 지점장으로 발령 받았을 때 도와준 고객들에게 감사의 뜻을 전하면서 그 때의 열정 가득했던 고객 사랑을 잊지 않기 위해서다. 그는 첫 지점장으로 발령 받은 뒤 2년 동안 휴일을 제외하고 매일 아침, 저녁으로 주요 기업과 기관, 인근 가게를 직접 돌며 수금 업무를 진행했다. 연말에는 망치와 못을 들고 고객을 찾아가 직접 광주은행 달력을 달아줬다. 솔선수범과 진정성은 송 행장의 26년 은행 생활의 모토다. 리더가 한발 더 뛰어야 직원들이 따라오고 고객들에게 진정성을 보여야 신뢰를 얻을 수 있다는 것이다. 광주 서구 금호동지점장을 시작으로 순천지점장, 서울 여의도지점장, 서울영업부장 등 가는 곳마다 실적 1위를 달성할 수 있었던 것도 솔선수범의 리더십과 진정성 있는 태도 덕분이다. 송 행장은 광주은행이 창립 50주년을 맞는 올해 100년 은행 프로젝트를 가동한다. 광주은행 역사상 첫 행원 출신 은행장으로 직원들에게는 장기적인 꿈을, 고객들에게는 희망을 심어주는 게 목표다. 송 행장을 만나 광주은행이 광주·전남 대표은행을 넘어 수도권과 글로벌로 영토를 확장하고 있는 이유와 향후 전략을 들어봤다. -지난해 사상 최대 순이익을 올린 것으로 추정된다."
연합뉴스,192530,/news/news_read.nhn?article_id=0010247465&office_id=001&mode=search&query=광주은행&page=3,2018-08-02 10:39,광주은행 무더위쉼터 인기,(광주=연합뉴스) 광주은행이 모든 영업점을 무더위쉼터로 운영하고 있다. 영업점을 방문하는 고객에게는 생수와 부채를 무료로 제공하고 있다. 2018.8.2 [광주은행 제공]
데일리안,192530,/news/news_read.nhn?article_id=0002279202&office_id=119&mode=search&query=광주은행&page=1,2018-08-31 10:34,"광주은행, 창립 50주년 기념 스마트상품 가입 이벤트 실시","광주은행 모델이 창립 50주년을 기념해 진행되는 스마트상품 가입 이벤트를 소개하고 있다.ⓒ광주은행 광주은행은 오는 9월 3일부터 10월 31일까지 창립 50주년 기념 스마트상품 가입 이벤트를 실시한다고 31일 밝혔다. 이번 이벤트는 광주은행 스마트뱅킹과 웹뱅킹에서 여·수신 상품을 12개월 이상 가입한 개인고객을 대상으로 진행된다. 예금 500만원 이상, 정액식 적금 10만원 이상, 신용대출 500만원 이상 가입한 고객 중 추첨을 통해 총 92명에게 경품 및 모바일 상품권을 제공한다. 이벤트 기간 중 해당 상품 가입고객은 별도 신청 없이 자동응모 되며 중도해지와 대출 상환 계좌는 대상에서 제외된다. 이벤트 경품은 ▲1등(1명) 삼성 플렉스워시 세탁기 ▲2등(2명) 다이슨 공기청정기 ▲3등(4명) 다이슨 헤어드라이기 등이 제공되며, 이밖에 4등 85명에게는 스타벅스 모바일상품권 3만원을 제공한다. 이벤트 추첨 결과는 오는 11월 9일 광주은행 홈페이지에 게시되며 당첨 고객에게는 문자로 개별 통지할 예정이다. 광주은행 관계자는 ""창립 50주년을 맞이해 광주은행의 디지털 고객 분들께 감사의 마음을 전하고자 다양한 경품을 준비했다""며 ""디지털 선도은행으로서 앞으로도 더욱 편리하고 차별화된 금융서비스로 고객과 동행하며 100년 은행으로 나아가겠다""고 말했다."
머니투데이,192530,/news/news_read.nhn?article_id=0003787504&office_id=008&mode=search&query=광주은행&page=52,2016-12-09 17:35,"VIP자문, 광주은행 현 지분율 6.45%&hellip;직전 대비 1.26%p&darr;",[머니투데이 백지수 기자] 광주은행 주주 VIP투자자문은 현 지분율이 6.45%(330만7922주)로 기존 7.71% 대비 1.26%p(64만8712주) 감소했다고 9일 공시했다. textlinktopstart textlinktopend textlinkstart
뉴시스,192530,/news/news_read.nhn?article_id=0008759478&office_id=003&mode=search&query=광주은행&page=2,2018-08-16 16:12,"광주은행, 여수시에 1억원 기탁",【광주=뉴시스】맹대환 기자 = 송종욱 광주은행장(왼쪽)이 16일 전남 여수시청에서 권오봉 여수시장(가운데)에게 사회복지시설 위문 및 기능보강사업비 1억원을 기탁하고 있다. 사진 오른쪽은 허정 전남사회복지공동모금회장. 2018.08.16 (사진=광주은행 제공)
연합뉴스,192530,/news/news_read.nhn?article_id=0010305427&office_id=001&mode=search&query=광주은행&page=1,2018-08-29 10:16,BNK부산은행 광주영업부 4년만에 철수하기로,"""기대만큼 성과 없어""…캐피탈 광주지점·전주출장소 남아 (부산=연합뉴스) 박창수 기자 = BNK부산은행이 호남지역에 둔 유일한 영업점을 철수하기로 했다. 부산은행은 광주 서구에 있는 광주영업부를 올해 연말까지만 운영한다고 29일 밝혔다. 영업부는 문을 닫지만 지방은행 공동정보망 등을 통해 기존 고객의 거래에는 지장이 없을 것이라고 부산은행은 설명했다. 광주영업부는 BNK금융이 경남은행 인수를 계기로 부산·울산·경남권의 한계를 넘고 시장을 확대하기 위해 2014년 7월 설립됐다. 하지만 광주영업부가 기대만큼 실적을 올리지 못하면서 결국 철수 대상이 됐다.    올해 6월 기준 예수금 잔액은 132억원, 대출금은 725억원에 불과하다. 부산은행 광주영업부가 철수하면 BNK금융의 호남 거점은 BNK캐피탈 광주지점과 전주출장소만 남게 된다. 부산은행 본점[연합뉴스 자료사진]"
뉴스1,192530,/news/news_read.nhn?article_id=0003559260&office_id=421&mode=search&query=광주은행&page=1,2018-08-28 17:41,광주은행 '장병내일준비적금' 29일부터 판매,"최고 연 5.2% 금리 제공 광주은행 '장병내일준비적금' 29일부터 판매. © News1 (광주=뉴스1) 박영래 기자 = 광주은행이 군 장병들의 목돈 마련 지원을 위한 '장병내일준비적금'을 29일부터 판매한다. 가입 대상은 현역병, 상근예비역, 의무경찰, 의무소방대원, 사회복무요원으로 1인 1계좌에 한해 가입 가능하며 계좌별 월 적립한도는 20만원이다. 계약기간은 6개월 이상 24개월까지 일 단위로 가입 할 수 있고, 만기일은 전역 예정일로 지정되어 장병들이 목표를 가지고 목돈 마련을 할 수 있게 됐다. 광주은행은 18개월 이상 가입 시 최고 연 5.2% 금리를 제공하고, 정부에서는 재정지원을 통한 추가 적립 인센티브(1%포인트)와 이자소득 비과세 혜택을 부여할 예정이다. 앞서 광주은행은 28일 오후 3시 국방부에서 송영무 국방부장관, 최종구 금융위원장, 기찬수 병무청장, 김태영 은행연합회장, 송종욱 광주은행장 등이 참석한 가운데  '장병내일준비적금' 업무협약을 체결했다. 광주은행 관계자는 ""국방의무를 하고 있는 군 의무 복무병사들이 전역 후 미래를 준비하는 데 도움이 되길 바란다""며 ""앞으로도 사회 공익을 위한 다양한 상품과 금융지원 서비스 발굴에 역량을 집중하겠다""고 말했다."
파이낸셜뉴스,192530,/news/news_read.nhn?article_id=0003948231&office_id=014&mode=search&query=광주은행&page=24,2018-01-21 12:16,"광주은행, 21일 인터넷뱅킹 전면 개편 운영","【광주=황태종기자】광주은행(은행장 송종욱)이 21일 인터넷뱅킹을 전면 개편해 운영에 들어갔다.           고객의 입장을 최대한 반영해 쉽고 편리하게 이용할 수 있게 개편한 '新인터넷뱅킹'은 우선 첫 화면부터 고객 편리성 중심으로 변화시켰다. 조회/이체 등 고객들이 가장 많이 사용하는 주요 기능과 고객들이 가장 많이 찾는 금융상품을 전면 배치한 것이다. 또 당/타행 이체, 예약이체, CMS이체 등 고객이 구별하기 어려웠던 이체 서비스들을 하나의 메뉴로 통합했다. 대량이체도 1000건까지 확대 적용해 편리성을 개선시켰다. 기업인터넷뱅킹의 경우도 다양한 기업 고객의 요구를 적극 반영해 복수결재를 수직/수평 결재가능토록 재구축했다. 지능형 서비스도 적극 도입해 고객이 기존에 이용하던 패턴대로 쉽게 이용할 수 있도록 했다. 자주 이용하는 메뉴도 고객이 설정하지 않고 실제로 많이 이용한 메뉴가 자동으로 포함되도록 했고, 계좌이체시 입금은행도 고객이 자주 입금하는 은행 순으로 자동 정렬된다. 고객의 금융거래 패턴에 따라 필요로 하는 금융상품을 추천하는 개별화된 마케팅 기능도 적용했다. 개인스마트뱅킹도 대폭 개편했다. 고객이 주로 사용하는 로그인, 조회, 이체 메뉴를 대화형 화면 진행으로 개편해 고객들이 이용 속도감과 친화적인 느낌을 가질 수 있도록 개선했다. 스마트뱅킹에서 가입할 수 있는 개인신용대출 상품도 신용도가 높은 고객의 경우 최대 2억원까지 대출을 받을 수 있도록 개편했다. 광주은행 디지털본부 장수연 부행장은 ""이번 개편은 고객의 입장에서 이용 편리성을 높이고 영업점 방문 등 불편함을 줄이는 방향으로 설계했다""며 ""앞으로도 디지털 시대의 흐름에 최적화된 서비스를 할 수 있도록 지속적으로 개선해 나갈 것""이라고 밝혔다."
파이낸셜뉴스,192530,/news/news_read.nhn?article_id=0004084444&office_id=014&mode=search&query=광주은행&page=1,2018-08-30 14:05,"광주은행, 중소기업 특별자금 3천억원 지원","자금수요 많은 추석 앞두고 지역 중소기업에 발 빠른 지원정책 눈길           【광주=황태종기자】광주은행(은행장 송종욱)은 추석을 앞두고 경영자금 마련에 어려움을 겪는 지역 중소기업 지원을 위해 '추석 중소기업 특별자금대출'로 신규자금 3000억원을 편성해 9월 3일부터 10월 31일까지 긴급 지원한다고 밝혔다. 아울러 3000억원의 만기연장자금을 함께 편성해 이 기간 중 기일이 도래한 대출금에 대해서는 특별한 경우를 제외하고는 차주가 원할 경우 만기연장이 가능하도록 했다. 이번 추석 특별자금대출의 업체당 지원한도는 최고 30억원 이내로, 금리는 산출금리 대비 최대 1.5%를 우대해 중소기업의 금융 부담이 줄어들 예정이다. 광주은행은 지역의 어려운 경제 사정을 감안해 민생안정 대책으로 지역 중소기업의 노무비 및 체불임금 지급, 원자재 구입과 긴급결제 자금 등을 지원하기 위해 자금수요가 집중되는 추석을 앞두고 긴급 지원을 결정했다. 광주은행 관계자는 ""이번 추석 특별자금대출 지원으로 지역 중소기업들의 자금난 해소에 많은 도움이 되었으면 좋겠다""며 ""광주·전남의 대표은행이라는 사명감을 가지고 지역 중소기업을 위한 다양한 지원책을 펼쳐 지역과 상생발전해 나가겠다""고 말했다."
아시아경제,192530,/news/news_read.nhn?article_id=0004142274&office_id=277&mode=search&query=광주은행&page=26,2017-12-18 13:56,"광주은행, &lsquo;KJ원더랜드&lsquo; 개관","[아시아경제 구채은 기자] 광주은행(은행장 송종욱)이 18일 본점 1층에서 송종욱 광주은행장과 임직원, 그리고 지역 아동 등 50여명이 참석한 가운데 우리 지역 어린이들을 위한 동화 속 눈의 나라를 재현시킨 ‘KJ원더랜드’ 개관식을 열었다. 세번째 겨울 개관을 맞은 ‘KJ원더랜드’는 본점 1층 KJ스퀘어에 위치하고 있다. 올해는 산타할아버지가 크리스마스를 맞아 우주와 바닷속으로 선물배달 가는 것을 주제로, 우주선과 잠수함을 특별히 제작했다.  KJ원더랜드는 내년 2월14일까지 무료로 자유롭게 관람이 가능하다. 관람시간은 평일 및 주말 오전 10시부터 오후 5시까지다. 평일 유치원 등의 단체 관람시에는 사전 예약이 필요하다.  송종욱 광주은행장은 “정성들여 만든 KJ원더랜드에 많은 지역민들과 어린이들이 찾아와서 즐거운 추억을 만들기를 바란다”며, “앞으로도 광주은행은 광주전남 대표은행으로서 다양하고 지속적인 지역공헌사업을 펼치겠다”고 말했다."
조세일보,192530,/news/news_read.nhn?article_id=0002190865&office_id=123&mode=search&query=광주은행&page=1,2018-08-30 10:58,"광주은행, 추석 앞두고 중소기업 특별자금 3천억원 지원","◆…광주은행이 추석을 앞두고 중소기업 특별자금 3천억원을 지원한다. 사진=광주은행 제공 광주은행은 추석을 앞두고 경영자금에 애로사항을 겪고 있는 지역 소재 중소기업을 지원하기 위해 추석 중소기업 특별자금대출로 신규자금 3000억원을 편성하여 내달 3일부터 10월 31일까지 긴급 지원한다고 30일 밝혔다. 아울러 3000억원의 만기연장자금을 함께 편성해 이 기간 중 기일이 도래한 대출금에 대해서는 특별한 경우를 제외하고는 차주가 원할 경우 만기연장이 가능토록 했다. 이번 추석 특별자금대출의 업체당 지원한도는 최고 30억원 이내로 금리는 산출금리 대비 최대 1.5%를 우대하여 중소기업의 금융 부담이 줄어들 예정이다. 광주은행은 지역의 어려운 경제 현안을 살펴 민생안정의 대책으로 지역 중소기업의 노무비나 체불임금 지급, 원자재 구입자금, 긴급결제자금을 지원하기 위해 자금수요가 집중되는 추석을 앞두고 발 빠르게 지원하기로 했다. 광주은행은 “이번 추석 특별자금대출 지원으로 지역 중소기업들의 자금난 해소에 많은 도움이 되었으면 한다”며 “지역소재 중소기업을 위한 다양한 지원책을 펼쳐 지역과 상생발전해 나가겠다”고 말했다."
뉴스1,192530,/news/news_read.nhn?article_id=0003556895&office_id=421&mode=search&query=광주은행&page=2,2018-08-27 18:01,"광주은행, 태풍&middot;집중호우 피해업체에1천억 금융지원","광주은행 본점. © News1 (광주=뉴스1) 박영래 기자 = 광주은행(은행장 송종욱)은 태풍 '솔릭'과 뒤이어 찾아온 집중호우로 피해를 입은 중소기업과 개인을 대상으로 신속한 피해시설 복구와 금융비용 부담완화를 위한 특별지원을 시행한다고 27일 밝혔다. 피해를 입은 중소기업은 3억원, 개인은 3000만원 이내로 총 1000억원 규모의 긴급경영안정자금을 투입하며, 최대 1.5%포인트의 특별금리우대도 적용할 예정이다. 만기가 도래하는 대출금을 보유하고 있는 피해고객은 별도 원금상환 없이 1%포인트의 대출금리 감면을 적용해 기한연장이 가능하며, 분할상환금 유예도 시행한다. 아울러 광주은행은 피해업체들에 대한 금융애로 사항을 신속하게 접수·처리할 수 있도록 전 영업점에 상시 지원체제를 도입했다. 직원들을 직접 피해현장에 파견해 현장점검을 통한 실질적인 지원방안을 강구하는 등 피해업체들의 경영안정을 도울 방침이다. 광주은행 관계자는 ""광주·전남 대표은행으로 피해복구 지원에 주도적인 역할로 지역 기업들의 어려움을 함께 극복해 나가겠다""고 말했다."
파이낸셜뉴스,192530,/news/news_read.nhn?article_id=0003935869&office_id=014&mode=search&query=광주은행&page=25,2018-01-03 11:39,"광주은행 KJ카드, '2018 캐시백 BIG 이벤트' 실시","광주은행은 2018년 맞아 광주은행 KJ카드 개인신용카드 고객을 대상으로 '2018 캐시백 BIG 이벤트'를 연말까지 진행한다고 3일 밝혔다. 이번 이벤트는 고객에게 직접적인 혜택인 캐시백을 제공하는 '100일의 약속'과 '365일의 약속' 두 가지 이벤트로 진행하며, 고객은 두 가지 중 하나를 선택하여 응모할 수 있다. 먼저 '100일의 약속'은 이벤트 응모 고객을 대상으로 이벤트 응모 전 후 100일간의 이용액을 비교하여 추가 이용액별로 최대 5만원을 캐시백해 준다. '365일의 약속'은 2018년 연간 개인신용카드 이용 금액에 따라 최대 50만원까지 캐시백하는 이벤트이다. 광주은행 관계자는 ""이번 이벤트는 2018년 무술년 한 해 동안 광주은행 KJ카드를 이용하는 고객들에게 꾸준한 혜택을 제공하기 위해 준비한 것으로, 창립 50주년을 맞은 광주·전남 대표은행 광주은행은 '나와 지역을 잘 아는 우리 모두의 은행'을 만들기 위해 최선을 다하겠다""고 전했다."
연합뉴스,192530,/news/news_read.nhn?article_id=0010247469&office_id=001&mode=search&query=광주은행&page=3,2018-08-02 10:40,광주은행 무더위쉼터 인기,(광주=연합뉴스) 광주은행이 모든 영업점을 무더위쉼터로 운영하고 있다. 영업점을 방문하는 고객에게는 생수와 부채를 무료로 제공하고 있다. 2018.8.2 [광주은행 제공]
파이낸셜뉴스,192530,/news/news_read.nhn?article_id=0003929902&office_id=014&mode=search&query=광주은행&page=26,2017-12-23 09:04,"광주은행, 올 성탄절엔 KJ원더랜드로 오세요","광주은행이 성탄절을 맞아 작년에 이어 광주은행 본점 1층 KJ원더랜드에서 지역 어린이들을 위해 '성탄절 나눔 행사'를 진행한다. 광주은행은 이날 KJ원더랜드에 산타, 삐에로, 인기 캐릭터 인형들을 준비하고, 원더랜드를 방문한 지역 어린이들에게 풍선 선물 등을 선사할 예정이다. 또한 어린이들에게 다양한 체험 학습형 즐길거리와 폴라로이드 사진기로 원더랜드를 배경으로 가족 기념 촬영도 제공한다. 이날 행사는 관람 비용 및 체험 비용을 모두 무료로 진행하며, 이용 시간은 오전 10시부터 오후 5시까지 누구나 자유롭게 이용 가능하다. 광주은행 관계자는 ""광주은행 KJ원더랜드에 다양한 볼거리와 즐길거리가 가득하니 지역민들이 많이 오셔서 아이들과 함께 즐거운 시간을 보내시길 바란다""고 말했다."
연합뉴스,192530,/news/news_read.nhn?article_id=0009834452&office_id=001&mode=search&query=광주은행&page=24,2018-01-24 17:07,"광주은행 임직원들, '체감온도 -20도' 서울서 밥퍼봉사","(광주=연합뉴스) 전승현 기자 = 광주은행 임직원들이 체감온도 -20도까지 내려가는 강력 한파 속에 서울지역 노인들을 위한 배식 봉사활동을 했다. 송종욱 광주은행장 등 은행 임직원 50여명은 24일 서울 청량리에 있는 밥퍼나눔운동본부에서 노인과 노숙인 등 800여 명에게 점심 배식을 했다. 배식은 실내에서 했지만, 임직원들은 건물 안팎을 오가며 물건을 나르고 실외에서 노인과 노숙인들에게 일일이 가래떡을 나눠줬다. 배식 봉사활동 후에는 설거지, 식당 청소도 했다. 이날 서울은 아침 최저기온이 영하 16.3도를 기록해 올겨울 들어 가장 추웠다. 정오 무렵에는 서울의 체감온도는 영하 20.7도를 기록했다. 송종욱 광주은행장은 ""더 많은 임직원이 참여형 사회공헌활동을 전개하고 지속적인 봉사활동으로 나눔 봉사의 아름다운 기업문화를 확산시켜 나가겠다""고 강조했다."
뉴시스,192530,/news/news_read.nhn?article_id=0007637038&office_id=003&mode=search&query=광주은행&page=52,2016-12-07 15:00,"기보, 광주은행과 동반성장 지원 협약","【서울=뉴시스】이근홍 기자 = 기술보증기금은 광주은행과 빛가람 에너지밸리 성공 조성과 우수기업 육성을 위한 동반성장 지원 협약을 체결했다고 7일 밝혔다. 이번 협약에 따른 지원 대상기업은 한국전력과 빛가람 에너지밸리 투자협약을 체결한 기업, 전력·에너지·정보통신·차세대융복합산업 등의 업종을 영위하는 광주·전남 소재 중소기업 등이다. 기보는 지원을 신청하는 기업이 부담하는 보증료를 0.2%포인트 감면하고 보증비율을 90% 이상으로 우대 적용하기로 했다. 기보 관계자는 ""앞으로도 금융기관과의 협업을 통해 지역 내 우수 기술중소기업을 지원하겠다""고 말했다."
