source,symbol,link,date,title,content
머니투데이,222800,/news/news_read.nhn?article_id=0003538411&office_id=008&mode=search&query=심텍&page=1,2015-09-07 15:20,"심텍홀딩스, 심텍 유상증자 현물출자로 지분 17.7% 보유",[머니투데이 김사무엘 기자] 심텍은 제3자 배정 유상증자 방식으로 심텍홀딩스가 자사주 388만3725주를 취득했다고 7일 공시했다. 심텍홀딩스는 심텍 지분 17.7%를 보유하게 됐다. textlinktopstart textlinktopend textlinkstart
이데일리,222800,/news/news_read.nhn?article_id=0003398823&office_id=018&mode=search&query=심텍&page=1,2015-11-18 15:47,"전세호 최대주주 외 1인, 심텍홀딩스 지분율 24.7%&rarr;55.8%",[이데일리 이유미 기자] 전세호 심텍홀딩스(036710) 최대주주외 특별관계자 1인은 심텍홀딩스의 보유주식이 380만6277주(24.73%)에서 1944만5537주(55.75%)로 변경됐다고 18일 공시했다.
연합뉴스,222800,/news/news_read.nhn?article_id=0008796475&office_id=001&mode=search&query=심텍&page=1,2016-11-02 15:58,"심텍홀딩스, 3분기 영업익 98억원&hellip;175.4%&uarr;",(서울=연합뉴스) 조민정 기자 = 코스닥 상장사인 심텍홀딩스는 올해 3분기 연결기준 영업이익이 98억원으로 전 분기보다 175.4% 증가했다고 2일 공시했다. 매출액은 8.3% 늘어난 2천21억원이고 당기순이익은 135억원으로 흑자전환했다.
전자신문,222800,/news/news_read.nhn?article_id=0002613775&office_id=030&mode=search&query=심텍&page=1,2017-06-01 11:09,"[ET투자뉴스]심텍, &quot;고부가 제품 믹스 &hellip;&quot; BUY(I)-유안타증권","유안타증권에서 1일 심텍(222800)에 대해 ""고부가 제품 믹스 개선에 따른 견조한 성장""라며 투자의견을 'BUY(I)'로 제시하였고, 아울러 목표주가로는 14,000원을 내놓았다. 유안타증권 이창영 애널리스트가 동종목에 대하여 이번에 제시한 'BUY(I)'의견은 유안타증권에서는 올해들어 처음 내놓는 매매의견이며 그리고 최근 분기내 발표된 전체 증권사 리포트의 컨센서스와 비교를 해볼 경우에 오늘 발표된 투자의견은 대체적으로 평균치에 해당하는 수준으로, 이번 의견은 동종목에 대한 전체적인 흐름에서 크게 벗어나지 않은 것으로 분석되고 있다. 또한 전일 종가 기준으로 볼때 동종목의 현주가는 이번에 제시된 목표가 대비 28.4%의 추가상승여력이 있다는 해석이 제시되고 있다."
파이낸셜뉴스,222800,/news/news_read.nhn?article_id=0003854366&office_id=014&mode=search&query=심텍&page=1,2017-08-04 13:59,"심텍, 성수기 진입 단계..주식 사모을 시기-교보증권","교보증권은 4일 심텍에 대해 실적과 주가 면에서 성수기에 진입하는 단계라고 판단했다. 김갑호 연구원은 ""심텍의 실적은 하반기 영업이익이 연간 영업이익의 70%를 차지하는 상저하고의 전형적인 계절성을 나타내고 있다""며 ""당연히 주가도 하반기 및 차년도 연초에 강세를 보이고 있다""며 이같이 분석했다. 2·4분기 심텍의 연결기준 매출액 1994억원(+6.8%YoY), 영업이익 79억원(+31.7%YoY, opm4.0%)을 기록했다. 김 연구원은 ""3·4분기 매출액은 2120억원(+6.3%YoY), 영업이익 132억원(+15.0%YoY, opm6.2%)으로 전망된다""며 ""연간 매출액 8,256억원(+4.2%YoY), 영업이익 460억원(+14.4%YoY, opm5.6%)을 달성할 것""으로 내다봤다. 특히 현재 진행중인 삼성전자의 평택, 시안공장 낸드 캐파증설의 직간접적인 수혜를 입을 것이라는 점도 긍정적이다. 심텍의 낸드용 MCP매출액이 모바일D램용 MCP 매출액을 넘어서는 등 낸드제품 수요가 급증하고 있다. 김 연구원은 ""심텍은 삼성전자, 도시바, 하이닉스 등 메이저 낸드 생산회사가 모두 고객""이라며 ""향후 폴더블 스마트폰에 필수적으로 탑재될 것으로 예상되는 것이 SLP(Substrate-Like PCB)이며 심텍은 FCCSP 양산경험을 통해 기술적으로 한발 앞서가고 있어 향후 폴더블 스마트폰 출시가 강한 주가 모멘텀이 될 수 있을 것""으로 전망했다."
머니투데이,222800,/news/news_read.nhn?article_id=0003630931&office_id=008&mode=search&query=심텍&page=1,2016-02-16 15:28,"심텍홀딩스, 영업이익 23억원..전년비 83% 감소",[머니투데이 최경민 기자] 심텍홀딩스는 16일 지난해 영업이익이 23억원으로 전년비 83% 감소했다고 공시했다. 매출액은 1561억원으로 77% 줄었지만 순이익은 1249억원으로 7248% 늘었다. textlinktopstart textlinktopend textlinkstart
이데일리,222800,/news/news_read.nhn?article_id=0003390876&office_id=018&mode=search&query=심텍&page=1,2015-11-11 09:42,"[특징주]심텍, 너무 내렸나&hellip;강세 전환","[이데일리 정병묵 기자] 심텍(222800)이 과도하게 주가가 하락했다는 분석에 강세 전환했다. 심텍은 11일 오전 9시40분 현재 전날 대비 1.34% 오른 7570원에 거래되고 있다. 심텍홀딩스(036710)는 7.13% 뛴 3080원을 나타내고 있다. 심텍의 3분기 매출액은 1872억원, 영업이익은 74억원으로 컨센서스를 밑돌았다. 김갑호 교보증권 연구원은 “이는 연결 자회사였던 중국 신태전자가 영업이익 25억원을 기록했으나 9월 한달치 3억원만 반영된 것으로, 온기로 반영됐다면 약 90억원의 영업이익을 기록하면서 시장 컨센서스에 크게 미달하지 않았을 것”이라며 “현 주가는 반도체 업황 악화가 극도로 반영된 가격”이라고 설명했다."
전자신문,222800,/news/news_read.nhn?article_id=0002732113&office_id=030&mode=search&query=심텍&page=1,2018-08-10 15:27,"[ET투자뉴스]심텍, &quot;성수기 효과와 자회&hellip;&quot; BUY(MAINTAIN)-키움증권","키움증권에서 10일 심텍(222800)에 대해 ""성수기 효과와 자회사 턴어라운드 기대 ""라며 투자의견을 'BUY(MAINTAIN)'로 제시하였고, 아울러 목표주가로는 15,000원을 내놓았다. 키움증권 김지산 애널리스트가 동종목에 대하여 이번에 제시한 'BUY(MAINTAIN)'의견은 키움증권의 직전 매매의견에서 큰 변화없이 그대로 유지되는 것이고  올해 초반의 매매의견을 기준으로  볼때도 역시 '매수'의견이 계속 유지되고 있는 상태이다. 그리고 최근 분기내 발표된 전체 증권사 리포트의 컨센서스와 비교를 해볼 경우에 오늘 발표된 투자의견은 전체의견에 수렴하고 있어, 이번 의견은 시장의 평균적인 기대감이 객관적으로 표현된 것으로 분석되고 있다. 목표주가의 추이를 살펴보면 최근 장기간 목표가가 같은 수준에 머물고 있는 모습이다. 또한 전일 종가 기준으로 볼때 동종목의 현주가는 이번에 제시된 목표가 대비 61.5%의 저평가 요인이 존재한다는 해석이 제시되고 있다."
이데일리,222800,/news/news_read.nhn?article_id=0003514479&office_id=018&mode=search&query=심텍&page=1,2016-04-04 09:15,"[특징주]심텍, 1Q 영업익 60억 이상 기대 '강세'",[이데일리 이재호 기자] 심텍(222800)이 실적 개선 기대감에 강세다. 4일 오전 9시14분 현재 심텍은 전거래일보다 3.54% 오른 8190원에 거래되고 있다. 심텍의 1분기 영업이익은 60억원대로 전년 동기보다 100% 이상 급증할 전망이다. 김갑호 교보증권 연구원은 “지난해부터 생산라인 수율이 안정되면서 수익성도 안정된 모습을 보이고 있다”며 “1분기 영업이익 60억원 이상을 기록할 경우 올해 400억원 이상의 영업이익을 올릴 것이라는 공감대가 형성될 것 ”이라고 말했다.
아시아경제,222800,/news/news_read.nhn?article_id=0004023803&office_id=277&mode=search&query=심텍&page=1,2017-06-29 07:37,"[클릭 e종목]심텍, 모바일 제품군 판매 호전&hellip;2Q 실적 기대","[아시아경제 임혜선 기자]키움증권은 29일 심텍에 대해 2분기 실적이 시장 예상치에 부합할 것으로 예상된다며 목표주가 1만5000원 투자의견 매수를 유지했다. 키움증권은 심텍의 2분기 영업이익이 전년동기보다 26% 증가한 74억원을 기록할 것으로 전망했다. 김지산 키움증권 연구원은 ""국내외 전략 스마트폰 출시 효과에 힘입어 멀티칩패키지(MCP), 플립칩-칩스케일패키지(FC-CSP) 등 모바일 제품군의 실적이 호전될 것""이라며 ""국내 고객 플래그십 모델향으로는 심텍 제품군의 탑재량이 기존 3개에서 6개로 늘어나는 우호적인 환경 변화가 뒷받침되고 있어 주고객 내 점유율 상승세가 이어질 것""이라고 분석했다. 이어 ""고성장세를 실현하고 있는 FC-CSP는 중화권 AP업체들 내 안정적인 지위를 바탕으로 고객 다변화 성과가 더해지고 있다""면서 ""하반기에는 계절적 성수기에 따른 가동률 상승과 충분한 영업 레버리지 효과를 기대해도 좋을 것""이라고 설명했다. 차세대 성장도력으로 육성중인 SLP와 SIP에 대한 기대감도 높아지고 있다. 김 연구원은 ""패키지 기판기술과 모듈PCB 기술을 모두 내재화하고 있고, 핵심MSAP 공정기술과 설비를 보유하고 있어 경쟁력을 갖출 것""이라며 "" SLP는 중화시장, SiP는 웨어러블기기와 전장분야를 공략할 계획""이라고 언급했다."
서울경제,222800,/news/news_read.nhn?article_id=0003238085&office_id=011&mode=search&query=심텍&page=1,2018-03-07 15:00,"(코)심텍, 장중 신저가 기록.. 8,940&rarr;8,910(▼30)","[서울경제] 오후 2시 58분 현재 심텍(222800) 이 2.94% 내린 8,910원(▼270)을 기록하며, 52주 신저가를 -30원 경신했다. 기존 52주 최저가는 2018년 03월 06일 기록한 8,940원이다. 체결강도는 27%로 강세 반전했다. 총매수체결량은 24,134주, 총매도체결량은 88,555주를 각각 기록했다.  (※ 체결강도(%) = (총매수체결량/총매도체결량)*100) 이 시각 현재 거래대금은 10억2,488만, 거래량은 11만3,628주를 기록하고 있으며, 수급측면으로는 79(매도):21(매수)의 매도우위를 보이고 있다. 거래일을 기준으로 최근 3일간 평균 거래량은 1십4만2천주, 60일 평균 거래량 1십6만9천주로 비슷한 수준의 거래량을 유지하고 있다."
이데일리,222800,/news/news_read.nhn?article_id=0003398817&office_id=018&mode=search&query=심텍&page=1,2015-11-18 15:41,"전세호 씨, 심텍 지분율 24.7%&rarr;0%",[이데일리 이유미 기자] 전세호 심텍(222800) 사내이사는 심텍 보유주식이 446만5723주(24.71%)에서 0주(0%)로 변경됐다고 18일 공시했다.
파이낸셜뉴스,222800,/news/news_read.nhn?article_id=0003539236&office_id=014&mode=search&query=심텍&page=1,2015-11-11 08:50,"심텍, 실적 다소 미흡...4분기부터 증가세","교보증권은 11일 심텍 에 대해 3·4분기 실적이 시장 컨센선스를 하회했지만 4·4분기부터 매출증가세가 예상된다고 내다봤다. 이에 투자의견은 매수로 유지했다. 다만 목표주가는 1만1500원으로 하향 조정했다. 김갑호 연구원은 ""3·4분기 심텍 의 매출액은 1872억원, 영업이익은 74억원 기록했다""라며 ""이는 연결자회사였던 중국 신태전자가 영업이익 25억원을 기록했으나 9월 한달치 3억원만 반영한 것으로 신태전자 실적이 온기로 반영됐다면 약 90억원의 영업이익을 기록하면서 시장 컨센서스에 크게 미달하지 않았을 것""이라고 지적했다. 또한 주력제품인 MCP와 SSD모듈PCB, 그리고 FC-CSP실적이 고객사 재고조정 등의 이유로 일시적 부진했던 것으로 파악되고 있다면서도 4·4분기 들어 다시 회복되는 추세가 확인됐다라며 매출액은 증가세를 보일 것이라고 분석했다. 4·4분기 예상 매출액과 영업이익은 각각 2030억원과 125억원이다. 계절적 성수기인데다 일시적 부진을 겪었던 주력제품 매출액이 증가세로 전환될 것으로 기대를 모으기 때문이다. 김 연구원은 ""3·4분기 부진한 실적은 주가에 이미 반영됐으며 메모리시장 부진으로 시장에서 우려했던 정도의 실적악화가 아니라는 점에서 오히려 안도심리가 작용할 수 있다""라고 예상했다."
한국경제,222800,/news/news_read.nhn?article_id=0003573800&office_id=015&mode=search&query=심텍&page=1,2016-04-04 08:55,"&quot;심텍, 1분기 호실적 기대&hellip;주가 정상화 될 것&quot; -교보","[ 박상재 기자  ] 교보증권은 4일 심텍에 대해 올해 1분기 호실적을 기록할 것이라고 분석했다. 투자의견 '매수'와 목표주가 1만1500원은 유지했다. 김갑호 스몰캡(중소형주) 팀장은 ""올해 1분기 영업이익은 작년 동기보다 106.2% 늘어난 64억원, 매출은 6.9% 증가한 1780억원이 될 것""이라며 ""올해 분기별 실적이 정상화 국면에 접어들었다""고 분석했다. 김 팀장은 ""심텍은 2013년 공장 화재로 수율관리에 어려움을 겪어 영업이익이 항상 예상치를 밑돌았다""며 ""작년 말부터 수율과 수익성 모두 안정된 모습을 보이고 있다""고 말했다. 실적과 함께 주가도 정상화 될 전망이다. 그동안 심텍은 실적이 추정치를 크게 밑돌면서 신뢰도와 주가가 함께 하락했다. 김 팀장은 ""심텍은 작년 중반부터 LPDDR4 메모리를 채택하는 스마트폰이 늘어나면서 고성장을 이어가는 중""이라며 ""1분기 호실적을 기록할 경우 신뢰도가 매우 높아지게 될 것""이라고 말했다. 이어 ""비수기인 1분기에 영업이익이 60억원을 웃돌 경우 주가가 반응할 가능성이 매우 높다""며 ""올해 주가와 실적 두 측면에서 저력을 보여줄 것""이라고 덧붙였다. 박상재 한경닷컴 기자"
머니투데이,222800,/news/news_read.nhn?article_id=0003767111&office_id=008&mode=search&query=심텍&page=1,2016-11-02 15:47,"심텍, 3Q 영업익 114억 전년동기比 55.3%&uarr;","[머니투데이 진달래 기자] 심텍이 2일 올해 3분기 연결기준 영업익이 114억7600만원으로 전년 동기보다 55.3% 증가했다고 공시했다. 같은 기간 매출액은 2025억3000만원으로 8.2% 증가했고, 당기순익은 145억2500만원으로 533.7% 늘었다. 이날 심텍은 이번 4분기 매출액을 2118억원, 영업이익은 166억원으로 전망했다. 회사 측은 ""스마트모바일향, DDR4칩향, SSD향 등 고부가가치 주력제품 위주로 매출 성장이 지속될 것""이라고 예측했다. textlinktopstart textlinktopend textlinkstart"
조선비즈,222800,/news/news_read.nhn?article_id=0000370887&office_id=366&mode=search&query=심텍&page=1,2017-05-29 08:12,"&quot;심텍, 최근 주가 하락 과도... 2분기 실적 개선 기대&quot; - KB","KB증권은 심텍(222800) 에 대해 최근 중화권 부진으로 인한 주가하락은 과도하다고 29일 분석했다. 투자의견은 매수를, 목표주가는 1만4000원을 유지했다. 인쇄회로기판 제조 전문업체 심텍의 1분기 매출액은 지난해 같은 기간보다 3.5% 감소한 1909억원, 영업이익은 15,3% 줄어든 53억원을 기록했다. 강태신 연구원은 “달러 대비 원화 환율이 지난해보다 3.5%가량 하락하면서 실적도 부진했다”며 “최근 중화권 부진과 향후 고객사 채택 우려로 주가가 크게 하락했지만, 주가 하락은 과도하다고 본다”고 말했다. 그는 “계절적 성수기와 신규 스마트폰 수요가 맞물리면서 2분기 실적은 크게 개선될 것”이라고 했다. 강 연구원은 “중화권 스마트폰 판매 부진은 저점을 통과한 상황""이라며 “달러 환율에 취약한 심텍의 사업구조를 세일즈 믹스와 고객사 다변화 등으로 헤쳐나가는 모습도 긍정적""이라고 분석했다. 그는 “스마트폰의 중앙처리장치(AP)용 제품이 주를 이루는 플립칩 칩스케일패키지(FC-CSP)의 경우, 중화권 고객사 관련 실적 부진을 국내 고객사 수요증가를 통해 방어해내고 있다""며 “고객사 다변화 효과가 본격적으로 나타나고 있다""고 말했다."
전자신문,222800,/news/news_read.nhn?article_id=0002688025&office_id=030&mode=search&query=심텍&page=1,2018-03-02 09:32,"[ET투자뉴스]심텍, &quot;아쉬운 실적과 두려&hellip;&quot; 매수(유지)-KB증권","KB증권에서 2일 심텍(222800)에 대해 ""아쉬운 실적과 두려운 환율""라며 투자의견을 '매수(유지)'로 제시하였고, 아울러 목표주가로는 12,000원을 내놓았다. KB증권 성현동 애널리스트가 동종목에 대하여 이번에 제시한 '매수(유지)'의견은 KB증권의 직전 매매의견을 그대로 유지하는 것이고 전년도말의 매매의견을 기준으로  볼때도 역시 '매수'의견이 계속 유지되고 있는 상태이다. 그리고 최근 분기내 발표된 전체 증권사 리포트의 컨센서스와 비교를 해볼 경우에 오늘 발표된 투자의견은 대체적으로 평균치에 해당하는 수준으로, 이번 의견은 동종목에 대한 전체적인 흐름에서 크게 벗어나지 않은 것으로 분석되고 있다. 목표주가의 추이를 살펴보면 한동안 정체구간을 보낸 후 이번에 목표가가 하향조정된 모습이다. 또한 전일 종가 기준으로 볼때 동종목의 현주가는 이번에 제시된 목표가 대비 29%의 추가상승여력이 있다는 해석이 제시되고 있다."
한국경제TV,222800,/news/news_read.nhn?article_id=0000584466&office_id=215&mode=search&query=심텍&page=1,2017-11-28 09:12,[국고처 류태형] 종목상담 - 심텍(222800),[한국경제TV 류장현 PD] [국고처 류태형] 종목상담 - 심텍(222800) 11월 25일 방송된 `국민주식고충처리반`에 출연한 류태형 파트너가 심텍(222800)에 대한 시세와 전망을 이야기하고 있다.
전자신문,222800,/news/news_read.nhn?article_id=0002545258&office_id=030&mode=search&query=심텍&page=1,2016-11-03 12:57,"[로봇뉴스]심텍, &quot;4년만에 최대 실적&hellip;&quot; 매수(유지)-교보증권","교보증권에서 3일 심텍(222800)에 대해 ""4년만에 최대 실적, 내년은 예년의 실적 회복할 것""라며 투자의견을 '매수(유지)'로 제시하였고, 아울러 목표주가로는 11,500원을 내놓았다. 교보증권 김갑호 애널리스트가 동종목에 대하여 이번에 제시한 '매수(유지)'의견은 교보증권의 직전 매매의견에서 큰 변화없이 그대로 유지되는 것이고  올해 초반의 매매의견을 기준으로  볼때도 역시 '매수'의견이 계속 유지되고 있는 상태이다. 그리고 최근 분기내 발표된 전체 증권사 리포트의 컨센서스와 비교를 해볼 경우에 오늘 발표된 투자의견은 전체의견에 수렴하고 있어, 이번 의견은 시장의 평균적인 기대감이 객관적으로 표현된 것으로 분석되고 있다. 목표주가의 추이를 살펴보면 최근 장기간 목표가가 같은 수준에 머물고 있는 모습이다. 또한 전일 종가 기준으로 볼때 동종목의 현주가는 이번에 제시된 목표가 대비 28.8%의 저평가 요인이 존재한다는 해석이 제시되고 있다."
이데일리,222800,/news/news_read.nhn?article_id=0003386822&office_id=018&mode=search&query=심텍&page=1,2015-11-05 17:50,"심텍홀딩스, 유증 청약률 87.40%&hellip; 총 660억 발행",[이데일리 이명철 기자] 심텍홀딩스(036710)는 일반투자자를 대상으로 유상증자 청약을 실시한 결과 발행주식수 2229만9290주에 1948만9910주가 청약해 87.40%의 청약률을 기록했다고 5일 공시했다. 유상증자 발행금액은 659억5385만5440원으로 결정됐다. 청약결과에 따라 심텍홀딩스는 심텍에 대한 지분율을 기존 17.7%에서 40%까지 확대해 자회사로 편입시키고 지주회사 전환을 완료할 예정이라고 밝혔다.
전자신문,222800,/news/news_read.nhn?article_id=0002539874&office_id=030&mode=search&query=심텍&page=1,2016-10-24 09:48,[@테마]심텍_외국인의 대량매수로 주가흐름 좋아 현재 +1.95%,"외국인이 전일 심텍을 평소와 다르게 큰 규모로 순매수했다. 전일 순매수량은 전체 거래량의 17.59%를 차지할 정도로 크다. 외국인의 순매수로 수급여건이 개선되면서 주가도 상승세를 나타내고 있다. 이러한 영향권에서 24일 오전 9시 33분 현재 170원(1.95%) 오른 8,900원을 기록하고 있다.    [주가/수급동향]     10월19일부터 전일까지 외국인이 3거래일 연속 순매수를 보였다. 최근 한달간 심텍의 상장주식수 대비 거래량을 비교해보니 일별 매매회전율이 2.02%로 집계됐다.  그리고 동기간 장중 저점과 고점의 차이인 일평균 주가변동률을 5.72%를 나타내고 있다.  그리고 최근 5일간 거래비중은 개인 비중이 87.46%로 가장 높았고, 외국인이 8.34%로 그 뒤를 이었다.  기관은 4.18%를 나타냈다.     [투자의견]"
아시아경제,222800,/news/news_read.nhn?article_id=0004048297&office_id=277&mode=search&query=심텍&page=1,2017-08-03 15:40,"심텍, 2Q 영업이익 79억&hellip;31% 증가",[아시아경제 박선미 기자]심텍은 연결재무제표 기준 2분기 영업이익이 전년 동기대비 31.7% 증가한 79억4700만원을 기록했다고 3일 공시했다. 매출액은 6.8% 늘어난 1994억2900만원으로 집계됐다.
이데일리,222800,/news/news_read.nhn?article_id=0003514395&office_id=018&mode=search&query=심텍&page=1,2016-04-04 07:53,"심텍, 수율 안정으로 실적전망 신뢰도 높아져-유안타","[이데일리 이재호 기자] 교보증권(030610)은 4일 심텍(222800)이 올해 실적 및 주가 정상화에 성공할 것으로 전망하며 투자의견 ‘매수’, 목표주가 1만1500원으로 유지했다. 김갑호 교보증권 연구원은 “심텍의 1분기 매출액과 영업이익은 1780억원과 64억원으로 전년동기보다 각각 6.9%와 106.2% 증가할 것”이라며 “심텍 실적은 뚜렷한 계절성을 보이기 때문에 전년대비 100% 이상 성장한 영업이익을 기록할 경우 올해 실적 추정에 대한 신뢰도가 높아지게 된다”고 설명했다. 김 연구원은 “지난해부터 생산라인 수율이 안정되면서 수익성도 안정된 모습을 보이고 있다”며 “1분기 영업이익 60억원 이상을 기록할 경우 올해 400억원 이상의 영업이익을 올릴 것이라는 공감대가 형성될 것 ”이라고 말했다. 김 연구원은 “MCP기판은 매년 400억원 이상 매출액이 늘고 있고 지난해 중반부터 LPDDR4 채택 스마트폰이 증가하면서 고성장을 지속 중”이라며 “PC DDR4를 탑재한 PC는 지난해 2~3개 모델에 불과했지만 올해는 대부분의 PC에 탑재되면서 실적이 개선될 것”이라고 분석했다."
이데일리,222800,/news/news_read.nhn?article_id=0003508196&office_id=018&mode=search&query=심텍&page=1,2016-03-25 16:06,"심텍홀딩스, 박광준 대표 신규 선임",[이데일리 임성영 기자] 심텍홀딩스(036710)는 정철화 대표이사가 사임함에 다라 박광준 대표이사를 신규로 선임했다고 25일 공시했다. 박광준 신임 대표는 심텍 사외이사로 활동했다.
전자신문,222800,/news/news_read.nhn?article_id=0002676258&office_id=030&mode=search&query=심텍&page=1,2018-01-19 11:20,"[ET투자뉴스]심텍, &quot;Eastern 포함&hellip;&quot; 매수(유지)-키움증권","키움증권에서 19일 심텍(222800)에 대해 ""Eastern 포함 연결 실적 예정, Eastern 턴어라운드 예상""라며 투자의견을 '매수(유지)'로 제시하였고, 아울러 목표주가로는 15,000원을 내놓았다. 키움증권 김지산 애널리스트가 동종목에 대하여 이번에 제시한 '매수(유지)'의견은 키움증권의 직전 매매의견에서 큰 변화없이 그대로 유지되는 것이고  전년도말의 매매의견을 기준으로  볼때도 역시 '매수'의견이 계속 유지되고 있는 상태이다. 그리고 최근 분기내 발표된 전체 증권사 리포트의 컨센서스와 비교를 해볼 경우에 오늘 발표된 투자의견은 전체의견에 수렴하고 있어, 이번 의견은 시장의 평균적인 기대감이 객관적으로 표현된 것으로 분석되고 있다. 목표주가의 추이를 살펴보면 최근 장기간 목표가가 같은 수준에 머물고 있는 모습이다. 또한 전일 종가 기준으로 볼때 동종목의 현주가는 이번에 제시된 목표가 대비 55.9%의 저평가 요인이 존재한다는 해석이 제시되고 있다."
