source,symbol,link,date,title,content
연합뉴스,224810,/news/news_read.nhn?article_id=0007932712&office_id=001&mode=search&query=엄지하우스&page=1,2015-10-21 09:50,(주)엄지하우스 코넥스시장 신규상장기념식,"(서울=연합뉴스) 한국거래소 코스닥시장본부는 21일 오전 서울사옥 홍보관에서 (주)엄지하우스의 코넥스시장 신규상장기념식을 개최했다. 상장기념패 전달 후 강홍기 한국IR협의회 부회장(왼쪽부터), 김군호 코넥스협회 회장, 김재준 한국거래소 코스닥시장위원회 위원장, 정재호 (주)엄지하우스 대표이사, 손기근 (주)엄지하우스 대표이사, 정영채 NH투자증권 IB사업부 대표가 기념촬영을 하고 있다. 2015.10.21 >"
파이낸셜뉴스,224810,/news/news_read.nhn?article_id=0004008952&office_id=014&mode=search&query=엄지하우스&page=1,2018-04-25 10:25,"[fnRASSI]엄지하우스, 당일 거래량 증가하며 3거래일 하락세 지속","엄지하우스(224810)의 당일 거래량이 최근 5거래일 거래량의 최고치를 경신했다. 그리고 현재 전 거래일보다 15% 감소하여 3일 연속 하락흐름을 보이고 있다. 외국인 보유량 변화 없음, 기관 감소 (5일 누적) 최근 5일간 동종목의 외국인 투자자는 0주 순매수하였고 반면 기관은 2,895주 순매도하였다. 전날 기관은 2,895주 매도했지만 외국인은 순매수량이 0으로 보유비율 그대로 유지했다. 다음 표는 동종목의 외국인, 기관의 일별 순매수량을 나타낸 것이다. 'fnRASSI'는 증권전문 기업 씽크풀과 파이낸셜뉴스의 협업으로 로봇기자가 실시간으로 생산하는 기사입니다."
한국경제TV,224810,/news/news_read.nhn?article_id=0000368580&office_id=215&mode=search&query=엄지하우스&page=1,2015-09-25 14:05,"KRX, 엄지하우스 코넥스 신규 상장신청 접수","한국거래소는 엄지하우스의 코넥스시장 신규상장신청서를 접수했다고 25일 밝혔습니다. 엄지하우스는 실내건축업·분양공사와 디자인설계를 영위하는 기업으로서, 지난해 매출 781억원, 순이익 24억원을 기록했습니다. 엄지하우스의 지정자문인은 NH투자증권입니다. 한국거래소는 상장적격성보고서 검토 및 현지심사를 하는 상장심사를 약 2주간에 걸쳐 한 후에 상장승인 여부를 결정할 예정입니다. 한편 이날 기준 코넥스시장 상장사는 총 90개입니다. `영재 발굴단` 6.7% 최고 시청률 경신… 5주째 상승세`사도` 개봉 2주차 압도적 예매 1위...`추석 평정`?가희, 11자 명품 복근 공개...""살아있네""가을맞이 등산객 급증, ‘무릎관절’ 부상 주의할 것....충북혁신도시 내 분양 받을만한 아파트 어디?"
헤럴드경제,224810,/news/news_read.nhn?article_id=0000883131&office_id=016&mode=search&query=엄지하우스&page=1,2015-10-21 10:18,엄지하우스 코넥스시장 신규상장기념식,"[헤럴드경제 =박영훈 기자] 한국거래소 코스닥시장본부는 21일 서울사옥 홍보관에서 오피스, 상업시설, 레져시설 등의 실내건축공사 전문기업인 (주)엄지하우스의 코넥스시장 신규상장기념식을 개최했다. 강홍기 한국IR협의회 부회장(왼쪽부터), 김군호 코넥스협회 회장, 김재준 한국거래소 코스닥시장위원회 위원장, 정재호 (주)엄지하우스 대표이사, 손기근 (주)엄지하우스 대표이사, 정영채 NH투자증권 IB사업부 대표 등이 참석 기념촬영을 하고 있다."
머니투데이,224810,/news/news_read.nhn?article_id=0003780733&office_id=008&mode=search&query=엄지하우스&page=1,2016-11-29 08:01,"엄지하우스, 부채비율 49.4%&hellip;재무구조&middot;성장성 우수 -NH","[머니투데이 백지수 기자] NH투자증권은 29일 코넥스시장에 상장된 실내 인테리어 업체 엄지하우스에 대해 ""지난 7월 38억원 유상증자를 실시하면서 재무구조가 개선됐고 이후 우수 대형 거래처와 지속적으로 파트너십을 형성하며 안정적으로 성장하고 있다""고 판단했다. 김형근 NH투자증권 연구원은 ""엄지하우스는 올해 상반기 매출액 368억원, 매출총이익 36억원, 영업이익 9억6000만원에 매출총이익률 9.7%, 영업이익률 2.6% 등을 기록했다""며 ""올해는 지난달 사옥 이전으로 일회성 판매관리비가 발생해 영업이익률은 다소 낮겠지만 693억원의 매출액 추정치를 충분히 달성 가능할 것""이라고 예상했다. 김 연구원은 ""엄지하우스는 지난 7월 38억원의 유상증자로 반기 기준 부채비율도 49.4%, 유동비율도 296.5%를 기록했다""며 ""관련 업계에서 드물게 차입금 의존도가 낮다""고 말했다. 그는 ""서울 강남구 역삼동으로의 사옥 이전 역시 경영환경 개선을 위한 것""이라며 ""삼성물산이나 대림산업, 현대건설, 신세계건설, NHN, 삼성전자 등 우수 고객들과의 파트너십도 이어가고 있다""고 평가했다. 이어 ""올해는 GKL부산롯데점 호텔, 대구 삼성 창조경제단지공사, 영종도 파라다이스호텔 5공구, 아모레퍼시픽 사옥 신축 인테리어 공사 등 수익성 높은 대형 프로젝트 신규 수주를 따내 안정적인 미래 먹거리도 확보한 상황""이라고 덧붙였다. 김 연구원은 이같은 성장성을 토대로 엄지하우스가 내년에는 745억원, 2020년에는 1000억원의 매출 달성도 가능할 것으로 전망했다. textlinktopstart textlinktopend textlinkstart"
한국경제,224810,/news/news_read.nhn?article_id=0003453769&office_id=015&mode=search&query=엄지하우스&page=1,2015-10-16 14:53,"엄지하우스, 21일 코넥스시장 신규 상장","[ 정현영 기자  ] 한국거래소(이사장 최경수)는 16일 실내건축 공사업체인 엄지하우스의 코넥스시장 신규 상장을 승인, 오는 21일부터 주권 매매거래가 가능하다고 밝혔다. 주당 평가가격은 6220원(액면가 500원)이며 NH투자증권이 지정자문을 맡았다. 정현영 한경닷컴 기자"
서울경제,224810,/news/news_read.nhn?article_id=0002752173&office_id=011&mode=search&query=엄지하우스&page=1,2015-10-21 10:28,"엄지하우스, 코넥스시장 신규 상장","실내건축 및 설계 업체인 엄지하우스가 21일 코넥스시장에 신규 상장했다. 한국거래소 코스닥시장본부는 이날 오전 서울사옥 홍보관에서 엄지하우스의 코넥스시장 신규상장기념식을 개최했다. 이날 행사에는 정재호·손기근 엄지하우스 공동 대표를 비롯해 강홍기 한국IR협의회 부회장, 김군호 코넥스협회 회장, 김재준 한국거래소 코스닥시장위원회 위원장, 정영채 NH투자증권 IB사업부 대표 등이 참석했다."
이데일리,224810,/news/news_read.nhn?article_id=0003373894&office_id=018&mode=search&query=엄지하우스&page=1,2015-10-21 09:54,[포토]엄지하우스 코넥스시장 신규상장기념식,"[이데일리 신종오 기자](주)엄지하우스 코넥스시장 신규상장기념식 한국거래소 코스닥시장본부는 21일 오전 서울사옥 홍보관에서 오피스, 상업시설, 레져시설 등의 실내건축공사 전문기업인 (주)엄지하우스의 코넥스시장 신규상장기념식을 개최했다. 상장기념패 전달 후 기념촬영 왼쪽부터 강홍기 한국IR협의회 부회장, 김군호 코넥스협회 회장, 김재준 한국거래소 코스닥시장위원회 위원장, 정재호 (주)엄지하우스 대표이사, 손기근 (주)엄지하우스 대표이사, 정영채 NH투자증권 IB사업부 대표.  한국거래소 제공."
뉴시스,224810,/news/news_read.nhn?article_id=0006823998&office_id=003&mode=search&query=엄지하우스&page=1,2015-10-21 10:37,엄지하우스 코넥스 시장 신규상장 기념식,"【서울=뉴시스】한국거래소 코스닥시장본부는 21일 오전 서울 여의도 서울사옥 홍보관에서 오피스, 상업시설, 레져시설 등의 실내건축공사 전문기업인 엄지하우스의 코넥스시장 신규상장 기념식을 개최했다. 왼쪽부터 강홍기 한국IR협의회 부회장, 김군호 코넥스협회 회장, 김재준 한국거래소 코스닥시장위원회 위원장, 정재호 엄지하우스 대표이사, 손기근 엄지하우스 대표이사, 정영채 NH투자증권 IB사업부 대표가 기념촬영을 하고 있다. 2015.10.21. (사진=한국거래소 제공)"
한국경제TV,224810,/news/news_read.nhn?article_id=0000378287&office_id=215&mode=search&query=엄지하우스&page=1,2015-10-16 17:01,"KRX, 엄지하우스 코넥스시장 신규상장 승인","한국거래소는 16일 엄지하우스의 코넥스시장 신규 상장을 승인해 오는 21일부터 주권 매매거래가 시작된다고 밝혔습니다. 엄지하우스는 실내건축과 건축마무리 공사업을 영위하고 있으며, 지난해 매출액 781억원, 영업이익 31억원을 달성했습니다. 주당 평가가격은 6,220원(액면가 500원)이며 NH투자증권이 지정자문을 맡았습니다."
서울경제,224810,/news/news_read.nhn?article_id=0002743967&office_id=011&mode=search&query=엄지하우스&page=1,2015-09-25 13:56,"한국거래소, 엄지하우스 코넥스 상장신청서 접수",한국거래소는 25일 엄지하우스의 코넥스시장 신규 상장신청서를 접수했다고 밝혔다. 엄지하우스는 실내건축 및 건축마무리 공사업체다. NH투자증권이 엄지하우스의 지정자문인을 맡았다. 한국거래소는 약 2주간의 상장심사를 거쳐 상장승인 여부를 결정할 예정이다.
파이낸셜뉴스,224810,/news/news_read.nhn?article_id=0004038052&office_id=014&mode=search&query=엄지하우스&page=1,2018-06-12 09:16,"[fnRASSI]엄지하우스, 당일 거래량 증가하며 3거래일 하락세 지속","엄지하우스(224810)의 현재 거래량이 최근 5거래일 거래량의 최고치를 넘어서며 투자자들의 관심을 받고 있다. 그리고 현재 전 거래일보다 7.89% 감소하여 3일 연속 하락흐름을 보이고 있다. 외국인 보유량 변화 없음, 기관 증가 (5일 누적) 최근 5일간 동종목의 외국인 투자자는 0주 순매수하였고 마찬가지로 기관은 300주 순매수하였다. 전날 기관은 300주 순매수했지만 외국인은 순매수량이 0으로 보유비율 그대로 유지했다. 다음 표는 동종목의 외국인, 기관의 일별 순매수량을 나타낸 것이다. 'fnRASSI'는 증권전문 기업 씽크풀과 파이낸셜뉴스의 협업으로 로봇기자가 실시간으로 생산하는 기사입니다."
전자신문,224810,/news/news_read.nhn?article_id=0002405725&office_id=030&mode=search&query=엄지하우스&page=1,2015-10-21 10:36,엄지하우스 코넥스시장 신규 상장,"한국거래소 코스닥시장본부는 21일 서울사옥 홍보관에서 오피스·상업·레저시설 등의 실내건축공사 전문기업인 엄지하우스의 코넥스시장 신규상장 기념식을 개최했다. 왼쪽부터 강홍기 한국IR협의회 부회장, 김군호 코넥스협회장, 김재준 한국거래소 코스닥시장위원장, 엄지하우스 정재호·손기근 대표, 정영채 NH투자증권 IB사업부 대표."
아시아경제,224810,/news/news_read.nhn?article_id=0003604867&office_id=277&mode=search&query=엄지하우스&page=1,2015-10-16 14:36,"거래소, 엄지하우스 코넥스 신규상장 승인&hellip;21일 매매 개시","[아시아경제 최동현 기자] 한국거래소는 엄지하우스의 코넥스시장 신규 상장을 승인해 오는 21일부터 매매가 시작된다고 16일 밝혔다. 엄지하우스는 실내건축 및 건축마무리 공사업을 영위하고 있다. 지난해 매출액 781억원, 영업이익 31억원을 달성했다. 지정자문인은 NH투자증권이다."
이데일리,224810,/news/news_read.nhn?article_id=0003355726&office_id=018&mode=search&query=엄지하우스&page=1,2015-09-25 13:37,"엄지하우스, 코넥스시장 신규 상장 신청","[이데일리 경계영 기자] 한국거래소는 실내건축업체인 엄지하우스가 코넥스시장 신규 상장 신청서를 접수했다고 25일 밝혔다. 엄지하우스는 지난해 매출액과 당기순이익이 각각 781억1000만원, 24억2000만원을 기록했다. 자기자본은 145억8600만원이다. 지정자문인은 NH투자증권이 맡는다."
아시아경제,224810,/news/news_read.nhn?article_id=0003939277&office_id=277&mode=search&query=엄지하우스&page=1,2017-02-23 15:08,"엄지하우스, 120만주 무상증자 결정",[아시아경제 박미주 기자]엄지하우스는 120만주의 무상증자를 결정했다고 23일 공시했다. 내달 14일 오후 5시 기준 주주명부에 등재된 주주들에 1주당 0.4주의 비율로 신주를 배정한다.
파이낸셜뉴스,224810,/news/news_read.nhn?article_id=0004004516&office_id=014&mode=search&query=엄지하우스&page=1,2018-04-18 11:33,"[fnRASSI]엄지하우스, 1.43% 내리며 거래량 증가","엄지하우스(224810)는 당일 거래량 증가로 최근 5거래일 거래량의 최고치를 넘어섰다. 그리고 현재 1.43% 내린 6,190원에 거래중이며 3일 연속 하락흐름을 보이고 있다. 외국인 보유량 변화 없음, 기관 감소 (5일 누적) 최근 5일간 동종목의 외국인 투자자는 0주 순매수하였고 반면 기관은 0주 순매도하였다. 전날 두 주체의 각각 순매수량은 0으로 보유비율이 그대로이다. 다음 표는 동종목의 외국인, 기관의 일별 순매수량을 나타낸 것이다. 'fnRASSI'는 증권전문 기업 씽크풀과 파이낸셜뉴스의 협업으로 로봇기자가 실시간으로 생산하는 기사입니다."
이데일리,224810,/news/news_read.nhn?article_id=0003370749&office_id=018&mode=search&query=엄지하우스&page=1,2015-10-16 16:17,"엄지하우스, 21일 코넥스시장 신규 상장","[이데일리 경계영 기자] 한국거래소는 엄지하우스의 코넥스시장 신규 상장을 승인했다고 16일 밝혔다. 매매거래는 21일부터 개시된다. 엄지하우스는 실내건축업, 분양공사 등을 하는 업체로 지난해 매출액과 당기순이익이 각각 781억1000만원, 24억2100만원을 기록했다. 현재 자본금은 12억원이다. 정재호 대표 외 3인이 지분 52.18%를 보유했다. NH투자증권이 지정자문인을 맡았다."
아시아경제,224810,/news/news_read.nhn?article_id=0003592493&office_id=277&mode=search&query=엄지하우스&page=1,2015-09-25 16:09,"엄지하우스, 코넥스 상장신청","[아시아경제 정준영 기자] 한국거래소는 25일 엄지하우스의 코넥스시장 신규상장신청서를 접수했다. 실내건축 및 건축마무리 공사업을 영위하는 엄지하우스는 지난해 매출액 781억원, 순이익 24억원을 기록했다. 지정자문인은 NH투자증권이 맡고 있다. 거래소는 약 2주간 상장심사를 거쳐 상장승인 여부를 결정할 예정이다. 한편 현재 코넥스시장에는 90개 회사가 상장돼 있다."
매일경제,224810,/news/news_read.nhn?article_id=0003631379&office_id=009&mode=search&query=엄지하우스&page=1,2015-11-29 11:02,"3040세대, 테라스&middot;다락방 품은 타운하우스에 &lsquo;엄지 척&rsquo;","3.3m²당 700만원대로 조합원을 모집하고 있는 ""용인에코릿지"" 테라스하우스가 들어설 경기도 용인시 기흥구 지곡동 470번지 일대 모습 [매경DB] 최근 주택시장에서 테라스(Terrace)‘의 인기가 뜨겁다. 공동주택에서 테라스는 비탈진 경사면 등 지형을 이용해 공급된다. 아랫집 지붕을 윗집에서 테라스로 사용하는 경우가 많아 대부분 거실에서 발코니 문을 열면 바로 테라스로 연결되는 구조다. 테라스형 타운하우스는 공동주택의 편리함과 테라스를 앞마당처럼 활용할 수 있는 단독주택의 장점까지 갖춰 특히 어린 자녀를 둔 3040세대에게 인기가 높다. 또한 프랑스 지리학자 발레리 줄레조가 ‘아파트공화국’이라고 표현했을 만큼 대한민국 국민 2명 중 1명은 고밀도 아파트에서의 생활에 익숙해져 있지만 이런 생활에서 벗어나 여유로운 주거생활을 즐기려는 젊은 층이 늘어난 점도 저밀도 타운하우스의 인기에 불을 지폈다. 정인택 JNK개발원 원장은 “서울지역의 전세값 고공행진이 장기화되면서 젊은층을 중심으로 교통, 학군, 편의시설 등 실질적 주거가치가 완비된 실속형 타운하우스에 관심이 높다”며  “기존 전원주택이 도심에서 벗어난 지역에 조성된 것과 달리 3040세대가 찾는 주택은 도심과 인접해 출퇴근이 가능하면서 1~2억원대로 가격이 저렴한 주택을 선호한다”고 말했다. ◆3.3㎡ 당 700만원대 테라스하우스 ‘용인에코릿지’ 용인민속촌 인근에 경기도 용인시에서 지역주택조합사업으로는 최초로 테라스와 다락방을 갖춘 타운하우스 단지가 조성된다. 용인민속마을지역주택조합이 조합원모집에 들어간 ‘용인에코릿지’가 그 주인공이다. 경기도 용인시 기흥구 지곡동 470번지 일대에 들어서는 ‘용인에코릿지’는 지역주택조합방식으로 공급되는 만큼 저렴한 분양가가 매력적이다. 이 단지의 조합원 모집가격은 3.3㎡ 당 700만원 초중반대로 수도권에 있는 20평형대 아파트 전셋값보다도 싸다. 내년 말 신갈 우회도로가 개통되면 단지까지 진입시간이 5분으로 단축되는 ""용인에코릿지"" 조감도 [사진제공: 용인민속마을지역주택조합]  ‘용인에코릿지’는 전용면적 53.14.㎡ 100가구와 70.47㎡ 100가구 등 2개 타입으로 구성됐다. 전용 53.14.㎡ 1층은 1억8000만원대, 4층도 2억원 미만에 내 집을 마련할 수 있다. 전용 70.47㎡ 1층은 2억2000만원 초반대, 4층은 2억3000만원대다. 테라스 없는 2·3층 가구는 전용 53.14.㎡가 1억7000만원대, 70.47㎡가 2억원대다. 이 단지의 ‘셀링포인트’는 착한 분양가에서 그치지 않는다. 이 단지는 최근 주택시장에서 트렌드로 자리한 테라스를 적용해 조합원모집에 박차를 가하고 있다. 각 세대 1층에는 폭이 3m에 달하는 테라스가 마련된다. 최상층인 4층은 복층형으로 설계해 테라스(19.6㎡)와 다락방(27.30㎡)이 제공된다. 테라스가 없는 2~3층 세대는 개인창고가 주어진다. ◆ 용인 첫 지역주택조합 테라스하우스 올 한해 전국은 지역주택조합사업 열풍이 뜨거웠다. 국민권익위원회에 따르면 지난 2005년부터 올해 6월까지 전국에는 155개 조합(약 7만6000가구)이 조합설립인가를 받았다. 같은 기간 동안 사업계획승인을 득한 지역주택조합은 총 88개 조합(약 4만 가구)에 달한다. 현재 추진 중인 사업장도 전국 126곳, 10만 가구에 육박한다. 지역주택조합 아파트는 지역민들이 직접 조합을 결성해 해당 토지를 구매하고 시공사를 선정해 집을 짓는 일종의 ‘공동구매’로, 일반 분양 아파트와 달리 시행사가 없어 원가의 10~20% 가량 싸게 구매할 수 있다는 장점이 있다. 하지만 장점이 많은 만큼 리스크도 적지 않다. 주택사업은 택지개발지구를 제외하고는 소유자가 다른 다수의 토지를 매입해야 사업 추진이 가능하기 때문에, 토지 매입 과정에서 토지비가 올라가는 등의 이유로 사업이 지연되는 경우 조합원 분담금이 늘어나는 문제가 발생할 수 있다. 또 조합원 모집 이후 조합설립인가를 받고 사업인허가를 진행해야 하기 때문에 착공 및 입주가 길어질 수 있고, 사업추진위(또는 업무대행사)가 투명한 자금관리를 하지 않을 경우 피해를 고스란히 조합원이 떠안을 수 있다. 용인에코릿지 분양 관계자는 “용인에코릿지가 들어설 사업지(15필지) 모두 계약을 끝낸 상태라 토지 매입에 따른 추가 분담금 발생이나 사업이 지연될 우려가 없다”며 “보통 한 채에 2000만원 정도 책정되는 업무대행비도 대폭 낮춰 상식 밖의 분양가로 조합원 모집에 나섰기 때문에 단기간 내 사업이 마무리될 것으로 예상된다”고 말했다. [용인 기흥 지곡동 = 조성신 기자] r_start // r_end // [ⓒ 매일경제 & mk.co.kr, 무단전재 및 재배포 금지] 매일경제 관련뉴스해당 언론사에서 선정하며 언론사 페이지(아웃링크)로 이동해 볼 수 있습니다.초아, 초미니로 과격 퍼포먼스 춤추다…""지금 보이는거 맞아? 男心 덜컹!""카드 결제하려면 10% 더 내라는 가게 주인…알고 보니잇단 대어급 선수들 협상실패...'이적도미노' 전주곡?UFC 서울 무대에 선 추성훈, 미나에게 통한의 판정패섹시 치어리더, 격한 안무에 속바지가 그만…""속살 보이는 과감한 턴? 헉"""
파이낸셜뉴스,224810,/news/news_read.nhn?article_id=0003945622&office_id=014&mode=search&query=엄지하우스&page=1,2018-01-17 11:07,"[fnRASSI]엄지하우스, 14.7% 오르며 거래량 증가","엄지하우스(224810)는 당일 거래량 증가로 최근 5거래일 거래량의 최고치를 넘어섰다. 그리고 엄지하우스는 3일 연속 상승흐름을 보이며, 11시 1분 현재 14.7% 증가한 6,710원에 거래중이다. 'fnRASSI'는 증권전문 기업 씽크풀과 파이낸셜뉴스의 협업으로 로봇기자가 실시간으로 생산하는 기사입니다."
머니투데이,224810,/news/news_read.nhn?article_id=0004019314&office_id=008&mode=search&query=엄지하우스&page=1,2018-03-06 18:36,"엄지하우스, 제주도 2375평 토지 50억원에 양수 결정",[머니투데이 김태현 기자] 엄지하우스는 관광숙박업을 영위하는 리체클럽으로부터 제주도 서귀포시 토평동 토지(7852㎡) 50억원에 양수키로 결정했다고 6일 공시했다. 이는 지난해 말 자산 총액 대비 15.47% 규모다. 양수 목적은 사업의 효율성 증대다.
