source,symbol,link,date,title,content
머니투데이,225850,/news/news_read.nhn?article_id=0003827398&office_id=008&mode=search&query=미애부&page=1,2017-02-23 16:29,"미애부, 여성행복누리 아우름과 &lsquo;미혼모 지원 협약&rsquo; 체결",[머니투데이 중기&창업팀 고문순 기자] ㈜미애부는 지난 21일 사단법인 여성행복누리 아우름과 ‘미혼모 지원 협약’을 체결했다고 23일 밝혔다. 사진제공=미애부 여성행복누리 아우름은 미혼의 임신부와 출산 후 6개월 이내의 유아 양육 지원이 필요한 여성을 돕는 미혼모자가족 복지시설이다. 협약을 통해 미애부는 매월 기부금과 함께 자사 제품을 지속적으로 지원하게 된다. 이번 협약은 올해 1월 광명시를 통해 아우름에 제품을 기부한 미애부가 사회적 약자인 미혼모들에 대한 지원을 일회성에 그치지 않겠다는 약속에서 비롯되었다. 아우름 서은교 이사장은 미애부와의 협약식에서 “미애부가 내민 따뜻한 나눔의 손길이 미혼모자가족에게 전해져 그들에게 또 다른 삶의 희망을 열어줄 것”이라며 고마움을 전했다. 한편 미애부는 2017년을 맞이해 창립 이후 꾸준히 진행해온 사회공헌활동을 본격적인 프로젝트로 추진한다. 매월 전국 50여개 지점에서 활동하는 판매원들이 뜻을 모아 마련한 기부금과 회사가 그에 상응하는 기부금 및 재화를 더하는 매칭그랜트 기부 방식을 마련한 것이다. 이에 따라 미애부는 지속적인 모금을 통해 전국에 있는 사회적 약자를 찾아 도울 계획이라고 회사 관계자는 전했다. 미애부 김기수 대표는 “미애부는 세상의 건강한 아름다움을 이뤄간다는 기업의 가치를 실현하기 위해 일시적 구호에 그치지 않고 그동안 진행해온 사회공헌활동을 더욱 적극적으로 진행할 계획”이라고 밝혔다. textlinktopstart textlinktopend textlinkstart
머니투데이,225850,/news/news_read.nhn?article_id=0003859043&office_id=008&mode=search&query=미애부&page=1,2017-04-18 16:50,"미애부, 신제품 &lsquo;큐일오(Q15)&rsquo; 출시","[머니투데이 중기&창업팀 고문순 기자] 생장품 브랜드 ㈜미애부는 신제품 ‘Q15(큐일오)’를 출시했다고 18일 밝혔다. 신제품 ‘Q15(큐일오)’/사진제공=미애부  안티링클세럼 큐일오는 주름개선 기능성 원료인 미생물 유래 아데노신을 자체 개발한 피부전달시스템인 셀포좀(CPS)에 담아 눈과 입가 주변 및 얼굴의 주름을 집중관리 할 수 있도록 도와주는 제품이다. 또한 히아루론산‧콜라겐을 셀포좀화 해 피부에 수분과 영양분을 공급하고, 세라마이드 셀포좀이 피부 장벽 강화에 도움을 주고 생기를 불어넣는 데 기여하는 프리미엄 스킨케어 제품이다. 미애부 마케팅 관계자는 ""큐일오 제품은 바른 후 15분이면 천연유래성분의 다당체와 셀포좀이 느슨해진 피부에 탄력을 부여해 일시적인 리프팅 효과가 있다""며 ""지속적인 수분과 천연유래 원료의 영양공급을 통해 주름 및 피부개선효과를 기대할 수 있다""고 전했다. 이어 ""지금껏 우수한 생명공학 기술력으로 고객의 신뢰를 받아온 미애부 생장품을 대표하는 제품으로 자리매김할 것으로 예상된다""고 밝혔다. 신제품 큐일오는 전국 50여개 미애부 지점 및 회원 사이트를 통해 구매할 수 있다. textlinktopstart textlinktopend textlinkstart"
이데일리,225850,/news/news_read.nhn?article_id=0003418660&office_id=018&mode=search&query=미애부&page=1,2015-12-08 11:48,[포토](주)미애부 코넥스시장 신규상장기념식,"[이데일리 김정욱 기자] 한국거래소 코스닥시장본부는 8일 서울사옥 홍보관에서 화장품 도매전문기업인 (주)미애부의 코넥스시장 신규상장기념식을 개최하였다. 왼쪽부터 강홍기 한국IR협의회 부회장, 김재준 한국거래소 코스닥시장위원회 위원장, 김기수 (주)미애부 대표이사, 김군호 코넥스협회 회장, 정해영 한양증권 대표이사. 한국거래소 제공."
뉴스1,225850,/news/news_read.nhn?article_id=0001775512&office_id=421&mode=search&query=미애부&page=1,2015-12-08 11:31,(주)미애부의 코넥스시장 신규상장기념식,"(서울=뉴스1) 장인범  = 한국거래소 코스닥시장본부는 8일 서울사옥 홍보관에서 화장품 도매전문기업인 (주)미애부의 코넥스시장 신규상장기념식을 개최하고 상장기념패 전달 후 기념 사진 촬영을 하고 있다. 왼쪽부터 강홍기 한국IR협의회 부회장, 김재준 한국거래소 코스닥시장위원회 위원장, 김기수 (주)미애부 대표이사, 김군호 코넥스협회 회장, 정해영 한양증권 대표이사. (한국거래소 제공) 2015.12.8/뉴스1"
파이낸셜뉴스,225850,/news/news_read.nhn?article_id=0003554068&office_id=014&mode=search&query=미애부&page=1,2015-12-03 13:28,"미애부, 코넥스시장 신규상장","미애부의 코넥스시장 매매거래가 오는 8일부터 개시된다. 한국거래소는 3일 미애부의 코넥스시장 신규상장을 승인했다고 밝혔다. 미애부는 화장품도매업체로 친환경, 무합성 발효화장품을 생산한다. 주당 평가가격은 1040원이다."
뉴시스,225850,/news/news_read.nhn?article_id=0006917332&office_id=003&mode=search&query=미애부&page=1,2015-12-08 11:12,미애부 코넥스시장 신규상장 기념식,"【서울=뉴시스】한국거래소 코스닥시장본부가 8일 오전 서울 여의도 서울사옥 홍보관에서 화장품 도매전문기업인 미애부의 코넥스시장 신규상장기념식을 개최했다. 왼쪽부터 강홍기 한국IR협의회 부회장, 김재준 한국거래소 코스닥시장위원회 위원장, 김기수 미애부 대표이사, 김군호 코넥스협회 회장, 정해영 한양증권 대표이사가 기념촬영을 하고 있다. 2015.12.08. (사진=한국거래소 제공)"
머니투데이,225850,/news/news_read.nhn?article_id=0003844124&office_id=008&mode=search&query=미애부&page=1,2017-03-23 16:52,"미애부생명과학, &lsquo;M&amp;C생명과학&rsquo;으로 사명변경 및 제2의 창업 선언","[머니투데이 중기&창업팀 고문순 기자] 미애부생명과학(대표 옥민)은 지난 13일 제5기 주주총회를 통해 ‘M&C생명과학’으로 사명을 변경했다고 23일 밝혔다. 사진제공=M&amp;C생명과학 ‘M&C생명과학’이라는 사명은 그동안의 연구개발 노력과 성과가 집약된 대표적 기술 MOF(MieV Osmotic pressure enzyme Fermentation system, 삼투압 효소발효시스템)와 CPS(CellPoSome, 유효성분 피부전달기술)의 약자로 독보적인 자체기술력을 확보한 바이오기업이라는 정체성을 담고 있다. M&C생명과학의 사명 변경에는 크게 두 가지 목적을 엿볼 수 있다. 하나는 그동안 회원직접판매방식의 자회사 ‘미애부’로 안정적인 매출과 영업이익을 달성해왔지만 미애부의 매출 의존도가 높다는 지적도 있었다. 따라서 사명 변경과 함께 현재 준비 중인 면세점 사업과 생활상품 분야의 국내 온라인 판매사업을 활성화시키겠다는 계획이다. 생활상품군은 현재 6개의 제품(치약, 세탁세제, 주방세제, 손세정제, 섬유탈취제, 미용비누)이 완비돼 쇼핑몰 구축이 완료되는 4월에 본격적인 시장공략에 나설 계획이다. M&C생명과학의 생활상품군은 천연유래원료와 생명공학기술을 바탕으로 최근 ‘노케미족, 화학포비아’ 등 유해합성화학성분이 함유된 생활상품을 거부하는 소비자 정서와 맞물려 시장에서 높은 경쟁력을 확보할 것으로 보인다. 사명변경의 또 다른 이유는 글로벌 기업으로서의 접근성을 확보하기 위함이다. M&C생명과학은 지금까지 중국시장에 직접진출 형태의 사업을 진행해왔다. 그 결과 생산법인과 방문판매 사업을 위한 유통법인 설립으로 중국시장을 직접 공략했으나 급격한 국제정서 변화 등 중국시장에 대한 시행착오를 겪었다. 그 결과 2016년 결산 시 중국 관련 상당액을 손실로 반영했고 이런 경험을 자산 삼아 현재 중국 제약회사를 비롯한 홈쇼핑 업체 등 현지 업체와의 컨소시엄 구축을 신중하게 검토하고 있는 상황이다. 회사 관계자는 “M&C생명과학은 작년 영업체제 변환으로 회원확보 및 영업실적이 대폭 증가한 자회사 미애부를 통해 이미 국내에 확실한 시장을 확보하고 있다”며 “이제 올해 상반기 상장 목표를 달성함과 동시에 사업다각화와 글로벌 기업으로서의 큰 성장을 이뤄내겠다는 발전적 목표를 가지고 있다. 경영진들은 올해를 사명변경을 통한 ‘제2의 창업원년’으로 삼겠다”고 밝혔다. textlinktopstart textlinktopend textlinkstart"
머니투데이,225850,/news/news_read.nhn?article_id=0003932303&office_id=008&mode=search&query=미애부&page=1,2017-09-08 16:31,"미애부, &lsquo;2017 케이뷰티 뮤즈선발대회&rsquo; 공식 협력사 지정","[머니투데이 중기&창업팀 고문순 기자] 생장품 전문기업 ㈜미애부가 오는 10일 서울 워커힐호텔에서 진행되는 ‘K뷰티 뮤즈 선발대회’의 공식 협력사로 참여한다고 8일 밝혔다. 미애부 제품/사진제공=미애부 K뷰티 뮤즈 선발대회는 세계뷰티뮤즈조직위원회가 주최하고, (주)케이뷰티센터가 주관하는 행사로 합숙기간부터 대회현황 모두를 MBCnet에서 방송을 주관한다. K뷰티 뮤즈 선발대회는 K뷰티의 위상을 전 세계에 알리기 위한 뷰티민간외교사절단을 선발한다. 선발된 케이뷰티뮤즈는 향후 케이뷰티센터와 함께 대한민국의 아름다움을 알리게 된다. 특히 해외 관광객들이 원하는 한국형 피부관리를 체험할 수 있는 서비스를 제공할 계획이다. 미애부는 2017 K-beauty Muse contest에 대한민국의 K뷰티를 알릴 뮤즈들이 합숙하는 동안 피부관리를 책임지고 있다. 미애부 관계자는 “세계에 미애부를 알리는 뮤즈들의 피부를 책임지며 자부심과 사명감을 느낀다”며 “오는 10일 선발대회 이후에도 꾸준히 K뷰티의 아름다움을 알리는데 앞장서겠다”고 밝혔다. 한편, 선발된 25명의 후보자들은 14일간의 합숙을 마치고 오는 10일 서울 워커힐호텔에서 최종 ‘K뷰티 뮤즈’를 가릴 예정이다. 선발대회 및 결과는 MBCnet 방송중계를 통해 확인할 수 있다."
머니투데이,225850,/news/news_read.nhn?article_id=0003918186&office_id=008&mode=search&query=미애부&page=1,2017-08-10 17:07,"미애부 희망나눔, 전주 완산구 저소득 가정에 라면 기부","[머니투데이 중기&창업팀 정유진 기자] 미애부가 지난 9일 전주시 완산구청에 라면 200박스를 기부했다고 10일 밝혔다. 미애부가 기부한 라면은 당일 완산구청 1층 로비에서 관내 저소득 가정 200세대에 지원됐다. 사진제공=미애부 당일 진행된 기부식에는 백순기 완산구청장, 전윤겸 미애부 전주지점장을 비롯한 주요 직급자가 참석했다. 백순기 완산구청장은 “우리 완산구에 보내주신 도움의 손길이 어려운 이웃들에게 큰 힘이 될 것”이라며 “완산구민을 대신해 감사드린다”고 전했다. 이에 “미애부는 언제나 건강한 사회를 위해 많은 노력을 기울여왔으며 특히 전국적으로 진행되고 있는 희망나눔 사업을 통해 전주지점이 위치한 완산구에 뜻깊은 도움을 줄 수 있게 되어 기쁘다”는 소감을 전했다. 한편, 미애부는 매월 전국 50여개 지점에서 활동하는 판매원들이 뜻을 모아 마련한 기부금과 회사가 그에 상응하는 기부금 및 재화를 더하는 매칭그랜트 기부를 실천하고 있다. 이에 따라 지속적인 희망나눔 모금이 이뤄지고 있으며, 지역 기관 등을 통해 꾸준히 나눔을 실천하고 있다."
파이낸셜뉴스,225850,/news/news_read.nhn?article_id=0003910757&office_id=014&mode=search&query=미애부&page=1,2017-11-22 10:45,"[fnRASSI]미애부, 거래량 확대되며 3거래일 연속 하락","미애부(225850)의 당일 거래량이 최근 5거래일 거래량의 최고치를 넘어섰다. 그리고 현재 11.7% 내린 4,000원에 거래중이며 3일 연속 하락흐름을 보이고 있다. 'fnRASSI'는 증권전문 기업 씽크풀과 파이낸셜뉴스의 협업으로 로봇기자가 실시간으로 생산하는 기사입니다."
한국경제TV,225850,/news/news_read.nhn?article_id=0000403167&office_id=215&mode=search&query=미애부&page=1,2015-12-03 17:19,"미애부, 코넥스시장 신규상장","[한국경제TV 정미형 기자] 화장품 도매업체인 미애부가 코넥스시장에 새롭게 상장됐습니다. 3일 한국거래소는 미애부의 코넥스시장 신규 상장을 승인하고 매매거래를 개시했다고 밝혔습니다. 미애부는 자연주의를 표방하는 화장품 업체로 합성화학성분을 함유하지 않은 화장품, 이른바 '생장품'을 생산하고 있습니다. 지난해 매출액 716억5600만원, 영업이익 6억8000만원을 기록했습니다."
파이낸셜뉴스,225850,/news/news_read.nhn?article_id=0003554340&office_id=014&mode=search&query=미애부&page=1,2015-12-03 16:58,"[코넥스시장] 미애부, 8일부터 거래 개시","미애부의 코넥스시장 매매거래가 오는 8일부터 개시된다. 미애부는 화장품도매업체로 친환경, 무합성 발효화장품을 생산한다.주당 평가가격은 1040원이다.원희영 기자

 ※ 저작권자 ⓒ"
머니투데이,225850,/news/news_read.nhn?article_id=0003839087&office_id=008&mode=search&query=미애부&page=1,2017-03-15 15:30,"미애부, 과감한 체제변환 실적 대폭 향상","[머니투데이 중기&창업팀 고문순 기자] 자연주의 원료와 생명공학기술을 바탕으로 ‘생장품’ 브랜드를 구축한 ㈜미애부의 2016년 실적이 전년대비 대폭 향상됐다고 15일 밝혔다. 지난 13일 영업보고서를 통해 밝혀진 미애부의 실적을 보면 전년대비 영업이익 및 당기순이익 등의 실적이 대폭 향상된 것을 확인할 수 있다. 2016년 미애부의 영업이익은 33억 8,900만원으로 전년 대비 235% 증가했고, 당기순이익은 20억 7,700만원으로 497% 증가했다. 또한 2016년 말 기준 미애부의 회원은 2만 9,877명으로, 2015년 말 기준 1만 1,685명 대비 256% 증가하였으며, 2017년 현재도 매월 큰 폭의 회원가입 성장세를 보이고 있다. 실적향 사진제공=미애부 상 배경에는 2016년의 시작과 함께 기존 ‘방문판매업’에서 현재의 ‘회원직접판매’로 유통방식을 과감하게 변환한 경영진의 선택이 적중했다는 평가다. 특히 전년대비 이익률이 대폭 증가한 직접적인 이유는 영업 체제변환에 따른 판매원 성과 지급률이 개선되었기 때문이다. 기존의 후원방문판매업 방식에서는 판매원의 후원수당 지급비율이 총 매출액 대비 약 48% 내외로 발생하였다. 하지만 회원직접판매업에서는 방문판매업과 달리 등록 판매원 및 소비자 보호장치를 강화하는 대신, 판매수수료 지급률이 35%로 법적 상한선이 제한되어 있다. 따라서 자연스럽게 이익률이 증가하고 재무구조 역시 전반적으로 건전성을 확보할 수 있었다는 게 회사 측 설명이다. 전년 대비 매출이 줄어든 것은 체제변환에 따른 과도기적 영향이 미쳤다고 볼 수 있지만, 10여년 간 성장을 이어온 영업조직의 탄탄한 기반을 바탕으로 올해부터는 매출 역시 꾸준히 상승세를 보일 전망이다. 미애부 관계자는 “이런 전망을 가능하게 하는 것은 회원직접판매의 안전성에서도 엿볼 수 있다”며 “회원직접판매는 기존의 불법다단계판매와는 달리 까다로운 법적 조건과 소비자 보호장치가 마련되어 있다”고 밝혔다. 이어 “공정거래위원회에서 인가한 직접판매공제조합에 정식 회원으로 등록되어 있으며, 공제규정에 따라 기업평가 및 매출심사, 소비자 피해보상 등 엄격한 심사를 받는다”고 덧붙였다. 미애부는 이와 같은 까다로운 법령에 따라 소비자 피해보상을 위해 2016년 말 기준 총 60억 3,500만원(지급보증)을 직접판매공제조합에 담보로 설정해둔 상태다. 미애부 관계자는 “방문판매 이상의 안전성 및 신뢰를 바탕으로 하는 유통방식과 함께 시대가 요구하는 자연주의 제품을 바탕으로 고객만족에 더욱 노력하겠다”고 밝혔다. textlinktopstart textlinktopend textlinkstart"
한국경제TV,225850,/news/news_read.nhn?article_id=0000499119&office_id=215&mode=search&query=미애부&page=1,2016-09-30 15:58,"오대교수능연구소, 미애부 대구지점과 함께하는 &lsquo;수능전략강연회&rsquo; 개최","[한국경제TV 디지털뉴스팀] 오대교수능연구소는 지난 28일 미애부 대구지점에서 2017대입 수험생 및 학부모를 위한 ‘수능전략강연회’를 진행했다고 밝혔다. 이날 강연을 한 교육전문가 오대교 대표는 청소년 공부법 부분 베스트셀러가 된 저서 의 내용을 바탕으로 ‘수능시험을 예상하는 방법’ , ‘30일 1등급 향상 비법’을 중심으로 주제 강연을 했다. 수능 시험에 앞서 지난 9월 실시한 평가원 모의고사 (한국교육과정평가원 전국연합평가) 시험 분석과 2017학년도 수능 시험 전망을 겸한 이번 강연회에서 오 대표는 “11월 수능 시험의 방향과 문항을 예측할 수 있는 9월 모의고사 결과를 바탕으로 수능 학습 및 대입 전략을 준비해야 한다.”고 강조했다. 이번 강연회를 기획한 김근영 처장(미애부 대구지점)은 “대부분의 고객들이 중, 고등학생 자녀를 둔 점에 착안하여 대입설명회 서비스”를 기획하게 되었다고 전하며, 학부모 입장에서 궁금해 하는 대입 정보를 접할 수 있는 기회를 만들고자 노력했다고 말했다. 박다은 지점장은 “빠르게 변화하는 대입에 필요한 효과적인 정보를 미애부 가족들과 고객들에게 제공함으로서 고객 만족도를 높이는 효과”를 기대했다며, 고객들의 반응이 예상보다 좋아 성공적인 서비스가 되었다 평가하고 이와 같은 대입설명회 및 수능공부법 강연회 프로그램을 정기적으로 진행하겠다는 뜻을 밝혔다. 이번 강연회에서 오 대표는 ‘EBS에서 제공하는 채점 서비스’ 활용을 특히 강조하면서, “오답률 정보를 바탕으로 중위권 학생들의 경우 기본 개념을 묻고 있는 문항을 선택해 집중하고, 상위권 학생들의 경우 각 시험별 응시생이 많이 틀린 오답률이 높은 5개 문항을 선택”하여 집중 학습하는 방법을 사례와 함께 구체적으로 설명했다. 이날 참석자들과 함께한 질의응답 시간에는 ‘9월 모의고사 결과를 활용하는 방법’, ‘수능 시험까지 남은 50여일 활용 방법’ 등 수험생 및 학부모들이 평소 궁금해 한 내용들에 대해 구체적인 답변을 전했다. 이날 강연회에 참석한 한 학부모는 “대입에 막연한 불안감을 갖고 있었는데, 수능 전문가의 강연을 듣고 효과적인 방향을 잡을 수 있어 좋았다”는 이야기를 전하며, 앞으로도 미애부 대구지점을 통해 이와 같은 강연회가 지속적으로 있었으면 하는 바람을 전했다. 오대교수능연구소에서는 ‘수능 분석 15년 데이터’를 기반으로, 기업체 VIP고객을 대상으로 한 맞춤형 대입강연회 서비스를 활성화할 계획 중이다. 디지털뉴스팀"
머니투데이,225850,/news/news_read.nhn?article_id=0003983285&office_id=008&mode=search&query=미애부&page=1,2017-12-22 17:05,"미애부, '가족친화형 기업' 여성가족부장관 표창","[머니투데이 중기&창업팀 고문순 기자] ㈜미애부가 지난 19일 서울 대한상공회의소에서 열린 ‘2017년 가족친화인증 및 일·생활 균형 우수기업 시상식’에서 여성가족부장관 표창을 수상했다고 밝혔다. 사진제공=(주)미애부 여성가족부는 총 2,802개의 가족친화인증 기업과 함께 우수한 25개 기업을 일·생활 균형 우수기업으로 선정하여 별도의 시상을 진행했다. 25개 기업에 미애부는 여성인력관리 우수기업으로 선정되어 여성부장관 표창을 받았다. 가족친화인증은 여성가족부가 가족친화제도를 모범적으로 운영하는 기업에 인증을 부여하는 제도다. 미애부는 이미 지난 2014년에 이어 재인증을 획득했다. 미애부는 2003년 창립 이래 항상 여성을 배려하고 사회 속에서 여성이 겪게 되는 불편과 어려움에 대해 깊이 생각하는 기업문화를 일구는데 노력해오고 있다. 특히, 여성근무자의 출산지원과 근무환경, 가족친화 문화조성 등이 평가에서 우수한 점수를 받았다. 이 외에도 사내 카페테리아 운영 및 장기근속자 시상 등 여성을 배려하는 다양한 복지제도를 운영 중이다."
연합뉴스,225850,/news/news_read.nhn?article_id=0008038480&office_id=001&mode=search&query=미애부&page=1,2015-12-08 11:10,(주)미애부 코넥스시장 신규상장기념식,"(서울=연합뉴스) 한국거래소 코스닥시장본부는 8일 오전 서울사옥 홍보관에서 (주)미애부의 코넥스시장 신규상장기념식을 개최했다. 상장기념패 전달 후 강홍기 한국IR협의회 부회장(왼쪽부터), 김재준 한국거래소 코스닥시장위원회 위원장, 김기수 (주)미애부 대표이사, 김군호 코넥스협회 회장, 정해영 한양증권 대표이사가 기념촬영을 하고 있다. 2015.12.8 >"
파이낸셜뉴스,225850,/news/news_read.nhn?article_id=0003897523&office_id=014&mode=search&query=미애부&page=1,2017-10-31 10:10,"[fnRASSI]미애부, 4.36% 오르며 거래량 증가","미애부는 투자자들의 관심으로 현재 거래량이 최근 5거래일 거래량의 최고치를 넘어섰다. 그리고 미애부는 8일 연속 상승흐름을 보이며, 10시 6분 현재 4.36% 증가한 5,740원에 거래중이다. 'fnRASSI'는 증권전문 기업 씽크풀과 파이낸셜뉴스의 협업으로 로봇기자가 실시간으로 생산하는 기사입니다."
머니투데이,225850,/news/news_read.nhn?article_id=0003614108&office_id=008&mode=search&query=미애부&page=1,2016-01-15 16:51,"미애부, 다단계판매업으로 판매방식 변경 결정",[머니투데이 백지수 기자] 코넥스기업 미애부는 유통 효율성을 개선하기 위해 기존 후원방문판매업에서 다단계판매업으로 판매방식을 변경키로 결정했다고 15일 공시했다. textlinktopstart textlinktopend textlinkstart
한국경제,225850,/news/news_read.nhn?article_id=0003945621&office_id=015&mode=search&query=미애부&page=1,2018-05-24 08:09,"케이프투자증권, 미애부 영업이익 68.2% 늘어날 것","[ 강영연 기자  ] 케이프투자증권은 미애부의 올해 영업이익이 전년대비 68.2% 늘어날 것으로 전망했다. 미애부는 회원직접판매(다단계 판매) 업체로 모회사인 엠앤씨생명과학이 개발, 제조한 화장품과 건강기능식품의 유통과 판매를 담당하고 있다. 케이프투자증권은 미애부의 올해 매출과 영업이익은 각각 589억원, 41억원으로 지난해보다 각각 7.2%, 68.2% 늘어날 것으로 전망했다. 김광진 케이프투자증권 연구원은 “제품에 화학물질을 쓰지 않아 재구매율이 80%에 달할 정도로 충성도가 높다”며 “46개에 달하는 전국 지점망을 운영해 매출이 꾸준히 늘고 있다”고 분석했다."
서울경제,225850,/news/news_read.nhn?article_id=0002929283&office_id=011&mode=search&query=미애부&page=1,2016-12-02 12:57,"미애부생명과학, 뛰어난 기술력으로 중소기업청장 표창",옥민 미애부생명과학 대표가 지난 1일 서울 코엑스에서 열린 ‘2016 벤처활성화 유공포상 시상식’에서 중소기업청장 표창을 받고 있다. /사진제공=미애부생명과학
