source,symbol,link,date,title,content
머니투데이,241710,/news/news_read.nhn?article_id=0003849045&office_id=008&mode=search&query=코스메카코리아&page=1,2017-03-31 14:53,"코스메카코리아, 조임래&middot;박은희 공동대표 체제로 변경",[머니투데이 권혜민 기자] 코스메카코리아는 이사회 결의에 따라 조임래 단독 대표 체제에서 조임래·박은희 공동대표 체제로 변경했다고 31일 공시했다. textlinktopstart textlinktopend textlinkstart
한국경제,241710,/news/news_read.nhn?article_id=0003502813&office_id=015&mode=search&query=코스메카코리아&page=1,2015-12-17 07:09,"[2015 올해의 CEO 대상] 코스메카코리아, R&amp;D&middot;설비 집중투자로 화장품 트...","코스메카코리아 조임래 회장 조임래 코스메카코리아 회장은 1978년 피어리스에 입사하며 화장품업계와 인연을 맺었다. 피어리스 연구실장, 한국콜마와 태웅화장품 연구소장을 거친 뒤 1999년 화장품 연구개발 및 제조생산 전문기업인 코스메카코리아를 설립했다. 조 회장은 연구개발(R&D) 및 최신 설비 도입에 집중적으로 투자했다. 고객의 다양한 니즈와 트렌드 변화에 신속하게 대응하기 위해 신제품 개발과 엄격한 품질관리 시스템을 적용했다. 혁신 정신을 바탕으로 한 리더십으로 코스메카코리아를 국내 화장품 ODM(제조자개발생산) 기업 가운데 3위 안에 꼽히는 우량 중견기업으로 키웠다. 이 회사는 3중 기능성 비비크림을 최초로 개발해 국내 BB크림 돌풍을 이끈 기업으로도 잘 알려져 있다. 코스메카코리아를 가장 잘 표현하는 단어는 ‘혁신’이다. 조 회장을 비롯한 모든 직원은 ‘안녕하세요’라는 인사말 대신 ‘혁신합시다’라는 말을 사용한다. 조 회장은 ‘대표가 먼저 혁신의 고통을 감수하지 않으면 기업의 미래가 없다’는 생각으로 컨설팅 교육, 생산 환경 개선, 업무 혁신 등 현장에서 솔선수범해 대대적인 변화를 추진했다. ["
매일경제,241710,/news/news_read.nhn?article_id=0003875199&office_id=009&mode=search&query=코스메카코리아&page=1,2017-01-18 14:12,코스메카코리아 `2017 CIR 뷰티 기술 세미나` 개최,"더마, 안티폴루션, 융합기술 기반 새로운 제품 컨셉 제안 화장품 연구개발 및 제조생산 기업 코스메카코리아가 20일 JW메리어트호텔 서울에서 '2017 CIR 뷰티 기술 세미나'를 개최한다고 18일 밝혔다. 코스메카코리아는 이번 세미나를 통해 국내외 화장품 브랜드사와의 긴밀한 소통을 통한 동반성장을 실현하고 장기적으로는 혁신제품을 개발해 한국 화장품이 한 단계 도약할 수 있는 계기를 만들 예정이다. CIR은 크리에이티브(Creative), 이노베이션(Innovation), 리서치(Research)의 머릿글자를 따서 만든 단어로 창조와 혁신을 담은 코스메카코리아의 정신을 의미한다. 코스메카코리아는 2013년 판교 기술연구원을 CIR센터로 명명하기도 했다. CIR 뷰티 기술 세미나에는 코스메카코리아 고객사인 아모레퍼시픽, LG생활건강, 에이블씨엔씨, 클리오 등 31개 화장품업체 160여명이 참석한다. 2017년 마케팅·기술 트렌드, 스킨케어·메이크업 개발 방향 등 카테고리로 발표된다. 코스메카코리아의 기술혁신을 주도하는 스킨케어연구소, 메이크업연구소, 연구기획부문과 화장품 트렌드와 상품기획을 이끌어가는 마케팅본부 등이 참여해 화장품 기술동향 및 패러다임 변화 등을 살필 예정이다. 최근 화장품 시장에서 대두되는 더마, 안티폴루션, 융합기술 기반의 새로운 제품 컨셉도 제안된다. 이영하 스킨케어연구소장, 조현대 메이크업연구소장, 최유정 이사대우, 남세희 책임연구원이 발표자로 나서며 각 부문의 전문적인 Q&A도 함께 이뤄진다. 조임래 코스메카코리아 회장은 ""연구개발을 바탕으로 혁신을 거듭해온 코스메카가 화장품 산업 발전에 필요한 토론의 장을 마련했다""며 ""한국 화장품이 세계적으로 주목을 끌고 있는 만큼 전세계 고객을 만족시키기 위한 첫걸음으로 볼 수 있는 이번 기술 세미나에 국내외 브랜드사의 많은 관심과 참여를 바란다""고 말했다. [이영욱 기자] r_start // r_end //"
한국경제,241710,/news/news_read.nhn?article_id=0003695059&office_id=015&mode=search&query=코스메카코리아&page=1,2016-12-05 09:40,"코스메카코리아, &lsquo;2000만불 수출탑&rsquo; 수상","화장품 주문자상표부착생산(OEM)업체 코스메카코리아(회장 조임래)는 제53회 무역의 날을 맞아 ‘2000만불 수출의 탑’을 수상했다고 5일 밝혔다. 코스메카코리아는 지난해 1000만불 수출의 탑을 수상한데 이어 올해 2000만불 수출의 탑을 받았다. 이 회사는 화장품 연구개발 노하우를 바탕으로 미국, 유럽, 아시아 등 13개국에 다양한 유통채널을 구축했다. 국내외 600여개 브랜드사에 제품을 공급하고 있으며 해외시장 매출 비중은 전체 매출에서 28%를 차지한다. 조임래 코스메카코리아 회장은 “올해는 화장품 시장이 급성장하고 있는 중국에 코스메카차이나를 설립했다”며 “글로벌 기업으로 성장하기 위해 노력하겠다”고 말했다."
머니투데이,241710,/news/news_read.nhn?article_id=0003838263&office_id=008&mode=search&query=코스메카코리아&page=1,2017-03-14 14:22,"코스메카코리아, 오는 31일 주총 소집 결의","[머니투데이 권혜민 기자] 코스메카코리아는 오는 31일 오전 9시 충북 음성군 대소면 대금로 196번길 17-12에서 정기 주주총회를 개최한다고 14일 공시했다. 안건은 재무제표 승인의 건, 이사·감사 선임의 건 등이다. textlinktopstart textlinktopend textlinkstart"
전자신문,241710,/news/news_read.nhn?article_id=0002613691&office_id=030&mode=search&query=코스메카코리아&page=1,2017-06-01 09:14,"[ET투자뉴스]코스메카코리아, &quot;ODM 삼강구도의 &hellip;&quot; 매수(신규)-하나금융투자","하나금융투자에서 1일 코스메카코리아(241710)에 대해 ""ODM 삼강구도의 완결""라며 투자의견을 '매수(신규)'로 제시하였다. 아울러 12개월 목표주가를 91,000원으로 내놓았다. 하나금융투자 박종대, 유민선 애널리스트가 동종목에 대하여 이번에 제시한 '매수(신규)'의견은 하나금융투자에서는 올해들어 처음 내놓는 매매의견이며 그리고 최근 분기내 발표된 전체 증권사 리포트의 컨센서스와 비교를 해볼 경우에 오늘 발표된 투자의견은 전체의견에 수렴하고 있어, 이번 의견은 시장의 평균적인 기대감이 객관적으로 표현된 것으로 분석되고 있다. 또한 전일 종가 기준으로 볼때 동종목의 현주가는 이번에 제시된 목표가 대비 22.1%의 저평가 요인이 존재한다는 해석이 제시되고 있다."
아시아경제,241710,/news/news_read.nhn?article_id=0004056417&office_id=277&mode=search&query=코스메카코리아&page=1,2017-08-17 10:40,"[특징주]코스메카코리아, 반기 실적 상승에 5%&uarr;","[아시아경제 문채석 기자]코스메카코리아가 지난 상반기 호실적을 거둔 것으로 발표하자 눈에 띄는 상승세를 보이고 있다. 17일 오전 10시38분 현재 코스메카코리아는 전 거래일보다 5.59% 오른 6만4200원에 거래되고 있다. 코스메카코리아는 상반기 연결 기준 매출액 498억5900만원, 영업이익 52억3700만원을 거뒀다고 17일 공시했다. 아모레퍼시픽(+0.00%), LG생활건강(-0.10%), 한국콜마(+0.29%), 한국화장품(-0.36%), 아모레G(+0.00%) 등 다른 화장품주 주가는 보합세를 보이고 있다. 박은정 대신증권 연구원은 ""코스메카코리아의 실적이 잘 나온 데다가 밸류에이션(실적 대비 주가 주가 수준)이 낮아 주가가 반응하고 있다""고 말했다."
헤럴드경제,241710,/news/news_read.nhn?article_id=0001278743&office_id=016&mode=search&query=코스메카코리아&page=1,2017-08-18 09:06,"[생생코스닥] 코스메카코리아, 화장품주 악재 속에서 고성장 유지","- 사드 악재에도 2분기 차별화한 실적 발표- 히트상품 중심 내년 해외시장서 큰 폭 성장 전망 [헤럴드경제=박세환 기자] 화장품 제조업자개발생산(ODM)업체인 코스메카코리아가 내수 침체와 중국발 사드리스크에도 2분기 호실적을 이어가면서 투자자들의 관심을 모으고 있다. 특히 올해는 물론 내년에서 히트 상품을 중심으로 해외시장에서 큰 폭의 성장을 이어갈 것이라는 전망도 나오고 있다. 18일 금융감독원 전자공시시스템에 따르면 코스메카코리아의 올 2분기 연결기준 영업이익은 전년동기 대비 31.8% 증가한 52억원을 기록했다. 매출은 499억원으로 14.6% 늘었고 순이익은 23.6% 증가한 49억원으로 집계됐다. 오린아 이베스트투자증권 연구원은 “내수 매출과 수출은 각각 전년 대비 7.5%와 35.6% 증가했고, 중국법인 매출은 41.8% 늘어났다”며 “국내 화장품 업체 중 상대적으로 양호한 실적을 기록했다”고 말했다. 오 연구원은 “중국법인은 톤업크림 등 히트 상품 위주의 매출 성장을 지속하고 있다”며 “중국 매출의 고객사별 비중은 중국 현지 브랜드 78%, 한국업체 22% 수준으로 중국 현지 화장품 시장 성장에 따른 수혜 받는 중”이라고 판단했다. 중국법인의 경우 계속 성장할 것이란 전망이다. 오 연구원은 “중국 현지 고객사들이 꾸준히 찾아와 다양한 요청을 하고 있다”며 “현지 공장 증설을 통해 지속적인 매출 상승이 가능하다”고 예상했다.  [이미지=게티이미지뱅크] 김영옥 KTB투자증권 연구원도 “미주 지역 중심의 해외 수출 견조한 상황에서 국내 증설 캐파 2018년부터 가동되며 오더 불륨 확대 용이해질 전망”이라며 “중국 역시 공격적인 캐파증설은 적체돼 있는 오더 해소를 위한 것으로 판단됨에 따라 향후 외형 성장 기대감은 유효하다”고 말했다. 대신증권은 코스메카코리아가 2018년 해외 시장으로부터의 실적이 큰 폭으로 성장할 전망이라면서 목표주가를 기존 8만원에서 8만9000원으로 올렸다. 박은정 대신증권 연구원은 “하반기는 안정적인 이익 성장, 2018년은 기대되는 해외 확장을 기대한다”면서 “화장품 히트 제품 개발력을 보유한 코스메카코리아는 국내외 단계적 설비 확충을 통해 글로벌 외형 고성장이 전망된다”고 강조했다. 박 연구원은 “2분기 화장품 기업의 이익 변동은 급속도로 부진해진 국내 전방 환경영향이 주효했다”며 “코스메카코리아는 드럭스토어, 온라인, 홈쇼 핑 등의 고객사 수주 확대를 통해 어려운 상황을 타개 중이고, 글로벌 수출 물량 및 중국 법인이 고성장하며 안정적 이익 성장이 하반기에도 기대된다”고 분석했다. 박세환 기자/"
전자신문,241710,/news/news_read.nhn?article_id=0002586499&office_id=030&mode=search&query=코스메카코리아&page=1,2017-02-21 09:27,"[ET투자뉴스]코스메카코리아, &quot;중국과 수출이 견인&hellip;&quot; 매수(유지)-대신증권","대신증권에서 21일 코스메카코리아(241710)에 대해 ""중국과 수출이 견인한 고성장""라며 투자의견을 '매수(유지)'로 제시하였고, 아울러 목표주가로는 80,000원을 내놓았다. 대신증권 박은정, 정다은 애널리스트가 동종목에 대하여 이번에 제시한 '매수(유지)'의견은 대신증권의 직전 매매의견과 동일한 것이고 전년도말의 매매의견을 기준으로  볼때도 역시 '매수'의견이 계속 유지되고 있는 상태이다. 그리고 최근 분기내 발표된 전체 증권사 리포트의 컨센서스와 비교를 해볼 경우에 오늘 발표된 투자의견은 대체적으로 평균치에 해당하는 수준으로, 이번 의견은 동종목에 대한 전체적인 흐름에서 크게 벗어나지 않은 것으로 분석되고 있다. 목표주가의 추이를 살펴보면 한동안 같은 수준을 유지하다가 이번에 목표가가 상향조정되는 모습이다. 또한 전일 종가 기준으로 볼때 동종목의 현주가는 이번에 제시된 목표가 대비 15.1%의 추가상승여력이 있다는 해석이 제시되고 있다."
매일경제,241710,/news/news_read.nhn?article_id=0003826774&office_id=009&mode=search&query=코스메카코리아&page=1,2016-10-28 16:12,[포토] 코스메카코리아&middot;HL사이언스 코스닥 입성,"김재준 한국거래소 코스닥시장본부장, 조임래 코스메카코리아 대표이사, 이해연 에이치엘사이언스 대표이사(왼쪽 셋째·넷째·다섯째) 등이 28일 한국거래소에서 열린 코스메카코리아·에이치엘사이언스의 신규 상장 기념식에 참석해 기념촬영하고 있다. [사진 제공 = 한국거래소] r_start // r_end //"
한국경제,241710,/news/news_read.nhn?article_id=0003891209&office_id=015&mode=search&query=코스메카코리아&page=1,2018-02-08 07:18,"&quot;코스메카코리아, 공장증설로 성장 기대&hellip;투자의견&middot;목표가&uarr;&quot;-신한","신한금융투자는 8일 코스메카코리아에 대해 공장증설로 성장이 기대된다며 목표주가를 기존 6만5000원에서 7만6000원으로 올려잡고, 투자의견도 중립에서 매수로 상향 조정했다. 이 증권사 이지용 연구원은 ""국내 및 중국 시장 CAPA(생산능력)에 열위가 있어 현재 동종업체(Peer) 대비 18% 낮은 기업 가치평가(Valuation)를 받고 있는 상황""이라며 ""증설로 이 격차가 축소될 것""이라고 말했다. 공격적 시설투자 CAPA는 2017년 2억4000개로 올해 4억9000개로 104.1% 큰 폭으로 증가할 것으로 예상했다. 이에 따라 올해 영업이익은 전년 대비 55.9% 증가해 실적 턴어라운드(급격한 실적 개선)가 전망된다고 이 연구원은 전했다. 다만 지난해 4분기 실적은 시장 기대치(컨센서스)를 밑돌 것으로 추정했다. 국내 로드샵 매출이 이연되면서 내수 매출이 2개 분기 연속 하락할 것으로 보이기 때문이다. 그는 ""4분기 매출액은 전년 대비 5.7% 감소한 421억원, 영업이익은 52.3% 줄어든 17억원이 예상된다""며 ""연구소 확대 이전으로 인한 신규 인력 채용으로 영업이익률은 3.9%포인트 하락한 4.1%를 기록할 것""이라고 내다봤다."
한국경제,241710,/news/news_read.nhn?article_id=0003922400&office_id=015&mode=search&query=코스메카코리아&page=1,2018-04-12 00:06,[코스닥 증자공시] (11일) 코스메카코리아,▲코스메카코리아=보통주 1주당 신주 1주를 배정하는 무상증자 결정. [
아시아경제,241710,/news/news_read.nhn?article_id=0004056351&office_id=277&mode=search&query=코스메카코리아&page=1,2017-08-17 09:56,[공시+]코스메카코리아 2분기 영업익 52억원&hellip;&quot;증설 이후 지속 수익 창출&quot;,"[아시아경제 권성회 기자]코스메카코리아가 화장품 업계의 고고도미사일방어체계(THAAD ·사드) 관련 위기에도 불구하고 시장의 예상치에 부합하는 실적을 보였다. 코스메카코리아는 올해 연결기준 2분기 매출액 499억원, 영업이익 52억원, 당기순이익 49억원의 실적을 거뒀다고 17일 발표했다. 전년 동기와 비교해 매출액은 14.6% 성장했고, 영업이익과 당기순이익은 각각 31.8%, 23.6% 증가했다. 상반기 매출은 전년 동기 대비 29.3% 증가한 1004억원을 기록했으며, 영업이익은 101억원, 당기순이익은 84억원으로 각각 36.0%, 24.8% 증가했다. 중국발 사드 위기에 따른 관광객 유입 감소로 인한 로드숍 등 국내 고객사로의 매출 하락에도 불구하고 전년 동기 대비 2분기 실적은 증가했다. 국내사업은 홈쇼핑, 온라인 채널 고객사로의 매출이 늘었고, 중국을 제외한 해외 수출 분야에서도 주요 글로벌 고객사에 대한 주문량이 증가했다. 중국사업도 현지 브랜드 전문매장, 온라인 고객사 등 현지 고객사에 대한 매출 증가가 성장의 주요인이 됐다. 코스메카코리아는 현재 충북 음성 본사 옆에 신규 공장을 증설하고 있으며, 신 공장이 완공되면 총생산능력은 지난해 대비 3배 증가한 3억1000만개로 예상된다. 중국에는 저장성 핑후에 신 공장을 내년 하반기 완공할 계획으로 토지허가증을 취득, 건축을 진행 중이다. 완공되면 현재 가동 중인 쑤저우와 포산의 공장을 합쳐 총생산능력이 2억4000만개로 지난해 대비 약 3배 늘어난다. 코스메카코리아 관계자는 “현재 추진 중인 국내외 신규 공장 건설을 차질 없이 진행해 지속적인 수익 창출의 토대를 마련하겠다”고 밝혔다."
파이낸셜뉴스,241710,/news/news_read.nhn?article_id=0003697587&office_id=014&mode=search&query=코스메카코리아&page=1,2016-08-26 10:21,"거래소, 코스메카코리아 등 4곳 코스닥 상장예비심사 통과","한국거래소는 코스메카코리아와 서플러스글로벌, 오가닉티코스메틱스홀딩스 등 4곳의 코스닥 상장예비심사를 통과했다고 26일 밝혔다. 1999년 설립된 화장품 제조업체 코스메카코리아는 지난해 매출액 991억원, 영업이익 64억원, 순이익 50억원을 각각 기록했다. 서플러스글로벌은 지난해 매출 941억원, 세전순이익 116억원, 순이익 90억원을 올린 반도체 제조용 장비 도소매 업체다. 화장품 제조업체를 자회사로 둔 오가닉티코스메틱스홀딩스는 홍콩에 소재한 비금융 지주회사로 지난해 연결 매출 1362억원, 세전순이익 490억원, 순이익 347억원의 실적을 기록했다. 또 거래소는 이날 한화에이스기업인수목적1호의 기업인수목적회사(스팩·SPAC) 합병상장도 승인했다. 합병 대상인 디알텍은 2000년에 설립된 의료용 기기 제조업체다. 지난해 매출액은 302억원, 세전순이익 17억원, 순이익 26억원을 기록했다."
이데일리,241710,/news/news_read.nhn?article_id=0004076919&office_id=018&mode=search&query=코스메카코리아&page=1,2018-04-11 14:04,"코스메카코리아, 주당 1주 무상증자 결정",[이데일리 이후섭 기자] 코스메카코리아(241710)는 보통주 1주당 1주의 신주를 배정하는 무상증자를 결정했다고 11일 공시했다. 신주 상장예정일은 오는 5월 18일이다.
뉴스1,241710,/news/news_read.nhn?article_id=0002360744&office_id=421&mode=search&query=코스메카코리아&page=1,2016-10-28 09:44,에이치엘사이언스&middot;코스메카코리아 코스닥시장 신규상장기념식,"(서울=뉴스1) 추연화 기자 = 한국거래소 코스닥시장본부는 28일 오전 서울사옥 홍보관에서 (주)에이치엘사이언스와 (주)코스메카코리아의 코스닥시장 신규상장기념식을 개최했다. 상장기념패 전달 후 임승원 한국IR협의회 부회장(왼쪽부터), 윤용암 삼성증권 대표이사, 김재준 한국거래소 코스닥시장위원회 위원장, 조임래 (주)코스메카코리아 대표이사, 이해연 (주)에이치엘사이언스 대표이사, 김성현 KB투자증권 IB대표, 김원식 코스닥협회 부회장이 기념촬영을 하고 있다. (한국거래소 제공) 2016.10.28/뉴스1"
전자신문,241710,/news/news_read.nhn?article_id=0002688458&office_id=030&mode=search&query=코스메카코리아&page=1,2018-03-05 09:31,"[ET투자뉴스]코스메카코리아, &quot;중국 법인 고성장은&hellip;&quot; NEUTRAL-하나금융투자","하나금융투자에서 5일 코스메카코리아(241710)에 대해 ""중국 법인 고성장은 긍정적이나, 미국 향 수출 저하 아쉬움""라며 투자의견을 'NEUTRAL'로 제시하였고, 아울러 목표주가로는 64,000원을 내놓았다. 하나금융투자 박종대 애널리스트가 동종목에 대하여 이번에 제시한 'NEUTRAL'의견은 하나금융투자의 직전 매매의견에서 큰 변화없이 그대로 유지되는 것이고  반면에 작년 연말의 매매의견을 기준으로 본다면 '매수'의견에서 'NEUTRAL로' 레벨다운된 것이다. 그리고 최근 분기내 발표된 전체 증권사 리포트의 컨센서스와 비교를 해볼 경우에 오늘 발표된 투자의견은 전체의견을 소폭 하회하는 수준으로 평가되는데, 이는 동종목에 대한 기대감을 다소 약하게 표현한 것으로 분석되고 있다. 목표주가의 추이를 살펴보면 최근 두차례 연속 하향조정되다가 이번에는 직전 목표가와 동일한 수준을 유지하는 모습이다. 또한 전일 종가 기준으로 볼때 동종목의 현주가는 이번에 제시된 목표가 대비 9%의 저평가 요인이 존재한다는 해석이 제시되고 있다."
머니S,241710,/news/news_read.nhn?article_id=0000322198&office_id=417&mode=search&query=코스메카코리아&page=1,2018-06-08 17:22,"[공시] 코스메카코리아, 200억원 규모 CB 발행 결정","코스메카코리아는 8일 200억원 규모 CB(전환사채)를 발행하기로 결정했다고 공시했다. 납입일은 오는 14일로 전환가액은 4만원으로 발행주식총수 대비 4.47% 수준이다.  전환청구기간은 2019년 6월14일부터 2023년 5월14일까지이며 표면이자율과 만기이자율 모두 0%이다. 모집방식은 제3자배정방식으로 대상자는 NH투자증권, KB증권, 미래에셋대우, 기업은행, 삼성증권 등 증권사의 전문투자형사모투자신탁사들이이다. 박기영 기자"
뉴스1,241710,/news/news_read.nhn?article_id=0003051472&office_id=421&mode=search&query=코스메카코리아&page=1,2017-11-16 17:10,"코스메카코리아, 3Q 영업익 전년比 77.5%&darr;&hellip;'사드에 휘청'","© News1 ""원브랜드숍 부진에 ODM주문량 줄어"" (서울=뉴스1) 김민석 기자 = 코스메카코리아는 올 3분기 영업이익은 4억8100만원으로 지난해 동기대비 77.5% 감소했다고 16일 공시했다. 같은기간 매출은 373억4900만원으로 전년대비 12.9% 감소하고 당기순이익은 6억5400만원으로 65.8% 줄었다. 증권업계에서는 코스메카코리아의 실적부진에 대해 중국인 관광객 감소로 인한 원브랜드샵 고객사 재고율이 증가함해 3분기 주문량이 감소함 것으로 판단된다고 풀이했다. 박신애 KB증권 연구원은 ""국내 고객사들의 실적이 2분기부터 악화됐고 원브랜드숍 업체들 경우 온라인과 헬스&뷰티숍과의 경쟁으로 실적이 부진하면서 ODM 주문량이 축소됐다""고 설명했다."
헤럴드경제,241710,/news/news_read.nhn?article_id=0001278302&office_id=016&mode=search&query=코스메카코리아&page=1,2017-08-17 10:45,"[생생코스닥] 코스메카코리아, 2분기 영업익 52억&hellip;전년동기比 31.8%&uarr;","- 상반기 영업익 36% 증가 [헤럴드경제=김지헌 기자] 코스메카코리아(회장 조임래) 올해 연결기준 2분기 매출 499억원, 영업이익 52억원, 당기순이익 49억원을 기록했다고 17일 밝혔다. 전년동기보다 매출은 14.6% 성장했고, 영업이익과 당기순이익은 각각 31.8%, 23.6% 늘었다. 상반기 매출은 전년동기보다 29.3% 증가한 1004억원을 기록했으며, 영업이익은 101억원, 당기순이익은 84억원으로 전년동기보다 각각 36.0%, 24.8% 증가했다. [사진=오픈애즈] 회사 관계자는 “중국발 사드 위기에 따른 관광객 유입 감소로 인한 로드샵 등 국내 고객사로의 매출 하락에도 불구하고 전년동기대비 2분기 실적은 증가했다”고 밝혔다. 국내사업은 홈쇼핑, 온라인 채널 고객사로의 수익이 증가했고, 중국을 제외한 해외 수출 분야에서 글로벌 고객사 주문량이 증가했다는 것이 회사측의 설명이다. 중국사업도 현지 브랜드 전문매장, 온라인 고객사 등 현지 고객사에 대한 매출 증가가 주효했다. 코스메카코리아는 현재 충북 음성 본사 옆에 신규 공장을 증설하고 있다. 신공장이 완공되면 총생산능력은 지난해보다 3배 증가한 3억1000만개로 예상된다. 내년 하반기에는 중국 저장성 핑후에 신공장을 완공할 계획이다. 완공되면 현재 가동중인 쑤저우와 포산의 공장을 합쳐 총생산능력이 2억4000만개가 된다. 코스메카코리아 관계자는 “현재 추진 중인 국내외 신규 공장 건설을 차질 없이 진행해 지속적인 수익 창출의 토대를 마련하겠다”고 밝혔다."
