source,symbol,link,date,title,content
스포츠경향,241710,/news/news_read.nhn?article_id=0000512868&office_id=144&mode=search&query=코스메카코리아&page=1,2017-09-15 11:09,"코스메카코리아, 오송뷰티엑스포 참가 &ldquo;중국시장 과잉집중 벗어날 것&rdquo;","‘K뷰티’를 대표하는 화장품 제조사 3사 중 하나인 코스메카코리아가 2017 오송화장품뷰티산업엑스포 참가했다. 코스메카코리아 제공 코스메카코리아는 이번 오송엑스포를 통해 중국 시장으로 과잉 집중되던 것을 벗어나 전세계 다양한 판로를 모색하기 위해 일본, 베트남, 말레이시아 등 아시아권 국가는 물론 중동, 유럽 등 세계 각국의 바이어들과 미팅을 진행한다는 계획이다. 특히 최근 코스메카코리아를 대한민국을 대표하는 3강 ODM업체로 인식하는 해외 브랜드사들이 많아지면서 미팅을 원하는 바이어들과 고객사의 수도 크게 증가해 사전에 상담일정을 미리 조율해 효율적인 상담이 가능하도록 했다. 올해는 부스에 주요 완제품, 히트 제품은 물론 2017년 계절별 제안샘플도 전시해 엑스포를 찾은 국내 유명 백화점과 홈쇼핑, 인터넷쇼핑몰 등의 유통상품기획자(MD)와의 상담도 꾸준히 이어지고 있다. 충북도와 청주시가 주최하는 오송엑스포는 오는 16일까지 닷새간 열리며 K뷰티를 이끄는 화장품 업체들이 바이어들과 한 자리에서 무역상담을 하고 수출계약까지 하는 ‘기업 간 거래(B2B)’ 중심의 산업박람회다. 올해 참가하는 바이어는 줄잡아 1,000여명에 이르며, 이 가운데 절반이 넘는 500여명이 전세계 40개국에서 오는 해외 바이어들이다. 특히 수출 다변화를 위해 중국 중심에서 탈피해 세계 각지의 바이어들이 고루 초청된 점이 눈길을 끈다. 코스메카코리아는 3중 기능성 BB크림을 세계 최초로 개발해 화장품의 새로운 카테고리를 만들며 전세계적으로 이름을 알린 코스메카코리아는 그 후에도 여러 히트 상품을 개발했다."
파이낸셜뉴스,241710,/news/news_read.nhn?article_id=0003672614&office_id=014&mode=search&query=코스메카코리아&page=1,2016-07-04 18:06,코스메카코리아 등 3개사 코스닥 상장 예심 청구,"한국거래소 코스닥시장본부는 벤처 기업 코스메카코리아의 코스닥시장 상장 예비심사와 2개사의 합병상장 예비심사를 청구했다고 4일 밝혔다.코스메카코리아는 화장품 주문자 상표 부착 생산(OEM).제조자 개발 생산(ODM) 업체로 지난해 영업이익은 71억8500만원을 기록했다.한화에이스기업인수목적은 의료용 기기 제조업체인 디알텍과의 합병 상장 예비심사를, 아이비케이에스제3호기업인수목적은 소프트웨어 개발.공급업체인 유라클과의 합병 상장 예비심사를 각각 청구했다.김가희 기자"
전자신문,241710,/news/news_read.nhn?article_id=0002659693&office_id=030&mode=search&query=코스메카코리아&page=1,2017-11-20 16:18,"[ET투자뉴스]2017년 3분기 실적발표 코스메카코리아, 전분기比 실적 감소","11월 16일 코스메카코리아(241710)의 2017년 3분기 연결 확정 실적이 발표됐다. 작년 같은 기간 대비해서 매출액, 영업이익, 당기순이익 모두 감소하였다. 매출액은 12.87% 감소한 373억원을, 영업이익은 77.48% 감소하여 4.8억원으로 발표됐다. 당기순이익은 65.78% 줄어들어 6.5억원으로 집계되었다. 이번분기 기준으로 추정되는 한편 동종목의 주가가 1주당 수익의 몇배가 되는지 나타내는 주가수익비율(PER)은 512.7배로 나타났다. 직전분기 PER은 76.44배로 이번 분기에 상승했다. 다음은 코스메카코리아와 동일 업종 내 비교 그룹 종목의 각각 최근 실적의 전년 동기 대비 성장률이다. 코스메카코리아의 매출액 증감율은 타 종목 대비 가장 우수한 편이다. 그리고 주가는 하락하였지만 가장 나은 상승률을 기록하였다."
아시아경제,241710,/news/news_read.nhn?article_id=0004233709&office_id=277&mode=search&query=코스메카코리아&page=1,2018-05-08 09:08,"[특징주]&quot;코스메카코리아, 2Q 최대 실적 예상&quot; 8%&uarr;","[아시아경제 문채석 기자]코스메카코리아가 8% 가까이 오르고 있다. 2분기에 사상 최대 실적을 거둘 것으로 예상되고 잉글우드랩 인수로 미국 진출 기대감도 피어오르고 있다는 분석도 나온다. 8일 오전 9시5분 현재 코스메카코리아는 전 거래일보다 3400원(7.73%) 오른 4만7400원에 거래되고 있다. 이지용 신한금융투자 연구원은 ""1분기 영업이익은 전년 동기 대비 73% 감소한 13억원으로 부진하겠지만 2분기는 32.2% 늘어난 69억원 사상 최대 분기 실적을 달성할 것""이라며 ""다음달 8일 완료되는 잉글우드랩 인수(지분 37%)으로 오는 하반기부터 연결 실적에 반영될 것""이라고 예상했다. 이 연구원은 ""잉글우드랩 인수로 미국 식품의약국(FDA) 워닝 레터(Warning letter) 문제도 해결 가능하다""며 ""FDA 승인을 이미 획득한 잉글우드랩 미국공장을 통해 자외선 차단 일반의약품(OTC) 제품을 생산할 수 있기 때문""이라고 덧붙였다."
이데일리,241710,/news/news_read.nhn?article_id=0003972497&office_id=018&mode=search&query=코스메카코리아&page=1,2017-11-17 08:14,"코스메카코리아, 3Q 실적 부진&hellip;목표가&darr;-신한","[이데일리 윤필호 기자] 신한금융투자는 17일 코스메카코리아(241710)에 대해 3분기 실적이 부진했으며 이 같은 분위기가 4분기까지 이어질 것으로 내다봤다. 투자의견은 매수(Buy)에서 Trading Buy로, 목표주가는 기존 7만6000원에서 6만5000원으로 각각 하향조정했다. 이지용 신한금융투자 연구원은 “3분기 매출액은 373억원을 기록했다”며 “매출이 감소한 이 유는 국내법인 부진 때문이다. 계절적 비수기와 중국인 관광객 감소에 따른 브랜드 주문 감소 효과로 내수 매출액은 230억원을 기록했다”고 밝혔다. 수출도 부진했다. 그는 “작년 역기저 효과와 2분기 선주문으로 국내법인 수출은 75억원을 기록했다”며 “다행스러운 점은 중국 법인 성장이다. 중국 현지 브랜드, 온라인 고객사 증가로 중국 매출은 91억원을 달성했다”고 했다. 그는 “영업이익은 5억원으로 컨센서스와 당사 기존 예상치를 큰 폭으로 하회했다”면서 “부진의 이유는 비용 증가 때문이다. 원가율은 전년 동기 대비 1.3%포인트 개선됐지만 판관비율이 전년 동기대비 5.1%p 상승했다”고 했다. 이어 “기본급 인상과 신규 인력 채용으로 인한 인건비, 연구소 확장 이전에 따른 임차료 증가로 부진 한 수익성을 기록했다”고 덧붙였다. 4분기도 부진이 이어지며 영업이익 개선은 내년 2분기에 기대할 수 있을 것으로 보인다. 이 연구원은 “4분기 매출액과 영업이익은 각각 428억원과 12억원으로 전망한다”며 “3분기와 마찬가지로 비우호적 영업 환경으로 실적 부진이 이어지겠다. 3분기 내수 부진의 원인인 중국인 관광객 증가는 내년 2분기로 전망한다. 이에 따른 실적 개선도 내년 2분기부터 시작되겠다”고 언급했다."
매일경제,241710,/news/news_read.nhn?article_id=0003998428&office_id=009&mode=search&query=코스메카코리아&page=1,2017-08-18 08:12,"[Hot-Line] &quot;코스메카코리아, 글로벌 외형 고성장 기대&quot;&hellip;목표가&uarr;","[표 제공 : 대신증권] 대신증권은 18일 코스메카코리아가 2018년 해외 시장으로부터의 실적이 큰 폭으로 성장할 전망이라면서 목표주가를 기존 8만원에서 8만9000원으로 올렸다. 박은정 연구원은 ""하반기는 안정적인 이익 성장, 2018년은 기대되는 해외 확장을 기대한다""면서 ""화장품 히트 제품 개발력을 보유한 코스메카코리아는 국내외 단계적 설비 확충을 통해 글로벌 외형 고성장이 전망된다""고 강조했다. 그는 ""2분기 화장품 기업의 이익 변동은 급속도로 부진해진 국내 전방 환경영향이 주효했다""며 ""코스메카코리아는 드럭스토어, 온라인, 홈쇼핑 등의 고객사 수주 확대를 통해 어려운 상황을 타개 중이고, 글로벌 수출 물량 및 중국 법인이 고성장하며 안정적 이익 성장이 하반기에도 기대된다""고 분석했다. 코스메카코리아는 2분기 실적으로 매출 499억원, 영업이익 52억원을 기록했다. 매출은 전분기 대비 1.4% 줄었고, 영업이익은 같은 기간 8.5% 늘었다. [디지털뉴스국 박진형 기자] r_start // r_end //"
연합뉴스,241710,/news/news_read.nhn?article_id=0009048737&office_id=001&mode=search&query=코스메카코리아&page=1,2017-02-20 10:24,"코스메카코리아, 작년 연결 영업익 126억원&hellip;97%&uarr;","(서울=연합뉴스) 유현민 기자 = 코스닥에 상장된 화장품 제조업체인 코스메카코리아는 지난해 연결기준 영업이익이 전년보다 97.4% 증가한 126억원으로 잠정 집계됐다고 20일 공시했다. 매출액은 1천652억원으로 66.6% 늘었고, 당기순이익은 109억원으로 117.3% 증가했다."
뉴시스,241710,/news/news_read.nhn?article_id=0008560008&office_id=003&mode=search&query=코스메카코리아&page=1,2018-04-24 11:37,[특징주]美 현지 화장품 법인 양수 결정에 코스메카코리아 &uarr;,"【서울=뉴시스】장서우 기자 = 잉글우드랩 지분 인수로 미국 화장품 제조자개발생산(ODM) 시장 진출을 공식화한 코스메카코리아(241710)가 24일 상승세다. 이날 오전 11시25분 현재 코스메카코리아는 코스닥 시장에서 전 거래일(7만5600원)보다 2000원(2.65%) 오른 7만7400원에 거래되고 있다. 주가는 이날 개장 직후 7만8600원까지 뛰며 52주 신고가를 새로 쓴 후 하락하다가 이내 반등해 상승 곡선을 그리고 있다. 코스메카코리아는 미국 화장품 제조자개발생산(ODM) 업체인 잉글우드랩(950140)의 주식 689만6831주를 578억원에 양수하기로 결정했다고 밝혔다. 양수금액은 지난해 자기자본의 50.9%이며 양수 후 지분율은 34.71%다. 양수 예정일은 오는 6월8일이다. 증권가에선 미국 식품의약국(FDA) 규정 변경 이슈와 더불어 중국 시장 등에서의 수출 감소로 올해 1분기 실적이 다소 부진할 것으로 예상되면서 이번 양수 결정이 이를 만회할 것이란 기대감이 나오고 있다. 양지혜 메리츠종금증권 연구원은 ""코스메카코리아의 1분기 매출액은 502억원, 영업이익은 20억원으로 각각 전망돼 크게 부진할 전망""이라며 ""제이엠솔루션 등 신규 고객사 영입과 미국 현지 법인 잉글우드랩 인수를 통한 실적 개선 가능성을 고려해 적정 주가를 7만7000원으로 상향한다""고 밝혔다. 이승은 BNK투자증권 연구원도 ""코스메카코리아 시가총액은 4000억원, 잉글우드랩 시가총액은 1400억원으로 합병 후 코스메카코리아의 가치는 5000억원 이상으로 전망된다""며 ""글로벌 고객사 확보로 투자 매력도가 높아질 것""이라고 내다봤다. 코스메카코리아의 올해 2분기 실적은 사상 최대치를 기록할 것으로 전망된다. 신한금융투자는 지난 19일 코스메카코리아의 2분기 매출액과 영업이익을 각각 759억원, 72억원으로 예상했다. 주력 고객사인 지피클럽의 성장과 더불어 홈쇼핑 내수와 중국 현지 매출의 증가세가 근거다. 이와 같은 전망이 나오면서 코스메카코리아의 주가는 이날 7.37% 뛰었다. 지난 20일을 제외하면 주가는 이날까지 4거래일 연속 상승 흐름을 타고 있다."
머니투데이,241710,/news/news_read.nhn?article_id=0004009641&office_id=008&mode=search&query=코스메카코리아&page=1,2018-02-14 10:34,"코스메카코리아, 지난해 영업이익 109억&hellip;전년比 16.7% &darr;","[머니투데이 이건희 기자] 코스메카코리아는 지난해 연결 기준 영업이익이 109억원으로 전년 동기 대비 16.7% 감소했다고 14일 공시했다. 같은 기간 매출액은 1825억원으로 10.5% 증가했다. 당기순이익은 13.6% 감소한 99억원으로 나타났다. 지난해 4분기 실적의 매출액은 448억원이었다. 매출액은 전년 동기 대비 0.2% 늘었지만 영업이익은 4억원, 당기순이익은 9억원으로 각각 89%와 65.9% 줄었다. 이와 별도로 코스메카코리아는 올해 연간 영업이익을 190억원, 매출액은 2400억원으로 전망했다. 회사 측은 또 결산배당으로 보통주 주당 200원의 현금배당을 결정했다고 이날 밝혔다. 배당금 총액은 10억6800만원이다."
머니투데이,241710,/news/news_read.nhn?article_id=0003845642&office_id=008&mode=search&query=코스메카코리아&page=1,2017-03-27 08:10,"코스메카코리아, 중국 사드 대응 지켜봐야-골든브릿지투자증권","[머니투데이 진경진 기자] 골든브릿지투자증권은 코스메카코리아 의 성장 기대치에 대해 사드로 인한 중국의 대응 등을 지켜봐야 한다고 분석했다. 김장열 연구원은 27일 ""표면적으로 사드 관련은 아니었지만 중국 당국에서 현지 공장에 단속을 나와 점검을 했다""며 ""큰 문제는 없었고 오히려 생산이 늦다거나 생산능력이 부족하다는 불평을 한것으로 알려졌다. 이는 제품·경쟁력 자체에는 이상이 없다는 것""이라고 설명했다. 김 연구원은 다만 ""당초 한국 공장 증설 시점이 올해 8월에서 10월로 연기됐고 광저우 '코스메카불산유한공사'공장 증축 관련 CFDA(중국 위생허가) 실사가 사드 영향으로 늑장을 부리고 있는 것도 지켜 볼 사항""이라며 ""당초 일부 기대 (전년 대비 40%대 매출 성장)는 낮춰야 한다""고 밝혔다. 그는 ""그럼에도 코스메카코리아는 차별적 신제품 개발 능력을 가지고 있고 독자적인 CPS 생산시스템 구축으로 생산성향상 안정화에 돌입했다""며 ""2019년에는 현재의 3배 수준으로 생산능력이 증가해 중국 등 해외 매출 확대가 가속화 할 것""이라고 내다봤다. textlinktopstart textlinktopend textlinkstart"
전자신문,241710,/news/news_read.nhn?article_id=0002623912&office_id=030&mode=search&query=코스메카코리아&page=1,2017-07-12 11:23,"[ET투자뉴스]코스메카코리아, &quot;2Q17 중국 관광&hellip;&quot; 매수(유지)-BNK투자증권","BNK투자증권에서 12일 코스메카코리아(241710)에 대해 ""2Q17 중국 관광객 감소에도 시장기대치 소폭 상회 예상""라며 투자의견을 '매수(유지)'로 제시하였다. 아울러 6개월 목표주가를 88,000원으로 내놓았다. BNK투자증권 이승은 애널리스트가 동종목에 대하여 이번에 제시한 '매수(유지)'의견은 BNK투자증권의 직전 매매의견과 동일한 것이고 반면에 연초반의 시장컨센서스에 견주어 본다면 '매수'의견에서 '매수(유지)로' 레벨다운된 것이다. 그리고 최근 분기내 발표된 전체 증권사 리포트의 컨센서스와 비교를 해볼 경우에 오늘 발표된 투자의견은 전체의견에 수렴하고 있어, 이번 의견은 시장의 평균적인 기대감이 객관적으로 표현된 것으로 분석되고 있다. 한편 6개월 목표주가로 제시한 88,000원은 직전에 발표된 목표가와 대비해서 큰 변화는 없고,"
파이낸셜뉴스,241710,/news/news_read.nhn?article_id=0004016448&office_id=014&mode=search&query=코스메카코리아&page=1,2018-05-08 09:23,"[특징주]코스메카코리아, 2&middot;4분기 최대 실적 예상에 상승세","코스메카코리아가 2·4분기 최대 실적 예상에 상승세다. 잉글우드랩 인수로 미국 진출 기대감도 피어오르고 있다는 분석도 나온다. 8일 오전 9시 21분 현재 코스메카코리아는 전 거래일보다 3300원(7.5%) 오른 4만7300원에 거래되고 있다. 이지용 신한금융투자 연구원은 ""1·4분기 영업이익은 전년 동기 대비 73% 감소한 13억원으로 부진하겠지만 2·4분기는 32.2% 늘어난 69억원 사상 최대 분기 실적을 달성할 것""이라며 ""다음달 8일 완료되는 잉글우드랩 인수(지분 37%)으로 오는 하반기부터 연결 실적에 반영될 것""이라고 예상했다. 이 연구원은 ""잉글우드랩 인수로 미국 식품의약국(FDA) 워닝 레터(Warning letter) 문제도 해결 가능하다""며 ""FDA 승인을 이미 획득한 잉글우드랩 미국공장을 통해 자외선 차단 일반의약품(OTC) 제품을 생산할 수 있기 때문""이라고 덧붙였다."
전자신문,241710,/news/news_read.nhn?article_id=0002685356&office_id=030&mode=search&query=코스메카코리아&page=1,2018-02-20 10:10,"[ET투자뉴스]코스메카코리아, &quot;아쉬운 실적&hellip;긴호흡&hellip;&quot; 매수(유지)-한화투자증권","한화투자증권에서 20일 코스메카코리아(241710)에 대해 ""아쉬운 실적…긴호흡으로 바라볼 때""라며 투자의견을 '매수(유지)'로 제시하였고, 아울러 목표주가로는 72,000원을 내놓았다. 한화투자증권 이승욱 애널리스트가 동종목에 대하여 이번에 제시한 '매수(유지)'의견은 작년 연말의 시장컨센서스에 비추어 볼때도 역시 '매수'의견에서 '매수(유지)로' 상향조정된 것이다. 그리고 최근 분기내 발표된 전체 증권사 리포트의 컨센서스와 비교를 해볼 경우에 오늘 발표된 투자의견은 대체적으로 평균치에 해당하는 수준으로, 이번 의견은 동종목에 대한 전체적인 흐름에서 크게 벗어나지 않은 것으로 분석되고 있다. 목표주가의 추이를 살펴보면 한동안 같은 수준을 유지하다가 이번에 목표가가 하향조정되는 모습이다. 또한 전일 종가 기준으로 볼때 동종목의 현주가는 이번에 제시된 목표가 대비 24.4%의 추가상승여력이 있다는 해석이 제시되고 있다."
한국경제,241710,/news/news_read.nhn?article_id=0003811322&office_id=015&mode=search&query=코스메카코리아&page=1,2017-08-18 08:16,"&quot;코스메카코리아, 화장품 업체들 대비 양호한 실적&quot;-이베스트","이베스트투자증권은 18일 코스메카코리아에 대해 국내 화장품 업체들 대비 양호한 실적으로 올렸다며 투자의견 '매수'와 목표주가 9만4000원을 유지했다. 코스메카코리아의 올 2분기 연결기준 영업이익은 전년동기 대비 31.8% 증가한 52억원을 기록했다. 매출은 499억원으로 14.6% 늘었고 순이익은 23.6% 증가한 49억원으로 집계됐다. 오린아 이베스트투자증권 연구원은 ""내수 매출과 수출은 각각 전년 대비 7.5%와 35.6% 증가했고, 중국법인 매출은 41.8% 늘어났다""며 ""국내 화장품 업체 중 상대적으로 양호한 실적을 기록했다""고 말했다. 오 연구원은 ""중국법인은 톤업크림 등 히트 상품 위주의 매출 성장을 지속하고 있다""며 ""중국 매출의 고객사별 비중은 중국 현지 브랜드 78%, 한국업체 22% 수준으로 중국 현지 화장품 시장 성장에 따른 수혜 받는 중""이라고 판단했다. 중국법인의 경우 계속 성장할 것이란 전망이다. 오 연구원은 ""중국 현지 고객사들이 꾸준히 찾아와 다양한 요청을 하고 있다""며 ""현지 공장 증설을 통해 지속적인 매출 상승이 가능하다""고 예상했다. 국내의 경우 고객사 다변화 전략을 펼쳐 매출을 보전하고 있다는 판단이 나온다. 오 연구원은 ""중국의 사드(고고도미사일 방어체계) 보복 영향으로 로드샵 매출이 줄자 이를 홈쇼핑 등 다른 채널을 통해 보전하려 하고 있다""며 ""로드샵 매출 비중이 지난해 말 33%에서 올 상반기 30%로 감소했다""고 설명했다."
한국경제,241710,/news/news_read.nhn?article_id=0003776326&office_id=015&mode=search&query=코스메카코리아&page=1,2017-06-01 07:26,"&quot;코스메카코리아, 연평균 27% 영업이익 성장 예상&quot;-하나","하나금융투자는 1일 코스메카코리아에 대해 높은 실적 가시성과 성장 여력을 보유하고 있다며 투자의견 '매수'와 목표주가 9만1000원을 제시했다. 박종대 연구원은 ""제조자개발생산(ODM) 메이저 3사는 치열한 경쟁으로 높은 진입장벽을 형성하면서 고성장을 지속하고 있다""며 ""또 중국 화장품 시장의 수요와 공급의 품질 격차 확대 국내 ODM 업체들에게 블루오션으로 작용하고 있고, 최근 H&B스토어 시장 확대는 신규 성장동력으로 작용할 것""이라고 전망했다. 코스메카코리아는 국내 ODM 시장 점유율 약 9%의 3위 업체다. 때문에 ODM 시장의 구조적 성장 국면에서 수혜를 볼 것이란 판단이다. 박 연구원은 ""올해 연결기준 매출과 영업이익은 각각 2130억원과 177억원으로 전년 대비 29%와 35% 증가할 것""이라며 ""내수는 클리오와 닥터자르트 등의 수요 확대, 중국은 증설 효과로 성장을 지속할 것""이라고 예상했다. 이어 ""중국 사업 본격화로 지난해부터 2019년까지 연평균 매출과 영업이익이 각각 26%와 27% 성장할 것""이라며 ""하반기 높은 실적 동력에 대비한 비중확대가 유효하다""고 했다."
연합뉴스,241710,/news/news_read.nhn?article_id=0009799519&office_id=001&mode=search&query=코스메카코리아&page=1,2018-01-09 10:35,"코스메카코리아, '아토피 효능' 산딸기 잎 추출물 특허","(서울=연합뉴스) 김은경 기자 = 화장품 연구개발·제조생산 기업 코스메카코리아는 산딸기 잎 추출물과 관련한 특허를 취득했다고 9일 밝혔다. 특허 명칭은 '산딸기 잎 추출물을 함유한 항아토피 효능을 갖는 피부 개선용 화장료 조성물'이다. 산딸기 잎은 초고압 에탄올 추출 공정을 거치면 폴리페놀, 플라보노이드, 트리테르페노이드 성분을 용출시킨다. 이 공정을 거쳐 제조된 화장료 조성물은 항산화·항염증 활성을 통한 항아토피 효능을 갖게 된다고 회사는 설명했다. 코스메카코리아는 지난해 10월 세계화장품학회에서 '산딸기 잎 추출물의 생리활성 연구와 이를 이용한 아토피 피부용 화장료 개발' 기술을 발표, 다량의 폴리페놀을 함유한 산딸기 잎 추출물이 항산화, 진정 등의 효능으로 피부 장벽을 강화해 아토피성 피부에 도움을 주는 것을 인체 적용 시험으로 입증한 바 있다. 조현대 HIT연구소장은 ""이번 특허는 스킨케어는 물론 메이크업 제품에도 적용이 가능한 만큼 아토피 피부 환자들에게 도움이 되는 다양한 화장품을 개발할 수 있을 것""이라고 기대했다. 코스메카코리아 연구소[코스메카코리아 제공]"
머니투데이,241710,/news/news_read.nhn?article_id=0003732573&office_id=008&mode=search&query=코스메카코리아&page=1,2016-08-26 11:30,"코스메카코리아 등 4개사, 코스닥 상장예비심사 통과","[머니투데이 김주현 기자] 한국거래소 코스닥시장본부는 코스메카코리아 등 4개사가 상장예비심사를 통과했다고 26일 밝혔다. 신규상장 예비심사 승인 기업은 코스메카코리아와 서플러스글로벌, 오가닉티코스메틱스홀딩스 등 3곳이다. 스팩(SPAC)합병 상장기업은 디알텍(한화에이스기업인수목적1호)이다. 1999년 설립된 화장품 제조업체 코스메카코리아는 지난해 매출액 991억4900만원을 기록했다. 순이익은 50억2700만원이다. 서플러스글로벌은 2000년 설립된 기타 산업용 기계·장비 도매업체다. 지난해 매출액과 순이익은 각각 941억1400만원, 89억7500만원이다. 오가닉티코스메틱스홀딩스는 화장품 제조업체를 자회사로 둔 홍콩 소재 비금융 지주회사다. 지난해 매출액은 1361억8800만원, 순이익은 346억6100만원이다. 디알텍은 2000년 설립된 의료용 기기 제조업체다. 지난해 매출액은 301억9700만원, 순이익은 26억3500만원을 기록했다. textlinktopstart textlinktopend textlinkstart"
