source,symbol,link,date,title,content
매일경제,241710,/news/news_read.nhn?article_id=0003942071&office_id=009&mode=search&query=코스메카코리아&page=1,2017-05-17 08:25,"[Hot-Line] &quot;코스메카코리아, 1분기 실적 추정치 웃돌아&quot;&hellip;목표가&uarr;","[자료 제공 = KB증권] KB증권은 17일 코스메카코리아에 대해 지난 1분기 실적이 추정치를 크게 웃돌았다며 목표주가를 기존 7만8000원에서 8만2000원으로 상향 조정했다. 투자의견은 '매수'를 유지했다. 박신애 KB증권 연구원은 ""코스메카코리아의 1분기 매출액과 영업이익은 각각 전년 동기 대비 48%, 41% 증가한 506억원, 48억원을 기록했다""면서 ""KB증권 추정치 대비 매출액과 영업이익이 각각 15%, 21% 웃돌았다""고 설명했다. 국내 매출액을 살펴보면 내수 부문은 고객 다변화 및 온라인·홈쇼핑 고객사 매출 호조로 전년 동기 대비 25% 증가했다. 수출 부문은 미주·유럽 기존 고객사들의 주문 확대 및 신규 고객 확보로 전년 동기 대비 45% 증가했다. 아울러 중국 법인은 톤업크림 등 히트제품의 주문 증가 및 신규 고객 유입으로 영업이익 16억원을 기록, 영업이익률 18%를 나타냈다. 박 연구원은 ""2분기 매출액과 영업이익은 전년 동기 대비 각각 56%, 61% 성장한 677억원, 64억원으로 예상된다""면서 ""사드 보복에 따른 전방시장 업황 악화로 내수 부문 성장률에 대한 우려가 있으나 탈모샴푸와 달팽이크림, 톤업크림과 같은 히트제품들이 꾸준한 성장을 보이는 가운데 지난 4월 광저우 신공장의 가동도 시작돼 높은 매출 성장률을 유지할 수 있을 전망""이라고 내다봤다. [디지털뉴스국 김경택 기자] r_start // r_end //"
아시아경제,241710,/news/news_read.nhn?article_id=0004120038&office_id=277&mode=search&query=코스메카코리아&page=1,2017-11-16 10:38,"[공시+]코스메카코리아, 3Q 영업익 5억&hellip;&quot;중국법인 매출 성장은 긍정적&quot;","[아시아경제 권성회 기자] 코스메카코리아가 올해 3분기 실적을 발표했다. 수익성은 둔화됐지만 중국법인 매출 성장세는 확인됐다. 코스메카코리아는 연결기준 3분기 매출 373억원, 영업이익 4억8000만원, 당기순이익 6억5000만원을 달성했다고 16일 공시했다. 전년 동기와 비교해 매출액은 12.9%, 영업이익과 당기순이익은 각각 77.5%, 65.8% 감소했다. 국내법인 상황을 살펴보면 중국발 사드 위기에 따른 관광객 유입 감소로 1, 2분기에 걸쳐 국내 고객사들의 매출이 대폭 하락했는데, 이 점이 내수시장 주문량 감소로 이어지며 ODM사인 코스메카코리아의 3분기 매출에 직접적인 영향을 끼친 것으로 분석된다. 여기에 화장품 업계의 비수기(7~8월)까지 겹치며 로드샵 고객사들의 발주가 감소해 내수매출에 탄력을 받지 못한 것으로 나타났다. 한편 해외시장 수출은 3분기 매출 중에서 2분기때 선반영된 부분이 있어 전 분기 대비로는 42.9% 감소했다. 중국법인은 지속적으로 성장하며 매출이 전년 동기대비 73.5%, 지난 2분기 대비 8.5% 올라 코스메카코리아의 3분기 연결 매출에서 24.5%를 차지했다. 중국 브랜드 전문매장, 온라인 채널 등 현지 주요 고객사에 대한 꾸준한 매출 증가 및 로컬 고객사수 증가가 성장의 주요인이 됐다. 코스메카코리아는 최근 중국으로부터의 사드 보복 조치가 해빙되는 상황을 주시하고 있다. 지난 1년여에 걸쳐 지속됐던 금한령이 이번에 해제되면서 국내 로드샵 및 면세점 등으로부터 긍정적인 신호가 오고 있어, 내수시장 매출이 4분기부터 차츰 반등하며 내년 상반기에는 원 궤도에 올라 고성장을 이어갈 것으로 내다보고 있다. 현재 충북 음성 본사 옆에 신규 공장을 증설하며 생산능력 확대에 집중하고 있는 코스메카코리아는, 최신형의 스마트 공장이자 CPS(Cosmecca Production System)가 도입된 생산시설 설비에 심혈을 기울이고 있다. 내년 신 공장이 완공되면 총생산능력은 2016년 대비 3배 증가한 3억1000만개가 돼, 국내외 고객사들의 주문에 차질 없이 대응할 수 있게 된다. 중국에는 세 번째 중국법인 코스메카차이나가 평호 지역에 공장 건설을 진행 중이다. 지난 5월 토지허가증 취득 후 공장 설계를 완료했고, 이달 7일에는 조임래 회장이 직접 중국 현지 시공업체와 공사 전반에 대한 계약을 체결했다. 2018년 하반기 완공 계획이며, 완공되면 코스메카쑤저우와 코스메카포산의 공장을 합쳐 중국의 총생산능력은 2017년 대비 2배 늘어나 2억4000만개가 된다. 코스메카코리아 관계자는 “지난해 코스닥 상장 이후 공모자금을 활용해 신중하게 추진해온 국내 및 중국 공장 건설이 계획대로 순항 중”이라며 “업계 최대 위기였던 사드 이슈가 소멸되고 있기 때문에, 앞으로 늘어날 고객사별 주문량에 최대한 대응할 수 있도록 철저히 준비하고 있다”고 밝혔다."
MBN,241710,/news/news_read.nhn?article_id=0001234905&office_id=057&mode=search&query=코스메카코리아&page=1,2018-03-21 23:06,"코스메카코리아, 모델링 마스크팩 관련 특허 취득","화장품 연구개발과 제조생산 기업 코스메카코리아가 모델링 마스크팩 관련 특허를 취득했습니다. 이번에 취득한 특허 명칭은 '젤 형태의 모델링 마스크팩 화장료 조성물'이며 크림 형태의 제1제와 액상 형태의 제2제가 혼합된 젤 형태의 마스크팩을 만드는 기술에 대한 것입니다. 기존 모델링 마스크팩은 분말 제형과 액상 제형을 적정비율로 혼합해 사용합니다. 코스메카코리아는 이번 특허취득을 통해 기존 모델링 마스크팩에서 발생할 수 있는 단점을 보완하고, 소비자들이 간편하게 사용할 수 있도록 제형을 개선했다고 설명했습니다."
파이낸셜뉴스,241710,/news/news_read.nhn?article_id=0003763683&office_id=014&mode=search&query=코스메카코리아&page=1,2017-01-17 10:36,[fnRASSI]코스메카코리아(241710) 현재 +5.28%,"현재 코스메카코리아(241710)는 전일대비 5.28% 상승하여 55,800원 선에서 거래가 이루어지고 있다.  상장주식수 대비 거래량은 0.34%로 적정수준최근 한달간 코스메카코리의 상장주식수 대비 거래량을 비교해보니 일별 매매회전율이 0.34%로 집계됐다. 그리고 동기간 장중 저점과 고점의 차이인 일평균 주가변동률을 4.75%를 나타내고 있다.  기관투자자의 거래참여 높아, 거래비중 25.11%최근 한달간 주체별 거래비중을 살펴보면 개인이 전체 거래의 67.51%를 차지하며 가장 적극적인 모습을 보여줬고, 기관은 25.11%를 나타냈으며 외국인은 7.37%를 나타냈다. 그리고 최근 5일간 거래비중은 개인이 전체 거래량의 65.03%를 차지하며 가장 활발한 참여를 보였고, 기관은 29.18%, 외국인은 5.78%의 거래 참여율을 보였다.  
 'fnRASSI'는 증권전문 기업 씽크풀과 파이낸셜뉴스의 협업으로 로봇기자가 실시간으로 생산하는 기사입니다."
헤럴드경제,241710,/news/news_read.nhn?article_id=0001218643&office_id=016&mode=search&query=코스메카코리아&page=1,2017-04-03 09:37,"[생생코스닥] 코스메카코리아, 광저우 포산공장 화장품생산허가 취득","- CFDA 화장품 생산허가 취득- 광저우 지역 판매 업체들의 높은 수요 대응 가능  [헤럴드경제=김지헌 기자] 코스닥 상장사 코스메카코리아의 두 번째 중국법인 ‘코스메카화장품 포산(불산)유한공사’가 지난달 29일 중국국가식품의약품감독관리총국(CFDA) 화장품생산허가 취득을 완료, 4월부터 본격 가동에 들어간다. 중국은 지난해 화장품 업체의 생산허가 기준을 강화해 기존 화장품 생산업체에 발급했던 ‘전국공업제품생산허가증’과 ‘위생허가증’을 ‘화장품생산허가증’으로 통합한 바 있다.  [사진=게티이미지] 이에 따라 중국에서는 화장품생산허가증 없이는 화장품 생산이 불가능하며, 화장품생산허가증은 취득일로부터 5년간 유효하다. 허가증 관련업무는 CFDA가 총괄한다. 코스메카코리아는 지난 2014년 첫 중국법인 쑤저우(소주)유한공사를 설립, 4년만에 흑자전환에 성공했고, 지난해에는 210%의 성장을 이어갔다. 현재 쑤저우공장은 생산능력 대비 제품 주문량이 크게 초과하고 있는 상황이며 이러한 수요에 대응하기 위해 지난해 광저우 인근에 두 번째 중국법인 포산유한공사를 설립, 신공장을 준비해왔다. 포산공장이 화장품생산허가를 취득하게 되면서 광저우 지역 판매 업체들의 높은 수요에 발 빠른 대응이 가능해졌다. 코스메카코리아의 중국 현지 생산능력은 쑤저우공장과 포산공장을 합쳐 연간 1억2000만개이다. 조임래 코스메카코리아 대표이사는 “현재 중국과의 어려운 이슈 속에서도 포산공장이 화장품생산허가를 취득하게 돼 고무적으로 생각한다”며 “포산공장이 단기적으로는 현지 고객사들의 수요를 충분히 소화할 수 있는 생산량이 되겠지만, 중장기적으로 중국 수요에 대응하기 위해 상하이 인근 저장성(절강성)에도 금년안으로 신 공장 건설을 시작해 내년 하반기부터 가동할 계획”이라고 밝혔다."
뉴시스,241710,/news/news_read.nhn?article_id=0008559941&office_id=003&mode=search&query=코스메카코리아&page=1,2018-04-24 11:20,"코스메카코리아, 잉글우드랩 지분 35% 양수...美 화장품 시장 진출","【서울=뉴시스】이진영 기자 = 코스메카코리아(241710)는 미국 화장품 제조자개발생산(ODM) 업체인 잉글우드랩(950140) 주식 689만6831주(지분율 34.71%)를 578억원에 양수하기로 결정했다고 24일 공시했다. 이는 자기자본의 50.90% 수준이다. 회사 측은 ""이번 양수 목적은 미국 화장품 ODM 시장에 진출하기 위함이다""라고 밝혔다."
한국경제TV,241710,/news/news_read.nhn?article_id=0000631864&office_id=215&mode=search&query=코스메카코리아&page=1,2018-05-09 11:22,"코스메카코리아, 전일 대비 약 6% 상승한 45,000원","[한국경제TV 라이온봇 기자] 코스메카코리아는 5월 9일 11시 22분 전일 대비 약 6% 상승한 45,000원에 거래되고 있다. 코스메카코리아는 코스닥 상장 기업으로 화학 업종에 속해 있다. 시가총액은 2,264억원으로 코스닥 상장기업 중 274위에 위치 해 있다. [종목 성향 진단] [그림 1] 종목 성향 진단 코스메카코리아의 투자 스타일은 모호한 측면이 있으나 성장주라고 볼 수 있다. 주가 고평가 우려가 공존하지만 높은 성장성이 기대되는 기업이다. 주가 모멘텀은 굉장히 좋은 편이었다. 최근 1개월 수익률이 무려 35.03%의 상승폭을 기록했다. 코스메카코리아 종목에 대한 투자자의 관심도는 높은 편에 속한다. [투자 점수 진단] [그림 2] 투자 점수 진단 코스메카코리아는 안정성(부채비율) 측면에서 두각을 나타내고 있다. 최근 부채비율은 75점으로 6개의 핵심 팩터 중 가장 높은 점수를 기록했다. 부채비율은  전체 시장 내 517위를 기록하며 상위 25.37%에 위치했다. 업종별로는 107위를 기록하며 상위 23.54%에 위치했다. 그리고 효율성(ROA) 역시 도드라지는 편이다. 효율성 점수는 63점으로 두번째로 높은 점수를 기록했다. ROA는 전체 시장 내 727위를 기록하며 상위 37.27%에 위치했다. 업종별로는 140위를 기록하며 상위 36.1%에 위치했다. 그러나 PBR이 아쉬움을 나타냈다. [종합 투자점수] [그림 3] 종합 투자점수 AI 인공지능 분석을 통한 코스메카코리아의 종목 종합 스코어는 69점을 기록했다. 이는 동일 업종 평균점수인 58점과 시장 평균점수인 60점를 상회하는 수치였다. (위의 AI인공지능 점수는 재무 데이터를 기반으로 전체 상장 종목과 비교/분석하여 도출한 점수로 높은 점수가 반드시 높은 수익률을 보장하지 않습니다. 위의 자료는 당사의 추천 종목이 아니며, 투자 시 참고용으로 제시해드리는 것입니다.) 라이온봇 기자 -한국경제TV※ 본 기사는 한국경제TV와 '거장들의 투자공식이'자체 개발한 '라이온봇 기자'가 실시간으로 작성한 기사입니다. 라이온봇기자 ⓒ 한국경제TV, 무단 전재 및 재배포 금지 한국경제TV 관련뉴스해당 언론사에서 선정하며 언론사 페이지(아웃링크)로 이동해 볼 수 있습니다.노사연♥이무송, 훈남 아들 공개 ""DNA 혁명""김생민 근황은?…박명수 예언 발언 ""소름 돋네""차인표, 신애라 반하게 한 '리즈시절' 미모 봤더니이은하, '쿠싱증후군' 극복 근황…""확 달라졌다""왕빛나 서구적 몸매 비결…'20kg을 한 번에?'"
전자신문,241710,/news/news_read.nhn?article_id=0002607163&office_id=030&mode=search&query=코스메카코리아&page=1,2017-05-10 09:32,"[ET투자뉴스]코스메카코리아, &quot;성장 잠재력이 가장&hellip;&quot; 매수(신규편입)-SK증권","SK증권에서 10일 코스메카코리아(241710)에 대해 ""성장 잠재력이 가장 큰 ODM 회사""라며 투자의견을 '매수(신규편입)'로 제시하였고, 아울러 목표주가로는 84,000원을 내놓았다. SK증권 서영화 애널리스트가 동종목에 대하여 이번에 제시한 '매수(신규편입)'의견은 SK증권에서는 올해들어 처음 내놓는 매매의견이며 그리고 최근 분기내 발표된 전체 증권사 리포트의 컨센서스와 비교를 해볼 경우에 오늘 발표된 투자의견은 전체의견에 수렴하고 있어, 이번 의견은 시장의 평균적인 기대감이 객관적으로 표현된 것으로 분석되고 있다. 또한 전일 종가 기준으로 볼때 동종목의 현주가는 이번에 제시된 목표가 대비 21.2%의 저평가 요인이 존재한다는 해석이 제시되고 있다."
한국경제,241710,/news/news_read.nhn?article_id=0003895854&office_id=015&mode=search&query=코스메카코리아&page=1,2018-02-20 07:29,"&quot;코스메카코리아, 中 여행객 부진에 실적 악화&hellip;목표가&darr;&quot;-한화","한화투자증권은 20일 코스메카코리아가 지난해 4분기 부진한 실적을 기록했다며 매출이 빠르게 회복되기 어려울 것이라고 전망했다. 이에 따라 목표주가를 기존 9만5000원에서 7만2000원으로 하향 조정했다. 투자의견 매수는 유지했다. 이 증권사 이승욱 연구원은 ""4분기 매출은 전년 동기 대비 0.2% 느러난 447억원, 영업이익은 89% 감소한 4억원""이라며 ""당초 기대치를 밑돌았다""고 평가했다. 그는 ""내수 부문에서는 중국인 관광객 감소에 따른 로드샵 부진에도 불구하고 홈쇼핑과 온라인에서 선전, 매출이 전년 대비 4.4% 늘어난 314억원을 기록했다""며 ""다만 원가율이 높은 온라인 제품의 비중이 확대되며 수익성이 크게 훼손됐다""고 말했다. 이어 ""중국 법인 매출액은 11.1% 늘어나 기존 고객사와 신규 고객사 물량이 모두 증가한 것으로 보인다""고 덧붙였다. 그는 코스메카코리아가 증설이 완료되는 올해 하반기부터 실적 반등을 이뤄낼 것이라고 전망했다. 그 전까지는 단기 모멘텀 부재에 주가도 횡보할 것이라는 설명이다. 이 연구원은 ""중국인 여행객 유입이 여전히 부진한 흐름을 나타내고 있다""며 ""로드샵 관련 매출의 빠른 회복을 기대하기는 어려울 것""이라고 예상했다. 다만 ""온라인, 홈쇼핑, H&B 스토어향 물량이 증가하고 있고 미국과 러시아 등 해외 신규고객사 확대도 지속될 것""이라며 ""늘어나는 고객사만큼 증설 역시 적시에 이뤄져, 증설이 완료되는 2018년 하반기 이후 높은 성장이 기대된다""고 조언했다."
뉴스1,241710,/news/news_read.nhn?article_id=0003223364&office_id=421&mode=search&query=코스메카코리아&page=1,2018-02-23 08:00,"中 사드 보복에 화장품 업계 고전&hellip;코스메카코리아, 작년 4분기 '어닝쇼크'","© News1 최진모 디자이너 영업익 89% 급감, 코스닥 주가 3거래일만 15.4% 빠져국내외 추가 공장 가동 실적 개선 이끌지 관심 (서울=뉴스1) 김민석 기자 = 국내 화장품 ODM·OEM 업계 3위인 코스메카코리아가 지난해 4분기 기대치를 크게 밑도는 실적을 기록했다. 중국의 사드(THAAD·고고도미사일방어체계) 경제보복 영향으로 풀이되는 가운데 코스메카코리아의 주가는 설 연휴 직전 실적 발표 이후 3거래일 만에 주가가 15.4% 하락했다. 하나금융투자는 코스메카코리아가 시장기대치를 크게 밑돈 '어닝쇼크'를 기록했다며 투자의견을 매수에서 중립으로, 목표주가를 하향조정했다. 주가 급락에 일부 주주들은 포털사이트 토론게시판 등에서 성토의 글을 올리고 있다. 그동안 회사는 IR설명회와 보도자료 등을 통해 청사진만을 강조해왔다. 시장의 우려에도 불구하고 코스메카코리아는 올해 매출과 영업이익을 각각 30% 74.3% 증가할 것이란 전망 공시를 내 실현여부에 관심이 쏠린다. ◇하나금융투자 ""시장점유율 3위 불구 단기적 실적 성장 제한적"" 23일 금융감독원 전자공시시스템에 따르면 코스메카코리아는 지난해 4분기 영업이익과 당기순이익이 각각 3억9400만원과 8억9100만원을 기록했다. 이는 전년 동기대비 89.0% 65.9% 감소한 수치다. 같은 기간 매출은 0.2% 늘어난 447억7000만원으로 집계됐다. 코스메카코리아의 지난해 3분기 영업이익과 당기순이익도 4억8100만원, 5억5400만원을 기록해 전년대비 77.5% 65.8% 감소한 바 있다. 당시엔 매출도 12.9% 감소했다. 지난해 전체로는 영업이익 당기순이익이 각각 109억원, 99억원으로 전년 대비 16.7% 13.6% 감소했다. 매출은 1825억원으로 10.5% 증가했다. 중국이 지난해 3월15일부터 한국행 단체관광 상품판매를 금지하고 나서면서 코스메카코리아가 실적에 큰 타격을 받은 것으로 풀이된다. 복수의 증권사들은 코스메카코리아에 대해 지난해 4분기 당사 추정치 및 시장 컨센서스에 못미치는 실적을 기록했다며 목표주가를 크게 낮췄다. 증권사들은 중국인 관광객 감소하면서 원브랜드숍 고객사들의 주문량이 감소했고 수익성 높은 수출 매출이 감소해 코스메카코리아가 부진한 실적을 기록했다고 분석했다. 먼저 하나금융투자는 시장기대치를 크게 밑도는 '어닝쇼크'라며 투자의견을 매수에서 중립으로, 목표주가도 7만5000원에서 6만4000원으로 하향 조정했다. 중장기 성장 여력이 있지만 단기적(올해) 실적 성장세는 제한적이라고 내다봤다. 하나투자증권은 코스메카코리아의 수익성이 저하된 이유로 공장 증설에 따른 고정비 부담 증가와 턴키(일괄 수주)방식 매출 비중의 상승 등을 꼽았다. 또 올해 상반기에는 공장 증설에 따른 매출 증가를 고려하더라도 수익 증대는 기대하기 어려울 것이라고 내다봤다. 박종대 연구원은 ""사드보복 조치와 수출 감소로 영업이익률이 1% 내외로 급격히 하락했다""며 ""국내부문 매출은 전년대비 4% 증가했음에도 수출이 전년대비 13% 감소해 받아 전체매출이 전년대비 0.5% 성장에 그쳤다""고 말했다. 한화투자증권도 회사가 매출을 빠르게 회복하기는 어려울 것이라고 전망했다. 이승욱 연구원은 ""4분기 내수시장에서 홈쇼핑·온라인 매출이 4.4% 증가했지만 원가율이 높은 온라인 제품의 비중이 확대돼 수익성이 크게 훼손됐다""고 분석했다. 신한금융투자와 메리츠투자증권 등도 코스메카코리아가 당사 추정치 및 시장 컨센서스보다 크게 부진한 실적을 기록했다고 설명했다. 코스메카코리아의 주가는 부진한 4분기 실적을 발표한 지난 14일 5만7800원으로 장을 마감해 전날대비(6만4500원) 하루 만에 10.39%(6700원) 떨어졌다. 19일엔 0.17% 반등했지만 20일 재차 5.18%(3000원) 떨어져 5만4900원으로 장을 마감했다. 이 회사 주가는 최근 7거래일 동안 20% 가까이 떨어졌다. 일부 주주들은 토론게시판에 ""명절 전날 실적 발표해서 어렵게 버티고 있는 개인 주주들 좌절케 하느냐"" ""연휴 앞두고 꼭 실적 발표를 해야 했나"" 등의 글을 올리며 반발했다. 몇몇은 코스메카코리아가 보통주 주당 200원(배당금 총액 10억6800만원)에 결산 배당한 것에 대해 볼멘소리를 내기도 했다. © News1 ◇코스메카코리아 ""올해 매출 30%, 영업이익 74.3% 성장할 것"" 코스메카코리아는 올해 우리나라와 중국서 각각 건설 중인 공장가동에 힘입어 매출 2400억원 영업이익 190억원을 기록하겠다는 전망 공시를 냈다. 이는 각각 30% 74.3% 증가한 수치다. 그러면서 실적 설명 자료를 통해 불투명한 글로벌 경제상황 속에서도 꾸준한 매출을 유지하고 있다고 했다. 지난해 4분기 내수 매출이 448억원으로 전분기 대비 19.9%, 중국 매출은 361억원으로 전년 동기대비 61.6% 증가하는 등 빠르게 주문량을 회복하고 있다고 설명했다. 코스메카코리아는 우리나라와 중국에 각각 공장을 증설 및 건설하고 있다. 국내에는 충북 음성 본사 뷰티1사업장에 대한 증축공사가 오는 6월 완공된다. 코스메카코리아는 국내법인 총생산능력이 3억1000만개로 증가해 2016년 대비 약 3배 증가할 것으로 예상했다. 중국 현지에서는 3번째 중국법인 코스메카차이나가 올해 11월 완공을 목표로 핑후 지역에 공장을 건설하고 있다. 완공 시 코스메카쑤저우·코스메카포산의 공장에 더해 현지법인의 총생산능력은 지난해 대비 2배 늘어난 2억4000만개다. 코스메카코리아 관계자는 ""중국 브랜드 전문매장과 온라인 채널 등 현지 주요 고객사의 매출이 늘고 있고 국내 고객사 수도 계속 증가해 유의미한 성장을 지속하고 있다""고 설명했다. 업계 한 관계자는 ""그동안 시장의 성장을 이끌어 온 중국관광객이 줄고 보따리상들이 특정 브랜드를 대량 구매하면서 여타 브랜드 간 경쟁은 더 치열해지고 있다""며 ""화장품 제조 공장이 늘어 마진이 높은 수출 물량이 줄면서 영향을 많이 받은 것으로 보인다""고 설명했다. 다른 관계자는 ""지난해 중국의 사드보복 영향으로 화장품 ODM·OEM사들 매출 실적 모두 좋지 못했다""면서도 ""이런 시장 상황에서도 국내·외서 공격적인 투자를 벌이는 코스메카코리아가 기대한만큼 실적을 거둘지는 예측이 쉽지 않다""고 말했다."
전자신문,241710,/news/news_read.nhn?article_id=0002545919&office_id=030&mode=search&query=코스메카코리아&page=1,2016-11-04 14:30,"[로봇뉴스][코스메카코리아 지분 변동] 권민정5.24%p 증가, 5.24% 보유","코스메카코리아(241710)는 04일 주주 권민정의 보유주식이 증가되었다고 발표했다. 이는 직전 보고일보다 280,000주 증가하여 지분율은 5.24%로 상승했다. 이번 보고 사유는 코스닥시장상장에따른신규보고로  알려졌다."
