source,symbol,link,date,title,content
전자신문,241710,/news/news_read.nhn?article_id=0002658978&office_id=030&mode=search&query=코스메카코리아&page=1,2017-11-17 10:40,"[ET투자뉴스]코스메카코리아, &quot;올해까지는 주춤&hellip;&quot; 매수(유지)-케이프투자증권","케이프투자증권에서 17일 코스메카코리아(241710)에 대해 ""올해까지는 주춤""라며 투자의견을 '매수(유지)'로 제시하였고, 아울러 목표주가로는 77,000원을 내놓았다. 케이프투자증권 강수민 애널리스트가 동종목에 대하여 이번에 제시한 '매수(유지)'의견은 케이프투자증권의 직전 매매의견과 동일한 것이고 반면에 연초반의 시장컨센서스에 견주어 본다면 '매수'의견에서 '매수(유지)로' 레벨다운된 것이다. 그리고 최근 분기내 발표된 전체 증권사 리포트의 컨센서스와 비교를 해볼 경우에 오늘 발표된 투자의견은 전체의견에 수렴하고 있어, 이번 의견은 시장의 평균적인 기대감이 객관적으로 표현된 것으로 분석되고 있다. 또한 전일 종가 기준으로 볼때 동종목의 현주가는 이번에 제시된 목표가 대비 23%의 저평가 요인이 존재한다는 해석이 제시되고 있다."
아시아경제,241710,/news/news_read.nhn?article_id=0004216537&office_id=277&mode=search&query=코스메카코리아&page=1,2018-04-11 13:57,"코스메카코리아, 주당 1.0주 무상증자 결정","[아시아경제 권성회 기자] 코스메카코리아는 보통주 1주당 1.0주의 무상증자를 결정했다고 11일 공시했다. 1주당 액면가액은 500원으로 이에 따라 534만주가 발행된다. 신주권 교부예정일은 5월17일, 신주 상장예정일은 5월18일이다. 이에 한국거래소 코스닥시장본부는 코스메카코리아에 대해 이날 오후 1시52분부터 30분 동안 주권매매 거래를 정지시켰다."
매일경제,241710,/news/news_read.nhn?article_id=0004140441&office_id=009&mode=search&query=코스메카코리아&page=1,2018-04-26 09:28,잉글우드랩 &quot;코스메카코리아 양수로 전략 경영 발판 마련&quot;,"화장품 제조자개발생산(ODM) 기업 잉글우드랩은 코스메카코리아와 시너지를 통해 올해 퀀텀점프를 할 것이라고 26일 밝혔다. 잉글우드랩은 지난 24일 코스닥 화장품 개발 기업 코스메카코리아와 양수도 계약을 체결한 바 있다. 코스메카코리아는 577억원에 잉글우드랩 지분 34.7%를 인수, 6월 8일부터 경영권을 행사하게 된다. 회사 관계자는 ""코스메카코리아의 미국 진출 교두보 역할뿐 아니라 양사의 기술 경쟁력을 극대화해 올해부터 고객 저변을 넓혀나갈 수 있게 됐다""고 말했다. 잉글우드랩은 미국 시장 내 사업기반 및 네트워크와 코스메카코리아의 제품 개발 및 운영 노하우가 결합돼 양사 모두 큰 폭으로 성장할 것으로 기대하고 있다. 이 관계자는 ""기초 스킨케어 제품에서 지난해 4월 한국로컬업체(현 잉글우드랩코리아, 연결자회사)를 인수해 색조화장품 시장에도 진출했다""며 ""매출 성장을 위한 선행투자 또한 마무리돼 자체적인 턴어라운드 및 큰 폭의 성장을 예상하고 있다""고 덧붙였다. [디지털뉴스국 김경택 기자] r_start // r_end //"
아시아경제,241710,/news/news_read.nhn?article_id=0003936866&office_id=277&mode=search&query=코스메카코리아&page=1,2017-02-21 07:39,"[클릭 e종목]코스메카코리아, 고성장 전망&hellip;목표가 8만원&uarr;","[아시아경제 박미주 기자]대신증권은 21일 코스메카코리아에 대해 고성장이 예상된다며 목표주가를 기존 6만6000원에서 8만원으로 올렸다. 투자의견은 '매수'를 유지했다. 지난해 연결 기준 코스메카코리아의 매출액과 영업이익은 각각 전년 동기보다 67% 늘어난 1652억원, 97% 증가한 126억원이었다. 직전 추정치 대비 매출액은 8% 상회, 영업이익은 8% 하회했고, 영업이익은 컨센서스 대비 7% 밑돌았다. 박은정 대신증권 연구원은 ""매출액 상회 원인은 전 부문이 고루 좋았으나 특히 해외(수출, 중국)관련 매출이 견조했다""며 ""국내 브랜드샵, 홈쇼핑, 수출향 수주에 있어 관여도가 높아져 원부자재 구매까지 진행하게 됐고 해당부분이 매출인식 되면서 수익성이 일부 낮아져 영업이익이 예상치를 하회했다""고 설명했다. 또 ""상장 이후 약 80여명의 인력이 충원됐고 영업 호조로 성과급을 지급했다""며 ""부자재 구매로 인한 수익성 하락은 향후 규모의 경제를 통해 수익성 개선이 이어질 것이고 인력 충원의 경우 2017년 가이던스, 중장기 성장을 위한 투자로 판단된다""고 덧붙였다. 올해 수익성은 개선될 것으로 봤다. 2017년 연결 기준 매출액은 전년보다 40% 늘어난 2310억원, 영업이익은 49% 증가한 187억원으로 추정했다. 박 연구원은 ""성장의 포인트는 여전히 중국법인과 북미향 수출""이라며 ""대표제품 톤업크림이 중국에서 히트 초입국면이고 매출액 기준 1위의 글로벌 고객사향 매출뿐만 아니라 2016년 하반기에 납품을 시작한 타 글로벌 고객사의 기초제품 규모도 확대될 것""이라고 예상했다. 그는 이어 ""해당 제품군은 고마진 품목으로 수익성 개선을 전망된다""면서 ""주가 대응은 연간 고성장이 예상되고 화장품 기업 내 2017년 이익성장이 독보적이며 특히 국내 제조업자개발생산(ODM) 기업 내 저가 매력이 여전해 점진적 매수를 권고한다""고 전했다."
머니투데이,241710,/news/news_read.nhn?article_id=0003976858&office_id=008&mode=search&query=코스메카코리아&page=1,2017-12-11 11:34,"코스메카코리아, 중국에 세번째 공장 착공","[머니투데이 배영윤 기자] [저장성 핑후지역에 세번째 공장내년 中 생산량 2억4000만개로 확대] 지난 8일 진행된 코스메카차이나 핑후공장&amp;ltbr&gt; 착공식에서 조임래 코스메카코리아 회장이 인사말을 하고 있다./사진제공=코스메카코리아 화장품 ODM(제조자개발생산) 기업 코스메카코리아 가 지난 8일 중국 세 번째 공장인 핑후공장 착공식을 개최했다고 11일 밝혔다. 중국 저장성 자싱시 핑후에서 진행된 이날 행사에는 조임래 코스메카코리아 회장과 박은희 부회장을 비롯해 한국 및 중국법인 임직원, 중국 시당국 관계자, 현지 주요업체 대표 등이 참석했다. 코스메카차이나는 코스메카코리아의 세 번째 중국 법인으로 지난 5월 중국 당국으로부터 절자성 자싱시 핑후 지역 토지허가증을 취득하며 본격적인 공사 준비에 들어갔다. 이후 약 5개월에 걸쳐 공장 설계 및 시공사 선정 등 작업을 진행했다. 지난달에는 현지 건설사인 중국건설기계공업과 공사 전반에 대한 계약을 체결했다. 핑후공장은 연면적 4만833㎡ 규모로 연간 생산능력은 1억2000만개다. 공장 설계 단계부터 코스메카 고유의 생산 노하우인 CPS(Cosmecca Production System)를 적용해 국내 공장과 동일한 시스템과 노하우를 중국 현지에 전수할 수 있게 됐다. 핑후공장은 내년 하반기 완공 예정이며 본격적인 가동을 시작하면 기존 중국에 운영 중인 2개 공장과 함께 중국 총생산능력은 올해 대비 2배 증가한 2억4000만개로 증가할 전망이다. 핑후공장이 위치한 저장성 자싱시는 수향(水鄕) 공업도시로 교통의 요지다. 상하이와 항저우를 잇는 후항철도의 중간 지점에 있으며, 제품이 생산되면 상하이 등지에 있는 현지 고객사로 빠른 물류배송이 가능하다. 조임래 회장은 이날 착공식에서 ""중장기적으로 중국 고객사들의 수요에 대응하기 위해 핑호공장 건설에 박차를 가하고 있다""며 ""코스메카만의 생산 시스템을 적용해 가장 현대적이고 스마트한 공장을 만들기 위해 총력을 기울이겠다""고 밝혔다. 코스메카차이나 핑후공장 조감도/사진제공=코스메카코리아"
연합뉴스,241710,/news/news_read.nhn?article_id=0009270349&office_id=001&mode=search&query=코스메카코리아&page=1,2017-05-17 08:21,대신증권 &quot;코스메카코리아 최대 실적&hellip;적극 매수&quot;,"[연합뉴스자료사진] (서울=연합뉴스) 조민정 기자 = 대신증권은 17일 코스메카코리아가 올해 1분기 분기 최대 실적을 달성했다며 화장품 제품 개발력과 국내 및 중국 생산설비 확충으로 해외에서 고성장했다고 평가했다. 코스메카코리아는 1분기 연결 매출 506억원, 영업이익 48억원을 달성해 작년 동기 대비 48%, 41% 각각 성장했다. 박은정 연구원은 ""내수 부문은 제품 확대에 따라 로드샵 매출이 견조했고 히트제품이 많아져 드럭스토어와 온라인, 홈쇼핑 매출이 성장했다""며 ""로레알그룹 등 글로벌 고객사에 대한 매출이 여전히 견조한 가운데 미주, 유럽으로의 수출 물량이 지속적으로 확대되고 있다""고 분석했다. 박 연구원은 ""중국법인은 비성수기임에도 톤업크림 등 히트제품의 매출이 늘어난 데다 고객사도 증가해 분기 최대 성과를 달성했다""고 평가했다. 중국법인 매출은 작년 1분기보다 259% 늘어났다. [코스메카코리아제공 = 연합뉴스 자료사진] 그는 올해 코스메카코리아가 연결기준 매출 2천310억원, 영업이익 188억원을 달성할 것으로 전망하면서 ""4분기에 완공되는 국내 신공장의 역할이 기대된다""고 말했다. 그러면서 ""현재 주가는 올해 기준 동종 화장품 생산기업 평균 주가수익비율(P/E)인 28배보다 낮은 22배 수준으로, 가격적 매력이 부각돼 적극 매수를 권고한다""고 말했다. 투자의견 '매수'와 목표주가 8만원은 종전대로 유지했다."
연합뉴스,241710,/news/news_read.nhn?article_id=0010042774&office_id=001&mode=search&query=코스메카코리아&page=1,2018-04-24 08:09,"코스메카코리아, 578억원 출자&hellip;&quot;미국 시장 진출&quot;","(서울=연합뉴스) 유현민 기자 = 코스닥 상장사인 코스메카코리아는 미국 화장품 제조자개발생산(ODM) 업체인 잉글우드랩 주식 689만6천여주(지분율 34.71%)를 577억6천여만원에 양수하기로 했다고 24일 공시했다. 이는 자기자본의 50.90%에 해당하는 규모다. 회사 측은 ""미국 화장품 ODM 시장 진출 목적""이라고 설명했다."
전자신문,241710,/news/news_read.nhn?article_id=0002619896&office_id=030&mode=search&query=코스메카코리아&page=1,2017-06-27 09:16,"[ET투자뉴스]코스메카코리아, &quot;대외 악재에도 불구&hellip;&quot; 매수(유지)-SK증권","SK증권에서 27일 코스메카코리아(241710)에 대해 ""대외 악재에도 불구, 모든 채널의 매출 성장세 지속""라며 투자의견을 '매수(유지)'로 제시하였고, 아울러 목표주가로는 84,000원을 내놓았다. SK증권 서영화 애널리스트가 동종목에 대하여 이번에 제시한 '매수(유지)'의견은 SK증권의 직전 매매의견을 그대로 유지하는 것이고 반면에 연초반의 시장컨센서스에 견주어 본다면 '매수'의견에서 '매수(유지)로' 레벨다운된 것이다. 그리고 최근 분기내 발표된 전체 증권사 리포트의 컨센서스와 비교를 해볼 경우에 오늘 발표된 투자의견은 대체적으로 평균치에 해당하는 수준으로, 이번 의견은 동종목에 대한 전체적인 흐름에서 크게 벗어나지 않은 것으로 분석되고 있다. 목표주가의 추이를 살펴보면 최근 두차례 연속해서 같은 수준을 유지하고 있는 모습이다. 또한 전일 종가 기준으로 볼때 동종목의 현주가는 이번에 제시된 목표가 대비 20.3%의 추가상승여력이 있다는 해석이 제시되고 있다."
머니투데이,241710,/news/news_read.nhn?article_id=0003874943&office_id=008&mode=search&query=코스메카코리아&page=1,2017-05-19 10:04,"코스메카코리아, 23~24일 기업설명회 개최",[머니투데이 권혜민 기자] 코스메카코리아는 오는 23~24일 양일간 국내 주요 기관투자자를 방문해 기업설명회(IR)를 실시할 예정이라고 19일 공시했다. textlinktopstart textlinktopend textlinkstart
이데일리,241710,/news/news_read.nhn?article_id=0004082074&office_id=018&mode=search&query=코스메카코리아&page=1,2018-04-19 09:22,"[특징주]코스메카코리아, 2Q 사상최대 실적 기대 `강세`","[이데일리 이후섭 기자] 코스메카코리아(241710)가 2분기 사상 최대 실적 달성 기대감에 강세다. 19일 오전 9시17분 현재 코스메카코리아 주가는 전날대비 4600원(6.65%) 오른 7만3800원을 기록 중이다. 이지용 신한금융투자 연구원은 이날 보고서를 통해 “코스메카코리아의 2분기 매출액은 전년동기대비 52.3% 증가한 759억원, 영업이익은 37.2% 늘어난 72억원으로 분기 사상 최대 매출액과 영업이익 달성이 기대된다”며 “지피클럽 JM 솔루션의 고판가 제품(24K 골드 제품류)과 여름철 성수기 품목인 선 스프레이 제조업자개발생산(ODM) 수주가 증가하고 있고 VT코스메틱과 에스디생명공학 등에서도 선 스프레이를 포함한 화장품 주문이 증가 추세를 나타내고 있다”고 설명했다. 이 연구원은 “차별화된 고객사를 바탕으로 한 국내 매출 성장, 양호한 외형 성장을 기반으로 한 영업이익률 개선, 최근 주가 상승에도 불구하고 동종업체 대비 매력적인 밸류에이션 등이 투자포인트”라고 판단했다."
이데일리,241710,/news/news_read.nhn?article_id=0004037724&office_id=018&mode=search&query=코스메카코리아&page=1,2018-02-19 08:15,"코스메카코리아, 단기 실적모멘텀 제한적&hellip;투자의견&middot;목표가&darr;-하나","[이데일리 이후섭 기자] 하나금융투자는 19일 코스메카코리아(241710)에 대해 지난해 4분기 실적이 시장기대치를 대폭 밑돌았다며 단기적인 실적 모멘텀은 제한적일 것으로 전망했다. 투자의견은 종전 `매수`에서 `중립`으로, 목표가를 7만5000원에서 6만4000원으로 각각 하향 조정했다. 박종대 하나금융투자 연구원은 “코스메카코리아의 4분기 매출액은 전년동기대비 0.2% 증가한 448억원, 영업이익은 89% 감소한 4억원을 기록해 영업이익 기준 시장기대치(42억원)를 대폭 하회했다”며 “국내부문 매출이 내수 회복세에도 불구하고 수출 부진으로 전년동기대비 0.5% 성장에 그쳤으며 국내외 생산설비 증설에 의한 고정비 부담 증가, 턴키방식 매출 비중 상승 등이 수익성 저하의 주 요인으로 작용했다”고 분석했다. 올해 상반기까지 감익이 예상돼 단기적인 실적 모멘텀은 제한적이라는 판단이다. 박 연구원은 “지난해 3분기 이후 국내외 생산설비 증설 영향으로 고정비는 증가한 반면 사드보복 조치와 수출 감소로 인해 지난해 상반기 10%까지 상승했던 영업이익률이 1% 내외로 급격히 하락했다”며 “올해 상반기 매출액은 전년동기대비 16% 증가를 가정하더라도 증익을 기대하기는 어렵다”고 내다봤다. 코스메카코리아의 올해 매출액을 전년대비 22% 증가한 2220억원, 영업이익은 30% 늘어난 140억원을 기록할 것으로 전망했다."
한국경제,241710,/news/news_read.nhn?article_id=0003730679&office_id=015&mode=search&query=코스메카코리아&page=1,2017-02-21 07:48,"&quot;코스메카코리아, 해외 공급 모멘텀 상상 이상&quot;-KTB","[ 한민수 기자  ] KTB투자증권은 21일 코스메카코리아에 대해 외형 확대 동력(모멘텀)이 제조자개발생산 3사(한국콜마 코스맥스 코스메카코리아) 중 가장 뛰어나다며 투자의견 '강력 매수'와 목표주가 9만8000원을 유지했다. 김영옥 연구원은 ""연결기준 지난해 매출과 영업이익은 각각 전년 대비 66.6%와 97.4% 증가한 1652억원과 126억원을 기록했다""며 ""영업이익은 추정치를 밑돌았으나, 이는 대규모 인력 채용에 따른 것으로 보인다""고 말했다. 매출은 중국과 미주 지역 공급이 추정치를 웃돌아 긍정적이었다는 설명이다. 올해도 중국과 미주로의 공급 확대가 실적을 이끌 것으로 봤다. 김 연구원은 ""지난해 하반기부터 진행된 E사의 럭셔리 브랜드 제품 공급이 빠르게 증가 중""이라며 ""2017년 미주 지역 성장세에 탄력을 더할 것""이라고 예상했다. 올해 매출은 전년 대비 45.7% 증가한 2406억원, 영업이익은 58.8% 늘어난 200억원이 될 것으로 봤다."
전자신문,241710,/news/news_read.nhn?article_id=0002658926&office_id=030&mode=search&query=코스메카코리아&page=1,2017-11-17 09:09,"[ET투자뉴스]코스메카코리아, &quot;피할 수 없었던 사&hellip;&quot; 매수(유지)-대신증권","대신증권에서 17일 코스메카코리아(241710)에 대해 ""피할 수 없었던 사드 보폭을 넓히는 2018년""라며 투자의견을 '매수(유지)'로 제시하였다. 아울러 6개월 목표주가를 78,000원으로 내놓았다. 대신증권 박은정, 정다은 애널리스트가 동종목에 대하여 이번에 제시한 '매수(유지)'의견은 대신증권의 직전 매매의견을 그대로 유지하는 것이고 올해 초반의 매매의견을 기준으로  볼때도 역시 '매수'의견이 계속 유지되고 있는 상태이다. 그리고 최근 분기내 발표된 전체 증권사 리포트의 컨센서스와 비교를 해볼 경우에 오늘 발표된 투자의견은 대체적으로 평균치에 해당하는 수준으로, 이번 의견은 동종목에 대한 전체적인 흐름에서 크게 벗어나지 않은 것으로 분석되고 있다. 한편 6개월 목표주가로 제시한 78,000원은 직전에 발표된 목표가 70,000원 대비 11.4% 상향조정 된 것이고, 목표주가의 추이를 살펴보면 직전에 한차례 하향조정된 후에 이번에 다시 목표가가 상향조정되었는데 전고점보다는 낮은 수준이다. 또한 전일 종가 기준으로 볼때 동종목의 현주가는 이번에 제시된 목표가 대비 24.6%의 추가상승여력이 있다는 해석이 제시되고 있다."
아시아경제,241710,/news/news_read.nhn?article_id=0004226191&office_id=277&mode=search&query=코스메카코리아&page=1,2018-04-26 09:38,"[공시+]잉글우드랩, 코스메카코리아와 시너지를 통한 '퀀텀점프 예상'","[아시아경제 문채석 기자]화장품 제조자개발생산(ODM) 기업  잉글우드랩 이  코스메카코리아 와 시너지를 통해 올해 퀀텀점프를 할 것이라고 26일 밝혔다. 잉글우드랩은 화장품 기업 코스메카코리아와 578억원 규모 양수도 계약을 맺어 전략적인 경영을 위한 발판을 마련했다고 지난 23일 공시했다. 잉글우드랩 측은 ""코스메카코리아의 미국 진출 교두보 역할뿐 아니라 양사의 기술 경쟁력을 극대화해 올해부터 고객 저변을 넓혀나갈 수 있게 됐다""고 말했다. 잉글우드랩은 미국 시장 내 사업기반 및 네트워크와 코스메카코리아의 제품 개발 및 운영 노하우가 결합돼 양사 모두 큰 폭으로 성장할 것으로 기대하고 있다. 회사 관계자는 ""기초 스킨케어 제품에서 지난해 4월 한국로컬업체(現 잉글우드랩코리아, 연결자회사)를 인수를 통해 자체 기술력 확보를 통한 색조화장품 시장에도 진출했다""며 ""매출 성장을 위한 선행투자 또한 마무리 돼 자체적인 턴어라운드 및 코스메카코리아와 시너지가 더해져 더 큰 폭의 성장을 예상하고 있다""고 말했다. 실제 잉글우드랩의 매출액은 지난 4년간 연평균 31% 증가했으며, 주요 고객사들의 물량 확대 및 신규고객사 유치로 현재 주문량이 전년 동기대비 약 30% 넘게 증가한 상태다. 잉글우드랩 관계자는 ""기존의 공급 물량과 함께 코스메카코리아의 미국향 제품까지 담당하게 될가능성이 커져, 턴어라운드는 물론 큰 폭으로 성장할 것으로 기대된다”며, “시너지를 극대화해 미국 화장품 ODM 시장에서 영향력을 지속적으로 확대할 예정""이라고 말했다."
아시아경제,241710,/news/news_read.nhn?article_id=0004296967&office_id=277&mode=search&query=코스메카코리아&page=1,2018-08-17 07:27,"[클릭 e종목]&ldquo;코스메카코리아, 분기 사상 최대 매출&middot;영업익 달성&rdquo;","[아시아경제 구은모 기자] KTB투자증권이 코스메카코리아에 대해 올해 2분기 분기 사상 최대 매출액과 영업이익 달성했다며 시장 흐름에 빠르게 대응한 결과라고 평가했다. 3분기부터는 잉글우드랩에 연결로 편입돼 외형적으로 큰 폭의 증가가 예상된다고 전했다. 코스메카코리아는 올해 2분기 매출액이 796억원으로 전년 동기 대비 59.7% 증가했다고 밝혔다. 같은 기간 영업이익은 84.1% 늘어난 96억원, 당기순이익도 63.5% 증가한 80억원을 기록했다. 김영옥 KTB투자증권 연구원은 17일 보고서에서 “본사 매출액은 약 650억원 수준으로 추정되며 이는 국내 고객사의 주문이 크게 증가했기 때문”이라며 “외형 레버리지가 극대화되면서 높은 영업이익률을 달성했다”고 설명했다. 김 연구원은 코스메카코리아의 최대 실적을 두고 시장 흐름에 발 빠르게 대응한 결과라고 평가했다. 그는 “사드 배치 이후 급랭했던 국내 화장품 오프라인 채널의 영향으로 제조업자개발생산(ODM)  업체들도 타격이 컸으나 업체별로 로드샵 비중을 낮추면서 성장 채널 전환을 진행 중”이라며 “코스메카코리아는 사드 이후 로드샵 고객사 공백에 따른 매출 감소를 최소화하기 위해 홈쇼핑, 온라인 등의 채널에서 입지가 강해지는 고객사에 집중해 시장 트렌드 변화에 빠르게 대응했다”고 설명했다. 이어 “올해 2분기 역시 온라인 채널 내에서 퍼포먼스가 좋은 고객사 주문이 크게 증가한 것으로 추정한다”고 했다. 올해 3분기부터는 잉글우드랩의 실적에 연결로 편입돼 외형적으로 큰 폭의 증가가 예상된다는 전망이다. 다만 빠른 경영 전상화 여부가 관건이라고 평가했다. 김 연구원은 “단기적으로 내부적인 생산과 경영관리 등이 정상화되기까지 시간이 다소 걸리겠지만 잉글우드랩의 기존 거래 고객사가 유지되고, 미국 공장의 생산 효율성 통제가 이뤄질 경우 이익 기여 시점 또한 앞당겨질 수 있을 전망”이라고 내다봤다."
한국경제,241710,/news/news_read.nhn?article_id=0003769414&office_id=015&mode=search&query=코스메카코리아&page=1,2017-05-17 07:20,"&quot;코스메카코리아, 1분기 실적 기대 웃돌아&hellip;목표가&uarr;&quot;-KB","KB증권은 17일 코스메카코리아에 대해 1분기 실적이 기대치를 웃돌았다며 목표주가를 기존 7만8000원에서 8만2000원으로 올려잡았다. 투자의견은 매수를 유지했다. 박신애 연구원은 ""1분기 실적은 국내와 중국 모두 높은 매출 성장률을 달성하면서 추정치를 상회했다""며 ""추정치 대비 매출액과 영업이익이 각각 15%, 21% 웃돌았다""고 말했다. 코스메카코리아의 1분기 매출액은 506억원으로 전년 동기 대비 48% 증가했고 영업이익은  48억원을 기록해 41% 늘었다. 박 연구원은 히트 제품 개발, 공격적 국내외 생산능력(Capa) 확대 등으로 외형 성장세를 지속할 것으로 봤다. 올해 매출액과 영업이익은 전년 대비 각각 37%, 44% 성장한 2257억원, 189억원을 기록할 것이란 분석이다. 내수와 수출은 각각 25%, 50% 성장하고, 중국 합산 매출액은 60% 증가할 것으로 추정했다. 그는 ""올해 코스메카코리아는 연구개발(R&D)에 기반한 차별화된 제품 개발 능력, 국내외 생산 확장, 생산 효율성 향상에 따른 마진 개선이 기대된다""며 ""화장품 업종 내 가장 고성장하는 업체 중 하나가 될 것""이라고 강조했다. 이어 ""현 주가는 주가수익비율(PER) 21배 수준에서 거래 중""이라며 ""높은 성장세를 감안할 때 저평가되어 있으므로 매수 관점의 접근을 추천한다""고 덧붙였다."
