source,symbol,link,date,title,content
이데일리,252500,/news/news_read.nhn?article_id=0004020925&office_id=018&mode=search&query=세화피앤씨&page=1,2018-01-27 09:22,"세화피앤씨, 중동서 화장품 인기 고공행진&hellip;주가도 &uarr;","[이데일리 박형수 기자] 화장품 사업을 하는 세화피앤씨(252500) 주가가 급등하고 있다. 27일 마켓포인트에 따르면 세화피앤씨 주가는 올 들어 106.9% 상승했다. 중동 시장에서 인기를 끌고 있다는 소식이 주가 상승으로 이어졌다. 앞서 세화피앤씨는 지난 25일 화장품 브랜드 ‘모레모’가 지난해 5월 중동 시장에 진출한 뒤로 8개월 만에 수출 규모가 20배 증가했다고 밝혔다. 세화피앤씨는 지난해 5월 두바이 시장에 처음으로 화장품 브랜드 ‘모레모’를 선보였다. 8개월 만에 아랍에미리트(UAE), 이라크, 요르단 등 중동지역에서 월 4만~5만개씩 판매되고 있다. 세화피앤씨 관계자는 “젊은 여성 사이에 ‘머스트 해브 아이템’으로 입소문을 타고 있다”며 “중동 여성용 화장품 시장에서 폭발적인 인기를 끌고 있다”고 설명했다. 세화피앤씨는 모레모 수출물량은 진출 초기에는 월 2000~3000개에 불과했다. 현지 소비자로부터 좋은 반응을 얻어 수출국이 아랍에미리트, 이라크, 요르단, 오만, 레바논, 튀니지, 바레인 등 7개국으로 늘었따. 중동 코스메틱 시장은 4억명 인구가 연간 21조원을 소비하는 세계 5대 화장품 시장 가운데 하나다. 매년 10% 가량 성장하고 있어 전세계 화장품업계가 주목하고 있다. 세화피앤씨가 중동지역에 수출중인 제품은 ‘물미역 트리트먼트’란 애칭으로 알려진 워터 트리트먼트로 젊은 여성층 사이에서 인기를 끌고 있다.  헤어 에센스, 스칼프 샴푸, 바디, 페이스 등 20여종을 출시했다. 이훈구 세화피앤씨 대표는 “중동 코스메틱 시장은 잠재력이 풍부한 미개척 시장”이라며 “한국산 화장품에 대한 신뢰와 호감도가 높다”고 소개했다. 이어 “모레모 브랜드를 중동 여성이 가장 사랑하는 화장품 브랜드로 육성해 K뷰티 신화를 만들 것”이라고 자신있게 말했다. 지난 1976년 설립한 세화피앤씨는 세계 최고 수준의 고농축 헤나추출 기술과 염모제 포뮬레이션기술을 보유하고 있다. ‘리체나’, ‘라헨느’, ‘프리모’, ‘모레모’ 등 염색약과 헤어화장품 브랜드로 전 세계 50여개국에 수출하고 있다."
이데일리,252500,/news/news_read.nhn?article_id=0004027838&office_id=018&mode=search&query=세화피앤씨&page=1,2018-02-06 09:34,"[특징주]세화피앤씨, 작년 순손실 전환&hellip;급락",[이데일리 이명철 기자] 세화피앤씨(252500)가 지난해 이익 감소 및 순이익 적자 소식에 급락세를 나타내고 있다. 6일 오전 9시 21분 현재 세화피앤씨 주가는 전일대비 9.67% 내린 4155원을 기록 중이다. 지난해 실적 발표 후 매도세가 몰리는 것으로 풀이된다. 회사는 전날 장 종료 후 지난해 개별 기준 영업이익 18억5000만원으로 전년대비 20.59% 감소했다고 공시했다. 당기순손실은 25억8300만원으로 적자로 돌아섰다. 매출액은 같은기간 13.45% 증가한 331억7100만원을 기록했다.
파이낸셜뉴스,252500,/news/news_read.nhn?article_id=0004019264&office_id=014&mode=search&query=세화피앤씨&page=1,2018-05-11 14:21,[fnRASSI]세화피앤씨(252500) 전일대비 8.09% 상승,"세화피앤씨(252500)는 현재 주가가 전일 대비 8.09% 상승한 7,080원 선에서 거래가 이루어지고 있다. 외국인/개인 순매수, 기관은 순매도(한달누적)  전일 기관이 2,573주를 순매수했고, 외국인은 15,545주를 순매도했다. 4주간을 기준으로 보면 외국인이 초반에 동종목을 순매수한 이후에 최근에는 순매수량이 줄어들고 있음에도 불구하고 397주를 순매수했고, 개인들도 초반에 동종목을 순매수한 이후에 기세를 이어가며 115,679주를 순매수했다. 하지만 기관은 초반에 동종목을 순매도한 이후에 근래에는 순매도량을 줄이면서 116,076주를 순매도했다. 거래비중은 개인투자자가 가장 높아 최근 한달간 주체별 거래비중을 살펴보면 개인이 97.2%, 외국인이 2.63%, 기관은 0.16%를 기록했다. 그리고 최근 5일간 거래비중은 개인이 96.15%, 외국인이 3.81%, 기관은 0.02%를 기록했다. 'fnRASSI'는 증권전문 기업 씽크풀과 파이낸셜뉴스의 협업으로 로봇기자가 실시간으로 생산하는 기사입니다."
한국경제TV,252500,/news/news_read.nhn?article_id=0000607349&office_id=215&mode=search&query=세화피앤씨&page=1,2018-03-02 14:39,"세화피앤씨, 11% 급등... 전일 보다 480원 상승한 4,820원","[한국경제TV 라이온봇 기자] 세화피앤씨는 3월 2일 14시 38분 전일 대비 약 11% 급등한 4,820원에 거래되고 있다. 세화피앤씨는 코스닥 상장 기업으로 화학 업종에 속해 있다. 시가총액은 826억원으로 코스닥 상장기업 중 733위에 위치 해 있다. [종목 성향 진단] [그림 1] 종목 성향 진단 세화피앤씨의 투자 스타일은 성장주에 가깝다. 주가 고평가 우려가 공존하지만 높은 성장성이 기대되는 기업이다. 주가 모멘텀은 부진한 편이었다. 최근 1개월 수익률은 -9.58%의 하락폭을 기록했다. 세화피앤씨 종목에 대한 투자자의 관심도는 평범한 수준이었다. [투자 점수 진단] [그림 2] 투자 점수 진단 세화피앤씨는 안정성(부채비율) 측면에서 두각을 나타내고 있다. 최근 부채비율은 67점으로 6개의 핵심 팩터 중 가장 높은 점수를 기록했다. 부채비율은  전체 시장 내 683위를 기록하며 상위 33.3%에 위치했다. 업종별로는 137위를 기록하며 상위 32.15%에 위치했다. 그리고 수익성(영업이익률) 역시 도드라지는 편이다. 수익성 점수는 60점으로 두번째로 높은 점수를 기록했다. 영업이익률은 전체 시장 내 788위를 기록하며 상위 40.34%에 위치했다. 업종별로는 138위를 기록하며 상위 34.68%에 위치했다. 그러나 PER이 아쉬움을 나타냈다. [종합 투자점수] [그림 3] 종합 투자점수 AI 인공지능 분석을 통한 세화피앤씨의 종목 종합 스코어는 56점을 기록했다. 이는 동일 업종 평균점수인 52점보단 높지만, 시장 평균점수인 57점을 하회했다. (위의 AI인공지능 점수는 재무 데이터를 기반으로 전체 상장 종목과 비교/분석하여 도출한 점수로 높은 점수가 반드시 높은 수익률을 보장하지 않습니다. 위의 자료는 당사의 추천 종목이 아니며, 투자 시 참고용으로 제시해드리는 것입니다.) 라이온봇 기자 -한국경제TV※ 본 기사는 한국경제TV와 '거장들의 투자공식이'자체 개발한 '라이온봇 기자'가 실시간으로 작성한 기사입니다. 라이온봇기자 ⓒ 한국경제TV, 무단 전재 및 재배포 금지 한국경제TV 관련뉴스해당 언론사에서 선정하며 언론사 페이지(아웃링크)로 이동해 볼 수 있습니다.이상호 2억원, 여자컬링 0원…경기단체 포상금 '천차만별'이하늬 ""살찌면 외삼촌""…문희상 의원과 닮은꼴 '깜짝'전현무♥한혜진 열애, 티격태격 하다가 정 들었다스텔라 해체, 선정성 논란 부담됐나 ""갓 스무살에...""이윤미, 주영훈 몰카논란 사과 ""많이 생각하고 반성"""
이데일리,252500,/news/news_read.nhn?article_id=0003805956&office_id=018&mode=search&query=세화피앤씨&page=1,2017-04-21 16:50,"IBKS지엠비스팩, 세화피앤씨 흡수합병 결정&hellip;9월 합병신주 상장",[이데일리 이명철 기자] IBKS지엠비스팩(252500)은 코넥스 상장 법인 세화피앤씨를 흡수 합병키로 결정했다고 21일 공시했다. 합병 목적은 △합병 시 유입 자금을 통한 재무적 안정성 제고 △코스닥 시장 상장을 통한 자금 조달능력 증대 △기업 신용도 및 이미지 제고를 통한 매출 증대 △사업의 확장 및 경쟁력 제고 △언론 노출 증가에 따른 회사 홍보 및 우수 인력 확보 △종업원 자긍심 고취 등이다. 스팩과 세화피앤씨간 합병비율은 1대 3.6255다. 합병신주는 1372만2517주다. 합병 기일은 오는 9월5일이며 같은달 19일 신주가 상장할 예정이다. 주식매수청구권 행사기간은 8월1~22일이다. 한국거래소는 예비심사청구 대상이 됨에 따라 이날 오후 4시21분부터 매매거래를 정지했다. 만료 일시는 상장예비심사결과 통지일 또는 부적격 심사결과를 통지한 경우 합병대상법인과 합병을 중단하는 결의 또는 결정일까지다.
한국경제TV,252500,/news/news_read.nhn?article_id=0000648020&office_id=215&mode=search&query=세화피앤씨&page=1,2018-06-14 10:33,"세화피앤씨, 전일 대비 약 -5% 하락한 5,570원","[한국경제TV 라이온봇 기자] 세화피앤씨는 6월 14일 10시 32분 전일 대비 약 -5% 하락한 5,570원에 거래되고 있다. 세화피앤씨는 코스닥 상장 기업으로 화학 업종에 속해 있다. 시가총액은 1,217억원으로 코스닥 상장기업 중 562위에 위치 해 있다. [종목 성향 진단] [그림 1] 종목 성향 진단 세화피앤씨의 투자 스타일은 성장주에 가깝다. 주가 고평가 우려가 공존하지만 높은 성장성이 기대되는 기업이다. 주가 모멘텀은 부진한 편이었다. 최근 1개월 수익률은 -3.91%의 하락폭을 기록했다. 세화피앤씨 종목에 대한 투자자의 관심도는 높은 편에 속한다. [투자 점수 진단] [그림 2] 투자 점수 진단 세화피앤씨는 안정성(부채비율) 측면에서 두각을 나타내고 있다. 최근 부채비율은 90점으로 6개의 핵심 팩터 중 가장 높은 점수를 기록했다. 부채비율은  전체 시장 내 225위를 기록하며 상위 10.33%에 위치했다. 업종별로는 43위를 기록하며 상위 9.18%에 위치했다. 그리고 효율성(ROA) 역시 도드라지는 편이다. 효율성 점수는 54점으로 두번째로 높은 점수를 기록했다. ROA는 전체 시장 내 844위를 기록하며 상위 46.42%에 위치했다. 업종별로는 154위를 기록하며 상위 40.58%에 위치했다. 그러나 PBR이 아쉬움을 나타냈다. [종합 투자점수] [그림 3] 종합 투자점수 AI 인공지능 분석을 통한 세화피앤씨의 종목 종합 스코어는 57점을 기록했다. 이는 동일 업종 평균점수인 53점과 시장 평균점수인 55점를 상회하는 수치였다. (위의 AI인공지능 점수는 재무 데이터를 기반으로 전체 상장 종목과 비교/분석하여 도출한 점수로 높은 점수가 반드시 높은 수익률을 보장하지 않습니다. 위의 자료는 당사의 추천 종목이 아니며, 투자 시 참고용으로 제시해드리는 것입니다.) 라이온봇 기자 -한국경제TV※ 본 기사는 한국경제TV와 '거장들의 투자공식이'자체 개발한 '라이온봇 기자'가 실시간으로 작성한 기사입니다. 라이온봇기자 ⓒ 한국경제TV, 무단 전재 및 재배포 금지 한국경제TV 관련뉴스해당 언론사에서 선정하며 언론사 페이지(아웃링크)로 이동해 볼 수 있습니다.논란의 이재명 인터뷰...""신중했으면"" vs ""저런 질문을"" 갑론을박대상포진 매년 8월 급증…여름철 '이것' 관리해야6.13 선거 민주당 싹쓸이…'홍준표 SNS글 보니'방탄소년단 태국팬들 20만cc 피 뽑아...무슨 일골드만삭스가 점찍은 2018 월드컵 우승국은"
파이낸셜뉴스,252500,/news/news_read.nhn?article_id=0003998151&office_id=014&mode=search&query=세화피앤씨&page=1,2018-04-09 13:04,[fnRASSI]세화피앤씨(252500) 현재 9.54% &uarr;,"세화피앤씨(252500)는 현재 주가가 전일 대비 9.54% 상승한 6,660원 선에서 거래가 이루어지고 있다. 외국인 보유량 증가, 기관 감소 (5일 누적) 최근 5일간 동종목의 외국인 투자자는 24,612주 순매수하였고 반면 기관은 22,030주 순매도하였다. 전날 외국인 5,949주 순매수, 기관22,030주 순매도하며 보유 비율이 변동했다. 다음 표는 동종목의 외국인, 기관의 일별 순매수량을 나타낸 것이다.                   지표               항목               값               종합점수                 성장성               매출액증가율               0               4.41                 자기자본증가율               0                 안정성               부채비율               40.86               7.5                 유동비율               274.21                 이익안정성               0                 수익성               ROA               -20.11               2.54                 ROE               -28.33                 영업이익율               3.51          세화피앤씨의 퀀트 재무 점수는 14.45점으로 지난 분기에 비해 성장성 점수가 하락했다. 수익성 측면에서 볼때 영업이익률이 하락하여 이전보다 낮은 점수를 받았다. 'fnRASSI'는 증권전문 기업 씽크풀과 파이낸셜뉴스의 협업으로 로봇기자가 실시간으로 생산하는 기사입니다."
연합뉴스,252500,/news/news_read.nhn?article_id=0009844681&office_id=001&mode=search&query=세화피앤씨&page=1,2018-01-29 15:52,"세화피앤씨, 106억원 규모 화장품&middot;염모제 공급계약","(서울=연합뉴스) 권수현 기자 = 코스닥 상장 두발용 화장품 전문업체 세화피앤씨는 코나인터내셔널과 106억원 규모의 화장품·염모제를 중국에 공급하는 계약을 체결했다고 29일 공시했다. 계약금액은 이 회사 2016년 개별 기준 매출액의 36.4%에 해당한다. 계약 기간은 내년 1월29일까지다. 회사 측은 ""계약 물품은 코나인터내셔널의 중국 지사인 주산코나전자상거래유한공사를 통해 판매될 예정""이라고 설명했다."
이데일리,252500,/news/news_read.nhn?article_id=0004061732&office_id=018&mode=search&query=세화피앤씨&page=1,2018-03-22 09:17,"[특징주]세화피앤씨, 이란 화장품시장 진출 `급등`",[이데일리 이후섭 기자] 세화피앤씨(252500)가 이란 화장품시장 진출 소식에 급등세다. 22일 오전 9시12분 현재 세화피앤씨 주가는 전날대비 640원(13.65%) 오른 5330원을 기록 중이다. 세화피앤씨는 최근 이란 식품의약국으로부터 헤어 제품 8종에 대한 화장품 유통판매 인허가 승인을 완료했다고 이날 밝혔다. 이에 따라 세화피앤씨는 아랍에미리트·이라크·요르단·오만·레바논·튀니지·바레인·이란 등 중동지역 8개국에 `모레모` 화장품을 공급할 수 있게 됐다. 세화피앤씨는 다음달 이란에 초도물량을 선적하고 이란 화장품시장에 모레모 브랜드를 공식 론칭할 예정이다. 세화피앤씨는 이란 현지 파트너를 통해 유통채널을 확대하고 공격적인 마케팅을 펼칠 계획이다. 이훈구 세화피앤씨 대표는 “모레모 주력제품 8종이 이란 식약국 인허가를 확보함에 따라 이르면 다음달부터 중동지역 2위 이란 화장품시장에 공식 론칭할 수 있게 됐다”며 “현지 유통채널과 협력해 다양한 온오프 마케팅을 펼쳐나갈 것”이라고 전했다.
연합뉴스,252500,/news/news_read.nhn?article_id=0009208043&office_id=001&mode=search&query=세화피앤씨&page=1,2017-04-21 16:30,"IBKS지엠비스팩, '세화피앤씨' 흡수합병 결정",(서울=연합뉴스) 전명훈 기자 = 코스닥시장 상장사 IBKS지엠비스팩은 코넥스 상장사인 세화피앤씨를 흡수합병하기로 했다고 21일 공시했다. 합병 비율은 1대 3.6255다. 신주 상장 예정일은 9월19일이다. 이에 따라 한국거래소 코스닥시장본부는 이날 오후 4시21분부터 주권매매를 정지했다. 거래 정지는 상장예비심사 결과 통지일 또는 합병 중단 결의·결정일 까지다.
파이낸셜뉴스,252500,/news/news_read.nhn?article_id=0003953954&office_id=014&mode=search&query=세화피앤씨&page=1,2018-01-29 13:04,"[fnRASSI]세화피앤씨(252500), 52주 신고가...26.25% &uarr;","세화피앤씨(252500)는 52주신고가를 기록하고 있어 주목할만하다. 동종목의 현재 주가는 6,060원 선에서 이루어지고 있다. 거래일을 기준으로 최근 3일간 평균 거래량은 348만 주이다. 이는 60일 일 평균 거래량 133만 주와 비교해보면 최근 거래량이 급격히 늘어났다는 것을 알 수 있다. 주가등락폭이 너무 커 최근 한달간 세화피앤씨의 상장주식수 대비 거래량을 비교해보니 일별 매매회전율이 3.3%로 집계됐다. 동기간 일평균 주가변동률은 10.06%로 장중 주가등락이 심하기 때문에 투자시 주의가 요망된다. 외국인 보유량 감소, 기관 증가 (5일 누적) 최근 5일간 동종목의 외국인 투자자는 12,342주 순매도하였고 반면 기관은 900주 순매수하였다. 전날 외국인 933주 순매도, 기관900주 순매수하며 보유 비율이 변동했다. 다음 표는 동종목의 외국인, 기관의 일별 순매수량을 나타낸 것이다. 'fnRASSI'는 증권전문 기업 씽크풀과 파이낸셜뉴스의 협업으로 로봇기자가 실시간으로 생산하는 기사입니다."
이데일리,252500,/news/news_read.nhn?article_id=0004061696&office_id=018&mode=search&query=세화피앤씨&page=1,2018-03-22 08:58,"세화피앤씨 '모레모', 3.6조 이란 화장품 진출","주력제품 8종 이란식약국 허가 취득 완료..4월초 첫 선적'모레모', 중동 핵심거점 ‘이란’ 화장품 시장 출사표 세화피앤씨 모레모. [이데일리 정태선 기자] 코스닥기업 세화피앤씨는 중동에서 두번째로 큰 인구 8200만명, 33억4000만달러(한화 3조6000억원) 규모의 이란 화장품시장을 본격 공략하고 나섰다. 세화피앤씨(252500)는 최근 ‘이란식품의약국’으로부터 모레모 페이셜 클렌징 오일 잇츠 매직과 페이셜 클렌저 잇츠 폼, 워터 트리트먼트 미라클 10, 헤어 에센스 딜라이트풀 오일, 헤어 트리트먼트 미라클 2X 등 모레모 브랜드 페이스-헤어 제품 8종에 대한 화장품 유통판매를 위한 인허가 승인을 완료했다고 22일 밝혔다. 이에 따라 세화피앤씨는 아랍에미리트, 이라크, 요르단, 오만, 레바논, 튀니지, 바레인, 이란 등 중동지역 8개국에 ‘모레모’ 화장품을 공급할 수 있게 됐다. 세화는 4월초 이란에 초도물량을 선적하고, 이르면 내달부터 이란 화장품 시장에 모레모 브랜드를 공식 론칭할 예정이다. 이란 코스메틱시장은 매년 10% 이상 급성장하고 있는 중동지역 2위 시장이다. 2015년 기준 헤어용품이 24%, 기초화장품이 12%를 차지하고 있으며, 최근 2030 신세대 여성층의 화장품 소비가 급증하고 K뷰티 화장품에 대한 호감도가 매우 높은 편이다. 세화피앤씨는 이란 현지 파트너를 통해 유통채널을 확대하고 공격적인 마케팅을 펼쳐 단기간에 중동지역 한류화장품 대표주자로 자리매김한다는 전략이다. 이훈구 세화피앤씨 대표는 “모레모 주력제품 8종이 이란 식약국 인허가를 확보함에 따라 이르면 4월부터 중동지역 2위 이란 화장품시장에 공식 론칭할 수 있게 됐다”면서 “현지 유통채널과 협력해 중동 7개국 여성에게 검증받은 모레모 화장품이 이란의 20·30 신세대 여성들이 사랑하는 필수 아이템으로 자리잡을 수 있게 다양한 온오프 마케팅을 펼쳐나갈 것”이라고 말했다. 세화피앤씨는 지난 1976년 설립된 코스닥 기업으로, 세계 최고수준의 고농축 헤나추출 기술과 염모제 포뮬레이션기술을 다수 보유, ‘리체나’, ‘라헨느’, ‘프리모’, ‘모레모’ 등 염색약과 헤어화장품 브랜드로 전세계 50여개국에 제품을 수출하고 있는 코스메틱 전문기업이다. 작년 한국소비자만족지수 화장품(헤어코스메틱) 부문 1위 수상, 소비자 중심경영 우수기업 인증 등 고객 감동, 소비자 중심 경영을 펼치고 있다."
서울경제,252500,/news/news_read.nhn?article_id=0003243771&office_id=011&mode=search&query=세화피앤씨&page=1,2018-03-14 14:25,"세화피앤씨, 주당 12원 현금 배당 결정","[서울경제] 세화피앤씨(252500) 가 보통주 1주당 12원의 현금 배당을 결정했다고 14일 공시했다. 배당금액은 총 2억2,107만1,812원이며 배당 기준일은 12월 31일이다."
헤럴드경제,252500,/news/news_read.nhn?article_id=0001345424&office_id=016&mode=search&query=세화피앤씨&page=1,2018-01-25 09:25,"세화피앤씨, 화장품 중동 판매량 급증 소식에 &lsquo;상한가&rsquo;","[헤럴드경제=최준선 기자] 세화피앤씨의 화장품 브랜드 ‘모레모’가 중동 시장에서 폭발적 인기를 끌고 있다는 소식에 상한가를 기록했다. 25일 오전 9시 20분 현재 세화피앤씨는 코스닥 시장에서 전날보다 29.88% 오른 상한가에 거래되고 있다. 세화피앤씨는 전날에도 5.96% 급등했으며, 지난 16일 이후 하루를 제외하고 상승세를 기록 중이다. 해당 기간 주가 상승률은 65.70%에 달한다. [사진=123RF] 이날 상한가는 세화피앤씨의 화장품 브랜드 모레모가 21조원 규모의 중동 여성 화장품 시장에서 가파른 매출 상승세를 보이고 있다는 소식이 영향을 미친 것으로 풀이된다. 세화피앤씨는 지난해 5월 두바이에 출시한 모레모 브랜드가 불과 8개월만에 아랍에미리트(UAE), 이라크, 요르단 등 중동지역에 월 4만~5만개씩 판매되고 있다고 이날 오전 밝혔다. 중동 시장은 4억명의 인구가 연간 21조원을 소비하는 세계 5대 코스메틱 시장으로, 매년 10%가량 급성장하고 있는 것으로 알려졌다."
파이낸셜뉴스,252500,/news/news_read.nhn?article_id=0004049649&office_id=014&mode=search&query=세화피앤씨&page=1,2018-07-02 09:15,[fnRASSI]세화피앤씨(252500) 10.13% 상승,"세화피앤씨(252500)는 현재 주가가 전일 대비 10.13% 상승한 5,380원 선에서 거래가 이루어지고 있다. 기관과 개인은 순매도, 외국인은 순매수(한달누적)  6월28일부터 전일까지 외국인이 2거래일 연속 순매수를 보였다. 4주간을 기준으로 보면 외국인이 초반에 동종목을 순매수한 이후에 기세를 이어가며 196,794주를 순매수한 반면, 기관은 매도 관점으로 접근하면서 40,819주를 순매도했고, 개인들도 매도쪽으로 방향을 잡으면서 155,975주를 순매도한 것으로 집계됐다. 외국인 보유량 증가, 기관 감소 (5일 누적) 최근 5일간 동종목의 외국인 투자자는 30,974주 순매수하였고 반면 기관은 0주 순매도하였다. 전날 외국인은 50,491주 순매수했지만 기관은 순매수량이 0으로 보유비율 그대로 유지했다. 다음 표는 동종목의 외국인, 기관의 일별 순매수량을 나타낸 것이다. 'fnRASSI'는 증권전문 기업 씽크풀과 파이낸셜뉴스의 협업으로 로봇기자가 실시간으로 생산하는 기사입니다."
한국경제,252500,/news/news_read.nhn?article_id=0003907081&office_id=015&mode=search&query=세화피앤씨&page=1,2018-03-14 14:33,"세화피앤씨, 주당 12원 현금배당 결정","세화피앤씨는 보통주 1주당 12원의 결산배당을 결정했다고 14일 공시했다. 시가배당률은 0.55%, 배당금 총액은 약 2억2100만원이다. 배당기준일은 지난해 12월31일이다. 김소현 한경닷컴 기자"
