source,symbol,link,date,title,content
한국경제TV,252500,/news/news_read.nhn?article_id=0000616613&office_id=215&mode=search&query=세화피앤씨&page=1,2018-03-29 10:36,"세화피앤씨, 전일 대비 약 8% 상승한 5,270원","[한국경제TV 라이온봇 기자] 세화피앤씨는 3월 29일 10시 36분 전일 대비 약 8% 상승한 5,270원에 거래되고 있다. 세화피앤씨는 코스닥 상장 기업으로 화학 업종에 속해 있다. 시가총액은 926억원으로 코스닥 상장기업 중 672위에 위치 해 있다. [종목 성향 진단] [그림 1] 종목 성향 진단 세화피앤씨의 투자 스타일은 성장주에 가깝다. 주가 고평가 우려가 공존하지만 높은 성장성이 기대되는 기업이다. 주가 모멘텀은 좋은 편에 속했다. 최근 1개월 수익률은 12.1%의 상승폭을 기록했다. 세화피앤씨 종목에 대한 투자자의 관심도는 굉장히 높은 편이다. [투자 점수 진단] [그림 2] 투자 점수 진단 세화피앤씨는 안정성(부채비율) 측면에서 두각을 나타내고 있다. 최근 부채비율은 67점으로 6개의 핵심 팩터 중 가장 높은 점수를 기록했다. 부채비율은  전체 시장 내 686위를 기록하며 상위 33.3%에 위치했다. 업종별로는 136위를 기록하며 상위 32.15%에 위치했다. 그리고 수익성(영업이익률) 역시 도드라지는 편이다. 수익성 점수는 60점으로 두번째로 높은 점수를 기록했다. 영업이익률은 전체 시장 내 788위를 기록하며 상위 40.34%에 위치했다. 업종별로는 138위를 기록하며 상위 34.68%에 위치했다. 그러나 PER이 아쉬움을 나타냈다. [종합 투자점수] [그림 3] 종합 투자점수 AI 인공지능 분석을 통한 세화피앤씨의 종목 종합 스코어는 57점을 기록했다. 이는 동일 업종 평균점수인 54점보단 높지만, 시장 평균점수인 57점과 동일한 수준이었다. (위의 AI인공지능 점수는 재무 데이터를 기반으로 전체 상장 종목과 비교/분석하여 도출한 점수로 높은 점수가 반드시 높은 수익률을 보장하지 않습니다. 위의 자료는 당사의 추천 종목이 아니며, 투자 시 참고용으로 제시해드리는 것입니다.) 라이온봇 기자 -한국경제TV※ 본 기사는 한국경제TV와 '거장들의 투자공식이'자체 개발한 '라이온봇 기자'가 실시간으로 작성한 기사입니다. 라이온봇기자 ⓒ 한국경제TV, 무단 전재 및 재배포 금지 한국경제TV 관련뉴스해당 언론사에서 선정하며 언론사 페이지(아웃링크)로 이동해 볼 수 있습니다.""자연미인"" 셋째 출산에도 여전히 아름다운 '리설주'신혼여행 살해 ""보험금 1억 때문에…""오연서, 서태지 부인 이은성 고아라 미모 대결 승자가…바다 남편, 9살 연하 아니다? ""민망함 때문에…""'재벌 3세' 정용진·정지선은 SNS를 어떻게 이용할까?"
서울경제,252500,/news/news_read.nhn?article_id=0003275684&office_id=011&mode=search&query=세화피앤씨&page=1,2018-04-20 09:12,"&lt;코&gt;세화피앤씨, 장중 신고가 돌파.. 7,660&rarr;7,850(▲190)","[서울경제] 오전 9시 10분 현재 세화피앤씨(252500) 가 10.56% 오른 7,850원(▲750)을 기록하며, 52주 신고가를 +190원 경신했다. 기존 52주 최고가는 2018년 04월 03일 기록한 7,660원이다. 체결강도는 131%로 강세를 유지했다. 총매수체결량은 706,720주, 총매도체결량은 540,280주를 각각 기록했다.  (※ 체결강도(%) = (총매수체결량/총매도체결량)*100) 이 시각 현재 거래대금은 75억6,664만, 거래량은 102만3,961주를 기록하고 있으며, 수급측면으로는 43(매도):57(매수)의 매수우위를 보이고 있다. 거래일을 기준으로 최근 3일간 평균 거래량은 2백3십만6천주, 60일 평균 거래량 2백7십6만2천주로 비슷한 수준의 거래량을 유지하고 있다."
이데일리,252500,/news/news_read.nhn?article_id=0004139705&office_id=018&mode=search&query=세화피앤씨&page=1,2018-07-02 09:20,"[특징주]세화피앤씨, 中 화장품 주문량 月 28만개&hellip;급등","[이데일리 이명철 기자] 세화피앤씨(252500)가 화장품 브랜드 ‘모레모’로 중국에 진출한지 약 5달만에 주문이 급증하는 등 성과를 내고 있다는 소식에 급등세다. 2일 오전 9시 18분 현재 세화피앤씨 주가는 전거래일대비 10.34% 오른 5390원을 기록 중이다. 화장품 실적 성장 기대감이 반영된 것으로 풀이된다. 회사는 지난달 중국 유통채널을 통한 모레모 브랜드 판매량이 처음으로 월간 28만개를 넘었다고 이날 밝혔다. 모레모는 일명 ‘물미역트리트먼트’로 불리는 모레모 워터트리트먼트 미라클 10을 비롯해 10여개 전략제품으로 구성됐다. 현재 샤오홍슈 브랜드관에 입점했으며 티몰, 징동, 쑤닝 등 중국 4대 대형 온라인 쇼핑몰 브랜드숍 입점도 앞뒀다. 다음달부터는 중국 유명 왕홍과 지속 마케팅 및 방송 판매를 전개해 고객층을 꾸준히 확대할 계획이다. 이훈구 대표는 “차별화된 품질력을 기반으로 중국내 화장품 유통채널을 확대한 성과”라며 “다양한 유통채널을 적극 활용해 현지화 전략을 펼쳐나갈 것”이라고 말했다."
연합뉴스,252500,/news/news_read.nhn?article_id=0010075269&office_id=001&mode=search&query=세화피앤씨&page=1,2018-05-09 18:15,"세화피앤씨 &quot;법원, 자사 모방제품 판매금지&quot;&hellip;상대방 이의신청(종합)","세화피앤씨 ""모레모와 동일한 기능·비슷한 형태 상품 판매해 부정경쟁행위"" 더블유비스킨 ""가처분신청서 받지 못해 대응 못했다"" 모레모 워터 트리트먼트 미라클 10[세화피앤씨 제공] (서울=연합뉴스) 김은경 기자 = 화장품 기업 세화피앤씨는 자사 주력제품인 '모레모 워터 트리트먼트 미라클 10'을 모방한 제품을 제조·판매한 '더블유비스킨'을 상대로 제기한 부정경쟁행위 금지 가처분 소송에서 승소했다고 9일 밝혔다. 세화피앤씨에 따르면 서울동부지방법원 민사 21부는 지난달 13일 ""더블유비스킨의 '트리트룸 나인 코팅 워터트리트먼트' 제조와 판매가 부정경쟁방지 및 영업비밀보호에 관한 법률상 부정경쟁행위에 해당한다""고 판결했다. 재판부는 결정문에서 ""더블유비스킨은 작년 3월 설립해 그해 7월께 모레모 제품과 동일한 기능의 상품인 '트리트룸 나인 코팅 워터트리트먼트' 제품을 출시해 판매하고 이를 광고한 사실이 소명된다""고 인정했다. 그러면서 ""해당 제품은 용기 모양과 외관(묽은 점성·색채·광택·형상), 포장에 쓰인 문구, 컨셉 등 모레모 제품 상품 형태도 모방했다""고 강조했다. 법원 판결에 따라 더블유비스킨의 '트리트룸 나인 코팅 워터트리트먼트'는 양도(판매), 대여 또는 이를 위한 전시와 광고, 수입, 수출 등이 전면 금지된다. 이훈구 세화피앤씨 대표는 ""앞으로도 자사 브랜드를 모방하거나 침해하는 행위에 강력하게 대처해 나갈 방침""이라고 말했다. 더블유비스킨은 ""세화피앤씨로부터 부정경쟁행위 금지 가처분 결정문을 4월 18일 송달받았으나 미리 가처분 신청서를 받지 못해 이에 대응하지 못했다""며 ""법원 결정은 세화피앤씨의 주장만으로 이뤄진 것""이라고 반박했다. 이 회사는 ""부정경쟁행위 금지 가처분 이의신청을 이당초 서울동부지방법원에 제출한 상태""라며 ""추가로 가처분 효력집행 정지와 제소명령 신청을 준비하고 있다""고 덧붙였다."
서울경제,252500,/news/news_read.nhn?article_id=0003309867&office_id=011&mode=search&query=세화피앤씨&page=1,2018-05-30 10:19,"더블유비스킨 워터트리트먼트, 세화피앤씨에 강제집행 정지 승소","강제집행정지 승소로 ‘나인코팅워터트리트먼트’ 제품 판매 가능하게 돼 [서울경제] 더블유비스킨는 자사의 ‘트리트룸 나인코팅 워터 트리트먼트’ 제품이 세화피앤씨(252500) 의 ‘모레모 워터 트리트먼트 미라클 10’ 제품을 대상으로 제기한 강제집행 정지 신청 사건에서 승소했다고 30일 밝혔다. 서울동부지방법원 민사제14부(강화석, 강영희, 김준우)는 세화피앤씨가 더블유비스킨에 ‘트리트룸 나인코팅 워터 트리트먼트’ 제품을 양도, 대여 또는 이를 위한 전시 및 광고를 하거나 수입, 수출하는 행위 금지를 신청한 것에 대한 강제집행에 대하여 가처분 이의사건의 결정시까지 이를 정지한다고 판결했다. 재판부는 더블유비스킨에 대한 부정경쟁행위 금지 가처분 결정의 위법성이 소명되고, 강제집행에 의해 더블유비스킨에 회복할 수 없는 손해를 발생할 우려가 있으므로, 더블유비스킨이 세화피앤씨 상대로 제기한 가처분 이의사건의 결정시까지 세화피앤씨의 가처분 신청의 효력을 정지한다고 밝혔다. 법원의 인용 결정에 따라 더블유비스킨은 ‘트리트룸 나인코팅 워터 트리트먼트’ 제품을 양도, 대여 또는 이를 위한 전시 및 광고, 수입, 수출하는 행위 등을 할 수 있게 됐다. 김왕배 더블유비스킨 대표는 “이번 결정은 법원이 상장기업이 아닌 스타트업에게 손을 들어준 의미있는 결정”이라며 “소비자가 높은 기술력이 적용된 중소기업의 좋은 제품을 사용할 수 있도록 앞으로 더블유비스킨은 자사를 견제하는 기업이 상장기업이라 하더라도 강력하게 대처해나갈 것”이라고 말했다."
뉴시스,252500,/news/news_read.nhn?article_id=0008335004&office_id=003&mode=search&query=세화피앤씨&page=1,2017-12-11 08:59,"세화피앤씨, 화장품 브랜드 '모레모' 중국 인허가 취득","【서울=뉴시스】류난영 기자 = 코스닥기업 세화피앤씨의 코스메틱 브랜드 '모레모'가 중국 식약처로부터 화장품 인허를 취득했다. 세화피앤씨는 중국 화장품 인허가를 담당하는 '중국 국가식품의약품감독관리총국'(중국식약총국 CFDA)으로부터 전략제품인 모레모 브랜드 헤어-기초 제품 총 5종이 중국내 유통판매를 위한 승인을 취득했다고 11일 밝혔다. 이에 따라 세화피앤씨는 내년 초부터 중국 화장품 시장에 본격 진출한다. 이번에 인허가를 받은 제품은 '모레모 워터 트리트먼트 미라클 10', '모레모 헤어 에센스 딜라이트풀 오일', '모레모 샴푸-레스 이즈 모어' 등 헤어케어 3종과 '모레모 페이셜 클렌징 오일-잇츠 매직', '모레모 페이셜 클렌저-잇츠 폼' 등 페이스케어 2종으로 중국 신세대 여성층을 겨냥한 제품 총 5개 모델이다. 세화피앤씨는 모레모 헤어 트리트먼트와 페이셜 에센스, 토너, 미스트 등 6종의 제품이 추가로 중국 식약총국 인허가 절차를 진행중이다. 이훈구 세화피앤씨 대표는 ""주요 제품의 중국 식약총국 인허가 절차가 마무리됨에 따라 본격적인 판매에 앞서 중국 파트너사와 함께 주요 백화점과 대형마트 등 대형 유통사 바이어들의 테스트 마케팅을 진행할 계획""이라고 말했다."
한국경제TV,252500,/news/news_read.nhn?article_id=0000638368&office_id=215&mode=search&query=세화피앤씨&page=1,2018-05-25 12:29,"세화피앤씨, 전일 대비 약 4% 상승한 7,580원","[한국경제TV 라이온봇 기자] 세화피앤씨는 5월 25일 12시 28분 전일 대비 약 4% 상승한 7,580원에 거래되고 있다. 세화피앤씨는 코스닥 상장 기업으로 화학 업종에 속해 있다. 시가총액은 1,510억원으로 코스닥 상장기업 중 464위에 위치 해 있다. [종목 성향 진단] [그림 1] 종목 성향 진단 세화피앤씨의 투자 스타일은 성장주에 가깝다. 주가 고평가 우려가 공존하지만 높은 성장성이 기대되는 기업이다. 주가 모멘텀은 평범한 수준이었다. 최근 1개월 수익률이 3.21%, 3개월 수익률은 50.48%, 6개월 수익률은 214.67%를 기록했다. 세화피앤씨 종목에 대한 투자자의 관심도는 높은 편에 속한다. [투자 점수 진단] [그림 2] 투자 점수 진단 세화피앤씨는 안정성(부채비율) 측면에서 두각을 나타내고 있다. 최근 부채비율은 86점으로 6개의 핵심 팩터 중 가장 높은 점수를 기록했다. 부채비율은  전체 시장 내 295위를 기록하며 상위 14.08%에 위치했다. 업종별로는 59위를 기록하며 상위 11.39%에 위치했다. 그리고 효율성(ROA) 역시 도드라지는 편이다. 효율성 점수는 69점으로 두번째로 높은 점수를 기록했다. ROA는 전체 시장 내 597위를 기록하며 상위 30.6%에 위치했다. 업종별로는 111위를 기록하며 상위 28.57%에 위치했다. 그러나 PBR이 아쉬움을 나타냈다. [종합 투자점수] [그림 3] 종합 투자점수 AI 인공지능 분석을 통한 세화피앤씨의 종목 종합 스코어는 59점을 기록했다. 이는 동일 업종 평균점수인 56점과 시장 평균점수인 57점를 상회하는 수치였다. (위의 AI인공지능 점수는 재무 데이터를 기반으로 전체 상장 종목과 비교/분석하여 도출한 점수로 높은 점수가 반드시 높은 수익률을 보장하지 않습니다. 위의 자료는 당사의 추천 종목이 아니며, 투자 시 참고용으로 제시해드리는 것입니다.) 라이온봇 기자 -한국경제TV※ 본 기사는 한국경제TV와 '거장들의 투자공식이'자체 개발한 '라이온봇 기자'가 실시간으로 작성한 기사입니다. 라이온봇기자 ⓒ 한국경제TV, 무단 전재 및 재배포 금지 한국경제TV 관련뉴스해당 언론사에서 선정하며 언론사 페이지(아웃링크)로 이동해 볼 수 있습니다.'정은숙 결혼' 나한일 딸 나혜진 알고보니 '얼짱 여배우'""발과 주먹으로..."" 조재범 코치, 심석희 폭행 사건 '공분'""미쳐도 곱게 미쳐라"" 시민 고성 속 조현아 출석…'고개 푹'엄지원 남편, 엄친아에 빌딩 부자…엄지원 부친은 '더 대박'홍수아 올 망사?…'이쯤되면 대륙여신'"
한국경제TV,252500,/news/news_read.nhn?article_id=0000655348&office_id=215&mode=search&query=세화피앤씨&page=1,2018-07-02 09:39,"세화피앤씨, 11% 급등... 전일 보다 515원 상승한 5,400원","[한국경제TV 라이온봇 기자] [그림 1] 최근 3개월 간 주가 추세 및 기간별 수익률 세화피앤씨는 7월 2일 9시 38분 전일 대비 약 11% 급등한 5,400원에 거래되고 있다. 세화피앤씨는 코스닥 상장 기업으로 화학 업종에 속해 있다. 시가총액은 957억원으로 코스닥 상장기업 중 640위에 위치 해 있다. [종목 성향 진단] [그림 2] 종목 성향 진단 세화피앤씨의 투자 스타일은 성장주에 가깝다. 주가 고평가 우려가 공존하지만 높은 성장성이 기대되는 기업이다. 주가 모멘텀은 좋지 못했다. 최근 1개월 수익률은 -28.67%의 하락폭을 기록했다. 세화피앤씨 종목에 대한 투자자의 관심도는 평범한 수준이었다. [투자 점수 진단] [그림 3] 투자 점수 진단 세화피앤씨는 어느 측면에서 투자 매력도가 높은 종목일까? AI 인공지능 종목 분석 시스템을 이용해 성장성, 수익성, 효율성, 안전성, 저평가성, 추세 등 주가 수익률에 영향을 줄 수 있는 6가지 핵심 투자 지표를 점수화하여 종목의 투자 매력도를 계산해보았다. 그 결과 세화피앤씨는 상대적으로 기업안정성 측면에서 두각을 드러내고 있었다. 기업안정성 점수는 기업의 재무 구조가 얼마나 안정적인 상태인지를 나타낸다. 세화피앤씨는 특히 부채비율 측면에서 가장 높은 점수는 기록했는데, 전체 시장 내 207위를 기록하며 상위 10.33%에 위치했다. 업종별로는 37위를 기록하며 상위 8.82%에 위치했다. 그러나 기업 가치 대비 주가 수준을 나타내는 저평가 측면에서는 아쉬움을 나타냈다. (위의 AI인공지능 점수는 재무 데이터를 기반으로 전체 상장 종목과 비교/분석하여 도출한 점수로 높은 점수가 반드시 높은 수익률을 보장하지 않습니다. 위의 자료는 당사의 추천 종목이 아니며, 투자 시 참고용으로 제시해드리는 것입니다. 핵심투자지표를 결합해 종목의 투자매력도를 종합 계산한 ""인공지능 투자점수""는 ""거장들의 투자공식"" 앱에서 확인하실 수 있습니다.) 라이온봇 기자 -한국경제TV※ 본 기사는 한국경제TV와 '거장들의 투자공식이'자체 개발한 '라이온봇 기자'가 실시간으로 작성한 기사입니다. 라이온봇기자 ⓒ 한국경제TV, 무단 전재 및 재배포 금지 한국경제TV 관련뉴스해당 언론사에서 선정하며 언론사 페이지(아웃링크)로 이동해 볼 수 있습니다.외국인·기관 떠나는데 '거꾸로 투자'한 개인…투자 종목봤더니휴가철 피부화상, 감자팩·오이팩 잘못 하면 낭패메시도 호날두도 없다…BBC ""남은 선수 중 최고는""상반기 아파트값 상승률 1위 '분당'…""양극화 심화""갑자기 많아진 새치…'20대'라면 이 것 때문"
전자신문,252500,/news/news_read.nhn?article_id=0002665443&office_id=030&mode=search&query=세화피앤씨&page=1,2017-12-11 09:39,[ET투자뉴스]세화피앤씨_상당히 강하게 밀어붙이며 현재 +29.85%,"11일 오전 9시 33분 현재 세화피앤씨가 700원(29.85%) 오른 3,045원으로 상한가를 기록하고 있다.   그렇다면 이제 투자자의 입장에서 상한가의 원인이 어디에 있는지 세부항목별로 살펴보도록 하자.    [주가/수급동향]     11월28일부터 기관이 9거래일 연속 순매수 행진을 벌이고 있다. 최근 한달간 세화피앤씨의 매매회전율을 분석한 결과 14일에 1번 꼴로 주식의 주인이 바뀐 것으로 나타났다.  회전율이 높은 경우 유동성이 좋다고 할 수 있으나 이런경우 주가변동이 심한 경우가 많아 주의가 요구된다.  동종목의 경우도 일평균 주가변동률이 8.34%에 달해 장중 주가변동이 상당히 크다는 것을 알 수 있다.  그리고 최근 5일간 거래비중은 개인이 96.44%, 외국인이 2.36%, 기관은 1.18%를 기록한 것으로 나타났다.     [차트신호]     현주가를 최근의 주가변화폭을 기준으로 본다면 상승폭이 상대적으로 큰 특징을 보이고 있고,거래량을 활용한 지표로 볼 때는 거래량이 수반되는 질적인 상승을 보이고 있다.투자심리적 관점에서 보면 뚜렷한 심리변화가 나타나지 않고 있고 이동평균선들의 배열도를 분석을 해보면 단기, 중기, 장기 이동평균선이 정배열을 이루는 전형적인 상승국면에 있다.     [업종내 종목흐름]     이 시각 현재 관련종목들은 혼조세를 보이고 있으나 화학업종은    0.48% 상승중이다. 프럼파스트 5,790원▲110(+1.94%) 한일화학 12,000원▼100(-0.83%)  와토스코리아 6,990원▼10(-0.14%) 나노 1,120원▲10(+0.90%)"
이데일리,252500,/news/news_read.nhn?article_id=0004037026&office_id=018&mode=search&query=세화피앤씨&page=1,2018-02-17 10:02,"[연초 급등주]세화피앤씨, 1월엔 급등 2월엔 주춤","[이데일리 박형수 기자] 지난달 주가가 급등했던 세화피앤씨 주가가 이달에는 주춤하다. 27일 마켓포인트에 따르면 세화피앤씨 주가는 이달 들어 23.3% 하락했다. 1월 한달 동안 153.0% 급등한 뒤로 차익 실현을 위한 매도 물량이 쏟아진 데다 지난해 영업이익이 전년 대비 감소했다는 소식이 전해지면서 주가가 큰 폭으로 하락했다. 앞서 세화피앤씨는 지난달 25일 화장품 브랜드 ‘모레모’가 지난해 5월 중동 시장에 진출한 뒤로 8개월 만에 수출 규모가 20배 증가했다고 밝혔다. 주가는 사흘 연속 상한가 행진을 이어갔다. 세화피앤씨는 지난해 5월 두바이 시장에 처음으로 화장품 브랜드 ‘모레모’를 선보였다. 8개월 만에 아랍에미리트(UAE), 이라크, 요르단 등 중동지역에서 월 4만~5만개씩 판매되고 있다. 세화피앤씨 관계자는 “젊은 여성 사이에 ‘머스트 해브 아이템’으로 입소문을 타고 있다”며 “중동 여성용 화장품 시장에서 폭발적인 인기를 끌고 있다”고 설명했다. 세화피앤씨는 모레모 수출물량은 진출 초기에는 월 2000~3000개에 불과했다. 현지 소비자로부터 좋은 반응을 얻어 수출국이 아랍에미리트, 이라크, 요르단, 오만, 레바논, 튀니지, 바레인 등 7개국으로 늘었따. 중동 코스메틱 시장은 4억명 인구가 연간 21조원을 소비하는 세계 5대 화장품 시장 가운데 하나다. 매년 10%가량 성장하고 있어 전 세계 화장품업계가 주목하고 있다. 세화피앤씨가 중동지역에 수출 중인 제품은 ‘물미역 트리트먼트’란 애칭으로 알려진 워터 트리트먼트로 젊은 여성층 사이에서 인기를 끌고 있다. 헤어 에센스, 스칼프 샴푸, 바디, 페이스 등 20여종을 출시했다. 이훈구 세화피앤씨 대표는 “중동 코스메틱 시장은 잠재력이 풍부한 미개척 시장”이라며 “한국산 화장품에 대한 신뢰와 호감도가 높다”고 소개했다. 이어 “모레모 브랜드를 중동 여성이 가장 사랑하는 화장품 브랜드로 육성해 K뷰티 신화를 만들 것”이라고 자신있게 말했다. 지난 1976년 설립한 세화피앤씨는 세계 최고 수준의 고농축 헤나추출 기술과 염모제 포뮬레이션기술을 보유하고 있다. ‘리체나’, ‘라헨느’, ‘프리모’, ‘모레모’ 등 염색약과 헤어화장품 브랜드로 전 세계 50여개국에 수출하고 있다. 단기간 주가가 급등한 뒤로 차익 실현을 위한 매도 물량이 나오기 시작했다. 지난달 30일부터 7거래일 연속으로 하락했다. 게다가 지난 5일 장 종료 후 세화피앤씨는 지난해 개별 기준 영업이익 18억5000만원으로 전년 대비 20.59% 감소했다고 공시했다. 당기순손실은 25억8300만원으로 적자로 돌아섰다. 매출액은 같은 기간 13.45% 증가한 331억7100만원을 기록했다."
