source,symbol,link,date,title,content
파이낸셜뉴스,252500,/news/news_read.nhn?article_id=0003976988&office_id=014&mode=search&query=세화피앤씨&page=1,2018-03-06 13:47,"[fnRASSI]세화피앤씨, 상한가 기록","세화피앤씨(252500)는 상한가를 기록하고 있다. 동종목은 현재 5,720원선에서 이루어지고 있다. 참고로 52주 최고가는 6,240원(18년 01월 29일), 최저가는 1,685원(17년 09월 20일)원이다. 최근 3일동안 평균 거래량은 361만 주이다. 이는 250일 일 평균 거래량 94만 주와 비교해보면 최근 거래량이 급격히 늘어났다는 것을 알 수 있다. 주주들의 손바뀜이 잦은 듯 최근 한달간 세화피앤씨의 매매회전율을 분석한 결과 14일에 1번 꼴로 주식의 주인이 바뀐 것으로 나타났다. 회전율이 높은 경우 유동성이 좋다고 할 수 있으나 이런경우 주가변동이 심한 경우가 많아 주의가 요구된다. 동종목의 경우 동기간 일평균 주가변동률은 4.54%를 기록했다. 외국인투자자 연속 5일 순매도 최근 5일간 동종목의 외국인 투자자는 82,503주 순매수하였고 반면 기관은 2주 순매도하였다. 전날 외국인 7,309주 순매수, 기관2주 순매도하며 보유 비율이 변동했다. 다음 표는 동종목의 외국인, 기관의 일별 순매수량을 나타낸 것이다. 'fnRASSI'는 증권전문 기업 씽크풀과 파이낸셜뉴스의 협업으로 로봇기자가 실시간으로 생산하는 기사입니다."
서울경제,252500,/news/news_read.nhn?article_id=0003278756&office_id=011&mode=search&query=세화피앤씨&page=1,2018-04-24 09:31,"&lt;코&gt;세화피앤씨, 전일 대비 23.50% 상승.. 일일회전율은 20.04% 기록","[서울경제] 세화피앤씨(252500) 는 24일 오전 9시 30분 현재 23.50% 오른 8,040원에 거래되고 있으며, 43(매도):57(매수)의 매수우위를 기록하고 있다. 거래대금은 311억1,211만, 거래량은 415만6,740주로 거래량회전율은 20.04%로 나타났다. 지난 1개월간 세화피앤씨는 상한가 1회, 상승 14회, 하락 15회를 기록했고, 주가수익률은 50.56% 표준편차는 7.13%를 기록했다. 이 기간 ' 화학업 ' 업종 평균 주가수익률은 4.99%로 나타났으며, 변동성은 1.28%를 기록했다. 이 시각 현재 ' 화학업 '은 0.97% 상승 중이며, 50(매도):50(매수)의 보합세를 보이고 있다"
서울경제,252500,/news/news_read.nhn?article_id=0003265127&office_id=011&mode=search&query=세화피앤씨&page=1,2018-04-09 11:35,"&lt;코&gt;세화피앤씨, 전일 대비 7.89% 상승.. 일일회전율은 7.36% 기록","[서울경제] 세화피앤씨(252500) 는 9일 오전 11시 34분 현재 7.89% 오른 6,560원에 거래되고 있으며, 42(매도):58(매수)의 매수우위를 기록하고 있다. 거래대금은 94억9,248만, 거래량은 152만7,001주로 거래량회전율은 7.36%로 나타났다. 지난 1개월간 세화피앤씨는 상한가 2회, 상승 12회, 하락 15회를 기록했고, 주가수익률은 37.96% 표준편차는 8.91%를 기록했다. 이 기간 ' 화학업 ' 업종 평균 주가수익률은 1.61%로 나타났으며, 변동성은 1.58%를 기록했다. 이 시각 현재 ' 화학업 '은 0.18% 상승 중이며, 42(매도):58(매수)의 매수우위를 기록하고 있다."
머니투데이,252500,/news/news_read.nhn?article_id=0004050244&office_id=008&mode=search&query=세화피앤씨&page=1,2018-05-11 15:06,"세화피앤씨, 中 왕홍 마케팅 시작...7일 첫방송 '매진'","[머니투데이 김건우 기자] [中 '타오바오' 등 주요 생방송 채널서 성황리 판매] 세화피앤씨는 지난 7일 주력제품 6종이 타오바오닷컴 등 중국 4개 방송채널에서 판매 매진을 기록했다고 11일 밝혔다. 세화피앤씨는 중국 왕홍 '콩지에CC'(空姐CC)와 후난방송 인기 아나운서 '왕리', '로샤'가 함께 '타오바오닷컴' 등 中 4개 방송채널에서 '워터 트리트먼트 미라클 10', '리페어샴푸 R', '페이셜 미스트 올데이 모이스트'와 프리모 '바디헤어 리무버', 리체나 '볼륨커버 스프레이', '바띠 립틴트' 등을 판매했다. '워터 트리트먼트 미라클 10'은 젊은층 사이에 '물미역 트리트먼트'란 애칭으로 국내 홈쇼핑에서 완판된 베스트셀러 제품이다. 지난해 100억원 이상의 매출을 기록한 바 있다. 세화피앤씨 관계자는 ""준비했던 물량이 1차 생방송만에 모두 판매돼, 14일로 예정된 2차 판매일정을 28일로 연기해 충분한 물량을 확보한 뒤 두 번째 방송에 나설 계획이다""고 말했다. 세화피앤씨는 첫 방송에서 중국 여성의 취향에 맞는 브랜드별 전략제품을 선정한 효과가 컸다고 분석했다.  28일 두번째 방송에서는 모레모 리페어샴푸 R, 모레모 워터트리트먼트 미라클10 , 모레모 선스틱 A, 모레모 브라이트닝크림 B, 리체나 헤어볼륨커버스프레이를 판매할 계획이다. 세화피앤씨는 오는 30일 중국 최대의 홈쇼핑이자, 화장품 분야 1위 홈쇼핑 기업인 '해피고' 방송도 계획하고 있다. 모레모 리페어샴푸 R, 모레모 워터트리트먼트 미라클10, 모레모 페이셜미스트 올데이 모이스트, 리체나 헤어볼륨커버스프레이 등 인기제품 4종을 판매할 예정이다. 이훈구 세화피앤씨 대표는 ""왕홍 마케팅과 해피고 TV홈쇼핑 판매를 통해 세화의 수준높은 화장품 품질을 인정받고 중국인이 사랑하는 K뷰티 대표 코스메틱 기업으로 자리매김하겠다""고 말했다."
한국경제,252500,/news/news_read.nhn?article_id=0003884895&office_id=015&mode=search&query=세화피앤씨&page=1,2018-01-26 11:26,중동 수출 대박에 2거래일 연속 상한가 기록한 세화피앤씨,"[ 은정진 기자  ] 세화피앤씨 '모레모' 염모제 및 헤어케어 전문 제조·유통업체인 세화피앤씨가 2거래일 연속 상한가를 기록했다. 세화피앤씨는 26일 코스닥시장에서 장중 가격 제한폭(29.91%)까치 치솟았다. 최근 3거래일동안 주가가 78.77% 상승했다. 자체적으로 만든 화장품 브랜드 ‘모레모’ 수출량이 중동 지역에서 8개월만에 20배 증가했다는 소식이 주가를 연이틀 끌어올린 요인이었다. 세화피앤씨는 지난해 5월 아랍에미리트의 두바이에 처음 이 화장품 브랜드를 출시했다. 초기에는 수출물량이 월 2000~3000개에 불과했지만 이후 현지 여성들 사이에서 ‘필수 화장품 아이템’으로 입소문을 타기 시작했다. 아랍에미리트를 비롯한 이라크, 요르단, 오만, 레바논, 튀니지, 바레인 등 7개국에서 월 4만~5만개씩 판매되고 있다. 중동 화장품시장은 연간 21조원을 소비하는 세계 5대 화장품 시장으로 알려져 있다. 세화피앤씨는 중동에 이어 올해부터는 중국 화장품시장에 본격 진출할 것으로 알려지면서 실적 확대를 예고하고 있다. 이미 지난해 12월 중국 화장품 인허가를 담당하고 있는 중국 국가식품의약품감독관리총국CFDA)으로부터 모레모 브랜드 헤어, 기초 제품 총 5종에 대한 중국 내 유통판매를 승인을 취득했다."
이데일리,252500,/news/news_read.nhn?article_id=0004085844&office_id=018&mode=search&query=세화피앤씨&page=1,2018-04-24 09:23,"[특징주]세화피앤씨, 中 절강성 사전통관&hellip;7일만 위생허가&uarr;","[이데일리 이명철 기자] 세화피앤씨(252500)가 국내 화장품업계 최초로 중국 절강성 자유무역구의 비특수화장품 사전통관 기업으로 선정됐다는 소식에 급등세다. 24일 오전 9시 21분 현재 세화피앤씨 주가는 전일대비 9.37% 오른 7120원을 기록 중이다. 이번 허가로 기능성(특수류) 화장품을 제외한 모든 화장품을 1주일이면 허가 인가를 받을 수 있게 돼 실적 개선 기대감이 반영한 것으로 풀이된다. 회사는 지난 17일 중국 절강성 사전통관제 첫 허가기업으로 선정돼 증서 발급식을 열었다고 이날 밝혔다. 사전통관제 허가기업 선정에 따라 앞으로 생산하는 모든 비특수 화장품 신제품을 중국 수출 시 7일간 테스트와 서류 심의만 받으면 중국식약청 위생허가를 받을 수 있다. 지금까지 위생허가를 받으려면 서류접수부터 자료심사, 테스트, 허가완료까지 통상 5개월에서 1년 가량 소요됐다. 이훈구 대표는 “국내 화장품 업계 최초로 절강성 자유무역구 비특수화장품 사전통관기업에 선정된 것은 K뷰티 업계 쾌거”라며 “통관기간이 획기적으로 단축돼 최신 개발 신제품과 전략제품을 자유롭게 론칭해 중국 화장품 시장을 빠르게 주도해나갈 것”이라고 말했다."
이데일리,252500,/news/news_read.nhn?article_id=0004020215&office_id=018&mode=search&query=세화피앤씨&page=1,2018-01-26 10:25,"코스닥, 900선 넘겨&hellip;세화피앤씨 상한가","- 개인투자자 574억원 순매수 [이데일리 윤필호 기자] 코스닥이 개인 투자자의 매수세에 힘입어 900선을 재돌파했다. 26일 마켓포인트에 따르면 오전 10시14분 현재 코스닥 지수는 전 거래일 대비 6.24포인트, 0.69% 오른 904.84를 기록 중이다. 장중 기준으로 지난 24일 이후 2거래일 만이고 종가기준으로 16일(901.23) 이후 8거래일만이다. 개인 투자자가 574억원 순매수로 지수 상승을 견인하고 있다. 기관도 2억원 순매수 중이다. 투신(42억원)을 비롯해 연기금(25억원), 사모펀드(21억원) 등이 매수 우위를 보이고 있다. 반면 외국인은 526억원 순매도를 기록하고 있다. 시가총액 상위 종목은 대체로 상승세다. 셀트리온(068270)이 0.45% 오른 가운데 셀트리온헬스케어(091990)와 셀트리온제약(068760)도 각각 3.85%와 0.51% 상승 중이다. 신라젠(215600)과 바이로메드(084990)도 나란히 상승세고 CJ E&M(130960) 펄어비스(263750) 로엔(016170) 코미팜(041960) 파라다이스(034230) 등도 상승 곡선을 그리고 있다. 반면 티슈진 메디톡스(086900) 포스코켐텍(003670) 휴젤(145020) 스튜디오드래곤(253450) 등은 하락세다. 업종별로도 상승업종 수가 더 많다. 디지털컨텐츠가 3% 넘게 오른 가운데 컴퓨터서비스(2.86%), 유통(2.85%), IT SW&SVC(2.00%), 방송서비스(1.30%), 통신방송서비스(1.16%) 등도 상승 중이다. 이밖에 기계·장비, 오락·문화, 소프트웨어, 화학, IT부품, 금속 등도 매수 우위다. 반면 종이·목재, 섬유·의류, 인터넷, 음식료·담배, 비금속 등은 하락세다."
머니투데이,252500,/news/news_read.nhn?article_id=0004032908&office_id=008&mode=search&query=세화피앤씨&page=1,2018-04-03 16:15,"타이거자산운용 외 3인, 세화피앤씨 주식 전량 처분",[머니투데이 김태현 기자] 세화피앤씨는 전문사모집합투자업체 타이거자산운용투자자문을 포함한 특별관계자 3인이 보유 중인 회사 주식 100만7917주(5.29%) 전량을 장내매도 했다고 3일 공시했다.
한국경제TV,252500,/news/news_read.nhn?article_id=0000598710&office_id=215&mode=search&query=세화피앤씨&page=1,2018-02-05 10:39,"세화피앤씨, 전일 대비 약 -6% 하락한 4,580원","[한국경제TV 라이온봇 기자] 세화피앤씨는 2월 5일 10시 39분 전일 대비 약 -6% 하락한 4,580원에 거래되고 있다. 세화피앤씨는 코스닥 상장 기업으로 화학 업종에 속해 있다. 시가총액은 928억원으로 코스닥 상장기업 중 687위에 위치 해 있다. [종목 성향 진단] [그림 1] 종목 성향 진단 세화피앤씨의 투자 스타일은 성장주에 가깝다. 주가 고평가 우려가 공존하지만 높은 성장성이 기대되는 기업이다. 주가 모멘텀은 눈에 띄는 성장세를 기록했다. 최근 6개월 수익률이 무려 117.15%의 상승폭을 기록했다. 최근 1개월 수익률 또한 110.13% 상승하며 굉장히 좋은 모멘텀을 보이고 있다. 세화피앤씨종목에 대한 투자자의 관심도는 높은 편에 속한다. [투자 점수 진단] [그림 2] 투자 점수 진단 세화피앤씨는 안정성(부채비율) 측면에서 두각을 나타내고 있다. 최근 부채비율은 67점으로 6개의 핵심 팩터 중 가장 높은 점수를 기록했다. 부채비율은  전체 시장 내 676위를 기록하며 상위 33.3%에 위치했다. 업종별로는 136위를 기록하며 상위 32.15%에 위치했다. 그리고 수익성(영업이익률) 역시 도드라지는 편이다. 수익성 점수는 60점으로 두번째로 높은 점수를 기록했다. 영업이익률은 전체 시장 내 788위를 기록하며 상위 40.34%에 위치했다. 업종별로는 138위를 기록하며 상위 34.68%에 위치했다. 그러나 PER이 아쉬움을 나타냈다. [종합 투자점수] [그림 3] 종합 투자점수 AI 인공지능 분석을 통한 세화피앤씨의 종목 종합 스코어는 56점을 기록했다. 이는 동일 업종 평균점수인 53점보단 높지만, 시장 평균점수인 57점을 하회했다. (위의 AI인공지능 점수는 재무 데이터를 기반으로 전체 상장 종목과 비교/분석하여 도출한 점수로 높은 점수가 반드시 높은 수익률을 보장하지 않습니다. 위의 자료는 당사의 추천 종목이 아니며, 투자 시 참고용으로 제시해드리는 것입니다.) 라이온봇 기자 -한국경제TV※ 본 기사는 한국경제TV와 '거장들의 투자공식이'자체 개발한 '라이온봇 기자'가 실시간으로 작성한 기사입니다. 라이온봇기자 ⓒ 한국경제TV, 무단 전재 및 재배포 금지 한국경제TV 관련뉴스해당 언론사에서 선정하며 언론사 페이지(아웃링크)로 이동해 볼 수 있습니다.'오달수의 그녀' 채국희, 승무원 출신? 채시라 동생?도도맘 전 남편 조용제 씨 ""불륜사건은 강용석과 나와의 싸움""박삼구 아시아나 회장도 성추행 논란…승무원들 상대로?'굿모닝FM 하차' 문지애 집…""아나운서 집이 왜 이래""태양♥민효린 결혼, 영화 포스터같은 웨딩화보 '시선집중'"
파이낸셜뉴스,252500,/news/news_read.nhn?article_id=0003953636&office_id=014&mode=search&query=세화피앤씨&page=1,2018-01-29 09:41,"[fnRASSI]세화피앤씨(252500), 52주 신고가...17.29% &uarr;","세화피앤씨(252500)는 52주신고가를 기록하고 있어 주목할만하다. 동종목의 현재 주가는 5,630원 선에서 이루어지고 있다. 거래일을 기준으로 최근 3일간 평균 거래량은 262만 주이다. 이는 60일 일 평균 거래량 128만 주와 비교해보면 최근 거래량이 급격히 늘어났다는 것을 알 수 있다. 주가등락폭이 너무 커 최근 한달간 세화피앤씨의 상장주식수 대비 거래량을 비교해보니 일별 매매회전율이 3.3%로 집계됐다. 동기간 일평균 주가변동률은 10.06%로 장중 주가등락이 심하기 때문에 투자시 주의가 요망된다. 외국인과 개인은 순매도, 기관은 순매수(한달누적)  전일 기관이 900주를 순매수했고, 외국인은 933주를 순매도했다. 4주간을 기준으로 보면 기관이 방향성있는 매매를 하면서 90,293주를 순매수한 반면, 외국인은 매도 우위를 지속하면서 25,275주를 순매도했고, 개인들도 매도쪽으로 방향을 잡으면서 65,018주를 순매도했다. 'fnRASSI'는 증권전문 기업 씽크풀과 파이낸셜뉴스의 협업으로 로봇기자가 실시간으로 생산하는 기사입니다."
파이낸셜뉴스,252500,/news/news_read.nhn?article_id=0004018964&office_id=014&mode=search&query=세화피앤씨&page=1,2018-05-11 09:16,[fnRASSI]세화피앤씨(252500) 8.85% 상승,"세화피앤씨(252500)는 현재 주가가 전일 대비 8.85% 상승한 7,130원 선에서 거래가 이루어지고 있다. 외국인, 기관 모두 보유량 증가 (5일 누적) 최근 5일간 동종목의 외국인 투자자는 874주 순매수하였고 마찬가지로 기관은 2,573주 순매수하였다. 전날 외국인 15,545주 순매도, 기관2,573주 순매수하며 보유 비율이 변동했다. 다음 표는 동종목의 외국인, 기관의 일별 순매수량을 나타낸 것이다. 주요 매매주체는 개인투자자  최근 한달간 주체별 거래비중을 살펴보면 개인 비중이 97.2%로 가장 높았고, 외국인이 2.63%로 그 뒤를 이었다. 기관은 0.16%를 나타냈다. 그리고 최근 5일간 거래비중은 개인이 96.15%로 가장 높은 참여율을 보였고, 외국인이 3.81%를 보였으며 기관은 0.02%를 나타냈다. 'fnRASSI'는 증권전문 기업 씽크풀과 파이낸셜뉴스의 협업으로 로봇기자가 실시간으로 생산하는 기사입니다."
서울경제,252500,/news/news_read.nhn?article_id=0003278763&office_id=011&mode=search&query=세화피앤씨&page=1,2018-04-24 09:32,"&lt;코&gt;세화피앤씨, 장중 신고가 돌파.. 7,850&rarr;8,140(▲290)","[서울경제] 오전 9시 30분 현재 세화피앤씨(252500) 가 25.04% 오른 8,140원(▲1,630)을 기록하며, 52주 신고가를 +290원 경신했다. 기존 52주 최고가는 2018년 04월 20일 기록한 7,850원이다. 체결강도는 133%로 강세를 유지했다. 총매수체결량은 2,292,662주, 총매도체결량은 1,724,448주를 각각 기록했다.  (※ 체결강도(%) = (총매수체결량/총매도체결량)*100) 이 시각 현재 거래대금은 307억7,016만, 거래량은 411만4,381주를 기록하고 있으며, 수급측면으로는 43(매도):57(매수)의 매수우위를 보이고 있다. 거래일을 기준으로 최근 3일간 평균 거래량은 3백2십3만3천주, 60일 평균 거래량 2백8십4만3천주로 최근 거래량이 증가하는 추세다."
서울경제,252500,/news/news_read.nhn?article_id=0003377543&office_id=011&mode=search&query=세화피앤씨&page=1,2018-08-23 09:31,"&lt;코&gt;세화피앤씨, 전일 대비 7.03% 상승.. 일일회전율은 3.75% 기록","[서울경제] 세화피앤씨(252500) 는 23일 오전 9시 30분 현재 7.03% 오른 4,945원에 거래되고 있으며, 47(매도):53(매수)의 매수우위를 기록하고 있다. 거래대금은 38억5,921만, 거래량은 77만7,843주로 거래량회전율은 3.75%로 나타났다. 지난 1개월간 세화피앤씨는 상승 15회, 하락 14회를 기록했고, 주가수익률은 1.54% 표준편차는 3.73%를 기록했다. 이 기간 ' 화학업 ' 업종 평균 주가수익률은 -4.69%로 나타났으며, 변동성은 1.67%를 기록했다. 이 시각 현재 ' 화학업 '은 1.37% 상승 중이며, 55(매도):45(매수)의 매도우위를 기록하고 있다."
이데일리,252500,/news/news_read.nhn?article_id=0004102431&office_id=018&mode=search&query=세화피앤씨&page=1,2018-05-15 16:34,"세화피앤씨, 1Q 흑자기조&hellip;모레모 국내외 매출 본격화","중국 현지 방송채널 및 국내 H&amp;B스토어 판매 확대 [이데일리 이명철 기자] 코스메틱 전문기업 세화피앤씨(252500)는 분기 보고서를 통해 1분기 매출액 69억원, 영업이익 2억원을 기록했다고 15일 밝혔다. 지난해 1분기 라헨느 볼륨 커버스틱 시즌1 판매 호조에 따른 기저 효과로 상대적으로 실적은 부진한 수준이다. 다만 2분기부터 본격 해외 수출과 오프라인 판매망, 홈쇼핑 방영 횟수 확대 등 공격적인 마케팅 실시로 외형 성장이 가속화될 것으로 예상했다. 회사는 매출 증대를 위해 국내외 유통채널을 강화하고 신제품을 준비하고 있다. 수출의 경우 올해 중동 7개국과 중국 대상으로 판매계약을 체결했다. 중국의 경우 지난달 저장성 자유무역구로부터 사전통관기업으로 지정돼 현지 시장 상황에 맞춰 신제품을 신속하게 출시할 수 있게 됐다. 지난 7일 중국 타오바오닷컴 등 4개 채널을 통해 진행한 첫 생방송에서 완판을 기록했다. 중국에서 가장 영향력 있는 마케팅 채널인 인터넷 스타 왕홍을 통해 마케팅 효과를 극대화한 것이 특징이다. 오는 28일와 30일에는 2차 생방송과 중국 최대 홈쇼핑 해피고에서 판매를 진행할 예정이다. 국내에서는 지난해 12월 롯데쇼핑 롭스를 시작으로 토탈케어 화장품 모레모 판매를 위해 다양한 H&B스토어에 입점을 추진 중이다. 2월에는 신세계 시코르, 4월 GS리테일 랄라블라(옛 왓슨스) 입점을 완료했다. 헤어케어 제품뿐 아니라 4월 출시한 선케어를 시작으로 다양한 스킨케어 제품 출시를 준비하고 있다. 이훈구 대표이사는 “적극적인 경영 활동을 통해 외형 성장을 시현하는 중으로 2분기부터 모레모 해외 매출 발생이 본격화될 것”이라며 “국내 주요 H&B스토어 입점 제품 라인업 확대와 신제품 출시를 계획하고 있어 판매 실적 증가로 이어질 것”이라고 말했다."
파이낸셜뉴스,252500,/news/news_read.nhn?article_id=0003993477&office_id=014&mode=search&query=세화피앤씨&page=1,2018-04-02 09:22,"[fnRASSI]세화피앤씨(252500), 52주 신고가...15.74% &uarr;","세화피앤씨(252500)는 52주신고가를 기록하고 있어 주목할만하다. 동종목의 현재 주가는 6,250원 선에서 이루어지고 있다. 거래일을 기준으로 최근 3일간 평균 거래량은 374만 주이다. 이는 60일 일 평균 거래량 196만 주와 비교해보면 최근 거래량이 다소 증가했다는 것을 알 수 있다. 외국인 보유량 증가, 기관 감소 (5일 누적) 최근 5일간 동종목의 외국인 투자자는 17,800주 순매수하였고 반면 기관은 0주 순매도하였다. 전날 외국인은 6,482주 순매수했지만 기관은 순매수량이 0으로 보유비율 그대로 유지했다. 다음 표는 동종목의 외국인, 기관의 일별 순매수량을 나타낸 것이다. 퀀트 재무분석, 종합점수 16점으로 상승                    지표               항목               값               종합점수                 성장성               매출액증가율               0               4.59                 자기자본증가율               0                 안정성               부채비율               40.86               7.5                 유동비율               274.21                 이익안정성               0                 수익성               ROA               -43.52               3.27                 ROE               -61.3                 영업이익율               6.19          세화피앤씨의 퀀트 재무 점수는 15.36점으로 3개월 이전 15.31점보다 올랐다. 지난 분기에 비해 성장성 점수가 상승했다. 'fnRASSI'는 증권전문 기업 씽크풀과 파이낸셜뉴스의 협업으로 로봇기자가 실시간으로 생산하는 기사입니다."
한국경제,252500,/news/news_read.nhn?article_id=0003884062&office_id=015&mode=search&query=세화피앤씨&page=1,2018-01-25 09:20,"[특징주]세화피앤씨, 화장품 사업 성장 기대감에 '상한가'","세화피앤씨가 화장품 사업 성장에 대한 기대감에 급등 중이다. 장중 상한가를 나타냈다. 25일 오전 9시18분 현재 세화피앤씨는 전날보다 850원(29.88%) 오른 3695원을 기록중이다. 현재 가격제한폭까지 오른 상태다. 중동에서 론칭한 화장품 브랜드 '모레모'의 판매 흥행 소식을 회사 측이 알리면서 주가는 급등했다. 회사는 지난해 5월 두바이에 론칭한 모레모가 8개월만에 아랍에미리트(UAE), 이라크, 요르단 등 중동 지역에서 월 4만~5만개씩 판매되고 있다고 밝혔다."
