source,symbol,link,date,title,content
파이낸셜뉴스,252500,/news/news_read.nhn?article_id=0003876548&office_id=014&mode=search&query=세화피앤씨&page=1,2017-09-19 10:39,"글로벌텍스프리, 세화피앤씨 코스닥 신규상장 기념식","한국거래소는 19일 서울 여의도 사옥에서 내국세 환급대행 서비스업체인 글로벌텍스프리(주) 및 염모제 개발, 제조업체인 (주)세화피앤씨의 코스닥시장 신규상장기념식을 개최했다. (왼쪽부터)최규준 한국IR협의회 부회장, 최영수 유안타증권 IB사업 부문장, 김재준 한국거래소 코스닥시장위원회 위원장, 강진원 글로벌텍스프리(주) 대표이사, 이훈구 (주)세화피앤씨 대표이사, 신성호 IBK투자증권 대표이사, 송윤진 코스닥협회 부회장이 기념촬영을 하고 있다."
한국경제TV,252500,/news/news_read.nhn?article_id=0000613431&office_id=215&mode=search&query=세화피앤씨&page=1,2018-03-21 10:36,"세화피앤씨, 전일 대비 약 -6% 하락한 4,710원","[한국경제TV 라이온봇 기자] 세화피앤씨는 3월 21일 10시 36분 전일 대비 약 -6% 하락한 4,710원에 거래되고 있다. 세화피앤씨는 코스닥 상장 기업으로 화학 업종에 속해 있다. 시가총액은 955억원으로 코스닥 상장기업 중 665위에 위치 해 있다. [종목 성향 진단] [그림 1] 종목 성향 진단 세화피앤씨의 투자 스타일은 성장주에 가깝다. 주가 고평가 우려가 공존하지만 높은 성장성이 기대되는 기업이다. 주가 모멘텀은 부진한 편이었다. 최근 1개월 수익률은 -1.57%의 하락폭을 기록했다. 세화피앤씨 종목에 대한 투자자의 관심도는 높은 편에 속한다. [투자 점수 진단] [그림 2] 투자 점수 진단 세화피앤씨는 안정성(부채비율) 측면에서 두각을 나타내고 있다. 최근 부채비율은 67점으로 6개의 핵심 팩터 중 가장 높은 점수를 기록했다. 부채비율은  전체 시장 내 683위를 기록하며 상위 33.3%에 위치했다. 업종별로는 136위를 기록하며 상위 32.15%에 위치했다. 그리고 수익성(영업이익률) 역시 도드라지는 편이다. 수익성 점수는 60점으로 두번째로 높은 점수를 기록했다. 영업이익률은 전체 시장 내 788위를 기록하며 상위 40.34%에 위치했다. 업종별로는 138위를 기록하며 상위 34.68%에 위치했다. 그러나 PER이 아쉬움을 나타냈다. [종합 투자점수] [그림 3] 종합 투자점수 AI 인공지능 분석을 통한 세화피앤씨의 종목 종합 스코어는 56점을 기록했다. 이는 동일 업종 평균점수인 53점보단 높지만, 시장 평균점수인 56점과 동일한 수준이었다. (위의 AI인공지능 점수는 재무 데이터를 기반으로 전체 상장 종목과 비교/분석하여 도출한 점수로 높은 점수가 반드시 높은 수익률을 보장하지 않습니다. 위의 자료는 당사의 추천 종목이 아니며, 투자 시 참고용으로 제시해드리는 것입니다.) 라이온봇 기자 -한국경제TV※ 본 기사는 한국경제TV와 '거장들의 투자공식이'자체 개발한 '라이온봇 기자'가 실시간으로 작성한 기사입니다. 라이온봇기자 ⓒ 한국경제TV, 무단 전재 및 재배포 금지 한국경제TV 관련뉴스해당 언론사에서 선정하며 언론사 페이지(아웃링크)로 이동해 볼 수 있습니다.노현정, 故 정주영 회장 제사 현장 포착…'더 예뻐졌네'골프여왕 박인비, 외모 때문에 메인스폰서 없었던 사연은?신성일, ""보디빌더 나갔다""던 리즈시절 사진 봤더니설현, 원주민도 반한 사연…만국 공통 몸매?'문재인 대통령 노벨상 추진위' 해산 이유"
파이낸셜뉴스,252500,/news/news_read.nhn?article_id=0003994036&office_id=014&mode=search&query=세화피앤씨&page=1,2018-04-02 15:34,"[fnRASSI]세화피앤씨,롯데관광개발 등 40종목 52주 신고가 경신","02일 세화피앤씨(252500), 롯데관광개발(032350), 엠에스씨(009780), 넥스트BT(065170), 디티앤씨(187220), 바이온(032980)등이 장중 52주 신고가를 경신했다. 특히 세화피앤씨는 전 거래일 대비 30% 오른 7,020원에 거래를 마감하며 높은 관심을 받았다. 'fnRASSI'는 증권전문 기업 씽크풀과 파이낸셜뉴스의 협업으로 로봇기자가 실시간으로 생산하는 기사입니다."
한국경제TV,252500,/news/news_read.nhn?article_id=0000603618&office_id=215&mode=search&query=세화피앤씨&page=1,2018-02-19 09:36,"세화피앤씨, 16% 급등... 전일 보다 730원 상승한 5,230원","[한국경제TV 라이온봇 기자] 세화피앤씨는 2월 19일 9시 36분 전일 대비 약 16% 급등한 5,230원에 거래되고 있다. 세화피앤씨는 코스닥 상장 기업으로 화학 업종에 속해 있다. 시가총액은 856억원으로 코스닥 상장기업 중 704위에 위치 해 있다. [종목 성향 진단] [그림 1] 종목 성향 진단 세화피앤씨의 투자 스타일은 성장주에 가깝다. 주가 고평가 우려가 공존하지만 높은 성장성이 기대되는 기업이다. 주가 모멘텀은 눈에 띄는 성장세를 기록했다. 최근 1개월 수익률이 무려 101.79%의 상승폭을 기록했다. 세화피앤씨 종목에 대한 투자자의 관심도는 평범한 수준이었다. [투자 점수 진단] [그림 2] 투자 점수 진단 세화피앤씨는 안정성(부채비율) 측면에서 두각을 나타내고 있다. 최근 부채비율은 67점으로 6개의 핵심 팩터 중 가장 높은 점수를 기록했다. 부채비율은  전체 시장 내 681위를 기록하며 상위 33.3%에 위치했다. 업종별로는 137위를 기록하며 상위 32.15%에 위치했다. 그리고 수익성(영업이익률) 역시 도드라지는 편이다. 수익성 점수는 60점으로 두번째로 높은 점수를 기록했다. 영업이익률은 전체 시장 내 788위를 기록하며 상위 40.34%에 위치했다. 업종별로는 138위를 기록하며 상위 34.68%에 위치했다. 그러나 PER이 아쉬움을 나타냈다. [종합 투자점수] [그림 3] 종합 투자점수 AI 인공지능 분석을 통한 세화피앤씨의 종목 종합 스코어는 56점을 기록했다. 이는 동일 업종 평균점수인 52점보단 높지만, 시장 평균점수인 57점을 하회했다. (위의 AI인공지능 점수는 재무 데이터를 기반으로 전체 상장 종목과 비교/분석하여 도출한 점수로 높은 점수가 반드시 높은 수익률을 보장하지 않습니다. 위의 자료는 당사의 추천 종목이 아니며, 투자 시 참고용으로 제시해드리는 것입니다.) 라이온봇 기자 -한국경제TV※ 본 기사는 한국경제TV와 '거장들의 투자공식이'자체 개발한 '라이온봇 기자'가 실시간으로 작성한 기사입니다. 라이온봇기자 ⓒ 한국경제TV, 무단 전재 및 재배포 금지 한국경제TV 관련뉴스해당 언론사에서 선정하며 언론사 페이지(아웃링크)로 이동해 볼 수 있습니다.고속도로 교통상황 아직 원활, 인천공항 출국장은 '북적'홍진영 근황, 물오른 미모…""30대 몸매 비결은""박지헌만의 성교육 ""야동 보는 게 나쁜 거 아냐""김수희 누구?…서태지 제치고 가요대상 받은 전설윤정수 다이어트, '홀쭉해진' 비결은?"
뉴시스,252500,/news/news_read.nhn?article_id=0008186192&office_id=003&mode=search&query=세화피앤씨&page=1,2017-09-19 12:04,"글로벌 텍스프리, 세화피앤씨 신규상장기념식","【서울=뉴시스】김지현 기자 = 한국거래소 코스닥시장본부가 19일 오전 서울 사옥 홍보관에서 내국세 환급대행 서비스업체인 글로벌텍스프리와 염모제 제조업체 세화피앤씨의 신규 상장 기념식을 개최했다. 왼쪽부터 최규준 한국IR협의회 부회장, 최영수 유안타증권 IB사업 부문장, 김재준 한국거래소 코스닥시장위원회 위원장, 강진원 글로벌텍스프리 대표이사, 이훈구 세화피앤씨 대표이사, 신성호 IBK투자증권 대표이사, 송윤진 코스닥협회 부회장. 2017.09.19. (사진=한국거래소 제공)"
머니투데이,252500,/news/news_read.nhn?article_id=0003984520&office_id=008&mode=search&query=세화피앤씨&page=1,2017-12-27 09:34,"세화피앤씨, '모레모' 화장품 5종 롭스에 공급","[머니투데이 김유경 기자] 세화피앤씨 모레모 제품 '헤어 에센스 딜라이트풀 오일' /사진제공 = 세화피앤씨 코스닥기업 세화피앤씨 의 감성코스메틱 브랜드 '모레모'가 롯데쇼핑의 헬스앤뷰티 드러그스토어 '롭스'에 화장품 신제품 5종을 공급한다고 27일 밝혔다. 신세대 1020 여성층을 겨냥해 내놓은 이번 신제품은 '스칼프 샴푸-클리어 앤 쿨', '손상모 샴푸-레스 이즈 모어', '워터트리트먼트 미라클 10', '미라클 2X 헤어팩', '헤어 에센스 딜라이트풀 오일' 등 헤어케어 5종이다. '워터트리트먼트 미라클 10'은 물미역 트리트먼트로 유명한 워터트리트먼트의 제형과 성분을 획기적으로 개선한 신제품이며, '미라클2X 헤어팩'도 여성들에게 머스트해브 아이템으로 폭발적인 인기를 끌고 있는 헤어팩을 업그레이드한 제품이다. 세화피앤씨 '모레모' 브랜드는 최근 중국식약총국(CFDA)으로부터 헤어-기초 화장품 5종에 대한 화장품 인허가를 취득했고, 추가로 6종에 대한 인허가 절차를 진행하는 등 내년초 중국 화장품시장 진출을 서두르고 있다. 이훈구 세화피앤씨 대표는 ""1020 신세대 여성들이 애용하는 드러그스토어 '롭스'를 통해 모레모 화장품을 공급하게 돼 판매량이 크게 늘 것으로 기대한다""며 ""어디서든 '모레모'를 쉽게 만나볼 수 있게 유통채널을 확대해 나갈 것""이라고 말했다. 1976년에 설립된 세화피앤씨는 고농축 헤나추출 기술과 염모제 포물레이션 기술을 다수 보유한 코스메틱 전문기업으로 '리체나', '라헨느', '프리모' 등 염색약과 헤어화장품을 50여개국에 수출하고 있다. 지난해 감성 코스메틱 브랜드 '모레모'를 론칭하고 중국시장 진출을 앞두고 있다."
이데일리,252500,/news/news_read.nhn?article_id=0004085889&office_id=018&mode=search&query=세화피앤씨&page=1,2018-04-24 09:51,"47조 中 화장품 '하이패스' 세화피앤씨, 세계 최고 수준 고농축 헤나 '날개달다...","기존 5개월 이상 걸리던 중국 식약처 인허가 7일로 단축세계 최고 수준 고농축 헤나 추출·염모제 포뮬레이션 기술 보유 [이데일리 박형수 기자] 국내 중소 화장품 업체가 중국 절강성 자유무역구가 공인하는 사전통관 기업으로 선정됐다. 사드 보복조치 완화 조짐이 국내 기업 중국 진출로 이어지는 모양새다. 24일 오전 9시46분 세화피앤씨(252500)는 전날보다 17.36% 오른 7640원에 거래되고 있다. 세화피앤씨는 이날 세계 유수의 화장품 기업과 함께 중국 절강성 자유무역구가 공인하는 사전통관 기업으로 선정됐다고 밝혔다. 세화피앤씨는 지난 17일 중국 절강성 자유무역지구가 해외 화장품 기업을 대상으로 개최한 ‘비특수화장품 사전통관제 오픈식’에서 샤넬, 로레알 등 40여개 글로벌 화장품 기업과 어깨를 나란히 하고 사전통관제 허가기업으로 선정돼 증서를 발급받았다. 국내 기업으로는 세화피앤씨 외에 아모레, 엘지생활건강 등 대기업이 포함된 것으로 알려졌다. 앞으로 세화는 기존 5개월에서 일년까지 걸렸던 중국 식약처의 인허가 과정을 7일간 테스트 및 서류 심의로 단축, 모든 제품을 단기간에 중국 시장에 출시할 수 있다. 사전통관제는 중국 내 대기업이나 국영기업이 제품 품질을 보증하고 책임진다는 조건에 수입제품에 대한 인허가를 파격적으로 단축해 주는 특별 허가제도다. 철저한 검토와 심사 과정으로 인해 글로벌 대기업조차 탈락한 기업이 많았던 것으로 알려졌다. 이훈구 세화피앤씨 대표이사는 “절강성 자유무역구에서 시행한 해외 화장품 사전통관 기업에 국내 화장품 업계 최초로 선정된 것은 세화피앤씨는 물론 K-뷰티업계 쾌거”라며 “통관 기간과 절차가 획기적으로 단축함에 따라 당사의 최신 개발 신제품과 전략 제품을 자유롭고 탄력적으로 론칭해 중국 화장품 시장을 발 빠르게 주도해 나갈 것”이라고 말했다. 세화피앤씨는 지난 2월 코나인터내셔널과 106억원 규모의 중국시장 독점 공급 계약을 체결하고 4월부터 본격적으로 수출하고 있다. 사전 통관 기업 선정으로 중국 시장 확대에 더욱 박차를 가할 것으로 기대했다. 유로모니터에 따르면 2016년 중국 화장품시장 규모는 2735억위안(약 47조원)이고 2021년까지 연평균 5.05% 증가하며 3499억위안(약 60조원)까지 확대될 것으로 예측된다. 세화피앤씨는 지난 1976년 설립한 코스닥 상장사로 세계 최고수준의 고농축 헤나 추출 기술과 염모제 포뮬레이션기술을 다수 보유하고 있다. ‘리체나, ‘라헨느’, ‘프리모’, ‘모레모’ 등 염색약과 헤어 화장품 브랜드로 전세계 50여개국에 제품을 수출하며 인지도를 강화해 나가고 있다. 앞서 외교부는 20일 중국 베이징(北京) 중국 상무부에서 제22차 한·중 경제공동위원회를 열고 상호 경제협력을 강화하기 위해 폭넓은 논의를 했다. 지난 2016년 4월 제21차 회의 이후 2년 만에 열렸다. 외교부에 따르면 우리 측은 전기차 배터리 보조금, 롯데마트 행정규제 및 매각, 선양 롯데월드 프로젝트, 중국인 방한 단체관광, 문화 콘텐츠 등 분야에서의 기업 애로사항이 조속히 해소될 수 있도록 중국의 전향적 조치를 요청했다. 중국 측은 지난 3월 양제츠 중국 공산당 정치국 위원 방한 이후 우리 관련 기업의 애로 해소를 위한 해당 부처 및 지방정부와의 긴밀한 논의가 진행 중이라고 설명하고 한국 정부 및 관련 기업들과 지속적으로 소통해 나가겠다고 답했다. 손윤경 SK증권 연구원은 “사드 갈등이 있는 동안 가파르게 상승한 위안화 가치가 중국인의 구매력을 향상시켰다”며 “한국 상품에 대한 회복 수요를 폭발시키고 있는 것으로 보인다”고 설명했다. 이어 “중국인 관광객 증가가 본격화될 때 내수 전반의 호조를 기대해볼 만하다”고 덧붙였다."
뉴시스,252500,/news/news_read.nhn?article_id=0008364086&office_id=003&mode=search&query=세화피앤씨&page=1,2017-12-27 16:58,"세화피앤씨, 롭스에 '모레모' 화장품 5종 공급","【서울=뉴시스】류난영 기자 = 세화피앤씨는 감성코스메틱 브랜드 '모레모'가 롯데쇼핑이 운영하는 헬스앤뷰티 드러그스토어 '롭스'에 화장품 신제품 5종을 공급한다고 27일 밝혔다. 이번에 롭스에 공급하는 화장품 신제품은 '스칼프 샴푸-클리어 앤 쿨', '손상모 샴푸-레스 이즈 모어', '워터트리트먼트 미라클 10', '미라클 2X 헤어팩', '헤어 에센스 딜라이트풀 오일' 등 헤어케어 5개 모델이다. 워터트리트먼트 미라클 10은 워터트리트먼트의 제형과 성분을 개선한 신제품이다. 미라클2X 헤어팩도 여성들에게 머스트해브 아이템으로 인기를 끌고 있는 헤어팩을 업그레이드한 제품이다. 롭스는 롯데쇼핑 H&B사업부가 운영하는 토종 드러그스토어로 2013년에 론칭한 이후 4년만에 100여개 매장을 거느린 젊은층의 쇼핑놀이터로 급성장하고 있다. 세화피앤씨 '모레모' 브랜드는 최근 중국식약총국(CFDA)으로부터 헤어-기초 화장품 5종에 대한 화장품 인허가를 취득했고 추가로 6종에 대한 인허가 절차를 진행하는 등 내년초 중국 화장품시장 진출을 앞두고 있다."
이데일리,252500,/news/news_read.nhn?article_id=0004027507&office_id=018&mode=search&query=세화피앤씨&page=1,2018-02-05 17:51,"세화피앤씨, 작년 영업익 18.4억&hellip;전년比 20.59%&darr;","[이데일리 윤필호 기자] 세화피앤씨(252500)는 지난해 개별기준 영업이익이 전년 대비 20.59% 감소한 18억4972만원으로 집계됐다고 5일 공시했다. 같은 기간 매출액은 13.45% 늘어난 331억7132만원, 당기순손실은 25억8291만원을 기록하며 적자전환했다."
서울경제,252500,/news/news_read.nhn?article_id=0003259055&office_id=011&mode=search&query=세화피앤씨&page=1,2018-04-02 09:42,"(코)세화피앤씨, 상한가 진입.. +30.00% &uarr;","[서울경제] 오전 9시 40분 현재 세화피앤씨(252500) 가 +30.00% 오른 7,020원(▲1,620)으로 장중 상한가에 진입했다. 거래대금은 307억5,390만, 거래량은 485만3,955주를 기록하고 있으며, 수급측면으로는 37(매도):63(매수)의 매수우위를 보이고 있다. 세화피앤씨는 전일 상승(5,400원, ▲240, +4.65%)한데 이어 이틀 연속 상승세를 이어가고 있다. 지난 1개월간 세화피앤씨는 상한가 1회, 상승 12회, 하락 15회를 기록했고, 주가수익률은 56.00%였다. 이 기간 ' 화학업 ' 업종 평균 주가수익률은 9.39%를 기록했다. 현재 ' 화학업 ' 총 63개 종목 중 상한가 종목은 1개, 상승 종목은 32개로, 일부 종목만이 상승세를 보이고 있다. ( 코스온(069110) +16.07%, 코리아나(027050) +10.49%, 연우(115960) +9.18%)"
한국경제TV,252500,/news/news_read.nhn?article_id=0000600218&office_id=215&mode=search&query=세화피앤씨&page=1,2018-02-07 09:38,"세화피앤씨, 전일 대비 약 4% 상승한 4,415원","[한국경제TV 라이온봇 기자] 세화피앤씨는 2월 7일 9시 38분 전일 대비 약 4% 상승한 4,415원에 거래되고 있다. 세화피앤씨는 코스닥 상장 기업으로 화학 업종에 속해 있다. 시가총액은 808억원으로 코스닥 상장기업 중 736위에 위치 해 있다. [종목 성향 진단] [그림 1] 종목 성향 진단 세화피앤씨의 투자 스타일은 성장주에 가깝다. 주가 고평가 우려가 공존하지만 높은 성장성이 기대되는 기업이다. 주가 모멘텀은 굉장히 좋은 편이었다. 최근 3개월 수익률이 무려 87%의 상승폭을 기록했다. 최근 1개월 수익률 또한 82.58% 상승하며 굉장히 좋은 모멘텀을 보이고 있다. 세화피앤씨 종목에 대한 투자자의 관심도는 높은 편에 속한다. [투자 점수 진단] [그림 2] 투자 점수 진단 세화피앤씨는 안정성(부채비율) 측면에서 두각을 나타내고 있다. 최근 부채비율은 67점으로 6개의 핵심 팩터 중 가장 높은 점수를 기록했다. 부채비율은  전체 시장 내 676위를 기록하며 상위 33.3%에 위치했다. 업종별로는 136위를 기록하며 상위 32.15%에 위치했다. 그리고 수익성(영업이익률) 역시 도드라지는 편이다. 수익성 점수는 60점으로 두번째로 높은 점수를 기록했다. 영업이익률은 전체 시장 내 788위를 기록하며 상위 40.34%에 위치했다. 업종별로는 138위를 기록하며 상위 34.68%에 위치했다. 그러나 PER이 아쉬움을 나타냈다. [종합 투자점수] [그림 3] 종합 투자점수 AI 인공지능 분석을 통한 세화피앤씨의 종목 종합 스코어는 56점을 기록했다. 이는 동일 업종 평균점수인 53점보단 높지만, 시장 평균점수인 57점을 하회했다. (위의 AI인공지능 점수는 재무 데이터를 기반으로 전체 상장 종목과 비교/분석하여 도출한 점수로 높은 점수가 반드시 높은 수익률을 보장하지 않습니다. 위의 자료는 당사의 추천 종목이 아니며, 투자 시 참고용으로 제시해드리는 것입니다.) 라이온봇 기자 -한국경제TV※ 본 기사는 한국경제TV와 '거장들의 투자공식이'자체 개발한 '라이온봇 기자'가 실시간으로 작성한 기사입니다. 라이온봇기자 ⓒ 한국경제TV, 무단 전재 및 재배포 금지 한국경제TV 관련뉴스해당 언론사에서 선정하며 언론사 페이지(아웃링크)로 이동해 볼 수 있습니다.이은하, 쿠싱증후군 투병 중에도 일해야 했던 속사정""그만 좀 괴롭혀"" 하리수 악플 고소에 누리꾼 '씁쓸'태진아 집 공개, 화려한 신발들 '시선집중'""따스한 햇살이 좋았던 하루"" 김희애 나이 잊은 근황최영미 시인 성추행 폭로 '재조명', ""교활한 늙은이"""
한국경제TV,252500,/news/news_read.nhn?article_id=0000667675&office_id=215&mode=search&query=세화피앤씨&page=1,2018-08-01 14:36,"세화피앤씨, 5거래일 연속 상승... 전일 대비 6% 상승","[한국경제TV 라이온봇 기자] [그림 1] 최근 3개월 간 주가 추세 및 기간별 수익률 세화피앤씨는 현재 5거래일 연속 상승세를 기록하고 있어 주목할 만하다. 세화피앤씨는 8월 1일 14시 36분 전일 대비 약 6% 상승한 4,805원에 거래되고 있다. 세화피앤씨는 코스닥 상장 기업으로 화학 업종에 속해 있다. 시가총액은 941억원으로 코스닥 상장기업 중 652위에 위치 해 있다. [종목 성향 진단] [그림 2] 종목 성향 진단 세화피앤씨의 투자 스타일은 성장주에 가깝다. 주가 고평가 우려가 공존하지만 높은 성장성이 기대되는 기업이다. 주가 모멘텀은 부진한 편이었다. 최근 3개월 수익률은 -36.86%의 하락폭을 기록했다. 최근 1개월 수익률 또한 -7.06% 하락하며 부진한 모멘텀을 이어가고 있다. 세화피앤씨 종목에 대한 투자자의 관심도는 평범한 수준이었다. [투자 점수 진단] [그림 3] 투자 점수 진단 세화피앤씨는 어느 측면에서 투자 매력도가 높은 종목일까? AI 인공지능 종목 분석 시스템을 이용해 성장성, 수익성, 효율성, 안전성, 저평가성, 추세 등 주가 수익률에 영향을 줄 수 있는 6가지 핵심 투자 지표를 점수화하여 종목의 투자 매력도를 계산해보았다. 그 결과 세화피앤씨는 상대적으로 기업안정성 측면에서 두각을 드러내고 있었다. 기업안정성 점수는 기업의 재무 구조가 얼마나 안정적인 상태인지를 나타낸다. 세화피앤씨는 특히 부채비율 측면에서 가장 높은 점수는 기록했는데, 전체 시장 내 209위를 기록하며 상위 10.42%에 위치했다. 업종별로는 38위를 기록하며 상위 9.05%에 위치했다. 그러나 기업 가치 대비 주가 수준을 나타내는 저평가 측면에서는 아쉬움을 나타냈다. (위의 AI인공지능 점수는 재무 데이터를 기반으로 전체 상장 종목과 비교/분석하여 도출한 점수로 높은 점수가 반드시 높은 수익률을 보장하지 않습니다. 위의 자료는 당사의 추천 종목이 아니며, 투자 시 참고용으로 제시해드리는 것입니다. 핵심투자지표를 결합해 종목의 투자매력도를 종합 계산한 ""인공지능 투자점수""는 ""거장들의 투자공식"" 앱에서 확인하실 수 있습니다.) 라이온봇 기자 -한국경제TV※ 본 기사는 한국경제TV와 '거장들의 투자공식이'자체 개발한 '라이온봇 기자'가 실시간으로 작성한 기사입니다. 라이온봇기자"
파이낸셜뉴스,252500,/news/news_read.nhn?article_id=0003987161&office_id=014&mode=search&query=세화피앤씨&page=1,2018-03-22 09:38,"[특징주]세화피앤씨, 이란 화장품 진출 소식에 강세",세화피앤씨가 3조6000억원 규모의 이란 화장품시장 진출 소식에 급등세다. 22일 오전 9시 36분 현재 코스닥시장에서 세화피앤씨는 전일 대비 11.51% 오른 5230원에 거래되고 있다. 세화피앤씨는 최근 이란식품의약국으로부터 주요 제품 8종에 대한 화장품 유통판매 인허가 승인을 완료했다. 세화피앤씨는 이란 현지 파트너를 통해 유통채널을 확대하고 공격적인 마케팅을 펼칠 것으로 알려졌다.
