source,symbol,link,date,title,content
한국경제,258540,/news/news_read.nhn?article_id=0003949073&office_id=015&mode=search&query=스템랩&page=1,2018-05-28 15:09,"스템랩, 보건복지부 주관 `국책과제` 사업자 선정","[ 김진성 기자  ] 바이오 벤처기업 스템랩이 보건복지부가 주관하는 ‘유도 신경줄기세포를 이용한 척수손상질환 치료제 개발 국책 과제’ 사업자로 선정됐다. 이 회사는 앞으로 3년간 정부 지원금을 포함해 총 13억원 규모의 사업비를 이번 연구개발에 투자할 계획이다. 스템랩은 유도 신경줄기세포 치료제의 생산공정 확립을 담당하고, 이 회사와 협업하고 있는 고려대학교는 척수손상질환 동물모델을 이용한 유효성 및 안전성 평가를 맡는다. 스템랩은 고려대학교 유승권 생명공학부 교수가 보유한 직접 교차분화(Direct reprogramming) 원천기술을 사업화한 바이오 벤처기업이다. 세계 최초로 직접 교차분화기법을 사업화, 자가 신경줄기세포 및 희소돌기아교세포를 이용한 중추신경계통 질환 치료법을 연구하고 있다. 2016년 11월 코넥스시장에 상장했다. 오동훈 스템랩 대표는 “이번 국책과제 사업자로 선정된 덕분에 세계 최초로 유도 신경줄기세포 치료제를 개발하는 임상시험을 진행할 수 있는 기반을 마련했다”고 말했다."
이데일리,258540,/news/news_read.nhn?article_id=0003687986&office_id=018&mode=search&query=스템랩&page=1,2016-11-29 11:00,[포토]시큐센&middot;스템랩 코넥스시장 신규상장,"[이데일리 유재희 기자] 한국거래소 코스닥시장본부는 29일 오전 서울사옥 홍보관에서 보안SI 및 생체인식바이오인증 전문기업인 시큐센과 줄기세포치료제 개발 및 전자의료기기 제조업체인 스템랩의 코넥스시장 신규상장 기념식을 개최했다. 왼쪽부터 임승원 한국IR협의회 부회장, 김성현 KB투자증권 IB총괄 대표, 김재준 한국거래소 코스닥시장위원회 위원장, 오동훈 스탬랩 대표이사, 김제호 시큐센 대표이사, 신성호 IBK투자증권 대표이사, 김군호 코넥스협회 회장 (사진: 한국거래소)"
뉴스1,258540,/news/news_read.nhn?article_id=0002418919&office_id=421&mode=search&query=스템랩&page=1,2016-11-29 09:44,(주)시큐센 및 (주)스템랩 코넥스시장 신규상장기념식,"한국거래소 코스닥시장본부는 29일 오전 서울사옥 홍보관에서 (주)시큐센 및 (주)스템랩의 코넥스시장 신규상장기념식을 개최했다. 상장기념패 전달 후 임승원 한국IR협의회 부회장(왼쪽부터), 김성현 KB투자증권 IB총괄 대표, 김재준 한국거래소 코스닥시장위원회 위원장, 오동훈 (주)스탬랩 대표이사, 김제호 (주)시큐센 대표이사, 신성호 IBK투자증권 대표이사, 김군호 코넥스협회 회장이 기념촬영을 하고 있다. (한국거래소 제공) 2016.11.29/뉴스1"
매일경제,258540,/news/news_read.nhn?article_id=0004158074&office_id=009&mode=search&query=스템랩&page=1,2018-05-28 09:46,"스템랩, 보건복지부 주관 `국책과제` 사업자 최종 선정","[사진제공 : 스템랩] 코넥스 상장기업 스템랩은 보건복지부가 주관하는 '유도 신경줄기세포를 이용한 척수손상질환 치료제 개발 국책 과제' 사업자로 최종 선정됐다고 28일 밝혔다. 이에 따라 스템랩은 고려대학교와 척수손상질환 치료를 위한 줄기세표 치료제 개발 과제를 수행하게 됐다. 이번 보건복지부 국책 과제로 선정되면서, 스템랩은 앞으로 3년 동안 정부지원금 포함하여 총 13억 원 규모의 사업비를 연구에 투자하게 된다. 국책 과제 기간 동안, 스템랩은 유도신경줄기세포 치료제의 생산 공정 확립을 담당하고 고려대학교는 척수손상질환 동물모델을 이용한 유효성 및 안전성 평가를 맡아 진행한다. 오동훈 스템랩 대표는 ""이번 국책과제 선정으로 한국은 직접교차분화 기술로 유도한 신경줄기세포의 임상시험을 세계 최초로 진행할 수 있는 기반을 마려하게 됐다""고 설명했다. 스템랩은 고려대학교 유승권 생명공학부 교수가 보유한 직접교차분화 (direct reprogramming) 원천 기술을 사업화한 바이오 벤처기업이다. 세계 최초로 직접교차분화기법을 사업화하는 사업모델을 바탕으로, 현재 자가 신경줄기세포 및 희소돌기아교세포를 이용한 중추신경계통의 질환을 치료를 연구 중이다. 또, 줄기세포를 이용한 탈모 치료 기술을 개발하고 있다. [디지털뉴스국 이상규 기자] r_start // r_end //"
연합뉴스,258540,/news/news_read.nhn?article_id=0008854185&office_id=001&mode=search&query=스템랩&page=1,2016-11-29 09:42,㈜시큐센&middot;㈜스템랩 코넥스시장 신규상장기념식,"(서울=연합뉴스) 29일 오전 서울 여의도 한국거래소에서 보안SI 및 생체인식바이오인증 전문기업인 ㈜시큐센 및 줄기세포치료제 개발 및 전자의료기기 제조업체인 ㈜스템랩의 코넥스시장 신규상장기념식이 열리고 있다. 왼쪽부터 임승원 한국IR협의회 부회장, 김성현 KB투자증권 IB총괄 대표, 김재준 한국거래소 코스닥시장위원장, 오동훈 ㈜스탬랩 대표이사, 김제호 ㈜시큐센 대표이사, 신성호 IBK투자증권 대표이사, 김군호 코넥스협회장. 2016.11.29 [한국거래소 제공=연합뉴스]"
파이낸셜뉴스,258540,/news/news_read.nhn?article_id=0003761063&office_id=014&mode=search&query=스템랩&page=1,2017-01-11 09:29,"[fnRASSI]스템랩, 14.93% 오르며 거래량 증가","스템랩은 투자자들의 관심으로 당일 거래량이 최근 5거래일 거래량의 최고치를 경신했다. 그리고 스템랩은 6일 연속 상승흐름을 보이며, 9시 14분 현재 14.93% 증가한 11,550원에 거래중이다.  
 'fnRASSI'는 증권전문 기업 씽크풀과 파이낸셜뉴스의 협업으로 로봇기자가 실시간으로 생산하는 기사입니다."
뉴시스,258540,/news/news_read.nhn?article_id=0007618410&office_id=003&mode=search&query=스템랩&page=1,2016-11-29 09:41,시큐센-스템랩 코넥스 신규상장,"【서울=뉴시스】한국거래소 코스닥시장본부는 29일 오전 서울 여의도 서울사옥 홍보관에서 보안SI 및 생체인식바이오인증 전문기업인 시큐센 및 줄기세포치료제 개발 및 전자의료기기 제조업체인 스템랩의 코넥스시장 신규상장기념식을 개최했다. 왼쪽부터 임승원 한국IR협의회 부회장, 김성현 KB투자증권 IB총괄 대표, 김재준 한국거래소 코스닥시장위원회 위원장, 오동훈 스탬랩 대표이사, 김제호 시큐센 대표이사, 신성호 IBK투자증권 대표이사, 김군호 코넥스협회 회장이 기념촬영을 하고 있다. 2016.11.29. (사진=한국거래소 제공)"
아시아경제,258540,/news/news_read.nhn?article_id=0003880679&office_id=277&mode=search&query=스템랩&page=1,2016-11-29 09:39,[포토]시큐센&middot;스템랩 코넥스 신규상장기념식,"[아시아경제 권성회 기자] 한국거래소 코스닥시장본부는 29일 오전 8시40분부터 서울사옥 홍보관에서 보안SI 및 생체인식바이오인증 전문기업인 시큐센과 줄기세포치료제 개발 및 전자의료기기 제조업체인 스템랩의 코넥스시장 신규상장기념식을 개최했다. 상장기념패 전달 후 기념촬영. 사진 왼쪽부터 임승원 한국IR협의회 부회장, 김성현 KB투자증권 IB총괄 대표, 김재준 한국거래소 코스닥시장위원회 위원장, 오동훈 스탬랩 대표이사, 김제호 시큐센 대표이사, 신성호 IBK투자증권 대표이사, 김군호 코넥스협회 회장"
아시아경제,258540,/news/news_read.nhn?article_id=0003871079&office_id=277&mode=search&query=스템랩&page=1,2016-11-15 16:10,"거래소, 스템랩&middot;시큐센 코넥스 상장신청서 접수","[아시아경제 권성회 기자] 한국거래소는 스템랩과 시큐센의 코넥스시장 신규상장신청서를 15일 접수했다고 밝혔다. 거래소 측은 “약 2주 내외의 상장심사를 거쳐 상장승인 여부를 결정할 예정”이라고 말했다. 스템랩은 줄기세포 치료제를 개발하는 업체로 지난해 기준 매출액 17억8400만원, 당기순손실 19억7200만원을 기록했다. 시큐센은 바이오인증, 모바일 보안솔루션 및 서비스를 개발하는 업체로 지난해 기준 매출액은 19억7500만원이며, 당기순손실은 9억2700만원이다."
이데일리,258540,/news/news_read.nhn?article_id=0004112814&office_id=018&mode=search&query=스템랩&page=1,2018-05-28 11:38,"스템랩, 척수손상질환치료제 개발 국책과제 선정",3년간 정부지원금 포함 총 13억원 규모의 사업비 투자 오동훈 스템랩 대표. (사진=스템랩) [이데일리 박경훈 기자] 코넥스 상장기업 스템랩은 보건복지부가 주관하는 ‘유도 신경줄기세포를 이용한 척수손상질환 치료제 개발 국책 과제’ 사업자로 최종 선정됐다고 28일 밝혔다. 스템랩은 고려대와 협력 모델을 제안해 척수손상질환 치료를 위한 줄기세표치료제 개발 과제를 수행할 계획이다. 이번 보건복지부 국책 과제로 선정되면서 스템랩은 앞으로 3년 동안 정부지원금 포함해 총 13억원 규모의 사업비를 연구에 투자하게 된다. 국책 과제 기간 동안 스템랩은 유도신경줄기세포 치료제의 생산 공정 확립을 담당하고 고려대는 척수손상질환 동물모델을 이용한 유효성 및 안전성 평가를 맡아 진행한다. 오동훈 스템랩 대표는 “이번 국책과제 선정으로 한국은 직접교차분화 기술로 유도한 신경줄기세포의 임상시험을 세계 최초로 진행할 수 있는 기반을 마련하게 됐다”고 설명했다. 스템랩은 유승권 고려대 생명공학부 교수가 보유한 직접교차분화(directreprogramming) 원천 기술을 사업화한 바이오 벤처기업이다. 세계 최초로 직접교차분화기법을 사업화하는 사업모델을 바탕으로 현재 자가 신경줄기세포 및 희소돌기아교세포를 이용한 중추신경계통의 질환을 치료를 연구 중이다. 줄기세포를 이용한 탈모 치료 기술도 개발하고 있다.
서울경제,258540,/news/news_read.nhn?article_id=0003322344&office_id=011&mode=search&query=스템랩&page=1,2018-06-14 14:55,"스템랩, 12억원 규모 제3자배정증자 결정",[서울경제] 스템랩(258540) 은 12억원 규모 제3자배정 유상증자를 결정했다고 14일 공시했다.
아시아경제,258540,/news/news_read.nhn?article_id=0004246755&office_id=277&mode=search&query=스템랩&page=1,2018-05-28 15:09,"스템랩, 보건복지부 주관 '국책 과제 사업자'로 최종 선정","고려대와 함께 '척수 손상 질환 줄기세포 치료제 개발' 수행 [아시아경제 조호윤 기자]스템랩이 보건복지부가 주관하는 '유도 신경 줄기세포를 이용한 척수 손상 질환 치료제 개발 국책 과제' 사업자로 최종 선정됐다. 스템랩은 고려대학교와 함께 척수손상질환 치료를 위한 줄기세포 치료제 개발 과제를 수행하게 됐다고 28일 밝혔다. 향후 3년간 정부 지원금 포함 총 13억 원 규모의 사업비를 연구에 투자한다. 국책 과제 기간 동안 스템랩은 유도신경줄기세포 치료제의 생산 공정 확립을 담당하고, 고려대학교는 척수손상질환 동물모델을 이용한 유효성 및 안전성을 평가한다.  오동훈 스템랩 대표는 ""이번 국책과제 선정으로 한국은 직접 교차분화 기술로 유도한 신경줄기세포의 임상시험을 세계 최초로 진행할 수 있는 기반을 마려하게 됐다""며 ""이는 우리나라가 직접교차분화 기술의 사업화를 선도하게 되는 기회를 확보하게 됐음을 뜻한다""고 말했다. 한편 스템랩은 유승권 고려대학교 생명공학부 교수가 보유한 직접교차분화(direct reprogramming) 원천 기술을 사업화한 바이오 벤처기업이다. 세계 최초로 직접 교차분화기법을 사업화해 현재 자가 신경줄기세포 및 희소돌기아교세포를 이용한 중추신경계통의 질환을 치료를 연구 중이며, 줄기세포를 이용한 탈모 치료 기술을 개발하고 있다."
