source,symbol,link,date,title,content
서울경제,260930,/news/news_read.nhn?article_id=0003279258&office_id=011&mode=search&query=씨티케이코스메틱스&page=1,2018-04-24 14:58,"&lt;코&gt;씨티케이코스메틱스, 전일 대비 7.01% 상승.. 일일회전율은 1.67% 기...","[서울경제] 씨티케이코스메틱스(260930) 는 24일 오후 2시 57분 현재 7.01% 오른 41,200원에 거래되고 있으며, 27(매도):73(매수)의 매수우위를 기록하고 있다. 거래대금은 68억3,365만, 거래량은 16만8,598주로 거래량회전율은 1.67%로 나타났다. 지난 1개월간 씨티케이코스메틱스는 상승 12회, 하락 17회를 기록했고, 주가수익률은 11.96% 표준편차는 2.52%를 기록했다. 이 기간 ' 화학업 ' 업종 평균 주가수익률은 3.98%로 나타났으며, 변동성은 1.28%를 기록했다. 이 시각 현재 ' 화학업 '은 0.01% 상승 중이며, 45(매도):55(매수)의 매수우위를 기록하고 있다."
한국경제TV,260930,/news/news_read.nhn?article_id=0000658737&office_id=215&mode=search&query=씨티케이코스메틱스&page=1,2018-07-09 13:12,"씨티케이코스메틱스, 전일 대비 약 4% 상승한 32,250원","[한국경제TV 라이온봇 기자] [그림 1] 최근 3개월 간 주가 추세 및 기간별 수익률 씨티케이코스메틱스는 7월 9일 13시 12분 전일 대비 약 4% 상승한 32,250원에 거래되고 있다. 씨티케이코스메틱스는 코스닥 상장 기업으로 화학 업종에 속해 있다. 시가총액은 3,137억원으로 코스닥 상장기업 중 165위에 위치 해 있다. [종목 성향 진단] [그림 2] 종목 성향 진단 씨티케이코스메틱스의 투자 스타일은 성장주에 가깝다. 주가 고평가 우려가 공존하지만 높은 성장성이 기대되는 기업이다. 주가 모멘텀은 좋지 못했다. 최근 6개월 수익률은 -28.35%의 하락폭을 기록했다. 최근 1개월 수익률 또한 -20.8% 하락하며 부진한 모멘텀을 이어가고 있다. 씨티케이코스메틱스 종목에 대한 투자자의 관심도는 평범한 수준이었다. [투자 점수 진단] [그림 3] 투자 점수 진단 씨티케이코스메틱스는 어느 측면에서 투자 매력도가 높은 종목일까? AI 인공지능 종목 분석 시스템을 이용해 성장성, 수익성, 효율성, 안전성, 저평가성, 추세 등 주가 수익률에 영향을 줄 수 있는 6가지 핵심 투자 지표를 점수화하여 종목의 투자 매력도를 계산해보았다. 그 결과 씨티케이코스메틱스는 상대적으로 기업안정성 측면에서 두각을 드러내고 있었다. 기업안정성 점수는 기업의 재무 구조가 얼마나 안정적인 상태인지를 나타낸다. 씨티케이코스메틱스는 특히 당좌비율 측면에서 가장 높은 점수는 기록했는데, 전체 시장 내 90위를 기록하며 상위 4.61%에 위치했다. 업종별로는 19위를 기록하며 상위 4.41%에 위치했다. 그러나 기업 가치 대비 주가 수준을 나타내는 저평가 측면에서는 아쉬움을 나타냈다. (위의 AI인공지능 점수는 재무 데이터를 기반으로 전체 상장 종목과 비교/분석하여 도출한 점수로 높은 점수가 반드시 높은 수익률을 보장하지 않습니다. 위의 자료는 당사의 추천 종목이 아니며, 투자 시 참고용으로 제시해드리는 것입니다. 핵심투자지표를 결합해 종목의 투자매력도를 종합 계산한 ""인공지능 투자점수""는 ""거장들의 투자공식"" 앱에서 확인하실 수 있습니다.) 라이온봇 기자 -한국경제TV※ 본 기사는 한국경제TV와 '거장들의 투자공식이'자체 개발한 '라이온봇 기자'가 실시간으로 작성한 기사입니다. 라이온봇기자 ⓒ 한국경제TV, 무단 전재 및 재배포 금지 한국경제TV 관련뉴스해당 언론사에서 선정하며 언론사 페이지(아웃링크)로 이동해 볼 수 있습니다.'무역전쟁' 선반영 됐다…지금 사야할 주식은11시에 무슨 일이...매출 50% 급증한다발표하자 마자 급락...코스닥 25개사 '난감하네'계산대 의자 '이렇게' 바꾼다…이마트 10년 만의 변화""당신 차 긁었다"" 문 열어주니 강도로 돌변"
서울경제,260930,/news/news_read.nhn?article_id=0003213658&office_id=011&mode=search&query=씨티케이코스메틱스&page=1,2018-02-02 13:04,"씨티케이코스메틱스, 독일 iF 디자인 어워드 2018 수상","[서울경제] 코스메틱 풀 서비스 플랫폼 전문 기업 씨티케이코스메틱스(260930) 는 자사의 제품 ‘Click Top Opening Jar’가 독일 iF 디자인 어워드 뷰티·헬스 부문 수상의 영예를 안았다고 2일 밝혔다. iF 디자인 어워드는 1953년 독일 하노버에서 시작된 세계 최고 권위의 디자인 대회로 레드닷(Reddot) 디자인 어워드, IDEA(International Design Excellence Awards) 디자인 어워드와 함께 세계 3대 디자인 어워드 중 하나다. 올해는 54개국으로부터 6,400여개 제품이 출품됐다. 이번 디자인 어워드에서 수상의 영예를 안은 제품은 ‘Click Top Opening Jar’로 기존의 크림 용기가 두 손을 사용해 캡을 열고 닫아야 하는 반면, 한 손만으로도 클릭해 손쉽고 빠르게 캡을 열고 닫을 수 있도록 디자인해 글로벌 코스메틱 브랜드들로부터 2017년 최고의 이노베이션이라는 평판을 얻고 있는 제품이다. 한편 씨티케이코스메틱스는 자체 소유 R&D 센터를 통해 지속적으로 혁신적인 패키지 디자인 및 개발을 하고 있으며 세계 특허 인증을 통해 글로벌 시장의 확대에 박차를 가하고 있다. 씨티케이코스메틱스는 현재 총 280건 이상의 특허를 보유하고 있다."
이데일리,260930,/news/news_read.nhn?article_id=0004015796&office_id=018&mode=search&query=씨티케이코스메틱스&page=1,2018-01-21 13:58,"[마켓인]씨티케이코스메틱스, 고객&middot;협력사에 직접 투자 나선다","- 스마일게이트와 200억원 펀드 결성…자본 이익·자물쇠 효과 '1석2조' - 대부분 '뉴브랜드'에 투자…""제2의 '아이티코스메틱스' 발굴할 것"" [이데일리 고준혁 기자]화장품 업체 씨티케이코스메틱스(260930)(CTK코스메틱스)가 제품을 납입하는 고객사와 원료를 공급받는 협력사에 직접 투자하기 위한 펀드를 만들었다. 이는 CTK코스메틱스와 관계를 맺고 있는 회사 지분을 확보해 자본 이익를 보면서도 ‘자물쇠 효과(기존 상품을 계속 사용하는 것)’를 누리겠다는 전략으로 풀이된다. 금융감독원 전자공시시스템(DART)에 따르면 CTK코스메틱스는 200억원 규모의 사모펀드(PEF) ‘씨티케이-스마일게이트 글로벌 파트너십 사모투자합자회사(CTK-스마일게이트 PEF)’에 120억원을 출자한다. 정인용 CTK코스메틱스 대표와 스마일게이트 인베스트먼트도 이 펀드에 각각 20억원, 60억원을 투자한다. 스마일게이트 인베스트먼트는 CTK코스메틱스에 2016년 140억원, 지난해엔 310억원을 투자하는 등 재무적 투자자(FI)로서 협력관계를 맺고 있다. CTK-스마일게이트 PEF도 스마일게이트 인베스트먼트의 제안으로 기획됐다. CTK의 많은 고객사나 협력사에 지분을 투자하면 매출뿐 아니라 자본 이득도 올릴 수 있을 수 있겠다는 아이디어에서 출발했다. CTK코스메틱스는 제품 기획부터 개발, 생산까지 원스톱으로 일괄생산(턴키)해 화장품 브랜드에 납품하는 B2B(기업 간 거래) 회사이기 때문에 다수의 고객사를 확보하고 있다. 자체 공장을 보유하지 않고 주문자상표부착생산(OEM) 업체를 통해 화장품을 생산하고 있어 제품 용기나 원료를 만드는 다양한 협력사들도 확보했다. 펀드 자금은 이처럼 이미 CTK코스메틱스와 관계를 맺고 있는 업체에 쓸 계획이다. 대부분의 자금은 중소 규모의 새로운 화장품 브랜드 발굴 및 투자에 투입될 예정이다. 스마일게이트 인베스트먼트 관계자는 “로레알에 1조원이 넘는 금액으로 인수된 아이티코스메틱스는 CTK코스메틱스가 회사 초장기에 계약한 고객사다. 이 회사에 지분투자를 했더라면 많은 자본이익을 올렸을 것”이라며 “펀드를 통해 ‘제2의 아이티코스메틱스’가 될 가능성이 있는 신생 업체를 발굴하고 투자하겠다”고 말했다. CTK코스메틱스의 고객 및 협력사 투자는 영업적인 측면에서도 도움이 된다. 지분을 가진 주주로서 영향력을 발휘해 경쟁사로의 이탈을 막을 수 있어서다. 이 관계자는 “주식 투자를 했으니 CTK코스메틱스는 업체들과 좀 더 긴밀한 관계를 유지할 수 있게 될 것”이라며 “이는 안전적인 판매와 생산 시스템을 확보하는 등 회사의 펀더멘탈을 강화하는 요소”라고 했다. CTK코스메틱스는 이 펀드를 통해 화장품 완제품과 원재료를 보관할 수 있는 대규모 창고도 만들 예정이다. 제품을 보관할 여력이 없는 신생 업체들을 포섭해 고객사로 만들고 투자까지 진행하겠다는 것이다. 또한 동남아와 중국 진출에도 해당 펀드 자금이 쓸 것이라고 전했다. CTK코스메틱스는 2001년 출범했다. 로레알과 에스티로더 등 글로벌 화장품 브랜드에 화장품을 납품하고 있다. 제품 기획과 개발, 생산까지 ‘원스탑 서비스’를 제공하기 때문에 화장품 플랫폼 회사라고 불린다. CTK코스메틱스는 미국과 유럽 등에도 진출했다. 지난해 미국 수출액은 약 1억달러를 기록했다. 2016년 매출액은 1338억원이고 영업이익은 267억원으로 전년대비 각각 119.3%, 113.9% 증가했다. 지난해 들어 3분기까지 매출 945억원, 영업이익 237억원이다. 지난해 말 코스닥 상장했고 공모 규모는 약 1100억원을 기록했다."
머니투데이,260930,/news/news_read.nhn?article_id=0004004949&office_id=008&mode=search&query=씨티케이코스메틱스&page=1,2018-02-07 10:17,"씨티케이코스메틱스-KAIST, 신개념 색조화장품 개발 협약","[머니투데이 박계현 기자] [스마트 나노 콜로이드 기반 개인별 최적화된 색조화장품 개발] 씨티케이코스메틱스가 한국과학기술원(KAIST)과 협력해 신개념 색조화장품 개발을 위한 중장기 과제를 진행 중이라고 7일 밝혔다. 이번 업무 협약은 씨티케이코스메틱스 R&D(연구개발) 역량을 강화하기 위한 목적으로, 국내 소재 연구 분야 권위자인 남윤성 카이스트 신소재공학과 교수와 김진웅 한양대학교 화학분자공학과 교수가 공동 개발에 참여한다. 이번 연구과제는 스마트 나노 콜로이드(colloid)를 이용해 외부 자극으로 인한 색상의 변화와 천연 구조 색상을 구현할 수 있는 기술이다. 씨티케이코스메틱스는 고객의 다양한 요구에 최적화한 맞춤 전략으로 제품 기획부터 개발, 생산까지 화장품과 관련한 모든 서비스를 제공하고 있다. 글로벌 톱티어(Top-tier) 화장품 기업으로부터 턴키(일괄수주) 형태로 의뢰받아 완제품을 납품하고 있으며, 자체적으로도 화장품 케이스, 포뮬러 등 다양한 제품을 개발해 납품하고 있다. 남윤성 카이스트 신소재공학과 교수는 ""씨티케이코스메틱스의 글로벌 화장품 트렌드 분석 능력과 우리의 신소재 연구개발 능력이 결합해 사업적 시너지를 낼 수 있도록 최선을 다할 것""이라고 말했다. 정인용 씨티케이코스메틱스 대표도 ""이번 산학협력을 통해 당사의 R&D 역량을 향상시켜 기존에 없던 신개념의 색조화장품을 상용화할 수 있을 것으로 기대한다""며 ""앞으로도 다방면의 기술 연구를 통해 글로벌 브랜드에 새로운 경험과 가치를 전달하도록 하겠다""고 말했다."
서울경제,260930,/news/news_read.nhn?article_id=0003162915&office_id=011&mode=search&query=씨티케이코스메틱스&page=1,2017-11-28 16:58,"씨티케이코스메틱스, 청약경쟁률 145.75대 1 기록","[서울경제] 씨티케이코스메틱스는 지난 27일과 28일 진행한 공모주 청약에서 경쟁률 145.75대 1을 기록했다고 밝혔다. 총공모주 수 200만 주의 20%인 40만 주를 대상으로 실시한 CTK의 일반 청약에는 총 5,830만 주가 접수됐다. 신청 규모의 50%인 청약 증거금은 1조6,032억 원에 달했다. 앞서 공모가 확정을 위한 기관 투자자 대상 수요예측에서도 CTK에 대해 기관의 러브콜을 이어지며 희망가의 상단인 5만5,000원으로 공모가를 확정했다. 국내외 기관 668곳에서 약 2억9,429만 주를 신청해 188.65대 1의 경쟁률을 보였다. CTK는 글로벌 화장품 시장에서 ‘풀 서비스 플랫폼’을 제공하는 연구·기획 중심의 전문 기업이다. 글로벌 주요 화장품 기업을 대상으로 상품 기획 및 제조를 진행하며, 국내외 ODM·OEM사를 파트너사로 두고 무공장 제조를 기반으로 하는 것이 특징이다. 회사는 브랜드 랩 및 풀필먼트(물류시스템) 구축으로 플랫폼 전략을 더욱 강화해 성장을 이어나갈 방침이다."
이데일리,260930,/news/news_read.nhn?article_id=0003980927&office_id=018&mode=search&query=씨티케이코스메틱스&page=1,2017-11-28 17:19,[마켓인]씨티케이코스메틱스&middot;메카로 공모청약 성적 '무난',"- 최종 경쟁률 각각 145.75대1, 664.69대1기록 [이데일리 신상건 기자] 코스닥시장 상장을 앞둔 씨티케이(CTK)코스메틱스와 메카로가 일반 공모 청약에서 무난한 성적을 거뒀다. 28일 상장 주간사인 미래에셋대우에 따르면 화장품용기 제조업체 씨티케이코스메틱스는 지난 27일부터 이날까지 진행된 일반 공모 청약 결과 최종경쟁률 145.75대1을 기록했다. 청약 주식 수는 5404만4560주로 청약증거금 1조4862억2540만원이 모였다. 씨티케이코스메틱스는 다음 달 7일 코스닥시장에 입성한다. 앞서 지난 21~22일 진행한 기관투자자 대상 수요예측에서는 공모가를 희망밴드 최상단인 5만5000원으로 확정했다. 수요예측 경쟁률은 189대 1을 나타냈다. 씨티케이코스메틱스는 지난 2001년 화장품 용기 제조 회사로 설립했다. 2009년부터 글로벌 화장품 기업을 대상으로 풀서비스 사업을 시작했다. 고객사로부터 의뢰를 받으면 화장품을 개발을 기획하고 생산은 외부 공장에 맡기는 사업이다. 씨현재 로레알과 유니레버, 에스티로더 등 해외 화장품 기업을 고객사로 두고 있다. 주요 고객사 5곳의 매출 비중이 80%가량을 차지한다. 씨티케이코스메틱스는 공모로 모인 1100억원 규모의 자금을 사업의 글로벌시장 확대를 포함해 연구개발(R&D)과 브랜드 기획 등에 투자할 계획이다. 올해 코스닥 ‘패스트트랙’(상장 간소화 절차)을 적용받는 두 번째 기업으로 공모가 기준 시가총액은 약 5600억원으로 추정된다. 같은 날 진행된 반도체 물질과 부품생산업체 메카로의 일반 공모 청약 최종경쟁률도 664.69대 1을 나타냈다. 청약주식 수는 2억6587만5050주로 청약 증거금은 4조3869억3832만5000원이 모였다. 메카로는 수요예측에서 719.26대1의 경쟁률을 기록했다. 총 공모 자금은 660억원으로 조달된 자금은 공장 신축과 음성 공장 증설, 신규 사업, 제품 연구 개발 등에 활용된다. 메카로 자체 결산 기준 올해 3분기 누적 실적은 매출액 757억1600만원, 영업이익 306억4600만원으로 각각 전년동기대비 57%, 888%가 늘었다. 메카로는 다음 달 6일 코스닥시장에 상장한다. IB업계 관계자는 “씨티케이코스메틱스는 사드 보복이 해빙기에 접어들면서 화장품 수요 증가에 대한 기대감이 반영됐다”며 “메카로 역시 반도체 경기 호황의 영향을 받았다”고 말했다."
한국경제,260930,/news/news_read.nhn?article_id=0003880926&office_id=015&mode=search&query=씨티케이코스메틱스&page=1,2018-01-18 14:21,"씨티케이코스메틱스, 사모펀드에 120억 출자","씨티케이코스메틱스는 스마일게이트인베스트먼트가 설립하는 200억원 규모의 사모펀드(PEF)인 '씨티케이 스마일게이트 글로벌 파트너십 사모투자합자회사'에 120억원을 출자한다고 18일 공시했다. 해당 PEF에 정인용 씨티케이코스메틱스 대표가 유한책임사원으로 20억원을 출자하고, 스마일게이트인베스트먼트도 자기자본으로 60억원을 투자할 예정이다. 씨티케이코스메틱스는 PEF 설립을 통해 공모자금 활용방안으로 제시했던 전·후방 사업에 대한 종합적인 투자를 진행한다는 방침이다. 자회사인 씨티케이브랜드랩에서 진행하는 고객사 브랜딩 프로젝트에도 지분을 투자, 잠재 고객이 될 수 있는 북미 유망 브랜드 및 아시아 신생 브랜드를 발굴하고 육성할 계획이라고 설명했다. 씨티케이코스메틱스 측은 ""브랜드를 인수하거나 경영권을 확보하는 것은 아니며, 지분 투자를 통해 전략적 파트너로서 화장품 브랜드 개발과 장기적 사업 파트너십을 강화하면서 동반 성장한다는 것이 핵심""이라고 전했다."
연합뉴스,260930,/news/news_read.nhn?article_id=0009714934&office_id=001&mode=search&query=씨티케이코스메틱스&page=1,2017-11-28 17:04,"씨티케이코스메틱스, 공모주 청약 경쟁률 150.12대 1","(서울=연합뉴스) 윤선희 기자 = 다음 달 7일 코스닥 시장에 상장하는 씨티케이코스메틱스가 공모주 청약에서 150.12대 1의 경쟁률을 기록했다. 상장주관사인 미래에셋대우는 27∼28일 일반공모 청약 결과 36만주 모집에 5천404만4천560주가 몰렸다고 밝혔다. 청약증거금은 1조4천862억원에 달했다. 씨티케이코스메틱스는 화장품 브랜드로부터 수주를 받아 제품 기획부터 개발, 마케팅 및 생산까지 원스톱으로 일괄생산해 납품하는 업체로, 코스닥 '패스트트랙'(상장 간소화 절차)을 적용받아 상장한다. 이 회사는 이번 기업 공개로 1천100억원을 조달해 플랫폼 서비스 사업의 글로벌 시장 확대와 브랜드 기획 등에 투자할 계획이다."
서울경제,260930,/news/news_read.nhn?article_id=0003160204&office_id=011&mode=search&query=씨티케이코스메틱스&page=1,2017-11-24 10:03,"씨티케이코스메틱스, 공모가 상단 5만5,000원 결정","[서울경제] 씨티케이코스메틱스는 24일 공시에서 기관 수요예측 결과 밴드 상단인 5만5,000원으로 공모가가 결정됐다고 밝혔다. 경쟁률은 188대 1을 기록했다."
한국경제,260930,/news/news_read.nhn?article_id=0003857613&office_id=015&mode=search&query=씨티케이코스메틱스&page=1,2017-11-28 17:05,"씨티케이코스메틱스, 청약 경쟁률 145.75대 1","다음달 7일 코스닥 시장에 상장하는 씨티케이코스메틱스는 지난 27일부터 이틀간 일반 공모 청약을 실시한 결과, 경쟁률이 145.75대 1을 기록했다고 28일 밝혔다. 회사에 따르면 일반투자자 배정물량인 40만주를 대상으로 실시한 청약에 총 5830만주의 신청이 접수됐다. 신청금액의 절반인 청약증거금은 1조6032억원이 몰렸다. 씨티케이코스메틱스는 앞서 기관 투자자 대상 수요예측에서도 공모가를 희망가격 상단인 5만5000원으로 확정한 바 있다. 씨티케이코스메틱스는 화장품 브랜드로부터 수주를 받아 제품 기획부터 개발, 마케팅 및 생산까지 원스톱으로 일괄생산(턴키)해 납품하는 기업 간 거래(B2B) 회사로 '화장품 풀(full) 서비스 플랫폼' 기업을 표방한다. 올해 코스닥 '패스트트랙'(상장 간소화 절차)을 적용받는 두 번째 기업이다. 정인용 씨티케이코스메틱스 대표는 ""코스닥 상장을 계기로 우리만이 할 수 있는 코스메틱 플랫폼 사업을 전략적으로 확대해 글로벌 경쟁력을 더욱 갖춰나가겠다""고 말했다."
머니투데이,260930,/news/news_read.nhn?article_id=0003967389&office_id=008&mode=search&query=씨티케이코스메틱스&page=1,2017-11-21 15:21,씨티케이코스메틱스 &quot;로레알&middot;샤넬이 고객사&hellip;25% 성장 자신&quot;,"[머니투데이 박계현 기자] [정인용 대표 ""화장품 '원스톱' 제조하는 플랫폼기업""…내달 7일 코스닥 상장] 정인용 씨티케이코스메틱스 대표/사진제공=씨티케이코스메틱스 ""매년 매출액 기준 전년 대비 20~25%의 성장세를 이어갈 수 있다. 향후 2~3년 내 고객사 요청에 발맞춰 브랜드를 만드는 일부터 물류 서비스까지 원스톱 서비스를 제공할 계획이다."" 정인용 씨티케이코스메틱스 대표는 21일 서울 여의도에서 열린 기자간담회에서 ""씨티케이코스메틱스가 화장품업계에 없던 플랫폼 비즈니스 시장을 개척한 회사""라며 이같이 말했다. 정 대표는 ""고객사가 다양하게 선택할 수 있도록 화장품 OEM(제조자개발생산)·ODM(주문자상표부착) 제조사 풀을 확보하고 주문규모를 키우는 것이 플랫폼 경쟁력의 핵심""이라며 ""고객사 대응에 맞춰 '원스톱 서비스'를 제공할 수 있도록 사업 영역을 확대해 나가고 있다""고 설명했다. 내달 7일 상장을 앞둔 씨티케이코스메틱스는 2001년 설립된 화장품 기업으로 제품 기획부터 디자인·마케팅·외주생산까지 모든 과정을 대행하는 플랫폼 서비스업체다. 최신 화장품 유행을 분석해 연구개발(R&D)과 기획을 끝낸 뒤 적절한 포뮬러와 용기 등을 소싱해 고객사에 턴키(turn key)로 납품한다. 씨티케이코스메틱스는 6개월~1년이면 새로운 유행이 자리잡는 화장품 시장의 틈새를 파고 들어 최근 5년간 비약적인 매출 성장세를 일궜다. 회사 매출액은 △2012년 85억원 △2013년 220억원 △2014년 415억원 △2015년 610억원 △2016년 1338억원을 기록했다. 올 상반기 매출액은 전년 대비 17.3% 증가한 727억원, 영업이익은 68% 증가한 198억원을 기록했다. 당기순이익은 35.3% 증가한 126억원이다. 정 대표는 ""화장품 생산 관련 모든 과정을 턴키로 제공하는 '풀서비스' 사업이 자리잡고 나니 기존 매출액 대비 100%가 넘는 성장세가 이어졌다""고 말했다. 이어 ""고객사의 PO(주문서)에 맞춰 제품을 생산·배송하고 OEM·ODM업체에 발주를 내기 때문에 재료·시설 투자가 필요치 않고, 27.2%의 높은 이익률 달성이 가능하다""고 덧붙였다. 전체 매출액의 70~80%를 기존 고객사의 리오더(재주문)로 벌어들인다는 것도 강점이다. 이 회사 고객사는 로레알·유니레버·에스티로더·샤넬·LVMH 등 글로벌 화장품 브랜드로 이들이 전체 매출액의 80% 이상을 차지한다. 나머지 20~30% 매출액은 신규 브랜드 수주가 차지하지만 올 상반기에는 신규 프로젝트 수주를 잠시 중단했다. 정 대표는 ""올해 초 직원수가 60명 안팎인 상황에서 전년 대비 100% 외형성장을 하다보니 품질관리 인원 충원이 회사의 우선과제로 떠올랐다""고 설명했다. 이어 ""현재는 직원수를 100명까지 늘린 상태로 그간 B2B(기업대상) 회사로 낮았던 인지도를 높여 우수인력을 확보하는 것이 상장을 추진하는 이유이기도 하다""고 덧붙였다. 회사는 이번 상장으로 조달한 공모자금 약 900억원은 △시설투자 370억원 △연구개발 180억원 △신규사업 360억원에 투입한다는 계획이다. 2018년~2020년까지 중국·프랑스·미국·일본에 글로벌 소싱 플랫폼을 구축하고 미국 LA·뉴욕 등지에 온라인 주문에 대응할 수 있는 물류센터를 설립할 예정이다. 정 대표는 ""화장품 산업 역시 온라인 유통 채널로 무게중심이 옮겨가는 추세""라며 ""제품 기획부터 생산에 더해 재고 관리까지 맡아달라는 고객사들의 요청이 있었고 향후 2~3년간은 여기에 집중할 계획""이라고 말했다. 정 대표는 ""과거에는 글로벌 고객사들이 국내 OEM·ODM 제조사들의 '메이드 인 코리아' 화장품을 이용하기 위해 우리 회사에 발주를 했지만 화장품 트렌드가 빨라지면서 플랫폼 비즈니스의 전문성을 점차 인정받고 있다""고 말했다. 이어 ""상장 후 포뮬러·용기 소싱 영역을 국내 뿐 아니라 글로벌로 확대해 나갈 계획""이라고 덧붙였다. 씨티케이코스메틱스는 오는 22일 수요예측을 마감한 뒤 27~28일 일반 청약을 진행할 예정이다. 공모희망가는 4만6000~5만5000원으로 상장 후 시가총액은 4658억~5569억원이다. 주관사는 미래에셋대우다."
