source,symbol,link,date,title,content
머니투데이,260930,/news/news_read.nhn?article_id=0004022447&office_id=008&mode=search&query=씨티케이코스메틱스&page=1,2018-03-13 16:01,"씨티케이코스메틱스, '뷰티 유튜버' 인기타고 '부활' 날개짓","[머니투데이 신아름 기자] [씨티케이코스메틱스 주가 지난해 12월 상장 이후 줄곧 공모가 밑돌아, 올해 실적 개선 기대감 커지며 반등 모멘텀 확보] 씨티케이코스메틱스의 주가가 부활의 날개를 펴고 있다. 지난해 12월 7일 상장한 뒤 지금까지 줄곧 하락해 공모가를 밑돌고 있는 주가가 실적 회복 기대감이 커지면서 반등하는 모양새다. 전문가들은 화장품도 의류처럼 SNS(소셜네트워크서비스) 채널을 통해 빠르게 소비하는 트렌드가 가속화함에 따라 이에 능동적으로 대응할 수 있는 사업 구조를 지닌 씨티케이코스메틱스가 재평가를 받을 것으로 기대했다. 씨티케이코스메틱스는 13일 코스닥시장에서 전일 대비 7.13% 오른 3만6800원으로 거래를 마쳤다. 전날 나온 최대주주 정인용 대표의 주식 장내매수(1만3667주) 공시가 호재로 작용한 데다 올해 실적 회복 전망이 힘을 받으면서 씨티케이코스메틱스 주가는 이날 장 초반 전일 대비 12% 오른 3만8500원까지 치솟으며 최근 한달새 장중 최고치를 경신하기도 했다. 씨티케이코스메틱스는 제품 기획부터 디자인, 마케팅, 외주 생산까지 화장품 관련 모든 과정을 풀코스로 제공하는 사업을 영위한다. 로레알, 루이비통모에헤네시(LVMH), 샤넬, 유니레버 등 글로벌 거대 화장품 기업들이 전체 매출의 80%를 차지하며 지역적으로는 미국의 비중이 90%로 절대적이다. 매출액이 2012년부터 2016년 4년간 연 평균 99%씩 가파르게 성장했고, 영업이익률은 2014년 9%대에서 2016년 20%로 개선됐다. 이처럼 탄탄한 사업 구조를 바탕으로 씨티케이코스메틱스는 기관 수요 예측 당시 188대1의 높은 경쟁률을 기록하며 공모가 밴드 상단인 5만5000원으로 시장의 기대를 한 몸에 받으면 지난해 12월 7일 코스닥 시장에 상장했다. 그러나 상장 직후부터 내리막길을 탄 주가는 아직까지 공모가인 5만5000원을 회복하지 못하고 있다. 기대에 못 미치는 부진한 실적이 악재로 작용한 탓이다. 씨티케이코스메틱스는 지난해 연결 기준 매출액 1135억원, 영업이익 247억원, 당기순이익 154억원을 기록했다. 이는 전년 대비 각각 15.2%, 7.6%, 34% 하락한 것이다. 다만, 이같은 지난해 실적 악화는 신규 인력 충원에 따른 인건비 증가, 환율 하락 등 일회성 요인에서 비롯된 것으로 올해는 다른 상황이 전개될 것이란 게 시장의 관측이다. 한국희 NH투자증권 연구원은 ""씨티케이코스메틱스는 올해 매출액 1400억원, 영업이익 280억원을 달성할 것""이라며 ""목표매출액 중 75%정도는 리오더(re-order)가 확정됐고 17%는 이미 시작된 프로젝트로 가시성이 높다""고 말했다. 화장품 유통 및 마케팅 채널이 다변화되면서 소비 행태에도 변화가 나타나고 있다는 점은 장기적인 관점에서 씨티케이코스메틱스의 투자 매력도롤 높이는 요소로 꼽힌다. 과거 화장품은 오프라인 매장을 통해 직접 눈으로 보고 써보면서 구입하는 패턴이 일반적이었지만 최근에는 유튜브, 인스타 등 다양한 SNS 채널을 기반으로 한 뷰티 유튜버, 뷰티 블로거 등을 통해 새로운 제품과 트렌드가 빠르게 확산되면서 제품 전반의 교체 주기가 짧아졌다. 이선화 유진투자증권 연구원은 ""화장품의 주요 소비층으로 떠오른 밀레니얼 세대(1980~2000년대 초반 출생자)가 SNS를 통해 트렌드를 선도하면서 화장품 업체들은 발빠른 대응 능력이 필요해진 상황""이라며 "" 화장품 관련 풀서비스를 통해 아이디어 획득, 비용절감, 시간절약, 클레임 리스크 축소 등에 강점을 지닌 씨티케이코스메틱의 매력이 더욱 부각될 수밖에 없는 이유""라고 말했다."
머니투데이,260930,/news/news_read.nhn?article_id=0003975230&office_id=008&mode=search&query=씨티케이코스메틱스&page=1,2017-12-07 09:05,"씨티케이코스메틱스, 시초가 4만9500원&hellip;공모가 대비 10%&darr;","[머니투데이 조한송 기자] 씨티케이코스메틱스가 7일 코스닥 시장 상장 첫날 공모가에서 10% 내린 4만9500원의 시초가를 기록했다. 씨티케이코스메틱스는 이날 오전 9시 3분 현재 시초가 대비 15.15%(7500원) 내린 4만2000원을 기록하고 있다. 회사 측은 당초 공모희망가로 4만6000~5만5000원을 제시했으며 공모가는 상단인 5만5000원으로 결정됐다. 지난달 27일부터 양일간 진행된 일반공모 청약에선 최종 청약 경쟁률 145.75 대 1을 기록했다. 오는 7일 상장을 앞둔 씨티케이코스메틱스는 2001년 설립된 화장품 기업으로 제품 기획부터 디자인·마케팅·외주생산까지 모든 과정을 대행하는 플랫폼 서비스업체다. 회사 매출액은 △2012년 85억원 △2013년 220억원 △2014년 415억원 △2015년 610억원 △2016년 1338억원을 기록했다. 올 상반기 매출액은 전년 대비 17.3% 증가한 727억원, 영업이익은 68% 증가한 198억원을 기록했다. 당기순이익은 35.3% 증가한 126억원이다."
이데일리,260930,/news/news_read.nhn?article_id=0003987031&office_id=018&mode=search&query=씨티케이코스메틱스&page=1,2017-12-07 09:05,"[특징주]씨티케이코스메틱스, 상장 첫날 약세&hellip;공모가 하회","[이데일리 윤필호 기자] 씨티케이코스메틱스(260930)가 상장 첫날 약세를 보이고 있다. 공모가도 하회하는 모습이다. 7일 오전 9시2분 현재 씨티케이코스메틱스 주가는 시초가 4만9500원 대비 13.13%(6500원) 내린 4만3000원에 거래되고 있다. 이는 공모가 5만5000원을 하회하는 수치다. CTK코스메틱스는 지난 2001년 화장품 용기 제조업체로 시작해 파트너십을 통한 무공장 제조사업을 이어왔다. 특히 상품 기획부터 납품까지 원스톱으로 제공하는 풀 서비스 플랫폼 비즈니스라는 새로운 영역을 개척했다. 각 분야 ODM(제조자개발생산), OEM(주문자상표부착생산)사를 파트너로 두고 고객사인 글로벌 화장품 기업을 대상으로 커스터마이징을 제공한다. 주요고객으로 세계 화장품시장 점유율 1위 로레알과 2위 유니레버, 4위 에스티로더 등 상위권 5개 기업이 매출 80% 이상을 책임지고 있다. 다양한 프로젝트를 통해 축적한 빅데이터 인사이트와 꾸준히 진행한 연구개발을 통해 ‘풀 서비스 플랫폼’을 구축할 수 있었다. 패션과 식음료 등 일상생활에서 아이디어를 찾고 화장품에 적용할 수 있는 기술을 확보했다. 특허와 지적재산권도 보유했다. 특히 세계 최초로 커피 캡슐형 파운데이션 콤팩트를 개발하는 성과도 거뒀다. 지난해 매출액 1338억원, 영업이익 267억원, 당기순이익 233억원을 달성했다. 향후 플랫폼사업 영향력을 더욱 강화할 계획이다. 특히 한국 파트너사에 집중했던 패키징(용기)과 포뮬러(내용물) 소싱 인프라를 해외로 확장할 예정이다."
한국경제TV,260930,/news/news_read.nhn?article_id=0000673089&office_id=215&mode=search&query=씨티케이코스메틱스&page=1,2018-08-17 13:19,"씨티케이코스메틱스, 전일 대비 약 -4% 하락한 21,400원","[한국경제TV 라이온봇 기자] [그림 1] 최근 3개월 간 주가 추세 및 기간별 수익률 씨티케이코스메틱스는 8월 17일 13시 18분 전일 대비 약 -4% 하락한 21,400원에 거래되고 있다. 씨티케이코스메틱스는 코스닥 상장 기업으로 화학 업종에 속해 있다. 시가총액은 2,252억원으로 코스닥 상장기업 중 239위에 위치 해 있다. [종목 성향 진단] [그림 2] 종목 성향 진단 씨티케이코스메틱스의 투자 스타일은 성장주에 가깝다. 주가 고평가 우려가 공존하지만 높은 성장성이 기대되는 기업이다. 주가 모멘텀은 좋지 못했다. 최근 3개월 수익률은 -43.74%의 하락폭을 기록했다. 최근 1개월 수익률 또한 -28.46% 하락하며 부진한 모멘텀을 이어가고 있다. 씨티케이코스메틱스 종목에 대한 투자자의 관심도는 평범한 수준이었다. [투자 점수 진단] [그림 3] 투자 점수 진단 씨티케이코스메틱스는 어느 측면에서 투자 매력도가 높은 종목일까? AI 인공지능 종목 분석 시스템을 이용해 성장성, 수익성, 효율성, 안전성, 저평가성, 추세 등 주가 수익률에 영향을 줄 수 있는 6가지 핵심 투자 지표를 점수화하여 종목의 투자 매력도를 계산해보았다. 그 결과 씨티케이코스메틱스는 상대적으로 재무안정성 측면에서 두각을 드러내고 있었다. 재무안정성 점수는 기업의 재무 구조가 얼마나 안정적인 상태인지를 나타낸다. 씨티케이코스메틱스는 특히 당좌비율 측면에서 가장 높은 점수는 기록했는데, 전체 시장 내 93위를 기록하며 상위 4.75%에 위치했다. 업종별로는 19위를 기록하며 상위 4.4%에 위치했다. 그러나 주가 상승 모멘텀을 나타내는 추세 측면에서는 아쉬움을 나타냈다. (위의 AI인공지능 점수는 재무 데이터를 기반으로 전체 상장 종목과 비교/분석하여 도출한 점수로 높은 점수가 반드시 높은 수익률을 보장하지 않습니다. 위의 자료는 당사의 추천 종목이 아니며, 투자 시 참고용으로 제시해드리는 것입니다. 핵심투자지표를 결합해 종목의 투자매력도를 종합 계산한 ""인공지능 투자점수""는 ""거장들의 투자공식"" 앱에서 확인하실 수 있습니다.) 라이온봇 기자 -한국경제TV※ 본 기사는 한국경제TV와 '거장들의 투자공식이'자체 개발한 '라이온봇 기자'가 실시간으로 작성한 기사입니다. 라이온봇기자"
한국경제TV,260930,/news/news_read.nhn?article_id=0000631156&office_id=215&mode=search&query=씨티케이코스메틱스&page=1,2018-05-08 10:14,"씨티케이코스메틱스, 전일 대비 약 -5% 하락한 40,200원","[한국경제TV 라이온봇 기자] 씨티케이코스메틱스는 5월 8일 10시 13분 전일 대비 약 -5% 하락한 40,200원에 거래되고 있다. 씨티케이코스메틱스는 코스닥 상장 기업으로 화학 업종에 속해 있다. 시가총액은 4,048억원으로 코스닥 상장기업 중 138위에 위치 해 있다. [종목 성향 진단] [그림 1] 종목 성향 진단 씨티케이코스메틱스의 투자 스타일은 성장주에 가깝다. 주가 고평가 우려가 공존하지만 높은 성장성이 기대되는 기업이다. 주가 모멘텀은 평범한 수준이었다. 최근 1개월 수익률이 4.57%, 3개월 수익률은 4.3%, 6개월 수익률은 0%를 기록했다. 씨티케이코스메틱스 종목에 대한 투자자의 관심도는 평범한 수준이었다. [투자 점수 진단] [그림 2] 투자 점수 진단 씨티케이코스메틱스는 안정성(부채비율) 측면에서 두각을 나타내고 있다. 최근 부채비율은 97점으로 6개의 핵심 팩터 중 가장 높은 점수를 기록했다. 부채비율은  전체 시장 내 71위를 기록하며 상위 2.78%에 위치했다. 업종별로는 20위를 기록하며 상위 1.52%에 위치했다. (위의 AI인공지능 점수는 재무 데이터를 기반으로 전체 상장 종목과 비교/분석하여 도출한 점수로 높은 점수가 반드시 높은 수익률을 보장하지 않습니다. 위의 자료는 당사의 추천 종목이 아니며, 투자 시 참고용으로 제시해드리는 것입니다.) 라이온봇 기자 -한국경제TV※ 본 기사는 한국경제TV와 '거장들의 투자공식이'자체 개발한 '라이온봇 기자'가 실시간으로 작성한 기사입니다. 라이온봇기자 ⓒ 한국경제TV, 무단 전재 및 재배포 금지 한국경제TV 관련뉴스해당 언론사에서 선정하며 언론사 페이지(아웃링크)로 이동해 볼 수 있습니다.노사연♥이무송, 훈남 아들 공개 ""DNA 혁명""김생민 근황은?…박명수 예언 발언 ""소름 돋네""차인표, 신애라 반하게 한 '리즈시절' 미모 봤더니이은하, '쿠싱증후군' 극복 근황…""확 달라졌다""왕빛나 서구적 몸매 비결…'20kg을 한 번에?'"
머니투데이,260930,/news/news_read.nhn?article_id=0003975914&office_id=008&mode=search&query=씨티케이코스메틱스&page=1,2017-12-08 10:32,"[특징주]씨티케이코스메틱스, 상장 이튿날 17.85% 반등","[머니투데이 박계현 기자] 씨티케이코스메틱스가 상장 이틀째인 8일 오전 10시 30분 현재 코스닥시장에서 전일 대비 7550원(17.85%) 오른 4만9850원을 기록하고 있다. 공모가 5만5000원은 하회하고 있다. 외국인들이 오전 10시 기준 6만5000주를 순매수하며 주가를 견인하고 있다. 씨티케이코스메틱스는 전날 공모가 대비 23% 하락한 4만2300원으로 장을 마감했다. 상장 첫 날 기관 이 17만3800주, 외국인이 17만5899주를 순매도했다. 씨티케이코스메틱스는 2001년 설립된 화장품 기업으로 제품 기획부터 디자인·마케팅·외주생산까지  화장품 생산 관련 모든 과정을 대행하는 플랫폼 서비스업체다."
이데일리,260930,/news/news_read.nhn?article_id=0003987866&office_id=018&mode=search&query=씨티케이코스메틱스&page=1,2017-12-08 09:30,"[특징주]씨티케이코스메틱스, 상장 하루만 반등&hellip;공모가는 하회","[이데일리 이후섭 기자] 씨티케이코스메틱스(260930)가 상장 하루만에 반등세를 보이고 있다. 8일 오전 9시21분 현재 씨티케이코스메틱스 주가는 전날대비 3050원(7.21%) 오른 4만5350원을 기록 중이다. 상장 첫날인 전날 14.55% 하락세를 기록했으나 이날 강세로 돌아섰다. 다만 공모가(5만5000원)는 여전히 밑돌고 있다. 씨티케이코스메틱스는 지난 2001년 화장품 용기 제조업체로 시작해 파트너십을 통한 무공장 제조사업을 이어왔다. 특히 상품 기획부터 납품까지 원스톱으로 제공하는 풀 서비스 플랫폼 비즈니스라는 새로운 영역을 개척했다. 주요고객으로 세계 화장품시장 점유율 1위 로레알과 2위 유니레버, 4위 에스티로더 등 상위권 5개 기업이 매출 80% 이상을 책임지고 있다. 지난해 매출액 1338억원, 영업이익 267억원, 당기순이익 233억원을 달성했다. 씨티케이코스메틱스는 지난 5일 열린 `제54회 무역의 날 시상식에서 1억불 수출의 탑을 수상하기도 했다. 씨티케이코스메틱스는 지난해 7000만불 탑 수상 이후 1년만에 1억불 클럽에 가입하게 됐다. 회사는 향후 플랫폼사업 영향력을 더욱 강화할 계획이다. 특히 한국 파트너사에 집중했던 패키징(용기)과 포뮬러(내용물) 소싱 인프라를 해외로 확장할 예정이다."
한국경제TV,260930,/news/news_read.nhn?article_id=0000671936&office_id=215&mode=search&query=씨티케이코스메틱스&page=1,2018-08-14 14:20,"씨티케이코스메틱스, 전일 대비 약 -4% 하락한 22,850원","[한국경제TV 라이온봇 기자] [그림 1] 최근 3개월 간 주가 추세 및 기간별 수익률 씨티케이코스메틱스는 8월 14일 14시 19분 전일 대비 약 -4% 하락한 22,850원에 거래되고 있다. 씨티케이코스메틱스는 코스닥 상장 기업으로 화학 업종에 속해 있다. 시가총액은 2,404억원으로 코스닥 상장기업 중 218위에 위치 해 있다. [종목 성향 진단] [그림 2] 종목 성향 진단 씨티케이코스메틱스의 투자 스타일은 성장주에 가깝다. 주가 고평가 우려가 공존하지만 높은 성장성이 기대되는 기업이다. 주가 모멘텀은 좋지 못했다. 최근 3개월 수익률은 -40.99%의 하락폭을 기록했다. 최근 1개월 수익률 또한 -27.15% 하락하며 부진한 모멘텀을 이어가고 있다. 씨티케이코스메틱스 종목에 대한 투자자의 관심도는 높은 편에 속한다. [투자 점수 진단] [그림 3] 투자 점수 진단 씨티케이코스메틱스는 어느 측면에서 투자 매력도가 높은 종목일까? AI 인공지능 종목 분석 시스템을 이용해 성장성, 수익성, 효율성, 안전성, 저평가성, 추세 등 주가 수익률에 영향을 줄 수 있는 6가지 핵심 투자 지표를 점수화하여 종목의 투자 매력도를 계산해보았다. 그 결과 씨티케이코스메틱스는 상대적으로 재무안정성 측면에서 두각을 드러내고 있었다. 재무안정성 점수는 기업의 재무 구조가 얼마나 안정적인 상태인지를 나타낸다. 씨티케이코스메틱스는 특히 당좌비율 측면에서 가장 높은 점수는 기록했는데, 전체 시장 내 91위를 기록하며 상위 4.65%에 위치했다. 업종별로는 19위를 기록하며 상위 4.4%에 위치했다. 그러나 주가 상승 모멘텀을 나타내는 추세 측면에서는 아쉬움을 나타냈다. (위의 AI인공지능 점수는 재무 데이터를 기반으로 전체 상장 종목과 비교/분석하여 도출한 점수로 높은 점수가 반드시 높은 수익률을 보장하지 않습니다. 위의 자료는 당사의 추천 종목이 아니며, 투자 시 참고용으로 제시해드리는 것입니다. 핵심투자지표를 결합해 종목의 투자매력도를 종합 계산한 ""인공지능 투자점수""는 ""거장들의 투자공식"" 앱에서 확인하실 수 있습니다.) 라이온봇 기자 -한국경제TV※ 본 기사는 한국경제TV와 '거장들의 투자공식이'자체 개발한 '라이온봇 기자'가 실시간으로 작성한 기사입니다. 라이온봇기자"
머니투데이,260930,/news/news_read.nhn?article_id=0003933267&office_id=008&mode=search&query=씨티케이코스메틱스&page=1,2017-09-11 16:57,"씨티케이코스메틱스, 화장품 IPO 부진 극복할까?","[머니투데이 김도윤 기자] [글로벌 브랜드 고객으로 둔 화장품 회사로 5000억원 이상 기업가치 기대…화장품 IPO 줄줄이 부진해 고심 깊어져] 화장품 회사 씨티케이코스메틱스가 코스닥 상장을 추진 중인 가운데 시장에선 5000억원 이상의 기업가치 책정이 가능하다는 평가가 나온다. 다만 화장품 기업의 IPO(기업공개)가 잇따라 어려움을 겪은 만큼 씨티케이코스메틱스에도 부담이 될 수 있다는 지적이다. 11일 증권업계에 따르면 씨티케이코스메틱스는 지난 8일 코스닥 상장예비심사를 청구하고 본격적인 IPO 절차에 돌입했다. 주관사는 미래에셋대우다. 씨티케이코스메틱스 공모 규모는 1000억원 이상이 가능하다는 분석이 우세한 만큼 모처럼 코스닥에 등장한 '대어급'으로 주목받고 있다. 씨티케이코스메틱스는 에스티로더, 디올 등 미국, 유럽의 글로벌 화장품 브랜드를 고객으로 둔 화장품 개발 회사다. 고객사의 화장품 생산 전 기획 단계부터 협업해 전반적인 화장품 개발 및 디자인 등을 담당한다. 씨티케이코스메틱스가 화장품 개발과 디자인을 담당하고, 제품 생산은 외부 공장에서 맡는 구조다. 씨티케이코스메틱스는 글로벌 주요 화장품 브랜드와 거래하며 눈에 띄는 실적 향상에 성공했다. 지난해 매출액은 1338억원, 영업이익은 267억원으로 전년대비 각각 119.3%, 113.9% 증가했다. 올해 상반기에도 전년동기대비 실적 향상에 성공하며 올해 최대 실적 경신이 가능할 것으로 관측된다. 씨티케이코스메틱스는 최근 가파른 실적 성장세를 앞세워 5000억원 이상의 기업가치 평가를 이끌어 낼 것으로 전망된다. 지난해 순이익은 233억원으로, 기업가치 5000억원은 PER(주가수익비율) 약 21.4배다. 올해 상장한 에스디생명공학, 아우딘퓨쳐스 사례를 고려하면 무리한 밸류에이션은 아닌 것으로 보인다. 더구나 올해 역시 실적 향상이 예상된다는 점도 긍정적이다. 다만 화장품 종목의 주가 흐름이 부진한데다 앞서 상장한 에스디생명공학, 아우딘퓨쳐스 주가가 모두 공모가를 밑돌아 부담스러운 상황이다. IPO 시장에서 화장품 기업에 대한 부정적인 학습효과를 경험한 만큼 공격적인 기업가치 책정은 공모 흥행에 부정적인 영향을 미칠 수 있다. 더구나 에스디생명공학과 아우딘퓨쳐스 모두 공모 과정에서 흥행에 실패했다는 공통점이 있다. 에스디생명공학은 수요예측에서 기관투자자 수요를 끌어내지 못하며 공모가가 밴드 하단을 밑돈 1만2000원에 결정됐고, 아우딘퓨쳐스 청약경쟁률은 2.99대 1에 그쳤다. 씨티케이코스메틱스는 화장품 기업의 주가 약세는 사드 영향으로 인한 실적 악화 우려 때문인 만큼 시티케이코스메틱스는 관련 없다는 점을 강조할 것으로 보인다. 실제 씨티케이코스메틱스는 중국에서 발생하는 매출이 없다. 하지만 아우딘퓨쳐스 역시 중국 매출 비중이 10%로 미미하다는 점을 강조했는데도 불구하고 공모 시장에서 주목받지 못했다는 점은 고려해야 한다. 또 중국 화장품 원재료 기업인 컬러레이홀딩스 역시 사드 영향과 무관하다는 점을 주장했지만 공모가가 밴드 최하단인 3800원에서 결정됐고, 현재는 3000원 아래에서 거래 중이다."
머니투데이,260930,/news/news_read.nhn?article_id=0004023379&office_id=008&mode=search&query=씨티케이코스메틱스&page=1,2018-03-15 10:12,"씨티케이코스메틱스, 신규 고객사 4곳 확보&hellip;전년比 10% 성장 전망-DB","[머니투데이 박계현 기자] DB금융투자가 15일 씨티케이코스메틱스에 대해 ""일본 최대 바이어의 주요 색조 브랜드 수요 증가 등에 힘입어 올해 전년 대비 10%대 외형성장이 가능할 것""이라고 전망했다. 박현진 DB금융투자 연구원은 ""지난해 매출에서 로레알·LVMH·에스티로더 등 글로벌 고객사가 차지하는 비중이 62%에 달하나 올해 신규 고객사 4곳에서 상반기부터 매출이 발생하면서 3사의 매출 과점 비율이 낮아질 것""이라고 설명했다. 씨티케이코스메틱스는 지난해 4분기 일부 OTC 제품에 FDA 감사 이슈가 발생하면서 수주 감소를 겪었으나 연초 생산지를 미국으로 이전하면서 3월부터 정상 가동되고 있다. 지난해 매출액은 1135억원으로 전년 대비 15.2% 감소한 바 있다. 박 연구원은 ""생산원가가 높은 미국 내 생산으로 마진 개선은 제한적일 수 있지만, 매출 부진의 주요인이 해소된 점은 긍정적이며, 물량 증대에 따른 이익 개선이 가능할 전망""이라고 말했다."
파이낸셜뉴스,260930,/news/news_read.nhn?article_id=0004044386&office_id=014&mode=search&query=씨티케이코스메틱스&page=1,2018-06-22 09:56,"[fnRASSI]씨티케이코스메틱스, 거래량 확대되며 4거래일 연속 하락","씨티케이코스메틱스는 투자자들의 관심으로 현재 거래량이 최근 5거래일 거래량의 최고치를 넘어섰다. 그리고 씨티케이코스메틱스는 4일 연속 하락흐름을 보이며, 9시 54분 현재 6.46% 내린 30,400원에 거래중이다. 외국인, 기관 모두 보유량 감소 (5일 누적) 최근 5일간 동종목의 외국인 투자자는 20,148주 순매도하였고 마찬가지로 기관은 4,147주 순매도하였다. 전날 두 주체 각각 2,451주, 4,147주 순매도하며 보유 비율을 줄였다. 다음 표는 동종목의 외국인, 기관의 일별 순매수량을 나타낸 것이다. 기관투자자의 거래참여 높아, 거래비중 26.49% 최근 한달간 주체별 거래비중을 살펴보면 개인이 62.93%, 기관이 26.49%, 외국인은 10.56%를 기록한 것으로 나타났다. 그리고 최근 5일간 거래비중은 개인이 전체 거래의 53.78%를 차지하며 가장 적극적인 모습을 보여줬고, 기관은 35.16%를 나타냈으며 외국인은 11.05%를 나타냈다. 'fnRASSI'는 증권전문 기업 씽크풀과 파이낸셜뉴스의 협업으로 로봇기자가 실시간으로 생산하는 기사입니다."
