source,symbol,link,date,title,content
머니투데이,260930,/news/news_read.nhn?article_id=0004042529&office_id=008&mode=search&query=씨티케이코스메틱스&page=1,2018-04-24 16:36,"씨티케이코스메틱스, 중기&middot;스타트업 협업공간 만든다","[머니투데이 박계현 기자] [카이스트와 산학협력 진행중…화장품 관련 280건 특허 보유] 코스닥 상장사인 씨티케이코스메틱스가 국내외 화장품 중소업체 및 스타트업과의 상생·협력 강화에 나선다. 24일 씨티케이코스메틱스는 국내 중소형 스타트업 및 독립 브랜드 상생을 위해 오픈 이노베이션 센터를 제공할 계획이라고 밝혔다. 오픈이노베이션 센터에선 유튜버, 뷰티 블로거 등 화장품 관련 콘텐츠 제작자가 메이크업 관련 촬영을 할 수 있는 공간과 촬영장비를 제공할 계획이다. 또 중소기업이나 스타트업이 화장품 재료나 소재 등을 연구개발할 수 있는 공간도 마련된다. 씨티케이코스메틱스는 시장조사부터 제품기획, 디자인, 외주생산, 품질관리까지 화장품 관련 모든 과정을 풀서비스로 제공하는 플랫폼 기업이다. 자체 소유 R&D(연구·개발) 센터 설립을 통해 지속적으로 혁신적인 패키지 디자인 및 개발을 진행하고 있으며 세계 특허 인증을 통해 글로벌 시장의 확대에 박차를 가하고 있다. 현재 총 280건 이상의 특허를 보유하고 있다. 지난 2월부터는 한국과학기술원(KAIST)과 산학협력을 통해 신개념 색조화장품 개발을 위한 중장기 과제를 진행 중이다. 남윤성 카이스트 신소재공학과 교수와 김진웅 한양대학교 화학분자공학과 교수가 공동 개발에 참여해 스마트 나노 콜로이드(colloid)를 이용한 색상 변화를 연구하고 있다. 정인용 씨티케이코스메틱스 대표는 ""공간이 없는 플랫폼 사업의 특성상 사람과 기술이 우리의 핵심 자산""이라며 ""국내외 유망 기업이나 대학 등 연구기관, 참신한 독립 브랜드와 협업해 '개방형 혁신'(Open innovation)을 추구해 나가겠다""고 말했다. 정인용 씨티케이코스메틱스 대표/사진제공=씨티케이코스메틱스"
머니투데이,260930,/news/news_read.nhn?article_id=0004031086&office_id=008&mode=search&query=씨티케이코스메틱스&page=1,2018-03-30 14:57,씨티케이코스메틱스 &quot;3분기 미국 물류센터 가동&hellip;사업 확장&quot;,"[머니투데이 박계현 기자] [정인용 대표 ""플랫폼 비즈니스 본격화…컨설팅 자회사도 시동""] 30일 씨티케이코스메틱스 주주총회에서 경영진들이 주주들의 질의에 답하고 있다./사진제공=씨티케이코스메틱스  씨티케이코스메틱스가 30일 주주총회를 열고 올 3분기부터 미국 풀필먼스(물류)센터를 완공하고 '풀서비스'(Full service) 플랫폼을 제공하겠다고 밝혔다. 정인용 씨티케이코스메틱스 대표는 이 날 주주총회가 끝난 뒤 주주와의 간담회를 통해 ""오는 3분기부터 고객사가 주문 한번으로 제품 기획, 생산, 물류·재고관리까지 할 수 있는 플랫폼 비즈니스를 실현할 수 있게 된다""며 ""최적화된 제품 풀서비스를 제공해 신규 고객사를 유치하는 등 사업을 확장해 나가겠다""고 말했다. 미국 LA 지역에 처음 건립한 풀필먼스 센터는 온라인 주문에 대응하기 위한 창고 겸 물류센터다. 회사 측은 향후 3~5년 내 미국 서부지역을 중심으로 4~5곳의 센터를 설치할 계획이다. 또 씨티케이코스메틱스는 지난해 하반기 설립된 화장품 브랜드 컨설팅 자회사 'CTK브랜드 랩'의 사업을 오는 2분기부터 본격 진행, 하반기부터는 매출이 발생할 것으로 기대하고 있다. 정 대표는 ""CTK브랜드 랩은 고객사에서 리테일스토어 맞춤형 브랜드를 직접 만들어 달라는 요청을 받고 시작한 사업""이라며 ""고객사 측 브랜드 설립을 자문하면서 핵심 고객사와 관계를 더욱 강화할 수 있는 측면이 있다""고 설명했다. 이어 ""지난해 매출 감소에 영향을 미친 미국 FDA 인증 이슈는 이 달 중순부터 공급처를 미국 소재지로 이전하면서 해결됐다""고 덧붙였다. 한편 씨티케이코스메틱스는 이번 주총에서 강한경 보성인더스트리 대표를 임기 3년의 감사로 신규선임했다."
동아일보,260930,/news/news_read.nhn?article_id=0003114365&office_id=020&mode=search&query=씨티케이코스메틱스&page=1,2017-12-12 03:06,[상장기업&amp;CEO]정인용 씨티케이코스메틱스 대표,"[동아일보] “美 화장품 물류시장 진출해 몸집 키울 것” “소싱 인프라를 해외로 확장하고 사업 밸류체인 영역을 더 넓혀 글로벌 화장품 플랫폼 비즈니스 시장 지배력을 강화하겠습니다.” 정인용 씨티케이(CTK)코스메틱스 대표이사 사장(45·사진)은 “미국 화장품 물류시장 진출, 해외 유명인 또는 대기업과의 화장품 브랜드 기획 등으로 5년 내 매출 5억 달러(약 5500억 원)를 달성할 계획이다”고 말했다. CTK코스메틱스는 화장품 풀 서비스 플랫폼 기업으로 2001년 설립됐다. 코스닥 시장에서 두 번째로 패스트 트랙(신속 상장 제도)을 적용받아 7일 상장했다. CTK코스메틱스는 화장품 용기를 외주로 만들어 납품하다가 2009년 글로벌 브랜드에 새 화장품의 기획, 개발, 생산, 마케팅, 품질관리, 선적까지 일련의 서비스를 원스톱으로 제공하는 사업을 세계 최초로 시작했다. 로레알, 유니레버, 에스티로더, 샤넬, 루이뷔통 등 글로벌 화장품 브랜드 100여 개와 거래하고 있다. 이들과 수행한 프로젝트는 100만 개 이상 팔린 커피 캡슐형 파운데이션 콤팩트 등 968건(작년 말 기준)에 이른다. CTK코스메틱스는 자체 공장 없이 화장품 용기 및 내용물 주문자상표부착생산(OEM) 업체 100여 곳을 활용해 지난해 미국에 화장품 1억 달러어치를 수출했다. 한국의 대미(對美) 화장품 수출액의 약 30%에 해당한다. 정 사장은 미국 오하이오주립대 경제학과를 마치고 귀국해 씨엠아이태가코리아를 창업했다. 알루미늄 용기 제조업체 태가통상을 38년간 운영한 부친의 영향을 받아 플라스틱 화장품 용기를 외주 제작해 수출했다. 2004년 메이크업 아티스트 이경민 씨와 손잡고 색조화장품 브랜드 ‘비디비치’를 시장에 내놨다. 이때 화장품 용기와 내용물, 포장지 업체에 대한 정보 부족으로 원하는 제품을 만드는 데 애를 먹었던 경험을 살려 화장품 풀 서비스 사업에 나섰다. 그는 “국내에 브랜드, 중국 상하이에 용기, 프랑스 파리에 내용물, 일본 도쿄에 디자인, 미국 뉴욕과 로스앤젤레스에 마케팅센터를 세워 풀 서비스 플랫폼 역량을 강화하겠다”며 “기획 중인 새 화장품 브랜드 6개에 투자해 지분 30%를 확보할 생각이다”고 말했다. CTK코스메틱스는 지난해 매출 1338억 원에 영업이익 267억 원을 올렸다. 공모자금(약 1100억 원)은 미국 3곳에 물류센터 설치, 미국 2곳에 합작 생산시설 구축, 해외 유통 대기업과 새 브랜드 기획, 화장품 연구개발 등에 쓸 예정이다."
한국경제TV,260930,/news/news_read.nhn?article_id=0000671171&office_id=215&mode=search&query=씨티케이코스메틱스&page=1,2018-08-13 10:15,"씨티케이코스메틱스, 전일 대비 약 -7% 하락한 23,800원","[한국경제TV 라이온봇 기자] [그림 1] 최근 3개월 간 주가 추세 및 기간별 수익률 씨티케이코스메틱스는 8월 13일 10시 15분 전일 대비 약 -7% 하락한 23,800원에 거래되고 있다. 씨티케이코스메틱스는 코스닥 상장 기업으로 화학 업종에 속해 있다. 시가총액은 2,581억원으로 코스닥 상장기업 중 208위에 위치 해 있다. [종목 성향 진단] [그림 2] 종목 성향 진단 씨티케이코스메틱스의 투자 스타일은 성장주에 가깝다. 주가 고평가 우려가 공존하지만 높은 성장성이 기대되는 기업이다. 주가 모멘텀은 좋지 못했다. 최근 3개월 수익률은 -37.35%의 하락폭을 기록했다. 최근 1개월 수익률 또한 -16.67% 하락하며 부진한 모멘텀을 이어가고 있다. 씨티케이코스메틱스 종목에 대한 투자자의 관심도는 평범한 수준이었다. [투자 점수 진단] [그림 3] 투자 점수 진단 씨티케이코스메틱스는 어느 측면에서 투자 매력도가 높은 종목일까? AI 인공지능 종목 분석 시스템을 이용해 성장성, 수익성, 효율성, 안전성, 저평가성, 추세 등 주가 수익률에 영향을 줄 수 있는 6가지 핵심 투자 지표를 점수화하여 종목의 투자 매력도를 계산해보았다. 그 결과 씨티케이코스메틱스는 상대적으로 재무안정성 측면에서 두각을 드러내고 있었다. 재무안정성 점수는 기업의 재무 구조가 얼마나 안정적인 상태인지를 나타낸다. 씨티케이코스메틱스는 특히 당좌비율 측면에서 가장 높은 점수는 기록했는데, 전체 시장 내 91위를 기록하며 상위 4.65%에 위치했다. 업종별로는 19위를 기록하며 상위 4.4%에 위치했다. 그러나 주가 상승 모멘텀을 나타내는 추세 측면에서는 아쉬움을 나타냈다. (위의 AI인공지능 점수는 재무 데이터를 기반으로 전체 상장 종목과 비교/분석하여 도출한 점수로 높은 점수가 반드시 높은 수익률을 보장하지 않습니다. 위의 자료는 당사의 추천 종목이 아니며, 투자 시 참고용으로 제시해드리는 것입니다. 핵심투자지표를 결합해 종목의 투자매력도를 종합 계산한 ""인공지능 투자점수""는 ""거장들의 투자공식"" 앱에서 확인하실 수 있습니다.) 라이온봇 기자 -한국경제TV※ 본 기사는 한국경제TV와 '거장들의 투자공식이'자체 개발한 '라이온봇 기자'가 실시간으로 작성한 기사입니다. 라이온봇기자"
머니투데이,260930,/news/news_read.nhn?article_id=0004030315&office_id=008&mode=search&query=씨티케이코스메틱스&page=1,2018-03-29 11:34,"[특징주]씨티케이코스메틱스, 외인 매수에 강세&hellip;전일比 4.27%&uarr;","[머니투데이 박계현 기자] 씨티케이코스메틱스가 29일 오전 11시 32분 현재 코스닥 시장에서 전일 대비 4.27%(1550원) 오른 3만7850원에 거래되고 있다. 최근 10거래일 내 최고 거래량을 기록중으로 거래량 6만5000주를 돌파했다. 오전 11시 2분 기준 외국인이 7000주를 순매수 중이다. 외국계 증권사인 크레딧스위스가 매수 창구 상위에 이름을 올렸다. 안지영 IBK투자증권 연구원은 화장품업종에 대해 ""글로벌 브랜드의 한국 전문 제조업체 선호도가 증가하면서 OEM·ODM 업계 고객사의 세분화가 구체화되고 있다""며 ""화장품 제조업체들이 브랜드사와 비교해 지난해 사드 쇼크를 한박자 빨리 벗어날 것""이라고 분석했다."
한국경제,260930,/news/news_read.nhn?article_id=0003862078&office_id=015&mode=search&query=씨티케이코스메틱스&page=1,2017-12-07 09:17,"[특징주]씨티케이코스메틱스, 상장 첫날 약세&hellip;공모가 하회","씨티케이코스메틱스가 코스닥 시장 상장 첫 날 하락해 공모가(5만5000원)를 밑돌았다. 씨티케이코스메틱스는 7일 시초가를 공모가보다 낮은 4만9500원에 결정했다. 이후 오전 9시8분 현재 시초가 대비 7600원(15.35%) 내린 4만1900원에 거래되고 있다. 씨티케이코스메틱스는 화장품 브랜드로부터 수주를 받아 제품 기획부터 개발, 마케팅 및 생산까지 원스톱으로 일괄생산(턴키)해 납품하는 기업 간 거래(B2B) 회사로 '화장품 풀(full) 서비스 플랫폼' 기업을 표방한다. 올해 코스닥 '패스트트랙'(상장 간소화 절차)을 적용받은 두 번째 기업이다."
서울경제,260930,/news/news_read.nhn?article_id=0003242566&office_id=011&mode=search&query=씨티케이코스메틱스&page=1,2018-03-13 10:54,"(코)씨티케이코스메틱스, 전일 대비 7.13% 상승.. 일일회전율은 1.16% 기...","[서울경제] 씨티케이코스메틱스(260930) 는 13일 오전 10시 54분 현재 7.13% 오른 36,800원에 거래되고 있으며, 44(매도):56(매수)의 매수우위를 기록하고 있다. 거래대금은 43억4,727만, 거래량은 11만7,614주로 거래량회전율은 1.16%로 나타났다. 지난 1개월간 씨티케이코스메틱스는 상승 12회, 하락 15회를 기록했고, 주가수익률은 -2.00% 표준편차는 2.45%를 기록했다. 이 기간 ' 화학업 ' 업종 평균 주가수익률은 0.85%로 나타났으며, 변동성은 1.87%를 기록했다. 이 시각 현재 ' 화학업 '은 1.28% 상승 중이며, 50(매도):50(매수)의 보합세를 보이고 있다"
매일경제,260930,/news/news_read.nhn?article_id=0004062081&office_id=009&mode=search&query=씨티케이코스메틱스&page=1,2017-12-07 09:13,"[Hot-Line] 씨티케이코스메틱스, 상장 첫날 급락",씨티케이코스메틱스가 상장 첫날 급락세다. 7일 오전 9시 3분 현재 씨티케이코스메틱스는 시초가 대바 7700원(15.56%) 내린 4만1800원에 거래되고 있다. 이는 공모가는 5만5000원 대비 크게 부진한 수준이다. 2001년 화장품 용기 제조 목적으로 설립한 씨티케이코스메틱스는 2009년부터 글로벌 화장품 기업을 대상으로 '풀 서비스' 사업을 시작했다. 풀 서비스 사업은 고객사에 상품 기획부터 납품까지 한꺼번에 제공하는 원스톱 서비스다. [디지털뉴스국 김경택 기자] r_start // r_end //
머니투데이,260930,/news/news_read.nhn?article_id=0003973678&office_id=008&mode=search&query=씨티케이코스메틱스&page=1,2017-12-04 16:25,씨티케이코스메틱스 &quot;매년 20~25% 성장 가능해&quot;,"[머니투데이 박계현 기자] [[인터뷰]정인용 대표 ""여성 사회참여 할수록 화장품 산업 고속성장""…7일 코스닥 상장] 정인용 씨티케이코스메틱스 대표/사진제공=씨티케이코스메틱스 ""업계 최초 '풀서비스'(Full Service)에 대한 확신은 있었지만 2008년 미국에서 서브프라임 위기가 터지자 수주받기 힘든 환경이 됐다. 그때 딱 3년만 채우고 버티자 했던 것이 여기까지 왔다."" 지난달 30일 경기 판교 본사에서 만난 정인용 씨티케이코스메틱스 대표는 ""당시에는 화장품 용기 수주 사업을 병행했기 때문에 3년이라는 시간을 버틸 수 있었다""며 ""3년이 얼마 안 남은 시점에 홍콩 브랜드의 첫 수주를 시작으로 북미 브랜드의 주문이 이어졌다""고 말했다. 오는 7일 상장을 앞둔 씨티케이코스메틱스(이하 씨티케이)는 2001년 설립된 화장품 기업으로 제품 기획부터 디자인·마케팅·외주생산까지 모든 과정을 대행하는 플랫폼 서비스업체다. 최신 화장품 유행을 분석해 연구개발(R&D)과 기획을 끝낸 뒤 적절한 포뮬러와 용기 등을 소싱해 고객사에 턴키(turn key)로 납품한다. 미국 오하이오주립대에서 학부를 마친 정 대표는 귀국 당시 유학생활 후원자였던 에스티로더 부사장에게 ""아버지가 운영하던 알루미늄 용기 공장 대신 플라스틱 용기 제조업에 도전해보라""는 조언을 받는다. 이후 메이크업아티스트 이경민 씨가 운영하는 비디비치를 공동 창업해 약 5년간 일한 뒤 독립을 결심했다. 정 대표는 ""당장 가을 시즌에 맞춰 신제품을 출시해야 하는데 해외 OEM사에 주문한 원료가 출시 일정까지 오지 않는 일이 허다했다""고 설명했다. 이어 ""또 급박하게 도착한 원료 중 하나가 잘못돼 있어도 책임을 지울 수 없어 적자가 발생할 수밖에 없는 환경이었다""고 덧붙였다. 정 대표는 ""화장품 OEM(제조자개발생산)·ODM(주문자상표부착)사 관리는 에스티로더 같은 큰 회사에서도 쉽지 않은 일""이라며 ""장기간 협력업체들과 쌓아온 신뢰 관계가 회사의 핵심 자산""이라고 말했다. 이어 ""국내 포뮬러 제조업체들이 글로벌 브랜드에서도 인정받는 제품을 내놓기 때문에 발빠르게 제품을 기획할 경우 글로벌 시장에서 계속 성장세를 탈 수밖에 없다""고 덧붙였다. 씨티케이코스메틱스는 북미 거래라인이 필요했던 OEM·ODM사와 글로벌 브랜드 사이에서 '징검다리' 역할을 했다. 씨티케이는 현재 매출의 90.5%를 로레알·유니레버·에스티로더·샤넬·LVMH 등 글로벌 화장품 브랜드 수주로 채우고 있다. 씨티케이의 지난해 북미 수출액은 약 1억달러로, 한국 화장품 전체 북미 수출액의 3분의 1을 차지했다. 올 상반기에는 매출액 727억원, 영업이익 198억원, 당기순이익 126억원을 기록했다. 상반기 매출의 92.4%도 북미 수출액이다. 직원이 104명에 불과한 씨티케이는 해외영업과 국내 구매관리팀의 일정이 톱니바퀴처럼 돌아가야 올해 매출 목표치인 1500억원 이상을 달성할 수 있다. 화장품업계에서 씨티케이 같은 플랫폼 비즈니스가 가능할 수 있는 이유는 화장품산업의 유행이 기존 기업이 쫓아갈 수 없을 정도로 빠르게 변하기 때문이다. 정 대표는 ""과거처럼 마케팅 비용을 많이 지출하는 회사가 시장을 장악하기에는 SNS를 통한 트렌드 변화가 너무 빠르다""며 ""글로벌 브랜드로선 OEM 관리 및 생산·재고관리 위험 부담을 함께 질 수 있는 파트너사를 필요로 할 수밖에 없는 상황""이라고 말했다. 사실상 경쟁자가 없는 시장에서 씨티케이는 사업영역 및 서비스지역을 확대해 나가고 있다. 향후 3~4년 내에 브랜드 기획·물류서비스센터까지 영역을 확대해 고객들이 한 장의 PO(발주서)로 완제품을 받아볼 수 있게 할 예정이다. 또 일본 디자인센터에서 용기 디자인을 하면 중국에서 용기를 생산해 세계 각국의 OEM에서 생산한 포뮬러를 채워 '메이드 인 글로벌'로 나아간다는 계획이다. 정 대표는 ""세계적으로 화장품산업이 가장 폭발적으로 성장했던 시기는 대공황처럼 여성들이 나가서 일을 하기 시작했던 시기""라며 ""세계에서 여성들의 사회 참여율이 높아질수록 화장품 산업은 성장일로를 걷을 수밖에 없다""고 말했다. 이어 ""매년 20~25%의 외형 성장은 기존 고객만 유지해도 가능한 자연 성장률로 파악하고 있다""며 자신감을 보였다."
연합뉴스,260930,/news/news_read.nhn?article_id=0009734674&office_id=001&mode=search&query=씨티케이코스메틱스&page=1,2017-12-07 09:10,[특징주] 씨티케이코스메틱스 코스닥 첫날 약세&hellip;공모가 하회,"(서울=연합뉴스) 권수현 기자 = 씨티케이코스메틱스가 코스닥 시장 상장 첫날인 7일 장 초반 약세를 보이고 있다. 이날 오전 9시6분 현재 씨티케이코스메틱스는 시초가(4만9천500원) 대비 17.17% 하락한 4만1천원선에 거래되고 있다. 이는 공모가인 5만5천원 대비 25% 이상 떨어진 수준이다. 씨티케이코스메틱스는 글로벌 화장품 브랜드로부터 수주를 받아 제품 기획부터 개발, 마케팅 및 생산까지 화장품 생산의 모든 과정을 서비스하는 '풀서비스' 사업을 하는 업체로 '패스트트랙'(상장 간소화 절차)을 적용받아 코스닥에 입성했다. 지난해 매출은 1천339억원, 당기순이익은 233억원이었다."
머니투데이,260930,/news/news_read.nhn?article_id=0003953402&office_id=008&mode=search&query=씨티케이코스메틱스&page=1,2017-10-25 16:36,"씨티케이코스메틱스, 코스닥 상장예심 통과&hellip;&quot;12월 초 상장&quot;","[머니투데이 박계현 기자] [기업가치 5000억원 안팎…지난해 매출액 1339억원 기록] 씨티케이코스메틱스가 지난 24일 코스닥 상장예비심사를 통과하고 오는 12월 초 상장을 마무리할 계획이라고 25일 밝혔다. 씨티케이코스메틱스는 내주 중 증권신고서를 제출하고 본격적인 공모에 나선다. 씨티케이코스메틱스는 글로벌 화장품 기업에서 주문을 받아 브랜드 또는 상품을 기획하고 개발해 제조까지 맡아서 진행하는 원스톱 서비스를 제공한다. 제품 생산은 국내외 ODM·OEM 파트너사들을 활용한다. 공장 없이 주문받은 물량만 외주형태로 제조한다. 지난해 씨티케이코스메틱스의 매출액은 전년 대비 119.3% 증가한 1338억8000만원을 기록했다. 영업이익은 114% 오른 267억원, 당기순이익은 126.3% 오른 233억2000만원을 기록했다. 현재 미국, 유럽 등의 화장품 기업에서 브랜드 기획과 제조까지 턴키(turn-key·일괄수주) 형태로 의뢰받아 완제품을 제공하고 있어 수출 비중이 99%다. 이 외에도 화장품 케이스, 포뮬러 등 다양한 제품을 개발해 납품하고 있다. 정인용 씨티케이코스메틱스 대표는 ""글로벌 화장품 산업 트렌드에 발빠르게 대응하며 다양한 상품과 서비스를 개발 중""이라며 ""코스닥 시장에 성공적으로 상장할 수 있도록 최선을 다하겠다""고 말했다. 상장예정주식수는 1012만5709주로 이중 19.8%인 200만주를 공모할 예정이다. 시장에선 5000억원 안팎의 기업가치를 인정받을 수 있을 것으로 평가하고 있다. 주관사는 미래에셋대우다."
머니투데이,260930,/news/news_read.nhn?article_id=0004022155&office_id=008&mode=search&query=씨티케이코스메틱스&page=1,2018-03-13 09:15,"[특징주]씨티케이코스메틱스, 호실적 전망에 전일 대비 10.63%&uarr;","[머니투데이 박계현 기자] 씨티케이코스메틱스가 13일 오전 9시 13분 현재 코스닥시장에서 전일 대비 10.63%(3650원) 오른 3만8000원을 기록하고 있다. 한국희 NH투자증권 연구원은 ""지난해 12월 상장 이후 실적 부진으로 공모가를 크게 하회하는 주가 흐름이 지속되고 있다""며 ""국내 투자자들에겐 낯설게 받아들일 수 있는 플랫폼 비즈니스를 영위하지만 글로벌 화장품산업 트렌드에 부합하는 구조적 성장 여력을 갖췄다""고 평가했다. 씨티케이코스메틱스는 생산 시설을 보유하지 않고 화장품 제품 기획에서 디자인 마케팅 외주 생산에 이르기까지 모든 과정을 외주 서비스로 제공하는 기업이다. 로레알, LVMH, 에스티로더, 유니레버, 샤넬 등 글로벌 메이저 브랜드가 매출의 80%를 차지한다. NH투자증권은 올해 실적 추정치로 매출액 1400억원, 영업이익 280억원을 제시했다."
