source,symbol,link,date,title,content
연합뉴스,260930,/news/news_read.nhn?article_id=0009736369&office_id=001&mode=search&query=씨티케이코스메틱스&page=1,2017-12-07 16:01,[특징주] 씨티케이코스메틱스 코스닥 첫날 약세&hellip;공모가 하회(종합),"(서울=연합뉴스) 권수현 기자 = 씨티케이코스메틱스가 코스닥 시장 상장 첫날인 7일 공모가 아래로 떨어졌다. 이날 씨티케이코스메틱스는 시초가(4만9천500원) 대비 14.55% 하락한 4만2천300원에 거래를 마쳤다. 이는 공모가인 5만5천원에서 23%가량 떨어진 수준이다. 씨티케이코스메틱스는 글로벌 화장품 브랜드로부터 수주를 받아 제품 기획부터 개발, 마케팅 및 생산까지 화장품 생산의 모든 과정을 서비스하는 '풀서비스' 사업을 하는 업체로 '패스트트랙'(상장 간소화 절차)을 적용받아 코스닥에 입성했다. 지난해 매출은 1천339억원, 당기순이익은 233억원이었다."
이데일리,260930,/news/news_read.nhn?article_id=0003987127&office_id=018&mode=search&query=씨티케이코스메틱스&page=1,2017-12-07 10:15,[포토] 씨티케이코스메틱스 코스닥시장 신규상장,"[이데일리 김태형 기자] 한국거래소 코스닥시장본부는7일 서울사옥 홍보관에서 색조(기초)화장품 제조업체인 (주)씨티케이코스메틱스의 코스닥시장 신규상장기념식을 개최하였다. 왼쪽부터 최규준 한국IR협의회 부회장, 정운수 한국거래소 코스닥시장본부장 직무대행, 정인용 (주)씨티케이코스메틱스 대표이사, 조웅기 미래에셋대우 대표이사, 송윤진 코스닥협회 부회장. (사진=한국거래소)"
이데일리,260930,/news/news_read.nhn?article_id=0004184932&office_id=018&mode=search&query=씨티케이코스메틱스&page=1,2018-08-29 17:59,"씨티케이코스메틱스, 상반기 영업손실 14억원&hellip;적자전환","[이데일리 박태진 기자] 씨티케이코스메틱스(260930)는 올 상반기 연결기준 영업손실이 13억5400만원으로 전년동기대비 적자전환했다고 29일 공시했다. 매출액은 413억5200만원으로 전년대비 43.12% 감소했고, 당기순이익은 22억8400만원으로 같은 기간 81.92% 줄었다."
아시아경제,260930,/news/news_read.nhn?article_id=0004135236&office_id=277&mode=search&query=씨티케이코스메틱스&page=1,2017-12-07 09:55,[포토]씨티케이코스메틱스 코스닥 신규상장 기념식,"[아시아경제 권성회 기자] 한국거래소 코스닥시장본부는 7일 오전 8시40분부터 서울사옥 홍보관에서 색조(기초)화장품 제조업체인 씨티케이코스메틱스의 코스닥시장 신규상장기념식을 개최했다. 상장기념패 전달 후 기념촬영. 사진 왼쪽부터 최규준 한국IR협의회 부회장, 정운수 한국거래소 코스닥시장본부장 직무대행, 정인용 씨티케이코스메틱스 대표이사, 조웅기 미래에셋대우 대표이사, 송윤진 코스닥협회 부회장"
서울경제,260930,/news/news_read.nhn?article_id=0003169781&office_id=011&mode=search&query=씨티케이코스메틱스&page=1,2017-12-07 17:15,씨티케이코스메틱스 상장 첫날 급락 왜?,"'화장품 풀서비스' 사업 불확실성 탓 공모가 대비 23% 하락한채 장 마감 [서울경제] 화장품 개발·마케팅 기업 씨티케이코스메틱스(260930) 가 코스닥 상장 첫날 공모가보다 낮은 주가에 장을 마감했다. 화장품 개발·마케팅 등 모든 과정을 서비스하는 ‘화장품 풀서비스’라는 생소한 업종에 투자자들이 투자를 망설였다는 분석이다. 씨티케이코스메틱스는 7일 공모가 대비 23% 하락한 4만2,300원에 장을 마쳤다. 시초가 대비로는 14.55% 내린 가격이다. 특히 시초가도 4만9,500원으로 결정되며 공모가보다 10% 떨어진 채 첫 거래를 시작했다. 이날 주가 하락세는 전체적인 시장 약세와 생소한 산업에 따른 경계감 때문으로 풀이된다. 7일 코스닥지수는 전일 대비 1.94%나 하락하며 전체적인 약세장을 보였다. 또 화장품 업계 최초 ‘풀서비스’라는 낯선 사업 아이템도 영향을 미친 것으로 풀이된다. 한 자산운용사 관계자는 “씨티케이코스메틱스는 사실상 마케팅 회사로 화장품 생산시설도 없어 아직 화장품 업종으로 분류하기 애매한 부분이 있다”고 평가했다. 씨티케이코스메틱스는 화장품 제품 기획부터 디자인·마케팅·외주생산까지 모든 과정을 대행하는 서비스 기업이다. 생소한 사업구조 덕분에 일반 청약 당시 경쟁률만 145대1을 기록할 정도로 관심을 받았지만 첫 정규 거래일 시장 약세와 사업 불확실성 때문에 주가가 공모가보다 낮은 수준에서 장을 끝냈다는 분석이다."
뉴스1,260930,/news/news_read.nhn?article_id=0003086670&office_id=421&mode=search&query=씨티케이코스메틱스&page=1,2017-12-07 09:47,(주)씨티케이코스메틱스 코스닥시장 신규상장기념식,"한국거래소 코스닥시장본부는 7일 오전 서울사옥 홍보관에서 (주)씨티케이코스메틱스의 코스닥시장 신규상장기념식을 개최했다. 상장기념패 전달 후 최규준 한국IR협의회 부회장(왼쪽부터), 정운수 한국거래소 코스닥시장본부장 직무대행, 정인용 (주)씨티케이코스메틱스 대표이사, 조웅기 미래에셋대우 대표이사, 송윤진 코스닥협회 부회장이 박수치고 있다. (한국거래소 제공) 2017.12.7/뉴스1"
헤럴드경제,260930,/news/news_read.nhn?article_id=0001342625&office_id=016&mode=search&query=씨티케이코스메틱스&page=1,2018-01-18 14:00,"[생생코스닥] 씨티케이코스메틱스, 200억 규모 PEF에 출자","- 전략적 파트너로서 잠재적 고객이 될 유망한 해외 신생 브랜드 발굴ㆍ육성 [헤럴드경제=김지헌 기자] 코스메틱 풀 서비스 플랫폼 전문 기업 CTK코스메틱스(대표 정인용)는 스마일게이트인베스트먼트가 설립하는 200억원 규모의 사모펀드(씨티케이 스마일게이트 글로벌 파트너십 사모투자합자회사)에 120억원을 출자한다고 18일 공시했다. 씨티케이코스메틱스와 더불어 정인용 대표 개인도 유한책임사원으로 20억원을 출자할 예정이며, 무한책임사원인 스마일게이트인베스트먼트도 자기자본으로 60억원을 출자할 예정이다. [사진=오픈애즈] 이번 사모펀드 설립으로 씨티케이코스메틱스는 상장 당시 발표했던 공모자금 활용의 목적으로 회사의 전후방 사업에 대한 종합적인 투자를 진행한다. 동시에 자회사인 씨티케이브랜드랩에서 진행하는 고객사 브랜딩 프로젝트에도 지분 참여를 함으로써 잠재 고객이 될 수 있는 북미 유망 브랜드 및 아시아 신생 브랜드를 발굴하고 육성할 계획이다. 단, 브랜드를 인수하거나 경영권을 확보하는 것은 아니며, 지분 투자를 통해 전략적 파트너로서 화장품 브랜드 개발과 장기적 사업 파트너십을 강화하면서 동반 성장한다는 것이 핵심이다. 스마일게이트인베스트먼트 관계자는 “투자 당시 씨티케이코스메틱스의 장기적인 성장 가능성에 대한 확실한 믿음을 가지고 대규모 투자를 결정했고, 앞으로도 단순한 재무적 투자자가 아닌 전략적 파트너이자 주요 주주로서 장기적으로 함께 할 계획”이라며 “스마일게이트의 국내외 네트워크를 적극 활용해 씨티케이코스메틱스의 추가적인 성장에 장기적이고 지속적으로 협력할 방침”이라고 강조했다. 정인용 씨티케이코스메틱스 대표도 “올해는 씨티케이코스메틱스가 새롭게 성장하는 한 해가 될 것”이라면서 “당사의 중장기적인 성장 전략에 맞춰 기업과 주주가치를 제고할 수 있도록 최선을 다하겠다”고 밝혔다."
한국경제,260930,/news/news_read.nhn?article_id=0003861989&office_id=015&mode=search&query=씨티케이코스메틱스&page=1,2017-12-06 22:26,[코스닥 메모] (7일) 신규상장=씨티케이코스메틱스(260930) 등,◇신규상장=씨티케이코스메틱스(260930) ◇변경상장=처음앤씨→지와이커머스(상호변경) ◇구주주청약=삼보산업 [
매일경제,260930,/news/news_read.nhn?article_id=0004062586&office_id=009&mode=search&query=씨티케이코스메틱스&page=1,2017-12-07 17:51,[포토] 씨티케이코스메틱스 코스닥 상장,"씨티케이코스메틱스 코스닥 상장 화장품업체 씨티케이코스메틱스의 코스닥 상장 기념식이 7일 한국거래소에서 열렸다. 최규준 한국IR협의회 부회장, 정운수 한국거래소 상무, 정인용 씨티케이코스메틱스 대표, 조웅기 미래에셋대우 대표, 송윤진 코스닥협회 부회장(왼쪽부터)이 기념촬영을 하고 있다. 이날 씨티케이코스메틱스는 공모가 5만5000원보다 23.09% 떨어진 4만2300원에 거래를 마쳤다. [사진 제공 = 한국거래소] r_start // r_end //"
서울경제,260930,/news/news_read.nhn?article_id=0003169913&office_id=011&mode=search&query=씨티케이코스메틱스&page=1,2017-12-07 18:17,[서울경제TV] 씨티케이코스메틱스 상장 첫날 공모가 하회,"씨티케이코스메틱스 상장 첫날 공모가 밑으로 화장품 풀 서비스 플랫폼 기업… 기획·제작·납품 총괄 OEM·ODM 업체와 협력, 자체 공장 없이 생산 작년 영업이익 267억원… 2012년 이후 연평균 99% 성장"
한국경제,260930,/news/news_read.nhn?article_id=0003852997&office_id=015&mode=search&query=씨티케이코스메틱스&page=1,2017-11-20 08:18,"&quot;씨티케이코스메틱스, 색조 시장 성장 수혜 기대&quot;-유진","유진투자증권은 다음달 7일 코스닥시장에 상장 예정인 씨티케이코스메틱스에 대해 향후 세계 색조화장품 시장의 성장 수혜가 기대된다고 20일 분석했다. 이선화 유진투자증권 연구원은 ""씨티케이코스메틱스는 별도의 공장시설을 보유하지 않고 화장품을 외주생산해 글로벌 화장품 브랜드 업체에 수출하는 기업""이라며 ""다양한 파트너사의 빅데이터를 기반으로 한 화장품 풀서비스 플랫폼 기업을 표방한다""고 밝혔다. 씨티케이코스메틱스는 100여 개가 넘는 글로벌 파트너사와 협력 관계에 있고, 로레알, 유니레버, 에스티로더 등 해외 유명 브랜드 업체를 고객사로 보유하고 있다고 이 연구원은 전했다. 매출의 90%가 북미 지역에서 발생하고 있고, 한국 화장품 전체 북미 수출액의 3분의 1이 씨티케이코스메틱스로부터 발생한다고 설명했다. 또한 씨티케이코스메틱스의 주력 거래처인 글로벌 브랜드는 제품의 라이프사이클이 5~7년으로 긴 편인 만큼 안정적인 실적이 확보되는 경향이 있다고 분석했다. 지난해의 경우 리오더 매출 비중이 82%에 달했다고 전했다. 밀레니얼 세대가 화장품의 주요 소비층으로 떠오르면서 세계 색조 화장품 시장의 성장이 가파른 만큼 관련 수혜도 기대된다는 관측이다. 이 연구원은 ""IT코스메틱스, 켄도, 타르트, 아워글래스, 세포라 등 밀레니얼 세대에게 인기 있는 브랜드를 씨티케이코스메틱스가 주요 고객사로 보유하고 있다""며 ""해당 브랜드의 유통채널이 공격적으로 확장하고 있어 지속적인 성장 동력이 확보됐다""고 평가했다."
뉴시스,260930,/news/news_read.nhn?article_id=0008329382&office_id=003&mode=search&query=씨티케이코스메틱스&page=1,2017-12-07 09:30,씨티케이코스메틱스 코스닥 상장 기념식,"【서울=뉴시스】 한국거래소 코스닥시장본부는 7일 오전 서울 여의도 서울사옥 홍보관에서 색조(기초)화장품 제조업체인 씨티케이코스메틱스의 코스닥시장 신규상장기념식을 개최했다. 왼쪽부터 최규준 한국IR협의회 부회장, 정운수 한국거래소 코스닥시장본부장 직무대행, 정인용 씨티케이코스메틱스 대표이사, 조웅기 미래에셋대우 대표이사, 송윤진 코스닥협회 부회장이 기념촬영을 하고 있다. 2017.12.07. (사진=한국거래소 제공)"
파이낸셜뉴스,260930,/news/news_read.nhn?article_id=0003918411&office_id=014&mode=search&query=씨티케이코스메틱스&page=1,2017-12-05 09:18,"코스닥 상장 예정 '씨티케이코스메틱스', 1억불 수출의 탑 수상","씨티케이코스메틱스(이하 CTK)는 제54회 무역의 날을 맞아 진행되는 기념행사에서 1억불 수출의 탑을 수상한다고 5일 밝혔다. CTK는 지난해 7천만불 탑 수상 이후 1년 만에 1억불 클럽에 가입하게 됐다. 세계 화장품 시장을 무대로 풀 서비스 플랫폼을 제공하는 CTK는 2016년 7월 1일부터 2017년 6월 30일까지 수출 실적 1억 달러를 돌파한 것으로 집계됐다. 특히 지난해 화장품 최대 시장인 북미 지역을 대상으로 한 우리나라 화장품 수출액의 30% 이상을 CTK가 차지할 정도로 독보적인 점유율을 기록했다. CTK는 화장품 업계에서 시장조사, 연구개발 단계부터 제품의 기획과 생산을 맡아 글로벌 브랜드에 제공하는 콘셉트의 기업이다. 국내외 OEM, ODM사를 파트너로 두고 무공장 제조를 추구하는 독특한 방식의 사업 구조를 갖고 있다. 시장의 트렌드 변화에 촉각을 세우고 이에 따른 혁신과 비전을 제시하고 있어 글로벌 브랜드의 신뢰가 매우 높다. 정인용 CTK 대표는 “대한민국 대표 화장품 수출 기업으로서 1억불 수출의 탑을 수상하게 돼 기쁘다”며, “코스닥 시장 상장을 계기로 우리 회사 고유의 풀 서비스 플랫폼 사업 역량을 더욱 강화하고 발전시켜 나갈 것”이라고 말했다. 한편, CTK는 지난달 기업공개(IPO) 절차를 마치고 오는 7일 코스닥에 상장할 예정이다."
한국경제,260930,/news/news_read.nhn?article_id=0003879060&office_id=015&mode=search&query=씨티케이코스메틱스&page=1,2018-01-15 15:24,"씨티케이코스메틱스, 조직 개편 단행&hellip;&quot;전략 부문 강화&quot;","씨티케이코스메틱스는 조직 개편을 단행, 사업본부와 관리본부로 조직을 이원화했다고 15일 밝혔다. 사업본부는 글로벌 고객사의 요구에 더욱 신속하게 대응하고, 풀 서비스의 질을 높이기 위해 연구개발과 제품 기획, 영업 및 마케팅을 담당한다. 관리본부는 코스닥 상장사로서 보다 투명한 경영관리를 진행한다는 방침이다. 아울러 전사의 전략을 담당할 전략 담당 임원(CSO·Chief Strategy Officer)인 전상윤 상무이사를 영입했다고 전했다. 이와 함께 기업 전략과 투자, 신사업 발굴 등을 주도하는 전략기획실을 신설했다. 씨티케이코스메틱스 관계자는 ""글로벌 코스메틱스 시장에서 풀 서비스 플랫폼이라는 독특한 포지셔닝과 핵심 경쟁력을 강화하기 위해 조직 개편을 단행했다""며 ""상장사로서 투명한 경영 관리는 물론이고 미래의 성장동력을 발굴하는 전략 파트를 강화하는 것이 이번 조직 개편의 핵심""이라고 설명했다."
한국경제,260930,/news/news_read.nhn?article_id=0003861138&office_id=015&mode=search&query=씨티케이코스메틱스&page=1,2017-12-05 14:21,"씨티케이코스메틱스, 1억불 수출의 탑 수상","씨티케이코스메틱스는 5일 제54회 무역의 날을 맞아 진행된 기념행사에서 1억불 수출의 탑을 수상했다고 4일 밝혔다. 이는 지난해 7월1일부터 올해 6월30일까지 수출 실적 1억 달러를 돌파한 것으로 집계된 결과다. 이에 씨티케이코스메틱스는 지난해 7000만불 탑 수상 이후 1년 만에 1억불 클럽에 가입하게 됐다. 정인용 씨티케이코스메틱스 대표는 ""오는 7일 코스닥 시장 상장을 계기로 회사 고유의 풀 서비스 플랫폼 사업 역량을 더욱 강화하고 발전시켜 나갈 것""이라고 말했다."
머니투데이,260930,/news/news_read.nhn?article_id=0004064924&office_id=008&mode=search&query=씨티케이코스메틱스&page=1,2018-06-14 11:40,"씨티케이코스메틱스, 태국 CMG와 MOU 체결","[머니투데이 박계현 기자] 지난 8일 정인용 씨티케이코스메틱스 대표(오른쪽)가 태국 현지에서 에드윈 호슨(Edwin Yap Hawson) CMG그룹 대표와 MOU(양해각서)를 교환했다./사진제공=씨티케이코스메틱스 씨티케이코스메틱스가 지난 8일 태국 센트럴마케팅그룹(CMG, Central Marketing Group)과 태국 화장품 산업 진출을 위한 MOU(양해각서)를 체결했다고 14일 밝혔다. CMG는 태국 최대 유통그룹인 센트럴그룹의 주력 계열사로, 태국 내 글로벌 브랜드를 제조·유통·소매하는 최대 업체다. 화장품, 패션 의류, 전자제품 등 소비 전반에 걸친 다양한 브랜드를 전개하고 있다. 센트럴그룹은 쇼핑몰, 백화점, 호텔, 식품 소매 등 다양한 유통채널을 보유하고 있으며 현재 동남아 뿐 아니라 유럽 등에서 사업 영역을 확대하고 있다. 씨티케이코스메틱스 관계자는 ""이번 전략적 제휴를 통해 CMG와 함께 태국을 포함 동남아시아 시장에서 신규 매출처를 발굴하고 장기적인 성장 전략을 마련할 계획""이라고 말했다."
연합뉴스,260930,/news/news_read.nhn?article_id=0009731198&office_id=001&mode=search&query=씨티케이코스메틱스&page=1,2017-12-05 18:32,씨티케이코스메틱스 7일 코스닥 상장,"(서울=연합뉴스) 경수현 기자 = 한국거래소는 5일 씨티케이코스메틱스의 코스닥 시장 신규 상장을 승인했다고 5일 밝혔다. 주식 매매거래는 7일부터 시작된다. 2001년 화장품 용기 제조 회사로 설립된 씨티케이코스메틱스는 현재는 글로벌 화장품 기업을 대상으로 화장품 생산의 모든 과정을 서비스하는 '풀서비스' 사업을 벌이고 있다. 지난해 매출은 1천339억원, 당기순이익은 233억원이었다. 공모가는 5만5천원(액면가 500원)이었다."
매일경제,260930,/news/news_read.nhn?article_id=0004083412&office_id=009&mode=search&query=씨티케이코스메틱스&page=1,2018-01-15 09:47,"씨티케이코스메틱스, 조직 개편 및 외부 전문가 영입","코스메틱 풀 서비스 플랫폼 기업 씨티케이코스메틱스는 미래 성장동력 확보를 위해 조직을 개편하고 전사의 전략을 담당할 외부 전문가를 영입했다고 15일 밝혔다. 씨티케이코스메틱스는 이번 조직 개편을 크게 2개의 본부로 나눠 효율성 제고에 힘을 실었다. 연구개발과 제품 기획, 영업 및 마케팅을 아우르는 사업본부와 코스닥 상장사로서 보다 투명한 경영관리를 위한 관리본부로 이원화했다. 이와 더불어 전략 담당 임원(CSO, Chief Strategy Officer)으로 외부 전문가였던 전상윤 상무이사를 영입했다. 전 상무는 미국과 한국을 오가며 다년간 글로벌 투자은행(IB), 벤처캐피털(VC), 프라이빗에퀴티(PE) 분야에서 인수합병(M&A) 자문, 투자, 전략 수립 등을 주도한 전문가다. [디지털뉴스국 김경택 기자] r_start // r_end //"
한국경제TV,260930,/news/news_read.nhn?article_id=0000650231&office_id=215&mode=search&query=씨티케이코스메틱스&page=1,2018-06-19 14:16,"씨티케이코스메틱스, 전일 대비 약 -5% 하락한 34,000원","[한국경제TV 라이온봇 기자] [그림 1] 최근 3개월 간 주가 추세 및 기간별 수익률 씨티케이코스메틱스는 6월 19일 14시 16분 전일 대비 약 -5% 하락한 34,000원에 거래되고 있다. 씨티케이코스메틱스는 코스닥 상장 기업으로 화학 업종에 속해 있다. 시가총액은 3,638억원으로 코스닥 상장기업 중 143위에 위치 해 있다. [종목 성향 진단] [그림 2] 종목 성향 진단 씨티케이코스메틱스의 투자 스타일은 성장주에 가깝다. 주가 고평가 우려가 공존하지만 높은 성장성이 기대되는 기업이다. 주가 모멘텀은 부진한 편이었다. 최근 6개월 수익률은 -15.43%의 하락폭을 기록했다. 최근 1개월 수익률 또한 -10.7% 하락하며 부진한 모멘텀을 이어가고 있다. 씨티케이코스메틱스 종목에 대한 투자자의 관심도는 평범한 수준이었다. [투자 점수 진단] [그림 3] 투자 점수 진단 씨티케이코스메틱스는 어느 측면에서 투자 매력도가 높은 종목일까? AI 인공지능 종목 분석 시스템을 이용해 성장성, 수익성, 효율성, 안전성, 저평가성, 추세 등 주가 수익률에 영향을 줄 수 있는 6가지 핵심 투자 지표를 점수화하여 종목의 투자 매력도를 계산해보았다. 그 결과 씨티케이코스메틱스는 상대적으로 기업안정성 측면에서 두각을 드러내고 있었다. 기업안정성 점수는 기업의 재무 구조가 얼마나 안정적인 상태인지를 나타낸다. 씨티케이코스메틱스는 특히 당좌비율 측면에서 가장 높은 점수는 기록했는데, 전체 시장 내 90위를 기록하며 상위 4.61%에 위치했다. 업종별로는 19위를 기록하며 상위 4.41%에 위치했다. 그러나 기업 가치 대비 주가 수준을 나타내는 저평가 측면에서는 아쉬움을 나타냈다. (위의 AI인공지능 점수는 재무 데이터를 기반으로 전체 상장 종목과 비교/분석하여 도출한 점수로 높은 점수가 반드시 높은 수익률을 보장하지 않습니다. 위의 자료는 당사의 추천 종목이 아니며, 투자 시 참고용으로 제시해드리는 것입니다. 핵심투자지표를 결합해 종목의 투자매력도를 종합 계산한 ""인공지능 투자점수""는 ""거장들의 투자공식"" 앱에서 확인하실 수 있습니다.) 라이온봇 기자 -한국경제TV※ 본 기사는 한국경제TV와 '거장들의 투자공식이'자체 개발한 '라이온봇 기자'가 실시간으로 작성한 기사입니다. 라이온봇기자 ⓒ 한국경제TV, 무단 전재 및 재배포 금지 한국경제TV 관련뉴스해당 언론사에서 선정하며 언론사 페이지(아웃링크)로 이동해 볼 수 있습니다.현실화되는 '보유세 폭탄'…똑똑한 절세법은?아시아팀 부진 속 콜롬비아-일본전 '이목'품귀 빚던 '꼬북칩'이 이럴줄은투기지역 연내 재조정…""노원구 빠질듯""'아동수당' 미리 신청하세요…몇 세까지 해당?"
뉴시스,260930,/news/news_read.nhn?article_id=0008326656&office_id=003&mode=search&query=씨티케이코스메틱스&page=1,2017-12-05 19:37,"씨티케이코스메틱스, 오는 7일 코스닥 상장","【서울=뉴시스】 이진영 기자 = 한국거래소는 씨티케이코스메틱스의 코스닥 시장 신규 상장을 승인했다고 5일 밝혔다. 주식 매매는 7일부터 시작된다. 씨티케이코스메틱스는 2001년 화장품 용기 제조 목적으로 설립됐다. 2009년부터는 글로벌 화장품사를 대상으로 상품 기획부터 디자인, 마케팅, 제품개발, 생산, 공급망관리, 납품까지 원스톱 서비스를 제공하는 '화장품 종합 플랫폼 서비스' 사업을 영위하고 있다. 지난해 매출은 1339억원, 당기순이익은 233억원이다. 공모가는 5만5000원(액면가 500원)이다."
