source,symbol,link,date,title,content
연합뉴스,267790,/news/news_read.nhn?article_id=0008339719&office_id=001&mode=search&query=배럴&page=53,2016-04-18 08:57,스프라이트 여름 한정판&hellip;스포츠브랜드 배럴과 협업,"(서울=연합뉴스) 강종훈 기자 = 코카콜라의 사이다 브랜드 스프라이트는 워터스포츠 브랜드 배럴(BARREL)과의 협업(콜라보레이션)으로 '썸머 스페셜 에디션'을 출시했다고 18일 밝혔다. 코카콜라는 국내 서퍼들 사이에서 널리 알려진 배럴과의 협업을 통해 스프라이트의 시원한 청량감을 전한다는 취지로 이 제품을 기획했다고 설명했다. 제품 포장은 열대의 정취를 담은 이국적인 꽃과 출렁이는 파도, 서프보드를 올린 미니밴 등 세 가지 디자인으로 구성됐으며, 250㎖ 캔과 500㎖ 페트 등 총 5가지 제품으로 선보인다. 코카콜라는 배럴과의 협업으로 다양한 여름 이벤트도 전개할 예정이다."
뉴시스,267790,/news/news_read.nhn?article_id=0008098867&office_id=003&mode=search&query=배럴&page=19,2017-08-01 09:24,"WTI, 배럴당 50달러 돌파&middot;&middot;&middot;상승세 지속될 듯",【서울=뉴시스】유세진 기자 = 미 서부텍사스유(WTI) 가격이 31일(현지시간)배럴당 50달러를 넘어섰다고 미 CNBC.가 보도했다. WTI는 이날 배럴당 46센트 오른 50.17달러로 거래를 마감했다. WTI 종가가 배럴당 50달러를 돌파한 것은 지난 5월24일 이후 처음이다. 이에 따라 WTI는 7월 중 9% 상승해 2016년 4월 이후 월간 상승폭으로는 최대를 기록했다. 미국의 원유 재고분이 크게 감소하고 사우디아라비아가 8월 수출을 줄이겠다고 약속한 것이 이 같은 원유 가격 상승을 부른 것으로 풀이된다. 게다가 미국이 제헌의회 선거를 강행한 베네수엘라 에너지 분야에 제재를 가하겠다고 위협한 것도 유가를 상승시켰다. 미국의 제재 시 베네수엘라 국영 석유회사 PDVSA는 산유량을 더욱 감축할 수밖에 없다. 석유수출국기구(OPEC)는 지난 주말 사우디와 러시아가 다음주 원유 공급 과잉 해소를 위해 산유량을 제한하는 방안을 논의할 것이라고 발표했다. 여기에 미국 셰일 원유 생산업자들도 자본 지출 계획을 축소하기 시작해 미국산 셰일 원유 생산 증대에 대한 우려도 어느 정도 해소될 것으로 기대된다. 일부 분석가들은 국제 유가가 배럴당 50달러를 훨씬 상회할 것이라는 전망도 내놓고 있으며 향후 수주 간 국제 유가가 계속 오를 것이라는 추측에 힘이 실리고 있다.
이데일리,267790,/news/news_read.nhn?article_id=0003887462&office_id=018&mode=search&query=배럴&page=19,2017-08-01 05:04,국제유가 두달만에 배럴당 50달러 회복,[뉴욕=이데일리 안승찬 특파원] 국제유가가 배럴당 50달러대를 회복했다. 31일(현지시간) 뉴욕상품거래소에서 서부텍사스산 원유(WTI) 9월 인도분은 전거래일보다 0.46달러(0.93%) 상승한 배럴당 50.17달러에 거래를 마쳤다. WTI가 50달러 선을 회복한 것은 지난 5월 24일 이후로 두 달여 만이다. 이번 한달 동안 9%가량 가격이 올랐다. 올해 들어 최대 상승률이다. 런던 ICE 선물시장의 브렌트유 9월물은 배럴당 0.10달러(0.19%) 오른 52.62달러에서 거래되고 있다. 최대 산유국인 사우디아라비아의 원유 수출 제한 조치와 미국의 원유재고 감소 소식이 맞물리면서 투자심리가 개선됐다.
한국경제TV,267790,/news/news_read.nhn?article_id=0000602889&office_id=215&mode=search&query=배럴&page=11,2018-02-14 09:31,"배럴, 전일 대비 약 -7% 하락한 16,050원","[한국경제TV 라이온봇 기자] 배럴은 2월 14일 9시 30분 전일 대비 약 -7% 하락한 16,050원에 거래되고 있다. 배럴은 코스닥 상장 기업으로 섬유,의류 업종에 속해 있다. 시가총액은 1,241억원으로 코스닥 상장기업 중 509위에 위치 해 있다. [종목 성향 진단] [그림 1] 종목 성향 진단 배럴의 투자 스타일은 성장주에 가깝다. 주가 고평가 우려가 공존하지만 높은 성장성이 기대되는 기업이다. 주가 모멘텀은 평범한 수준이었다. 배럴 종목에 대한 투자자의 관심도는 굉장히 높은 편이다. [투자 점수 진단] [그림 2] 투자 점수 진단 배럴은 각 재무지표를 전체 상장종목과 비교하여 점수화 했을 때, 대부분 지표에서 시장과 업종 대비 아쉬움을 나타냈다. (위의 AI인공지능 점수는 재무 데이터를 기반으로 전체 상장 종목과 비교/분석하여 도출한 점수로 높은 점수가 반드시 높은 수익률을 보장하지 않습니다. 위의 자료는 당사의 추천 종목이 아니며, 투자 시 참고용으로 제시해드리는 것입니다.) 라이온봇 기자 -한국경제TV※ 본 기사는 한국경제TV와 '거장들의 투자공식이'자체 개발한 '라이온봇 기자'가 실시간으로 작성한 기사입니다. 라이온봇기자 ⓒ 한국경제TV, 무단 전재 및 재배포 금지 한국경제TV 관련뉴스해당 언론사에서 선정하며 언론사 페이지(아웃링크)로 이동해 볼 수 있습니다.김신영 다이어트 전후 사진 어떻길래? '깜짝'홍진영 근황, 물오른 미모…""30대 몸매 비결은""박지헌만의 성교육 ""야동 보는 게 나쁜 거 아냐""서정희 ""서세원과 이혼 후 트라우마, 결국...""윤정수 다이어트, '홀쭉해진' 비결은?"
아시아경제,267790,/news/news_read.nhn?article_id=0004029045&office_id=277&mode=search&query=배럴&page=20,2017-07-06 15:41,"대한뉴팜, 투자광구 일 2000배럴 이상 원유 생산","[아시아경제 임혜선 기자]대한뉴팜이 투자한 광구 운영사인 카스피안 선라이즈는 카자흐스탄 BNG광구의 원유 증산 소식을 6일 밝혔다. BNG 광구는 카자흐스탄 텡기즈 유전(1979년 발견된 유전으로 최근 발견된 가장 큰 대형 유전 중 하나)으로부터 남동쪽으로 40km 떨어져 있으며 광구 면적은 1,702㎢에 달한다. 제주도 면적의 92%에 해당하는 규모로 이미 광구의 80% 이상에 대해 3D탄성파 조사를 끝낸 상태다. 대한뉴팜측 관계자는 ""이번 공시에서 가장 주목할 사항은 MJF 구조 지역의 중심에 위치한 144유정 테스트가 성공하면서 일일 총 생산량이 2000배럴을 초과 생산하게 됐다는 점""이라고 밝혔다. 이는 원유 증산과 동시에 MJF 구조 지역의 규모가 10㎢이상이라는 점을 확인해 준 것이다. 대한뉴팜이 투자한 BNG광구는 얕은 매장층과 깊은 매장층이 있으며, 이미 얕은 매장층 지역에서 원유가 생산되고 있다. 첫번째 지역은 에르메스로 54, 805, 806, 807유정이 있으며, 두번째 지역은 MJF구조로 143, 141,142, 144유정이 위치해있다. 마지막으로 808 지역 유정이 있다."
연합뉴스,267790,/news/news_read.nhn?article_id=0008348197&office_id=001&mode=search&query=배럴&page=53,2016-04-21 08:25,두바이유 가격 소폭 하락&hellip;배럴당 39달러선은 유지,[AP=연합뉴스 자료사진 ] (서울=연합뉴스) 김연숙 기자 = 전날 반등했던 두바이유 가격이 다시 소폭 하락했지만 배럴당 39달러 선은 유지했다. 한국석유공사는 지난 20일(현지시간) 거래된 두바이유 현물 가격이 전날보다 0.14달러 내린 배럴당 39.03달러를 기록했다고 21일 밝혔다. 두바이유 가격은 최근 오름세를 보이며 지난해 11월 27일(40.37달러) 이후 처음으로 배럴당 40달러대를 회복했다가 이달 14일부터 등락을 반복하고 있다. 뉴욕상업거래소(NYMEX)에서 미국 서부텍사스산 원유(WTI) 선물은 전날보다 1.55달러 오른 배럴당 42.63달러에 거래를 마감했다. 런던 ICE 선물시장의 브렌트유도 전날보다 1.77달러 상승한 배럴당 45.80달러를 기록했다. 이날 WTI와 브렌트유 가격 상승은 미국의 원유 비축 증가량이 예상보다 적고 원유 생산량이 6주 연속 감소했다는 발표의 영향을 받았다. 미국 에너지정보청(EIA)은 지난주 미국의 원유 비축량이 전주보다 210만 배럴 늘었다고 이날 밝혔다. 앞서 시장 전문가들은 240만 배럴 증가를 예측했고 민간기구 미국석유협회(API)는 310만 배럴이 늘었다고 발표한 바 있다.
서울경제,267790,/news/news_read.nhn?article_id=0003221890&office_id=011&mode=search&query=배럴&page=11,2018-02-13 09:31,"(코)배럴, 전일 대비 8.72% 상승.. 일일회전율은 7.67% 기록","[서울경제] 배럴(267790) 은 13일 오전 9시 30분 현재 8.72% 오른 18,700원에 거래되고 있으며, 44(매도):56(매수)의 매수우위를 기록하고 있다. 거래대금은 102억5,904만, 거래량은 55만3,373주로 거래량회전율은 7.67%로 나타났다. 지난 1개월간 배럴은 상한가 3회, 상승 2회, 하락 3회를 기록했고, 주가수익률은 0% 표준편차는 18.51%를 기록했다. 이 기간 ' 섬유·의류업 ' 업종 평균 주가수익률은 6.83%로 나타났으며, 변동성은 2.06%를 기록했다. 이 시각 현재 ' 섬유·의류업 '은 0.87% 상승 중이며, 31(매도):69(매수)의 매수우위를 기록하고 있다."
머니투데이,267790,/news/news_read.nhn?article_id=0003899822&office_id=008&mode=search&query=배럴&page=20,2017-07-06 15:44,"대한뉴팜, 투자광구 일 2000배럴 이상 원유 생산","[머니투데이 김건우 기자] 대한뉴팜이 투자한 광구 운영사인 카스피안 선라이즈(Caspian Sunrise)가 카자흐스탄 BNG광구의 원유를 생산한다고 3일 밝혔다. BNG 광구는 카자흐스탄 텡기즈 유전으로부터 남동쪽으로 40km 떨어져 있으며 광구 면적은 1702㎢에 달한다. 제주도 면적의 92%에 해당하는 규모로 이미 광구의 80% 이상에 대해 3D탄성파 조사를 끝낸 상태다. 대한뉴팜 관계자는 6일 “MJF 구조 지역 중심에 위치한 144유정 테스트가 성공하면서 일일 총 생산량이 2000배럴을 초과 생산한다”며 “원유 증산과 동시에 MJF 구조 지역의 규모가 10㎢이상이라는 점을 확인했다""고 말했다. 대한뉴팜이 투자한 BNG광구는 얕은 매장층과 깊은 매장층이 있으며, 이미 얕은 매장층 지역에서 원유가 생산되고 있다. 첫번째 지역은 에르메스로 54·805·806·807유정이 있으며, 두번째 지역은 MJF구조로 143·141·142·144유정이 위치해있다. 마지막으로 808 지역 유정이 있다. 카스피안 선라이즈 의장 클라이브 카버는 “144유정 초기 결과에 만족하며, 808 유정이 MJF구조와 같은 수준이 되길 기대한다”며 “이미 시추한 3개 심부유정(deep well)에서도 원활한 테스트가 진행될 수 있도록 집중하겠다""고 말했다. textlinktopstart textlinktopend textlinkstart"
한국경제,267790,/news/news_read.nhn?article_id=0003581833&office_id=015&mode=search&query=배럴&page=53,2016-04-20 08:32,두바이유 가격 반등&hellip;배럴당 39.17달러,사진=게티이미지뱅크 최근 3거래일 연속 하락했던 두바이유 가격이 반등해 39달러대로 올라섰다. 한국석유공사는 지난 19일(현지시간) 거래된 두바이유 현물 가격이 전날보다 1.44달러 오른 배럴당 39.17달러를 기록했다고 20일 밝혔다. 두바이유 가격은 지난주 오름세를 보이며 지난해 11월 27일(40.37달러) 이후 처음으로 배럴당 40달러대를 회복했다가 이달 14일부터 다시 하락세를 보였다. 뉴욕상업거래소(NYMEX)에서 미국 서부텍사스산 원유(WTI) 선물은 전날보다 1.30달러 오른 배럴당 41.08달러에 거래를 마감했다. 런던 ICE 선물시장의 브렌트유도 전날보다 1.12달러 상승한 배럴당 44.03달러를 기록했다. 이날 국제유가 상승은 쿠웨이트 석유 기업 파업의 영향을 받았다. 공공분야 임금개혁안에 반대하는 쿠웨이트 국영 석유 기업 노동자들의 파업이 사흘째로 접어들면서 석유수출국기구(OPEC) 회원국인 쿠웨이트의 원유 생산량은 절반 가까이 줄었다. 한경닷컴 산업경제팀
이데일리,267790,/news/news_read.nhn?article_id=0003868272&office_id=018&mode=search&query=배럴&page=20,2017-07-06 16:47,"대한뉴팜, 카자흐스탄 투자광구 일 2000배럴 원유 생산",- 지속적으로 늘어나는 생산량과 매장 구조로 기대감 높여 [이데일리 박경훈 기자] 대한뉴팜(054670)은 자사가 투자한 광구 운영사인 카스피안 선라이즈(Caspian Sunrise)가 카자흐스탄 BNG광구 원유를 증산했다고 6일 밝혔다. BNG 광구는 카자흐스탄 텡기즈 유전으로부터 남동쪽으로 40㎞ 떨어져 있다. 광구 면적은 1702㎢다. 이는 제주도 면적의 92%에 해당하는 규모로 이미 광구의 80% 이상에 대해 3D탄성파 조사를 끝낸 상태라고 대한뉴팜 측은 전했다. 대한뉴팜 관계자는 “유정 테스트가 성공하면서 일일 총 생산량이 2000배럴을 초과 생산하게 됐다는 점이 중요하다”고 밝혔다. 대한뉴팜이 투자한 BNG광구는 얕은 매장층과 깊은 매장층이 있다. 이미 얕은 매장층 지역에서 원유가 생산되고 있다. 카스피안 선라이즈 의장 클라이브 카버는 “초기 결과에 만족하며 또 다른 유정이 같은 수준이 되길 기대한다”며 “이미 시추한 3개 심부유정(deep well)에서도 원활한 테스트가 진행될 수 있도록 집중하겠다”고 전했다.
머니투데이,267790,/news/news_read.nhn?article_id=0003900511&office_id=008&mode=search&query=배럴&page=20,2017-07-07 17:46,모건스탠리 &quot;국제유가 내년 중반까지 배럴당 50달러 이하 전망&quot;,"[머니투데이 유희석 기자] 글로벌 투자은행(IB) 모건스탠리는 6일(현지시간) 미국 서부텍사스산원유(WTI) 가격이 내년 말까지 배럴당 50달러 이하에 머물 것이라고 전망했다. 모건스탠리는 ""석유수출국기구(OPEC)의 감산 규모가 충분하지 않은 상황에서 세계 석유시장이 내년 수급 균형을 이루기 위해서는 미국의 셰일원유 생산이 줄어야 한다""며 ""WTI 가격은 내년 말 배럴당 55달러에 도달한 이후 2020년 배럴당 60달러로 오를 것""이라고 예상했다. textlinktopstart textlinktopend textlinkstart"
파이낸셜뉴스,267790,/news/news_read.nhn?article_id=0003964014&office_id=014&mode=search&query=배럴&page=11,2018-02-12 15:39,"[fnRASSI]장마감, 코스닥 하락 종목(배럴 -14.43%&darr;)","12일 코스닥 시장에서 하락한 종목으로 배럴(267790) -14.43%, 대동기어(008830) -12.15%, 엔에스엔(031860) -11.43% 등이 있다. 'fnRASSI'는 증권전문 기업 씽크풀과 파이낸셜뉴스의 협업으로 로봇기자가 실시간으로 생산하는 기사입니다."
뉴시스,267790,/news/news_read.nhn?article_id=0008067301&office_id=003&mode=search&query=배럴&page=20,2017-07-13 18:06,원유 생산량 일일 72만 배럴&uarr;&middot;&middot;&middot;OPEC 감산합의 이행률 78%,"【서울=뉴시스】 전 세계 원유 생산량이 가파르게 상승하고 있는 것으로 나타났다. 석유수출국기구(OPEC) 간 합의된 감산 합의 이행 비율은 78%까지 떨어졌다. 파이낸셜뉴스(FT)은 13일(현지시간) 국제에너지기구(IEA)의 6월 정례 보고서를 인용해 세계 시장의 원유 공급량이 일일 72만 배럴 정도 더 늘어난 것으로 집계됐다고 보도했다. 이날 발표된 IEA의 보고서에 따르면 사우디아라비아와 나이지리아, 리비아 등이 원유 생산량을 늘리고 있는 것으로 나타났다. 사진은 모하메드 빈 살레 알 사다 카타르 에너지 장관(왼쪽)이 지난해 9월 28일 페막한 OPEC 회원국 회의를 마치면서 모하메드 바라킨도 오펙 사무총장과 악수하고 있는 모습. 이날 회원국들은 감산에 전격 합의했다. 2017.07.13. 【서울=뉴시스】박상주 기자 =  전 세계 원유 생산량이 가파르게 상승하고 있는 것으로 나타났다. 석유수출국기구(OPEC) 간 합의된 감산 합의 이행 비율은 78%까지 떨어졌다. 파이낸셜뉴스(FT)은 13일(현지시간) 국제에너지기구(IEA)의 6월 정례 보고서를 인용해 세계 시장의 원유 공급량이 일일 72만 배럴 정도 더 늘어난 것으로 집계됐다고 보도했다. 이날 발표된 IEA의 보고서에 따르면 사우디아라비아와 나이지리아, 리비아 등이 원유 생산량을 늘리고 있는 것으로 나타났다. 올해 초까지만 하더라도 산유국들의 감산 합의는 100% 이상을 달성했었다. 리야드 등이 합의 쿼터 이상 감산을 이행했기 때문이다. 그러나 올 들어 미국의 셰일 석유의 생산량이 늘기 시작하면서 산유국들 간 협력이 깨질 조짐을 보이고 있다. 산유국들의 감산 합의 이후 반등세를 보이던 국제유가는 다시 하락세로 접어들었다. 현재 국제유가는 연초 대비 15%나 떨어진 배럴당 45달러 선에 거래되고 있다. OPEC 회원국들은 지난해 11월 30일 오스트리아 빈에서 총회를 열고 올 1월부터 6개월 동안 기존 생산량보다 120만 배럴(4.5%)을 감산키로 합의했다. 이어 지난 해 12월 10일 러시아와 멕시코 등 11개 비 OPEC 산유국들도 일일 원유 생산량을 55만8000배럴 감축키로 합의했다. OPEC 회원 산유국이 하루 평균 120만 배럴 줄이기로 한 데 이어 비회원까지 가세하면서 하루 감산규모는 180만 배럴에 이르게 된 것이다. 나이지리아와 리비아는 불안한 정정을 이유로 감산 합의에서 제외됐다. 이어 지난 5월 OPEC의 리더격인 사우디아라비아와 비 OPEC의 대표적 산유국인 러시아가 올해 6월 종료되는 원유 감산 합의를 내년 3월까지 연장키로 합의했었다."
한국경제TV,267790,/news/news_read.nhn?article_id=0000602038&office_id=215&mode=search&query=배럴&page=11,2018-02-12 10:25,"배럴, -10% 하락... 전일 보다 2,050원 내린 18,050원","[한국경제TV 라이온봇 기자] 배럴은 2월 12일 10시 24분 전일 대비 약 -10% 급락한 18,050원에 거래되고 있다. 배럴은 코스닥 상장 기업으로 섬유,의류 업종에 속해 있다. 시가총액은 1,450억원으로 코스닥 상장기업 중 437위에 위치 해 있다. [종목 성향 진단] [그림 1] 종목 성향 진단 배럴의 투자 스타일은 성장주에 가깝다. 주가 고평가 우려가 공존하지만 높은 성장성이 기대되는 기업이다. 주가 모멘텀은 평범한 수준이었다. 배럴 종목에 대한 투자자의 관심도는 굉장히 높은 편이다. [투자 점수 진단] [그림 2] 투자 점수 진단 배럴은 각 재무지표를 전체 상장종목과 비교하여 점수화 했을 때, 대부분 지표에서 시장과 업종 대비 아쉬움을 나타냈다. (위의 AI인공지능 점수는 재무 데이터를 기반으로 전체 상장 종목과 비교/분석하여 도출한 점수로 높은 점수가 반드시 높은 수익률을 보장하지 않습니다. 위의 자료는 당사의 추천 종목이 아니며, 투자 시 참고용으로 제시해드리는 것입니다.) 라이온봇 기자 -한국경제TV※ 본 기사는 한국경제TV와 '거장들의 투자공식이'자체 개발한 '라이온봇 기자'가 실시간으로 작성한 기사입니다. 라이온봇기자 ⓒ 한국경제TV, 무단 전재 및 재배포 금지 한국경제TV 관련뉴스해당 언론사에서 선정하며 언론사 페이지(아웃링크)로 이동해 볼 수 있습니다.김신영 다이어트 전후 사진 어떻길래? '깜짝'홍진영 근황, 물오른 미모…""30대 몸매 비결은""박지헌만의 성교육 ""야동 보는 게 나쁜 거 아냐""서정희 ""서세원과 이혼 후 트라우마, 결국...""윤정수 다이어트, '홀쭉해진' 비결은?"
매경이코노미,267790,/news/news_read.nhn?article_id=0000057409&office_id=024&mode=search&query=배럴&page=19,2017-09-25 10:22,[ISSUE INSIDE] 국제유가 배럴당 50달러대 상승 배경 글로벌 경기회복&middot;...,"국내 정유·석유화학·건설업계 실적 개선 기대 글로벌 경기회복으로 국제유가가 상승세를 보이고 있다. 사진은 서울 시내 한 주유소.  한동안 하락세를 보이던 국제유가가 상승세로 돌아서면서 배경에 관심이 쏠린다. 글로벌 경기가 회복세에 접어든 데다 OPEC(석유수출국기구)의 감산 영향이 크다는 분석이다. 지난 6월 이후 배럴당 40달러대에 머물던 국제유가는 최근 50달러 이상에 거래되는 중이다. 지난 9월 20일(현지 시간) 미국 뉴욕상품거래소에서 거래된 서부텍사스산원유(WTI) 10월물은 전날보다 1.6% 상승한 배럴당 50.69달러에 거래를 마쳤다. 국제유가가 상승세를 탄 건 글로벌 경기회복으로 미국, 유럽 등 수요가 급증했기 때문이다. 국제에너지기구는 “경기회복에 따라 유럽 산업, 운송용 석유 수요가 늘고 있다. 미국도 연말이 가까워지면 허리케인 복구 작업을 위해 석유 수요가 증가할 것”이라고 밝혔다. 국제에너지기구는 올해 석유 수요 증가량이 2년 만에 최대 폭을 기록할 것으로 내다봤다. 올해 세계 석유 수요는 전년보다 160만배럴 늘어 하루 평균 9770만배럴에 이를 것으로 보인다. 내년 세계 석유 수요 역시 하루 평균 9910만배럴로 올해보다 1.4% 늘어날 것이란 전망을 더했다. OPEC도 올해와 내년 세계 석유 수요 전망치를 일제히 상향 조정했다. 올해 세계 석유 수요는 하루 평균 142만배럴, 내년에는 135만배럴 증가할 것으로 내다봤다. 이에 비해 석유 공급은 계속 줄어드는 추세다. OPEC은 지난 8월 회원국들의 석유 생산량이 하루 평균 3276만배럴로 전월 대비 7만9100배럴 감소했다고 밝혔다. OPEC 생산량이 줄어든 건 지난 3월 이후 처음이다."
연합뉴스,267790,/news/news_read.nhn?article_id=0008345119&office_id=001&mode=search&query=배럴&page=53,2016-04-20 08:14,두바이유 가격 반등&hellip;배럴당 39.17달러,[AP=연합뉴스 자료사진 ] (서울=연합뉴스) 김연숙 기자 = 최근 3거래일 연속 하락했던 두바이유 가격이 반등해 39달러대로 올라섰다. 한국석유공사는 지난 19일(현지시간) 거래된 두바이유 현물 가격이 전날보다 1.44달러 오른 배럴당 39.17달러를 기록했다고 20일 밝혔다. 두바이유 가격은 지난주 오름세를 보이며 지난해 11월 27일(40.37달러) 이후 처음으로 배럴당 40달러대를 회복했다가 이달 14일부터 다시 하락세를 보였다. 뉴욕상업거래소(NYMEX)에서 미국 서부텍사스산 원유(WTI) 선물은 전날보다 1.30달러 오른 배럴당 41.08달러에 거래를 마감했다. 런던 ICE 선물시장의 브렌트유도 전날보다 1.12달러 상승한 배럴당 44.03달러를 기록했다. 이날 국제유가 상승은 쿠웨이트 석유 기업 파업의 영향을 받았다. 공공분야 임금개혁안에 반대하는 쿠웨이트 국영 석유 기업 노동자들의 파업이 사흘째로 접어들면서 석유수출국기구(OPEC) 회원국인 쿠웨이트의 원유 생산량은 절반 가까이 줄었다.
