source,symbol,link,date,title,content
KBS 뉴스,267790,/news/news_read.nhn?article_id=0010327749&office_id=056&mode=search&query=배럴&page=46,2016-06-14 09:04,두바이유 가격 또 하락&hellip;배럴당 47.06달러,두바이유 가격이 2거래일 연속 하락하며 배럴당 47달러대로 내려섰다. 한국석유공사는 현지 시각으로 어제(13일) 거래된 두바이유 현물 가격이 전 거래일보다 1.17달러 내린 배럴당 47.06달러로 집계됐다고 밝혔다. 두바이유 가격은 4개월여 만인 지난 4월 13일 배럴당 40달러대로 올라선 뒤 등락을 거듭하면서도 꾸준한 상승세를 보이고 있다. 뉴욕상업거래소(NYMEX)의 서부텍사스산 원유 선물은 전 거래일보다 19센트 내린 배럴당 48.88달러로 거래를 마감했다. 런던 ICE 선물시장의 브렌트유 선물도 전 거래일보다 19센트 하락한 50.35달러로 장을 마쳤다.
한국일보,267790,/news/news_read.nhn?article_id=0000162441&office_id=469&mode=search&query=배럴&page=38,2016-09-09 08:57,두바이유 배럴당 44달러대 회복,"두바이유 가격이 이틀 연속 상승하며 44달러 선으로 올라서는 등 국제유가가 일제히 상승했다. 한국석유공사는 8일(현지시간) 거래된 두바이유 현물 가격이 전날보다 1.16달러 상승한 배럴당 44.83달러로 집계됐다고 9일 밝혔다. 두바이유 가격은 6월 9일 48.98달러대까지 올라갔지만, ‘브렉시트’(Brexit.영국의 유럽연합 탈퇴) 등의 영향으로 한때 38달러 선까지 내려갔다. 이후 가격이 회복하면서 45∼46달러 선에서 움직이다가 최근 41달러대까지 떨어진 뒤 회복 중이다. 런던 ICE 선물시장의 브렌트유 선물도 전날보다 2.01달러 오른 49.99달러로 거래를 마쳤다. 뉴욕상업거래소(NYMEX)의 서부 텍사스산 원유(WTI) 선물도 전날보다 2.12달러 상승한 47.62달러로 마감했다. 이날 국제유가는 미국의 원유 재고가 시장의 예상과 달리 큰 폭으로 감소했다는 사실이 알려지면서 오름세를 보였다."
연합뉴스,267790,/news/news_read.nhn?article_id=0008784695&office_id=001&mode=search&query=배럴&page=33,2016-10-28 08:14,두바이유 가격 반등&hellip;배럴당 48.16달러,[연합뉴스자료사진] (서울=연합뉴스) 정성호 기자 = 두바이유 가격이 이틀간의 하락 뒤 반등하며 48달러 선으로 올라서는 등 국제유가가 일제히 상승했다. 한국석유공사는 27일(현지시간) 거래된 두바이유 현물 가격이 전날보다 25센트 오른 배럴당 48.16달러로 집계됐다고 28일 밝혔다. 두바이유 가격은 최근 석유수출국기구(OPEC) 산유국들이 원유 감산에 합의하면서 한때 50달러를 넘어서는 등 강세를 보였으나 최근 상승세가 주춤한 상태다. 런던 ICE 선물시장의 브렌트유 선물도 전날보다 49센트 상승한 배럴당 50.47달러로 거래를 마쳤다. 또 뉴욕상업거래소(NYMEX)의 서부텍사스산원유(WTI) 선물도 전날보다 54센트 오른 배럴당 49.72달러로 장을 마감했다. 이날 국제유가는 OPEC의 에너지 장관들이 원유 감산 의향을 러시아에 전달했다는 사실이 보도되면서 감산에 대한 기대감이 반영돼 일제히 오른 것으로 풀이된다.
매일경제,267790,/news/news_read.nhn?article_id=0003749122&office_id=009&mode=search&query=배럴&page=46,2016-06-14 08:28,두바이유 가격 2거래일 연속 하락&hellip;배럴당 47.06달러,"두바이유 가격이 2거래일 연속 하락하며 배럴당 47달러대로 내려섰다. 한국석유공사는 13일(현지시간) 거래된 두바이유 현물 가격이 전 거래일보다 1.17달러 내린 배럴당 47.06달러로 집계됐다고 14일 밝혔다. 두바이유 가격은 지난 4월 13일 4개월 만에 배럴당 40달러대로 올라선 뒤 등락을 거듭하면서도 꾸준한 상승세를 보이고 있다. [디지털뉴스국] r_start // r_end // [ⓒ 매일경제 & mk.co.kr, 무단전재 및 재배포 금지] 매일경제 관련뉴스해당 언론사에서 선정하며 언론사 페이지(아웃링크)로 이동해 볼 수 있습니다.쯔위, 속바지 보다 더 짧은 핫팬츠 입고…'男心 올킬'제네시스 G80, 사전계약 돌입…4720만~7270만원[유로2016] 17번째 슛이 결승골..스페인, 체코에 진땀승""美올랜도 테러범, 빈라덴 삼촌이라며…"" 증언""도끼는 불우이웃이야"" 천억대 자산가, 이희진 누구?"
한국경제,267790,/news/news_read.nhn?article_id=0003706808&office_id=015&mode=search&query=배럴&page=27,2016-12-29 08:35,두바이유 3일 연속 상승&hellip;배럴당 53.73달러,두바이유 가격이 3거래일 연속 오르며 53달러 선으로 상승했다. 한국석유공사는 28일(이하 현지시간) 거래된 두바이유 현물 가격이 전날보다 1.01달러 오른 53.73달러로 집계됐다고 29일 밝혔다. 두바이유 가격은 9월 말 석유수출국기구(OPEC) 회원국들이 감산에 합의한 데 이어 이달 OPEC 비회원국까지 감산에 동참키로 하면서 상승세를 지속하고 있다. 런던 ICE 선물시장의 브렌트유 선물도 전날보다 13센트 상승한 배럴당 56.22달러로 거래를 마쳤다. 이는 지난해 7월 21일의 57.04달러 이후 1년 5개월 만에 가장 높은 수준이다. 뉴욕상업거래소(NYMEX)의 서부텍사스산원유(WTI) 선물 역시 전날보다 16센트 오른 54.06달러로 장을 마감했다. 이 역시 지난해 7월 2일(56.93달러) 이후 약 1년 5개월 만의 최고치다.
한국경제,267790,/news/news_read.nhn?article_id=0003609256&office_id=015&mode=search&query=배럴&page=46,2016-06-14 08:18,"두바이유, 2거래일 연속 하락&hellip;배럴당 47.06달러",두바이유 가격이 2거래일 연속 하락하며 배럴당 47달러대로 내려섰다. 한국석유공사는 13일(현지시간) 거래된 두바이유 현물 가격이 전 거래일보다 1.17달러 내린 배럴당 47.06달러로 집계됐다고 14일 밝혔다. 두바이유 가격은 4개월여 만인 지난 4월 13일 배럴당 40달러대로 올라선 뒤 등락을 거듭하면서도 꾸준한 상승세를 보이고 있다. 뉴욕상업거래소(NYMEX)의 WTI(서부텍사스산 원유) 선물은 전 거래일보다 19센트 내린 배럴당 48.88달러로 거래를 마감했다. 런던 ICE 선물시장의 브렌트유 선물도 전 거래일보다 19센트 하락한 50.35달러로 장을 마쳤다. 한경닷컴 산업경제팀
뉴시스,267790,/news/news_read.nhn?article_id=0007461154&office_id=003&mode=search&query=배럴&page=38,2016-09-09 12:29,사우디 8월 원유 생산량 일일 1063만 배럴&hellip;4만 배럴 감산,"【서울=뉴시스】이재준 기자 = 사우디아라비아는 8월 원유를 일일 평균 1063만 배럴 생산해 전달에 비해 4만 배럴 감산했다고 블룸버그 통신이 9일 보도했다. 통신에 따르면 사우디는 전날 석유수출국기구(OPEC)에 8월 산유량을 이같이 줄였다고 정식 통보했다. OPEC은 러시아와 함께 국제 석유시장의 안정과 유가 인상을 겨냥해 주요 산유국의 증산 동결을 추진하고 있다. 관련 사정에 정통한 관계자는 사우디가 산유량 통계를 OPEC 제출했으며 8월 생산량이 사상 최대인 7월의 일일 1067만 배럴보다 감소했다고 설명했다. NGP 에너지 캐피털 매니지먼트의 전 수석 이코노미스트 아나스 알하지는 ""가장 중요한 문제는 사우디가 산유량을 여름철 전 수준으로 줄일지 여부""라고 지적했다. 여름철 혹서로 국내 수요가 확대하기 전인 3월 사우디의 산유량은 일일 1022만 배럴을 기록했다. 지난 2년간 사우디가 미국 셰일유 생산 확대에 맞서 시장 점유율을 유지할 목적으로 증산을 주도하면서 원유 과잉공급으로 유가 급락세를 보였다. 이에 OPEC이 원유 증산 동결의 합의를 이끌려고 노력했지만 사우디가 이란을 포함한 OPEC 회원국 모두 참여하지 않으면 응하지 않겠다고 버팀에 따라 난항을 겪어왔다. 하지만 이번 감산으로 사우디가 증산 동결에 나서겠다는 신호를 보낸 것은 아닌가는 관측을 불러일으키고 있다. 한편 이란의 8월 일일 산유량은 7월의 362만 배럴에서 1만 배럴 늘어난 363만 배럴에 달했다. OPEC에서 사우디 다음의 원유 생산국인 이라크는 8월 산유량이 일일 463만8000 배럴로 7월보다 3만2000 배럴 증가한 것으로 나타났다."
연합뉴스,267790,/news/news_read.nhn?article_id=0008470069&office_id=001&mode=search&query=배럴&page=46,2016-06-14 08:11,두바이유 가격 또 하락&hellip;배럴당 47.06달러,(서울=연합뉴스) 정성호 기자 = 두바이유 가격이 2거래일 연속 하락하며 배럴당 47달러대로 내려섰다. 한국석유공사는 13일(현지시간) 거래된 두바이유 현물 가격이 전 거래일보다 1.17달러 내린 배럴당 47.06달러로 집계됐다고 14일 밝혔다. 두바이유 가격은 4개월여 만인 지난 4월 13일 배럴당 40달러대로 올라선 뒤 등락을 거듭하면서도 꾸준한 상승세를 보이고 있다. 뉴욕상업거래소(NYMEX)의 WTI(서부텍사스산 원유) 선물은 전 거래일보다 19센트 내린 배럴당 48.88달러로 거래를 마감했다. 런던 ICE 선물시장의 브렌트유 선물도 전 거래일보다 19센트 하락한 50.35달러로 장을 마쳤다.
연합뉴스,267790,/news/news_read.nhn?article_id=0008465250&office_id=001&mode=search&query=배럴&page=46,2016-06-11 08:37,두바이유 가격 '숨고르기'&hellip;배럴당 48.23달러,(서울=연합뉴스) 옥철 기자 = 사흘 연속 오르던 두바이유 가격이 하락세로 바뀌어 배럴당 48달러 초반대로 내려갔다. 한국석유공사는 10일(현지시간) 거래된 두바이유 현물 가격이 전날보다 0.75달러 내린 배럴당 48.23달러로 집계됐다고 11일 밝혔다. 두바이유 가격은 4개월여 만인 지난 4월 13일 배럴당 40달러대로 올라선 뒤 등락을 거듭하면서도 꾸준한 상승세를 보이고 있다. 뉴욕상업거래소(NYMEX)의 WTI(서부텍사스산 원유) 선물은 전날보다 1.49달러 내린 배럴당 49.07달러로 거래를 마감했다. 런던 ICE 선물시장의 브렌트유 선물도 전날보다 1.41달러 내린 50.54달러로 장을 마쳤다.
서울경제,267790,/news/news_read.nhn?article_id=0002946460&office_id=011&mode=search&query=배럴&page=26,2016-12-29 09:20,[서울경제TV] 두바이유 3일 연속 상승&middot;&middot;&middot; 배럴당 53.73달러,두바이유 가격이 3거래일 연속으로 상승하며 53달러선으로 올라섰다. 29일 한국석유공사에 따르면 28일(이하 현지시간) 거래된 두바이유 현물 가격이 전날보다 1.01달러 오른 53.73달러로 집계됐다. 두바이유 가격은 9월말 석유수출국기구(OPEC) 회원국들이 감산에 합의한 데 이어 이달 OPEC 비회원국까지 감산에 동참하기로 하면서 상승세를 타고 있다. 런던 ICE 선물시장의 브렌트유 선물도 전날보다 13센트 상승한 배럴당 56.22달러로 거래를 마쳤다. 이는 지난해 7월 21일의 57.04달러 이후 1년 5개월 만에 가장 높은 수준이다. 뉴욕상업거래소(NYMEX)의 서부텍사스산원유(WTI) 선물 역시 전날보다 16센트 오른 54.06달러로 장을 마감했다. 이 역시 지난해 7월 2일(56.93달러) 이후 약 1년 5개월 만의 최고치다. 이날 국제유가는 OPEC 회원국과 비회원국들이 하루 원유 생산량을 평균 180만 배럴 정도 줄이기로 한 감산 합의가 이행에 들어가는 내년 1월 1일을 앞두고 감산에 대한 기대감에 일제히 오른 것으로 풀이된다.
아시아경제,267790,/news/news_read.nhn?article_id=0003856823&office_id=277&mode=search&query=배럴&page=33,2016-10-27 10:45,"[컨콜]에쓰오일 &quot;가솔린 마진, 현재 배럴당 12.3달러까지 회복&quot;","[아시아경제 심나영 기자]에쓰오일은 27일 올 3분기 실적 컨퍼런스콜을 통해 ""최근 가솔린 스프레드가 가을 정기보수 영향으로 회복세""라며 ""(배럴당) 12.3달러 대로 회복돼 있다""고밝혔다. 이어 ""4분기 중에는 수요가 난방유 위주로 증가하기 때문에 상대적으로 전체적 마진 수준이 현재에서 추가적으로 상승하기는 어렵고 현재 수준으로 유지될 것으로 전망하고 있다""고 덧붙였다."
경향신문,267790,/news/news_read.nhn?article_id=0002753715&office_id=032&mode=search&query=배럴&page=26,2016-12-29 09:43,감산 이행 앞두고 두바이유 연일 상승&middot;&middot;&middot;배럴당 53.73달러,두바이유 가격이 연일 상승하며 53달러 선으로 올라섰다. 한국석유공사는 28일(현지시간) 거래된 두바이유 현물 가격이 전날보다 1.01달러 오른 53.73달러로 집계됐다고 29일 밝혔다. 런던 ICE 선물시장의 브렌트유 선물도 전날보다 13센트 상승한 배럴당 56.22달러로 거래를 마쳤다. 뉴욕상업거래소(NYMEX)의 서부텍사스산원유(WTI) 선물 역시 전날보다 16센트 오른 54.06달러로 장을 마감했다. 브렌트유와 WTI 선물가는 1년5개월 만의 최고치다. 이날 국제유가는 석유수출국기구(OPEC) 회원국과 비회원국들의 감산 합의가 이행에 들어가는 내년 1월1일을 앞두고 감산에 대한 기대감이 영향을 미친 것으로 분석된다.
KBS 뉴스,267790,/news/news_read.nhn?article_id=0010326599&office_id=056&mode=search&query=배럴&page=46,2016-06-10 08:48,두바이유 가격 사흘째 상승&hellip;배럴당 48달러대,두바이유 가격이 사흘 연속 상승하며 배럴당 48달러대로 올라섰다. 한국석유공사는 9일(현지시각) 두바이유 현물 가격이 전날보다 0.99달러 상승한 배럴당 48.98달러로 집계됐다고 10일 밝혔다. 두바이유 가격은 4개월여 만인 4월 13일 배럴당 40달러대로 올라선 뒤 등락을 거듭하면서도 꾸준히 상승세를 보이고 있다. 뉴욕상업거래소(NYMEX)에서 WTI 선물은 전날보다 0.67달러 내린 배럴당 50.56달러로 거래를 마감했다. 런던 ICE 선물시장의 브렌트유 선물 역시 전날보다 0.56달러 오르면서 51.95달러로 장을 마쳤다.
뉴시스,267790,/news/news_read.nhn?article_id=0007682397&office_id=003&mode=search&query=배럴&page=26,2016-12-30 02:28,미 원유재고 예상밖 증가&hellip; 지난주 61만 배럴&uarr;,【서울=뉴시스】박상주 기자 = 지난주 미국의 원유재고가 예상과는 달리 소폭 증가한 것으로 나타났다. 월스트리트저널(WSJ)과 로이터통신 등의 보도에 따르면 미국 에너지정보청(EIA)은 29일(현지시간) 지난주 23일까지의 미국 원유재고가 전주보다 61만4000배럴 증가한 것으로 집계됐다고 발표했다. 시장에서는 210만 배럴 감소할 것으로 예측했었다. 휘발유재고는 160만 배럴 줄었다. 시장에서는 130만 배럴 증가할 것으로 예측했었다. 난방유와 디젤을 포함하는 정제유재고는 190만 배럴 줄었다. 시장에서는 180만 배럴 증가를 예상했다. EIA에 따르면 서부텍사스원유(WTI) 선물시장 거래분 인도 지역인 쿠싱의 재고는 17만2000배럴 증가했다. 정유공장의 원유 처리량은 일 평균 10만1000배럴 감소했다. 정유공장 가동률은 전주보다 0.5%포인트 하락한 91%를 기록했다. 지난주 원유수입은 일평균 37만4000배럴 감소했다. 이에 앞서 28일 미국석유협회(API)는 지난 주간 미국 원유재고가 420만 배럴 증가한 것으로 나타났다고 발표했다. 이전 주 410만 배럴 감소했던 API의 원유재고는 한 주 만에 다시 증가세로 돌아섰다. WSJ이 11명의 전문가를 대상으로 벌인 조사에 따르면 EIA가 집계한 지난주 원유재고는 140만 배럴 감소할 것으로 전망됐었다. 미국의 원유재고가 증가했다는 사실이 알려지면서 국제유가는 약세를 보이고 있다.  29일 뉴욕상업거래소에서 서부텍사스산원유(WTI)는 지난 거래일보다 0.7% 떨어진 배럴당 53.68달러에 거래되고 있다. 런던 ICE선물거래소의 북해산 브랜트유 역시 0.4% 하락한 배럴당 56.73달러를 나타내고 있다.
SBS 뉴스,267790,/news/news_read.nhn?article_id=0000417575&office_id=055&mode=search&query=배럴&page=46,2016-06-10 08:12,두바이유 가격 사흘째 상승&hellip;배럴당 48달러대,두바이유 가격이 사흘 연속 상승하며 배럴당 48달러대로 올라섰습니다. 한국석유공사는 오늘(10일) 현지시각 어제 두바이유 현물 가격이 전날보다 0.99달러 상승한 배럴당 48.98달러로 집계됐다고 밝혔습니다. 두바이유 가격은 4개월여 만인 4월 13일 배럴당 40달러대로 올라선 뒤 등락을 거듭하면서도 꾸준히 상승세를 보이고 있습니다. 뉴욕상업거래소(NYMEX)에서 WTI 선물은 전날보다 0.67달러 내린 배럴당 50.56달러로 거래를 마감했습니다. 런던 ICE 선물시장의 브렌트유 선물 역시 전날보다 0.56달러 오르면서 51.95달러로 장을 마쳤습니다. 
연합뉴스,267790,/news/news_read.nhn?article_id=0008924484&office_id=001&mode=search&query=배럴&page=26,2016-12-30 04:54,"국제유가, 미 원유재고 증가에 하락&hellip;WTI 배럴당 53.77달러",(뉴욕=연합뉴스) 김화영 특파원 = 미국의 주간 원유재고가 늘어난 것으로 파악되면서 나흘 연속 올랐던 국제유가가 29일(현지시간) 하락했다. 미국 뉴욕상업거래소(NYMEX)에서 서부텍사스산 원유(WTI) 내년 2월 인도분은 전날보다 29센트 떨어진 배럴당 53.77달러에 거래를 마쳤다. 런던 ICE 선물시장의 내년 2월 인도분 브렌트유는 8센트(0.14%) 내린 배럴당 56.14달러 수준에서 움직이고 있다. 미국 에너지정보청(EIA)은 지난 23일로 끝난 주간에 미국 원유재고량이 61만4천 배럴 늘었다고 발표했다. 시장 전문가들은 200만 배럴 이상 감소했을 것으로 예상했는데 결과는 반대였다. WTI 선물인도지점인 오클라호마 주 커싱의 재고량도 17만2천 배럴 정도 늘어난 것으로 집계됐다.
연합뉴스,267790,/news/news_read.nhn?article_id=0008463139&office_id=001&mode=search&query=배럴&page=46,2016-06-10 08:07,두바이유 가격 사흘째 상승&hellip;배럴당 48달러대,(서울=연합뉴스) 김연숙 기자 = 두바이유 가격이 사흘 연속 상승하며 배럴당 48달러대로 올라섰다. 한국석유공사는 9일(현지시간) 두바이유 현물 가격이 전날보다 0.99달러 상승한 배럴당 48.98달러로 집계됐다고 10일 밝혔다. 두바이유 가격은 4개월여 만인 4월 13일 배럴당 40달러대로 올라선 뒤 등락을 거듭하면서도 꾸준히 상승세를 보이고 있다. 뉴욕상업거래소(NYMEX)에서 WTI 선물은 전날보다 0.67달러 내린 배럴당 50.56달러로 거래를 마감했다. 런던 ICE 선물시장의 브렌트유 선물 역시 전날보다 0.56달러 오르면서 51.95달러로 장을 마쳤다.
머니S,267790,/news/news_read.nhn?article_id=0000199533&office_id=417&mode=search&query=배럴&page=38,2016-09-09 13:41,"배럴, 네오프렌 전품목 50% 할인 이벤트 진행","본문 이미지 영역스포츠 브랜드 배럴이 '오늘 사면 유리해ver2' 프로모션을 통해 네오프렌 전품목을 50% 할인한다고 9일 밝혔다.   이번 행사는 가을을 맞아 서핑, 웨이크보드, 바다수영, 다이빙 등 즐거운 워터스포츠 활동을 위해 네오프렌 전품목을 50% 할인된 가격에 제공한다는 취지에서 시작되었다. 배럴 네오프렌 제품은 체온 유지 기능이 있어 워터스포츠를 장시간 즐길 수 있으며, 물 밖에서도 급격한 체온 변화를 막아주어 가을 서핑을 즐기는 서퍼들과 각종 워터스포츠 애호가들에게 매우 최적화된 아이템이라는 업체 측 서명.  한편 '오늘 사면 유리해ver2' 는 9월9일부터 11일까지 3일간 공식 온라인과 오프라인 직영매장 중  배럴 쇼룸, 배럴 홍대 플래그십스토어, 신세계 하남 스타필드 배럴매장 비롯한 총 3곳에서 만나볼 수 있다.&lt;이미지제공=배럴&gt;실시간 재테크 경제뉴스│창업정보의 모든 것
강인귀 기자 
&lt;저작권자 ⓒ '성공을 꿈꾸는 사람들의 경제 뉴스' 머니S, 무단전재 및 재배포 금지&gt;머니S 관련뉴스해당 언론사에서 선정하며 언론사 페이지(아웃링크)로 이동해 볼 수 있습니다.버커루, 롤업 스타일로 슬림핏 연출 '롤링진 시리즈' 출시이동 많은 명절엔 'eBook 소설'이 인기[건강] 추석에 늘어난 가사ᆞ장거리운전, 어깨 질환 발생 위험 높여모델 태은, 뉴욕 패션위크 데뷔… '톰포드 쇼' 에 유일한 동양인 남자모델로 등장"
연합뉴스,267790,/news/news_read.nhn?article_id=0008924649&office_id=001&mode=search&query=배럴&page=26,2016-12-30 08:37,두바이유 4일연속 상승&hellip;배럴당 53.90달러,[AP=연합뉴스자료사진] (서울=연합뉴스) 정성호 기자 = 두바이유 가격이 3거래일 연속으로 상승했다. 한국석유공사는 29일(이하 현지시간) 거래된 두바이유 현물 가격이 전날보다 17센트 오른 53.90달러로 집계됐다고 30일 밝혔다. 두바이유 가격은 9월 말 석유수출국기구(OPEC) 회원국들이 감산에 합의한 데 이어 이달 OPEC 비회원국까지 감산에 동참하기로 하면서 상승세를 타고 있다. 반면 런던 ICE 선물시장의 브렌트유 선물은 전날보다 8센트 하락한 배럴당 56.14달러로 거래를 마쳤다. 뉴욕상업거래소(NYMEX)의 서부텍사스산원유(WTI) 선물 역시 전날보다 29센트 내린 53.77달러로 장을 마감했다.
연합뉴스,267790,/news/news_read.nhn?article_id=0008781916&office_id=001&mode=search&query=배럴&page=33,2016-10-27 08:16,두바이유 가격 이틀째 하락&hellip;배럴당 47.91달러,[연합뉴스 자료사진] (서울=연합뉴스) 정성호 기자 = 두바이유 가격이 이틀 연속으로 하락하며 47달러 선까지 내려가는 등 국제유가가 일제히 떨어졌다. 한국석유공사는 26일(현지시간) 거래된 두바이유 현물 가격이 전날보다 1.29달러 내린 배럴당 47.91달러로 집계됐다고 27일 밝혔다. 두바이유 가격은 최근 석유수출국기구(OPEC) 산유국들이 원유 감산에 합의하면서 한때 50달러를 넘어서는 등 강세를 보였으나 최근 상승세가 주춤한 상태다. 런던 ICE 선물시장의 브렌트유 선물은 전날보다 81센트 하락한 49.98달러로 거래를 마쳤다. 또 뉴욕상업거래소(NYMEX)의 서부텍사스산원유(WTI) 선물도 전날보다 78센트 하락한 배럴당 49.18달러로 장을 마감했다. 이날 국제유가는 OPEC 산유국들이 감산에 합의한 가운데 이라크가 예외를 인정할 것을 요구하는 등 실제 감산 이행에 대한 불확실성이 커지면서 일제히 하락했다.
한국경제TV,267790,/news/news_read.nhn?article_id=0000469939&office_id=215&mode=search&query=배럴&page=46,2016-06-10 05:29,"국제유가, 달러화 강세속 1.3% &darr;&hellip;WTI 배럴당 50.56달러","[한국경제TV 문성필 기자] 사흘 연속 상승하던 국제유가가 현지시각 9일 하락했습니다. 뉴욕상업거래소에서 미국 서부텍사스산 원유(WTI) 7월 인도분은 하루 전보다 67센트(1.3%) 내린 배럴당 50.56달러로 거래를 마쳤습니다. 런던 ICE 선물시장의 7월 인도분 브렌트유도 하루 전보다 54센트(1.03%) 하락한 배럴당 51.97달러 수준입니다. 이날 달러화 상승으로 유가에 하락 압력이 커졌으며, 최근 단기급등에 따라 이익을 실현하려는 흐름이 형성됐습니다. 또, 지난달 앨버타 주 대형산불로 캐나다의 원유 공급량이 크게 줄었지만, 최근의 유가 강세로 조속한 정상화가 전망되는 점도 영향을 미쳤습니다. 다만, 일부 유전 지대의 정세 불안은 하락 폭을 제어했습니다. 최근 나이지리아 유정시설을 폭파했던 나이지리아 무장세력 '니제르 델타 어벤저스'는 전날 나이지리아 정부의 협상 제안을 거부한 것으로 알려졌습니다."
