source,symbol,link,date,title,content
SBS CNBC,267790,/news/news_read.nhn?article_id=0000108933&office_id=374&mode=search&query=배럴&page=40,2016-08-19 09:00,"[CNBC] 상승 흐름 탄 국제유가, 배럴당 60달러 문제없다?",■ 경제와이드 모닝벨 '이 시각 CNBC' 최근 달러화가 약세가 이어지고 있습니다. 다음 달 금리 인상 가능성을 주장하고 있는 위원들이 계속 등장하고 있는데 달러화가 오히려 약세를 보이는 원인은 무엇인지 살펴보겠습니다. 다음 달 금리 인상이 가능하다는 연준 위원들의 진단에도 달러화가 오히려 약세를 보였습니다. 연준에 대한 신뢰도가 크게 떨어진 모습입니다. 달러화가 3개월 내 최저치로 떨어져 달러 인덱스 역시 0.4% 떨어진 94.30선에서 거래되고 있습니다. 채권시장 트레이더들은 9월 연준의 금리 인상 가능성이 20%에 그치는 것으로 판단하고 있습니다. 윌리엄 더들리 뉴욕 연방은행 총재는 미국의 일자리가 늘고 중산층이 증가하고 있다고 말했습니다. 고용시장 개선에 따라 금리 인상 환경이 조성되고 있음을 강조했습니다. 하지만 미국의 중앙은행이 신뢰성을 잃어가는 모습이라서 더는 위원들의 발언 영향력도 크진 않은 것 같습니다. 연준이 페이스북에 자체적인 페이지를 오픈했다고 합니다. 금융시장과 소통의 문제를 해결하기 위한 전략으로 풀이되는데 하지만 시장 반응은 냉소적이라고 합니다. 연준의 통화정책이 더는 효용성이 없다는 지적만 있습니다. 달러화 약세가 부각됨에 따라 국제유가는 강세를 보였습니다. 6거래일 연속 상승해 WTI 배럴당 48달러 선을 기록했습니다. 이달 초보다 20%나 오른 수준이자 지난 7월 1일 이후 가장 높은 수준입니다. 산유국들의 생산량 조절 논의 기대감과 달러화 약세 현상에 따른 것이라는 분석입니다. 뱅오아는 내년 6월까지 국제유가 50% 더 올라 69달러 도달 전망하고 데이비드 카츠 전문가 역시 60달러대 진입이 머지않았다고 주장했습니다. [CNBC 주요내용] 지금이 오일 관련주에 투자할 때라고 봅니다. 그 이유는 유가가 배럴당 60~65달러 수준까지 오를 거라고 보기 때문입니다. 현재 유가는 40~55달러 수준에서 밴드를 형성하고 있는데요. 하지만 유가가 상승 추세를 보이면 오일 관련주 투자가 유망합니다. 오일 기업의 실적이 개선되면서 높은 수익률을 올릴 수 있을 겁니다. 오일 관련주는 현재 실적과 주가순자산 대비 크게 저평가되어 있습니다. 따라서 장기적으로 오일 관련주에 투자가 유망합니다. 유가가 65달러로 오를 때까지 기다렸다가는 주가도 이미 크게 올라있을 겁니다. (자세한 내용은 동영상을 시청하시기 바랍니다.)
YTN,267790,/news/news_read.nhn?article_id=0000888223&office_id=052&mode=search&query=배럴&page=40,2016-08-13 09:13,두바이유 가격 사흘 만에 반등...배럴당 42.89달러,"두바이유 가격이 사흘 만에 반등하면서 배럴당 42달러대에 올라섰습니다. 한국석유공사는 어제(12일) 거래된 두바이유 현물 가격이 하루 전날보다 2달러 40센트 오른 배럴당 42달러 89센트로 집계됐다고 밝혔습니다. 뉴욕상업거래소의 서부 텍사스산 원유 선물은 1달러 오른 배럴당 44달러 49센트로 마감했고, 런던 ICE 선물시장의 10월 인도분 브렌트유도 전날보다 93센트 상승한 배럴당 46달러 97센트로 거래를 마쳤습니다."
MBN,267790,/news/news_read.nhn?article_id=0001006290&office_id=057&mode=search&query=배럴&page=40,2016-08-13 09:13,두바이유 가격 사흘만에 반등&hellip;배럴당 42.89달러,두바이유 가격 사흘만에 반등…배럴당 42.89달러 두바이유/사진=연합뉴스 두바이유 가격이 사흘 만에 반등하며 배럴당 42달러대에 올라섰습니다. 한국석유공사는 12일(현지시간) 거래된 두바이유 현물 가격이 전날보다 2.40달러 오른 배럴당 42.89달러로 집계됐다고 13일 밝혔습니다. 두바이유 가격은 6월 9일에 48.98달러까지 올라갔지만 이후 브렉시트 등의 영향을 받아 42~43달러대에서 등락을 거듭했습니다. 런던 ICE 선물시장의 10월 인도분 브렌트유도 전날보다 0.93달러 상승한 배럴당 46.97달러로 거래를 마쳤습니다. 뉴욕상업거래소(NYMEX)의 서부텍사스산 원유(WTI) 선물은 1.00달러 오른 배럴당 44.49달러로 장을 마감했습니다.
이데일리,267790,/news/news_read.nhn?article_id=0003670494&office_id=018&mode=search&query=배럴&page=32,2016-11-08 10:30,"윌리엄그랜트, '발베니 15년 싱글 배럴 셰리 캐스크' 출시","(사진=윌리엄그랜트앤선즈코리아 제공) [이데일리 김태현 기자] 위스키 명가 윌리엄그랜트앤선즈코리아는 프리미엄 싱글몰트 위스키 발베니의 신제품 ‘발베니 15년 싱글 배럴 셰리 캐스크’를 국내 출시한다고 8일 밝혔다. 이번에 출시된 발베니 15년 싱글 배럴 셰리 캐스크는 한 개의 오크통에서 15년 숙성된 원액만을 담은 싱글 배럴 싱글몰트 위스키이다. 최대 650병까지만 생산되며, 각각의 병에 부착된 라벨에는 오크통과 병의 고유 일렬 번호가 표시돼 있다. 각각의 오크통마다 향이 다르다. 영국 왕실로부터 훈장을 받은 위스키 발베니의 몰트 마스터 데이비드 스튜어트에 의해 엄선된 유러피언 올로로소 셰리 오크통에서 숙성된 제품으로 발베니만의 깊은 풍미에 말린 과일의 달콤함, 은은한 견과류에 스파이시함의 균형 잡힌 조화에 부드러운 여운을 느낄 수 있다. 발베니 15년 싱글 배럴 셰리 캐스크의 가격은 27만원이다."
연합뉴스,267790,/news/news_read.nhn?article_id=0008610372&office_id=001&mode=search&query=배럴&page=41,2016-08-13 08:38,두바이유 가격 사흘만에 반등&hellip;배럴당 42.89달러,[연합뉴스자료사진] (서울=연합뉴스) 고웅석 기자 = 두바이유 가격이 사흘 만에 반등하며 배럴당 42달러대에 올라섰다. 한국석유공사는 12일(현지시간) 거래된 두바이유 현물 가격이 전날보다 2.40달러 오른 배럴당 42.89달러로 집계됐다고 13일 밝혔다. 두바이유 가격은 6월 9일에 48.98달러까지 올라갔지만 이후 브렉시트 등의 영향을 받아 42~43달러대에서 등락을 거듭했다. 런던 ICE 선물시장의 10월 인도분 브렌트유도 전날보다 0.93달러 상승한 배럴당 46.97달러로 거래를 마쳤다. 뉴욕상업거래소(NYMEX)의 서부텍사스산 원유(WTI) 선물은 1.00달러 오른 배럴당 44.49달러로 장을 마감했다.
한국경제,267790,/news/news_read.nhn?article_id=0003639025&office_id=015&mode=search&query=배럴&page=41,2016-08-12 08:30,두바이유 가격 하락 지속&hellip;배럴당 40.49달러,두바이유 가격이 2거래일 연속 하락하며 다시 40달러 선으로 내려앉았다. 한국석유공사는 11일(현지시간) 거래된 두바이유 현물 가격이 전날보다 85센트 하락한 배럴당 40.49달러로 집계됐다고 12일 밝혔다. 두바이유 가격은 6월 9일 48.98달러까지 올라갔지만 이후 브렉시트(Brexit·영국의 유럽연합 탈퇴) 등의 영향을 받아 42~43달러대에서 등락을 거듭했다. 반면 런던 ICE 선물시장의 브렌트유 선물은 전날보다 1.99달러 상승한 배럴당 46.04달러로 거래를 마쳤다. 뉴욕상업거래소(NYMEX)의 서부텍사스산 원유(WTI) 선물도 전날보다 1.78달러 오른 43.49달러로 장을 마감했다. 한경닷컴 뉴스룸
한국경제,267790,/news/news_read.nhn?article_id=0003679056&office_id=015&mode=search&query=배럴&page=32,2016-11-03 08:33,"국제유가, 일제히 하락&hellip;두바이유, 배럴당 44달러선",국제유가가 미국의 원유 재고가 예상보다 많이 늘어나자 투자 심리가 얼어붙으면서 일제히 하락했다. 한국석유공사는 2일(현지시간) 거래된 두바이유 현물 가격이 전날보다 1.34달러 하락한 배럴당 44.08달러로 집계됐다고 3일 밝혔다. 두바이유 가격은 최근 석유수출국기구(OPEC) 산유국들이 원유 감산에 합의하면서 한때 50달러를 넘어서는 등 강세를 보였으나 최근 감산 조처의 실제 이행에 대한 의구심이 확산하면서 다시 하락하는 추세다. 런던 ICE 선물시장의 브렌트유 선물도 전날보다 1.28달러 내린 배럴당 46.86달러로 거래를 마쳤다. 또 뉴욕상업거래소(NYMEX)의 서부텍사스산원유(WTI) 선물도 전날보다 1.33달러 하락한 배럴당 45.34달러로 장을 마감했다. 한경닷컴 산업경제팀 기사제보 및 보도자료
연합뉴스,267790,/news/news_read.nhn?article_id=0008806999&office_id=001&mode=search&query=배럴&page=32,2016-11-08 08:16,두바이유 가격 닷새째 하락&hellip;배럴당 42.69달러,[연합뉴스자료사진] (서울=연합뉴스) 정성호 기자 = 두바이유 가격이 5거래일 연속으로 하락하며 배럴당 42.69달러로 떨어졌다. 한국석유공사는 7일(현지시간) 거래된 두바이유 현물 가격이 전 거래일보다 15센트 하락한 배럴당 42.69달러로 집계됐다고 8일 밝혔다. 두바이유 가격은 9월 말 석유수출국기구(OPEC) 산유국들이 원유 감산에 합의하면서 한때 50달러를 넘어서는 등 강세를 보였으나 최근 감산 조처의 실제 이행에 대한 의구심이 확산하면서 다시 하락하는 추세다. 반면 런던 ICE 선물시장의 브렌트유 선물은 전 거래일보다 57센트 오른 배럴당 46.15달러로 거래를 마쳤다. 또 뉴욕상업거래소(NYMEX)의 서부텍사스산원유(WTI) 선물도 전 거래일보다 82센트 상승한 배럴당 44.89달러로 장을 마감했다.
매일경제,267790,/news/news_read.nhn?article_id=0003779141&office_id=009&mode=search&query=배럴&page=41,2016-08-04 08:48,두바이유 가격 하락세 이어가&hellip;배럴당 38.54달러,두바이유 가격이 하락세를 이어가 배럴당 38달러대를 유지했다. 한국석유공사는 3일(현지시간) 거래된 두바이유 현물 가격이 전날보다 0.31달러 내린 배럴당 38.54달러로 마감했다고 4일 밝혔다. 두바이유 가격은 지난 6월 9일 48.98달러까지 올라갔지만 이후 브렉시트영국의 유럽연합 탈퇴) 등의 영향을 받으며 42∼43달러대에서 등락을 거듭했다. 지난달 말부터는 40달러 선 안팎에서 움직이고 있다. 런던 ICE 선물시장의 브렌트유 선물은 전날보다 1.30달러 오른 배럴당 43.10달러로 거래를 마쳤다. 전날 4개월 만에 배럴당 가격이 40달러 아래에서 마감했던 뉴욕상업거래소(NYMEX)의 WTI 선물은 1.32달러 오른 배럴당 40.83달러로 장을 마감했다. 미국 에너지정보청(EIA)은 미국의 휘발유 재고량이 1주일새 330만 배럴 감소했다고 이날 발표했다. 이는 전문가들이 예상한 20만 배럴보다 훨씬 많은 양이 줄어든 것이다. [디지털뉴스국] r_start // r_end //
뉴스1,267790,/news/news_read.nhn?article_id=0002250243&office_id=421&mode=search&query=배럴&page=39,2016-08-30 07:15,유가 하락&hellip;달러 강세에 WTI 배럴당 47달러 붕괴,"미국의 셰일유 유전지대. © AFP=뉴스1 (서울=뉴스1) 김정한 기자 = 국제 유가가 29일(현지시간) 하락했다. 미국 연방준비제도(연준)가 이르면 다음 달 금리인상에 나설 것이라는 전망이 고조돼  달러가 강세를 나타냈고 주요 산유국들이 원유 생산 동결에 실패할 것이라는 예상이 확대됐다. 이날 미국 서부텍사스원유(WTI)는 1.4% 하락한 배럴당 46.98달러에 거래됐다. 브렌트유는 1.3% 매린 49.762달러를 기록했다. 주요 6개국 통화 대비 미국 달러화의 가치를 나타내는 달러인덱스는 0.11% 상승한 95.59를 나타냈다. 지난 26일 달러 가치는 재닛 옐런 미국 연방준비제도(연준) 의장의 잭슨홀 심포지엄 기조연설 직후 기대에 못 미치는 금리인상 전망에 하락했다가 스탠리 피셔 연준 부의장의 CNBC와의 인터뷰 직후 금리인상 전망이 높아지면서 다시 상승했다. 옐런 의장은 이날 고용과 인플레이션 개선에 힘입어 ""추가인상 여건이 강화됐다""고 말했다. 이어서 피셔 부의장은 CNBC와의 인터뷰에서 이에 대해 ""9월을 포함해 연내 두 차례도 가능하다는 뜻""이라고 해설했다. 이날 발표된 지난달 미국의 소비지출도 양호하게 나타나 연준의 연내 금리인상 가능성에 힘을 실어줬다. 앞으로 수주동안 유가는 다음 달 석유수출국기구(OPEC)회원국들과 비회원국들이 알제리에서 진행할 비공식 회의에 대한 전망에 따라 움직일 것으로 예상된다. OPEC을 둘러싼 낮은 기대감은 과거 산유국들이 유가를 올리기 위한 합의에 도달하지 못했다는 전력 때문이다. 지난 4월에도 핵개발 제재에서 풀려난 이란이 원유 증산을 포기하지 않아  원유생산 동결에 실패한 바 있다. OPEC 회원국들은 다음달 26~28일 알제리에서 국제 에너지 포럼의 개최한다."
머니투데이,267790,/news/news_read.nhn?article_id=0003721138&office_id=008&mode=search&query=배럴&page=42,2016-08-03 03:40,"국제유가 , 배럴당 40달러 붕괴&hellip;WTI 1.4%&darr;",[머니투데이 뉴욕=서명훈 특파원] 국제 유가가 지난 4월 이후 처음으로 배럴당 40달러 선이 무너졌다. 2일(현지시간) 뉴욕상업거래소에서 서부텍사스산원유(WTI) 가격은 전날보다 배럴당 1.4% 하락한 39.51달러를 기록했다. textlinktopstart textlinktopend
연합뉴스,267790,/news/news_read.nhn?article_id=0008846854&office_id=001&mode=search&query=배럴&page=30,2016-11-25 08:15,두바이유 가격 이틀 연속 하락&hellip;배럴당 45.67달러,[연합뉴스자료사진] (서울=연합뉴스) 정성호 기자 = 두바이유 가격이 이틀 연속으로 하락하며 45달러대로 내려섰다. 한국석유공사는 24일(현지시간) 거래된 두바이유 현물 가격이 전날보다 40센트 하락한 배럴당 45.67달러로 집계됐다고 24일 밝혔다. 두바이유 가격은 9월 말 석유수출국기구(OPEC) 산유국들이 원유 감산에 합의하면서 한때 50달러를 넘어서는 등 강세를 보였다. 그러나 이후 감산 조처의 실제 이행에 대한 의구심으로 40달러 초반대까지 하락했다가 최근 다시 회복하는 모양새다. 런던 ICE 선물시장의 브렌트유 선물은 전날보다 5센트 상승한 배럴당 49.00달러로 거래를 마쳤다. 뉴욕상업거래소(NYMEX)의 서부텍사스산원유(WTI) 선물은 이날 미국이 추수감사절 휴일이라 거래가 이뤄지지 않았다.
연합뉴스,267790,/news/news_read.nhn?article_id=0008582673&office_id=001&mode=search&query=배럴&page=42,2016-08-03 03:38,"국제유가, 배럴당 40달러 붕괴 마감(1보)","연합뉴스 관련뉴스해당 언론사에서 선정하며 언론사 페이지(아웃링크)로 이동해 볼 수 있습니다.탤런트 견미리 대주주 회사 주가조작 혐의로 남편 구속'온몸에 멍' 4살 햄버거 먹고 숨져…""학대여부 수사""로스쿨생, 치마 속 '몰카'로 철창행…이번이 세번째콘도형 숙박시설 하루 50만원…'휴가시즌 한철 맘껏 돈벌어보자'탈북자지원 학교에 손도끼ㆍ협박편지…""간첩소행 가능성"""
서울경제,267790,/news/news_read.nhn?article_id=0002924702&office_id=011&mode=search&query=배럴&page=30,2016-11-25 14:21,러 중앙銀 &quot;국제유가 배럴당 25달러까지 폭락해도 재앙 아냐&quot;,석유수출국기구(OPEC) 정례회의를 앞두고 러시아 중앙은행이 국제유가가 폭락하더라도 자국 경제에 큰 타격은 없을 것이라고 밝혔다고 러시아 스푸트니크통신이 24일(현지시간) 보도했다. 엘비라 나비울리나 러시아 중앙은행 총재는 “국제유가가 배럴당 25달러로 내려가는 상황에 대비해 스트레스테스트(재무건전성 점검)를 했다”며 “러시아에 재앙이 올 것으로 보지는 않지만 루블화 가치는 하락할 것”이라고 전망했다. OPEC은 지난 9월 산유량 감축에 합의한 후 오는 30일 정례회의에서 구체적인 할당량을 확정하기로 했지만 실제 감산으로 이어질지에 대해서는 관측이 분분한 상황이다. 서방의 경제제재 해제 이후 증산을 이어온 이란뿐 아니라 이슬람 극단주의 무장단체 ‘이슬람국가(IS)’와 전쟁을 치르고 있는 이라크까지 감산에서 제외해달라고 요청했기 때문이다. OPEC은 양국 간 합의를 유도하기 위해 할당량 유지 시한을 6개월로 제한하는 방안을 논의 중인 것으로 알려졌으며 두 나라가 할당량을 끝까지 거부할 경우 사우디아라비아가 감산 물량의 상당 부분을 떠안을 가능성도 점쳐진다.
SBS CNBC,267790,/news/news_read.nhn?article_id=0000107367&office_id=374&mode=search&query=배럴&page=42,2016-08-02 18:13,"국제유가, 공급과잉 우려에 급락&hellip;배럴당 40달러","공급 과잉 우려로 국제유가가 석 달만에 가장 낮은 수준으로 떨어졌습니다. 미국 뉴욕 상품거래소에서 서부 텍사스산 원유 9월 인도분은 지난 주 마지막 거래일보다 1달러 54센트 하락한 배럴당 40달러 6센트에 거래를 마감했습니다. 이는 4월 20일 이후 가장 낮은 수준입니다. 파이낸셜타임즈는 ""원유시장 공급과잉이 여전하다""는 이란 석유부 장관의 발언이 공급과잉 우려를 확대시켜 이처럼 유가 하락을 부추겼다고 분석했습니다."
헤럴드경제,267790,/news/news_read.nhn?article_id=0001093344&office_id=016&mode=search&query=배럴&page=42,2016-08-02 11:19,다시 미끄러진 국제유가&hellip;배럴당 40달러대 턱걸이,"두달새 22% 폭락…약세장 돌입 [헤럴드경제]특별한 이유없이 야금야금 오르며 한 때 40달러 중반대를 넘어 50달러대까지 올랐던 국제유가가 이번엔 속절없는 추락을 계속하고 있다. 특히 국제유가는 최근 두 달여새 22%나 폭락하면서 ‘약세장’(Bear Market)에 들어갔다는 분석도 나오고 있다. 지난 2년간 국제유가를 짓눌렀던 공급과잉에 대한 우려가 다시 ‘저유가의 저주’를 불러오고 있다는 얘기다. 이에 따라 일각에선 국제유가가 다시 30달러 중반대까지 떨어질 수 있다는 관측도 나오고 있다. 1일(현지시간) 뉴욕상업거래소에서 9월 인도분 서부텍사스산원유(WTI) 가격은 전거래일 대비 3.7%(1.54달러) 하락한 배럴당 40.06달러에 거래를 마쳤다. 지난 4월 20일 이후 가장 낮은 가격이다. WTI는 이날 장중 한 때 배럴당 39.82달러까지 떨어지기도 했지만, 가까스로 40달러에 턱걸이했다. WTI는 이로써 지난 6월 초 50달러를 넘어섰던 것에서 두 달여만에 22%나 폭락했다. 런던 ICE거래소에서 브렌트유 9월 인도분 선물가격 역시 이날 3.2% 하락한 배럴당 42.14달러에 그쳤다. 미국 3대 메이저 석유회사 중 하나인 코노코필립스의 라이언 랜스 CEO는 지난주 컨퍼런스 콜에서 “더 낮은 유가와 변동성에 준비할 필요가 있다”며 “유가가 진짜 상승하는 걸 보려면 내년까지는 기다려야 한다”고 말했다. 최근 ‘저유가의 저주’는 공급과잉과 수요부진, 재고 급증이라는 3대 악재가 맞물린 탓이다. 나이지리아, 이라크, 미국 등이 최근 원유생산량을 높였다. 사우디아라비아의 국영석유회사 아람코는 대(對)아시아 9월 원유 수출가격을 배럴당 1.30 달러 인하했다. 이는 10개월 만에 가장 큰 인하 폭이다. 로이터통신은 사우디산 원유의 가격인하가 비슷한 등급의 러시아와 아랍에미리트연합산 원유와의 경쟁 때문이라고 분석했다. 이에 반해 수요는 저성장 속에서 부진한 상태다. 닛케이는 “석유 최대 소비국인 미국에서 수요가 부진해 원유 재고량으로 이례적인 증가세를 보였다”고 평가했다. 미국 에너지정보청(EIA)에 따르면 미국 전체 원유 비축량은 5억1950만 배럴을 기록했다. 1990년 이후 최고 수준이다. 미국의 대표적인 원유비축지역인 오클라호마 쿠싱지역의 원유 재고량은 지난주보다 110만 배럴 증가했다."
뉴시스,267790,/news/news_read.nhn?article_id=0007615806&office_id=003&mode=search&query=배럴&page=30,2016-11-27 17:28,"OPEC, 일일 총110만 배럴 감축 추진&hellip;이란 &quot;검토 중&quot;","러시아 등 주요 비회원국들도 일일 60만 배럴 감축 계획 【서울=뉴시스】오애리 기자 = 석유수출국기구(OPEC)회원국들이 오는 30일부터 시작되는 총회를 앞두고 유가 안정을 위해 일일 총 110만 배럴의 원유 생산 감축을 추진하고 있다고 블룸버그통신이 26일(현지시간) 보도했다. 통신에 따르면 알제리의 누레딘 부타르파 에너지 장관은 26일 이란 테헤란을 방문해 비잔 남다르 잔가네 장관에게 15개 오펙 회원국들이 일일 총 110만배럴을 감축하는 방안을 제안했다. 주요 비회원국들이 총 60만 배럴을 감축해 유가 안정을 위해 고통을 분담하는 방안도 내놓았다. 오펙 월례보고서에 따르면, 지난 10월 회원국들의 일일 평균 산유량은 3364만 배럴을 기록했다. 국제에너지기구(IEA)는 오펙의 10월 산유량을 3383만 배럴로 집계했다. 부타르파 장관은 지난 9월 알제리에서 열린 오펙 회원국 및 일부 비회원국 긴급회의 때 원칙적 감산 합의를 이끌어내는데 기여한 바있다. 이후 부타르파 장관은 각 회원국들을 대상으로 감산 분담에 대한 동의를 이끌어내기 위해 노력해왔으며, 특히 '감산 제외'를 주장하고 있는 이란과 이라크를 설득하는데 주력해왔다. 이란은 국제사회 제재로 인해 손해를 입었기 때문에 감산 대상에서 제외돼야 한다고 주장하고 있고, 이라크는 극단이슬람 무장조직 이슬람국가(IS)와의 전쟁으로 인해 막대한 재정을 쏟아붓고 있기 때문에 제외시켜달라고 요구하고 있다. 이란 정부 관계자는 블룸버그통신과의 인터뷰에서 잔가네 장관이 알제리 제안에 대해 살펴보고 있으며, 오는 30일 오스트리아 빈에서 열리는 총회에서 이 제안을 놓고 다른 회원국들과 논의해보겠다는 입장을 밝혔다고 전했다.잔가네 장관이 감산 제안을 일언지하에 거부하지 않고 논의해보겠다는 자세를 취하는 것만으로도 이번 회의 결과에 대한 기대감이 높아지는 게 사실이다. 이란 석유부 산하 샤나통신은 잔가네 장관이 알제리 장관과의 회의를 마치고 난 후 ""오펙 회원국들이 산유량과 시장 관리에 관한 최종적 합의에 도달할 수있을 것""이라고 밝혔으며 ""만약 합의에 도달한다면 유가가 상승할 것으로 낙관한다""고 말했다고 전했다. 그러나 잔가네 장관은 이란이 감산 부담을 수용할 것인지 여부, 또 수용한다면 어느정도 수준인지에 대해서는 전혀 언급하지 않다. 부타르파 장관은 잔가네 장관에게 감산안에 합의할 경우 국제유가가 배럴당 55~60달러로 상승할 수 있지만, 만약 합의하지 않을 경우엔 배럴당 50달러선 이하를 유지하게 될 것이라고 설득한 것으로 전해졌다. 현재 국제유가는 서부텍사스유(WTI)를 기준으로 50달러 이하에서 등락을 반복하고 있다. 앞서 지난 9월 15개 오펙 회원국들은 알제리에 모여 일일 생산량을 3250만 배럴~3300만 배럴 수준으로 유지하기로 합의한 바있다. 이는 기존 생산량에서 약 2% 줄어든 수준이다. 하지만 아직 감산 합의를 낙관하기는 어렵다는 전망도 있다. 사우디아라비아가 28일로 예정된 러시아 등 비오펙 회원국들과의 회의 참석 계획을 취소해버렸기 때문이다. 이로 인해 총회 전 조율을 위해 마련됐던 이 회의는 취소돼버렸다. 그럼에도 불구하고 30일 빈 회의 이전까지 회원국 및 주요 비회원 산유국들 간에 치열한 막후 협상이 진행될 전망이다."
서울경제,267790,/news/news_read.nhn?article_id=0002864719&office_id=011&mode=search&query=배럴&page=42,2016-08-02 10:36,"국제유가 WTI, 배럴당 40달러로 거래 마감 &lsquo;금값 상승&rsquo;","국제유가 WTI, 배럴당 40달러로 거래 마감 ‘금값 상승’"
