source,symbol,link,date,title,content
이데일리,272420,/news/news_read.nhn?article_id=0003861333&office_id=018&mode=search&query=극동자동화&page=1,2017-06-28 11:02,[포토] 극동자동화 코넥스시장 신규상장기념식,"[이데일리 김태형 기자] 한국거래소 코스닥시장본부는 28일 서울사옥 홍보관에서 통신 및 보안시스템 구축, 선박엔진유압장치(HPS) 제조 생산기업인 (주)극동자동화의 코넥스시장 신규상장기념식을 개최하였다. 왼쪽부터 최규준 한국IR협의회 부회장, 김재준 한국거래소 코스닥시장위원회 위원장, 이상열 (주)극동자동화 대표이사, 염호 유진투자증권 부사장, 최욱 코넥스협회 부회장. (사진=한국거래소)"
머니투데이,272420,/news/news_read.nhn?article_id=0003958034&office_id=008&mode=search&query=극동자동화&page=1,2017-11-02 16:29,극동일렉콤(주) EM-RCS가 주도하는 컨테이너터미널의 자동화,"[머니투데이 송기우 에디터] 세계 최고층 빌딩, 7성급 호텔이 있는 인공도시 두바이 항만터미널에 국내업체의 장비가 설치·운용되며 전 세계 터미널운영사의 관심을 받고 있다. 코마린전시회에서 만난 이종기 대표/사진=송기우 에디터 극동일렉콤(주)(대표 이종기)은 1992년 선박용 조명등기구로 출발해 현재 냉동컨테이너 모니터링 시스템, 육상용 조명등기구, 야간감시 장치, 전선격벽장치 등 다양한 제품을 제조하는 회사다. 특히 선박용 조명등기구는 2012년 조명등기구 분야 세계시장 점유율 2위가 보여주듯 그 기술력도 인정받았다. 또 2016년에는 냉동컨테이너 모니터링 시스템(EM-RCS: Energy Monitoring - Reefer Container Socket)으로 ‘IR52 장영실상’도 수상했다. EM-RCS는 냉동컨테이너의 상태 및 전력 소요현황을 사무실에서 통합 모니터링 할 수 있는 시스템이다. 최근 온도 변화에 민감한 화물의 물동량이 증가하며 냉동컨테이너의 사용량이 증가하고 있어, 냉동관리를 인력에 의존할 경우 야간 및 악천 후에는 인명 사고의 위험이 따랐다. 이에 ISO 10368 규격에 따라 컨테이너에 설치된 전력선 모뎀을 사용하는 모니터링 시스템이 개발되었으나, 전력선 통신의 경우 부하에 따른 신호 감쇄 및 고주파 노이즈에 취약한 단점과 모뎀이 장착된 컨테이너가 전체 냉동컨테이너의 40% 이하라는 문제가 있었다. 이에 극동일렉콤은 냉동컨테이너에 100% 장착되어 있는 데이터포트를 통해 신호를 분석하는 시스템을 개발, 모뎀이 없는 냉동컨테이너까지 모니터링을 가능케 했고, 인력에 의존하던 방식을 자동화시켜 수기로 기록될 때의 정보 오류를 차단하고, 컨테이너별 전력적산 기능까지 갖췄다. 극동일렉콤(주)은 2013년 전자동 신축 터미널인 두바이 제벨알리항구 Terminal 3에 EM-RCS를 공급하여 그 성능을 입증하였으며, 그 결과 기존의 반자동 터미널인 Terminal 1, 2를 포함하여 2018년 개장 예정인 Terminal 4에도 공급이 확정되어 1,300만 불 규모의 계약을 달성했다. 또 세계 4위 터미널운영사인 DP World가 운영하는 세네갈의 다카르항구에도 이 제품이 운용되고 있으며, 이 회사가 운영하는 전 세계 60개 터미널에도 EM-RCS의 순차적 적용을 계획하고 있다. 극동일렉콤(주)은 직원의 10% 이상을 연구직으로 배치하여 경쟁력 있는 특화 상품을 개발하고자 끊임없이 노력해왔다. 이종기 대표는 “냉동컨테이너 전원공급 장치 시장은 1조 2000억 원의 블루오션이며, 당사는 EM-RCS의 최초 적용을 통해 시장 선점의 첫발을 내딛었으며, 이번 2017년 코마린 전시회를 겨냥해 선박용 시스템인 TM-RCS (Total Monitoring-Reefer Container Socket)을 개발 완료하여 적용 준비 중에 있다”고 밝혔다. 또 “올해를 냉동컨테이너 모니터링 시스템을 세계시장에 접목시키는 원년으로 삼고, 여기에 GPS(위성항법장치)기능과 IT 기능 그리고 스마트폰의 웹 검색 기능까지 부가하여 언제 어디서나 화물의 이동경로와 위치, 화물 상태까지 확인할 수 있는 시스템을 구축할 것”이라고 덧붙였다."
이데일리,272420,/news/news_read.nhn?article_id=0003857379&office_id=018&mode=search&query=극동자동화&page=1,2017-06-22 17:52,"[마켓인]극동자동화, 코넥스 신규상장","[이 기사는 6월 22일(목) 오후 5시 51분 이데일리 IB정보 서비스 ‘마켓인’에 표출됐습니다] [이데일리 신상건 기자]  한국거래소는 극동자동화의 코넥스시장 신규상장을 승인했다고 22일 밝혔다. 매매 거래는 오는 28일부터 개시된다. 극동자동화는 일반통신공사업체로 평가가격은 4565원, 액면가는 500원이다. 지정자문인은 유진투자증권이다."
뉴시스,272420,/news/news_read.nhn?article_id=0008036745&office_id=003&mode=search&query=극동자동화&page=1,2017-06-28 10:51,극동자동화 코넥스 신규상장 기념식,"【서울=뉴시스】 한국거래소 코스닥시장본부는 28일 오전 서울 여의도 서울사옥 홍보관에서 통신 및 보안시스템 구축, 선박엔진유압장치(HPS) 제조 생산기업인 극동자동화 코넥스시장 신규상장기념식을 개최했다. 왼쪽부터 최규준 한국IR협의회 부회장, 김재준 한국거래소 코스닥시장위원회 위원장, 이상열 극동자동화 대표이사, 염호 유진투자증권 부사장, 최욱 코넥스협회 부회장이 기념촬영을 하고 있다. 2017.06.28. (사진=한국거래소 제공)"
뉴스1,272420,/news/news_read.nhn?article_id=0002809840&office_id=421&mode=search&query=극동자동화&page=1,2017-06-28 10:37,(주)극동자동화 코넥스시장 신규상장기념식,"한국거래소 코스닥시장본부는 28일 오전 서울사옥 홍보관에서 (주)극동자동화의 코넥스시장 신규상장기념식을 개최했다. 상장기념패 전달 후 최규준 한국IR협의회 부회장(왼쪽부터), 김재준 한국거래소 코스닥시장위원회 위원장, 이상열 (주)극동자동화 대표이사, 염호 유진투자증권 부사장, 최욱 코넥스협회 부회장이 기념촬영을 하고 있다. (한국거래소 제공) 2017.6.28/뉴스1"
연합뉴스,272420,/news/news_read.nhn?article_id=0009368186&office_id=001&mode=search&query=극동자동화&page=1,2017-06-28 10:39,㈜극동자동화 코넥스시장 신규상장기념식,"(서울=연합뉴스) 28일 오전 서울 여의도 한국거래소에서 통신 및 보안시스템 구축, 선박엔진 유압장치(HPS) 제조 생산기업인 ㈜극동자동화의 코넥스시장 신규상장기념식이 열리고 있다. 왼쪽부터 최규준 한국IR협의회 부회장, 김재준 한국거래소 코스닥시장위원회 위원장, 이상열 ㈜극동자동화 대표이사, 염호 유진투자증권 부사장, 최욱 코넥스협회 부회장. 2017.6.28 [한국거래소 제공=연합뉴스]"
