source,symbol,link,date,title,content
파이낸셜뉴스,276240,/news/news_read.nhn?article_id=0004052663&office_id=014&mode=search&query=엘리비젼&page=1,2018-07-05 17:10,[인터뷰] 코넥스시장 데뷔한 안덕근 엘리비젼 대표 &quot;무인결제주문기&middot;스마트미러로 실...,삼성·롯데 등 주 협력사 주 52시간 근무제 시행무인결제주문기 수혜 기대 스마트미러로 신시장 개척
파이낸셜뉴스,276240,/news/news_read.nhn?article_id=0004052242&office_id=014&mode=search&query=엘리비젼&page=1,2018-07-05 10:56,[인터뷰] 코넥스 상장 첫 데뷔 한 안덕근 엘리비젼 대표,"무인결제주문기, 주 52시간 확산 수혜 기대…미용실용 스마트미러로 ‘승부수’        안덕근 엘리비젼 대표    “사이니지 기반 광고 산업의 전략적 육성을 통해 오는 2020년까지 매출액 200억원 이상을 달성할 계획입니다. 특히 주 52시간 시행제를 앞두고 당 사의 대표상품인 무인결제주문기(키오스크)와 미용실용 스마트미러로 성과를 극대화 하겠습니다.” 5일 코넥스 시장에 첫 상장한 안덕근 엘리비젼 대표(사진)는 파이낸셜뉴스와 만나 이같이 포부를 밝혔다. 1997년 당시 토탈정보통신으로 설립된 엘리비젼은 2008년 사명을 바꿨다. 엘리비젼은 일명 ‘스마트 디스플레이’로 불리는 디지널 사이니지를 개발하고 제조하는 업체다. 디지털 사이니지와 더불어 무인결제주문기(키오스크) 등 영상 음향기기를 제조하고 고객 맞춤형 주문과 설계, 생산 기술력을 지녀 이 분야에선 독보적인 시장 점유율을 보유하고 있다. 지난해 매출은 50억원 규모다. 현재 주력 고객사로는 삼성그룹, 롯데그룹 등 대기업을 비롯 방송사, 금융사, 김포공항, 대학교 등이 대표적이다. 이랜드 외식프랜차이드 브랜드(애슐리, 아시아문, 리미니 등)와 SPC그룹 계열 브랜드(파리바게뜨, 파스쿠찌, 던킨도넛 등)와 전국 매장 납품 및 유지보수 계약을 체결했다. 안 대표는 “엘리비젼은 기업이 원하는 다품종 소량생산의 특수 주문 제작에서 설계부터 생산까지 일원화 한 점이 특징”이라며“직접 납품 및 전국망 유지보수가 가능해, 국내를 비롯 해외 고객들의 시장 및 개별 수요자의 니즈를 충족 시킬 수 있는 맞춤 제조가 가능해 호응이 크다”고 말했다. 이번 코넥스 상장을 발판으로 그간 성과를 낸 디지털 사이니지 분야에서 광고 및 콘텐츠 시장으로 더 사업을 다각화 한다는 계획이다. 안 대표는 “현재 실시간 정보, 사용자 참여형 광고가 예상되는 미디어를 기반한 ‘미라보’(MIRAVO)를 개발해 여러 가지 콘텐츠 구현이 가능한 미용실용 스마트미러 디스플레이를 선보였다”며 “이 사업과 관련된 원천 특허를 취득해 경쟁우위에 있는 만큼 플랫폼 완성에 역점을 두고 일본과 중국 등에도 진출을 모색중”이라고 언급했다.       미라보가 설치된 헤어샵(로이드밤헤어 광명점) 전경.     실제 미라보는 스마트 기기로서도 손색이 없다. 이 시스템을 통해 미용실을 방문한 고객들은 자신에 맞는 헤어 스타일을 선택하고 수분측정, 두피 관리, 자신에게 필요한 뷰티 상품 등을 추천 받을 수 있다. 미라보는 지난 6월 말 싱가포르에서 열린‘커뮤닉 아시아(CommunicAsia)2018’ 전시회에도 선보여 해외 바이어들의 높은 관심을 받았다. 이와 더불어 최저임금 인상, 주 52시간 시행 여파로 엘리비젼의 주력상품인 무인결제주문기(키오스크) 매출 신장도 기대되고 있다. 최근 대표적인 외식프랜차이즈 기업인 맥도날드와 버커킹도 올 들어 무인주문기를 확대하는 추세이며, 김밥전문점, 커피프랜차이즈, 개인식당 들도 대거 도입을 앞두고 있다. 안 대표는 “그간 디지털 사이니지는 광고매체 전달 효과에 대한 객관적 지표가 부족하다는 이유로 소극적 태도를 보이는 광고주를 설득할 수익 모델에 고심했다”며 “엘리비젼은 이같은 시사점을 바탕으로 고부가 가치 미래 기술에 대한 플랫폼 소프트웨어(S/W)기술개발에 몰두했다. 대표적 사례가 바로 미용실용 스마트미러 디스플레이 ‘미라보’이다. 향후에도 고객들의 니즈에 맞춘 비즈니스 모델을 강화해 나가겠다”고 덧붙였다."
머니S,276240,/news/news_read.nhn?article_id=0000326519&office_id=417&mode=search&query=엘리비젼&page=1,2018-06-28 15:02,"거래소, 엘리비젼 코넥스 신규상장 승인","/사진=엘리비젼 홈페이지 캡처 한국거래소(KRX)는 28일 영상 및 음향기기 제조업체 엘리비젼에 대해 코넥스시장 신규상장을 승인했다고 밝혔다. 엘리비젼은 오는 7월5일부터 매매거래가 개시된다. 엘리비젼은 평가가격 1040원, 액면가 500원이며 지정자문인은 신한금융투자다. 홍승우 기자"
이데일리,276240,/news/news_read.nhn?article_id=0004142363&office_id=018&mode=search&query=엘리비젼&page=1,2018-07-05 10:02,[포토] 엘리비젼 코넥스시장 신규상장,"[이데일리 김태형 기자] 한국거래소 코스닥시장본부는 5일 서울사옥 홍보관에서 디지털 사이니지 전문기업인 (주)엘리비젼의 코넥스시장 신규상장기념식을 개최했다. 왼쪽부터 최규준 한국IR협의회 부회장, 김춘식 인천광역시 유망중소기업연합회장, 정운수 한국거래소 코스닥시장본부장, 안덕근 (주)엘리비젼 대표이사, 이상훈 신한금융투자 기업금융2본부장, 최욱 코넥스협회 부회장. (사진=한국거래소)"
이데일리,276240,/news/news_read.nhn?article_id=0004126668&office_id=018&mode=search&query=엘리비젼&page=1,2018-06-15 15:01,"[마켓인]엘리비젼, 코넥스시장 상장 신청","[이데일리 김무연 기자] 한국거래소는 엘리비젼의 코넥스시장 신규 상장 신청서를 접수했다고 15일 밝혔다. 지정자문인은 신한금융투자다. 한국거래소는 약 2주간 상장심사를 거쳐 상장승인 여부를 결정할 방침이다. 엘리비젼은 영상 및 음향기기 제조업체로 주로 디지털 사이니지, 키오스크 등을 생산·설치한다. 현재 미국과 독일·체코 등 유럽에도 수출을 진행 중이다. 지난해 50억8200만원의 매출액과 2억600만원의 순손실을 기록했다."
한국경제,276240,/news/news_read.nhn?article_id=0003803378&office_id=015&mode=search&query=엘리비젼&page=1,2017-07-31 09:27,"[마켓인사이트]코넥스시장 입성하는 엘리비젼, 크라우드펀딩 추진","내달까지 5억원 조달...9~10월 코넥스 상장 이 기사는 07월28일(17:24) 자본시장의 혜안 ‘마켓인사이트’에 게재된 기사입니다 ----------------------------------------------------------- 디스플레이 장비 업체인 엘리비젼이 올해 코넥스시장 기업공개(IPO)를 앞두고 5억원 규모의 크라우드펀딩을 추진한다. 크라우드펀딩은 다수의 소액투자자로부터 온라인을 통해 자금을 조달하는 것이다. 28일 투자은행(IB) 업계에 따르면 엘리비젼은 이달 20일부터 KTB투자증권을 통해 5억원 규모의 증권형 크라우드펀딩 공모를 진행하고 있다. 크라우드펀딩 청약기간은 다음달 31일까지다. 이 회사는 자금조달과는 별개로 지난달 신한금융투자를 IPO 주관사로 선정하고 올해 10~11월 코넥스 상장을 준비하고 있다. 엘리비젼은 2002년 출범했으며 사이니지'(디지털 광고패널) 키오스크(무인 단말기)등을 생산하는 업체다. 이 회사는 파리바게트, 던킨도너츠 등을 운영하는 SPC에 사이니지를 공급하고 있다. 지난해 매출 59억원, 영업이익 5억원을 올렸다. 영업이익은 전년 동기 대비 10배 이상 늘었다. 이 회사는 올해 매출액 목표치를 80억원으로 잡았다. 이 회사 안덕근 대표는 ""디지털 사이니지를 유럽, 중동, 일본 등에도 수출하고 있다""며 ""싱가포르 창이국제공항에도 제품을 보급할 것""이라고 말했다. 엘리비젼은 미용실에서 사용할 수 있는 디스플레이 기기다. 이 기기를 통해 미용실을 방문한 손님들은 자신에 맞는 헤어스타일을 선택하는 동시에  수분측정, 두피관리 등도 받을 수 있다. 안 대표는 ""기기에는 카드리더기, 지문인식기 기능 등도 포함될 것""이라며 ""올해 코넥스에 입성하고 내년 상반기에는 코스닥으로 이전상장할 것""이라고 말했다."
이데일리,276240,/news/news_read.nhn?article_id=0004136900&office_id=018&mode=search&query=엘리비젼&page=1,2018-06-28 14:37,"[마켓인]엘리비젼, 코넥스 시장 신규상장","[이데일리 김무연 기자] 엘리비젼이 코넥스 시장에 신규 상장된다. 한국거래소는 엘리비젼의 코넥스시장 신규상장을 승인했다고 28일 밝혔다. 매매거래는 오는 5일부터 가능하다. 액면가는 500원, 평가액은 1040원이다. 상장주간사는 신한금융투자다. 엘리비젼은 거울 앞에 선 사용자에게 착용한 옷의 정보를 알려주고 옷과 어울리는 화장품을 추천해주는 VR·AR 기기를 제작해  백화점·프랜차이즈 업체에 공급하는 업체다. 최대주주는 안덕근 대표로 현재 지분 44.6%를 보유 중이다. 엘리비젼은  지난해 51억원의 매출액과 4억4600만원의 영업손실을 기록했다."
한국경제,276240,/news/news_read.nhn?article_id=0003803398&office_id=015&mode=search&query=엘리비젼&page=1,2017-07-31 10:04,"엘리비젼, 10월 코넥스 상장&hellip;2019년 코스닥 추진","디지털 사이니지 제조업체 엘리비젼은 지난달 신한금융투자와 기업공개(IPO) 주관사 계약을 맺고, 오는 10~11월 코넥스 상장을 준비하고 있다고 31일 밝혔다. 엘리비젼은 지난 2002년 정보통신 공사업체로 출발해 2007년 디지털 사이니지 부문에 진출했다. 이후 SPC그룹과 공급계약을 체결하고, 인천국제공항 내부 파리바게트와 던킨도너츠 등 SPC 소속 프랜차이즈 17곳에 디지털 사이니지를 공급했다. 현재 프렌차이즈 수요에 따른 셀프 오더키오스크 양산에도 심혈을 기울이고 있다. 사용자들은 이 기계를 통해 해당 매장의 메뉴 정보를 검색하고, 공항 내 탑승구 위치, 면세점 위치 등도 찾아볼 수 있다. '공항인증샷'을 찍어 자신의 휴대전화로 사진을 받아볼 수 있는 '즐길 수 있는 요소'도 포함돼 있다. 이를 비롯해 인천국제공항 안에는 엘리비젼이 제조한 안내사이니지와 인터넷검색 키오스크 디스플레이 기기가 184대가 설치돼 있다. 엘리비젼의 매출은 지난해 59억원으로 전년대비 55.2% 증가했고, 영업이익도 5억6000만원으로 전년보다 10배이상 늘었다. 올해 80억원, 내년 120억원으로 매년 고성장세를 유지할 것이란 기대하고 있다. 이 회사 안덕근 대표는 ""디지털 사이니지를 개발하고 제조한지 10년동안 축적한 노하우와 기술력을 바탕으로 유럽과 중동, 일본 등 해외시장 공략과 조만간 싱가포르 창이 국제공항에도 남품 공급이 이뤄질 것""이라며 ""스마트 디스플레이의 활용방안을 더욱 확대해 회사 성장을 도모하고 2019년 상반기에 코스닥에 상장할 수 있도록 하겠다""고 말했다. 엘리비젼의 다음 사업은 미용실에서 활용할 수 있는 디스플레이 기기다. 가상현실(VR)과 증강현실(AR) 기술을 접목한 차세대 스마트 기기라는 게 안 대표의 설명이다. 이 기계를 통해 미용실을 방문한 손님들은 자신에 맞는 헤어스타일을 선택할 수 있고, 수분측정, 두피관리 등도 동시에 받을 수 있다. 자신에게 맞는 뷰티 관련 상품을 추천받을 수도 있다. 그는 ""카드리더기, 지문인식기 등도 포함되며 애플리케이션과 연동도 할 수 있는 다기능, 다목적 기기가 될 것""이라며 ""이같은 기기를 직접 설계하고 생산하며 콘텐츠를 개발하고 유지 및 보수까지 할 수 있는 기술력을 보유한 것이 엘리비젼의 가장 큰 장점""이라고 덧붙였다."
파이낸셜뉴스,276240,/news/news_read.nhn?article_id=0003851700&office_id=014&mode=search&query=엘리비젼&page=1,2017-07-31 10:11,"디지털 사이니지업체 엘리비젼, 코넥스 &lsquo;입성&rsquo;","신한금융투자 주관사로 10월중 상장…AR활용 신개념 ‘미용실 미러’ 차세대 동력 국내 최정상급 디지털 사이니지업체 엘리비젼이 코넥스 시장에 상장한다. 31일 투자은행(IB)업계에 따르면, 엘리비젼은 최근 신한금융투자를 상장 주관사로 선정하고 오는 코넥스 상장 채비에 나섰다. 이르면 10월 중 코넥스에 상장한다는 계획이다. 엘리비젼은 일명 ‘스마트 디스플레이’로 일컬어지는 디지털 사이니지를 개발하고 제조하는 업체다. 10년 동안 축적한 노하우와 기술력으로 승부를 보겠다는 비전을 내세우고 있다. 엘리비젼은 2002년 정보통신 공사업체로 출발한 이후 2007년 디지털 사이니지 부문에 진출했다. 이후 SPC 그룹과 공급계약을 체결하고 SPC 그룹에 속한 프랜차이즈 업체에 디지털 사이니지를 공급해왔다. 인천국제공항 내부 파리바게트, 던킨도너츠 등 SPC 소속 프랜차이즈 17곳에 디지털 사이니지가 설치되어 있다. 현재 프렌차이즈 수요에 따른 셀프 오더키오스크 양산에도 심혈을 기울이는 중이다. 사용자들은 이 기계를 통해서 해당 매장의 메뉴 정보를 검색할 수 있을 뿐 아니라, 공항 내 탑승구 위치, 면세점 위치 등도 찾아볼 수 있다. '공항인증샷'을 찍어 자신의 휴대전화로 사진을 받아볼 수 있는 '즐길 수 있는 요소'도 포함돼 있다. 이를 비롯해 인천국제공항 안에는 엘리비젼이 제조한 안내사이니지와 인터넷검색 키오스크 디스플레이 기기가 184대가 설치돼 있다. 안덕근 엘리비젼 대표는 ""디지털 사이니지를 제조하는 엘리비젼의 기술력은 해외에서도 인정을 받아 유럽, 중동, 일본 등에도 수출하고 있다""며 ""조만간 싱가포르 창이국제공항에도 우리가 만든 기기가 보급될 예정""이라고 말했다. 엘리비젼의 성장세도 가파르다. 실제 이 회사의 매출액은 2015년 38억원에서 지난해 59억원으로 증가했고 영업이익도 5200만원에서 5억6000만원으로 10배 이상 늘었다. 목표 매출액은 올해 80억원, 내년 120억원 규모다. 엘리비젼이 향후 주력 사업으로 내세운 것은 미용실에서 활용할 수 있는 디스플레이 기기다. 가상현실(VR)과 증강현실(AR) 기술을 접목한 차세대 스마트 기기라는 게 안 대표의 설명이다. 이 기계를 통해 미용실을 방문한 손님들은 자신에 맞는 헤어스타일을 선택할 수 있을뿐 아니라 수분측정, 두피관리 등도 동시에 받을 수 있다. 자신에게 맞는 뷰티 관련 상품을 추천받을 수도 있다. 스마트기기를 활용한 광고매출이 주 수익원으로 가능한 것이다. 안 대표는 ""카드리더기, 지문인식기 등도 포함되며 어플리케이션과 연동도 할 수 있는 다기능, 다목적 기기가 될 것""이라며 ""이같은 기기를 직접 설계하고 생산하며 콘텐츠를 개발하고 유지 및 보수까지 할 수 있는 기술력을 보유한 것이 엘리비젼의 가장 큰 장점""이라고 자신감을 내비쳤다. 이어 그는 ""스마트 디스플레이의 활용방안을 더욱 확대해 회사 성장을 도모하고 2019년 상반기에 코스닥에 상장할 수 있도록 하겠다""고 밝혔다. 한편 엘리비젼은 코넥스 상장 준비와 더불어 현재 KTB투자증권을 청약 주관사로 선정하고5억원 규모의 증권형 클라우드펀딩 공모도 진행중이다. 청약 기간은 지난 20일부터 오는 8월 31일까지이다. 신주 교부일은 오는 9월29일로 예정됐다."
뉴스1,276240,/news/news_read.nhn?article_id=0003465952&office_id=421&mode=search&query=엘리비젼&page=1,2018-07-05 09:22,(주)엘리비젼 코넥스시장 신규상장기념식,"(서울=뉴스1) 추연화 기자 = 5일 오전 서울 영등포구 한국거래소에서 열린 (주)엘리비젼의 코넥스시장 신규상장기념식에서 최규준 한국IR협의회 부회장(왼쪽부터), 김춘식 인천광역시 유망중소기업연합회장, 정운수 한국거래소 코스닥시장본부장, 안덕근 (주)엘리비젼 대표이사, 이상훈 신한금융투자 기업금융2본부장, 최욱 코넥스협회 부회장이 상장기념패 전달 후 박수치고 있다. (한국거래소 제공) 2018.7.5/뉴스1"
뉴시스,276240,/news/news_read.nhn?article_id=0008689620&office_id=003&mode=search&query=엘리비젼&page=1,2018-07-05 09:31,엘리비젼 코넥스 신규상장 기념식,"【서울=뉴시스】 한국거래소 코스닥시장본부는 5일 오전 서울 여의도 서울사옥 홍보관에서 디지털 사이니지 전문기업인 엘리비젼의 코넥스시장 신규상장기념식을 개최했다. 왼쪽부터 최규준 한국IR협의회 부회장, 김춘식 인천광역시 유망중소기업연합회장, 정운수 한국거래소 코스닥시장본부장, 안덕근 엘리비젼 대표이사, 이상훈 신한금융투자 기업금융2본부장, 최욱 코넥스협회 부회장이 기념촬영을 하고 있다. 2018.07.05. (사진=한국거래소 제공)"
이데일리,276240,/news/news_read.nhn?article_id=0003886653&office_id=018&mode=search&query=엘리비젼&page=1,2017-07-31 09:21,"`디지털 사이니지` 엘리비젼, 10월 코넥스 상장&hellip;&quot;2019년 코스닥으로&quot;","- 신한금융투자와 코넥스 IPO 주관사계약 - 작년 영업익 5.6억…1년새 10배 `껑충` - VR·AR 접목한 미용실 스마트미러 개발 [이데일리 이정훈 기자] 디지털 영상정보 디스플레이 장비(DID) 전문업체인 엘리비젼이 이르면 10월쯤 코넥스시장에 상장한 뒤 내후년쯤 코스닥시장에도 상장하겠다는 비전을 밝혔다. 안덕근 엘리비젼 대표는 31일 “10~11월쯤 코넥스 상장을 목표로 지난달 신한금융투자와 기업공개(IPO) 주관사 계약을 체결했다”고 밝힌 뒤 “스마트 디스플레이 활용방안을 더욱 확대해 회사 성장을 도모한 뒤 오는 2019년 상반기쯤에는 코스닥에 상장할 수 있도록 하겠다”고 말했다. 엘리비젼은 지난 2002년 정보통신 공사업체로 출발한 이후 2007년 디지털 사이니지부문에 진출했다. 이후 SPC그룹과 공급계약을 체결하고 SPC그룹에 속한 프랜차이즈업체에 디지털 사이니지를 공급해왔다. 인천국제공항 내부 파리바게트, 던킨도너츠 등 SPC 프랜차이즈 17곳에 디지털 사이니지가 설치됐고 프랜차이즈 수요에 따른 셀프오더 키오스크 양산에도 심혈을 기울이고 있다. 현재 인천국제공항내에는 엘리비젼이 제조한 안내사이니지와 인터넷검색 키오스크 디스플레이 기기가 184대가 설치돼 있다. 안 대표는 “디지털 사이니지를 제조하는 엘리비젼의 기술력은 해외에서도 인정을 받아 유럽, 중동, 일본 등에도 수출하고 있다”며 “조만간 싱가포르 창이국제공항에도 우리가 만든 기기가 보급될 예정”이라고 말했다. 엘리비젼은 매년 성장세를 보이고 있다. 매출액은 2015년 38억원에서 지난해 59억원으로 증가했고 영업이익도 5200만원에서 5억6000만원으로 10배 이상 늘었다. 올해 매출액 80억원, 내년 120억원을 목표로 하고 있다. 아울러 엘리비젼은 가상현실(VR)과 증강현실(AR) 기술을 접목해 헤어스타일 선택부터 수분측정과 두피관리, 뷰티관련 상품 추천까지 한 번에 서비스가 가능한 미용실용(用) 스마트 미러를 개발한다는 목표를 세웠다. 이를 위해 KTB투자증권을 통해 총 5억원 규모의 증권형 크라우드펀딩 공모를 진행하고 있다. 청약기간은 다음달 31일까지다. 안 대표는 “카드리더기와 지문인식기 등도 포함되며 어플리케이션과 연동도 할 수 있는 다기능, 다목적 기기가 될 것”이라며 “이같은 기기를 직접 설계하고 생산하며 콘텐츠를 개발하고 유지와 보수까지 할 수 있는 기술력을 보유한 것이 엘리비젼의 가장 큰 장점”이라며 자신감을 내비쳤다."
연합뉴스,276240,/news/news_read.nhn?article_id=0010191504&office_id=001&mode=search&query=엘리비젼&page=1,2018-07-05 09:30,㈜엘리비젼 코넥스시장 신규상장 기념식,"(서울=연합뉴스) 5일 서울 여의도 한국거래소에서 디지털 사이니지 전문기업인 ㈜엘리비젼의 코넥스시장 신규상장기념식이 열리고 있다. 왼쪽부터 최규준 한국IR협의회 부회장, 김춘식 인천광역시 유망중소기업연합회장, 정운수 한국거래소 코스닥시장본부장, 안덕근 ㈜엘리비젼 대표이사, 이상훈 신한금융투자 기업금융2본부장, 최욱 코넥스협회 부회장. 2018.7.5 [한국거래소 제공=연합뉴스]"
서울경제,276240,/news/news_read.nhn?article_id=0003334444&office_id=011&mode=search&query=엘리비젼&page=1,2018-06-28 15:42,"엘리비젼, 코넥스 신규 상장&middot;&middot;&middot;다음달 5일 거래개시","[서울경제] 한국거래소가 28일 영상 및 음향기기 제조업체 엘리비젼에 대해 코넥스시장 신규상장을 승인했다고 발표했다. 엘리비젼은 오는 7월5일부터 매매거래가 개시된다. 엘리비젼은 평가가격 1040원, 액면가 500원이며 지정자문인은 신한금융투자다."
서울경제,276240,/news/news_read.nhn?article_id=0003081890&office_id=011&mode=search&query=엘리비젼&page=1,2017-07-30 17:54,"VR&middot;AR기술 보유 엘리비젼, 코스닥 입성 닻 올린다",신한금융투자와 주관사 계약 10월께 코넥스 상장 이후 이르면 2019년 코스닥 이전상장 코오롱매장에 설치된 엘리비젼 키오스크(무인종합정보안내시스템)
